T01n0005_002:0168b14	死之根本。時，天暴雨，雷電霹靂，殺四牛、耕	死 之 根 本 時 天 暴 雨 雷電霹靂 殺 四 牛 耕 
T01n0005_002:0168b15	者兄弟二人。時，有眾人往觀。有一人來到我	者 兄 弟 二 人 時 有 眾 人 往 觀 有 一 人 來 到 我 
T01n0005_002:0168b16	所，前為我作禮，我問：『是間何以聚人？』其人	所 前 為 我 作 禮 我 問 是 間 何 以 聚 人 其 人 
T01n0005_002:0168b17	言：『屬者霹靂，殺四牛、兄弟二人，佛何以不	言 屬 者 霹 靂 殺 四 牛 兄 弟 二 人 佛 何 以 不 
T01n0005_002:0168b18	聞？佛時瞑耶？』佛言：『我不瞑，坐思道耳。』其人	聞 佛 時 瞑 耶 佛 言 我 不 瞑 坐 思 道 耳 其 人 
T01n0005_002:0168b19	言：『佛道深乃如是，不瞑而不聞霹靂聲，佛思	言 佛 道 深 乃 如 是 不 瞑 而 不 聞 霹 靂 聲 佛 思 
T01n0005_002:0168b20	道甚深。』其人亦即淚出。」大臣胞罠言：「佛道	道 甚 深 其 人 亦 即 淚 出 大 臣 胞 罠 言 佛 道 
T01n0005_002:0168b21	深乃如是，從今以往，當持佛經戒。」胞罠	深 乃 如 是 從 今 以 往 當 持 佛 經 戒 胞 罠 
T01n0005_002:0168b22	即呼從者來，使歸取黃金織成[疊*毛]布一張來，	即 呼 從 者 來 使 歸 取 黃 金 織 成 [疊毛] 布 一 張 來 
T01n0005_002:0168b23	我以上佛。從者即歸取來。胞罠持上佛，白	我 以 上 佛 從 者 即 歸 取 來 胞 罠 持 上 佛 白 
T01n0005_002:0168b24	佛言：「同知佛不用，當哀我，為受之。」佛即受	佛 言 同 知 佛 不 用 當 哀 我 為 受 之 佛 即 受 
T01n0005_002:0168b25	之，胞罠為佛作禮而去。去未久，佛呼阿難：	之 胞 罠 為 佛 作 禮 而 去 去 未 久 佛 呼 阿 難 
T01n0005_002:0168b26	「持金織成[疊*毛]布來，色大好正黃。」阿難言：「我	 持 金 織 成 [疊毛] 布 來 色 大 好 正 黃 阿 難 言 我 
T01n0005_002:0168b27	侍佛二十餘年，未曾見[疊*毛]好乃如是。」佛言：「有	侍 佛 二 十 餘 年 未 曾 見 [疊毛] 好 乃 如 是 佛 言 有 
T01n0005_002:0168b28	是甚好。」阿難言：「佛今日面色，如是[疊*毛]色。」佛	是 甚 好 阿 難 言 佛 今 日 面 色 如 是 [疊毛] 色 佛 
T01n0005_002:0168b29	告阿難：「佛有是曹色者有兩時，佛初得道為	告 阿 難 佛 有 是 曹 色 者 有 兩 時 佛 初 得 道 為 
T01n0005_002:0168c01	佛時，面色好如是，我今日夜半當般泥洹，	佛 時 面 色 好 如 是 我 今 日 夜 半 當 般 泥 洹 
T01n0005_002:0168c02	面色好當復如是。」佛復呼阿難：「去至醯連溪	面 色 好 當 復 如 是 佛 復 呼 阿 難 去 至 醯 連 溪 
T01n0005_002:0168c03	水邊，我欲洗浴身體。」阿難言：「諾。」佛獨與阿	水 邊 我 欲 洗 浴 身 體 阿 難 言 諾 佛 獨 與 阿 
T01n0005_002:0168c04	難俱，至醯連溪水邊，佛解衣，自取水灌浴。	難 俱 至 醯 連 溪 水 邊 佛 解 衣 自 取 水 灌 浴 
T01n0005_002:0168c05	佛告阿難：「朝華氏子淳家飯我，今日夜半，	佛 告 阿 難 朝 華 氏 子 淳 家 飯 我 今 日 夜 半 
T01n0005_002:0168c06	當般泥洹，若告淳言：『佛從若飯已，夜半當	當 般 泥 洹 若 告 淳 言 佛 從 若 飯 已 夜 半 當 
T01n0005_002:0168c07	般泥洹，若當歡喜。』語淳：『莫啼哭，若一飯佛	般 泥 洹 若 當 歡 喜 語 淳 莫 啼 哭 若 一 飯 佛 
T01n0005_002:0168c08	得五福，若飯佛，佛持若飯食氣力用般泥	得 五 福 若 飯 佛 佛 持 若 飯 食 氣 力 用 般 泥 
T01n0005_002:0168c09	洹，淳得長壽，得端正，得富貴尊豪，得生天	洹 淳 得 長 壽 得 端 正 得 富 貴 尊 豪 得 生 天 
T01n0005_002:0168c10	上。佛可敬，一飯佛得五福。』」阿難白佛：「有一	上 佛 可 敬 一 飯 佛 得 五 福 阿 難 白 佛 有 一 
T01n0005_002:0168c11	比丘，名栴檀比丘，急性憙罵，數鬪諸比丘，	比 丘 名 栴 檀 比 丘 急 性 憙 罵 數 鬪 諸 比 丘 
T01n0005_002:0168c12	佛般泥洹以後，我曹諸比丘，當云何共事佛	佛 般 泥 洹 以 後 我 曹 諸 比 丘 當 云 何 共 事 佛 
T01n0005_002:0168c13	經戒？」佛語阿難：「我般泥洹已，若曹莫復與語，	經 戒 佛 語 阿 難 我 般 泥 洹 已 若 曹 莫 復 與 語 
T01n0005_002:0168c14	諸比丘不與語，栴檀比丘，當思惟懷重慚	諸 比 丘 不 與 語 栴 檀 比 丘 當 思 惟 懷 重 慚 
T01n0005_002:0168c15	愧悔數鬪諸比丘。」佛告阿難：「施牀使北首，	愧 悔 數 鬪 諸 比 丘 佛 告 阿 難 施 牀 使 北 首 
T01n0005_002:0168c16	我背大痛欲臥。」阿難即施牀著枕，佛偃右脇	我 背 大 痛 欲 臥 阿 難 即 施 牀 著 枕 佛 偃 右 脇 
T01n0005_002:0168c17	臥，屈膝累脚，臥思無為之道。佛臥呼阿難：	臥 屈 膝 累 脚 臥 思 無 為 之 道 佛 臥 呼 阿 難 
T01n0005_002:0168c18	「若知七意之事不？何等為七？一者有志，二	 若 知 七 意 之 事 不 何 等 為 七 一 者 有 志 二 
T01n0005_002:0168c19	者明經，三者不懈於經，四者不貪臥當憙經，	者 明 經 三 者 不 懈 於 經 四 者 不 貪 臥 當 憙 經 
T01n0005_002:0168c20	五者政心，六者淨心，七者視身中惡露。比	五 者 政 心 六 者 淨 心 七 者 視 身 中 惡 露 比 
T01n0005_002:0168c21	丘有是七法，以自知得度世道。」阿難意念	丘 有 是 七 法 以 自 知 得 度 世 道 阿 難 意 念 
T01n0005_002:0168c22	佛懈臥，佛告阿難：「若意念佛懈臥耶？」佛告	佛 懈 臥 佛 告 阿 難 若 意 念 佛 懈 臥 耶 佛 告 
T01n0005_002:0168c23	阿難：「人不懈於經，不懈於坐起欲作佛者，	阿 難 人 不 懈 於 經 不 懈 於 坐 起 欲 作 佛 者 
T01n0005_002:0168c24	可得佛語已即起坐。」時，有一比丘名劫賓，來	可 得 佛 語 已 即 起 坐 時 有 一 比 丘 名 劫 賓 來 
T01n0005_002:0168c25	語阿難言：「我欲問一事。」阿難言：「佛聖體不	語 阿 難 言 我 欲 問 一 事 阿 難 言 佛 聖 體 不 
T01n0005_002:0168c26	和且莫。」佛即從裏知比丘欲問事，佛告阿難：	和 且 莫 佛 即 從 裏 知 比 丘 欲 問 事 佛 告 阿 難 
T01n0005_002:0168c27	「呼比丘來入。」入與佛相見，佛言：「所欲問者當	 呼 比 丘 來 入 入 與 佛 相 見 佛 言 所 欲 問 者 當 
T01n0005_002:0168c28	問。」比丘言：「佛有疾且置經不須復說。佛說	問 比 丘 言 佛 有 疾 且 置 經 不 須 復 說 佛 說 
T01n0005_002:0168c29	七事者，我曹以聞當持，佛且止莫說經。」佛告	七 事 者 我 曹 以 聞 當 持 佛 且 止 莫 說 經 佛 告 
T01n0005_002:0169a01	比丘：「我向臥，阿難念佛有懈墮之意，何以	比 丘 我 向 臥 阿 難 念 佛 有 懈 墮 之 意 何 以 
T01n0005_002:0169a02	臥，我以是故起說七事。」比丘言：「佛是天上	臥 我 以 是 故 起 說 七 事 比 丘 言 佛 是 天 上 
T01n0005_002:0169a03	天下之尊，云何不從天請藥，可使病愈？」佛	天 下 之 尊 云 何 不 從 天 請 藥 可 使 病 愈 佛 
T01n0005_002:0169a04	言：「如人舍宅，久故皆當壞，地續安如故。佛	言 如 人 舍 宅 久 故 皆 當 壞 地 續 安 如 故 佛 
T01n0005_002:0169a05	心安如地，身如故舍，心無病，但身有病耳。」佛	心 安 如 地 身 如 故 舍 心 無 病 但 身 有 病 耳 佛 
T01n0005_002:0169a06	言：「憂七事，憂身持戒。」比丘言：「今佛當般泥洹	言 憂 七 事 憂 身 持 戒 比 丘 言 今 佛 當 般 泥 洹 
T01n0005_002:0169a07	有身病，何況凡人？」比丘言：「燕生子，怙父母得	有 身 病 何 況 凡 人 比 丘 言 燕 生 子 怙 父 母 得 
T01n0005_002:0169a08	食以生活，今佛捨我曹般泥洹，我曹當依誰？」	食 以 生 活 今 佛 捨 我 曹 般 泥 洹 我 曹 當 依 誰 
T01n0005_002:0169a09	世尊又曰：「吾經不說，無生不死者，比丘當念	世 尊 又 曰 吾 經 不 說 無 生 不 死 者 比 丘 當 念 
T01n0005_002:0169a10	持佛重戒。」比丘旋出。佛告阿難：「疾去為佛於	持 佛 重 戒 比 丘 旋 出 佛 告 阿 難 疾 去 為 佛 於 
T01n0005_002:0169a11	鹽呵沙，施牀使北首，今日夜半，佛當般泥	鹽 呵 沙 施 牀 使 北 首 今 日 夜 半 佛 當 般 泥 
T01n0005_002:0169a12	洹。」阿難奉命，之彼施牀牀頭北首。畢，還白	洹 阿 難 奉 命 之 彼 施 牀 牀 頭 北 首 畢 還 白 
T01n0005_002:0169a13	言：「施牀已竟。」佛起至鹽呵沙，得牀猗右脇	言 施 牀 已 竟 佛 起 至 鹽 呵 沙 得 牀 猗 右 脇 
T01n0005_002:0169a14	臥。有一比丘，名優和洹，當佛前立。佛言：「無當	臥 有 一 比 丘 名 優 和 洹 當 佛 前 立 佛 言 無 當 
T01n0005_002:0169a15	吾前。」阿難白言：「自吾親侍二十五年，未曾見	吾 前 阿 難 白 言 自 吾 親 侍 二 十 五 年 未 曾 見 
T01n0005_002:0169a16	比丘直自來進不問阿難。」佛言：「是比丘，於彼	比 丘 直 自 來 進 不 問 阿 難 佛 言 是 比 丘 於 彼 
T01n0005_002:0169a17	諸天，最有威神，聞佛滅度故，直自前，貪欲見	諸 天 最 有 威 神 聞 佛 滅 度 故 直 自 前 貪 欲 見 
T01n0005_002:0169a18	佛。」阿難問言：「獨是天知佛當滅度？復有餘天？」	佛 阿 難 問 言 獨 是 天 知 佛 當 滅 度 復 有 餘 天 
T01n0005_002:0169a19	佛告阿難：「從鳩夷那竭國境界，四百八十里	佛 告 阿 難 從 鳩 夷 那 竭 國 境 界 四 百 八 十 里 
T01n0005_002:0169a20	中，頭頭相附，間不容鍼，皆是諸天，聞佛當滅	中 頭 頭 相 附 間 不 容 鍼 皆 是 諸 天 聞 佛 當 滅 
T01n0005_002:0169a21	度，悲哭且來，中有挽頭髮者，自裂衣者，塞心	度 悲 哭 且 來 中 有 挽 頭 髮 者 自 裂 衣 者 塞 心 
T01n0005_002:0169a22	絕尸視者，哀云：『奈何！佛捨我曹，滅度永逝，何	絕 尸 視 者 哀 云 奈 何 佛 捨 我 曹 滅 度 永 逝 何 
T01n0005_002:0169a23	其疾乎！佛為大明，三界中眼，今般泥洹，三	其 疾 乎 佛 為 大 明 三 界 中 眼 今 般 泥 洹 三 
T01n0005_002:0169a24	界眼滅。』」佛告阿難：「吾本經不說，無生不死	界 眼 滅 佛 告 阿 難 吾 本 經 不 說 無 生 不 死 
T01n0005_002:0169a25	者，天地無不壞敗者，愚人以天地為常，佛以	者 天 地 無 不 壞 敗 者 愚 人 以 天 地 為 常 佛 以 
T01n0005_002:0169a26	為虛空，天地有成敗，無不棄身者，善惡隨身，	為 虛 空 天 地 有 成 敗 無 不 棄 身 者 善 惡 隨 身 
T01n0005_002:0169a27	父有過惡，子不獲殃，子有過惡，父不獲殃，	父 有 過 惡 子 不 獲 殃 子 有 過 惡 父 不 獲 殃 
T01n0005_002:0169a28	各自生死，善惡殃咎，各隨其身。」阿難白佛言：	各 自 生 死 善 惡 殃 咎 各 隨 其 身 阿 難 白 佛 言 
T01n0005_002:0169a29	「佛滅度後，吾等葬佛身體，法當云何？」佛告阿	 佛 滅 度 後 吾 等 葬 佛 身 體 法 當 云 何 佛 告 阿 
T01n0005_002:0169b01	難：「汝默無憂，當有逝心理家，共憂吾身。」阿	難 汝 默 無 憂 當 有 逝 心 理 家 共 憂 吾 身 阿 
T01n0005_002:0169b02	難言：「彼以何法，憂佛尊體？」佛告阿難：「葬法	難 言 彼 以 何 法 憂 佛 尊 體 佛 告 阿 難 葬 法 
T01n0005_002:0169b03	如飛行皇帝殯葬之法，佛復踰彼。」阿難言：「葬	如 飛 行 皇 帝 殯 葬 之 法 佛 復 踰 彼 阿 難 言 葬 
T01n0005_002:0169b04	聖帝法云何？」佛告阿難：「葬法用錦褻以纏	聖 帝 法 云 何 佛 告 阿 難 葬 法 用 錦 褻 以 纏 
T01n0005_002:0169b05	身，劫波育千張，交纏其上，著假棺中，以	身 劫 波 育 千 張 交 纏 其 上 著 假 棺 中 以 
T01n0005_002:0169b06	澤香膏，灌劫波育上，其有好香，皆以著上，	澤 香 膏 灌 劫 波 育 上 其 有 好 香 皆 以 著 上 
T01n0005_002:0169b07	以梓薪樟薪柟薪，以葢覆棺，以薪著上下，	以 梓 薪 樟 薪 柟 薪 以 葢 覆 棺 以 薪 著 上 下 
T01n0005_002:0169b08	蛇維訖畢，歛舍利，於四交道，起塔立剎，以	蛇 維 訖 畢 歛 舍 利 於 四 交 道 起 塔 立 剎 以 
T01n0005_002:0169b09	槃著上，懸繒鼓，華香燃燈，飛行皇帝葬法	槃 著 上 懸 繒 鼓 華 香 燃 燈 飛 行 皇 帝 葬 法 
T01n0005_002:0169b10	若斯；佛復勝之。」佛說此時，阿難在後，慷	若 斯 佛 復 勝 之 佛 說 此 時 阿 難 在 後 慷 
T01n0005_002:0169b11	慨啼以頭拄牀角，從後白言：「滅度太疾，亡	慨 啼 以 頭 拄 牀 角 從 後 白 言 滅 度 太 疾 亡 
T01n0005_002:0169b12	天下眼。」四面郡國，諸比丘僧，聞佛欲滅度，	天 下 眼 四 面 郡 國 諸 比 丘 僧 聞 佛 欲 滅 度 
T01n0005_002:0169b13	啼哭且來，自相謂恐不見佛。比丘僧到，佛問	啼 哭 且 來 自 相 謂 恐 不 見 佛 比 丘 僧 到 佛 問 
T01n0005_002:0169b14	比丘：「阿難所在乎？」對曰：「阿難近在牀後角，低	比 丘 阿 難 所 在 乎 對 曰 阿 難 近 在 牀 後 角 低 
T01n0005_002:0169b15	頭哽噎。」諸比丘流淚而言：「世尊滅度，何其	頭 哽 噎 諸 比 丘 流 淚 而 言 世 尊 滅 度 何 其 
T01n0005_002:0169b16	太疾！」佛言：「吾本行諸墟聚，豫告若曹，却九十	太 疾 佛 言 吾 本 行 諸 墟 聚 豫 告 若 曹 却 九 十 
T01n0005_002:0169b17	日當般泥洹。」四輩弟子，在數千里外者悉	日 當 般 泥 洹 四 輩 弟 子 在 數 千 里 外 者 悉 
T01n0005_002:0169b18	至，佛告阿難：「若莫悲哀。所以然者？若盡心	至 佛 告 阿 難 若 莫 悲 哀 所 以 然 者 若 盡 心 
T01n0005_002:0169b19	侍佛，二十餘年，慈仁於佛，敬身慎口，大孝	侍 佛 二 十 餘 年 慈 仁 於 佛 敬 身 慎 口 大 孝 
T01n0005_002:0169b20	於佛，過去佛侍者亦如阿難，當來佛侍者亦	於 佛 過 去 佛 侍 者 亦 如 阿 難 當 來 佛 侍 者 亦 
T01n0005_002:0169b21	如阿難。若知佛意，若云某時可見，比丘比	如 阿 難 若 知 佛 意 若 云 某 時 可 見 比 丘 比 
T01n0005_002:0169b22	丘尼優婆塞優婆夷，某時不可見；所供飲食，	丘 尼 優 婆 塞 優 婆 夷 某 時 不 可 見 所 供 飲 食 
T01n0005_002:0169b23	若言可食可飲可臥可起，常合佛意未甞失	若 言 可 食 可 飲 可 臥 可 起 常 合 佛 意 未 甞 失 
T01n0005_002:0169b24	儀；某比丘某逝心，樂經不樂經，若所言皆	儀 某 比 丘 某 逝 心 樂 經 不 樂 經 若 所 言 皆 
T01n0005_002:0169b25	誠，於佛最孝，啼哭何為？」佛告：「諸比丘聽！飛	誠 於 佛 最 孝 啼 哭 何 為 佛 告 諸 比 丘 聽 飛 
T01n0005_002:0169b26	行皇帝有四難及之德。何謂四德？諸小國王，	行 皇 帝 有 四 難 及 之 德 何 謂 四 德 諸 小 國 王 
T01n0005_002:0169b27	及諸逝心理家，并諸黎民，詣帝闕下，飛行	及 諸 逝 心 理 家 并 諸 黎 民 詣 帝 闕 下 飛 行 
T01n0005_002:0169b28	皇帝皆見之；和心軟教，為諸王說治國法，	皇 帝 皆 見 之 和 心 軟 教 為 諸 王 說 治 國 法 
T01n0005_002:0169b29	知足無求，逝心之行，清淨為首；理家及民，	知 足 無 求 逝 心 之 行 清 淨 為 首 理 家 及 民 
T01n0005_002:0169c01	出詣佛廟，聽採沙門正真之化，歸當修孝；	出 詣 佛 廟 聽 採 沙 門 正 真 之 化 歸 當 修 孝 
T01n0005_002:0169c02	隨其所定，慈心賜之，諸王逝心理家庶民，	隨 其 所 定 慈 心 賜 之 諸 王 逝 心 理 家 庶 民 
T01n0005_002:0169c03	靡不欣豫，稱嘆聖帝感動諸天；飛行皇帝有	靡 不 欣 豫 稱 嘆 聖 帝 感 動 諸 天 飛 行 皇 帝 有 
T01n0005_002:0169c04	斯四德。阿難比丘亦有四德：其有除饉男	斯 四 德 阿 難 比 丘 亦 有 四 德 其 有 除 饉 男 
T01n0005_002:0169c05	除饉女清信士清信女，之阿難所從問經戒，	除 饉 女 清 信 士 清 信 女 之 阿 難 所 從 問 經 戒 
T01n0005_002:0169c06	阿難為具廣陳演之，四輩弟子，靡不欣懌，	阿 難 為 具 廣 陳 演 之 四 輩 弟 子 靡 不 欣 懌 
T01n0005_002:0169c07	退坐出去，尋塗稱歎，斯謂阿難第一四德；	退 坐 出 去 尋 塗 稱 歎 斯 謂 阿 難 第 一 四 德 
T01n0005_002:0169c08	復有四輩弟子，不解經奧，至阿難所啟質	復 有 四 輩 弟 子 不 解 經 奧 至 阿 難 所 啟 質 
T01n0005_002:0169c09	所疑，阿難釋結無不開解，聞者不厭出無不	所 疑 阿 難 釋 結 無 不 開 解 聞 者 不 厭 出 無 不 
T01n0005_002:0169c10	歎，斯謂阿難第二四德；四輩高德，覩阿難	歎 斯 謂 阿 難 第 二 四 德 四 輩 高 德 覩 阿 難 
T01n0005_002:0169c11	侍佛左側，無不吟詠，斯謂阿難第三四德；佛	侍 佛 左 側 無 不 吟 詠 斯 謂 阿 難 第 三 四 德 佛 
T01n0005_002:0169c12	所說經，言無多少，阿難所聞，皆識諷誦，宣	所 說 經 言 無 多 少 阿 難 所 聞 皆 識 諷 誦 宣 
T01n0005_002:0169c13	授四輩，一無增減，是為阿難第四四德。」阿	授 四 輩 一 無 增 減 是 為 阿 難 第 四 四 德 阿 
T01n0005_002:0169c14	難白佛言：「去是不遠有郡國，舍衛國、沙枝	難 白 佛 言 去 是 不 遠 有 郡 國 舍 衛 國 沙 枝 
T01n0005_002:0169c15	國、栴波國、王舍國、波羅[木*奈]國、維耶梨國，	國 栴 波 國 王 舍 國 波 羅 [木奈] 國 維 耶 梨 國 
T01n0005_002:0169c16	斯諸大國，明義備悉，佛當滅度，何不於彼？	斯 諸 大 國 明 義 備 悉 佛 當 滅 度 何 不 於 彼 
T01n0005_002:0169c17	既於小縣，復處城外，薄聚鄙縣，而般泥洹？」	既 於 小 縣 復 處 城 外 薄 聚 鄙 縣 而 般 泥 洹 
T01n0005_002:0169c18	佛告阿難：「無云小聚。所以然者？惟昔往古	佛 告 阿 難 無 云 小 聚 所 以 然 者 惟 昔 往 古 
T01n0005_002:0169c19	鳩夷那竭，名鳩夷越，王國大樂時無疹病，	鳩 夷 那 竭 名 鳩 夷 越 王 國 大 樂 時 無 疹 病 
T01n0005_002:0169c20	米穀豐沃黎民熾盛，家有孝子。城東西長四	米 穀 豐 沃 黎 民 熾 盛 家 有 孝 子 城 東 西 長 四 
T01n0005_002:0169c21	百八十里，南北廣二百八十里，其城七重，	百 八 十 里 南 北 廣 二 百 八 十 里 其 城 七 重 
T01n0005_002:0169c22	皆以焦墼累集作城，黃金白銀琉璃水精，	皆 以 焦 墼 累 集 作 城 黃 金 白 銀 琉 璃 水 精 
T01n0005_002:0169c23	以著城壁，亦以四寶為瓦覆城。城高六丈四	以 著 城 壁 亦 以 四 寶 為 瓦 覆 城 城 高 六 丈 四 
T01n0005_002:0169c24	尺，上廣二丈四尺，城中寶樹，華光五色；行	尺 上 廣 二 丈 四 尺 城 中 寶 樹 華 光 五 色 行 
T01n0005_002:0169c25	有三道，兩邊皆以四寶，瓦覆其上；兩邊居	有 三 道 兩 邊 皆 以 四 寶 瓦 覆 其 上 兩 邊 居 
T01n0005_002:0169c26	家舍宅，彫文刻鏤，服如天上，琴瑟眾樂。男	家 舍 宅 彫 文 刻 鏤 服 如 天 上 琴 瑟 眾 樂 男 
T01n0005_002:0169c27	女不雜，歌音以德，道樂益明，民無憂怖，心	女 不 雜 歌 音 以 德 道 樂 益 明 民 無 憂 怖 心 
T01n0005_002:0169c28	常歡喜，頭上不飾，明香遠達。「其聖王名曰大	常 歡 喜 頭 上 不 飾 明 香 遠 達 其 聖 王 名 曰 大 
T01n0005_002:0169c29	快見，號飛行皇帝，勒兵光世，都無齊雙，相	快 見 號 飛 行 皇 帝 勒 兵 光 世 都 無 齊 雙 相 
T01n0005_002:0170a01	率以道，無違王法，民欲飛行，念即身往。王	率 以 道 無 違 王 法 民 欲 飛 行 念 即 身 往 王 
T01n0005_002:0170a02	有七寶自然生：黃金飛輪，神力白象，紺色	有 七 寶 自 然 生 黃 金 飛 輪 神 力 白 象 紺 色 
T01n0005_002:0170a03	神馬，明月珠，天玉女妻，主寶聖臣，典兵聖	神 馬 明 月 珠 天 玉 女 妻 主 寶 聖 臣 典 兵 聖 
T01n0005_002:0170a04	臣。王有四德，為小兒時，為太子時，即帝位	臣 王 有 四 德 為 小 兒 時 為 太 子 時 即 帝 位 
T01n0005_002:0170a05	時，捐國絕欲為沙門時，各八萬四千歲，斯	時 捐 國 絕 欲 為 沙 門 時 各 八萬四千 歲 斯 
T01n0005_002:0170a06	即大快見王一難及之德；飲食時化，體無長	即 大 快 見 王 一 難 及 之 德 飲 食 時 化 體 無 長 
T01n0005_002:0170a07	疾，寒溫調適身意常安，斯二德；容觀堂堂	疾 寒 溫 調 適 身 意 常 安 斯 二 德 容 觀 堂 堂 
T01n0005_002:0170a08	顏華絕世，微下帝釋，以為不如，斯三德；	顏 華 絕 世 微 下 帝 釋 以 為 不 如 斯 三 德 
T01n0005_002:0170a09	普天率土民無巨細慈愛於王，猶至孝之子	普 天 率 土 民 無 巨 細 慈 愛 於 王 猶 至 孝 之 子 
T01n0005_002:0170a10	願令親安，王亦赤心慈愛眾生，等之於子，	願 令 親 安 王 亦 赤 心 慈 愛 眾 生 等 之 於 子 
T01n0005_002:0170a11	貧給財寶，飢者飯之渴者飲之，窮老幼孤，	貧 給 財 寶 飢 者 飯 之 渴 者 飲 之 窮 老 幼 孤 
T01n0005_002:0170a12	令之合居為親為子，屋舍車乘，疾濟以藥，	令 之 合 居 為 親 為 子 屋 舍 車 乘 疾 濟 以 藥 
T01n0005_002:0170a13	斯謂四德。「其國常聞十二種聲：象聲、馬聲、牛	斯 謂 四 德 其 國 常 聞 十 二 種 聲 象 聲 馬 聲 牛 
T01n0005_002:0170a14	聲、車聲、螺聲、鼓聲、舞聲、歌聲，諸絃樂聲，誦仁	聲 車 聲 螺 聲 鼓 聲 舞 聲 歌 聲 諸 絃 樂 聲 誦 仁 
T01n0005_002:0170a15	義聲，歎佛尊行聲。黎民服飾，眾寶織成，明	義 聲 歎 佛 尊 行 聲 黎 民 服 飾 眾 寶 織 成 明 
T01n0005_002:0170a16	月雜珠，瓔珞光道，飲食伎樂，猶忉利天，居	月 雜 珠 瓔 珞 光 道 飲 食 伎 樂 猶 忉 利 天 居 
T01n0005_002:0170a17	民欣樂，無日不喜。王欲出遊，呼御車臣，	民 欣 樂 無 日 不 喜 王 欲 出 遊 呼 御 車 臣 
T01n0005_002:0170a18	臣名須達，勅之曰：『令車徐行，吾久不見逝心	臣 名 須 達 勅 之 曰 令 車 徐 行 吾 久 不 見 逝 心 
T01n0005_002:0170a19	理家，今欲見之。』逝心理家，聞王當出，有	理 家 今 欲 見 之 逝 心 理 家 聞 王 當 出 有 
T01n0005_002:0170a20	持明月珠者，白珠碧珠、青珠珊瑚、栴檀名香，	持 明 月 珠 者 白 珠 碧 珠 青 珠 珊 瑚 栴 檀 名 香 
T01n0005_002:0170a21	輙貢聖王。王不欲受，皆稽首求哀，王乃受	輙 貢 聖 王 王 不 欲 受 皆 稽 首 求 哀 王 乃 受 
T01n0005_002:0170a22	之。勅掌寶臣，倍顧其直。黎民巨細，亦以	之 勅 掌 寶 臣 倍 顧 其 直 黎 民 巨 細 亦 以 
T01n0005_002:0170a23	眾寶華香散地，稱壽無極。諸小國王，有八	眾 寶 華 香 散 地 稱 壽 無 極 諸 小 國 王 有 八 
T01n0005_002:0170a24	萬四千，聞飛行皇帝欲布施，皆來翼從，至	萬 四 千 聞 飛 行 皇 帝 欲 布 施 皆 來 翼 從 至 
T01n0005_002:0170a25	大殿所。帝欲與諸王俱昇正殿，諸王辭曰：	大 殿 所 帝 欲 與 諸 王 俱 昇 正 殿 諸 王 辭 曰 
T01n0005_002:0170a26	『臣等諸國皆有寶殿。』帝曰：『爾等小殿，未足以	 臣 等 諸 國 皆 有 寶 殿 帝 曰 爾 等 小 殿 未 足 以 
T01n0005_002:0170a27	云，且觀明殿。』遂無敢昇者。諸王各有寶車，	云 且 觀 明 殿 遂 無 敢 昇 者 諸 王 各 有 寶 車 
T01n0005_002:0170a28	車高十丈，皆有四輪，自下以上，悉是七寶，	車 高 十 丈 皆 有 四 輪 自 下 以 上 悉 是 七 寶 
T01n0005_002:0170a29	上施幢幡，色明相照，車駕六馬，馬皆飛行。	上 施 幢 幡 色 明 相 照 車 駕 六 馬 馬 皆 飛 行 
T01n0005_002:0170b01	時有一車駕，兩駱象車，名俱羅竭，聖帝所	時 有 一 車 駕 兩 駱 象 車 名 俱 羅 竭 聖 帝 所 
T01n0005_002:0170b02	乘矣。八萬四千車皆在前導，至明殿所。「殿	乘 矣 八萬四千 車 皆 在 前 導 至 明 殿 所 殿 
T01n0005_002:0170b03	名波羅沙檀，縱廣四十里，以黃金、白銀、琉璃、	名 波 羅 沙 檀 縱 廣 四 十 里 以 黃 金 白 銀 琉 璃 
T01n0005_002:0170b04	水精墼為壁；亦以四寶為柱；黃金瓦，白銀	水 精 墼 為 壁 亦 以 四 寶 為 柱 黃 金 瓦 白 銀 
T01n0005_002:0170b05	瓦，琉璃瓦，水精瓦；陛五十重，皆以黃金、	瓦 琉 璃 瓦 水 精 瓦 陛 五 十 重 皆 以 黃 金 
T01n0005_002:0170b06	白銀、琉璃、水精為陛；黃金梁，白銀梁，琉璃	白 銀 琉 璃 水 精 為 陛 黃 金 梁 白 銀 梁 琉 璃 
T01n0005_002:0170b07	梁，水精梁；黃金[木*沓]，白銀[木*沓]，琉璃[木*沓]，水精[木*沓]。	梁 水 精 梁 黃 金 [木沓]白銀[木沓]琉璃[木沓]水精[木沓] 
T01n0005_002:0170b08	殿中有八萬四千床，黃金床、白銀床，琉璃床、	殿 中 有 八萬四千 床 黃 金 床 白 銀 床 琉 璃 床 
T01n0005_002:0170b09	水精床；黃金帳、白銀帳、琉璃帳、水精帳，黃	水 精 床 黃 金 帳 白 銀 帳 琉 璃 帳 水 精 帳 黃 
T01n0005_002:0170b10	金織成、白銀織成、琉璃織成、水精織成，赤罽	金 織 成 白 銀 織 成 琉 璃 織 成 水 精 織 成 赤 罽 
T01n0005_002:0170b11	織成，皆以布床上，以天上降織成為枕。「阿	織 成 皆 以 布 床 上 以 天 上 降 織 成 為 枕 阿 
T01n0005_002:0170b12	難！宮墻四重：黃金墻、白銀墻、琉璃墻、水精	難 宮 墻 四 重 黃 金 墻 白 銀 墻 琉 璃 墻 水 精 
