T01n0005_001:0160b05	佛般泥洹經卷上	佛 般 泥 洹 經 卷 上 
T01n0005_001:0160b07	西晉河內沙門白法祖譯	西 晉 河 內 沙 門 白 法 祖 譯 
T01n0005_001:0160b08	聞如是：一時，佛在王舍國鷂山中，與千二百	聞 如 是 一 時 佛 在 王 舍 國 鷂 山 中 與 千 二 百 
T01n0005_001:0160b09	五十比丘俱。時，摩竭國王，號名阿闍世，與	五 十 比 丘 俱 時 摩 竭 國 王 號 名 阿 闍 世 與 
T01n0005_001:0160b10	越祇國不相得，欲往伐之。自與群臣共議：	越 祇 國 不 相 得 欲 往 伐 之 自 與 群 臣 共 議 
T01n0005_001:0160b11	「越祇國富，人民熾盛，多出珍寶，不首伏於	 越 祇 國 富 人民熾盛 多 出 珍 寶 不 首 伏 於 
T01n0005_001:0160b12	我，寧可起兵伐其國？」國有賢公，公名雨舍，	我 寧 可 起 兵 伐 其 國 國 有 賢 公 公 名 雨 舍 
T01n0005_001:0160b13	雨舍公者，逝心種也，公言：「唯命。」王告雨舍	雨 舍 公 者 逝 心 種 也 公 言 唯 命 王 告 雨 舍 
T01n0005_001:0160b14	公言：「佛去是不遠，若持王聲，往至佛所，頭	公 言 佛 去 是 不 遠 若 持 王 聲 往 至 佛 所 頭 
T01n0005_001:0160b15	面著足，問佛消息，身體平安不？飡食如常	面 著 足 問 佛 消 息 身 體 平 安 不 飡 食 如 常 
T01n0005_001:0160b16	不？問佛禮竟，自持若意白佛言：『越祇國大	不 問 佛 禮 竟 自 持 若 意 白 佛 言 越 祇 國 大 
T01n0005_001:0160b17	輕易王，王欲往伐之，寧能得勝不？』」公受王	輕 易 王 王 欲 往 伐 之 寧 能 得 勝 不 公 受 王 
T01n0005_001:0160b18	教，即嚴車五百，乘騎二千，步人二千，往到	教 即 嚴 車 五 百 乘 騎 二 千 步 人 二 千 往 到 
T01n0005_001:0160b19	王舍國，得步徑止車下，到佛所見佛前。頭	王 舍 國 得 步 徑 止 車 下 到 佛 所 見 佛 前 頭 
T01n0005_001:0160b20	面著佛足，佛與机使坐，問國丞相：「從何所	面 著 佛 足 佛 與 机 使 坐 問 國 丞 相 從 何 所 
T01n0005_001:0160b21	來？」公言：「王使臣來，稽首佛足，問佛消息，身	來 公 言 王 使 臣 來 稽 首 佛 足 問 佛 消 息 身 
T01n0005_001:0160b22	體平安不？飡食如常不？」佛即問：「王及國人	體 平 安 不 飡 食 如 常 不 佛 即 問 王 及 國 人 
T01n0005_001:0160b23	民，寧安和不？穀糴平賤不？」公言：「得佛恩，皆	民 寧 安 和 不 穀 糴 平 賤 不 公 言 得 佛 恩 皆 
T01n0005_001:0160b24	自安和，風雨時節，國中豐熟。」佛言：「公行道	自 安 和 風 雨 時 節 國 中 豐 熟 佛 言 公 行 道 
T01n0005_001:0160b25	人馬，皆平安不？」公言：「得佛恩，行道皆平安	人 馬 皆 平 安 不 公 言 得 佛 恩 行 道 皆 平 安 
T01n0005_001:0160b26	無他。」公白佛言：「王與越祇國有嫌，欲往伐	無 他 公 白 佛 言 王 與 越 祇 國 有 嫌 欲 往 伐 
T01n0005_001:0160b27	壞之，於佛意何如？可得勝不？」佛言：「是越祇	壞 之 於 佛 意 何 如 可 得 勝 不 佛 言 是 越 祇 
T01n0005_001:0160b28	國人民，持七法者，王不能得勝，不持七法	國 人 民 持 七 法 者 王 不 能 得 勝 不 持 七 法 
T01n0005_001:0160b29	者可勝。」佛言：「我昔嘗往到越祇國，國有急疾	者 可 勝 佛 言 我 昔 嘗 往 到 越 祇 國 國 有 急 疾 
T01n0005_001:0160c01	神舍，我止頓其中。越祇國中諸長老，皆來	神 舍 我 止 頓 其 中 越 祇 國 中 諸 長 老 皆 來 
T01n0005_001:0160c02	語我言：『阿闍世王欲來伐我國，我曹謹勅	語 我 言 阿 闍 世 王 欲 來 伐 我 國 我 曹 謹 勅 
T01n0005_001:0160c03	自守國。』」佛言：「我即告諸長老，莫愁莫恐；若	自 守 國 佛 言 我 即 告 諸 長 老 莫 愁 莫 恐 若 
T01n0005_001:0160c04	曹持七法，阿闍世王來者，不能勝汝。」雨舍	曹 持 七 法 阿 闍 世 王 來 者 不 能 勝 汝 雨 舍 
T01n0005_001:0160c05	問佛：「七法者何等？」時，佛坐，阿難從後扇佛。	問 佛 七 法 者 何 等 時 佛 坐 阿 難 從 後 扇 佛 
T01n0005_001:0160c06	佛告阿難：「汝寧聞越祇國人，數相聚會，講	佛 告 阿 難 汝 寧 聞 越 祇 國 人 數 相 聚 會 講 
T01n0005_001:0160c07	議政事，修備自守不？」對曰：「聞其數相聚會，	議 政 事 修 備 自 守 不 對 曰 聞 其 數 相 聚 會 
T01n0005_001:0160c08	講議政事，修備自守。」佛言：「如是，彼為不衰。	講 議 政 事 修 備 自 守 佛 言 如 是 彼 為 不 衰 
T01n0005_001:0160c09	汝聞越祇，君臣常和，所任忠良，轉相承用	汝 聞 越 祇 君 臣 常 和 所 任 忠 良 轉 相 承 用 
T01n0005_001:0160c10	不？」對曰：「聞其君臣常和，所任忠良，轉相承	不 對 曰 聞 其 君 臣 常 和 所 任 忠 良 轉 相 承 
T01n0005_001:0160c11	用。」「汝聞越祇國，奉法相率，無取無願，不敢	用 汝 聞 越 祇 國 奉 法 相 率 無 取 無 願 不 敢 
T01n0005_001:0160c12	有過不？」曰：「聞其奉法相率，無取無願，不敢	有 過 不 曰 聞 其 奉 法 相 率 無 取 無 願 不 敢 
T01n0005_001:0160c13	有過。」「汝聞越祇，禮化謹敬，男女有別，長幼	有 過 汝 聞 越 祇 禮 化 謹 敬 男 女 有 別 長 幼 
T01n0005_001:0160c14	相事不？」曰：「聞其禮化謹敬，男女有別，長幼	相 事 不 曰 聞 其 禮 化 謹 敬 男 女 有 別 長 幼 
T01n0005_001:0160c15	相事。」「汝聞越祇，孝於父母，遜弟師長，受	相 事 汝 聞 越 祇 孝 於 父 母 遜 弟 師 長 受 
T01n0005_001:0160c16	誡教誨不？」曰：「聞其孝於父母，遜弟師長，受	誡 教 誨 不 曰 聞 其 孝 於 父 母 遜 弟 師 長 受 
T01n0005_001:0160c17	誡教誨。」「汝聞越祇，承天則地，敬畏社稷，奉	誡 教 誨 汝 聞 越 祇 承 天 則 地 敬 畏 社 稷 奉 
T01n0005_001:0160c18	事四時不？」曰：「聞其承天則地，敬畏社稷，奉	事 四 時 不 曰 聞 其 承 天 則 地 敬 畏 社 稷 奉 
T01n0005_001:0160c19	順四時。」「汝聞越祇，尊奉道德，國有沙門應	順 四 時 汝 聞 越 祇 尊 奉 道 德 國 有 沙 門 應 
T01n0005_001:0160c20	真及方遠來者，供養衣被、牀臥、醫藥不？」曰：「聞	真 及 方 遠 來 者 供 養 衣 被 牀 臥 醫 藥 不 曰 聞 
T01n0005_001:0160c21	其尊奉道德，國有沙門應真及方遠來者，供	其 尊 奉 道 德 國 有 沙 門 應 真 及 方 遠 來 者 供 
T01n0005_001:0160c22	養衣被、牀臥、醫藥。」佛言：「夫有國者，行此七法，	養 衣 被 牀 臥 醫 藥 佛 言 夫 有 國 者 行 此 七 法 
T01n0005_001:0160c23	難可得危。」雨舍公對言：「使越祇持一法者，	難 可 得 危 雨 舍 公 對 言 使 越 祇 持 一 法 者 
T01n0005_001:0160c24	尚不可攻，何況七法？」公曰：「國事多故，當還	尚 不 可 攻 何 況 七 法 公 曰 國 事 多 故 當 還 
T01n0005_001:0160c25	請辭。」佛言：「可宜知時！」即從坐起禮佛而去。	請 辭 佛 言 可 宜 知 時 即 從 坐 起 禮 佛 而 去 
T01n0005_001:0160c26	去未久，佛呼阿難勅之，往至鷂山中，請諸	去 未 久 佛 呼 阿 難 勅 之 往 至 鷂 山 中 請 諸 
T01n0005_001:0160c27	比丘僧皆聚會，著講堂中。阿難即受教詔，	比 丘 僧 皆 聚 會 著 講 堂 中 阿 難 即 受 教 詔 
T01n0005_001:0160c28	至鷂山中，勅諸比丘僧：「佛請諸比丘。」比丘	至 鷂 山 中 勅 諸 比 丘 僧 佛 請 諸 比 丘 比 丘 
T01n0005_001:0160c29	悉來，皆為佛作禮，佛即在前，至講堂中，設	悉 來 皆 為 佛 作 禮 佛 即 在 前 至 講 堂 中 設 
T01n0005_001:0161a01	座已皆坐。佛告諸比丘：「若曹當持七戒法。	座 已 皆 坐 佛 告 諸 比 丘 若 曹 當 持 七 戒 法 
T01n0005_001:0161a02	何等為七？比丘當數相聚會誦經，法可久。	何 等 為 七 比 丘 當 數 相 聚 會 誦 經 法 可 久 
T01n0005_001:0161a03	上下相承用坐起，法可久。坐起不得念家室	上 下 相 承 用 坐 起 法 可 久 坐 起 不 得 念 家 室 
T01n0005_001:0161a04	妻子，法可久。在山阻間，若在深林樹下塚	妻 子 法 可 久 在 山 阻 間 若 在 深 林 樹 下 塚 
T01n0005_001:0161a05	間，當自思惟五滅，法可久。少年奉道，當	間 當 自 思 惟 五 滅 法 可 久 少 年 奉 道 當 
T01n0005_001:0161a06	先問長老比丘，敬畏承用，受教莫厭，法可	先 問 長老比丘 敬 畏 承 用 受 教 莫 厭 法 可 
T01n0005_001:0161a07	久。心當奉法，敬畏經戒，法可久。持二百五	久 心 當 奉 法 敬 畏 經 戒 法 可 久 持 二 百 五 
T01n0005_001:0161a08	十戒，具以得阿羅漢道，欲來學者莫却，入	十 戒 具 以 得阿羅漢 道 欲 來 學 者 莫 却 入 
T01n0005_001:0161a09	者相承用，來者所有衣被飲食當共用，病瘦	者 相 承 用 來 者 所 有 衣 被 飲 食 當 共 用 病 瘦 
T01n0005_001:0161a10	當相瞻視。比丘持是七法，法可久。	當 相 瞻 視 比 丘 持 是 七 法 法 可 久 
T01n0005_001:0161a11	「復有七法，皆聽。」比丘諾：「受教。」「比丘不得貪臥，	 復 有 七 法 皆 聽 比 丘 諾 受 教 比 丘 不 得 貪 臥 
T01n0005_001:0161a12	臥者、不得思他事，法可久。樂守清淨，不樂	臥 者 不 得 思 他 事 法 可 久 樂 守 清 淨 不 樂 
T01n0005_001:0161a13	有為，法可久。樂賢共坐，守忍辱行，慎無諍	有 為 法 可 久 樂 賢 共 坐 守 忍 辱 行 慎 無 諍 
T01n0005_001:0161a14	訟，法可久。不得責望人禮敬，為人說經	訟 法 可 久 不 得 責 望 人 禮 敬 為 人 說 經 
T01n0005_001:0161a15	不用作恩德，法可久。小得道，頭角莫自憍	不 用 作 恩 德 法 可 久 小 得 道 頭 角 莫 自 憍 
T01n0005_001:0161a16	恣，法可久。不思諸情欲，心不投餘行，如此	恣 法 可 久 不 思 諸 情 欲 心 不 投 餘 行 如 此 
T01n0005_001:0161a17	者法可久。不貪利養，常樂隱處。草蓐為牀。	者 法 可 久 不 貪 利 養 常 樂 隱 處 草 蓐 為 牀 
T01n0005_001:0161a18	比丘持是，法可久。「復有七法，皆聽。」諸比丘	比 丘 持 是 法 可 久 復 有 七 法 皆 聽 諸 比 丘 
T01n0005_001:0161a19	言：「受教。」「人有惠彼物，餘人不得有恨意，法	言 受 教 人 有 惠 彼 物 餘 人 不 得 有 恨 意 法 
T01n0005_001:0161a20	可久。當知羞慚，法可久。不懈於經戒，法可	可 久 當 知 羞 慚 法 可 久 不 懈 於 經 戒 法 可 
T01n0005_001:0161a21	久。坐起心不忘經法，法可久。坐起不相厭	久 坐 起 心 不 忘 經 法 法 可 久 坐 起 不 相 厭 
T01n0005_001:0161a22	苦，法可久。坐起當明經法，法可久。學讀經	苦 法 可 久 坐 起 當 明 經 法 法 可 久 學 讀 經 
T01n0005_001:0161a23	當諷誦惟其深義。比丘持是七法，法可久。	當 諷 誦 惟 其 深 義 比 丘 持 是 七 法 法 可 久 
T01n0005_001:0161a24	「復有七法。佛在世間，為比丘作師。比丘敬佛	 復 有 七 法 佛 在 世 間 為 比 丘 作 師 比 丘 敬 佛 
T01n0005_001:0161a25	所說戒勅，持受戒法，不慢念師恩，持師戒	所 說 戒 勅 持 受 戒 法 不 慢 念 師 恩 持 師 戒 
T01n0005_001:0161a26	法，法可久。不得下道，當隨佛法約束，法可	法 法 可 久 不 得 下 道 當 隨 佛 法 約 束 法 可 
T01n0005_001:0161a27	久。敬比丘僧，受其教戒，得當承用無厭，法	久 敬 比 丘 僧 受 其 教 戒 得 當 承 用 無 厭 法 
T01n0005_001:0161a28	可久。當重持戒能忍辱者，法可久。隨經戒	可 久 當 重 持 戒 能 忍 辱 者 法 可 久 隨 經 戒 
T01n0005_001:0161a29	心無所貪愛，常念人命非常，法可久。晝日	心 無 所 貪 愛 常 念 人 命 非 常 法 可 久 晝 日 
T01n0005_001:0161b01	不得貪飯食，夜臥不得貪好牀，法可久。自	不 得 貪 飯 食 夜 臥 不 得 貪 好 牀 法 可 久 自 
T01n0005_001:0161b02	勅頓思惟世間擾擾，所念莫懈，莫隨惡心，莫	勅 頓 思 惟 世 間 擾 擾 所 念 莫 懈 莫 隨 惡 心 莫 
T01n0005_001:0161b03	隨邪心，邪心來至，自戒莫隨，當端心，世間	隨 邪 心 邪 心 來 至 自 戒 莫 隨 當 端 心 世 間 
T01n0005_001:0161b04	人為心所欺，比丘莫隨天下愚人心。持是七	人 為 心 所 欺 比 丘 莫 隨 天 下 愚 人 心 持 是 七 
T01n0005_001:0161b05	法，法可久。	法 法 可 久 
T01n0005_001:0161b06	「復有七法。」比丘僧言：「受教。」「比丘當重經如愚	 復 有 七 法 比 丘 僧 言 受 教 比 丘 當 重 經 如 愚 
T01n0005_001:0161b07	人重珍寶，持經當父母，當用經生活，父母	人 重 珍 寶 持 經 當 父 母 當 用 經 生 活 父 母 
T01n0005_001:0161b08	活人一世耳，經度人無數世，令人得泥洹	活 人 一 世 耳 經 度 人 無 數 世 令 人 得 泥 洹 
T01n0005_001:0161b09	道，用是故，法可久。不得貪食嗜味，食不得	道 用 是 故 法 可 久 不 得 貪 食 嗜 味 食 不 得 
T01n0005_001:0161b10	多，多者病人，少者復飢，趣可而已，不得味	多 多 者 病 人 少 者 復 飢 趣 可 而 已 不 得 味 
T01n0005_001:0161b11	飯，法可久。當持身比土，日當憂死，不樂在	飯 法 可 久 當 持 身 比 土 日 當 憂 死 不 樂 在 
T01n0005_001:0161b12	生死中，生者多憂，憂父母、兄弟、妻子、親屬、奴	生 死 中 生 者 多 憂 憂 父 母 兄 弟 妻 子 親 屬 奴 
T01n0005_001:0161b13	婢、知識、畜生、田宅，是曹憂者，皆愚癡憂耳。	婢 知 識 畜 生 田 宅 是 曹 憂 者 皆 愚 癡 憂 耳 
T01n0005_001:0161b14	如人有罪，為吏所取，雖有宗親，不得前附，	如 人 有 罪 為 吏 所 取 雖 有 宗 親 不 得 前 附 
T01n0005_001:0161b15	用是穢故；身當以比土，獨來獨去，當與身	用 是 穢 故 身 當 以 比 土 獨 來 獨 去 當 與 身 
T01n0005_001:0161b16	競，法可久。勤修精進，端身口意行無過失，	競 法 可 久 勤修精進 端 身 口 意 行 無 過 失 
T01n0005_001:0161b17	取道不難，法可久。懼降心意，不聽六情，抑	取 道 不 難 法 可 久 懼 降 心 意 不 聽 六 情 抑 
T01n0005_001:0161b18	婬怒癡，無有邪行，法可久。坐眾人中，不羞	婬 怒 癡 無 有 邪 行 法 可 久 坐 眾 人 中 不 羞 
T01n0005_001:0161b19	眾人，為人所敬，心淨端故，不恐不畏；取	眾 人 為 人 所 敬 心 淨 端 故 不 恐 不 畏 取 
T01n0005_001:0161b20	道不邪，如人為人所讒，為吏所捕，吏雖執	道 不 邪 如 人 為 人 所 讒 為 吏 所 捕 吏 雖 執 
T01n0005_001:0161b21	之，其人不恐，用無所犯故；清淨持戒，畏佛	之 其 人 不 恐 用 無 所 犯 故 清 淨 持 戒 畏 佛 
T01n0005_001:0161b22	戒語，坐眾人中不恐，心淨故，法可久。敬慎	戒 語 坐 眾 人 中 不 恐 心 淨 故 法 可 久 敬 慎 
T01n0005_001:0161b23	不自憍慢，從慧者受經戒，見癡者當教經戒。	不 自 憍 慢 從 慧 者 受 經 戒 見 癡 者 當 教 經 戒 
T01n0005_001:0161b24	比丘持是七法，法可久。	比 丘 持 是 七 法 法 可 久 
T01n0005_001:0161b25	「復有七法。」比丘言：「受教。」「比丘常當念經，棄	 復 有 七 法 比 丘 言 受 教 比 丘 常 當 念 經 棄 
T01n0005_001:0161b26	貪婬之態，常當念度世之道，自思惟身體，	貪 婬 之 態 常 當 念 度 世 之 道 自 思 惟 身 體 
T01n0005_001:0161b27	法可久。常持佛所說經，用著心中，既著心	法 可 久 常 持 佛 所 說 經 用 著 心 中 既 著 心 
T01n0005_001:0161b28	中，當端其心，棄惡心受好心，如人衣多垢，	中 當 端 其 心 棄 惡 心 受 好 心 如 人 衣 多 垢 
T01n0005_001:0161b29	以淳灰浣之再三，遍垢便去；念佛語當持戒，	以 淳 灰 浣 之 再 三 遍 垢 便 去 念 佛 語 當 持 戒 
T01n0005_001:0161c01	去惡就善，法可久。當與心諍，不當隨心，心	去 惡 就 善 法 可 久 當 與 心 諍 不 當 隨 心 心 
T01n0005_001:0161c02	欲婬怒癡不得聽，常自戒於心，不得隨心，	欲 婬 怒 癡 不 得 聽 常 自 戒 於 心 不 得 隨 心 
T01n0005_001:0161c03	如人從軍，健者眾人共將踧在軍前鋒，難得	如 人 從 軍 健 者 眾 人 共 將 踧 在 軍 前 鋒 難 得 
T01n0005_001:0161c04	復還，意欲悔却，羞其後人，以受淨戒，但當	復 還 意 欲 悔 却 羞 其 後 人 以 受 淨 戒 但 當 
T01n0005_001:0161c05	端心正意，在眾人前，莫得在後，可先得道，	端 心 正 意 在 眾 人 前 莫 得 在 後 可 先 得 道 
T01n0005_001:0161c06	法可久。當知所入法行多少深淺，熟與初頭	法 可 久 當 知 所 入 法 行 多 少 深 淺 熟 與 初 頭 
T01n0005_001:0161c07	志，當日勝樂經，不厭苦、不擇食、不擇牀臥，	志 當 日 勝 樂 經 不 厭 苦 不 擇 食 不 擇 牀 臥 
T01n0005_001:0161c08	以道自勸樂，法可久。當敬同學，當持同學	以 道 自 勸 樂 法 可 久 當 敬 同 學 當 持 同 學 
T01n0005_001:0161c09	作兄弟，當端外內，外者身口過，內者心過，	作 兄 弟 當 端 外 內 外 者 身 口 過 內 者 心 過 
T01n0005_001:0161c10	當思惟是二事，法可久。坐自思惟，九孔惡	當 思 惟 是 二 事 法 可 久 坐 自 思 惟 九 孔 惡 
T01n0005_001:0161c11	露無所不有，一孔主內，九孔皆出不淨；飢	露 無 所 不 有 一 孔 主 內 九 孔 皆 出 不 淨 飢 
T01n0005_001:0161c12	飽寒熱，皆為苦極，身體難得宜適，皆不淨	飽 寒 熱 皆 為 苦 極 身 體 難 得 宜 適 皆 不 淨 
T01n0005_001:0161c13	潔；內懷不淨，風寒熱見外，有不淨反自覆，	潔 內 懷 不 淨 風 寒 熱 見 外 有 不 淨 反 自 覆 
T01n0005_001:0161c14	鼻見吐寒熱，心皆不喜，有臭者，亦不惡不	鼻 見 吐 寒 熱 心 皆 不 喜 有 臭 者 亦 不 惡 不 
T01n0005_001:0161c15	喜，比丘當端心內外，法可久。視天下人，帝	喜 比 丘 當 端 心 內 外 法 可 久 視 天 下 人 帝 
T01n0005_001:0161c16	王亦死，貧富貴賤，無有離死者，同死生之	王 亦 死 貧 富 貴 賤 無 有 離 死 者 同 死 生 之 
T01n0005_001:0161c17	道，如人夢見好舍好園豪貴快樂，寤則不見，	道 如 人 夢 見 好 舍 好 園 豪 貴 快 樂 寤 則 不 見 
T01n0005_001:0161c18	世間所有貧富貴賤，如人夢耳，自思惟世	世 間 所 有 貧 富 貴 賤 如 人 夢 耳 自 思 惟 世 
T01n0005_001:0161c19	間，譬如人夢。比丘持是七法，思惟莫失，法	間 譬 如 人 夢 比 丘 持 是 七 法 思 惟 莫 失 法 
T01n0005_001:0161c20	可久。	可 久 
T01n0005_001:0161c21	「復有七法。比丘僧當有慈心於天下，有慈	 復 有 七 法 比 丘 僧 當 有 慈 心 於 天 下 有 慈 
T01n0005_001:0161c22	心於佛，人罵不得應，不得恨，持慈心向天	心 於 佛 人 罵 不 得 應 不 得 恨 持 慈 心 向 天 
T01n0005_001:0161c23	下，如獄中有繫囚，常慈心相向。人處世間，	下 如 獄 中 有 繫 囚 常 慈 心 相 向 人 處 世 間 
T01n0005_001:0161c24	亦當慈心轉相愍念，比丘執心人罵無怒，	亦 當 慈 心 轉 相 愍 念 比 丘 執 心 人 罵 無 怒 
T01n0005_001:0161c25	將踧無喜生有是心，可以無憂。所以不與世	將 踧 無 喜 生 有 是 心 可 以 無 憂 所 以 不 與 世 
T01n0005_001:0161c26	人諍者，譬如牸牛食芻草，出乳乳出酪，酪	人 諍 者 譬 如 牸 牛 食 芻 草 出 乳 乳 出 酪 酪 
T01n0005_001:0161c27	出酥酥成醍醐，持心當如醍醐，奉佛戒，	出 酥 酥 成 醍 醐 持 心 當 如 醍 醐 奉 佛 戒 
T01n0005_001:0161c28	法可久。端舌莫妄語，語莫傷人意，舌當端，	法 可 久 端 舌 莫 妄 語 語 莫 傷 人 意 舌 當 端 
T01n0005_001:0161c29	舌不端，使人不得道；舌致刀杖或致滅門，為	舌 不 端 使 人 不 得 道 舌 致 刀 杖 或 致 滅 門 為 
T01n0005_001:0162a01	道常當端舌，法可久。端心莫念惡，莫思婬，	道 常 當 端 舌 法 可 久 端 心 莫 念 惡 莫 思 婬 
T01n0005_001:0162a02	有婬心者，不成阿羅漢道。夜臥婬欲態欲來	有 婬 心 者 不 成 阿羅漢道 夜 臥 婬 欲 態 欲 來 
T01n0005_001:0162a03	者，當念女人惡露，婬意即解；恨怒心來，	者 當 念 女 人 惡 露 婬 意 即 解 恨 怒 心 來 
T01n0005_001:0162a04	當念生在地上不久，法可久。若有將請比丘	當 念 生 在 地 上 不 久 法 可 久 若 有 將 請 比 丘 
T01n0005_001:0162a05	飲食，餘人不得念言：『是比丘獨得，我不得。』	飲 食 餘 人 不 得 念 言 是 比 丘 獨 得 我 不 得 
T01n0005_001:0162a06	不得有是。曹念比丘病人，儻有義持醫藥	不 得 有 是 曹 念 比 丘 病 人 儻 有 義 持 醫 藥 
T01n0005_001:0162a07	來與之，餘人不得念言：『獨視彼，不視我。』不	來 與 之 餘 人 不 得 念 言 獨 視 彼 不 視 我 不 
T01n0005_001:0162a08	得念是。人持衣物遺比丘，餘人不得念言：『我	得 念 是 人 持 衣 物 遺 比 丘 餘 人 不 得 念 言 我 
T01n0005_001:0162a09	獨不得。』何以所行乞匃得者？以在鉢中，不得	獨 不 得 何 以 所 行 乞 匃 得 者 以 在 鉢 中 不 得 
T01n0005_001:0162a10	言多少，心如是者，法可久。持戒法慎戒法，	言 多 少 心 如 是 者 法 可 久 持 戒 法 慎 戒 法 
T01n0005_001:0162a11	不知者當問知戒比丘。念佛念法念比丘僧，	不 知 者 當 問 知 戒 比 丘 念 佛 念 法 念 比 丘 僧 
T01n0005_001:0162a12	莫得休息，展轉相承用；於衣中得虱，當有	莫 得 休 息 展轉相承 用 於 衣 中 得 虱 當 有 
T01n0005_001:0162a13	慈心向之，法可久。見死人言：『此人既死，不	慈 心 向 之 法 可 久 見 死 人 言 此 人 既 死 不 
T01n0005_001:0162a14	知經道，舉家啼哭，及知識親屬不知，此人	知 經 道 舉 家 啼 哭 及 知 識 親 屬 不 知 此 人 
T01n0005_001:0162a15	獨如去。』比丘以得道，能知死人魂神所趣向，	獨 如 去 比 丘 以 得 道 能 知 死 人 魂 神 所 趣 向 
T01n0005_001:0162a16	佛經不可不讀，道不可不學，天下徑道眾多	佛 經 不 可 不 讀 道 不 可 不 學 天 下 徑 道 眾 多 
T01n0005_001:0162a17	王道最大，佛道亦爾，最上道也。如數十人，	王 道 最 大 佛 道 亦 爾 最 上 道 也 如 數 十 人 
T01n0005_001:0162a18	各持弓箭射埻中，有前中者，有後中者，	各 持 弓 箭 射 埻 中 有 前 中 者 有 後 中 者 
T01n0005_001:0162a19	射不休息，必復中埻，行佛經道如此，莫懈	射 不 休 息 必 復 中 埻 行 佛 經 道 如 此 莫 懈 
T01n0005_001:0162a20	莫念。前以得道，今我不得道，不得有是恨，如	莫 念 前 以 得 道 今 我 不 得 道 不 得 有 是 恨 如 
T01n0005_001:0162a21	人射不休息會中埻，為比丘不止會得道，	人 射 不 休 息 會 中 埻 為 比 丘 不 止 會 得 道 
T01n0005_001:0162a22	法可久。坐起當相承用，佛經當讀諷誦，思	法 可 久 坐 起 當 相 承 用 佛 經 當 讀 諷 誦 思 
T01n0005_001:0162a23	惟其義，除饉清信士、清信女，如此七，法可	惟 其 義 除 饉 清 信 士 清 信 女 如 此 七 法 可 
T01n0005_001:0162a24	久。奉是七七四十九法，如天下水，小溪水	久 奉 是 七 七 四 十 九 法 如 天 下 水 小 溪 水 
T01n0005_001:0162a25	流入大溪，大溪水流入江，江流入海。比丘！	流 入 大 溪 大 溪 水 流 入 江 江 流 入 海 比 丘 
T01n0005_001:0162a26	當如水流入海，為道不止會，當得阿羅漢道。」	當 如 水 流 入 海 為 道 不 止 會 當 得阿羅漢 道 
T01n0005_001:0162a27	佛從王舍國起，呼阿難：「去至巴隣陬。」阿難	佛 從 王 舍 國 起 呼 阿 難 去 至 巴 隣 陬 阿 難 
T01n0005_001:0162a28	言：「諾。」即從摩竭國行未至巴隣陬。中間有	言 諾 即 從 摩 竭 國 行 未 至 巴 隣 陬 中 間 有 
T01n0005_001:0162a29	為羅致陬，佛至呼比丘僧：「皆聽。」比丘諾：「受教。」	為 羅 致 陬 佛 至 呼 比 丘 僧 皆 聽 比 丘 諾 受 教 
T01n0005_001:0162b01	佛言：「天下有四痛，佛所知，人皆不知。用人不	佛 言 天 下 有 四 痛 佛 所 知 人 皆 不 知 用 人 不 
T01n0005_001:0162b02	知故，生死不止，無休息時。何等為四？生痛、	知 故 生 死 不 止 無 休 息 時 何 等 為 四 生 痛 
T01n0005_001:0162b03	老痛、病痛、死痛，人不思惟是四痛，強力忍之	老 痛 病 痛 死 痛 人 不 思 惟 是 四 痛 強 力 忍 之 
T01n0005_001:0162b04	故生死不絕無休止時，佛故發是四痛以告	故 生 死 不 絕 無 休 止 時 佛 故 發 是 四 痛 以 告 
T01n0005_001:0162b05	人。雖有父母妻子，皆當別離，轉相憂思啼	人 雖 有 父 母 妻 子 皆 當 別 離 轉 相 憂 思 啼 
T01n0005_001:0162b06	哭不止。諸所惡見日在目前，用是故佛出經，	哭 不 止 諸 所 惡 見 日 在 目 前 用 是 故 佛 出 經 
T01n0005_001:0162b07	當離是四痛，奉八戒，身亦可厭。」佛言：「一者受	當 離 是 四 痛 奉 八 戒 身 亦 可 厭 佛 言 一 者 受 
T01n0005_001:0162b08	佛語。二者當遠離愛欲就道，無所貪諍。三者	佛 語 二 者 當 遠 離 愛 欲 就 道 無 所 貪 諍 三 者 
