T01n0005_001:0164b10	理家，請佛明日旦，寧可與諸比丘入城飯	理 家 請 佛 明 日 旦 寧 可 與 諸 比 丘 入 城 飯 
T01n0005_001:0164b11	食？佛言：「[木*奈]女朝旦來請佛及比丘僧。」諸逝	食 佛 言 [木奈] 女 朝 旦 來 請 佛 及 比 丘 僧 諸 逝 
T01n0005_001:0164b12	心理家，皆俱去。[木*奈]女明日旦來至佛所，白	心 理 家 皆 俱 去 [木奈] 女 明 日 旦 來 至 佛 所 白 
T01n0005_001:0164b13	佛言：「已設座，飯食具皆已辦，願天尊屈	佛 言 已 設 座 飯 食 具 皆 已 辦 願 天 尊 屈 
T01n0005_001:0164b14	威神。」佛言：「若徑去，我今隨後。」佛起著衣持	威 神 佛 言 若 徑 去 我 今 隨 後 佛 起 著 衣 持 
T01n0005_001:0164b15	鉢，與比丘俱入城。城中觀者數十萬人，中	鉢 與 比 丘 俱 入 城 城 中 觀 者 數 十 萬 人 中 
T01n0005_001:0164b16	有賢善優婆塞，皆言：「佛如明月，弟子如明星，	有 賢 善 優 婆 塞 皆 言 佛 如 明 月 弟 子 如 明 星 
T01n0005_001:0164b17	與月相隨。」時，佛好如是。佛至[木*奈]女家，就坐	與 月 相 隨 時 佛 好 如 是 佛 至 [木奈] 女 家 就 坐 
T01n0005_001:0164b18	行澡水，佛及諸比丘僧飯食竟，澡手已畢，	行 澡 水 佛 及 諸 比 丘 僧 飯 食 竟 澡 手 已 畢 
T01n0005_001:0164b19	[木*奈]女持小机，於佛前坐。佛告[木*奈]女：「聖人及	[木奈]女持小机於佛前坐佛告[木奈] 女 聖 人 及 
T01n0005_001:0164b20	天下尊豪富貴，唯尚戒淨，明佛諸經。坐中	天 下 尊 豪 富 貴 唯 尚 戒 淨 明 佛 諸 經 坐 中 
T01n0005_001:0164b21	語言，無不好聽，其所行處，無不敬愛者，今	語 言 無 不 好 聽 其 所 行 處 無 不 敬 愛 者 今 
T01n0005_001:0164b22	在天下作人，不貪財色，奉佛神化，死無不	在 天 下 作 人 不 貪 財 色 奉 佛 神 化 死 無 不 
T01n0005_001:0164b23	生天上者。」佛告[木*奈]女：「善自愛重，持五戒。」佛	生 天 上 者 佛 告 [木奈] 女 善 自 愛 重 持 五 戒 佛 
T01n0005_001:0164b24	與比丘俱去。	與 比 丘 俱 去 
T01n0005_001:0164b25	佛從維耶梨國出，告阿難：「寧可俱至竹芳	佛 從 維 耶 梨 國 出 告 阿 難 寧 可 俱 至 竹 芳 
T01n0005_001:0164b26	聚。」阿難言：「諾。」又聞竹芳聚，米穀大貴，諸	聚 阿 難 言 諾 又 聞 竹 芳 聚 米 穀 大 貴 諸 
T01n0005_001:0164b27	比丘求分衛難得。佛坐思惟，維耶梨國飢饉，	比 丘 求 分 衛 難 得 佛 坐 思 惟 維 耶 梨 國 飢 饉 
T01n0005_001:0164b28	穀糴騰貴，其聚狹小，不能供諸比丘分衛，	穀 糴 騰 貴 其 聚 狹 小 不 能 供 諸 比 丘 分 衛 
T01n0005_001:0164b29	佛思念，欲遣諸比丘，分布餘國賤米穀處	佛 思 念 欲 遣 諸 比 丘 分 布 餘 國 賤 米 穀 處 
T01n0005_001:0164c01	行分衛。佛告諸比丘僧：「是竹芳聚，米穀騰	行 分 衛 佛 告 諸 比 丘 僧 是 竹 芳 聚 米 穀 騰 
T01n0005_001:0164c02	貴，求分衛難得；彼間有沙羅提國豐熟。是	貴 求 分 衛 難 得 彼 間 有 沙 羅 提 國 豐 熟 是 
T01n0005_001:0164c03	維耶梨四界，米穀皆貴，我自與阿難，俱留	維 耶 梨 四 界 米 穀 皆 貴 我 自 與 阿 難 俱 留 
T01n0005_001:0164c04	此竹芳聚。」諸比丘受佛教，皆去至沙羅提	此 竹 芳 聚 諸 比 丘 受 佛 教 皆 去 至 沙 羅 提 
T01n0005_001:0164c05	國。佛與阿難俱，至竹芳聚，身皆大痛，欲	國 佛 與 阿 難 俱 至 竹 芳 聚 身 皆 大 痛 欲 
T01n0005_001:0164c06	般泥洹。佛自念：「諸比丘皆去，我獨般泥洹，	般 泥 洹 佛 自 念 諸 比 丘 皆 去 我 獨 般 泥 洹 
T01n0005_001:0164c07	不事無教戒？」阿難從一樹下起至佛所，問佛：	不 事 無 教 戒 阿 難 從 一 樹 下 起 至 佛 所 問 佛 
T01n0005_001:0164c08	「聖體不和寧差不？」佛言：「未差大劇，欲般泥	 聖 體 不 和 寧 差 不 佛 言 未 差 大 劇 欲 般 泥 
T01n0005_001:0164c09	洹。」阿難言：「且莫般泥洹，須比丘僧聚會。」佛	洹 阿 難 言 且 莫 般 泥 洹 須 比 丘 僧 聚 會 佛 
T01n0005_001:0164c10	告阿難：「我已有經戒，若曹但當案經戒奉	告 阿 難 我 已 有 經 戒 若 曹 但 當 案 經 戒 奉 
T01n0005_001:0164c11	行之，我亦在比丘僧中，比丘僧皆已知佛	行 之 我 亦 在 比 丘 僧 中 比 丘 僧 皆 已 知 佛 
T01n0005_001:0164c12	所教勅，事師法皆以付諸弟子，弟子但當持	所 教 勅 事 師 法 皆 以 付 諸 弟 子 弟 子 但 當 持 
T01n0005_001:0164c13	行熟學。今我身皆痛，我持佛威神治病，不	行 熟 學 今 我 身 皆 痛 我 持 佛 威 神 治 病 不 
T01n0005_001:0164c14	復持心思病，如小差狀。」佛語阿難：「今佛年	復 持 心 思 病 如 小 差 狀 佛 語 阿 難 今 佛 年 
T01n0005_001:0164c15	已尊，且八十，如故車無堅強，我身體如此	已 尊 且 八 十 如 故 車 無 堅 強 我 身 體 如 此 
T01n0005_001:0164c16	無堅強，我本不為若曹說，無有墮地不死	無 堅 強 我 本 不 為 若 曹 說 無 有 墮 地 不 死 
T01n0005_001:0164c17	者，最上有天，名不想入，壽八十億四千萬	者 最 上 有 天 名 不 想 入 壽 八 十 億 四 千 萬 
T01n0005_001:0164c18	劫，會當復死，用是故起經於天下，斷生死之	劫 會 當 復 死 用 是 故 起 經 於 天 下 斷 生 死 之 
T01n0005_001:0164c19	根本。我般泥洹以後，無得棄是經戒，轉相	根 本 我 般 泥 洹 以 後 無 得 棄 是 經 戒 轉 相 
T01n0005_001:0164c20	承用，自思中外，端心正行，當持戒法，中外	承 用 自 思 中 外 端 心 正 行 當 持 戒 法 中 外 
T01n0005_001:0164c21	令如常。其有四輩弟子，持戒法者，皆佛弟	令 如 常 其 有 四 輩 弟 子 持 戒 法 者 皆 佛 弟 
T01n0005_001:0164c22	子，其有學佛經道者，皆是佛弟子。佛棄轉	子 其 有 學 佛 經 道 者 皆 是 佛 弟 子 佛 棄 轉 
T01n0005_001:0164c23	輪王，憂天上天下人，亦可自憂疾，去婬態、	輪 王 憂 天 上 天 下 人 亦 可 自 憂 疾 去 婬 態 
T01n0005_001:0164c24	怒態、癡態。」	怒 態 癡 態 
T01n0005_001:0164c25	佛從竹芳聚，呼阿難：「且復還至維耶梨國。」	佛 從 竹 芳 聚 呼 阿 難 且 復 還 至 維 耶 梨 國 
T01n0005_001:0164c26	阿難言：「受教。」佛還維耶梨國，入城持鉢行分	阿 難 言 受 教 佛 還 維 耶 梨 國 入 城 持 鉢 行 分 
T01n0005_001:0164c27	衛，還止急疾神樹下露坐，思惟生死之事。	衛 還 止 急 疾 神 樹 下 露 坐 思 惟 生 死 之 事 
T01n0005_001:0164c28	阿難遠在一樹下，思惟陰房之事，起至佛所，	阿 難 遠 在 一 樹 下 思 惟 陰 房 之 事 起 至 佛 所 
T01n0005_001:0164c29	為佛作禮已，住白佛言：「何以不般泥洹？」佛	為 佛 作 禮 已 住 白 佛 言 何 以 不 般 泥 洹 佛 
T01n0005_001:0165a01	告阿難：「維耶梨國大樂，越耶國大樂，急疾	告 阿 難 維 耶 梨 國 大 樂 越 耶 國 大 樂 急 疾 
T01n0005_001:0165a02	神地大樂，沙達諍城門大樂，城中街曲大樂，	神 地 大 樂 沙 達 諍 城 門 大 樂 城 中 街 曲 大 樂 
T01n0005_001:0165a03	社名浮沸大樂，閻浮利天下大樂，越祇大樂，	社 名 浮 沸 大 樂 閻 浮 利 天 下 大 樂 越 祇 大 樂 
T01n0005_001:0165a04	遮波國大樂，薩城門大樂，摩竭國大樂，滿	遮 波 國 大 樂 薩 城 門 大 樂 摩 竭 國 大 樂 滿 
T01n0005_001:0165a05	沸大樂，鬱提大樂，醯連溪出金山大樂，閻	沸 大 樂 鬱 提 大 樂 醯 連 溪 出 金 山 大 樂 閻 
T01n0005_001:0165a06	浮利內地，所生五色如畫，人在其中生者大	浮 利 內 地 所 生 五 色 如 畫 人 在 其 中 生 者 大 
T01n0005_001:0165a07	樂。」	樂 
T01n0005_001:0165a08	佛告阿難：「其有比丘比丘尼，持四法熟思正	佛 告 阿 難 其 有 比 丘 比 丘 尼 持 四 法 熟 思 正 
T01n0005_001:0165a09	心不隨心，外亦思善，中亦思善，心亦無所	心 不 隨 心 外 亦 思 善 中 亦 思 善 心 亦 無 所 
T01n0005_001:0165a10	復貪樂，心不驚恐不復走，比丘比丘尼，其有	復 貪 樂 心 不 驚 恐 不 復 走 比 丘 比 丘 尼 其 有 
T01n0005_001:0165a11	持志意如是四法，名四神足，欲不死一劫	持 志 意 如 是 四 法 名 四 神 足 欲 不 死 一 劫 
T01n0005_001:0165a12	可得。」魔時入阿難腹中。佛復告阿難：「如是	可 得 魔 時 入 阿 難 腹 中 佛 復 告 阿 難 如 是 
T01n0005_001:0165a13	尚可。」阿難復言：「佛何以不般泥洹？時足可	尚 可 阿 難 復 言 佛 何 以 不 般 泥 洹 時 足 可 
T01n0005_001:0165a14	般泥洹。」佛復言：「閻浮利大樂，其有知是四	般 泥 洹 佛 復 言 閻 浮 利 大 樂 其 有 知 是 四 
T01n0005_001:0165a15	神足者，當可在天地間一劫有餘。」佛告阿難	神 足 者 當 可 在 天 地 間 一 劫 有 餘 佛 告 阿 難 
T01n0005_001:0165a16	如是者再三，阿難不應四神足事。佛告阿	如 是 者 再 三 阿 難 不 應 四 神 足 事 佛 告 阿 
T01n0005_001:0165a17	難：「若却於樹下自思惟。」佛起至醯連溪水邊	難 若 却 於 樹 下 自 思 惟 佛 起 至 醯 連 溪 水 邊 
T01n0005_001:0165a18	樹下坐，魔來至佛所言：「何以不般泥洹？」佛言：	樹 下 坐 魔 來 至 佛 所 言 何 以 不 般 泥 洹 佛 言 
T01n0005_001:0165a19	「咄！弊魔！未可般泥洹，須我四輩弟子黠慧得	 咄 弊 魔 未 可 般 泥 洹 須 我 四 輩 弟 子 黠 慧 得 
T01n0005_001:0165a20	道，須我天上諸天世間人民逮及鬼神智慧	道 須 我 天 上 諸 天 世 間 人 民 逮 及 鬼 神 智 慧 
T01n0005_001:0165a21	得道，須我經法遍布天下，未可般泥洹。」魔	得 道 須 我 經 法 遍 布 天 下 未 可 般 泥 洹 魔 
T01n0005_001:0165a22	知佛當般泥洹，歡喜而去。佛坐自思惟：「亦	知 佛 當 般 泥 洹 歡 喜 而 去 佛 坐 自 思 惟 亦 
T01n0005_001:0165a23	可放棄壽命，意欲放棄壽命。」時天地大動，	可 放 棄 壽 命 意 欲 放 棄 壽 命 時 天 地 大 動 
T01n0005_001:0165a24	諸鬼神皆驚。阿難於樹下，驚起至佛所，前	諸 鬼 神 皆 驚 阿 難 於 樹 下 驚 起 至 佛 所 前 
T01n0005_001:0165a25	以頭面著佛足，却在一面住，白佛：「我於樹	以 頭 面 著 佛 足 却 在 一 面 住 白 佛 我 於 樹 
T01n0005_001:0165a26	下坐，天地大動，我驚衣毛為起，我生不更	下 坐 天 地 大 動 我 驚 衣 毛 為 起 我 生 不 更 
T01n0005_001:0165a27	是曹地動。」佛為阿難說：「天地動有八事。何	是 曹 地 動 佛 為 阿 難 說 天 地 動 有 八 事 何 
T01n0005_001:0165a28	等為八？地在水上，水在風上，風持水，如從	等 為 八 地 在 水 上 水 在 風 上 風 持 水 如 從 
T01n0005_001:0165a29	地上望天，或時風動水，水動地，地因動，是	地 上 望 天 或 時 風 動 水 水 動 地 地 因 動 是 
T01n0005_001:0165b01	為一動。有阿羅漢尊貴，自欲試威神，意欲	為 一 動 有 阿 羅 漢 尊 貴 自 欲 試 威 神 意 欲 
T01n0005_001:0165b02	令地動，因以手兩指案地，天地為大動，是	令 地 動 因 以 手 兩 指 案 地 天 地 為 大 動 是 
T01n0005_001:0165b03	為二動。中有天威神大，意欲動地，地即為	為 二 動 中 有 天 威 神 大 意 欲 動 地 地 即 為 
T01n0005_001:0165b04	大動，是為三動。佛為菩薩時，從第四兜術	大 動 是 為 三 動 佛 為 菩 薩 時 從 第 四 兜 術 
T01n0005_001:0165b05	天來下，入母腹中，時，天地為大動。菩薩從	天 來 下 入 母 腹 中 時 天 地 為 大 動 菩 薩 從 
T01n0005_001:0165b06	右脇生時，天地為大動。菩薩得道為佛時，	右 脇 生 時 天 地 為 大 動 菩 薩 得 道 為 佛 時 
T01n0005_001:0165b07	天地為大動。佛起本經時，天地為大動。佛	天 地 為 大 動 佛 起 本 經 時 天 地 為 大 動 佛 
T01n0005_001:0165b08	放棄壽命，天地為大動。」佛告阿難：「今佛却	放 棄 壽 命 天 地 為 大 動 佛 告 阿 難 今 佛 却 
T01n0005_001:0165b09	後三月當般泥洹，天地為當復大動，是為	後 三 月 當 般 泥 洹 天 地 為 當 復 大 動 是 為 
T01n0005_001:0165b10	八動。」阿難聞佛自期三月，即啼而問：「得無	八 動 阿 難 聞 佛 自 期 三 月 即 啼 而 問 得 無 
T01n0005_001:0165b11	以棄壽命？」佛告阿難：「是以棄壽命。」阿難白	以 棄 壽 命 佛 告 阿 難 是 以 棄 壽 命 阿 難 白 
T01n0005_001:0165b12	佛言：「我從佛聞口受，若比丘有是四法，名	佛 言 我 從 佛 聞 口 受 若 比 丘 有 是 四 法 名 
T01n0005_001:0165b13	四神足，欲不死一劫可得。佛德過四神足，	四 神 足 欲 不 死 一 劫 可 得 佛 德 過 四 神 足 
T01n0005_001:0165b14	何以不止過一劫？」佛告阿難：「是若過，是若所	何 以 不 止 過 一 劫 佛 告 阿 難 是 若 過 是 若 所 
T01n0005_001:0165b15	作。我再三告言，閻浮利內大樂；若徑默然	作 我 再 三 告 言 閻 浮 利 內 大 樂 若 徑 默 然 
T01n0005_001:0165b16	不應。我見若頭角，若何以聽魔使得入若腹	不 應 我 見 若 頭 角 若 何 以 聽 魔 使 得 入 若 腹 
T01n0005_001:0165b17	中？我今不得復止，却後三月當般泥洹。」阿	中 我 今 不 得 復 止 却 後 三 月 當 般 泥 洹 阿 
T01n0005_001:0165b18	難即起，語諸比丘僧：「佛却後三月當般泥洹。」	難 即 起 語 諸 比 丘 僧 佛 却 後 三 月 當 般 泥 洹 
T01n0005_001:0165b19	佛告阿難：「皆聚會諸比丘，著大會堂中。」阿	佛 告 阿 難 皆 聚 會 諸 比 丘 著 大 會 堂 中 阿 
T01n0005_001:0165b20	難白言：「比丘僧皆在大會堂中。」佛即起到大	難 白 言 比 丘 僧 皆 在 大 會 堂 中 佛 即 起 到 大 
T01n0005_001:0165b21	會堂中，諸比丘皆起，為佛作禮。佛告諸比	會 堂 中 諸 比 丘 皆 起 為 佛 作 禮 佛 告 諸 比 
T01n0005_001:0165b22	丘：「天下無常堅固人，愛樂生死，不求度世	丘 天 下 無 常 堅 固 人 愛 樂 生 死 不 求 度 世 
T01n0005_001:0165b23	道者，皆為癡。父母皆當別離，有憂哭之念，	道 者 皆 為 癡 父 母 皆 當 別 離 有 憂 哭 之 念 
T01n0005_001:0165b24	人轉相恩愛貪慕悲哀，天下無生不死者。我	人 轉 相 恩 愛 貪 慕 悲 哀 天 下 無 生 不 死 者 我 
T01n0005_001:0165b25	本經說，生者皆當死，死者復生，轉相憂哭，	本 經 說 生 者 皆 當 死 死 者 復 生 轉 相 憂 哭 
T01n0005_001:0165b26	無休息時。須彌山尚崩壞，天上諸天亦死，	無 休 息 時 須 彌 山 尚 崩 壞 天 上 諸 天 亦 死 
T01n0005_001:0165b27	作王者亦死，貧富貴賤下至畜生，無生不死	作 王 者 亦 死 貧 富 貴 賤 下 至 畜 生 無 生 不 死 
T01n0005_001:0165b28	者，莫怪佛却後三月當般泥洹。佛去亦當持	者 莫 怪 佛 却 後 三 月 當 般 泥 洹 佛 去 亦 當 持 
T01n0005_001:0165b29	經戒，在者亦當持經戒，趣至度世，不復生	經 戒 在 者 亦 當 持 經 戒 趣 至 度 世 不 復 生 
T01n0005_001:0165c01	死，無復憂哭。佛經當使長久，佛去後天下	死 無 復 憂 哭 佛 經 當 使 長 久 佛 去 後 天 下 
T01n0005_001:0165c02	賢者，當共持經戒，天下人自正心者，天上	賢 者 當 共 持 經 戒 天 下 人 自 正 心 者 天 上 
T01n0005_001:0165c03	諸天，皆喜助人得福。佛經可讀、可諷、可學、可	諸 天 皆 喜 助 人 得 福 佛 經 可 讀 可 諷 可 學 可 
T01n0005_001:0165c04	持、可思、可正心、可端意、可轉相教，有四事：端	持 可 思 可 正 心 可 端 意 可 轉 相 教 有 四 事 端 
T01n0005_001:0165c05	身、端心、端志、端口。復有四事，欲怒者忍，惡	身 端 心 端 志 端 口 復 有 四 事 欲 怒 者 忍 惡 
T01n0005_001:0165c06	念者棄，貪欲者棄，常當憂死。復有四事：心	念 者 棄 貪 欲 者 棄 常 當 憂 死 復 有 四 事 心 
T01n0005_001:0165c07	欲邪者莫聽，心欲婬者莫聽，思欲惡者莫聽，	欲 邪 者 莫 聽 心 欲 婬 者 莫 聽 思 欲 惡 者 莫 聽 
T01n0005_001:0165c08	思欲豪貴莫聽。復有四事：心常當憂死，心	思 欲 豪 貴 莫 聽 復 有 四 事 心 常 當 憂 死 心 
T01n0005_001:0165c09	所欲圖惡者莫聽，當撿心，心當隨人，人莫	所 欲 圖 惡 者 莫 聽 當 撿 心 心 當 隨 人 人 莫 
T01n0005_001:0165c10	隨心，心者誤人，心殺身，心取羅漢，心取天，	隨 心 心 者 誤 人 心 殺 身 心 取 羅 漢 心 取 天 
T01n0005_001:0165c11	心取人，心取畜生蟲蟻鳥獸，心取地獄，心	心 取 人 心 取 畜 生 蟲 蟻 鳥 獸 心 取 地 獄 心 
T01n0005_001:0165c12	取餓鬼，作形貌者，皆心所為。壽命，三者相	取 餓 鬼 作 形 貌 者 皆 心 所 為 壽 命 三 者 相 
T01n0005_001:0165c13	隨，心最是師，命隨心，壽隨命，三者相隨，	隨 心 最 是 師 命 隨 心 壽 隨 命 三 者 相 隨 
T01n0005_001:0165c14	今我作佛，為天上天下所敬，皆心所為，當	今 我 作 佛 為 天 上 天 下 所 敬 皆 心 所 為 當 
T01n0005_001:0165c15	念生死之痛，與家室別離，當念八事，思惟	念 生 死 之 痛 與 家 室 別 離 當 念 八 事 思 惟 
T01n0005_001:0165c16	佛經：一者當棄妻子求度世道，不與世間諍，	佛 經 一 者 當 棄 妻 子 求 度 世 道 不 與 世 間 諍 
T01n0005_001:0165c17	無貪心。二者不得兩舌、惡口、妄言、綺語、吟嘯、	無 貪 心 二 者 不 得 兩 舌 惡 口 妄 言 綺 語 吟 嘯 
T01n0005_001:0165c18	歌戲。三者不得殺生，盜人財物，思念婬泆。四	歌 戲 三 者 不 得 殺 生 盜 人 財 物 思 念 婬 泆 四 
T01n0005_001:0165c19	者不得懷怒癡貪。五者不得嫉彼慢人。六者	者 不 得 懷 怒 癡 貪 五 者 不 得 嫉 彼 慢 人 六 者 
T01n0005_001:0165c20	不得思念作惡加痛於人。七者無作恣態，不	不 得 思 念 作 惡 加 痛 於 人 七 者 無 作 恣 態 不 
T01n0005_001:0165c21	得懈怠著臥，存味飲食。八者當憂身生老病	得 懈 怠 著 臥 存 味 飲 食 八 者 當 憂 身 生 老 病 
T01n0005_001:0165c22	死。持是八事，自端心，可與天下無諍，當趣	死 持 是 八 事 自 端 心 可 與 天 下 無 諍 當 趣 
T01n0005_001:0165c23	度世道。諸比丘當思惟是八事，本四痛，佛經	度 世 道 諸 比 丘 當 思 惟 是 八 事 本 四 痛 佛 經 
T01n0005_001:0165c24	可長久。」	可 長 久 
T01n0005_001:0165c25	佛從維耶梨國，呼阿難：「去至拘隣聚。」阿難	佛 從 維 耶 梨 國 呼 阿 難 去 至 拘 隣 聚 阿 難 
T01n0005_001:0165c26	言：「諾。」佛從維耶梨國出，迴身視城。阿難即	言 諾 佛 從 維 耶 梨 國 出 迴 身 視 城 阿 難 即 
T01n0005_001:0165c27	前問佛：「佛不妄轉身視城。」佛告阿難：「我不妄	前 問 佛 佛 不 妄 轉 身 視 城 佛 告 阿 難 我 不 妄 
T01n0005_001:0165c28	轉身，夫作佛不得妄還向視。」阿難言：「佛還	轉 身 夫 作 佛 不 得 妄 還 向 視 阿 難 言 佛 還 
T01n0005_001:0165c29	向視者何意？」佛言：「我今日壽竟，不復入是	向 視 者 何 意 佛 言 我 今 日 壽 竟 不 復 入 是 
T01n0005_001:0166a01	城，故還顧耳。」隨佛有一比丘，前問佛：「於今	城 故 還 顧 耳 隨 佛 有 一 比 丘 前 問 佛 於 今 
T01n0005_001:0166a02	不復還入是城中？」佛言：「我當般泥洹，不復還	不 復 還 入 是 城 中 佛 言 我 當 般 泥 洹 不 復 還 
T01n0005_001:0166a03	見維耶梨國，當至華氏鄉土。」佛至拘鄰聚，聚	見 維 耶 梨 國 當 至 華 氏 鄉 土 佛 至 拘 鄰 聚 聚 
T01n0005_001:0166a04	中有園，名尸舍洹。佛皆呼諸比丘：「今作心	中 有 園 名 尸 舍 洹 佛 皆 呼 諸 比 丘 今 作 心 
T01n0005_001:0166a05	淨潔坐，自思惟，知生中慧者使心端，心端者	淨 潔 坐 自 思 惟 知 生 中 慧 者 使 心 端 心 端 者 
T01n0005_001:0166a06	婬怒癡態三態皆解，其比丘自說以斷生死	婬 怒 癡 態 三 態 皆 解 其 比 丘 自 說 以 斷 生 死 
T01n0005_001:0166a07	之根，得羅漢道，一心無所復憂，不復憂生死，	之 根 得 羅 漢 道 一 心 無 所 復 憂 不 復 憂 生 死 
T01n0005_001:0166a08	雖更苦，得不生死之道。」佛從拘隣聚，呼阿難：	雖 更 苦 得 不 生 死 之 道 佛 從 拘 隣 聚 呼 阿 難 
T01n0005_001:0166a09	「去至揵梨聚。」阿難言：「諾。」佛與比丘僧，俱至揵	 去 至 揵 梨 聚 阿 難 言 諾 佛 與 比 丘 僧 俱 至 揵 
T01n0005_001:0166a10	梨聚。從揵梨聚，佛呼阿難：「俱至金聚。」與比	梨 聚 從 揵 梨 聚 佛 呼 阿 難 俱 至 金 聚 與 比 
T01n0005_001:0166a11	丘僧俱，佛告諸比丘：「其有比丘，淨心思心智	丘 僧 俱 佛 告 諸 比 丘 其 有 比 丘 淨 心 思 心 智 
T01n0005_001:0166a12	心自思惟，其有智知經者，是慧心本，婬心、	心 自 思 惟 其 有 智 知 經 者 是 慧 心 本 婬 心 
T01n0005_001:0166a13	怒心、癡心皆滅去，三心清淨，欲得度世道不	怒 心 癡 心 皆 滅 去 三 心 清 淨 欲 得 度 世 道 不 
T01n0005_001:0166a14	難。以得羅漢道，諸婬、怒、癡皆消滅去，當自	難 以 得 羅 漢 道 諸 婬 怒 癡 皆 消 滅 去 當 自 
T01n0005_001:0166a15	說已棄是三事，不復作生死之法。」佛從金	說 已 棄 是 三 事 不 復 作 生 死 之 法 佛 從 金 
T01n0005_001:0166a16	聚，呼阿難：「且復至授手聚。」阿難言：「諾。」即與	聚 呼 阿 難 且 復 至 授 手 聚 阿 難 言 諾 即 與 
T01n0005_001:0166a17	諸比丘俱，至授手聚。佛告比丘：「淨心思心	諸 比 丘 俱 至 授 手 聚 佛 告 比 丘 淨 心 思 心 
T01n0005_001:0166a18	智心，有淨心意者，心即生，智心即生，智	智 心 有 淨 心 意 者 心 即 生 智 心 即 生 智 
T01n0005_001:0166a19	心即生開解，不念婬，不念怒，不復癡，心乃	心 即 生 開 解 不 念 婬 不 念 怒 不 復 癡 心 乃 
T01n0005_001:0166a20	開解。」比丘自說言：「我所求皆得，因見羅漢	開 解 比 丘 自 說 言 我 所 求 皆 得 因 見 羅 漢 
T01n0005_001:0166a21	道。」佛從授手聚，呼阿難：「去至掩滿聚。」阿難言：	道 佛 從 授 手 聚 呼 阿 難 去 至 掩 滿 聚 阿 難 言 
T01n0005_001:0166a22	「諾。」即與諸比丘俱，至掩滿聚。佛告諸比丘	 諾 即 與 諸 比 丘 俱 至 掩 滿 聚 佛 告 諸 比 丘 
T01n0005_001:0166a23	僧：「淨心之法，思心智心，至無婬怒之態，得	僧 淨 心 之 法 思 心 智 心 至 無 婬 怒 之 態 得 
T01n0005_001:0166a24	淨心之道，思心智心，即生思心之道，淨心智	淨 心 之 道 思 心 智 心 即 生 思 心 之 道 淨 心 智 
T01n0005_001:0166a25	心，即開解智心之道，淨心思心即明。人有	心 即 開 解 智 心 之 道 淨 心 思 心 即 明 人 有 
T01n0005_001:0166a26	褺與染者作色，褺布淨潔，作色皆好，是	褺 與 染 者 作 色 褺 布 淨 潔 作 色 皆 好 是 
T01n0005_001:0166a27	褺淨故。比丘有是三心，淨心、思心、智心，淨心	褺 淨 故 比 丘 有 是 三 心 淨 心 思 心 智 心 淨 心 
T01n0005_001:0166a28	為尸大，思心為三摩提，智心為崩慢若。尸大	為 尸 大 思 心 為 三 摩 提 智 心 為 崩 慢 若 尸 大 
T01n0005_001:0166a29	心者，不婬、不怒、不貪。三摩提者，攝心令不走。	心 者 不 婬 不 怒 不 貪 三 摩 提 者 攝 心 令 不 走 
T01n0005_001:0166b01	崩慢若者，心無愛欲，持佛經戒。如人有褺	崩 慢 若 者 心 無 愛 欲 持 佛 經 戒 如 人 有 褺 
T01n0005_001:0166b02	布，褺布有垢，人欲染作色，以著染中，色不	布 褺 布 有 垢 人 欲 染 作 色 以 著 染 中 色 不 
T01n0005_001:0166b03	明。比丘不定在淨心、思心、智心，欲得道者難，	明 比 丘 不 定 在 淨 心 思 心 智 心 欲 得 道 者 難 
T01n0005_001:0166b04	坐心不解故。比丘心自解，坐思即見天上，具	坐 心 不 解 故 比 丘 心 自 解 坐 思 即 見 天 上 具 
T01n0005_001:0166b05	知人心所念，亦見地獄、餓鬼、畜生善惡所趣，	知 人 心 所 念 亦 見 地 獄 餓 鬼 畜 生 善 惡 所 趣 
T01n0005_001:0166b06	如清水下有沙石，青黃白黑，水中所有皆現，	如 清 水 下 有 沙 石 青 黃 白 黑 水 中 所 有 皆 現 
T01n0005_001:0166b07	但水清故；求度世道，如是心清淨。譬如溪水，	但 水 清 故 求 度 世 道 如 是 心 清 淨 譬 如 溪 水 
T01n0005_001:0166b08	濁，下沙石不見，亦不知水深淺；比丘心不淨，	濁 下 沙 石 不 見 亦 不 知 水 深 淺 比 丘 心 不 淨 
T01n0005_001:0166b09	不能得度世道，坐心濁故。」佛從掩滿聚，呼阿	不 能 得 度 世 道 坐 心 濁 故 佛 從 掩 滿 聚 呼 阿 
T01n0005_001:0166b10	難：「俱至喜豫聚。」阿難言：「諾。」即與諸比丘俱，	難 俱 至 喜 豫 聚 阿 難 言 諾 即 與 諸 比 丘 俱 
T01n0005_001:0166b11	至喜豫聚。佛告比丘：「若有淨心思心智心，師	至 喜 豫 聚 佛 告 比 丘 若 有 淨 心 思 心 智 心 師 
