T01n0005_002:0170b13	墻；作四寶浴池，周匝四十里，黃金池白銀	墻 作 四 寶 浴 池 周 匝 四 十 里 黃 金 池 白 銀 
T01n0005_002:0170b14	陛，白銀池黃金陛，琉璃池水精陛，水精池	陛 白 銀 池 黃 金 陛 琉 璃 池 水 精 陛 水 精 池 
T01n0005_002:0170b15	琉璃陛，池中自然，生四色蓮華，青紅紫白	琉 璃 陛 池 中 自 然 生 四 色 蓮 華 青 紅 紫 白 
T01n0005_002:0170b16	華，冬夏常生池中，外有香華樹，殿下有四	華 冬 夏 常 生 池 中 外 有 香 華 樹 殿 下 有 四 
T01n0005_002:0170b17	道，亦以四寶為步欄，欄各長二十里。殿陛	道 亦 以 四 寶 為 步 欄 欄 各 長 二 十 里 殿 陛 
T01n0005_002:0170b18	之前，有四寶樹，樹高四十里，蔭地亦爾，黃	之 前 有 四 寶 樹 樹 高 四 十 里 蔭 地 亦 爾 黃 
T01n0005_002:0170b19	金樹白銀葉，白銀樹黃金葉，琉璃樹水精葉，	金 樹 白 銀 葉 白 銀 樹 黃 金 葉 琉 璃 樹 水 精 葉 
T01n0005_002:0170b20	水精樹琉璃葉。帝於殿下，自思惟不宜上	水 精 樹 琉 璃 葉 帝 於 殿 下 自 思 惟 不 宜 上 
T01n0005_002:0170b21	殿，辭讓諸王，諸王皆不敢昇。大快見勅令	殿 辭 讓 諸 王 諸 王 皆 不 敢 昇 大 快 見 勅 令 
T01n0005_002:0170b22	近臣，請諸沙門逝心明經持戒者先上殿，	近 臣 請 諸 沙 門 逝 心 明 經 持 戒 者 先 上 殿 
T01n0005_002:0170b23	具設美食，重賜明寶。沙門逝心去，帝即深惟，	具 設 美 食 重 賜 明 寶 沙 門 逝 心 去 帝 即 深 惟 
T01n0005_002:0170b24	壽命非常，與一侍人，俱昇明殿曰：『吾欲遣	壽 命 非 常 與 一 侍 人 俱 昇 明 殿 曰 吾 欲 遣 
T01n0005_002:0170b25	諸夫人伎女。』傍臣諸王，各遣令去。帝坐黃	諸 夫 人 伎 女 傍 臣 諸 王 各 遣 令 去 帝 坐 黃 
T01n0005_002:0170b26	金床，足蹈白銀机，深自思念：『婬泆之行，何	金 床 足 蹈 白 銀 机 深 自 思 念 婬 泆 之 行 何 
T01n0005_002:0170b27	益於己，愚人多貪不知其禍。吾今雖壽三十	益 於 己 愚 人 多 貪 不 知 其 禍 吾 今 雖 壽 三 十 
T01n0005_002:0170b28	三萬六千歲，夫盛有衰合會有離，身為朽種，	三 萬 六 千 歲 夫 盛 有 衰 合 會 有 離 身 為 朽 種 
T01n0005_002:0170b29	會成灰土，斯四寶殿，孰能久保乎？』曰：『吾一	會 成 灰 土 斯 四 寶 殿 孰 能 久 保 乎 曰 吾 一 
T01n0005_002:0170c01	身耳，小屋足安，何用四十里殿八萬四千	身 耳 小 屋 足 安 何 用 四 十 里 殿 八萬四千 
T01n0005_002:0170c02	床為？』從黃金床至白銀床，足蹈金机：『惟人	床 為 從 黃 金 床 至 白 銀 床 足 蹈 金 机 惟 人 
T01n0005_002:0170c03	作意，必當清潔貪、嫉、恚、癡、邪婬之心，以四	作 意 必 當 清 潔 貪 嫉 恚 癡 邪 婬 之 心 以 四 
T01n0005_002:0170c04	非常滅令無餘，覩世無常，吾焉得久？』從白銀	非 常 滅 令 無 餘 覩 世 無 常 吾 焉 得 久 從 白 銀 
T01n0005_002:0170c05	床至琉璃床，足蹈水精机曰：『吾後宮玉女，	床 至 琉 璃 床 足 蹈 水 精 机 曰 吾 後 宮 玉 女 
T01n0005_002:0170c06	有八萬四千人，各遣令去，用之為拘，女聚	有 八萬四千 人 各 遣 令 去 用 之 為 拘 女 聚 
T01n0005_002:0170c07	惡盛，當棄穢意。』從琉璃床至水精床，足蹈	惡 盛 當 棄 穢 意 從 琉 璃 床 至 水 精 床 足 蹈 
T01n0005_002:0170c08	琉璃机：『重思天下，眾事皆惡，唯無為快，除	琉 璃 机 重 思 天 下 眾 事 皆 惡 唯 無 為 快 除 
T01n0005_002:0170c09	吾濁志，當求無為，今雖為飛行皇帝豪貴如	吾 濁 志 當 求 無 為 今 雖 為 飛 行 皇 帝 豪 貴 如 
T01n0005_002:0170c10	斯，何潤於身？』侍者前白：『諸玉女寶，問王處	斯 何 潤 於 身 侍 者 前 白 諸 玉 女 寶 問 王 處 
T01n0005_002:0170c11	殿，何其稽久，皆欲進前？』帝告侍者曰：『勅掌	殿 何 其 稽 久 皆 欲 進 前 帝 告 侍 者 曰 勅 掌 
T01n0005_002:0170c12	寶臣，遣諸夫人，各歸其家，著身眾珍名寶，	寶 臣 遣 諸 夫 人 各 歸 其 家 著 身 眾 珍 名 寶 
T01n0005_002:0170c13	皆各自隨；諸王群臣，天馬寶象，皆遣令去。』	皆 各 自 隨 諸 王 群 臣 天 馬 寶 象 皆 遣 令 去 
T01n0005_002:0170c14	「大快見王，即昇高觀，遙聞眾聲，喧叫呼天，	 大 快 見 王 即 昇 高 觀 遙 聞 眾 聲 喧 叫 呼 天 
T01n0005_002:0170c15	帝曰：『何聲？』侍者白言：『天玉女聲。』諸王群臣，	帝 曰 何 聲 侍 者 白 言 天 玉 女 聲 諸 王 群 臣 
T01n0005_002:0170c16	頓蹌于地，舉哀呼天，寶象天馬，呼[口*睪]淚	頓 蹌 于 地 舉 哀 呼 天 寶 象 天 馬 呼 [口睪] 淚 
T01n0005_002:0170c17	出，戀慕天王，靡不頓躃。帝曰：『持小机來，	出 戀 慕 天 王 靡 不 頓 躃 帝 曰 持 小 机 來 
T01n0005_002:0170c18	安置殿下。』請玉女寶，諸王群寮，進諸象馬	安 置 殿 下 請 玉 女 寶 諸 王 群 寮 進 諸 象 馬 
T01n0005_002:0170c19	寶車從者。第一嫡后就坐帝側，帝更以女妹	寶 車 從 者 第 一 嫡 后 就 坐 帝 側 帝 更 以 女 妹 
T01n0005_002:0170c20	之愛，侍諸夫人，嫡后舉手，指諸女寶曰：	之 愛 侍 諸 夫 人 嫡 后 舉 手 指 諸 女 寶 曰 
T01n0005_002:0170c21	『天女之容，韑韑光世，着身天服，世所希覩，	 天 女 之 容 韑 韑 光 世 着 身 天 服 世 所 希 覩 
T01n0005_002:0170c22	願留微心，以副其意；寶象天馬，馬名桓青，	願 留 微 心 以 副 其 意 寶 象 天 馬 馬 名 桓 青 
T01n0005_002:0170c23	白珠夜光眾寶瓔珞，奕奕光國；四方諸王，	白 珠 夜 光 眾 寶 瓔 珞 奕 奕 光 國 四 方 諸 王 
T01n0005_002:0170c24	皆有聖人之明，虔奉稱臣，孝順慈忠，愛慕	皆 有 聖 人 之 明 虔 奉 稱 臣 孝 順 慈 忠 愛 慕 
T01n0005_002:0170c25	天王。』快見王曰：『吾世世有慈心，於世女人，	天 王 快 見 王 曰 吾 世 世 有 慈 心 於 世 女 人 
T01n0005_002:0170c26	更相嫉妬，殃惡流被，延及王身，惟斯重禍，	更 相 嫉 妬 殃 惡 流 被 延 及 王 身 惟 斯 重 禍 
T01n0005_002:0170c27	吾欲遠之，自今以往，若曹女等，皆我女妹。』	吾 欲 遠 之 自 今 以 往 若 曹 女 等 皆 我 女 妹 
T01n0005_002:0170c28	諸夫人皆舉哀云：『當奈何生離棄我去。』皆脫	諸 夫 人 皆 舉 哀 云 當 奈 何 生 離 棄 我 去 皆 脫 
T01n0005_002:0170c29	身眾飾，投之于地。嫡后自搣椎心悲哭呼	身 眾 飾 投 之 于 地 嫡 后 自 搣 椎 心 悲 哭 呼 
T01n0005_002:0171a01	云：『天王！吾當依誰？』帝曰：『人命致短，爾憂反	云 天 王 吾 當 依 誰 帝 曰 人 命 致 短 爾 憂 反 
T01n0005_002:0171a02	長，身為朽器，死在無期。自今執心，尚沙門	長 身 為 朽 器 死 在 無 期 自 今 執 心 尚 沙 門 
T01n0005_002:0171a03	德，遠女親賢，唯道是尊，修身自憂，不能憂	德 遠 女 親 賢 唯 道 是 尊 修 身 自 憂 不 能 憂 
T01n0005_002:0171a04	餘。』告諸王曰：『命短憂長，當自愛身，無生	餘 告 諸 王 曰 命 短 憂 長 當 自 愛 身 無 生 
T01n0005_002:0171a05	不死，當正心行，慈愛孝順，榮難久保。』諸王	不 死 當 正 心 行 慈 愛 孝 順 榮 難 久 保 諸 王 
T01n0005_002:0171a06	稽首，至誠辭曰：『四天諸國，皆侍天王，常	稽 首 至 誠 辭 曰 四 天 諸 國 皆 侍 天 王 常 
T01n0005_002:0171a07	聞諸聖，咨嗟斯土，以為無喻，帝及群寮，	聞 諸 聖 咨 嗟 斯 土 以 為 無 喻 帝 及 群 寮 
T01n0005_002:0171a08	無不神聖，國土珍寶，譬如天上，天王加哀，	無 不 神 聖 國 土 珍 寶 譬 如 天 上 天 王 加 哀 
T01n0005_002:0171a09	宜還聖思。』帝告諸王：『人壽致短，憂俗反長，	宜 還 聖 思 帝 告 諸 王 人 壽 致 短 憂 俗 反 長 
T01n0005_002:0171a10	當自憂身，命在呼吸，無生不死，當去貪婬	當 自 憂 身 命 在 呼 吸 無 生 不 死 當 去 貪 婬 
T01n0005_002:0171a11	穢濁之行。』帝起上殿，坐黃金床，持弘慈之	穢 濁 之 行 帝 起 上 殿 坐 黃 金 床 持 弘 慈 之 
T01n0005_002:0171a12	心，向諸夫人，群寮諸王，庶民象馬，十方	心 向 諸 夫 人 群 寮 諸 王 庶 民 象 馬 十 方 
T01n0005_002:0171a13	勤苦者，悲心傷之，欲使知佛，從金床至銀	勤 苦 者 悲 心 傷 之 欲 使 知 佛 從 金 床 至 銀 
T01n0005_002:0171a14	床，思無為之道，從銀床至琉璃床，思慈	床 思 無 為 之 道 從 銀 床 至 琉 璃 床 思 慈 
T01n0005_002:0171a15	哀之行，以濟眾生，從琉璃床至水精床，思大	哀 之 行 以 濟 眾 生 從 琉 璃 床 至 水 精 床 思 大 
T01n0005_002:0171a16	孝行，欲度無數劫之親，自惟五藏九孔惡露。	孝 行 欲 度 無 數 劫 之 親 自 惟 五 藏 九 孔 惡 露 
T01n0005_002:0171a17	帝曰：『吾昔尚得一病，如有竹索絞頸，木鑿	帝 曰 吾 昔 尚 得 一 病 如 有 竹 索 絞 頸 木 鑿 
T01n0005_002:0171a18	鑿身，身為苦器，安足可恃乎？』」佛告阿難：「飛	鑿 身 身 為 苦 器 安 足 可 恃 乎 佛 告 阿 難 飛 
T01n0005_002:0171a19	行皇帝大快見者，吾身是也。王後壽終，昇	行 皇 帝 大 快 見 者 吾 身 是 也 王 後 壽 終 昇 
T01n0005_002:0171a20	生梵天，誰知佛身，作飛行皇帝，修行正法。	生 梵 天 誰 知 佛 身 作 飛 行 皇 帝 修 行 正 法 
T01n0005_002:0171a21	又有四德，七寶自然，從鳩夷那竭境界，長	又 有 四 德 七 寶 自 然 從 鳩 夷 那 竭 境 界 長 
T01n0005_002:0171a22	四百八十里，廣二百八十里，皆在城中，吾前	四 百 八 十 里 廣 二 百 八 十 里 皆 在 城 中 吾 前 
T01n0005_002:0171a23	以七持身置此地中，今得斷求，念空無相	以 七 持 身 置 此 地 中 今 得 斷 求 念 空 無 相 
T01n0005_002:0171a24	之定，絕生死之原，自今之後，不復作身	之 定 絕 生 死 之 原 自 今 之 後 不 復 作 身 
T01n0005_002:0171a25	也。	也 
T01n0005_002:0171a26	「阿難！汝往入城，告諸民云：『今日夜半，佛當	 阿 難 汝 往 入 城 告 諸 民 云 今 日 夜 半 佛 當 
T01n0005_002:0171a27	般泥洹，若等所疑，急詣決之，慎無後悔，長	般 泥 洹 若 等 所 疑 急 詣 決 之 慎 無 後 悔 長 
T01n0005_002:0171a28	懷瞢瞢恨。』」佛在小聚，違於稟戒，阿難如教，	懷 瞢 瞢 恨 佛 在 小 聚 違 於 稟 戒 阿 難 如 教 
T01n0005_002:0171a29	民僉然曰：「佛以何緣，處于小聚，滅度去乎？」	民 僉 然 曰 佛 以 何 緣 處 于 小 聚 滅 度 去 乎 
T01n0005_002:0171b01	民皆頓地，叩頭者搏頰者、搥心刮面搣髮，	民 皆 頓 地 叩 頭 者 搏 頰 者 搥 心 刮 面 搣 髮 
T01n0005_002:0171b02	裂衣蹹地啼哭，呼當奈何！其王聞之，愕然曰：	裂 衣 蹹 地 啼 哭 呼 當 奈 何 其 王 聞 之 愕 然 曰 
T01n0005_002:0171b03	「斯者何哀？」王遣近臣問外何哀？民哽咽曰：	 斯 者 何 哀 王 遣 近 臣 問 外 何 哀 民 哽 咽 曰 
T01n0005_002:0171b04	「阿難勅言：『佛當滅度，心所疑結，令詣質之。』	 阿 難 勅 言 佛 當 滅 度 心 所 疑 結 令 詣 質 之 
T01n0005_002:0171b05	以斯哀矣。」臣還啟云：「阿難勅民，佛當般泥	以 斯 哀 矣 臣 還 啟 云 阿 難 勅 民 佛 當 般 泥 
T01n0005_002:0171b06	洹，令質所疑，以故哭耳。」王即召太子阿晨，	洹 令 質 所 疑 以 故 哭 耳 王 即 召 太 子 阿 晨 
T01n0005_002:0171b07	命之曰：「爾詣佛所，稽首佛足，敬問消息，伏	命 之 曰 爾 詣 佛 所 稽 首 佛 足 敬 問 消 息 伏 
T01n0005_002:0171b08	願世尊於正殿上，昇泥洹道，無於小聚般	願 世 尊 於 正 殿 上 昇 泥 洹 道 無 於 小 聚 般 
T01n0005_002:0171b09	泥洹也。」太子白言：「若世尊遂不爾翔者，當云	泥 洹 也 太 子 白 言 若 世 尊 遂 不 爾 翔 者 當 云 
T01n0005_002:0171b10	何？」王曰：「受教疾還。」太子到佛所，阿難白言：	何 王 曰 受 教 疾 還 太 子 到 佛 所 阿 難 白 言 
T01n0005_002:0171b11	「鳩夷國王遣太子來，未敢通之。」佛言：「呼進。」	 鳩 夷 國 王 遣 太 子 來 未 敢 通 之 佛 言 呼 進 
T01n0005_002:0171b12	太子五體投地，稽首佛足，却長跪諾：「王遣	太 子 五體投地 稽 首 佛 足 却 長 跪 諾 王 遣 
T01n0005_002:0171b13	阿晨，稽首佛足，敬問消息，眾生沒淵，唯佛	阿 晨 稽 首 佛 足 敬 問 消 息 眾 生 沒 淵 唯 佛 
T01n0005_002:0171b14	拯濟，今當滅度，何其大疾，當於宮中，而	拯 濟 今 當 滅 度 何 其 大 疾 當 於 宮 中 而 
T01n0005_002:0171b15	於小聚。」佛告阿晨：「謝爾父王，吾往以說，	於 小 聚 佛 告 阿 晨 謝 爾 父 王 吾 往 以 說 
T01n0005_002:0171b16	昔為飛行皇帝，最後聖帝，名大快見。吾以	昔 為 飛 行 皇 帝 最 後 聖 帝 名 大 快 見 吾 以 
T01n0005_002:0171b17	七反以身喪此，并今為八。吾今道成，不復以	七 反 以 身 喪 此 并 今 為 八 吾 今 道 成 不 復 以 
T01n0005_002:0171b18	身著斯地中。謝爾父王，抂苦太子。」太子還	身 著 斯 地 中 謝 爾 父 王 抂 苦 太 子 太 子 還 
T01n0005_002:0171b19	宮，晻冥適至，太子見王，本末自陳。王愕然	宮 晻 冥 適 至 太 子 見 王 本 末 自 陳 王 愕 然 
T01n0005_002:0171b20	流涕，勅國黎民，率土皆往，受佛明法。王以	流 涕 勅 國 黎 民 率 土 皆 往 受 佛 明 法 王 以 
T01n0005_002:0171b21	人定時到佛所，與民十四萬眾俱住在外。王	人 定 時 到 佛 所 與 民 十 四 萬 眾 俱 住 在 外 王 
T01n0005_002:0171b22	白阿難曰：「吾與民十四萬人，欲受佛戒。」阿	白 阿 難 曰 吾 與 民 十 四 萬 人 欲 受 佛 戒 阿 
T01n0005_002:0171b23	難向佛，具陳王意，世尊即曰：「苦王及民。」	難 向 佛 具 陳 王 意 世 尊 即 曰 苦 王 及 民 
T01n0005_002:0171b24	阿難白言：「寧可遣王？」佛言：「不可。當與相見。」	阿 難 白 言 寧 可 遣 王 佛 言 不 可 當 與 相 見 
T01n0005_002:0171b25	王與國中高德賢者俱進，皆以頭面稽首佛	王 與 國 中 高 德 賢 者 俱 進 皆 以 頭 面 稽 首 佛 
T01n0005_002:0171b26	足，却叉手立。時，佛前無燈火，佛放頂中光，	足 却 叉 手 立 時 佛 前 無 燈 火 佛 放 頂 中 光 
T01n0005_002:0171b27	光照二千里。佛謝王及其臣民勞抂爾來。王	光 照 二 千 里 佛 謝 王 及 其 臣 民 勞 抂 爾 來 王 
T01n0005_002:0171b28	稽首曰：「佛有何誡，所當奉行？」	稽 首 曰 佛 有 何 誡 所 當 奉 行 
T01n0005_002:0171b29	佛言：「吾告使者云，得佛說經，四十九歲，王	佛 言 吾 告 使 者 云 得 佛 說 經 四 十 九 歲 王 
T01n0005_002:0171c01	國諸賢，皆自執行。王且還宮，吾今夜半當	國 諸 賢 皆 自 執 行 王 且 還 宮 吾 今 夜 半 當 
T01n0005_002:0171c02	般泥洹。」王及臣民莫不舉哀，佛告王曰：「吾	般 泥 洹 王 及 臣 民 莫 不 舉 哀 佛 告 王 曰 吾 
T01n0005_002:0171c03	聞有生無不衰喪，啼哭何為？怒伏猛心，上	聞 有 生 無 不 衰 喪 啼 哭 何 為 怒 伏 猛 心 上 
T01n0005_002:0171c04	法天閨，遠惡自愛，勤心修德親賢，事來重	法 天 閨 遠 惡 自 愛 勤 心 修 德 親 賢 事 來 重 
T01n0005_002:0171c05	思，無加卒暴，人命難得，當哀萬姓；明者可	思 無 加 卒 暴 人 命 難 得 當 哀 萬 姓 明 者 可 
T01n0005_002:0171c06	責，愚者原赦，世多諸邪，自愛自慶。」王	責 愚 者 原 赦 世 多 諸 邪 自 愛 自 慶 王 
T01n0005_002:0171c07	及賢者，皆自退出，王去佛五里，所止屯住。	及 賢 者 皆 自 退 出 王 去 佛 五 里 所 止 屯 住 
T01n0005_002:0171c08	國有耆年，字曰須拔，年百二十，時在城中。	國 有 耆 年 字 曰 須 拔 年 百 二 十 時 在 城 中 
T01n0005_002:0171c09	夜臥覺寤，見佛光明，照一城中，家無一人	夜 臥 覺 寤 見 佛 光 明 照 一 城 中 家 無 一 人 
T01n0005_002:0171c10	即出城，疾到佛所，向阿難曰：「以吾啟聞，吾	即 出 城 疾 到 佛 所 向 阿 難 曰 以 吾 啟 聞 吾 
T01n0005_002:0171c11	有疑心於世尊。」阿難曰：「夜以且半，佛當善	有 疑 心 於 世 尊 阿 難 曰 夜 以 且 半 佛 當 善 
T01n0005_002:0171c12	逝，且莫煩擾。」須拔對曰：「不可以聞乎，吾	逝 且 莫 煩 擾 須 拔 對 曰 不 可 以 聞 乎 吾 
T01n0005_002:0171c13	聞無數世乃有一佛耳，今詣質疑，而不以聞。	聞 無 數 世 乃 有 一 佛 耳 今 詣 質 疑 而 不 以 聞 
T01n0005_002:0171c14	吾之所疑，唯佛而釋，餘莫能也。」阿難曰：「且	吾 之 所 疑 唯 佛 而 釋 餘 莫 能 也 阿 難 曰 且 
T01n0005_002:0171c15	止！不須問矣。」佛知須拔在外欲質所疑，呼	止 不 須 問 矣 佛 知 須 拔 在 外 欲 質 所 疑 呼 
T01n0005_002:0171c16	阿難問：「何以不啟須拔疑事？」阿難對曰：「見	阿 難 問 何 以 不 啟 須 拔 疑 事 阿 難 對 曰 見 
T01n0005_002:0171c17	夜且半，佛當滅度，懼其來入語言煩擾，佛	夜 且 半 佛 當 滅 度 懼 其 來 入 語 言 煩 擾 佛 
T01n0005_002:0171c18	今當棄三有欲界就無為道。」佛言：「將須拔入，	今 當 棄 三 有 欲 界 就 無 為 道 佛 言 將 須 拔 入 
T01n0005_002:0171c19	有疑當問。」阿難即將須拔入。須拔聞當入，	有 疑 當 問 阿 難 即 將 須 拔 入 須 拔 聞 當 入 
T01n0005_002:0171c20	其心喜踊，身皆為動，前以頭面稽首佛足。佛	其 心 喜 踊 身 皆 為 動 前 以 頭 面 稽 首 佛 足 佛 
T01n0005_002:0171c21	見須拔年老息微，賜机使坐。佛問須拔：「爾	見 須 拔 年 老 息 微 賜 机 使 坐 佛 問 須 拔 爾 
T01n0005_002:0171c22	有何疑？」對曰：「佛為三界天中之天，神聖無	有 何 疑 對 曰 佛 為 三 界 天 中 之 天 神 聖 無 
T01n0005_002:0171c23	量，至尊難雙，開化導引四十九年，仙聖梵	量 至 尊 難 雙 開 化 導 引 四 十 九 年 仙 聖 梵 
T01n0005_002:0171c24	釋靡不稽首，吾有同志八人，有故龜氏、有	釋 靡 不 稽 首 吾 有 同 志 八 人 有 故 龜 氏 有 
T01n0005_002:0171c25	無先氏、有志行氏、有白鷺子氏、有延壽氏、	無 先 氏 有 志 行 氏 有 白 鷺 子 氏 有 延 壽 氏 
T01n0005_002:0171c26	有計金樊氏、有多積願氏、有尼揵子，彼八	有 計 金 樊 氏 有 多 積 願 氏 有 尼 揵 子 彼 八 
T01n0005_002:0171c27	人智，無螢燭之明，善無沛生絲髮之潤，內	人 智 無 螢 燭 之 明 善 無 沛 生 絲 髮 之 潤 內 
T01n0005_002:0171c28	懷三毒，外為欲走，坐作虛論，妄書非真，不詣	懷 三 毒 外 為 欲 走 坐 作 虛 論 妄 書 非 真 不 詣 
T01n0005_002:0171c29	稟化將有緣乎？」佛告須拔：「子曹經意，與佛	稟 化 將 有 緣 乎 佛 告 須 拔 子 曹 經 意 與 佛 
T01n0005_002:0172a01	經違，為生死之路，求富貴之耶？吾道之志	經 違 為 生 死 之 路 求 富 貴 之 耶 吾 道 之 志 
T01n0005_002:0172a02	斷求念空，不願世榮淡泊無為，以斯為樂。」	斷 求 念 空 不 願 世 榮 淡 泊 無 為 以 斯 為 樂 
T01n0005_002:0172a03	須拔曰：「何謂無為之道乎？」佛言：「滅有歸本，	須 拔 曰 何 謂 無 為 之 道 乎 佛 言 滅 有 歸 本 
T01n0005_002:0172a04	不復生死，謂之無為也。若曹志趣，皆有八	不 復 生 死 謂 之 無 為 也 若 曹 志 趣 皆 有 八 
T01n0005_002:0172a05	惡。何謂為八？祠祀鬼神，卜問虛殺，是為一。	惡 何 謂 為 八 祠 祀 鬼 神 卜 問 虛 殺 是 為 一 
T01n0005_002:0172a06	處家貪餮，不奉孝道，貪愛萬邪，欲無舍止，	處 家 貪 餮 不 奉 孝 道 貪 愛 萬 邪 欲 無 舍 止 
T01n0005_002:0172a07	是為二。兩舌、惡罵、妄言、綺語，未常陳善令	是 為 二 兩 舌 惡 罵 妄 言 綺 語 未 常 陳 善 令 
T01n0005_002:0172a08	愚去惡，是為三。殺盜婬泆，是為四。常懷怒	愚 去 惡 是 為 三 殺 盜 婬 泆 是 為 四 常 懷 怒 
T01n0005_002:0172a09	心，不孝二親，輕慢兄弟、妻子九族，心邪行	心 不 孝 二 親 輕 慢 兄 弟 妻 子 九 族 心 邪 行 
T01n0005_002:0172a10	穢，無善勸導，常自憍大，欲人畏敬，是為五。	穢 無 善 勸 導 常 自 憍 大 欲 人 畏 敬 是 為 五 
T01n0005_002:0172a11	晝夜懷邪，不畏法律，輕慢賢者，尊貴穢濁，	晝 夜 懷 邪 不 畏 法 律 輕 慢 賢 者 尊 貴 穢 濁 
T01n0005_002:0172a12	遠避真正，交隨惡人，是為六。聞有賢智，明	遠 避 真 正 交 隨 惡 人 是 為 六 聞 有 賢 智 明 
T01n0005_002:0172a13	經沙門梵志，豫懷憎嫉，虛偽作謗，是為七。	經 沙 門 梵 志 豫 懷 憎 嫉 虛 偽 作 謗 是 為 七 
T01n0005_002:0172a14	不敬先祖盡孝于親，弃賢明而反賊，毀仁	不 敬 先 祖 盡 孝 于 親 弃 賢 明 而 反 賊 毀 仁 
T01n0005_002:0172a15	正，不覺流俗穢濁可耻。斯謂八惡。若自陳云：	正 不 覺 流 俗 穢 濁 可 耻 斯 謂 八 惡 若 自 陳 云 
T01n0005_002:0172a16	『世尊說經，四十九載，有八人不詣稟化。』子曹	 世 尊 說 經 四 十 九 載 有 八 人 不 詣 稟 化 子 曹 
T01n0005_002:0172a17	皆懷斯八惡，豈樂清化乎？正使來者，佛亦	皆 懷 斯 八 惡 豈 樂 清 化 乎 正 使 來 者 佛 亦 
T01n0005_002:0172a18	不受。須拔！若心有斯八惡，慎無問佛：『執斯	不 受 須 拔 若 心 有 斯 八 惡 慎 無 問 佛 執 斯 
T01n0005_002:0172a19	八戒可得溝港、頻來、不還、應真？』行斯八戒，當	八 戒 可 得 溝 港 頻 來 不 還 應 真 行 斯 八 戒 當 
T01n0005_002:0172a20	正爾心，乃為佛弟子。其有凡人，擅作師導	正 爾 心 乃 為 佛 弟 子 其 有 凡 人 擅 作 師 導 
T01n0005_002:0172a21	教化之首，違斯八戒，皆是妖蠱，當遠棄避，慎	教 化 之 首 違 斯 八 戒 皆 是 妖 蠱 當 遠 棄 避 慎 
T01n0005_002:0172a22	無聽受。」世尊曰：「吾今於三界中，獨言獨步，	無 聽 受 世 尊 曰 吾 今 於 三 界 中 獨 言 獨 步 
T01n0005_002:0172a23	莫有等雙；爾之所疑，便問無嫌。」須拔稽首，	莫 有 等 雙 爾 之 所 疑 便 問 無 嫌 須 拔 稽 首 
T01n0005_002:0172a24	長跪而曰：「誠如佛言，幾亡吾身，又墮狂愚。」	長 跪 而 曰 誠 如 佛 言 幾 亡 吾 身 又 墮 狂 愚 
T01n0005_002:0172a25	世尊又曰：「若解八戒未乎？」對曰：「已解。」重稽	世 尊 又 曰 若 解 八 戒 未 乎 對 曰 已 解 重 稽 
T01n0005_002:0172a26	首曰：「吾欲捐下賤之操，執沙門清淨之行。」	首 曰 吾 欲 捐 下 賤 之 操 執 沙 門 清 淨 之 行 
T01n0005_002:0172a27	世尊又曰：「爾誠不？」對曰：「願佛加哀，受我為	世 尊 又 曰 爾 誠 不 對 曰 願 佛 加 哀 受 我 為 
T01n0005_002:0172a28	沙門。」須拔髮自然墮地，袈裟著體，精心思	沙 門 須 拔 髮 自 然 墮 地 袈 裟 著 體 精 心 思 
T01n0005_002:0172a29	教，霍然無想，一心清淨，喻明月珠，即得應	教 霍 然 無 想 一 心 清 淨 喻 明 月 珠 即 得 應 
T01n0005_002:0172b01	真道，重自思念：「吾不能使吾師於前泥洹也。」	真 道 重 自 思 念 吾 不 能 使 吾 師 於 前 泥 洹 也 
T01n0005_002:0172b02	即時先佛，取泥洹道。	即 時 先 佛 取 泥 洹 道 
T01n0005_002:0172b03	佛呼比丘入言：「吾滅度後，其有世人，棄家	佛 呼 比 丘 入 言 吾 滅 度 後 其 有 世 人 棄 家 
T01n0005_002:0172b04	去穢，欲作沙門，入比丘僧中，先試三月，知	去 穢 欲 作 沙 門 入 比 丘 僧 中 先 試 三 月 知 
T01n0005_002:0172b05	行高下。世有四輩人：一輩貧窮不能自活，欲	行 高 下 世 有 四 輩 人 一 輩 貧 窮 不 能 自 活 欲 
T01n0005_002:0172b06	為比丘；一輩負債無以償之，欲作比丘；一輩	為 比 丘 一 輩 負 債 無 以 償 之 欲 作 比 丘 一 輩 
T01n0005_002:0172b07	在役當時無用，欲作比丘；一輩高士行淨無	在 役 當 時 無 用 欲 作 比 丘 一 輩 高 士 行 淨 無 
T01n0005_002:0172b08	穢，聞無數世乃有一佛，覩佛經典欣然心寤，	穢 聞 無 數 世 乃 有 一 佛 覩 佛 經 典 欣 然 心 寤 
T01n0005_002:0172b09	捐家棄欲，不貪世榮，來作比丘。吾泥洹後，	捐 家 棄 欲 不 貪 世 榮 來 作 比 丘 吾 泥 洹 後 
T01n0005_002:0172b10	凡諸來者，觀于志趣，視于坐起，採于語言，	凡 諸 來 者 觀 于 志 趣 視 于 坐 起 採 于 語 言 
T01n0005_002:0172b11	察于躇步，知于施行，善惡所趣，求道用心，	察 于 躇 步 知 于 施 行 善 惡 所 趣 求 道 用 心 
T01n0005_002:0172b12	精進樂不？三月審察，志高行淨，可眾乃用	精 進 樂 不 三 月 審 察 志 高 行 淨 可 眾 乃 用 
T01n0005_002:0172b13	作比丘。身既作比丘，當選耆舊明於法律，	作 比 丘 身 既 作 比 丘 當 選 耆 舊 明 於 法 律 
T01n0005_002:0172b14	為之作師，授其十戒。奉戒三年，兢兢不虧，	為 之 作 師 授 其 十 戒 奉 戒 三 年 兢 兢 不 虧 
