T03n0154_004:0098c07	華供佛，報其恩德，稽首佛足。佛為說經，	華 供 佛 報 其 恩 德 稽 首 佛 足 佛 為 說 經 
T03n0154_004:0098c08	即發無上正真道意，輙得立在不退轉地	即 發 無 上 正 真 道 意 輙 得 立 在 不退轉地 
T03n0154_004:0098c09	從無生忍，乃還天上。	從 無 生 忍 乃 還 天 上 
T03n0154_004:0098c10	佛說光華梵志經第四十	佛 說 光 華 梵 志 經 第 四 十 
T03n0154_004:0098c11	聞如是：一時佛遊舍衛祇樹給孤獨園，與	聞 如 是 一 時 佛 遊 舍 衛 祇 樹 給 孤 獨 園 與 
T03n0154_004:0098c12	大比丘眾俱，千二百五十菩薩，無央數人。	大 比 丘 眾 俱 千二百五十 菩 薩 無 央 數 人 
T03n0154_004:0098c13	于時眾人無央數千，皆來集會在於佛所，	于 時 眾 人 無 央 數 千 皆 來 集 會 在 於 佛 所 
T03n0154_004:0098c14	悉下鬚髮行作沙門，各自與五百群從，修	悉 下 鬚 髮 行 作 沙 門 各 自 與 五 百 群 從 修 
T03n0154_004:0098c15	治道德，精進不懈，成得神通，生死根斷，普	治 道 德 精 進 不 懈 成 得 神 通 生 死 根 斷 普 
T03n0154_004:0098c16	獲道證，周旋十方，濟度眾生。阿難白佛：「此	獲 道 證 周 旋 十 方 濟 度 眾 生 阿 難 白 佛 此 
T03n0154_004:0098c17	等眾學，宿有何行、本修何德，乃致此譽，神	等 眾 學 宿 有 何 行 本 修 何 德 乃 致 此 譽 神 
T03n0154_004:0098c18	通之慧，然為第一？」佛告阿難：「乃往過去久	通 之 慧 然 為 第 一 佛 告 阿 難 乃往過去 久 
T03n0154_004:0098c19	遠世時，經歷劫數九十有一，維衛佛時。有	遠 世 時 經 歷 劫 數 九 十 有 一 維 衛 佛 時 有 
T03n0154_004:0098c20	一國王，名曰旃頭，城號旃頭摩提。爾時有	一 國 王 名 曰 旃 頭 城 號 旃 頭 摩 提 爾 時 有 
T03n0154_004:0098c21	一梵志，名光華，博學眾經，廣宣法典，無義	一 梵 志 名 光 華 博 學 眾 經 廣 宣 法 典 無 義 
T03n0154_004:0098c22	不達；有五百眾，侍從啟受。數數往詣維衛	不 達 有 五 百 眾 侍 從 啟 受 數 數 往 詣 維 衛 
T03n0154_004:0098c23	如來，聽受經典，誘化群黎，開發愚冥，勸示	如 來 聽 受 經 典 誘 化 群 黎 開 發 愚 冥 勸 示 
T03n0154_004:0098c24	正真，行作沙門修德為業。時彼國中五百	正 真 行 作 沙 門 修 德 為 業 時 彼 國 中 五 百 
T03n0154_004:0098c25	營從，將五百人大臣群僚，亦作沙門。有大	營 從 將 五 百 人 大 臣 群 僚 亦 作 沙 門 有 大 
T03n0154_004:0098c26	長者，化諸群眾，皆復捨家，行作沙門，奉行	長 者 化 諸 群 眾 皆 復 捨 家 行 作 沙 門 奉 行 
T03n0154_004:0098c27	精進，不犯禁戒。命終之後，得生天上。天	精 進 不 犯 禁 戒 命終之後 得 生 天 上 天 
T03n0154_004:0098c28	上壽盡，來生人間。如是上下，終而復始，九	上 壽 盡 來 生 人 間 如 是 上 下 終 而 復 始 九 
T03n0154_004:0098c29	十一劫，於此佛世，皆作沙門，悉會佛所，	十 一 劫 於 此 佛 世 皆 作 沙 門 悉 會 佛 所 
T03n0154_004:0099a01	為佛作禮，退坐一面。」諸天、龍神、乾沓和、阿	為 佛 作 禮 退 坐 一 面 諸 天 龍 神 乾 沓 和 阿 
T03n0154_004:0099a02	須倫、迦留羅、真陀羅、摩休勒，人與非人靡	須 倫 迦 留 羅 真 陀 羅 摩 休 勒 人 與 非 人 靡 
T03n0154_004:0099a03	不來到，會於佛所，稽首足下，遷住一面。	不 來 到 會 於 佛 所 稽 首 足 下 遷 住 一 面 
T03n0154_004:0099a04	佛時便笑。阿難問佛：「何因緣笑？至真世尊，	佛 時 便 笑 阿 難 問 佛 何 因 緣 笑 至 真 世 尊 
T03n0154_004:0099a05	終不虛欣，唯說其意。」佛告阿難：「見此眾	終 不 虛 欣 唯 說 其 意 佛 告 阿 難 見 此 眾 
T03n0154_004:0099a06	人天龍鬼神來會者不？」答曰：「已見。」佛告阿	人 天 龍 鬼 神 來 會 者 不 答 曰 已 見 佛 告 阿 
T03n0154_004:0099a07	難：「維衛佛時，有一大國，名旃頭摩提，王名	難 維 衛 佛 時 有 一 大 國 名 旃 頭 摩 提 王 名 
T03n0154_004:0099a08	旃頭，皆奉大法，歸命三寶。時有梵志，名	旃 頭 皆 奉 大 法 歸 命 三 寶 時 有 梵 志 名 
T03n0154_004:0099a09	光華，總攝三達，博綜眾經，無義不達，見	光 華 總 攝 三 達 博 綜 眾 經 無 義 不 達 見 
T03n0154_004:0099a10	維衛佛化於十方，天上天下，靡不啟親，誘	維 衛 佛 化 於 十 方 天 上 天 下 靡 不 啟 親 誘 
T03n0154_004:0099a11	五百眾，往詣佛所而作沙門，咸受經戒。時	五 百 眾 往 詣 佛 所 而 作 沙 門 咸 受 經 戒 時 
T03n0154_004:0099a12	其國王，棄國捐王，與五百眾，亦作沙門。	其 國 王 棄 國 捐 王 與 五 百 眾 亦 作 沙 門 
T03n0154_004:0099a13	有大長者，亦化群從五百之眾，行作沙門，	有 大 長 者 亦 化 群 從 五 百 之 眾 行 作 沙 門 
T03n0154_004:0099a14	普受道化，進獲神通，奉四等心——慈、悲、喜、護——	普 受 道 化 進 獲 神 通 奉 四 等 心 慈 悲 喜 護 
T03n0154_004:0099a15	九十一劫不歸惡趣，生天上人間，今得人	九 十 一 劫 不 歸 惡 趣 生 天 上 人 間 今 得 人 
T03n0154_004:0099a16	身，悉來會此，亦普出家，行作沙門，啟受經	身 悉 來 會 此 亦 普 出 家 行 作 沙 門 啟 受 經 
T03n0154_004:0099a17	戒，皆得道證。欲知爾時所行梵志豈異人	戒 皆 得 道 證 欲 知 爾 時 所 行 梵 志 豈 異 人 
T03n0154_004:0099a18	乎？勿作斯觀，則吾身是。國王人民，及大長	乎 勿 作 斯 觀 則 吾 身 是 國 王 人 民 及 大 長 
T03n0154_004:0099a19	者之眾，皆是維衛如來至真同時學者，彼	者 之 眾 皆 是 維 衛 如 來 至 真 同 時 學 者 彼 
T03n0154_004:0099a20	種此獲，功不唐捐，皆自得之。」佛說是時，無	種 此 獲 功 不 唐 捐 皆 自 得 之 佛 說 是 時 無 
T03n0154_004:0099a21	央數人，皆發無上正真道意，應時立不退	央 數 人 皆 發 無 上 正 真 道 意 應 時 立 不 退 
T03n0154_004:0099a22	轉地，一生補處亦不可計，得成羅漢亦復	轉 地 一生補處 亦 不 可 計 得 成 羅 漢 亦 復 
T03n0154_004:0099a23	如是。佛說是時，莫不歡喜。	如 是 佛 說 是 時 莫 不 歡 喜 
T03n0154_004:0099a24	佛說變悔喻經第四十一	佛 說 變 悔 喻 經 第 四 十 一 
T03n0154_004:0099a25	聞如是：一時佛遊舍衛祇樹給孤獨園，與	聞 如 是 一 時 佛 遊 舍 衛 祇 樹 給 孤 獨 園 與 
T03n0154_004:0099a26	大比丘眾俱。爾時有一居士——厭世苦患，萬	大 比 丘 眾 俱 爾 時 有 一 居 士 厭 世 苦 患 萬 
T03n0154_004:0099a27	物非常，身之所有財物如幻，寄居天地，猶	物 非 常 身 之 所 有 財 物 如 幻 寄 居 天 地 猶 
T03n0154_004:0099a28	如過客無一可貪；唯道真正，永可常存——	如 過 客 無 一 可 貪 唯 道 真 正 永 可 常 存 
T03n0154_004:0099a29	因便出家，行作沙門，精進不懈，志本不達，	因 便 出 家 行 作 沙 門 精 進 不 懈 志 本 不 達 
T03n0154_004:0099b01	則便入山。山中修行，夙夜不廢，不惜身命，	則 便 入 山 山 中 修 行 夙 夜 不 廢 不惜身命 
T03n0154_004:0099b02	布施持戒，忍辱精進，一心智慧，守志不動，	布 施 持 戒 忍 辱 精 進 一 心 智 慧 守 志 不 動 
T03n0154_004:0099b03	不得道證，心欲變悔，還作白衣：「學道積	不 得 道 證 心 欲 變 悔 還 作 白 衣 學 道 積 
T03n0154_004:0099b04	年，勤務不休，然心冥冥，不知所趣。本在	年 勤 務 不 休 然 心 冥 冥 不 知 所 趣 本 在 
T03n0154_004:0099b05	人間，數蒙說議，口舌流盈，今在山中，復	人 間 數 蒙 說 議 口 舌 流 盈 今 在 山 中 復 
T03n0154_004:0099b06	無所獲，進退無宜，不知所湊，不如脫衣	無 所 獲 進 退 無 宜 不 知 所 湊 不 如 脫 衣 
T03n0154_004:0099b07	還就吾業。」猶豫未定。時山神樹神覩之，	還 就 吾 業 猶 豫 未 定 時 山 神 樹 神 覩 之 
T03n0154_004:0099b08	惜其功夫，方欲成就，反欲還家，志在瑕	惜 其 功 夫 方 欲 成 就 反 欲 還 家 志 在 瑕 
T03n0154_004:0099b09	穢，代之恨恨，不可為喻。因則化作比丘尼	穢 代 之 恨 恨 不 可 為 喻 因 則 化 作 比 丘 尼 
T03n0154_004:0099b10	身，冀化亂意欲發道心，堅固其志。其比丘	身 冀 化 亂 意 欲 發 道 心 堅 固 其 志 其 比 丘 
T03n0154_004:0099b11	尼，身著珠寶，面色光榮，非世所有，復現女	尼 身 著 珠 寶 面 色 光 榮 非 世 所 有 復 現 女 
T03n0154_004:0099b12	人，顏貌端正，色像第一，姿曜煒煒，眾類無	人 顏 貌 端 正 色 像 第 一 姿 曜 煒 煒 眾 類 無 
T03n0154_004:0099b13	逮。俱相謂言：「卿比丘尼，何故身著寶瓔珞？	逮 俱 相 謂 言 卿 比 丘 尼 何 故 身 著 寶 瓔 珞 
T03n0154_004:0099b14	脣口妙好，猶如赤真珠。」比丘尼曰：「寶如幻	脣 口 妙 好 猶 如 赤 真 珠 比 丘 尼 曰 寶 如 幻 
T03n0154_004:0099b15	化，脣如彩畫，端正喻膏，有何可貪？如卿	化 脣 如 彩 畫 端 正 喻 膏 有 何 可 貪 如 卿 
T03n0154_004:0099b16	今身，色雖端正猶如春華，身若果落不久	今 身 色 雖 端 正 猶 如 春 華 身 若 果 落 不 久 
T03n0154_004:0099b17	著樹，四大合散，無有正主。唯心為本，在	著 樹 四 大 合 散 無 有 正 主 唯 心 為 本 在 
T03n0154_004:0099b18	三界中，獨來獨去無一隨者，禍福追身如	三 界 中 獨 來 獨 去 無 一 隨 者 禍 福 追 身 如 
T03n0154_004:0099b19	影隨形。三處皆空，無一可賴，為罪所覆，	影 隨 形 三 處 皆 空 無 一 可 賴 為 罪 所 覆 
T03n0154_004:0099b20	五陰六蓋，心閉意塞，不解三昧。」比丘聞之	五 陰 六 蓋 心 閉 意 塞 不 解 三 昧 比 丘 聞 之 
T03n0154_004:0099b21	心即覺了，知審如言識別四大本因緣合，	心 即 覺 了 知 審 如 言 識 別 四 大 本 因 緣 合 
T03n0154_004:0099b22	貪身自害，剖判本空，猶如寄居，觀十方人，	貪 身 自 害 剖 判 本 空 猶 如 寄 居 觀 十 方 人 
T03n0154_004:0099b23	無有親疎，則心了意解，諸漏得盡，生死已	無 有 親 疎 則 心 了 意 解 諸 漏 得 盡 生 死 已 
T03n0154_004:0099b24	斷，悉無起分，出入自由，不著垢塵，爾乃達	斷 悉 無 起 分 出 入 自 由 不 著 垢 塵 爾 乃 達 
T03n0154_004:0099b25	知，山樹有故，化如除浮雲。樹神跪拜，自	知 山 樹 有 故 化 如 除 浮 雲 樹 神 跪 拜 自 
T03n0154_004:0099b26	陳：「辛苦周旋三界，五陰所覆，十二牽連，忽	陳 辛 苦 周 旋 三 界 五 陰 所 覆 十 二 牽 連 忽 
T03n0154_004:0099b27	始相因，唯見愍哀救濟此覆。」即為說經，	始 相 因 唯 見 愍 哀 救 濟 此 覆 即 為 說 經 
T03n0154_004:0099b28	使心開解，奉受五戒，修行十善，塞惡三塗，	使 心 開 解 奉 受 五 戒 修 行 十 善 塞 惡 三 塗 
T03n0154_004:0099b29	道心稍前，遂至無極，入佛正真。於時世尊，	道 心 稍 前 遂 至 無 極 入 佛 正 真 於 時 世 尊 
T03n0154_004:0099c01	告諸比丘：「解其本末，執心當堅，無得後	告 諸 比 丘 解 其 本 末 執 心 當 堅 無 得 後 
T03n0154_004:0099c02	悔。」佛說如是，莫不歡喜。	悔 佛 說 如 是 莫 不 歡 喜 
T03n0154_004:0099c03	佛說馬喻經第四十二	佛 說 馬 喻 經 第 四 十 二 
T03n0154_004:0099c04	昔有長者，畜一好馬，初得之時，志操犇突，	昔 有 長 者 畜 一 好 馬 初 得 之 時 志 操 犇 突 
T03n0154_004:0099c05	不可御調。適欲被騎，舉前兩脚，跳上遊	不 可 御 調 適 欲 被 騎 舉 前 兩 脚 跳 上 遊 
T03n0154_004:0099c06	逸，四出橫走，不從徑路，入於溝渠，突樹牆	逸 四 出 橫 走 不 從 徑 路 入 於 溝 渠 突 樹 牆 
T03n0154_004:0099c07	壁。其主長者，甚懷瞋恨，還歸在家，鞭撾酷	壁 其 主 長 者 甚 懷 瞋 恨 還 歸 在 家 鞭 撾 酷 
T03n0154_004:0099c08	毒，不與水草，獨令窮困。飢餓心惱，而自剋	毒 不 與 水 草 獨 令 窮 困 飢 餓 心 惱 而 自 剋 
T03n0154_004:0099c09	責，心中無計，不知何施？空中聲出，則告之	責 心 中 無 計 不 知 何 施 空 中 聲 出 則 告 之 
T03n0154_004:0099c10	曰：「順從其主，時無患難。」時馬心解，明日長	曰 順 從 其 主 時 無 患 難 時 馬 心 解 明 日 長 
T03n0154_004:0099c11	者，故乘騎試，以著鞍勒，馬即受之，不復	者 故 乘 騎 試 以 著 鞍 勒 馬 即 受 之 不 復 
T03n0154_004:0099c12	跳踉。騎上鞍住，亦不為態，牽東西南北，行	跳 踉 騎 上 鞍 住 亦 不 為 態 牽 東 西 南 北 行 
T03n0154_004:0099c13	從而不違，與穀飲之，隨時消息令飽滿肥	從 而 不 違 與 穀 飲 之 隨 時 消 息 令 飽 滿 肥 
T03n0154_004:0099c14	盛氣力。後騎將行，轉遂調柔，日日成就。後	盛 氣 力 後 騎 將 行 轉 遂 調 柔 日 日 成 就 後 
T03n0154_004:0099c15	生二子，至數歲，長者乘之。後不順從，跳	生 二 子 至 數 歲 長 者 乘 之 後 不 順 從 跳 
T03n0154_004:0099c16	踉橫走斷絕韁靽，捶杖加之不以改行，還	踉 橫 走 斷 絕 韁 靽 捶 杖 加 之 不 以 改 行 還 
T03n0154_004:0099c17	歸餓之。乃思己殃，食以臭草，飲以濁泉，	歸 餓 之 乃 思 己 殃 食 以 臭 草 飲 以 濁 泉 
T03n0154_004:0099c18	自作己受，何所復怨？夜行見母，長跪問言：	自 作 己 受 何 所 復 怨 夜 行 見 母 長 跪 問 言 
T03n0154_004:0099c19	「今者大家，獨見憎毒，不得水草，撾鞭甚酷。	 今 者 大 家 獨 見 憎 毒 不 得 水 草 撾 鞭 甚 酷 
T03n0154_004:0099c20	母獨高處，不念親慼，行來欣欣，一身喜樂，	母 獨 高 處 不 念 親 慼 行 來 欣 欣 一 身 喜 樂 
T03n0154_004:0099c21	高望遠視，猶若鴻鵠，不憂子孫獨遇此酷。」	高 望 遠 視 猶 若 鴻 鵠 不 憂 子 孫 獨 遇 此 酷 
T03n0154_004:0099c22	其母答曰：「是卿身過，何所怨責？長者授勒	其 母 答 曰 是 卿 身 過 何 所 怨 責 長 者 授 勒 
T03n0154_004:0099c23	被鞍，即便受騎，汝隨順東西從之，便見	被 鞍 即 便 受 騎 汝 隨 順 東 西 從 之 便 見 
T03n0154_004:0099c24	愛耳！斯事極易而卿反之，故獲此殃！」子聞	愛 耳 斯 事 極 易 而 卿 反 之 故 獲 此 殃 子 聞 
T03n0154_004:0099c25	母教，明日即從。長者試之，安然順之，騎之	母 教 明 日 即 從 長 者 試 之 安 然 順 之 騎 之 
T03n0154_004:0099c26	授身，令行即行，令住尋住。長者大喜，馬即	授 身 令 行 即 行 令 住 尋 住 長 者 大 喜 馬 即 
T03n0154_004:0099c27	調良，飲食隨時，與母無異。假以為喻，長者	調 良 飲 食 隨 時 與 母 無 異 假 以 為 喻 長 者 
T03n0154_004:0099c28	謂佛，馬喻學人，不受佛教，放心恣意，不	謂 佛 馬 喻 學 人 不 受 佛 教 放 心 恣 意 不 
T03n0154_004:0099c29	從道化，故為說法，令知去就。跳踉走行，不	從 道 化 故 為 說 法 令 知 去 就 跳 踉 走 行 不 
T03n0154_004:0100a01	可制者，加以捶杖，為演五戒十善，生天人	可 制 者 加 以 捶 杖 為 演 五 戒 十 善 生 天 人 
T03n0154_004:0100a02	中，罪者示以地獄、餓鬼畜生，勤苦之難，三	中 罪 者 示 以 地 獄 餓 鬼 畜 生 勤 苦 之 難 三 
T03n0154_004:0100a03	界之患，往來輪轉，無一可安。設不犯惡，五	界 之 患 往 來 輪 轉 無 一 可 安 設 不 犯 惡 五 
T03n0154_004:0100a04	戒十善，乃開化之，四等六度，神通之行，在	戒 十 善 乃 開 化 之 四 等 六 度 神 通 之 行 在 
T03n0154_004:0100a05	於十方諸佛共會，三毒消除，去諸陰蓋。其	於 十方諸佛 共 會 三 毒 消 除 去 諸 陰 蓋 其 
T03n0154_004:0100a06	子從母，長跪問曰前聞其師所行法則，師	子 從 母 長 跪 問 曰 前 聞 其 師 所 行 法 則 師 
T03n0154_004:0100a07	說深淺之行皆有意。故五戒十善因，為天	說 深 淺 之 行 皆 有 意 故 五 戒 十 善 因 為 天 
T03n0154_004:0100a08	人說，空無相願，六度無極，四等四恩，不在	人 說 空 無 相 願 六 度 無 極 四 等 四 恩 不 在 
T03n0154_004:0100a09	生死，不住滅度，乃入正真，勇果之徒，處	生 死 不 住 滅 度 乃 入 正 真 勇 果 之 徒 處 
T03n0154_004:0100a10	神通乘，周旋三界，度脫一切。	神 通 乘 周 旋 三 界 度 脫 一 切 
T03n0154_004:0100a11	佛說比丘尼現變經第四十三	佛 說 比 丘 尼 現 變 經 第 四 十 三 
T03n0154_004:0100a12	昔者舍衛之城，城名拘薩。國中有諸蕩逸婬	昔 者 舍 衛 之 城 城 名 拘 薩 國 中 有 諸 蕩 逸 婬 
T03n0154_004:0100a13	亂之眾，專為凶惡，不隨徑路，一國患之，以	亂 之 眾 專 為 凶 惡 不 隨 徑 路 一 國 患 之 以 
T03n0154_004:0100a14	為酷苦，伴黨相追，共為惡逆，官家求取，馳	為 酷 苦 伴 黨 相 追 共 為 惡 逆 官 家 求 取 馳 
T03n0154_004:0100a15	走叵得。於時國中諸比丘尼，俱共遊行，樹	走 叵 得 於 時 國 中 諸比丘尼 俱 共 遊 行 樹 
T03n0154_004:0100a16	下精專，思惟正道，不捨心懷。眾比丘尼，	下 精 專 思 惟 正 道 不 捨 心 懷 眾 比 丘 尼 
T03n0154_004:0100a17	智慧第一，名曰差摩；神足第一，名蓮華鮮，	智慧第一 名 曰 差 摩 神 足 第 一 名 蓮 華 鮮 
T03n0154_004:0100a18	各各有德行，威神巍巍。時天小熱，俱行欲	各 各 有 德 行 威 神 巍 巍 時 天 小 熱 俱 行 欲 
T03n0154_004:0100a19	洗，詣流水側，凶眾遙見，即生惡心婬意	洗 詣 流 水 側 凶 眾 遙 見 即 生 惡 心 婬 意 
T03n0154_004:0100a20	隆崇，欲以犯之。候比丘尼，適脫衣被，入	隆 崇 欲 以 犯 之 候 比 丘 尼 適 脫 衣 被 入 
T03n0154_004:0100a21	水洗浴，尋前掣衣，持著遠處，欲牽犯之。	水 洗 浴 尋 前 掣 衣 持 著 遠 處 欲 牽 犯 之 
T03n0154_004:0100a22	時比丘尼，見發逆意，意中愴然，愍之為愚，	時 比 丘 尼 見 發 逆 意 意 中 愴 然 愍 之 為 愚 
T03n0154_004:0100a23	因脫兩眼，著其掌中，以示諸逆。「卿所愛我，	因 脫 兩 眼 著 其 掌 中 以 示 諸 逆 卿 所 愛 我 
T03n0154_004:0100a24	唯愛面色，今我以盲，何所可好？」復示腸	唯 愛 面 色 今 我 以 盲 何 所 可 好 復 示 腸 
T03n0154_004:0100a25	胃身體五藏手脚各異，棄在一面，謂凶眾	胃 身 體 五 藏 手 脚 各 異 棄 在 一 面 謂 凶 眾 
T03n0154_004:0100a26	言：「好為所在？」逆凶見此忽然恐怖，知世無	言 好 為 所 在 逆 凶 見 此 忽 然 恐 怖 知 世 無 
T03n0154_004:0100a27	常，三界如寄，其身化成，骨血不淨，無可貪	常 三 界 如 寄 其 身 化 成 骨 血 不 淨 無 可 貪 
T03n0154_004:0100a28	者。尋還衣被，稽首悔過：「所作無狀，反逆無	者 尋 還 衣 被 稽 首 悔 過 所 作 無 狀 反 逆 無 
T03n0154_004:0100a29	義，願捨其殃。」長跪叉手，各受五戒。將至佛	義 願 捨 其 殃 長 跪 叉 手 各 受 五 戒 將 至 佛 
T03n0154_004:0100b01	所，稽首于地，自責其罪：「盲冥無知，迷來日	所 稽 首 于 地 自 責 其 罪 盲 冥 無 知 迷 來 日 
T03n0154_004:0100b02	久，作惡不罷，不覺世世當受禍危，今蒙	久 作 惡 不 罷 不 覺 世 世 當 受 禍 危 今 蒙 
T03n0154_004:0100b03	大聖垂恩救濟，乃感比丘尼威德化眼，去	大 聖 垂 恩 救 濟 乃 感 比 丘 尼 威 德 化 眼 去 
T03n0154_004:0100b04	罪罪輕，稍近無為。」佛言：「善哉！惡趣已離，轉	罪 罪 輕 稍 近 無 為 佛 言 善 哉 惡 趣 已 離 轉 
T03n0154_004:0100b05	當成就，如樹花枝，果實以茂，行亦從斯。」	當 成 就 如 樹 花 枝 果 實 以 茂 行 亦 從 斯 
T03n0154_004:0100b06	諸人欣然，求作沙門。佛即聽之：「正心為本。」	諸 人 欣 然 求 作 沙 門 佛 即 聽 之 正 心 為 本 
T03n0154_004:0100b07	尋時出家，守護諸根，眾殃永除，五蓋不存，	尋 時 出 家 守 護 諸 根 眾 殃 永 除 五 蓋 不 存 
T03n0154_004:0100b08	三毒消滅，為佛子孫，以斷生死，自然神通，	三 毒 消 滅 為 佛 子 孫 以 斷 生 死 自 然 神 通 
T03n0154_004:0100b09	爾乃識別佛之大恩。	爾 乃 識 別 佛 之 大 恩 
T03n0154_004:0100b10	佛說孤獨經第四十四	佛 說 孤 獨 經 第 四 十 四 
T03n0154_004:0100b11	昔有一人，幼少孤苦，獨一身居。種作廣田，	昔 有 一 人 幼 少 孤 苦 獨 一 身 居 種 作 廣 田 
T03n0154_004:0100b12	益有犁牛，得收五穀，乳酪醍醐，眾果菜茹	益 有 犁 牛 得 收 五 穀 乳 酪 醍 醐 眾 果 菜 茹 
T03n0154_004:0100b13	不可限量，供給遠近諸食之者，往來每與	不 可 限 量 供 給 遠 近 諸 食 之 者 往 來 每 與 
T03n0154_004:0100b14	窮困，名德流布普通十方。時說眾喻解	窮 困 名 德 流 布 普 通 十 方 時 說 眾 喻 解 
T03n0154_004:0100b15	悟其意，當得伴黨獨不可諧，眾人咸來	悟 其 意 當 得 伴 黨 獨 不 可 諧 眾 人 咸 來 
T03n0154_004:0100b16	皆共居止，在其人邊居家遂多，更立城邑。	皆 共 居 止 在 其 人 邊 居 家 遂 多 更 立 城 邑 
T03n0154_004:0100b17	取婦生子，子大眾多，父轉年大，教告諸子：	取 婦 生 子 子 大 眾 多 父 轉 年 大 教 告 諸 子 
T03n0154_004:0100b18	「當可施行，護身口意，布恩施德。」子各違	 當 可 施 行 護 身 口 意 布 恩 施 德 子 各 違 
T03n0154_004:0100b19	錯，不從其教言。「父今已老，何不寂然？妄有	錯 不 從 其 教 言 父 今 已 老 何 不 寂 然 妄 有 
T03n0154_004:0100b20	所教，誰當受之？」父得子惱，心自念言：「吾本	所 教 誰 當 受 之 父 得 子 惱 心 自 念 言 吾 本 
T03n0154_004:0100b21	一身，所豐廣施遠近，下及不逮，今得諸子，	一 身 所 豐 廣 施 遠 近 下 及 不 逮 今 得 諸 子 
T03n0154_004:0100b22	亂我身心，不從其教，不如無子。」佛言：「人	亂 我 身 心 不 從 其 教 不 如 無 子 佛 言 人 
T03n0154_004:0100b23	本立神，一身清明，能有所益。奉於正行，	本 立 神 一 身 清 明 能 有 所 益 奉 於 正 行 
T03n0154_004:0100b24	強有所觀，不解本無，自見有身，因生五陰	強 有 所 觀 不 解 本 無 自 見 有 身 因 生 五 陰 
T03n0154_004:0100b25	六衰之惑，反為所迷，不至正真；後解三界	六 衰 之 惑 反 為 所 迷 不 至 正 真 後 解 三 界 
T03n0154_004:0100b26	一切皆空，五陰悉除，三毒自滅，乃至無上	一切皆空 五 陰 悉 除 三 毒 自 滅 乃 至 無 上 
T03n0154_004:0100b27	正真之道。」佛說如是，莫不歡喜。	正 真 之 道 佛 說 如 是 莫 不 歡 喜 
T03n0154_004:0100b28	生經卷第四	生 經 卷 第 四 
T03n0154_005:0100c02	生經卷第五	生 經 卷 第 五 
T03n0154_005:0100c04	西晉三藏竺法護譯	西 晉 三 藏 竺 法 護 譯 
T03n0154_005:0100c05	佛說梵志經第四十五	佛 說 梵 志 經 第 四 十 五 
T03n0154_005:0100c06	聞如是：一時佛遊舍衛祇樹給孤獨園，與	聞 如 是 一 時 佛 遊 舍 衛 祇 樹 給 孤 獨 園 與 
T03n0154_005:0100c07	千二百五十比丘俱。爾時世尊，晨旦著衣持	千二百五十 比 丘 俱 爾 時 世 尊 晨 旦 著 衣 持 
T03n0154_005:0100c08	鉢，入舍衛城分衛，次第求食，即時轉行到	鉢 入 舍 衛 城 分 衛 次 第 求 食 即 時 轉 行 到 
T03n0154_005:0100c09	梵志舍。時彼梵志，遙見世尊——威神巍巍，諸	梵 志 舍 時 彼 梵 志 遙 見 世 尊 威 神 巍 巍 諸 
T03n0154_005:0100c10	根寂定，其心湛靜，降伏諸根，無復衰入，如	根 寂 定 其 心 湛 靜 降 伏 諸 根 無 復 衰 入 如 
T03n0154_005:0100c11	日之昇出于山崗、如月盛滿眾星獨明、如	日 之 昇 出 于 山 崗 如 月 盛 滿 眾 星 獨 明 如 
T03n0154_005:0100c12	帝釋宮處於忉利、如梵天王在諸梵中、如	帝 釋 宮 處 於 忉 利 如 梵 天 王 在 諸 梵 中 如 
T03n0154_005:0100c13	高山上而大積雪現於四遠、如樹華茂其心	高 山 上 而 大 積 雪 現 於 四 遠 如 樹 華 茂 其 心 
T03n0154_005:0100c14	憺泊、如水之清，三十二相莊嚴其身，八十	憺 泊 如 水 之 清 三十二相 莊 嚴 其 身 八 十 
T03n0154_005:0100c15	種好遍布其體，威神光光不可稱限，覩之	種 好 遍 布 其 體 威 神 光 光 不 可 稱 限 覩 之 
T03n0154_005:0100c16	如日——即從座起，與眷屬俱，前行奉迎，稽	如 日 即 從 座 起 與 眷 屬 俱 前 行 奉 迎 稽 
T03n0154_005:0100c17	首佛足，請坐別床。佛便就坐。時梵志、梵志	首 佛 足 請 坐 別 床 佛 便 就 坐 時 梵 志 梵 志 
T03n0154_005:0100c18	婦，心懷踊躍，若干種食，香潔之饌，手自斟	婦 心 懷 踊 躍 若 干 種 食 香 潔 之 饌 手 自 斟 
T03n0154_005:0100c19	酌，供養無極。飯食畢訖，舉鉢洗手，更取卑	酌 供 養 無 極 飯 食 畢 訖 舉 鉢 洗 手 更 取 卑 
T03n0154_005:0100c20	[木*翕]，聽佛說經。於時世尊，即為梵志及妻子	[木翕] 聽 佛 說 經 於 時 世 尊 即 為 梵 志 及 妻 子 
