T03n0152_005:0026b21	乎？』又退讌息曰：『男女為偶，自古然矣。男	乎 又 退 讌 息 曰 男 女 為 偶 自 古 然 矣 男 
T03n0152_005:0026b22	賢女貞，誠亦難值。』遂納禮會宗，九族歎曰：	賢 女 貞 誠 亦 難 值 遂 納 禮 會 宗 九 族 歎 曰 
T03n0152_005:0026b23	『斯榮傳世。』納妻禮成，邸閣馳啟，四姓聞之	 斯 榮 傳 世 納 妻 禮 成 邸 閣 馳 啟 四 姓 聞 之 
T03n0152_005:0026b24	結疾殊篤。兒聞親疾，哽咽而言：『夫命難	結 疾 殊 篤 兒 聞 親 疾 哽 咽 而 言 夫 命 難 
T03n0152_005:0026b25	保，猶幻非真。』梵志欲擇良日遣還，菩薩內	保 猶 幻 非 真 梵 志 欲 擇 良 日 遣 還 菩 薩 內 
T03n0152_005:0026b26	痛不從其云，室家馳歸升堂稽首，妻尋	痛 不 從 其 云 室 家 馳 歸 升 堂 稽 首 妻 尋 
T03n0152_005:0026b27	再拜，垂泣而進三步又拜，稱名曰『妾是子男	再 拜 垂 泣 而 進 三 步 又 拜 稱 名 曰 妾 是 子 男 
T03n0152_005:0026b28	某妻，親召妾為某，當奉宗嗣箕帚之使，	某 妻 親 召 妾 為 某 當 奉 宗 嗣 箕 帚 之 使 
T03n0152_005:0026b29	盡禮修孝。惟願大人疾瘳福臻，永保無終	盡 禮 修 孝 惟 願 大 人 疾 瘳 福 臻 永 保 無 終 
T03n0152_005:0026c01	之壽，令其展情獲孝婦之德。』四姓結忿內	之 壽 令 其 展 情 獲 孝 婦 之 德 四 姓 結 忿 內 
T03n0152_005:0026c02	塞而殞。菩薩殯送慈惻哀慕，一國稱孝，喪	塞 而 殞 菩 薩 殯 送 慈 惻 哀 慕 一 國 稱 孝 喪 
T03n0152_005:0026c03	畢修行馨熏十方。」佛告諸比丘：「童子者，吾	畢 修 行 馨 熏 十 方 佛 告 諸 比 丘 童 子 者 吾 
T03n0152_005:0026c04	身是也。妻者，俱夷是。四姓者，調達是。菩	身 是 也 妻 者 俱 夷 是 四 姓 者 調 達 是 菩 
T03n0152_005:0026c05	薩法忍度無極行忍辱如是。」	薩 法 忍 度 無 極 行 忍 辱 如 是 
T03n0152_005:0026c06	（四六）「昔者菩薩為大國王，常以四等育護眾	 四 六 昔 者 菩 薩 為 大 國 王 常 以 四 等 育 護 眾 
T03n0152_005:0026c07	生，聲動遐邇靡不歎懿。舅亦為王，處在異	生 聲 動 遐 邇 靡 不 歎 懿 舅 亦 為 王 處 在 異 
T03n0152_005:0026c08	國，性貪無耻，以兇為健。開士林歎：『菩薩懷	國 性 貪 無 耻 以 兇 為 健 開 士 林 歎 菩 薩 懷 
T03n0152_005:0026c09	二儀之仁惠。』虛誣謗訕為造訧端，興兵欲	二 儀 之 仁 惠 虛 誣 謗 訕 為 造 訧 端 興 兵 欲 
T03n0152_005:0026c10	奪菩薩國。菩薩群僚僉曰：『寧為天仁賤，不	奪 菩 薩 國 菩 薩 群 僚 僉 曰 寧 為 天 仁 賤 不 
T03n0152_005:0026c11	為犲狼貴也。』民曰：『寧為有道之畜，不	為 犲 狼 貴 也 民 曰 寧 為 有 道 之 畜 不 
T03n0152_005:0026c12	為無道民矣。』料選武士陳軍振旅，國王	為 無 道 民 矣 料 選 武 士 陳 軍 振 旅 國 王 
T03n0152_005:0026c13	登臺觀軍情猥，流淚涕泣交頸曰：『以吾	登 臺 觀 軍 情 猥 流 淚 涕 泣 交 頸 曰 以 吾 
T03n0152_005:0026c14	一躬毀兆民之命，國亡難復，人身難獲，	一 躬 毀 兆 民 之 命 國 亡 難 復 人 身 難 獲 
T03n0152_005:0026c15	吾之遁邁，國境咸康，將誰有患乎？』王與	吾 之 遁 邁 國 境 咸 康 將 誰 有 患 乎 王 與 
T03n0152_005:0026c16	元后俱委國亡。舅入處國，以貪殘為	元 后 俱 委 國 亡 舅 入 處 國 以 貪 殘 為 
T03n0152_005:0026c17	政，戮忠貞、進佞蠱，政苛民困，怨泣相	政 戮 忠 貞 進 佞 蠱 政 苛 民 困 怨 泣 相 
T03n0152_005:0026c18	屬，思詠舊君猶孝子之存慈親也。「王與	屬 思 詠 舊 君 猶 孝 子 之 存 慈 親 也 王 與 
T03n0152_005:0026c19	元妃處于山林，海有邪龍，好妃光顏，化	元 妃 處 于 山 林 海 有 邪 龍 好 妃 光 顏 化 
T03n0152_005:0026c20	為梵志，訛叉手箕坐垂首靖思，有似道	為 梵 志 訛 叉 手 箕 坐 垂 首 靖 思 有 似 道 
T03n0152_005:0026c21	士惟禪定時。王覩欣然，日採果供養。龍	士 惟 禪 定 時 王 覩 欣 然 日 採 果 供 養 龍 
T03n0152_005:0026c22	伺王行，盜挾妃去，將還海居。路由兩	伺 王 行 盜 挾 妃 去 將 還 海 居 路 由 兩 
T03n0152_005:0026c23	山夾道之徑，山有巨鳥，張翼塞徑，與龍	山 夾 道 之 徑 山 有 巨 鳥 張 翼 塞 徑 與 龍 
T03n0152_005:0026c24	一戰焉。龍為震電擊鳥，墮其右翼，遂獲	一 戰 焉 龍 為 震 電 擊 鳥 墮 其 右 翼 遂 獲 
T03n0152_005:0026c25	還海。「王採果還，不見其妃，悵然而曰：	還 海 王 採 果 還 不 見 其 妃 悵 然 而 曰 
T03n0152_005:0027a01	『吾宿行違，殃咎隣臻乎？』乃執弓持矢，經歷	 吾 宿 行 違 殃 咎 隣 臻 乎 乃 執 弓 持 矢 經 歷 
T03n0152_005:0027a02	諸山尋求元妃。覩有滎流，尋極其原，	諸 山 尋 求 元 妃 覩 有 滎 流 尋 極 其 原 
T03n0152_005:0027a03	見巨獼猴而致哀慟，王愴然曰：『爾復何哀	見 巨 獼 猴 而 致 哀 慟 王 愴 然 曰 爾 復 何 哀 
T03n0152_005:0027a04	乎？』獼猴曰：『吾與舅氏併肩為王，舅以勢	乎 獼 猴 曰 吾 與 舅 氏 併 肩 為 王 舅 以 勢 
T03n0152_005:0027a05	強奪吾眾矣，嗟乎無訴。子今何緣翔茲	強 奪 吾 眾 矣 嗟 乎 無 訴 子 今 何 緣 翔 茲 
T03n0152_005:0027a06	山岨乎？』菩薩答曰：『吾與爾其憂齊矣！吾又	山 岨 乎 菩 薩 答 曰 吾 與 爾 其 憂 齊 矣 吾 又 
T03n0152_005:0027a07	亡妃，未知所之。』猴曰：『子助吾戰，復吾士	亡 妃 未 知 所 之 猴 曰 子 助 吾 戰 復 吾 士 
T03n0152_005:0027a08	眾；為子尋之，終必獲矣。』王然之曰：『可。』明日	眾 為 子 尋 之 終 必 獲 矣 王 然 之 曰 可 明 日 
T03n0152_005:0027a09	猴與舅戰，王乃彎弓擩矢，股肱勢張，舅遙	猴 與 舅 戰 王 乃 彎 弓 擩 矢 股 肱 勢 張 舅 遙 
T03n0152_005:0027a10	悚懼，播徊迸馳，猴王眾反，遂命眾曰：『人王	悚 懼 播 徊 迸 馳 猴 王 眾 反 遂 命 眾 曰 人 王 
T03n0152_005:0027a11	元妃，迷在斯山，爾等布索。』猴眾各行，見鳥	元 妃 迷 在 斯 山 爾 等 布 索 猴 眾 各 行 見 鳥 
T03n0152_005:0027a12	病翼，鳥曰：『爾等奚求乎？』曰：『人王亡其正妃，	病 翼 鳥 曰 爾 等 奚 求 乎 曰 人 王 亡 其 正 妃 
T03n0152_005:0027a13	吾等尋之。』鳥曰：『龍盜之矣！吾勢無如，今在	吾 等 尋 之 鳥 曰 龍 盜 之 矣 吾 勢 無 如 今 在 
T03n0152_005:0027a14	海中大洲之上。』言畢鳥絕。「猴王率眾，由徑	海 中 大 洲 之 上 言 畢 鳥 絕 猴 王 率 眾 由 徑 
T03n0152_005:0027a15	臨海，憂無以渡。天帝釋即化為獼猴，身	臨 海 憂 無 以 渡 天 帝 釋 即 化 為 獼 猴 身 
T03n0152_005:0027a16	病疥癬，來進曰：『今士眾之多，其踰海沙，	病 疥 癬 來 進 曰 今 士 眾 之 多 其 踰 海 沙 
T03n0152_005:0027a17	何憂不達於彼洲乎？今各復負石杜海，	何 憂 不 達 於 彼 洲 乎 今 各 復 負 石 杜 海 
T03n0152_005:0027a18	可以為高山，何但通洲而已？』猴王即封之	可 以 為 高 山 何 但 通 洲 而 已 猴 王 即 封 之 
T03n0152_005:0027a19	為監，眾從其謀，負石功成，眾得濟度，圍洲	為 監 眾 從 其 謀 負 石 功 成 眾 得 濟 度 圍 洲 
T03n0152_005:0027a20	累沓。龍作毒霧，猴眾都病無不仆地。二	累 沓 龍 作 毒 霧 猴 眾 都 病 無 不 仆 地 二 
T03n0152_005:0027a21	王悵愁，小猴重曰：『令眾病瘳，無勞聖念。』	王 悵 愁 小 猴 重 曰 令 眾 病 瘳 無 勞 聖 念 
T03n0152_005:0027a22	即以天藥傅眾鼻中，眾則奮鼻而興，力	即 以 天 藥 傅 眾 鼻 中 眾 則 奮 鼻 而 興 力 
T03n0152_005:0027a23	勢踰前。龍即興風雲以擁天日，電耀光	勢 踰 前 龍 即 興 風 雲 以 擁 天 日 電 耀 光 
T03n0152_005:0027a24	海，勃怒霹靂震乾動地。小猴曰：『人王妙射，	海 勃 怒 霹 靂 震 乾 動 地 小 猴 曰 人 王 妙 射 
T03n0152_005:0027a25	夫電耀者即龍矣。發矢除凶，為民招福，眾	夫 電 耀 者 即 龍 矣 發 矢 除 凶 為 民 招 福 眾 
T03n0152_005:0027a26	聖無怨矣。』霆耀電光，王乃放箭，正破龍胸，	聖 無 怨 矣 霆 耀 電 光 王 乃 放 箭 正 破 龍 胸 
T03n0152_005:0027a27	龍被射死，猴眾稱善。小猴拔龍門鑰，開門	龍 被 射 死 猴 眾 稱 善 小 猴 拔 龍 門 鑰 開 門 
T03n0152_005:0027a28	出妃，天鬼咸喜。二王俱還本山，更相辭謝，	出 妃 天 鬼 咸 喜 二 王 俱 還 本 山 更 相 辭 謝 
T03n0152_005:0027a29	謙光崇讓。「會舅王死，無有嗣子，臣民奔馳	謙 光 崇 讓 會 舅 王 死 無 有 嗣 子 臣 民 奔 馳 
T03n0152_005:0027b01	尋求舊君，於彼山阻君臣相見，哀泣	尋 求 舊 君 於 彼 山 阻 君 臣 相 見 哀 泣 
T03n0152_005:0027b02	俱還，并獲舅國，兆民歡喜稱壽萬歲，大赦	俱 還 并 獲 舅 國 兆 民 歡 喜 稱 壽 萬 歲 大 赦 
T03n0152_005:0027b03	寬政，民心欣欣含笑且行。王曰：『婦離所	寬 政 民 心 欣 欣 含 笑 且 行 王 曰 婦 離 所 
T03n0152_005:0027b04	天隻行一宿，眾有疑望，豈況旬朔乎？還于	天 隻 行 一 宿 眾 有 疑 望 豈 況 旬 朔 乎 還 于 
T03n0152_005:0027b05	爾宗事合古儀。』妃曰：『吾雖在穢蟲之窟，猶	爾 宗 事 合 古 儀 妃 曰 吾 雖 在 穢 蟲 之 窟 猶 
T03n0152_005:0027b06	蓮華居于污泥。吾言有信，地其坼矣。』言	蓮 華 居 于 污 泥 吾 言 有 信 地 其 坼 矣 言 
T03n0152_005:0027b07	畢地裂，曰：『吾信現矣。』王曰：『善哉！夫貞潔者沙	畢 地 裂 曰 吾 信 現 矣 王 曰 善 哉 夫 貞 潔 者 沙 
T03n0152_005:0027b08	門之行。』自斯國內，商人讓利，士者辭位，	門 之 行 自 斯 國 內 商 人 讓 利 士 者 辭 位 
T03n0152_005:0027b09	豪能忍賤，強不陵弱，王之化也。婬婦改操，	豪 能 忍 賤 強 不 陵 弱 王 之 化 也 婬 婦 改 操 
T03n0152_005:0027b10	危命守貞，欺者尚信，巧偽守真，元妃	危 命 守 貞 欺 者 尚 信 巧 偽 守 真 元 妃 
T03n0152_005:0027b11	之化也。」佛告諸比丘：「時國王者，我身是也。	之 化 也 佛 告 諸 比 丘 時 國 王 者 我 身 是 也 
T03n0152_005:0027b12	妃者，俱夷是。舅者，調達是。天帝釋者，彌勒是	妃 者 俱 夷 是 舅 者 調 達 是 天 帝 釋 者 彌 勒 是 
T03n0152_005:0027b13	也。菩薩法忍度無極行忍辱如是。」	也 菩 薩 法 忍 度 無 極 行 忍 辱 如 是 
T03n0152_005:0027b14	（四七）「昔者菩薩，身為獼猴，力幹尠輩，明哲	 四 七 昔 者 菩 薩 身 為 獼 猴 力 幹 尠 輩 明 哲 
T03n0152_005:0027b15	踰人，常懷普慈拯濟眾生。處在深山，登	踰 人 常 懷 普 慈 拯 濟 眾 生 處 在 深 山 登 
T03n0152_005:0027b16	樹採果，覩山谷中有窮陷人，不能自出，	樹 採 果 覩 山 谷 中 有 窮 陷 人 不 能 自 出 
T03n0152_005:0027b17	數日哀號，呼天乞活。獼猴聞哀，愴為流淚	數 日 哀 號 呼 天 乞 活 獼 猴 聞 哀 愴 為 流 淚 
T03n0152_005:0027b18	曰：『吾誓求佛，唯為斯類耳。今不出此人，	曰 吾 誓 求 佛 唯 為 斯 類 耳 今 不 出 此 人 
T03n0152_005:0027b19	其必窮死。吾當尋岸下谷，負出之也。』遂入	其 必 窮 死 吾 當 尋 岸 下 谷 負 出 之 也 遂 入 
T03n0152_005:0027b20	幽谷，使人負己，攀草上山置之平地，示	幽 谷 使 人 負 己 攀 草 上 山 置 之 平 地 示 
T03n0152_005:0027b21	其徑路曰：『在爾所之，別去之後慎無為惡	其 徑 路 曰 在 爾 所 之 別 去 之 後 慎 無 為 惡 
T03n0152_005:0027b22	也。』出人疲極，就閑臥息。人曰：『處谷飢饉，今	也 出 人 疲 極 就 閑 臥 息 人 曰 處 谷 飢 饉 今 
T03n0152_005:0027b23	出亦然，將何異哉？』心念：『當殺獼猴噉之，	出 亦 然 將 何 異 哉 心 念 當 殺 獼 猴 噉 之 
T03n0152_005:0027b24	以濟吾命。不亦可乎！』以石椎首，血流丹	以 濟 吾 命 不 亦 可 乎 以 石 椎 首 血 流 丹 
T03n0152_005:0027b25	地，猴臥驚起，眩倒緣樹，心無恚意，慈哀	地 猴 臥 驚 起 眩 倒 緣 樹 心 無 恚 意 慈 哀 
T03n0152_005:0027b26	愍傷悲其懷惡，自念曰：『吾勢所不能度	愍 傷 悲 其 懷 惡 自 念 曰 吾 勢 所 不 能 度 
T03n0152_005:0027b27	者，願其來世常逢諸佛，信受道教行之得	者 願 其 來 世 常 逢 諸 佛 信 受 道 教 行 之 得 
T03n0152_005:0027b28	度。世世莫有念惡如斯人也。』」佛告諸比	度 世 世 莫 有 念 惡 如 斯 人 也 佛 告 諸 比 
T03n0152_005:0027b29	丘：「獼猴者，吾身是也。谷中人者，調達是。菩	丘 獼 猴 者 吾 身 是 也 谷 中 人 者 調 達 是 菩 
T03n0152_005:0027c01	薩法忍度無極行忍辱如是。」	薩 法 忍 度 無 極 行 忍 辱 如 是 
T03n0152_005:0027c02	（四八）「昔者菩薩與阿難俱畢罪為龍，其一龍	 四 八 昔 者 菩 薩 與 阿 難 俱 畢 罪 為 龍 其 一 龍 
T03n0152_005:0027c03	曰：『惟吾與卿共在海中靡所不覩，寧可俱	曰 惟 吾 與 卿 共 在 海 中 靡 所 不 覩 寧 可 俱 
T03n0152_005:0027c04	上陸地遊戲乎？』答曰：『陸地人惡，起逢非常，	上 陸 地 遊 戲 乎 答 曰 陸 地 人 惡 起 逢 非 常 
T03n0152_005:0027c05	不可出也。』一龍重曰：『化為小蛇耳。若路無	不 可 出 也 一 龍 重 曰 化 為 小 蛇 耳 若 路 無 
T03n0152_005:0027c06	人，尋大道戲；逢人則隱。何所憂乎？』於是相	人 尋 大 道 戲 逢 人 則 隱 何 所 憂 乎 於 是 相 
T03n0152_005:0027c07	可，俱升遊觀。出水未久。道逢含毒蚖，蚖	可 俱 升 遊 觀 出 水 未 久 道 逢 含 毒 蚖 蚖 
T03n0152_005:0027c08	覩兩蛇厥兇念生，志往犯害，則吐毒喣沫	覩 兩 蛇 厥 兇 念 生 志 往 犯 害 則 吐 毒 喣 沫 
T03n0152_005:0027c09	兩蛇。一蛇起意，將欲以威神殺斯毒蚖；一	兩 蛇 一 蛇 起 意 將 欲 以 威 神 殺 斯 毒 蚖 一 
T03n0152_005:0027c10	蛇慈心，忍而諫止曰：『夫為高士，當赦眾	蛇 慈 心 忍 而 諫 止 曰 夫 為 高 士 當 赦 眾 
T03n0152_005:0027c11	愚，忍不可忍者，是乃為佛正真之大戒	愚 忍 不 可 忍 者 是 乃 為 佛 正 真 之 大 戒 
T03n0152_005:0027c12	也。』即說偈曰：	也 即 說 偈 曰 
T03n0152_005:0027c13	「『貪欲為狂夫，　　靡有仁義心，	 貪 欲 為 狂 夫 靡 有 仁 義 心 
T03n0152_005:0027c14	　　嫉妬欲害聖，　　唯默忍為安。	 嫉 妬 欲 害 聖 唯 默 忍 為 安 
T03n0152_005:0027c15	　　非法不軌者，　　內無惻隱心，	 非 法 不 軌 者 內 無 惻 隱 心 
T03n0152_005:0027c16	　　慳惡害布施，　　唯默忍為安。	 慳 惡 害 布 施 唯 默 忍 為 安 
T03n0152_005:0027c17	　　放逸無戒人，　　酷害懷賊心，	 放 逸 無 戒 人 酷 害 懷 賊 心 
T03n0152_005:0027c18	　　不承順道德，　　唯默忍為安。	 不 承 順 道 德 唯 默 忍 為 安 
T03n0152_005:0027c19	　　背恩無反復，　　虛飾行諂偽，	 背 恩 無 反 復 虛 飾 行 諂 偽 
T03n0152_005:0027c20	　　是為愚癡極，　　唯默忍為安。』	 是 為 愚 癡 極 唯 默 忍 為 安 
T03n0152_005:0027c21	「一蛇遂稱頌忍德，說偈陳義，一蛇敬受，遂	 一 蛇 遂 稱 頌 忍 德 說 偈 陳 義 一 蛇 敬 受 遂 
T03n0152_005:0027c22	不害蚖。一蛇曰：『吾等還海中，可乎？』相然俱	不 害 蚖 一 蛇 曰 吾 等 還 海 中 可 乎 相 然 俱 
T03n0152_005:0027c23	去，奮其威神震天動地，興雲降雨變化	去 奮 其 威 神 震 天 動 地 興 雲 降 雨 變 化 
T03n0152_005:0027c24	龍耀，人鬼咸驚，蚖乃惶怖，屍視無知七	龍 耀 人 鬼 咸 驚 蚖 乃 惶 怖 屍 視 無 知 七 
T03n0152_005:0027c25	日絕食。」佛告諸比丘：「爾時，欲害蚖龍者，阿	日 絕 食 佛 告 諸 比 丘 爾 時 欲 害 蚖 龍 者 阿 
T03n0152_005:0027c26	難是也。說忍法龍者吾，身是也。含毒蚖者，	難 是 也 說 忍 法 龍 者 吾 身 是 也 含 毒 蚖 者 
T03n0152_005:0027c27	調達是也。菩薩所在世世行忍，雖處禽	調 達 是 也 菩 薩 所 在 世 世 行 忍 雖 處 禽 
T03n0152_005:0027c28	獸不忘其行也。菩薩法忍度無極行忍辱	獸 不 忘 其 行 也 菩 薩 法 忍 度 無 極 行 忍 辱 
T03n0152_005:0027c29	如是。」	如 是 
T03n0152_005:0028a01	（四九）「昔者有國名摩天羅，王名難，學通神	 四 九 昔 者 有 國 名 摩 天 羅 王 名 難 學 通 神 
T03n0152_005:0028a02	明，靡幽不覩，覺世非常，曰：『吾身當朽為	明 靡 幽 不 覩 覺 世 非 常 曰 吾 身 當 朽 為 
T03n0152_005:0028a03	世糞壤，何國之可保？』捐榮棄樂，服大士之	世 糞 壤 何 國 之 可 保 捐 榮 棄 樂 服 大 士 之 
T03n0152_005:0028a04	法服，一鉢食為足，稟沙門戒，山林為居積	法 服 一 鉢 食 為 足 稟 沙 門 戒 山 林 為 居 積 
T03n0152_005:0028a05	三十年。樹邊有坑，坑深三十丈。時，有獵者，	三 十 年 樹 邊 有 坑 坑 深 三 十 丈 時 有 獵 者 
T03n0152_005:0028a06	馳騁尋鹿墮于坑中。時，有鳥、蛇各一，亦驚	馳 騁 尋 鹿 墮 于 坑 中 時 有 鳥 蛇 各 一 亦 驚 
T03n0152_005:0028a07	俱隕焉，體皆毀傷，俱亦困矣。仰天悲號，	俱 隕 焉 體 皆 毀 傷 俱 亦 困 矣 仰 天 悲 號 
T03n0152_005:0028a08	有孤窮之音。道士愴然，火照見之，涕泣交	有 孤 窮 之 音 道 士 愴 然 火 照 見 之 涕 泣 交 
T03n0152_005:0028a09	頸，臨坑告曰：『汝等無憂，吾拔汝重難。』即	頸 臨 坑 告 曰 汝 等 無 憂 吾 拔 汝 重 難 即 
T03n0152_005:0028a10	作長繩懸以登之，三物或銜或持，遂獲全	作 長 繩 懸 以 登 之 三 物 或 銜 或 持 遂 獲 全 
T03n0152_005:0028a11	命。俱叩頭謝曰：『吾等命在轉燭，道士仁	命 俱 叩 頭 謝 曰 吾 等 命 在 轉 燭 道 士 仁 
T03n0152_005:0028a12	惠弘普無量，令吾等得覩天日。願終斯	惠 弘 普 無 量 令 吾 等 得 覩 天 日 願 終 斯 
T03n0152_005:0028a13	身給眾所乏，以微報重，萬不賽一。』「道士	身 給 眾 所 乏 以 微 報 重 萬 不 賽 一 道 士 
T03n0152_005:0028a14	曰：『吾為國王，國大民多，宮寶婇女諸國為	曰 吾 為 國 王 國 大 民 多 宮 寶 婇 女 諸 國 為 
T03n0152_005:0028a15	上，願即響應何求不得？吾以國為怨窟，以	上 願 即 響 應 何 求 不 得 吾 以 國 為 怨 窟 以 
T03n0152_005:0028a16	色聲香味華服邪念，為六劒截吾身，六箭	色 聲 香 味 華 服 邪 念 為 六 劒 截 吾 身 六 箭 
T03n0152_005:0028a17	射吾體，由斯六邪輪轉受苦，三塗酷烈難	射 吾 體 由 斯 六 邪 輪 轉 受 苦 三 塗 酷 烈 難 
T03n0152_005:0028a18	忍難堪，吾甚厭之。捐國為沙門，願獲如	忍 難 堪 吾 甚 厭 之 捐 國 為 沙 門 願 獲 如 
T03n0152_005:0028a19	來、無所著、正真道、最正覺、道法御、天人師，開	來 無 所 著 正 真 道 最 正 覺 道 法 御 天 人 師 開 
T03n0152_005:0028a20	化群生令還本元，豈但汝等三人而已	化 群 生 令 還 本 元 豈 但 汝 等 三 人 而 已 
T03n0152_005:0028a21	乎？各還舊居見汝所親，令三自歸無違	乎 各 還 舊 居 見 汝 所 親 令 三 自 歸 無 違 
T03n0152_005:0028a22	佛教矣。』「獵者曰：『處世有年，雖覩儒士	佛 教 矣 獵 者 曰 處 世 有 年 雖 覩 儒 士 
T03n0152_005:0028a23	積德為善，豈有若佛弟子恕己濟眾，隱	積 德 為 善 豈 有 若 佛 弟 子 恕 己 濟 眾 隱 
T03n0152_005:0028a24	處而不揚名者乎？若道士有之，願至吾	處 而 不 揚 名 者 乎 若 道 士 有 之 願 至 吾 
T03n0152_005:0028a25	家乞微供養。』烏曰：『吾名鉢，道士有難，願	家 乞 微 供 養 烏 曰 吾 名 鉢 道 士 有 難 願 
T03n0152_005:0028a26	呼吾名，吾當馳詣。』蛇曰：『吾名萇，若道士	呼 吾 名 吾 當 馳 詣 蛇 曰 吾 名 萇 若 道 士 
T03n0152_005:0028a27	有患，願呼吾名，必來報恩。』辭畢各退。「他	有 患 願 呼 吾 名 必 來 報 恩 辭 畢 各 退 他 
T03n0152_005:0028a28	日，道士之獵者舍，獵者遙見其來，告妻曰：	日 道 士 之 獵 者 舍 獵 者 遙 見 其 來 告 妻 曰 
T03n0152_005:0028a29	『彼不祥之人來，吾勅汝為饌。』徐徐設之，	 彼 不 祥 之 人 來 吾 勅 汝 為 饌 徐 徐 設 之 
T03n0152_005:0028b01	彼過日中即不食矣。妻覩道士勃然作色，	彼 過 日 中 即 不 食 矣 妻 覩 道 士 勃 然 作 色 
T03n0152_005:0028b02	訛留設食，虛談過中。道士退矣，還山覩	訛 留 設 食 虛 談 過 中 道 士 退 矣 還 山 覩 
T03n0152_005:0028b03	烏，呼名曰：『鉢。』烏問曰：『自何來耶？』曰：『獵者所	烏 呼 名 曰 鉢 烏 問 曰 自 何 來 耶 曰 獵 者 所 
T03n0152_005:0028b04	來。』烏曰：『已食乎？』曰：『彼設未辦而日過中，時	來 烏 曰 已 食 乎 曰 彼 設 未 辦 而 日 過 中 時 
T03n0152_005:0028b05	不應食故吾退耳。』烏曰：『凶咎之鬼難以慈	不 應 食 故 吾 退 耳 烏 曰 凶 咎 之 鬼 難 以 慈 
T03n0152_005:0028b06	濟，違仁背恩，凶逆之大也。吾無飲食，無	濟 違 仁 背 恩 凶 逆 之 大 也 吾 無 飲 食 無 
T03n0152_005:0028b07	以供養。留心坐斯，吾須臾還。』飛之般遮國，	以 供 養 留 心 坐 斯 吾 須 臾 還 飛 之 般 遮 國 
T03n0152_005:0028b08	入王後宮，覩王夫人臥，首飾之中有明月	入 王 後 宮 覩 王 夫 人 臥 首 飾 之 中 有 明 月 
T03n0152_005:0028b09	珠。烏銜馳還，以奉道士。「夫人寐寤，求之不	珠 烏 銜 馳 還 以 奉 道 士 夫 人 寐 寤 求 之 不 
T03n0152_005:0028b10	獲，即以上聞。王勅臣民：『有得之者，賞金	獲 即 以 上 聞 王 勅 臣 民 有 得 之 者 賞 金 
T03n0152_005:0028b11	銀各千斤，牛馬各千首；得不貢者，罪重滅	銀 各 千 斤 牛 馬 各 千 首 得 不 貢 者 罪 重 滅 
T03n0152_005:0028b12	宗。』道士惠獵者，獵者縛而白之。王曰：『汝從	宗 道 士 惠 獵 者 獵 者 縛 而 白 之 王 曰 汝 從 
T03n0152_005:0028b13	何得斯寶乎？』道士深惟：『以狀言之，即	何 得 斯 寶 乎 道 士 深 惟 以 狀 言 之 即 
T03n0152_005:0028b14	一國烏皆死矣；云盜得之，斯非佛弟子	一 國 烏 皆 死 矣 云 盜 得 之 斯 非 佛 弟 子 
T03n0152_005:0028b15	也。』默然受拷，杖楚千數，不怨王，不讎彼，	也 默 然 受 拷 杖 楚 千 數 不 怨 王 不 讎 彼 
T03n0152_005:0028b16	弘慈誓曰：『令吾得佛，度眾生諸苦矣。』「王	弘 慈 誓 曰 令 吾 得 佛 度 眾 生 諸 苦 矣 王 
T03n0152_005:0028b17	曰：『取道士埋之，唯出其頭，明日戮焉。』道	曰 取 道 士 埋 之 唯 出 其 頭 明 日 戮 焉 道 
T03n0152_005:0028b18	士乃呼蛇曰：『萇。』蛇曰：『天下無知我名者，	士 乃 呼 蛇 曰 萇 蛇 曰 天 下 無 知 我 名 者 
T03n0152_005:0028b19	唯有道士耳。揚聲相呼，必有以也。』疾邁，	唯 有 道 士 耳 揚 聲 相 呼 必 有 以 也 疾 邁 
T03n0152_005:0028b20	見道士若茲，叩頭問曰：『何由致此？』道士具	見 道 士 若 茲 叩 頭 問 曰 何 由 致 此 道 士 具 
T03n0152_005:0028b21	陳厥所由然。蛇流淚曰：『道士仁如天地，	陳 厥 所 由 然 蛇 流 淚 曰 道 士 仁 如 天 地 
T03n0152_005:0028b22	尚與禍會，豈況無道，誰將祐之乎？天仁無	尚 與 禍 會 豈 況 無 道 誰 將 祐 之 乎 天 仁 無 
T03n0152_005:0028b23	怨，斯王唯有太子一人，無他儲副，我將	怨 斯 王 唯 有 太 子 一 人 無 他 儲 副 我 將 
T03n0152_005:0028b24	入宮咋殺太子，以吾神藥傅之即愈。』蛇	入 宮 咋 殺 太 子 以 吾 神 藥 傅 之 即 愈 蛇 
T03n0152_005:0028b25	夜入宮，咋之即絕。停屍三日，令曰：『有能活	夜 入 宮 咋 之 即 絕 停 屍 三 日 令 曰 有 能 活 
T03n0152_005:0028b26	太子者，分國而治。』載之山間，當火葬之。	太 子 者 分 國 而 治 載 之 山 間 當 火 葬 之 
T03n0152_005:0028b27	行徑歷道士邊，道士曰：『太子何疾而致喪	行 徑 歷 道 士 邊 道 士 曰 太 子 何 疾 而 致 喪 
T03n0152_005:0028b28	身乎？且無葬矣！吾能活之。』從者聞說，馳	身 乎 且 無 葬 矣 吾 能 活 之 從 者 聞 說 馳 
T03n0152_005:0028b29	以上聞。王心悲喜，重更哀慟曰：『吾赦爾	以 上 聞 王 心 悲 喜 重 更 哀 慟 曰 吾 赦 爾 
T03n0152_005:0028c01	罪，分國為王。』道士以藥傅身，太子忽然興	罪 分 國 為 王 道 士 以 藥 傅 身 太 子 忽 然 興 
T03n0152_005:0028c02	曰：『吾何緣在斯乎？』從者具陳所以。太子	曰 吾 何 緣 在 斯 乎 從 者 具 陳 所 以 太 子 
T03n0152_005:0028c03	還宮，巨細喜舞。「分國惠之，一無所受。王	還 宮 巨 細 喜 舞 分 國 惠 之 一 無 所 受 王 
T03n0152_005:0028c04	寤曰：『分國不受，豈當盜哉？』問：『子何國人？	寤 曰 分 國 不 受 豈 當 盜 哉 問 子 何 國 人 
T03n0152_005:0028c05	以何見為沙門乎？何從獲珠？行高乃然，	以 何 見 為 沙 門 乎 何 從 獲 珠 行 高 乃 然 
