T03n0154_002:0079a08	者，欲以臣女，若吾之女，當以相配，自恣所	者 欲 以 臣 女 若 吾 之 女 當 以 相 配 自 恣 所 
T03n0154_002:0079a09	欲。』對曰：『不敢！若王見哀，其實欲索某國王	欲 對 曰 不 敢 若 王 見 哀 其 實 欲 索 某 國 王 
T03n0154_002:0079a10	女。』王曰：『善哉！從所志願！』王即有名自以	女 王 曰 善 哉 從 所 志 願 王 即 有 名 自 以 
T03n0154_002:0079a11	為子，遣使者往，往令求彼王女，王即可	為 子 遣 使 者 往 往 令 求 彼 王 女 王 即 可 
T03n0154_002:0079a12	之。王心念言：『續是盜魁，前後狡猾。』即遣使	之 王 心 念 言 續 是 盜 魁 前 後 狡 猾 即 遣 使 
T03n0154_002:0079a13	者：『欲迎吾女，遣其太子，五百騎乘，皆使	者 欲 迎 吾 女 遣 其 太 子 五 百 騎 乘 皆 使 
T03n0154_002:0079a14	嚴整。』王即勅外，疾嚴車騎。甥為賊臣，即懷	嚴 整 王 即 勅 外 疾 嚴 車 騎 甥 為 賊 臣 即 懷 
T03n0154_002:0079a15	恐懼，心自念言：『若到彼國，王必被覺，見執	恐 懼 心 自 念 言 若 到 彼 國 王 必 被 覺 見 執 
T03n0154_002:0079a16	不疑。』便啟其王：『若王見遣，當令人馬五	不 疑 便 啟 其 王 若 王 見 遣 當 令 人 馬 五 
T03n0154_002:0079a17	百騎，具衣服鞍勒一無差異，乃可迎婦。』王	百 騎 具 衣 服 鞍 勒 一 無 差 異 乃 可 迎 婦 王 
T03n0154_002:0079a18	然其言，即往迎婦。「王令女飲食待客，善相	然 其 言 即 往 迎 婦 王 令 女 飲 食 待 客 善 相 
T03n0154_002:0079a19	娛樂，二百五十騎在前；二百五十騎在後。	娛 樂 二百五十 騎 在 前 二百五十 騎 在 後 
T03n0154_002:0079a20	甥在其中，跨馬不下。女父自出，屢觀察之。	甥 在 其 中 跨 馬 不 下 女 父 自 出 屢 觀 察 之 
T03n0154_002:0079a21	王入騎中躬執甥出：『爾為是非前後方	王 入 騎 中 躬 執 甥 出 爾 為 是 非 前 後 方 
T03n0154_002:0079a22	便，捕何叵得？』稽首答曰：『實爾是也！』王曰：『卿	便 捕 何 叵 得 稽 首 答 曰 實 爾 是 也 王 曰 卿 
T03n0154_002:0079a23	之聰哲，天下無雙，隨卿所願，以女配之，	之 聰 哲 天 下 無 雙 隨 卿 所 願 以 女 配 之 
T03n0154_002:0079a24	得為夫婦。』」佛告諸比丘：「欲知爾時甥者，	得 為 夫 婦 佛 告 諸 比 丘 欲 知 爾 時 甥 者 
T03n0154_002:0079a25	則吾身是；女父王者，舍利弗是也；舅者，調	則 吾 身 是 女 父 王 者 舍 利 弗 是 也 舅 者 調 
T03n0154_002:0079a26	達是也；女婦國王父，輸頭檀是也；母，摩耶	達 是 也 女 婦 國 王 父 輸 頭 檀 是 也 母 摩 耶 
T03n0154_002:0079a27	是；婦，瞿夷是；子，羅云是也。」佛說是時，莫	是 婦 瞿 夷 是 子 羅 云 是 也 佛 說 是 時 莫 
T03n0154_002:0079a28	不歡喜。◎	不 歡 喜 
T03n0154_002:0079a29	◎佛說閑居經第十三	 佛 說 閑 居 經 第 十 三 
T03n0154_002:0079b01	聞如是：一時佛遊拘留國轉遊，與大比丘	聞 如 是 一 時 佛 遊 拘 留 國 轉 遊 與 大 比 丘 
T03n0154_002:0079b02	眾五百人俱。稍至城裏聚落，有自然好音，	眾 五 百 人 俱 稍 至 城 裏 聚 落 有 自 然 好 音 
T03n0154_002:0079b03	佛頓其中。時彼聚落有梵志長者，與無央	佛 頓 其 中 時 彼 聚 落 有 梵 志 長 者 與 無 央 
T03n0154_002:0079b04	數眾，悉共普聞。有大寂志，姓曰瞿曇，釋族	數 眾 悉 共 普 聞 有 大 寂 志 姓 曰 瞿 曇 釋 族 
T03n0154_002:0079b05	姓子，棄國轉遊城裏聚落，與大比丘五百	姓 子 棄 國 轉 遊 城 裏 聚 落 與 大 比 丘 五 百 
T03n0154_002:0079b06	人俱。彼佛大聖，名稱普聞，流遍十方，莫不	人 俱 彼 佛 大 聖 名稱普聞 流 遍 十 方 莫 不 
T03n0154_002:0079b07	宣揚。疑者肅驚，戰戰兢兢，莫不欣戴，號	宣 揚 疑 者 肅 驚 戰 戰 兢 兢 莫 不 欣 戴 號 
T03n0154_002:0079b08	曰如來、至真、等正覺、明行成為、善逝、世間解、	曰 如 來 至 真 等 正 覺 明 行 成 為 善 逝 世 間 解 
T03n0154_002:0079b09	無上士、導法御、天人師，號佛、世尊。則以加	無 上 士 導 法 御 天 人 師 號 佛 世 尊 則 以 加 
T03n0154_002:0079b10	哀，天上人間諸魔梵天、沙門梵志、開化	哀 天 上 人 間 諸 魔 梵 天 沙 門 梵 志 開 化 
T03n0154_002:0079b11	天人，證以六通，獨步三界。所說經法，初語	天 人 證 以 六 通 獨 步 三 界 所 說 經 法 初 語 
T03n0154_002:0079b12	亦善，中語亦善，竟語亦善。分別其義，微	亦 善 中 語 亦 善 竟 語 亦 善 分 別 其 義 微 
T03n0154_002:0079b13	妙見諦，淨修梵行，得覲如斯如來、至真、等	妙 見 諦 淨 修 梵 行 得 覲 如 斯 如 來 至 真 等 
T03n0154_002:0079b14	正覺，善哉蒙慶，若能稽首，敬受道教，功祚	正 覺 善 哉 蒙 慶 若 能 稽 首 敬 受 道 教 功 祚 
T03n0154_002:0079b15	無量。於時梵志長者，往詣佛所，稽首足	無 量 於 時 梵 志 長 者 往 詣 佛 所 稽 首 足 
T03n0154_002:0079b16	下，却坐一面，敬問占謝，叉手白佛者，揖讓	下 却 坐 一 面 敬 問 占 謝 叉 手 白 佛 者 揖 讓 
T03n0154_002:0079b17	者，遙見默者，却住一面者。於時世尊告	者 遙 見 默 者 却 住 一 面 者 於 時 世 尊 告 
T03n0154_002:0079b18	梵志長者：「假使有人來問汝者，何所沙門	梵 志 長 者 假 使 有 人 來 問 汝 者 何 所 沙 門 
T03n0154_002:0079b19	不當供養奉事？」答曰：「不及，唯佛說之！」佛	不 當 供 養 奉 事 答 曰 不 及 唯 佛 說 之 佛 
T03n0154_002:0079b20	言：「其有沙門梵志，眼著妙色、耳貪五音、鼻	言 其 有 沙 門 梵 志 眼 著 妙 色 耳 貪 五 音 鼻 
T03n0154_002:0079b21	慕好香、口存美味、身猗細滑，志于諸法	慕 好 香 口 存 美 味 身 猗 細 滑 志 于 諸 法 
T03n0154_002:0079b22	不捨於欲、貪嫉恩愛，志求無厭，焚燒之痛。	不 捨 於 欲 貪 嫉 恩 愛 志 求 無 厭 焚 燒 之 痛 
T03n0154_002:0079b23	如是之比沙門梵志，不當供養奉事尊敬。」	如 是 之 比 沙 門 梵 志 不 當 供 養 奉 事 尊 敬 
T03n0154_002:0079b24	白佛言：「有來問者，當以是答乃合善義，	白 佛 言 有 來 問 者 當 以 是 答 乃 合 善 義 
T03n0154_002:0079b25	則應法化。所以者何？我等著色聲香味細滑	則 應 法 化 所以者何 我 等 著 色 聲 香 味 細 滑 
T03n0154_002:0079b26	之法、恩愛之著，貪求無厭，斯輩之類，迷于	之 法 恩 愛 之 著 貪 求 無 厭 斯 輩 之 類 迷 于 
T03n0154_002:0079b27	五陰，惑於六衰。官爵俸祿，財物富貴，不以	五 陰 惑 於 六 衰 官 爵 俸 祿 財 物 富 貴 不 以 
T03n0154_002:0079b28	懈惓，與俗無別。以是之故，不當奉供順	懈 惓 與 俗 無 別 以 是 之 故 不 當 奉 供 順 
T03n0154_002:0079b29	此等類。」佛告梵志長者：「假使有人來問汝	此 等 類 佛 告 梵 志 長 者 假 使 有 人 來 問 汝 
T03n0154_002:0079c01	者，當供事奉敬尊重何所沙門梵志？當云	者 當 供 事 奉 敬 尊 重 何 所 沙 門 梵 志 當 云 
T03n0154_002:0079c02	何乎？」白世尊曰：「其不著念五陰六衰婬	何 乎 白 世 尊 曰 其 不 著 念 五 陰 六 衰 婬 
T03n0154_002:0079c03	怒癡，習濟色聲香味細滑之念，斯等積德，	怒 癡 習 濟 色 聲 香 味 細 滑 之 念 斯 等 積 德 
T03n0154_002:0079c04	溫雅和順，正當供事如此之輩，沙門梵志。」	溫 雅 和 順 正 當 供 事 如 此 之 輩 沙 門 梵 志 
T03n0154_002:0079c05	佛告城裏聚落梵志長者：「汝等何故說此	佛 告 城 裏 聚 落 梵 志 長 者 汝 等 何 故 說 此 
T03n0154_002:0079c06	言乎？寧有比類？安知沙門梵志，已離婬	言 乎 寧 有 比 類 安 知 沙 門 梵 志 已 離 婬 
T03n0154_002:0079c07	怒癡，又教人離及色聲香味細滑恩愛之	怒 癡 又 教 人 離 及 色 聲 香 味 細 滑 恩 愛 之 
T03n0154_002:0079c08	著，心惱之熱，諸情無厭。」答佛言：「吾等數	著 心 惱 之 熱 諸 情 無 厭 答 佛 言 吾 等 數 
T03n0154_002:0079c09	見沙門梵志，端正殊好，捨色聲香味細滑所	見 沙 門 梵 志 端 正 殊 好 捨 色 聲 香 味 細 滑 所 
T03n0154_002:0079c10	欲，處在閑居，若樹下坐，塜間曠野，棄諸瑕	欲 處 在 閑 居 若 樹 下 坐 塜 間 曠 野 棄 諸 瑕 
T03n0154_002:0079c11	惡，志無所求，燕居獨處，彼則永除色痛	惡 志 無 所 求 燕 居 獨 處 彼 則 永 除 色 痛 
T03n0154_002:0079c12	想行識諸法之念，斷求念空。常察此等沙	想 行 識 諸 法 之 念 斷 求 念 空 常 察 此 等 沙 
T03n0154_002:0079c13	門梵志，離婬怒癡，亦教人離，捨色聲香味	門 梵 志 離 婬 怒 癡 亦 教 人 離 捨 色 聲 香 味 
T03n0154_002:0079c14	細滑之念。聽聞如是，以斯為樂，恩愛之著，	細 滑 之 念 聽 聞 如 是 以 斯 為 樂 恩 愛 之 著 
T03n0154_002:0079c15	永以除盡。可意色欲，諸所慕求，[火*霍]然已離，	永 以 除 盡 可 意 色 欲 諸 所 慕 求 [火霍] 然 已 離 
T03n0154_002:0079c16	則以時節供事所樂，五陰六情，亦復如是。	則 以 時 節 供 事 所 樂 五 陰 六 情 亦復如是 
T03n0154_002:0079c17	我觀此等沙門梵志，處在閑居，若樹下坐，	我 觀 此 等 沙 門 梵 志 處 在 閑 居 若 樹 下 坐 
T03n0154_002:0079c18	塜間曠野，獨而燕處，則已永除眼色耳聲	塜 間 曠 野 獨 而 燕 處 則 已 永 除 眼 色 耳 聲 
T03n0154_002:0079c19	鼻香口味身受心法，積眾德本，恭順和雅，	鼻 香 口 味 身 受 心 法 積 眾 德 本 恭 順 和 雅 
T03n0154_002:0079c20	如是比像，我等觀之。沙門梵志離婬怒癡，	如是比像 我 等 觀 之 沙 門 梵 志 離 婬 怒 癡 
T03n0154_002:0079c21	及教人離，我等今日，自歸佛及法僧，奉受	及 教 人 離 我 等 今 日 自 歸 佛 及 法 僧 奉 受 
T03n0154_002:0079c22	五戒，為清信士。」佛說如是，莫不歡喜。	五 戒 為 清 信 士 佛 說 如 是 莫 不 歡 喜 
T03n0154_002:0079c23	佛說舍利弗般泥洹經第十四	佛 說 舍 利 弗 般 泥 洹 經 第 十 四 
T03n0154_002:0079c24	聞如是：一時佛遊王舍城迦蘭陀竹園中。爾	聞 如 是 一 時 佛 遊 王 舍 城 迦 蘭 陀 竹 園 中 爾 
T03n0154_002:0079c25	時賢者舍利弗在那羅聚落，得疾困劣，	時 賢 者 舍 利 弗 在 那羅聚落 得 疾 困 劣 
T03n0154_002:0079c26	寢在于床，與諸賢者沙彌俱。於時舍利弗，	寢 在 于 床 與 諸 賢 者 沙 彌 俱 於 時 舍 利 弗 
T03n0154_002:0079c27	尋般泥洹，侍者諄那供養奉事，如法已訖，取	尋 般 泥 洹 侍 者 諄 那 供 養 奉 事 如 法 已 訖 取 
T03n0154_002:0079c28	鉢衣服，就王舍城。到竹樹間，已日昳時，	鉢 衣 服 就 王 舍 城 到 竹 樹 間 已 日 昳 時 
T03n0154_002:0079c29	從燕處起，取鉢衣服，至阿難所。稽首足	從 燕 處 起 取 鉢 衣 服 至 阿 難 所 稽 首 足 
T03n0154_002:0080a01	下，退坐一面，諄那沙彌白阿難曰：「唯然，仁	下 退 坐 一 面 諄 那 沙 彌 白 阿 難 曰 唯 然 仁 
T03n0154_002:0080a02	者！欲得知不？賢者舍利弗已取滅度，我今	者 欲 得 知 不 賢 者 舍 利 弗 已 取 滅 度 我 今 
T03n0154_002:0080a03	齎持和上舍利及鉢衣服。」賢者阿難報諄	齎 持 和 上 舍 利 及 鉢 衣 服 賢 者 阿 難 報 諄 
T03n0154_002:0080a04	那曰：「便與我俱往詣佛所敬事修禮，儻從	那 曰 便 與 我 俱 往 詣 佛 所 敬 事 修 禮 儻 從 
T03n0154_002:0080a05	世尊得聞要法。」諄那答曰：「唯然從命！」於	世 尊 得 聞 要 法 諄 那 答 曰 唯 然 從 命 於 
T03n0154_002:0080a06	時阿難與諄那俱往詣佛所，稽首足下	時 阿 難 與 諄 那 俱 往 詣 佛 所 稽 首 足 下 
T03n0154_002:0080a07	退坐一面，叉手白佛：「我身羸極，無復力	退 坐 一 面 叉 手 白 佛 我 身 羸 極 無 復 力 
T03n0154_002:0080a08	勢柔弱疲劣，不能修法。所以者何？諄那	勢 柔 弱 疲 劣 不 能 修 法 所以者何 諄 那 
T03n0154_002:0080a09	(晉言碎末)沙彌來詣我所，稽首足下為我說	 晉 言 碎 末 沙 彌 來 詣 我 所 稽 首 足 下 為 我 說 
T03n0154_002:0080a10	言：『仁者欲知，賢者舍利弗已取滅度？并齎	言 仁 者 欲 知 賢 者 舍 利 弗 已 取 滅 度 并 齎 
T03n0154_002:0080a11	衣鉢及舍利。』」佛告賢者阿難：「汝意諄那念	衣 鉢 及 舍 利 佛 告 賢 者 阿 難 汝 意 諄 那 念 
T03n0154_002:0080a12	舍利弗比丘，齎於戒品而滅度，定品、慧品、解	舍 利 弗 比 丘 齎 於 戒 品 而 滅 度 定 品 慧 品 解 
T03n0154_002:0080a13	脫品、度知見品而滅度乎？又吾了是法，	脫 品 度 知 見 品 而 滅 度 乎 又 吾 了 是 法 
T03n0154_002:0080a14	致最正覺，乃分別說；及四意止、四意斷、	致 最 正 覺 乃 分 別 說 及 四 意 止 四 意 斷 
T03n0154_002:0080a15	四神足、五根五力、七覺意、八聖道行，佛所	四 神 足 五 根 五 力 七 覺 意 八 聖 道 行 佛 所 
T03n0154_002:0080a16	現信。汝於今見舍利弗比丘又般泥洹，而	現 信 汝 於 今 見 舍 利 弗 比 丘 又 般 泥 洹 而 
T03n0154_002:0080a17	反愁慼，涕泣悲哀，不能自勝。」賢者白世尊	反 愁 慼 涕 泣 悲 哀 不 能 自 勝 賢 者 白 世 尊 
T03n0154_002:0080a18	曰：「舍利弗比丘不齎持戒、定、慧、解、度知見	曰 舍 利 弗 比 丘 不 齎 持 戒 定 慧 解 度 知 見 
T03n0154_002:0080a19	品而滅度也。世尊以是分別斯法，成最	品 而 滅 度 也 世 尊 以 是 分 別 斯 法 成 最 
T03n0154_002:0080a20	正覺，分別說耳！及四意止、四意斷、四神足念、	正 覺 分 別 說 耳 及 四 意 止 四 意 斷 四 神 足 念 
T03n0154_002:0080a21	五根五力、七覺意、八聖道行，亦不齎此	五 根 五 力 七 覺 意 八 聖 道 行 亦 不 齎 此 
T03n0154_002:0080a22	而滅度也！」阿難白佛：「唯然，世尊！舍利弗比丘	而 滅 度 也 阿 難 白 佛 唯 然 世 尊 舍 利 弗 比 丘 
T03n0154_002:0080a23	奉戒真諦，有妙辯才，講法無厭，其四部眾，	奉 戒 真 諦 有 妙 辯 才 講 法 無 厭 其 四 部 眾 
T03n0154_002:0080a24	聽之不惓，說之不懈，多所勸助，開化	聽 之 不 惓 說 之 不 懈 多 所 勸 助 開 化 
T03n0154_002:0080a25	未解，令心欣豫，莫不奉命。知節止足，	未 解 令 心 欣 豫 莫 不 奉 命 知 節 止 足 
T03n0154_002:0080a26	常志精進，志常定止，有大聖智無極之慧，	常 志 精 進 志 常 定 止 有 大 聖 智 無 極 之 慧 
T03n0154_002:0080a27	卒問對之言辭，應機發遣，博達能了，尋音	卒 問 對 之 言 辭 應 機 發 遣 博 達 能 了 尋 音 
T03n0154_002:0080a28	答報，一切能通，智慧為寶，眾德具足。舍	答 報 一 切 能 通 智 慧 為 寶 眾 德 具 足 舍 
T03n0154_002:0080a29	利弗比丘，巍巍如是。以故我見舍利弗比	利 弗 比 丘 巍 巍 如 是 以 故 我 見 舍 利 弗 比 
T03n0154_002:0080b01	丘取滅度去，愁憂悲哀，心懷感慼，不能	丘 取 滅 度 去 愁 憂 悲 哀 心 懷 感 慼 不 能 
T03n0154_002:0080b02	自勝！」佛告阿難：「生者在世，安可久存？有	自 勝 佛 告 阿 難 生 者 在 世 安 可 久 存 有 
T03n0154_002:0080b03	諸思想緣起之法，必當歸盡，壞敗永沒，法	諸 思 想 緣 起 之 法 必 當 歸 盡 壞 敗 永 沒 法 
T03n0154_002:0080b04	當崩敗，法應當壞。欲使不爾，終不可得。」	當 崩 敗 法 應 當 壞 欲 使 不 爾 終 不 可 得 
T03n0154_002:0080b05	佛告阿難：「佛本自說，一切恩愛皆當別離。	佛 告 阿 難 佛 本 自 說 一 切 恩 愛 皆 當 別 離 
T03n0154_002:0080b06	夫生有終，物成有敗，合則有散，應當滅	夫 生 有 終 物 成 有 敗 合 則 有 散 應 當 滅 
T03n0154_002:0080b07	盡壞敗，欲使不爾，安得如意？應當終沒	盡 壞 敗 欲 使 不 爾 安 得 如 意 應 當 終 沒 
T03n0154_002:0080b08	歸于無常，離別之法，欲使不散，安得可	歸 于 無 常 離 別 之 法 欲 使 不 散 安 得 可 
T03n0154_002:0080b09	獲乎？」佛語阿難：「舍利弗所遊之處，佛心則	獲 乎 佛 語 阿 難 舍 利 弗 所 遊 之 處 佛 心 則 
T03n0154_002:0080b10	安，不以為慮。應當別離，壞敗無常，欲使	安 不 以 為 慮 應 當 別 離 壞 敗 無 常 欲 使 
T03n0154_002:0080b11	不至，安可獲乎？法起有滅，物成有敗，人	不 至 安 可 獲 乎 法 起 有 滅 物 成 有 敗 人 
T03n0154_002:0080b12	生有終，興盛必衰，應當無常。別離之法，	生 有 終 興 盛 必 衰 應 當 無 常 別 離 之 法 
T03n0154_002:0080b13	欲使不至，未可獲也！譬如大寶之山，嵩	欲 使 不 至 未 可 獲 也 譬 如 大 寶 之 山 嵩 
T03n0154_002:0080b14	高之頂，一旦崩摧。如是，阿難！舍利弗比丘	高 之 頂 一 旦 崩 摧 如 是 阿 難 舍 利 弗 比 丘 
T03n0154_002:0080b15	在眾僧中，今取滅度，如寶山崩。無常壞敗，	在 眾 僧 中 今 取 滅 度 如 寶 山 崩 無 常 壞 敗 
T03n0154_002:0080b16	別離之法，欲使不至，安得如意？」佛告阿	別 離 之 法 欲 使 不 至 安 得 如 意 佛 告 阿 
T03n0154_002:0080b17	難：「猶大寶樹，根芽莖節，枝葉華實，具足茂	難 猶 大 寶 樹 根 芽 莖 節 枝 葉 華 實 具 足 茂 
T03n0154_002:0080b18	好，大觚卒墮，則現缺減，視之無威。如是，	好 大 觚 卒 墮 則 現 缺 減 視 之 無 威 如 是 
T03n0154_002:0080b19	阿難！舍利弗比丘存在眾僧，今取滅度，眾	阿 難 舍 利 弗 比 丘 存 在 眾 僧 今 取 滅 度 眾 
T03n0154_002:0080b20	僧威減，應當滅盡。無常衰耗，欲使不至，	僧 威 減 應 當 滅 盡 無 常 衰 耗 欲 使 不 至 
T03n0154_002:0080b21	豈可得乎？是故，阿難！從今日往，自修身	豈 可 得 乎 是 故 阿 難 從 今 日 往 自 修 身 
T03n0154_002:0080b22	行，已求歸依，以法為證，歸命經典，勿求	行 已 求 歸 依 以 法 為 證 歸 命 經 典 勿 求 
T03n0154_002:0080b23	餘歸。云何比丘作是行乎？於是比丘，自觀	餘 歸 云 何 比 丘 作 是 行 乎 於 是 比 丘 自 觀 
T03n0154_002:0080b24	身行，內外非我，當自觀察，調御其心，觀諸	身 行 內 外 非 我 當 自 觀 察 調 御 其 心 觀 諸 
T03n0154_002:0080b25	世間，皆由無黠。內觀痛痒，觀外痛痒，內	世 間 皆 由 無 黠 內 觀 痛 痒 觀 外 痛 痒 內 
T03n0154_002:0080b26	外非我，入于善哉！調御其心，察世無明，	外 非 我 入 于 善 哉 調 御 其 心 察 世 無 明 
T03n0154_002:0080b27	內觀其心，亦觀外心，不得內外，入于善	內 觀 其 心 亦 觀 外 心 不 得 內 外 入 于 善 
T03n0154_002:0080b28	哉！自調其心，觀世無黠，觀上日月，亦觀	哉 自 調 其 心 觀 世 無 黠 觀 上 日 月 亦 觀 
T03n0154_002:0080b29	外法，不猗內外，入于善哉！調御其心，觀	外 法 不 猗 內 外 入 于 善 哉 調 御 其 心 觀 
T03n0154_002:0080c01	世無黠。」佛告阿難：「是為修其身行，自求	世 無 黠 佛 告 阿 難 是 為 修 其 身 行 自 求 
T03n0154_002:0080c02	歸依，處於法地，歸命于法，不處他地，不	歸 依 處 於 法 地 歸 命 于 法 不 處 他 地 不 
T03n0154_002:0080c03	歸餘人。」佛告阿難：「其比丘、比丘尼、清信士、	歸 餘 人 佛 告 阿 難 其 比 丘 比 丘 尼 清 信 士 
T03n0154_002:0080c04	清信女，從我受教，自修其身，自求歸依，	清 信 女 從 我 受 教 自 修 其 身 自 求 歸 依 
T03n0154_002:0080c05	處於法地，歸於法地，歸命于法，不處他	處 於 法 地 歸 於 法 地 歸 命 于 法 不 處 他 
T03n0154_002:0080c06	地、不歸餘人。出家比丘為佛弟子，順此	地 不 歸 餘 人 出 家 比 丘 為 佛 弟 子 順 此 
T03n0154_002:0080c07	教者則順佛教。」佛說如是，阿難及沙彌、諸	教 者 則 順 佛 教 佛 說 如 是 阿 難 及 沙 彌 諸 
T03n0154_002:0080c08	比丘眾，聞經歡喜，受教而退。	比 丘 眾 聞 經 歡 喜 受 教 而 退 
T03n0154_002:0080c09	佛說子命過經第十五	佛 說 子 命 過 經 第 十 五 
T03n0154_002:0080c10	聞如是：一時佛遊舍衛祇樹給孤獨園。爾時	聞 如 是 一 時 佛 遊 舍 衛 祇 樹 給 孤 獨 園 爾 時 
T03n0154_002:0080c11	舍衛城中，有一異人，息男命過。父母愛重，	舍 衛 城 中 有 一 異 人 息 男 命 過 父 母 愛 重 
T03n0154_002:0080c12	無不欲念視之無厭。以子之憂，狂亂失	無 不 欲 念 視 之 無 厭 以 子 之 憂 狂 亂 失 
T03n0154_002:0080c13	志，奔走門戶中庭街路求子，願來見我，	志 奔 走 門 戶 中 庭 街 路 求 子 願 來 見 我 
T03n0154_002:0080c14	當於何所得覩汝形？於時是人隨其門	當 於 何 所 得 覩 汝 形 於 時 是 人 隨 其 門 
T03n0154_002:0080c15	路，出舍衛城，至祇樹給孤獨園，往詣佛所，	路 出 舍 衛 城 至 祇 樹 給 孤 獨 園 往 詣 佛 所 
T03n0154_002:0080c16	默然立前。佛問其人：「汝何以故本制其心，	默 然 立 前 佛 問 其 人 汝 何 以 故 本 制 其 心 
T03n0154_002:0080c17	今者諸根變沒不常，憔悴羸極？」其人白佛	今 者 諸 根 變 沒 不 常 憔 悴 羸 極 其 人 白 佛 
T03n0154_002:0080c18	言：「用為問我諸根變異。所以者何？獨有一	言 用 為 問 我 諸 根 變 異 所以者何 獨 有 一 
T03n0154_002:0080c19	子，舉家愛重，莫不敬愛，視之無厭。今以	子 舉 家 愛 重 莫 不 敬 愛 視 之 無 厭 今 以 
T03n0154_002:0080c20	命過，以子之憂，而發狂癡。其心迷亂，開軒	命 過 以 子 之 憂 而 發 狂 癡 其 心 迷 亂 開 軒 
T03n0154_002:0080c21	窗及門戶求索子，願來見我，何所求子？」	窗 及 門 戶 求 索 子 願 來 見 我 何 所 求 子 
T03n0154_002:0080c22	佛言：「其人恩愛之著，別離則憂，啼泣悲哀，憂	佛 言 其 人 恩 愛 之 著 別 離 則 憂 啼 泣 悲 哀 憂 
T03n0154_002:0080c23	惱之患，合會有離，適有所愛，必致惱患。」爾	惱 之 患 合 會 有 離 適 有 所 愛 必 致 惱 患 爾 
T03n0154_002:0080c24	時其人，聞佛所語，心中忽然了世無常，三	時 其 人 聞 佛 所 語 心 中 忽 然 了 世 無 常 三 
T03n0154_002:0080c25	世如幻，即受佛戒，稽首而退。	世 如 幻 即 受 佛 戒 稽 首 而 退 
T03n0154_002:0080c26	佛說比丘各言志經第十六	佛 說 比 丘 各 言 志 經 第 十 六 
T03n0154_002:0080c27	聞如是：一時佛遊於越祇音聲叢樹，與尊	聞 如 是 一 時 佛 遊 於 越 祇 音 聲 叢 樹 與 尊 
T03n0154_002:0080c28	比丘俱——一切聖賢，諸通已達，皆悉耆年——	比 丘 俱 一 切 聖 賢 諸 通 已 達 皆 悉 耆 年 
T03n0154_002:0080c29	其名曰賢者舍利弗、賢者大目連、賢者迦	其 名 曰 賢 者 舍 利 弗 賢 者 大 目 連 賢 者 迦 
T03n0154_002:0081a01	葉、賢者阿那律、賢者離越、賢者邠耨文陀	葉 賢 者 阿 那 律 賢 者 離 越 賢 者 邠 耨 文 陀 
T03n0154_002:0081a02	弗、賢者須菩提、賢者迦旃延、賢者優波離、	弗 賢 者 須 菩 提 賢 者 迦 旃 延 賢 者 優 波 離 
T03n0154_002:0081a03	賢者離垢、賢者名聞、賢者牛呞、賢者羅云、	賢 者 離 垢 賢 者 名 聞 賢 者 牛 呞 賢 者 羅 云 
T03n0154_002:0081a04	賢者阿難，如是之比，大比丘眾五百人。	賢 者 阿 難 如 是 之 比 大 比 丘 眾 五 百 人 
T03n0154_002:0081a05	爾時賢者大目揵連及大弟子，天欲向	爾 時 賢 者 大 目 揵 連 及 大 弟 子 天 欲 向 
T03n0154_002:0081a06	明，從坐起，往詣賢者舍利弗所。時舍	明 從 坐 起 往 詣 賢 者 舍 利 弗 所 時 舍 
T03n0154_002:0081a07	利弗遙見諸大弟子相隨而來，適覩此已，	利 弗 遙 見 諸 大 弟 子 相 隨 而 來 適 覩 此 已 
T03n0154_002:0081a08	至離越所，而謂之曰：「離越，且觀大聖眾來，	至 離 越 所 而 謂 之 曰 離 越 且 觀 大 聖 眾 來 
T03n0154_002:0081a09	諸目連等。」賢者離越，尋時往詣舍利弗所，手	諸 目 連 等 賢 者 離 越 尋 時 往 詣 舍 利 弗 所 手 
T03n0154_002:0081a10	執涼扇，詣舍利弗所。所以者何？今日且	執 涼 扇 詣 舍 利 弗 所 所以者何 今 日 且 
T03n0154_002:0081a11	當因舍利弗得聞講法，與大弟子一時	當 因 舍 利 弗 得 聞 講 法 與 大 弟 子 一 時 
T03n0154_002:0081a12	同心。時舍利弗見大弟子，尋以勞賀賢者	同 心 時 舍 利 弗 見 大 弟 子 尋 以 勞 賀 賢 者 
T03n0154_002:0081a13	阿難：「善來，阿難！能自枉屈，為佛侍者，親近	阿 難 善 來 阿 難 能 自 枉 屈 為 佛 侍 者 親 近 
T03n0154_002:0081a14	世尊，宣聖明教。當問阿難！心所懷疑。音	世 尊 宣 聖 明 教 當 問 阿 難 心 所 懷 疑 音 
T03n0154_002:0081a15	聲叢樹，為其樂乎？威神巍巍，華實茂盛，其	聲 叢 樹 為 其 樂 乎 威 神 巍 巍 華 實 茂 盛 其 
T03n0154_002:0081a16	香芬馥，柔軟悅人。云何比丘在於音聲叢樹	香 芬 馥 柔 軟 悅 人 云 何 比 丘 在 於 音 聲 叢 樹 
