T03n0154_003:0087c05	「第四人，嗟歎精進，以偈頌曰：	 第 四 人 嗟 歎 精 進 以 偈 頌 曰 
T03n0154_003:0087c06	「『精進為第一，　　精進入大海，	 精 進 為 第 一 精 進 入 大 海 
T03n0154_003:0087c07	　　能越諸患難，　　多致珍寶財。	 能 越 諸 患 難 多 致 珍 寶 財 
T03n0154_003:0087c08	　　勇猛多所能，　　由是無所礙，	 勇 猛 多 所 能 由 是 無 所 礙 
T03n0154_003:0087c09	　　家業皆成辦，　　親里敬欣戴。』	 家 業 皆 成 辦 親 里 敬 欣 戴 
T03n0154_003:0087c10	「第五人，嗟歎福德，以偈頌曰：	 第 五 人 嗟 歎 福 德 以 偈 頌 曰 
T03n0154_003:0087c11	「『福德為第一，　　所在得自然，	 福 德 為 第 一 所 在 得 自 然 
T03n0154_003:0087c12	　　富樂無有極，　　生生為福田。	 富 樂 無 有 極 生 生 為 福 田 
T03n0154_003:0087c13	　　福為天帝釋，　　梵天轉輪王，	 福 為 天 帝 釋 梵 天 轉 輪 王 
T03n0154_003:0087c14	　　亦得成佛道，　　具足道法王。』	 亦 得 成 佛 道 具 足 道 法 王 
T03n0154_003:0087c15	「各各自說己之所長，各謂第一，無能決者。	 各 各 自 說 己 之 所 長 各 謂 第 一 無 能 決 者 
T03n0154_003:0087c16	各自立意，不相為伏，轉相謂言：『吾等各當	各 自 立 意 不 相 為 伏 轉 相 謂 言 吾 等 各 當 
T03n0154_003:0087c17	自試功德，現丈夫之相，遠遊諸國，詣他	自 試 功 德 現 丈 夫 之 相 遠 遊 諸 國 詣 他 
T03n0154_003:0087c18	土地，爾乃別知殊異之德，誰為第一！』時智	土 地 爾 乃 別 知 殊 異 之 德 誰 為 第 一 時 智 
T03n0154_003:0087c19	慧者，入他國土，推問其國人民善惡？穀米	慧 者 入 他 國 土 推 問 其 國 人 民 善 惡 穀 米 
T03n0154_003:0087c20	貴賤？豪富下劣？聞其國中，有兩長者，豪富	貴 賤 豪 富 下 劣 聞 其 國 中 有 兩 長 者 豪 富 
T03n0154_003:0087c21	難及，舊共親親，中共相失，眾人搆狡，鬪使	難 及 舊 共 親 親 中 共 相 失 眾 人 搆 狡 鬪 使 
T03n0154_003:0087c22	成怨，積有年歲無能和解者。其智慧者設	成 怨 積 有 年 歲 無 能 和 解 者 其 智 慧 者 設 
T03n0154_003:0087c23	權方便，齎好饋遺百種飲食，詣長者門求	權 方 便 齎 好 饋 遺 百 種 飲 食 詣 長 者 門 求 
T03n0154_003:0087c24	索奉現。長者即見。進其所齎餽遺之具，以	索 奉 現 長 者 即 見 進 其 所 齎 餽 遺 之 具 以 
T03n0154_003:0087c25	其長者名，辭謝問訊：『前者相失，以意不及，	其 長 者 名 辭 謝 問 訊 前 者 相 失 以 意 不 及 
T03n0154_003:0087c26	眾人搆狡，遂成怨結，積年違曠，不得言	眾 人 搆 狡 遂 成 怨 結 積 年 違 曠 不 得 言 
T03n0154_003:0087c27	會。思一侍面敘其辛苦，故遣飲食饋遺之	會 思 一 侍 面 敘 其 辛 苦 故 遣 飲 食 饋 遺 之 
T03n0154_003:0087c28	物，唯見納受，無見譏責，亦無父怨母讎，	物 唯 見 納 受 無 見 譏 責 亦 無 父 怨 母 讎 
T03n0154_003:0087c29	故遣吾來，以相喻意。』其長者聞，欣然大悅：	故 遣 吾 來 以 相 喻 意 其 長 者 聞 欣 然 大 悅 
T03n0154_003:0088a01	『吾欲和解，其日久矣！但無親親以相喻意，	 吾 欲 和 解 其 日 久 矣 但 無 親 親 以 相 喻 意 
T03n0154_003:0088a02	乃復辱信，枉屈相喻，誠非所望。同念厚意，	乃 復 辱 信 枉 屈 相 喻 誠 非 所 望 同 念 厚 意 
T03n0154_003:0088a03	便順來旨，不敢違命。』其智慧者，解長者意，	便 順 來 旨 不 敢 違 命 其 智 慧 者 解 長 者 意 
T03n0154_003:0088a04	[火*霍]然無疑，辭出而退。詣第二長者，亦復	[火霍] 然 無 疑 辭 出 而 退 詣 第 二 長 者 亦 復 
T03n0154_003:0088a05	如是，解喻其意，如前所言，便共尅期，共會	如 是 解 喻 其 意 如 前 所 言 便 共 尅 期 共 會 
T03n0154_003:0088a06	其處，聚合眾人，和解仇怨。應時醼飲，	其 處 聚 合 眾 人 和 解 仇 怨 應 時 醼 飲 
T03n0154_003:0088a07	作諸伎樂，共相娛樂，各各相問本末和解	作 諸 伎 樂 共 相 娛 樂 各 各 相 問 本 末 和 解 
T03n0154_003:0088a08	意，乃知此人以善權和解兩怨令親如	意 乃 知 此 人 以 善 權 和 解 兩 怨 令 親 如 
T03n0154_003:0088a09	故，各自念言：『吾久相失，一國中人，不能	故 各 自 念 言 吾 久 相 失 一 國 中 人 不 能 
T03n0154_003:0088a10	和解，乃使此人遠來相聞和解，其恩難量，	和 解 乃 使 此 人 遠 來 相 聞 和 解 其 恩 難 量 
T03n0154_003:0088a11	非辭所盡。』各出百千兩金，而奉遺之！即持	非 辭 所 盡 各 出 百 千 兩 金 而 奉 遺 之 即 持 
T03n0154_003:0088a12	此寶，與諸兄弟，以偈頌曰：	此 寶 與 諸 兄 弟 以 偈 頌 曰 
T03n0154_003:0088a13	「『言辭所具足，　　辯能造經典，	 言 辭 所 具 足 辯 能 造 經 典 
T03n0154_003:0088a14	　　正士能博聞，　　安隱至究竟。	 正 士 能 博 聞 安 隱 至 究 竟 
T03n0154_003:0088a15	　　觀我以智慧，　　致此若干寶，	 觀 我 以 智 慧 致 此 若 干 寶 
T03n0154_003:0088a16	　　衣食自具足，　　并及布施人。』	 衣 食 自 具 足 并 及 布 施 人 
T03n0154_003:0088a17	「時第二工巧者，轉行至他國。應時國王，喜	 時 第 二 工 巧 者 轉 行 至 他 國 應 時 國 王 喜 
T03n0154_003:0088a18	諸技術，即以材木，作機關木人，形貌端正，	諸 技 術 即 以 材 木 作 機 關 木 人 形 貌 端 正 
T03n0154_003:0088a19	生人無異，衣服顏色，黠慧無比，能工歌	生 人 無 異 衣 服 顏 色 黠 慧 無 比 能 工 歌 
T03n0154_003:0088a20	舞，舉動如人，辭言：『我子生若干年，國中恭	舞 舉 動 如 人 辭 言 我 子 生 若 干 年 國 中 恭 
T03n0154_003:0088a21	敬，多所餽遺。』國王聞之，命使作伎，	敬 多 所 餽 遺 國 王 聞 之 命 使 作 伎 
T03n0154_003:0088a22	王及夫人，升閣而觀。作伎歌舞若干方便，	王 及 夫 人 升 閣 而 觀 作 伎 歌 舞 若 干 方 便 
T03n0154_003:0088a23	跪拜進止，勝於生人。王及夫人，歡喜無量。	跪 拜 進 止 勝 於 生 人 王 及 夫 人 歡喜無量 
T03n0154_003:0088a24	便角[目*翕]眼，色視夫人。王遙見之，心懷忿	便 角 [目翕] 眼 色 視 夫 人 王 遙 見 之 心 懷 忿 
T03n0154_003:0088a25	怒，促勅侍者：『斬其頭來。何以[目*翕]眼視吾	怒 促 勅 侍 者 斬 其 頭 來 何 以 [目翕] 眼 視 吾 
T03n0154_003:0088a26	夫人？謂有惡意，色視不疑。』其父啼泣，淚出	夫 人 謂 有 惡 意 色 視 不 疑 其 父 啼 泣 淚 出 
T03n0154_003:0088a27	五行，長跪請命：『吾有一子，甚重愛之，坐	五 行 長 跪 請 命 吾 有 一 子 甚 重 愛 之 坐 
T03n0154_003:0088a28	起進退，以解憂思，愚意不及，有是失耳。	起 進 退 以 解 憂 思 愚 意 不 及 有 是 失 耳 
T03n0154_003:0088a29	假使殺者，我共當死，唯以加哀，原其罪	假 使 殺 者 我 共 當 死 唯 以 加 哀 原 其 罪 
T03n0154_003:0088b01	舋。』時王恚甚，不肯聽之。復白王言：『若不	舋 時 王 恚 甚 不 肯 聽 之 復 白 王 言 若 不 
T03n0154_003:0088b02	活者，願自手殺，勿使餘人。』王便可之。則	活 者 願 自 手 殺 勿 使 餘 人 王 便 可 之 則 
T03n0154_003:0088b03	拔一肩榍，機關解落，碎散在地。王乃驚	拔 一 肩 榍 機 關 解 落 碎 散 在 地 王 乃 驚 
T03n0154_003:0088b04	愕：『吾身云何瞋於材木？此人工巧，天下無	愕 吾 身 云 何 瞋 於 材 木 此 人 工 巧 天 下 無 
T03n0154_003:0088b05	雙，作此機關，三百六十節，勝於生人！』即以	雙 作 此 機 關 三 百 六 十 節 勝 於 生 人 即 以 
T03n0154_003:0088b06	賞賜億萬兩金。即持金出，與諸兄弟，令	賞 賜 億 萬 兩 金 即 持 金 出 與 諸 兄 弟 令 
T03n0154_003:0088b07	飲食之，以偈頌曰：	飲 食 之 以 偈 頌 曰 
T03n0154_003:0088b08	「『觀此工巧者，　　多所而成就，	 觀 此 工 巧 者 多 所 而 成 就 
T03n0154_003:0088b09	　　機關為木人，　　過踰於生者。	 機 關 為 木 人 過 踰 於 生 者 
T03n0154_003:0088b10	　　歌舞現伎樂，　　令尊者歡喜，	 歌 舞 現 伎 樂 令 尊 者 歡 喜 
T03n0154_003:0088b11	　　得賞若干寶，　　誰為最第一？』	 得 賞 若 干 寶 誰 為 最 第 一 
T03n0154_003:0088b12	「第三端正者，轉詣他國。人民聞有端正者	 第 三 端 正 者 轉 詣 他 國 人 民 聞 有 端 正 者 
T03n0154_003:0088b13	從遠方來，色像第一，世間希有，人民皆	從 遠 方 來 色 像 第 一 世 間 希 有 人 民 皆 
T03n0154_003:0088b14	往奉迎，飲食百味，金銀珍寶，用上遺之。其	往 奉 迎 飲 食 百 味 金 銀 珍 寶 用 上 遺 之 其 
T03n0154_003:0088b15	人作伎，眾庶益悅，瞻戴光顏，如星中月，驕	人 作 伎 眾 庶 益 悅 瞻 戴 光 顏 如 星 中 月 驕 
T03n0154_003:0088b16	貴之女，多有財寶，眾藏盈滿，獻致珍異無	貴 之 女 多 有 財 寶 眾 藏 盈 滿 獻 致 珍 異 無 
T03n0154_003:0088b17	數億寶。得此寶已，與諸兄弟，以偈頌曰：	數 億 寶 得 此 寶 已 與 諸 兄 弟 以 偈 頌 曰 
T03n0154_003:0088b18	「『善哉色如花，　　端正顏貌足，	 善 哉 色 如 花 端 正 顏 貌 足 
T03n0154_003:0088b19	　　女人所尊敬，　　又得常安隱。	 女 人 所 尊 敬 又 得 常 安 隱 
T03n0154_003:0088b20	　　眾人所觀察，　　猶如星中月，	 眾 人 所 觀 察 猶 如 星 中 月 
T03n0154_003:0088b21	　　今致若干寶，　　自食并施人。』	 今 致 若 干 寶 自 食 并 施 人 
T03n0154_003:0088b22	「第四精進者，轉詣他國。到一江邊，見一栴	 第 四 精 進 者 轉 詣 他 國 到 一 江 邊 見 一 栴 
T03n0154_003:0088b23	檀樹，隨流來下，脫衣入水，泅截接取。國王	檀 樹 隨 流 來 下 脫 衣 入 水 泅 截 接 取 國 王 
T03n0154_003:0088b24	家急求栴檀，即載送上，金得百萬，所得	家 急 求 栴 檀 即 載 送 上 金 得 百 萬 所 得 
T03n0154_003:0088b25	之寶，不可稱計。與諸兄弟，以偈頌曰：	之 寶 不可稱計 與 諸 兄 弟 以 偈 頌 曰 
T03n0154_003:0088b26	「『精進最第一，　　勇猛能入海，	 精 進 最 第 一 勇 猛 能 入 海 
T03n0154_003:0088b27	　　致於眾珍寶，　　以給家親屬。	 致 於 眾 珍 寶 以 給 家 親 屬 
T03n0154_003:0088b28	　　賴我浮江水，　　接得妙栴檀，	 賴 我 浮 江 水 接 得 妙 栴 檀 
T03n0154_003:0088b29	　　致金若干數，　　自食及施人。』	 致 金 若 干 數 自 食 及 施 人 
T03n0154_003:0088c01	「第五福德者，轉詣大國。時天暑熱，臥于樹	 第 五 福 德 者 轉 詣 大 國 時 天 暑 熱 臥 于 樹 
T03n0154_003:0088c02	下，日時昳中，餘樹蔭移。此人所臥，樹蔭不	下 日 時 昳 中 餘 樹 蔭 移 此 人 所 臥 樹 蔭 不 
T03n0154_003:0088c03	動，威神巍巍，端正姝好，猶如日月。彼國王	動 威 神 巍 巍 端 正 姝 好 猶 如 日 月 彼 國 王 
T03n0154_003:0088c04	薨，無有太子可嗣立者，眾人議言：『當求	薨 無 有 太 子 可 嗣 立 者 眾 人 議 言 當 求 
T03n0154_003:0088c05	賢士以為國主！』募人四出，選擇國內可應	賢 士 以 為 國 主 募 人 四 出 選 擇 國 內 可 應 
T03n0154_003:0088c06	立者。使者按行，見一樹下，有此一人，於	立 者 使 者 按 行 見 一 樹 下 有 此 一 人 於 
T03n0154_003:0088c07	世希有，臥於樹下，樹蔭不移，心自念言：『此	世 希 有 臥 於 樹 下 樹 蔭 不 移 心 自 念 言 此 
T03n0154_003:0088c08	非凡人，應為國主！』尋往遍啟國之大臣，	非 凡 人 應 為 國 主 尋 往 遍 啟 國 之 大 臣 
T03n0154_003:0088c09	具說本末。於時群臣即嚴威儀，導從騎乘，	具 說 本 末 於 時 群 臣 即 嚴 威 儀 導 從 騎 乘 
T03n0154_003:0088c10	印綬冠幘，車駕衣服，則往奉迎。洗沐塗香，	印 綬 冠 幘 車 駕 衣 服 則 往 奉 迎 洗 沐 塗 香 
T03n0154_003:0088c11	衣冠被服，佩帶畢訖，皆拜謁稱臣。昇車入	衣 冠 被 服 佩 帶 畢 訖 皆 拜 謁 稱 臣 昇 車 入 
T03n0154_003:0088c12	宮，南面立詔，國即太平，風雨時節。即時	宮 南 面 立 詔 國 即 太 平 風 雨 時 節 即 時 
T03n0154_003:0088c13	勅外：『詔有四人：一者智慧、二者工巧、三者	勅 外 詔 有 四 人 一 者 智 慧 二 者 工 巧 三 者 
T03n0154_003:0088c14	端正、四者精進，召至中閤。』一時俱集，令	端 正 四 者 精 進 召 至 中 閤 一 時 俱 集 令 
T03n0154_003:0088c15	住侍衛。時福德王，以偈頌曰：	住 侍 衛 時 福 德 王 以 偈 頌 曰 
T03n0154_003:0088c16	「『有福功德者，　　得為天帝釋，	 有 福 功 德 者 得 為 天 帝 釋 
T03n0154_003:0088c17	　　帝王轉輪王，　　亦得為梵王。	 帝 王 轉 輪 王 亦 得 為 梵 王 
T03n0154_003:0088c18	　　智慧及工巧，　　端正并精進，	 智 慧 及 工 巧 端 正 并 精 進 
T03n0154_003:0088c19	　　皆詣福德門，　　侍立為臣僕。』	 皆 詣 福 德 門 侍 立 為 臣 僕 
T03n0154_003:0088c20	「時福德王，遂以高位，署諸兄弟，各令得所。」	 時 福 德 王 遂 以 高 位 署 諸 兄 弟 各 令 得 所 
T03n0154_003:0088c21	佛告諸比丘：「爾時智慧者，則舍利弗是；工巧	佛 告 諸 比 丘 爾 時 智 慧 者 則 舍 利 弗 是 工 巧 
T03n0154_003:0088c22	者，則阿那律是；端正者，則阿難是；精進者，則	者 則 阿 那 律 是 端 正 者 則 阿 難 是 精 進 者 則 
T03n0154_003:0088c23	輸輪是；福德王者，即吾身是。此等爾時	輸 輪 是 福 德 王 者 即 吾 身 是 此 等 爾 時 
T03n0154_003:0088c24	各自稱歎己之所長，以為第一，於今亦然。	各 自 稱 歎 己 之 所 長 以 為 第 一 於 今 亦 然 
T03n0154_003:0088c25	昔爾時世皆不如吾，而各自嗟歎。吾成佛	昔 爾 時 世 皆 不 如 吾 而 各 自 嗟 歎 吾 成 佛 
T03n0154_003:0088c26	道，三界之尊，今皆歸吾以為弟子，依佛得	道 三 界 之 尊 今 皆 歸 吾 以 為 弟 子 依 佛 得 
T03n0154_003:0088c27	度。」佛說如是，莫不歡喜。	度 佛 說 如 是 莫 不 歡 喜 
T03n0154_003:0088c28	佛說蠱狐烏經第二十五	佛 說 蠱 狐 烏 經 第 二 十 五 
T03n0154_003:0088c29	聞如是：一時佛遊舍衛祇樹給孤獨園，與	聞 如 是 一 時 佛 遊 舍 衛 祇 樹 給 孤 獨 園 與 
T03n0154_003:0089a01	大比丘眾千二百五十人俱。爾時佛告諸比	大 比 丘 眾 千二百五十 人 俱 爾 時 佛 告 諸 比 
T03n0154_003:0089a02	丘：「調達凶危，橫見嗟歎者，不得其理。」拘迦	丘 調 達 凶 危 橫 見 嗟 歎 者 不 得 其 理 拘 迦 
T03n0154_003:0089a03	利比丘嗟歎調達，調達亦復歎拘迦利比	利 比 丘 嗟 歎 調 達 調 達 亦 復 歎 拘 迦 利 比 
T03n0154_003:0089a04	丘。其彼二人，橫相嗟歎，無義無理。諸比	丘 其 彼 二 人 橫 相 嗟 歎 無 義 無 理 諸 比 
T03n0154_003:0089a05	丘聞，往白世尊：「唯然，大聖！觀拘迦利比丘，	丘 聞 往 白 世 尊 唯 然 大 聖 觀 拘 迦 利 比 丘 
T03n0154_003:0089a06	因依正典，緣法律教，以信出家，而為沙門；	因 依 正 典 緣 法 律 教 以 信 出 家 而 為 沙 門 
T03n0154_003:0089a07	橫歎調達，以非為是，不得義理。又彼調	橫 歎 調 達 以 非 為 是 不 得 義 理 又 彼 調 
T03n0154_003:0089a08	達嗟歎拘迦利比丘，以非為是，以是為	達 嗟 歎 拘 迦 利 比 丘 以 非 為 是 以 是 為 
T03n0154_003:0089a09	非。」佛告諸比丘：「今此輩愚騃之等，不但今	非 佛 告 諸 比 丘 今 此 輩 愚 騃 之 等 不 但 今 
T03n0154_003:0089a10	世橫相嗟歎，以非為是、以是為非，前世亦	世 橫 相 嗟 歎 以 非 為 是 以 是 為 非 前 世 亦 
T03n0154_003:0089a11	然。乃往過去久遠世時，黃門命過，親里即	然 乃往過去 久 遠 世 時 黃 門 命 過 親 里 即 
T03n0154_003:0089a12	取棄樗樹間。彼時蠱狐烏鳥，來食其肉，時	取 棄 樗 樹 間 彼 時 蠱 狐 烏 鳥 來 食 其 肉 時 
T03n0154_003:0089a13	共相嗟歎。樹間烏為狐說偈曰：	共 相 嗟 歎 樹 間 烏 為 狐 說 偈 曰 
T03n0154_003:0089a14	「『君體如師子，　　其頭如仙人，	 君 體 如 師 子 其 頭 如 仙 人 
T03n0154_003:0089a15	　　脂猶鹿中王，　　善哉如好華。』	 脂 猶 鹿 中 王 善 哉 如 好 華 
T03n0154_003:0089a16	「於時蠱狐即樹間，以偈讚曰：	 於 時 蠱 狐 即 樹 間 以 偈 讚 曰 
T03n0154_003:0089a17	「『誰尊在樹上，　　其慧第一最，	 誰 尊 在 樹 上 其 慧 第 一 最 
T03n0154_003:0089a18	　　其明炤十方，　　如積紫磨金。』	 其 明 炤 十 方 如 積 紫 磨 金 
T03n0154_003:0089a19	「於時烏以偈報，頌曰：	 於 時 烏 以 偈 報 頌 曰 
T03n0154_003:0089a20	「『君則大師子，　　欲見君故來，	 君 則 大 師 子 欲 見 君 故 來 
T03n0154_003:0089a21	　　君脂如鹿王，　　善哉得利義。』	 君 脂 如 鹿 王 善 哉 得 利 義 
T03n0154_003:0089a22	「蠱狐復以偈報，頌曰：	 蠱 狐 復 以 偈 報 頌 曰 
T03n0154_003:0089a23	「『誠信實相知，　　俱相歎至誠，	 誠 信 實 相 知 俱 相 歎 至 誠 
T03n0154_003:0089a24	　　合積紫磨金，　　所問服食此。』	 合 積 紫 磨 金 所 問 服 食 此 
T03n0154_003:0089a25	「爾時，去彼不遠有大仙人，處於閑居淨修	 爾 時 去 彼 不 遠 有 大 仙 人 處 於 閑 居 淨 修 
T03n0154_003:0089a26	為道。聞狐及烏轉共相譽，心自念言：『彼等	為 道 聞 狐 及 烏 轉 共 相 譽 心 自 念 言 彼 等 
T03n0154_003:0089a27	之類，橫相咨嗟，彼言皆虛，無一誠實。』以偈	之 類 橫 相 咨 嗟 彼 言 皆 虛 無 一 誠 實 以 偈 
T03n0154_003:0089a28	問曰：	問 曰 
T03n0154_003:0089a29	「『吾久見所興，　　至此俱兩舌，	 吾 久 見 所 興 至 此 俱 兩 舌 
T03n0154_003:0089b01	　　自藏於樹間，　　俱食於人肉。』	 自 藏 於 樹 間 俱 食 於 人 肉 
T03n0154_003:0089b02	「於時烏瞋恚，以偈報仙人：	 於 時 烏 瞋 恚 以 偈 報 仙 人 
T03n0154_003:0089b03	「『師子及孔雀，　　共食於禽肉，	 師 子 及 孔 雀 共 食 於 禽 肉 
T03n0154_003:0089b04	　　於彼髠滅頭，　　次第而求活。』	 於 彼 髠 滅 頭 次 第 而 求 活 
T03n0154_003:0089b05	「仙人以偈答曰：	 仙 人 以 偈 答 曰 
T03n0154_003:0089b06	「『樗樹臭下極，　　一切鳥所惡，	 樗 樹 臭 下 極 一 切 鳥 所 惡 
T03n0154_003:0089b07	　　眾鹿所依因，　　棄死黃門身。	 眾 鹿 所 依 因 棄 死 黃 門 身 
T03n0154_003:0089b08	　　汝輩下賤物，　　俱來聚會此，	 汝 輩 下 賤 物 俱 來 聚 會 此 
T03n0154_003:0089b09	　　食於黃門身，　　自稱為上人。』」	 食 於 黃 門 身 自 稱 為 上 人 
T03n0154_003:0089b10	佛告諸比丘：「欲知，爾時蠱狐者，調達是；烏	佛 告 諸 比 丘 欲 知 爾 時 蠱 狐 者 調 達 是 烏 
T03n0154_003:0089b11	者，拘迦利是；仙人者，則菩薩是。爾時俱共相	者 拘 迦 利 是 仙 人 者 則 菩 薩 是 爾 時 俱 共 相 
T03n0154_003:0089b12	歎，以非為是、以是為非，於今亦然。」	歎 以 非 為 是 以 是 為 非 於 今 亦 然 
T03n0154_003:0089b13	佛說比丘疾病經第二十六	佛 說 比 丘 疾 病 經 第 二 十 六 
T03n0154_003:0089b14	聞如是：一時佛遊舍衛祇樹給孤獨園，與	聞 如 是 一 時 佛 遊 舍 衛 祇 樹 給 孤 獨 園 與 
T03n0154_003:0089b15	大比丘千二百五十人俱。時一比丘，疾病困	大 比 丘 千二百五十 人 俱 時 一 比 丘 疾 病 困 
T03n0154_003:0089b16	篤獨自一身，無有等類，無有視者，亦無	篤 獨 自 一 身 無 有 等 類 無 有 視 者 亦 無 
T03n0154_003:0089b17	醫藥衣被飯食，不能起居，惡露自出。身臥	醫 藥 衣 被 飯 食 不 能 起 居 惡 露 自 出 身 臥 
T03n0154_003:0089b18	其上，四向顧視，無來救濟者，便自歎息：「今	其 上 四 向 顧 視 無 來 救 濟 者 便 自 歎 息 今 
T03n0154_003:0089b19	日吾身，無救無護！」時阿難見，往白佛：「唯然	日 吾 身 無 救 無 護 時 阿 難 見 往 白 佛 唯 然 
T03n0154_003:0089b20	大聖！吾身今日，得未曾有。如來世尊大慈	大 聖 吾 身 今 日 得未曾有 如 來 世 尊 大 慈 
T03n0154_003:0089b21	大哀，有苦比丘，當念救濟。吾乃往世無	大 哀 有 苦 比 丘 當 念 救 濟 吾 乃 往 世 無 
T03n0154_003:0089b22	數劫時，救此比丘疾病之患，於今世亦然。	數 劫 時 救 此 比 丘 疾 病 之 患 於 今 世 亦 然 
T03n0154_003:0089b23	乃往過去久遠世時，於空閑處，多神仙五通	乃往過去 久 遠 世 時 於 空 閑 處 多 神 仙 五 通 
T03n0154_003:0089b24	學者，在彼獨處，各各相勸，轉相佐助。各各	學 者 在 彼 獨 處 各 各 相 勸 轉 相 佐 助 各 各 
T03n0154_003:0089b25	取果，以相給足，以作籌筭，設使疾病，轉相	取 果 以 相 給 足 以 作 籌 筭 設 使 疾 病 轉 相 
T03n0154_003:0089b26	瞻療。時有摩納學志，有所緩急，常馳走	瞻 療 時 有 摩 納 學 志 有 所 緩 急 常 馳 走 
T03n0154_003:0089b27	趣。有一學志，若有急緩疾病之厄，初不視	趣 有 一 學 志 若 有 急 緩 疾 病 之 厄 初 不 視 
T03n0154_003:0089b28	瞻。時彼學志，有急緩時，無有救者，則自獨	瞻 時 彼 學 志 有 急 緩 時 無 有 救 者 則 自 獨 
T03n0154_003:0089b29	立，無伴無侶。彼於異時，身得疾病，無療	立 無 伴 無 侶 彼 於 異 時 身 得 疾 病 無 療 
T03n0154_003:0089c01	瞻者，亦無持果授與食者。是時五通仙人	瞻 者 亦 無 持 果 授 與 食 者 是 時 五 通 仙 人 
T03n0154_003:0089c02	見彼和上，見之如是，心自念言：『此人孤	見 彼 和 上 見 之 如 是 心 自 念 言 此 人 孤 
T03n0154_003:0089c03	獨，無有救護。』心慜念之，即往到其所，即問	獨 無有救護 心 慜 念 之 即 往 到 其 所 即 問 
T03n0154_003:0089c04	之曰：『摩納學志！卿強健時，頗有消息，問訊	之 曰 摩 納 學 志 卿 強 健 時 頗 有 消 息 問 訊 
T03n0154_003:0089c05	不寧，有親厚朋友乎？』即時報曰：『無也！和	不 寧 有 親 厚 朋 友 乎 即 時 報 曰 無 也 和 
T03n0154_003:0089c06	上亦無親友知識之厚，我之父母，家屬親	上 亦 無 親 友 知 識 之 厚 我 之 父 母 家 屬 親 
T03n0154_003:0089c07	里，去此大遠。』又問曰：『此梵志共頓一處，不	里 去 此 大 遠 又 問 曰 此 梵 志 共 頓 一 處 不 
T03n0154_003:0089c08	與親友結為知識耶？』答曰：『無也！』和上答	與 親 友 結 為 知 識 耶 答 曰 無 也 和 上 答 
T03n0154_003:0089c09	曰：『不結親友，無有知識，以何為人？卿見	曰 不 結 親 友 無 有 知 識 以 何 為 人 卿 見 
T03n0154_003:0089c10	餘人，展轉相敬，展轉相事，卿獨不也？今日孤	餘 人 展 轉 相 敬 展 轉 相 事 卿 獨 不 也 今 日 孤 
T03n0154_003:0089c11	獨，無救護。』於時仙人，扶接摩納，使之令	獨 無 救 護 於 時 仙 人 扶 接 摩 納 使 之 令 
T03n0154_003:0089c12	坐，將詣自所頓處，勸之安心，將詣親厚	坐 將 詣 自 所 頓 處 勸 之 安 心 將 詣 親 厚 
T03n0154_003:0089c13	而以療治，則頌偈曰：	而 以 療 治 則 頌 偈 曰 
T03n0154_003:0089c14	「『棄捐于妻子，　　出家無所慕，	 棄 捐 于 妻 子 出 家 無 所 慕 
T03n0154_003:0089c15	　　卿和上為父，　　等類則兄弟。	 卿 和 上 為 父 等 類 則 兄 弟 
T03n0154_003:0089c16	　　頓與梵志俱，　　而不相供視，	 頓 與 梵 志 俱 而 不 相 供 視 
T03n0154_003:0089c17	　　得疾病困篤，　　孤獨無所依。	 得 疾 病 困 篤 孤 獨 無 所 依 
T03n0154_003:0089c18	　　察子見此已，　　梵行為親友，	 察 子 見 此 已 梵 行 為 親 友 
T03n0154_003:0089c19	　　普行子恭敬，　　展轉相瞻視。』」	 普 行 子 恭 敬 展 轉 相 瞻 視 
T03n0154_003:0089c20	時佛世尊往詣比丘，而問之曰：「今得疾病，	時 佛 世 尊 往 詣 比 丘 而 問 之 曰 今 得 疾 病 
T03n0154_003:0089c21	有瞻視醫藥床臥具乎？」白曰：「孤獨無瞻視	有 瞻 視 醫 藥 床 臥 具 乎 白 曰 孤 獨 無 瞻 視 
T03n0154_003:0089c22	者，無醫無藥，去家甚遠，離於父母無有	者 無 醫 無 藥 去 家 甚 遠 離 於 父 母 無 有 
T03n0154_003:0089c23	兄弟，親里伴侶，無供侍者。」世尊又問：「卿強	兄 弟 親 里 伴 侶 無 供 侍 者 世 尊 又 問 卿 強 
T03n0154_003:0089c24	健時，頗瞻視問訊有疾者不？」答曰：「不也！」	健 時 頗 瞻 視 問 訊 有 疾 者 不 答 曰 不 也 
T03n0154_003:0089c25	世尊告曰：「卿強健時，不瞻視人，不問訊疾	世 尊 告 曰 卿 強 健 時 不 瞻 視 人 不 問 訊 疾 
T03n0154_003:0089c26	病，誰當瞻視卿乎？善惡有對，罪福有報，	病 誰 當 瞻 視 卿 乎 善 惡 有 對 罪 福 有 報 
