T03n0178_001:0447c22	前世三轉經	前 世 三 轉 經 
T03n0178_001:0447c24	西晉沙門法炬譯	西 晉 沙 門 法 炬 譯 
T03n0178_001:0447c25	聞如是：一時，佛遊於舍衛國祇樹給孤獨園，	聞 如 是 一 時 佛 遊 於 舍 衛 國 祇 樹 給 孤 獨 園 
T03n0178_001:0447c26	與大比丘眾五百人，皆阿羅漢也。一切大	與 大 比 丘 眾 五 百 人 皆 阿 羅 漢 也 一 切 大 
T03n0178_001:0447c27	聖皆其上尊，悉知他人心所念，獨阿難未也。	聖 皆 其 上 尊 悉 知 他 人 心 所 念 獨 阿 難 未 也 
T03n0178_001:0447c28	爾時，佛出精舍坐於虛空，為無央數百千眾	爾 時 佛 出 精 舍 坐 於 虛 空 為 無 央 數 百 千 眾 
T03n0178_001:0447c29	會圍繞，而為說法，及七萬菩薩，皆得諸總	會 圍 繞 而 為 說 法 及 七 萬 菩 薩 皆 得 諸 總 
T03n0178_001:0448a01	持。彼時，佛面色光明勝常時，光明從面出，往	持 彼 時 佛 面 色 光 明 勝 常 時 光 明 從 面 出 往 
T03n0178_001:0448a02	照遍諸世界。時佛便笑，五色光從口出，上	照 遍 諸 世 界 時 佛 便 笑 五 色 光 從 口 出 上 
T03n0178_001:0448a03	至梵天。諸佛天中天授諸弟子決時，光往照	至 梵 天 諸 佛 天 中 天 授 諸 弟 子 決 時 光 往 照 
T03n0178_001:0448a04	四天王，光還照佛三匝，從足心入。諸佛天	四 天 王 光 還 照 佛 三 匝 從 足 心 入 諸 佛 天 
T03n0178_001:0448a05	中天授辟支佛道決時，光從口中出，往照	中 天 授 辟支佛道 決 時 光 從 口 中 出 往 照 
T03n0178_001:0448a06	波羅尼蜜天，還繞佛三匝從臍入。諸佛天中	波 羅 尼 蜜 天 還 繞 佛 三 匝 從 臍 入 諸 佛 天 中 
T03n0178_001:0448a07	天授佛道決時，光往照梵天，還繞佛三匝	天 授 佛 道 決 時 光 往 照 梵 天 還 繞 佛 三 匝 
T03n0178_001:0448a08	從頂入。是時地神皆同時舉聲：「如是佛見	從 頂 入 是 時 地 神 皆 同 時 舉 聲 如 是 佛 見 
T03n0178_001:0448a09	三事，若過去、當來、今現在，說種種決。」虛空神	三 事 若 過 去 當 來 今 現 在 說 種 種 決 虛 空 神 
T03n0178_001:0448a10	天、四天王、忉利天、上至梵天，皆舉作聲：「如是	天 四 天 王 忉 利 天 上 至 梵 天 皆 舉 作 聲 如 是 
T03n0178_001:0448a11	說三事種種決，過去、當來、今現在，為授弟	說 三 事 種 種 決 過 去 當 來 今 現 在 為 授 弟 
T03n0178_001:0448a12	子地決、為授辟支佛地決、為授佛地決。」時，	子 地 決 為 授 辟支佛地 決 為 授 佛 地 決 時 
T03n0178_001:0448a13	梵天皆來下，上至三十三天人皆來下。爾時，	梵 天 皆 來 下 上 至 三十三天 人 皆 來 下 爾 時 
T03n0178_001:0448a14	無央數百千人會，比丘、比丘尼、優婆塞、優婆	無 央 數 百 千 人 會 比 丘 比 丘 尼 優 婆 塞 優 婆 
T03n0178_001:0448a15	夷。賢者阿難，時知七法事，何等為七：一者、	夷 賢 者 阿 難 時 知 七 法 事 何 等 為 七 一 者 
T03n0178_001:0448a16	知義；二者、解法；三者、曉時；四者、了節；五	知 義 二 者 解 法 三 者 曉 時 四 者 了 節 五 
T03n0178_001:0448a17	者、明眾；六者、知身事；七者、知他人事。賢者	者 明 眾 六 者 知 身 事 七 者 知 他 人 事 賢 者 
T03n0178_001:0448a18	阿難從座起，整衣被長跪叉手，以偈讚佛	阿 難 從 座 起 整 衣 被 長 跪 叉 手 以 偈 讚 佛 
T03n0178_001:0448a19	言：	言 
T03n0178_001:0448a20	「得清淨智眼明好，　　尊根寂定度無極，	 得 清 淨 智 眼 明 好 尊 根 寂 定 度 無 極 
T03n0178_001:0448a21	　光明遠照而金色，　　神照誰得願說之。	 光 明 遠 照 而 金 色 神 照 誰 得 願 說 之 
T03n0178_001:0448a22	　誰今發意於佛道？　　誰坐樹下降伏魔？	 誰 今 發 意 於 佛 道 誰 坐 樹 下 降 伏 魔 
T03n0178_001:0448a23	　誰今取佛上道利？　　月面願說何故笑？	 誰 今 取 佛 上 道 利 月 面 願 說 何 故 笑 
T03n0178_001:0448a24	　若佛世尊笑之時，　　面出光笑勝於人，	 若 佛 世 尊 笑 之 時 面 出 光 笑 勝 於 人 
T03n0178_001:0448a25	　應時百千人民會，　　今佛以緣當說之。」	 應 時 百 千 人 民 會 今 佛 以 緣 當 說 之 
T03n0178_001:0448a26	阿難問佛：「惟，天中天！諸有婬怒癡者，以	阿 難 問 佛 惟 天 中 天 諸 有 婬 怒 癡 者 以 
T03n0178_001:0448a27	色、聲、香、味、細滑、法故笑；天中天斷婬怒癡，用	色 聲 香 味 細 滑 法 故 笑 天 中 天 斷 婬 怒 癡 用 
T03n0178_001:0448a28	何故笑？天中天！不是舍利弗所問？亦不是	何 故 笑 天 中 天 不 是 舍 利 弗 所 問 亦 不 是 
T03n0178_001:0448a29	摩訶目犍連、摩訶迦葉、優為迦葉、迦翼迦葉、那	摩 訶 目 犍 連 摩 訶 迦 葉 優 為 迦 葉 迦 翼 迦 葉 那 
T03n0178_001:0448b01	翼迦葉、施羅比利迦私所問？諸佛天中天，有	翼 迦 葉 施 羅 比 利 迦 私 所 問 諸 佛 天 中 天 有 
T03n0178_001:0448b02	六法不共。何等為六？一者、諸佛天中天，知過	六 法 不 共 何 等 為 六 一 者 諸 佛 天 中 天 知 過 
T03n0178_001:0448b03	去無所罣礙慧；二者、諸佛天中天，有當來	去 無 所 罣 礙 慧 二 者 諸 佛 天 中 天 有 當 來 
T03n0178_001:0448b04	無所罣礙慧；三者、諸佛天中天，今現在亦有	無 所 罣 礙 慧 三 者 諸 佛 天 中 天 今 現 在 亦 有 
T03n0178_001:0448b05	無所罣礙慧；四者、諸佛天中天，身所行智慧；	無 所 罣 礙 慧 四 者 諸 佛 天 中 天 身 所 行 智 慧 
T03n0178_001:0448b06	五者、諸佛天中天，口所說智慧；六者、諸佛天	五 者 諸 佛 天 中 天 口 所 說 智 慧 六 者 諸 佛 天 
T03n0178_001:0448b07	中天，心念智慧，是為六。諸佛天中天，無有	中 天 心 念 智 慧 是 為 六 諸 佛 天 中 天 無 有 
T03n0178_001:0448b08	不見聞諸佛說佛道慧。」佛告阿難：「過世	不 見 聞 諸 佛 說 佛 道 慧 佛 告 阿 難 過 世 
T03n0178_001:0448b09	時，有國名優波羅越，其國富樂熾盛五穀豐	時 有 國 名 優 波 羅 越 其 國 富 樂 熾 盛 五 穀 豐 
T03n0178_001:0448b10	熟，人民安隱眾多不可得計。」佛語阿難：	熟 人 民 安 隱 眾 多 不 可 得 計 佛 語 阿 難 
T03n0178_001:0448b11	「爾時，優波羅越國中，有王名波羅先。於諸國	 爾 時 優 波 羅 越 國 中 有 王 名 波 羅 先 於 諸 國 
T03n0178_001:0448b12	中獨尊，所施行教敕使人，正法治國鞭杖不	中 獨 尊 所 施 行 教 敕 使 人 正 法 治 國 鞭 杖 不 
T03n0178_001:0448b13	行；爾時，人民長壽二萬歲。時其王命過，其	行 爾 時 人 民 長 壽 二 萬 歲 時 其 王 命 過 其 
T03n0178_001:0448b14	國中有一婬妷女，為上色面貌、端正姝好，	國 中 有 一 婬 妷 女 為 上 色 面 貌 端 正 姝 好 
T03n0178_001:0448b15	其女人往至他人舍，其主人生男，便以手	其 女 人 往 至 他 人 舍 其 主 人 生 男 便 以 手 
T03n0178_001:0448b16	牽子臂。婬女便問之：『牽兒欲作何等？』報	牽 子 臂 婬 女 便 問 之 牽 兒 欲 作 何 等 報 
T03n0178_001:0448b17	言：『我飢餓欲噉之。』問言：『無有飯可食之耶？』	言 我 飢 餓 欲 噉 之 問 言 無 有 飯 可 食 之 耶 
T03n0178_001:0448b18	報言：『無有也。』婬女人報言：『且待，須我為	報 言 無 有 也 婬 女 人 報 言 且 待 須 我 為 
T03n0178_001:0448b19	汝持食來。』答曰：『卿未出門頃，我當餓死，那	汝 持 食 來 答 曰 卿 未 出 門 頃 我 當 餓 死 那 
T03n0178_001:0448b20	能須卿持飯來耶！』婬女人念言：『若我持兒	能 須 卿 持 飯 來 耶 婬 女 人 念 言 若 我 持 兒 
T03n0178_001:0448b21	去，其母便當餓死；若置去者，便當取兒噉	去 其 母 便 當 餓 死 若 置 去 者 便 當 取 兒 噉 
T03n0178_001:0448b22	之。將當奈何令母子各得安隱？』婬女人即取	之 將 當 奈 何 令 母 子 各 得 安 隱 婬 女 人 即 取 
T03n0178_001:0448b23	利刀，自割兩乳與之，其母便食之。婬女人	利 刀 自 割 兩 乳 與 之 其 母 便 食 之 婬 女 人 
T03n0178_001:0448b24	問言：『卿為飽未？』報言：『已飽矣。』婬女人兩乳	問 言 卿 為 飽 未 報 言 已 飽 矣 婬 女 人 兩 乳 
T03n0178_001:0448b25	血出流離，便還其家。「時，有一男子至其婬女	血 出 流 離 便 還 其 家 時 有 一 男 子 至 其 婬 女 
T03n0178_001:0448b26	人舍，欲與共作非法，見之便言：『誰取此上	人 舍 欲 與 共 作 非 法 見 之 便 言 誰 取 此 上 
T03n0178_001:0448b27	色女乳，割如是耶？』便有悲意，以姊弟心侍	色 女 乳 割 如 是 耶 便 有 悲 意 以 姊 弟 心 侍 
T03n0178_001:0448b28	之，不復起欲心。男子即問言：『姊！誰取卿如	之 不 復 起 欲 心 男 子 即 問 言 姊 誰 取 卿 如 
T03n0178_001:0448b29	是耶？』報言：『無有嬈我者也，我自至他舍，其	是 耶 報 言 無 有 嬈 我 者 也 我 自 至 他 舍 其 
T03n0178_001:0448c01	主人適產，生便牽其子。我問言：「欲作何等？」	主 人 適 產 生 便 牽 其 子 我 問 言 欲 作 何 等 
T03n0178_001:0448c02	報我言：「我飢餓，欲取子肉噉之。」我問：「卿無	報 我 言 我 飢 餓 欲 取 子 肉 噉 之 我 問 卿 無 
T03n0178_001:0448c03	有飯可食耶？」報我言：「無有也。」我言：「且待須，	有 飯 可 食 耶 報 我 言 無 有 也 我 言 且 待 須 
T03n0178_001:0448c04	我為汝持飯來。」報我言：「卿去未及出門頃，	我 為 汝 持 飯 來 報 我 言 卿 去 未 及 出 門 頃 
T03n0178_001:0448c05	我便餓死。」我心念：「適持兒去，母便當死；	我 便 餓 死 我 心 念 適 持 兒 去 母 便 當 死 
T03n0178_001:0448c06	若捨去者，則當取兒噉。」我便割乳便與噉	若 捨 去 者 則 當 取 兒 噉 我 便 割 乳 便 與 噉 
T03n0178_001:0448c07	之。』其男子聞之言，即躃地奄絕。婬女便	之 其 男 子 聞 之 言 即 躃 地 奄 絕 婬 女 便 
T03n0178_001:0448c08	取水灑其上，其久乃得穌息。男子問言：『姉	取 水 灑 其 上 其 久 乃 得 穌 息 男 子 問 言 姉 
T03n0178_001:0448c09	當為我現至誠？』婬女言：『諾！』男子言：『我初	當 為 我 現 至 誠 婬 女 言 諾 男 子 言 我 初 
T03n0178_001:0448c10	不見此難，實至誠如汝言不虛者，姉乳當平	不 見 此 難 實 至 誠 如 汝 言 不 虛 者 姉 乳 當 平 
T03n0178_001:0448c11	復如故。』應時，其女人乳平復如故，亦無瘢	復 如 故 應 時 其 女 人 乳 平 復 如 故 亦 無 瘢 
T03n0178_001:0448c12	也。「釋提桓因以天眼見婬妷女，言：『此上色	也 釋提桓因 以 天 眼 見 婬 妷 女 言 此 上 色 
T03n0178_001:0448c13	婬女人布施為福乃如是，恐來奪我座。』則	婬 女 人 布 施 為 福 乃 如 是 恐 來 奪 我 座 則 
T03n0178_001:0448c14	化作婆羅門，持寶枝、澡豆瓶，著金錫杖，行	化 作 婆 羅 門 持 寶 枝 澡 豆 瓶 著 金 錫 杖 行 
T03n0178_001:0448c15	乞匃至此婬女家，言：『乞我分衛。』其女人	乞 匃 至 此 婬 女 家 言 乞 我 分 衛 其 女 人 
T03n0178_001:0448c16	便以金鉢盛飯出與婆羅門，婆羅門即却行	便 以 金 鉢 盛 飯 出 與 婆 羅 門 婆 羅 門 即 却 行 
T03n0178_001:0448c17	不肯受。上色女問道人：『何為却行不肯受	不 肯 受 上 色 女 問 道 人 何 為 却 行 不 肯 受 
T03n0178_001:0448c18	食？』報言：『我不用食，我聞汝布施乳，為審爾	食 報 言 我 不 用 食 我 聞 汝 布 施 乳 為 審 爾 
T03n0178_001:0448c19	不乎？』報言：『實如是。』婆羅門以偈問之曰：	不 乎 報 言 實 如 是 婆 羅 門 以 偈 問 之 曰 
T03n0178_001:0448c20	「『汝為索何願？　　云何釋為梵？	 汝 為 索 何 願 云 何 釋 為 梵 
T03n0178_001:0449a01	　　為求多寶王，　　所願難如是。』	 為 求 多 寶 王 所 願 難 如 是 
T03n0178_001:0449a02	「上色女，以偈報之言：	 上 色 女 以 偈 報 之 言 
T03n0178_001:0449a03	「『婆羅門無為者，　　無生老及病死，	 婆 羅 門 無 為 者 無 生 老 及 病 死 
T03n0178_001:0449a04	　　無愁憂清淨處，　　婆羅門我求彼。』	 無 愁 憂 清 淨 處 婆 羅 門 我 求 彼 
T03n0178_001:0449a05	「婆羅門言：『問汝持乳布施時，意寧轉異不？』	 婆羅門言 問 汝 持 乳 布 施 時 意 寧 轉 異 不 
T03n0178_001:0449a06	女人報言：『婆羅門！我當為汝現至誠。』報言：	女 人 報 言 婆 羅 門 我 當 為 汝 現 至 誠 報 言 
T03n0178_001:0449a07	『現之。』女人言：『若使我至誠持乳布施意無	 現 之 女 人 言 若 使 我 至 誠 持 乳 布 施 意 無 
T03n0178_001:0449a08	異者，令我轉女人身得作男子。』所言適竟，	異 者 令 我 轉 女 人 身 得 作 男 子 所 言 適 竟 
T03n0178_001:0449a09	即轉成男子。「時優波羅越王，治國五千歲已	即 轉 成 男 子 時 優 波 羅 越 王 治 國 五 千 歲 已 
T03n0178_001:0449a10	後終亡。傍臣、左右聞婬女人轉身作男子，念	後 終 亡 傍 臣 左 右 聞 婬 女 人 轉 身 作 男 子 念 
T03n0178_001:0449a11	言：『正當立此作國王，為王者當以正法治國。』	言 正 當 立 此 作 國 王 為 王 者 當 以 正 法 治 國 
T03n0178_001:0449a12	便共立作王。鞭杖不行，以正法治國，好布施	便 共 立 作 王 鞭 杖 不 行 以 正 法 治 國 好 布 施 
T03n0178_001:0449a13	金銀、珍寶著四城門，外及諸街里，欲得飯	金 銀 珍 寶 著 四 城 門 外 及 諸 街 里 欲 得 飯 
T03n0178_001:0449a14	食、漿水、衣被、熏華、房室、座席、舍宅、金銀、珍寶、明	食 漿 水 衣 被 熏 華 房 室 座 席 舍 宅 金 銀 珍 寶 明 
T03n0178_001:0449a15	月珠、玉琉璃、水精、珊瑚、馬瑙，隨其欲與之。	月 珠 玉 琉 璃 水 精 珊 瑚 馬 瑙 隨 其 欲 與 之 
T03n0178_001:0449a16	教一天下人持八關齋，如是治國五百歲，不	教 一 天 下 人 持 八 關 齋 如 是 治 國 五 百 歲 不 
T03n0178_001:0449a17	耕種自然稻米清潔香美，無有麁獷，今日截，	耕 種 自 然 稻 米 清 潔 香 美 無 有 麁 獷 今 日 截 
T03n0178_001:0449a18	旦日續自然生，即取其米，莖應時沒不現。	旦 日 續 自 然 生 即 取 其 米 莖 應 時 沒 不 現 
T03n0178_001:0449a19	取共食味，一切味食是已後齒不落，亦不	取 共 食 味 一 切 味 食 是 已 後 齒 不 落 亦 不 
T03n0178_001:0449a20	老、亦不病、亦不傴，顏色無異長短適等；祿	老 亦 不 病 亦 不 傴 顏 色 無 異 長 短 適 等 祿 
T03n0178_001:0449a21	相亦等，譬如欝單越天下。「國王自念言：	相 亦 等 譬 如 欝 單 越 天 下 國 王 自 念 言 
T03n0178_001:0449a22	『我布施與人，有何可怪？我布施與禽獸者，	 我 布 施 與 人 有 何 可 怪 我 布 施 與 禽 獸 者 
T03n0178_001:0449a23	爾乃為難。』時，王穌香自塗身，便入山空閑	爾 乃 為 難 時 王 穌 香 自 塗 身 便 入 山 空 閑 
T03n0178_001:0449a24	處臥巖石上，諸百鳥皆來生噉其身，便命過，	處 臥 巖 石 上 諸 百 鳥 皆 來 生 噉 其 身 便 命 過 
T03n0178_001:0449a25	生於婆羅門家——其家大富，金銀珍寶無央數——	生 於 婆 羅 門 家 其 家 大 富 金 銀 珍 寶 無 央 數 
T03n0178_001:0449a26	十月已滿便生，端正好無比。適生，四侍女共	十 月 已 滿 便 生 端 正 好 無 比 適 生 四 侍 女 共 
T03n0178_001:0449a27	養育，第一女主拭其身；第二女主沐浴；第	養 育 第 一 女 主 拭 其 身 第 二 女 主 沐 浴 第 
T03n0178_001:0449a28	三女主乳哺；第四女主抱之。兒即長大，四人	三 女 主 乳 哺 第 四 女 主 抱 之 兒 即 長 大 四 人 
T03n0178_001:0449a29	共侍議，不得使有見者，五百綵女共侍相	共 侍 議 不 得 使 有 見 者 五 百 綵 女 共 侍 相 
T03n0178_001:0449b01	娛樂。便竊出，過向市，觀見販賣貧窮乞匃者，	娛 樂 便 竊 出 過 向 市 觀 見 販 賣 貧 窮 乞 匃 者 
T03n0178_001:0449b02	有悲哀之意言：『此人民若使富樂者，不復賈	有 悲 哀 之 意 言 此 人 民 若 使 富 樂 者 不 復 賈 
T03n0178_001:0449b03	作販賣。』爾時，自說偈言：	作 販 賣 爾 時 自 說 偈 言 
T03n0178_001:0449b04	「『我之身心云何？　　甚堅而不破碎，	 我 之 身 心 云 何 甚 堅 而 不 破 碎 
T03n0178_001:0449b05	　　吾自在安樂處，　　見勤苦諸人民。』	 吾 自 在 安 樂 處 見 勤 苦 諸 人 民 
T03n0178_001:0449b06	「馳還白父母：『我欲除鬚髮行入山空處，處	 馳 還 白 父 母 我 欲 除 鬚 髮 行 入 山 空 處 處 
T03n0178_001:0449b07	樹下。』父母不聽。所以者何？適有汝一子甚	樹 下 父 母 不 聽 所以者何 適 有 汝 一 子 甚 
T03n0178_001:0449b08	重愛之：『我禱祠山川、日月、諸天，適得汝一	重 愛 之 我 禱 祠 山 川 日 月 諸 天 適 得 汝 一 
T03n0178_001:0449b09	子耳，我不見汝者便愁憂死。』不肯聽使去，	子 耳 我 不 見 汝 者 便 愁 憂 死 不 肯 聽 使 去 
T03n0178_001:0449b10	子便委臥地，一日、二日、至五日不食飲。諸親	子 便 委 臥 地 一 日 二 日 至 五 日 不 食 飲 諸 親 
T03n0178_001:0449b11	厚知識聞此兒欲學道除鬚髮，父母不聽，委	厚 知 識 聞 此 兒 欲 學 道 除 鬚 髮 父 母 不 聽 委 
T03n0178_001:0449b12	臥空地不食飲五日；諸親厚知識皆共到其	臥 空 地 不 食 飲 五 日 諸 親 厚 知 識 皆 共 到 其 
T03n0178_001:0449b13	所，諫曉言：『童子！何以不起沐浴、飲食、莊嚴，用	所 諫 曉 言 童 子 何 以 不 起 沐 浴 飲 食 莊 嚴 用 
T03n0178_001:0449b14	除鬚髮，在樹間樂道？』童子亦不應；如是言	除 鬚 髮 在 樹 間 樂 道 童 子 亦 不 應 如 是 言 
T03n0178_001:0449b15	者三日。諸親厚共到父母所，言：『聽使去學	者 三 日 諸 親 厚 共 到 父 母 所 言 聽 使 去 學 
T03n0178_001:0449b16	道，若樂者可數來往相見，不樂者便當來	道 若 樂 者 可 數 來 往 相 見 不 樂 者 便 當 來 
T03n0178_001:0449b17	歸。』父母言：『諾！』見聽已，子便自養視六七	歸 父 母 言 諾 見 聽 已 子 便 自 養 視 六 七 
T03n0178_001:0449b18	日，繞父母三匝為作禮，便入空閑坐行道	日 繞 父 母 三 匝 為 作 禮 便 入 空 閑 坐 行 道 
T03n0178_001:0449b19	已後，則往至餘大叢樹間。「中有兩道人坐得	已 後 則 往 至 餘 大 叢 樹 間 中 有 兩 道 人 坐 得 
T03n0178_001:0449b20	五神通，精誠求道離婬欲，童子便至其所	五 神 通 精 誠 求 道 離 婬 欲 童 子 便 至 其 所 
T03n0178_001:0449b21	問：『此間作何等？』報言：『我在此間露坐禪念	問 此 間 作 何 等 報 言 我 在 此 間 露 坐 禪 念 
T03n0178_001:0449b22	道，用人民故，作勤苦行。』童子言：『我亦當用人	道 用 人 民 故 作 勤 苦 行 童 子 言 我 亦 當 用 人 
T03n0178_001:0449b23	民故，露坐禪念道。』二道人言：『善！』童子即於大	民 故 露 坐 禪 念 道 二 道 人 言 善 童 子 即 於 大 
T03n0178_001:0449b24	叢樹下坐禪，於中用人民故，勤苦行道，即得	叢 樹 下 坐 禪 於 中 用 人 民 故 勤 苦 行 道 即 得 
T03n0178_001:0449b25	五神通，精進踰於二道人。其人大聖上尊，	五 神 通 精 進 踰 於 二 道 人 其 人 大 聖 上 尊 
T03n0178_001:0449b26	其樹間有虎妊娠。諸道人法，樹果自墮落	其 樹 間 有 虎 妊 娠 諸 道 人 法 樹 果 自 墮 落 
T03n0178_001:0449b27	者，乃取食之，不從樹摘取也。諸道人共行求	者 乃 取 食 之 不 從 樹 摘 取 也 諸 道 人 共 行 求 
T03n0178_001:0449b28	果蓏，便見妊娠虎，童子道人語兩道人	果 蓏 便 見 妊 娠 虎 童 子 道 人 語 兩 道 人 
T03n0178_001:0449b29	言：『此虎今不久當產，飢餓經日，恐自噉其	言 此 虎 今 不 久 當 產 飢 餓 經 日 恐 自 噉 其 
T03n0178_001:0449c01	子。誰能持身食之者？』彌勒菩薩言：『我當持	子 誰 能 持 身 食 之 者 彌 勒 菩 薩 言 我 當 持 
T03n0178_001:0449c02	身食之。』採果還已，見虎乳飢餓，欲取其	身 食 之 採 果 還 已 見 虎 乳 飢 餓 欲 取 其 
T03n0178_001:0449c03	子噉之，其道人語兩道人言：『虎已乳飢餓，	子 噉 之 其 道 人 語 兩 道 人 言 虎 已 乳 飢 餓 
T03n0178_001:0449c04	欲還噉其子。誰能持身食之？』便共俱至餓	欲 還 噉 其 子 誰 能 持 身 食 之 便 共 俱 至 餓 
T03n0178_001:0449c05	虎所，虎開目張口向之，兩道人俱畏懼，便	虎 所 虎 開 目 張 口 向 之 兩 道 人 俱 畏 懼 便 
T03n0178_001:0449c06	飛上虛空中。其一人言：『道人！卿之至誠如	飛 上 虛 空 中 其 一 人 言 道 人 卿 之 至 誠 如 
T03n0178_001:0449c07	是也。屬者言：「當持身食餓虎。」今者何故	是 也 屬 者 言 當 持 身 食 餓 虎 今 者 何 故 
T03n0178_001:0449c08	飛上虛空也？』其一道人哀之淚出，左右顧	飛 上 虛 空 也 其 一 道 人 哀 之 淚 出 左 右 顧 
T03n0178_001:0449c09	視無所有。童子道人取利刀刺右臂流血，	視 無 所 有 童 子 道 人 取 利 刀 刺 右 臂 流 血 
T03n0178_001:0449c10	如是七處自刺，血入虎口中因飲之，便復	如 是 七 處 自 刺 血 入 虎 口 中 因 飲 之 便 復 
T03n0178_001:0449c11	自投身食餓虎則死。」佛語阿難：「欲知爾時	自 投 身 食 餓 虎 則 死 佛 語 阿 難 欲 知 爾 時 
T03n0178_001:0449c12	上色婬女人者不？正是我身；時立為王者，	上 色 婬 女 人 者 不 正 是 我 身 時 立 為 王 者 
T03n0178_001:0449c13	亦是我身；時婆羅門子自投身餧餓虎者，	亦 是 我 身 時 婆 羅 門 子 自 投 身 餧 餓 虎 者 
T03n0178_001:0449c14	亦是我身；兩道人者，是迦葉、彌勒菩薩。」佛	亦 是 我 身 兩 道 人 者 是 迦 葉 彌 勒 菩 薩 佛 
T03n0178_001:0449c15	告阿難：「我精進行道故，超越九劫出彌勒	告 阿 難 我 精 進 行 道 故 超 越 九 劫 出 彌 勒 
T03n0178_001:0449c16	前。如是，阿難！勤苦行道六十劫，布施手、足、	前 如 是 阿 難 勤 苦 行 道 六 十 劫 布 施 手 足 
T03n0178_001:0449c17	鼻、耳、頭、目、肌肉、婦、子、男、女、好衣被、飲食故，降	鼻 耳 頭 目 肌 肉 婦 子 男 女 好 衣 被 飲 食 故 降 
T03n0178_001:0449c18	伏六十億魔，三十四億得佛道。」佛語阿難：「若	伏 六 十 億 魔 三 十 四 億 得 佛 道 佛 語 阿 難 若 
T03n0178_001:0449c19	使一切人知布施之福，如我所知者，窮乏餬	使 一 切 人 知 布 施 之 福 如 我 所 知 者 窮 乏 餬 
T03n0178_001:0449c20	口得一食自飯繼命；若不食此便死者，則	口 得 一 食 自 飯 繼 命 若 不 食 此 便 死 者 則 
T03n0178_001:0450a01	當不自食與善人令受。阿難！我念昔世時所	當 不 自 食 與 善 人 令 受 阿 難 我 念 昔 世 時 所 
T03n0178_001:0450a02	布施，用是故面色明好照曜，笑光從口出遍	布 施 用 是 故 面 色 明 好 照 曜 笑 光 從 口 出 遍 
T03n0178_001:0450a03	三千大千世界。」佛說是經時，四千二百比丘	三千大千世界 佛 說 是 經 時 四 千 二 百 比 丘 
T03n0178_001:0450a04	起無餘意得解脫，八十那術諸天人發無上	起 無 餘 意 得 解 脫 八 十 那 術 諸 天 人 發 無 上 
T03n0178_001:0450a05	正真道意，七萬菩薩得無所從生法忍。佛說	正 真 道 意 七 萬 菩 薩 得 無 所 從 生 法 忍 佛 說 
T03n0178_001:0450a06	如是，賢者阿難，及一切眾會諸天龍、鬼神、世	如 是 賢 者 阿 難 及 一 切 眾 會 諸 天 龍 鬼 神 世 
T03n0178_001:0450a07	間人皆歡喜，前為佛作禮而去。	間 人 皆 歡 喜 前 為 佛 作 禮 而 去 
T03n0178_001:0450a08	前世三轉經	前 世 三 轉 經 
