T03n0152_006:0037a28	為斯類矣。可以道化，喻之以仁，龍含凶	為 斯 類 矣 可 以 道 化 喻 之 以 仁 龍 含 凶 
T03n0152_006:0037a29	毒，吾等摧焉。』叔曰：『佛戒以殺為凶虐之	毒 吾 等 摧 焉 叔 曰 佛 戒 以 殺 為 凶 虐 之 
T03n0152_006:0037b01	大，活生仁道之首也。將如彼何？』伯曰：『夫	大 活 生 仁 道 之 首 也 將 如 彼 何 伯 曰 夫 
T03n0152_006:0037b02	殘一人者，其罪百劫；龍吞一國，吾懼恒沙	殘 一 人 者 其 罪 百 劫 龍 吞 一 國 吾 懼 恒 沙 
T03n0152_006:0037b03	劫畢，厥殃未除矣。苟貪尠味斯須之利，不	劫 畢 厥 殃 未 除 矣 苟 貪 尠 味 斯 須 之 利 不 
T03n0152_006:0037b04	覩太山燒煑之咎，吾心愍然。人道難獲，	覩 太 山 燒 煑 之 咎 吾 心 愍 然 人 道 難 獲 
T03n0152_006:0037b05	佛法難聞，除龍濟國，導以三尊六度高行，	佛 法 難 聞 除 龍 濟 國 導 以 三 尊 六 度 高 行 
T03n0152_006:0037b06	禍若絲髮，福喻二儀。爾化為象，吾為師	禍 若 絲 髮 福 喻 二 儀 爾 化 為 象 吾 為 師 
T03n0152_006:0037b07	子，二命不殞，斯國不濟也。』稽首十方誓	子 二 命 不 殞 斯 國 不 濟 也 稽 首 十 方 誓 
T03n0152_006:0037b08	曰：『眾生不寧，余之咎矣。吾後得佛，當度一	曰 眾 生 不 寧 余 之 咎 矣 吾 後 得 佛 當 度 一 
T03n0152_006:0037b09	切。』象造龍所，師子登之。龍即奮勢霆耀雷	切 象 造 龍 所 師 子 登 之 龍 即 奮 勢 霆 耀 雷 
T03n0152_006:0037b10	震，師子踊吼，龍之威靈，師子赫勢，普地	震 師 子 踊 吼 龍 之 威 靈 師 子 赫 勢 普 地 
T03n0152_006:0037b11	為震，三命絕矣。諸天稱善，靡不歎仁。兩	為 震 三 命 絕 矣 諸 天 稱 善 靡 不 歎 仁 兩 
T03n0152_006:0037b12	菩薩終，生第四天上。「一國全命，抱屍哀號	菩 薩 終 生 第 四 天 上 一 國 全 命 抱 屍 哀 號 
T03n0152_006:0037b13	曰：『斯必神矣！孰仁若茲。』門徒尋之，覩師	曰 斯 必 神 矣 孰 仁 若 茲 門 徒 尋 之 覩 師 
T03n0152_006:0037b14	普慈殺身濟眾，哀慟稱德。各又進行宣師	普 慈 殺 身 濟 眾 哀 慟 稱 德 各 又 進 行 宣 師 
T03n0152_006:0037b15	道化，王逮臣民始知有佛，率土僉曰：『佛	道 化 王 逮 臣 民 始 知 有 佛 率 土 僉 曰 佛 
T03n0152_006:0037b16	之仁化乃至於茲乎！』殯葬二屍，舉國哀慟。	之 仁 化 乃 至 於 茲 乎 殯 葬 二 屍 舉 國 哀 慟 
T03n0152_006:0037b17	王即命曰：『有不奉佛六度十善而事妖鬼	王 即 命 曰 有 不 奉 佛 六 度 十 善 而 事 妖 鬼 
T03n0152_006:0037b18	者，罪舉眷屬同。』自斯之後，剎有千數	者 罪 舉 眷 屬 同 自 斯 之 後 剎 有 千 數 
T03n0152_006:0037b19	沙門比肩而行，國內士女皆為清信高行，	沙 門 比 肩 而 行 國 內 士 女 皆 為 清 信 高 行 
T03n0152_006:0037b20	四境寧靖，遂致太平。」佛告諸比丘：「時兄	四 境 寧 靖 遂 致 太 平 佛 告 諸 比 丘 時 兄 
T03n0152_006:0037b21	者，吾身是也。弟者，彌勒是也。毒龍者，調達	者 吾 身 是 也 弟 者 彌 勒 是 也 毒 龍 者 調 達 
T03n0152_006:0037b22	是。菩薩銳志度無極精進如是。」(舉眷屬同，丹本與螣同)	是 菩 薩 銳 志 度 無 極 精 進 如 是 舉 眷 屬 同 丹 本 與 螣 同 
T03n0152_006:0037b23	（七一）彌勒為女人身經	 七 一 彌 勒 為 女 人 身 經 
T03n0152_006:0037b24	「昔者菩薩，為天帝釋，位尊榮高，其志恒	 昔 者 菩 薩 為 天 帝 釋 位 尊 榮 高 其 志 恒 
T03n0152_006:0037b25	存非常、苦、空、非身之想。坐則思惟，遊則	存 非 常 苦 空 非 身 之 想 坐 則 思 惟 遊 則 
T03n0152_006:0037b26	教化，愍愚愛智，誨以智慧，精進無休。覩	教 化 愍 愚 愛 智 誨 以 智 慧 精 進 無 休 覩 
T03n0152_006:0037b27	其宿友，受婦人身為富姓妻，惑乎財色，	其 宿 友 受 婦 人 身 為 富 姓 妻 惑 乎 財 色 
T03n0152_006:0037b28	不覺無常，居市坐肆。釋化為商人，佯有	不 覺 無 常 居 市 坐 肆 釋 化 為 商 人 佯 有 
T03n0152_006:0037b29	所市，至婦人前住。婦人喜悅，令兒馳歸，	所 市 至 婦 人 前 住 婦 人 喜 悅 令 兒 馳 歸 
T03n0152_006:0037c01	取獨坐床欲以坐之，商人乃熟視婦人	取 獨 坐 床 欲 以 坐 之 商 人 乃 熟 視 婦 人 
T03n0152_006:0037c02	而笑。婦執高操，意怪商人住笑非宜。兒	而 笑 婦 執 高 操 意 怪 商 人 住 笑 非 宜 兒 
T03n0152_006:0037c03	取床遲，還即搏之，商人又住笑。側有一	取 床 遲 還 即 搏 之 商 人 又 住 笑 側 有 一 
T03n0152_006:0037c04	兒，播鼗踊戲，商人復笑之。有父病者，子以	兒 播 鼗 踊 戲 商 人 復 笑 之 有 父 病 者 子 以 
T03n0152_006:0037c05	牛祠鬼，商人亦笑之。有一婦人抱兒仿	牛 祠 鬼 商 人 亦 笑 之 有 一 婦 人 抱 兒 仿 
T03n0152_006:0037c06	佯，行過市中，兒刮面頰，血流交頸，商人	佯 行 過 市 中 兒 刮 面 頰 血 流 交 頸 商 人 
T03n0152_006:0037c07	復笑之。於是富姓妻問曰：『君住吾前含笑	復 笑 之 於 是 富 姓 妻 問 曰 君 住 吾 前 含 笑 
T03n0152_006:0037c08	不止，吾屬搏兒，意興由子，子何以笑？』商人	不 止 吾 屬 搏 兒 意 興 由 子 子 何 以 笑 商 人 
T03n0152_006:0037c09	曰：『卿吾良友，今相忘乎？』婦人悵然，意益	曰 卿 吾 良 友 今 相 忘 乎 婦 人 悵 然 意 益 
T03n0152_006:0037c10	不悅，怪商人言。商人又曰：『吾所以笑搏	不 悅 怪 商 人 言 商 人 又 曰 吾 所 以 笑 搏 
T03n0152_006:0037c11	兒者，兒是卿父，魂靈旋感，為卿作子，	兒 者 兒 是 卿 父 魂 靈 旋 感 為 卿 作 子 
T03n0152_006:0037c12	一世之間有父不識，何況長久乎？播鼗兒	一 世 之 間 有 父 不 識 何 況 長 久 乎 播 鼗 兒 
T03n0152_006:0037c13	者本是牛，牛死靈魄還為主作子，家以牛	者 本 是 牛 牛 死 靈 魄 還 為 主 作 子 家 以 牛 
T03n0152_006:0037c14	皮用貫此鼗，兒今播弄踊躍戲舞，不識此	皮 用 貫 此 鼗 兒 今 播 弄 踊 躍 戲 舞 不 識 此 
T03n0152_006:0037c15	皮是其故體，故笑之耳。殺牛祭者，父病請	皮 是 其 故 體 故 笑 之 耳 殺 牛 祭 者 父 病 請 
T03n0152_006:0037c16	活，求生以殺，不祥之甚；猶服鴆毒，以救	活 求 生 以 殺 不 祥 之 甚 猶 服 鴆 毒 以 救 
T03n0152_006:0037c17	病也。斯父方終，終則為牛，累世屠戮受	病 也 斯 父 方 終 終 則 為 牛 累 世 屠 戮 受 
T03n0152_006:0037c18	禍無已。今此祭牛，命終靈還，當受人體，免	禍 無 已 今 此 祭 牛 命 終 靈 還 當 受 人 體 免 
T03n0152_006:0037c19	脫憂苦，故復笑之。刮母面兒，兒本小妻，母	脫 憂 苦 故 復 笑 之 刮 母 面 兒 兒 本 小 妻 母 
T03n0152_006:0037c20	是嫡妻，女情專婬，心懷嫉妬，常加酷	是 嫡 妻 女 情 專 婬 心 懷 嫉 妬 常 加 酷 
T03n0152_006:0037c21	暴。妾含怨恨，壽終則生為嫡妻子，今來報	暴 妾 含 怨 恨 壽 終 則 生 為 嫡 妻 子 今 來 報 
T03n0152_006:0037c22	讎，攫面傷體，故不敢怨耳，是以笑之。夫	讎 攫 面 傷 體 故 不 敢 怨 耳 是 以 笑 之 夫 
T03n0152_006:0037c23	眾生之心其為無恒，古憎今愛，何常之有？	眾 生 之 心 其 為 無 恒 古 憎 今 愛 何 常 之 有 
T03n0152_006:0037c24	斯皆一世見而不知，豈況累劫？經曰：「以色	斯 皆 一 世 見 而 不 知 豈 況 累 劫 經 曰 以 色 
T03n0152_006:0037c25	自壅者，盲於大道，專聽邪聲者，不聞佛音	自 壅 者 盲 於 大 道 專 聽 邪 聲 者 不 聞 佛 音 
T03n0152_006:0037c26	之響也。」吾是以笑之耳。世榮若電恍惚即	之 響 也 吾 是 以 笑 之 耳 世 榮 若 電 恍 惚 即 
T03n0152_006:0037c27	滅，當覺非常，莫與愚竝，崇修德操，六度	滅 當 覺 非 常 莫 與 愚 竝 崇 修 德 操 六 度 
T03n0152_006:0037c28	妙行。吾今反居，後日必造子門。』言竟忽然	妙 行 吾 今 反 居 後 日 必 造 子 門 言 竟 忽 然 
T03n0152_006:0037c29	不現，婦悵然而歸。齋肅望慕，一國咸聞，	不 現 婦 悵 然 而 歸 齋 肅 望 慕 一 國 咸 聞 
T03n0152_006:0038a01	王逮群寮靡不欽延。「商人後果在門，狀醜	王 逮 群 寮 靡 不 欽 延 商 人 後 果 在 門 狀 醜 
T03n0152_006:0038a02	衣弊，曰：『吾友在內，爾呼之來。』門人入告，具	衣 弊 曰 吾 友 在 內 爾 呼 之 來 門 人 入 告 具 
T03n0152_006:0038a03	以狀言。婦出曰：『爾非吾友矣。』釋笑而	以 狀 言 婦 出 曰 爾 非 吾 友 矣 釋 笑 而 
T03n0152_006:0038a04	云：『變形易服，子尚不識，豈況異世捨斯	云 變 形 易 服 子 尚 不 識 豈 況 異 世 捨 斯 
T03n0152_006:0038a05	受彼乎？』重曰：『爾勤奉佛，佛時難值，高行比	受 彼 乎 重 曰 爾 勤 奉 佛 佛 時 難 值 高 行 比 
T03n0152_006:0038a06	丘難得供事，命在呼吸無隨世惑。』言畢	丘 難 得 供 事 命 在 呼 吸 無 隨 世 惑 言 畢 
T03n0152_006:0038a07	不現。舉國歡嘆矣，各執六度高妙之行。」	不 現 舉 國 歡 嘆 矣 各 執 六 度 高 妙 之 行 
T03n0152_006:0038a08	佛告鶖鷺子：「爾時婦人者，彌勒是也。天帝釋	佛 告 鶖 鷺 子 爾 時 婦 人 者 彌 勒 是 也 天 帝 釋 
T03n0152_006:0038a09	者，吾身是也。菩薩銳志度無極精進如是。」	者 吾 身 是 也 菩 薩 銳 志 度 無 極 精 進 如 是 
T03n0152_006:0038a10	（七二）女人求願經	 七 二 女 人 求 願 經 
T03n0152_006:0038a11	「昔者菩薩，身為女人，厥婿稟氣兇愚妬忌，	 昔 者 菩 薩 身 為 女 人 厥 婿 稟 氣 兇 愚 妬 忌 
T03n0152_006:0038a12	每出商行，以妻囑隣獨母，母奉佛戒為	每 出 商 行 以 妻 囑 隣 獨 母 母 奉 佛 戒 為 
T03n0152_006:0038a13	清信行。時佛入國，王逮臣民靡不受戒，獨	清 信 行 時 佛 入 國 王 逮 臣 民 靡 不 受 戒 獨 
T03n0152_006:0038a14	母聞經，還為婦說之。婦喜歎曰：『斯即無上	母 聞 經 還 為 婦 說 之 婦 喜 歎 曰 斯 即 無 上 
T03n0152_006:0038a15	正真道、最正覺者也。』從母聞佛，即遙稽首。	正 真 道 最 正 覺 者 也 從 母 聞 佛 即 遙 稽 首 
T03n0152_006:0038a16	齋日母曰：『可往聽化乎？』婦喜曰：『可。』尋之城	齋 日 母 曰 可 往 聽 化 乎 婦 喜 曰 可 尋 之 城 
T03n0152_006:0038a17	外，忽存婿妬，悵然不悅，旋居自鄙：『吾殃	外 忽 存 婿 妬 悵 然 不 悅 旋 居 自 鄙 吾 殃 
T03n0152_006:0038a18	重乎？』母還為陳：『天龍鬼神、帝王臣民聽經，	重 乎 母 還 為 陳 天 龍 鬼 神 帝 王 臣 民 聽 經 
T03n0152_006:0038a19	或得沙門四道者，或受菩薩決者。佛時	或 得 沙 門 四 道 者 或 受 菩 薩 決 者 佛 時 
T03n0152_006:0038a20	難值，經法難聞，爾還為乎？』婦聞佛德，流	難 值 經 法 難 聞 爾 還 為 乎 婦 聞 佛 德 流 
T03n0152_006:0038a21	淚具陳婿妬之意。母曰：『可試一行。』婦曰：『敬	淚 具 陳 婿 妬 之 意 母 曰 可 試 一 行 婦 曰 敬 
T03n0152_006:0038a22	諾。』明日即隨母行覩佛，五體投地却立靜	諾 明 日 即 隨 母 行 覩 佛 五體投地 却 立 靜 
T03n0152_006:0038a23	心，視佛相好念佛清淨真是天尊。佛問女：	心 視 佛 相 好 念 佛 清 淨 真 是 天 尊 佛 問 女 
T03n0152_006:0038a24	『爾來何願？』即稽首而對：『我聞佛為無上正	 爾 來 何 願 即 稽 首 而 對 我 聞 佛 為 無 上 正 
T03n0152_006:0038a25	真道、最正覺、道法御、天人師，德如恒沙，智	真 道 最 正 覺 道 法 御 天 人 師 德 如 恒 沙 智 
T03n0152_006:0038a26	若虛空，六通四達得一切智，勢來請尊，願	若 虛 空 六 通 四 達 得 一 切 智 勢 來 請 尊 願 
T03n0152_006:0038a27	佛哀我。』世尊告曰：『佛為一切護，恣汝所	佛 哀 我 世 尊 告 曰 佛 為 一 切 護 恣 汝 所 
T03n0152_006:0038a28	願。』女人稽首曰：『夫人處世未獲本無者，皆	願 女 人 稽 首 曰 夫 人 處 世 未 獲 本 無 者 皆 
T03n0152_006:0038a29	以欲故為匹偶居，令我世世與至德偶居，	以 欲 故 為 匹 偶 居 令 我 世 世 與 至 德 偶 居 
T03n0152_006:0038b01	同志無嫉妬行。二曰，身口意行端正絕	同 志 無 嫉 妬 行 二 曰 身 口 意 行 端 正 絕 
T03n0152_006:0038b02	世。三曰，世世虔奉三尊，心垢日消，進道無	世 三 曰 世 世 虔 奉 三 尊 心 垢 日 消 進 道 無 
T03n0152_006:0038b03	倦，諸佛祐助，眾邪不能遏，必獲一切	倦 諸 佛 祐 助 眾 邪 不 能 遏 必 獲 一 切 
T03n0152_006:0038b04	智，濟眾生難。』眾祐歎曰：『善哉，善哉！令汝得	智 濟 眾 生 難 眾 祐 歎 曰 善 哉 善 哉 令 汝 得 
T03n0152_006:0038b05	之。』婦大歡喜稽首，退歸本居。厥婿賈還，乘	之 婦 大 歡 喜 稽 首 退 歸 本 居 厥 婿 賈 還 乘 
T03n0152_006:0038b06	舟水行，當以斯日至。天帝覩婦高行，發	舟 水 行 當 以 斯 日 至 天 帝 覩 婦 高 行 發 
T03n0152_006:0038b07	願無雙，助喜歎善，為興風雨，住其舟行	願 無 雙 助 喜 歎 善 為 興 風 雨 住 其 舟 行 
T03n0152_006:0038b08	明日乃臻。「婦後壽終，神生有道之家，容華	明 日 乃 臻 婦 後 壽 終 神 生 有 道 之 家 容 華 
T03n0152_006:0038b09	光世，年長出嫡為國儒士之妻，國稱高	光 世 年 長 出 嫡 為 國 儒 士 之 妻 國 稱 高 
T03n0152_006:0038b10	賢。時，婿入海採寶欲濟窮民，婦居家以禮	賢 時 婿 入 海 採 寶 欲 濟 窮 民 婦 居 家 以 禮 
T03n0152_006:0038b11	自衛，猶城衛寇，國王后妃大臣妻妾靡不	自 衛 猶 城 衛 寇 國 王 后 妃 大 臣 妻 妾 靡 不 
T03n0152_006:0038b12	仰則，詣門雲集稟婦德儀。婦夜寐覺，憶世	仰 則 詣 門 雲 集 稟 婦 德 儀 婦 夜 寐 覺 憶 世 
T03n0152_006:0038b13	無常：『榮富猶幻孰獲長存，躬為坏舟我神	無 常 榮 富 猶 幻 孰 獲 長 存 躬 為 坏 舟 我 神 
T03n0152_006:0038b14	載之，猶獲月影望天寶者也。勞心苦身	載 之 猶 獲 月 影 望 天 寶 者 也 勞 心 苦 身 
T03n0152_006:0038b15	何益於己？夢幻皆空，天神世榮其歸若茲	何 益 於 己 夢 幻 皆 空 天 神 世 榮 其 歸 若 茲 
T03n0152_006:0038b16	矣。明晨當索無上正真、天中之天為吾師	矣 明 晨 當 索 無 上 正 真 天 中 之 天 為 吾 師 
T03n0152_006:0038b17	焉。』晨興即覩石塔在庭，佛像金耀，琢壁	焉 晨 興 即 覩 石 塔 在 庭 佛 像 金 耀 琢 壁 
T03n0152_006:0038b18	書經，歎佛為眾聖之師三界獨步。婦喜	書 經 歎 佛 為 眾 聖 之 師 三 界 獨 步 婦 喜 
T03n0152_006:0038b19	歎曰：『是則如來、應儀、正真道、最正覺者乎！』即	歎 曰 是 則 如 來 應 儀 正 真 道 最 正 覺 者 乎 即 
T03n0152_006:0038b20	五體投地遶廟三匝，散華燒香，然燈懸	五體投地 遶 廟 三 匝 散 華 燒 香 然 燈 懸 
T03n0152_006:0038b21	繒，晨夜肅虔，稽首恭禮。王后國婦請承	繒 晨 夜 肅 虔 稽 首 恭 禮 王 后 國 婦 請 承 
T03n0152_006:0038b22	清風退邪崇真。隣有兇夫賈逢婦婿，曰：	清 風 退 邪 崇 真 隣 有 兇 夫 賈 逢 婦 婿 曰 
T03n0152_006:0038b23	『子妻造妖，虛立鬼廟，朝暮香熏呪咀妖蠱，	 子 妻 造 妖 虛 立 鬼 廟 朝 暮 香 熏 呪 咀 妖 蠱 
T03n0152_006:0038b24	願令爾喪，不祥之甚。』婿歸，婦啟曰：『妾前一	願 令 爾 喪 不 祥 之 甚 婿 歸 婦 啟 曰 妾 前 一 
T03n0152_006:0038b25	夜覺世無常，晨覩宗靈，無上正真絕妙之像	夜 覺 世 無 常 晨 覩 宗 靈 無 上 正 真 絕 妙 之 像 
T03n0152_006:0038b26	來在中庭，妾今供事，燒香然燈，懸繒奉	來 在 中 庭 妾 今 供 事 燒 香 然 燈 懸 繒 奉 
T03n0152_006:0038b27	華，朝夕禮拜，稽首自歸，子當事之，必合聖	華 朝 夕 禮 拜 稽 首 自 歸 子 當 事 之 必 合 聖 
T03n0152_006:0038b28	則。』婿大歡喜，一心肅虔，國人巨細僉然	則 婿 大 歡 喜 一 心 肅 虔 國 人 巨 細 僉 然 
T03n0152_006:0038b29	承風，如是八萬四千餘歲。」佛告鶖鷺子：	承 風 如 是 八萬四千 餘 歲 佛 告 鶖 鷺 子 
T03n0152_006:0038c01	「爾時婦人者，吾身是也。時婿者，彌勒是也，獨	 爾 時 婦 人 者 吾 身 是 也 時 婿 者 彌 勒 是 也 獨 
T03n0152_006:0038c02	母者，鶖鷺子是也。隣兇夫者，調達是也。菩薩	母 者 鶖 鷺 子 是 也 隣 兇 夫 者 調 達 是 也 菩 薩 
T03n0152_006:0038c03	銳志度無極精進如是。」	銳 志 度 無 極 精 進 如 是 
T03n0152_006:0038c04	（七三）然燈授決經	 七 三 然 燈 授 決 經 
T03n0152_006:0038c05	「昔者菩薩，身為女人，少寡守節，歸命三尊，	 昔 者 菩 薩 身 為 女 人 少 寡 守 節 歸 命 三 尊 
T03n0152_006:0038c06	處貧樂道，精進不倦，蠲除兇利，賣膏為	處 貧 樂 道 精 進 不 倦 蠲 除 兇 利 賣 膏 為 
T03n0152_006:0038c07	業。時有沙門，年在西夕，志存高行，不遑	業 時 有 沙 門 年 在 西 夕 志 存 高 行 不 遑 
T03n0152_006:0038c08	文學，內否之類謂之無明矣。禮敬有偏，	文 學 內 否 之 類 謂 之 無 明 矣 禮 敬 有 偏 
T03n0152_006:0038c09	終始無就，分衛麻油以供佛前，獨母照	終 始 無 就 分 衛 麻 油 以 供 佛 前 獨 母 照 
T03n0152_006:0038c10	然，貢不缺日。有一除饉，稽首佛足，叉	然 貢 不 缺 日 有 一 除 饉 稽 首 佛 足 叉 
T03n0152_006:0038c11	手質曰：『斯老除饉，其雖尠明，戒具行高，	手 質 曰 斯 老 除 饉 其 雖 尠 明 戒 具 行 高 
T03n0152_006:0038c12	然燈供養，後獲何福？』世尊歎曰：『善哉問也！	然 燈 供 養 後 獲 何 福 世 尊 歎 曰 善 哉 問 也 
T03n0152_006:0038c13	是老除饉，却無數劫，當為如來、無所著、正	是 老 除 饉 却 無 數 劫 當 為 如 來 無 所 著 正 
T03n0152_006:0038c14	真道、最正覺，項有重光，將導三界，眾生得	真 道 最 正 覺 項 有 重 光 將 導 三 界 眾 生 得 
T03n0152_006:0038c15	度，其為無數。』獨母聞之，馳詣佛所，稽首陳	度 其 為 無 數 獨 母 聞 之 馳 詣 佛 所 稽 首 陳 
T03n0152_006:0038c16	曰：『除饉然燈，膏即吾所貢云，其當獲為無	曰 除 饉 然 燈 膏 即 吾 所 貢 云 其 當 獲 為 無 
T03n0152_006:0038c17	上正真道，將導眾生還神本無，天人鬼龍	上 正 真 道 將 導 眾 生 還 神 本 無 天 人 鬼 龍 
T03n0152_006:0038c18	靡不逸豫。唯願加哀，復授吾決。』佛告女	靡 不 逸 豫 唯 願 加 哀 復 授 吾 決 佛 告 女 
T03n0152_006:0038c19	人：『女身不得為佛、緣一覺道、梵、釋、魔天、	人 女 身 不 得 為 佛 緣 一 覺 道 梵 釋 魔 天 
T03n0152_006:0038c20	飛行皇帝，斯尊巍巍非女人身所得作也。	飛 行 皇 帝 斯 尊 巍 巍 非 女 人 身 所 得 作 也 
T03n0152_006:0038c21	夫欲獲彼，當捐穢體受清淨身。』女稽首曰：	夫 欲 獲 彼 當 捐 穢 體 受 清 淨 身 女 稽 首 曰 
T03n0152_006:0038c22	『今當捐之。』還居淨浴，遙拜而曰：『夫身者四	 今 當 捐 之 還 居 淨 浴 遙 拜 而 曰 夫 身 者 四 
T03n0152_006:0038c23	大之有，非吾長保也。』登樓願曰：『以今穢身	大 之 有 非 吾 長 保 也 登 樓 願 曰 以 今 穢 身 
T03n0152_006:0038c24	惠眾生之飢渴者，乞獲男躬，受決為佛。	惠 眾 生 之 飢 渴 者 乞 獲 男 躬 受 決 為 佛 
T03n0152_006:0038c25	若有濁世眾生盲冥背正向邪無知佛者，	若 有 濁 世 眾 生 盲 冥 背 正 向 邪 無 知 佛 者 
T03n0152_006:0038c26	吾當於彼世拯濟之也。』自高投下，觀者	吾 當 於 彼 世 拯 濟 之 也 自 高 投 下 觀 者 
T03n0152_006:0038c27	寒慄。佛知至意，化令地軟猶天綩綖，覩身	寒 慄 佛 知 至 意 化 令 地 軟 猶 天 綩 綖 覩 身 
T03n0152_006:0038c28	無害，即化為男，厥喜無量。馳詣佛所踊躍	無 害 即 化 為 男 厥 喜 無 量 馳 詣 佛 所 踊 躍 
T03n0152_006:0038c29	而云：『受世尊恩，已獲淨身。唯願加哀，授	而 云 受 世 尊 恩 已 獲 淨 身 唯 願 加 哀 授 
T03n0152_006:0039a01	吾尊決。』佛歎之曰：『爾之勇猛世所希有，必	吾 尊 決 佛 歎 之 曰 爾 之 勇 猛 世 所 希 有 必 
T03n0152_006:0039a02	得為佛無懷疑望，然燈除饉，其得佛時	得 為 佛 無 懷 疑 望 然 燈 除 饉 其 得 佛 時 
T03n0152_006:0039a03	當授汝號。』天人鬼龍聞當為佛，皆向拜賀，	當 授 汝 號 天 人 鬼 龍 聞 當 為 佛 皆 向 拜 賀 
T03n0152_006:0039a04	還居咨歎，各加精進。爾時，勸發群生不	還 居 咨 歎 各 加 精 進 爾 時 勸 發 群 生 不 
T03n0152_006:0039a05	可計數。」佛告鶖鷺子：「時老比丘者，錠光佛	可 計 數 佛 告 鶖 鷺 子 時 老 比 丘 者 錠 光 佛 
T03n0152_006:0039a06	是也。獨母者，吾身是。菩薩銳志度無極精	是 也 獨 母 者 吾 身 是 菩 薩 銳 志 度 無 極 精 
T03n0152_006:0039a07	進如是。」	進 如 是 
T03n0152_006:0039a08	六度集經卷第六	六 度 集 經 卷 第 六 
T03n0152_007:0039a11	六度集經卷第七	六 度 集 經 卷 第 七 
T03n0152_007:0039a13	吳康居國沙門康僧會譯	吳 康 居 國 沙 門 康 僧 會 譯 
T03n0152_007:0039a14	禪度無極章第五(此有九章)	禪 度 無 極 章 第 五 此 有 九 章 
T03n0152_007:0039a15	（七四）「禪度無極者云何？端其心，壹其意，合	 七 四 禪 度 無 極 者 云 何 端 其 心 壹 其 意 合 
T03n0152_007:0039a16	會眾善，內著心中，意諸穢惡，以善消之。凡	會 眾 善 內 著 心 中 意 諸 穢 惡 以 善 消 之 凡 
T03n0152_007:0039a17	有四禪：一禪之行，去所貪愛五妖邪事，眼	有 四 禪 一 禪 之 行 去 所 貪 愛 五 妖 邪 事 眼 
T03n0152_007:0039a18	覩華色心為淫狂，去耳聲、鼻香、口味、身好，	覩 華 色 心 為 淫 狂 去 耳 聲 鼻 香 口 味 身 好 
T03n0152_007:0039a19	道行之志必當遠彼。又有五蓋：貪財蓋、恚	道 行 之 志 必 當 遠 彼 又 有 五 蓋 貪 財 蓋 恚 
T03n0152_007:0039a20	怒蓋、睡眠蓋、淫樂蓋、悔疑蓋。有道無道，有	怒 蓋 睡 眠 蓋 淫 樂 蓋 悔 疑 蓋 有 道 無 道 有 
T03n0152_007:0039a21	佛無佛，有經無經，心意識念，清淨無垢，心	佛 無 佛 有 經 無 經 心 意 識 念 清 淨 無 垢 心 
T03n0152_007:0039a22	明覩真得無不知，天龍鬼妖所不能惑。	明 覩 真 得 無 不 知 天 龍 鬼 妖 所 不 能 惑 
T03n0152_007:0039a23	猶人有十怨脫身離之，獨處山間眾所	猶 人 有 十 怨 脫 身 離 之 獨 處 山 間 眾 所 
T03n0152_007:0039a24	不知、無所復畏，人遠情慾，內淨心寂，斯	不 知 無 所 復 畏 人 遠 情 慾 內 淨 心 寂 斯 
T03n0152_007:0039a25	謂一禪。心獲一禪進向二禪，第二之禪，如	謂 一 禪 心 獲 一 禪 進 向 二 禪 第 二 之 禪 如 
T03n0152_007:0039a26	人避怨，雖處深山懼怨尋之，逾自深藏，	人 避 怨 雖 處 深 山 懼 怨 尋 之 逾 自 深 藏 
T03n0152_007:0039a27	行家雖遠十情慾怨，猶恐慾賊來壞道	行 家 雖 遠 十 情 慾 怨 猶 恐 慾 賊 來 壞 道 
T03n0152_007:0039a28	志，得第二禪，情慾稍遠不能污己。第一	志 得 第 二 禪 情 慾 稍 遠 不 能 污 己 第 一 
T03n0152_007:0039a29	之禪，善惡諍已，以善消惡，惡退善進。第	之 禪 善 惡 諍 已 以 善 消 惡 惡 退 善 進 第 
T03n0152_007:0039b01	二之禪，喜心寂止，不復以善住消彼惡	二 之 禪 喜 心 寂 止 不 復 以 善 住 消 彼 惡 
T03n0152_007:0039b02	也。喜善二意，悉自消滅，十惡煙絕，外無因	也 喜 善 二 意 悉 自 消 滅 十 惡 煙 絕 外 無 因 
T03n0152_007:0039b03	緣來入心者。譬如高山其頂有泉，無流入	緣 來 入 心 者 譬 如 高 山 其 頂 有 泉 無 流 入 
T03n0152_007:0039b04	者，亦非龍雨水自內出，水淨泉滿，善內心	者 亦 非 龍 雨 水 自 內 出 水 淨 泉 滿 善 內 心 
T03n0152_007:0039b05	出，惡不復由耳目鼻口入，御心如是，便	出 惡 不 復 由 耳 目 鼻 口 入 御 心 如 是 便 
T03n0152_007:0039b06	向三禪。第三之禪，守意牢固，善惡不入，心	向 三 禪 第 三 之 禪 守 意 牢 固 善 惡 不 入 心 
T03n0152_007:0039b07	安如須彌，諸善不出。外事善惡寂滅不入，	安 如 須 彌 諸 善 不 出 外 事 善 惡 寂 滅 不 入 
T03n0152_007:0039b08	心猶蓮華根莖在水，華合未發為水所覆。	心 猶 蓮 華 根 莖 在 水 華 合 未 發 為 水 所 覆 
T03n0152_007:0039b09	三禪之行，其淨猶華，去離眾惡身意俱安。	三 禪 之 行 其 淨 猶 華 去 離 眾 惡 身 意 俱 安 
T03n0152_007:0039b10	御心如是，便向四禪。善惡皆棄，心不念	御 心 如 是 便 向 四 禪 善 惡 皆 棄 心 不 念 
T03n0152_007:0039b11	善亦不存惡，心中明淨猶琉璃珠，又如	善 亦 不 存 惡 心 中 明 淨 猶 琉 璃 珠 又 如 
T03n0152_007:0039b12	士女淨自沐浴，名香塗身，內外衣新，鮮明	士 女 淨 自 沐 浴 名 香 塗 身 內 外 衣 新 鮮 明 
