T03n0152_001:0001a03	六度集經卷第一	六 度 集 經 卷 第 一 
T03n0152_001:0001a05	吳康居國沙門康僧會譯	吳 康 居 國 沙 門 康 僧 會 譯 
T03n0152_001:0001a06	布施度無極章第一(此有一十章)	布 施 度 無 極 章 第 一 此 有 一 十 章 
T03n0152_001:0001a07	聞如是：一時佛在王舍國鷂山中。時，與五	聞 如 是 一 時 佛 在 王 舍 國 鷂 山 中 時 與 五 
T03n0152_001:0001a08	百應儀、菩薩千人共坐。中有菩薩名阿泥	百 應 儀 菩 薩 千 人 共 坐 中 有 菩 薩 名 阿 泥 
T03n0152_001:0001a09	察，佛說經道，常靖心惻聽，寂然無念，意	察 佛 說 經 道 常 靖 心 惻 聽 寂 然 無 念 意 
T03n0152_001:0001a10	定在經。眾祐知之，為說：「菩薩六度無極難	定 在 經 眾 祐 知 之 為 說 菩 薩 六 度 無 極 難 
T03n0152_001:0001a11	逮高行，疾得為佛。何謂為六？一曰布施，	逮 高 行 疾 得 為 佛 何 謂 為 六 一 曰 布 施 
T03n0152_001:0001a12	二曰持戒，三曰忍辱，四曰精進，五曰禪定，	二 曰 持 戒 三 曰 忍 辱 四 曰 精 進 五 曰 禪 定 
T03n0152_001:0001a13	六曰明度無極高行。	六 曰 明 度 無 極 高 行 
T03n0152_001:0001a14	「布施度無極者，厥則云何？慈育人物，悲愍	 布 施 度 無 極 者 厥 則 云 何 慈 育 人 物 悲 愍 
T03n0152_001:0001a15	群邪，喜賢成度，護濟眾生，跨天踰地	群 邪 喜 賢 成 度 護 濟 眾 生 跨 天 踰 地 
T03n0152_001:0001a16	潤弘河海。布施眾生，飢者食之，渴者飲之，	潤 弘 河 海 布 施 眾 生 飢 者 食 之 渴 者 飲 之 
T03n0152_001:0001a17	寒衣熱涼，疾濟以藥，車馬舟輿、眾寶名	寒 衣 熱 涼 疾 濟 以 藥 車 馬 舟 輿 眾 寶 名 
T03n0152_001:0001a18	珍、妻子國土，索即惠之。猶太子須大拏，	珍 妻 子 國 土 索 即 惠 之 猶 太 子 須 大 拏 
T03n0152_001:0001a19	布施貧乏，若親育子，父王屏逐，愍而不	布 施 貧 乏 若 親 育 子 父 王 屏 逐 愍 而 不 
T03n0152_001:0001a20	怨。」	怨 
T03n0152_001:0001a21	（一）「昔者菩薩，其心通真，覩世無常，榮命難	 一 昔 者 菩 薩 其 心 通 真 覩 世 無 常 榮 命 難 
T03n0152_001:0001a22	保，盡財布施。天帝釋覩菩薩慈育群生布	保 盡 財 布 施 天 帝 釋 覩 菩 薩 慈 育 群 生 布 
T03n0152_001:0001a23	施濟眾，功勳巍巍，德重十方，懼奪己位，	施 濟 眾 功 勳 巍 巍 德 重 十 方 懼 奪 己 位 
T03n0152_001:0001a24	因化為地獄，現于其前曰：『布施濟眾，命	因 化 為 地 獄 現 于 其 前 曰 布 施 濟 眾 命 
T03n0152_001:0001a25	終魂靈入于太山地獄，燒煮萬毒。為施受害	終 魂 靈 入 于 太 山 地 獄 燒 煮 萬 毒 為 施 受 害 
T03n0152_001:0001a26	也，爾惠為乎？』菩薩報曰：『豈有施德而入	也 爾 惠 為 乎 菩 薩 報 曰 豈 有 施 德 而 入 
T03n0152_001:0001a27	太山地獄者乎？』釋曰：『爾其不信，可問辜	太 山 地 獄 者 乎 釋 曰 爾 其 不 信 可 問 辜 
T03n0152_001:0001a28	者。』菩薩問曰：『爾以何緣處地獄乎？』罪人	者 菩 薩 問 曰 爾 以 何 緣 處 地 獄 乎 罪 人 
T03n0152_001:0001a29	曰：『吾昔處世，空家濟窮，拯拔眾厄，今受	曰 吾 昔 處 世 空 家 濟 窮 拯 拔 眾 厄 今 受 
T03n0152_001:0001b01	重辜處太山獄。』菩薩問曰：『仁惠獲殃，受	重 辜 處 太 山 獄 菩 薩 問 曰 仁 惠 獲 殃 受 
T03n0152_001:0001b02	施者如之乎？』釋曰：『受惠者，命終昇天。』菩薩	施 者 如 之 乎 釋 曰 受 惠 者 命 終 昇 天 菩 薩 
T03n0152_001:0001b03	報曰：『吾之拯濟，唯為眾生；假如子云，誠吾	報 曰 吾 之 拯 濟 唯 為 眾 生 假 如 子 云 誠 吾 
T03n0152_001:0001b04	願矣。慈惠受罪，吾必為之。危己濟眾，菩薩	願 矣 慈 惠 受 罪 吾 必 為 之 危 己 濟 眾 菩 薩 
T03n0152_001:0001b05	上志也。』釋曰：『爾何志願，尚斯高行？』答曰：	上 志 也 釋 曰 爾 何 志 願 尚 斯 高 行 答 曰 
T03n0152_001:0001b06	『吾欲求佛，擢濟眾生，令得泥洹不復生	 吾 欲 求 佛 擢 濟 眾 生 令 得 泥 洹 不 復 生 
T03n0152_001:0001b07	死。』釋聞聖趣，因却叩頭曰：『實無布施慈	死 釋 聞 聖 趣 因 却 叩 頭 曰 實 無 布 施 慈 
T03n0152_001:0001b08	濟眾生，遠福受禍入太山獄者也。子德	濟 眾 生 遠 福 受 禍 入 太 山 獄 者 也 子 德 
T03n0152_001:0001b09	動乾坤，懼奪吾位，故示地獄以惑子志	動 乾 坤 懼 奪 吾 位 故 示 地 獄 以 惑 子 志 
T03n0152_001:0001b10	耳。愚欺聖人，原其重尤。』既悔過畢，稽首	耳 愚 欺 聖 人 原 其 重 尤 既 悔 過 畢 稽 首 
T03n0152_001:0001b11	而退。菩薩慈惠度無極行布施如是。」	而 退 菩 薩 慈 惠 度 無 極 行 布 施 如 是 
T03n0152_001:0001b12	（二）「昔者菩薩為大國王，號薩波達，布施眾	 二 昔 者 菩 薩 為 大 國 王 號 薩 波 達 布 施 眾 
T03n0152_001:0001b13	生恣其所索，愍濟厄難常有悲愴。天帝釋	生 恣 其 所 索 愍 濟 厄 難 常 有 悲 愴 天 帝 釋 
T03n0152_001:0001b14	覩王慈惠德被十方，天神鬼龍僉然而曰：『天	覩 王 慈 惠 德 被 十 方 天 神 鬼 龍 僉 然 而 曰 天 
T03n0152_001:0001b15	帝尊位初無常人，戒具行高慈惠福隆，命盡	帝 尊 位 初 無 常 人 戒 具 行 高 慈 惠 福 隆 命 盡 
T03n0152_001:0001b16	神遷則為天帝。』懼奪己位，欲往試之，以	神 遷 則 為 天 帝 懼 奪 己 位 欲 往 試 之 以 
T03n0152_001:0001b17	照真偽。帝命邊王曰：『今彼人王，慈潤霶霈	照 真 偽 帝 命 邊 王 曰 今 彼 人 王 慈 潤 霶 霈 
T03n0152_001:0001b18	福德巍巍，恐于志求奪吾帝位。爾化為鴿，	福 德 巍 巍 恐 于 志 求 奪 吾 帝 位 爾 化 為 鴿 
T03n0152_001:0001b19	疾之王所，佯恐怖，求哀彼王。彼王仁惠，必	疾 之 王 所 佯 恐 怖 求 哀 彼 王 彼 王 仁 惠 必 
T03n0152_001:0001b20	受爾歸；吾當尋後從王索爾。王終不還，	受 爾 歸 吾 當 尋 後 從 王 索 爾 王 終 不 還 
T03n0152_001:0001b21	必當市肉，以當其處。吾詭不止，王意清	必 當 市 肉 以 當 其 處 吾 詭 不 止 王 意 清 
T03n0152_001:0001b22	真，許終不違，會自割身肉以當其重也。	真 許 終 不 違 會 自 割 身 肉 以 當 其 重 也 
T03n0152_001:0001b23	若其秤肉隨而自重，肉盡身痛其必悔矣。	若 其 秤 肉 隨 而 自 重 肉 盡 身 痛 其 必 悔 矣 
T03n0152_001:0001b24	意有悔者，所志不成。』「釋即化為鷹，邊王化	意 有 悔 者 所 志 不 成 釋 即 化 為 鷹 邊 王 化 
T03n0152_001:0001b25	為鴿。鴿疾飛趣于王足下，恐怖而云：『大王	為 鴿 鴿 疾 飛 趣 于 王 足 下 恐 怖 而 云 大 王 
T03n0152_001:0001b26	哀我！吾命窮矣！』王曰：『莫恐莫恐！吾今活	哀 我 吾 命 窮 矣 王 曰 莫 恐 莫 恐 吾 今 活 
T03n0152_001:0001b27	汝。』鷹尋後至，向王說曰：『吾鴿爾來，鴿是吾	汝 鷹 尋 後 至 向 王 說 曰 吾 鴿 爾 來 鴿 是 吾 
T03n0152_001:0001b28	食，願王相還。』王曰：『鴿來以命相歸，已受	食 願 王 相 還 王 曰 鴿 來 以 命 相 歸 已 受 
T03n0152_001:0001b29	其歸，吾言守信，終始無違。爾苟得肉，吾	其 歸 吾 言 守 信 終 始 無 違 爾 苟 得 肉 吾 
T03n0152_001:0001c01	自足爾，令重百倍。』鷹曰：『吾唯欲鴿，不用	自 足 爾 令 重 百 倍 鷹 曰 吾 唯 欲 鴿 不 用 
T03n0152_001:0001c02	餘肉，希王當相惠。而奪吾食乎？』王曰：『已	餘 肉 希 王 當 相 惠 而 奪 吾 食 乎 王 曰 已 
T03n0152_001:0001c03	受彼歸，信重天地，何心違之乎？當以何	受 彼 歸 信 重 天 地 何 心 違 之 乎 當 以 何 
T03n0152_001:0001c04	物令汝置鴿歡喜去矣？』鷹曰：『若王慈惠	物 令 汝 置 鴿 歡 喜 去 矣 鷹 曰 若 王 慈 惠 
T03n0152_001:0001c05	必濟眾生者，割王肌肉令與鴿等，吾欣	必 濟 眾 生 者 割 王 肌 肉 令 與 鴿 等 吾 欣 
T03n0152_001:0001c06	而受之。』王曰：『大善！』即自割髀肉秤之	而 受 之 王 曰 大 善 即 自 割 髀 肉 秤 之 
T03n0152_001:0001c07	令與鴿重等；鴿踰自重，自割如斯，身肉都	令 與 鴿 重 等 鴿 踰 自 重 自 割 如 斯 身 肉 都 
T03n0152_001:0001c08	盡未與重等，身瘡之痛其為無量。王以慈	盡 未 與 重 等 身 瘡 之 痛 其 為 無 量 王 以 慈 
T03n0152_001:0001c09	忍心願鴿活，又命近臣曰：『爾疾殺我，秤髓	忍 心 願 鴿 活 又 命 近 臣 曰 爾 疾 殺 我 秤 髓 
T03n0152_001:0001c10	令與鴿重等。吾奉諸佛，受正真之重戒，	令 與 鴿 重 等 吾 奉 諸 佛 受 正 真 之 重 戒 
T03n0152_001:0001c11	濟眾生之危厄，雖有眾邪之惱，猶若微風，	濟 眾 生 之 危 厄 雖 有 眾 邪 之 惱 猶 若 微 風 
T03n0152_001:0001c12	焉能動太山乎？』「鷹照王懷守道不移，慈	焉 能 動 太 山 乎 鷹 照 王 懷 守 道 不 移 慈 
T03n0152_001:0001c13	惠難齊，各復本身。帝釋、邊王稽首于地	惠 難 齊 各 復 本 身 帝 釋 邊 王 稽 首 于 地 
T03n0152_001:0001c14	曰：『大王！欲何志尚，惱苦若茲？』人王曰：『吾	曰 大 王 欲 何 志 尚 惱 苦 若 茲 人 王 曰 吾 
T03n0152_001:0001c15	不志天帝釋及飛行皇帝之位，吾覩眾生	不 志 天 帝 釋 及 飛 行 皇 帝 之 位 吾 覩 眾 生 
T03n0152_001:0001c16	沒于盲冥，不覩三尊、不聞佛教，恣心于	沒 于 盲 冥 不 覩 三 尊 不 聞 佛 教 恣 心 于 
T03n0152_001:0001c17	凶禍之行，投身于無擇之獄。覩斯愚惑，為	凶 禍 之 行 投 身 于 無 擇 之 獄 覩 斯 愚 惑 為 
T03n0152_001:0001c18	之惻愴。誓願求佛，拔濟眾生之困厄，令得	之 惻 愴 誓 願 求 佛 拔 濟 眾 生 之 困 厄 令 得 
T03n0152_001:0001c19	泥洹。』天帝驚曰：『愚謂大王欲奪吾位，故	泥 洹 天 帝 驚 曰 愚 謂 大 王 欲 奪 吾 位 故 
T03n0152_001:0001c20	相擾耳。將何勅誨？』王曰：『使吾身瘡愈復	相 擾 耳 將 何 勅 誨 王 曰 使 吾 身 瘡 愈 復 
T03n0152_001:0001c21	如舊，令吾志尚布施濟眾行高踰今。』天帝	如 舊 令 吾 志 尚 布 施 濟 眾 行 高 踰 今 天 帝 
T03n0152_001:0001c22	即使天醫神藥，傳身瘡愈、色力踰前，身瘡	即 使 天 醫 神 藥 傳 身 瘡 愈 色 力 踰 前 身 瘡 
T03n0152_001:0001c23	斯須豁然都愈。釋却稽首，遶王三匝歡喜	斯 須 豁 然 都 愈 釋 却 稽 首 遶 王 三 匝 歡 喜 
T03n0152_001:0001c24	而去。自是之後，布施踰前。菩薩慈惠度無	而 去 自 是 之 後 布 施 踰 前 菩 薩 慈 惠 度 無 
T03n0152_001:0001c25	極行布施如是。」	極 行 布 施 如 是 
T03n0152_001:0001c26	（三）「昔者菩薩貧窶尤困，與諸商人俱之他	 三 昔 者 菩 薩 貧 窶 尤 困 與 諸 商 人 俱 之 他 
T03n0152_001:0001c27	國，其眾皆有信佛之志，布施窮乏濟度眾	國 其 眾 皆 有 信 佛 之 志 布 施 窮 乏 濟 度 眾 
T03n0152_001:0001c28	生。等人僉曰：『眾皆慈惠，爾將何施？』答曰：『夫	生 等 人 僉 曰 眾 皆 慈 惠 爾 將 何 施 答 曰 夫 
T03n0152_001:0001c29	身假借之類靡不棄捐，吾覩海魚，巨細相	身 假 借 之 類 靡 不 棄 捐 吾 覩 海 魚 巨 細 相 
T03n0152_001:0002a01	吞，心為愴愴。吾當以身代其小者，令得	吞 心 為 愴 愴 吾 當 以 身 代 其 小 者 令 得 
T03n0152_001:0002a02	須臾之命也。』即自投海。海大魚飽，小者	須 臾 之 命 也 即 自 投 海 海 大 魚 飽 小 者 
T03n0152_001:0002a03	得活。魂靈化為鱣魚之王，身有里數。「海	得 活 魂 靈 化 為 鱣 魚 之 王 身 有 里 數 海 
T03n0152_001:0002a04	邊有國，其國枯旱，黎庶飢饉更相吞噉。魚	邊 有 國 其 國 枯 旱 黎 庶 飢 饉 更 相 吞 噉 魚 
T03n0152_001:0002a05	為流淚曰：『眾生擾擾，其苦痛哉？吾身有	為 流 淚 曰 眾 生 擾 擾 其 苦 痛 哉 吾 身 有 
T03n0152_001:0002a06	里數之肉，可供黎民旬月之乏。』即自盪	里 數 之 肉 可 供 黎 民 旬 月 之 乏 即 自 盪 
T03n0152_001:0002a07	身上于國渚，舉國噉之以存生命，輦肉數	身 上 于 國 渚 舉 國 噉 之 以 存 生 命 輦 肉 數 
T03n0152_001:0002a08	月而魚猶生。天神下曰：『爾為忍苦，其可堪	月 而 魚 猶 生 天 神 下 曰 爾 為 忍 苦 其 可 堪 
T03n0152_001:0002a09	哉？何不放壽，可離斯痛也？』魚曰：『吾自絕	哉 何 不 放 壽 可 離 斯 痛 也 魚 曰 吾 自 絕 
T03n0152_001:0002a10	命神逝身腐，民後飢饉將復相噉，吾不忍	命 神 逝 身 腐 民 後 飢 饉 將 復 相 噉 吾 不 忍 
T03n0152_001:0002a11	覩。』心為其感矣，天曰：『菩薩懷慈難齊。』天為	覩 心 為 其 感 矣 天 曰 菩 薩 懷 慈 難 齊 天 為 
T03n0152_001:0002a12	傷心曰：『爾必得佛，度吾眾生矣。』「有人	傷 心 曰 爾 必 得 佛 度 吾 眾 生 矣 有 人 
T03n0152_001:0002a13	以斧斫取其首，魚時死矣。魂靈即感為王	以 斧 斫 取 其 首 魚 時 死 矣 魂 靈 即 感 為 王 
T03n0152_001:0002a14	太子。生有上聖之明，四恩弘慈，潤齊二儀。	太 子 生 有 上 聖 之 明 四 恩 弘 慈 潤 齊 二 儀 
T03n0152_001:0002a15	愍民困窮，言之哽咽。然國尚旱，靖心	愍 民 困 窮 言 之 哽 咽 然 國 尚 旱 靖 心 
T03n0152_001:0002a16	齊肅，退食絕獻，頓首悔過曰：『民之不善，咎	齊 肅 退 食 絕 獻 頓 首 悔 過 曰 民 之 不 善 咎 
T03n0152_001:0002a17	在我身，願喪吾命惠民雨澤。』日日哀慟，	在 我 身 願 喪 吾 命 惠 民 雨 澤 日 日 哀 慟 
T03n0152_001:0002a18	猶至孝之子遭聖父之喪矣。精誠達遠，即	猶 至 孝 之 子 遭 聖 父 之 喪 矣 精 誠 達 遠 即 
T03n0152_001:0002a19	有各佛五百人來之其國界。「王聞心喜，悅	有 各 佛 五 百 人 來 之 其 國 界 王 聞 心 喜 悅 
T03n0152_001:0002a20	若無身，奉迎稽首，請歸正殿。皇后、太子	若 無 身 奉 迎 稽 首 請 歸 正 殿 皇 后 太 子 
T03n0152_001:0002a21	靡不肅虔，最味法服供足所乏，五體投地	靡 不 肅 虔 最 味 法 服 供 足 所 乏 五體投地 
T03n0152_001:0002a22	稽首叩頭，涕泣而曰：『吾心穢行濁，不合	稽 首 叩 頭 涕 泣 而 曰 吾 心 穢 行 濁 不 合 
T03n0152_001:0002a23	三尊四恩之教，苦酷人民，罪當伐己。流	三 尊 四 恩 之 教 苦 酷 人 民 罪 當 伐 己 流 
T03n0152_001:0002a24	被下劣，枯旱累載，黎庶飢饉怨痛傷情。願	被 下 劣 枯 旱 累 載 黎 庶 飢 饉 怨 痛 傷 情 願 
T03n0152_001:0002a25	除民灾，以禍罪我。』諸各佛曰：『爾為仁	除 民 灾 以 禍 罪 我 諸 各 佛 曰 爾 為 仁 
T03n0152_001:0002a26	君，慈惻仁惠，德齊帝釋，諸佛普知。今授汝	君 慈 惻 仁 惠 德 齊 帝 釋 諸 佛 普 知 今 授 汝 
T03n0152_001:0002a27	福，慎無慼也。便疾勅民，皆令種穀。』王即	福 慎 無 慼 也 便 疾 勅 民 皆 令 種 穀 王 即 
T03n0152_001:0002a28	如命，男女就業，家無不修，稻化為蓏，農	如 命 男 女 就 業 家 無 不 修 稻 化 為 蓏 農 
T03n0152_001:0002a29	臣以聞。王曰：『須熟。』蓏實覆國，皆含稻穬，中	臣 以 聞 王 曰 須 熟 蓏 實 覆 國 皆 含 稻 穬 中 
T03n0152_001:0002b01	容數斛，其味苾芬，香聞一國；舉國欣懌，	容 數 斛 其 味 苾 芬 香 聞 一 國 舉 國 欣 懌 
T03n0152_001:0002b02	歎詠王德。四境讎國皆稱臣妾，黎民雲集，	歎 詠 王 德 四 境 讎 國 皆 稱 臣 妾 黎 民 雲 集 
T03n0152_001:0002b03	國界日長。率土持戒，歸命三尊，王及臣民	國 界 日 長 率 土 持 戒 歸 命 三 尊 王 及 臣 民 
T03n0152_001:0002b04	壽終之後，皆生天上。」佛言：「時貧人者，吾身是	壽終之後 皆 生 天 上 佛 言 時 貧 人 者 吾 身 是 
T03n0152_001:0002b05	也。累劫仁惠拯濟眾生，功不徒朽，今果得	也 累 劫 仁 惠 拯 濟 眾 生 功 不 徒 朽 今 果 得 
T03n0152_001:0002b06	佛，號天中天，為三界雄。菩薩慈惠度無極	佛 號 天 中 天 為 三 界 雄 菩 薩 慈 惠 度 無 極 
T03n0152_001:0002b07	行布施如是。」	行 布 施 如 是 
T03n0152_001:0002b08	（四）「昔者菩薩，時為逝心，恒處山澤，專精念	 四 昔 者 菩 薩 時 為 逝 心 恒 處 山 澤 專 精 念 
T03n0152_001:0002b09	道不犯諸惡。食果飲水不畜微餘，慈念	道 不 犯 諸 惡 食 果 飲 水 不 畜 微 餘 慈 念 
T03n0152_001:0002b10	眾生愚癡自衰，每覩危厄沒命濟之。行	眾 生 愚 癡 自 衰 每 覩 危 厄 沒 命 濟 之 行 
T03n0152_001:0002b11	索果蓏，道逢乳虎。虎乳之後，疲困乏食，	索 果 蓏 道 逢 乳 虎 虎 乳 之 後 疲 困 乏 食 
T03n0152_001:0002b12	飢饉心荒，欲還食子。菩薩覩之愴然心	飢 饉 心 荒 欲 還 食 子 菩 薩 覩 之 愴 然 心 
T03n0152_001:0002b13	悲，哀念眾生處世憂苦其為無量，母子相	悲 哀 念 眾 生 處 世 憂 苦 其 為 無 量 母 子 相 
T03n0152_001:0002b14	吞其痛難言，哽咽流淚。迴身四顧，索可	吞 其 痛 難 言 哽 咽 流 淚 迴 身 四 顧 索 可 
T03n0152_001:0002b15	以食虎，以濟子命。都無所見，內自惟曰：	以 食 虎 以 濟 子 命 都 無 所 見 內 自 惟 曰 
T03n0152_001:0002b16	『夫虎肉食之類也。』深重思惟：『吾建志學道，	 夫 虎 肉 食 之 類 也 深 重 思 惟 吾 建 志 學 道 
T03n0152_001:0002b17	但為眾生沒在重苦欲以濟之，令得去	但 為 眾 生 沒 在 重 苦 欲 以 濟 之 令 得 去 
T03n0152_001:0002b18	禍身命永安耳。吾後老死，身會棄捐，不	禍 身 命 永 安 耳 吾 後 老 死 身 會 棄 捐 不 
T03n0152_001:0002b19	如慈惠濟眾成德。』即自以首投虎口中。	如 慈 惠 濟 眾 成 德 即 自 以 首 投 虎 口 中 
T03n0152_001:0002b20	以頭與者，欲令疾死不覺其痛耳。虎母	以 頭 與 者 欲 令 疾 死 不 覺 其 痛 耳 虎 母 
T03n0152_001:0002b21	子俱全。諸佛歎德，上聖齊功，天龍善神	子 俱 全 諸 佛 歎 德 上 聖 齊 功 天 龍 善 神 
T03n0152_001:0002b22	有道志者，靡不愴然。進行或得溝港、頻	有 道 志 者 靡 不 愴 然 進 行 或 得 溝 港 頻 
T03n0152_001:0002b23	來、不還、應真、緣一覺、有發無上正真道意	來 不 還 應 真 緣 一 覺 有 發 無 上 正 真 道 意 
T03n0152_001:0002b24	者。以斯猛志，跨諸菩薩九劫之前，誓於五	者 以 斯 猛 志 跨 諸 菩 薩 九 劫 之 前 誓 於 五 
T03n0152_001:0002b25	濁為天人師，度諸逆惡令偽順道。菩薩慈	濁 為 天 人 師 度 諸 逆 惡 令 偽 順 道 菩 薩 慈 
T03n0152_001:0002b26	惠度無極行布施如是。」	惠 度 無 極 行 布 施 如 是 
T03n0152_001:0002b27	（五）「昔者菩薩為大國王，國名乾夷，王號偏	 五 昔 者 菩 薩 為 大 國 王 國 名 乾 夷 王 號 偏 
T03n0152_001:0002b28	悅，內明外仁，顏和正平，民從其化，獄無繫	悅 內 明 外 仁 顏 和 正 平 民 從 其 化 獄 無 繫 
T03n0152_001:0002b29	囚，黎民貧乏恣所求索，慈惠和潤，恩如帝	囚 黎 民 貧 乏 恣 所 求 索 慈 惠 和 潤 恩 如 帝 
T03n0152_001:0002c01	釋。「他國逝心服王仁施從眾所欲，群邪妬	釋 他 國 逝 心 服 王 仁 施 從 眾 所 欲 群 邪 妬 
T03n0152_001:0002c02	嫉以偽毀真，詣宮門曰：『吾聞明王濟黎	嫉 以 偽 毀 真 詣 宮 門 曰 吾 聞 明 王 濟 黎 
T03n0152_001:0002c03	民之困乏，猶天潤之普覆。』告衛士曰：『爾	民 之 困 乏 猶 天 潤 之 普 覆 告 衛 士 曰 爾 
T03n0152_001:0002c04	可聞乎？』近臣以聞，王即現矣。「逝心現曰：『明	可 聞 乎 近 臣 以 聞 王 即 現 矣 逝 心 現 曰 明 
T03n0152_001:0002c05	王仁澤被于四國，有識之類靡不咨嗟，敢	王 仁 澤 被 于 四 國 有 識 之 類 靡 不 咨 嗟 敢 
T03n0152_001:0002c06	執所願欲以上聞。』王曰：『大善！』逝心曰：『天	執 所 願 欲 以 上 聞 王 曰 大 善 逝 心 曰 天 
T03n0152_001:0002c07	王尚施，求則無違。時宜應用人首為事，	王 尚 施 求 則 無 違 時 宜 應 用 人 首 為 事 
T03n0152_001:0002c08	願乞王首以副望矣。』王曰：『吾首何好而欲	願 乞 王 首 以 副 望 矣 王 曰 吾 首 何 好 而 欲 
T03n0152_001:0002c09	得之乎？吾有眾寶益以惠子。』逝心不受，	得 之 乎 吾 有 眾 寶 益 以 惠 子 逝 心 不 受 
T03n0152_001:0002c10	又使工匠作七寶首，各數百枚，以與逝心。	又 使 工 匠 作 七 寶 首 各 數 百 枚 以 與 逝 心 
T03n0152_001:0002c11	逝心曰：『唯欲王首耳。』「王未甞逆人，即自	逝 心 曰 唯 欲 王 首 耳 王 未 甞 逆 人 即 自 
T03n0152_001:0002c12	下殿以髮纏樹曰：『吾以首惠子。』逝心拔	下 殿 以 髮 纏 樹 曰 吾 以 首 惠 子 逝 心 拔 
T03n0152_001:0002c13	刀疾步而進，樹神覩之忿其無道，以手	刀 疾 步 而 進 樹 神 覩 之 忿 其 無 道 以 手 
T03n0152_001:0002c14	搏其頰，身即繚戾，面為反向，手垂刀	搏 其 頰 身 即 繚 戾 面 為 反 向 手 垂 刀 
T03n0152_001:0002c15	隕。王得平康，臣民稱壽，悲喜交集，諸天	隕 王 得 平 康 臣 民 稱 壽 悲 喜 交 集 諸 天 
T03n0152_001:0002c16	歎德，可謂內施乎！四王擁護，眾毒消歇，	歎 德 可 謂 內 施 乎 四 王 擁 護 眾 毒 消 歇 
T03n0152_001:0002c17	境界無病，五穀豐熟，牢獄裂毀，君民欣欣。」	境 界 無 病 五 穀 豐 熟 牢 獄 裂 毀 君 民 欣 欣 
T03n0152_001:0002c18	佛告諸沙門：「時乾夷國王者，即吾身也。逝	佛 告 諸 沙 門 時 乾 夷 國 王 者 即 吾 身 也 逝 
T03n0152_001:0002c19	心者，調達是。菩薩慈惠度無極行布施如	心 者 調 達 是 菩 薩 慈 惠 度 無 極 行 布 施 如 
T03n0152_001:0002c20	是。」	是 
T03n0152_001:0002c21	（六）「昔者菩薩為大國王，理民以慈，恕己度	 六 昔 者 菩 薩 為 大 國 王 理 民 以 慈 恕 己 度 
T03n0152_001:0002c22	彼，月月巡行貧乏，拔濟鰥寡、疾藥糜粥。每	彼 月 月 巡 行 貧 乏 拔 濟 鰥 寡 疾 藥 糜 粥 每 
T03n0152_001:0002c23	出巡狩，則命後車具載眾寶衣被醫藥，死	出 巡 狩 則 命 後 車 具 載 眾 寶 衣 被 醫 藥 死 
T03n0152_001:0002c24	者葬之。每覩貧民輙自咎責：『君貧德，民窮	者 葬 之 每 覩 貧 民 輙 自 咎 責 君 貧 德 民 窮 
T03n0152_001:0002c25	矣；君富德，民家足。今民貧，則吾貧矣。』王慈	矣 君 富 德 民 家 足 今 民 貧 則 吾 貧 矣 王 慈 
T03n0152_001:0002c26	若斯，名被十方。「第二帝釋坐為其熱，釋心	若 斯 名 被 十 方 第 二 帝 釋 坐 為 其 熱 釋 心 
T03n0152_001:0002c27	即懼曰：『彼德巍巍，必奪吾位。吾壞其志，行	即 懼 曰 彼 德 巍 巍 必 奪 吾 位 吾 壞 其 志 行 
T03n0152_001:0002c28	即畢乎！』便自變化為老梵志，從王乞銀	即 畢 乎 便 自 變 化 為 老 梵 志 從 王 乞 銀 
T03n0152_001:0002c29	錢一千，王即惠之。曰：『吾西[穴/老]，恐人盜	錢 一 千 王 即 惠 之 曰 吾 西 [穴老] 恐 人 盜 
T03n0152_001:0003a01	之。願以寄王。』王曰：『吾國無盜。』重曰：『寄	之 願 以 寄 王 王 曰 吾 國 無 盜 重 曰 寄 
T03n0152_001:0003a02	王。』王即受之。「天又化為梵志詣宮門，	王 王 即 受 之 天 又 化 為 梵 志 詣 宮 門 
T03n0152_001:0003a03	近臣以聞，王即現之。梵志歎曰：『大王功名	近 臣 以 聞 王 即 現 之 梵 志 歎 曰 大 王 功 名 
T03n0152_001:0003a04	流布八極，德行希有。今故遠來，欲有所乞。』	流 布 八 極 德 行 希 有 今 故 遠 來 欲 有 所 乞 
T03n0152_001:0003a05	王曰：『甚善！』曰：『吾宿薄祐生在凡庶，欣慕尊	王 曰 甚 善 曰 吾 宿 薄 祐 生 在 凡 庶 欣 慕 尊 
T03n0152_001:0003a06	榮，欲乞斯國。』王曰：『大善！』即與妻子，輙輕	榮 欲 乞 斯 國 王 曰 大 善 即 與 妻 子 輙 輕 
T03n0152_001:0003a07	乘而去。「天帝復化為梵志，從王乞車；以車	乘 而 去 天 帝 復 化 為 梵 志 從 王 乞 車 以 車 
T03n0152_001:0003a08	馬惠之。與妻子進路，依山止宿。有五通	馬 惠 之 與 妻 子 進 路 依 山 止 宿 有 五 通 
T03n0152_001:0003a09	道士與王為友，侻憶王德仰視其宿，	道 士 與 王 為 友 侻 憶 王 德 仰 視 其 宿 
T03n0152_001:0003a10	覩之失國，靖心禪息，覩天帝釋，貪嫉奪	覩 之 失 國 靖 心 禪 息 覩 天 帝 釋 貪 嫉 奪 
T03n0152_001:0003a11	國委頓疲疵。道士以神足忽然之王所，	國 委 頓 疲 疵 道 士 以 神 足 忽 然 之 王 所 
T03n0152_001:0003a12	曰：『將欲何求，勞志若茲？』曰：『吾志所存，子具	曰 將 欲 何 求 勞 志 若 茲 曰 吾 志 所 存 子 具 
T03n0152_001:0003a13	知之。』道士即化為一轅之車，以送王還，晨	知 之 道 士 即 化 為 一 轅 之 車 以 送 王 還 晨 
T03n0152_001:0003a14	各離矣。「天化為梵志復乞其車，即復	各 離 矣 天 化 為 梵 志 復 乞 其 車 即 復 
T03n0152_001:0003a15	惠之。轉進未至彼國數十里，天復化為	惠 之 轉 進 未 至 彼 國 數 十 里 天 復 化 為 
