T03n0152_003:0013c16	一。』即行取樵然之為炭，向道士曰：『吾身	一 即 行 取 樵 然 之 為 炭 向 道 士 曰 吾 身 
T03n0152_003:0013c17	雖小，可供一日之粮。』言畢即自投火，火為	雖 小 可 供 一 日 之 粮 言 畢 即 自 投 火 火 為 
T03n0152_003:0013c18	不然。道士覩之，感其若斯，諸佛歎德，天	不 然 道 士 覩 之 感 其 若 斯 諸 佛 歎 德 天 
T03n0152_003:0013c19	神慈育。道士遂留，日說妙經，四獸稟誨。」佛	神 慈 育 道 士 遂 留 日 說 妙 經 四 獸 稟 誨 佛 
T03n0152_003:0013c20	告諸沙門：「梵志者，錠光佛是也。兔者，吾身	告 諸 沙 門 梵 志 者 錠 光 佛 是 也 兔 者 吾 身 
T03n0152_003:0013c21	是也。獼猴者，秋鷺子是也。狐者，阿難是	是 也 獼 猴 者 秋 鷺 子 是 也 狐 者 阿 難 是 
T03n0152_003:0013c22	也。獺者，目連是也。菩薩慈惠度無極行布	也 獺 者 目 連 是 也 菩 薩 慈 惠 度 無 極 行 布 
T03n0152_003:0013c23	施如是。」	施 如 是 
T03n0152_003:0013c24	（二二）「昔者菩薩為大理家，積寶齊國，常好濟	 二 二 昔 者 菩 薩 為 大 理 家 積 寶 齊 國 常 好 濟 
T03n0152_003:0013c25	貧惠逮眾生，受一切歸猶海含流。時，有友	貧 惠 逮 眾 生 受 一 切 歸 猶 海 含 流 時 有 友 
T03n0152_003:0013c26	子，以泆蕩之行，家賄消盡。理家愍焉，教之	子 以 泆 蕩 之 行 家 賄 消 盡 理 家 愍 焉 教 之 
T03n0152_003:0013c27	曰：『治生以道，福利無盡。』以金千兩給子	曰 治 生 以 道 福 利 無 盡 以 金 千 兩 給 子 
T03n0152_003:0013c28	為本。對曰：『敬諾。不敢違明誨。』即以行賈。	為 本 對 曰 敬 諾 不 敢 違 明 誨 即 以 行 賈 
T03n0152_003:0013c29	性邪行嬖，好事鬼妖，婬蕩酒樂，財盡復窮。	性 邪 行 嬖 好 事 鬼 妖 婬 蕩 酒 樂 財 盡 復 窮 
T03n0152_003:0014a01	如斯五行[歹*斯]盡其財，窮還守之。時，理家門	如 斯 五 行 [歹斯] 盡 其 財 窮 還 守 之 時 理 家 門 
T03n0152_003:0014a02	外糞上有死鼠，理家示之曰：『夫聰明之	外 糞 上 有 死 鼠 理 家 示 之 曰 夫 聰 明 之 
T03n0152_003:0014a03	善士者，可以彼死鼠治生成居也。有金	善 士 者 可 以 彼 死 鼠 治 生 成 居 也 有 金 
T03n0152_003:0014a04	千兩而窮困乎？今復以金千兩給汝。』「時	千 兩 而 窮 困 乎 今 復 以 金 千 兩 給 汝 時 
T03n0152_003:0014a05	有乞兒，遙聞斯誨愴然而感，進猶乞食，還	有 乞 兒 遙 聞 斯 誨 愴 然 而 感 進 猶 乞 食 還 
T03n0152_003:0014a06	取鼠去，循彼妙教，具乞諸味，調和炙之，	取 鼠 去 循 彼 妙 教 具 乞 諸 味 調 和 炙 之 
T03n0152_003:0014a07	賣得兩錢；轉以販菜，致有百餘。以微致	賣 得 兩 錢 轉 以 販 菜 致 有 百 餘 以 微 致 
T03n0152_003:0014a08	著，遂成富姓。閑居憶曰：『吾本乞兒，緣致斯	著 遂 成 富 姓 閑 居 憶 曰 吾 本 乞 兒 緣 致 斯 
T03n0152_003:0014a09	賄乎！』寤曰：『由賢理家訓彼兒頑，吾致	賄 乎 寤 曰 由 賢 理 家 訓 彼 兒 頑 吾 致 
T03n0152_003:0014a10	斯寶。受恩不報，謂之背明。』作一銀案，又	斯 寶 受 恩 不 報 謂 之 背 明 作 一 銀 案 又 
T03n0152_003:0014a11	為金鼠，以眾名珍滿其腹內，羅著案上。又	為 金 鼠 以 眾 名 珍 滿 其 腹 內 羅 著 案 上 又 
T03n0152_003:0014a12	以眾寶瓔珞其邊，具以眾甘，禮彼理家，	以 眾 寶 瓔 珞 其 邊 具 以 眾 甘 禮 彼 理 家 
T03n0152_003:0014a13	陳其所以：『今答天潤。』理家曰：『賢哉，丈夫！可	陳 其 所 以 今 答 天 潤 理 家 曰 賢 哉 丈 夫 可 
T03n0152_003:0014a14	為教訓矣。』即以女妻之，居處眾諸都以	為 教 訓 矣 即 以 女 妻 之 居 處 眾 諸 都 以 
T03n0152_003:0014a15	付焉，曰：『汝為吾後，當奉佛三寶，以四等心	付 焉 曰 汝 為 吾 後 當 奉 佛 三 寶 以 四 等 心 
T03n0152_003:0014a16	救濟眾生。』對曰：『必修佛教矣。』後為理家	救 濟 眾 生 對 曰 必 修 佛 教 矣 後 為 理 家 
T03n0152_003:0014a17	之嗣，一國稱孝。」佛告諸沙門：「理家者，吾身	之 嗣 一 國 稱 孝 佛 告 諸 沙 門 理 家 者 吾 身 
T03n0152_003:0014a18	是也。彼蕩子者，調達是。以鼠致富者，槃特	是 也 彼 蕩 子 者 調 達 是 以 鼠 致 富 者 槃 特 
T03n0152_003:0014a19	比丘是。調達懷吾六億品經，言順行逆，	比 丘 是 調 達 懷 吾 六 億 品 經 言 順 行 逆 
T03n0152_003:0014a20	死入太山地獄。槃特比丘，懷吾一句，乃	死 入 太 山 地 獄 槃 特 比 丘 懷 吾 一 句 乃 
T03n0152_003:0014a21	致度世。夫有言無行，猶膏以明自賊，斯	致 度 世 夫 有 言 無 行 猶 膏 以 明 自 賊 斯 
T03n0152_003:0014a22	小人之智也。言行相扶，明猶日月，含懷	小 人 之 智 也 言 行 相 扶 明 猶 日 月 含 懷 
T03n0152_003:0014a23	眾生成濟萬物，斯大人之明也。行者是地，	眾 生 成 濟 萬 物 斯 大 人 之 明 也 行 者 是 地 
T03n0152_003:0014a24	萬物所由生矣。菩薩慈惠度無極行布施	萬 物 所 由 生 矣 菩 薩 慈 惠 度 無 極 行 布 施 
T03n0152_003:0014a25	如是。」	如 是 
T03n0152_003:0014a26	（二三）「昔有獨母為理家賃，守視田園。主人	 二 三 昔 有 獨 母 為 理 家 賃 守 視 田 園 主 人 
T03n0152_003:0014a27	有徨，餉過食時。時至欲食，沙門從乞。心	有 徨 餉 過 食 時 時 至 欲 食 沙 門 從 乞 心 
T03n0152_003:0014a28	存斯人，絕欲棄邪厥行清真。『濟四海餓人	存 斯 人 絕 欲 棄 邪 厥 行 清 真 濟 四 海 餓 人 
T03n0152_003:0014a29	不如少惠淨戒真賢者。』以所食分盡著	不 如 少 惠 淨 戒 真 賢 者 以 所 食 分 盡 著 
T03n0152_003:0014b01	鉢中，蓮華一枚著上貢焉！道人現神足	鉢 中 蓮 華 一 枚 著 上 貢 焉 道 人 現 神 足 
T03n0152_003:0014b02	放光明，母喜歎曰：『真所謂神聖者乎！願我後	放 光 明 母 喜 歎 曰 真 所 謂 神 聖 者 乎 願 我 後 
T03n0152_003:0014b03	生百子若茲。』母終神遷，應為梵志嗣矣。	生 百 子 若 茲 母 終 神 遷 應 為 梵 志 嗣 矣 
T03n0152_003:0014b04	其靈集梵志小便之處，鹿舐小便即感之	其 靈 集 梵 志 小 便 之 處 鹿 舐 小 便 即 感 之 
T03n0152_003:0014b05	生。時滿生女，梵志育焉。年有十餘，光儀庠	生 時 滿 生 女 梵 志 育 焉 年 有 十 餘 光 儀 庠 
T03n0152_003:0014b06	步，守居護火。女與鹿戲，不覺火滅。父還恚	步 守 居 護 火 女 與 鹿 戲 不 覺 火 滅 父 還 恚 
T03n0152_003:0014b07	之，令行索火。女至人聚，一躇步處一蓮	之 令 行 索 火 女 至 人 聚 一 躇 步 處 一 蓮 
T03n0152_003:0014b08	華生。火主曰：『爾遶吾居三匝，以火與爾。』	華 生 火 主 曰 爾 遶 吾 居 三 匝 以 火 與 爾 
T03n0152_003:0014b09	女即順命，華生陸地圍屋三重；行者住足，	女 即 順 命 華 生 陸 地 圍 屋 三 重 行 者 住 足 
T03n0152_003:0014b10	靡不雅奇。「斯須宣聲聞其國王，王命工	靡 不 雅 奇 斯 須 宣 聲 聞 其 國 王 王 命 工 
T03n0152_003:0014b11	相相其貴賤。師曰：『必有聖嗣，傳祚無窮。』	相 相 其 貴 賤 師 曰 必 有 聖 嗣 傳 祚 無 窮 
T03n0152_003:0014b12	王命賢臣娉迎禮備，容華奕奕，宮人莫如。	王 命 賢 臣 娉 迎 禮 備 容 華 奕 奕 宮 人 莫 如 
T03n0152_003:0014b13	懷妊時滿，生卵百枚。后妃逮妾靡不嫉焉，	懷 妊 時 滿 生 卵 百 枚 后 妃 逮 妾 靡 不 嫉 焉 
T03n0152_003:0014b14	豫刻芭蕉為鬼形像，臨產以髮被覆其	豫 刻 芭 蕉 為 鬼 形 像 臨 產 以 髮 被 覆 其 
T03n0152_003:0014b15	面，惡露塗芭蕉，以之示王。眾妖弊明，	面 惡 露 塗 芭 蕉 以 之 示 王 眾 妖 弊 明 
T03n0152_003:0014b16	王惑信矣。群邪以壺盛卵，密覆其口，投	王 惑 信 矣 群 邪 以 壺 盛 卵 密 覆 其 口 投 
T03n0152_003:0014b17	江流矣。「天帝釋下，以印封口，諸天翼衛，順	江 流 矣 天 帝 釋 下 以 印 封 口 諸 天 翼 衛 順 
T03n0152_003:0014b18	流停止，猶柱植地。下流之國，其王於臺	流 停 止 猶 柱 植 地 下 流 之 國 其 王 於 臺 
T03n0152_003:0014b19	遙覩水中有壺流下，韑輝光耀似有乾	遙 覩 水 中 有 壺 流 下 韑 輝 光 耀 似 有 乾 
T03n0152_003:0014b20	靈，取之觀焉。覩帝印文，發得百卵，令百	靈 取 之 觀 焉 覩 帝 印 文 發 得 百 卵 令 百 
T03n0152_003:0014b21	婦人懷育溫煖。時滿體成，產為百男。生有	婦 人 懷 育 溫 煖 時 滿 體 成 產 為 百 男 生 有 
T03n0152_003:0014b22	上聖之智，不啟而自明，顏景跨世，相好希	上 聖 之 智 不 啟 而 自 明 顏 景 跨 世 相 好 希 
T03n0152_003:0014b23	有，力幹勢援，兼人百倍，言音之響有若師	有 力 幹 勢 援 兼 人 百 倍 言 音 之 響 有 若 師 
T03n0152_003:0014b24	子之吼。王即具白象百頭，七寶鞍勒，以供	子 之 吼 王 即 具 白 象 百 頭 七 寶 鞍 勒 以 供 
T03n0152_003:0014b25	聖嗣，令征隣國；四鄰降伏，咸稱臣妾。「又	聖 嗣 令 征 隣 國 四 鄰 降 伏 咸 稱 臣 妾 又 
T03n0152_003:0014b26	伐所生之國，國人巨細靡不悚慄。王曰：『孰	伐 所 生 之 國 國 人 巨 細 靡 不 悚 慄 王 曰 孰 
T03n0152_003:0014b27	有能却斯敵者乎？』夫人曰：『大王無懼，	有 能 却 斯 敵 者 乎 夫 人 曰 大 王 無 懼 
T03n0152_003:0014b28	視敵所由，攻城何方？臨之興觀，為王降	視 敵 所 由 攻 城 何 方 臨 之 興 觀 為 王 降 
T03n0152_003:0014b29	之。』王即視敵所由而立觀矣。母登觀，揚	之 王 即 視 敵 所 由 而 立 觀 矣 母 登 觀 揚 
T03n0152_003:0014c01	聲曰：『夫逆之大，其有三矣。不遠群邪	聲 曰 夫 逆 之 大 其 有 三 矣 不 遠 群 邪 
T03n0152_003:0014c02	招二世咎，斯一也。生不識親而逆孝行，	招 二 世 咎 斯 一 也 生 不 識 親 而 逆 孝 行 
T03n0152_003:0014c03	斯二也。恃勢殺親毒向三尊，斯三也。懷	斯 二 也 恃 勢 殺 親 毒 向 三 尊 斯 三 也 懷 
T03n0152_003:0014c04	斯三逆，其惡無蓋。爾等張口，信現于今。』母	斯 三 逆 其 惡 無 蓋 爾 等 張 口 信 現 于 今 母 
T03n0152_003:0014c05	捉其乳，天令湩射遍百子口。精誠之感，飲	捉 其 乳 天 令 湩 射 遍 百 子 口 精 誠 之 感 飲 
T03n0152_003:0014c06	乳情哀，僉然俱曰：『斯則吾親。』泣涕交頸，	乳 情 哀 僉 然 俱 曰 斯 則 吾 親 泣 涕 交 頸 
T03n0152_003:0014c07	叉手步進，叩頭悔過。親嗣始會，靡不哀慟。	叉 手 步 進 叩 頭 悔 過 親 嗣 始 會 靡 不 哀 慟 
T03n0152_003:0014c08	二國和睦，情過伯叔。異方欣然靡不稱	二 國 和 睦 情 過 伯 叔 異 方 欣 然 靡 不 稱 
T03n0152_003:0014c09	善。「諸子覩世無常如幻，辭親學道，遠世	善 諸 子 覩 世 無 常 如 幻 辭 親 學 道 遠 世 
T03n0152_003:0014c10	穢垢。九十九子皆得緣一覺。一子理國，	穢 垢 九 十 九 子 皆 得 緣 一 覺 一 子 理 國 
T03n0152_003:0014c11	父王崩，為王。大赦眾罪，壞牢獄、裂池塞，	父 王 崩 為 王 大 赦 眾 罪 壞 牢 獄 裂 池 塞 
T03n0152_003:0014c12	免奴使，慰孝悌、養孤獨，開帑藏大布	免 奴 使 慰 孝 悌 養 孤 獨 開 帑 藏 大 布 
T03n0152_003:0014c13	施，隨民之願給。以十善為國法，人人	施 隨 民 之 願 給 以 十 善 為 國 法 人 人 
T03n0152_003:0014c14	帶誦，家有孝子。興立塔寺，供養沙門，	帶 誦 家 有 孝 子 興 立 塔 寺 供 養 沙 門 
T03n0152_003:0014c15	誦經論道口無四惡，諸毒歇盡，壽命益長。	誦 經 論 道 口 無 四 惡 諸 毒 歇 盡 壽 命 益 長 
T03n0152_003:0014c16	天帝養護，猶親育子。」佛告諸沙門：「留為	天 帝 養 護 猶 親 育 子 佛 告 諸 沙 門 留 為 
T03n0152_003:0014c17	王者，吾身是也。父王者，今白淨王是。母者，	王 者 吾 身 是 也 父 王 者 今 白 淨 王 是 母 者 
T03n0152_003:0014c18	舍妙是。菩薩慈惠度無極行布施如是。」	舍 妙 是 菩 薩 慈 惠 度 無 極 行 布 施 如 是 
T03n0152_003:0014c19	（二四）「昔者菩薩，時為梵志，經學明達，國人	 二 四 昔 者 菩 薩 時 為 梵 志 經 學 明 達 國 人 
T03n0152_003:0014c20	師焉。弟子五百，皆有儒德，體好布施，猶	師 焉 弟 子 五 百 皆 有 儒 德 體 好 布 施 猶 
T03n0152_003:0014c21	自護身。時世有佛，號啑如來、無所著、正	自 護 身 時 世 有 佛 號 啑 如 來 無 所 著 正 
T03n0152_003:0014c22	真尊、最正覺，將導三界還神本無。菩薩覩	真 尊 最 正 覺 將 導 三 界 還 神 本 無 菩 薩 覩 
T03n0152_003:0014c23	佛，欣然自歸，請佛及僧七日留家，以	佛 欣 然 自 歸 請 佛 及 僧 七 日 留 家 以 
T03n0152_003:0014c24	禮供養。梵志弟子各諍所主。一人年稚師	禮 供 養 梵 志 弟 子 各 諍 所 主 一 人 年 稚 師 
T03n0152_003:0014c25	使之行，還請事作。師曰：『有事無作者，爾	使 之 行 還 請 事 作 師 曰 有 事 無 作 者 爾 
T03n0152_003:0014c26	攝之焉。』童子對曰：『唯燈無主者也。』師	攝 之 焉 童 子 對 曰 唯 燈 無 主 者 也 師 
T03n0152_003:0014c27	曰：『善哉。』弟子以[土*瓦]盛麻油膏，淨自洗浴，	曰 善 哉 弟 子 以 [土瓦] 盛 麻 油 膏 淨 自 洗 浴 
T03n0152_003:0014c28	白[疊*毛]纏頭，自手然之。「天人龍鬼覩其猛力，	白 [疊毛] 纏 頭 自 手 然 之 天 人 龍 鬼 覩 其 猛 力 
T03n0152_003:0014c29	靡不拊手驚愕，而歎：『世未曾有，斯必為	靡 不 拊 手 驚 愕 而 歎 世 未 曾 有 斯 必 為 
T03n0152_003:0015a01	佛矣。』佛嘉之焉，令明徹夜而頭不損，心	佛 矣 佛 嘉 之 焉 令 明 徹 夜 而 頭 不 損 心 
T03n0152_003:0015a02	定在經霍然無想，七日若茲都無懈惓	定 在 經 霍 然 無 想 七 日 若 茲 都 無 懈 惓 
T03n0152_003:0015a03	念矣。佛則授決：『却無數劫汝當為佛，號	念 矣 佛 則 授 決 却 無 數 劫 汝 當 為 佛 號 
T03n0152_003:0015a04	曰錠光。項中肩上各有光明，教授拯濟，	曰 錠 光 項 中 肩 上 各 有 光 明 教 授 拯 濟 
T03n0152_003:0015a05	眾生獲度其為無量。』天人鬼龍，聞當	眾 生 獲 度 其 為 無 量 天 人 鬼 龍 聞 當 
T03n0152_003:0015a06	為佛，靡不嘉豫稽首拜賀。「梵志念曰：『彼	為 佛 靡 不 嘉 豫 稽 首 拜 賀 梵 志 念 曰 彼 
T03n0152_003:0015a07	其得佛，吾必得也，須當受決。』而佛去焉。前	其 得 佛 吾 必 得 也 須 當 受 決 而 佛 去 焉 前 
T03n0152_003:0015a08	稽首曰：『今設微供誠吾盡心，願授吾決。』佛	稽 首 曰 今 設 微 供 誠 吾 盡 心 願 授 吾 決 佛 
T03n0152_003:0015a09	告梵志：『童子作佛之時，當授爾決。』梵志聞	告 梵 志 童 子 作 佛 之 時 當 授 爾 決 梵 志 聞 
T03n0152_003:0015a10	當得佛，喜忘有身，自斯之後，遂大布	當 得 佛 喜 忘 有 身 自 斯 之 後 遂 大 布 
T03n0152_003:0015a11	施，飢食寒衣，病給醫藥，蜎飛蚑行蠕動之	施 飢 食 寒 衣 病 給 醫 藥 蜎 飛 蚑 行 蠕 動 之 
T03n0152_003:0015a12	類，隨其所食以時濟之。八方諸國，稱為仁	類 隨 其 所 食 以 時 濟 之 八 方 諸 國 稱 為 仁 
T03n0152_003:0015a13	父也。」佛告舍利弗：「童子者，錠光佛是。梵志	父 也 佛 告 舍 利 弗 童 子 者 錠 光 佛 是 梵 志 
T03n0152_003:0015a14	者，吾身是也。菩薩慈惠度無極行布施如	者 吾 身 是 也 菩 薩 慈 惠 度 無 極 行 布 施 如 
T03n0152_003:0015a15	是。」	是 
T03n0152_003:0015a16	（二五）「昔者菩薩，為大理家，積財巨億，常奉三	 二 五 昔 者 菩 薩 為 大 理 家 積 財 巨 億 常 奉 三 
T03n0152_003:0015a17	尊，慈向眾生。觀市覩鼈，心悼之焉，問價	尊 慈 向 眾 生 觀 市 覩 鼈 心 悼 之 焉 問 價 
T03n0152_003:0015a18	貴賤。鼈主知菩薩有普慈之德、尚濟眾	貴 賤 鼈 主 知 菩 薩 有 普 慈 之 德 尚 濟 眾 
T03n0152_003:0015a19	生，財富難數，貴賤無違，答曰：『百萬，能取	生 財 富 難 數 貴 賤 無 違 答 曰 百 萬 能 取 
T03n0152_003:0015a20	者善，不者吾當烹之。』菩薩答曰：『大善！』即	者 善 不 者 吾 當 烹 之 菩 薩 答 曰 大 善 即 
T03n0152_003:0015a21	雇如直，持鼈歸家，澡護其傷，臨水放之。	雇 如 直 持 鼈 歸 家 澡 護 其 傷 臨 水 放 之 
T03n0152_003:0015a22	覩其遊去，悲喜誓曰：『太山餓鬼眾生之類，	覩 其 遊 去 悲 喜 誓 曰 太 山 餓 鬼 眾 生 之 類 
T03n0152_003:0015a23	世主牢獄早獲免難，身安命全如爾今也。』	世 主 牢 獄 早 獲 免 難 身 安 命 全 如 爾 今 也 
T03n0152_003:0015a24	稽首十方，叉手願曰：『眾生擾擾，其苦無量，	稽 首 十 方 叉 手 願 曰 眾 生 擾 擾 其 苦 無 量 
T03n0152_003:0015a25	吾當為天為地，為旱作潤，為漂作筏，	吾 當 為 天 為 地 為 旱 作 潤 為 漂 作 筏 
T03n0152_003:0015a26	飢食渴漿，寒衣熱涼，為病作醫，為冥作	飢 食 渴 漿 寒 衣 熱 涼 為 病 作 醫 為 冥 作 
T03n0152_003:0015a27	光；若有濁世顛倒之時，吾當於中作佛度	光 若 有 濁 世 顛 倒 之 時 吾 當 於 中 作 佛 度 
T03n0152_003:0015a28	彼眾生矣。』十方諸佛皆善其誓，讚曰：『善哉！	彼 眾 生 矣 十方諸佛 皆 善 其 誓 讚 曰 善 哉 
T03n0152_003:0015a29	必獲爾志。』「鼈後夜來齕其門，怪門有聲，使	必 獲 爾 志 鼈 後 夜 來 齕 其 門 怪 門 有 聲 使 
T03n0152_003:0015b01	出覩鼈，還如事云。菩薩視之，鼈人語	出 覩 鼈 還 如 事 云 菩 薩 視 之 鼈 人 語 
T03n0152_003:0015b02	曰：『吾受重潤，身體獲全，無以答潤。	曰 吾 受 重 潤 身 體 獲 全 無 以 答 潤 
T03n0152_003:0015b03	蟲水居物知水盈虛，洪水將至必為巨害	蟲 水 居 物 知 水 盈 虛 洪 水 將 至 必 為 巨 害 
T03n0152_003:0015b04	矣。願速嚴舟，臨時相迎。』答曰：『大善！』明晨	矣 願 速 嚴 舟 臨 時 相 迎 答 曰 大 善 明 晨 
T03n0152_003:0015b05	詣門，如事啟王。王以菩薩宿有善名，信	詣 門 如 事 啟 王 王 以 菩 薩 宿 有 善 名 信 
T03n0152_003:0015b06	用其言：『遷下處高。』時至鼈來曰：『洪水至，	用 其 言 遷 下 處 高 時 至 鼈 來 曰 洪 水 至 
T03n0152_003:0015b07	可速下載，尋吾所之，可獲無患。』船尋	可 速 下 載 尋 吾 所 之 可 獲 無 患 船 尋 
T03n0152_003:0015b08	其後，有蛇趣船，菩薩曰：『取之。』鼈云：『大善！』	其 後 有 蛇 趣 船 菩 薩 曰 取 之 鼈 云 大 善 
T03n0152_003:0015b09	又覩漂狐，曰：『取之。』鼈亦云：『善。』又覩漂人	又 覩 漂 狐 曰 取 之 鼈 亦 云 善 又 覩 漂 人 
T03n0152_003:0015b10	搏頰呼天，哀濟吾命，曰：『取之。』鼈曰：『慎	搏 頰 呼 天 哀 濟 吾 命 曰 取 之 鼈 曰 慎 
T03n0152_003:0015b11	無取也，凡人心偽，尠有終信，背恩追	無 取 也 凡 人 心 偽 尠 有 終 信 背 恩 追 
T03n0152_003:0015b12	勢，好為兇逆。』菩薩曰：『蟲類爾濟，人類吾	勢 好 為 兇 逆 菩 薩 曰 蟲 類 爾 濟 人 類 吾 
T03n0152_003:0015b13	賤，豈是仁哉？吾不忍也。』於是取之。鼈	賤 豈 是 仁 哉 吾 不 忍 也 於 是 取 之 鼈 
T03n0152_003:0015b14	曰：『悔哉！』遂之豐土。鼈辭曰：『恩畢請退。』答	曰 悔 哉 遂 之 豐 土 鼈 辭 曰 恩 畢 請 退 答 
T03n0152_003:0015b15	曰：『吾獲如來、無所著、至真、正覺者，必當相	曰 吾 獲 如 來 無 所 著 至 真 正 覺 者 必 當 相 
T03n0152_003:0015b16	度。』鼈曰：『大善！』鼈退，蛇狐各去。「狐以穴	度 鼈 曰 大 善 鼈 退 蛇 狐 各 去 狐 以 穴 
T03n0152_003:0015b17	為居，獲古人伏藏紫磨名金百斤，喜曰：『當	為 居 獲 古 人 伏 藏 紫 磨 名 金 百 斤 喜 曰 當 
T03n0152_003:0015b18	以報彼恩矣。』馳還曰：『小蟲受潤，獲濟微	以 報 彼 恩 矣 馳 還 曰 小 蟲 受 潤 獲 濟 微 
T03n0152_003:0015b19	命。蟲穴居之物，求穴以自安，獲金百斤，	命 蟲 穴 居 之 物 求 穴 以 自 安 獲 金 百 斤 
T03n0152_003:0015b20	斯穴非塚非家非劫非盜。吾精誠之所致，	斯 穴 非 塚 非 家 非 劫 非 盜 吾 精 誠 之 所 致 
T03n0152_003:0015b21	願以貢賢。』菩薩深惟：『不取徒捐，無益於	願 以 貢 賢 菩 薩 深 惟 不 取 徒 捐 無 益 於 
T03n0152_003:0015b22	貧民；取以布施，眾生獲濟，不亦善乎！』	貧 民 取 以 布 施 眾 生 獲 濟 不 亦 善 乎 
T03n0152_003:0015b23	尋而取之。漂人覩焉，曰：『分吾半矣。』菩薩即	尋 而 取 之 漂 人 覩 焉 曰 分 吾 半 矣 菩 薩 即 
T03n0152_003:0015b24	以十斤惠之。漂人曰：『爾掘塚劫金，罪福	以 十 斤 惠 之 漂 人 曰 爾 掘 塚 劫 金 罪 福 
T03n0152_003:0015b25	應柰何？不半分之，吾必告有司。』答曰：『貧民	應 柰 何 不 半 分 之 吾 必 告 有 司 答 曰 貧 民 
T03n0152_003:0015b26	困乏，吾欲等施；爾欲專之，不亦偏乎？』	困 乏 吾 欲 等 施 爾 欲 專 之 不 亦 偏 乎 
T03n0152_003:0015b27	漂人遂告有司，菩薩見拘，無所告訴，唯	漂 人 遂 告 有 司 菩 薩 見 拘 無 所 告 訴 唯 
T03n0152_003:0015b28	歸命三尊，悔過自責，慈願：『眾生早離八難，	歸 命 三 尊 悔 過 自 責 慈 願 眾 生 早 離 八 難 
T03n0152_003:0015b29	莫有怨結如吾今也。』「蛇狐會曰：『奈斯事	莫 有 怨 結 如 吾 今 也 蛇 狐 會 曰 奈 斯 事 
T03n0152_003:0015c01	何？』蛇曰：『吾將濟之。』遂銜良藥開關入	何 蛇 曰 吾 將 濟 之 遂 銜 良 藥 開 關 入 
T03n0152_003:0015c02	獄。見菩薩狀，顏色有損，愴而心悲，謂	獄 見 菩 薩 狀 顏 色 有 損 愴 而 心 悲 謂 
T03n0152_003:0015c03	菩薩言：『以藥自隨，吾將齚太子，其毒尤	菩 薩 言 以 藥 自 隨 吾 將 齚 太 子 其 毒 尤 
T03n0152_003:0015c04	甚，莫能濟者。賢者以藥自聞，傅則愈矣。』菩	甚 莫 能 濟 者 賢 者 以 藥 自 聞 傅 則 愈 矣 菩 
T03n0152_003:0015c05	薩默然。蛇如所云，太子命將殞，王令曰：	薩 默 然 蛇 如 所 云 太 子 命 將 殞 王 令 曰 
T03n0152_003:0015c06	『有能濟茲，封之相國，吾與參治。』菩薩上	 有 能 濟 茲 封 之 相 國 吾 與 參 治 菩 薩 上 
T03n0152_003:0015c07	聞，傅之即愈。王喜問所由，囚人本末自	聞 傅 之 即 愈 王 喜 問 所 由 囚 人 本 末 自 
T03n0152_003:0015c08	陳。王悵然自咎曰：『吾闇甚哉！』即誅漂人，	陳 王 悵 然 自 咎 曰 吾 闇 甚 哉 即 誅 漂 人 
T03n0152_003:0015c09	大赦其國，封為國相，執手入宮，並坐而	大 赦 其 國 封 為 國 相 執 手 入 宮 並 坐 而 
T03n0152_003:0015c10	曰：『賢者說何書？懷何道？而為二儀之仁，惠	曰 賢 者 說 何 書 懷 何 道 而 為 二 儀 之 仁 惠 
T03n0152_003:0015c11	逮眾生乎？』對曰：『說佛經，懷佛道也。』王曰：	逮 眾 生 乎 對 曰 說 佛 經 懷 佛 道 也 王 曰 
T03n0152_003:0015c12	『佛有要決？』曰：『有之。佛說四非常，在之	 佛 有 要 決 曰 有 之 佛 說 四 非 常 在 之 
T03n0152_003:0015c13	者，眾禍殄，景祐昌。』王曰：『善哉！願獲其	者 眾 禍 殄 景 祐 昌 王 曰 善 哉 願 獲 其 
T03n0152_003:0015c14	實。』曰：『乾坤終訖之時，七日竝列巨海都索，	實 曰 乾 坤 終 訖 之 時 七 日 竝 列 巨 海 都 索 
T03n0152_003:0015c15	天地烔然，須彌崩壞，天人鬼龍、眾生身	天 地 烔 然 須 彌 崩 壞 天 人 鬼 龍 眾 生 身 
T03n0152_003:0015c16	命，霍然燋盡。前盛今衰，所謂非常矣。明	命 霍 然 燋 盡 前 盛 今 衰 所 謂 非 常 矣 明 
T03n0152_003:0015c17	士守無常之念，曰天地尚然，官爵國土，	士 守 無 常 之 念 曰 天 地 尚 然 官 爵 國 土 
T03n0152_003:0015c18	焉得久存？得斯念者，乃有普慈之志矣。』	焉 得 久 存 得 斯 念 者 乃 有 普 慈 之 志 矣 
T03n0152_003:0015c19	王曰：『天地尚然，豈況國土？佛說非常，我	王 曰 天 地 尚 然 豈 況 國 土 佛 說 非 常 我 
T03n0152_003:0015c20	心信哉。』「理家又曰：『苦之尤苦者，王宜知	心 信 哉 理 家 又 曰 苦 之 尤 苦 者 王 宜 知 
T03n0152_003:0015c21	之。』王曰：『願聞明誡。』曰：『眾生識靈微妙難	之 王 曰 願 聞 明 誡 曰 眾 生 識 靈 微 妙 難 
T03n0152_003:0015c22	知，視之無形，聽之無聲，弘也天下，高也	知 視 之 無 形 聽 之 無 聲 弘 也 天 下 高 也 
T03n0152_003:0015c23	無蓋，汪洋無表，輪轉無際。然飢渴于六欲，	無 蓋 汪 洋 無 表 輪 轉 無 際 然 飢 渴 于 六 欲 
T03n0152_003:0015c24	猶海不足于眾流，以斯數更太山燒煮諸	猶 海 不 足 于 眾 流 以 斯 數 更 太 山 燒 煮 諸 
T03n0152_003:0015c25	毒眾苦；或為餓鬼，洋銅沃口役作太山；或	毒 眾 苦 或 為 餓 鬼 洋 銅 沃 口 役 作 太 山 或 
