T04n0197_001:0163c11	佛說興起行經序	佛 說 興 起 行 經 序 
T04n0197_001:0163c13	所謂崑崙山者，則閻浮利地之中心也。山皆	所 謂 崑 崙 山 者 則 閻 浮 利 地 之 中 心 也 山 皆 
T04n0197_001:0163c14	寶石，周匝有五百窟，窟皆黃金，常五百羅漢	寶 石 周 匝 有 五 百 窟 窟 皆 黃 金 常 五 百 羅 漢 
T04n0197_001:0163c15	居之。阿耨大泉，外周圍山，山內平地，泉處其	居 之 阿 耨 大 泉 外 周 圍 山 山 內 平 地 泉 處 其 
T04n0197_001:0163c16	中。泉岸皆黃金，以四獸頭，出水其口。各遶一	中 泉 岸 皆 黃 金 以 四 獸 頭 出 水 其 口 各 遶 一 
T04n0197_001:0163c17	匝已，還復其方，出投四海。象口所出者，則黃	匝 已 還 復 其 方 出 投 四 海 象 口 所 出 者 則 黃 
T04n0197_001:0163c18	河是也。其泉方各二十五由延，深三厥劣——一	河 是 也 其 泉 方 各 二 十 五 由 延 深 三 厥 劣 一 
T04n0197_001:0163c19	厥劣者，七里也。泉中有金臺，臺方一由延，臺	厥 劣 者 七 里 也 泉 中 有 金 臺 臺 方 一 由 延 臺 
T04n0197_001:0163c20	上有金蓮華，以七寶為莖。如來將五百羅漢，	上 有 金 蓮 華 以 七 寶 為 莖 如 來 將 五 百 羅 漢 
T04n0197_001:0163c21	常以月十五日，於中說戒。因舍利弗問佛十	常 以 月十五日 於 中 說 戒 因 舍 利 弗 問 佛 十 
T04n0197_001:0163c22	事宿緣，後以十五日時，將本弟子說訖乃止，	事 宿 緣 後 以 十 五 日 時 將 本 弟 子 說 訖 乃 止 
T04n0197_001:0163c23	如是至九。往所以十問而九答者，以木槍	如 是 至 九 往 所 以 十 問 而 九 答 者 以 木 槍 
T04n0197_001:0163c24	之對，人間償之，欲示人宿緣不可逃避故也。	之 對 人 間 償 之 欲 示 人 宿 緣 不 可 逃 避 故 也 
T04n0197_001:0163c25	又阿耨泉中，非有漏、礙形所可周旋，唯有	又 阿 耨 泉 中 非 有 漏 礙 形 所 可 周 旋 唯 有 
T04n0197_001:0163c26	阿難為如來所接也。所以慇懃告舍利弗者，	阿 難 為 如 來 所 接 也 所 以 慇 懃 告 舍 利 弗 者 
T04n0197_001:0163c27	欲化諸龍故也。	欲 化 諸 龍 故 也 
T04n0197_001:0164a02	佛說興起行經卷上(一名嚴誡宿緣經，出雜藏)	佛 說 興 起 行 經 卷 上 一 名 嚴 誡 宿 緣 經 出 雜 藏 
T04n0197_001:0164a04	後漢外國三藏康孟詳譯	後 漢 外 國 三 藏 康 孟 詳 譯 
T04n0197_001:0164a05	　聞如是：一時，　　佛在摩竭國。	 聞 如 是 一 時 佛 在 摩 竭 國 
T04n0197_001:0164a06	　普為眾生故，　　止於竹園中。	 普 為 眾 生 故 止 於 竹 園 中 
T04n0197_001:0164a07	　佛語諸比丘，　　及神足羅漢：	 佛 語 諸 比 丘 及 神 足 羅 漢 
T04n0197_001:0164a08	「各齎所乞食，　　共至阿耨泉。」	 各 齎 所 乞 食 共 至 阿 耨 泉 
T04n0197_001:0164a09	　路由五姓國，　　將諸比丘眾，	 路 由 五 姓 國 將 諸 比 丘 眾 
T04n0197_001:0164a10	　於中共乞食。　　比丘五百人，	 於 中 共 乞 食 比 丘 五 百 人 
T04n0197_001:0164a11	　以神足飛下，　　比丘僧圍遶，	 以 神 足 飛 下 比 丘 僧 圍 遶 
T04n0197_001:0164a12	　到阿耨大泉，　　世尊坐其中。	 到 阿 耨 大 泉 世 尊 坐 其 中 
T04n0197_001:0164a13	　世尊食已訖，　　諸比丘故食。	 世 尊 食 已 訖 諸 比 丘 故 食 
T04n0197_001:0164a14	　當於飯食時，　　地為大震動。	 當 於 飯 食 時 地 為 大 震 動 
T04n0197_001:0164a15	　比丘問世尊：　　「此地何為動？」	 比 丘 問 世 尊 此 地 何 為 動 
T04n0197_001:0164a16	　世尊便為說，　　愍此眾生動：	 世 尊 便 為 說 愍 此 眾 生 動 
T04n0197_001:0164a17	「地獄有罪人，　　極行眾逆惡，	 地 獄 有 罪 人 極 行 眾 逆 惡 
T04n0197_001:0164a18	　鬼神有千人，　　斫其兩大肋，	 鬼 神 有 千 人 斫 其 兩 大 肋 
T04n0197_001:0164a19	　須臾不休息，　　斧斤皆燒赤，	 須 臾 不 休 息 斧 斤 皆 燒 赤 
T04n0197_001:0164a20	　斫滿正千歲，　　力極乃得斷。」	 斫 滿 正 千 歲 力 極 乃 得 斷 
T04n0197_001:0164a21	　問：「作何等罪，　　乃致此苦痛？	 問 作 何 等 罪 乃 致 此 苦 痛 
T04n0197_001:0164a22	　此肋大爾許，　　使地為震動？」	 此 肋 大 爾 許 使 地 為 震 動 
T04n0197_001:0164a23	「此本世間人，　　恒喜婬他妻，	 此 本 世 間 人 恒 喜 婬 他 妻 
T04n0197_001:0164a24	　坐貪色欲故，　　又殺清信士。	 坐 貪 色 欲 故 又 殺 清 信 士 
T04n0197_001:0164a25	　以是宿緣故，　　致得此大身，	 以 是 宿 緣 故 致 得 此 大 身 
T04n0197_001:0164a26	　鬼神有千人，　　恒斫此兩肋。」	 鬼 神 有 千 人 恒 斫 此 兩 肋 
T04n0197_001:0164a27	　世尊說如是，　　佛問諸四道：	 世 尊 說 如 是 佛 問 諸 四 道 
T04n0197_001:0164a28	「汝等作何緣？　　各各可自說。」	 汝 等 作 何 緣 各 各 可 自 說 
T04n0197_001:0164a29	　神通大弟子，　　能繼轉法輪，	 神 通 大 弟 子 能 繼 轉 法 輪 
T04n0197_001:0164b01	　智慧舍利弗，　　起問於世尊：	 智 慧 舍 利 弗 起 問 於 世 尊 
T04n0197_001:0164b02	「世尊無雙比，　　無事不見聞。	 世 尊 無 雙 比 無 事 不 見 聞 
T04n0197_001:0164b03	　世尊先自說，　　宿世諸因緣。	 世 尊 先 自 說 宿 世 諸 因 緣 
T04n0197_001:0164b04	　孫陀生惡謗，　　望得其敬事，	 孫 陀 生 惡 謗 望 得 其 敬 事 
T04n0197_001:0164b05	　無故誹謗尊，　　此是何因緣？	 無 故 誹 謗 尊 此 是 何 因 緣 
T04n0197_001:0164b06	　坐奢彌跋提，　　此五百比丘，	 坐 奢 彌 跋 提 此 五 百 比 丘 
T04n0197_001:0164b07	　無故相誹謗，　　此是何因緣？	 無 故 相 誹 謗 此 是 何 因 緣 
T04n0197_001:0164b08	　何為得頭痛？　　誅殺五親時，	 何 為 得 頭 痛 誅 殺 五 親 時 
T04n0197_001:0164b09	　諸節皆疼痛；　　及患脊背強；	 諸 節 皆 疼 痛 及 患 脊 背 強 
T04n0197_001:0164b10	　剛木槍刺脚；　　調達崖石擲，	 剛 木 槍 刺 脚 調 達 崖 石 擲 
T04n0197_001:0164b11	　垖破脚拇指；　　此是何因緣？	 垖 破 脚 拇 指 此 是 何 因 緣 
T04n0197_001:0164b12	　多舌童女人，　　帶杅起其腹，	 多 舌 童 女 人 帶 杅 起 其 腹 
T04n0197_001:0164b13	　無故來相謗，　　在於大眾中；	 無 故 來 相 謗 在 於 大 眾 中 
T04n0197_001:0164b14	　又在毘蘭邑，　　三月食馬麥，	 又 在 毘 蘭 邑 三 月 食 馬 麥 
T04n0197_001:0164b15	　國師梵志請，　　此是何因緣？	 國 師 梵 志 請 此 是 何 因 緣 
T04n0197_001:0164b16	　在於欝祕地，　　苦行足六年，	 在 於 欝 祕 地 苦 行 足 六 年 
T04n0197_001:0164b17	　斷息禪羸瘦，　　此是何因緣？」	 斷 息 禪 羸 瘦 此 是 何 因 緣 
T04n0197_001:0164b18	　世尊為演說：　　「舍利弗諦聽。	 世 尊 為 演 說 舍 利 弗 諦 聽 
T04n0197_001:0164b19	　今當盡為說，　　先世所行緣。」	 今 當 盡 為 說 先 世 所 行 緣 
T04n0197_001:0164b20	佛說孫陀利宿緣經第一	佛 說 孫 陀 利 宿 緣 經 第 一 
T04n0197_001:0164b21	聞如是：一時佛在阿耨大泉，與大比丘五百	聞 如 是 一 時 佛 在 阿 耨 大 泉 與 大 比 丘 五 百 
T04n0197_001:0164b22	人俱，皆是阿羅漢——六通神足，大有名稱，端	人 俱 皆 是 阿 羅 漢 六 通 神 足 大 有 名 稱 端 
T04n0197_001:0164b23	正姝好，各有眾相，不長、不短、不白、不黑、不肥、	正 姝 好 各 有 眾 相 不 長 不 短 不 白 不 黑 不 肥 
T04n0197_001:0164b24	不瘦，色猶紅蓮華，皆能伏心意——唯除一比丘，	不 瘦 色 猶 紅 蓮 華 皆 能 伏 心 意 唯 除 一 比 丘 
T04n0197_001:0164b25	何者？阿難是也。舍利弗自從華座起，整衣服，	何 者 阿 難 是 也 舍 利 弗 自 從 華 座 起 整 衣 服 
T04n0197_001:0164b26	偏露右臂，右膝跪蓮華座，向佛叉手，問世	偏 露 右 臂 右 膝 跪 蓮 華 座 向 佛 叉 手 問 世 
T04n0197_001:0164b27	尊言：「世尊無事不見、無事不聞、無事不知，世	尊 言 世 尊 無 事 不 見 無 事 不 聞 無 事 不 知 世 
T04n0197_001:0164b28	尊無雙比，眾惡滅盡、諸善普備，諸天龍神、帝	尊 無 雙 比 眾 惡 滅 盡 諸 善 普 備 諸 天 龍 神 帝 
T04n0197_001:0164b29	王、臣民、一切眾生，皆欲度之。世尊今故現有	王 臣 民 一 切 眾 生 皆 欲 度 之 世 尊 今 故 現 有 
T04n0197_001:0164c01	殘緣？願佛自說此緣，使天人、眾生，聞者開解。	殘 緣 願 佛 自 說 此 緣 使 天 人 眾 生 聞 者 開 解 
T04n0197_001:0164c02	以何因緣，孫陀利來誹謗？以何因緣，坐奢彌	以何因緣 孫 陀 利 來 誹 謗 以何因緣 坐 奢 彌 
T04n0197_001:0164c03	跋提被謗，及五百羅漢？以何因緣，世尊頭痛？	跋 提 被 謗 及 五 百 羅 漢 以何因緣 世 尊 頭 痛 
T04n0197_001:0164c04	以何因緣，世尊骨節疼痛？以何因緣，世尊脊	以何因緣 世 尊 骨 節 疼 痛 以何因緣 世 尊 脊 
T04n0197_001:0164c05	背強？以何因緣，剛木刺其脚？以何因緣，地婆	背 強 以何因緣 剛 木 刺 其 脚 以何因緣 地 婆 
T04n0197_001:0164c06	達兜以崖石擲？以何因緣，多舌女人，帶杅	達 兜 以 崖 石 擲 以何因緣 多 舌 女 人 帶 杅 
T04n0197_001:0164c07	大眾中，有漏、無漏，前來相誹謗曰：『何以不自	大 眾 中 有 漏 無 漏 前 來 相 誹 謗 曰 何 以 不 自 
T04n0197_001:0164c08	說家事，乃為他說為？我今臨產，當須酥油。』	說 家 事 乃 為 他 說 為 我 今 臨 產 當 須 酥 油 
T04n0197_001:0164c09	以何因緣，於毘蘭邑，與五百比丘食馬麥？以	以何因緣 於 毘 蘭 邑 與 五 百 比 丘 食 馬 麥 以 
T04n0197_001:0164c10	何因緣，在欝祕地，苦行經六年，謂呼當得佛？」	何 因 緣 在 欝 祕 地 苦 行 經 六 年 謂 呼 當 得 佛 
T04n0197_001:0164c11	佛語舍利弗：「還復華座。吾當為汝說先世諸	佛 語 舍 利 弗 還 復 華 座 吾 當 為 汝 說 先 世 諸 
T04n0197_001:0164c12	因緣。」舍利弗即便還復本座。阿耨大龍王，聞	因 緣 舍 利 弗 即 便 還 復 本 座 阿 耨 大 龍 王 聞 
T04n0197_001:0164c13	佛當說緣法，踊躍歡喜，即為佛作七寶交露	佛 當 說 緣 法 踊 躍 歡 喜 即 為 佛 作 七寶交露 
T04n0197_001:0164c14	蓋，蓋中雨栴檀、末香，周遍諸座。無數諸天龍、	蓋 蓋 中 雨 栴 檀 末 香 周 遍 諸 座 無 數 諸 天 龍 
T04n0197_001:0164c15	鬼神、乾沓和、阿須倫、迦樓羅、甄陀羅、摩休勒，	鬼 神 乾 沓 和 阿 須 倫 迦 樓 羅 甄 陀 羅 摩 休 勒 
T04n0197_001:0164c16	皆來詣佛，叉手作禮，圍遶而立。佛便為舍利	皆 來 詣 佛 叉 手 作 禮 圍 遶 而 立 佛 便 為 舍 利 
T04n0197_001:0164c17	弗說：「往昔過去世，波羅[木*奈]城中，有博戲人，	弗 說 往 昔 過 去 世 波 羅 [木奈] 城 中 有 博 戲 人 
T04n0197_001:0164c18	名曰淨眼，巧於歌戲。爾時，有婬女，名曰鹿相，	名 曰 淨 眼 巧 於 歌 戲 爾 時 有 婬 女 名 曰 鹿 相 
T04n0197_001:0164c19	端正姝好，嚴淨無比。時淨眼往至鹿相所，語	端 正 姝 好 嚴 淨 無 比 時 淨 眼 往 至 鹿 相 所 語 
T04n0197_001:0164c20	此女曰：『當共出外，詣樹園中，求於好地，共相	此 女 曰 當 共 出 外 詣 樹 園 中 求 於 好 地 共 相 
T04n0197_001:0164c21	娛樂。』女答曰：『可爾。』鹿相便歸，莊嚴衣服，詣淨	娛 樂 女 答 曰 可 爾 鹿 相 便 歸 莊 嚴 衣 服 詣 淨 
T04n0197_001:0164c22	眼家。淨眼即嚴駕好車，與鹿相共載，出波羅	眼 家 淨 眼 即 嚴 駕 好 車 與 鹿 相 共 載 出 波 羅 
T04n0197_001:0164c23	[木*奈]城，至於樹園，共相娛樂。「經於日夜，淨眼	[木奈] 城 至 於 樹 園 共 相 娛 樂 經 於 日 夜 淨 眼 
T04n0197_001:0164c24	覩其衣服珍妙，便生貪心：『當殺此女，取其衣	覩 其 衣 服 珍 妙 便 生 貪 心 當 殺 此 女 取 其 衣 
T04n0197_001:0164c25	服。』復念：『殺已，當云何藏之？』時此園中，有辟支	服 復 念 殺 已 當 云 何 藏 之 時 此 園 中 有 辟 支 
T04n0197_001:0164c26	佛，名樂無為，去其所止不遠。淨眼又念：『此辟	佛 名 樂 無 為 去 其 所 止 不 遠 淨 眼 又 念 此 辟 
T04n0197_001:0164c27	支佛，晨入城乞食後，我當殺鹿相，埋其廬中，	支 佛 晨 入 城 乞 食 後 我 當 殺 鹿 相 埋 其 廬 中 
T04n0197_001:0164c28	持衣而歸，誰知我處？』明旦，辟支佛即入城	持 衣 而 歸 誰 知 我 處 明 旦 辟 支 佛 即 入 城 
T04n0197_001:0164c29	乞食，淨眼於後，便殺鹿相，脫衣服取，埋屍	乞 食 淨 眼 於 後 便 殺 鹿 相 脫 衣 服 取 埋 屍 
T04n0197_001:0165a01	著樂無為廬中，平地如故，便乘車從餘門入	著 樂 無 為 廬 中 平 地 如 故 便 乘 車 從 餘 門 入 
T04n0197_001:0165a02	城。「爾時，波羅[木*奈]國王名梵達。國人不見鹿	城 爾 時 波 羅 [木奈] 國 王 名 梵 達 國 人 不 見 鹿 
T04n0197_001:0165a03	相，遂徹國王，眾人白王：『鹿相不見。』王即召群	相 遂 徹 國 王 眾 人 白 王 鹿 相 不 見 王 即 召 群 
T04n0197_001:0165a04	臣，遍詣里巷，戶至覔之。諸臣受教，如命	臣 遍 詣 里 巷 戶 至 覔 之 諸 臣 受 教 如 命 
T04n0197_001:0165a05	覔之，遍覔不得，便復出城，見樹間眾鳥飛	覔 之 遍 覔 不 得 便 復 出 城 見 樹 間 眾 鳥 飛 
T04n0197_001:0165a06	翔其上，眾人便念：『城中已遍不得，此必有以，	翔 其 上 眾 人 便 念 城 中 已 遍 不 得 此 必 有 以 
T04n0197_001:0165a07	當共往彼。』即尋便往到樂無為廬前，搜索得	當 共 往 彼 即 尋 便 往 到 樂 無 為 廬 前 搜 索 得 
T04n0197_001:0165a08	屍。諸臣語樂無為曰：『已行不淨，胡為復殺？』辟	屍 諸 臣 語 樂 無 為 曰 已 行 不 淨 胡 為 復 殺 辟 
T04n0197_001:0165a09	支佛默然不答。問如此至三，不答如前。樂無	支 佛 默 然 不 答 問 如 此 至 三 不 答 如 前 樂 無 
T04n0197_001:0165a10	為手脚著土，此是先世因緣，故默不答。「眾	為 手 脚 著 土 此 是 先世因緣 故 默 不 答 眾 
T04n0197_001:0165a11	臣便反縛樂無為，拷打問辭。樹神人現出半	臣 便 反 縛 樂 無 為 拷 打 問 辭 樹 神 人 現 出 半 
T04n0197_001:0165a12	身，語眾人曰：『莫拷打此人。』眾臣曰：『何以不	身 語 眾 人 曰 莫 拷 打 此 人 眾 臣 曰 何 以 不 
T04n0197_001:0165a13	打？』神曰：『此無是法，終不行是。』諸臣雖聞神	打 神 曰 此 無 是 法 終 不 行 是 諸 臣 雖 聞 神 
T04n0197_001:0165a14	言，不肯聽用，將此樂無為，徑詣王所，白王	言 不 肯 聽 用 將 此 樂 無 為 徑 詣 王 所 白 王 
T04n0197_001:0165a15	曰：『此道士，行不淨已，又復殺之。』王聞是語，	曰 此 道 士 行 不 淨 已 又 復 殺 之 王 聞 是 語 
T04n0197_001:0165a16	瞋恚大喚，語諸大臣：『看是道士，行於非法，應	瞋 恚 大 喚 語 諸 大 臣 看 是 道 士 行 於 非 法 應 
T04n0197_001:0165a17	當爾耶？』王勅諸臣：『急縛驢駄，打鼓遍巡，然後	當 爾 耶 王 勅 諸 臣 急 縛 驢 駄 打 鼓 遍 巡 然 後 
T04n0197_001:0165a18	出城南門，將至樹下，鐵鉾[矛*贊]之，貫著竿頭，	出 城 南 門 將 至 樹 下 鐵 鉾 [矛贊] 之 貫 著 竿 頭 
T04n0197_001:0165a19	聚弓射之；若不死者，便斬其頭。』諸臣受教，	聚 弓 射 之 若 不 死 者 便 斬 其 頭 諸 臣 受 教 
T04n0197_001:0165a20	急縛驢駄，打鼓巷至巡之。國人見之，皆怪所	急 縛 驢 駄 打 鼓 巷 至 巡 之 國 人 見 之 皆 怪 所 
T04n0197_001:0165a21	以，或有信者、或不信者，眾人集觀，喚呼悲傷。	以 或 有 信 者 或 不 信 者 眾 人 集 觀 喚 呼 悲 傷 
T04n0197_001:0165a22	「於時，淨眼在破牆中藏，聞眾人云云聲，便於	 於 時 淨 眼 在 破 牆 中 藏 聞 眾 人 云 云 聲 便 於 
T04n0197_001:0165a23	牆中，傾顧盜視，見樂無為反縛驢駄，眾人逐	牆 中 傾 顧 盜 視 見 樂 無 為 反 縛 驢 駄 眾 人 逐 
T04n0197_001:0165a24	行，見已心念：『此道士無故見抂當死，此不應	行 見 已 心 念 此 道 士 無 故 見 抂 當 死 此 不 應 
T04n0197_001:0165a25	有愛欲。我自殺鹿相，非道士殺，我自受死，當	有 愛 欲 我 自 殺 鹿 相 非 道 士 殺 我 自 受 死 當 
T04n0197_001:0165a26	活道士。』淨眼念已，便出走趣大眾，普喚上	活 道 士 淨 眼 念 已 便 出 走 趣 大 眾 普 喚 上 
T04n0197_001:0165a27	官曰：『莫困殺此道士，非道士殺鹿相，是我殺	官 曰 莫 困 殺 此 道 士 非 道 士 殺 鹿 相 是 我 殺 
T04n0197_001:0165a28	之耳。願放此道士，縛我，隨罪治我。』諸上官皆	之 耳 願 放 此 道 士 縛 我 隨 罪 治 我 諸 上 官 皆 
T04n0197_001:0165a29	驚愕曰：『何能代他受罪？』即共解辟支佛縛，便	驚 愕 曰 何 能 代 他 受 罪 即 共 解 辟 支 佛 縛 便 
T04n0197_001:0165b01	捉淨眼，反縛如前。諸上官等，皆向辟支佛作	捉 淨 眼 反 縛 如 前 諸 上 官 等 皆 向 辟 支 佛 作 
T04n0197_001:0165b02	禮懺悔：『我等愚癡，無故抂困道士，當以大慈，	禮 懺 悔 我 等 愚 癡 無 故 抂 困 道 士 當 以 大 慈 
T04n0197_001:0165b03	原赦我罪，莫使我將來受此重殃。』如是至三，	原 赦 我 罪 莫 使 我 將 來 受 此 重 殃 如 是 至 三 
T04n0197_001:0165b04	樂無為辟支佛默然不答。「辟支佛心念：『我不	樂 無 為 辟 支 佛 默 然 不 答 辟 支 佛 心 念 我 不 
T04n0197_001:0165b05	宜更入波羅[木*奈]城乞食，我但當於此眾前，	宜 更 入 波 羅 [木奈] 城 乞 食 我 但 當 於 此 眾 前 
T04n0197_001:0165b06	取滅度耳。』辟支佛便於眾前，踊升虛空，於中	取 滅 度 耳 辟 支 佛 便 於 眾 前 踊 升 虛 空 於 中 
T04n0197_001:0165b07	往反，坐、臥、住、立，腰以下出煙、腰以上出火；或	往 反 坐 臥 住 立 腰 以 下 出 煙 腰 以 上 出 火 或 
T04n0197_001:0165b08	復腰以下出火、腰以上出煙；或左脇出煙、右	復 腰 以 下 出 火 腰 以 上 出 煙 或 左 脇 出 煙 右 
T04n0197_001:0165b09	脇出火；或左脇出火、右脇出煙；或腹前出煙、	脇 出 火 或 左 脇 出 火 右 脇 出 煙 或 腹 前 出 煙 
T04n0197_001:0165b10	背上出火；或腹前出火、背上出煙；或腰以	背 上 出 火 或 腹 前 出 火 背 上 出 煙 或 腰 以 
T04n0197_001:0165b11	下出火、腰以上出水；或腰以下出水、腰以上	下 出 火 腰 以 上 出 水 或 腰 以 下 出 水 腰 以 上 
T04n0197_001:0165b12	出火；或左脇出火、右脇出水；或左脇出	出 火 或 左 脇 出 火 右 脇 出 水 或 左 脇 出 
T04n0197_001:0165b13	水、右脇出火；或腹前出水、背上出火；或腹	水 右 脇 出 火 或 腹 前 出 水 背 上 出 火 或 腹 
T04n0197_001:0165b14	前出火、背上出水；或左肩出水、右肩出火；	前 出 火 背 上 出 水 或 左 肩 出 水 右 肩 出 火 
T04n0197_001:0165b15	或左肩出火、右肩出水；或兩肩出水、或兩	或 左 肩 出 火 右 肩 出 水 或 兩 肩 出 水 或 兩 
T04n0197_001:0165b16	肩出火；然後，舉身出煙、舉身出火、舉身出	肩 出 火 然 後 舉 身 出 煙 舉 身 出 火 舉 身 出 
T04n0197_001:0165b17	水，即於空中，燒身滅度。於是，大眾皆悲涕	水 即 於 空 中 燒 身 滅 度 於 是 大 眾 皆 悲 涕 
T04n0197_001:0165b18	泣，或有懺悔、或有作禮者，取其舍利，於四	泣 或 有 懺 悔 或 有 作 禮 者 取 其 舍 利 於 四 
T04n0197_001:0165b19	衢道起偷婆。「諸上官即將淨眼詣王梵達：『此	衢 道 起 偷 婆 諸 上 官 即 將 淨 眼 詣 王 梵 達 此 
T04n0197_001:0165b20	人殺鹿相，非是道士殺。』王便瞋此監司：『前時，	人 殺 鹿 相 非 是 道 士 殺 王 便 瞋 此 監 司 前 時 
T04n0197_001:0165b21	何為妄白虛事，云此人殺人，今云非也。乃	何 為 妄 白 虛 事 云 此 人 殺 人 今 云 非 也 乃 
T04n0197_001:0165b22	使我作虛妄之人，抂困道士。』諸臣白王：『於時	使 我 作 虛 妄 之 人 抂 困 道 士 諸 臣 白 王 於 時 
T04n0197_001:0165b23	頻問道士，何為殺人也？時道士默不見答，	頻 問 道 士 何 為 殺 人 也 時 道 士 默 不 見 答 
T04n0197_001:0165b24	又手脚復著土，以是故，臣等謂呼其殺人。』	又 手 脚 復 著 土 以 是 故 臣 等 謂 呼 其 殺 人 
T04n0197_001:0165b25	王便勅臣：『驢駄此人，於城南，先以鉾[矛*贊]之，然	王 便 勅 臣 驢 駄 此 人 於 城 南 先 以 鉾 [矛贊] 之 然 
T04n0197_001:0165b26	後立竿貫頭，聚弓射之；若不死者，便斫其頭。』	後 立 竿 貫 頭 聚 弓 射 之 若 不 死 者 便 斫 其 頭 
T04n0197_001:0165b27	諸臣受教，即以驢駄，打鼓遍巡已，出城南，詣	諸 臣 受 教 即 以 驢 駄 打 鼓 遍 巡 已 出 城 南 詣 
T04n0197_001:0165b28	樹下，以鉾[矛*贊]貫木，聚弓射之，然後斫頭。」佛	樹 下 以 鉾 [矛贊] 貫 木 聚 弓 射 之 然 後 斫 頭 佛 
T04n0197_001:0165b29	語舍利弗：「汝乃知爾時淨眼者不？則我身是。	語 舍 利 弗 汝 乃 知 爾 時 淨 眼 者 不 則 我 身 是 
T04n0197_001:0165c01	舍利弗！汝復知鹿相者不？則今孫陀利是。舍	舍 利 弗 汝 復 知 鹿 相 者 不 則 今 孫 陀 利 是 舍 
T04n0197_001:0165c02	利弗！汝知爾時梵達王不？則今執杖釋種是。	利 弗 汝 知 爾 時 梵 達 王 不 則 今 執 杖 釋 種 是 
T04n0197_001:0165c03	舍利弗！我爾時殺鹿相、抂困辟支佛，以是	舍 利 弗 我 爾 時 殺 鹿 相 抂 困 辟 支 佛 以 是 
T04n0197_001:0165c04	罪故，無數千歲，在泥犁中煮，及上劍樹；無數	罪 故 無 數 千 歲 在 泥 犁 中 煮 及 上 劍 樹 無 數 
T04n0197_001:0165c05	千歲，在畜生中；無數千歲，在餓鬼中。爾時餘	千 歲 在 畜 生 中 無 數 千 歲 在 餓 鬼 中 爾 時 餘 
T04n0197_001:0165c06	殃，今雖作佛，故獲此孫陀利謗。」於是，佛自說	殃 今 雖 作 佛 故 獲 此 孫 陀 利 謗 於 是 佛 自 說 
T04n0197_001:0165c07	宿命因緣偈曰：	宿 命 因 緣 偈 曰 
T04n0197_001:0165c08	「我先名淨眼，　　乃是博戲人。	 我 先 名 淨 眼 乃 是 博 戲 人 
T04n0197_001:0165c09	　辟支名樂無，　　無過致困苦。	 辟 支 名 樂 無 無 過 致 困 苦 
T04n0197_001:0165c10	　此有真淨行，　　為眾所擾惱，	 此 有 真 淨 行 為 眾 所 擾 惱 
T04n0197_001:0165c11	　毀辱而縛束，　　復欲驅出城。	 毀 辱 而 縛 束 復 欲 驅 出 城 
T04n0197_001:0165c12	　見此辟支佛，　　困辱被繫縛，	 見 此 辟 支 佛 困 辱 被 繫 縛 
T04n0197_001:0165c13	　我起慈悲心，　　使令得解脫。	 我 起 慈 悲 心 使 令得解脫 
T04n0197_001:0165c14	　以是因緣故，　　久受地獄苦。	 以是因緣 故 久 受 地 獄 苦 
T04n0197_001:0165c15	　乃爾時殘殃，　　今故被誹謗。	 乃 爾 時 殘 殃 今 故 被 誹 謗 
T04n0197_001:0165c16	　我今斷後生，　　便盡於是世，	 我 今 斷 後 生 便 盡 於 是 世 
T04n0197_001:0165c17	　坐此孫陀利，　　故得其誹謗。	 坐 此 孫 陀 利 故 得 其 誹 謗 
T04n0197_001:0165c18	　因緣終不脫，　　亦不著虛空。	 因 緣 終 不 脫 亦 不 著 虛 空 
T04n0197_001:0165c19	　當護三因緣，　　終始不可犯。	 當 護 三 因 緣 終 始 不 可 犯 
T04n0197_001:0165c20	　我自成尊佛，　　得為三界將，	 我 自 成 尊 佛 得 為 三 界 將 
T04n0197_001:0165c21	　故說先因緣，　　阿耨大泉中。」	 故 說 先 因 緣 阿 耨 大 泉 中 
T04n0197_001:0165c22	佛語舍利弗：「汝觀如來，眾惡皆盡、諸善普備，	佛 語 舍 利 弗 汝 觀 如 來 眾 惡 皆 盡 諸 善 普 備 
T04n0197_001:0165c23	能度天龍、鬼神、帝王、臣民、蠉飛、蠕動，皆使得	能 度 天 龍 鬼 神 帝 王 臣 民 蠉 飛 蠕 動 皆 使 得 
T04n0197_001:0165c24	度，無為安樂。雖有是功德，猶不免於宿緣，	度 無 為 安 樂 雖 有 是 功 德 猶 不 免 於 宿 緣 
T04n0197_001:0165c25	況復愚冥未得道者，不攝身、口、意，此等當如	況 復 愚 冥 未 得 道 者 不 攝 身 口 意 此 等 當 如 
T04n0197_001:0165c26	何？」佛語舍利弗：「汝當學是，及諸羅漢并一切	何 佛 語 舍 利 弗 汝 當 學 是 及 諸 羅 漢 并 一 切 
T04n0197_001:0165c27	眾生，當護身三、口四、意三。舍利弗！汝當學是，	眾 生 當 護 身 三 口 四 意 三 舍 利 弗 汝 當 學 是 
T04n0197_001:0165c28	并及一切。」佛說是時，舍利弗及五百羅漢、阿	并 及 一 切 佛 說 是 時 舍 利 弗 及 五 百 羅 漢 阿 
T04n0197_001:0165c29	耨大龍王、天、龍、鬼神、乾沓和、阿須倫、迦樓羅、	耨 大 龍 王 天 龍 鬼 神 乾 沓 和 阿 須 倫 迦 樓 羅 
T04n0197_001:0166a01	甄陀羅、摩休勒，聞佛所說，歡喜受行。	甄 陀 羅 摩 休 勒 聞 佛 所 說 歡 喜 受 行 
