T04n0197_001:0166a02	佛說奢彌跋宿緣經第二	佛 說 奢 彌 跋 宿 緣 經 第 二 
T04n0197_001:0166a03	聞如是：一時佛在阿耨大泉，與大比丘眾五	聞 如 是 一 時 佛 在 阿 耨 大 泉 與 大 比 丘 眾 五 
T04n0197_001:0166a04	百人俱，皆是羅漢，六通神足，唯除一比丘——阿	百 人 俱 皆 是 羅 漢 六 通 神 足 唯 除 一 比 丘 阿 
T04n0197_001:0166a05	難也。是時，佛告舍利弗：「過去久遠九十一劫，	難 也 是 時 佛 告 舍 利 弗 過去久遠 九 十 一 劫 
T04n0197_001:0166a06	是時有王，名曰善說，城名善說所造。有一婆	是 時 有 王 名 曰 善 說 城 名 善 說 所 造 有 一 婆 
T04n0197_001:0166a07	羅門，名延如達，好學廣博，外學、三部、天文、	羅 門 名 延 如 達 好 學 廣 博 外 學 三 部 天 文 
T04n0197_001:0166a08	圖讖、占相、藝術，曉七種書及外道教誡，解	圖 讖 占 相 藝 術 曉 七 種 書 及 外 道 教 誡 解 
T04n0197_001:0166a09	了眾法，世俗典籍，相有三十，常教學五百豪	了 眾 法 世 俗 典 籍 相 有 三 十 常 教 學 五 百 豪 
T04n0197_001:0166a10	族童子。復有一婆羅門，名曰梵天，大富饒財，	族 童 子 復 有 一 婆 羅 門 名 曰 梵 天 大 富 饒 財 
T04n0197_001:0166a11	象、馬、七珍、侍使、僕從，婦名淨音，端正姝妙，	象 馬 七 珍 侍 使 僕 從 婦 名 淨 音 端 正 姝 妙 
T04n0197_001:0166a12	容貌第一，性行和調，無嫉妬心。延如達以梵	容 貌 第 一 性 行 和 調 無 嫉 妬 心 延 如 達 以 梵 
T04n0197_001:0166a13	天為檀越，婦淨音供養延如達，飲食、衣被、床	天 為 檀 越 婦 淨 音 供 養 延 如 達 飲 食 衣 被 床 
T04n0197_001:0166a14	臥、坐具、病瘦、醫藥。「有一辟支佛，名曰愛學，往	臥 坐 具 病 瘦 醫 藥 有 一 辟 支 佛 名 曰 愛 學 往 
T04n0197_001:0166a15	到城內，執衣持鉢，行欲乞食。偶至梵天門，	到 城 內 執 衣 持 鉢 行 欲 乞 食 偶 至 梵 天 門 
T04n0197_001:0166a16	時淨音見辟支佛，衣服整齊、行步詳審、六	時 淨 音 見 辟 支 佛 衣 服 整 齊 行 步 詳 審 六 
T04n0197_001:0166a17	根寂定，心甚愛樂，即請供養曰：『自今已去，衣	根 寂 定 心 甚 愛 樂 即 請 供 養 曰 自 今 已 去 衣 
T04n0197_001:0166a18	被、飲食、床臥、醫藥，常從我受，當為我故，受我	被 飲 食 床 臥 醫 藥 常 從 我 受 當 為 我 故 受 我 
T04n0197_001:0166a19	請。』淨音即以濃美飲食，滿鉢與之。辟支佛受	請 淨 音 即 以 濃 美 飲 食 滿 鉢 與 之 辟 支 佛 受 
T04n0197_001:0166a20	已，執鉢升虛，七反迴旋，飛還所止。時城內人，	已 執 鉢 升 虛 七 反 迴 旋 飛 還 所 止 時 城 內 人 
T04n0197_001:0166a21	見此神足曰：『國有是人，我等有福。』舉國歡	見 此 神 足 曰 國 有 是 人 我 等 有 福 舉 國 歡 
T04n0197_001:0166a22	喜，供養無厭。「淨音供養辟支佛日進；待延如	喜 供 養 無 厭 淨 音 供 養 辟 支 佛 日 進 待 延 如 
T04n0197_001:0166a23	達遂薄。延如達自覺薄已厚彼，便興妬嫉、誹	達 遂 薄 延 如 達 自 覺 薄 已 厚 彼 便 興 妬 嫉 誹 
T04n0197_001:0166a24	謗之言：『此道士，實無戒德。何以故？與此淨	謗 之 言 此 道 士 實 無 戒 德 何 以 故 與 此 淨 
T04n0197_001:0166a25	音作不淨行故也。以是故，厚供養之。』延如達	音 作 不 淨 行 故 也 以 是 故 厚 供 養 之 延 如 達 
T04n0197_001:0166a26	告五百弟子曰：『此道士，犯戒、無精進行。諸童	告 五 百 弟 子 曰 此 道 士 犯 戒 無 精 進 行 諸 童 
T04n0197_001:0166a27	子各歸家，宣令曰：「此道士，無有淨行，與淨音	子 各 歸 家 宣 令 曰 此 道 士 無 有 淨 行 與 淨 音 
T04n0197_001:0166a28	通。」』諸童子曰：『爾！如師所言，此道士實有婬欲	通 諸 童 子 曰 爾 如 師 所 言 此 道 士 實 有 婬 欲 
T04n0197_001:0166a29	心。』五百童子，受教入城，至巷宣令曰：『此道	心 五 百 童 子 受 教 入 城 至 巷 宣 令 曰 此 道 
T04n0197_001:0166b01	士，有婬欲心，與淨音通。』國人咸疑：『神足如	士 有 婬 欲 心 與 淨 音 通 國 人 咸 疑 神 足 如 
T04n0197_001:0166b02	是，有此穢聲耶？』此聲經七年乃斷。後辟支佛	是 有 此 穢 聲 耶 此 聲 經 七 年 乃 斷 後 辟 支 佛 
T04n0197_001:0166b03	現十八變，取於滅度，眾人乃知延如達為虛	現 十 八 變 取 於 滅 度 眾 人 乃 知 延 如 達 為 虛 
T04n0197_001:0166b04	妄、辟支佛為清淨。」佛語舍利弗：「汝知爾時延	妄 辟 支 佛 為 清 淨 佛 語 舍 利 弗 汝 知 爾 時 延 
T04n0197_001:0166b05	如達不？則我身是；爾時梵天者，憂填王是；爾	如 達 不 則 我 身 是 爾 時 梵 天 者 憂 填 王 是 爾 
T04n0197_001:0166b06	時淨音者，奢彌跋是；爾時五百童子者，今五	時 淨 音 者 奢 彌 跋 是 爾 時 五 百 童 子 者 今 五 
T04n0197_001:0166b07	百羅漢是。」佛語舍利弗：「我爾時因失供養故，	百 羅 漢 是 佛 語 舍 利 弗 我 爾 時 因 失 供 養 故 
T04n0197_001:0166b08	便生妬嫉心，與汝等共誹謗辟支佛，以是因	便 生 妬 嫉 心 與 汝 等 共 誹 謗 辟 支 佛 以 是 因 
T04n0197_001:0166b09	緣，與汝等共入地獄，鑊湯見煮，無數千歲。由	緣 與 汝 等 共 入 地 獄 鑊 湯 見 煮 無 數 千 歲 由 
T04n0197_001:0166b10	是餘殃，今雖得佛，故與汝等，有奢彌跋之謗	是 餘 殃 今 雖 得 佛 故 與 汝 等 有 奢 彌 跋 之 謗 
T04n0197_001:0166b11	也。」於是，世尊說先世因緣偈曰：	也 於 是 世 尊 說 先世因緣 偈 曰 
T04n0197_001:0166b12	「我先為梵志，　　廣學外四部，	 我 先 為 梵 志 廣 學 外 四 部 
T04n0197_001:0166b13	　止於樹園中，　　教授五百童。	 止 於 樹 園 中 教 授 五 百 童 
T04n0197_001:0166b14	　有一辟支佛，　　清淨有神足。	 有 一 辟 支 佛 清 淨 有 神 足 
T04n0197_001:0166b15	　見是得供養，　　無故橫相謗，	 見 是 得 供 養 無 故 橫 相 謗 
T04n0197_001:0166b16	　還語諸童子，　　道士不淨行。	 還 語 諸 童 子 道 士 不 淨 行 
T04n0197_001:0166b17	　我適說是時，　　童子皆歡喜。	 我 適 說 是 時 童 子 皆 歡 喜 
T04n0197_001:0166b18	　童子聞是已，　　遍行諸里巷，	 童 子 聞 是 已 遍 行 諸 里 巷 
T04n0197_001:0166b19	　盡向眾人說，　　道士犯不淨。	 盡 向 眾 人 說 道 士 犯 不 淨 
T04n0197_001:0166b20	　以是因緣故，　　經歷地獄久，	 以是因緣 故 經 歷 地 獄 久 
T04n0197_001:0166b21	　我及汝曹等，　　更是無限苦。	 我 及 汝 曹 等 更 是 無 限 苦 
T04n0197_001:0166b22	　由是殘因緣，　　是眾五百人，	 由 是 殘 因 緣 是 眾 五 百 人 
T04n0197_001:0166b23	　無故被誹謗，　　坐此奢彌跋。	 無 故 被 誹 謗 坐 此 奢 彌 跋 
T04n0197_001:0166b24	　我今在末世，　　成於無上道，	 我 今 在 末 世 成 於 無 上 道 
T04n0197_001:0166b25	　無故而誹謗，　　坐此奢彌跋。	 無 故 而 誹 謗 坐 此 奢 彌 跋 
T04n0197_001:0166b26	　如來成尊佛，　　三界之大將，	 如 來 成 尊 佛 三 界 之 大 將 
T04n0197_001:0166b27	　阿耨大池中，　　自說本世緣。」	 阿 耨 大 池 中 自 說 本 世 緣 
T04n0197_001:0166b28	佛告舍利弗：「汝觀如來，眾漏已盡、諸善普具，	佛 告 舍 利 弗 汝 觀 如 來 眾 漏 已 盡 諸 善 普 具 
T04n0197_001:0166b29	慈愍天人、乃至蠕動，皆欲使濟度。雖有此功	慈 愍 天 人 乃 至 蠕 動 皆 欲 使 濟 度 雖 有 此 功 
T04n0197_001:0166c01	德，猶不免於宿緣，況復愚曚、未識道者？」佛	德 猶 不 免 於 宿 緣 況 復 愚 曚 未 識 道 者 佛 
T04n0197_001:0166c02	語舍利弗：「汝當學是，及諸羅漢、一切眾生，皆	語 舍 利 弗 汝 當 學 是 及 諸 羅 漢 一 切 眾 生 皆 
T04n0197_001:0166c03	當學是。」佛語舍利弗：「汝當護身三、口四、意三，	當 學 是 佛 語 舍 利 弗 汝 當 護 身 三 口 四 意 三 
T04n0197_001:0166c04	舍利弗！當學如是。」佛說是已，舍利弗及五百	舍 利 弗 當 學 如 是 佛 說 是 已 舍 利 弗 及 五 百 
T04n0197_001:0166c05	羅漢、阿耨大龍王、天、龍、鬼神、乾沓和、阿須倫、	羅 漢 阿 耨 大 龍 王 天 龍 鬼 神 乾 沓 和 阿 須 倫 
T04n0197_001:0166c06	迦樓羅、甄陀羅、摩休勒，聞佛所說，歡喜受行。	迦 樓 羅 甄 陀 羅 摩 休 勒 聞 佛 所 說 歡 喜 受 行 
T04n0197_001:0166c07	佛說頭痛宿緣經第三	佛 說 頭 痛 宿 緣 經 第 三 
T04n0197_001:0166c08	聞如是：一時佛在阿耨大泉，與大比丘五百	聞 如 是 一 時 佛 在 阿 耨 大 泉 與 大 比 丘 五 百 
T04n0197_001:0166c09	人俱，皆是阿羅漢，六通神足，唯除一比丘——阿	人 俱 皆 是 阿 羅 漢 六 通 神 足 唯 除 一 比 丘 阿 
T04n0197_001:0166c10	難也。佛告舍利弗：「過去久遠世，於羅閱祇大	難 也 佛 告 舍 利 弗 過去久遠 世 於 羅 閱 祇 大 
T04n0197_001:0166c11	城中，時穀貴飢饉，人皆捨取白骨，打煮飲汁，	城 中 時 穀 貴 飢 饉 人 皆 捨 取 白 骨 打 煮 飲 汁 
T04n0197_001:0166c12	掘百草根，以續微命。以一升金，貿一升穀。爾	掘 百 草 根 以 續 微 命 以 一 升 金 貿 一 升 穀 爾 
T04n0197_001:0166c13	時，羅閱祇有大村數百家，名曰吱(九支反)越。村	時 羅 閱 祇 有 大 村 數 百 家 名 曰 吱 九 支 反 越 村 
T04n0197_001:0166c14	東不遠，有池，名曰多魚。吱越村人，將妻子詣	東 不 遠 有 池 名 曰 多 魚 吱 越 村 人 將 妻 子 詣 
T04n0197_001:0166c15	多魚池，止於池邊，捕魚食之。時捕魚人，採	多 魚 池 止 於 池 邊 捕 魚 食 之 時 捕 魚 人 採 
T04n0197_001:0166c16	魚著岸上，在陸而跳。「我爾時為小兒，年適四	魚 著 岸 上 在 陸 而 跳 我 爾 時 為 小 兒 年 適 四 
T04n0197_001:0166c17	歲，見魚跳而喜。時池中有兩種魚：一種名麩，	歲 見 魚 跳 而 喜 時 池 中 有 兩 種 魚 一 種 名 麩 
T04n0197_001:0166c18	一種名多舌。此自相語曰：『我等不犯人，橫被	一 種 名 多 舌 此 自 相 語 曰 我 等 不 犯 人 橫 被 
T04n0197_001:0166c19	見食。我等後世，要當報此。』」佛語舍利弗：「汝	見 食 我 等 後 世 要 當 報 此 佛 語 舍 利 弗 汝 
T04n0197_001:0166c20	識爾時吱越村人，男、女、大、小不？則今迦毘羅	識 爾 時 吱 越 村 人 男 女 大 小 不 則 今 迦 毘 羅 
T04n0197_001:0166c21	越國諸釋種是；爾時小兒者，我身是；爾時麩	越 國 諸 釋 種 是 爾 時 小 兒 者 我 身 是 爾 時 麩 
T04n0197_001:0166c22	魚者，毘樓勒王是；爾時多舌魚者，今毘樓勒	魚 者 毘 樓 勒 王 是 爾 時 多 舌 魚 者 今 毘 樓 勒 
T04n0197_001:0166c23	王相師，婆羅門名惡舌者是。爾時魚跳，我以	王 相 師 婆 羅 門 名 惡 舌 者 是 爾 時 魚 跳 我 以 
T04n0197_001:0166c24	小杖打魚頭，以是因緣，墮地獄中，無數千歲。	小 杖 打 魚 頭 以是因緣 墮 地 獄 中 無 數 千 歲 
T04n0197_001:0166c25	我今雖得阿惟三佛，由是殘緣故，毘樓勒	我 今 雖 得 阿惟三佛 由 是 殘 緣 故 毘 樓 勒 
T04n0197_001:0166c26	王伐釋種時，我得頭痛。」佛語舍利弗：「汝知	王 伐 釋 種 時 我 得 頭 痛 佛 語 舍 利 弗 汝 知 
T04n0197_001:0166c27	我云何頭痛？舍利弗！我初得頭痛時，語阿難	我 云 何 頭 痛 舍 利 弗 我 初 得 頭 痛 時 語 阿 難 
T04n0197_001:0166c28	曰：『以四升鉢，盛滿冷水來。』阿難如教持來，	曰 以 四 升 鉢 盛 滿 冷 水 來 阿 難 如 教 持 來 
T04n0197_001:0166c29	以指抆額上，汗渧水中，水即尋消滅。猶如終	以 指 抆 額 上 汗 渧 水 中 水 即 尋 消 滅 猶 如 終 
T04n0197_001:0167a01	日炊空大釜，投一渧水，水即燋燃。頭痛之	日 炊 空 大 釜 投 一 渧 水 水 即 燋 燃 頭 痛 之 
T04n0197_001:0167a02	熱，其狀如是。假令須彌山邊，旁出亞崖一	熱 其 狀 如 是 假 令 須 彌 山 邊 旁 出 亞 崖 一 
T04n0197_001:0167a03	由延、至百由延，值我頭痛熱者，亦當消盡。舍	由 延 至 百 由 延 值 我 頭 痛 熱 者 亦 當 消 盡 舍 
T04n0197_001:0167a04	利弗！如來頭痛如是。」佛爾時說宿緣偈曰：	利 弗 如 來 頭 痛 如 是 佛 爾 時 說 宿 緣 偈 曰 
T04n0197_001:0167a05	「先世吱越村，　　有一吱越子，	 先 世 吱 越 村 有 一 吱 越 子 
T04n0197_001:0167a06	　捕魚置岸上，　　以杖敲其頭。	 捕 魚 置 岸 上 以 杖 敲 其 頭 
T04n0197_001:0167a07	　以是因緣故，　　經歷地獄久，	 以是因緣 故 經 歷 地 獄 久 
T04n0197_001:0167a08	　名曰黑繩獄，　　燒煮甚久長。	 名 曰 黑 繩 獄 燒 煮 甚 久 長 
T04n0197_001:0167a09	　由是殘因緣，　　今得頭痛熱，	 由 是 殘 因 緣 今 得 頭 痛 熱 
T04n0197_001:0167a10	　殺是諸釋時，　　惡行毘樓勒。	 殺 是 諸 釋 時 惡 行 毘 樓 勒 
T04n0197_001:0167a11	　此緣終不化，　　亦不著虛空。	 此 緣 終 不 化 亦 不 著 虛 空 
T04n0197_001:0167a12	　當共自謹慎，　　防護身口意。	 當 共 自 謹 慎 防 護 身 口 意 
T04n0197_001:0167a13	　我自成尊佛，　　得為三界將，	 我 自 成 尊 佛 得 為 三 界 將 
T04n0197_001:0167a14	　故說先世緣，　　阿耨大泉中。」	 故 說 先 世 緣 阿 耨 大 泉 中 
T04n0197_001:0167a15	佛語舍利弗：「汝見如來，眾惡已盡、諸善普具，	佛 語 舍 利 弗 汝 見 如 來 眾 惡 已 盡 諸 善 普 具 
T04n0197_001:0167a16	欲使天、龍、鬼神、帝王、臣民，皆念其善，猶有此	欲 使 天 龍 鬼 神 帝 王 臣 民 皆 念 其 善 猶 有 此 
T04n0197_001:0167a17	緣，況復愚冥、未得道者？」佛語舍利弗：「汝當學	緣 況 復 愚 冥 未 得 道 者 佛 語 舍 利 弗 汝 當 學 
T04n0197_001:0167a18	是，及諸羅漢、一切眾生，皆當學是。」佛語舍	是 及 諸 羅 漢 一 切 眾 生 皆 當 學 是 佛 語 舍 
T04n0197_001:0167a19	利弗：「汝當護身三、口四、意三，舍利弗！當學是。」	利 弗 汝 當 護 身 三 口 四 意 三 舍 利 弗 當 學 是 
T04n0197_001:0167a20	佛說是已，舍利弗及五百羅漢、阿耨大龍王、	佛 說 是 已 舍 利 弗 及 五 百 羅 漢 阿 耨 大 龍 王 
T04n0197_001:0167a21	天、龍、鬼神、乾沓和、阿須倫、迦樓羅、甄陀羅、摩休	天 龍 鬼 神 乾 沓 和 阿 須 倫 迦 樓 羅 甄 陀 羅 摩 休 
T04n0197_001:0167a22	勒，聞佛所說，歡喜受行。	勒 聞 佛 所 說 歡 喜 受 行 
T04n0197_001:0167a23	佛說骨節煩疼因緣經第四	佛 說 骨 節 煩 疼 因 緣 經 第 四 
T04n0197_001:0167a24	聞如是：一時佛在阿耨大泉，與大比丘眾五	聞 如 是 一 時 佛 在 阿 耨 大 泉 與 大 比 丘 眾 五 
T04n0197_001:0167a25	百人俱，皆是阿羅漢，六通神足，唯除一比丘	百 人 俱 皆 是 阿 羅 漢 六 通 神 足 唯 除 一 比 丘 
T04n0197_001:0167a26	——阿難也。佛語舍利弗：「往昔久遠世，於羅閱祇	 阿 難 也 佛 語 舍 利 弗 往 昔 久 遠 世 於 羅 閱 祇 
T04n0197_001:0167a27	城中，有一長者子，得熱病甚困。其城中有一	城 中 有 一 長 者 子 得 熱 病 甚 困 其 城 中 有 一 
T04n0197_001:0167a28	大醫子，別識諸藥，能治眾病。長者子呼此醫	大 醫 子 別 識 諸 藥 能 治 眾 病 長 者 子 呼 此 醫 
T04n0197_001:0167a29	子曰：『為我治病愈，大與卿財寶。』醫子即治，長	子 曰 為 我 治 病 愈 大 與 卿 財 寶 醫 子 即 治 長 
T04n0197_001:0167b01	者子病得差；既差之後，不報其功。長者子	者 子 病 得 差 既 差 之 後 不 報 其 功 長 者 子 
T04n0197_001:0167b02	於後復病，復命治之，差不答勞。如此至三，不	於 後 復 病 復 命 治 之 差 不 答 勞 如 此 至 三 不 
T04n0197_001:0167b03	報如前。「後復得病，續喚治之，醫子念曰：『前已	報 如 前 後 復 得 病 續 喚 治 之 醫 子 念 曰 前 已 
T04n0197_001:0167b04	三差，而不見報。』長者子曰：『卿前後治我，未得	三 差 而 不 見 報 長 者 子 曰 卿 前 後 治 我 未 得 
T04n0197_001:0167b05	相報，今好治我，差當併報。』醫子念曰：『見欺	相 報 今 好 治 我 差 當 併 報 醫 子 念 曰 見 欺 
T04n0197_001:0167b06	如此至三，如誑小兒，我今治此，當令命斷。』	如 此 至 三 如 誑 小 兒 我 今 治 此 當 令 命 斷 
T04n0197_001:0167b07	即便與非藥，病遂增劇，便致無常。」佛語舍利	即 便 與 非 藥 病 遂 增 劇 便 致 無 常 佛 語 舍 利 
T04n0197_001:0167b08	弗：「汝知爾時醫子不？則我身是；爾時病長者	弗 汝 知 爾 時 醫 子 不 則 我 身 是 爾 時 病 長 者 
T04n0197_001:0167b09	子者，地婆達兜是也。」佛語舍利弗：「我爾時與	子 者 地 婆 達 兜 是 也 佛 語 舍 利 弗 我 爾 時 與 
T04n0197_001:0167b10	此長者子非藥，致令無常，以是因緣，數千歲	此 長 者 子 非 藥 致 令 無 常 以是因緣 數 千 歲 
T04n0197_001:0167b11	受地獄燒煮，及畜生、餓鬼。由是殘緣，今雖得	受 地 獄 燒 煮 及 畜 生 餓 鬼 由 是 殘 緣 今 雖 得 
T04n0197_001:0167b12	作佛，故有骨節煩疼病生。」於是，佛說宿緣頌	作 佛 故 有 骨 節 煩 疼 病 生 於 是 佛 說 宿 緣 頌 
T04n0197_001:0167b13	曰：	曰 
T04n0197_001:0167b14	「我往為醫子，　　治於長者兒，	 我 往 為 醫 子 治 於 長 者 兒 
T04n0197_001:0167b15	　瞋恚與非藥，　　由此致無常。	 瞋 恚 與 非 藥 由 此 致 無 常 
T04n0197_001:0167b16	　以是宿因緣，　　久受地獄苦，	 以 是 宿 因 緣 久 受 地 獄 苦 
T04n0197_001:0167b17	　爾時餘因緣，　　故致煩疼患。	 爾 時 餘 因 緣 故 致 煩 疼 患 
T04n0197_001:0167b18	　因緣終不滅，　　亦不著虛空。	 因 緣 終 不 滅 亦 不 著 虛 空 
T04n0197_001:0167b19	　以是三因緣，　　盡護身、口、意。	 以 是 三 因 緣 盡 護 身 口 意 
T04n0197_001:0167b20	　我自成尊佛，　　得為三界將，	 我 自 成 尊 佛 得 為 三 界 將 
T04n0197_001:0167b21	　故說先世緣，　　阿耨大泉中。」	 故 說 先 世 緣 阿 耨 大 泉 中 
T04n0197_001:0167b22	佛語舍利弗：「汝見如來，眾惡已盡、諸善普具，	佛 語 舍 利 弗 汝 見 如 來 眾 惡 已 盡 諸 善 普 具 
T04n0197_001:0167b23	欲使天、龍、鬼神、帝王、臣民，皆念其善，猶有此	欲 使 天 龍 鬼 神 帝 王 臣 民 皆 念 其 善 猶 有 此 
T04n0197_001:0167b24	緣，況復愚冥、未得道者？」佛語舍利弗：「汝當學	緣 況 復 愚 冥 未 得 道 者 佛 語 舍 利 弗 汝 當 學 
T04n0197_001:0167b25	是，及五百羅漢、一切眾生，皆當學是。」佛語舍	是 及 五 百 羅 漢 一 切 眾 生 皆 當 學 是 佛 語 舍 
T04n0197_001:0167b26	利弗：「汝當護身三、口四、意三，舍利弗！汝當	利 弗 汝 當 護 身 三 口 四 意 三 舍 利 弗 汝 當 
T04n0197_001:0167b27	學是。」佛說是已，舍利弗及五百羅漢、阿耨大	學 是 佛 說 是 已 舍 利 弗 及 五 百 羅 漢 阿 耨 大 
T04n0197_001:0167b28	龍王、天、龍、鬼神、乾沓和、阿須倫、迦樓羅、甄陀羅、	龍 王 天 龍 鬼 神 乾 沓 和 阿 須 倫 迦 樓 羅 甄 陀 羅 
T04n0197_001:0167b29	摩休勒，聞佛所說，歡喜受行。	摩 休 勒 聞 佛 所 說 歡 喜 受 行 
T04n0197_001:0167c01	佛說背痛宿緣經第五	佛 說 背 痛 宿 緣 經 第 五 
T04n0197_001:0167c02	聞如是：一時佛在阿耨大泉，與大比丘眾五	聞 如 是 一 時 佛 在 阿 耨 大 泉 與 大 比 丘 眾 五 
T04n0197_001:0167c03	百人俱，皆是羅漢，六通神足，唯除一比丘——阿	百 人 俱 皆 是 羅 漢 六 通 神 足 唯 除 一 比 丘 阿 
T04n0197_001:0167c04	難也。於是，佛語舍利弗：「往昔久遠世時，於羅	難 也 於 是 佛 語 舍 利 弗 往 昔 久 遠 世 時 於 羅 
T04n0197_001:0167c05	閱祇，時大節日聚會，時國中有兩姓力士：一	閱 祇 時 大 節 日 聚 會 時 國 中 有 兩 姓 力 士 一 
T04n0197_001:0167c06	姓剎帝利種，一姓婆羅門種，亦來在會。時兩	姓 剎 帝 利 種 一 姓 婆 羅 門 種 亦 來 在 會 時 兩 
T04n0197_001:0167c07	力士共相撲，婆羅門力士語剎帝利力士	力 士 共 相 撲 婆 羅 門 力 士 語 剎 帝 利 力 士 
T04n0197_001:0167c08	曰：『卿莫撲我，我當大與卿錢寶。』剎帝利便不	曰 卿 莫 撲 我 我 當 大 與 卿 錢 寶 剎 帝 利 便 不 
T04n0197_001:0167c09	盡力，戲令其屈伏也。二人俱得稱，皆受王賞，	盡 力 戲 令 其 屈 伏 也 二 人 俱 得 稱 皆 受 王 賞 
T04n0197_001:0167c10	婆羅門力士竟不報剎帝利力士所許。到後	婆 羅 門 力 士 竟 不 報 剎 帝 利 力 士 所 許 到 後 
T04n0197_001:0167c11	節日，復來聚會相撲，婆羅門力士復求首剎	節 日 復 來 聚 會 相 撲 婆 羅 門 力 士 復 求 首 剎 
T04n0197_001:0167c12	帝利力士，如前相許，剎帝利力士復饒不	帝 利 力 士 如 前 相 許 剎 帝 利 力 士 復 饒 不 
T04n0197_001:0167c13	撲，得賞如上，復不相報。如是至三。「後節復	撲 得 賞 如 上 復 不 相 報 如 是 至 三 後 節 復 
T04n0197_001:0167c14	會，婆羅門力士重語剎帝利力士曰：『前後所	會 婆 羅 門 力 士 重 語 剎 帝 利 力 士 曰 前 後 所 
T04n0197_001:0167c15	許，當一時併報。』剎帝利力士心念曰：『此人	許 當 一 時 併 報 剎 帝 利 力 士 心 念 曰 此 人 
T04n0197_001:0167c16	數欺我，既不報我、又侵我分，我今日當使其	數 欺 我 既 不 報 我 又 侵 我 分 我 今 日 當 使 其 
T04n0197_001:0167c17	消。』是剎帝利便乾笑語曰：『卿誑我滿三，今不	消 是 剎 帝 利 便 乾 笑 語 曰 卿 誑 我 滿 三 今 不 
T04n0197_001:0167c18	復用卿物。』便右手捺項，左手捉袴腰，兩手	復 用 卿 物 便 右 手 捺 項 左 手 捉 袴 腰 兩 手 
T04n0197_001:0167c19	蹙之，挫折其脊，如折甘蔗，擎之三旋，使眾	蹙 之 挫 折 其 脊 如 折 甘 蔗 擎 之 三 旋 使 眾 
T04n0197_001:0167c20	人見，然後撲地，墮地即死。王及群臣，皆大歡	人 見 然 後 撲 地 墮 地 即 死 王 及 群 臣 皆 大 歡 
T04n0197_001:0167c21	喜，賜金錢十萬。」佛語舍利弗：「汝知爾時剎帝	喜 賜 金 錢 十 萬 佛 語 舍 利 弗 汝 知 爾 時 剎 帝 
T04n0197_001:0167c22	利力士撲殺婆羅門力士者不？則我身是；婆	利 力 士 撲 殺 婆 羅 門 力 士 者 不 則 我 身 是 婆 
T04n0197_001:0167c23	羅門力士者，地婆達兜是。」佛語舍利弗：「我爾	羅 門 力 士 者 地 婆 達 兜 是 佛 語 舍 利 弗 我 爾 
T04n0197_001:0167c24	時以貪恚故，撲殺此力士，以是因緣，墮地獄	時 以 貪 恚 故 撲 殺 此 力 士 以是因緣 墮 地 獄 
T04n0197_001:0167c25	中，燒煮榜治，經數千歲。今我已成阿惟三佛，	中 燒 煮 榜 治 經 數 千 歲 今 我 已 成 阿惟三佛 
T04n0197_001:0167c26	諸漏已盡，爾時殘緣，今故有此脊痛之患。」於	諸漏已盡 爾 時 殘 緣 今 故 有 此 脊 痛 之 患 於 
T04n0197_001:0167c27	是，世尊自說宿緣頌曰：	是 世 尊 自 說 宿 緣 頌 曰 
T04n0197_001:0167c28	「節會共相撲，　　意欲屈彼人，	 節 會 共 相 撲 意 欲 屈 彼 人 
T04n0197_001:0167c29	　一舉撲著地，　　令其脊中折。	 一 舉 撲 著 地 令 其 脊 中 折 
T04n0197_001:0168a01	　以是因緣故，　　久受地獄苦，	 以是因緣 故 久 受 地 獄 苦 
T04n0197_001:0168a02	　先世殘餘殃，　　故致脊痛患。	 先 世 殘 餘 殃 故 致 脊 痛 患 
T04n0197_001:0168a03	　此緣終不滅，　　亦不著虛空。	 此 緣 終 不 滅 亦 不 著 虛 空 
T04n0197_001:0168a04	　護是三因緣，　　莫犯身、口、意。	 護 是 三 因 緣 莫 犯 身 口 意 
T04n0197_001:0168a05	　我自成尊佛，　　得為三界將，	 我 自 成 尊 佛 得 為 三 界 將 
T04n0197_001:0168a06	　阿耨大泉中，　　自說宿世緣。」	 阿 耨 大 泉 中 自 說 宿 世 緣 
T04n0197_001:0168a07	佛語舍利弗：「汝見如來，眾惡已盡，諸善普具，	佛 語 舍 利 弗 汝 見 如 來 眾 惡 已 盡 諸 善 普 具 
T04n0197_001:0168a08	諸天、龍、神、帝王、臣民、一切眾生，皆欲令得	諸 天 龍 神 帝 王 臣 民 一 切 眾 生 皆 欲 令 得 
T04n0197_001:0168a09	渡，尚不免餘殃，況復愚癡、未得道者？」佛語	渡 尚 不 免 餘 殃 況 復 愚 癡 未 得 道 者 佛 語 
T04n0197_001:0168a10	舍利弗：「汝等當學是，護身三、口四、意三。」佛說	舍 利 弗 汝 等 當 學 是 護 身 三 口 四 意 三 佛 說 
T04n0197_001:0168a11	是已，舍利弗及五百羅漢、八部鬼神，聞佛所	是 已 舍 利 弗 及 五 百 羅 漢 八 部 鬼 神 聞 佛 所 
T04n0197_001:0168a12	說，歡喜受行。	說 歡 喜 受 行 
T04n0197_001:0168a13	佛說木槍刺脚因緣經第六	佛 說 木 槍 刺 脚 因 緣 經 第 六 
