T04n0197_002:0172a23	唯願屈尊。』時毘婆葉佛，見時已至，便勅大	唯 願 屈 尊 時 毘 婆 葉 佛 見 時 已 至 便 勅 大 
T04n0197_002:0172a24	眾，著衣持鉢，當就王請。大眾圍遶，往詣王	眾 著衣持鉢 當 就 王 請 大 眾 圍 遶 往 詣 王 
T04n0197_002:0172a25	宮，就座而坐。王即下食，手自斟酌種種餚	宮 就 座 而 坐 王 即 下 食 手 自 斟 酌 種 種 餚 
T04n0197_002:0172a26	饍。「爾時，有一比丘，名曰彌勒，時病不行。佛及	饍 爾 時 有 一 比 丘 名 曰 彌 勒 時 病 不 行 佛 及 
T04n0197_002:0172a27	大眾，食已各還，還時，皆為諸病比丘請食。過	大 眾 食 已 各 還 還 時 皆 為 諸 病 比 丘 請 食 過 
T04n0197_002:0172a28	梵志山，見食香美，便興妬嫉意曰：『此髠	梵 志 山 見 食 香 美 便 興 妬 嫉 意 曰 此 髠 
T04n0197_002:0172a29	頭沙門，正應食馬麥，不應食此甘饌之供。』告	頭 沙 門 正 應 食 馬 麥 不 應 食 此 甘 饌 之 供 告 
T04n0197_002:0172b01	諸童子：『汝等見此髠頭道人，食於甘美餚饍	諸 童 子 汝 等 見 此 髠 頭 道 人 食 於 甘 美 餚 饍 
T04n0197_002:0172b02	不？』諸童子曰：『爾實見。此等師主，亦應食馬	不 諸 童 子 曰 爾 實 見 此 等 師 主 亦 應 食 馬 
T04n0197_002:0172b03	麥。』」佛語舍利弗：「汝知爾時山王婆羅門不？則	麥 佛 語 舍 利 弗 汝 知 爾 時 山 王 婆 羅 門 不 則 
T04n0197_002:0172b04	我身是；爾時五百童子者，今五百羅漢是；爾	我 身 是 爾 時 五 百 童 子 者 今 五 百 羅 漢 是 爾 
T04n0197_002:0172b05	時病比丘彌勒者，則今彌勒菩薩是。」佛語舍	時 病 比 丘 彌 勒 者 則 今 彌 勒 菩 薩 是 佛 語 舍 
T04n0197_002:0172b06	利弗：「我爾時興妬嫉，意言是輩不應食甘	利 弗 我 爾 時 興 妬 嫉 意 言 是 輩 不 應 食 甘 
T04n0197_002:0172b07	饍，正應食馬麥耳，及卿等亦云如是。以是因	饍 正 應 食 馬 麥 耳 及 卿 等 亦 云 如 是 以 是 因 
T04n0197_002:0172b08	緣，我及卿等，經歷地獄，無數千歲。今雖成佛，	緣 我 及 卿 等 經 歷 地 獄 無 數 千 歲 今 雖 成 佛 
T04n0197_002:0172b09	爾時殘緣，我及卿等，於毘蘭邑，故食馬麥九	爾 時 殘 緣 我 及 卿 等 於 毘 蘭 邑 故 食 馬 麥 九 
T04n0197_002:0172b10	十日。我爾時不言與佛馬麥，但言與比丘，以	十 日 我 爾 時 不 言 與 佛 馬 麥 但 言 與 比 丘 以 
T04n0197_002:0172b11	是故，我今得食[打丁+鳥]麥仁；以卿等加言，當與佛	是 故 我 今 得 食 [打丁鳥] 麥 仁 以 卿 等 加 言 當 與 佛 
T04n0197_002:0172b12	麥故，今日卿等，食著皮麥耳。」於是，世尊說宿	麥 故 今 日 卿 等 食 著 皮 麥 耳 於 是 世 尊 說 宿 
T04n0197_002:0172b13	緣偈言：	緣 偈 言 
T04n0197_002:0172b14	「我本為梵志，　　所學甚廣博。	 我 本 為 梵 志 所 學 甚 廣 博 
T04n0197_002:0172b15	　教授五百童，　　在於樹園中。	 教 授 五 百 童 在 於 樹 園 中 
T04n0197_002:0172b16	　在毘葉佛世，　　形罵諸比丘，	 在 毘 葉 佛 世 形 罵 諸 比 丘 
T04n0197_002:0172b17	　不應食粳粮，　　正應食馬麥。	 不 應 食 粳 粮 正 應 食 馬 麥 
T04n0197_002:0172b18	　汝等童子說，　　實如師所道，	 汝 等 童 子 說 實 如 師 所 道 
T04n0197_002:0172b19	　并及此等師，　　亦應食馬麥。	 并 及 此 等 師 亦 應 食 馬 麥 
T04n0197_002:0172b20	　以是因緣故，　　久受地獄苦。	 以是因緣 故 久 受 地 獄 苦 
T04n0197_002:0172b21	　爾時殘餘殃，　　亦五百比丘，	 爾 時 殘 餘 殃 亦 五 百 比 丘 
T04n0197_002:0172b22	　婆羅門時請，　　當會毘蘭邑，	 婆 羅 門 時 請 當 會 毘 蘭 邑 
T04n0197_002:0172b23	　與卿食馬麥，　　九十日不減。	 與 卿 食 馬 麥 九 十 日 不 減 
T04n0197_002:0172b24	　因緣終不朽，　　亦不著虛空。	 因 緣 終 不 朽 亦 不 著 虛 空 
T04n0197_002:0172b25	　當護三因緣，　　莫犯身、口、意。	 當 護 三 因 緣 莫 犯 身 口 意 
T04n0197_002:0172b26	　今我成佛道，　　得為三界將，	 今 我 成 佛 道 得 為 三 界 將 
T04n0197_002:0172b27	　阿耨大泉中，　　自說先世緣。」	 阿 耨 大 泉 中 自 說 先 世 緣 
T04n0197_002:0172b28	佛語舍利弗：「汝觀如來，眾惡已盡，諸善普具，	佛 語 舍 利 弗 汝 觀 如 來 眾 惡 已 盡 諸 善 普 具 
T04n0197_002:0172b29	諸天、龍、神、帝王、臣民、一切眾生，皆欲度之，尚	諸 天 龍 神 帝 王 臣 民 一 切 眾 生 皆 欲 度 之 尚 
T04n0197_002:0172c01	不能得免宿世餘殃，況愚冥、未得道者？」佛語	不 能 得 免 宿 世 餘 殃 況 愚 冥 未 得 道 者 佛 語 
T04n0197_002:0172c02	舍利弗：「當學護三因緣，莫犯身、口、意。舍利弗！	舍 利 弗 當 學 護 三 因 緣 莫 犯 身 口 意 舍 利 弗 
T04n0197_002:0172c03	當學如是。」佛說是已，舍利弗及五百羅漢、阿	當 學 如 是 佛 說 是 已 舍 利 弗 及 五 百 羅 漢 阿 
T04n0197_002:0172c04	耨大龍王、八部鬼神，聞佛所說，歡喜受行。	耨 大 龍 王 八 部 鬼 神 聞 佛 所 說 歡 喜 受 行 
T04n0197_002:0172c05	佛說苦行宿緣經第十	佛 說 苦 行 宿 緣 經 第 十 
T04n0197_002:0172c06	聞如是：一時佛在阿耨大泉，與大比丘眾五	聞 如 是 一 時 佛 在 阿 耨 大 泉 與 大 比 丘 眾 五 
T04n0197_002:0172c07	百人俱，皆是阿羅漢，六通神足，唯除一比丘——	百 人 俱 皆 是 阿 羅 漢 六 通 神 足 唯 除 一 比 丘 
T04n0197_002:0172c08	阿難也。是時，佛告舍利弗：「往昔波羅[木*奈]城	阿 難 也 是 時 佛 告 舍 利 弗 往 昔 波 羅 [木奈] 城 
T04n0197_002:0172c09	邊，去城不遠，有多獸邑，中有婆羅門，為王	邊 去 城 不 遠 有 多 獸 邑 中 有婆羅門 為 王 
T04n0197_002:0172c10	太史，國中第一。有一子，頭上有自然火鬘，因	太 史 國 中 第 一 有 一 子 頭 上 有 自 然 火 鬘 因 
T04n0197_002:0172c11	以為名。婆首端正，有三十相，梵志典籍、圖	以 為 名 婆 首 端 正 有 三 十 相 梵 志 典 籍 圖 
T04n0197_002:0172c12	書、讖記，無事不博，外道禁戒及諸算術，皆悉	書 讖 記 無 事 不 博 外 道 禁 戒 及 諸 算 術 皆 悉 
T04n0197_002:0172c13	明練。時有一瓦師子，名難提婆羅，與火鬘少	明 練 時 有 一 瓦 師 子 名 難 提 婆 羅 與 火 鬘 少 
T04n0197_002:0172c14	小親友，心相敬念，須臾不忘。瓦師子精進、勇	小 親 友 心 相 敬 念 須 臾 不 忘 瓦 師 子 精 進 勇 
T04n0197_002:0172c15	猛、慈仁、孝順，其父母俱盲，供養二親，無所乏	猛 慈 仁 孝 順 其 父 母 俱 盲 供 養 二 親 無 所 乏 
T04n0197_002:0172c16	短。難提婆羅雖為瓦師，手不掘地，亦不使人	短 難 提 婆 羅 雖 為 瓦 師 手 不 掘 地 亦 不 使 人 
T04n0197_002:0172c17	掘，唯取破牆、崩岸及鼠壤，和以為器，成好無	掘 唯 取 破 牆 崩 岸 及 鼠 壤 和 以 為 器 成 好 無 
T04n0197_002:0172c18	比。若有男子、女人欲來買者，以穀、麥、麻、豆置	比 若 有 男 子 女 人 欲 來 買 者 以 穀 麥 麻 豆 置 
T04n0197_002:0172c19	地，取器而去。初不爭價數，亦不取金、銀、財帛，	地 取 器 而 去 初 不 爭 價 數 亦 不 取 金 銀 財 帛 
T04n0197_002:0172c20	唯取穀米，供食而已。「迦葉如來所住精舍，去	唯 取 穀 米 供 食 而 已 迦 葉 如 來 所 住 精 舍 去 
T04n0197_002:0172c21	多獸邑不遠，與大比丘眾二萬人，皆是羅	多 獸 邑 不 遠 與 大 比 丘 眾 二 萬 人 皆 是 羅 
T04n0197_002:0172c22	漢。護喜語火鬘曰：『共見迦葉如來去乎？』火鬘	漢 護 喜 語 火 鬘 曰 共 見 迦 葉 如 來 去 乎 火 鬘 
T04n0197_002:0172c23	答曰：『護喜用見此髠頭道人為？直是髠頭人	答 曰 護 喜 用 見 此 髠 頭 道 人 為 直 是 髠 頭 人 
T04n0197_002:0172c24	耳，何有道哉？佛道難可得！』如是至三。護喜	耳 何 有 道 哉 佛 道 難 可 得 如 是 至 三 護 喜 
T04n0197_002:0172c25	後日復語火鬘曰：『共至水上澡浴乎？』火鬘答	後 日 復 語 火 鬘 曰 共 至 水 上 澡 浴 乎 火 鬘 答 
T04n0197_002:0172c26	曰：『可爾。』便共詣水澡浴，已著衣服，護喜舉右	曰 可 爾 便 共 詣 水 澡 浴 已 著 衣 服 護 喜 舉 右 
T04n0197_002:0172c27	手遙指示曰：『迦葉如來精舍，去是不遠，可共	手 遙 指 示 曰 迦 葉 如 來 精 舍 去 是 不 遠 可 共 
T04n0197_002:0172c28	暫見不？』火鬘答曰：『護喜用見此髠頭道人	暫 見 不 火 鬘 答 曰 護 喜 用 見 此 髠 頭 道 人 
T04n0197_002:0172c29	為？髠頭道人，何有佛道？佛道難得！』護喜便	為 髠 頭 道 人 何 有 佛 道 佛 道 難 得 護 喜 便 
T04n0197_002:0173a01	捉火鬘衣牽曰：『共至迦葉佛去來，去佛甚近、	捉 火 鬘 衣 牽 曰 共 至 迦 葉 佛 去 來 去 佛 甚 近 
T04n0197_002:0173a02	不遠。』火鬘便脫衣、捨走，護喜逐後，捉腰帶挽	不 遠 火 鬘 便 脫 衣 捨 走 護 喜 逐 後 捉 腰 帶 挽 
T04n0197_002:0173a03	曰：『為可暫共見佛，便還耶。』火鬘復解帶捨走	曰 為 可 暫 共 見 佛 便 還 耶 火 鬘 復 解 帶 捨 走 
T04n0197_002:0173a04	曰：『我不欲見此髠頭沙門。』護喜便捉其頭，牽	曰 我 不 欲 見 此 髠 頭 沙 門 護 喜 便 捉 其 頭 牽 
T04n0197_002:0173a05	曰：『為一過，共見佛去來。』」佛語舍利弗：「爾時波	曰 為 一 過 共 見 佛 去 來 佛 語 舍 利 弗 爾 時 波 
T04n0197_002:0173a06	羅[木*奈]國俗，諱捉人頭，捉頭者法皆斬刑。火	羅 [木奈] 國 俗 諱 捉 人 頭 捉 頭 者 法 皆 斬 刑 火 
T04n0197_002:0173a07	鬘代其驚怖，心念曰：『此瓦師子，分死捉我頭	鬘 代 其 驚 怖 心 念 曰 此 瓦 師 子 分 死 捉 我 頭 
T04n0197_002:0173a08	耶。』護喜語火鬘曰：『爾，我死終不相置，要當	耶 護 喜 語 火 鬘 曰 爾 我 死 終 不 相 置 要 當 
T04n0197_002:0173a09	使卿見佛。』火鬘心念：『此非小事，必當有好事	使 卿 見 佛 火 鬘 心 念 此 非 小 事 必 當 有 好 事 
T04n0197_002:0173a10	耳，乃使此人分死相捉。』火鬘曰：『放我頭，我隨	耳 乃 使 此 人 分 死 相 捉 火 鬘 曰 放 我 頭 我 隨 
T04n0197_002:0173a11	子去耳。』護喜即放，火鬘便還，結頭、著衣服，即	子 去 耳 護 喜 即 放 火 鬘 便 還 結 頭 著 衣 服 即 
T04n0197_002:0173a12	相隨共詣迦葉佛所。「護喜禮迦葉如來足，於	相 隨 共 詣 迦 葉 佛 所 護 喜 禮 迦 葉 如 來 足 於 
T04n0197_002:0173a13	一面坐，火鬘直立舉手，問訊而已，便坐一面。	一 面 坐 火 鬘 直 立 舉 手 問 訊 而 已 便 坐 一 面 
T04n0197_002:0173a14	護喜叉手，白迦葉佛言：『此火鬘者，多獸邑中	護 喜 叉 手 白 迦 葉 佛 言 此 火 鬘 者 多 獸 邑 中 
T04n0197_002:0173a15	太史之子，是我少小親友。然其不識三尊、不	太 史 之 子 是 我 少 小 親 友 然 其 不 識 三 尊 不 
T04n0197_002:0173a16	信三寶、不見佛、不聞法、不供養眾僧，願世尊	信 三 寶 不 見 佛 不 聞 法 不 供 養 眾 僧 願 世 尊 
T04n0197_002:0173a17	開化愚冥，使其信解。』火鬘童子熟視世尊，從	開 化 愚 冥 使 其 信 解 火 鬘 童 子 熟 視 世 尊 從 
T04n0197_002:0173a18	頭至足、從足至頭，覩佛相好，威容巍巍，諸	頭 至 足 從 足 至 頭 覩 佛 相 好 威 容 巍 巍 諸 
T04n0197_002:0173a19	根寂定，純淑調和，以三十二相，嚴飾其體，八	根 寂 定 純 淑 調 和 以 三十二相 嚴 飾 其 體 八 
T04n0197_002:0173a20	十種好，以為姿媚，儀如娑羅樹花，身猶須彌	十 種 好 以 為 姿 媚 儀 如 娑 羅 樹 花 身 猶 須 彌 
T04n0197_002:0173a21	山，無能見其頂，面如月滿，光如日明，身色如	山 無 能 見 其 頂 面 如 月 滿 光 如 日 明 身 色 如 
T04n0197_002:0173a22	金山。火鬘見佛相好已，便心念曰：『我梵讖	金 山 火 鬘 見 佛 相 好 已 便 心 念 曰 我 梵 讖 
T04n0197_002:0173a23	記所載相好，今佛盡有，唯無二事耳。』「火鬘於	記 所 載 相 好 今 佛 盡 有 唯 無 二 事 耳 火 鬘 於 
T04n0197_002:0173a24	是說偈問曰：	是 說 偈 問 曰 
T04n0197_002:0173a25	「『所聞三十二，　　大士之相好，	 所 聞 三 十 二 大 士 之 相 好 
T04n0197_002:0173a26	　　於此人中尊，　　唯不覩二事。	 於 此 人 中 尊 唯 不 覩 二 事 
T04n0197_002:0173a27	　　豈有丈夫體，　　猶如馬藏不？	 豈 有 丈 夫 體 猶 如 馬 藏 不 
T04n0197_002:0173a28	　　寧有廣長舌，　　覆面舐頭不？	 寧 有 廣 長 舌 覆 面 舐 頭 不 
T04n0197_002:0173a29	　　願為吐舌示，　　令我決狐疑。	 願 為 吐 舌 示 令 我 決 狐 疑 
T04n0197_002:0173b01	　　我見乃當知，　　如經所載不？』	 我 見 乃 當 知 如 經 所 載 不 
T04n0197_002:0173b02	「於是，迦葉如來便出廣長舌相，以覆其面上	 於 是 迦 葉 如 來 便 出 廣長舌相 以 覆 其 面 上 
T04n0197_002:0173b03	及肉髻，并覆兩耳，七過舐頭，縮舌入口，色光	及 肉 髻 并 覆 兩 耳 七 過 舐 頭 縮 舌 入 口 色 光 
T04n0197_002:0173b04	出照大千世界，蔽日月明，乃至阿迦膩吒天	出 照 大千世界 蔽 日 月 明 乃 至 阿 迦 膩 吒 天 
T04n0197_002:0173b05	光，還遶身七匝，從頂上入。迦葉如來以神足	光 還 遶 身 七 匝 從 頂 上 入 迦 葉 如 來 以 神 足 
T04n0197_002:0173b06	力，現陰馬藏，令火鬘獨見，餘人不覩。火鬘童	力 現 陰 馬 藏 令 火 鬘 獨 見 餘 人 不 覩 火 鬘 童 
T04n0197_002:0173b07	子具足見佛三十二相，無一缺減，踊躍歡	子 具 足 見 佛 三十二相 無 一 缺 減 踊 躍 歡 
T04n0197_002:0173b08	喜，不能自勝。「迦葉如來為火鬘童子說法。說	喜 不 能 自 勝 迦 葉 如 來 為 火 鬘 童 子 說 法 說 
T04n0197_002:0173b09	何法？說菩薩斷功德法：『何等為斷菩薩功德	何 法 說 菩 薩 斷 功 德 法 何 等 為 斷 菩 薩 功 德 
T04n0197_002:0173b10	法？身行惡、口言惡、意念惡，身不可行而行、	法 身 行 惡 口 言 惡 意 念 惡 身 不 可 行 而 行 
T04n0197_002:0173b11	口不可言而言、意不可念而念。云何菩薩身	口 不 可 言 而 言 意 不 可 念 而 念 云 何 菩 薩 身 
T04n0197_002:0173b12	不可行而行者？後作佛時，身形短小，族姓子！	不 可 行 而 行 者 後 作 佛 時 身 形 短 小 族 姓 子 
T04n0197_002:0173b13	是為菩薩身不可行而行報也。云何菩薩口	是 為 菩 薩 身 不 可 行 而 行 報 也 云 何 菩 薩 口 
T04n0197_002:0173b14	不可言而言者？後出家學時，力極勤苦，乃當	不 可 言 而 言 者 後 出 家 學 時 力 極 勤 苦 乃 當 
T04n0197_002:0173b15	得佛，族姓子！是為菩薩口不可言而言報。云	得 佛 族 姓 子 是 為 菩 薩 口 不 可 言 而 言 報 云 
T04n0197_002:0173b16	何菩薩意不可念而念者？菩薩後成佛時，境	何 菩 薩 意 不 可 念 而 念 者 菩 薩 後 成 佛 時 境 
T04n0197_002:0173b17	內眾僧，常不和合，在在處處，共相是非，族姓	內 眾 僧 常 不 和 合 在在處處 共 相 是 非 族 姓 
T04n0197_002:0173b18	子！是為菩薩心不可念而念報。族姓子！是為	子 是 為 菩 薩 心 不 可 念 而 念 報 族 姓 子 是 為 
T04n0197_002:0173b19	菩薩三惡行對，族姓子！當棄是。』「於是，火鬘童	菩 薩 三 惡 行 對 族 姓 子 當 棄 是 於 是 火 鬘 童 
T04n0197_002:0173b20	子即退前禮佛足，長跪叉手，白佛言：『我今懺	子 即 退 前 禮 佛 足 長 跪 叉 手 白 佛 言 我 今 懺 
T04n0197_002:0173b21	悔，身不可行而行、口不可言而言、意不可念	悔 身 不 可 行 而 行 口 不 可 言 而 言 意 不 可 念 
T04n0197_002:0173b22	而念，願世尊當受我此懺悔，從今已往，不復	而 念 願 世 尊 當 受 我 此 懺 悔 從 今 已 往 不 復 
T04n0197_002:0173b23	敢犯。』如此懺至三。迦葉如來，默然受之。火鬘	敢 犯 如 此 懺 至 三 迦 葉 如 來 默 然 受 之 火 鬘 
T04n0197_002:0173b24	童子、護喜童子，俱起，稽首佛足，辭退而還。「火	童 子 護 喜 童 子 俱 起 稽 首 佛 足 辭 退 而 還 火 
T04n0197_002:0173b25	鬘童子於中路，忽思惟向三惡報，便報護	鬘 童 子 於 中 路 忽 思 惟 向 三 惡 報 便 報 護 
T04n0197_002:0173b26	喜曰：『卿為失利，不為得利；卿為無利，不為有	喜 曰 卿 為 失 利 不 為 得 利 卿 為 無 利 不 為 有 
T04n0197_002:0173b27	利。我不應見卿面，不喜聞卿名。』護喜答曰：『何	利 我 不 應 見 卿 面 不 喜 聞 卿 名 護 喜 答 曰 何 
T04n0197_002:0173b28	以故爾？』火鬘曰：『卿早從迦葉佛，聞深法寶，	以 故 爾 火 鬘 曰 卿 早 從 迦 葉 佛 聞 深 法 寶 
T04n0197_002:0173b29	何能在家，而不作道？』護喜答曰：『卿不知我父	何 能 在 家 而 不 作 道 護 喜 答 曰 卿 不 知 我 父 
T04n0197_002:0173c01	母年老，又復俱盲，供養二親，何由出家？我亦	母 年 老 又 復 俱 盲 供 養 二 親 何 由 出 家 我 亦 
T04n0197_002:0173c02	久欲為道耳，若我出家為道者，父母便當命	久 欲 為 道 耳 若 我 出 家 為 道 者 父 母 便 當 命 
T04n0197_002:0173c03	終，以是故，不得出家耳。』火鬘語護喜曰：『我從	終 以 是 故 不 得 出 家 耳 火 鬘 語 護 喜 曰 我 從 
T04n0197_002:0173c04	迦葉佛聞菩薩行三惡緣對，不復樂在家。我	迦 葉 佛 聞 菩 薩 行 三 惡 緣 對 不 復 樂 在 家 我 
T04n0197_002:0173c05	欲從此還至佛所，求為比丘。』護喜報曰：『善哉！	欲 從 此 還 至 佛 所 求 為 比 丘 護 喜 報 曰 善 哉 
T04n0197_002:0173c06	善哉！火鬘得思惟力耶，便可時還。所以然者，	善 哉 火 鬘 得 思 惟 力 耶 便 可 時 還 所 以 然 者 
T04n0197_002:0173c07	佛世難值故也。』火鬘童子即抱護喜已，便遶	佛 世 難 值 故 也 火 鬘 童 子 即 抱 護 喜 已 便 遶 
T04n0197_002:0173c08	三匝，叉手謝曰：『我設有身、口、意，過於卿者，願	三 匝 叉 手 謝 曰 我 設 有 身 口 意 過 於 卿 者 願 
T04n0197_002:0173c09	見原恕。苦卿指授正真大道。』「於是，火鬘童	見 原 恕 苦 卿 指 授 正 真 大 道 於 是 火 鬘 童 
T04n0197_002:0173c10	子說頌讚曰：	子 說 頌 讚 曰 
T04n0197_002:0173c11	「『仁為我善友，　　法友無所貪，	 仁 為 我 善 友 法 友 無 所 貪 
T04n0197_002:0173c12	　　導我以正道，　　是友佛所譽。』	 導 我 以 正 道 是 友 佛 所 譽 
T04n0197_002:0173c13	「火鬘童子於是說偈已，遶護喜三匝已，還詣	 火 鬘 童 子 於 是 說 偈 已 遶 護 喜 三 匝 已 還 詣 
T04n0197_002:0173c14	精舍迦葉佛所，稽首佛足，兩膝跪地，叉手白	精 舍 迦 葉 佛 所 稽 首 佛 足 兩 膝 跪 地 叉 手 白 
T04n0197_002:0173c15	佛言：『寧可得從迦葉如來，下鬚髮入道，受	佛 言 寧 可 得 從 迦 葉 如 來 下 鬚 髮 入 道 受 
T04n0197_002:0173c16	具足戒不？』」佛語舍利弗：「迦葉即度火鬘童子，	具 足 戒 不 佛 語 舍 利 弗 迦 葉 即 度 火 鬘 童 子 
T04n0197_002:0173c17	為道授其具足戒。」佛語舍利弗：「汝知爾時火	為 道 授 其 具 足 戒 佛 語 舍 利 弗 汝 知 爾 時 火 
T04n0197_002:0173c18	鬘童子不？則我身是；火鬘父者，今父王真淨	鬘 童 子 不 則 我 身 是 火 鬘 父 者 今 父 王 真 淨 
T04n0197_002:0173c19	是；爾時瓦師童子護喜者，我為太子，在宮婇	是 爾 時 瓦 師 童 子 護 喜 者 我 為 太 子 在 宮 婇 
T04n0197_002:0173c20	女，時夜半，作瓶天子來謂我曰：『時到，可出家	女 時 夜 半 作 瓶 天 子 來 謂 我 曰 時 到 可 出 家 
T04n0197_002:0173c21	去為道。』者是。舍利弗！此護喜者，頻勸我出家，	去 為 道 者 是 舍 利 弗 此 護 喜 者 頻 勸 我 出 家 
T04n0197_002:0173c22	則是作道善知識也。」佛語舍利弗：「我前向護	則 是 作 道 善 知 識 也 佛 語 舍 利 弗 我 前 向 護 
T04n0197_002:0173c23	喜作惡語道：『迦葉佛，髠頭沙門，何有佛道？	喜 作 惡 語 道 迦 葉 佛 髠 頭 沙 門 何 有 佛 道 
T04n0197_002:0173c24	佛道難得！』以是惡言故，臨成阿惟三佛時，六	佛 道 難 得 以 是 惡 言 故 臨 成 阿惟三佛 時 六 
T04n0197_002:0173c25	年受苦行。舍利弗！爾時日食一麻、一米、大豆、	年 受 苦 行 舍 利 弗 爾 時 日 食 一 麻 一 米 大 豆 
T04n0197_002:0173c26	小豆，我如是雖受辛苦，於法無益。我忍飢渴、	小 豆 我 如 是 雖 受 辛 苦 於 法 無 益 我 忍 飢 渴 
T04n0197_002:0173c27	寒熱、風雨、蚊虻之苦，身形枯燥，謂乎我成	寒 熱 風 雨 蚊 虻 之 苦 身 形 枯 燥 謂 乎 我 成 
T04n0197_002:0173c28	佛道，實無所得。舍利弗！我六年苦行者，償先	佛 道 實 無 所 得 舍 利 弗 我 六 年 苦 行 者 償 先 
T04n0197_002:0173c29	緣對畢也，然後乃得阿耨三耶三菩阿惟三	緣 對 畢 也 然 後 乃 得 阿 耨 三 耶 三 菩 阿 惟 三 
T04n0197_002:0174a01	佛耳。」於是，世尊說宿緣偈曰：	佛 耳 於 是 世 尊 說 宿 緣 偈 曰 
T04n0197_002:0174a02	「我昔火鬘童，　　向於護喜說：	 我 昔 火 鬘 童 向 於 護 喜 說 
T04n0197_002:0174a03	『髠頭何有佛？　　佛道甚難得！』	 髠 頭 何 有 佛 佛 道 甚 難 得 
T04n0197_002:0174a04	　以是因緣故，　　六年日不減，	 以是因緣 故 六 年 日 不 減 
T04n0197_002:0174a05	　受此勤苦行，　　望得成佛道。	 受 此 勤 苦 行 望 得 成 佛 道 
T04n0197_002:0174a06	　不以是苦行，　　能得成佛道，	 不 以 是 苦 行 能 得 成 佛 道 
T04n0197_002:0174a07	　非道而行求，　　因緣自纏繞。	 非 道 而 行 求 因 緣 自 纏 繞 
T04n0197_002:0174a08	　宿緣終不朽，　　亦不著虛空。	 宿 緣 終 不 朽 亦 不 著 虛 空 
T04n0197_002:0174a09	　當護三因緣，　　莫犯身、口、意。	 當 護 三 因 緣 莫 犯 身 口 意 
T04n0197_002:0174a10	　今我成佛道，　　得為三界將，	 今 我 成 佛 道 得 為 三 界 將 
T04n0197_002:0174a11	　阿耨大泉中，　　自說先世緣。」	 阿 耨 大 泉 中 自 說 先 世 緣 
T04n0197_002:0174a12	佛語舍利弗：「汝觀如來，眾惡已盡、諸善普	佛 語 舍 利 弗 汝 觀 如 來 眾 惡 已 盡 諸 善 普 
T04n0197_002:0174a13	具，諸天人、神鬼、乾沓和、阿須倫、迦樓羅、甄陀	具 諸 天 人 神 鬼 乾 沓 和 阿 須 倫 迦 樓 羅 甄 陀 
T04n0197_002:0174a14	羅、摩休勒、一切眾生，皆欲度之，我猶不免	羅 摩 休 勒 一 切 眾 生 皆 欲 度 之 我 猶 不 免 
T04n0197_002:0174a15	宿對，況復愚冥、未得道者？舍利弗！當學護身	宿 對 況 復 愚 冥 未 得 道 者 舍 利 弗 當 學 護 身 
T04n0197_002:0174a16	三、口四、意三，舍利弗！當學如是。」佛說如來先	三 口 四 意 三 舍 利 弗 當 學 如 是 佛 說 如 來 先 
T04n0197_002:0174a17	世因緣時，萬一千天子，得須陀洹道；八千龍，	世 因 緣 時 萬 一 千 天 子 得 須陀洹道 八 千 龍 
T04n0197_002:0174a18	皆受五戒；五千夜叉，受三自歸。阿耨大龍王	皆 受 五 戒 五 千 夜 叉 受 三 自 歸 阿 耨 大 龍 王 
T04n0197_002:0174a19	叉手白佛：「世尊！於我泉上，受我供養，說宿命	叉 手 白 佛 世 尊 於 我 泉 上 受 我 供 養 說 宿 命 
T04n0197_002:0174a20	因緣法，使我將來成佛時，莫有如此因緣；使	因 緣 法 使 我 將 來 成 佛 時 莫 有 如 此 因 緣 使 
T04n0197_002:0174a21	我眾惡皆盡，作真淨如來。」佛語阿耨大龍王：	我 眾 惡 皆 盡 作 真 淨 如 來 佛 語 阿 耨 大 龍 王 
T04n0197_002:0174a22	「汝欲得如是願者，當極護身、口、意，不令犯者，	 汝 欲 得 如 是 願 者 當 極 護 身 口 意 不 令 犯 者 
T04n0197_002:0174a23	可得如上所願，眾惡消盡，作真淨如來。」阿耨	可 得 如 上 所 願 眾 惡 消 盡 作 真 淨 如 來 阿 耨 
T04n0197_002:0174a24	大龍王聞佛所說，踊躍歡喜。以天栴檀香散	大 龍 王 聞 佛 所 說 踊 躍 歡 喜 以 天 栴 檀 香 散 
T04n0197_002:0174a25	佛及五百羅漢上。佛於是為諸天、龍、神，說安	佛 及 五 百 羅 漢 上 佛 於 是 為 諸 天 龍 神 說 安 
T04n0197_002:0174a26	慰法：「何謂安慰法？行布施法、行持戒法、行生	慰 法 何 謂 安 慰 法 行 布 施 法 行 持 戒 法 行 生 
T04n0197_002:0174a27	天道法、行斷欲法、行斷三惡道法、行無漏法、	天 道 法 行 斷 欲 法 行 斷 三 惡 道 法 行 無 漏 法 
T04n0197_002:0174a28	行清淨法。」佛說如是已，與諸比丘，各離本花	行 清 淨 法 佛 說 如 是 已 與 諸 比 丘 各 離 本 花 
T04n0197_002:0174a29	座。比丘圍遶佛，踊在虛空，高七多羅，以神	座 比 丘 圍 遶 佛 踊 在 虛 空 高 七 多 羅 以 神 
