T04n0197_001:0168a14	聞如是：一時佛在羅閱祇竹園精舍，與大比	聞 如 是 一 時 佛 在 羅 閱 祇 竹 園 精 舍 與 大 比 
T04n0197_001:0168a15	丘僧五百人俱。世尊晨旦著衣持鉢，與五百	丘 僧 五 百 人 俱 世 尊 晨 旦 著衣持鉢 與 五 百 
T04n0197_001:0168a16	比丘僧及阿難圍遶，共入羅閱祇城乞食，家	比 丘 僧 及 阿 難 圍 遶 共 入 羅 閱 祇 城 乞 食 家 
T04n0197_001:0168a17	家遍至。見此里中，有破剛木者，有一片木，	家 遍 至 見 此 里 中 有 破 剛 木 者 有 一 片 木 
T04n0197_001:0168a18	長尺二，迸在一邊，於佛前立。佛便心念：「此是	長 尺 二 迸 在 一 邊 於 佛 前 立 佛 便 心 念 此 是 
T04n0197_001:0168a19	宿緣，我自作是，自當受之。」眾人聞見，皆共	宿 緣 我 自 作 是 自 當 受 之 眾 人 聞 見 皆 共 
T04n0197_001:0168a20	聚觀，大眾見之，驚愕失聲。佛復心念：「今當現	聚 觀 大 眾 見 之 驚 愕 失 聲 佛 復 心 念 今 當 現 
T04n0197_001:0168a21	償宿緣，使眾人見，信解殃對，不敢造惡。」佛便	償 宿 緣 使 眾 人 見 信 解 殃 對 不 敢 造 惡 佛 便 
T04n0197_001:0168a22	踊在虛空，去地一刃，木槍逐佛，亦高一刃，	踊 在 虛 空 去 地 一 刃 木 槍 逐 佛 亦 高 一 刃 
T04n0197_001:0168a23	於佛前立；佛復上二刃、三刃、四刃乃至七	於 佛 前 立 佛 復 上 二 刃 三 刃 四 刃 乃 至 七 
T04n0197_001:0168a24	刃，槍亦隨上七刃；世尊復上高一多羅，槍	刃 槍 亦 隨 上 七 刃 世 尊 復 上 高 一 多 羅 槍 
T04n0197_001:0168a25	亦高一多羅；佛復上乃至七多羅，槍亦隨上，	亦 高 一 多 羅 佛 復 上 乃 至 七 多 羅 槍 亦 隨 上 
T04n0197_001:0168a26	立於佛前；佛復上高七里，槍亦高七里；佛復	立 於 佛 前 佛 復 上 高 七 里 槍 亦 高 七 里 佛 復 
T04n0197_001:0168a27	上高十里，槍亦如是；佛復上高一由延，槍亦	上 高 十 里 槍 亦 如 是 佛 復 上 高 一 由 延 槍 亦 
T04n0197_001:0168a28	隨之；佛復上七由延，槍亦上隨之。佛於空	隨 之 佛 復 上 七 由 延 槍 亦 上 隨 之 佛 於 空 
T04n0197_001:0168a29	中，化作青石，厚六由延，縱廣十二由延，佛於	中 化 作 青 石 厚 六 由 延 縱 廣 十 二 由 延 佛 於 
T04n0197_001:0168b01	上立，槍便穿石，出在佛前立；佛復於空中，化	上 立 槍 便 穿 石 出 在 佛 前 立 佛 復 於 空 中 化 
T04n0197_001:0168b02	作水，縱廣十二由延，深六由延，於水上立，槍	作 水 縱 廣 十 二 由 延 深 六 由 延 於 水 上 立 槍 
T04n0197_001:0168b03	復過水，於佛前立；佛復於空中，化作大火，縱	復 過 水 於 佛 前 立 佛 復 於 空 中 化 作 大 火 縱 
T04n0197_001:0168b04	廣十二由延，高六由延，於焰上立，槍亦過焰，	廣 十 二 由 延 高 六 由 延 於 焰 上 立 槍 亦 過 焰 
T04n0197_001:0168b05	至佛前立；佛復於空中，化作旋風，縱廣十二	至 佛 前 立 佛 復 於 空 中 化 作 旋 風 縱 廣 十 二 
T04n0197_001:0168b06	由延，高六由延，於風上立，槍從傍邊斜來，趣	由 延 高 六 由 延 於 風 上 立 槍 從 傍 邊 斜 來 趣 
T04n0197_001:0168b07	佛前立。佛復上至四天王宮殿中住，槍亦來	佛 前 立 佛 復 上 至 四 天 王 宮 殿 中 住 槍 亦 來 
T04n0197_001:0168b08	上，至佛前立。佛復上至三十三天，上壁方一	上 至 佛 前 立 佛 復 上 至 三十三天 上 壁 方 一 
T04n0197_001:0168b09	由延琉璃石，佛於上立，槍亦來上，在佛前立。	由 延 琉 璃 石 佛 於 上 立 槍 亦 來 上 在 佛 前 立 
T04n0197_001:0168b10	佛去後，四天王相告曰：「佛畏此木槍，槍亦逐	佛 去 後 四 天 王 相 告 曰 佛 畏 此 木 槍 槍 亦 逐 
T04n0197_001:0168b11	不置。」皆共僉然不悅，從三十三天化去。至焰	不 置 皆 共 僉 然 不 悅 從 三十三天 化 去 至 焰 
T04n0197_001:0168b12	天，焰天化去；至兜率，兜率化去；至涅磨羅	天 焰 天 化 去 至 兜 率 兜 率 化 去 至 涅 磨 羅 
T04n0197_001:0168b13	他，涅磨羅他化去；至婆羅尼蜜，婆羅尼蜜	他 涅 磨 羅 他 化 去 至 婆 羅 尼 蜜 婆 羅 尼 蜜 
T04n0197_001:0168b14	化去；至梵天；木槍從三十三天，以次來上，乃	化 去 至 梵 天 木 槍 從 三十三天 以 次 來 上 乃 
T04n0197_001:0168b15	至梵天，於佛前立。諸天皆相謂曰：「佛畏此槍，	至 梵 天 於 佛 前 立 諸 天 皆 相 謂 曰 佛 畏 此 槍 
T04n0197_001:0168b16	捨走，然槍逐不置。」爾時，世尊與諸梵天說	捨 走 然 槍 逐 不 置 爾 時 世 尊 與 諸 梵 天 說 
T04n0197_001:0168b17	自宿緣法；從梵天還，至婆羅尼蜜；婆羅尼蜜，	自 宿 緣 法 從 梵 天 還 至 婆 羅 尼 蜜 婆 羅 尼 蜜 
T04n0197_001:0168b18	下至涅摩羅他；涅摩羅他，下至兜率；兜率，	下 至 涅 摩 羅 他 涅 摩 羅 他 下 至 兜 率 兜 率 
T04n0197_001:0168b19	下至焰天；焰天，下至三十三天；三十三天，下	下 至 焰 天 焰 天 下 至 三十三天 三十三天 下 
T04n0197_001:0168b20	至四天王；四天王，下還至羅閱祇；所過諸天，	至 四 天 王 四 天 王 下 還 至 羅 閱 祇 所 過 諸 天 
T04n0197_001:0168b21	皆為說宿緣法，槍亦復從上下至羅閱祇，佛	皆 為 說 宿 緣 法 槍 亦 復 從 上 下 至 羅 閱 祇 佛 
T04n0197_001:0168b22	亦為羅閱祇人說宿緣法。佛與比丘僧出羅	亦 為 羅 閱 祇 人 說 宿 緣 法 佛 與 比 丘 僧 出 羅 
T04n0197_001:0168b23	閱祇城，槍亦尋佛後，國人盡逐佛出城。佛問	閱 祇 城 槍 亦 尋 佛 後 國 人 盡 逐 佛 出 城 佛 問 
T04n0197_001:0168b24	眾人：「汝等欲何至？」眾人答曰：「欲隨如來，看此	眾 人 汝 等 欲 何 至 眾 人 答 曰 欲 隨 如 來 看 此 
T04n0197_001:0168b25	因緣。」佛語眾人：「各自還歸，如來自知時節。」阿	因 緣 佛 語 眾 人 各 自 還 歸 如 來 自 知 時 節 阿 
T04n0197_001:0168b26	難問佛：「如來！何以遣眾人還？」佛語阿難：「若眾	難 問 佛 如 來 何 以 遣 眾 人 還 佛 語 阿 難 若 眾 
T04n0197_001:0168b27	人見我償此緣者，皆當盟死墮地。」阿難便	人 見 我 償 此 緣 者 皆 當 盟 死 墮 地 阿 難 便 
T04n0197_001:0168b28	默。世尊即還竹園僧伽藍，自處己房，勅諸	默 世 尊 即 還 竹 園 僧 伽 藍 自 處 己 房 勅 諸 
T04n0197_001:0168b29	比丘：「各自還房。」各受教還房。阿難問佛：「我當	比 丘 各 自 還 房 各 受 教 還 房 阿 難 問 佛 我 當 
T04n0197_001:0168c01	云何？」佛語阿難：「汝亦還房。」阿難即還。佛便心	云 何 佛 語 阿 難 汝 亦 還 房 阿 難 即 還 佛 便 心 
T04n0197_001:0168c02	念：「是緣我宿自造，必當償之。」即取大衣，四疊	念 是 緣 我 宿 自 造 必 當 償 之 即 取 大 衣 四 疊 
T04n0197_001:0168c03	襞之，還坐本座。佛便展右足，木槍便從足趺	襞 之 還 坐 本 座 佛 便 展 右 足 木 槍 便 從 足 趺 
T04n0197_001:0168c04	上下入，徹過入地，地深六萬八千由延；過此	上 下 入 徹 過 入 地 地 深 六 萬 八 千 由 延 過 此 
T04n0197_001:0168c05	地至水，水深亦六萬八千由延；過水至火，火	地 至 水 水 深 亦 六 萬 八 千 由 延 過 水 至 火 火 
T04n0197_001:0168c06	高六萬八千由延；至火乃燋。當爾時，地六反	高 六 萬 八 千 由 延 至 火 乃 燋 當 爾 時 地 六 反 
T04n0197_001:0168c07	震動。阿難、諸比丘，各自心念：「今此地動，槍必	震 動 阿 難 諸 比 丘 各 自 心 念 今 此 地 動 槍 必 
T04n0197_001:0168c08	刺佛脚也。」佛被刺已，苦痛、辛痛、疼痛、斷氣痛。	刺 佛 脚 也 佛 被 刺 已 苦 痛 辛 痛 疼 痛 斷 氣 痛 
T04n0197_001:0168c09	阿難即至佛所，見佛脚槍刺瘡，便悶死倒	阿 難 即 至 佛 所 見 佛 脚 槍 刺 瘡 便 悶 死 倒 
T04n0197_001:0168c10	地。佛便以水灑阿難，阿難乃起。起已，禮佛足、	地 佛 便 以 水 灑 阿 難 阿 難 乃 起 起 已 禮 佛 足 
T04n0197_001:0168c11	摩拭佛足、嗚佛足，涕泣墮淚曰：「佛以是脚，行	摩 拭 佛 足 嗚 佛 足 涕 泣 墮 淚 曰 佛 以 是 脚 行 
T04n0197_001:0168c12	至樹下降魔，上至三十三天，為母說法。世尊	至 樹 下 降 魔 上 至 三十三天 為 母 說 法 世 尊 
T04n0197_001:0168c13	金剛之身，作何因緣，為此小木所害乃爾？」佛	金 剛 之 身 作 何 因 緣 為 此 小 木 所 害 乃 爾 佛 
T04n0197_001:0168c14	語阿難：「且止，勿憂涕泣。世間因緣，輪轉生死，	語 阿 難 且 止 勿 憂 涕 泣 世 間 因 緣 輪轉生死 
T04n0197_001:0168c15	有是苦患。」阿難問佛：「今者，瘡痛增損何如？」佛	有 是 苦 患 阿 難 問 佛 今 者 瘡 痛 增 損 何 如 佛 
T04n0197_001:0168c16	語阿難：「漸漸有降。」舍利弗將諸比丘僧來詣	語 阿 難 漸 漸 有 降 舍 利 弗 將 諸 比 丘 僧 來 詣 
T04n0197_001:0168c17	佛所，稽首佛足，禮已，一面住。舍利弗問佛：「不	佛 所 稽 首 佛 足 禮 已 一 面 住 舍 利 弗 問 佛 不 
T04n0197_001:0168c18	審瘡痛，增損云何？」佛報舍利弗：「瘡痛漸漸有	審 瘡 痛 增 損 云 何 佛 報 舍 利 弗 瘡 痛 漸 漸 有 
T04n0197_001:0168c19	損。」爾時，比丘眾中，漏未盡者，見此瘡，皆悲喚	損 爾 時 比 丘 眾 中 漏 未 盡 者 見 此 瘡 皆 悲 喚 
T04n0197_001:0168c20	號泣曰：「世尊大悲，無物不濟，而云何有此	號 泣 曰 世 尊 大 悲 無 物 不 濟 而 云 何 有 此 
T04n0197_001:0168c21	痛緣也？」佛語此等比丘：「且止，莫涕。我乃先世	痛 緣 也 佛 語 此 等 比 丘 且 止 莫 涕 我 乃 先 世 
T04n0197_001:0168c22	自造此緣，要當受之，無可逃避處。此對亦非	自 造 此 緣 要 當 受 之 無 可 逃 避 處 此 對 亦 非 
T04n0197_001:0168c23	父作、亦非母作、亦非王作、亦非天作、亦非沙	父 作 亦 非 母 作 亦 非 王 作 亦 非 天 作 亦 非 沙 
T04n0197_001:0168c24	門、婆羅門所作，本我自造，今自受之。」諸漏盡	門 婆 羅 門 所 作 本 我 自 造 今 自 受 之 諸 漏 盡 
T04n0197_001:0168c25	神通者，各自默然思惟佛往日曾所說偈曰：	神 通 者 各 自 默 然 思 惟 佛 往 日 曾 所 說 偈 曰 
T04n0197_001:0168c26	「世人所作行，　　或作善惡事，	 世 人 所 作 行 或 作 善 惡 事 
T04n0197_001:0168c27	　此行還歸身，　　終不朽敗亡。」	 此 行 還 歸 身 終 不 朽 敗 亡 
T04n0197_001:0168c28	耆婆聞佛為木槍所刺，涕泣至阿闍世王所。	耆 婆 聞 佛 為 木 槍 所 刺 涕 泣 至 阿 闍 世 王 所 
T04n0197_001:0168c29	阿闍世王曰：「卿何以涕泣？」耆婆答曰：「我聞佛	阿 闍 世 王 曰 卿 何 以 涕 泣 耆 婆 答 曰 我 聞 佛 
T04n0197_001:0169a01	為木槍刺脚，是以涕耳。」阿闍世王聞此語，便	為 木 槍 刺 脚 是 以 涕 耳 阿 闍 世 王 聞 此 語 便 
T04n0197_001:0169a02	從床上，悶死墮地，良久乃穌。舉宮內外，咸皆	從 床 上 悶 死 墮 地 良 久 乃 穌 舉 宮 內 外 咸 皆 
T04n0197_001:0169a03	驚怖。王起涕泣，勅諸臣曰：「速疾嚴駕，欲至佛	驚 怖 王 起 涕 泣 勅 諸 臣 曰 速 疾 嚴 駕 欲 至 佛 
T04n0197_001:0169a04	所。」諸臣受教，即便嚴駕，白王曰：「嚴駕已訖。」	所 諸 臣 受 教 即 便 嚴 駕 白 王 曰 嚴 駕 已 訖 
T04n0197_001:0169a05	王即便上車，出羅閱祇城。城內四姓宗族、清	王 即 便 上 車 出 羅 閱 祇 城 城 內 四 姓 宗 族 清 
T04n0197_001:0169a06	信士女，聞佛為木槍所刺，王與弟耆婆，及此	信 士 女 聞 佛 為 木 槍 所 刺 王 與 弟 耆 婆 及 此 
T04n0197_001:0169a07	人眾，百千圍遶，共至佛所。下車、脫冠、解劍、退	人 眾 百 千 圍 遶 共 至 佛 所 下 車 脫 冠 解 劍 退 
T04n0197_001:0169a08	蓋，步進詣佛。佛右脇側臥，王禮佛已，手捉	蓋 步 進 詣 佛 佛 右 脇 側 臥 王 禮 佛 已 手 捉 
T04n0197_001:0169a09	佛足，摩抆、口嗚，自稱國號姓名曰：「摩竭王阿	佛 足 摩 抆 口 嗚 自 稱 國 號 姓 名 曰 摩 竭 王 阿 
T04n0197_001:0169a10	闍世，問訊世尊，瘡痛寧有小損不？」佛報阿闍	闍 世 問 訊 世 尊 瘡 痛 寧 有 小 損 不 佛 報 阿 闍 
T04n0197_001:0169a11	世：「當使大王，常得安隱，長壽無病。王當治	世 當 使 大 王 常 得 安 隱 長 壽 無 病 王 當 治 
T04n0197_001:0169a12	以正法，莫行非法。」佛便命王使坐，王即就	以 正 法 莫 行 非 法 佛 便 命 王 使 坐 王 即 就 
T04n0197_001:0169a13	座。王問佛言：「我從如來所聞，佛身金剛，不	座 王 問 佛 言 我 從 如 來 所 聞 佛 身 金 剛 不 
T04n0197_001:0169a14	可毀壞。不審今者，何為此木槍所刺耶？」佛告	可 毀 壞 不 審 今 者 何 為 此 木 槍 所 刺 耶 佛 告 
T04n0197_001:0169a15	王曰：「一切諸法，皆為緣對所壞。我身雖是金	王 曰 一切諸法 皆 為 緣 對 所 壞 我 身 雖 是 金 
T04n0197_001:0169a16	剛，非木槍能壞，宿對所壞。」於是，世尊即說頌	剛 非 木 槍 能 壞 宿 對 所 壞 於 是 世 尊 即 說 頌 
T04n0197_001:0169a17	曰：	曰 
T04n0197_001:0169a18	「世人所為作，　　各自見其行，	 世 人 所 為 作 各 自 見 其 行 
T04n0197_001:0169a19	　行善得善報，　　行惡得惡報。	 行 善 得 善 報 行 惡 得 惡 報 
T04n0197_001:0169a20	「是故，大王！當學捨惡、從善。愚騃不學問，未識	 是 故 大 王 當 學 捨 惡 從 善 愚 騃 不 學 問 未 識 
T04n0197_001:0169a21	真道者，戲笑輕作罪，後當號泣受。是故，大王！	真 道 者 戲 笑 輕 作 罪 後 當 號 泣 受 是 故 大 王 
T04n0197_001:0169a22	不可以戲笑作罪，王當學如是。」王語耆婆：「汝	不 可 以 戲 笑 作 罪 王 當 學 如 是 王 語 耆 婆 汝 
T04n0197_001:0169a23	合好藥，洗瘡呪治，必令時差。」耆婆曰：「諾。」耆婆	合 好 藥 洗 瘡 呪 治 必 令 時 差 耆 婆 曰 諾 耆 婆 
T04n0197_001:0169a24	即便禮佛、洗足、著生肌藥已，復讀止痛呪。	即 便 禮 佛 洗 足 著 生 肌 藥 已 復 讀 止 痛 呪 
T04n0197_001:0169a25	耆婆出百千價[疊*毛]，用裹佛足，以手摩足，以口	耆 婆 出 百 千 價 [疊毛] 用 裹 佛 足 以 手 摩 足 以 口 
T04n0197_001:0169a26	嗚之曰：「願佛老壽，此患早除。一切眾生，長夜	嗚 之 曰 願 佛 老 壽 此 患 早 除 一 切 眾 生 長 夜 
T04n0197_001:0169a27	之苦，亦得解脫。」即起禮佛，於一面住。佛於是	之 苦 亦 得 解 脫 即 起 禮 佛 於 一 面 住 佛 於 是 
T04n0197_001:0169a28	為阿闍世王、一切眾會故，說四諦法：「何謂四	為 阿 闍 世 王 一 切 眾 會 故 說 四 諦 法 何 謂 四 
T04n0197_001:0169a29	諦？苦諦、苦習諦、苦盡諦、苦盡道諦，是為四	諦 苦 諦 苦 習 諦 苦 盡 諦 苦 盡 道 諦 是 為 四 
T04n0197_001:0169b01	諦。」說是時，六十比丘，得漏盡、意解；萬一千	諦 說 是 時 六 十 比 丘 得 漏 盡 意 解 萬 一 千 
T04n0197_001:0169b02	人，得法眼淨。王於是辭曰：「國事多故，欲還請	人 得法眼淨 王 於 是 辭 曰 國 事 多 故 欲 還 請 
T04n0197_001:0169b03	辭。」佛言：「可，宜知是時。」王即起，稽首佛足，遶三	辭 佛 言 可 宜知是時 王 即 起 稽 首 佛 足 遶 三 
T04n0197_001:0169b04	匝而歸。諸眾亦各禮佛，遶三匝而還。於是暮，	匝 而 歸 諸 眾 亦 各 禮 佛 遶 三 匝 而 還 於 是 暮 
T04n0197_001:0169b05	夜半，有七天人，人人能出百種音聲，來詣佛	夜 半 有 七 天 人 人 人 能 出 百 種 音 聲 來 詣 佛 
T04n0197_001:0169b06	所，稽首佛足，遶床一匝而立。一天白佛：「瞿曇	所 稽 首 佛 足 遶 床 一 匝 而 立 一 天 白 佛 瞿 曇 
T04n0197_001:0169b07	沙門！如師子受瘡，能忍苦痛，不告他人。」一天	沙 門 如 師 子 受 瘡 能 忍 苦 痛 不 告 他 人 一 天 
T04n0197_001:0169b08	又曰：「瞿曇沙門！如象受瘡，能忍苦痛，不語他	又 曰 瞿 曇 沙 門 如 象 受 瘡 能 忍 苦 痛 不 語 他 
T04n0197_001:0169b09	人。」一天復曰：「瞿曇沙門！如犎牛號時，亦不	人 一 天 復 曰 瞿 曇 沙 門 如 犎 牛 號 時 亦 不 
T04n0197_001:0169b10	覺苦痛。」一天復曰：「瞿曇沙門！如水牛號時，	覺 苦 痛 一 天 復 曰 瞿 曇 沙 門 如 水 牛 號 時 
T04n0197_001:0169b11	亦不覺痛。」一天復曰：「瞿曇沙門！如八臂天	亦 不 覺 痛 一 天 復 曰 瞿 曇 沙 門 如 八 臂 天 
T04n0197_001:0169b12	王受瘡，能忍苦痛。」一天復曰：「瞿曇沙門！如寶	王 受 瘡 能 忍 苦 痛 一 天 復 曰 瞿 曇 沙 門 如 寶 
T04n0197_001:0169b13	馬不覺苦痛。」一天復曰：「瞿曇沙門！審諦清淨，	馬 不 覺 苦 痛 一 天 復 曰 瞿 曇 沙 門 審 諦 清 淨 
T04n0197_001:0169b14	不覺苦痛。」第一天曰：「佛！人中師子、人中象、	不 覺 苦 痛 第 一 天 曰 佛 人 中 師 子 人 中 象 
T04n0197_001:0169b15	人中犎牛、人中水牛、人中八臂天王、人中寶	人 中 犎 牛 人 中 水 牛 人 中 八 臂 天 王 人 中 寶 
T04n0197_001:0169b16	馬、人中審諦清淨，世尊如此等，能忍苦痛。此	馬 人 中 審 諦 清 淨 世 尊 如 此 等 能 忍 苦 痛 此 
T04n0197_001:0169b17	輩愚耐痛，世尊以慧耐。不如外學、梵志，已過	輩 愚 耐 痛 世 尊 以 慧 耐 不 如 外 學 梵 志 已 過 
T04n0197_001:0169b18	中年，懈廢取婦，故望度苦，無由得度。何以故？	中 年 懈 廢 取 婦 故 望 度 苦 無 由 得 度 何 以 故 
T04n0197_001:0169b19	不能究竟故也。如來法中，清淨究竟，斷諸愛	不 能 究 竟 故 也 如 來 法 中 清 淨 究 竟 斷 諸 愛 
T04n0197_001:0169b20	欲，滅盡涅槃，如此乃度三界穢海也。何以故？	欲 滅 盡 涅 槃 如 此 乃 度 三 界 穢 海 也 何 以 故 
T04n0197_001:0169b21	是輩心意正定，從四諦求涅槃故也。」天於是	是 輩 心 意 正 定 從 四 諦 求 涅 槃 故 也 天 於 是 
T04n0197_001:0169b22	以偈頌曰：	以 偈 頌 曰 
T04n0197_001:0169b23	「凶獷難降伏，　　癡疑無定智，	 凶 獷 難 降 伏 癡 疑 無 定 智 
T04n0197_001:0169b24	　志荒處野露，　　不度生死淵。	 志 荒 處 野 露 不 度 生 死 淵 
T04n0197_001:0169b25	　定智除凶愚，　　調意眾縛解，	 定 智 除 凶 愚 調 意 眾 縛 解 
T04n0197_001:0169b26	　志寂無狂惑，　　是度生死海。」	 志 寂 無 狂 惑 是 度生死海 
T04n0197_001:0169b27	於是，天說偈已，佛默然可之。諸天見佛默然，	於 是 天 說 偈 已 佛 默 然 可 之 諸 天 見 佛 默 然 
T04n0197_001:0169b28	知為可意，即稽首佛足，遶三匝已，忽然化去。	知 為 可 意 即 稽 首 佛 足 遶 三 匝 已 忽 然 化 去 
T04n0197_001:0169b29	至清旦，佛語舍利弗：「往昔無數阿僧祇劫前，	至 清 旦 佛 語 舍 利 弗 往 昔 無 數 阿僧祇劫 前 
T04n0197_001:0169c01	爾時，有兩部賈客，各有五百人，在波羅[木*奈]	爾 時 有 兩 部 賈 客 各 有 五 百 人 在 波 羅 [木奈] 
T04n0197_001:0169c02	國，各撰合資財，欲嚴船渡海。裝捒已訖，解	國 各 撰 合 資 財 欲 嚴 船 渡 海 裝 捒 已 訖 解 
T04n0197_001:0169c03	繫張帆，便引而去。乘風徑往，即至寶渚。渚上	繫 張 帆 便 引 而 去 乘 風 徑 往 即 至 寶 渚 渚 上 
T04n0197_001:0169c04	豐饒，多有衣被、飲食、床臥、坐具，及妙婇女，	豐 饒 多 有 衣 被 飲 食 床 臥 坐 具 及 妙 婇 女 
T04n0197_001:0169c05	種種雜寶，無物不有。一部賈客主語眾人曰：	種 種 雜 寶 無 物 不 有 一 部 賈 客 主 語 眾 人 曰 
T04n0197_001:0169c06	『我等以資財故，勤身苦體，渡海至此，所求	 我 等 以 資 財 故 勤 身 苦 體 渡 海 至 此 所 求 
T04n0197_001:0169c07	已獲，今當住此，以五樂自娛。』第二薩薄告其	已 獲 今 當 住 此 以 五 樂 自 娛 第 二 薩 薄 告 其 
T04n0197_001:0169c08	部眾：『此間雖饒眾寶、五樂、婇女、衣食無乏，不	部 眾 此 間 雖 饒 眾 寶 五 樂 婇 女 衣 食 無 乏 不 
T04n0197_001:0169c09	當於此久住。』「是時，於虛空中，有天女慈愍此	當 於 此 久 住 是 時 於 虛 空 中 有 天 女 慈 愍 此 
T04n0197_001:0169c10	輩賈客，欲使從心所願，多得財寶，無為還歸，	輩 賈 客 欲 使 從 心 所 願 多 得 財 寶 無 為 還 歸 
T04n0197_001:0169c11	便於空中，語眾賈人曰：『此間雖有財寶、五樂、	便 於 空 中 語 眾 賈 人 曰 此 間 雖 有 財 寶 五 樂 
T04n0197_001:0169c12	婇女、衣被、飲食，不足久住，當早還去。何以故？	婇 女 衣 被 飲 食 不 足 久 住 當 早 還 去 何 以 故 
T04n0197_001:0169c13	却後七日，此地皆當沒水。』語訖化去。復有魔	却 後 七 日 此 地 皆 當 沒 水 語 訖 化 去 復 有 魔 
T04n0197_001:0169c14	天女，意欲使此賈客於此沒盡，不得還歸，於	天 女 意 欲 使 此 賈 客 於 此 沒 盡 不 得 還 歸 於 
T04n0197_001:0169c15	空中告曰：『卿等不足嚴駕欲還去，此間快樂，	空 中 告 曰 卿 等 不 足 嚴 駕 欲 還 去 此 間 快 樂 
T04n0197_001:0169c16	極可娛樂。此地初無水至，設當有水至此，	極 可 娛 樂 此 地 初 無 水 至 設 當 有 水 至 此 
T04n0197_001:0169c17	此之眾寶、飲食、衣被、婇女、五樂，何由而有？	此 之 眾 寶 飲 食 衣 被 婇 女 五 樂 何 由 而 有 
T04n0197_001:0169c18	前天所說，水當沒此，皆是虛妄，不足信之。』說	前 天 所 說 水 當 沒 此 皆 是 虛 妄 不 足 信 之 說 
T04n0197_001:0169c19	已化去。「第一薩薄聞天女語已，勅其部眾：『卿	已 化 去 第 一 薩 薄 聞 天 女 語 已 勅 其 部 眾 卿 
T04n0197_001:0169c20	等勿復嚴駕欲得還去，莫信前天所說，此是	等 勿 復 嚴 駕 欲 得 還 去 莫 信 前 天 所 說 此 是 
T04n0197_001:0169c21	虛妄耳。此間快樂，五欲無乏，閻浮勤苦，正欲	虛 妄 耳 此 間 快 樂 五 欲 無 乏 閻 浮 勤 苦 正 欲 
T04n0197_001:0169c22	求此，今已得之，何緣復去？』第二薩薄還告其	求 此 今 已 得 之 何 緣 復 去 第 二 薩 薄 還 告 其 
T04n0197_001:0169c23	眾：『卿等莫貪五樂，於此久住。却後七日，水當	眾 卿 等 莫 貪 五 樂 於 此 久 住 却 後 七 日 水 當 
T04n0197_001:0169c24	滿此，速疾市買，裝駕治船。前天所說，至誠不	滿 此 速 疾 市 買 裝 駕 治 船 前 天 所 說 至 誠 不 
T04n0197_001:0169c25	虛。設七日無水，猶當治嚴還去，豈可捨本父、	虛 設 七 日 無 水 猶 當 治 嚴 還 去 豈 可 捨 本 父 
T04n0197_001:0169c26	母、妻子乎？若當却後七日，水不至者，便當於	母 妻 子 乎 若 當 却 後 七 日 水 不 至 者 便 當 於 
T04n0197_001:0169c27	此五樂自娛，然後徐歸。若水審來，如前天所	此 五 樂 自 娛 然 後 徐 歸 若 水 審 來 如 前 天 所 
T04n0197_001:0169c28	說者，治嚴已竟，去復何難？』」佛語舍利弗：「却後	說 者 治 嚴 已 竟 去 復 何 難 佛 語 舍 利 弗 却 後 
T04n0197_001:0169c29	七日，如前天所言，水滿其地。於時，第二薩薄，	七 日 如 前 天 所 言 水 滿 其 地 於 時 第 二 薩 薄 
T04n0197_001:0170a01	先已嚴辦，水至之日，所將部眾，即得上船；第	先 已 嚴 辦 水 至 之 日 所 將 部 眾 即 得 上 船 第 
T04n0197_001:0170a02	一薩薄，先不治嚴，水至之日，與治嚴者爭船，	一 薩 薄 先 不 治 嚴 水 至 之 日 與 治 嚴 者 爭 船 
T04n0197_001:0170a03	船主護之，不令得前，便著鎧持杖，共相格戰。	船 主 護 之 不 令 得 前 便 著 鎧 持 杖 共 相 格 戰 
T04n0197_001:0170a04	第二薩薄於船上，以鋑(麤官反)鉾鋑第一	第 二 薩 薄 於 船 上 以 鋑 麤 官 反 鉾 鋑 第 一 
T04n0197_001:0170a05	薩薄脚，徹過，即便命終。」佛語舍利弗：「汝知第	薩 薄 脚 徹 過 即 便 命 終 佛 語 舍 利 弗 汝 知 第 
T04n0197_001:0170a06	一薩薄者不？則地婆達兜是；第二薩薄，以鉾	一 薩 薄 者 不 則 地 婆 達 兜 是 第 二 薩 薄 以 鉾 
T04n0197_001:0170a07	鋑第一薩薄者，則我身是；爾時，第一賈客，	鋑 第 一 薩 薄 者 則 我 身 是 爾 時 第 一 賈 客 
T04n0197_001:0170a08	眾五百人者，則今地婆達兜五百弟子是；爾	眾 五 百 人 者 則 今 地 婆 達 兜 五 百 弟 子 是 爾 
T04n0197_001:0170a09	時，第二賈客，五百眾者，則今五百羅漢是；爾	時 第 二 賈 客 五 百 眾 者 則 今 五 百 羅 漢 是 爾 
T04n0197_001:0170a10	時，第一天女者，則舍利弗是；爾時，第二天女，	時 第 一 天 女 者 則 舍 利 弗 是 爾 時 第 二 天 女 
T04n0197_001:0170a11	則今名滿月比丘，婆羅門弟子是。」佛語舍利	則 今 名 滿 月 比 丘 婆 羅 門 弟 子 是 佛 語 舍 利 
T04n0197_001:0170a12	弗：「我往昔作薩薄，貪財分死渡海，與彼爭	弗 我 往 昔 作 薩 薄 貪 財 分 死 渡 海 與 彼 爭 
