T11n0314_001:0768a26	佛，於諸佛所種諸善根及大乘行，正學菩提、	佛 於 諸 佛 所 種 諸 善 根 及 大 乘 行 正 學 菩 提 
T11n0314_001:0768a27	順向菩提、不退於大菩提，近阿耨多羅三藐	順 向 菩 提 不 退 於 大 菩 提 近 阿 耨 多 羅 三 藐 
T11n0314_001:0768a28	三菩提。是諸眾生偏起惡故，於命終後墮阿	三 菩 提 是 諸 眾 生 偏 起 惡 故 於 命 終 後 墮 阿 
T11n0314_001:0768a29	鼻地獄、餓鬼、畜生之中歷受諸苦。善男子！云	鼻 地 獄 餓 鬼 畜 生 之 中 歷 受 諸 苦 善 男 子 云 
T11n0314_001:0768b01	何所取？『如來入舍梨耶婆羅門村。』善男子！我	何 所 取 如 來 入 舍 梨 耶 婆 羅 門 村 善 男 子 我 
T11n0314_001:0768b02	為愍後世故，行示此教。何以故？無有業報而	為 愍 後 世 故 行 示 此 教 何 以 故 無 有 業 報 而 
T11n0314_001:0768b03	對如來。然我護後世故，所有乞食比丘入聚	對 如 來 然 我 護 後 世 故 所 有 乞 食 比 丘 入 聚 
T11n0314_001:0768b04	落村邑城郭王都等，以薄福力故不得其食。	落 村 邑 城 郭 王 都 等 以 薄 福 力 故 不 得 其 食 
T11n0314_001:0768b05	彼爾時正憶於我：『是其佛世尊具足一切功	彼 爾 時 正 憶 於 我 是 其 佛 世 尊 具 足 一 切 功 
T11n0314_001:0768b06	德，空鉢而出，何況我等微薄善根？我等以是	德 空 鉢 而 出 何 況 我 等 微 薄 善 根 我 等 以 是 
T11n0314_001:0768b07	故，心不應生退。』為此事故，如來入村空鉢而	故 心 不 應 生 退 為 此 事 故 如 來 入 村 空 鉢 而 
T11n0314_001:0768b08	出。然復所說言：『魔波旬治諸婆羅門令不給	出 然 復 所 說 言 魔 波 旬 治 諸 婆 羅 門 令 不 給 
T11n0314_001:0768b09	如來食。』不應隨說而取。何以故？魔無如是神	如 來 食 不 應 隨 說 而 取 何 以 故 魔 無 如 是 神 
T11n0314_001:0768b10	力堪障施如來食。爾時諸佛神力故，令魔處	力 堪 障 施 如 來 食 爾 時 諸 佛 神 力 故 令 魔 處 
T11n0314_001:0768b11	處治諸婆羅門及居士等，而如來無有過咎。	處 治 諸 婆 羅 門 及 居 士 等 而 如 來 無 有 過 咎 
T11n0314_001:0768b12	為顯彼眾生故，如來示現此方便善巧等事。	為 顯 彼 眾 生 故 如 來 示 現 此 方便善巧 等 事 
T11n0314_001:0768b13	爾時如來及諸聲聞，斷食之後，魔及魔民并	爾 時 如 來 及 諸 聲 聞 斷 食 之 後 魔 及 魔 民 并 
T11n0314_001:0768b14	諸餘天，觀如來心：『是沙門瞿曇及諸聲聞弟	諸 餘 天 觀 如 來 心 是 沙 門 瞿 曇 及 諸 聲 聞 弟 
T11n0314_001:0768b15	子為憂惱不？』彼日觀如來及諸弟子，無有意	子 為 憂 惱 不 彼 日 觀 如 來 及 諸 弟 子 無 有 意 
T11n0314_001:0768b16	恨憂惱心已，亦不高不下，如前後亦如是。爾	恨 憂 惱 心 已 亦 不 高 不 下 如 前 後 亦 如 是 爾 
T11n0314_001:0768b17	時彼眾中七千諸天子，以心歡喜，歸依於佛。	時 彼 眾 中 七 千 諸 天 子 以 心 歡 喜 歸 依 於 佛 
T11n0314_001:0768b18	如來為彼善化說妙法，彼聞法已，於如來法	如 來 為 彼 善 化 說 妙 法 彼 聞 法 已 於 如 來 法 
T11n0314_001:0768b19	中得法眼淨。如是如來觀後世事，佛無業報。」	中 得法眼淨 如 是 如 來 觀 後 世 事 佛 無 業 報 
T11n0314_001:0768b20	「世尊！云何可取？『旃遮孫陀利等以木器置腹	 世 尊 云 何 可 取 旃 遮 孫 陀 利 等 以 木 器 置 腹 
T11n0314_001:0768b21	上而謗如來。』」答曰：「善男子！如來無有業患果	上 而 謗 如 來 答 曰 善 男 子 如 來 無 有 業 患 果 
T11n0314_001:0768b22	報。如來成就諸神通力，令旃遮孫陀利過無	報 如 來 成 就 諸 神 通 力 令 旃 遮 孫 陀 利 過 無 
T11n0314_001:0768b23	量恒河沙等世界，令安彼人。然是如來方便	量 恒 河 沙 等 世 界 令 安 彼 人 然 是 如 來 方 便 
T11n0314_001:0768b24	力故，示現業報諸謗等事。於我法中出家者，	力 故 示 現 業 報 諸 謗 等 事 於 我 法 中 出 家 者 
T11n0314_001:0768b25	彼被虛謗，既聞謗已，而生憂愁疑悔。彼作如	彼 被 虛 謗 既 聞 謗 已 而 生 憂 愁 疑 悔 彼 作 如 
T11n0314_001:0768b26	是說：『是如來成就一切諸白法，對面被謗，何	是 說 是 如 來 成 就 一 切 諸 白 法 對 面 被 謗 何 
T11n0314_001:0768b27	況我等而不被謗？』彼爾時忍其諸謗，行清淨	況 我 等 而 不 被 謗 彼 爾 時 忍 其 諸 謗 行 清 淨 
T11n0314_001:0768b28	梵行而不成退。旃遮孫陀利者，以惡業所牽，	梵 行 而 不 成 退 旃 遮 孫 陀 利 者 以 惡 業 所 牽 
T11n0314_001:0768b29	乃至夢中謗其如來，謗已捨身墮於惡趣。若	乃 至 夢 中 謗 其 如 來 謗 已 捨 身 墮於惡趣 若 
T11n0314_001:0768c01	如來知是可救者，便應救之。何以故？如來無	如 來 知 是 可 救 者 便 應 救 之 何 以 故 如 來 無 
T11n0314_001:0768c02	有眾生而是可捨者。」「世尊！云何可取？『如來於	有 眾 生 而 是 可 捨 者 世 尊 云 何 可 取 如 來 於 
T11n0314_001:0768c03	修羅婆國毘蘭若婆羅門所，請三月安居已，	修 羅 婆 國 毘 蘭 若 婆 羅 門 所 請 三 月 安 居 已 
T11n0314_001:0768c04	唯食其麥。』」答曰：「如來知諸婆羅門居士等請	唯 食 其 麥 答 曰 如 來 知 諸 婆 羅 門 居 士 等 請 
T11n0314_001:0768c05	已而不供養。如來知已，故往至彼。何以故？所	已 而 不 供 養 如 來 知 已 故 往 至 彼 何 以 故 所 
T11n0314_001:0768c06	有五百匹馬者，如來并諸比丘眾食麥，彼一	有 五 百 匹 馬 者 如 來 并 諸 比 丘 眾 食 麥 彼 一 
T11n0314_001:0768c07	切盡修菩薩行，親近過去諸佛，是以值惡知	切 盡 修菩薩行 親 近 過去諸佛 是 以 值 惡 知 
T11n0314_001:0768c08	識故造諸惡業，以此事生畜生中，彼五百馬	識 故 造 諸 惡 業 以 此 事 生 畜 生 中 彼 五 百 馬 
T11n0314_001:0768c09	能調伏教者，名曰金剛藏菩薩，以願力故	能 調 伏 教 者 名 曰 金 剛 藏 菩 薩 以 願 力 故 
T11n0314_001:0768c10	生於彼處。是諸馬者，以日藏菩薩所化發菩	生 於 彼 處 是 諸 馬 者 以 日 藏 菩 薩 所 化 發 菩 
T11n0314_001:0768c11	提心，為化彼故應生彼處。以彼調伏馬師力	提 心 為 化 彼 故 應 生 彼 處 以 彼 調 伏 馬 師 力 
T11n0314_001:0768c12	故，彼一切諸馬憶本宿命，而彼現其菩提心。	故 彼 一 切 諸 馬 憶 本 宿 命 而 彼 現 其 菩 提 心 
T11n0314_001:0768c13	善男子！如來愍彼五百馬故，往至彼處調伏	善 男 子 如 來 愍 彼 五 百 馬 故 往 至 彼 處 調 伏 
T11n0314_001:0768c14	馬師，麥者分半施佛，五百馬所有麥亦分半	馬 師 麥 者 分 半 施 佛 五 百 馬 所 有 麥 亦 分 半 
T11n0314_001:0768c15	施諸比丘。彼馬師以馬音聲，令彼五百馬，	施 諸 比 丘 彼 馬 師 以 馬 音 聲 令 彼 五 百 馬 
T11n0314_001:0768c16	令能悔過及禮拜佛僧等。爾時彼三說後，彼	令 能 悔 過 及 禮 拜 佛 僧 等 爾 時 彼 三 說 後 彼 
T11n0314_001:0768c17	諸馬捨身已，生兜率陀天中，彼復生天中而	諸 馬 捨 身 已 生 兜 率 陀 天 中 彼 復 生 天 中 而 
T11n0314_001:0768c18	供養如來。如來為彼善教化說法，聞法已即	供養如來 如 來 為 彼 善 教 化 說 法 聞 法 已 即 
T11n0314_001:0768c19	不退阿耨多羅三藐三菩提。彼五百馬所調	不 退 阿耨多羅三藐三菩提 彼 五 百 馬 所 調 
T11n0314_001:0768c20	伏護者，如來亦記彼當成辟支佛，號曰善調	伏 護 者 如 來 亦 記 彼 當 成 辟 支 佛 號 曰 善 調 
T11n0314_001:0768c21	伏心。然復，善男子！如來無慈不備、不常者。善	伏 心 然 復 善 男 子 如 來 無 慈 不 備 不 常 者 善 
T11n0314_001:0768c22	男子！設使如來食土木瓦石等，無三千大千	男 子 設 使 如 來 食 土 木 瓦 石 等 無 三千大千 
T11n0314_001:0768c23	世界中，有如是味及如是上味，是諸土木瓦	世 界 中 有 如 是 味 及 如 是 上 味 是 諸 土 木 瓦 
T11n0314_001:0768c24	石等。何以故？如來得上妙味中之味，大人之	石 等 何 以 故 如 來 得 上 妙 味 中 之 味 大 人 之 
T11n0314_001:0768c25	相故。善男子！以此義故應如是知，如來一切	相 故 善 男 子 以 此 義 故 應 如 是 知 如 來 一 切 
T11n0314_001:0768c26	諸食皆上妙味。善男子！阿難比丘生憐愍心，	諸 食 皆 上 妙 味 善 男 子 阿 難 比 丘 生 憐 愍 心 
T11n0314_001:0768c27	如來捨轉輪王位，今既食麥。如來知阿難心	如 來 捨 轉輪王位 今 既 食 麥 如 來 知 阿 難 心 
T11n0314_001:0768c28	已，施其一麥，故語阿難言：『汝知是何味？』彼食	已 施 其 一 麥 故 語 阿 難 言 汝 知 是 何 味 彼 食 
T11n0314_001:0768c29	已生奇特異相，語我言：『世尊！我生王家長	已 生 奇 特 異 相 語 我 言 世 尊 我 生 王 家 長 
T11n0314_001:0769a01	養，未曾甞如是上味。』以此上味力故，阿難比	養 未 曾 甞 如 是 上 味 以 此 上 味 力 故 阿 難 比 
T11n0314_001:0769a02	丘七日受上妙快樂，而不復食。善男子！以此	丘 七 日 受 上 妙 快 樂 而 不 復 食 善 男 子 以 此 
T11n0314_001:0769a03	義故，應如是知，如來無有諸業果報。若有	義 故 應 如 是 知 如 來 無 有 諸 業 果 報 若 有 
T11n0314_001:0769a04	眾生淨持諸戒，若沙門及婆羅門，不隨本請	眾 生 淨 持 諸 戒 若 沙 門 及 婆 羅 門 不 隨 本 請 
T11n0314_001:0769a05	奉施者，為彼眾生說不虛故，如來示此業果	奉 施 者 為 彼 眾 生 說 不 虛 故 如 來 示 此 業 果 
T11n0314_001:0769a06	報事。「善男子！汝觀如來諸身等法，是彼婆羅	報 事 善 男 子 汝 觀 如 來 諸 身 等 法 是 彼 婆 羅 
T11n0314_001:0769a07	門請如來而不施設，如來亦說彼令不退轉。	門 請 如 來 而 不 施 設 如 來 亦 說 彼 令 不 退 轉 
T11n0314_001:0769a08	然，善男子！所說彼五百比丘，如來記令不退	然 善 男 子 所 說 彼 五 百 比 丘 如 來 記 令 不 退 
T11n0314_001:0769a09	者。復次，善男子！所有彼五百比丘，共如來夏	者 復 次 善 男 子 所 有 彼 五 百 比 丘 共 如 來 夏 
T11n0314_001:0769a10	坐安居中，有四十比丘，多念於欲結，靜念彼	坐 安 居 中 有 四 十 比 丘 多 念 於 欲 結 靜 念 彼 
T11n0314_001:0769a11	若得美食者，欲想、欲覺便令熾盛，彼以惡食	若 得 美 食 者 欲 想 欲 覺 便 令 熾 盛 彼 以 惡 食 
T11n0314_001:0769a12	因緣故，欲想、欲覺亦微。既微已，彼七日七夜	因 緣 故 欲 想 欲 覺 亦 微 既 微 已 彼 七日七夜 
T11n0314_001:0769a13	得阿羅漢果。「善男子！若能如是解如來所說	得阿羅漢 果 善 男 子 若 能 如 是 解 如 來 所 說 
T11n0314_001:0769a14	語者，彼名為正解。善男子！菩薩摩訶薩成就	語 者 彼 名 為 正 解 善 男 子 菩薩摩訶薩 成 就 
T11n0314_001:0769a15	如是，名為善巧解如來祕密說教。」爾時世尊	如 是 名 為 善 巧 解 如 來 祕 密 說 教 爾 時 世 尊 
T11n0314_001:0769a16	欲重宣此義，而說偈言：	欲 重 宣 此 義 而 說 偈 言 
T11n0314_001:0769a17	「所說漸義教，　　及以頓說者，	 所 說 漸 義 教 及 以 頓 說 者 
T11n0314_001:0769a18	　大智諸菩薩，　　祕密故正解，	 大 智 諸 菩 薩 祕 密 故 正 解 
T11n0314_001:0769a19	　善巧諸密語，　　舍利報說教，	 善 巧 諸 密 語 舍 利 報 說 教 
T11n0314_001:0769a20	　通達正說法，　　諸佛之所說。」	 通 達 正 說 法 諸 佛 之 所 說 
T11n0314_001:0769a21	「善男子！云何菩薩摩訶薩不喜樂聲聞、辟支	 善 男 子 云 何 菩薩摩訶薩 不 喜 樂 聲 聞 辟 支 
T11n0314_001:0769a22	佛乘？善男子！若菩薩摩訶薩，或以地獄苦，餓	佛 乘 善 男 子 若 菩薩摩訶薩 或 以 地 獄 苦 餓 
T11n0314_001:0769a23	鬼、畜生等受諸重惡，而不喜樂求聲聞涅槃。	鬼 畜 生 等 受 諸 重 惡 而 不 喜 樂 求 聲 聞 涅 槃 
T11n0314_001:0769a24	復不念云何得厭離世間心？令速得自在。亦	復 不 念 云 何 得 厭 離 世 間 心 令 速 得 自 在 亦 
T11n0314_001:0769a25	不求少欲、少作等，復不求少欲、少作等行因。	不 求 少 欲 少 作 等 復 不 求 少 欲 少 作 等 行 因 
T11n0314_001:0769a26	彼所見諸眾生修諸善業者，菩薩佐助令成。	彼 所 見 諸 眾 生 修 諸 善 業 者 菩 薩 佐 助 令 成 
T11n0314_001:0769a27	及勸諸眾生讚歎正說正示，向阿耨多羅三	及 勸 諸 眾 生 讚 歎 正 說 正 示 向 阿 耨 多 羅 三 
T11n0314_001:0769a28	藐三菩提。善男子！菩薩摩訶薩成就如是諸	藐 三 菩 提 善 男 子 菩薩摩訶薩 成 就 如 是 諸 
T11n0314_001:0769a29	功德，不喜樂聲聞、辟支佛乘。爾時世尊欲重	功 德 不 喜 樂 聲 聞 辟 支 佛 乘 爾 時 世 尊 欲 重 
T11n0314_001:0769b01	宣此義，而說偈言：	宣 此 義 而 說 偈 言 
T11n0314_001:0769b02	「化眾無疲倦，　　不退於菩提，	 化 眾 無 疲 倦 不 退 於 菩 提 
T11n0314_001:0769b03	　持心如山王，　　行慈心等法。」	 持 心 如 山 王 行 慈 心 等 法 
T11n0314_001:0769b04	爾時淨無垢妙淨寶月王光菩薩白佛言：「世	爾 時 淨 無 垢 妙 淨 寶 月 王 光 菩 薩 白 佛 言 世 
T11n0314_001:0769b05	尊！如來已說諸法，菩薩成就諸法已名為住	尊 如 來 已 說 諸 法 菩 薩 成 就 諸 法 已 名 為 住 
T11n0314_001:0769b06	大乘。然如來不說以何義故，名為大乘？」爾時	大 乘 然 如 來 不 說 以 何 義 故 名 為 大 乘 爾 時 
T11n0314_001:0769b07	世尊告淨無垢妙淨寶月王光菩薩言：「善男	世 尊 告 淨 無 垢 妙 淨 寶 月 王 光 菩 薩 言 善 男 
T11n0314_001:0769b08	子！吾今問汝，隨汝意說。善男子！於汝意云	子 吾 今 問 汝 隨 汝 意 說 善 男 子 於 汝 意 云 
T11n0314_001:0769b09	何？轉輪聖王并四兵眾隨所行者，彼道以何	何 轉輪聖王 并 四 兵 眾 隨 所 行 者 彼 道 以 何 
T11n0314_001:0769b10	說耶？」答曰：「世尊！名曰王道，亦名大道，名無	說 耶 答 曰 世 尊 名 曰 王 道 亦 名 大 道 名 無 
T11n0314_001:0769b11	畏道，名無障礙道，名為寂靜道。」佛言：「善男	畏 道 名 無 障 礙 道 名 為 寂 靜 道 佛 言 善 男 
T11n0314_001:0769b12	子！如來亦爾。隨所乘乘至阿耨多羅三藐三	子 如 來 亦 爾 隨 所 乘 乘 至 阿 耨 多 羅 三 藐 三 
T11n0314_001:0769b13	菩提，彼乘名為大乘，名為上乘，名為妙乘，名	菩 提 彼 乘 名 為 大 乘 名 為 上 乘 名 為 妙 乘 名 
T11n0314_001:0769b14	微妙乘，名曰勝乘，名無上乘，名無惡乘，名無	微 妙 乘 名 曰 勝 乘 名 無 上 乘 名 無 惡 乘 名 無 
T11n0314_001:0769b15	比乘，名無等乘，名無等等乘。善男子！以此義	比 乘 名 無 等 乘 名 無 等 等 乘 善 男 子 以 此 義 
T11n0314_001:0769b16	故名為大乘。」答曰：「善哉！大乘。世尊！善哉！大	故 名 為 大 乘 答 曰 善 哉 大 乘 世 尊 善 哉 大 
T11n0314_001:0769b17	乘。」爾時魔王波旬作如是念：「此沙門瞿曇過	乘 爾 時 魔王波旬 作如是念 此 沙 門 瞿 曇 過 
T11n0314_001:0769b18	吾境界，亦令餘者能過境界。若我集四兵眾	吾 境 界 亦 令 餘 者 能 過 境 界 若 我 集 四 兵 眾 
T11n0314_001:0769b19	共往惱亂，及不說此法故，至沙門瞿曇所。」爾	共 往 惱 亂 及 不 說 此 法 故 至 沙 門 瞿 曇 所 爾 
T11n0314_001:0769b20	時魔王波旬，將領四部兵眾，至王舍大城耆	時 魔王波旬 將 領 四 部 兵 眾 至 王 舍 大 城 耆 
T11n0314_001:0769b21	闍崛山。爾時淨無垢妙淨寶月王光菩薩，遙	闍 崛 山 爾 時 淨 無 垢 妙 淨 寶 月 王 光 菩 薩 遙 
T11n0314_001:0769b22	見魔王波旬將領四部兵眾來，欲為此法令作	見 魔王波旬 將 領 四 部 兵 眾 來 欲 為 此 法 令 作 
T11n0314_001:0769b23	妨故。見已作如是神力——現神力已，魔王波旬	妨 故 見 已 作 如 是 神 力 現 神 力 已 魔王波旬 
T11n0314_001:0769b24	至王舍大城巷衢四道之處，作如是聲：「汝等	至 王 舍 大 城 巷 衢 四 道 之 處 作 如 是 聲 汝 等 
T11n0314_001:0769b25	往至王舍大城。諸仁者！若知是如來在耆闍	往 至 王 舍 大 城 諸 仁 者 若 知 是 如 來 在 耆 闍 
T11n0314_001:0769b26	崛山中，為四部眾說法，初善、中善、後善，其義	崛 山 中 為 四 部 眾 說 法 初 善 中 善 後 善 其 義 
T11n0314_001:0769b27	巧妙，滿足白淨，說行梵行。是故汝等應往如	巧 妙 滿 足 白 淨 說 行 梵 行 是 故 汝 等 應 往 如 
T11n0314_001:0769b28	來所，是以汝等於長夜，而成饒益快樂。」爾時	來 所 是 以 汝 等 於 長 夜 而 成 饒 益 快 樂 爾 時 
T11n0314_001:0769b29	王舍城中諸婆羅門剎利長者居士等，被魔	王 舍 城 中 諸 婆 羅 門 剎 利 長 者 居 士 等 被 魔 
T11n0314_001:0769c01	勸已，持諸香華、塗香、末香、燒香、繒幡、寶蓋、衣	勸 已 持 諸 香 華 塗 香 末 香 燒 香 繒 幡 寶 蓋 衣 
T11n0314_001:0769c02	服等，從王舍大城出已，至耆闍崛山。於如來	服 等 從 王 舍 大 城 出 已 至 耆 闍 崛 山 於 如 來 
T11n0314_001:0769c03	所頭面禮佛，尊重讚歎供養恭敬已，却住一	所 頭 面 禮 佛 尊 重 讚 歎 供養恭敬 已 却 住 一 
T11n0314_001:0769c04	面。魔王波旬及四兵眾，出王舍大城耆闍崛	面 魔王波旬 及 四 兵 眾 出 王 舍 大 城 耆 闍 崛 
T11n0314_001:0769c05	山中，至如來所已，化作天曼陀羅華而散佛	山 中 至 如 來 所 已 化 作 天曼陀羅華 而 散 佛 
T11n0314_001:0769c06	上，散已及四部兵眾却坐一面。爾時淨無垢	上 散 已 及 四 部 兵 眾 却 坐 一 面 爾 時 淨 無 垢 
T11n0314_001:0769c07	妙淨寶月王光菩薩，見魔波旬却坐一面，而	妙 淨 寶 月 王 光 菩 薩 見 魔 波 旬 却 坐 一 面 而 
T11n0314_001:0769c08	告之言：「波旬！汝何故將四兵眾至如來所？」魔	告 之 言 波 旬 汝 何 故 將 四 兵 眾 至 如 來 所 魔 
T11n0314_001:0769c09	言：「吾至此為令滅此法故，及惱亂如來故。」淨	言 吾 至 此 為 令 滅 此 法 故 及 惱 亂 如 來 故 淨 
T11n0314_001:0769c10	無垢妙淨寶月王光菩薩，語魔波旬言：「波旬！	無 垢 妙 淨 寶 月 王 光 菩 薩 語 魔 波 旬 言 波 旬 
T11n0314_001:0769c11	何容煩亂如來，及以此法？汝波旬，於如	何 容 煩 亂 如 來 及 以 此 法 汝 波 旬 於 如 
T11n0314_001:0769c12	來前今可悔過，勿於長夜成無利益苦報。」淨	來 前 今 可 悔 過 勿 於 長 夜 成 無 利 益 苦 報 淨 
T11n0314_001:0769c13	無垢妙淨寶月王光菩薩，所順說法已，魔即	無 垢 妙 淨 寶 月 王 光 菩 薩 所 順 說 法 已 魔 即 
T11n0314_001:0769c14	從坐起偏袒右肩，叉手合掌禮佛足已，於如	從 坐 起 偏袒右肩 叉 手 合 掌 禮 佛 足 已 於 如 
T11n0314_001:0769c15	來前而起悔過：「願世尊受我悔過！我以愚癡、	來 前 而 起 悔 過 願 世 尊 受 我 悔 過 我 以 愚 癡 
T11n0314_001:0769c16	無智慧、不善巧，不能自知，而如來前起惡心，	無 智 慧 不 善 巧 不 能 自 知 而 如 來 前 起 惡 心 
T11n0314_001:0769c17	及欲滅如是等經。善哉，世尊！為我正受悔過	及 欲 滅 如 是 等 經 善 哉 世 尊 為 我 正 受 悔 過 
T11n0314_001:0769c18	等法。」佛語魔王波旬言：「吾法中增長善根，所	等 法 佛 語 魔王波旬 言 吾 法 中 增 長 善 根 所 
T11n0314_001:0769c19	謂若善男子善女人，為欲清淨法故，今能悔	謂 若 善 男 子 善 女 人 為 欲 清 淨 法 故 今 能 悔 
T11n0314_001:0769c20	過。」爾時魔王波旬從坐起已，在佛前立，而白	過 爾 時 魔王波旬 從 坐 起 已 在 佛 前 立 而 白 
T11n0314_001:0769c21	佛言：「世尊！先制一切諸惱惡口等不善業道。」	佛 言 世 尊 先 制 一 切 諸 惱 惡 口 等 不善業道 
T11n0314_001:0769c22	佛語波旬：「如是，如是。」波旬問曰：「如來法主，何	佛 語 波 旬 如 是 如 是 波 旬 問 曰 如 來 法 主 何 
T11n0314_001:0769c23	故以波旬名而喚於我？」佛言：「波旬！吾今說喻。	故 以 波 旬 名 而 喚 於 我 佛 言 波 旬 吾 今 說 喻 
T11n0314_001:0769c24	譬如長者及居士大富，財錢無窮，然彼人唯	譬 如 長 者 及 居 士 大 富 財 錢 無 窮 然 彼 人 唯 
T11n0314_001:0769c25	有一子愛念深重，以彼繼命為活。然彼一子	有 一 子 愛 念 深 重 以 彼 繼 命 為 活 然 彼 一 子 
T11n0314_001:0769c26	不善調伏，心諂曲。彼長者及居士，若手、若杖、	不 善 調 伏 心 諂 曲 彼 長 者 及 居 士 若 手 若 杖 
T11n0314_001:0769c27	若捲等治，或惡言及苦語惡治，為令息彼	若 捲 等 治 或 惡 言 及 苦 語 惡 治 為 令 息 彼 
T11n0314_001:0769c28	惡故。波旬！於汝意云何？是長者居士瞋恨情	惡 故 波 旬 於汝意云何 是 長 者 居 士 瞋 恨 情 
T11n0314_001:0769c29	治彼一子不？」答曰：「世尊！唯為成彼一子故。」	治 彼 一 子 不 答 曰 世 尊 唯 為 成 彼 一 子 故 
T11n0314_001:0770a01	佛言：「如是，波旬！如來亦爾。善知眾生心、心數	佛 言 如 是 波 旬 如 來 亦 爾 善 知 眾 生 心 心 數 
T11n0314_001:0770a02	法，以苦惱語調伏者，為說苦惱語；應以壇	法 以 苦 惱 語 調 伏 者 為 說 苦 惱 語 應 以 壇 
T11n0314_001:0770a03	治者，即以壇治；應以攝取者，即說攝取言；	治 者 即 以 壇 治 應 以 攝 取 者 即 說 攝 取 言 
T11n0314_001:0770a04	應以色身度者，即以色身度之；應以聲、香、味、	應 以 色 身 度 者 即 以 色 身 度 之 應 以 聲 香 味 
T11n0314_001:0770a05	觸、法等度者，即乃至法等度之。」爾時魔王波	觸 法 等 度 者 即 乃 至 法 等 度 之 爾 時 魔 王 波 
T11n0314_001:0770a06	旬，從佛聞此法歡喜踊躍，復更禮佛足。禮已，	旬 從 佛 聞 此 法 歡喜踊躍 復 更 禮 佛 足 禮 已 
T11n0314_001:0770a07	白佛言：「世尊！若有村邑聚落中說是法者，我	白 佛 言 世 尊 若 有 村 邑 聚 落 中 說 是 法 者 我 
T11n0314_001:0770a08	為聽此法故，往至彼處及護此經，亦念益法	為 聽 此 法 故 往 至 彼 處 及 護 此 經 亦 念 益 法 
T11n0314_001:0770a09	師故，是中多有如是瑞相。眾則寂定，離調戲、	師 故 是 中 多 有 如 是 瑞 相 眾 則 寂 定 離 調 戲 
T11n0314_001:0770a10	懈怠等，得上勝聽法之者，若讀、若誦、若受持、	懈 怠 等 得 上 勝 聽 法 之 者 若 讀 若 誦 若 受 持 
T11n0314_001:0770a11	若解說，身不生疲倦，心不起厭足，隨所說此	若 解 說 身 不 生 疲 倦 心 不 起 厭 足 隨 所 說 此 
T11n0314_001:0770a12	法，若聽或為他廣說，如是彼轉生歡喜踊躍	法 若 聽 或 為 他 廣 說 如 是 彼 轉 生 歡喜踊躍 
T11n0314_001:0770a13	心。」爾時彼眾中有諸外道尼乾子等，彼見聞	心 爾 時 彼 眾 中 有 諸 外 道 尼 乾 子 等 彼 見 聞 
T11n0314_001:0770a14	此魔王所說語已，於如來所即生歡喜踊躍	此 魔 王 所 說 語 已 於 如 來 所 即 生 歡喜踊躍 
T11n0314_001:0770a15	之心。爾時尊者阿難白佛言：「世尊！何因何	之 心 爾 時 尊 者 阿 難 白 佛 言 世 尊 何 因 何 
T11n0314_001:0770a16	緣故，此諸外道聞說此法而得證忍？」佛語阿	緣 故 此 諸 外 道 聞 說 此 法 而 得 證 忍 佛 語 阿 
T11n0314_001:0770a17	難：「過去此王舍城耆闍崛山中，有佛——名曰善	難 過 去 此 王 舍 城 耆 闍 崛 山 中 有 佛 名 曰 善 
T11n0314_001:0770a18	勝調伏多陀阿伽度、阿羅訶、三藐三佛陀——說	勝 調 伏 多 陀 阿 伽 度 阿 羅 訶 三藐三佛陀 說 
T11n0314_001:0770a19	法。彼佛說法已，有諸外道為惱故來。彼至已，	法 彼 佛 說 法 已 有 諸 外 道 為 惱 故 來 彼 至 已 
T11n0314_001:0770a20	聞此法，即唱『善哉！』而於佛所不生敬重心。彼	聞 此 法 即 唱 善 哉 而 於 佛 所 不生敬重 心 彼 
T11n0314_001:0770a21	諸外道以此因緣力故，六萬劫不生地獄、餓	諸 外 道 以 此 因 緣 力 故 六 萬 劫 不 生 地 獄 餓 
T11n0314_001:0770a22	鬼、畜生之中，唯生人、天之處。彼諸外道以不	鬼 畜 生 之 中 唯 生 人 天 之 處 彼 諸 外 道 以 不 
T11n0314_001:0770a23	敬如來故，所生之處不值善知識。阿難！於汝	敬 如 來 故 所 生 之 處 不 值 善 知 識 阿 難 於 汝 
T11n0314_001:0770a24	意云何？爾時彼諸外道等豈異人乎？阿難！汝	意 云 何 爾 時 彼 諸 外 道 等 豈 異 人 乎 阿 難 汝 
T11n0314_001:0770a25	不應異意取。何以故？善男子！此諸外道尼乾	不 應 異 意 取 何 以 故 善 男 子 此 諸 外 道 尼 乾 
T11n0314_001:0770a26	子等。阿難！今此諸外道於如來所，生歡喜恭	子 等 阿 難 今 此 諸 外 道 於 如 來 所 生 歡 喜 恭 
