T11n0314_001:0770a27	敬踊躍心。以此因故，如來今記，得阿耨多羅	敬 踊 躍 心 以 此 因 故 如 來 今 記 得 阿 耨 多 羅 
T11n0314_001:0770a28	三藐三菩提。」爾時彼諸外道尼乾子等，聞受	三藐三菩提 爾 時 彼 諸 外 道 尼 乾 子 等 聞 受 
T11n0314_001:0770a29	記已，心大踊躍，即得無生法忍。說此法時萬	記 已 心 大 踊 躍 即 得無生法忍 說 此 法 時 萬 
T11n0314_001:0770b01	二千人遠塵離垢，得法眼淨。二萬眾生未曾	二 千 人 遠塵離垢 得法眼淨 二 萬 眾 生 未 曾 
T11n0314_001:0770b02	發阿耨多羅三藐三菩提心，而發道意。爾時	發 阿耨多羅三藐三菩提 心 而 發 道 意 爾 時 
T11n0314_001:0770b03	尊者阿難白佛言：「世尊！若有善男子、善女人，	尊 者 阿 難 白 佛 言 世 尊 若 有 善 男 子 善 女 人 
T11n0314_001:0770b04	聞此法讀誦、受持、廣為人說，得幾福德？」佛言：	聞 此 法 讀 誦 受 持 廣 為 人 說 得 幾 福 德 佛 言 
T11n0314_001:0770b05	「若善男子、善女人，一切無餘眾生界，令安阿	 若 善 男 子 善 女 人 一 切 無 餘 眾 生 界 令 安 阿 
T11n0314_001:0770b06	耨多羅三藐三菩提者。若復善男子、善女人，	耨 多 羅 三藐三菩提 者 若 復 善 男 子 善 女 人 
T11n0314_001:0770b07	讀誦、受持及廣為人說此經，是人倍得福德。	讀 誦 受 持 及 廣 為 人 說 此 經 是 人 倍 得 福 德 
T11n0314_001:0770b08	何以故？阿難！此法能令得阿耨多羅三藐三	何 以 故 阿 難 此 法 能 令 得 阿 耨 多 羅 三 藐 三 
T11n0314_001:0770b09	菩提、一切種智。」「世尊！若善男子、善女人，於此	菩 提 一切種智 世 尊 若 善 男 子 善 女 人 於 此 
T11n0314_001:0770b10	法及法師起惡心。世尊！彼善男子、善女人，得	法 及 法 師 起 惡 心 世 尊 彼 善 男 子 善 女 人 得 
T11n0314_001:0770b11	幾不饒益？」佛言：「善男子！若善男子、善女人，挑	幾 不 饒 益 佛 言 善 男 子 若 善 男 子 善 女 人 挑 
T11n0314_001:0770b12	拔一切眾生目，若復有人於此法及法師起	拔 一 切 眾 生 目 若 復 有 人 於 此 法 及 法 師 起 
T11n0314_001:0770b13	惡心，是人因此事得惡，復倍於前。何以故？	惡 心 是 人 因 此 事 得 惡 復 倍 於 前 何 以 故 
T11n0314_001:0770b14	阿難！此法於一切眾生能作光明。」阿難白佛	阿 難 此 法 於 一 切 眾 生 能 作 光 明 阿 難 白 佛 
T11n0314_001:0770b15	言：「世尊！此法不應不信心善男子、善女人前	言 世 尊 此 法 不 應 不 信 心 善 男 子 善 女 人 前 
T11n0314_001:0770b16	說。何以故？世尊！應護後世諸眾生故，勿說此	說 何 以 故 世 尊 應 護 後 世 諸 眾 生 故 勿 說 此 
T11n0314_001:0770b17	法，謗法業報故墮諸地獄中。」佛語阿難：「應說	法 謗 法 業 報 故 墮 諸 地 獄 中 佛 語 阿 難 應 說 
T11n0314_001:0770b18	此法。何以故？彼諸眾生於阿耨多羅三藐三	此 法 何 以 故 彼 諸 眾 生 於 阿 耨 多 羅 三 藐 三 
T11n0314_001:0770b19	菩提，即以此為因。」阿難白佛言：「世尊！此經以	菩 提 即 以 此 為 因 阿 難 白 佛 言 世 尊 此 經 以 
T11n0314_001:0770b20	何名？云何受持？」佛語阿難：「此經名為『十法』，如	何 名 云 何 受 持 佛 語 阿 難 此 經 名 為 十 法 如 
T11n0314_001:0770b21	是受持；『淨無垢妙淨寶月王光菩薩所問』，如	是 受 持 淨 無 垢 妙 淨 寶 月 王 光 菩 薩 所 問 如 
T11n0314_001:0770b22	是受持。」如來說此法時，尊者阿難及淨無垢	是 受 持 如 來 說 此 法 時 尊 者 阿 難 及 淨 無 垢 
T11n0314_001:0770b23	妙淨寶月王光菩薩，并諸菩薩眾、比丘眾，及	妙 淨 寶 月 王 光 菩 薩 并 諸 菩 薩 眾 比 丘 眾 及 
T11n0314_001:0770b24	諸天、人、龍王、阿修羅、迦樓羅、緊那羅、摩睺羅伽	諸 天 人 龍 王 阿 修 羅 迦 樓 羅 緊 那 羅 摩睺羅伽 
T11n0314_001:0770b25	等，聞佛所說，歡喜奉行。	等 聞 佛 所 說 歡 喜 奉 行 
T11n0314_001:0770b26	佛說大乘十法經	佛 說 大 乘 十 法 經 
