T11n0314_001:0766a22	義故，菩薩名為樂著諸法。」爾時世尊欲重宣	義 故 菩 薩 名 為 樂 著 諸 法 爾 時 世 尊 欲 重 宣 
T11n0314_001:0766a23	此義，而說偈言：	此 義 而 說 偈 言 
T11n0314_001:0766a24	「大智樂諸法，　　而成諸佛子，	 大 智 樂 諸 法 而 成 諸 佛 子 
T11n0314_001:0766a25	　親近正妙法，　　而不生疲倦。	 親 近 正 妙 法 而 不 生 疲 倦 
T11n0314_001:0766a26	　敬心求正法，　　諸深心佛子，	 敬 心 求 正 法 諸 深 心 佛 子 
T11n0314_001:0766a27	　及以心憶持，　　亦顯正妙行。」	 及 以 心 憶 持 亦 顯 正 妙 行 
T11n0314_001:0766a28	「善男子！云何菩薩摩訶薩正觀諸法？善男子！	 善 男 子 云 何 菩薩摩訶薩 正 觀 諸 法 善 男 子 
T11n0314_001:0766a29	若菩薩作如是觀：『一切諸法猶如幻，迷惑凡	若 菩 薩 作 如 是 觀 一切諸法 猶 如 幻 迷 惑 凡 
T11n0314_001:0766b01	夫故；一切諸法如夢，不實故；一切諸法如水	夫 故 一切諸法 如 夢 不 實 故 一切諸法 如 水 
T11n0314_001:0766b02	中月，非事故；一切諸法如響，非眾生故；一切	中 月 非 事 故 一切諸法 如 響 非 眾 生 故 一 切 
T11n0314_001:0766b03	諸法如影，計妄想故；一切諸法如響聲，生滅	諸 法 如 影 計 妄 想 故 一切諸法 如 響 聲 生 滅 
T11n0314_001:0766b04	壞故。一切諸法生滅壞，緣假成故；一切諸法	壞 故 一切諸法 生 滅 壞 緣 假 成 故 一切諸法 
T11n0314_001:0766b05	本不生不移，同真如體故；一切諸法不滅，本	本 不 生 不 移 同 真 如 體 故 一切諸法 不 滅 本 
T11n0314_001:0766b06	不生故；一切諸法無作，無作者故；一切諸法	不 生 故 一切諸法 無 作 無 作 者 故 一切諸法 
T11n0314_001:0766b07	如虛空，不可染故；一切諸法定寂滅，性不染	如 虛 空 不 可 染 故 一切諸法 定 寂 滅 性 不 染 
T11n0314_001:0766b08	故；一切諸法無垢，離一切諸垢故；一切諸法	故 一切諸法 無 垢 離 一 切 諸 垢 故 一切諸法 
T11n0314_001:0766b09	性滅，離煩惱故。一切諸法非色，不可見故；一	性 滅 離 煩 惱 故 一切諸法 非 色 不 可 見 故 一 
T11n0314_001:0766b10	切諸法離心境界，無體性故；一切諸法不住，	切 諸 法 離 心 境 界 無 體 性 故 一切諸法 不 住 
T11n0314_001:0766b11	滅諸毒故；一切諸法不可求，滅愛憎等心故；	滅 諸 毒 故 一切諸法 不 可 求 滅 愛 憎 等 心 故 
T11n0314_001:0766b12	一切諸法無著，離煩惱境界故。一切諸法如	一切諸法 無 著 離 煩 惱 境 界 故 一切諸法 如 
T11n0314_001:0766b13	毒蛇，離善巧方便故；一切諸法如芭蕉，無堅	毒 蛇 離 善巧方便 故 一切諸法 如 芭 蕉 無 堅 
T11n0314_001:0766b14	實故；一切諸法如水沫，體性弱故。』善男子！菩	實 故 一切諸法 如 水 沫 體 性 弱 故 善 男 子 菩 
T11n0314_001:0766b15	薩如是觀名為正觀諸法。」	薩 如 是 觀 名 為 正 觀 諸 法 
T11n0314_001:0766b16	爾時世尊，欲重宣此義，而說偈言：	爾 時 世 尊 欲 重 宣 此 義 而 說 偈 言 
T11n0314_001:0766b17	「一切法如幻，　　迷惑愚迷者，	 一切法如 幻 迷 惑 愚 迷 者 
T11n0314_001:0766b18	　虛危猶如夢，　　汝等如是持。	 虛 危 猶 如 夢 汝 等 如 是 持 
T11n0314_001:0766b19	　法如水中月，　　亦如響等事，	 法 如水中月 亦 如 響 等 事 
T11n0314_001:0766b20	　復如影像等，　　智者諸不覺。」	 復 如 影 像 等 智 者 諸 不 覺 
T11n0314_001:0766b21	「善男子！云何菩薩摩訶薩行法順法等。善男	 善 男 子 云 何 菩薩摩訶薩 行 法 順 法 等 善 男 
T11n0314_001:0766b22	子！若菩薩摩訶薩，觀色無常而不厭離色。欲	子 若 菩薩摩訶薩 觀 色 無 常 而 不 厭 離 色 欲 
T11n0314_001:0766b23	證於法已，正智助法界，同用等法善自觀入，	證 於 法 已 正 智 助 法 界 同 用 等 法 善 自 觀 入 
T11n0314_001:0766b24	善持彼者諸相，善思善記。彼記此相，善持、善	善 持 彼 者 諸 相 善 思 善 記 彼 記 此 相 善 持 善 
T11n0314_001:0766b25	修、善記已，自然行法界等行，受、想、行、識亦觀	修 善 記 已 自 然 行 法 界 等 行 受 想 行 識 亦 觀 
T11n0314_001:0766b26	無常，然不厭離識等之。入法界已，正智助同。	無 常 然 不 厭 離 識 等 之 入 法 界 已 正 智 助 同 
T11n0314_001:0766b27	法界等法善自觀達，亦記彼相，善持、善修、善	法 界 等 法 善 自 觀 達 亦 記 彼 相 善 持 善 修 善 
T11n0314_001:0766b28	記已，自然入法界等行，如無常，苦、空、無我亦	記 已 自 然 入 法 界 等 行 如 無 常 苦 空 無 我 亦 
T11n0314_001:0766b29	爾。彼觀色無常已，於色中不生恐怖驚等。何	爾 彼 觀 色 無 常 已 於 色 中 不 生 恐 怖 驚 等 何 
T11n0314_001:0766c01	以故？色是妄想顛倒所起，然彼如實知。觀受、	以 故 色 是 妄 想 顛 倒 所 起 然 彼 如 實 知 觀 受 
T11n0314_001:0766c02	想、行、識無常，乃至於識中，不恐不怖不驚。何	想 行 識 無 常 乃 至 於 識 中 不 恐 不 怖 不 驚 何 
T11n0314_001:0766c03	以故？識者妄想顛倒所起故，然彼如實知。善	以 故 識 者 妄 想 顛 倒 所 起 故 然 彼 如 實 知 善 
T11n0314_001:0766c04	男子！譬如善巧幻師或幻師弟子，化作種種	男 子 譬 如 善 巧 幻 師 或 幻 師 弟 子 化 作 種 種 
T11n0314_001:0766c05	幻事，象兵、馬兵、車兵、步兵。彼智者見已，不生	幻 事 象 兵 馬 兵 車 兵 步 兵 彼 智 者 見 已 不 生 
T11n0314_001:0766c06	恐怖驚等。何以故？彼如實知是幻師所作不	恐 怖 驚 等 何 以 故 彼 如 實 知 是 幻 師 所 作 不 
T11n0314_001:0766c07	實，未曾有虛誑作。菩薩亦如是，觀色無常	實 未 曾 有 虛 誑 作 菩 薩 亦 如 是 觀 色 無 常 
T11n0314_001:0766c08	已，於色中不生恐怖驚等。何以故？色是妄想	已 於 色 中 不 生 恐 怖 驚 等 何 以 故 色 是 妄 想 
T11n0314_001:0766c09	顛倒所起，然彼如實知，觀受、想、行、識無常已，	顛 倒 所 起 然 彼 如 實 知 觀 受 想 行 識 無 常 已 
T11n0314_001:0766c10	乃至於識中不生恐怖驚等。何以故？識者妄	乃 至 於 識 中 不 生 恐 怖 驚 等 何 以 故 識 者 妄 
T11n0314_001:0766c11	想顛倒所起故，然彼如實知。」爾時淨無垢妙	想 顛 倒 所 起 故 然 彼 如 實 知 爾 時 淨 無 垢 妙 
T11n0314_001:0766c12	淨寶月王光菩薩白佛言：「世尊！云何菩薩觀	淨 寶 月 王 光 菩 薩 白 佛 言 世 尊 云 何 菩 薩 觀 
T11n0314_001:0766c13	諸色無常，然不厭離色？而證法界已，正智觀	諸 色 無 常 然 不 厭 離 色 而 證 法 界 已 正 智 觀 
T11n0314_001:0766c14	入助法界等法。」爾時世尊告淨無垢妙淨寶	入 助 法 界 等 法 爾 時 世 尊 告 淨 無 垢 妙 淨 寶 
T11n0314_001:0766c15	月王光菩薩言：「善男子！吾當為汝分別說喻。	月 王 光 菩 薩 言 善 男 子 吾 當 為 汝 分 別 說 喻 
T11n0314_001:0766c16	善男子！譬如有智男子，常事諸毒，善持、善覆、	善 男 子 譬 如 有 智 男 子 常 事 諸 毒 善 持 善 覆 
T11n0314_001:0766c17	善惜，起我相已，種種莊嚴具貿易，然是不食	善 惜 起 我 相 已 種 種 莊 嚴 具 貿 易 然 是 不 食 
T11n0314_001:0766c18	彼毒，勿令我因此事斷其正命。菩薩亦如是，	彼 毒 勿 令 我 因 此 事 斷 其 正 命 菩 薩 亦 如 是 
T11n0314_001:0766c19	向涅槃心，潤向涅槃，順向涅槃，近取涅槃。然	向 涅 槃 心 潤 向 涅 槃 順 向 涅 槃 近 取 涅 槃 然 
T11n0314_001:0766c20	不證彼涅槃。何以故？勿令我因於此事退菩	不 證 彼 涅 槃 何 以 故 勿 令 我 因 於 此 事 退 菩 
T11n0314_001:0766c21	提行。「善男子！譬如有人事其火神，然彼人日	提 行 善 男 子 譬 如 有 人 事 其 火 神 然 彼 人 日 
T11n0314_001:0766c22	夜香華等供養恭敬尊重讚歎親侍，然彼人	夜 香 華 等 供養恭敬 尊 重 讚 歎 親 侍 然 彼 人 
T11n0314_001:0766c23	不作是念：『我以事火供養、恭敬、尊重、讚歎，親	不 作 是 念 我 以 事 火 供 養 恭 敬 尊 重 讚 歎 親 
T11n0314_001:0766c24	近已，我以二手接取之。何以故？勿令我因此	近 已 我 以 二 手 接 取 之 何 以 故 勿 令 我 因 此 
T11n0314_001:0766c25	事於身有苦，於心有惱。』菩薩如是，向涅槃心，	事 於 身 有 苦 於 心 有 惱 菩 薩 如 是 向 涅 槃 心 
T11n0314_001:0766c26	潤向涅槃，順向涅槃，及取涅槃，然彼不證	潤 向 涅 槃 順 向 涅 槃 及 取 涅 槃 然 彼 不 證 
T11n0314_001:0766c27	涅槃。何以故？勿令我因此事退菩提行。」爾時	涅 槃 何 以 故 勿 令 我 因 此 事 退 菩 提 行 爾 時 
T11n0314_001:0766c28	淨無垢妙淨寶月王光菩薩白佛言：「世尊！如	淨 無 垢 妙 淨 寶 月 王 光 菩 薩 白 佛 言 世 尊 如 
T11n0314_001:0766c29	我知世尊所說意趣，菩薩者應住世間。」佛言：	我 知 世 尊 所 說 意 趣 菩 薩 者 應 住 世 間 佛 言 
T11n0314_001:0767a01	「如是，如是！善男子！菩薩應住世間。」問曰：「世尊！	 如 是 如 是 善 男 子 菩 薩 應 住 世 間 問 曰 世 尊 
T11n0314_001:0767a02	云何菩薩住世間，而不以世間諸患所染？」佛	云 何 菩 薩 住 世 間 而 不 以 世 間 諸 患 所 染 佛 
T11n0314_001:0767a03	言：「善男子！為此事故略說一喻。善男子！譬如	言 善 男 子 為 此 事 故 略 說 一 喻 善 男 子 譬 如 
T11n0314_001:0767a04	呪術之人，以大呪術力故，諸惡毒蝄蛇等	呪 術 之 人 以 大 呪 術 力 故 諸 惡 毒 蝄 蛇 等 
T11n0314_001:0767a05	弄戲，然彼人不以此事斷其命根。何以故？以	弄 戲 然 彼 人 不 以 此 事 斷 其 命 根 何 以 故 以 
T11n0314_001:0767a06	彼人善通達呪術力故。菩薩亦如是，行世間	彼 人 善 通 達 呪 術 力 故 菩 薩 亦 如 是 行 世 間 
T11n0314_001:0767a07	住世間，住世間已，大智方便呪力故，共諸煩	住 世 間 住 世 間 已 大 智 方 便 呪 力 故 共 諸 煩 
T11n0314_001:0767a08	惱毒蛇而居戲暴，亦弄行住坐臥。菩薩不以	惱 毒 蛇 而 居 戲 暴 亦 弄 行住坐臥 菩 薩 不 以 
T11n0314_001:0767a09	此事故，於菩提而有退還。何以故？彼成就大	此 事 故 於 菩 提 而 有 退 還 何 以 故 彼 成 就 大 
T11n0314_001:0767a10	智方便呪力故。」爾時淨無垢妙淨寶月王光	智 方 便 呪 力 故 爾 時 淨 無 垢 妙 淨 寶 月 王 光 
T11n0314_001:0767a11	菩薩言：「世尊！希有，希有！彼諸菩薩而能不證	菩 薩 言 世 尊 希 有 希 有 彼 諸 菩 薩 而 能 不 證 
T11n0314_001:0767a12	涅槃，復不以世間煩惱毒之所染。世尊！我今	涅 槃 復 不 以 世 間 煩 惱 毒 之 所 染 世 尊 我 今 
T11n0314_001:0767a13	歸依諸大菩薩。世尊！是諸眾生成就諸善根，	歸 依 諸 大 菩 薩 世 尊 是 諸 眾 生 成 就 諸 善 根 
T11n0314_001:0767a14	聞此法已，而生一歡喜心。世尊！彼善男子、善	聞 此 法 已 而 生 一 歡 喜 心 世 尊 彼 善 男 子 善 
T11n0314_001:0767a15	女人，諸佛已記：『若能聞此法門。』」佛言：「善男子！」	女 人 諸 佛 已 記 若 能 聞 此 法 門 佛 言 善 男 子 
T11n0314_001:0767a16	說此法時，五百比丘未證無漏而得解脫。彼	說 此 法 時 五 百 比 丘 未 證 無 漏 而 得 解 脫 彼 
T11n0314_001:0767a17	得解脫已，即從坐起，偏袒右肩，右膝著地，合	得 解 脫 已 即 從 坐 起 偏袒右肩 右膝著地 合 
T11n0314_001:0767a18	掌向佛，白佛言：「世尊！諸菩薩者，可敬可禮	掌 向 佛 白 佛 言 世 尊 諸 菩 薩 者 可 敬 可 禮 
T11n0314_001:0767a19	拜。」佛語諸比丘：「如是，如是！如汝所說。」爾時世	拜 佛 語 諸 比 丘 如 是 如 是 如 汝 所 說 爾 時 世 
T11n0314_001:0767a20	尊欲重宣此義，而說偈言：	尊 欲 重 宣 此 義 而 說 偈 言 
T11n0314_001:0767a21	「敬禮諸大智，　　敬禮得無畏，	 敬 禮 諸 大 智 敬 禮 得 無 畏 
T11n0314_001:0767a22	　敬禮淨諸目，　　敬禮親佛子。	 敬 禮 淨 諸 目 敬 禮 親 佛 子 
T11n0314_001:0767a23	　方便善巧故，　　及以勝妙智，	 方便善巧 故 及 以 勝 妙 智 
T11n0314_001:0767a24	　菩薩大名稱，　　能過二乘地。	 菩 薩 大 名 稱 能 過 二 乘 地 
T11n0314_001:0767a25	　如實知諸陰，　　謂生滅識等，	 如 實 知 諸 陰 謂 生 滅 識 等 
T11n0314_001:0767a26	　見世間渴仰，　　故不證涅槃。」	 見 世 間 渴 仰 故 不 證 涅 槃 
T11n0314_001:0767a27	「善男子！云何菩薩摩訶薩離慢及增上慢等？	 善 男 子 云 何 菩薩摩訶薩 離 慢 及 增 上 慢 等 
T11n0314_001:0767a28	善男子！慢者，我自亦可，若家、若姓、若色，或復	善 男 子 慢 者 我 自 亦 可 若 家 若 姓 若 色 或 復 
T11n0314_001:0767a29	異事，金銀等資用，象兵、馬兵、步兵、車兵，如是	異 事 金 銀 等 資 用 象 兵 馬 兵 步 兵 車 兵 如 是 
T11n0314_001:0767b01	心所有高下者名曰慢。我慢者，生我身高想，	心 所 有 高 下 者 名 曰 慢 我 慢 者 生 我 身 高 想 
T11n0314_001:0767b02	若家、若姓、若色等，或金銀、財物、倉庫，象兵、馬	若 家 若 姓 若 色 等 或 金 銀 財 物 倉 庫 象 兵 馬 
T11n0314_001:0767b03	兵、步兵、車兵，如是心喜高意，不下諸他者，名	兵 步 兵 車 兵 如 是 心 喜 高 意 不 下 諸 他 者 名 
T11n0314_001:0767b04	曰增上慢。菩薩捨如是等法，名曰離慢及增	曰 增 上 慢 菩 薩 捨 如 是 等 法 名 曰 離 慢 及 增 
T11n0314_001:0767b05	上慢。」爾時世尊，欲重宣此義而說偈言：	上 慢 爾 時 世 尊 欲 重 宣 此 義 而 說 偈 言 
T11n0314_001:0767b06	「離慢增上慢，　　常以慈心念，	 離 慢 增 上 慢 常 以 慈 心 念 
T11n0314_001:0767b07	　及常懷悲心，　　恒怖世間中，	 及 常 懷 悲 心 恒 怖 世 間 中 
T11n0314_001:0767b08	　常以行乞食，　　善說人天益。」	 常 以 行 乞 食 善 說 人 天 益 
T11n0314_001:0767b09	「善男子！云何菩薩摩訶薩善巧祕密語？善男	 善 男 子 云 何 菩薩摩訶薩 善 巧 祕 密 語 善 男 
T11n0314_001:0767b10	子！若菩薩摩訶薩，如來所說諸甚深經中祕	子 若 菩薩摩訶薩 如 來 所 說 諸 甚 深 經 中 祕 
T11n0314_001:0767b11	密之教，彼不隨說取何者是祕密之教。如來	密 之 教 彼 不 隨 說 取 何 者 是 祕 密 之 教 如 來 
T11n0314_001:0767b12	記諸聲聞，於阿耨多羅三藐三菩提者，非如	記 諸 聲 聞 於 阿耨多羅三藐三菩提 者 非 如 
T11n0314_001:0767b13	所說。」佛語阿難：「吾患背痛不隨說取，退老患	所 說 佛 語 阿 難 吾 患 背 痛 不 隨 說 取 退 老 患 
T11n0314_001:0767b14	朽敗為我訪覓，侍者不隨說而取，汝目連往	朽 敗 為 我 訪 覓 侍 者 不 隨 說 而 取 汝 目 連 往 
T11n0314_001:0767b15	至耆婆醫王所，取諸妙藥，不應如說取。如來	至 耆 婆 醫 王 所 取 諸 妙 藥 不 應 如 說 取 如 來 
T11n0314_001:0767b16	共諸外道尼揵子等，諍其諸伎，不應如說	共 諸 外 道 尼 揵 子 等 諍 其 諸 伎 不 應 如 說 
T11n0314_001:0767b17	取。如來佉陀羅刺刺足者，是事不應如說而	取 如 來 佉 陀 羅 刺 刺 足 者 是 事 不 應 如 說 而 
T11n0314_001:0767b18	取，提婆達多是如來久遠害者怨家，不應隨	取 提 婆 達 多 是 如 來 久 遠 害 者 怨 家 不 應 隨 
T11n0314_001:0767b19	說而取。如來入舍梨耶婆羅門村，空鉢而出，	說 而 取 如 來 入 舍 梨 耶 婆 羅 門 村 空 鉢 而 出 
T11n0314_001:0767b20	不應如說而取。旃遮及孫陀利謗佛者，不應	不 應 如 說 而 取 旃 遮 及 孫 陀 利 謗 佛 者 不 應 
T11n0314_001:0767b21	隨說而取。須那國毘羅若婆羅門，請佛至已	隨 說 而 取 須 那 國 毘 羅 若 婆 羅 門 請 佛 至 已 
T11n0314_001:0767b22	食麥，亦不應如說而取。」爾時淨無垢妙淨寶	食 麥 亦 不 應 如 說 而 取 爾 時 淨 無 垢 妙 淨 寶 
T11n0314_001:0767b23	月王光菩薩白佛言：「世尊！世尊云何記諸聲	月 王 光 菩 薩 白 佛 言 世 尊 世 尊 云 何 記 諸 聲 
T11n0314_001:0767b24	聞當得阿耨多羅三藐三菩提？」佛言：「善男子！	聞 當 得阿耨多羅三藐三菩提 佛 言 善 男 子 
T11n0314_001:0767b25	吾記諸聲聞得無上正真正道者，以有性故。」	吾 記 諸 聲 聞 得 無 上 正 真 正 道 者 以 有 性 故 
T11n0314_001:0767b26	淨無垢妙淨寶月王光菩薩白佛言：「世尊！云	淨 無 垢 妙 淨 寶 月 王 光 菩 薩 白 佛 言 世 尊 云 
T11n0314_001:0767b27	何諸無漏聲聞斷諸有習煩惱，設有性而成	何 諸 無 漏 聲 聞 斷 諸 有 習 煩 惱 設 有 性 而 成 
T11n0314_001:0767b28	阿耨多羅三藐三菩提？」佛言：「善男子！吾今說	阿耨多羅三藐三菩提 佛 言 善 男 子 吾 今 說 
T11n0314_001:0767b29	喻。譬如灌頂轉輪聖王有子，彼欲學一切技	喻 譬 如 灌 頂 轉輪聖王 有 子 彼 欲 學 一 切 技 
T11n0314_001:0767c01	藝等事，然是中根復非利根，彼應後學是先	藝 等 事 然 是 中 根 復 非 利 根 彼 應 後 學 是 先 
T11n0314_001:0767c02	學，應前學彼後學。善男子！於汝意云何？彼	學 應 前 學 彼 後 學 善 男 子 於汝意云何 彼 
T11n0314_001:0767c03	以此事故，可說非王子也？」答曰：「不也！世尊！是	以 此 事 故 可 說 非 王 子 也 答 曰 不 也 世 尊 是 
T11n0314_001:0767c04	善王子。」「善男子！菩薩亦爾，已成就中根性故	善 王 子 善 男 子 菩 薩 亦 爾 已 成 就 中 根 性 故 
T11n0314_001:0767c05	修道門，先除諸煩惱障，後成阿耨多羅三藐	修 道 門 先 除 諸 煩 惱 障 後 成 阿 耨 多 羅 三 藐 
T11n0314_001:0767c06	三菩提。」「善男子！於汝意云何？彼以此事故可	三 菩 提 善 男 子 於汝意云何 彼 以 此 事 故 可 
T11n0314_001:0767c07	說不成正覺？」答曰：「世尊！我不見有眾生若天、	說 不 成 正 覺 答 曰 世 尊 我 不 見 有 眾 生 若 天 
T11n0314_001:0767c08	若魔、若梵、若沙門、若婆羅門、人、天、阿修羅眾中	若 魔 若 梵 若 沙 門 若 婆 羅 門 人 天 阿 修 羅 眾 中 
T11n0314_001:0767c09	說言不成正覺者，除一闡提。」佛言：「善男子！復	說 言 不 成 正 覺 者 除 一 闡 提 佛 言 善 男 子 復 
T11n0314_001:0767c10	聽一喻。善男子！十地菩薩為斷諸煩惱坐於	聽 一 喻 善 男 子 十地菩薩 為 斷 諸 煩 惱 坐 於 
T11n0314_001:0767c11	道場？為不斷？」答曰：「世尊！以斷故。」「善男子！於	道 場 為 不 斷 答 曰 世 尊 以 斷 故 善 男 子 於 
T11n0314_001:0767c12	汝意云何？彼以此，豈不成正覺？」答曰：「世尊！此	汝意云何 彼 以 此 豈 不 成 正 覺 答 曰 世 尊 此 
T11n0314_001:0767c13	名為成。」佛言：「善男子！此亦如是。」淨無垢妙淨	名 為 成 佛 言 善 男 子 此 亦 如 是 淨 無 垢 妙 淨 
T11n0314_001:0767c14	寶月王光菩薩白佛言：「世尊！云何告阿難比	寶 月 王 光 菩 薩 白 佛 言 世 尊 云 何 告 阿 難 比 
T11n0314_001:0767c15	丘：『吾患背痛。』？」佛言：「善男子！吾愍念後世眾生	丘 吾 患 背 痛 佛 言 善 男 子 吾 愍 念 後 世 眾 生 
T11n0314_001:0767c16	故說此言。金剛身諸佛尚患背痛，況其餘者？	故 說 此 言 金 剛 身 諸 佛 尚 患 背 痛 況 其 餘 者 
T11n0314_001:0767c17	然彼愚癡眾生隨教而取，彼既自壞，亦壞於	然 彼 愚 癡 眾 生 隨 教 而 取 彼 既 自 壞 亦 壞 於 
T11n0314_001:0767c18	他。『吾朽敗老退患，為我訪覓侍者。』善男子！我	他 吾 朽 敗 老 退 患 為 我 訪 覓 侍 者 善 男 子 我 
T11n0314_001:0767c19	此言亦為後世所說，於我滅後，後世無弟子，	此 言 亦 為 後 世 所 說 於 我 滅 後 後 世 無 弟 子 
T11n0314_001:0767c20	故說沙門、婆羅門朽敗老退患者，如是以侍	故 說 沙 門 婆 羅 門 朽 敗 老 退 患 者 如 是 以 侍 
T11n0314_001:0767c21	者所加身故，彼以佛聽故不生之意，為此故	者 所 加 身 故 彼 以 佛 聽 故 不 生 之 意 為 此 故 
T11n0314_001:0767c22	說如來朽敗老退患耳。」「世尊！云何，可取『汝目	說 如 來 朽 敗 老 退 患 耳 世 尊 云 何 可 取 汝 目 
T11n0314_001:0767c23	連，往至耆婆大醫王所取藥。』？」「善男子！我此言	連 往 至 耆 婆 大 醫 王 所 取 藥 善 男 子 我 此 言 
T11n0314_001:0767c24	亦為後世故說，吾諸聲聞必須諸藥，知佛聽	亦 為 後 世 故 說 吾 諸 聲 聞 必 須 諸 藥 知 佛 聽 
T11n0314_001:0767c25	故而無有乏。為此事故如來所說。彼諸愚癡	故 而 無 有 乏 為 此 事 故 如 來 所 說 彼 諸 愚 癡 
T11n0314_001:0767c26	眾生如所說取，如來是患身，目連比丘往至	眾 生 如 所 說 取 如 來 是 患 身 目 連 比 丘 往 至 
T11n0314_001:0767c27	耆婆所，而不禮拜及不生恭敬，速疾之意聞	耆 婆 所 而 不 禮 拜 及 不生恭敬 速 疾 之 意 聞 
T11n0314_001:0767c28	已，怱怱說其藥。善男子！此亦說諸欲等患，證	已 怱 怱 說 其 藥 善 男 子 此 亦 說 諸 欲 等 患 證 
T11n0314_001:0767c29	見法者尚忘，何況凡夫？」「世尊！云何所取？『如	見 法 者 尚 忘 何 況 凡 夫 世 尊 云 何 所 取 如 
T11n0314_001:0768a01	來共諸外道尼乾子等，諍其諸伎者。』我為	來 共 諸 外 道 尼 乾 子 等 諍 其 諸 伎 者 我 為 
T11n0314_001:0768a02	後世眾生故說此言，如來尚有怨家，況於我	後 世 眾 生 故 說 此 言 如 來 尚 有 怨 家 況 於 我 
T11n0314_001:0768a03	等？然彼愚癡眾生如實說取，如來有怨家等。	等 然 彼 愚 癡 眾 生 如 實 說 取 如 來 有 怨 家 等 
T11n0314_001:0768a04	轉輪聖王微善根故，尚無諸患，況如來也，	轉輪聖王 微 善 根 故 尚 無 諸 患 況 如 來 也 
T11n0314_001:0768a05	成就諸功德藏，云何所取？佉陀羅刺刺如	成 就 諸 功 德 藏 云 何 所 取 佉 陀 羅 刺 刺 如 
T11n0314_001:0768a06	來足，如來亦說過去業報，如來尚受過去業	來 足 如 來 亦 說 過 去 業 報 如 來 尚 受 過 去 業 
T11n0314_001:0768a07	報，況餘凡夫？眾生為是事故，為彼因彼緣故，	報 況 餘 凡 夫 眾 生 為 是 事 故 為 彼 因 彼 緣 故 
T11n0314_001:0768a08	示於惡業。為此義故，而示其業果報事。然彼	示 於 惡 業 為 此 義 故 而 示 其 業 果 報 事 然 彼 
T11n0314_001:0768a09	愚癡眾生，如實所取，佉陀羅刺刺如來足。」	愚 癡 眾 生 如 實 所 取 佉 陀 羅 刺 刺 如 來 足 
T11n0314_001:0768a10	「世尊！云何可取？『提婆達多是善知識，復是如	 世 尊 云 何 可 取 提 婆 達 多 是 善 知 識 復 是 如 
T11n0314_001:0768a11	來久遠親近是怨家者。』」「善男子！若無提婆達	來 久 遠 親 近 是 怨 家 者 善 男 子 若 無 提 婆 達 
T11n0314_001:0768a12	多善知識者，不顯如來諸佛功德。善男子！是	多 善 知 識 者 不 顯 如 來 諸 佛 功 德 善 男 子 是 
T11n0314_001:0768a13	以提婆達多善知識，共如來諍伎等道德，示	以 提 婆 達 多 善 知 識 共 如 來 諍 伎 等 道 德 示 
T11n0314_001:0768a14	怨家等事。然是顯如來諸大智功德。善男子！	怨 家 等 事 然 是 顯 如 來 諸 大 智 功 德 善 男 子 
T11n0314_001:0768a15	若提婆達多承王教已，於大眾中放護財大	若 提 婆 達 多 承 王 教 已 於 大 眾 中 放 護 財 大 
T11n0314_001:0768a16	象，此象若往堪害如來，而如來力令降伏善	象 此 象 若 往 堪 害 如 來 而 如 來 力 令 降 伏 善 
T11n0314_001:0768a17	調。爾時無量人眾見彼象調伏已，生希有希	調 爾 時 無 量 人 眾 見 彼 象 調 伏 已 生 希 有 希 
T11n0314_001:0768a18	有心，即歸依三寶——所謂佛寶、法寶、僧寶——是名	有 心 即 歸 依 三 寶 所 謂 佛 寶 法 寶 僧 寶 是 名 
T11n0314_001:0768a19	提婆達多善知識之相。然有愚癡之人如說	提 婆 達 多 善 知 識 之 相 然 有 愚 癡 之 人 如 說 
T11n0314_001:0768a20	而取，提婆達多者是如來怨家。如是五百世	而 取 提 婆 達 多 者 是 如 來 怨 家 如 是 五 百 世 
T11n0314_001:0768a21	中現菩薩行，是提婆達多所示現者，顯如來	中 現 菩 薩 行 是 提 婆 達 多 所 示 現 者 顯 如 來 
T11n0314_001:0768a22	道德，然愚癡眾生隨教而取，提婆達多者是	道 德 然 愚 癡 眾 生 隨 教 而 取 提 婆 達 多 者 是 
T11n0314_001:0768a23	如來怨家害者，以是因緣，捨身墮阿鼻地獄、	如 來 怨 家 害 者 以是因緣 捨 身 墮 阿鼻地獄 
T11n0314_001:0768a24	餓鬼、畜生之處。何以故？善男子！提婆達多者	餓 鬼 畜 生 之 處 何 以 故 善 男 子 提 婆 達 多 者 
T11n0314_001:0768a25	善集諸行，善集諸善根，以曾供養無量諸	善 集 諸 行 善 集 諸 善 根 以 曾 供 養 無 量 諸 
