T14n0464_001:0483c04	者善知具足，從一地至一地。復有二隨法行。	者 善 知 具 足 從 一 地 至 一 地 復 有 二 隨 法 行 
T14n0464_001:0483c05	何等為二？一者善知聲聞、辟支佛道；二者善	何 等 為 二 一 者 善 知 聲 聞 辟支佛道 二 者 善 
T14n0464_001:0483c06	知佛道，不退轉行。」爾時佛讚文殊師利法	知 佛 道 不 退 轉 行 爾 時 佛 讚 文 殊 師 利 法 
T14n0464_001:0483c07	王子言：「善哉，善哉！汝能為諸菩薩摩訶薩說	王 子 言 善 哉 善 哉 汝 能 為 諸 菩薩摩訶薩 說 
T14n0464_001:0483c08	本業道，誠如所說。」說是法時，十千菩薩得無	本 業 道 誠 如 所 說 說 是 法 時 十 千 菩 薩 得 無 
T14n0464_001:0483c09	生法忍。文殊師利法王子，一切世間天、人、阿	生 法 忍 文 殊 師 利 法 王 子 一切世間 天 人 阿 
T14n0464_001:0483c10	修羅，聞佛所說，歡喜信受。	修 羅 聞 佛 所 說 歡喜信受 
T14n0464_001:0483c11	文殊師利問菩提經	文 殊 師 利 問 菩 提 經 
