T14n0472_001:0514c03	佛說大乘善見變化文殊師利問	佛 說 大 乘 善 見 變 化 文 殊 師 利 問 
T14n0472_001:0514c04	法經	法 經 
T14n0472_001:0514c06	西天中印度，惹爛馱囉國密林寺，三藏明	西 天 中 印 度 惹 爛 馱 囉 國 密 林 寺 三 藏 明 
T14n0472_001:0514c07	教大師，賜紫沙門臣天息災奉　詔譯	教 大 師 賜 紫 沙 門 臣 天 息 災 奉 詔 譯 
T14n0472_001:0514c08	如是我聞：一時世尊，在王舍城鷲峯山中，與	如是我聞 一 時 世 尊 在 王 舍 城 鷲 峯 山 中 與 
T14n0472_001:0514c09	大比丘眾，并大菩薩文殊師利等大眾圍遶。	大 比 丘 眾 并 大 菩 薩 文 殊 師 利 等 大 眾 圍 遶 
T14n0472_001:0514c10	爾時，佛告文殊師利童子言：「佛子，我今為諸	爾 時 佛 告 文 殊 師 利 童 子 言 佛 子 我 今 為 諸 
T14n0472_001:0514c11	眾生於四聖諦，心生顛倒，恒處輪迴不能免	眾 生 於 四 聖 諦 心 生 顛 倒 恒 處 輪 迴 不 能 免 
T14n0472_001:0514c12	離，說此真實四聖諦法。」文殊師利白佛言：	離 說 此 真 實 四 聖 諦 法 文 殊 師 利 白 佛 言 
T14n0472_001:0514c13	「世尊！如來、應、正等覺，云何因緣，而諸眾生	 世 尊 如 來 應 正 等 覺 云 何 因 緣 而 諸 眾 生 
T14n0472_001:0514c14	不能遠離如是虛妄輪迴之中，不覺不知？」佛	不 能 遠 離 如 是 虛 妄 輪 迴 之 中 不 覺 不 知 佛 
T14n0472_001:0514c15	言：「文殊師利！我見眾生受如是虛妄輪迴，	言 文 殊 師 利 我 見 眾 生 受 如 是 虛 妄 輪 迴 
T14n0472_001:0514c16	何以故？善男子！皆因無始已來妄生計執，分	何 以 故 善 男 子 皆 因 無始已來 妄 生 計 執 分 
T14n0472_001:0514c17	別彼我。文殊師利！以是因緣，受此愚癡業	別 彼 我 文 殊 師 利 以是因緣 受 此 愚 癡 業 
T14n0472_001:0514c18	報，虛妄輪迴。何以故？是諸愚癡眾生，不聞、	報 虛 妄 輪 迴 何 以 故 是 諸 愚 癡 眾 生 不 聞 
T14n0472_001:0514c19	不知最上一切寂靜法故，不自思惟警悟三	不 知 最 上 一 切 寂 靜 法 故 不 自 思 惟 警 悟 三 
T14n0472_001:0514c20	業，恣身口意造眾煩惱，我貪、我瞋、我癡等；	業 恣 身 口 意 造 眾 煩 惱 我 貪 我 瞋 我 癡 等 
T14n0472_001:0514c21	我今於彼如來法中，得此出家，受清淨戒，修	我 今 於 彼 如 來 法 中 得 此 出 家 受 清 淨 戒 修 
T14n0472_001:0514c22	持淨行，遠離輪迴，得涅盤道，解脫苦輪。「復	持 淨 行 遠 離 輪 迴 得 涅 盤 道 解 脫 苦 輪 復 
T14n0472_001:0514c23	自思惟，此煩惱性即善法故，即有漏法故，	自 思 惟 此 煩 惱 性 即 善 法 故 即 有 漏 法 故 
T14n0472_001:0514c24	即無漏法故，即輪迴法故，即世間、即出世間，	即 無 漏 法 故 即 輪 迴 法 故 即 世 間 即 出 世 間 
T14n0472_001:0514c25	即智、即蠲除法，即決定法，即觀法圓滿智，	即 智 即 蠲 除 法 即 決 定 法 即 觀 法 圓 滿 智 
T14n0472_001:0514c26	即觀苦集滅決定道，乃至決定法界故。「又復	即 觀 苦 集 滅 決 定 道 乃 至 決 定 法 界 故 又 復 
T14n0472_001:0514c27	思惟，一切行虛假故，一切行苦惱故，一切	思 惟 一 切 行 虛 假 故 一切行苦 惱 故 一 切 
T14n0472_001:0514c28	行即無相故。我若得此，即能遠離一切虛假，	行 即 無 相 故 我 若 得 此 即 能 遠 離 一 切 虛 假 
T14n0472_001:0514c29	得隨意生。若觀我見，不離道諦，即得彼法，所	得 隨 意 生 若 觀 我 見 不 離 道 諦 即 得 彼 法 所 
T14n0472_001:0515a01	作隨意。復於彼法，憶念無惑，於一切法，心無	作 隨 意 復 於 彼 法 憶 念 無 惑 於一切法 心 無 
T14n0472_001:0515a02	差別，能如是知，即得遠離不信、疑惑、毀謗、	差 別 能 如 是 知 即 得 遠 離 不 信 疑 惑 毀 謗 
T14n0472_001:0515a03	讚歎，得此解脫一切我苦。我於是時，無有少	讚 歎 得 此 解 脫 一 切 我 苦 我 於 是 時 無 有 少 
T14n0472_001:0515a04	分，而難作者。若阿羅漢能知此我，彼臨命終	分 而 難 作 者 若 阿 羅 漢 能 知 此 我 彼 臨 命 終 
T14n0472_001:0515a05	時，自見所生，棄捨本心得佛菩提，隨意所樂	時 自 見 所 生 棄 捨 本 心 得 佛 菩 提 隨 意 所 樂 
T14n0472_001:0515a06	自在而往，即得至於無為界故，彼得此苦智、	自 在 而 往 即 得 至 於 無 為 界 故 彼 得 此 苦 智 
T14n0472_001:0515a07	法智。若了知我集一切法，生不信心，疑惑、誹	法 智 若 了 知 我 集 一 切 法 生 不 信 心 疑 惑 誹 
T14n0472_001:0515a08	謗、種種怖畏。若不信此法，盡此集故，彼作是	謗 種 種 怖 畏 若 不 信 此 法 盡 此 集 故 彼 作 是 
T14n0472_001:0515a09	思惟，決定滅諦。「彼復思惟，此法應如是作，得	思 惟 決 定 滅 諦 彼 復 思 惟 此 法 應 如 是 作 得 
T14n0472_001:0515a10	滅諦故。是法若作此，決定滅作，是決定彼意，	滅 諦 故 是 法 若 作 此 決 定 滅 作 是 決 定 彼 意 
T14n0472_001:0515a11	心生疑惑，命終之後墮大地獄中，云何名如	心 生 疑 惑 命終之後 墮 大 地 獄 中 云 何 名 如 
T14n0472_001:0515a12	實思惟？生一切法故。」	實 思 惟 生 一 切 法 故 
T14n0472_001:0515a13	爾時文殊師利童子白佛言：「世尊！云何見四	爾 時 文 殊 師 利 童 子 白 佛 言 世 尊 云 何 見 四 
T14n0472_001:0515a14	聖諦心？」佛告文殊師利：「若見一切法即不生	聖 諦 心 佛 告 文 殊 師 利 若 見 一 切 法 即 不 生 
T14n0472_001:0515a15	故，即見苦諦；若見出生一切法消除故，即是	故 即 見 苦 諦 若 見 出 生 一 切 法 消 除 故 即 是 
T14n0472_001:0515a16	集諦；若見最上涅盤一切寂靜法相，即是滅	集 諦 若 見 最 上 涅 盤 一 切 寂 靜 法 相 即 是 滅 
T14n0472_001:0515a17	諦；若見究竟一切法性即是道諦。文殊師利！	諦 若 見 究 竟 一切法性 即 是 道 諦 文 殊 師 利 
T14n0472_001:0515a18	若彼見此四聖諦非實、非虛，是善法、是不善	若 彼 見 此 四 聖 諦 非 實 非 虛 是 善 法 是 不 善 
T14n0472_001:0515a19	法，是有漏、是無漏，是世間、是出世間，是有	法 是 有 漏 是 無 漏 是 世 間 是 出 世 間 是 有 
T14n0472_001:0515a20	為智、是無為智，是無變異法，是觀苦集了別	為 智 是 無 為 智 是 無 變 異 法 是 觀 苦 集 了 別 
T14n0472_001:0515a21	智法，即決定滅諦，乃至決定法界道諦，不可	智 法 即 決 定 滅 諦 乃 至 決 定 法 界 道 諦 不 可 
T14n0472_001:0515a22	改變。何故一切愚迷眾生耽著欲樂，於此	改 變 何 故 一 切 愚 迷 眾 生 耽 著 欲 樂 於 此 
T14n0472_001:0515a23	實相法中，而生迷惑？彼諸眾生，於寂滅法，不	實 相 法 中 而 生 迷 惑 彼 諸 眾 生 於 寂 滅 法 不 
T14n0472_001:0515a24	諦思惟，乃至一切法，寂靜自性，不得現前。	諦 思 惟 乃 至 一 切 法 寂 靜 自 性 不 得 現 前 
T14n0472_001:0515a25	不知此法非取、非捨、非離取捨，在彼貪界，顯	不 知 此 法 非 取 非 捨 非 離 取 捨 在 彼 貪 界 顯 
T14n0472_001:0515a26	現涅盤，瞋界、癡界乃至輪迴界，悉能現彼涅	現 涅 盤 瞋 界 癡 界 乃 至 輪 迴 界 悉 能 現 彼 涅 
T14n0472_001:0515a27	盤寂靜界故。若於一切法，能現如是自性平	盤 寂 靜 界 故 若 於一切法 能 現 如 是 自 性 平 
T14n0472_001:0515a28	等，當得一切法中自在無礙。云何不知彼	等 當 得一切法 中 自在無礙 云 何 不 知 彼 
T14n0472_001:0515a29	真實法？若於不生、不滅法，心同虛空，即佛平	真 實 法 若 於 不 生 不 滅 法 心 同 虛 空 即 佛 平 
T14n0472_001:0515b01	等不可得故，法平等不可得故，僧平等不可	等 不 可 得 故 法 平 等 不 可 得 故 僧 平 等 不 可 
T14n0472_001:0515b02	得故，乃至涅盤寂靜平等亦不可得故。如是	得 故 乃 至 涅 盤 寂 靜 平 等 亦 不 可 得 故 如 是 
T14n0472_001:0515b03	於一切未曾有法，不生疑惑，即得離疑。不	於 一 切 未曾有法 不 生 疑 惑 即 得 離 疑 不 
T14n0472_001:0515b04	生、不出，至一切最勝涅盤寂靜界故。文殊師	生 不 出 至 一切最勝 涅 盤 寂 靜 界 故 文 殊 師 
T14n0472_001:0515b05	利！如是真諦一切法不可見，是故須菩提而	利 如 是 真 諦 一 切 法 不 可 見 是 故 須 菩 提 而 
T14n0472_001:0515b06	不往詣禮如來足。如須菩提尚得無我，況復	不 往 詣 禮 如 來 足 如 須 菩 提 尚 得 無 我 況 復 
T14n0472_001:0515b07	如來云何而見？勿作是解。文殊師利！如是一	如 來 云 何 而 見 勿 作 是 解 文 殊 師 利 如 是 一 
T14n0472_001:0515b08	切不生法中有所見故，即非見四聖諦。」	切 不 生 法 中 有 所 見 故 即 非 見 四 聖 諦 
T14n0472_001:0515b09	爾時文殊師利法王子白佛言：「世尊！云何見	爾 時 文 殊 師 利 法 王 子 白 佛 言 世 尊 云 何 見 
T14n0472_001:0515b10	四念處？」佛告文殊師利：「彼須菩提，當得觀身	四 念 處 佛 告 文 殊 師 利 彼 須 菩 提 當 得 觀 身 
T14n0472_001:0515b11	不淨，見身念處；觀受是苦，見受念處；觀心無	不 淨 見 身 念 處 觀 受 是 苦 見 受 念 處 觀 心 無 
T14n0472_001:0515b12	常，見心念處；觀法無我，見法念處。」文殊師利	常 見 心 念 處 觀法無我 見 法 念 處 文 殊 師 利 
T14n0472_001:0515b13	復白佛言：「世尊！如是實相云何而說？復云何	復 白 佛 言 世 尊 如 是 實 相 云 何 而 說 復 云 何 
T14n0472_001:0515b14	見真實四念處？」佛告文殊師利：「止，此真實諦	見 真 實 四 念 處 佛 告 文 殊 師 利 止 此 真 實 諦 
T14n0472_001:0515b15	如來所說，難解難知。」文殊師利言：「唯願說之，	如 來 所 說 難 解 難 知 文 殊 師 利 言 唯 願 說 之 
T14n0472_001:0515b16	廣演分別，彼真實四念處故」佛言：「文殊師	廣 演 分 別 彼 真 實 四 念 處 故 佛 言 文 殊 師 
T14n0472_001:0515b17	利！汝若見等虛空身，即見此身中身念處。	利 汝 若 見 等 虛 空 身 即 見 此 身 中 身 念 處 
T14n0472_001:0515b18	又，文殊師利！若於受中內外中間有所得故，	又 文 殊 師 利 若 於 受 中 內 外 中 間 有 所 得 故 
T14n0472_001:0515b19	即見受念處。又，文殊師利！若見此心智有方	即 見 受 念 處 又 文 殊 師 利 若 見 此 心 智 有 方 
T14n0472_001:0515b20	圓大小，即見此心中心念處。又，文殊師利！	圓 大 小 即 見 此 心 中 心 念 處 又 文 殊 師 利 
T14n0472_001:0515b21	若於善、不善，有漏、無漏，乃至煩惱世出世間法	若 於 善 不 善 有 漏 無 漏 乃 至 煩 惱 世出世間 法 
T14n0472_001:0515b22	中有所得故，即非見此法中法念處。文殊	中 有 所 得 故 即 非 見 此 法 中 法 念 處 文 殊 
T14n0472_001:0515b23	師利！此真實四念處應如是解。」文殊師利白	師 利 此 真 實 四 念 處 應 如 是 解 文 殊 師 利 白 
T14n0472_001:0515b24	世尊言：「云何見四正勤？」佛告文殊師利：「若	世 尊 言 云 何 見 四 正 勤 佛 告 文 殊 師 利 若 
T14n0472_001:0515b25	觀十二緣生，究竟空寂乃至無性，一切法彼	觀 十 二 緣 生 究 竟 空 寂 乃 至 無 性 一 切 法 彼 
T14n0472_001:0515b26	不可得，當起精進心，稱法滅除所生不善一	不 可 得 當 起 精 進 心 稱 法 滅 除 所 生 不 善 一 
T14n0472_001:0515b27	切業故；為未生不善法，令不起故；未生善	切 業 故 為 未 生 不 善 法 令 不 起 故 未 生 善 
T14n0472_001:0515b28	法，起精進心令出生故；所生善法，令得久住，	法 起 精 進 心 令 出 生 故 所 生 善 法 令 得 久 住 
T14n0472_001:0515b29	不廢忘故，當起圓滿精進心故。如一切法離	不 廢 忘 故 當 起 圓 滿 精 進 心 故 如 一 切 法 離 
T14n0472_001:0515c01	取、離捨、非離取捨，若得如是正憶念故，彼不	取 離 捨 非 離 取 捨 若 得 如 是 正 憶 念 故 彼 不 
T14n0472_001:0515c02	復起心，即得此三摩地行。彼云何思惟？得	復 起 心 即 得 此 三 摩 地 行 彼 云 何 思 惟 得 
T14n0472_001:0515c03	神足故。云何住平等一切法？文殊師利，應	神 足 故 云 何 住 平 等 一 切 法 文 殊 師 利 應 
T14n0472_001:0515c04	當如是見四正勤。」	當 如 是 見 四 正 勤 
T14n0472_001:0515c05	文殊師利又復白言：「世尊！云何見五根？」佛	文 殊 師 利 又 復 白 言 世 尊 云 何 見 五 根 佛 
T14n0472_001:0515c06	言：「文殊師利！若見究竟一切法不生，即解	言 文 殊 師 利 若 見 究 竟 一 切 法 不 生 即 解 
T14n0472_001:0515c07	信根。何以故？文殊師利！此究竟不生信根，於	信 根 何 以 故 文 殊 師 利 此 究 竟 不 生 信 根 於 
T14n0472_001:0515c08	一切法中，心不可得故，本離此名。又，文殊師	一 切 法 中 心 不 可 得 故 本 離 此 名 又 文 殊 師 
T14n0472_001:0515c09	利！若於一切法離憶念故，無有趣求，不住方	利 若 於一切法 離 憶 念 故 無 有 趣 求 不 住 方 
T14n0472_001:0515c10	所，是為精進根。文殊師利！若於一切法，離	所 是 為 精 進 根 文 殊 師 利 若 於一切法 離 
T14n0472_001:0515c11	現前明了故，遠離差別，心不起故，是為念	現 前 明 了 故 遠 離 差 別 心 不 起 故 是 為 念 
T14n0472_001:0515c12	根。又，文殊師利！若於諸法，能離生滅，能覺	根 又 文 殊 師 利 若 於 諸 法 能 離 生 滅 能 覺 
T14n0472_001:0515c13	所覺，性空性非空性故，是為定根。文殊師利！	所 覺 性 空 性 非 空 性 故 是 為 定 根 文 殊 師 利 
T14n0472_001:0515c14	若性孰有孰無，一切法中不可得故，是為慧	若 性 孰 有 孰 無 一 切 法 中 不 可 得 故 是 為 慧 
T14n0472_001:0515c15	根。文殊師利！應如是解，了知五根故。」	根 文 殊 師 利 應 如 是 解 了 知 五 根 故 
T14n0472_001:0515c16	文殊師利言：「世尊！云何見五力？」佛言：「文殊師	文 殊 師 利 言 世 尊 云 何 見 五 力 佛 言 文 殊 師 
T14n0472_001:0515c17	利！若能見此離性、離相一切廣大心法，是為	利 若 能 見 此 離 性 離 相 一 切 廣 大 心 法 是 為 
T14n0472_001:0515c18	信力。文殊師利！若於菩提進求功德，能離取	信 力 文 殊 師 利 若 於 菩 提 進 求 功 德 能 離 取 
T14n0472_001:0515c19	捨，非離取捨，是為進力。文殊師利！若於一切	捨 非 離 取 捨 是 為 進 力 文 殊 師 利 若 於 一 切 
T14n0472_001:0515c20	法離諸憶念，無有計執，是為念力。文殊師利！	法 離 諸 憶 念 無 有 計 執 是 為 念 力 文 殊 師 利 
T14n0472_001:0515c21	若至一切法無相故，是為定力。文殊師利！	若 至 一 切 法 無 相 故 是 為 定 力 文 殊 師 利 
T14n0472_001:0515c22	若能遠離一切所見，乃至涅盤，是為慧力。文	若 能 遠 離 一 切 所 見 乃 至 涅 盤 是 為 慧 力 文 
T14n0472_001:0515c23	殊師利！應如是解，了知五力故。」	殊 師 利 應 如 是 解 了 知 五 力 故 
T14n0472_001:0515c24	文殊師利言：「世尊！云何見七覺分？」佛言：「文殊	文 殊 師 利 言 世 尊 云 何 見 七 覺 分 佛 言 文 殊 
T14n0472_001:0515c25	師利！若見一切無自性法，不憶念故，是為念	師 利 若 見 一 切 無 自 性 法 不 憶 念 故 是 為 念 
T14n0472_001:0515c26	覺分。文殊師利！若於一切法，心不可測度，說	覺 分 文 殊 師 利 若 於一切法 心 不 可 測 度 說 
T14n0472_001:0515c27	善、不善及得受記，是為擇法覺分。文殊師利！	善 不 善 及 得 受 記 是 為 擇 法 覺 分 文 殊 師 利 
T14n0472_001:0515c28	若於一切法，能離取捨、非離取捨，又於諸法	若 於一切法 能 離 取 捨 非 離 取 捨 又 於 諸 法 
T14n0472_001:0515c29	捨離思慮，是為精進覺分。文殊師利！若於一	捨 離 思 慮 是 為 精 進 覺 分 文 殊 師 利 若 於 一 
T14n0472_001:0516a01	切法，不生愛著，解一切法即無生故，是為喜	切 法 不 生 愛 著 解 一 切 法 即 無 生 故 是 為 喜 
T14n0472_001:0516a02	覺分。文殊師利！若於一切法，心生信樂，解一	覺 分 文 殊 師 利 若 於一切法 心 生 信 樂 解 一 
T14n0472_001:0516a03	切法不可得故，是為輕安覺分。文殊師利！	切 法 不 可 得 故 是 為 輕 安 覺 分 文 殊 師 利 
T14n0472_001:0516a04	若於一切法，心無掉舉，是為定覺分。文殊師	若 於一切法 心 無 掉 舉 是 為 定 覺 分 文 殊 師 
T14n0472_001:0516a05	利！若於一切法無住、無著、不可覺知，於一切	利 若 於一切法 無 住 無 著 不 可 覺 知 於 一 切 
T14n0472_001:0516a06	法不生貪著，若得此捨，是為捨覺分。文殊師	法 不 生 貪 著 若 得 此 捨 是 為 捨 覺 分 文 殊 師 
T14n0472_001:0516a07	利！七菩提分，應如是解而能了知。」	利 七菩提分 應 如 是 解 而 能 了 知 
T14n0472_001:0516a08	文殊師利言：「世尊！云何見八正道？」佛告文殊	文 殊 師 利 言 世 尊 云 何 見 八 正 道 佛 告 文 殊 
T14n0472_001:0516a09	師利：「若不見正，乃至不見一切無性、法無二	師 利 若 不 見 正 乃 至 不 見 一 切 無 性 法 無 二 
T14n0472_001:0516a10	相，心無罣礙，是為正見。文殊師利！若見一切	相 心 無 罣 礙 是 為 正 見 文 殊 師 利 若 見 一 切 
T14n0472_001:0516a11	法，離諸罣礙、非離罣礙，心無所著，是為正思	法 離 諸 罣 礙 非 離 罣 礙 心無所著 是 為 正 思 
T14n0472_001:0516a12	惟。文殊師利！若見一切法，無有邊際，稱無邊	惟 文 殊 師 利 若 見 一 切 法 無有邊際 稱 無 邊 
T14n0472_001:0516a13	際，平等善說，是為正語。文殊師利！若見一切	際 平 等 善 說 是 為 正 語 文 殊 師 利 若 見 一 切 
T14n0472_001:0516a14	法，無有動作，離悲[(每*殳)/心]心，本不生故，是為	法 無 有 動 作 離 悲 [每殳心] 心 本 不 生 故 是 為 
T14n0472_001:0516a15	正業。文殊師利！若於一切法，無喜、無瞋，諸法	正 業 文 殊 師 利 若 於一切法 無 喜 無 瞋 諸 法 
T14n0472_001:0516a16	不生，是為正命。文殊師利！若於一切法，無有	不 生 是 為 正 命 文 殊 師 利 若 於一切法 無 有 
T14n0472_001:0516a17	起滅、無有力用，是為正精進。文殊師利！若於	起 滅 無 有 力 用 是 為 正 精 進 文 殊 師 利 若 於 
T14n0472_001:0516a18	一切法，念念不生、無有知覺，離諸思惟，是為	一 切 法 念 念 不 生 無 有 知 覺 離 諸 思 惟 是 為 
T14n0472_001:0516a19	正念。文殊師利！若於一切法，自性、非性而能	正 念 文 殊 師 利 若 於一切法 自 性 非 性 而 能 
T14n0472_001:0516a20	遠離，無有所著，是為正定。文殊師利！此八	遠 離 無 有 所 著 是 為 正 定 文 殊 師 利 此 八 
T14n0472_001:0516a21	正道，應如是解即能了知。」	正 道 應 如 是 解 即 能 了 知 
T14n0472_001:0516a22	「文殊師利！若有見如是四聖諦心，即得見於	 文 殊 師 利 若 有 見 如 是 四 聖 諦 心 即 得 見 於 
T14n0472_001:0516a23	四念處、四正勤、四神足、五根、五力、七菩提分、八	四 念 處 四 正 勤 四 神 足 五 根 五 力 七菩提分 八 
T14n0472_001:0516a24	聖道分，真實心故。是求彼岸，至實際地，得	聖 道 分 真 實 心 故 是 求 彼 岸 至 實 際 地 得 
T14n0472_001:0516a25	大安樂，悉捨重擔，遠塵離垢，觀身無相至無	大 安 樂 悉 捨 重 擔 遠塵離垢 觀 身 無 相 至 無 
T14n0472_001:0516a26	生忍。阿羅漢、沙門、婆羅門，至淨彼岸名曰	生 忍 阿 羅 漢 沙 門 婆 羅 門 至 淨 彼 岸 名 曰 
T14n0472_001:0516a27	多聞，是真佛子，是能仁子；能敵冤家，棄擲煩	多 聞 是 真 佛 子 是 能 仁 子 能 敵 冤 家 棄 擲 煩 
T14n0472_001:0516a28	惱，得大堅固，無老、無怖，無有疑惑亦無戲	惱 得 大 堅 固 無 老 無 怖 無有疑惑 亦 無 戲 
T14n0472_001:0516a29	論，無彼無此，名此比丘為聖法幢。文殊師	論 無 彼 無 此 名 此 比 丘 為 聖 法 幢 文 殊 師 
T14n0472_001:0516b01	利！若得如是法忍，得大善利，應得一切世間	利 若 得 如 是 法 忍 得 大 善 利 應 得 一切世間 
T14n0472_001:0516b02	天、人、阿修羅而為供養。文殊師利！是故得一	天 人 阿 修 羅 而 為 供 養 文 殊 師 利 是 故 得 一 
T14n0472_001:0516b03	切國土無空過者，悉受清淨飲食供養，為離	切 國 土 無 空 過 者 悉 受 清 淨 飲 食 供 養 為 離 
T14n0472_001:0516b04	輪迴、得涅盤岸，脫諸苦輪，乃至一切正遍知	輪 迴 得 涅 盤 岸 脫 諸 苦 輪 乃 至 一 切 正 遍 知 
T14n0472_001:0516b05	正等菩提，起此心法所求皆得。」	正等菩提 起 此 心 法 所 求 皆 得 
T14n0472_001:0516b06	爾時世尊說是法時，三萬二千天子皆得此	爾 時 世 尊 說 是 法 時 三 萬 二 千 天 子 皆 得 此 
T14n0472_001:0516b07	法，彼諸天眾於如來、世尊、應、正等覺，并文殊	法 彼 諸 天 眾 於 如 來 世 尊 應 正 等 覺 并 文 殊 
T14n0472_001:0516b08	師利菩薩摩訶薩，散曼陀羅花、摩訶曼陀羅	師 利 菩薩摩訶薩 散 曼陀羅花 摩訶曼陀羅 
T14n0472_001:0516b09	花而以供養，作如是言：「彼等於如來佛法	花 而 以 供 養 作如是言 彼 等 於 如 來 佛 法 
T14n0472_001:0516b10	中，當得出家受清淨戒。若說此法，一心聽	中 當 得 出 家 受 清 淨 戒 若 說 此 法 一 心 聽 
T14n0472_001:0516b11	受，得菩提道。」復有八千一百比丘眾，心得漏	受 得 菩 提 道 復 有 八 千 一 百 比 丘 眾 心 得 漏 
T14n0472_001:0516b12	盡無生解脫；復有四萬二千菩薩，得無生法	盡 無 生 解 脫 復 有 四 萬 二 千 菩 薩 得 無 生 法 
T14n0472_001:0516b13	忍。于時三千大千世界，一切魔王宮殿、山	忍 于 時 三千大千世界 一 切 魔 王 宮 殿 山 
T14n0472_001:0516b14	林曠野、大地，六種振動，於虛空中雨眾天花，	林 曠 野 大 地 六 種 振 動 於 虛 空 中 雨 眾 天 花 
T14n0472_001:0516b15	讚言：「善哉，善哉！善說此法，甚為希有！」出是音	讚 言 善 哉 善 哉 善 說 此 法 甚 為 希 有 出 是 音 
T14n0472_001:0516b16	聲，十方普聞。佛說此經已，文殊師利法王子	聲 十 方 普 聞 佛 說 此 經 已 文 殊 師 利 法 王 子 
T14n0472_001:0516b17	及大菩薩、諸比丘眾，一切世間諸天、人民、阿	及 大 菩 薩 諸 比 丘 眾 一切世間 諸 天 人 民 阿 
T14n0472_001:0516b18	修羅、乾達婆等，聞佛所說，各各歡喜，禮佛	修 羅 乾 達 婆 等 聞 佛 所 說 各 各 歡 喜 禮 佛 
T14n0472_001:0516b19	而退。	而 退 
T14n0472_001:0516b20	佛說文殊師利問法經	佛 說 文 殊 師 利 問 法 經 
