T14n0464_001:0481b26	文殊師利問菩提經(一名伽耶山頂經)	文 殊 師 利 問 菩 提 經 一 名 伽 耶 山 頂 經 
T14n0464_001:0481b28	姚秦龜茲三藏鳩摩羅什譯	姚 秦 龜 茲 三 藏 鳩 摩 羅 什 譯 
T14n0464_001:0481b29	如是我聞：一時佛初得道，在摩伽陀國伽耶	如是我聞 一 時 佛 初 得 道 在 摩伽陀國 伽 耶 
T14n0464_001:0481c01	山祠，與大比丘眾千人俱，其先悉是編髮	山 祠 與 大 比 丘 眾 千 人 俱 其 先 悉 是 編 髮 
T14n0464_001:0481c02	仙人，皆阿羅漢，所作已辦，心得自在，逮得己	仙 人 皆 阿 羅 漢 所 作 已 辦 心得自在 逮 得 己 
T14n0464_001:0481c03	利，盡諸有結，正智解脫。菩薩萬人，皆從十方	利 盡諸有結 正智解脫 菩 薩 萬 人 皆 從 十 方 
T14n0464_001:0481c04	世界來集，有大威德，皆得諸忍、諸陀羅尼、諸	世 界 來 集 有 大 威 德 皆 得 諸 忍 諸 陀 羅 尼 諸 
T14n0464_001:0481c05	深三昧，具諸神通。文殊師利菩薩、觀世音	深 三 昧 具 諸 神 通 文 殊 師 利 菩 薩 觀 世 音 
T14n0464_001:0481c06	菩薩、大勢至菩薩、香象菩薩、勇施菩薩、	菩 薩 大 勢 至 菩 薩 香 象 菩 薩 勇 施 菩 薩 
T14n0464_001:0481c07	隨智行菩薩以為上首，如是等菩薩大眾，百	隨 智 行 菩 薩 以 為 上 首 如 是 等 菩 薩 大 眾 百 
T14n0464_001:0481c08	千萬億，其數無量；并諸天、龍、夜叉、乾闥婆、阿	千 萬 億 其 數 無 量 并 諸 天 龍 夜 叉 乾 闥 婆 阿 
T14n0464_001:0481c09	修羅、迦樓羅、緊那羅、摩睺羅伽、人非人等大眾	修 羅 迦 樓 羅 緊 那 羅 摩睺羅伽 人 非 人 等 大 眾 
T14n0464_001:0481c10	圍繞。爾時世尊，入諸佛甚深三昧，如實諦觀	圍 繞 爾 時 世 尊 入 諸 佛 甚 深 三 昧 如 實 諦 觀 
T14n0464_001:0481c11	諸法性相，而作是念：「我得阿耨多羅三藐三	諸 法 性 相 而 作 是 念 我 得 阿 耨 多 羅 三 藐 三 
T14n0464_001:0481c12	菩提、得一切智慧，除諸重擔、度三有險道，滅	菩 提 得 一 切 智 慧 除 諸 重 擔 度 三 有 險 道 滅 
T14n0464_001:0481c13	無明、得真明，拔邪箭、斷渴愛，成法船、擊法鼓、	無 明 得 真 明 拔 邪 箭 斷 渴 愛 成 法 船 擊 法 鼓 
T14n0464_001:0481c14	吹法蠡、建法幢，轉生死種，示涅槃性，閉塞邪	吹 法 蠡 建 法 幢 轉 生 死 種 示 涅 槃 性 閉 塞 邪 
T14n0464_001:0481c15	道，開於正路，離諸惡業，示于福田。我今當觀，	道 開 於 正 路 離 諸 惡 業 示 于 福 田 我 今 當 觀 
T14n0464_001:0481c16	誰得阿耨多羅三藐三菩提，為以身得？為	誰 得阿耨多羅三藐三菩提 為 以 身 得 為 
T14n0464_001:0481c17	以心得？「若以身得，身則無知、無作，如草木	以 心 得 若 以 身 得 身 則 無 知 無 作 如 草 木 
T14n0464_001:0481c18	瓦石，四大所造從父母生，以衣服、飲食、臥具、	瓦 石 四 大 所 造 從 父 母 生 以 衣 服 飲 食 臥 具 
T14n0464_001:0481c19	澡浴而得存立，必歸敗壞無常磨滅。而是菩	澡 浴 而 得 存 立 必 歸 敗 壞 無 常 磨 滅 而 是 菩 
T14n0464_001:0481c20	提，但有名字世俗故說，無形、無色、無定、無相、	提 但 有 名 字 世 俗 故 說 無 形 無 色 無 定 無 相 
T14n0464_001:0481c21	無向、無入、無道，過諸言說出於三界，無見、無	無 向 無 入 無 道 過 諸 言 說 出 於 三 界 無 見 無 
T14n0464_001:0481c22	聞、無覺、無知，亦無所得、亦無戲論，無問、無示、	聞 無 覺 無 知 亦 無 所 得 亦 無 戲 論 無 問 無 示 
T14n0464_001:0481c23	無有文字、無語言道。「若以心得，心從眾緣	無 有 文 字 無 語 言 道 若 以 心 得 心 從 眾 緣 
T14n0464_001:0481c24	生，眾緣生故空如幻，無處、無相、無性，亦無所	生 眾 緣 生 故 空 如 幻 無 處 無 相 無 性 亦 無 所 
T14n0464_001:0481c25	有，於是中得菩提者，所用法得阿耨多羅三	有 於 是 中 得 菩 提 者 所 用 法 得 阿 耨 多 羅 三 
T14n0464_001:0481c26	藐三菩提，是法皆空但有名字，以世俗故而	藐 三 菩 提 是 法 皆 空 但 有 名 字 以 世 俗 故 而 
T14n0464_001:0481c27	有言說，是皆憶想分別，實無所有，無有根本，	有 言 說 是 皆 憶想分別 實無所有 無 有 根 本 
T14n0464_001:0481c28	亦無體相。無受、無著、無染、無離，一相所謂無	亦 無 體 相 無 受 無 著 無 染 無 離 一 相 所 謂 無 
T14n0464_001:0481c29	相。是故於此法中，無有得者。無所用法，亦	相 是 故 於 此 法 中 無 有 得 者 無 所 用 法 亦 
T14n0464_001:0482a01	無菩提。如是通達，是則名為阿耨多羅三	無 菩 提 如 是 通 達 是 則 名 為 阿 耨 多 羅 三 
T14n0464_001:0482a02	藐三菩提。」爾時文殊師利法王子，在大會	藐 三 菩 提 爾 時 文 殊 師 利 法 王 子 在 大 會 
T14n0464_001:0482a03	中，立佛右面，執大寶蓋，以覆佛上。時文殊師	中 立 佛 右 面 執 大 寶 蓋 以 覆 佛 上 時 文 殊 師 
T14n0464_001:0482a04	利默知世尊所念如是，即白佛言：「世尊！若	利 默 知 世 尊 所 念 如 是 即 白 佛 言 世 尊 若 
T14n0464_001:0482a05	菩提如是相者，善男子、善女人云何發心？」佛	菩 提 如 是 相 者 善 男 子 善 女 人 云 何 發 心 佛 
T14n0464_001:0482a06	告文殊師利：「善男子、善女人，當隨菩提相，而	告 文 殊 師 利 善 男 子 善 女 人 當 隨 菩 提 相 而 
T14n0464_001:0482a07	發其心。」「世尊，菩提相者當云何說？」佛告文	發 其 心 世 尊 菩 提 相 者 當 云 何 說 佛 告 文 
T14n0464_001:0482a08	殊師利：「菩提相者，出於三界，過世俗法，語	殊 師 利 菩 提 相 者 出 於 三 界 過 世 俗 法 語 
T14n0464_001:0482a09	言道斷，滅諸發、無發，是發菩提。文殊師利！	言 道 斷 滅 諸 發 無 發 是 發 菩 提 文 殊 師 利 
T14n0464_001:0482a10	是故菩薩應滅諸發，發菩提心，無發是發菩	是 故 菩 薩 應 滅 諸 發 發菩提心 無 發 是 發 菩 
T14n0464_001:0482a11	提。發菩提心者，如如法性，相如實際，無	提 發菩提心 者 如 如 法 性 相 如 實 際 無 
T14n0464_001:0482a12	分別，不緣身心，是發菩提。不著諸法，不增、	分 別 不 緣 身 心 是 發 菩 提 不 著 諸 法 不 增 
T14n0464_001:0482a13	不減、不異、不一，是發菩提。如鏡中像、如熱	不 減 不 異 不 一 是 發 菩 提 如 鏡 中 像 如 熱 
T14n0464_001:0482a14	時焰、如影、如響、如水中月，應當如是發菩提	時 焰 如 影 如 響 如水中月 應 當 如 是 發 菩 提 
T14n0464_001:0482a15	心。」	心 
T14n0464_001:0482a16	爾時會中，有天子，名月淨光德，得阿惟越致。	爾 時 會 中 有 天 子 名 月 淨 光 德 得 阿惟越致 
T14n0464_001:0482a17	問文殊師利法王子言：「菩薩緣何事故行菩	問 文 殊 師 利 法 王 子 言 菩 薩 緣 何 事 故 行 菩 
T14n0464_001:0482a18	薩道？」文殊師利言：「汝可以此問於世尊。」	薩 道 文 殊 師 利 言 汝 可 以 此 問 於 世 尊 
T14n0464_001:0482a19	佛即告文殊師利：「汝答月淨光德天子所問	佛 即 告 文 殊 師 利 汝 答 月 淨 光 德 天 子 所 問 
T14n0464_001:0482a20	行法。」文殊師利謂天子言：「汝可善聽，我今	行 法 文 殊 師 利 謂 天 子 言 汝 可 善 聽 我 今 
T14n0464_001:0482a21	當說。天子當知，諸菩薩道，以大悲為本，緣於	當 說 天 子 當 知 諸 菩 薩 道 以 大 悲 為 本 緣 於 
T14n0464_001:0482a22	眾生。」天子言：「菩薩大悲以何為本？」文殊師	眾 生 天 子 言 菩薩大悲 以 何 為 本 文 殊 師 
T14n0464_001:0482a23	利言：「以直心為本。」又問：「直心以何為本？」	利 言 以 直 心 為 本 又 問 直 心 以 何 為 本 
T14n0464_001:0482a24	答言：「於一切眾生等心為本。」又問：「等心	答 言 於 一 切 眾 生 等 心 為 本 又 問 等 心 
T14n0464_001:0482a25	以何為本？」答言：「無別異行為本。」又問：「無別	以 何 為 本 答 言 無 別 異 行 為 本 又 問 無 別 
T14n0464_001:0482a26	異行以何為本。」答言：「以深淨心為本。」又	異 行 以 何 為 本 答 言 以 深 淨 心 為 本 又 
T14n0464_001:0482a27	問：「深淨心以何為本？」答言：「以阿耨多羅三	問 深 淨 心 以 何 為 本 答 言 以 阿 耨 多 羅 三 
T14n0464_001:0482a28	藐三菩提心為本。」又問：「阿耨多羅三藐三菩	藐 三 菩 提 心 為 本 又 問 阿 耨 多 羅 三 藐 三 菩 
T14n0464_001:0482a29	提心以何為本？」答言：「以六波羅蜜為本。」又	提 心 以 何 為 本 答 言 以 六波羅蜜 為 本 又 
T14n0464_001:0482b01	問：「六波羅蜜以何為本。」答言：「方便慧為本。」	問 六波羅蜜 以 何 為 本 答 言 方 便 慧 為 本 
T14n0464_001:0482b02	又問：「方便慧以何為本？」答言：「不放逸為本。」	又 問 方 便 慧 以 何 為 本 答 言 不 放 逸 為 本 
T14n0464_001:0482b03	又問：「不放逸以何為本？」答言：「三善行為本。」	又 問 不 放 逸 以 何 為 本 答 言 三 善 行 為 本 
T14n0464_001:0482b04	又問：「三善行以何為本？」答言：「以十善業道為	又 問 三 善 行 以 何 為 本 答 言 以 十善業道 為 
T14n0464_001:0482b05	本。」又問：「十善業道以何為本？」答言：「以攝六根	本 又 問 十善業道 以 何 為 本 答 言 以 攝 六 根 
T14n0464_001:0482b06	為本。」又問：「攝六根以何為本？」答言：「以正憶念	為 本 又 問 攝 六 根 以 何 為 本 答 言 以 正 憶 念 
T14n0464_001:0482b07	為本。」又問：「正憶念以何為本？」答言：「以正觀	為 本 又 問 正 憶 念 以 何 為 本 答 言 以 正 觀 
T14n0464_001:0482b08	為本。」又問：「正觀以何為本？」答言：「以堅念不	為 本 又 問 正 觀 以 何 為 本 答 言 以 堅 念 不 
T14n0464_001:0482b09	忘為本。」	忘 為 本 
T14n0464_001:0482b10	天子言：「文殊師利！菩薩有幾心，能攝因、能攝	天 子 言 文 殊 師 利 菩 薩 有 幾 心 能 攝 因 能 攝 
T14n0464_001:0482b11	果？」文殊師利言：「天子！諸菩薩有四心，能攝因、	果 文 殊 師 利 言 天 子 諸 菩 薩 有 四 心 能 攝 因 
T14n0464_001:0482b12	能攝果。何等為四？一者初發心，二者行道	能 攝 果 何 等 為 四 一 者 初 發 心 二 者 行 道 
T14n0464_001:0482b13	心，三者不退轉心，四者一生補處心。初發心，	心 三 者 不 退 轉 心 四 者 一生補處 心 初 發 心 
T14n0464_001:0482b14	為行道心作因緣；行道心，為不退轉心作因	為 行 道 心 作 因 緣 行 道 心 為 不 退 轉 心 作 因 
T14n0464_001:0482b15	緣；不退轉心，為一生補處心作因緣。	緣 不 退 轉 心 為 一生補處 心 作 因 緣 
T14n0464_001:0482b16	「復次，天子當知，初發心如種穀田中，行道心	 復 次 天 子 當 知 初 發 心 如 種 穀 田 中 行 道 心 
T14n0464_001:0482b17	如穀子增長，不退轉心如華果始成，補處心	如 穀 子 增 長 不 退 轉 心 如 華 果 始 成 補 處 心 
T14n0464_001:0482b18	如花果有用。又初發心如車匠集材，行道心	如 花 果 有 用 又 初 發 心 如 車 匠 集 材 行 道 心 
T14n0464_001:0482b19	如釿治材木，不退轉心如安施材木，一生	如 釿 治 材 木 不 退 轉 心 如 安 施 材 木 一 生 
T14n0464_001:0482b20	補處心如車成運致。又初發心如月新生，行	補 處 心 如 車 成 運 致 又 初 發 心 如 月 新 生 行 
T14n0464_001:0482b21	道心如月五日，不退轉心如月十日，一生補	道 心 如 月 五 日 不 退 轉 心 如 月 十 日 一 生 補 
T14n0464_001:0482b22	處心如月十四日，如來智慧如月十五日。又	處 心 如 月 十 四 日 如來智慧 如 月十五日 又 
T14n0464_001:0482b23	初發心能過聲聞地，行道心能過辟支佛地，	初 發 心 能 過 聲 聞 地 行 道 心 能 過 辟支佛地 
T14n0464_001:0482b24	不退轉心能過不定地，一生補處心安住定	不 退 轉 心 能 過 不 定 地 一生補處 心 安 住 定 
T14n0464_001:0482b25	地。又初發心如學初章，行道心如學第二章，	地 又 初 發 心 如 學 初 章 行 道 心 如 學 第 二 章 
T14n0464_001:0482b26	不退轉心如能以章為用，一生補處心如通	不 退 轉 心 如 能 以 章 為 用 一生補處 心 如 通 
T14n0464_001:0482b27	達深經。又初發心從因生，行道心從智生，	達 深 經 又 初 發 心 從 因 生 行 道 心 從 智 生 
T14n0464_001:0482b28	不退轉心從斷生，補處心從果生。又初發心	不 退 轉 心 從 斷 生 補 處 心 從 果 生 又 初 發 心 
T14n0464_001:0482b29	因勢力，行道心智勢力，不退轉心斷勢力，	因 勢 力 行 道 心 智 勢 力 不 退 轉 心 斷 勢 力 
T14n0464_001:0482c01	補處心果勢力。又初發心如病者求藥，行	補 處 心 果 勢 力 又 初 發 心 如 病 者 求 藥 行 
T14n0464_001:0482c02	道心如分別藥，不退轉心如病服藥，補處心	道 心 如 分 別 藥 不 退 轉 心 如 病 服 藥 補 處 心 
T14n0464_001:0482c03	如病得差。又初發心法王家生，行道心學	如 病 得 差 又 初 發 心 法 王 家 生 行 道 心 學 
T14n0464_001:0482c04	法王法，不退轉心能具足學法王法；補處心	法 王 法 不 退 轉 心 能 具 足 學 法 王 法 補 處 心 
T14n0464_001:0482c05	學法王法能得自在。」	學 法 王 法 能 得 自 在 
T14n0464_001:0482c06	爾時大眾中，有天子名定光明主，不退轉於	爾 時 大 眾 中 有 天 子 名 定 光 明 主 不 退 轉 於 
T14n0464_001:0482c07	阿耨多羅三藐三菩提。定光明主天子，語文	阿耨多羅三藐三菩提 定 光 明 主 天 子 語 文 
T14n0464_001:0482c08	殊師利法王子言：「何等是菩薩摩訶薩略道？	殊 師 利 法 王 子 言 何 等 是 菩薩摩訶薩 略 道 
T14n0464_001:0482c09	以是略道，疾得阿耨多羅三藐三菩提。」文殊	以 是 略 道 疾 得阿耨多羅三藐三菩提 文 殊 
T14n0464_001:0482c10	師利言：「天子！菩薩摩訶薩略道有二，以是	師 利 言 天 子 菩薩摩訶薩 略 道 有 二 以 是 
T14n0464_001:0482c11	略道，疾得阿耨多羅三藐三菩提。何等為二？	略 道 疾 得阿耨多羅三藐三菩提 何 等 為 二 
T14n0464_001:0482c12	一者方便，二者慧。攝善法名為方便，分	一 者 方 便 二 者 慧 攝 善 法 名 為 方 便 分 
T14n0464_001:0482c13	散諸法名為慧；又方便名為隨眾生行，慧名	散 諸 法 名 為 慧 又 方 便 名 為 隨 眾 生 行 慧 名 
T14n0464_001:0482c14	不轉一切法相；方便名待應眾生心，慧名不	不 轉 一 切 法 相 方 便 名 待 應 眾 生 心 慧 名 不 
T14n0464_001:0482c15	待一切法；方便名和合諸法，慧名捨離諸法；	待 一 切 法 方 便 名 和 合 諸 法 慧 名 捨 離 諸 法 
T14n0464_001:0482c16	方便名起因緣，慧名滅因緣；方便名知分別	方 便 名 起 因 緣 慧 名 滅 因 緣 方 便 名 知 分 別 
T14n0464_001:0482c17	諸法，慧名不分別法性；方便名莊嚴佛土，	諸 法 慧 名 不 分 別 法 性 方 便 名 莊 嚴 佛 土 
T14n0464_001:0482c18	慧名莊嚴佛土無所分別；方便名知眾生諸	慧 名 莊 嚴 佛 土 無所分別 方 便 名 知 眾 生 諸 
T14n0464_001:0482c19	根利鈍，慧名不得眾生；方便名能至道場，	根 利 鈍 慧 名 不 得 眾 生 方 便 名 能 至 道 場 
T14n0464_001:0482c20	慧名能得一切佛法。「天子當知，菩薩摩訶薩	慧 名 能 得 一切佛法 天 子 當 知 菩薩摩訶薩 
T14n0464_001:0482c21	復有二道，以是二道疾得阿耨多羅三藐三	復 有 二 道 以 是 二 道 疾 得 阿 耨 多 羅 三 藐 三 
T14n0464_001:0482c22	菩提。何等為二？一者助道，二者斷道。助道	菩 提 何 等 為 二 一 者 助 道 二 者 斷 道 助 道 
T14n0464_001:0482c23	者五波羅蜜，斷道者般若波羅蜜。「復有二	者 五波羅蜜 斷 道 者 般 若 波 羅 蜜 復 有 二 
T14n0464_001:0482c24	道。何等為二？一者有繫道，二者無繫道。有繫	道 何 等 為 二 一 者 有 繫 道 二 者 無 繫 道 有 繫 
T14n0464_001:0482c25	道者五波羅蜜，無繫道者般若波羅蜜。「復	道 者 五波羅蜜 無 繫 道 者 般 若 波 羅 蜜 復 
T14n0464_001:0482c26	有二道，一者有量道，二者無量道。有量道者	有 二 道 一 者 有 量 道 二 者 無 量 道 有 量 道 者 
T14n0464_001:0482c27	取相分別，無量道者不取相分別。「復有二道，	取 相 分 別 無 量 道 者 不 取 相 分 別 復 有 二 道 
T14n0464_001:0482c28	一者智道，二者斷道。智道者，初地至七地，	一 者 智 道 二 者 斷 道 智 道 者 初 地 至 七 地 
T14n0464_001:0482c29	斷道者，八地至十地。」	斷 道 者 八 地 至 十 地 
T14n0464_001:0483a01	爾時會中有菩薩名隨智勇行，問文殊師利	爾 時 會 中 有 菩 薩 名 隨 智 勇 行 問 文 殊 師 利 
T14n0464_001:0483a02	法王子言：「何謂為菩薩義？何謂為菩薩智？」文	法 王 子 言 何 謂 為 菩 薩 義 何 謂 為 菩 薩 智 文 
T14n0464_001:0483a03	殊師利言：「善男子！義名無用，智名有用。何謂	殊 師 利 言 善 男 子 義 名 無 用 智 名 有 用 何 謂 
T14n0464_001:0483a04	義名無用？義是無為，無為法於法無用、非用。	義 名 無 用 義 是 無 為 無 為 法 於 法 無 用 非 用 
T14n0464_001:0483a05	又義者，非染相、非離相，是義於法無用非用。	又 義 者 非 染 相 非 離 相 是 義 於 法 無 用 非 用 
T14n0464_001:0483a06	又義不增不減，於法無用非用。天子，何謂為	又 義 不增不減 於 法 無 用 非 用 天 子 何 謂 為 
T14n0464_001:0483a07	智？智是忍道，是心所用非無用。是故，智名有	智 智 是 忍 道 是 心 所 用 非 無 用 是 故 智 名 有 
T14n0464_001:0483a08	用非無用。智功歸於斷，是故智名有用非	用 非 無 用 智 功 歸 於 斷 是 故 智 名 有 用 非 
T14n0464_001:0483a09	無用。智名善知五陰、十二入、十八界、十二因	無 用 智 名 善 知 五 陰 十 二 入 十 八 界 十 二 因 
T14n0464_001:0483a10	緣，是處非處，是故智名有用非無用。	緣 是處非處 是 故 智 名 有 用 非 無 用 
T14n0464_001:0483a11	「復次，天子，諸菩薩有十智。何等為十？一者	 復 次 天 子 諸 菩 薩 有 十 智 何 等 為 十 一 者 
T14n0464_001:0483a12	因智，二者果智，三者義智，四者方便智，五者	因 智 二 者 果 智 三 者 義 智 四 者 方 便 智 五 者 
T14n0464_001:0483a13	慧智，六者攝智，七者波羅蜜智，八者大悲智，	慧 智 六 者 攝 智 七 者 波 羅 蜜 智 八 者 大 悲 智 
T14n0464_001:0483a14	九者成就眾生智，十者不著一切法智。	九 者 成 就 眾 生 智 十 者 不 著 一 切 法 智 
T14n0464_001:0483a15	「復次，天子！諸菩薩有十發。何等為十？一者身	 復 次 天 子 諸 菩 薩 有 十 發 何 等 為 十 一 者 身 
T14n0464_001:0483a16	發，欲令眾生身業清淨故；二者口發，欲令眾	發 欲 令 眾 生 身 業 清 淨 故 二 者 口 發 欲 令 眾 
T14n0464_001:0483a17	生口業清淨故；三者意發，欲令眾生意業清	生 口 業 清 淨 故 三 者 意 發 欲 令 眾 生 意 業 清 
T14n0464_001:0483a18	淨故；四者內發，一切內物不貪著故；五者	淨 故 四 者 內 發 一 切 內 物 不 貪 著 故 五 者 
T14n0464_001:0483a19	外發，欲令眾生住正行故；六者智發，具足	外 發 欲 令 眾 生 住 正 行 故 六 者 智 發 具 足 
T14n0464_001:0483a20	佛智故；七者慈發，念一切功德莊嚴故；八	佛 智 故 七 者 慈 發 念 一切功德 莊 嚴 故 八 
T14n0464_001:0483a21	者眾生成熟發，守護智慧藥故；九者有為	者 眾 生 成 熟 發 守 護 智 慧 藥 故 九 者 有 為 
T14n0464_001:0483a22	智發，具足定聚故；十者無為智發，心不著	智 發 具 足 定 聚 故 十 者 無 為 智 發 心 不 著 
T14n0464_001:0483a23	三界故。	三 界 故 
T14n0464_001:0483a24	「復次，天子！諸菩薩有十行。何等為十？一者	 復 次 天 子 諸 菩 薩 有 十 行 何 等 為 十 一 者 
T14n0464_001:0483a25	波羅蜜行，二者攝行，三者慧行，四者方便	波 羅 蜜 行 二 者 攝 行 三 者 慧 行 四 者 方 便 
T14n0464_001:0483a26	行，五者大悲行，六者求助慧法行，七者求	行 五 者 大 悲 行 六 者 求 助 慧 法 行 七 者 求 
T14n0464_001:0483a27	智法行，八者心清淨行，九者觀諸諦行，十	智 法 行 八 者 心 清 淨 行 九 者 觀 諸 諦 行 十 
T14n0464_001:0483a28	者一切所愛無貪著行。	者 一 切 所 愛 無 貪 著 行 
T14n0464_001:0483a29	「復次，天子！諸菩薩復有十思惟盡。何等為	 復 次 天 子 諸 菩 薩 復 有 十 思 惟 盡 何 等 為 
T14n0464_001:0483b01	十？一者思惟事盡，二者思惟受盡，三者思	十 一 者 思 惟 事 盡 二 者 思 惟 受 盡 三 者 思 
T14n0464_001:0483b02	惟法盡，四者思惟煩惱盡，五者思惟見盡，六	惟 法 盡 四 者 思 惟 煩 惱 盡 五 者 思 惟 見 盡 六 
T14n0464_001:0483b03	者思惟邪盡，七者思惟愛盡，八者思惟	者 思 惟 邪 盡 七 者 思 惟 愛 盡 八 者 思 惟 
T14n0464_001:0483b04	不著盡，九者思惟結使盡，十者思惟著道	不 著 盡 九 者 思 惟 結 使 盡 十 者 思 惟 著 道 
T14n0464_001:0483b05	場行盡。	場 行 盡 
T14n0464_001:0483b06	「復次，天子！諸菩薩復有十治法。何等為十？	 復 次 天 子 諸 菩 薩 復 有 十 治 法 何 等 為 十 
T14n0464_001:0483b07	一者治慳貪心，雨布施雨故；二者治破戒心，	一 者 治 慳 貪 心 雨 布 施 雨 故 二 者 治 破 戒 心 
T14n0464_001:0483b08	三法清淨故；三者治瞋恚心修行慈忍故；四	三 法 清 淨 故 三 者 治 瞋 恚 心 修 行 慈 忍 故 四 
T14n0464_001:0483b09	者治懈怠心，求佛法無厭故；五者治不善覺	者 治 懈 怠 心 求 佛 法 無 厭 故 五 者 治 不 善 覺 
T14n0464_001:0483b10	觀心，得禪定解脫自在故；六者治愚癡心，生	觀 心 得 禪 定 解 脫 自 在 故 六 者 治 愚 癡 心 生 
T14n0464_001:0483b11	助決定般若波羅蜜法故；七者治諸煩惱心，	助 決 定 般 若 波 羅 蜜 法 故 七 者 治 諸 煩 惱 心 
T14n0464_001:0483b12	生助道法故；八者治顛倒道心，修助四諦法	生 助 道 法 故 八 者 治 顛 倒 道 心 修 助 四 諦 法 
T14n0464_001:0483b13	故；九者治心時、非時自在行故；十者治我觀	故 九 者 治 心 時 非 時 自 在 行 故 十 者 治 我 觀 
T14n0464_001:0483b14	無我法故。	無 我 法 故 
T14n0464_001:0483b15	「復次，天子！諸菩薩復有十善地。何等為十？	 復 次 天 子 諸 菩 薩 復 有 十 善 地 何 等 為 十 
T14n0464_001:0483b16	一者，身善離身三惡故；二者，口善離口四惡	一 者 身 善 離 身 三 惡 故 二 者 口 善 離 口 四 惡 
T14n0464_001:0483b17	故；三者，意善離心三惡故；四者，內善不著	故 三 者 意 善 離 心 三 惡 故 四 者 內 善 不 著 
T14n0464_001:0483b18	見身故；五者，外善不著一切法故；六者，不	見 身 故 五 者 外 善 不 著 一 切 法 故 六 者 不 
T14n0464_001:0483b19	著助智善，不貪助道法故；七者不自高，善思	著 助 智 善 不 貪 助 道 法 故 七 者 不 自 高 善 思 
T14n0464_001:0483b20	惟聖道性故；八者除身善，修集般若波羅蜜	惟 聖 道 性 故 八 者 除 身 善 修 集 般 若 波 羅 蜜 
T14n0464_001:0483b21	故；九者離倒善，不誑一切眾生故；十者不	故 九 者 離 倒 善 不 誑 一 切 眾 生 故 十 者 不 
T14n0464_001:0483b22	惜身命，善以大悲化眾生故。	惜 身 命 善 以 大 悲 化 眾 生 故 
T14n0464_001:0483b23	「復次，天子！諸菩薩貴隨法行者，能得菩提，非	 復 次 天 子 諸 菩 薩 貴 隨 法 行 者 能 得 菩 提 非 
T14n0464_001:0483b24	不貴隨法行。隨法行者，如說能行。不隨法行	不 貴 隨 法 行 隨 法 行 者 如 說 能 行 不 隨 法 行 
T14n0464_001:0483b25	者，但有言說，不能如所說行。	者 但有言說 不 能 如 所 說 行 
T14n0464_001:0483b26	「復次，天子！諸菩薩復有二隨法行。何等為二？	 復 次 天 子 諸 菩 薩 復 有 二 隨 法 行 何 等 為 二 
T14n0464_001:0483b27	一者行道，二者行斷。復有二隨法行。何等為	一 者 行 道 二 者 行 斷 復 有 二 隨 法 行 何 等 為 
T14n0464_001:0483b28	二？一者身自修行善，二者教化眾生。復有	二 一 者 身 自 修 行 善 二 者 教 化 眾 生 復 有 
T14n0464_001:0483b29	二隨法行。何等為二？一者行智行，二者不	二 隨 法 行 何 等 為 二 一 者 行 智 行 二 者 不 
T14n0464_001:0483c01	行智行。復有二隨法行。何等為二？一者善	行 智 行 復 有 二 隨 法 行 何 等 為 二 一 者 善 
T14n0464_001:0483c02	分別諸地，二者不分別地非地。復有二隨法	分 別 諸 地 二 者 不 分 別 地 非 地 復 有 二 隨 法 
T14n0464_001:0483c03	行。何等為二？一者知諸地過，而能轉進；二	行 何 等 為 二 一 者 知 諸 地 過 而 能 轉 進 二 
