T16n0679_001:0720b01	若違背道迹譏訶毀呰，復於我所起恚害心，	若 違 背 道 迹 譏 訶 毀 呰 復 於 我 所 起 恚 害 心 
T16n0679_001:0720b02	若命終時彼一切處得一切下劣身。以是故，	若 命 終 時 彼 一 切 處 得 一 切 下 劣 身 以 是 故 
T16n0679_001:0720b03	文殊師利！當知非但由如來神力建立得自	文 殊 師 利 當 知 非 但 由 如來神力 建 立 得 自 
T16n0679_001:0720b04	身具足，亦有由於如來所起恚害心得下劣	身 具 足 亦 有 由 於 如 來 所 起 恚 害 心 得 下 劣 
T16n0679_001:0720b05	身。」文殊師利白佛言：「世尊！不淨佛國，何者	身 文 殊 師 利 白 佛 言 世 尊 不 淨 佛 國 何 者 
T16n0679_001:0720b06	難得易得耶？清淨佛國，何者難得易得耶？」	難 得 易 得 耶 清 淨 佛 國 何 者 難 得 易 得 耶 
T16n0679_001:0720b07	佛告文殊師利：「不淨佛國，八事易得，二事難	佛 告 文 殊 師 利 不 淨 佛 國 八 事 易 得 二 事 難 
T16n0679_001:0720b08	得，所謂外道，貧窮眾生，生下姓家，具足不具	得 所 謂 外 道 貧 窮 眾 生 生 下 姓 家 具 足 不 具 
T16n0679_001:0720b09	足，壞行諸惡行，犯戒，惡趣，下劣悕望方便	足 壞 行 諸 惡 行 犯 戒 惡 趣 下 劣 悕 望 方 便 
T16n0679_001:0720b10	行菩薩，是名八事易得；勝悕望方便行，菩	行 菩 薩 是 名 八 事 易 得 勝 悕 望 方 便 行 菩 
T16n0679_001:0720b11	薩及如來出世，是名二事難得。文殊師利！	薩 及 如 來 出 世 是 名 二 事 難 得 文 殊 師 利 
T16n0679_001:0720b12	清淨佛國與上相違，八事難得二事易得。」	清 淨 佛 國 與 上 相 違 八 事 難 得 二 事 易 得 
T16n0679_001:0720b13	爾時文殊師利白佛言：「世尊！《相續解脫經》中，	爾 時 文 殊 師 利 白 佛 言 世 尊 相 續 解 脫 經 中 
T16n0679_001:0720b14	此經何名？云何奉持？」佛告文殊師利：「此經名	此 經 何 名 云 何 奉 持 佛 告 文 殊 師 利 此 經 名 
T16n0679_001:0720b15	『如來所作隨順處了義說』，如是奉持。」說是如	 如來所作 隨 順 處 了 義 說 如 是 奉 持 說 是 如 
T16n0679_001:0720b16	來所作隨順處了義說經時，七萬五千菩薩	來 所 作 隨 順 處 了 義 說 經 時 七萬五千 菩 薩 
T16n0679_001:0720b17	得分別滿足法身三昧。	得 分 別 滿 足 法 身 三 昧 
T16n0679_001:0720b18	如來所作隨順處了義說經	如來所作 隨 順 處 了 義 說 經 
