T16n0679_001:0718a24	相續解脫如來所作隨順處了義	相 續 解 脫 如來所作 隨 順 處 了 義 
T16n0679_001:0718a25	經	經 
T16n0679_001:0718a27	如《相續解脫經》說：文殊師利白佛言：「世尊！世	如 相 續 解 脫 經 說 文 殊 師 利 白 佛 言 世 尊 世 
T16n0679_001:0718a28	尊所說如來法身，如來法身有何相？」佛告文殊	尊 所 說 如來法身 如來法身 有 何 相 佛 告 文 殊 
T16n0679_001:0718a29	師利：「地波羅蜜，善修習乘身轉集成，文殊師	師 利 地 波 羅 蜜 善 修 習 乘 身 轉 集 成 文 殊 師 
T16n0679_001:0718b01	利！是如來法身相。當知復有不可思議相，有	利 是 如來法身 相 當 知 復 有 不可思議 相 有 
T16n0679_001:0718b02	二因緣，謂彼離虛偽、無行；眾生計著虛偽行。」	二 因 緣 謂 彼 離 虛 偽 無 行 眾 生 計 著 虛 偽 行 
T16n0679_001:0718b03	文殊師利白佛言：「世尊！聲聞、緣覺身轉，亦是	文 殊 師 利 白 佛 言 世 尊 聲 聞 緣 覺 身 轉 亦 是 
T16n0679_001:0718b04	法身耶？」佛告文殊師利：「不名法身。」文殊師利	法 身 耶 佛 告 文 殊 師 利 不 名 法 身 文 殊 師 利 
T16n0679_001:0718b05	白佛言：「世尊！名何等身？」佛告文殊師利：「名解	白 佛 言 世 尊 名 何 等 身 佛 告 文 殊 師 利 名 解 
T16n0679_001:0718b06	脫身(五分法身名解脫，梵音云毘尼木叉，涅槃解脫梵音云木叉也)。文殊師利！	脫 身 五分法身 名 解 脫 梵 音 云 毘 尼 木 叉 涅 槃 解 脫 梵 音 云 木 叉 也 文 殊 師 利 
T16n0679_001:0718b07	解脫身者，聲聞、緣覺；諸如來等，唯法身差	解 脫 身 者 聲 聞 緣 覺 諸 如 來 等 唯 法 身 差 
T16n0679_001:0718b08	別。法身差別者，謂無量功德殊勝奇特，不可	別 法 身 差 別 者 謂 無量功德 殊 勝 奇 特 不 可 
T16n0679_001:0718b09	為譬。」文殊師利白佛言：「世尊！如來因起有何	為 譬 文 殊 師 利 白 佛 言 世 尊 如 來 因 起 有 何 
T16n0679_001:0718b10	相？」佛告文殊師利：「化身相如世界起一切種	相 佛 告 文 殊 師 利 化 身 相 如 世 界 起 一 切 種 
T16n0679_001:0718b11	如來功德，及清淨莊嚴住相。當知化身相起，	如 來 功 德 及 清 淨 莊 嚴 住 相 當 知 化 身 相 起 
T16n0679_001:0718b12	法身無起。」文殊師利白佛言：「世尊！以何等巧	法 身 無 起 文 殊 師 利 白 佛 言 世 尊 以 何 等 巧 
T16n0679_001:0718b13	方便示現化身？」佛告文殊師利：「一切三千大	方 便 示 現 化 身 佛 告 文 殊 師 利 一 切 三 千 大 
T16n0679_001:0718b14	千諸佛世界，增上主家生，福田家生，入胎出	千 諸 佛 世 界 增 上 主 家 生 福 田 家 生 入 胎 出 
T16n0679_001:0718b15	胎生，長受五欲，出家苦行，往詣道場，菩提樹	胎 生 長 受 五 欲 出 家 苦 行 往 詣 道 場 菩 提 樹 
T16n0679_001:0718b16	下降魔成佛，轉法輪已，現般涅槃，當知是示	下 降 魔 成 佛 轉 法 輪 已 現般涅槃 當 知 是 示 
T16n0679_001:0718b17	現化身巧方便。」	現 化 身 巧 方 便 
T16n0679_001:0718b18	文殊師利白佛言：「世尊！如來化身幾種語為	文 殊 師 利 白 佛 言 世 尊 如 來 化 身 幾 種 語 為 
T16n0679_001:0718b19	眾生說法，諸未熟者調伏令熟，已熟者令於	眾 生 說 法 諸 未 熟 者 調 伏 令 熟 已 熟 者 令 於 
T16n0679_001:0718b20	緣解脫？」	緣 解 脫 
T16n0679_001:0718b21	佛告文殊師利：「如來語者，說修多羅語、毘尼	佛 告 文 殊 師 利 如 來 語 者 說 修 多 羅 語 毘 尼 
T16n0679_001:0718b22	語、摩德勒伽語。」文殊師利白佛言：「世尊！云	語 摩德勒伽 語 文 殊 師 利 白 佛 言 世 尊 云 
T16n0679_001:0718b23	何修多羅？云何毘尼？云何摩德勒伽？」	何 修 多 羅 云 何 毘 尼 云 何 摩德勒伽 
T16n0679_001:0718b24	佛告文殊師利：「若我說諸法，攝事分齊，名修	佛 告 文 殊 師 利 若 我 說 諸 法 攝 事 分 齊 名 修 
T16n0679_001:0718b25	多羅，謂因四事、九事、二十九事，如是四十二	多 羅 謂 因 四 事 九 事 二 十 九 事 如 是 四 十 二 
T16n0679_001:0718b26	事。何等四事？謂聞事、歸依事、戒事、菩薩事。	事 何 等 四 事 謂 聞 事 歸 依 事 戒 事 菩 薩 事 
T16n0679_001:0718b27	何等九事？謂施設眾生事、受用事、彼因起事、	何 等 九 事 謂 施 設 眾 生 事 受 用 事 彼 因 起 事 
T16n0679_001:0718b28	起已住事、彼滅事、彼種種事、說事、所說事、	起 已 住 事 彼 滅 事 彼 種 種 事 說 事 所 說 事 
T16n0679_001:0718b29	徒眾事。何等二十九事？謂從染污分行攝事，	徒 眾 事 何 等 二 十 九 事 謂 從 染 污 分 行 攝 事 
T16n0679_001:0718c01	彼主漸次隨起事，彼作如是人想已未來生	彼 主 漸 次 隨 起 事 彼 作 如 是 人 想 已 未 來 生 
T16n0679_001:0718c02	因事，作法想已未來生因事，從清淨分緣中	因 事 作 法 想 已 未 來 生 因 事 從 清 淨 分 緣 中 
T16n0679_001:0718c03	繫念事，於彼決定事，心住事，現法樂住事，起	繫 念 事 於 彼 決 定 事 心 住 事 現法樂住 事 起 
T16n0679_001:0718c04	一切苦緣方便事，彼斷知事——彼亦三種，謂顛	一 切 苦 緣 方 便 事 彼 斷 知 事 彼 亦 三 種 謂 顛 
T16n0679_001:0718c05	倒處斷知、從眾生想外眾生邪向處斷知、內	倒 處 斷 知 從 眾 生 想 外 眾 生 邪 向 處 斷 知 內 
T16n0679_001:0718c06	離增上慢處斷知——修處事，作證事，修事，彼所	離 增 上 慢 處 斷 知 修 處 事 作 證 事 修 事 彼 所 
T16n0679_001:0718c07	作堅固事，彼行事，彼緣事，斷不斷觀察巧便	作 堅 固 事 彼 行 事 彼 緣 事 斷 不 斷 觀 察 巧 便 
T16n0679_001:0718c08	事，彼散亂事，彼不散亂事，不散亂處事，修	事 彼 散 亂 事 彼 不 散 亂 事 不 散 亂 處 事 修 
T16n0679_001:0718c09	習無厭方便不捨所作事，修福利事，彼堅固	習 無 厭 方 便 不 捨 所 作 事 修 福 利 事 彼 堅 固 
T16n0679_001:0718c10	修事，真實覺知事，到涅槃事，善說法律世俗	修 事 真 實 覺 知 事 到 涅 槃 事 善 說 法 律 世 俗 
T16n0679_001:0718c11	正見得一切內外正見頂事，彼修退事。文殊	正 見 得 一 切 內 外 正 見 頂 事 彼 修 退 事 文 殊 
T16n0679_001:0718c12	師利！彼善說法律不修習退非見過。	師 利 彼 善 說 法 律 不 修 習 退 非 見 過 
T16n0679_001:0718c13	「文殊師利！若我為弟子——聲聞、菩薩——說波羅提	 文 殊 師 利 若 我 為 弟 子 聲 聞 菩 薩 說 波 羅 提 
T16n0679_001:0718c14	木叉，波羅提木叉相應學，是名毘尼事。」文殊	木 叉 波羅提木叉 相 應 學 是 名 毘 尼 事 文 殊 
T16n0679_001:0718c15	師利白佛言：「菩薩有幾種波羅提木叉？」佛告	師 利 白 佛 言 菩 薩 有 幾 種 波羅提木叉 佛 告 
T16n0679_001:0718c16	文殊師利：「有七種：一者說受威儀、二者說波	文 殊 師 利 有 七 種 一 者 說 受 威 儀 二 者 說 波 
T16n0679_001:0718c17	羅夷處事、三者說犯自性、四者說不犯自性、	羅 夷 處 事 三 者 說 犯 自 性 四 者 說 不 犯 自 性 
T16n0679_001:0718c18	五者說出犯、六者說受律儀、七者說捨律儀。	五 者 說 出 犯 六 者 說 受 律 儀 七 者 說 捨 律 儀 
T16n0679_001:0718c19	「文殊師利！有十一種相，宣通分別廣說顯示，	 文 殊 師 利 有 十 一 種 相 宣 通 分 別 廣 說 顯 示 
T16n0679_001:0718c20	是名摩德勒伽。云何十一種相？一者等相、二	是 名 摩德勒伽 云 何 十 一 種 相 一 者 等 相 二 
T16n0679_001:0718c21	者第一義相、三者菩提分法攀緣相、四者行	者 第 一 義 相 三 者 菩提分法 攀 緣 相 四 者 行 
T16n0679_001:0718c22	相、五者果相、六者神力顯示相、七者自性相、	相 五 者 果 相 六 者 神 力 顯 示 相 七 者 自 性 相 
T16n0679_001:0718c23	八者彼持相、九者彼順法相、十者彼患相、十	八 者 彼 持 相 九 者 彼 順 法 相 十 者 彼 患 相 十 
T16n0679_001:0718c24	一者彼利相。「文殊師利！等相者，說人、說妄想	一 者 彼 利 相 文 殊 師 利 等 相 者 說 人 說 妄 想 
T16n0679_001:0718c25	自性、說諸法動作業事。第一義相者，說七種。	自 性 說 諸 法 動 作 業 事 第 一 義 相 者 說 七 種 
T16n0679_001:0718c26	如緣相者，說一切種爾焰事。行相者，說八行觀	如 緣 相 者 說 一 切 種 爾 焰 事 行 相 者 說 八 行 觀 
T16n0679_001:0718c27	察。何等八行觀察？一者諦、二者立、三者過、	察 何 等 八 行 觀 察 一 者 諦 二 者 立 三 者 過 
T16n0679_001:0718c28	四者德、五者通、六者生、七者成、八者略廣。	四 者 德 五 者 通 六 者 生 七 者 成 八 者 略 廣 
T16n0679_001:0718c29	諦者如。立者建立眾生等，若建立妄想自性，	諦 者 如 立 者 建 立 眾 生 等 若 建 立 妄 想 自 性 
T16n0679_001:0719a01	若建立一向分別詰問置答，若建立隱覆顯	若 建 立 一 向 分 別 詰 問 置 答 若 建 立 隱 覆 顯 
T16n0679_001:0719a02	現記說。過者我於煩惱法無量因緣說過患。	現 記 說 過 者 我 於 煩 惱 法 無 量 因 緣 說 過 患 
T16n0679_001:0719a03	德者我於清淨無量因緣說福利。通者有六	德 者 我 於 清 淨 無 量 因 緣 說 福 利 通 者 有 六 
T16n0679_001:0719a04	種：一者真實義通、二者得通、三者說通、四者	種 一 者 真 實 義 通 二 者 得 通 三 者 說 通 四 者 
T16n0679_001:0719a05	離二邊通、五者不可思議通、六者意通。生者	離 二 邊 通 五 者 不可思議 通 六 者 意 通 生 者 
T16n0679_001:0719a06	謂三禪、三有為相及四緣。成者有四種：一者	謂 三 禪 三 有 為 相 及 四 緣 成 者 有 四 種 一 者 
T16n0679_001:0719a07	以有成、二者所作事成、三者助成、四者法成。	以 有 成 二 者 所 作 事 成 三 者 助 成 四 者 法 成 
T16n0679_001:0719a08	若因若緣諸行起及隨說，是名以有成。若因	若 因 若 緣 諸 行 起 及 隨 說 是 名 以 有 成 若 因 
T16n0679_001:0719a09	若緣，諸法若得若成，若已起者作所作，是名	若 緣 諸 法 若 得 若 成 若 已 起 者 作 所 作 是 名 
T16n0679_001:0719a10	所作事成。若因若緣，或宗或說或授或義，而	所 作 事 成 若 因 若 緣 或 宗 或 說 或 授 或 義 而 
T16n0679_001:0719a11	成之覺之，彼復略說二種：一者淨，二者不淨。	成 之 覺 之 彼 復 略 說 二 種 一 者 淨 二 者 不 淨 
T16n0679_001:0719a12	淨有五種相，不淨有七種相。何等為五淨相？	淨 有 五 種 相 不 淨 有 七 種 相 何 等 為 五 淨 相 
T16n0679_001:0719a13	一者彼現前得相，二者彼依現前得相，三者	一 者 彼 現 前 得 相 二 者 彼 依 現 前 得 相 三 者 
T16n0679_001:0719a14	自種比相，四者成相，五者快淨語說相，一切	自 種 比 相 四 者 成 相 五 者 快 淨 語 說 相 一 切 
T16n0679_001:0719a15	行無常，一切行苦，一切法無我，若世間現前	行 無 常 一切行苦 一切法無我 若 世 間 現 前 
T16n0679_001:0719a16	得如是等，名現前得相。一切行剎那，故有他	得 如 是 等 名 現 前 得 相 一 切 行 剎 那 故 有 他 
T16n0679_001:0719a17	世及淨不淨業不壞，若依現見麁無常故得，	世 及 淨不淨業 不 壞 若 依 現 見 麁 無 常 故 得 
T16n0679_001:0719a18	若依現見種種眾生及種種業故得，若依現	若 依 現 見 種 種 眾 生 及 種 種 業 故 得 若 依 現 
T16n0679_001:0719a19	見苦樂眾生淨不淨業故得，以此比類得不	見 苦 樂 眾 生 淨不淨業 故 得 以 此 比 類 得 不 
T16n0679_001:0719a20	現前，如是等名彼依現前得相。若復內外諸	現 前 如 是 等 名 彼 依 現 前 得 相 若 復 內 外 諸 
T16n0679_001:0719a21	行，一切世間緣起沒生得，如是比苦等得，	行 一切世間 緣 起 沒 生 得 如 是 比 苦 等 得 
T16n0679_001:0719a22	如是比不自在得，如是比外世間緣起成敗	如 是 比 不 自 在 得 如 是 比 外 世 間 緣 起 成 敗 
T16n0679_001:0719a23	得，如是比如是等，名自種比相。彼現前得相，	得 如 是 比 如 是 等 名 自 種 比 相 彼 現 前 得 相 
T16n0679_001:0719a24	彼依現前得相，自種比相，作一向成相已，當	彼 依 現 前 得 相 自 種 比 相 作 一 向 成 相 已 當 
T16n0679_001:0719a25	知是相若廣演說，一切智所說，謂涅槃寂靜，	知 是 相 若 廣 演 說 一 切 智 所 說 謂 涅槃寂靜 
T16n0679_001:0719a26	如是等名快淨語說相。文殊師利！是故此五	如 是 等 名 快 淨 語 說 相 文 殊 師 利 是 故 此 五 
T16n0679_001:0719a27	相成清淨觀，以清淨故應當修習。」	相 成 清 淨 觀 以 清 淨 故 應 當 修 習 
T16n0679_001:0719a28	文殊師利白佛言：「世尊！一切智相有幾種？」佛	文 殊 師 利 白 佛 言 世 尊 一切智相 有 幾 種 佛 
T16n0679_001:0719a29	告文殊師利：「有五種：一者若一切智名聞出	告 文 殊 師 利 有 五 種 一 者 若 一 切 智 名 聞 出 
T16n0679_001:0719b01	于世間，二者成就三十二大人相，三者十力	于 世 間 二 者 成 就 三十二大人相 三 者 十 力 
T16n0679_001:0719b02	決斷一切眾生疑網，四者四無畏說法，一切	決 斷 一 切 眾 生 疑 網 四 者 四 無 畏 說 法 一 切 
T16n0679_001:0719b03	外論不能難問、不能屈伏，五者若彼法律知，	外 論 不 能 難 問 不 能 屈 伏 五 者 若 彼 法 律 知 
T16n0679_001:0719b04	有八聖道、四沙門果。當知此五行，是一切智	有 八 聖 道 四沙門果 當 知 此 五 行 是 一 切 智 
T16n0679_001:0719b05	相。若此助成如是現前量、比量、信言量，是名	相 若 此 助 成 如 是 現 前 量 比 量 信 言 量 是 名 
T16n0679_001:0719b06	五種快淨相。云何七種相？一者彼異相似得	五 種 快 淨 相 云 何 七 種 相 一 者 彼 異 相 似 得 
T16n0679_001:0719b07	相，二者彼異不相似得相，三者一切相似得	相 二 者 彼 異 不 相 似 得 相 三 者 一 切 相 似 得 
T16n0679_001:0719b08	相，四者一切不相似得相，五者異生比相，六	相 四 者 一 切 不 相 似 得 相 五 者 異 生 比 相 六 
T16n0679_001:0719b09	者不成相，七者不淨語說相。若彼一切法意	者 不 成 相 七 者 不 淨 語 說 相 若 彼 一 切 法 意 
T16n0679_001:0719b10	識識，是名一切相似得相。若復形自性業法	識 識 是 名 一 切 相 似 得 相 若 復 形 自 性 業 法 
T16n0679_001:0719b11	因果異相，名各各異相，決定各各異相，是名	因 果 異 相 名 各 各 異 相 決 定 各 各 異 相 是 名 
T16n0679_001:0719b12	一切不相似得相。文殊師利！彼有比異一切	一 切 不 相 似 得 相 文 殊 師 利 彼 有 比 異 一 切 
T16n0679_001:0719b13	相似得相，有一切不相似相，以彼不一向成	相 似 得 相 有 一 切 不 相 似 相 以 彼 不 一 向 成 
T16n0679_001:0719b14	故，是名不成相；又復彼有比異不相似得相，	故 是 名 不 成 相 又 復 彼 有 比 異 不 相 似 得 相 
T16n0679_001:0719b15	有一切相似相，以彼不一向成故，是名不成	有 一 切 相 似 相 以 彼 不 一 向 成 故 是 名 不 成 
T16n0679_001:0719b16	相；不成故不成清淨觀，不淨故不應習近不	相 不 成 故 不 成 清 淨 觀 不 淨 故 不 應 習 近 不 
T16n0679_001:0719b17	淨語說相者，當知是性不清淨。若如來出世、	淨 語 說 相 者 當 知 是 性 不 清 淨 若 如 來 出 世 
T16n0679_001:0719b18	若不出世，如是法住住法界，是名法成。「彼略	若 不 出 世 如 是 法 住 住 法 界 是 名 法 成 彼 略 
T16n0679_001:0719b19	廣者總說一句法漸增廣句，分別解說乃至	廣 者 總 說 一 句 法 漸 增 廣 句 分別解說 乃 至 
T16n0679_001:0719b20	究竟，若有行有攀緣決定菩提分法，我說念	究 竟 若 有 行 有 攀 緣 決 定 菩提分法 我 說 念 
T16n0679_001:0719b21	處等，是名自性相。世間出世間道共，斷諸煩	處 等 是 名 自 性 相 世間出世間 道 共 斷 諸 煩 
T16n0679_001:0719b22	惱，招引世間出世間功德果，是名彼得果相。	惱 招 引 世間出世間 功 德 果 是 名 彼 得 果 相 
T16n0679_001:0719b23	若彼解脫智知，廣為眾生演說顯示，是名神	若 彼 解 脫 智 知 廣 為 眾 生 演 說 顯 示 是 名 神 
T16n0679_001:0719b24	力顯示相。如是修菩提分法，彼違道處染污，	力 顯 示 相 如 是 修 菩提分法 彼 違 道 處 染 污 
T16n0679_001:0719b25	是名障法相；彼多利益，是名順法相。若障過，	是 名 障 法 相 彼 多 利 益 是 名 順 法 相 若 障 過 
T16n0679_001:0719b26	是名過患相；若隨順功德，是名利相。」	是 名 過 患 相 若 隨 順 功 德 是 名 利 相 
T16n0679_001:0719b27	爾時文殊師利白佛言：「世尊！唯願更為諸菩	爾 時 文 殊 師 利 白 佛 言 世 尊 唯 願 更 為 諸 菩 
T16n0679_001:0719b28	薩眾，說修多羅、毘尼、摩德勒伽略受持義，	薩 眾 說 修 多 羅 毘 尼 摩德勒伽 略 受 持 義 
T16n0679_001:0719b29	不與一切諸外道共，令諸菩薩，於如來所說	不 與 一 切 諸 外 道 共 令 諸 菩 薩 於 如 來 所 說 
T16n0679_001:0719c01	甚深之法，次第隨順入。」佛告文殊師利：「汝今	甚 深 之 法 次 第 隨 順 入 佛 告 文 殊 師 利 汝 今 
T16n0679_001:0719c02	諦聽！我當為說略受持義，令諸菩薩善入如	諦 聽 我 當 為 說 略 受 持 義 令 諸 菩 薩 善 入 如 
T16n0679_001:0719c03	來不了義說。文殊師利！若染污法、若清淨法，	來 不了義說 文 殊 師 利 若 染 污 法 若 清 淨 法 
T16n0679_001:0719c04	我說一切法無作無人，一切無所取，非染污	我 說 一 切 法 無 作 無 人 一 切 無 所 取 非 染 污 
T16n0679_001:0719c05	法先染污後清淨，非清淨法後清淨先染污。	法 先 染 污 後 清 淨 非 清 淨 法 後 清 淨 先 染 污 
T16n0679_001:0719c06	彼愚癡凡夫於罪過身，若法若人計著先自	彼 愚 癡 凡 夫 於 罪 過 身 若 法 若 人 計 著 先 自 
T16n0679_001:0719c07	性，妄見因緣，言此是我此是我，所見聞嗅甞	性 妄 見 因 緣 言 此 是 我 此 是 我 所 見 聞 嗅 甞 
T16n0679_001:0719c08	及觸識相，妄作淨穢而起邪行。若有如實知	及 觸 識 相 妄 作 淨 穢 而 起 邪 行 若 有 如 實 知 
T16n0679_001:0719c09	者，捨離過身，一切煩惱所不能染，得畢竟快	者 捨 離 過 身 一切煩惱 所 不 能 染 得 畢 竟 快 
T16n0679_001:0719c10	淨離諸虛偽，得無為身永離諸行。文殊師利！	淨 離 諸 虛 偽 得 無 為 身 永 離 諸 行 文 殊 師 利 
T16n0679_001:0719c11	當知此是略說受持義。」爾時世尊欲重宣此	當 知 此 是 略 說 受 持 義 爾 時 世 尊 欲 重 宣 此 
T16n0679_001:0719c12	義，而說偈言：	義 而 說 偈 言 
T16n0679_001:0719c13	「染污清淨法，　　無作亦無人，	 染 污 清 淨 法 無 作 亦 無 人 
T16n0679_001:0719c14	　我說無所取，　　淨穢無先後。	 我 說 無 所 取 淨 穢 無 先 後 
T16n0679_001:0719c15	　愚於過患身，　　計我及我所，	 愚 於 過 患 身 計 我及我所 
T16n0679_001:0719c16	　緣彼起見著，　　我食我所作。	 緣 彼 起 見 著 我 食 我 所 作 
T16n0679_001:0719c17	　此是我煩惱，　　此是我清淨，	 此 是 我 煩 惱 此 是 我 清 淨 
T16n0679_001:0719c18	　如是如實知，　　永捨過惡身。	 如 是 如 實 知 永 捨 過 惡 身 
T16n0679_001:0719c19	　煩惱不染著，　　畢竟快清淨，	 煩 惱 不 染 著 畢 竟 快 清 淨 
T16n0679_001:0719c20	　永離諸虛偽，　　無為常住身。」	 永 離 諸 虛 偽 無 為 常 住 身 
T16n0679_001:0719c21	爾時文殊師利白佛言：「世尊！如來心起有何	爾 時 文 殊 師 利 白 佛 言 世 尊 如 來 心 起 有 何 
T16n0679_001:0719c22	相？」佛告文殊師利：「如來無心意識起，然如來	相 佛 告 文 殊 師 利 如 來 無 心 意 識 起 然 如 來 
T16n0679_001:0719c23	無行心起當知如化，若諸如來法身離一切	無 行 心 起 當 知 如 化 若 諸 如來法身 離 一 切 
T16n0679_001:0719c24	行者，云何無行中間心起？文殊師利，本所修	行 者 云 何 無 行 中 間 心 起 文 殊 師 利 本 所 修 
T16n0679_001:0719c25	智慧起故。譬如非無心眠作覺行，然有覺本	智 慧 起 故 譬 如 非 無 心 眠 作 覺 行 然 有 覺 本 
T16n0679_001:0719c26	作行力故。譬如非入滅受想定作覺行，然有	作 行 力 故 譬 如 非 入 滅受想定 作 覺 行 然 有 
T16n0679_001:0719c27	起本作行力故。如眠及滅受想定心起，如來	起 本 作 行 力 故 如 眠 及 滅受想定 心 起 如 來 
T16n0679_001:0719c28	心起亦復如是，本修習慧所起故。」文殊師利	心 起 亦復如是 本 修 習 慧 所 起 故 文 殊 師 利 
T16n0679_001:0719c29	白佛言：「世尊！如來身為有心、為無心耶？」佛	白 佛 言 世 尊 如 來 身 為 有 心 為 無 心 耶 佛 
T16n0679_001:0720a01	告文殊師利：「無心心不自在大自在故。」文殊	告 文 殊 師 利 無 心 心 不 自 在 大 自 在 故 文 殊 
T16n0679_001:0720a02	師利復白佛言：「世尊！如來行處、如來境界，有	師 利 復 白 佛 言 世 尊 如 來 行 處 如來境界 有 
T16n0679_001:0720a03	何差別？」	何 差 別 
T16n0679_001:0720a04	佛告文殊師利：「如來行處者，乃至一切如來	佛 告 文 殊 師 利 如 來 行 處 者 乃 至 一 切 如 來 
T16n0679_001:0720a05	共，謂不思議無量功德嚴淨佛國。文殊師利！	共 謂 不 思 議 無量功德 嚴 淨 佛 國 文 殊 師 利 
T16n0679_001:0720a06	如來境界有五種：一切種眾生界、世界、法界、	如來境界 有 五 種 一 切 種 眾 生 界 世 界 法 界 
T16n0679_001:0720a07	調伏界、調伏方便界，是則差別。」文殊師利白	調 伏 界 調伏方便界 是 則 差 別 文 殊 師 利 白 
T16n0679_001:0720a08	佛言：「世尊！如來成正覺及轉法輪乃至大般	佛 言 世 尊 如 來 成 正 覺 及 轉 法 輪 乃 至 大 般 
T16n0679_001:0720a09	涅槃，此有何相？」佛告文殊師利：「無有二相，不	涅 槃 此 有 何 相 佛 告 文 殊 師 利 無 有 二 相 不 
T16n0679_001:0720a10	成正覺非不成正覺，非轉法輪非不轉法	成 正 覺 非 不 成 正 覺 非 轉 法 輪 非 不 轉 法 
T16n0679_001:0720a11	輪，不大般涅槃非不大般涅槃，法身究竟清	輪 不 大 般 涅 槃 非 不 大 般 涅 槃 法 身 究 竟 清 
T16n0679_001:0720a12	淨故，示現化身故。」文殊師利白佛言：「世尊！化	淨 故 示 現 化 身 故 文 殊 師 利 白 佛 言 世 尊 化 
T16n0679_001:0720a13	身者，眾生見聞供養何故生功德？」佛告文殊	身 者 眾 生 見 聞 供 養 何 故 生 功 德 佛 告 文 殊 
T16n0679_001:0720a14	師利：「緣淨心攀緣如來故，化身是如來化故，	師 利 緣 淨 心 攀 緣 如 來 故 化 身 是 如 來 化 故 
T16n0679_001:0720a15	般涅槃行故。」	般 涅 槃 行 故 
T16n0679_001:0720a16	文殊師利白佛言：「世尊！同有無行，何故如來	文 殊 師 利 白 佛 言 世 尊 同 有 無 行 何 故 如 來 
T16n0679_001:0720a17	法身為眾生出大智光明，及出無量化像，非	法 身 為 眾 生 出 大 智 光 明 及 出 無 量 化 像 非 
T16n0679_001:0720a18	聲聞、緣覺解脫身耶？」佛告文殊師利：「譬如日	聲 聞 緣 覺 解 脫 身 耶 佛 告 文 殊 師 利 譬 如 日 
T16n0679_001:0720a19	月水火頗梨珠寶，彼同無行而出光明普照	月 水 火 頗 梨 珠 寶 彼 同 無 行 而 出 光明普照 
T16n0679_001:0720a20	眾生；善法頗梨，眾生大威德故，眾生增上業	眾 生 善 法 頗 梨 眾 生 大 威 德 故 眾 生 增 上 業 
T16n0679_001:0720a21	故，是淨頗梨現眾色像；如是攀緣無量法界	故 是 淨 頗 梨 現 眾 色 像 如 是 攀 緣 無 量 法 界 
T16n0679_001:0720a22	修方便慧，得善治如來法身故，出智光明及	修 方 便 慧 得 善 治 如來法身 故 出 智 光 明 及 
T16n0679_001:0720a23	化色像，非純解脫身。」文殊師利白佛言：「世尊！	化 色 像 非 純 解 脫 身 文 殊 師 利 白 佛 言 世 尊 
T16n0679_001:0720a24	所說如來神力，令欲界人自身具足，謂剎利	所 說 如來神力 令 欲 界 人 自 身 具 足 謂 剎 利 
T16n0679_001:0720a25	婆羅門大姓家，欲界天一切自身具足，色界	婆 羅 門 大 姓 家 欲 界 天 一 切 自 身 具 足 色 界 
T16n0679_001:0720a26	天一切自身具足，無色界天一切自身具足，	天 一 切 自 身 具 足 無 色 界 天 一 切 自 身 具 足 
T16n0679_001:0720a27	有何義？」佛告文殊師利：「如來神力建立若道	有 何 義 佛 告 文 殊 師 利 如來神力 建 立 若 道 
T16n0679_001:0720a28	若迹，令一切處得一切自身具足，謂於彼道	若 迹 令 一 切 處 得 一 切 自 身 具 足 謂 於 彼 道 
T16n0679_001:0720a29	彼迹隨所說行，彼一切處得一切自身具足，	彼 迹 隨 所 說 行 彼 一 切 處 得 一 切 自 身 具 足 
