T18n0892_004:0597a12	等酸醎苦淡。及香美味殘觸飲食。以菩提心	等 酸 醎 苦 淡 及 香 美 味 殘 觸 飲 食 以 菩 提 心 
T18n0892_004:0597a13	不二智故。世間少分無不食者。又得自然生	不 二 智 故 世 間 少 分 無 不 食 者 又 得 自 然 生 
T18n0892_004:0597a14	酤蘇摩華置蓮華器中。入尸利沙及星伽拏藥	酤 蘇 摩 華 置 蓮 華 器 中 入 尸 利 沙 及 星 伽 拏 藥 
T18n0892_004:0597a15	而為甘露。以寒林灰塗身著雜色弊衣。畢利	而 為 甘 露 以 寒 林 灰 塗 身 著 雜 色 弊 衣 畢 利 
T18n0892_004:0597a16	多華結鬘嚴飾。復次金剛藏言。六根清淨故	多 華 結 鬘 嚴 飾 復 次 金 剛 藏 言 六 根 清 淨 故 
T18n0892_004:0597a17	即一切境界廣大清淨。世尊豈不說此諸根清	即 一切境界 廣 大 清 淨 世 尊 豈 不 說 此 諸 根 清 
T18n0892_004:0597a18	淨。是大勇健身所甲冑。金剛藏白佛言。世尊	淨 是 大 勇 健 身 所 甲 冑 金 剛 藏 白 佛 言 世 尊 
T18n0892_004:0597a19	諸聲聞人所不能知是大三昧耶。佛語決定	諸 聲 聞 人 所 不 能 知 是 大 三 昧 耶 佛 語 決 定 
T18n0892_004:0597a20	如剎那頃離諸煩惱。如來於四種教理不作是	如 剎 那 頃 離諸煩惱 如 來 於 四 種 教 理 不 作 是 
T18n0892_004:0597a21	說。云何名方便說。佛言金剛藏汝一心聽。我	說 云 何 名 方 便 說 佛 言 金 剛 藏 汝 一 心 聽 我 
T18n0892_004:0597a22	今為大心者。以方便說大三昧耶。如說摩黏	今 為 大 心 者 以 方 便 說 大 三 昧 耶 如 說 摩 黏 
T18n0892_004:0597a23	即果實義。如說彌羅即鉤召義。如說珂吒畢	即 果 實 義 如 說 彌 羅 即 鉤 召 義 如 說 珂 吒 畢 
T18n0892_004:0597a24	利珂喃即去來義。如說阿薩爹婆囉喃即珠寶	利 珂 喃 即 去 來 義 如 說 阿 薩 爹 婆 囉 喃 即 珠 寶 
T18n0892_004:0597a25	義。如說曼拏嚕即鼓音義。如說努囉努囉即	義 如 說 曼 拏 嚕 即 鼓 音 義 如 說 努 囉 努 囉 即 
T18n0892_004:0597a26	薄德人。如說歌陵惹囉即福善人。如說[寧*頁]抳	薄 德 人 如 說 歌 陵 惹 囉 即 福 善 人 如 說 [寧頁] 抳 
T18n0892_004:0597a27	[牟*含]即無觸義。如說葛波羅即蓮華器。如義底	[牟含] 即 無 觸 義 如 說 葛 波 羅 即 蓮 華 器 如 義 底 
T18n0892_004:0597a28	望鉢多即飲食義。如說摩羅頂即菜食義。如	望 鉢 多 即 飲 食 義 如 說 摩 羅 頂 即 菜 食 義 如 
T18n0892_004:0597a29	說兀探即四平等義。如說母多羅即妙香義。	說 兀 探 即 四 平 等 義 如 說 母 多 羅 即 妙 香 義 
T18n0892_004:0597b01	如說悉羅紺即自然生義。如說輸葛囉即造	如 說 悉 羅 紺 即 自 然 生 義 如 說 輸 葛 囉 即 造 
T18n0892_004:0597b02	作義。如說末娑即白色義。如說瑜即相應義。	作 義 如 說 末 娑 即 白 色 義 如 說 瑜 即 相 應 義 
T18n0892_004:0597b03	如說謨羅紺即金剛義。如說酤羅紺即蓮華	如 說 謨 羅 紺 即 金 剛 義 如 說 酤 羅 紺 即 蓮 華 
T18n0892_004:0597b04	義。如說酤覽即部類義。如說嚩囉拏即有分	義 如 說 酤 覽 即 部 類 義 如 說 嚩 囉 拏 即 有 分 
T18n0892_004:0597b05	別無分別義。於佛五部亦如是說。如說努彌	別 無 分 別 義 於 佛 五 部 亦 如 是 說 如 說 努 彌 
T18n0892_004:0597b06	即金剛部。如說那胝即蓮華部。如說贊拏梨	即 金 剛 部 如 說 那 胝 即 蓮 華 部 如 說 贊 拏 梨 
T18n0892_004:0597b07	即是寶部。如說挼惹多即如來部。如說辣惹	即 是 寶 部 如 說 挼 惹 多 即 如 來 部 如 說 辣 惹 
T18n0892_004:0597b08	計即羯磨部。如說母陀羅即妙成就義。又修	計 即 羯 磨 部 如 說 母 陀 羅 即 妙 成 就 義 又 修 
T18n0892_004:0597b09	觀者得金剛水成就。作供養已而自服行。佛	觀 者 得 金 剛 水 成 就 作 供 養 已 而 自 服 行 佛 
T18n0892_004:0597b10	言金剛大薩埵我為汝說。非彼一切但應尊	言 金 剛 大 薩 埵 我 為 汝 說 非 彼 一 切 但 應 尊 
T18n0892_004:0597b11	重而攝受之。於此金剛空智灌頂大真實句	重 而 攝 受 之 於 此 金 剛 空 智 灌 頂 大 真 實 句 
T18n0892_004:0597b12	三昧方便。勿妄宣說。得大罪咎畢竟無疑。或	三 昧 方 便 勿 妄 宣 說 得 大 罪 咎 畢 竟 無 疑 或 
T18n0892_004:0597b13	為鬼昧怨賊侵嬈瘧病蠱毒。乃至是人速趣	為 鬼 昧 怨 賊 侵 嬈 瘧 病 蠱 毒 乃 至 是 人 速 趣 
T18n0892_004:0597b14	命終。設復有人於此三昧。如世醫王及佛導	命 終 設 復 有 人 於 此 三 昧 如 世 醫 王 及 佛 導 
T18n0892_004:0597b15	師。於是方便亦勿為說。彼不動使者及四大	師 於 是 方 便 亦 勿 為 說 彼 不 動 使 者 及 四 大 
T18n0892_004:0597b16	明妃發大忿怒。是名一切儀軌中義。	明 妃 發 大 忿 怒 是 名 一 切 儀 軌 中 義 
T18n0892_004:0597b17	集一切儀軌部品第十四	集 一 切 儀 軌 部 品 第 十 四 
T18n0892_004:0597b18	爾時金剛藏而為上首。與一切金剛拏吉尼。	爾 時 金 剛 藏 而 為 上 首 與 一 切 金 剛 拏 吉 尼 
T18n0892_004:0597b19	心生疑惑得大憂惱。而白佛言世尊。前行品	心 生 疑 惑 得 大 憂 惱 而 白 佛 言 世 尊 前 行 品 
T18n0892_004:0597b20	中說金剛歌舞成就者。云何為歌舞云何本	中 說 金 剛 歌 舞 成 就 者 云 何 為 歌 舞 云 何 本 
T18n0892_004:0597b21	尊灌頂。於何等印說瞋等作用。又真言品說。	尊 灌 頂 於 何 等 印 說 瞋 等 作 用 又 真 言 品 說 
T18n0892_004:0597b22	無我明妃種子者云何。種子從何出生。金剛	無 我 明 妃 種 子 者 云 何 種 子 從 何 出 生 金 剛 
T18n0892_004:0597b23	部品說三十二血脈之相談彼清淨。唯願世	部 品 說 三 十 二 血 脈 之 相 談 彼 清 淨 唯 願 世 
T18n0892_004:0597b24	尊為我除疑。佛言金剛歌舞者所謂。	尊 為 我 除 疑 佛 言 金 剛 歌 舞 者 所 謂 
T18n0892_004:0597b25	酤(引)羅以哩胝　阿冒(引)羅(引)蒙母抳哩哥(引)酤(引)	酤 引 羅 以 哩 胝 阿 冒 引 羅 引 蒙 母 抳 哩 哥 引 酤 引 
T18n0892_004:0597b26	羅(引)佉吉畢吒斛(引)末惹　伊葛嚕尼吉阿伊路	羅 引 佉 吉 畢 吒 斛 引 末 惹 伊 葛 嚕 尼 吉 阿 伊 路 
T18n0892_004:0597b27	(引)羅(引)怛呬左羅渴惹伊誐(引)遲摩野拏(引)畢惹	 引 羅 引 怛 呬 左 羅 渴 惹 伊 誐 引 遲 摩 野 拏 引 畢 惹 
T18n0892_004:0597b28	　阿伊喝隷歌(引)陵惹囉鉢抳阿伊訥努嚕末[口*爾]	 阿 伊 喝 隷 歌 引 陵 惹 囉 鉢 抳 阿 伊 訥 努 嚕 末 [口爾] 
T18n0892_004:0597b29	阿伊拶烏三摩葛芻哩　悉羅歌(二合引)葛卜嚕羅	阿 伊 拶 烏 三 摩 葛 芻 哩 悉 羅 歌 二 合 引 葛 卜 嚕 羅 
T18n0892_004:0597c01	(引)伊阿伊摩(引)羅伊印馱拏　娑隷怛呬婆嚕呵	 引 伊 阿 伊 摩 引 羅 伊 印 馱 拏 娑 隷 怛 呬 婆 嚕 呵 
T18n0892_004:0597c02	(引)壹阿伊畢陵(二合)渴拏契吒葛陵諦戍馱戍	 引 壹 阿 伊 畢 陵 二 合 渴 拏 契 吒 葛 陵 諦 戍 馱 戍 
T18n0892_004:0597c03	馱奴惹　抳阿伊抳囕戍盎枿左拏(引)尾阿伊耽	馱 奴 惹 抳 阿 伊 抳 囕 戍 盎 枿 左 拏 引 尾 阿 伊 耽 
T18n0892_004:0597c04	呬[口*爾]薩囉(引)嚩阿尾鉢　抳阿伊未隷野[口*爾]翁努	呬 [口爾]薩囉引嚩阿尾鉢 抳阿伊未隷野[口爾] 翁 努 
T18n0892_004:0597c05	嚕末吒伊[寧*頁]抳未多馨末惹阿伊哩。	嚕 末 吒 伊 [寧頁] 抳 未 多 馨 末 惹 阿 伊 哩 
T18n0892_004:0597c06	金剛舞者於呬嚕迦相勿應忘念。心生愛樂	金 剛 舞 者 於 呬 嚕 迦 相 勿 應 忘 念 心 生 愛 樂 
T18n0892_004:0597c07	相續觀想。又金剛明妃及瑜儗尼等如諸佛	相 續 觀 想 又 金 剛 明 妃 及 瑜 儗 尼 等 如 諸 佛 
T18n0892_004:0597c08	母。是金剛歌舞而常真實。護持自身及餘眷	母 是 金 剛 歌 舞 而 常 真 實 護 持 自 身 及 餘 眷 
T18n0892_004:0597c09	屬。此諸世間所持誦處能生信愛。是故於此	屬 此 諸 世 間 所 持 誦 處 能 生 信 愛 是 故 於 此 
T18n0892_004:0597c10	極生尊重。如月愛相勿復疑惑。時金剛藏白	極 生 尊 重 如 月 愛 相 勿 復 疑 惑 時 金 剛 藏 白 
T18n0892_004:0597c11	佛言。世尊是俱生喜自性。何所棄捨而能出	佛 言 世 尊 是 俱 生 喜 自 性 何 所 棄 捨 而 能 出 
T18n0892_004:0597c12	生一切相應。譬若虛空無有窮盡。佛言如是	生 一 切 相 應 譬 若 虛 空 無 有 窮 盡 佛 言 如 是 
T18n0892_004:0597c13	如是如汝所說。金剛藏言云何菩提心出生	如 是 如 汝 所 說 金 剛 藏 言 云 何 菩 提 心 出 生 
T18n0892_004:0597c14	方便。佛言謂此輪壇以自威力加持次第。名	方 便 佛 言 謂 此 輪 壇 以 自 威 力 加 持 次 第 名 
T18n0892_004:0597c15	菩提心出生方便。世非世俗有二種相。如俱	菩 提 心 出 生 方 便 世 非 世 俗 有 二 種 相 如 俱 
T18n0892_004:0597c16	那花處白月影。世間妙樂亦復如是。謂佛菩	那 花 處 白 月 影 世 間 妙 樂 亦復如是 謂 佛 菩 
T18n0892_004:0597c17	薩如是任持。信解輪迴無復涅槃。所說色	薩 如 是 任 持 信 解 輪 迴 無 復 涅 槃 所 說 色 
T18n0892_004:0597c18	聲等是輪迴。受等是輪迴。根等是輪迴。瞋	聲 等 是 輪 迴 受 等 是 輪 迴 根 等 是 輪 迴 瞋 
T18n0892_004:0597c19	等是輪迴。即以是法而名涅槃。謂無癡是涅	等 是 輪 迴 即 以 是 法 而 名 涅 槃 謂 無 癡 是 涅 
T18n0892_004:0597c20	槃。無迷亂是涅槃。清淨是涅槃。若非世俗	槃 無 迷 亂 是 涅 槃 清 淨 是 涅 槃 若 非 世 俗 
T18n0892_004:0597c21	菩提心。以具相童子是上種族。性行調柔	菩 提 心 以 具 相 童 子 是 上 種 族 性 行 調 柔 
T18n0892_004:0597c22	殊妙莊嚴。以悉羅訶香和合龍腦。及妙飲食	殊 妙 莊 嚴 以 悉 羅 訶 香 和 合 龍 腦 及 妙 飲 食 
T18n0892_004:0597c23	隨分供養。於自他身成就義利。又金剛蓮華	隨 分 供 養 於 自 他 身 成 就 義 利 又 金 剛 蓮 華 
T18n0892_004:0597c24	而作相應。出生次第不應遠離。以蓮華器或	而 作 相 應 出 生 次 第 不 應 遠 離 以 蓮 華 器 或 
T18n0892_004:0597c25	白螺貝而作甘露。如是正理有大力能即無	白 螺 貝 而 作 甘 露 如 是 正 理 有 大 力 能 即 無 
T18n0892_004:0597c26	我明妃。以大印曼拏羅住臍輪中。從阿字音	我 明 妃 以 大 印 曼 拏 羅 住 臍 輪 中 從 阿 字 音 
T18n0892_004:0597c27	自性及彼提字。說是勝慧出生相應次第。非	自 性 及 彼 提 字 說 是 勝 慧 出 生 相 應 次 第 非 
T18n0892_004:0597c28	長短方圓。而俱生喜如是出生。受用妙樂及	長短方圓 而 俱 生 喜 如 是 出 生 受 用 妙 樂 及 
T18n0892_004:0597c29	與大印而得成就。彼色聲香味觸法界自性。	與 大 印 而 得 成 就 彼 色聲香味觸 法 界 自 性 
T18n0892_004:0598a01	智慧方便及大妙樂即彼輪壇。五智自性謂	智慧方便 及 大 妙 樂 即 彼 輪 壇 五 智 自 性 謂 
T18n0892_004:0598a02	大圓鏡智。平等性智。妙觀察智。成所作智。	大圓鏡智 平等性智 妙觀察智 成所作智 
T18n0892_004:0598a03	清淨法界。此無我明妃法界本性。如我為曼	清 淨 法 界 此 無 我 明 妃 法 界 本 性 如 我 為 曼 
T18n0892_004:0598a04	拏羅王等無有異。復次金剛藏言。於輪壇觀	拏 羅 王 等無有異 復 次 金 剛 藏 言 於 輪 壇 觀 
T18n0892_004:0598a05	想道。如其出生諸佛聖賢。唯佛世尊先為我	想 道 如 其 出 生 諸 佛 聖 賢 唯佛世尊 先 為 我 
T18n0892_004:0598a06	等說是戒相。佛言先於身中住阿字門金剛蓮	等 說 是 戒 相 佛 言 先 於 身 中 住 阿 字 門 金 剛 蓮 
T18n0892_004:0598a07	華大印方便學處。此內外戒我今開示。以阿	華 大 印 方 便 學 處 此 內 外 戒 我 今 開 示 以 阿 
T18n0892_004:0598a08	字理趣祕密三摩鉢底。令煩惱縛外不現起了	字 理 趣 祕 密 三 摩 鉢 底 令 煩 惱 縛 外 不 現 起 了 
T18n0892_004:0598a09	知法報化三身輪及大樂輪義。如是住心意	知 法 報 化 三 身 輪 及 大 樂 輪 義 如 是 住 心 意 
T18n0892_004:0598a10	喉頂。出生無量諸佛聖賢。彼化身輪依上座	喉 頂 出 生 無 量 諸 佛 聖 賢 彼 化 身 輪 依 上 座 
T18n0892_004:0598a11	部律出變化身。法身輪者依一切有部律宣	部 律 出 變 化 身 法 身 輪 者 依 一 切 有 部 律 宣 
T18n0892_004:0598a12	說法故。報身輪者依正量部律為所受用一	說 法 故 報 身 輪 者 依 正 量 部 律 為 所 受 用 一 
T18n0892_004:0598a13	切飲食味故。大樂輪者依大眾部律住妙樂	切 飲 食 味 故 大 樂 輪 者 依 大 眾 部 律 住 妙 樂 
T18n0892_004:0598a14	故。世尊分別四種不動果等。以勝慧業而作	故 世 尊 分 別 四 種 不 動 果 等 以 勝 慧 業 而 作 
T18n0892_004:0598a15	教誡。是法輪者如其受用。說無所動而得大	教 誡 是 法 輪 者 如 其 受 用 說 無 所 動 而 得 大 
T18n0892_004:0598a16	果。於妙樂輪具大力能有士夫用。相應出生	果 於 妙 樂 輪 具 大 力 能 有 士 夫 用 相 應 出 生 
T18n0892_004:0598a17	清淨果報。是等義類說名聖胎為遊止處。若	清 淨 果 報 是 等 義 類 說 名 聖 胎 為 遊 止 處 若 
T18n0892_004:0598a18	人心離貪等。設處胎藏如被法服。觀所生母	人 心 離 貪 等 設 處 胎 藏 如 被 法 服 觀 所 生 母 
T18n0892_004:0598a19	即諸佛母。慈愍訓育曲躬禮敬如親教師。猶	即 諸 佛 母 慈 愍 訓 育 曲 躬 禮 敬 如 親 教 師 猶 
T18n0892_004:0598a20	我往昔順生世間。從阿字輪出生[亢*欠]字。圓頂	我 往 昔 順 生 世 間 從 阿 字 輪 出 生 [亢欠] 字 圓 頂 
T18n0892_004:0598a21	潔膚若苾芻相。又眾生十月始生地上。我於	潔 膚 若 苾 芻 相 又 眾 生 十 月 始 生 地 上 我 於 
T18n0892_004:0598a22	爾時滿十地行大自在位故。阿字門積集眾	爾 時 滿 十 地 行 大 自 在 位 故 阿 字 門 積 集 眾 
T18n0892_004:0598a23	生如佛無疑。爾時無我明妃等。聞佛語已心	生 如 佛 無 疑 爾 時 無 我 明 妃 等 聞 佛 語 已 心 
T18n0892_004:0598a24	生疑惑。得大恐怖悶絕躄地。時會見已語金	生 疑 惑 得 大 恐 怖 悶 絕 躄 地 時 會 見 已 語 金 
T18n0892_004:0598a25	剛明妃等言。是地水火風空。此五大種唯佛	剛 明 妃 等 言 是 地水火風 空 此 五 大 種 唯 佛 
T18n0892_004:0598a26	知覺。時無我明妃如夢所聞。從地而起白言	知 覺 時 無 我 明 妃 如 夢 所 聞 從 地 而 起 白 言 
T18n0892_004:0598a27	世尊。如是眾生云何為諸垢染之所覆藏。能	世 尊 如 是 眾 生 云 何 為 諸 垢 染 之 所 覆 藏 能 
T18n0892_004:0598a28	除是等名正覺者。世尊如是真實無有虛妄。	除 是 等 名 正 覺 者 世 尊 如 是 真 實 無 有 虛 妄 
T18n0892_004:0598a29	佛言如無智人飲枿囉拏藥極生惛醉。若離	佛 言 如 無 智 人 飲 枿 囉 拏 藥 極 生 惛 醉 若 離 
T18n0892_004:0598b01	癡愛是即解脫。若人於金剛空智信樂多聞。	癡 愛 是 即 解 脫 若 人 於 金 剛 空 智 信 樂 多 聞 
T18n0892_004:0598b02	了知出離方便。斷無明縛不生執取。於天人	了 知 出 離 方 便 斷 無 明 縛 不 生 執 取 於 天 人 
T18n0892_004:0598b03	阿修羅地獄餓鬼畜生起大覺悟。無眾生相當	阿 修 羅 地 獄 餓 鬼 畜 生 起 大 覺 悟 無 眾 生 相 當 
T18n0892_004:0598b04	成正覺。又糞穢諸蟲常樂自體。而尚不知有	成 正 覺 又 糞 穢 諸 蟲 常 樂 自 體 而 尚 不 知 有 
T18n0892_004:0598b05	天人等樂。此覺性者隨心所現。非餘世界得	天 人 等 樂 此 覺 性 者 隨 心 所 現 非 餘 世 界 得 
T18n0892_004:0598b06	成正覺。設旃陀羅諸殺業者。是人無智愚夫	成 正 覺 設 旃 陀 羅 諸 殺 業 者 是 人 無 智 愚 夫 
T18n0892_004:0598b07	執著。不知是行為極癡冥。於六趣中發行取	執 著 不 知 是 行 為 極 癡 冥 於 六 趣 中 發 行 取 
T18n0892_004:0598b08	有支之所輪轉。若於金剛空智得是方便除	有 支 之 所 輪 轉 若 於 金 剛 空 智 得 是 方 便 除 
T18n0892_004:0598b09	我慢習。清淨境界得無上道。於此勝行成就	我 慢 習 清 淨 境 界 得 無 上 道 於 此 勝 行 成 就 
T18n0892_004:0598b10	無疑。說卜葛西明妃是即地界。彼堅硬體是	無 疑 說 卜 葛 西 明 妃 是 即 地 界 彼 堅 硬 體 是 
T18n0892_004:0598b11	即癡義。佛言身依心出生。若於餘處定不	即 癡 義 佛 言 身 依 心 出 生 若 於 餘 處 定 不 
T18n0892_004:0598b12	可得。是故毘盧遮那如來部。說設嚩哩明妃	可 得 是 故 毘 盧 遮 那 如 來 部 說 設 嚩 哩 明 妃 
T18n0892_004:0598b13	是即水界。彼濕潤性本尊理趣。佛言心依身	是 即 水 界 彼 濕 潤 性 本 尊 理 趣 佛 言 心 依 身 
T18n0892_004:0598b14	出生。若於餘處不應現起。是故阿閦如來部。	出 生 若 於 餘 處 不 應 現 起 是 故 阿 閦 如 來 部 
T18n0892_004:0598b15	說贊拏哩明妃是即火界。即貪理趣。佛言說	說 贊 拏 哩 明 妃 是 即 火 界 即 貪 理 趣 佛 言 說 
T18n0892_004:0598b16	貪愛火以赤色為自相。由貪起兩舌故。寶生	貪 愛 火 以 赤 色 為 自 相 由 貪 起 兩 舌 故 寶 生 
T18n0892_004:0598b17	如來部。說努彌尼明妃是即風界。本尊理趣。	如 來 部 說 努 彌 尼 明 妃 是 即 風 界 本 尊 理 趣 
T18n0892_004:0598b18	佛言由貪故起嫉妬。不空成就如來部。如是	佛 言 由 貪 故 起 嫉 妬 不 空 成 就 如 來 部 如 是 
T18n0892_004:0598b19	邀哩明妃。陬哩明妃。尾多哩明妃。渴三摩哩	邀 哩 明 妃 陬 哩 明 妃 尾 多 哩 明 妃 渴 三 摩 哩 
T18n0892_004:0598b20	明妃。亦如上說。於金剛空智如是住持三摩	明 妃 亦 如 上 說 於 金 剛 空 智 如 是 住 持 三 摩 
T18n0892_004:0598b21	鉢底。	鉢 底 
T18n0892_004:0598b22	復次無我菩薩於平等相為利眾生。請問末	復 次 無 我 菩 薩 於 平 等 相 為 利 眾 生 請 問 末 
T18n0892_004:0598b23	隣大供養真言句。時金剛薩埵於諸眾生令	隣 大 供 養 真 言 句 時 金 剛 薩 埵 於 諸 眾 生 令 
T18n0892_004:0598b24	護他命。為作障者一切頻那夜迦。說末隣大	護 他 命 為 作 障 者 一 切 頻 那 夜 迦 說 末 隣 大 
T18n0892_004:0598b25	供養明曰。	供 養 明 曰 
T18n0892_004:0598b26	唵印捺野摩惹羅惹剎普嚩嚩喝尼(二合)嚩(引)	唵 印 捺 野 摩 惹 羅 惹 剎 普 嚩 嚩 喝 尼 二 合 嚩 引 
T18n0892_004:0598b27	喻囉剎贊捺蘇惹摩捺嚩鉢多羅鉢多(引)梨遏	喻 囉 剎 贊 捺 蘇 惹 摩 捺 嚩 鉢 多 羅 鉢 多 引 梨 遏 
T18n0892_004:0598b28	吒薩鉢伊喃末隣蓬惹仍伽補澁波(二合)度(引)	吒 薩 鉢 伊 喃 末 隣 蓬 惹 仍 伽 補 澁 波 二 合 度 引 
T18n0892_004:0598b29	波莾(引)娑(引)尾覲喃(二合)盎喝歌(引)惹薩嚩娑(引)	波 莾 引 娑 引 尾 覲 喃 二 合 盎 喝 歌 引 惹 薩 嚩 娑 引 
T18n0892_004:0598c01	達侃底枯尼譬痆枿(引)捺唵(引)遏歌(引)嚕(引)牟	達 侃 底 枯 尼 譬 痆 枿 引 捺 唵 引 遏 歌 引 嚕 引 牟 
T18n0892_004:0598c02	抗薩哩嚩(二合)達哩摩(二合引)拏摩[寧*也](切身)那庾	抗 薩 哩 嚩 二 合 達 哩 摩 二 合 引 拏 摩 [寧也] 切 身 那 庾 
T18n0892_004:0598c03	(二合)怛半(二合)那怛嚩(二合)多唵(引)阿(引)吽(引)發吒	 二 合 怛 半 二 合 那 怛 嚩 二 合 多 唵 引 阿 引 吽 引 發 吒 
T18n0892_004:0598c04	(半音)薩嚩(二合引)賀(引)	 半 音 薩 嚩 二 合 引 賀 引 
T18n0892_004:0598c05	如是末隣大供養明。善解瑜伽者供養一切	如 是 末 隣 大 供 養 明 善 解 瑜 伽 者 供 養 一 切 
T18n0892_004:0598c06	部多等得大吉祥。若求信愛護世諸天生大	部 多 等 得 大 吉 祥 若 求 信 愛 護 世 諸 天 生 大 
T18n0892_004:0598c07	歡喜。若作降伏速破冤敵。若作鉤召能遣諸	歡 喜 若 作 降 伏 速 破 冤 敵 若 作 鉤 召 能 遣 諸 
T18n0892_004:0598c08	魔。若作息災增益得大富樂相續不斷。	魔 若 作 息 災 增 益 得 大 富 樂 相續不斷 
T18n0892_004:0598c09	復次金剛藏言。如來先說地行空行明妃。我	復 次 金 剛 藏 言 如 來 先 說 地 行 空 行 明 妃 我 
T18n0892_004:0598c10	今不知當何部主。佛言為身語意三密輪中。	今 不 知 當 何 部 主 佛 言 為 身 語 意 三 密 輪 中 
T18n0892_004:0598c11	以我住處及無我菩薩住上中下。此中開示	以 我 住 處 及 無 我 菩 薩 住 上 中 下 此 中 開 示 
T18n0892_004:0598c12	部有三種五種或開六種。即五如來為對治	部 有 三 種 五 種 或 開 六 種 即 五 如 來 為 對 治 
T18n0892_004:0598c13	彼貪瞋愚癡兩舌嫉妬。又於五種隨其次第。	彼 貪 瞋 愚 癡 兩 舌 嫉 妬 又 於 五 種 隨其次第 
T18n0892_004:0598c14	觀想出生金剛薩埵清淨妙樂。又三種者即	觀 想 出 生 金 剛 薩 埵 清 淨 妙 樂 又 三 種 者 即 
T18n0892_004:0598c15	如來部蓮華部金剛部。為對治彼貪瞋癡等。	如 來 部 蓮 華 部 金 剛 部 為 對 治 彼 貪 瞋 癡 等 
T18n0892_004:0598c16	又復一部謂阿閦如來金剛威德現忿怒相。	又 復 一 部 謂 阿 閦 如 來 金 剛 威 德 現 忿 怒 相 
T18n0892_004:0598c17	對治瞋法。	對 治 瞋 法 
T18n0892_004:0598c18	金剛王出現品第十五	金 剛 王 出 現 品 第 十 五 
T18n0892_004:0598c19	爾時空智大金剛王。開示一切本尊。一切自	爾 時 空 智 大 金 剛 王 開 示 一 切 本 尊 一 切 自 
T18n0892_004:0598c20	性身曼拏羅。住極妙樂金剛心種子。出生一	性 身 曼 拏 羅 住 極 妙 樂 金 剛 心 種 子 出 生 一 
T18n0892_004:0598c21	切自相曼拏羅王。一十六臂八面四足。帶髑	切 自 相 曼 拏 羅 王 一 十 六 臂 八 面 四 足 帶 髑 
T18n0892_004:0598c22	髏鬘現忿怒相。執持五印得大無畏。時無我	髏 鬘 現 忿 怒 相 執 持 五 印 得 大 無 畏 時 無 我 
T18n0892_004:0598c23	菩薩白如是言。我先不知是曼拏羅一十五	菩 薩 白 如 是 言 我 先 不 知 是 曼 拏 羅 一 十 五 
T18n0892_004:0598c24	位。眷愛種智願為我說。時金剛王如是嗟咨。	位 眷 愛 種 智 願 為 我 說 時 金 剛 王 如 是 嗟 咨 
T18n0892_004:0598c25	持葛波羅擲金剛杵摧伏魔已。說是如前曼	持 葛 波 羅 擲 金 剛 杵 摧 伏 魔 已 說 是 如 前 曼 
T18n0892_004:0598c26	拏羅輪。四隅四門及金剛線珠纓半纓。無量	拏 羅 輪 四 隅 四 門 及 金 剛 線 珠 纓 半 纓 無 量 
T18n0892_004:0598c27	雜寶間飾莊嚴。以我吽阿字種智。放青色熾	雜 寶 間 飾 莊 嚴 以 我 吽 阿 字 種 智 放 青 色 熾 
T18n0892_004:0598c28	盛光焰。出生八面一十六臂。足踏四魔現忿	盛 光 焰 出 生 八 面 一 十 六 臂 足 踏 四 魔 現 忿 
T18n0892_004:0598c29	怒相。帶髑髏鬘及妙瓔珞得大無畏。住日輪	怒 相 帶 髑 髏 鬘 及 妙 瓔 珞 得 大 無 畏 住 日 輪 
T18n0892_004:0599a01	中立如舞勢。頂戴善巧金剛杵。黑色忿怒以	中 立 如 舞 勢 頂 戴 善 巧 金 剛 杵 黑 色 忿 怒 以 
T18n0892_004:0599a02	灰塗身。口誦吽發吒字。入樂寂靜離煩惱縛	灰 塗 身 口 誦 吽 發 吒 字 入 樂 寂 靜 離 煩 惱 縛 
T18n0892_004:0599a03	妙三摩地。正面大黑色。右面如白色俱那華。	妙 三 摩 地 正 面 大 黑 色 右 面 如 白 色 俱 那 華 
T18n0892_004:0599a04	左面紅色大忿怒相。上面笑容。餘四面並青	左 面 紅 色 大 忿 怒 相 上 面 笑 容 餘 四 面 並 青 
T18n0892_004:0599a05	黑色。共二十四目。如是相續復入樂嬉戲三	黑 色 共 二 十 四 目 如 是 相 續 復 入 樂 嬉 戲 三 
T18n0892_004:0599a06	摩地。從喭字門出生遨哩明妃。住於東門。復	摩 地 從 喭 字 門 出 生 遨 哩 明 妃 住 於 東 門 復 
T18n0892_004:0599a07	入滿他那相應三摩地。從尊字門出生陬哩	入 滿 他 那 相 應 三 摩 地 從 尊 字 門 出 生 陬 哩 
T18n0892_004:0599a08	明妃。住於南門。為護門者。復入金剛蓮華相	明 妃 住 於 南 門 為 護 門 者 復 入 金 剛 蓮 華 相 
T18n0892_004:0599a09	應三摩地。從鑁字門出生尾多哩明妃。住於	應 三 摩 地 從 鑁 字 門 出 生 尾 多 哩 明 妃 住 於 
T18n0892_004:0599a10	西門。復入破大煩惱闇三摩地。從紺字門出	西 門 復 入 破 大 煩 惱 闇 三 摩 地 從 紺 字 門 出 
T18n0892_004:0599a11	生渴三摩哩明妃。住於北門。為壞魔者。從奔	生 渴 三 摩 哩 明 妃 住 於 北 門 為 壞 魔 者 從 奔 
T18n0892_004:0599a12	字門出生卜葛西明妃。住伊舍那方。復入滿	字 門 出 生 卜 葛 西 明 妃 住 伊 舍 那 方 復 入 滿 
T18n0892_004:0599a13	他那相應三摩地。從商字門出生設嚩哩明	他 那 相 應 三 摩 地 從 商 字 門 出 生 設 嚩 哩 明 
T18n0892_004:0599a14	妃。住火天方。從贊字門出生贊拏梨明妃。住	妃 住 火 天 方 從 贊 字 門 出 生 贊 拏 梨 明 妃 住 
T18n0892_004:0599a15	羅剎方。從農字門出生努彌尼明妃。住風天	羅 剎 方 從 農 字 門 出 生 努 彌 尼 明 妃 住 風 天 
