T18n0892_003:0594c19	剎帝利誦真言十萬遍。宰官誦一百遍。於世	剎 帝 利 誦 真 言 十 萬 遍 宰 官 誦 一 百 遍 於 世 
T18n0892_003:0594c20	間眾生誦一萬遍。諸天誦二十萬遍。阿修	間 眾 生 誦 一 萬 遍 諸 天 誦 二 十 萬 遍 阿 修 
T18n0892_003:0594c21	羅七十萬遍。藥叉傍生誦一俱胝。如其所說	羅 七 十 萬 遍 藥 叉 傍 生 誦 一 俱 胝 如 其 所 說 
T18n0892_003:0594c22	住清淨相。諸佛世尊金剛堅固之身。普能攝	住 清 淨 相 諸佛世尊 金剛堅固 之 身 普 能 攝 
T18n0892_003:0594c23	受。作曼拏羅及護摩時。於彼晨朝承事佛像。	受 作 曼 拏 羅 及 護 摩 時 於 彼 晨 朝 承 事 佛 像 
T18n0892_003:0594c24	作加持已。觀想諸佛遍滿虛空。隨屬本尊入	作 加 持 已 觀 想 諸 佛 遍 滿 虛 空 隨 屬 本 尊 入 
T18n0892_003:0594c25	已心內。於真言行應當善解。種種供養皆從	已 心 內 於 真 言 行 應 當 善 解 種種供養 皆 從 
T18n0892_003:0594c26	吽字出生。彼彼真言曰。	吽 字 出 生 彼 彼 真 言 曰 
T18n0892_003:0594c27	唵(引)嚩日囉(二合)補瑟閉(二合)阿(引)吽(引)薩嚩(二	唵 引 嚩 日 囉 二 合 補 瑟 閉 二 合 阿 引 吽 引 薩 嚩 二 
T18n0892_003:0594c28	合)訶	合 訶 
T18n0892_003:0594c29	唵(引)嚩日囉(二合)度閉(引)阿(引)吽(引)薩嚩(二合)訶	唵 引 嚩 日 囉 二 合 度 閉 引 阿 引 吽 引 薩 嚩 二 合 訶 
T18n0892_003:0595a01	唵(引)嚩日囉(二合)禰(引)閉(引)阿吽(引)薩嚩(二合)訶	唵 引 嚩 日 囉 二 合 禰 引 閉 引 阿 吽 引 薩 嚩 二 合 訶 
T18n0892_003:0595a02	唵(引)嚩日囉(二合)喭提阿(引)吽(引)薩嚩(二合)訶	唵 引 嚩 日 囉 二 合 喭 提 阿 引 吽 引 薩 嚩 二 合 訶 
T18n0892_003:0595a03	唵(引)嚩日囉(二合)迺尾儞(引)阿(引)吽(引)薩嚩(二合)	唵 引 嚩 日 囉 二 合 迺 尾 儞 引 阿 引 吽 引 薩 嚩 二 合 
T18n0892_003:0595a04	訶	訶 
T18n0892_003:0595a05	獻阿伽水儀軌次第如前已說。我今復說成	獻 阿 伽 水 儀 軌 次 第 如 前 已 說 我 今 復 說 成 
T18n0892_003:0595a06	就護魔法。息災圓爐白色廣一肘半深等半。	就 護 魔 法 息 災 圓 爐 白 色 廣 一 肘 半 深 等 半 
T18n0892_003:0595a07	增益四方黃色廣二肘深一肘。降伏三角黑	增 益 四 方 黃 色 廣 二 肘 深 一 肘 降 伏 三 角 黑 
T18n0892_003:0595a08	色廣十指深五指。信愛紅色。鉤召如信愛同。	色 廣 十 指 深 五 指 信 愛 紅 色 鉤 召 如 信 愛 同 
T18n0892_003:0595a09	忿怒與降伏同。息災用脂麻。增益用酪。降伏	忿 怒 與 降 伏 同 息 災 用 脂 麻 增 益 用 酪 降 伏 
T18n0892_003:0595a10	用羯諾迦木。忿怒用棘木。信愛鉤召並用紅	用 羯 諾 迦 木 忿 怒 用 棘 木 信 愛 鉤 召 並 用 紅 
T18n0892_003:0595a11	優鉢羅華。火天歡喜真言曰。	優 鉢 羅 華 火 天 歡 喜 真 言 曰 
T18n0892_003:0595a12	唵(引)阿枿那(二合)曳摩訶(引)帝惹薩哩嚩(二合)歌	唵 引 阿 枿 那 二 合 曳 摩 訶 引 帝 惹 薩 哩 嚩 二 合 歌 
T18n0892_003:0595a13	(引)摩鉢囉(二合)娑(引)馱各歌(引)嚕拏也(二合)訖哩	 引 摩 鉢 囉 二 合 娑 引 馱 各 歌 引 嚕 拏 也 二 合 訖 哩 
T18n0892_003:0595a14	(二合)多薩埵(引)囉他(二合)遏悉銘(二合)散儞呬都	 二 合 多 薩 埵 引 囉 他 二 合 遏 悉 銘 二 合 散 儞 呬 都 
T18n0892_003:0595a15	婆嚩阿枿那也(三合)嚩(引)喝那怛鑁(二合)儞尾索	婆 嚩 阿 枿 那 也 三 合 嚩 引 喝 那 怛 鑁 二 合 儞 尾 索 
T18n0892_003:0595a16	(引)叱部(引)多(引)枲呬嚩日囉(二合)酤(引)駄布(引)[口*爾]	 引 叱 部 引 多 引 枲 呬 嚩 日 囉 二 合 酤 引 駄 布 引 [口爾] 
T18n0892_003:0595a17	底那(引)那(引)囉怛那(二合)馱哩(引)馱(引)底哩(二合引)阿	底 那 引 那 引 囉 怛 那 二 合 馱 哩 引 馱 引 底 哩 二 合 引 阿 
T18n0892_003:0595a18	母酤(引)[亢*欠]曼拏朗栗契多莎哩覃(二合)拶嚩鉢	母 酤 引 [亢欠] 曼 拏 朗 栗 契 多 莎 哩 覃 二 合 拶 嚩 鉢 
T18n0892_003:0595a19	囉(二合)哩覃(二合)拶娑(引)提耽枿[打丁+荼]賀咩部葛阿	囉 二 合 哩 覃 二 合 拶 娑 引 提 耽 枿 [打丁荼] 賀 咩 部 葛 阿 
T18n0892_003:0595a20	(引)枿弭奢悉野他(引)歌(引)梨薩哩嚩(二合)悉提酤	 引 枿 弭 奢 悉 野 他 引 歌 引 梨 薩 哩 嚩 二 合 悉 提 酤 
T18n0892_003:0595a21	嚕薩嚩(二合)彌	嚕 薩 嚩 二 合 彌 
T18n0892_003:0595a22	獻閼伽水真言曰。	獻 閼 伽 水 真 言 曰 
T18n0892_003:0595a23	唵(引)[口*弱]吽(引)鑁斛龕囕	唵 引 [口弱] 吽 引 鑁 斛 龕 囕 
T18n0892_003:0595a24	淨水真言曰。	淨 水 真 言 曰 
T18n0892_003:0595a25	唵(引)梨(引)梨(引)吽(引)恪	唵 引 梨 引 梨 引 吽 引 恪 
T18n0892_003:0595a26	獻食真言曰。	獻 食 真 言 曰 
T18n0892_003:0595a27	唵(引)探探	唵 引 探 探 
T18n0892_003:0595a28	熾盛拏吉尼所說成就品第十二	熾 盛 拏 吉 尼 所 說 成 就 品 第 十 二 
T18n0892_003:0595a29	復次金剛藏言。世尊於諸法海。云何為求成	復 次 金 剛 藏 言 世 尊 於 諸 法 海 云 何 為 求 成 
T18n0892_003:0595b01	就者。略說如是本尊色相。佛言為於無我明	就 者 略 說 如 是 本 尊 色 相 佛 言 為 於 無 我 明 
T18n0892_003:0595b02	妃。或吉祥呬嚕迦。一剎那頃知彼安住。及於	妃 或 吉 祥 呬 嚕 迦 一 剎 那 頃 知 彼 安 住 及 於 
T18n0892_003:0595b03	廣大清淨儀軌。若時若處最初修習是故略	廣 大 清 淨 儀 軌 若 時 若 處 最 初 修 習 是 故 略 
T18n0892_003:0595b04	說。復次持真言者。一心成就三摩呬多。於已	說 復 次 持 真 言 者 一 心 成 就 三 摩 呬 多 於 已 
T18n0892_003:0595b05	住舍或夜時分。發勤勇心以勝慧相。應觀想	住 舍 或 夜 時 分 發 勤 勇 心 以 勝 慧 相 應 觀 想 
T18n0892_003:0595b06	吉祥呬嚕迦像。澡浴塵穢著新淨衣。以旃檀	吉 祥 呬 嚕 迦 像 澡 浴 塵 穢 著 新 淨 衣 以 旃 檀 
T18n0892_003:0595b07	香塗瑩手足。嚼荳蔻齒木及妙香果無非時	香 塗 瑩 手 足 嚼 荳 蔻 齒 木 及 妙 香 果 無 非 時 
T18n0892_003:0595b08	食。如佛世尊求出離想。親近智者觀想行人。	食 如 佛 世 尊 求 出 離 想 親 近 智 者 觀 想 行 人 
T18n0892_003:0595b09	於剎那頃忽起異相。於所持明心難調柔。爾	於 剎 那 頃 忽 起 異 相 於 所 持 明 心 難 調 柔 爾 
T18n0892_003:0595b10	時行者不應止息。決定精勤趣求成就。	時 行 者 不 應 止 息 決 定 精 勤 趣 求 成 就 
T18n0892_003:0595b11	佛告金剛藏言。我說禪定心能壞煩惱毒。求	佛 告 金 剛 藏 言 我 說 禪 定 心 能 壞 煩 惱 毒 求 
T18n0892_003:0595b12	成就者極善籌量。於一月分心存聖像離諸	成 就 者 極 善 籌 量 於 一 月 分 心 存 聖 像 離 諸 
T18n0892_003:0595b13	攀緣。或一日中相續觀想。隨其所辦得大果	攀 緣 或 一 日 中 相 續 觀 想 隨 其 所 辦 得 大 果 
T18n0892_003:0595b14	利。所有輪轉自他二利。非餘方便速能修習。	利 所 有 輪 轉 自 他 二 利 非 餘 方 便 速 能 修 習 
T18n0892_003:0595b15	於所持明而常現前。求成就者如是煩惱迷	於 所 持 明 而 常 現 前 求 成 就 者 如 是 煩 惱 迷 
T18n0892_003:0595b16	醉。憂悲病苦熾然三毒。說剎那頃如實相應。	醉 憂 悲 病 苦 熾 然 三 毒 說 剎 那 頃 如 實 相 應 
T18n0892_003:0595b17	而得不墮五無間處。設有屠膾卑賤醜陋身	而 得 不 墮 五 無 間 處 設 有 屠 膾 卑 賤 醜 陋 身 
T18n0892_003:0595b18	不具足。造惡業者思求成就。應修十善尊重	不 具 足 造 惡 業 者 思 求 成 就 應 修 十 善 尊 重 
T18n0892_003:0595b19	愛樂密護根門。是人決定離瞋慢習。而得成	愛 樂 密護根門 是 人 決 定 離 瞋 慢 習 而 得 成 
T18n0892_003:0595b20	就三摩呬多。設此時分於祕密行。乃至法印	就 三 摩 呬 多 設 此 時 分 於 祕 密 行 乃 至 法 印 
T18n0892_003:0595b21	未得成就自然得是。持明智者或瑜儗尼。而	未 得 成 就 自 然 得 是 持 明 智 者 或 瑜 儗 尼 而 
T18n0892_003:0595b22	來為說攝受某印。執金剛杵利益眾生。或得	來 為 說 攝 受 某 印 執 金 剛 杵 利 益 眾 生 或 得 
T18n0892_003:0595b23	廣大莊嚴具相童子。以悉囉訶香和合龍腦。	廣 大 莊 嚴 具 相 童 子 以 悉 囉 訶 香 和 合 龍 腦 
T18n0892_003:0595b24	以菩提心加持散之。應當一心觀彼聖像。彼	以 菩 提 心 加 持 散 之 應 當 一 心 觀 彼 聖 像 彼 
T18n0892_003:0595b25	或為說十善等法知實明了。得彼成就無復	或 為 說 十 善 等 法 知 實 明 了 得 彼 成 就 無 復 
T18n0892_003:0595b26	疑惑。或勝那哩及自眷屬亦應觀想。若天若	疑 惑 或 勝 那 哩 及 自 眷 屬 亦 應 觀 想 若 天 若 
T18n0892_003:0595b27	人阿修羅緊那羅夜叉女等。彼亦領解自所	人 阿 修 羅 緊 那 羅 夜 叉 女 等 彼 亦 領 解 自 所 
T18n0892_003:0595b28	行行當生信敬。勿起邪思瞋怒色相。復次金	行 行 當 生 信 敬 勿 起 邪 思 瞋 怒 色 相 復 次 金 
T18n0892_003:0595b29	剛藏言。世尊於無我理已具足說。復何印所	剛 藏 言 世 尊 於 無 我 理 已 具 足 說 復 何 印 所 
T18n0892_003:0595c01	印處二種成就。佛言如來大悲。隨所應現具	印 處 二 種 成 就 佛 言 如來大悲 隨 所 應 現 具 
T18n0892_003:0595c02	相明妃。住蓮華族捨幻化相。而能照解勝惠	相 明 妃 住 蓮 華 族 捨 幻 化 相 而 能 照 解 勝 惠 
T18n0892_003:0595c03	方便二種生滅。是二邊際非生非滅即真實	方 便 二 種 生 滅 是 二 邊 際 非 生 非 滅 即 真 實 
T18n0892_003:0595c04	性。又此滅處處無有性滅無盡故。瑜伽生滅	性 又 此 滅 處 處 無 有 性 滅 無 盡 故 瑜 伽 生 滅 
T18n0892_003:0595c05	次第如是。又修觀者從戲論生。如夢所作了	次 第 如 是 又 修 觀 者 從 戲 論 生 如 夢 所 作 了 
T18n0892_003:0595c06	如幻覺實無戲論。是中所說如曼拏羅現諸	如 幻 覺 實 無 戲 論 是 中 所 說 如 曼 拏 羅 現 諸 
T18n0892_003:0595c07	色相。和合出生灌頂大印及大妙樂。如是了	色 相 和 合 出 生 灌 頂 大 印 及 大 妙 樂 如 是 了 
T18n0892_003:0595c08	知唯大威力。青黃赤綠及黑白色。行非行等	知 唯 大 威 力 青 黃 赤 綠 及 黑 白 色 行 非 行 等 
T18n0892_003:0595c09	勝惠方便二種相因。說金剛薩埵有妙樂性。	勝 惠 方 便 二 種 相 因 說 金 剛 薩 埵 有 妙 樂 性 
T18n0892_003:0595c10	於曼拏羅餘無作用。時金剛藏白佛言。世尊	於 曼 拏 羅 餘 無 作 用 時 金 剛 藏 白 佛 言 世 尊 
T18n0892_003:0595c11	是大妙樂自所相應出生次第。若非有性復	是 大 妙 樂 自 所 相 應 出 生 次 第 若 非 有 性 復 
T18n0892_003:0595c12	何所用。佛言快哉大士以信除疑。我說世間	何 所 用 佛 言 快 哉 大 士 以 信 除 疑 我 說 世 間 
T18n0892_003:0595c13	身所妙樂。能觀所觀如華有香。華性若無香	身 所 妙 樂 能 觀 所 觀 如 華 有 香 華 性 若 無 香 
T18n0892_003:0595c14	不可得。身相妙樂亦復如是。於性無性如佛	不 可 得 身 相 妙 樂 亦復如是 於 性 無 性 如 佛 
T18n0892_003:0595c15	知覺。癡暗無知及餘怯弱悉能破壞。彼金剛	知 覺 癡 暗 無 知 及 餘 怯 弱 悉 能 破 壞 彼 金 剛 
T18n0892_003:0595c16	喻沙三摩地極妙樂行。唯一體相為佛實藏。	喻 沙 三 摩 地 極 妙 樂 行 唯 一 體 相 為 佛 實 藏 
T18n0892_003:0595c17	我所說法聞自功德信順。世出世間為調御	我 所 說 法 聞 自 功 德 信 順 世出世間 為 調 御 
T18n0892_003:0595c18	者。離喜俱生喜等即我自性。如以燈明破諸	者 離 喜 俱 生 喜 等 即 我 自 性 如 以 燈 明 破 諸 
T18n0892_003:0595c19	黑暗。三十二相八十種好。皆樂輪之所安	黑 暗 三十二相 八十種好 皆 樂 輪 之 所 安 
T18n0892_003:0595c20	住。彼相若無是義非有。於諸聖天不應棄捨。	住 彼 相 若 無 是 義 非 有 於 諸 聖 天 不 應 棄 捨 
T18n0892_003:0595c21	是故覺非有性色亦無性。諸相非相皆勝妙	是 故 覺 非 有 性 色 亦 無 性 諸 相 非 相 皆 勝 妙 
T18n0892_003:0595c22	樂。又諸世間自他色相悉俱生故。心相清淨	樂 又 諸 世 間 自 他 色 相 悉 俱 生 故 心 相 清 淨 
T18n0892_003:0595c23	即名還滅。若於本尊相應出生。威儀色相及	即 名 還 滅 若 於 本 尊 相 應 出 生 威 儀 色 相 及 
T18n0892_003:0595c24	安住處。如彈指頃而執著者。譬少毒藥能害	安 住 處 如 彈 指 頃 而 執 著 者 譬 少 毒 藥 能 害 
T18n0892_003:0595c25	多命。知彼毒已還能壞毒。又於分別而強分	多 命 知 彼 毒 已 還 能 壞 毒 又 於 分 別 而 強 分 
T18n0892_003:0596a01	別。以清淨有破煩惱有。如風病人食摩沙豆。	別 以 清 淨 有 破 煩 惱 有 如 風 病 人 食 摩 沙 豆 
T18n0892_003:0596a02	發病愈風名顛倒藥。於相決定而常尋伺。而	發 病 愈 風 名 顛 倒 藥 於 相 決 定 而 常 尋 伺 而 
T18n0892_003:0596a03	為分別一切法性。譬如有人少水入耳還以	為 分 別 一切法性 譬 如 有 人 少 水 入 耳 還 以 
T18n0892_003:0596a04	水取。又諸眾生貪火所燒。為諸惡業之所纏	水 取 又 諸 眾 生 貪 火 所 燒 為 諸 惡 業 之 所 纏 
T18n0892_003:0596a05	縛。我以方便為說貪火而令解脫。如若有人	縛 我 以 方 便 為 說 貪 火 而 令 解 脫 如 若 有 人 
T18n0892_003:0596a06	為火燒烙。還炙以火。即以是貪令斷貪縛。而	為 火 燒 烙 還 炙 以 火 即 以 是 貪 令 斷 貪 縛 而 
T18n0892_003:0596a07	不能知是顛倒觀想者。是人名為佛法中外	不 能 知 是 顛 倒 觀 想 者 是 人 名 為 佛 法 中 外 
T18n0892_003:0596a08	道。又蓮華部相應分別此五大種。觸堅硬性	道 又 蓮 華 部 相 應 分 別 此 五 大 種 觸 堅 硬 性 
T18n0892_003:0596a09	而生執著。對治癡法是即地界毘盧遮那如	而 生 執 著 對 治 癡 法 是 即 地 界 毘 盧 遮 那 如 
T18n0892_003:0596a10	來。為菩提心之所容受。色身業用是即水界	來 為 菩 提 心 之 所 容 受 色 身 業 用 是 即 水 界 
T18n0892_003:0596a11	阿閦如來。水地相搖熱觸生火。對治貪熾是	阿 閦 如 來 水 地 相 搖 熱 觸 生 火 對 治 貪 熾 是 
T18n0892_003:0596a12	即火界無量壽如來。思惟餘部有動轉相。對	即 火 界 無 量 壽 如 來 思 惟 餘 部 有 動 轉 相 對 
T18n0892_003:0596a13	治嫉妬是即風界不空成就如來。於此妙樂	治 嫉 妬 是 即 風 界 不 空 成 就 如 來 於 此 妙 樂 
T18n0892_003:0596a14	而生愛樂。即虛空相對治兩舌。是即空界寶	而 生 愛 樂 即 虛 空 相 對 治 兩 舌 是 即 空 界 寶 
T18n0892_003:0596a15	生如來。此五大種於剎那頃。心能了知等同	生 如 來 此 五 大 種 於 剎 那 頃 心 能 了 知 等 同 
T18n0892_003:0596a16	一味。是故於勝喜中分別貪等五火。與大妙	一 味 是 故 於 勝 喜 中 分 別 貪 等 五 火 與 大 妙 
T18n0892_003:0596a17	樂同一本性。有十殑伽沙數如來眾同是一	樂 同 一 本 性 有 十 殑伽沙數 如 來 眾 同 是 一 
T18n0892_003:0596a18	部。於是一部復有百萬無數大俱胝部。是勝	部 於 是 一 部 復 有 百 萬 無 數 大 俱 胝 部 是 勝 
T18n0892_003:0596a19	喜中得如是部。	喜 中 得 如 是 部 
T18n0892_003:0596a20	說方便品第十三	說 方 便 品 第 十 三 
T18n0892_003:0596a21	復次宣說一切金剛儀軌瑜儗尼方便灌頂	復 次 宣 說 一 切 金 剛 儀 軌 瑜 儗 尼 方 便 灌 頂 
T18n0892_003:0596a22	戒。謂分別剎那飲食喜等。諸佛如來安住鑁	戒 謂 分 別 剎 那 飲 食 喜 等 諸佛如來 安 住 鑁 
T18n0892_003:0596a23	字。正等一相得灌頂成就。復次金剛薩埵白	字 正 等 一 相 得 灌 頂 成 就 復 次 金 剛 薩 埵 白 
T18n0892_003:0596a24	佛言。世尊如是鑁字云何說為拏吉尼戒。如	佛 言 世 尊 如 是 鑁 字 云 何 說 為 拏 吉 尼 戒 如 
T18n0892_003:0596a25	來為調御師願為我說如其次第。佛言是中	來 為 調 御 師 願 為 我 說 如 其 次 第 佛 言 是 中 
T18n0892_003:0596a26	鑁字唯一體性最上莊嚴。為阿賴耶諸佛寶	鑁 字 唯 一 體 性 最 上 莊 嚴 為 阿 賴 耶 諸 佛 寶 
T18n0892_003:0596a27	藏。於初喜等分別剎那住妙樂智。謂莊嚴果	藏 於 初 喜 等 分 別 剎 那 住 妙 樂 智 謂 莊 嚴 果 
T18n0892_003:0596a28	報作觀離相。修瑜伽者於四剎那正行當如	報 作 觀 離 相 修 瑜 伽 者 於 四 剎 那 正 行 當 如 
T18n0892_003:0596a29	是知。莊嚴者。即初喜中方便為說種種理事。	是 知 莊 嚴 者 即 初 喜 中 方 便 為 說 種 種 理 事 
T18n0892_003:0596b01	果報者。謂即勝喜知妙樂觸。作觀者。謂即離	果 報 者 謂 即 勝 喜 知 妙 樂 觸 作 觀 者 謂 即 離 
T18n0892_003:0596b02	喜我所受用為說尋伺。離相者。即俱生喜遠	喜 我 所 受 用 為 說 尋 伺 離 相 者 即 俱 生 喜 遠 
T18n0892_003:0596b03	離三種貪與無貪及彼中間。復次灌頂阿闍	離 三 種 貪 與 無 貪 及 彼 中 間 復 次 灌 頂 阿 闍 
T18n0892_003:0596b04	梨。以四種祕密觀想次第。發清淨心熙怡顧	梨 以 四 種 祕 密 觀 想 次 第 發 清 淨 心 熙 怡 顧 
T18n0892_003:0596b05	視。知具福慧滅除煩惱。於諸眾生因緣成熟。	視 知 具 福 慧 滅 除 煩 惱 於 諸 眾 生 因 緣 成 熟 
T18n0892_003:0596b06	為說四種澡沐灌頂。以二手執金剛鈴杵。其	為 說 四 種 澡 沐 灌 頂 以 二 手 執 金 剛 鈴 杵 其 
T18n0892_003:0596b07	灌頂者面目熙怡莊嚴色相。以大拇指無名	灌 頂 者 面 目 熙 怡 莊 嚴 色 相 以 大 拇 指 無 名 
T18n0892_003:0596b08	指。施設種種供養已。為說攝受大印。知彼弟	指 施 設 種種供養 已 為 說 攝 受 大 印 知 彼 弟 
T18n0892_003:0596b09	子是大種族。遠離瞋恚及我慢習。調御教誨	子 是 大 種 族 遠 離 瞋 恚 及 我 慢 習 調 御 教 誨 
T18n0892_003:0596b10	執金剛杵。隨其本尊說灌頂作用相應契印。	執 金 剛 杵 隨 其 本 尊 說 灌 頂 作 用 相 應 契 印 
T18n0892_003:0596b11	見自師尊恭敬供養。如佛世尊具大寂靜。於	見 自 師 尊 恭敬供養 如 佛 世 尊 具 大 寂 靜 於 
T18n0892_003:0596b12	此金剛瑜伽出生成就印法不應分別。又應	此 金 剛 瑜 伽 出 生 成 就 印 法 不 應 分 別 又 應 
T18n0892_003:0596b13	如我以大威力。於生死泥拔濟沈溺作大歸	如 我 以 大 威 力 於 生 死 泥 拔 濟 沈 溺 作 大 歸 
T18n0892_003:0596b14	救。爾時弟子執金剛杵。以盡世甘美廣大飲	救 爾 時 弟 子 執 金 剛 杵 以 盡 世 甘 美 廣 大 飲 
T18n0892_003:0596b15	食。燒香塗香幢幡寶鐸。及妙華鬘是等供養。	食 燒 香 塗 香 幢 幡 寶 鐸 及 妙 華 鬘 是 等 供 養 
T18n0892_003:0596b16	於種種勝喜妙樂剎那遠離。乃至菩提最後	於 種 種 勝 喜 妙 樂 剎 那 遠 離 乃至菩提 最 後 
T18n0892_003:0596b17	邊際。持金剛杵利諸含識。又為弟子說大悲	邊 際 持 金 剛 杵 利 諸 含 識 又 為 弟 子 說 大 悲 
T18n0892_003:0596b18	智安住一切。是身非身無有二相。觀動植等	智 安 住 一 切 是 身 非 身 無 有 二 相 觀 動 植 等 
T18n0892_003:0596b19	皆幻化相。輪壇方便畢竟無疑。諸同學者如	皆 幻 化 相 輪 壇 方 便 畢 竟 無 疑 諸 同 學 者 如 
T18n0892_003:0596b20	己眷屬。時金剛藏白佛言。世尊云何名諸佛	己 眷 屬 時 金 剛 藏 白 佛 言 世 尊 云 何 名 諸 佛 
T18n0892_003:0596b21	身最上輪壇。如其次第為我除疑。佛言是曼	身 最 上 輪 壇 如 其 次 第 為 我 除 疑 佛 言 是 曼 
T18n0892_003:0596b22	拏羅者。堅固菩提心作大施會。如虛空輪清	拏 羅 者 堅 固 菩 提 心 作 大 施 會 如 虛 空 輪 清 
T18n0892_003:0596b23	淨境界。應知是名金剛瑜伽蓮華部義。	淨 境 界 應 知 是 名 金 剛 瑜 伽 蓮 華 部 義 
T18n0892_003:0596b24	時金剛藏復白佛言。世尊持何等戒住何三	時 金 剛 藏 復 白 佛 言 世 尊 持 何 等 戒 住 何 三 
T18n0892_003:0596b25	昧。佛言一者不應殺害眾生。當共一心如護	昧 佛 言 一 者 不 應 殺 害 眾 生 當 共 一 心 如 護 
T18n0892_003:0596b26	己有。二者無不與故取他人翫好。三者無欲	己 有 二 者 無 不 與 故 取 他 人 翫 好 三 者 無 欲 
T18n0892_003:0596b27	邪行知本性空故。四者無虛妄語世出世間	邪 行 知 本 性 空 故 四 者 無 虛 妄 語 世出世間 
T18n0892_003:0596b28	發最上願。時諸瑜伽者於佛世尊作如是言。	發 最 上 願 時 諸 瑜 伽 者 於 佛 世 尊 作如是言 
T18n0892_003:0596b29	　云何名根境　　云何十二處	 云 何 名 根 境 云 何 十 二 處 
T18n0892_003:0596c01	　何等名蘊界　　復何為自性	 何 等 名 蘊 界 復 何 為 自 性 
T18n0892_003:0596c02	　佛言根有六　　謂眼耳鼻根	 佛 言 根 有 六 謂 眼 耳 鼻 根 
T18n0892_003:0596c03	　與身舌意等　　內外根癡俱	 與 身 舌 意 等 內 外 根 癡 俱 
T18n0892_003:0596c04	　以金剛解脫　　又境有六塵	 以 金 剛 解 脫 又 境 有 六 塵 
T18n0892_003:0596c05	　謂色聲香味　　及與觸境界	 謂 色 聲 香 味 及 與 觸 境 界 
T18n0892_003:0596c06	　并法界自性　　是名為六境	 并 法 界 自 性 是 名 為 六 境 
T18n0892_003:0596c07	　即前根境二　　翻名十二處	 即 前 根 境 二 翻 名 十 二 處 
T18n0892_003:0596c08	　五蘊謂色等　　及大悲行性	 五 蘊 謂 色 等 及 大 悲 行 性 
T18n0892_003:0596c09	　如是根境識　　說名十八界	 如 是 根 境 識 說 名 十 八 界 
T18n0892_003:0596c10	　是故瑜伽者　　於此能悟了	 是 故 瑜 伽 者 於 此 能 悟 了 
T18n0892_003:0596c11	　彼自性不生　　真實無妄失	 彼 自 性 不 生 真 實 無 妄 失 
T18n0892_003:0596c12	　一切盡知解　　猶如水中月	 一 切 盡 知 解 猶 如水中月 
T18n0892_003:0596c13	　又如撚箭手　　云何生火相	 又 如 撚 箭 手 云 何 生 火 相 
T18n0892_003:0596c14	　是火非箭出　　亦非撚人手	 是 火 非 箭 出 亦 非 撚 人 手 
T18n0892_003:0596c15	　諸相盡度量　　俱時無所得	 諸 相 盡 度 量 俱 時 無 所 得 
T18n0892_003:0596c16	　又此所生火　　非假亦非實	 又 此 所 生 火 非 假 亦 非 實 
T18n0892_003:0596c17	　是故諸法中　　應如是作意	 是 故 諸 法 中 應 如 是 作 意 
T18n0892_003:0596c18	佛說大悲空智金剛大教王儀軌經卷第三	佛 說 大 悲 空 智 金 剛 大 教 王 儀 軌 經 卷 第 三 
T18n0892_004:0596c22	佛說大悲空智金剛大教王儀軌	佛 說 大 悲 空 智 金 剛 大 教 王 儀 軌 
T18n0892_004:0596c23	經卷第四(第五同卷)	經 卷 第 四 第 五 同 卷 
T18n0892_004:0596c25	宋西天三藏銀青光祿大夫試光祿卿	宋 西 天 三 藏 銀 青 光 祿 大 夫 試 光 祿 卿 
T18n0892_004:0596c26	普明慈覺傳梵大師法護奉　詔譯	普 明 慈 覺 傳 梵 大 師 法 護 奉 詔 譯 
T18n0892_004:0596c27	說方便品第十三之餘	說 方 便 品 第 十 三 之 餘 
T18n0892_004:0596c28	爾時無我明妃而為上首。與一切金剛拏吉	爾 時 無 我 明 妃 而 為 上 首 與 一 切 金 剛 拏 吉 
T18n0892_004:0596c29	尼等。俱持五甘露相應。供養世尊金剛薩埵	尼 等 俱 持 五 甘 露 相 應 供 養 世 尊 金 剛 薩 埵 
T18n0892_004:0597a01	已。飲金剛甘露味。現大威神發歡喜心。語汝	已 飲 金 剛 甘 露 味 現 大 威 神 發歡喜心 語 汝 
T18n0892_004:0597a02	金剛拏吉尼等。我此真實極為祕密。供養禮	金 剛 拏 吉 尼 等 我 此 真 實 極 為 祕 密 供 養 禮 
T18n0892_004:0597a03	敬一切佛已。於金剛本性我今開示。時諸明	敬 一 切 佛 已 於 金 剛 本 性 我 今 開 示 時 諸 明 
T18n0892_004:0597a04	妃得大歡喜。右膝著地合掌恭敬聽佛所說。	妃 得 大 歡 喜 右膝著地 合掌恭敬 聽 佛 所 說 
T18n0892_004:0597a05	佛言如得飲食於美不美勿生厭離。澡浴塵	佛 言 如 得 飲 食 於 美 不 美 勿 生 厭 離 澡 浴 塵 
T18n0892_004:0597a06	穢無起淨想。設復不修禪定不誦呪句。不捨	穢 無 起 淨 想 設 復 不 修 禪 定 不 誦 呪 句 不 捨 
T18n0892_004:0597a07	睡眠不護根門。於五淨食平等服行。一切眷	睡 眠 不 護 根 門 於 五 淨 食 平 等 服 行 一 切 眷 
T18n0892_004:0597a08	屬心無愛著無怨親想。木石塑像不行禮事。	屬 心 無 愛 著 無 怨 親 想 木 石 塑 像 不 行 禮 事 
T18n0892_004:0597a09	於世間法悉能遠離。又於剎帝利婆羅門吠	於 世 間 法 悉 能 遠 離 又 於 剎 帝 利 婆 羅 門 吠 
T18n0892_004:0597a10	舍戍陀羅等不樂親近。穢行旃陀羅皮作廁	舍 戍 陀 羅 等 不 樂 親 近 穢 行 旃 陀 羅 皮 作 廁 
T18n0892_004:0597a11	人等亦不遠離。或以摩粘及藿香葉。毒辣藥	人 等 亦 不 遠 離 或 以 摩 粘 及 藿 香 葉 毒 辣 藥 
