T18n0892_002:0592c03	　說名妙觀察　　唯諸作用中	 說 名 妙 觀 察 唯 諸 作 用 中 
T18n0892_002:0592c04	　名成所作智　　及清淨法性	 名 成所作智 及 清 淨 法 性 
T18n0892_002:0592c05	　彼五智次第　　觀想如是說	 彼 五 智 次 第 觀 想 如 是 說 
T18n0892_002:0592c06	　又修瑜伽者　　於日月時分	 又 修 瑜 伽 者 於 日 月 時 分 
T18n0892_002:0592c07	　及金剛薩埵　　繫念悉平等	 及 金 剛 薩 埵 繫 念 悉 平 等 
T18n0892_002:0592c08	　文字出生身　　住吽發吒義	 文 字 出 生 身 住 吽 發 吒 義 
T18n0892_002:0592c09	　彼薩埵影像　　等真實出生	 彼 薩 埵 影 像 等 真 實 出 生 
T18n0892_002:0592c10	　作意而觀想　　如前幖幟輪	 作 意 而 觀 想 如 前 幖 幟 輪 
T18n0892_002:0592c11	　以摩尼妙光　　惠方便自性	 以 摩 尼 妙 光 惠 方 便 自 性 
T18n0892_002:0592c12	　一切速成就	 一 切 速 成 就 
T18n0892_002:0592c13	爾時佛告金剛藏菩薩言。彼日月時分者。謂	爾 時 佛 告 金 剛 藏 菩 薩 言 彼 日 月 時 分 者 謂 
T18n0892_002:0592c14	以勝惠而能揀擇。最初遨哩明妃者。分別色	以 勝 惠 而 能 揀 擇 最 初 遨 哩 明 妃 者 分 別 色 
T18n0892_002:0592c15	相而各有異。於中五位安五。明妃。即五蘊自	相 而 各 有 異 於 中 五 位 安 五 明 妃 即 五 蘊 自 
T18n0892_002:0592c16	性。修瑜伽者當如是觀。初帝釋方安金剛	性 修 瑜 伽 者 當 如 是 觀 初 帝 釋 方 安 金 剛 
T18n0892_002:0592c17	明妃。次燄魔方安最初遨哩明妃。於水天	明 妃 次 燄 魔 方 安 最 初 遨 哩 明 妃 於 水 天 
T18n0892_002:0592c18	方安嚩哩明妃。酤尾羅方安金剛拏。吉尼	方 安 嚩 哩 明 妃 酤 尾 羅 方 安 金 剛 拏 吉 尼 
T18n0892_002:0592c19	明妃中方安無我明妃。於次外院安八明妃。	明 妃 中 方 安 無 我 明 妃 於 次 外 院 安 八 明 妃 
T18n0892_002:0592c20	所謂遨哩明妃。陬哩明妃。尾多哩明妃。渴三	所 謂 遨 哩 明 妃 陬 哩 明 妃 尾 多 哩 明 妃 渴 三 
T18n0892_002:0592c21	摩哩明妃。十葛西明妃。設嚩哩明妃。贊拏	摩 哩 明 妃 十 葛 西 明 妃 設 嚩 哩 明 妃 贊 拏 
T18n0892_002:0592c22	哩明妃。弩弭尼明妃。於上下方安空行明	哩 明 妃 弩 弭 尼 明 妃 於 上 下 方 安 空 行 明 
T18n0892_002:0592c23	妃及地居明妃。住大悲空智輪者。悉於三有	妃 及 地 居 明 妃 住 大 悲 空 智 輪 者 悉 於 三 有 
T18n0892_002:0592c24	從自觀想之所變現。此諸明妃皆以黑色大	從 自 觀 想 之 所 變 現 此 諸 明 妃 皆 以 黑 色 大 
T18n0892_002:0592c25	忿怒相。用前五印之所莊嚴。各有一面面安	忿 怒 相 用 前 五 印 之 所 莊 嚴 各 有 一 面 面 安 
T18n0892_002:0592c26	三目。左右二臂。執持寶刀及葛波羅器。前五	三 目 左 右 二 臂 執 持 寶 刀 及 葛 波 羅 器 前 五 
T18n0892_002:0592c27	印者即是輪鐶寶釧寶鬘寶帶。以五佛清淨	印 者 即 是 輪 鐶 寶 釧 寶 鬘 寶 帶 以 五 佛 清 淨 
T18n0892_002:0592c28	故即五印清淨。此諸明妃已如上說。無我明	故 即 五 印 清 淨 此 諸 明 妃 已 如 上 說 無 我 明 
T18n0892_002:0592c29	妃。右執寶刀。左持葛波羅器及金剛渴樁誐	妃 右 執 寶 刀 左 持 葛 波 羅 器 及 金 剛 渴 樁 誐 
T18n0892_002:0593a01	杖。衣虎皮衣立蓮華上足如舞勢。智光熾盛	杖 衣 虎 皮 衣 立 蓮 華 上 足 如 舞 勢 智 光 熾 盛 
T18n0892_002:0593a02	如大火聚。髮髻金色微忿怒相。執寶刀者為	如大火聚 髮 髻 金 色 微 忿 怒 相 執 寶 刀 者 為 
T18n0892_002:0593a03	斷一切慢過慢等。葛波羅器者為破四魔令	斷 一 切 慢 過 慢 等 葛 波 羅 器 者 為 破 四 魔 令 
T18n0892_002:0593a04	善成就。金剛渴樁誐杖者即空智性及諸方	善 成 就 金 剛 渴 樁 誐 杖 者 即 空 智 性 及 諸 方 
T18n0892_002:0593a05	便。於此儀軌觀想輪法成就者。最初觀想黑	便 於 此 儀 軌 觀 想 輪 法 成 就 者 最 初 觀 想 黑 
T18n0892_002:0593a06	色。第二赤色。第三黃色。第四綠色。第五青	色 第 二 赤 色 第 三 黃 色 第 四 綠 色 第 五 青 
T18n0892_002:0593a07	色。第六白色。然於六分觀想相應亦復厭離。	色 第 六 白 色 然 於 六 分 觀 想 相 應 亦 復 厭 離 
T18n0892_002:0593a08	謂出生次第非出生次第。於此二種平等依	謂 出 生 次 第 非 出 生 次 第 於 此 二 種 平 等 依 
T18n0892_002:0593a09	止。是金剛部隨其生滅所說法故。諸佛世尊	止 是 金 剛 部 隨 其 生 滅 所 說 法 故 諸佛世尊 
T18n0892_002:0593a10	說是空界蓮華種智觀想。三摩鉢底及妙樂	說 是 空 界 蓮 華 種 智 觀 想 三 摩 鉢 底 及 妙 樂 
T18n0892_002:0593a11	輪。如是次第為自領納從菩提心。如是觀想	輪 如 是 次 第 為 自 領 納 從 菩 提 心 如 是 觀 想 
T18n0892_002:0593a12	出生聖賢。是二種輪悉俱生故。所說勝惠出	出 生 聖 賢 是 二 種 輪 悉 俱 生 故 所 說 勝 惠 出 
T18n0892_002:0593a13	生義故。所說方便士夫用故。後於勝義世俗	生 義 故 所 說 方 便 士 夫 用 故 後 於 勝義世俗 
T18n0892_002:0593a14	二種分別。彼二種輪者說勝惠輪。如妙樂故。	二 種 分 別 彼 二 種 輪 者 說 勝 惠 輪 如 妙 樂 故 
T18n0892_002:0593a15	是中於無量義分別有四。是四種者即俱生	是 中 於 無 量 義 分 別 有 四 是 四 種 者 即 俱 生 
T18n0892_002:0593a16	分出生次第。一者喜謂於此先行。少分妙樂	分 出 生 次 第 一 者 喜 謂 於 此 先 行 少 分 妙 樂 
T18n0892_002:0593a17	有進求故。二者勝喜於此相應。漸令增勝說	有 進 求 故 二 者 勝 喜 於 此 相 應 漸 令 增 勝 說 
T18n0892_002:0593a18	妙樂故。三者離喜於此妙樂。厭離諸根息除	妙 樂 故 三 者 離 喜 於 此 妙 樂 厭 離 諸 根 息 除 
T18n0892_002:0593a19	貪染。無眾生可喜愛故。四者俱生喜。一切平	貪 染 無 眾 生 可 喜 愛 故 四 者 俱 生 喜 一 切 平 
T18n0892_002:0593a20	等真實觀想故。又此妙樂具諸方便。唯勝喜	等 真 實 觀 想 故 又 此 妙 樂 具 諸 方 便 唯 勝 喜 
T18n0892_002:0593a21	中如實遠離餘不復說。於非有中無可得故。	中 如 實 遠 離 餘 不 復 說 於 非 有 中 無 可 得 故 
T18n0892_002:0593a22	於他了知身所有福。尊重稱歎。方便附近諸	於 他 了 知 身 所 有 福 尊 重 稱 歎 方 便 附 近 諸 
T18n0892_002:0593a23	薄德人。彼少睡眠若飲若食。為境思念及餘	薄 德 人 彼 少 睡 眠 若 飲 若 食 為 境 思 念 及 餘 
T18n0892_002:0593a24	一切。如其所見於上中下。平等一味真實觀	一 切 如 其 所 見 於 上 中 下 平 等 一 味 真 實 觀 
T18n0892_002:0593a25	想。勿應於下劣品少略句義。於最上品而作	想 勿 應 於 下 劣 品 少 略 句 義 於 最 上 品 而 作 
T18n0892_002:0593a26	觀想。於中品者離此二種。如是六根諸有動	觀 想 於 中 品 者 離 此 二 種 如 是 六 根 諸 有 動 
T18n0892_002:0593a27	息。淨盡無餘共所修作。等彼一味彼妙樂輪。	息 淨 盡 無 餘 共 所 修 作 等 彼 一 味 彼 妙 樂 輪 
T18n0892_002:0593a28	等同開示真實觀想。如是所說出生三有及	等 同 開 示 真 實 觀 想 如是所說 出 生 三 有 及 
T18n0892_002:0593a29	諸世間。如我所見一切觀照。是故於三摩呬	諸 世 間 如 我 所 見 一 切 觀 照 是 故 於 三 摩 呬 
T18n0892_002:0593b01	多畢竟修習。於此成就無復疑惑。設於大印	多 畢 竟 修 習 於 此 成 就 無 復 疑 惑 設 於 大 印 
T18n0892_002:0593b02	畢竟進求。觀想世間諸所作意悉非觀想。觀	畢 竟 進 求 觀 想 世 間 諸 所 作 意 悉 非 觀 想 觀 
T18n0892_002:0593b03	諸法智亦非觀想。諸所動植枝葉蔓草。及自	諸 法 智 亦 非 觀 想 諸 所 動 植 枝 葉 蔓 草 及 自 
T18n0892_002:0593b04	他身一切色相。是大妙樂悉非有性。於自所	他 身 一 切 色 相 是 大 妙 樂 悉 非 有 性 於 自 所 
T18n0892_002:0593b05	得成就觀想。所生業用如王者尊。隨自取捨	得 成 就 觀 想 所 生 業 用 如 王 者 尊 隨 自 取 捨 
T18n0892_002:0593b06	一切無礙。貪瞋嫉妬及我慢等。諸所愛樂乃	一 切 無 礙 貪 瞋 嫉 妬 及 我 慢 等 諸 所 愛 樂 乃 
T18n0892_002:0593b07	至十六分中不及其一。以智慧方便自性出	至 十 六 分 中 不 及 其 一 以 智慧方便 自 性 出 
T18n0892_002:0593b08	生諸法。及彼三世猶若虛空。如來所說彼妙	生 諸 法 及 彼 三 世 猶 若 虛 空 如 來 所 說 彼 妙 
T18n0892_002:0593b09	樂輪。於一剎那而得降伏。於自境界悉能棄	樂 輪 於 一 剎 那 而 得 降 伏 於 自 境 界 悉 能 棄 
T18n0892_002:0593b10	捨。諸了悟智及語言道。加持次第唯用趣向。	捨 諸 了 悟 智 及 語 言 道 加 持 次 第 唯 用 趣 向 
T18n0892_002:0593b11	一切智智自他了知。地水火風及餘空等。於	一切智智 自 他 了 知 地水火風 及 餘 空 等 於 
T18n0892_002:0593b12	剎那頃悉能破壞。天上人間乃至地際。於剎	剎 那 頃 悉 能 破 壞 天 上 人 間 乃 至 地 際 於 剎 
T18n0892_002:0593b13	那頃皆同一相。離諸分別不為自他之所侵	那 頃 皆 同 一 相 離 諸 分 別 不 為 自 他 之 所 侵 
T18n0892_002:0593b14	撓。成就持明諸業用等。設復於生死中而常	撓 成 就 持 明 諸 業 用 等 設 復 於 生 死 中 而 常 
T18n0892_002:0593b15	清淨。譬如河流亦如燈炷。於晝夜中真實不	清 淨 譬 如 河 流 亦 如 燈 炷 於 晝 夜 中 真 實 不 
T18n0892_002:0593b16	斷。彼無智者於是儀軌徒設疲勞。此世他世	斷 彼 無 智 者 於 是 儀 軌 徒 設 疲 勞 此世他世 
T18n0892_002:0593b17	無能成就。	無 能 成 就 
T18n0892_002:0593b18	清淨品第九	清 淨 品 第 九 
T18n0892_002:0593b19	佛告金剛藏言清淨品我今當說。	佛 告 金 剛 藏 言 清 淨 品 我今當說 
T18n0892_002:0593b20	　由說是清淨　　一切無疑惑	 由 說 是 清 淨 一 切 無 疑 惑 
T18n0892_002:0593b21	　一一賢聖位　　後當分別說	 一 一 賢 聖 位 後 當 分 別 說 
T18n0892_002:0593b22	　五蘊五大種　　六根及六處	 五 蘊 五 大 種 六 根 及 六 處 
T18n0892_002:0593b23	　無知煩惱闇　　自性悉清淨	 無 知 煩 惱 闇 自 性 悉 清 淨 
T18n0892_002:0593b24	　謂自身領納　　及餘他所作	 謂 自 身 領 納 及 餘 他 所 作 
T18n0892_002:0593b25	　說妙樂相應　　境界等清淨	 說 妙 樂 相 應 境 界 等 清 淨 
T18n0892_002:0593b26	　故佛善巧說　　一切性清淨	 故 佛 善 巧 說 一 切 性 清 淨 
T18n0892_002:0593b27	時金剛藏菩薩白佛言。世尊為何等清淨。佛	時 金 剛 藏 菩 薩 白 佛 言 世 尊 為 何 等 清 淨 佛 
T18n0892_002:0593b28	言於色等境觀想遠離能取所取。所謂眼取	言 於 色 等 境 觀 想 遠 離 能取所取 所 謂 眼 取 
T18n0892_002:0593b29	色耳取聲。鼻取香舌取味。身取觸意取妙樂。	色 耳 取 聲 鼻 取 香 舌 取 味 身 取 觸 意 取 妙 樂 
T18n0892_002:0593c01	應知是等無餘親近是即清淨。說金剛明妃	應 知 是 等 無 餘 親 近 是 即 清 淨 說 金 剛 明 妃 
T18n0892_002:0593c02	即色蘊清淨。遨哩明妃即受蘊清淨。嚩哩明	即 色 蘊 清 淨 遨 哩 明 妃 即 受 蘊 清 淨 嚩 哩 明 
T18n0892_002:0593c03	妃即想蘊清淨。金剛拏吉尼明妃即行蘊清	妃 即 想 蘊 清 淨 金 剛 拏 吉 尼 明 妃 即 行 蘊 清 
T18n0892_002:0593c04	淨。無我明妃即識蘊清淨。外第二重四方上	淨 無 我 明 妃 即 識 蘊 清 淨 外 第 二 重 四 方 上 
T18n0892_002:0593c05	下成就清淨者。謂帝釋方遨哩明妃即色境	下 成 就 清 淨 者 謂 帝 釋 方 遨 哩 明 妃 即 色 境 
T18n0892_002:0593c06	清淨。焰魔方陬哩明妃即聲境清淨。水天方	清 淨 焰 魔 方 陬 哩 明 妃 即 聲 境 清 淨 水 天 方 
T18n0892_002:0593c07	尾多梨明妃即香境清淨。酤尾羅天方渴三	尾 多 梨 明 妃 即 香 境 清 淨 酤 尾 羅 天 方 渴 三 
T18n0892_002:0593c08	摩哩明妃即味境清淨。下方地行明妃即觸	摩 哩 明 妃 即 味 境 清 淨 下 方 地 行 明 妃 即 觸 
T18n0892_002:0593c09	境清淨。上方空行明妃即法境清淨。又地行	境 清 淨 上 方 空 行 明 妃 即 法 境 清 淨 又 地 行 
T18n0892_002:0593c10	空行二種明妃。從是輪回涅槃自性之所出	空 行 二 種 明 妃 從 是 輪 回 涅 槃 自 性 之 所 出 
T18n0892_002:0593c11	生。外第二重四隅成就清淨者。謂伊舍那方	生 外 第 二 重 四 隅 成 就 清 淨 者 謂 伊 舍 那 方 
T18n0892_002:0593c12	十葛西明妃即地大清淨。火天方設嚩哩明	十 葛 西 明 妃 即 地 大 清 淨 火 天 方 設 嚩 哩 明 
T18n0892_002:0593c13	妃即水大清淨。迺哩底方贊拏哩明妃即火	妃 即 水 大 清 淨 迺 哩 底 方 贊 拏 哩 明 妃 即 火 
T18n0892_002:0593c14	大清淨。風天方弩彌尼明。妃即風大清淨。一	大 清 淨 風 天 方 弩 彌 尼 明 妃 即 風 大 清 淨 一 
T18n0892_002:0593c15	十六臂者即一十六空清淨。四足即四魔清	十 六 臂 者 即 一 十 六 空 清 淨 四 足 即 四 魔 清 
T18n0892_002:0593c16	淨。八面即八解脫清淨。三目即三金剛清淨。	淨 八 面 即 八 解 脫 清 淨 三 目 即 三 金 剛 清 淨 
T18n0892_002:0593c17	說金剛空智者即瞋清淨。嚩哩明妃即貪清	說 金 剛 空 智 者 即 瞋 清 淨 嚩 哩 明 妃 即 貪 清 
T18n0892_002:0593c18	淨。金剛拏吉尼明妃即嫉妬清淨。遨哩明妃	淨 金 剛 拏 吉 尼 明 妃 即 嫉 妬 清 淨 遨 哩 明 妃 
T18n0892_002:0593c19	即兩舌清淨。金剛明妃即癡清淨。如是蘊等	即 兩 舌 清 淨 金 剛 明 妃 即 癡 清 淨 如 是 蘊 等 
T18n0892_002:0593c20	清淨出生次第。彼於是法棄捨真實無能成	清 淨 出 生 次 第 彼 於 是 法 棄 捨 真 實 無 能 成 
T18n0892_002:0593c21	就。則為蘊等之所纏縛。若於世間癡闇真實	就 則 為 蘊 等 之 所 纏 縛 若 於 世 間 癡 闇 真 實 
T18n0892_002:0593c22	了知。即於是縛而得解脫。是故非色非聲非	了 知 即 於 是 縛 而 得 解 脫 是 故 非 色 非 聲 非 
T18n0892_002:0593c23	香非味非觸非法亦非世間。心清淨故即一	香 非 味 非 觸 非 法 亦 非 世 間 心 清 淨 故 即 一 
T18n0892_002:0593c24	切清淨。	切 清 淨 
T18n0892_002:0593c25	灌頂品第十	灌 頂 品 第 十 
T18n0892_002:0593c26	佛告金剛藏言。復次弟子灌頂曼拏羅法。如	佛 告 金 剛 藏 言 復 次 弟 子 灌 頂 曼 拏 羅 法 如 
T18n0892_002:0593c27	其次第我今當說。修瑜伽者先清淨地。或殊	其 次 第 我今當說 修 瑜 伽 者 先 清 淨 地 或 殊 
T18n0892_002:0593c28	妙園林菩薩聖賢得道之處。以吽字儀軌作	妙 園 林 菩 薩 聖 賢 得 道 之 處 以 吽 字 儀 軌 作 
T18n0892_002:0593c29	警覺已。然後於殿閣中。以五寶末或米粉末。	警 覺 已 然 後 於 殿 閣 中 以 五 寶 末 或 米 粉 末 
T18n0892_002:0594a01	粉畫最上大曼拏羅。其壇作三肘三指量。	粉 畫 最 上 大 曼 拏 羅 其 壇 作 三 肘 三 指 量 
T18n0892_002:0594a02	或增四指量指。明者入已於五部出生。乃至	或 增 四 指 量 指 明 者 入 已 於 五 部 出 生 乃 至 
T18n0892_002:0594a03	童子亦應親近是輪壇中。先令弟子以帛覆	童 子 亦 應 親 近 是 輪 壇 中 先 令 弟 子 以 帛 覆 
T18n0892_002:0594a04	面。及為說此難得親近希有之相。如是平等	面 及 為 說 此 難 得 親 近 希 有 之 相 如 是 平 等 
T18n0892_002:0594a05	作用境界。自他領納悉能棄捨。於有無性遠	作 用 境 界 自 他 領 納 悉 能 棄 捨 於 有 無 性 遠 
T18n0892_002:0594a06	離塵染等若虛空。以智慧方便染無染等。眾	離 塵 染 等 若 虛 空 以 智慧方便 染 無 染 等 眾 
T18n0892_002:0594a07	生緣力最上文字。諸所安住一切觀照。又彼	生 緣 力 最 上 文 字 諸 所 安 住 一 切 觀 照 又 彼 
T18n0892_002:0594a08	世間有性無性之所建立。及餘所有我人眾	世 間 有 性 無 性 之 所 建 立 及 餘 所 有 我 人 眾 
T18n0892_002:0594a09	生。色者受者命者士夫補特伽羅。如是諸有	生 色 者 受 者 命 者 士夫補特伽羅 如 是 諸 有 
T18n0892_002:0594a10	自性悉幻化相。時會聽者於金剛藏及一切	自 性 悉 幻 化 相 時 會 聽 者 於 金 剛 藏 及 一 切 
T18n0892_002:0594a11	如來前。歡喜踴躍作是唱言。我於喜最上喜	如 來 前 歡 喜 踴 躍 作 是 唱 言 我 於 喜 最 上 喜 
T18n0892_002:0594a12	離喜。如是三種世間色相悉無所得。及俱生	離 喜 如 是 三 種 世 間 色 相 悉 無 所 得 及 俱 生 
T18n0892_002:0594a13	喜無復疑惑。時金剛藏讚言。善哉善哉是中	喜 無 復 疑 惑 時 金 剛 藏 讚 言 善哉善哉 是 中 
T18n0892_002:0594a14	非貪非離。及彼中間皆。不可得。如是俱生喜	非 貪 非 離 及 彼 中 間 皆 不 可 得 如 是 俱 生 喜 
T18n0892_002:0594a15	遠離三種說名正覺。佛言金剛藏而知喜等	遠 離 三 種 說 名 正 覺 佛 言 金 剛 藏 而 知 喜 等 
T18n0892_002:0594a16	三種遠離。如現浮雲猶成幻化。於俱生喜如	三 種 遠 離 如 現 浮 雲 猶 成 幻 化 於 俱 生 喜 如 
T18n0892_002:0594a17	睡夢覺。破一切相得無分別。瑜伽印契悉能	睡 夢 覺 破 一 切 相 得 無 分 別 瑜 伽 印 契 悉 能 
T18n0892_002:0594a18	成就。以我四方曼荼羅放熾盛光明。而調御	成 就 以 我 四 方 曼 荼 羅 放 熾 盛 光 明 而 調 御 
T18n0892_002:0594a19	之四門樓閣。珠纓半纓雜色交映。無量間錯	之 四 門 樓 閣 珠 纓 半 纓 雜 色 交 映 無 量 間 錯 
T18n0892_002:0594a20	莊嚴八柱。以金剛線平等相應。種種妙華燒	莊 嚴 八 柱 以 金 剛 線 平 等 相 應 種 種 妙 華 燒 
T18n0892_002:0594a21	香塗香及妙燈明。八大賢瓶殊妙莊嚴於。彼	香 塗 香 及 妙 燈 明 八 大 賢 瓶 殊 妙 莊 嚴 於 彼 
T18n0892_002:0594a22	瓶中插波羅葉吉祥樹枝。入五寶末。上妙繒	瓶 中 插 波 羅 葉 吉 祥 樹 枝 入 五 寶 末 上 妙 繒 
T18n0892_002:0594a23	[疊*毛]繫覆瓶項。隨自本尊作第九賢瓶。殊妙相	[疊毛] 繫 覆 瓶 項 隨 自 本 尊 作 第 九 賢 瓶 殊 妙 相 
T18n0892_002:0594a24	應如前嚴飾。線及智線應善抨量。於輪壇所	應 如 前 嚴 飾 線 及 智 線 應 善 抨 量 於 輪 壇 所 
T18n0892_002:0594a25	誦一洛叉及阿庾多數。所誦真言如前已說。	誦 一 洛 叉 及 阿 庾 多 數 所 誦 真 言 如 前 已 說 
T18n0892_002:0594a26	又瑜伽者先擇淨地。施諸飲食作護已身。如	又 瑜 伽 者 先 擇 淨 地 施 諸 飲 食 作 護 已 身 如 
T18n0892_002:0594a27	其所見觀想處所。於自壇中示灌頂法。供養	其 所 見 觀 想 處 所 於 自 壇 中 示 灌 頂 法 供 養 
T18n0892_002:0594a28	祈請皆如上說。內外兩重善巧安布。遨哩明	祈 請 皆 如 上 說 內 外 兩 重 善 巧 安 布 遨 哩 明 
T18n0892_002:0594a29	妃如次紛畫。先於東方粉畫寶刀。南西北方	妃 如 次 紛 畫 先 於 東 方 粉 畫 寶 刀 南 西 北 方 
T18n0892_002:0594b01	四維上下亦復如是。時金剛薩埵清淨澡浴	四 維 上 下 亦復如是 時 金 剛 薩 埵 清 淨 澡 浴 
T18n0892_002:0594b02	身塗妙香。華鬘珠寶極勝莊嚴。勇猛決定引	身 塗 妙 香 華 鬘 珠 寶 極 勝 莊 嚴 勇 猛 決 定 引 
T18n0892_002:0594b03	離茶步。入阿闍梨大曼拏羅。兩稱吽字作勇	離 茶 步 入 阿 闍 梨 大 曼 拏 羅 兩 稱 吽 字 作 勇 
T18n0892_002:0594b04	猛勢。復誦呬呬字辟除怖畢。與二臂空智金	猛 勢 復 誦 呬 呬 字 辟 除 怖 畢 與 二 臂 空 智 金 
T18n0892_002:0594b05	剛相應。然後為說真實平等清淨智相。不壞	剛 相 應 然 後 為 說 真 實 平 等 清 淨 智 相 不 壞 
T18n0892_002:0594b06	他教息除輪轉。於無所觀無能觀者。無取無	他 教 息 除 輪 轉 於 無 所 觀 無 能 觀 者 無 取 無 
T18n0892_002:0594b07	不取離二相故。	不 取 離 二 相 故 
T18n0892_002:0594b08	又瑜伽者諸有飲食無復淨穢。不生癡厭無	又 瑜 伽 者 諸 有 飲 食 無 復 淨 穢 不 生 癡 厭 無 
T18n0892_002:0594b09	有三毒。兩舌嫉妬慢過慢等。若冤若親心無	有 三 毒 兩 舌 嫉 妬 慢 過 慢 等 若 冤 若 親 心 無 
T18n0892_002:0594b10	所動。何意於中得生我相。自性清淨本然故	所 動 何 意 於 中 得 生 我 相 自 性 清 淨 本 然 故 
T18n0892_002:0594b11	爾。彼金剛拏吉尼等與是妙樂。身諸色相悉	爾 彼 金 剛 拏 吉 尼 等 與 是 妙 樂 身 諸 色 相 悉 
T18n0892_002:0594b12	無所動。金剛藏白佛言。世尊云何五大種。佛	無 所 動 金 剛 藏 白 佛 言 世 尊 云 何 五 大 種 佛 
T18n0892_002:0594b13	言是菩提心之所容受。觸堅硬法即是地大。	言 是 菩 提 心 之 所 容 受 觸 堅 硬 法 即 是 地 大 
T18n0892_002:0594b14	彼濕潤性即是水大。彼溫熱性即是火大。彼	彼 濕 潤 性 即 是 水 大 彼 溫 熱 性 即 是 火 大 彼 
T18n0892_002:0594b15	動轉性即是風大。說妙樂性即是空大。此五	動 轉 性 即 是 風 大 說 妙 樂 性 即 是 空 大 此 五 
T18n0892_002:0594b16	大種能為繫縛。若於妙樂發俱生喜說是自	大 種 能 為 繫 縛 若 於 妙 樂 發 俱 生 喜 說 是 自 
T18n0892_002:0594b17	性。一切所作是即持戒。以大悲方便之所相	性 一 切 所 作 是 即 持 戒 以 大 悲 方 便 之 所 相 
T18n0892_002:0594b18	應。設不護魔粉布輪壇。猶於色相心心平等。	應 設 不 護 魔 粉 布 輪 壇 猶 於 色 相 心 心 平 等 
T18n0892_002:0594b19	佛說大悲空智金剛大教王儀軌經卷第二	佛 說 大 悲 空 智 金 剛 大 教 王 儀 軌 經 卷 第 二 
T18n0892_003:0594b23	佛說大悲空智金剛大教王儀軌	佛 說 大 悲 空 智 金 剛 大 教 王 儀 軌 
T18n0892_003:0594b24	經卷第三	經 卷 第 三 
T18n0892_003:0594b26	宋西天三藏銀青光祿大夫試光祿卿	宋 西 天 三 藏 銀 青 光 祿 大 夫 試 光 祿 卿 
T18n0892_003:0594b27	普明慈覺大師法護奉　詔譯	普 明 慈 覺 大 師 法 護 奉 詔 譯 
T18n0892_003:0594b28	金剛藏菩薩現證儀軌王品第十一	金 剛 藏 菩 薩 現 證 儀 軌 王 品 第 十 一 
T18n0892_003:0594b29	佛告金剛藏言。顰眉顧視名忿怒眼。二目向	佛 告 金 剛 藏 言 顰 眉 顧 視 名 忿 怒 眼 二 目 向 
T18n0892_003:0594c01	左顧視名信愛眼。向右顧視或二目仰視並	左 顧 視 名 信 愛 眼 向 右 顧 視 或 二 目 仰 視 並 
T18n0892_003:0594c02	鉤召眼。二目平視或視鼻準上。觀出息或屏	鉤 召 眼 二 目 平 視 或 視 鼻 準 上 觀 出 息 或 屏 
T18n0892_003:0594c03	氣並信愛用。觀入息鉤召用。說鬼宿日觀乳	氣 並 信 愛 用 觀 入 息 鉤 召 用 說 鬼 宿 日 觀 乳 
T18n0892_003:0594c04	木樹名信愛用。以金剛杵止草木動。並息災	木 樹 名 信 愛 用 以 金 剛 杵 止 草 木 動 並 息 災 
T18n0892_003:0594c05	鉤召用。於六月分修習相應成就無礙。以佛	鉤 召 用 於 六 月 分 修 習 相 應 成 就 無 礙 以 佛 
T18n0892_003:0594c06	神力不思議故。得成就已。令諸眾生入佛知	神 力 不 思 議 故 得 成 就 已 令 諸 眾 生 入 佛 知 
T18n0892_003:0594c07	見。不應降伏作損惱事。又此三昧不應分別。	見 不 應 降 伏 作 損 惱 事 又 此 三 昧 不 應 分 別 
T18n0892_003:0594c08	得大罪咎諸所作事。乃至語言畢竟利益。若	得 大 罪 咎 諸 所 作 事 乃 至 語 言 畢 竟 利 益 若 
T18n0892_003:0594c09	於眾生少分損害。如是法印不能成就。服三	於 眾 生 少 分 損 害 如 是 法 印 不 能 成 就 服 三 
T18n0892_003:0594c10	昧藥者。住歌詠舞戲三摩呬多是所對治。自	昧 藥 者 住 歌 詠 舞 戲 三 摩 呬 多 是 所 對 治 自 
T18n0892_003:0594c11	他飲食如五甘露。又說是相於七日中。應知	他 飲 食 如 五 甘 露 又 說 是 相 於七日中 應 知 
T18n0892_003:0594c12	成就離喜過失。或有殊妙言音眼目修淨身	成 就 離 喜 過 失 或 有 殊 妙 言 音 眼 目 修 淨 身 
T18n0892_003:0594c13	出妙香。影長七步大身人來。見是相已即知	出 妙 香 影 長 七 步 大 身 人 來 見 是 相 已 即 知 
T18n0892_003:0594c14	聖賢。修瑜伽者觸彼少分。得剎那頃作持明	聖 賢 修 瑜 伽 者 觸 彼 少 分 得 剎 那 頃 作 持 明 
T18n0892_003:0594c15	仙。我今於十二廣大儀軌中。略說酤羅菩薩	仙 我 今 於 十 二 廣 大 儀 軌 中 略 說 酤 羅 菩 薩 
T18n0892_003:0594c16	於諸眾生。速疾成就信愛之法。從紇哩字	於 諸 眾 生 速 疾 成 就 信 愛 之 法 從 紇 哩 字 
T18n0892_003:0594c17	觀想本尊。紅色四臂手執弓箭。持優鉢羅華	觀 想 本 尊 紅 色 四 臂 手 執 弓 箭 持 優 鉢 羅 華 
T18n0892_003:0594c18	及蓮華鉤。如是觀想於三界中而為信愛。於	及 蓮 華 鉤 如 是 觀 想 於 三 界 中 而 為 信 愛 於 
