T18n0892_001:0587c05	佛說大悲空智金剛大教王儀軌	佛 說 大 悲 空 智 金 剛 大 教 王 儀 軌 
T18n0892_001:0587c06	經卷第一(大幻化普通儀軌三十一分中略出二無我法)	經 卷 第 一 大 幻 化 普 通 儀 軌 三 十 一 分 中 略 出 二 無 我 法 
T18n0892_001:0587c08	宋西天三藏銀青光祿大夫試光祿卿	宋 西 天 三 藏 銀 青 光 祿 大 夫 試 光 祿 卿 
T18n0892_001:0587c09	普明慈覺傳梵大師法護奉　詔譯	普 明 慈 覺 傳 梵 大 師 法 護 奉 詔 譯 
T18n0892_001:0587c10	金剛部序品第一	金 剛 部 序 品 第 一 
T18n0892_001:0587c11	如是我聞。一時薄伽梵。住一切如來身語	如是我聞 一 時 薄 伽 梵 住 一 切 如 來 身 語 
T18n0892_001:0587c12	心金剛喻施婆倪數祕密中祕密出生妙三摩	心 金 剛 喻 施 婆 倪 數 祕 密 中 祕 密 出 生 妙 三 摩 
T18n0892_001:0587c13	地。時彼世尊從是三摩地起。讚言善哉善哉	地 時 彼 世 尊 從 是 三 摩 地 起 讚 言 善哉善哉 
T18n0892_001:0587c14	金剛藏菩薩摩訶薩。奇哉金剛薩埵大薩	金 剛 藏 菩薩摩訶薩 奇 哉 金 剛 薩 埵 大 薩 
T18n0892_001:0587c15	埵三昧耶薩埵。悉從大悲空智金剛大菩	埵 三 昧 耶 薩 埵 悉 從 大 悲 空 智 金 剛 大 菩 
T18n0892_001:0587c16	提心之所開示。	提 心 之 所 開 示 
T18n0892_001:0587c17	爾時金剛藏菩薩。聞是語已即白佛言。世尊	爾 時 金 剛 藏 菩 薩 聞 是 語 已 即 白 佛 言 世 尊 
T18n0892_001:0587c18	云何金剛薩埵。云何大薩埵。云何三昧耶薩	云 何 金 剛 薩 埵 云 何 大 薩 埵 云 何 三 昧 耶 薩 
T18n0892_001:0587c19	埵。唯願世尊為我解說。佛告金剛藏菩薩。金	埵 唯 願 世 尊 為 我 解 說 佛 告 金 剛 藏 菩 薩 金 
T18n0892_001:0587c20	剛者謂不可破壞。薩埵者謂三有一性。勝	剛 者 謂 不可破壞 薩 埵 者 謂 三 有 一 性 勝 
T18n0892_001:0587c21	慧相應是名金剛薩埵。謂於大智勝味充滿。	慧 相 應 是 名 金 剛 薩 埵 謂 於 大 智 勝 味 充 滿 
T18n0892_001:0587c22	是名大薩埵。謂常行三昧。是名三昧耶薩	是 名 大 薩 埵 謂 常行三昧 是 名 三 昧 耶 薩 
T18n0892_001:0587c23	埵。時金剛藏菩薩重白佛言。世尊空智金剛	埵 時 金 剛 藏 菩 薩 重 白 佛 言 世 尊 空 智 金 剛 
T18n0892_001:0587c24	者。於如是名云何攝受。云何名空智。何等	者 於 如 是 名 云 何 攝 受 云 何 名 空 智 何 等 
T18n0892_001:0587c25	名金剛。佛告金剛藏菩薩。空智者謂即大	名 金 剛 佛 告 金 剛 藏 菩 薩 空 智 者 謂 即 大 
T18n0892_001:0587c26	悲空智。金剛者體即勝慧。以勝慧方便成就	悲 空 智 金 剛 者 體 即 勝 慧 以 勝 慧 方 便 成 就 
T18n0892_001:0587c27	儀軌。於彼見聞有大力。能種種成辦。謂降伏	儀 軌 於 彼 見 聞 有 大 力 能 種 種 成 辦 謂 降 伏 
T18n0892_001:0587c28	禁止。或却他軍及瑜儗尼。如其正理生住因	禁 止 或 却 他 軍 及 瑜 儗 尼 如 其 正 理 生 住 因 
T18n0892_001:0587c29	緣。以識智成辦如其出現諸佛聖賢。是為空	緣 以 識 智 成 辦 如 其 出 現 諸 佛 聖 賢 是 為 空 
T18n0892_001:0588a01	智最初出生行相。又復於大悲性如是解脫。	智 最 初 出 生 行 相 又 復 於 大 悲 性 如 是 解 脫 
T18n0892_001:0588a02	則於縛性縛。遍能了知悉皆解脫。所以者何。	則 於 縛 性 縛 遍 能 了 知 悉 皆 解 脫 所以者何 
T18n0892_001:0588a03	彼勝慧性及所知性悉非性故。彼空智性亦	彼 勝 慧 性 及 所 知 性 悉 非 性 故 彼 空 智 性 亦 
T18n0892_001:0588a04	非性故。以本然智決諸疑網。照解諸法本然	非 性 故 以 本 然 智 決 諸 疑 網 照 解 諸 法 本 然 
T18n0892_001:0588a05	不起。時金剛藏菩薩重白佛言。世尊如是空	不 起 時 金 剛 藏 菩 薩 重 白 佛 言 世 尊 如 是 空 
T18n0892_001:0588a06	智云何而有血脈之相。佛告金剛藏菩薩。彼	智 云 何 而 有 血 脈 之 相 佛 告 金 剛 藏 菩 薩 彼 
T18n0892_001:0588a07	血脈相有三十二種。是名三十二菩提之心。	血 脈 相 有 三 十 二 種 是 名 三 十 二 菩提之心 
T18n0892_001:0588a08	又此漏法於大樂處總有三種。謂羅羅拏辣	又 此 漏 法 於 大 樂 處 總 有 三 種 謂 羅 羅 拏 辣 
T18n0892_001:0588a09	娑摩阿嚩底。羅羅拏者即勝慧自性。辣娑拏	娑 摩 阿 嚩 底 羅 羅 拏 者 即 勝 慧 自 性 辣 娑 拏 
T18n0892_001:0588a10	者謂善方便。阿嚩底者是中說。離能取所取。	者 謂 善 方 便 阿 嚩 底 者 是 中 說 離 能取所取 
T18n0892_001:0588a11	又此三種即是住持不動清淨智月。彼三十	又 此 三 種 即 是 住 持 不 動 清 淨 智 月 彼 三 十 
T18n0892_001:0588a12	二種血脈者。謂一者不可破壞。二者微妙	二 種 血 脈 者 謂 一 者 不可破壞 二 者 微 妙 
T18n0892_001:0588a13	色相。三者天。四者左邊際。五者短。六者	色 相 三 者 天 四 者 左 邊 際 五 者 短 六 者 
T18n0892_001:0588a14	酤摩惹。七者性。八者施迦。九者過失。十	酤 摩 惹 七 者 性 八 者 施 迦 九 者 過 失 十 
T18n0892_001:0588a15	者阿尾吒。十一者本母。十二者設哩嚩	者 阿 尾 吒 十 一 者 本 母 十 二 者 設 哩 嚩 
T18n0892_001:0588a16	梨。十三者清涼。十四者焰熾。十五者羅	梨 十 三 者 清 涼 十 四 者 焰 熾 十 五 者 羅 
T18n0892_001:0588a17	羅拏。十六者辣娑拏。十七者阿嚩底。十八	羅 拏 十 六 者 辣 娑 拏 十 七 者 阿 嚩 底 十 八 
T18n0892_001:0588a18	者量。十九者青色。二十者平等。二十一	者 量 十 九 者 青 色 二 十 者 平 等 二 十 一 
T18n0892_001:0588a19	者因。二十二者相應。二十三者喜。二十	者 因 二 十 二 者 相 應 二 十 三 者 喜 二 十 
T18n0892_001:0588a20	四者成就。二十五者煗。二十六者蘇末	四 者 成 就 二 十 五 者 煗 二 十 六 者 蘇 末 
T18n0892_001:0588a21	他。二十七者轉。二十八者欲。二十九者	他 二 十 七 者 轉 二 十 八 者 欲 二 十 九 者 
T18n0892_001:0588a22	忿怒。三十者迦多演尼。三十一者童子。	忿 怒 三 十 者 迦 多 演 尼 三 十 一 者 童 子 
T18n0892_001:0588a23	三十二者施設。是名三十二種血脈之相。	三 十 二 者 施 設 是 名 三 十 二 種 血 脈 之 相 
T18n0892_001:0588a24	復次金剛藏菩薩白佛言。世尊此何因緣有	復 次 金 剛 藏 菩 薩 白 佛 言 世 尊 此 何 因 緣 有 
T18n0892_001:0588a25	如是相。佛告金剛藏菩薩。謂欲成熟三有。遠	如 是 相 佛 告 金 剛 藏 菩 薩 謂 欲 成 熟 三 有 遠 
T18n0892_001:0588a26	離一切能取所取。以諸方便了別性相。為持	離 一 切 能取所取 以 諸 方 便 了 別 性 相 為 持 
T18n0892_001:0588a27	戒者分別解說。諸佛賢聖智慧方便。三身三	戒 者 分別解說 諸 佛 賢 聖 智慧方便 三 身 三 
T18n0892_001:0588a28	業及伊鑁摩野。謂伊者佛眼母菩薩鑁者	業 及 伊 鑁 摩 野 謂 伊 者 佛 眼 母 菩 薩 鑁 者 
T18n0892_001:0588a29	摩摩枳菩薩。摩者白衣菩薩。野者多羅菩	摩 摩 枳 菩 薩 摩 者 白 衣 菩 薩 野 者 多 羅 菩 
T18n0892_001:0588b01	薩。又復法身輪者具八輻相。報身輪者具十	薩 又 復 法 身 輪 者 具 八 輻 相 報 身 輪 者 具 十 
T18n0892_001:0588b02	六輻。化身輪者具蓮華相六十四葉。大藥輪	六 輻 化 身 輪 者 具 蓮 華 相 六 十 四 葉 大 藥 輪 
T18n0892_001:0588b03	者具三十二幅。建此輪者如是次第有四剎	者 具 三 十 二 幅 建 此 輪 者 如 是 次 第 有 四 剎 
T18n0892_001:0588b04	那。謂莊嚴果報作觀離相。依四聖諦謂苦集	那 謂 莊 嚴 果 報 作 觀 離 相 依 四 聖 諦 謂 苦 集 
T18n0892_001:0588b05	滅道依四真實謂身真實智真實持明真實聖	滅 道 依 四 真 實 謂 身 真 實 智 真 實 持 明 真 實 聖 
T18n0892_001:0588b06	賢真實。有四歡喜謂喜勝喜離喜俱生喜等。	賢 真 實 有 四 歡 喜 謂 喜 勝 喜 離 喜 俱 生 喜 等 
T18n0892_001:0588b07	依四種律謂上座部大眾部正量部一切有	依 四 種 律 謂 上 座 部 大 眾 部 正 量 部 一 切 有 
T18n0892_001:0588b08	部。日月時分晝夜增減。謂於八時有十六分	部 日 月 時 分 晝 夜 增 減 謂 於 八 時 有 十 六 分 
T18n0892_001:0588b09	三十二點六十四刻。如是一切四種最初贊	三 十 二 點 六 十 四 刻 如是一切 四 種 最 初 贊 
T18n0892_001:0588b10	拏梨明妃。從彼臍輪發大智火焚棄五蘊。以	拏 梨 明 妃 從 彼 臍 輪 發 大 智 火 焚 棄 五 蘊 以 
T18n0892_001:0588b11	佛眼母焚燼諸漏除妄因緣故。	佛 眼 母 焚 燼 諸 漏 除 妄 因 緣 故 
T18n0892_001:0588b12	拏吉尼熾盛威儀真言品第二	拏 吉 尼 熾 盛 威 儀 真 言 品 第 二 
T18n0892_001:0588b13	施一切地上飲食真言曰。	施 一 切 地 上 飲 食 真 言 曰 
T18n0892_001:0588b14	唵(引)(一)阿吽(引)(三)發吒(半音)莎(引)賀(引下同四)	唵 引 一 阿 吽 引 三 發 吒 半 音 莎 引 賀 引 下 同 四 
T18n0892_001:0588b15	佛言唵阿者作一切法出生門故。	佛 言 唵 阿 者 作 一 切 法 出 生 門 故 
T18n0892_001:0588b16	五如來種子者所謂。	五 如 來 種 子 者 所 謂 
T18n0892_001:0588b17	捫(一)盎(二)[口*爾]陵(二合引)(三)龕(四)吽(五引)	捫 一 盎 二 [口爾] 陵 二 合 引 三 龕 四 吽 五 引 
T18n0892_001:0588b18	空智金剛心真言曰。	空 智 金 剛 心 真 言 曰 
T18n0892_001:0588b19	唵(引)(一)禰嚩畢祖(二)嚩惹囉(二合)吽(引)(三)吽(引)(四)	唵 引 一 禰 嚩 畢 祖 二 嚩 惹 囉 二 合 吽 引 三 吽 引 四 
T18n0892_001:0588b20	吽(引)(五)發吒(半音)莎賀(六)	吽 引 五 發 吒 半 音 莎 賀 六 
T18n0892_001:0588b21	佛言一切真言句首。當安唵字。次置吽發吒	佛 言 一 切 真 言 句 首 當 安 唵 字 次 置 吽 發 吒 
T18n0892_001:0588b22	字。後用莎賀字。	字 後 用 莎 賀 字 
T18n0892_001:0588b23	阿閦如來真言曰。	阿 閦 如 來 真 言 曰 
T18n0892_001:0588b24	唵(引)(一)遏(二)葛(三)拶(四)吒(五)多(六)波(七)野設莎賀	唵 引 一 遏 二 葛 三 拶 四 吒 五 多 六 波 七 野 設 莎 賀 
T18n0892_001:0588b25	(八)	 八 
T18n0892_001:0588b26	佛言一切瑜儗尼種子字。	佛 言 一 切 瑜 儗 尼 種 子 字 
T18n0892_001:0588b27	遏(一)阿(引)(二)壹(三)翳(引)(四)嗢(五)污(引)(六)哩(七)梨(八)嚕	遏 一 阿 引 二 壹 三 翳 引 四 嗢 五 污 引 六 哩 七 梨 八 嚕 
T18n0892_001:0588b28	(九)盧(十)伊(十一)愛(引)(十二)鄔(十三)奧(引)(十四)暗(十五)惡(十六)	 九 盧 十 伊 十 一 愛 引 十 二 鄔 十 三 奧 引 十 四 暗 十 五 惡 十 六 
T18n0892_001:0588b29	二臂明王真言曰。	二 臂 明 王 真 言 曰 
T18n0892_001:0588c01	唵(引)(一)怛懶(二合)路(引)歌(引)(二)叱波各(引)(三)吽(引)(四)	唵 引 一 怛 懶 二 合 路 引 歌 引 二 叱 波 各 引 三 吽 引 四 
T18n0892_001:0588c02	吽(引)(五)吽(引)(六)發吒(半音)莎賀(七)	吽 引 五 吽 引 六 發 吒 半 音 莎 賀 七 
T18n0892_001:0588c03	四臂明王真言曰。	四 臂 明 王 真 言 曰 
T18n0892_001:0588c04	唵(引)入嚩(二合)囉(二)入嚩(二合)囉毘喻(二合引)(三)吽(引	唵 引 入 嚩 二 合 囉 二 入 嚩 二 合 囉 毘 喻 二 合 引 三 吽 引 
T18n0892_001:0588c05	四)吽(引)(五)吽(引)(六)發吒(半音)莎賀(七)	四 吽 引 五 吽 引 六 發 吒 半 音 莎 賀 七 
T18n0892_001:0588c06	六臂明王真言曰。	六 臂 明 王 真 言 曰 
T18n0892_001:0588c07	唵(引)(一)吉胝吉胝(二)嚩惹囉(二合)吽(引)(三)吽(引)(四)	唵 引 一 吉 胝 吉 胝 二 嚩 惹 囉 二 合 吽 引 三 吽 引 四 
T18n0892_001:0588c08	吽(引)(五)發吒(半音)莎賀(六)	吽 引 五 發 吒 半 音 莎 賀 六 
T18n0892_001:0588c09	加持真言曰。	加 持 真 言 曰 
T18n0892_001:0588c10	唵(引)(一)阿(引)(二)吽(引)(三)	唵 引 一 阿 引 二 吽 引 三 
T18n0892_001:0588c11	淨地真言曰。	淨 地 真 言 曰 
T18n0892_001:0588c12	唵(引)(一)犖叉(上呂角切下同)犖叉(二)犖叉吽(引)(三)吽(引)(四)吽	唵 引 一 犖 叉 上 呂 角 切 下 同 犖 叉 二 犖 叉 吽 引 三 吽 引 四 吽 
T18n0892_001:0588c13	(引)(五)發吒(半音)莎賀(六)	 引 五 發 吒 半 音 莎 賀 六 
T18n0892_001:0588c14	禁止真言曰。	禁 止 真 言 曰 
T18n0892_001:0588c15	唵(引)(一)吽(引)(二)莎賀(三)	唵 引 一 吽 引 二 莎 賀 三 
T18n0892_001:0588c16	發遣真言曰。	發 遣 真 言 曰 
T18n0892_001:0588c17	唵(引)(一)龕(二)莎賀(三)	唵 引 一 龕 二 莎 賀 三 
T18n0892_001:0588c18	忿怒真言曰。	忿 怒 真 言 曰 
T18n0892_001:0588c19	唵(引)(一)紇陵(二合引)(二)莎賀(三)	唵 引 一 紇 陵 二 合 引 二 莎 賀 三 
T18n0892_001:0588c20	降伏真言曰。	降 伏 真 言 曰 
T18n0892_001:0588c21	唵(引)(一)吽(引)(二)莎賀(三)	唵 引 一 吽 引 二 莎 賀 三 
T18n0892_001:0588c22	鉤召真言曰。	鉤 召 真 言 曰 
T18n0892_001:0589a01	唵(引)(一)枯(二)莎賀(三)	唵 引 一 枯 二 莎 賀 三 
T18n0892_001:0589a02	又降伏真言曰。	又 降 伏 真 言 曰 
T18n0892_001:0589a03	唵(引)(一)捫(二)莎賀(三)	唵 引 一 捫 二 莎 賀 三 
T18n0892_001:0589a04	信愛真言曰。	信 愛 真 言 曰 
T18n0892_001:0589a05	唵(引)(一)酤嚕梨(引)(二)紇哩(二合引)(三)莎賀(四)	唵 引 一 酤 嚕 梨 引 二 紇 哩 二 合 引 三 莎 賀 四 
T18n0892_001:0589a06	佛言若天旱時欲請雨者。先建曼荼羅。用寒	佛 言 若 天 旱 時 欲 請 雨 者 先 建 曼 荼 羅 用 寒 
T18n0892_001:0589a07	林線。絣量界道。於壇中心。以寒林中五色粉。	林 線 絣 量 界 道 於 壇 中 心 以 寒 林 中 五 色 粉 
T18n0892_001:0589a08	骨作白粉。炭作黑粉。甎作赤粉。雄黃作黃粉。	骨 作 白 粉 炭 作 黑 粉 甎 作 赤 粉 雄 黃 作 黃 粉 
T18n0892_001:0589a09	陬羅葉作緣粉(以石碌代之)粉畫空智金剛大明王。	陬 羅 葉 作 緣 粉 以 石 碌 代 之 粉 畫 空 智 金 剛 大 明 王 
T18n0892_001:0589a10	八面四足一十六臂。面各三目作忿怒相。踏	八 面 四 足 一 十 六 臂 面 各 三 目 作 忿 怒 相 踏 
T18n0892_001:0589a11	阿難陀龍王。復以香泥捏造阿難陀龍王像。	阿 難 陀 龍 王 復 以 香 泥 捏 造 阿 難 陀 龍 王 像 
T18n0892_001:0589a12	其龍王及妃種子字並用朴堊。以五甘露沐	其 龍 王 及 妃 種 子 字 並 用 朴 堊 以 五 甘 露 沐 
T18n0892_001:0589a13	浴散黑色花。次以龍華樹汁塗之(或以白蒿汁代之)復以	浴 散 黑 色 花 次 以 龍 華 樹 汁 塗 之 或 以 白 蒿 汁 代 之 復 以 
T18n0892_001:0589a14	象眵塗龍王頂上。於黑月十四日。取黑牛乳	象 眵 塗 龍 王 頂 上 於 黑 月 十 四 日 取 黑 牛 乳 
T18n0892_001:0589a15	盛滿器中。令黑色童女合青色線。於壇西北	盛 滿 器 中 令 黑 色 童 女 合 青 色 線 於 壇 西 北 
T18n0892_001:0589a16	隅開一小池。以阿難陀龍王安彼池中。然後	隅 開 一 小 池 以 阿 難 陀 龍 王 安 彼 池 中 然 後 
T18n0892_001:0589a17	阿闍梨依法厲聲。無間誦此請雨真言曰。	阿 闍 梨 依 法 厲 聲 無 間 誦 此 請 雨 真 言 曰 
T18n0892_001:0589a18	唵(引)(一)苦嚕苦嚕(二)渴痆(女轄切下同)渴痆(三)末娑末	唵 引 一 苦 嚕 苦 嚕 二 渴 痆 女 轄 切 下 同 渴 痆 三 末 娑 末 
T18n0892_001:0589a19	娑(四)渴吒渴吒(五)枯吒野枯吒野(六)阿難多(七)閦	娑 四 渴 吒 渴 吒 五 枯 吒 野 枯 吒 野 六 阿 難 多 七 閦 
T18n0892_001:0589a20	婆葛囉(引)野(八)那(引)誐(引)提鉢多曳(九)呬呬嚕嚕	婆 葛 囉 引 野 八 那 引 誐 引 提 鉢 多 曳 九 呬 呬 嚕 嚕 
T18n0892_001:0589a21	紺(十)薩鉢多(二合)播(引)多(引)羅誐耽(引)(十一)那(引)誐(引)	紺 十 薩 鉢 多 二 合 播 引 多 引 羅 誐 耽 引 十 一 那 引 誐 引 
T18n0892_001:0589a22	那(引)歌(引)哩沙(二合)野(十二)末哩沙(二合)野(十三)誐	那 引 歌 引 哩 沙 二 合 野 十 二 末 哩 沙 二 合 野 十 三 誐 
T18n0892_001:0589a23	哩惹(二合)野(十四)扑(十五)扑(十六)扑(十七)扑(十八)扑(十	哩 惹 二 合 野 十 四 扑 十 五 扑 十 六 扑 十 七 扑 十 八 扑 十 
T18n0892_001:0589a24	九)扑(二十)扑(二十一)扑(二十二)吽(引)(二十三)吽(引)(二十四)吽(二十五)莎賀	九 扑 二 十 扑 二 十 一 扑 二 十 二 吽 引 二 十 三 吽 引 二 十 四 吽 二 十 五 莎 賀 
T18n0892_001:0589a25	(二十六)	 二 十 六 
T18n0892_001:0589a26	誦此真言。若時不雨。即當倒誦此呪。降霔大	誦 此 真 言 若 時 不 雨 即 當 倒 誦 此 呪 降 霔 大 
T18n0892_001:0589a27	雨。又若不雨。令彼龍王頭破七分如蘭香梢	雨 又 若 不 雨 令 彼 龍 王 頭 破 七 分 如 蘭 香 梢 
T18n0892_001:0589a28	若欲止雨。取寒林衣置於坐下。誦此真言即	若 欲 止 雨 取 寒 林 衣 置 於 坐 下 誦 此 真 言 即 
T18n0892_001:0589a29	能止雨。止雨真言曰。	能 止 雨 止 雨 真 言 曰 
T18n0892_001:0589b01	唵(引)(一)阿哩也(二合)(二)設摩(二合)舍(引)那畢哩(二合)	唵 引 一 阿 哩 也 二 合 二 設 摩 二 合 舍 引 那 畢 哩 二 合 
T18n0892_001:0589b02	夜(引)野(三)吽(引)(四)吽(引)(五)吽(引)(六)發吒(半音七)	夜 引 野 三 吽 引 四 吽 引 五 吽 引 六 發 吒 半 音 七 
T18n0892_001:0589b03	復次成就法。謂降伏他軍速令破壞。當用畫	復 次 成 就 法 謂 降 伏 他 軍 速 令 破 壞 當 用 畫 
T18n0892_001:0589b04	石為末入五甘露。以斷鐵草和合為丸。加持	石 為 末 入 五 甘 露 以 斷 鐵 草 和 合 為 丸 加 持 
T18n0892_001:0589b05	誦此真言曰。	誦 此 真 言 曰 
T18n0892_001:0589b06	唵(引)(一)嚩惹囉(二合)葛哩多(二合)哩(二)呬嚩惹囉	唵 引 一 嚩 惹 囉 二 合 葛 哩 多 二 合 哩 二 呬 嚩 惹 囉 
T18n0892_001:0589b07	(二合引)野(三)吽(引)(四)吽(引)(五)吽(引)(六)發吒(半音七)	 二 合 引 野 三 吽 引 四 吽 引 五 吽 引 六 發 吒 半 音 七 
T18n0892_001:0589b08	應先誦此真言一十萬遍。或一百萬遍。得成	應 先 誦 此 真 言 一 十 萬 遍 或 一 百 萬 遍 得 成 
T18n0892_001:0589b09	就已。即用前藥丸畫缾器頂。悉令周匝無使	就 已 即 用 前 藥 丸 畫 缾 器 頂 悉 令 周 匝 無 使 
T18n0892_001:0589b10	斷絕。即得他軍速皆破壞。	斷 絕 即 得 他 軍 速 皆 破 壞 
T18n0892_001:0589b11	若欲成就底羅紺法當用末羅摩子。白色	若 欲 成 就 底 羅 紺 法 當 用 末 羅 摩 子 白 色 
T18n0892_001:0589b12	曼度迦華。及斷鐵草。阿閦毘藥。於日蝕時	曼 度 迦 華 及 斷 鐵 草 阿 閦 毘 藥 於 日 蝕 時 
T18n0892_001:0589b13	和合作鉞斧形。踏兩足下誦此真言曰。	和 合 作 鉞 斧 形 踏 兩 足 下 誦 此 真 言 曰 
T18n0892_001:0589b14	唵(引)(一)嚩惹囉(二合)酤吒(引)囉(二)播(引)吒野播(引)	唵 引 一 嚩 惹 囉 二 合 酤 吒 引 囉 二 播 引 吒 野 播 引 
T18n0892_001:0589b15	吒野(三)吒吒(四)吽(引)(五)吽(引)(六)吽(引)(七)發吒莎賀(八)	吒 野 三 吒 吒 四 吽 引 五 吽 引 六 吽 引 七 發 吒 莎 賀 八 
T18n0892_001:0589b16	誦此真言一百萬遍。即得成就一切聖賢。尚	誦 此 真 言 一 百 萬 遍 即 得 成 就 一 切 聖 賢 尚 
T18n0892_001:0589b17	不違越何況破壞焰摩羅界。	不 違 越 何 況 破 壞 焰 摩 羅 界 
T18n0892_001:0589b18	復次成就法。若欲作諸瘧病。於阿哩迦樹	復 次 成 就 法 若 欲 作 諸 瘧 病 於 阿 哩 迦 樹 
T18n0892_001:0589b19	葉上。用唧多迦毒辣藥。書彼設覩嚕名字。	葉 上 用 唧 多 迦 毒 辣 藥 書 彼 設 覩 嚕 名 字 
T18n0892_001:0589b20	棄擲稻糠火中。誦此真言曰。	棄 擲 稻 糠 火 中 誦 此 真 言 曰 
T18n0892_001:0589b21	唵(引)(一)呬(引)嚩惹囉(二合)(二)入嚩(二合)囉入嚩(二合)	唵 引 一 呬 引 嚩 惹 囉 二 合 二 入 嚩 二 合 囉 入 嚩 二 合 
T18n0892_001:0589b22	囉(三)設咄籠(二合)(四)勃籠(二合)(五)吽(引)(六)吽(引)(七)吽(引)(八)	囉 三 設 咄 籠 二 合 四 勃 籠 二 合 五 吽 引 六 吽 引 七 吽 引 八 
T18n0892_001:0589b23	發吒莎賀	發 吒 莎 賀 
T18n0892_001:0589b24	誦此真言一阿庾多即得成就。	誦 此 真 言 一 阿 庾 多 即 得 成 就 
T18n0892_001:0589b25	若欲成就開摩黏法。於自臍輪作是觀想。或	若 欲 成 就 開 摩 黏 法 於 自 臍 輪 作 是 觀 想 或 
T18n0892_001:0589b26	於腹上觀想成辦。然後乃見摩黏自開。若欲	於 腹 上 觀 想 成 辦 然 後 乃 見 摩 黏 自 開 若 欲 
T18n0892_001:0589b27	作信愛法。於月八日分詣無憂樹下。著赤色	作 信 愛 法 於 月 八 日 分 詣 無 憂 樹 下 著 赤 色 
T18n0892_001:0589b28	衣食未捺那果。以肝摩唧歌樂汁塗於額	衣 食 未 捺 那 果 以 肝 摩 唧 歌 樂 汁 塗 於 額 
T18n0892_001:0589b29	上。誦此真言曰。	上 誦 此 真 言 曰 
T18n0892_001:0589c01	唵(引)(一)阿目計(引)弭(二)紇哩(二合引)嚩施(引)(三)婆鑁	唵 引 一 阿 目 計 引 弭 二 紇 哩 二 合 引 嚩 施 引 三 婆 鑁 
T18n0892_001:0589c02	覩(四)娑(引)賀(引)(五)	覩 四 娑 引 賀 引 五 
T18n0892_001:0589c03	誦此真言一阿庾多。無令間斷即得成就。	誦 此 真 言 一 阿 庾 多 無 令 間 斷 即 得 成 就 
T18n0892_001:0589c04	若欲制止日月。當用阿闍梨飯作日月狀。置	若 欲 制 止 日 月 當 用 阿 闍 梨 飯 作 日 月 狀 置 
T18n0892_001:0589c05	金剛水中誦此真言曰。	金 剛 水 中 誦 此 真 言 曰 
T18n0892_001:0589c06	唵(引)(一)嚩惹囉(二合)哩葛(二合引)(二)摩(引)左羅(三)摩(引)	唵 引 一 嚩 惹 囉 二 合 哩 葛 二 合 引 二 摩 引 左 羅 三 摩 引 
T18n0892_001:0589c07	左羅(四)底瑟吒(二合)(五)底瑟吒(二合)(六)呬嚩惹囉(二合引)(七)	左 羅 四 底 瑟 吒 二 合 五 底 瑟 吒 二 合 六 呬 嚩 惹 囉 二 合 引 七 
T18n0892_001:0589c08	野吽(引)(八)吽(引)(九)吽(引)(十)發吒(十一)莎賀(十二)	野 吽 引 八 吽 引 九 吽 引 十 發 吒 十 一 莎 賀 十 二 
T18n0892_001:0589c09	誦此真言七百萬遍。即得日月制止。於彼晝	誦 此 真 言 七 百 萬 遍 即 得 日 月 制 止 於 彼 晝 
T18n0892_001:0589c10	夜無能分別。又金剛喻沙多成就法。於日後	夜 無 能 分 別 又 金 剛 喻 沙 多 成 就 法 於 日 後 
T18n0892_001:0589c11	分。令一具相童女。以諸香華供養。念此真言	分 令 一 具 相 童 女 以 諸 香 華 供 養 念 此 真 言 
T18n0892_001:0589c12	一百八遍。然後用油沐浴。取多羅樹汁。塗於	一百八遍 然 後 用 油 沐 浴 取 多 羅 樹 汁 塗 於 
T18n0892_001:0589c13	童女大拇指上。及用此真言加持。即時應現	童 女 大 拇 指 上 及 用 此 真 言 加 持 即 時 應 現 
T18n0892_001:0589c14	乃問三世之事。時彼童女隨問為說。誦真言。	乃 問 三 世 之 事 時 彼 童 女 隨 問 為 說 誦 真 言 
T18n0892_001:0589c15	唵(引)(一)那誐囉(二合引)那誐囉(二合引)	唵 引 一 那 誐 囉 二 合 引 那 誐 囉 二 合 引 
T18n0892_001:0589c16	又成就法。	又 成 就 法 
T18n0892_001:0589c17	尾盧野(引)尾盧野(引)	尾 盧 野 引 尾 盧 野 引 
T18n0892_001:0589c18	誦此真言時象即犇走。	誦 此 真 言 時 象 即 犇 走 
T18n0892_001:0589c19	曼摩(引)曼摩(引)	曼 摩 引 曼 摩 引 
T18n0892_001:0589c20	誦此呪時虎即犇走。	誦 此 呪 時 虎 即 犇 走 
T18n0892_001:0589c21	底梨野(引)底梨野(引)	底 梨 野 引 底 梨 野 引 
T18n0892_001:0589c22	誦此呪時熊即犇走。	誦 此 呪 時 熊 即 犇 走 
T18n0892_001:0590a01	伊梨弭梨扑扑	伊 梨 弭 梨 扑 扑 
T18n0892_001:0590a02	誦此呪時蛇即犇走。	誦 此 呪 時 蛇 即 犇 走 
T18n0892_001:0590a03	佛告金剛藏菩薩。如我往昔亦以是法。調伏	佛 告 金 剛 藏 菩 薩 如 我 往 昔 亦 以 是 法 調 伏 
T18n0892_001:0590a04	護藏醉象悉令犇走。此遨哩明妃。設嚩哩明	護 藏 醉 象 悉 令 犇 走 此 遨 哩 明 妃 設 嚩 哩 明 
T18n0892_001:0590a05	妃。金剛拏吉尼即無我義。彼地行空行鉤召	妃 金 剛 拏 吉 尼 即 無 我 義 彼 地 行 空 行 鉤 召 
T18n0892_001:0590a06	發遣。悉相應故。	發 遣 悉 相 應 故 
T18n0892_001:0590a07	一切如來身語心聖賢品第三	一 切 如 來 身 語 心 聖 賢 品 第 三 
T18n0892_001:0590a08	　最初觀於慈　　次即觀於悲	 最 初 觀 於 慈 次 即 觀 於 悲 
T18n0892_001:0590a09	　第三當觀喜　　一切處學捨	 第 三 當 觀 喜 一 切 處 學 捨 
T18n0892_001:0590a10	　初空性菩提　　第二集種子	 初 空 性 菩 提 第 二 集 種 子 
T18n0892_001:0590a11	　三成辦形像　　後當觀字義	 三 成 辦 形 像 後 當 觀 字 義 
T18n0892_001:0590a12	　現前觀囉字　　成熾盛日輪	 現 前 觀 囉 字 成 熾 盛 日 輪 
T18n0892_001:0590a13	　於彼日輪中　　吽字金剛業	 於 彼 日 輪 中 吽 字 金 剛 業 
T18n0892_001:0590a14	　又復觀杵形　　牆網悉周遍	 又 復 觀 杵 形 牆 網 悉 周 遍 
T18n0892_001:0590a15	　先觀沒哩多　　成法界智者	 先 觀 沒 哩 多 成 法 界 智 者 
