T21n1382_001:0904a20	佛說宿命智陀羅尼	佛 說 宿 命 智 陀 羅 尼 
T21n1382_001:0904a22	西天譯經三藏朝散大夫試光祿卿	西 天 譯 經 三 藏 朝 散 大 夫 試 光 祿 卿 
T21n1382_001:0904a23	明教大師臣法賢奉　詔譯	明 教 大 師 臣 法 賢 奉 詔 譯 
T21n1382_001:0904a24	那謨(引)婆誐嚩帝(引)阿芻毘夜(二合引)野(一)怛他(引)	那 謨 引 婆 誐 嚩 帝 引 阿 芻 毘 夜 二 合 引 野 一 怛 他 引 
T21n1382_001:0904a25	誐多(引)野(二)阿囉曷(二合)帝(引)三藐訖三(二合)沒	誐 多 引 野 二 阿 囉 曷 二 合 帝 引 三 藐 訖 三 二 合 沒 
T21n1382_001:0904a26	馱(引)野(三)怛[寧*也](切身)他(引四)唵惡剎曳(引)惡剎曳	馱 引 野 三 怛 [寧也] 切 身 他 引 四 唵 惡 剎 曳 引 惡 剎 曳 
T21n1382_001:0904a27	(引五)惡剎野(引)嚩囉拏(六)尾輸(引)達儞(引)娑嚩	 引 五 惡 剎 野 引 嚩 囉 拏 六 尾 輸 引 達 儞 引 娑 嚩 
T21n1382_001:0904a28	(二合引)賀(引七)	 二 合 引 賀 引 七 
T21n1382_001:0904a29	佛說宿命智陀羅尼	佛 說 宿 命 智 陀 羅 尼 
