T24n1459_001:0628b09	　若非親族尼，　　苾芻取衣服；	 若 非 親 族 尼 苾 芻 取 衣 服 
T24n1459_001:0628b10	　為無憐愍故，　　得時招捨墮。	 為 無 憐 愍 故 得 時 招 捨 墮 
T24n1459_001:0628b11	　不與亦不取，　　換易便無過；	 不 與 亦 不 取 換 易 便 無 過 
T24n1459_001:0628b12	　買時依價直，　　或可任其情。	 買 時 依 價 直 或 可 任 其 情 
T24n1459_001:0628b13	　苾芻尼有財，　　決意持相施；	 苾 芻 尼 有 財 決 意 持 相 施 
T24n1459_001:0628b14	　或聽微妙語，　　歡情奉法師；	 或 聽 微 妙 語 歡 情 奉 法 師 
T24n1459_001:0628b15	　或時見近圓，　　持物來相助；	 或 時 見 近 圓 持 物 來 相 助 
T24n1459_001:0628b16	　被賊奪時施，　　為受皆無犯。	 被 賊 奪 時 施 為 受 皆 無 犯 
T24n1459_001:0628b17	從非親居士婦乞衣學處	從 非 親 居 士 婦 乞 衣 學 處 
T24n1459_001:0628b18	　於非親俗人，　　或於俗人婦；	 於 非 親 俗 人 或 於 俗 人 婦 
T24n1459_001:0628b19	　苾芻衣現有，　　從乞遂招愆。	 苾 芻 衣 現 有 從 乞 遂 招 愆 
T24n1459_001:0628b20	　乞下衣及線，　　便得勝上服；	 乞 下 衣 及 線 便 得 勝 上 服 
T24n1459_001:0628b21	　覓少得全衣，　　受取時無過。	 覓 少 得 全 衣 受 取 時 無 過 
T24n1459_001:0628b22	過量乞衣學處	過 量 乞 衣 學 處 
T24n1459_001:0628b23	　苾芻衣失奪，　　有人多施衣；	 苾 芻 衣 失 奪 有 人 多 施 衣 
T24n1459_001:0628b24	　但取上下衣，　　不應過量受。	 但 取 上 下 衣 不 應 過 量 受 
T24n1459_001:0628b25	　上衣肘十一，　　下長至七肘；	 上 衣 肘 十 一 下 長 至 七 肘 
T24n1459_001:0628b26	　此據俗人衣，　　名為上下服。	 此 據 俗 人 衣 名 為 上 下 服 
T24n1459_001:0628b27	　大衣三五肘，　　兩重為上服；	 大 衣 三 五 肘 兩 重 為 上 服 
T24n1459_001:0628b28	　二五肘下衣，　　謂聖教上下。	 二 五 肘 下 衣 謂 聖 教 上 下 
T24n1459_001:0628b29	　從彼乞衣時，　　若得盈長物；	 從 彼 乞 衣 時 若 得 盈 長 物 
T24n1459_001:0628c01	　宜應還本主，　　更施受隨聽。	 宜 應 還 本 主 更 施 受 隨 聽 
T24n1459_001:0628c02	非親居士婦共辦衣學處	非 親 居 士 婦 共 辦 衣 學 處 
T24n1459_001:0628c03	　若俗人夫婦，　　欲為辦衣價；	 若 俗 人 夫 婦 欲 為 辦 衣 價 
T24n1459_001:0628c04	　苾芻從彼覓，　　若得罪便傷。	 苾 芻 從 彼 覓 若 得 罪 便 傷 
T24n1459_001:0628c05	　非親如上說，　　若得七種衣；	 非 親 如 上 說 若 得 七 種 衣 
T24n1459_001:0628c06	　衣體是堅牢，　　說名為淨物。	 衣 體 是 堅 牢 說 名 為 淨 物 
T24n1459_001:0628c07	　從他乞衣直，　　或五乃至十；	 從 他 乞 衣 直 或 五 乃 至 十 
T24n1459_001:0628c08	　迦利沙波拏，　　色量如前說。	 迦利沙波拏 色 量 如 前 說 
T24n1459_001:0628c09	　若求此等衣，　　乞時招惡作；	 若 求 此 等 衣 乞 時 招 惡 作 
T24n1459_001:0628c10	　若得泥薩祇，　　得多便不犯。	 若 得 泥 薩 祇 得 多 便 不 犯 
T24n1459_001:0628c11	　苾芻若無衣，　　容儀不端正；	 苾 芻 若 無 衣 容 儀 不 端 正 
T24n1459_001:0628c12	　由斯世尊教，　　制遣著三衣。	 由 斯 世 尊 教 制 遣 著 三 衣 
T24n1459_001:0628c13	非親居士婦各辦衣學處	非 親 居 士 婦 各 辦 衣 學 處 
T24n1459_001:0628c14	　衣事並如前，　　別與衣價異；	 衣 事 並 如 前 別 與 衣 價 異 
T24n1459_001:0628c15	　當觀緣起處，　　有罪及無罪。	 當 觀 緣 起 處 有 罪 及 無 罪 
T24n1459_001:0628c16	王臣送衣價學處	王 臣 送 衣 價 學 處 
T24n1459_001:0628c17	　若是灌頂王，　　及婆羅門等；	 若 是 灌 頂 王 及 婆 羅 門 等 
T24n1459_001:0628c18	　大臣并將帥，　　令持衣價來。	 大 臣 并 將 帥 令 持 衣 價 來 
T24n1459_001:0628c19	　見使送衣直，　　告言非所應；	 見 使 送 衣 直 告 言 非 所 應 
T24n1459_001:0628c20	　我受清淨衣，　　開悟於使者。	 我 受 清 淨 衣 開 悟 於 使 者 
T24n1459_001:0628c21	　應告執事者，　　謂是信心人；	 應 告 執 事 者 謂 是 信 心 人 
T24n1459_001:0628c22	　苾芻可求衣，　　乃至於六返。	 苾 芻 可 求 衣 乃 至 於 六 返 
T24n1459_001:0628c23	　若更得餘衣，　　受取成清淨；	 若 更 得 餘 衣 受 取 成 清 淨 
T24n1459_001:0628c24	　過分從求得，　　此招根本罪。	 過 分 從 求 得 此 招 根 本 罪 
T24n1459_001:0628c25	　若過於六返，　　彼自送衣來；	 若 過 於 六 返 彼 自 送 衣 來 
T24n1459_001:0628c26	　語言我息心，　　當可還衣主。	 語 言 我 息 心 當 可 還 衣 主 
T24n1459_001:0628c27	　若彼極慇懃，　　禮敬歡授與；	 若 彼 極 慇 懃 禮 敬 歡 授 與 
T24n1459_001:0628c28	　此物應受取，　　用時無有過。	 此 物 應 受 取 用 時 無 有 過 
T24n1459_001:0628c29	　居處有四別，　　謂敞舍田店：	 居 處 有 四 別 謂 敞 舍 田 店 
T24n1459_001:0629a01	　敞謂瓦作等；　　舍即是居家；	 敞 謂 瓦 作 等 舍 即 是 居 家 
T24n1459_001:0629a02	　田是營田處，　　謂稻蔗穀麥；	 田 是 營 田 處 謂 稻 蔗 穀 麥 
T24n1459_001:0629a03	　店謂貯貨物，　　是詰處應知。	 店 謂 貯 貨 物 是 詰 處 應 知 
T24n1459_001:0629a04	　說有六詰門，　　待語徐為答；	 說 有 六 詰 門 待 語 徐 為 答 
T24n1459_001:0629a05	　若作急速語，　　便招惡作愆。	 若 作 急 速 語 便 招 惡 作 愆 
T24n1459_001:0629a06	　彼見苾芻至，　　告言仁善來；	 彼 見 苾 芻 至 告 言 仁 善 來 
T24n1459_001:0629a07	　或云極善來，　　當於此處坐。	 或 云 極 善 來 當 於 此 處 坐 
T24n1459_001:0629a08	　或云人食飯，　　或時命噉餅；	 或 云 人 食 飯 或 時 命 噉 餅 
T24n1459_001:0629a09	　或飲非時漿，　　略言斯六種。	 或 飲 非 時 漿 略 言 斯 六 種 
T24n1459_001:0629a10	　施主使淨人，　　三是人清淨；	 施 主 使 淨 人 三 是 人 清 淨 
T24n1459_001:0629a11	　隨有非人者，　　即招於惡作。	 隨 有 非 人 者 即 招 於 惡 作 
T24n1459_001:0629a12	　苾芻寄衣去，　　與彼親愛人；	 苾 芻 寄 衣 去 與 彼 親 愛 人 
T24n1459_001:0629a13	　使於所寄人，　　親友用無過。	 使 於 所 寄 人 親 友 用 無 過 
T24n1459_001:0629a14	　在路知彼死，　　即是死人物；	 在 路 知 彼 死 即 是 死 人 物 
T24n1459_001:0629a15	　多時無長過，　　物如餘處辨。	 多 時 無 長 過 物 如 餘 處 辨 
T24n1459_001:0629a16	用野蠶絲作敷具學處	用 野 蠶 絲 作 敷 具 學 處 
T24n1459_001:0629a17	　若作新蠶褥，　　成時犯捨墮；	 若 作 新 蠶 褥 成 時 犯 捨 墮 
T24n1459_001:0629a18	　有二種不同，　　囊成及扞作。	 有 二 種 不 同 囊 成 及 扞 作 
T24n1459_001:0629a19	　作二皆犯罪，　　他與用無過；	 作 二 皆 犯 罪 他 與 用 無 過 
T24n1459_001:0629a20	　饒益施主故，　　令其福命增。	 饒 益 施 主 故 令 其 福 命 增 
T24n1459_001:0629a21	純黑羊毛作敷具學處	純 黑 羊 毛 作 敷 具 學 處 
T24n1459_001:0629a22	　不用純黑毛，　　而作新臥具；	 不 用 純 黑 毛 而 作 新 臥 具 
T24n1459_001:0629a23	　求覓時難得，　　復妨於正修。	 求 覓 時 難 得 復 妨 於 正 修 
T24n1459_001:0629a24	過分用毛作敷具學處	過 分 用 毛 作 敷 具 學 處 
T24n1459_001:0629a25	　且如用羊毛，　　四斤為臥褥；	 且 如 用 羊 毛 四 斤 為 臥 褥 
T24n1459_001:0629a26	　黑二餘各一，　　是應法無罪。	 黑 二 餘 各 一 是 應 法 無 罪 
T24n1459_001:0629a27	　黑謂性烏毛，　　齊項名為白；	 黑 謂 性 烏 毛 齊 項 名 為 白 
T24n1459_001:0629a28	　在頭腹及足，　　謂行處應知。	 在 頭 腹 及 足 謂 行 處 應 知 
T24n1459_001:0629a29	　白尨毛若欠，　　乃至於半兩；	 白 尨 毛 若 欠 乃 至 於 半 兩 
T24n1459_001:0629b01	　若造此褥訖，　　必為罪相知。	 若 造 此 褥 訖 必 為 罪 相 知 
T24n1459_001:0629b02	　黑易餘難求，　　純黑亦聽作；	 黑 易 餘 難 求 純 黑 亦 聽 作 
T24n1459_001:0629b03	　若從他處得，　　受用當隨意。	 若 從 他 處 得 受 用 當 隨 意 
T24n1459_001:0629b04	六年敷具學處	六 年 敷 具 學 處 
T24n1459_001:0629b05	　若自作臥褥，　　強遣六年持；	 若 自 作 臥 褥 強 遣 六 年 持 
T24n1459_001:0629b06	　六內造時犯，　　除僧為秉法。	 六 內 造 時 犯 除 僧 為 秉 法 
T24n1459_001:0629b07	　若苾芻一年，　　更造第二褥；	 若 苾 芻 一 年 更 造 第 二 褥 
T24n1459_001:0629b08	　興功招惡作，　　成時得本罪。	 興 功 招 惡 作 成 時 得 本 罪 
T24n1459_001:0629b09	　如是二三四，　　乃至五年終；	 如 是 二 三 四 乃 至 五 年 終 
T24n1459_001:0629b10	　若入於六年，　　縱造非遮限。	 若 入 於 六 年 縱 造 非 遮 限 
T24n1459_001:0629b11	不帖坐具學處	不 帖 坐 具 學 處 
T24n1459_001:0629b12	　若作新坐具，　　以佛一張手；	 若 作 新 坐 具 以 佛 一 張 手 
T24n1459_001:0629b13	　帖在於新者，　　壞色令牢固。	 帖 在 於 新 者 壞 色 令 牢 固 
T24n1459_001:0629b14	　若於張手內，　　故心減片許；	 若 於 張 手 內 故 心 減 片 許 
T24n1459_001:0629b15	　還遭本罪杖，　　楚痛此人身。	 還 遭 本 罪 杖 楚 痛 此 人 身 
T24n1459_001:0629b16	　舊者極爛壞，　　久故無所堪：	 舊 者 極 爛 壞 久 故 無 所 堪 
T24n1459_001:0629b17	　或唯但有新，　　不帖時非犯。	 或 唯 但 有 新 不 帖 時 非 犯 
T24n1459_001:0629b18	擔羊毛學處	擔 羊 毛 學 處 
T24n1459_001:0629b19	　不自將羊毛，　　行過三驛外；	 不 自 將 羊 毛 行 過 三 驛 外 
T24n1459_001:0629b20	　少許為帽等，　　密持非是愆。	 少 許 為 帽 等 密 持 非 是 愆 
T24n1459_001:0629b21	　半村擎惡作，　　及半俱盧舍；	 半 村 擎 惡 作 及 半 俱 盧 舍 
T24n1459_001:0629b22	　俱盧舍若過，　　越村便得墮。	 俱 盧 舍 若 過 越 村 便 得 墮 
T24n1459_001:0629b23	使非親尼擘羊毛學處	使 非 親 尼 擘 羊 毛 學 處 
T24n1459_001:0629b24	　非親苾芻尼，　　苾芻令浣等；	 非 親 苾 芻 尼 苾 芻 令 浣 等 
T24n1459_001:0629b25	　持毛彼若洗，　　斯便損式叉。	 持 毛 彼 若 洗 斯 便 損 式 叉 
T24n1459_001:0629b26	　若別令洗等，　　或復總皆為；	 若 別 令 洗 等 或 復 總 皆 為 
T24n1459_001:0629b27	　得罪隨所應，　　不為但惡作。	 得 罪 隨 所 應 不 為 但 惡 作 
T24n1459_001:0629b28	捉畜錢寶學處	捉 畜 錢 寶 學 處 
T24n1459_001:0629b29	　佛遮苾芻輩，　　執捉金銀等；	 佛 遮 苾 芻 輩 執 捉 金 銀 等 
T24n1459_001:0629c01	　若三衣道糧，　　病藥當持去。	 若 三 衣 道 糧 病 藥 當 持 去 
T24n1459_001:0629c02	　苾芻應少欲，　　少作少營求；	 苾 芻 應 少 欲 少 作 少 營 求 
T24n1459_001:0629c03	　存心樂涅槃，　　知量知時受。	 存 心 樂 涅 槃 知 量 知 時 受 
T24n1459_001:0629c04	出息求利學處	出 息 求 利 學 處 
T24n1459_001:0629c05	　為利作興生，　　財穀等出納；	 為 利 作 興 生 財 穀 等 出 納 
T24n1459_001:0629c06	　覓利金剛杵，　　便傷貪者身。	 覓 利 金 剛 杵 便 傷 貪 者 身 
T24n1459_001:0629c07	　遠求及期限，　　出利并納質；	 遠 求 及 期 限 出 利 并 納 質 
T24n1459_001:0629c08	　成與不成等，　　興生有四殊。	 成 與 不 成 等 興 生 有 四 殊 
T24n1459_001:0629c09	　或往他處求，　　莊束船車等；	 或 往 他 處 求 莊 束 船 車 等 
T24n1459_001:0629c10	　及覓同行伴，　　斯名作遠求。	 及 覓 同 行 伴 斯 名 作 遠 求 
T24n1459_001:0629c11	　七倍等獲利，　　方始與他財；	 七 倍 等 獲 利 方 始 與 他 財 
T24n1459_001:0629c12	　書券證保人，　　斯名作期限。	 書 券 證 保 人 斯 名 作 期 限 
T24n1459_001:0629c13	　本欲求生利，　　兩倍等利增；	 本 欲 求 生 利 兩 倍 等 利 增 
T24n1459_001:0629c14	　書券計時徵，　　斯名曰生利。	 書 券 計 時 徵 斯 名 曰 生 利 
T24n1459_001:0629c15	　末尼珊瑚等，　　真珠物貯收；	 末 尼 珊 瑚 等 真 珠 物 貯 收 
T24n1459_001:0629c16	　明契作要期，　　斯名為納質。	 明 契 作 要 期 斯 名 為 納 質 
T24n1459_001:0629c17	　此中利未生，　　已招於惡作；	 此 中 利 未 生 已 招 於 惡 作 
T24n1459_001:0629c18	　如其生利得，　　便招於捨墮。	 如 其 生 利 得 便 招 於 捨 墮 
T24n1459_001:0629c19	　成者謂已作，　　打為莊嚴具；	 成 者 謂 已 作 打 為 莊 嚴 具 
T24n1459_001:0629c20	　不成即金等，　　此並如前說。	 不 成 即 金 等 此 並 如 前 說 
T24n1459_001:0629c21	　為三寶所須，　　方便欲求利；	 為 三 寶 所 須 方 便 欲 求 利 
T24n1459_001:0629c22	　應差知事者，　　俗法勿相違。	 應 差 知 事 者 俗 法 勿 相 違 
T24n1459_001:0629c23	　王及諸官屬，　　施主勿交關；	 王 及 諸 官 屬 施 主 勿 交 關 
T24n1459_001:0629c24	　與時追索難，　　或可全不獲。	 與 時 追 索 難 或 可 全 不 獲 
T24n1459_001:0629c25	　納質善觀望，　　籌量可與物；	 納 質 善 觀 望 籌 量 可 與 物 
T24n1459_001:0629c26	　善人堪委付，　　無質與非傷。	 善 人 堪 委 付 無 質 與 非 傷 
T24n1459_001:0629c27	賣買學處	賣 買 學 處 
T24n1459_001:0629c28	　無別交易人，　　苾芻須自買；	 無 別 交 易 人 苾 芻 須 自 買 
T24n1459_001:0629c29	　善觀當出語，　　決價但三酬。	 善 觀 當 出 語 決 價 但 三 酬 
T24n1459_001:0630a01	　若當有賣買，　　元不許求利；	 若 當 有 賣 買 元 不 許 求 利 
T24n1459_001:0630a02	　若別有所須，　　賣買時無過。	 若 別 有 所 須 賣 買 時 無 過 
T24n1459_001:0630a03	　若為三寶事，　　要須有賣買；	 若 為 三 寶 事 要 須 有 賣 買 
T24n1459_001:0630a04	　知事人應作，　　勿與俗相違。	 知 事 人 應 作 勿 與 俗 相 違 
T24n1459_001:0630a05	　若人為設供，　　就寺為市易；	 若 人 為 設 供 就 寺 為 市 易 
T24n1459_001:0630a06	　當須差降與，　　令彼信心增。	 當 須 差 降 與 令 彼 信 心 增 
T24n1459_001:0630a07	　油麻穀豆等，　　於內有蟲出；	 油 麻 穀 豆 等 於 內 有 蟲 出 
T24n1459_001:0630a08	　安在陰涼處，　　任彼自隨緣。	 安 在 陰 涼 處 任 彼 自 隨 緣 
T24n1459_001:0630a09	　雖安在陰處，　　生蟲尚自存；	 雖 安 在 陰 處 生 蟲 尚 自 存 
T24n1459_001:0630a10	　置室瓨等中，　　密閉無令損。	 置 室 瓨 等 中 密 閉 無 令 損 
T24n1459_001:0630a11	畜長鉢學處	畜 長 鉢 學 處 
T24n1459_001:0630a12	　畜鉢有二種，　　謂鐵及與瓦；	 畜 鉢 有 二 種 謂 鐵 及 與 瓦 
T24n1459_001:0630a13	　若持過十日，　　必為罪相中。	 若 持 過 十 日 必 為 罪 相 中 
T24n1459_001:0630a14	　若應量及減，　　有餘應貯畜；	 若 應 量 及 減 有 餘 應 貯 畜 
T24n1459_001:0630a15	　為濟近圓人，　　不分別無咎。	 為 濟 近 圓 人 不 分 別 無 咎 
T24n1459_001:0630a16	乞鉢學處	乞 鉢 學 處 
T24n1459_001:0630a17	　得作五種綴，　　不合乞餘鉢；	 得 作 五 種 綴 不 合 乞 餘 鉢 
T24n1459_001:0630a18	　意遮求妙好，　　若買則非愆。	 意 遮 求 妙 好 若 買 則 非 愆 
T24n1459_001:0630a19	　苾芻綴鉢璺，　　不應用融物；	 苾 芻 綴 鉢 璺 不 應 用 融 物 
T24n1459_001:0630a20	　黑糖錫紫鑛，　　泥蠟並皆遮。	 黑 糖 錫 紫 鑛 泥 蠟 並 皆 遮 
T24n1459_001:0630a21	　綴鉢有五種，　　謂銜鍱釘鍱；	 綴 鉢 有 五 種 謂 銜 鍱 釘 鍱 
T24n1459_001:0630a22	　鐵釘并鐵末，　　及為魚齒縫。	 鐵 釘 并 鐵 末 及 為 魚 齒 縫 
T24n1459_001:0630a23	　依法而轉換，　　若得便無罪；	 依 法 而 轉 換 若 得 便 無 罪 
T24n1459_001:0630a24	　異此乞惡作，　　得時泥薩祇。	 異 此 乞 惡 作 得 時 泥 薩 祇 
T24n1459_001:0630a25	　所得之長鉢，　　捨在於僧伽；	 所 得 之 長 鉢 捨 在 於 僧 伽 
T24n1459_001:0630a26	　轉取最後者，　　應如法持用。	 轉 取 最 後 者 應 如 法 持 用 
T24n1459_001:0630a27	　指鉤不觸食，　　受二升米飯，	 指 鉤 不 觸 食 受 二 升 米 飯 
T24n1459_001:0630a28	　并容於菜茹，　　此名為大鉢；	 并 容 於 菜 茹 此 名 為 大 鉢 
T24n1459_001:0630a29	　受一升米飯，　　并菹菜名小；	 受 一 升 米 飯 并 菹 菜 名 小 
T24n1459_001:0630b01	　此兩內名中，　　是名三種鉢。	 此 兩 內 名 中 是 名 三 種 鉢 
T24n1459_001:0630b02	　若鉢有璺穴，　　補綴可存情；	 若 鉢 有 璺 穴 補 綴 可 存 情 
T24n1459_001:0630b03	　作具須者持，　　置於僧庫內。	 作 具 須 者 持 置 於 僧 庫 內 
T24n1459_001:0630b04	　要有鉢方行，　　不蒙眾秉法；	 要 有 鉢 方 行 不 蒙 眾 秉 法 
T24n1459_001:0630b05	　除為賊恐怖，　　又復擬還來。	 除 為 賊 恐 怖 又 復 擬 還 來 
T24n1459_001:0630b06	自乞縷使非親織學處	自 乞 縷 使 非 親 織 學 處 
T24n1459_001:0630b07	　若非親織師，　　無價織衣犯；	 若 非 親 織 師 無 價 織 衣 犯 
T24n1459_001:0630b08	　酬價并親族，　　遣織時非過。	 酬 價 并 親 族 遣 織 時 非 過 
T24n1459_001:0630b09	居士婦使非親織學處	居 士 婦 使 非 親 織 學 處 
T24n1459_001:0630b10	　俗人令織匠，　　為苾芻織衣；	 俗 人 令 織 匠 為 苾 芻 織 衣 
T24n1459_001:0630b11	　不應至彼邊，　　諂心申愛語，	 不 應 至 彼 邊 諂 心 申 愛 語 
T24n1459_001:0630b12	　令長刷削打，　　將食誘織師；	 令 長 刷 削 打 將 食 誘 織 師 
T24n1459_001:0630b13	　彼人如為作，　　得便招捨墮。	 彼 人 如 為 作 得 便 招 捨 墮 
T24n1459_001:0630b14	　長者謂廣大，　　刷者令軟滑；	 長 者 謂 廣 大 刷 者 令 軟 滑 
T24n1459_001:0630b15	　削謂除縷結，　　打謂打令堅。	 削 謂 除 縷 結 打 謂 打 令 堅 
T24n1459_001:0630b16	　乞餅與織師，　　五正等飲食；	 乞 餅 與 織 師 五 正 等 飲 食 
T24n1459_001:0630b17	　與其食糧者，　　米豆等應知。	 與 其 食 糧 者 米 豆 等 應 知 
T24n1459_001:0630b18	奪衣學處	奪 衣 學 處 
T24n1459_001:0630b19	　苾芻與他衣，　　瞋不應還奪；	 苾 芻 與 他 衣 瞋 不 應 還 奪 
T24n1459_001:0630b20	　哀憐者無過，　　意欲益前人。	 哀 憐 者 無 過 意 欲 益 前 人 
T24n1459_001:0630b21	　動身是身業，　　言陳成語愆；	 動 身 是 身 業 言 陳 成 語 愆 
T24n1459_001:0630b22	　於斯兩業中，　　隨一便招罪。	 於 斯 兩 業 中 隨 一 便 招 罪 
T24n1459_001:0630b23	　乃至於衣角，　　未離身已來；	 乃 至 於 衣 角 未 離 身 已 來 
T24n1459_001:0630b24	　得惡作應知，　　離身便犯捨。	 得 惡 作 應 知 離 身 便 犯 捨 
T24n1459_001:0630b25	急施衣學處	急 施 衣 學 處 
T24n1459_001:0630b26	　但是夏中利，　　坐夏者應分；	 但 是 夏 中 利 坐 夏 者 應 分 
T24n1459_001:0630b27	　此不通餘人，　　預分招惡作。	 此 不 通 餘 人 預 分 招 惡 作 
T24n1459_001:0630b28	　夏無掌衣者，　　不合受他衣；	 夏 無 掌 衣 者 不 合 受 他 衣 
T24n1459_001:0630b29	　若有難施衣，　　金等咸應受。	 若 有 難 施 衣 金 等 咸 應 受 
T24n1459_001:0630c01	　急施有五種，　　謂病為病人；	 急 施 有 五 種 謂 病 為 病 人 
T24n1459_001:0630c02	　欲死或為亡，　　將行故行施。	 欲 死 或 為 亡 將 行 故 行 施 
T24n1459_001:0630c03	　隨意十日在，　　此時當受物；	 隨 意 十 日 在 此 時 當 受 物 
T24n1459_001:0630c04	　若過於衣時，　　斯便不合畜。	 若 過 於 衣 時 斯 便 不 合 畜 
T24n1459_001:0630c05	　若施主告言，　　我當自手施；	 若 施 主 告 言 我 當 自 手 施 
T24n1459_001:0630c06	　受取應為舉，　　合眾罪皆無。	 受 取 應 為 舉 合 眾 罪 皆 無 
T24n1459_001:0630c07	　若得隨意利，　　悉屬坐夏人；	 若 得 隨 意 利 悉 屬 坐 夏 人 
T24n1459_001:0630c08	　亦通無夏者，　　同為隨意事。	 亦 通 無 夏 者 同 為 隨 意 事 
T24n1459_001:0630c09	蘭若離衣學處	蘭 若 離 衣 學 處 
T24n1459_001:0630c10	　阿蘭若有怖，　　於自三衣中；	 阿 蘭 若 有 怖 於 自 三 衣 中 
T24n1459_001:0630c11	　俗舍寄一衣，　　為防其難故。	 俗 舍 寄 一 衣 為 防 其 難 故 
T24n1459_001:0630c12	　於斯離衣宿，　　六夜許無愆；	 於 斯 離 衣 宿 六 夜 許 無 愆 
T24n1459_001:0630c13	　第七明相生，　　須還蘭若處。	 第 七 明 相 生 須 還 蘭 若 處 
T24n1459_001:0630c14	　非前夏安居，　　是名為後夏；	 非 前 夏 安 居 是 名 為 後 夏 
T24n1459_001:0630c15	　此中若有賊，　　謂是難應知。	 此 中 若 有 賊 謂 是 難 應 知 
T24n1459_001:0630c16	　言有疑畏處，　　謂師子虎等；	 言 有 疑 畏 處 謂 師 子 虎 等 
T24n1459_001:0630c17	　有怖謂虻等，　　惱亂多眾毒。	 有 怖 謂 虻 等 惱 亂 多 眾 毒 
T24n1459_001:0630c18	雨浴衣學處	雨 浴 衣 學 處 
T24n1459_001:0630c19	　春餘一月在，　　四半至五半；	 春 餘 一 月 在 四 半 至 五 半 
T24n1459_001:0630c20	　若其須雨衣，　　此時宜可乞。	 若 其 須 雨 衣 此 時 宜 可 乞 
T24n1459_001:0630c21	　去前安居日，　　尚有一月在；	 去 前 安 居 日 尚 有 一 月 在 
T24n1459_001:0630c22	　此月應守持，　　入夏隨情用。	 此 月 應 守 持 入 夏 隨 情 用 
T24n1459_001:0630c23	　可於兩月半，　　苾芻用雨衣；	 可 於 兩 月 半 苾 芻 用 雨 衣 
T24n1459_001:0630c24	　早求過後持，　　此便招捨墮。	 早 求 過 後 持 此 便 招 捨 墮 
T24n1459_001:0630c25	　若於隨意日，　　施得好衣財；	 若 於 隨 意 日 施 得 好 衣 財 
T24n1459_001:0630c26	　秉白二羯磨，　　對眾前當受。	 秉 白二羯磨 對 眾 前 當 受 
T24n1459_001:0630c27	　眾僧既共許，　　慇懃各用心；	 眾 僧 既 共 許 慇 懃 各 用 心 
T24n1459_001:0630c28	　一日作使成，　　物體須牢固。	 一 日 作 使 成 物 體 須 牢 固 
T24n1459_001:0630c29	　如法作衣已，　　花香好嚴飾；	 如 法 作 衣 已 花 香 好 嚴 飾 
T24n1459_001:0631a01	　置在於眾中，　　張須知法者。	 置 在 於 眾 中 張 須 知 法 者 
T24n1459_001:0631a02	　由張羯恥那，　　苾芻獲饒益；	 由 張 羯 恥 那 苾 芻 獲 饒 益 
T24n1459_001:0631a03	　謂於十日內，　　不須分別持。	 謂 於 十 日 內 不 須 分 別 持 
T24n1459_001:0631a04	　雖無僧伽胝，　　人間任情去；	 雖 無 僧 伽 胝 人 間 任 情 去 
T24n1459_001:0631a05	　別眾食展轉，　　斯皆無過愆。	 別 眾 食 展 轉 斯 皆 無 過 愆 
T24n1459_001:0631a06	　雖不告苾芻，　　得入於村內；	 雖 不 告 苾 芻 得 入 於 村 內 
T24n1459_001:0631a07	　廣文具有十，　　此略言其五。	 廣 文 具 有 十 此 略 言 其 五 
T24n1459_001:0631a08	　謂從八月半，　　乃至正月半；	 謂 從 八 月 半 乃 至 正 月 半 
T24n1459_001:0631a09	　齊斯五月內，　　名羯恥那時。	 齊 斯 五 月 內 名 羯 恥 那 時 
T24n1459_001:0631a10	　行下意及了，　　行遍住兼出；	 行 下 意 及 了 行 遍 住 兼 出 
T24n1459_001:0631a11	　不滿夏及破，　　後夏者不應。	 不 滿 夏 及 破 後 夏 者 不 應 
T24n1459_001:0631a12	　囑信并求寂，　　及以授學人；	 囑 信 并 求 寂 及 以 授 學 人 
T24n1459_001:0631a13	　不受羯恥那，　　餘利皆須與。	 不 受 羯 恥 那 餘 利 皆 須 與 
T24n1459_001:0631a14	　破尸羅行壞，　　大眾與作遮；	 破 尸 羅 行 壞 大 眾 與 作 遮 
T24n1459_001:0631a15	　及入非法朋，　　於餘處坐夏。	 及 入 非 法 朋 於 餘 處 坐 夏 
T24n1459_001:0631a16	　如斯等五人，　　無利無饒益；	 如 斯 等 五 人 無 利 無 饒 益 
T24n1459_001:0631a17	　由其不消施，　　持戒者應為。	 由 其 不 消 施 持 戒 者 應 為 
T24n1459_001:0631a18	迴眾物入己學處	迴 眾 物 入 己 學 處 
T24n1459_001:0631a19	　若僧現前物，　　迴之將屬己；	 若 僧 現 前 物 迴 之 將 屬 己 
T24n1459_001:0631a20	　他利最難消，　　當受泥黎苦。	 他 利 最 難 消 當 受 泥 黎 苦 
T24n1459_001:0631a21	　他施衣金等，　　及以諸飲食；	 他 施 衣 金 等 及 以 諸 飲 食 
T24n1459_001:0631a22	　遮斯兩種物，　　名迴換應知。	 遮 斯 兩 種 物 名 迴 換 應 知 
