T24n1488_001:1034a20	優婆塞戒經卷第一	優婆塞戒 經 卷 第 一 
T24n1488_001:1034a22	北涼中印度三藏曇無讖譯	北 涼 中 印 度 三 藏 曇 無 讖 譯 
T24n1488_001:1034a23	集會品第一	集 會 品 第 一 
T24n1488_001:1034a24	如是我聞：一時、佛在舍衛國祇樹林中阿那	如是我聞 一 時 佛 在 舍 衛 國 祇 樹 林 中 阿 那 
T24n1488_001:1034a25	邠坻精舍，與大比丘僧千二百五十人，五百	邠 坻 精 舍 與 大 比 丘 僧 千二百五十 人 五 百 
T24n1488_001:1034a26	比丘尼，千優婆塞，五百乞兒。爾時、會中有長	比 丘 尼 千 優 婆 塞 五 百 乞 兒 爾 時 會 中 有 長 
T24n1488_001:1034a27	者子名曰善生，白佛言：「世尊！外道六師常演	者 子 名 曰 善 生 白 佛 言 世 尊 外 道 六 師 常 演 
T24n1488_001:1034a28	說法，教眾生言：『若能晨朝敬禮六方，則得增	說 法 教 眾 生 言 若 能 晨 朝 敬 禮 六 方 則 得 增 
T24n1488_001:1034a29	長命之與財。何以故？東方之土屬于帝釋，有	長 命 之 與 財 何 以 故 東 方 之 土 屬 于 帝 釋 有 
T24n1488_001:1034b01	供養者，釋提桓因則為護助。南方之土屬閻羅	供 養 者 釋提桓因 則 為 護 助 南 方 之 土 屬 閻 羅 
T24n1488_001:1034b02	王，有供養者，彼閻羅王則為護助。西方之土	王 有 供 養 者 彼 閻 羅 王 則 為 護 助 西 方 之 土 
T24n1488_001:1034b03	屬婆樓那天，有供養者，彼婆樓那則為護	屬 婆 樓 那 天 有 供 養 者 彼 婆 樓 那 則 為 護 
T24n1488_001:1034b04	助。北方之土屬拘毘羅天，有供養者，彼拘毘	助 北 方 之 土 屬 拘 毘 羅 天 有 供 養 者 彼 拘 毘 
T24n1488_001:1034b05	羅則為護助。下方之土屬于火天，有供養者，	羅 則 為 護 助 下 方 之 土 屬 于 火 天 有 供 養 者 
T24n1488_001:1034b06	火天則為護助。上方之土屬于風天，有供	火 天 則 為 護 助 上 方 之 土 屬 于 風 天 有 供 
T24n1488_001:1034b07	養者，彼亦為護。』世尊！佛法之中，頗有如是六	養 者 彼 亦 為 護 世 尊 佛 法 之 中 頗 有 如 是 六 
T24n1488_001:1034b08	方不耶？」「善男子！我佛法中亦有六方，所謂	方 不 耶 善 男 子 我 佛 法 中 亦 有 六 方 所 謂 
T24n1488_001:1034b09	六波羅蜜。東方則是檀波羅蜜。何以故？始	六波羅蜜 東 方 則 是 檀 波 羅 蜜 何 以 故 始 
T24n1488_001:1034b10	初出者，為出智慧光因緣故，彼東方者屬眾	初 出 者 為 出 智 慧 光 因 緣 故 彼 東 方 者 屬 眾 
T24n1488_001:1034b11	生心。若有眾生能供養彼檀波羅蜜，則為增	生 心 若 有 眾 生 能 供 養 彼 檀 波 羅 蜜 則 為 增 
T24n1488_001:1034b12	長壽命與財。南方即是尸波羅蜜。何以故？尸	長 壽 命 與 財 南 方 即 是 尸 波 羅 蜜 何 以 故 尸 
T24n1488_001:1034b13	波羅蜜名之為右。若人供養，亦得增長壽命	波 羅 蜜 名 之 為 右 若 人 供 養 亦 得 增 長 壽 命 
T24n1488_001:1034b14	與財。西方即是羼提波羅蜜。何以故？彼西	與 財 西 方 即 是 羼 提 波 羅 蜜 何 以 故 彼 西 
T24n1488_001:1034b15	方者名之為後，一切惡法棄於後故。若有供	方 者 名 之 為 後 一 切 惡 法 棄 於 後 故 若 有 供 
T24n1488_001:1034b16	養，則得增長壽命與財。北方即是毘離耶	養 則 得 增 長 壽 命 與 財 北 方 即 是 毘 離 耶 
T24n1488_001:1034b17	波羅蜜。何以故？北方名號勝諸惡法。若人供	波 羅 蜜 何 以 故 北 方 名 號 勝 諸 惡 法 若 人 供 
T24n1488_001:1034b18	養，則得增長壽命與財。下方則是禪波羅	養 則 得 增 長 壽 命 與 財 下 方 則 是 禪 波 羅 
T24n1488_001:1034b19	蜜。何以故？能正觀察三惡道故。若人供養，亦	蜜 何 以 故 能正觀察 三 惡 道 故 若 人 供 養 亦 
T24n1488_001:1034b20	得增長命之與財。上方即是般若波羅蜜。何	得 增 長 命 之 與 財 上 方 即 是 般 若 波 羅 蜜 何 
T24n1488_001:1034b21	以故？上方者即是無上無上故。若有供	以 故 上 方 者 即 是 無 上 無 上 故 若 有 供 
T24n1488_001:1034b22	養，則得增長命之與財。善男子！是六方者，屬	養 則 得 增 長 命 之 與 財 善 男 子 是 六 方 者 屬 
T24n1488_001:1034b23	眾生心，非如外道六師所說。」「如是六方，誰能	眾 生 心 非 如 外 道 六 師 所 說 如 是 六 方 誰 能 
T24n1488_001:1034b24	供養？」「善男子！唯有菩薩乃能供養。」「世尊！	供 養 善 男 子 唯 有 菩 薩 乃 能 供 養 世 尊 
T24n1488_001:1034b25	以何義故名為菩薩？」佛言：「得菩提故名為菩	以 何 義 故 名 為 菩 薩 佛 言 得 菩 提 故 名 為 菩 
T24n1488_001:1034b26	薩；菩提性故名為菩薩。」「世尊！若言得菩提	薩 菩 提 性 故 名 為 菩 薩 世 尊 若 言 得 菩 提 
T24n1488_001:1034b27	已名為菩薩者，若未供養彼六方時，云何得	已 名 為 菩 薩 者 若 未 供 養 彼 六 方 時 云 何 得 
T24n1488_001:1034b28	名為菩薩耶？若以性故名菩薩者，誰有此性？	名 為 菩 薩 耶 若 以 性 故 名 菩 薩 者 誰 有 此 性 
T24n1488_001:1034b29	有此性者則能供養，若無性者，則不能供養！	有 此 性 者 則 能 供 養 若 無 性 者 則 不 能 供 養 
T24n1488_001:1034c01	是故如來不應說言：彼六方者，屬眾生心。」「善	是 故 如 來 不 應 說 言 彼 六 方 者 屬 眾 生 心 善 
T24n1488_001:1034c02	男子！非得菩提故名菩薩。何以故？得菩提	男 子 非 得 菩 提 故 名 菩 薩 何 以 故 得 菩 提 
T24n1488_001:1034c03	者，名之為佛，未得菩提乃名菩薩；亦非性故	者 名 之 為 佛 未 得 菩 提 乃 名 菩 薩 亦 非 性 故 
T24n1488_001:1034c04	名菩薩也。善男子！一切眾生無菩提性，如諸	名 菩 薩 也 善 男 子 一 切 眾 生 無 菩 提 性 如 諸 
T24n1488_001:1034c05	眾生無人、天性，師子、虎、狼、狗犬等性；現在世	眾 生 無 人 天 性 師 子 虎 狼 狗 犬 等 性 現 在 世 
T24n1488_001:1034c06	中和合眾善業因緣故，得人、天身，和合不善	中 和 合 眾 善 業 因 緣 故 得 人 天 身 和 合 不 善 
T24n1488_001:1034c07	業因緣故，得師子等畜生之身。菩薩亦爾，	業 因 緣 故 得 師 子 等 畜 生 之 身 菩 薩 亦 爾 
T24n1488_001:1034c08	和合眾善業因緣故，發菩提心，故名菩薩。若	和 合 眾 善 業 因 緣 故 發菩提心 故 名 菩 薩 若 
T24n1488_001:1034c09	有說言一切眾生有菩薩性者，是義不然。何	有 說 言 一 切 眾 生 有 菩 薩 性 者 是 義 不 然 何 
T24n1488_001:1034c10	以故？若有性者，則不應修善業因緣供養六	以 故 若 有 性 者 則 不 應 修 善 業 因 緣 供 養 六 
T24n1488_001:1034c11	方。善男子！若有性者，則無初心及退轉心；以	方 善 男 子 若 有 性 者 則 無 初 心 及 退 轉 心 以 
T24n1488_001:1034c12	無量善業因緣故，發菩提心名菩薩性。「善男	無 量 善 業 因 緣 故 發菩提心 名 菩 薩 性 善 男 
T24n1488_001:1034c13	子！有諸眾生受行外道，不樂外典顛倒說故，	子 有 諸 眾 生 受 行 外 道 不 樂 外 典 顛 倒 說 故 
T24n1488_001:1034c14	發菩提心；或有眾生住寂靜處，內善因緣，發	發菩提心 或 有 眾 生 住 寂 靜 處 內 善 因 緣 發 
T24n1488_001:1034c15	菩提心；或有眾生觀生死過，發菩提心；或有	菩 提 心 或 有 眾 生 觀 生 死 過 發菩提心 或 有 
T24n1488_001:1034c16	眾生，見惡、聞惡，發菩提心；或有眾生深知自	眾 生 見 惡 聞 惡 發菩提心 或 有 眾 生 深 知 自 
T24n1488_001:1034c17	身貪欲、瞋恚、愚癡、慳嫉，為呵責故發菩提心；	身 貪 欲 瞋 恚 愚 癡 慳 嫉 為 呵 責 故 發菩提心 
T24n1488_001:1034c18	或有眾生見諸外道五通神仙，發菩提心；或	或 有 眾 生 見 諸 外 道 五 通 神 仙 發菩提心 或 
T24n1488_001:1034c19	有眾生欲知世間有邊無邊故，發菩提心；或	有 眾 生 欲 知 世 間 有邊無邊 故 發菩提心 或 
T24n1488_001:1034c20	有眾生見聞如來不思議故，發菩提心；或有	有 眾 生 見 聞 如 來 不 思 議 故 發菩提心 或 有 
T24n1488_001:1034c21	眾生生憐愍故，發菩提心；或有眾生愛眾生	眾 生 生 憐 愍 故 發菩提心 或 有 眾 生 愛 眾 生 
T24n1488_001:1034c22	故，發菩提心。「善男子！菩提之心，凡有三種：	故 發菩提心 善 男 子 菩提之心 凡 有 三 種 
T24n1488_001:1034c23	謂下、中、上。若言眾生定有性者，云何說言	謂 下 中 上 若 言 眾 生 定 有 性 者 云 何 說 言 
T24n1488_001:1034c24	有三種耶？眾生下心能作中心，中心作上，	有 三 種 耶 眾 生 下 心 能 作 中 心 中 心 作 上 
T24n1488_001:1034c25	上心作中，中心作下。眾生勤修無量善法，	上 心 作 中 中 心 作 下 眾 生 勤 修 無 量 善 法 
T24n1488_001:1034c26	故能增上；不勤修故，便退為下。若善修進	故 能 增 上 不 勤 修 故 便 退 為 下 若 善 修 進 
T24n1488_001:1034c27	則名不退，若不修進名之為退。一切時中常	則 名 不 退 若 不 修 進 名 之 為 退 一 切 時 中 常 
T24n1488_001:1034c28	為一切無邊眾生修集善故，名不退轉；若不	為 一 切 無 邊 眾 生 修 集 善 故 名 不 退 轉 若 不 
T24n1488_001:1034c29	如是，是名退轉，如是菩薩則有退心及怖	如 是 是 名 退 轉 如 是 菩 薩 則 有 退 心 及 怖 
T24n1488_001:1035a01	畏心。若一切時中為一切眾生修集善法，得	畏 心 若 一 切 時 中 為 一 切 眾 生 修 集 善 法 得 
T24n1488_001:1035a02	不退轉，是故我記是大喜地不久當得阿耨	不 退 轉 是 故 我 記 是 大 喜 地 不 久 當 得 阿 耨 
T24n1488_001:1035a03	多羅三藐三菩提。「善男子！三種菩提無有定	多 羅 三藐三菩提 善 男 子 三 種 菩 提 無 有 定 
T24n1488_001:1035a04	性；若有定性，已發聲聞、緣覺心者，則不能發	性 若 有 定 性 已 發 聲 聞 緣 覺 心 者 則 不 能 發 
T24n1488_001:1035a05	菩提之心。善男子！譬如眾僧無有定性，是	菩提之心 善 男 子 譬 如 眾 僧 無 有 定 性 是 
T24n1488_001:1035a06	三種性亦復如是。若有說言定有性者，是名	三 種 性 亦復如是 若 有 說 言 定 有 性 者 是 名 
T24n1488_001:1035a07	外道。何以故？諸外道等無因果故，如自在天	外 道 何 以 故 諸 外 道 等 無 因 果 故 如 自 在 天 
T24n1488_001:1035a08	非因非果。「善男子！或有人說菩薩之性，譬如	非 因 非 果 善 男 子 或 有 人 說 菩 薩 之 性 譬 如 
T24n1488_001:1035a09	石中定有金性，以巧方便因緣發故，得為金	石 中 定 有 金 性 以巧方便 因 緣 發 故 得 為 金 
T24n1488_001:1035a10	用；菩薩之性亦如是者，是梵志說。何以故？梵	用 菩 薩 之 性 亦 如 是 者 是 梵 志 說 何 以 故 梵 
T24n1488_001:1035a11	志等常言尼拘陀子有尼拘陀樹，眼有火石，	志 等 常 言 尼 拘 陀 子 有 尼 拘 陀 樹 眼 有 火 石 
T24n1488_001:1035a12	是故梵志無因無果，因即是果，果即是因。尼	是 故 梵 志 無 因 無 果 因 即 是 果 果 即 是 因 尼 
T24n1488_001:1035a13	拘陀子具足而有尼拘陀樹，當知即是梵志	拘 陀 子 具 足 而 有 尼 拘 陀 樹 當 知 即 是 梵 志 
T24n1488_001:1035a14	因果。是義不然。何以故？因細果麁故。若	因 果 是 義 不 然 何 以 故 因 細 果 麁 故 若 
T24n1488_001:1035a15	言眼中定有火者，眼則被燒；眼若被燒，云何	言 眼 中 定 有 火 者 眼 則 被 燒 眼 若 被 燒 云 何 
T24n1488_001:1035a16	能見？眼中有石，石則遮眼；眼若有遮，復云何	能 見 眼 中 有 石 石 則 遮 眼 眼 若 有 遮 復 云 何 
T24n1488_001:1035a17	見？善男子！如梵志說：有即是有，無即是無；	見 善 男 子 如 梵 志 說 有 即 是 有 無 即 是 無 
T24n1488_001:1035a18	無則不生，有不應滅。若言石中有金性者，金	無 則 不 生 有 不 應 滅 若 言 石 中 有 金 性 者 金 
T24n1488_001:1035a19	不說性，性不說金。善男子！因緣故則有和合，	不 說 性 性 不 說 金 善 男 子 因 緣 故 則 有 和 合 
T24n1488_001:1035a20	緣和合故本無後有，如梵志言無即永無。是	緣 和 合 故 本 無 後 有 如 梵 志 言 無 即 永 無 是 
T24n1488_001:1035a21	義云何？金合水銀，金則滅壞，若言有，不應滅。	義 云 何 金 合 水 銀 金 則 滅 壞 若 言 有 不 應 滅 
T24n1488_001:1035a22	是義云何？若說眾生有菩薩性，是名外道，不	是 義 云 何 若 說 眾 生 有 菩 薩 性 是 名 外 道 不 
T24n1488_001:1035a23	名佛道。善男子！譬如和合石因緣故而有金	名 佛 道 善 男 子 譬 如 和 合 石 因 緣 故 而 有 金 
T24n1488_001:1035a24	用，菩薩之性，亦復如是。眾生有思，名為欲心，	用 菩 薩 之 性 亦復如是 眾 生 有 思 名 為 欲 心 
T24n1488_001:1035a25	以如是欲，善業因緣發菩提心，是則名為菩	以 如 是 欲 善 業 因 緣 發菩提心 是 則 名 為 菩 
T24n1488_001:1035a26	薩性也。善男子！譬如眾生先無菩提後乃方	薩 性 也 善 男 子 譬 如 眾 生 先 無 菩 提 後 乃 方 
T24n1488_001:1035a27	有，性亦如是先無後有，是故不可說言定有。	有 性 亦 如 是 先 無 後 有 是 故 不可說言 定 有 
T24n1488_001:1035a28	「善男子！求大智慧，故名菩薩；欲知一切法真	 善 男 子 求 大 智 慧 故 名 菩 薩 欲 知一切法 真 
T24n1488_001:1035a29	實故、大莊嚴故、心堅固故、多度眾生故、不惜	實 故 大 莊 嚴 故 心 堅 固 故 多 度 眾 生 故 不 惜 
T24n1488_001:1035b01	身命故，是名菩薩修行大乘。善男子！菩薩有	身 命 故 是 名 菩薩修行 大 乘 善 男 子 菩 薩 有 
T24n1488_001:1035b02	二種：一者、退轉，二者、不退。已修三十二相業	二 種 一 者 退 轉 二 者 不 退 已 修 三十二相 業 
T24n1488_001:1035b03	者，名不退轉；若未能修，是名為退。復有二	者 名 不 退 轉 若 未 能 修 是 名 為 退 復 有 二 
T24n1488_001:1035b04	種：一者、出家，二者、在家。出家菩薩奉持八	種 一 者 出 家 二 者 在 家 出 家 菩 薩 奉 持 八 
T24n1488_001:1035b05	重，具足清淨，是名不退；在家菩薩奉持六重，	重 具 足 清 淨 是 名 不 退 在 家 菩 薩 奉 持 六 重 
T24n1488_001:1035b06	具足清淨，亦名不退。「善男子！外道斷欲所得	具 足 清 淨 亦 名 不 退 善 男 子 外 道 斷 欲 所 得 
T24n1488_001:1035b07	福德，勝於欲界一切眾生所有福德；須陀洹	福 德 勝 於 欲 界 一 切 眾 生 所 有 福 德 須 陀 洹 
T24n1488_001:1035b08	人勝於一切外道異見；斯陀含人勝於一切	人 勝 於 一 切 外 道 異 見 斯 陀 含 人 勝 於 一 切 
T24n1488_001:1035b09	須陀洹果；阿那含人勝於一切斯陀含果；阿	須陀洹果 阿 那 含 人 勝 於 一 切 斯陀含果 阿 
T24n1488_001:1035b10	羅漢人勝於一切阿那含果；辟支佛人勝於	羅 漢 人 勝 於 一 切 阿那含果 辟支佛人 勝 於 
T24n1488_001:1035b11	一切阿羅漢果；在家之人發菩提心，勝於一	一 切 阿羅漢果 在 家 之 人 發菩提心 勝 於 一 
T24n1488_001:1035b12	切辟支佛果。出家之人發菩提心，此不為難，	切 辟 支 佛 果 出家之人 發菩提心 此 不 為 難 
T24n1488_001:1035b13	在家之人發菩提心，是乃名為不可思議。何	在 家 之 人 發菩提心 是 乃 名 為 不可思議 何 
T24n1488_001:1035b14	以故？在家之人多惡因緣所纏遶故。在家之	以 故 在 家 之 人 多 惡 因 緣 所 纏 遶 故 在 家 之 
T24n1488_001:1035b15	人發菩提心時，從四天王乃至阿迦膩吒諸	人 發菩提心 時 從 四 天 王 乃 至 阿 迦 膩 吒 諸 
T24n1488_001:1035b16	天，皆大驚喜，作如是言：『我今已得人天之師。』」	天 皆 大 驚 喜 作如是言 我 今 已 得 人 天 之 師 
T24n1488_001:1035b17	優婆塞戒經發菩提心品第二	優婆塞戒 經 發菩提心 品 第 二 
T24n1488_001:1035b18	善生言：「世尊！眾生云何發菩提心？」「善男子！為	善 生 言 世 尊 眾 生 云 何 發菩提心 善 男 子 為 
T24n1488_001:1035b19	二事故發菩提心：一者、增長壽命，二者、增長	二 事 故 發菩提心 一 者 增 長 壽 命 二 者 增 長 
T24n1488_001:1035b20	財物。復有二事：一者、為不斷絕菩薩種姓，	財 物 復 有 二 事 一 者 為 不 斷 絕 菩薩種姓 
T24n1488_001:1035b21	二者、為斷眾生罪苦煩惱。復有二事：一者、自	二 者 為 斷 眾 生 罪 苦 煩 惱 復 有 二 事 一 者 自 
T24n1488_001:1035b22	觀無量世中受大苦惱，不得利益；二者、雖有	觀 無 量 世 中 受 大 苦 惱 不 得 利 益 二 者 雖 有 
T24n1488_001:1035b23	無量恒沙諸佛，悉皆不能度脫我身，我當自	無 量 恒 沙 諸 佛 悉 皆 不 能 度 脫 我 身 我 當 自 
T24n1488_001:1035b24	度。復有二事：一者、作諸善業，二者、作已不失。	度 復 有 二 事 一 者 作 諸 善 業 二 者 作 已 不 失 
T24n1488_001:1035b25	復有二事：一者、為勝一切人天果報，二者、為	復 有 二 事 一 者 為 勝 一 切 人 天 果 報 二 者 為 
T24n1488_001:1035b26	勝一切二乘果報。復有二事：一者、為求菩提	勝 一 切 二 乘 果 報 復 有 二 事 一 者 為 求 菩 提 
T24n1488_001:1035b27	之道受大苦惱；二者、為得無量大利益事。復	之 道 受 大 苦 惱 二 者 為 得 無 量 大 利 益 事 復 
T24n1488_001:1035b28	有二事：一者、過去、未來恒沙諸佛皆如我身，	有 二 事 一 者 過 去 未 來 恒 沙 諸 佛 皆 如 我 身 
T24n1488_001:1035b29	二者、深觀菩提是可得法，是故發心。復有二	二 者 深 觀 菩 提 是 可 得 法 是 故 發 心 復 有 二 
T24n1488_001:1035c01	事：一者、觀六住人雖有轉心，猶勝一切聲聞、	事 一 者 觀 六 住 人 雖 有 轉 心 猶 勝 一 切 聲 聞 
T24n1488_001:1035c02	緣覺；二者、勤心求索無上果故。復有二事：一	緣 覺 二 者 勤 心 求 索 無 上 果 故 復 有 二 事 一 
T24n1488_001:1035c03	者、欲令一切眾生悉得解脫，二者、欲令眾生	者 欲 令 一 切 眾 生 悉 得 解 脫 二 者 欲 令 眾 生 
T24n1488_001:1035c04	解脫、勝外道等所得果報。復有二事：一者、	解 脫 勝 外 道 等 所 得 果 報 復 有 二 事 一 者 
T24n1488_001:1035c05	不捨一切眾生，二者、捨離一切煩惱。復有二	不 捨 一 切 眾 生 二 者 捨 離 一切煩惱 復 有 二 
T24n1488_001:1035c06	事：一者、為斷眾生現在苦惱，二者、為遮眾生	事 一 者 為 斷 眾 生 現 在 苦 惱 二 者 為 遮 眾 生 
T24n1488_001:1035c07	未來苦惱。復有二事：一者、為斷智慧障礙，二	未 來 苦 惱 復 有 二 事 一 者 為 斷 智 慧 障 礙 二 
T24n1488_001:1035c08	者、為斷眾生身障。「善男子！發菩提心有五事：	者 為 斷 眾 生 身 障 善 男 子 發菩提心 有 五 事 
T24n1488_001:1035c09	一者、親近善友，二者、斷瞋恚心，三者、隨師教	一 者 親近善友 二 者 斷 瞋 恚 心 三 者 隨 師 教 
T24n1488_001:1035c10	誨，四者、生憐愍心，五者、勤修精進。復有五事：	誨 四 者 生 憐 愍 心 五 者 勤修精進 復 有 五 事 
T24n1488_001:1035c11	一者、不見他過，二者、雖見他過而心不悔，三	一 者 不 見 他 過 二 者 雖 見 他 過 而 心 不 悔 三 
T24n1488_001:1035c12	者、得善法已不生憍慢，四者、見他善業不生	者 得 善 法 已 不生憍慢 四 者 見 他 善 業 不 生 
T24n1488_001:1035c13	妬心，五者、觀諸眾生如一子想。「善男子！有智	妬 心 五 者 觀 諸 眾 生 如 一 子 想 善 男 子 有 智 
T24n1488_001:1035c14	之人發菩提心已，即能破壞惡業等果如須	之 人 發菩提心 已 即 能 破 壞 惡 業 等 果 如 須 
T24n1488_001:1035c15	彌山。有智之人，為三事故發菩提心：一者、見	彌 山 有 智 之 人 為 三 事 故 發菩提心 一 者 見 
T24n1488_001:1035c16	惡世中五濁眾生，二者、見於如來有不可思	惡 世 中 五 濁 眾 生 二 者 見 於 如 來 有 不 可 思 
T24n1488_001:1035c17	議神通道力，三者、聞佛如來八種妙聲。復有	議 神通道力 三 者 聞 佛 如 來 八 種 妙 聲 復 有 
T24n1488_001:1035c18	二事：一者、了了自知己身有苦，二者、知眾生	二 事 一 者 了 了 自 知 己 身 有 苦 二 者 知 眾 生 
T24n1488_001:1035c19	苦如己受苦，為斷彼苦，如己無異。「善男子！若	苦 如 己 受 苦 為 斷 彼 苦 如 己 無 異 善 男 子 若 
T24n1488_001:1035c20	有人能發菩提心，當知是人能禮六方增長	有 人 能 發菩提心 當 知 是 人 能 禮 六 方 增 長 
T24n1488_001:1035c21	命、財，不如外道之所宣說。」	命 財 不 如 外 道 之 所 宣 說 
T24n1488_001:1035c22	優婆塞戒經悲品第三	優婆塞戒 經 悲 品 第 三 
T24n1488_001:1035c23	善生言：「世尊！彼六師等不說因果，如來今	善 生 言 世 尊 彼 六 師 等 不 說 因 果 如 來 今 
T24n1488_001:1035c24	說因，有二種：一者、生因，二者、了因。如佛初說	說 因 有 二 種 一 者 生 因 二 者 了 因 如 佛 初 說 
T24n1488_001:1035c25	發菩提心，為是生因、是了因耶？」「善男子！我為	發菩提心 為 是 生 因 是 了 因 耶 善 男 子 我 為 
T24n1488_001:1035c26	眾生或說一因，或說二因，或說三因，或說四	眾 生 或 說 一 因 或 說 二 因 或 說 三 因 或 說 四 
T24n1488_001:1035c27	因，或說五因，或說六、七至十二因。言一因者，	因 或 說 五 因 或 說 六 七 至 十 二 因 言 一 因 者 
T24n1488_001:1035c28	即生因也。言二因者，生因、了因。言三因者，煩	即 生 因 也 言 二 因 者 生 因 了 因 言 三 因 者 煩 
T24n1488_001:1035c29	惱、業、器。言四因者，所謂四大。言五因者，未	惱 業 器 言 四 因 者 所 謂 四 大 言 五 因 者 未 
T24n1488_001:1036a01	來五支。言六因者，如契經中所說六因。言七	來 五 支 言 六 因 者 如 契 經 中 所 說 六 因 言 七 
T24n1488_001:1036a02	因者，如《法華》說。言八因者，現在八支。言九因	因 者 如 法 華 說 言 八 因 者 現 在 八 支 言 九 因 
T24n1488_001:1036a03	者，如《大城經》說。言十因者，如為摩男優婆塞	者 如 大 城 經 說 言 十 因 者 如 為 摩 男 優 婆 塞 
T24n1488_001:1036a04	說。十一因者，如《智印》說。十二因者，如十二因	說 十 一 因 者 如 智 印 說 十 二 因 者 如 十 二 因 
T24n1488_001:1036a05	緣。善男子！一切有漏法無量無邊因，一切無	緣 善 男 子 一切有漏法 無量無邊 因 一 切 無 
T24n1488_001:1036a06	漏法無量無邊因，有智之人欲盡知故，發菩	漏 法 無量無邊 因 有 智 之 人 欲 盡 知 故 發 菩 
T24n1488_001:1036a07	提心；是故如來名一切智。「善男子！一切眾	提 心 是 故 如 來 名 一 切 智 善 男 子 一 切 眾 
T24n1488_001:1036a08	生發菩提心，或有生因，或有了因，或有生	生 發菩提心 或 有 生 因 或 有 了 因 或 有 生 
T24n1488_001:1036a09	因、了因。汝今當知：夫生因者，即是大悲；因是	因 了 因 汝 今 當 知 夫 生 因 者 即 是 大 悲 因 是 
T24n1488_001:1036a10	悲故，便能發心，是故悲心為生因也。」「世尊！云	悲 故 便 能 發 心 是 故 悲 心 為 生 因 也 世 尊 云 
T24n1488_001:1036a11	何而得修於悲心？」「善男子！智者深見一切眾	何 而 得 修 於 悲 心 善 男 子 智 者 深 見 一 切 眾 
T24n1488_001:1036a12	生沈沒生死苦惱大海，為欲拔濟，是故生悲。	生 沈 沒 生 死 苦 惱 大 海 為 欲 拔 濟 是 故 生 悲 
T24n1488_001:1036a13	又見眾生未有十力、四無所畏、大悲、三念，我	又 見 眾 生 未 有 十 力 四無所畏 大 悲 三 念 我 
T24n1488_001:1036a14	當云何令彼具足？是故生悲。又見眾生雖多	當 云 何 令 彼 具 足 是 故 生 悲 又 見 眾 生 雖 多 
T24n1488_001:1036a15	怨毒，亦作親想，是故生悲。又見眾生迷於正	怨 毒 亦 作 親 想 是 故 生 悲 又 見 眾 生 迷 於 正 
T24n1488_001:1036a16	路，無有示導，是故生悲。又見眾生臥五欲泥	路 無 有 示 導 是 故 生 悲 又 見 眾 生 臥 五 欲 泥 
T24n1488_001:1036a17	而不能出，猶故放逸，是故生悲。又見眾生常	而 不 能 出 猶 故 放 逸 是 故 生 悲 又 見 眾 生 常 
T24n1488_001:1036a18	為財物、妻子纏縛，不能捨離，是故生悲。又見	為 財 物 妻 子 纏 縛 不 能 捨 離 是 故 生 悲 又 見 
T24n1488_001:1036a19	眾生以色命故而生憍慢，是故生悲。又見眾	眾 生 以 色 命 故 而 生 憍 慢 是 故 生 悲 又 見 眾 
T24n1488_001:1036a20	生為惡知識之所誑惑，故生親想，如六師等，	生 為 惡 知 識 之 所 誑 惑 故 生 親 想 如 六 師 等 
T24n1488_001:1036a21	是故生悲。又見眾生墮生有界，受諸苦惱，猶	是 故 生 悲 又 見 眾 生 墮 生 有 界 受諸苦惱 猶 
T24n1488_001:1036a22	故樂著，是故生悲。又見眾生造身、口、意不善	故 樂 著 是 故 生 悲 又 見 眾 生 造 身 口 意 不 善 
