T24n1488_006:1064a28	者、喜，四者、忍，五者、信。若人能破慇重邪見，心	者 喜 四 者 忍 五 者 信 若 人 能 破 慇 重 邪 見 心 
T24n1488_006:1064a29	無疑網，則具正念，莊嚴清淨，根本清淨，離惡	無 疑 網 則 具 正 念 莊 嚴 清 淨 根 本 清 淨 離 惡 
T24n1488_006:1064b01	覺觀。善男子！若人能遠五惡事者，是名受戒，	覺 觀 善 男 子 若 人 能 遠 五 惡 事 者 是 名 受 戒 
T24n1488_006:1064b02	遠離一切身、口、意惡。若有說言：離五戒已度	遠 離 一 切 身 口 意 惡 若 有 說 言 離 五 戒 已 度 
T24n1488_006:1064b03	生死者。無有是處。善男子！若人欲度生死	生 死 者 無 有 是 處 善 男 子 若 人 欲 度 生 死 
T24n1488_006:1064b04	大海，應當至心受持五戒。是五戒中、四於	大 海 應 當 至 心 受 持 五 戒 是 五 戒 中 四 於 
T24n1488_006:1064b05	後世成無作戒，唯愛難斷故不得成；以是因	後 世 成 無 作 戒 唯 愛 難 斷 故 不 得 成 以 是 因 
T24n1488_006:1064b06	緣，婬欲纏綿，應當至心慎無放逸！若有說言：	緣 婬 欲 纏 綿 應 當 至 心 慎 無 放 逸 若 有 說 言 
T24n1488_006:1064b07	更有無量極重之法，過去諸佛何緣不制，而	更 有 無 量 極 重 之 法 過去諸佛 何 緣 不 制 而 
T24n1488_006:1064b08	制於酒？善男子！因於飲酒，慚愧心壞，於三惡	制 於 酒 善 男 子 因 於 飲 酒 慚 愧 心 壞 於 三 惡 
T24n1488_006:1064b09	道不生怖畏，以是因緣，則不能受其餘四戒，	道 不 生 怖 畏 以是因緣 則 不 能 受 其 餘 四 戒 
T24n1488_006:1064b10	是故過去諸佛如來制不聽飲。若有說言：如	是 故 過去諸佛 如 來 制 不 聽 飲 若 有 說 言 如 
T24n1488_006:1064b11	來已說酒多過失，何故不在五戒初說？是義	來 已 說 酒 多 過 失 何 故 不 在 五 戒 初 說 是 義 
T24n1488_006:1064b12	不然！何以故？如是酒戒，名為遮重，不為性	不 然 何 以 故 如 是 酒 戒 名 為 遮 重 不 為 性 
T24n1488_006:1064b13	重；如來先制性重之戒，後制遮重。「善男子！如	重 如 來 先 制 性 重 之 戒 後 制 遮 重 善 男 子 如 
T24n1488_006:1064b14	來先說白、黑月中各有三齋，隨外道故；諸外	來 先 說 白 黑 月 中 各 有 三 齋 隨 外 道 故 諸 外 
T24n1488_006:1064b15	道輩常以此日供養諸天，是故如來說有三	道 輩 常 以 此 日 供 養 諸 天 是 故 如 來 說 有 三 
T24n1488_006:1064b16	齋。善男子！如因帳窓，帳勒故不墮，三齋之	齋 善 男 子 如 因 帳 窓 帳 勒 故 不 墮 三 齋 之 
T24n1488_006:1064b17	法，亦復如是。眾生若有發心受持，終不墮於	法 亦復如是 眾 生 若 有 發 心 受 持 終 不 墮 於 
T24n1488_006:1064b18	三惡道中。善男子！有人若欲施時，供養三寶	三 惡 道 中 善 男 子 有 人 若 欲 施 時 供養三寶 
T24n1488_006:1064b19	時，若坐禪時，若修善時，若讀經時，供養父	時 若 坐 禪 時 若 修 善 時 若 讀 經 時 供 養 父 
T24n1488_006:1064b20	母時，當先立制，我若不作，要自剋罰；是人	母 時 當 先 立 制 我 若 不 作 要 自 剋 罰 是 人 
T24n1488_006:1064b21	福德，日夜增長，如恒河流。如是五戒有五種	福 德 日 夜 增 長 如 恒 河 流 如 是 五 戒 有 五 種 
T24n1488_006:1064b22	果：一者、無作果，二者、報果，三者、餘果，四者、作	果 一 者 無 作 果 二 者 報 果 三 者 餘 果 四 者 作 
T24n1488_006:1064b23	果，五者、解脫果。若有具足受持五戒，當知	果 五 者 解 脫 果 若 有 具 足 受 持 五 戒 當 知 
T24n1488_006:1064b24	是人得是五果。若優婆塞常能出至寺廟僧	是 人 得 是 五 果 若 優 婆 塞 常 能 出 至 寺 廟 僧 
T24n1488_006:1064b25	坊，到已，親近諸比丘等，既親近已，諮問法味；	坊 到 已 親 近 諸 比 丘 等 既 親 近 已 諮 問 法 味 
T24n1488_006:1064b26	既問法已，當至心聽；聽已受持，憶念不忘能	既 問 法 已 當 至 心 聽 聽 已 受 持 憶 念 不 忘 能 
T24n1488_006:1064b27	分別義；分別義已，轉化眾生，是名優婆塞自	分 別 義 分 別 義 已 轉 化 眾 生 是 名 優 婆 塞 自 
T24n1488_006:1064b28	利利他。「若優婆塞不能習學如是所說，輕慢	利 利 他 若 優 婆 塞 不 能 習 學 如是所說 輕 慢 
T24n1488_006:1064b29	比丘，為求過失而往聽法，無信敬心，奉事外	比 丘 為 求 過 失 而 往 聽 法 無 信 敬 心 奉 事 外 
T24n1488_006:1064c01	道，見其功德，深信日、月、五星、諸宿，是優婆塞	道 見 其 功 德 深 信 日 月 五 星 諸 宿 是 優 婆 塞 
T24n1488_006:1064c02	不名堅固如法住也。若優婆塞雖不自作五	不 名 堅 固 如 法 住 也 若 優 婆 塞 雖 不 自 作 五 
T24n1488_006:1064c03	惡之業，教人作者，是優婆塞非如法住也。	惡 之 業 教 人 作 者 是 優 婆 塞 非 如 法 住 也 
T24n1488_006:1064c04	若優婆塞先取他物，許為了事，是優婆塞非	若 優 婆 塞 先 取 他 物 許 為 了 事 是 優 婆 塞 非 
T24n1488_006:1064c05	如法住。若優婆塞典知官津，稅賣估物，是	如 法 住 若 優 婆 塞 典 知 官 津 稅 賣 估 物 是 
T24n1488_006:1064c06	優婆塞非如法住。若優婆塞計價治病，治已	優 婆 塞 非 如 法 住 若 優 婆 塞 計 價 治 病 治 已 
T24n1488_006:1064c07	賣物，是優婆塞非如法住。若優婆塞違官私	賣 物 是 優 婆 塞 非 如 法 住 若 優 婆 塞 違 官 私 
T24n1488_006:1064c08	制，非如法住。若優婆塞自不作惡，不教他作，	制 非 如 法 住 若 優 婆 塞 自 不 作 惡 不 教 他 作 
T24n1488_006:1064c09	心不念惡，名如法住。若優婆塞因客煩惱所	心 不 念 惡 名 如 法 住 若 優 婆 塞 因 客 煩 惱 所 
T24n1488_006:1064c10	起之罪，作已不生慚愧悔心，非如法住。若	起 之 罪 作 已 不 生 慚 愧 悔 心 非 如 法 住 若 
T24n1488_006:1064c11	優婆塞為身命故，作諸惡事，非如法住。若優	優 婆 塞 為 身 命 故 作 諸 惡 事 非 如 法 住 若 優 
T24n1488_006:1064c12	婆塞雖得人身，行於非法，不名為人。若得信	婆 塞 雖 得 人 身 行 於 非 法 不 名 為 人 若 得 信 
T24n1488_006:1064c13	心，能作福德，善修正念，觀一切法皆是無常、	心 能 作 福 德 善 修 正 念 觀 一 切 法 皆 是 無 常 
T24n1488_006:1064c14	無我我所，於一切法心無取著，見一切法不	無我我所 於一切法 心 無 取 著 見 一 切 法 不 
T24n1488_006:1064c15	得自在，生滅苦空無有寂靜；人身難得，雖得	得 自 在 生 滅 苦 空 無 有 寂 靜 人 身 難 得 雖 得 
T24n1488_006:1064c16	人身，難具諸根；雖具諸根，難得正見；雖具正	人 身 難 具 諸 根 雖 具 諸 根 難 得 正 見 雖 具 正 
T24n1488_006:1064c17	見，難得信心；雖得信心，難遇善友；雖遇善友，	見 難 得 信 心 雖 得 信 心 難 遇 善 友 雖 遇 善 友 
T24n1488_006:1064c18	難聞正法；雖聞正法，難得受持；能如是觀，是	難 聞 正 法 雖 聞 正 法 難 得 受 持 能 如 是 觀 是 
T24n1488_006:1064c19	名人身。若人能觀欲界無常，乃至非想非非	名 人 身 若 人 能 觀 欲 界 無 常 乃 至 非 想 非 非 
T24n1488_006:1064c20	想處皆悉無常，以是因緣，不求三惡乃至非	想 處 皆 悉 無 常 以是因緣 不 求 三 惡 乃 至 非 
T24n1488_006:1064c21	想非非想處。如是觀已，見三不堅，以不堅身	想 非非想處 如 是 觀 已 見 三 不 堅 以 不 堅 身 
T24n1488_006:1064c22	易於堅身：禮拜供養，來迎去送，自手施與，親	易 於 堅 身 禮拜供養 來 迎 去 送 自 手 施 與 親 
T24n1488_006:1064c23	執福事，是名以不堅身易於堅身。以不堅財	執 福 事 是 名 以 不 堅 身 易 於 堅 身 以 不 堅 財 
T24n1488_006:1064c24	易於堅財：能自食用亦以布施，供給病瘦行	易 於 堅 財 能 自 食 用 亦 以 布 施 供 給 病 瘦 行 
T24n1488_006:1064c25	路之人，供養沙門、婆羅門等貧窮下賤，是名	路 之 人 供 養 沙 門 婆 羅 門 等 貧窮下賤 是 名 
T24n1488_006:1064c26	以不堅財易於堅財。以不堅命易於堅命：修	以 不 堅 財 易 於 堅 財 以 不 堅 命 易 於 堅 命 修 
T24n1488_006:1064c27	於六念、慈悲喜捨，證四真諦，善能觀察生老	於 六 念 慈 悲 喜 捨 證 四 真 諦 善 能 觀 察 生 老 
T24n1488_006:1064c28	病死，明信善惡業之果報，定知恩愛當有別	病 死 明 信 善 惡 業 之 果 報 定 知 恩 愛 當 有 別 
T24n1488_006:1064c29	離，一切眾生不得自在，未得聖道，生死力大，	離 一 切 眾 生 不得自在 未 得 聖 道 生 死 力 大 
T24n1488_006:1065a01	一切世樂常與苦俱，雖復受之，心不染著，猶	一 切 世 樂 常 與 苦 俱 雖 復 受 之 心 不 染 著 猶 
T24n1488_006:1065a02	如寒月求火自煖，雖復為之，終不作惡。修忍	如 寒 月 求 火 自 煖 雖 復 為 之 終 不 作 惡 修 忍 
T24n1488_006:1065a03	二施以潤眾生，深觀苦樂其性平等。凡所發	二 施 以 潤 眾 生 深 觀 苦 樂 其 性 平 等 凡 所 發 
T24n1488_006:1065a04	言，言則柔軟，善化眾生，令如法住，遠離惡友，	言 言 則 柔 軟 善 化 眾 生 令 如 法 住 遠 離 惡 友 
T24n1488_006:1065a05	心無放逸，飲酒、博弈、射獵之事悉不為之，是	心 無 放 逸 飲 酒 博 弈 射 獵 之 事 悉 不 為 之 是 
T24n1488_006:1065a06	名以不堅之命易於堅命。「善男子！若得人	名 以 不 堅 之 命 易 於 堅 命 善 男 子 若 得 人 
T24n1488_006:1065a07	身，多饒財物，兼得自在，先應供養父母、師長、	身 多 饒 財 物 兼 得 自 在 先 應 供 養 父 母 師 長 
T24n1488_006:1065a08	和上、耆舊、持法之人，供給遠至、初行之人，疾	和 上 耆 舊 持 法 之 人 供 給 遠 至 初 行 之 人 疾 
T24n1488_006:1065a09	病所須。言則柔軟，多有慚愧，不偏信敬有德	病 所 須 言 則 柔 軟 多 有 慚 愧 不 偏 信 敬 有 德 
T24n1488_006:1065a10	一人，見有賢聖持戒、多聞，能以舍宅、飲食、臥	一 人 見 有 賢 聖 持 戒 多 聞 能 以 舍 宅 飲 食 臥 
T24n1488_006:1065a11	具、衣服、病藥而供養之，深言僧中多有功德，	具 衣 服 病 藥 而 供 養 之 深 言 僧 中 多 有 功 德 
T24n1488_006:1065a12	修集向道得須陀洹果，乃至能修向阿羅漢，	修 集 向 道 得 須陀洹果 乃 至 能 修 向 阿 羅 漢 
T24n1488_006:1065a13	得阿羅漢果，修金剛三昧、電光三昧。觀如是	得阿羅漢 果 修 金 剛 三 昧 電 光 三 昧 觀 如 是 
T24n1488_006:1065a14	已，平等奉施。如是施已，得無量福，是故我於	已 平 等 奉 施 如 是 施 已 得 無 量 福 是 故 我 於 
T24n1488_006:1065a15	《鹿子經》中告鹿子母曰：『雖復請佛及五百阿	 鹿 子 經 中 告 鹿 子 母 曰 雖 復 請 佛 及 五 百 阿 
T24n1488_006:1065a16	羅漢，猶故不得名請僧福。若能僧中施一	羅 漢 猶 故 不 得 名 請 僧 福 若 能 僧 中 施 一 
T24n1488_006:1065a17	似像極惡比丘，猶得無量福德果報。何以	似 像 極 惡 比 丘 猶 得 無量福德 果 報 何 以 
T24n1488_006:1065a18	故？如是比丘雖是惡人，無戒、多聞，不修善法，	故 如 是 比 丘 雖 是 惡 人 無 戒 多 聞 不 修 善 法 
T24n1488_006:1065a19	亦能演說三種菩提，有因有果，亦不誹謗佛	亦 能 演 說 三 種 菩 提 有 因 有 果 亦 不 誹 謗 佛 
T24n1488_006:1065a20	法僧寶，執持如來無上勝幡，正見無謬。』若供	法 僧 寶 執 持 如 來 無 上 勝 幡 正 見 無 謬 若 供 
T24n1488_006:1065a21	養僧，即是供養佛、僧二寶；若觀佛法功德	養 僧 即 是 供 養 佛 僧 二 寶 若 觀 佛 法 功 德 
T24n1488_006:1065a22	微妙，即是具足供養三寶。若人施時不求果	微 妙 即 是 具 足 供養三寶 若 人 施 時 不 求 果 
T24n1488_006:1065a23	報，即是供養無上菩提，具足成就檀波羅蜜，	報 即 是 供 養 無上菩提 具 足 成 就 檀 波 羅 蜜 
T24n1488_006:1065a24	修菩提道，能得未來無量功德，亦能自利及	修 菩 提 道 能 得 未 來 無量功德 亦 能 自 利 及 
T24n1488_006:1065a25	利益他。能修慈悲，為破他苦，自捨己樂。未得	利 益 他 能 修 慈 悲 為 破 他 苦 自 捨 己 樂 未 得 
T24n1488_006:1065a26	菩提，心無憂悔，雖聞菩提久遠難得，而其內	菩 提 心 無 憂 悔 雖 聞 菩 提 久 遠 難 得 而 其 內 
T24n1488_006:1065a27	心初無退轉，為諸眾生無量世中受大苦惱，	心 初 無 退 轉 為 諸 眾 生 無 量 世 中 受 大 苦 惱 
T24n1488_006:1065a28	亦不疲厭。樂如法行，不求世樂，樂處寂靜出	亦 不 疲 厭 樂 如 法 行 不 求 世 樂 樂 處 寂 靜 出 
T24n1488_006:1065a29	家修道，未得出家，雖在家居，如解脫人不作	家 修 道 未 得 出 家 雖 在 家 居 如 解 脫 人 不 作 
T24n1488_006:1065b01	眾惡，得三種戒——戒戒、定戒、無漏戒。「善男子！菩	眾 惡 得 三 種 戒 戒 戒 定 戒 無 漏 戒 善 男 子 菩 
T24n1488_006:1065b02	薩二種：一者、在家，二者、出家。出家菩薩如法	薩 二 種 一 者 在 家 二 者 出 家 出 家 菩 薩 如 法 
T24n1488_006:1065b03	修行，是不為難；在家菩薩如法修行，是乃為	修 行 是 不 為 難 在 家 菩 薩 如 法 修 行 是 乃 為 
T24n1488_006:1065b04	難。何以故？在家之人多惡因緣所纏繞故。」	難 何 以 故 在 家 之 人 多 惡 因 緣 所 纏 繞 故 
T24n1488_006:1065b05	優婆塞戒經尸波羅蜜品第二十三	優婆塞戒 經 尸 波 羅 蜜 品 第 二 十 三 
T24n1488_006:1065b06	善生言「世尊！云何菩薩趣向菩提，其心堅固？」	善 生 言 世 尊 云 何 菩 薩 趣 向 菩 提 其 心 堅 固 
T24n1488_006:1065b07	「善男子？菩薩堅固，具足四法：一者、受大苦時	 善 男 子 菩 薩 堅 固 具 足 四 法 一 者 受 大 苦 時 
T24n1488_006:1065b08	終不捨離如法之行；二者、得大自在，常修忍	終 不 捨 離 如 法 之 行 二 者 得 大 自 在 常 修 忍 
T24n1488_006:1065b09	辱；三者、身處貧窮，常樂施與；四者、盛壯之年，	辱 三 者 身 處 貧 窮 常 樂 施 與 四 者 盛 壯 之 年 
T24n1488_006:1065b10	常樂出家。若有菩薩具足四法，趣向菩提，其	常 樂 出 家 若 有 菩 薩 具 足 四 法 趣 向 菩 提 其 
T24n1488_006:1065b11	心堅固。「菩薩具足如是四法，復作是念：『是菩	心 堅 固 菩 薩 具 足 如 是 四 法 復 作 是 念 是 菩 
T24n1488_006:1065b12	提道初根本地，名之為戒。如是戒者，亦名初	提 道 初 根 本 地 名 之 為 戒 如 是 戒 者 亦 名 初 
T24n1488_006:1065b13	地，亦名導地，亦名平地，亦名等地，亦名慈地，	地 亦 名 導 地 亦 名 平 地 亦 名 等 地 亦 名 慈 地 
T24n1488_006:1065b14	亦名悲地，亦名佛跡，亦名一切功德根本，	亦 名 悲 地 亦 名 佛 跡 亦 名 一切功德 根 本 
T24n1488_006:1065b15	亦名福田；以是因緣，智者應當受持不毀。』	亦 名 福 田 以是因緣 智 者 應 當 受 持 不 毀 
T24n1488_006:1065b16	復次，智者又作是念：『戒有二果，一、諸天樂，二、	復 次 智 者 又 作 是 念 戒 有 二 果 一 諸 天 樂 二 
T24n1488_006:1065b17	菩提樂；智者應當求菩提樂，不求天樂。』若受	菩 提 樂 智 者 應 當 求 菩 提 樂 不 求 天 樂 若 受 
T24n1488_006:1065b18	戒已，所不應作而故作之，所不應思而故思	戒 已 所 不 應 作 而 故 作 之 所 不 應 思 而 故 思 
T24n1488_006:1065b19	惟，懈怠懶惰，樂於睡眠，念惡覺觀，邪命惡	惟 懈 怠 懶 惰 樂 於 睡 眠 念 惡 覺 觀 邪 命 惡 
T24n1488_006:1065b20	願，是名污戒。若受戒已，心生悔恨，求人天樂，	願 是 名 污 戒 若 受 戒 已 心 生 悔 恨 求 人 天 樂 
T24n1488_006:1065b21	多諸放逸，不生憐愍，是名污戒。若畏貧窮，若	多 諸 放 逸 不 生 憐 愍 是 名 污 戒 若 畏 貧 窮 若 
T24n1488_006:1065b22	為恐怖，若為失財，若畏作役，若為身命，若為	為 恐 怖 若 為 失 財 若 畏 作 役 若 為 身 命 若 為 
T24n1488_006:1065b23	利養，若為愛心而受禁戒，既受戒已，心生疑	利 養 若 為 愛 心 而 受 禁 戒 既 受 戒 已 心 生 疑 
T24n1488_006:1065b24	惑，是名污戒。「善男子！若人不樂久處生死，深	惑 是 名 污 戒 善 男 子 若 人 不 樂 久 處 生 死 深 
T24n1488_006:1065b25	見過罪，觀人天樂、阿鼻獄苦平等無差，憐愍	見 過 罪 觀 人 天 樂 阿 鼻 獄 苦 平 等 無 差 憐 愍 
T24n1488_006:1065b26	眾生，具足正念，為欲利益無量眾生使得成	眾 生 具 足 正 念 為 欲 利 益 無 量 眾 生 使 得 成 
T24n1488_006:1065b27	道；為具無上菩提道故，為如法行故，受持是	道 為 具 無上菩提 道 故 為 如 法 行 故 受 持 是 
T24n1488_006:1065b28	戒，心不放逸。能觀過去未來現在身口意業，	戒 心 不 放 逸 能 觀 過去未來現在 身口意業 
T24n1488_006:1065b29	知輕知重。凡所作事，先當繫心修不放逸，作	知 輕 知 重 凡 所 作 事 先 當 繫 心 修 不 放 逸 作 
T24n1488_006:1065c01	已、作時亦復如是修不放逸。若先不知，作已	已 作 時 亦復如是 修 不 放 逸 若 先 不 知 作 已 
T24n1488_006:1065c02	得罪，若失念心亦得犯罪，若客煩惱時暫起	得 罪 若 失 念 心 亦 得 犯 罪 若 客 煩 惱 時 暫 起 
T24n1488_006:1065c03	者亦得犯罪，若小放逸亦得犯罪。是人常觀	者 亦 得 犯 罪 若 小 放 逸 亦 得 犯 罪 是 人 常 觀 
T24n1488_006:1065c04	犯輕如重，觀已生悔及慚愧心，怖畏愁惱，心	犯 輕 如 重 觀 已 生 悔 及 慚 愧 心 怖 畏 愁 惱 心 
T24n1488_006:1065c05	不樂之，至心懺悔。既懺悔已，心生歡喜，慎	不 樂 之 至 心 懺 悔 既 懺 悔 已 心生歡喜 慎 
T24n1488_006:1065c06	護受持更不敢犯，是名淨戒。「善男子！有智	護 受 持 更 不 敢 犯 是 名 淨 戒 善 男 子 有 智 
T24n1488_006:1065c07	之人，既受戒已，當觀三事不作惡行：一者、自	之 人 既 受 戒 已 當 觀 三 事 不 作 惡 行 一 者 自 
T24n1488_006:1065c08	為，二者、為世，三者、為法。云何自為？我自證知	為 二 者 為 世 三 者 為 法 云 何 自 為 我 自 證 知 
T24n1488_006:1065c09	此是惡事，知作惡業得如是果，知作善業得	此 是 惡 事 知 作 惡 業 得 如 是 果 知 作 善 業 得 
T24n1488_006:1065c10	如是果。所作惡業無有虛妄，決定還得諸惡	如 是 果 所 作 惡 業 無 有 虛 妄 決 定 還 得 諸 惡 
T24n1488_006:1065c11	之果，所作善業亦無虛妄，決定還得諸善之	之 果 所 作 善 業 亦 無 虛 妄 決 定 還 得 諸 善 之 
T24n1488_006:1065c12	果；若是二業無虛妄者，我今云何而自欺誑？	果 若 是 二 業 無 虛 妄 者 我 今 云 何 而 自 欺 誑 
T24n1488_006:1065c13	以是因緣，我受戒已，不應毀犯，當至心持，是	以是因緣 我 受 戒 已 不 應 毀 犯 當 至 心 持 是 
T24n1488_006:1065c14	名自為。云何為世？有智者觀見世間之人，有	名 自 為 云 何 為 世 有 智 者 觀 見 世 間 之 人 有 
T24n1488_006:1065c15	得清淨天耳、天眼及他心智，我若作惡，是人	得 清 淨 天 耳 天 眼 及 他 心 智 我 若 作 惡 是 人 
T24n1488_006:1065c16	必當見聞知我；若見聞知，我當云何不生慚	必 當 見 聞 知 我 若 見 聞 知 我 當 云 何 不 生 慚 
T24n1488_006:1065c17	愧而作惡耶？復觀諸天具足無量福德，神足、	愧 而 作 惡 耶 復 觀 諸 天 具 足 無量福德 神 足 
T24n1488_006:1065c18	天耳、天眼，具他心智，遙能見聞，雖近於人，人	天 耳 天 眼 具 他 心 智 遙 能 見 聞 雖 近 於 人 人 
T24n1488_006:1065c19	不能見。若我作惡，如是等天當見聞知，若是	不 能 見 若 我 作 惡 如 是 等 天 當 見 聞 知 若 是 
T24n1488_006:1065c20	天等了了見我，我當云何不生慚愧故作罪	天 等 了 了 見 我 我 當 云 何 不 生 慚 愧 故 作 罪 
T24n1488_006:1065c21	耶？是名為世。云何為法？有智之人，觀如來	耶 是 名 為 世 云 何 為 法 有 智 之 人 觀 如 來 
T24n1488_006:1065c22	法清淨無染，得現在利，能令寂靜度於彼岸，	法 清 淨 無 染 得 現 在 利 能 令 寂 靜 度 於 彼 岸 
T24n1488_006:1065c23	能作解脫，不選時節。我為是法故受持戒，我	能 作 解 脫 不 選 時 節 我 為 是 法 故 受 持 戒 我 
T24n1488_006:1065c24	若不能先受小制，云何能得受大制耶？破小	若 不 能 先 受 小 制 云 何 能 得 受 大 制 耶 破 小 
T24n1488_006:1065c25	制已，增五有苦，若至心持，增無上樂。我受身	制 已 增 五 有 苦 若 至 心 持 增 無 上 樂 我 受 身 
T24n1488_006:1065c26	來所以未得證解脫者，實由不從過去無量	來 所 以 未 得 證 解 脫 者 實 由 不 從 過 去 無 量 
T24n1488_006:1065c27	諸佛如來受禁戒故；我今受戒，未來定當值	諸佛如來 受 禁 戒 故 我 今 受 戒 未 來 定 當 值 
T24n1488_006:1065c28	遇恒河沙等諸佛。深觀是已，生大憐愍，至心	遇 恒 河 沙 等 諸 佛 深 觀 是 已 生 大 憐 愍 至 心 
T24n1488_006:1065c29	受戒，受已堅持，為阿耨多羅三藐三菩提，利	受 戒 受 已 堅 持 為 阿耨多羅三藐三菩提 利 
T24n1488_006:1066a01	益無量諸眾生故。「善男子！若在家，若出家，若	益 無 量 諸 眾 生 故 善 男 子 若 在 家 若 出 家 若 
T24n1488_006:1066a02	三歸，若八齋，若五戒，若具足，若不具足，若一	三 歸 若 八 齋 若 五 戒 若 具 足 若 不 具 足 若 一 
T24n1488_006:1066a03	日一夜，若一時一念，若盡形壽至心受持，當	日 一 夜 若 一 時 一 念 若 盡 形 壽 至 心 受 持 當 
T24n1488_006:1066a04	知是人得大福德。善男子！若受戒已，修三善	知 是 人 得 大 福 德 善 男 子 若 受 戒 已 修 三 善 
T24n1488_006:1066a05	業——多聞、布施、修定，修善供養三寶，是則名為	業 多 聞 布 施 修 定 修 善 供養三寶 是 則 名 為 
T24n1488_006:1066a06	莊嚴菩提。若受戒已，能讀如來十二部經，是	莊 嚴 菩 提 若 受 戒 已 能 讀 如 來 十二部經 是 
T24n1488_006:1066a07	名無上大法之藏，勤加精進，欲得具足尸波	名 無 上 大 法 之 藏 勤加精進 欲 得 具 足 尸 波 
T24n1488_006:1066a08	羅蜜。如是戒者，今世受已，後雖不受，成無作	羅 蜜 如 是 戒 者 今 世 受 已 後 雖 不 受 成 無 作 
T24n1488_006:1066a09	戒。善男子！有戒非波羅蜜，有波羅蜜非戒，	戒 善 男 子 有 戒 非波羅蜜 有 波 羅 蜜 非 戒 
T24n1488_006:1066a10	有戒有波羅蜜，有非禁戒非波羅蜜。是戒	有 戒 有 波 羅 蜜 有 非 禁 戒 非波羅蜜 是 戒 
T24n1488_006:1066a11	非波羅蜜者，所謂聲聞、辟支佛戒。是波羅蜜	非波羅蜜 者 所 謂 聲 聞 辟 支 佛 戒 是 波 羅 蜜 
T24n1488_006:1066a12	非是戒者，所謂檀波羅蜜。是戒是波羅蜜者，	非 是 戒 者 所 謂 檀 波 羅 蜜 是 戒 是 波 羅 蜜 者 
T24n1488_006:1066a13	如昔菩薩受瞿陀身時，為諸虫獸及諸蟻子	如 昔 菩 薩 受 瞿 陀 身 時 為 諸 虫 獸 及 諸 蟻 子 
T24n1488_006:1066a14	之所唼食，身不傾動，不生惡心；亦如仙人為	之 所 唼 食 身 不 傾 動 不 生 惡 心 亦 如 仙 人 為 
T24n1488_006:1066a15	眾生故，十二年中青雀處頂，不起不動。非戒	眾 生 故 十 二 年 中 青 雀 處 頂 不 起 不 動 非 戒 
T24n1488_006:1066a16	非波羅蜜者，如世俗施。「善男子！菩薩摩訶薩	非波羅蜜 者 如 世 俗 施 善 男 子 菩薩摩訶薩 
T24n1488_006:1066a17	住尸波羅蜜時，所受眾苦，誰能說之？有人若	住 尸 波 羅 蜜 時 所 受 眾 苦 誰 能 說 之 有 人 若 
T24n1488_006:1066a18	受小小戒已，少欲知足，不能憐愍諸苦眾生，	受 小 小 戒 已 少欲知足 不 能 憐 愍 諸 苦 眾 生 
T24n1488_006:1066a19	當知是人不能具足尸波羅蜜。若能修忍、三昧、	當 知 是 人 不 能 具 足 尸 波 羅 蜜 若 能 修 忍 三 昧 
T24n1488_006:1066a20	智慧，勤行精進，樂於多聞，當知是人則能增	智 慧 勤行精進 樂 於 多 聞 當 知 是 人 則 能 增 
T24n1488_006:1066a21	長尸波羅蜜，莊嚴菩提，證菩提果。如是戒者，	長 尸 波 羅 蜜 莊 嚴 菩 提 證 菩 提 果 如 是 戒 者 
T24n1488_006:1066a22	無量眾生故，無量果報故，無量戒禁故，以	無 量 眾 生 故 無 量 果 報 故 無 量 戒 禁 故 以 
T24n1488_006:1066a23	是因緣，莊嚴菩提。「善男子！菩薩摩訶薩既受	是 因 緣 莊 嚴 菩 提 善 男 子 菩薩摩訶薩 既 受 
T24n1488_006:1066a24	戒已，口不說惡，耳不樂聞，不樂說世，亦不樂	戒 已 口 不 說 惡 耳 不 樂 聞 不 樂 說 世 亦 不 樂 
T24n1488_006:1066a25	聞，終不放心在惡覺觀，不親惡友，是故得名	聞 終 不 放 心 在 惡 覺 觀 不 親 惡 友 是 故 得 名 
T24n1488_006:1066a26	寂靜淨戒。菩薩若見破戒惡人，不生惡心，為	寂 靜 淨 戒 菩 薩 若 見 破 戒 惡 人 不 生 惡 心 為 
