T24n1488_002:1044a25	應護一切眾生之心，若不護者，則不能調一切	應 護 一 切 眾 生 之 心 若 不 護 者 則 不 能 調 一 切 
T24n1488_002:1044a26	眾生。菩薩亦應擁護自身，若不護身，亦不能	眾 生 菩 薩 亦 應 擁 護 自 身 若 不 護 身 亦 不 能 
T24n1488_002:1044a27	得調伏眾生。菩薩不為貪身、命、財，護身、命、財，	得 調 伏 眾 生 菩 薩 不 為 貪 身 命 財 護 身 命 財 
T24n1488_002:1044a28	皆為調伏諸眾生故。菩薩摩訶薩先自除惡，	皆 為 調 伏 諸 眾 生 故 菩薩摩訶薩 先 自 除 惡 
T24n1488_002:1044a29	後教人除，若不自除，能教他除，無有是處！	後 教 人 除 若 不 自 除 能 教 他 除 無 有 是 處 
T24n1488_002:1044b01	是故菩薩先應自施、持戒、知足、勤行精進，然	是 故 菩 薩 先 應 自 施 持 戒 知 足 勤行精進 然 
T24n1488_002:1044b02	後化人。菩薩若不自行法行，則不能得教化	後 化 人 菩 薩 若 不 自 行 法 行 則 不 能 得 教 化 
T24n1488_002:1044b03	眾生。「善男子！眾生諸根凡有三種，菩薩諸根，	眾 生 善 男 子 眾 生 諸 根 凡 有 三 種 菩 薩 諸 根 
T24n1488_002:1044b04	亦復三種，謂下中上：下根菩薩能化下根，不	亦 復 三 種 謂 下 中 上 下 根 菩 薩 能 化 下 根 不 
T24n1488_002:1044b05	及中、上；中根菩薩能化中、下，不及上根；上根	及 中 上 中 根 菩 薩 能 化 中 下 不 及 上 根 上 根 
T24n1488_002:1044b06	菩薩，能三種化。「善男子！菩薩有二種：一者、在	菩 薩 能 三 種 化 善 男 子 菩 薩 有 二 種 一 者 在 
T24n1488_002:1044b07	家，二者、出家。出家菩薩自利利他，是不為	家 二 者 出 家 出 家 菩 薩 自利利他 是 不 為 
T24n1488_002:1044b08	難；在家菩薩修是二利，是乃為難。何以故？	難 在 家 菩 薩 修 是 二 利 是 乃 為 難 何 以 故 
T24n1488_002:1044b09	在家菩薩多惡因緣所纏繞故。」	在 家 菩 薩 多 惡 因 緣 所 纏 繞 故 
T24n1488_002:1044b10	優婆塞戒經自他莊嚴品第十一	優婆塞戒 經 自 他 莊 嚴 品 第 十 一 
T24n1488_002:1044b11	善生言：「世尊！菩薩摩訶薩具足幾法能自他	善 生 言 世 尊 菩薩摩訶薩 具 足 幾 法 能 自 他 
T24n1488_002:1044b12	利？」「善男子！具足八法，能自他利。何等為八？一	利 善 男 子 具 足 八 法 能 自 他 利 何 等 為 八 一 
T24n1488_002:1044b13	者、壽命長遠，二者、具上妙色，三者、身具大力，	者 壽 命 長 遠 二 者 具 上 妙 色 三 者 身 具 大 力 
T24n1488_002:1044b14	四者、具好種姓，五者、多饒財寶，六者、具男	四 者 具 好 種 姓 五 者 多 饒 財 寶 六 者 具 男 
T24n1488_002:1044b15	子身，七者、言語辯了，八者、無大眾畏。」善生言：	子 身 七 者 言 語 辯 了 八 者 無 大 眾 畏 善 生 言 
T24n1488_002:1044b16	「世尊！何因緣故菩薩得壽命長，乃至大眾不	 世 尊 何 因 緣 故 菩 薩 得 壽 命 長 乃 至 大 眾 不 
T24n1488_002:1044b17	生怖畏？」佛言：「善男子！菩薩摩訶薩無量世中	生 怖 畏 佛 言 善 男 子 菩薩摩訶薩 無 量 世 中 
T24n1488_002:1044b18	慈心不殺，以是因緣，獲得長壽。無量世中常	慈 心 不 殺 以是因緣 獲 得 長 壽 無 量 世 中 常 
T24n1488_002:1044b19	施衣燈，以是因緣，獲得上色。無量世中常壞	施 衣 燈 以是因緣 獲 得 上 色 無 量 世 中 常 壞 
T24n1488_002:1044b20	憍慢，以是因緣，生上種姓。無量世中常施飲	憍 慢 以是因緣 生 上 種 姓 無 量 世 中 常 施 飲 
T24n1488_002:1044b21	食，以是因緣，身力具足。無量世中常樂說法，	食 以是因緣 身 力 具 足 無 量 世 中 常 樂 說 法 
T24n1488_002:1044b22	以是因緣，多饒財寶。無量世中呵責女身，以是	以是因緣 多 饒 財 寶 無 量 世 中 呵 責 女 身 以 是 
T24n1488_002:1044b23	因緣，得男子身。無量世中至心持戒，以是因	因 緣 得 男 子 身 無 量 世 中 至 心 持 戒 以 是 因 
T24n1488_002:1044b24	緣，言語辯了。無量世中供養三寶，以是因緣，	緣 言 語 辯 了 無 量 世 中 供養三寶 以是因緣 
T24n1488_002:1044b25	無大眾畏。「如是八事，有三因緣：一者、物淨，二	無 大 眾 畏 如 是 八 事 有 三 因 緣 一 者 物 淨 二 
T24n1488_002:1044b26	者、心淨，三者、福田淨。云何物淨？非偷盜物，	者 心 淨 三 者 福 田 淨 云 何 物 淨 非 偷 盜 物 
T24n1488_002:1044b27	非聖遮物，非眾共物，非三寶物，非施一人迴	非 聖 遮 物 非 眾 共 物 非 三 寶 物 非 施 一 人 迴 
T24n1488_002:1044b28	與多人，非施多人迴與一人，不惱他得，不誑	與 多 人 非 施 多 人 迴 與 一 人 不 惱 他 得 不 誑 
T24n1488_002:1044b29	他得，不欺人得，是名物淨。云何心淨？施時不	他 得 不 欺 人 得 是 名 物 淨 云 何 心 淨 施 時 不 
T24n1488_002:1044c01	為生死善果，名稱勝他，得色、力、財，不斷家法，	為 生 死 善 果 名 稱 勝 他 得 色 力 財 不 斷 家 法 
T24n1488_002:1044c02	眷屬多饒；唯為莊嚴菩提故施，為欲調伏眾	眷 屬 多 饒 唯 為 莊 嚴 菩 提 故 施 為 欲 調 伏 眾 
T24n1488_002:1044c03	生故施，是名心淨。云何福田淨？受施之人遠	生 故 施 是 名 心 淨 云 何 福 田 淨 受 施 之 人 遠 
T24n1488_002:1044c04	離八邪，名福田淨。善男子！以如是等三因緣	離 八 邪 名 福 田 淨 善 男 子 以 如 是 等 三 因 緣 
T24n1488_002:1044c05	故，八法具足。「善男子！菩薩所以求於長命，欲	故 八 法 具 足 善 男 子 菩 薩 所 以 求 於 長 命 欲 
T24n1488_002:1044c06	為眾生讚不殺故。菩薩所以求上色者，為令	為 眾 生 讚 不 殺 故 菩 薩 所 以 求 上 色 者 為 令 
T24n1488_002:1044c07	眾生見歡喜故。菩薩所以求上種姓，為令眾	眾 生 見 歡 喜 故 菩 薩 所 以 求 上 種 姓 為 令 眾 
T24n1488_002:1044c08	生生恭敬故。菩薩所以求具足力，為欲持戒、	生 生 恭 敬 故 菩 薩 所 以 求 具 足 力 為 欲 持 戒 
T24n1488_002:1044c09	誦經、坐禪故。菩薩所以求多財寶，為欲調伏	誦 經 坐 禪 故 菩 薩 所 以 求 多 財 寶 為 欲 調 伏 
T24n1488_002:1044c10	諸眾生故。菩薩所以求男子身，為欲成器成	諸 眾 生 故 菩 薩 所 以 求 男 子 身 為 欲 成 器 成 
T24n1488_002:1044c11	善法故。菩薩所以求語辯了，為諸眾生受法	善 法 故 菩 薩 所 以 求 語 辯 了 為 諸 眾 生 受 法 
T24n1488_002:1044c12	語故。菩薩所以求不畏大眾，為欲分別真實	語 故 菩 薩 所 以 求 不 畏 大 眾 為 欲 分 別 真 實 
T24n1488_002:1044c13	法故。「善男子！是故菩薩具足八法能自他利，	法 故 善 男 子 是 故 菩 薩 具 足 八 法 能 自 他 利 
T24n1488_002:1044c14	能如是行，是名實行。善男子！菩薩摩訶薩有	能 如 是 行 是 名 實 行 善 男 子 菩薩摩訶薩 有 
T24n1488_002:1044c15	八法者，具足受持十善之法，樂以化人；具足	八 法 者 具 足 受 持 十 善 之 法 樂 以 化 人 具 足 
T24n1488_002:1044c16	受持優婆塞戒，樂以化人。雖得妙色，終不以	受 持 優婆塞戒 樂 以 化 人 雖 得 妙 色 終 不 以 
T24n1488_002:1044c17	是而生憍慢；雖持淨戒、多聞、精進、大力、好姓、	是 而 生 憍 慢 雖 持 淨 戒 多 聞 精 進 大 力 好 姓 
T24n1488_002:1044c18	多饒財寶，終不以此而生憍慢。不以幻惑	多 饒 財 寶 終 不 以 此 而 生 憍 慢 不 以 幻 惑 
T24n1488_002:1044c19	欺誑眾生，不生放逸，修六和敬。菩薩具足如	欺 誑 眾 生 不 生 放 逸 修 六 和 敬 菩 薩 具 足 如 
T24n1488_002:1044c20	是等法，雖復在家，不異出家。如是菩薩終不	是 等 法 雖 復 在 家 不 異 出 家 如 是 菩 薩 終 不 
T24n1488_002:1044c21	為他作惡因緣，何以故？慚愧堅故。「善男子！	為 他 作 惡 因 緣 何 以 故 慚 愧 堅 故 善 男 子 
T24n1488_002:1044c22	在家之人，設於一世受持如是優婆塞戒，雖	在 家 之 人 設 於 一 世 受 持 如 是 優婆塞戒 雖 
T24n1488_002:1044c23	復後生無三寶處，終不造作諸惡因緣。所以	復 後 生 無 三 寶 處 終 不 造 作 諸 惡 因 緣 所 以 
T24n1488_002:1044c24	者何？二因緣故：一者、智慧，二、不放逸。善男	者 何 二 因 緣 故 一 者 智 慧 二 不 放 逸 善 男 
T24n1488_002:1044c25	子！於後惡處不作惡事，有四因緣：一者、了知	子 於 後 惡 處 不 作 惡 事 有 四 因 緣 一 者 了 知 
T24n1488_002:1044c26	煩惱過故，二者、不隨諸煩惱故，三者、能忍諸	煩 惱 過 故 二 者 不 隨 諸 煩 惱 故 三 者 能 忍 諸 
T24n1488_002:1044c27	惡苦故，四者、不生恐怖心故。菩薩具足如是	惡 苦 故 四 者 不 生 恐 怖 心 故 菩 薩 具 足 如 是 
T24n1488_002:1044c28	四法，不為諸苦一切煩惱之所傾動。善男子！	四 法 不 為 諸 苦 一切煩惱 之 所 傾 動 善 男 子 
T24n1488_002:1044c29	不動菩薩有五因緣：一者、樂修善法，二者、分	不 動 菩 薩 有 五 因 緣 一 者 樂 修 善 法 二 者 分 
T24n1488_002:1045a01	別善惡，三者、親近正法，四者、憐愍眾生，五者、	別 善 惡 三 者 親 近 正 法 四 者 憐 愍 眾 生 五 者 
T24n1488_002:1045a02	常識宿命。「善男子！菩薩具足如是八法，若聞	常 識 宿 命 善 男 子 菩 薩 具 足 如 是 八 法 若 聞 
T24n1488_002:1045a03	譏毀，心能堪忍；若聞讚歎，反生慚愧。修行道	譏 毀 心 能 堪 忍 若 聞 讚 歎 反 生 慚 愧 修 行 道 
T24n1488_002:1045a04	時，歡喜自慶，不生憍慢。能調惡人，見離壞眾，	時 歡 喜 自 慶 不生憍慢 能 調 惡 人 見 離 壞 眾 
T24n1488_002:1045a05	能令和合。揚人善事，隱他過咎，人所慚恥處，	能 令 和 合 揚 人 善 事 隱 他 過 咎 人 所 慚 恥 處 
T24n1488_002:1045a06	終不宣說，聞他祕事，不向餘說。不為世事而	終 不 宣 說 聞 他 祕 事 不 向 餘 說 不 為 世 事 而 
T24n1488_002:1045a07	作呪誓。少恩加己，思欲大報；於己怨者，恒生	作 呪 誓 少 恩 加 己 思 欲 大 報 於 己 怨 者 恒 生 
T24n1488_002:1045a08	善心。怨親等苦，先救怨者。見有罵者，反生憐	善 心 怨 親 等 苦 先 救 怨 者 見 有 罵 者 反 生 憐 
T24n1488_002:1045a09	愍；見他偷時，默然不動；見來打者，生於悲	愍 見 他 偷 時 默 然 不 動 見 來 打 者 生 於 悲 
T24n1488_002:1045a10	心。視諸眾生，猶如父母。寧喪身命，終不虛言。	心 視 諸 眾 生 猶 如 父 母 寧 喪 身 命 終 不 虛 言 
T24n1488_002:1045a11	何以故？知果報故。於諸煩惱應生怨想，於	何 以 故 知 果 報 故 於 諸 煩 惱 應 生 怨 想 於 
T24n1488_002:1045a12	善法中生親舊想。若於外法生於貪心，尋能	善 法 中 生 親 舊 想 若 於 外 法 生 於 貪 心 尋 能 
T24n1488_002:1045a13	觀察貪之過咎，一切煩惱，亦復如是。雖復久	觀 察 貪 之 過 咎 一切煩惱 亦復如是 雖 復 久 
T24n1488_002:1045a14	與惡人同處，終不於中生親善想；雖與善人	與 惡 人 同 處 終 不 於 中 生 親 善 想 雖 與 善 人 
T24n1488_002:1045a15	不同居止，終不於彼而生遠想。雖復供養父	不 同 居 止 終 不 於 彼 而 生 遠 想 雖 復 供 養 父 
T24n1488_002:1045a16	母、師長，終不為是而作惡事。乏財之時，見有	母 師 長 終 不 為 是 而 作 惡 事 乏 財 之 時 見 有 
T24n1488_002:1045a17	求者，不生惡想。雖不親近凶惡之人，而其內	求 者 不 生 惡 想 雖 不 親 近 凶 惡 之 人 而 其 內 
T24n1488_002:1045a18	心常生憐愍，惡來加已，以善報之。自受樂時，	心 常 生 憐 愍 惡 來 加 已 以 善 報 之 自 受 樂 時 
T24n1488_002:1045a19	不輕他人；見他受苦，不生歡喜。身業清淨，持	不 輕 他 人 見 他 受 苦 不 生 歡 喜 身 業 清 淨 持 
T24n1488_002:1045a20	四威儀，即以是法用化眾生。口業清淨，誦讀	四 威 儀 即 以 是 法 用 化 眾 生 口 業 清 淨 誦 讀 
T24n1488_002:1045a21	如來十二部經，即以是法用化眾生。意業清	如 來 十二部經 即 以 是 法 用 化 眾 生 意 業 清 
T24n1488_002:1045a22	淨，修四無量，亦以是法開化眾生。假身受苦，	淨 修 四 無 量 亦 以 是 法 開 化 眾 生 假 身 受 苦 
T24n1488_002:1045a23	令他受樂，甘樂為之。世間之事，雖無利益，為	令 他 受 樂 甘 樂 為 之 世 間 之 事 雖 無 利 益 為 
T24n1488_002:1045a24	眾生故而亦學之，所學之事，世中最勝，雖得	眾 生 故 而 亦 學 之 所 學 之 事 世 中 最 勝 雖 得 
T24n1488_002:1045a25	通達，心無憍慢，以己所知勤用化人，欲令此	通 達 心 無 憍 慢 以 己 所 知 勤 用 化 人 欲 令 此 
T24n1488_002:1045a26	事逕世不絕。於親友中不令作惡，樂以上	事 逕 世 不 絕 於 親 友 中 不 令 作 惡 樂 以 上 
T24n1488_002:1045a27	八法教化眾生。說因說果，無有錯謬。愛別	八 法 教 化 眾 生 說 因 說 果 無 有 錯 謬 愛 別 
T24n1488_002:1045a28	離時，心不生惱，觀無常故。受樂受時，心不耽	離 時 心 不 生 惱 觀 無 常 故 受 樂 受 時 心 不 耽 
T24n1488_002:1045a29	荒，觀苦、無常。善男子！菩薩具足如上八法，則	荒 觀 苦 無 常 善 男 子 菩 薩 具 足 如 上 八 法 則 
T24n1488_002:1045b01	能施作如是等事。「善男子！菩薩二種：一者、在	能 施 作 如 是 等 事 善 男 子 菩 薩 二 種 一 者 在 
T24n1488_002:1045b02	家，二者、出家。出家菩薩修是八法，是不為難；	家 二 者 出 家 出 家 菩 薩 修 是 八 法 是 不 為 難 
T24n1488_002:1045b03	在家修集，是乃為難。何以故？在家菩薩多惡	在 家 修 集 是 乃 為 難 何 以 故 在 家 菩 薩 多 惡 
T24n1488_002:1045b04	因緣所纏繞故。」	因 緣 所 纏 繞 故 
T24n1488_002:1045b05	優婆塞戒經二莊嚴品第十二	優婆塞戒 經 二 莊 嚴 品 第 十 二 
T24n1488_002:1045b06	善生言：「世尊！云何菩薩自他莊嚴。」佛言：「善男	善 生 言 世 尊 云 何 菩 薩 自 他 莊 嚴 佛 言 善 男 
T24n1488_002:1045b07	子！菩薩具足二法，能自他莊嚴：一者、福德，二	子 菩 薩 具 足 二 法 能 自 他 莊 嚴 一 者 福 德 二 
T24n1488_002:1045b08	者、智慧。」「世尊！何因緣故得二莊嚴？」「善男子！菩	者 智 慧 世 尊 何 因 緣 故 得 二 莊 嚴 善 男 子 菩 
T24n1488_002:1045b09	薩修集六波羅蜜，便得如是二種莊嚴。施、戒、	薩 修 集 六波羅蜜 便 得 如是二種 莊 嚴 施 戒 
T24n1488_002:1045b10	精進，名福莊嚴；忍、定、智慧，名智莊嚴。復有六	精 進 名 福 莊 嚴 忍 定 智 慧 名 智 莊 嚴 復 有 六 
T24n1488_002:1045b11	法二莊嚴因，所謂六念：念佛、法、僧，名智莊嚴；	法 二 莊 嚴 因 所 謂 六 念 念 佛 法 僧 名 智 莊 嚴 
T24n1488_002:1045b12	念戒、施、天，名福莊嚴。「善男子！菩薩具足是二	念 戒 施 天 名 福 莊 嚴 善 男 子 菩 薩 具 足 是 二 
T24n1488_002:1045b13	莊嚴，能自他利，為諸眾生受三惡苦，而其內	莊 嚴 能 自 他 利 為 諸 眾 生 受 三 惡 苦 而 其 內 
T24n1488_002:1045b14	心不生憂悔。若能具足是二莊嚴，則得微妙	心 不 生 憂 悔 若 能 具 足 是 二 莊 嚴 則 得 微 妙 
T24n1488_002:1045b15	善巧方便，了知世法及出世法。善男子！福德	善巧方便 了 知 世 法 及 出 世 法 善 男 子 福 德 
T24n1488_002:1045b16	莊嚴即智莊嚴，智慧莊嚴即福莊嚴。何以故？	莊 嚴 即 智 莊 嚴 智慧莊嚴 即 福 莊 嚴 何 以 故 
T24n1488_002:1045b17	夫智慧者，能修善法具足十善，獲得財富及	夫 智 慧 者 能 修 善 法 具 足 十 善 獲 得 財 富 及 
T24n1488_002:1045b18	大自在，得是二故，故能自利及利益他。有智	大 自 在 得 是 二 故 故 能 自 利 及 利 益 他 有 智 
T24n1488_002:1045b19	之人，所學世法，於學中勝，以是因緣，便得財	之 人 所 學 世 法 於 學 中 勝 以是因緣 便 得 財 
T24n1488_002:1045b20	富及大自在。菩薩具足如是二法，則能二	富 及 大 自 在 菩 薩 具 足 如 是 二 法 則 能 二 
T24n1488_002:1045b21	世自他利益。智者若能分別世法及出世法，	世 自 他 利 益 智 者 若 能 分 別 世 法 及 出 世 法 
T24n1488_002:1045b22	世間法者，一切世論、一切世定；出世法者，知	世 間 法 者 一 切 世 論 一 切 世 定 出 世 法 者 知 
T24n1488_002:1045b23	陰、入、界。菩薩知是二法因緣，故能二世自他	陰 入 界 菩 薩 知 是 二 法 因 緣 故 能 二 世 自 他 
T24n1488_002:1045b24	利益。善男子！菩薩雖知世間之樂，虛妄非真，	利 益 善 男 子 菩 薩 雖 知 世 間 之 樂 虛 妄 非 真 
T24n1488_002:1045b25	而亦能造世樂因緣。何以故？為欲利益諸眾	而 亦 能 造 世 樂 因 緣 何 以 故 為 欲 利 益 諸 眾 
T24n1488_002:1045b26	生故。「善男子！是二莊嚴，有一正因：一者、慈	生 故 善 男 子 是 二 莊 嚴 有 一 正 因 一 者 慈 
T24n1488_002:1045b27	心，二者、悲心。修是二因，雖復流轉生死苦海，	心 二 者 悲 心 修 是 二 因 雖 復 流轉生死 苦 海 
T24n1488_002:1045b28	心不生悔。復次，菩薩具足二法而能莊嚴無	心 不 生 悔 復 次 菩 薩 具 足 二 法 而 能 莊 嚴 無 
T24n1488_002:1045b29	上菩提：一者、不樂生死，二者、深觀解脫；是故	上 菩 提 一 者 不 樂 生 死 二 者 深 觀 解 脫 是 故 
T24n1488_002:1045c01	亦能二世利益，了知法相得大智慧，能令自	亦 能 二 世 利 益 了 知 法 相 得 大 智 慧 能 令 自 
T24n1488_002:1045c02	他財命增長。善男子！菩薩摩訶薩具足二	他 財 命 增 長 善 男 子 菩薩摩訶薩 具 足 二 
T24n1488_002:1045c03	法，一切施時不生憂悔，見眾惡事而能堪忍。	法 一 切 施 時 不 生 憂 悔 見 眾 惡 事 而 能 堪 忍 
T24n1488_002:1045c04	菩薩施時，觀二種田：一者、福田，二、貧窮田。菩	菩 薩 施 時 觀 二 種 田 一 者 福 田 二 貧 窮 田 菩 
T24n1488_002:1045c05	薩為欲增福德故，施於貧苦；為增無上妙智	薩 為 欲 增 福 德 故 施 於 貧 苦 為 增 無 上 妙 智 
T24n1488_002:1045c06	慧故，施於福田。為報恩故，施於福田；生憐愍	慧 故 施 於 福 田 為 報 恩 故 施 於 福 田 生 憐 愍 
T24n1488_002:1045c07	故，給施貧窮。捨煩惱故，施於福田；成功德故，	故 給 施 貧 窮 捨 煩 惱 故 施 於 福 田 成 功 德 故 
T24n1488_002:1045c08	施於貧窮。增長一切樂因緣故，施於福田；欲	施 於 貧 窮 增 長 一 切 樂 因 緣 故 施 於 福 田 欲 
T24n1488_002:1045c09	捨一切苦因緣故，施於貧窮。菩薩若施所親	捨 一 切 苦 因 緣 故 施 於 貧 窮 菩 薩 若 施 所 親 
T24n1488_002:1045c10	愛處，為報恩故；若施怨讎，為除惡故。菩薩摩	愛 處 為 報 恩 故 若 施 怨 讎 為 除 惡 故 菩 薩 摩 
T24n1488_002:1045c11	訶薩見來求者，生一子想，是故任力多少施	訶 薩 見 來 求 者 生 一 子 想 是 故 任 力 多 少 施 
T24n1488_002:1045c12	之，是則名為施波羅蜜。菩薩施時，離於慳心，	之 是 則 名 為 施 波 羅 蜜 菩 薩 施 時 離 於 慳 心 
T24n1488_002:1045c13	名尸波羅蜜。能忍一切求者之言，名忍波羅	名 尸 波 羅 蜜 能 忍 一 切 求 者 之 言 名 忍 波 羅 
T24n1488_002:1045c14	蜜。所施之物，手自授與，名精進波羅蜜。至心	蜜 所 施 之 物 手 自 授 與 名 精進波羅蜜 至 心 
T24n1488_002:1045c15	繫念，觀於解脫，名禪波羅蜜。不擇一切怨親	繫 念 觀 於 解 脫 名 禪 波 羅 蜜 不 擇 一 切 怨 親 
T24n1488_002:1045c16	之相，名般若波羅蜜。善男子！如諸眾生，貪	之 相 名 般 若 波 羅 蜜 善 男 子 如 諸 眾 生 貪 
T24n1488_002:1045c17	心殺時，一念具足十二因緣。菩薩施時，亦復	心 殺 時 一 念 具 足 十二因緣 菩 薩 施 時 亦 復 
T24n1488_002:1045c18	如是，一念具足如是六事。是名功德智慧莊	如 是 一 念 具 足 如 是 六 事 是 名 功 德 智 慧 莊 
T24n1488_002:1045c19	嚴。「復次，善男子！菩薩摩訶薩造作不共法之	嚴 復 次 善 男 子 菩薩摩訶薩 造 作 不 共 法 之 
T24n1488_002:1045c20	因緣，名福莊嚴；教化眾生悉令獲得三種菩	因 緣 名 福 莊 嚴 教 化 眾 生 悉 令 獲 得 三 種 菩 
T24n1488_002:1045c21	提，名智莊嚴。復次，善男子！菩薩若能調伏眾	提 名 智 莊 嚴 復 次 善 男 子 菩 薩 若 能 調 伏 眾 
T24n1488_002:1045c22	生，名智莊嚴；同於眾生受諸苦惱，名福莊嚴。	生 名 智 莊 嚴 同 於 眾 生 受諸苦惱 名 福 莊 嚴 
T24n1488_002:1045c23	菩薩能令一切眾生離於惡見，名智莊嚴；能	菩 薩 能 令 一 切 眾 生 離 於 惡 見 名 智 莊 嚴 能 
T24n1488_002:1045c24	教眾生住信、施、戒、多聞、智慧，名福莊嚴。「復次，	教 眾 生 住 信 施 戒 多 聞 智 慧 名 福 莊 嚴 復 次 
T24n1488_002:1045c25	善男子！菩薩摩訶薩具足五法，則能莊嚴無	善 男 子 菩薩摩訶薩 具 足 五 法 則 能 莊 嚴 無 
T24n1488_002:1045c26	上菩提。何等為五？一者、信心，二者、悲心，三者、	上 菩 提 何 等 為 五 一 者 信 心 二 者 悲 心 三 者 
T24n1488_002:1045c27	勇健，四者、讀誦世論不生疲厭，五者、學諸世	勇 健 四 者 讀 誦 世 論 不 生 疲 厭 五 者 學 諸 世 
T24n1488_002:1045c28	業亦不厭之。「善男子！菩薩具足二種莊嚴，則	業 亦 不 厭 之 善 男 子 菩 薩 具 足 二 種 莊 嚴 則 
T24n1488_002:1045c29	有七相。何等為七？一者、自知罪過，二者、不	有 七 相 何 等 為 七 一 者 自 知 罪 過 二 者 不 
T24n1488_002:1046a01	說他過，三者、樂瞻病人，四者、樂施貧人，五者、	說 他 過 三 者 樂 瞻 病 人 四 者 樂 施 貧 人 五 者 
T24n1488_002:1046a02	獲菩提心，六者、心不放逸，七者、一切時中常	獲 菩 提 心 六 者 心 不 放 逸 七 者 一 切 時 中 常 
T24n1488_002:1046a03	至心修六波羅蜜。善男子！復有七相。何等	至 心 修 六波羅蜜 善 男 子 復 有 七 相 何 等 
T24n1488_002:1046a04	為七？一者、樂化怨讎；二者、化時不厭；三者、要	為 七 一 者 樂 化 怨 讎 二 者 化 時 不 厭 三 者 要 
T24n1488_002:1046a05	令成熟解脫；四者、盡己所知世語、世事，以化	令 成熟解脫 四 者 盡 己 所 知 世 語 世 事 以 化 
T24n1488_002:1046a06	眾生心不貪著；五者、能忍一切惡事；六者、終	眾 生 心 不 貪 著 五 者 能 忍 一 切 惡 事 六 者 終 
T24n1488_002:1046a07	不宣說他人所不喜事；七者、見破戒者及弊	不 宣 說 他 人 所 不 喜 事 七 者 見 破 戒 者 及 弊 
T24n1488_002:1046a08	惡人，心不瞋恚，常生憐愍。善男子！菩薩摩訶	惡 人 心 不 瞋 恚 常 生 憐 愍 善 男 子 菩 薩 摩 訶 
T24n1488_002:1046a09	薩知是七相，則能自利及利益他。「善男子！菩	薩 知 是 七 相 則 能 自 利 及 利 益 他 善 男 子 菩 
T24n1488_002:1046a10	薩二種：一者、在家，二者、出家。出家菩薩為二	薩 二 種 一 者 在 家 二 者 出 家 出 家 菩 薩 為 二 
T24n1488_002:1046a11	莊嚴，是不為難；在家修集，是乃為難。何以	莊 嚴 是 不 為 難 在 家 修 集 是 乃 為 難 何 以 
T24n1488_002:1046a12	故？在家多有諸惡因緣所纏繞故。」	故 在 家 多 有 諸 惡 因 緣 所 纏 繞 故 
T24n1488_002:1046a13	優婆塞戒經卷第二	優婆塞戒 經 卷 第 二 
T24n1488_003:1046a16	優婆塞戒經卷第三	優婆塞戒 經 卷 第 三 
T24n1488_003:1046a18	北涼中印度三藏曇無讖譯	北 涼 中 印 度 三 藏 曇 無 讖 譯 
T24n1488_003:1046a19	攝取品第十三	攝 取 品 第 十 三 
T24n1488_003:1046a20	善生言：「世尊！菩薩具足二莊嚴已，云何得畜	善 生 言 世 尊 菩 薩 具 足 二 莊 嚴 已 云 何 得 畜 
T24n1488_003:1046a21	徒眾弟子？」「善男子！應以四攝而攝取之，令離	徒 眾 弟 子 善 男 子 應 以 四 攝 而 攝 取 之 令 離 
T24n1488_003:1046a22	諸惡，增諸善法，至心教詔，猶如一子。不求恩	諸 惡 增 諸 善 法 至 心 教 詔 猶 如 一 子 不 求 恩 
T24n1488_003:1046a23	報，不為名稱，不為利養，不求自樂。善男子！	報 不 為 名 稱 不 為 利 養 不 求 自 樂 善 男 子 
T24n1488_003:1046a24	菩薩若無如是等事畜弟子者，名弊惡人，假	菩 薩 若 無 如 是 等 事 畜 弟 子 者 名 弊 惡 人 假 
T24n1488_003:1046a25	名菩薩，非義菩薩；名旃陀羅，臭穢不淨，破壞	名 菩 薩 非 義 菩 薩 名 旃 陀 羅 臭 穢 不 淨 破 壞 
T24n1488_003:1046a26	佛法，是人不為十方諸佛之所憐念。「善男子！	佛 法 是 人 不 為 十方諸佛 之 所 憐 念 善 男 子 
T24n1488_003:1046a27	菩薩若能隨時教戒，所言時者，貪、恚、癡時。起	菩 薩 若 能 隨 時 教 戒 所 言 時 者 貪 恚 癡 時 起 
