T24n1459_002:0645b03	　若九人十人，　　是大眾差遣；	 若 九 人 十 人 是 大 眾 差 遣 
T24n1459_002:0645b04	　此差五或過，　　名為差重差。	 此 差 五 或 過 名 為 差 重 差 
T24n1459_002:0645b05	　凡差重差人，　　正直明三篋；	 凡 差 重 差 人 正 直 明 三 篋 
T24n1459_002:0645b06	　上座不朋一，　　能為滅諍人。	 上 座 不 朋 一 能 為 滅 諍 人 
T24n1459_002:0645b07	　若無其五德，　　設已差應退；	 若 無 其 五 德 設 已 差 應 退 
T24n1459_002:0645b08	　具德者應差，　　令作行籌者。	 具 德 者 應 差 令 作 行 籌 者 
T24n1459_002:0645b09	　彼可作二籌，　　顯法及非法：	 彼 可 作 二 籌 顯 法 及 非 法 
T24n1459_002:0645b10	　法籌應可直，　　香滑稱人心；	 法 籌 應 可 直 香 滑 稱 人 心 
T24n1459_002:0645b11	　非法籌須曲，　　臭澁情不樂；	 非 法 籌 須 曲 臭 澁 情 不 樂 
T24n1459_002:0645b12	　左手蓋而行，　　法籌應顯露。	 左 手 蓋 而 行 法 籌 應 顯 露 
T24n1459_002:0645b13	　僧伽應總集，　　從初次第行；	 僧 伽 應 總 集 從 初 次 第 行 
T24n1459_002:0645b14	　先呈其法籌，　　三語慇懃與。	 先 呈 其 法 籌 三 語 慇 懃 與 
T24n1459_002:0645b15	　如其取法籌，　　數多於非法；	 如 其 取 法 籌 數 多 於 非 法 
T24n1459_002:0645b16	　是名為法滅，　　諍息理應知。	 是 名 為 法 滅 諍 息 理 應 知 
T24n1459_002:0645b17	　苾芻毀破時，　　便招其墮罪；	 苾 芻 毀 破 時 便 招 其 墮 罪 
T24n1459_002:0645b18	　非法籌多此，　　名非法滅諍。	 非 法 籌 多 此 名 非 法 滅 諍 
T24n1459_002:0645b19	　諍雖非法滅，　　毀破得小愆；	 諍 雖 非 法 滅 毀 破 得 小 愆 
T24n1459_002:0645b20	　斯乃是多人，　　毘奈耶滅諍。	 斯 乃 是 多 人 毘 奈 耶 滅 諍 
T24n1459_002:0645b21	　已說評論諍，　　二法可應除；	 已 說 評 論 諍 二 法 可 應 除 
T24n1459_002:0645b22	　子細述其緣，　　具如廣文說。	 子 細 述 其 緣 具 如 廣 文 說 
T24n1459_002:0645b23	　次明非言諍，　　以其三法滅；	 次 明 非 言 諍 以 其 三 法 滅 
T24n1459_002:0645b24	　謂將可惡法，　　詰他清淨人。	 謂 將 可 惡 法 詰 他 清 淨 人 
T24n1459_002:0645b25	　謂是現前事，　　憶念及不癡；	 謂 是 現 前 事 憶 念 及 不 癡 
T24n1459_002:0645b26	　現前如上陳，　　餘二今應辯。	 現 前 如 上 陳 餘 二 今 應 辯 
T24n1459_002:0645b27	　應知念調伏，　　如友苾芻尼；	 應 知 念 調 伏 如 友 苾 芻 尼 
T24n1459_002:0645b28	　謗毀實力子，　　大師因此制。	 謗 毀 實 力 子 大 師 因 此 制 
T24n1459_002:0645b29	　應與實力子，　　作憶念調伏；	 應 與 實 力 子 作 憶 念 調 伏 
T24n1459_002:0645c01	　令在上座前，　　如是言應說：	 令 在 上 座 前 如 是 言 應 說 
T24n1459_002:0645c02	　大德僧伽聽！　　被他妄說我；	 大 德 僧 伽 聽 被 他 妄 說 我 
T24n1459_002:0645c03	　我乞憶念法，　　僧伽應愍聽。	 我 乞 憶 念 法 僧 伽 應 愍 聽 
T24n1459_002:0645c04	　如斯三請已，　　應令一苾芻；	 如 斯 三 請 已 應 令 一 苾 芻 
T24n1459_002:0645c05	　秉法為彼人，　　作憶念羯磨。	 秉 法 為 彼 人 作 憶 念 羯 磨 
T24n1459_002:0645c06	　次作不癡法，　　如惡羯苾芻；	 次 作 不 癡 法 如 惡 羯 苾 芻 
T24n1459_002:0645c07	　由彼先癲狂，　　今秉不癡事。	 由 彼 先 癲 狂 今 秉 不 癡 事 
T24n1459_002:0645c08	　致在上座前，　　白言我昔日；	 致 在 上 座 前 白 言 我 昔 日 
T24n1459_002:0645c09	　被狂亂所惱，　　為非不覺知。	 被 狂 亂 所 惱 為 非 不 覺 知 
T24n1459_002:0645c10	　他便數數詰，　　云我為惡行；	 他 便 數 數 詰 云 我 為 惡 行 
T24n1459_002:0645c11	　我今乞不癡，　　毘奈耶應與。	 我 今 乞 不 癡 毘 奈 耶 應 與 
T24n1459_002:0645c12	　所言犯罪諍，　　由四法能除；	 所 言 犯 罪 諍 由 四 法 能 除 
T24n1459_002:0645c13	　自言及現前，　　草掩求其性。	 自 言 及 現 前 草 掩 求 其 性 
T24n1459_002:0645c14	　既作於罪已，　　或詰或不詰；	 既 作 於 罪 已 或 詰 或 不 詰 
T24n1459_002:0645c15	　當在苾芻前，　　合掌除其罪。	 當 在 苾 芻 前 合 掌 除 其 罪 
T24n1459_002:0645c16	　言大德存念！　　我今犯斯罪。	 言 大 德 存 念 我 今 犯 斯 罪 
T24n1459_002:0645c17	　問言見罪不？　　報言我今見。	 問 言 見 罪 不 報 言 我 今 見 
T24n1459_002:0645c18	　於後不犯不？　　報言我不犯。	 於 後 不 犯 不 報 言 我 不 犯 
T24n1459_002:0645c19	　彼說奧箄迦，　　此答言娑度。	 彼 說 奧 箄 迦 此 答 言 娑 度 
T24n1459_002:0645c20	　犯他勝等罪，　　對眾而自陳；	 犯 他 勝 等 罪 對 眾 而 自 陳 
T24n1459_002:0645c21	　此並是自言，　　能令諍消殄。	 此 並 是 自 言 能 令 諍 消 殄 
T24n1459_002:0645c22	　如哥羅苾芻，　　被他言所及；	 如 哥 羅 苾 芻 被 他 言 所 及 
T24n1459_002:0645c23	　由衣招詰責，　　行向釋迦城。	 由 衣 招 詰 責 行 向 釋 迦 城 
T24n1459_002:0645c24	　現前能滅諍，　　名為現前法；	 現 前 能 滅 諍 名 為 現 前 法 
T24n1459_002:0645c25	　此亦是現前，　　重更言其軌。	 此 亦 是 現 前 重 更 言 其 軌 
T24n1459_002:0645c26	　今說草掩法，　　更相鬪諍人；	 今 說 草 掩 法 更 相 鬪 諍 人 
T24n1459_002:0645c27	　上座應就之，　　正理當教示：	 上 座 應 就 之 正 理 當 教 示 
T24n1459_002:0645c28	　報言法難逢，　　何為作二黨？	 報 言 法 難 逢 何 為 作 二 黨 
T24n1459_002:0645c29	　無事為諍競，　　輕慢大師言。	 無 事 為 諍 競 輕 慢 大 師 言 
T24n1459_002:0646a01	　言作如是事，　　我汝咸有犯；	 言 作 如 是 事 我 汝 咸 有 犯 
T24n1459_002:0646a02	　陳其後邊罪，　　應可願蠲除。	 陳 其 後 邊 罪 應 可 願 蠲 除 
T24n1459_002:0646a03	　作斯言告時，　　如其不違逆；	 作 斯 言 告 時 如 其 不 違 逆 
T24n1459_002:0646a04	　是名住本性，　　此朋應亦然。	 是 名 住 本 性 此 朋 應 亦 然 
T24n1459_002:0646a05	　彼朋意靜息，　　不為違戾言；	 彼 朋 意 靜 息 不 為 違 戾 言 
T24n1459_002:0646a06	　因此諍能除，　　名為草掩息。	 因 此 諍 能 除 名 為 草 掩 息 
T24n1459_002:0646a07	　自言犯斯罪，　　對眾便言無；	 自 言 犯 斯 罪 對 眾 便 言 無 
T24n1459_002:0646a08	　猶如手苾芻，　　說有言非有。	 猶 如 手 苾 芻 說 有 言 非 有 
T24n1459_002:0646a09	　與作求罪性，　　苾芻令彼臣；	 與 作 求 罪 性 苾 芻 令 彼 臣 
T24n1459_002:0646a10	　大聖誨親言，　　良由具悲性。	 大 聖 誨 親 言 良 由 具 悲 性 
T24n1459_002:0646a11	　彼亦上座前，　　應可從眾乞；	 彼 亦 上 座 前 應 可 從 眾 乞 
T24n1459_002:0646a12	　大眾宜於此，　　作法並同前。	 大 眾 宜 於 此 作 法 並 同 前 
T24n1459_002:0646a13	　欲殄作事諍，　　應須眾咸集；	 欲 殄 作 事 諍 應 須 眾 咸 集 
T24n1459_002:0646a14	　如不作違拒，　　是諍息應知。◎	 如 不 作 違 拒 是 諍 息 應 知 
T24n1459_002:0646a15	已上兩卷明波羅底木叉戒本了。次下一卷	已 上 兩 卷 明 波 羅 底 木 叉 戒 本 了 次 下 一 卷 
T24n1459_002:0646a16	明跋窣覩等事。	明 跋 窣 覩 等 事 
T24n1459_002:0646a17	根本說一切有部毘奈耶頌卷中	根 本 說 一 切 有 部 毘 奈 耶 頌 卷 中 
T24n1459_003:0646a20	根本說一切有部毘奈耶頌卷下	根 本 說 一 切 有 部 毘 奈 耶 頌 卷 下 
T24n1459_003:0646a22	尊者毘舍佉造	尊 者 毘 舍 佉 造 
T24n1459_003:0646a23	三藏法師義淨奉　制譯	三藏法師 義 淨 奉 制 譯 
T24n1459_003:0646a24	◎下明於十七跋窣覩等，中述其要事	 下 明 於 十 七 跋 窣 覩 等 中 述 其 要 事 
T24n1459_003:0646a25	(跋窣覩是事)。	 跋 窣 覩 是 事 
T24n1459_003:0646a26	　若是旃荼羅，　　唱令及酒舍；	 若 是 旃 荼 羅 唱 令 及 酒 舍 
T24n1459_003:0646a27	　婬女王宮處，　　此五非行境。	 婬 女 王 宮 處 此 五 非 行 境 
T24n1459_003:0646a28	　外道諸典籍，　　習讀將為勝；	 外 道 諸 典 籍 習 讀 將 為 勝 
T24n1459_003:0646a29	　及數犯罪人，　　所食皆成毒。	 及 數 犯 罪 人 所 食 皆 成 毒 
T24n1459_003:0646b01	　常應讀佛教，　　是惡道良醫；	 常 應 讀 佛 教 是 惡 道 良 醫 
T24n1459_003:0646b02	　開許讀外書，　　為欲知其過。	 開 許 讀 外 書 為 欲 知 其 過 
T24n1459_003:0646b03	　一切智言說，　　美妙多譬喻；	 一 切 智 言 說 美 妙 多 譬 喻 
T24n1459_003:0646b04	　豈如外道論，　　無理言麁淺。	 豈 如 外 道 論 無 理 言 麁 淺 
T24n1459_003:0646b05	　多畜諸器具，　　彫飾皆不許；	 多 畜 諸 器 具 彫 飾 皆 不 許 
T24n1459_003:0646b06	　若畫坐床足，　　斯皆外道儀。	 若 畫 坐 床 足 斯 皆 外 道 儀 
T24n1459_003:0646b07	　苾芻身老病，　　若乘輿隨聽；	 苾 芻 身 老 病 若 乘 輿 隨 聽 
T24n1459_003:0646b08	　杖絡及皮衣，　　斯皆在開限。	 杖 絡 及 皮 衣 斯 皆 在 開 限 
T24n1459_003:0646b09	　無由帝釋請，　　遂開於浴室；	 無 由 帝 釋 請 遂 開 於 浴 室 
T24n1459_003:0646b10	　并勤定誦人，　　咸聽小食飯。	 并 勤 定 誦 人 咸 聽 小 食 飯 
T24n1459_003:0646b11	　不注於眼口，　　亦不香薰衣；	 不 注 於 眼 口 亦 不 香 薰 衣 
T24n1459_003:0646b12	　不畫傘皮鞋，　　揩爪令光淨。	 不 畫 傘 皮 鞋 揩 爪 令 光 淨 
T24n1459_003:0646b13	　傘蓋有二種，　　葉作葦竹成；	 傘 蓋 有 二 種 葉 作 葦 竹 成 
T24n1459_003:0646b14	　若至村中時，　　不應正持入。	 若 至 村 中 時 不 應 正 持 入 
T24n1459_003:0646b15	　若作於傘柄，　　應與傘蓋同；	 若 作 於 傘 柄 應 與 傘 蓋 同 
T24n1459_003:0646b16	　欠呿開口時，　　應將衣手掩。	 欠 呿 開 口 時 應 將 衣 手 掩 
T24n1459_003:0646b17	　有緣須笑時，　　不得露齗齒；	 有 緣 須 笑 時 不 得 露 齗 齒 
T24n1459_003:0646b18	　讚詠大師德，　　說法時非過。	 讚 詠 大 師 德 說 法 時 非 過 
T24n1459_003:0646b19	　不得長作聲，　　宣唱牟尼典；	 不 得 長 作 聲 宣 唱 牟 尼 典 
T24n1459_003:0646b20	　讀誦宜依法，　　隨處勿相違。	 讀 誦 宜 依 法 隨 處 勿 相 違 
T24n1459_003:0646b21	　若學讚德聲，　　應在於屏處；	 若 學 讚 德 聲 應 在 於 屏 處 
T24n1459_003:0646b22	　為宣揚正法，　　不應生染心。	 為 宣 揚 正 法 不 應 生 染 心 
T24n1459_003:0646b23	　苾芻及尼等，　　五眾許安居；	 苾 芻 及 尼 等 五 眾 許 安 居 
T24n1459_003:0646b24	　若至夏罷時，　　五眾集隨意。	 若 至 夏 罷 時 五 眾 集 隨 意 
T24n1459_003:0646b25	　苾芻苾芻尼，　　一切戒須學；	 苾 芻 苾 芻 尼 一 切 戒 須 學 
T24n1459_003:0646b26	　求寂求寂女，　　受十戒應知。	 求 寂 求 寂 女 受 十 戒 應 知 
T24n1459_003:0646b27	　不獨在道行，　　亦不獨渡水；	 不 獨 在 道 行 亦 不 獨 渡 水 
T24n1459_003:0646b28	　不故觸男子，　　不與男同宿；	 不 故 觸 男 子 不 與 男 同 宿 
T24n1459_003:0646b29	　不為媒嫁事，　　不覆藏他罪；	 不 為 媒 嫁 事 不 覆 藏 他 罪 
T24n1459_003:0646c01	　是名為六法，　　正學女應知。	 是 名 為 六 法 正 學 女 應 知 
T24n1459_003:0646c02	　金銀不應捉，　　不除隱處毛；	 金 銀 不 應 捉 不 除 隱 處 毛 
T24n1459_003:0646c03	　亦不掘生地，　　不斷於青草；	 亦 不 掘 生 地 不 斷 於 青 草 
T24n1459_003:0646c04	　不得不受食，　　及以殘宿食；	 不 得 不 受 食 及 以 殘 宿 食 
T24n1459_003:0646c05	　是名為六隨，　　學之經兩歲。	 是 名 為 六 隨 學 之 經 兩 歲 
T24n1459_003:0646c06	　上座於日數，　　分明須憶知；	 上 座 於 日 數 分 明 須 憶 知 
T24n1459_003:0646c07	　授事在眾前，　　日日當陳告。	 授 事 在 眾 前 日 日 當 陳 告 
T24n1459_003:0646c08	　可於六時中，　　月半減一日；	 可 於 六 時 中 月 半 減 一 日 
T24n1459_003:0646c09	　減日成其月，　　至六成一閏。	 減 日 成 其 月 至 六 成 一 閏 
T24n1459_003:0646c10	　如其王作閏，　　月數有參差；	 如 其 王 作 閏 月 數 有 參 差 
T24n1459_003:0646c11	　苾芻應可隨，　　由王有勢力。	 苾 芻 應 可 隨 由 王 有 勢 力 
T24n1459_003:0646c12	　洗手洗鉢處，　　若作曼荼羅；	 洗 手 洗 鉢 處 若 作 曼 荼 羅 
T24n1459_003:0646c13	　不似日月形，　　及似塔形勢。	 不 似 日 月 形 及 似 塔 形 勢 
T24n1459_003:0646c14	　苾芻涉路去，　　若過神廟堂；	 苾 芻 涉 路 去 若 過 神 廟 堂 
T24n1459_003:0646c15	　入彈指作聲，　　伽他說佛語。	 入 彈 指 作 聲 伽 他 說 佛 語 
T24n1459_003:0646c16	　若至神廟所，　　不應為損益；	 若 至 神 廟 所 不 應 為 損 益 
T24n1459_003:0646c17	　苾芻若違教，　　便招惡作罪。	 苾 芻 若 違 教 便 招 惡 作 罪 
T24n1459_003:0646c18	　苾芻等五眾，　　不供養天神；	 苾 芻 等 五 眾 不 供 養 天 神 
T24n1459_003:0646c19	　自作若使人，　　亦得惡作罪。	 自 作 若 使 人 亦 得 惡 作 罪 
T24n1459_003:0646c20	　若有餘因緣，　　許香花祭食；	 若 有 餘 因 緣 許 香 花 祭 食 
T24n1459_003:0646c21	　不得違時俗，　　損益不應為。	 不 得 違 時 俗 損 益 不 應 為 
T24n1459_003:0646c22	　事佛之善神，　　隨情應供養；	 事 佛 之 善 神 隨 情 應 供 養 
T24n1459_003:0646c23	　於諸大經內，　　遣作皆無犯。	 於 諸 大 經 內 遣 作 皆 無 犯 
T24n1459_003:0646c24	　於諸有情類，　　常擁護行慈；	 於諸有情 類 常 擁 護 行 慈 
T24n1459_003:0646c25	　由有慈悲種，　　不生於苦趣。	 由 有 慈 悲 種 不 生 於 苦 趣 
T24n1459_003:0646c26	　愛敬天神者，　　常好為供養；	 愛 敬 天 神 者 常 好 為 供 養 
T24n1459_003:0646c27	　世間皆共然，　　由貪生死樂。	 世 間 皆 共 然 由 貪 生 死 樂 
T24n1459_003:0646c28	　皆求世間果，　　由是祭邪神；	 皆 求 世 間 果 由 是 祭 邪 神 
T24n1459_003:0646c29	　惱害殺眾生，　　引他歸惡趣。	 惱 害 殺 眾 生 引 他 歸 惡 趣 
T24n1459_003:0647a01	　先已歸依佛，　　轉更事天神；	 先 已 歸 依 佛 轉 更 事 天 神 
T24n1459_003:0647a02	　供養獲果少，　　不知尊敬處。	 供 養 獲 果 少 不 知 尊 敬 處 
T24n1459_003:0647a03	　破戒著袈裟，　　欺弄苾芻像；	 破 戒 著 袈 裟 欺 弄 苾 芻 像 
T24n1459_003:0647a04	　無慚噉人食，　　事同剛火炭。	 無 慚 噉 人 食 事 同 剛 火 炭 
T24n1459_003:0647a05	　應寫律教等，　　流布能生福；	 應 寫 律 教 等 流 布 能 生 福 
T24n1459_003:0647a06	　忘念者令憶，　　自身兼讀持。	 忘 念 者 令 憶 自 身 兼 讀 持 
T24n1459_003:0647a07	　苾芻入浴室，　　須揩身體時；	 苾 芻 入 浴 室 須 揩 身 體 時 
T24n1459_003:0647a08	　應令敬信人，　　勿使不信者。	 應 令 敬 信 人 勿 使 不 信 者 
T24n1459_003:0647a09	　諸有持戒人，　　不供破戒者；	 諸 有 持 戒 人 不 供 破 戒 者 
T24n1459_003:0647a10	　不可令師子，　　承事於野干。	 不 可 令 師 子 承 事 於 野 干 
T24n1459_003:0647a11	　此是佛法刺，　　正教中死屍；	 此 是 佛 法 刺 正 教 中 死 屍 
T24n1459_003:0647a12	　共住及隨行，　　皆成不應法。	 共 住 及 隨 行 皆 成 不 應 法 
T24n1459_003:0647a13	　親教軌範師，　　及父母有病；	 親 教 軌 範 師 及 父 母 有 病 
T24n1459_003:0647a14	　假令是破戒，　　悉可為供給。	 假 令 是 破 戒 悉 可 為 供 給 
T24n1459_003:0647a15	　父母老貧病，　　乞食半相供；	 父 母 老 貧 病 乞 食 半 相 供 
T24n1459_003:0647a16	　由斯有大恩，　　是故應瞻養。	 由 斯 有 大 恩 是 故 應 瞻 養 
T24n1459_003:0647a17	　見有闕乏處，　　隨事皆供給；	 見 有 闕 乏 處 隨 事 皆 供 給 
T24n1459_003:0647a18	　乃至塗足油，　　洗沐令身淨。	 乃 至 塗 足 油 洗 沐 令 身 淨 
T24n1459_003:0647a19	　苾芻若用甎，　　唯得揩踝足；	 苾 芻 若 用 甎 唯 得 揩 踝 足 
T24n1459_003:0647a20	　餘身分不許，　　若為病皆聽。	 餘 身 分 不 許 若 為 病 皆 聽 
T24n1459_003:0647a21	　不三畫插梳，　　及帶於呪線；	 不 三 畫 插 梳 及 帶 於 呪 線 
T24n1459_003:0647a22	　應繫於左臂，　　為治病開聽。	 應 繫 於 左 臂 為 治 病 開 聽 
T24n1459_003:0647a23	　如其病除愈，　　應安柱孔中；	 如 其 病 除 愈 應 安 柱 孔 中 
T24n1459_003:0647a24	　醫人若遣為，　　香塗身不犯。	 醫 人 若 遣 為 香 塗 身 不 犯 
T24n1459_003:0647a25	　若以香塗身，　　不應出房外；	 若 以 香 塗 身 不 應 出 房 外 
T24n1459_003:0647a26	　勿令他嫌慢，　　增其不信心。	 勿 令 他 嫌 慢 增 其 不 信 心 
T24n1459_003:0647a27	　若有淨信者，　　為福施香泥；	 若 有 淨 信 者 為 福 施 香 泥 
T24n1459_003:0647a28	　應塗戶扇邊，　　嗅之能益眼。	 應 塗 戶 扇 邊 嗅 之 能 益 眼 
T24n1459_003:0647a29	　淨信以香泥，　　塗摩苾芻足；	 淨 信 以 香 泥 塗 摩 苾 芻 足 
T24n1459_003:0647b01	　為福宜應受，　　去時當洗除。	 為 福 宜 應 受 去 時 當 洗 除 
T24n1459_003:0647b02	　必有妙香花，　　苾芻欲得嗅；	 必 有 妙 香 花 苾 芻 欲 得 嗅 
T24n1459_003:0647b03	　意欲令明眼，　　不應生愛心。	 意 欲 令 明 眼 不 應 生 愛 心 
T24n1459_003:0647b04	　聽持鐵鑰匙，　　為防衣藥故；	 聽 持 鐵 鑰 匙 為 防 衣 藥 故 
T24n1459_003:0647b05	　勿興煩惱意，　　輒捉打眾生。	 勿 興 煩 惱 意 輒 捉 打 眾 生 
T24n1459_003:0647b06	　大眾及別人，　　持印皆聽許；	 大 眾 及 別 人 持 印 皆 聽 許 
T24n1459_003:0647b07	　銅鐵木礦石，　　甎錫等應為。	 銅 鐵 木 礦 石 甎 錫 等 應 為 
T24n1459_003:0647b08	　別人髑髏像，　　或刻為白骨；	 別 人 髑 髏 像 或 刻 為 白 骨 
T24n1459_003:0647b09	　大眾法輪形，　　此是作印相。	 大 眾 法 輪 形 此 是 作 印 相 
T24n1459_003:0647b10	　凡食小香果，　　皆須待核成；	 凡 食 小 香 果 皆 須 待 核 成 
T24n1459_003:0647b11	　欲令其福增，　　僧伽果須熟。	 欲 令 其 福 增 僧 伽 果 須 熟 
T24n1459_003:0647b12	　不應臨水鏡，　　愛心觀面像；	 不 應 臨 水 鏡 愛 心 觀 面 像 
T24n1459_003:0647b13	　為病念無常，　　照時無有過。	 為 病 念 無 常 照 時 無 有 過 
T24n1459_003:0647b14	　不自斷生支，　　亦不甎石打；	 不 自 斷 生 支 亦 不 甎 石 打 
T24n1459_003:0647b15	　宜將不淨觀，　　洗除婬染心。	 宜 將 不 淨 觀 洗 除 婬 染 心 
T24n1459_003:0647b16	　洗足盆內高，　　其形如象跡；	 洗 足 盆 內 高 其 形 如 象 跡 
T24n1459_003:0647b17	　竹及多羅葉，　　二種扇應持。	 竹 及 多 羅 葉 二 種 扇 應 持 
T24n1459_003:0647b18	　若欲除蚊子，　　五種拂隨聽；	 若 欲 除 蚊 子 五 種 拂 隨 聽 
T24n1459_003:0647b19	　枝梢劫貝[卄/毦]，　　麻毛并破帛。	 枝 梢 劫 貝 [卄毦] 麻 毛 并 破 帛 
T24n1459_003:0647b20	　若須上高梯，　　應結裙下緣；	 若 須 上 高 梯 應 結 裙 下 緣 
T24n1459_003:0647b21	　苾芻不擎重，　　應覓俗人持。	 苾 芻 不 擎 重 應 覓 俗 人 持 
T24n1459_003:0647b22	　苾芻之儀式，　　皆與俗不同；	 苾 芻 之 儀 式 皆 與 俗 不 同 
T24n1459_003:0647b23	　用梳等搔頭，　　是事咸不可。	 用 梳 等 搔 頭 是 事 咸 不 可 
T24n1459_003:0647b24	　若髮有塵垢，　　頭癢手揩摩；	 若 髮 有 塵 垢 頭 癢 手 揩 摩 
T24n1459_003:0647b25	　或時將故衣，　　此等皆無犯。	 或 時 將 故 衣 此 等 皆 無 犯 
T24n1459_003:0647b26	　寺後西北隅，　　安置大便室；	 寺 後 西 北 隅 安 置 大 便 室 
T24n1459_003:0647b27	　及以小行室，　　皆須店門扇。	 及 以 小 行 室 皆 須 店 門 扇 
T24n1459_003:0647b28	　西北角下房，　　安大眾瓶水；	 西 北 角 下 房 安 大 眾 瓶 水 
T24n1459_003:0647b29	　此據門南向，　　餘面准應知。	 此 據 門 南 向 餘 面 准 應 知 
T24n1459_003:0647c01	　若見諸俗人，　　及老苾芻啑；	 若 見 諸 俗 人 及 老 苾 芻 啑 
T24n1459_003:0647c02	　應云久長壽，　　不言便得罪。	 應 云 久 長 壽 不 言 便 得 罪 
T24n1459_003:0647c03	　大者見小啑，　　應告言無病；	 大 者 見 小 啑 應 告 言 無 病 
T24n1459_003:0647c04	　小者於尊年，　　即須云敬禮。	 小 者 於 尊 年 即 須 云 敬 禮 
T24n1459_003:0647c05	　凡是噉食時，　　及便利未洗；	 凡 是 噉 食 時 及 便 利 未 洗 
T24n1459_003:0647c06	　或一衣在道，　　或立穢鬧處；	 或 一 衣 在 道 或 立 穢 鬧 處 
T24n1459_003:0647c07	　或復食雖了，　　口猶未澡漱；	 或 復 食 雖 了 口 猶 未 澡 漱 
T24n1459_003:0647c08	　斯皆不禮他，　　亦不受他禮。	 斯 皆 不 禮 他 亦 不 受 他 禮 
T24n1459_003:0647c09	　若於旦起時，　　齒木未淨口；	 若 於 旦 起 時 齒 木 未 淨 口 
T24n1459_003:0647c10	　禮他及受禮，　　並皆招惡作。	 禮 他 及 受 禮 並 皆 招 惡 作 
T24n1459_003:0647c11	　見行遍住等，　　皆不應禮拜；	 見 行 遍 住 等 皆 不 應 禮 拜 
T24n1459_003:0647c12	　佛及大苾芻，　　唯此二應禮。	 佛 及 大 苾 芻 唯 此 二 應 禮 
T24n1459_003:0647c13	　於斯聖教內，　　有二種畔睇：	 於 斯 聖 教 內 有 二 種 畔 睇 
T24n1459_003:0647c14	　一謂以五輪、　　二乃搦其腨。	 一 謂 以 五 輪 二 乃 搦 其 腨 
T24n1459_003:0647c15	　持戒者不應，　　毛繩繫蛇項；	 持 戒 者 不 應 毛 繩 繫 蛇 項 
T24n1459_003:0647c16	　如其不肯去，　　方便好應驅。	 如 其 不 肯 去 方 便 好 應 驅 
T24n1459_003:0647c17	　應可用軟繩，　　徐徐繫項棄；	 應 可 用 軟 繩 徐 徐 繫 項 棄 
T24n1459_003:0647c18	　宜安嶮叢處，　　勿對於眾人。	 宜 安 嶮 叢 處 勿 對 於 眾 人 
T24n1459_003:0647c19	　如是於鼠等，　　皆可興悲念；	 如 是 於 鼠 等 皆 可 興 悲 念 
T24n1459_003:0647c20	　繫放無令害，　　慇懃善用心。	 繫 放 無 令 害 慇 懃 善 用 心 
T24n1459_003:0647c21	　護戒者悲心，　　蚤虱常存念；	 護 戒 者 悲 心 蚤 虱 常 存 念 
T24n1459_003:0647c22	　置故衣氈內，　　應安孔隙中。	 置 故 衣 氈 內 應 安 孔 隙 中 
T24n1459_003:0647c23	　若其除壁虱，　　可安青草中；	 若 其 除 壁 虱 可 安 青 草 中 
T24n1459_003:0647c24	　隨其樂處行，　　勿令生苦害。	 隨 其 樂 處 行 勿 令 生 苦 害 
T24n1459_003:0647c25	　油器有三種：　　大者受一抄，	 油 器 有 三 種 大 者 受 一 抄 
T24n1459_003:0647c26	　小半抄餘中，　　隨情可持用。	 小 半 抄 餘 中 隨 情 可 持 用 
T24n1459_003:0647c27	　道行為法語，　　或作聖默然；	 道 行 為 法 語 或 作 聖 默 然 
T24n1459_003:0647c28	　住息說伽他，　　宿處誦三啟。	 住 息 說 伽 他 宿 處 誦 三 啟 
T24n1459_003:0647c29	　聽持三種繩：　　長百五十肘，	 聽 持 三 種 繩 長 百 五 十 肘 
T24n1459_003:0648a01	　短百肘餘中，　　隨處應當用。	 短 百 肘 餘 中 隨 處 應 當 用 
T24n1459_003:0648a02	　如其井池淺，　　或可水平流；	 如 其 井 池 淺 或 可 水 平 流 
T24n1459_003:0648a03	　長短任應持，　　或時全不用。	 長 短 任 應 持 或 時 全 不 用 
T24n1459_003:0648a04	　若為苾芻尼，　　演說律儀教；	 若 為 苾 芻 尼 演 說 律 儀 教 
T24n1459_003:0648a05	　中間應幔障，　　異斯便惡作。	 中 間 應 幔 障 異 斯 便 惡 作 
T24n1459_003:0648a06	　不取賊遺物，　　應可善觀瞻；	 不 取 賊 遺 物 應 可 善 觀 瞻 
T24n1459_003:0648a07	　多人共委知，　　設取無愆過。	 多 人 共 委 知 設 取 無 愆 過 
T24n1459_003:0648a08	　苾芻若種樹，　　擬充僧果園；	 苾 芻 若 種 樹 擬 充 僧 果 園 
T24n1459_003:0648a09	　守看經五年，　　去時須囑授。	 守 看 經 五 年 去 時 須 囑 授 
T24n1459_003:0648a10	　苾芻不呪誓，　　若作似妄語，	 苾 芻 不 呪 誓 若 作 似 妄 語 
T24n1459_003:0648a11	　亦不賭衣等，　　博奕匪尸羅。	 亦 不 賭 衣 等 博 奕 匪 尸 羅 
T24n1459_003:0648a12	　苾芻見女人，　　若有染心起；	 苾 芻 見 女 人 若 有 染 心 起 
