T24n1488_004:1054a27	成佛，是名勝田，施如是田，故得勝果。若有施	成 佛 是 名 勝 田 施 如 是 田 故 得 勝 果 若 有 施 
T24n1488_004:1054a28	物，具足妙好色、香、味、觸，是名財勝，以是物施，	物 具 足 妙 好 色 香 味 觸 是 名 財 勝 以 是 物 施 
T24n1488_004:1054a29	故得勝果。若有施主信心淳濃，施、戒、聞、慧，則	故 得 勝 果 若 有 施 主 信 心 淳 濃 施 戒 聞 慧 則 
T24n1488_004:1054b01	得勝果。「善男子！有智之人，施有五種：一者、至	得 勝 果 善 男 子 有 智 之 人 施 有 五 種 一 者 至 
T24n1488_004:1054b02	心施，二者、自手施，三者、信心施，四者、時節施，	心 施 二 者 自 手 施 三 者 信 心 施 四 者 時 節 施 
T24n1488_004:1054b03	五者、如法求物施。善男子！至心施者，得何等	五 者 如 法 求 物 施 善 男 子 至 心 施 者 得 何 等 
T24n1488_004:1054b04	果？若至心施者，是人則得多財饒寶，金銀、	果 若 至 心 施 者 是 人 則 得 多 財 饒 寶 金 銀 
T24n1488_004:1054b05	琉璃、車渠、馬瑙、真珠、珊瑚，象、馬、牛、羊，田、宅、	琉 璃 車 渠 馬 瑙 真 珠 珊 瑚 象 馬 牛 羊 田 宅 
T24n1488_004:1054b06	奴、婢，多饒眷屬，至心施者，得如是果。自手施	奴 婢 多 饒 眷 屬 至 心 施 者 得 如 是 果 自 手 施 
T24n1488_004:1054b07	者，得何等果？自手施已，所得果報，如上所	者 得 何 等 果 自 手 施 已 所 得 果 報 如 上 所 
T24n1488_004:1054b08	說，得已能用，自手施者得如是報。信心施	說 得 已 能 用 自 手 施 者 得 如 是 報 信 心 施 
T24n1488_004:1054b09	者，得何等果？信心施已，所得果報，如上所	者 得 何 等 果 信 心 施 已 所 得 果 報 如 上 所 
T24n1488_004:1054b10	說，常為父母、兄弟、宗親、一切眾生之所愛念，	說 常 為 父 母 兄 弟 宗 親 一 切 眾 生 之 所 愛 念 
T24n1488_004:1054b11	信心施者，加如是報。時節施者得何等果？時	信 心 施 者 加 如 是 報 時 節 施 者 得 何 等 果 時 
T24n1488_004:1054b12	節施者所得果報，如上所說，所須之物隨時	節 施 者 所 得 果 報 如上所說 所 須 之 物 隨 時 
T24n1488_004:1054b13	而得，時節施者，兼如是果。如法財施，得何等	而 得 時 節 施 者 兼 如 是 果 如 法 財 施 得 何 等 
T24n1488_004:1054b14	果？如法財施所得果報，如先所說，得是財	果 如 法 財 施 所 得 果 報 如先所說 得 是 財 
T24n1488_004:1054b15	已，王、賊、水、火所不能侵。「若好色施，以是因緣，	已 王 賊 水 火 所 不 能 侵 若 好 色 施 以是因緣 
T24n1488_004:1054b16	是人獲得微妙上色。若以香施，是人因是名	是 人 獲 得 微 妙 上 色 若 以 香 施 是 人 因 是 名 
T24n1488_004:1054b17	稱遠聞。若以味施，是人因是眾樂見聞，既見	稱 遠 聞 若 以 味 施 是 人 因 是 眾 樂 見 聞 既 見 
T24n1488_004:1054b18	聞已生愛重心。若好觸施，是人因是得上妙	聞 已 生 愛 重 心 若 好 觸 施 是 人 因 是 得 上 妙 
T24n1488_004:1054b19	觸；受者受已，則能獲得壽命、色、力、安樂、辯才。	觸 受 者 受 已 則 能 獲 得 壽 命 色 力 安 樂 辯 才 
T24n1488_004:1054b20	善男子！有人說言：施於塔、像，不得壽命、色、	善 男 子 有 人 說 言 施 於 塔 像 不 得 壽 命 色 
T24n1488_004:1054b21	力、安、辯，無受者故。是義不然！何以故？有	力 安 辯 無 受 者 故 是 義 不 然 何 以 故 有 
T24n1488_004:1054b22	信心故，施主信心而行布施，是故應得如	信 心 故 施 主 信 心 而 行 布 施 是 故 應 得 如 
T24n1488_004:1054b23	是五報。善男子！譬如比丘修集慈心，如是	是 五 報 善 男 子 譬 如 比 丘 修 集 慈 心 如 是 
T24n1488_004:1054b24	慈心實無受者，而亦獲得無量果報。施塔、像	慈 心 實 無 受 者 而 亦 獲 得 無 量 果 報 施 塔 像 
T24n1488_004:1054b25	等亦應如是，得五果報。善男子！如人種穀，終	等 亦 應 如 是 得 五 果 報 善 男 子 如 人 種 穀 終 
T24n1488_004:1054b26	不生苽，施於塔、像，亦復如是；以福田故，得種	不 生 苽 施 於 塔 像 亦復如是 以 福 田 故 得 種 
T24n1488_004:1054b27	種果。是故我說田得果報，物得果報，主得果	種 果 是 故 我 說 田 得 果 報 物 得 果 報 主 得 果 
T24n1488_004:1054b28	報。「善男子！施有二種：一者、法施，二者、財施。	報 善 男 子 施 有 二 種 一 者 法 施 二 者 財 施 
T24n1488_004:1054b29	法施則得財、法二報，財施唯還得財寶報。菩	法 施 則 得 財 法 二 報 財 施 唯 還 得 財 寶 報 菩 
T24n1488_004:1054c01	薩修行如是二施，為二事故：一、令眾生遠離	薩 修 行 如 是 二 施 為 二 事 故 一 令 眾 生 遠 離 
T24n1488_004:1054c02	苦惱，二、令眾生心得調伏。善男子！復有三	苦 惱 二 令 眾 生 心 得 調 伏 善 男 子 復 有 三 
T24n1488_004:1054c03	施：一、以法施，二、無畏施，三、財物施。以法施	施 一 以 法 施 二 無 畏 施 三 財 物 施 以 法 施 
T24n1488_004:1054c04	者，教他受戒、出家、修道、白四羯磨，為壞邪見	者 教 他 受 戒 出 家 修 道 白四羯磨 為 壞 邪 見 
T24n1488_004:1054c05	說於正法，能分別說實非實等，宣說四倒及	說 於 正 法 能 分 別 說 實 非 實 等 宣 說 四 倒 及 
T24n1488_004:1054c06	不放逸，是名法施。若有眾生怖畏王者、師子、	不 放 逸 是 名 法 施 若 有 眾 生 怖 畏 王 者 師 子 
T24n1488_004:1054c07	虎、狼、水、火、盜賊，菩薩見已，能為救濟，名無畏	虎 狼 水 火 盜 賊 菩 薩 見 已 能 為 救 濟 名 無 畏 
T24n1488_004:1054c08	施。自於財寶破慳不悋，若好若醜，若多若少，	施 自 於 財 寶 破 慳 不 悋 若 好 若 醜 若 多 若 少 
T24n1488_004:1054c09	牛、羊、象、馬，房舍、臥具、樹林、泉井，奴婢、僕使，水	牛 羊 象 馬 房 舍 臥 具 樹 林 泉 井 奴 婢 僕 使 水 
T24n1488_004:1054c10	牛、駝驢，車乘、輦輿，瓶瓮、釜鑊，繩床、坐具，銅鐵、	牛 駝 驢 車 乘 輦 輿 瓶 瓮 釜 鑊 繩 床 坐 具 銅 鐵 
T24n1488_004:1054c11	瓦器，衣服、瓔珞，燈明、香、花，扇、蓋、帽、履，机杖、繩	瓦 器 衣 服 瓔 珞 燈 明 香 花 扇 蓋 帽 履 机 杖 繩 
T24n1488_004:1054c12	索，犁、鎒、斧、鑿，草、木、水、石，如是等物，稱求者	索 犁 鎒 斧 鑿 草 木 水 石 如 是 等 物 稱 求 者 
T24n1488_004:1054c13	意，隨所須與，是名財施。若起僧坊及起別房，	意 隨 所 須 與 是 名 財 施 若 起 僧 坊 及 起 別 房 
T24n1488_004:1054c14	如上施與出家之人，唯除象、馬。「善男子！施	如 上 施 與 出家之人 唯 除 象 馬 善 男 子 施 
T24n1488_004:1054c15	有四累：一、慳貪心，二、不修施，三、輕小物，四、求	有 四 累 一 慳 貪 心 二 不 修 施 三 輕 小 物 四 求 
T24n1488_004:1054c16	世報。如是四累，二法能壞：一、修無我，二、修	世 報 如 是 四 累 二 法 能 壞 一 修 無 我 二 修 
T24n1488_004:1054c17	無常。善男子！若欲樂施，當破五事：一者、瞋心，	無 常 善 男 子 若 欲 樂 施 當 破 五 事 一 者 瞋 心 
T24n1488_004:1054c18	二者、慳心，三者、妬心，四者、惜身命，五者、	二 者 慳 心 三 者 妬 心 四 者 惜 身 命 五 者 
T24n1488_004:1054c19	不信因果；破是五事，常樂布施。樂施之人，獲	不 信 因 果 破 是 五 事 常 樂 布 施 樂 施 之 人 獲 
T24n1488_004:1054c20	得五事：一者、終不遠離一切聖人，二者、一切	得 五 事 一 者 終 不 遠 離 一切聖人 二 者 一 切 
T24n1488_004:1054c21	眾生樂見、樂聞，三者、入大眾時不生怖畏，四	眾 生 樂 見 樂 聞 三 者 入 大 眾 時 不 生 怖 畏 四 
T24n1488_004:1054c22	者、得好名稱，五者、莊嚴菩提。「善男子！菩薩	者 得 好 名 稱 五 者 莊 嚴 菩 提 善 男 子 菩 薩 
T24n1488_004:1054c23	之人名一切施，云何名為一切施也？善男	之 人 名 一 切 施 云 何 名 為 一 切 施 也 善 男 
T24n1488_004:1054c24	子！菩薩摩訶薩如法求物，持以布施，名一切	子 菩薩摩訶薩 如 法 求 物 持 以 布 施 名 一 切 
T24n1488_004:1054c25	施；恒以淨心施於受者，名一切施；少物能	施 恒 以 淨 心 施 於 受 者 名 一 切 施 少 物 能 
T24n1488_004:1054c26	施，名一切施；所愛之物，破慳能捨，名一切施；	施 名 一 切 施 所 愛 之 物 破 慳 能 捨 名 一 切 施 
T24n1488_004:1054c27	施不求報，名一切施；施時不觀田以非田，名	施 不 求 報 名 一 切 施 施 時 不 觀 田 以 非 田 名 
T24n1488_004:1054c28	一切施；怨親等施，名一切施。菩薩施財，凡有	一 切 施 怨 親 等 施 名 一 切 施 菩 薩 施 財 凡 有 
T24n1488_004:1054c29	二種：一者、眾生，二者、非眾生，於是二中乃	二 種 一 者 眾 生 二 者 非 眾 生 於 是 二 中 乃 
T24n1488_004:1055a01	至自身都不悋惜，名一切施；菩薩布施，由憐	至 自 身 都 不 悋 惜 名 一 切 施 菩 薩 布 施 由 憐 
T24n1488_004:1055a02	愍心，名一切施；欲施、施時、施已不悔，名一	愍 心 名 一 切 施 欲 施 施 時 施 已 不 悔 名 一 
T24n1488_004:1055a03	切施。或時設以不淨物施，為令前人生喜心	切 施 或 時 設 以 不 淨 物 施 為 令 前 人 生 喜 心 
T24n1488_004:1055a04	故。酒、毒、刀、杖、枷鎖等物，若得自在、若不自	故 酒 毒 刀 杖 枷 鎖 等 物 若 得 自 在 若 不 自 
T24n1488_004:1055a05	在，終不以施；不施病人不淨食藥；不劫他	在 終 不 以 施 不 施 病 人 不 淨 食 藥 不 劫 他 
T24n1488_004:1055a06	物乃至一錢持以布施。菩薩施時雖得自在，	物 乃 至 一 錢 持 以 布 施 菩 薩 施 時 雖 得 自 在 
T24n1488_004:1055a07	終不罵打令諸僕使生瞋苦惱。如法財施，不	終 不 罵 打 令 諸 僕 使 生 瞋 苦 惱 如 法 財 施 不 
T24n1488_004:1055a08	求現在後世果報。施已常觀煩惱罪過，深觀	求 現 在 後 世 果 報 施 已 常 觀 煩 惱 罪 過 深 觀 
T24n1488_004:1055a09	涅槃功德微妙，除菩提已更無所求。施貧窮	涅 槃 功 德 微 妙 除 菩 提 已 更 無 所 求 施 貧 窮 
T24n1488_004:1055a10	時，起悲愍心；施福田時，生喜敬心；施親友時，	時 起 悲 愍 心 施 福 田 時 生 喜 敬 心 施 親 友 時 
T24n1488_004:1055a11	不生放捨心。若見乞者，則知所須隨相給	不 生 放 捨 心 若 見 乞 者 則 知 所 須 隨 相 給 
T24n1488_004:1055a12	與，不令發言。何以故？不待求施，得無量果。	與 不 令 發 言 何 以 故 不 待 求 施 得 無 量 果 
T24n1488_004:1055a13	「◎善男子！施主有三：謂下、中、上。不信業果，	 善 男 子 施 主 有 三 謂 下 中 上 不 信 業 果 
T24n1488_004:1055a14	深著慳悋，恐財有盡，見來求者生瞋礙想，是	深 著 慳 悋 恐 財 有 盡 見 來 求 者 生 瞋 礙 想 是 
T24n1488_004:1055a15	名為下。雖信業果，於財生慳，恐有空竭，見	名 為 下 雖 信 業 果 於 財 生 慳 恐 有 空 竭 見 
T24n1488_004:1055a16	來求者生於捨心，是名為中。深信業果，於財	來 求 者 生 於 捨 心 是 名 為 中 深 信 業 果 於 財 
T24n1488_004:1055a17	物所不生慳悋，觀諸財物是無常想，見來	物 所 不 生 慳 悋 觀 諸 財 物 是 無 常 想 見 來 
T24n1488_004:1055a18	求者，有與則喜、無與則惱，以身[貝*致]物而用與	求 者 有 與 則 喜 無 與 則 惱 以 身 [貝致] 物 而 用 與 
T24n1488_004:1055a19	之，是名為上。復有下者，見來求者，[卑*頁]面不	之 是 名 為 上 復 有 下 者 見 來 求 者 [卑頁] 面 不 
T24n1488_004:1055a20	看，惡罵毀辱。復有中者，雖復施與，輕賤不	看 惡 罵 毀 辱 復 有 中 者 雖 復 施 與 輕 賤 不 
T24n1488_004:1055a21	敬。復有上者，未求便施，敬心而與。復有下	敬 復 有 上 者 未 求 便 施 敬 心 而 與 復 有 下 
T24n1488_004:1055a22	者，為現報施；復有中者，為後報施；復有上者，	者 為 現 報 施 復 有 中 者 為 後 報 施 復 有 上 者 
T24n1488_004:1055a23	憐愍故施。復有下者，為報恩施；復有中者，為	憐 愍 故 施 復 有 下 者 為 報 恩 施 復 有 中 者 為 
T24n1488_004:1055a24	業故施；復有上者，為法藏施。復有下者，畏勝	業 故 施 復 有 上 者 為 法 藏 施 復 有 下 者 畏 勝 
T24n1488_004:1055a25	故施；復有中者，等己故施；復有上者，不擇怨	故 施 復 有 中 者 等 己 故 施 復 有 上 者 不 擇 怨 
T24n1488_004:1055a26	親。又復下者，有財言無；又復中者，多財言	親 又 復 下 者 有 財 言 無 又 復 中 者 多 財 言 
T24n1488_004:1055a27	少；又復上者，少索多與。施者無財，亦復三種：	少 又 復 上 者 少 索 多 與 施 者 無 財 亦 復 三 種 
T24n1488_004:1055a28	最下之人，見來求者，惡心瞋責；中品之人，見	最 下 之 人 見 來 求 者 惡 心 瞋 責 中 品 之 人 見 
T24n1488_004:1055a29	來求者，直言無物；上品之人，見來求者，自鄙	來 求 者 直 言 無 物 上 品 之 人 見 來 求 者 自 鄙 
T24n1488_004:1055b01	無物，心生愁惱。善男子！又復下者，常為聖	無 物 心 生 愁 惱 善 男 子 又 復 下 者 常 為 聖 
T24n1488_004:1055b02	賢之所呵責；又復中者，常為賢聖之所憐愍；	賢 之 所 呵 責 又 復 中 者 常 為 賢 聖 之 所 憐 愍 
T24n1488_004:1055b03	又復上者，賢聖見已心生歡喜。「善男子！智人	又 復 上 者 賢 聖 見 已 心生歡喜 善 男 子 智 人 
T24n1488_004:1055b04	行施，為自他利，知財寶物是無常故，為令眾	行 施 為 自 他 利 知 財 寶 物 是 無 常 故 為 令 眾 
T24n1488_004:1055b05	生生喜心故，為憐愍故，為壞慳故，為不求	生 生 喜 心 故 為 憐 愍 故 為 壞 慳 故 為 不 求 
T24n1488_004:1055b06	索後果報故，為欲莊嚴菩提道故。是故菩薩	索 後 果 報 故 為 欲 莊 嚴 菩 提 道 故 是 故 菩 薩 
T24n1488_004:1055b07	一切施已，不生悔心，不慮財盡，不輕財物，不	一 切 施 已 不 生 悔 心 不 慮 財 盡 不 輕 財 物 不 
T24n1488_004:1055b08	輕自身，不觀時節，不觀求者，常念乞者如飢	輕 自 身 不 觀 時 節 不 觀 求 者 常 念 乞 者 如 飢 
T24n1488_004:1055b09	思食。親近善友，諮受正教，見來求者，心生歡	思 食 親近善友 諮 受 正 教 見 來 求 者 心 生 歡 
T24n1488_004:1055b10	喜，如失火家得出財物，歡喜讚歎，說財多過。	喜 如 失 火 家 得 出 財 物 歡 喜 讚 歎 說 財 多 過 
T24n1488_004:1055b11	施已生喜，如寄善人；復語乞者：『汝今真是我	施 已 生 喜 如 寄 善 人 復 語 乞 者 汝 今 真 是 我 
T24n1488_004:1055b12	功德因！我今遠離慳貪之心，皆由於汝來乞	功 德 因 我 今 遠 離 慳 貪 之 心 皆 由 於 汝 來 乞 
T24n1488_004:1055b13	因緣。』即於求者生親愛心。既施與已，復教乞	因 緣 即 於 求 者 生 親 愛 心 既 施 與 已 復 教 乞 
T24n1488_004:1055b14	者如法守護，勤修供養佛、法、僧寶。菩薩如是	者 如 法 守 護 勤 修 供 養 佛 法 僧 寶 菩 薩 如 是 
T24n1488_004:1055b15	樂行施已，則得遠離一切放逸，雖以身分施	樂 行 施 已 則 得 遠 離 一 切 放 逸 雖 以 身 分 施 
T24n1488_004:1055b16	於乞者，終不生於一念惡心，因是更增慈、	於 乞 者 終 不 生 於 一 念 惡 心 因 是 更 增 慈 
T24n1488_004:1055b17	悲、喜、捨。不輕受者，亦不自高，自慶有財稱求	悲 喜 捨 不 輕 受 者 亦 不 自 高 自 慶 有 財 稱 求 
T24n1488_004:1055b18	者意，增長信心，不疑業果。善男子！若能觀	者 意 增 長 信 心 不 疑 業 果 善 男 子 若 能 觀 
T24n1488_004:1055b19	財是無常相，觀諸眾生作一子想，是人乃	財 是 無 常 相 觀 諸 眾 生 作 一 子 想 是 人 乃 
T24n1488_004:1055b20	能施於乞者。善男子！是人不為慳結所動，如	能 施 於 乞 者 善 男 子 是 人 不 為 慳 結 所 動 如 
T24n1488_004:1055b21	須彌山風不能動。如是之人，能為眾生而作	須 彌 山 風 不 能 動 如 是 之 人 能 為 眾 生 而 作 
T24n1488_004:1055b22	歸依，是人能具檀波羅蜜。「善男子！有智之	歸 依 是 人 能 具 檀 波 羅 蜜 善 男 子 有 智 之 
T24n1488_004:1055b23	人，為四事故，樂行惠施：一者、因施能破煩惱，	人 為 四 事 故 樂 行 惠 施 一 者 因 施 能 破 煩 惱 
T24n1488_004:1055b24	二者、因施發種種願，三者、因施得受安樂，四	二 者 因 施 發 種 種 願 三 者 因 施 得 受 安 樂 四 
T24n1488_004:1055b25	者、因施多饒財寶。善男子！無貪之心，名之為	者 因 施 多 饒 財 寶 善 男 子 無 貪 之 心 名 之 為 
T24n1488_004:1055b26	施。云何無貪？施即是業，物即是作，為業、為	施 云 何 無 貪 施 即 是 業 物 即 是 作 為 業 為 
T24n1488_004:1055b27	作具足布施，名為無貪。因於布施破煩惱者，	作 具 足 布 施 名 為 無 貪 因 於 布 施 破 煩 惱 者 
T24n1488_004:1055b28	既行惠施，破慳貪、嫉妬、瞋恚、愚癡。云何因施	既 行 惠 施 破 慳 貪 嫉 妬 瞋 恚 愚 癡 云 何 因 施 
T24n1488_004:1055b29	發種種願？因是施已，能發種種善惡等願，因	發 種 種 願 因 是 施 已 能 發 種 種 善 惡 等 願 因 
T24n1488_004:1055c01	善惡願得善惡果。何以故？誓願力故。云何	善 惡 願 得 善 惡 果 何 以 故 誓 願 力 故 云 何 
T24n1488_004:1055c02	因施得受安樂？因是施故受人天樂，至無	因 施 得 受 安 樂 因 是 施 故 受 人 天 樂 至 無 
T24n1488_004:1055c03	上樂。云何因施多饒財寶？因是施故，所求金、	上 樂 云 何 因 施 多 饒 財 寶 因 是 施 故 所 求 金 
T24n1488_004:1055c04	銀乃至畜生，如意即得。善男子！若人樂施，	銀 乃 至 畜 生 如 意 即 得 善 男 子 若 人 樂 施 
T24n1488_004:1055c05	是人即壞五弊惡法：一者、邪見，二者、無信，三	是 人 即 壞 五 弊 惡 法 一 者 邪 見 二 者 無 信 三 
T24n1488_004:1055c06	者、放逸，四者、慳悋，五者、瞋礙。離是惡已，心	者 放 逸 四 者 慳 悋 五 者 瞋 礙 離 是 惡 已 心 
T24n1488_004:1055c07	生歡喜，因歡喜故，乃至獲得真正解脫。是人	生 歡 喜 因 歡 喜 故 乃 至 獲 得 真 正 解 脫 是 人 
T24n1488_004:1055c08	現在得四果報：一者、一切樂見乃至怨家，二	現 在 得 四 果 報 一 者 一 切 樂 見 乃 至 怨 家 二 
T24n1488_004:1055c09	者、善名流布遍於四方，三者、入大眾時心無	者 善 名 流 布 遍 於 四 方 三 者 入 大 眾 時 心 無 
T24n1488_004:1055c10	怖畏，四者、一切善人樂來親附。善男子！修	怖 畏 四 者 一 切 善 人 樂 來 親 附 善 男 子 修 
T24n1488_004:1055c11	行施已，其心無悔。是人若以客塵煩惱故墮	行 施 已 其 心 無 悔 是 人 若 以 客塵煩惱 故 墮 
T24n1488_004:1055c12	於地獄，雖處惡處，不飢不渴，以是因緣離二	於 地 獄 雖 處 惡 處 不 飢 不 渴 以是因緣 離 二 
T24n1488_004:1055c13	種苦：一、鐵丸苦，二、鐵漿苦。若畜生身，所須易	種 苦 一 鐵 丸 苦 二 鐵 漿 苦 若 畜 生 身 所 須 易 
T24n1488_004:1055c14	得，無所匱乏。若餓鬼身，不受飢渴，常得飽滿。	得 無 所 匱 乏 若 餓 鬼 身 不 受 飢 渴 常 得 飽 滿 
T24n1488_004:1055c15	若得人身，壽命、色、力、安樂、辯才，及信、戒、施、多	若 得 人 身 壽 命 色 力 安 樂 辯 才 及 信 戒 施 多 
T24n1488_004:1055c16	聞、智慧，勝於一切；雖處惡世，不為惡事，惡法	聞 智 慧 勝 於 一 切 雖 處 惡 世 不 為 惡 事 惡 法 
T24n1488_004:1055c17	生時，終不隨受，於怖畏處不生恐怖。若受	生 時 終 不 隨 受 於 怖 畏 處 不 生 恐 怖 若 受 
T24n1488_004:1055c18	天身，十事殊勝。「善男子！有智之人，為二事故，	天 身 十 事 殊 勝 善 男 子 有 智 之 人 為 二 事 故 
T24n1488_004:1055c19	能行布施：一者、調伏自心，二者、壞怨瞋心；如	能 行 布 施 一 者 調 伏 自 心 二 者 壞 怨 瞋 心 如 
T24n1488_004:1055c20	來因是名無上尊。善男子！智者施已，不求受	來 因 是 名 無 上 尊 善 男 子 智 者 施 已 不 求 受 
T24n1488_004:1055c21	者愛念之心，不求名稱免於怖畏，不求善人	者 愛 念 之 心 不 求 名 稱 免 於 怖 畏 不 求 善 人 
T24n1488_004:1055c22	來見親附，亦不求望天人果報。觀於二事：	來 見 親 附 亦 不 求 望 天 人 果 報 觀 於 二 事 
T24n1488_004:1055c23	一者、以不堅財易於堅財，二者、終不隨順慳	一 者 以 不 堅 財 易 於 堅 財 二 者 終 不 隨 順 慳 
T24n1488_004:1055c24	悋之心。何以故？如是財物，我若終沒，不隨	悋 之 心 何 以 故 如 是 財 物 我 若 終 沒 不 隨 
T24n1488_004:1055c25	我去，是故應當自手施與，我今不應隨失生	我 去 是 故 應 當 自 手 施 與 我 今 不 應 隨 失 生 
T24n1488_004:1055c26	惱，應當隨施生於歡喜。善男子！施者先當	惱 應 當 隨 施 生 於 歡 喜 善 男 子 施 者 先 當 
T24n1488_004:1055c27	自試其心，以外物施；知心調已，次施內物。	自 試 其 心 以 外 物 施 知 心 調 已 次 施 內 物 
T24n1488_004:1055c28	因是二施，獲得二法：一者、永離諸有，二者、得	因 是 二 施 獲 得 二 法 一 者 永 離 諸 有 二 者 得 
T24n1488_004:1055c29	正解脫。善男子！如人遠行，身荷重擔，疲苦勞	正 解 脫 善 男 子 如 人 遠 行 身 荷 重 擔 疲 苦 勞 
T24n1488_004:1056a01	極，捨之則樂。行施之人，見來求者，捨財與之，	極 捨 之 則 樂 行 施 之 人 見 來 求 者 捨 財 與 之 
T24n1488_004:1056a02	心生喜樂，亦復如是。「善男子！智者常作如	心 生 喜 樂 亦復如是 善 男 子 智 者 常 作 如 
T24n1488_004:1056a03	是思惟：『欲令此物隨逐我身至後世者，莫	是 思 惟 欲 令 此 物 隨 逐 我 身 至 後 世 者 莫 
T24n1488_004:1056a04	先於施。』復當深觀貧窮之苦，豪貴快樂，是故	先 於 施 復 當 深 觀 貧 窮 之 苦 豪 貴 快 樂 是 故 
T24n1488_004:1056a05	繫心常樂行施。善男子！若人有財，見有求者，	繫 心 常 樂 行 施 善 男 子 若 人 有 財 見 有 求 者 
T24n1488_004:1056a06	言無言懅，當知是人已說來世貧窮薄德，	言 無 言 懅 當 知 是 人 已 說 來 世 貧 窮 薄 德 
T24n1488_004:1056a07	如是之人名為放逸。善男子！無財之人，自說	如 是 之 人 名 為 放 逸 善 男 子 無 財 之 人 自 說 
T24n1488_004:1056a08	無財，是義不然。何以故？一切水草人無不有，	無 財 是 義 不 然 何 以 故 一 切 水 草 人 無 不 有 
T24n1488_004:1056a09	雖是國主，不必能施，雖是貧窮，非不能施。何	雖 是 國 主 不 必 能 施 雖 是 貧 窮 非 不 能 施 何 
T24n1488_004:1056a10	以故？貧窮之人亦有食分，食已洗器，棄蕩	以 故 貧 窮 之 人 亦 有 食 分 食 已 洗 器 棄 蕩 
T24n1488_004:1056a11	滌汁，施應食者，亦得福德。若以塵[麩夫+少]施於蟻	滌 汁 施 應 食 者 亦 得 福 德 若 以 塵 [麩夫少] 施 於 蟻 
T24n1488_004:1056a12	子，亦得無量福德果報。天下極貧，誰當無此	子 亦 得 無量福德 果 報 天 下 極 貧 誰 當 無 此 
T24n1488_004:1056a13	塵許[麩夫+少]也？誰有一日食三揣[麩夫+少]，命不全者？	塵 許 [麩夫少]也誰有一日食三揣[麩夫少] 命 不 全 者 
T24n1488_004:1056a14	是故諸人應以食半施於乞者。善男子！極貧	是 故 諸 人 應 以 食 半 施 於 乞 者 善 男 子 極 貧 
T24n1488_004:1056a15	之人，誰有赤裸無衣服者？若有衣服，豈無	之 人 誰 有 赤 裸 無 衣 服 者 若 有 衣 服 豈 無 
T24n1488_004:1056a16	一綖施人繫瘡，一指許財作燈炷耶？善男	一 綖 施 人 繫 瘡 一 指 許 財 作 燈 炷 耶 善 男 
T24n1488_004:1056a17	子！天下之人，誰有貧窮當無身者？如其有身，	子 天 下 之 人 誰 有 貧 窮 當 無 身 者 如 其 有 身 
T24n1488_004:1056a18	見他作福，身應往助，歡喜無厭，亦名施主，	見 他 作 福 身 應 往 助 歡 喜 無 厭 亦 名 施 主 
T24n1488_004:1056a19	亦得福德，或時有分，或有與等，或有勝者。以	亦 得 福 德 或 時 有 分 或 有 與 等 或 有 勝 者 以 
T24n1488_004:1056a20	是因緣，我受波斯匿王食時，亦呪願王及貧	是 因 緣 我 受 波 斯 匿 王 食 時 亦 呪 願 王 及 貧 
T24n1488_004:1056a21	窮人所得福德等無差別。善男子！如人買香，	窮 人 所 得 福 德 等 無 差 別 善 男 子 如 人 買 香 
T24n1488_004:1056a22	塗香、末香、散香、燒香，如是四香，有人觸者，買	塗 香 末 香 散 香 燒 香 如 是 四 香 有 人 觸 者 買 
T24n1488_004:1056a23	者、量者等聞無異，而是諸香不失毫釐。修施	者 量 者 等 聞 無 異 而 是 諸 香 不 失 毫 釐 修 施 
