T24n1459_002:0636c22	　足罷竟去休，　　此說名遮足；	 足 罷 竟 去 休 此 說 名 遮 足 
T24n1459_002:0636c23	　若道且言者，　　聖說許無愆。	 若 道 且 言 者 聖 說 許 無 愆 
T24n1459_002:0636c24	　若作餘食法，　　非側非背後；	 若 作 餘 食 法 非 側 非 背 後 
T24n1459_002:0636c25	　不安在懷中，　　非空非置地。	 不 安 在 懷 中 非 空 非 置 地 
T24n1459_002:0636c26	　兩手極淨洗，　　然後方受食；	 兩 手 極 淨 洗 然 後 方 受 食 
T24n1459_002:0636c27	　食了不離座，　　是未足應知。	 食 了 不 離 座 是 未 足 應 知 
T24n1459_002:0636c28	　執食可蹲踞，　　對苾芻應告：	 執 食 可 蹲 踞 對 苾 芻 應 告 
T24n1459_002:0636c29	　我作餘食法，　　仁當憶念知。	 我 作 餘 食 法 仁 當 憶 念 知 
T24n1459_002:0637a01	　彼人當取食，　　若二若三口；	 彼 人 當 取 食 若二若三 口 
T24n1459_002:0637a02	　語言持取去，　　隨意可應飡。	 語 言 持 取 去 隨 意 可 應 飡 
T24n1459_002:0637a03	　若彼雖足食，　　然未離於座；	 若 彼 雖 足 食 然 未 離 於 座 
T24n1459_002:0637a04	　應就彼人前，　　作法皆如上。	 應 就 彼 人 前 作 法 皆 如 上 
T24n1459_002:0637a05	　彼人不合食，　　應告食人言：	 彼 人 不 合 食 應 告 食 人 言 
T24n1459_002:0637a06	　將去任情飡，　　名第二餘法。	 將 去 任 情 飡 名 第 二 餘 法 
T24n1459_002:0637a07	　若得非正食，　　謂是乳酪類、	 若 得 非 正 食 謂 是 乳 酪 類 
T24n1459_002:0637a08	　薄粥薄[麩夫+少]等，　　並非成足食。	 薄 粥 薄 [麩夫少] 等 並 非 成 足 食 
T24n1459_002:0637a09	　若竪匙不住，　　此名為薄粥；	 若 竪 匙 不 住 此 名 為 薄 粥 
T24n1459_002:0637a10	　指鉤不見迹，　　謂薄[麩夫+少]應知。	 指 鉤 不 見 迹 謂 薄 [麩夫少] 應 知 
T24n1459_002:0637a11	　若作足食想，　　及以生猶豫；	 若 作 足 食 想 及 以 生 猶 豫 
T24n1459_002:0637a12	　食便招本罪，　　便開地獄門。	 食 便 招 本 罪 便 開 地 獄 門 
T24n1459_002:0637a13	　若食雖未足，　　而為足食心；	 若 食 雖 未 足 而 為 足 食 心 
T24n1459_002:0637a14	　及起疑意時，　　皆招惡作罪。	 及 起 疑 意 時 皆 招 惡 作 罪 
T24n1459_002:0637a15	勸足食學處	勸 足 食 學 處 
T24n1459_002:0637a16	　知他足食竟，　　不為餘食法；	 知 他 足 食 竟 不 為 餘 食 法 
T24n1459_002:0637a17	　內懷於惡心，　　勸食便生罪。	 內 懷 於 惡 心 勸 食 便 生 罪 
T24n1459_002:0637a18	　知足食想疑，　　慇懃勸彼足；	 知 足 食 想 疑 慇 懃 勸 彼 足 
T24n1459_002:0637a19	　欲令他犯過，　　當來苦自傷。	 欲 令 他 犯 過 當 來 苦 自 傷 
T24n1459_002:0637a20	　不應以雙足，　　蹈於食葉上；	 不 應 以 雙 足 蹈 於 食 葉 上 
T24n1459_002:0637a21	　病者便非過，　　無病起譏嫌。	 病 者 便 非 過 無 病 起 譏 嫌 
T24n1459_002:0637a22	　苾芻若無病，　　連鞋不應食；	 苾 芻 若 無 病 連 鞋 不 應 食 
T24n1459_002:0637a23	　病應抽出足，　　蹋鞋上非愆。	 病 應 抽 出 足 蹋 鞋 上 非 愆 
T24n1459_002:0637a24	　授食在背側，　　或遠或隔障；	 授 食 在 背 側 或 遠 或 隔 障 
T24n1459_002:0637a25	　及不仰手時，　　斯皆不成受。	 及 不 仰 手 時 斯 皆 不 成 受 
T24n1459_002:0637a26	　授者立相近，　　當前無障隔；	 授 者 立 相 近 當 前 無 障 隔 
T24n1459_002:0637a27	　皆須仰手受，　　極可用心請。	 皆 須 仰 手 受 極 可 用 心 請 
T24n1459_002:0637a28	　指食令安鉢，　　如其墮葉盤；	 指 食 令 安 鉢 如 其 墮 葉 盤 
T24n1459_002:0637a29	　此即名為受，　　無疑應可食。	 此 即 名 為 受 無 疑 應 可 食 
T24n1459_002:0637b01	　微塵有多種，　　花果飲食衣；	 微 塵 有 多 種 花 果 飲 食 衣 
T24n1459_002:0637b02	　有觸與無觸，　　淨與不淨別。	 有 觸 與 無 觸 淨 與 不 淨 別 
T24n1459_002:0637b03	　土塵事多種，　　有淨及不淨；	 土 塵 事 多 種 有 淨 及 不 淨 
T24n1459_002:0637b04	　覩色不分明，　　此則無勞受。	 覩 色 不 分 明 此 則 無 勞 受 
T24n1459_002:0637b05	　塵相若分明，　　不受不應食；	 塵 相 若 分 明 不 受 不 應 食 
T24n1459_002:0637b06	　食污衣須洗，　　不洗便生過。	 食 污 衣 須 洗 不 洗 便 生 過 
T24n1459_002:0637b07	　若行鹽等竟，　　雖小不應起；	 若 行 鹽 等 竟 雖 小 不 應 起 
T24n1459_002:0637b08	　及時應可坐，　　准次勿相排。	 及 時 應 可 坐 准 次 勿 相 排 
T24n1459_002:0637b09	　年卑居老上，　　知想或生疑；	 年 卑 居 老 上 知 想 或 生 疑 
T24n1459_002:0637b10	　突色訖里多，　　日日恒增長。	 突 色 訖 里 多 日 日 恒 增 長 
T24n1459_002:0637b11	　持食與他人，　　便作希望意；	 持 食 與 他 人 便 作 希 望 意 
T24n1459_002:0637b12	　彼人重授與，　　不淨不應食。	 彼 人 重 授 與 不 淨 不 應 食 
T24n1459_002:0637b13	　決捨絕希望，　　後從他獲得；	 決 捨 絕 希 望 後 從 他 獲 得 
T24n1459_002:0637b14	　此名清淨食，　　受時無有過。	 此 名 清 淨 食 受 時 無 有 過 
T24n1459_002:0637b15	　勿語益送人，　　與我如是食；	 勿 語 益 送 人 與 我 如 是 食 
T24n1459_002:0637b16	　隨行得應噉，　　病人非在遮。	 隨 行 得 應 噉 病 人 非 在 遮 
T24n1459_002:0637b17	　苾芻若食了，　　可留一大抄；	 苾 芻 若 食 了 可 留 一 大 抄 
T24n1459_002:0637b18	　普施於眾生，　　不應為簡別。	 普 施 於 眾 生 不 應 為 簡 別 
T24n1459_002:0637b19	　若客至將行，　　撿挍人并病；	 若 客 至 將 行 撿 挍 人 并 病 
T24n1459_002:0637b20	　及以看病者，　　隨情在前食。	 及 以 看 病 者 隨 情 在 前 食 
T24n1459_002:0637b21	　因籠拏開粥，　　僧眾並隨聽；	 因 籠 拏 開 粥 僧 眾 並 隨 聽 
T24n1459_002:0637b22	　由斯影勝王，　　施地佛聽受。	 由 斯 影 勝 王 施 地 佛 聽 受 
T24n1459_002:0637b23	　因論於食法，　　及與藥相應；	 因 論 於 食 法 及 與 藥 相 應 
T24n1459_002:0637b24	　淨地等要門，　　隨事皆須識。	 淨 地 等 要 門 隨 事 皆 須 識 
T24n1459_002:0637b25	　飯餅及肉魚，　　豆飯并[麩夫+少]等；	 飯 餅 及 肉 魚 豆 飯 并 [麩夫少] 等 
T24n1459_002:0637b26	　斯謂為時藥，　　養命噉恒須。	 斯 謂 為 時 藥 養 命 噉 恒 須 
T24n1459_002:0637b27	　蒱萄及芭蕉，　　醋果并蘡薁；	 蒱 萄 及 芭 蕉 醋 果 并 蘡 薁 
T24n1459_002:0637b28	　棗等烏曇跋，　　並曰非時漿。	 棗 等 烏 曇 跋 並 曰 非 時 漿 
T24n1459_002:0637b29	　俗人及求寂，　　熟柔當淨濾；	 俗 人 及 求 寂 熟 柔 當 淨 濾 
T24n1459_002:0637c01	　酪漿蔗醋漿，　　斯等非時飲。	 酪 漿 蔗 醋 漿 斯 等 非 時 飲 
T24n1459_002:0637c02	　說有七日藥，　　酥油蜜諸糖，	 說 有 七 日 藥 酥 油 蜜 諸 糖 
T24n1459_002:0637c03	　石蜜及沙糖，　　許服皆無過。	 石 蜜 及 沙 糖 許 服 皆 無 過 
T24n1459_002:0637c04	　又有盡壽藥，　　謂是根莖等；	 又 有 盡 壽 藥 謂 是 根 莖 等 
T24n1459_002:0637c05	　如法應守持，　　無限常聽服。	 如 法 應 守 持 無 限 常 聽 服 
T24n1459_002:0637c06	　根雞舌薑等，　　莖謂不死條；	 根 雞 舌 薑 等 莖 謂 不 死 條 
T24n1459_002:0637c07	　黃薑等可知，　　并諸香雜水。	 黃 薑 等 可 知 并 諸 香 雜 水 
T24n1459_002:0637c08	　七葉苦爪苗，　　果謂胡椒等；	 七 葉 苦 爪 苗 果 謂 胡 椒 等 
T24n1459_002:0637c09	　及以三果類，　　准病服皆聽。	 及 以 三 果 類 准 病 服 皆 聽 
T24n1459_002:0637c10	　紫礦及阿魏，　　黃蠟諸樹汁；	 紫 礦 及 阿 魏 黃 蠟 諸 樹 汁 
T24n1459_002:0637c11	　油麻灰等五，　　復有五種鹽。	 油 麻 灰 等 五 復 有 五 種 鹽 
T24n1459_002:0637c12	　菴末羅苦木，　　七葉尸利沙；	 菴 末 羅 苦 木 七 葉 尸 利 沙 
T24n1459_002:0637c13	　如斯樹等皮，　　皆名盡壽藥。	 如 斯 樹 等 皮 皆 名 盡 壽 藥 
T24n1459_002:0637c14	　如是諸藥類，　　不擬將充食；	 如 是 諸 藥 類 不 擬 將 充 食 
T24n1459_002:0637c15	　但欲排飢渴，　　希心趣涅槃。	 但 欲 排 飢 渴 希 心 趣 涅 槃 
T24n1459_002:0637c16	　蒱萄及石榴，　　菴婆芭蕉等；	 蒱 萄 及 石 榴 菴 婆 芭 蕉 等 
T24n1459_002:0637c17	　根謂蓮藕類，　　是時攝應知。	 根 謂 蓮 藕 類 是 時 攝 應 知 
T24n1459_002:0637c18	　如斯時藥等，　　展轉更相雜；	 如 斯 時 藥 等 展 轉 更 相 雜 
T24n1459_002:0637c19	　各從前藥勢，　　服用者無傷。	 各 從 前 藥 勢 服 用 者 無 傷 
T24n1459_002:0637c20	　熊羆及龜鼈，　　并江猪等脂；	 熊 羆 及 龜 鼈 并 江 猪 等 脂 
T24n1459_002:0637c21	　並隨身治病，　　非時咸可服。	 並 隨 身 治 病 非 時 咸 可 服 
T24n1459_002:0637c22	　醫言食生肉，　　人蛇象不聽；	 醫 言 食 生 肉 人 蛇 象 不 聽 
T24n1459_002:0637c23	　魚肉若持來，　　問淨當隨食。	 魚 肉 若 持 來 問 淨 當 隨 食 
T24n1459_002:0637c24	　門前制底舍，　　空露地水堂；	 門 前 制 底 舍 空 露 地 水 堂 
T24n1459_002:0637c25	　簷下及房中，　　並不應煮食。	 簷 下 及 房 中 並 不 應 煮 食 
T24n1459_002:0637c26	　作淨有五種，　　生心等軌則；	 作 淨 有 五 種 生 心 等 軌 則 
T24n1459_002:0637c27	　若為作食厨，　　眾僧共立淨。	 若 為 作 食 厨 眾 僧 共 立 淨 
T24n1459_002:0637c28	　住處絣繩墨，　　草創立基時，	 住 處 絣 繩 墨 草 創 立 基 時 
T24n1459_002:0637c29	　解法營作人，　　興心應作法：	 解 法 營 作 人 興 心 應 作 法 
T24n1459_002:0638a01	　我今於此處，　　立作眾淨厨；	 我 今 於 此 處 立 作 眾 淨 厨 
T24n1459_002:0638a02	　三心念口言，　　謂是生心淨。	 三 心 念 口 言 謂 是 生 心 淨 
T24n1459_002:0638a03	　造寺半已了，　　知事對僧前；	 造 寺 半 已 了 知 事 對 僧 前 
T24n1459_002:0638a04	　我今普告知，　　應如是三說。	 我 今 普 告 知 應 如是三說 
T24n1459_002:0638a05	　此處我守持，　　將為淨食處；	 此 處 我 守 持 將 為 淨 食 處 
T24n1459_002:0638a06	　作如是告白，　　名為共印持。	 作 如 是 告 白 名 為 共 印 持 
T24n1459_002:0638a07	　若人造寺宇，　　房門料亂開；	 若 人 造 寺 宇 房 門 料 亂 開 
T24n1459_002:0638a08	　室相不齊行，　　此名牛臥淨。	 室 相 不 齊 行 此 名 牛 臥 淨 
T24n1459_002:0638a09	　若有僧住處，　　苾芻久棄捨；	 若 有 僧 住 處 苾 芻 久 棄 捨 
T24n1459_002:0638a10	　後至過便無，　　斯名廢故淨。	 後 至 過 便 無 斯 名 廢 故 淨 
T24n1459_002:0638a11	　若僧秉白二，　　羯磨眾詳許；	 若 僧 秉 白 二 羯 磨 眾 詳 許 
T24n1459_002:0638a12	　知法並同心，　　名為作法淨。	 知 法 並 同 心 名 為 作 法 淨 
T24n1459_002:0638a13	　如是五淨厨，　　苾芻不作法；	 如 是 五 淨 厨 苾 芻 不 作 法 
T24n1459_002:0638a14	　停食及煮食，　　悉皆成不淨。	 停 食 及 煮 食 悉 皆 成 不 淨 
T24n1459_002:0638a15	　為淨二五殊，　　刀火蔫鳥甲；	 為 淨 二 五 殊 刀 火 蔫 鳥 甲 
T24n1459_002:0638a16	　墮拔截擘壞，　　作法者無愆。	 墮 拔 截 擘 壞 作 法 者 無 愆 
T24n1459_002:0638a17	　火壞五咸淨，　　餘損子皆成；	 火 壞 五 咸 淨 餘 損 子 皆 成 
T24n1459_002:0638a18	　傷皮有不成，　　於中驗生性。	 傷 皮 有 不 成 於 中 驗 生 性 
T24n1459_002:0638a19	　當於上座所，　　行食者應言：	 當 於 上 座 所 行 食 者 應 言 
T24n1459_002:0638a20	　三鉢羅法哆，　　是名行食法。	 三 鉢 羅 法 哆 是 名 行 食 法 
T24n1459_002:0638a21	　上座當告言：　　應平等行與；	 上 座 當 告 言 應 平 等 行 與 
T24n1459_002:0638a22	　須正意而食，　　了說願伽他。	 須 正 意 而 食 了 說 願 伽 他 
T24n1459_002:0638a23	　正說福頌時，　　苾芻不應食；	 正 說 福 頌 時 苾 芻 不 應 食 
T24n1459_002:0638a24	　若不聞聲者，　　食時無有過。	 若 不 聞 聲 者 食 時 無 有 過 
T24n1459_002:0638a25	　正說伽他時，　　聞時應諦聽；	 正 說 伽 他 時 聞 時 應 諦 聽 
T24n1459_002:0638a26	　頌了隨情食，　　更說非遮限。	 頌 了 隨 情 食 更 說 非 遮 限 
T24n1459_002:0638a27	　有能者應說，　　眾首或餘人；	 有 能 者 應 說 眾 首 或 餘 人 
T24n1459_002:0638a28	　演法應時機，　　當隨施主望。	 演 法 應 時 機 當 隨 施 主 望 
T24n1459_002:0638a29	　凡是說法人，　　應須與伴助；	 凡 是 說 法 人 應 須 與 伴 助 
T24n1459_002:0638b01	　由非獨一己，　　令法有光輝。	 由 非 獨 一 己 令 法 有 光 輝 
T24n1459_002:0638b02	　為眾誦經時，　　夜無燈不許；	 為 眾 誦 經 時 夜 無 燈 不 許 
T24n1459_002:0638b03	　護蟲為百目，　　或復作籠遮。	 護 蟲 為 百 目 或 復 作 籠 遮 
T24n1459_002:0638b04	　所食魚肉等，　　與俗勝人同；	 所 食 魚 肉 等 與 俗 勝 人 同 
T24n1459_002:0638b05	　他持施鉢中，　　應食全無罪。	 他 持 施 鉢 中 應 食 全 無 罪 
T24n1459_002:0638b06	　他為作肉食，　　若有見聞疑；	 他 為 作 肉 食 若 有 見 聞 疑 
T24n1459_002:0638b07	　此則不應飡，　　為愍眾生故。	 此 則 不 應 飡 為 愍 眾 生 故 
T24n1459_002:0638b08	　得虎狼等殘，　　若有聞疑見；	 得 虎 狼 等 殘 若 有 聞 疑 見 
T24n1459_002:0638b09	　由彼心不捨，　　此皆不合飡。	 由 彼 心 不 捨 此 皆 不 合 飡 
T24n1459_002:0638b10	　不許無悲心，　　耽味害他命；	 不 許 無 悲 心 耽 味 害 他 命 
T24n1459_002:0638b11	　准法依三淨，　　食肉許無愆。	 准 法 依 三 淨 食 肉 許 無 愆 
T24n1459_002:0638b12	　蒜葱等諸藥，　　為病在隨聽；	 蒜 葱 等 諸 藥 為 病 在 隨 聽 
T24n1459_002:0638b13	　欲令身命存，　　斯名善法器。	 欲 令 身 命 存 斯 名 善 法 器 
T24n1459_002:0638b14	　病者食蒜時，　　當護其臭氣；	 病 者 食 蒜 時 當 護 其 臭 氣 
T24n1459_002:0638b15	　選處應將息，　　隱密可應為。	 選 處 應 將 息 隱 密 可 應 為 
T24n1459_002:0638b16	　為病服食了，　　可洗身令淨；	 為 病 服 食 了 可 洗 身 令 淨 
T24n1459_002:0638b17	　臭氣皆除滅，　　方入本房中。	 臭 氣 皆 除 滅 方 入 本 房 中 
T24n1459_002:0638b18	　若服蒜葱韮，　　為令身淨故；	 若 服 蒜 葱 韮 為 令 身 淨 故 
T24n1459_002:0638b19	　停七三二夜，　　如次可應知。	 停 七 三 二 夜 如 次 可 應 知 
T24n1459_002:0638b20	　巡家行乞食，　　料亂有多門；	 巡 家 行 乞 食 料 亂 有 多 門 
T24n1459_002:0638b21	　應將飯等記，　　無令路差失。	 應 將 飯 等 記 無 令 路 差 失 
T24n1459_002:0638b22	　乞食秉鳴錫，　　欲使施人知；	 乞 食 秉 鳴 錫 欲 使 施 人 知 
T24n1459_002:0638b23	　及怖於犬牛，　　不許行撾打。	 及 怖 於 犬 牛 不 許 行 撾 打 
T24n1459_002:0638b24	　苾芻於俗舍，　　若食餅果根；	 苾 芻 於 俗 舍 若 食 餅 果 根 
T24n1459_002:0638b25	　勿嚼作大聲，　　或時將汁飲。	 勿 嚼 作 大 聲 或 時 將 汁 飲 
T24n1459_002:0638b26	　自非有要事，　　不應相觸食；	 自 非 有 要 事 不 應 相 觸 食 
T24n1459_002:0638b27	　食時須用心，　　勿濺傍邊者。	 食 時 須 用 心 勿 濺 傍 邊 者 
T24n1459_002:0638b28	　儉時若得食，　　施主歡隨施；	 儉 時 若 得 食 施 主 歡 隨 施 
T24n1459_002:0638b29	　亦可多將去，　　分張與苾芻。	 亦 可 多 將 去 分 張 與 苾 芻 
T24n1459_002:0638c01	　若上座受請，　　食半與餘人；	 若 上 座 受 請 食 半 與 餘 人 
T24n1459_002:0638c02	　為濟儉年時，　　活諸同梵行。	 為 濟 儉 年 時 活 諸 同 梵 行 
T24n1459_002:0638c03	　欲令壽命久，　　餘人得應食；	 欲 令 壽 命 久 餘 人 得 應 食 
T24n1459_002:0638c04	　若在牟尼教，　　一日實難逢。	 若 在 牟 尼 教 一 日 實 難 逢 
T24n1459_002:0638c05	　若於鉢縫中，　　見有餘殘食；	 若 於 鉢 縫 中 見 有 餘 殘 食 
T24n1459_002:0638c06	　應以物擿去，　　三洗用無愆。	 應 以 物 擿 去 三 洗 用 無 愆 
T24n1459_002:0638c07	　食罷口應淨，　　用齒木土等；	 食 罷 口 應 淨 用 齒 木 土 等 
T24n1459_002:0638c08	　淨水漱三度，　　若過亦隨情。	 淨 水 漱 三 度 若 過 亦 隨 情 
T24n1459_002:0638c09	　苾芻得食已，　　疑有餘人觸；	 苾 芻 得 食 已 疑 有 餘 人 觸 
T24n1459_002:0638c10	　應覓未具人，　　重受隨情食。	 應 覓 未 具 人 重 受 隨 情 食 
T24n1459_002:0638c11	　有事須行去，　　無人持路糧；	 有 事 須 行 去 無 人 持 路 糧 
T24n1459_002:0638c12	　自携為換想，　　噉時無有過。	 自 携 為 換 想 噉 時 無 有 過 
T24n1459_002:0638c13	　若無人可換，　　一日不應飡；	 若 無 人 可 換 一 日 不 應 飡 
T24n1459_002:0638c14	　他日噉虎拳，　　不合過斯食。	 他 日 噉 虎 拳 不 合 過 斯 食 
T24n1459_002:0638c15	　三日兩虎拳，　　已後當隨意；	 三 日 兩 虎 拳 已 後 當 隨 意 
T24n1459_002:0638c16	　自作宜應食，　　希望性命全。	 自 作 宜 應 食 希 望 性 命 全 
T24n1459_002:0638c17	　須根地可掘，　　欲果樹宜昇；	 須 根 地 可 掘 欲 果 樹 宜 昇 
T24n1459_002:0638c18	　苾芻應自取，　　除飢得延命。	 苾 芻 應 自 取 除 飢 得 延 命 
T24n1459_002:0638c19	　斯等是遮戒，　　為難暫開聽；	 斯 等 是 遮 戒 為 難 暫 開 聽 
T24n1459_002:0638c20	　若是性罪者，　　命斷不應作。	 若 是 性 罪 者 命 斷 不 應 作 
T24n1459_002:0638c21	　親識遠方來，　　屏處應同食；	 親 識 遠 方 來 屏 處 應 同 食 
T24n1459_002:0638c22	　室羅末尼羅，　　同飡開怖處。	 室 羅 末 尼 羅 同 飡 開 怖 處 
T24n1459_002:0638c23	　受已莫放器，　　左手急堅持；	 受 已 莫 放 器 左 手 急 堅 持 
T24n1459_002:0638c24	　齊手可應飡，　　食時須用意。	 齊 手 可 應 飡 食 時 須 用 意 
T24n1459_002:0638c25	　如其不蓋覆，　　置食被烏殘；	 如 其 不 蓋 覆 置 食 被 烏 殘 
T24n1459_002:0638c26	　近[此/束]處應除，　　餘者隨情食。	 近 [此束] 處 應 除 餘 者 隨 情 食 
T24n1459_002:0638c27	　僧祇若別人，　　酥油沙糖等；	 僧 祇 若 別 人 酥 油 沙 糖 等 
T24n1459_002:0638c28	　如其誤觸者，　　不應便即棄。	 如 其 誤 觸 者 不 應 便 即 棄 
T24n1459_002:0638c29	　若是四方僧，　　或復別人食；	 若 是 四 方 僧 或 復 別 人 食 
T24n1459_002:0639a01	　知淨宜應受，　　異此即不應。	 知 淨 宜 應 受 異 此 即 不 應 
T24n1459_002:0639a02	　食雜沙糖等，　　水洗宜應食；	 食 雜 沙 糖 等 水 洗 宜 應 食 
T24n1459_002:0639a03	　雖在非時中，　　此無不淨過。	 雖 在 非 時 中 此 無 不 淨 過 
T24n1459_002:0639a04	　糖與[麩夫+少]相和，　　應將淨水投；	 糖 與 [麩夫少] 相 和 應 將 淨 水 投 
T24n1459_002:0639a05	　苾芻須淨濾，　　非時飲水聽。	 苾 芻 須 淨 濾 非 時 飲 水 聽 
T24n1459_002:0639a06	　苾芻自為己，　　於沙糖守持；	 苾 芻 自 為 己 於 沙 糖 守 持 
T24n1459_002:0639a07	　隨開於五人，　　相知更互食。	 隨 開 於 五 人 相 知 更 互 食 
T24n1459_002:0639a08	　病斷食少食，　　熱悶及塗中；	 病 斷 食 少 食 熱 悶 及 塗 中 
T24n1459_002:0639a09	　於此五人聽，　　餘者皆不合。	 於 此 五 人 聽 餘 者 皆 不 合 
T24n1459_002:0639a10	　勝果卒難逢，　　及上飲食等；	 勝 果 卒 難 逢 及 上 飲 食 等 
T24n1459_002:0639a11	　苾芻雖足食，　　不加法亦飡。	 苾 芻 雖 足 食 不 加 法 亦 飡 
T24n1459_002:0639a12	　若乞食苾芻，　　巡家乞得食；	 若 乞 食 苾 芻 巡 家 乞 得 食 
T24n1459_002:0639a13	　有人請入舍，　　隨言使福增。	 有 人 請 入 舍 隨 言 使 福 增 
T24n1459_002:0639a14	　舍中食餘飯，　　施主遣將歸；	 舍 中 食 餘 飯 施 主 遣 將 歸 
T24n1459_002:0639a15	　縱觸還應食，　　儉歲聽非過。	 縱 觸 還 應 食 儉 歲 聽 非 過 
T24n1459_002:0639a16	　寺三時設食，　　祭彼護寺神；	 寺 三 時 設 食 祭 彼 護 寺 神 
T24n1459_002:0639a17	　時非時藥叉，　　住彼須應食。	 時 非 時 藥 叉 住 彼 須 應 食 
T24n1459_002:0639a18	　訶利底母兒，　　佛遣多祭食；	 訶 利 底 母 兒 佛 遣 多 祭 食 
T24n1459_002:0639a19	　為護於住處，　　令教法光輝。	 為 護 於 住 處 令 教 法 光 輝 
T24n1459_002:0639a20	別眾食學處	別 眾 食 學 處 
T24n1459_002:0639a21	　不飡別眾食，　　唯除病等緣；	 不 飡 別 眾 食 唯 除 病 等 緣 
T24n1459_002:0639a22	　僧中取少多，　　或此送無犯。	 僧 中 取 少 多 或 此 送 無 犯 
T24n1459_002:0639a23	　乃至一匕鹽，　　或一握草葉；	 乃 至 一 匕 鹽 或 一 握 草 葉 
T24n1459_002:0639a24	　送向於餘處，　　亦得表情和。	 送 向 於 餘 處 亦 得 表 情 和 
T24n1459_002:0639a25	　有人不盡情，　　四人名別眾；	 有 人 不 盡 情 四 人 名 別 眾 
T24n1459_002:0639a26	　病作道行時，　　事如前已說。	 病 作 道 行 時 事 如 前 已 說 
T24n1459_002:0639a27	　若是乘船去，　　至半踰膳那；	 若 是 乘 船 去 至 半 踰 膳 那 
T24n1459_002:0639a28	　或可覆還來，　　食皆無有過。	 或 可 覆 還 來 食 皆 無 有 過 
T24n1459_002:0639a29	　若眾多施主，　　別別供苾芻；	 若 眾 多 施 主 別 別 供 苾 芻 
T24n1459_002:0639b01	　隨彼施主心，　　此謂時差別。	 隨 彼 施 主 心 此 謂 時 差 別 
T24n1459_002:0639b02	　諸外道沙門，　　彼若施僧食；	 諸 外 道 沙 門 彼 若 施 僧 食 
T24n1459_002:0639b03	　悲心應為受，　　由彼不信故。	 悲 心 應 為 受 由 彼 不 信 故 
T24n1459_002:0639b04	　界中別眾食，　　有苾芻想疑；	 界 中 別 眾 食 有 苾 芻 想 疑 
T24n1459_002:0639b05	　得罪若三人，　　食便無有過。	 得 罪 若 三 人 食 便 無 有 過 
T24n1459_002:0639b06	　有別定屬利，　　食時與眾乖；	 有 別 定 屬 利 食 時 與 眾 乖 
T24n1459_002:0639b07	　此順施主心，　　縱食非成犯。	 此 順 施 主 心 縱 食 非 成 犯 
T24n1459_002:0639b08	非時食學處	非 時 食 學 處 
T24n1459_002:0639b09	　從過中已後，　　至明相未出；	 從 過 中 已 後 至 明 相 未 出 
T24n1459_002:0639b10	　苾芻不應食，　　若食罪侵身。	 苾 芻 不 應 食 若 食 罪 侵 身 
T24n1459_002:0639b11	　有病在非時，　　醫人令遣食；	 有 病 在 非 時 醫 人 令 遣 食 
T24n1459_002:0639b12	　當於隱密處，　　無令俗見譏。	 當 於 隱 密 處 無 令 俗 見 譏 
T24n1459_002:0639b13	食曾觸食學處	食 曾 觸 食 學 處 
T24n1459_002:0639b14	　苾芻觸食等，　　此則不應飡；	 苾 芻 觸 食 等 此 則 不 應 飡 
T24n1459_002:0639b15	　食前食後殊，　　說觸有兩別。	 食 前 食 後 殊 說 觸 有 兩 別 
T24n1459_002:0639b16	　若在食前受，　　食後噉便愆；	 若 在 食 前 受 食 後 噉 便 愆 
T24n1459_002:0639b17	　若食後受持，　　夜分過不合。	 若 食 後 受 持 夜 分 過 不 合 
T24n1459_002:0639b18	　若手有雜膩，　　謂除眾難緣；	 若 手 有 雜 膩 謂 除 眾 難 緣 
T24n1459_002:0639b19	　不觸於鑰匙，　　及以觸衣鉢。	 不 觸 於 鑰 匙 及 以 觸 衣 鉢 
T24n1459_002:0639b20	不受食學處	不 受 食 學 處 
T24n1459_002:0639b21	　飲食若不受，　　怖罪者不飡；	 飲 食 若 不 受 怖 罪 者 不 飡 
T24n1459_002:0639b22	　食咽罪便傷，　　除水及齒木。	 食 咽 罪 便 傷 除 水 及 齒 木 
T24n1459_002:0639b23	　葉及淨齒木，　　有汁還須受；	 葉 及 淨 齒 木 有 汁 還 須 受 
T24n1459_002:0639b24	　若是生種者，　　仍須將火淨。	 若 是 生 種 者 仍 須 將 火 淨 
T24n1459_002:0639b25	　苾芻行乞飯，　　有餘仍未熟；	 苾 芻 行 乞 飯 有 餘 仍 未 熟 
T24n1459_002:0639b26	　宜應自煮食，　　受取取應飡。	 宜 應 自 煮 食 受 取 取 應 飡 
T24n1459_002:0639b27	　得魚肉果等，　　先煮已色變；	 得 魚 肉 果 等 先 煮 已 色 變 
T24n1459_002:0639b28	　牛乳等三沸，　　更自煮非愆。	 牛 乳 等 三 沸 更 自 煮 非 愆 
T24n1459_002:0639b29	　他人來設食，　　有事便棄去；	 他 人 來 設 食 有 事 便 棄 去 
