T26n1538_003:0520c22	又問：何因佛與緣覺於一時中不相值遇？答：	又 問 何 因 佛 與 緣 覺 於 一 時 中 不 相 值 遇 答 
T26n1538_003:0520c23	諸緣覺眾於長時中修緣覺法，勝妙果報現	諸 緣 覺 眾 於 長 時 中 修 緣 覺 法 勝 妙 果 報 現 
T26n1538_003:0520c24	前克成，無所願求，於最上法無復施作，亦不	前 克 成 無 所 願 求 於 最 上 法 無 復 施 作 亦 不 
T26n1538_003:0520c25	樂欲親近恭敬瞻覩如來。由是因故，佛與緣	樂 欲 親 近 恭 敬 瞻 覩 如 來 由 是 因 故 佛 與 緣 
T26n1538_003:0520c26	覺不同時出。	覺 不 同 時 出 
T26n1538_003:0520c27	又問：何因二轉輪王不同時出？答：轉輪聖王	又 問 何 因 二 轉 輪 王 不 同 時 出 答 轉輪聖王 
T26n1538_003:0520c28	往昔修因其事廣大，謂於長時勤修諸善，同	往 昔 修 因 其 事 廣 大 謂 於 長 時 勤 修 諸 善 同 
T26n1538_003:0520c29	一妙蓋普覆一切。一輪王出，觀諸眾生同一	一 妙 蓋 普 覆 一 切 一 輪 王 出 觀 諸 眾 生 同 一 
T26n1538_003:0521a01	子想。一輪王出，同一境界尊重供養，隨所應	子 想 一 輪 王 出 同 一 境 界 尊 重 供 養 隨 所 應 
T26n1538_003:0521a02	作一切善業，勝願果報現前克成。由是因故，	作 一 切 善 業 勝 願 果 報 現 前 克 成 由 是 因 故 
T26n1538_003:0521a03	二轉輪王不同時出。	二 轉 輪 王 不 同 時 出 
T26n1538_003:0521a04	又問：何因二佛如來、應供、正等正覺不同時	又 問 何 因 二 佛 如 來 應 供 正 等 正 覺 不 同 時 
T26n1538_003:0521a05	出？答：菩薩往昔修因其事廣大，謂於長時，唯	出 答 菩 薩 往 昔 修 因 其 事 廣 大 謂 於 長 時 唯 
T26n1538_003:0521a06	一師教、一種修習，作諸善法，隨其所作同一	一 師 教 一 種 修 習 作 諸 善 法 隨 其 所 作 同 一 
T26n1538_003:0521a07	解脫、唯一所尊、唯一大智。作諸善業，長養成	解 脫 唯 一 所 尊 唯 一 大 智 作 諸 善 業 長 養 成 
T26n1538_003:0521a08	熟，於一時中無二果報現前所起。此復云	熟 於 一 時 中 無 二 果 報 現 前 所 起 此 復 云 
T26n1538_003:0521a09	何？答：二難並故。以是因故，於一時中二佛如	何 答 二 難 並 故 以 是 因 故 於 一 時 中 二 佛 如 
T26n1538_003:0521a10	來、應供、正等正覺不同出世。	來 應 供 正 等 正 覺 不 同 出 世 
T26n1538_003:0521a11	又問：何因女人不作轉輪聖王、不成帝釋、不	又 問 何 因 女 人 不 作 轉輪聖王 不 成 帝 釋 不 
T26n1538_003:0521a12	成梵王、不成魔王、不證緣覺菩提、不證無上	成 梵 王 不 成 魔 王 不 證 緣 覺 菩 提 不 證 無 上 
T26n1538_003:0521a13	正等菩提？答：謂諸女人善力劣弱，男子勝善	正等菩提 答 謂 諸 女 人 善 力 劣 弱 男 子 勝 善 
T26n1538_003:0521a14	樂欲根力之所建立，以其極生善欲心故。女	樂 欲 根 力 之 所 建 立 以 其 極 生 善 欲 心 故 女 
T26n1538_003:0521a15	無勢力，皆是男子善業因作。又復女人無其	無 勢 力 皆 是 男 子 善 業 因 作 又 復 女 人 無 其 
T26n1538_003:0521a16	利根，唯彼男子善力成故。又彼男子善力增	利 根 唯 彼 男 子 善 力 成 故 又 彼 男 子 善 力 增 
T26n1538_003:0521a17	極，乃能獲得利根勝業。以如是因故，女人不	極 乃 能 獲 得 利 根 勝 業 以 如 是 因 故 女 人 不 
T26n1538_003:0521a18	作轉輪聖王、不成帝釋、不成梵王、不成魔王、	作 轉輪聖王 不 成 帝 釋 不 成 梵 王 不 成 魔 王 
T26n1538_003:0521a19	不證緣覺菩提、不證無上正等菩提。	不 證 緣 覺 菩 提 不 證無上正等菩提 
T26n1538_003:0521a20	又問：何因佛世尊者具無邊智、具無邊慧無	又 問 何 因 佛 世 尊 者 具 無 邊 智 具 無 邊 慧 無 
T26n1538_003:0521a21	邊辯才？答菩薩長時於其三慧親近修習廣	邊 辯 才 答 菩 薩 長 時 於 其 三 慧 親近修習 廣 
T26n1538_003:0521a22	多施作，謂聞所成慧、思所成慧、修所成慧，增	多 施 作 謂 聞所成慧 思所成慧 修所成慧 增 
T26n1538_003:0521a23	極勤勇。以如是因故，佛世尊具無邊智慧無	極 勤 勇 以 如 是 因 故 佛 世 尊 具 無 邊 智 慧 無 
T26n1538_003:0521a24	邊辯才。	邊 辯 才 
T26n1538_003:0521a25	又問：何因佛世尊出清淨妙音，普聞三千大	又 問 何 因 佛 世 尊 出 清 淨 妙 音 普 聞 三 千 大 
T26n1538_003:0521a26	千世界悉令曉了？答：以佛世尊成道未久，住	千 世 界 悉 令 曉 了 答 以 佛 世 尊 成 道 未 久 住 
T26n1538_003:0521a27	梵界已，普令親近得聞解脫。頌句	梵 界 已 普 令 親 近 得 聞 解 脫 頌 句 
T26n1538_003:0521a28	頌曰：	頌 曰 
T26n1538_003:0521a29	「安住諸佛正教中，　　發起精進求出離，	 安 住 諸 佛 正 教 中 發起精進 求 出 離 
T26n1538_003:0521b01	　能破生死大力軍，　　猶如狂象在草舍。	 能 破 生 死 大 力 軍 猶 如 狂 象 在 草 舍 
T26n1538_003:0521b02	　今此清淨正法律，　　不放逸心善所行，	 今 此 清 淨 正 法 律 不 放 逸 心 善 所 行 
T26n1538_003:0521b03	　即能斷滅生死輪，　　乃盡一切苦邊際。」	 即 能 斷 滅 生 死 輪 乃 盡 一 切 苦 邊 際 
T26n1538_003:0521b04	如是頌句，一一世界、一一眾生普皆得聞，分	如 是 頌 句 一 一 世 界 一 一 眾 生 普 皆 得 聞 分 
T26n1538_003:0521b05	明曉了。此是如來清淨妙音，普聞三千大千	明 曉 了 此 是 如 來 清 淨 妙 音 普 聞 三千大千 
T26n1538_003:0521b06	世界。	世 界 
T26n1538_003:0521b07	施設論卷第三	施 設 論 卷 第 三 
T26n1538_004:0521b10	施設論卷第四	施 設 論 卷 第 四 
T26n1538_004:0521b12	譯經三藏朝散大夫試光祿卿	譯 經 三 藏 朝 散 大 夫 試 光 祿 卿 
T26n1538_004:0521b13	光梵大師賜紫沙門臣惟淨等	光 梵 大 師 賜 紫 沙 門 臣 惟 淨 等 
T26n1538_004:0521b14	奉　詔譯	奉 詔 譯 
T26n1538_004:0521b15	對法大論中因施設門第六之二	對 法 大 論 中 因 施 設 門 第 六 之 二 
T26n1538_004:0521b16	論中問曰：有何所因而能了知正覺世尊於	論 中 問 曰 有 何 所 因 而 能 了 知 正 覺 世 尊 於 
T26n1538_004:0521b17	諸眾生大悲超勝：答：世尊為見世間眾生染	諸 眾 生 大 悲 超 勝 答 世 尊 為 見 世 間 眾 生 染 
T26n1538_004:0521b18	煩惱病、煩惱逼迫，種種煩惱而生損害，無救	煩 惱 病 煩 惱 逼 迫 種種煩惱 而 生 損 害 無 救 
T26n1538_004:0521b19	無歸、無所趣向。以如是因故，世尊不久乃成	無 歸 無 所 趣 向 以 如 是 因 故 世 尊 不 久 乃 成 
T26n1538_004:0521b20	正覺，為諸眾生而作救度，是故大悲超勝。	正 覺 為 諸 眾 生 而 作 救 度 是 故 大 悲 超 勝 
T26n1538_004:0521b21	又問：何因菩薩入慈心定時，而菩薩身火不	又 問 何 因 菩 薩 入 慈 心 定 時 而 菩 薩 身 火 不 
T26n1538_004:0521b22	能燒、水不能溺、刀杖不傷、毒不能害，復無	能 燒 水 不 能 溺 刀 杖 不 傷 毒 不 能 害 復 無 
T26n1538_004:0521b23	中間趣滅？答：無惱害定，無定所入。無彼無惱	中 間 趣 滅 答 無 惱 害 定 無 定 所 入 無 彼 無 惱 
T26n1538_004:0521b24	害觸亦無，不同分心趣滅。以如是因故，菩薩	害 觸 亦 無 不同分心 趣 滅 以 如 是 因 故 菩 薩 
T26n1538_004:0521b25	入慈心定時，水火刀杖毒不能害，復無中間	入 慈 心 定 時 水 火 刀 杖 毒 不 能 害 復 無 中 間 
T26n1538_004:0521b26	趣滅。	趣 滅 
T26n1538_004:0521b27	又問：何因入無想定及滅盡定時，水火刀杖	又 問 何 因 入無想定 及 滅 盡 定 時 水 火 刀 杖 
T26n1538_004:0521b28	毒不能害，復無中間趣滅？答：無惱害定，無定	毒 不 能 害 復 無 中 間 趣 滅 答 無 惱 害 定 無 定 
T26n1538_004:0521b29	所入，亦無無惱害之觸、無心趣滅。由此因故，	所 入 亦 無 無 惱 害 之 觸 無 心 趣 滅 由 此 因 故 
T26n1538_004:0521c01	其事如是。	其 事 如 是 
T26n1538_004:0521c02	又問：何因菩薩在母胎時，而菩薩母不為水	又 問 何 因 菩 薩 在 母 胎 時 而 菩 薩 母 不 為 水 
T26n1538_004:0521c03	火刀杖毒所惱害，亦無中間趣滅。答：菩薩大	火 刀 杖 毒 所 惱 害 亦 無 中 間 趣 滅 答 菩 薩 大 
T26n1538_004:0521c04	威力故。以其菩薩勝力，令菩薩母無諸惱	威 力 故 以 其 菩 薩 勝 力 令 菩 薩 母 無 諸 惱 
T26n1538_004:0521c05	害。	害 
T26n1538_004:0521c06	又問：何因菩薩之身無水火刀杖毒所惱害，	又 問 何 因 菩 薩 之 身 無 水 火 刀 杖 毒 所 惱 害 
T26n1538_004:0521c07	亦無中間趣滅。答：菩薩於一切眾生中而得	亦 無 中 間 趣 滅 答 菩 薩 於 一 切 眾 生 中 而 得 
T26n1538_004:0521c08	最勝，設於同等類中亦復最勝。	最 勝 設 於 同 等 類 中 亦 復 最 勝 
T26n1538_004:0521c09	又問：何因彼焰摩王身，無水火刀杖等害，	又 問 何 因 彼 焰 摩 王 身 無 水 火 刀 杖 等 害 
T26n1538_004:0521c10	亦無中間趣滅？答：焰摩王者，於焰摩界眾生	亦 無 中 間 趣 滅 答 焰 摩 王 者 於 焰 摩 界 眾 生 
T26n1538_004:0521c11	類中而得最勝。由此因故，其事如是。	類 中 而 得 最 勝 由 此 因 故 其 事 如 是 
T26n1538_004:0521c12	又問：何因愛囉嚩拏象王及善住象王，身無	又 問 何 因 愛 囉 嚩 拏 象 王 及 善 住 象 王 身 無 
T26n1538_004:0521c13	水火刀杖等害，亦無中間趣滅。答：彼於傍生	水 火 刀 杖 等 害 亦 無 中 間 趣 滅 答 彼 於 傍 生 
T26n1538_004:0521c14	類中而得最勝，出諸趣類。由此因故，其事如	類 中 而 得 最 勝 出 諸 趣 類 由 此 因 故 其 事 如 
T26n1538_004:0521c15	最。	最 
T26n1538_004:0521c16	又問：何因地獄趣中諸眾生類受極苦楚，而	又 問 何 因 地 獄 趣 中 諸 眾 生 類 受 極 苦 楚 而 
T26n1538_004:0521c17	無中間趣滅。答：業報熾然故，以其苦受業報	無 中 間 趣 滅 答 業 報 熾 然 故 以 其 苦 受 業 報 
T26n1538_004:0521c18	未盡。由此因故，其事如是。	未 盡 由 此 因 故 其 事 如 是 
T26n1538_004:0521c19	對法大論中因施設門第七	對 法 大 論 中 因 施 設 門 第 七 
T26n1538_004:0521c20	復次一時佛在舍衛國，告苾芻眾言：「苾芻當	復 次 一 時 佛 在 舍 衛 國 告 苾 芻 眾 言 苾 芻 當 
T26n1538_004:0521c21	知，有三種法，為內垢染、內含藏、內怨惡。何	知 有 三 種 法 為 內 垢 染 內 含 藏 內 怨 惡 何 
T26n1538_004:0521c22	等為三？謂貪、瞋、癡。諸苾芻，此中云何名內垢	等 為 三 謂 貪 瞋 癡 諸 苾 芻 此 中 云 何 名 內 垢 
T26n1538_004:0521c23	染、內含藏、內怨惡？謂若有人，惡友所作，侵他	染 內 含 藏 內 怨 惡 謂 若 有 人 惡 友 所 作 侵 他 
T26n1538_004:0521c24	受用及諸種類，乃至害命。以其貪愛增盛，於	受 用 及 諸 種 類 乃 至 害 命 以 其 貪 愛 增 盛 於 
T26n1538_004:0521c25	身口意廣行諸惡。行諸惡已，由此因緣，身壞	身 口 意 廣 行 諸 惡 行 諸 惡 已 由此因緣 身 壞 
T26n1538_004:0521c26	命終墮於惡趣地獄中。生瞋、癡亦然。諸苾芻，	命 終 墮於惡趣 地 獄 中 生 瞋 癡 亦 然 諸 苾 芻 
T26n1538_004:0521c27	是故貪、瞋、癡法，名內垢染、內含藏、內怨惡。」	是 故 貪 瞋 癡 法 名 內 垢 染 內 含 藏 內 怨 惡 
T26n1538_004:0521c28	世尊善逝如是說已。	世 尊 善 逝 如 是 說 已 
T26n1538_004:0521c29	復次總略而說頌曰：	復 次 總 略 而 說 頌 曰 
T26n1538_004:0522a01	「不能了知貪愛法，　　於貪愛法不諦觀，	 不 能 了 知 貪 愛 法 於 貪 愛 法 不 諦 觀 
T26n1538_004:0522a02	　是人與其貪愛俱，　　彼即入於黑暗處。	 是 人 與 其 貪 愛 俱 彼 即 入 於 黑 暗 處 
T26n1538_004:0522a03	　貪染之人無義利，　　由貪染心生愛著，	 貪 染 之 人 無 義 利 由 貪 染 心 生 愛 著 
T26n1538_004:0522a04	　中間生起怖畏心，　　當知彼人不覺了。	 中 間 生 起 怖 畏 心 當 知 彼 人 不 覺 了 
T26n1538_004:0522a05	　若能斷除於貪愛，　　彼即愛塵不能染，	 若 能 斷 除 於 貪 愛 彼 即 愛 塵 不 能 染 
T26n1538_004:0522a06	　由其貪愛不轉時，　　如蓮不住於渧水。	 由 其 貪 愛 不 轉 時 如 蓮 不 住 於 渧 水 
T26n1538_004:0522a07	　不能了知瞋恚法，　　於瞋恚法不諦觀，	 不 能 了 知 瞋 恚 法 於 瞋 恚 法 不 諦 觀 
T26n1538_004:0522a08	　是人與其瞋恚俱，　　彼即入於黑暗處。	 是 人 與 其 瞋 恚 俱 彼 即 入 於 黑 暗 處 
T26n1538_004:0522a09	　瞋恚之人無義利，　　由瞋恚心生過失，	 瞋 恚 之 人 無 義 利 由 瞋 恚 心 生 過 失 
T26n1538_004:0522a10	　中間生起怖畏心，　　當知彼人不覺了。	 中 間 生 起 怖 畏 心 當 知 彼 人 不 覺 了 
T26n1538_004:0522a11	　若能斷除於瞋恚，　　即於瞋境不生瞋，	 若 能 斷 除 於 瞋 恚 即 於 瞋 境 不 生 瞋 
T26n1538_004:0522a12	　由其瞋法墜墮時，　　如彼果熟而自落。	 由 其 瞋 法 墜 墮 時 如 彼 果 熟 而 自 落 
T26n1538_004:0522a13	　不能了知癡冥法，　　於癡冥法不諦觀，	 不 能 了 知 癡 冥 法 於 癡 冥 法 不 諦 觀 
T26n1538_004:0522a14	　是人與其癡冥俱，　　彼即入於黑暗處。	 是 人 與 其 癡 冥 俱 彼 即 入 於 黑 暗 處 
T26n1538_004:0522a15	　癡冥之人無義利，　　由癡暗心故癡迷，	 癡 冥 之 人 無 義 利 由 癡 暗 心 故 癡 迷 
T26n1538_004:0522a16	　中間生起怖畏心，　　當知彼人不覺了。	 中 間 生 起 怖 畏 心 當 知 彼 人 不 覺 了 
T26n1538_004:0522a17	　若能斷除癡冥者，　　不為癡境所癡迷，	 若 能 斷 除 癡 冥 者 不 為 癡 境 所 癡 迷 
T26n1538_004:0522a18	　彼癡冥法若破時，　　其猶日光破諸暗。	 彼 癡 冥 法 若 破 時 其 猶 日 光 破 諸 暗 
T26n1538_004:0522a19	　若能了知此三法，　　決定不墮於惡趣，	 若 能 了 知 此 三 法 決 定 不 墮於惡趣 
T26n1538_004:0522a20	　如斷多羅大樹心，　　彼所斷已不復生。	 如 斷 多 羅 大 樹 心 彼 所 斷 已 不 復 生 
T26n1538_004:0522a21	　是故貪法及瞋法，　　癡等三法皆離著，	 是 故 貪 法 及 瞋 法 癡 等 三 法 皆 離 著 
T26n1538_004:0522a22	　行人明慧發生時，　　即能盡於苦邊際。」	 行 人 明 慧 發 生 時 即 能 盡 於 苦 邊 際 
T26n1538_004:0522a23	又問：何因有極貪者？答：謂若有人於貪不善	又 問 何 因 有 極 貪 者 答 謂 若 有 人 於 貪 不 善 
T26n1538_004:0522a24	根中近習修作，於無貪善根中不近習修作。	根 中 近 習 修 作 於 無貪善根 中 不 近 習 修 作 
T26n1538_004:0522a25	於其欲想、欲因、欲尋而乃近習亦復修作，於	於 其 欲 想 欲 因 欲 尋 而 乃 近 習 亦 復 修 作 於 
T26n1538_004:0522a26	出離想、出離因、出離尋不能修作。於諸世間	出 離 想 出 離 因 出 離 尋 不 能 修 作 於 諸 世 間 
T26n1538_004:0522a27	莊嚴受用，以愛著心勤行修作，於不莊嚴受	莊 嚴 受 用 以 愛 著 心 勤 行 修 作 於 不 莊 嚴 受 
T26n1538_004:0522a28	用不勤修作。於諸善法所應作處而不能作，	用 不 勤 修 作 於 諸 善 法 所 應 作 處 而 不 能 作 
T26n1538_004:0522a29	復不思惟、不修三摩地行，不能守護諸根隱	復 不 思 惟 不 修 三 摩 地 行 不 能 守 護 諸 根 隱 
T26n1538_004:0522b01	密之門，食不知量，初夜後夜常不睡眠勤行	密 之 門 食 不 知 量 初夜後夜 常 不 睡 眠 勤 行 
T26n1538_004:0522b02	諸惡，不修奢摩他、毘鉢舍那，於不如理作意	諸 惡 不 修奢摩他 毘 鉢 舍 那 於 不如理作意 
T26n1538_004:0522b03	中而乃修作。此等之人，故極貪愛。至謝滅	中 而 乃 修 作 此 等 之 人 故 極 貪 愛 至 謝 滅 
T26n1538_004:0522b04	已當復云何？謂作歌舞倡伎戲笑之人，及為	已 當 復 云 何 謂 作 歌舞倡伎 戲 笑 之 人 及 為 
T26n1538_004:0522b05	女人。設得生天，即生欲界天中。由此因故，其	女 人 設 得 生 天 即 生 欲 界 天 中 由 此 因 故 其 
T26n1538_004:0522b06	事如是。	事 如 是 
T26n1538_004:0522b07	又問：何因有極瞋者？答：謂若有人於瞋不善	又 問 何 因 有 極 瞋 者 答 謂 若 有 人 於 瞋 不 善 
T26n1538_004:0522b08	根中近習修作，於無瞋善根中不近習修作，	根 中 近 習 修 作 於 無瞋善根 中 不 近 習 修 作 
T26n1538_004:0522b09	於其瞋想、瞋因、瞋尋而乃近習亦復修作，於	於 其 瞋 想 瞋 因 瞋 尋 而 乃 近 習 亦 復 修 作 於 
T26n1538_004:0522b10	不瞋想、不瞋因、不瞋尋不能修作。於非處起	不 瞋 想 不 瞋 因 不 瞋 尋 不 能 修 作 於 非 處 起 
T26n1538_004:0522b11	瞋勤行修作，於慈心三摩地不能修作。於殺	瞋 勤 行 修 作 於 慈 心 三 摩 地 不 能 修 作 於 殺 
T26n1538_004:0522b12	害事勤行修作，於不殺害事不能修作。於彼	害 事 勤 行 修 作 於 不 殺 害 事 不 能 修 作 於 彼 
T26n1538_004:0522b13	諸根隱密之門不能守護，食不知量，初夜後	諸 根 隱 密 之 門 不 能 守 護 食 不 知 量 初 夜 後 
T26n1538_004:0522b14	夜常不睡眠勤行諸惡，不修奢摩他、毘鉢舍	夜 常 不 睡 眠 勤 行 諸 惡 不 修奢摩他 毘 鉢 舍 
T26n1538_004:0522b15	那，於不如理作意中而乃修作。此等之人，	那 於 不如理作意 中 而 乃 修 作 此 等 之 人 
T26n1538_004:0522b16	故極瞋恚。至謝滅已，當復云何？謂作蝎蜂、三	故 極 瞋 恚 至 謝 滅 已 當 復 云 何 謂 作 蝎 蜂 三 
T26n1538_004:0522b17	目蟲、百足蟲等。由此因故，其事如是。	目 蟲 百 足 蟲 等 由 此 因 故 其 事 如 是 
T26n1538_004:0522b18	又問：何因有極癡者？答：謂若有人於癡不	又 問 何 因 有 極 癡 者 答 謂 若 有 人 於 癡 不 
T26n1538_004:0522b19	善根中近習修作，於無癡善根中不近習修	善 根 中 近 習 修 作 於 無癡善根 中 不 近 習 修 
T26n1538_004:0522b20	作。於其害想、害因、害尋而乃近習亦復修作，	作 於 其 害 想 害 因 害 尋 而 乃 近 習 亦 復 修 作 
T26n1538_004:0522b21	於不害想、不害因、不害尋不能修作。於諸見	於 不 害 想 不 害 因 不 害 尋 不 能 修 作 於 諸 見 
T26n1538_004:0522b22	中而常修作，及於怪異不祥等事亦復修作。	中 而 常 修 作 及 於 怪 異 不 祥 等 事 亦 復 修 作 
T26n1538_004:0522b23	由是緣故，而不能於緣生法門內心伺察，不	由 是 緣 故 而 不 能 於 緣 生 法 門 內 心 伺 察 不 
T26n1538_004:0522b24	能於五取蘊中諦觀生滅無常之行，所謂此法	能 於 五 取 蘊 中 諦 觀 生 滅 無 常 之 行 所 謂 此 法 
T26n1538_004:0522b25	是色所成、是色所集、從色所滅。如是受想行	是 色 所 成 是 色 所 集 從 色 所 滅 如 是 受 想 行 
T26n1538_004:0522b26	識所成，是識所集、從識所滅。此人於諸根隱	識 所 成 是 識 所 集 從 識 所 滅 此 人 於 諸 根 隱 
T26n1538_004:0522b27	密之門不能守護，食不知量，初夜後夜常不	密 之 門 不 能 守 護 食 不 知 量 初夜後夜 常 不 
T26n1538_004:0522b28	睡眠勤行諸惡，不修奢摩他、毘鉢舍那，於不	睡 眠 勤 行 諸 惡 不 修奢摩他 毘 鉢 舍 那 於 不 
T26n1538_004:0522b29	如理作意中而乃修作。此等之人，故極癡冥。	如理作意 中 而 乃 修 作 此 等 之 人 故 極 癡 冥 
T26n1538_004:0522c01	至謝滅已，當復云何，謂作象馬駝驢、羊鹿牛	至 謝 滅 已 當 復 云 何 謂 作 象 馬 駝 驢 羊 鹿 牛 
T26n1538_004:0522c02	及猪等。由此因故，其事如是。	及 猪 等 由 此 因 故 其 事 如 是 
T26n1538_004:0522c03	又問：何因有不極貪者？答：謂若有人於無貪	又 問 何 因 有 不 極 貪 者 答 謂 若 有 人 於 無 貪 
T26n1538_004:0522c04	善根中近習修作，於貪不善根中不近習	善 根 中 近 習 修 作 於 貪 不 善 根 中 不 近 習 
T26n1538_004:0522c05	修作。於出離想、出離因、出離尋而乃近習亦	修 作 於 出 離 想 出 離 因 出 離 尋 而 乃 近 習 亦 
T26n1538_004:0522c06	復修作，於其欲想、欲因、欲尋不勤修作。於諸	復 修 作 於 其 欲 想 欲 因 欲 尋 不 勤 修 作 於 諸 
T26n1538_004:0522c07	世間不莊嚴受用勤行修作，於莊嚴受用不	世 間 不 莊 嚴 受 用 勤 行 修 作 於 莊 嚴 受 用 不 
T26n1538_004:0522c08	勤修作。於諸善法常所思惟，於三摩地勤行	勤 修 作 於 諸 善 法 常 所 思 惟 於 三 摩 地 勤 行 
T26n1538_004:0522c09	修作，於不善法而不修作。守護諸根隱密之	修 作 於 不 善 法 而 不 修 作 守 護 諸 根 隱 密 之 
T26n1538_004:0522c10	門，飲食知量，初夜後夜常不睡眠勤行諸	門 飲 食 知 量 初夜後夜 常 不 睡 眠 勤 行 諸 
T26n1538_004:0522c11	善，修奢摩他，毘鉢舍那，於如理作意中勤行	善 修奢摩他 毘 鉢 舍 那 於 如理作意 中 勤 行 
T26n1538_004:0522c12	修作，於不如理作意中而不修作。此等之人，	修 作 於 不如理作意 中 而 不 修 作 此 等 之 人 
T26n1538_004:0522c13	不極貪愛。至謝滅已，當復云何？謂作仙人及	不 極 貪 愛 至 謝 滅 已 當 復 云 何 謂 作 仙 人 及 
T26n1538_004:0522c14	出家人、諸長者等，或生色界天中。由此因故，	出 家 人 諸 長 者 等 或 生 色 界 天 中 由 此 因 故 
T26n1538_004:0522c15	其事如是。	其 事 如 是 
T26n1538_004:0522c16	又問：何因有不極瞋者：答：謂若有人於無瞋	又 問 何 因 有 不 極 瞋 者 答 謂 若 有 人 於 無 瞋 
T26n1538_004:0522c17	善根中近習修作，於瞋不善根中不近習修	善 根 中 近 習 修 作 於 瞋 不 善 根 中 不 近 習 修 
T26n1538_004:0522c18	作。於無瞋想、無瞋因、無瞋尋而乃近習亦復	作 於 無 瞋 想 無 瞋 因 無 瞋 尋 而 乃 近 習 亦 復 
T26n1538_004:0522c19	修作，於其瞋想、瞋因、瞋尋不勤修作。常修慈	修 作 於 其 瞋 想 瞋 因 瞋 尋 不 勤 修 作 常 修 慈 
T26n1538_004:0522c20	心三摩地行，於非處起瞋而亦不作。於不害	心 三 摩 地 行 於 非 處 起 瞋 而 亦 不 作 於 不 害 
T26n1538_004:0522c21	法勤行修作，於損害法而不修作。守護諸	法 勤 行 修 作 於 損 害 法 而 不 修 作 守 護 諸 
T26n1538_004:0522c22	根隱密之門，飲食知量，初夜後夜常不睡眠	根 隱 密 之 門 飲 食 知 量 初夜後夜 常 不 睡 眠 
T26n1538_004:0522c23	勤行諸善，修奢摩他、毘鉢舍那，於如理作意	勤 行 諸 善 修奢摩他 毘 鉢 舍 那 於 如理作意 
T26n1538_004:0522c24	中勤行修作，於不如理作意中而不修作。此	中 勤 行 修 作 於 不如理作意 中 而 不 修 作 此 
T26n1538_004:0522c25	等之人，不極瞋恚。至滅謝已，當復云何？謂作	等 之 人 不 極 瞋 恚 至 滅 謝 已 當 復 云 何 謂 作 
T26n1538_004:0522c26	仙人及出家人、諸長者等，或生色界天中。由	仙 人 及 出 家 人 諸 長 者 等 或 生 色 界 天 中 由 
T26n1538_004:0522c27	此因故，其事如是。	此 因 故 其 事 如 是 
T26n1538_004:0522c28	又問：何因有不極癡者？答：謂若有人於無	又 問 何 因 有 不 極 癡 者 答 謂 若 有 人 於 無 
T26n1538_004:0522c29	癡善根中近習修作，於癡不善根中不近習修	癡 善 根 中 近 習 修 作 於 癡 不 善 根 中 不 近 習 修 
T26n1538_004:0523a01	作。於無害想、無害因、無害尋而乃近習亦復	作 於 無 害 想 無 害 因 無 害 尋 而 乃 近 習 亦 復 
T26n1538_004:0523a02	修作，於諸見中及怪異不祥等事悉不修作。	修 作 於 諸 見 中 及 怪 異 不 祥 等 事 悉 不 修 作 
T26n1538_004:0523a03	以是緣故，而於緣生法門內心伺察，於五取	以 是 緣 故 而 於 緣 生 法 門 內 心 伺 察 於 五 取 
T26n1538_004:0523a04	蘊中諦觀生滅無常之行，所謂此法是色所	蘊 中 諦 觀 生 滅 無 常 之 行 所 謂 此 法 是 色 所 
T26n1538_004:0523a05	成，是色所集，從色所滅。如是受想行識所成，	成 是 色 所 集 從 色 所 滅 如 是 受 想 行 識 所 成 
T26n1538_004:0523a06	是識所集、從識所滅。此人於諸根隱密之門	是 識 所 集 從 識 所 滅 此 人 於 諸 根 隱 密 之 門 
T26n1538_004:0523a07	而常守護，飲食知量，初夜後夜常不睡眠勤	而 常 守 護 飲 食 知 量 初夜後夜 常 不 睡 眠 勤 
T26n1538_004:0523a08	行諸善，修奢摩他、毘鉢舍那，於如理作意中	行 諸 善 修奢摩他 毘 鉢 舍 那 於 如理作意 中 
T26n1538_004:0523a09	勤行修作。此等之人，不極癡冥。至謝滅已，當	勤 行 修 作 此 等 之 人 不 極 癡 冥 至 謝 滅 已 當 
T26n1538_004:0523a10	復云何，謂作仙人及出家人、諸長者等，或生	復 云 何 謂 作 仙 人 及 出 家 人 諸 長 者 等 或 生 
T26n1538_004:0523a11	色、無色界天中。由此因故，其事如是。	色 無 色 界 天 中 由 此 因 故 其 事 如 是 
