T26n1538_002:0518c03	所攝：一、天壽命；二、天色相；三、天名稱。菩薩作	所 攝 一 天 壽 命 二 天 色 相 三 天 名 稱 菩 薩 作 
T26n1538_002:0518c04	是念時，兜率陀天諸天子眾悉知菩薩決定	是 念 時 兜 率 陀 天 諸 天 子 眾 悉 知 菩 薩 決 定 
T26n1538_002:0518c05	當成如來、應供、正等正覺。以是緣故，皆生恭	當 成 如 來 應 供 正 等 正 覺 以 是 緣 故 皆 生 恭 
T26n1538_002:0518c06	敬尊重供養，正念具足、親近修習、廣多施作。	敬 尊 重 供 養 正 念 具 足 親近修習 廣 多 施 作 
T26n1538_002:0518c07	乃至菩薩隨彼天子壽量而住，正念具足、親	乃 至 菩 薩 隨 彼 天 子 壽 量 而 住 正 念 具 足 親 
T26n1538_002:0518c08	近修習、廣多施作，菩薩即能了知入母胎事。	近 修 習 廣 多 施 作 菩 薩 即 能 了 知 入 母 胎 事 
T26n1538_002:0518c09	又作是念：「我當得成如來、應供、正等正覺已，	又 作 是 念 我 當 得 成 如 來 應 供 正 等 正 覺 已 
T26n1538_002:0518c10	正念具足、親近修習、廣多施作。」菩薩即能了	正 念 具 足 親近修習 廣 多 施 作 菩 薩 即 能 了 
T26n1538_002:0518c11	知出母胎事。住胎亦然。	知 出 母 胎 事 住 胎 亦 然 
T26n1538_002:0518c12	如經所說，佛告尊者阿難言：「我念往昔，於彼	如 經 所 說 佛 告 尊 者 阿 難 言 我 念 往 昔 於 彼 
T26n1538_002:0518c13	迦葉如來、應供、正等正覺法中，最初為菩提	迦 葉 如 來 應 供 正 等 正 覺 法 中 最 初 為 菩 提 
T26n1538_002:0518c14	故，勤修梵行、正念具足、親近修習、廣多施作，	故 勤 修 梵 行 正 念 具 足 親近修習 廣 多 施 作 
T26n1538_002:0518c15	發大誓願：『願我當成如來、應供、正等正覺已，	發 大 誓 願 願 我 當 成 如 來 應 供 正 等 正 覺 已 
T26n1538_002:0518c16	所有世間癡暗眾生、無救護者、無歸向者，廣	所 有 世 間 癡 暗 眾 生 無 救 護 者 無 歸 向 者 廣 
T26n1538_002:0518c17	為化度。』以是因故，我於迦葉如來法中，最初	為 化 度 以 是 因 故 我 於 迦 葉 如 來 法 中 最 初 
T26n1538_002:0518c18	為菩提故，修梵行已，得生兜率陀天。生彼天	為 菩 提 故 修 梵 行 已 得 生 兜 率 陀 天 生 彼 天 
T26n1538_002:0518c19	已，乃至得彼天中三事所攝，即作是念：『我當	已 乃 至 得 彼 天 中 三 事 所 攝 即 作 是 念 我 當 
T26n1538_002:0518c20	成正覺已，正念具足、修習施作。』以是因故，作	成 正 覺 已 正 念 具 足 修 習 施 作 以 是 因 故 作 
T26n1538_002:0518c21	是念時，彼天子眾悉知菩薩當成正覺，皆生	是 念 時 彼 天 子 眾 悉 知 菩 薩 當 成 正 覺 皆 生 
T26n1538_002:0518c22	恭敬尊重供養，正念具足、修習施作。以是緣	恭 敬 尊 重 供 養 正 念 具 足 修 習 施 作 以 是 緣 
T26n1538_002:0518c23	故，乃至菩薩隨彼天子壽量而住，修習施作，	故 乃 至 菩 薩 隨 彼 天 子 壽 量 而 住 修 習 施 作 
T26n1538_002:0518c24	菩薩即能了知從兜率天宮歿已入母胎事。	菩 薩 即 能 了 知 從 兜率天宮 歿 已 入 母 胎 事 
T26n1538_002:0518c25	又作是念：『我當成正覺已，正念具足、修習施	又 作 是 念 我 當 成 正 覺 已 正 念 具 足 修 習 施 
T26n1538_002:0518c26	作。』菩薩即能了知住母胎事。菩薩又作是念：	作 菩 薩 即 能 了 知 住 母 胎 事 菩 薩 又 作 是 念 
T26n1538_002:0518c27	『我當成正覺已，正念具足、修習施作。』即能了	 我 當 成 正 覺 已 正 念 具 足 修 習 施 作 即 能 了 
T26n1538_002:0518c28	知出母胎事。	知 出 母 胎 事 
T26n1538_002:0518c29	「復次阿難！我以正念具足、修習施作故，未久	 復 次 阿 難 我 以 正 念 具 足 修 習 施 作 故 未 久 
T26n1538_002:0519a01	之間出母胎藏即行七步。	之 間 出 母 胎 藏 即 行 七 步 
T26n1538_002:0519a02	「阿難當知！此如是等，一一皆是我昔思念，	 阿 難 當 知 此 如 是 等 一 一 皆 是 我 昔 思 念 
T26n1538_002:0519a03	當成如來、應供、正等正覺已，廣為眾生宣說	當 成 如 來 應 供 正 等 正 覺 已 廣 為 眾 生 宣 說 
T26n1538_002:0519a04	七覺支法。此是菩薩先現瑞相。」	七 覺 支 法 此 是 菩 薩 先 現 瑞 相 
T26n1538_002:0519a05	施設論卷第二	施 設 論 卷 第 二 
T26n1538_003:0519a08	施設論卷第三	施 設 論 卷 第 三 
T26n1538_003:0519a10	西天譯經三藏朝散大夫	西 天 譯 經 三 藏 朝 散 大 夫 
T26n1538_003:0519a11	試光祿卿傳梵大師賜紫	試 光 祿 卿 傳 梵 大 師 賜 紫 
T26n1538_003:0519a12	沙門臣法護等奉　詔譯	沙 門 臣 法 護 等 奉 詔 譯 
T26n1538_003:0519a13	對法大論中因施設門第四之二	對 法 大 論 中 因 施 設 門 第 四 之 二 
T26n1538_003:0519a14	「又復阿難！我出母胎未久之間，即觀四方，乃	 又 復 阿 難 我 出 母 胎 未 久 之 間 即 觀 四 方 乃 
T26n1538_003:0519a15	作是念：『我當得成如來、應供、正等正覺已，當	作 是 念 我 當 得 成 如 來 應 供 正 等 正 覺 已 當 
T26n1538_003:0519a16	為眾生演說四聖諦法。』此是菩薩先現瑞相。	為 眾 生 演 說 四 聖 諦 法 此 是 菩 薩 先 現 瑞 相 
T26n1538_003:0519a17	「又復阿難！我出胎未久，即作是言：『今我此身	 又 復 阿 難 我 出 胎 未 久 即 作 是 言 今 我 此 身 
T26n1538_003:0519a18	是邊際生。』乃作是念：『我當得成如來、應供、正	是 邊 際 生 乃 作 是 念 我 當 得 成 如 來 應 供 正 
T26n1538_003:0519a19	等正覺已，當為一切眾生普盡生死邊際。』此	等 正 覺 已 當 為 一 切 眾 生 普 盡 生 死 邊 際 此 
T26n1538_003:0519a20	是菩薩先現瑞相。	是 菩 薩 先 現 瑞 相 
T26n1538_003:0519a21	「又復阿難！我出胎未久，空中自然雨眾天花，	 又 復 阿 難 我 出 胎 未 久 空 中 自 然 雨 眾 天 花 
T26n1538_003:0519a22	謂優鉢羅花、俱母陀花、鉢訥摩花、奔拏利	謂 優 鉢 羅 花 俱 母 陀 花 鉢 訥 摩 花 奔 拏 利 
T26n1538_003:0519a23	伽花等。又雨眾妙沈水薰陸、旃檀香粖及散	伽 花 等 又 雨 眾 妙 沈 水 薰 陸 旃 檀 香 粖 及 散 
T26n1538_003:0519a24	天花。乃作是念：『我當得成如來、應供、正等正	天 花 乃 作 是 念 我 當 得 成 如 來 應 供 正 等 正 
T26n1538_003:0519a25	覺已，具大智慧、具大福德，飲食衣服、床座	覺 已 具 大 智 慧 具 大 福 德 飲 食 衣 服 床 座 
T26n1538_003:0519a26	醫藥諸受用具悉皆豐足。』此是菩薩先現瑞	醫 藥 諸 受 用 具 悉 皆 豐 足 此 是 菩 薩 先 現 瑞 
T26n1538_003:0519a27	相。	相 
T26n1538_003:0519a28	「又復阿難！我出胎未久，空中自然奏天音樂。	 又 復 阿 難 我 出 胎 未 久 空 中 自 然 奏 天 音 樂 
T26n1538_003:0519a29	乃作是念：『我當得成如來、應供、正等正覺已、	乃 作 是 念 我 當 得 成 如 來 應 供 正 等 正 覺 已 
T26n1538_003:0519b01	聲聞十方。』	聲 聞 十 方 
T26n1538_003:0519b02	「又復阿難！我昔宮中，與諸宮屬同處床座。	 又 復 阿 難 我 昔 宮 中 與 諸 宮 屬 同 處 床 座 
T26n1538_003:0519b03	乃作是念：『從今已往我不復處王宮之座。今	乃 作 是 念 從 今 已 往 我 不 復 處 王 宮 之 座 今 
T26n1538_003:0519b04	我此座是即最後所處之座。』作是念已從床	我 此 座 是 即 最 後 所 處 之 座 作 是 念 已 從 床 
T26n1538_003:0519b05	座起，詣王宮門志欲求出。時有聖賢密開其	座 起 詣 王 宮 門 志 欲 求 出 時 有 聖 賢 密 開 其 
T26n1538_003:0519b06	門，我於是時出宮門已，漸次前詣重重宮禁，	門 我 於 是 時 出 宮 門 已 漸 次 前 詣 重 重 宮 禁 
T26n1538_003:0519b07	一一門首皆有聖賢為開其門。我於爾時即	一 一 門 首 皆 有 聖 賢 為 開 其 門 我 於 爾 時 即 
T26n1538_003:0519b08	作是念：『我當得成如來、應供、正等正覺已，普	作 是 念 我 當 得 成 如 來 應 供 正 等 正 覺 已 普 
T26n1538_003:0519b09	為眾生開甘露門。』此是菩薩先現瑞相。	為 眾 生 開 甘 露 門 此 是 菩 薩 先 現 瑞 相 
T26n1538_003:0519b10	「又復阿難！我時乘彼迦蹉迦馬王出王城	 又 復 阿 難 我 時 乘 彼 迦 蹉 迦 馬 王 出 王 城 
T26n1538_003:0519b11	已，至於他邦即時下馬。乃作是念：『今此是我	已 至 於 他 邦 即 時 下 馬 乃 作 是 念 今 此 是 我 
T26n1538_003:0519b12	最後所乘王宮寶馬。』我時所有眾莊嚴具及	最 後 所 乘 王 宮 寶 馬 我 時 所 有 眾 莊 嚴 具 及 
T26n1538_003:0519b13	迦蹉迦馬王而悉不受，還其馭者。乃起是	迦 蹉 迦 馬 王 而 悉 不 受 還 其 馭 者 乃 起 是 
T26n1538_003:0519b14	念：『今此是我最後所有世間嚴具，而悉棄置	念 今 此 是 我 最 後 所 有 世 間 嚴 具 而 悉 棄 置 
T26n1538_003:0519b15	不復受之。』阿難當知！我時即持妙色寶劍，自	不 復 受 之 阿 難 當 知 我 時 即 持 妙 色 寶 劍 自 
T26n1538_003:0519b16	斷頂髻。斷已復念：『今此是我最後自斷頂髮	斷 頂 髻 斷 已 復 念 今 此 是 我 最 後 自 斷 頂 髮 
T26n1538_003:0519b17	寶髻，不復重生。』即時見一被袈裟衣者，儀相	寶 髻 不 復 重 生 即 時 見 一 被 袈 裟 衣 者 儀 相 
T26n1538_003:0519b18	調善。見已歡喜，前詣彼所而謂之曰：『我今奉	調 善 見 已 歡 喜 前 詣 彼 所 而 謂 之 曰 我 今 奉 
T26n1538_003:0519b19	汝迦尸迦衣，汝可授我袈裟法衣。』即作是念：	汝 迦 尸 迦 衣 汝 可 授 我 袈 裟 法 衣 即 作 是 念 
T26n1538_003:0519b20	『今此是我最後所棄王宮之服，不復重以俗	 今 此 是 我 最 後 所 棄 王 宮 之 服 不 復 重 以 俗 
T26n1538_003:0519b21	服被體。』	服 被 體 
T26n1538_003:0519b22	「又復阿難！其後我於吉祥長者所受吉祥草，	 又 復 阿 難 其 後 我 於 吉 祥 長 者 所 受 吉 祥 草 
T26n1538_003:0519b23	詣菩提樹下自敷其草，端身正念加趺而	詣 菩提樹下 自 敷 其 草 端 身 正 念 加 趺 而 
T26n1538_003:0519b24	坐，作是念言：『我若不成阿耨多羅三藐三菩	坐 作是念言 我 若 不 成 阿 耨 多 羅 三 藐 三 菩 
T26n1538_003:0519b25	提果，誓願不起于座。』又作是念：『我今快得善	提 果 誓 願 不 起 于 座 又 作 是 念 我 今 快 得 善 
T26n1538_003:0519b26	利。何以故？一切眾生處無明中、住著無明，	利 何 以 故 一 切 眾 生 處 無 明 中 住 著 無 明 
T26n1538_003:0519b27	無明卵[穀禾+卵]障覆慧眼。我當破無明卵，令諸眾	無 明 卵 [穀禾卵] 障 覆 慧 眼 我 當 破 無 明 卵 令 諸 眾 
T26n1538_003:0519b28	生吉祥安樂。』	生 吉 祥 安 樂 
T26n1538_003:0519b29	「又復阿難！我成佛未久，觀見眾生世間所生	 又 復 阿 難 我 成 佛 未 久 觀 見 眾 生 世 間 所 生 
T26n1538_003:0519c01	亦世間老，有利根者、有中根者、有下根者。其	亦 世 間 老 有 利 根 者 有 中 根 者 有 下 根 者 其 
T26n1538_003:0519c02	下根者，隨其行相而調伏之。乃至不聞正法	下 根 者 隨 其 行 相 而 調 伏 之 乃 至 不 聞 正 法 
T26n1538_003:0519c03	諸缺減者，彼等眾生我觀見已，於彼彼所起	諸 缺 減 者 彼 等 眾 生 我 觀 見 已 於 彼 彼 所 起 
T26n1538_003:0519c04	大悲心，為說正法而化度之。	大 悲 心 為 說 正 法 而 化 度 之 
T26n1538_003:0519c05	「又復阿難！我復作是念：『我今快得善利。我於	 又 復 阿 難 我 復 作 是 念 我 今 快 得 善 利 我 於 
T26n1538_003:0519c06	世間雜染中生而無雜染心意所行。』」	世 間 雜 染 中 生 而 無 雜 染 心 意 所 行 
T26n1538_003:0519c07	對法大論中因施設門第五	對 法 大 論 中 因 施 設 門 第 五 
T26n1538_003:0519c08	總說頌曰：	總 說 頌 曰 
T26n1538_003:0519c09	　如子下族并貧族，　　賊難劫初至十歲，	 如 子 下 族 并 貧 族 賊 難 劫 初 至 十 歲 
T26n1538_003:0519c10	　牛貨勝身俱盧洲，　　無我及彼欲色界，	 牛 貨 勝 身 俱 盧 洲 無 我 及 彼 欲 色 界 
T26n1538_003:0519c11	　佛從定起入涅槃，　　最後大衣不焚爇。	 佛 從 定 起 入 涅 槃 最 後 大 衣 不 焚 爇 
T26n1538_003:0519c12	又問：何因菩薩於一切眾生中最上最勝，有	又 問 何 因 菩 薩 於 一 切 眾 生 中 最 上 最 勝 有 
T26n1538_003:0519c13	不發大菩提心而能正信出家者邪？答：菩薩	不 發 大菩提心 而 能 正 信 出 家 者 邪 答 菩 薩 
T26n1538_003:0519c14	長時觀諸眾生等同一子，勤修善業長養成	長 時 觀 諸 眾 生 等 同 一 子 勤 修 善 業 長 養 成 
T26n1538_003:0519c15	熟，勝妙果報現前克成，法爾如是。殑伽沙等	熟 勝 妙 果 報 現 前 克 成 法 爾 如 是 殑 伽 沙 等 
T26n1538_003:0519c16	諸菩薩眾，未有不發大菩提心而能正信出	諸 菩 薩 眾 未 有 不 發 大菩提心 而 能 正 信 出 
T26n1538_003:0519c17	家之者。如其所說，即是不能受欲樂故。	家 之 者 如 其 所 說 即 是 不 能 受 欲 樂 故 
T26n1538_003:0519c18	又問：何因菩薩不於下族中生？答：下族生者，	又 問 何 因 菩 薩 不 於 下 族 中 生 答 下 族 生 者 
T26n1538_003:0519c19	習近慢心。菩薩長時遠離諸慢、親近善法修	習 近 慢 心 菩 薩 長 時 遠 離 諸 慢 親 近 善 法 修 
T26n1538_003:0519c20	習施作，是故菩薩決定於其上族中生。又若	習 施 作 是 故 菩 薩 決 定 於 其 上 族 中 生 又 若 
T26n1538_003:0519c21	菩薩下族生者，即起謗訕。	菩 薩 下 族 生 者 即 起 謗 訕 
T26n1538_003:0519c22	又問：何因菩薩不於貧族中生？答：貧族生者，	又 問 何 因 菩 薩 不 於 貧 族 中 生 答 貧 族 生 者 
T26n1538_003:0519c23	習近慳吝。菩薩長時離慳吝垢，親近修習廣	習 近 慳 吝 菩 薩 長 時 離 慳 吝 垢 親近修習 廣 
T26n1538_003:0519c24	多施作無慳吝法，是故菩薩決定於其富族	多 施 作 無 慳 吝 法 是 故 菩 薩 決 定 於 其 富 族 
T26n1538_003:0519c25	中生。謂以菩薩諸有所得色聲香味觸等諸	中 生 謂 以 菩 薩 諸 有 所 得 色聲香味觸 等 諸 
T26n1538_003:0519c26	境，不歷艱苦自他平等而受用之。又若菩	境 不 歷 艱 苦 自他平等 而 受 用 之 又 若 菩 
T26n1538_003:0519c27	薩生貧族者，即起謗訕。	薩 生 貧 族 者 即 起 謗 訕 
T26n1538_003:0519c28	又問：何因菩薩不生極邊國土及多賊難鄙	又 問 何 因 菩 薩 不 生 極 邊 國 土 及 多 賊 難 鄙 
T26n1538_003:0519c29	惡之方？答：邊惡國土於戒於見而悉艱苦，不	惡 之 方 答 邊 惡 國 土 於 戒 於 見 而 悉 艱 苦 不 
T26n1538_003:0520a01	與菩薩相似同等。而菩薩者，勤修諸善長養	與 菩 薩 相 似 同 等 而 菩 薩 者 勤 修 諸 善 長 養 
T26n1538_003:0520a02	成熟，現前勝妙果報克成，是故菩薩決定於	成 熟 現 前 勝 妙 果 報 克 成 是 故 菩 薩 決 定 於 
T26n1538_003:0520a03	其大國中生。設有利根清淨眾生，值遇菩薩	其 大 國 中 生 設 有 利 根 清 淨 眾 生 值 遇 菩 薩 
T26n1538_003:0520a04	大威德者，然亦不能發起最上無漏善法，所	大 威 德 者 然 亦 不能發起 最 上 無 漏 善 法 所 
T26n1538_003:0520a05	謂無上正等菩提、緣覺菩提、聲聞菩提到彼岸	謂 無上正等菩提 緣 覺 菩 提 聲聞菩提 到 彼 岸 
T26n1538_003:0520a06	法，及餘最上無漏善根。	法 及 餘 最 上 無漏善根 
T26n1538_003:0520a07	又問：何因菩薩不於劫初時生，彼時人壽始	又 問 何 因 菩 薩 不 於 劫 初 時 生 彼 時 人 壽 始 
T26n1538_003:0520a08	八萬歲？答：劫初時人軟品根性，所行愚鈍，朴	八 萬 歲 答 劫 初 時 人 軟 品 根 性 所 行 愚 鈍 朴 
T26n1538_003:0520a09	質種類，不與菩薩相似同等。菩薩大士大威	質 種 類 不 與 菩 薩 相 似 同 等 菩薩大士 大 威 
T26n1538_003:0520a10	德者，於長時中勤修善法長養成熟。設有利	德 者 於 長 時 中 勤 修 善 法 長 養 成 熟 設 有 利 
T26n1538_003:0520a11	根清淨眾生值遇菩薩大威德者，然亦不能	根 清 淨 眾 生 值 遇 菩 薩 大 威 德 者 然 亦 不 能 
T26n1538_003:0520a12	發起最上無漏善法。	發 起 最 上 無 漏 善 法 
T26n1538_003:0520a13	又問：何因菩薩不於人壽最後十歲時生？答：	又 問 何 因 菩 薩 不 於 人 壽 最 後 十 歲 時 生 答 
T26n1538_003:0520a14	人壽十歲之時，廣多罪業、廣多煩惱，不與菩	人 壽 十 歲 之 時 廣 多 罪 業 廣 多 煩 惱 不 與 菩 
T26n1538_003:0520a15	薩相似同等。是故菩薩大威德者，不於人壽	薩 相 似 同 等 是 故 菩 薩 大 威 德 者 不 於 人 壽 
T26n1538_003:0520a16	十歲時生。	十 歲 時 生 
T26n1538_003:0520a17	又問：何因菩薩不生西瞿陀尼洲？答：西瞿陀	又 問 何 因 菩 薩 不 生 西瞿陀尼 洲 答 西 瞿 陀 
T26n1538_003:0520a18	尼洲人軟品根性，所行愚鈍，朴質種類，不與	尼 洲 人 軟 品 根 性 所 行 愚 鈍 朴 質 種 類 不 與 
T26n1538_003:0520a19	菩薩相似同等。菩薩大士大威德者，勤修善	菩 薩 相 似 同 等 菩薩大士 大 威 德 者 勤 修 善 
T26n1538_003:0520a20	法長養成熟，現前勝妙果報克成，是故菩薩	法 長 養 成 熟 現 前 勝 妙 果 報 克 成 是 故 菩 薩 
T26n1538_003:0520a21	決定於其大國中生。設有利根清淨眾生，值	決 定 於 其 大 國 中 生 設 有 利 根 清 淨 眾 生 值 
T26n1538_003:0520a22	遇菩薩大威德者，然亦不能發起最上無漏	遇 菩 薩 大 威 德 者 然 亦 不能發起 最 上 無 漏 
T26n1538_003:0520a23	善法，所謂無上正等菩提、緣覺菩提、聲聞菩	善 法 所 謂 無上正等菩提 緣 覺 菩 提 聲 聞 菩 
T26n1538_003:0520a24	提到彼岸法，及餘最上無漏善根。	提 到 彼 岸 法 及 餘 最 上 無漏善根 
T26n1538_003:0520a25	又問：何因菩薩不生東勝身洲？答：如西瞿陀	又 問 何 因 菩 薩 不 生 東勝身洲 答 如 西 瞿 陀 
T26n1538_003:0520a26	尼洲其事廣說。	尼 洲 其 事 廣 說 
T26n1538_003:0520a27	又問：何因菩薩不生北俱盧洲？答：北俱盧洲	又 問 何 因 菩 薩 不 生 北 俱 盧 洲 答 北 俱 盧 洲 
T26n1538_003:0520a28	人軟品根性，所行愚鈍，朴質種類隨作艱	人 軟 品 根 性 所 行 愚 鈍 朴 質 種 類 隨 作 艱 
T26n1538_003:0520a29	辛，不與菩薩相以同等。菩薩大士大威德	辛 不 與 菩 薩 相 以 同 等 菩薩大士 大 威 德 
T26n1538_003:0520b01	者，於長時中勤修諸善長養成熟，現前勝	者 於 長 時 中 勤 修 諸 善 長 養 成 熟 現 前 勝 
T26n1538_003:0520b02	妙果報克成，是故菩薩決定於其大國中生。	妙 果 報 克 成 是 故 菩 薩 決 定 於 其 大 國 中 生 
T26n1538_003:0520b03	設有利根清淨眾生，值遇菩薩大威德者，然	設 有 利 根 清 淨 眾 生 值 遇 菩 薩 大 威 德 者 然 
T26n1538_003:0520b04	亦不能於一切處發起最上無漏善根。而北	亦 不 能 於 一 切 處 發 起 最 上 無漏善根 而 北 
T26n1538_003:0520b05	俱盧洲人無我所執。此中問言：北俱盧洲人	俱 盧 洲 人 無 我 所 執 此 中 問 言 北 俱 盧 洲 人 
T26n1538_003:0520b06	何故無我所執邪？答？謂以眾生數多、境界廣	何 故 無 我 所 執 邪 答 謂 以 眾 生 數 多 境 界 廣 
T26n1538_003:0520b07	大、所受境界咸皆悅意平等無差，故無我	大 所 受 境 界 咸 皆 悅 意 平 等 無 差 故 無 我 
T26n1538_003:0520b08	所。	所 
T26n1538_003:0520b09	又問：何因菩薩不生欲界諸天？答：謂欲界中	又 問 何 因 菩 薩 不 生 欲 界 諸 天 答 謂 欲 界 中 
T26n1538_003:0520b10	諸天子眾，著諸境界、愛樂放逸，不與菩薩相	諸 天 子 眾 著 諸 境 界 愛 樂 放 逸 不 與 菩 薩 相 
T26n1538_003:0520b11	似同等。雖能修持少分梵行，不能廣為比丘、	似 同 等 雖 能 修 持 少 分 梵 行 不 能 廣 為 比 丘 
T26n1538_003:0520b12	比丘尼、優婆塞、優婆夷等四眾廣大宣演梵	比 丘 尼 優 婆 塞 優 婆 夷 等 四 眾 廣 大 宣 演 梵 
T26n1538_003:0520b13	行，令諸天人各獲利益。以是緣故，不生欲界	行 令 諸 天 人 各 獲 利 益 以 是 緣 故 不 生 欲 界 
T26n1538_003:0520b14	諸天。	諸 天 
T26n1538_003:0520b15	又問：何因菩薩不生色界諸天：答：謂色界中	又 問 何 因 菩 薩 不 生 色界諸天 答 謂 色 界 中 
T26n1538_003:0520b16	諸天子眾，雖能修持少分梵行，而亦不能廣	諸 天 子 眾 雖 能 修 持 少 分 梵 行 而 亦 不 能 廣 
T26n1538_003:0520b17	為四眾別別開演所有梵行，令諸天人各獲	為 四 眾 別 別 開 演 所 有 梵 行 令 諸 天 人 各 獲 
T26n1538_003:0520b18	利益。又復菩薩不於色界諸天趣證涅槃。	利 益 又 復 菩 薩 不 於 色界諸天 趣 證 涅 槃 
T26n1538_003:0520b19	此中應問：何故色界天中不入涅槃？答：謂無	此 中 應 問 何 故 色 界 天 中 不入涅槃 答 謂 無 
T26n1538_003:0520b20	色相正受處故，但作意已正入涅槃。	色 相 正 受 處 故 但 作 意 已 正 入 涅 槃 
T26n1538_003:0520b21	又問：若如此說者，不善心入邪、無記心入邪？	又 問 若 如 此 說 者 不 善 心 入 邪 無 記 心 入 邪 
T26n1538_003:0520b22	答：此說應知無記心入。	答 此 說 應 知 無 記 心 入 
T26n1538_003:0520b23	又問：何因諸佛世尊住世教化？何故賢上大	又 問 何 因 諸佛世尊 住 世 教 化 何 故 賢 上 大 
T26n1538_003:0520b24	聲聞眾先入涅槃，佛乃後入？答：以諸聲聞長	聲 聞 眾 先 入 涅 槃 佛 乃 後 入 答 以 諸 聲 聞 長 
T26n1538_003:0520b25	時無間勤修善法長養成熟，現前勝妙果報	時 無 間 勤 修 善 法 長 養 成 熟 現 前 勝 妙 果 報 
T26n1538_003:0520b26	克成。若見世尊入涅槃者，彼諸聲聞所有勝	克 成 若 見 世 尊 入 涅 槃 者 彼 諸 聲 聞 所 有 勝 
T26n1538_003:0520b27	報即不圓成。又復法爾，殑伽沙數等諸佛世	報 即 不 圓 成 又 復 法 爾 殑伽沙數 等 諸 佛 世 
T26n1538_003:0520b28	尊所有賢上大聲聞眾，皆先涅槃，佛乃後入。	尊 所 有 賢 上 大 聲 聞 眾 皆 先 涅 槃 佛 乃 後 入 
T26n1538_003:0520b29	如其所說入涅槃者，諸佛世尊於第四禪不	如 其 所 說 入 涅 槃 者 諸佛世尊 於 第 四 禪 不 
T26n1538_003:0520c01	動地中現前證入。此中應問：云何世尊入涅	動 地 中 現 前 證 入 此 中 應 問 云 何 世 尊 入 涅 
T26n1538_003:0520c02	槃邪、或復起邪？答：若有所起，即無所入。	槃 邪 或 復 起 邪 答 若 有 所 起 即 無 所 入 
T26n1538_003:0520c03	又問：何因如來世尊入涅槃已，聖體既焚，大	又 問 何 因 如 來 世 尊 入 涅 槃 已 聖 體 既 焚 大 
T26n1538_003:0520c04	衣如故，若內若外都無所損？答：天威力故，謂	衣 如 故 若內若外 都 無 所 損 答 天 威 力 故 謂 
T26n1538_003:0520c05	以諸天於佛世尊極生淨信。又復二種制止	以 諸 天 於 佛 世 尊 極 生 淨 信 又 復 二 種 制 止 
T26n1538_003:0520c06	不燒：一者內身；二者外財。當知皆是佛神力	不 燒 一 者 內 身 二 者 外 財 當 知 皆 是 佛 神 力 
T26n1538_003:0520c07	故。	故 
T26n1538_003:0520c08	對法大論中因施設門第六之一	對 法 大 論 中 因 施 設 門 第 六 之 一 
T26n1538_003:0520c09	總說頌曰：	總 說 頌 曰 
T26n1538_003:0520c10	　二緣及彼二眾出，　　聲聞三千大千界，	 二 緣 及 彼 二 眾 出 聲 聞 三千大千界 
T26n1538_003:0520c11	　大慈大悲二種心，　　不思議及隨順法，	 大慈大悲 二 種 心 不 思 議 及 隨 順 法 
T26n1538_003:0520c12	　眾中差別所行中，　　如象王住地獄等。	 眾 中 差 別 所 行 中 如 象 王 住 地 獄 等 
T26n1538_003:0520c13	又問：何因佛及輪王皆具三十二大丈夫相，	又 問 何 因 佛 及 輪 王 皆 具 三十二大丈夫相 
T26n1538_003:0520c14	一謂如來、應供、正等正覺，二謂轉輪聖王。答：	一 謂 如 來 應 供 正 等 正 覺 二 謂 轉輪聖王 答 
T26n1538_003:0520c15	轉輪聖王者，往昔修因其事廣大，於長時中	轉輪聖王 者 往 昔 修 因 其 事 廣 大 於 長 時 中 
T26n1538_003:0520c16	常起是念：「我當廣行布施、植諸勝福，長養一	常 起 是 念 我 當 廣 行 布 施 植 諸 勝 福 長 養 一 
T26n1538_003:0520c17	切眾生，淨持戒行。世間癡暗無歸救者，悉為	切 眾 生 淨 持 戒 行 世 間 癡 暗 無 歸 救 者 悉 為 
T26n1538_003:0520c18	救度。」如來、應供、正等正覺者，隨諸所作一切	救 度 如 來 應 供 正 等 正 覺 者 隨 諸 所 作 一 切 
T26n1538_003:0520c19	善法，普施世間一切眾生。廣發大願，如願所	善 法 普 施 世 間 一 切 眾 生 廣 發 大 願 如 願 所 
T26n1538_003:0520c20	行，捨家出家成等正覺。以是因故，轉輪聖	行 捨 家 出 家 成等正覺 以 是 因 故 轉 輪 聖 
T26n1538_003:0520c21	王、如來應供正等正覺皆具大丈夫相。	王 如 來 應 供 正 等 正 覺 皆 具 大丈夫相 
