T26n1538_001:0514a14	施設論卷第一	施 設 論 卷 第 一 
T26n1538_001:0514a16	西天譯經三藏朝散大夫	西 天 譯 經 三 藏 朝 散 大 夫 
T26n1538_001:0514a17	試光祿卿傳梵大師賜紫	試 光 祿 卿 傳 梵 大 師 賜 紫 
T26n1538_001:0514a18	沙門臣法護等奉　詔譯	沙 門 臣 法 護 等 奉 詔 譯 
T26n1538_001:0514a19	對法大論中世間施設門第一(按釋論有此門，梵本元闕)	對 法 大 論 中 世 間 施 設 門 第 一 按 釋 論 有 此 門 梵 本 元 闕 
T26n1538_001:0514a20	對法大論中因施設門第二	對 法 大 論 中 因 施 設 門 第 二 
T26n1538_001:0514a21	論中問曰：有何所因，轉輪聖王所有女寶，妙	論 中 問 曰 有 何 所 因 轉輪聖王 所 有 女 寶 妙 
T26n1538_001:0514a22	色端嚴眾所樂見，超人狀貌如天色相？答：轉	色 端 嚴 眾 所 樂 見 超 人 狀 貌 如 天 色 相 答 轉 
T26n1538_001:0514a23	輪聖王彼女寶者，往昔修因其事廣大，能以	輪 聖 王 彼 女 寶 者 往 昔 修 因 其 事 廣 大 能 以 
T26n1538_001:0514a24	清淨諸物布施，所謂清淨眾莊嚴具，并餘飲	清 淨 諸 物 布 施 所 謂 清 淨 眾 莊 嚴 具 并 餘 飲 
T26n1538_001:0514a25	食衣服、塗香粖香、床座舍宇及燈明等。以如	食 衣 服 塗 香 粖 香 床 座 舍 宇 及 燈 明 等 以 如 
T26n1538_001:0514a26	是因故，輪王女寶妙色端嚴眾所樂見，超人	是 因 故 輪 王 女 寶 妙 色 端 嚴 眾 所 樂 見 超 人 
T26n1538_001:0514a27	狀貌如天色相。	狀 貌 如 天 色 相 
T26n1538_001:0514a28	又問：何因輪王女寶，不白不黑膚色中均，不	又 問 何 因 輪 王 女 寶 不 白 不 黑 膚 色 中 均 不 
T26n1538_001:0514a29	長不短、不肥不瘦身分亭等？答：彼女寶者，往	長 不 短 不 肥 不 瘦 身 分 亭 等 答 彼 女 寶 者 往 
T26n1538_001:0514b01	昔修因其事廣大，能行布施，謂以諸色香味	昔 修 因 其 事 廣 大 能 行 布 施 謂 以 諸 色 香 味 
T26n1538_001:0514b02	皆具足者飲食等物，自手持奉，起無慢心行	皆 具 足 者 飲 食 等 物 自 手 持 奉 起 無 慢 心 行 
T26n1538_001:0514b03	於布施。以如是因故，所有女寶不白不黑膚	於 布 施 以 如 是 因 故 所 有 女 寶 不 白 不 黑 膚 
T26n1538_001:0514b04	色中均，不長不短、不肥不瘦身分亭等。	色 中 均 不 長 不 短 不 肥 不 瘦 身 分 亭 等 
T26n1538_001:0514b05	又問：何因輪王女寶，寒時溫暖適意快樂？答：	又 問 何 因 輪 王 女 寶 寒 時 溫 暖 適 意 快 樂 答 
T26n1538_001:0514b06	彼女寶者，往昔修因其事廣大，謂若有時冬	彼 女 寶 者 往 昔 修 因 其 事 廣 大 謂 若 有 時 冬 
T26n1538_001:0514b07	際嚴凝大風吹擊，境色極寒人所惶畏。女寶	際 嚴 凝 大 風 吹 擊 境 色 極 寒 人 所 惶 畏 女 寶 
T26n1538_001:0514b08	是時，於其父母知識及師尊所并餘沙門婆	是 時 於 其 父 母 知 識 及 師 尊 所 并 餘 沙 門 婆 
T26n1538_001:0514b09	羅門眾不生惱害，而復愛樂不惱害者，即以	羅 門 眾 不 生 惱 害 而 復 愛 樂 不 惱 害 者 即 以 
T26n1538_001:0514b10	溫暖事用所攝，所謂衣服臥具、塗香粖香、床	溫 暖 事 用 所 攝 所 謂 衣 服 臥 具 塗 香 粖 香 床 
T26n1538_001:0514b11	座舍宇、爐炭火具并餘溫暖應用等物，廣行	座 舍 宇 爐 炭 火 具 并 餘 溫 暖 應 用 等 物 廣 行 
T26n1538_001:0514b12	布施。以如是因故，輪王女寶，寒時溫暖適意	布 施 以 如 是 因 故 輪 王 女 寶 寒 時 溫 暖 適 意 
T26n1538_001:0514b13	快樂。	快 樂 
T26n1538_001:0514b14	又問：何因輪王女寶，熱時清涼適悅快樂？答：	又 問 何 因 輪 王 女 寶 熱 時 清 涼 適 悅 快 樂 答 
T26n1538_001:0514b15	彼女寶者，往昔修因其事廣大，謂若有時熱	彼 女 寶 者 往 昔 修 因 其 事 廣 大 謂 若 有 時 熱 
T26n1538_001:0514b16	際炎燠日光熾逼，隨熱生蟲，人極增惱。女寶	際 炎 燠 日 光 熾 逼 隨 熱 生 蟲 人 極 增 惱 女 寶 
T26n1538_001:0514b17	是時，於其父母知識及師尊所并餘沙門婆	是 時 於 其 父 母 知 識 及 師 尊 所 并 餘 沙 門 婆 
T26n1538_001:0514b18	羅門眾不生惱害，而復愛樂不惱害者，即以	羅 門 眾 不 生 惱 害 而 復 愛 樂 不 惱 害 者 即 以 
T26n1538_001:0514b19	清涼事用所攝，謂持衣服臥具、塗香粖香、床	清 涼 事 用 所 攝 謂 持 衣 服 臥 具 塗 香 粖 香 床 
T26n1538_001:0514b20	座舍宇、承足寶机、寶嚴環釧、多摩羅香，及多	座 舍 宇 承 足 寶 机 寶 嚴 環 釧 多 摩 羅 香 及 多 
T26n1538_001:0514b21	羅香所成眾具并餘應用等物，廣行布施。以	羅 香 所 成 眾 具 并 餘 應 用 等 物 廣 行 布 施 以 
T26n1538_001:0514b22	如是因故，輪王女寶，熱時清涼適悅快樂。	如 是 因 故 輪 王 女 寶 熱 時 清 涼 適 悅 快 樂 
T26n1538_001:0514b23	又問：何因輪王女寶，身諸毛孔有旃檀香，口	又 問 何 因 輪 王 女 寶 身 諸 毛 孔 有 旃 檀 香 口 
T26n1538_001:0514b24	中常出優鉢羅花香？答：彼女寶者，往昔修因	中 常 出 優 鉢 羅 花 香 答 彼 女 寶 者 往 昔 修 因 
T26n1538_001:0514b25	其事廣大，謂於父母知識及師尊所并餘沙	其 事 廣 大 謂 於 父 母 知 識 及 師 尊 所 并 餘 沙 
T26n1538_001:0514b26	門婆羅門眾不生惱害，而復愛樂不惱害者，	門 婆 羅 門 眾 不 生 惱 害 而 復 愛 樂 不 惱 害 者 
T26n1538_001:0514b27	即以沈水、薰陸、欝金、多摩羅等及餘上妙諸	即 以 沈 水 薰 陸 欝 金 多 摩 羅 等 及 餘 上 妙 諸 
T26n1538_001:0514b28	香，廣行布施。以如是因故，身諸毛孔有旃	香 廣 行 布 施 以 如 是 因 故 身 諸 毛 孔 有 旃 
T26n1538_001:0514b29	檀香，口中常出優鉢羅花香。	檀 香 口 中 常 出 優 鉢 羅 花 香 
T26n1538_001:0514c01	又問：何因輪王女寶，侍從轉輪聖王，先起後	又 問 何 因 輪 王 女 寶 侍 從 轉輪聖王 先 起 後 
T26n1538_001:0514c02	坐不失規儀，隨何所作悉能承奉，勤力無	坐 不 失 規 儀 隨 何 所 作 悉 能 承 奉 勤 力 無 
T26n1538_001:0514c03	慢而復愛語？答：轉輪聖王於長時中，隨所	慢 而 復 愛 語 答 轉輪聖王 於 長 時 中 隨 所 
T26n1538_001:0514c04	作用善業增強，長養成熟現前勝報。以如	作 用 善 業 增 強 長 養 成 熟 現 前 勝 報 以 如 
T26n1538_001:0514c05	是因故，獲感女寶愛語承順。	是 因 故 獲 感 女 寶 愛 語 承 順 
T26n1538_001:0514c06	又問：何因輪王女寶能令轉輪聖王悅意稱	又 問 何 因 輪 王 女 寶 能 令 轉輪聖王 悅 意 稱 
T26n1538_001:0514c07	順，然無染心，況乎身語無不調柔？答：轉輪聖	順 然 無 染 心 況 乎 身 語 無 不 調 柔 答 轉 輪 聖 
T26n1538_001:0514c08	王具大威德，於彼彼眾生曾無異心，超人	王 具 大 威 德 於 彼 彼 眾 生 曾 無 異 心 超 人 
T26n1538_001:0514c09	意表。以如是因故，所感女寶悅意稱順，然無	意 表 以 如 是 因 故 所 感 女 寶 悅 意 稱 順 然 無 
T26n1538_001:0514c10	染心。	染 心 
T26n1538_001:0514c11	又問：何因輪王女寶，王欲行時或坐立時而	又 問 何 因 輪 王 女 寶 王 欲 行 時 或 坐 立 時 而 
T26n1538_001:0514c12	悉先知，即向王前作是白言：「快哉聖王！所欲	悉 先 知 即 向 王 前 作 是 白 言 快 哉 聖 王 所 欲 
T26n1538_001:0514c13	行邪或坐立邪，悉當隨從。」答：彼女寶者，往昔	行 邪 或 坐 立 邪 悉 當 隨 從 答 彼 女 寶 者 往 昔 
T26n1538_001:0514c14	修因其事廣大，謂具慈心，於欲界中觀諸眾	修 因 其 事 廣 大 謂 具 慈 心 於 欲 界 中 觀 諸 眾 
T26n1538_001:0514c15	生，於義所欲、於利所欲及安樂欲，或若眾生	生 於 義 所 欲 於 利 所 欲 及 安 樂 欲 或 若 眾 生 
T26n1538_001:0514c16	起無利欲、不安樂欲，悉起慈心、慈眼觀視。以	起 無 利 欲 不 安 樂 欲 悉 起 慈 心 慈 眼 觀 視 以 
T26n1538_001:0514c17	如是因故，輪王女寶，於王進止而悉先知。	如 是 因 故 輪 王 女 寶 於 王 進 止 而 悉 先 知 
T26n1538_001:0514c18	又問：何因輪王女寶，超勝世間常品女人，	又 問 何 因 輪 王 女 寶 超 勝 世 間 常 品 女 人 
T26n1538_001:0514c19	如星中月？答：彼女寶者，往昔修因其事廣大，	如 星 中 月 答 彼 女 寶 者 往 昔 修 因 其 事 廣 大 
T26n1538_001:0514c20	謂自不殺生，復教他人持不殺戒。自不偷	謂 自 不 殺 生 復 教 他 人 持 不 殺 戒 自 不 偷 
T26n1538_001:0514c21	盜、不邪染、不妄語、不飲酒，復教他人一一	盜 不 邪 染 不 妄 語 不 飲 酒 復 教 他 人 一 一 
T26n1538_001:0514c22	修持。以如是因故，輪王女寶超勝諸女，如星	修 持 以 如 是 因 故 輪 王 女 寶 超 勝 諸 女 如 星 
T26n1538_001:0514c23	中月。又問：何因輪王女寶不乳產邪？答：一切	中 月 又 問 何 因 輪 王 女 寶 不 乳 產 邪 答 一 切 
T26n1538_001:0514c24	女人共所病者，謂即胎藏乳產之苦。彼女	女 人 共 所 病 者 謂 即 胎 藏 乳 產 之 苦 彼 女 
T26n1538_001:0514c25	寶者，於長時中少病少惱，作諸善業長養成	寶 者 於 長 時 中 少 病 少 惱 作 諸 善 業 長 養 成 
T26n1538_001:0514c26	熟，現前勝妙果報克成。以如是因故，輪王女	熟 現 前 勝 妙 果 報 克 成 以 如 是 因 故 輪 王 女 
T26n1538_001:0514c27	寶而不乳產。	寶 而 不 乳 產 
T26n1538_001:0514c28	又問：何因輪王女寶先於輪王而趣命終？	又 問 何 因 輪 王 女 寶 先 於 輪 王 而 趣 命 終 
T26n1538_001:0514c29	答：彼女寶者，修諸善業長時不斷，現前勝妙	答 彼 女 寶 者 修 諸 善 業 長 時 不 斷 現 前 勝 妙 
T26n1538_001:0515a01	果報克成。以如是因故，輪王女寶，先於轉輪	果 報 克 成 以 如 是 因 故 輪 王 女 寶 先 於 轉 輪 
T26n1538_001:0515a02	聖王而趣命終。又問：何因輪王女寶，於諸女	聖 王 而 趣 命 終 又 問 何 因 輪 王 女 寶 於 諸 女 
T26n1538_001:0515a03	中獨得生天？答：彼女寶者，本性賢善而復	中 獨 得 生 天 答 彼 女 寶 者 本 性 賢 善 而 復 
T26n1538_001:0515a04	廣修十善業道。以如是因故，輪王女寶於諸	廣 修 十善業道 以 如 是 因 故 輪 王 女 寶 於 諸 
T26n1538_001:0515a05	女中獨得生天。	女 中 獨 得 生 天 
T26n1538_001:0515a06	又問：何因轉輪聖王得有主藏臣寶？答：轉輪	又 問 何 因 轉輪聖王 得 有 主 藏 臣 寶 答 轉 輪 
T26n1538_001:0515a07	聖王，往昔修因其事廣大，謂若有時極寒極	聖 王 往 昔 修 因 其 事 廣 大 謂 若 有 時 極 寒 極 
T26n1538_001:0515a08	熱，王於彼等寒熱時中，於其父母知識及師	熱 王 於 彼 等 寒 熱 時 中 於 其 父 母 知 識 及 師 
T26n1538_001:0515a09	尊所及餘沙門婆羅門眾不生惱害，而復愛	尊 所 及 餘 沙 門 婆 羅 門 眾 不 生 惱 害 而 復 愛 
T26n1538_001:0515a10	樂不惱害者，隨時應用妙好醫藥，及所愛樂	樂 不 惱 害 者 隨 時 應 用 妙 好 醫 藥 及 所 愛 樂 
T26n1538_001:0515a11	上味飲食并餘所須，承事供給。彼等受已，	上 味 飲 食 并 餘 所 須 承 事 供 給 彼 等 受 已 
T26n1538_001:0515a12	身無不潔、衣無不覆，於晝夜中常受快樂。以	身 無 不 潔 衣 無 不 覆 於 晝 夜 中 常 受 快 樂 以 
T26n1538_001:0515a13	如是因故，轉輪聖王而能獲得主藏臣寶。彼	如 是 因 故 轉輪聖王 而 能 獲 得 主 藏 臣 寶 彼 
T26n1538_001:0515a14	主藏臣寶者，大富自在、廣多眷屬、庫藏珍	主 藏 臣 寶 者 大 富 自 在 廣 多 眷 屬 庫 藏 珍 
T26n1538_001:0515a15	寶、財穀豐盈、受用增積。善業報生而具天	寶 財 穀 豐 盈 受 用 增 積 善 業 報 生 而 具 天 
T26n1538_001:0515a16	眼，能見伏藏，若有主宰、若無主宰、若水若	眼 能 見 伏 藏 若 有 主 宰 若 無 主 宰 若 水 若 
T26n1538_001:0515a17	陸、若近若遠。來詣轉輪王所，乃至種種豐足	陸 若 近 若 遠 來 詣 轉 輪 王 所 乃 至 種 種 豐 足 
T26n1538_001:0515a18	供給勤力無倦，恭白王言：「天子所須財寶等	供 給 勤 力 無 倦 恭 白 王 言 天 子 所 須 財 寶 等 
T26n1538_001:0515a19	事，悉能奉上。」過去一時，有轉輪聖王意欲	事 悉 能 奉 上 過 去 一 時 有 轉輪聖王 意 欲 
T26n1538_001:0515a20	試驗主藏臣寶，即命寶船涉水遊行，乃召主	試 驗 主 藏 臣 寶 即 命 寶 船 涉 水 遊 行 乃 召 主 
T26n1538_001:0515a21	藏臣寶而謂之曰：「汝今宜應以財寶等供我	藏 臣 寶 而 謂 之 曰 汝 今 宜 應 以 財 寶 等 供 我 
T26n1538_001:0515a22	所須。」時主藏臣寶白彼轉輪聖王言：「聖王	所 須 時 主 藏 臣 寶 白 彼 轉輪聖王 言 聖 王 
T26n1538_001:0515a23	就岸，我當奉上王之所須。若不就岸，事應難	就 岸 我 當 奉 上 王 之 所 須 若 不 就 岸 事 應 難 
T26n1538_001:0515a24	作。」時王即當迴以寶船安泊岸側。彼主藏臣	作 時 王 即 當 迴 以 寶 船 安 泊 岸 側 彼 主 藏 臣 
T26n1538_001:0515a25	寶前詣王所，右膝著地，肅恭嚴奉作潔淨	寶 前 詣 王 所 右膝著地 肅 恭 嚴 奉 作 潔 淨 
T26n1538_001:0515a26	已，二手捧持四金所成上妙寶瓶，滿盛眾	已 二 手 捧 持 四 金 所 成 上 妙 寶 瓶 滿 盛 眾 
T26n1538_001:0515a27	寶獻奉王前，白言聖王：「受我所奉上妙眾寶。」	寶 獻 奉 王 前 白 言 聖 王 受 我 所 奉 上 妙 眾 寶 
T26n1538_001:0515a28	即說頌曰：	即 說 頌 曰 
T26n1538_001:0515a29	「清陰細雨從天降，　　俯近炎天盛夏時，	 清 陰 細 雨 從 天 降 俯 近 炎 天 盛 夏 時 
T26n1538_001:0515b01	　舉以眾寶奉輪王，　　及施餘諸貧匱者，	 舉 以 眾 寶 奉 輪 王 及 施 餘 諸 貧 匱 者 
T26n1538_001:0515b02	　彼等受已皆快樂，　　丐者咸生歡喜心。	 彼 等 受 已 皆 快 樂 丐 者 咸 生歡喜心 
T26n1538_001:0515b03	　由斯業報廣無窮，　　獲得最勝大財富，	 由 斯 業 報 廣 無 窮 獲 得 最 勝 大 財 富 
T26n1538_001:0515b04	　有大神力具天眼，　　當為轉輪聖王尊。」	 有 大 神 力 具 天 眼 當 為 轉輪聖王 尊 
T26n1538_001:0515b05	又問：何因主藏臣寶，獲得大富、廣多庫藏、受	又 問 何 因 主 藏 臣 寶 獲 得 大 富 廣 多 庫 藏 受 
T26n1538_001:0515b06	用增積？答：主藏臣寶，往昔修因其事廣大，謂	用 增 積 答 主 藏 臣 寶 往 昔 修 因 其 事 廣 大 謂 
T26n1538_001:0515b07	能布施一切沙門婆羅門眾、諸貧窮者、諸往	能 布 施 一 切 沙 門 婆 羅 門 眾 諸 貧 窮 者 諸 往 
T26n1538_001:0515b08	來者、諸乞丐者，授以飲食衣服、花鬘塗香、床	來 者 諸 乞 丐 者 授 以 飲 食 衣 服 花 鬘 塗 香 床 
T26n1538_001:0515b09	座舍宇、燈明等物。以如是因故，主藏臣寶獲	座 舍 宇 燈 明 等 物 以 如 是 因 故 主 藏 臣 寶 獲 
T26n1538_001:0515b10	得大富、廣多庫藏、受用增積。	得 大 富 廣 多 庫 藏 受 用 增 積 
T26n1538_001:0515b11	又問：何因主藏臣寶，勝業報生能具天眼，於	又 問 何 因 主 藏 臣 寶 勝 業 報 生 能 具 天 眼 於 
T26n1538_001:0515b12	諸伏藏，若有主宰、若無主宰、若水若陸、若近	諸 伏 藏 若 有 主 宰 若 無 主 宰 若 水 若 陸 若 近 
T26n1538_001:0515b13	若遠而悉觀見？答：主藏臣寶，往昔修因其事	若 遠 而 悉 觀 見 答 主 藏 臣 寶 往 昔 修 因 其 事 
T26n1538_001:0515b14	廣大，謂於父母知識及師尊所并餘沙門婆	廣 大 謂 於 父 母 知 識 及 師 尊 所 并 餘 沙 門 婆 
T26n1538_001:0515b15	羅門眾不生惱害，而復愛樂不惱害者，又於	羅 門 眾 不 生 惱 害 而 復 愛 樂 不 惱 害 者 又 於 
T26n1538_001:0515b16	世間普為一切癡黑暗冥作光明照，授與燈	世 間 普 為 一 切 癡 黑 暗 冥 作 光 明 照 授 與 燈 
T26n1538_001:0515b17	明及然燈具，破諸冥暗悉使明亮。以如是因	明 及 然 燈 具 破 諸 冥 暗 悉 使 明 亮 以 如 是 因 
T26n1538_001:0515b18	故，主藏臣寶勝業報生能具天眼，水陸遠近	故 主 藏 臣 寶 勝 業 報 生 能 具 天 眼 水 陸 遠 近 
T26n1538_001:0515b19	悉見伏藏。	悉 見 伏 藏 
T26n1538_001:0515b20	復次頌曰：	復 次 頌 曰 
T26n1538_001:0515b21	「飲食衣服花鬘等，　　往昔曾興清淨心，	 飲 食 衣 服 花 鬘 等 往 昔 曾 興 清 淨 心 
T26n1538_001:0515b22	　自手持奉開施門，　　復以燈明照諸暗。	 自 手 持 奉 開 施 門 復 以 燈 明 照 諸 暗 
T26n1538_001:0515b23	　得為主藏大臣寶，　　近侍名稱轉輪王，	 得 為 主 藏 大 臣 寶 近 侍 名 稱 轉 輪 王 
T26n1538_001:0515b24	　廣多富盛具大財，　　能獲天眼見伏藏。」	 廣 多 富 盛 具 大 財 能 獲 天 眼 見 伏 藏 
T26n1538_001:0515b25	又問：何因轉輪聖王得有主兵臣寶？答：轉輪	又 問 何 因 轉輪聖王 得 有 主 兵 臣 寶 答 轉 輪 
T26n1538_001:0515b26	聖王，往昔修因其事廣大，謂於父母知識及	聖 王 往 昔 修 因 其 事 廣 大 謂 於 父 母 知 識 及 
T26n1538_001:0515b27	師尊所并餘沙門婆羅門眾不生惱害，而復	師 尊 所 并 餘 沙 門 婆 羅 門 眾 不 生 惱 害 而 復 
T26n1538_001:0515b28	愛樂不惱害者，於諸昏黑暗冥作光明照，施	愛 樂 不 惱 害 者 於 諸 昏 黑 暗 冥 作 光 明 照 施 
T26n1538_001:0515b29	以燈具悉使明亮。以如是因故，轉輪聖王得	以 燈 具 悉 使 明 亮 以 如 是 因 故 轉輪聖王 得 
T26n1538_001:0515c01	有主兵臣寶。彼主兵臣寶者，聰叡明利、善喻	有 主 兵 臣 寶 彼 主 兵 臣 寶 者 聰 叡 明 利 善 喻 
T26n1538_001:0515c02	善察、智慧具足。至於王所，以現世事正法義	善 察 智慧具足 至 於 王 所 以 現 世 事 正 法 義 
T26n1538_001:0515c03	利輔贊於王，於他世事正法義利亦悉輔	利 輔 贊 於 王 於 他 世 事 正 法 義 利 亦 悉 輔 
T26n1538_001:0515c04	贊。於兵眾中，知其王意，存者存之、去者去	贊 於 兵 眾 中 知 其 王 意 存 者 存 之 去 者 去 
T26n1538_001:0515c05	之；不勞王力，亦復不假四兵運用，無使疲懈，	之 不 勞 王 力 亦 復 不 假 四 兵 運 用 無 使 疲 懈 
T26n1538_001:0515c06	而彼一切自然歸伏。	而 彼 一 切 自 然 歸 伏 
T26n1538_001:0515c07	復次頌曰：	復 次 頌 曰 
T26n1538_001:0515c08	「世間昏黑暗冥者，　　普作燈明為照曜，	 世 間 昏 黑 暗 冥 者 普 作 燈 明 為 照 曜 
T26n1538_001:0515c09	　施諸燈具及光明，　　悉使廣大皆明亮。	 施 諸 燈 具 及 光 明 悉 使 廣 大 皆 明 亮 
T26n1538_001:0515c10	　又於父母及知識，　　并餘沙門婆羅門，	 又 於 父 母 及 知 識 并 餘 沙 門 婆 羅 門 
T26n1538_001:0515c11	　廣作燈明普照明，　　咸得破暗而煥曜。	 廣 作 燈 明 普 照 明 咸 得 破 暗 而 煥 曜 
T26n1538_001:0515c12	　由斯善業施安樂，　　并餘善作諸勝事，	 由 斯 善 業 施 安 樂 并 餘 善 作 諸 勝 事 
T26n1538_001:0515c13	　輪王以此勝報因，　　獲得大智主兵寶。」	 輪 王 以 此 勝 報 因 獲 得 大 智 主 兵 寶 
T26n1538_001:0515c14	又問：何因主兵臣寶，聰叡明利、善喻善察、具	又 問 何 因 主 兵 臣 寶 聰 叡 明 利 善 喻 善 察 具 
T26n1538_001:0515c15	有智慧？答：彼主兵臣寶，往昔生中昔因建立，	有 智 慧 答 彼 主 兵 臣 寶 往 昔 生 中 昔 因 建 立 
T26n1538_001:0515c16	乃至極遠生生之前已盡已滅得為人時，於	乃 至 極 遠 生 生 之 前 已 盡 已 滅 得 為 人 時 於 
T26n1538_001:0515c17	諸沙門婆羅門聰叡明利、具有智慧、善伺察	諸 沙 門 婆 羅 門 聰 叡 明 利 具 有 智 慧 善 伺 察 
T26n1538_001:0515c18	者，故往親近恭敬請問：何者是善？何者不善？	者 故 往 親 近 恭 敬 請 問 何 者 是 善 何 者 不 善 
T26n1538_001:0515c19	何者有罪？何者無罪？何者所作當得勝上、離	何 者 有 罪 何 者 無 罪 何 者 所 作 當 得 勝 上 離 
T26n1538_001:0515c20	諸罪業？隨所聞已依法修行，常善伺察、常善	諸 罪 業 隨 所 聞 已 依 法 修 行 常 善 伺 察 常 善 
T26n1538_001:0515c21	思惟，若事若因勤求請益，作極拔事、行普	思 惟 若 事 若 因 勤 求 請 益 作 極 拔 事 行 普 
T26n1538_001:0515c22	救因，增極恪志逼切而行。以如是因故，聰叡	救 因 增 極 恪 志 逼 切 而 行 以 如 是 因 故 聰 叡 
T26n1538_001:0515c23	明利、具有智慧。	明 利 具 有 智 慧 
T26n1538_001:0515c24	復次頌曰：	復 次 頌 曰 
T26n1538_001:0515c25	「往昔親近諸智者，　　勤求伺察眾善因，	 往 昔 親 近 諸 智 者 勤 求 伺 察 眾 善 因 
T26n1538_001:0515c26	　發起最上利益心，　　於一切處無退倦。	 發 起 最 上 利 益 心 於 一 切 處 無 退 倦 
T26n1538_001:0515c27	　主兵臣寶由斯力，　　今得聰叡具智明，	 主 兵 臣 寶 由 斯 力 今 得 聰 叡 具 智 明 
T26n1538_001:0515c28	　迅疾發興精進心，　　今為輪王主兵寶。」	 迅 疾 發 興 精 進 心 今 為 輪 王 主 兵 寶 
T26n1538_001:0515c29	對法大論中因施設門第三	對 法 大 論 中 因 施 設 門 第 三 
T26n1538_001:0516a01	總說頌曰：	總 說 頌 曰 
T26n1538_001:0516a02	　轉輪聖王而具有，　　輪寶象馬并珠寶，	 轉輪聖王 而 具 有 輪 寶 象 馬 并 珠 寶 
T26n1538_001:0516a03	　女寶主藏及主兵，　　長壽無病具色相，	 女 寶 主 藏 及 主 兵 長 壽 無 病 具 色 相 
T26n1538_001:0516a04	　適意自在復多子，　　廣如第三蘊中說。	 適 意 自 在 復 多 子 廣 如 第 三 蘊 中 說 
T26n1538_001:0516a05	如論中說，轉輪聖王即同如來、應供、正等正	如 論 中 說 轉輪聖王 即 同 如 來 應 供 正 等 正 
T26n1538_001:0516a06	覺。	覺 
T26n1538_001:0516a07	復次頌曰：	復 次 頌 曰 
T26n1538_001:0516a08	「如論所說轉輪王，　　即同無上大法王，	 如 論 所 說 轉 輪 王 即 同 無 上 大 法 王 
T26n1538_001:0516a09	　於此大地境界中，　　轉大法輪作善利。	 於 此 大 地 境 界 中 轉 大 法 輪 作 善 利 
T26n1538_001:0516a10	　以彼轉輪聖王者，　　應觀即同佛如來，	 以 彼 轉輪聖王 者 應 觀 即 同 佛 如 來 
T26n1538_001:0516a11	　咸起悲心愍世間，　　廣利一切大寂默。」	 咸 起 悲 心 愍 世 間 廣 利 一 切 大 寂 默 
T26n1538_001:0516a12	如轉輪聖王有輪寶者，應知即同如來、應供、	如 轉輪聖王 有 輪 寶 者 應 知 即 同 如 來 應 供 
T26n1538_001:0516a13	正等正覺出現世間所說聖八正道法。以佛	正 等 正 覺 出 現 世 間 所 說 聖 八 正 道 法 以 佛 
T26n1538_001:0516a14	所說八正道者，能破世間一切煩惱，於諸法	所 說 八 正 道 者 能 破 世 間 一切煩惱 於 諸 法 
T26n1538_001:0516a15	中得無障礙。	中 得 無 障 礙 
T26n1538_001:0516a16	復次頌曰：	復 次 頌 曰 
T26n1538_001:0516a17	「轉輪聖王輪寶者，　　於此大地能摧伏；	 轉輪聖王 輪 寶 者 於 此 大 地 能 摧 伏 
T26n1538_001:0516a18	　如佛開演八正門，　　解除一切魔怨縛。」	 如 佛 開 演 八 正 門 解 除 一 切 魔 怨 縛 
T26n1538_001:0516a19	如轉輪聖王有象寶者，應知即同如來、應供、	如 轉輪聖王 有 象 寶 者 應 知 即 同 如 來 應 供 
T26n1538_001:0516a20	正等正覺所說四神足法。以佛所說四神足	正 等 正 覺 所 說 四 神 足 法 以 佛 所 說 四 神 足 
T26n1538_001:0516a21	者，能破世間一切煩惱，於諸法中得無障礙。	者 能 破 世 間 一切煩惱 於 諸 法 中 得 無 障 礙 
T26n1538_001:0516a22	復次頌曰：	復 次 頌 曰 
T26n1538_001:0516a23	「轉輪聖王白龍象，　　騰空來往悉自在；	 轉輪聖王 白 龍 象 騰 空 來 往 悉 自 在 
T26n1538_001:0516a24	　如來神足亦復然，　　瞿曇名稱廣神化。」	 如 來 神 足 亦 復 然 瞿 曇 名 稱 廣 神 化 
T26n1538_001:0516a25	如轉輪聖王有馬寶者，應知即同如來、應供、	如 轉輪聖王 有 馬 寶 者 應 知 即 同 如 來 應 供 
T26n1538_001:0516a26	正等正覺所說四正斷法。以佛所說四正斷	正 等 正 覺 所 說 四 正 斷 法 以 佛 所 說 四 正 斷 
T26n1538_001:0516a27	者，能破世間一切煩惱，於諸法中得無障	者 能 破 世 間 一切煩惱 於 諸 法 中 得 無 障 
T26n1538_001:0516a28	礙。	礙 
T26n1538_001:0516a29	復次頌曰：	復 次 頌 曰 
T26n1538_001:0516b01	「輪王青身妙馬寶，　　圓具調馴迅若風；	 輪 王 青 身 妙 馬 寶 圓 具 調 馴 迅 若 風 
T26n1538_001:0516b02	　如佛四正斷法門，　　速證無為寂靜果。	 如 佛 四 正 斷 法 門 速 證 無 為 寂 靜 果 
T26n1538_001:0516b03	　馬相嚴好頭頂黑，　　而彼馬寶輪王乘；	 馬 相 嚴 好 頭 頂 黑 而 彼 馬 寶 輪 王 乘 
T26n1538_001:0516b04	　四正斷法亦復然，　　瞿曇名稱廣自在。」	 四 正 斷 法 亦 復 然 瞿 曇 名 稱 廣 自 在 
