T26n1538_004:0523a12	對法大論中因施設門第八之一	對 法 大 論 中 因 施 設 門 第 八 之 一 
T26n1538_004:0523a13	總說頌曰：	總 說 頌 曰 
T26n1538_004:0523a14	　先際穢氣及堅重，　　穢氣上風而飄散，	 先 際 穢 氣 及 堅 重 穢 氣 上 風 而 飄 散 
T26n1538_004:0523a15	　充滿出息入息俱，　　晝夜魚龜陸中等。	 充 滿 出息入息 俱 晝 夜 魚 龜 陸 中 等 
T26n1538_004:0523a16	如佛所說。	如 佛 所 說 
T26n1538_004:0523a17	佛告諸苾芻言：「汝諸苾芻！不能了知先際，皆	佛 告 諸 苾 芻 言 汝 諸 苾 芻 不 能 了 知 先 際 皆 
T26n1538_004:0523a18	因有、愛二法。於先際中若無有、愛，即後無所	因 有 愛 二 法 於 先 際 中 若 無 有 愛 即 後 無 所 
T26n1538_004:0523a19	起。若能了知如是法者，即自思惟：『於後際法，	起 若 能 了 知 如 是 法 者 即 自 思 惟 於 後 際 法 
T26n1538_004:0523a20	有愛為緣、為有相續，不了知邪？為無相續邪？』	有 愛 為 緣 為 有 相 續 不 了 知 邪 為 無 相 續 邪 
T26n1538_004:0523a21	或有答言：『此無相續。』何所以邪？謂不了知故。	或 有 答 言 此 無 相 續 何 所 以 邪 謂 不 了 知 故 
T26n1538_004:0523a22	於無明中諸眾生類，乃起是念：『我過去世為	於 無 明 中 諸 眾 生 類 乃 起 是 念 我 過 去 世 為 
T26n1538_004:0523a23	有為無？』若過去世有，此即是常。若過去世無，	有 為 無 若 過 去 世 有 此 即 是 常 若 過 去 世 無 
T26n1538_004:0523a24	此即是斷。而乃諸行或有因邪？若彼諸行先	此 即 是 斷 而 乃 諸 行 或 有 因 邪 若 彼 諸 行 先 
T26n1538_004:0523a25	有因者，然亦諸行先無有因。是故若能了知	有 因 者 然 亦 諸 行 先 無 有 因 是 故 若 能 了 知 
T26n1538_004:0523a26	先際，即諸行本來而無有因。」	先 際 即 諸 行 本 來 而 無 有 因 
T26n1538_004:0523a27	又問：何因未離欲者當趣滅已，火焚身時，	又 問 何 因 未 離 欲 者 當 趣 滅 已 火 焚 身 時 
T26n1538_004:0523a28	而有穢氣周遍充塞；已離欲者火焚身時，而	而 有 穢 氣 周 遍 充 塞 已 離 欲 者 火 焚 身 時 而 
T26n1538_004:0523a29	無穢氣周遍充塞？答：未離欲者，謂以身中精	無 穢 氣 周 遍 充 塞 答 未 離 欲 者 謂 以 身 中 精 
T26n1538_004:0523b01	血不淨而有流散，以流散故，火焚身時風飄	血 不 淨 而 有 流 散 以 流 散 故 火 焚 身 時 風 飄 
T26n1538_004:0523b02	穢氣而有充塞，故使大威力諸天不來勤勇	穢 氣 而 有 充 塞 故 使 大 威 力 諸 天 不 來 勤 勇 
T26n1538_004:0523b03	作供養事。何以故？穢氣未散故。已離欲者，當	作 供 養 事 何 以 故 穢 氣 未 散 故 已 離 欲 者 當 
T26n1538_004:0523b04	趣滅已，身無精血不淨流散。以不流散故，火	趣 滅 已 身 無 精 血 不 淨 流 散 以 不 流 散 故 火 
T26n1538_004:0523b05	焚身時而無穢氣，是故大威力諸天悉來勤	焚 身 時 而 無 穢 氣 是 故 大 威 力 諸 天 悉 來 勤 
T26n1538_004:0523b06	勇作供養事。何以故？無穢氣故。	勇 作 供 養 事 何 以 故 無 穢 氣 故 
T26n1538_004:0523b07	又問：何因未離欲者，當趣滅已，身體堅重而	又 問 何 因 未 離 欲 者 當 趣 滅 已 身 體 堅 重 而 
T26n1538_004:0523b08	不調暢；已離欲者，當趣滅已，身體調暢而不	不 調 暢 已 離 欲 者 當 趣 滅 已 身 體 調 暢 而 不 
T26n1538_004:0523b09	堅重？答：未離欲者，上風吹鼓內入其身，是故	堅 重 答 未 離 欲 者 上 風 吹 鼓 內 入 其 身 是 故 
T26n1538_004:0523b10	堅重而不調暢。已離欲者，當趣滅已，止攝外	堅 重 而 不 調 暢 已 離 欲 者 當 趣 滅 已 止 攝 外 
T26n1538_004:0523b11	風，身得調暢而無堅重。由此因故，其事如是。	風 身 得 調 暢 而 無 堅 重 由 此 因 故 其 事 如 是 
T26n1538_004:0523b12	施設論卷第四	施 設 論 卷 第 四 
T26n1538_005:0523b16	施設論卷第五	施 設 論 卷 第 五 
T26n1538_005:0523b18	譯經三藏朝散大夫試光祿卿	譯 經 三 藏 朝 散 大 夫 試 光 祿 卿 
T26n1538_005:0523b19	光梵大師賜紫沙門臣惟淨等	光 梵 大 師 賜 紫 沙 門 臣 惟 淨 等 
T26n1538_005:0523b20	奉　詔譯	奉 詔 譯 
T26n1538_005:0523b21	對法大論中因施設門第八之二	對 法 大 論 中 因 施 設 門 第 八 之 二 
T26n1538_005:0523b22	又問：何因未離欲者當趣滅時，上風吹鼓	又 問 何 因 未 離 欲 者 當 趣 滅 時 上 風 吹 鼓 
T26n1538_005:0523b23	內入其身；已離欲者當趣滅時，無上風吹鼓	內 入 其 身 已 離 欲 者 當 趣 滅 時 無 上 風 吹 鼓 
T26n1538_005:0523b24	內入其身？答：未離欲者當趣滅時，外心生起，	內 入 其 身 答 未 離 欲 者 當 趣 滅 時 外 心 生 起 
T26n1538_005:0523b25	住著奔流，風吹目開，心周遍故其風不止，是	住 著 奔 流 風 吹 目 開 心 周 遍 故 其 風 不 止 是 
T26n1538_005:0523b26	故上風吹鼓內入其身。已離欲者當趣滅時，	故 上 風 吹 鼓 內 入 其 身 已 離 欲 者 當 趣 滅 時 
T26n1538_005:0523b27	無外心生起住著奔流，無風所吹目不開合，	無 外 心 生 起 住 著 奔 流 無 風 所 吹 目 不 開 合 
T26n1538_005:0523b28	無心周遍其風乃止，是故無上風吹鼓內入	無 心 周 遍 其 風 乃 止 是 故 無 上 風 吹 鼓 內 入 
T26n1538_005:0523b29	其身。由此因故，其事如是。	其 身 由 此 因 故 其 事 如 是 
T26n1538_005:0523c01	又問：何因人命存活，身體輕安而復調暢；命	又 問 何 因 人 命 存 活 身 體 輕 安 而 復 調 暢 命 
T26n1538_005:0523c02	既終歿，身體堅重而不調暢。答：其終歿者，邊	既 終 歿 身 體 堅 重 而 不 調 暢 答 其 終 歿 者 邊 
T26n1538_005:0523c03	際分位火界風界二界俱滅，是故堅重而不	際 分 位 火 界 風 界 二 界 俱 滅 是 故 堅 重 而 不 
T26n1538_005:0523c04	調暢。彼存活者，中間分位火界風界二界不	調 暢 彼 存 活 者 中 間 分 位 火 界 風 界 二 界 不 
T26n1538_005:0523c05	滅，是故輕安而復調暢。由此因故，其事如	滅 是 故 輕 安 而 復 調 暢 由 此 因 故 其 事 如 
T26n1538_005:0523c06	是。又問：何因人命存活，現住世間，飲食銷	是 又 問 何 因 人 命 存 活 現 住 世 間 飲 食 銷 
T26n1538_005:0523c07	散；既終歿已，食不銷散？答：人命存活現住	散 既 終 歿 已 食 不 銷 散 答 人 命 存 活 現 住 
T26n1538_005:0523c08	世者，中間分位火界水界風界不滅，由彼水	世 者 中 間 分 位 火 界 水 界 風 界 不 滅 由 彼 水 
T26n1538_005:0523c09	界流潤、火界成熟、風界吹鼓，故其所食而	界 流 潤 火 界 成 熟 風 界 吹 鼓 故 其 所 食 而 
T26n1538_005:0523c10	乃銷散。彼終歿者，邊際分位水界火界風	乃 銷 散 彼 終 歿 者 邊 際 分 位 水 界 火 界 風 
T26n1538_005:0523c11	界俱滅，以其所食，水不流潤、火不成熟、風	界 俱 滅 以 其 所 食 水 不 流 潤 火 不 成 熟 風 
T26n1538_005:0523c12	不吹鼓，故不銷散。由此因故，其事如是。	不 吹 鼓 故 不 銷 散 由 此 因 故 其 事 如 是 
T26n1538_005:0523c13	又問：何因人命存活，現住世間，身無穢氣；	又 問 何 因 人 命 存 活 現 住 世 間 身 無 穢 氣 
T26n1538_005:0523c14	既終歿已；穢氣充盈？答：人命存活現住世者，	既 終 歿 已 穢 氣 充 盈 答 人 命 存 活 現 住 世 者 
T26n1538_005:0523c15	中間分位火界風界二界不滅，隨逐水界而	中 間 分 位 火 界 風 界 二 界 不 滅 隨 逐 水 界 而 
T26n1538_005:0523c16	得盈滿，是故彼身無諸穢氣。既終歿已，邊際	得 盈 滿 是 故 彼 身 無 諸 穢 氣 既 終 歿 已 邊 際 
T26n1538_005:0523c17	分位火界風界二界俱滅，不隨水界而得盈	分 位 火 界 風 界 二 界 俱 滅 不 隨 水 界 而 得 盈 
T26n1538_005:0523c18	滿，是故彼身乃有穢氣。由此因故，其事如	滿 是 故 彼 身 乃 有 穢 氣 由 此 因 故 其 事 如 
T26n1538_005:0523c19	是。	是 
T26n1538_005:0523c20	又問：何因人命存活，現住世間，出息入息	又 問 何 因 人 命 存 活 現 住 世 間 出息入息 
T26n1538_005:0523c21	而常隨轉；彼終歿者，其事不然？答：命存活者，	而 常 隨 轉 彼 終 歿 者 其 事 不 然 答 命 存 活 者 
T26n1538_005:0523c22	以思惟發悟故依止於思，是故存活出入息	以 思 惟 發 悟 故 依 止 於 思 是 故 存 活 出 入 息 
T26n1538_005:0523c23	轉。既終歿者，無所思故，其事如是。	轉 既 終 歿 者 無 所 思 故 其 事 如 是 
T26n1538_005:0523c24	又問：何因彼訓狐鳥，夜見晝不見？答：彼訓狐	又 問 何 因 彼 訓 狐 鳥 夜 見 晝 不 見 答 彼 訓 狐 
T26n1538_005:0523c25	鳥，目中瞳人其狀赤色，夜中無障、晝即有	鳥 目 中 瞳 人 其 狀 赤 色 夜 中 無 障 晝 即 有 
T26n1538_005:0523c26	障，是故夜見而晝不見。又問：何因人能晝	障 是 故 夜 見 而 晝 不 見 又 問 何 因 人 能 晝 
T26n1538_005:0523c27	見夜乃不見？答：人之目中瞳人，其狀黑色，晝	見 夜 乃 不 見 答 人 之 目 中 瞳 人 其 狀 黑 色 晝 
T26n1538_005:0523c28	乃無障、夜即有障，是故晝見而夜不見。	乃 無 障 夜 即 有 障 是 故 晝 見 而 夜 不 見 
T26n1538_005:0523c29	又問：何因犬馬夜見晝亦能見？答：犬馬目中	又 問 何 因 犬 馬 夜 見 晝 亦 能 見 答 犬 馬 目 中 
T26n1538_005:0524a01	瞳人黃色，晝夜無障，是故俱見。	瞳 人 黃 色 晝 夜 無 障 是 故 俱 見 
T26n1538_005:0524a02	又問：何因魚於水中能見、陸中不見？答：諸魚	又 問 何 因 魚 於 水 中 能 見 陸 中 不 見 答 諸 魚 
T26n1538_005:0524a03	者目中瞳人，眵淚所覆，水中無障、陸中有障，	者 目 中 瞳 人 眵 淚 所 覆 水 中 無 障 陸 中 有 障 
T26n1538_005:0524a04	故水中見、陸中不見。又問：何因人之兩目，	故 水 中 見 陸 中 不 見 又 問 何 因 人 之 兩 目 
T26n1538_005:0524a05	陸中無障、水中有障？答：人之目中瞳人，水泡	陸 中 無 障 水 中 有 障 答 人 之 目 中 瞳 人 水 泡 
T26n1538_005:0524a06	所成，是故陸中無障、水中有障。	所 成 是 故 陸 中 無 障 水 中 有 障 
T26n1538_005:0524a07	又問：何因龜鼈蝦蟇及水蛭等，水陸俱見？答：	又 問 何 因 龜 鼈 蝦 蟇 及 水 蛭 等 水 陸 俱 見 答 
T26n1538_005:0524a08	龜鼈蝦蟇及水蛭等，目中瞳人，骨之所成，陸	龜 鼈 蝦 蟇 及 水 蛭 等 目 中 瞳 人 骨 之 所 成 陸 
T26n1538_005:0524a09	中水中俱無障礙，是故俱見。	中 水 中 俱 無 障 礙 是 故 俱 見 
T26n1538_005:0524a10	對法大論中因施設門第九	對 法 大 論 中 因 施 設 門 第 九 
T26n1538_005:0524a11	總說頌曰：	總 說 頌 曰 
T26n1538_005:0524a12	　睡眠惡戾及棹舉，　　多舌語言并暗鈍，	 睡 眠 惡 戾 及 棹 舉 多 舌 語 言 并 暗 鈍 
T26n1538_005:0524a13	　念慧而復煩惱增，　　不頴利於禪定等。	 念 慧 而 復 煩 惱 增 不 頴 利 於 禪 定 等 
T26n1538_005:0524a14	又問：何因世間有多睡眠之者？答：謂若有	又 問 何 因 世 間 有 多 睡 眠 之 者 答 謂 若 有 
T26n1538_005:0524a15	人常所近習多睡眠者，於光明法中而不近	人 常 所 近 習 多 睡 眠 者 於 光 明 法 中 而 不 近 
T26n1538_005:0524a16	習。彼人至謝滅已，當復云何？謂作蟒蛇龍	習 彼 人 至 謝 滅 已 當 復 云 何 謂 作 蟒 蛇 龍 
T26n1538_005:0524a17	等。由此因故？其事如是。	等 由 此 因 故 其 事 如 是 
T26n1538_005:0524a18	又問：何因有少睡眠者？答：謂若有人於光明	又 問 何 因 有 少 睡 眠 者 答 謂 若 有 人 於 光 明 
T26n1538_005:0524a19	法中，作光明想多所近習，於昏沈睡眠法中	法 中 作 光 明 想 多 所 近 習 於 昏 沈 睡 眠 法 中 
T26n1538_005:0524a20	而不近習。彼人至謝滅已，當復云何？謂作	而 不 近 習 彼 人 至 謝 滅 已 當 復 云 何 謂 作 
T26n1538_005:0524a21	仙人及出家人、諸長者等，或生色、無色界天	仙 人 及 出 家 人 諸 長 者 等 或 生 色 無 色 界 天 
T26n1538_005:0524a22	中。由此因故，其事如是。	中 由 此 因 故 其 事 如 是 
T26n1538_005:0524a23	又問：何因有惡戾者？答：謂若有人常所近習	又 問 何 因 有 惡 戾 者 答 謂 若 有 人 常 所 近 習 
T26n1538_005:0524a24	運用執行刀杖器械諸惡戾人，不能近習	運 用 執 行 刀 杖 器 械 諸 惡 戾 人 不 能 近 習 
T26n1538_005:0524a25	不行刀杖不惡戾者。彼人至謝滅已，當復	不 行 刀 杖 不 惡 戾 者 彼 人 至 謝 滅 已 當 復 
T26n1538_005:0524a26	云何？謂作屠宰魁膾、畋獵漁捕、調制象馬、杻	云 何 謂 作 屠 宰 魁 膾 畋 獵 漁 捕 調 制 象 馬 杻 
T26n1538_005:0524a27	械繫縛諸不律者。由此因故，其事如是。	械 繫 縛 諸 不 律 者 由 此 因 故 其 事 如 是 
T26n1538_005:0524a28	又問：何因有不惡戾者？答：謂若有人常所近	又 問 何 因 有 不 惡 戾 者 答 謂 若 有 人 常 所 近 
T26n1538_005:0524a29	習不行刀杖不惡戾人，而不近習諸惡戾者。	習 不 行 刀 杖 不 惡 戾 人 而 不 近 習 諸 惡 戾 者 
T26n1538_005:0524b01	彼人至謝滅已，當復云何？謂作仙人及出家	彼 人 至 謝 滅 已 當 復 云 何 謂 作 仙 人 及 出 家 
T26n1538_005:0524b02	人、諸長者等，或生色、無色界天中。由此因故，	人 諸 長 者 等 或 生 色 無 色 界 天 中 由 此 因 故 
T26n1538_005:0524b03	其事如是。	其 事 如 是 
T26n1538_005:0524b04	又問：何因有掉舉者？答：謂若有人常所近習	又 問 何 因 有 掉 舉 者 答 謂 若 有 人 常 所 近 習 
T26n1538_005:0524b05	多掉舉者，不能近習諸寂止者。彼人至謝滅	多 掉 舉 者 不 能 近 習 諸 寂 止 者 彼 人 至 謝 滅 
T26n1538_005:0524b06	已，當復云何？謂作歌舞戲笑之人，或生欲界	已 當 復 云 何 謂 作 歌 舞 戲 笑 之 人 或 生 欲 界 
T26n1538_005:0524b07	天中。由此因故，其事如是。	天 中 由 此 因 故 其 事 如 是 
T26n1538_005:0524b08	又問：何因有不掉舉者？答：謂若有人常所近	又 問 何 因 有 不 掉 舉 者 答 謂 若 有 人 常 所 近 
T26n1538_005:0524b09	習諸寂止者：而不近習掉舉之人。彼人至謝	習 諸 寂 止 者 而 不 近 習 掉 舉 之 人 彼 人 至 謝 
T26n1538_005:0524b10	滅已：當復云何：謂作仙人及出家人、諸長者	滅 已 當 復 云 何 謂 作 仙 人 及 出 家 人 諸 長 者 
T26n1538_005:0524b11	等，或生色、無色界天中。由此因故，其事如	等 或 生 色 無 色 界 天 中 由 此 因 故 其 事 如 
T26n1538_005:0524b12	是。	是 
T26n1538_005:0524b13	又問：何因世有多舌多語之者？答：謂若有人	又 問 何 因 世 有 多 舌 多 語 之 者 答 謂 若 有 人 
T26n1538_005:0524b14	常所近習多語之人，不能近習少語之者。彼	常 所 近 習 多 語 之 人 不 能 近 習 少 語 之 者 彼 
T26n1538_005:0524b15	人至謝滅已，當復云何？謂作鸚鵡鶖鷺、拘枳	人 至 謝 滅 已 當 復 云 何 謂 作 鸚 鵡 鶖 鷺 拘 枳 
T26n1538_005:0524b16	羅燕鴈等諸飛鳥。由此因故，其事如是。	羅 燕 鴈 等 諸 飛 鳥 由 此 因 故 其 事 如 是 
T26n1538_005:0524b17	又問：何因有不多舌多語者？答：謂若有人常	又 問 何 因 有 不 多 舌 多 語 者 答 謂 若 有 人 常 
T26n1538_005:0524b18	所近習少語之人，不能近習多語之者。彼人	所 近 習 少 語 之 人 不 能 近 習 多 語 之 者 彼 人 
T26n1538_005:0524b19	至謝滅已，當復云何？謂作仙人及出家人、諸	至 謝 滅 已 當 復 云 何 謂 作 仙 人 及 出 家 人 諸 
T26n1538_005:0524b20	長者等，或生，色無色界天中。由此因故，其	長 者 等 或 生 色無色界 天 中 由 此 因 故 其 
T26n1538_005:0524b21	事如是。	事 如 是 
T26n1538_005:0524b22	又問：何因有暗鈍者？答：謂若有人不能近習	又 問 何 因 有 暗 鈍 者 答 謂 若 有 人 不 能 近 習 
T26n1538_005:0524b23	多聞之人，不以各各方處之言說釋義理。由	多 聞 之 人 不 以 各 各 方 處 之 言 說 釋 義 理 由 
T26n1538_005:0524b24	此因故，其事如是。	此 因 故 其 事 如 是 
T26n1538_005:0524b25	又問：何因有不暗鈍者？答：謂若有人常所近	又 問 何 因 有 不 暗 鈍 者 答 謂 若 有 人 常 所 近 
T26n1538_005:0524b26	習多聞之人，不能近習寡聞之者，能以各各	習 多 聞 之 人 不 能 近 習 寡 聞 之 者 能 以 各 各 
T26n1538_005:0524b27	方處之言說釋義理。彼人至謝滅已，謂作婆	方 處 之 言 說 釋 義 理 彼 人 至 謝 滅 已 謂 作 婆 
T26n1538_005:0524b28	羅門中善說法者，或作沙門中善說法者。由	羅 門 中 善 說 法 者 或 作 沙 門 中 善 說 法 者 由 
T26n1538_005:0524b29	此因故，其事如是。	此 因 故 其 事 如 是 
T26n1538_005:0524c01	復次當知，少語之人有其二種：一者卑賤：二	復 次 當 知 少 語 之 人 有 其 二 種 一 者 卑 賤 二 
T26n1538_005:0524c02	者尊高。何等是為卑賤少語？謂若有人，雖復	者 尊 高 何 等 是 為 卑 賤 少 語 謂 若 有 人 雖 復 
T26n1538_005:0524c03	卑賤，以有智故，常能依止父母師長名稱尊	卑 賤 以 有 智 故 常 能 依 止 父 母 師 長 名 稱 尊 
T26n1538_005:0524c04	者及餘有智之人，故雖卑賤而能少語。何等	者 及 餘 有 智 之 人 故 雖 卑 賤 而 能 少 語 何 等 
T26n1538_005:0524c05	是為尊高少語，謂若有人，本性尊高而復有	是 為 尊 高 少 語 謂 若 有 人 本 性 尊 高 而 復 有 
T26n1538_005:0524c06	智，常能依止父母師長名稱尊者及餘有智	智 常 能 依 止 父 母 師 長 名 稱 尊 者 及 餘 有 智 
T26n1538_005:0524c07	之人，故能少語。	之 人 故 能 少 語 
T26n1538_005:0524c08	又問，何因世有有行無慧之者？答：謂若有人	又 問 何 因 世 有 有 行 無 慧 之 者 答 謂 若 有 人 
T26n1538_005:0524c09	多求正法心無厭足，然於理趣不能伺察。由	多 求 正 法 心 無 厭 足 然 於 理 趣 不 能 伺 察 由 
T26n1538_005:0524c10	此因故，其事如是。	此 因 故 其 事 如 是 
T26n1538_005:0524c11	又問：何因世有有慧無行之者？答：謂若有人	又 問 何 因 世 有 有 慧 無 行 之 者 答 謂 若 有 人 
T26n1538_005:0524c12	於法理趣能諦伺察，然於正法不能多求，	於 法 理 趣 能 諦 伺 察 然 於 正 法 不 能 多 求 
T26n1538_005:0524c13	少以為足。由此因故，其事如是。	少 以 為 足 由 此 因 故 其 事 如 是 
T26n1538_005:0524c14	又問：何因世有無慧無行之者：答：謂若有人	又 問 何 因 世 有 無 慧 無 行 之 者 答 謂 若 有 人 
T26n1538_005:0524c15	不能多求正法，復於理趣不能伺察。由此因	不 能 多 求 正 法 復 於 理 趣 不 能 伺 察 由 此 因 
T26n1538_005:0524c16	故，其事如是。	故 其 事 如 是 
T26n1538_005:0524c17	又問：何因世有有行有慧之者？答：謂若有人	又 問 何 因 世 有 有 行 有 慧 之 者 答 謂 若 有 人 
T26n1538_005:0524c18	多求正法，復於理趣能諦伺察。由此因故，其	多 求 正 法 復 於 理 趣 能 諦 伺 察 由 此 因 故 其 
T26n1538_005:0524c19	事如是。	事 如 是 
T26n1538_005:0524c20	又問：何因而能住持正法？答：謂若有人能於	又 問 何 因 而 能 住 持 正 法 答 謂 若 有 人 能 於 
T26n1538_005:0524c21	諸法行相之中，依止十二處法而善攝受。由	諸 法 行 相 之 中 依 止 十 二 處 法 而 善 攝 受 由 
T26n1538_005:0524c22	此因故，其事如是。	此 因 故 其 事 如 是 
T26n1538_005:0524c23	又問，何因世有失念之者，答：謂若有人於不	又 問 何 因 世 有 失 念 之 者 答 謂 若 有 人 於 不 
T26n1538_005:0524c24	善法，積集而轉、近習修作、廣多惡行。彼人身	善 法 積 集 而 轉 近 習 修 作 廣 多 惡 行 彼 人 身 
T26n1538_005:0524c25	壞命終，墮在惡趣地獄中。生地獄歿已，設欲	壞 命 終 墮 在 惡 趣 地 獄 中 生 地 獄 歿 已 設 欲 
T26n1538_005:0524c26	來生人同分中，縱得為人壽量短促。人中	來 生 人 同 分 中 縱 得 為 人 壽 量 短 促 人 中 
T26n1538_005:0524c27	歿已，當生還復無多記念、所為忘失。由此因	歿 已 當 生 還 復 無 多 記 念 所 為 忘 失 由 此 因 
T26n1538_005:0524c28	故，其事如是。	故 其 事 如 是 
T26n1538_005:0524c29	又問：何因世有多記念者？答：謂若有人於諸	又 問 何 因 世 有 多 記 念 者 答 謂 若 有 人 於 諸 
T26n1538_005:0525a01	善法，積集而轉、近習修作、廣多善行。彼人身	善 法 積 集 而 轉 近 習 修 作 廣 多 善 行 彼 人 身 
T26n1538_005:0525a02	壞命終，墮在善趣天界中。生天趣歿已，若欲	壞 命 終 墮 在 善 趣 天 界 中 生 天 趣 歿 已 若 欲 
T26n1538_005:0525a03	來生人同分中，即得為人，壽量長遠。人中歿	來 生 人 同 分 中 即 得 為 人 壽 量 長 遠 人 中 歿 
T26n1538_005:0525a04	已，當生還復廣多記念、所為不忘。由此因故，	已 當 生 還 復 廣 多 記 念 所 為 不 忘 由 此 因 故 
T26n1538_005:0525a05	其事如是。	其 事 如 是 
T26n1538_005:0525a06	又問：何因世有深極煩惱之者？答：謂若有人	又 問 何 因 世 有 深 極 煩 惱 之 者 答 謂 若 有 人 
T26n1538_005:0525a07	於其欲想、瞋想、害想、欲因、瞋因、害因、欲尋、瞋尋、	於 其 欲 想 瞋 想 害 想 欲 因 瞋 因 害 因 欲 尋 瞋 尋 
T26n1538_005:0525a08	害尋，近習修作，於極煩惱隨應而轉。由此因	害 尋 近 習 修 作 於 極 煩 惱 隨 應 而 轉 由 此 因 
T26n1538_005:0525a09	故，其事如是。又問：何因世有不極煩惱之者？	故 其 事 如 是 又 問 何 因 世 有 不 極 煩 惱 之 者 
T26n1538_005:0525a10	答：謂若有人於出離想、不瞋想、不害想、出離	答 謂 若 有 人 於 出 離 想 不 瞋 想 不 害 想 出 離 
T26n1538_005:0525a11	因、不瞋因、不害因、出離尋、不瞋尋、不害尋，近	因 不 瞋 因 不 害 因 出 離 尋 不 瞋 尋 不 害 尋 近 
T26n1538_005:0525a12	習修作，於極煩惱不隨應轉。由此因故，其事	習 修 作 於 極 煩 惱 不 隨 應 轉 由 此 因 故 其 事 
T26n1538_005:0525a13	如是。	如 是 
T26n1538_005:0525a14	又問：何因世有不能速成禪定、忍辱二善法	又 問 何 因 世 有 不 能 速 成 禪 定 忍 辱 二 善 法 
T26n1538_005:0525a15	者？答：謂若有人於其諸法行相決定義中不	者 答 謂 若 有 人 於 其 諸 法 行 相 決 定 義 中 不 
T26n1538_005:0525a16	善攝受。由此因故，不能速成禪定、忍辱二種	善 攝 受 由 此 因 故 不 能 速 成 禪 定 忍 辱 二 種 
T26n1538_005:0525a17	善法。	善 法 
T26n1538_005:0525a18	又問：何因有能速成禪定：忍辱二種善法者？	又 問 何 因 有 能 速 成 禪 定 忍 辱 二 種 善 法 者 
T26n1538_005:0525a19	答：謂若有人於其諸法行相決定義中能善	答 謂 若 有 人 於 其 諸 法 行 相 決 定 義 中 能 善 
T26n1538_005:0525a20	攝受。由此因故，即能速成禪定、忍辱二種善	攝 受 由 此 因 故 即 能 速 成 禪 定 忍 辱 二 種 善 
T26n1538_005:0525a21	法。◎	法 
T26n1538_005:0525a22	◎對法大論中因施設門第十之一	 對 法 大 論 中 因 施 設 門 第 十 之 一 
T26n1538_005:0525a23	總說頌曰：	總 說 頌 曰 
T26n1538_005:0525a24	　須彌大地及方處，　　山有廣多草木者，	 須 彌 大 地 及 方 處 山 有 廣 多 草 木 者 
T26n1538_005:0525a25	　多樹及彼枝葉多，　　花果豐盈茂盛等。	 多 樹 及 彼 枝 葉 多 花 果 豐 盈 茂 盛 等 
T26n1538_005:0525a26	又問：何因一切山中，須彌山王最高最勝？答：	又 問 何 因 一 切 山 中 須 彌 山 王 最 高 最 勝 答 
T26n1538_005:0525a27	世界成，時彼須彌山界地最上、處逕最上、殊	世 界 成 時 彼 須 彌 山 界 地 最 上 處 逕 最 上 殊 
T26n1538_005:0525a28	妙最上、輪圍最上，總聚方處而成其山。由此	妙 最 上 輪 圍 最 上 總 聚 方 處 而 成 其 山 由 此 
T26n1538_005:0525a29	因故，須彌山王最高最勝。	因 故 須 彌 山 王 最 高 最 勝 
T26n1538_005:0525b01	又問：何因北方地界多樹多草？答：世界成時，	又 問 何 因 北 方 地 界 多 樹 多 草 答 世 界 成 時 
T26n1538_005:0525b02	北面風吹，界地最上、處逕最上、殊妙最上，總	北 面 風 吹 界 地 最 上 處 逕 最 上 殊 妙 最 上 總 
T26n1538_005:0525b03	聚方處，是故北方多樹多草。	聚 方 處 是 故 北 方 多 樹 多 草 
T26n1538_005:0525b04	又問：何因於大地中，一類地高、一類地下？答：	又 問 何 因 於 大 地 中 一 類 地 高 一 類 地 下 答 
T26n1538_005:0525b05	此大地中，一類地方土界高涌，得少天雨流	此 大 地 中 一 類 地 方 土 界 高 涌 得 少 天 雨 流 
T26n1538_005:0525b06	潤澍渧，其下低陷故彼地下。又此大地，一類	潤 澍 渧 其 下 低 陷 故 彼 地 下 又 此 大 地 一 類 
