T30n1581_003:0903a22	以有足故有遊行。以有身故有屈申。以有飢	以 有 足 故 有 遊 行 以 有 身 故 有 屈 申 以 有 飢 
T30n1581_003:0903a23	渴故有求飲食。如是比無量無數名以有因	渴 故 有 求 飲 食 如 是 比 無量無數 名 以 有 因 
T30n1581_003:0903a24	種諸種子。名種殖因。水土潤澤。是名攝因。	種 諸 種 子 名 種 殖 因 水 土 潤 澤 是 名 攝 因 
T30n1581_003:0903a25	種子於芽。是名生因。芽莖相續乃至成熟。	種 子 於 芽 是 名 生 因 芽 莖 相 續 乃 至 成 熟 
T30n1581_003:0903a26	是名長因種種種子各各自生。是名自種因。	是 名 長 因 種 種 種 子 各 各 自 生 是 名 自 種 因 
T30n1581_003:0903a27	彼以有因種殖因攝因生因長因自種因。此	彼 以 有 因 種 殖 因 攝 因 生 因 長 因 自 種 因 此 
T30n1581_003:0903a28	六因總說共事因。障礙於生。名相違因。不	六 因 總 說 共 事 因 障 礙 於 生 名 相 違 因 不 
T30n1581_003:0903a29	障礙者。名不相違因。彼相違有六種一者語	障 礙 者 名 不相違因 彼 相 違 有 六 種 一 者 語 
T30n1581_003:0903b01	相違。謂沙門婆羅門所說經論。前後相違。二	相 違 謂 沙 門 婆 羅 門 所 說 經 論 前 後 相 違 二 
T30n1581_003:0903b02	者所應相違。謂說一切義與理相違。三者生	者 所 應 相 違 謂 說 一 切 義 與 理 相 違 三 者 生 
T30n1581_003:0903b03	相違。謂生緣不具。障礙於生四者處相違。謂	相 違 謂 生 緣 不 具 障 礙 於 生 四 者 處 相 違 謂 
T30n1581_003:0903b04	明暗愛恚苦樂等法。五者怨相違。謂毒蛇鼠	明 暗 愛 恚 苦 樂 等 法 五 者 怨 相 違 謂 毒 蛇 鼠 
T30n1581_003:0903b05	狼猫鼠。是等蟲獸各各怨害。六者對治相	狼 猫 鼠 是 等 蟲 獸 各 各 怨 害 六 者 對 治 相 
T30n1581_003:0903b06	違。謂修不淨對治貪欲。慈息瞋恚。悲止害覺。	違 謂 修 不 淨 對 治 貪 欲 慈 息 瞋 恚 悲 止 害 覺 
T30n1581_003:0903b07	無漏道品永斷煩惱。此中以生相違故。說此	無 漏 道 品 永 斷 煩 惱 此 中 以 生 相 違 故 說 此 
T30n1581_003:0903b08	諸因二因所攝。一者生因。二者方便因。若	諸 因 二 因 所 攝 一 者 生 因 二 者 方 便 因 若 
T30n1581_003:0903b09	種諸種子生。是名生因。諸餘因。是名方便	種 諸 種 子 生 是 名 生 因 諸 餘 因 是 名 方 便 
T30n1581_003:0903b10	因。	因 
T30n1581_003:0903b11	復次有四緣。因緣次第緣緣緣增上緣。生因	復 次 有 四 緣 因 緣 次 第 緣 緣 緣 增 上 緣 生 因 
T30n1581_003:0903b12	者。是因緣。方便因者。是增上緣。次第緣緣緣	者 是 因 緣 方 便 因 者 是 增 上 緣 次 第 緣 緣 緣 
T30n1581_003:0903b13	者。是心心數法。謂前生心心數法。開導攝受	者 是 心心數法 謂 前 生 心心數法 開 導 攝 受 
T30n1581_003:0903b14	緣攝受生。是故二緣攝因所攝。	緣 攝 受 生 是 故 二 緣 攝 因 所 攝 
T30n1581_003:0903b15	云何此十因。生一切世間。事云何生一切	云 何 此 十 因 生 一切世間 事 云 何 生 一 切 
T30n1581_003:0903b16	煩惱。云何生一切清淨。若種種穀數世間	煩 惱 云 何 生 一 切 清 淨 若 種 種 穀 數 世 間 
T30n1581_003:0903b17	資生。名想言說。所謂黍稷稻梁胡麻豆麥	資 生 名想言說 所 謂 黍 稷 稻 梁 胡 麻 豆 麥 
T30n1581_003:0903b18	是名隨說因。如大麥若持來若持去。若取	是 名 隨 說 因 如 大 麥 若 持 來 若 持 去 若 取 
T30n1581_003:0903b19	若與。如是等種種言說。餘一切亦如是以有	若 與 如 是 等 種 種 言 說 餘 一 切 亦 如 是 以 有 
T30n1581_003:0903b20	飢渴身。羸瘦故求索摶食。如是等此名以	飢 渴 身 羸 瘦 故 求 索 摶 食 如 是 等 此 名 以 
T30n1581_003:0903b21	有因。若種諸種子各各自生。彼初殖種子。	有 因 若 種 諸 種 子 各 各 自 生 彼 初 殖 種 子 
T30n1581_003:0903b22	是名種殖因(初種種子於後芽莖乃至成熟是名種殖因初種生芽是名生因)。水土	是 名 種 殖 因 初 種 種 子 於 後 芽 莖 乃 至 成 熟 是 名 種 殖 因 初 種 生 芽 是 名 生 因 水 土 
T30n1581_003:0903b23	潤澤令芽得生。是名攝因。彼種子於芽。是	潤 澤 令 芽 得 生 是 名 攝 因 彼 種 子 於 芽 是 
T30n1581_003:0903b24	名生因。復次芽莖枝葉展轉相續。乃至成	名 生 因 復 次 芽 莖 枝 葉 展轉相續 乃 至 成 
T30n1581_003:0903b25	熟。是名長因。如麥種子。麥芽生非餘。餘亦如	熟 是 名 長 因 如 麥 種 子 麥 芽 生 非 餘 餘 亦 如 
T30n1581_003:0903b26	是。是名自種因。彼一切以有因乃至自種	是 是 名 自 種 因 彼 一 切 以 有 因 乃 至 自 種 
T30n1581_003:0903b27	因。悉名共事因。以一切和合生故名共	因 悉 名 共 事 因 以 一 切 和 合 生 故 名 共 
T30n1581_003:0903b28	事因。霜雹災害障礙破壞。是名相違因。彼	事 因 霜 雹 災 害 障 礙 破 壞 是 名 相 違 因 彼 
T30n1581_003:0903b29	不具不障。是名不相違因諸餘一切世間事。	不 具 不 障 是 名 不相違因 諸 餘 一切世間 事 
T30n1581_003:0903c01	皆十因所生。隨所宜應當知。	皆 十 因 所 生 隨 所 宜 應 當 知 
T30n1581_003:0903c02	彼一切緣起名想言說。所謂無明行識名	彼 一 切 緣 起 名想言說 所 謂 無 明 行 識 名 
T30n1581_003:0903c03	色六入觸受愛取有生老病死憂悲苦惱。是	色 六 入 觸 受 愛 取 有 生老病死 憂 悲 苦 惱 是 
T30n1581_003:0903c04	名煩惱隨說因。無明緣行。乃至生緣老死等。	名 煩 惱 隨 說 因 無明緣行 乃 至 生 緣 老 死 等 
T30n1581_003:0903c05	言說境界顧念味著。諸有支生。是名煩惱以	言 說 境 界 顧 念 味 著 諸 有 支 生 是 名 煩 惱 以 
T30n1581_003:0903c06	有因。無明等法。現法種子。生餘生生老病死。	有 因 無 明 等 法 現 法 種 子 生 餘 生 生老病死 
T30n1581_003:0903c07	是名種殖因。不近善友聽受正法。習不正思	是 名 種 殖 因 不 近 善 友 聽受正法 習 不 正 思 
T30n1581_003:0903c08	惟。無明等生。是名攝因。各各種子無明等	惟 無 明 等 生 是 名 攝 因 各 各 種 子 無 明 等 
T30n1581_003:0903c09	生。是名生因。從無明至後有增進相求。至餘	生 是 名 生 因 從 無 明 至 後 有 增 進 相 求 至 餘 
T30n1581_003:0903c10	生生老病死。是名長因。種種種子。俱從無明	生 生老病死 是 名 長 因 種 種 種 子 俱 從 無 明 
T30n1581_003:0903c11	乃至後有。生地獄餓鬼畜生。及諸人天。是	乃 至 後 有 生 地 獄 餓 鬼 畜 生 及 諸 人 天 是 
T30n1581_003:0903c12	名煩惱自種因。從以有因乃至自種因。是	名 煩 惱 自 種 因 從 以 有 因 乃 至 自 種 因 是 
T30n1581_003:0903c13	名共事因。若有種性。值佛出世演說善法。	名 共 事 因 若 有 種 性 值 佛 出 世 演 說 善 法 
T30n1581_003:0903c14	近善知識聽受善法。正念思惟。法次法向清	近 善 知 識 聽 受 善 法 正念思惟 法 次 法 向 清 
T30n1581_003:0903c15	淨道品。是名煩惱相違因。如上說不具者。	淨 道 品 是 名 煩 惱 相 違 因 如 上 說 不 具 者 
T30n1581_003:0903c16	是名不相違因。是名十因。生一切煩惱應當	是 名 不相違因 是 名 十 因 生 一切煩惱 應 當 
T30n1581_003:0903c17	知。	知 
T30n1581_003:0903c18	彼一切淨法乃至滅盡涅槃。名想言說。是	彼 一 切 淨 法 乃 至 滅 盡 涅 槃 名想言說 是 
T30n1581_003:0903c19	名淨法隨說因。此念處正勤。乃至八聖道。無	名 淨 法 隨 說 因 此 念 處 正 勤 乃 至 八 聖 道 無 
T30n1581_003:0903c20	明滅乃至生老病死滅。如是名想言說。是名	明 滅 乃 至 生老病死 滅 如 是 名想言說 是 名 
T30n1581_003:0904a01	淨法隨說因。彼以有無明等故。樂求淨法。	淨 法 隨 說 因 彼 以 有 無 明 等 故 樂 求 淨 法 
T30n1581_003:0904a02	攝受淨法。淨法得生。是名以有因。若種性	攝 受 淨 法 淨 法 得 生 是 名 以 有 因 若 種 性 
T30n1581_003:0904a03	具足人。向有餘無餘涅槃最先行者。是名清	具 足 人 向 有 餘 無餘涅槃 最 先 行 者 是 名 清 
T30n1581_003:0904a04	淨種殖因。彼種性所攝。無漏道品種子。於	淨 種 殖 因 彼 種 性 所 攝 無 漏 道 品 種 子 於 
T30n1581_003:0904a05	諸道品法。是名生因。近善知識聽受善法。	諸 道 品 法 是 名 生 因 近 善 知 識 聽 受 善 法 
T30n1581_003:0904a06	正思惟修。諸根成熟。是名攝因。彼種子。生	正 思 惟 修 諸 根 成 熟 是 名 攝 因 彼 種 子 生 
T30n1581_003:0904a07	道品法。向無餘涅槃。是名長因。彼聲聞種性。	道 品 法 向 無餘涅槃 是 名 長 因 彼 聲聞種性 
T30n1581_003:0904a08	以聲聞乘而般涅槃。緣覺種性。以緣覺乘而	以 聲 聞 乘 而 般 涅 槃 緣 覺 種 性 以 緣 覺 乘 而 
T30n1581_003:0904a09	般涅槃。大乘種性。以無上大乘而般涅槃。是	般 涅 槃 大 乘 種 性 以 無 上 大 乘 而 般 涅 槃 是 
T30n1581_003:0904a10	名自種因。從以有因乃至自種因。是名共事	名 自 種 因 從 以 有 因 乃 至 自 種 因 是 名 共 事 
T30n1581_003:0904a11	因。種性不具。不值佛世。生諸難處。不近善	因 種 性 不 具 不 值 佛 世 生 諸 難 處 不 近 善 
T30n1581_003:0904a12	友。不聞善法。不正思惟。習行邪道。是名淨法	友 不 聞 善 法 不正思惟 習 行 邪 道 是 名 淨 法 
T30n1581_003:0904a13	相違因。此相違不具者。是名不相違因。諸煩	相 違 因 此 相 違 不 具 者 是 名 不相違因 諸 煩 
T30n1581_003:0904a14	惱相違因。是淨法因。淨法相違因。是煩惱	惱 相 違 因 是 淨 法 因 淨 法 相 違 因 是 煩 惱 
T30n1581_003:0904a15	因。如是煩惱十因。清淨十因。過去未來煩惱	因 如 是 煩 惱 十 因 清 淨 十 因 過去未來 煩 惱 
T30n1581_003:0904a16	清淨。皆亦如是。無餘無上。	清 淨 皆 亦 如 是 無 餘 無 上 
T30n1581_003:0904a17	云何為果。略說五種。一者報果。二者依果。	云 何 為 果 略 說 五 種 一 者 報 果 二 者 依 果 
T30n1581_003:0904a18	三者解脫果。四者士夫果。五者增上果。若	三 者 解 脫 果 四 者 士 夫 果 五 者 增 上 果 若 
T30n1581_003:0904a19	不善法得惡趣報。有漏善法得善趣報。是名	不 善 法 得 惡 趣 報 有 漏 善 法 得 善 趣 報 是 名 
T30n1581_003:0904a20	報果。若習不善法。樂住不善法。增不善法。若	報 果 若 習 不 善 法 樂 住 不 善 法 增 不 善 法 若 
T30n1581_003:0904a21	習善法。樂住善法。增益善法。先業相似後果	習 善 法 樂 住 善 法 增 益 善 法 先 業 相 似 後 果 
T30n1581_003:0904a22	生。是名依果。八聖道滅諸煩惱。名解脫果。若	生 是 名 依 果 八 聖 道 滅 諸 煩 惱 名 解 脫 果 若 
T30n1581_003:0904a23	復世俗滅諸煩惱。彼不究竟捨離凡夫。非解	復 世 俗 滅 諸 煩 惱 彼 不 究 竟 捨 離 凡 夫 非 解 
T30n1581_003:0904a24	脫果。若於現法。依種種世間工巧處業諸	脫 果 若 於 現 法 依 種 種 世 間 工 巧 處 業 諸 
T30n1581_003:0904a25	士夫事。所謂田種販賣。宰官理務。書畫算數。	士 夫 事 所 謂 田 種 販 賣 宰 官 理 務 書 畫 算 數 
T30n1581_003:0904a26	卜占印封。各有果生。是名士夫果。眼識是眼	卜 占 印 封 各 有 果 生 是 名 士 夫 果 眼 識 是 眼 
T30n1581_003:0904a27	根增上果。乃至意識是意根增上果。生理不	根 增 上 果 乃 至 意 識 是 意 根 增 上 果 生 理 不 
T30n1581_003:0904a28	壞是命根增上果。一切二十二根。各為增	壞 是 命 根 增 上 果 一 切 二十二根 各 為 增 
T30n1581_003:0904a29	上。各有果生。當知皆是增上果。此二十二根	上 各 有 果 生 當 知 皆 是 增 上 果 此 二十二根 
T30n1581_003:0904b01	增上如攝事處說。如是菩薩知佛顯示正因	增 上 如 攝 事 處 說 如 是 菩 薩 知 佛 顯 示 正 因 
T30n1581_003:0904b02	果已。於處非處智力種性。次第修習清淨	果 已 於 處 非 處 智 力 種 性 次 第 修 習 清 淨 
T30n1581_003:0904b03	增長。非不作異作。有所成熟。亦無自所作業	增 長 非 不 作 異 作 有 所 成 熟 亦 無 自 所 作 業 
T30n1581_003:0904b04	經劫而失。作者不失。不作不受。佛所顯示。	經 劫 而 失 作 者 不 失 不 作 不 受 佛 所 顯 示 
T30n1581_003:0904b05	如是菩薩如實知已。自業智力種性。次第修	如 是 菩 薩 如 實 知 已 自業智力 種 性 次 第 修 
T30n1581_003:0904b06	習清淨增長。	習 清 淨 增 長 
T30n1581_003:0904b07	云何菩薩求聞法。是菩薩住慇懃恭敬。求善	云 何 菩 薩 求 聞 法 是 菩 薩 住 慇 懃 恭 敬 求 善 
T30n1581_003:0904b08	說法。善語法。如是比略說善說法住。勤恭	說 法 善 語 法 如 是 比 略 說 善 說 法 住 勤 恭 
T30n1581_003:0904b09	敬住。若菩薩為聞一善說法。路由惡道大地	敬 住 若 菩 薩 為 聞 一 善 說 法 路 由 惡 道 大 地 
T30n1581_003:0904b10	熾然。猶尚歡喜從中而過。況為多聞。為一聞	熾 然 猶 尚 歡 喜 從 中 而 過 況 為 多 聞 為 一 聞 
T30n1581_003:0904b11	法。猶尚不惜所愛之身。況餘資生。一聞說法。	法 猶 尚 不 惜 所 愛 之 身 況 餘 資 生 一 聞 說 法 
T30n1581_003:0904b12	愛樂恭敬。比前愛敬百千萬倍。乃至算數譬	愛 樂 恭 敬 比 前 愛 敬 百 千 萬 倍 乃 至 算 數 譬 
T30n1581_003:0904b13	喻不得為比。謂聞善說法心無厭足。增益淨	喻 不 得 為 比 謂 聞 善 說 法 心 無 厭 足 增 益 淨 
T30n1581_003:0904b14	信其身柔軟。心直見直深樂功德。至說法所	信 其 身 柔 軟 心 直 見 直 深 樂 功 德 至 說 法 所 
T30n1581_003:0904b15	無留難心。恭敬除慢。但求正法不求名稱。為	無 留 難 心 恭 敬 除 慢 但 求 正 法 不 求 名 稱 為 
T30n1581_003:0904b16	己及他修諸善根。不為利養至說法所。不染	己 及 他 修 諸 善 根 不 為 利 養 至 說 法 所 不 染 
T30n1581_003:0904b17	心聽法。不亂心聽法。不染污心聽法者。離	心 聽 法 不 亂 心 聽 法 不 染 污 心 聽 法 者 離 
T30n1581_003:0904b18	貢高煩惱。及輕想煩惱。下想煩惱。有七行	貢 高 煩 惱 及 輕 想 煩 惱 下 想 煩 惱 有 七 行 
T30n1581_003:0904b19	離貢高煩惱。一者時聽。二者欲受。三者頓	離 貢 高 煩 惱 一 者 時 聽 二 者 欲 受 三 者 頓 
T30n1581_003:0904b20	聽。四者敬聽。五者不戲。六者隨順。七者不求	聽 四 者 敬 聽 五 者 不 戲 六 者 隨 順 七 者 不 求 
T30n1581_003:0904b21	過失。如是七行。離貢高煩惱。有四行離輕	過 失 如 是 七 行 離 貢 高 煩 惱 有 四 行 離 輕 
T30n1581_003:0904b22	想煩惱。一者恭敬法。二者恭敬說法人。三者	想 煩 惱 一 者 恭 敬 法 二 者 恭 敬 說 法 人 三 者 
T30n1581_003:0904b23	不輕法。四者不輕說法人。如是四行。離輕想	不 輕 法 四 者 不 輕 說 法 人 如 是 四 行 離 輕 想 
T30n1581_003:0904b24	煩惱。一行離下想煩惱。所謂聽受正法不	煩 惱 一 行 離 下 想 煩 惱 所 謂 聽受正法 不 
T30n1581_003:0904b25	自輕聽法。以此一行離下想煩惱。離如是等	自 輕 聽 法 以 此 一 行 離 下 想 煩 惱 離 如 是 等 
T30n1581_003:0904b26	過聽受正法。是名菩薩不染心聽法。云何不	過 聽受正法 是 名 菩 薩 不 染 心 聽 法 云 何 不 
T30n1581_003:0904b27	亂心聽法。有四行。一者一心。二者側聽。三者	亂 心 聽 法 有 四 行 一 者 一 心 二 者 側 聽 三 者 
T30n1581_003:0904b28	定意。四者一向專樂聽受正法。是名菩薩求	定 意 四 者 一 向 專 樂 聽受正法 是 名 菩 薩 求 
T30n1581_003:0904b29	聞法。	聞 法 
T30n1581_003:0904c01	菩薩何故求聞法。菩薩求佛所說法。為受正	菩 薩 何 故 求 聞 法 菩 薩 求 佛 所 說 法 為 受 正 
T30n1581_003:0904c02	法次法向故。為他廣說故。菩薩求因論者。欲	法 次 法 向 故 為 他 廣 說 故 菩 薩 求 因 論 者 欲 
T30n1581_003:0904c03	知彼論過故。欲降伏異論故。未信佛法者令	知 彼 論 過 故 欲 降 伏 異 論 故 未 信 佛 法 者 令 
T30n1581_003:0904c04	生信故。已生信者令增廣故。菩薩求聲論者。	生 信 故 已 生 信 者 令 增 廣 故 菩 薩 求 聲 論 者 
T30n1581_003:0904c05	廣為眾生演說正語令愛樂故。為淨莊嚴辭	廣 為 眾 生 演 說 正 語 令 愛 樂 故 為 淨 莊 嚴 辭 
T30n1581_003:0904c06	句味故。於一義中種種言辭莊嚴故。菩薩求	句 味 故 於 一 義 中 種 種 言 辭 莊 嚴 故 菩 薩 求 
T30n1581_003:0904c07	醫方論者。為除眾生種種病故。攝受大眾故。	醫 方 論 者 為 除 眾 生 種 種 病 故 攝 受 大 眾 故 
T30n1581_003:0904c08	菩薩求世間工業處智者。為少方便獲致大	菩 薩 求 世 間 工 業 處 智 者 為 少 方 便 獲 致 大 
T30n1581_003:0904c09	財饒益無量諸眾生故。為教眾生種種事業	財 饒 益 無 量 諸 眾 生 故 為 教 眾 生 種 種 事 業 
T30n1581_003:0904c10	故。如是菩薩求五明處。為無上菩提大智眾	故 如 是 菩 薩 求 五 明 處 為 無上菩提 大 智 眾 
T30n1581_003:0904c11	具究竟滿故。非不次第。學一切法而得一切	具 究 竟 滿 故 非 不 次 第 學 一 切 法 而 得 一 切 
T30n1581_003:0904c12	無障礙智。是名菩薩所求如所求所為求。	無障礙智 是 名 菩 薩 所 求 如 所 求 所 為 求 
T30n1581_003:0904c13	菩薩為他說者。何所說云何說何故說。彼如	菩 薩 為 他 說 者 何 所 說 云 何 說 何 故 說 彼 如 
T30n1581_003:0904c14	所求法。如是法說。如所求義。如是義說。以	所 求 法 如 是 法 說 如 所 求 義 如 是 義 說 以 
T30n1581_003:0904c15	二因緣故說。一者隨順說。二者清淨說。隨順	二 因 緣 故 說 一 者 隨 順 說 二 者 清 淨 說 隨 順 
T30n1581_003:0904c16	說者。住如法威儀說。非不如法。不為高坐無	說 者 住 如 法 威 儀 說 非 不 如 法 不 為 高 坐 無 
T30n1581_003:0904c17	病者說。覆頭者在前行者。悉不為說。如修多	病 者 說 覆 頭 者 在 前 行 者 悉 不 為 說 如 修 多 
T30n1581_003:0904c18	羅廣說。何以故。諸佛菩薩自恭敬法。以敬法	羅 廣 說 何 以 故 諸佛菩薩 自 恭 敬 法 以 敬 法 
T30n1581_003:0904c19	故。令餘眾生深起恭敬。聞已奉持不起輕慢。	故 令 餘 眾 生 深 起 恭 敬 聞 已 奉 持 不 起 輕 慢 
T30n1581_003:0904c20	一切說。一切無間說。不為法慳不作師惓。	一 切 說 一 切 無 間 說 不 為 法 慳 不 作 師 惓 
T30n1581_003:0904c21	如次第句味說。如次第句味受。如次第義分	如 次 第 句 味 說 如 次 第 句 味 受 如 次 第 義 分 
T30n1581_003:0904c22	別說。義饒益及法饒益。種種義饒益。示所應	別 說 義 饒 益 及 法 饒 益 種 種 義 饒 益 示 所 應 
T30n1581_003:0904c23	示。授所應授。照所應照。喜所應喜。現智比	示 授 所 應 授 照 所 應 照 喜 所 應 喜 現 智 比 
T30n1581_003:0904c24	智。從師具聞而為人說。非不思量。具足聽聞	智 從 師 具 聞 而 為 人 說 非 不 思 量 具 足 聽 聞 
T30n1581_003:0904c25	順向善趣。不亂說善說不深隱說。應四聖諦。	順 向 善 趣 不 亂 說 善 說 不 深 隱 說 應 四 聖 諦 
T30n1581_003:0904c26	隨眾所應而為廣說。此十五種。菩薩普為眾	隨 眾 所 應 而 為 廣 說 此 十 五 種 菩 薩 普 為 眾 
T30n1581_003:0904c27	生隨順善說。一切利他應當知。◎	生 隨 順 善 說 一 切 利 他 應 當 知 
T30n1581_003:0904c28	◎復次菩薩於不饒益己者住慈心為說。惡	 復 次 菩 薩 於 不 饒 益 己 者 住 慈 心 為 說 惡 
T30n1581_003:0904c29	趣行者住安隱心說。苦樂眾生放逸貧乞者	趣 行 者 住 安 隱 心 說 苦 樂 眾 生 放 逸 貧 乞 者 
T30n1581_003:0905a01	住安樂哀愍心說。不以嫉纏故自歎毀他。離	住 安 樂 哀 愍 心 說 不 以 嫉 纏 故 自 歎 毀 他 離 
T30n1581_003:0905a02	貪著心不求名利為他說法。如是五種。菩薩	貪 著 心 不 求 名 利 為 他 說 法 如 是 五 種 菩 薩 
T30n1581_003:0905a03	清淨說法。前後略說二十種。一者時。二者頓。	清 淨 說 法 前 後 略 說 二 十 種 一 者 時 二 者 頓 
T30n1581_003:0905a04	三者次第。四者相續。五者堪耐。六者歡喜。	三 者 次 第 四 者 相 續 五 者 堪 耐 六 者 歡 喜 
T30n1581_003:0905a05	七者欲。八者喜。九者勸。十者不毀。十一者	七 者 欲 八 者 喜 九 者 勸 十 者 不 毀 十 一 者 
T30n1581_003:0905a06	應。十二者文字具足。十三者不雜。十四者如	應 十 二 者 文 字 具 足 十 三 者 不 雜 十 四 者 如 
T30n1581_003:0905a07	法。十五者隨眾。十六者慈心。十七者安心。十	法 十 五 者 隨 眾 十 六 者 慈 心 十 七 者 安 心 十 
T30n1581_003:0905a08	八者哀愍心。十九者不自譽毀人。二十者不	八 者 哀 愍 心 十 九 者 不 自 譽 毀 人 二 十 者 不 
T30n1581_003:0905a09	依名利。是名菩薩為他說法。	依 名 利 是 名 菩 薩 為 他 說 法 
T30n1581_003:0905a10	云何菩薩法次法向。略說五種。如所求如所	云 何 菩 薩 法 次 法 向 略 說 五 種 如 所 求 如 所 
T30n1581_003:0905a11	攝法。身口意隨轉。正思及修。若此法世尊制	攝 法 身 口 意 隨 轉 正 思 及 修 若 此 法 世 尊 制 
T30n1581_003:0905a12	身口意所作。及若此法聽身口意所作。彼	身 口 意 所 作 及 若 此 法 聽 身 口 意 所 作 彼 
T30n1581_003:0905a13	身口意業。如是離。如是修。身口意隨轉。是名	身口意業 如 是 離 如 是 修 身 口 意 隨 轉 是 名 
T30n1581_003:0905a14	法次法向。彼正思者。菩薩獨一靜處。如所聞	法 次 法 向 彼 正 思 者 菩 薩 獨 一 靜 處 如 所 聞 
T30n1581_003:0905a15	法思惟稱量觀察。先離如是不思處。思量於	法 思 惟 稱 量 觀 察 先 離 如 是 不 思 處 思 量 於 
T30n1581_003:0905a16	法。勤思常思頓思。方便不息。又菩薩正思具	法 勤 思 常 思 頓 思 方 便 不 息 又 菩 薩 正 思 具 
T30n1581_003:0905a17	足。具足行隨順入。有所捨。依義不依於味。	足 具 足 行 隨 順 入 有 所 捨 依 義 不 依 於 味 
T30n1581_003:0905a18	闇說明說。如實知。先思量應入者。入已入	闇 說 明 說 如 實 知 先 思 量 應 入 者 入 已 入 
T30n1581_003:0905a19	者。數數思惟。菩薩離不思處者。不隨愚心	者 數 數 思 惟 菩 薩 離 不 思 處 者 不 隨 愚 心 
T30n1581_003:0905a20	亂心。勤思常思頓思。具足者。未知義者。令	亂 心 勤 思 常 思 頓 思 具 足 者 未 知 義 者 令 
T30n1581_003:0905a21	得知之。已知義者。不失不忘。具足者。有所	得 知 之 已 知 義 者 不 失 不 忘 具 足 者 有 所 
T30n1581_003:0905a22	入所行。不由他人。能具觀察。有所捨者。若知	入 所 行 不 由 他 人 能 具 觀 察 有 所 捨 者 若 知 
T30n1581_003:0905a23	諸法非其境界。當自念言。此佛所知非我境	諸 法 非 其 境 界 當 自 念 言 此 佛 所 知 非 我 境 
T30n1581_003:0905a24	界。如是不謗。自無罪咎。菩薩依義不依味	界 如 是 不 謗 自 無 罪 咎 菩 薩 依 義 不 依 味 
T30n1581_003:0905a25	者。善入如來隱密之說。善知闇說明說者。於	者 善 入 如 來 隱 密 之 說 善 知 闇 說 明 說 者 於 
T30n1581_003:0905a26	真實義莫能動搖。初入正思菩薩。先未得忍。	真 實 義 莫 能 動 搖 初 入 正 思 菩 薩 先 未 得 忍 
T30n1581_003:0905a27	於今得之。已得忍者。堅固隨順入於修慧。如	於 今 得 之 已 得 忍 者 堅 固 隨 順 入 於 修 慧 如 
T30n1581_003:0905a28	是八種。菩薩正思所攝。法次法向修者。略	是 八 種 菩 薩 正 思 所 攝 法 次 法 向 修 者 略 
T30n1581_003:0905a29	說四種。一者止。二者觀。三者修習止觀。四者	說 四 種 一 者 止 二 者 觀 三 者 修 習 止 觀 四 者 
T30n1581_003:0905b01	樂止觀。止者。謂菩薩八種正思。善正真	樂 止 觀 止 者 謂 菩 薩 八 種 正 思 善 正 真 
T30n1581_003:0905b02	實。離言說法。若事若義。係心緣中。遠離一	實 離 言 說 法 若 事 若 義 係 心 緣 中 遠 離 一 
T30n1581_003:0905b03	切虛偽輕躁及諸憶想。緣中解脫係心安立。	切 虛 偽 輕 躁 及 諸 憶 想 緣 中 解 脫 係 心 安 立 
T30n1581_003:0905b04	內三昧相。廣說乃至一心。是名為止。觀者。彼	內 三 昧 相 廣說乃至 一 心 是 名 為 止 觀 者 彼 
T30n1581_003:0905b05	止所熏修。憶念思惟。如正思法相。憶念選	止 所 熏 修 憶 念 思 惟 如 正 思 法 相 憶 念 選 
T30n1581_003:0905b06	擇。乃至明慧。是名為觀。修止觀者。若行止	擇 乃 至 明 慧 是 名 為 觀 修 止 觀 者 若 行 止 
T30n1581_003:0905b07	觀。常修方便。頓修方便。是名修習止觀。樂	觀 常 修 方 便 頓 修 方 便 是 名 修 習 止 觀 樂 
