T30n1581_001:0888a07	菩薩地持經卷第一	菩 薩 地 持 經 卷 第 一 
T30n1581_001:0888a09	北涼中印度三藏曇無讖於姑臧譯	北 涼 中 印 度 三 藏 曇 無 讖 於 姑 臧 譯 
T30n1581_001:0888a10	菩薩地持初方便處種性品第一(第一段有一十八品)	菩 薩 地 持 初 方 便 處 種 性 品 第 一 第 一 段 有 一 十 八 品 
T30n1581_001:0888a11	　敬禮過去未來世　　現在一切佛世尊	 敬 禮 過去未來 世 現 在 一 切 佛 世 尊 
T30n1581_001:0888a12	有十法。具足菩薩道。摩訶衍攝。云何為十。一	有 十 法 具 足 菩 薩 道 摩 訶 衍 攝 云 何 為 十 一 
T30n1581_001:0888a13	者持。二者相。三者翼。四者淨心。五者住。六	者 持 二 者 相 三 者 翼 四 者 淨 心 五 者 住 六 
T30n1581_001:0888a14	者生。七者攝。八者地。九者行。十者安立。云	者 生 七 者 攝 八 者 地 九 者 行 十 者 安 立 云 
T30n1581_001:0888a15	何名持。菩薩自種性初發心及一切菩提分	何 名 持 菩 薩 自 種 性 初 發 心 及 一 切 菩 提 分 
T30n1581_001:0888a16	法。是名為持。何以故。菩薩依種性。必定堪任	法 是 名 為 持 何 以 故 菩 薩 依 種 性 必 定 堪 任 
T30n1581_001:0888a17	阿耨多羅三藐三菩提。是故種性。名必定持。	阿耨多羅三藐三菩提 是 故 種 性 名 必 定 持 
T30n1581_001:0888a18	菩薩依初發心修行檀波羅蜜。尸波羅蜜。羼	菩 薩 依 初 發 心 修 行 檀 波 羅 蜜 尸 波 羅 蜜 羼 
T30n1581_001:0888a19	提波羅蜜。毘梨耶波羅蜜。禪波羅蜜。般若波	提 波 羅 蜜 毘梨耶波羅蜜 禪 波 羅 蜜 般 若 波 
T30n1581_001:0888a20	羅蜜。修此六波羅蜜。功德律儀。智慧律儀。菩	羅 蜜 修 此 六波羅蜜 功 德 律 儀 智 慧 律 儀 菩 
T30n1581_001:0888a21	提分法。是故初發心名為菩薩行方便持。菩	提 分 法 是 故 初 發 心 名 為 菩 薩 行 方 便 持 菩 
T30n1581_001:0888a22	薩依行方便。滿足阿耨多羅三藐三菩提。是	薩 依 行 方 便 滿 足 阿耨多羅三藐三菩提 是 
T30n1581_001:0888a23	故行方便名為大菩提持。非種性人。無種性	故 行 方 便 名 為 大 菩 提 持 非 種 性 人 無 種 性 
T30n1581_001:0888a24	故。雖復發心勤精進。必不究竟阿耨多羅三	故 雖 復 發 心 勤 精 進 必 不 究 竟 阿 耨 多 羅 三 
T30n1581_001:0888a25	藐三菩提。是故當知。雖不發心不修行方便	藐 三 菩 提 是故當知 雖 不 發 心 不 修 行 方 便 
T30n1581_001:0888a26	猶得名為種性持。若有菩薩種性。而不發心。	猶 得 名 為 種 性 持 若 有 菩薩種性 而 不 發 心 
T30n1581_001:0888a27	不修行方便。不能疾成阿耨多羅三藐三菩	不 修 行 方 便 不 能 疾 成 阿 耨 多 羅 三 藐 三 菩 
T30n1581_001:0888a28	提。有菩薩種性。發菩提心勤行精進。則能疾	提 有 菩薩種性 發菩提心 勤行精進 則 能 疾 
T30n1581_001:0888a29	成阿耨多羅三藐三菩提。又種性名為持。	成 阿耨多羅三藐三菩提 又 種 性 名 為 持 
T30n1581_001:0888b01	名為長養。名為因。名為依。名為梯。名為導。	名 為 長 養 名 為 因 名 為 依 名 為 梯 名 為 導 
T30n1581_001:0888b02	名為覆。如種性發心。行方便亦如是。云何為	名 為 覆 如 種 性 發 心 行 方 便 亦 如 是 云 何 為 
T30n1581_001:0888b03	種性。略說有二。一者性種性。二者習種性。	種 性 略 說 有 二 一 者 性 種 性 二 者 習 種 性 
T30n1581_001:0888b04	性種性者。是菩薩六入殊勝。展轉相續無始	性 種 性 者 是 菩 薩 六 入 殊 勝 展轉相續 無 始 
T30n1581_001:0888b05	法爾。是名性種性。習種性者。若從先來修	法 爾 是 名 性 種 性 習 種 性 者 若 從 先 來 修 
T30n1581_001:0888b06	善所得。是名習種性。又種性名為種子。名為	善 所 得 是 名 習 種 性 又 種 性 名 為 種 子 名 為 
T30n1581_001:0888b07	界。名為性。又不習者。果細果遠。習者。果麁	界 名 為 性 又 不 習 者 果 細 果 遠 習 者 果 麁 
T30n1581_001:0888b08	果近。菩薩成就種性者。出過一切聲聞辟支	果 近 菩 薩 成 就 種 性 者 出 過 一 切 聲 聞 辟 支 
T30n1581_001:0888b09	佛上。何以故。有二種淨。一者煩惱障淨。二者	佛 上 何 以 故 有 二 種 淨 一 者 煩惱障淨 二 者 
T30n1581_001:0888b10	智障淨。二乘種性煩惱障淨非智障淨。菩薩	智 障 淨 二 乘 種 性 煩惱障淨 非 智 障 淨 菩 薩 
T30n1581_001:0888b11	種性具足二淨。是故一切最勝最上。復有四	種性具足 二 淨 是 故 一切最勝 最 上 復 有 四 
T30n1581_001:0888b12	事勝於一切聲聞緣覺。一者根勝。二者道勝。	事 勝 於 一 切 聲 聞 緣 覺 一 者 根 勝 二 者 道 勝 
T30n1581_001:0888b13	三者巧便勝。四者果勝。菩薩性自利根。緣覺	三 者 巧 便 勝 四 者 果 勝 菩 薩 性 自 利 根 緣 覺 
T30n1581_001:0888b14	中根。聲聞軟根。是名根勝。聲聞緣覺但為自	中 根 聲 聞 軟 根 是 名 根 勝 聲 聞 緣 覺 但 為 自 
T30n1581_001:0888b15	度。菩薩不爾自度度彼是名道勝。聲聞緣	度 菩 薩 不 爾 自 度 度 彼 是 名 道 勝 聲 聞 緣 
T30n1581_001:0888b16	覺唯能了知陰界諸入十二緣起是處非處	覺 唯 能 了 知 陰界諸入 十二緣起 是處非處 
T30n1581_001:0888b17	及四真諦。菩薩巧便悉能了知一切諸法。是	及 四 真 諦 菩 薩 巧 便 悉 能 了 知 一切諸法 是 
T30n1581_001:0888b18	名巧便勝。聲聞得聲聞菩提。緣覺得緣覺菩	名 巧 便 勝 聲 聞 得 聲聞菩提 緣 覺 得 緣 覺 菩 
T30n1581_001:0888b19	提。菩薩得阿耨多羅三藐三菩提。是名果	提 菩 薩 得阿耨多羅三藐三菩提 是 名 果 
T30n1581_001:0888b20	勝。有六波羅蜜。是菩薩種性相。令諸眾生知	勝 有 六波羅蜜 是 菩薩種性 相 令 諸 眾 生 知 
T30n1581_001:0888b21	是菩薩。云何為六。謂檀波羅蜜。乃至般若	是 菩 薩 云 何 為 六 謂 檀 波 羅 蜜 乃 至 般 若 
T30n1581_001:0888b22	波羅蜜。檀波羅蜜菩薩種性相者。是菩薩性	波 羅 蜜 檀 波 羅 蜜 菩薩種性 相 者 是 菩 薩 性 
T30n1581_001:0888b23	自樂施。於彼受者以所施物等施不惓。於諸	自 樂 施 於 彼 受 者 以 所 施 物 等 施 不 惓 於 諸 
T30n1581_001:0888b24	財物若多若少。等心惠施歡喜無悔。若無所	財 物 若 多 若 少 等 心 惠 施 歡 喜 無 悔 若 無 所 
T30n1581_001:0888b25	施心常慚愧。常為他人歎施功德勸令行施。	施 心 常 慚 愧 常 為 他 人 歎 施 功 德 勸 令 行 施 
T30n1581_001:0888b26	見有施者心常隨喜。於諸尊重耆宿福田應	見 有 施 者 心 常 隨 喜 於 諸 尊 重 耆 宿 福 田 應 
T30n1581_001:0888b27	供養者。捨所坐處恭敬奉施。若有人問今世	供 養 者 捨 所 坐 處 恭 敬 奉 施 若 有 人 問 今 世 
T30n1581_001:0888b28	後世如法事者。悉皆為說若有王賊水火惡	後 世 如 法 事 者 悉 皆 為 說 若 有 王 賊 水 火 惡 
T30n1581_001:0888b29	知識怖。隨力所能施以無畏。受他寄物未曾	知 識 怖 隨力所能 施 以 無 畏 受 他 寄 物 未 曾 
T30n1581_001:0888c01	差違。若負人債終不抵捍。兄弟分財平等無	差 違 若 負 人 債 終 不 抵 捍 兄 弟 分 財 平 等 無 
T30n1581_001:0888c02	二。於諸珍寶深愛著者。教令離貪。尚教他	二 於 諸 珍 寶 深 愛 著 者 教 令 離 貪 尚 教 他 
T30n1581_001:0888c03	離。況自貪著。性於好財能捨受用。樂修勝	離 況 自 貪 著 性 於 好 財 能 捨 受 用 樂 修 勝 
T30n1581_001:0888c04	業報利弘多。於諸酒色歌舞倡伎種種變現	業 報 利 弘 多 於 諸 酒 色 歌舞倡伎 種 種 變 現 
T30n1581_001:0888c05	一切戲事。常生慚愧能速遠離。得大財寶猶	一 切 戲 事 常 生 慚 愧 能 速 遠 離 得 大 財 寶 猶 
T30n1581_001:0888c06	不貪著。何況小利。如是等比。是名檀波羅蜜	不 貪 著 何 況 小 利 如 是 等 比 是 名 檀 波 羅 蜜 
T30n1581_001:0888c07	菩薩種性相。	菩薩種性 相 
T30n1581_001:0888c08	尸羅波羅蜜菩薩種性相者。是菩薩身口意	尸 羅 波 羅 蜜 菩薩種性 相 者 是 菩 薩 身 口 意 
T30n1581_001:0888c09	業性自柔軟。不增惡行不樂殺生。設作惡業	業 性 自 柔 軟 不 增 惡 行 不 樂 殺 生 設 作 惡 業 
T30n1581_001:0888c10	心生慚愧。能疾悔除不令增長。不以刀杖恐	心 生 慚 愧 能 疾 悔 除 不 令 增 長 不 以 刀 杖 恐 
T30n1581_001:0888c11	怖眾生。體性仁賢常懷慈愛。恭敬尊長奉迎	怖 眾 生 體 性 仁 賢 常 懷 慈 愛 恭 敬 尊 長 奉 迎 
T30n1581_001:0888c12	供養。善知機宜所作巧便。善隨人心言常含	供 養 善 知 機 宜 所 作 巧 便 善 隨 人 心 言 常 含 
T30n1581_001:0888c13	笑。舒顏平視先意問訊。知恩報恩。所求正直	笑 舒顏平視 先 意 問 訊 知 恩 報 恩 所 求 正 直 
T30n1581_001:0888c14	不偽不曲。受如法財不為非法。性常喜樂修	不 偽 不 曲 受 如 法 財 不 為 非 法 性 常 喜 樂 修 
T30n1581_001:0888c15	諸福德。見人修福尚以身助。況復自為。若有	諸 福 德 見 人 修 福 尚 以 身 助 況 復 自 為 若 有 
T30n1581_001:0888c16	眾生更相殘害打縛割截毀訾訶責。有如是	眾 生 更 相 殘 害 打 縛 割 截 毀 訾 訶 責 有 如 是 
T30n1581_001:0888c17	等無量眾苦。若見若聞心常憐愍。重今世善	等 無 量 眾 苦 若 見 若 聞 心 常 憐 愍 重 今 世 善 
T30n1581_001:0888c18	及後世樂。於輕罪中心常恐怖。況餘重惡而	及 後 世 樂 於 輕 罪 中 心 常 恐 怖 況 餘 重 惡 而 
T30n1581_001:0888c19	不畏慎。若見他人農商放牧。書數算計。和合	不 畏 慎 若 見 他 人 農 商 放 牧 書 數 算 計 和 合 
T30n1581_001:0888c20	諍訟。求財守護。出息施與。婚姻集會。如是	諍 訟 求 財 守 護 出 息 施 與 婚 姻 集 會 如 是 
T30n1581_001:0888c21	一切如法事中悉與同事。鬪亂諍訟互相恐	一 切 如 法 事 中 悉 與 同 事 鬪 亂 諍 訟 互 相 恐 
T30n1581_001:0888c22	怖。若自若他無義無益。如是一切不與同事。	怖 若 自 若 他 無 義 無 益 如是一切 不 與 同 事 
T30n1581_001:0888c23	善能遮制十不善道。若為他使隨順其教。已	善 能 遮 制 十 不 善 道 若 為 他 使 隨 順 其 教 已 
T30n1581_001:0888c24	所宜行諮訪明哲。於諸事業廢我成彼。常懷	所 宜 行 諮 訪 明 哲 於 諸 事 業 廢 我 成 彼 常 懷 
T30n1581_001:0888c25	悲惻不興怒害。設令暫起尋即除滅。恒修實	悲 惻 不 興 怒 害 設 令 暫 起 尋 即 除 滅 恒 修 實 
T30n1581_001:0888c26	語不誑眾生。不離他親及無義語。言常柔軟	語 不 誑 眾 生 不 離 他 親 及 無 義 語 言 常 柔 軟 
T30n1581_001:0888c27	無有麁惡。於己僮僕尚不麁言。況於他人。於	無 有 麁 惡 於 己 僮 僕 尚 不 麁 言 況 於 他 人 於 
T30n1581_001:0888c28	諸功德心常愛樂。見人行者隨喜讚善。如是	諸 功 德 心 常 愛 樂 見 人 行 者 隨 喜 讚 善 如 是 
T30n1581_001:0888c29	等比。是名尸羅波羅蜜菩薩種性相。	等 比 是 名 尸 羅 波 羅 蜜 菩薩種性 相 
T30n1581_001:0889a01	羼提波羅蜜菩薩種性相者。是菩薩性自柔	羼 提 波 羅 蜜 菩薩種性 相 者 是 菩 薩 性 自 柔 
T30n1581_001:0889a02	和。若遇他人不饒益事。不起恚害無反報心。	和 若 遇 他 人 不饒益事 不 起 恚 害 無 反 報 心 
T30n1581_001:0889a03	若他悔謝即受其懺。不懷結恨無復餘想。如	若 他 悔 謝 即 受 其 懺 不 懷 結 恨 無 復 餘 想 如 
T30n1581_001:0889a04	是等比。是名羼提波羅蜜菩薩種性相。	是 等 比 是 名 羼 提 波 羅 蜜 菩薩種性 相 
T30n1581_001:0889a05	毘梨耶波羅蜜菩薩種性相者。是菩薩性自	毘梨耶波羅蜜 菩薩種性 相 者 是 菩 薩 性 自 
T30n1581_001:0889a06	精進。晨起夜寐不樂習著眠睡偃臥。凡所作	精 進 晨 起 夜 寐 不 樂 習 著 眠 睡 偃 臥 凡 所 作 
T30n1581_001:0889a07	事精勤不捨。能善思惟要令究竟。創始造業	事 精 勤 不 捨 能 善 思 惟 要 令 究 竟 創 始 造 業 
T30n1581_001:0889a08	必定堅固。事若未成終不中廢。於第一義心	必 定 堅 固 事 若 未 成 終 不 中 廢 於 第 一 義 心 
T30n1581_001:0889a09	不退沒。不自輕言不能成辦。於所作事堪能	不 退 沒 不 自 輕 言 不 能 成 辦 於 所 作 事 堪 能 
T30n1581_001:0889a10	勇猛。入諸大眾摧伏邪論。善能酬答一切難	勇 猛 入 諸 大 眾 摧 伏 邪 論 善 能 酬 答 一 切 難 
T30n1581_001:0889a11	問。諸餘苦事悉能堪耐。大方便力終不憂	問 諸 餘 苦 事 悉 能 堪 耐 大方便力 終 不 憂 
T30n1581_001:0889a12	悔。何況小事。如是等比。是名毘梨耶波羅蜜	悔 何 況 小 事 如 是 等 比 是 名 毘梨耶波羅蜜 
T30n1581_001:0889a13	菩薩種性相。禪波羅蜜菩薩種性相者。是菩	菩薩種性 相 禪 波 羅 蜜 菩薩種性 相 者 是 菩 
T30n1581_001:0889a14	薩於法於義。性善思量無諸亂想。若見若聞	薩 於 法 於 義 性 善 思 量 無 諸 亂 想 若 見 若 聞 
T30n1581_001:0889a15	山巖林藪。離諸憒亂隨順寂默即生念言。是	山 巖 林 藪 離 諸 憒 亂 隨 順 寂 默 即 生 念 言 是 
T30n1581_001:0889a16	處安樂是處遠離。尋往其所。勤加修學。是	處 安 樂 是 處 遠 離 尋 往 其 所 勤 加 修 學 是 
T30n1581_001:0889a17	菩薩性薄煩惱陰蓋輕微。至遠離處思量己	菩 薩 性 薄 煩 惱 陰 蓋 輕 微 至 遠 離 處 思 量 己 
T30n1581_001:0889a18	利。不為惡覺之所惱亂。或時暫起尋即除滅。	利 不 為 惡 覺 之 所 惱 亂 或 時 暫 起 尋 即 除 滅 
T30n1581_001:0889a19	於怨憎所常起慈心況復餘人。若見若聞眾	於 怨 憎 所 常 起 慈 心 況 復 餘 人 若 見 若 聞 眾 
T30n1581_001:0889a20	生受苦。即起悲心。隨力方便度令離苦。性	生 受 苦 即 起 悲 心 隨 力 方 便 度 令 離 苦 性 
T30n1581_001:0889a21	樂饒益安樂眾生。或有親屬錢財殺縛驅擯。	樂 饒 益 安 樂 眾 生 或 有 親 屬 錢 財 殺 縛 驅 擯 
T30n1581_001:0889a22	如是等難悉能安忍。能速受持諸法深義。念	如 是 等 難 悉 能 安 忍 能 速 受 持 諸 法 深 義 念 
T30n1581_001:0889a23	力成就所受專諦。久遠所修悉能憶持。亦令	力 成 就 所 受 專 諦 久 遠 所 修 悉 能 憶 持 亦 令 
T30n1581_001:0889a24	他人憶念不忘。如是等比。是名禪波羅蜜菩	他 人 憶 念 不 忘 如 是 等 比 是 名 禪 波 羅 蜜 菩 
T30n1581_001:0889a25	薩種性相。	薩 種 性 相 
T30n1581_001:0889a26	般若波羅蜜菩薩種性相者。是菩薩於一切	般 若 波 羅 蜜 菩薩種性 相 者 是 菩 薩 於 一 切 
T30n1581_001:0889a27	明處一切智處生慧成就。不頑鈍不薄少不	明 處 一 切 智 處 生 慧 成 就 不 頑 鈍 不 薄 少 不 
T30n1581_001:0889a28	愚癡。諸放逸處悉能思量。是名般若波羅蜜	愚 癡 諸 放 逸 處 悉 能 思 量 是 名 般 若 波 羅 蜜 
T30n1581_001:0889a29	菩薩種性相。	菩薩種性 相 
T30n1581_001:0889b01	是菩薩種性麁相我已略說。諸餘實義。唯佛	是 菩薩種性 麁 相 我 已 略 說 諸 餘 實 義 唯 佛 
T30n1581_001:0889b02	世尊能決定知。種性菩薩具足如是性功德	世 尊 能 決 定 知 種 性 菩 薩 具 足 如 是 性 功 德 
T30n1581_001:0889b03	者。成就真實白淨之法。是故名為難得。名為	者 成 就 真 實 白 淨 之 法 是 故 名 為 難 得 名 為 
T30n1581_001:0889b04	奇特。名為不可思議。名為不動。名為無上。名	奇 特 名 為 不可思議 名 為 不 動 名 為 無 上 名 
T30n1581_001:0889b05	為如來住處。正因相應。	為 如 來 住 處 正 因 相 應 
T30n1581_001:0889b06	種性菩薩。成就白淨法者。不為四種煩惱之	種 性 菩 薩 成 就 白 淨 法 者 不 為 四 種 煩 惱 之 
T30n1581_001:0889b07	所染污。若染污者。白淨之法不現在前。或生	所 染 污 若 染 污 者 白 淨 之 法 不 現 在 前 或 生 
T30n1581_001:0889b08	惡道。種性菩薩久處生死或墮惡道。墮惡道	惡 道 種 性 菩 薩 久 處 生 死 或 墮 惡 道 墮 惡 道 
T30n1581_001:0889b09	者疾得解脫。雖處惡道不受大苦。如餘眾生	者 疾 得 解 脫 雖 處 惡 道 不 受 大 苦 如 餘 眾 生 
T30n1581_001:0889b10	入地獄者。若苦觸身即能厭離。見他受苦能	入 地 獄 者 若 苦 觸 身 即 能 厭 離 見 他 受 苦 能 
T30n1581_001:0889b11	起悲心。如是種性為大悲因。是故菩薩雖墮	起 悲 心 如是種性 為 大 悲 因 是 故 菩 薩 雖 墮 
T30n1581_001:0889b12	惡道勝餘一切惡道眾生。云何四種煩惱。一	惡 道 勝 餘 一 切 惡 道 眾 生 云 何 四 種 煩 惱 一 
T30n1581_001:0889b13	者久習放逸煩惱數利。二者愚癡習惡知識。	者 久 習 放 逸 煩 惱 數 利 二 者 愚 癡 習 惡 知 識 
T30n1581_001:0889b14	三者尊主王賊怨敵所迫不得自在。其心迷	三 者 尊 主 王 賊 怨 敵 所 迫 不得自在 其 心 迷 
T30n1581_001:0889b15	亂。四者眾具不足常憂身命。	亂 四 者 眾 具 不 足 常 憂 身 命 
T30n1581_001:0889b16	種性菩薩復有四法。不得阿耨多羅三藐三	種 性 菩 薩 復 有 四 法 不 得 阿 耨 多 羅 三 藐 三 
T30n1581_001:0889b17	菩提。云何為四。一者本無善友諸佛菩薩善	菩 提 云 何 為 四 一 者 本 無 善 友 諸佛菩薩 善 
T30n1581_001:0889b18	說法者。二者雖值善友佛及菩薩善說法者。	說 法 者 二 者 雖 值 善 友 佛 及 菩 薩 善 說 法 者 
T30n1581_001:0889b19	而謬受學。三者雖值善友佛及菩薩善說法	而 謬 受 學 三 者 雖 值 善 友 佛 及 菩 薩 善 說 法 
T30n1581_001:0889b20	者。不謬受學。而不勤方便。不熾然精進。四者	者 不 謬 受 學 而 不 勤 方 便 不 熾然精進 四 者 
T30n1581_001:0889b21	雖值善友佛及菩薩善說法者勤修方便。而	雖 值 善 友 佛 及 菩 薩 善 說 法 者 勤 修 方 便 而 
T30n1581_001:0889b22	善根未熟莊嚴未備。久遠已來心不調伏。菩	善根未熟 莊 嚴 未 備 久 遠 已 來 心 不 調 伏 菩 
T30n1581_001:0889b23	薩雖有菩薩種性。因緣不具不能得成無上	薩 雖 有 菩薩種性 因 緣 不 具 不 能 得 成 無 上 
T30n1581_001:0889b24	菩提。離是四法疾得阿耨多羅三藐三菩提。	菩 提 離 是 四 法 疾 得阿耨多羅三藐三菩提 
T30n1581_001:0889b25	若無菩薩種性。雖有一切諸方便行。終不得	若 無 菩薩種性 雖 有 一 切 諸 方 便 行 終 不 得 
T30n1581_001:0889b26	成無上菩提。	成 無上菩提 
T30n1581_001:0889b27	菩薩地持方便處發菩提心品第二	菩 薩 地 持 方 便 處 發菩提心 品 第 二 
T30n1581_001:0889b28	菩薩初發心。是一切正願始。悉能攝受一切	菩 薩 初 發 心 是 一 切 正 願 始 悉 能 攝 受 一 切 
T30n1581_001:0889b29	正願。是故初正願為自性願。菩薩發心而作	正 願 是 故 初 正 願 為 自 性 願 菩 薩 發 心 而 作 
T30n1581_001:0889c01	是言。我當求無上菩提安立一切眾生。令究	是 言 我 當 求 無上菩提 安 立 一 切 眾 生 令 究 
T30n1581_001:0889c02	竟無餘涅槃及如來大智。如是發心求菩薩	竟 無餘涅槃 及 如 來 大 智 如 是 發 心 求 菩 薩 
T30n1581_001:0889c03	道。是故初發心名為求行菩薩。緣於菩提及	道 是 故 初 發 心 名 為 求 行 菩 薩 緣 於 菩 提 及 
T30n1581_001:0889c04	緣眾生而發心求。是故初發心攝受一切菩	緣 眾 生 而 發 心 求 是 故 初 發 心 攝 受 一 切 菩 
T30n1581_001:0889c05	提善根。為上導。為極巧便。為功德具足。為	提 善 根 為 上 導 為 極 巧 便 為 功德具足 為 
T30n1581_001:0889c06	極賢善。為極真實。於一切眾生悉捨惡行。於	極 賢 善 為 極 真 實 於 一 切 眾 生 悉 捨 惡 行 於 
T30n1581_001:0889c07	世間出世間正願為上無上。如是當知。初發	世間出世間 正 願 為 上 無 上 如 是 當 知 初 發 
T30n1581_001:0889c08	心有五相。一者自性。二者行。三者緣。四者	心 有 五 相 一 者 自 性 二 者 行 三 者 緣 四 者 
T30n1581_001:0889c09	德。五者勝。初發心菩薩名為度。大乘菩提諸	德 五 者 勝 初 發 心 菩 薩 名 為 度 大 乘 菩 提 諸 
T30n1581_001:0889c10	菩薩數。是故初發心度之所攝。發是心已。漸	菩 薩 數 是 故 初 發 心 度 之 所 攝 發 是 心 已 漸 
T30n1581_001:0889c11	得阿耨多羅三藐三菩提。是故初發心是菩	得阿耨多羅三藐三菩提 是 故 初 發 心 是 菩 
T30n1581_001:0889c12	提根木。發是心已。見諸眾生受無量苦。而	提 根 木 發 是 心 已 見 諸 眾 生 受 無 量 苦 而 
T30n1581_001:0889c13	起悲心欲度脫之。是故初發心是大悲所依。	起 悲 心 欲 度 脫 之 是 故 初 發 心 是 大 悲 所 依 
T30n1581_001:0889c14	依初發心建立菩薩菩提分法。及眾生所作	依 初 發 心 建 立 菩 薩 菩提分法 及 眾 生 所 作 
T30n1581_001:0889c15	菩薩所學悉能修習。是故初發心是菩薩學	菩 薩 所 學 悉 能 修 習 是 故 初 發 心 是 菩 薩 學 
T30n1581_001:0889c16	之所依。如是初發心名為攝。名為根本。名	之 所 依 如 是 初 發 心 名 為 攝 名 為 根 本 名 
T30n1581_001:0889c17	為依。	為 依 
T30n1581_001:0889c18	初發心菩薩有二種。一者出。二者不出。出者。	初 發 心 菩 薩 有 二 種 一 者 出 二 者 不 出 出 者 
T30n1581_001:0889c19	從初發心乃至究竟終不退轉。不出者。則有	從 初 發 心 乃 至 究 竟 終 不 退 轉 不 出 者 則 有 
T30n1581_001:0889c20	退轉。退有二種。一者究竟退。二者不究竟退。	退 轉 退 有 二 種 一 者 究 竟 退 二 者 不 究 竟 退 
T30n1581_001:0889c21	究竟退者。退已終不復起菩薩之願。不究	究 竟 退 者 退 已 終 不 復 起 菩 薩 之 願 不 究 
T30n1581_001:0889c22	竟退者。退已還起。	竟 退 者 退 已 還 起 
T30n1581_001:0889c23	初發心菩薩有四種緣。四種因。四種力。云	初 發 心 菩 薩 有 四 種 緣 四 種 因 四 種 力 云 
T30n1581_001:0889c24	何四緣。一者善男子善女人。若見若聞諸	何 四 緣 一 者 善 男 子 善 女 人 若 見 若 聞 諸 
T30n1581_001:0889c25	佛菩薩有不可思議神通變化。彼見聞已即	佛 菩 薩 有 不可思議神通 變 化 彼 見 聞 已 即 
T30n1581_001:0889c26	發是念。是為大事不可思議。能為如是諸	發 是 念 是 為 大 事 不可思議 能 為 如 是 諸 
T30n1581_001:0889c27	變化事。以此見聞為增上緣故。樂佛大智	變 化 事 以 此 見 聞 為 增 上 緣 故 樂 佛 大 智 
T30n1581_001:0889c28	發菩提心。二者雖不見聞如上神變。聞說法	發菩提心 二 者 雖 不 見 聞 如 上 神 變 聞 說 法 
T30n1581_001:0889c29	者讚歎菩提及菩薩藏。聞則欣慶歡喜信樂。	者 讚 歎 菩 提 及 菩 薩 藏 聞 則 欣 慶 歡 喜 信 樂 
T30n1581_001:0890a01	以此聞法為增上緣故。樂佛大智發菩提心。	以 此 聞 法 為 增 上 緣 故 樂 佛 大 智 發菩提心 
T30n1581_001:0890a02	三者雖不聞法。見法滅相而作是念。無量眾	三 者 雖 不 聞 法 見 法 滅 相 而 作 是 念 無 量 眾 
T30n1581_001:0890a03	生當遭大苦。菩薩住世則能除滅。我今當修	生 當 遭 大 苦 菩 薩 住 世 則 能 除 滅 我 今 當 修 
T30n1581_001:0890a04	菩提之道。護持正法。為諸眾生滅無量苦。	菩 提 之 道 護持正法 為 諸 眾 生 滅 無 量 苦 
T30n1581_001:0890a05	以護法為增上緣故。樂佛大智發菩提心。四	以 護 法 為 增 上 緣 故 樂 佛 大 智 發菩提心 四 
T30n1581_001:0890a06	者不見法滅。見惡世眾生為十煩惱之所惱	者 不 見 法 滅 見 惡 世 眾 生 為 十 煩 惱 之 所 惱 
T30n1581_001:0890a07	亂。一者愚癡。二者無慚愧。三者慳嫉。四者苦	亂 一 者 愚 癡 二 者 無 慚 愧 三 者 慳 嫉 四 者 苦 
T30n1581_001:0890a08	惱。五者穢污。六者煩惱。七者惡行。八者放	惱 五 者 穢 污 六 者 煩 惱 七 者 惡 行 八 者 放 
T30n1581_001:0890a09	逸。九者懈怠。十者不信。見已作是念。大濁世	逸 九 者 懈 怠 十 者 不 信 見 已 作 是 念 大 濁 世 
T30n1581_001:0890a10	起。於此惡世尚不能發二乘之願。況能志求	起 於 此 惡 世 尚 不 能 發 二 乘 之 願 況 能 志 求 
T30n1581_001:0890a11	無上菩提。我當發心亦令他發。以濁世中發	無上菩提 我 當 發 心 亦 令 他 發 以 濁 世 中 發 
T30n1581_001:0890a12	心難得為增上緣故。樂佛大智發菩提心。	心 難 得 為 增 上 緣 故 樂 佛 大 智 發菩提心 
T30n1581_001:0890a13	云何四因。一者種性具足。二者諸佛菩薩善	云 何 四 因 一 者 種性具足 二 者 諸佛菩薩 善 
T30n1581_001:0890a14	友所攝。三者起大悲心。四者生死苦難行苦。	友 所 攝 三 者 起大悲心 四 者 生 死 苦 難 行 苦 
T30n1581_001:0890a15	如是久遠無量諸苦。於此眾苦心不怖畏。種	如 是 久 遠 無 量 諸 苦 於 此 眾 苦 心 不 怖 畏 種 
T30n1581_001:0890a16	性具足者。所謂無始法爾。善友所攝者。有四	性 具 足 者 所 謂 無 始 法 爾 善 友 所 攝 者 有 四 
