T30n1581_006:0919c10	益事。	益 事 
T30n1581_006:0919c11	云何善人忍。略說五種。是菩薩先見行忍	云 何 善 人 忍 略 說 五 種 是 菩 薩 先 見 行 忍 
T30n1581_006:0919c12	有大福利。謂修行忍者。於未來世不多結恨	有 大 福 利 謂 修 行 忍 者 於未來世 不 多 結 恨 
T30n1581_006:0919c13	不多乖離。心多喜樂死時無悔。身壞命終生	不 多 乖 離 心 多 喜 樂 死 時 無 悔 身 壞 命 終 生 
T30n1581_006:0919c14	於善趣天上化生。見如是等功德福利。能	於 善 趣 天 上 化 生 見 如 是 等 功 德 福 利 能 
T30n1581_006:0919c15	自堪忍教他行忍。常為他人歎忍功德。見	自 堪 忍 教 他 行 忍 常 為 他 人 歎 忍 功 德 見 
T30n1581_006:0919c16	他行忍其心隨喜。	他 行 忍 其 心 隨 喜 
T30n1581_006:0919c17	云何菩薩一切行忍。謂六種七種。略說十	云 何 菩 薩 一 切 行 忍 謂 六 種 七 種 略 說 十 
T30n1581_006:0919c18	三種。菩薩見不忍者得大苦報。畏怖故忍。	三 種 菩 薩 見 不 忍 者 得 大 苦 報 畏 怖 故 忍 
T30n1581_006:0919c19	於一切眾生慈心悲心親厚心親愛故忍。慇	於 一 切 眾 生 慈 心 悲 心 親 厚 心 親 愛 故 忍 慇 
T30n1581_006:0919c20	懃願樂無上菩提。欲滿足羼提波羅蜜。作因	懃 願 樂 無上菩提 欲 滿 足 羼 提 波 羅 蜜 作 因 
T30n1581_006:0919c21	故忍。忍力故出家。如世尊說。常當具足等受	故 忍 忍 力 故 出 家 如 世 尊 說 常 當 具 足 等 受 
T30n1581_006:0919c22	持戒。是出家忍。是名受法忍。種性具足及先	持 戒 是 出 家 忍 是 名 受 法 忍 種性具足 及 先 
T30n1581_006:0920a01	修習現在住。是名性忍。知一切法無有眾生	修 習 現 在 住 是 名 性 忍 知一切法 無 有 眾 生 
T30n1581_006:0920a02	見離言語法數。是名正念法忍。一切不饒益	見 離 言 語 法 數 是 名 正 念 法 忍 一 切 不 饒 益 
T30n1581_006:0920a03	忍一切忍一切處忍。謂一人及大眾會。一切	忍 一 切 忍 一 切 處 忍 謂 一 人 及 大 眾 會 一 切 
T30n1581_006:0920a04	時忍。謂平旦日中日入日夜。過去未來現在。	時 忍 謂 平 旦 日 中 日 入 日 夜 過去未來現在 
T30n1581_006:0920a05	若病不病若臥若起。身常行忍不觸惱彼。口	若 病 不 病 若 臥 若 起 身 常 行 忍 不 觸 惱 彼 口 
T30n1581_006:0920a06	常行忍離不愛語。意常行忍不興忿怒。亦復	常 行 忍 離 不 愛 語 意 常 行 忍 不 興 忿 怒 亦 復 
T30n1581_006:0920a07	不起不淨悕望。	不 起 不 淨 悕 望 
T30n1581_006:0920a08	云何菩薩除惱忍。略說八種。一者菩薩	云 何 菩 薩 除 惱 忍 略 說 八 種 一 者 菩 薩 
T30n1581_006:0920a09	於苦求者堪忍不惱。二者於凶暴增上惡者。	於 苦 求 者 堪 忍 不 惱 二 者 於 凶 暴 增 上 惡 者 
T30n1581_006:0920a10	依大悲心堪忍不惱。三者於出家犯戒者。依	依 大 悲 心 堪 忍 不 惱 三 者 於 出 家 犯 戒 者 依 
T30n1581_006:0920a11	大悲心堪忍不惱。五種精進堪忍不惱苦惱	大 悲 心 堪 忍 不 惱 五 種 精 進 堪 忍 不 惱 苦 惱 
T30n1581_006:0920a12	眾生。欲為除苦求法及法次法向。如是法廣	眾 生 欲 為 除 苦 求 法 及 法 次 法 向 如 是 法 廣 
T30n1581_006:0920a13	為宣說。若眾生所作悉皆營助精進堪能。是	為 宣 說 若 眾 生 所 作 悉 皆 營 助 精 進 堪 能 是 
T30n1581_006:0920a14	名八種除惱忍。眾生所患堪忍為除。所可	名 八 種 除 惱 忍 眾 生 所 患 堪 忍 為 除 所 可 
T30n1581_006:0920a15	乏少堪忍饒益。	乏 少 堪 忍 饒 益 
T30n1581_006:0920a16	云何菩薩此世他世樂忍。略說九種。是菩	云 何 菩 薩 此世他世 樂 忍 略 說 九 種 是 菩 
T30n1581_006:0920a17	薩住不放逸善法。堪忍寒熱飢渴蚊虻所	薩 住 不 放 逸 善 法 堪 忍 寒 熱 飢 渴 蚊 虻 所 
T30n1581_006:0920a18	觸。風日眾毒所觸。一切堪忍身心疲苦。悉	觸 風 日 眾 毒 所 觸 一 切 堪 忍 身 心 疲 苦 悉 
T30n1581_006:0920a19	能堪忍。墮生死海生老病死等。諸苦眾生哀	能 堪 忍 墮 生 死 海 生老病死 等 諸 苦 眾 生 哀 
T30n1581_006:0920a20	愍在前。如是忍。菩薩於現法中自住安樂。	愍 在 前 如 是 忍 菩 薩 於現法中 自 住 安 樂 
T30n1581_006:0920a21	一切諸惡皆悉遠離。復為來世安樂因緣。亦	一 切 諸 惡 皆 悉 遠 離 復 為 來 世 安 樂 因 緣 亦 
T30n1581_006:0920a22	復令他向今世後世安隱快樂。是故名為此	復 令 他 向 今 世 後 世 安 隱 快 樂 是 故 名 為 此 
T30n1581_006:0920a23	世他世樂忍。	世 他 世 樂 忍 
T30n1581_006:0920a24	云何為菩薩清淨忍。略說十種。一者他不	云 何 為 菩 薩 清 淨 忍 略 說 十 種 一 者 他 不 
T30n1581_006:0920a25	饒益。無反報心。二者不起恚恨。三者無怨憎	饒 益 無 反 報 心 二 者 不 起 恚 恨 三 者 無 怨 憎 
T30n1581_006:0920a26	想。四者常饒益向如本心後亦如是作饒益	想 四 者 常 饒 益 向 如 本 心 後 亦 如 是 作 饒 益 
T30n1581_006:0920a27	已捨不饒益。五者於不饒益者軟語辭謝。六	已 捨 不 饒 益 五 者 於 不 饒 益 者 軟 語 辭 謝 六 
T30n1581_006:0920a28	者若彼悔謝能速忍受。七者見彼不忍加以	者 若 彼 悔 謝 能 速 忍 受 七 者 見 彼 不 忍 加 以 
T30n1581_006:0920a29	悲心。八者見彼修忍倍增敬佛。九者眾生恐	悲 心 八 者 見 彼 修 忍 倍 增 敬 佛 九 者 眾 生 恐 
T30n1581_006:0920b01	怖深起悲心。十者斷除一切不忍等過離欲	怖 深 起 悲 心 十 者 斷除一切 不 忍 等 過 離 欲 
T30n1581_006:0920b02	清淨。如是十種。名菩薩淨忍。如是從性忍。	清 淨 如 是 十 種 名 菩 薩 淨 忍 如 是 從 性 忍 
T30n1581_006:0920b03	乃至淨忍廣大無量大菩提果。因依是忍。必	乃 至 淨 忍 廣大無量 大菩提果 因 依 是 忍 必 
T30n1581_006:0920b04	得阿耨多羅三藐三菩提。	得阿耨多羅三藐三菩提 
T30n1581_006:0920b05	菩薩地持方便處精進品第十二	菩 薩 地 持 方 便 處 精 進 品 第 十 二 
T30n1581_006:0920b06	云何菩薩毘梨耶波羅蜜。略說有九種。一者	云 何 菩 薩 毘梨耶波羅蜜 略 說 有 九 種 一 者 
T30n1581_006:0920b07	自性精進。二者一切精進。三者難精進。四者	自 性 精 進 二 者 一切精進 三 者 難 精 進 四 者 
T30n1581_006:0920b08	一切門精進。五者善人精進。六者一切行精	一 切 門 精 進 五 者 善 人 精 進 六 者 一 切 行 精 
T30n1581_006:0920b09	進。七者除惱精進。八者此世他世樂精進。九	進 七 者 除 惱 精 進 八 者 此世他世 樂 精 進 九 
T30n1581_006:0920b10	者清淨精進。云何自性精進。是菩薩心堪	者 清 淨 精 進 云 何 自 性 精 進 是 菩 薩 心 堪 
T30n1581_006:0920b11	能攝受無量善法。利益安樂一切眾生。熾然	能 攝 受 無 量 善 法 利益安樂 一 切 眾 生 熾 然 
T30n1581_006:0920b12	不斷亦不顛倒。彼所起身口意業。是名菩	不 斷 亦 不 顛 倒 彼 所 起 身口意業 是 名 菩 
T30n1581_006:0920b13	薩自性精進。	薩 自 性 精 進 
T30n1581_006:0920b14	云何一切精進。略說有二種。一依在家。	云 何 一切精進 略 說 有 二 種 一 依 在 家 
T30n1581_006:0920b15	二依出家。此二各有三種。一者弘誓精進。	二 依 出 家 此 二 各 有 三 種 一 者 弘 誓 精 進 
T30n1581_006:0920b16	二者攝諸善法。三者利益眾生。弘誓精進者。	二 者 攝 諸 善 法 三 者 利 益 眾 生 弘 誓 精 進 者 
T30n1581_006:0920b17	菩薩先起精進方便。心數堪能被弘誓鎧。作	菩 薩 先 起 精 進 方 便 心 數 堪 能 被弘誓鎧 作 
T30n1581_006:0920b18	是念言。我為一眾生脫苦因緣故。以百千大	是 念 言 我 為 一 眾 生 脫 苦 因 緣 故 以 百 千 大 
T30n1581_006:0920b19	劫為一日一夜。如是數億百千大劫在地獄	劫 為 一 日 一 夜 如 是 數 億 百 千 大 劫 在 地 獄 
T30n1581_006:0920b20	中。乃至成佛誓不退轉。不得無上菩提終不	中 乃至成佛 誓 不 退 轉 不 得 無上菩提 終 不 
T30n1581_006:0920b21	捨精進。況復少時受於少苦。是名菩薩弘誓	捨 精 進 況 復 少 時 受 於 少 苦 是 名 菩 薩 弘 誓 
T30n1581_006:0920b22	精進。如是像類菩薩。弘誓精進。起少解少	精 進 如 是 像 類 菩 薩 弘 誓 精 進 起 少 解 少 
T30n1581_006:0920b23	信已。能長養無量開覺勤方便性。況復成就	信 已 能 長 養 無 量 開 覺 勤 方 便 性 況 復 成 就 
T30n1581_006:0920b24	如是弘誓精進。菩薩為無上菩提故利益眾	如 是 弘 誓 精 進 菩 薩 為 無上菩提 故 利 益 眾 
T30n1581_006:0920b25	生。不以為難生退沒想。攝善法精進者。菩薩	生 不 以 為 難 生 退 沒 想 攝 善 法 精 進 者 菩 薩 
T30n1581_006:0920b26	精進為檀波羅蜜方便成就故。為戒忍禪定	精 進 為 檀 波 羅 蜜 方 便 成 就 故 為 戒 忍 禪 定 
T30n1581_006:0920b27	般若波羅蜜方便成就故。略說七種。一者不	般 若 波 羅 蜜 方 便 成 就 故 略 說 七 種 一 者 不 
T30n1581_006:0920b28	動。一切妄想煩惱異論。無量眾苦不傾動故。	動 一 切 妄 想 煩 惱 異 論 無 量 眾 苦 不 傾 動 故 
T30n1581_006:0920b29	二者堅固。頓方便故。三者得無量明處。安住	二 者 堅 固 頓 方 便 故 三 者 得 無 量 明 處 安 住 
T30n1581_006:0920c01	正念故。四者方便具足。所當得義。不顛倒道。	正 念 故 四 者 方 便 具 足 所 當 得 義 不 顛 倒 道 
T30n1581_006:0920c02	隨順得故。五者正精進義饒益。所當得義成	隨 順 得 故 五 者 正 精 進 義 饒 益 所 當 得 義 成 
T30n1581_006:0920c03	就願故。六者熾然。常勤方便故。七者離慢。精	就 願 故 六 者 熾 然 常 勤 方 便 故 七 者 離 慢 精 
T30n1581_006:0920c04	進方便心不自舉故。菩薩修此七種攝諸善	進 方 便 心 不 自 舉 故 菩 薩 修 此 七 種 攝 諸 善 
T30n1581_006:0920c05	法。精進方便疾滿足諸波羅蜜。得阿耨多羅	法 精 進 方 便 疾 滿 足 諸波羅蜜 得 阿 耨 多 羅 
T30n1581_006:0920c06	三藐三菩提。一切菩提行善法。皆此精進之	三藐三菩提 一 切 菩 提 行 善 法 皆 此 精 進 之 
T30n1581_006:0920c07	所成就。是故此精進為最上最勝因無餘無	所 成 就 是 故 此 精 進 為 最 上 最 勝 因 無 餘 無 
T30n1581_006:0920c08	上。是故世尊修多羅中。種種稱歎精進。為	上 是 故 世 尊 修 多 羅 中 種 種 稱 歎 精 進 為 
T30n1581_006:0920c09	阿耨多羅三藐三菩提因。菩薩利眾生精	阿耨多羅三藐三菩提 因 菩 薩 利 眾 生 精 
T30n1581_006:0920c10	進有十一種。如戒品說。彼說戒。此說精進。	進 有 十 一 種 如 戒 品 說 彼 說 戒 此 說 精 進 
T30n1581_006:0920c11	云何菩薩難精進。略說三種。是菩薩精	云 何 菩 薩 難 精 進 略 說 三 種 是 菩 薩 精 
T30n1581_006:0920c12	進無間。無衣食想床臥具想己身想。常修善	進 無 間 無 衣 食 想 床 臥 具 想 己 身 想 常 修 善 
T30n1581_006:0920c13	法。是名第一難精進。菩薩如是精進。乃至	法 是 名 第 一 難 精 進 菩 薩 如 是 精 進 乃 至 
T30n1581_006:0920c14	捨身受身。常修善法不捨精進。是名第二難	捨 身 受 身 常 修 善 法 不捨精進 是 名 第 二 難 
T30n1581_006:0920c15	精進。是菩薩平等分別功德具足。不緩不急	精 進 是 菩 薩 平 等 分 別 功德具足 不 緩 不 急 
T30n1581_006:0920c16	心不顛倒。以義饒益精進成就。是名第三難	心 不 顛 倒 以 義 饒 益 精 進 成 就 是 名 第 三 難 
T30n1581_006:0920c17	精進。又此菩薩難精進力。當知是攝取大悲	精 進 又 此 菩 薩 難 精 進 力 當 知 是 攝 取 大 悲 
T30n1581_006:0920c18	及智慧因。	及 智 慧 因 
T30n1581_006:0920c19	云何菩薩一切門精進。略說四種。一者	云 何 菩 薩 一 切 門 精 進 略 說 四 種 一 者 
T30n1581_006:0920c20	捨離染污法。二者生白淨法。三者淨除三業。	捨 離 染 污 法 二 者 生 白 淨 法 三 者 淨 除 三 業 
T30n1581_006:0920c21	四者增益智慧。捨染污法者。菩薩精進離諸	四 者 增 益 智 慧 捨 染 污 法 者 菩 薩 精 進 離 諸 
T30n1581_006:0920c22	煩惱。未起不起。已起令滅。生白淨法者。未生	煩 惱 未 起 不 起 已 起 令 滅 生 白 淨 法 者 未 生 
T30n1581_006:0920c23	善法方便令生。已生善法方便增廣。淨除三	善 法 方 便 令 生 已 生 善 法 方 便 增 廣 淨 除 三 
T30n1581_006:0920c24	業者。菩薩精進三業清淨。悉能攝取善身口	業 者 菩 薩 精 進 三 業 清 淨 悉 能 攝 取 善 身 口 
T30n1581_006:0921a01	意業。增益智慧者。菩薩精進得聞思修慧。增	意 業 增 益 智 慧 者 菩 薩 精 進 得 聞思修慧 增 
T30n1581_006:0921a02	長具足。	長 具 足 
T30n1581_006:0921a03	云何菩薩善人精進。略說五種。一者無	云 何 菩 薩 善 人 精 進 略 說 五 種 一 者 無 
T30n1581_006:0921a04	不作一切欲方便。不休息故。二者不下隨。其	不 作 一 切 欲 方 便 不 休 息 故 二 者 不 下 隨 其 
T30n1581_006:0921a05	所起若中若上。精進長養故。三者不懈怠。勇	所 起 若 中 若 上 精 進 長 養 故 三 者 不 懈 怠 勇 
T30n1581_006:0921a06	猛熾然長久無間。精進方便心不退沒。不息	猛 熾 然 長 久 無 間 精 進 方 便 心 不 退 沒 不 息 
T30n1581_006:0921a07	不壞故。四者不顛倒義饒益。方便攝取故。五	不 壞 故 四 者 不 顛 倒 義 饒 益 方 便 攝 取 故 五 
T30n1581_006:0921a08	者慇懃。方便精進速疾於無上菩提故。云何	者 慇 懃 方 便 精 進 速 疾 於 無上菩提 故 云 何 
T30n1581_006:0921a09	菩薩一切行精進者。謂六種七種。略說十	菩 薩 一 切 行 精 進 者 謂 六 種 七 種 略 說 十 
T30n1581_006:0921a10	三種。六種者所謂常精進。常方便故。頓精進。	三 種 六 種 者 所 謂 常 精 進 常 方 便 故 頓 精 進 
T30n1581_006:0921a11	至到方便故。依精進。因本精進力故。方便精	至 到 方 便 故 依 精 進 因 本 精 進 力 故 方 便 精 
T30n1581_006:0921a12	進。思惟計校善方便故。不動精進。一切苦觸	進 思 惟 計 校 善 方 便 故 不 動 精 進 一 切 苦 觸 
T30n1581_006:0921a13	不傾動故。亦不向餘義故。不知足精進。限量	不 傾 動 故 亦 不 向 餘 義 故 不 知 足 精 進 限 量 
T30n1581_006:0921a14	勝進不歡喜故。菩薩成就如是六種。一切行	勝 進 不 歡 喜 故 菩 薩 成 就 如 是 六 種 一 切 行 
T30n1581_006:0921a15	精進者。慇懃精進堪能堅固。於諸善法不可	精 進 者 慇 懃 精 進 堪 能 堅 固 於 諸 善 法 不 可 
T30n1581_006:0921a16	毀壞。復有七種。一者與欲俱精進。慇懃欲	毀 壞 復 有 七 種 一 者 與 欲 俱 精 進 慇 懃 欲 
T30n1581_006:0921a17	願長養無上菩提故。二者等具足精進。諸餘	願 長 養 無上菩提 故 二 者 等 具 足 精 進 諸 餘 
T30n1581_006:0921a18	煩惱染污心住。菩薩精進於諸善法等心住	煩 惱 染 污 心 住 菩 薩 精 進 於 諸 善 法 等 心 住 
T30n1581_006:0921a19	故。三者勝進精進。諸餘煩惱上煩惱心住。斷	故 三 者 勝 進 精 進 諸 餘 煩 惱 上 煩 惱 心 住 斷 
T30n1581_006:0921a20	彼煩惱如救頭然故。四者求精進。一切明處	彼 煩 惱 如 救 頭 然 故 四 者 求 精 進 一 切 明 處 
T30n1581_006:0921a21	求故。五者學精進。彼如是諸法。隨其所應起	求 故 五 者 學 精 進 彼 如 是 諸 法 隨其所應 起 
T30n1581_006:0921a22	法次法向故。六者利眾生精進。有十一事如	法 次 法 向 故 六 者 利 眾 生 精 進 有 十 一 事 如 
T30n1581_006:0921a23	前說。七者自正方便。護精進。若有缺漏。如	前 說 七 者 自 正 方 便 護 精 進 若 有 缺 漏 如 
T30n1581_006:0921a24	法悔故。是名七種。如是十三種。是名菩薩	法 悔 故 是 名 七 種 如 是 十 三 種 是 名 菩 薩 
T30n1581_006:0921a25	一切行精進。菩薩除惱精進。此世他世樂精	一 切 行 精 進 菩 薩 除 惱 精 進 此世他世 樂 精 
T30n1581_006:0921a26	進。如忍中說。	進 如 忍 中 說 
T30n1581_006:0921a27	云何菩薩清淨精進。略說十種。一者隨	云 何 菩 薩 清 淨 精 進 略 說 十 種 一 者 隨 
T30n1581_006:0921a28	順。二者修習。三者專著。四者善攝。五者時具	順 二 者 修 習 三 者 專 著 四 者 善 攝 五 者 時 具 
T30n1581_006:0921a29	足。六者分別相具足。七者不退弱。八者不	足 六 者 分 別 相 具 足 七 者 不 退 弱 八 者 不 
T30n1581_006:0921b01	壞。九者平等。十者迴向大菩提。是菩薩為斷	壞 九 者 平 等 十 者 迴 向 大 菩 提 是 菩 薩 為 斷 
T30n1581_006:0921b02	除煩惱隨其所應修習對治。如愛所縛修	除 煩 惱 隨其所應 修 習 對 治 如 愛 所 縛 修 
T30n1581_006:0921b03	不淨觀。瞋修慈心。癡觀緣起。覺觀所亂修安	不 淨 觀 瞋 修 慈 心 癡 觀 緣 起 覺 觀 所 亂 修 安 
T30n1581_006:0921b04	般念。慢修分別界方便觀。如是等名隨順精	般 念 慢 修 分 別 界 方 便 觀 如 是 等 名 隨 順 精 
T30n1581_006:0921b05	進。是菩薩非成就初業精進。謂心已住教授	進 是 菩 薩 非 成 就 初 業 精 進 謂 心 已 住 教 授 
T30n1581_006:0921b06	教誡。修習方便調伏方便。是名菩薩修習精	教 誡 修 習 方便調伏 方 便 是 名 菩 薩 修 習 精 
T30n1581_006:0921b07	進。是菩薩非修習精進。教授教誡。方便心	進 是 菩 薩 非 修 習 精 進 教授教誡 方 便 心 
T30n1581_006:0921b08	住。然是初業。是菩薩於是方便。專精進方	住 然 是 初 業 是 菩 薩 於 是 方 便 專 精 進 方 
T30n1581_006:0921b09	便。常方便。頓方便。是名專著精進。是菩薩	便 常 方 便 頓 方 便 是 名 專 著 精 進 是 菩 薩 
T30n1581_006:0921b10	因諸所尊。若多聞力不顛倒受。其心安住精	因 諸 所 尊 若 多 聞 力 不 顛 倒 受 其 心 安 住 精 
T30n1581_006:0921b11	進方便。是名善攝精進。是菩薩如是不顛倒	進 方 便 是 名 善 攝 精 進 是 菩 薩 如 是 不 顛 倒 
T30n1581_006:0921b12	受。止時修止。舉時修舉。捨時修捨。是名時具	受 止 時 修 止 舉 時 修 舉 捨 時 修 捨 是 名 時 具 
T30n1581_006:0921b13	足精進。菩薩於止舉捨相。三昧住起相。常	足 精 進 菩 薩 於 止 舉 捨 相 三 昧 住 起 相 常 
T30n1581_006:0921b14	善觀察不妄分別。是名菩薩分別相精進。是	善 觀 察 不 妄 分 別 是 名 菩 薩 分 別 相 精 進 是 
T30n1581_006:0921b15	菩薩聞說第一妙勝。第一甚深。不可思議	菩 薩 聞 說 第 一 妙 勝 第 一 甚 深 不可思議 
T30n1581_006:0921b16	無量菩薩精進方便。心不自輕亦不怯弱不	無 量 菩 薩 精 進 方 便 心 不 自 輕 亦 不 怯 弱 不 
T30n1581_006:0921b17	少勝進。生知足想而不上求。是名菩薩不退	少 勝 進 生 知 足 想 而 不 上 求 是 名 菩 薩 不 退 
T30n1581_006:0921b18	弱精進。是菩薩常守根門飲食知量。初夜後	弱 精 進 是 菩 薩 常 守 根 門 飲 食 知 量 初 夜 後 
T30n1581_006:0921b19	夜未曾睡眠。精進方便正智心住。如是等三	夜 未 曾 睡 眠 精 進 方 便 正 智 心 住 如 是 等 三 
T30n1581_006:0921b20	摩跋提。具精勤成就正義饒益。是名菩薩	摩 跋 提 具 精 勤 成 就 正 義 饒 益 是 名 菩 薩 
T30n1581_006:0921b21	不壞精進。是菩薩精進方便。不緩不急平等	不 壞 精 進 是 菩 薩 精 進 方 便 不 緩 不 急 平 等 
T30n1581_006:0921b22	修習。一切方便平等頓修。是名菩薩平等精	修 習 一 切 方 便 平 等 頓 修 是 名 菩 薩 平 等 精 
T30n1581_006:0921b23	進。是菩薩一切精進方便所作。迴向無上菩	進 是 菩 薩 一切精進 方 便 所 作 迴 向 無 上 菩 
T30n1581_006:0921b24	提。是名菩薩正迴向精進。如是從自性精進	提 是 名 菩 薩 正 迴 向 精 進 如 是 從 自 性 精 進 
T30n1581_006:0921b25	乃至清淨精進。當得大菩提果。菩薩依是精	乃 至 清 淨 精 進 當 得大菩提 果 菩 薩 依 是 精 
T30n1581_006:0921b26	進滿足。毘梨耶波羅蜜。得阿耨多羅三藐三	進 滿 足 毘梨耶波羅蜜 得 阿 耨 多 羅 三 藐 三 
T30n1581_006:0921b27	菩提。	菩 提 
T30n1581_006:0921b28	菩薩地持方便處禪品第十三	菩 薩 地 持 方 便 處 禪 品 第 十 三 
T30n1581_006:0921b29	云何菩薩禪波羅蜜。略說九種。一者自性	云 何 菩 薩 禪 波 羅 蜜 略 說 九 種 一 者 自 性 
T30n1581_006:0921c01	禪。二者一切禪。三者難禪。四者一切門禪。五	禪 二 者 一 切 禪 三 者 難 禪 四 者 一 切 門 禪 五 
T30n1581_006:0921c02	者善人禪。六者一切行禪。七者除惱禪。八者	者 善 人 禪 六 者 一 切 行 禪 七 者 除 惱 禪 八 者 
T30n1581_006:0921c03	此世他世樂禪。九者清淨禪。云何自性禪。	此世他世 樂 禪 九 者 清 淨 禪 云 何 自 性 禪 
T30n1581_006:0921c04	於菩薩藏聞思。前行世間出世間善。一心安	於 菩 薩 藏 聞 思 前 行 世間出世間 善 一 心 安 
T30n1581_006:0921c05	住。或止分。或觀分。或此二同類。或俱分。是	住 或 止 分 或 觀 分 或 此 二 同 類 或 俱 分 是 
T30n1581_006:0921c06	名自性禪。	名 自 性 禪 
T30n1581_006:0921c07	云何菩薩一切禪。略說二種。一者世聞。	云 何 菩 薩 一 切 禪 略 說 二 種 一 者 世 聞 
T30n1581_006:0921c08	二者出世間。又隨其所應各有三種。一者現	二 者 出 世 間 又 隨其所應 各 有 三 種 一 者 現 
T30n1581_006:0921c09	法樂住禪。二者出生三昧功德禪。三者利益	法 樂 住 禪 二 者 出 生 三 昧 功 德 禪 三 者 利 益 
T30n1581_006:0921c10	眾生禪。菩薩禪定離一世妄想。身心止息。	眾 生 禪 菩 薩 禪 定 離 一 世 妄 想 身 心 止 息 
T30n1581_006:0921c11	第一寂滅自舉心息。捨離味著及一切相。是	第一寂滅 自 舉 心 息 捨 離 味 著 及 一 切 相 是 
T30n1581_006:0921c12	名現法樂住禪。菩薩禪定出生種種不可思	名 現法樂住 禪 菩 薩 禪 定 出 生 種 種 不 可 思 
T30n1581_006:0921c13	議無量無邊十力種性所攝三昧。彼諸三昧。	議 無量無邊 十 力 種 性 所 攝 三 昧 彼 諸 三 昧 
T30n1581_006:0921c14	一切聲聞辟支佛不知其名。況復能起及所	一 切 聲 聞 辟 支 佛 不 知 其 名 況 復 能 起 及 所 
T30n1581_006:0921c15	出生。二乘解脫。除入一切入無礙慧無諍	出 生 二 乘 解 脫 除 入 一 切 入 無 礙 慧 無 諍 
T30n1581_006:0921c16	願智勝妙功德。是名菩薩出生三昧功德禪。	願 智 勝 妙 功 德 是 名 菩 薩 出 生 三 昧 功 德 禪 
T30n1581_006:0921c17	利益眾生禪者。有十一種。如前說。菩薩依	利 益 眾 生 禪 者 有 十 一 種 如 前 說 菩 薩 依 
T30n1581_006:0921c18	布施。眾生所作。以義饒益。皆與同事。為除	布 施 眾 生 所 作 以 義 饒 益 皆 與 同 事 為 除 
T30n1581_006:0921c19	眾苦。如所應說知恩報恩。護諸恐怖。諸難憂	眾 苦 如 所 應 說 知 恩 報 恩 護 諸 恐 怖 諸 難 憂 
T30n1581_006:0921c20	苦能為開解。資生不具給施所須。如法畜眾	苦 能 為 開 解 資 生 不 具 給 施 所 須 如 法 畜 眾 
T30n1581_006:0921c21	善能隨順。見實功德歡喜讚歎。有過惡者	善能隨順 見 實 功 德 歡 喜 讚 歎 有 過 惡 者 
T30n1581_006:0921c22	等心析伏。神力恐怖或令歡喜是名略說	等 心 析 伏 神 力 恐 怖 或 令 歡 喜 是 名 略 說 
T30n1581_006:0921c23	一切禪。無餘無上。云何菩薩難禪。略說三	一 切 禪 無 餘 無 上 云 何 菩 薩 難 禪 略 說 三 
T30n1581_006:0921c24	種。菩薩久習勝妙禪定。於諸三昧心得自	種 菩 薩 久 習 勝 妙 禪 定 於 諸 三 昧 心 得 自 
T30n1581_006:0921c25	在。哀愍眾生欲令成熟。捨第一禪樂而生欲	在 哀 愍 眾 生 欲 令 成 熟 捨 第 一 禪 樂 而 生 欲 
T30n1581_006:0921c26	界。是名菩薩第一難禪。菩薩依禪出生無量	界 是 名 菩 薩 第 一 難 禪 菩 薩 依 禪 出 生 無 量 
T30n1581_006:0921c27	無數不可思議諸深三昧。出過一切聲聞辟	無 數 不可思議 諸 深 三 昧 出 過 一 切 聲 聞 辟 
T30n1581_006:0921c28	支佛上。是名第二難禪。菩薩依禪得無上菩	支 佛 上 是 名 第 二 難 禪 菩 薩 依 禪 得 無 上 菩 
T30n1581_006:0922a01	提。是名第三難禪。云何菩薩一切門禪。略	提 是 名 第 三 難 禪 云 何 菩 薩 一 切 門 禪 略 
T30n1581_006:0922a02	說四種。一者有觀有覺禪。二者喜俱禪。	說 四 種 一 者 有 觀 有 覺 禪 二 者 喜 俱 禪 
T30n1581_006:0922a03	三者樂俱禪。四者捨俱禪。	三 者 樂 俱 禪 四 者 捨 俱 禪 
T30n1581_006:0922a04	云何菩薩善人禪。略說五種。一者不味	云 何 菩 薩 善 人 禪 略 說 五 種 一 者 不 味 
T30n1581_006:0922a05	著。二者慈心俱。三者悲心俱。四者喜心俱。五	著 二 者 慈 心 俱 三 者 悲 心 俱 四 者 喜 心 俱 五 
T30n1581_006:0922a06	者捨心俱。	者 捨 心 俱 
