T30n1581_008:0936c17	種方便名方便施設。如前力種性品說。乘施	種 方 便 名 方 便 施 設 如 前 力 種 性 品 說 乘 施 
T30n1581_008:0936c18	設者。聲聞乘。緣覺乘。大乘。一一乘七種施	設 者 聲 聞 乘 緣 覺 乘 大 乘 一 一 乘 七 種 施 
T30n1581_008:0936c19	設。四聖諦慧。如是慧。若依若緣伴業眾具。如	設 四 聖 諦 慧 如 是 慧 若 依 若 緣 伴 業 眾 具 如 
T30n1581_008:0936c20	是慧若果。此七種名聲聞乘施設。如聲聞乘	是 慧 若 果 此 七 種 名 聲 聞 乘 施 設 如 聲 聞 乘 
T30n1581_008:0936c21	施設。緣覺乘亦如是。離言說境界。一切法如	施 設 緣 覺 乘 亦 如 是 離 言 說 境 界 一切法如 
T30n1581_008:0936c22	離諸妄想。平等慧。如是慧。若依若緣伴業眾	離 諸 妄 想 平 等 慧 如 是 慧 若 依 若 緣 伴 業 眾 
T30n1581_008:0936c23	具。如是慧若果。此七種名大乘施設。過去未	具 如 是 慧 若 果 此 七 種 名 大 乘 施 設 過 去 未 
T30n1581_008:0936c24	來現在。一切菩薩正施設。已作當作。一切四	來 現 在 一切菩薩 正 施 設 已 作 當 作 一 切 四 
T30n1581_008:0936c25	種無餘無上。	種 無 餘 無 上 
T30n1581_008:0936c26	菩薩有五種無量生一切巧便行。一者眾生	菩 薩 有 五 種 無 量 生 一 切 巧 便 行 一 者 眾 生 
T30n1581_008:0936c27	界無量。二者世界無量。三者法界無量。四者	界 無 量 二 者 世界無量 三 者 法 界 無 量 四 者 
T30n1581_008:0936c28	調伏界無量。五者調伏方便無量。六十一種	調 伏 界 無 量 五 者 調 伏 方 便 無 量 六 十 一 種 
T30n1581_008:0936c29	眾生名眾生界。如意地身分別則有無量。十	眾 生 名 眾 生 界 如 意 地 身 分 別 則 有 無 量 十 
T30n1581_008:0937a01	方無量世界無量。名如娑婆世界。名娑婆主。	方 無量世界 無 量 名 如 娑婆世界 名 娑 婆 主 
T30n1581_008:0937a02	善不善無記法分別則有無量。調伏有一種。	善不善無記 法 分 別 則 有 無 量 調 伏 有 一 種 
T30n1581_008:0937a03	謂一切眾生調伏。復有二種。具縛。不具縛。復	謂 一 切 眾 生 調 伏 復 有 二 種 具 縛 不 具 縛 復 
T30n1581_008:0937a04	有三種。軟中上根。復有四種。剎利。婆羅門。毘	有 三 種 軟 中 上 根 復 有 四 種 剎 利 婆 羅 門 毘 
T30n1581_008:0937a05	舍。首陀復有五種。貪欲。瞋恚。愚癡。憍慢。覺	舍 首 陀 復 有 五 種 貪 欲 瞋 恚 愚 癡 憍 慢 覺 
T30n1581_008:0937a06	觀。復有六種。在家。出家。未熟。已熟。未解脫。	觀 復 有 六 種 在 家 出 家 未 熟 已 熟 未 解 脫 
T30n1581_008:0937a07	已解脫。復有七種。惡人。中人。小智人。大智	已 解 脫 復 有 七 種 惡 人 中 人 小 智 人 大 智 
T30n1581_008:0937a08	人。現在調伏。未來調伏。隨緣調伏。若得緣如	人 現 在 調 伏 未 來 調 伏 隨 緣 調 伏 若 得 緣 如 
T30n1581_008:0937a09	是。如是迴向。復有八種。謂八眾剎利。乃至婆	是 如 是 迴 向 復 有 八 種 謂 八 眾 剎 利 乃 至 婆 
T30n1581_008:0937a10	羅門。復有九種。一者如來調伏。二者聲聞緣	羅 門 復 有 九 種 一 者 如 來 調 伏 二 者 聲 聞 緣 
T30n1581_008:0937a11	覺調伏。三者菩薩調伏。四者難調伏。五者易	覺 調 伏 三 者 菩 薩 調 伏 四 者 難 調 伏 五 者 易 
T30n1581_008:0937a12	調伏。六者軟語調伏。七者呵責調伏。八者遠	調 伏 六 者 軟 語 調 伏 七 者 呵 責 調 伏 八 者 遠 
T30n1581_008:0937a13	調伏。九者近調伏。復有十種。一者地獄。二	調 伏 九 者 近 調 伏 復 有 十 種 一 者 地 獄 二 
T30n1581_008:0937a14	者畜生。三者餓鬼。四者欲界人天。五者中陰。	者 畜 生 三 者 餓 鬼 四 者 欲 界 人 天 五 者 中 陰 
T30n1581_008:0937a15	六者色。七者無色。八者想。九者無想。十者非	六 者 色 七 者 無 色 八 者 想 九 者 無 想 十 者 非 
T30n1581_008:0937a16	想非非想。是五十五種分別則為無量。眾生	想 非 非 想 是 五 十 五 種 分 別 則 為 無 量 眾 生 
T30n1581_008:0937a17	界調伏界有何差別。眾生界者。不分別一切	界 調 伏 界 有何差別 眾 生 界 者 不 分 別 一 切 
T30n1581_008:0937a18	眾生種性處。調伏界者。彼種性處。如是彼彼	眾 生 種 性 處 調 伏 界 者 彼 種 性 處 如 是 彼 彼 
T30n1581_008:0937a19	處轉調伏方便無量。如前成熟品說。彼亦無	處 轉 調 伏 方 便 無 量 如 前 成 熟 品 說 彼 亦 無 
T30n1581_008:0937a20	量種分別。如是次第說五種無量。何以故。是	量 種 分 別 如 是 次 第 說 五 種 無 量 何 以 故 是 
T30n1581_008:0937a21	菩薩為眾生修行。是故說初無量。眾生彼處	菩 薩 為 眾 生 修 行 是 故 說 初 無 量 眾 生 彼 處 
T30n1581_008:0937a22	可得。是故說第二無量。眾生於彼彼世界煩	可 得 是 故 說 第 二 無 量 眾 生 於 彼 彼 世 界 煩 
T30n1581_008:0937a23	惱清淨法可得。是故說第三無量。觀彼彼眾	惱 清 淨 法 可 得 是 故 說 第 三 無 量 觀 彼 彼 眾 
T30n1581_008:0937a24	生隨所堪能脫苦。是故說第四無量。乃至方	生 隨 所 堪 能 脫 苦 是 故 說 第 四 無 量 乃 至 方 
T30n1581_008:0937a25	便脫眾生苦。是故說第五無量。是故說五種	便 脫 眾 生 苦 是 故 說 第 五 無 量 是 故 說 五 種 
T30n1581_008:0937a26	無量。生菩薩一切巧便行。菩薩有四求。於一	無 量 生 菩 薩 一 切 巧 便 行 菩 薩 有 四 求 於 一 
T30n1581_008:0937a27	切法如實知。一者名求。二者事求。三者自性	切 法 如 實 知 一 者 名 求 二 者 事 求 三 者 自 性 
T30n1581_008:0937a28	施設求。四者差別施設求。如前真實品說。菩	施 設 求 四 者 差別施設求 如 前 真 實 品 說 菩 
T30n1581_008:0937a29	薩有四事。於一切法如實知。隨名求如實知。	薩 有 四 事 於一切法 如 實 知 隨 名 求 如 實 知 
T30n1581_008:0937b01	隨事求如實知。隨自性施設求如實知。隨差	隨 事 求 如 實 知 隨 自性施設求 如 實 知 隨 差 
T30n1581_008:0937b02	別施設求如實知。如前真實品說。	別 施 設 求 如 實 知 如 前 真 實 品 說 
T30n1581_008:0937b03	諸佛菩薩有五事。為眾生說法得大果福利。	諸佛菩薩 有 五 事 為 眾 生 說 法 得 大 果 福 利 
T30n1581_008:0937b04	一者為眾生說法生離垢法眼。二者為眾生	一 者 為 眾 生 說 法 生 離 垢 法 眼 二 者 為 眾 生 
T30n1581_008:0937b05	說法得諸漏盡。三者為眾生說法發無上菩	說 法 得 諸 漏 盡 三 者 為 眾 生 說 法 發 無 上 菩 
T30n1581_008:0937b06	提心。四者為眾生說法得第一菩薩忍。五者	提 心 四 者 為 眾 生 說 法 得 第 一 菩 薩 忍 五 者 
T30n1581_008:0937b07	為眾生說法。聞已受誦。具足修習令法久住。	為 眾 生 說 法 聞 已 受 誦 具 足 修 習 令 法 久 住 
T30n1581_008:0937b08	是名五種說法得大果福利。	是 名 五 種 說 法 得 大 果 福 利 
T30n1581_008:0937b09	云何名大乘。有七種大故名為大乘。一者法	云 何 名 大 乘 有 七 種 大 故 名 為 大 乘 一 者 法 
T30n1581_008:0937b10	大。謂十二部經。菩薩方廣藏。最上最大。二者	大 謂 十二部經 菩 薩 方 廣 藏 最 上 最 大 二 者 
T30n1581_008:0937b11	心大。謂發阿耨多羅三藐三菩提心。三者解	心 大 謂 發 阿耨多羅三藐三菩提 心 三 者 解 
T30n1581_008:0937b12	大。謂解菩薩方廣藏。四者淨心大。謂過解行	大 謂 解 菩 薩 方 廣 藏 四 者 淨 心 大 謂 過 解 行 
T30n1581_008:0937b13	地入淨心地。五者眾具大。謂福德眾具智慧	地 入 淨 心 地 五 者 眾 具 大 謂 福 德 眾 具 智 慧 
T30n1581_008:0937b14	眾具得無上菩提。六者時大。謂三阿僧祇劫	眾 具 得 無上菩提 六 者 時 大 謂 三阿僧祇劫 
T30n1581_008:0937b15	得無上菩提。七者得大。謂得無上菩提身無	得 無上菩提 七 者 得 大 謂 得 無上菩提 身 無 
T30n1581_008:0937b16	與等者。況復過上。彼法大心大解大淨心大	與 等 者 況 復 過 上 彼 法 大 心 大 解 大 淨 心 大 
T30n1581_008:0937b17	眾具大時大。此六大謂因種得大謂果處。菩	眾 具 大 時 大 此 六 大 謂 因 種 得 大 謂 果 處 菩 
T30n1581_008:0937b18	薩有八法攝一切摩訶衍菩薩藏所說。謂信	薩 有 八 法 攝 一 切 摩 訶 衍 菩 薩 藏 所 說 謂 信 
T30n1581_008:0937b19	菩薩藏。顯示一切法真實義。顯示一切諸佛	菩 薩 藏 顯 示 一 切 法 真 實 義 顯 示 一切諸佛 
T30n1581_008:0937b20	菩薩不可思議第一勝妙神力。得聞慧思慧	菩 薩 不可思議 第 一 勝 妙 神 力 得 聞 慧 思 慧 
T30n1581_008:0937b21	思惟。依聞慧思慧思惟。方便得淨心。得淨心。	思 惟 依 聞 慧 思 慧 思 惟 方 便 得 淨 心 得 淨 心 
T30n1581_008:0937b22	方便入修慧行。入修慧行。方便修慧果。成	方 便 入 修 慧 行 入 修 慧 行 方 便 修 慧 果 成 
T30n1581_008:0937b23	如是修慧果。成畢竟出離。菩薩如是學得無	如 是 修 慧 果 成 畢 竟 出 離 菩 薩 如 是 學 得 無 
T30n1581_008:0937b24	上菩提。菩薩如是學得無上菩提略說十種。	上 菩 提 菩 薩 如 是 學 得 無上菩提 略 說 十 種 
T30n1581_008:0937b25	一者種性。二者入。三者未淨。四者淨。五者未	一 者 種 性 二 者 入 三 者 未 淨 四 者 淨 五 者 未 
T30n1581_008:0937b26	熟。六者熟。七者未定。八者定。九者一生。十	熟 六 者 熟 七 者 未 定 八 者 定 九 者 一 生 十 
T30n1581_008:0937b27	者最後身。種性者。名未得淨心。發心修學	者 最 後 身 種 性 者 名 未 得 淨 心 發 心 修 學 
T30n1581_008:0937b28	名為入。已入未入淨心地名為未淨。入淨	名 為 入 已 入 未 入 淨 心 地 名 為 未 淨 入 淨 
T30n1581_008:0937b29	心地名為淨。淨者未入畢竟地名為未熟。入	心 地 名 為 淨 淨 者 未 入 畢 竟 地 名 為 未 熟 入 
T30n1581_008:0937c01	畢竟地名為熟。熟者未入定地名為未定。已	畢 竟 地 名 為 熟 熟 者 未 入 定 地 名 為 未 定 已 
T30n1581_008:0937c02	入定地名為定。又熟有二種。一者一生。次第	入 定 地 名 為 定 又 熟 有 二 種 一 者 一 生 次 第 
T30n1581_008:0937c03	得無上菩提。二者最後身。即此生得。如是從	得 無上菩提 二 者 最 後 身 即 此 生 得 如 是 從 
T30n1581_008:0937c04	種性乃至最後身得無上菩提。此十種菩薩	種 性 乃 至 最 後 身 得 無上菩提 此 十 種 菩 薩 
T30n1581_008:0937c05	所學而學。於上更無所學。菩薩如所學而學。	所 學 而 學 於 上 更 無 所 學 菩 薩 如 所 學 而 學 
T30n1581_008:0937c06	於上更無菩薩學。菩薩如所學而學。得一切	於 上 更 無 菩 薩 學 菩 薩 如 所 學 而 學 得 一 切 
T30n1581_008:0937c07	功德名。所謂菩薩摩訶薩。勇猛無上。佛子佛	功 德 名 所 謂 菩薩摩訶薩 勇 猛 無 上 佛 子 佛 
T30n1581_008:0937c08	持。大師大聖。大商主大名稱。大功德大自在。	持 大 師 大 聖 大 商 主 大 名 稱 大 功 德 大 自 在 
T30n1581_008:0937c09	如是十方無量世界無量菩薩無量因緣。自	如 是 十 方 無量世界 無 量 菩 薩 無 量 因 緣 自 
T30n1581_008:0937c10	想施設。當知若有言我是菩薩。不善學菩薩	想 施 設 當 知 若 有 言 我 是 菩 薩 不 善 學 菩 薩 
T30n1581_008:0937c11	所學者。當知是名字菩薩非實菩薩。若言	所 學 者 當 知 是 名 字 菩 薩 非 實 菩 薩 若 言 
T30n1581_008:0937c12	我是菩薩。善學菩薩所學者。當知是實菩	我 是 菩 薩 善 學 菩 薩 所 學 者 當 知 是 實 菩 
T30n1581_008:0937c13	薩。◎	薩 
T30n1581_008:0937c14	◎菩薩地持次法方便處菩薩相品第一	 菩 薩 地 持 次 法 方 便 處 菩 薩 相 品 第 一 
T30n1581_008:0937c15	(第二段有四品)	 第 二 段 有 四 品 
T30n1581_008:0937c16	菩薩成就五種真實相得入諸菩薩數。一者	菩 薩 成 就 五 種 真 實 相 得 入 諸 菩 薩 數 一 者 
T30n1581_008:0937c17	哀愍。二者愛語。三者勇猛。四者惠施。五	哀 愍 二 者 愛 語 三 者 勇 猛 四 者 惠 施 五 
T30n1581_008:0937c18	者說深法義。此五相。各五種分別。一者自	者 說 深 法 義 此 五 相 各 五 種 分 別 一 者 自 
T30n1581_008:0937c19	性。二者境界。三者果報。四者次第。五者攝	性 二 者 境 界 三 者 果 報 四 者 次 第 五 者 攝 
T30n1581_008:0937c20	受。	受 
T30n1581_008:0937c21	哀愍自性有二種。一者至心。二者具足。至	哀 愍 自 性 有 二 種 一 者 至 心 二 者 具 足 至 
T30n1581_008:0937c22	心者。安心樂心。具足者。菩薩至心於諸眾	心 者 安 心 樂 心 具 足 者 菩 薩 至 心 於 諸 眾 
T30n1581_008:0937c23	生。隨其所能隨其力。身口饒益。愛語自性者。	生 隨 其 所 能 隨 其 力 身 口 饒 益 愛 語 自 性 者 
T30n1581_008:0937c24	先語安慰。如前攝品說。勇猛自性者。於諸眾	先 語 安 慰 如 前 攝 品 說 勇 猛 自 性 者 於 諸 眾 
T30n1581_008:0937c25	生志強有力。惠施自性者。勝妙施無煩惱	生 志 強 有 力 惠 施 自 性 者 勝 妙 施 無 煩 惱 
T30n1581_008:0937c26	施。說深法義自性者。四無礙智。出生正方	施 說 深 法 義 自 性 者 四無礙智 出 生 正 方 
T30n1581_008:0937c27	便智。哀愍境界有五種。一者受苦眾生。二者	便 智 哀 愍 境 界 有 五 種 一 者 受 苦 眾 生 二 者 
T30n1581_008:0937c28	惡行眾生。三者放逸眾生。四者邪趣眾生。五	惡 行 眾 生 三 者 放 逸 眾 生 四 者 邪 趣 眾 生 五 
T30n1581_008:0937c29	者煩惱所使眾生。從地獄乃至一切苦受相	者 煩 惱 所 使 眾 生 從 地 獄 乃 至 一 切 苦 受 相 
T30n1581_008:0938a01	續。是名受苦。雖不受苦而多造作身口意惡	續 是 名 受 苦 雖 不 受 苦 而 多 造 作 身 口 意 惡 
T30n1581_008:0938a02	行。所謂十二惡律儀。是名惡行。雖不受苦	行 所 謂 十 二 惡 律 儀 是 名 惡 行 雖 不 受 苦 
T30n1581_008:0938a03	造諸惡行而樂著五欲歌舞戲笑。是名放逸。	造 諸 惡 行 而 樂 著 五 欲 歌 舞 戲 笑 是 名 放 逸 
T30n1581_008:0938a04	雖不受苦造諸惡行樂著五欲。而依邪見求	雖 不 受 苦 造 諸 惡 行 樂 著 五 欲 而 依 邪 見 求 
T30n1581_008:0938a05	苦解脫。是名邪趣。捨離五欲於法出家。不受	苦 解 脫 是 名 邪 趣 捨 離 五 欲 於 法 出 家 不 受 
T30n1581_008:0938a06	諸苦乃至邪趣。而具煩惱或有不具。謂正方	諸 苦 乃 至 邪 趣 而 具 煩 惱 或 有 不 具 謂 正 方 
T30n1581_008:0938a07	便。真實凡夫及諸學人。是名煩惱所使。菩薩	便 真 實 凡 夫 及 諸 學 人 是 名 煩 惱 所 使 菩 薩 
T30n1581_008:0938a08	於此境界哀愍心生無餘無上。	於 此 境 界 哀 愍 心 生 無 餘 無 上 
T30n1581_008:0938a09	愛語境界有五種。一者正實語。二者正喜語。	愛 語 境 界 有 五 種 一 者 正 實 語 二 者 正 喜 語 
T30n1581_008:0938a10	三者正饒益語。四者正如法語。五者方便說	三 者 正 饒 益 語 四 者 正 如 法 語 五 者 方 便 說 
T30n1581_008:0938a11	法語。如前攝品說。菩薩於此境界愛語心生	法 語 如 前 攝 品 說 菩 薩 於 此 境 界 愛 語 心 生 
T30n1581_008:0938a12	無餘無上。勇猛境界有五種。如前菩提分品	無 餘 無 上 勇 猛 境 界 有 五 種 如 前 菩 提 分 品 
T30n1581_008:0938a13	說。菩薩於此境界勇猛心生無餘無上。	說 菩 薩 於 此 境 界 勇 猛 心 生 無 餘 無 上 
T30n1581_008:0938a14	惠施境界有五種。一者不分別施。二者歡喜	惠 施 境 界 有 五 種 一 者 不 分 別 施 二 者 歡 喜 
T30n1581_008:0938a15	施。三者頓施。四者不染污施。五者無依施。	施 三 者 頓 施 四 者 不 染 污 施 五 者 無 依 施 
T30n1581_008:0938a16	如前施品說。菩薩於此境界惠施心生無餘	如 前 施 品 說 菩 薩 於 此 境 界 惠 施 心 生 無 餘 
T30n1581_008:0938a17	無上。說深法義境界有五種。一者於如來所	無 上 說 深 法 義 境 界 有 五 種 一 者 於 如 來 所 
T30n1581_008:0938a18	說修多羅。甚深空相應緣起隨順。二者於諸	說 修 多 羅 甚 深 空 相 應 緣 起 隨 順 二 者 於 諸 
T30n1581_008:0938a19	戒律。善知犯不犯及與出犯。三者於摩德勒	戒 律 善 知 犯 不 犯 及 與 出 犯 三 者 於 摩 德 勒 
T30n1581_008:0938a20	伽藏。不顛倒建立法相。四者於深法義以	伽 藏 不 顛 倒 建 立 法 相 四 者 於 深 法 義 以 
T30n1581_008:0938a21	想分別。五者於一切法法義種種言辭種種分	想 分 別 五 者 於一切法 法 義 種 種 言 辭 種 種 分 
T30n1581_008:0938a22	別。菩薩於此境界說深法義心生無餘無上。	別 菩 薩 於 此 境 界 說 深 法 義 心 生 無 餘 無 上 
T30n1581_008:0938a23	菩薩哀愍於諸眾生修習慈心。利益親厚方	菩 薩 哀 愍 於 諸 眾 生 修 習 慈 心 利 益 親 厚 方 
T30n1581_008:0938a24	便不厭。多住無罪現法樂攝取眾生。如世	便 不 厭 多 住 無 罪 現 法 樂 攝 取 眾 生 如 世 
T30n1581_008:0938a25	尊說。慈心福利。身常不被刀杖等害。此中應	尊 說 慈 心 福 利 身 常 不 被 刀 杖 等 害 此 中 應 
T30n1581_008:0938a26	廣說。是名哀愍果。	廣 說 是 名 哀 愍 果 
T30n1581_008:0938a27	菩薩愛語。於現法中離口四過。兩舌惡口妄	菩 薩 愛 語 於現法中 離 口 四 過 兩 舌 惡 口 妄 
T30n1581_008:0938a28	言綺語。以此愛語自攝攝他。於未來世成就	言 綺 語 以 此 愛 語 自 攝 攝 他 於未來世 成 就 
T30n1581_008:0938a29	正語。言輒信用。是名愛語果。	正 語 言 輒 信 用 是 名 愛 語 果 
T30n1581_008:0938b01	菩薩勇猛。於現法中離諸懈怠心常歡喜。受	菩 薩 勇 猛 於現法中 離 諸 懈 怠 心 常 歡 喜 受 
T30n1581_008:0938b02	持菩薩律儀戒不毀不犯。以堪忍心攝受自	持 菩 薩 律 儀 戒 不 毀 不 犯 以 堪 忍 心 攝 受 自 
T30n1581_008:0938b03	他。於未來世菩薩所作悉能修學。學已堅固。	他 於未來世 菩薩所作 悉 能 修 學 學 已 堅 固 
T30n1581_008:0938b04	是名勇猛界。	是 名 勇 猛 界 
T30n1581_008:0938b05	菩薩惠施及說深法義果。如前力品檀波羅	菩 薩 惠 施 及 說 深 法 義 果 如 前 力 品 檀 波 羅 
T30n1581_008:0938b06	蜜般若波羅蜜說。是名惠施說深法義果。次	蜜 般 若 波 羅 蜜 說 是 名 惠 施 說 深 法 義 果 次 
T30n1581_008:0938b07	第者。菩薩先修哀愍。攝取眾生。為令眾	第 者 菩 薩 先 修 哀 愍 攝 取 眾 生 為 令 眾 
T30n1581_008:0938b08	生出不善法安立善法。為具足說教授攝	生 出 不 善 法 安 立 善 法 為 具 足 說 教 授 攝 
T30n1581_008:0938b09	受。是故次說愛語。眾生造惡種種煩惱堪能	受 是 故 次 說 愛 語 眾 生 造 惡 種種煩惱 堪 能 
T30n1581_008:0938b10	不息。是故次說勇猛。或有眾生以財攝受。	不 息 是 故 次 說 勇 猛 或 有 眾 生 以 財 攝 受 
T30n1581_008:0938b11	或有眾生以法攝受。或俱攝受。是故次說惠	或 有 眾 生 以 法 攝 受 或 俱 攝 受 是 故 次 說 惠 
T30n1581_008:0938b12	施。說深法義。	施 說 深 法 義 
T30n1581_008:0938b13	菩薩。有五種相攝六波羅蜜。此六波羅蜜何	菩 薩 有 五 種 相 攝 六波羅蜜 此 六波羅蜜 何 
T30n1581_008:0938b14	相所攝。哀愍相攝禪波羅蜜。愛語相攝尸	相 所 攝 哀 愍 相 攝 禪 波 羅 蜜 愛 語 相 攝 尸 
T30n1581_008:0938b15	波羅蜜般若波羅蜜。勇猛相攝羼提波羅蜜	波 羅 蜜 般 若 波 羅 蜜 勇 猛 相 攝 羼 提 波 羅 蜜 
T30n1581_008:0938b16	毘離耶波羅蜜般若波羅蜜。惠施相攝檀	毘 離 耶 波 羅 蜜 般 若 波 羅 蜜 惠 施 相 攝 檀 
T30n1581_008:0938b17	波羅蜜。說深法義相攝禪波羅蜜般若波	波 羅 蜜 說 深 法 義 相 攝 禪 波 羅 蜜 般 若 波 
T30n1581_008:0938b18	羅蜜。是名菩薩五種相五種分別。	羅 蜜 是 名 菩 薩 五 種 相 五 種 分 別 
T30n1581_008:0938b19	菩薩地持次法方便處翼品第二	菩 薩 地 持 次 法 方 便 處 翼 品 第 二 
T30n1581_008:0938b20	在家出家菩薩翼有四法。菩薩修學疾得阿	在家出家 菩 薩 翼 有 四 法 菩 薩 修 學 疾 得 阿 
T30n1581_008:0938b21	耨多羅三藐三菩提。一者善修業。二者巧便。	耨 多 羅 三藐三菩提 一 者 善 修 業 二 者 巧 便 
T30n1581_008:0938b22	三者攝取眾生。四者迴向。云何善修業。菩薩	三 者 攝 取 眾 生 四 者 迴 向 云 何 善 修 業 菩 薩 
T30n1581_008:0938b23	於六波羅蜜。決定修。專心修。常修。無罪修。	於 六波羅蜜 決 定 修 專 心 修 常 修 無 罪 修 
T30n1581_008:0938b24	云何決定修。檀波羅蜜。是菩薩於來求者。	云 何 決 定 修 檀 波 羅 蜜 是 菩 薩 於 來 求 者 
T30n1581_008:0938b25	饒益不饒益。有德有過。要當施與。於諸惠	饒 益 不 饒 益 有 德 有 過 要 當 施 與 於 諸 惠 
T30n1581_008:0938b26	施心不傾動。若人非人。沙門婆羅門。世間	施 心 不 傾 動 若 人 非 人 沙 門 婆 羅 門 世 間 
T30n1581_008:0938b27	同法。所不能壞。云何專心修。是菩薩於求	同 法 所 不 能 壞 云 何 專 心 修 是 菩 薩 於 求 
T30n1581_008:0938b28	來者。捨內外物一切施與無有悋惜。云何常	來 者 捨 內 外 物 一 切 施 與 無 有 悋 惜 云 何 常 
T30n1581_008:0938b29	修。是菩薩施無厭惓。一切時平等隨得隨施。	修 是 菩 薩 施 無 厭 惓 一 切 時 平 等 隨 得 隨 施 
T30n1581_008:0938c01	云何無罪修。如施品說。離煩惱施。是名菩薩	云 何 無 罪 修 如 施 品 說 離 煩 惱 施 是 名 菩 薩 
T30n1581_008:0938c02	善修檀波羅蜜。如施如是戒忍精進禪定智	善 修 檀 波 羅 蜜 如 施 如 是 戒 忍 精 進 禪 定 智 
T30n1581_008:0938c03	慧亦如是。隨其所應當知。云何巧便。略說有	慧 亦 如 是 隨其所應 當 知 云 何 巧 便 略 說 有 
T30n1581_008:0938c04	十種。壞法眾生為除惱害。方便巧便。中住者	十 種 壞 法 眾 生 為 除 惱 害 方 便 巧 便 中 住 者 
T30n1581_008:0938c05	令入。已入者令熟。已熟者令解脫。方便巧便。	令 入 已 入 者 令 熟 已 熟 者 令 解 脫 方 便 巧 便 
T30n1581_008:0938c06	世論巧便。菩薩戒律若持若毀觀察巧便。正	世 論 巧 便 菩 薩 戒 律 若 持 若 毀 觀 察 巧 便 正 
T30n1581_008:0938c07	願巧便。聲聞乘巧便。緣覺乘巧便。大乘巧便。	願 巧 便 聲 聞 乘 巧 便 緣 覺 乘 巧 便 大 乘 巧 便 
T30n1581_008:0938c08	如是一切巧便。隨所應彼彼菩薩地。分別	如是一切 巧 便 隨 所 應 彼 彼 菩 薩 地 分 別 
T30n1581_008:0938c09	當知。此十巧便為五種事。初四巧便。為利	當 知 此 十 巧 便 為 五 種 事 初 四 巧 便 為 利 
T30n1581_008:0938c10	眾生。世論巧便。為伏異論。菩薩戒律若持若	眾 生 世 論 巧 便 為 伏 異 論 菩 薩 戒 律 若 持 若 
T30n1581_008:0938c11	毀觀察巧便。為不起犯戒。已犯者令如法悔。	毀 觀 察 巧 便 為 不 起 犯 戒 已 犯 者 令 如 法 悔 
T30n1581_008:0938c12	受持清淨律儀。正願巧便。菩薩於未來世	受 持 清 淨 律 儀 正 願 巧 便 菩 薩 於未來世 
T30n1581_008:0938c13	一切所欲悉皆得之。三乘巧便。菩薩隨種性	一 切 所 欲 悉 皆 得 之 三 乘 巧 便 菩 薩 隨 種 性 
T30n1581_008:0938c14	根解譬喻。隨順說法具足說法。如是十種巧	根 解 譬 喻 隨 順 說 法 具 足 說 法 如 是 十 種 巧 
T30n1581_008:0938c15	便為五種事。此五種事。一切所作皆悉具足。	便 為 五 種 事 此 五 種 事 一 切 所 作 皆 悉 具 足 
T30n1581_008:0938c16	現法後世利益方便。云何菩薩攝取眾生。	現 法 後 世 利 益 方 便 云 何 菩 薩 攝 取 眾 生 
T30n1581_008:0938c17	是菩薩依四攝法。布施愛語利益同事。或有	是 菩 薩 依 四 攝 法 布 施 愛 語 利 益 同 事 或 有 
T30n1581_008:0938c18	眾生。以安饒益。以樂饒益。以安樂饒益。廣	眾 生 以 安 饒 益 以 樂 饒 益 以 安 樂 饒 益 廣 
T30n1581_008:0938c19	說如前自他利品。云何菩薩迴向。菩薩三	說 如 前 自他利品 云 何 菩 薩 迴 向 菩 薩 三 
T30n1581_008:0938c20	門修習善根。謂善修業巧便。攝取眾生。彼	門 修習善根 謂 善 修 業 巧 便 攝 取 眾 生 彼 
T30n1581_008:0938c21	一切過去未來現在淳淨心。迴向阿耨多	一 切 過去未來現在 淳 淨 心 迴 向 阿 耨 多 
T30n1581_008:0938c22	羅三藐三菩提。不以善根求餘果報。	羅 三藐三菩提 不 以 善 根 求 餘 果 報 
T30n1581_008:0939a01	若世尊說。在家出家菩薩所學法。當知一切	若 世 尊 說 在家出家 菩 薩 所 學 法 當 知 一 切 
T30n1581_008:0939a02	皆是善修業巧便。攝取迴向四法所攝。菩薩	皆 是 善 修 業 巧 便 攝 取 迴 向 四 法 所 攝 菩 薩 
