T32n1667_002:0589c23	決定皆經三無數劫成正覺故。但隨眾生世	決 定 皆 經 三無數劫 成 正 覺 故 但 隨 眾 生 世 
T32n1667_002:0589c24	界不同。所見所聞根欲性異。示所修行種種	界 不 同 所 見 所 聞 根 欲 性 異 示 所 修 行 種 種 
T32n1667_002:0589c25	差別。此證發心中有三種心。一真心。無有	差 別 此 證 發 心 中 有 三 種 心 一 真 心 無 有 
T32n1667_002:0589c26	分別故。二方便心。任運利他故。三業識心。微	分 別 故 二 方 便 心 任 運 利 他 故 三 業 識 心 微 
T32n1667_002:0589c27	細起滅故。	細 起 滅 故 
T32n1667_002:0589c28	又此菩薩福德智慧二種莊嚴悉圓滿已。於	又 此 菩 薩 福 德 智 慧 二 種 莊 嚴 悉 圓 滿 已 於 
T32n1667_002:0589c29	色究竟得一切世間最尊勝身。以一念相應	色 究 竟 得 一切世間 最 尊 勝 身 以 一 念 相 應 
T32n1667_002:0590a01	慧。頓拔無明根。具一切種智。任運而有不思	慧 頓 拔 無 明 根 具 一切種智 任 運 而 有 不 思 
T32n1667_002:0590a02	議業。於十方無量世界普化眾生。	議 業 於 十 方 無量世界 普 化 眾 生 
T32n1667_002:0590a03	問虛空無邊故世界無邊。世界無邊故眾生	問 虛 空 無 邊 故 世 界 無 邊 世 界 無 邊 故 眾 生 
T32n1667_002:0590a04	無邊。眾生無邊故心行差別亦復無邊。如	無 邊 眾 生 無 邊 故 心 行 差 別 亦 復 無 邊 如 
T32n1667_002:0590a05	是境界無有齊限難知難解。若無明斷永無	是 境 界 無 有 齊 限 難 知 難 解 若 無 明 斷 永 無 
T32n1667_002:0590a06	心相。云何能了一切種。成一切種智。	心 相 云 何 能 了 一 切 種 成 一切種智 
T32n1667_002:0590a07	答一切妄境從本已來理實唯一心為性。一	答 一 切 妄 境 從 本 已 來 理 實 唯 一 心 為 性 一 
T32n1667_002:0590a08	切眾生執著妄境。不能得知一切諸法第一	切 眾 生 執 著 妄 境 不 能 得 知 一切諸法 第 一 
T32n1667_002:0590a09	義性。諸佛如來無有執著。則能現見諸法實	義 性 諸佛如來 無 有 執 著 則 能 現 見 諸 法 實 
T32n1667_002:0590a10	性。而有大智顯照一切染淨差別。以無量無	性 而 有 大 智 顯 照 一 切 染 淨 差 別 以 無 量 無 
T32n1667_002:0590a11	邊善巧方便。隨其所應利樂眾生。是故妄念	邊 善巧方便 隨其所應 利 樂 眾 生 是 故 妄 念 
T32n1667_002:0590a12	心滅。了一切種成一切種智。	心 滅 了 一 切 種 成 一切種智 
T32n1667_002:0590a13	問若諸佛有無邊方便。能於十方任運利益	問 若 諸 佛 有 無 邊 方 便 能 於 十 方 任 運 利 益 
T32n1667_002:0590a14	諸眾生者。何故眾生不常見佛。或覩神變。或	諸 眾 生 者 何 故 眾 生 不 常 見 佛 或 覩 神 變 或 
T32n1667_002:0590a15	聞說法。	聞 說 法 
T32n1667_002:0590a16	答如來實有如是方便。但要待眾生其心清	答 如 來 實 有 如 是 方 便 但 要 待 眾 生 其 心 清 
T32n1667_002:0590a17	淨。乃為現身。如鏡有垢色像不現。垢除則現。	淨 乃 為 現 身 如 鏡 有 垢 色 像 不 現 垢 除 則 現 
T32n1667_002:0590a18	眾生亦爾。心未離垢。法身不現。離垢則現。云	眾 生 亦 爾 心 未 離 垢 法 身 不 現 離 垢 則 現 云 
T32n1667_002:0590a19	何修習信分。此依未入正定眾生說。何者為	何 修 習 信 分 此 依 未 入 正 定 眾 生 說 何 者 為 
T32n1667_002:0590a20	信心。云何而修習。信有四種。一信根本。謂樂	信 心 云 何 而 修 習 信 有 四 種 一 信 根 本 謂 樂 
T32n1667_002:0590a21	念真如法故。二信佛具足無邊功德。謂常樂	念 真 如 法 故 二 信 佛 具 足 無 邊 功 德 謂 常 樂 
T32n1667_002:0590a22	頂禮恭敬供養。聽聞正法如法修行。迴向一	頂 禮 恭敬供養 聽聞正法 如 法 修 行 迴 向 一 
T32n1667_002:0590a23	切智故。三信法有大利益。謂常樂修行諸波	切 智 故 三 信 法 有 大 利 益 謂 常 樂 修 行 諸 波 
T32n1667_002:0590a24	羅蜜故。四信正行僧。謂常供養諸菩薩眾正	羅 蜜 故 四 信 正 行 僧 謂 常 供 養 諸 菩 薩 眾 正 
T32n1667_002:0590a25	修自利利他行故。修五門行。能成此信。所謂	修 自利利他 行 故 修 五 門 行 能 成 此 信 所 謂 
T32n1667_002:0590a26	施門。戒門。忍門。精進門。止觀門。云何修施	施 門 戒 門 忍 門 精 進 門 止 觀 門 云 何 修 施 
T32n1667_002:0590a27	門。謂若見眾生來從乞求。以己資財隨力施	門 謂 若 見 眾 生 來 從 乞 求 以 己 資 財 隨 力 施 
T32n1667_002:0590a28	與。捨自慳著令其歡喜。若見眾生危難逼迫。	與 捨 自 慳 著 令其歡喜 若 見 眾 生 危 難 逼 迫 
T32n1667_002:0590a29	方便救濟令無怖畏。若有眾生而來求法。以	方 便 救 濟 令 無 怖 畏 若 有 眾 生 而 來 求 法 以 
T32n1667_002:0590b01	己所解隨宜為說。修行如是三種施時。不為	己 所 解 隨 宜 為 說 修 行 如 是 三 種 施 時 不 為 
T32n1667_002:0590b02	名聞不求利養。亦不貪著世間果報。但念自	名 聞 不 求 利 養 亦 不 貪 著 世間果報 但 念 自 
T32n1667_002:0590b03	他利益安樂。迴向阿耨多羅三藐三菩提。	他 利益安樂 迴 向 阿耨多羅三藐三菩提 
T32n1667_002:0590b04	云何修戒門。所謂在家菩薩當離殺生偷盜	云 何 修 戒 門 所 謂 在 家 菩 薩 當 離 殺 生 偷 盜 
T32n1667_002:0590b05	邪婬妄言兩舌惡口綺語慳貪瞋嫉諂誑邪	邪 婬 妄 言 兩 舌 惡 口 綺 語 慳 貪 瞋 嫉 諂 誑 邪 
T32n1667_002:0590b06	見。若出家者為欲折伏諸煩惱故。應離憒閙	見 若 出 家 者 為 欲 折 伏 諸 煩 惱 故 應 離 憒 閙 
T32n1667_002:0590b07	常依寂靜。修習止足頭陀等行。乃至小罪心	常 依 寂 靜 修 習 止 足 頭 陀 等 行 乃 至 小 罪 心 
T32n1667_002:0590b08	生大怖慚愧悔責。護持如來所制禁戒。不令	生 大 怖 慚 愧 悔 責 護 持 如 來 所 制 禁 戒 不 令 
T32n1667_002:0590b09	見者有所譏嫌。能使眾生捨惡修善云何修	見 者 有 所 譏 嫌 能 使 眾 生 捨 惡 修 善 云 何 修 
T32n1667_002:0590b10	忍門。所謂見惡不嫌遭苦不動。常樂觀察甚	忍 門 所 謂 見 惡 不 嫌 遭 苦 不 動 常 樂 觀 察 甚 
T32n1667_002:0590b11	深句義。	深 句 義 
T32n1667_002:0590b12	云何修精進門。所謂修諸善行心不懈退。當	云 何 修 精 進 門 所 謂 修諸善行 心 不 懈 退 當 
T32n1667_002:0590b13	念過去無數劫來。為求世間貪欲境界。虛受	念 過 去 無 數 劫 來 為 求 世 間 貪 欲 境 界 虛 受 
T32n1667_002:0590b14	一切身心大苦。畢竟無有少分滋味。為令未	一 切 身 心 大 苦 畢 竟 無 有 少 分 滋 味 為 令 未 
T32n1667_002:0590b15	來遠離此苦。應勤精進不生懈怠。大悲利益	來 遠 離 此 苦 應 勤 精 進 不 生 懈 怠 大 悲 利 益 
T32n1667_002:0590b16	一切眾生。其初學菩薩雖修行信心。以先世	一 切 眾 生 其 初 學 菩 薩 雖 修 行 信 心 以 先 世 
T32n1667_002:0590b17	來多有重罪惡業障故。或為魔邪所惱。或為	來 多 有 重 罪 惡 業 障 故 或 為 魔 邪 所 惱 或 為 
T32n1667_002:0590b18	世務所纏。或為種種病緣之所逼迫。如是等	世 務 所 纏 或 為 種 種 病 緣 之 所 逼 迫 如 是 等 
T32n1667_002:0590b19	事為難非一。令其行人廢修善品。是故宜應	事 為 難 非 一 令 其 行 人 廢 修 善 品 是 故 宜 應 
T32n1667_002:0590b20	勇猛精進。晝夜六時禮拜諸佛。供養讚歎懺	勇猛精進 晝 夜 六 時 禮 拜 諸 佛 供 養 讚 歎 懺 
T32n1667_002:0590b21	悔勸請。隨喜迴向無上菩提。發大誓願無有	悔 勸 請 隨 喜 迴 向 無上菩提 發 大 誓 願 無 有 
T32n1667_002:0590b22	休息。令惡障銷滅善根增長。云何修止觀門。	休 息 令 惡 障 銷 滅 善 根 增 長 云 何 修 止 觀 門 
T32n1667_002:0590b23	謂息滅一切戲論境界是止義。明見因果生	謂 息 滅 一 切 戲 論 境 界 是 止 義 明 見 因 果 生 
T32n1667_002:0590b24	滅之相是觀義。初各別修漸次增長。至于成	滅 之 相 是 觀 義 初 各 別 修 漸 次 增 長 至 于 成 
T32n1667_002:0590b25	就任運雙行。其修止者。住寂靜處結加趺坐	就 任 運 雙 行 其 修 止 者 住 寂 靜 處 結加趺坐 
T32n1667_002:0590b26	端身正意。不依氣息。不依形色。不依虛空。不	端 身 正 意 不 依 氣 息 不 依 形 色 不 依 虛 空 不 
T32n1667_002:0590b27	依地水火風。乃至不依見聞覺知。一切分別	依 地水火風 乃 至 不 依 見聞覺知 一 切 分 別 
T32n1667_002:0590b28	想念皆除。亦遣除想以一切法不生不滅皆無	想 念 皆 除 亦 遣 除 想 以 一 切 法 不生不滅 皆 無 
T32n1667_002:0590b29	相故。前心依境次捨於境。後念依心復捨於	相 故 前 心 依 境 次 捨 於 境 後 念 依 心 復 捨 於 
T32n1667_002:0590c01	心。以心馳外境攝住內心。後復起心不取心	心 以 心 馳 外 境 攝 住 內 心 後 復 起 心 不 取 心 
T32n1667_002:0590c02	相。以離真如不可得故。行住坐臥於一切時	相 以 離 真 如 不 可 得 故 行住坐臥 於一切時 
T32n1667_002:0590c03	如是修行恒不斷絕。漸次得入真如三昧。究	如 是 修 行 恒 不 斷 絕 漸 次 得 入 真 如 三 昧 究 
T32n1667_002:0590c04	竟折伏一切煩惱。信心增長速成不退。若心	竟 折 伏 一切煩惱 信 心 增 長 速 成 不 退 若 心 
T32n1667_002:0590c05	懷疑惑誹謗不信。業障所纏我慢懈怠。如是	懷 疑 惑 誹 謗 不 信 業 障 所 纏 我 慢 懈 怠 如 是 
T32n1667_002:0590c06	等人所不能入。	等 人 所 不 能 入 
T32n1667_002:0590c07	復次依此三昧證法界相。知一切如來法身	復 次 依 此 三 昧 證 法 界 相 知 一 切 如來法身 
T32n1667_002:0590c08	與一切眾生身平等無二皆是一相。是故說	與 一 切 眾 生 身 平 等 無 二 皆 是 一 相 是 故 說 
T32n1667_002:0590c09	名一相三昧。若修習此三昧。能生無量三昧。	名 一 相 三 昧 若 修 習 此 三 昧 能 生 無量三昧 
T32n1667_002:0590c10	以真如是一切三昧根本處故。或有眾生善	以 真 如是一切 三 昧 根 本 處 故 或 有 眾 生 善 
T32n1667_002:0590c11	根微少。為諸魔外道鬼神惑亂。或現惡形以	根 微 少 為 諸 魔 外 道 鬼 神 惑 亂 或 現 惡 形 以 
T32n1667_002:0590c12	怖其心。或示美色以迷其意。或現天形或菩	怖 其 心 或 示 美 色 以 迷 其 意 或 現 天 形 或 菩 
T32n1667_002:0590c13	薩形。乃至佛形相好莊嚴。或說總持或說諸	薩 形 乃 至 佛 形 相好莊嚴 或 說 總 持 或 說 諸 
T32n1667_002:0590c14	度。或復演說諸解脫門。無怨無親無因無果。	度 或 復 演 說 諸 解 脫 門 無 怨 無 親 無 因 無 果 
T32n1667_002:0590c15	一切諸法畢竟空寂本性涅槃。或復令知過	一切諸法 畢 竟 空 寂 本 性 涅 槃 或 復 令 知 過 
T32n1667_002:0590c16	去未來及他心事。辯才演說無滯無斷。使其	去 未 來 及 他 心 事 辯 才 演 說 無 滯 無 斷 使 其 
T32n1667_002:0590c17	貪著名譽利養。或數瞋數喜。或多悲多愛。或	貪 著 名 譽 利 養 或 數 瞋 數 喜 或 多 悲 多 愛 或 
T32n1667_002:0590c18	恒樂昏寐。或久不睡眠。或身嬰疹疾。或性不	恒 樂 昏 寐 或 久 不 睡 眠 或 身 嬰 疹 疾 或 性 不 
T32n1667_002:0590c19	勤策。或卒起精進即便休廢。或情多疑惑不	勤 策 或 卒 起 精 進 即 便 休 廢 或 情 多 疑 惑 不 
T32n1667_002:0590c20	生信受。或捨本勝行更修雜業。愛著世事溺	生 信 受 或 捨 本 勝 行 更 修 雜 業 愛 著 世 事 溺 
T32n1667_002:0590c21	情從好。或令證得外道諸定。一日二日乃至	情 從 好 或 令 證 得 外 道 諸 定 一 日 二 日 乃 至 
T32n1667_002:0590c22	七日。住於定中得好飲食。身心適悅不饑不	七 日 住 於 定 中 得 好 飲 食 身 心 適 悅 不 饑 不 
T32n1667_002:0590c23	渴。或復勸令受女等色。或令其飲食乍少乍	渴 或 復 勸 令 受 女 等 色 或 令 其 飲 食 乍 少 乍 
T32n1667_002:0590c24	多。或使其形容或好或醜。若為諸見煩惱所	多 或 使 其 形 容 或 好 或 醜 若 為 諸 見 煩 惱 所 
T32n1667_002:0590c25	亂。即便退失往昔善根。是故宜應審諦觀察。	亂 即 便 退 失 往 昔 善 根 是 故 宜 應 審諦觀察 
T32n1667_002:0590c26	當作是念。此皆以我善根微薄業障厚重。為	當作是念 此 皆 以 我 善 根 微 薄 業 障 厚 重 為 
T32n1667_002:0590c27	魔鬼等之所迷惑。如是知已。念彼一切皆唯	魔 鬼 等 之 所 迷 惑 如 是 知 已 念 彼 一 切 皆 唯 
T32n1667_002:0590c28	是心。如是思惟剎那即滅。遠離諸相入真三	是 心 如 是 思 惟 剎 那 即 滅 遠 離 諸 相 入 真 三 
T32n1667_002:0590c29	昧。心相既離真相亦盡。從於定起諸見煩惱	昧 心 相 既 離 真 相 亦 盡 從 於 定 起 諸 見 煩 惱 
T32n1667_002:0591a01	皆不現行。以三昧力壞其種故。殊勝善品隨	皆 不 現 行 以 三 昧 力 壞 其 種 故 殊 勝 善 品 隨 
T32n1667_002:0591a02	順相續。一切障難悉皆遠離。起大精進恒無	順 相 續 一 切 障 難 悉 皆 遠 離 起 大 精 進 恒 無 
T32n1667_002:0591a03	斷絕。若不修行此三昧者。無有得入如來種	斷 絕 若 不 修 行 此 三 昧 者 無 有 得 入 如 來 種 
T32n1667_002:0591a04	性。以餘三昧皆是有相。與外道共。不得值遇	性 以 餘 三 昧 皆 是 有 相 與 外 道 共 不 得 值 遇 
T32n1667_002:0591a05	佛菩薩故。是故菩薩於此三昧當勤修習。令	佛 菩 薩 故 是 故 菩 薩 於 此 三 昧 當 勤 修 習 令 
T32n1667_002:0591a06	成就究竟。修此三昧。現身即得十種利益。一	成 就 究 竟 修 此 三 昧 現 身 即 得 十 種 利 益 一 
T32n1667_002:0591a07	者常為十方諸佛菩薩之所護念。二者不為	者 常 為 十方諸佛 菩 薩 之 所 護 念 二 者 不 為 
T32n1667_002:0591a08	一切諸魔惡鬼之所惱亂。三者不為一切邪	一 切 諸 魔 惡 鬼 之 所 惱 亂 三 者 不 為 一 切 邪 
T32n1667_002:0591a09	道所惑。四者令誹謗深法重罪業障皆悉微	道 所 惑 四 者 令 誹 謗 深 法 重 罪 業 障 皆 悉 微 
T32n1667_002:0591a10	薄。五者滅一切疑諸惡覺觀。六者於如來境	薄 五 者 滅 一 切 疑 諸 惡 覺 觀 六 者 於 如 來 境 
T32n1667_002:0591a11	界信得增長。七者遠離憂悔於生死中勇猛	界 信 得 增 長 七 者 遠 離 憂 悔 於 生 死 中 勇 猛 
T32n1667_002:0591a12	不怯。八者遠離憍慢柔和忍辱常為一切世	不 怯 八 者 遠 離 憍 慢 柔 和 忍 辱 常 為 一 切 世 
T32n1667_002:0591a13	間所敬。九者設不住定於一切時一切境中	間 所 敬 九 者 設 不 住 定 於一切時 一 切 境 中 
T32n1667_002:0591a14	煩惱種薄終不現起。十者若住於定不為一	煩 惱 種 薄 終 不 現 起 十 者 若 住 於 定 不 為 一 
T32n1667_002:0591a15	切音聲等緣之所動亂。	切 音 聲 等 緣 之 所 動 亂 
T32n1667_002:0591a16	復次若唯修止。心則沈沒或生懈怠。不樂眾	復 次 若 唯 修 止 心 則 沈 沒 或 生 懈 怠 不 樂 眾 
T32n1667_002:0591a17	善遠離大悲。是故宜應兼修於觀。云何修耶。	善 遠 離 大 悲 是 故 宜 應 兼 修 於 觀 云 何 修 耶 
T32n1667_002:0591a18	謂當觀世間一切諸法生滅不停。以無常故	謂 當 觀 世 間 一切諸法 生 滅 不 停 以 無 常 故 
T32n1667_002:0591a19	苦。苦故無我。應觀過去法如夢。現在法如電。	苦 苦 故 無 我 應 觀 過 去 法 如 夢 現 在 法 如 電 
T32n1667_002:0591a20	未來法如雲。忽爾而起。應觀有身悉皆不淨。	未 來 法 如 雲 忽 爾 而 起 應 觀 有 身 悉 皆 不 淨 
T32n1667_002:0591a21	諸蟲穢污煩惱和雜。觀諸凡愚所見諸法。於	諸 蟲 穢 污 煩 惱 和 雜 觀 諸 凡 愚 所 見 諸 法 於 
T32n1667_002:0591a22	無物中妄計為有。觀察一切從緣生法。皆如	無 物 中 妄 計 為 有 觀 察 一 切 從 緣 生 法 皆 如 
T32n1667_002:0591a23	幻等畢竟無實。觀第一義諦非心所行。不可	幻 等 畢 竟 無 實 觀 第一義諦 非 心 所 行 不 可 
T32n1667_002:0591a24	譬喻不可言說。觀一切眾生。從無始來皆因	譬 喻 不可言說 觀 一 切 眾 生 從無始來 皆 因 
T32n1667_002:0591a25	無明熏習力故。受於無量身心大苦。現在未	無 明 熏 習 力 故 受 於 無 量 身 心 大 苦 現 在 未 
T32n1667_002:0591a26	來亦復如是無邊無限難出難度。常在其中	來 亦復如是 無 邊 無 限 難 出 難 度 常 在 其 中 
T32n1667_002:0591a27	不能覺察。甚為可愍。如是觀已生決定智起	不 能 覺 察 甚 為 可 愍 如 是 觀 已 生 決 定 智 起 
T32n1667_002:0591a28	廣大悲。發大勇猛立大誓願。願令我心離諸	廣 大 悲 發 大 勇 猛 立 大 誓 願 願 令 我 心 離 諸 
T32n1667_002:0591a29	顛倒斷諸分別。親近一切諸佛菩薩。頂禮供	顛 倒 斷 諸 分 別 親 近 一切諸佛 菩 薩 頂 禮 供 
T32n1667_002:0591b01	養恭敬讚歎。聽聞正法如說修行。盡未來際	養 恭 敬 讚 歎 聽聞正法 如說修行 盡未來際 
T32n1667_002:0591b02	無有休息。以無量方便拔濟一切苦海眾生。	無有休息 以 無量方便 拔 濟 一 切 苦 海 眾 生 
T32n1667_002:0591b03	令住涅槃第一義樂。作是願已於一切時。隨	令 住 涅 槃 第 一 義 樂 作 是 願 已 於一切時 隨 
T32n1667_002:0591b04	己堪能修行自利利他之行。行住坐臥常勤	己 堪 能 修 行 自利利他 之 行 行住坐臥 常 勤 
T32n1667_002:0591b05	觀察應作不應作。是名修觀。	觀 察 應 作 不 應 作 是 名 修 觀 
T32n1667_002:0591b06	復次若唯修觀則心不止息。多生疑惑不隨	復 次 若 唯 修 觀 則 心 不 止 息 多 生 疑 惑 不 隨 
T32n1667_002:0591b07	順第一義諦。不出生無分別智。是故止觀應	順 第一義諦 不 出 生 無分別智 是 故 止 觀 應 
T32n1667_002:0591b08	並修行。謂雖念一切法皆無自性不生不滅	並 修 行 謂 雖 念 一 切 法 皆 無 自 性 不生不滅 
T32n1667_002:0591b09	本來寂滅自性涅槃。而亦即見因緣和合善	本 來 寂 滅 自性涅槃 而 亦 即 見 因緣和合 善 
T32n1667_002:0591b10	惡業報不失不壞。雖念因緣善惡業報。而亦	惡 業 報 不 失 不 壞 雖 念 因 緣 善 惡 業 報 而 亦 
T32n1667_002:0591b11	即見一切諸法無生無性乃至涅槃。然修行	即 見 一切諸法 無 生 無 性 乃至涅槃 然 修 行 
T32n1667_002:0591b12	止者。對治凡夫樂著生死。亦治二乘執著生	止 者 對 治 凡 夫 樂 著 生 死 亦 治 二 乘 執 著 生 
T32n1667_002:0591b13	死而生怖畏。修行觀者。對治凡夫不修善根。	死 而 生 怖 畏 修 行 觀 者 對 治 凡 夫 不 修 善 根 
T32n1667_002:0591b14	亦治二乘不起大悲狹劣心過。是故止觀互	亦 治 二 乘 不 起 大 悲 狹 劣 心 過 是 故 止 觀 互 
T32n1667_002:0591b15	相助成不相捨離。若止觀不具。必不能得無	相 助 成 不相捨離 若 止 觀 不 具 必 不 能 得 無 
T32n1667_002:0591b16	上菩提。	上 菩 提 
T32n1667_002:0591b17	復次初學菩薩住此娑婆世界。或值寒熱風	復 次 初 學 菩 薩 住 此 娑婆世界 或 值 寒 熱 風 
T32n1667_002:0591b18	雨不時飢饉等苦。或見不善可畏眾生。三毒	雨 不 時 飢 饉 等 苦 或 見 不 善 可 畏 眾 生 三 毒 
T32n1667_002:0591b19	所纏邪見顛倒。棄背善道習行惡法。菩薩在	所 纏 邪 見 顛 倒 棄 背 善 道 習 行 惡 法 菩 薩 在 
T32n1667_002:0591b20	中心生怯弱。恐不可值遇諸佛菩薩。恐不能	中 心 生 怯 弱 恐 不 可 值 遇 諸佛菩薩 恐 不 能 
T32n1667_002:0591b21	成就清淨信心。生疑欲退者應作是念。十方	成 就 清 淨 信 心 生 疑 欲 退 者 應 作 是 念 十 方 
T32n1667_002:0591b22	所有諸佛菩薩。皆得大神通無有障礙。能以	所 有 諸佛菩薩 皆 得 大 神 通 無有障礙 能 以 
T32n1667_002:0591b23	種種善巧方便。救拔一切險厄眾生。作是念	種 種 善巧方便 救 拔 一 切 險 厄 眾 生 作 是 念 
T32n1667_002:0591b24	已發大誓願。一心專念佛及菩薩。以生如是	已 發 大 誓 願 一 心 專 念 佛 及 菩 薩 以 生 如 是 
T32n1667_002:0591b25	決定心故。於此命終必得往生餘佛剎中。見	決 定 心 故 於 此 命 終 必 得 往 生 餘 佛 剎 中 見 
T32n1667_002:0591b26	佛菩薩信心成就永離惡趣。如經中說。若善	佛 菩 薩 信 心 成 就 永 離 惡 趣 如 經 中 說 若 善 
T32n1667_002:0591b27	男子善女人。專念西方極樂世界阿彌陀佛。	男 子 善 女 人 專 念 西方極樂 世 界 阿 彌 陀 佛 
T32n1667_002:0591b28	以諸善根迴向願生決定得生。常見彼佛信	以 諸 善 根 迴 向 願 生 決 定 得 生 常 見 彼 佛 信 
T32n1667_002:0591b29	心增長永不退轉。於彼聞法觀佛法身。漸次	心 增 長 永 不 退 轉 於 彼 聞 法 觀 佛 法 身 漸 次 
T32n1667_002:0591c01	修行得入正位。	修 行 得 入 正 位 
T32n1667_002:0591c02	云何利益分。如是大乘祕密句義今已略說。	云 何 利 益 分 如 是 大 乘 祕 密 句 義 今 已 略 說 
T32n1667_002:0591c03	若有眾生。欲於如來甚深境界廣大法中生	若 有 眾 生 欲 於 如 來 甚 深 境 界 廣 大 法 中 生 
T32n1667_002:0591c04	淨信覺解心。入大乘道無有障礙。於此略論	淨 信 覺 解 心 入 大 乘 道 無有障礙 於 此 略 論 
T32n1667_002:0591c05	當勤聽受思惟修習。當知是人決定速成一	當 勤 聽受思惟 修 習 當 知 是 人 決 定 速 成 一 
T32n1667_002:0591c06	切種智。若聞此法不生驚怖。當知此人定紹	切 種 智 若 聞 此 法 不 生 驚 怖 當 知 此 人 定 紹 
T32n1667_002:0591c07	佛種速得授記。假使有人。化三千大千世界	佛 種 速 得 授 記 假 使 有 人 化 三千大千世界 
T32n1667_002:0591c08	眾生。令住十善道。不如於須臾頃正思此法	眾 生 令 住 十 善 道 不 如 於 須 臾 頃 正 思 此 法 
T32n1667_002:0591c09	過前功德無量無邊。若一日一夜如說修行。	過 前 功 德 無量無邊 若 一 日 一 夜 如說修行 
T32n1667_002:0591c10	所生功德無量無邊不可稱說。假令十方一	所 生 功 德 無量無邊 不 可 稱 說 假 令 十 方 一 
T32n1667_002:0591c11	切諸佛。各於無量阿僧祇劫。說不能盡。以真	切 諸 佛 各 於 無量阿僧祇劫 說 不 能 盡 以 真 
T32n1667_002:0591c12	如功德無邊際故。修行功德亦復無邊。若於	如 功 德 無 邊 際 故 修 行 功 德 亦 復 無 邊 若 於 
T32n1667_002:0591c13	此法生誹謗者。獲無量罪。於阿僧祇劫受大	此 法 生 誹 謗 者 獲 無 量 罪 於 阿僧祇劫 受 大 
T32n1667_002:0591c14	苦惱。是故於此應決定信。勿生誹謗自害害	苦 惱 是 故 於 此 應 決 定 信 勿 生 誹 謗 自 害 害 
T32n1667_002:0591c15	他斷三寶種。一切諸佛依此修行成無上智。	他 斷 三 寶 種 一切諸佛 依 此 修 行 成 無 上 智 
T32n1667_002:0591c16	一切菩薩由此證得如來法身。過去菩薩依	一切菩薩 由 此 證 得 如來法身 過 去 菩 薩 依 
T32n1667_002:0591c17	此得成大乘淨信。現在今成未來當成。是故	此 得 成 大 乘 淨 信 現 在 今 成 未 來 當 成 是 故 
T32n1667_002:0591c18	欲成自利利他殊勝行者。當於此論勤加修	欲 成 自利利他 殊 勝 行 者 當 於 此 論 勤 加 修 
T32n1667_002:0591c19	學。	學 
T32n1667_002:0591c20	　我今已解釋　　甚深廣大義	 我 今 已 解 釋 甚 深 廣 大 義 
T32n1667_002:0591c21	　功德施群生　　令見真如法	 功 德 施 群 生 令 見 真 如 法 
T32n1667_002:0591c22	大乘起信論卷下	大 乘 起 信 論 卷 下 
