T32n1667_001:0587c09	自性。不見有餘法而可更求。是故滿足過於	自 性 不 見 有 餘 法 而 可 更 求 是 故 滿 足 過 於 
T32n1667_001:0587c10	恒沙非異非一不可思議諸佛之法無有斷	恒 沙 非 異 非 一 不可思議 諸 佛 之 法 無 有 斷 
T32n1667_001:0587c11	絕。故說真如名如來藏。亦復名為如來法身。	絕 故 說 真 如 名 如 來 藏 亦 復 名 為 如來法身 
T32n1667_001:0587c12	復次真如用者。謂一切諸佛在因地時發大	復 次 真 如 用 者 謂 一切諸佛 在 因 地 時 發 大 
T32n1667_001:0587c13	慈悲。修行諸度四攝等行。觀物同已普皆救	慈 悲 修 行 諸 度 四 攝 等 行 觀 物 同 已 普 皆 救 
T32n1667_001:0587c14	脫。盡未來際不限劫數。如實了知自他平等。	脫 盡未來際 不 限 劫 數 如實了知 自他平等 
T32n1667_001:0587c15	而亦不取眾生之相。以如是大方便智。滅無	而 亦 不 取 眾 生 之 相 以 如 是 大 方 便 智 滅 無 
T32n1667_001:0587c16	始無明證本法身。任運起於不思議業。種種	始 無 明 證 本 法 身 任 運 起 於 不 思 議 業 種 種 
T32n1667_001:0587c17	自在差別作用。周遍法界與真如等。而亦無	自 在 差 別 作 用 周 遍 法 界 與 真 如 等 而 亦 無 
T32n1667_001:0587c18	有用相可得。何以故。一切如來唯是法身。第	有 用 相 可 得 何 以 故 一 切 如 來 唯 是 法 身 第 
T32n1667_001:0587c19	一義諦無有世諦境界作用。但隨眾生見聞	一 義 諦 無 有 世 諦 境 界 作 用 但 隨 眾 生 見 聞 
T32n1667_001:0587c20	等故。而有種種作用不同。	等 故 而 有 種 種 作 用 不 同 
T32n1667_001:0587c21	此用有二。一依分別事識。謂凡夫二乘心所	此 用 有 二 一 依 分別事識 謂 凡 夫 二 乘 心 所 
T32n1667_001:0587c22	見者是名化身。此人不知轉識影現。見從外	見 者 是 名 化 身 此 人 不 知 轉 識 影 現 見 從 外 
T32n1667_001:0587c23	來取色分限。然佛化身無有限量。二依業識。	來 取 色 分 限 然 佛 化 身 無 有 限 量 二 依 業 識 
T32n1667_001:0587c24	謂諸菩薩從初發心乃至菩薩究竟地心所見	謂 諸 菩 薩 從 初 發 心 乃 至 菩 薩 究 竟 地 心 所 見 
T32n1667_001:0587c25	者名受用身。身有無量色。色有無量相。相有	者 名 受 用 身 身 有 無 量 色 色 有 無 量 相 相 有 
T32n1667_001:0587c26	無量好。所住依果亦具無量功德莊嚴。隨所	無 量 好 所 住 依 果 亦 具 無量功德 莊 嚴 隨 所 
T32n1667_001:0587c27	應見無量無邊無際無斷。非於心外如是而	應 見 無量無邊 無 際 無 斷 非 於 心 外 如 是 而 
T32n1667_001:0587c28	見。此諸功德皆因波羅蜜等無漏行熏及不	見 此 諸 功 德 皆 因 波 羅 蜜 等 無 漏 行 熏 及 不 
T32n1667_001:0587c29	思議熏之所成就。具無邊喜樂功德相故亦	思 議 熏 之 所 成 就 具 無 邊 喜 樂 功 德 相 故 亦 
T32n1667_001:0588a01	名報身。又凡夫等所見是其麁用。隨六趣異	名 報 身 又 凡 夫 等 所 見 是 其 麁 用 隨 六 趣 異 
T32n1667_001:0588a02	種種差別。無有無邊功德樂相名為化身。初	種種差別 無 有 無 邊 功 德 樂 相 名 為 化 身 初 
T32n1667_001:0588a03	行菩薩見中品用。以深信真如故得少分見。	行 菩 薩 見 中 品 用 以 深 信 真 如 故 得 少 分 見 
T32n1667_001:0588a04	知如來身無去無來無有斷絕。唯心影現不	知 如 來 身 無 去 無 來 無 有 斷 絕 唯 心 影 現 不 
T32n1667_001:0588a05	離真如。然此菩薩猶未能離微細分別。以未	離 真 如 然 此 菩 薩 猶 未 能 離 微 細 分 別 以 未 
T32n1667_001:0588a06	入法身位故。淨心菩薩見微細用。如是轉勝	入 法 身 位 故 淨 心 菩 薩 見 微 細 用 如 是 轉 勝 
T32n1667_001:0588a07	乃至菩薩究竟地中見之方盡。此微細用是	乃 至 菩 薩 究 竟 地 中 見 之 方 盡 此 微 細 用 是 
T32n1667_001:0588a08	受用身。以有業識見受用身。若離業識則無	受 用 身 以 有 業 識 見 受 用 身 若 離 業 識 則 無 
T32n1667_001:0588a09	可見。一切如來皆是法身。無有彼此差別色	可 見 一 切 如 來 皆 是 法 身 無 有 彼 此 差 別 色 
T32n1667_001:0588a10	相。互相見故。問若佛法身無有種種差別色	相 互 相 見 故 問 若 佛 法 身 無 有 種種差別 色 
T32n1667_001:0588a11	相。云何能現種種諸色。	相 云 何 能 現 種 種 諸 色 
T32n1667_001:0588a12	答以法身是色實體故。能現種種色。謂從本	答 以 法 身 是 色 實 體 故 能 現 種 種 色 謂 從 本 
T32n1667_001:0588a13	已來色心無二。以色本性即心自性。說名智	已 來 色 心 無 二 以 色 本 性 即 心 自 性 說 名 智 
T32n1667_001:0588a14	身。以心本性即色自性。說名法身。依於法身。	身 以 心 本 性 即 色 自 性 說 名 法 身 依 於 法 身 
T32n1667_001:0588a15	一切如來所現色身。遍一切處無有間斷。十	一 切 如 來 所 現 色 身 遍 一 切 處 無有間斷 十 
T32n1667_001:0588a16	方菩薩隨所堪任隨所願樂。見無量受用身	方 菩 薩 隨 所 堪 任 隨 所 願 樂 見 無 量 受 用 身 
T32n1667_001:0588a17	無量莊嚴土各各差別。不相障礙無有斷絕。	無 量 莊 嚴 土 各 各 差 別 不相障礙 無 有 斷 絕 
T32n1667_001:0588a18	此所現色身一切眾生心意識不能思量。以	此 所 現 色 身 一 切 眾 生 心 意 識 不 能 思 量 以 
T32n1667_001:0588a19	是真如自在甚深用故。◎	是 真 如 自 在 甚 深 用 故 
T32n1667_001:0588a20	◎復次為令眾生從心生滅門入真如門故。	 復 次 為 令 眾 生 從 心 生 滅 門 入 真 如 門 故 
T32n1667_001:0588a21	令觀色等相皆不成就。云何不成就。謂分析	令 觀 色 等 相 皆 不 成 就 云 何 不 成 就 謂 分 析 
T32n1667_001:0588a22	麁色漸至微塵。復以方分析此微塵。是故若	麁 色 漸 至 微 塵 復 以 方 分 析 此 微 塵 是 故 若 
T32n1667_001:0588a23	麁若細一切諸色。唯是妄心分別影像實無	麁 若 細 一 切 諸 色 唯 是 妄 心 分 別 影 像 實 無 
T32n1667_001:0588a24	所有。推求餘蘊漸至剎那。求此剎那相。別非	所 有 推 求 餘 蘊 漸 至 剎 那 求 此 剎 那 相 別 非 
T32n1667_001:0588a25	一無為之法。亦復如是。離於法界終不可得。	一 無 為 之 法 亦復如是 離 於 法 界 終 不 可 得 
T32n1667_001:0588a26	如是十方一切諸法應知悉然。猶如迷人謂	如 是 十 方 一切諸法 應 知 悉 然 猶 如 迷 人 謂 
T32n1667_001:0588a27	東為西方實不轉。眾生亦爾。無明迷故謂心	東 為 西 方 實 不 轉 眾 生 亦 爾 無 明 迷 故 謂 心 
T32n1667_001:0588a28	為動而實不動。若知動心即不生滅。即得入	為 動 而 實 不 動 若 知 動 心 即 不 生 滅 即 得 入 
T32n1667_001:0588a29	於真如之門。◎	於 真 如 之 門 
T32n1667_001:0588b01	大乘起信論卷上	大 乘 起 信 論 卷 上 
T32n1667_002:0588b04	大乘起信論卷下	大 乘 起 信 論 卷 下 
T32n1667_002:0588b06	馬鳴菩薩造	馬 鳴 菩 薩 造 
T32n1667_002:0588b07	大周于闐三藏實叉難陀	大 周 于 闐 三 藏 實 叉 難 陀 
T32n1667_002:0588b08	奉　制譯	奉 制 譯 
T32n1667_002:0588b09	◎對治邪執者。一切邪執莫不皆依我見而	 對 治 邪 執 者 一 切 邪 執 莫 不 皆 依 我 見 而 
T32n1667_002:0588b10	起。若離我見則無邪執。我見有二種。一人我	起 若 離 我 見 則 無 邪 執 我 見 有 二 種 一 人 我 
T32n1667_002:0588b11	見。二法我見。人我見者。依諸凡夫說有五種。	見 二 法 我 見 人 我 見 者 依 諸 凡 夫 說 有 五 種 
T32n1667_002:0588b12	一者如經中說。如來法身究竟寂滅猶如虛	一 者 如 經 中 說 如來法身 究竟寂滅 猶 如 虛 
T32n1667_002:0588b13	空。凡愚聞之不解其義。則執如來性同於虛	空 凡 愚 聞 之 不 解 其 義 則 執 如 來 性 同 於 虛 
T32n1667_002:0588b14	空常恒遍有。為除彼執。明虛空相唯是分別	空 常 恒 遍 有 為 除 彼 執 明 虛 空 相 唯 是 分 別 
T32n1667_002:0588b15	實不可得。有見有對待於諸色。以心分別說	實 不 可 得 有 見 有 對 待 於 諸 色 以 心 分 別 說 
T32n1667_002:0588b16	名虛空。色既唯是妄心分別。當知虛空亦無	名 虛 空 色 既 唯 是 妄 心 分 別 當 知 虛 空 亦 無 
T32n1667_002:0588b17	有體。一切境相唯是妄心之所分別。若離妄	有 體 一 切 境 相 唯 是 妄 心 之 所 分 別 若 離 妄 
T32n1667_002:0588b18	心即境界相滅。唯真如心無所不遍。此是如	心 即 境 界 相 滅 唯 真 如 心 無 所 不 遍 此 是 如 
T32n1667_002:0588b19	來自性如虛空義。非謂如空是常是有。二者	來 自 性 如 虛 空 義 非 謂 如 空 是 常 是 有 二 者 
T32n1667_002:0588b20	如經中說。一切世法皆畢竟空。乃至涅槃真	如 經 中 說 一 切 世 法 皆 畢 竟 空 乃至涅槃 真 
T32n1667_002:0588b21	如法亦畢竟空。本性如是離一切相。凡愚聞	如 法 亦 畢 竟 空 本 性 如 是 離一切相 凡 愚 聞 
T32n1667_002:0588b22	之不解其義。即執涅槃真如法唯空無物。為	之 不 解 其 義 即 執 涅 槃 真 如 法 唯 空 無 物 為 
T32n1667_002:0588b23	除彼執明真如法身自體不空。具足無量性	除 彼 執 明 真 如 法 身 自 體 不 空 具 足 無 量 性 
T32n1667_002:0588b24	功德故。	功 德 故 
T32n1667_002:0588b25	三者如經中說。如來藏具足一切諸性功德	三 者 如 經 中 說 如 來 藏 具 足 一 切 諸 性 功 德 
T32n1667_002:0588b26	不增不減。凡愚聞已不解其義。則執如來藏	不增不減 凡 愚 聞 已 不 解 其 義 則 執 如 來 藏 
T32n1667_002:0588b27	有色心法自相差別。為除此執。明以真如本	有 色 心 法 自 相 差 別 為 除 此 執 明 以 真 如 本 
T32n1667_002:0588b28	無染法差別。立有無邊功德相。非是染相。四	無 染 法 差 別 立 有 無 邊 功 德 相 非 是 染 相 四 
T32n1667_002:0588b29	者如經中說。一切世間諸雜染法。皆依如來	者 如 經 中 說 一切世間 諸 雜 染 法 皆 依 如 來 
T32n1667_002:0588c01	藏起。一切法不異真如。凡愚聞之不解其義。	藏 起 一 切 法 不 異 真 如 凡 愚 聞 之 不 解 其 義 
T32n1667_002:0588c02	則謂如來藏具有一切世間染法。為除此執。	則 謂 如 來 藏 具 有 一切世間 染 法 為 除 此 執 
T32n1667_002:0588c03	明如來藏從本具有過恒沙數清淨功德不異	明 如 來 藏 從 本 具 有 過 恒 沙 數 清 淨 功 德 不 異 
T32n1667_002:0588c04	真如。過恒沙數煩惱染法。唯是妄有本無自	真 如 過 恒 沙 數 煩 惱 染 法 唯 是 妄 有 本 無 自 
T32n1667_002:0588c05	性。從無始來未曾暫與如來藏相應。若如來	性 從無始來 未 曾 暫 與 如 來 藏 相 應 若 如 來 
T32n1667_002:0588c06	藏染法相應。而令證會息妄染者。無有是	藏 染 法 相 應 而 令 證 會 息 妄 染 者 無 有 是 
T32n1667_002:0588c07	處。	處 
T32n1667_002:0588c08	五者如經中說。依如來藏有生死得涅槃。凡	五 者 如 經 中 說 依 如 來 藏 有 生 死 得 涅 槃 凡 
T32n1667_002:0588c09	愚聞之不知其義。則謂依如來藏生死有始。	愚 聞 之 不 知 其 義 則 謂 依 如 來 藏 生 死 有 始 
T32n1667_002:0588c10	以見始故復謂涅槃有其終盡。為除此執。明	以 見 始 故 復 謂 涅 槃 有 其 終 盡 為 除 此 執 明 
T32n1667_002:0588c11	如來藏無有初際。無明依之生死無始。若言	如 來 藏 無 有 初 際 無 明 依 之 生 死 無 始 若 言 
T32n1667_002:0588c12	三界外更有眾生始起者。是外道經中說。非	三 界 外 更 有 眾 生 始 起 者 是 外 道 經 中 說 非 
T32n1667_002:0588c13	是佛教。以如來藏無有後際。證此永斷生死	是 佛 教 以 如 來 藏 無 有 後 際 證 此 永 斷 生 死 
T32n1667_002:0588c14	種子。得於涅槃亦無後際。依人我見四種見	種 子 得 於 涅 槃 亦 無 後 際 依 人 我 見 四 種 見 
T32n1667_002:0588c15	生。是故於此安立彼四。	生 是 故 於 此 安 立 彼 四 
T32n1667_002:0588c16	法我見者。以二乘鈍根。世尊。但為說人無我。	法 我 見 者 以 二 乘 鈍 根 世 尊 但 為 說 人 無 我 
T32n1667_002:0588c17	彼人便於五蘊生滅畢竟執著。怖畏生死妄	彼 人 便 於 五 蘊 生 滅 畢 竟 執 著 怖 畏 生 死 妄 
T32n1667_002:0588c18	取涅槃。為除此執。明五蘊法本性不生。不生	取 涅 槃 為 除 此 執 明 五 蘊 法 本 性 不 生 不 生 
T32n1667_002:0588c19	故亦無有滅。不滅故本來涅槃。若究竟離分	故 亦 無 有 滅 不 滅 故 本 來 涅 槃 若 究 竟 離 分 
T32n1667_002:0588c20	別執著。則知一切染法淨法皆相待立。是故	別 執 著 則 知 一 切 染 法 淨 法 皆 相 待 立 是 故 
T32n1667_002:0588c21	當知。一切諸法從本已來。非色非心非智非	當 知 一切諸法 從 本 已 來 非 色 非 心 非 智 非 
T32n1667_002:0588c22	識非無非有。畢竟皆是不可說相。而有言說	識 非 無 非 有 畢 竟 皆 是 不 可 說 相 而 有 言 說 
T32n1667_002:0588c23	示教之者。皆是如來善巧方便。假以言語引	示 教 之 者 皆 是 如 來 善巧方便 假 以 言 語 引 
T32n1667_002:0588c24	導眾生。令捨文字入於真實。若隨言執義增	導 眾 生 令 捨 文 字 入 於 真 實 若 隨 言 執 義 增 
T32n1667_002:0588c25	妄分別。不生實智不得涅槃。	妄 分 別 不 生 實 智 不 得 涅 槃 
T32n1667_002:0588c26	分別修行正道相者。謂一切如來得道正因。	分 別 修 行 正 道 相 者 謂 一 切 如 來 得 道 正 因 
T32n1667_002:0588c27	一切菩薩發心修習。令現前故。略說發心有	一切菩薩 發 心 修 習 令 現 前 故 略 說 發 心 有 
T32n1667_002:0588c28	三種相。一信成就發心。二解行發心。三證發	三 種 相 一 信 成 就 發 心 二 解 行 發 心 三 證 發 
T32n1667_002:0588c29	心。信成就發心者。依何位修何行。得信成就	心 信 成 就 發 心 者 依 何 位 修 何 行 得 信 成 就 
T32n1667_002:0589a01	堪能發心。當知是人依不定聚。以法熏習善	堪 能 發 心 當 知 是 人 依 不 定 聚 以 法 熏 習 善 
T32n1667_002:0589a02	根力故。深信業果行十善道。厭生死苦求無	根 力 故 深 信 業 果 行 十 善 道 厭 生 死 苦 求 無 
T32n1667_002:0589a03	上覺。值遇諸佛及諸菩薩。承事供養修行諸	上 覺 值 遇 諸 佛 及 諸 菩 薩 承事供養 修 行 諸 
T32n1667_002:0589a04	行。經十千劫信乃成就。從是已後。或以諸佛	行 經 十 千 劫 信 乃 成 就 從 是 已 後 或 以 諸 佛 
T32n1667_002:0589a05	菩薩教力。或以大悲。或因正法將欲壞滅。以	菩 薩 教 力 或 以 大 悲 或 因 正 法 將 欲 壞 滅 以 
T32n1667_002:0589a06	護法故而能發心。既發心已入正定聚畢竟	護 法 故 而 能 發 心 既 發 心 已 入正定聚 畢 竟 
T32n1667_002:0589a07	不退。住佛種性勝因相應。或有眾生。久遠已	不 退 住 佛 種 性 勝 因 相 應 或 有 眾 生 久 遠 已 
T32n1667_002:0589a08	來善根微少。煩惱深厚覆其心故。雖值諸佛	來 善 根 微 少 煩 惱 深 厚 覆 其 心 故 雖 值 諸 佛 
T32n1667_002:0589a09	及諸菩薩承事供養。唯種人天受生種子。或	及 諸 菩 薩 承事供養 唯 種 人 天 受 生 種 子 或 
T32n1667_002:0589a10	種二乘菩提種子。或有雖求大菩提道。然根	種 二 乘 菩 提 種 子 或 有 雖 求大菩提 道 然 根 
T32n1667_002:0589a11	不定或進或退。或有值佛及諸菩薩供養承	不 定 或 進 或 退 或 有 值 佛 及 諸 菩 薩 供 養 承 
T32n1667_002:0589a12	事修行諸行。未得滿足十千大劫。中間遇緣	事 修 行 諸 行 未 得 滿 足 十 千 大 劫 中 間 遇 緣 
T32n1667_002:0589a13	而發於心。遇何等緣。所謂或見佛形相。或供	而 發 於 心 遇 何 等 緣 所 謂 或 見 佛 形 相 或 供 
T32n1667_002:0589a14	養眾僧。或二乘所教。或見他發心。此等發心	養 眾 僧 或 二 乘 所 教 或 見 他 發 心 此 等 發 心 
T32n1667_002:0589a15	皆悉未定。若遇惡緣或時退墮二乘地故。	皆 悉 未 定 若 遇 惡 緣 或 時 退 墮 二 乘 地 故 
T32n1667_002:0589a16	復次信成就發心。略說有三。一發正直心。如	復 次 信 成 就 發 心 略 說 有 三 一 發 正 直 心 如 
T32n1667_002:0589a17	理正念真如法故。二發深重心。樂集一切諸	理 正 念 真 如 法 故 二 發 深 重 心 樂 集 一 切 諸 
T32n1667_002:0589a18	善行故。三發大悲心。願拔一切眾生苦故。問	善 行 故 三 發 大 悲 心 願 拔 一 切 眾 生 苦 故 問 
T32n1667_002:0589a19	一切眾生一切諸法皆同一法界。無有二相。	一 切 眾 生 一切諸法 皆 同 一 法 界 無 有 二 相 
T32n1667_002:0589a20	據理但應正念真如。何假復修一切善行救	據 理 但 應 正 念 真 如 何 假 復 修 一 切 善 行 救 
T32n1667_002:0589a21	一切眾生。	一 切 眾 生 
T32n1667_002:0589a22	答不然。如摩尼寶本性明潔在鑛穢中。假使	答 不 然 如 摩 尼 寶 本 性 明 潔 在 鑛 穢 中 假 使 
T32n1667_002:0589a23	有人勤加憶念。而不作方便不施功力。欲求	有 人 勤 加 憶 念 而 不 作 方 便 不 施 功 力 欲 求 
T32n1667_002:0589a24	清淨終不可得。真如之法亦復如是。體雖明	清 淨 終 不 可 得 真 如 之 法 亦復如是 體 雖 明 
T32n1667_002:0589a25	潔具足功德。而被無邊客塵所染。假使有人	潔 具 足 功 德 而 被 無 邊 客 塵 所 染 假 使 有 人 
T32n1667_002:0589a26	勤加憶念。而不作方便不修諸行。欲求清淨	勤 加 憶 念 而 不 作 方 便 不 修 諸 行 欲 求 清 淨 
T32n1667_002:0589a27	終無得理。是故要當集一切善行救一切眾	終 無 得 理 是 故 要 當 集 一 切 善 行 救 一 切 眾 
T32n1667_002:0589a28	生。離彼無邊客塵垢染顯現真法。	生 離 彼 無 邊 客 塵 垢 染 顯 現 真 法 
T32n1667_002:0589a29	彼方便行略有四種。一行根本方便。謂觀一	彼 方 便 行 略 有 四 種 一 行 根 本 方 便 謂 觀 一 
T32n1667_002:0589b01	切法本性無生。離於妄見不住生死。又觀一	切 法 本 性 無 生 離 於 妄 見 不 住 生 死 又 觀 一 
T32n1667_002:0589b02	切法因緣和合業果不失。起於大悲修諸善	切 法 因緣和合 業 果 不 失 起 於 大 悲 修 諸 善 
T32n1667_002:0589b03	行。攝化眾生不住涅槃。以真如離於生死涅	行 攝 化 眾 生 不住涅槃 以 真 如 離於生死 涅 
T32n1667_002:0589b04	槃相故。此行隨順以為根本。是名行根本方	槃 相 故 此 行 隨 順 以 為 根 本 是 名 行 根 本 方 
T32n1667_002:0589b05	便。二能止息方便所謂慚愧及以悔過。此能	便 二 能 止 息 方 便 所 謂 慚 愧 及 以 悔 過 此 能 
T32n1667_002:0589b06	止息一切惡法令不增長。以真如離一切過	止 息 一 切 惡 法 令 不 增 長 以 真 如 離 一 切 過 
T32n1667_002:0589b07	失相故。隨順真如止息諸惡。是名能止息方	失 相 故 隨 順 真 如 止 息 諸 惡 是 名 能 止 息 方 
T32n1667_002:0589b08	便。三生長善根方便。謂於三寶所起愛敬心。	便 三 生 長 善 根 方 便 謂 於 三 寶 所 起 愛 敬 心 
T32n1667_002:0589b09	尊重供養頂禮稱讚。隨喜勸請正信增長。乃	尊 重 供 養 頂 禮 稱 讚 隨 喜 勸 請 正 信 增 長 乃 
T32n1667_002:0589b10	至志求無上菩提。為佛法僧威力所護。業障	至 志 求 無上菩提 為 佛 法 僧 威 力 所 護 業 障 
T32n1667_002:0589b11	清淨善根不退。以真如離一切障具一切功	清 淨 善 根 不 退 以 真 如 離一切障 具 一 切 功 
T32n1667_002:0589b12	德故。隨順真如修行善業。是名生長善根方	德 故 隨 順 真 如 修 行 善 業 是 名 生 長 善 根 方 
T32n1667_002:0589b13	便。四大願平等方便。謂發誓願盡未來際。平	便 四 大 願 平 等 方 便 謂 發 誓 願 盡未來際 平 
T32n1667_002:0589b14	等救拔一切眾生。令其安住無餘涅槃。以知	等 救 拔 一 切 眾 生 令 其 安 住 無餘涅槃 以 知 
T32n1667_002:0589b15	一切法本性無二故。彼此平等故。究竟寂滅	一 切 法 本 性 無 二 故 彼 此 平 等 故 究竟寂滅 
T32n1667_002:0589b16	故。隨順真如此三種相發大誓願。是名大願	故 隨 順 真 如 此 三 種 相 發 大 誓 願 是 名 大 願 
T32n1667_002:0589b17	平等方便。	平 等 方 便 
T32n1667_002:0589b18	菩薩如是發心之時。則得少分見佛法身。能	菩 薩 如 是 發 心 之 時 則 得 少 分 見 佛 法 身 能 
T32n1667_002:0589b19	隨願力現八種事。謂從兜率天宮來下入胎	隨 願 力 現 八 種 事 謂 從 兜率天宮 來 下 入 胎 
T32n1667_002:0589b20	住胎出。胎出家成佛轉法輪般涅槃。然猶未	住 胎 出 胎 出 家 成 佛 轉 法 輪 般 涅 槃 然 猶 未 
T32n1667_002:0589b21	得名為法身。以其過去無量世來有漏之業	得 名 為 法 身 以 其 過 去 無 量 世 來 有 漏 之 業 
T32n1667_002:0589b22	未除斷故。或由惡業受於微苦。願力所持非	未 除 斷 故 或 由 惡 業 受 於 微 苦 願 力 所 持 非 
T32n1667_002:0589b23	久被繫。有經中說。信成就發心菩薩。或有退	久 被 繫 有 經 中 說 信 成 就 發 心 菩 薩 或 有 退 
T32n1667_002:0589b24	墮惡趣中者。此為初學心多懈怠不入正位。	墮 惡 趣 中 者 此 為 初 學 心 多 懈 怠 不 入 正 位 
T32n1667_002:0589b25	以此語之令增勇猛非如實說。	以 此 語 之 令 增 勇 猛 非 如 實 說 
T32n1667_002:0589b26	又此菩薩一發心後。自利利他修諸苦行。心	又 此 菩 薩 一 發 心 後 自利利他 修諸苦行 心 
T32n1667_002:0589b27	無怯弱尚不畏墮二乘之地。況於惡道。若聞	無 怯 弱 尚 不 畏 墮 二 乘 之 地 況 於 惡 道 若 聞 
T32n1667_002:0589b28	無量阿僧祇劫勤修種種難行苦行方始得	無量阿僧祇劫 勤 修 種 種 難行苦行 方 始 得 
T32n1667_002:0589b29	佛。不驚不怖。何況有起二乘之心及墮惡趣。	佛 不驚不怖 何 況 有 起 二 乘 之 心 及 墮 惡 趣 
T32n1667_002:0589c01	以決定信一切諸法從本已來性涅槃故。解	以 決 定 信 一切諸法 從 本 已 來 性 涅 槃 故 解 
T32n1667_002:0589c02	行發心者當知轉勝。初無數劫將欲滿故。於	行 發 心 者 當 知 轉 勝 初 無 數 劫 將 欲 滿 故 於 
T32n1667_002:0589c03	真如中得深解故。修一切行皆無著故。此菩	真 如 中 得 深 解 故 修 一 切 行 皆 無 著 故 此 菩 
T32n1667_002:0589c04	薩知法性離慳貪相是清淨施度。隨順修行	薩 知 法 性 離 慳 貪 相 是 清 淨 施 度 隨 順 修 行 
T32n1667_002:0589c05	檀那波羅蜜。知法性離五欲境無破戒相是	檀 那 波 羅 蜜 知 法 性 離 五 欲 境 無 破 戒 相 是 
T32n1667_002:0589c06	清淨戒度。隨順修行尸羅波羅蜜。知法性無	清 淨 戒 度 隨 順 修 行 尸 羅 波 羅 蜜 知 法 性 無 
T32n1667_002:0589c07	有苦惱離瞋害相是清淨忍度。隨順修行羼	有 苦 惱 離 瞋 害 相 是 清 淨 忍 度 隨 順 修 行 羼 
T32n1667_002:0589c08	提波羅蜜。知法性離身心相無有懈怠是清	提 波 羅 蜜 知 法 性 離 身 心 相 無 有 懈 怠 是 清 
T32n1667_002:0589c09	淨進度。隨順修行毘梨耶波羅蜜。知法性無	淨 進 度 隨 順 修 行 毘梨耶波羅蜜 知 法 性 無 
T32n1667_002:0589c10	動無亂是清淨禪度。隨順修行禪那波羅蜜。	動 無 亂 是 清 淨 禪 度 隨 順 修 行 禪 那 波 羅 蜜 
T32n1667_002:0589c11	知法性離諸癡闇是清淨慧度。隨順修行般	知 法 性 離 諸 癡 闇 是 清 淨 慧 度 隨 順 修 行 般 
T32n1667_002:0589c12	若波羅蜜。	若 波 羅 蜜 
T32n1667_002:0589c13	證發心者。從淨心地乃至菩薩究竟地證何	證 發 心 者 從 淨 心 地 乃 至 菩 薩 究 竟 地 證 何 
T32n1667_002:0589c14	境界。所謂真如。以依轉識說為境界。而實證	境 界 所 謂 真 如 以 依 轉 識 說 為 境 界 而 實 證 
T32n1667_002:0589c15	中無境界相。此菩薩以無分別智。證離言說	中 無 境 界 相 此 菩 薩 以 無分別智 證 離 言 說 
T32n1667_002:0589c16	真如法身故。能於一念遍往十方一切世界。	真 如 法 身 故 能 於 一 念 遍 往 十 方 一切世界 
T32n1667_002:0589c17	供養諸佛請轉法輪。唯為眾生而作利益不	供 養 諸 佛 請 轉 法 輪 唯 為 眾 生 而 作 利 益 不 
T32n1667_002:0589c18	求聽受美妙音詞。或為怯弱眾生故示大精	求 聽 受 美 妙 音 詞 或 為 怯 弱 眾 生 故 示 大 精 
T32n1667_002:0589c19	進。超無量劫速成正覺。或為懈怠眾生故。經	進 超 無 量 劫 速 成 正 覺 或 為 懈 怠 眾 生 故 經 
T32n1667_002:0589c20	於無量阿僧祇劫。久修苦行方始成佛。如是	於 無量阿僧祇劫 久 修 苦 行 方 始 成 佛 如 是 
T32n1667_002:0589c21	示現無數方便。皆為饒益一切眾生。而實菩	示 現 無數方便 皆 為 饒益一切 眾 生 而 實 菩 
T32n1667_002:0589c22	薩種性諸根發心作證。皆悉同等無超過法。	薩 種 性 諸 根 發 心 作 證 皆 悉 同 等 無 超 過 法 
