T32n1667_001:0583b21	新譯大乘起信論序	新 譯 大 乘 起 信 論 序 
T32n1667_001:0583b23	夫聲同則應道合自隣。是以法雄命宗賴宣揚	夫 聲 同 則 應 道 合 自 隣 是 以 法 雄 命 宗 賴 宣 揚 
T32n1667_001:0583b24	乎法子。素王垂範假傳述乎素臣。蓋德必不	乎 法 子 素 王 垂 範 假 傳 述 乎 素 臣 蓋 德 必 不 
T32n1667_001:0583b25	孤聖無虛應矣。起信論者。大乘之祕典也。佛	孤 聖 無 虛 應 矣 起 信 論 者 大 乘 之 祕 典 也 佛 
T32n1667_001:0583b26	滅度後五百餘年。有馬鳴菩薩。出興于世。時	滅 度 後 五 百 餘 年 有 馬 鳴 菩 薩 出 興 于 世 時 
T32n1667_001:0583b27	稱四日道王五天。轉不退輪建無生忍。銘總	稱 四 日 道 王 五 天 轉 不 退 輪 建 無 生 忍 銘 總 
T32n1667_001:0583b28	持之智印。宅畢竟之真空。受波奢付囑。蒙釋	持 之 智 印 宅 畢 竟 之 真 空 受 波 奢 付 囑 蒙 釋 
T32n1667_001:0583b29	尊遠記。善說法要大啟迷津。欲使群生殖不	尊 遠 記 善 說 法 要 大 啟 迷 津 欲 使 群 生 殖 不 
T32n1667_001:0583c01	壞之信根。下難思之佛種。故造斯論。其為論	壞 之 信 根 下 難 思 之 佛 種 故 造 斯 論 其 為 論 
T32n1667_001:0583c02	也。示無價寶。詮最上乘。演恒沙之法門。惟在	也 示 無 價 寶 詮 最 上 乘 演 恒 沙 之 法 門 惟 在 
T32n1667_001:0583c03	方寸。開諸佛之祕藏。本自一心。遣執而不喪	方 寸 開 諸 佛 之 祕 藏 本 自 一 心 遣 執 而 不 喪 
T32n1667_001:0583c04	其真。存修而亦忘其相。少文而攝多義。假名	其 真 存 修 而 亦 忘 其 相 少 文 而 攝 多 義 假 名 
T32n1667_001:0583c05	而會深旨。落落焉晈智月於淨天。滔滔焉注	而 會 深 旨 落 落 焉 晈 智 月 於 淨 天 滔 滔 焉 注 
T32n1667_001:0583c06	禪河於性海。返迷歸極莫不由之。此論東傳	禪 河 於 性 海 返 迷 歸 極 莫 不 由 之 此 論 東 傳 
T32n1667_001:0583c07	總經二譯。初本即西印度三藏法師波羅末	總 經 二 譯 初 本 即 西 印 度 三藏法師 波 羅 末 
T32n1667_001:0583c08	陀此云真諦。以梁武帝承聖三年歲次癸酉	陀 此 云 真 諦 以 梁 武 帝 承 聖 三 年 歲 次 癸 酉 
T32n1667_001:0583c09	九月十日。於衡州始興郡建興寺。共揚州沙	九 月 十 日 於 衡 州 始 興 郡 建 興 寺 共 揚 州 沙 
T32n1667_001:0583c10	門智愷所譯。此本即于闐國三藏法師實叉	門 智 愷 所 譯 此 本 即 于 闐 國 三藏法師 實 叉 
T32n1667_001:0583c11	難陀。齎梵文至此。又於西京慈恩塔內。獲舊	難 陀 齎 梵 文 至 此 又 於 西 京 慈 恩 塔 內 獲 舊 
T32n1667_001:0583c12	梵本。與義學沙門荊州弘景崇福法藏等。以	梵 本 與 義 學 沙 門 荊 州 弘 景 崇 福 法 藏 等 以 
T32n1667_001:0583c13	大周聖曆三年歲次癸亥十月壬午朔八日己	大 周 聖 曆 三 年 歲 次 癸 亥 十 月 壬 午 朔 八 日 己 
T32n1667_001:0583c14	丑。於授記寺。與花嚴經相次而譯。沙門復禮	丑 於 授 記 寺 與 花 嚴 經 相 次 而 譯 沙 門 復 禮 
T32n1667_001:0583c15	筆受。開為兩卷。然與舊翻時有出沒。蓋譯者	筆 受 開 為 兩 卷 然 與 舊 翻 時 有 出 沒 蓋 譯 者 
T32n1667_001:0583c16	之意。又梵文非一也。夫理幽則信難道尊則	之 意 又 梵 文 非 一 也 夫 理 幽 則 信 難 道 尊 則 
T32n1667_001:0583c17	魔盛。況當劫濁尤更倍增。故使偏見之流。執	魔 盛 況 當 劫 濁 尤 更 倍 增 故 使 偏 見 之 流 執 
T32n1667_001:0583c18	成唯識誹毀此論。真妄互熏。既形於言遂彰	成 唯 識 誹 毀 此 論 真 妄 互 熏 既 形 於 言 遂 彰 
T32n1667_001:0583c19	時聽。方等甘露翻為毒藥。故經云。唯佛與佛	時 聽 方 等 甘 露 翻 為 毒 藥 故 經 云 唯 佛 與 佛 
T32n1667_001:0583c20	乃能究盡諸法實相。豈可輒以凡心貶量聖	乃 能 究 盡 諸法實相 豈 可 輒 以 凡 心 貶 量 聖 
T32n1667_001:0583c21	旨。夫真如者。物之性也。備難思之業用。蘊不	旨 夫 真 如 者 物 之 性 也 備 難 思 之 業 用 蘊 不 
T32n1667_001:0583c22	空之勝德。內熏妄法令起厭求。故勝鬘經云。	空 之 勝 德 內 熏 妄 法 令 起 厭 求 故 勝 鬘 經 云 
T32n1667_001:0583c23	由有如來藏。令厭生死苦樂求涅槃。又經云。	由 有 如 來 藏 令 厭 生 死 苦 樂 求 涅 槃 又 經 云 
T32n1667_001:0583c24	闡提之人。未來以佛性力故。善根還生。如彼	闡 提 之 人 未 來 以 佛 性 力 故 善 根 還 生 如 彼 
T32n1667_001:0583c25	淨珠能清濁水。是勝義之常善。異太虛之無	淨 珠 能 清 濁 水 是 勝 義 之 常 善 異 太 虛 之 無 
T32n1667_001:0583c26	記。故經云。佛性常故非三世攝。虛空無故非	記 故 經 云 佛 性 常 故 非 三 世 攝 虛 空 無 故 非 
T32n1667_001:0583c27	三世攝。豈執事空以齊真理。夫論妄者。依理	三 世 攝 豈 執 事 空 以 齊 真 理 夫 論 妄 者 依 理 
T32n1667_001:0583c28	故迷真性。隨流為妄漂動。故經云。隨其流處	故 迷 真 性 隨 流 為 妄 漂 動 故 經 云 隨 其 流 處 
T32n1667_001:0583c29	有種種味。又楞伽經云。如來藏為無始虛偽	有 種 種 味 又 楞 伽 經 云 如 來 藏 為 無 始 虛 偽 
T32n1667_001:0584a01	惡習所熏。名為識藏。密嚴經云。佛說如來藏。	惡 習 所 熏 名 為 識 藏 密 嚴 經 云 佛 說 如 來 藏 
T32n1667_001:0584a02	以為阿賴耶。惡慧不能知。藏即賴耶識。雖在	以 為 阿 賴 耶 惡 慧 不 能 知 藏 即 賴 耶 識 雖 在 
T32n1667_001:0584a03	纏而體淨。不變性而成迷。故經云。然藥真味	纏 而 體 淨 不 變 性 而 成 迷 故 經 云 然 藥 真 味 
T32n1667_001:0584a04	停留在山。猶如滿月。又云。雖處五道受別異	停 留 在 山 猶如滿月 又 云 雖 處 五 道 受 別 異 
T32n1667_001:0584a05	身。而此佛性常恒不變。若言真不熏妄妄不	身 而 此 佛 性 常 恒 不 變 若 言 真 不 熏 妄 妄 不 
T32n1667_001:0584a06	熏真。真妄兩殊豈會中道。故梁攝論云。智慧	熏 真 真 妄 兩 殊 豈 會 中 道 故 梁 攝 論 云 智 慧 
T32n1667_001:0584a07	極盲暗。謂真俗別執。今則真為妄體。妄假真	極 盲 暗 謂 真 俗 別 執 今 則 真 為 妄 體 妄 假 真 
T32n1667_001:0584a08	成性相俱融一異雙遣。故密嚴經云。如來清	成 性 相 俱 融 一 異 雙 遣 故 密 嚴 經 云 如 來 清 
T32n1667_001:0584a09	淨藏。世間阿賴耶。如金與指環。展轉無差別。	淨 藏 世 間 阿 賴 耶 如 金 與 指 環 展 轉 無 差 別 
T32n1667_001:0584a10	聖教明白。何所致疑。良由滯相而乖真。尋末	聖 教 明 白 何 所 致 疑 良 由 滯 相 而 乖 真 尋 末 
T32n1667_001:0584a11	而棄本。言越規矩動成戲論。自貽聖責深可	而 棄 本 言 越 規 矩 動 成 戲 論 自 貽 聖 責 深 可 
T32n1667_001:0584a12	悲哉。余少小以來。專心斯論。翫味不已。諷誦	悲 哉 余 少 小 以 來 專 心 斯 論 翫 味 不 已 諷 誦 
T32n1667_001:0584a13	忘疲。課拙傳揚二十餘遍。雖未究深旨。而麁	忘 疲 課 拙 傳 揚 二 十 餘 遍 雖 未 究 深 旨 而 麁 
T32n1667_001:0584a14	識文意。以為大乘明鏡莫過於此。幸希宗心	識 文 意 以 為 大 乘 明 鏡 莫 過 於 此 幸 希 宗 心 
T32n1667_001:0584a15	之士。時覽斯文。庶日進有功。聊為序引云爾。	之 士 時 覽 斯 文 庶 日 進 有 功 聊 為 序 引 云 爾 
T32n1667_001:0584a18	大乘起信論卷上	大 乘 起 信 論 卷 上 
T32n1667_001:0584a20	馬鳴菩薩造	馬 鳴 菩 薩 造 
T32n1667_001:0584a21	大周于闐三藏實叉難陀	大 周 于 闐 三 藏 實 叉 難 陀 
T32n1667_001:0584a22	奉　制譯	奉 制 譯 
T32n1667_001:0584a23	　歸命盡十方　　普作大饒益	 歸 命 盡 十 方 普 作 大 饒 益 
T32n1667_001:0584a24	　智無限自在　　救護世間尊	 智 無 限 自 在 救 護 世 間 尊 
T32n1667_001:0584a25	　及彼體相海　　無我句義法	 及 彼 體 相 海 無 我 句 義 法 
T32n1667_001:0584a26	　無邊德藏僧　　勤求正覺者	 無 邊 德 藏 僧 勤 求 正 覺 者 
T32n1667_001:0584a27	　為欲令眾生　　除疑去邪執	 為 欲 令 眾 生 除 疑 去 邪 執 
T32n1667_001:0584a28	　起信紹佛種　　故我造此論	 起 信 紹 佛 種 故 我 造 此 論 
T32n1667_001:0584a29	論曰。為欲發起大乘淨信。斷諸眾生疑暗邪	論 曰 為 欲 發 起 大 乘 淨 信 斷 諸 眾 生 疑 暗 邪 
T32n1667_001:0584b01	執。令佛種性相續不斷故造此論。有法能生	執 令 佛 種 性 相續不斷 故 造 此 論 有 法 能 生 
T32n1667_001:0584b02	大乘信根。是故應說。說有五分一作因。二立	大 乘 信 根 是 故 應 說 說 有 五 分 一 作 因 二 立 
T32n1667_001:0584b03	義。三解釋。四修信。五利益此中作因有八一	義 三 解 釋 四 修 信 五 利 益 此 中 作 因 有 八 一 
T32n1667_001:0584b04	總相。為令眾生離苦得樂。不為貪求利養等	總 相 為 令 眾 生 離 苦 得 樂 不 為 貪 求 利 養 等 
T32n1667_001:0584b05	故。二為顯如來根本實義。令諸眾生生正解	故 二 為 顯 如 來 根 本 實 義 令 諸 眾 生 生 正 解 
T32n1667_001:0584b06	故。三為令善根成熟眾生不退信心。於大乘	故 三 為 令 善根成熟 眾 生 不 退 信 心 於 大 乘 
T32n1667_001:0584b07	法有堪任故。四為令善根微少眾生。發起信	法 有 堪 任 故 四 為 令 善 根 微 少 眾 生 發 起 信 
T32n1667_001:0584b08	心至不退故。五為令眾生消除業障。調伏自	心 至 不 退 故 五 為 令 眾 生 消 除 業 障 調 伏 自 
T32n1667_001:0584b09	心離三毒故。六為令眾生修正止觀。對治凡	心 離 三 毒 故 六 為 令 眾 生 修 正 止 觀 對 治 凡 
T32n1667_001:0584b10	小過失心故。七為令眾生於大乘法如理思	小 過 失 心 故 七 為 令 眾 生 於 大 乘 法 如 理 思 
T32n1667_001:0584b11	惟。得生佛前究竟不退大乘信故。八為顯信	惟 得 生 佛 前 究 竟 不 退 大 乘 信 故 八 為 顯 信 
T32n1667_001:0584b12	樂大乘利益。勸諸含識令歸向故。此諸句義	樂 大 乘 利 益 勸 諸 含 識 令 歸 向 故 此 諸 句 義 
T32n1667_001:0584b13	大乘經中雖已具有。然由所化根欲不同待	大 乘 經 中 雖 已 具 有 然 由 所 化 根 欲 不 同 待 
T32n1667_001:0584b14	悟緣別。是故造論。此復云何。謂如來在世所	悟 緣 別 是 故 造 論 此 復 云 何 謂 如 來 在 世 所 
T32n1667_001:0584b15	化利根。佛色心勝。一音開演無邊義味故不	化 利 根 佛 色 心 勝 一 音 開 演 無 邊 義 味 故 不 
T32n1667_001:0584b16	須論。佛涅槃後。或有能以自力少見於經而	須 論 佛 涅 槃 後 或 有 能 以 自 力 少 見 於 經 而 
T32n1667_001:0584b17	解多義。復有能以自力廣見諸經乃生正解。	解 多 義 復 有 能 以 自 力 廣 見 諸 經 乃 生 正 解 
T32n1667_001:0584b18	或有自無智力因他廣論而得解義。亦有自	或 有 自 無 智 力 因 他 廣 論 而 得 解 義 亦 有 自 
T32n1667_001:0584b19	無智力怖於廣說樂聞略論攝廣大義而正修	無 智 力 怖 於 廣 說 樂 聞 略 論 攝 廣 大 義 而 正 修 
T32n1667_001:0584b20	行。我今為彼最後人故。略攝如來最勝甚深	行 我 今 為 彼 最 後 人 故 略 攝 如 來 最 勝 甚 深 
T32n1667_001:0584b21	無邊之義。而造此論。	無 邊 之 義 而 造 此 論 
T32n1667_001:0584b22	云何立義分。謂摩訶衍略有二種。有法及	云 何 立 義 分 謂 摩 訶 衍 略有二種 有 法 及 
T32n1667_001:0584b23	法。言有法者。謂一切眾生心。是心則攝一	法 言 有 法 者 謂 一 切 眾 生 心 是 心 則 攝 一 
T32n1667_001:0584b24	切世間出世間法。依此顯示摩訶衍義以此	切 世間出世間 法 依 此 顯 示 摩 訶 衍 義 以 此 
T32n1667_001:0584b25	心真如相。即示大乘體故。此心生滅因緣相。	心 真 如 相 即 示 大 乘 體 故 此 心 生 滅 因 緣 相 
T32n1667_001:0584b26	能顯示大乘體相用故。所言法者。略有三種。	能 顯 示 大 乘 體 相 用 故 所 言 法 者 略 有 三 種 
T32n1667_001:0584b27	一體大。謂一切法真如在染在淨性恒平等。	一 體 大 謂 一 切 法 真 如 在 染 在 淨 性 恒 平 等 
T32n1667_001:0584b28	無增無減無別異故。二者相大。謂如來藏本	無增無減 無 別 異 故 二 者 相 大 謂 如 來 藏 本 
T32n1667_001:0584b29	求具足無量無邊性功德故。三者用大。能生	求 具 足 無量無邊 性 功 德 故 三 者 用 大 能 生 
T32n1667_001:0584c01	一切世出世間善因果故一切諸佛本所乘故。	一 切 世出世間 善 因 果 故 一切諸佛 本 所 乘 故 
T32n1667_001:0584c02	一切菩薩皆乘於此入佛地故。	一切菩薩 皆 乘 於 此 入 佛 地 故 
T32n1667_001:0584c03	云何解釋分。此有三種。所謂顯示實義故。對	云 何 解 釋 分 此 有 三 種 所 謂 顯 示 實 義 故 對 
T32n1667_001:0584c04	治邪執故。分別修行正道相故。此中顯示實	治 邪 執 故 分 別 修 行 正 道 相 故 此 中 顯 示 實 
T32n1667_001:0584c05	義者。依於一心有二種門。所謂心真如門。心	義 者 依 於 一 心 有 二 種 門 所 謂 心 真 如 門 心 
T32n1667_001:0584c06	生滅門。此二種門各攝一切法。以此展轉不	生 滅 門 此 二 種 門 各 攝 一 切 法 以 此 展 轉 不 
T32n1667_001:0584c07	相離故。心真如者。即是一法界大總相法門	相 離 故 心 真 如 者 即 是 一 法 界 大 總 相 法 門 
T32n1667_001:0584c08	體。以心本性不生不滅相。一切諸法皆由妄	體 以 心 本 性 不生不滅 相 一切諸法 皆 由 妄 
T32n1667_001:0584c09	念而有差別。若離妄念則無境界差別之相。	念 而有差別 若 離 妄 念 則 無 境界差別 之 相 
T32n1667_001:0584c10	是故諸法從本已來性離語言。一切文字不能	是 故 諸 法 從 本 已 來 性 離 語 言 一 切 文 字 不 能 
T32n1667_001:0584c11	顯說。離心攀緣無有諸相。究竟平等永無變	顯 說 離 心 攀 緣 無 有 諸 相 究 竟 平 等 永 無 變 
T32n1667_001:0584c12	異不可破壞。唯是一心說名真如。以真如	異 不可破壞 唯 是 一 心 說 名 真 如 以 真 如 
T32n1667_001:0584c13	故從本已來不可言說不可分別。一切言說	故 從 本 已 來 不可言說 不可分別 一 切 言 說 
T32n1667_001:0584c14	唯假非實。但隨妄念無所有故。言真如者。此	唯 假 非 實 但 隨 妄 念 無 所 有 故 言 真 如 者 此 
T32n1667_001:0584c15	亦無相。但是一切言說中極以言遣言。非其	亦 無 相 但 是 一 切 言 說 中 極 以 言 遣 言 非 其 
T32n1667_001:0584c16	體性有少可遣有少可立問曰。若如是者。眾	體 性 有 少 可 遣 有 少 可 立 問 曰 若 如 是 者 眾 
T32n1667_001:0584c17	生云何隨順悟入。答曰。若知雖說一切法而	生 云 何 隨 順 悟 入 答 曰 若 知 雖 說 一 切 法 而 
T32n1667_001:0584c18	無能說所說。雖念一切法而無能念所念。爾	無 能 說 所 說 雖 念 一 切 法 而 無 能 念 所 念 爾 
T32n1667_001:0584c19	時隨順妄念都盡名為悟入。	時 隨 順 妄 念 都 盡 名 為 悟 入 
T32n1667_001:0584c20	復次真如者。依言說建立有二種別。一真實	復 次 真 如 者 依 言 說 建 立 有 二 種 別 一 真 實 
T32n1667_001:0584c21	空。究竟遠離不實之相顯實體故。二真實不	空 究 竟 遠 離 不 實 之 相 顯 實 體 故 二 真 實 不 
T32n1667_001:0584c22	空。本性具足無邊功德有自體故。復次真實	空 本 性 具 足 無 邊 功 德 有 自 體 故 復 次 真 實 
T32n1667_001:0584c23	空者。從本已來一切染法不相應故。離一切	空 者 從 本 已 來 一 切 染 法 不 相 應 故 離 一 切 
T32n1667_001:0584c24	法差別相故。無有虛妄分別心故。應知真如	法 差 別 相 故 無 有 虛妄分別 心 故 應 知 真 如 
T32n1667_001:0584c25	非有相非無相。非有無相非非有無相非一	非 有 相 非 無 相 非 有 無 相 非 非 有 無 相 非 一 
T32n1667_001:0584c26	相非異相。非一異相非非一異相。略說以一	相 非 異 相 非 一 異 相 非 非 一 異 相 略 說 以 一 
T32n1667_001:0584c27	切眾生妄分別心所不能觸故立為空。據實	切 眾 生 妄 分 別 心 所 不 能 觸 故 立 為 空 據 實 
T32n1667_001:0584c28	道理。妄念非有。空性亦空。以所遮是無。能遮	道 理 妄 念 非 有 空 性 亦 空 以 所 遮 是 無 能 遮 
T32n1667_001:0584c29	亦無故。言真實不空者。由妄念空無故。即顯	亦 無 故 言 真 實 不 空 者 由 妄 念 空 無 故 即 顯 
T32n1667_001:0585a01	真心常恒不變淨法圓滿故名不空。亦無不	真 心 常 恒 不 變 淨 法 圓 滿 故 名 不 空 亦 無 不 
T32n1667_001:0585a02	空相。以非妄念心所行故。唯離念智之所證	空 相 以 非 妄 念 心 所 行 故 唯 離 念 智 之 所 證 
T32n1667_001:0585a03	故。	故 
T32n1667_001:0585a04	心生滅門者。謂依如來藏有生滅心轉。不生	心 生 滅 門 者 謂 依 如 來 藏 有 生 滅 心 轉 不 生 
T32n1667_001:0585a05	滅與生滅和合非一非異。名阿賴耶識。此識	滅 與 生 滅 和 合 非一非異 名 阿賴耶識 此 識 
T32n1667_001:0585a06	有二種義。謂能攝一切法。能生一切法。復有	有 二 種 義 謂 能 攝 一 切 法 能 生 一 切 法 復 有 
T32n1667_001:0585a07	二種義。一者覺義。二者不覺義。言覺義者。謂	二 種 義 一 者 覺 義 二 者 不 覺 義 言 覺 義 者 謂 
T32n1667_001:0585a08	心第一義性離一切妄念相。離一切妄念相	心 第 一 義 性 離 一 切 妄 念 相 離 一 切 妄 念 相 
T32n1667_001:0585a09	故。等虛空界無所不遍。法界一相即是一切	故 等 虛 空 界 無 所 不 遍 法 界 一 相 即 是 一 切 
T32n1667_001:0585a10	如來平等法身。依此法身。說一切如來為本	如 來 平 等 法 身 依 此 法 身 說 一 切 如 來 為 本 
T32n1667_001:0585a11	覺。以待始覺立為本覺。然始覺時即是本覺。	覺 以 待 始 覺 立 為 本 覺 然 始 覺 時 即 是 本 覺 
T32n1667_001:0585a12	無別覺起立。始覺者。謂依本覺有不覺。依不	無 別 覺 起 立 始 覺 者 謂 依 本 覺 有 不 覺 依 不 
T32n1667_001:0585a13	覺說有始覺。又以覺心源故名究竟覺。不覺	覺 說 有 始 覺 又 以 覺 心 源 故 名 究 竟 覺 不 覺 
T32n1667_001:0585a14	心源故非究竟覺。如凡夫人。前念不覺起	心 源 故 非 究 竟 覺 如 凡 夫 人 前 念 不 覺 起 
T32n1667_001:0585a15	於煩惱。後念制伏令不更生。此雖名覺即	於 煩 惱 後 念 制 伏 令 不 更 生 此 雖 名 覺 即 
T32n1667_001:0585a16	是不覺。如二乘人及初業菩薩。覺有念無	是 不 覺 如 二 乘 人 及 初 業 菩 薩 覺 有 念 無 
T32n1667_001:0585a17	念體相別異。以捨麁分別故。名相似覺。如法	念 體 相 別 異 以 捨 麁 分 別 故 名 相 似 覺 如 法 
T32n1667_001:0585a18	身菩薩。覺念無念皆無有相。捨中品分別故。	身 菩 薩 覺 念 無 念 皆 無 有 相 捨 中 品 分 別 故 
T32n1667_001:0585a19	名隨分覺。若超過菩薩地究竟道滿足。一念	名 隨 分 覺 若 超 過 菩 薩 地 究 竟 道 滿 足 一 念 
T32n1667_001:0585a20	相應覺心初起。始名為覺。遠離覺相微細分	相 應 覺 心 初 起 始 名 為 覺 遠 離 覺 相 微 細 分 
T32n1667_001:0585a21	別究竟永盡。心根本性常住現前。是為如來。	別 究 竟 永 盡 心 根 本 性 常 住 現 前 是 為 如 來 
T32n1667_001:0585a22	名究竟覺。是故經說。若有眾生。能觀一切妄	名 究 竟 覺 是 故 經 說 若 有 眾 生 能 觀 一 切 妄 
T32n1667_001:0585a23	念無相。則為證得如來智慧。又言心初起者。	念 無 相 則 為 證 得 如來智慧 又 言 心 初 起 者 
T32n1667_001:0585a24	但隨俗說。求其初相終不可得。心尚無有何	但 隨 俗 說 求 其 初 相 終 不 可 得 心 尚 無 有 何 
T32n1667_001:0585a25	況有初。是故一切眾生不名為覺。以無始來	況 有 初 是 故 一 切 眾 生 不 名 為 覺 以 無 始 來 
T32n1667_001:0585a26	恒有無明妄念相續未曾離故。若妄念息。即	恒 有 無 明 妄 念 相 續 未 曾 離 故 若 妄 念 息 即 
T32n1667_001:0585a27	知心相生住異滅皆悉無相。以於一心前後	知 心 相 生住異滅 皆 悉 無 相 以 於 一 心 前 後 
T32n1667_001:0585a28	同時皆不相應無自性故。如是知已則知始	同 時 皆 不 相 應 無 自 性 故 如 是 知 已 則 知 始 
T32n1667_001:0585a29	覺不可得。以不異本覺故。	覺 不 可 得 以 不 異 本 覺 故 
T32n1667_001:0585b01	復次本覺隨染。分別生二種差別相。一淨智	復 次 本 覺 隨 染 分 別 生 二 種 差 別 相 一 淨 智 
T32n1667_001:0585b02	相。二不思議用相。淨智相者。謂依法熏習。如	相 二 不 思 議 用 相 淨 智 相 者 謂 依 法 熏 習 如 
T32n1667_001:0585b03	實修行功行滿足。破和合識滅轉識相。顯現	實 修 行 功 行 滿 足 破 和 合 識 滅 轉 識 相 顯 現 
T32n1667_001:0585b04	法身清淨智故。一切心識相即是無明相。與	法 身 清 淨 智 故 一 切 心 識 相 即 是 無 明 相 與 
T32n1667_001:0585b05	本覺非一非異。非是可壞非不可壞。如海水	本 覺 非一非異 非 是 可 壞 非 不 可 壞 如 海 水 
T32n1667_001:0585b06	與波非一非異。波因風動非水性動。若風止	與 波 非一非異 波 因 風 動 非 水 性 動 若 風 止 
T32n1667_001:0585b07	時波動即滅非水性滅。眾生亦爾。自性清淨	時 波 動 即 滅 非 水 性 滅 眾 生 亦 爾 自 性 清 淨 
T32n1667_001:0585b08	心因無明風動起識波浪。如是三事皆無形	心 因 無 明 風 動 起 識 波 浪 如 是 三 事 皆 無 形 
T32n1667_001:0585b09	相非一非異。然性淨心是動識本。無明滅時	相 非一非異 然 性 淨 心 是 動 識 本 無 明 滅 時 
T32n1667_001:0585b10	動識隨滅。智性不壞。不思議用相者。依於淨	動 識 隨 滅 智 性 不 壞 不 思 議 用 相 者 依 於 淨 
T32n1667_001:0585b11	智。能起一切勝妙境界常無斷絕。謂如來身	智 能 起 一 切 勝 妙 境 界 常 無 斷 絕 謂 如 來 身 
T32n1667_001:0585b12	具足無量增上功德。隨眾生根。示現成就無	具 足 無 量 增 上 功 德 隨 眾 生 根 示 現 成 就 無 
T32n1667_001:0585b13	量利益。	量 利 益 
T32n1667_001:0585b14	復次覺相有四種大義。清淨如虛空明鏡。一	復 次 覺 相 有 四 種 大 義 清 淨 如 虛 空 明 鏡 一 
T32n1667_001:0585b15	真實空大義如虛空明鏡。謂一切心境界相	真 實 空 大 義 如 虛 空 明 鏡 謂 一 切 心 境 界 相 
T32n1667_001:0585b16	及覺相皆不可得故。二真實不空大義如虛	及 覺 相 皆 不 可 得 故 二 真 實 不 空 大 義 如 虛 
T32n1667_001:0585b17	空明鏡。謂一切法圓滿成就無能壞性。一切	空 明 鏡 謂 一 切 法 圓 滿 成 就 無 能 壞 性 一 切 
T32n1667_001:0585b18	世間境界之相皆於中現。不出不入不滅不	世 間 境 界 之 相 皆 於 中 現 不出不入 不 滅 不 
T32n1667_001:0585b19	壞常住一心。一切染法所不能染。智體具足	壞 常 住 一 心 一 切 染 法 所 不 能 染 智 體 具 足 
T32n1667_001:0585b20	無邊無漏功德為因。熏習一切眾生心故。三	無 邊 無 漏 功 德 為 因 熏 習 一 切 眾 生 心 故 三 
T32n1667_001:0585b21	真實不空離障大義如虛空明鏡。謂煩惱所	真 實 不 空 離 障 大 義 如 虛 空 明 鏡 謂 煩 惱 所 
T32n1667_001:0585b22	知二障永斷和合識滅。本性清淨常安住故。	知 二 障 永 斷 和 合 識 滅 本 性 清 淨 常 安 住 故 
T32n1667_001:0585b23	四真實不空示現大義如虛空明鏡。謂依離	四 真 實 不 空 示 現 大 義 如 虛 空 明 鏡 謂 依 離 
T32n1667_001:0585b24	障法隨所應化。現如來等種種色聲。令彼修	障 法 隨 所 應 化 現 如 來 等 種 種 色 聲 令 彼 修 
T32n1667_001:0585b25	行諸善根故。	行 諸 善 根 故 
T32n1667_001:0585b26	不覺義者。謂從無始來不如實知真法一故。	不 覺 義 者 謂 從無始來 不 如 實 知 真 法 一 故 
T32n1667_001:0585b27	不覺心起而有妄念。然彼妄念自無實相。不	不 覺 心 起 而 有 妄 念 然 彼 妄 念 自 無 實 相 不 
T32n1667_001:0585b28	離本覺。猶如迷人依方故迷。迷無自相不離	離 本 覺 猶 如 迷 人 依 方 故 迷 迷 無 自 相 不 離 
T32n1667_001:0585b29	於方。眾生亦爾。依於覺故而有不覺妄念迷	於 方 眾 生 亦 爾 依 於 覺 故 而 有 不 覺 妄 念 迷 
T32n1667_001:0585c01	生。然彼不覺自無實相。不離本覺。復待不覺	生 然 彼 不 覺 自 無 實 相 不 離 本 覺 復 待 不 覺 
T32n1667_001:0585c02	以說真覺。不覺既無真覺亦遣。	以 說 真 覺 不 覺 既 無 真 覺 亦 遣 
T32n1667_001:0585c03	復次依於覺故而有不覺生三種相不相捨	復 次 依 於 覺 故 而 有 不 覺 生 三 種 相 不 相 捨 
T32n1667_001:0585c04	離。一無明業相。以依不覺心動為業。覺則不	離 一 無 明 業 相 以 依 不 覺 心 動 為 業 覺 則 不 
