T32n1667_001:0585c05	動。動則有苦。果不離因故。二能見相。以依心	動 動 則 有 苦 果 不 離 因 故 二 能 見 相 以 依 心 
T32n1667_001:0585c06	動能見境界。不動則無見。三境界相。以依能	動 能 見 境 界 不 動 則 無 見 三 境 界 相 以 依 能 
T32n1667_001:0585c07	見妄境相現。離見則無境。以有虛妄境界緣	見 妄 境 相 現 離 見 則 無 境 以 有 虛 妄 境 界 緣 
T32n1667_001:0585c08	故。復生六種相。一智相。謂緣境界生愛非	故 復 生 六 種 相 一 智 相 謂 緣 境 界 生 愛 非 
T32n1667_001:0585c09	愛心。二相續相。謂依於智苦樂覺念相應不	愛 心 二 相 續 相 謂 依 於 智 苦 樂 覺 念 相 應 不 
T32n1667_001:0585c10	斷。三執著相。謂依苦樂覺念相續而生執著。	斷 三 執 著 相 謂 依 苦 樂 覺 念 相 續 而 生 執 著 
T32n1667_001:0585c11	四執名等相。謂依執著分別名等諸安立相。	四 執 名 等 相 謂 依 執 著 分 別 名 等 諸 安 立 相 
T32n1667_001:0585c12	五起業相。謂依執名等起於種種諸差別業。	五 起 業 相 謂 依 執 名 等 起 於 種 種 諸 差 別 業 
T32n1667_001:0585c13	六業繫苦相。謂依業受苦不得自在。是故當	六 業 繫 苦 相 謂 依 業 受 苦 不得自在 是 故 當 
T32n1667_001:0585c14	知。一切染法悉無有相。皆因無明而生起故。	知 一 切 染 法 悉 無 有 相 皆 因 無 明 而 生 起 故 
T32n1667_001:0585c15	復次覺與不覺有二種相。一同相二異相。言	復 次 覺 與 不 覺 有 二 種 相 一 同 相 二 異 相 言 
T32n1667_001:0585c16	同相者。如種種瓦器皆同土相。如是無漏無	同 相 者 如 種 種 瓦 器 皆 同 土 相 如 是 無 漏 無 
T32n1667_001:0585c17	明種種幻用。皆同真相。是故佛說。一切眾生	明 種 種 幻 用 皆 同 真 相 是 故 佛 說 一 切 眾 生 
T32n1667_001:0585c18	無始已來常入涅槃。菩提非可修相。非可生	無始已來 常 入 涅 槃 菩 提 非 可 修 相 非 可 生 
T32n1667_001:0585c19	相。畢竟無得。無有色相而可得見。見色相者	相 畢 竟 無 得 無 有 色 相 而 可 得 見 見 色 相 者 
T32n1667_001:0585c20	當知皆是隨染幻用。非是智色不空之相。以	當 知 皆 是 隨 染 幻 用 非 是 智 色 不 空 之 相 以 
T32n1667_001:0585c21	智相不可得故。廣如彼說。言異相者。如種種	智 相 不 可 得 故 廣 如 彼 說 言 異 相 者 如 種 種 
T32n1667_001:0585c22	瓦器各各不同。此亦如是。無漏無明種種幻	瓦 器 各各不同 此 亦 如 是 無 漏 無 明 種 種 幻 
T32n1667_001:0585c23	用相差別故。復次生滅因緣者。謂諸眾生依	用 相 差 別 故 復 次 生 滅 因 緣 者 謂 諸 眾 生 依 
T32n1667_001:0585c24	心意識轉。此義云何。以依阿賴耶識有無明	心 意 識 轉 此義云何 以 依 阿賴耶識 有 無 明 
T32n1667_001:0585c25	不覺起。能見能現能取境界分別相續。說名	不 覺 起 能 見 能 現 能 取 境 界 分 別 相 續 說 名 
T32n1667_001:0585c26	為意。此意復。有五種異名。一名業識。謂無明	為 意 此 意 復 有 五 種 異 名 一 名 業 識 謂 無 明 
T32n1667_001:0585c27	力不覺心動。二名轉識。謂依動心能見境相。	力 不 覺 心 動 二 名 轉 識 謂 依 動 心 能 見 境 相 
T32n1667_001:0585c28	三名現識。謂現一切諸境界相。猶如明鏡現	三 名 現 識 謂 現 一 切 諸 境 界 相 猶 如 明 鏡 現 
T32n1667_001:0585c29	眾色像。現識亦爾。如其五境對至即現。無有	眾 色 像 現 識 亦 爾 如 其 五 境 對 至 即 現 無 有 
T32n1667_001:0586a01	前後不由功力。四名智識。謂分別染淨諸差	前 後 不 由 功 力 四 名 智 識 謂 分 別 染 淨 諸 差 
T32n1667_001:0586a02	別法。五名相續識。謂恒作意相應不斷。任持	別 法 五 名 相 續 識 謂 恒 作 意 相 應 不 斷 任 持 
T32n1667_001:0586a03	過去善惡等業令無失壞。成熟現未苦樂等	過 去 善 惡 等 業 令 無 失 壞 成 熟 現 未 苦 樂 等 
T32n1667_001:0586a04	報使無違越。已曾經事忽然憶念。未曾經事	報 使 無 違 越 已 曾 經 事 忽 然 憶 念 未 曾 經 事 
T32n1667_001:0586a05	妄生分別。是故三界一切皆以心為自性。離	妄 生 分 別 是 故 三 界 一 切 皆 以 心 為 自 性 離 
T32n1667_001:0586a06	心則無六塵境界何以故。一切諸法以心為	心 則 無 六 塵 境 界 何 以 故 一切諸法 以 心 為 
T32n1667_001:0586a07	主從妄念起。凡所分別皆分別自心。心不見	主 從 妄 念 起 凡 所 分 別 皆 分 別 自 心 心 不 見 
T32n1667_001:0586a08	心無相可得。是故當知。一切世間境界之相。	心 無 相 可 得 是故當知 一切世間 境 界 之 相 
T32n1667_001:0586a09	皆依眾生無明妄念而得建立。如鏡中像無體	皆 依 眾 生 無 明 妄 念 而 得 建 立 如 鏡 中 像 無 體 
T32n1667_001:0586a10	可得。唯從虛妄分別心轉心生則種種法生。	可 得 唯 從 虛妄分別 心 轉 心 生 則 種 種 法 生 
T32n1667_001:0586a11	心滅則種種法滅故。言意識者。謂一切凡夫	心 滅 則 種 種 法 滅 故 言 意 識 者 謂 一 切 凡 夫 
T32n1667_001:0586a12	依相續識執我我所。種種妄取六種境界。亦	依 相 續 識 執 我 我 所 種 種 妄 取 六 種 境 界 亦 
T32n1667_001:0586a13	名分離識。亦名分別事識。以依見愛等熏而	名 分 離 識 亦 名 分別事識 以 依 見 愛 等 熏 而 
T32n1667_001:0586a14	增長故。無始無明熏所起識。非諸凡夫二乘	增 長 故 無 始 無 明 熏 所 起 識 非 諸 凡 夫 二 乘 
T32n1667_001:0586a15	智慧之所能知。解行地菩薩始學觀察。法身	智 慧 之 所 能 知 解 行 地 菩 薩 始 學 觀 察 法 身 
T32n1667_001:0586a16	菩薩能少分知。至究竟地猶未知盡。唯有如	菩 薩 能 少 分 知 至 究 竟 地 猶 未 知 盡 唯 有 如 
T32n1667_001:0586a17	來能總明了。此義云何。以其心性本來清淨。	來 能 總 明 了 此義云何 以 其 心 性 本 來 清 淨 
T32n1667_001:0586a18	無明力故染心相現雖有染心而常明潔無有	無 明 力 故 染 心 相 現 雖 有 染 心 而 常 明 潔 無 有 
T32n1667_001:0586a19	改變。復以本性無分別故。雖復遍生一切境界	改 變 復 以 本 性 無 分 別 故 雖 復 遍 生 一切境界 
T32n1667_001:0586a20	而無變易。以不覺一法界故不相應。無明分	而 無 變 易 以 不 覺 一 法 界 故 不 相 應 無 明 分 
T32n1667_001:0586a21	別起生諸染心。如是之義甚深難測。唯佛能	別 起 生 諸 染 心 如 是 之 義 甚 深 難 測 唯 佛 能 
T32n1667_001:0586a22	知非餘所了。此所生染心有六種別。一執相	知 非 餘 所 了 此 所 生 染 心 有 六 種 別 一 執 相 
T32n1667_001:0586a23	應染。聲聞緣覺及信相應地諸菩薩能遠離。	應 染 聲 聞 緣 覺 及 信 相 應 地 諸 菩 薩 能 遠 離 
T32n1667_001:0586a24	二不斷相應染。信地菩薩勤修力能少分離。	二 不 斷 相 應 染 信 地 菩 薩 勤 修 力 能 少 分 離 
T32n1667_001:0586a25	至淨心地永盡無餘。三分別智相應染。從具	至 淨 心 地 永 盡 無 餘 三 分 別 智 相 應 染 從 具 
T32n1667_001:0586a26	戒地乃至具慧地能少分離。至無相行地方得	戒 地 乃 至 具 慧 地 能 少 分 離 至 無 相 行 地 方 得 
T32n1667_001:0586a27	永盡。四現色不相應染。此色自在地之所除	永 盡 四 現 色 不 相 應 染 此 色 自 在 地 之 所 除 
T32n1667_001:0586a28	滅。五見心不相應染。此心自在地之所除滅。	滅 五 見 心不相應 染 此 心 自 在 地 之 所 除 滅 
T32n1667_001:0586a29	六根本業不相應染。此從菩薩究竟地入如	六 根 本 業不相應 染 此 從 菩 薩 究 竟 地 入 如 
T32n1667_001:0586b01	來地之所除滅。不覺一法界者。始從信地觀	來 地 之 所 除 滅 不 覺 一 法 界 者 始 從 信 地 觀 
T32n1667_001:0586b02	察起行。至淨心地能少分離。入如來地方得	察 起 行 至 淨 心 地 能 少 分 離 入如來地 方 得 
T32n1667_001:0586b03	永盡。相應義者。心分別異。染淨分別異。知相	永 盡 相 應 義 者 心 分 別 異 染 淨 分 別 異 知 相 
T32n1667_001:0586b04	緣相同。不相應義者即心不覺常無別異。知	緣 相 同 不 相 應 義 者 即 心 不 覺 常 無 別 異 知 
T32n1667_001:0586b05	相緣相不同。染心者。是煩惱障。能障真如根	相 緣 相 不 同 染 心 者 是 煩 惱 障 能 障 真 如 根 
T32n1667_001:0586b06	本智故無明者。是所知障。能障世間業自在	本 智 故 無 明 者 是 所 知 障 能 障 世 間 業 自 在 
T32n1667_001:0586b07	智故。此義云何。以依染心。執著無量能取	智 故 此義云何 以 依 染 心 執 著 無 量 能 取 
T32n1667_001:0586b08	所取虛妄境界。違一切法平等之性。一切法	所 取 虛 妄 境 界 違 一 切 法 平 等 之 性 一 切 法 
T32n1667_001:0586b09	性平等寂滅無有生相。無明不覺妄與覺違。	性 平 等 寂 滅 無 有 生 相 無 明 不 覺 妄 與 覺 違 
T32n1667_001:0586b10	是故於一切世間種種境界差別業用。皆悉	是 故 於 一切世間 種 種 境界差別 業 用 皆 悉 
T32n1667_001:0586b11	不能如實而知。	不 能 如 實 而 知 
T32n1667_001:0586b12	復次分別心生滅相者。有二種別。一麁謂相	復 次 分 別 心 生 滅 相 者 有 二 種 別 一 麁 謂 相 
T32n1667_001:0586b13	應心。二細謂不相應心。麁中之麁凡夫智境。	應 心 二 細 謂 不相應心 麁 中 之 麁 凡 夫 智 境 
T32n1667_001:0586b14	麁中之細及細中之麁菩薩智境。此二種相。	麁 中 之 細 及 細 中 之 麁 菩 薩 智 境 此 二 種 相 
T32n1667_001:0586b15	皆由無明熏習力起。然依因依緣。因是不覺	皆 由 無 明 熏 習 力 起 然 依 因 依 緣 因 是 不 覺 
T32n1667_001:0586b16	緣是妄境。因滅則緣滅。緣滅故相應心滅。因	緣 是 妄 境 因 滅 則 緣 滅 緣 滅 故 相 應 心 滅 因 
T32n1667_001:0586b17	滅故不相應心滅。問若心滅者云何相續。若	滅 故 不相應心 滅 問 若 心 滅 者 云 何 相 續 若 
T32n1667_001:0586b18	相續者云何言滅答實然。今言滅者。但心相	相 續 者 云 何 言 滅 答 實 然 今 言 滅 者 但 心 相 
T32n1667_001:0586b19	滅非心體滅。如水因風而有動相。以風滅故	滅 非 心 體 滅 如 水 因 風 而 有 動 相 以 風 滅 故 
T32n1667_001:0586b20	動相即滅。非水體滅。若水滅者動相應斷。以	動 相 即 滅 非 水 體 滅 若 水 滅 者 動 相 應 斷 以 
T32n1667_001:0586b21	無所依無能依故。以水體不滅動相相續。眾	無 所 依 無 能 依 故 以 水 體 不 滅 動 相 相 續 眾 
T32n1667_001:0586b22	生亦爾。以無明力令其心動。無明滅故動相	生 亦 爾 以 無 明 力 令 其 心 動 無 明 滅 故 動 相 
T32n1667_001:0586b23	即滅。非心體滅。若心滅者則眾生斷。以無所	即 滅 非 心 體 滅 若 心 滅 者 則 眾 生 斷 以 無 所 
T32n1667_001:0586b24	依無能依故。以心體不滅心動相續。	依 無 能 依 故 以 心 體 不 滅 心 動 相 續 
T32n1667_001:0586b25	復次以四種法熏習義故。染淨法起無有斷	復 次 以 四 種 法 熏 習 義 故 染 淨 法 起 無 有 斷 
T32n1667_001:0586b26	絕。一淨法。謂真如二染因。謂無明。三妄心。	絕 一 淨 法 謂 真 如 二 染 因 謂 無 明 三 妄 心 
T32n1667_001:0586b27	謂業識。四妄境謂六塵。熏習義者。如世衣服	謂 業 識 四 妄 境 謂 六 塵 熏 習 義 者 如 世 衣 服 
T32n1667_001:0586b28	非臭非香。隨以物熏則有彼氣。真如淨法性	非 臭 非 香 隨 以 物 熏 則 有 彼 氣 真 如 淨 法 性 
T32n1667_001:0586b29	非是染。無明熏故則有染相。無明染法實無	非 是 染 無 明 熏 故 則 有 染 相 無 明 染 法 實 無 
T32n1667_001:0586c01	淨業。真如熏故說有淨用。云何熏習染法不	淨 業 真 如 熏 故 說 有 淨 用 云 何 熏 習 染 法 不 
T32n1667_001:0586c02	斷。所謂依真如故而起無明為諸染因。然此	斷 所 謂 依 真 如 故 而 起 無 明 為 諸 染 因 然 此 
T32n1667_001:0586c03	無明即熏真如。既熏習已生妄念心。此妄念	無 明 即 熏 真 如 既 熏 習 已 生 妄 念 心 此 妄 念 
T32n1667_001:0586c04	心復熏無明。以熏習故不覺真法。以不覺故	心 復 熏 無 明 以 熏 習 故 不 覺 真 法 以 不 覺 故 
T32n1667_001:0586c05	妄境相現。以妄念心熏習力故。生於種種差	妄 境 相 現 以 妄 念 心 熏 習 力 故 生 於 種 種 差 
T32n1667_001:0586c06	別執著。造種種業。受身心等眾苦果報。妄境	別 執 著 造 種 種 業 受 身 心 等 眾 苦 果 報 妄 境 
T32n1667_001:0586c07	熏義有二種別。一增長分別熏。二增長執取	熏 義 有 二 種 別 一 增 長 分 別 熏 二 增 長 執 取 
T32n1667_001:0586c08	熏。妄心熏義亦二種別。一增長根本業識熏。	熏 妄 心 熏 義 亦 二 種 別 一 增 長 根 本 業 識 熏 
T32n1667_001:0586c09	令阿羅漢辟支佛一切菩薩受生滅苦。二增	令 阿 羅 漢 辟 支 佛 一切菩薩 受 生 滅 苦 二 增 
T32n1667_001:0586c10	長分別事識熏。令諸凡夫受業繫苦。無明熏	長 分別事識 熏 令 諸 凡 夫 受 業 繫 苦 無 明 熏 
T32n1667_001:0586c11	義亦二種別。一根本熏。成就業識義。二見愛	義 亦 二 種 別 一 根 本 熏 成 就 業 識 義 二 見 愛 
T32n1667_001:0586c12	熏。成就分別事識義。云何熏習淨法不斷。謂	熏 成 就 分別事識 義 云 何 熏 習 淨 法 不 斷 謂 
T32n1667_001:0586c13	以真如熏於無明。以熏習因緣力故。令妄念	以 真 如 熏 於 無 明 以 熏 習 因 緣 力 故 令 妄 念 
T32n1667_001:0586c14	心厭生死苦求涅槃樂。以此妄心厭求因緣	心 厭 生 死 苦 求 涅 槃 樂 以 此 妄 心 厭 求 因 緣 
T32n1667_001:0586c15	復熏真如。以熏習故則自信己身有真如法	復 熏 真 如 以 熏 習 故 則 自 信 己 身 有 真 如 法 
T32n1667_001:0586c16	本性清淨。知一切境界唯心妄動畢竟無有。	本 性 清 淨 知 一切境界 唯 心 妄 動 畢 竟 無 有 
T32n1667_001:0586c17	以能如是如實知故。修遠離法。起於種種諸	以 能 如 是 如 實 知 故 修 遠 離 法 起 於 種 種 諸 
T32n1667_001:0586c18	隨順行。無所分別無所取著。經於無量阿僧	隨 順 行 無所分別 無 所 取 著 經 於 無 量 阿 僧 
T32n1667_001:0586c19	祇劫。慣習力故無明則滅。無明滅故心相不	祇 劫 慣 習 力 故 無 明 則 滅 無 明 滅 故 心 相 不 
T32n1667_001:0586c20	起。心不起故境界相滅。如是一切染因染緣	起 心 不 起 故 境 界 相 滅 如是一切 染 因 染 緣 
T32n1667_001:0586c21	及以染果。心相都滅名得涅槃。成就種種自	及 以 染 果 心 相 都 滅 名 得 涅 槃 成 就 種 種 自 
T32n1667_001:0586c22	在業用。妄心熏義有二種別。一分別事識熏。	在 業 用 妄 心 熏 義 有 二 種 別 一 分別事識 熏 
T32n1667_001:0586c23	令一切凡夫二乘厭生死苦。隨已堪能趣無	令 一 切 凡 夫 二 乘 厭 生 死 苦 隨 已 堪 能 趣 無 
T32n1667_001:0586c24	上道。二意熏。令諸菩薩發心勇猛。速疾趣入	上 道 二 意 熏 令 諸 菩 薩 發 心 勇 猛 速 疾 趣 入 
T32n1667_001:0586c25	無住涅槃。真如熏義亦二種別。一體熏。二用	無住涅槃 真 如 熏 義 亦 二 種 別 一 體 熏 二 用 
T32n1667_001:0586c26	熏。體熏者。所謂真如從無始來具足一切無	熏 體 熏 者 所 謂 真 如 從無始來 具 足 一 切 無 
T32n1667_001:0586c27	量無漏。亦具難思勝境界用。常無間斷熏眾	量 無 漏 亦 具 難 思 勝 境 界 用 常 無 間 斷 熏 眾 
T32n1667_001:0586c28	生心。以此力故令諸眾生厭生死苦求涅槃樂	生 心 以 此 力 故 令 諸 眾 生 厭 生 死 苦 求 涅 槃 樂 
T32n1667_001:0586c29	自信己身有真實法發心修行。問若一切眾	自 信 己 身 有 真 實 法 發 心 修 行 問 若 一 切 眾 
T32n1667_001:0587a01	生同有真如等皆熏習。云何而有信不信者。	生 同 有 真 如 等 皆 熏 習 云 何 而 有 信 不 信 者 
T32n1667_001:0587a02	從初發意乃至涅槃。前後不同無量差別。如	從 初 發 意 乃至涅槃 前 後 不 同 無量差別 如 
T32n1667_001:0587a03	是一切悉應齊等。答雖一切眾生等有真如。	是 一 切 悉 應 齊 等 答 雖 一 切 眾 生 等 有 真 如 
T32n1667_001:0587a04	然無始來無明厚薄無量差別過恒沙數。我	然 無 始 來 無 明 厚 薄 無量差別 過 恒 沙 數 我 
T32n1667_001:0587a05	見愛等纏縛煩惱亦復如是。唯如來智之所	見 愛 等 纏 縛 煩 惱 亦復如是 唯 如 來 智 之 所 
T32n1667_001:0587a06	能知。故令信等前後差別。又諸佛法有因有	能 知 故 令 信 等 前 後 差 別 又 諸 佛 法 有 因 有 
T32n1667_001:0587a07	緣。因緣具足事乃成辦。如木中火性。是火正	緣 因緣具足 事 乃 成 辦 如 木 中 火 性 是 火 正 
T32n1667_001:0587a08	因若無人知或有雖知而不施功。欲令出火	因 若 無 人 知 或 有 雖 知 而 不 施 功 欲 令 出 火 
T32n1667_001:0587a09	焚燒木者無有是處。眾生亦爾。雖有真如體	焚 燒 木 者 無 有 是 處 眾 生 亦 爾 雖 有 真 如 體 
T32n1667_001:0587a10	熏因力。若不遇佛諸菩薩等善知識緣。或雖	熏 因 力 若 不 遇 佛 諸 菩 薩 等 善 知 識 緣 或 雖 
T32n1667_001:0587a11	不修勝行不生智慧不斷煩惱。能得涅槃無	不 修 勝 行 不 生 智 慧 不 斷 煩 惱 能 得 涅 槃 無 
T32n1667_001:0587a12	有是處。又復雖有善知識緣。儻內無真如熏	有 是 處 又 復 雖 有 善 知 識 緣 儻 內 無 真 如 熏 
T32n1667_001:0587a13	習因力。必亦不能厭生死苦求涅槃樂。要因	習 因 力 必 亦 不 能 厭 生 死 苦 求 涅 槃 樂 要 因 
T32n1667_001:0587a14	緣具足乃能如是。云何具足。謂自相續中有	緣 具 足 乃 能 如 是 云 何 具 足 謂 自 相 續 中 有 
T32n1667_001:0587a15	熏習力。諸佛菩薩慈悲攝護。乃能厭生死苦	熏 習 力 諸佛菩薩 慈 悲 攝 護 乃 能 厭 生 死 苦 
T32n1667_001:0587a16	信有涅槃。種諸善根修習成熟。以是復值諸	信 有 涅 槃 種 諸 善 根 修 習 成 熟 以 是 復 值 諸 
T32n1667_001:0587a17	佛菩薩示教利喜。令修勝行乃至成佛入于	佛 菩 薩 示 教 利 喜 令 修 勝 行 乃至成佛 入 于 
T32n1667_001:0587a18	涅槃。用熏者。即是眾生外緣之力有無量義。	涅 槃 用 熏 者 即 是 眾 生 外 緣 之 力 有 無 量 義 
T32n1667_001:0587a19	略說二種。一差別緣。二平等緣。差別緣者。謂	略 說 二 種 一 差 別 緣 二 平 等 緣 差 別 緣 者 謂 
T32n1667_001:0587a20	諸眾生從初發心乃至成佛。蒙佛菩薩等諸	諸 眾 生 從 初 發 心 乃至成佛 蒙 佛 菩 薩 等 諸 
T32n1667_001:0587a21	善知識。隨所應化而為現身。或為父母或為	善 知 識 隨 所 應 化 而 為 現 身 或 為 父 母 或 為 
T32n1667_001:0587a22	妻子。或為眷屬或為僕使。或為知友或作怨	妻 子 或 為 眷 屬 或 為 僕 使 或 為 知 友 或 作 怨 
T32n1667_001:0587a23	家。或復示現天王等形。或以四攝或以六度。	家 或 復 示 現 天 王 等 形 或 以 四 攝 或 以 六 度 
T32n1667_001:0587a24	乃至一切菩提行緣。以大悲柔軟心廣大福	乃 至 一 切 菩 提 行 緣 以 大 悲 柔 軟 心 廣 大 福 
T32n1667_001:0587a25	智藏。熏所應化一切眾生。令其見聞及以	智 藏 熏 所 應 化 一 切 眾 生 令 其 見 聞 及 以 
T32n1667_001:0587a26	憶念如來等形增長善根。此緣有二。一近	憶 念 如 來 等 形 增 長 善 根 此 緣 有 二 一 近 
T32n1667_001:0587a27	緣。速得菩提故。二遠緣。久遠方得故。此二差	緣 速 得 菩 提 故 二 遠 緣 久 遠 方 得 故 此 二 差 
T32n1667_001:0587a28	別復各二種。一增行緣。二入道緣。	別 復 各 二 種 一 增 行 緣 二 入 道 緣 
T32n1667_001:0587a29	平等緣者。謂一切諸佛及諸菩薩。以平等智	平 等 緣 者 謂 一切諸佛 及 諸 菩 薩 以 平 等 智 
T32n1667_001:0587b01	慧平等志願。普欲拔濟一切眾生。任運相續	慧 平 等 志 願 普 欲 拔 濟 一 切 眾 生 任 運 相 續 
T32n1667_001:0587b02	常無斷絕。以此智願熏眾生故。令其憶念諸	常 無 斷 絕 以 此 智 願 熏 眾 生 故 令 其 憶 念 諸 
T32n1667_001:0587b03	佛菩薩。或見或聞而作利益。入淨三昧隨所	佛 菩 薩 或 見 或 聞 而 作 利 益 入 淨 三 昧 隨 所 
T32n1667_001:0587b04	斷障得無礙眼。於念念中一切世界平等現	斷 障 得 無 礙 眼 於念念中 一切世界 平 等 現 
T32n1667_001:0587b05	見無量諸佛及諸菩薩。此體用熏復有二別。	見 無 量 諸 佛 及 諸 菩 薩 此 體 用 熏 復 有 二 別 
T32n1667_001:0587b06	一未相應。二已相應。未相應者。謂凡夫二乘	一 未 相 應 二 已 相 應 未 相 應 者 謂 凡 夫 二 乘 
T32n1667_001:0587b07	初行菩薩。以意意識熏。唯依信力修行。未得	初 行 菩 薩 以 意 意 識 熏 唯 依 信 力 修 行 未 得 
T32n1667_001:0587b08	無分別心修行。未與真如體相應故。未得自	無 分 別 心 修 行 未 與 真 如 體 相 應 故 未 得 自 
T32n1667_001:0587b09	在業修行。未與真如用相應故。已相應者。謂	在 業 修 行 未 與 真 如 用 相 應 故 已 相 應 者 謂 
T32n1667_001:0587b10	法身菩薩得無分別心。與一切如來自體相	法身菩薩 得 無 分 別 心 與 一 切 如 來 自 體 相 
T32n1667_001:0587b11	應故。得自在業與一切如來智用相應故。唯	應 故 得 自 在 業 與 一 切 如 來 智 用 相 應 故 唯 
T32n1667_001:0587b12	依法力任運修行。熏習真如滅無明故。復次	依 法 力 任 運 修 行 熏 習 真 如 滅 無 明 故 復 次 
T32n1667_001:0587b13	染熏習。從無始來不斷成佛乃斷。淨熏習。盡	染 熏 習 從無始來 不 斷 成 佛 乃 斷 淨 熏 習 盡 
T32n1667_001:0587b14	於未來畢竟無斷。以真如法熏習故。妄心則	於 未 來 畢 竟 無 斷 以 真 如 法 熏 習 故 妄 心 則 
T32n1667_001:0587b15	滅法身顯現。用熏習起故無有斷。	滅 法 身 顯 現 用 熏 習 起 故 無 有 斷 
T32n1667_001:0587b16	復次真如自體相者。一切凡夫聲聞緣覺菩	復 次 真 如 自 體 相 者 一 切 凡 夫 聲 聞 緣 覺 菩 
T32n1667_001:0587b17	薩諸佛無有增減。非前際生非後際滅常恒	薩 諸 佛 無 有 增 減 非 前 際 生 非 後 際 滅 常 恒 
T32n1667_001:0587b18	究竟。從無始來本性具足一切功德。謂大智	究 竟 從無始來 本 性 具 足 一切功德 謂 大 智 
T32n1667_001:0587b19	慧光明義。遍照法界義。如實了知義。本性清	慧 光 明 義 遍 照 法 界 義 如實了知 義 本 性 清 
T32n1667_001:0587b20	淨心義。常樂我淨義。寂靜不變自在義。如	淨 心 義 常樂我淨 義 寂 靜 不 變 自 在 義 如 
T32n1667_001:0587b21	是等過恒沙數非同非異不思議佛法無有斷	是 等 過 恒 沙 數 非 同 非 異 不 思 議 佛 法 無 有 斷 
T32n1667_001:0587b22	絕。依此義故名如來藏。亦名法身。	絕 依 此 義 故 名 如 來 藏 亦 名 法 身 
T32n1667_001:0587b23	問上說真如離一切相。云何今說具足一切	問 上 說 真 如 離一切相 云 何 今 說 具 足 一 切 
T32n1667_001:0587b24	諸功德相。	諸 功 德 相 
T32n1667_001:0587b25	答雖實具有一切功德。然無差別相。彼一切	答 雖 實 具 有 一切功德 然 無差別相 彼 一 切 
T32n1667_001:0587b26	法皆同一味一真。離分別相無二性故。以依	法 皆 同 一 味 一 真 離 分 別 相 無 二 性 故 以 依 
T32n1667_001:0587b27	業識等生滅相。而立彼一切差別之相。此云	業 識 等 生 滅 相 而 立 彼 一 切 差別之相 此 云 
T32n1667_001:0587b28	何立。以一切法本來唯心實無分別。以不覺	何 立 以 一 切 法 本 來 唯 心 實 無 分 別 以 不 覺 
T32n1667_001:0587b29	故分別心起見有境界。名為無明。心性本淨	故 分 別 心 起 見 有 境 界 名 為 無 明 心 性 本 淨 
T32n1667_001:0587c01	無明不起。即於真如立大智慧光明義。若心	無 明 不 起 即 於 真 如 立 大 智慧光明 義 若 心 
T32n1667_001:0587c02	性見境則有不見之相。心性無見則無不見。	性 見 境 則 有 不 見 之 相 心 性 無 見 則 無 不 見 
T32n1667_001:0587c03	即於真如立遍照法界義。若心有動則非真	即 於 真 如 立 遍 照 法 界 義 若 心 有 動 則 非 真 
T32n1667_001:0587c04	了知。非本性清淨。非常樂我淨。非寂靜。是變	了 知 非 本 性 清 淨 非 常樂我淨 非 寂 靜 是 變 
T32n1667_001:0587c05	異不自在。由是具起過於恒沙虛妄雜染。以	異 不 自 在 由 是 具 起 過 於 恒 沙 虛 妄 雜 染 以 
T32n1667_001:0587c06	心性無動故即立真實了知義。乃至過於恒	心 性 無 動 故 即 立 真 實 了 知 義 乃 至 過 於 恒 
T32n1667_001:0587c07	沙清淨功德相義若心有起見有餘境可分別	沙 清 淨 功 德 相 義 若 心 有 起 見 有 餘 境 可 分 別 
T32n1667_001:0587c08	求。則於內法有所不足。以無邊功德即一心	求 則 於 內 法 有 所 不 足 以 無 邊 功 德 即 一 心 
