T32n1684_001:0772b08	八大靈塔梵讚(西天戒日王製)	八 大 靈 塔 梵 讚 西 天 戒 日 王 製 
T32n1684_001:0772b10	西天譯經三藏朝散大夫試光祿卿	西 天 譯 經 三 藏 朝 散 大 夫 試 光 祿 卿 
T32n1684_001:0772b11	明教大師臣法賢奉　詔譯	明 教 大 師 臣 法 賢 奉 詔 譯 
T32n1684_001:0772b12	惹(引)鼎冒亭鉢囉(二合)嚩囉末覩朗(一句)達哩摩(二合)	惹 引 鼎 冒 亭 鉢 囉 二 合 嚩 囉 末 覩 朗 一 句 達 哩 摩 二 合 
T32n1684_001:0772b13	作訖囉(二合)左囉藐(二)戴帝煬(二合)左(引)禰煬(二合)帝哩	作 訖 囉 二 合 左 囉 藐 二 戴 帝 煬 二 合 左 引 禰 煬 二 合 帝 哩 
T32n1684_001:0772b14	(二合)部嚩那摩呬當(三)室哩(二合引)摩賀(引)鉢囉(一合引)	 二 合 部 嚩 那 摩 呬 當 三 室 哩 二 合 引 摩 賀 引 鉢 囉 一 合 引 
T32n1684_001:0772b15	底賀(引)哩煬(二合四)薩他(二合)難際(引)曩呬摩儗哩	底 賀 引 哩 煬 二 合 四 薩 他 二 合 難 際 引 曩 呬 摩 儗 哩 
T32n1684_001:0772b16	儞羅煬(五)禰(引)縛禰(引)縛(引)嚩多(引)囉(六)滿禰(引)	儞 羅 煬 五 禰 引 縛 禰 引 縛 引 嚩 多 引 囉 六 滿 禰 引 
T32n1684_001:0772b17	喝鉢囉(二合)拏摩多室囉娑(引)儞沒哩(二合)多(引)拽怛	喝 鉢 囉 二 合 拏 摩 多 室 囉 娑 引 儞 沒 哩 二 合 多 引 拽 怛 
T32n1684_001:0772b18	囉(二合)沒馱(引七)吠(引)舍(引)梁(引)達哩摩(二合)作訖麗(二合)室	囉 二 合 沒 馱 引 七 吠 引 舍 引 梁 引 達 哩 摩 二 合 作 訖 麗 二 合 室 
T32n1684_001:0772b19	輸摩儗哩怛致(引八)毘(引)瑟摩(二合)哥(引)踰(引)迭帝(引)	輸 摩 儗 哩 怛 致 引 八 毘 引 瑟 摩 二 合 哥 引 踰 引 迭 帝 引 
T32n1684_001:0772b20	麗(引九)室囉(二合引)嚩薩爹(二合引)冐提暮梨(引)拘尸那	麗 引 九 室 囉 二 合 引 嚩 薩 爹 二 合 引 冐 提 暮 梨 引 拘 尸 那 
T32n1684_001:0772b21	誐囉嚩麗(引十)龍彌儞(引)哥(引)必邏(引)契曳(二合引十一)	誐 囉 嚩 麗 引 十 龍 彌 儞 引 哥 引 必 邏 引 契 曳 二 合 引 十 一 
T32n1684_001:0772b22	憍睒(引)咩(引)薩兔(二合)羅酤瑟致(二合引)末吐囉嚩囉	憍 睒 引 咩 引 薩 兔 二 合 羅 酤 瑟 致 二 合 引 末 吐 囉 嚩 囉 
T32n1684_001:0772b23	補麗(引十二)難那吳播(引)寫囉(引)瑟致麗(三合引十三)曳	補 麗 引 十 二 難 那 吳 播 引 寫 囉 引 瑟 致 麗 三 合 引 十 三 曳 
T32n1684_001:0772b24	(引)左(引)[寧*(尤尢+曳)](切身下同)舍(引)窣都(二合)戴(引)爹(引)捺舍嚩囉	 引 左 引 [寧尤尢曳] 切 身 下 同 舍 引 窣 都 二 合 戴 引 爹 引 捺 舍 嚩 囉 
T32n1684_001:0772b25	嚩里那(引十四)薩旦(二合引)那莫寫(引)彌暮達那(二合引十五)	嚩 里 那 引 十 四 薩 旦 二 合 引 那 莫 寫 引 彌 暮 達 那 二 合 引 十 五 
T32n1684_001:0772b26	割濕彌(二合引)麗(引)際(引)那禰(引)尸(引十六)朅沙怛吒	割 濕 彌 二 合 引 麗 引 際 引 那 禰 引 尸 引 十 六 朅 沙 怛 吒 
T32n1684_001:0772b27	野牟泥(引)末哩嚩(二合)麗(引)星賀梨(引)嚩(引十七)邏(引)	野 牟 泥 引 末 哩 嚩 二 合 麗 引 星 賀 梨 引 嚩 引 十 七 邏 引 
T32n1684_001:0772b28	濃捺麗(二合引)辛度褒捺麗(二合引十八)三摩怛吒摩[卄/(阿可+辛)/女]	濃 捺 麗 二 合 引 辛 度 褒 捺 麗 二 合 引 十 八 三 摩 怛 吒 摩 [卄阿可辛女] 
T32n1684_001:0772b29	提(引)末朅梨(引)酤薩梨(引)嚩(引十九)泥(引)播(引)梨(引)哥	提 引 末 朅 梨 引 酤 薩 梨 引 嚩 引 十 九 泥 引 播 引 梨 引 哥 
T32n1684_001:0772c01	(引)摩嚕閉(引)割羅舍嚩囉補麗(引二十)幹(引)唧騷囉	 引 摩 嚕 閉 引 割 羅 舍 嚩 囉 補 麗 引 二 十 幹 引 唧 騷 囉 
T32n1684_001:0772c02	(引)瑟吒囉(三合)囉(引)瑟吒麗(三合引二十一)曳(引)左(引)[寧*(尤尢+曳)](上同)馱	 引 瑟 吒 囉 三 合 囉 引 瑟 吒 麗 三 合 引 二 十 一 曳 引 左 引 [寧尤尢曳] 上 同 馱 
T32n1684_001:0772c03	(引)覩誐哩婆(二合引)捺舍[口*縳]囉嚩哩那(引二十二)薩旦	 引 覩 誐 哩 婆 二 合 引 捺 舍 [口縳] 囉 嚩 哩 那 引 二 十 二 薩 旦 
T32n1684_001:0772c04	(二合引)那莫寫(引)彌暮達那(二合二十三)該邏(引)細(引)係(引)	 二 合 引 那 莫 寫 引 彌 暮 達 那 二 合 二 十 三 該 邏 引 細 引 係 引 
T32n1684_001:0772c05	末酤(引)致呬摩儗哩儞羅曳(引二十四)滿捺麗(引)彌	末 酤 引 致 呬 摩 儗 哩 儞 羅 曳 引 二 十 四 滿 捺 麗 引 彌 
T32n1684_001:0772c06	(引)嚕室凌(二合)詣(引二十五)播(引)怛(引)梨(引)昧惹演帝(引)達	 引 嚕 室 凌 二 合 詣 引 二 十 五 播 引 怛 引 梨 引 昧 惹 演 帝 引 達 
T32n1684_001:0772c07	那鉢底儞羅曳(引二十六)悉馱巘達哩嚩(二合)路計(引二十七)	那 鉢 底 儞 羅 曳 引 二 十 六 悉 馱 巘 達 哩 嚩 二 合 路 計 引 二 十 七 
T32n1684_001:0772c08	沒囉(二合)吽滿(二合引)尼(引)尾瑟女(二合)部耄(引)鉢輸鉢	沒 囉 二 合 吽 滿 二 合 引 尼 引 尾 瑟 女 二 合 部 耄 引 鉢 輸 鉢 
T32n1684_001:0772c09	帝婆嚩泥(引二十八)贊捺囉(二合)素(引)哩也(引二合)禰路(引)	帝 婆 嚩 泥 引 二 十 八 贊 捺 囉 二 合 素 引 哩 也 引 二 合 禰 路 引 
T32n1684_001:0772c10	計(引二十九)曳(引)左(引)[寧*(尤尢+曳)](上同)馱(引)覩誐哩婆(二合引)捺舍嚩	計 引 二 十 九 曳 引 左 引 [寧尤尢曳] 上 同 馱 引 覩 誐 哩 婆 二 合 引 捺 舍 嚩 
T32n1684_001:0772c11	羅嚩里那(引三十)薩旦(二合引)那莫寫(引)彌暮(引)達那	羅 嚩 里 那 引 三 十 薩 旦 二 合 引 那 莫 寫 引 彌 暮 引 達 那 
T32n1684_001:0772c12	(二合引三十一)曳(引)左(引)瑟誅(吒侯切)馱(引)覩誐哩婆(二合)捺舍	 二 合 引 三 十 一 曳 引 左 引 瑟 誅 吒 侯 切 馱 引 覩 誐 哩 婆 二 合 捺 舍 
T32n1684_001:0772c13	嚩羅嚩里那(三十二)功婆僧倪也(二合)室左(二合)載爹(引三	嚩 羅 嚩 里 那 三 十 二 功 婆 僧 倪 也 二 合 室 左 二 合 載 爹 引 三 
T32n1684_001:0772c14	十三)盎誐(引)囉契也(二合引)薩怛(二合)他(引)[寧*(尤尢+曳)](上同)呬摩囉	十 三 盎 誐 引 囉 契 也 二 合 引 薩 怛 二 合 他 引 [寧尤尢曳] 上 同 呬 摩 囉 
T32n1684_001:0772c15	惹多儞婆(引三十四)窣都(二合引)波囉怛那(二合)鉢囉(二合)哥	惹 多 儞 婆 引 三 十 四 窣 都 二 合 引 波 囉 怛 那 二 合 鉢 囉 二 合 哥 
T32n1684_001:0772c16	(引)舍(引三十五)播(引)多(引)梨(引)曳(引)左部咩(引)儗哩室	 引 舍 引 三 十 五 播 引 多 引 梨 引 曳 引 左 部 咩 引 儗 哩 室 
T32n1684_001:0772c17	朅囉誐多(引三十六)薩哩嚩(二合)都(引)馱(引)覩誐哩婆(二合	朅 囉 誐 多 引 三 十 六 薩 哩 嚩 二 合 都 引 馱 引 覩 誐 哩 婆 二 合 
T32n1684_001:0772c18	引三十七)沒馱(引)喃(引)夜(引)儞泯摩(引)鉢囉(二合)底禰那	引 三 十 七 沒 馱 引 喃 引 夜 引 儞 泯 摩 引 鉢 囉 二 合 底 禰 那 
T32n1684_001:0772c19	摩設訖哩(二合三十八)多(引)儞暮(引)達那(二合引)那摩(引)彌	摩 設 訖 哩 二 合 三 十 八 多 引 儞 暮 引 達 那 二 合 引 那 摩 引 彌 
T32n1684_001:0772c20	(三十九)阿瑟吒(二合)摩賀(引)載爹滿捺那三摩鉢多(一合	 三 十 九 阿 瑟 吒 二 合 摩 賀 引 載 爹 滿 捺 那 三 摩 鉢 多 一 合 
T32n1684_001:0772c21	四十)	四 十 
T32n1684_001:0772c22	八大靈塔梵讚	八 大 靈 塔 梵 讚 
