T33n1698_001:0081b17	今欲明無所有故須將來釋。若橫論破病則	今 欲 明 無 所 有 故 須 將 來 釋 若 橫 論 破 病 則 
T33n1698_001:0081b18	實是一無所有。若竪論望道即無所有而不	實 是 一 無 所 有 若 竪 論 望 道 即 無 所 有 而 不 
T33n1698_001:0081b19	無所有。此三假亦然能成能破故。既言假有	無 所 有 此 三 假 亦 然 能 成 能 破 故 既 言 假 有 
T33n1698_001:0081b20	竟何所有。既言假有何為而不有。初約釋尊	竟 何 所 有 既 言 假 有 何 為 而 不 有 初 約 釋 尊 
T33n1698_001:0081b21	因無所有。次約如來果無所有。後約菩薩化	因 無 所 有 次 約 如 來 果 無 所 有 後 約 菩 薩 化 
T33n1698_001:0081b22	他明無所有。就因中更為三。初佛告下釋因	他 明 無 所 有 就 因 中 更 為 三 初 佛 告 下 釋 因 
T33n1698_001:0081b23	無所有。次然燈下引證。後如是。如是下佛述。	無 所 有 次 然 燈 下 引 證 後 如 是 如 是 下 佛 述 
T33n1698_001:0081b24	釋中又三。初明得次明失後雙釋得失。初	釋 中 又 三 初 明 得 次 明 失 後 雙 釋 得 失 初 
T33n1698_001:0081b25	明發心欲度眾生起弘誓願。我當滅度一切	明 發 心 欲 度 眾 生 起 弘 誓 願 我 當 滅 度 一 切 
T33n1698_001:0081b26	眾生。實無眾生得滅度者。此明菩薩知眾生	眾 生 實 無 眾 生 得滅度者 此 明 菩 薩 知 眾 生 
T33n1698_001:0081b27	如有何可滅。若實有眾生可度釋論云菩薩	如 有 何 可 滅 若 實 有 眾 生 可 度 釋 論 云 菩 薩 
T33n1698_001:0081b28	得殺眾生罪。又大品如化品佛語須菩提。諸	得 殺 眾 生 罪 又 大 品 如 化 品 佛 語 須 菩 提 諸 
T33n1698_001:0081b29	法本有今無耶。此即責須菩提意。眾生非本	法 本 有 今 無 耶 此 即 責 須 菩 提 意 眾 生 非 本 
T33n1698_001:0081c01	時有今時無何須慰喻始行菩薩。本自無生	時 有 今 時 無 何 須 慰 喻 始 行 菩 薩 本 自 無 生 
T33n1698_001:0081c02	今何可滅也。二何以故下明失。若菩薩有我	今 何 可 滅 也 二 何 以 故 下 明 失 若 菩 薩 有 我 
T33n1698_001:0081c03	人等相即非菩薩。以失明得理可知矣。所以	人 等 相 即 非 菩 薩 以 失 明 得 理 可 知 矣 所 以 
T33n1698_001:0081c04	者何下雙釋得失。無發心者故知無我即	者 何 下 雙 釋 得 失 無 發 心 者 故 知 無 我 即 
T33n1698_001:0081c05	行人空計我有惑。故非菩薩。於意云何下	行 人 空 計 我 有 惑 故 非 菩 薩 於意云何 下 
T33n1698_001:0081c06	第二引證。證中有問答。初問中即引自昔得	第 二 引 證 證 中 有 問 答 初 問 中 即 引 自 昔 得 
T33n1698_001:0081c07	記之解以證前說。次今答中無有法得菩提。	記 之 解 以 證 前 說 次 今 答 中 無 有 法 得 菩 提 
T33n1698_001:0081c08	聖心難測義推可圖。得記由於無相。無相之	聖 心 難 測 義 推 可 圖 得 記 由 於 無 相 無 相 之 
T33n1698_001:0081c09	中即無所得也。如是如是下第三佛述如	中 即 無 所 得 也 如是如是 下 第 三 佛 述 如 
T33n1698_001:0081c10	汝所說者。在因時已自無所有故。無所得菩	汝 所 說 者 在 因 時 已 自 無 所 有 故 無 所 得 菩 
T33n1698_001:0081c11	提佛與我記。若見有法則乖菩提。何容得記	提 佛 與 我 記 若 見 有 法 則 乖 菩 提 何 容 得 記 
T33n1698_001:0081c12	無法得菩提。是故然燈佛受記無法則會理	無 法 得 菩 提 是 故 然 燈 佛 受 記 無 法 則 會 理 
T33n1698_001:0081c13	會理則向極故得記也。何以故下第二是明	會 理 則 向 極 故 得 記 也 何 以 故 下 第 二 是 明 
T33n1698_001:0081c14	果無所有。有三義。初明如次證後譬。初即此	果 無 所 有 有 三 義 初 明 如 次 證 後 譬 初 即 此 
T33n1698_001:0081c15	是果人同如。同如故無所有。諸法性空理無	是 果 人 同 如 同 如 故 無 所 有 諸 法 性 空 理 無 
T33n1698_001:0081c16	乖異謂之為如。會如解極故名如來也。若有	乖 異 謂 之 為 如 會 如 解 極 故 名 如 來 也 若 有 
T33n1698_001:0082a01	人言如來得菩提下。若有說如來得菩提	人 言 如 來 得 菩 提 下 若 有 說 如 來 得 菩 提 
T33n1698_001:0082a02	者。此人俗間語非理言也。實無有法得菩提	者 此 人 俗 間 語 非 理 言 也 實 無 有 法 得 菩 提 
T33n1698_001:0082a03	佛人也。菩提道也。既無人法誰得菩提。無實	佛 人 也 菩 提 道 也 既 無 人 法 誰 得 菩 提 無 實 
T33n1698_001:0082a04	無虛者是非。既盡則會菩提。菩提之中不見	無 虛 者 是 非 既 盡 則 會 菩 提 菩 提 之 中 不 見 
T33n1698_001:0082a05	是非。非實即無是非虛即無非也。是故如來	是 非 非 實 即 無 是 非 虛 即 無 非 也 是 故 如 來 
T33n1698_001:0082a06	說一切法下第二證如來無所有。如來在一	說 一 切 法 下 第 二 證 如 來 無 所 有 如 來 在 一 
T33n1698_001:0082a07	切數故。凡夫違一切法為邪。聖人順一切法	切 數 故 凡 夫 違 一 切 法 為 邪 聖 人 順 一 切 法 
T33n1698_001:0082a08	為正。正即覺悟故皆佛法矣。譬如身長大下	為 正 正 即 覺 悟 故 皆 佛 法 矣 譬 如 身 長 大 下 
T33n1698_001:0082a09	第三說非果而果。直舉人身類上諸法。緣假	第 三 說 非 果 而 果 直 舉 人 身 類 上 諸 法 緣 假 
T33n1698_001:0082a10	故長大無性即非身。既非般若為般若者寧	故 長 大 無 性 即 非 身 既 非 般 若 為 般 若 者 寧 
T33n1698_001:0082a11	不以非身為身耶。若菩薩作是言下第三明	不 以 非 身 為 身 耶 若 菩 薩 作 是 言 下 第 三 明 
T33n1698_001:0082a12	菩薩化他無所有　初明化人次引佛說為證	菩 薩 化 他 無 所 有 初 明 化 人 次 引 佛 說 為 證 
T33n1698_001:0082a13	後明嚴土。初滅度眾生不名菩薩。元無眾生	後 明 嚴 土 初 滅 度 眾 生 不 名 菩 薩 元 無 眾 生 
T33n1698_001:0082a14	橫見眾生見。即乖道非菩薩也。何以故下釋	橫 見 眾 生 見 即 乖 道 非 菩 薩 也 何 以 故 下 釋 
T33n1698_001:0082a15	菩薩自無何有眾生二是故佛說下引證無	菩 薩 自 無 何 有 眾 生 二 是 故 佛 說 下 引 證 無 
T33n1698_001:0082a16	菩薩亦無眾生。一切法都無我人也。三若菩	菩 薩 亦 無 眾 生 一 切 法 都 無 我 人 也 三 若 菩 
T33n1698_001:0082a17	薩言莊嚴佛土者。虛襟進道嚴土濟物。濟物	薩 言 莊 嚴 佛 土 者 虛 襟 進 道 嚴 土 濟 物 濟 物 
T33n1698_001:0082a18	之行方便慧也。解空無相謂之為慧。若言我	之 行 方 便 慧 也 解 空 無 相 謂 之 為 慧 若 言 我 
T33n1698_001:0082a19	能莊嚴國土眾生可化見惑違道。何名菩薩	能 莊 嚴 國 土 眾 生 可 化 見 惑 違 道 何 名 菩 薩 
T33n1698_001:0082a20	也。何以故如來說非莊嚴是名莊嚴者。無存	也 何 以 故 如 來 說 非 莊 嚴 是 名 莊 嚴 者 無 存 
T33n1698_001:0082a21	於化而土自嚴也。明應住義受假竟。若菩薩	於 化 而 土 自 嚴 也 明 應 住 義 受 假 竟 若 菩 薩 
T33n1698_001:0082a22	通達無我法者下。第二明名假無所有。文二	通 達 無 我 法 者 下 第 二 明 名 假 無 所 有 文 二 
T33n1698_001:0082a23	初通達無我。既云一切法皆無所有。何名菩	初 通 達 無 我 既 云 一 切 法 皆 無 所 有 何 名 菩 
T33n1698_001:0082a24	薩。今實無一切諸法。而今言菩薩但有其名。	薩 今 實 無 一切諸法 而 今 言 菩 薩 但 有 其 名 
T33n1698_001:0082a25	今明此名亦無所有故。何名此為菩薩。通達	今 明 此 名 亦 無 所 有 故 何 名 此 為 菩 薩 通 達 
T33n1698_001:0082a26	諸法無我等相故名菩薩。真菩薩故。所以能	諸法無我 等 相 故 名 菩 薩 真 菩 薩 故 所 以 能 
T33n1698_001:0082a27	通達無我。二立真解。通達非偽真菩薩也。	通 達 無 我 二 立 真 解 通 達 非 偽 真 菩 薩 也 
T33n1698_001:0082a28	名假竟。五眼下第三明法假無所有。即上如	名 假 竟 五 眼 下 第 三 明 法 假 無 所 有 即 上 如 
T33n1698_001:0082a29	來悉知見是人。其文又三。初明智慧。次明	來 悉 知 見 是 人 其 文 又 三 初 明 智 慧 次 明 
T33n1698_001:0082b01	心。後明功德。法雖多不過功德智慧二種嚴。	心 後 明 功 德 法 雖 多 不 過 功 德 智 慧 二 種 嚴 
T33n1698_001:0082b02	心為其體故備空也。此是初明智慧空。智慧	心 為 其 體 故 備 空 也 此 是 初 明 智 慧 空 智 慧 
T33n1698_001:0082b03	雖多不過五眼。舊云肉眼見障內。天眼見障	雖 多 不 過 五 眼 舊 云 肉 眼 見 障 內 天 眼 見 障 
T33n1698_001:0082b04	外。慧眼見真。法眼見俗。佛眼通知內外法。今	外 慧 眼 見 真 法 眼 見 俗 佛 眼 通 知 內 外 法 今 
T33n1698_001:0082b05	言但是一智差別說之故有五耳。釋論云。法	言 但 是 一 智 差 別 說 之 故 有 五 耳 釋 論 云 法 
T33n1698_001:0082b06	眼知聲聞緣覺等法故名法眼。是以知俗名	眼 知 聲 聞 緣 覺 等 法 故 名 法 眼 是 以 知 俗 名 
T33n1698_001:0082b07	法眼。然此中本明智慧空而直辨五眼。不言	法 眼 然 此 中 本 明 智 慧 空 而 直 辨 五 眼 不 言 
T33n1698_001:0082b08	其空者意現於後。後既將智體心空。智寧不	其 空 者 意 現 於 後 後 既 將 智 體 心 空 智 寧 不 
T33n1698_001:0082b09	空。後明功德空。前智豈不空。以前明智有後	空 後 明 功 德 空 前 智 豈 不 空 以 前 明 智 有 後 
T33n1698_001:0082b10	明功德無。無有雖殊致不乖也。二恒河中	明 功 德 無 無 有 雖 殊 致 不 乖 也 二 恒 河 中 
T33n1698_001:0082b11	去是明心無所有。以舉恒沙等來。為欲校量	去 是 明 心 無 所 有 以 舉 恒 沙 等 來 為 欲 校 量 
T33n1698_001:0082b12	取心明其空耳。如來說心皆為非心。只以非	取 心 明 其 空 耳 如 來 說 心 皆 為 非 心 只 以 非 
T33n1698_001:0082b13	心為心此與前不異。五眼照。理無不周備。舉	心 為 心 此 與 前 不 異 五 眼 照 理 無 不 周 備 舉 
T33n1698_001:0082b14	色心收境盡矣。三世不可得說非心名心。何	色 心 收 境 盡 矣 三 世 不可得說 非 心 名 心 何 
T33n1698_001:0082b15	者以三世心無性可得故。可從緣而生心也。	者 以 三 世 心 無 性 可 得 故 可 從 緣 而 生 心 也 
T33n1698_001:0082b16	三若人滿三千七寶布施下明功德無所有。	三 若 人 滿 三 千 七 寶 布 施 下 明 功 德 無 所 有 
T33n1698_001:0082b17	明福有實。此即有量豈得多耶。以無福為福	明 福 有 實 此 即 有 量 豈 得 多 耶 以 無 福 為 福 
T33n1698_001:0082b18	故多也。金玉無性故可積滿三千。福德無實	故 多 也 金 玉 無 性 故 可 積 滿 三 千 福 德 無 實 
T33n1698_001:0082b19	則可曠施而多心之無性。惑滅解生也。法假	則 可 曠 施 而 多 心 之 無 性 惑 滅 解 生 也 法 假 
T33n1698_001:0082b20	竟佛可以色身見下第二明經名。初名次行。	竟 佛 可 以 色 身 見 下 第 二 明 經 名 初 名 次 行 
T33n1698_001:0082b21	名中有三初身相次說法後福多。色身者法	名 中 有 三 初 身 相 次 說 法 後 福 多 色 身 者 法 
T33n1698_001:0082b22	身如空月。色身若水像。世間之色無實可覩。	身 如 空 月 色 身 若 水 像 世 間 之 色 無 實 可 覩 
T33n1698_001:0082b23	尋其本實即法身也。慧為萬善之主施為眾	尋 其 本 實 即 法 身 也 慧 為 萬 善 之 主 施 為 眾 
T33n1698_001:0082b24	行之首。總為丈六金容別則眾相。云娑婆隨	行 之 首 總 為 丈 六 金 容 別 則 眾 相 云 娑 婆 隨 
T33n1698_001:0082b25	現則為相豈。可一方盡極。我當有所說法下	現 則 為 相 豈 可 一 方 盡 極 我 當 有 所 說 法 下 
T33n1698_001:0082b26	第二明說法又二。初正對上名。道成應出說	第 二 明 說 法 又 二 初 正 對 上 名 道 成 應 出 說 
T33n1698_001:0082b27	法化人。謬傳毀聖名為謗佛。無法可說是名	法 化 人 謬 傳 毀 聖 名 為 謗 佛 無 法 可 說 是 名 
T33n1698_001:0082b28	說法。故傳說法之意向言無說。非杜默不語	說 法 故 傳 說 法 之 意 向 言 無 說 非 杜 默 不 語 
T33n1698_001:0082b29	但無存而說。即說滿天下無乖法理之過也。	但 無 存 而 說 即 說 滿 天 下 無 乖 法 理 之 過 也 
T33n1698_001:0082c01	佛得菩提下第二明習應。有問答前應後習	佛 得 菩 提 下 第 二 明 習 應 有 問 答 前 應 後 習 
T33n1698_001:0082c02	佛人也菩提道也。佛得道故說以示人。而言	佛 人 也 菩 提 道 也 佛 得 道 故 說 以 示 人 而 言 
T33n1698_001:0082c03	無法可說未審得道不。答中乃至無有少法	無 法 可 說 未 審 得 道 不 答 中 乃 至 無 有 少 法 
T33n1698_001:0082c04	可得。相盡虛通謂之菩提。菩提無相有何可	可 得 相 盡 虛 通 謂 之 菩 提 菩 提 無 相 有 何 可 
T33n1698_001:0082c05	得。寂滅無得道之至也。是法平等下結成菩	得 寂 滅 無 得 道 之 至 也 是 法 平 等 下 結 成 菩 
T33n1698_001:0082c06	提義也。人無貴賤法無好醜。平等菩提義也	提 義 也 人 無 貴 賤 法 無 好 醜 平 等 菩 提 義 也 
T33n1698_001:0082c07	無我無人修一切善者即是修義。夫形端故	無 我 無 人 修 一 切 善 者 即 是 修 義 夫 形 端 故 
T33n1698_001:0082c08	影直聲和則響順。忘我人而修因必尅無相	影 直 聲 和 則 響 順 忘 我 人 而 修 因 必 尅 無 相 
T33n1698_001:0082c09	之菩提。所言善法者人既不有善何得實耶。	之 菩 提 所 言 善 法 者 人 既 不 有 善 何 得 實 耶 
T33n1698_001:0082c10	善是離惡之名法是軌持之義。三千世界中	善 是 離 惡 之 名 法 是 軌 持 之 義 三千世界 中 
T33n1698_001:0082c11	山王七寶下第三明福多。聚寶有盡妙解無	山 王 七 寶 下 第 三 明 福 多 聚 寶 有 盡 妙 解 無 
T33n1698_001:0082c12	窮。一偈法寶勝無量珍也。我當度眾生下。	窮 一 偈 法 寶 勝 無 量 珍 也 我 當 度 眾 生 下 
T33n1698_001:0082c13	菩提無得為果故以忘言而說。勿謂如來見	菩 提 無 得 為 果 故 以 忘 言 而 說 勿 謂 如 來 見 
T33n1698_001:0082c14	眾生可度。若見有眾生則為我見何謂如來。	眾 生 可 度 若 見 有 眾 生 則 為 我 見 何 謂 如 來 
T33n1698_001:0082c15	但說假名我耳。非實我。而凡夫者聞說假名	但 說 假 名 我 耳 非 實 我 而 凡 夫 者 聞 說 假 名 
T33n1698_001:0082c16	不達言旨以為實我。如來說非凡夫者。凡夫	不 達 言 旨 以 為 實 我 如 來 說 非 凡 夫 者 凡 夫 
T33n1698_001:0083a01	不實故可化而成佛也。可以三十二相觀如	不 實 故 可 化 而 成 佛 也 可 以 三十二相 觀 如 
T33n1698_001:0083a02	來下二辨行就。文有五。一正觀問二邪答三	來 下 二 辨 行 就 文 有 五 一 正 觀 問 二 邪 答 三 
T33n1698_001:0083a03	佛難四領解五佛舉正義為釋。初以問疑者	佛 難 四 領 解 五 佛 舉 正 義 為 釋 初 以 問 疑 者 
T33n1698_001:0083a04	謂眾生是有可化而聖。法身不無可以妙相	謂 眾 生 是 有 可 化 而 聖 法 身 不 無 可 以 妙 相 
T33n1698_001:0083a05	而期。故問之也。次邪答者。聽者實爾用三	而 期 故 問 之 也 次 邪 答 者 聽 者 實 爾 用 三 
T33n1698_001:0083a06	十二相是如來也。三難。輪王是佛即以近	十 二 相 是 如 來 也 三 難 輪 王 是 佛 即 以 近 
T33n1698_001:0083a07	事質之令其自解。四信解。不應。時情謂然	事 質 之 令 其 自 解 四 信 解 不 應 時 情 謂 然 
T33n1698_001:0083a08	我解不爾。五佛舉正釋者。五色煥眼而非	我 解 不 爾 五 佛 舉 正 釋 者 五 色 煥 眼 而 非 
T33n1698_001:0083a09	形。八音盈耳而非聲。偏謬為邪愚邪隔不見	形 八 音 盈 耳 而 非 聲 偏 謬 為 邪 愚 邪 隔 不 見 
T33n1698_001:0083a10	也。若作念下第三功用無所有。即是有不斷	也 若 作 念 下 第 三 功 用 無 所 有 即 是 有 不 斷 
T33n1698_001:0083a11	滅義。有因有果一切宛然。即是般若方便用。	滅 義 有 因 有 果 一 切 宛 然 即 是 般 若 方 便 用 
T33n1698_001:0083a12	論云得般若氣分故有居空涉有之用。無復	論 云 得 般 若 氣 分 故 有 居 空 涉 有 之 用 無 復 
T33n1698_001:0083a13	滯閡。此下去不說諸法斷滅就文有二。初	滯 閡 此 下 去 不 說 諸 法 斷 滅 就 文 有 二 初 
T33n1698_001:0083a14	果次因。有義雖多不過因果。明果中二。初	果 次 因 有 義 雖 多 不 過 因 果 明 果 中 二 初 
T33n1698_001:0083a15	誡次明有。汝莫作念誡也。勿言諸法一向	誡 次 明 有 汝 莫 作 念 誡 也 勿 言 諸 法 一 向 
T33n1698_001:0083a16	無所有。故謂不以具足相得菩提。不偏在色	無 所 有 故 謂 不 以 具 足 相 得 菩 提 不 偏 在 色 
T33n1698_001:0083a17	聲故向言非。非不身相故復言是也。發阿耨	聲 故 向 言 非 非 不 身 相 故 復 言 是 也 發 阿 耨 
T33n1698_001:0083a18	下第二明因亦二。前誡後明有。莫起斷滅。	下 第 二 明 因 亦 二 前 誡 後 明 有 莫 起 斷 滅 
T33n1698_001:0083a19	相盡寂滅故不有。道王十方非謂無。應畢而	相 盡 寂 滅 故 不 有 道 王 十 方 非 謂 無 應 畢 而 
T33n1698_001:0083a20	謝即不常。感至隨現故不斷體合中道軌物	謝 即 不 常 感 至 隨 現 故 不 斷 體 合 中 道 軌 物 
T33n1698_001:0083a21	之式。限之一方豈不謬哉。若人滿恒沙七寶	之 式 限 之 一 方 豈 不 謬 哉 若 人 滿 恒 沙 七 寶 
T33n1698_001:0083a22	下結般若成忍。就文復三。初明體道成忍之	下 結 般 若 成 忍 就 文 復 三 初 明 體 道 成 忍 之 
T33n1698_001:0083a23	行無所有。次明體道證忍之人無所有。三明	行 無 所 有 次 明 體 道 證 忍 之 人 無 所 有 三 明 
T33n1698_001:0083a24	體道行忍之用無所有。以行成人人故有用	體 道 行 忍 之 用 無 所 有 以 行 成 人 人 故 有 用 
T33n1698_001:0083a25	備明無所有。就忍行中先校量。次若復有	備 明 無 所 有 就 忍 行 中 先 校 量 次 若 復 有 
T33n1698_001:0083a26	人下明成忍之行無所有。忘我則忍成超出	人 下 明 成 忍 之 行 無 所 有 忘 我 則 忍 成 超 出 
T33n1698_001:0083a27	故勝也。白佛下第二明體道證忍之人無所	故 勝 也 白 佛 下 第 二 明 體 道 證 忍 之 人 無 所 
T33n1698_001:0083a28	有。初明因人不受。後明果人不受。初明因中	有 初 明 因 人 不 受 後 明 果 人 不 受 初 明 因 中 
T33n1698_001:0083a29	有問答。乃云不受亦不受。受其報種已名貪	有 問 答 乃 云 不 受 亦 不 受 受 其 報 種 已 名 貪 
T33n1698_001:0083b01	著。無存我人邪染何生次若來若去下明果	著 無 存 我 人 邪 染 何 生 次 若 來 若 去 下 明 果 
T33n1698_001:0083b02	人不受。若言從真如實際中來。善逝自及化	人 不 受 若 言 從 真 如 實 際 中 來 善 逝 自 及 化 
T33n1698_001:0083b03	人去至涅槃。皆是不解佛所說義。如來道蔭	人 去 至 涅 槃 皆 是 不 解 佛 所 說 義 如 來 道 蔭 
T33n1698_001:0083b04	之主。世界權應之宅。眾生慈育之子。舉此三	之 主 世 界 權 應 之 宅 眾 生 慈 育 之 子 舉 此 三 
T33n1698_001:0083b05	事大旨彰矣。無來無去。故名如來。解極會如	事 大 旨 彰 矣 無 來 無 去 故 名 如 來 解 極 會 如 
T33n1698_001:0083b06	體無方所。緣至物見來無所從感畢為隱。亦	體 無 方 所 緣 至 物 見 來 無 所 從 感 畢 為 隱 亦 
T33n1698_001:0083b07	何所去也。若三千碎塵下第三明體道行忍	何 所 去 也 若 三 千 碎 塵 下 第 三 明 體 道 行 忍 
T33n1698_001:0083b08	之用有四。初明碎塵用二碎界用。三碎合相	之 用 有 四 初 明 碎 塵 用 二 碎 界 用 三 碎 合 相 
T33n1698_001:0083b09	用四碎諸見用。以微塵成世界有合。世界有	用 四 碎 諸 見 用 以 微 塵 成 世 界 有 合 世 界 有 
T33n1698_001:0083b10	合故起見。見者即失。謂有此四妄想得者非	合 故 起 見 見 者 即 失 謂 有 此 四 妄 想 得 者 非 
T33n1698_001:0083b11	見為見。乃至非塵為塵為得。此四並是般若	見 為 見 乃 至 非 塵 為 塵 為 得 此 四 並 是 般 若 
T33n1698_001:0083b12	用。塵界等是依報。見是正報。合通色心。即此	用 塵 界 等 是 依 報 見 是 正 報 合 通 色 心 即 此 
T33n1698_001:0083b13	下是碎塵用。善男子並是大行。同華嚴中說	下 是 碎 塵 用 善 男 子 並 是 大 行 同 華 嚴 中 說 
T33n1698_001:0083b14	佛說非微塵為微塵。次三千下明成世界用。	佛 說 非 微 塵 為 微 塵 次 三 千 下 明 成 世 界 用 
T33n1698_001:0083b15	微塵非實故可碎而為多。世界非有則可假	微 塵 非 實 故 可 碎 而 為 多 世 界 非 有 則 可 假 
T33n1698_001:0083b16	借而成也。三一合相下破一合相。以非合為	借 而 成 也 三 一 合 相 下 破 一 合 相 以 非 合 為 
T33n1698_001:0083b17	合故是不可說。只復言是合。此復非復是故	合 故 是 不 可 說 只 復 言 是 合 此 復 非 復 是 故 
T33n1698_001:0083b18	假名說合。何為而非合以非合為合竟何有	假 名 說 合 何 為 而 非 合 以 非 合 為 合 竟 何 有 
T33n1698_001:0083b19	合。大經四句皆不可說。有因緣故亦可得說。	合 大 經 四 句 皆 不 可 說 有因緣故 亦 可 得 說 
T33n1698_001:0083b20	今亦無合假說合耳。中論大品皆破合。當知	今 亦 無 合 假 說 合 耳 中 論 大 品 皆 破 合 當 知 
T33n1698_001:0083b21	無合今經中說合順俗假說耳。凡夫貪著其	無 合 今 經 中 說 合 順 俗 假 說 耳 凡 夫 貪 著 其 
T33n1698_001:0083b22	事不知事即理。理無所有即是事無所有。何	事 不 知 事 即 理 理 無 所 有 即 是 事 無 所 有 何 
T33n1698_001:0083b23	故非世界名世界。若是實有即應一性合不	故 非 世 界 名 世 界 若 是 實 有 即 應 一 性 合 不 
T33n1698_001:0083b24	可分。假眾生名一無合可得。假名無體不可	可 分 假 眾 生 名 一 無 合 可 得 假 名 無 體 不 可 
T33n1698_001:0083b25	實說。疑惑則凡夫貪著故計實。四佛說我見	實 說 疑 惑 則 凡 夫 貪 著 故 計 實 四 佛 說 我 見 
T33n1698_001:0083b26	下明破諸見用。凡夫謂諸見決定是見。今佛	下 明 破 諸 見 用 凡 夫 謂 諸 見 決 定 是 見 今 佛 
T33n1698_001:0083b27	說非見以本來無所有。諸見非實可改為正。	說 非 見 以 本 來 無 所 有 諸 見 非 實 可 改 為 正 
T33n1698_001:0083b28	眾生虛假從凡至聖。正說意。從發菩提去第	眾 生 虛 假 從 凡 至 聖 正 說 意 從 發 菩 提 去 第 
T33n1698_001:0083b29	三流通叚。非止近益當時。亦乃遠傳千載。	三 流 通 叚 非 止 近 益 當 時 亦 乃 遠 傳 千 載 
T33n1698_001:0083c01	文為二初付囑次奉行。付囑又三初正付囑	文 為 二 初 付 囑 次 奉 行 付 囑 又 三 初 正 付 囑 
T33n1698_001:0083c02	次校量後方法。始終既畢故指宗勸人。凡欲	次 校 量 後 方 法 始 終 既 畢 故 指 宗 勸 人 凡 欲 
T33n1698_001:0083c03	發心成佛淨國土化眾生。當如上所說理而	發 心 成 佛 淨 國 土 化 眾 生 當 如上所說 理 而 
T33n1698_001:0083c04	生知見也。如是信解者理深未明推信為解	生 知 見 也 如 是 信 解 者 理 深 未 明 推 信 為 解 
T33n1698_001:0083c05	耳。不生法相但是虛假非實法也。如來說非	耳 不 生 法 相 但 是 虛 假 非 實 法 也 如 來 說 非 
T33n1698_001:0083c06	法相是名法相。相窮理盡明。其唯如來說言	法 相 是 名 法 相 相 窮 理 盡 明 其 唯 如 來 說 言 
T33n1698_001:0083c07	非實故應從信矣。二阿僧祇七寶下校量流	非 實 故 應 從 信 矣 二 阿 僧 祇 七 寶 下 校 量 流 
T33n1698_001:0083c08	通。七寶有竭四句無窮。明以無所得心指經	通 七 寶 有 竭 四 句 無 窮 明 以 無 所 得 心 指 經 
T33n1698_001:0083c09	一偈。其福勝彼有所得施。三云何為人下後	一 偈 其 福 勝 彼 有 所 得 施 三 云 何 為 人 下 後 
T33n1698_001:0083c10	方法。初標次釋。釋中有止有觀。弘通此經若	方 法 初 標 次 釋 釋 中 有 止 有 觀 弘 通 此 經 若 
T33n1698_001:0083c11	為方法。須不取法相須如真如。上如是智下	為 方 法 須 不 取 法 相 須 如 真 如 上 如 是 智 下 
T33n1698_001:0083c12	如是境。心境符合故得不動。不動空有等法。	如 是 境 心 境 符 合 故 得 不 動 不 動 空 有 等 法 
T33n1698_001:0083c13	何以故下一偈明觀。觀諸法夢幻等。而為	何 以 故 下 一 偈 明 觀 觀 諸 法 夢 幻 等 而 為 
T33n1698_001:0084a01	人說句偈有真實。及有此假有也。大品十喻	人 說 句 偈 有 真 實 及 有 此 假 有 也 大 品 十 喻 
T33n1698_001:0084a02	一幻二焰三水月四虛空五響六乾城七夢八	一 幻 二 焰 三 水 月 四 虛 空 五 響 六 乾 城 七 夢 八 
T33n1698_001:0084a03	影九鏡像十化。此中舉六。論本明九然流通	影 九 鏡 像 十 化 此 中 舉 六 論 本 明 九 然 流 通 
