T33n1706_002:0292a24	般若。亦於其處以其勝一也。然於餘處說經。	般 若 亦 於 其 處 以 其 勝 一 也 然 於 餘 處 說 經 
T33n1706_002:0292a25	豈必不勝邪。故知偏強之說。一往云爾。列同	豈 必 不 勝 邪 故 知 偏 強 之 說 一 往 云 爾 列 同 
T33n1706_002:0292a26	聞眾。謂比丘等三乘之別。同聞如來一音之	聞 眾 謂 比 丘 等 三 乘 之 別 同 聞 如 來 一 音 之 
T33n1706_002:0292a27	教。故曰同聞。而設化有權實。得益有淺深。故	教 故 曰 同 聞 而 設 化 有 權 實 得 益 有 淺 深 故 
T33n1706_002:0292a28	有發起影響當機結緣四種之別云云。問諸	有 發 起 影 響 當 機 結 緣 四 種 之 別 云 云 問 諸 
T33n1706_002:0292a29	經列眾。或云三乘人天或比丘等四。今何特	經 列 眾 或 云 三 乘 人 天 或 比 丘 等 四 今 何 特 
T33n1706_002:0292b01	異云發起等耶。答中或有言三乘從人列也。	異 云 發 起 等 耶 答 中 或 有 言 三 乘 從 人 列 也 
T33n1706_002:0292b02	言發起等以類言也。若從人列經亦言之。但	言 發 起 等 以 類 言 也 若 從 人 列 經 亦 言 之 但 
T33n1706_002:0292b03	今先以類論。故言一者影響二者發起等。然	今 先 以 類 論 故 言 一 者 影 響 二 者 發 起 等 然 
T33n1706_002:0292b04	言人而不言類。則眾故多端不一而足也。言	言 人 而 不 言 類 則 眾 故 多 端 不 一 而 足 也 言 
T33n1706_002:0292b05	類而不言人。則類必統攝。雖有諸四眾而義	類 而 不 言 人 則 類 必 統 攝 雖 有 諸 四 眾 而 義 
T33n1706_002:0292b06	必通收。要不出權實淺深故也。今約一眾而	必 通 收 要 不 出 權 實 淺 深 故 也 今 約 一 眾 而 
T33n1706_002:0292b07	開四類。則眾眾皆四。有何一眾而不攝耶。何	開 四 類 則 眾 眾 皆 四 有 何 一 眾 而 不 攝 耶 何 
T33n1706_002:0292b08	一機而不辯邪。此特言類不言人之所以也。	一 機 而 不 辯 邪 此 特 言 類 不 言 人 之 所 以 也 
T33n1706_002:0292b09	又曰比丘比丘尼等各有四義者。則以人從	又 曰 比 丘 比 丘 尼 等 各 有 四 義 者 則 以 人 從 
T33n1706_002:0292b10	類言也。論三乘等列次前後可知。言菩薩心	類 言 也 論 三 乘 等 列 次 前 後 可 知 言 菩 薩 心 
T33n1706_002:0292b11	勝形劣者。若論形服未必劣於聲聞。今以出	勝 形 劣 者 若 論 形 服 未 必 劣 於 聲 聞 今 以 出 
T33n1706_002:0292b12	家形服比之故也。初釋聲聞眾。與者共義。據	家 形 服 比 之 故 也 初 釋 聲 聞 眾 與 者 共 義 據 
T33n1706_002:0292b13	論作七一義解。謂比丘等雖多不同。而所依	論 作 七 一 義 解 謂 比 丘 等 雖 多 不 同 而 所 依 
T33n1706_002:0292b14	時處等七無不一故。如文。若委明同異。具如	時 處 等 七 無 不 一 故 如 文 若 委 明 同 異 具 如 
T33n1706_002:0292b15	妙記云云。然以後世論之。使無法以一之。而	妙 記 云 云 然 以 後 世 論 之 使 無 法 以 一 之 而 
T33n1706_002:0292b16	人情各異。又安得而共邪。而云和合為眾亦	人 情 各 異 又 安 得 而 共 邪 而 云 和 合 為 眾 亦 
T33n1706_002:0292b17	浪語耳。通號中言大羅漢者。大亦云多云勝。	浪 語 耳 通 號 中 言 大 羅 漢 者 大 亦 云 多 云 勝 
T33n1706_002:0292b18	故兼三義釋之。亦取摩訶衍多含意也。委如	故 兼 三 義 釋 之 亦 取 摩 訶 衍 多 含 意 也 委 如 
T33n1706_002:0292b19	別釋翻。釋比丘為五義者。本唯三名。謂乞士	別 釋 翻 釋 比 丘 為 五 義 者 本 唯 三 名 謂 乞 士 
T33n1706_002:0292b20	等因三名也。應供等果三義也。以因配果義	等 因 三 名 也 應 供 等 果 三 義 也 以 因 配 果 義 
T33n1706_002:0292b21	如常釋。今加二義。於文非要。分字之釋殊乖	如 常 釋 今 加 二 義 於 文 非 要 分 字 之 釋 殊 乖 
T33n1706_002:0292b22	梵語。未詳所自。置之可也云云。明於位中簡	梵 語 未 詳 所 自 置 之 可 也 云 云 明 於 位 中 簡 
T33n1706_002:0292b23	學無學者。依成論釋。言羅漢二種。謂行之與	學 無 學 者 依 成 論 釋 言 羅 漢 二 種 謂 行 之 與 
T33n1706_002:0292b24	住。行謂所行位在學人。住即當果。以分二異。	住 行 謂 所 行 位 在 學 人 住 即 當 果 以 分 二 異 
T33n1706_002:0292b25	又曰五戒賢者皆行阿羅漢。是即學位。學於	又 曰 五 戒 賢 者 皆 行 阿 羅 漢 是 即 學 位 學 於 
T33n1706_002:0292b26	無學之行云爾。亦不全同果向之別。信如所	無 學 之 行 云 爾 亦 不 全 同 果 向 之 別 信 如 所 
T33n1706_002:0292b27	明無定論也。釋羅漢中翻釋三義。謂不生殺	明 無 定 論 也 釋 羅 漢 中 翻 釋 三 義 謂 不 生 殺 
T33n1706_002:0292b28	賊應供。以果對因其義彌顯。此藏通意也。若	賊 應 供 以 果 對 因 其 義 彌 顯 此 藏 通 意 也 若 
T33n1706_002:0292b29	從圓極義釋。則不生等皆約中道。故曰非但	從 圓 極 義 釋 則 不 生 等 皆 約 中 道 故 曰 非 但 
T33n1706_002:0292c01	不生等。謂無漏涅槃亦皆不生故也。供應反	不 生 等 謂 無 漏 涅 槃 亦 皆 不 生 故 也 供 應 反 
T33n1706_002:0292c02	之。謂以慈悲之德應彼所求。即供應義也。有	之 謂 以 慈 悲 之 德 應 彼 所 求 即 供 應 義 也 有 
T33n1706_002:0292c03	為功下。凡八科法門歎聲聞德。或作六科。則	為 功 下 凡 八 科 法 門 歎 聲 聞 德 或 作 六 科 則 
T33n1706_002:0292c04	後二為總。開合異耳。如後出云云。諸經歎德	後 二 為 總 開 合 異 耳 如 後 出 云 云 諸 經 歎 德 
T33n1706_002:0292c05	多以辭句敘述歎之。而此特異舉諸法門歎	多 以 辭 句 敘 述 歎 之 而 此 特 異 舉 諸 法 門 歎 
T33n1706_002:0292c06	者。是彰人必有德德必在人以德顯人之意	者 是 彰 人 必 有 德 德 必 在 人 以 德 顯 人 之 意 
T33n1706_002:0292c07	也。下去例爾。又曰亦可歎三人者。文本在聲	也 下 去 例 爾 又 曰 亦 可 歎 三 人 者 文 本 在 聲 
T33n1706_002:0292c08	聞。今取般若部旨故。二乘亦通後教。二釋異	聞 今 取 般 若 部 旨 故 二 乘 亦 通 後 教 二 釋 異 
T33n1706_002:0292c09	者。多應三假之名義該別圓故也。有為舉智	者 多 應 三 假 之 名 義 該 別 圓 故 也 有 為 舉 智 
T33n1706_002:0292c10	德下。約智斷釋。若論二德。斷證必俱就境以	德 下 約 智 斷 釋 若 論 二 德 斷 證 必 俱 就 境 以 
T33n1706_002:0292c11	論。道滅本一。今作異釋。亦一往云爾。如常	論 道 滅 本 一 今 作 異 釋 亦 一 往 云 爾 如 常 
T33n1706_002:0292c12	論。當約二種解脫分之云云。次約十智歎者。	論 當 約 二 種 解 脫 分 之 云 云 次 約 十 智 歎 者 
T33n1706_002:0292c13	謂一法智等即於欲界九品界繫思中。修四	謂 一 法 智 等 即 於 欲 界 九 品 界 繫 思 中 修 四 
T33n1706_002:0292c14	行觀發無漏智。如是一一諦下所發。是為四	行 觀 發 無 漏 智 如 是 一 一 諦 下 所 發 是 為 四 
T33n1706_002:0292c15	法智。於上二界界繫法中。各修四行觀。是	法 智 於 上 二 界 界 繫 法 中 各 修 四 行 觀 是 
T33n1706_002:0292c16	為四比智。比謂比前所發智也。通總而言。共	為 四 比 智 比 謂 比 前 所 發 智 也 通 總 而 言 共 
T33n1706_002:0292c17	為一比一智。及他心世智為四。更加後四諦	為 一 比 一 智 及 他 心 世 智 為 四 更 加 後 四 諦 
T33n1706_002:0292c18	智及盡無生共為十。若只合前後四諦為八。	智 及 盡 無 生 共 為 十 若 只 合 前 後 四 諦 為 八 
T33n1706_002:0292c19	加盡無生智。則十數亦足。當知只是開合異	加 盡 無 生 智 則 十 數 亦 足 當 知 只 是 開 合 異 
T33n1706_002:0292c20	耳。五苦智下。重明十六行觀。不過廣上文耳。	耳 五 苦 智 下 重 明 十 六 行 觀 不 過 廣 上 文 耳 
T33n1706_002:0292c21	於集智中文似差互。盡無生智中引論釋可	於 集 智 中 文 似 差 互 盡 無 生 智 中 引 論 釋 可 
T33n1706_002:0292c22	知。以次更加如實成十一智。約大教論。非關	知 以 次 更 加 如 實 成 十 一 智 約 大 教 論 非 關 
T33n1706_002:0292c23	開顯。唯在於佛不及二乘。仍對學無學明增	開 顯 唯 在 於 佛 不 及 二 乘 仍 對 學 無 學 明 增 
T33n1706_002:0292c24	減之異。如文。次歎三根中。先對智辯。次隨	減 之 異 如 文 次 歎 三 根 中 先 對 智 辯 次 隨 
T33n1706_002:0292c25	釋者。謂於見道前以信等九根成就信法兩	釋 者 謂 於 見 道 前 以 信 等 九 根 成 就 信 法 兩 
T33n1706_002:0292c26	行。至見道中向未知根。今知無漏故名欲知。	行 至 見 道 中 向 未 知 根 今 知 無 漏 故 名 欲 知 
T33n1706_002:0292c27	如是次第歷於思惟無學二道。轉名知根知	如 是 次 第 歷 於 思 惟 無 學 二 道 轉 名 知 根 知 
T33n1706_002:0292c28	已等。十六心行。前釋諦智已明。今復列之何	已 等 十 六 心 行 前 釋 諦 智 已 明 今 復 列 之 何 
T33n1706_002:0292c29	邪。然向所明但是舉類歎德。非專約行。若約	邪 然 向 所 明 但 是 舉 類 歎 德 非 專 約 行 若 約 
T33n1706_002:0293a01	行次應在智前。今言心行。義當後果。亦復何	行 次 應 在 智 前 今 言 心 行 義 當 後 果 亦 復 何 
T33n1706_002:0293a02	咎。但疑缺一今字云云。亦委如籤釋況十六	咎 但 疑 缺 一 今 字 云 云 亦 委 如 籤 釋 況 十 六 
T33n1706_002:0293a03	行之言復該眾義故不一途。如疏云云。又心	行 之 言 復 該 眾 義 故 不 一 途 如 疏 云 云 又 心 
T33n1706_002:0293a04	行云者。義有即離。今簡即從離。亦且一往。以	行 云 者 義 有 即 離 今 簡 即 從 離 亦 且 一 往 以 
T33n1706_002:0293a05	十六行法相在小故也。三假歎德言法假等	十 六 行 法 相 在 小 故 也 三 假 歎 德 言 法 假 等 
T33n1706_002:0293a06	者。先指體釋名。謂受名在初。想行從之。識為	者 先 指 體 釋 名 謂 受 名 在 初 想 行 從 之 識 為 
T33n1706_002:0293a07	受主故。通得名受。而曰自實無體藉他方有	受 主 故 通 得 名 受 而 曰 自 實 無 體 藉 他 方 有 
T33n1706_002:0293a08	者。言所以假也。止觀所謂無主而生是也。又	者 言 所 以 假 也 止 觀 所 謂 無 主 而 生 是 也 又 
T33n1706_002:0293a09	曰一虛二實相形得名者。釋虛實也。而曰只	曰 一 虛 二 實 相 形 得 名 者 釋 虛 實 也 而 曰 只 
T33n1706_002:0293a10	實而虛。合云實虛從通結示云爾。惟其實虛。	實 而 虛 合 云 實 虛 從 通 結 示 云 爾 惟 其 實 虛 
T33n1706_002:0293a11	此實所以為幻。幻故成於通義。三假之中各	此 實 所 以 為 幻 幻 故 成 於 通 義 三 假 之 中 各 
T33n1706_002:0293a12	有三觀。准上別約三觀說也。法假即虛者。謂	有 三 觀 准 上 別 約 三 觀 說 也 法 假 即 虛 者 謂 
T33n1706_002:0293a13	法以虛故不實。不實故空。是為空觀。空即假	法 以 虛 故 不 實 不 實 故 空 是 為 空 觀 空 即 假 
T33n1706_002:0293a14	實者。對假名實。實而非實。實處即空故。一色	實 者 對 假 名 實 實 而 非 實 實 處 即 空 故 一 色 
T33n1706_002:0293a15	一香本當於假。以體空故無非般若。以即理	一 香 本 當 於 假 以 體 空 故 無 非 般 若 以 即 理 
T33n1706_002:0293a16	故空只是假。即假觀也。觀字是中者。惟其中	故 空 只 是 假 即 假 觀 也 觀 字 是 中 者 惟 其 中 
T33n1706_002:0293a17	有非空非假之體。而有能空能假之用。故空	有 非 空 非 假 之 體 而 有 能 空 能 假 之 用 故 空 
T33n1706_002:0293a18	假為方便得入中道。以中奪邊故二邊但有其	假 為 方 便 得 入 中 道 以 中 奪 邊 故 二 邊 但 有 其 
T33n1706_002:0293a19	名不名為觀。由中實故始得言之。此並約法	名 不 名 為 觀 由 中 實 故 始 得 言 之 此 並 約 法 
T33n1706_002:0293a20	假明也。其次二觀類推可解云云。若約三假	假 明 也 其 次 二 觀 類 推 可 解 云 云 若 約 三 假 
T33n1706_002:0293a21	明圓觀者。圓無別圓。但依次第融歸一心即	明 圓 觀 者 圓 無 別 圓 但 依 次 第 融 歸 一 心 即 
T33n1706_002:0293a22	空假中。自然亡照。於是得矣。智論下。引喻釋	空 假 中 自 然 亡 照 於 是 得 矣 智 論 下 引 喻 釋 
T33n1706_002:0293a23	成為三。初立二喻。如狗臨井喻意可知。叱應	成 為 三 初 立 二 喻 如 狗 臨 井 喻 意 可 知 叱 應 
T33n1706_002:0293a24	作吠。相影二字恐倒。眾生亦爾下。合也。仍該	作 吠 相 影 二 字 恐 倒 眾 生 亦 爾 下 合 也 仍 該 
T33n1706_002:0293a25	三義。謂法假等。如文云云。又一切法但從	三 義 謂 法 假 等 如 文 云 云 又 一 切 法 但 從 
T33n1706_002:0293a26	名字和合名為身等。更無餘名者。無別名也。	名 字 和 合 名 為 身 等 更 無 餘 名 者 無 別 名 也 
T33n1706_002:0293a27	亦應作法。所謂三界無別法。唯一假名是也。	亦 應 作 法 所 謂 三 界 無 別 法 唯 一 假 名 是 也 
T33n1706_002:0293a28	諸皆即事為名為分等可知。三空等下。釋歎	諸 皆 即 事 為 名 為 分 等 可 知 三 空 等 下 釋 歎 
T33n1706_002:0293a29	三昧德也。由假達空故。次歎三空。亦因果次	三 昧 德 也 由 假 達 空 故 次 歎 三 空 亦 因 果 次 
T33n1706_002:0293b01	第。謂法假故空等。對義可知云云。故大論下。	第 謂 法 假 故 空 等 對 義 可 知 云 云 故 大 論 下 
T33n1706_002:0293b02	引論明三十七品為趣涅槃門。則道品為能	引 論 明 三十七品 為 趣 涅 槃 門 則 道 品 為 能 
T33n1706_002:0293b03	趣。趣於所趣涅槃之門。又謂涅槃門有三。則	趣 趣 於 所 趣 涅 槃 之 門 又 謂 涅 槃 門 有 三 則 
T33n1706_002:0293b04	三空。又為趣涅槃門。是應立兩重門義。謂外	三 空 又 為 趣 涅 槃 門 是 應 立 兩 重 門 義 謂 外 
T33n1706_002:0293b05	門則道品是也。內門則三空是也。是則如來	門 則 道 品 是 也 內 門 則 三 空 是 也 是 則 如 來 
T33n1706_002:0293b06	大寂滅樂三德堂奧尤為深邃也。言空門者	大 寂 滅 樂 三 德 堂 奧 尤 為 深 邃 也 言 空 門 者 
T33n1706_002:0293b07	下。牒釋也。謂觀諸法無我。我所則去。其蔽	下 牒 釋 也 謂 觀 諸法無我 我 所 則 去 其 蔽 
T33n1706_002:0293b08	者。從因緣和合而有。則了法緣主當處即空	者 從 因緣和合 而 有 則 了 法 緣 主 當 處 即 空 
T33n1706_002:0293b09	也。無有作受則稱本自空也。由三義故名曰	也 無 有 作 受 則 稱 本 自 空 也 由 三 義 故 名 曰 
T33n1706_002:0293b10	空門。無相門者。謂觀身雖空領上空門。而有	空 門 無 相 門 者 謂 觀 身 雖 空 領 上 空 門 而 有 
T33n1706_002:0293b11	相在對治相著。以修無相故。如說屈伸俯仰	相 在 對 治 相 著 以 修 無 相 故 如 說 屈 伸 俯 仰 
T33n1706_002:0293b12	等。皆所謂相也。相本無實而動轉者風。風依	等 皆 所 謂 相 也 相 本 無 實 而 動 轉 者 風 風 依 
T33n1706_002:0293b13	於識則有所作。識若滅者念念無故何有於	於 識 則 有 所 作 識 若 滅 者 念 念 無 故 何 有 於 
T33n1706_002:0293b14	相哉。無相則無我。而見有男女等相。是有我	相 哉 無 相 則 無 我 而 見 有 男 女 等 相 是 有 我 
T33n1706_002:0293b15	心在無智慧故。妄見有骨鎖連持等相。所謂	心 在 無 智 慧 故 妄 見 有 骨 鎖 連 持 等 相 所 謂 
T33n1706_002:0293b16	皮骨覆機關動作。如木偶是也。事見列子云	皮 骨 覆 機 關 動 作 如 木 偶 是 也 事 見 列 子 云 
T33n1706_002:0293b17	云。無作門者。凡所作相依於無相。無相亦無。	云 無 作 門 者 凡 所 作 相 依 於 無 相 無 相 亦 無 
T33n1706_002:0293b18	所作安有。故曰無相亦無是名無作。是三空	所 作 安 有 故 曰 無 相 亦 無 是 名 無 作 是 三 空 
T33n1706_002:0293b19	門為諸禪中要。若無此定不名三昧。易多退	門 為 諸 禪 中 要 若 無 此 定 不 名 三 昧 易 多 退 
T33n1706_002:0293b20	失故。說唯三種人能到涅槃。謂持戒觀空精	失 故 說 唯 三 種 人 能 到 涅 槃 謂 持 戒 觀 空 精 
T33n1706_002:0293b21	進。有是三者則三十七品思過半矣。由初門	進 有 是 三 者 則 三十七品 思 過 半 矣 由 初 門 
T33n1706_002:0293b22	故得三解脫。則第二門從而可造。其去祕藏	故 得 三 解 脫 則 第 二 門 從 而 可 造 其 去 祕 藏 
T33n1706_002:0293b23	不遙矣。四諦十二緣下。總結歎可知。若以諦	不 遙 矣 四 諦 十 二 緣 下 總 結 歎 可 知 若 以 諦 
T33n1706_002:0293b24	緣自為二科。殆似煩重。況後歎緣覺文亦有	緣 自 為 二 科 殆 似 煩 重 況 後 歎 緣 覺 文 亦 有 
T33n1706_002:0293b25	是句何乎。今得以申析之。然諦緣度等以藏。	是 句 何 乎 今 得 以 申 析 之 然 諦 緣 度 等 以 藏 
T33n1706_002:0293b26	則利鈍各稟。開合之異。今是通乘。故得會而	則 利 鈍 各 稟 開 合 之 異 今 是 通 乘 故 得 會 而 
T33n1706_002:0293b27	為一。則有同別也。如疏云云。又曰四諦鈍根	為 一 則 有 同 別 也 如 疏 云 云 又 曰 四 諦 鈍 根 
T33n1706_002:0293b28	者觀下。兼後因緣利鈍者觀。則有通有別。及	者 觀 下 兼 後 因 緣 利 鈍 者 觀 則 有 通 有 別 及 
T33n1706_002:0293b29	出大經。各通四教。則隨文用與義不一揆也。	出 大 經 各 通 四 教 則 隨 文 用 與 義 不 一 揆 也 
T33n1706_002:0293c01	二列緣覺眾。言大仙緣覺者。標位有三。謂一	二 列 緣 覺 眾 言 大 仙 緣 覺 者 標 位 有 三 謂 一 
T33n1706_002:0293c02	者獨覺等。本列緣覺而以大仙云者。即所謂	者 獨 覺 等 本 列 緣 覺 而 以 大 仙 云 者 即 所 謂 
T33n1706_002:0293c03	以外況內。取其悟同得以稱之。二因緣覺。即	以 外 況 內 取 其 悟 同 得 以 稱 之 二 因 緣 覺 即 
T33n1706_002:0293c04	今所列同聞是也。雖出佛世與彼獨悟無生。	今 所 列 同 聞 是 也 雖 出 佛 世 與 彼 獨 悟 無 生 
T33n1706_002:0293c05	何以異焉。非斷非常等。凡約三義釋。通而言	何 以 異 焉 非 斷 非 常 等 凡 約 三 義 釋 通 而 言 
T33n1706_002:0293c06	之。以緣生故非斷。以緣滅故非常。非斷非常。	之 以 緣 生 故 非 斷 以 緣 滅 故 非 常 非 斷 非 常 
T33n1706_002:0293c07	所歎之德盡矣。三小辟支佛亦云獨覺。於其	所 歎 之 德 盡 矣 三 小 辟 支 佛 亦 云 獨 覺 於 其 
T33n1706_002:0293c08	兩間有同有異。以類同故出無佛世。以根異	兩 間 有 同 有 異 以 類 同 故 出 無 佛 世 以 根 異 
T33n1706_002:0293c09	故小大則殊。大不制果故唯無學。此仍住因	故 小 大 則 殊 大 不 制 果 故 唯 無 學 此 仍 住 因 
T33n1706_002:0293c10	猶學人耳。支佛根性頗不易明。大略如此云	猶 學 人 耳 支 佛 根 性 頗 不 易 明 大 略 如 此 云 
T33n1706_002:0293c11	云。料簡二重。初問該二意。謂三乘若一向異	云 料 簡 二 重 初 問 該 二 意 謂 三 乘 若 一 向 異 
T33n1706_002:0293c12	不應兩處各明諦緣。次列菩薩。仍名羅漢。若	不 應 兩 處 各 明 諦 緣 次 列 菩 薩 仍 名 羅 漢 若 
T33n1706_002:0293c13	一向同則三乘何別。答言。於一境上取悟自	一 向 同 則 三 乘 何 別 答 言 於 一 境 上 取 悟 自 
T33n1706_002:0293c14	差。謂通約諦緣本同一境。而隨機異解取悟	差 謂 通 約 諦 緣 本 同 一 境 而 隨 機 異 解 取 悟 
T33n1706_002:0293c15	不一。故譬之三獸度河等云云。故大經下。引	不 一 故 譬 之 三 獸 度 河 等 云 云 故 大 經 下 引 
T33n1706_002:0293c16	同證別。以境同故通觀因緣。以證別故得菩	同 證 別 以 境 同 故 通 觀 因 緣 以 證 別 故 得 菩 
T33n1706_002:0293c17	提異。亦應兼出四種四諦。如上云云。良由下。	提 異 亦 應 兼 出 四 種 四 諦 如 上 云 云 良 由 下 
T33n1706_002:0293c18	結旨酬答可知。次問意以大仙緣覺本出無	結 旨 酬 答 可 知 次 問 意 以 大 仙 緣 覺 本 出 無 
T33n1706_002:0293c19	佛世。今何列在同聞眾耶。以經無獨覺之名	佛 世 今 何 列 在 同 聞 眾 耶 以 經 無 獨 覺 之 名 
T33n1706_002:0293c20	故。通以緣覺為問。答謂緣覺佛世亦有。但在	故 通 以 緣 覺 為 問 答 謂 緣 覺 佛 世 亦 有 但 在 
T33n1706_002:0293c21	聲聞數攝。今言緣覺出無佛世者。此約獨覺	聲 聞 數 攝 今 言 緣 覺 出 無 佛 世 者 此 約 獨 覺 
T33n1706_002:0293c22	云爾。列菩薩眾為五。翻譯名義云云。大道心	云 爾 列 菩 薩 眾 為 五 翻 譯 名 義 云 云 大 道 心 
T33n1706_002:0293c23	者。以今言之。則實智方便智諸功德皆成就	者 以 今 言 之 則 實 智 方 便 智 諸 功 德 皆 成 就 
T33n1706_002:0293c24	也。大士亦曰開士。謂能任持大事開通法道	也 大 士 亦 曰 開 士 謂 能 任 持 大 事 開 通 法 道 
T33n1706_002:0293c25	也。約教中言心勝道卑者。菩薩先人後己。篤	也 約 教 中 言 心 勝 道 卑 者 菩 薩 先 人 後 己 篤 
T33n1706_002:0293c26	於為物故勝聲聞。此當藏三祇百劫。未論斷	於 為 物 故 勝 聲 聞 此 當 藏 三 祇 百 劫 未 論 斷 
T33n1706_002:0293c27	惑故劣於羅漢。通雖異藏。而教無變造之詮。	惑 故 劣 於 羅 漢 通 雖 異 藏 而 教 無 變 造 之 詮 
T33n1706_002:0293c28	故說留習。習不獨生故。說扶願。所以異也。十	故 說 留 習 習 不 獨 生 故 說 扶 願 所 以 異 也 十 
T33n1706_002:0293c29	地行圓當知如佛者。以第十地亦名菩薩故	地 行 圓 當 知 如 佛 者 以 第 十 地 亦 名 菩 薩 故 
T33n1706_002:0294a01	得如名。謂與當教佛齊也。非成不成者。謂以	得 如 名 謂 與 當 教 佛 齊 也 非 成 不 成 者 謂 以 
T33n1706_002:0294a02	無作心觀不二境。則諸行無作故非成。一念	無 作 心 觀 不 二 境 則 諸 行 無 作 故 非 成 一 念 
T33n1706_002:0294a03	圓證故非不成。今此下。結判前所列菩薩義。	圓 證 故 非 不 成 今 此 下 結 判 前 所 列 菩 薩 義 
T33n1706_002:0294a04	今此正當衍教初門。則是共行十地至第八	今 此 正 當 衍 教 初 門 則 是 共 行 十 地 至 第 八 
T33n1706_002:0294a05	地。有兼通含別之義。以正兼接故云密兼。非	地 有 兼 通 含 別 之 義 以 正 兼 接 故 云 密 兼 非 
T33n1706_002:0294a06	顯密之密也。若據大品三種發心。則又三教	顯 密 之 密 也 若 據 大 品 三 種 發 心 則 又 三 教 
T33n1706_002:0294a07	各詮之義應通。二說可也。皆羅漢者。明菩薩	各 詮 之 義 應 通 二 說 可 也 皆 羅 漢 者 明 菩 薩 
T33n1706_002:0294a08	位也。三祇菩薩既未斷惑不名羅漢。至果方	位 也 三 祇 菩 薩 既 未 斷 惑 不 名 羅 漢 至 果 方 
T33n1706_002:0294a09	得稱之。又本行云者。文有二意。一約菩薩至	得 稱 之 又 本 行 云 者 文 有 二 意 一 約 菩 薩 至 
T33n1706_002:0294a10	果得名。二約如來正施小化一往俯同印證	果 得 名 二 約 如 來 正 施 小 化 一 往 俯 同 印 證 
T33n1706_002:0294a11	云爾。至後二味乃當廢斥。何皆之有。於三教	云 爾 至 後 二 味 乃 當 廢 斥 何 皆 之 有 於 三 教 
T33n1706_002:0294a12	菩薩。約位格量如文。又引大品文證。謂是菩	菩 薩 約 位 格 量 如 文 又 引 大 品 文 證 謂 是 菩 
T33n1706_002:0294a13	薩別立忍名。是亦褒揚菩薩引進二乘之意。	薩 別 立 忍 名 是 亦 褒 揚 菩 薩 引 進 二 乘 之 意 
T33n1706_002:0294a14	然前於聲聞明皆羅漢。則無間於學無學。今	然 前 於 聲 聞 明 皆 羅 漢 則 無 間 於 學 無 學 今 
T33n1706_002:0294a15	於菩薩有收有簡。此何意耶。答中以菩薩形	於 菩 薩 有 收 有 簡 此 何 意 耶 答 中 以 菩 薩 形 
T33n1706_002:0294a16	無定準為釋。今謂是固一說。而不無餘意。前	無 定 準 為 釋 今 謂 是 固 一 說 而 不 無 餘 意 前 
T33n1706_002:0294a17	約聲聞。唯學無學則進有學以至無學故皆	約 聲 聞 唯 學 無 學 則 進 有 學 以 至 無 學 故 皆 
T33n1706_002:0294a18	名之。今明菩薩既涉別圓則有後位可望。故	名 之 今 明 菩 薩 既 涉 別 圓 則 有 後 位 可 望 故 
T33n1706_002:0294a19	約真似對論收簡。疏不云者略耳。問若下。釋	約 真 似 對 論 收 簡 疏 不 云 者 略 耳 問 若 下 釋 
T33n1706_002:0294a20	重明所以。謂今明菩薩形服既通。或同凡小	重 明 所 以 謂 今 明 菩 薩 形 服 既 通 或 同 凡 小 
T33n1706_002:0294a21	未免混濫。故復更明則知進退有在。謂貴小	未 免 混 濫 故 復 更 明 則 知 進 退 有 在 謂 貴 小 
T33n1706_002:0294a22	乘者。使知大小德齊。所以進小乘也。取名相	乘 者 使 知 大 小 德 齊 所 以 進 小 乘 也 取 名 相 
T33n1706_002:0294a23	者。悟凡聖道越。所以退凡夫也。故重明之。次	者 悟 凡 聖 道 越 所 以 退 凡 夫 也 故 重 明 之 次 
