T33n1706_004:0306b11	又反上重立。既無無相。而無相亦無。何有於	又 反 上 重 立 既 無 無 相 而 無 相 亦 無 何 有 於 
T33n1706_004:0306b12	去來。亦應云非無去來。所謂不來相而來。無	去 來 亦 應 云 非 無 去 來 所 謂 不 來 相 而 來 無 
T33n1706_004:0306b13	見相而見。非無來去。亡其迹耳。故曰如虛空。	見 相 而 見 非 無 來 去 亡 其 迹 耳 故 曰 如 虛 空 
T33n1706_004:0306b14	此下凡有三如虛空句。並結終歸於空。則畢	此 下 凡 有 三 如 虛 空 句 並 結 終 歸 於 空 則 畢 
T33n1706_004:0306b15	竟空而已矣。故今約三節釋義。其理明矣。二	竟 空 而 已 矣 故 今 約 三 節 釋 義 其 理 明 矣 二 
T33n1706_004:0306b16	約眾生人法明空。如文云云。謂一切眾生無	約 眾 生 人 法 明 空 如 文 云 云 謂 一 切 眾 生 無 
T33n1706_004:0306b17	生滅等。總明人法空故。生滅等三亦悉叵得。	生 滅 等 總 明 人 法 空 故 生 滅 等 三 亦 悉 叵 得 
T33n1706_004:0306b18	故皆空也。非不因果者。例上蕩立可知。如疏	故 皆 空 也 非 不 因 果 者 例 上 蕩 立 可 知 如 疏 
T33n1706_004:0306b19	引大品等具釋顯然。今不別解。煩惱下。別明	引 大 品 等 具 釋 顯 然 今 不 別 解 煩 惱 下 別 明 
T33n1706_004:0306b20	二空。此我人等本屬見使故。以煩惱該之。若	二 空 此 我 人 等 本 屬 見 使 故 以 煩 惱 該 之 若 
T33n1706_004:0306b21	論我所。即假名所託。本當實法。今以者字當	論 我 所 即 假 名 所 託 本 當 實 法 今 以 者 字 當 
T33n1706_004:0306b22	之。約能計者說。當是人法二執。一切法集下。	之 約 能 計 者 說 當 是 人 法 二 執 一 切 法 集 下 
T33n1706_004:0306b23	以實法顯空。實本非假。為成空義故。以名等	以 實 法 顯 空 實 本 非 假 為 成 空 義 故 以 名 等 
T33n1706_004:0306b24	三假言之。法境界空者。正言人法所顯之空。	三 假 言 之 法 境 界 空 者 正 言 人 法 所 顯 之 空 
T33n1706_004:0306b25	此空無相故不可轉。此空不顛倒故不順幻	此 空 無 相 故 不 可 轉 此 空 不 顛 倒 故 不 順 幻 
T33n1706_004:0306b26	化。圓覺所謂知幻即離離幻即覺故。不隨諸	化 圓 覺 所 謂 知 幻 即 離 離 幻 即 覺 故 不 隨 諸 
T33n1706_004:0306b27	幻。是亦不順之義也。無三寶者。凡諸名相本	幻 是 亦 不 順 之 義 也 無 三 寶 者 凡 諸 名 相 本 
T33n1706_004:0306b28	對治之說。苟無所對則名亦不立。今顯空義。	對 治 之 說 苟 無 所 對 則 名 亦 不 立 今 顯 空 義 
T33n1706_004:0306b29	是故云爾。又曰無聖人六道者。謂所空境界	是 故 云 爾 又 曰 無 聖 人 六 道 者 謂 所 空 境 界 
T33n1706_004:0306c01	既無世出世之異。聖名凡號復從誰立。所謂	既 無 世 出 世 之 異 聖 名 凡 號 復 從 誰 立 所 謂 
T33n1706_004:0306c02	絕凡聖之假名是也。三般若無知下。克就般	絕 凡 聖 之 假 名 是 也 三 般 若 無 知 下 克 就 般 
T33n1706_004:0306c03	若當體明空。謂聖凡人法皆空。則唯有般若。	若 當 體 明 空 謂 聖 凡 人 法 皆 空 則 唯 有 般 若 
T33n1706_004:0306c04	而般若亦空。故曰般若無知等。謂般若者。以	而 般 若 亦 空 故 曰 般 若 無 知 等 謂 般 若 者 以 
T33n1706_004:0306c05	智為名以空為體。以無知無見為相。所謂知	智 為 名 以 空 為 體 以 無 知 無 見 為 相 所 謂 知 
T33n1706_004:0306c06	止於其所不知。其言至矣。肇師為之作般若	止 於 其 所 不 知 其 言 至 矣 肇 師 為 之 作 般 若 
T33n1706_004:0306c07	無知論焉故其論云云。而經言不行者。心路	無 知 論 焉 故 其 論 云 云 而 經 言 不 行 者 心 路 
T33n1706_004:0306c08	絕也。不緣不因者。不同諸法因緣所成也。直	絕 也 不 緣 不 因 者 不 同 諸 法 因 緣 所 成 也 直 
T33n1706_004:0306c09	即空而已。故不受一切法。不受亦不受始得	即 空 而 已 故 不 受 一 切 法 不 受 亦 不 受 始 得 
T33n1706_004:0306c10	為今不受也。不得一切照相者。能照既亡所照	為 今 不 受 也 不 得 一 切 照 相 者 能 照 既 亡 所 照 
T33n1706_004:0306c11	亦寂。直如行道相爾。行猶行深般若之行。此	亦 寂 直 如 行 道 相 爾 行 猶 行 深 般 若 之 行 此 
T33n1706_004:0306c12	其所以為行道相。亦如經空相而已矣。故曰	其 所 以 為 行 道 相 亦 如 經 空 相 而 已 矣 故 曰 
T33n1706_004:0306c13	法相如是等。總結上說法相如於虛空無非	法 相 如 是 等 總 結 上 說 法 相 如 於 虛 空 無 非 
T33n1706_004:0306c14	般若。故曰如如。不可以有心得故無可立。以	般 若 故 曰 如 如 不 可 以 有 心 得 故 無 可 立 以 
T33n1706_004:0306c15	一切法悉皆如故。不可以無心得故無可遣。	一 切 法 悉 皆 如 故 不 可 以 無 心 得 故 無 可 遣 
T33n1706_004:0306c16	以一切法悉皆真故。是則般若功德非眾生	以 一 切 法 悉 皆 真 故 是 則 般 若 功 德 非 眾 生 
T33n1706_004:0306c17	心行所及故。不可以眾生五陰假實中行。與	心 行 所 及 故 不 可 以 眾 生 五 陰 假 實 中 行 與 
T33n1706_004:0306c18	夫境界智解。皆所莫及故也。唯順於空契無	夫 境 界 智 解 皆 所 莫 及 故 也 唯 順 於 空 契 無 
T33n1706_004:0306c19	相。然乃可行爾。故知般若其為不可思議言	相 然 乃 可 行 爾 故 知 般 若 其 為 不可思議 言 
T33n1706_004:0306c20	語斷心路絕者是矣。惟其不可思議故。菩薩	語 斷 心 路 絕 者 是 矣 惟 其 不可思議 故 菩 薩 
T33n1706_004:0306c21	於守行之。是為一切行藏。即前所謂三十忍	於 守 行 之 是 為 一 切 行 藏 即 前 所 謂 三 十 忍 
T33n1706_004:0306c22	等是也。一切如來於中住化。是為一切佛藏。	等 是 也 一 切 如 來 於 中 住 化 是 為 一 切 佛 藏 
T33n1706_004:0306c23	即上品寂光極智所照之境故。皆不可言言	即 上 品 寂 光 極 智 所 照 之 境 故 皆 不 可 言 言 
T33n1706_004:0306c24	而識識也。善男子下。述贊功德。既不可思議	而 識 識 也 善 男 子 下 述 贊 功 德 既 不可思議 
T33n1706_004:0306c25	亦不可度量。則王之所說勝矣。只合云於王	亦 不 可 度 量 則 王 之 所 說 勝 矣 只 合 云 於 王 
T33n1706_004:0306c26	所說如海一滴。其文曉然。而經云如王所說	所 說 如 海 一 滴 其 文 曉 然 而 經 云 如 王 所 說 
T33n1706_004:0306c27	義。似反覆故。使從容釋之。至於問答顯王說	義 似 反 覆 故 使 從 容 釋 之 至 於 問 答 顯 王 說 
T33n1706_004:0306c28	為勝。以其有本故也。故曰王無本地云何而	為 勝 以 其 有 本 故 也 故 曰 王 無 本 地 云 何 而 
T33n1706_004:0306c29	知。反釋云爾。然以文本意。宜從初釋。若從容	知 反 釋 云 爾 然 以 文 本 意 宜 從 初 釋 若 從 容 
T33n1706_004:0307a01	以言。則各當為便聖賢分上。宜乎斟酌也。分	以 言 則 各 當 為 便 聖 賢 分 上 宜 乎 斟 酌 也 分 
T33n1706_004:0307a02	義功德者。謂於無量義中言其少分爾。疏推	義 功 德 者 謂 於 無 量 義 中 言 其 少 分 爾 疏 推 
T33n1706_004:0307a03	月光之德無量。雖略而盡。非無此理。或恐指	月 光 之 德 無 量 雖 略 而 盡 非 無 此 理 或 恐 指 
T33n1706_004:0307a04	般若而言。其義亦順。更當詳之。亦為過去來	般 若 而 言 其 義 亦 順 更 當 詳 之 亦 為 過 去 來 
T33n1706_004:0307a05	今下。多應述可月光分義。述可猶印可也。十	今 下 多 應 述 可 月 光 分 義 述 可 猶 印 可 也 十 
T33n1706_004:0307a06	四法門下。勸修可知。不由此門得薩婆若者。	四 法 門 下 勸 修 可 知 不 由 此 門 得 薩 婆 若 者 
T33n1706_004:0307a07	舉要結勸也。何以故下。更重徵釋。示無異道	舉 要 結 勸 也 何 以 故 下 更 重 徵 釋 示 無 異 道 
T33n1706_004:0307a08	也。楞嚴所謂十方薄伽梵一路涅槃門。又曰	也 楞 嚴 所 謂 十 方 薄 伽 梵 一 路 涅 槃 門 又 曰 
T33n1706_004:0307a09	方便有多門歸源性無二。是也又以無滯釋	方 便 有 多 門 歸 源 性 無 二 是 也 又 以 無 滯 釋 
T33n1706_004:0307a10	門。能通釋路。亦一往爾。如能通曰門。豈非門	門 能 通 釋 路 亦 一 往 爾 如 能 通 曰 門 豈 非 門 
T33n1706_004:0307a11	亦能通。由此門故得薩婆若。則門亦無滯。何	亦 能 通 由 此 門 故 得 薩 婆 若 則 門 亦 無 滯 何 
T33n1706_004:0307a12	獨路味。乘正路者。非今十四忍門終始圓實。	獨 路 味 乘 正 路 者 非 今 十 四 忍 門 終 始 圓 實 
T33n1706_004:0307a13	何由乘之行大直道。其超百千劫難見身得	何 由 乘 之 行 大 直 道 其 超 百 千 劫 難 見 身 得 
T33n1706_004:0307a14	妙報者。不為過矣。佛告大王下。以大章則答	妙 報 者 不 為 過 矣 佛 告 大 王 下 以 大 章 則 答 
T33n1706_004:0307a15	第二問。以文兼三問。此當答第三問也。正言	第 二 問 以 文 兼 三 問 此 當 答 第 三 問 也 正 言 
T33n1706_004:0307a16	菩薩以何相見眾生。使眾生可化。雖正問所	菩 薩 以 何 相 見 眾 生 使 眾 生 可 化 雖 正 問 所 
T33n1706_004:0307a17	化而實兼能化故。若以下答兼二意。謂菩薩	化 而 實 兼 能 化 故 若 以 下 答 兼 二 意 謂 菩 薩 
T33n1706_004:0307a18	能自視身如幻化相。見所化眾生亦如幻化。	能 自 視 身 如 幻 化 相 見 所 化 眾 生 亦 如 幻 化 
T33n1706_004:0307a19	則可以化之。不然則若自若他皆為著我人	則 可 以 化 之 不 然 則 若 自 若 他 皆 為 著 我 人 
T33n1706_004:0307a20	眾生壽者。乖於般若自性。非今所以化也。所	眾 生 壽 者 乖 於 般 若 自 性 非 今 所 以 化 也 所 
T33n1706_004:0307a21	謂若知眾生無所有。誓度無所有之眾生。斯	謂 若 知 眾 生 無 所 有 誓 度 無 所 有 之 眾 生 斯 
T33n1706_004:0307a22	言盡矣。後諸所說。為未了者開演言之爾。正	言 盡 矣 後 諸 所 說 為 未 了 者 開 演 言 之 爾 正 
T33n1706_004:0307a23	廣答中。眾生識者。最初一念性非木石。遇其	廣 答 中 眾 生 識 者 最 初 一 念 性 非 木 石 遇 其 
T33n1706_004:0307a24	善則為善。遇其惡則為惡。此其所以為善惡	善 則 為 善 遇 其 惡 則 為 惡 此 其 所 以 為 善 惡 
T33n1706_004:0307a25	識本。則三界六道由心發生。本為最初一念	識 本 則 三 界 六 道 由 心 發 生 本 為 最 初 一 念 
T33n1706_004:0307a26	終於金剛。金剛者。等覺後心也。於中有始無	終 於 金 剛 金 剛 者 等 覺 後 心 也 於 中 有 始 無 
T33n1706_004:0307a27	始有迷有悟。有善惡因果之別。有漏無漏等	始 有 迷 有 悟 有 善 惡 因 果 之 別 有漏無漏 等 
T33n1706_004:0307a28	之殊。從心變生。不可說識亦能成就不可說	之 殊 從 心 變 生 不 可 說 識 亦 能 成 就 不 可 說 
T33n1706_004:0307a29	眾生色心。皆一色心之所從出。識心如幻故	眾 生 色 心 皆 一 色 心 之 所 從 出 識 心 如 幻 故 
T33n1706_004:0307b01	色亦如幻。能化所化莫不咸然。此所以以幻	色 亦 如 幻 能 化 所 化 莫 不 咸 然 此 所 以 以 幻 
T33n1706_004:0307b02	化身見所幻者。真行化眾生也。故疏釋云云。	化 身 見 所 幻 者 真 行 化 眾 生 也 故 疏 釋 云 云 
T33n1706_004:0307b03	謂本識者。即正因佛性指出識體也。所謂夫	謂 本 識 者 即 正 因 佛 性 指 出 識 體 也 所 謂 夫 
T33n1706_004:0307b04	有心者皆當作佛是也。非有非無者。非二邊	有 心 者 皆 當 作 佛 是 也 非有非無 者 非 二 邊 
T33n1706_004:0307b05	所得度量也。所謂適言其有。不貌色質等是	所 得 度 量 也 所 謂 適 言 其 有 不 貌 色 質 等 是 
T33n1706_004:0307b06	也。不知不忘者。正言識體非記無記也。如水	也 不 知 不 忘 者 正 言 識 體 非 記 無 記 也 如 水 
T33n1706_004:0307b07	濕性等。謂諸法各隨性別。非所謂性一也。但	濕 性 等 謂 諸 法 各 隨 性 別 非 所 謂 性 一 也 但 
T33n1706_004:0307b08	隨善惡而有差別。則性習所以異也。文引大	隨 善 惡 而有差別 則 性 習 所 以 異 也 文 引 大 
T33n1706_004:0307b09	經為證者。非全證同。亦以顯異。上以水火等	經 為 證 者 非 全 證 同 亦 以 顯 異 上 以 水 火 等 
T33n1706_004:0307b10	性為言。取其性習之性而已。此以一味流異	性 為 言 取 其 性 習 之 性 而 已 此 以 一 味 流 異 
T33n1706_004:0307b11	為說。則於異處顯其理同也。疏簡眾生本際	為 說 則 於 異 處 顯 其 理 同 也 疏 簡 眾 生 本 際 
T33n1706_004:0307b12	有無者。挾彼本文以無難有。若言本際不可	有 無 者 挾 彼 本 文 以 無 難 有 若 言 本 際 不 可 
T33n1706_004:0307b13	得則無也。亦應以有難無。但文略耳。答略為	得 則 無 也 亦 應 以 有 難 無 但 文 略 耳 答 略 為 
T33n1706_004:0307b14	二。一約理明無。則不容有前後。疑多一無字。	二 一 約 理 明 無 則 不 容 有 前 後 疑 多 一 無 字 
T33n1706_004:0307b15	二約事明有。則一念生識義固有之。然非所	二 約 事 明 有 則 一 念 生 識 義 固 有 之 然 非 所 
T33n1706_004:0307b16	謂真際之際。若夫大教以明則際乃無際。無	謂 真 際 之 際 若 夫 大 教 以 明 則 際 乃 無 際 無 
T33n1706_004:0307b17	際乃際。際與無際兩得之矣。亦未始有定說	際 乃 際 際 與 無 際 兩 得 之 矣 亦 未 始 有 定 說 
T33n1706_004:0307b18	也。如常論云云。眾生識下。廣答所化眾生如	也 如 常 論 云 云 眾 生 識 下 廣 答 所 化 眾 生 如 
T33n1706_004:0307b19	幻相。夫幻以虛假不實為義。疏約六假科釋	幻 相 夫 幻 以 虛 假 不 實 為 義 疏 約 六 假 科 釋 
T33n1706_004:0307b20	之。初法假中明一念識生五陰色心。復於一	之 初 法 假 中 明 一 念 識 生 五 陰 色 心 復 於 一 
T33n1706_004:0307b21	色生無量色。則十二入義在其中。又以四大	色 生 無 量 色 則 十 二 入 義 在 其 中 又 以 四 大 
T33n1706_004:0307b22	所造而生五識。識託於根。是為五根。則十八	所 造 而 生 五 識 識 託 於 根 是 為 五 根 則 十 八 
T33n1706_004:0307b23	界盡之矣。然皆從一出多。自無幻有即幻假	界 盡 之 矣 然 皆 從 一 出 多 自 無 幻 有 即 幻 假 
T33n1706_004:0307b24	之相　既明根識四大。則四類法空識等亦	之 相 既 明 根 識 四 大 則 四 類 法 空 識 等 亦 
T33n1706_004:0307b25	悉兼之。但文略耳。故總結如疏可解。不明法	悉 兼 之 但 文 略 耳 故 總 結 如 疏 可 解 不 明 法 
T33n1706_004:0307b26	入色者。於其色心法入為少分故也。是亦文	入 色 者 於 其 色 心 法 入 為 少 分 故 也 是 亦 文 
T33n1706_004:0307b27	略。二明聖凡見異者。是亦法無自相或見為	略 二 明 聖 凡 見 異 者 是 亦 法 無 自 相 或 見 為 
T33n1706_004:0307b28	假。或見真實。故曰凡夫六識麁等。謂凡夫識	假 或 見 真 實 故 曰 凡 夫 六 識 麁 等 謂 凡 夫 識 
T33n1706_004:0307b29	麁見假而眩於實。香味觸法本名下之實。而	麁 見 假 而 眩 於 實 香 味 觸 法 本 名 下 之 實 而 
T33n1706_004:0307c01	聖人識淨見實而不惑於假。此聖凡所以見	聖 人 識 淨 見 實 而 不 惑 於 假 此 聖 凡 所 以 見 
T33n1706_004:0307c02	異也。至於聖有小大淺深故。見有常無常。或	異 也 至 於 聖 有 小 大 淺 深 故 見 有 常 無 常 或 
T33n1706_004:0307c03	滅色顯常。或於實見理等。所謂諸法何嘗自	滅 色 顯 常 或 於 實 見 理 等 所 謂 諸 法 何 嘗 自 
T33n1706_004:0307c04	謂同異。當知一切由心分別是也。眾生世諦	謂 同 異 當 知 一 切 由 心 分 別 是 也 眾 生 世 諦 
T33n1706_004:0307c05	之名者。疏科此下為受假。非無受義而文不	之 名 者 疏 科 此 下 為 受 假 非 無 受 義 而 文 不 
T33n1706_004:0307c06	顯只合兼下科同為一假名。對上五陰實法。	顯 只 合 兼 下 科 同 為 一 假 名 對 上 五 陰 實 法 
T33n1706_004:0307c07	成人法二境。接後三假俱得名幻。文簡而不	成 人 法 二 境 接 後 三 假 俱 得 名 幻 文 簡 而 不 
T33n1706_004:0307c08	煩。雖與科異。然亦有文同而科異者。如妙疏	煩 雖 與 科 異 然 亦 有 文 同 而 科 異 者 如 妙 疏 
T33n1706_004:0307c09	等文云云。若有若無者。謂於世諦法上假名	等 文 云 云 若有若無 者 謂 於 世 諦 法 上 假 名 
T33n1706_004:0307c10	有無。但生眾生憶想。名為世諦。非實諦也。又	有 無 但 生 眾 生 憶 想 名 為 世 諦 非 實 諦 也 又 
T33n1706_004:0307c11	世而非諦。故曰世諦。假誑幻化故。有而實非	世 而 非 諦 故 曰 世 諦 假 誑 幻 化 故 有 而 實 非 
T33n1706_004:0307c12	有。非有而有。是為幻有。亦名幻諦。又幻諦	有 非 有 而 有 是 為 幻 有 亦 名 幻 諦 又 幻 諦 
T33n1706_004:0307c13	者。對實諦得名。世諦者。對非諦為說。各當其	者 對 實 諦 得 名 世 諦 者 對 非 諦 為 說 各 當 其 
T33n1706_004:0307c14	理。而隨義淺深爾。又曰乃至六道幻化眾生	理 而 隨 義 淺 深 爾 又 曰 乃 至 六 道 幻 化 眾 生 
T33n1706_004:0307c15	等者。謂有能所。一以六道幻化為能見。見幻	等 者 謂 有 能 所 一 以 六 道 幻 化 為 能 見 見 幻 
T33n1706_004:0307c16	化為所見。二以幻化二字為能見。見幻化四	化 為 所 見 二 以 幻 化 二 字 為 能 見 見 幻 化 四 
T33n1706_004:0307c17	性為所見。但句義影略爾。無他說也。疏言見	性 為 所 見 但 句 義 影 略 爾 無 他 說 也 疏 言 見 
T33n1706_004:0307c18	者下。覆釋上見義。非直能見而已。亦能照知	者 下 覆 釋 上 見 義 非 直 能 見 而 已 亦 能 照 知 
T33n1706_004:0307c19	能化所化一皆如幻。謂真幻者。即別教菩薩	能 化 所 化 一 皆 如 幻 謂 真 幻 者 即 別 教 菩 薩 
T33n1706_004:0307c20	能化人也。言別則通圓可知。文缺略耳。化實	能 化 人 也 言 別 則 通 圓 可 知 文 缺 略 耳 化 實 
T33n1706_004:0307c21	幻者。即上六道凡夫是也。化及所化悉皆見	幻 者 即 上 六 道 凡 夫 是 也 化 及 所 化 悉 皆 見 
T33n1706_004:0307c22	之。是故云爾。於是復躡上云幻諦等。謂此幻	之 是 故 云 爾 於 是 復 躡 上 云 幻 諦 等 謂 此 幻 
T33n1706_004:0307c23	法空劫以來。乃至佛未出時。本無名字。縱有	法 空 劫 以 來 乃 至 佛 未 出 時 本 無 名 字 縱 有 
T33n1706_004:0307c24	其名亦無實義。故曰無義名幻法。所謂世諦	其 名 亦 無 實 義 故 曰 無 義 名 幻 法 所 謂 世 諦 
T33n1706_004:0307c25	有名無實義是也。故知幻化本為名字。既無	有 名 無 實 義 是 也 故 知 幻 化 本 為 名 字 既 無 
T33n1706_004:0307c26	實義。豈有體相。故於無六道等一切名字。然	實 義 豈 有 體 相 故 於 無 六 道 等 一 切 名 字 然 
T33n1706_004:0307c27	若一向無名則眾生於實道無所入。諸佛於	若 一 向 無 名 則 眾 生 於 實 道 無 所 入 諸 佛 於 
T33n1706_004:0307c28	權方無所施。眾生何由出生死乎。以是故佛	權 方 無 所 施 眾 生 何 由 出 生 死 乎 以 是 故 佛 
T33n1706_004:0307c29	佛出世。為眾生故施設假名。令諸眾生因名	佛 出 世 為 眾 生 故 施 設 假 名 令 諸 眾 生 因 名 
T33n1706_004:0308a01	識法。由法悟空。光明所謂劫初廓然萬物無	識 法 由 法 悟 空 光 明 所 謂 劫 初 廓 然 萬 物 無 
T33n1706_004:0308a02	字。聖人仰則真法俯立俗號等。即其義焉。如	字 聖 人 仰 則 真 法 俯 立 俗 號 等 即 其 義 焉 如 
T33n1706_004:0308a03	空法下。結攝前來三界等法。無量名字悉如	空 法 下 結 攝 前 來 三 界 等 法 無 量 名 字 悉 如 
T33n1706_004:0308a04	空法。則如幻如化無非般若。以例餘法。起後	空 法 則 如幻如化 無 非 般 若 以 例 餘 法 起 後 
T33n1706_004:0308a05	三假相續相待無定實法。是即如幻故。曰非	三 假 相 續 相 待 無 定 實 法 是 即 如 幻 故 曰 非 
T33n1706_004:0308a06	一非異等。所以必約相續假等以推之者。謂	一 非 異 等 所 以 必 約 相 續 假 等 以 推 之 者 謂 
T33n1706_004:0308a07	於人法二空有未能入故。須續待以資發之。	於 人 法 二 空 有 未 能 入 故 須 續 待 以 資 發 之 
T33n1706_004:0308a08	必使入空而後已具。如止觀等文。夫續以前	必 使 入 空 而 後 已 具 如 止 觀 等 文 夫 續 以 前 
T33n1706_004:0308a09	後相續不斷為義。使定一異不名為續。非一	後 相續不斷 為 義 使 定 一 異 不 名 為 續 非 一 
T33n1706_004:0308a10	非異爾乃名續。如芽莖等體非一異次第生	非 異 爾 乃 名 續 如 芽 莖 等 體 非 一 異 次 第 生 
T33n1706_004:0308a11	長。是為續假。以是推之。無定實法。是即空	長 是 為 續 假 以 是 推 之 無 定 實 法 是 即 空 
T33n1706_004:0308a12	也。又相待假者。以一切名相相待。如五色有	也 又 相 待 假 者 以 一 切 名 相 相 待 如 五 色 有 
T33n1706_004:0308a13	無等。亦名不定相待。故疏有二意之釋。謂相	無 等 亦 名 不 定 相 待 故 疏 有 二 意 之 釋 謂 相 
T33n1706_004:0308a14	對待相形待。配義可知。而云相避待者。猶言	對 待 相 形 待 配 義 可 知 而 云 相 避 待 者 猶 言 
T33n1706_004:0308a15	不兩立之義。如論云云。又緣成假者。亦名因	不 兩 立 之 義 如 論 云 云 又 緣 成 假 者 亦 名 因 
T33n1706_004:0308a16	生。不出以五陰十二支等因緣假成眾生。故	生 不 出 以 五 陰 十 二 支 等 因 緣 假 成 眾 生 故 
T33n1706_004:0308a17	曰俱時因果等。疏釋云云。但文有影略。似不	曰 俱 時 因 果 等 疏 釋 云 云 但 文 有 影 略 似 不 
T33n1706_004:0308a18	易見耳。言緣見是俱時者。見應音現。謂觀現	易 見 耳 言 緣 見 是 俱 時 者 見 應 音 現 謂 觀 現 
T33n1706_004:0308a19	境在一時內為俱時。若推觀在因即異時。又	境 在 一 時 內 為 俱 時 若 推 觀 在 因 即 異 時 又 
T33n1706_004:0308a20	梁柱成舍為俱時。而成有漸次為異時。如十	梁 柱 成 舍 為 俱 時 而 成 有 漸 次 為 異 時 如 十 
T33n1706_004:0308a21	二時有前後為異時。共成一日為俱時。燈及	二 時 有 前 後 為 異 時 共 成 一 日 為 俱 時 燈 及 
T33n1706_004:0308a22	明等其義可知。然以此等因果求其實法。皆	明 等 其 義 可 知 然 以 此 等 因 果 求 其 實 法 皆 
T33n1706_004:0308a23	悉叵得。是為幻諦。眾生居幻而非諦則為妄	悉 叵 得 是 為 幻 諦 眾 生 居 幻 而 非 諦 則 為 妄 
T33n1706_004:0308a24	幻。幻而能諦方名幻諦。幻諦即空也。若菩薩	幻 幻 而 能 諦 方 名 幻 諦 幻 諦 即 空 也 若 菩 薩 
T33n1706_004:0308a25	如上所見。眾生幻化猶是通途言之。十住菩	如 上 所 見 眾 生 幻 化 猶 是 通 途 言 之 十 住 菩 
T33n1706_004:0308a26	薩下。始是今能化菩薩所見。故曰如幻諦而	薩 下 始 是 今 能 化 菩 薩 所 見 故 曰 如 幻 諦 而 
T33n1706_004:0308a27	見菩薩化眾生為若此。總結歸上問也。	見 菩 薩 化 眾 生 為 若 此 總 結 歸 上 問 也 
T33n1706_004:0308a28	釋二諦品	釋 二 諦 品 
T33n1706_004:0308a29	次教化而後明二諦者。疏約二義論次。初以	次 教 化 而 後 明 二 諦 者 疏 約 二 義 論 次 初 以 
T33n1706_004:0308b01	內對外。則內護文有三別。謂因果自他及以	內 對 外 則 內 護 文 有 三 別 謂 因 果 自 他 及 以 
T33n1706_004:0308b02	依正。通得為次。二以今二諦對上二護。則能	依 正 通 得 為 次 二 以 今 二 諦 對 上 二 護 則 能 
T33n1706_004:0308b03	依所依之別。即前所見幻諦等。依於不思識	依 所 依 之 別 即 前 所 見 幻 諦 等 依 於 不 思 識 
T33n1706_004:0308b04	真俗故。次之以二諦焉。總明二諦云是佛教	真 俗 故 次 之 以 二 諦 焉 總 明 二 諦 云 是 佛 教 
T33n1706_004:0308b05	之大宗者。謂以本言之。則如來常依二諦說	之 大 宗 者 謂 以 本 言 之 則 如 來 常 依 二 諦 說 
T33n1706_004:0308b06	法。一代所說莫過此二。又以七二諦該之。則	法 一 代 所 說 莫 過 此 二 又 以 七 二 諦 該 之 則 
T33n1706_004:0308b07	一化五時攝無不盡。推而極之。何法而非真	一 化 五 時 攝 無 不 盡 推 而 極 之 何 法 而 非 真 
T33n1706_004:0308b08	俗乎。抑若以為有無。孰不知之。惟其所以有	俗 乎 抑 若 以 為 有 無 孰 不 知 之 惟 其 所 以 有 
T33n1706_004:0308b09	無究其所以審諦。至於歷教淺深隨文詮義	無 究 其 所 以 審 諦 至 於 歷 教 淺 深 隨 文 詮 義 
T33n1706_004:0308b10	有接有正情智開合。此所以難也。夫諦只是	有 接 有 正 情 智 開 合 此 所 以 難 也 夫 諦 只 是 
T33n1706_004:0308b11	理。理尚無一。云何有二。況有種種差別邪。又	理 理 尚 無 一 云 何 有 二 況 有 種種差別 邪 又 
