T33n1698_001:0075a03	金剛般若經疏	金 剛 般 若 經 疏 
T33n1698_001:0075a05	隋天台智者大師說	隋 天 台 智 者 大 師 說 
T33n1698_001:0075a06	略釋經題。法譬標名。般若幽玄。微妙難測。假	略 釋 經 題 法 譬 標 名 般 若 幽 玄 微 妙 難 測 假 
T33n1698_001:0075a07	斯譬況以顯深法。金即三義。一寶中真上不	斯 譬 況 以 顯 深 法 金 即 三 義 一 寶 中 真 上 不 
T33n1698_001:0075a08	可侵毀。二利用自在摧破諸物。三表裏清淨	可 侵 毀 二 利 用 自 在 摧 破 諸 物 三 表 裏 清 淨 
T33n1698_001:0075a09	影現分明。剛是堅義。謂身命財。身即法身。命	影 現 分 明 剛 是 堅 義 謂 身 命 財 身 即 法 身 命 
T33n1698_001:0075a10	即慧命。財即法財。功德助道。用譬三種般若。	即 慧 命 財 即 法 財 功 德 助 道 用 譬 三 種 般 若 
T33n1698_001:0075a11	實相般若理性常住。觀照般若破五住惑。文	實 相 般 若 理 性 常 住 觀 照 般 若 破 五 住 惑 文 
T33n1698_001:0075a12	字般若解脫自在。如此三法不縱不橫非並	字 般 若 解 脫 自 在 如 此 三 法 不 縱 不 橫 非 並 
T33n1698_001:0075a13	非別。成祕密藏。佛三種身亦復如是。實相即	非 別 成 祕 密 藏 佛 三 種 身 亦復如是 實 相 即 
T33n1698_001:0075a14	法身如大經明金剛身品。觀照即報身如金	法 身 如 大 經 明 金 剛 身 品 觀 照 即 報 身 如 金 
T33n1698_001:0075a15	剛三昧破諸煩惱。文字即應身。隨機利益普	剛 三 昧 破 諸 煩 惱 文 字 即 應 身 隨 機 利 益 普 
T33n1698_001:0075a16	現無邊。舊云金剛譬十地後心因圓之位。今	現 無 邊 舊 云 金 剛 譬 十 地 後 心 因 圓 之 位 今 
T33n1698_001:0075a17	言初心至後即有六種金剛也。體者若見諸	言 初 心 至 後 即 有 六 種 金 剛 也 體 者 若 見 諸 
T33n1698_001:0075a18	相非相即見如來。是經之正體也。宗者約實	相 非 相 即 見 如 來 是 經 之 正 體 也 宗 者 約 實 
T33n1698_001:0075a19	相之慧。行無相之檀。如人有目日光明照。見	相 之 慧 行 無 相 之 檀 如 人 有 目 日 光 明 照 見 
T33n1698_001:0075a20	種種色是因。諸相非相是果。此之因果同約	種 種 色 是 因 諸 相 非 相 是 果 此 之 因 果 同 約 
T33n1698_001:0075a21	實相。用者破執為用。一切封著通名為執。破	實 相 用 者 破 執 為 用 一 切 封 著 通 名 為 執 破 
T33n1698_001:0075a22	諸相惑顯出功能。亦自無滯即力用也。教相	諸 相 惑 顯 出 功 能 亦 自 無 滯 即 力 用 也 教 相 
T33n1698_001:0075a23	者有五。一摩訶二金剛三天王問四光讚	者 有 五 一 摩 訶 二 金 剛 三 天 王 問 四 光 讚 
T33n1698_001:0075a24	五仁王。廣略雖異同名般若。摩訶以廣歷色	五 仁 王 廣 略 雖 異 同 名 般 若 摩 訶 以 廣 歷 色 
T33n1698_001:0075a25	心。乃至種智皆摩訶衍。此文略說金剛為喻	心 乃 至 種 智 皆 摩 訶 衍 此 文 略 說 金 剛 為 喻 
T33n1698_001:0075a26	也。次廣解釋。言金剛般若此乃摧萬有於性	也 次 廣 解 釋 言 金 剛 般 若 此 乃 摧 萬 有 於 性 
T33n1698_001:0075a27	空。蕩一無於畢竟。甚堅甚銳名曰金剛。智名	空 蕩 一 無 於 畢 竟 甚 堅 甚 銳 名 曰 金 剛 智 名 
T33n1698_001:0075a28	決斷。慧曰解知。萬像雖繁物我無相。有為斯	決 斷 慧 曰 解 知 萬 像 雖 繁 物 我 無 相 有 為 斯 
T33n1698_001:0075a29	絕寂其機照故假名般若。西云跋闍羅亦云	絕 寂 其 機 照 故 假 名 般 若 西 云 跋 闍 羅 亦 云 
T33n1698_001:0075b01	斫迦羅。此翻金剛。云是利鐵亦名破具。引大	斫 迦 羅 此 翻 金 剛 云 是 利 鐵 亦 名 破 具 引 大 
T33n1698_001:0075b02	經云。佛告迦葉汝今決斷譬若剛刀。又云劫	經 云 佛 告 迦 葉 汝 今 決 斷 譬 若 剛 刀 又 云 劫 
T33n1698_001:0075b03	火起時一切皆銷。利銳者在下為金剛際。又	火 起 時 一 切 皆 銷 利 銳 者 在 下 為 金 剛 際 又 
T33n1698_001:0075b04	云往古諸佛舍利變為金剛如意珠。今通取	云 往 古 諸 佛 舍 利 變 為 金 剛 如 意 珠 今 通 取 
T33n1698_001:0075b05	堅利為譬。舊云體堅用利。體堅眾惑不侵。用	堅 利 為 譬 舊 云 體 堅 用 利 體 堅 眾 惑 不 侵 用 
T33n1698_001:0075b06	利能摧萬物。今問體唯堅不利。用唯利不堅。	利 能 摧 萬 物 今 問 體 唯 堅 不 利 用 唯 利 不 堅 
T33n1698_001:0075b07	亦應體則不利用則不堅。此乃不堅不利何	亦 應 體 則 不 利 用 則 不 堅 此 乃 不 堅 不 利 何 
T33n1698_001:0075b08	謂堅利。百論云眼非知意非見。別既非見合	謂 堅 利 百 論 云 眼 非 知 意 非 見 別 既 非 見 合 
T33n1698_001:0075b09	云何見。今依中論通此問即無滯義。今言堅	云 何 見 今 依 中 論 通 此 問 即 無 滯 義 今 言 堅 
T33n1698_001:0075b10	利者不堅不利。假言堅利。如言苦以不苦為	利 者 不 堅 不 利 假 言 堅 利 如 言 苦 以 不 苦 為 
T33n1698_001:0075b11	義。無常以常為義。空以不空為義。此一例語	義 無 常 以 常 為 義 空 以 不 空 為 義 此 一 例 語 
T33n1698_001:0075b12	任運不畏斯難。般若如大火聚四邊不可觸。	任 運 不 畏 斯 難 般 若 如大火聚 四 邊 不 可 觸 
T33n1698_001:0075b13	豈可定作體用耶。體用因緣不一。不異。體堅	豈 可 定 作 體 用 耶 體 用 因 緣 不 一 不 異 體 堅 
T33n1698_001:0075b14	用亦堅體利用亦利。既其不一假名義辨。若	用 亦 堅 體 利 用 亦 利 既 其 不 一 假 名 義 辨 若 
T33n1698_001:0075b15	說體堅即說用利。此是假名義一邊之說。離	說 體 堅 即 說 用 利 此 是 假 名 義 一 邊 之 說 離 
T33n1698_001:0075b16	用無體離體無用。用即寂寂即用。無別有無	用 無 體 離 體 無 用 用 即 寂 寂 即 用 無 別 有 無 
T33n1698_001:0075b17	用之體主於用也。亦無別有無體之用主於	用 之 體 主 於 用 也 亦 無 別 有 無 體 之 用 主 於 
T33n1698_001:0075b18	體也。不一亦不異有因緣故亦可說一說異。	體 也 不 一 亦 不 異 有因緣故 亦 可 說 一 說 異 
T33n1698_001:0075b19	為破一說異破異說一。假說一異。令眾生悟	為 破 一 說 異 破 異 說 一 假 說 一 異 令 眾 生 悟 
T33n1698_001:0075b20	非一非異秖名此因緣不一不異離斷常戲	非一非異 秖 名 此 因 緣 不 一 不 異 離 斷 常 戲 
T33n1698_001:0075b21	論。戲論不得入即是堅。能破斷常即是利也。	論 戲 論 不 得 入 即 是 堅 能 破 斷 常 即 是 利 也 
T33n1698_001:0075b22	問何者為般若如是堅利。答一往性空為般	問 何 者 為 般 若 如 是 堅 利 答 一 往 性 空 為 般 
T33n1698_001:0075b23	若。不斷不常不一不異性空畢竟空為般若。	若 不 斷 不 常 不 一 不 異 性 空 畢 竟 空 為 般 若 
T33n1698_001:0075b24	萬相一無皆悉盡淨。大論云般若有三種。實	萬 相 一 無 皆 悉 盡 淨 大 論 云 般 若 有 三 種 實 
T33n1698_001:0075b25	相觀照文字。實相即理境第一義諦。觀照即	相 觀 照 文 字 實 相 即 理 境 第一義諦 觀 照 即 
T33n1698_001:0075b26	行人智慧。智慧鑑此實相。說智及智處皆名	行 人 智 慧 智 慧 鑑 此 實 相 說 智 及 智 處 皆 名 
T33n1698_001:0075b27	為般若。文字能為作詮亦為般若。故云無離	為 般 若 文 字 能 為 作 詮 亦 為 般 若 故 云 無 離 
T33n1698_001:0075b28	文字說乎解脫。一體三名同祕密藏。問有翻	文 字 說 乎 解 脫 一 體 三 名 同 祕 密 藏 問 有 翻 
T33n1698_001:0075b29	無翻。答翻為智慧。問大論云智慧輕薄般若	無 翻 答 翻 為 智 慧 問 大 論 云 智 慧 輕 薄 般 若 
T33n1698_001:0075c01	深重云何相翻。釋論七十卷釋須菩提五歎	深 重 云 何 相 翻 釋 論 七 十 卷 釋 須 菩 提 五 歎 
T33n1698_001:0075c02	不可稱不可量無等等無有邊如虛空。解不	不 可 稱 不 可 量 無 等 等 無 有 邊 如 虛 空 解 不 
T33n1698_001:0075c03	可稱句云稱名智慧。此是稱量檀度。非智慧	可 稱 句 云 稱 名 智 慧 此 是 稱 量 檀 度 非 智 慧 
T33n1698_001:0075c04	不能準量。故稱名智慧般若定實相。此釋不	不 能 準 量 故 稱 名 智 慧 般 若 定 實 相 此 釋 不 
T33n1698_001:0075c05	可量何意不可量。欲明佛所得般若明鑑實	可 量 何 意 不 可 量 欲 明 佛 所 得 般 若 明 鑑 實 
T33n1698_001:0075c06	相甚深窮邊極底。菩薩因中智慧不能稱量	相 甚 深 窮 邊 極 底 菩 薩 因 中 智 慧 不 能 稱 量 
T33n1698_001:0075c07	佛果地般若。此是因中智慧輕薄。不能稱量	佛 果 地 般 若 此 是 因 中 智 慧 輕 薄 不 能 稱 量 
T33n1698_001:0075c08	果地般若。何得妄引無翻耶。大經云慧有三	果 地 般 若 何 得 妄 引 無 翻 耶 大 經 云 慧 有 三 
T33n1698_001:0075c09	種。般若毘婆舍那闍那。同一氣類隨名而辨。	種 般 若 毘婆舍那 闍 那 同 一 氣 類 隨 名 而 辨 
T33n1698_001:0075c10	約人般若屬眾生。毘婆舍那一切聖人。闍那	約 人 般 若 屬 眾 生 毘婆舍那 一切聖人 闍 那 
T33n1698_001:0075c11	諸佛菩薩。就法者毘婆舍那總相。般若別相。	諸佛菩薩 就 法 者 毘婆舍那 總 相 般 若 別 相 
T33n1698_001:0075c12	闍那翻破相。毘婆舍那翻正知見。此即是總	闍 那 翻 破 相 毘婆舍那 翻 正 知 見 此 即 是 總 
T33n1698_001:0075c13	相知見般若翻出離慧即是屬眾生。眾生有	相 知 見 般 若 翻 出 離 慧 即 是 屬 眾 生 眾 生 有 
T33n1698_001:0075c14	慧數故。闍那諸佛十地菩薩。有決斷義故。共	慧 數 故 闍 那 諸 佛 十地菩薩 有 決 斷 義 故 共 
T33n1698_001:0075c15	為一位耳。波羅蜜亦阿羅蜜波羅伽等。翻度	為 一 位 耳 波 羅 蜜 亦 阿 羅 蜜 波 羅 伽 等 翻 度 
T33n1698_001:0075c16	彼岸。亦彼岸到亦度無極。此假名無度為度	彼 岸 亦 彼 岸 到 亦 度 無 極 此 假 名 無 度 為 度 
T33n1698_001:0075c17	耳。佛已度智慧度名一切智。菩薩未度亦不	耳 佛 已 度 智 慧 度 名 一 切 智 菩 薩 未 度 亦 不 
T33n1698_001:0075c18	名度。度時亦不名度。不離已度度未度故。	名 度 度 時 亦 不 名 度 不 離 已 度 度 未 度 故 
T33n1698_001:0075c19	而今言乃度此假名說度。一行度二時度三	而 今 言 乃 度 此 假 名 說 度 一 行 度 二 時 度 三 
T33n1698_001:0075c20	果度。六度善修滿足為行度。三僧祇滿為時	果 度 六 度 善 修 滿 足 為 行 度 三 僧 祇 滿 為 時 
T33n1698_001:0075c21	度得大菩提為果度。彼岸者生死為此岸涅	度 得大菩提 為 果 度 彼 岸 者 生 死 為 此 岸 涅 
T33n1698_001:0075c22	槃為彼岸。煩惱為中流。八正為船筏。又慳貪	槃 為 彼 岸 煩 惱 為 中 流 八 正 為 船 筏 又 慳 貪 
T33n1698_001:0075c23	為此岸佛果為彼岸。布施為河中正勤為船	為 此 岸 佛 果 為 彼 岸 布 施 為 河 中 正 勤 為 船 
T33n1698_001:0075c24	筏。又取相為此岸無相為彼岸。智慧為河中	筏 又 取 相 為 此 岸 無 相 為 彼 岸 智 慧 為 河 中 
T33n1698_001:0075c25	精進為船筏。一往如此。又即生死涅槃俱為	精 進 為 船 筏 一 往 如 此 又 即 生死涅槃 俱 為 
T33n1698_001:0075c26	此。非生死涅槃為彼。故云遠離此彼岸乃	此 非 生死涅槃 為 彼 故 云 遠 離 此 彼 岸 乃 
T33n1698_001:0075c27	名波羅蜜。又前生死涅槃雙非中道為二。非	名 波 羅 蜜 又 前 生死涅槃 雙 非 中 道 為 二 非 
T33n1698_001:0075c28	生死涅槃中道為不二。二不二俱為此。非二	生死涅槃 中 道 為 不 二 二 不 二 俱 為 此 非 二 
T33n1698_001:0075c29	非不二俱為彼故遠離二邊及以中道名波	非 不 二 俱 為 彼 故 遠離二邊 及 以 中 道 名 波 
T33n1698_001:0076a01	羅蜜。修多羅翻契經。經字訓法訓。常由聖人	羅 蜜 修 多 羅 翻 契 經 經 字 訓 法 訓 常 由 聖 人 
T33n1698_001:0076a02	心口也。次部軸者第一部十萬偈。第二部二	心 口 也 次 部 軸 者 第 一 部 十 萬 偈 第 二 部 二 
T33n1698_001:0076a03	萬偈並不來此土。第三部一萬八千偈即大	萬 偈 並 不 來 此 土 第 三 部 一 萬 八 千 偈 即 大 
T33n1698_001:0076a04	品亦名放光。第四部八千偈即小品亦名道	品 亦 名 放 光 第 四 部 八 千 偈 即 小 品 亦 名 道 
T33n1698_001:0076a05	行。第五部四千偈即光讚。第六部二千五百	行 第 五 部 四 千 偈 即 光 讚 第 六 部 二 千 五 百 
T33n1698_001:0076a06	偈即天王問。第七部六百偈即文殊問般若。	偈 即 天 王 問 第 七 部 六 百 偈 即 文 殊 問 般 若 
T33n1698_001:0076a07	第八部三百偈即此金剛般若。叡師云並是	第 八 部 三 百 偈 即 此 金 剛 般 若 叡 師 云 並 是 
T33n1698_001:0076a08	如來隨機之說。般若非稱量過諸數量。豈是	如 來 隨 機 之 說 般 若 非 稱 量 過 諸 數 量 豈 是 
T33n1698_001:0076a09	一多四五之可說。次簡前後。言金剛前後者。	一 多 四 五 之 可 說 次 簡 前 後 言 金 剛 前 後 者 
T33n1698_001:0076a10	肇師注云五種般若此說最初又千二百五	肇 師 注 云 五種般若 此 說 最 初 又 千 二 百 五 
T33n1698_001:0076a11	十人後說大品。大數五千人受化轉多故摩	十 人 後 說 大 品 大 數 五 千 人 受 化 轉 多 故 摩 
T33n1698_001:0076a12	訶在後。若金剛在後者。仁王經云初摩訶次	訶 在 後 若 金 剛 在 後 者 仁 王 經 云 初 摩 訶 次 
T33n1698_001:0076a13	金剛。又護念付囑及得慧眼。未聞此經似宜	金 剛 又 護 念 付 囑 及 得 慧 眼 未 聞 此 經 似 宜 
T33n1698_001:0076a14	在後。俱有證據。由人用耳。對機設教廣略不	在 後 俱 有 證 據 由 人 用 耳 對 機 設 教 廣 略 不 
T33n1698_001:0076a15	同。從得道夜訖泥洹夕常說般若明理一等。	同 從 得 道 夜 訖 泥 洹 夕 常 說 般 若 明 理 一 等 
T33n1698_001:0076a16	若依光讚如來十九出家三十成道。至四十	若 依 光 讚 如 來 十 九 出 家 三 十 成 道 至 四 十 
T33n1698_001:0076a17	二二月十五日食後。為諸菩薩說般若。次譯	二 二 月十五日 食 後 為 諸 菩 薩 說 般 若 次 譯 
T33n1698_001:0076a18	經者羅什法師秦弘始三年即晉安帝十一年	經 者 羅 什 法 師 秦 弘 始 三 年 即 晉 安 帝 十 一 年 
T33n1698_001:0076a19	譯。又後魏末菩提流支譯論本八十偈。彌勒	譯 又 後 魏 末 菩 提 流 支 譯 論 本 八 十 偈 彌 勒 
T33n1698_001:0076a20	作偈天親長行。釋總三卷分文十二分。一序	作 偈 天 親 長 行 釋 總 三 卷 分 文 十 二 分 一 序 
T33n1698_001:0076a21	分二護念分三住分四修行分五法身非身分	分 二 護 念 分 三 住 分 四 修 行 分 五 法 身 非 身 分 
T33n1698_001:0076a22	六信者分七校量顯勝分八顯性分九利益分	六 信 者 分 七 校 量 顯 勝 分 八 顯 性 分 九 利 益 分 
T33n1698_001:0076a23	十斷疑分十一不住道分十二流通分。講說	十 斷 疑 分 十 一 不 住 道 分 十 二 流 通 分 講 說 
T33n1698_001:0076a24	時別一途開章耳。就此一經開為三段序正	時 別 一 途 開 章 耳 就 此 一 經 開 為 三 段 序 正 
T33n1698_001:0076a25	流通。序為緣起。說教之前必有由漸。分衛放	流 通 序 為 緣 起 說 教 之 前 必 有 由 漸 分 衛 放 
T33n1698_001:0076a26	光雨華獻蓋等也。由漸既起正教宜陳。緣教	光 雨 華 獻 蓋 等 也 由 漸 既 起 正 教 宜 陳 緣 教 
T33n1698_001:0076a27	相感其猶影響。故有正說。又非止近被一時。	相 感 其 猶 影 響 故 有 正 說 又 非 止 近 被 一 時 
T33n1698_001:0076a28	乃欲遠傳來際。故有流通三段各二。序有通	乃 欲 遠 傳 來 際 故 有 流 通 三 段 各 二 序 有 通 
T33n1698_001:0076a29	有別正說前後二周。流通付囑奉行通序	有 別 正 說 前 後 二 周 流 通 付 囑 奉 行 通 序 
T33n1698_001:0076b01	為五。如是者佛所說般泥洹時。侍者請問	為 五 如 是 者 佛 所 說 般 泥 洹 時 侍 者 請 問 
T33n1698_001:0076b02	答云。一切經初皆安如是。我聞者親承金口。	答 云 一 切 經 初 皆 安 如 是 我 聞 者 親 承 金 口 
T33n1698_001:0076b03	而聞事非謬也。一時者言則當理理亦如言。	而 聞 事 非 謬 也 一 時 者 言 則 當 理 理 亦 如 言 
T33n1698_001:0076b04	當理得時令人開悟聖不虛說言必會機。故	當 理 得 時 令 人 開 悟 聖 不 虛 說 言 必 會 機 故 
T33n1698_001:0076b05	言一時也。佛者大師之名佛者覺義。異凡夫	言 一 時 也 佛 者 大 師 之 名 佛 者 覺 義 異 凡 夫 
T33n1698_001:0076b06	故自覺。異二乘故覺他。異菩薩故覺滿。在舍	故 自 覺 異 二 乘 故 覺 他 異 菩 薩 故 覺 滿 在 舍 
T33n1698_001:0076b07	衛者法王行運。應物而遊在舍衛城。憍薩羅	衛 者 法 王 行 運 應 物 而 遊 在 舍 衛 城 憍 薩 羅 
T33n1698_001:0076b08	國舍衛名聞物國。勝物多出此境嘉名遠振	國 舍 衛 名 聞 物 國 勝 物 多 出 此 境 嘉 名 遠 振 
T33n1698_001:0076b09	諸國故名聞物。又舍婆提者昔有二仙。弟名	諸 國 故 名 聞 物 又 舍 婆 提 者 昔 有 二 仙 弟 名 
T33n1698_001:0076b10	舍婆此云幼小。兄名阿跋提此名不可害。合	舍 婆 此 云 幼 小 兄 名 阿 跋 提 此 名 不 可 害 合 
T33n1698_001:0076b11	此二人以名城也。祇樹給園者。須達布園祇	此 二 人 以 名 城 也 祇 樹 給 園 者 須 達 布 園 祇 
T33n1698_001:0076b12	陀施樹。共立精舍。廣出他經。與大比丘者聖	陀 施 樹 共 立 精 舍 廣 出 他 經 與 大 比 丘 者 聖 
T33n1698_001:0076b13	化無祕。聽必有儔俱聞如林。可明信矣。應有	化 無 祕 聽 必 有 儔 俱 聞 如 林 可 明 信 矣 應 有 
T33n1698_001:0076b14	四眾略而不載。比丘云怖魔乞士破惡。千二	四 眾 略 而 不 載 比 丘 云 怖 魔 乞 士 破 惡 千 二 
T33n1698_001:0076b15	百五十人者三迦葉一千目連身子二百五十。	百 五 十 人 者 三 迦 葉 一 千 目 連 身 子 二百五十 
T33n1698_001:0076b16	爾時世尊下明別序。上明通序以證信。今	爾 時 世 尊 下 明 別 序 上 明 通 序 以 證 信 今 
T33n1698_001:0076b17	辨別序以發起具上十號故曰世尊。食時者	辨 別 序 以 發 起 具 上 十 號 故 曰 世 尊 食 時 者 
T33n1698_001:0076b18	食熟之時。一人家皆有施心易生。著衣僧伽	食 熟 之 時 一 人 家 皆 有 施 心 易 生 著 衣 僧 伽 
T33n1698_001:0076b19	梨衣也。佛觀良田區塍命出家人著此服也。	梨 衣 也 佛 觀 良 田 區 塍 命 出 家 人 著 此 服 也 
T33n1698_001:0076b20	持鉢執四天王所奉應器。入舍衛城乞食。法	持 鉢 執 四 天 王 所 奉 應 器 入 舍 衛 城 乞 食 法 
T33n1698_001:0076b21	身無待何須乞食。天人妙供百味日盈。自行	身 無 待 何 須 乞 食 天 人 妙 供 百 味 日 盈 自 行 
T33n1698_001:0076b22	分衛福物之宜。乞食有十利。一見相好二去	分 衛 福 物 之 宜 乞 食 有 十 利 一 見 相 好 二 去 
T33n1698_001:0076b23	疾三除慢四為女人監護五天龍從六四天王	疾 三 除 慢 四 為 女 人 監 護 五 天 龍 從 六 四 天 王 
T33n1698_001:0076b24	鉢七貧富等八不雜九息謗十常在三昧其	鉢 七 貧 富 等 八 不 雜 九 息 謗 十 常 在 三 昧 其 
T33n1698_001:0076b25	實不食。此城縱廣千二百由旬九億家。國南	實 不 食 此 城 縱 廣 千 二 百 由 旬 九 億 家 國 南 
T33n1698_001:0076b26	城北精舍在東。自外以適故言入也。食時如	城 北 精 舍 在 東 自 外 以 適 故 言 入 也 食 時 如 
T33n1698_001:0076b27	法食。眾生有此勝智。機緣將發以表般若。著	法 食 眾 生 有 此 勝 智 機 緣 將 發 以 表 般 若 著 
T33n1698_001:0076b28	衣持鉢衣是被弘誓鎧慈悲之心。鉢是行鉢	衣 持 鉢 衣 是 被弘誓鎧 慈 悲 之 心 鉢 是 行 鉢 
T33n1698_001:0076b29	鉢能盛飯。行能趣理即表解脫城。即法性涅	鉢 能 盛 飯 行 能 趣 理 即 表 解 脫 城 即 法 性 涅 
T33n1698_001:0076c01	槃之城。觀五陰舍悉皆空寂。不動如城以表	槃 之 城 觀 五 陰 舍 悉 皆 空 寂 不 動 如 城 以 表 
T33n1698_001:0076c02	法身次第乞食不越貧從富不捨賤從貴大	法 身 次第乞食 不 越 貧 從 富 不 捨 賤 從 貴 大 
T33n1698_001:0076c03	慈平等故言次第。即表菩薩次第行次第學	慈 平 等 故 言 次 第 即 表 菩 薩 次 第 行 次 第 學 
T33n1698_001:0076c04	次第道。行行因緣故為還至本處。本處即一	次 第 道 行 行 因 緣 故 為 還 至 本 處 本 處 即 一 
T33n1698_001:0076c05	切智處。歷色心觀至一切智。飯食訖收衣鉢	切 智 處 歷 色 心 觀 至 一 切 智 飯 食 訖 收 衣 鉢 
T33n1698_001:0076c06	者即是果後無復願行。無誓故收衣不復進	者 即 是 果 後 無 復 願 行 無 誓 故 收 衣 不 復 進 
T33n1698_001:0076c07	行故併鉢。洗足已即是定慧無復垢累。塵沙	行 故 併 鉢 洗 足 已 即 是 定 慧 無 復 垢 累 塵 沙 
T33n1698_001:0076c08	無明永去。洗水清淨故言洗足。敷座者即諸	無 明 永 去 洗 水 清 淨 故 言 洗 足 敷 座 者 即 諸 
T33n1698_001:0076c09	法空為座。四無畏處此說般若也。別序竟時	法 空 為 座 四 無 畏 處 此 說 般 若 也 別 序 竟 時 
T33n1698_001:0076c10	長老須菩提下第一為正說。文又為二。從初	長 老 須 菩 提 下 第 一 為 正 說 文 又 為 二 從 初 
T33n1698_001:0076c11	至果報不可思議。名實智道重白佛去是方	至 果 報 不可思議 名 實 智 道 重 白 佛 去 是 方 
T33n1698_001:0076c12	便道。或為後來或為鈍根。或可智度善權為	便 道 或 為 後 來 或 為 鈍 根 或 可 智 度 善 權 為 
T33n1698_001:0076c13	菩薩父母。如判大品般若方便兩道分文。此	菩 薩 父 母 如 判 大 品 般 若 方 便 兩 道 分 文 此 
T33n1698_001:0076c14	經略說亦復如是。就前段中初問次答。問中	經 略 說 亦復如是 就 前 段 中 初 問 次 答 問 中 
T33n1698_001:0076c15	前述讚次正問。長老須菩提是對揚主。有長	前 述 讚 次 正 問 長 老 須 菩 提 是 對 揚 主 有 長 
T33n1698_001:0076c16	人之德夫鉅鐘雖朗非扣不鳴。聖不孤應影	人 之 德 夫 鉅 鐘 雖 朗 非 扣 不 鳴 聖 不 孤 應 影 
T33n1698_001:0076c17	響唯仁須菩提翻空生。亦名善吉。或云東方	響 唯 仁 須 菩 提 翻 空 生 亦 名 善 吉 或 云 東 方 
T33n1698_001:0076c18	青龍陀佛。從座起者請業之儀。即事請道側	青 龍 陀 佛 從 座 起 者 請 業 之 儀 即 事 請 道 側 
T33n1698_001:0076c19	身避席。袒右肩者隋國法以袒為敬。亦示弟	身 避 席 袒 右 肩 者 隋 國 法 以 袒 為 敬 亦 示 弟 
T33n1698_001:0076c20	子執作為便。右膝著地屈曲伏從。示無違拒	子 執 作 為 便 右膝著地 屈 曲 伏 從 示 無 違 拒 
T33n1698_001:0076c21	之貌。合掌斂容祇肅顯師尊道重故。克敬盡	之 貌 合 掌 斂 容 祇 肅 顯 師 尊 道 重 故 克 敬 盡 
T33n1698_001:0076c22	恭專一之至。白佛言述讚。希有者佛從前代	恭 專 一 之 至 白 佛 言 述 讚 希 有 者 佛 從 前 代 
T33n1698_001:0076c23	八萬四千歲皆輪王位。至釋尊身若不出家。	八萬四千 歲 皆 輪 王 位 至 釋 尊 身 若 不 出 家 
T33n1698_001:0076c24	當二千五百歲作金輪王。而能捨位從門乞	當 二 千 五 百 歲 作 金 輪 王 而 能 捨 位 從 門 乞 
T33n1698_001:0076c25	食。是為希有。此歎身密。護念歎意密付囑歎	食 是 為 希 有 此 歎 身 密 護 念 歎 意 密 付 囑 歎 
T33n1698_001:0076c26	口密。又是述讚大品中意。護念即般若實道	口 密 又 是 述 讚 大 品 中 意 護 念 即 般 若 實 道 
T33n1698_001:0076c27	如母能護念。付囑即方便權道如父能教詔	如 母 能 護 念 付 囑 即 方 便 權 道 如 父 能 教 詔 
T33n1698_001:0076c28	付囑。世尊下還躡前述更起今問。發菩提心	付 囑 世 尊 下 還 躡 前 述 更 起 今 問 發菩提心 
T33n1698_001:0076c29	者一切智也。總牒指歸翻云無上正遍知	者 一 切 智 也 總 牒 指 歸 翻 云 無 上 正 遍 知 
T33n1698_001:0077a01	覺。標心擬向遠期正覺。次問住。入理般若	覺 標 心 擬 向 遠 期 正 覺 次 問 住 入 理 般 若 
T33n1698_001:0077a02	名為住即實智。次問降者。方便即權智。如	名 為 住 即 實 智 次 問 降 者 方 便 即 權 智 如 
T33n1698_001:0077a03	善財言我已先發菩提心。云何修行云何學	善 財 言 我 已 先 發菩提心 云 何 修 行 云 何 學 
T33n1698_001:0077a04	道。佛言善哉下第二佛答。初略許次廣答。略	道 佛 言 善 哉 下 第 二 佛 答 初 略 許 次 廣 答 略 
T33n1698_001:0077a05	許中有三一述二誡三願聞。善哉下述許如	許 中 有 三 一 述 二 誡 三 願 聞 善 哉 下 述 許 如 
T33n1698_001:0077a06	汝所說讚請之儀。當理會機盡善盡美誠如	汝 所 說 讚 請 之 儀 當 理 會 機 盡 善 盡 美 誠 如 
