T33n1698_001:0079a24	何故說處如塔其義實爾。但世人敬塔故令	何 故 說 處 如 塔 其 義 實 爾 但 世 人 敬 塔 故 令 
T33n1698_001:0079a25	說處如塔是人成就最上下明人尊。法妙人	說 處 如 塔 是 人 成 就 最 上 下 明 人 尊 法 妙 人 
T33n1698_001:0079a26	稱理故宜然。希有之法是菩提成就即人可	稱 理 故 宜 然 希 有 之 法 是 菩 提 成 就 即 人 可 
T33n1698_001:0079a27	貴。如法華說最實事。即是第一義諦最上之	貴 如 法 華 說 最 實 事 即 是 第一義諦 最 上 之 
T33n1698_001:0079a28	法也。若是經典下總明。經所在之處即為	法 也 若 是 經 典 下 總 明 經 所 在 之 處 即 為 
T33n1698_001:0079a29	有佛尊重弟子。人能弘法即人有法。以法成	有 佛 尊重弟子 人 能 弘 法 即 人 有 法 以 法 成 
T33n1698_001:0079b01	人即法有人。人法所處理當貴矣。非果而果	人 即 法 有 人 人 法 所 處 理 當 貴 矣 非 果 而 果 
T33n1698_001:0079b02	即為有佛。非因而因即以尊重弟子謂普賢	即 為 有 佛 非 因 而 因 即 以 尊重弟子 謂 普 賢 
T33n1698_001:0079b03	文殊等。初章竟當何名下第二辨名空無所	文 殊 等 初 章 竟 當 何 名 下 第 二 辨 名 空 無 所 
T33n1698_001:0079b04	有。夫條散難究本一易尋會。宗領旨宜正其	有 夫 條 散 難 究 本 一 易 尋 會 宗 領 旨 宜 正 其 
T33n1698_001:0079b05	名。文有四叚初名字空二受持福多三信受	名 文 有 四 叚 初 名 字 空 二 受 持 福 多 三 信 受 
T33n1698_001:0079b06	行深四佛述。初中有問答問名問持。遵修為	行 深 四 佛 述 初 中 有 問 答 問 名 問 持 遵 修 為 
T33n1698_001:0079b07	奉任弘為持。在三成範請問其軌。佛告下答	奉 任 弘 為 持 在 三 成 範 請 問 其 軌 佛 告 下 答 
T33n1698_001:0079b08	名答持。名冠題首義已備矣。境慧相從通名	名 答 持 名 冠 題 首 義 已 備 矣 境 慧 相 從 通 名 
T33n1698_001:0079b09	般若那要宜別歸乎聖心。挈網舉目詮合義	般 若 那 要 宜 別 歸 乎 聖 心 挈 網 舉 目 詮 合 義 
T33n1698_001:0079b10	從名正理顯宜應修習。所以者何下釋。夫名	從 名 正 理 顯 宜 應 修 習 所以者何 下 釋 夫 名 
T33n1698_001:0079b11	不虛設必當其實。金剛所擬物莫不碎。此慧	不 虛 設 必 當 其 實 金 剛 所 擬 物 莫 不 碎 此 慧 
T33n1698_001:0079b12	所照法無不空即非般若即慧空也。境滅慧	所 照 法 無 不 空 即 非 般 若 即 慧 空 也 境 滅 慧 
T33n1698_001:0079b13	忘何相不盡。弘持之旨宜在於此。釋中初無	忘 何 相 不 盡 弘 持 之 旨 宜 在 於 此 釋 中 初 無 
T33n1698_001:0079b14	所有。二亦無所有而意異故。明不無所有此	所 有 二 亦 無 所 有 而 意 異 故 明 不 無 所 有 此 
T33n1698_001:0079b15	簡性空義。一者性自是空二者破性說空。前	簡 性 空 義 一 者 性 自 是 空 二 者 破 性 說 空 前 
T33n1698_001:0079b16	有所無空後無所有空。大品云。諸法無所有	有 所 無 空 後 無 所 有 空 大 品 云 諸 法 無 所 有 
T33n1698_001:0079b17	如是有如是無所有。是事不知名為無明。有	如 是 有 如 是 無 所 有 是 事 不 知 名 為 無 明 有 
T33n1698_001:0079b18	所無望前無所有望後。前三藏中說性義皆	所 無 望 前 無 所 有 望 後 前 三 藏 中 說 性 義 皆 
T33n1698_001:0079b19	破。即屬破性說空所攝。而此性義前時為緣	破 即 屬 破 性 說 空 所 攝 而 此 性 義 前 時 為 緣 
T33n1698_001:0079b20	為有者。今日悉無故言有所無而言無所有。	為 有 者 今 日 悉 無 故 言 有 所 無 而 言 無 所 有 
T33n1698_001:0079b21	望後明諸法無所有而復有不無所有義。即	望 後 明 諸 法 無 所 有 而 復 有 不 無 所 有 義 即 
T33n1698_001:0079b22	明如是有故。經云。不知名無明破性說性空。	明 如 是 有 故 經 云 不 知 名 無 明 破 性 說 性 空 
T33n1698_001:0079b23	橫論破病一切悉皆洗淨。是盡亦盡是淨亦	橫 論 破 病 一 切 悉 皆 洗 淨 是 盡 亦 盡 是 淨 亦 
T33n1698_001:0079b24	淨。豎論入道盡復有不盡義。此望道為論即	淨 豎 論 入 道 盡 復 有 不 盡 義 此 望 道 為 論 即 
T33n1698_001:0079b25	此盡淨為道。道有隔凡成聖之用。不同二頭	此 盡 淨 為 道 道 有 隔 凡 成 聖 之 用 不 同 二 頭 
T33n1698_001:0079b26	三手之無所有。復有不無所有義即是如是	三 手 之 無 所 有 復 有 不 無 所 有 義 即 是 如 是 
T33n1698_001:0079b27	有義。若是前無所有一向無所有無所有亦	有 義 若 是 前 無 所 有 一 向 無 所 有 無 所 有 亦 
T33n1698_001:0079b28	復無所有。後明無所有即是不無所有。無所	復 無 所 有 後 明 無 所 有 即 是 不 無 所 有 無 所 
T33n1698_001:0079b29	有名雖同其意有異。就前中初明如空次明	有 名 雖 同 其 意 有 異 就 前 中 初 明 如 空 次 明 
T33n1698_001:0079c01	如亦空。所以者何佛說般若則非般若。此	如 亦 空 所以者何 佛 說 般 若 則 非 般 若 此 
T33n1698_001:0079c02	是如空。既以性空為般若般若即非般若。性	是 如 空 既 以 性 空 為 般 若 般 若 即 非 般 若 性 
T33n1698_001:0079c03	空如亦空如來有所說法不。境慧都空復何	空 如 亦 空 如 來 有 所 說 法 不 境 慧 都 空 復 何 
T33n1698_001:0079c04	所說。說不說如不如二智皆空也。三千下是	所 說 說 不 說 如 不 如 二 智 皆 空 也 三 千 下 是 
T33n1698_001:0079c05	第二受持福多。不無所有。亦二初明微塵不	第 二 受 持 福 多 不 無 所 有 亦 二 初 明 微 塵 不 
T33n1698_001:0079c06	無所有。二明身相不無所有。佛說微塵即非	無 所 有 二 明 身 相 不 無 所 有 佛 說 微 塵 即 非 
T33n1698_001:0079c07	微塵是名微塵故是無所有如是有。大品云	微 塵 是 名 微 塵 故 是 無 所 有 如 是 有 大 品 云 
T33n1698_001:0079c08	不知名無明今明了此。如是有即智慧也。散	不 知 名 無 明 今 明 了 此 如 是 有 即 智 慧 也 散 
T33n1698_001:0079c09	為微塵合成世界。世界無性故非假名即有。	為 微 塵 合 成 世 界 世 界 無 性 故 非 假 名 即 有 
T33n1698_001:0079c10	可以三十二相下二明身相不無所有。非相	可 以 三十二相 下 二 明 身 相 不 無 所 有 非 相 
T33n1698_001:0079c11	假名身相只以身為非身。不是遣除身別有	假 名 身 相 只 以 身 為 非 身 不 是 遣 除 身 別 有 
T33n1698_001:0079c12	非身也。亦非遣相別有無相。相無相不一不	非 身 也 亦 非 遣 相 別 有 無 相 相 無 相 不 一 不 
T33n1698_001:0079c13	異。恒河沙身命下說經名已復一番校量。前	異 恒 河 沙 身 命 下 說 經 名 已 復 一 番 校 量 前 
T33n1698_001:0079c14	寄捨財以明勝此寄捨身以辨多。依報易捨	寄 捨 財 以 明 勝 此 寄 捨 身 以 辨 多 依 報 易 捨 
T33n1698_001:0079c15	正報難損自易之難示化漸也。身命布施不	正 報 難 損 自 易 之 難 示 化 漸 也 身 命 布 施 不 
T33n1698_001:0079c16	免有生。弘持四句累滅道成聞說經深解下	免 有 生 弘 持 四 句 累 滅 道 成 聞 說 經 深 解 下 
T33n1698_001:0079c17	第三信受。行深有四初須菩提不聞。二餘人	第 三 信 受 行 深 有 四 初 須 菩 提 不 聞 二 餘 人 
T33n1698_001:0079c18	能信。三善吉聞易四餘人聞難深解。悲泣者	能 信 三 善 吉 聞 易 四 餘 人 聞 難 深 解 悲 泣 者 
T33n1698_001:0079c19	嗟我晚悟兼悲未聞。愍念一切眾生不知此	嗟 我 晚 悟 兼 悲 未 聞 愍 念 一 切 眾 生 不 知 此 
T33n1698_001:0079c20	法故悲。聞此法喜故悲深嗟小乘。嗚呼自責	法 故 悲 聞 此 法 喜 故 悲 深 嗟 小 乘 嗚 呼 自 責 
T33n1698_001:0079c21	故悲。不善觀空名得慧眼。故爾前雖聞未聞	故 悲 不 善 觀 空 名 得 慧 眼 故 爾 前 雖 聞 未 聞 
T33n1698_001:0079c22	如此降伏應住也。若復有人得聞下第二餘	如 此 降 伏 應 住 也 若 復 有 人 得 聞 下 第 二 餘 
T33n1698_001:0080a01	人能信。實相者即是非相。若有少相即非實	人 能 信 實 相 者 即 是 非 相 若 有 少 相 即 非 實 
T33n1698_001:0080a02	相。故以無相為實相。如來說此而人能信。豈	相 故 以 無 相 為 實 相 如 來 說 此 而 人 能 信 豈 
T33n1698_001:0080a03	非第一希有。而言生實相者此是無生生也。	非 第一希有 而 言 生 實 相 者 此 是 無 生 生 也 
T33n1698_001:0080a04	大品云。色不生故般若波羅蜜生。若解色無	大 品 云 色 不 生 故 般 若 波 羅 蜜 生 若 解 色 無 
T33n1698_001:0080a05	生即是無生觀智起故般若生也。我今得聞	生 即 是 無 生 觀 智 起 故 般 若 生 也 我 今 得 聞 
T33n1698_001:0080a06	下第三善吉信易。遇佛道成證聖方信何難。	下 第 三 善 吉 信 易 遇 佛 道 成 證 聖 方 信 何 難 
T33n1698_001:0080a07	生值佛世親得解悟。解故信之易也。若當來	生 值 佛 世 親 得 解 悟 解 故 信 之 易 也 若 當 來 
T33n1698_001:0080a08	世下第四餘人信難。生不值佛而能信如是	世 下 第 四 餘 人 信 難 生 不 值 佛 而 能 信 如 是 
T33n1698_001:0080a09	無相之法斯豈不難。就文更為四。初明信者	無相之法 斯 豈 不 難 就 文 更 為 四 初 明 信 者 
T33n1698_001:0080a10	希有末法時信最可稱美。二何以故下釋	希 有 末 法 時 信 最 可 稱 美 二 何 以 故 下 釋 
T33n1698_001:0080a11	信者由無我相能信此經。若纔有少許我人	信 者 由 無 我 相 能 信 此 經 若 纔 有 少 許 我 人 
T33n1698_001:0080a12	等相即不信也。三所以者何下釋無相意。	等 相 即 不 信 也 三 所以者何 下 釋 無 相 意 
T33n1698_001:0080a13	我相即是非相無片許相可得故。其能不顛	我 相 即 是 非 相 無 片 許 相 可 得 故 其 能 不 顛 
T33n1698_001:0080a14	倒我人等從本以來無一相可得故。其體本	倒 我 人 等 從本以來 無 一 相 可 得 故 其 體 本 
T33n1698_001:0080a15	來無相即為希有此是反釋。四何以故離一	來 無 相 即 為 希 有 此 是 反 釋 四 何 以 故 離 一 
T33n1698_001:0080a16	切相即名諸佛。相盡解極即是為佛。能離有	切 相 即 名 諸 佛 相 盡 解 極 即 是 為 佛 能 離 有 
T33n1698_001:0080a17	無畢竟常住。前云若見諸相非相即見如來。	無 畢 竟 常 住 前 云 若 見 諸 相 非 相 即 見 如 來 
T33n1698_001:0080a18	佛告下第四如來述成。若善吉自言容可不	佛 告 下 第 四 如 來 述 成 若 善 吉 自 言 容 可 不 
T33n1698_001:0080a19	定。言無我人即是佛者佛今印定如汝所說。	定 言 無 我 人 即 是 佛 者 佛 今 印 定 如 汝 所 說 
T33n1698_001:0080a20	是故非虛一往怛愕名驚。心膽怯弱名怖深	是 故 非 虛 一 往 怛 愕 名 驚 心 膽 怯 弱 名 怖 深 
T33n1698_001:0080a21	惡前事名畏。又驚是始行怖是二乘畏是外	惡 前 事 名 畏 又 驚 是 始 行 怖 是 二 乘 畏 是 外 
T33n1698_001:0080a22	道。亦初聞經不驚次思義不怖後修行不	道 亦 初 聞 經 不 驚 次 思 義 不 怖 後 修 行 不 
T33n1698_001:0080a23	畏。第一即般若諸度中最為第一。六從後	畏 第 一 即 般 若 諸 度 中 最 為 第 一 六 從 後 
T33n1698_001:0080a24	數亦是第一。忍辱下第三明般若功用無	數 亦 是 第 一 忍 辱 下 第 三 明 般 若 功 用 無 
T33n1698_001:0080a25	所有。然諸法不出體名用。今皆無所有。文更	所 有 然 諸 法 不 出 體 名 用 今 皆 無 所 有 文 更 
T33n1698_001:0080a26	為三。初力用無所有二能如是解仰參佛慧	為 三 初 力 用 無 所 有 二 能 如 是 解 仰 參 佛 慧 
T33n1698_001:0080a27	三明福多。就初中復五。一體無所有二功用	三 明 福 多 就 初 中 復 五 一 體 無 所 有 二 功 用 
T33n1698_001:0080a28	三勸誡四引證五舉譬。第一體者安耐名忍	三 勸 誡 四 引 證 五 舉 譬 第 一 體 者 安 耐 名 忍 
T33n1698_001:0080a29	加毀為辱。既無我人誰加誰忍。故非忍為忍	加 毀 為 辱 既 無 我 人 誰 加 誰 忍 故 非 忍 為 忍 
T33n1698_001:0080b01	忍為非忍為般若體也。何以故下第二明般	忍 為 非 忍 為 般 若 體 也 何 以 故 下 第 二 明 般 
T33n1698_001:0080b02	若用。以非忍為忍有大力用。初一世忍次多	若 用 以 非 忍 為 忍 有 大 力 用 初 一 世 忍 次 多 
T33n1698_001:0080b03	世忍。一歌利此云惡生。王何故忍即非忍引	世 忍 一 歌 利 此 云 惡 生 王 何 故 忍 即 非 忍 引 
T33n1698_001:0080b04	事為證。有苦能忍有忍無苦。既無我人割忍	事 為 證 有 苦 能 忍 有 忍 無 苦 既 無 我 人 割 忍 
T33n1698_001:0080b05	何生。若有人我必生忿恚而能恬然無我明	何 生 若 有 人 我 必 生 忿 恚 而 能 恬 然 無 我 明 
T33n1698_001:0080b06	矣。二又念五百世下即多世忍。菩薩知身無	矣 二 又 念 五 百 世 下 即 多 世 忍 菩 薩 知 身 無 
T33n1698_001:0080b07	所有捨不足難。若有此身捨大難也。尸毘代	所 有 捨 不 足 難 若 有 此 身 捨 大 難 也 尸 毘 代 
T33n1698_001:0080b08	鴿猶是三藏中事忍。前明有忍無苦今明無	鴿 猶 是 三 藏 中 事 忍 前 明 有 忍 無 苦 今 明 無 
T33n1698_001:0080b09	苦有樂。有慈悲故無恨無恨故即樂也。應離	苦 有 樂 有 慈 悲 故 無 恨 無 恨 故 即 樂 也 應 離 
T33n1698_001:0080b10	下第三勸誡。此是般若之中心故須精解。就	下 第 三 勸 誡 此 是 般 若 之 中 心 故 須 精 解 就 
T33n1698_001:0080b11	文又二。一勸二誡文句相參。初勸發心次勸	文 又 二 一 勸 二 誡 文 句 相 參 初 勸 發 心 次 勸 
T33n1698_001:0080b12	應住後勸修行。前誡離相後誡莫染心施。今	應 住 後 勸 修 行 前 誡 離 相 後 誡 莫 染 心 施 今 
T33n1698_001:0080b13	即初勸離相。發心菩薩以相盡為極。故宜以	即 初 勸 離 相 發 心 菩 薩 以 相 盡 為 極 故 宜 以 
T33n1698_001:0080b14	忘懷而期心也。不應下即是前誡不應住	忘 懷 而 期 心 也 不 應 下 即 是 前 誡 不 應 住 
T33n1698_001:0080b15	色。心中離一切相不住聲香等也。應生無所	色 心 中 離一切相 不 住 聲 香 等 也 應 生 無 所 
T33n1698_001:0080b16	住心者即次勸應住般若。般若無相可緣心	住 心 者 即 次 勸 應 住 般 若 般 若 無 相 可 緣 心 
T33n1698_001:0080b17	何所住。若心有住即為非住。住相即心動故	何 所 住 若 心 有 住 即 為 非 住 住 相 即 心 動 故 
T33n1698_001:0080b18	非住也。是故下是後誡。令不住六塵行施。	非 住 也 是 故 下 是 後 誡 令 不 住 六 塵 行 施 
T33n1698_001:0080b19	還舉前宗會以成義理無住故。應忘心而施不	還 舉 前 宗 會 以 成 義 理 無 住 故 應 忘 心 而 施 不 
T33n1698_001:0080b20	住色無財物也。菩薩為利下即是後勸。令	住 色 無 財 物 也 菩 薩 為 利 下 即 是 後 勸 令 
T33n1698_001:0080b21	為利益而行施。施不望報利益必深也。如來	為 利 益 而 行 施 施 不 望 報 利 益 必 深 也 如 來 
T33n1698_001:0080b22	說一切諸下第四引證。證中有三。第一舉佛	說 一 切 諸 下 第 四 引 證 證 中 有 三 第 一 舉 佛 
T33n1698_001:0080b23	說為證。諸相皆無不見施者我說一切相即	說 為 證 諸 相 皆 無 不 見 施 者 我 說 一 切 相 即 
T33n1698_001:0080b24	非相。不應住相生心行施。又說一切眾生即	非 相 不 應 住 相 生 心 行 施 又 說 一 切 眾 生 即 
T33n1698_001:0080b25	非眾生。受者亦無。不應化眾生而受度也。如	非 眾 生 受 者 亦 無 不 應 化 眾 生 而 受 度 也 如 
T33n1698_001:0080b26	來是真語者下第二舉能說人為證。真是不	來 是 真 語 者 下 第 二 舉 能 說 人 為 證 真 是 不 
T33n1698_001:0080b27	偽實是無虛。如必當理不誑非妄不異即始	偽 實 是 無 虛 如 必 當 理 不 誑 非 妄 不 異 即 始 
T33n1698_001:0080b28	終恒一。聖言不謬故宜修行也。無實無虛下	終 恒 一 聖 言 不 謬 故 宜 修 行 也 無 實 無 虛 下 
T33n1698_001:0080b29	第三舉所得法為證。寄實以非虛何實之可	第 三 舉 所 得 法 為 證 寄 實 以 非 虛 何 實 之 可 
T33n1698_001:0080c01	得耶。若疑我說法非者及能說人亦非者。今	得 耶 若 疑 我 說 法 非 者 及 能 說 人 亦 非 者 今 
T33n1698_001:0080c02	我所證得法只自如此心實作此證。不實不	我 所 證 得 法 只 自 如 此 心 實 作 此 證 不 實 不 
T33n1698_001:0080c03	虛兩捨。無生無滅等例然。故所說如所得非	虛 兩 捨 無生無滅 等 例 然 故 所 說 如 所 得 非 
T33n1698_001:0080c04	虛言也。菩薩心住法下第五舉譬顯住相非	虛 言 也 菩 薩 心 住 法 下 第 五 舉 譬 顯 住 相 非 
T33n1698_001:0080c05	曉冥若夜遊。前舉有得為非後明無得為是。	曉 冥 若 夜 遊 前 舉 有 得 為 非 後 明 無 得 為 是 
T33n1698_001:0080c06	若住色香等行施不能得見諸法。若不住法	若 住 色 香 等 行 施 不 能 得 見 諸 法 若 不 住 法 
T33n1698_001:0080c07	行施如有目日光能得見色。無我三事即不	行 施 如 有 目 日 光 能 得 見 色 無 我 三 事 即 不 
T33n1698_001:0080c08	住相也。慧見為目理境為日。萬行顯別為種	住 相 也 慧 見 為 目 理 境 為 日 萬 行 顯 別 為 種 
T33n1698_001:0080c09	種色。諸法本來空。菩薩觀心復知其無所有	種 色 諸 法 本 來 空 菩 薩 觀 心 復 知 其 無 所 有 
T33n1698_001:0080c10	而行布施者。即所見明了。此中先法後譬直	而 行 布 施 者 即 所 見 明 了 此 中 先 法 後 譬 直 
T33n1698_001:0080c11	說譬耳。當來之世下第二能。如是解即仰參	說 譬 耳 當來之世 下 第 二 能 如 是 解 即 仰 參 
T33n1698_001:0080c12	佛說。當來若能受持即為佛悉知見。皆得成	佛 說 當 來 若 能 受 持 即 為 佛 悉 知 見 皆 得 成 
T33n1698_001:0080c13	就無量無邊功德。如來所見理用非謬明將	就 無量無邊 功 德 如 來 所 見 理 用 非 謬 明 將 
T33n1698_001:0080c14	來宜加勤修也。日三時捨下是第三福多。若	來 宜 加 勤 修 也 日 三 時 捨 下 是 第 三 福 多 若 
T33n1698_001:0080c15	能如是信者勝一日三時以恒河沙身之與	能 如 是 信 者 勝 一 日 三 時 以 恒 河 沙 身 之 與 
T33n1698_001:0080c16	命布施。分一日為三分故言初中後。施重又	命 布 施 分 一 日 為 三 分 故 言 初 中 後 施 重 又 
T33n1698_001:0080c17	多功德彌曠。若於此經生心不逆。福勝前施。	多 功 德 彌 曠 若 於 此 經 生 心 不 逆 福 勝 前 施 
T33n1698_001:0080c18	施即有限信心無極。何況書寫持讀誦說但	施 即 有 限 信 心 無 極 何 況 書 寫 持 讀 誦 說 但 
T33n1698_001:0081a01	言以信況復弘持也。以要言之下答上無所	言 以 信 況 復 弘 持 也 以要言之 下 答 上 無 所 
T33n1698_001:0081a02	有。如是有不可思議事也。能知諸法本來無	有 如 是 有 不可思議 事 也 能 知 諸 法 本 來 無 
T33n1698_001:0081a03	所有而以無所有為有。即不可思議。此文有	所 有 而 以 無 所 有 為 有 即 不可思議 此 文 有 
T33n1698_001:0081a04	十。第一經不可思議。理圓道極言即盡美。提	十 第 一 經 不可思議 理 圓 道 極 言 即 盡 美 提 
T33n1698_001:0081a05	宗表實約言之耳。物莫能測不思議也。算數	宗 表 實 約 言 之 耳 物 莫 能 測 不 思 議 也 算 數 
T33n1698_001:0081a06	不該不可稱量也。蕩然無涯無邊耳。以要言	不 該 不可稱量 也 蕩 然 無 涯 無 邊 耳 以 要 言 
T33n1698_001:0081a07	之略此三句矣。文理平等無所有如是有。非	之 略 此 三 句 矣 文 理 平 等 無 所 有 如 是 有 非 
T33n1698_001:0081a08	般若為般若非身相為身相皆不思議也。第	般 若 為 般 若 非 身 相 為 身 相 皆 不 思 議 也 第 
T33n1698_001:0081a09	二為大乘者說為最上乘者說。此經在始便	二 為 大 乘 者 說 為 最 上 乘 者 說 此 經 在 始 便 
T33n1698_001:0081a10	為大乘不為三乘。廣運無涯謂之大乘。超三	為 大 乘 不 為 三 乘 廣 運 無 涯 謂 之 大 乘 超 三 
T33n1698_001:0081a11	乘之勝謂之為最上。自非其人不謬說也。包	乘 之 勝 謂 之 為 最 上 自 非 其 人 不 謬 說 也 包 
T33n1698_001:0081a12	含名大無勝最上。如來悉知見者人高道曠	含 名 大 無 勝 最 上 如 來 悉 知 見 者 人 高 道 曠 
T33n1698_001:0081a13	唯佛見之。荷擔菩提千載不墜。由於人弘任	唯 佛 見 之 荷 擔 菩 提 千 載 不 墜 由 於 人 弘 任 
T33n1698_001:0081a14	持運行荷擔義也。背荷肩擔非身而身實相	持 運 行 荷 擔 義 也 背 荷 肩 擔 非 身 而 身 實 相 
T33n1698_001:0081a15	法身。非因非果即是兩肩也。第三何以故下	法 身 非 因 非 果 即 是 兩 肩 也 第 三 何 以 故 下 
T33n1698_001:0081a16	三乘不堪聞不信受樂。小是二乘著我是凡	三 乘 不 堪 聞 不 信 受 樂 小 是 二 乘 著 我 是 凡 
T33n1698_001:0081a17	夫著見是外道。不能讀誦以失釋得也。第	夫 著 見 是 外 道 不 能 讀 誦 以 失 釋 得 也 第 
T33n1698_001:0081a18	四在在處處下。地是無知法處故貴。雖復廢	四 在在處處 下 地 是 無 知 法 處 故 貴 雖 復 廢 
T33n1698_001:0081a19	言息義此處常有天龍圍遶如帝王所居之	言 息 義 此 處 常 有 天 龍 圍 遶 如 帝 王 所 居 之 
T33n1698_001:0081a20	處。人皆宗重天人供養此處是塔。恭敬作禮	處 人 皆 宗 重 天 人 供 養 此 處 是 塔 恭 敬 作 禮 
T33n1698_001:0081a21	香花而散也。第五轉障。本有重障習學般	香 花 而 散 也 第 五 轉 障 本 有 重 障 習 學 般 
T33n1698_001:0081a22	若先世重罪現在輕受。止為人輕賤過去重	若 先 世 重 罪 現 在 輕 受 止 為 人 輕 賤 過 去 重 
T33n1698_001:0081a23	罪即得消滅。罪起由惑福生於解。福解既積	罪 即 得 消 滅 罪 起 由 惑 福 生 於 解 福 解 既 積 
T33n1698_001:0081a24	宿殃滅矣。第六當得菩提即受記也。累滅	宿 殃 滅 矣 第 六 當 得 菩 提 即 受 記 也 累 滅 
T33n1698_001:0081a25	解生菩提可登故佛懸記。第七我念過去下	解 生 菩 提 可 登 故 佛 懸 記 第 七 我 念 過 去 下 
T33n1698_001:0081a26	明能持經者所得福德勝佛往行。然燈佛時	明 能 持 經 者 所 得 福 德 勝 佛 往 行 然 燈 佛 時 
T33n1698_001:0081a27	始獲無生忍。今能無所得心而持經者得福	始 獲 無 生 忍 今 能 無 所 得 心 而 持 經 者 得 福 
T33n1698_001:0081a28	勝我。阿僧祇佛所值八百四千萬億那由他	勝 我 阿 僧 祇 佛 所 值 八 百 四 千 萬 億 那 由 他 
T33n1698_001:0081a29	佛。供養無空過者福德算數不及。心限即福	佛 供 養 無 空 過 者 福 德 算 數 不 及 心 限 即 福 
T33n1698_001:0081b01	少意曠則功德多也。第八於末世下明若。具	少 意 曠 則 功 德 多 也 第 八 於 末 世 下 明 若 具 
T33n1698_001:0081b02	說無所得持經所得福。時人聞則狂亂狐疑	說 無 所 得 持 經 所 得 福 時 人 聞 則 狂 亂 狐 疑 
T33n1698_001:0081b03	不信。解通人曠德必無涯。狂亂不信不足明	不 信 解 通 人 曠 德 必 無 涯 狂 亂 不 信 不 足 明 
T33n1698_001:0081b04	道也。第九義不可思議萬行淵深。義能誰	道 也 第 九 義 不可思議 萬 行 淵 深 義 能 誰 
T33n1698_001:0081b05	測。以無所得無所有如是有無所有為義。以	測 以 無 所 得 無 所 有 如 是 有 無 所 有 為 義 以 
T33n1698_001:0081b06	非般若為般若義故不可思議。第十果報	非 般 若 為 般 若 義 故 不可思議 第 十 果 報 
T33n1698_001:0081b07	不可思議菩提妙果豈有心之所議。如華嚴	不可思議 菩 提 妙 果 豈 有 心 之 所 議 如 華 嚴 
T33n1698_001:0081b08	經明初發心便成正覺。與微塵法界眾生為	經 明 初 發 心 便 成 正 覺 與 微 塵 法 界 眾 生 為 
T33n1698_001:0081b09	眷屬。故知果報不可思議也。須菩提問下第	眷 屬 故 知 果 報 不可思議 也 須 菩 提 問 下 第 
T33n1698_001:0081b10	二周重說。般若或為後來或是為鈍根者。文	二 周 重 說 般 若 或 為 後 來 或 是 為 鈍 根 者 文 
T33n1698_001:0081b11	亦三叚。初從問去至福德多明體。次佛可以	亦 三 叚 初 從 問 去 至 福 德 多 明 體 次 佛 可 以 
T33n1698_001:0081b12	色身見去至前偈辨名。後如來不以具足相	色 身 見 去 至 前 偈 辨 名 後 如 來 不 以 具 足 相 
T33n1698_001:0081b13	故至壽者見明用並無所有。就體中辨於三	故 至 壽 者 見 明 用 並 無 所 有 就 體 中 辨 於 三 
T33n1698_001:0081b14	假。初受假次名假後法假受是人。人即有名	假 初 受 假 次 名 假 後 法 假 受 是 人 人 即 有 名 
T33n1698_001:0081b15	此人之與名有能成之法。三假是立法云何	此 人 之 與 名 有 能 成 之 法 三 假 是 立 法 云 何 
T33n1698_001:0081b16	將三假釋無所有。三假乃是立法亦是壞法。	將 三 假 釋 無 所 有 三 假 乃 是 立 法 亦 是 壞 法 
