T33n1706_003:0298b01	不可多。請必有主。姑推匿王為首。佛知請意	不 可 多 請 必 有 主 姑 推 匿 王 為 首 佛 知 請 意 
T33n1706_003:0298b02	不局一人。法當爾耳。吾今下。因開二護廣其	不 局 一 人 法 當 爾 耳 吾 今 下 因 開 二 護 廣 其 
T33n1706_003:0298b03	所請。亦為生后二品。作張本故。如文云云。過	所 請 亦 為 生 后 二 品 作 張 本 故 如 文 云 云 過 
T33n1706_003:0298b04	十地行因本應生教化品文。言散華者誤耳。	十 地 行 因 本 應 生 教 化 品 文 言 散 華 者 誤 耳 
T33n1706_003:0298b05	彼諸國王雖有此意。但是機扣於佛。而佛開	彼 諸 國 王 雖 有 此 意 但 是 機 扣 於 佛 而 佛 開 
T33n1706_003:0298b06	二護過其所扣。則又應之深者也。意如後見。	二 護 過 其 所 扣 則 又 應 之 深 者 也 意 如 後 見 
T33n1706_003:0298b07	問王下。簡開二護所以。答中凡約多意申之。	問 王 下 簡 開 二 護 所 以 答 中 凡 約 多 意 申 之 
T33n1706_003:0298b08	初以麁妙難易言者。則王但知其一而不知	初 以 麁 妙 難 易 言 者 則 王 但 知 其 一 而 不 知 
T33n1706_003:0298b09	其二。佛具知之。彼此兼到過其所扣也。又以	其 二 佛 具 知 之 彼 此 兼 到 過 其 所 扣 也 又 以 
T33n1706_003:0298b10	世出世真俗論者。使國土縱安而生憍慢。不	世 出 世 真 俗 論 者 使 國 土 縱 安 而 生 憍 慢 不 
T33n1706_003:0298b11	若今陳出世因果則真俗俱當。又約索有多	若 今 陳 出 世 因 果 則 真 俗 俱 當 又 約 索 有 多 
T33n1706_003:0298b12	少者。若索少賜多。得師弟子之體。如法華索	少 者 若 索 少 賜 多 得 師 弟 子 之 體 如 法 華 索 
T33n1706_003:0298b13	車請三與一過本所望。豈不快哉。又衣不貪	車 請 三 與 一 過 本 所 望 豈不快哉 又 衣 不 貪 
T33n1706_003:0298b14	不慳可知。慈導之志者。謂慈悲能導。此並在	不 慳 可 知 慈 導 之 志 者 謂 慈 悲 能 導 此 並 在 
T33n1706_003:0298b15	佛。志應作意。然猶分別之說。若相濟為言。則	佛 志 應 作 意 然 猶 分 別 之 說 若 相 濟 為 言 則 
T33n1706_003:0298b16	護果護因必資般若之力。使因果俱護。信行	護 果 護 因 必 資 般 若 之 力 使 因 果 俱 護 信 行 
T33n1706_003:0298b17	大乘。何有國土而不安乎。王聞二護之言三	大 乘 何 有 國 土 而 不 安 乎 王 聞 二 護 之 言 三 
T33n1706_003:0298b18	慧之語勸發。稱善以美之極。言大事因緣。以	慧 之 語 勸 發 稱 善 以 美 之 極 言 大 事 因 緣 以 
T33n1706_003:0298b19	褒揚之。其理可謂至矣。非特般若為然。凡一	褒 揚 之 其 理 可 謂 至 矣 非 特 般 若 為 然 凡 一 
T33n1706_003:0298b20	代顯頓之說。皆得以言之。故疏類舉諸文為	代 顯 頓 之 說 皆 得 以 言 之 故 疏 類 舉 諸 文 為 
T33n1706_003:0298b21	說是也。散華下。約表法釋。凡諸事供必表法	說 是 也 散 華 下 約 表 法 釋 凡 諸 事 供 必 表 法 
T33n1706_003:0298b22	門。此亦釋經之法。若直事解。何足以見行因	門 此 亦 釋 經 之 法 若 直 事 解 何 足 以 見 行 因 
T33n1706_003:0298b23	得果。起化之義。故以事表理。兩得之矣。廣明	得 果 起 化 之 義 故 以 事 表 理 兩 得 之 矣 廣 明 
T33n1706_003:0298b24	二護為二。初爾時下躡上。請問文兼二護。答	二 護 為 二 初 爾 時 下 躡 上 請 問 文 兼 二 護 答 
T33n1706_003:0298b25	中合先答護果。而言化四生者。故知二護雖	中 合 先 答 護 果 而 言 化 四 生 者 故 知 二 護 雖 
T33n1706_003:0298b26	該因果實以度生為本。謂以佛果化眾生。及	該 因 果 實 以 度 生 為 本 謂 以 佛 果 化 眾 生 及 
T33n1706_003:0298b27	以因行化眾生是也。但佛所證性本亡離。何	以 因 行 化 眾 生 是 也 但 佛 所 證 性 本 亡 離 何 
T33n1706_003:0298b28	護之有。故寄因明果。直從行釋。苟於行無著	護 之 有 故 寄 因 明 果 直 從 行 釋 苟 於 行 無 著 
T33n1706_003:0298b29	理當自明。既文從行結。而又曰菩薩修佛果	理 當 自 明 既 文 從 行 結 而 又 曰 菩 薩 修 佛 果 
T33n1706_003:0298c01	為若此等。故知寄因明果其理彰矣。言所化	為 若 此 等 故 知 寄 因 明 果 其 理 彰 矣 言 所 化 
T33n1706_003:0298c02	境。如疏云云。而一皆如幼五道之所從出。	境 如 疏 云 云 而 一 皆 如 幼 五 道 之 所 從 出 
T33n1706_003:0298c03	若論所化。本該九界。今且從界內能生云爾。	若 論 所 化 本 該 九 界 今 且 從 界 內 能 生 云 爾 
T33n1706_003:0298c04	二明能化智。則不觀色如等。凡五科。今束為	二 明 能 化 智 則 不 觀 色 如 等 凡 五 科 今 束 為 
T33n1706_003:0298c05	四。謂一者五陰我人知見。即所化眾生。經以	四 謂 一 者 五 陰 我 人 知 見 即 所 化 眾 生 經 以 
T33n1706_003:0298c06	常樂我淨如綴我人下。恐差誤。義見後文二	常樂我淨 如 綴 我 人 下 恐 差 誤 義 見 後 文 二 
T33n1706_003:0298c07	菩薩如等。即能化人法。三佛果即所護四德。	菩 薩 如 等 即 能 化 人 法 三 佛 果 即 所 護 四 德 
T33n1706_003:0298c08	此可兼見護果之義。四二諦即二護所依。而	此 可 兼 見 護 果 之 義 四 二 諦 即 二 護 所 依 而 
T33n1706_003:0298c09	皆言不觀等。則遮其所非。謂今般若能觀觀	皆 言 不 觀 等 則 遮 其 所 非 謂 今 般 若 能 觀 觀 
T33n1706_003:0298c10	智。以空慧為本。故不觀色是遮其有也。不觀	智 以 空 慧 為 本 故 不 觀 色 是 遮 其 有 也 不 觀 
T33n1706_003:0298c11	如是遮其空也。唯觀法性真實空。如疏釋云	如 是 遮 其 空 也 唯 觀 法 性 真 實 空 如 疏 釋 云 
T33n1706_003:0298c12	云。是皆以偏見故不觀。若知一切法性下。懸	云 是 皆 以 偏 見 故 不 觀 若 知一切法 性 下 懸 
T33n1706_003:0298c13	取後文意說。是皆以圓智故。則何所不觀。何	取 後 文 意 說 是 皆 以 圓 智 故 則 何 所 不 觀 何 
T33n1706_003:0298c14	所不攝。雖不言所是而理在其中。故結云如	所 不 攝 雖 不 言 所 是 而 理 在 其 中 故 結 云 如 
T33n1706_003:0298c15	虛空。是為真空之空。不礙妙有之有。舉斯以	虛 空 是 為 真 空 之 空 不 礙 妙 有 之 有 舉 斯 以 
T33n1706_003:0298c16	況。則一皆無我無相。是為菩薩下。結行成護	況 則 一 皆 無 我 無 相 是 為 菩 薩 下 結 行 成 護 
T33n1706_003:0298c17	因義。本釋在次品。今結此中者。寄顯護果義。	因 義 本 釋 在 次 品 今 結 此 中 者 寄 顯 護 果 義 
T33n1706_003:0298c18	非正結因。亦與上標宗文旨一貫也。若如即	非 正 結 因 亦 與 上 標 宗 文 旨 一 貫 也 若 如 即 
T33n1706_003:0298c19	色為別見者。不出從空出假之義。常樂我淨	色 為 別 見 者 不 出 從 空 出 假 之 義 常樂我淨 
T33n1706_003:0298c20	如句。若移置一切行如下。文義極便。但聖經	如 句 若 移 置 一 切 行 如 下 文 義 極 便 但 聖 經 
T33n1706_003:0298c21	不可輒爾。且當仍舊。疏約對前五陰作顛倒	不 可 輒 爾 且 當 仍 舊 疏 約 對 前 五 陰 作 顛 倒 
T33n1706_003:0298c22	不顛倒釋等。非無此理云云。而曰隨盡煩惱	不 顛 倒 釋 等 非 無 此 理 云 云 而 曰 隨 盡 煩 惱 
T33n1706_003:0298c23	等者。謂對所滅五陰該於九界故。隨煩惱滅	等 者 謂 對 所 滅 五 陰 該 於 九 界 故 隨 煩 惱 滅 
T33n1706_003:0298c24	處雖有淺深。而所顯性則一而已。亦猶氷水	處 雖 有 淺 深 而 所 顯 性 則 一 而 已 亦 猶 氷 水 
T33n1706_003:0298c25	之漸融釋也。知見壽者。如本當連上眾生我	之 漸 融 釋 也 知 見 壽 者 如 本 當 連 上 眾 生 我 
T33n1706_003:0298c26	人。亦緣前句所間故。以知見作對位釋。更當	人 亦 緣 前 句 所 間 故 以 知 見 作 對 位 釋 更 當 
T33n1706_003:0298c27	詳之。菩薩如下。疏簡淨名一切皆如之言。似	詳 之 菩 薩 如 下 疏 簡 淨 名 一 切 皆 如 之 言 似 
T33n1706_003:0298c28	與今同若為異耶。答中彼斥授記故。以真空	與 今 同 若 為 異 耶 答 中 彼 斥 授 記 故 以 真 空 
T33n1706_003:0298c29	奪之。今顯諸法皆如故。以妙有為說。又以動	奪 之 今 顯 諸 法 皆 如 故 以 妙 有 為 說 又 以 動 
T33n1706_003:0299a01	寂等對釋。並如疏可知。然以斷常而顯中道。	寂 等 對 釋 並 如 疏 可 知 然 以 斷 常 而 顯 中 道 
T33n1706_003:0299a02	未出阿含所離之中。應以妙疏所離雖近能	未 出 阿 含 所 離 之 中 應 以 妙 疏 所 離 雖 近 能 
T33n1706_003:0299a03	離實遠成之。又以淨名有曰不觀色色如色	離 實 遠 成 之 又 以 淨 名 有 曰 不 觀 色 色 如 色 
T33n1706_003:0299a04	性之文。揀之云云。但是情執之未袪。惑取之	性 之 文 揀 之 云 云 但 是 情 執 之 未 袪 惑 取 之 
T33n1706_003:0299a05	未亡。觀道之未融。理性之未顯。皆所當遣亦	未 亡 觀 道 之 未 融 理 性 之 未 顯 皆 所 當 遣 亦 
T33n1706_003:0299a06	所當護也。餘文如前釋可知。白佛言下。廣上	所 當 護 也 餘 文 如 前 釋 可 知 白 佛 言 下 廣 上 
T33n1706_003:0299a07	觀空起後菩薩修護佛果見三般若義。初約	觀 空 起 後 菩 薩 修 護 佛 果 見 三 般 若 義 初 約 
T33n1706_003:0299a08	不住明實相般若。先領上為問。謂若諸法悉	不 住 明 實 相 般 若 先 領 上 為 問 謂 若 諸 法 悉 
T33n1706_003:0299a09	如前云爾者。為菩薩護化眾生。則無眾生可	如 前 云 爾 者 為 菩 薩 護 化 眾 生 則 無 眾 生 可 
T33n1706_003:0299a10	化。為化眾生則有眾生可化。若為有無邪。問	化 為 化 眾 生 則 有 眾 生 可 化 若 為 有 無 邪 問 
T33n1706_003:0299a11	既隱略。答亦難明。於是申以二意焉。謂真則	既 隱 略 答 亦 難 明 於 是 申 以 二 意 焉 謂 真 則 
T33n1706_003:0299a12	無化。俗則有化故。自法性色下。明真則無化。	無 化 俗 則 有 化 故 自 法 性 色 下 明 真 則 無 化 
T33n1706_003:0299a13	謂法性五陰者。即常樂我淨境也。皆所不住	謂 法 性 五 陰 者 即 常樂我淨 境 也 皆 所 不 住 
T33n1706_003:0299a14	等觀也。舊例多釋經本三句。今加作四句云	等 觀 也 舊 例 多 釋 經 本 三 句 今 加 作 四 句 云 
T33n1706_003:0299a15	云。四句三觀既皆不住。則不住亦不住。以悉	云 四 句 三 觀 既 皆 不 住 則 不 住 亦 不 住 以 悉 
T33n1706_003:0299a16	皆如故。即實相中道之體。於是明矣。故以真	皆 如 故 即 實 相 中 道 之 體 於 是 明 矣 故 以 真 
T33n1706_003:0299a17	言之。安有眾生假實而可得邪。次明俗則有	言 之 安 有 眾 生 假 實 而 可 得 邪 次 明 俗 則 有 
T33n1706_003:0299a18	化。則曰以世諦三假故名見眾生。而又曰一	化 則 曰 以 世 諦 三 假 故 名 見 眾 生 而 又 曰 一 
T33n1706_003:0299a19	切法性實故者。謂稱實而見則無眾生可見	切 法 性 實 故 者 謂 稱 實 而 見 則 無 眾 生 可 見 
T33n1706_003:0299a20	也。如是乃至諸佛聖賢亦皆名見。亦皆非見。	也 如 是 乃 至 諸 佛 聖 賢 亦 皆 名 見 亦 皆 非 見 
T33n1706_003:0299a21	例此而言。見有正邪。謂正見見也。邪見爾見	例 此 而 言 見 有 正 邪 謂 正 見 見 也 邪 見 爾 見 
T33n1706_003:0299a22	也。今以假名之名。名見一切法。則知諸佛凡	也 今 以 假 名 之 名 名 見 一 切 法 則 知 諸 佛 凡 
T33n1706_003:0299a23	聖爾。皆以非見而見稱性見一切法也。是則	聖 爾 皆 以 非 見 而 見 稱 性 見 一 切 法 也 是 則 
T33n1706_003:0299a24	二諦雖異。以建化故護果護因。未始偏廢也。	二 諦 雖 異 以 建 化 故 護 果 護 因 未 始 偏 廢 也 
T33n1706_003:0299a25	此中三假非成實因成等三。以今非小教故	此 中 三 假 非 成 實 因 成 等 三 以 今 非 小 教 故 
T33n1706_003:0299a26	也。然或引於二空文。後爾得以小成大也云	也 然 或 引 於 二 空 文 後 爾 得 以 小 成 大 也 云 
T33n1706_003:0299a27	云。二約能照義明觀照般若。而言有法非非	云 二 約 能 照 義 明 觀 照 般 若 而 言 有 法 非 非 
T33n1706_003:0299a28	法摩訶衍者。疏出問意云云。今謂有法者。提	法 摩 訶 衍 者 疏 出 問 意 云 云 今 謂 有 法 者 提 
T33n1706_003:0299a29	所照境也。非非法者。其言猶總略。正應云	所 照 境 也 非 非 法 者 其 言 猶 總 略 正 應 云 
T33n1706_003:0299b01	法非法皆非非法。謂法者有也。非法者空也。	法 非 法 皆 非 非 法 謂 法 者 有 也 非 法 者 空 也 
T33n1706_003:0299b02	非非法者非其非法。則空之又空。即中道第	非 非 法 者 非 其 非 法 則 空 之 又 空 即 中 道 第 
T33n1706_003:0299b03	一義畢竟空也。據下答文。正應如是而照。為	一 義 畢 竟 空 也 據 下 答 文 正 應 如 是 而 照 為 
T33n1706_003:0299b04	未解者非常情所到。故曰摩訶衍云何照。所	未 解 者 非 常 情 所 到 故 曰 摩 訶 衍 云 何 照 所 
T33n1706_003:0299b05	以正領上文。以生答意。摩訶衍此翻大乘。與	以 正 領 上 文 以 生 答 意 摩 訶 衍 此 翻 大 乘 與 
T33n1706_003:0299b06	今般若同出異名爾。佛答以於般若自性見	今 般 若 同 出 異 名 爾 佛 答 以 於 般 若 自 性 見 
T33n1706_003:0299b07	非非法。苟能如是而照。則能空其空。此法所	非 非 法 苟 能 如 是 而 照 則 能 空 其 空 此 法 所 
T33n1706_003:0299b08	以非非法。故名非非法空。既言法空而又曰	以 非 非 法 故 名 非 非 法 空 既 言 法 空 而 又 曰 
T33n1706_003:0299b09	法性空者。謂此空非照已方空。非作得故空。	法 性 空 者 謂 此 空 非 照 已 方 空 非 作 得 故 空 
T33n1706_003:0299b10	直由般若性離無自性故。理本自空也。所謂	直 由 般 若 性 離 無 自 性 故 理 本 自 空 也 所 謂 
T33n1706_003:0299b11	受想行識空乃至十二緣空。皆其理也。故此	受 想 行 識 空 乃 至 十 二 緣 空 皆 其 理 也 故 此 
T33n1706_003:0299b12	下。歷法明空。疏引大論約六門明之。謂果報	下 歷 法 明 空 疏 引 大 論 約 六 門 明 之 謂 果 報 
T33n1706_003:0299b13	空等空雖是一而義類復不同。五陰是果報	空 等 空 雖 是 一 而 義 類 復 不 同 五 陰 是 果 報 
T33n1706_003:0299b14	空者。以是報陰法故。十二入受用空者。以其	空 者 以 是 報 陰 法 故 十 二 入 受 用 空 者 以 其 
T33n1706_003:0299b15	根境相對受用各別故。十八界性別空者。加	根 境 相 對 受 用 各 別 故 十 八 界 性 別 空 者 加 
T33n1706_003:0299b16	以六識。分一精明為六和合。成見聞覺知別	以 六 識 分 一 精 明 為 六 和 合 成 見聞覺知 別 
T33n1706_003:0299b17	故。所以只一色心而有陰入界開合異者。以所	故 所 以 只 一 色 心 而 有 陰 入 界 開 合 異 者 以 所 
T33n1706_003:0299b18	病不同故也。故曰云云。餘論疑或作迷。言迷	病 不 同 故 也 故 曰 云 云 餘 論 疑 或 作 迷 言 迷 
T33n1706_003:0299b19	尤顯。六大名遍到空。謂其大大各遍一切。而	尤 顯 六 大 名 遍 到 空 謂 其 大 大 各 遍 一 切 而 
T33n1706_003:0299b20	有相傾凌滅之相。此復別明如楞嚴云云。又	有 相 傾 凌 滅 之 相 此 復 別 明 如 楞 嚴 云 云 又 
T33n1706_003:0299b21	引阿含明六王互諍云云。謂五各有用而識	引 阿 含 明 六 王 互 諍 云 云 謂 五 各 有 用 而 識 
T33n1706_003:0299b22	為主故。居中則勝也。因緣義空者。謂三世	為 主 故 居 中 則 勝 也 因 緣 義 空 者 謂 三 世 
T33n1706_003:0299b23	因果有緣生緣滅之義。而與諦境總別有殊	因 果 有 緣 生 緣 滅 之 義 而 與 諦 境 總 別 有 殊 
T33n1706_003:0299b24	云云。是法下。約三義釋成。然生滅等本非空	云 云 是 法 下 約 三 義 釋 成 然 生 滅 等 本 非 空 
T33n1706_003:0299b25	義。今取其速疾不停傍顯即空。其旨益明。故	義 今 取 其 速 疾 不 停 傍 顯 即 空 其 旨 益 明 故 
T33n1706_003:0299b26	曰云云。即有即空者。總結諸法之有歸即空	曰 云 云 即 有 即 空 者 總 結 諸 法 之 有 歸 即 空 
T33n1706_003:0299b27	義。與疏小別。論引諸小乘師明生滅前後同	義 與 疏 小 別 論 引 諸 小 乘 師 明 生 滅 前 後 同 
T33n1706_003:0299b28	異。一一覈之。然皆有過云云。疾炎過鋒者。正	異 一 一 覈 之 然 皆 有 過 云 云 疾 炎 過 鋒 者 正 
T33n1706_003:0299b29	應云疾炎奔緣過鋒經刃。取其至疾無迹。喻	應 云 疾 炎 奔 緣 過 鋒 經 刃 取 其 至 疾 無 迹 喻 
T33n1706_003:0299c01	上空義而已。上以諸法顯則曰是法即生即	上 空 義 而 已 上 以 諸 法 顯 則 曰 是 法 即 生 即 
T33n1706_003:0299c02	滅。次以心念明則曰剎那剎那。然意猶難曉。	滅 次 以 心 念 明 則 曰 剎 那 剎 那 然 意 猶 難 曉 
T33n1706_003:0299c03	故復徵釋云云。九十剎那等如經未檢。夫以	故 復 徵 釋 云 云 九 十 剎 那 等 如 經 未 檢 夫 以 
T33n1706_003:0299c04	一剎那極短之時。而經九百生滅。使以情量	一 剎 那 極 短 之 時 而 經 九 百 生 滅 使 以 情 量 
T33n1706_003:0299c05	分別終不可解。以不思議意會之可也。若乃	分 別 終 不 可 解 以 不 思 議 意 會 之 可 也 若 乃 
T33n1706_003:0299c06	以圓頓教旨明之。所謂一念普觀無量劫等。	以 圓 頓 教 旨 明 之 所 謂 一 念 普 觀 無 量 劫 等 
T33n1706_003:0299c07	則九百生滅惡足道哉。當以理求。難以言盡	則 九 百 生 滅 惡 足 道 哉 當 以 理 求 難 以 言 盡 
T33n1706_003:0299c08	云云。九十剎那下。釋通。即空凡二義。若自	云 云 九 十 剎 那 下 釋 通 即 空 凡 二 義 若 自 
T33n1706_003:0299c09	一之多。謂一念攝九十剎那。一剎那攝九百	一 之 多 謂 一 念 攝 九 十 剎 那 一 剎 那 攝 九 百 
T33n1706_003:0299c10	生滅。九十剎那義當八萬一千生滅。求其定	生 滅 九 十 剎 那 義 當 八 萬 一 千 生 滅 求 其 定 
T33n1706_003:0299c11	實不可得。則此心空矣。又自多之少。謂生滅	實 不 可 得 則 此 心 空 矣 又 自 多 之 少 謂 生 滅 
T33n1706_003:0299c12	不出剎那。剎那不出一念。於其念中求定實	不 出 剎 那 剎 那 不 出 一 念 於 其 念 中 求 定 實 
T33n1706_003:0299c13	爾不可得。則此念空矣。故曰如是心法不可	爾 不 可 得 則 此 念 空 矣 故 曰 如 是 心 法 不 可 
T33n1706_003:0299c14	得。此名心空也。但了心空諸法自泯。心法泯	得 此 名 心 空 也 但 了 心 空 諸 法 自 泯 心 法 泯 
T33n1706_003:0299c15	處落空者誰。又以四大分(應作去呼)諸根下。例推四	處 落 空 者 誰 又 以 四 大 分 應 作 去 呼 諸 根 下 例 推 四 
T33n1706_003:0299c16	大至於極微。分分不可得。如是推析至於隣	大 至 於 極 微 分 分 不 可 得 如 是 推 析 至 於 隣 
T33n1706_003:0299c17	虛。是為正析。非同邪外之析也。色盡心窮豁	虛 是 為 正 析 非 同 邪 外 之 析 也 色 盡 心 窮 豁 
T33n1706_003:0299c18	然無住。可謂至矣。而猶止是生滅。為護三藏	然 無 住 可 謂 至 矣 而 猶 止 是 生 滅 為 護 三 藏 
T33n1706_003:0299c19	佛果而已。望大無生無量無作相去遠矣。奈	佛 果 而 已 望 大 無 生 無 量 無 作 相 去 遠 矣 奈 
T33n1706_003:0299c20	何今人欲以麁心淺量議佛法之精微吾未見	何 今 人 欲 以 麁 心 淺 量 議 佛 法 之 精 微 吾 未 見 
T33n1706_003:0299c21	其能彷彿也。若見色空下。推明衍門教旨。其	其 能 彷 彿 也 若 見 色 空 下 推 明 衍 門 教 旨 其 
T33n1706_003:0299c22	文雖約理則至矣。如言通教體空。固無他說。	文 雖 約 理 則 至 矣 如 言 通 教 體 空 固 無 他 說 
T33n1706_003:0299c23	別詮心色而一而異者。以能造心是故不異。	別 詮 心 色 而 一 而 異 者 以 能 造 心 是 故 不 異 
T33n1706_003:0299c24	以所造法非故不一。又以教權故不一。理實	以 所 造 法 非 故 不 一 又 以 教 權 故 不 一 理 實 
T33n1706_003:0299c25	故不異。此正得別教之旨也。又圓明色心本	故 不 異 此 正 得 別 教 之 旨 也 又 圓 明 色 心 本 
T33n1706_003:0299c26	來空寂。善談即具旨在於斯。以護佛果則佛	來 空 寂 善 談 即 具 旨 在 於 斯 以 護 佛 果 則 佛 
T33n1706_003:0299c27	果各得其正。以護般若則般若斯明。以化眾	果 各 得 其 正 以 護 般 若 則 般 若 斯 明 以 化 眾 
T33n1706_003:0299c28	生則眾生斯度。不唯菩薩護持。而諸佛亦各	生 則 眾 生 斯 度 不 唯 菩 薩 護 持 而 諸 佛 亦 各 
T33n1706_003:0299c29	護念。何以故。以其理所同故也。不然則夭傷	護 念 何 以 故 以 其 理 所 同 故 也 不 然 則 夭 傷 
T33n1706_003:0300a01	慧命亡失法身者有之。於是得無懼乎。經復	慧 命 亡 失 法 身 者 有 之 於 是 得 無 懼 乎 經 復 
T33n1706_003:0300a02	以心例色。反復明之。故曰色亦如是。以般若	以 心 例 色 反 復 明 之 故 曰 色 亦 如 是 以 般 若 
T33n1706_003:0300a03	下。明能觀觀智。結成雙照。顯中空之旨。謂以	下 明 能 觀 觀 智 結 成 雙 照 顯 中 空 之 旨 謂 以 
T33n1706_003:0300a04	般若空故無相。無相故照。所照皆寂。大品所	般 若 空 故 無 相 無 相 故 照 所 照 皆 寂 大 品 所 
T33n1706_003:0300a05	謂波若者爾。般若存略耳。然於其中了無小	謂 波 若 者 爾 般 若 存 略 耳 然 於 其 中 了 無 小 
T33n1706_003:0300a06	法可得。故曰不見緣等。則諸法皆空名為不	法 可 得 故 曰 不 見 緣 等 則 諸法皆空 名 為 不 
T33n1706_003:0300a07	見。非謂不照名不見也。非見及見者。文缺一	見 非 謂 不 照 名 不 見 也 非 見 及 見 者 文 缺 一 
T33n1706_003:0300a08	所字。以皆亡相故。是為真實般若。即地住所	所 字 以 皆 亡 相 故 是 為 真 實 般 若 即 地 住 所 
T33n1706_003:0300a09	證。爾前通別無量教門謂接正等則相似般	證 爾 前 通 別 無 量 教 門 謂 接 正 等 則 相 似 般 
T33n1706_003:0300a10	若。至於歷法明空。亦謂空之分齊。謂略則十	若 至 於 歷 法 明 空 亦 謂 空 之 分 齊 謂 略 則 十 
T33n1706_003:0300a11	二如今文。或十八空如大論。疏列釋云云。然	二 如 今 文 或 十 八 空 如 大 論 疏 列 釋 云 云 然 
T33n1706_003:0300a12	則空本破有。有既空矣。有復何立而為俗邪。	則 空 本 破 有 有 既 空 矣 有 復 何 立 而 為 俗 邪 
T33n1706_003:0300a13	故曰但法集故有等。謂法有合散。散則為空	故 曰 但 法 集 故 有 等 謂 法 有 合 散 散 則 為 空 
T33n1706_003:0300a14	為真。合則為有為俗。集亦合也。兩者各論則	為 真 合 則 為 有 為 俗 集 亦 合 也 兩 者 各 論 則 
T33n1706_003:0300a15	為偏。偏則二邊而非中道。兩者並明則為	為 偏 偏 則 二 邊 而 非 中 道 兩 者 並 明 則 為 
T33n1706_003:0300a16	圓圓則中。中則妙。如斯而已矣。三假等對釋	圓 圓 則 中 中 則 妙 如 斯 而 已 矣 三 假 等 對 釋 
T33n1706_003:0300a17	可知。次明得失者。金剛般若所謂若見有法	可 知 次 明 得 失 者 金 剛 般 若 所 謂 若 見 有 法 
T33n1706_003:0300a18	可得則為著。我人眾生壽者。皆見也。苟此見	可 得 則 為 著 我 人 眾 生 壽 者 皆 見 也 苟 此 見 
T33n1706_003:0300a19	未亡則有法也。非無法也。非所謂開眼也。著	未 亡 則 有 法 也 非 無 法 也 非 所 謂 開 眼 也 著 
T33n1706_003:0300a20	合眼也。著若無此見則有無皆是。謂不異世	合 眼 也 著 若 無 此 見 則 有 無 皆 是 謂 不 異 世 
T33n1706_003:0300a21	間者。見同凡見。非正觀也。與夫如來出世間	間 者 見 同 凡 見 非 正 觀 也 與 夫 如 來 出 世 間 
T33n1706_003:0300a22	能了世間相者。敻然異矣。雖然若見世間法	能 了 世 間 相 者 敻 然 異 矣 雖 然 若 見 世 間 法 
T33n1706_003:0300a23	不合不散等。是則聖法凡境未始異未始不	不 合 不 散 等 是 則 聖 法 凡 境 未 始 異 未 始 不 
T33n1706_003:0300a24	異。固所取證如何耳。於諸法下。復宗明觀。	異 固 所 取 證 如 何 耳 於 諸 法 下 復 宗 明 觀 
T33n1706_003:0300a25	謂即色是空理極事遍。故曰不動。是法平	謂 即 色 是 空 理 極 事 遍 故 曰 不 動 是 法 平 
T33n1706_003:0300a26	等無二無別。故無到者。以本不生故。無可	等 無 二 無 別 故 無 到 者 以 本 不 生 故 無 可 
T33n1706_003:0300a27	滅。無相無無相故。諸法皆如。餘如疏釋。是即	滅 無 相 無 無 相 故 諸 法 皆 如 餘 如 疏 釋 是 即 
T33n1706_003:0300a28	初地下。明一念心具足八萬四千般若波羅	初 地 下 明 一 念 心 具 足 八萬四千 般 若 波 羅 
T33n1706_003:0300a29	蜜者。以一實理同故。翻惑為智故。破塵出	蜜 者 以 一 實 理 同 故 翻 惑 為 智 故 破 塵 出 
