T33n1698_001:0077a07	所言汝今諦聽下誡示聽。若不審諦即漏言	所 言 汝 今 諦 聽 下 誡 示 聽 若 不 審 諦 即 漏 言 
T33n1698_001:0077a08	遺理。誡令諦聽言理弗虛。唯然下受旨願	遺 理 誡 令 諦 聽 言 理 弗 虛 唯 然 下 受 旨 願 
T33n1698_001:0077a09	聞。慈誡許說敬肅傾心也。佛告下第二廣答	聞 慈 誡 許 說 敬 肅 傾 心 也 佛 告 下 第 二 廣 答 
T33n1698_001:0077a10	為三。初明般若體空無所有。次云何名下二	為 三 初 明 般 若 體 空無所有 次 云 何 名 下 二 
T33n1698_001:0077a11	明名空無所有。後忍辱下三明力用空無所	明 名 空無所有 後 忍 辱 下 三 明 力 用 空 無 所 
T33n1698_001:0077a12	有還。就初中更為三段。初正明體相空二信	有 還 就 初 中 更 為 三 段 初 正 明 體 相 空 二 信 
T33n1698_001:0077a13	者行深三信受福重。初體相中降心約願住	者 行 深 三 信 受 福 重 初 體 相 中 降 心 約 願 住 
T33n1698_001:0077a14	心約行皆無所有為無相因。法身無色為無	心 約 行 皆 無 所 有 為 無 相 因 法 身 無 色 為 無 
T33n1698_001:0077a15	得果。問何故。許中前住後降。答中先降	得 果 問 何 故 許 中 前 住 後 降 答 中 先 降 
T33n1698_001:0077a16	次住。互前後者。般若多含義非一轍。若約	次 住 互 前 後 者 般 若 多 含 義 非 一 轍 若 約 
T33n1698_001:0077a17	發心前願後行廣發誓願。權引於前次入實	發 心 前 願 後 行 廣 發 誓 願 權 引 於 前 次 入 實 
T33n1698_001:0077a18	相以無住法住於妙理。若約修行要須前修	相 以 無 住 法 住 於 妙 理 若 約 修 行 要 須 前 修 
T33n1698_001:0077a19	實慧次用權道。故有二觀次第。前住後降若	實 慧 次 用 權 道 故 有 二 觀 次 第 前 住 後 降 若 
T33n1698_001:0077a20	就證時。權實一心中悟不復前後。今就誓願	就 證 時 權 實 一 心 中 悟 不 復 前 後 今 就 誓 願 
T33n1698_001:0077a21	中有四心。一廣大。二第一。三常心。四不顛	中 有 四 心 一 廣 大 二 第 一 三 常 心 四 不 顛 
T33n1698_001:0077a22	倒菩薩發願普濟萬物無邊曠遠。故名大	倒 菩 薩 發 願 普 濟 萬 物 無 邊 曠 遠 故 名 大 
T33n1698_001:0077a23	心欲願與涅槃寂滅極樂故名第一。生死道長	心 欲 願 與 涅槃寂滅 極 樂 故 名 第 一 生 死 道 長 
T33n1698_001:0077a24	眾生性多。而誨人不倦名曰常心。不見能所	眾 生 性 多 而 誨 人 不 倦 名 曰 常 心 不 見 能 所 
T33n1698_001:0077a25	名不顛倒。釋大心者橫亘四生竪窮三界。四	名 不 顛 倒 釋 大 心 者 橫 亘 四 生 竪 窮 三 界 四 
T33n1698_001:0077a26	生是能住三界為所在。依[穀禾+卵]謂卵含藏曰胎。	生 是 能 住 三 界 為 所 在 依 [穀禾卵] 謂 卵 含 藏 曰 胎 
T33n1698_001:0077a27	假潤稱濕歘現名化。若有色即欲色二界。無	假 潤 稱 濕 歘 現 名 化 若 有 色 即 欲 色 二 界 無 
T33n1698_001:0077a28	色即空處。有想是識處。無想不用處。非有想	色 即 空 處 有 想 是 識 處 無 想 不 用 處 非 有 想 
T33n1698_001:0077a29	非無想即最上天。我皆令入下釋第一心。	非 無 想 即 最 上 天 我 皆 令 入 下 釋 第 一 心 
T33n1698_001:0077b01	法不自起因緣故生。但是因緣自性皆空。順	法 不 自 起 因 緣 故 生 但 是 因 緣 自 性 皆 空 順 
T33n1698_001:0077b02	理為解乖宗成惑。惑即生死流轉受身心苦。	理 為 解 乖 宗 成 惑 惑 即 生死流轉 受 身 心 苦 
T33n1698_001:0077b03	解即累滅苦盡寂然永樂。謂之滅度。小乘涅	解 即 累 滅 苦 盡 寂 然 永 樂 謂 之 滅 度 小 乘 涅 
T33n1698_001:0077b04	槃灰身滅智為無餘。大乘以累無不盡德無	槃 灰 身 滅 智 為 無 餘 大 乘 以 累 無 不 盡 德 無 
T33n1698_001:0077b05	不圓名為無餘。生滅觀在名有餘也。如是	不 圓 名 為 無 餘 生 滅 觀 在 名 有 餘 也 如 是 
T33n1698_001:0077b06	滅度下釋常心。若有能所即懈息以無休倦。	滅 度 下 釋 常 心 若 有 能 所 即 懈 息 以 無 休 倦 
T33n1698_001:0077b07	故名常心。度無量無邊實無度者。大品度空	故 名 常 心 度 無量無邊 實 無 度 者 大 品 度 空 
T33n1698_001:0077b08	品云。度眾生如度虛空明眾生無毫末可得。	品 云 度 眾 生 如 度 虛 空 明 眾 生 無 毫 末 可 得 
T33n1698_001:0077b09	只解眾生本來無所有即是悟。悟即名度。若	只 解 眾 生 本 來 無 所 有 即 是 悟 悟 即 名 度 若 
T33n1698_001:0077b10	有眾生可度者。佛菩薩等即得殺罪。於一身	有 眾 生 可 度 者 佛 菩 薩 等 即 得 殺 罪 於 一 身 
T33n1698_001:0077b11	理而為論。實無有眾生。眾生顛倒妄執謂有。	理 而 為 論 實 無 有 眾 生 眾 生 顛 倒 妄 執 謂 有 
T33n1698_001:0077b12	今佛菩薩憐愍說法令悟本無所有。名此悟	今 佛 菩 薩 憐 愍 說 法 令 悟 本 無 所 有 名 此 悟 
T33n1698_001:0077b13	為度。實無別有眾生異理而度著涅槃中也。	為 度 實 無 別 有 眾 生 異 理 而 度 著 涅 槃 中 也 
T33n1698_001:0077b14	何以故下釋不顛倒。以失顯德。若有我人	何 以 故 下 釋 不 顛 倒 以 失 顯 德 若 有 我 人 
T33n1698_001:0077b15	可言有滅。但是假名橫計人我。執我為非忘	可 言 有 滅 但 是 假 名 橫 計 人 我 執 我 為 非 忘 
T33n1698_001:0077b16	我為是。是非既彰得失明矣。大品中具明十	我 為 是 是 非 既 彰 得 失 明 矣 大 品 中 具 明 十 
T33n1698_001:0077b17	六。一我二眾生三壽者四命者五生者六養	六 一 我 二 眾 生 三 壽 者 四 命 者 五 生 者 六 養 
T33n1698_001:0077b18	育七眾數八人者九作者十使作者十一起者	育 七 眾 數 八 人 者 九 作 者 十 使 作 者 十 一 起 者 
T33n1698_001:0077b19	十二使起者十三受者十四使受者十五知者	十 二 使 起 者 十 三 受 者 十 四 使 受 者 十 五 知 者 
T33n1698_001:0077b20	十六見者。此中略明四耳。復次下第二答住	十 六 見 者 此 中 略 明 四 耳 復 次 下 第 二 答 住 
T33n1698_001:0077b21	問更為三。初辨行次舉喻格量後結勸。就辨	問 更 為 三 初 辨 行 次 舉 喻 格 量 後 結 勸 就 辨 
T33n1698_001:0077b22	行中二前標無住為本。依無住本行於布施	行 中 二 前 標 無 住 為 本 依 無 住 本 行 於 布 施 
T33n1698_001:0077b23	即住般若中也。娑婆世界宜用檀義攝六。資	即 住 般 若 中 也 娑婆世界 宜 用 檀 義 攝 六 資 
T33n1698_001:0077b24	生攝施無畏攝戒忍法攝。後三但舉一檀即	生 攝 施 無 畏 攝 戒 忍 法 攝 後 三 但 舉 一 檀 即 
T33n1698_001:0077b25	攝六也。捨心無吝謂之布施。無相可存何吝	攝 六 也 捨 心 無 吝 謂 之 布 施 無 相 可 存 何 吝 
T33n1698_001:0077b26	之有施為六度之首。塵為生法之機二法皆空	之 有 施 為 六 度 之 首 塵 為 生 法 之 機 二 法 皆 空 
T33n1698_001:0077b27	於何不盡次菩薩應如是布施下結成住義。	於 何 不 盡 次 菩 薩 應 如 是 布 施 下 結 成 住 義 
T33n1698_001:0077b28	施受皆不可得不住相也。正以虛心而施福	施 受 皆 不 可 得 不 住 相 也 正 以 虛 心 而 施 福 
T33n1698_001:0077b29	不可量。理既無量心不應限。稱理行施其福	不 可 量 理 既 無 量 心 不 應 限 稱 理 行 施 其 福 
T33n1698_001:0077c01	彌廣。東方虛空下第二舉喻格量。理行既顯	彌 廣 東 方 虛 空 下 第 二 舉 喻 格 量 理 行 既 顯 
T33n1698_001:0077c02	如說而行。其福甚多齊太虛也。但應如所教	如 說 而 行 其 福 甚 多 齊 太 虛 也 但 應 如 所 教 
T33n1698_001:0077c03	住下第三結勸也。聖言無謬理不可越。如佛	住 下 第 三 結 勸 也 聖 言 無 謬 理 不 可 越 如 佛 
T33n1698_001:0077c04	所教安心住實相也。可以身相見不下明願	所 教 安 心 住 實 相 也 可 以 身 相 見 不 下 明 願 
T33n1698_001:0077c05	行皆無相為因。法身無色為無得果。菩薩發	行 皆 無 相 為 因 法 身 無 色 為 無 得 果 菩 薩 發 
T33n1698_001:0077c06	心有三義。一化眾生二修萬行三向菩提降	心 有 三 義 一 化 眾 生 二 修 萬 行 三 向 菩 提 降 
T33n1698_001:0077c07	伏明化物。辨住示修行。如來身相即菩提果	伏 明 化 物 辨 住 示 修 行 如 來 身 相 即 菩 提 果 
T33n1698_001:0077c08	體若識法身菩提可登。若計性實乖之遠矣。	體 若 識 法 身 菩 提 可 登 若 計 性 實 乖 之 遠 矣 
T33n1698_001:0077c09	舉法身明菩提空也。不也下善吉深識法	舉 法 身 明 菩 提 空 也 不 也 下 善 吉 深 識 法 
T33n1698_001:0077c10	身。故言不可以身相而見。或一身一智或言真	身 故 言 不 可 以 身 相 而 見 或 一 身 一 智 或 言 真 
T33n1698_001:0077c11	應或言法報應皆是明果。若至果理不生不	應 或 言 法 報 應 皆 是 明 果 若 至 果 理 不 生 不 
T33n1698_001:0077c12	生而般若生理不生不生即法身不可說。習	生 而 般 若 生 理 不 生 不 生 即 法 身 不 可 說 習 
T33n1698_001:0077c13	報二果不生不生即報身不可說。慈誓不生	報 二 果 不 生 不 生 即 報 身 不 可 說 慈 誓 不 生 
T33n1698_001:0077c14	不生即應身不可說。如此三身皆不可說。那	不 生 即 應 身 不 可 說 如 此 三 身 皆 不 可 說 那 
T33n1698_001:0077c15	得以身相見如來。以因緣故。若得道人聞說	得 以 身 相 見 如 來 以 因 緣 故 若 得 道 人 聞 說 
T33n1698_001:0077c16	即悟得見如來。若聞不悟雖說身相即非身	即 悟 得 見 如 來 若 聞 不 悟 雖 說 身 相 即 非 身 
T33n1698_001:0077c17	相故不可見凡所有相皆是虛妄若見非相	相 故 不 可 見 凡 所 有 相 皆 是 虛 妄 若 見 非 相 
T33n1698_001:0077c18	見如來者。非因非果有因緣故可得言因。亦	見 如 來 者 非 因 非 果 有因緣故 可 得 言 因 亦 
T33n1698_001:0077c19	可言果如非初焰非後焰。不離初後焰即此	可 言 果 如 非 初 焰 非 後 焰 不 離 初 後 焰 即 此 
T33n1698_001:0077c20	意也。今只以相為非相非謂遣相別有一非相。	意 也 今 只 以 相 為 非 相 非 謂 遣 相 別 有 一 非 相 
T33n1698_001:0077c21	若能如此即見如來。頗有下第二明信者。	若 能 如 此 即 見 如 來 頗 有 下 第 二 明 信 者 
T33n1698_001:0077c22	行深文為三。一明行深二釋三引證。初有問	行 深 文 為 三 一 明 行 深 二 釋 三 引 證 初 有 問 
T33n1698_001:0078a01	答。問頗有人能信不答如來滅後後五百歲	答 問 頗 有 人 能 信 不 答 如來滅後 後 五 百 歲 
T33n1698_001:0078a02	有持戒修福者。二初非一佛二多積者能信	有 持 戒 修 福 者 二 初 非 一 佛 二 多 積 者 能 信 
T33n1698_001:0078a03	此經。出家持戒在俗修福後五百歲者。從六	此 經 出 家 持 戒 在 俗 修 福 後 五 百 歲 者 從 六 
T33n1698_001:0078a04	百至一千亦云最後五百始有佛法之名。能	百 至 一 千 亦 云 最 後 五 百 始 有 佛 法 之 名 能 
T33n1698_001:0078a05	生信者非值一兩佛也。應以如來滅後是其	生 信 者 非 值 一 兩 佛 也 應 以 如來滅後 是 其 
T33n1698_001:0078a06	得道之時。如優波掘因緣。若尋其本非一兩	得 道 之 時 如 優 波 掘 因 緣 若 尋 其 本 非 一 兩 
T33n1698_001:0078a07	佛也。淨信無所得信也。無相者為淨信。五百	佛 也 淨 信 無 所 得 信 也 無 相 者 為 淨 信 五 百 
T33n1698_001:0078a08	論師非不持戒不信大乘四依。久植故能信	論 師 非 不 持 戒 不 信 大 乘 四 依 久 植 故 能 信 
T33n1698_001:0078a09	耳。既得實相淨信。如來以種智知以佛眼見。	耳 既 得 實 相 淨 信 如 來 以 種 智 知 以 佛 眼 見 
T33n1698_001:0078a10	見其一念信得無量之福。如一人以花自供	見 其 一 念 信 得 無 量 之 福 如 一 人 以 花 自 供 
T33n1698_001:0078a11	佛。一人以花與他供佛所得福德。問羅漢不	佛 一 人 以 花 與 他 供 佛 所 得 福 德 問 羅 漢 不 
T33n1698_001:0078a12	能見問彌勒。彌勒云自者畢苦得辟支與他	能 見 問 彌 勒 彌 勒 云 自 者 畢 苦 得 辟 支 與 他 
T33n1698_001:0078a13	得成。佛是菩薩心故如來知見。般若為佛母	得 成 佛 是 菩 薩 心 故 如 來 知 見 般 若 為 佛 母 
T33n1698_001:0078a14	佛常眼觀。此經及受持者福與虛空齊。非下	佛 常 眼 觀 此 經 及 受 持 者 福 與 虛 空 齊 非 下 
T33n1698_001:0078a15	所測唯佛能知見耳次何以故下第二舉二	所 測 唯 佛 能 知 見 耳 次 何 以 故 下 第 二 舉 二 
T33n1698_001:0078a16	空釋成。信者相有三。何以故初標次釋後結。	空 釋 成 信 者 相 有 三 何 以 故 初 標 次 釋 後 結 
T33n1698_001:0078a17	此中文隱有縱釋反釋傳釋。初列生空有四。	此 中 文 隱 有 縱 釋 反 釋 傳 釋 初 列 生 空 有 四 
T33n1698_001:0078a18	我是自在之名。人為宰主之目。眾生取續前	我 是 自 在 之 名 人 為 宰 主 之 目 眾 生 取 續 前 
T33n1698_001:0078a19	為義。壽者以接後為能此四同為人。執隨用	為 義 壽 者 以 接 後 為 能 此 四 同 為 人 執 隨 用 
T33n1698_001:0078a20	以立四名。廣即十六知見取著此見不信般	以 立 四 名 廣 即 十 六 知 見 取 著 此 見 不 信 般 
T33n1698_001:0078a21	若。次列法空。但有兩句法非法也。今言法	若 次 列 法 空 但 有 兩 句 法 非 法 也 今 言 法 
T33n1698_001:0078a22	者說五陰空為法。五陰相為非法。即以陰空	者 說 五 陰 空 為 法 五 陰 相 為 非 法 即 以 陰 空 
T33n1698_001:0078a23	為藥名法。陰有為病名非法。陰病既除空藥	為 藥 名 法 陰 有 為 病 名 非 法 陰 病 既 除 空 藥 
T33n1698_001:0078a24	亦遣。非法既謝在法亦亡。又持戒為法破戒	亦 遣 非 法 既 謝 在 法 亦 亡 又 持 戒 為 法 破 戒 
T33n1698_001:0078a25	為非法。次若持若犯並非法。非持非犯為法。	為 非 法 次 若 持 若 犯 並 非 法 非 持 非 犯 為 法 
T33n1698_001:0078a26	是中道義。此信達中道離有無二邊。乃信此	是 中 道 義 此 信 達 中 道 離 有 無 二 邊 乃 信 此 
T33n1698_001:0078a27	經耳。以是義故。如筏喻者第三引證。信者行	經 耳 以是義故 如 筏 喻 者 第 三 引 證 信 者 行 
T33n1698_001:0078a28	深有六。初舉經為證二舉菩薩正行。三舉菩	深 有 六 初 舉 經 為 證 二 舉 菩 薩 正 行 三 舉 菩 
T33n1698_001:0078a29	薩遍行四舉往古時事。五舉淨佛國土六舉	薩 遍 行 四 舉 往 古 時 事 五 舉 淨佛國土 六 舉 
T33n1698_001:0078b01	譬山王。為證第一引經為證者。譬欲濟河搆	譬 山 王 為 證 第 一 引 經 為 證 者 譬 欲 濟 河 搆 
T33n1698_001:0078b02	筏自運。既登彼岸棄筏而去。將度生死假乘	筏 自 運 既 登 彼 岸 棄 筏 而 去 將 度 生 死 假 乘 
T33n1698_001:0078b03	萬行。既到涅槃萬善俱捨。道法尚捨而況非	萬 行 既 到 涅 槃 萬 善 俱 捨 道 法 尚 捨 而 況 非 
T33n1698_001:0078b04	法。初以善捨惡後則俱捨如來得菩提下第	法 初 以 善 捨 惡 後 則 俱 捨 如 來 得 菩 提 下 第 
T33n1698_001:0078b05	二舉菩薩正行為證。佛問有菩提可得有法	二 舉 菩 薩 正 行 為 證 佛 問 有 菩 提 可 得 有 法 
T33n1698_001:0078b06	可說。不答。無有定法名菩提。亦無有定法如	可 說 不 答 無 有 定 法 名 菩 提 亦 無 有 定 法 如 
T33n1698_001:0078b07	來可說。無定即是性空解窮相盡謂之菩提。	來 可 說 無 定 即 是 性 空 解 窮 相 盡 謂 之 菩 提 
T33n1698_001:0078b08	無相故不有。假名即不無。不有不無何實可	無 相 故 不 有 假 名 即 不 無 不 有 不 無 何 實 可 
T33n1698_001:0078b09	得。何定可說。應化非真佛。亦非說法者。應既	得 何 定 可 說 應 化 非 真 佛 亦 非 說 法 者 應 既 
T33n1698_001:0078b10	不說真亦復然。離真無應真應不同。由來真	不 說 真 亦 復 然 離 真 無 應 真 應 不 同 由 來 真 
T33n1698_001:0078b11	不說應說。說即不說不說而說。若知如來常	不 說 應 說 說 即 不 說 不 說 而 說 若 知 如 來 常 
T33n1698_001:0078b12	不說是為具足多聞。何以故下釋菩提無	不 說 是 為 具 足 多 聞 何 以 故 下 釋 菩 提 無 
T33n1698_001:0078b13	相可取。諸法空不可說非法即不有。非非法	相 可 取 諸 法 空 不 可 說 非 法 即 不 有 非 非 法 
T33n1698_001:0078b14	即不無。故不可說。有無並無理之極也。所	即 不 無 故 不 可 說 有 無 並 無 理 之 極 也 所 
T33n1698_001:0078b15	以者何。理無生滅謂之無為。無為之理眾聖	以 者 何 理 無 生 滅 謂 之 無 為 無 為 之 理 眾 聖 
T33n1698_001:0078b16	同解。解會無為結盡道成。一解脫義同入法	同 解 解 會 無 為 結 盡 道 成 一 解 脫 義 同 入 法 
T33n1698_001:0078b17	性。無為雖一解有明昧淺深差別也。三千七	性 無 為 雖 一 解 有 明 昧 淺 深 差 別 也 三 千 七 
T33n1698_001:0078b18	寶下校量。前舉虛空此豈不盡。今一念信解	寶 下 校 量 前 舉 虛 空 此 豈 不 盡 今 一 念 信 解 
T33n1698_001:0078b19	復一番格量。積寶多而功薄。四句約而福厚。	復 一 番 格 量 積 寶 多 而 功 薄 四 句 約 而 福 厚 
T33n1698_001:0078b20	金玉三千止以養身。一偈雖約妙極資神。愛	金 玉 三 千 止 以 養 身 一 偈 雖 約 妙 極 資 神 愛 
T33n1698_001:0078b21	佛功德七住未忘。妙著難覺宜應虛心也。七	佛 功 德 七 住 未 忘 妙 著 難 覺 宜 應 虛 心 也 七 
T33n1698_001:0078b22	寶是事善緣因。天人果報不動不出。故以動	寶 是 事 善 緣 因 天 人 果 報 不 動 不 出 故 以 動 
T33n1698_001:0078b23	出之慧導之得成菩提。一念圓信能導眾善。	出 之 慧 導 之 得 成 菩 提 一 念 圓 信 能 導 眾 善 
T33n1698_001:0078b24	此心為勝。實相能出諸法。法即非法諸法不	此 心 為 勝 實 相 能 出 諸 法 法 即 非 法 諸 法 不 
T33n1698_001:0078b25	生般若生也。須陀洹下第三舉菩薩遍行。初	生 般 若 生 也 須 陀 洹 下 第 三 舉 菩 薩 遍 行 初 
T33n1698_001:0078b26	舉四果次善吉自陳。須陀洹此云修習無漏。	舉 四 果 次 善 吉 自 陳 須 陀 洹 此 云 修 習 無 漏 
T33n1698_001:0078b27	亦逆生死流亦入道流。不入色塵是逆流。至	亦 逆 生 死 流 亦 入 道 流 不 入 色 塵 是 逆 流 至 
T33n1698_001:0078b28	論在觀無逆無入。言不入色者即是六塵。過	論 在 觀 無 逆 無 入 言 不 入 色 者 即 是 六 塵 過 
T33n1698_001:0078b29	去無明所感。無明不實所感六塵那得是實。	去 無 明 所 感 無 明 不 實 所 感 六 塵 那 得 是 實 
T33n1698_001:0078c01	既其不實那得作定有無六十二見計。以不	既 其 不 實 那 得 作 定 有 無 六 十 二 見 計 以 不 
T33n1698_001:0078c02	定性故名不入。海為眾流之川。菩提神極之	定 性 故 名 不 入 海 為 眾 流 之 川 菩 提 神 極 之 
T33n1698_001:0078c03	淵。始會無生必盡源也理無乖順何入之有。	淵 始 會 無 生 必 盡 源 也 理 無 乖 順 何 入 之 有 
T33n1698_001:0078c04	違理故入六塵。背塵即會於理。下眾果類然。	違 理 故 入 六 塵 背 塵 即 會 於 理 下 眾 果 類 然 
T33n1698_001:0078c05	斯陀含云住薄亦一往來。欲界思惑九品	斯 陀 含 云 住 薄 亦 一 往 來 欲 界 思 惑 九 品 
T33n1698_001:0078c06	已斷六品。餘三品在故言薄。人天各一生便	已 斷 六 品 餘 三 品 在 故 言 薄 人 天 各 一 生 便 
T33n1698_001:0078c07	成羅漢。故名一往來。而實無往來。已得生	成 羅 漢 故 名 一 往 來 而 實 無 往 來 已 得 生 
T33n1698_001:0078c08	法二空故。阿那含此云不還亦云不來。欲界	法 二 空 故 阿 那 含 此 云 不 還 亦 云 不 來 欲 界 
T33n1698_001:0078c09	結盡上界證無學。應云不來。略以無兼不。	結 盡 上 界 證 無 學 應 云 不 來 略 以 無 兼 不 
T33n1698_001:0078c10	互文現耳。羅漢此云無著亦曰不生。三界生	互 文 現 耳 羅 漢 此 云 無 著 亦 曰 不 生 三 界 生 
T33n1698_001:0078c11	盡所作已辦羅漢稱道前三言果。果實通四	盡 所 作 已 辦 羅 漢 稱 道 前 三 言 果 果 實 通 四 
T33n1698_001:0078c12	而獨稱道者。以得盡無生二智聲聞道極。故	而 獨 稱 道 者 以 得 盡 無 生 二 智 聲 聞 道 極 故 
T33n1698_001:0078c13	以道為名。世尊佛說下第二自陳。以己所解	以 道 為 名 世 尊 佛 說 下 第 二 自 陳 以 己 所 解 
T33n1698_001:0078c14	驗理非虛。心空恒靜諍從何起。蘭那者寂靜	驗 理 非 虛 心 空 恒 靜 諍 從 何 起 蘭 那 者 寂 靜 
T33n1698_001:0078c15	行。相盡於外心息於內。內外俱寂何時不靜。	行 相 盡 於 外 心 息 於 內 內 外 俱 寂 何 時 不 靜 
T33n1698_001:0078c16	得名不虛必稱實也。蘭那此云無事。若自謂	得 名 不 虛 必 稱 實 也 蘭 那 此 云 無 事 若 自 謂 
T33n1698_001:0078c17	是離欲。即是有事何謂無事。昔在然燈下第	是 離 欲 即 是 有 事 何 謂 無 事 昔 在 然 燈 下 第 
T33n1698_001:0078c18	四舉往古時事為證。次明菩薩其解亦同。如	四 舉 往 古 時 事 為 證 次 明 菩 薩 其 解 亦 同 如 
T33n1698_001:0078c19	來在昔佛所行般若時。非但於假名不入色	來 在 昔 佛 所 行 般 若 時 非 但 於 假 名 不 入 色 
T33n1698_001:0078c20	香等。亦不入涅槃亦不入中道。是故得成菩	香 等 亦 不入涅槃 亦 不 入 中 道 是 故 得 成 菩 
T33n1698_001:0078c21	提。四依齊此明一念。信人降伏其心無我相	提 四 依 齊 此 明 一 念 信 人 降 伏 其 心 無 我 相 
T33n1698_001:0078c22	等。淨佛土下。第五一念淨信辨其應住以	等 淨 佛 土 下 第 五 一 念 淨 信 辨 其 應 住 以 
T33n1698_001:0079a01	無所住。住於般若而取佛土即是四種莊嚴。	無 所 住 住 於 般 若 而 取 佛 土 即 是 四 種 莊 嚴 
T33n1698_001:0079a02	若自嚴淨即是寂光。若論化他即具四土相	若 自 嚴 淨 即 是 寂 光 若 論 化 他 即 具 四 土 相 
T33n1698_001:0079a03	惑此土穢虛明即國淨。嚴國之義亦在虛	惑 此 土 穢 虛 明 即 國 淨 嚴 國 之 義 亦 在 虛 
T33n1698_001:0079a04	心。如是嚴淨土應行檀等生清淨心。不住色	心 如 是 嚴 淨 土 應 行 檀 等 生 清 淨 心 不 住 色 
T33n1698_001:0079a05	香其心無住。三番法非法等。一念淨心無住	香 其 心 無 住 三 番 法 非 法 等 一 念 淨 心 無 住 
T33n1698_001:0079a06	之住。即是非因而因而降住等也。譬如下第	之 住 即 是 非 因 而 因 而 降 住 等 也 譬 如 下 第 
T33n1698_001:0079a07	六須彌山王。此即非果而果。須彌翻云安明	六 須 彌 山 王 此 即 非 果 而 果 須 彌 翻 云 安 明 
T33n1698_001:0079a08	四寶所成是十山中一。一雪山二香山三軻	四 寶 所 成 是 十 山 中 一 一 雪 山 二 香 山 三 軻 
T33n1698_001:0079a09	梨羅山四仙聖山五由乾陀山六馬耳山七尼	梨 羅 山 四 仙 聖 山 五 由 乾 陀 山 六 馬 耳 山 七 尼 
T33n1698_001:0079a10	民陀羅山八斫迦羅山九宿慧山十須彌山。	民 陀 羅 山 八 斫 迦 羅 山 九 宿 慧 山 十 須 彌 山 
T33n1698_001:0079a11	因大故果大。得法性五陰成就法身。故言大	因 大 故 果 大 得 法 性 五 陰 成 就 法 身 故 言 大 
T33n1698_001:0079a12	如須彌須彌以譬法性色。色大故般若大如	如 須 彌 須 彌 以 譬 法 性 色 色 大 故 般 若 大 如 
T33n1698_001:0079a13	山大神亦大。習果既圓報果亦滿。法身非身	山 大 神 亦 大 習 果 既 圓 報 果 亦 滿 法 身 非 身 
T33n1698_001:0079a14	故言大身恒河下第三信者福重。文有四階	故 言 大 身 恒 河 下 第 三 信 者 福 重 文 有 四 階 
T33n1698_001:0079a15	一福多二處重三人尊四總結。恒河者是神	一 福 多 二 處 重 三 人 尊 四 總 結 恒 河 者 是 神 
T33n1698_001:0079a16	名。此河長八千由旬廣四千由旬。甚深象度	名 此 河 長 八 千 由 旬 廣 四 千 由 旬 甚 深 象 度 
T33n1698_001:0079a17	皆沒沙細如麵水白如乳。初言三千不即恒	皆 沒 沙 細 如 麵 水 白 如 乳 初 言 三 千 不 即 恒 
T33n1698_001:0079a18	河者自少至多。一恒河為本復數諸恒河。諸	河 者 自 少 至 多 一 恒 河 為 本 復 數 諸 恒 河 諸 
T33n1698_001:0079a19	恒河之沙三重為數。捨寶多而福少持經少	恒 河 之 沙 三 重 為 數 捨 寶 多 而 福 少 持 經 少 
T33n1698_001:0079a20	而福多者經之勝用。復次下明處重。一切	而 福 多 者 經 之 勝 用 復 次 下 明 處 重 一 切 
T33n1698_001:0079a21	世間總明處貴。天人修羅略明三善道。供養	世 間 總 明 處 貴 天 人 修 羅 略 明 三 善 道 供 養 
T33n1698_001:0079a22	如塔此云方墳亦名靈廟。尊法身故敬塔為。	如 塔 此 云 方 墳 亦 名 靈 廟 尊 法 身 故 敬 塔 為 
T33n1698_001:0079a23	重經故貴說經處。大品舍利起塔不及般若。	重 經 故 貴 說 經 處 大 品 舍 利 起 塔 不 及 般 若 
