T34n1728_002:0929b14	依請觀音者。淨於三毒根成佛道無疑。今作	依 請 觀 音 者 淨 於 三 毒 根 成 佛 道 無 疑 今 作 
T34n1728_002:0929b15	十番明救三毒。三番是伏惑論離。七番是斷	十 番 明 救 三 毒 三 番 是 伏 惑 論 離 七 番 是 斷 
T34n1728_002:0929b16	惑論離也。問。離煩惱須智慧。但念豈得離耶。	惑 論 離 也 問 離 煩 惱 須 智 慧 但 念 豈 得 離 耶 
T34n1728_002:0929b17	答。經稱常念即是正念。體達煩惱性無所有。	答 經 稱 常 念 即 是 正 念 體 達 煩 惱 性 無 所 有 
T34n1728_002:0929b18	住貪欲際即是實際。絕四句無能無所念性	住 貪 欲 際 即 是 實 際 絕 四 句 無 能 無 所 念 性 
T34n1728_002:0929b19	清淨。如此正念非是智慧。更何處覓智慧。此	清 淨 如 此 正 念 非 是 智 慧 更 何 處 覓 智 慧 此 
T34n1728_002:0929b20	慧不離煩惱。其誰能離耶。若如所難必須別	慧 不 離 煩 惱 其 誰 能 離 耶 若 如 所 難 必 須 別 
T34n1728_002:0929b21	用。智慧破煩惱者。此則有惑可斷有智能斷。	用 智 慧 破 煩 惱 者 此 則 有 惑 可 斷 有 智 能 斷 
T34n1728_002:0929b22	非唯惑不可斷慧還成惑。豈得名斷惑之慧	非 唯 惑 不 可 斷 慧 還 成 惑 豈 得 名 斷 惑 之 慧 
T34n1728_002:0929b23	耶。今此正念不以色念不以非色念。如是四	耶 今 此 正 念 不 以 色 念 不 以 非 色 念 如 是 四 
T34n1728_002:0929b24	句亦以色念亦以非色念。如是四句或次第	句 亦 以 色 念 亦 以 非 色 念 如 是 四 句 或 次 第 
T34n1728_002:0929b25	論非念。或不次第論非念。或不次第論念。或	論 非 念 或 不 次 第 論 非 念 或 不 次 第 論 念 或 
T34n1728_002:0929b26	次第論念。或次第論離。或不次第論離。次就	次 第 論 念 或 次 第 論 離 或 不 次 第 論 離 次 就 
T34n1728_002:0929b27	觀解者。七番例上可解。今但順逆兩意約界	觀 解 者 七 番 例 上 可 解 今 但 順 逆 兩 意 約 界 
T34n1728_002:0929b28	外作也。不取分段三毒相。今取善欲之心名	外 作 也 不 取 分 段 三 毒 相 今 取 善 欲 之 心 名 
T34n1728_002:0929b29	貪。大經云。一切善法欲為其本。二乘欲樂涅	貪 大 經 云 一 切 善 法 欲 為 其 本 二 乘 欲 樂 涅 
T34n1728_002:0929c01	槃名貪。厭生死名瞋。不達此理名癡。開三毒	槃 名 貪 厭 生 死 名 瞋 不 達 此 理 名 癡 開 三 毒 
T34n1728_002:0929c02	即有八萬四千宛然具足。淨名云。結習未盡	即 有 八萬四千 宛 然 具 足 淨 名 云 結 習 未 盡 
T34n1728_002:0929c03	華則著身。二乘未斷此三毒。即變易三毒相	華 則 著 身 二 乘 未 斷 此 三 毒 即 變 易 三 毒 相 
T34n1728_002:0929c04	也。未斷別惑菩薩亦同有此三毒。故云菩薩	也 未 斷 別 惑 菩 薩 亦 同 有 此 三 毒 故 云 菩 薩 
T34n1728_002:0929c05	貪求佛法於恒沙劫未曾暫捨。多學問無厭	貪 求 佛 法 於 恒 沙 劫 未 曾 暫 捨 多 學 問 無 厭 
T34n1728_002:0929c06	足即貪相。惡賤二乘不喜聞其名。故言寧起	足 即 貪 相 惡 賤 二 乘 不 喜 聞 其 名 故 言 寧 起 
T34n1728_002:0929c07	惡癩野干心不起二乘心。如大樹折枝之譬。	惡 癩 野 干 心 不 起 二 乘 心 如 大 樹 折 枝 之 譬 
T34n1728_002:0929c08	豈非瞋相。無明重數甚多。佛菩提智之所能	豈 非 瞋 相 無 明 重 數 甚 多 佛 菩 提 智 之 所 能 
T34n1728_002:0929c09	斷。佛性未了了者皆是癡相。欲除此三煩	斷 佛 性 未 了 了 者 皆 是 癡 相 欲 除 此 三 煩 
T34n1728_002:0929c10	惱故。常念觀音隨機應赴即得永離。永離有	惱 故 常 念 觀 音 隨 機 應 赴 即 得 永 離 永 離 有 
T34n1728_002:0929c11	兩種。若此菩薩於生身中全未除別惑。就變	兩 種 若 此 菩 薩 於 生 身 中 全 未 除 別 惑 就 變 
T34n1728_002:0929c12	易論全未永離。若生身中已侵別惑。就變易	易 論 全 未 永 離 若 生 身 中 已 侵 別 惑 就 變 易 
T34n1728_002:0929c13	中除殘論永離。次明逆說三毒觀者。一切	中 除 殘 論 永 離 次 明 逆 說 三 毒 觀 者 一 切 
T34n1728_002:0929c14	眾生名為少欲瞋癡。何以故。止瞋三途之	眾 生 名 為 少 欲 瞋 癡 何 以 故 止 瞋 三 途 之 
T34n1728_002:0929c15	苦。貪人天之樂。二乘只瞋生死欲得涅槃樂。	苦 貪 人 天 之 樂 二 乘 只 瞋 生 死 欲 得 涅 槃 樂 
T34n1728_002:0929c16	皆名為少。菩薩不爾。樂求佛法非但求一佛	皆 名 為 少 菩 薩 不 爾 樂 求 佛 法 非 但 求 一 佛 
T34n1728_002:0929c17	法。遍求一切不可說佛法。如海吞眾流猶自	法 遍 求 一 切 不 可 說 佛 法 如 海 吞 眾 流 猶 自 
T34n1728_002:0929c18	不滿。非但不受生死亦不受涅槃。故大品五	不 滿 非 但 不 受 生 死 亦 不 受 涅 槃 故 大 品 五 
T34n1728_002:0929c19	不受此即大瞋。無明力大佛智能斷。菩薩於	不 受 此 即 大 瞋 無 明 力 大 佛 智 能 斷 菩 薩 於 
T34n1728_002:0929c20	無明大力之惑尚在。又癡如虛空不可盡。乃	無 明 大 力 之 惑 尚 在 又 癡 如 虛 空 不 可 盡 乃 
T34n1728_002:0929c21	至老死如虛空不可盡。如此三毒即為三法	至 老 死 如 虛 空 不 可 盡 如 此 三 毒 即 為 三 法 
T34n1728_002:0929c22	門。一取二捨三不取不捨。大慈大悲四攝十	門 一 取 二 捨 三 不 取 不 捨 大慈大悲 四 攝 十 
T34n1728_002:0929c23	力無畏三昧解脫無上菩提。淨佛國土化度	力 無 畏 三 昧 解 脫 無上菩提 淨佛國土 化 度 
T34n1728_002:0929c24	眾生。名為取門。即大貪也。一切法空無所有	眾 生 名 為 取 門 即 大 貪 也 一切法空 無 所 有 
T34n1728_002:0929c25	不住不著。般若如大火炎四邊不可取。大涅	不 住 不 著 般 若 如 大 火 炎 四 邊 不 可 取 大 涅 
T34n1728_002:0929c26	槃空迦毘羅城空。言語道斷心行處滅。不以	槃 空 迦 毘 羅 城 空 言語道斷 心行處滅 不 以 
T34n1728_002:0929c27	四句得菩提。無得無證即是捨門。名為大瞋	四 句 得 菩 提 無 得 無 證 即 是 捨 門 名 為 大 瞋 
T34n1728_002:0929c28	也。中道非取非捨。不憎不愛。不斷不常。無去	也 中 道 非 取 非 捨 不 憎 不 愛 不 斷 不 常 無 去 
T34n1728_002:0929c29	無來。無生無滅。如鏡中像不可見而見。見而	無 來 無生無滅 如 鏡 中 像 不 可 見 而 見 見 而 
T34n1728_002:0930a01	不可見。非可見非不可見。遮二邊故不可言	不 可 見 非 可 見 非 不 可 見 遮 二 邊 故 不 可 言 
T34n1728_002:0930a02	說。淨名杜口名為中道。此即大癡。故文殊云。	說 淨 名 杜 口 名 為 中 道 此 即 大 癡 故 文 殊 云 
T34n1728_002:0930a03	我是貪欲尸利瞋恚尸利邪見尸利。此即其	我 是 貪 欲 尸 利 瞋 恚 尸 利 邪 見 尸 利 此 即 其 
T34n1728_002:0930a04	明證。欲滿此三法門。常念觀音即得滿願一	明 證 欲 滿 此 三 法 門 常 念 觀 音 即 得 滿 願 一 
T34n1728_002:0930a05	切。聖人自行化他無不從此三門而入。離此	切 聖 人 自 行 化 他 無 不 從 此 三 門 而 入 離 此 
T34n1728_002:0930a06	更無有道。故無行經云。貪欲即是道。恚癡亦	更 無 有 道 故 無 行 經 云 貪 欲 即 是 道 恚 癡 亦 
T34n1728_002:0930a07	如是。如是三法中。具足一切佛法。一切佛法	如 是 如 是 三 法 中 具 足 一切佛法 一切佛法 
T34n1728_002:0930a08	不出萬行波羅蜜。不受三昧廣大之用中道	不 出 萬 行 波 羅 蜜 不 受 三 昧 廣 大 之 用 中 道 
T34n1728_002:0930a09	實相。此三法門不可宣示。愍眾生故或作順	實 相 此 三 法 門 不 可 宣 示 愍 眾 生 故 或 作 順 
T34n1728_002:0930a10	說或作逆說互有去取。此即四悉檀意赴緣	說 或 作 逆 說 互 有 去 取 此 即 四 悉 檀 意 赴 緣 
T34n1728_002:0930a11	利益。如華嚴四十二明。險難國寶莊嚴城	利 益 如 華 嚴 四 十 二 明 險 難 國 寶 莊 嚴 城 
T34n1728_002:0930a12	婆須密多女。說離欲際法門。一切眾生隨類	婆 須 密 多 女 說 離 欲 際 法 門 一 切 眾 生 隨 類 
T34n1728_002:0930a13	見我。我皆為其女像。見我者得歡喜三昧。共	見 我 我 皆 為 其 女 像 見 我 者 得 歡 喜 三 昧 共 
T34n1728_002:0930a14	我語得無礙妙音三昧。執我手得詣諸佛剎	我 語 得 無 礙 妙 音 三 昧 執 我 手 得 詣 諸 佛 剎 
T34n1728_002:0930a15	三昧。共我宿者得解脫光明三昧。目視我者	三 昧 共 我 宿 者 得 解 脫 光 明 三 昧 目 視 我 者 
T34n1728_002:0930a16	得寂靜法門。見我嚬伸得壞散外道法門。	得 寂 靜 法 門 見 我 嚬 伸 得 壞 散 外 道 法 門 
T34n1728_002:0930a17	阿黎宜我者得攝一切眾生三昧。阿眾鞞我	阿 黎 宜 我 者 得 攝 一 切 眾 生 三 昧 阿 眾 鞞 我 
T34n1728_002:0930a18	者得諸功德密藏。住是離欲法門廣為利益。	者 得 諸 功 德 密 藏 住 是 離 欲 法 門 廣 為 利 益 
T34n1728_002:0930a19	此豈非逆順欲法門導利群品耶。又四十一	此 豈 非 逆 順 欲 法 門 導 利 群 品 耶 又 四 十 一 
T34n1728_002:0930a20	滿幢城滿足王。於正殿行王法。其犯法者斬	滿 幢 城 滿 足 王 於 正 殿 行 王 法 其 犯 法 者 斬 
T34n1728_002:0930a21	截燒煮劈裂屠膾。嗔目訶責苦楚治罪。善財	截 燒 煮 劈 裂 屠 膾 嗔 目 訶 責 苦 楚 治 罪 善 財 
T34n1728_002:0930a22	生疑。王斷事已執善財手入其宮。見不可思	生 疑 王 斷 事 已 執 善 財 手 入 其 宮 見 不 可 思 
T34n1728_002:0930a23	議境界不可譬喻。語善財云。我知幻化法門。	議 境 界 不 可 譬 喻 語 善 財 云 我 知 幻 化 法 門 
T34n1728_002:0930a24	化作眾生。而苦治之。以調一切。其見聞者發	化 作 眾 生 而 苦 治 之 以 調 一 切 其 見 聞 者 發 
T34n1728_002:0930a25	菩提心。此豈非瞋法門。方便命婆羅門五熱	菩 提 心 此 豈 非 瞋 法 門 方 便 命 婆 羅 門 五 熱 
T34n1728_002:0930a26	炙身即是癡法門如前說。次此應明別圓兩	炙 身 即 是 癡 法 門 如 前 說 次 此 應 明 別 圓 兩 
T34n1728_002:0930a27	觀觀三毒慈悲機感例可知。不具記。第三從	觀 觀 三 毒 慈 悲 機 感 例 可 知 不 具 記 第 三 從 
T34n1728_002:0930a28	若有女人去。明身業為機亦為三。一貼文。	若 有 女 人 去 明 身 業 為 機 亦 為 三 一 貼 文 
T34n1728_002:0930a29	二引事證。三觀解。貼文為二。一求願滿。二	二 引 事 證 三 觀 解 貼 文 為 二 一 求 願 滿 二 
T34n1728_002:0930b01	結歎求。又為二。一求男二求女。文云。女人求	結 歎 求 又 為 二 一 求 男 二 求 女 文 云 女 人 求 
T34n1728_002:0930b02	男若是無子則絕嗣。有子則父母俱欣。云何	男 若 是 無 子 則 絕 嗣 有 子 則 父 母 俱 欣 云 何 
T34n1728_002:0930b03	獨標女人求男耶。解者或云。女厭女身非求	獨 標 女 人 求 男 耶 解 者 或 云 女 厭 女 身 非 求 
T34n1728_002:0930b04	子也。又解女性多愛欣子偏重故標女人。今	子 也 又 解 女 性 多 愛 欣 子 偏 重 故 標 女 人 今 
T34n1728_002:0930b05	解女人以無子為苦。夫之所棄並婦所輕旁	解 女 人 以 無 子 為 苦 夫 之 所 棄 並 婦 所 輕 旁 
T34n1728_002:0930b06	人所笑。又婦有七失。六猶可忍無子最劇。容	人 所 笑 又 婦 有 七 失 六 猶 可 忍 無 子 最 劇 容 
T34n1728_002:0930b07	惡性妬不能事公姑貪食無子拙。無子既苦	惡 性 妬 不 能 事 公 姑 貪 食 無 子 拙 無 子 既 苦 
T34n1728_002:0930b08	故以標女人求男也。求男文為三。一立願。	故 以 標 女 人 求 男 也 求 男 文 為 三 一 立 願 
T34n1728_002:0930b09	二修行。三德業。願與行如文。德業者。明士有	二 修 行 三 德 業 願 與 行 如 文 德 業 者 明 士 有 
T34n1728_002:0930b10	百行智居其首。若但智而無福則位卑而財	百 行 智 居 其 首 若 但 智 而 無 福 則 位 卑 而 財 
T34n1728_002:0930b11	貧觸途壈坎。智與福合彌相扶顯福則財位	貧 觸 途 壈 坎 智 與 福 合 彌 相 扶 顯 福 則 財 位 
T34n1728_002:0930b12	高昇。慧則名聞博遠。故言便生福德智慧之	高 昇 慧 則 名 聞 博 遠 故 言 便 生 福 德 智 慧 之 
T34n1728_002:0930b13	男也。求女文中但明願與德業不明修行者。	男 也 求 女 文 中 但 明 願 與 德 業 不 明 修 行 者 
T34n1728_002:0930b14	行同禮拜故不重論。願德既殊故須各辯。女	行 同 禮 拜 故 不 重 論 願 德 既 殊 故 須 各 辯 女 
T34n1728_002:0930b15	人端正七德之初。但端正無相者或早孤少	人 端 正 七 德 之 初 但 端 正 無 相 者 或 早 孤 少 
T34n1728_002:0930b16	寡相祿不佳。今明貌與相相扶彌顯其德。端	寡 相 祿 不 佳 今 明 貌 與 相 相 扶 彌 顯 其 德 端 
T34n1728_002:0930b17	正則招寵愛相則招於祿敬。故文云。眾人愛	正 則 招 寵 愛 相 則 招 於 祿 敬 故 文 云 眾 人 愛 
T34n1728_002:0930b18	敬。若愛帶慢何謂為德。愛而敬之故是相也。	敬 若 愛 帶 慢 何 謂 為 德 愛 而 敬 之 故 是 相 也 
T34n1728_002:0930b19	有人解。宿植德本是釋疑。眾人咸謂。觀	有 人 解 宿 植 德 本 是 釋 疑 眾 人 咸 謂 觀 
T34n1728_002:0930b20	音但能交會父母智慧端正兒之宿植。若	音 但 能 交 會 父 母 智 慧 端 正 兒 之 宿 植 若 
T34n1728_002:0930b21	是觀音與其智慧端正。則墮無因之過。私難	是 觀 音 與 其 智 慧 端 正 則 墮 無 因 之 過 私 難 
T34n1728_002:0930b22	此語。若言福慧是兒業。觀音唯能會其受生。	此 語 若 言 福 慧 是 兒 業 觀 音 唯 能 會 其 受 生 
T34n1728_002:0930b23	兒無生緣觀音會生。兒無福慧觀音亦能使	兒 無 生 緣 觀 音 會 生 兒 無 福 慧 觀 音 亦 能 使 
T34n1728_002:0930b24	有。觀音遂不能令無福。種福何能使無生而	有 觀 音 遂 不 能 令 無 福 種 福 何 能 使 無 生 而 
T34n1728_002:0930b25	生。論福畏墮無因。論生何不畏墮無因。若爾。	生 論 福 畏 墮 無 因 論 生 何 不 畏 墮 無 因 若 爾 
T34n1728_002:0930b26	聖人全不能與福慧。只能作媒人。此不可解	聖 人 全 不 能 與 福 慧 只 能 作 媒 人 此 不 可 解 
T34n1728_002:0930b27	也。難觀音不能令兒有福慧者。上一人稱名	也 難 觀 音 不 能 令 兒 有 福 慧 者 上 一 人 稱 名 
T34n1728_002:0930b28	多人皆脫羅剎之難。此無因而不與彼。無機	多 人 皆 脫 羅 剎 之 難 此 無 因 而 不 與 彼 無 機 
T34n1728_002:0930b29	那忽脫耶。今明聖力甚大無所不與。能使先	那 忽 脫 耶 今 明 聖 力 甚 大 無 所 不 與 能 使 先 
T34n1728_002:0930c01	世有福慧者託生也。縱令先世不植善緣。亦	世 有 福 慧 者 託 生 也 縱 令 先 世 不 植 善 緣 亦 
T34n1728_002:0930c02	能令其於中陰中修福。此義出中陰經也。今	能 令 其 於 中 陰 中 修 福 此 義 出 中 陰 經 也 今 
T34n1728_002:0930c03	不取此句為釋疑之意。若有禮拜福不唐捐。	不 取 此 句 為 釋 疑 之 意 若 有 禮 拜 福 不 唐 捐 
T34n1728_002:0930c04	此結成身業之機。亦是釋疑之義。結義可解。	此 結 成 身 業 之 機 亦 是 釋 疑 之 義 結 義 可 解 
T34n1728_002:0930c05	釋疑者若言禮拜願滿。自有禮拜不蒙願滿	釋 疑 者 若 言 禮 拜 願 滿 自 有 禮 拜 不 蒙 願 滿 
T34n1728_002:0930c06	者。何得云不唐捐。唐者言徒。捐者言棄。由心	者 何 得 云 不 唐 捐 唐 者 言 徒 捐 者 言 棄 由 心 
T34n1728_002:0930c07	不志即願未滿。禮拜之功冥資不失。此得	不 志 即 願 未 滿 禮 拜 之 功 冥 資 不 失 此 得 
T34n1728_002:0930c08	是釋疑也。問。禮拜是身業機亦應脫水火等	是 釋 疑 也 問 禮 拜 是 身 業 機 亦 應 脫 水 火 等 
T34n1728_002:0930c09	難不。答。此舉男女為言端爾。次引事證者。	難 不 答 此 舉 男 女 為 言 端 爾 次 引 事 證 者 
T34n1728_002:0930c10	應驗傳有人姓鬲。四月八日生月氏國癡	應 驗 傳 有 人 姓 鬲 四 月 八 日 生 月 氏 國 癡 
T34n1728_002:0930c11	人。次觀解者。果報求男女者如阿含中。地獄	人 次 觀 解 者 果 報 求 男 女 者 如 阿 含 中 地 獄 
T34n1728_002:0930c12	界已上乃至欲天皆有無子之苦。禮拜求願	界 已 上 乃 至 欲 天 皆 有 無 子 之 苦 禮 拜 求 願 
T34n1728_002:0930c13	亦能滿心。次明修因論男女者。先辯法門。	亦 能 滿 心 次 明 修 因 論 男 女 者 先 辯 法 門 
T34n1728_002:0930c14	次明與願。法門者無明為父貪愛為母。六根	次 明 與 願 法 門 者 無 明 為 父 貪 愛 為 母 六 根 
T34n1728_002:0930c15	男六塵女。識為媒嫁生出無量煩惱之子孫。	男 六 塵 女 識 為 媒 嫁 生 出 無 量 煩 惱 之 子 孫 
T34n1728_002:0930c16	此男女不勞願求任運成眷屬也。若外書以天	此 男 女 不 勞 願 求 任 運 成 眷 屬 也 若 外 書 以 天 
T34n1728_002:0930c17	陽地陰沈動為男女。何況佛法而無此耶。若	陽 地 陰 沈 動 為 男 女 何 況 佛 法 而 無 此 耶 若 
T34n1728_002:0930c18	就佛為國王經教為夫人。出生一切菩薩佛	就 佛 為 國 王 經 教 為 夫 人 出 生 一切菩薩 佛 
T34n1728_002:0930c19	子。又善權方便父。智度菩薩母。一切諸導師。	子 又 善權方便 父 智 度 菩 薩 母 一 切 諸 導 師 
T34n1728_002:0930c20	無不由是生。又慈悲為女善心為男。或禪定	無 不 由 是 生 又 慈 悲 為 女 善 心 為 男 或 禪 定 
T34n1728_002:0930c21	靜細為女。觀慧分別為男。二乘定多慧少。菩	靜 細 為 女 觀 慧 分 別 為 男 二 乘 定 多 慧 少 菩 
T34n1728_002:0930c22	薩定少慧多。大經云。若聞大涅槃佛性之法。	薩 定 少 慧 多 大 經 云 若 聞 大 涅 槃 佛 性 之 法 
T34n1728_002:0930c23	當知是人有丈夫相。正觀剛決為男。無緣慈	當 知 是 人 有 丈 夫 相 正 觀 剛 決 為 男 無 緣 慈 
T34n1728_002:0930c24	悲含覆一切為女。今借世間男女以表法門	悲 含 覆 一 切 為 女 今 借 世 間 男 女 以 表 法 門 
T34n1728_002:0930c25	爾。問。那得以男女表法門。無男女故即無法	爾 問 那 得 以 男 女 表 法 門 無 男 女 故 即 無 法 
T34n1728_002:0930c26	門。如大經永離十相名大涅槃。大論云。無	門 如 大 經 永 離 十 相 名 大 涅 槃 大 論 云 無 
T34n1728_002:0930c27	男女相故名無相。淨名云。一切諸法非男非	男 女 相 故 名 無 相 淨 名 云 一切諸法 非 男 非 
T34n1728_002:0930c28	女。如佛所說亦非男非女。安樂行云。亦不	女 如 佛 所 說 亦 非 男 非 女 安 樂 行 云 亦 不 
T34n1728_002:0930c29	分別是男是女。入不二法門云。無聲聞心即	分 別 是 男 是 女 入 不二法門 云 無 聲 聞 心 即 
T34n1728_002:0931a01	無於定。無菩薩心即無於慧。小乘三藏緣諦	無 於 定 無 菩 薩 心 即 無 於 慧 小 乘 三 藏 緣 諦 
T34n1728_002:0931a02	理。吾聞解脫之中無有言說。成論入空平等	理 吾 聞 解 脫 之 中 無 有 言 說 成 論 入 空 平 等 
T34n1728_002:0931a03	亦無男女。男女既無所表安在。故知無定慧	亦 無 男 女 男 女 既 無 所 表 安 在 故 知 無 定 慧 
T34n1728_002:0931a04	法門也。答。大乘實相不當有男女及無男女。	法 門 也 答 大 乘 實 相 不 當 有 男 女 及 無 男 女 
T34n1728_002:0931a05	善巧方便以四悉檀說於有無。天女云。無離	善巧方便 以 四 悉 檀 說 於 有 無 天 女 云 無 離 
T34n1728_002:0931a06	文字說解脫義。文字性離即是解脫。皆以文	文 字 說 解 脫 義 文 字 性 離 即 是 解 脫 皆 以 文 
T34n1728_002:0931a07	字有去來今。非謂菩提實相亦爾。非有非無	字 有 去 來 今 非 謂 菩 提 實 相 亦 爾 非有非無 
T34n1728_002:0931a08	非二而二。明此二法未曾相離。譬如一身有	非 二 而 二 明 此 二 法 未 曾 相 離 譬 如 一 身 有 
T34n1728_002:0931a09	左右手。定慧亦爾。定靜慧照。雖復二分。不離	左 右 手 定 慧 亦 爾 定 靜 慧 照 雖 復 二 分 不 離 
T34n1728_002:0931a10	法性。言定即有慧。言慧即有定。譬如女人而	法 性 言 定 即 有 慧 言 慧 即 有 定 譬 如 女 人 而 
T34n1728_002:0931a11	有左手。亦如男子而有右手。定慧亦爾。	有 左 手 亦 如 男 子 而 有 右 手 定 慧 亦 爾 
T34n1728_002:0931a12	無緣之慈具正觀慧而以定當名。中道種智。	無 緣 之 慈 具 正 觀 慧 而 以 定 當 名 中 道 種 智 
T34n1728_002:0931a13	具大慈定以智標目。何但理然今文亦爾。文	具 大 慈 定 以 智 標 目 何 但 理 然 今 文 亦 爾 文 
T34n1728_002:0931a14	云。便生福德智慧之男。此語自具二法門何	云 便 生 福 德 智 慧 之 男 此 語 自 具 二 法 門 何 
T34n1728_002:0931a15	勞有疑而稱男子也。文云。便生端正有相之	勞 有 疑 而 稱 男 子 也 文 云 便 生 端 正 有 相 之 
T34n1728_002:0931a16	女。端正無邪醜表中道正觀。離二邊之醜。	女 端 正 無 邪 醜 表 中 道 正 觀 離 二 邊 之 醜 
T34n1728_002:0931a17	即慧義也。相即三十二相慈心所種。即表	即 慧 義 也 相 即 三十二相 慈 心 所 種 即 表 
T34n1728_002:0931a18	定義也。雖具二而名女。故知此文若作男	定 義 也 雖 具 二 而 名 女 故 知 此 文 若 作 男 
T34n1728_002:0931a19	女二解。即表定慧不二而二。若作不二解。	女 二 解 即 表 定 慧 不 二 而 二 若 作 不 二 解 
T34n1728_002:0931a20	即表定慧二而不二。理實非二非不二。赴緣	即 表 定 慧 二 而 不 二 理 實 非 二 非 不 二 赴 緣 
T34n1728_002:0931a21	為二為不二。即是表二法門文義斯在。次明	為 二 為 不 二 即 是 表 二 法 門 文 義 斯 在 次 明 
T34n1728_002:0931a22	應機滿願者。果報滿願如前說。修因者。若就	應 機 滿 願 者 果 報 滿 願 如 前 說 修 因 者 若 就 
T34n1728_002:0931a23	修五戒事論。不殺是仁不盜是廉。屬女表定	修 五 戒 事 論 不 殺 是 仁 不 盜 是 廉 屬 女 表 定 
T34n1728_002:0931a24	法。不妄語是質直不婬是貞良不飲酒是	法 不 妄 語 是 質 直 不 婬 是 貞 良 不 飲 酒 是 
T34n1728_002:0931a25	離邪昏。此屬男表慧法。若不得此五戒男女。	離 邪 昏 此 屬 男 表 慧 法 若 不 得 此 五 戒 男 女 
T34n1728_002:0931a26	則失人天道。孤獨墮在三途。歸命求救五戒	則 失 人 天 道 孤 獨 墮 在 三 途 歸 命 求 救 五 戒 
T34n1728_002:0931a27	完全即男女願滿。十善例可知。修禪時。方	完 全 即 男 女 願 滿 十 善 例 可 知 修 禪 時 方 
T34n1728_002:0931a28	便修慧精進等三方便為男。念一心為女。若	便 修 慧 精 進 等 三 方 便 為 男 念 一 心 為 女 若 
T34n1728_002:0931a29	就支林。覺觀喜為男。樂一心為女。乃至非想	就 支 林 覺 觀 喜 為 男 樂 一 心 為 女 乃 至 非 想 
T34n1728_002:0931b01	禪禪中細作可解。次明聲聞男女者。五停心	禪 禪 中 細 作 可 解 次 明 聲 聞 男 女 者 五 停 心 
T34n1728_002:0931b02	觀。治瞋用慈治散用數。此二為女。治貪用不	觀 治 瞋 用 慈 治 散 用 數 此 二 為 女 治 貪 用 不 
T34n1728_002:0931b03	淨。治癡用因緣。治障道用念佛。此三屬男。又	淨 治 癡 用 因 緣 治 障 道 用 念 佛 此 三 屬 男 又 
T34n1728_002:0931b04	直緣諦理正智決斷名為男。出觀用法緣慈	直 緣 諦 理 正 智 決 斷 名 為 男 出 觀 用 法 緣 慈 
T34n1728_002:0931b05	為女。若不得此兩法。即當墮落凡夫。為火宅	為 女 若 不 得 此 兩 法 即 當 墮 落 凡 夫 為 火 宅 
T34n1728_002:0931b06	燒害貧窮孤露。若蒙垂應五停心男女生	燒 害 貧 窮 孤 露 若 蒙 垂 應 五 停 心 男 女 生 
T34n1728_002:0931b07	即得入真。出觀男女生得入假。二義既滿則	即 得 入 真 出 觀 男 女 生 得 入 假 二 義 既 滿 則 
T34n1728_002:0931b08	不復畏二十五有也。次支佛者。緣方便道起	不 復 畏 二十五有 也 次 支 佛 者 緣 方 便 道 起 
T34n1728_002:0931b09	慈觀名女。慧觀為男。若發真緣理名男。出	慈 觀 名 女 慧 觀 為 男 若 發 真 緣 理 名 男 出 
T34n1728_002:0931b10	觀緣慈名女。支佛譬鹿猶有迴顧之慈也。若	觀 緣 慈 名 女 支 佛 譬 鹿 猶 有 迴 顧 之 慈 也 若 
T34n1728_002:0931b11	不得如此定慧。何由速出殷勤求法。若得願	不 得 如 此 定 慧 何 由 速 出 殷 勤 求 法 若 得 願 
T34n1728_002:0931b12	滿坦然快樂。次明六度菩薩。菩薩有慈悲不	滿 坦 然 快 樂 次 明 六 度 菩 薩 菩 薩 有 慈 悲 不 
T34n1728_002:0931b13	斷惑在生死利物名女。行六度方便智慧名	斷 惑 在 生 死 利 物 名 女 行 六 度 方便智慧 名 
T34n1728_002:0931b14	男。女人法應生子。慈悲法應受生死化物。化	男 女 人 法 應 生 子 慈 悲 法 應 受 生 死 化 物 化 
T34n1728_002:0931b15	於前人善心開發。即是生子義。前人生五度	於 前 人 善 心 開 發 即 是 生 子 義 前 人 生 五 度 
