T34n1728_002:0931b16	者是生女。前人生智慧是生男。若定慧義不	者 是 生 女 前 人 生 智 慧 是 生 男 若 定 慧 義 不 
T34n1728_002:0931b17	成。則菩薩行不立。故求觀音而獲願滿。次	成 則 菩 薩 行 不 立 故 求 觀 音 而 獲 願 滿 次 
T34n1728_002:0931b18	通菩薩。既斷煩惱則有智斷緣諦理之慧為	通 菩 薩 既 斷 煩 惱 則 有 智 斷 緣 諦 理 之 慧 為 
T34n1728_002:0931b19	男。慈悲扶餘習入三界名女。何以故。如男法	男 慈 悲 扶 餘 習 入 三 界 名 女 何 以 故 如 男 法 
T34n1728_002:0931b20	不生表智慧決斷斷於煩惱。不生三界而今	不 生 表 智 慧 決 斷 斷 於 煩 惱 不 生 三 界 而 今 
T34n1728_002:0931b21	還生者。乃是慈扶餘習故得更生。稱之為女。	還 生 者 乃 是 慈 扶 餘 習 故 得 更 生 稱 之 為 女 
T34n1728_002:0931b22	求願觀音蒙此願滿。次明別教十信菩薩。修	求 願 觀 音 蒙 此 願 滿 次 明 別 教 十 信 菩 薩 修 
T34n1728_002:0931b23	福德莊嚴五波羅蜜為女。從一地二地智慧	福德莊嚴 五波羅蜜 為 女 從 一 地 二 地 智 慧 
T34n1728_002:0931b24	莊嚴為男。三十心名男女交處聖胎。初地中	莊 嚴 為 男 三 十 心 名 男 女 交 處 聖 胎 初 地 中 
T34n1728_002:0931b25	道正智開發名為男生。無緣慈心發名為女	道 正 智 開 發 名 為 男 生 無 緣 慈 心 發 名 為 女 
T34n1728_002:0931b26	生。此兩要在初地方得開發。亦名男女雙生。	生 此 兩 要 在 初 地 方 得 開 發 亦 名 男 女 雙 生 
T34n1728_002:0931b27	若不如此即墮二乘生死兩邊之過。生此男	若 不 如 此 即 墮 二 乘 生 死 兩 邊 之 過 生 此 男 
T34n1728_002:0931b28	女者生大歡喜故稱歡喜地。慈悲被物物荷	女 者 生大歡喜 故 稱 歡 喜 地 慈 悲 被 物 物 荷 
T34n1728_002:0931b29	恩故稱為大慈大悲。大慈大悲能成佛道生	恩 故 稱 為 大慈大悲 大慈大悲 能 成 佛 道 生 
T34n1728_002:0931c01	出般若。是諸佛之祖母故稱為大女。十力無	出 般 若 是 諸 佛 之 祖 母 故 稱 為 大 女 十 力 無 
T34n1728_002:0931c02	畏等眾生不知故不名為大也。次圓教以無	畏 等 眾 生 不 知 故 不 名 為 大 也 次 圓 教 以 無 
T34n1728_002:0931c03	緣慈悲種三十二相業亦名為女。此女端正	緣 慈 悲 種 三十二相 業 亦 名 為 女 此 女 端 正 
T34n1728_002:0931c04	有相以中道智慧為男。此男質直福德。十信	有 相 以 中 道 智 慧 為 男 此 男 質 直 福 德 十 信 
T34n1728_002:0931c05	六根清淨名為處胎。初住慈智男女雙生。若	六 根 清 淨 名 為 處 胎 初 住 慈 智 男 女 雙 生 若 
T34n1728_002:0931c06	得此男不畏愛見大悲順道法愛。亦不畏無	得 此 男 不 畏 愛 見 大 悲 順 道 法 愛 亦 不 畏 無 
T34n1728_002:0931c07	慧方便縛無方便慧縛。方便與慧俱解者。即	慧 方 便 縛 無 方 便 慧 縛 方 便 與 慧 俱 解 者 即 
T34n1728_002:0931c08	男女具足二求願滿也。變易兩番可解。復次	男 女 具 足 二 求 願 滿 也 變 易 兩 番 可 解 復 次 
T34n1728_002:0931c09	從五戒十善齊第六天已來皆無禪定。番番	從 五 戒 十 善 齊 第 六 天 已 來 皆 無 禪 定 番 番 
T34n1728_002:0931c10	悉是散心慧法狂男子也。但慧無定四禪有	悉 是 散 心 慧 法 狂 男 子 也 但 慧 無 定 四 禪 有 
T34n1728_002:0931c11	支林一心名為男女福慧備也。從三界定慧	支 林 一 心 名 為 男 女 福 慧 備 也 從 三 界 定 慧 
T34n1728_002:0931c12	男女。男無破惑之功。女無生出無漏之力。此	男 女 男 無 破 惑 之 功 女 無 生 出 無 漏 之 力 此 
T34n1728_002:0931c13	無用之男女。從二乘通教等。慧有斷惑之用。	無 用 之 男 女 從 二 乘 通 教 等 慧 有 斷 惑 之 用 
T34n1728_002:0931c14	則是幹事之男。女有發生無漏紹繼之德也。	則 是 幹 事 之 男 女 有 發 生 無 漏 紹 繼 之 德 也 
T34n1728_002:0931c15	從二乘通教所有定慧不能破無明見佛性雖	從 二 乘 通 教 所 有 定 慧 不 能 破 無 明 見 佛 性 雖 
T34n1728_002:0931c16	男而女。定則不能懷於中道之子猶如石女。	男 而 女 定 則 不 能 懷 於 中 道 之 子 猶 如 石 女 
T34n1728_002:0931c17	雖女而男。故大經云。二乘之人定多慧少不	雖 女 而 男 故 大 經 云 二 乘 之 人 定 多 慧 少 不 
T34n1728_002:0931c18	見佛性。通教菩薩之人慧多定少亦不見佛	見 佛 性 通 教 菩 薩 之 人 慧 多 定 少 亦 不 見 佛 
T34n1728_002:0931c19	性。自此之前我等皆名邪見人也。唯有別教	性 自 此 之 前 我 等 皆 名 邪 見 人 也 唯 有 別 教 
T34n1728_002:0931c20	登地真明慧發無緣慈成。此乃名為真正男	登 地 真 明 慧 發 無 緣 慈 成 此 乃 名 為 真 正 男 
T34n1728_002:0931c21	女。圓教初住見中道時。定慧具足男女相滿。	女 圓 教 初 住 見 中 道 時 定 慧 具 足 男 女 相 滿 
T34n1728_002:0931c22	方稱經文男則福德女則端正。故知借事表	方 稱 經 文 男 則 福 德 女 則 端 正 故 知 借 事 表 
T34n1728_002:0931c23	法。何得作媒嫁解觀音耶。第三從是故眾生	法 何 得 作 媒 嫁 解 觀 音 耶 第 三 從 是 故 眾 生 
T34n1728_002:0931c24	去。是勸受持也。即為三。一勸持。二格量。三	去 是 勸 受 持 也 即 為 三 一 勸 持 二 格 量 三 
T34n1728_002:0931c25	結勸。持者上說觀音得名因緣其力廣大。既	結 勸 持 者 上 說 觀 音 得 名 因 緣 其 力 廣 大 既 
T34n1728_002:0931c26	不辯形質相對正述名論德。若欲歸崇宜奉	不 辯 形 質 相 對 正 述 名 論 德 若 欲 歸 崇 宜 奉 
T34n1728_002:0931c27	持名號。故舉持名為勸也。二格量為四。一格	持 名 號 故 舉 持 名 為 勸 也 二 格 量 為 四 一 格 
T34n1728_002:0931c28	量本。二問。三答。四正格量。格量本者舉三	量 本 二 問 三 答 四 正 格 量 格 量 本 者 舉 三 
T34n1728_002:0931c29	多。六十二億舉福田多。盡形壽舉時節多。四	多 六 十 二 億 舉 福 田 多 盡 形 壽 舉 時 節 多 四 
T34n1728_002:0932a01	事具足舉種子多。舊但三意今持名號多。凡	事 具 足 舉 種 子 多 舊 但 三 意 今 持 名 號 多 凡 
T34n1728_002:0932a02	舉四多為格量本也。次問答如文。次正格量	舉 四 多 為 格 量 本 也 次 問 答 如 文 次 正 格 量 
T34n1728_002:0932a03	者。還舉四少以格四多也。功德正等持名少	者 還 舉 四 少 以 格 四 多 也 功 德 正 等 持 名 少 
T34n1728_002:0932a04	田少時少種子少。問。何意以少敵多。答。佛眼	田 少 時 少 種 子 少 問 何 意 以 少 敵 多 答 佛 眼 
T34n1728_002:0932a05	稱量不增不減。四多重倍功德正齊如此。格	稱 量 不增不減 四 多 重 倍 功 德 正 齊 如 此 格 
T34n1728_002:0932a06	量秋毫無謬。問。何意等。舊解有五。一云其福	量 秋 毫 無 謬 問 何 意 等 舊 解 有 五 一 云 其 福 
T34n1728_002:0932a07	實殊引物論等。此解乃是虛談。觀音遂無實	實 殊 引 物 論 等 此 解 乃 是 虛 談 觀 音 遂 無 實 
T34n1728_002:0932a08	德可貴也。二云田有高下薄瘠所致。如供養	德 可 貴 也 二 云 田 有 高 下 薄 瘠 所 致 如 供 養 
T34n1728_002:0932a09	百初果不如一二果乃至無學。此亦非歎德之	百 初 果 不 如 一 二 果 乃 至 無 學 此 亦 非 歎 德 之 
T34n1728_002:0932a10	意。乃是以下比高法應優劣爾。三心有濃	意 乃 是 以 下 比 高 法 應 優 劣 爾 三 心 有 濃 
T34n1728_002:0932a11	淡故令福不等。四時得解不得解。此二釋皆	淡 故 令 福 不 等 四 時 得 解 不 得 解 此 二 釋 皆 
T34n1728_002:0932a12	是前人心力致福。何關觀音德高也。五有緣	是 前 人 心 力 致 福 何 關 觀 音 德 高 也 五 有 緣 
T34n1728_002:0932a13	無緣者。如供毀路人罪福淺。供毀父母罪福	無 緣 者 如 供 毀 路 人 罪 福 淺 供 毀 父 母 罪 福 
T34n1728_002:0932a14	深也。今明一多性不可得無有二相。一則非	深 也 今 明 一 多 性 不 可 得 無 有 二 相 一 則 非 
T34n1728_002:0932a15	一多則非多。同入如實際實際正等無異。一	一 多 則 非 多 同 入 如 實 際 實 際 正 等 無 異 一 
T34n1728_002:0932a16	中解無量故說六十二億。無量中解一故說	中 解 無 量 故 說 六 十 二 億 無 量 中 解 一 故 說 
T34n1728_002:0932a17	觀音展轉生非實者。則是一無一實一從無	觀 音 展 轉 生 非 實 者 則 是 一 無 一 實 一 從 無 
T34n1728_002:0932a18	量生故。多無多實多從一生故其理正均。故	量 生 故 多 無 多 實 多 從 一 生 故 其 理 正 均 故 
T34n1728_002:0932a19	言不異智者。無所畏者照其事理既明不生	言 不 異 智 者 無 所 畏 者 照 其 事 理 既 明 不 生 
T34n1728_002:0932a20	疑畏。故言正等也。法華論云。畢竟決定知法	疑 畏 故 言 正 等 也 法 華 論 云 畢 竟 決 定 知 法 
T34n1728_002:0932a21	故。法即法性真如法身。是故六十二億佛名	故 法 即 法 性 真 如 法 身 是 故 六 十 二 億 佛 名 
T34n1728_002:0932a22	與觀音名功德無差別也。又約觀解者。二觀	與 觀 音 名 功 德 無 差 別 也 又 約 觀 解 者 二 觀 
T34n1728_002:0932a23	發中道二觀實不等而言等者。以中道等故。	發 中 道 二 觀 實 不 等 而 言 等 者 以 中 道 等 故 
T34n1728_002:0932a24	故言為等。如乞人等彼難勝如來故言等也。	故 言 為 等 如 乞 人 等 彼 難 勝 如 來 故 言 等 也 
T34n1728_002:0932a25	三結成一時稱名福不可盡。大品云。一華散	三 結 成 一 時 稱 名 福 不 可 盡 大 品 云 一 華 散 
T34n1728_002:0932a26	空乃至畢苦其福不盡。如文第二問答。從無	空 乃 至 畢 苦 其 福 不 盡 如 文 第 二 問 答 從 無 
T34n1728_002:0932a27	盡意白佛言云何遊娑婆下前。問。何緣得名	盡 意 白 佛 言 云 何 遊 娑 婆 下 前 問 何 緣 得 名 
T34n1728_002:0932a28	佛。答。眾生三業顯機為境法身靈智冥應。境	佛 答 眾 生 三 業 顯 機 為 境 法 身 靈 智 冥 應 境 
T34n1728_002:0932a29	智因緣名觀世音。此義已竟。今問。云何遊此	智 因 緣 名 觀 世 音 此 義 已 竟 今 問 云 何 遊 此 
T34n1728_002:0932b01	娑婆世界。佛答以普門示現。三業顯應應眾	娑婆世界 佛 答 以 普 門 示 現 三 業 顯 應 應 眾 
T34n1728_002:0932b02	生冥機等十義。一問二答。問即為三。一云	生 冥 機 等 十 義 一 問 二 答 問 即 為 三 一 云 
T34n1728_002:0932b03	何遊是問身業。云何說是問口業。方便是問	何 遊 是 問 身 業 云 何 說 是 問 口 業 方 便 是 問 
T34n1728_002:0932b04	意業。此是聖人三業無謀而遍應一切。亦名	意 業 此 是 聖 人 三 業 無 謀 而 遍 應 一 切 亦 名 
T34n1728_002:0932b05	三不失三輪不思議化也。亦名三不護。三不	三 不 失 三 輪 不 思 議 化 也 亦 名 三 不 護 三 不 
T34n1728_002:0932b06	護者。明觀音住不思議圓普法門。實不作意	護 者 明 觀 音 住 不 思 議 圓 普 法 門 實 不 作 意 
T34n1728_002:0932b07	計校籌量。次第經營方施此應。既無分別	計 校 籌 量 次 第 經 營 方 施 此 應 既 無 分 別 
T34n1728_002:0932b08	亦無前後。任運成就譬如明鏡隨對即現一	亦 無 前 後 任 運 成 就 譬 如 明 鏡 隨 對 即 現 一 
T34n1728_002:0932b09	時等應。故言三業不護也。三無失者。眾生根	時 等 應 故 言 三 業 不 護 也 三 無 失 者 眾 生 根 
T34n1728_002:0932b10	機不同深淺有異。觀音雖不作念逗機。逗機	機 不 同 深 淺 有 異 觀 音 雖 不 作 念 逗 機 逗 機 
T34n1728_002:0932b11	無失契當前人。冥會事理故言不失。三輪不	無 失 契 當 前 人 冥 會 事 理 故 言 不 失 三 輪 不 
T34n1728_002:0932b12	思議化者。若示為佛身亦示佛心佛口。乃至	思 議 化 者 若 示 為 佛 身 亦 示 佛 心 佛 口 乃 至 
T34n1728_002:0932b13	示執金剛神身。亦示金剛心口。雖普現色身	示 執金剛神 身 亦 示 金 剛 心 口 雖 普 現 色 身 
T34n1728_002:0932b14	屈曲利物。於法身智慧無所損減淨名云。善	屈 曲 利 物 於 法 身 智 慧 無 所 損 減 淨 名 云 善 
T34n1728_002:0932b15	能分別諸法相。於第一義而不動。不動而動。	能 分別諸法 相 於 第 一 義 而 不 動 不 動 而 動 
T34n1728_002:0932b16	此乃不思義化故也。問。意業云何可示。答。聖	此 乃 不 思 義 化 故 也 問 意 業 云 何 可 示 答 聖 
T34n1728_002:0932b17	意無能測者。若欲示之。乃至昆蟲亦能得知	意 無 能 測 者 若 欲 示 之 乃 至 昆 蟲 亦 能 得 知 
T34n1728_002:0932b18	也。佛答為三。一別答。二總答。三勸供養。初	也 佛 答 為 三 一 別 答 二 總 答 三 勸 供 養 初 
T34n1728_002:0932b19	別答還答三問。應以之言是答其方便之力	別 答 還 答 三 問 應 以 之 言 是 答 其 方 便 之 力 
T34n1728_002:0932b20	意業問也。何以故。意地觀機見其所宜。宜示	意 業 問 也 何 以 故 意 地 觀 機 見 其 所 宜 宜 示 
T34n1728_002:0932b21	何身宜說何法。隨而化之。故知應以是答意	何 身 宜 說 何 法 隨 而 化 之 故 知 應 以 是 答 意 
T34n1728_002:0932b22	也。現身是答身業。說法是答口業。故知具	也 現 身 是 答 身 業 說 法 是 答 口 業 故 知 具 
T34n1728_002:0932b23	答三問也。又但作二答兼得於三。論其現	答 三 問 也 又 但 作 二 答 兼 得 於 三 論 其 現 
T34n1728_002:0932b24	身不止色陰而已。必具五陰。即兼答意也。口	身 不 止 色 陰 而 已 必 具 五 陰 即 兼 答 意 也 口 
T34n1728_002:0932b25	亦依身即兼答口。若說法者不止如樹木無	亦 依 身 即 兼 答 口 若 說 法 者 不 止 如 樹 木 無 
T34n1728_002:0932b26	心。欲知智在說巧運四悉檀方便。即兼口以	心 欲 知 智 在 說 巧 運 四 悉 檀 方 便 即 兼 口 以 
T34n1728_002:0932b27	答意也。二釋俱明答三問也。從別答中凡現	答 意 也 二 釋 俱 明 答 三 問 也 從 別 答 中 凡 現 
T34n1728_002:0932b28	三十三身十九說法。束為十界身。而文闕二	三 十 三 身 十 九 說 法 束 為 十 界 身 而 文 闕 二 
T34n1728_002:0932b29	界者。或指上品云菩薩身。或翻脫落或依	界 者 或 指 上 品 云 菩 薩 身 或 翻 脫 落 或 依 
T34n1728_002:0932c01	古本正法華文。或言觀音即是菩薩身。何須	古 本 正 法 華 文 或 言 觀 音 即 是 菩 薩 身 何 須 
T34n1728_002:0932c02	更現若三解皆有難今所不用。今依古本為	更 現 若 三 解 皆 有 難 今 所 不 用 今 依 古 本 為 
T34n1728_002:0932c03	明菩薩義故。然菩薩一界或權或實。種種應	明 菩 薩 義 故 然 菩 薩 一 界 或 權 或 實 種 種 應 
T34n1728_002:0932c04	化義不可闕。故釋菩薩界也。又無地獄界身	化 義 不 可 闕 故 釋 菩 薩 界 也 又 無 地 獄 界 身 
T34n1728_002:0932c05	者。或指上品或言苦重不可度。或言其形破	者 或 指 上 品 或 言 苦 重 不 可 度 或 言 其 形 破 
T34n1728_002:0932c06	壞人見驚畏故不現。今明別釋雖無總。答中	壞 人 見 驚 畏 故 不 現 今 明 別 釋 雖 無 總 答 中 
T34n1728_002:0932c07	有文云以種種形遊諸國土。何得言無耶。又	有 文 云 以 種 種 形 遊 諸 國 土 何 得 言 無 耶 又 
T34n1728_002:0932c08	請觀音云。或遊戲地獄大悲代受苦。或言止	請 觀 音 云 或 遊 戲 地 獄 大 悲 代 受 苦 或 言 止 
T34n1728_002:0932c09	代受苦不論說法。若依方等婆藪教化即有	代 受 苦 不 論 說 法 若 依 方 等 婆 藪 教 化 即 有 
T34n1728_002:0932c10	說法。釋論云。菩薩化地獄多作佛身。獄卒見	說 法 釋 論 云 菩 薩 化 地 獄 多 作 佛 身 獄 卒 見 
T34n1728_002:0932c11	不敢遮。以此而推。應有地獄界身說法也。	不 敢 遮 以 此 而 推 應 有 地 獄 界 身 說 法 也 
T34n1728_002:0932c12	若爾。十法界身則為具足。今通約十身四句	若 爾 十 法 界 身 則 為 具 足 今 通 約 十 身 四 句 
T34n1728_002:0932c13	料簡。自有一界身度一界。自有十界身度十	料 簡 自 有 一 界 身 度 一 界 自 有 十 界 身 度 十 
T34n1728_002:0932c14	界。自有一界身度十界。自有十界身度一界	界 自 有 一 界 身 度 十 界 自 有 十 界 身 度 一 界 
T34n1728_002:0932c15	也。若妙覺法身應實報土。為舍那佛受化之	也 若 妙 覺 法 身 應 實 報 土 為 舍 那 佛 受 化 之 
T34n1728_002:0932c16	人。純諸菩薩皆求佛道更無異身。此一界度	人 純 諸 菩 薩 皆 求 佛 道 更 無 異 身 此 一 界 度 
T34n1728_002:0932c17	一界也。若方便有餘土五人同生皆求大乘。	一 界 也 若 方 便 有 餘 土 五 人 同 生 皆 求 大 乘 
T34n1728_002:0932c18	上文云。而於彼土求佛智慧於此土為佛。亦	上 文 云 而 於 彼 土 求 佛 智 慧 於 此 土 為 佛 亦 
T34n1728_002:0932c19	是一界度一界也。若同居土寂滅道場。初成	是 一 界 度 一 界 也 若 同 居 土 寂 滅 道 場 初 成 
T34n1728_002:0932c20	佛先開頓說。稟教之徒皆有見思煩惱之人。	佛 先 開 頓 說 稟 教 之 徒 皆 有 見 思 煩 惱 之 人 
T34n1728_002:0932c21	而是圓機同感佛身。亦得是一界身度一界	而 是 圓 機 同 感 佛 身 亦 得 是 一 界 身 度 一 界 
T34n1728_002:0932c22	也。若寂滅道場稟教之徒諸界不同。或人或	也 若 寂 滅 道 場 稟 教 之 徒 諸 界 不 同 或 人 或 
T34n1728_002:0932c23	天龍神鬼等。又根性圓別兩異。雖諸界不同	天 龍 神 鬼 等 又 根 性 圓 別 兩 異 雖 諸 界 不 同 
T34n1728_002:0932c24	同見一佛身而為說法者。即是一界度多界	同 見 一 佛 身 而 為 說 法 者 即 是 一 界 度 多 界 
T34n1728_002:0932c25	也。若有一界之機但見一界身現則不得度。	也 若 有 一 界 之 機 但 見 一 界 身 現 則 不 得 度 
T34n1728_002:0932c26	則示種種之身眷屬圍繞。共逗一緣。是名多	則 示 種 種 之 身 眷 屬 圍 繞 共 逗 一 緣 是 名 多 
T34n1728_002:0932c27	界身度一界也。若佛身菩薩身遍作十法界	界 身 度 一 界 也 若 佛 身 菩 薩 身 遍 作 十 法 界 
T34n1728_002:0932c28	身。遍入諸道各令得見。同其形像而為說法。	身 遍 入 諸 道 各 令 得 見 同 其 形 像 而 為 說 法 
T34n1728_002:0932c29	此是多界度多界。用此四句。歷五味五時現	此 是 多 界 度 多 界 用 此 四 句 歷 五 味 五 時 現 
T34n1728_002:0933a01	身皆如此。復次約說法多少者。如善財從百	身 皆 如 此 復 次 約 說 法 多 少 者 如 善 財 從 百 
T34n1728_002:0933a02	一十知識聞諸法門。則多法為一人說。如	一 十 知 識 聞 諸 法 門 則 多 法 為 一 人 說 如 
T34n1728_002:0933a03	淨名云。為聲聞說四諦。為緣覺說十二因緣。	淨 名 云 為 聲 聞 說 四 諦 為 緣 覺 說 十二因緣 
T34n1728_002:0933a04	乃至為梵王說勝慧。為帝釋說無常。一人用	乃 至 為 梵 王 說 勝 慧 為 帝 釋 說 無 常 一 人 用 
T34n1728_002:0933a05	一法為一人說。若如通教說般若三乘人同	一 法 為 一 人 說 若 如 通 教 說 般 若 三 乘 人 同 
T34n1728_002:0933a06	稟。此則一法為多人說也。若是一切無礙人	稟 此 則 一 法 為 多 人 說 也 若 是 一 切 無 礙 人 
T34n1728_002:0933a07	一道出生死開佛知見。此則多法為多人說。	一 道 出 生 死 開 佛 知 見 此 則 多 法 為 多 人 說 
T34n1728_002:0933a08	復次因果相對明多少者。五戒十善因少果	復 次 因 果 相 對 明 多 少 者 五 戒 十 善 因 少 果 
T34n1728_002:0933a09	亦少。聲聞五停心煖頂等入二涅槃此因多	亦 少 聲 聞 五 停 心 煖 頂 等 入 二 涅 槃 此 因 多 
T34n1728_002:0933a10	果少。支佛見花飛葉落即得道此因少果多。	果 少 支 佛 見 花 飛 葉 落 即 得 道 此 因 少 果 多 
T34n1728_002:0933a11	諸菩薩萬行成就萬德果圓因多果亦多。觀	諸 菩 薩 萬 行 成 就 萬 德 果 圓 因 多 果 亦 多 觀 
T34n1728_002:0933a12	音明了眾生根之所趣。或示現身多少。或說	音 明 了 眾 生 根 之 所 趣 或 示 現 身 多 少 或 說 
T34n1728_002:0933a13	法多少。或修因多少。或證果多少。逗彼機宜	法 多 少 或 修 因 多 少 或 證 果 多 少 逗 彼 機 宜 
T34n1728_002:0933a14	必無有差。有人云。現因身說果法。現果身說	必 無 有 差 有 人 云 現 因 身 說 果 法 現 果 身 說 
T34n1728_002:0933a15	因法現一身說多法。現多身說一法。或現身	因 法 現 一 身 說 多 法 現 多 身 說 一 法 或 現 身 
T34n1728_002:0933a16	而無說。此比十法界機狹。舊釋三十三身為	而 無 說 此 比 十 法 界 機 狹 舊 釋 三 十 三 身 為 
T34n1728_002:0933a17	三。初三乘人。二四眾。三八部。各有枝末以	三 初 三 乘 人 二 四 眾 三 八 部 各 有 枝 末 以 
T34n1728_002:0933a18	人天為聖末。以其是受道器故。童男童女	人 天 為 聖 末 以 其 是 受 道 器 故 童 男 童 女 
T34n1728_002:0933a19	為四眾未。可成四眾故。執金剛為八部末。	為 四 眾 未 可 成 四 眾 故 執 金 剛 為 八 部 末 
T34n1728_002:0933a20	同有大力故。若爾。執金剛力大何意為末。	同 有 大 力 故 若 爾 執 金 剛 力 大 何 意 為 末 
T34n1728_002:0933a21	答此最在後為掩跡故也。今明三十三身文	答 此 最 在 後 為 掩 跡 故 也 今 明 三 十 三 身 文 
T34n1728_002:0933a22	為八番。一聖身。二天身。三人身。四四眾身。	為 八 番 一 聖 身 二 天 身 三 人 身 四 四 眾 身 
T34n1728_002:0933a23	五婦女身。六童男女身。七八部身。八金剛身。	五 婦 女 身 六 童 男 女 身 七 八 部 身 八 金 剛 身 
T34n1728_002:0933a24	明其次第出自人意爾。一明聖人先明佛者。	明 其 次 第 出 自 人 意 爾 一 明 聖 人 先 明 佛 者 
T34n1728_002:0933a25	為是應佛為是化佛。但聖人逗物具有二義。	為 是 應 佛 為 是 化 佛 但 聖 人 逗 物 具 有 二 義 
T34n1728_002:0933a26	若一時欻有為化。應同始終名應。若尋此	若 一 時 欻 有 為 化 應 同 始 終 名 應 若 尋 此 
T34n1728_002:0933a27	文明於應義也。問。何不以真佛為眾生說法	文 明 於 應 義 也 問 何 不 以 真 佛 為 眾 生 說 法 
T34n1728_002:0933a28	而以應耶。答。佛身多種。若應化非真佛。亦非	而 以 應 耶 答 佛 身 多 種 若 應 化 非 真 佛 亦 非 
T34n1728_002:0933a29	說法人。真佛者據妙覺法身究竟極地毘盧	說 法 人 真 佛 者 據 妙 覺 法 身 究 竟 極 地 毘 盧 
T34n1728_002:0933b01	遮那乃名真佛。真佛淵遠不可說示。云何能	遮 那 乃 名 真 佛 真 佛 淵 遠 不 可 說 示 云 何 能 
T34n1728_002:0933b02	解。如妙音所作文殊不知。況下地凡夫為示	解 如 妙 音 所 作 文 殊 不 知 況 下 地 凡 夫 為 示 
T34n1728_002:0933b03	真身耶。如為牛羊彈琴不如作蚊虻之聲。若	真 身 耶 如 為 牛 羊 彈 琴 不 如 作 蚊 虻 之 聲 若 
T34n1728_002:0933b04	從妙覺應。為實報圓滿相好光明無量。同四	從 妙 覺 應 為 實 報 圓 滿 相 好 光 明 無 量 同 四 
T34n1728_002:0933b05	十一地實報土眾生。為說一實諦正真之法	十 一 地 實 報 土 眾 生 為 說 一 實 諦 正 真 之 法 
T34n1728_002:0933b06	而教化之。如此之應非餘界所堪也。何以故。	而 教 化 之 如 此 之 應 非 餘 界 所 堪 也 何 以 故 
T34n1728_002:0933b07	此等諸地已分入地位。不可以餘界身應。亦	此 等 諸 地 已 分 入 地 位 不 可 以 餘 界 身 應 亦 
T34n1728_002:0933b08	不得以餘佛身應。如此應者唯應彼土。非餘	不 得 以 餘 佛 身 應 如 此 應 者 唯 應 彼 土 非 餘 
T34n1728_002:0933b09	土所堪也。復次變易土明應佛者。小乘經云。	土 所 堪 也 復 次 變 易 土 明 應 佛 者 小 乘 經 云 
T34n1728_002:0933b10	三界外無生大乘五種意生身方生方便土。	三 界 外 無 生 大 乘 五 種 意 生 身 方 生 方 便 土 
T34n1728_002:0933b11	此即三界外受生生變易土也。釋論云。法性	此 即 三 界 外 受 生 生 變 易 土 也 釋 論 云 法 性 
T34n1728_002:0933b12	身菩薩生三界外。既有生寧無應佛。法華云。	身 菩 薩 生 三 界 外 既 有 生 寧 無 應 佛 法 華 云 
T34n1728_002:0933b13	我於餘國作佛更有異名。即是此義也。此	我 於 餘 國 作 佛 更 有 異 名 即 是 此 義 也 此 
T34n1728_002:0933b14	應佛即有兩相。一示勝應身。圓滿相海如前	應 佛 即 有 兩 相 一 示 勝 應 身 圓 滿 相 海 如 前 
T34n1728_002:0933b15	實報之應。二示劣應。令見者劣於前。但為二	實 報 之 應 二 示 劣 應 令 見 者 劣 於 前 但 為 二 
T34n1728_002:0933b16	佛更不示為種種諸身。何故爾。五種意生	佛 更 不 示 為 種 種 諸 身 何 故 爾 五 種 意 生 
T34n1728_002:0933b17	利鈍之別。赴此根性故示二身。但說次第不	利 鈍 之 別 赴 此 根 性 故 示 二 身 但 說 次 第 不 
