T34n1728_001:0925b03	皆得解脫。如華嚴三十八明。善財至海門國。	皆 得 解 脫 如 華 嚴 三 十 八 明 善 財 至 海 門 國 
T34n1728_001:0925b04	海雲比丘為說普眼經云。十二年來常觀此	海 雲 比 丘 為 說 普 眼 經 云 十 二 年 來 常 觀 此 
T34n1728_001:0925b05	海漸漸轉深。大身居止珍寶聚集。如是觀已	海 漸 漸 轉 深 大 身 居 止 珍 寶 聚 集 如 是 觀 已 
T34n1728_001:0925b06	則見海底生大蓮華。無量天龍八部莊嚴華	則 見 海 底 生 大 蓮 華 無 量 天 龍 八 部 莊 嚴 華 
T34n1728_001:0925b07	上。有佛相好無邊。即申右手摩於我頂。為說	上 有 佛 相 好 無 邊 即 申 右 手 摩 於 我 頂 為 說 
T34n1728_001:0925b08	普眼經千二百歲。一日所受阿僧祇品無量	普 眼 經 千 二 百 歲 一 日 所 受 阿 僧 祇 品 無 量 
T34n1728_001:0925b09	無邊。若以海水為墨須彌聚筆。書寫此經不	無 邊 若 以 海 水 為 墨 須 彌 聚 筆 書 寫 此 經 不 
T34n1728_001:0925b10	能得盡。當知水法門攝一切法。亦如大品阿	能 得 盡 當 知 水 法 門 攝 一 切 法 亦 如 大 品 阿 
T34n1728_001:0925b11	字門具足一切義。觀音於水法門久已通達。	字 門 具 足 一 切 義 觀 音 於 水 法 門 久 已 通 達 
T34n1728_001:0925b12	故能遍應一切水難。復次本修圓觀法門。無	故 能 遍 應 一 切 水 難 復 次 本 修 圓 觀 法 門 無 
T34n1728_001:0925b13	緣慈悲遍應一切者。觀水字門。十法界趣水	緣 慈 悲 遍 應 一 切 者 觀 水 字 門 十 法 界 趣 水 
T34n1728_001:0925b14	字是趣不過。水尚不可得。云何當有趣不趣。	字 是 趣 不 過 水 尚 不 可 得 云 何 當 有 趣 不 趣 
T34n1728_001:0925b15	十法界趣水是俗諦。水尚不可得即真諦。云	十 法 界 趣 水 是 俗 諦 水 尚 不 可 得 即 真 諦 云 
T34n1728_001:0925b16	何當有趣不趣。即雙非顯中道第一義諦。如	何 當 有 趣 不 趣 即 雙 非 顯 中 道 第一義諦 如 
T34n1728_001:0925b17	此觀水字十法界三諦之法。即起無緣慈悲	此 觀 水 字 十 法 界 三 諦 之 法 即 起 無緣慈悲 
T34n1728_001:0925b18	遍熏三諦十法界眾生。故能圓應一切。若分	遍 熏 三 諦 十 法 界 眾 生 故 能 圓 應 一 切 若 分 
T34n1728_001:0925b19	別觀者。以十六三昧救果報水。以二十四三	別 觀 者 以 十 六 三 昧 救 果 報 水 以 二 十 四 三 
T34n1728_001:0925b20	昧救惡業水。以二十五三昧救二乘通別圓	昧 救 惡 業 水 以 二 十 五 三 昧 救 二 乘 通 別 圓 
T34n1728_001:0925b21	入空有流等水。以二十五三昧救別教出假。	入 空 有 流 等 水 以 二 十 五 三 昧 救 別 教 出 假 
T34n1728_001:0925b22	於有流中令無染濕。以二十五三昧救圓教	於 有 流 中 令 無 染 濕 以 二 十 五 三 昧 救 圓 教 
T34n1728_001:0925b23	入中無明流水。一切一時俱得解脫也。第	入 中 無 明 流 水 一 切 一 時 俱 得 解 脫 也 第 
T34n1728_001:0925b24	三羅剎難者。亦為三。一貼文。二約事。三	三 羅 剎 難 者 亦 為 三 一 貼 文 二 約 事 三 
T34n1728_001:0925b25	觀釋。貼文又為二。一明難。二結名。難中為	觀 釋 貼 文 又 為 二 一 明 難 二 結 名 難 中 為 
T34n1728_001:0925b26	五。一舉數。二明遇難之由。三遭苦。四明機。	五 一 舉 數 二 明 遇 難 之 由 三 遭 苦 四 明 機 
T34n1728_001:0925b27	五明應。人數者但舉百千總數不定判多少。	五 明 應 人 數 者 但 舉 百 千 總 數 不 定 判 多 少 
T34n1728_001:0925b28	明入海求珍結伴無定。難無定數終不可獨	明 入 海 求 珍 結 伴 無 定 難 無 定 數 終 不 可 獨 
T34n1728_001:0925b29	往。故舉百千也。賢愚云。田殖百倍商估千倍	往 故 舉 百 千 也 賢 愚 云 田 殖 百 倍 商 估 千 倍 
T34n1728_001:0925c01	仕宦萬倍。入海吉還得無量倍。故入海也。	仕 宦 萬 倍 入 海 吉 還 得 無 量 倍 故 入 海 也 
T34n1728_001:0925c02	次遭風是難由約下文證。今若開風為正難。	次 遭 風 是 難 由 約 下 文 證 今 若 開 風 為 正 難 
T34n1728_001:0925c03	下文云。皆得解脫羅剎之難。此豈不獨是	下 文 云 皆 得 解 脫 羅 剎 之 難 此 豈 不 獨 是 
T34n1728_001:0925c04	羅剎難也。難由正應無在由者。何但由風。	羅 剎 難 也 難 由 正 應 無 在 由 者 何 但 由 風 
T34n1728_001:0925c05	由風墮難由入海遭風。求寶入海由貪求珍	由 風 墮 難 由 入 海 遭 風 求 寶 入 海 由 貪 求 珍 
T34n1728_001:0925c06	寶。展轉相由風災難切。故風是墮難之由	寶 展 轉 相 由 風 災 難 切 故 風 是 墮 難 之 由 
T34n1728_001:0925c07	也。七寶是正寶珠是偽寶。又如意珠寶最	也 七 寶 是 正 寶 珠 是 偽 寶 又 如 意 珠 寶 最 
T34n1728_001:0925c08	上。今言等者等上等下諸寶也。樓炭云。巨	上 今 言 等 者 等 上 等 下 諸 寶 也 樓 炭 云 巨 
T34n1728_001:0925c09	海有七種似寶一百二十種真珠寶。黑風者。	海 有 七 種 似 寶 一 百 二 十 種 真 珠 寶 黑 風 者 
T34n1728_001:0925c10	舊云風無色吹黑沙故爾。有人彈云。沙中	舊 云 風 無 色 吹 黑 沙 故 爾 有 人 彈 云 沙 中 
T34n1728_001:0925c11	無船水中無沙。非是吹黑沙乃是吹黑雲爾。	無 船 水 中 無 沙 非 是 吹 黑 沙 乃 是 吹 黑 雲 爾 
T34n1728_001:0925c12	今還例此難。水中無雲雲中無船。何得彈沙	今 還 例 此 難 水 中 無 雲 雲 中 無 船 何 得 彈 沙 
T34n1728_001:0925c13	而取雲。風能吹黑雲何意不能吹黑沙。請	而 取 雲 風 能 吹 黑 雲 何 意 不 能 吹 黑 沙 請 
T34n1728_001:0925c14	觀音云。黑風洄波。仁王般若有六色風黑赤	觀 音 云 黑 風 洄 波 仁 王 般 若 有 六 色 風 黑 赤 
T34n1728_001:0925c15	青天地火也。受陰經明五風。阿含亦云。有黑	青 天 地 火 也 受 陰 經 明 五 風 阿 含 亦 云 有 黑 
T34n1728_001:0925c16	風風加以黑怖之甚也。羅剎是食人鬼人屍	風 風 加 以 黑 怖 之 甚 也 羅 剎 是 食 人 鬼 人 屍 
T34n1728_001:0925c17	若臭能呪養之令鮮。復有噉精氣鬼。人心中	若 臭 能 呪 養 之 令 鮮 復 有 噉 精 氣 鬼 人 心 中 
T34n1728_001:0925c18	有七渧甜水和氣精神。鬼噉一渧令頭痛。	有 七 渧 甜 水 和 氣 精 神 鬼 噉 一 渧 令 頭 痛 
T34n1728_001:0925c19	三渧悶絕。七渧盡即死。一人稱名餘者悉脫	三 渧 悶 絕 七 渧 盡 即 死 一 人 稱 名 餘 者 悉 脫 
T34n1728_001:0925c20	者。同憂慼休否。是共雖口不同唱。心助	者 同 憂 慼 休 否 是 共 雖 口 不 同 唱 心 助 
T34n1728_001:0925c21	覓福故俱獲濟是均。若後值賊則同聲者。陸	覓 福 故 俱 獲 濟 是 均 若 後 值 賊 則 同 聲 者 陸 
T34n1728_001:0925c22	地心多不并決。須稱號令。使齊與水難為	地 心 多 不 并 決 須 稱 號 令 使 齊 與 水 難 為 
T34n1728_001:0925c23	異。何意就此結觀音之名。此正就一人稱名	異 何 意 就 此 結 觀 音 之 名 此 正 就 一 人 稱 名 
T34n1728_001:0925c24	而賴兼群黨。明慈力廣被救護平等。顯觀音	而 賴 兼 群 黨 明 慈 力 廣 被 救 護 平 等 顯 觀 音 
T34n1728_001:0925c25	之名也。二約事證。應驗傳云。外國百餘人	之 名 也 二 約 事 證 應 驗 傳 云 外 國 百 餘 人 
T34n1728_001:0925c26	從師子國汎海向扶南。忽遇惡風墮鬼國。	從 師 子 國 汎 海 向 扶 南 忽 遇 惡 風 墮 鬼 國 
T34n1728_001:0925c27	便欲盡食。一舶眾人怖稱觀音。中有一小乘	便 欲 盡 食 一 舶 眾 人 怖 稱 觀 音 中 有 一 小 乘 
T34n1728_001:0925c28	沙門不信觀音。不肯稱名。鬼索此沙門。沙門	沙 門 不 信 觀 音 不 肯 稱 名 鬼 索 此 沙 門 沙 門 
T34n1728_001:0925c29	狼狽學稱亦得免脫。次觀釋者不但明世界	狼 狽 學 稱 亦 得 免 脫 次 觀 釋 者 不 但 明 世 界 
T34n1728_001:0926a01	中風。黑業名風。華嚴云。嫌恨猛風吹罪心火	中 風 黑 業 名 風 華 嚴 云 嫌 恨 猛 風 吹 罪 心 火 
T34n1728_001:0926a02	常令熾然。吹諸行商人墮落惡道。失人道善	常 令 熾 然 吹 諸 行 商 人 墮 落 惡 道 失 人 道 善 
T34n1728_001:0926a03	寶及無漏聖財。從地獄上至三禪。皆有果報	寶 及 無 漏 聖 財 從 地 獄 上 至 三 禪 皆 有 果 報 
T34n1728_001:0926a04	風難。如僧護經明地獄種種形相。疾風猛浪	風 難 如 僧 護 經 明 地 獄 種 種 形 相 疾 風 猛 浪 
T34n1728_001:0926a05	沒溺破壞。餓鬼所噉若鬼道中寒風裂骨身	沒 溺 破 壞 餓 鬼 所 噉 若 鬼 道 中 寒 風 裂 骨 身 
T34n1728_001:0926a06	碎碑。[石*妻]畜生飛走之類傾巢覆卵何可勝	碎 碑 [石妻] 畜 生 飛 走 之 類 傾 巢 覆 卵 何 可 勝 
T34n1728_001:0926a07	言。脩羅亦有風災。若風災起時諸山擊搏。	言 脩 羅 亦 有 風 災 若 風 災 起 時 諸 山 擊 搏 
T34n1728_001:0926a08	上至三禪宮殿碎為微塵。當此之時誰能	上 至 三 禪 宮 殿 碎 為 微 塵 當 此 之 時 誰 能 
T34n1728_001:0926a09	救濟。唯當一心稱觀世音菩薩。以王三昧力。	救 濟 唯 當 一 心 稱 觀 世 音 菩 薩 以 王 三 昧 力 
T34n1728_001:0926a10	或以手障或以口吸。無量方便令得解脫也。	或 以 手 障 或 以 口 吸 無量方便 令得解脫 也 
T34n1728_001:0926a11	次明若修諸善惡。業風吹壞五戒十善船舫。	次 明 若 修 諸 善 惡 業 風 吹 壞 五 戒 十 善 船 舫 
T34n1728_001:0926a12	墮三途鬼國及愛見境中。大經云。羅剎婦女	墮 三 途 鬼 國 及 愛 見 境 中 大 經 云 羅 剎 婦 女 
T34n1728_001:0926a13	隨所生子而悉食之。食子既盡復食其夫。急	隨 所 生 子 而 悉 食 之 食 子 既 盡 復 食 其 夫 急 
T34n1728_001:0926a14	須稱觀世音菩薩。以慈悲力能令解脫。次明	須 稱 觀 世 音 菩 薩 以 慈 悲 力 能 令 解 脫 次 明 
T34n1728_001:0926a15	二乘人採聖財寶。為煩惱風吹慧行船。行	二 乘 人 採 聖 財 寶 為 煩 惱 風 吹 慧 行 船 行 
T34n1728_001:0926a16	行舫墮見愛境。為見愛羅剎所害。若能稱觀	行 舫 墮 見 愛 境 為 見 愛 羅 剎 所 害 若 能 稱 觀 
T34n1728_001:0926a17	世音得脫見愛二輪。永得免二十五有黑	世 音 得 脫 見 愛 二 輪 永 得 免 二十五有 黑 
T34n1728_001:0926a18	業也。次明支佛六度行通別圓變易等。入	業 也 次 明 支 佛 六 度 行 通 別 圓 變 易 等 入 
T34n1728_001:0926a19	煩惱海採一切智寶。八倒暴風所吹飄。諸行	煩 惱 海 採 一 切 智 寶 八 倒 暴 風 所 吹 飄 諸 行 
T34n1728_001:0926a20	船墮二邊鬼國。用正觀心。體達諸法不生不	船 墮 二 邊 鬼 國 用 正 觀 心 體 達 諸 法 不 生 不 
T34n1728_001:0926a21	滅。入實際中。即得解脫。鬼義合前後章故	滅 入 實 際 中 即 得 解 脫 鬼 義 合 前 後 章 故 
T34n1728_001:0926a22	不重說也。法界風難無量一時圓應者。皆	不 重 說 也 法 界 風 難 無 量 一 時 圓 應 者 皆 
T34n1728_001:0926a23	由別圓慈悲所熏。菩薩本修別觀。見事中風	由 別 圓 慈 悲 所 熏 菩 薩 本 修 別 觀 見 事 中 風 
T34n1728_001:0926a24	即起慈悲修戒定。見惡業風即起慈悲修三	即 起 慈 悲 修 戒 定 見 惡 業 風 即 起 慈 悲 修 三 
T34n1728_001:0926a25	觀時。節節慈悲令入風實相王三昧中。以事	觀 時 節 節 慈 悲 令 入 風 實 相 王 三 昧 中 以 事 
T34n1728_001:0926a26	慈悲救果報風。以戒定慈悲救惡業風。三觀	慈 悲 救 果 報 風 以 戒 定 慈 悲 救 惡 業 風 三 觀 
T34n1728_001:0926a27	慈悲救煩惱風。故能十番拔難。若作圓觀論	慈 悲 救 煩 惱 風 故 能 十 番 拔 難 若 作 圓 觀 論 
T34n1728_001:0926a28	機應者。但觀風字門具照十法界。三諦宛然	機 應 者 但 觀 風 字 門 具 照 十 法 界 三 諦 宛 然 
T34n1728_001:0926a29	通達無礙慈悲遍覆。若分別說王三昧者。以	通 達 無 礙 慈 悲 遍 覆 若 分 別 說 王 三 昧 者 以 
T34n1728_001:0926b01	十七三昧救果報風。以二十四三昧救修因	十 七 三 昧 救 果 報 風 以 二 十 四 三 昧 救 修 因 
T34n1728_001:0926b02	風。以二十五三昧救二乘通別圓從假入空	風 以 二 十 五 三 昧 救 二 乘 通 別 圓 從 假 入 空 
T34n1728_001:0926b03	煩惱風。以二十五三昧救別教出假無知風。	煩 惱 風 以 二 十 五 三 昧 救 別 教 出 假 無 知 風 
T34n1728_001:0926b04	以二十五三昧救圓教入中無明風。變易可	以 二 十 五 三 昧 救 圓 教 入 中 無 明 風 變 易 可 
T34n1728_001:0926b05	解。如是遍救法界。一切一時皆得解脫也。第	解 如 是 遍 救 法 界 一 切 一 時 皆 得 解 脫 也 第 
T34n1728_001:0926b06	四明刀杖難者。亦為三。一貼文二約證。三	四 明 刀 杖 難 者 亦 為 三 一 貼 文 二 約 證 三 
T34n1728_001:0926b07	觀釋。貼文為三。一遭難即是苦。二稱名即	觀 釋 貼 文 為 三 一 遭 難 即 是 苦 二 稱 名 即 
T34n1728_001:0926b08	是善。三應。今言刀杖段段壞者。明人執殺	是 善 三 應 今 言 刀 杖 段 段 壞 者 明 人 執 殺 
T34n1728_001:0926b09	具。一折一來隨來隨斷。彌顯力大。問。水火何	具 一 折 一 來 隨 來 隨 斷 彌 顯 力 大 問 水 火 何 
T34n1728_001:0926b10	不令再滅耶。答。刀杖折再來重明聖力。水	不 令 再 滅 耶 答 刀 杖 折 再 來 重 明 聖 力 水 
T34n1728_001:0926b11	火滅後誰復持來。既無持來滅何所顯。今只	火 滅 後 誰 復 持 來 既 無 持 來 滅 何 所 顯 今 只 
T34n1728_001:0926b12	令絕炎不燒洪流更淺。存顯力大各有其意。	令 絕 炎 不 燒 洪 流 更 淺 存 顯 力 大 各 有 其 意 
T34n1728_001:0926b13	不得一例作難也。二約事證者。應驗傳云。	不 得 一 例 作 難 也 二 約 事 證 者 應 驗 傳 云 
T34n1728_001:0926b14	晉太元中彭城有一人被枉為賊。本供養金像	晉 太 元 中 彭 城 有 一 人 被 枉 為 賊 本 供 養 金 像 
T34n1728_001:0926b15	帶在髻中。後伏法刀下但聞金聲。刀三斫	帶 在 髻 中 後 伏 法 刀 下 但 聞 金 聲 刀 三 斫 
T34n1728_001:0926b16	頸終無異。解看像有三痕。由是得放。又蜀	頸 終 無 異 解 看 像 有 三 痕 由 是 得 放 又 蜀 
T34n1728_001:0926b17	有一人檀函盛像安髻中。值姚萇寇蜀。此人	有 一 人 檀 函 盛 像 安 髻 中 值 姚 萇 寇 蜀 此 人 
T34n1728_001:0926b18	與萇相遇。萇以手斫之聞頂有聲。退後看像	與 萇 相 遇 萇 以 手 斫 之 聞 頂 有 聲 退 後 看 像 
T34n1728_001:0926b19	果見有痕。其人悲感。寧傷我身反損聖容。	果 見 有 痕 其 人 悲 感 寧 傷 我 身 反 損 聖 容 
T34n1728_001:0926b20	益加精進。晉太元高簡榮陽京人。犯法臨刑	益 加 精 進 晉 太 元 高 簡 榮 陽 京 人 犯 法 臨 刑 
T34n1728_001:0926b21	一心歸命。鉗鎖不復見處。下刀刀折。絞之	一 心 歸 命 鉗 鎖 不 復 見 處 下 刀 刀 折 絞 之 
T34n1728_001:0926b22	寸斷。遂賣妻子及自身起五層塔在京縣。宋	寸 斷 遂 賣 妻 子 及 自 身 起 五 層 塔 在 京 縣 宋 
T34n1728_001:0926b23	太始初四方兵亂。沈文秀牧青州。為土人明	太 始 初 四 方 兵 亂 沈 文 秀 牧 青 州 為 土 人 明 
T34n1728_001:0926b24	僧駿所攻。秀將杜賀刑妻司馬氏云云。三	僧 駿 所 攻 秀 將 杜 賀 刑 妻 司 馬 氏 云 云 三 
T34n1728_001:0926b25	明觀釋者。非但世間殺具名為刀杖。惡業亦	明 觀 釋 者 非 但 世 間 殺 具 名 為 刀 杖 惡 業 亦 
T34n1728_001:0926b26	能傷善業身命。煩惱六塵三毒等皆名刀箭。	能 傷 善 業 身 命 煩 惱 六 塵 三 毒 等 皆 名 刀 箭 
T34n1728_001:0926b27	從地獄去即有刀山挂骨劍樹傷身。鋸解屠	從 地 獄 去 即 有 刀 山 挂 骨 劍 樹 傷 身 鋸 解 屠 
T34n1728_001:0926b28	膾狼籍痛楚。餓鬼更相斬刺互相殘害。畜生	膾 狼 籍 痛 楚 餓 鬼 更 相 斬 刺 互 相 殘 害 畜 生 
T34n1728_001:0926b29	自有雌雄牙角自相觸突。又被剉切[利禾+皮]剝。脩	自 有 雌 雄 牙 角 自 相 觸 突 又 被 剉 切 [利禾皮] 剝 脩 
T34n1728_001:0926c01	羅晝夜征戰。龍王降雨變成刀刃。人中前履	羅 晝 夜 征 戰 龍 王 降 雨 變 成 刀 刃 人 中 前 履 
T34n1728_001:0926c02	白刃却怖難誅。復有橫屍塞外。復有銜刀東	白 刃 却 怖 難 誅 復 有 橫 屍 塞 外 復 有 銜 刀 東 
T34n1728_001:0926c03	市。天共脩羅鬪時五情失守。皆有刀杖怖畏	市 天 共 脩 羅 鬪 時 五 情 失 守 皆 有 刀 杖 怖 畏 
T34n1728_001:0926c04	失命之苦。若能稱觀世音。若應刑所刀尋	失 命 之 苦 若 能 稱 觀 世 音 若 應 刑 所 刀 尋 
T34n1728_001:0926c05	斷壞。若應戰陣立之等力令得安和。次明	斷 壞 若 應 戰 陣 立 之 等 力 令 得 安 和 次 明 
T34n1728_001:0926c06	修諸善因。為三毒刀箭惡業破壞善心。割斷	修 諸 善 因 為 三 毒 刀 箭 惡 業 破 壞 善 心 割 斷 
T34n1728_001:0926c07	戒皮定肉慧骨。微妙心髓法身慧命。退失墮	戒 皮 定 肉 慧 骨 微 妙 心 髓 法 身 慧 命 退 失 墮 
T34n1728_001:0926c08	落失人天道。乃至正命登難崩易。萬劫不復	落 失 人 天 道 乃 至 正 命 登 難 崩 易 萬 劫 不 復 
T34n1728_001:0926c09	起怖畏心。稱觀世音即蒙救護。三毒不傷清	起 怖 畏 心 稱 觀 世 音 即 蒙 救 護 三 毒 不 傷 清 
T34n1728_001:0926c10	昇受樂。即菩薩力也。次明聲聞人厭患生死。	昇 受 樂 即 菩 薩 力 也 次 明 聲 聞 人 厭 患 生 死 
T34n1728_001:0926c11	即時觀三界見思劇於刀箭。故大經云。寧以	即 時 觀 三 界 見 思 劇 於 刀 箭 故 大 經 云 寧 以 
T34n1728_001:0926c12	終身近旃陀羅。不能暫時親近五陰愛詐親善	終 身 近 旃 陀 羅 不 能 暫 時 親 近 五 陰 愛 詐 親 善 
T34n1728_001:0926c13	六拔刀賊。趣向正路如為怨逐。大論云。譬如	六 拔 刀 賊 趣 向 正 路 如 為 怨 逐 大 論 云 譬 如 
T34n1728_001:0926c14	臨陣白刃間。結賊未滅害未除。如共毒蛇同	臨 陣 白 刃 間 結 賊 未 滅 害 未 除 如 共 毒 蛇 同 
T34n1728_001:0926c15	室居。如人被縛將去殺。爾時云何安可眠。五	室 居 如 人 被 縛 將 去 殺 爾 時 云 何 安 可 眠 五 
T34n1728_001:0926c16	苦章句云。十二重城三重棘舘五拔刀人	苦 章 句 云 十 二 重 城 三 重 棘 舘 五 拔 刀 人 
T34n1728_001:0926c17	守門。爾時思惟如此怖畏何由得脫。著於正	守 門 爾 時 思 惟 如 此 怖 畏 何 由 得 脫 著 於 正 
T34n1728_001:0926c18	路。須一心稱觀世音。三業至到機成感徹。則	路 須 一 心 稱 觀 世 音 三 業 至 到 機 成 感 徹 則 
T34n1728_001:0926c19	能裂生死券度恩愛河。不為煩惱刀杖所害。	能 裂 生 死 券 度 恩 愛 河 不 為 煩 惱 刀 杖 所 害 
T34n1728_001:0926c20	欲主魔王無如之何。次明支佛。次明六度	欲 主 魔 王 無 如 之 何 次 明 支 佛 次 明 六 度 
T34n1728_001:0926c21	行。次明通別圓變易等。五住刀箭傷法身損	行 次 明 通 別 圓 變 易 等 五 住 刀 箭 傷 法 身 損 
T34n1728_001:0926c22	慧命者。若能稱名即蒙聖應。免離通別刀杖	慧 命 者 若 能 稱 名 即 蒙 聖 應 免 離 通 別 刀 杖 
T34n1728_001:0926c23	脫二死地。豈非法身慈力耶。復次明刀杖機	脫 二 死 地 豈 非 法 身 慈 力 耶 復 次 明 刀 杖 機 
T34n1728_001:0926c24	應遍法界者。良由本修別圓觀時。見諸鋒刃	應 遍 法 界 者 良 由 本 修 別 圓 觀 時 見 諸 鋒 刃 
T34n1728_001:0926c25	傷毀。即起慈悲我當救護。修善遮惡時。於	傷 毀 即 起 慈 悲 我 當 救 護 修 善 遮 惡 時 於 
T34n1728_001:0926c26	善惡業復起慈悲。若觀刀杖是因緣生法修	善 惡 業 復 起 慈 悲 若 觀 刀 杖 是 因緣生法 修 
T34n1728_001:0926c27	三觀時。復起慈悲願行填滿。今住王三昧	三 觀 時 復 起 慈 悲 願 行 填 滿 今 住 王 三 昧 
T34n1728_001:0926c28	中。無量神力以本事慈悲對果報刀箭。修善	中 無 量 神 力 以 本 事 慈 悲 對 果 報 刀 箭 修 善 
T34n1728_001:0926c29	慈悲救惡業刀箭。三觀慈悲救煩惱刀箭。刀	慈 悲 救 惡 業 刀 箭 三 觀 慈 悲 救 煩 惱 刀 箭 刀 
T34n1728_001:0927a01	杖是質礙屬地字門攝。菩薩於質礙地門通	杖 是 質 礙 屬 地 字 門 攝 菩 薩 於 質 礙 地 門 通 
T34n1728_001:0927a02	達明了。如華嚴四十明。彌多羅童女於師子	達 明 了 如 華 嚴 四 十 明 彌 多 羅 童 女 於 師 子 
T34n1728_001:0927a03	奮迅城師子幢王宮中。處明淨寶藏法堂。不	奮 迅 城 師 子 幢 王 宮 中 處 明 淨 寶 藏 法 堂 不 
T34n1728_001:0927a04	可思議莊校此堂。一瑠璃柱一金剛壁一	可 思 議 莊 校 此 堂 一 瑠 璃 柱 一 金 剛 壁 一 
T34n1728_001:0927a05	摩尼鏡。諸寶諸鈴諸樹諸形像諸瓔珞中。住	摩 尼 鏡 諸 寶 諸 鈴 諸 樹 諸 形 像 諸 瓔 珞 中 住 
T34n1728_001:0927a06	是一切質礙具內。悉見一切如來從初發心	是 一 切 質 礙 具 內 悉 見 一 切 如 來 從 初 發 心 
T34n1728_001:0927a07	行菩薩道。乃至成等正覺入滅。皆於中現無	行菩薩道 乃 至 成等正覺 入 滅 皆 於 中 現 無 
T34n1728_001:0927a08	不明了。如於淨水見月影像。此法門名般若	不 明 了 如 於 淨 水 見 月 影 像 此 法 門 名 般 若 
T34n1728_001:0927a09	普莊嚴法門。善財入此地法門時。能得不可	普 莊 嚴 法 門 善 財 入 此 地 法 門 時 能 得 不 可 
T34n1728_001:0927a10	說陀羅尼大慈大悲陀羅尼。能作佛事陀羅	說 陀 羅 尼 大慈大悲 陀 羅 尼 能 作 佛 事 陀 羅 
T34n1728_001:0927a11	尼。一切法無不具足。當知地字門普應一切	尼 一 切 法 無 不 具 足 當 知 地 字 門 普 應 一 切 
T34n1728_001:0927a12	令得解脫也。復次圓觀觀地大質礙之法。攝	令得解脫 也 復 次 圓 觀 觀 地 大 質 礙 之 法 攝 
T34n1728_001:0927a13	一切十法界三諦宛然。明了在地門中。圓起	一 切 十 法 界 三 諦 宛 然 明 了 在 地 門 中 圓 起 
T34n1728_001:0927a14	慈悲遍於法界。寂而常照無機不應。若欲分	慈 悲 遍 於 法 界 寂 而 常 照 無 機 不 應 若 欲 分 
T34n1728_001:0927a15	別說之令易解者。以十三昧救果報刀杖。以	別 說 之 令 易 解 者 以 十 三 昧 救 果 報 刀 杖 以 
T34n1728_001:0927a16	二十四三昧救三毒刀杖。以二十五三昧救	二 十 四 三 昧 救 三 毒 刀 杖 以 二 十 五 三 昧 救 
T34n1728_001:0927a17	入空煩惱刀杖。以二十五三昧救出假無知	入 空 煩 惱 刀 杖 以 二 十 五 三 昧 救 出 假 無 知 
T34n1728_001:0927a18	刀杖。以二十五三昧救入中無明刀杖。一切	刀 杖 以 二 十 五 三 昧 救 入 中 無 明 刀 杖 一 切 
T34n1728_001:0927a19	一時皆得解脫。第五鬼難亦為三。一貼文。	一 時 皆 得 解 脫 第 五 鬼 難 亦 為 三 一 貼 文 
T34n1728_001:0927a20	二約證。三觀解。貼文為四。一標處所。二明	二 約 證 三 觀 解 貼 文 為 四 一 標 處 所 二 明 
T34n1728_001:0927a21	遭難即是苦。三稱名即是善。四應。三千大千	遭 難 即 是 苦 三 稱 名 即 是 善 四 應 三千大千 
T34n1728_001:0927a22	滿中者。此假設之辭也。若言滿中復。更從何	滿 中 者 此 假 設 之 辭 也 若 言 滿 中 復 更 從 何 
T34n1728_001:0927a23	處來。知是假言爾。上水火何不假設滿大	處 來 知 是 假 言 爾 上 水 火 何 不 假 設 滿 大 
T34n1728_001:0927a24	千耶。鬼有心識相延故滿假設為便。水火無	千 耶 鬼 有 心 識 相 延 故 滿 假 設 為 便 水 火 無 
T34n1728_001:0927a25	心假設為難。鬼所以畏者觀音有威有恩。若	心 假 設 為 難 鬼 所 以 畏 者 觀 音 有 威 有 恩 若 
T34n1728_001:0927a26	非懷恩則是畏威。所以聞名尚不能加於惡	非 懷 恩 則 是 畏 威 所 以 聞 名 尚 不 能 加 於 惡 
T34n1728_001:0927a27	眼。豈容興害心。害心惡眼二俱歇也。次約事	眼 豈 容 興 害 心 害 心 惡 眼 二 俱 歇 也 次 約 事 
T34n1728_001:0927a28	證者。次觀解者。若果報論鬼難者。地獄道亦	證 者 次 觀 解 者 若 果 報 論 鬼 難 者 地 獄 道 亦 
T34n1728_001:0927a29	應有弊惡大力鬼惱諸罪人。鬼道中力大者惱	應 有 弊 惡 大 力 鬼 惱 諸 罪 人 鬼 道 中 力 大 者 惱 
T34n1728_001:0927b01	於小鬼。畜生道鬼亦噉畜生。人中可知諸天	於 小 鬼 畜 生 道 鬼 亦 噉 畜 生 人 中 可 知 諸 天 
T34n1728_001:0927b02	既領鬼何容為鬼所惱。如阿含中云。有大力	既 領 鬼 何 容 為 鬼 所 惱 如 阿 含 中 云 有 大 力 
T34n1728_001:0927b03	鬼忽坐帝釋床。帝釋大瞋鬼光明轉盛。釋還	鬼 忽 坐 帝 釋 床 帝 釋 大 瞋 鬼 光 明 轉 盛 釋 還 
T34n1728_001:0927b04	發慈心鬼光明滅即去。天主既為鬼所惱。	發 慈 心 鬼 光 明 滅 即 去 天 主 既 為 鬼 所 惱 
T34n1728_001:0927b05	何況四王脩羅道耶。如是等處鬼難怖畏稱	何 況 四 王 脩 羅 道 耶 如 是 等 處 鬼 難 怖 畏 稱 
