T37n1748_002:0150b26	次第不同故。今將彼帛謙二十四對此法護四	次 第 不 同 故 今 將 彼 帛 謙 二 十 四 對 此 法 護 四 
T37n1748_002:0150b27	十八願略製以釋名。弘誓之文帛謙兩本經	十 八 願 略 製 以 釋 名 弘 誓 之 文 帛 謙 兩 本 經 
T37n1748_002:0150b28	皆二十四其意各異。帛延選此經中前二十	皆 二 十 四 其 意 各 異 帛 延 選 此 經 中 前 二 十 
T37n1748_002:0150b29	四願足寶鉢願為二十四願。支謙亦抄四十	四 願 足 寶 鉢 願 為 二 十 四 願 支 謙 亦 抄 四 十 
T37n1748_002:0150c01	八中二十五願更加寶鉢彼佛眼耳神境三通	八 中 二 十 五 願 更 加 寶 鉢 彼 佛 眼 耳 神 境 三 通 
T37n1748_002:0150c02	及以智辨為二十四故。又彼二經既抄出於	及 以 智 辨 為 二 十 四 故 又 彼 二 經 既 抄 出 於 
T37n1748_002:0150c03	四十八願故次第亦異。此經第七第十四第	四 十 八 願 故 次 第 亦 異 此 經 第 七 第 十 四 第 
T37n1748_002:0150c04	十二第十三第十九第二十二第二十五。如	十 二 第 十 三 第 十 九 第 二 十 二 第 二 十 五 如 
T37n1748_002:0150c05	次帛延第九第十二第十三第十四第十八第	次 帛 延 第 九 第 十 二 第 十 三 第 十 四 第 十 八 第 
T37n1748_002:0150c06	二十第二十四。故開合亦不同。合此二十三	二 十 第 二 十 四 故 開 合 亦 不 同 合 此 二 十 三 
T37n1748_002:0150c07	四為第二十二。七寶鉢願為第二十三。略無	四 為 第 二 十 二 七 寶 鉢 願 為 第 二 十 三 略 無 
T37n1748_002:0150c08	此第十八。彼第二十願此中無故。支謙二十	此 第 十 八 彼 第 二 十 願 此 中 無 故 支 謙 二 十 
T37n1748_002:0150c09	四次第亦異。此經三十五三十八二十七二	四 次 第 亦 異 此 經 三 十 五 三 十 八 二 十 七 二 
T37n1748_002:0150c10	十十八十九三十二十六二十一二十五十三	十 十 八 十 九 三 十 二 十 六 二 十 一 二 十 五 十 三 
T37n1748_002:0150c11	十四十五二十八三十三。如其次第即彼前	十 四 十 五 二 十 八 三 十 三 如 其 次 第 即 彼 前 
T37n1748_002:0150c12	八第十第十一第十五第六第十九第二十第	八 第 十 第 十 一 第 十 五 第 六 第 十 九 第 二 十 第 
T37n1748_002:0150c13	二十一第二十二第二十三第二十四。故開	二 十 一 第 二 十 二 第 二 十 三 第 二 十 四 故 開 
T37n1748_002:0150c14	合亦異。合此二十三二十四為第十三。合五	合 亦 異 合 此 二 十 三 二 十 四 為 第 十 三 合 五 
T37n1748_002:0150c15	六七為第二十二故有無亦異。彼第十四寶	六 七 為 第 二 十 二 故 有 無 亦 異 彼 第 十 四 寶 
T37n1748_002:0150c16	鉢第十七三通第十八智辨此經中無。此第	鉢 第 十 七 三 通 第 十 八 智 辨 此 經 中 無 此 第 
T37n1748_002:0150c17	二願彼中無故。所以有此參差者蓋梵本有	二 願 彼 中 無 故 所 以 有 此 參 差 者 蓋 梵 本 有 
T37n1748_002:0150c18	備闕故傳譯逐而脫落也。義推言之。即法護	備 闕 故 傳 譯 逐 而 脫 落 也 義 推 言 之 即 法 護 
T37n1748_002:0150c19	經應為指南。問諸佛本誓為同為異。異即違	經 應 為 指 南 問 諸 佛 本 誓 為 同 為 異 異 即 違 
T37n1748_002:0150c20	華嚴云一切諸佛悉具一切願滿方得成佛	華 嚴 云 一切諸佛 悉 具 一 切 願 滿 方 得 成 佛 
T37n1748_002:0150c21	故。若同者亦違藥師十二本願彌陀四十八	故 若 同 者 亦 違 藥 師 十 二 本 願 彌 陀 四 十 八 
T37n1748_002:0150c22	願故。答無有一佛少一願行而成道者故悉	願 故 答 無 有 一 佛 少 一 願 行 而 成 道 者 故 悉 
T37n1748_002:0150c23	同也。然以對所化之機緣熟不同故。藥師佛	同 也 然 以 對 所 化 之 機 緣 熟 不 同 故 藥 師 佛 
T37n1748_002:0150c24	於此土眾生十二大願救現在苦。緣既熟故	於 此 土 眾 生 十 二 大 願 救 現 在 苦 緣 既 熟 故 
T37n1748_002:0150c25	不說有四十八願。彌陀如來四十八願與未	不 說 有 四 十 八 願 彌 陀 如 來 四 十 八 願 與 未 
T37n1748_002:0150c26	來樂。緣熟故不說有十二願。由此諸佛所有	來 樂 緣 熟 故 不 說 有 十 二 願 由 此 諸 佛 所 有 
T37n1748_002:0150c27	誓願雖有未必遂果而法藏菩薩所發之願皆	誓 願 雖 有 未 必 遂 果 而 法 藏 菩 薩 所 發 之 願 皆 
T37n1748_002:0150c28	有成辦故。四十八願略有三意。一求佛身願	有 成 辦 故 四 十 八 願 略 有 三 意 一 求 佛 身 願 
T37n1748_002:0150c29	也。二求佛土願即三十一第三十二願也。三	也 二 求 佛 土 願 即 三 十 一 第 三 十 二 願 也 三 
T37n1748_002:0151a01	利眾生願即餘四十三也。以此三意釋四十	利 眾 生 願 即 餘 四 十 三 也 以 此 三 意 釋 四 十 
T37n1748_002:0151a02	八願之文有七。一初十一願願攝眾生。二次	八 願 之 文 有 七 一 初 十 一 願 願 攝 眾 生 二 次 
T37n1748_002:0151a03	二願願攝佛身。三次三願願攝眾生。四次一	二 願 願 攝 佛 身 三 次 三 願 願 攝 眾 生 四 次 一 
T37n1748_002:0151a04	願願攝佛身。五次十三願願攝眾生。六次二	願 願 攝 佛 身 五 次 十 三 願 願 攝 眾 生 六 次 二 
T37n1748_002:0151a05	願願攝佛土。七後十六願願攝眾生。初又有	願 願 攝 佛 土 七 後 十 六 願 願 攝 眾 生 初 又 有 
T37n1748_002:0151a06	二。初之二願願離苦。後之九願願得樂。初又	二 初 之 二 願 願 離 苦 後 之 九 願 願 得 樂 初 又 
T37n1748_002:0151a07	有二。此初願無苦苦也。汎言願者即悕求義。	有 二 此 初 願 無 苦 苦 也 汎 言 願 者 即 悕 求 義 
T37n1748_002:0151a08	所謂設我得佛等。又言誓者即邀制義。不取	所 謂 設 我 得 佛 等 又 言 誓 者 即 邀 制 義 不 取 
T37n1748_002:0151a09	正覺是也。諸願若不滿終不成佛故。假使願	正 覺 是 也 諸 願 若 不 滿 終 不 成 佛 故 假 使 願 
T37n1748_002:0151a10	不滿而得成者誓終不取故。所餘諸願皆有	不 滿 而 得 成 者 誓 終 不 取 故 所 餘 諸 願 皆 有 
T37n1748_002:0151a11	此二。應如理思。	此 二 應 如 理 思 
T37n1748_002:0151a12	經曰設我得佛至不取正覺者。述云此後願	經 曰 設 我 得 佛 至 不取正覺 者 述 云 此 後 願 
T37n1748_002:0151a13	無壞苦也。	無 壞 苦 也 
T37n1748_002:0151a14	經曰設我得佛至不取正覺者。述云第二得	經 曰 設 我 得 佛 至 不取正覺 者 述 云 第 二 得 
T37n1748_002:0151a15	樂願有二。此初二願願得身樂。	樂 願 有 二 此 初 二 願 願 得 身 樂 
T37n1748_002:0151a16	經曰設我得佛至不取正覺者。述云此後七	經 曰 設 我 得 佛 至 不取正覺 者 述 云 此 後 七 
T37n1748_002:0151a17	願願得心樂有六。此初願得宿命樂也。	願 願 得 心 樂 有 六 此 初 願 得 宿 命 樂 也 
T37n1748_002:0151a18	經曰設我得佛至不取正覺者。述云此第二	經 曰 設 我 得 佛 至 不取正覺 者 述 云 此 第 二 
T37n1748_002:0151a19	願得天眼樂也。	願 得 天 眼 樂 也 
T37n1748_002:0151a20	經曰設我得佛至不取正覺者。述云此第三	經 曰 設 我 得 佛 至 不取正覺 者 述 云 此 第 三 
T37n1748_002:0151a21	願得天耳樂也。	願 得 天 耳 樂 也 
T37n1748_002:0151a22	經曰設我得佛至不取正覺者。述云此第五	經 曰 設 我 得 佛 至 不取正覺 者 述 云 此 第 五 
T37n1748_002:0151a23	願得神通樂也。	願 得 神 通 樂 也 
T37n1748_002:0151a24	經曰設我得佛至不取正覺者。述云此第六	經 曰 設 我 得 佛 至 不取正覺 者 述 云 此 第 六 
T37n1748_002:0151a25	願得漏盡樂有二。此初漏盡體也。想念者即	願 得 漏 盡 樂 有 二 此 初 漏 盡 體 也 想 念 者 即 
T37n1748_002:0151a26	所知障。貪身者即煩惱障。盡二障漏故。	所 知 障 貪 身 者 即 煩 惱 障 盡 二 障 漏 故 
T37n1748_002:0151a27	經曰設我得佛至不取正覺者。述云此後漏	經 曰 設 我 得 佛 至 不取正覺 者 述 云 此 後 漏 
T37n1748_002:0151a28	盡位也。十信以去皆名正定聚故。言住者通	盡 位 也 十 信 以 去 皆 名 正 定 聚 故 言 住 者 通 
T37n1748_002:0151a29	正當之言也。	正 當 之 言 也 
T37n1748_002:0151b01	經曰設我得佛至不取正覺者。述云第二願	經 曰 設 我 得 佛 至 不取正覺 者 述 云 第 二 願 
T37n1748_002:0151b02	攝佛身有二。此初願光色也。	攝 佛 身 有 二 此 初 願 光 色 也 
T37n1748_002:0151b03	經曰設我得佛至不取正覺者。述云此後願	經 曰 設 我 得 佛 至 不取正覺 者 述 云 此 後 願 
T37n1748_002:0151b04	長壽也。	長 壽 也 
T37n1748_002:0151b05	經曰設我得佛至不取正覺者。述云第三願	經 曰 設 我 得 佛 至 不取正覺 者 述 云 第 三 願 
T37n1748_002:0151b06	攝眾生有三。此初攝眷屬願也。	攝 眾 生 有 三 此 初 攝 眷 屬 願 也 
T37n1748_002:0151b07	經曰設我得佛至不取正覺者。述云此次得	經 曰 設 我 得 佛 至 不取正覺 者 述 云 此 次 得 
T37n1748_002:0151b08	長壽願也。	長 壽 願 也 
T37n1748_002:0151b09	經曰設我得佛至不取正覺者。述云此後離	經 曰 設 我 得 佛 至 不取正覺 者 述 云 此 後 離 
T37n1748_002:0151b10	譏嫌願也。	譏 嫌 願 也 
T37n1748_002:0151b11	經曰設我得佛至不取正覺者。述云此第四	經 曰 設 我 得 佛 至 不取正覺 者 述 云 此 第 四 
T37n1748_002:0151b12	攝法身願也。咨者讚也。嗟者歎也。	攝 法 身 願 也 咨 者 讚 也 嗟 者 歎 也 
T37n1748_002:0151b13	經曰設我得佛至不取正覺者。述云第五攝眾	經 曰 設 我 得 佛 至 不取正覺 者 述 云 第 五 攝 眾 
T37n1748_002:0151b14	生願有二。初之四願攝人天願。後之九願攝	生 願 有 二 初 之 四 願 攝 人 天 願 後 之 九 願 攝 
T37n1748_002:0151b15	菩薩願。初又有二。初攝往生者後攝所生報。	菩 薩 願 初 又 有 二 初 攝 往 生 者 後 攝 所 生 報 
T37n1748_002:0151b16	初又有三。此攝上品願也。有說初下品次上	初 又 有 三 此 攝 上 品 願 也 有 說 初 下 品 次 上 
T37n1748_002:0151b17	品後中品非也。非唯亂次第亦違觀經不除	品 後 中 品 非 也 非 唯 亂 次 第 亦 違 觀 經 不 除 
T37n1748_002:0151b18	五逆故。然彼經云作五逆罪得生淨土。違此	五 逆 故 然 彼 經 云 作 五 逆 罪 得 生 淨 土 違 此 
T37n1748_002:0151b19	願云唯除五逆誹謗正法故。從昔會釋自成	願 云 唯 除 五 逆 誹謗正法 故 從 昔 會 釋 自 成 
T37n1748_002:0151b20	百家。有說亦謗正法者除唯造五逆者生。有	百 家 有 說 亦 謗 正 法 者 除 唯 造 五 逆 者 生 有 
T37n1748_002:0151b21	難此言彼經亦云具諸不善。若不謗法即不	難 此 言 彼 經 亦 云 具 諸 不 善 若 不 謗 法 即 不 
T37n1748_002:0151b22	可言具諸不善。如何乃言唯造五逆得生淨	可 言 具 諸 不 善 如 何 乃 言 唯 造 五 逆 得 生 淨 
T37n1748_002:0151b23	土。此難非也。若謂彼經具諸不善故亦攝謗	土 此 難 非 也 若 謂 彼 經 具 諸 不 善 故 亦 攝 謗 
T37n1748_002:0151b24	法者即五逆應屬諸不善故。不須別說。今即	法 者 即 五 逆 應 屬 諸 不 善 故 不 須 別 說 今 即 
T37n1748_002:0151b25	應彈。隨順及言合集之義而相違釋。相違釋	應 彈 隨 順 及 言 合 集 之 義 而 相 違 釋 相 違 釋 
T37n1748_002:0151b26	者諍頭義故。罪既各別名亦別故。有說此	者 諍 頭 義 故 罪 既 各 別 名 亦 別 故 有 說 此 
T37n1748_002:0151b27	除不悔彼之說悔此亦不然。既十念中念別	除 不 悔 彼 之 說 悔 此 亦 不 然 既 十 念 中 念 別 
T37n1748_002:0151b28	滅八十億劫生死之罪。應無悔與不悔別故。	滅 八 十 億 劫 生 死 之 罪 應 無 悔 與 不 悔 別 故 
T37n1748_002:0151b29	若更有別懺悔法者即於下品下生文中都無	若 更 有 別 懺 悔 法 者 即 於 下 品 下 生 文 中 都 無 
T37n1748_002:0151c01	故。有說對未造者言除對已造者說生。此亦	故 有 說 對 未 造 者 言 除 對 已 造 者 說 生 此 亦 
T37n1748_002:0151c02	不然。未造者尚除況亦已造。故若已造令進	不 然 未 造 者 尚 除 況 亦 已 造 故 若 已 造 令 進 
T37n1748_002:0151c03	故無此失者未造應令退耶。有說正五逆者除	故 無 此 失 者 未 造 應 令 退 耶 有 說 正 五 逆 者 除 
T37n1748_002:0151c04	五逆類者生此亦不然。無有聖教說五逆類	五 逆 類 者 生 此 亦 不 然 無 有 聖 教 說 五 逆 類 
T37n1748_002:0151c05	名五逆故。不可彼經五逆言類。有說重心造	名 五 逆 故 不 可 彼 經 五 逆 言 類 有 說 重 心 造 
T37n1748_002:0151c06	者除輕心造者生歟。此亦不然。誹謗正法必	者 除 輕 心 造 者 生 歟 此 亦 不 然 誹謗正法 必 
T37n1748_002:0151c07	有輕重。不可唯言除不生故。有說除即第三	有 輕 重 不 可 唯 言 除 不 生 故 有 說 除 即 第 三 
T37n1748_002:0151c08	階造五逆者生即第二階造逆者。此亦不然。	階 造 五 逆 者 生 即 第 二 階 造 逆 者 此 亦 不 然 
T37n1748_002:0151c09	眾生有三非聖教故。設有聖說亦違自許第	眾 生 有 三 非 聖 教 故 設 有 聖 說 亦 違 自 許 第 
T37n1748_002:0151c10	三階人不行普法有逆無逆皆不得生。若如	三 階 人 不 行 普 法 有 逆 無 逆 皆 不 得 生 若 如 
T37n1748_002:0151c11	所言應說唯除第三階而言除逆唯有虛言	所 言 應 說 唯 除 第 三 階 而 言 除 逆 唯 有 虛 言 
T37n1748_002:0151c12	故。有說除者先遮生者後開。此亦非也。先遮	故 有 說 除 者 先 遮 生 者 後 開 此 亦 非 也 先 遮 
T37n1748_002:0151c13	若實生後開實應不生故。有說未發菩提心	若 實 生 後 開 實 應 不 生 故 有 說 未 發菩提心 
T37n1748_002:0151c14	造逆者除已發菩提心作逆者生。此亦不然。	造 逆 者 除 已 發菩提心 作 逆 者 生 此 亦 不 然 
T37n1748_002:0151c15	已發菩提心若退失者應如未發心不得生	已 發菩提心 若 退 失 者 應 如 未 發 心 不 得 生 
T37n1748_002:0151c16	故。若不退心者必不作逆故。有說除即對佛	故 若 不 退 心 者 必 不 作 逆 故 有 說 除 即 對 佛 
T37n1748_002:0151c17	說五逆罪決定故。生即對佛說五逆等皆不	說 五 逆 罪 決 定 故 生 即 對 佛 說 五 逆 等 皆 不 
T37n1748_002:0151c18	定故。此亦不然。不善順生後受業等皆應例	定 故 此 亦 不 然 不 善 順 生 後 受 業 等 皆 應 例 
T37n1748_002:0151c19	此五逆罪等便成大過故。有說若宿世中無	此 五 逆 罪 等 便 成 大 過 故 有 說 若 宿 世 中 無 
T37n1748_002:0151c20	道機者既作五逆終無生理。其先發菩提心	道 機 者 既 作 五 逆 終 無 生 理 其 先 發菩提心 
T37n1748_002:0151c21	雖復逢緣造五逆等必生深悔亦得往生。善	雖 復 逢 緣 造 五 逆 等 必 生 深 悔 亦 得 往 生 善 
T37n1748_002:0151c22	趣之人有作五逆謗正法故。二文各談一互	趣 之 人 有 作 五 逆 謗 正 法 故 二 文 各 談 一 互 
T37n1748_002:0151c23	不相違。此亦不然。宿世之言應無用故。現發	不 相 違 此 亦 不 然 宿 世 之 言 應 無 用 故 現 發 
T37n1748_002:0151c24	菩提心逢緣作逆應亦生故。又彼善趣即十	菩 提 心 逢 緣 作 逆 應 亦 生 故 又 彼 善 趣 即 十 
T37n1748_002:0151c25	信故作逆謗法必無此理。前已說故。有說一	信 故 作 逆 謗 法 必 無 此 理 前 已 說 故 有 說 一 
T37n1748_002:0151c26	念念佛者除十念念佛者生。此必非也。即違	念 念 佛 者 除 十 念 念 佛 者 生 此 必 非 也 即 違 
T37n1748_002:0151c27	此云乃至十念故。有說除者具十不具十悉	此 云 乃 至 十 念 故 有 說 除 者 具 十 不 具 十 悉 
T37n1748_002:0151c28	不得生故。生者唯具十聲故。此亦不然。雖兼	不 得 生 故 生 者 唯 具 十 聲 故 此 亦 不 然 雖 兼 
T37n1748_002:0151c29	不具十聲既亦申具十念。應如彼經不可除	不 具 十 聲 既 亦 申 具 十 念 應 如 彼 經 不 可 除 
T37n1748_002:0152a01	故。今即此經上三生中必無作逆故須除之。	故 今 即 此 經 上 三 生 中 必 無 作 逆 故 須 除 之 
T37n1748_002:0152a02	彼說下生。雖作五逆若備十念亦得生故無	彼 說 下 生 雖 作 五 逆 若 備 十 念 亦 得 生 故 無 
T37n1748_002:0152a03	違可釋。不應難言中品三生亦無作逆故。不	違 可 釋 不 應 難 言 中 品 三 生 亦 無 作 逆 故 不 
T37n1748_002:0152a04	須除者發菩提心修諸功德。即非作逆義既	須 除 者 發菩提心 修諸功德 即 非 作 逆 義 既 
T37n1748_002:0152a05	顯故。但誹謗正法罪既深重。於無數劫受苦	顯 故 但 誹謗正法 罪 既 深 重 於 無 數 劫 受 苦 
T37n1748_002:0152a06	報故。假具十聲必不得生。所以聖教更無異	報 故 假 具 十 聲 必 不 得 生 所 以 聖 教 更 無 異 
T37n1748_002:0152a07	說。入諸不善者過難多故。有說此經十念依	說 入 諸 不 善 者 過 難 多 故 有 說 此 經 十 念 依 
T37n1748_002:0152a08	十法而念。非佛名故即彌勒所問十念是也	十 法 而 念 非 佛 名 故 即 彌 勒 所 問 十 念 是 也 
T37n1748_002:0152a09	此亦不然。彼經十念即非凡夫。必非上品三	此 亦 不 然 彼 經 十 念 即 非 凡 夫 必 非 上 品 三 
T37n1748_002:0152a10	生所能修故。今即還同觀經十念。上輩亦修	生 所 能 修 故 今 即 還 同 觀 經 十 念 上 輩 亦 修 
T37n1748_002:0152a11	十念。理無違故。欲顯一二等言乃至故。傍論	十 念 理 無 違 故 欲 顯 一 二 等 言 乃 至 故 傍 論 
T37n1748_002:0152a12	且止應釋本文。	且 止 應 釋 本 文 
T37n1748_002:0152a13	經曰設我得佛至不取正覺者。述云此次攝	經 曰 設 我 得 佛 至 不取正覺 者 述 云 此 次 攝 
T37n1748_002:0152a14	中品也。既云發菩提心故。即知不發心聖雖	中 品 也 既 云 發菩提心 故 即 知 不 發 心 聖 雖 
T37n1748_002:0152a15	不迎無違本願之失。	不 迎 無 違 本 願 之 失 
T37n1748_002:0152a16	經曰設我得佛至不取正覺者。述云此後攝下	經 曰 設 我 得 佛 至 不取正覺 者 述 云 此 後 攝 下 
T37n1748_002:0152a17	品也。有說攝論雖舉願言意亦說念佛是別	品 也 有 說 攝 論 雖 舉 願 言 意 亦 說 念 佛 是 別 
T37n1748_002:0152a18	時之意。有說彼不以念佛為別時意。往生論	時 之 意 有 說 彼 不 以 念 佛 為 別 時 意 往 生 論 
T37n1748_002:0152a19	云念佛即生非別時故。往生論及攝論釋皆	云 念 佛 即 生 非 別 時 故 往 生 論 及 攝 論 釋 皆 
T37n1748_002:0152a20	天親造理必應同。不可前後有鉾楯故。但諸	天 親 造 理 必 應 同 不 可 前 後 有 鉾 楯 故 但 諸 
T37n1748_002:0152a21	眾生雖聞淨土之教誹謗不信自沈惡道。或	眾 生 雖 聞 淨 土 之 教 誹 謗 不 信 自 沈 惡 道 或 
T37n1748_002:0152a22	信不謗欲愛所纏不敢起願況亦修行。或有	信 不 謗 欲 愛 所 纏 不 敢 起 願 況 亦 修 行 或 有 
T37n1748_002:0152a23	眾生聞說便發誓願欲生而逢惡友廣作諸	眾 生 聞 說 便 發 誓 願 欲 生 而 逢 惡 友 廣 作 諸 
T37n1748_002:0152a24	惡。命欲終時不遇善友不能念佛。雖不即生	惡 命 欲 終 時 不 遇 善 友 不 能 念 佛 雖 不 即 生 
T37n1748_002:0152a25	是遠生因。佛歎此類生極樂土。愚人將謂更	是 遠 生 因 佛 歎 此 類 生 極 樂 土 愚 人 將 謂 更 
T37n1748_002:0152a26	不修因而即往生。故釋論云是別時之意。二	不 修 因 而 即 往 生 故 釋 論 云 是 別 時 之 意 二 
T37n1748_002:0152a27	俱不然。若願若念皆於淨土是遠生因故。不	俱 不 然 若 願 若 念 皆 於 淨 土 是 遠 生 因 故 不 
T37n1748_002:0152a28	爾即違密意說言。前已說故。若諸眾生起願	爾 即 違 密意說言 前 已 說 故 若 諸 眾 生 起 願 
T37n1748_002:0152a29	念佛即生化土故。此文言繫念我國者即往	念 佛 即 生 化 土 故 此 文 言 繫 念 我 國 者 即 往 
T37n1748_002:0152b01	生之行也。	生 之 行 也 
T37n1748_002:0152b02	經曰設我得佛至不取正覺者。述云此第二	經 曰 設 我 得 佛 至 不取正覺 者 述 云 此 第 二 
T37n1748_002:0152b03	願所生報也。	願 所 生 報 也 
T37n1748_002:0152b04	經曰設我得佛至不取正覺者。述云第二攝	經 曰 設 我 得 佛 至 不取正覺 者 述 云 第 二 攝 
T37n1748_002:0152b05	菩薩願有二。此初攝他國菩薩也。常倫者即	菩 薩 願 有 二 此 初 攝 他 國 菩 薩 也 常 倫 者 即 
T37n1748_002:0152b06	凡夫之屬故。諸地亦初劫之地。	凡 夫 之 屬 故 諸 地 亦 初 劫 之 地 
T37n1748_002:0152b07	經曰設我得佛至不取正覺者。述云此後攝	經 曰 設 我 得 佛 至 不取正覺 者 述 云 此 後 攝 
T37n1748_002:0152b08	自土菩薩願有八。此初承力供聖願也。	自 土 菩 薩 願 有 八 此 初 承 力 供 聖 願 也 
T37n1748_002:0152b09	經曰設我得佛至不取正覺者。述云此第二	經 曰 設 我 得 佛 至 不取正覺 者 述 云 此 第 二 
T37n1748_002:0152b10	供具隨欲願也。	供 具 隨 欲 願 也 
T37n1748_002:0152b11	經曰設我得佛至不取正覺者。述曰此第三	經 曰 設 我 得 佛 至 不取正覺 者 述 曰 此 第 三 
T37n1748_002:0152b12	說法盡勝願也。	說 法 盡 勝 願 也 
T37n1748_002:0152b13	經曰設我得佛至不取正覺者。述云此第四身	經 曰 設 我 得 佛 至 不取正覺 者 述 云 此 第 四 身 
T37n1748_002:0152b14	得堅固願也。那羅延者即真諦云天力士故。	得 堅 固 願 也 那 羅 延 者 即 真 諦 云 天 力 士 故 
T37n1748_002:0152b15	經曰設我得佛至不取正覺者。述云此第五	經 曰 設 我 得 佛 至 不取正覺 者 述 云 此 第 五 
T37n1748_002:0152b16	光色特妙願也。	光 色 特 妙 願 也 
T37n1748_002:0152b17	經曰設我得佛至不取正覺者。述云此第六	經 曰 設 我 得 佛 至 不取正覺 者 述 云 此 第 六 
T37n1748_002:0152b18	知見道樹願也。	知 見 道 樹 願 也 
T37n1748_002:0152b19	經曰設我得佛至不取正覺者。述云此第七	經 曰 設 我 得 佛 至 不取正覺 者 述 云 此 第 七 
T37n1748_002:0152b20	四辨無礙願也。	四 辨 無 礙 願 也 
T37n1748_002:0152b21	經曰設我得佛至不取正覺。此第八□□□	經 曰 設 我 得 佛 至 不取正覺 此 第 八 
T37n1748_002:0152b22	□願也。	 願 也 
T37n1748_002:0152b23	經曰設我得佛至不取正覺者。述云第六攝	經 曰 設 我 得 佛 至 不取正覺 者 述 云 第 六 攝 
T37n1748_002:0152b24	佛土願有二。此初形色功德願也。	佛 土 願 有 二 此 初 形 色 功 德 願 也 
T37n1748_002:0152b25	經曰設我得佛至不取正覺者。述云此後莊	經 曰 設 我 得 佛 至 不取正覺 者 述 云 此 後 莊 
T37n1748_002:0152b26	嚴功德願也。	嚴 功 德 願 也 
T37n1748_002:0152b27	經曰設我得佛至不取正覺者。述云第七攝	經 曰 設 我 得 佛 至 不取正覺 者 述 云 第 七 攝 
T37n1748_002:0152b28	眾生願有五。此初攝他土眾生有二。此初蒙	眾 生 願 有 五 此 初 攝 他 土 眾 生 有 二 此 初 蒙 
T37n1748_002:0152b29	光獲利願也。	光 獲 利 願 也 
T37n1748_002:0152c01	經曰設我得佛至不取正覺者。述云此後聞	經 曰 設 我 得 佛 至 不取正覺 者 述 云 此 後 聞 
T37n1748_002:0152c02	名得益願有四。此初法忍總持也。	名 得 益 願 有 四 此 初 法 忍 總 持 也 
T37n1748_002:0152c03	經曰設我得佛至不取正覺者。述云此第二遠	經 曰 設 我 得 佛 至 不取正覺 者 述 云 此 第 二 遠 
T37n1748_002:0152c04	離譏嫌願也。然音聲王云阿彌陀佛有父母	離 譏 嫌 願 也 然 音 聲 王 云 阿 彌 陀 佛 有 父 母 
T37n1748_002:0152c05	者有說彼顯穢土。佛有父母非淨土故。不違	者 有 說 彼 顯 穢 土 佛 有 父 母 非 淨 土 故 不 違 
T37n1748_002:0152c06	此文自說魔王名曰無勝提婆達多名曰寂	此 文 自 說 魔 王 名 曰 無 勝 提 婆 達 多 名 曰 寂 
T37n1748_002:0152c07	故。有說不然。雖有魔王而守護故。不爾即法	故 有 說 不 然 雖 有 魔 王 而 守 護 故 不 爾 即 法 
T37n1748_002:0152c08	華經中違飲光淨土魔及魔民皆護佛法故。	華 經 中 違 飲 光 淨 土 魔 及 魔 民 皆 護 佛 法 故 
T37n1748_002:0152c09	應說彼經顯變化土。亦有女人自說所生之	應 說 彼 經 顯 變 化 土 亦 有 女 人 自 說 所 生 之 
T37n1748_002:0152c10	處永離胞胎穢欲之形故。而無女人者即受	處 永 離 胞 胎 穢 欲 之 形 故 而 無 女 人 者 即 受 
T37n1748_002:0152c11	用土也。存此言善順菩薩瓔珞經也。如彼經	用 土 也 存 此 言 善 順 菩 薩 瓔 珞 經 也 如 彼 經 
T37n1748_002:0152c12	第十一釋慧智造如來淨土云。但男女眾生	第 十 一 釋 慧 智 造 如 來 淨 土 云 但 男 女 眾 生 
T37n1748_002:0152c13	不如阿彌陀國得道者故。雖有男女而無男	不 如 阿 彌 陀 國 得 道 者 故 雖 有 男 女 而 無 男 
T37n1748_002:0152c14	女之欲。此必不然。既云男女眾生不如彌陀	女 之 欲 此 必 不 然 既 云 男 女 眾 生 不 如 彌 陀 
