T37n1748_003:0161c11	能見眾生死此生彼故名天眼。所見廣多故	能 見 眾 生 死此生彼 故 名 天 眼 所 見 廣 多 故 
T37n1748_003:0161c12	云無量。亦長遠故云無限。法眼即以有智為	云 無 量 亦 長 遠 故 云 無 限 法 眼 即 以 有 智 為 
T37n1748_003:0161c13	體能見眾生根欲性心及諸佛法故名法眼。	體 能 見 眾 生 根 欲 性 心 及 諸 佛 法 故 名 法 眼 
T37n1748_003:0161c14	普知三乘道法差別故云究竟諸道。慧眼即	普 知 三 乘 道 法 差 別 故 云 究 竟 諸 道 慧 眼 即 
T37n1748_003:0161c15	以空智為體照真空理故。云見真。窮真理之	以 空 智 為 體 照 真 空 理 故 云 見 真 窮 真 理 之 
T37n1748_003:0161c16	源故云度彼岸。度者至也。佛眼自有二所謂	源 故 云 度 彼 岸 度 者 至 也 佛 眼 自 有 二 所 謂 
T37n1748_003:0161c17	總別。別即一切種智為體無法不照故云具	總 別 別 即 一切種智 為 體 無 法 不 照 故 云 具 
T37n1748_003:0161c18	足。亦見佛性故云覺法性。總即前四眼佛之	足 亦 見 佛 性 故 云 覺 法 性 總 即 前 四 眼 佛 之 
T37n1748_003:0161c19	所得。觀境同盡故云具足了。	所 得 觀 境 同 盡 故 云 具 足 了 
T37n1748_003:0161c20	經曰以無礙智為人演說者。述云此後成化	經 曰 以 無 礙 智 為 人 演 說 者 述 云 此 後 成 化 
T37n1748_003:0161c21	德。即四無礙辯為物說法也。	德 即 四 無 礙 辯 為 物 說 法 也 
T37n1748_003:0161c22	經曰等觀三界至煩惱之患者。述云此第三	經 曰 等觀三界 至 煩 惱 之 患 者 述 云 此 第 三 
T37n1748_003:0161c23	行修具足有二。此初修行也。觀三界空無者	行 修 具 足 有 二 此 初 修 行 也 觀 三 界 空 無 者 
T37n1748_003:0161c24	即捨生死行。欲等三界無有一界而不空者故	即 捨 生 死 行 欲 等 三 界 無 有 一 界 而 不 空 者 故 
T37n1748_003:0161c25	云等觀。志求佛法者即欣菩提行。具辯才者	云 等 觀 志 求 佛 法 者 即 欣 菩 提 行 具 辯 才 者 
T37n1748_003:0161c26	即利他之德所謂四辯等。滅煩惱患者化他	即 利 他 之 德 所 謂 四 辯 等 滅 煩 惱 患 者 化 他 
T37n1748_003:0161c27	之益。	之 益 
T37n1748_003:0161c28	經曰從如來生至二餘俱盡者。述云此後修成	經 曰 從 如 來 生 至 二 餘 俱 盡 者 述 云 此 後 修 成 
T37n1748_003:0161c29	有二。此初自行成又有二。此初解行雙成也	有 二 此 初 自 行 成 又 有 二 此 初 解 行 雙 成 也 
T37n1748_003:0162a01	有說從如來生解法如如者是其理解。善知	有 說 從 如 來 生 解 法 如 如 者 是 其 理 解 善 知 
T37n1748_003:0162a02	習滅方便者是其教解。解由如來教化而生	習 滅 方 便 者 是 其 教 解 解 由 如 來 教 化 而 生 
T37n1748_003:0162a03	解一切法皆即如故云從如來生解法如如。	解 一 切 法 皆 即 如 故 云 從 如 來 生 解 法 如 如 
T37n1748_003:0162a04	習善之教名習音聲。滅惡之教名滅音聲。於	習 善 之 教 名 習 音 聲 滅 惡 之 教 名 滅 音 聲 於 
T37n1748_003:0162a05	此善解巧知故云善知方便。此猶不盡。教解	此 善 解 巧 知 故 云 善知方便 此 猶 不 盡 教 解 
T37n1748_003:0162a06	亦從佛化生故。有說習即集諦意亦兼苦。滅	亦 從 佛 化 生 故 有 說 習 即 集 諦 意 亦 兼 苦 滅 
T37n1748_003:0162a07	即滅諦含道之言。因果相涉。故說四諦之教	即 滅 諦 含 道 之 言 因 果 相 涉 故 說 四 諦 之 教 
T37n1748_003:0162a08	即音聲方便。此亦不然。集雖必苦苦有非集。	即 音 聲 方 便 此 亦 不 然 集 雖 必 苦 苦 有 非 集 
T37n1748_003:0162a09	滅之與道為無為異。不可以集滅而攝苦道	滅 之 與 道 為 無 為 異 不 可 以 集 滅 而 攝 苦 道 
T37n1748_003:0162a10	故。今即從如來生者即總顯菩薩獲解之所	故 今 即 從 如 來 生 者 即 總 顯 菩 薩 獲 解 之 所 
T37n1748_003:0162a11	由。解法如如者即別申悟非安立真之智。善	由 解 法 如 如 者 即 別 申 悟 非 安 立 真 之 智 善 
T37n1748_003:0162a12	智習滅者即別辨悟安立諦之解。習滅者舉	智 習 滅 者 即 別 辨 悟 安 立 諦 之 解 習 滅 者 舉 
T37n1748_003:0162a13	染因淨果不盡之言。真絕眾相而說四諦唯	染 因 淨 果 不 盡 之 言 真 絕 眾 相 而 說 四 諦 唯 
T37n1748_003:0162a14	教施設故云音聲方便。由於聖教能善解故	教 施 設 故 云 音 聲 方 便 由 於 聖 教 能 善 解 故 
T37n1748_003:0162a15	不欣世語樂在正論。有說離口四過故不欣	不欣世語 樂 在 正 論 有 說 離 口 四 過 故 不 欣 
T37n1748_003:0162a16	世語。作四聖言故樂在正論非也。想實聖言	世 語 作 四 聖 言 故 樂 在 正 論 非 也 想 實 聖 言 
T37n1748_003:0162a17	必非正論故即解成是也。崇佛道者求菩提	必 非 正 論 故 即 解 成 是 也 崇 佛 道 者 求 菩 提 
T37n1748_003:0162a18	之心。知法寂滅者修對治之行。二餘俱盡者	之 心 知 法 寂 滅 者 修 對 治 之 行 二 餘 俱 盡 者 
T37n1748_003:0162a19	除障苦之行。有說生身是報餘煩惱是分段	除 障 苦 之 行 有 說 生 身 是 報 餘 煩 惱 是 分 段 
T37n1748_003:0162a20	之餘。初地上盡。變易二餘當盡故。有說煩惱	之 餘 初 地 上 盡 變 易 二 餘 當 盡 故 有 說 煩 惱 
T37n1748_003:0162a21	及習二餘俱盡。二俱不然。前七地中亦受分	及 習 二 餘 俱 盡 二 俱 不 然 前 七 地 中 亦 受 分 
T37n1748_003:0162a22	段煩惱餘氣名為餘習必非煩惱故。如其次	段 煩 惱 餘 氣 名 為 餘 習 必 非 煩 惱 故 如 其 次 
T37n1748_003:0162a23	第今即生身在報煩惱苦因。因果二餘皆已	第 今 即 生 身 在 報 煩 惱 苦 因 因 果 二 餘 皆 已 
T37n1748_003:0162a24	盡故即行成是也。	盡 故 即 行 成 是 也 
T37n1748_003:0162a25	經曰聞甚深法至常能修行者。述云此後解	經 曰 聞 甚 深 法 至 常 能 修 行 者 述 云 此 後 解 
T37n1748_003:0162a26	行並修也。有說於深能解故不疑於深能入	行 並 修 也 有 說 於 深 能 解 故 不 疑 於 深 能 入 
T37n1748_003:0162a27	故不懼非也入亦解故。今即能信深教故不	故 不 懼 非 也 入 亦 解 故 今 即 能 信 深 教 故 不 
T37n1748_003:0162a28	疑能解深義故不懼進修解是也。常修行者	疑 能 解 深 義 故 不 懼 進 修 解 是 也 常 修 行 者 
T37n1748_003:0162a29	即進修行也。聞必修習而無間故云常修。	即 進 修 行 也 聞 必 修 習 而 無 間 故 云 常 修 
T37n1748_003:0162b01	經曰其大悲者至靡不覆載者。述云此後化	經 曰 其 大 悲 者 至 靡 不 覆 載 者 述 云 此 後 化 
T37n1748_003:0162b02	行成也。深遠微妙者歎心深重。靡不覆載者	行 成 也 深 遠 微 妙 者 歎 心 深 重 靡 不 覆 載 者 
T37n1748_003:0162b03	嘆濟普廣。非唯悲蔭亦令出死故云載也。	嘆 濟 普 廣 非 唯 悲 蔭 亦 令 出 死 故 云 載 也 
T37n1748_003:0162b04	經曰究竟一乘至于彼岸者。述云此第四成德	經 曰 究 竟 一 乘 至 于 彼 岸 者 述 云 此 第 四 成 德 
T37n1748_003:0162b05	奇勝有二。初成自德後成化德。初又有二。此	奇 勝 有 二 初 成 自 德 後 成 化 德 初 又 有 二 此 
T37n1748_003:0162b06	初集善勝有三對。此初智斷對也。一乘者即	初 集 善 勝 有 三 對 此 初 智 斷 對 也 一 乘 者 即 
T37n1748_003:0162b07	智雖有三乘其極無二故云一乘。有說於此	智 雖 有 三 乘 其 極 無 二 故 云 一 乘 有 說 於 此 
T37n1748_003:0162b08	一乘窮名究竟。至涅槃果故至于彼岸非也。	一 乘 窮 名 究 竟 至 涅 槃 果 故 至 于 彼 岸 非 也 
T37n1748_003:0162b09	若窮一乘至涅槃者應非菩薩故。今即信解	若 窮 一 乘 至 涅 槃 者 應 非 菩 薩 故 今 即 信 解 
T37n1748_003:0162b10	斯極故云究竟彼岸者即斷。既得斷智障無	斯 極 故 云 究 竟 彼 岸 者 即 斷 既 得 斷 智 障 無 
T37n1748_003:0162b11	為故云至彼岸。	為 故 云 至 彼 岸 
T37n1748_003:0162b12	經曰決斷疑網至該羅無外者。述云此次理教	經 曰 決斷疑網 至 該 羅 無 外 者 述 云 此 次 理 教 
T37n1748_003:0162b13	對也。顯實以除妄故云斷疑網。真解發中故	對 也 顯 實 以 除 妄 故 云 斷 疑 網 真 解 發 中 故 
T37n1748_003:0162b14	慧由心出。心者中實義故即證理慧也。達之	慧 由 心 出 心 者 中 實 義 故 即 證 理 慧 也 達 之 
T37n1748_003:0162b15	無餘故該無外。即達教解也。有說知無我慧	無 餘 故 該 無 外 即 達 教 解 也 有 說 知 無 我 慧 
T37n1748_003:0162b16	不從外來故慧由心出。知教從心現故該羅	不 從 外 來 故 慧 由 心 出 知 教 從 心 現 故 該 羅 
T37n1748_003:0162b17	無外。此猶未盡。無我慧從佛化生現心上。教	無 外 此 猶 未 盡 無 我 慧 從 佛 化 生 現 心 上 教 
T37n1748_003:0162b18	非正教性故不可言從心出現。即知心者中	非 正 教 性 故 不 可 言 從 心 出 現 即 知 心 者 中 
T37n1748_003:0162b19	實無外者無餘。即教智也。	實 無 外 者 無 餘 即 教 智 也 
T37n1748_003:0162b20	經曰智慧如大海至猶如雪山者。述云此後	經 曰 智 慧 如 大 海 至 猶 如 雪 山 者 述 云 此 後 
T37n1748_003:0162b21	定慧對也。慧深廣如海定高勝如山故。慧用	定 慧 對 也 慧 深 廣 如 海 定 高 勝 如 山 故 慧 用 
T37n1748_003:0162b22	明淨超日月定能滿德如雪山故。	明 淨 超 日 月 定 能 滿 德 如 雪 山 故 
T37n1748_003:0162b23	經曰照諸功德等一淨故者。述云此後除障勝	經 曰 照 諸 功 德 等 一 淨 故 者 述 云 此 後 除 障 勝 
T37n1748_003:0162b24	有二。此初總標也。位法師云下有二十句皆	有 二 此 初 總 標 也 位 法 師 云 下 有 二 十 句 皆 
T37n1748_003:0162b25	辨慧能。然慧必不離定故說定慧離障者勝。	辨 慧 能 然 慧 必 不 離 定 故 說 定 慧 離 障 者 勝 
T37n1748_003:0162b26	無有一德而不離染故云等一淨。	無 有 一 德 而 不 離 染 故 云 等 一 淨 
T37n1748_003:0162b27	經曰猶如大地至無染污故者。述云此後別	經 曰 猶 如 大 地 至 無 染 污 故 者 述 云 此 後 別 
T37n1748_003:0162b28	釋有三對。初所因所起對。即異心是二障所	釋 有 三 對 初 所 因 所 起 對 即 異 心 是 二 障 所 
T37n1748_003:0162b29	因非理作意。垢染如次作意所起智惑障故。	因 非理作意 垢 染 如 次 作 意 所 起 智 惑 障 故 
T37n1748_003:0162c01	次能依所依對。即煩惱障礙如其次第惑智	次 能依所依 對 即 煩 惱 障 礙 如 其 次 第 惑 智 
T37n1748_003:0162c02	二障能所依故。後無著無染對。即於三有著	二 障 能 所 依 故 後 無 著 無 染 對 即 於 三 有 著 
T37n1748_003:0162c03	亦所智障。染污唯惑故。	亦 所 智 障 染 污 唯 惑 故 
T37n1748_003:0162c04	經曰猶如大乘至大慈等故者。述云第二化德	經 曰 猶 如 大 乘 至 大 慈 等 故 者 述 云 第 二 化 德 
T37n1748_003:0162c05	成有十三句略作六對。一出凡入聖對即初三	成 有 十 三 句 略 作 六 對 一 出 凡 入 聖 對 即 初 三 
T37n1748_003:0162c06	也。乘者車也。群萌者凡夫二乘。運凡小而出	也 乘 者 車 也 群 萌 者 凡 夫 二 乘 運 凡 小 而 出 
T37n1748_003:0162c07	二死。聞權實而潤善芽故。二却邪就善對即	二 死 聞 權 實 而 潤 善 芽 故 二 却 邪 就 善 對 即 
T37n1748_003:0162c08	次二句也。三普覆希見對即次二句也。四摧邪	次 二 句 也 三 普 覆 希 見 對 即 次 二 句 也 四 摧 邪 
T37n1748_003:0162c09	歸正對即次二句。無所藏積即聖種故。五無	歸 正 對 即 次 二 句 無所藏積 即 聖 種 故 五 無 
T37n1748_003:0162c10	勝無染對即次二句。無善能勝調諸染故。六	勝 無 染 對 即 次 二 句 無 善 能 勝 調 諸 染 故 六 
T37n1748_003:0162c11	無畏有憐對即後二句。無邪可畏憐無樂故。	無 畏 有 憐 對 即 後 二 句 無 邪 可 畏 憐 無 樂 故 
T37n1748_003:0162c12	經曰摧滅嫉心至修六和敬者。述云此第五行	經 曰 摧滅嫉心 至 修 六 和 敬 者 述 云 此 第 五 行 
T37n1748_003:0162c13	修增進有二。初自分行修後勝進修行。初又	修 增 進 有 二 初 自 分 行 修 後 勝 進 修 行 初 又 
T37n1748_003:0162c14	有二。初行修方便摧滅嫉心即利他方便。若	有 二 初 行 修 方 便 摧滅嫉心 即 利 他 方 便 若 
T37n1748_003:0162c15	有嫉忌不能利物故。求法無足即自利方便。	有 嫉 忌 不 能 利 物 故 求 法 無 足 即 自 利 方 便 
T37n1748_003:0162c16	有厭足者必不進修故。後勤修正行即常正	有 厭 足 者 必 不 進 修 故 後 勤修正行 即 常 正 
T37n1748_003:0162c17	行。常欲廣說等利他行。修心無疲惓故欲廣	行 常 欲 廣 說 等 利 他 行 修 心 無 疲 惓 故 欲 廣 
T37n1748_003:0162c18	說。說心勝也。擊法鼓等即所說勝也。曜慧日	說 說 心 勝 也 擊 法 鼓 等 即 所 說 勝 也 曜 慧 日 
T37n1748_003:0162c19	等所利勝。照三慧日以除愚癡故。修六和敬	等 所 利 勝 照 三 慧 日 以 除 愚 癡 故 修 六 和 敬 
T37n1748_003:0162c20	者即自利行。修三業見戒利皆同故便相親	者 即 自 利 行 修 三 業 見 戒 利 皆 同 故 便 相 親 
T37n1748_003:0162c21	敬情無乖異故云六和敬。	敬 情 無 乖 異 故 云 六 和 敬 
T37n1748_003:0162c22	經曰常行法施至遊諸神通者。述云第二勝進	經 曰 常 行 法 施 至 遊諸神通 者 述 云 第 二 勝 進 
T37n1748_003:0162c23	行修有三階。初勝進始即常行法施利他始	行 修 有 三 階 初 勝 進 始 即 常 行 法 施 利 他 始 
T37n1748_003:0162c24	志勇不弱自利始故。次勝進中為燈明福田	志 勇 不 弱 自 利 始 故 次 勝 進 中 為 燈 明 福 田 
T37n1748_003:0162c25	等利他中也。能生物解故云世燈明。亦生人	等 利 他 中 也 能 生 物 解 故 云 世 燈 明 亦 生 人 
T37n1748_003:0162c26	善故云勝福田。以慧開化故云導師。福利無	善 故 云 勝 福 田 以 慧 開 化 故 云 導 師 福 利 無 
T37n1748_003:0162c27	差故無增愛。樂道無欣慼即自利中修善故	差 故 無 增 愛 樂 道 無 欣 慼 即 自 利 中 修 善 故 
T37n1748_003:0162c28	云樂道。除過故無餘。後勝進修成。即拔欲刺	云 樂 道 除 過 故 無 餘 後 勝 進 修 成 即 拔 欲 刺 
T37n1748_003:0162c29	等利他行成。化令離過故以安群生。導之從	等 利 他 行 成 化 令 離 過 故 以 安 群 生 導 之 從 
T37n1748_003:0163a01	善故德勝尊敬。滅三垢等即自行成。滅貪瞋	善 故 德 勝 尊 敬 滅 三 垢 等 即 自 行 成 滅 貪 瞋 
T37n1748_003:0163a02	等故斷行成。遊戲神通故行德成也。有說三	等 故 斷 行 成 遊戲神通 故 行 德 成 也 有 說 三 
T37n1748_003:0163a03	垢即煩惱業苦非也。業苦未必垢故。	垢 即 煩 惱 業 苦 非 也 業 苦 未 必 垢 故 
T37n1748_003:0163a04	經曰因力緣力至諸通明力者。述云此第六	經 曰 因 力 緣 力 至 諸 通 明 力 者 述 云 此 第 六 
T37n1748_003:0163a05	諸力備足有三。此初自力備有七雙。一因緣	諸 力 備 足 有 三 此 初 自 力 備 有 七 雙 一 因 緣 
T37n1748_003:0163a06	雙即因力緣力。宿世善根名因力親近善友而	雙 即 因 力 緣 力 宿 世 善 根 名 因 力 親近善友 而 
T37n1748_003:0163a07	聞法名緣力故。二意願雙即意力願力。有說	聞 法 名 緣 力 故 二 意 願 雙 即 意 力 願 力 有 說 
T37n1748_003:0163a08	求佛之心名意力起行之願名願力。有說發	求 佛 之 心 名 意 力 起 行 之 願 名 願 力 有 說 發 
T37n1748_003:0163a09	菩提心名意力希求佛果名願力。二俱不然。	菩 提 心 名 意 力 希 求 佛 果 名 願 力 二 俱 不 然 
T37n1748_003:0163a10	求願起行言別義一故發菩提心即希佛果	求 願 起 行 言 別 義 一 故 發菩提心 即 希 佛 果 
T37n1748_003:0163a11	故。如其次第。今即如理作意名意力求菩提	故 如 其 次 第 今 即 如理作意 名 意 力 求 菩 提 
T37n1748_003:0163a12	心名為願力。三總別雙即方便力者總也。常	心 名 為 願 力 三 總 別 雙 即 方 便 力 者 總 也 常 
T37n1748_003:0163a13	力善力者別也。無間脩故常力。惡法不間故	力 善 力 者 別 也 無 間 脩 故 常 力 惡 法 不 間 故 
T37n1748_003:0163a14	善力。即此二力加行善巧故云方便力。四止	善 力 即 此 二 力 加 行 善 巧 故 云 方 便 力 四 止 
T37n1748_003:0163a15	觀雙所止行成故名定力觀行成故云慧力。	觀 雙 所 止 行 成 故 名 定 力 觀 行 成 故 云 慧 力 
T37n1748_003:0163a16	五聞行雙即多聞力是脩行之解施等六度是	五 聞 行 雙 即 多 聞 力 是 脩 行 之 解 施 等 六 度 是 
T37n1748_003:0163a17	所修行故。六念定雙即遣相之念是正念力	所 修 行 故 六 念 定 雙 即 遣 相 之 念 是 正 念 力 
T37n1748_003:0163a18	除亂證實是正觀力故。或有本云正定止觀	除 亂 證 實 是 正 觀 力 故 或 有 本 云 正 定 止 觀 
T37n1748_003:0163a19	故。位法師解止是定觀是慧正觀應是。七通	故 位 法 師 解 止 是 定 觀 是 慧 正 觀 應 是 七 通 
T37n1748_003:0163a20	明雙即通力者六通明力者三明故。	明 雙 即 通 力 者 六 通 明 力 者 三 明 故 
T37n1748_003:0163a21	經曰如法調伏諸眾生力者。述云次化行成	經 曰 如 法 調 伏 諸 眾 生 力 者 述 云 次 化 行 成 
T37n1748_003:0163a22	也。	也 
T37n1748_003:0163a23	經曰如是等力一切具足者。述云此後總結	經 曰 如 是 等 力 一切具足 者 述 云 此 後 總 結 
T37n1748_003:0163a24	也。	也 
T37n1748_003:0163a25	經曰身色相好至無量諸佛者。述云此第七	經 曰 身 色 相 好 至 無 量 諸 佛 者 述 云 此 第 七 
T37n1748_003:0163a26	諸德殊勝有四。此初自德殊勝也。	諸 德 殊 勝 有 四 此 初 自 德 殊 勝 也 
T37n1748_003:0163a27	經曰常為諸佛所共稱嘆者述曰此第二行順	經 曰 常 為 諸 佛 所 共 稱 嘆 者 述 曰 此 第 二 行 順 
T37n1748_003:0163a28	諸佛也。	諸 佛 也 
T37n1748_003:0163a29	經曰究竟菩薩至諸三昧門者。述云此第三	經 曰 究 竟 菩 薩 至 諸 三 昧 門 者 述 云 此 第 三 
T37n1748_003:0163b01	解行究滿。即六度為行三昧為解故。有說見	解 行 究 滿 即 六 度 為 行 三 昧 為 解 故 有 說 見 
T37n1748_003:0163b02	諸法生即知不滅見諸法滅即知不生故云不	諸 法 生 即 知 不 滅 見 諸 法 滅 即 知 不 生 故 云 不 
T37n1748_003:0163b03	生滅非也。既見法生必知滅故。生者歸滅一	生 滅 非 也 既 見 法 生 必 知 滅 故 生 者 歸 滅 一 
T37n1748_003:0163b04	向記故。今即我法空空故無相無相故無願。	向 記 故 今 即 我 法 空 空 故 無 相 無 相 故 無 願 
T37n1748_003:0163b05	由此不見有生滅也。	由 此 不 見 有 生 滅 也 
T37n1748_003:0163b06	經曰遠離聲聞緣覺之地者。述云此第四行	經 曰 遠 離 聲 聞 緣 覺 之 地 者 述 云 此 第 四 行 
T37n1748_003:0163b07	超二乘也。	超 二 乘 也 
T37n1748_003:0163b08	經曰阿難彼諸菩薩至不能窮盡者。述云此	經 曰 阿 難 彼 諸 菩 薩 至 不 能 窮 盡 者 述 云 此 
T37n1748_003:0163b09	第二結歎也。	第 二 結 歎 也 
T37n1748_003:0163b10	經曰佛告彌勒至不可稱說者。述云第二勸	經 曰 佛 告 彌 勒 至 不 可 稱 說 者 述 云 第 二 勸 
T37n1748_003:0163b11	人往生有二。初結人土勝後正勸往生。初又	人 往 生 有 二 初 結 人 土 勝 後 正 勸 往 生 初 又 
T37n1748_003:0163b12	有二。此初結人德勝也。	有 二 此 初 結 人 德 勝 也 
T37n1748_003:0163b13	經曰又其國土至清淨若此。述云此後結土	經 曰 又 其 國 土 至 清 淨 若 此 述 云 此 後 結 土 
T37n1748_003:0163b14	樂勝也。	樂 勝 也 
T37n1748_003:0163b15	經曰何不力為至昇道無窮極者。述云第二正	經 曰 何 不 力 為 至 昇 道 無 窮 極 者 述 云 第 二 正 
T37n1748_003:0163b16	勸往生有二。此初直勸往生也。何不力為善	勸 往 生 有 二 此 初 直 勸 往 生 也 何 不 力 為 善 
T37n1748_003:0163b17	者勸脩往生之因。力者盡力。人聖國妙詎不	者 勸 脩 往 生 之 因 力 者 盡 力 人 聖 國 妙 詎 不 
T37n1748_003:0163b18	盡力作善願生故。又力者力勵。道之自然者	盡 力 作 善 願 生 故 又 力 者 力 勵 道 之 自 然 者 
T37n1748_003:0163b19	脩所得之利。因善既成不自獲果故云念自	脩 所 得 之 利 因 善 既 成 不 自 獲 果 故 云 念 自 
T37n1748_003:0163b20	然。唯能念道行德著不簡貴賤皆得往生故	然 唯 能 念 道 行 德 著 不 簡 貴 賤 皆 得 往 生 故 
T37n1748_003:0163b21	云著於無上下。念字長讀流至此故。有說洞	云 著 於 無 上 下 念 字 長 讀 流 至 此 故 有 說 洞 
T37n1748_003:0163b22	達者洞解了達。無邊際者實相。非三際可尋	達 者 洞 解 了 達 無 邊 際 者 實 相 非 三 際 可 尋 
T37n1748_003:0163b23	故。實相既是淨土之本。往生者要須窮其原	故 實 相 既 是 淨 土 之 本 往 生 者 要 須 窮 其 原 
T37n1748_003:0163b24	故須解達非也。窮實相之原非凡夫所能。往	故 須 解 達 非 也 窮 實 相 之 原 非 凡 夫 所 能 往 
T37n1748_003:0163b25	生淨土唯應聖故。今即得生彼土神智洞達	生 淨 土 唯 應 聖 故 今 即 得 生 彼 土 神 智 洞 達 
T37n1748_003:0163b26	無有邊際故。去者棄棄穢土故。有說五惡道	無有邊際 故 去 者 棄 棄 穢 土 故 有 說 五 惡 道 
T37n1748_003:0163b27	者三途非天及以女人。女人是惡趣本故。又	者 三 途 非 天 及 以 女 人 女 人 是 惡 趣 本 故 又 
T37n1748_003:0163b28	下文五惡即名五道非也。無有處說名女人	下 文 五 惡 即 名 五 道 非 也 無 有 處 說 名 女 人 
T37n1748_003:0163b29	趣故。五惡是因不可言趣故。今即人天雖名	趣 故 五 惡 是 因 不 可 言 趣 故 今 即 人 天 雖 名 
T37n1748_003:0163c01	善趣對於淨土亦名惡道。云五惡道。在此穢	善 趣 對 於 淨 土 亦 名 惡 道 云 五 惡 道 在 此 穢 
T37n1748_003:0163c02	土先斷見惑離三途因果。後斷修惑絕人天	土 先 斷 見 惑 離 三 途 因 果 後 斷 修 惑 絕 人 天 
T37n1748_003:0163c03	因果。若生淨土五道頓捨故云橫截。截者其	因 果 若 生 淨 土 五 道 頓 捨 故 云 橫 截 截 者 其 
T37n1748_003:0163c04	果自閉其因。獲道深廣故無窮極。	果 自 閉 其 因 獲 道 深 廣 故 無 窮 極 
T37n1748_003:0163c05	經曰易往而無人至壽樂無窮極者。述云此後	經 曰 易 往 而 無 人 至 壽 樂 無 窮 極 者 述 云 此 後 
T37n1748_003:0163c06	傷嘆重也。修因即住故易往。無人修因往生	傷 嘆 重 也 修 因 即 住 故 易 往 無 人 修 因 往 生 
T37n1748_003:0163c07	者尠故無人。修因求生終不違逆故國不逆	者 尠 故 無 人 修 因 求 生 終 不 違 逆 故 國 不 逆 
T37n1748_003:0163c08	違即前易往也。久習纏蓋自然為之牽縛不	違 即 前 易 往 也 久 習 纏 蓋 自 然 為 之 牽 縛 不 
T37n1748_003:0163c09	往故自然所牽即前無人也。有說因滿果熟	往 故 自 然 所 牽 即 前 無 人 也 有 說 因 滿 果 熟 
T37n1748_003:0163c10	不假功用自然招致故自然所牽。義亦可也。	不假功用 自 然 招 致 故 自 然 所 牽 義 亦 可 也 
T37n1748_003:0163c11	道德者因壽樂者果。壽者受也。問修淨土及	道 德 者 因 壽 樂 者 果 壽 者 受 也 問 修 淨 土 及 
T37n1748_003:0163c12	兜率因何者為難。答有說兜率是界淨土非	兜 率 因 何 者 為 難 答 有 說 兜 率 是 界 淨 土 非 
T37n1748_003:0163c13	繫故。生淨土易於兜率非也。夫言界者是流	繫 故 生 淨 土 易 於 兜 率 非 也 夫 言 界 者 是 流 
T37n1748_003:0163c14	轉之處。西方淨土是出離之所故。難修流轉	轉 之 處 西方淨土 是 出 離 之 所 故 難 修 流 轉 
T37n1748_003:0163c15	業易行出離之因。必違正理故。有說古來諸	業 易 行 出 離 之 因 必 違 正 理 故 有 說 古 來 諸 
T37n1748_003:0163c16	德作兜率業者咸以西方難生故不敢作。今	德 作 兜 率 業 者 咸 以 西 方 難 生 故 不 敢 作 今 
T37n1748_003:0163c17	以七義證西方易生。一時但少修故即觀經	以 七 義 證 西 方 易 生 一 時 但 少 修 故 即 觀 經 
T37n1748_003:0163c18	云下三品臨命終時一念十念悉得生故。二	云 下 三 品 臨命終時 一 念 十 念 悉 得 生 故 二 
T37n1748_003:0163c19	諸佛護念故即稱讚經曰六方諸佛護念等是	諸 佛 護 念 故 即 稱 讚 經 曰 六 方 諸 佛 護 念 等 是 
T37n1748_003:0163c20	也。三光明攝受故即觀經云念佛眾生攝取	也 三 光 明 攝 受 故 即 觀 經 云 念 佛 眾 生 攝 取 
T37n1748_003:0163c21	不捨也。四乘佛本願故即此經云阿彌陀佛	不 捨 也 四 乘 佛 本 願 故 即 此 經 云 阿 彌 陀 佛 
T37n1748_003:0163c22	四十八願弘誓是也。五彼聖來迎故即上文	四 十 八 願 弘 誓 是 也 五 彼 聖 來 迎 故 即 上 文 
