T37n1748_001:0139c25	即眉間白毫之光遍大千界故復云大。使魔	即 眉間白毫 之 光 遍 大 千 界 故 復 云 大 使 魔 
T37n1748_001:0139c26	知者即夢所見不吉祥之相。來逼試者即將	知 者 即 夢 所 見 不 吉 祥 之 相 來 逼 試 者 即 將 
T37n1748_001:0139c27	諸兵眾欲近菩薩之時。魔者魔羅。此云弊惡	諸 兵 眾 欲 近 菩 薩 之 時 魔 者 魔 羅 此 云 弊 惡 
T37n1748_001:0139c28	亦名殺者。有說智力者即十力智令魔降伏。	亦 名 殺 者 有 說 智 力 者 即 十 力 智 令 魔 降 伏 
T37n1748_001:0139c29	若爾如何亦云降魔。是慈定力故。今即智者	若 爾 如 何 亦 云 降 魔 是 慈 定 力 故 今 即 智 者 
T37n1748_001:0140a01	菩薩之道。力者威神之力。欲壞自利即智能	菩薩之道 力 者 威 神 之 力 欲 壞 自 利 即 智 能 
T37n1748_001:0140a02	伏。若破利他即神力伏。隨善一種義即闕焉	伏 若 破 利 他 即 神 力 伏 隨 善 一 種 義 即 闕 焉 
T37n1748_001:0140a03	故兼之也。神力必由慈定發故云智力皆令	故 兼 之 也 神 力 必 由 慈 定 發 故 云 智 力 皆 令 
T37n1748_001:0140a04	降伏。即智論云由得菩薩道。餘經亦云由慈	降 伏 即 智 論 云 由 得 菩 薩 道 餘 經 亦 云 由 慈 
T37n1748_001:0140a05	三昧是也。	三 昧 是 也 
T37n1748_001:0140a06	經曰得微妙法成寂正覺者。述云此第五覺	經 曰 得 微 妙 法 成 寂 正 覺 者 述 云 此 第 五 覺 
T37n1748_001:0140a07	果斯成也。有說妙法是理。有說涅槃滅皆非	果 斯 成 也 有 說 妙 法 是 理 有 說 涅 槃 滅 皆 非 
T37n1748_001:0140a08	也。不可唯言得理得滅成正覺故。今即菩薩	也 不 可 唯 言 得 理 得 滅 成 正 覺 故 今 即 菩 薩 
T37n1748_001:0140a09	降伏魔怨建立法幢遊入四禪無有動搖。至	降伏魔怨 建 立 法 幢 遊 入 四 禪 無 有 動 搖 至 
T37n1748_001:0140a10	初夜分得智得明攝持一心發天眼通。於中	初 夜 分 得 智 得 明 攝 持 一 心 發 天 眼 通 於 中 
T37n1748_001:0140a11	夜分得宿命通皆憶自他過去之事。便觀一	夜 分 得 宿 命 通 皆 憶 自 他 過 去 之 事 便 觀 一 
T37n1748_001:0140a12	切眾生老死因生故有。乃至行亦因無明有。	切 眾 生 老 死 因 生 故 有 乃 至 行 亦 因 無 明 有 
T37n1748_001:0140a13	復更思惟因何滅故老死滅。即無明滅故行	復 更 思 惟 因 何 滅 故 老 死 滅 即 無 明 滅 故 行 
T37n1748_001:0140a14	滅。乃至生滅故老死滅。復更思惟此色無明。	滅 乃 至 生 滅 故 老 死 滅 復 更 思 惟 此 色 無 明 
T37n1748_001:0140a15	此無明因。此無明滅。此滅無明道。乃至老死	此 無 明 因 此 無 明 滅 此 滅 無 明 道 乃 至 老 死 
T37n1748_001:0140a16	憂悲苦惱皆亦如是。於後夜分明星出時調	憂 悲 苦 惱 皆 亦 如 是 於 後 夜 分 明 星 出 時 調 
T37n1748_001:0140a17	御聖智所應知所應悟所應見所應證。彼一	御 聖 智 所 應 知 所 應 悟 所 應 見 所 應 證 彼 一 
T37n1748_001:0140a18	切一念相應慧證無上覺。備足三明為諸天	切 一 念 相 應 慧 證 無 上 覺 備 足 三 明 為 諸 天 
T37n1748_001:0140a19	子現成佛瑞。上昇虛空高七多羅。以頌而言	子 現 成 佛 瑞 上 昇 虛 空 高 七 多 羅 以 頌 而 言 
T37n1748_001:0140a20	煩惱悉已斷諸漏皆空渴更不復受生是名盡	煩 惱 悉 已 斷 諸 漏 皆 空 渴 更 不 復 受 生 是 名 盡 
T37n1748_001:0140a21	苦際。諸天生喜天華散佛積至于膝故。微妙	苦 際 諸 天 生 喜 天 華 散 佛 積 至 于 膝 故 微 妙 
T37n1748_001:0140a22	法者即攝所證果德悉盡之言。即瑜伽論云	法 者 即 攝 所 證 果 德 悉 盡 之 言 即 瑜 伽 論 云 
T37n1748_001:0140a23	復於後時坐菩提座棄捨一切非方便攝勇猛	復 於 後 時 坐菩提座 棄 捨 一 切 非 方 便 攝 勇 猛 
T37n1748_001:0140a24	精進所有善法遂得增長。於所修斷轉求勝	精 進 所 有 善 法 遂 得 增 長 於 所 修 斷 轉 求 勝 
T37n1748_001:0140a25	妙遂不更求餘外道師。無師自然修三十七	妙 遂 不 更 求 餘 外 道 師 無師自然 修 三 十 七 
T37n1748_001:0140a26	菩提分法證得無上正等菩提名大覺者是	菩提分法 證 得 無上正等菩提 名 大 覺 者 是 
T37n1748_001:0140a27	也。	也 
T37n1748_001:0140a28	經曰釋梵祈勸請轉法輪者。述云第八法化普	經 曰 釋 梵 祈 勸 請 轉 法 輪 者 述 云 第 八 法 化 普 
T37n1748_001:0140a29	洽有二。初加威祈請後因請起說。此初也。初	洽 有 二 初 加 威 祈 請 後 因 請 起 說 此 初 也 初 
T37n1748_001:0140b01	成正覺。諸天嘆已住喜悅定。觀菩提樹目不	成 正 覺 諸 天 嘆 已 住 喜 悅 定 觀 菩 提 樹 目 不 
T37n1748_001:0140b02	暫捨。禪悅為食不起于座。經於七日為居此	暫 捨 禪 悅 為 食 不 起 于 座 經 於 七 日 為 居 此 
T37n1748_001:0140b03	處除諸苦故。第二七日周匝經行大千為限。	處 除 諸 苦 故 第 二 七 日 周 匝 經 行 大 千 為 限 
T37n1748_001:0140b04	第三七日觀菩提場。亦為居此得大覺故。第	第 三 七 日 觀 菩 提 場 亦 為 居 此 得 大 覺 故 第 
T37n1748_001:0140b05	四七日隨近經行大海為邊。時魔王請曠劫	四 七 日 隨 近 經 行 大 海 為 邊 時 魔 王 請 曠 劫 
T37n1748_001:0140b06	苦行方得成佛。唯願善逝入於涅槃。佛報波	苦 行 方 得 成 佛 唯 願 善 逝 入 於 涅 槃 佛 報 波 
T37n1748_001:0140b07	旬求大菩提欲利眾生。而我法中未獲義利	旬 求大菩提 欲 利 眾 生 而 我 法 中 未 獲 義 利 
T37n1748_001:0140b08	三寶未備未說妙法云何涅槃。波旬聞已心	三 寶 未 備 未 說 妙 法 云 何 涅 槃 波 旬 聞 已 心 
T37n1748_001:0140b09	生憂惱。時彼三女見父愁苦更變其形。一為	生 憂 惱 時 彼 三 女 見 父 愁 苦 更 變 其 形 一 為 
T37n1748_001:0140b10	少婦之形一為中婦之形來至佛所。以神通	少 婦 之 形 一 為 中 婦 之 形 來 至 佛 所 以 神 通 
T37n1748_001:0140b11	力皆成老母。還至父所言我復為變化惑亂	力 皆 成 老 母 還 至 父 所 言 我 復 為 變 化 惑 亂 
T37n1748_001:0140b12	彼沙門。仍以大神通化我為老母。願王以威	彼 沙 門 仍 以 大 神 通 化 我 為 老 母 願 王 以 威 
T37n1748_001:0140b13	力令得如本形。魔報諸女汝可自往懺悔前	力 令 得 如 本 形 魔 報 諸 女 汝 可 自 往 懺 悔 前 
T37n1748_001:0140b14	罪。彼攝神力方得復本。諸女至佛言我今極	罪 彼 攝 神 力 方 得 復 本 諸 女 至 佛 言 我 今 極 
T37n1748_001:0140b15	生悔冀得罪銷滅。唯願慈悲力令復於本形。	生 悔 冀 得 罪 銷 滅 唯 願 慈 悲 力 令 復 於 本 形 
T37n1748_001:0140b16	佛以慈悲故攝神通令復如本。第五七日住	佛 以 慈 悲 故 攝 神 通 令 復 如 本 第 五 七 日 住 
T37n1748_001:0140b17	目真隣陀龍王所居龍神守護。第六七日往	目 真 隣 陀 龍 王 所 居 龍 神 守 護 第 六 七 日 往 
T37n1748_001:0140b18	尼俱陀樹下近尼連河。有多外道皆來慰問。	尼 俱 陀 樹 下 近 尼 連 河 有 多 外 道 皆 來 慰 問 
T37n1748_001:0140b19	第七七日至多演林中觀諸眾生為生老病死	第 七 七 日 至 多 演 林 中 觀 諸 眾 生 為 生老病死 
T37n1748_001:0140b20	所逼迫。時北天竺兄弟二人。為眾商之主。一	所 逼 迫 時 北 天 竺 兄 弟 二 人 為 眾 商 之 主 一 
T37n1748_001:0140b21	名帝履富婆一名婆履。以五百乘車載其珍	名 帝 履 富 婆 一 名 婆 履 以 五 百 乘 車 載 其 珍 
T37n1748_001:0140b22	寶還歸本國。有二調牛。一名善生二號名稱。	寶 還 歸 本 國 有 二 調 牛 一 名 善 生 二 號 名 稱 
T37n1748_001:0140b23	巧識前路止不能進。心懷恐懼。林神忽語勿	巧 識 前 路 止 不 能 進 心 懷 恐 懼 林 神 忽 語 勿 
T37n1748_001:0140b24	懷恐汝得大利。有佛出世初成正覺住此林	懷 恐 汝 得 大 利 有 佛 出 世 初 成 正 覺 住 此 林 
T37n1748_001:0140b25	中。不食已來四十九日。汝等應將種種飲食	中 不 食 已 來 四 十 九 日 汝 等 應 將 種 種 飲 食 
T37n1748_001:0140b26	而以上之。時二調牛便向佛行。故諸商人隨	而 以 上 之 時 二 調 牛 便 向 佛 行 故 諸 商 人 隨 
T37n1748_001:0140b27	調牛而往。遙覩如來相好光如日出。生希有	調 牛 而 往 遙 覩 如 來 相 好 光 如 日 出 生 希 有 
T37n1748_001:0140b28	心以為天神。佛舉袈裟即知如來。辨諸美味	心 以 為 天 神 佛 舉 袈 裟 即 知 如 來 辨 諸 美 味 
T37n1748_001:0140b29	蘇蜜甘蔗乳糜豆屬乃時奉施。右遶三匝却	蘇 蜜 甘 蔗 乳 糜 豆 屬 乃 時 奉 施 右 遶 三 匝 却 
T37n1748_001:0140c01	住一面白佛。哀愍受我微供。佛作是思。以何	住 一 面 白 佛 哀 愍 受 我 微 供 佛 作 是 思 以 何 
T37n1748_001:0140c02	器受。時四天王各上金鉢。佛言出家不合汝	器 受 時 四 天 王 各 上 金 鉢 佛 言 出 家 不 合 汝 
T37n1748_001:0140c03	鉢。北方天王語餘天言昔青身天將白石鉢	鉢 北 方 天 王 語 餘 天 言 昔 青 身 天 將 白 石 鉢 
T37n1748_001:0140c04	來與我等欲施石鉢。今正是時。各還自宮持	來 與 我 等 欲 施 石 鉢 今正是時 各 還 自 宮 持 
T37n1748_001:0140c05	彼石鉢以上如來。佛各受四天王之鉢次第	彼 石 鉢 以 上 如 來 佛 各 受 四 天 王 之 鉢 次 第 
T37n1748_001:0140c06	相重安置右手按之合成一器四際分明。時	相 重 安 置 右 手 按 之 合 成 一 器 四 際 分 明 時 
T37n1748_001:0140c07	商眾於晨朝時牧人揲乳。凡所揲者化為醍	商 眾 於 晨 朝 時 牧 人 揲 乳 凡 所 揲 者 化 為 醍 
T37n1748_001:0140c08	醐。心生希有選上粳米煮以為糜。和好合密	醐 心 生 希 有 選 上 粳 米 煮 以 為 糜 和 好 合 密 
T37n1748_001:0140c09	盛栴檀鉢以上如來。如來受已鉢擲空中。梵	盛 栴 檀 鉢 以 上 如 來 如 來 受 已 鉢 擲 空 中 梵 
T37n1748_001:0140c10	王接還自宮起塔供養。佛自呪願而授記莂。	王 接 還 自 宮 起 塔 供 養 佛 自 呪 願 而 授 記 莂 
T37n1748_001:0140c11	入深禪定觀諸世間便作思惟。所證之法非	入 深 禪 定 觀 諸 世 間 便 作 思 惟 所 證 之 法 非 
T37n1748_001:0140c12	心言境恐無利應。默然住而說偈言我得甘	心 言 境 恐 無 利 應 默 然 住 而 說 偈 言 我 得 甘 
T37n1748_001:0140c13	露無為法。甚深寂靜離塵垢。梵王若來勸請	露 無 為 法 甚 深 寂 靜 離 塵 垢 梵 王 若 來 勸 請 
T37n1748_001:0140c14	我。或當為轉微妙法。螺髻梵王以佛威神即	我 或 當 為 轉 微 妙 法 螺 髻 梵 王 以 佛 威 神 即 
T37n1748_001:0140c15	知如來默然之旨。與六十八拘胝梵眾來白	知 如 來 默 然 之 旨 與 六 十 八 拘 胝 梵 眾 來 白 
T37n1748_001:0140c16	佛言。世尊多有眾生堪能悟入甚深之法。唯	佛 言 世 尊 多 有 眾 生 堪 能 悟 入 甚 深 之 法 唯 
T37n1748_001:0140c17	願說之。而佛默然。梵王亦知默然之旨。即與	願 說 之 而 佛 默 然 梵 王 亦 知 默 然 之 旨 即 與 
T37n1748_001:0140c18	釋天乃至阿迦尼吒天於夜分中至多演林禮	釋 天 乃 至 阿 迦 尼 吒 天 於 夜 分 中 至 多 演 林 禮 
T37n1748_001:0140c19	已右遶。釋天白佛請轉法輪。佛猶默然。大梵	已 右 遶 釋 天 白 佛 請 轉 法 輪 佛 猶 默 然 大 梵 
T37n1748_001:0140c20	重請佛說二偈。我證逆流道甚深難可見。盲	重 請 佛 說 二 偈 我 證 逆 流 道 甚 深 難 可 見 盲 
T37n1748_001:0140c21	者莫能覩故默而不說。世間諸眾生著彼五	者 莫 能 覩 故 默 而 不 說 世 間 諸 眾 生 著 彼 五 
T37n1748_001:0140c22	塵境不能解我法。是故今默然。梵釋諸天聞	塵 境 不 能 解 我 法 是 故 今 默 然 梵 釋 諸 天 聞 
T37n1748_001:0140c23	已憂惱忽然不現。復於一時大梵天王歎摩	已 憂 惱 忽 然 不 現 復 於 一 時 大 梵 天 王 歎 摩 
T37n1748_001:0140c24	伽陀國諸外道等封著邪見詣佛偈請。摩伽	伽 陀 國 諸 外 道 等 封 著 邪 見 詣 佛 偈 請 摩 伽 
T37n1748_001:0140c25	陀國多諸異道。因邪見故種種籌量。唯願牟	陀 國 多 諸 異 道 因 邪 見 故 種 種 籌 量 唯 願 牟 
T37n1748_001:0140c26	尼為開甘露最清淨法令其得聞。世尊以佛	尼 為 開 甘 露 最 清 淨 法 令 其 得 聞 世 尊 以 佛 
T37n1748_001:0140c27	眼觀諸眾生上中下根及以三聚告梵王言。	眼 觀 諸 眾 生 上 中 下 根 及 以 三 聚 告 梵 王 言 
T37n1748_001:0140c28	我今為汝請當雨於甘露。一切諸世間天人	我 今 為 汝 請 當 雨 於 甘 露 一 切 諸 世 間 天 人 
T37n1748_001:0140c29	龍神等若有淨信者聽受如是法。梵王聞已	龍 神 等 若 有 淨 信 者 聽 受 如 是 法 梵 王 聞 已 
T37n1748_001:0141a01	喜歎不現。神唱言如來今受梵王勸請。於一	喜 歎 不 現 神 唱 言 如 來 今 受 梵 王 勸 請 於 一 
T37n1748_001:0141a02	念頃虛空神聞展轉傳至阿迦吒天。而今言	念 頃 虛 空 神 聞 展 轉 傳 至 阿 迦 吒 天 而 今 言 
T37n1748_001:0141a03	梵釋祈請者略舉。不盡之言也。祈巨衣反作	梵 釋 祈 請 者 略 舉 不 盡 之 言 也 祈 巨 衣 反 作 
T37n1748_001:0141a04	蘄求福也。轉者即通自他轉。自即如來三道	蘄 求 福 也 轉 者 即 通 自 他 轉 自 即 如 來 三 道 
T37n1748_001:0141a05	轉滿。他即轉所得法。至他相續法。轉者即不	轉 滿 他 即 轉 所 得 法 至 他 相 續 法 轉 者 即 不 
T37n1748_001:0141a06	定義。以移轉故。佛雖既自轉而未有他轉故	定 義 以 移 轉 故 佛 雖 既 自 轉 而 未 有 他 轉 故 
T37n1748_001:0141a07	次請轉。	次 請 轉 
T37n1748_001:0141a08	經曰以佛遊步佛吼而吼者。述云第二因請起	經 曰 以 佛 遊 步 佛 吼 而 吼 者 述 云 第 二 因 請 起 
T37n1748_001:0141a09	說有二。初身口略化後身口廣利。初又有三。	說 有 二 初 身 口 略 化 後 身 口 廣 利 初 又 有 三 
T37n1748_001:0141a10	初文請警物也。佛遊者即身業化。現佛威儀	初 文 請 警 物 也 佛 遊 者 即 身 業 化 現 佛 威 儀 
T37n1748_001:0141a11	遊化物故。如來所作已辦無德不備。五眼清	遊 化 物 故 如來所作 已 辦 無 德 不 備 五 眼 清 
T37n1748_001:0141a12	淨觀諸世間堪受法者。即念羅摩子三垢微	淨 觀 諸 世 間 堪 受 法 者 即 念 羅 摩 子 三 垢 微 
T37n1748_001:0141a13	薄聞法得證。以佛眼觀命終七日。有天亦曰	薄 聞 法 得 證 以 佛 眼 觀 命 終 七 日 有 天 亦 曰 
T37n1748_001:0141a14	死經七日。後觀外道阿羅邏仙死經三日。空	死 經 七 日 後 觀 外 道 阿 羅 邏 仙 死 經 三 日 空 
T37n1748_001:0141a15	中天言死亦三日。後作是念五跋陀羅根性	中 天 言 死 亦 三 日 後 作 是 念 五 跋 陀 羅 根 性 
T37n1748_001:0141a16	已熟若聞開悟。以佛眼觀。在鹿野苑中從菩	已 熟 若 聞 開 悟 以 佛 眼 觀 在 鹿 野 苑 中 從 菩 
T37n1748_001:0141a17	提樹向迦毘羅國波羅奈城振動大千。伽耶	提 樹 向 迦 毘 羅 國 波 羅 奈 城 振 動 大 千 伽 耶 
T37n1748_001:0141a18	城傍有一外道名阿字婆。問佛所師及以所	城 傍 有 一 外 道 名 阿 字 婆 問 佛 所 師 及 以 所 
T37n1748_001:0141a19	往。如來備答。即北遊經伽耶城。城中有龍名	往 如 來 備 答 即 北 遊 經 伽 耶 城 城 中 有 龍 名 
T37n1748_001:0141a20	曰善見。明日設齋。如來受訖往盧醯多婆蘇	曰 善 見 明 日 設 齋 如 來 受 訖 往 盧 醯 多 婆 蘇 
T37n1748_001:0141a21	都村。次至多羅聚落次經婆羅村。如是遊歷	都 村 次 至 多 羅 聚 落 次 經 婆 羅 村 如 是 遊 歷 
T37n1748_001:0141a22	皆受長者居士飲食。次第而行至恒河邊。河	皆 受 長 者 居 士 飲 食 次 第 而 行 至 恒 河 邊 河 
T37n1748_001:0141a23	水瀑集平流彌岸。飛騰虛空達于彼岸至波	水 瀑 集 平 流 彌 岸 飛 騰 虛 空 達 于 彼 岸 至 波 
T37n1748_001:0141a24	羅奈城。於晨朝時著衣持鉢入城乞食請鹿	羅 奈 城 於 晨 朝 時 著衣持鉢 入 城 乞 食 請 鹿 
T37n1748_001:0141a25	園中。五跋陀羅遙見世尊共相謂言不須承	園 中 五 跋 陀 羅 遙 見 世 尊 共 相 謂 言 不 須 承 
T37n1748_001:0141a26	事。唯憍陳如不同眾心。佛近五人皆違本要	事 唯 憍 陳 如 不 同 眾 心 佛 近 五 人 皆 違 本 要 
T37n1748_001:0141a27	無不起迎。皆言善來長老請坐。世尊坐已語	無 不 起 迎 皆 言 善 來 長 老 請 坐 世 尊 坐 已 語 
T37n1748_001:0141a28	五人言我備種智不得稱呼為長老也。五跋	五 人 言 我 備 種 智 不 得 稱 呼 為 長 老 也 五 跋 
T37n1748_001:0141a29	陀羅請為沙門。佛言善來便成沙門。鬚髮長	陀 羅 請 為 沙 門 佛 言 善 來 便 成 沙 門 鬚 髮 長 
T37n1748_001:0141b01	短如剃。經七日威儀整肅如百臈比丘。世尊	短 如 剃 經 七 日 威 儀 整 肅 如 百 臈 比 丘 世 尊 
T37n1748_001:0141b02	入池澡浴已訖思過去佛坐於何座而轉法	入 池 澡 浴 已 訖 思 過 去 佛 坐 於 何 座 而 轉 法 
T37n1748_001:0141b03	輪。忽有千寶座從池涌出。即起恭遶初三高	輪 忽 有 千 寶 座 從 池 涌 出 即 起 恭 遶 初 三 高 
T37n1748_001:0141b04	座。至第四座結跏趺座。時五跋陀羅坐於佛	座 至 第 四 座 結 跏 趺 座 時 五 跋 陀 羅 坐 於 佛 
T37n1748_001:0141b05	前。佛放大光照大千界召人天眾。地神神力	前 佛 放 大 光 照 大 千 界 召 人 天 眾 地 神 神 力 
T37n1748_001:0141b06	令此道場縱廣正等七百由旬。欲色諸天將	令 此 道 場 縱 廣 正 等 七 百 由 旬 欲 色 諸 天 將 
T37n1748_001:0141b07	八萬四千寶師子座置道場中各請。世尊哀	八萬四千 寶 師 子 座 置 道 場 中 各 請 世 尊 哀 
T37n1748_001:0141b08	坐我座轉正法輪。十方無量拘胝菩薩十方	坐 我 座 轉正法輪 十 方 無 量 拘 胝 菩 薩 十 方 
T37n1748_001:0141b09	三千世界釋梵護世諸天皆至佛所請轉法	三千世界 釋 梵 護 世 諸 天 皆 至 佛 所 請 轉 法 
T37n1748_001:0141b10	輪。愍眾生故雨大法雨建大法幢吹大法螺	輪 愍 眾 生 故 雨大法雨 建 大 法 幢 吹大法螺 
T37n1748_001:0141b11	擊大法鼓。時有菩薩名曰轉法。持眾寶輪備	擊大法鼓 時 有 菩 薩 名 曰 轉 法 持 眾 寶 輪 備 
T37n1748_001:0141b12	有千輪莊嚴綺麗。放千光明過去諸佛皆有	有 千 輪 莊 嚴 綺 麗 放 千 光 明 過去諸佛 皆 有 
T37n1748_001:0141b13	此輪。然後轉法奉上如來。如來於初夜默然	此 輪 然 後 轉 法 奉 上 如 來 如 來 於 初 夜 默 然 
T37n1748_001:0141b14	而過。於中夜分安慰大眾喚五跋陀羅言出	而 過 於 中 夜 分 安 慰 大 眾 喚 五 跋 陀 羅 言 出 
T37n1748_001:0141b15	家之人有二種障。一心著欲境而不能離。二	家 之 人 有 二 種 障 一 心 著 欲 境 而 不 能 離 二 
T37n1748_001:0141b16	不正思惟自苦其身。而求出離當捨此二邊。	不正思惟 自 苦 其 身 而 求 出 離 當 捨 此 二 邊 
T37n1748_001:0141b17	今聖教是佛吼故云佛吼。吼即違彼經先稱	今 聖 教 是 佛 吼 故 云 佛 吼 吼 即 違 彼 經 先 稱 
T37n1748_001:0141b18	德號略說中道故。今即略申二障。總說中道	德 號 略 說 中 道 故 今 即 略 申 二 障 總 說 中 道 
T37n1748_001:0141b19	故云佛吼。吼亦轉也。	故 云 佛 吼 吼 亦 轉 也 
T37n1748_001:0141b20	經曰扣法鼓至演法施者。述云此別申法化	經 曰 扣 法 鼓 至 演 法 施 者 述 云 此 別 申 法 化 
T37n1748_001:0141b21	也。有說欲使有緣普得聞故扣法鼓。法鼓者	也 有 說 欲 使 有 緣 普 得 聞 故 扣 法 鼓 法 鼓 者 
T37n1748_001:0141b22	令遠聞故。吹法螺即欲改號令。改邪從正也。	令 遠 聞 故 吹 法 螺 即 欲 改 號 令 改 邪 從 正 也 
T37n1748_001:0141b23	欲斷障故執法劍。表勝出故建法幢。欲動執	欲 斷 障 故 執 法 劍 表 勝 出 故 建 法 幢 欲 動 執 
T37n1748_001:0141b24	故振法雷。欲亡暗故曜法電。欲潤眾生故澍	故 振 法 雷 欲 亡 暗 故 曜 法 電 欲 潤 眾 生 故 澍 
T37n1748_001:0141b25	法雨。欲布藥故演法施。此有虛言皆無可採。	法 雨 欲 布 藥 故 演 法 施 此 有 虛 言 皆 無 可 採 
T37n1748_001:0141b26	違世親論亦違正理故。有說扣法鼓者說聞	違 世 親 論 亦 違 正 理 故 有 說 扣 法 鼓 者 說 聞 
T37n1748_001:0141b27	慧法。吹法螺者說思慧法。執法劍者說修慧	慧 法 吹 法 螺 者 說 思 慧 法 執 法 劍 者 說 修 慧 
T37n1748_001:0141b28	法。建法幢者宣證慧法。振法雷者法無礙化。	法 建 法 幢 者 宣 證 慧 法 振 法 雷 者 法 無 礙 化 
T37n1748_001:0141b29	曜法電者義無礙利。澍法雨者詞無礙說。演	曜 法 電 者 義 無 礙 利 澍 法 雨 者 詞 無 礙 說 演 
T37n1748_001:0141c01	法施者樂說無礙利眾生也。此亦不然。三慧	法 施 者 樂 說 無 礙 利 眾 生 也 此 亦 不 然 三 慧 
T37n1748_001:0141c02	皆覺證慧法故。三慧所學亦無異故。四辨所	皆 覺 證 慧 法 故 三 慧 所 學 亦 無 異 故 四 辨 所 
T37n1748_001:0141c03	說亦即三慧法故。今即如來說中道已。為陳	說 亦 即 三 慧 法 故 今 即 如 來 說 中 道 已 為 陳 
T37n1748_001:0141c04	如等說四諦法及十二緣流轉還滅二門修	如 等 說 四 諦 法 及 十 二 緣 流 轉 還 滅 二 門 修 
T37n1748_001:0141c05	行。三轉十二行法輪已。陳如皆達諸法因緣	行 三 轉 十 二 行 法 輪 已 陳 如 皆 達 諸 法 因 緣 
T37n1748_001:0141c06	成阿羅漢。即三寶出。婆伽婆為佛三轉十二	成 阿 羅 漢 即 三 寶 出 婆 伽 婆 為 佛 三 轉 十 二 
T37n1748_001:0141c07	行法輪為法五跋陀羅為僧。轉法輪聲遍十	行 法 輪 為 法 五 跋 陀 羅 為 僧 轉 法 輪 聲 遍 十 
T37n1748_001:0141c08	方佛土。土別諸佛默不說法。化五人竟至優	方 佛 土 土 別 諸 佛 默 不 說 法 化 五 人 竟 至 優 
T37n1748_001:0141c09	樓頻螺迦葉所。寄止石室降伏毒龍。迦葉見	樓 頻 螺 迦 葉 所 寄 止 石 室 降 伏 毒 龍 迦 葉 見 
T37n1748_001:0141c10	佛神力難當。與五百資請為沙門。佛言善來	佛 神 力 難 當 與 五 百 資 請 為 沙 門 佛 言 善 來 
T37n1748_001:0141c11	皆成沙門。迦葉二弟難提伽耶各有二百五	皆 成 沙 門 迦 葉 二 弟 難 提 伽 耶 各 有 二 百 五 
T37n1748_001:0141c12	十弟子。見事火物遂水下流。即與五百人泝	十 弟 子 見 事 火 物 遂 水 下 流 即 與 五 百 人 泝 
T37n1748_001:0141c13	流而上。聞迦葉歎佛道神化求為沙門。佛言	流 而 上 聞 迦 葉 歎 佛 道 神 化 求 為 沙 門 佛 言 
T37n1748_001:0141c14	善來皆成沙門。佛與千比丘往波羅奈。於林	善 來 皆 成 沙 門 佛 與 千 比 丘 往 波 羅 奈 於 林 
T37n1748_001:0141c15	下種種教化盡成應供。即從波羅奈與兄弟	下 種 種 教 化 盡 成 應 供 即 從 波 羅 奈 與 兄 弟 
T37n1748_001:0141c16	三人及千羅漢至摩訶陀國。頻婆娑王大臣	三 人 及 千 羅 漢 至 摩 訶 陀 國 頻 婆 娑 王 大 臣 
T37n1748_001:0141c17	百官前後道從千乘萬騎出城迎佛。佛近王	百 官 前 後 道 從 千 乘 萬 騎 出 城 迎 佛 佛 近 王 
T37n1748_001:0141c18	舍在遮越林。王下車禮佛。佛即慰問以說云	舍 在 遮 越 林 王 下 車 禮 佛 佛 即 慰 問 以 說 云 
T37n1748_001:0141c19	五蘊無常苦空。三界不實一切無常。問王有	五 蘊 無 常 苦 空 三 界 不 實 一 切 無 常 問 王 有 
T37n1748_001:0141c20	此國來幾時。王答七百餘代。而王領者唯知	此 國 來 幾 時 王 答 七 百 餘 代 而 王 領 者 唯 知 
T37n1748_001:0141c21	五文。佛言世間須臾唯道可恃。應修來福無	五 文 佛 言 世 間 須 臾 唯 道 可 恃 應 修 來 福 無 
T37n1748_001:0141c22	為空過。遂說緣起轉還之義。王得法眼淨受	為 空 過 遂 說 緣 起 轉 還 之 義 王 得法眼淨 受 
T37n1748_001:0141c23	五戒。有長者迦蘭陀。以好竹園奉上如來。如	五 戒 有 長 者 迦 蘭 陀 以 好 竹 園 奉 上 如 來 如 
T37n1748_001:0141c24	來呪願而受。恒與聖眾遊處其內。佛有弟子	來 呪 願 而 受 恒 與 聖 眾 遊 處 其 內 佛 有 弟 子 
T37n1748_001:0141c25	名舍婆耆。入城乞食。時舍利弗問沙門師。以	名 舍 婆 耆 入 城 乞 食 時 舍 利 弗 問 沙 門 師 以 
T37n1748_001:0141c26	聞佛德將諸弟子至如來所請為沙門。佛言	聞 佛 德 將 諸 弟 子 至 如 來 所 請 為 沙 門 佛 言 
T37n1748_001:0141c27	善來便成沙門。亦為說法成阿羅漢。入王舍	善 來 便 成 沙 門 亦 為 說 法 成 阿 羅 漢 入 王 舍 
T37n1748_001:0141c28	城訪目連。目連見舍利弗形狀變改問所得	城 訪 目 連 目 連 見 舍 利 弗 形 狀 變 改 問 所 得 
T37n1748_001:0141c29	法。共詣佛所願為沙門。佛言善來便成沙門。	法 共 詣 佛 所 願 為 沙 門 佛 言 善 來 便 成 沙 門 
