T37n1748_001:0131c04	無量壽經連義述文贊卷上	無 量 壽 經 連 義 述 文 贊 卷 上 
T37n1748_001:0131c06	釋璟興撰	釋 璟 興 撰 
T37n1748_001:0131c07	經曰佛說無量壽經上者。述云將講此經略作	經 曰 佛 說 無 量 壽 經 上 者 述 云 將 講 此 經 略 作 
T37n1748_001:0131c08	三門。一者來意二者釋名三解本文。初來意	三 門 一 者 來 意 二 者 釋 名 三 解 本 文 初 來 意 
T37n1748_001:0131c09	者略有三義。一者欲顯淨土之所因故。謂前	者 略 有 三 義 一 者 欲 顯 淨 土 之 所 因 故 謂 前 
T37n1748_001:0131c10	經中雖言華座由法藏比丘願力所成而猶未	經 中 雖 言 華 座 由 法 藏 比 丘 願 力 所 成 而 猶 未 
T37n1748_001:0131c11	說極樂依正二報莊嚴皆依法積本誓力成	說 極 樂 依 正 二 報 莊 嚴 皆 依 法 積 本 誓 力 成 
T37n1748_001:0131c12	故。今更須廣說宿世四十八願以顯彼土今	故 今 更 須 廣 說 宿 世 四 十 八 願 以 顯 彼 土 今 
T37n1748_001:0131c13	現之因。二者欲辨本誓之不虛故。謂一切佛	現 之 因 二 者 欲 辨 本 誓 之 不 虛 故 謂 一 切 佛 
T37n1748_001:0131c14	雖發本願本願亦有不能果遂。如般若中所	雖 發 本 願 本 願 亦 有 不 能 果 遂 如 般 若 中 所 
T37n1748_001:0131c15	有眾生令得滅度。法積願力即不如此故。今	有 眾 生 令 得 滅 度 法 積 願 力 即 不 如 此 故 今 
T37n1748_001:0131c16	廣說依正功德嚴淨以顯宿願必有所辨使增	廣 說 依 正 功 德 嚴 淨 以 顯 宿 願 必 有 所 辨 使 增 
T37n1748_001:0131c17	行者往生之意。三者欲示穢土之苦惱故。謂	行 者 往 生 之 意 三 者 欲 示 穢 土 之 苦 惱 故 謂 
T37n1748_001:0131c18	觀經中雖言未來一切眾生為煩惱賊之所苦	觀 經 中 雖 言 未 來 一 切 眾 生 為 煩 惱 賊 之 所 苦 
T37n1748_001:0131c19	害而眾生不聞痛惱之相即不能起欣厭之意	害 而 眾 生 不 聞 痛 惱 之 相 即 不 能 起 欣 厭 之 意 
T37n1748_001:0131c20	往生之業亦不得成故。今廣宣五惡痛燒以	往 生 之 業 亦 不 得 成 故 今 廣 宣 五 惡 痛 燒 以 
T37n1748_001:0131c21	於苦害。令修行者厭此苦域欣彼樂方修福觀	於 苦 害 令 修 行 者 厭 此 苦 域 欣 彼 樂 方 修 福 觀 
T37n1748_001:0131c22	行速出娑婆而生淨土。如其次第即所成所	行 速 出 娑 婆 而 生 淨 土 如 其 次 第 即 所 成 所 
T37n1748_001:0131c23	化之二也。以是三義故次觀經後說此經也。	化 之 二 也 以 是 三 義 故 次 觀 經 後 說 此 經 也 
T37n1748_001:0131c24	第二釋名者觀乎歷代傳來經本。經本題名	第 二 釋 名 者 觀 乎 歷 代 傳 來 經 本 經 本 題 名 
T37n1748_001:0131c25	雖復多途今且申三代經之首名也。魏時帛	雖 復 多 途 今 且 申 三 代 經 之 首 名 也 魏 時 帛 
T37n1748_001:0131c26	延顯無量清淨平等覺經之號。吳時支謙立	延 顯 無 量 清 淨 平 等 覺 經 之 號 吳 時 支 謙 立 
T37n1748_001:0131c27	諸佛阿彌陀三耶三佛薩樓佛檀過度人道經	諸 佛 阿 彌 陀 三耶三佛 薩 樓 佛 檀 過 度 人 道 經 
T37n1748_001:0131c28	之稱亦名大阿彌陀。今西晉法護名無量壽	之 稱 亦 名 大 阿 彌 陀 今 西 晉 法 護 名 無 量 壽 
T37n1748_001:0131c29	經。故經之名雖復廣略其義大同。欲釋法護	經 故 經 之 名 雖 復 廣 略 其 義 大 同 欲 釋 法 護 
T37n1748_001:0132a01	經本之名即有四對。一總別相對。即佛說及	經 本 之 名 即 有 四 對 一 總 別 相 對 即 佛 說 及 
T37n1748_001:0132a02	經名總無量壽名別故。二人法相對。即佛者	經 名 總 無 量 壽 名 別 故 二 人 法 相 對 即 佛 者 
T37n1748_001:0132a03	人餘名法故。三詮旨相對。即無量壽名旨經	人 餘 名 法 故 三 詮 旨 相 對 即 無 量 壽 名 旨 經 
T37n1748_001:0132a04	者詮也說兼二故。四首尾相對。即上者對下	者 詮 也 說 兼 二 故 四 首 尾 相 對 即 上 者 對 下 
T37n1748_001:0132a05	之言下亦對上之詞如次首尾故。委細之義	之 言 下 亦 對 上 之 詞 如 次 首 尾 故 委 細 之 義 
T37n1748_001:0132a06	如前釋。	如 前 釋 
T37n1748_001:0132a07	經曰我聞如是者。述云第三解本文。又有第	經 曰 我聞如是 者 述 云 第 三 解 本 文 又 有 第 
T37n1748_001:0132a08	二直申彌陀宿成佛剎本願樂果以例眾生生	二 直 申 彌 陀 宿 成 佛 剎 本 願 樂 果 以 例 眾 生 生 
T37n1748_001:0132a09	之因果。此中有說此經大開十分。一從初至	之 因 果 此 中 有 說 此 經 大 開 十 分 一 從 初 至 
T37n1748_001:0132a10	於一時來會已來名序說分。二時世尊諸根	於 一 時 來 會 已 來 名 序 說 分 二 時 世 尊 諸 根 
T37n1748_001:0132a11	悅豫下是現相分。三尊者阿難承佛聖旨下	悅 豫 下 是 現 相 分 三 尊 者 阿 難 承 佛 聖 旨 下 
T37n1748_001:0132a12	是啟請分。四於是世尊告阿難曰下是敘興	是 啟 請 分 四 於 是 世 尊 告 阿 難 曰 下 是 敘 興 
T37n1748_001:0132a13	分。五阿難諦聽今為汝說下是正說分。六彌	分 五 阿 難 諦 聽 今 為 汝 說 下 是 正 說 分 六 彌 
T37n1748_001:0132a14	勒菩薩白佛言下是生生分。七佛語彌勒其	勒 菩 薩 白 佛 言 下 是 生 生 分 七 佛 語 彌 勒 其 
T37n1748_001:0132a15	有得聞下是勸信分。八爾時世尊說此經法	有 得 聞 下 是 勸 信 分 八 爾 時 世 尊 說 此 經 法 
T37n1748_001:0132a16	下是說益分。九爾時三千大千下是勸請分。	下 是 說 益 分 九 爾 時 三千大千 下 是 勸 請 分 
T37n1748_001:0132a17	十佛說經已盡靡不歡喜下是畢喜分。逐申有	十 佛 說 經 已 盡 靡 不 歡 喜 下 是 畢 喜 分 逐 申 有 
T37n1748_001:0132a18	此十分之意。然未盡理故不採錄。有何未盡	此 十 分 之 意 然 未 盡 理 故 不 採 錄 有 何 未 盡 
T37n1748_001:0132a19	者。如來現相將顯聖教。所說法門應名目。如	者 如 來 現 相 將 顯 聖 教 所 說 法 門 應 名 目 如 
T37n1748_001:0132a20	何乃言現相分耶。若發所說非發起序者阿	何 乃 言 現 相 分 耶 若 發 所 說 非 發 起 序 者 阿 
T37n1748_001:0132a21	難證誰。證信序。若非證信必不可言序說分	難 證 誰 證 信 序 若 非 證 信 必 不 可 言 序 說 分 
T37n1748_001:0132a22	故。又自世尊諸根悅豫前都未有說序。何所	故 又 自 世 尊 諸 根 悅 豫 前 都 未 有 說 序 何 所 
T37n1748_001:0132a23	說故作序說分之名也。不可以他兼發起名。	說 故 作 序 說 分 之 名 也 不 可 以 他 兼 發 起 名 
T37n1748_001:0132a24	序說分目單證信故。又阿難申問於前如來	序 說 分 目 單 證 信 故 又 阿 難 申 問 於 前 如 來 
T37n1748_001:0132a25	送答於後即顯所說之旨。有何所少諦聽已	送 答 於 後 即 顯 所 說 之 旨 有 何 所 少 諦 聽 已 
T37n1748_001:0132a26	去乃名正說。正說與序既不能別。後諸分意	去 乃 名 正 說 正 說 與 序 既 不 能 別 後 諸 分 意 
T37n1748_001:0132a27	亦成乖角。若如所言每章段盡應作別分。分	亦 成 乖 角 若 如 所 言 每 章 段 盡 應 作 別 分 分 
T37n1748_001:0132a28	非唯十故。有說此經文別有三。從初我聞至	非 唯 十 故 有 說 此 經 文 別 有 三 從 初 我 聞 至 
T37n1748_001:0132a29	願樂欲聞是其由序。佛告阿難乃往過去下	願 樂 欲 聞 是 其 由 序 佛 告 阿 難 乃往過去 下 
T37n1748_001:0132b01	是正宗分。佛語彌勒若有得聞下是流通分。	是 正 宗 分 佛 語 彌 勒 若 有 得 聞 下 是 流 通 分 
T37n1748_001:0132b02	初由序有二。初我聞如是即證信序。後一時	初 由 序 有 二 初 我聞如是 即 證 信 序 後 一 時 
T37n1748_001:0132b03	佛下義既兩兼。故對準證信為發起序。於中	佛 下 義 既 兩 兼 故 對 準 證 信 為 發 起 序 於 中 
T37n1748_001:0132b04	有三。一辨化主二辨徒眾三如來現相阿難	有 三 一 辨 化 主 二 辨 徒 眾 三 如 來 現 相 阿 難 
T37n1748_001:0132b05	申請。此亦不然。阿難申請若發起者佛答阿	申 請 此 亦 不 然 阿 難 申 請 若 發 起 者 佛 答 阿 
T37n1748_001:0132b06	難應非正宗。若答正宗問必非序故。撿諸經	難 應 非 正 宗 若 答 正 宗 問 必 非 序 故 撿 諸 經 
T37n1748_001:0132b07	論答名正說必兼其問。言問雖發起答是正	論 答 名 正 說 必 兼 其 問 言 問 雖 發 起 答 是 正 
T37n1748_001:0132b08	宗無此例故。又時處等准證信我問如是詎	宗 無 此 例 故 又 時 處 等 准 證 信 我 問 如 是 詎 
T37n1748_001:0132b09	不然。發起若聞若佛皆說前有故。又時佛處	不 然 發 起 若 聞 若 佛 皆 說 前 有 故 又 時 佛 處 
T37n1748_001:0132b10	辨其化主亦違佛地論總顯已聞等五義故。	辨 其 化 主 亦 違 佛 地 論 總 顯 已 聞 等 五 義 故 
T37n1748_001:0132b11	今觀此一部之經宜作三分。初從我聞至光	今 觀 此 一 部 之 經 宜 作 三 分 初 從 我 聞 至 光 
T37n1748_001:0132b12	顏巍巍已來名說經因起分。次自尊者阿難	顏 巍 巍 已 來 名 說 經 因 起 分 次 自 尊 者 阿 難 
T37n1748_001:0132b13	迨于略說之耳已來名問答廣說分。後始佛	迨 于 略 說 之 耳 已 來 名 問 答 廣 說 分 後 始 佛 
T37n1748_001:0132b14	語彌勒盡於靡不歡喜已來名問說喜行分。	語 彌 勒 盡 於 靡 不 歡 喜 已 來 名 問 說 喜 行 分 
T37n1748_001:0132b15	將釋有此三品之意還同佛地論。初又有二。	將 釋 有 此 三 品 之 意 還 同 佛 地 論 初 又 有 二 
T37n1748_001:0132b16	初傳法勸信分後發起聖說序。初又有五。我	初 傳 法 勸 信 分 後 發 起 聖 說 序 初 又 有 五 我 
T37n1748_001:0132b17	聞如是此初傳法也。帛延支謙皆無此言。法	聞 如 是 此 初 傳 法 也 帛 延 支 謙 皆 無 此 言 法 
T37n1748_001:0132b18	護經存言順印度。	護 經 存 言 順 印 度 
T37n1748_001:0132b19	經曰一時者。述云此第二傳時也。	經 曰 一 時 者 述 云 此 第 二 傳 時 也 
T37n1748_001:0132b20	經曰佛者。述云此第三傳主也。	經 曰 佛 者 述 云 此 第 三 傳 主 也 
T37n1748_001:0132b21	經曰王舍城耆闍崛山中者。述云此第四傳	經 曰 王 舍 城 耆 闍 崛 山 中 者 述 云 此 第 四 傳 
T37n1748_001:0132b22	處也。若釋此四文。即同前經故不勞再解。	處 也 若 釋 此 四 文 即 同 前 經 故 不 勞 再 解 
T37n1748_001:0132b23	經曰與大比丘者。述云第五傳機。經本不同。	經 曰 與 大 比 丘 者 述 云 第 五 傳 機 經 本 不 同 
T37n1748_001:0132b24	帛延備敘三眾。一聲聞眾即與大弟子眾千	帛 延 備 敘 三 眾 一 聲 聞 眾 即 與 大 弟 子 眾 千 
T37n1748_001:0132b25	二百五十人比丘尼五百人清信士七千人清	二百五十 人 比 丘 尼 五 百 人 清 信 士 七 千 人 清 
T37n1748_001:0132b26	信女五百人也。二菩薩眾即菩薩七十那衍	信 女 五 百 人 也 二 菩 薩 眾 即 菩 薩 七 十 那 衍 
T37n1748_001:0132b27	也。三諸天眾即欲天子八十萬色天子七十	也 三 諸 天 眾 即 欲 天 子 八 十 萬 色 天 子 七 十 
T37n1748_001:0132b28	萬遍淨天子六十那衍梵天一億也。支謙唯	萬 遍 淨 天 子 六 十 那 衍 梵 天 一 億 也 支 謙 唯 
T37n1748_001:0132b29	標聲聞之眾。即摩訶比丘僧萬二千人也。今	標 聲 聞 之 眾 即 摩訶比丘僧 萬 二 千 人 也 今 
T37n1748_001:0132c01	法護經略舉比丘菩薩二眾餘皆無也。所以	法 護 經 略 舉 比 丘 菩 薩 二 眾 餘 皆 無 也 所 以 
T37n1748_001:0132c02	有此備闕者蓋翻家意樂互存廣略。異由此	有 此 備 闕 者 蓋 翻 家 意 樂 互 存 廣 略 異 由 此 
T37n1748_001:0132c03	也。將釋傳機有二。初聲聞眾後菩薩眾。眾有	也 將 釋 傳 機 有 二 初 聲 聞 眾 後 菩 薩 眾 眾 有 
T37n1748_001:0132c04	此次第亦如前解。初又有五。此初標行也。即	此 次 第 亦 如 前 解 初 又 有 五 此 初 標 行 也 即 
T37n1748_001:0132c05	法華論中云論聲聞修小乘行依乞等自活	法 華 論 中 云 論 聲 聞 修 小 乘 行 依 乞 等 自 活 
T37n1748_001:0132c06	故。威儀一定不同菩薩。故以比丘為名也。	故 威 儀 一 定 不 同 菩 薩 故 以 比 丘 為 名 也 
T37n1748_001:0132c07	經曰萬二千人俱者。述云此第二唱數也。彼	經 曰 萬 二 千 人 俱 者 述 云 此 第 二 唱 數 也 彼 
T37n1748_001:0132c08	論亦云數成就者謂大眾無數故總別雖異其	論 亦 云 數 成 就 者 謂 大 眾 無 數 故 總 別 雖 異 其 
T37n1748_001:0132c09	義一焉。而帛延唱千二百五十人者略舉常	義 一 焉 而 帛 延 唱 千二百五十 人 者 略 舉 常 
T37n1748_001:0132c10	眾。不盡之言故亦不違。	眾 不 盡 之 言 故 亦 不 違 
T37n1748_001:0132c11	經曰一切大聖神通已達者。述云此第三歎德	經 曰 一 切 大 聖 神 通 已 達 者 述 云 此 第 三 歎 德 
T37n1748_001:0132c12	也。一切者即普及盡際之言。大聖者即會理	也 一 切 者 即 普 及 盡 際 之 言 大 聖 者 即 會 理 
T37n1748_001:0132c13	之德名聞凡聖故。論云心得自在到彼岸即其	之 德 名 聞 凡 聖 故 論 云 心得自在 到 彼 岸 即 其 
T37n1748_001:0132c14	大也。神通者即該六通之名無壅叵測之義	大 也 神 通 者 即 該 六 通 之 名 無 壅 叵 測 之 義 
T37n1748_001:0132c15	也。已者竟也。達者即作證義。皆於六通究竟	也 已 者 竟 也 達 者 即 作 證 義 皆 於 六 通 究 竟 
T37n1748_001:0132c16	作證故。有說阿難既在學地位。雖未得通而	作 證 故 有 說 阿 難 既 在 學 地 位 雖 未 得 通 而 
T37n1748_001:0132c17	有勝德亦名已達非也。阿難為人非凡所知。	有 勝 德 亦 名 已 達 非 也 阿 難 為 人 非 凡 所 知 
T37n1748_001:0132c18	其實即經言迹雖初果初果亦伏欲障獲根本	其 實 即 經 言 迹 雖 初 果 初 果 亦 伏 欲 障 獲 根 本 
T37n1748_001:0132c19	定。縱無漏盡既發五通。故從多言已達都無	定 縱 無 漏 盡 既 發 五 通 故 從 多 言 已 達 都 無 
T37n1748_001:0132c20	致怪。	致 怪 
T37n1748_001:0132c21	經曰其名曰尊者了本際至尊者阿難者。述云	經 曰 其 名 曰 尊 者 了 本 際 至 尊 者 阿 難 者 述 云 
T37n1748_001:0132c22	此第四列名也。諸經列眾無定次第故。或有	此 第 四 列 名 也 諸 經 列 眾 無 定 次 第 故 或 有 
T37n1748_001:0132c23	行德大小為次第。如法華經迦葉在第二鶖	行 德 大 小 為 次 第 如 法 華 經 迦 葉 在 第 二 鶖 
T37n1748_001:0132c24	子列在迦旃延上等。或有以出家前後為次	子 列 在 迦 旃 延 上 等 或 有 以 出 家 前 後 為 次 
T37n1748_001:0132c25	第。如報恩經初度五人次度耶舍門徒五十	第 如 報 恩 經 初 度 五 人 次 度 耶 舍 門 徒 五 十 
T37n1748_001:0132c26	次度優樓頻螺門徒五百次度伽耶門徒三百	次 度 優 樓 頻 螺 門 徒 五 百 次 度 伽 耶 門 徒 三 百 
T37n1748_001:0132c27	次度那提門徒二百次度鶖子門徒一百次度	次 度 那 提 門 徒 二 百 次 度 鶖 子 門 徒 一 百 次 度 
T37n1748_001:0132c28	目連門人一百。或有以德辨為次第。如無垢	目 連 門 人 一 百 或 有 以 德 辨 為 次 第 如 無 垢 
T37n1748_001:0132c29	稱以命問疾要假智辨方對揚故。今此經中	稱 以 命 問 疾 要 假 智 辨 方 對 揚 故 今 此 經 中 
T37n1748_001:0132c30	即同報恩入聖次第。帛延列其三十六名。支	即 同 報 恩 入 聖 次 第 帛 延 列 其 三 十 六 名 支 
T37n1748_001:0133a01	謙法護皆標三十一。憍陳如為其初故。帛謙	謙 法 護 皆 標 三 十 一 憍 陳 如 為 其 初 故 帛 謙 
T37n1748_001:0133a02	並曰賢者而法護云尊者。皆嘆德之言。即前	並 曰 賢 者 而 法 護 云 尊 者 皆 嘆 德 之 言 即 前 
T37n1748_001:0133a03	大聖之義。了本際者即支謙云[牛*句]隣也。梵云	大 聖 之 義 了 本 際 者 即 支 謙 云 [牛句] 隣 也 梵 云 
T37n1748_001:0133a04	阿若多憍陳那。憍陳是婆羅門姓。那是男聲。	阿 若 多 憍 陳 那 憍 陳 是 婆 羅 門 姓 那 是 男 聲 
T37n1748_001:0133a05	阿若多是解義。初解淨居。亦言已解。因以為	阿 若 多 是 解 義 初 解 淨 居 亦 言 已 解 因 以 為 
T37n1748_001:0133a06	初解。憍陳之姓乃亦眾多。以解標號以男簡	初 解 憍 陳 之 姓 乃 亦 眾 多 以 解 標 號 以 男 簡 
T37n1748_001:0133a07	女故復云那。今言本際者即四諦真性。了者	女 故 復 云 那 今 言 本 際 者 即 四 諦 真 性 了 者 
T37n1748_001:0133a08	即解故言雖不同其義一也。正願者即謙云	即 解 故 言 雖 不 同 其 義 一 也 正 願 者 即 謙 云 
T37n1748_001:0133a09	拔智致蓋是拔提之名也。有說馬師。因驅擯	拔 智 致 蓋 是 拔 提 之 名 也 有 說 馬 師 因 驅 擯 
T37n1748_001:0133a10	法發更不往他家之願遂得羅漢故。即恐非	法 發 更 不 往 他 家 之 願 遂 得 羅 漢 故 即 恐 非 
T37n1748_001:0133a11	也。准婆沙論馬師滿宿身顯龍相遂生其中。	也 准 婆 沙 論 馬 師 滿 宿 身 顯 龍 相 遂 生 其 中 
T37n1748_001:0133a12	得羅漢果受畜生身無是處故。有說正語即	得 羅 漢 果 受 畜 生 身 無 是 處 故 有 說 正 語 即 
T37n1748_001:0133a13	畢陵伽婆差非也。其人即惡性麁言。雖得羅	畢 陵 伽 婆 差 非 也 其 人 即 惡 性 麁 言 雖 得 羅 
T37n1748_001:0133a14	漢餘習亦在。必不可言正語故。今即論云摩	漢 餘 習 亦 在 必 不 可 言 正 語 故 今 即 論 云 摩 
T37n1748_001:0133a15	訶那彌此云正語蓋是摩男之名矣。即帛延	訶 那 彌 此 云 正 語 蓋 是 摩 男 之 名 矣 即 帛 延 
T37n1748_001:0133a16	云賢者能讚也。大號者即論云賢者含屍。蓋	云 賢 者 能 讚 也 大 號 者 即 論 云 賢 者 含 屍 蓋 
T37n1748_001:0133a17	為離婆多也。其人持不妄語。因證鬼諍以屍	為 離 婆 多 也 其 人 持 不 妄 語 因 證 鬼 諍 以 屍 
T37n1748_001:0133a18	代身遂居王位德名令聞諸方故。仁賢者即	代 身 遂 居 王 位 德 名 令 聞 諸 方 故 仁 賢 者 即 
T37n1748_001:0133a19	謙云須滿曰內懷賢善外申慈仁故因名之。	謙 云 須 滿 曰 內 懷 賢 善 外 申 慈 仁 故 因 名 之 
T37n1748_001:0133a20	離垢者即謙云維末坻蓋淨除是也。說本起	離 垢 者 即 謙 云 維 末 坻 蓋 淨 除 是 也 說 本 起 
T37n1748_001:0133a21	云輪提陀。掃淨寺舍願令心無塵垢如寺故	云 輪 提 陀 掃 淨 寺 舍 願 令 心 無 塵 垢 如 寺 故 
T37n1748_001:0133a22	名淨除。淨除離垢言異義同故。名聞者有說	名 淨 除 淨 除 離 垢 言 異 義 同 故 名 聞 者 有 說 
T37n1748_001:0133a23	長爪梵志。博達之名聞於十方故云名聞此	長 爪 梵 志 博 達 之 名 聞 於 十 方 故 云 名 聞 此 
T37n1748_001:0133a24	恐非也。違說本起故。無有除此而可准故。今	恐 非 也 違 說 本 起 故 無 有 除 此 而 可 准 故 今 
T37n1748_001:0133a25	依彼經。夜耶尊者名為名聞。梵行淨潔眾所	依 彼 經 夜 耶 尊 者 名 為 名 聞 梵 行 淨 潔 眾 所 
T37n1748_001:0133a26	見敬故。善實者即說本起長者凡耆名為取	見 敬 故 善 實 者 即 說 本 起 長 者 凡 耆 名 為 取 
T37n1748_001:0133a27	善。供養維衛佛塔已來九十一劫常生人天遂	善 供 養 維 衛 佛 塔 已 來 九 十 一 劫 常 生 人 天 遂 
T37n1748_001:0133a28	得阿羅漢故。具足者即應說本起樹提。尊者	得阿羅漢 故 具 足 者 即 應 說 本 起 樹 提 尊 者 
T37n1748_001:0133a29	願得受大戒具足成沙門故。牛王者即笈房	願 得 受 大 戒 具 足 成 沙 門 故 牛 王 者 即 笈 房 
T37n1748_001:0133b01	鉢底此言牛相而言王者兼美而已。梵云鄔	鉢 底 此 言 牛 相 而 言 王 者 兼 美 而 已 梵 云 鄔 
T37n1748_001:0133b02	盧頻螺此云木苽。當其胸前有一疴起如木	盧 頻 螺 此 云 木 苽 當 其 胸 前 有 一 疴 起 如 木 
T37n1748_001:0133b03	苽故。今云優樓頻螺者訛也。伽耶者即象頭	苽 故 今 云 優 樓 頻 螺 者 訛 也 伽 耶 者 即 象 頭 
T37n1748_001:0133b04	山。逐處之名故。梵云捺地莊嚴經云難提即	山 逐 處 之 名 故 梵 云 捺 地 莊 嚴 經 云 難 提 即 
T37n1748_001:0133b05	江名也。此三迦葉皆飲光種兄弟三人。帛延	江 名 也 此 三 迦 葉 皆 飲 光 種 兄 弟 三 人 帛 延 
T37n1748_001:0133b06	經中更有賢者氏聚迦葉。蓋說本起云承禪	經 中 更 有 賢 者 氏 聚 迦 葉 蓋 說 本 起 云 承 禪 
T37n1748_001:0133b07	迦葉應云此中尊者具足。覺經除氏聚後即	迦 葉 應 云 此 中 尊 者 具 足 覺 經 除 氏 聚 後 即 
T37n1748_001:0133b08	云牛飼故。既無誠說且開二途取捨任意學	云 牛 飼 故 既 無 誠 說 且 開 二 途 取 捨 任 意 學 
T37n1748_001:0133b09	者應知。梵云迦葉波此云飲光即婆羅門姓。	者 應 知 梵 云 迦 葉 波 此 云 飲 光 即 婆 羅 門 姓 
T37n1748_001:0133b10	上古有仙身有光明飲蔽日月之光。迦葉是	上 古 有 仙 身 有 光 明 飲 蔽 日 月 之 光 迦 葉 是 
T37n1748_001:0133b11	種。自亦有光能飲日月故襲性之名。摩訶言	種 自 亦 有 光 能 飲 日 月 故 襲 性 之 名 摩 訶 言 
T37n1748_001:0133b12	大。既大富長者之子亦為大人所識故表大	大 既 大 富 長 者 之 子 亦 為 大 人 所 識 故 表 大 
T37n1748_001:0133b13	名以簡餘三。梵云奢利弗怛羅。舍利云鶖即	名 以 簡 餘 三 梵 云 奢 利 弗 怛 羅 舍 利 云 鶖 即 
T37n1748_001:0133b14	百舌鳥亦曰春鸎。弗怛羅云子。以母才辯猶	百 舌 鳥 亦 曰 春 鸎 弗 怛 羅 云 子 以 母 才 辯 猶 
T37n1748_001:0133b15	如鶖鳥。此是彼子因以名之故云鶖子。言舍	如 鶖 鳥 此 是 彼 子 因 以 名 之 故 云 鶖 子 言 舍 
T37n1748_001:0133b16	利弗者訛也。梵云摩訶沒特伽羅此云大採	利 弗 者 訛 也 梵 云 摩 訶 沒 特 伽 羅 此 云 大 採 
T37n1748_001:0133b17	菽氏。上古有仙居山寂處常採菉豆以充所	菽 氏 上 古 有 仙 居 山 寂 處 常 採 菉 豆 以 充 所 
T37n1748_001:0133b18	食因為其姓。尊者之母是彼之族仍以名之。	食 因 為 其 姓 尊 者 之 母 是 彼 之 族 仍 以 名 之 
T37n1748_001:0133b19	得大神通簡餘此姓故亦云大。言目連者音	得 大 神 通 簡 餘 此 姓 故 亦 云 大 言 目 連 者 音 
T37n1748_001:0133b20	訛也。劫賓那者此云房宿。佛與同房宿化	訛 也 劫 賓 那 者 此 云 房 宿 佛 與 同 房 宿 化 
T37n1748_001:0133b21	作老比丘為之說法而悟道故。梵云摩訶迦	作 老 比 丘 為 之 說 法 而 悟 道 故 梵 云 摩 訶 迦 
T37n1748_001:0133b22	多衍那此云大剪剔種男即婆羅門姓。上古	多 衍 那 此 云 大 剪 剔 種 男 即 婆 羅 門 姓 上 古 
T37n1748_001:0133b23	多仙山中靜處。年既掩久鬚髮稍長垂人為	多 仙 山 中 靜 處 年 既 掩 久 鬚 髮 稍 長 垂 人 為 
T37n1748_001:0133b24	剔。婆羅門法行剔髮故。一仙有子兄弟二人	剔 婆 羅 門 法 行 剔 髮 故 一 仙 有 子 兄 弟 二 人 
T37n1748_001:0133b25	俱來覲父。小者乃為諸仙剔髮諸仙願護。後	俱 來 覲 父 小 者 乃 為 諸 仙 剔 髮 諸 仙 願 護 後 
T37n1748_001:0133b26	成仙貴。爾來此種皆稱剪剔。剔者身是男子	成 仙 貴 爾 來 此 種 皆 稱 剪 剔 剔 者 身 是 男 子 
T37n1748_001:0133b27	威德特尊。簡餘此種故云大剪剔種男。古迦	威 德 特 尊 簡 餘 此 種 故 云 大 剪 剔 種 男 古 迦 
T37n1748_001:0133b28	旃延此云繩扇訛也。今云大住者亦襲昔之	旃 延 此 云 繩 扇 訛 也 今 云 大 住 者 亦 襲 昔 之 
T37n1748_001:0133b29	名。母戀此子不肯改嫁如繩繫扇可謂住故。	名 母 戀 此 子 不 肯 改 嫁 如 繩 繫 扇 可 謂 住 故 
T37n1748_001:0133c01	大淨志者即說本起中賴吒和羅。更無所樂	大 淨 志 者 即 說 本 起 中 賴 吒 和 羅 更 無 所 樂 
T37n1748_001:0133c02	志於清白法樂閑居第一故名大靜志。摩訶	志 於 清 白 法 樂 閑 居 第 一 故 名 大 靜 志 摩 訶 
T37n1748_001:0133c03	周那者即周那般特。此云路生。路生有大小	周 那 者 即 周 那 般 特 此 云 路 生 路 生 有 大 小 
T37n1748_001:0133c04	故摩訶以簡其小。梵云補賴拏梅怛利曳尼	故 摩 訶 以 簡 其 小 梵 云 補 賴 拏 梅 怛 利 曳 尼 
T37n1748_001:0133c05	弗怛羅此云滿慈子。言富樓那彌多羅尼子	弗 怛 羅 此 云 滿 慈 子 言 富 樓 那 彌 多 羅 尼 子 
T37n1748_001:0133c06	者訛也。滿是其名慈是母姓。母姓是慈。滿尊	者 訛 也 滿 是 其 名 慈 是 母 姓 母 姓 是 慈 滿 尊 
T37n1748_001:0133c07	者是慈女之子故因名之。今言滿願子者訛	者 是 慈 女 之 子 故 因 名 之 今 言 滿 願 子 者 訛 
T37n1748_001:0133c08	也。梵云阿泥律陀此云無滅。佛之堂弟即天	也 梵 云 阿 泥 律 陀 此 云 無 滅 佛 之 堂 弟 即 天 
T37n1748_001:0133c09	眼第一。今言離障意亦此謂也。言阿[少/兔]樓馱	眼 第 一 今 言 離 障 意 亦 此 謂 也 言 阿 [少兔] 樓 馱 
