T45n1901_001:0902a14	護命放生軌儀法	護 命 放 生 軌 儀 法 
T45n1901_001:0902a16	唐三藏法師義淨撰	唐 三藏法師 義 淨 撰 
T45n1901_001:0902a17	夫以懷生者。皆愛其生。上通賢智。有死者。咸	夫 以 懷 生 者 皆 愛 其 生 上 通 賢 智 有 死 者 咸 
T45n1901_001:0902a18	畏其死。下洎蜫蟲。由是善逝隨事而修慈。不	畏 其 死 下 洎 蜫 蟲 由 是 善 逝 隨 事 而 修 慈 不 
T45n1901_001:0902a19	損含識。量內身而准物。刀杖不加唯以大悲。	損 含 識 量 內 身 而 准 物 刀 杖 不 加 唯 以 大 悲 
T45n1901_001:0902a20	宣揚法化。於護生處。極致慇懃。是佛弟子。理	宣 揚 法 化 於 護 生 處 極 致 慇 懃 是 佛 弟 子 理 
T45n1901_001:0902a21	應隨作。觀蟲濾水。是出家之要儀。見危存護。	應 隨 作 觀 蟲 濾 水 是 出 家 之 要 儀 見 危 存 護 
T45n1901_001:0902a22	乃悲中之拯急。既知有蟲。律文令作放生器	乃 悲 中 之 拯 急 既 知 有 蟲 律 文 令 作 放 生 器 
T45n1901_001:0902a23	者。但為西國久行。人皆共解東夏先來未識。	者 但 為 西 國 久 行 人 皆 共 解 東 夏 先 來 未 識 
T45n1901_001:0902a24	故亦須委其儀。若不具陳。無由曉悟。其器任	故 亦 須 委 其 儀 若 不 具 陳 無 由 曉 悟 其 器 任 
T45n1901_001:0902a25	用鐵銅瓦木。瓦即安鼻鐵木准成。若擬隨身	用 鐵 銅 瓦 木 瓦 即 安 鼻 鐵 木 准 成 若 擬 隨 身 
T45n1901_001:0902a26	將去。可用銅作。唯受二升三升。即是舊來小	將 去 可 用 銅 作 唯 受 二 升 三 升 即 是 舊 來 小 
T45n1901_001:0902a27	銅罐子。還施銅系。令穿手得過。底傍一邊。須	銅 罐 子 還 施 銅 系 令 穿 手 得 過 底 傍 一 邊 須 
T45n1901_001:0902a28	安銅鈕。可受小梅指頭。若乞食去時。穿在左	安 銅 鈕 可 受 小 梅 指 頭 若 乞 食 去 時 穿 在 左 
T45n1901_001:0902a29	臂。以衣掩蓋。右手携鉢。乞食得已。隨至一	臂 以 衣 掩 蓋 右 手 携 鉢 乞 食 得 已 隨 至 一 
T45n1901_001:0902b01	家。安置飯鉢。自將淨繩一條。如麁箸許。隨井	家 安 置 飯 鉢 自 將 淨 繩 一 條 如 麁 箸 許 隨 井 
T45n1901_001:0902b02	深淺。繫罐取水。濾以小羅。斟酌得足。即以繩	深 淺 繫 罐 取 水 濾 以 小 羅 斟 酌 得 足 即 以 繩 
T45n1901_001:0902b03	一頭穿鈕。急繫擡系等。繫小鐵鉤。鉤系起時。	一 頭 穿 鈕 急 繫 擡 系 等 繫 小 鐵 鉤 鉤 系 起 時 
T45n1901_001:0902b04	務令平穩。此並預先作了。不得臨時求覓。即	務 令 平 穩 此 並 預 先 作 了 不 得 臨 時 求 覓 即 
T45n1901_001:0902b05	以小羅。覆蟲罐內。徐徐放下。至水縱鉤。拔繩	以 小 羅 覆 蟲 罐 內 徐 徐 放 下 至 水 縱 鉤 拔 繩 
T45n1901_001:0902b06	令覆。再三下濯。方牽出井。此是乞食之儀也。	令 覆 再 三 下 濯 方 牽 出 井 此 是 乞 食 之 儀 也 
T45n1901_001:0902b07	或用銅椀漆椀。穿孔著系。權用亦得。若在寺	或 用 銅 椀 漆 椀 穿 孔 著 系 權 用 亦 得 若 在 寺 
T45n1901_001:0902b08	者。即以常用鐵罐覆之。如前安置。少有別處。	者 即 以 常 用 鐵 罐 覆 之 如 前 安 置 少 有 別 處 
T45n1901_001:0902b09	底傍著鐵鐶。可容三指。以罐鉤內中。擡起系	底 傍 著 鐵 鐶 可 容 三 指 以 罐 鉤 內 中 擡 起 系 
T45n1901_001:0902b10	等同前著鉤。覆蟲在中。放使至水。假令深井	等 同 前 著 鉤 覆 蟲 在 中 放 使 至 水 假 令 深 井 
T45n1901_001:0902b11	亦得為之。若別畜繩。恐成勞擾。若井深處。或	亦 得 為 之 若 別 畜 繩 恐 成 勞 擾 若 井 深 處 或 
T45n1901_001:0902b12	可別為盆貯。或可送往河池。瀉水竟時。還須	可 別 為 盆 貯 或 可 送 往 河 池 瀉 水 竟 時 還 須 
T45n1901_001:0902b13	滌器。斯其法也。濾羅樣式。如別處言之。豈容	滌 器 斯 其 法 也 濾 羅 樣 式 如 別 處 言 之 豈 容 
T45n1901_001:0902b14	井口之上翻羅。元無放生之器。欲似護戒。寧	井 口 之 上 翻 羅 元 無 放 生 之 器 欲 似 護 戒 寧 
T45n1901_001:0902b15	顧蟲亡。但以如來聖教。慈悲為本。所制戒律。	顧 蟲 亡 但 以 如來聖教 慈 悲 為 本 所 制 戒 律 
T45n1901_001:0902b16	罪有性遮。遮則准事合經。性乃理應從重。性	罪 有 性 遮 遮 則 准 事 合 經 性 乃 理 應 從 重 性 
T45n1901_001:0902b17	罪之內。殺生最初。是故智人特宜存護。若將	罪 之 內 殺 生 最 初 是 故 智 人 特 宜 存 護 若 將 
T45n1901_001:0902b18	此為輕者。更復何有重哉。若能依教作者。現	此 為 輕 者 更 復 何 有 重 哉 若 能 依 教 作 者 現 
T45n1901_001:0902b19	在得長命果報。來世當生淨土。且神州之地。	在 得 長 命 果 報 來 世 當 生 淨 土 且 神 州 之 地 
T45n1901_001:0902b20	四百餘城。出家之人動有萬計。於濾水事。存	四 百 餘 城 出家之人 動 有 萬 計 於 濾 水 事 存 
T45n1901_001:0902b21	心者寡。習俗生常。見輕佛教。不可一一門到	心 者 寡 習 俗 生 常 見 輕 佛 教 不 可 一 一 門 到 
T45n1901_001:0902b22	口傳。冀諸行人遞相教習。設使學通三藏。坐	口 傳 冀 諸 行 人 遞 相 教 習 設 使 學 通 三 藏 坐 
T45n1901_001:0902b23	證四禪。鎮想無生。澄心空理。若不護命。依教	證 四 禪 鎮 想 無 生 澄 心 空 理 若 不 護 命 依 教 
T45n1901_001:0902b24	奉持。終亦不免佛所訶責。十惡初罪。誰代受	奉 持 終 亦 不 免 佛 所 訶 責 十 惡 初 罪 誰 代 受 
T45n1901_001:0902b25	之。且如見有屠兒牽羊入寺。不過數口。放作	之 且 如 見 有 屠 兒 牽 羊 入 寺 不 過 數 口 放 作 
T45n1901_001:0902b26	長生。眾共聚看。彈指稱善。寧知房內用水。日	長 生 眾 共 聚 看 彈 指 稱 善 寧 知 房 內 用 水 日 
T45n1901_001:0902b27	殺千生萬生。既知理教不輕。宜應細羅細察。	殺 千 生 萬 生 既 知 理 教 不 輕 宜 應 細 羅 細 察 
T45n1901_001:0902b28	自利利物。善護善思。復有令人耕田種植。規	自 利 利 物 善 護 善 思 復 有 令 人 耕 田 種 植 規 
T45n1901_001:0902b29	求小利。不見大尤。水陸俱傷。殺生無數。斯之	求 小 利 不 見 大 尤 水 陸 俱 傷 殺 生 無 數 斯 之 
T45n1901_001:0902c01	罪咎。欲如之何。直如束手泉門。任他處分。故	罪 咎 欲 如 之 何 直 如 束 手 泉 門 任 他 處 分 故 
T45n1901_001:0902c02	經云。殺生之人。當墮地獄餓鬼畜生。設得為	經 云 殺 生 之 人 當 墮 地 獄 餓 鬼 畜 生 設 得 為 
T45n1901_001:0902c03	人。短命多病。嗚呼此苦。誰當受之。脫有能	人 短 命 多 病 嗚 呼 此 苦 誰 當 受 之 脫 有 能 
T45n1901_001:0902c04	為。善哉甚善。可謂釋迦末法。共結慈念之因。	為 善 哉 甚 善 可 謂 釋 迦 末 法 共 結 慈 念 之 因 
T45n1901_001:0902c05	彌勒初成。俱證無生之果。廣如別傳。此不煩	彌 勒 初 成 俱 證 無 生 之 果 廣 如 別 傳 此 不 煩 
T45n1901_001:0902c06	云。	云 
T45n1901_001:0902c07	護命放生軌儀法	護 命 放 生 軌 儀 法 
