T45n1906_001:0917a23	切無貪施性。一切思業戒性。一切無瞋忍性。	切 無 貪 施 性 一 切 思 業 戒 性 一 切 無 瞋 忍 性 
T45n1906_001:0917a24	一切勇悍精進性。一切專注靜慮性。一切正	一 切 勇 悍 精 進 性 一 切 專 注 靜 慮 性 一 切 正 
T45n1906_001:0917a25	見後五性。由此一行修一切行。必相應故。三	見 後 五 性 由 此 一 行 修 一 切 行 必 相 應 故 三 
T45n1906_001:0917a26	者用攝無貪等法。一一具有無畏等施。乃至	者 用 攝 無 貪 等 法 一 一 具 有 無 畏 等 施 乃 至 
T45n1906_001:0917a27	成就有情智儀。互相資助展轉眷屬。皆以一	成 就 有 情 智 儀 互 相 資 助 展 轉 眷 屬 皆 以 一 
T45n1906_001:0917a28	切俱行功德。為自性故。由此於一切行。行一	切 俱 行 功 德 為 自 性 故 由 此 於 一 切 行 行 一 
T45n1906_001:0917a29	切行。是則一念修一切行。豈唯阿僧企耶已	切 行 是 則 一 念 修 一 切 行 豈 唯 阿 僧 企 耶 已 
T45n1906_001:0917b01	後。又無數劫實在一念。如旋行者。實向自項。	後 又 無 數 劫 實 在 一 念 如 旋 行 者 實 向 自 項 
T45n1906_001:0917b02	為未來際。項亦背顏。為過去際。無始無終歸	為 未 來 際 項 亦 背 顏 為 過 去 際 無 始 無 終 歸 
T45n1906_001:0917b03	一念故。如有頌言。處夢謂經年　悟乃須臾	一 念 故 如 有 頌 言 處 夢 謂 經 年 悟 乃 須 臾 
T45n1906_001:0917b04	項　故時雖無量　攝在一剎那。三輕重性	項 故 時 雖 無 量 攝 在 一 剎 那 三 輕 重 性 
T45n1906_001:0917b05	門者。所取及捨。雖攝一切雜染清淨。於加行	門 者 所 取 及 捨 雖 攝 一 切 雜 染 清 淨 於 加 行 
T45n1906_001:0917b06	業。制禁戒故。略有十重四十八輕。然菩薩戒。	業 制 禁 戒 故 略 有 十 重 四 十 八 輕 然 菩 薩 戒 
T45n1906_001:0917b07	意地為本。若見勝利。縱身語故。無惡不由貪	意 地 為 本 若 見 勝 利 縱 身 語 故 無 惡 不 由 貪 
T45n1906_001:0917b08	瞋癡者。無不為引好推惡。所以後四為根本	瞋 癡 者 無 不 為 引 好 推 惡 所 以 後 四 為 根 本 
T45n1906_001:0917b09	重。攝善戒中極違有二。一修福捨智。二棄大	重 攝 善 戒 中 極 違 有 二 一 修 福 捨 智 二 棄 大 
T45n1906_001:0917b10	向小。貪偏引初。愚癡遍引。餘二引後。違大乘	向 小 貪 偏 引 初 愚 癡 遍 引 餘 二 引 後 違 大 乘 
T45n1906_001:0917b11	故。攝有情中極違有二。一先自後他。二有親	故 攝 有 情 中 極 違 有 二 一 先 自 後 他 二 有 親 
T45n1906_001:0917b12	怨想。惟惡引初。貪瞋引後。愚癡邪見通引一	怨 想 惟 惡 引 初 貪 瞋 引 後 愚 癡 邪 見 通 引 一 
T45n1906_001:0917b13	切。由此隨應。為三聚本。四持犯相門者。略有	切 由 此 隨 應 為 三 聚 本 四 持 犯 相 門 者 略 有 
T45n1906_001:0917b14	三門。一總相門。二別相門。三究竟門。一總相	三 門 一 總 相 門 二 別 相 門 三 究 竟 門 一 總 相 
T45n1906_001:0917b15	者。若作必犯。設犯亦作。四句分別。或有作而	者 若 作 必 犯 設 犯 亦 作 四句分別 或 有 作 而 
T45n1906_001:0917b16	非犯。謂見勝利菩薩戒中。乃至下凡。善心所	非 犯 謂 見 勝 利 菩 薩 戒 中 乃 至 下 凡 善 心 所 
T45n1906_001:0917b17	作。皆非犯故。或有不作而犯。謂隨喜等。餘句	作 皆 非 犯 故 或 有 不 作 而 犯 謂 隨 喜 等 餘 句 
T45n1906_001:0917b18	應知。若犯必染。設染定犯。謂有四句。第一句	應 知 若 犯 必 染 設 染 定 犯 謂 有 四 句 第 一 句 
T45n1906_001:0917b19	者。無覆無記。無知。放逸。此罪助惡招彼果	者 無覆無記 無 知 放 逸 此 罪 助 惡 招 彼 果 
T45n1906_001:0917b20	故。第二句者。謂欲斷彼。生起意樂。發勤精	故 第 二 句 者 謂 欲 斷 彼 生 起 意 樂 發 勤 精 
T45n1906_001:0917b21	進。煩惱熾盛。弊抑其心。時時數起。餘句應	進 煩惱熾盛 弊 抑 其 心 時 時 數 起 餘 句 應 
T45n1906_001:0917b22	知。若犯必罪。設罪亦犯。謂順前句。以犯亂	知 若 犯 必 罪 設 罪 亦 犯 謂 順 前 句 以 犯 亂 
T45n1906_001:0917b23	等。無所了知。故思業故。若有重罪。亦業道。	等 無 所 了 知 故 思 業 故 若 有 重 罪 亦 業 道 
T45n1906_001:0917b24	設有業道。亦重罪。四句分別。或有是重而非	設 有 業 道 亦 重 罪 四句分別 或 有 是 重 而 非 
T45n1906_001:0917b25	業道。謂酤酒等。及餘一分或有業道而非重	業 道 謂 酤 酒 等 及 餘 一 分 或 有 業 道 而 非 重 
T45n1906_001:0917b26	攝。謂綺語等餘句應知。若重業道亦必捨戒。	攝 謂 綺 語 等 餘 句 應 知 若 重 業 道 亦 必 捨 戒 
T45n1906_001:0917b27	設捨戒者亦重業耶。應作四句。一中下品纏。	設 捨 戒 者 亦 重 業 耶 應 作 四 句 一 中 下 品 纏 
T45n1906_001:0917b28	犯他勝處。謂有慚愧。亦不深耽見是功德。二	犯 他 勝 處 謂 有 慚 愧 亦 不 深 耽 見 是 功 德 二 
T45n1906_001:0917b29	自及向他。捨菩提願。三上纏。總別犯他勝處。	自 及 向 他 捨 菩 提 願 三 上 纏 總 別 犯 他 勝 處 
T45n1906_001:0917c01	起根本罪。除爾所相。為第四句。問若爾何故	起 根 本 罪 除 爾 所 相 為 第 四 句 問 若爾何故 
T45n1906_001:0917c02	本業經言。菩薩戒有受法。而無捨法。有犯不	本 業 經 言 菩 薩 戒 有 受 法 而 無 捨 法 有 犯 不 
T45n1906_001:0917c03	失。盡未來際。答下乘向大。有應捨法。棄菩薩	失 盡未來際 答 下 乘 向 大 有 應 捨 法 棄 菩 薩 
T45n1906_001:0917c04	戒。無應爾故。或菩薩戒。無無餘犯。無有總	戒 無 應 爾 故 或 菩 薩 戒 無 無 餘 犯 無 有 總 
T45n1906_001:0917c05	盡。如前說故。二別相者。若於自他。讚毀必	盡 如 前 說 故 二 別 相 者 若 於 自 他 讚 毀 必 
T45n1906_001:0917c06	罪。設毀讚者。亦是福耶。謂有四句。或有讚毀	罪 設 毀 讚 者 亦 是 福 耶 謂 有 四 句 或 有 讚 毀 
T45n1906_001:0917c07	罪毀讚福。如次他邊損害故。饒益故。或有讚	罪 毀 讚 福 如 次 他 邊 損 害 故 饒 益 故 或 有 讚 
T45n1906_001:0917c08	毀福毀讚罪。摧邪等故。佞引利故。或有讚毀	毀 福 毀 讚 罪 摧 邪 等 故 佞 引 利 故 或 有 讚 毀 
T45n1906_001:0917c09	亦福亦罪。毀讚亦爾。謂順淺小違深廣等。或	亦 福 亦 罪 毀 讚 亦 爾 謂 順 淺 小 違 深 廣 等 或 
T45n1906_001:0917c10	有讚毀毀讚非罪非福。謂如彼心增上犯亂。	有 讚 毀 毀 讚 非 罪 非 福 謂 如 彼 心 增 上 犯 亂 
T45n1906_001:0917c11	或重苦逼。或未受戒無記所作。若讚毀罪。必	或 重 苦 逼 或 未 受 戒 無 記 所 作 若 讚 毀 罪 必 
T45n1906_001:0917c12	他勝處。設他勝處。亦讚毀耶。謂輕重相難可	他 勝 處 設 他 勝 處 亦 讚 毀 耶 謂 輕 重 相 難 可 
T45n1906_001:0917c13	決定。隨位持犯極微細故。然約初業四句分	決 定 隨 位 持 犯 極 微 細 故 然 約 初 業 四 句 分 
T45n1906_001:0917c14	別。謂有讚毀而非重罪。雖有愛憎。不為利等。	別 謂 有 讚 毀 而 非 重 罪 雖 有 愛 憎 不 為 利 等 
T45n1906_001:0917c15	雖染犯罪。而非重故。餘句應知。此中且說讚	雖 染 犯 罪 而 非 重 故 餘 句 應 知 此 中 且 說 讚 
T45n1906_001:0917c16	毀一戒。所餘持犯類此應知。謂菩薩戒。與諸	毀 一 戒 所 餘 持 犯 類 此 應 知 謂 菩 薩 戒 與 諸 
T45n1906_001:0917c17	行心。廣蕩無方。無所據礙。行者之機。過塵沙	行 心 廣 蕩 無 方 無 所 據 礙 行 者 之 機 過 塵 沙 
T45n1906_001:0917c18	故。萬行一一以千門。應塵機。修一一故。罪福	故 萬 行 一 一 以 千 門 應 塵 機 修 一 一 故 罪 福 
T45n1906_001:0917c19	之性難別。一行應塵之故。邪正之相易濫。雖	之 性 難 別 一 行 應 塵 之 故 邪 正 之 相 易 濫 雖 
T45n1906_001:0917c20	無數機。皆入菩薩之道。雖無礙門。莫出菩提	無 數 機 皆 入 菩薩之道 雖 無 礙 門 莫 出 菩 提 
T45n1906_001:0917c21	之因。無不道故。高出狹情之謗。皆為因故。深	之 因 無 不 道 故 高 出 狹 情 之 謗 皆 為 因 故 深 
T45n1906_001:0917c22	入廣慧之歎。雖同人面。豈合一相。雖向遠路。	入 廣 慧 之 歎 雖 同 人 面 豈 合 一 相 雖 向 遠 路 
T45n1906_001:0917c23	寧唯特足。如契經言。於乘緩者。乃名為緩。於	寧 唯 特 足 如 契 經 言 於 乘 緩 者 乃 名 為 緩 於 
T45n1906_001:0917c24	戒緩者。不名為緩。菩薩摩訶薩。於此大乘。心	戒 緩 者 不 名 為 緩 菩薩摩訶薩 於 此 大 乘 心 
T45n1906_001:0917c25	不懈縵。是名奉戒。為護正法。以大乘水。而自	不 懈 縵 是 名 奉 戒 為 護 正 法 以 大 乘 水 而 自 
T45n1906_001:0917c26	澡浴。是故菩薩。雖現破戒。不名為緩。三究竟	澡 浴 是 故 菩 薩 雖 現 破 戒 不 名 為 緩 三 究 竟 
T45n1906_001:0917c27	者。即以二空亡三輪相。如契經言。應以不護	者 即 以 二 空 亡 三 輪 相 如 契 經 言 應 以 不 護 
T45n1906_001:0917c28	圓滿淨戒波羅密多。犯無犯相。不可得故。謂	圓 滿 淨 戒 波羅密多 犯 無 犯 相 不 可 得 故 謂 
T45n1906_001:0917c29	戒。罪。人。三輪之相。不即緣故。雖相非無。不	戒 罪 人 三 輪 之 相 不 即 緣 故 雖 相 非 無 不 
T45n1906_001:0918a01	離緣故。自性非有。即。離。中間。亦不可得。性	離 緣 故 自 性 非 有 即 離 中 間 亦 不 可 得 性 
T45n1906_001:0918a02	非有故。勿增能持。相非無故。不撥無犯。空而	非 有 故 勿 增 能 持 相 非 無 故 不 撥 無 犯 空 而 
T45n1906_001:0918a03	不撥。不失戒相。有而不增。無犯戒性。雖明輕	不 撥 不 失 戒 相 有 而 不 增 無 犯 戒 性 雖 明 輕 
T45n1906_001:0918a04	重是非之相。而見三輪。非究竟行。諸法如義。	重 是 非 之 相 而 見 三 輪 非 究 竟 行 諸 法 如 義 
T45n1906_001:0918a05	即名如來。由修無我。之所得故。此無相行。永	即 名 如 來 由 修 無 我 之 所 得 故 此 無 相 行 永 
T45n1906_001:0918a06	斷二障。能滿二利。名為究竟。何者。一念之內	斷 二 障 能 滿 二 利 名 為 究 竟 何 者 一 念 之 內 
T45n1906_001:0918a07	三際圓融。便謂菩提。不離發心。增上意樂。從	三 際 圓 融 便 謂 菩 提 不 離 發 心 增上意樂 從 
T45n1906_001:0918a08	此而生。如契經說。當果諸佛。摩頂說法。一法	此 而 生 如 契 經 說 當 果 諸 佛 摩 頂 說 法 一 法 
T45n1906_001:0918a09	之空。一切無生。便謂。自心流成六道。同體大	之 空 一 切 無 生 便 謂 自 心 流 成 六 道 同 體 大 
T45n1906_001:0918a10	悲。從此而起。如契經言。即此法身無量煩惱	悲 從 此 而 起 如 契 經 言 即 此 法 身 無 量 煩 惱 
T45n1906_001:0918a11	之所漂動。往來生死。名為眾生。護持既爾。出	之 所 漂 動 往 來 生 死 名 為 眾 生 護 持 既 爾 出 
T45n1906_001:0918a12	離亦然。如有頌曰。一切業障海　皆從妄想	離 亦 然 如 有 頌 曰 一 切 業 障 海 皆 從 妄 想 
T45n1906_001:0918a13	生　若欲懺悔者　端坐念實相　眾罪如霜	生 若 欲 懺 悔 者 端 坐 念 實 相 眾 罪 如 霜 
T45n1906_001:0918a14	露　慧日能消除　是故應至心　勤懺六根	露 慧 日 能 消 除 是 故 應 至 心 勤 懺 六 根 
T45n1906_001:0918a15	罪。此三聚戒。離苦樂邊。證斷智恩三身德	罪 此 三 聚 戒 離 苦 樂 邊 證 斷 智 恩 三 身 德 
T45n1906_001:0918a16	本。誡如調絃妙取其中。如契經說。菩薩為道	本 誡 如 調 絃 妙 取 其 中 如 契 經 說 菩 薩 為 道 
T45n1906_001:0918a17	受四供養。身不堅牢則不忍苦。不忍苦故。不	受 四 供 養 身 不 堅 牢 則 不 忍 苦 不 忍 苦 故 不 
T45n1906_001:0918a18	能修善。於苦生恚。於樂生貪。乃至廣說。吾為	能 修 善 於 苦 生 恚 於 樂 生 貪 乃至廣說 吾 為 
T45n1906_001:0918a19	遍訪一切論宗。數寶之項。少年位滿。今為	遍 訪 一 切 論 宗 數 寶 之 項 少 年 位 滿 今 為 
T45n1906_001:0918a20	半錢之利。鳩此要門。為後修集古迹。如瑜伽	半 錢 之 利 鳩 此 要 門 為 後 修 集 古 迹 如 瑜 伽 
T45n1906_001:0918a21	記并頌。申自意樂。如唯識判一卷。幸有同趣。	記 并 頌 申 自 意 樂 如 唯 識 判 一 卷 幸 有 同 趣 
T45n1906_001:0918a22	詳而取決　已開聖典微密要　圓鏡懸空照	詳 而 取 決 已 開 聖 典 微 密 要 圓 鏡 懸 空 照 
T45n1906_001:0918a23	長霄　人身聖教難可再　有心欲出宜及時。	長 霄 人 身 聖 教 難 可 再 有 心 欲 出 宜 及 時 
T45n1906_001:0918a24	菩薩戒本宗要一卷	菩 薩 戒 本 宗 要 一 卷 
