T45n1907_001:0918b03	菩薩戒本持犯要記	菩 薩 戒 本 持 犯 要 記 
T45n1907_001:0918b05	新羅國沙門元曉述	新 羅 國 沙 門 元 曉 述 
T45n1907_001:0918b06	菩薩戒者。返流歸源之大津。去邪就正之要	菩 薩 戒 者 返 流 歸 源 之 大 津 去 邪 就 正 之 要 
T45n1907_001:0918b07	門也。然邪正之相易濫。罪福之性難分。何則	門 也 然 邪 正 之 相 易 濫 罪 福 之 性 難 分 何 則 
T45n1907_001:0918b08	或內意實邪。而外迹似正。或表業同染。而中	或 內 意 實 邪 而 外 迹 似 正 或 表 業 同 染 而 中 
T45n1907_001:0918b09	心淳淨。或有作業合少福。而致大患。或有心	心 淳 淨 或 有 作 業 合 少 福 而 致 大 患 或 有 心 
T45n1907_001:0918b10	行順深遠。而違淺近。是以專穢道人。剋私沙	行 順 深 遠 而 違 淺 近 是 以 專 穢 道 人 剋 私 沙 
T45n1907_001:0918b11	門。長專似迹。以亡真正。每剋深戒。而求淺	門 長 專 似 迹 以 亡 真 正 每 剋 深 戒 而 求 淺 
T45n1907_001:0918b12	行。今將遣淺事。而全深。去似迹而逐實。為自	行 今 將 遣 淺 事 而 全 深 去 似 迹 而 逐 實 為 自 
T45n1907_001:0918b13	忽忘。撮要記別。幸同趣者。詳而取決(矣)持犯	忽 忘 撮 要 記 別 幸 同 趣 者 詳 而 取 決 矣 持 犯 
T45n1907_001:0918b14	之要。有三門。一輕重門。二淺深門。三明究竟	之 要 有 三 門 一 輕 重 門 二 淺 深 門 三 明 究 竟 
T45n1907_001:0918b15	持犯門也。初門之內。有其二句。先即總判輕	持 犯 門 也 初 門 之 內 有 其 二 句 先 即 總 判 輕 
T45n1907_001:0918b16	重。後以別顯差別。言總判者。輕重垢罪中。細	重 後 以 別 顯 差 別 言 總 判 者 輕 重 垢 罪 中 細 
T45n1907_001:0918b17	論支別。頭類乃有八萬四千。括舉其要。別有	論 支 別 頭 類 乃 有 八萬四千 括 舉 其 要 別 有 
T45n1907_001:0918b18	三類。或四十四。如達摩戒本所說。或四十八。	三 類 或 四 十 四 如 達 摩 戒 本 所 說 或 四 十 八 
T45n1907_001:0918b19	如多羅戒本所判。或有二百四十六輕。如別	如 多 羅 戒 本 所 判 或 有 二 百 四 十 六 輕 如 別 
T45n1907_001:0918b20	解脫戒經所立。此第二中。有共不共。共不共	解 脫 戒 經 所 立 此 第 二 中 有 共 不 共 共 不 共 
T45n1907_001:0918b21	相。依文可解。重戒之中。總說有十。論其類	相 依 文 可 解 重 戒 之 中 總 說 有 十 論 其 類 
T45n1907_001:0918b22	別。亦有三種。或有共小之重。謂前四也。或有	別 亦 有 三 種 或 有 共 小 之 重 謂 前 四 也 或 有 
T45n1907_001:0918b23	不共之重。謂後四也。或立在家菩薩六重。謂	不 共 之 重 謂 後 四 也 或 立 在 家 菩 薩 六 重 謂 
T45n1907_001:0918b24	十重內在前六也。此中合。有共與不共。總判	十 重 內 在 前 六 也 此 中 合 有 共 與 不 共 總 判 
T45n1907_001:0918b25	輕重義類如是。若明差別者。今依達摩戒本。	輕 重 義 類 如 是 若 明 差 別 者 今 依 達 摩 戒 本 
T45n1907_001:0918b26	辨其性相差別。文言。於有違犯。是染。非染。	辨 其 性 相 差 別 文 言 於 有 違 犯 是 染 非 染 
T45n1907_001:0918b27	耎中上品。應當了知。欲。悲。雖所作業同。而	耎 中 上 品 應 當 了 知 欲 悲 雖 所 作 業 同 而 
T45n1907_001:0918b28	犯。無犯。異言有犯者。謂由四因。所犯諸事。	犯 無 犯 異 言 有 犯 者 謂 由 四 因 所 犯 諸 事 
T45n1907_001:0918b29	無違犯者。謂由三緣。所作諸事。三緣是何。謂	無 違 犯 者 謂 由 三 緣 所 作 諸 事 三 緣 是 何 謂 
T45n1907_001:0918c01	若彼心增上誑亂。若重苦受之所逼切。若未	若 彼 心 增 上 誑 亂 若 重 苦 受 之 所 逼 切 若 未 
T45n1907_001:0918c02	曾受淨戒律儀。此三無犯。通一切戒。別論無	曾 受 淨 戒 律 儀 此 三 無 犯 通 一 切 戒 別 論 無 
T45n1907_001:0918c03	犯。如文廣說。於有犯中。有其二聚。重內應	犯 如 文 廣 說 於 有 犯 中 有 其 二 聚 重 內 應 
T45n1907_001:0918c04	知。耎中上品。輕中當識。是染。非染。通而論	知 耎 中 上 品 輕 中 當 識 是 染 非 染 通 而 論 
T45n1907_001:0918c05	之。四因中。若由無知。及由放逸。所犯眾罪。	之 四 因 中 若 由 無 知 及 由 放 逸 所 犯 眾 罪 
T45n1907_001:0918c06	是不染污。若煩惱盛。及由輕慢。所犯眾罪。是	是 不 染 污 若 煩 惱 盛 及 由 輕 慢 所 犯 眾 罪 是 
T45n1907_001:0918c07	其染污。別論染不染者。亦依本文。可知。凡說	其 染 污 別 論 染 不 染 者 亦 依 本 文 可 知 凡 說 
T45n1907_001:0918c08	雖然。一二論者。且就初戒。以示其相。於一讚	雖 然 一 二 論 者 且 就 初 戒 以 示 其 相 於 一 讚 
T45n1907_001:0918c09	毀。有四差別。若為令彼赴信心故。自讚毀他。	毀 有 四 差 別 若 為 令 彼 赴 信 心 故 自讚毀他 
T45n1907_001:0918c10	是福非犯。若由放逸無記心故。自讚毀他。是	是 福 非 犯 若 由 放 逸 無 記 心 故 自讚毀他 是 
T45n1907_001:0918c11	犯非染。若於他人。有愛恚心。自讚毀他。是染	犯 非 染 若 於 他 人 有 愛 恚 心 自讚毀他 是 染 
T45n1907_001:0918c12	非重。若為貪求利養恭敬。自讚毀他。是重非	非 重 若 為 貪 求 利養恭敬 自讚毀他 是 重 非 
T45n1907_001:0918c13	輕。第四之中。有其三品。成三之由。亦有二	輕 第 四 之 中 有 其 三 品 成 三 之 由 亦 有 二 
T45n1907_001:0918c14	途。謂由事故。及由纏故。由纏故者。若纏現	途 謂 由 事 故 及 由 纏 故 由 纏 故 者 若 纏 現 
T45n1907_001:0918c15	行。非極猛利。或發慚愧。是為耎品。雖極猛	行 非 極 猛 利 或 發 慚 愧 是 為 耎 品 雖 極 猛 
T45n1907_001:0918c16	利。無慚無愧。未見為德。猶在中品。都無慚	利 無慚無愧 未 見 為 德 猶 在 中 品 都 無 慚 
T45n1907_001:0918c17	愧。深生愛樂。見是功德。是名上品。由事故	愧 深生愛樂 見 是 功 德 是 名 上 品 由 事 故 
T45n1907_001:0918c18	者。若毀別人。是為耎品。若毀一眾。即是中	者 若 毀 別 人 是 為 耎 品 若 毀 一 眾 即 是 中 
T45n1907_001:0918c19	品。普毀眾多。乃為上品。上品之內。罪非一	品 普 毀 眾 多 乃 為 上 品 上 品 之 內 罪 非 一 
T45n1907_001:0918c20	端。隨其難別。略示三雙。佛法內人。多依三	端 隨 其 難 別 略 示 三 雙 佛 法 內 人 多 依 三 
T45n1907_001:0918c21	學。起似佛道之魔事故。猶如師子身內之虫。	學 起 似 佛 道 之 魔 事 故 猶 如 師 子 身 內 之 虫 
T45n1907_001:0918c22	乃食師子。餘無能故。第一雙者。依於心學。有	乃 食 師 子 餘 無 能 故 第 一 雙 者 依 於 心 學 有 
T45n1907_001:0918c23	二類虫。食滅佛法。一由貪故。二由慢故。由貪	二 類 虫 食 滅 佛 法 一 由 貪 故 二 由 慢 故 由 貪 
T45n1907_001:0918c24	故者。如有一類。閑居靜慮。離諸散亂。攝心	故 者 如 有 一 類 閑 居 靜 慮 離 諸 散 亂 攝 心 
T45n1907_001:0918c25	禪門。由心澄靜。髣髴有見。或由邪神加力令	禪 門 由 心 澄 靜 髣 髴 有 見 或 由 邪 神 加 力 令 
T45n1907_001:0918c26	識。于時由自少聞不別邪正。又欲引致名利	識 于 時 由 自 少 聞 不 別 邪 正 又 欲 引 致 名 利 
T45n1907_001:0918c27	恭敬。隨所見識。令他聞知。耀諸世人。咸疑是	恭 敬 隨 所 見 識 令 他 聞 知 耀 諸 世 人 咸 疑 是 
T45n1907_001:0918c28	聖。此由獨揚似聖之迹。普抑諸僧。為無可歸。	聖 此 由 獨 揚 似 聖 之 迹 普 抑 諸 僧 為 無 可 歸 
T45n1907_001:0918c29	以破佛法。故得重罪。是謂諸僧之大賊也。由	以 破 佛 法 故 得 重 罪 是 謂 諸 僧 之 大 賊 也 由 
T45n1907_001:0919a01	慢故者。如有一類。長住深山。有所得心。修寂	慢 故 者 如 有 一 類 長 住 深 山 有所得心 修 寂 
T45n1907_001:0919a02	靜業。魔知彼心。可以動壞。發空中聲。讚其所	靜 業 魔 知 彼 心 可 以 動 壞 發 空 中 聲 讚 其 所 
T45n1907_001:0919a03	行。其人由是。起自高心。普抑諸僧住人間	行 其 人 由 是 起 自 高 心 普 抑 諸 僧 住 人 間 
T45n1907_001:0919a04	者。誰當稱美爾等所行。此人罪過重於前者。	者 誰 當 稱 美 爾 等 所 行 此 人 罪 過 重 於 前 者 
T45n1907_001:0919a05	是謂菩薩旃陀羅也。第二雙者。依於戒學。有	是 謂 菩 薩 旃 陀 羅 也 第 二 雙 者 依 於 戒 學 有 
T45n1907_001:0919a06	二類虫。食滅佛法。一坐邪戒。二坐正戒。坐邪	二 類 虫 食 滅 佛 法 一 坐 邪 戒 二 坐 正 戒 坐 邪 
T45n1907_001:0919a07	戒者。如有一類。性非質直或承邪戒。或自邪	戒 者 如 有 一 類 性 非 質 直 或 承 邪 戒 或 自 邪 
T45n1907_001:0919a08	念。不衣絲麻。不食五穀。變欲貪求利養恭敬。	念 不 衣 絲 麻 不 食 五 穀 變 欲 貪 求 利養恭敬 
T45n1907_001:0919a09	自揚無比。誑諸癡類。希望群愚咸仰己德。普	自 揚 無 比 誑 諸 癡 類 希 望 群 愚 咸 仰 己 德 普 
T45n1907_001:0919a10	抑一切無異迹者。由是內以傷真。外以亂人。	抑 一 切 無 異 迹 者 由 是 內 以 傷 真 外 以 亂 人 
T45n1907_001:0919a11	傷亂之罪。莫是為先也。坐正戒者。如有一類。	傷 亂 之 罪 莫 是 為 先 也 坐 正 戒 者 如 有 一 類 
T45n1907_001:0919a12	性是淺近。於世大運。多慢緩時。獨正其身。威	性 是 淺 近 於 世 大 運 多 慢 緩 時 獨 正 其 身 威 
T45n1907_001:0919a13	儀無缺。便起自高湋池之心。慢毀乘急戒緩	儀 無 缺 便 起 自 高 湋 池 之 心 慢 毀 乘 急 戒 緩 
T45n1907_001:0919a14	之眾。此人全其不善。以毀大禁。轉福為禍莫	之 眾 此 人 全 其 不 善 以 毀 大 禁 轉 福 為 禍 莫 
T45n1907_001:0919a15	斯為甚也。問邪戒之罪。應如所說。持正戒者。	斯 為 甚 也 問 邪 戒 之 罪 應 如 所 說 持 正 戒 者 
T45n1907_001:0919a16	何必是罪。所以然者。如有一類。內無諸纏。不	何 必 是 罪 所 以 然 者 如 有 一 類 內 無 諸 纏 不 
T45n1907_001:0919a17	觀餘人作與不作。唯察自心。獨持正戒。如是	觀 餘 人 作 與 不 作 唯 察 自 心 獨 持 正 戒 如 是 
T45n1907_001:0919a18	菩薩何由成犯。答若無染心。不在前說。而於	菩 薩 何 由 成 犯 答 若 無 染 心 不 在 前 說 而 於 
T45n1907_001:0919a19	此人。亦當分別。若由獨淨。令諸世人普於諸	此 人 亦 當 分 別 若 由 獨 淨 令 諸 世 人 普 於 諸 
T45n1907_001:0919a20	僧。謂非福田。利養尊重偏歸於己者。雖順聲	僧 謂 非 福 田 利 養 尊 重 偏 歸 於 己 者 雖 順 聲 
T45n1907_001:0919a21	聞自度心戒。而逆菩薩廣大心戒。如似聲聞	聞 自 度 心 戒 而 逆 菩 薩 廣 大 心 戒 如 似 聲 聞 
T45n1907_001:0919a22	無常等觀。雖於淺事是無顛倒。而於法身。即	無 常 等 觀 雖 於 淺 事 是 無 顛 倒 而 於 法 身 即 
T45n1907_001:0919a23	是顛倒。當知此中順逆亦爾。若由獨淨。令諸	是 顛 倒 當 知 此 中 順 逆 亦 爾 若 由 獨 淨 令 諸 
T45n1907_001:0919a24	世間未信者。信者增長。普於諸僧。平等供養	世 間 未 信 者 信 者 增 長 普 於 諸 僧 平 等 供 養 
T45n1907_001:0919a25	者。非直無犯。乃生多福。然由獨淨。居雜染	者 非 直 無 犯 乃 生 多 福 然 由 獨 淨 居 雜 染 
T45n1907_001:0919a26	間。以此望得不抑染眾。又欲令他生等敬心	間 以 此 望 得 不 抑 染 眾 又 欲 令 他 生 等 敬 心 
T45n1907_001:0919a27	者。猶如頭戴日月。而行而欲不却其暗者矣。	者 猶 如 頭 戴 日 月 而 行 而 欲 不 却 其 暗 者 矣 
T45n1907_001:0919a28	自非知機大聖。尠能得其然也。以是之故。古	自 非 知 機 大 聖 尠 能 得 其 然 也 以 是 之 故 古 
T45n1907_001:0919a29	之大賢。誡其子云。慎莫為善。其子對曰。當為	之 大 賢 誡 其 子 云 慎 莫 為 善 其 子 對 曰 當 為 
T45n1907_001:0919b01	惡乎。親言善尚莫為。況為惡乎。第三雙者。依	惡 乎 親 言 善 尚 莫 為 況 為 惡 乎 第 三 雙 者 依 
T45n1907_001:0919b02	於慧學。亦有二輩自讚毀他。一由增益。二由	於 慧 學 亦 有 二 輩 自讚毀他 一 由 增 益 二 由 
T45n1907_001:0919b03	損減。由增益者。如有一類。性是斜聽。為勝	損 減 由 增 益 者 如 有 一 類 性 是 斜 聽 為 勝 
T45n1907_001:0919b04	他。故廣習諸論。不解諸法皆離言說。執有如	他 故 廣 習 諸 論 不 解 諸 法 皆 離 言 說 執 有 如 
T45n1907_001:0919b05	言自性差別。為得名利。作如是言。我得三世	言 自性差別 為 得 名 利 作如是言 我 得 三 世 
T45n1907_001:0919b06	諸佛意說。若異此者。皆是漫說。此人於一讚	諸 佛 意 說 若異此者 皆 是 漫 說 此 人 於 一 讚 
T45n1907_001:0919b07	毀。具四顛倒。以亂佛法。故成重罪。謂其妄執	毀 具 四 顛 倒 以 亂 佛 法 故 成 重 罪 謂 其 妄 執 
T45n1907_001:0919b08	有所得見。去佛意遠。如天與地。而謂我近佛	有所得見 去 佛 意 遠 如 天 與 地 而 謂 我 近 佛 
T45n1907_001:0919b09	意。是一倒也。佛意甚深。絕諸戲論。於一切	意 是 一 倒 也 佛 意 甚 深 絕 諸 戲 論 於 一 切 
T45n1907_001:0919b10	法。都無所得。而引同己妄見。是二倒也。揚此	法 都 無 所 得 而 引 同 己 妄 見 是 二 倒 也 揚 此 
T45n1907_001:0919b11	二倒之見。加於四部之上。是三倒也。抑諸離	二 倒 之 見 加 於 四 部 之 上 是 三 倒 也 抑 諸 離 
T45n1907_001:0919b12	邊說者。置其偏執之下。是四倒也。由損減者。	邊 說 者 置 其 偏 執 之 下 是 四 倒 也 由 損 減 者 
T45n1907_001:0919b13	如有一類。稟性狹劣。不近善友。不廣學問。偏	如 有 一 類 稟 性 狹 劣 不 近 善 友 不 廣 學 問 偏 
T45n1907_001:0919b14	習一分甚深經論。不解密意。如言取義。誹撥	習 一 分 甚 深 經 論 不 解 密 意 如言取義 誹 撥 
T45n1907_001:0919b15	諸法依他道理。起如是見。作如是言。三性三	諸 法 依 他 道 理 起 如 是 見 作如是言 三 性 三 
T45n1907_001:0919b16	諦。但是教門。無所有中。施設假名。如是解	諦 但 是 教 門 無 所 有 中 施 設 假 名 如 是 解 
T45n1907_001:0919b17	者。乃為真實。異此說者。皆是戲論。由是獨特	者 乃 為 真 實 異 此 說 者 皆 是 戲 論 由 是 獨 特 
T45n1907_001:0919b18	自見。不受他言。設遇鈍根少聞之人。墮其所	自 見 不 受 他 言 設 遇 鈍 根 少 聞 之 人 墮 其 所 
T45n1907_001:0919b19	破。從其所言者。即云此人神明正直。若值聰	破 從 其 所 言 者 即 云 此 人 神 明 正 直 若 值 聰 
T45n1907_001:0919b20	明解文義者。巧能立義不墮其破者。便言脫	明 解 文 義 者 巧 能 立 義 不 墮 其 破 者 便 言 脫 
T45n1907_001:0919b21	失。謂是心惑。未識自解昧鈍。不能逐破意。謂	失 謂 是 心 惑 未 識 自 解 昧 鈍 不 能 逐 破 意 謂 
T45n1907_001:0919b22	彼心不正未及我意。此猶家狗逐[少/兔]。望不能	彼 心 不 正 未 及 我 意 此 猶 家 狗 逐 [少兔] 望 不 能 
T45n1907_001:0919b23	及。便謂已超。止而顧見。此損減人。略由二	及 便 謂 已 超 止 而 顧 見 此 損 減 人 略 由 二 
T45n1907_001:0919b24	愚。失壞佛法。故成重罪。一舉下為高愚。二特	愚 失 壞 佛 法 故 成 重 罪 一 舉 下 為 高 愚 二 特 
T45n1907_001:0919b25	小誹多愚。第一愚者。此損減見。於諸見中。最	小 誹 多 愚 第 一 愚 者 此 損 減 見 於 諸 見 中 最 
T45n1907_001:0919b26	在底下。亦復不如外道我見。其故何耶。此人	在 底 下 亦 復 不 如 外 道 我 見 其 故 何 耶 此 人 
T45n1907_001:0919b27	服最深藥變。成重病。重病之狀。極似無病。是	服 最 深 藥 變 成 重 病 重 病 之 狀 極 似 無 病 是 
T45n1907_001:0919b28	故更無醫術能治此病。亦尠有人自覺是患。	故 更 無 醫 術 能 治 此 病 亦 尠 有 人 自 覺 是 患 
T45n1907_001:0919b29	猶如根本無明極闇。與般若明。其狀極似同。	猶 如 根本無明 極 闇 與 般 若 明 其 狀 極 似 同 
T45n1907_001:0919c01	無能所故。俱無能所故。故彼無明最難可滅。	無 能 所 故 俱 無 能 所 故 故 彼 無 明 最 難 可 滅 
T45n1907_001:0919c02	此病難治當知。亦爾如偈說云。	此 病 難 治 當 知 亦 爾 如 偈 說 云 
T45n1907_001:0919c03	　為除有執故　　如來說其空	 為 除 有 執 故 如 來 說 其 空 
T45n1907_001:0919c04	　若人復執空　　諸佛所不化	 若 人 復 執 空 諸 佛 所 不 化 
T45n1907_001:0919c05	又復此見由其解昧。漫起信心。若依此見。修	又 復 此 見 由 其 解 昧 漫 起 信 心 若 依 此 見 修 
T45n1907_001:0919c06	心明利。必撥信心。墮大邪見。於無數劫。受無	心 明 利 必 撥 信 心 墮 大 邪 見 於 無 數 劫 受 無 
T45n1907_001:0919c07	間苦。是故菩薩。深悲餘人有隨彼。故預誡之	間 苦 是 故 菩 薩 深 悲 餘 人 有 隨 彼 故 預 誡 之 
T45n1907_001:0919c08	言。一切有智同梵行者。不應共住。一切外道	言 一 切 有 智 同 梵 行 者 不應共住 一 切 外 道 
T45n1907_001:0919c09	所起我見。雖有乖理。而無是患。如偈說云。	所 起 我 見 雖 有 乖 理 而 無 是 患 如 偈 說 云 
T45n1907_001:0919c10	　寧起我見　　如須彌山　　不起空見	 寧 起 我 見 如須彌山 不 起 空 見 
T45n1907_001:0919c11	　如毫釐許	 如 毫 釐 許 
T45n1907_001:0919c12	由此二緣。最在底下。而其不了。起增上慢。如	由 此 二 緣 最 在 底 下 而 其 不 了 起增上慢 如 
T45n1907_001:0919c13	似最下沙彌。謂居和上之上。是謂舉下為高	似 最 下 沙 彌 謂 居 和 上 之 上 是 謂 舉 下 為 高 
T45n1907_001:0919c14	愚也。第二愚者。然佛道廣蕩。無礙無方。永無	愚 也 第 二 愚 者 然 佛 道 廣 蕩 無 礙 無 方 永 無 
T45n1907_001:0919c15	所據。而無不當。故曰。一切他義。咸是佛義。	所 據 而 無 不 當 故 曰 一 切 他 義 咸 是 佛 義 
T45n1907_001:0919c16	百家之說。無所不是。八萬法門。皆可入理。而	百 家 之 說 無 所 不 是 八 萬 法 門 皆 可 入 理 而 
T45n1907_001:0919c17	彼自少聞。專其樣狹見。同其見者。乃為是得。	彼 自 少 聞 專 其 樣 狹 見 同 其 見 者 乃 為 是 得 
T45n1907_001:0919c18	異其見者。咸謂脫失。猶如有人葦管窺天。謂	異 其 見 者 咸 謂 脫 失 猶 如 有 人 葦 管 窺 天 謂 
T45n1907_001:0919c19	諸不窺其管內者。皆是不見蒼天者矣。是謂	諸 不 窺 其 管 內 者 皆 是 不 見 蒼 天 者 矣 是 謂 
T45n1907_001:0919c20	恃少誹多愚也。問如經言。譬如貧乞兒。日夜	恃 少 誹 多 愚 也 問 如 經 言 譬 如 貧 乞 兒 日 夜 
T45n1907_001:0919c21	數他寶。不能如說行。多聞亦如是。又言。若有	數 他 寶 不 能 如 說 行 多 聞 亦 如 是 又 言 若 有 
T45n1907_001:0919c22	人。分別婬癡及道。是人去佛遠。猶如天與地。	人 分 別 婬 癡 及 道 是 人 去 佛 遠 猶 如 天 與 地 
T45n1907_001:0919c23	是知。多聞。有所得見。與乞兒近。去佛道遠。	是 知 多 聞 有所得見 與 乞 兒 近 去 佛 道 遠 
T45n1907_001:0919c24	雖曰得意。而不忘言。橫求名利。甚於俗人。其	雖 曰 得 意 而 不 忘 言 橫 求 名 利 甚 於 俗 人 其 
T45n1907_001:0919c25	墮偏執。事在灼然。今我學徒。與彼一殊。不殉	墮 偏 執 事 在 灼 然 今 我 學 徒 與 彼 一 殊 不 殉 
T45n1907_001:0919c26	名利。捐棄俗事。深信佛法。專求寂靜。唯樂隨	名 利 捐 棄 俗 事 深 信 佛 法 專 求 寂 靜 唯 樂 隨 
T45n1907_001:0919c27	分修心潔行。驗知。所解非邪是正。且復執有	分 修 心 潔 行 驗 知 所 解 非 邪 是 正 且 復 執 有 
T45n1907_001:0919c28	曰增。取無曰損。我所趣宗。有無俱遣。蕭然無	曰 增 取 無 曰 損 我 所 趣 宗 有 無 俱 遣 蕭 然 無 
T45n1907_001:0919c29	據。以為所觀。觀狀如是。何得為患。答逐名利	據 以 為 所 觀 觀 狀 如 是 何 得 為 患 答 逐 名 利 
T45n1907_001:0920a01	者。背道向俗。其為失理。何足可惜。堪絕世綱	者 背 道 向 俗 其 為 失 理 何 足 可 惜 堪 絕 世 綱 
T45n1907_001:0920a02	將趣道方。服藥成疾。甚為可傷。且覺自迷者。	將 趣 道 方 服 藥 成 疾 甚 為 可 傷 且 覺 自 迷 者 
T45n1907_001:0920a03	非大迷矣。知自闇者。非極闇矣。設使子之心	非 大 迷 矣 知 自 闇 者 非 極 闇 矣 設 使 子 之 心 
T45n1907_001:0920a04	行。不違法相。實不誹撥依他道理故。不執	行 不 違 法 相 實 不 誹 撥 依 他 道 理 故 不 執 
T45n1907_001:0920a05	有。而不墮無者。子自離邊。玄會中道。不在彼	有 而 不 墮 無 者 子 自 離 邊 玄 會 中 道 不 在 彼 
T45n1907_001:0920a06	類。那忽跳赴。雖然自是於中。而非於他者。還	類 那 忽 跳 赴 雖 然 自 是 於 中 而 非 於 他 者 還 
T45n1907_001:0920a07	墮邊執。猶非淨智。如經偈云。不肯受他法。是	墮 邊 執 猶 非 淨 智 如 經 偈 云 不 肯 受 他 法 是 
T45n1907_001:0920a08	名愚癡人。諸有戲論者。皆是大愚人。若依自	名 愚 癡 人 諸 有 戲 論 者 皆 是 大 愚 人 若 依 自 
T45n1907_001:0920a09	是見。而生諸戲論。設此為淨智。無非淨智者。	是 見 而 生 諸 戲 論 設 此 為 淨 智 無 非 淨 智 者 
T45n1907_001:0920a10	設使子之見解。墮惡取空。誹撥緣有。亦撥其	設 使 子 之 見 解 墮 惡 取 空 誹 撥 緣 有 亦 撥 其 
T45n1907_001:0920a11	無。最極損減。而不自覺者。唯子最遠於道。乃	無 最 極 損 減 而 不 自 覺 者 唯 子 最 遠 於 道 乃 
T45n1907_001:0920a12	還近於乞兒。如乞兒云。多寶者富。少財者貧。	還 近 於 乞 兒 如 乞 兒 云 多 寶 者 富 少 財 者 貧 
T45n1907_001:0920a13	我無多寶。亦無少財。蕭然無據故。我非貧。	我 無 多 寶 亦 無 少 財 蕭 然 無 據 故 我 非 貧 
T45n1907_001:0920a14	今子所言與彼同焉。是知。無多無少者。最極	今 子 所 言 與 彼 同 焉 是 知 無 多 無 少 者 最 極 
T45n1907_001:0920a15	貧窮也。撥有撥無者。最極損減也。然至道昏	貧 窮 也 撥 有 撥 無 者 最 極 損 減 也 然 至 道 昏 
T45n1907_001:0920a16	昏。是非莫分。心行密密。得失難別。唯有宿殖	昏 是 非 莫 分 心 行 密 密 得 失 難 別 唯 有 宿 殖 
T45n1907_001:0920a17	善根。稟性質直。深伏我慢。近善知識者。仰依	善 根 稟 性 質 直 深 伏 我 慢 近 善 知 識 者 仰 依 
T45n1907_001:0920a18	聖典。以為心鏡。自內審觀。熟微心行。若能如	聖 典 以 為 心 鏡 自 內 審 觀 熟 微 心 行 若 能 如 
T45n1907_001:0920a19	是之人。幸治惡取空病。向說諸佛所不化者。	是 之 人 幸 治 惡 取 空 病 向 說 諸 佛 所 不 化 者 
T45n1907_001:0920a20	為欲令彼自內驚改。是故還為諸佛所化。以	為 欲 令 彼 自 內 驚 改 是 故 還 為 諸 佛 所 化 以 
T45n1907_001:0920a21	不化言。使自化故。問若欲於此自察心病。依	不 化 言 使 自 化 故 問 若 欲 於 此 自 察 心 病 依 
T45n1907_001:0920a22	何等典。最為明鏡。答如深密經言。若諸有情	何 等 典 最 為 明 鏡 答 如 深 密 經 言 若 諸 有 情 
T45n1907_001:0920a23	性。非質直。非質直類。雖有力能思擇廢立。而	性 非 質 直 非 質 直 類 雖 有 力 能 思 擇 廢 立 而 
T45n1907_001:0920a24	復安住自見取中。聽聞甚深密意之說。而無	復 安 住 自 見 取 中 聽 聞 甚 深 密 意 之 說 而 無 
T45n1907_001:0920a25	力能如實解了。於如是法。雖生信解。而於其	力 能 如 實 解 了 於 如 是 法 雖 生 信 解 而 於 其 
T45n1907_001:0920a26	義。隨言執著。謂一切法。決定皆無自性。決定	義 隨 言 執 著 謂 一 切 法 決 定 皆 無 自 性 決 定 
T45n1907_001:0920a27	不生不滅本來寂靜。自性涅槃。由此因緣。於	不生不滅 本來寂靜 自性涅槃 由此因緣 於 
T45n1907_001:0920a28	一切法。獲得無見及無相見。由是見故。撥一	一 切 法 獲 得 無 見 及 無 相 見 由 是 見 故 撥 一 
T45n1907_001:0920a29	切相。皆為無相。誹撥諸法三種性相。何以故。	切 相 皆 為 無 相 誹 撥 諸 法 三 種 性 相 何 以 故 
T45n1907_001:0920b01	由有依他起相及圓成實相故。故遍計所執	由 有 依他起相 及 圓成實相 故 故 遍 計 所 執 
T45n1907_001:0920b02	相。方可施設。若於二相。見為無相。彼亦誹撥	相 方 可 施 設 若 於 二 相 見 為 無 相 彼 亦 誹 撥 
T45n1907_001:0920b03	遍計所執相。是故。說彼誹撥三相。彼雖於法	遍計所執相 是 故 說 彼 誹 撥 三 相 彼 雖 於 法 
T45n1907_001:0920b04	起信解故。福德增長。然於非義。起執著故。退	起 信 解 故 福 德 增 長 然 於 非 義 起 執 著 故 退 
