T45n1906_001:0915a16	大賢法師義記序	大 賢 法 師 義 記 序 
T45n1906_001:0915a18	大薦福寺僧道峯撰	大 薦 福 寺 僧 道 峯 撰 
T45n1906_001:0915a19	吾觀。悠悠群動。營塵業。以增夫漏根。遑遑眾	吾 觀 悠 悠 群 動 營 塵 業 以 增 夫 漏 根 遑 遑 眾 
T45n1906_001:0915a20	人。攀垢緣。以津於惑樹。譬乎空花起滅火輪	人 攀 垢 緣 以 津 於 惑 樹 譬 乎 空 花 起 滅 火 輪 
T45n1906_001:0915a21	施馳。故真梵哀夫。運之以寶筏。世雄宰化授	施 馳 故 真 梵 哀 夫 運 之 以 寶 筏 世 雄 宰 化 授 
T45n1906_001:0915a22	之。以金章。若賾其精微。冥厥中祕。則超識妄	之 以 金 章 若 賾 其 精 微 冥 厥 中 祕 則 超 識 妄 
T45n1906_001:0915a23	海。遺捐汩紛。宅神靈卿。懌用恬止。自天鼓始	海 遺 捐 汩 紛 宅 神 靈 卿 懌 用 恬 止 自 天 鼓 始 
T45n1906_001:0915a24	奏於光曜。道實正真。世眼初滅於堅林。理唯	奏 於 光 曜 道 實 正 真 世 眼 初 滅 於 堅 林 理 唯 
T45n1906_001:0915a25	一悟。至乎千歲之後。二宗肇興。執有則遣空。	一 悟 至 乎 千 歲 之 後 二 宗 肇 興 執 有 則 遣 空 
T45n1906_001:0915a26	著空則遣有。各據邊岸。未涉中源。嗟乎德風。	著 空 則 遣 有 各 據 邊 岸 未 涉 中 源 嗟 乎 德 風 
T45n1906_001:0915a27	罷熏。仙露失味。大義將喪。孰云提綱。則五日	罷 熏 仙 露 失 味 大 義 將 喪 孰 云 提 綱 則 五 日 
T45n1906_001:0915a28	傳照於五天。還舒麗景。千部飛聲於千古。再	傳 照 於 五 天 還 舒 麗 景 千 部 飛 聲 於 千 古 再 
T45n1906_001:0915a29	樹洪勳。信夫繼燭傳燈。春蘭秋菊。然應五百。	樹 洪 勳 信 夫 繼 燭 傳 燈 春 蘭 秋 菊 然 應 五 百 
T45n1906_001:0915b01	而傑起。其誰歟。即東國大賢法師其人也。玄	而 傑 起 其 誰 歟 即 東 國 大 賢 法 師 其 人 也 玄 
T45n1906_001:0915b02	風清邈。道氣孤雄。龍章鳳雛之姿。河關缶聳	風 清 邈 道 氣 孤 雄 龍 章 鳳 雛 之 姿 河 關 缶 聳 
T45n1906_001:0915b03	之量。踰弱冠之歲。栽覺樹於青丘。將成立之	之 量 踰 弱 冠 之 歲 栽 覺 樹 於 青 丘 將 成 立 之 
T45n1906_001:0915b04	年。泛慈舟於陸海。而跡幽期遠。遂潛用。韜光	年 泛 慈 舟 於 陸 海 而 跡 幽 期 遠 遂 潛 用 韜 光 
T45n1906_001:0915b05	嗟義苑之彫榮。歎法橋之墜構。因述瑜伽纂	嗟 義 苑 之 彫 榮 歎 法 橋 之 墜 構 因 述 瑜 伽 纂 
T45n1906_001:0915b06	要三卷。造唯識決擇一卷菩薩戒本宗要一	要 三 卷 造 唯 識 決 擇 一 卷 菩 薩 戒 本 宗 要 一 
T45n1906_001:0915b07	卷。并本母頌一百行。用傳來葉。並詞妍理邃。	卷 并 本 母 頌 一 百 行 用 傳 來 葉 並 詞 妍 理 邃 
T45n1906_001:0915b08	文約義豐。彪炳之惠日增明。采[火*(?/示)]之覺山踰	文 約 義 豐 彪 炳 之 惠 日 增 明 采 [火示] 之 覺 山 踰 
T45n1906_001:0915b09	麗。庶使迷於岐路。直觀南指之車。昧其形顏。	麗 庶 使 迷 於 岐 路 直 觀 南 指 之 車 昧 其 形 顏 
T45n1906_001:0915b10	仰鑒西秦之鏡者爾。	仰 鑒 西 秦 之 鏡 者 爾 
T45n1906_001:0915b13	菩薩戒本宗要一卷	菩 薩 戒 本 宗 要 一 卷 
T45n1906_001:0915b15	青丘沙門大賢撰	青 丘 沙 門 大 賢 撰 
T45n1906_001:0915b16	　勇士交陳死如歸　　丈夫向道有何辭	 勇 士 交 陳 死 如 歸 丈 夫 向 道 有 何 辭 
T45n1906_001:0915b17	　初入恒難永無易　　由難若退何劫成	 初 入 恒 難 永 無 易 由 難 若 退 何 劫 成 
T45n1906_001:0915b18	　丈夫欲取三界王　　當揮智劍斷眾魔	 丈 夫 欲 取 三 界 王 當 揮 智 劍 斷 眾 魔 
T45n1906_001:0915b19	　吾於苦海誓無畏　　莊嚴戒筏攝諸方	 吾 於 苦 海 誓 無 畏 莊 嚴 戒 筏 攝 諸 方 
T45n1906_001:0915b20	今依此經釋持犯要。略有三門。一申經意門。	今 依 此 經 釋 持 犯 要 略 有 三 門 一 申 經 意 門 
T45n1906_001:0915b21	二能所成門。三修行差別門。	二 能 所 成 門 三 修 行 差 別 門 
T45n1906_001:0915b22	一經意者。經曰。梵網經盧遮那佛說菩薩心	一 經 意 者 經 曰 梵 網 經 盧 遮 那 佛 說 菩 薩 心 
T45n1906_001:0915b23	地品。梵者。能淨之義網者。攝有情義。謂此經	地 品 梵 者 能 淨 之 義 網 者 攝 有 情 義 謂 此 經 
T45n1906_001:0915b24	者。乃至有頂。生死大海拘持有情。終致無上	者 乃至有頂 生 死 大 海 拘 持 有 情 終 致 無 上 
T45n1906_001:0915b25	寂滅之岸。無盡饒益諸飢渴類。如世網故。由	寂 滅 之 岸 無 盡 饒 益 諸 飢 渴 類 如 世 網 故 由 
T45n1906_001:0915b26	斯世尊。因梵網說一部宗心。生長萬德名為	斯 世 尊 因 梵 網 說 一 部 宗 心 生 長 萬 德 名 為 
T45n1906_001:0915b27	心地。	心 地 
T45n1906_001:0915b28	二能所成門者。略有二門。一能成相門。二所	二 能 所 成 門 者 略 有 二 門 一 能 成 相 門 二 所 
T45n1906_001:0915b29	成相門。一能成者。如經曰。一切有心者。皆應	成 相 門 一 能 成 者 如 經 曰 一 切 有 心 者 皆 應 
T45n1906_001:0915c01	攝佛戒。謂無上乘。至深至廣。以至深故。極之	攝 佛 戒 謂 無 上 乘 至 深 至 廣 以 至 深 故 極 之 
T45n1906_001:0915c02	良難。由至廣故。一切成因。一塵微渧山海本	良 難 由 至 廣 故 一 切 成 因 一 塵 微 渧 山 海 本 
T45n1906_001:0915c03	故。由此諸佛制戒無礙。但解語者。所發之心。	故 由 此 諸 佛 制 戒 無 礙 但 解 語 者 所 發 之 心 
T45n1906_001:0915c04	由種姓力皆成因故。此復云何。謂如有一人	由種姓力 皆 成 因 故 此 復 云 何 謂 如 有 一 人 
T45n1906_001:0915c05	決定。希求斷一切惡。修一切善。盡有情界。至	決 定 希 求 斷 一 切 惡 修 一 切 善 盡 有 情 界 至 
T45n1906_001:0915c06	丈夫行。爾時於此解脫分心。由羯磨緣。得菩	丈 夫 行 爾 時 於 此 解 脫 分 心 由 羯 磨 緣 得 菩 
T45n1906_001:0915c07	薩戒。一切惡者。從初發心乃至菩提。所斷及	薩 戒 一 切 惡 者 從 初 發 心 乃至菩提 所 斷 及 
T45n1906_001:0915c08	捨一切雜染。一切善者。從初發心乃至菩提。	捨 一 切 雜 染 一 切 善 者 從 初 發 心 乃至菩提 
T45n1906_001:0915c09	所生及得一切清淨。有情界者。窮未來際所	所 生 及 得 一 切 清 淨 有 情 界 者 窮未來際 所 
T45n1906_001:0915c10	荷負。一切求道莫大斯。焉名至丈夫。何者鳳	荷 負 一 切 求 道 莫 大 斯 焉 名 至 丈 夫 何 者 鳳 
T45n1906_001:0915c11	凰之卵雖未破穀自在超境之勢。初發之心	凰 之 卵 雖 未 破 穀 自 在 超 境 之 勢 初 發 之 心 
T45n1906_001:0915c12	雖在纏裹。便有近物性蚊虻舉翼。而無翳	雖 在 纏 裹 便 有 近 物 性 蚊 虻 舉 翼 而 無 翳 
T45n1906_001:0915c13	天之用。二乘出染。而無覆生之功。如經迦葉	天 之 用 二 乘 出 染 而 無 覆 生 之 功 如 經 迦 葉 
T45n1906_001:0915c14	菩薩頌曰。發心畢竟二無別　如是二心先	菩 薩 頌 曰 發 心 畢 竟 二 無 別 如 是 二 心 先 
T45n1906_001:0915c15	心難　自未得度先度他　是故我禮初發心	心 難 自 未 得 度 先 度 他 是 故 我 禮 初 發 心 
T45n1906_001:0915c16	初發已為天人師　勝出聲聞及獨覺　如是	初 發 已 為 天 人 師 勝 出 聲 聞 及 獨 覺 如 是 
T45n1906_001:0915c17	發心過三界　是故得名最無上。二所成相	發 心 過 三 界 是 故 得 名 最 無 上 二 所 成 相 
T45n1906_001:0915c18	者。如經曰。一切菩薩已學。一切菩薩當學。一	者 如 經 曰 一切菩薩 已 學 一切菩薩 當 學 一 
T45n1906_001:0915c19	切菩薩今學。已略說波羅提木叉相貌。謂菩	切 菩 薩 今 學 已 略 說波羅提木叉 相 貌 謂 菩 
T45n1906_001:0915c20	薩戒依實取捨。不同餘戒佛。知時宜。說輕為	薩 戒 依 實 取 捨 不 同 餘 戒 佛 知 時 宜 說 輕 為 
T45n1906_001:0915c21	重。說重為輕。故於三際。戒相決定。然望聲	重 說 重 為 輕 故 於 三 際 戒 相 決 定 然 望 聲 
T45n1906_001:0915c22	聞。略有三種不同分相。一受不同分相。謂菩	聞 略 有 三 種 不 同 分 相 一 受 不 同 分 相 謂 菩 
T45n1906_001:0915c23	薩戒。除具七遮。一切受得。如本業說。六道眾	薩 戒 除 具 七 遮 一 切 受 得 如 本 業 說 六 道 眾 
T45n1906_001:0915c24	生受得戒。但解語得戒不失。佛子三世劫中。	生 受 得 戒 但 解 語 得 戒 不 失 佛 子 三 世 劫 中 
T45n1906_001:0915c25	一切佛常作是說。由此亦有自受之法。又雖	一 切 佛 常 作 是 說 由 此 亦 有 自 受 之 法 又 雖 
T45n1906_001:0915c26	犯重。若非七遮。現身得受。不同餘戒。如本業	犯 重 若 非 七 遮 現 身 得 受 不 同 餘 戒 如 本 業 
T45n1906_001:0915c27	說。十重有犯無悔。得使重受。瑜伽亦爾。然此	說 十 重 有 犯 無 悔 得 使 重 受 瑜 伽 亦 爾 然 此 
T45n1906_001:0915c28	經中。約犯七遮。密意總說。犯十重者。現身不	經 中 約 犯 七 遮 密 意 總 說 犯 十 重 者 現 身 不 
T45n1906_001:0915c29	得戒。二犯不同分相攝大乘說。菩薩性罪不	得 戒 二 犯 不 同 分 相 攝 大 乘 說 菩 薩 性 罪 不 
T45n1906_001:0916a01	現行故。與聲聞共相似。遮罪有現行故。與彼	現 行 故 與 聲 聞 共 相 似 遮 罪 有 現 行 故 與 彼 
T45n1906_001:0916a02	不共於此處所有聲聞犯菩薩不犯。有菩薩	不 共 於 此 處 所 有 聲 聞 犯 菩 薩 不 犯 有 菩 薩 
T45n1906_001:0916a03	犯聲聞不犯。菩薩具有身語心戒。聲聞唯有	犯 聲 聞 不 犯 菩 薩 具 有 身 語 心 戒 聲 聞 唯 有 
T45n1906_001:0916a04	身語二戒。謂人與行各有四句。人四句者。一	身 語 二 戒 謂 人 與 行 各 有 四 句 人 四 句 者 一 
T45n1906_001:0916a05	內邪外正。二外染內淨。三俱淨。四俱染。行四	內 邪 外 正 二 外 染 內 淨 三 俱 淨 四 俱 染 行 四 
T45n1906_001:0916a06	句者。一合小福而乖廣大。二順深遠而違淺	句 者 一 合 小 福 而 乖 廣 大 二 順 深 遠 而 違 淺 
T45n1906_001:0916a07	近。三俱順。四俱違。此中菩薩取中間二故。與	近 三 俱 順 四 俱 違 此 中 菩 薩 取 中 間 二 故 與 
T45n1906_001:0916a08	聲聞自有不同。由此亦有性罪現行。如瑜伽	聲 聞 自 有 不 同 由 此 亦 有 性 罪 現 行 如 瑜 伽 
T45n1906_001:0916a09	說。善權方便為利他故。於諸性罪。少分現行。	說 善權方便 為 利 他 故 於 諸 性 罪 少 分 現 行 
T45n1906_001:0916a10	而無所犯。反生功德。乃至廣說。若以至知。唯	而 無 所 犯 反 生 功 德 乃至廣說 若 以 至 知 唯 
T45n1906_001:0916a11	佛境界而隨分故。一切由心。不爾如何。自判	佛 境 界 而 隨 分 故 一 切 由 心 不 爾 如 何 自 判 
T45n1906_001:0916a12	地獄。以諸聖者已斷彼故。如契經言。菩薩知	地 獄 以 諸 聖 者 已 斷 彼 故 如 契 經 言 菩 薩 知 
T45n1906_001:0916a13	以破戒因緣。令人受持愛樂大乘。則得破戒。	以 破 戒 因 緣 令 人 受 持 愛 樂 大 乘 則 得 破 戒 
T45n1906_001:0916a14	菩薩爾時應作此念。我寧一劫若減一劫。墮	菩 薩 爾 時 應 作 此 念 我 寧 一 劫 若 減 一 劫 墮 
T45n1906_001:0916a15	無間獄。受此罪報。要令是人不退菩提。文殊	無 間 獄 受 此 罪 報 要 令 是 人 不 退 菩 提 文 殊 
T45n1906_001:0916a16	白佛言。為此毀戒。墮阿鼻獄。無有是處。佛讚	白 佛 言 為 此 毀 戒 墮 阿 鼻 獄 無 有 是 處 佛 讚 
T45n1906_001:0916a17	善哉。瑜伽亦同。問既生功德。何名性罪。答意	善 哉 瑜 伽 亦 同 問 既 生 功 德 何 名 性 罪 答 意 
T45n1906_001:0916a18	樂雖善。方便惡故。然處處說不染不犯。但由	樂 雖 善 方 便 惡 故 然 處 處 說 不 染 不 犯 但 由 
T45n1906_001:0916a19	意樂。不由方便。以方便時亦有染故。如說。在	意 樂 不由方便 以 方 便 時 亦 有 染 故 如 說 在 
T45n1906_001:0916a20	家慈心行婬。出家不爾。護聲聞故。問同受三	家 慈 心 行 婬 出 家 不 爾 護 聲 聞 故 問 同 受 三 
T45n1906_001:0916a21	聚。戒支應等。如何一事犯不犯別。答戒支雖	聚 戒 支 應 等 如 何 一 事 犯 不 犯 別 答 戒 支 雖 
T45n1906_001:0916a22	等。修有分齋。如不定性所知障性。隨其所望	等 修 有 分 齋 如 不 定 性 所 知 障 性 隨 其 所 望 
T45n1906_001:0916a23	染不染故。三捨不同分相。比丘五緣。菩薩四	染 不 染 故 三 捨 不 同 分 相 比 丘 五 緣 菩 薩 四 
T45n1906_001:0916a24	緣。如論廣說。又比丘三品犯重。皆捨淨戒。菩	緣 如 論 廣 說 又 比 丘 三 品 犯 重 皆 捨 淨 戒 菩 
T45n1906_001:0916a25	薩必由上品纏捨。如慈尊說。若諸菩薩。毀犯	薩 必 由 上 品 纏 捨 如 慈 尊 說 若 諸 菩 薩 毀 犯 
T45n1906_001:0916a26	四種他勝處法。數數現行都無慚愧。深生愛	四 種 他勝處法 數數現行 都 無 慚 愧 深 生 愛 
T45n1906_001:0916a27	樂。見是功德。當知說。名上品纏犯。非諸菩薩	樂 見 是 功 德 當 知 說 名 上 品 纏 犯 非 諸 菩 薩 
T45n1906_001:0916a28	暫一。現行他勝處法。便捨菩薩淨戒律儀。如	暫 一 現 行 他勝處法 便 捨 菩薩淨戒 律 儀 如 
T45n1906_001:0916a29	諸苾芻。又比丘戒。必總受持故。犯一重。便失	諸 苾 芻 又 比 丘 戒 必 總 受 持 故 犯 一 重 便 失 
T45n1906_001:0916b01	一切。菩薩不爾。如瑜伽言。菩薩戒中。無無	一 切 菩 薩 不 爾 如 瑜 伽 言 菩 薩 戒 中 無 無 
T45n1906_001:0916b02	餘犯。乃至廣說。謂上品纏雖破一重。不失餘	餘 犯 乃至廣說 謂 上 品 纏 雖 破 一 重 不 失 餘 
T45n1906_001:0916b03	故。猶如近事總受持一。雖名犯戒。而成其性。	故 猶 如 近 事 總 受 持 一 雖 名 犯 戒 而 成 其 性 
T45n1906_001:0916b04	如契經言。有而犯者。勝無不犯。有犯名菩薩。	如 契 經 言 有 而 犯 者 勝 無 不 犯 有 犯 名 菩 薩 
T45n1906_001:0916b05	無犯名外道。又初誘戒。由有一分受。亦有一	無 犯 名 外 道 又 初 誘 戒 由 有 一 分 受 亦 有 一 
T45n1906_001:0916b06	分持。如世尊言。受一戒。名一分優婆塞。菩薩	分 持 如 世 尊 言 受 一 戒 名 一 分 優 婆 塞 菩 薩 
T45n1906_001:0916b07	亦爾。隨分戒故。如契經言。有受一分戒。名一	亦 爾 隨 分 戒 故 如 契 經 言 有 受 一 分 戒 名 一 
T45n1906_001:0916b08	分菩薩。乃至十分。名具足受戒。又比丘戒。隨	分 菩 薩 乃 至 十 分 名 具 足 受 戒 又 比 丘 戒 隨 
T45n1906_001:0916b09	命即捨。菩薩不爾。雖轉餘生。戒隨遂故。廣說	命 即 捨 菩 薩 不 爾 雖 轉 餘 生 戒 隨 遂 故 廣 說 
T45n1906_001:0916b10	如論。又如經說。一切菩薩凡聖戒。盡心為	如 論 又 如 經 說 一切菩薩 凡 聖 戒 盡 心 為 
T45n1906_001:0916b11	體。是故心盡戒亦盡。心無盡故戒亦無盡。問	體 是 故 心 盡 戒 亦 盡 心 無 盡 故 戒 亦 無 盡 問 
T45n1906_001:0916b12	亦可菩薩。期願勝故。別受八戒。過日夜持。答	亦 可 菩 薩 期 願 勝 故 別 受 八 戒 過 日 夜 持 答 
T45n1906_001:0916b13	如支無過所制而受。時亦應然。寧過邊際。	如 支 無 過 所 制 而 受 時 亦 應 然 寧 過 邊 際 
T45n1906_001:0916b14	如觀經說。大王日日受八戒。問若爾。如時必	如 觀 經 說 大 王 日 日 受 八 戒 問 若 爾 如 時 必 
T45n1906_001:0916b15	應具支。或復如支亦可減時。是則違經。如說。	應 具 支 或 復 如 支 亦 可 減 時 是 則 違 經 如 說 
T45n1906_001:0916b16	我於一時。住恒河邊。迦旃延來作如是言。世	我 於 一 時 住 恒 河 邊 迦 旃 延 來 作如是言 世 
T45n1906_001:0916b17	尊。我教眾生。令受齊法。或一日。或一夜。或	尊 我 教 眾 生 令 受 齊 法 或 一 日 或 一 夜 或 
T45n1906_001:0916b18	一時。或一念。如是之人成齊不耶。我言。比	一 時 或 一 念 如 是 之 人 成 齊 不 耶 我 言 比 
T45n1906_001:0916b19	丘是人得善。不名持齋。我諸弟子。聞是說。已	丘 是 人 得 善 不 名 持 齋 我 諸 弟 子 聞 是 說 已 
T45n1906_001:0916b20	不解我意。唱言。如來說八戒齋具受乃得。答	不 解 我 意 唱 言 如 來 說 八 戒 齋 具 受 乃 得 答 
T45n1906_001:0916b21	一惡應遮。一支成戒。欲進定慧。不減其時。菩	一 惡 應 遮 一 支 成 戒 欲 進 定 慧 不 減 其 時 菩 
T45n1906_001:0916b22	薩七眾。隨順聲聞。八戒亦爾。別受如彼。如涅	薩 七 眾 隨 順 聲 聞 八 戒 亦 爾 別 受 如 彼 如 涅 
T45n1906_001:0916b23	槃經頌曰。若為無上道　一日一夜中　受	槃 經 頌 曰 若 為 無 上 道 一 日 一 夜 中 受 
T45n1906_001:0916b24	持八齋法　則生不動國。	持 八 齋 法 則 生 不 動 國 
T45n1906_001:0916b25	三修行差別門者。略有四門。一親近善士門。	三 修 行 差 別 門 者 略 有 四 門 一 親近善士 門 
T45n1906_001:0916b26	二聽門正法門。三如理作意門。四如說修行	二 聽 門 正 法 門 三 如理作意 門 四 如說修行 
T45n1906_001:0916b27	門。一近善士者。如世尊言。一切眾生。為大菩	門 一 近 善 士 者 如 世 尊 言 一 切 眾 生 為 大 菩 
T45n1906_001:0916b28	提近因緣者。無先善友。謂友有四。一順善違	提 近 因 緣 者 無 先 善 友 謂 友 有 四 一 順 善 違 
T45n1906_001:0916b29	惡。二順惡違善。三善惡皆順。四善惡俱違。此	惡 二 順 惡 違 善 三 善 惡 皆 順 四 善 惡 俱 違 此 
T45n1906_001:0916c01	中初一。應與事同。雖其惡者。以改為師。不以	中 初 一 應 與 事 同 雖 其 惡 者 以 改 為 師 不 以 
T45n1906_001:0916c02	同心斷金之友。開於額上之珠。使成菩提器。	同 心 斷 金 之 友 開 於 額 上 之 珠 使 成 菩 提 器 
T45n1906_001:0916c03	誰有不憑勝近而立其功者也。是故親近善	誰 有 不 憑 勝 近 而 立 其 功 者 也 是 故 親 近 善 
T45n1906_001:0916c04	士為先。二聞正法者。如契經言。設滿世界火。	士 為 先 二 聞 正 法 者 如 契 經 言 設 滿 世 界 火 
T45n1906_001:0916c05	必過要聞法。謂由一句。能斷苦輪故。聞半偈。	必 過 要 聞 法 謂 由 一 句 能 斷 苦 輪 故 聞 半 偈 
T45n1906_001:0916c06	魂沈雪山。然於四處。安住正念。然後請問。如	魂 沈 雪 山 然 於 四 處 安住正念 然 後 請 問 如 
T45n1906_001:0916c07	論應知。朝聞未夕要必流通。以他正行。為自	論 應 知 朝 聞 未 夕 要 必 流 通 以 他 正 行 為 自 
T45n1906_001:0916c08	萬行。以他成道。為自菩提。設誤正念。墮阿鼻	萬 行 以 他 成 道 為 自 菩 提 設 誤 正 念 墮 阿 鼻 
T45n1906_001:0916c09	獄。利一眾生。甘心受苦。如契經言。為一眾	獄 利 一 眾 生 甘 心 受 苦 如 契 經 言 為 一 眾 
T45n1906_001:0916c10	生。億劫修行。使無量眾。令度苦海。三如理作	生 億 劫 修 行 使 無 量 眾 令 度 苦 海 三 如 理 作 
T45n1906_001:0916c11	意者。謂觀四事。先治四倒。一者諸行無常。生	意 者 謂 觀 四 事 先 治 四 倒 一 者 諸行無常 生 
T45n1906_001:0916c12	必滅故。諸盛歸衰。非究竟故。二者有漏皆苦。	必 滅 故 諸 盛 歸 衰 非 究 竟 故 二 者 有 漏 皆 苦 
T45n1906_001:0916c13	由三苦故。然以愛網纏生死輪。合離毒刃之	由 三 苦 故 然 以 愛 網 纏 生 死 輪 合 離 毒 刃 之 
T45n1906_001:0916c14	所割裂。憂苦火箭之所射然。廣說如論。三者	所 割 裂 憂 苦 火 箭 之 所 射 然 廣 說 如 論 三 者 
T45n1906_001:0916c15	三界。不淨雜染性故。然似淨現如怨誑親。諸	三 界 不 淨 雜 染 性 故 然 似 淨 現 如 怨 誑 親 諸 
T45n1906_001:0916c16	不淨想。如論廣說。四者諸法無我。二我空故。	不 淨 想 如 論 廣 說 四 者 諸法無我 二 我 空 故 
T45n1906_001:0916c17	謂諸蘊法生滅為身。起不言起。滅無滅想。諸	謂 諸 蘊 法 生 滅 為 身 起 不 言 起 滅 無 滅 想 諸 
T45n1906_001:0916c18	法一相。所謂無相。如幻緣生。無自性故。無性	法 一 相 所 謂 無 相 如 幻 緣 生 無 自 性 故 無 性 
T45n1906_001:0916c19	之性。即諸法性。雖不出相。莫見其軀。雖在言	之 性 即 諸 法 性 雖 不 出 相 莫 見 其 軀 雖 在 言 
T45n1906_001:0916c20	裏。未談其狀。四如說修行者。誓起十地。遠志	裏 未 談 其 狀 四 如說修行 者 誓 起 十 地 遠 志 
T45n1906_001:0916c21	菩提。出家辭別所愛之類。掃衣量鉢如法受	菩 提 出 家 辭 別 所 愛 之 類 掃 衣 量 鉢 如 法 受 
T45n1906_001:0916c22	持。樹百姓門以為家糧戒定慧中。如說修行。	持 樹 百 姓 門 以 為 家 糧 戒 定 慧 中 如說修行 
T45n1906_001:0916c23	此復云何。謂於四門善巧。菩薩能淨戒行。妙	此 復 云 何 謂 於 四 門 善 巧 菩 薩 能 淨 戒 行 妙 
T45n1906_001:0916c24	具資糧。一護正念門。二波羅密多勝門。三	具 資 糧 一 護 正 念 門 二 波羅密多 勝 門 三 
T45n1906_001:0916c25	輕重性門。四持犯相門。一護正念者。謂於可	輕 重 性 門 四 持 犯 相 門 一 護 正 念 者 謂 於 可 
T45n1906_001:0916c26	愛。應作此念。諸欲無飽。如枯骨等。乃至厄如	愛 應 作 此 念 諸 欲 無 飽 如 枯 骨 等 乃 至 厄 如 
T45n1906_001:0916c27	樹端爛果。如羅剎女。少味多災。遍害於世出	樹 端 爛 果 如 羅 剎 女 少 味 多 災 遍 害 於 世 出 
T45n1906_001:0916c28	世義利。於此不忍。何盡苦際。若對相違。應作	世 義 利 於 此 不 忍 何 盡 苦 際 若 對 相 違 應 作 
T45n1906_001:0916c29	此念。雖諸有情一如來藏。而迷自心。計為他	此 念 雖 諸 有 情 一 如 來 藏 而 迷 自 心 計 為 他 
T45n1906_001:0917a01	故。妄生喜恚。沈於苦流。自業受果。引他為	故 妄 生 喜 恚 沈 於 苦 流 自 業 受 果 引 他 為 
T45n1906_001:0917a02	緣。令墮惡趣。深是自過。我曾尚求無義利事。	緣 令 墮 惡 趣 深 是 自 過 我 曾 尚 求 無 義 利 事 
T45n1906_001:0917a03	不顧地獄。長受大苦。況為菩提。暫時小苦而	不 顧 地 獄 長 受 大 苦 況 為 菩 提 暫 時 小 苦 而 
T45n1906_001:0917a04	不忍受。若在中容。應作此念。命如放箭。俯仰	不 忍 受 若 在 中 容 應 作 此 念 命 如 放 箭 俯 仰 
T45n1906_001:0917a05	一生。今日欲盡。何義利成。無始供身。身所反	一 生 今 日 欲 盡 何 義 利 成 無 始 供 身 身 所 反 
T45n1906_001:0917a06	害。無邊生死。無所不羈。如世尊言。大地無有	害 無 邊 生 死 無 所 不 羈 如 世 尊 言 大 地 無 有 
T45n1906_001:0917a07	汝等長夜。不受無量生死苦處。一人一劫所	汝 等 長 夜 不 受 無 量 生 死 苦 處 一 人 一 劫 所 
T45n1906_001:0917a08	受身骨。不爛壞者。其聚量。齊王舍城側廣博	受 身 骨 不 爛 壞 者 其 聚 量 齊 王 舍 城 側 廣 博 
T45n1906_001:0917a09	脇山。所飲乳汁如四海水。身所出血。復愛別	脇 山 所 飲 乳 汁 如 四 海 水 身 所 出 血 復 愛 別 
T45n1906_001:0917a10	離所泣之淚。多四大海。大地草木盡斬為籌。	離 所 泣 之 淚 多 四 大 海 大 地 草 木 盡 斬 為 籌 
T45n1906_001:0917a11	以數父母。亦不可盡。無量劫來。或在地獄。或	以 數 父 母 亦 不 可 盡 無 量 劫 來 或 在 地 獄 或 
T45n1906_001:0917a12	在畜生。或在餓鬼。所受行苦。不可稱計。如是	在 畜 生 或 在 餓 鬼 所 受 行 苦 不可稱計 如 是 
T45n1906_001:0917a13	思惟。夙夜匪懈。乃至中夜。右脇而臥。住光明	思 惟 夙 夜 匪 懈 乃 至 中 夜 右 脇 而 臥 住 光 明 
T45n1906_001:0917a14	想。如野鹿寐。如坐禪經曰。煩惱深無底　生	想 如 野 鹿 寐 如 坐 禪 經 曰 煩 惱 深 無 底 生 
T45n1906_001:0917a15	死海無邊　度苦船未立　云何得睡眠。二	死 海 無 邊 度 苦 船 未 立 云 何 得 睡 眠 二 
T45n1906_001:0917a16	波羅密多攝門者。略有二門。一總性攝門。二	波羅密多 攝 門 者 略 有 二 門 一 總 性 攝 門 二 
T45n1906_001:0917a17	別相攝門。初者諸行。由作不作應作四句。七	別 相 攝 門 初 者 諸 行 由 作 不 作 應 作 四 句 七 
T45n1906_001:0917a18	種最勝之所攝受。乃名到彼岸故。廣說如論。	種 最 勝 之 所 攝 受 乃 名 到 彼 岸 故 廣 說 如 論 
T45n1906_001:0917a19	然到彼岸各有九相。如瑜伽說。應當善巧。後	然 到 彼 岸 各 有 九 相 如 瑜 伽 說 應 當 善 巧 後 
T45n1906_001:0917a20	者有三種。一因果。攝前為後依故。順前句攝。	者 有 三 種 一 因 果 攝 前 為 後 依 故 順 前 句 攝 
T45n1906_001:0917a21	後淨持前故。順後句攝。雖別別修。由引持故。	後 淨 持 前 故 順 後 句 攝 雖 別 別 修 由 引 持 故 
T45n1906_001:0917a22	一一自然遍修一切。二者體攝修一一行。一	一 一 自 然 遍 修 一 切 二 者 體 攝 修 一 一 行 一 
