T45n1907_001:0920b05	失智慧。智慧退故。退失廣大無量善法。瑜伽	失 智 慧 智 慧 退 故 退 失 廣大無量 善 法 瑜 伽 
T45n1907_001:0920b06	論云。如有一類。聞說難解空性相應。未極顯	論 云 如 有 一 類 聞 說 難 解 空性相應 未 極 顯 
T45n1907_001:0920b07	了密意趣義。甚深經典。不能如實解所說義	了 密意趣義 甚深經典 不 能 如 實 解 所 說 義 
T45n1907_001:0920b08	趣。起不如理虛妄分別。由不巧便。所引尋思。	趣 起 不 如 理 虛妄分別 由 不 巧 便 所 引 尋 思 
T45n1907_001:0920b09	起如是見。立如是論。一切唯假。是為真實。若	起 如 是 見 立如是論 一 切 唯 假 是 為 真 實 若 
T45n1907_001:0920b10	作是觀。名為正觀。彼於虛假所依所處。實有	作 是 觀 名 為 正 觀 彼 於 虛 假 所 依 所 處 實 有 
T45n1907_001:0920b11	唯事。撥為非有。是則一切虛假皆無。何當得	唯 事 撥 為 非 有 是 則 一 切 虛 假 皆 無 何 當 得 
T45n1907_001:0920b12	有一切唯假。是為真實。由此道理。彼於真實。	有 一 切 唯 假 是 為 真 實 由此道理 彼 於 真 實 
T45n1907_001:0920b13	及與虛假。二種俱謗。都無所有。當知。是名最	及 與 虛 假 二 種 俱 謗 都無所有 當 知 是 名 最 
T45n1907_001:0920b14	極無者。如是無者。一切有智同梵行者。不應	極 無 者 如 是 無 者 一 切 有 智 同 梵 行 者 不 應 
T45n1907_001:0920b15	共住。世尊依此密意。說言。寧如一類起我見	共 住 世 尊 依 此 密 意 說 言 寧 如 一 類 起 我 見 
T45n1907_001:0920b16	者。不如一類惡取空者。云何名為惡取空者。	者 不 如 一 類 惡取空者 云 何 名 為 惡取空者 
T45n1907_001:0920b17	謂有沙門或婆羅門。由彼故。空亦不信受。於	謂 有 沙 門 或 婆 羅 門 由 彼 故 空 亦 不 信 受 於 
T45n1907_001:0920b18	此而空。亦不信受。如是名為惡取空者。何以	此 而 空 亦 不 信 受 如 是 名 為 惡取空者 何 以 
T45n1907_001:0920b19	故。由彼故空。彼實是無。於此而空。此實是	故 由彼故空 彼 實 是 無 於此而空 此 實 是 
T45n1907_001:0920b20	有。由此道理。可說為空。若說一切都無所有。	有 由此道理 可 說 為 空 若 說 一切都無所有 
T45n1907_001:0920b21	何處何者。何故名空。亦不應言由此於此即	何 處 何 者 何 故 名 空 亦 不 應 言 由 此 於 此 即 
T45n1907_001:0920b22	說為空。是故名為惡取空者。乃至廣說。且止	說 為 空 是 故 名 為 惡取空者 乃至廣說 且 止 
T45n1907_001:0920b23	傍論。還結本宗。持犯輕重略相如前。次第二	傍 論 還 結 本 宗 持 犯 輕 重 略 相 如 前 次 第 二 
T45n1907_001:0920b24	明持犯淺深者。乘前所說讚毀之戒。以顯持	明 持 犯 淺 深 者 乘 前 所 說 讚 毀 之 戒 以 顯 持 
T45n1907_001:0920b25	犯淺深之相。如多羅戒本云。常代眾生。受加	犯 淺 深 之 相 如 多 羅 戒 本 云 常 代 眾 生 受 加 
T45n1907_001:0920b26	毀辱。惡事自向己。好事與他人。若自讚揚己	毀 辱 惡 事 自 向 己 好 事 與 他 人 若 自 讚 揚 己 
T45n1907_001:0920b27	德。隱他人好事。令他受毀辱者。是為波羅夷	德 隱 他 人 好 事 令 他 受 毀 辱 者 是 為 波 羅 夷 
T45n1907_001:0920b28	罪。依此一文。淺深解何者。下士聞之。齊言取	罪 依 此 一 文 淺 深 解 何 者 下 士 聞 之 齊 言 取 
T45n1907_001:0920b29	解。自毀讚他。必是福業。自讚毀他。定為犯	解 自 毀 讚 他 必 是 福 業 自讚毀他 定 為 犯 
T45n1907_001:0920c01	罪。如是一向隨言取故。將修其福。福行少而	罪 如 是 一 向 隨 言 取 故 將 修 其 福 福 行 少 而 
T45n1907_001:0920c02	罪業多。欲捨其罪。却罪一而除福三。是謂淺	罪 業 多 欲 捨 其 罪 却 罪 一 而 除 福 三 是 謂 淺 
T45n1907_001:0920c03	識持犯過也。上士聞之掬解意趣。舉一隅。便	識 持 犯 過 也 上 士 聞 之 掬 解 意 趣 舉 一 隅 便 
T45n1907_001:0920c04	以三隅。而變就一文。每用四句而判。由是審	以 三 隅 而 變 就 一 文 每 用 四 句 而 判 由 是 審 
T45n1907_001:0920c05	別無所濫故。無福而遺。無罪而辨。是謂深解	別 無 所 濫 故 無 福 而 遺 無 罪 而 辨 是 謂 深 解 
T45n1907_001:0920c06	持犯德也。言四句而判者。或有自毀讚他。是	持 犯 德 也 言 四 句 而 判 者 或 有 自 毀 讚 他 是 
T45n1907_001:0920c07	福自讚毀他是罪。或有自毀讚他是罪。自讚	福 自讚毀他 是 罪 或 有 自 毀 讚 他 是 罪 自 讚 
T45n1907_001:0920c08	毀他是福。或有若毀讚若讚毀。或罪或福。或	毀 他 是 福 或 有 若 毀 讚 若 讚 毀 或 罪 或 福 或 
T45n1907_001:0920c09	有非毀讚非讚毀。或福或罪。第一句者。如人	有 非 毀 讚 非 讚 毀 或 福 或 罪 第 一 句 者 如 人 
T45n1907_001:0920c10	深愍眾生受辱。欲引他所受辱向己。推自所	深 愍 眾 生 受 辱 欲 引 他 所 受 辱 向 己 推 自 所 
T45n1907_001:0920c11	應受榮與他。此意自毀讚他。是福。若欲自受	應 受 榮 與 他 此 意 自 毀 讚 他 是 福 若 欲 自 受 
T45n1907_001:0920c12	其榮。令他受辱。此意自讚毀他。是罪。第二句	其 榮 令 他 受 辱 此 意 自讚毀他 是 罪 第 二 句 
T45n1907_001:0920c13	者。如知時世風俗所習多。憎自讚毀他之人。	者 如 知 時 世 風 俗 所 習 多 憎 自讚毀他 之 人 
T45n1907_001:0920c14	每敬自謙揚他之士。又知毀彼彼必呰我。我	每 敬 自 謙 揚 他 之 士 又 知 毀 彼 彼 必 呰 我 我 
T45n1907_001:0920c15	若讚他他還美我。由此知故。巧求自高。自毀	若 讚 他 他 還 美 我 由 此 知 故 巧 求 自 高 自 毀 
T45n1907_001:0920c16	讚他。是為重罪。若知他人所執非理。可捨。自	讚 他 是 為 重 罪 若 知 他 人 所 執 非 理 可 捨 自 
T45n1907_001:0920c17	內所解是道。應修直欲建立佛法。饒益有情。	內 所 解 是 道 應 修 直 欲 建 立 佛 法 饒益有情 
T45n1907_001:0920c18	自讚毀他。是為大福。第三句者。如有一類性。	自讚毀他 是 為 大 福 第 三 句 者 如 有 一 類 性 
T45n1907_001:0920c19	多誑偽。為欲誑惑世間諸人。凌他所長。覆自	多 誑 偽 為 欲 誑 惑 世 間 諸 人 凌 他 所 長 覆 自 
T45n1907_001:0920c20	所短。由此意故。作矯亂言。毀己小長為過。讚	所 短 由 此 意 故 作 矯 亂 言 毀 己 小 長 為 過 讚 
T45n1907_001:0920c21	他所短為功。揚己多短為德。抑他所長為失。	他 所 短 為 功 揚 己 多 短 為 德 抑 他 所 長 為 失 
T45n1907_001:0920c22	又有一類。稟性質直。為欲開導世間諸人。識	又 有 一 類 稟 性 質 直 為 欲 開 導 世 間 諸 人 識 
T45n1907_001:0920c23	善別惡。捨罪修福。由斯志故。直言無僻。見自	善 別 惡 捨 罪 修 福 由 斯 志 故 直 言 無 僻 見 自 
T45n1907_001:0920c24	惡。而必呰。聞他善。而即歎。覺己德。而還褒。	惡 而 必 呰 聞 他 善 而 即 歎 覺 己 德 而 還 褒 
T45n1907_001:0920c25	知彼罪而直貶。前人毀讚揚抑。直是誑諂之	知 彼 罪 而 直 貶 前 人 毀 讚 揚 抑 直 是 誑 諂 之 
T45n1907_001:0920c26	罪。後士呰歎褒貶。並為忠直之福也。第四句	罪 後 士 呰 歎 褒 貶 並 為 忠 直 之 福 也 第 四 句 
T45n1907_001:0920c27	者。如有高士性。是弘懿放神苞朴。不知端兒。	者 如 有 高 士 性 是 弘 懿 放 神 苞 朴 不 知 端 兒 
T45n1907_001:0920c28	混禍福。而歸一。忘彼我。為無二。其神常樂。	混 禍 福 而 歸 一 忘 彼 我 為 無 二 其 神 常 樂 
T45n1907_001:0920c29	遊是處故。亦不自毀讚他。亦不自揚抑彼。又	遊 是 處 故 亦 不 自 毀 讚 他 亦 不 自 揚 抑 彼 又 
T45n1907_001:0921a01	有下愚稟性鈍朴。莫知是非。難別菽麥。不識	有 下 愚 稟 性 鈍 朴 莫 知 是 非 難 別 菽 麥 不 識 
T45n1907_001:0921a02	善之為善。不了惡之為惡。其意常昏。忘憎愛	善 之 為 善 不 了 惡 之 為 惡 其 意 常 昏 忘 憎 愛 
T45n1907_001:0921a03	故。亦無自謙美他。復無自褒貶他。此為下愚	故 亦 無 自 謙 美 他 復 無 自 褒 貶 他 此 為 下 愚 
T45n1907_001:0921a04	渾鈍之罪。彼是上智純朴之福也。是謂四句	渾 鈍 之 罪 彼 是 上 智 純 朴 之 福 也 是 謂 四 句 
T45n1907_001:0921a05	以。判罪福。依前兩句。則福業變作重患。罪行	以 判 罪 福 依 前 兩 句 則 福 業 變 作 重 患 罪 行 
T45n1907_001:0921a06	更為大善。尋後二句。則誑語。與忠談無隔。上	更 為 大 善 尋 後 二 句 則 誑 語 與 忠 談 無 隔 上 
T45n1907_001:0921a07	智。共下愚同迹。是知。行者持犯之要。只應微	智 共 下 愚 同 迹 是 知 行 者 持 犯 之 要 只 應 微 
T45n1907_001:0921a08	察自之得失。不可輒判他之德患。持犯淺深	察 自 之 得 失 不 可 輒 判 他 之 德 患 持 犯 淺 深 
T45n1907_001:0921a09	意趣然矣。第三明究竟持犯者。雖依如前所	意 趣 然 矣 第 三 明 究 竟 持 犯 者 雖 依 如 前 所 
T45n1907_001:0921a10	說法門。能識輕重之性。兼知淺深之狀。而於	說 法 門 能 識 輕 重 之 性 兼 知 淺 深 之 狀 而 於 
T45n1907_001:0921a11	戒相。不如實解。於罪非罪。未離二邊者。不能	戒 相 不 如 實 解 於 罪 非 罪 未 離 二 邊 者 不 能 
T45n1907_001:0921a12	究竟持而無犯。不趣清淨戒波羅蜜。其故何	究 竟 持 而 無 犯 不 趣 清 淨 戒 波 羅 蜜 其 故 何 
T45n1907_001:0921a13	耶。然戒不自生。必託眾緣。故決無自相。即緣	耶 然 戒 不 自 生 必 託 眾 緣 故 決 無 自 相 即 緣 
T45n1907_001:0921a14	非戒。離緣無戒。除即除離。不得中間。如是求	非 戒 離 緣 無 戒 除 即 除 離 不 得 中 間 如 是 求 
T45n1907_001:0921a15	戒。永不是有。可言自性。不成就故。而託眾	戒 永 不 是 有 可 言 自 性 不 成 就 故 而 託 眾 
T45n1907_001:0921a16	緣。亦不無戒。非如兔角。無因緣故。如說戒	緣 亦 不 無 戒 非 如 兔 角 無 因 緣 故 如 說 戒 
T45n1907_001:0921a17	相。罪相亦爾。如戒罪相。人相亦然。若於此	相 罪 相 亦 爾 如 戒 罪 相 人 相 亦 然 若 於 此 
T45n1907_001:0921a18	中。依不是有。見都無者。雖謂無犯。而永失	中 依 不 是 有 見 都 無 者 雖 謂 無 犯 而 永 失 
T45n1907_001:0921a19	戒。誹撥戒之唯事相故。又於此中。依其不無。	戒 誹 撥 戒 之 唯 事 相 故 又 於 此 中 依 其 不 無 
T45n1907_001:0921a20	計是有者。雖曰能持。持即是犯。違逆戒之如	計 是 有 者 雖 曰 能 持 持 即 是 犯 違 逆 戒 之 如 
T45n1907_001:0921a21	實相故。菩薩修戒。則不如是。雖不計有能持	實 相 故 菩 薩 修 戒 則 不 如 是 雖 不 計 有 能 持 
T45n1907_001:0921a22	所持。而不誹撥戒之唯事。是故終無失戒巨	所 持 而 不 誹 撥 戒 之 唯 事 是 故 終 無 失 戒 巨 
T45n1907_001:0921a23	過。雖不見無罪與非罪。而不違逆戒之實相。	過 雖 不 見 無 罪 與 非 罪 而 不 違 逆 戒 之 實 相 
T45n1907_001:0921a24	是故永離犯戒細罪。由是巧便深智方便。永	是 故 永 離 犯 戒 細 罪 由 是 巧 便 深 智 方 便 永 
T45n1907_001:0921a25	忘三輪。不墮二邊。方趣具足戒波羅蜜。如經	忘 三 輪 不墮二邊 方 趣 具 足 戒 波 羅 蜜 如 經 
T45n1907_001:0921a26	言。罪。非罪。不可得故。應具足戒波羅蜜。戒	言 罪 非 罪 不 可 得 故 應 具 足 戒 波 羅 蜜 戒 
T45n1907_001:0921a27	本云。戒光從口出。有緣。非無因。非色。非心。	本 云 戒 光 從 口 出 有 緣 非 無 因 非 色 非 心 
T45n1907_001:0921a28	非有。非無。非因果法。諸佛之本原。菩薩之根	非 有 非 無 非 因 果 法 諸 佛 之 本 原 菩 薩 之 根 
T45n1907_001:0921a29	本。此中言戒光者。為顯戒之與光。無二無別。	本 此 中 言 戒 光 者 為 顯 戒 之 與 光 無 二 無 別 
T45n1907_001:0921b01	明淨雜染同一味故。故緣戒光。顯戒實相。戒	明 淨 雜 染 同 一 味 故 故 緣 戒 光 顯 戒 實 相 戒 
T45n1907_001:0921b02	無自性。必藉他緣故。曰有緣。有緣之言。非據	無 自 性 必 藉 他 緣 故 曰 有 緣 有 緣 之 言 非 據 
T45n1907_001:0921b03	是有。直顯不無其所從因。故曰非無因。非無	是 有 直 顯 不 無 其 所 從 因 故 曰 非 無 因 非 無 
T45n1907_001:0921b04	因戒性。非質礙。亦非緣慮。故曰非色非心。雖	因 戒 性 非 質 礙 亦 非 緣 慮 故 曰 非 色 非 心 雖 
T45n1907_001:0921b05	非色心。而離色心。永不可得。雖不可得。而非	非 色 心 而 離 色 心 永 不 可 得 雖 不 可 得 而 非 
T45n1907_001:0921b06	無戒。故曰非有非無。雖非無戒。而離果。無	無 戒 故 曰 非有非無 雖 非 無 戒 而 離 果 無 
T45n1907_001:0921b07	因。離因。無果。故曰非因果法。戒為因性。雖	因 離 因 無 果 故 曰 非 因 果 法 戒 為 因 性 雖 
T45n1907_001:0921b08	不可得。而諸佛果。必藉戒因。故言諸佛之本	不 可 得 而 諸 佛 果 必 藉 戒 因 故 言 諸 佛 之 本 
T45n1907_001:0921b09	原也。戒為果性。雖不可得。而戒要藉菩提心	原 也 戒 為 果 性 雖 不 可 得 而 戒 要 藉 菩 提 心 
T45n1907_001:0921b10	因。故言菩薩之根本也。問戒相如是。甚深難	因 故 言 菩 薩 之 根 本 也 問 戒 相 如 是 甚 深 難 
T45n1907_001:0921b11	解。解之尚難。況乎修行。故知。如前所說行	解 解 之 尚 難 況 乎 修 行 故 知 如前所說 行 
T45n1907_001:0921b12	相。唯是大地菩薩所修。不關諸新發意所行。	相 唯 是 大 地 菩 薩 所 修 不 關 諸 新 發 意 所 行 
T45n1907_001:0921b13	答經中。正答如汝問。言菩薩從初發意已來。	答 經 中 正 答 如 汝 問 言 菩 薩 從 初 發 意 已 來 
T45n1907_001:0921b14	常行無所得法。因無所得法。故修布施持戒。	常 行 無 所 得 法 因 無 所 得 法 故 修 布 施 持 戒 
T45n1907_001:0921b15	乃至因無所得法。故修智慧。此答意者。若使	乃 至 因 無 所 得 法 故 修 智 慧 此 答 意 者 若 使 
T45n1907_001:0921b16	彼行。由未曾修。難可行故。今不修者。今不習	彼 行 由 未 曾 修 難 可 行 故 今 不 修 者 今 不 習 
T45n1907_001:0921b17	故。後亦不修。如是久久。彌在其難。故令從初	故 後 亦 不 修 如 是 久 久 彌 在 其 難 故 令 從 初 
T45n1907_001:0921b18	仰習其難。習行漸增。轉成其易。是謂新行發	仰 習 其 難 習 行 漸 增 轉 成 其 易 是 謂 新 行 發 
T45n1907_001:0921b19	趣大意。究竟持犯。略明如是。	趣 大 意 究 竟 持 犯 略 明 如 是 
T45n1907_001:0921b20	　仰依聖典了義文　　粗述戒藏開要門	 仰 依 聖 典 了 義 文 粗 述 戒 藏 開 要 門 
T45n1907_001:0921b21	　普為法界燃一燈　　願用傳燈周十方	 普 為 法 界 燃 一 燈 願 用 傳 燈 周 十 方 
T45n1907_001:0921b22	　四句三聚戒圓滿　　六意五修為成辨	 四 句 三 聚 戒 圓 滿 六 意 五 修 為 成 辨 
T45n1907_001:0921b23	　遠離二邊滅諸罪　　等飡一味遊方外	 遠離二邊 滅 諸 罪 等 飡 一 味 遊 方 外 
T45n1907_001:0921b24	持犯要記一卷	持 犯 要 記 一 卷 
