T47n1967_002:0138a20	旨乎？」對曰：「有為雖偽，捨之則道業不成；無為	旨 乎 對 曰 有 為 雖 偽 捨 之 則 道 業 不 成 無 為 
T47n1967_002:0138a21	雖實，取之則慧心不朗。經云：『厭離有為功德，	雖 實 取 之 則 慧 心 不 朗 經 云 厭 離 有 為 功 德 
T47n1967_002:0138a22	是為魔業；樂著無為功德，亦為魔業。』子今厭	是 為 魔 業 樂 著 無 為 功 德 亦 為 魔 業 子 今 厭 
T47n1967_002:0138a23	樂交爭，得不入於魔骨也？又若聖賢攝心謂	樂 交 爭 得 不 入 於 魔 骨 也 又 若 聖 賢 攝 心 謂 
T47n1967_002:0138a24	之內；凡夫馳想謂之外。苟以馳外為亂，住內	之 內 凡 夫 馳 想 謂 之 外 苟 以 馳 外 為 亂 住 內 
T47n1967_002:0138a25	為定，復是內外所馳，非所以念佛三昧攝心	為 定 復 是 內 外 所 馳 非 所 以 念佛三昧 攝 心 
T47n1967_002:0138a26	之意也。《注維摩經》羅什法師云：『外國有一女，	之 意 也 注 維 摩 經 羅 什 法 師 云 外 國 有 一 女 
T47n1967_002:0138a27	身體金色。有長者子，名達暮多羅，以千兩金，	身 體 金 色 有 長 者 子 名 達 暮 多 羅 以 千 兩 金 
T47n1967_002:0138a28	邀入竹林，同載而去。文殊於道中，變身為白	邀 入 竹 林 同 載 而 去 文 殊 於 道 中 變 身 為 白 
T47n1967_002:0138a29	衣士身，著寶衣，衣甚嚴好，女人見之，貪心內	衣 士 身 著 寶 衣 衣 甚 嚴 好 女 人 見 之 貪 心 內 
T47n1967_002:0138b01	發。文殊言：「汝欲得衣者，當發菩提心。」女	發 文 殊 言 汝 欲 得 衣 者 當 發菩提心 女 
T47n1967_002:0138b02	曰：「何等為菩提心？」文殊言：「汝身是。」問曰：「云	曰 何 等 為 菩 提 心 文 殊 言 汝 身 是 問 曰 云 
T47n1967_002:0138b03	何是？」答曰：「菩提性空，汝身亦空，是故。」此女	何 是 答 曰 菩 提 性 空 汝 身 亦 空 是 故 此 女 
T47n1967_002:0138b04	曾於迦葉佛所，多植善本，廣修智慧，聞是說	曾 於 迦 葉 佛 所 多 植 善 本 廣 修 智 慧 聞 是 說 
T47n1967_002:0138b05	已，即得無生法忍。得是忍已，而將示欲之過，	已 即 得無生法忍 得 是 忍 已 而 將 示 欲 之 過 
T47n1967_002:0138b06	還與長者子入林。既入林已，自現身死胮脹	還 與 長 者 子 入 林 既 入 林 已 自 現 身 死 胮 脹 
T47n1967_002:0138b07	爛臭。長者子見已，甚大怖畏，往詣佛所，佛為	爛 臭 長 者 子 見 已 甚 大 怖 畏 往 詣 佛 所 佛 為 
T47n1967_002:0138b08	說法，亦得法忍。』大覺未成，未暇閑任，故名為	說 法 亦 得 法 忍 大 覺 未 成 未 暇 閑 任 故 名 為 
T47n1967_002:0138b09	忍。如自觀身實相，觀佛亦然，女身空，佛身空，	忍 如 自 觀 身 實 相 觀 佛 亦 然 女 身 空 佛 身 空 
T47n1967_002:0138b10	未始異也。菩提之義，豈得異乎？夫如是則一	未 始 異 也 菩 提 之 義 豈 得 異 乎 夫 如 是 則 一 
T47n1967_002:0138b11	切有為即無為矣！一切內外非內外矣！然在	切 有 為 即 無 為 矣 一 切 內 外 非 內 外 矣 然 在 
T47n1967_002:0138b12	有而未甞有，有而常無，居無而未甞無，無而	有 而 未 甞 有 有 而 常 無 居 無 而 未 甞 無 無 而 
T47n1967_002:0138b13	恒有，何患之於佛有相心有念哉？」	恒 有 何 患 之 於 佛 有 相 心 有 念 哉 
T47n1967_002:0138b14	此生他生一念十念門第九	此 生 他 生 一 念 十 念 門 第 九 
T47n1967_002:0138b15	問曰：「易行、難行之談，身即菩提之觀，其旨	問 曰 易 行 難 行 之 談 身 即 菩 提 之 觀 其 旨 
T47n1967_002:0138b16	鏡焉。人生在世，石火電火，失念蹉跎，悔無所	鏡 焉 人 生 在 世 石 火 電 火 失 念 蹉 跎 悔 無 所 
T47n1967_002:0138b17	及。修道之人，尚不親心，況親於身，尚不親於	及 修 道 之 人 尚 不 親 心 況 親 於 身 尚 不 親 於 
T47n1967_002:0138b18	身，況身外歟？常恐出息不還，屬於後世，	身 況 身 外 歟 常 恐 出 息 不 還 屬 於 後 世 
T47n1967_002:0138b19	狂風飄蓬，茫茫何之？願示一念、十念之門，此	狂 風 飄 蓬 茫 茫 何 之 願 示 一 念 十 念 之 門 此 
T47n1967_002:0138b20	生、他生之計。」答曰：「夫淨土之會，功業之大者，	生 他 生 之 計 答 曰 夫 淨 土 之 會 功 業 之 大 者 
T47n1967_002:0138b21	二乘乃澄神虛無、耽空怖相，不念眾生，故無	二 乘 乃 澄 神 虛 無 耽 空 怖 相 不 念 眾 生 故 無 
T47n1967_002:0138b22	淨土；而大乘有之。按《悲華經》云：『阿彌陀佛，昔	淨 土 而 大 乘 有 之 按 悲 華 經 云 阿 彌 陀 佛 昔 
T47n1967_002:0138b23	為轉輪王，名無諍念，七寶千子，悉皆具足。因	為 轉 輪 王 名 無 諍 念 七 寶 千 子 悉 皆 具 足 因 
T47n1967_002:0138b24	寶海大臣為善知識，於寶藏佛所發菩提心，	寶 海 大 臣 為 善 知 識 於 寶 藏 佛 所 發菩提心 
T47n1967_002:0138b25	取於西方極樂淨土，則諸經中知名諸佛、菩	取 於 西方極樂 淨 土 則 諸 經 中 知 名 諸 佛 菩 
T47n1967_002:0138b26	薩、聲聞等，皆昔之千子也。其長太子，名不瞬，	薩 聲 聞 等 皆 昔 之 千 子 也 其 長 太 子 名 不 瞬 
T47n1967_002:0138b27	觀世音也；次子名摩尼，大勢至也；次子名王	觀 世 音 也 次 子 名 摩 尼 大 勢 至 也 次 子 名 王 
T47n1967_002:0138b28	眾，文殊師利也；次子名能伽奴，即金剛智慧	眾 文 殊 師 利 也 次 子 名 能 伽 奴 即 金 剛 智 慧 
T47n1967_002:0138b29	光明菩薩；次子名無畏，即蓮華尊如來；次子	光 明 菩 薩 次 子 名 無 畏 即 蓮 華 尊 如 來 次 子 
T47n1967_002:0138c01	名菴婆羅，即虛空光明菩薩；次子名善臂，即	名 菴 婆 羅 即 虛 空 光 明 菩 薩 次 子 名 善 臂 即 
T47n1967_002:0138c02	師子香菩薩；次子名泯圖，即普賢也；次子名	師 子 香 菩 薩 次 子 名 泯 圖 即 普 賢 也 次 子 名 
T47n1967_002:0138c03	蜜蘇，即阿閦佛也。蜜蘇王子，一自發心已來，	蜜 蘇 即 阿 閦 佛 也 蜜 蘇 王 子 一 自 發 心 已 來 
T47n1967_002:0138c04	行時步步，心心數法，常念諸佛，今登正覺，	行 時 步 步 心心數法 常 念 諸 佛 今 登 正 覺 
T47n1967_002:0138c05	生妙樂剎焉。』吾謂經行廣陌，從步幽林，則不	生 妙 樂 剎 焉 吾 謂 經 行 廣 陌 從 步 幽 林 則 不 
T47n1967_002:0138c06	異蜜蘇之見。若鳴珂入伏，動珮翰天，肅肅羽	異 蜜 蘇 之 見 若 鳴 珂 入 伏 動 珮 翰 天 肅 肅 羽 
T47n1967_002:0138c07	儀，駸駸車馬，安得不用心於步步之間哉？今	儀 駸 駸 車 馬 安 得 不 用 心 於 步 步 之 間 哉 今 
T47n1967_002:0138c08	則例之，亦不移於前操矣！夫含齒戴髮，死生	則 例 之 亦 不 移 於 前 操 矣 夫 含 齒 戴 髮 死 生 
T47n1967_002:0138c09	交際，未有無出、入息焉。又一息不還，即屬後	交 際 未 有 無 出 入 息 焉 又 一 息 不 還 即 屬 後 
T47n1967_002:0138c10	世者，亦誠如所問。世上之人，多以寶玉、水精、	世 者 亦 誠 如 所 問 世 上 之 人 多 以 寶 玉 水 精 
T47n1967_002:0138c11	金剛、菩提木槵，為數珠矣；吾則以出、入息為	金 剛 菩 提 木 槵 為 數 珠 矣 吾 則 以 出 入 息 為 
T47n1967_002:0138c12	念珠焉。稱佛名號，隨之於息，有大恃怙，安懼	念 珠 焉 稱 佛 名 號 隨 之 於 息 有 大 恃 怙 安 懼 
T47n1967_002:0138c13	於息不還，屬後世者哉？余行、住、坐、臥常用此	於 息 不 還 屬 後 世 者 哉 余 行 住 坐 臥 常 用 此 
T47n1967_002:0138c14	珠，縱今昏寐含佛而寢，覺即續之，必於夢	珠 縱 今 昏 寐 含 佛 而 寢 覺 即 續 之 必 於 夢 
T47n1967_002:0138c15	中得見彼佛，如鑽燧煙飛火之前相。夢之不	中 得 見 彼 佛 如 鑽 燧 煙 飛 火 之 前 相 夢 之 不 
T47n1967_002:0138c16	已，三昧成焉，面覩玉毫，親蒙授記，則萬無一	已 三 昧 成 焉 面 覩 玉 毫 親 蒙 授 記 則 萬 無 一 
T47n1967_002:0138c17	失也。子宜勉之。」又問：「一念、十念往生淨土，	失 也 子 宜 勉 之 又 問 一 念 十 念 往 生 淨 土 
T47n1967_002:0138c18	何者為正？」對曰：「但一念往生，住不退地，此為	何 者 為 正 對 曰 但 一 念 往 生 住 不 退 地 此 為 
T47n1967_002:0138c19	正也。如佛所說，謗佛、毀經，打僧、罵尊，五逆、四	正 也 如 佛 所 說 謗 佛 毀 經 打 僧 罵 尊 五 逆 四 
T47n1967_002:0138c20	重，皆一念惡業成，墮無間獄猶如箭射。今之	重 皆 一 念 惡 業 成 墮 無 間 獄 猶 如 箭 射 今 之 
T47n1967_002:0138c21	念佛生于淨土，亦一念善業成即登極樂。猶	念 佛 生 于 淨 土 亦 一 念 善 業 成 即 登 極 樂 猶 
T47n1967_002:0138c22	如屈臂，前一念五陰滅，後一念五陰生，如蠟	如 屈 臂 前 一 念 五 陰 滅 後 一 念 五 陰 生 如 蠟 
T47n1967_002:0138c23	印印泥，印壞文成，尚不須兩念，豈要至十念	印 印 泥 印 壞 文 成 尚 不 須 兩 念 豈 要 至 十 念 
T47n1967_002:0138c24	哉？打僧、罵尊，雖非正逆，是五逆之類也。又	哉 打 僧 罵 尊 雖 非 正 逆 是 五 逆 之 類 也 又 
T47n1967_002:0138c25	一念者，如經云：『愛酪沙彌，生一念愛心，後生	一 念 者 如 經 云 愛 酪 沙 彌 生 一 念 愛 心 後 生 
T47n1967_002:0138c26	酪中作蟲。』又大薩婆長者妻，坐對明鏡，自愛	酪 中 作 蟲 又 大 薩 婆 長 者 妻 坐 對 明 鏡 自 愛 
T47n1967_002:0138c27	其身，海風破船，生故屍中作蟲，嬉戲往來，不	其 身 海 風 破 船 生 故 屍 中 作 蟲 嬉 戲 往 來 不 
T47n1967_002:0138c28	離其所。斯皆一念，非十念也。又《大無量壽經》	離 其 所 斯 皆 一 念 非 十 念 也 又 大 無 量 壽 經 
T47n1967_002:0138c29	明一念念佛皆得往生。《觀經》十念，良有以也。	明 一 念 念 佛 皆 得 往 生 觀 經 十 念 良 有 以 也 
T47n1967_002:0139a01	蓋為遘疾尫羸力微心劣故，須十稱彌陀以	蓋 為 遘 疾 尫 羸 力 微 心 劣 故 須 十 稱 彌 陀 以 
T47n1967_002:0139a02	助其念；若心盛不昧，一念生焉，亦猶栽植絲	助 其 念 若 心 盛 不 昧 一 念 生 焉 亦 猶 栽 植 絲 
T47n1967_002:0139a03	髮，其茂百圍也。」	髮 其 茂 百 圍 也 
T47n1967_002:0139a04	是心是佛，是心作佛門第十	是 心 是 佛 是 心 作 佛 門 第 十 
T47n1967_002:0139a05	問曰：「經明是心是佛，是心作佛。何用遠稱彌	問 曰 經 明 是 心 是 佛 是 心 作 佛 何 用 遠 稱 彌 
T47n1967_002:0139a06	陀，存想於極樂之國；近念諸佛，興敬於未	陀 存 想 於 極 樂 之 國 近 念 諸 佛 興 敬 於 未 
T47n1967_002:0139a07	來之尊。此皆自外而求，豈曰是心是佛耶？」對	來 之 尊 此 皆 自 外 而 求 豈 曰 是 心 是 佛 耶 對 
T47n1967_002:0139a08	曰：「子問非也。子但引經，不知經之所趣。經者，	曰 子 問 非 也 子 但 引 經 不 知 經 之 所 趣 經 者 
T47n1967_002:0139a09	《觀無量壽經》也，正明念阿彌陀之文矣。『以念	 觀 無 量 壽 經 也 正 明 念 阿 彌 陀 之 文 矣 以 念 
T47n1967_002:0139a10	佛故，佛從想生』，故云是心是佛。安得竊取彌	佛 故 佛 從 想 生 故 云 是 心 是 佛 安 得 竊 取 彌 
T47n1967_002:0139a11	陀之觀，反噬彌陀之心者哉？若爾，都不念佛，	陀 之 觀 反 噬 彌 陀 之 心 者 哉 若 爾 都 不 念 佛 
T47n1967_002:0139a12	而言是心是佛者，亦應都不想惡，而言是心	而 言 是 心 是 佛 者 亦 應 都 不 想 惡 而 言 是 心 
T47n1967_002:0139a13	是惡耶？彼既不然，此亦焉可？況彼極樂之國，	是 惡 耶 彼 既 不 然 此 亦 焉 可 況 彼 極 樂 之 國 
T47n1967_002:0139a14	彌陀至尊，十萬億之須彌山王，不與眼根為	彌 陀 至 尊 十 萬 億 之 須 彌 山 王 不 與 眼 根 為 
T47n1967_002:0139a15	障礙，恒河沙之光明相好，由佛願力而想成，	障 礙 恒 河 沙 之 光 明 相 好 由 佛 願 力 而 想 成 
T47n1967_002:0139a16	屈臂即得往生，寧計彼方之遠近也？」。問曰：「是	屈 臂 即 得 往 生 寧 計 彼 方 之 遠 近 也 問 曰 是 
T47n1967_002:0139a17	心是佛，敬聞其理也。然此經所明十六妙觀，	心 是 佛 敬 聞 其 理 也 然 此 經 所 明 十 六 妙 觀 
T47n1967_002:0139a18	韋提得之，則氷日可想，金山晃然，魔光、佛光，	韋 提 得 之 則 氷 日 可 想 金 山 晃 然 魔 光 佛 光 
T47n1967_002:0139a19	自觀、他觀，邪正混雜，若為澄渟？願一一示	自 觀 他 觀 邪 正 混 雜 若 為 澄 渟 願 一 一 示 
T47n1967_002:0139a20	之，令念佛人離師獨坐心安若海也。」對曰：	之 令 念 佛 人 離 師 獨 坐 心 安 若 海 也 對 曰 
T47n1967_002:0139a21	「氷想者，為琉璃地之張本也；日想者，作白毫	 氷 想 者 為 琉 璃 地 之 張 本 也 日 想 者 作 白 毫 
T47n1967_002:0139a22	光之由漸也。依想而現，曰自、曰正；不依想現，	光 之 由 漸 也 依 想 而 現 曰 自 曰 正 不 依 想 現 
T47n1967_002:0139a23	則曰他、曰邪。本則想白毫，白毫不現，而未想	則 曰 他 曰 邪 本 則 想 白 毫 白 毫 不 現 而 未 想 
T47n1967_002:0139a24	紺目，紺目現，此乖其本心，豈不邪也？況諸想	紺 目 紺 目 現 此 乖 其 本 心 豈 不 邪 也 況 諸 想 
T47n1967_002:0139a25	歟？又魔光乃有影耀眼，佛光乃無影耀眼，故	歟 又 魔 光 乃 有 影 耀 眼 佛 光 乃 無 影 耀 眼 故 
T47n1967_002:0139a26	《楞伽》偈云：	 楞 伽 偈 云 
T47n1967_002:0139a27	「『佛地名最勝，　　清淨妙莊嚴，	 佛 地 名 最 勝 清 淨 妙 莊 嚴 
T47n1967_002:0139a28	　　照耀如盛火，　　光明悉遍至，	 照 耀 如 盛 火 光 明 悉 遍 至 
T47n1967_002:0139a29	　　熾焰不壞目，　　周輪化三有。』」	 熾 焰 不 壞 目 周 輪 化 三 有 
T47n1967_002:0139b01	問：「今之光現者，熾焰壞目，非魔如何？光而	問 今 之 光 現 者 熾 焰 壞 目 非 魔 如 何 光 而 
T47n1967_002:0139b02	不耀，非佛如何？」答：「又光之真也，令念佛人身	不 耀 非 佛 如 何 答 又 光 之 真 也 令 念 佛 人 身 
T47n1967_002:0139b03	心澄渟清淨；光之偽也，令念佛人心躁動恍	心 澄 渟 清 淨 光 之 偽 也 令 念 佛 人 心 躁 動 恍 
T47n1967_002:0139b04	惚。故《涅槃經》云：『澄渟清淨，即真解脫。真解	惚 故 涅 槃 經 云 澄 渟 清 淨 即 真 解 脫 真 解 
T47n1967_002:0139b05	脫者，即是如來。』明矣！」又問曰：「至人無思，而今	脫 者 即 是 如 來 明 矣 又 問 曰 至 人 無 思 而 今 
T47n1967_002:0139b06	用想，豈不謬哉？」對曰：「不謬也！如《大威德陀羅	用 想 豈 不 謬 哉 對 曰 不 謬 也 如 大 威 德 陀 羅 
T47n1967_002:0139b07	尼經》云：『超過有結，應發欲心，想無欲事。』今則	尼 經 云 超 過 有 結 應 發 欲 心 想 無 欲 事 今 則 
T47n1967_002:0139b08	例之，欲修念佛，應發想心，想無想事。故《方等	例 之 欲 修 念 佛 應 發 想 心 想 無 想 事 故 方 等 
T47n1967_002:0139b09	賢護經》云：『惡欲想女，夢見於女；善欲想佛，夢	賢 護 經 云 惡 欲 想 女 夢 見 於 女 善 欲 想 佛 夢 
T47n1967_002:0139b10	見於佛。』吾謂二想名同，善、惡天隔，不可聞想，	見 於 佛 吾 謂 二 想 名 同 善 惡 天 隔 不 可 聞 想 
T47n1967_002:0139b11	一概厭之。若苟厭之，雖不毀經、不謗佛，則必	一 概 厭 之 若 苟 厭 之 雖 不 毀 經 不 謗 佛 則 必 
T47n1967_002:0139b12	生於無想天宮矣！若固執無想而噬想佛者，	生 於 無 想 天 宮 矣 若 固 執 無 想 而 噬 想 佛 者 
T47n1967_002:0139b13	則名謗法，以謗法故，遽入十方無擇之囹圄，	則 名 謗 法 以 謗 法 故 遽 入 十 方 無 擇 之 囹 圄 
T47n1967_002:0139b14	未知出日，豈有天宮之望乎？縱令得生，名外	未 知 出 日 豈 有 天 宮 之 望 乎 縱 令 得 生 名 外 
T47n1967_002:0139b15	道天，非解脫路。《涅槃經》云：『隨聞毒鼓，遠近俱	道 天 非 解 脫 路 涅 槃 經 云 隨 聞 毒 鼓 遠 近 俱 
T47n1967_002:0139b16	死。』此亦如是，隨其撥想，遠近俱墮。經所謂：	死 此 亦 如 是 隨 其 撥 想 遠 近 俱 墮 經 所 謂 
T47n1967_002:0139b17	『或時離地一尺、二尺，往返遊行。』斯之謂矣！豈	 或 時 離 地 一 尺 二 尺 往返遊行 斯 之 謂 矣 豈 
T47n1967_002:0139b18	同於三界之流轉焉？豈同於九品往生焉？況	同 於 三 界 之 流 轉 焉 豈 同 於 九 品 往 生 焉 況 
T47n1967_002:0139b19	覆舟、載舟，水也；因倒、因起，地也。想妄即眾生，	覆 舟 載 舟 水 也 因 倒 因 起 地 也 想 妄 即 眾 生 
T47n1967_002:0139b20	想真即諸佛，離想之外，更用何焉？」問曰：「事解	想 真 即 諸 佛 離 想 之 外 更 用 何 焉 問 曰 事 解 
T47n1967_002:0139b21	已竟，理何在耶？如《般舟三昧經》云：『心起想即	已 竟 理 何 在 耶 如 般舟三昧 經 云 心 起 想 即 
T47n1967_002:0139b22	癡，無想即涅槃。』今之用想，不亦然乎？」對曰：	癡 無 想 即 涅 槃 今 之 用 想 不 亦 然 乎 對 曰 
T47n1967_002:0139b23	「不也！若存所想之佛、能想之心，或避想佛，則	 不 也 若 存 所 想 之 佛 能 想 之 心 或 避 想 佛 則 
T47n1967_002:0139b24	以惡取空為無想者，則癡之甚也！吾今了佛	以 惡 取 空 為 無 想 者 則 癡 之 甚 也 吾 今 了 佛 
T47n1967_002:0139b25	皆從想生，無佛、無想，何癡之有？此乃觀空三	皆 從 想 生 無 佛 無 想 何 癡 之 有 此 乃 觀 空 三 
T47n1967_002:0139b26	昧，非邪見也。子又問：『理何在者？』夫至人冥	昧 非 邪 見 也 子 又 問 理 何 在 者 夫 至 人 冥 
T47n1967_002:0139b27	真體寂，虛空其懷，雖復萬法並照，而心未甞	真 體 寂 虛 空 其 懷 雖 復 萬 法 並 照 而 心 未 甞 
T47n1967_002:0139b28	有，則真智無緣，故無念為名；俗智有緣，故念	有 則 真 智 無 緣 故 無 念 為 名 俗 智 有 緣 故 念 
T47n1967_002:0139b29	想以生。又想不異空，空不異想，名第一義中	想 以 生 又 想 不 異 空 空 不 異 想 名 第 一 義 中 
T47n1967_002:0139c01	道之理也，此顯法身矣；空即是想，名俗諦之	道 之 理 也 此 顯 法 身 矣 空 即 是 想 名 俗 諦 之 
T47n1967_002:0139c02	理也，恒沙萬德，皆依俗諦，此顯報身矣；想即	理 也 恒 沙 萬 德 皆 依 俗 諦 此 顯 報 身 矣 想 即 
T47n1967_002:0139c03	是空，名真諦之理也，破二十五有，得二十五	是 空 名 真 諦 之 理 也 破 二十五有 得 二 十 五 
T47n1967_002:0139c04	三昧，常空常化，和光利物，此顯化身矣。是則	三 昧 常 空 常 化 和 光 利 物 此 顯 化 身 矣 是 則 
T47n1967_002:0139c05	以三觀，觀三諦、證三德、成三身，乃至十種三	以 三 觀 觀 三 諦 證 三 德 成 三 身 乃 至 十 種 三 
T47n1967_002:0139c06	法，有何不可？而欲擯於清淨之想，取無想之	法 有 何 不 可 而 欲 擯 於 清 淨 之 想 取 無 想 之 
T47n1967_002:0139c07	想耶？塞於禪定門，而取成佛之閾耶？《楞伽》、《密	想 耶 塞 於 禪 定 門 而 取 成 佛 之 閾 耶 楞 伽 密 
T47n1967_002:0139c08	嚴經》皆曰：『寧起有見如須彌』者，謂信有因	嚴 經 皆 曰 寧 起 有 見 如 須 彌 者 謂 信 有 因 
T47n1967_002:0139c09	果，存想念佛，生極樂淨國，故云寧起有也。	果 存 想 念 佛 生 極 樂 淨 國 故 云 寧 起 有 也 
T47n1967_002:0139c10	『不起空見如芥子』者，謂撥無因果，謗于念佛，	 不 起 空 見 如 芥 子 者 謂 撥無因果 謗 于 念 佛 
T47n1967_002:0139c11	生阿鼻地獄，故云不起空也。吁可畏者，其在	生 阿鼻地獄 故 云 不 起 空 也 吁 可 畏 者 其 在 
T47n1967_002:0139c12	茲焉！」	茲 焉 
T47n1967_002:0139c13	高聲念佛，面向西方門第十一	高 聲 念 佛 面 向 西 方 門 第 十 一 
T47n1967_002:0139c14	問曰：「想即無想，謹聞之矣！然《方等經》中，修	問 曰 想 即 無 想 謹 聞 之 矣 然 方 等 經 中 修 
T47n1967_002:0139c15	無上深妙禪定，令繼想白毫兼稱佛號，以祈	無 上 深 妙 禪 定 令 繼 想 白 毫 兼 稱 佛 號 以 祈 
T47n1967_002:0139c16	勝定，既契之後，心佛兩忘，信有之矣！但默念	勝 定 既 契 之 後 心 佛 兩 忘 信 有 之 矣 但 默 念 
T47n1967_002:0139c17	泉澄，即三昧自至，亦何必聲喧里巷，響震山	泉 澄 即 三 昧 自 至 亦 何 必 聲 喧 里 巷 響 震 山 
T47n1967_002:0139c18	林，然後為道哉？」對曰：「誠如所問，聲亦無爽，	林 然 後 為 道 哉 對 曰 誠 如 所 問 聲 亦 無 爽 
T47n1967_002:0139c19	試為明之。何者？夫辟散之要，要存於聲，聲之	試 為 明 之 何 者 夫 辟 散 之 要 要 存 於 聲 聲 之 
T47n1967_002:0139c20	不厲，心竊竊然，飄飄然無定；聲之厲也，拔茅	不 厲 心 竊 竊 然 飄 飄 然 無 定 聲 之 厲 也 拔 茅 
T47n1967_002:0139c21	連茹乘策，其後畢命一對，長謝百憂，其義	連 茹 乘 策 其 後 畢 命 一 對 長 謝 百 憂 其 義 
T47n1967_002:0139c22	一也。近而取之，聲光所及，萬禍氷消，功德叢	一 也 近 而 取 之 聲 光 所 及 萬 禍 氷 消 功 德 叢 
T47n1967_002:0139c23	林，千山松茂，其義二也。遠而說之，金容熒	林 千 山 松 茂 其 義 二 也 遠 而 說 之 金 容 熒 
T47n1967_002:0139c24	煌以散彩，寶華浙瀝而雨空，若指諸掌，皆聲	煌 以 散 彩 寶 華 浙 瀝 而 雨 空 若 指 諸 掌 皆 聲 
T47n1967_002:0139c25	致焉，其義三也。如牽木石，重而不前，洪音發	致 焉 其 義 三 也 如 牽 木 石 重 而 不 前 洪 音 發 
T47n1967_002:0139c26	號，飄然輕舉，其義四也。與魔軍相戰，旗鼓相	號 飄 然 輕 舉 其 義 四 也 與 魔 軍 相 戰 旗 鼓 相 
T47n1967_002:0139c27	望，用聲律於戎軒，以定破於強敵，其義五也。	望 用 聲 律 於 戎 軒 以 定 破 於 強 敵 其 義 五 也 
T47n1967_002:0139c28	具斯眾義，復何厭哉！未若喧靜兩全，止觀雙	具 斯 眾 義 復 何 厭 哉 未 若 喧 靜 兩 全 止 觀 雙 
T47n1967_002:0139c29	運，叶夫佛意，不亦可乎？定慧若均，則兼忘心	運 叶 夫 佛 意 不 亦 可 乎 定 慧 若 均 則 兼 忘 心 
T47n1967_002:0140a01	佛誠如所問矣。故廬山〈遠公念佛三昧序〉曰：	佛 誠 如 所 問 矣 故 廬 山 遠 公 念佛三昧 序 曰 
T47n1967_002:0140a02	『功高易進，念佛為先。』察夫玄音之扣心，聽則	 功 高 易 進 念 佛 為 先 察 夫 玄 音 之 扣 心 聽 則 
T47n1967_002:0140a03	塵累每銷，滯情融朗，非天下之至妙，其孰能	塵 累 每 銷 滯 情 融 朗 非 天 下 之 至 妙 其 孰 能 
T47n1967_002:0140a04	與於此歟？言明證者，未若《華嚴經》偈云：	與 於 此 歟 言 明 證 者 未 若 華 嚴 經 偈 云 
T47n1967_002:0140a05	「『寧受無量苦，　　得聞佛音聲，	 寧 受 無 量 苦 得 聞 佛 音 聲 
T47n1967_002:0140a06	　　不受一切樂，　　而不聞佛名。』	 不 受 一 切 樂 而 不 聞 佛 名 
T47n1967_002:0140a07	「夫然則佛聲，遠震開善萌牙，猶春雷之動百	 夫 然 則 佛 聲 遠 震 開 善 萌 牙 猶 春 雷 之 動 百 
T47n1967_002:0140a08	草，安得輕誣哉？」問曰：「高聲下聲，稱佛名號，	草 安 得 輕 誣 哉 問 曰 高 聲 下 聲 稱 佛 名 號 
T47n1967_002:0140a09	敬承其義。十方淨土皆有如來，面之西方，何	敬 承 其 義 十 方 淨 土 皆 有 如 來 面 之 西 方 何 
T47n1967_002:0140a10	滯之甚耶？」對曰：「子問非也。此是方等佛經作	滯 之 甚 耶 對 曰 子 問 非 也 此 是 方 等 佛 經 作 
T47n1967_002:0140a11	如是說，非人師之意也。豈可謗之於方等經	如 是 說 非 人 師 之 意 也 豈 可 謗 之 於 方 等 經 
T47n1967_002:0140a12	歟？」問曰：「謹聞教矣，理在何焉？」對曰：「亦有其	歟 問 曰 謹 聞 教 矣 理 在 何 焉 對 曰 亦 有 其 
T47n1967_002:0140a13	理。如說癡人見觀世音有十一面，即設難云：	理 如 說 癡 人 見 觀 世 音 有 十 一 面 即 設 難 云 
T47n1967_002:0140a14	『何不安十二面耶？』及隨其語，又設難云：『何不	 何 不 安 十 二 面 耶 及 隨 其 語 又 設 難 云 何 不 
T47n1967_002:0140a15	安十一面耶？』子欲將東難西，其義若此。猶迷	安 十 一 面 耶 子 欲 將 東 難 西 其 義 若 此 猶 迷 
T47n1967_002:0140a16	未醒者，即以此身，令其安置，不背一方，則其	未 醒 者 即 以 此 身 令 其 安 置 不 背 一 方 則 其 
T47n1967_002:0140a17	自悟矣。如其不悟，誠不可化，但可悲矣！又《勝	自 悟 矣 如 其 不 悟 誠 不 可 化 但 可 悲 矣 又 勝 
T47n1967_002:0140a18	天王經．二行品》明如來八十種好，中有一隨	天 王 經 二 行 品 明 如 來 八十種好 中 有 一 隨 
