T47n1967_003:0142a29	青雲，以鞘背承，未甞或失；庖丁解牛，投刃皆	青 雲 以 鞘 背 承 未 甞 或 失 庖 丁 解 牛 投 刃 皆 
T47n1967_003:0142b01	虛，音合桑林之舞。此念之熟也，不亦明焉？故	虛 音 合 桑 林 之 舞 此 念 之 熟 也 不 亦 明 焉 故 
T47n1967_003:0142b02	《起信論》云：『若知雖說無有能說可說，雖念亦	 起 信 論 云 若 知 雖 說 無 有 能 說 可 說 雖 念 亦 
T47n1967_003:0142b03	無能念可念，名為隨順；若離於念，名為得	無 能 念 可 念 名 為 隨 順 若 離 於 念 名 為 得 
T47n1967_003:0142b04	入。』得入者，真如三昧也！況乎無念之位，在於	入 得 入 者 真 如 三 昧 也 況 乎 無 念 之 位 在 於 
T47n1967_003:0142b05	妙覺，蓋以了心初生之相也。而言知初相者，	妙 覺 蓋 以 了 心 初 生 之 相 也 而 言 知 初 相 者 
T47n1967_003:0142b06	所謂無念，非菩薩十地所知。而今之人，尚未	所 謂 無 念 非 菩薩十地 所 知 而 今 之 人 尚 未 
T47n1967_003:0142b07	階十信，即不依馬鳴大士，從說入於無說，從	階 十 信 即 不 依 馬 鳴 大 士 從 說 入 於 無 說 從 
T47n1967_003:0142b08	念入於無念，實恐慕崇臺而輕累土，倒裳索	念 入 於 無 念 實 恐 慕 崇 臺 而 輕 累 土 倒 裳 索 
T47n1967_003:0142b09	領，其可得哉？《大佛頂諸菩薩萬行首楞嚴經》	領 其 可 得 哉 大 佛 頂 諸 菩 薩 萬 行 首 楞 嚴 經 
T47n1967_003:0142b10	云：『大勢至法王子，與其同倫五十二菩薩，即	云 大 勢 至 法 王 子 與 其 同 倫 五 十 二 菩 薩 即 
T47n1967_003:0142b11	從座起，頂禮佛足，而白佛言：「我憶往昔恒河	從 座 起 頂禮佛足 而 白 佛 言 我 憶 往 昔 恒 河 
T47n1967_003:0142b12	沙劫，有佛出世，名無量光，十二如來相繼一	沙 劫 有 佛 出 世 名 無 量 光 十 二 如 來 相 繼 一 
T47n1967_003:0142b13	劫，其最後佛，名超日月光，彼佛教我念佛三	劫 其 最 後 佛 名 超 日 月 光 彼 佛 教 我 念 佛 三 
T47n1967_003:0142b14	昧。譬如有人，一專為憶，一人專念，如是二	昧 譬 如 有 人 一 專 為 憶 一 人 專 念 如 是 二 
T47n1967_003:0142b15	人，若逢不逢，或見非見。二人相憶，二憶念深，	人 若 逢 不 逢 或 見 非 見 二 人 相 憶 二 憶 念 深 
T47n1967_003:0142b16	如是乃至從生至生，同於形影，不相乖異。十	如 是 乃 至 從 生 至 生 同 於 形 影 不 相 乖 異 十 
T47n1967_003:0142b17	方如來，憐念眾生，如母憶子。若子逃逝，雖憶	方 如 來 憐 念 眾 生 如 母 憶 子 若 子 逃 逝 雖 憶 
T47n1967_003:0142b18	何為？子若憶母，如母憶時，母子歷生，不相違	何 為 子 若 憶 母 如 母 憶 時 母 子 歷 生 不 相 違 
T47n1967_003:0142b19	遠。若眾生心，憶佛念佛，現前當來，必定見	遠 若 眾 生 心 憶 佛 念 佛 現 前 當 來 必 定 見 
T47n1967_003:0142b20	佛！去佛不遠，不假方便，自得心開，如染香	佛 去 佛 不 遠 不 假 方 便 自 得 心 開 如 染 香 
T47n1967_003:0142b21	人身有香氣，此則名曰香光莊嚴。我本因地，	人 身 有 香 氣 此 則 名 曰 香 光 莊 嚴 我 本 因 地 
T47n1967_003:0142b22	以念佛心，入無生忍，今於此界，攝念佛人，歸	以 念 佛 心 入 無 生 忍 今 於 此 界 攝 念 佛 人 歸 
T47n1967_003:0142b23	於淨土。佛問圓通，我無選擇，都攝六根，淨念	於 淨 土 佛 問 圓 通 我 無 選 擇 都 攝 六 根 淨 念 
T47n1967_003:0142b24	相繼，得三摩提，斯為第一。」』」	相 繼 得 三 摩 提 斯 為 第 一 
T47n1967_003:0142b25	了心境界妄想不生門第十六	了 心 境 界 妄 想 不 生 門 第 十 六 
T47n1967_003:0142b26	問曰：「不了心及緣，即起二妄想，今存所念之	問 曰 不 了 心 及 緣 即 起 二 妄 想 今 存 所 念 之 
T47n1967_003:0142b27	佛、能念之心，豈非二妄想耶？」對曰：「《楞伽經》	佛 能 念 之 心 豈 非 二 妄 想 耶 對 曰 楞 伽 經 
T47n1967_003:0142b28	云：『了心及境界，妄想即不生。』不生心者，即	云 了 心 及 境 界 妄 想 即 不 生 不 生 心 者 即 
T47n1967_003:0142b29	種種遠離能相、所相。吾今念千輪、萬字、紺目、	種 種 遠 離 能 相 所 相 吾 今 念 千 輪 萬 字 紺 目 
T47n1967_003:0142c01	白毫種種之相，皆吾自心，無佛可得，緣既不	白 毫 種 種 之 相 皆 吾 自 心 無 佛 可 得 緣 既 不 
T47n1967_003:0142c02	有，心豈有哉？則能相之念，所相之佛，自遠離	有 心 豈 有 哉 則 能 相 之 念 所 相 之 佛 自 遠 離 
T47n1967_003:0142c03	矣！安得住於二妄想耶？前聖所知，轉相傳	矣 安 得 住 於 二 妄 想 耶 前 聖 所 知 轉 相 傳 
T47n1967_003:0142c04	授，妄想無性，於茲悟矣！又如觀佛實相，觀身	授 妄 想 無 性 於 茲 悟 矣 又 如 觀 佛 實 相 觀 身 
T47n1967_003:0142c05	亦然，遇境皆真，無心不佛，中道之理，遍於一	亦 然 遇 境 皆 真 無 心 不 佛 中 道 之 理 遍 於 一 
T47n1967_003:0142c06	切，豈存於所緣之佛歟？又解云：『如鼻有墨點，	切 豈 存 於 所 緣 之 佛 歟 又 解 云 如 鼻 有 墨 點 
T47n1967_003:0142c07	對之明鏡，人惡其墨，但揩于鏡，其可得耶？好	對 之 明 鏡 人 惡 其 墨 但 揩 于 鏡 其 可 得 耶 好 
T47n1967_003:0142c08	惡、是非，對之前境，不了自心，但尤于境，其可	惡 是 非 對 之 前 境 不 了 自 心 但 尤 于 境 其 可 
T47n1967_003:0142c09	得耶？』未若洗分別之鼻墨，則一鏡圓淨矣！萬	得 耶 未 若 洗 分 別 之 鼻 墨 則 一 鏡 圓 淨 矣 萬 
T47n1967_003:0142c10	境咸真矣！執石成寶矣！眾生即佛矣！故《續高	境 咸 真 矣 執 石 成 寶 矣 眾 生 即 佛 矣 故 續 高 
T47n1967_003:0142c11	僧傳》云：『齊朝有向居士，致書通好於惠可禪	僧 傳 云 齊 朝 有 向 居 士 致 書 通 好 於 惠 可 禪 
T47n1967_003:0142c12	師曰：「影由形起，響逐聲來，弄影勞形，不知形	師 曰 影 由 形 起 響 逐 聲 來 弄 影 勞 形 不 知 形 
T47n1967_003:0142c13	是影本；揚聲止響，不識聲是響根。除煩惱而	是 影 本 揚 聲 止 響 不 識 聲 是 響 根 除 煩 惱 而 
T47n1967_003:0142c14	求涅槃者，喻避形而覓影，離眾生而求佛性	求 涅 槃 者 喻 避 形 而 覓 影 離 眾 生 而 求 佛 性 
T47n1967_003:0142c15	者，喻默聲而尋響。故知，迷悟一塗，愚智非	者 喻 默 聲 而 尋 響 故 知 迷 悟 一 塗 愚 智 非 
T47n1967_003:0142c16	別，無名作名，因其名，是非生矣；無理作理，因	別 無 名 作 名 因 其 名 是 非 生 矣 無 理 作 理 因 
T47n1967_003:0142c17	其理，諍論起矣。幻化非真，誰是？誰非？虛妄無	其 理 諍 論 起 矣 幻 化 非 真 誰 是 誰 非 虛 妄 無 
T47n1967_003:0142c18	實，何空？何有？將知得無所得，失無所失矣。未	實 何 空 何 有 將 知 得 無 所 得 失 無 所 失 矣 未 
T47n1967_003:0142c19	及造談，聊申此意，想為答之。」慧可禪師，命筆	及 造 談 聊 申 此 意 想 為 答 之 慧 可 禪 師 命 筆 
T47n1967_003:0142c20	迷意，答居士曰：「說此真法，皆如實契真幽	迷 意 答 居 士 曰 說 此 真 法 皆 如 實 契 真 幽 
T47n1967_003:0142c21	理，竟不殊本，迷，摩尼謂瓦礫，豁然自覺是真	理 竟 不 殊 本 迷 摩 尼 謂 瓦 礫 豁 然 自 覺 是 真 
T47n1967_003:0142c22	殊，無明、智慧等無異。當知，萬法即皆如，破此	殊 無 明 智 慧 等 無 異 當 知 萬 法 即 皆 如 破 此 
T47n1967_003:0142c23	二見之徒輩，申辭措意，作斯書，觀身與佛無	二 見 之 徒 輩 申 辭 措 意 作 斯 書 觀 身 與 佛 無 
T47n1967_003:0142c24	差別，何須更覓彼無餘？」』此二上士，依達磨大	差 別 何 須 更 覓 彼 無 餘 此 二 上 士 依 達 磨 大 
T47n1967_003:0142c25	師稱法之行，理觀用心，皆是念中道第一義	師 稱 法 之 行 理 觀 用 心 皆 是 念 中 道 第 一 義 
T47n1967_003:0142c26	諦、法身佛也。必不離念存於無念，離生立於	諦 法 身 佛 也 必 不 離 念 存 於 無 念 離 生 立 於 
T47n1967_003:0142c27	無生。若謂離之而別立者，斯不了煩惱即涅	無 生 若 謂 離 之 而 別 立 者 斯 不 了 煩 惱 即 涅 
T47n1967_003:0142c28	槃，眾生即諸佛，安得悟彼瓦礫如真珠哉？既	槃 眾 生 即 諸 佛 安 得 悟 彼 瓦 礫 如 真 珠 哉 既 
T47n1967_003:0142c29	離之不可，即念佛而真無念也，即往生而真	離 之 不 可 即 念 佛 而 真 無 念 也 即 往 生 而 真 
T47n1967_003:0143a01	無生也。夫如是則其義煥然，若秋天澄霽，明	無 生 也 夫 如 是 則 其 義 煥 然 若 秋 天 澄 霽 明 
T47n1967_003:0143a02	月出雲矣。豈同愚人觀指而不觀月哉？」	月 出 雲 矣 豈 同 愚 人 觀 指 而 不 觀 月 哉 
T47n1967_003:0143a03	諸佛解脫心行中求門第十七	諸 佛 解 脫 心 行 中 求 門 第 十 七 
T47n1967_003:0143a04	問曰：「念佛名真無念，往生名真無生，信矣。《維	問 曰 念 佛 名 真 無 念 往 生 名 真 無 生 信 矣 維 
T47n1967_003:0143a05	摩經》云：『諸佛解脫，當於何求？當於一切眾生	摩 經 云 諸 佛 解 脫 當 於 何 求 當 於 一 切 眾 生 
T47n1967_003:0143a06	心行中求。』既曰『一切心行中求』，何不求於自	心 行 中 求 既 曰 一 切 心 行 中 求 何 不 求 於 自 
T47n1967_003:0143a07	心，而乃求於外佛耶？」對曰：「子謂念佛三昧無	心 而 乃 求 於 外 佛 耶 對 曰 子 謂 念佛三昧 無 
T47n1967_003:0143a08	上妙禪，非心行中求者。不然也！為子明之。夫	上 妙 禪 非 心 行 中 求 者 不 然 也 為 子 明 之 夫 
T47n1967_003:0143a09	心之為行者，行於三境也：一、行善境，即念佛	心 之 為 行 者 行 於 三 境 也 一 行 善 境 即 念 佛 
T47n1967_003:0143a10	三昧，善中之善，天中之天；二、行不善境，謂	三 昧 善 中 之 善 天 中 之 天 二 行 不 善 境 謂 
T47n1967_003:0143a11	貪、瞋、癡等諸惡境界；三、行無記境，謂其心不	貪 瞋 癡 等 諸 惡 境 界 三 行 無 記 境 謂 其 心 不 
T47n1967_003:0143a12	住，善、惡不緣。若論夫理性，理遍前三，語其順	住 善 惡 不 緣 若 論 夫 理 性 理 遍 前 三 語 其 順 
T47n1967_003:0143a13	理，唯留善境，經云：『所謂取我是垢，不取我	理 唯 留 善 境 經 云 所 謂 取 我 是 垢 不 取 我 
T47n1967_003:0143a14	是淨』者，謂不了法性體無慳貪，違於法性而	是 淨 者 謂 不 了 法 性 體 無 慳 貪 違 於 法 性 而 
T47n1967_003:0143a15	不行施，縱施住施，不能捨施，非垢如何？若能	不 行 施 縱 施 住 施 不 能 捨 施 非 垢 如 何 若 能 
T47n1967_003:0143a16	了知隨順法性，行檀波羅蜜，無慳施相，善順	了 知 隨 順 法 性 行 檀 波 羅 蜜 無 慳 施 相 善 順 
T47n1967_003:0143a17	於理，非淨如何？不善、無記，乖於法性，不可與	於 理 非 淨 如 何 不 善 無 記 乖 於 法 性 不 可 與 
T47n1967_003:0143a18	善聯鍍也。故勝天王問佛：『云何菩薩，通達禪	善 聯 鍍 也 故 勝 天 王 問 佛 云 何 菩 薩 通 達 禪 
T47n1967_003:0143a19	波羅蜜？』佛告大王：『菩薩摩訶薩學般若波羅	波 羅 蜜 佛 告 大 王 菩薩摩訶薩 學 般 若 波 羅 
T47n1967_003:0143a20	蜜，行禪波羅蜜，當觀此心行於何境，若善、不	蜜 行 禪 波 羅 蜜 當 觀 此 心 行 於 何 境 若 善 不 
T47n1967_003:0143a21	善、無記境界。若行善境則勤修習，譬如蓮華	善 無 記 境 界 若 行 善 境 則 勤 修 習 譬 如 蓮 華 
T47n1967_003:0143a22	不停水滴，一不善海不得暫住。』據斯金口，豈	不 停 水 滴 一 不 善 海 不 得 暫 住 據 斯 金 口 豈 
T47n1967_003:0143a23	有不善、無記而不擯之哉？是則順理，善心行	有 不 善 無 記 而 不 擯 之 哉 是 則 順 理 善 心 行 
T47n1967_003:0143a24	於善境，熾然念佛解脫在心行中。若謂念佛	於 善 境 熾 然 念 佛 解 脫 在 心 行 中 若 謂 念 佛 
T47n1967_003:0143a25	心行，而非解脫者，不善、無記二種心行，豈得	心 行 而 非 解 脫 者 不 善 無 記 二 種 心 行 豈 得 
T47n1967_003:0143a26	有哉？如斯解脫，迷之則滯於浩劫，悟之則證	有 哉 如 斯 解 脫 迷 之 則 滯 於 浩 劫 悟 之 則 證 
T47n1967_003:0143a27	如反掌，習禪明鏡，允茲、在茲。如來世雄，考彼	如 反 掌 習 禪 明 鏡 允 茲 在 茲 如 來 世 雄 考 彼 
T47n1967_003:0143a28	群定，以念佛三昧為禪中王；諸餘三昧，有待	群 定 以 念佛三昧 為 禪 中 王 諸 餘 三 昧 有 待 
T47n1967_003:0143a29	有對者，皆匹夫之定耳。然寶王三昧，不住尊	有 對 者 皆 匹 夫 之 定 耳 然 寶 王 三 昧 不 住 尊 
T47n1967_003:0143b01	相，不住卑相，邪相、正相，生死相、涅槃相，煩惱	相 不 住 卑 相 邪 相 正 相 生 死 相 涅 槃 相 煩 惱 
T47n1967_003:0143b02	相、菩提相，靜相、亂相，成正覺相、度眾生相、坐	相 菩 提 相 靜 相 亂 相 成 正 覺 相 度 眾 生 相 坐 
T47n1967_003:0143b03	道場相，無所得相，如是等相皆悉不住，猶如	道 場 相 無 所 得 相 如 是 等 相 皆 悉 不 住 猶 如 
T47n1967_003:0143b04	夢覺，廓無來去。故《大品》云：『無去、無來是佛。』夫	夢 覺 廓 無 來 去 故 大 品 云 無 去 無 來 是 佛 夫 
T47n1967_003:0143b05	如是則尚遣乎中道，豈住於邊徼哉？如《諸海	如 是 則 尚 遣 乎 中 道 豈 住 於 邊 徼 哉 如 諸 海 
T47n1967_003:0143b06	無行經》偈云：	無 行 經 偈 云 
T47n1967_003:0143b07	「『譬如人，　　於夢中，　　得佛道，　　度眾生，	 譬 如 人 於 夢 中 得 佛 道 度 眾 生 
T47n1967_003:0143b08	　　此無道，　　無眾生，　　佛法性，　　亦復然。	 此 無 道 無 眾 生 佛 法 性 亦 復 然 
T47n1967_003:0143b09	　　坐道場，　　無所得，　　若不得，　　則不有，	 坐 道 場 無 所 得 若 不 得 則 不 有 
T47n1967_003:0143b10	　　明無明，　　同一相，　　知如是，　　為世尊。	 明 無 明 同 一 相 知 如 是 為 世 尊 
T47n1967_003:0143b11	　　眾生性，　　即菩提，　　菩提性，　　即眾生，	 眾 生 性 即 菩 提 菩 提 性 即 眾 生 
T47n1967_003:0143b12	　　菩薩眾，　　亦不二，　　知如是，　　為世尊。』」	 菩 薩 眾 亦 不 二 知 如 是 為 世 尊 
T47n1967_003:0143b13	三業供養真實表敬門第十八	三 業 供 養 真 實 表 敬 門 第 十 八 
T47n1967_003:0143b14	問曰：「三昧觀門已聞奇唱，三業供養，佛在滅	問 曰 三 昧 觀 門 已 聞 奇 唱 三 業 供 養 佛 在 滅 
T47n1967_003:0143b15	後，獻福何多？」對曰：「夫論供養法界海者，萬行	後 獻 福 何 多 對 曰 夫 論 供 養 法 界 海 者 萬 行 
T47n1967_003:0143b16	之中，能淨三業，皆名供養也，況浪思真境，而	之 中 能 淨 三 業 皆 名 供 養 也 況 浪 思 真 境 而 
T47n1967_003:0143b17	非供養哉？《理趣》曰：『觀一切法，若常、若無常，皆	非 供 養 哉 理 趣 曰 觀 一 切 法 若 常 若 無 常 皆 
T47n1967_003:0143b18	不可得。』於諸如來，廣設供養，不亦明焉？又如	不 可 得 於 諸 如 來 廣 設 供 養 不 亦 明 焉 又 如 
T47n1967_003:0143b19	來在世，嚴薦表誠，皆言華雲香海，遍微塵剎，	來 在 世 嚴 薦 表 誠 皆 言 華 雲 香 海 遍 微 塵 剎 
T47n1967_003:0143b20	猶恨其少。大士所以入觀用想，須彌為燈炷，	猶 恨 其 少 大 士 所 以 入 觀 用 想 須 彌 為 燈 炷 
T47n1967_003:0143b21	大海為油盞，未展殷敬，故焚金色之僻，獻淨	大 海 為 油 盞 未 展 殷 敬 故 焚 金 色 之 僻 獻 淨 
T47n1967_003:0143b22	明之塔，金身火焰洞照十方，則喜見菩薩其	明 之 塔 金 身 火 焰 洞 照 十 方 則 喜 見 菩 薩 其 
T47n1967_003:0143b23	例矣。而今之人，但推於自心，或遙指華樹，乖	例 矣 而 今 之 人 但 推 於 自 心 或 遙 指 華 樹 乖 
T47n1967_003:0143b24	奉獻之儀，何慢之深也？子問：『佛在、滅後，獻福	奉 獻 之 儀 何 慢 之 深 也 子 問 佛 在 滅 後 獻 福 
T47n1967_003:0143b25	何多？』者，試為明之。且丁蘭刻木於堂，溫清如	何 多 者 試 為 明 之 且 丁 蘭 刻 木 於 堂 溫 清 如 
T47n1967_003:0143b26	在，名光青史，人到于今，稱之為真孝子也。若	在 名 光 青 史 人 到 于 今 稱 之 為 真 孝 子 也 若 
T47n1967_003:0143b27	如來在世，金山晃耀，嚴相赫然，誰有覩之，不	如 來 在 世 金 山 晃 耀 嚴 相 赫 然 誰 有 覩 之 不 
T47n1967_003:0143b28	發道意？獻華伸懇，不亦易哉？洎世雄晦迹，月	發 道 意 獻 華 伸 懇 不 亦 易 哉 洎 世 雄 晦 迹 月 
T47n1967_003:0143b29	隱重山，不奉真儀，但傳貝葉。對之形像，發無	隱 重 山 不 奉 真 儀 但 傳 貝 葉 對 之 形 像 發 無 
T47n1967_003:0143c01	上意，能獻一華，此志、此心，足可嘉尚！有如是	上 意 能 獻 一 華 此 志 此 心 足 可 嘉 尚 有 如 是 
T47n1967_003:0143c02	者，不亦難哉？《涅槃》云：『乃至獻一華，則生不動	者 不 亦 難 哉 涅 槃 云 乃 至 獻 一 華 則 生 不 動 
T47n1967_003:0143c03	國。』是則一香、一華、一燈、一樂，及以飲食，盡心	國 是 則 一 香 一 華 一 燈 一 樂 及 以 飲 食 盡 心 
T47n1967_003:0143c04	樂得奉薦三世諸佛者，淨土妙因，成聖元始，	樂 得 奉 薦 三世諸佛 者 淨 土 妙 因 成 聖 元 始 
T47n1967_003:0143c05	安得輕易其事而不遵之哉？若離於此行，而	安 得 輕 易 其 事 而 不 遵 之 哉 若 離 於 此 行 而 
T47n1967_003:0143c06	聽無稽之言，獻心華、點心燈，焚心香、禮心佛，	聽 無 稽 之 言 獻 心 華 點 心 燈 焚 心 香 禮 心 佛 
T47n1967_003:0143c07	而欲求於正覺者，亦何異騁猿猴之巧、守梅	而 欲 求 於 正 覺 者 亦 何 異 騁 猿 猴 之 巧 守 梅 
T47n1967_003:0143c08	林之望歟？及令彼衣心衣、飯心飯，則困拒不	林 之 望 歟 及 令 彼 衣 心 衣 飯 心 飯 則 困 拒 不 
T47n1967_003:0143c09	已，至於六度萬行，何乃排於空見之心哉？指	已 至 於 六 度 萬 行 何 乃 排 於 空 見 之 心 哉 指 
T47n1967_003:0143c10	心、指空之言，其過若此，不可不慎也！真言門	心 指 空 之 言 其 過 若 此 不 可 不 慎 也 真 言 門 
T47n1967_003:0143c11	中瑜伽觀行，亦約事門表相，不一向推心，常	中 瑜伽觀行 亦 約 事 門 表 相 不 一 向 推 心 常 
T47n1967_003:0143c12	嚴薦香華六時無廢也。」	嚴 薦 香 華 六 時 無 廢 也 
T47n1967_003:0143c13	無相獻華信毀交報門第十九	無 相 獻 華 信 毀 交 報 門 第 十 九 
T47n1967_003:0143c14	問曰：「華者事也，理在何焉？信之與毀，交報	問 曰 華 者 事 也 理 在 何 焉 信 之 與 毀 交 報 
T47n1967_003:0143c15	在何？」對曰：「華即理也，色即空也。信之報者，	在 何 對 曰 華 即 理 也 色 即 空 也 信 之 報 者 
T47n1967_003:0143c16	《悲華經》云：『昔有王子，名無所畏，手持蓮華，	 悲 華 經 云 昔 有 王 子 名 無 所 畏 手 持 蓮 華 
T47n1967_003:0143c17	上寶藏佛。佛言：「汝以蓮華，印於虛空，今與汝	上 寶 藏 佛 佛 言 汝 以 蓮 華 印 於 虛 空 今 與 汝 
T47n1967_003:0143c18	號，名虛空印，當來成佛，世界名蓮華，佛號蓮	號 名 虛 空 印 當來成佛 世 界 名 蓮 華 佛 號 蓮 
T47n1967_003:0143c19	華尊，汝是也。」』國土及佛，皆約昔日所獻蓮華	華 尊 汝 是 也 國 土 及 佛 皆 約 昔 日 所 獻 蓮 華 
T47n1967_003:0143c20	而為號者，欲令明識行因感果之義也。何乃	而 為 號 者 欲 令 明 識 行 因 感 果 之 義 也 何 乃 
T47n1967_003:0143c21	沮檀度之獻華，而欲別遵之無相哉？毀之報	沮 檀 度 之 獻 華 而 欲 別 遵 之 無 相 哉 毀 之 報 
T47n1967_003:0143c22	者，《大方廣總持經》說：『昔有一比丘名淨命，住	者 大 方 廣 總 持 經 說 昔 有 一 比 丘 名 淨 命 住 
T47n1967_003:0143c23	於正見，持華供養；又一比丘名法行，住於邪	於 正 見 持 華 供 養 又 一 比 丘 名 法 行 住 於 邪 
T47n1967_003:0143c24	見，坐得四禪，常說空宗般若最勝，謗淨命法	見 坐 得 四 禪 常 說 空 宗 般 若 最 勝 謗 淨 命 法 
T47n1967_003:0143c25	師云：「淨命所受諸華，不持供養，而自受用。」坐	師 云 淨 命 所 受 諸 華 不 持 供 養 而 自 受 用 坐 
T47n1967_003:0143c26	此一言，於六萬世，常無舌根，乃至成佛，猶居	此 一 言 於 六 萬 世 常 無 舌 根 乃至成佛 猶 居 
T47n1967_003:0143c27	五濁。彼何人耶？即釋迦是也。佛言：「少聞之	五 濁 彼 何 人 耶 即 釋 迦 是 也 佛 言 少 聞 之 
T47n1967_003:0143c28	人，於我法中，作二說者，命終之後，隨於地獄，	人 於 我 法 中 作 二 說 者 命終之後 隨 於 地 獄 
T47n1967_003:0143c29	多百千劫。若以惡眼，視發菩提心人，得無眼	多 百 千 劫 若 以 惡 眼 視 發菩提心 人 得 無 眼 
T47n1967_003:0144a01	報；以惡口，謗發菩提心人，得無舌報。」』若唯修	報 以 惡 口 謗 發菩提心 人 得 無 舌 報 若 唯 修 
T47n1967_003:0144a02	一般若波羅蜜得菩薩者，往昔迦尸迦王行	一 般 若 波 羅 蜜 得 菩 薩 者 往 昔 迦 尸 迦 王 行 
T47n1967_003:0144a03	菩薩行，時捨所愛身頭、目、髓、腦。爾時此王豈	菩 薩 行 時 捨 所 愛 身 頭 目 髓 腦 爾 時 此 王 豈 
T47n1967_003:0144a04	無智慧哉？則知六波羅蜜應具足修，執一非	無 智 慧 哉 則 知 六波羅蜜 應 具 足 修 執 一 非 
T47n1967_003:0144a05	餘，是為魔業。安得棄獻華之檀波羅蜜，而以	餘 是 為 魔 業 安 得 棄 獻 華 之 檀 波 羅 蜜 而 以 
T47n1967_003:0144a06	惡取空，僭易於般若真無相哉？無舌之報，自	惡 取 空 僭 易 於 般 若 真 無 相 哉 無 舌 之 報 自 
T47n1967_003:0144a07	貽伊咎。如來所以自引昔非，欲令眾生不覆	貽 伊 咎 如 來 所 以 自 引 昔 非 欲 令 眾 生 不 覆 
T47n1967_003:0144a08	車於前轍耳。一華若此，一切土、木形像，竹、帛諸	車 於 前 轍 耳 一 華 若 此 一 切 土 木 形 像 竹 帛 諸 
T47n1967_003:0144a09	經，剃髮僧、尼，住持三寶，戒定慧學，無論福田	經 剃 髮 僧 尼 住 持 三 寶 戒 定 慧 學 無 論 福 田 
T47n1967_003:0144a10	及非福田，悉可敬之，一切皆入真實三業供	及 非 福 田 悉 可 敬 之 一 切 皆 入 真 實 三 業 供 
T47n1967_003:0144a11	法界海中，有何不可？而欲略之哉！《法華偈》云：	法 界 海 中 有 何 不 可 而 欲 略 之 哉 法 華 偈 云 
T47n1967_003:0144a12	「『若人於塔廟，　　寶像及畫像，	 若 人 於 塔 廟 寶 像 及 畫 像 
T47n1967_003:0144a13	　　以華香幡蓋，　　敬心而供養，	 以 華 香 幡 蓋 敬 心 而 供 養 
T47n1967_003:0144a14	　　乃至一小音，　　皆已成佛道。』」	 乃 至 一 小 音 皆 已 成 佛 道 
T47n1967_003:0144a15	萬善同歸皆成三昧門第二十	萬 善 同 歸 皆 成 三 昧 門 第 二 十 
T47n1967_003:0144a16	問曰：「夫施燈長明，生日月宮，華香、幡蓋與	問 曰 夫 施 燈 長 明 生 日 月 宮 華 香 幡 蓋 與 
T47n1967_003:0144a17	燈未異，盡生天之福也。而云『皆已成佛道』者，	燈 未 異 盡 生 天 之 福 也 而 云 皆 已 成 佛 道 者 
T47n1967_003:0144a18	何酬報之深哉？」對曰：「如帝王行幸，萬乘千官，	何 酬 報 之 深 哉 對 曰 如 帝 王 行 幸 萬 乘 千 官 
T47n1967_003:0144a19	步卒已來，皆帶御字，犯之天仗，死在斯須。	步 卒 已 來 皆 帶 御 字 犯 之 天 仗 死 在 斯 須 
T47n1967_003:0144a20	若鑾輅還宮，步卒放散，歸乎村墅，苟稱於御	若 鑾 輅 還 宮 步 卒 放 散 歸 乎 村 墅 苟 稱 於 御 
T47n1967_003:0144a21	字，亦死在斯須。且步卒是同，而生、死有異，	字 亦 死 在 斯 須 且 步 卒 是 同 而 生 死 有 異 
T47n1967_003:0144a22	蓋為緣起之殊，有茲寵辱也。向若華、蓋、香、燈，	蓋 為 緣 起 之 殊 有 茲 寵 辱 也 向 若 華 蓋 香 燈 
T47n1967_003:0144a23	不遇《法華經》王命之天仗，實亦報在天宮。今	不 遇 法 華 經 王 命 之 天 仗 實 亦 報 在 天 宮 今 
T47n1967_003:0144a24	逢三昧寶王，猶當扈從，乃至獻一華，皆已成	逢 三 昧 寶 王 猶 當 扈 從 乃 至 獻 一 華 皆 已 成 
T47n1967_003:0144a25	佛道。斯則佛種從緣起，理教然耳！亦猶鳥向	佛 道 斯 則 佛 種 從 緣 起 理 教 然 耳 亦 猶 鳥 向 
T47n1967_003:0144a26	須彌，皆同一色；水朝巨海，無復異名。故《大寶	須 彌 皆 同 一 色 水 朝 巨 海 無 復 異 名 故 大 寶 
T47n1967_003:0144a27	積經．文殊普門會》，會天龍八部，地獄、畜生，色、	積 經 文 殊 普 門 會 會 天 龍 八 部 地 獄 畜 生 色 
