T47n1982_002:0468c17	　衣食支身命　　精麁隨眾等	 衣 食 支 身 命 精 麁 隨 眾 等 
T47n1982_002:0468c18	諸眾等今日晨朝各記六念。	諸 眾 等 今 日 晨 朝 各 記 六 念 
T47n1982_002:0468c19	日中偈云。	日 中 偈 云 
T47n1982_002:0468c20	　人生不精進　　喻若樹無根	 人 生 不 精 進 喻 若 樹 無 根 
T47n1982_002:0468c21	　採花置日裹　　能得幾時鮮	 採 花 置 日 裹 能 得 幾 時 鮮 
T47n1982_002:0468c22	　人命亦如是　　無常須臾間	 人 命 亦 如 是 無 常 須 臾 間 
T47n1982_002:0468c23	　勸諸行道眾　　勤修乃至真	 勸 諸 行 道 眾 勤 修 乃 至 真 
T47n1982_002:0468c24	第二比丘善導謹依大乘經。採集要文以為	第 二 比 丘 善 導 謹 依 大 乘 經 採 集 要 文 以 為 
T47n1982_002:0468c25	讚偈。二十三拜。當初夜時禮。懺悔同前後。	讚 偈 二 十 三 拜 當 初 夜 時 禮 懺 悔 同 前 後 
T47n1982_002:0468c26	至心歸命禮　西方阿彌陀佛　彌陀智願海	至 心 歸 命 禮 西 方 阿 彌 陀 佛 彌 陀 智 願 海 
T47n1982_002:0468c27	　深廣無涯底　　聞名欲往生　　皆悉到彼國	 深 廣 無 涯 底 聞 名 欲 往 生 皆 悉 到 彼 國 
T47n1982_002:0468c28	　願共諸眾生　　往生安樂國	 願 共 諸 眾 生 往 生 安 樂 國 
T47n1982_002:0468c29	至心歸命禮　西方阿彌陀佛　於此世界中	至 心 歸 命 禮 西 方 阿 彌 陀 佛 於 此 世 界 中 
T47n1982_002:0469a01	　六十有七億　　不退諸菩薩　　皆當得生彼	 六 十 有 七 億 不 退 諸 菩 薩 皆 當 得 生 彼 
T47n1982_002:0469a02	　願共諸眾生　　往生安樂國	 願 共 諸 眾 生 往 生 安 樂 國 
T47n1982_002:0469a03	至心歸命禮　西方阿彌陀佛　小行諸菩薩	至 心 歸 命 禮 西 方 阿 彌 陀 佛 小 行 諸 菩 薩 
T47n1982_002:0469a04	　及修少福者　　其數不可計　　皆當得生彼	 及 修 少 福 者 其 數 不 可 計 皆 當 得 生 彼 
T47n1982_002:0469a05	　願共諸眾生　　往生安樂國	 願 共 諸 眾 生 往 生 安 樂 國 
T47n1982_002:0469a06	至心歸命禮　西方阿彌陀佛　十方佛剎中	至 心 歸 命 禮 西 方 阿 彌 陀 佛 十 方 佛 剎 中 
T47n1982_002:0469a07	　菩薩比丘眾　　窮劫不可計　　皆當得往生	 菩 薩 比 丘 眾 窮 劫 不 可 計 皆 當 得 往 生 
T47n1982_002:0469a08	　願共諸眾生　　往生安樂國	 願 共 諸 眾 生 往 生 安 樂 國 
T47n1982_002:0469a09	至心歸命禮　西方阿彌陀佛　一切諸菩薩	至 心 歸 命 禮 西 方 阿 彌 陀 佛 一切諸菩薩 
T47n1982_002:0469a10	　各齎天妙華　　寶香無價衣　　供養彌陀佛	 各 齎 天 妙 華 寶 香 無 價 衣 供 養 彌 陀 佛 
T47n1982_002:0469a11	　願共諸眾生　　往生安樂國	 願 共 諸 眾 生 往 生 安 樂 國 
T47n1982_002:0469a12	至心歸命禮　西方阿彌陀佛　咸然奏天樂	至 心 歸 命 禮 西 方 阿 彌 陀 佛 咸 然 奏 天 樂 
T47n1982_002:0469a13	　暢發和雅音　　歌歎最勝尊　　供養彌陀佛	 暢 發 和 雅 音 歌 歎 最 勝 尊 供 養 彌 陀 佛 
T47n1982_002:0469a14	　願共諸眾生　　往生安樂國	 願 共 諸 眾 生 往 生 安 樂 國 
T47n1982_002:0469a15	至心歸命禮　西方阿彌陀佛　慧日照世間	至 心 歸 命 禮 西 方 阿 彌 陀 佛 慧 日 照 世 間 
T47n1982_002:0469a16	　消除生死雲　　恭敬遶三匝　　稽首彌陀佛	 消 除 生 死 雲 恭 敬 遶 三 匝 稽 首 彌 陀 佛 
T47n1982_002:0469a17	　願共諸眾生　　往生安樂國	 願 共 諸 眾 生 往 生 安 樂 國 
T47n1982_002:0469a18	至心歸命禮　西方阿彌陀佛　見彼嚴淨土	至 心 歸 命 禮 西 方 阿 彌 陀 佛 見 彼 嚴 淨 土 
T47n1982_002:0469a19	　微妙難思議　　因發無上心　　願我國亦然	 微 妙 難 思 議 因 發 無 上 心 願 我 國 亦 然 
T47n1982_002:0469a20	　願共諸眾生　　往生安樂國	 願 共 諸 眾 生 往 生 安 樂 國 
T47n1982_002:0469a21	至心歸命禮　西方阿彌陀佛　應時無量尊	至 心 歸 命 禮 西 方 阿 彌 陀 佛 應 時 無 量 尊 
T47n1982_002:0469a22	　動容發欣笑　　口出無數光　　遍照十方國	 動 容 發 欣 笑 口 出 無 數 光 遍照十方 國 
T47n1982_002:0469a23	　願共諸眾生　　往生安樂國	 願 共 諸 眾 生 往 生 安 樂 國 
T47n1982_002:0469a24	至心歸命禮　西方阿彌陀佛　迴光圍遶身	至 心 歸 命 禮 西 方 阿 彌 陀 佛 迴 光 圍 遶 身 
T47n1982_002:0469a25	　三匝從頂入　　一切天人眾　　踊躍皆歡喜	 三 匝 從 頂 入 一 切 天 人 眾 踊 躍 皆 歡 喜 
T47n1982_002:0469a26	　願共諸眾生　　往生安樂國	 願 共 諸 眾 生 往 生 安 樂 國 
T47n1982_002:0469a27	至心歸命禮　西方阿彌陀佛　梵聲如雷震	至 心 歸 命 禮 西 方 阿 彌 陀 佛 梵 聲 如 雷 震 
T47n1982_002:0469a28	　八音暢妙響　　十方來正士　　吾悉知彼願	 八 音 暢 妙 響 十 方 來 正 士 吾 悉 知 彼 願 
T47n1982_002:0469a29	　願共諸眾生　　往生安樂國	 願 共 諸 眾 生 往 生 安 樂 國 
T47n1982_002:0469b01	至心歸命禮　西方阿彌陀佛　至彼嚴淨土	至 心 歸 命 禮 西 方 阿 彌 陀 佛 至 彼 嚴 淨 土 
T47n1982_002:0469b02	　便速得神通　　必於無量尊　　受記成等覺	 便 速 得 神 通 必 於 無 量 尊 受 記 成 等 覺 
T47n1982_002:0469b03	　願共諸眾生　　往生安樂國	 願 共 諸 眾 生 往 生 安 樂 國 
T47n1982_002:0469b04	至心歸命禮　西方阿彌陀佛　奉事億如來	至 心 歸 命 禮 西 方 阿 彌 陀 佛 奉 事 億 如 來 
T47n1982_002:0469b05	　飛化遍諸剎　　恭敬歡喜去　　還到安養國	 飛 化 遍 諸 剎 恭 敬 歡 喜 去 還 到 安 養 國 
T47n1982_002:0469b06	　願共諸眾生　　往生安樂國	 願 共 諸 眾 生 往 生 安 樂 國 
T47n1982_002:0469b07	至心歸命禮　西方阿彌陀佛　若人無善本	至 心 歸 命 禮 西 方 阿 彌 陀 佛 若 人 無 善 本 
T47n1982_002:0469b08	　不得聞佛名　　憍慢弊懈怠　　難以信此法	 不 得 聞 佛 名 憍 慢 弊 懈 怠 難 以 信 此 法 
T47n1982_002:0469b09	　願共諸眾生　　往生安樂國	 願 共 諸 眾 生 往 生 安 樂 國 
T47n1982_002:0469b10	至心歸命禮　西方阿彌陀佛　宿世見諸佛	至 心 歸 命 禮 西 方 阿 彌 陀 佛 宿 世 見 諸 佛 
T47n1982_002:0469b11	　則能信此事　　謙敬聞奉行　　踊躍大歡喜	 則 能 信 此 事 謙 敬 聞 奉 行 踊躍大歡喜 
T47n1982_002:0469b12	　願共諸眾生　　往生安樂國	 願 共 諸 眾 生 往 生 安 樂 國 
T47n1982_002:0469b13	至心歸命禮　西方阿彌陀佛　其有得聞彼	至 心 歸 命 禮 西 方 阿 彌 陀 佛 其 有 得 聞 彼 
T47n1982_002:0469b14	　彌陀佛名號　　歡喜至一心　　皆當得生彼	 彌 陀 佛 名 號 歡 喜 至 一 心 皆 當 得 生 彼 
T47n1982_002:0469b15	　願共諸眾生　　往生安樂國	 願 共 諸 眾 生 往 生 安 樂 國 
T47n1982_002:0469b16	至心歸命禮　西方阿彌陀佛　設滿大千火	至 心 歸 命 禮 西 方 阿 彌 陀 佛 設 滿 大 千 火 
T47n1982_002:0469b17	　直過聞佛名　　聞名歡喜讚　　皆當得生彼	 直 過 聞 佛 名 聞 名 歡 喜 讚 皆 當 得 生 彼 
T47n1982_002:0469b18	　願共諸眾生　　往生安樂國	 願 共 諸 眾 生 往 生 安 樂 國 
T47n1982_002:0469b19	至心歸命禮　西方阿彌陀佛　萬年三寶滅	至 心 歸 命 禮 西 方 阿 彌 陀 佛 萬 年 三 寶 滅 
T47n1982_002:0469b20	　此經住百年　　爾時聞一念　　皆當得生彼	 此 經 住 百 年 爾 時 聞 一 念 皆 當 得 生 彼 
T47n1982_002:0469b21	　願共諸眾生　　往生安樂國	 願 共 諸 眾 生 往 生 安 樂 國 
T47n1982_002:0469b22	至心歸命禮　西方阿彌陀佛　佛世甚難值	至 心 歸 命 禮 西 方 阿 彌 陀 佛 佛 世 甚 難 值 
T47n1982_002:0469b23	　人有信慧難　　遇聞希有法　　此復最為難	 人 有 信 慧 難 遇 聞 希 有 法 此 復 最 為 難 
T47n1982_002:0469b24	　自信教人信　　難中轉更難　　大慈弘普化	 自 信 教 人 信 難 中 轉 更 難 大 慈 弘 普 化 
T47n1982_002:0469b25	　真成報佛恩　　願共諸眾生　　往生安樂國	 真 成 報 佛 恩 願 共 諸 眾 生 往 生 安 樂 國 
T47n1982_002:0469b26	至心歸命禮　西方阿彌陀佛　哀愍覆護我	至 心 歸 命 禮 西 方 阿 彌 陀 佛 哀 愍 覆 護 我 
T47n1982_002:0469b27	　令法種增長　　此世及後生　　願佛常攝受	 令 法 種 增 長 此 世 及 後 生 願 佛 常 攝 受 
T47n1982_002:0469b28	　願共諸眾生　　往生安樂國	 願 共 諸 眾 生 往 生 安 樂 國 
T47n1982_002:0469b29	至心歸命禮　西方阿彌陀佛　觀世音菩薩	至 心 歸 命 禮 西 方 阿 彌 陀 佛 觀 世 音 菩 薩 
T47n1982_002:0469c01	　願共諸眾生　往生安樂國	 願 共 諸 眾 生 往 生 安 樂 國 
T47n1982_002:0469c02	至心歸命禮　西方阿彌陀佛　大勢至菩薩	至 心 歸 命 禮 西 方 阿 彌 陀 佛 大 勢 至 菩 薩 
T47n1982_002:0469c03	　願共諸眾生　往生安樂國	 願 共 諸 眾 生 往 生 安 樂 國 
T47n1982_002:0469c04	至心歸命禮　西方阿彌陀佛　諸菩薩清淨大	至 心 歸 命 禮 西 方 阿 彌 陀 佛 諸 菩 薩 清 淨 大 
T47n1982_002:0469c05	海眾　願共諸眾生　往生安樂國	海 眾 願 共 諸 眾 生 往 生 安 樂 國 
T47n1982_002:0469c06	普為師僧父母及善知識法界眾生。斷除三	普 為 師 僧 父 母 及 善 知 識 法 界 眾 生 斷 除 三 
T47n1982_002:0469c07	障。同得往生阿彌陀佛國。歸命懺悔。	障 同 得 往 生 阿 彌 陀 佛 國 歸 命 懺 悔 
T47n1982_002:0469c08	第三依龍樹菩薩願生禮讚偈一十六拜。當	第 三 依 龍 樹 菩 薩 願 生 禮 讚 偈 一 十 六 拜 當 
T47n1982_002:0469c09	中夜時禮。懺悔同前後。	中 夜 時 禮 懺 悔 同 前 後 
T47n1982_002:0469c10	至心歸命禮西方阿彌陀佛。	至 心 歸 命 禮 西 方 阿 彌 陀 佛 
T47n1982_002:0469c11	　稽首天人所恭敬　　阿彌陀佛兩足尊	 稽 首 天 人 所 恭 敬 阿 彌 陀 佛 兩 足 尊 
T47n1982_002:0469c12	　在彼微妙安樂國　　無量佛子眾圍遶	 在 彼 微 妙 安 樂 國 無 量 佛 子 眾 圍 遶 
T47n1982_002:0469c13	　故我頂禮彌陀佛	 故 我 頂 禮 彌 陀 佛 
T47n1982_002:0469c14	願共諸眾生。往生安樂國。	願 共 諸 眾 生 往 生 安 樂 國 
T47n1982_002:0469c15	至心歸命禮西方阿彌陀佛。	至 心 歸 命 禮 西 方 阿 彌 陀 佛 
T47n1982_002:0469c16	　金色身淨如山王　　奢摩他行如象步	 金 色 身 淨 如 山 王 奢 摩 他 行 如 象 步 
T47n1982_002:0469c17	　兩目淨若青蓮花　　故我頂禮彌陀佛	 兩 目 淨 若 青 蓮 花 故 我 頂 禮 彌 陀 佛 
T47n1982_002:0469c18	願共諸眾生。往生安樂國。	願 共 諸 眾 生 往 生 安 樂 國 
T47n1982_002:0469c19	至心歸命禮西方阿彌陀佛。	至 心 歸 命 禮 西 方 阿 彌 陀 佛 
T47n1982_002:0469c20	　面善圓淨如滿月　　威光猶如百千日	 面 善 圓 淨 如 滿 月 威 光 猶 如 百 千 日 
T47n1982_002:0469c21	　聲若天鼓俱翅羅　　故我頂禮彌陀佛	 聲 若 天 鼓 俱 翅 羅 故 我 頂 禮 彌 陀 佛 
T47n1982_002:0469c22	願共諸眾生。往生安樂國。	願 共 諸 眾 生 往 生 安 樂 國 
T47n1982_002:0469c23	至心歸命禮西方阿彌陀佛。	至 心 歸 命 禮 西 方 阿 彌 陀 佛 
T47n1982_002:0469c24	　觀音頂戴冠中住　　種種妙相寶莊嚴	 觀 音 頂 戴 冠 中 住 種 種 妙 相 寶 莊 嚴 
T47n1982_002:0469c25	　能伏外道魔憍慢　　故我頂禮彌陀佛	 能 伏 外 道 魔 憍 慢 故 我 頂 禮 彌 陀 佛 
T47n1982_002:0469c26	願共諸眾生。往生安樂國。	願 共 諸 眾 生 往 生 安 樂 國 
T47n1982_002:0469c27	至心歸命禮西方阿彌陀佛。	至 心 歸 命 禮 西 方 阿 彌 陀 佛 
T47n1982_002:0469c28	　無比無垢廣清淨　　眾德皎潔如虛空	 無 比 無 垢 廣 清 淨 眾 德 皎 潔 如 虛 空 
T47n1982_002:0469c29	　所作利益得自在　　故我頂禮彌陀佛	 所 作 利 益 得 自 在 故 我 頂 禮 彌 陀 佛 
T47n1982_002:0470a01	願共諸眾生。往生安樂國。	願 共 諸 眾 生 往 生 安 樂 國 
T47n1982_002:0470a02	至心歸命禮西方阿彌陀佛。	至 心 歸 命 禮 西 方 阿 彌 陀 佛 
T47n1982_002:0470a03	　十方名聞菩薩眾　　無量諸魔常讚歎	 十 方 名 聞 菩 薩 眾 無 量 諸 魔 常 讚 歎 
T47n1982_002:0470a04	　為諸眾生願力住　　故我頂禮彌陀佛	 為 諸 眾 生 願 力 住 故 我 頂 禮 彌 陀 佛 
T47n1982_002:0470a05	願共諸眾生。往生安樂國。	願 共 諸 眾 生 往 生 安 樂 國 
T47n1982_002:0470a06	至心歸命禮西方阿彌陀佛。	至 心 歸 命 禮 西 方 阿 彌 陀 佛 
T47n1982_002:0470a07	　金底寶澗池生華　　善根所成妙臺座	 金 底 寶 澗 池 生 華 善 根 所 成 妙 臺 座 
T47n1982_002:0470a08	　於彼座上如山王　　故我頂禮彌陀佛	 於 彼 座 上 如 山 王 故 我 頂 禮 彌 陀 佛 
T47n1982_002:0470a09	願共諸眾生。往生安樂國。	願 共 諸 眾 生 往 生 安 樂 國 
T47n1982_002:0470a10	至心歸命禮西方阿彌陀佛。	至 心 歸 命 禮 西 方 阿 彌 陀 佛 
T47n1982_002:0470a11	　十方所來諸佛子　　顯現神通至安樂	 十 方 所 來 諸 佛 子 顯 現 神 通 至 安 樂 
T47n1982_002:0470a12	　瞻仰尊顏常恭敬　　故我頂禮彌陀佛	 瞻 仰 尊 顏 常 恭 敬 故 我 頂 禮 彌 陀 佛 
T47n1982_002:0470a13	願共諸眾生。往生安樂國。	願 共 諸 眾 生 往 生 安 樂 國 
T47n1982_002:0470a14	至心歸命禮西方阿彌陀佛。	至 心 歸 命 禮 西 方 阿 彌 陀 佛 
T47n1982_002:0470a15	　諸有無常無我等　　亦如水月電影露	 諸 有 無 常 無 我 等 亦 如 水 月 電 影 露 
T47n1982_002:0470a16	　為眾說法無名字　　故我頂禮彌陀佛	 為 眾 說 法 無 名 字 故 我 頂 禮 彌 陀 佛 
T47n1982_002:0470a17	願共諸眾生。往生安樂國。	願 共 諸 眾 生 往 生 安 樂 國 
T47n1982_002:0470a18	至心歸命禮西方阿彌陀佛。	至 心 歸 命 禮 西 方 阿 彌 陀 佛 
T47n1982_002:0470a19	　彼尊佛剎無惡名　　亦無女人惡道怖	 彼 尊 佛 剎 無 惡 名 亦 無 女 人 惡 道 怖 
T47n1982_002:0470a20	　眾人至心敬彼尊　　故我頂禮彌陀佛	 眾 人 至 心 敬 彼 尊 故 我 頂 禮 彌 陀 佛 
T47n1982_002:0470a21	願共諸眾生。往生安樂國。	願 共 諸 眾 生 往 生 安 樂 國 
T47n1982_002:0470a22	至心歸命禮西方阿彌陀佛。	至 心 歸 命 禮 西 方 阿 彌 陀 佛 
T47n1982_002:0470a23	　彼尊無量方便境　　無有諸趣惡知識	 彼 尊 無量方便 境 無 有 諸 趣 惡 知 識 
T47n1982_002:0470a24	　往生不退至菩提　　故我頂禮彌陀佛	 往 生 不 退 至 菩 提 故 我 頂 禮 彌 陀 佛 
T47n1982_002:0470a25	願共諸眾生。往生安樂國。	願 共 諸 眾 生 往 生 安 樂 國 
T47n1982_002:0470a26	至心歸命禮西方阿彌陀佛。	至 心 歸 命 禮 西 方 阿 彌 陀 佛 
T47n1982_002:0470a27	　我說彼尊功德事　　眾善無邊如海水	 我 說 彼 尊 功 德 事 眾 善 無 邊 如 海 水 
T47n1982_002:0470a28	　所作善根清淨者　　迴施眾生生彼土	 所 作 善 根 清 淨 者 迴 施 眾 生 生 彼 土 
T47n1982_002:0470a29	願共諸眾生。往生安樂國。	願 共 諸 眾 生 往 生 安 樂 國 
T47n1982_002:0470b01	至心歸命禮　西方阿彌陀佛　哀愍覆護我	至 心 歸 命 禮 西 方 阿 彌 陀 佛 哀 愍 覆 護 我 
T47n1982_002:0470b02	　令法種增長　　此世及後生　　願佛常攝受	 令 法 種 增 長 此 世 及 後 生 願 佛 常 攝 受 
T47n1982_002:0470b03	　願共諸眾生　　往生安樂國	 願 共 諸 眾 生 往 生 安 樂 國 
T47n1982_002:0470b04	至心歸命禮　西方極樂世界觀世音菩薩	至 心 歸 命 禮 西方極樂 世 界 觀 世 音 菩 薩 
T47n1982_002:0470b05	　願共諸眾生　往生安樂國。	 願 共 諸 眾 生 往 生 安 樂 國 
T47n1982_002:0470b06	至心歸命禮　西方極樂世界大勢至菩薩	至 心 歸 命 禮 西方極樂 世 界 大 勢 至 菩 薩 
T47n1982_002:0470b07	　願共諸眾生　往生安樂國。	 願 共 諸 眾 生 往 生 安 樂 國 
T47n1982_002:0470b08	至心歸命禮　西方極樂世界諸菩薩清淨大	至 心 歸 命 禮 西方極樂 世 界 諸 菩 薩 清 淨 大 
T47n1982_002:0470b09	海眾　願共諸眾生　往生安樂國◎	海 眾 願 共 諸 眾 生 往 生 安 樂 國 
T47n1982_002:0470b10	◎普為師僧父母及善知識法界眾生。斷除	 普 為 師 僧 父 母 及 善 知 識 法 界 眾 生 斷 除 
T47n1982_002:0470b11	三障。同得往生阿彌陀佛國。歸命懺悔至心	三 障 同 得 往 生 阿 彌 陀 佛 國 歸 命 懺 悔 至 心 
T47n1982_002:0470b12	懺悔。自從無始受身來。恒以十惡加眾生。不	懺 悔 自 從 無 始 受 身 來 恒 以 十 惡 加 眾 生 不 
T47n1982_002:0470b13	孝父母謗三寶。造作五逆不善業。以是眾罪	孝 父 母 謗 三 寶 造 作 五 逆 不 善 業 以 是 眾 罪 
T47n1982_002:0470b14	因緣故。妄想顛倒生纏縛。應受無量生死	因 緣 故 妄 想 顛 倒 生 纏 縛 應 受 無 量 生 死 
T47n1982_002:0470b15	苦。頂禮懺悔願滅除。懺悔已至心歸命禮	苦 頂 禮 懺 悔 願 滅 除 懺 悔 已 至 心 歸 命 禮 
T47n1982_002:0470b16	阿彌陀佛。	阿 彌 陀 佛 
T47n1982_002:0470b17	至心勸請。諸佛大慈無上尊。恒以空慧照三	至 心 勸 請 諸 佛 大 慈 無 上 尊 恒 以 空 慧 照 三 
T47n1982_002:0470b18	界。眾生盲冥不覺知。永沈生死大苦海。為拔	界 眾 生 盲 冥 不 覺 知 永 沈 生 死 大 苦 海 為 拔 
T47n1982_002:0470b19	群生離諸苦。勸請常住轉法輪。勸請已至心	群 生 離 諸 苦 勸 請 常 住 轉 法 輪 勸 請 已 至 心 
T47n1982_002:0470b20	歸命禮阿彌陀佛。	歸 命 禮 阿 彌 陀 佛 
T47n1982_002:0470b21	至心隨喜。歷劫已來懷嫉妬。我慢放逸由癡	至 心 隨 喜 歷 劫 已 來 懷 嫉 妬 我 慢 放 逸 由 癡 
T47n1982_002:0470b22	生。恒以瞋恚毒害火。焚燒智慧慈善根。今日	生 恒 以 瞋 恚 毒 害 火 焚 燒 智 慧 慈 善 根 今 日 
T47n1982_002:0470b23	思惟始惺悟。發大精進隨喜心。隨喜已至心	思 惟 始 惺 悟 發大精進 隨 喜 心 隨 喜 已 至 心 
T47n1982_002:0470b24	歸命禮阿彌陀佛。	歸 命 禮 阿 彌 陀 佛 
T47n1982_002:0470b25	至心迴向。流浪三界內。癡愛入胎獄。生已歸	至 心 迴 向 流 浪 三 界 內 癡 愛 入 胎 獄 生 已 歸 
T47n1982_002:0470b26	老死。沈沒於苦海。我今修此福。迴生安樂土。	老 死 沈 沒 於 苦 海 我 今 修 此 福 迴 生 安 樂 土 
T47n1982_002:0470b27	迴向已至心歸命禮阿彌陀佛。	迴 向 已 至 心 歸 命 禮 阿 彌 陀 佛 
T47n1982_002:0470b28	至心發願。願捨胎藏形。往生安樂國。速見彌	至 心 發 願 願 捨 胎 藏 形 往 生 安 樂 國 速 見 彌 
T47n1982_002:0470b29	陀佛。無邊功德身。奉覲諸如來。賢聖亦復	陀 佛 無 邊 功 德 身 奉 覲 諸 如 來 賢 聖 亦 復 
T47n1982_002:0470c01	然。獲六神通力。救攝苦眾生。虛空法界盡。	然 獲 六 神 通 力 救 攝 苦 眾 生 虛 空 法 界 盡 
T47n1982_002:0470c02	我願亦如是。發願已至心歸命禮阿彌陀佛	我 願 亦 如 是 發 願 已 至 心 歸 命 禮 阿 彌 陀 佛 
T47n1982_002:0470c03	(餘悉同上法)。	 餘 悉 同 上 法 
T47n1982_002:0470c04	第四依天親菩薩願往生禮讚偈二十拜。當	第 四 依 天 親 菩 薩 願 往 生 禮 讚 偈 二 十 拜 當 
T47n1982_002:0470c05	後夜時禮(懺悔同前後)。	後 夜 時 禮 懺 悔 同 前 後 
T47n1982_002:0470c06	至心歸命禮　西方阿彌陀佛　世尊我一心	至 心 歸 命 禮 西 方 阿 彌 陀 佛 世 尊 我 一 心 
T47n1982_002:0470c07	　歸命盡十方　　無礙光如來　　願生安樂國	 歸 命 盡 十 方 無 礙 光 如 來 願 生 安 樂 國 
T47n1982_002:0470c08	至心歸命禮　西方阿彌陀佛　觀彼世界相	至 心 歸 命 禮 西 方 阿 彌 陀 佛 觀 彼 世 界 相 
T47n1982_002:0470c09	　勝過三界道　　究竟如虛空　　廣大無邊際	 勝 過 三 界 道 究 竟 如 虛 空 廣 大 無 邊 際 
T47n1982_002:0470c10	　願共諸眾生　　往生安樂國	 願 共 諸 眾 生 往 生 安 樂 國 
T47n1982_002:0470c11	至心歸命禮　西方阿彌陀佛　正道大慈悲	至 心 歸 命 禮 西 方 阿 彌 陀 佛 正 道 大 慈 悲 
T47n1982_002:0470c12	　出世善根生　　淨光明滿足　　如鏡日月輪	 出 世 善 根 生 淨 光 明 滿 足 如 鏡 日 月 輪 
T47n1982_002:0470c13	　願共諸眾生　　往生安樂國	 願 共 諸 眾 生 往 生 安 樂 國 
T47n1982_002:0470c14	至心歸命禮　西方阿彌陀佛　備諸珍寶性	至 心 歸 命 禮 西 方 阿 彌 陀 佛 備 諸 珍 寶 性 
T47n1982_002:0470c15	　具足妙莊嚴　　無垢光焰熾　　明淨曜世間	 具 足 妙 莊 嚴 無 垢 光 焰 熾 明 淨 曜 世 間 
T47n1982_002:0470c16	　願共諸眾生　　往生安樂國	 願 共 諸 眾 生 往 生 安 樂 國 
T47n1982_002:0470c17	至心歸命禮　西方阿彌陀佛　寶華千萬種	至 心 歸 命 禮 西 方 阿 彌 陀 佛 寶 華 千 萬 種 
T47n1982_002:0470c18	　彌覆池流泉　　微風動花葉　　交錯光亂轉	 彌 覆 池 流 泉 微 風 動 花 葉 交 錯 光 亂 轉 
T47n1982_002:0470c19	　願共諸眾生　　往生安樂國	 願 共 諸 眾 生 往 生 安 樂 國 
T47n1982_002:0470c20	至心歸命禮　西方阿彌陀佛　宮殿諸樓閣	至 心 歸 命 禮 西 方 阿 彌 陀 佛 宮 殿 諸 樓 閣 
T47n1982_002:0470c21	　觀十方無礙　　雜樹異光色　　寶欄遍圍遶	 觀 十 方 無 礙 雜 樹 異 光 色 寶 欄 遍 圍 遶 
T47n1982_002:0470c22	　願共諸眾生　　往生安樂國	 願 共 諸 眾 生 往 生 安 樂 國 
T47n1982_002:0470c23	至心歸命禮　西方阿彌陀佛　無量寶交絡	至 心 歸 命 禮 西 方 阿 彌 陀 佛 無 量 寶 交 絡 
T47n1982_002:0470c24	　羅網遍虛空　　種種鈴發響　　宣吐妙法音	 羅 網 遍 虛 空 種 種 鈴 發 響 宣 吐 妙 法 音 
T47n1982_002:0470c25	　願共諸眾生　　往生安樂國	 願 共 諸 眾 生 往 生 安 樂 國 
T47n1982_002:0470c26	至心歸命禮　西方阿彌陀佛　梵音悟深遠	至 心 歸 命 禮 西 方 阿 彌 陀 佛 梵 音 悟 深 遠 
T47n1982_002:0470c27	　微妙聞十方　　正覺阿彌陀　　法王善住持	 微 妙 聞 十 方 正 覺 阿 彌 陀 法 王 善 住 持 
T47n1982_002:0470c28	　願共諸眾生　　往生安樂國	 願 共 諸 眾 生 往 生 安 樂 國 
T47n1982_002:0470c29	至心歸命禮　西方阿彌陀佛　如來淨華眾	至 心 歸 命 禮 西 方 阿 彌 陀 佛 如 來 淨 華 眾 
T47n1982_002:0471a01	　正覺花化生　　愛樂佛法味　　禪三昧為食	 正 覺 花 化 生 愛 樂 佛 法 味 禪 三 昧 為 食 
T47n1982_002:0471a02	　願共諸眾生　　往生安樂國	 願 共 諸 眾 生 往 生 安 樂 國 
T47n1982_002:0471a03	至心歸命禮　西方阿彌陀佛　永離身心惱	至 心 歸 命 禮 西 方 阿 彌 陀 佛 永 離 身 心 惱 
T47n1982_002:0471a04	　受樂常無間　　大乘善根界　　等無譏嫌名	 受 樂 常 無 間 大 乘 善 根 界 等 無 譏 嫌 名 
T47n1982_002:0471a05	　願共諸眾生　　往生安樂國	 願 共 諸 眾 生 往 生 安 樂 國 
T47n1982_002:0471a06	至心歸命禮　西方阿彌陀佛　女人及根缺	至 心 歸 命 禮 西 方 阿 彌 陀 佛 女 人 及 根 缺 
T47n1982_002:0471a07	　二乘種不生　　眾生所願樂　　一切能滿足	 二 乘 種 不 生 眾 生 所 願 樂 一 切 能 滿 足 
T47n1982_002:0471a08	　願共諸眾生　　往生安樂國	 願 共 諸 眾 生 往 生 安 樂 國 
T47n1982_002:0471a09	至心歸命禮　西方阿彌陀佛　無量大寶王	至 心 歸 命 禮 西 方 阿 彌 陀 佛 無 量 大 寶 王 
T47n1982_002:0471a10	　微妙淨花臺　　相好光一尋　　色像超群生	 微 妙 淨 花 臺 相 好 光 一 尋 色 像 超 群 生 
T47n1982_002:0471a11	　願共諸眾生　　往生安樂國	 願 共 諸 眾 生 往 生 安 樂 國 
T47n1982_002:0471a12	至心歸命禮　西方阿彌陀佛　天人不動眾	至 心 歸 命 禮 西 方 阿 彌 陀 佛 天 人 不 動 眾 
T47n1982_002:0471a13	　清淨智海王　　如須彌山王　　勝妙無過者	 清 淨 智 海 王 如須彌山 王 勝 妙 無 過 者 
T47n1982_002:0471a14	　願共諸眾生　　往生安樂國	 願 共 諸 眾 生 往 生 安 樂 國 
T47n1982_002:0471a15	至心歸命禮　西方阿彌陀佛　天人丈夫眾	至 心 歸 命 禮 西 方 阿 彌 陀 佛 天 人 丈 夫 眾 
T47n1982_002:0471a16	　恭敬遶瞻仰　　雨天樂花衣　　妙香等供養	 恭 敬 遶 瞻 仰 雨 天 樂 花 衣 妙 香 等 供 養 
T47n1982_002:0471a17	　願共諸眾生　　往生安樂國	 願 共 諸 眾 生 往 生 安 樂 國 
T47n1982_002:0471a18	至心歸命禮　西方阿彌陀佛　安樂國清淨	至 心 歸 命 禮 西 方 阿 彌 陀 佛 安 樂 國 清 淨 
T47n1982_002:0471a19	　常轉無垢輪　　一念及一時　　利益諸群生	 常 轉 無 垢 輪 一 念 及 一 時 利 益 諸 群 生 
T47n1982_002:0471a20	　願共諸眾生　　往生安樂國	 願 共 諸 眾 生 往 生 安 樂 國 
