T47n1967_001:0136a08	降，不服者咸服，則使天下一統矣！獵獵旌旗	降 不 服 者 咸 服 則 使 天 下 一 統 矣 獵 獵 旌 旗 
T47n1967_001:0136a09	而焉用？翩翩飛將而奚適？吾將却馬以糞田，	而 焉 用 翩 翩 飛 將 而 奚 適 吾 將 却 馬 以 糞 田 
T47n1967_001:0136a10	日出而作，日入而息，雖帝堯之聖，於我何力	日 出 而 作 日 入 而 息 雖 帝 堯 之 聖 於 我 何 力 
T47n1967_001:0136a11	哉？百姓日用而不知，方明聖化之廣被矣！若	哉 百 姓 日 用 而 不 知 方 明 聖 化 之 廣 被 矣 若 
T47n1967_001:0136a12	能悟色、聲而為佛者，念眾生為當來佛者，必	能 悟 色 聲 而 為 佛 者 念 眾 生 為 當 來 佛 者 必 
T47n1967_001:0136a13	不立心前之凡境也，或想自身為本尊也，瑜	不 立 心 前 之 凡 境 也 或 想 自 身 為 本 尊 也 瑜 
T47n1967_001:0136a14	伽真言深妙觀門，不謀而會。夫因想而有者，	伽 真 言 深 妙 觀 門 不 謀 而 會 夫 因 想 而 有 者 
T47n1967_001:0136a15	豈得不空哉？則大鵬將尺鷃以齊，太山與秋	豈 得 不 空 哉 則 大 鵬 將 尺 鷃 以 齊 太 山 與 秋 
T47n1967_001:0136a16	毫而一，無夷岳之僻，續鳧之憂矣。」問曰：「湯獄	毫 而 一 無 夷 岳 之 僻 續 鳧 之 憂 矣 問 曰 湯 獄 
T47n1967_001:0136a17	之子殊未發心，如來法王宥過與記，千光散	之 子 殊 未 發 心 如 來 法 王 宥 過 與 記 千 光 散 
T47n1967_001:0136a18	射，十號圓明。誠如弗言，孰敢不信？原夫未	射 十 號 圓 明 誠 如 弗 言 孰 敢 不 信 原 夫 未 
T47n1967_001:0136a19	悟，從何得醒耶？」對曰：「言未悟者，亦有義焉。	悟 從 何 得 醒 耶 對 曰 言 未 悟 者 亦 有 義 焉 
T47n1967_001:0136a20	夫長江之源濫乎一觴，大迷之本存乎二見。	夫 長 江 之 源 濫 乎 一 觴 大 迷 之 本 存 乎 二 見 
T47n1967_001:0136a21	若謂念外立無念，生外立無生，則生死異於	若 謂 念 外 立 無 念 生 外 立 無 生 則 生 死 異 於 
T47n1967_001:0136a22	涅槃也。萬佛洪音，莫之能訓矣！若了念而無	涅 槃 也 萬 佛 洪 音 莫 之 能 訓 矣 若 了 念 而 無 
T47n1967_001:0136a23	念，觀生而不生，煩惱即菩提也。一相莊嚴，斯	念 觀 生 而 不 生 煩 惱 即 菩 提 也 一 相 莊 嚴 斯 
T47n1967_001:0136a24	之能悟矣！亦猶巖上群蜂已房純蜜，井中七	之 能 悟 矣 亦 猶 巖 上 群 蜂 已 房 純 蜜 井 中 七 
T47n1967_001:0136a25	寶何廢稱珍，皆本有之，非適今也。念未來	寶 何 廢 稱 珍 皆 本 有 之 非 適 今 也 念 未 來 
T47n1967_001:0136a26	佛，罪從何生，吾放其心，遍一切所緣之處，皆	佛 罪 從 何 生 吾 放 其 心 遍 一 切 所 緣 之 處 皆 
T47n1967_001:0136a27	見如來，道從恚等生。於是乎，在《如來藏經》，佛	見 如 來 道 從 恚 等 生 於 是 乎 在 如 來 藏 經 佛 
T47n1967_001:0136a28	告金剛慧菩薩言：『善男子，我以佛眼，觀一切	告 金 剛 慧 菩 薩 言 善 男 子 我 以 佛 眼 觀 一 切 
T47n1967_001:0136a29	眾生貪欲、恚、癡諸煩惱中，有如來智、如來眼、	眾 生 貪 欲 恚 癡 諸 煩 惱 中 有 如 來 智 如 來 眼 
T47n1967_001:0136b01	如來身，結加趺坐，儼然不動。乃至德相備	如 來 身 結加趺坐 儼 然 不 動 乃 至 德 相 備 
T47n1967_001:0136b02	足，如我無異。』廣說一切眾生，有如來藏，以九	足 如 我 無 異 廣 說 一 切 眾 生 有 如 來 藏 以 九 
T47n1967_001:0136b03	喻況之。《寶性論》釋而結頌言：	喻 況 之 寶 性 論 釋 而 結 頌 言 
T47n1967_001:0136b04	「『萎華中諸佛，　　糞穢中真金，	 萎 華 中 諸 佛 糞 穢 中 真 金 
T47n1967_001:0136b05	　　地中珍寶藏，　　諸果子中牙，	 地 中 珍 寶 藏 諸 果 子 中 牙 
T47n1967_001:0136b06	　　朽故弊壞衣，　　纏裹真金像，	 朽故弊壞衣 纏 裹 真 金 像 
T47n1967_001:0136b07	　　貧賤醜陋女，　　懷轉輪聖王，	 貧賤醜陋女 懷 轉輪聖王 
T47n1967_001:0136b08	　　焦黑泥模中，　　有上妙寶像。	 焦 黑 泥 模 中 有 上 妙 寶 像 
T47n1967_001:0136b09	　　眾生貪瞋癡，　　妄想煩惱等，	 眾 生 貪 瞋 癡 妄 想 煩 惱 等 
T47n1967_001:0136b10	　　塵勞諸境中，　　皆有如來藏。	 塵 勞 諸 境 中 皆 有 如 來 藏 
T47n1967_001:0136b11	　　下至阿鼻獄，　　皆有如來身，	 下 至 阿 鼻 獄 皆 有 如 來 身 
T47n1967_001:0136b12	　　真如清淨法，　　名為如來體。』	 真 如 清 淨 法 名 為 如 來 體 
T47n1967_001:0136b13	「以此文證湯獄之記，頓覺明焉。三昧門自然	 以 此 文 證 湯 獄 之 記 頓 覺 明 焉 三 昧 門 自 然 
T47n1967_001:0136b14	洞啟。」問曰：「至人用心，澹然清淨，攀緣永絕。	洞 啟 問 曰 至 人 用 心 澹 然 清 淨 攀 緣 永 絕 
T47n1967_001:0136b15	今說放心遍緣一切所緣之處皆見如來，教	今 說 放 心 遍 緣 一 切 所 緣 之 處 皆 見 如 來 教 
T47n1967_001:0136b16	何在焉？」對曰：「亦有教說，起心遍緣六塵三業	何 在 焉 對 曰 亦 有 教 說 起 心 遍 緣 六 塵 三 業 
T47n1967_001:0136b17	仍發妙願，入佛境界，一一緣起不離如來，名	仍 發 妙 願 入 佛 境 界 一 一 緣 起 不 離 如 來 名 
T47n1967_001:0136b18	悉皆見矣。此是圓見，非由眼也。故《涅槃經》云：	悉 皆 見 矣 此 是 圓 見 非 由 眼 也 故 涅 槃 經 云 
T47n1967_001:0136b19	『聲聞人雖有天眼，名為肉眼；學大乘者雖有	 聲 聞 人 雖 有 天 眼 名 為 肉 眼 學 大 乘 者 雖 有 
T47n1967_001:0136b20	肉眼，名為佛眼。何以故？曉了己身，有佛性	肉 眼 名 為 佛 眼 何 以 故 曉 了 己 身 有 佛 性 
T47n1967_001:0136b21	故。』又如《勝天王經》中，佛告天王菩薩摩訶薩：	故 又 如 勝 天 王 經 中 佛 告 天 王 菩薩摩訶薩 
T47n1967_001:0136b22	『以方便力行般若波羅蜜，於一切法，心緣自	 以 方 便 力 行 般 若 波 羅 蜜 於一切法 心 緣 自 
T47n1967_001:0136b23	在。緣一切色，願得佛色，無所得故；心緣眾	在 緣 一 切 色 願 得 佛 色 無 所 得 故 心 緣 眾 
T47n1967_001:0136b24	聲，願得如來微妙音聲；心緣眾香，願得如來	聲 願 得 如 來 微 妙 音 聲 心 緣 眾 香 願 得 如 來 
T47n1967_001:0136b25	清淨戒香；心緣諸味，願得如來味中第一大	清 淨 戒 香 心 緣 諸 味 願 得 如 來 味 中 第 一 大 
T47n1967_001:0136b26	丈夫相；心緣諸觸，願得如來柔軟手掌；心緣	丈 夫 相 心 緣 諸 觸 願 得 如 來 柔 軟 手 掌 心 緣 
T47n1967_001:0136b27	諸法，願得如來寂靜之心；心緣自身，願得佛	諸 法 願 得 如 來 寂 靜 之 心 心 緣 自 身 願 得 佛 
T47n1967_001:0136b28	身；心緣自口，願得佛口；心緣自意，願得如來	身 心 緣 自 口 願 得 佛 口 心 緣 自 意 願 得 如 來 
T47n1967_001:0136b29	平等之意。』天王菩薩摩訶薩行般若波羅	平 等 之 意 天 王 菩薩摩訶薩 行 般 若 波 羅 
T47n1967_001:0136c01	蜜，無有一心、一行空過不向薩婆若者，遍緣	蜜 無 有 一 心 一 行 空 過 不 向 薩 婆 若 者 遍 緣 
T47n1967_001:0136c02	諸法而能不著，觀見諸法，無不趣向菩提之	諸 法 而 能 不 著 觀 見 諸 法 無 不 趣 向 菩 提 之 
T47n1967_001:0136c03	道。菩薩修習諸行，皆因外緣而得成立。又如	道 菩 薩 修 習 諸 行 皆 因 外 緣 而 得 成 立 又 如 
T47n1967_001:0136c04	大地住在水上，若鑿池井，即得水用；其不鑿	大 地 住 在 水 上 若 鑿 池 井 即 得 水 用 其 不 鑿 
T47n1967_001:0136c05	者，無由見之。如是聖智境界遍一切法，若	者 無 由 見 之 如 是 聖智境界 遍 一 切 法 若 
T47n1967_001:0136c06	有勤修般若方便，則便得之；其不修者，云何	有 勤 修 般 若 方 便 則 便 得 之 其 不 修 者 云 何 
T47n1967_001:0136c07	能得心緣之理？豈不大哉！」	能 得 心 緣 之 理 豈 不 大 哉 
T47n1967_001:0136c08	觀空、無我擇善而從門第五	觀 空 無 我 擇 善 而 從 門 第 五 
T47n1967_001:0136c09	問曰：「即動而靜，靜為躁君，即凡而聖，聖隱凡	問 曰 即 動 而 靜 靜 為 躁 君 即 凡 而 聖 聖 隱 凡 
T47n1967_001:0136c10	內，謹聞遐旨。又三教無我，理既不殊，擇善	內 謹 聞 遐 旨 又 三 教 無 我 理 既 不 殊 擇 善 
T47n1967_001:0136c11	而從，其義焉在？」對曰：「三教之理也，名未始	而 從 其 義 焉 在 對 曰 三 教 之 理 也 名 未 始 
T47n1967_001:0136c12	異，理未始同。且夫子四絕中：一無我者，謙光	異 理 未 始 同 且 夫 子 四 絕 中 一 無 我 者 謙 光 
T47n1967_001:0136c13	之義，為無我也；道無我者，長而不宰，為無我	之 義 為 無 我 也 道 無 我 者 長 而 不 宰 為 無 我 
T47n1967_001:0136c14	也；佛無我者，觀五蘊空，為無我也。上二教門	也 佛 無 我 者 觀 五 蘊 空 為 無 我 也 上 二 教 門 
T47n1967_001:0136c15	都不明五蘊，孰辨其四諦、六度萬行、賢聖階	都 不 明 五 蘊 孰 辨 其 四 諦 六 度 萬 行 賢 聖 階 
T47n1967_001:0136c16	級？蔑然無聞，但和光同塵，保雌守靜，既慈	級 蔑 然 無 聞 但 和 光 同 塵 保 雌 守 靜 既 慈 
T47n1967_001:0136c17	且儉，不敢為天下先，各一聖也，安用商摧其	且 儉 不 敢 為 天 下 先 各 一 聖 也 安 用 商 摧 其 
T47n1967_001:0136c18	淺深歟？三教無我明矣。擇善而從者，謂三性	淺 深 歟 三 教 無 我 明 矣 擇 善 而 從 者 謂 三 性 
T47n1967_001:0136c19	之理，理無不在，修心之士，擇善而從，蓋謂不	之 理 理 無 不 在 修 心 之 士 擇 善 而 從 蓋 謂 不 
T47n1967_001:0136c20	善無益於至真，無記雙亡於善惡，妨亂佛理，	善 無 益 於 至 真 無 記 雙 亡 於 善 惡 妨 亂 佛 理 
T47n1967_001:0136c21	何莫由斯？故聖人簡之而不取也，故《涅槃經》	何 莫 由 斯 故 聖 人 簡 之 而 不 取 也 故 涅 槃 經 
T47n1967_001:0136c22	云：『一闡提者，心不攀緣一切善法，乃至不生	云 一 闡 提 者 心 不 攀 緣 一 切 善 法 乃 至 不 生 
T47n1967_001:0136c23	一念之善。』是知，念佛三昧，善之最上，萬行元	一 念 之 善 是 知 念佛三昧 善 之 最 上 萬 行 元 
T47n1967_001:0136c24	首，故曰三昧王焉。」	首 故 曰 三 昧 王 焉 
T47n1967_001:0136c25	無善可擇，無惡可棄門第六	無 善 可 擇 無 惡 可 棄 門 第 六 
T47n1967_001:0136c26	問曰：「若擇善而從者，何不擇諸佛之善，棄眾	問 曰 若 擇 善 而 從 者 何 不 擇 諸 佛 之 善 棄 眾 
T47n1967_001:0136c27	生之惡，乃念未來諸佛，而同過、現正覺耶？」對	生 之 惡 乃 念 未來諸佛 而 同 過 現 正 覺 耶 對 
T47n1967_001:0136c28	曰：「不易來問，自成我答。何者？擇善而從者，蓋	曰 不 易 來 問 自 成 我 答 何 者 擇 善 而 從 者 蓋 
T47n1967_001:0136c29	不得已而言之，為力微任重，不能即惡而善、	不 得 已 而 言 之 為 力 微 任 重 不 能 即 惡 而 善 
T47n1967_001:0137a01	即妄而真，故以明之。苟能念未來之佛，叶不	即 妄 而 真 故 以 明 之 苟 能 念 未 來 之 佛 叶 不 
T47n1967_001:0137a02	輕之行，天地一指，萬物一馬，眾生皆佛，此土	輕 之 行 天 地 一 指 萬 物 一 馬 眾 生 皆 佛 此 土 
T47n1967_001:0137a03	常淨，異鶖子之土石砂礫，同梵王之珍寶莊	常 淨 異 鶖 子 之 土 石 砂 礫 同 梵 王 之 珍 寶 莊 
T47n1967_001:0137a04	嚴，擇善之至矣！無惡可棄矣！即天台智者，釋	嚴 擇 善 之 至 矣 無 惡 可 棄 矣 即 天 台 智 者 釋 
T47n1967_001:0137a05	《法華經》明絕待之妙，引證曰：	 法 華 經 明 絕 待 之 妙 引 證 曰 
T47n1967_001:0137a06	「『眾生見劫盡，　　大火所燒時，	 眾 生 見 劫 盡 大 火 所 燒 時 
T47n1967_001:0137a07	　　我此土安隱，　　天人常充滿，	 我 此 土 安 隱 天 人 常 充 滿 
T47n1967_001:0137a08	　　園林諸堂閣，　　種種寶莊嚴。』	 園 林 諸 堂 閣 種 種 寶 莊 嚴 
T47n1967_001:0137a09	「又《勝天王經》曰：『佛所住處，實無穢土，眾生薄	 又 勝 天 王 經 曰 佛 所 住 處 實 無 穢 土 眾 生 薄 
T47n1967_001:0137a10	福，而見不淨。』良在此焉。梵云南無，唐言歸命；	福 而 見 不 淨 良 在 此 焉 梵 云 南 無 唐 言 歸 命 
T47n1967_001:0137a11	梵云阿彌陀，唐言無量壽。三世諸佛，豈祇一	梵 云 阿 彌 陀 唐 言 無 量 壽 三世諸佛 豈 祇 一 
T47n1967_001:0137a12	佛而有壽量耶？今與子同念于三世彌陀，同	佛 而 有 壽 量 耶 今 與 子 同 念 于 三 世 彌 陀 同 
T47n1967_001:0137a13	生于十方極樂，有何不可？而欲鷁路退飛哉？	生 于 十 方 極 樂 有 何 不 可 而 欲 鷁 路 退 飛 哉 
T47n1967_001:0137a14	夫然則烈三昧之猛焰也，不居於纖妄蚊蜹，	夫 然 則 烈 三 昧 之 猛 焰 也 不 居 於 纖 妄 蚊 蜹 
T47n1967_001:0137a15	鏗十念之洪鐘也，不間於散亂稱佛，明矣。念	鏗 十 念 之 洪 鐘 也 不 間 於 散 亂 稱 佛 明 矣 念 
T47n1967_001:0137a16	彌陀通三世既爾，念諸佛菩薩，不亦然歟？」問	彌 陀 通 三 世 既 爾 念 諸佛菩薩 不 亦 然 歟 問 
T47n1967_001:0137a17	曰：「念未來佛，即與過、現諸佛等者，願聞其理	曰 念 未 來 佛 即 與 過 現 諸 佛 等 者 願 聞 其 理 
T47n1967_001:0137a18	也。」對曰：「《華嚴經》云：『一切諸如來，同共一法	也 對 曰 華 嚴 經 云 一切諸如來 同 共 一 法 
T47n1967_001:0137a19	身，一身一智慧，力、無畏亦然。』《楞伽》偈云：『迦	身 一 身 一 智 慧 力 無 畏 亦 然 楞 伽 偈 云 迦 
T47n1967_001:0137a20	葉、拘留孫、拘那含我是，以此四種等，我為	葉 拘 留 孫 拘 那 含 我 是 以 此 四 種 等 我 為 
T47n1967_001:0137a21	佛子說。』言四等者，一、字等，同名佛也，二、語等，	佛 子 說 言 四 等 者 一 字 等 同 名 佛 也 二 語 等 
T47n1967_001:0137a22	皆具迦陵頻伽梵音聲相，三、法等，盡得菩提	皆 具 迦陵頻伽 梵 音 聲 相 三 法 等 盡 得 菩 提 
T47n1967_001:0137a23	分法無障礙智也，四、身等，法身、色身相好無	分 法 無障礙智 也 四 身 等 法 身 色 身 相 好 無 
T47n1967_001:0137a24	差也。《起信論》云：『依方故迷，方實不轉。』夫如	差 也 起 信 論 云 依 方 故 迷 方 實 不 轉 夫 如 
T47n1967_001:0137a25	是則悟者悟於一方，群方自正；念者念於一	是 則 悟 者 悟 於 一 方 群 方 自 正 念 者 念 於 一 
T47n1967_001:0137a26	佛，諸佛現前。經所謂：『水不上升，月不下降。』	佛 諸 佛 現 前 經 所 謂 水 不 上 升 月 不 下 降 
T47n1967_001:0137a27	光淨因緣，虛空皓月，現於清水；彼佛不來，我	光 淨 因 緣 虛 空 皓 月 現 於 清 水 彼 佛 不 來 我 
T47n1967_001:0137a28	身不往，念佛因緣，如來寶月，現於心水。如說	身 不 往 念 佛 因 緣 如 來 寶 月 現 於 心 水 如 說 
T47n1967_001:0137a29	頌曰：『菩薩清涼月，遊於畢竟空，眾生心水淨，	頌 曰 菩 薩 清 涼 月 遊 於 畢 竟 空 眾 生 心 水 淨 
T47n1967_001:0137b01	菩提影現中。』」	菩 提 影 現 中 
T47n1967_001:0137b02	一切眾生肉不可食門第七	一 切 眾 生 肉 不 可 食 門 第 七 
T47n1967_001:0137b03	問曰：「肉者人之所食，而念佛之家，絕之何耶？」	問 曰 肉 者 人 之 所 食 而 念 佛 之 家 絕 之 何 耶 
T47n1967_001:0137b04	對曰：「夫尸毘救鴿，上稱方平者，王禽異也，	對 曰 夫 尸 毘 救 鴿 上 稱 方 平 者 王 禽 異 也 
T47n1967_001:0137b05	保命一也。安得固食其肉，用資敗軀，而兀兀	保 命 一 也 安 得 固 食 其 肉 用 資 敗 軀 而 兀 兀 
T47n1967_001:0137b06	然，不知其懼哉？苟能悟之，為未來諸佛者，	然 不 知 其 懼 哉 苟 能 悟 之 為 未來諸佛 者 
T47n1967_001:0137b07	孰肯飛白刃於赤鱗，放蒼鷹於狡兔，如夕蛾	孰 肯 飛 白 刃 於 赤 鱗 放 蒼 鷹 於 狡 兔 如 夕 蛾 
T47n1967_001:0137b08	投火自取其斃歟！故《楞伽》、《寶積經》、〈佛語心品〉	投 火 自 取 其 斃 歟 故 楞 伽 寶 積 經 佛 語 心 品 
T47n1967_001:0137b09	偈云：	偈 云 
T47n1967_001:0137b10	「『為利殺眾生，　　以財網諸肉，	 為 利 殺 眾 生 以 財 網 諸 肉 
T47n1967_001:0137b11	　　二俱是惡業，　　死墮叫喚獄。』	 二 俱 是 惡 業 死 墮 叫 喚 獄 
T47n1967_001:0137b12	「以斯聖旨，若不施此財，則網者、屠者自息矣。	 以 斯 聖 旨 若 不 施 此 財 則 網 者 屠 者 自 息 矣 
T47n1967_001:0137b13	且龍樹不輕於鴿雀，高僧不跨於蟲蟻。或問	且 龍 樹 不 輕 於 鴿 雀 高 僧 不 跨 於 蟲 蟻 或 問 
T47n1967_001:0137b14	其故，答曰：『斯之與吾，同在生死，彼或將先成	其 故 答 曰 斯 之 與 吾 同 在 生 死 彼 或 將 先 成 
T47n1967_001:0137b15	正覺，安可妄輕耶？』輕尚不可，豈得專食其血	正 覺 安 可 妄 輕 耶 輕 尚 不 可 豈 得 專 食 其 血 
T47n1967_001:0137b16	肉哉？《寶性論》云：『《如來藏經》中告舍利弗言：	肉 哉 寶 性 論 云 如 來 藏 經 中 告 舍 利 弗 言 
T47n1967_001:0137b17	「眾生者，即是第一義諦，即是如來藏，即是法	 眾 生 者 即 是 第一義諦 即 是 如 來 藏 即 是 法 
T47n1967_001:0137b18	身，即是菩提。」』吾謂，太唯逐塊，不知逐人，塊	身 即 是 菩 提 吾 謂 太 唯 逐 塊 不 知 逐 人 塊 
T47n1967_001:0137b19	終不息；唯念過、現不念未來，慢終不息。若	終 不 息 唯 念 過 現 不 念 未 來 慢 終 不 息 若 
T47n1967_001:0137b20	如師子而逐於人，其塊自息。聞夫敬、慢之道，	如 師 子 而 逐 於 人 其 塊 自 息 聞 夫 敬 慢 之 道 
T47n1967_001:0137b21	一以貫之，則移敬就慢，均父母於平人，逆之	一 以 貫 之 則 移 敬 就 慢 均 父 母 於 平 人 逆 之 
T47n1967_001:0137b22	甚也！移慢就敬，均平人於父母，孝之大也！故	甚 也 移 慢 就 敬 均 平 人 於 父 母 孝 之 大 也 故 
T47n1967_001:0137b23	《梵網經》云：『六道眾生，皆是我父母，孝名為戒。』	 梵 網 經 云 六 道 眾 生 皆 是 我 父 母 孝 名 為 戒 
T47n1967_001:0137b24	良在茲焉。觀六道為當來佛者，父母之談，猶	良 在 茲 焉 觀 六 道 為 當 來 佛 者 父 母 之 談 猶 
T47n1967_001:0137b25	近言耳。若能等沙彌之救蟻，促壽更延；同流	近 言 耳 若 能 等 沙 彌 之 救 蟻 促 壽 更 延 同 流 
T47n1967_001:0137b26	水之濟魚，天華雨[卄/積]。革曠劫眾生之見，念未	水 之 濟 魚 天 華 雨 [卄積] 革 曠 劫 眾 生 之 見 念 未 
T47n1967_001:0137b27	來善逝之身，糞穢之內，知有真金；重雲之間，	來 善 逝 之 身 糞 穢 之 內 知 有 真 金 重 雲 之 間 
T47n1967_001:0137b28	信有明月。則食肉之昏霧，生死之煙霾，慧風	信 有 明 月 則 食 肉 之 昏 霧 生 死 之 煙 霾 慧 風 
T47n1967_001:0137b29	掃之，於三昧長空矣！《梵網經》云：『我是已成佛，	掃 之 於 三 昧 長 空 矣 梵 網 經 云 我 是 已 成 佛 
T47n1967_001:0137c01	汝是當成佛，常作如是信，戒品已具足。』豈得	汝 是 當 成 佛 常 作 如 是 信 戒 品 已 具 足 豈 得 
T47n1967_001:0137c02	不念之哉？」問曰：「肉不可食，信之矣。五辛如何？」	不 念 之 哉 問 曰 肉 不 可 食 信 之 矣 五 辛 如 何 
T47n1967_001:0137c03	對曰：「聖教明之。《大佛頂經》云：『佛告阿難：「是五	對 曰 聖 教 明 之 大 佛 頂 經 云 佛 告 阿 難 是 五 
T47n1967_001:0137c04	種辛，熟食發淫，生噉增恚。如是世界食辛之	種 辛 熟 食 發 淫 生 噉 增 恚 如 是 世 界 食 辛 之 
T47n1967_001:0137c05	人，縱能宣說十二部經，十方天仙嫌其臭穢，咸	人 縱 能 宣 說 十二部經 十 方 天 仙 嫌 其 臭 穢 咸 
T47n1967_001:0137c06	皆遠離；諸餓鬼等，因彼食次，舐其脣吻，常與	皆 遠 離 諸 餓 鬼 等 因 彼 食 次 舐 其 脣 吻 常 與 
T47n1967_001:0137c07	鬼住。福德日消，長無利益。是食辛人，修三摩	鬼 住 福 德 日 消 長 無 利 益 是 食 辛 人 修 三 摩 
T47n1967_001:0137c08	地，菩薩天仙十方善神不來守護，大力魔王	地 菩 薩 天 仙 十 方 善 神 不 來 守 護 大 力 魔 王 
T47n1967_001:0137c09	得其方便。」佛告阿難：「修菩提者，永斷五辛，是	得 其 方 便 佛 告 阿 難 修 菩 提 者 永 斷 五 辛 是 
T47n1967_001:0137c10	則名為第一增進修行漸次。」』斯金口也，不亦	則 名 為 第 一 增 進 修 行 漸 次 斯 金 口 也 不 亦 
T47n1967_001:0137c11	誠哉？酒固不可言耳，《百喻經》云：『昔有貧人，在	誠 哉 酒 固 不 可 言 耳 百 喻 經 云 昔 有 貧 人 在 
T47n1967_001:0137c12	路而行，遇得一囊金錢，心大喜躍，即便數之，	路 而 行 遇 得 一 囊 金 錢 心 大 喜 躍 即 便 數 之 
T47n1967_001:0137c13	數未能周，錢主忽至，盡還奪去。其人當時，悔	數 未 能 周 錢 主 忽 至 盡 還 奪 去 其 人 當 時 悔 
T47n1967_001:0137c14	不疾去，懊惱之情，甚為苦極。遇佛法者，亦復	不 疾 去 懊 惱 之 情 甚 為 苦 極 遇 佛 法 者 亦 復 
T47n1967_001:0137c15	如是，雖得值遇三寶福田，不勤方便修行，而	如 是 雖 得 值 遇 三 寶 福 田 不 勤 方 便 修 行 而 
T47n1967_001:0137c16	好多聞，忽爾命終，墮三惡道，如彼愚人，還為	好 多 聞 忽 爾 命 終 墮 三 惡 道 如 彼 愚 人 還 為 
T47n1967_001:0137c17	其主，奪錢而去。偈曰：	其 主 奪 錢 而 去 偈 曰 
T47n1967_001:0137c18	「『今日營此事，　　明自營彼事，	 今 日 營 此 事 明 自 營 彼 事 
T47n1967_001:0137c19	　　樂著不觀苦，　　不覺死賊至，	 樂 著 不 觀 苦 不 覺 死 賊 至 
T47n1967_001:0137c20	　　怱怱營眾務，　　凡人無不爾，	 怱 怱 營 眾 務 凡 人 無 不 爾 
T47n1967_001:0137c21	　　如彼數錢人，　　其事亦如是。』」	 如 彼 數 錢 人 其 事 亦 如 是 
T47n1967_001:0137c22	已上七門，盡是念未來諸佛，以通三世之意	已 上 七 門 盡 是 念 未來諸佛 以 通 三 世 之 意 
T47n1967_001:0137c23	也。若欲念於彌勒佛者，必得上生兜率天宮，	也 若 欲 念 於 彌 勒 佛 者 必 得 上 生 兜率天宮 
T47n1967_001:0137c24	見慈氏之尊，則彌天釋道安，為其首唱耳。	見 慈 氏 之 尊 則 彌 天 釋 道 安 為 其 首 唱 耳 
T47n1967_001:0137c25	念佛三昧寶王論卷上	念佛三昧 寶 王 論 卷 上 
T47n1967_002:0138a02	念佛三昧寶王論卷中	念佛三昧 寶 王 論 卷 中 
T47n1967_002:0138a04	唐、紫閣山草堂寺沙門飛錫撰	唐 紫 閣 山 草 堂 寺 沙 門 飛 錫 撰 
T47n1967_002:0138a05	念現在佛專注一境門第八	念 現 在 佛 專 注 一 境 門 第 八 
T47n1967_002:0138a06	問：「念未來佛即眾生是，已聞玄義，事廣理幽	問 念 未 來 佛 即 眾 生 是 已 聞 玄 義 事 廣 理 幽 
T47n1967_002:0138a07	也。又恐心散難檢，今欲一以貫之，專西方念	也 又 恐 心 散 難 檢 今 欲 一 以 貫 之 專 西 方 念 
T47n1967_002:0138a08	一佛，踐不退地，祛有漏心，乘扁舟於黃金之	一 佛 踐 不 退 地 祛 有 漏 心 乘 扁 舟 於 黃 金 之 
T47n1967_002:0138a09	池，禮彌陀於白玉之殿，以通三世，希沾九品，	池 禮 彌 陀 於 白 玉 之 殿 以 通 三 世 希 沾 九 品 
T47n1967_002:0138a10	不亦可乎？」對曰：「《十住婆沙論》并龍樹菩薩造	不 亦 可 乎 對 曰 十 住 婆 沙 論 并 龍 樹 菩 薩 造 
T47n1967_002:0138a11	《釋華嚴經論》，〈易行行品〉云：『菩薩道有難行行，	 釋 華 嚴 經 論 易 行 行 品 云 菩 薩 道 有 難 行 行 
T47n1967_002:0138a12	如陸地乘舟也；有易行行，如水路乘舟也。』阿	如 陸 地 乘 舟 也 有 易 行 行 如 水 路 乘 舟 也 阿 
T47n1967_002:0138a13	彌陀佛本願之力，若人聞名稱念，自歸彼國，	彌 陀 佛 本 願 之 力 若 人 聞 名 稱 念 自 歸 彼 國 
T47n1967_002:0138a14	如舟得水，又遇便風，一舉千里，不亦易哉？則	如 舟 得 水 又 遇 便 風 一 舉 千 里 不 亦 易 哉 則 
T47n1967_002:0138a15	釋迦如來父王眷屬，六萬釋種，皆生極樂土，	釋 迦 如 來 父 王 眷 屬 六 萬 釋 種 皆 生 極 樂 土 
T47n1967_002:0138a16	蓋佛與此界眾生緣深也，專注一境，圓通三	蓋 佛 與 此 界 眾 生 緣 深 也 專 注 一 境 圓 通 三 
T47n1967_002:0138a17	世，不亦良哉？」問曰：「專注一境，圓通三世，誠哉！	世 不 亦 良 哉 問 曰 專 注 一 境 圓 通 三 世 誠 哉 
T47n1967_002:0138a18	然稱念自歸，往生彼國者，有為虛偽，風多浪	然 稱 念 自 歸 往 生 彼 國 者 有 為 虛 偽 風 多 浪 
T47n1967_002:0138a19	鼓，曷若不馳想於外，但攝心於內，協無為之	鼓 曷 若 不 馳 想 於 外 但 攝 心 於 內 協 無 為 之 
