T47n1982_001:0461b04	別分三品．五門相續助三因．一日七日專精	別 分 三 品 五 門 相 續 助 三 因 一 日 七 日 專 精 
T47n1982_001:0461b05	進．畢命乘臺出六塵．慶哉難逢今得遇．永證	進 畢 命 乘 臺 出 六 塵 慶 哉 難 逢 今 得 遇 永 證 
T47n1982_001:0461b06	無為法相身。	無 為 法 相 身 
T47n1982_001:0461b07	願共諸眾生。往生安樂國。	願 共 諸 眾 生 往 生 安 樂 國 
T47n1982_001:0461b08	至心歸命禮西方阿彌陀佛。	至 心 歸 命 禮 西 方 阿 彌 陀 佛 
T47n1982_001:0461b09	中輩中行中根人．一日齋戒處金蓮．孝養	中 輩 中 行 中 根 人 一 日 齋 戒 處 金 蓮 孝 養 
T47n1982_001:0461b10	父母教迴向．為說西方快樂因．佛與聲聞眾	父 母 教 迴 向 為 說 西 方 快 樂 因 佛 與 聲 聞 眾 
T47n1982_001:0461b11	來取．直到彌陀華座前．百寶花籠經七日．	來 取 直 到 彌 陀 華 座 前 百 寶 花 籠 經 七 日 
T47n1982_001:0461b12	三品蓮開證小真。	三 品 蓮 開 證 小 真 
T47n1982_001:0461b13	願共諸眾生。往生安樂國。	願 共 諸 眾 生 往 生 安 樂 國 
T47n1982_001:0461b14	至心歸命禮西方阿彌陀佛。	至 心 歸 命 禮 西 方 阿 彌 陀 佛 
T47n1982_001:0461b15	下輩下行下根人．十惡五逆等貪瞋．四重偷	下 輩 下 行 下 根 人 十 惡 五 逆 等 貪 瞋 四 重 偷 
T47n1982_001:0461b16	僧謗正法．未曾慚愧悔前愆．終時苦相皆雲	僧 謗 正 法 未 曾 慚 愧 悔 前 愆 終 時 苦 相 皆 雲 
T47n1982_001:0461b17	集．地獄猛火罪人前．忽遇往生善知識．急勸	集 地 獄 猛 火 罪 人 前 忽 遇 往 生 善 知 識 急 勸 
T47n1982_001:0461b18	專稱彼佛名．化佛菩薩尋聲到．一念傾心入	專 稱 彼 佛 名 化 佛 菩 薩 尋 聲 到 一 念 傾 心 入 
T47n1982_001:0461b19	寶蓮．三業障重開經劫．于時始發菩提因。	寶 蓮 三 業 障 重 開 經 劫 于 時 始 發 菩 提 因 
T47n1982_001:0461b20	願共諸眾生。往生安樂國。	願 共 諸 眾 生 往 生 安 樂 國 
T47n1982_001:0461b21	至心歸命禮西方阿彌陀佛。	至 心 歸 命 禮 西 方 阿 彌 陀 佛 
T47n1982_001:0461b22	樂何樂事難思議．無邊菩薩為同學．性海	樂 何 樂 事 難 思 議 無 邊 菩 薩 為 同 學 性 海 
T47n1982_001:0461b23	如來盡是師．渴聞波若絕思漿．念食無生	如 來 盡 是 師 渴 聞 波 若 絕 思 漿 念 食 無 生 
T47n1982_001:0461b24	即斷飢．一切莊嚴皆說法．無心領納自然知．	即 斷 飢 一 切 莊 嚴 皆 說 法 無 心 領 納 自 然 知 
T47n1982_001:0461b25	七寶花池隨意入．八輩凝神會一枝．彌陀心	七 寶 花 池 隨 意 入 八 輩 凝 神 會 一 枝 彌 陀 心 
T47n1982_001:0461b26	水沐身頂．觀音大勢與衣披．歘爾騰空遊法	水 沐 身 頂 觀 音 大 勢 與 衣 披 歘 爾 騰 空 遊 法 
T47n1982_001:0461b27	界．須臾授記號無為．如此逍遙極樂處．吾今	界 須 臾 授 記 號 無 為 如 此 逍 遙 極 樂 處 吾 今 
T47n1982_001:0461b28	不去待何時。	不 去 待 何 時 
T47n1982_001:0461b29	願共諸眾生。往生安樂國。	願 共 諸 眾 生 往 生 安 樂 國 
T47n1982_001:0461c01	至心歸命禮西方阿彌陀佛。	至 心 歸 命 禮 西 方 阿 彌 陀 佛 
T47n1982_001:0461c02	哀愍覆護我．令法種增長．此世及後生．願	哀 愍 覆 護 我 令 法 種 增 長 此 世 及 後 生 願 
T47n1982_001:0461c03	佛常攝受。	佛 常 攝 受 
T47n1982_001:0461c04	願共諸眾生。往生安樂國。	願 共 諸 眾 生 往 生 安 樂 國 
T47n1982_001:0461c05	至心歸命禮西方極樂世界觀世音菩薩。	至 心 歸 命 禮 西方極樂 世 界 觀 世 音 菩 薩 
T47n1982_001:0461c06	願共諸眾生。往生安樂國。	願 共 諸 眾 生 往 生 安 樂 國 
T47n1982_001:0461c07	至心歸命禮西方極樂世界大勢至菩薩。	至 心 歸 命 禮 西方極樂 世 界 大 勢 至 菩 薩 
T47n1982_001:0461c08	願共諸眾生。往生安樂國。	願 共 諸 眾 生 往 生 安 樂 國 
T47n1982_001:0461c09	至心歸命禮西方極樂世界諸菩薩清淨大	至 心 歸 命 禮 西方極樂 世 界 諸 菩 薩 清 淨 大 
T47n1982_001:0461c10	海眾。	海 眾 
T47n1982_001:0461c11	願共諸眾生．往生安樂國。	願 共 諸 眾 生 往 生 安 樂 國 
T47n1982_001:0461c12	普為師僧父母及善知識法界眾生。斷除三	普 為 師 僧 父 母 及 善 知 識 法 界 眾 生 斷 除 三 
T47n1982_001:0461c13	障同得往生阿彌陀佛國。歸命懺悔	障 同 得 往 生 阿 彌 陀 佛 國 歸 命 懺 悔 
T47n1982_001:0461c14	至心懺悔。	至 心 懺 悔 
T47n1982_001:0461c15	南無歸懺十方佛．願滅一切諸罪根．今將久	南 無 歸 懺 十 方 佛 願 滅 一 切 諸 罪 根 今 將 久 
T47n1982_001:0461c16	近所修善．迴作自他安樂因．唯願一切臨終	近 所 修 善 迴 作 自 他 安 樂 因 唯 願 一 切 臨 終 
T47n1982_001:0461c17	時．勝緣勝境悉現前．願覩彌陀大悲主．觀音	時 勝 緣 勝 境 悉 現 前 願 覩 彌 陀 大 悲 主 觀 音 
T47n1982_001:0461c18	勢至十方尊．仰惟神光蒙接手．乘佛願力生	勢 至 十 方 尊 仰 惟 神 光 蒙 接 手 乘 佛 願 力 生 
T47n1982_001:0461c19	彼國．懺悔迴向發願已．至心歸命禮阿彌陀	彼 國 懺 悔 迴 向 發 願 已 至 心 歸 命 禮 阿 彌 陀 
T47n1982_001:0461c20	佛。	佛 
T47n1982_001:0461c21	說偈言。說此偈已。更當心口發願。願弟子	說 偈 言 說 此 偈 已 更 當 心 口 發 願 願 弟 子 
T47n1982_001:0461c22	臨命終時。心不顛倒。心不錯亂。心不失念。身	臨命終時 心 不 顛 倒 心 不 錯 亂 心 不 失 念 身 
T47n1982_001:0461c23	心無諸苦痛。身心快樂如入禪定。聖眾現前。	心 無 諸 苦 痛 身 心 快 樂 如 入 禪 定 聖 眾 現 前 
T47n1982_001:0461c24	乘佛本願上品上生。阿彌陀佛國。到彼國已	乘 佛 本 願 上 品 上 生 阿 彌 陀 佛 國 到 彼 國 已 
T47n1982_001:0461c25	得六神通。迴入十方界。救攝苦眾生。虛空法	得 六 神 通 迴 入 十 方 界 救 攝 苦 眾 生 虛 空 法 
T47n1982_001:0462a01	界盡。我願亦如是發願已至心歸命禮阿彌	界 盡 我 願 亦 如 是 發 願 已 至 心 歸 命 禮 阿 彌 
T47n1982_001:0462a02	陀佛。	陀 佛 
T47n1982_001:0462a03	大眾欲作西方業．初夜獨坐自思量。莫言久	大 眾 欲 作 西 方 業 初 夜 獨 坐 自 思 量 莫 言 久 
T47n1982_001:0462a04	住閻浮地．會有一日即無常．命如當風一條	住 閻 浮 地 會 有 一 日 即 無 常 命 如 當 風 一 條 
T47n1982_001:0462a05	燭．亦如石中一電光．聞身康強不苦行．臨渴	燭 亦 如 石 中 一 電 光 聞 身 康 強 不 苦 行 臨 渴 
T47n1982_001:0462a06	掘井水難望。	掘 井 水 難 望 
T47n1982_001:0462a07	願共諸眾生。往生安樂國。	願 共 諸 眾 生 往 生 安 樂 國 
T47n1982_001:0462a08	今觀此身實可厭．種種不淨假名身．三百碎	今 觀 此 身 實 可 厭 種 種 不 淨 假 名 身 三 百 碎 
T47n1982_001:0462a09	骨相支柱．遍體何曾有片真．香粉塗身無厭	骨 相 支 柱 遍 體 何 曾 有 片 真 香 粉 塗 身 無 厭 
T47n1982_001:0462a10	足．畢竟地下成灰塵．煩惱熾盛何曾歇．終是	足 畢 竟 地 下 成 灰 塵 煩惱熾盛 何 曾 歇 終 是 
T47n1982_001:0462a11	流浪三塗因．普勸道場諸眾等．真心念佛入	流 浪 三 塗 因 普 勸 道 場 諸 眾 等 真 心 念 佛 入 
T47n1982_001:0462a12	真門。	真 門 
T47n1982_001:0462a13	願共諸眾生。往生安樂國。	願 共 諸 眾 生 往 生 安 樂 國 
T47n1982_001:0462a14	貪嗔六賊無虛假．妄想悠悠循臭身．夢裹	貪 嗔 六 賊 無 虛 假 妄 想 悠 悠 循 臭 身 夢 裹 
T47n1982_001:0462a15	種種縱橫去．忽覺寂滅並虛然．四大無常歸	種 種 縱 橫 去 忽 覺 寂 滅 並 虛 然 四 大 無 常 歸 
T47n1982_001:0462a16	糞土．魂魄零落若个邊．生時財物他人用．	糞 土 魂 魄 零 落 若 个 邊 生 時 財 物 他 人 用 
T47n1982_001:0462a17	自身唯得紙泥錢．為此佛在西方國．努力相	自 身 唯 得 紙 泥 錢 為 此 佛 在 西 方 國 努 力 相 
T47n1982_001:0462a18	勸用心鐫。	勸 用 心 鐫 
T47n1982_001:0462a19	願共諸眾生。往生安樂國。	願 共 諸 眾 生 往 生 安 樂 國 
T47n1982_001:0462a20	至心歸命禮西方阿彌陀佛。	至 心 歸 命 禮 西 方 阿 彌 陀 佛 
T47n1982_001:0462a21	發願生佛國。聖眾普應知。今生蒙佛教。不敢	發 願 生 佛 國 聖 眾 普 應 知 今 生 蒙 佛 教 不 敢 
T47n1982_001:0462a22	更生疑。一日七日專精進。定得西方花上期	更 生 疑 一 日 七 日 專 精 進 定 得 西 方 花 上 期 
T47n1982_001:0462a23	願共諸眾生。往生安樂國。	願 共 諸 眾 生 往 生 安 樂 國 
T47n1982_001:0462a24	淨土快樂無人去．地獄苦報競攢頭．聞惡	淨 土 快 樂 無 人 去 地 獄 苦 報 競 攢 頭 聞 惡 
T47n1982_001:0462a25	一聲不惜死．善法未肯至心求．死墮阿鼻十	一 聲 不 惜 死 善 法 未 肯 至 心 求 死 墮 阿 鼻 十 
T47n1982_001:0462a26	八獄．輪迴受苦何時休。	八 獄 輪 迴 受 苦 何 時 休 
T47n1982_001:0462a27	願共諸眾生。往生安樂國。	願 共 諸 眾 生 往 生 安 樂 國 
T47n1982_001:0462a28	歸去來。魔鄉不可停。曠劫來流轉。六道盡	歸 去 來 魔 鄉 不 可 停 曠 劫 來 流 轉 六 道 盡 
T47n1982_001:0462a29	皆經。到處無餘事。唯聞生死聲。為此生平	皆 經 到 處 無 餘 事 唯 聞 生 死 聲 為 此 生 平 
T47n1982_001:0462b01	後。入彼涅槃城。	後 入 彼 涅 槃 城 
T47n1982_001:0462b02	願共諸眾生。往生安樂國。	願 共 諸 眾 生 往 生 安 樂 國 
T47n1982_001:0462b03	觀彼彌陀極樂界。廣大寬平眾寶城。雲華作	觀 彼 彌 陀 極 樂 界 廣 大 寬 平 眾 寶 城 雲 華 作 
T47n1982_001:0462b04	行無有數。擬待此地善眾生。五濁欲修十善	行 無 有 數 擬 待 此 地 善 眾 生 五 濁 欲 修 十 善 
T47n1982_001:0462b05	業。第一專誦彌陀經。心口稱佛無厭足。命終	業 第 一 專 誦 彌 陀 經 心 口 稱 佛 無 厭 足 命 終 
T47n1982_001:0462b06	菩薩自來迎。	菩 薩 自 來 迎 
T47n1982_001:0462b07	願共諸眾生。往生安樂國。	願 共 諸 眾 生 往 生 安 樂 國 
T47n1982_001:0462b08	至心歸命禮西方阿彌陀佛。	至 心 歸 命 禮 西 方 阿 彌 陀 佛 
T47n1982_001:0462b09	諦觀西方有一國。其國有佛號彌陀。一坐說	諦 觀 西 方 有 一 國 其 國 有 佛 號 彌 陀 一 坐 說 
T47n1982_001:0462b10	法恒沙劫。普為世界斷諸魔。極樂城中登聖	法 恒 沙 劫 普 為 世 界 斷 諸 魔 極 樂 城 中 登 聖 
T47n1982_001:0462b11	座。諸天圍遶悉來過。八萬四千菩薩眾。奉持	座 諸 天 圍 遶 悉 來 過 八萬四千 菩 薩 眾 奉 持 
T47n1982_001:0462b12	花果散娑婆。	花 果 散 娑 婆 
T47n1982_001:0462b13	願共諸眾生。往生安樂國。	願 共 諸 眾 生 往 生 安 樂 國 
T47n1982_001:0462b14	普為梵釋四王天龍八部帝主人王。師僧父	普 為 梵 釋 四 王 天 龍 八 部 帝 主 人 王 師 僧 父 
T47n1982_001:0462b15	母及善知識法界眾生。斷除三障。同得往生	母 及 善 知 識 法 界 眾 生 斷 除 三 障 同 得 往 生 
T47n1982_001:0462b16	阿彌陀佛國歸命懺悔。	阿 彌 陀 佛 國 歸 命 懺 悔 
T47n1982_001:0462b17	諸行無常　是生滅法　生滅滅已　寂滅	諸行無常 是 生 滅 法 生 滅 滅 已 寂 滅 
T47n1982_001:0462b18	為樂	為 樂 
T47n1982_001:0462b19	　如來證涅槃　　永斷於生死	 如 來 證 涅 槃 永 斷 於 生 死 
T47n1982_001:0462b20	　若能至心聽　　常得無量樂	 若 能 至 心 聽 常 得 無 量 樂 
T47n1982_001:0462b21	南無本師釋迦牟尼佛等一切三寶。我今稽	南 無 本 師 釋 迦 牟 尼 佛 等 一 切 三 寶 我 今 稽 
T47n1982_001:0462b22	首禮。迴願往生無量壽國。	首 禮 迴 願 往 生 無 量 壽 國 
T47n1982_001:0462b23	南無十方三世盡虛空遍法界微塵剎土中一	南 無 十 方 三 世 盡 虛 空 遍 法 界 微 塵 剎 土 中 一 
T47n1982_001:0462b24	切三寶。我今稽首禮。迴願往生無量壽國。	切 三 寶 我 今 稽 首 禮 迴 願 往 生 無 量 壽 國 
T47n1982_001:0462b25	南無西方極樂世界阿彌陀佛。願共眾生咸	南 無 西方極樂 世 界 阿 彌 陀 佛 願 共 眾 生 咸 
T47n1982_001:0462b26	歸命故。我頂禮生彼國。	歸 命 故 我 頂 禮 生 彼 國 
T47n1982_001:0462b27	南無西方極樂世界無量光佛。願共眾生咸	南 無 西方極樂 世界無量 光 佛 願 共 眾 生 咸 
T47n1982_001:0462b28	歸命故。我頂禮生彼國。	歸 命 故 我 頂 禮 生 彼 國 
T47n1982_001:0462b29	南無西方極樂世界無邊光佛。願共眾生咸	南 無 西方極樂 世 界 無 邊 光 佛 願 共 眾 生 咸 
T47n1982_001:0462c01	歸命故。我頂禮生彼國。	歸 命 故 我 頂 禮 生 彼 國 
T47n1982_001:0462c02	南無西方極樂世界無礙光佛。願共眾生咸	南 無 西方極樂 世 界 無 礙 光 佛 願 共 眾 生 咸 
T47n1982_001:0462c03	歸命故。我頂禮生彼國。	歸 命 故 我 頂 禮 生 彼 國 
T47n1982_001:0462c04	南無西方極樂世界無對光佛。願共眾生咸	南 無 西方極樂 世 界 無 對 光 佛 願 共 眾 生 咸 
T47n1982_001:0462c05	歸命故。我頂禮生彼國。	歸 命 故 我 頂 禮 生 彼 國 
T47n1982_001:0462c06	南無西方極樂世界光焰王佛。願共眾生咸	南 無 西方極樂 世 界 光 焰 王 佛 願 共 眾 生 咸 
T47n1982_001:0462c07	歸命故。我頂禮生彼國。	歸 命 故 我 頂 禮 生 彼 國 
T47n1982_001:0462c08	南無西方極樂世界清淨光佛。願共眾生咸	南 無 西方極樂 世 界 清 淨 光 佛 願 共 眾 生 咸 
T47n1982_001:0462c09	歸命故。我頂禮生彼國。	歸 命 故 我 頂 禮 生 彼 國 
T47n1982_001:0462c10	南無西方極樂世界歡喜光佛。願共眾生咸	南 無 西方極樂 世 界 歡 喜 光 佛 願 共 眾 生 咸 
T47n1982_001:0462c11	歸命故。我頂禮生彼國。	歸 命 故 我 頂 禮 生 彼 國 
T47n1982_001:0462c12	南無西方極樂世界智慧光佛。願共眾生咸	南 無 西方極樂 世 界 智 慧 光 佛 願 共 眾 生 咸 
T47n1982_001:0462c13	歸命故。我頂禮生彼國。	歸 命 故 我 頂 禮 生 彼 國 
T47n1982_001:0462c14	南無西方極樂世界不斷光佛。願共眾生咸	南 無 西方極樂 世 界 不 斷 光 佛 願 共 眾 生 咸 
T47n1982_001:0462c15	歸命故。我頂禮生彼國。	歸 命 故 我 頂 禮 生 彼 國 
T47n1982_001:0462c16	南無西方極樂世界難思光佛。願共眾生咸	南 無 西方極樂 世 界 難 思 光 佛 願 共 眾 生 咸 
T47n1982_001:0462c17	歸命故。我頂禮生彼國。	歸 命 故 我 頂 禮 生 彼 國 
T47n1982_001:0462c18	南無西方極樂世界無稱光佛。願共眾生咸	南 無 西方極樂 世 界 無 稱 光 佛 願 共 眾 生 咸 
T47n1982_001:0462c19	歸命故。我頂禮生彼國。	歸 命 故 我 頂 禮 生 彼 國 
T47n1982_001:0462c20	南無西方極樂世界超日月光佛。願共眾生	南 無 西方極樂 世 界 超 日 月 光 佛 願 共 眾 生 
T47n1982_001:0462c21	咸歸命故。我頂禮生彼國。	咸 歸 命 故 我 頂 禮 生 彼 國 
T47n1982_001:0462c22	南無西方極樂世界阿彌陀佛。哀愍覆護我。	南 無 西方極樂 世 界 阿 彌 陀 佛 哀 愍 覆 護 我 
T47n1982_001:0462c23	令法種增長。此世及後生。願佛常攝受願	令 法 種 增 長 此 世 及 後 生 願 佛 常 攝 受 願 
T47n1982_001:0462c24	共眾生咸歸命故。我頂禮生彼國。	共 眾 生 咸 歸 命 故 我 頂 禮 生 彼 國 
T47n1982_001:0462c25	南無西方極樂世界觀世音菩薩摩訶薩。願	南 無 西方極樂 世 界 觀 世 音 菩薩摩訶薩 願 
T47n1982_001:0462c26	共眾生咸歸命故。我頂禮生彼國。	共 眾 生 咸 歸 命 故 我 頂 禮 生 彼 國 
T47n1982_001:0462c27	南無西方極樂世界大勢至菩薩摩訶薩。願	南 無 西方極樂 世 界 大 勢 至 菩薩摩訶薩 願 
T47n1982_001:0462c28	共眾生咸歸命故。我頂禮生彼國。	共 眾 生 咸 歸 命 故 我 頂 禮 生 彼 國 
T47n1982_001:0462c29	南無西方極樂世界諸尊菩薩摩訶薩清淨大	南 無 西方極樂 世 界 諸 尊 菩薩摩訶薩 清 淨 大 
T47n1982_001:0463a01	海眾。願共眾生咸歸命故。我頂禮生彼國。	海 眾 願 共 眾 生 咸 歸 命 故 我 頂 禮 生 彼 國 
T47n1982_001:0463a02	普為上界梵釋四王天龍八部帝王人王師	普 為 上 界 梵 釋 四 王 天 龍 八 部 帝 王 人 王 師 
T47n1982_001:0463a03	僧父母及善知識法界眾生。悉願斷除三障。	僧 父 母 及 善 知 識 法 界 眾 生 悉 願 斷 除 三 障 
T47n1982_001:0463a04	同得往生阿彌陀佛國。歸命懺悔。	同 得 往 生 阿 彌 陀 佛 國 歸 命 懺 悔 
T47n1982_001:0463a05	南無普光佛　南無普明佛　南無普淨佛	南 無 普 光 佛 南 無 普 明 佛 南 無 普 淨 佛 
T47n1982_001:0463a06	南無多摩羅跋栴檀香佛	南 無 多摩羅跋 栴 檀 香 佛 
T47n1982_001:0463a07	南無栴檀光佛　南無摩尼幢佛　南無歡喜	南 無 栴 檀 光 佛 南 無 摩 尼 幢 佛 南 無 歡 喜 
T47n1982_001:0463a08	藏摩尼寶積佛　南無一切世間樂見上大精	藏 摩 尼 寶 積 佛 南 無 一切世間 樂 見 上 大 精 
T47n1982_001:0463a09	進佛　南無摩尼幢燈光佛	進 佛 南 無 摩 尼 幢 燈 光 佛 
T47n1982_001:0463a10	南無慧炬照佛　南無海德光明佛　南無金	南 無 慧 炬 照 佛 南 無 海 德 光 明 佛 南 無 金 
T47n1982_001:0463a11	剛牢強普散金光佛	剛 牢 強 普 散 金 光 佛 
T47n1982_001:0463a12	南無大強精進勇猛佛	南 無 大 強 精進勇猛 佛 
T47n1982_001:0463a13	南無大悲光佛　南無慈力王佛　南無慈藏	南 無 大 悲 光 佛 南 無 慈 力 王 佛 南 無 慈 藏 
T47n1982_001:0463a14	佛　南無栴檀窟莊嚴勝佛　南無賢善首佛	佛 南 無 栴 檀 窟 莊 嚴 勝 佛 南 無 賢 善 首 佛 
T47n1982_001:0463a15	　南無善意佛　南無廣莊嚴王佛　南無金	 南 無 善 意 佛 南 無 廣 莊 嚴 王 佛 南 無 金 
T47n1982_001:0463a16	剛華佛　南無寶蓋照空自在王佛	剛 華 佛 南 無 寶 蓋 照 空 自 在 王 佛 
T47n1982_001:0463a17	南無虛空寶華光佛	南 無 虛 空 寶 華 光 佛 
T47n1982_001:0463a18	南無琉璃莊嚴王佛	南 無 琉 璃 莊 嚴 王 佛 
T47n1982_001:0463a19	南無普現色身光佛	南 無 普 現 色 身 光 佛 
T47n1982_001:0463a20	南無不動光佛　南無降伏諸魔王佛　南無	南 無 不 動 光 佛 南 無 降 伏 諸 魔 王 佛 南 無 
T47n1982_001:0463a21	才光明佛　南無智慧勝佛　南無彌勒仙光	才 光 明 佛 南 無 智 慧 勝 佛 南 無 彌 勒 仙 光 
T47n1982_001:0463a22	佛　南無世靜光佛　南無善寂月音妙尊智	佛 南 無 世 靜 光 佛 南 無 善 寂 月 音 妙 尊 智 
T47n1982_001:0463a23	王佛	王 佛 
T47n1982_001:0463a24	南無龍種上尊王佛	南 無 龍 種 上 尊 王 佛 
T47n1982_001:0463a25	南無日月光佛　南無日月珠光佛　南無慧	南 無 日 月 光 佛 南 無 日 月 珠 光 佛 南 無 慧 
T47n1982_001:0463a26	幡勝王佛	幡 勝 王 佛 
T47n1982_001:0463a27	南無師子吼自在力王佛	南 無 師 子 吼 自 在 力 王 佛 
T47n1982_001:0463a28	南無妙音勝佛　南無常光幢佛　南無觀世	南 無 妙 音 勝 佛 南 無 常 光 幢 佛 南 無 觀 世 
T47n1982_001:0463b01	燈佛　南無慧威燈王佛　南無法勝王佛	燈 佛 南 無 慧 威 燈 王 佛 南 無 法 勝 王 佛 
T47n1982_001:0463b02	　南無須彌光佛　南無須曼那華光佛	 南 無 須 彌 光 佛 南 無 須 曼 那 華 光 佛 
T47n1982_001:0463b03	南無優鉢羅華殊勝王佛	南 無 優 鉢 羅 華 殊 勝 王 佛 
T47n1982_001:0463b04	南無大慧力王佛	南 無 大 慧 力 王 佛 
T47n1982_001:0463b05	南無阿閦鞞歡喜光佛	南 無 阿 閦 鞞 歡 喜 光 佛 
T47n1982_001:0463b06	南無無量音聲王佛	南 無 無 量 音 聲 王 佛 
T47n1982_001:0463b07	南無才光佛　南無金海光佛　南無山海慧	南 無 才 光 佛 南 無 金 海 光 佛 南 無 山 海 慧 
T47n1982_001:0463b08	自在通王佛	自 在 通 王 佛 
T47n1982_001:0463b09	南無大通光佛	南 無 大 通 光 佛 
T47n1982_001:0463b10	南無一切法常滿王佛	南 無 一 切 法 常 滿 王 佛 
T47n1982_001:0463b11	此五十三佛名者。乃是過去久遠舊住娑婆	此 五 十 三 佛 名 者 乃 是 過去久遠 舊 住 娑 婆 
T47n1982_001:0463b12	世界。成熟眾生而般涅槃。若有善男子善女	世 界 成 熟 眾 生 而 般 涅 槃 若 有 善 男 子 善 女 
T47n1982_001:0463b13	人及餘一切眾生。得聞是五十三佛名者。是	人 及 餘 一 切 眾 生 得 聞 是 五 十 三 佛 名 者 是 
T47n1982_001:0463b14	人於百千萬億阿僧祇劫不墮惡道。若復有	人 於 百 千 萬 億 阿僧祇劫 不墮惡道 若 復 有 
T47n1982_001:0463b15	人。能誦是五十三佛名者。除滅四重五逆。及	人 能 誦 是 五 十 三 佛 名 者 除 滅 四 重 五 逆 及 
T47n1982_001:0463b16	謗方等經皆悉清淨。以是諸佛本誓願故。於	謗 方 等 經 皆 悉 清 淨 以 是 諸 佛 本 誓 願 故 於 
T47n1982_001:0463b17	念念中即得除滅如上諸罪。	念 念 中 即 得 除 滅 如 上 諸 罪 
T47n1982_001:0463b18	此華嚴偈九句。	此 華 嚴 偈 九 句 
T47n1982_001:0463b19	　一切眾生類　　皆悉三世攝	 一 切 眾 生 類 皆 悉 三 世 攝 
T47n1982_001:0463b20	　三世諸眾生　　皆為五陰攝	 三 世 諸 眾 生 皆 為 五 陰 攝 
T47n1982_001:0463b21	　五陰諸眾生　　皆悉從業起	 五 陰 諸 眾 生 皆 悉 從 業 起 
T47n1982_001:0463b22	　諸業因心起　　心法猶如幻	 諸 業 因 心 起 心 法 猶 如 幻 
T47n1982_001:0463b23	　眾生亦如是	 眾 生 亦 如 是 
T47n1982_001:0463b24	凡眾生皆不得漫瞋。瞋時忍。即誦此四偈。	凡 眾 生 皆 不 得 漫 瞋 瞋 時 忍 即 誦 此 四 偈 
T47n1982_001:0463b25	　瞋是忍辱花　　忍是瞋家果	 瞋 是 忍 辱 花 忍 是 瞋 家 果 
T47n1982_001:0463b26	　花生便摘却　　果生何處坐	 花 生 便 摘 却 果 生 何 處 坐 
T47n1982_001:0463b27	但人受菩薩戒八勝法偈。	但 人 受 菩 薩 戒 八 勝 法 偈 
T47n1982_001:0463b28	　第一趣道勝　　第二發心勝	 第 一 趣 道 勝 第 二 發 心 勝 
T47n1982_001:0463b29	　第三功德勝　　第四福田勝	 第 三 功 德 勝 第 四 福 田 勝 
T47n1982_001:0463c01	　第五受罪輕微勝	 第 五 受 罪 輕 微 勝 
T47n1982_001:0463c02	　第六處胎勝　　第七神通勝	 第 六 處 胎 勝 第 七 神 通 勝 
T47n1982_001:0463c03	　第八果報勝	 第 八 果 報 勝 
T47n1982_001:0463c04	此四偈亦是受菩薩戒法偈。	此 四 偈 亦 是 受 菩 薩 戒 法 偈 
T47n1982_001:0463c05	　金剛無等解脫道　　十力雄猛震三千	 金 剛 無 等 解 脫 道 十 力 雄 猛 震 三 千 
T47n1982_001:0463c06	　破壞外道尼乾眾　　不與魔邪作因緣	 破 壞 外 道 尼 乾 眾 不 與 魔 邪 作 因 緣 
T47n1982_001:0463c07	此四偈亦是菩薩戒香湯法。	此 四 偈 亦 是 菩 薩 戒 香 湯 法 
T47n1982_001:0463c08	西方溫池水雪山童子補香湯．澡浴凡夫	西 方 溫 池 水 雪 山 童 子 補 香 湯 澡 浴 凡 夫 
T47n1982_001:0463c09	表裹淨．唯願速生彌勒家。	表 裹 淨 唯 願 速 生 彌 勒 家 
T47n1982_001:0463c10	此四偈亦是戒法。	此 四 偈 亦 是 戒 法 
T47n1982_001:0463c11	　戒如明日月　　亦如瓔珞珠	 戒 如 明 日 月 亦 如 瓔 珞 珠 
T47n1982_001:0463c12	　微塵菩薩眾　　由戒成正覺	 微 塵 菩 薩 眾 由 戒 成 正 覺 
T47n1982_001:0463c13	此四偈是破戒偈。	此 四 偈 是 破 戒 偈 
T47n1982_001:0463c14	　破戒如弦斷　　持戒若施弦	 破 戒 如 弦 斷 持 戒 若 施 弦 
T47n1982_001:0463c15	　臨陣空牽挽　　如何若向前	 臨 陣 空 牽 挽 如 何 若 向 前 
T47n1982_001:0463c16	此八偈是大智度論偈。	此 八 偈 是 大 智 度 論 偈 
T47n1982_001:0463c17	　世間人心動　　愛好福果報	 世 間 人 心 動 愛 好 福 果 報 
T47n1982_001:0463c18	　而不好福田　　求有不求滅	 而 不 好 福 田 求 有 不 求 滅 
T47n1982_001:0463c19	　先聞邪見法　　心著而深入	 先 聞 邪 見 法 心 著 而 深 入 
T47n1982_001:0463c20	　我是甚深法　　無信云何解	 我 是 甚 深 法 無 信 云 何 解 
T47n1982_001:0463c21	此四偈亦須修善業。	此 四 偈 亦 須 修 善 業 
T47n1982_001:0463c22	　汝得人身不修道　　如向寶山空手歸	 汝 得 人 身 不 修 道 如 向 寶 山 空 手 歸 
T47n1982_001:0463c23	　汝今自造還自受　　號咷啼哭知向誰	 汝 今 自 造 還 自 受 號 咷 啼 哭 知 向 誰 
T47n1982_001:0463c24	阿彌陀佛呪	阿 彌 陀 佛 呪 
T47n1982_001:0463c25	那謨菩陀夜　那謨馱囉摩夜那謨僧伽夜	那 謨 菩 陀 夜 那 謨 馱 囉 摩 夜 那 謨 僧 伽 夜 
T47n1982_001:0463c26	　那摩阿弭多婆夜　哆姪他　阿弭唎羝　阿	 那 摩 阿 弭 多 婆 夜 哆 姪 他 阿 弭 唎 羝 阿 
T47n1982_001:0463c27	弭唎都婆鼙　阿弭唎哆三婆鼙　阿弭	弭 唎 都 婆 鼙 阿 弭 唎 哆 三 婆 鼙 阿 弭 
T47n1982_001:0463c28	唎哆鼻　迦囒羝　伽弭儞伽伽那稽唎夜	唎 哆 鼻 迦 囒 羝 伽 弭 儞 伽 伽 那 稽 唎 夜 
