T47n1982_001:0456b03	集諸經禮懺儀卷上	集 諸 經 禮 懺 儀 卷 上 
T47n1982_001:0456b05	大唐西崇福寺沙門智昇撰	大 唐 西 崇 福 寺 沙 門 智 昇 撰 
T47n1982_001:0456b06	一切恭敬　敬禮常住三寶。	一 切 恭 敬 敬 禮 常 住 三 寶 
T47n1982_001:0456b07	是諸眾等人各[跍*月]跪。嚴持香花如法供養。	是 諸 眾 等 人 各 [跍月] 跪 嚴 持 香 花 如 法 供 養 
T47n1982_001:0456b08	願此香花雲。遍滿十方界。供養一切佛。化佛	願 此 香 花 雲 遍 滿 十 方 界 供 養 一 切 佛 化 佛 
T47n1982_001:0456b09	并菩薩。無數聲聞眾。受此香花雲。以為光明	并 菩 薩 無 數 聲 聞 眾 受 此 香 花 雲 以 為 光 明 
T47n1982_001:0456b10	臺。廣於無邊界。無邊無量佛土中受用作佛	臺 廣 於 無 邊 界 無 邊 無 量 佛 土 中 受 用 作 佛 
T47n1982_001:0456b11	事。供養一切恭敬嚴持香花如法行道一	事 供 養 一 切 恭 敬 嚴 持 香 花 如 法 行 道 一 
T47n1982_001:0456b12	切普誦。	切 普 誦 
T47n1982_001:0456b13	　如來妙色身　　世間無與等	 如 來 妙 色 身 世 間 無 與 等 
T47n1982_001:0456b14	　無比不思議　　是故今敬禮	 無 比 不 思 議 是 故 今 敬 禮 
T47n1982_001:0456b15	　如來色無盡　　智慧亦復然	 如 來 色 無 盡 智 慧 亦 復 然 
T47n1982_001:0456b16	　一切法常住　　是故我歸依	 一 切 法 常 住 是 故 我 歸 依 
T47n1982_001:0456b17	敬禮常住三寶。	敬 禮 常 住 三 寶 
T47n1982_001:0456b18	歎佛呪願	歎 佛 呪 願 
T47n1982_001:0456b19	如來應供正遍知明行足善逝世間解無上士	如 來 應 供 正 遍 知 明 行 足 善 逝 世 間 解 無 上 士 
T47n1982_001:0456b20	調御丈夫天人師佛世尊。佛有如是無量功	調御丈夫 天 人 師 佛 世 尊 佛 有 如 是 無 量 功 
T47n1982_001:0456b21	德。歎不能盡。以此善根已集當集現集一切	德 歎 不 能 盡 以 此 善 根 已 集 當 集 現 集 一 切 
T47n1982_001:0456b22	善根。以此善根滋益法界眾生。悉得離苦	善 根 以 此 善 根 滋 益 法 界 眾 生 悉 得 離 苦 
T47n1982_001:0456b23	解脫。捨邪歸正。發菩提心。永除三障。常見	解 脫 捨 邪 歸 正 發菩提心 永 除 三 障 常 見 
T47n1982_001:0456b24	一切諸佛菩薩及善知識。恒聞正法。福智具	一切諸佛 菩 薩 及 善 知 識 恒 聞 正 法 福 智 具 
T47n1982_001:0456b25	足一時作佛。	足 一 時 作 佛 
T47n1982_001:0456b26	南無東方須彌燈光明如來十方佛等一切諸	南 無 東 方 須 彌 燈 光 明 如 來 十 方 佛 等 一 切 諸 
T47n1982_001:0456b27	佛	佛 
T47n1982_001:0456b28	南無毘婆尸如來過去七佛等一切諸佛	南 無 毘 婆 尸 如 來 過 去 七 佛 等 一切諸佛 
T47n1982_001:0456b29	南無普光如來五十三佛等一切諸佛	南 無 普 光 如 來 五 十 三 佛 等 一切諸佛 
T47n1982_001:0456c01	南無東方善德如來十方佛等一切諸佛	南 無 東 方 善 德 如 來 十 方 佛 等 一切諸佛 
T47n1982_001:0456c02	南無拘那提如來賢劫千佛等一切諸佛	南 無 拘 那 提 如 來 賢 劫 千 佛 等 一切諸佛 
T47n1982_001:0456c03	南無釋迦牟尼如來三十五佛等一切諸佛	南 無 釋 迦 牟 尼 如 來 三 十 五 佛 等 一切諸佛 
T47n1982_001:0456c04	南無東方阿閦如來十方無量佛等一切諸佛	南 無 東 方 阿 閦 如 來 十 方 無 量 佛 等 一切諸佛 
T47n1982_001:0456c05	南無寶集佛　南無寶勝佛　南無成就	南 無 寶 集 佛 南 無 寶 勝 佛 南 無 成 就 
T47n1982_001:0456c06	盧舍那佛	盧 舍 那 佛 
T47n1982_001:0456c07	南無盧舍那鏡像佛	南 無 盧 舍 那 鏡 像 佛 
T47n1982_001:0456c08	南無盧舍那光明佛	南 無 盧 舍 那 光 明 佛 
T47n1982_001:0456c09	南無不動佛　南無大光明佛　南無無量聲	南 無 不 動 佛 南 無 大 光 明 佛 南 無 無 量 聲 
T47n1982_001:0456c10	如來(三稱)	如 來 三 稱 
T47n1982_001:0456c11	南無無量聲如來	南 無 無 量 聲 如 來 
T47n1982_001:0456c12	南無無量聲如來	南 無 無 量 聲 如 來 
T47n1982_001:0456c13	南無阿彌陀劬沙佛	南 無 阿 彌 陀 劬 沙 佛 
T47n1982_001:0456c14	南無大稱佛　南無寶光明佛　南無得大無	南 無 大 稱 佛 南 無 寶 光 明 佛 南 無 得 大 無 
T47n1982_001:0456c15	畏佛	畏 佛 
T47n1982_001:0456c16	南無燃燈火佛　南無實聲佛　南無無邊無	南 無 燃 燈 火 佛 南 無 實 聲 佛 南 無 無 邊 無 
T47n1982_001:0456c17	垢佛	垢 佛 
T47n1982_001:0456c18	南無月聲佛　南無無邊稱佛　南無日月光	南 無 月 聲 佛 南 無 無 邊 稱 佛 南 無 日 月 光 
T47n1982_001:0456c19	明世尊(三稱)	明 世 尊 三 稱 
T47n1982_001:0456c20	南無日月光明世尊	南 無 日 月 光 明 世 尊 
T47n1982_001:0456c21	南無日月光明世尊	南 無 日 月 光 明 世 尊 
T47n1982_001:0456c22	南無無垢光明佛	南 無 無垢光明 佛 
T47n1982_001:0456c23	南無清淨光明佛	南 無 清 淨 光 明 佛 
T47n1982_001:0456c24	南無日光明佛　南無無邊寶佛　南無華勝	南 無 日 光 明 佛 南 無 無 邊 寶 佛 南 無 華 勝 
T47n1982_001:0456c25	佛　南無妙身佛	佛 南 無 妙 身 佛 
T47n1982_001:0456c26	南無法光明清淨開敷蓮華佛	南 無 法 光 明 清 淨 開 敷 蓮 華 佛 
T47n1982_001:0456c27	南無虛空功德清淨微塵等目端正功德相光	南 無 虛 空 功 德 清 淨 微 塵 等 目 端 正 功 德 相 光 
T47n1982_001:0456c28	明華波頭摩瑠璃光寶體香最上香供養訖種	明 華 波 頭 摩 瑠 璃 光 寶 體 香 最 上 香 供 養 訖 種 
T47n1982_001:0456c29	種莊嚴頂髻無量無邊日月光明願力莊嚴變	種 莊 嚴 頂 髻 無量無邊 日 月 光 明 願 力 莊 嚴 變 
T47n1982_001:0457a01	化莊嚴法界出生無障礙王如來	化 莊 嚴 法 界 出 生 無 障 礙 王 如 來 
T47n1982_001:0457a02	南無毫相日月光明華寶蓮華堅如金剛身	南 無 毫 相 日 月 光 明 華 寶 蓮 華 堅 如 金 剛 身 
T47n1982_001:0457a03	毘盧遮那無障礙眼圓滿十方放光照一切佛	毘 盧 遮 那 無 障 礙 眼 圓 滿 十 方 放 光 照 一 切 佛 
T47n1982_001:0457a04	剎相王如來	剎 相 王 如 來 
T47n1982_001:0457a05	普為四恩三有法界眾生。斷除三障歸命懺	普 為 四 恩 三 有 法 界 眾 生 斷 除 三 障 歸 命 懺 
T47n1982_001:0457a06	悔。如是等一切世界。諸佛世尊常住在世。是	悔 如 是 等 一切世界 諸佛世尊 常 住 在 世 是 
T47n1982_001:0457a07	諸世尊。當慈念我。憶念我。證知我。若我此	諸 世 尊 當 慈 念 我 憶 念 我 證 知 我 若 我 此 
T47n1982_001:0457a08	生。若我前生。從無始生死已來。所作眾罪。	生 若 我 前 生 從 無始生死 已 來 所 作 眾 罪 
T47n1982_001:0457a09	若自作。若教他作。見作隨喜。若塔若僧。若取	若 自 作 若 教 他 作 見 作 隨 喜 若 塔 若 僧 若 取 
T47n1982_001:0457a10	四方僧物。若自取。若教人取。見取隨喜。或	四 方 僧 物 若 自 取 若 教 人 取 見 取 隨 喜 或 
T47n1982_001:0457a11	作五逆無間重罪。若自作。若教他作。見作隨	作 五 逆 無 間 重 罪 若 自 作 若 教 他 作 見 作 隨 
T47n1982_001:0457a12	喜。十不善道。自作教他見作隨喜。所作眾	喜 十 不 善 道 自 作 教 他 見 作 隨 喜 所 作 眾 
T47n1982_001:0457a13	罪或有覆藏或不覆藏。應墮地獄餓鬼畜生	罪 或 有 覆 藏 或 不 覆 藏 應 墮 地 獄 餓 鬼 畜 生 
T47n1982_001:0457a14	諸餘惡趣邊地下賤及彌戾車。於如是等處	諸 餘 惡 趣 邊 地 下 賤 及 彌 戾 車 於 如 是 等 處 
T47n1982_001:0457a15	所作罪障。今皆懺悔。	所 作 罪 障 今 皆 懺 悔 
T47n1982_001:0457a16	今諸佛世尊。當證知我當憶念我。我復於	今 諸佛世尊 當 證 知 我 當 憶 念 我 我 復 於 
T47n1982_001:0457a17	諸佛世尊前。作如是言。若我此生。若於餘生。	諸佛世尊 前 作如是言 若 我 此 生 若 於 餘 生 
T47n1982_001:0457a18	曾行布施。或守淨戒。乃至施與畜生一揣之	曾 行 布 施 或 守 淨 戒 乃 至 施 與 畜 生 一 揣 之 
T47n1982_001:0457a19	食。或修淨行所有善根。成就眾生所有善根。	食 或 修 淨 行 所 有 善 根 成 就 眾 生 所 有 善 根 
T47n1982_001:0457a20	修行菩提所有善根。求無上智所有善根。一	修 行 菩 提 所 有 善 根 求 無 上 智 所 有 善 根 一 
T47n1982_001:0457a21	切合集計校籌量。悉皆迴向阿耨多羅三藐	切 合 集 計 校 籌 量 悉 皆 迴 向 阿 耨 多 羅 三 藐 
T47n1982_001:0457a22	三菩提。如過去未來現在諸佛所作迴向。我	三 菩 提 如 過去未來現在 諸 佛 所 作 迴 向 我 
T47n1982_001:0457a23	亦如是迴向。	亦 如 是 迴 向 
T47n1982_001:0457a24	　眾罪皆懺悔　　諸福盡隨喜	 眾 罪 皆 懺 悔 諸 福 盡 隨 喜 
T47n1982_001:0457a25	　及請佛功德　　願成無上智	 及 請 佛 功 德 願 成 無 上 智 
T47n1982_001:0457a26	　去來現在佛　　於眾生最勝	 去來現在 佛 於 眾 生 最 勝 
T47n1982_001:0457a27	　無量功德海　　歸依合掌禮	 無量功德 海 歸 依 合 掌 禮 
T47n1982_001:0457a28	一切普誦	一 切 普 誦 
T47n1982_001:0457a29	南無摩訶般若波羅蜜。是大神呪。是大明呪。	南 無 摩訶般若波羅蜜 是 大 神 呪 是 大 明 呪 
T47n1982_001:0457b01	是無上呪。是無等等呪。	是 無 上 呪 是 無 等 等 呪 
T47n1982_001:0457b02	處世界　如虛空　如蓮華　不著水　心清	處 世 界 如 虛 空 如 蓮 華 不 著 水 心 清 
T47n1982_001:0457b03	淨　超於彼　稽首禮　無上尊	淨 超 於 彼 稽 首 禮 無 上 尊 
T47n1982_001:0457b04	願以此功德　普及於一切　我等與眾生	願 以 此 功 德 普 及 於 一 切 我 等 與 眾 生 
T47n1982_001:0457b05	　皆共成佛道	 皆 共 成 佛 道 
T47n1982_001:0457b06	禮佛已恭敬。	禮 佛 已 恭 敬 
T47n1982_001:0457b07	自歸依佛　當願眾生　體解大道　發無上	自 歸 依 佛 當 願 眾 生 體 解 大 道 發 無 上 
T47n1982_001:0457b08	意	意 
T47n1982_001:0457b09	自歸依法　當願眾生　深入經藏　智慧如	自 歸 依 法 當 願 眾 生 深 入 經 藏 智 慧 如 
T47n1982_001:0457b10	海	海 
T47n1982_001:0457b11	自歸依僧　當願眾生　統理大眾　一切無	自 歸 依 僧 當 願 眾 生 統 理 大 眾 一 切 無 
T47n1982_001:0457b12	礙	礙 
T47n1982_001:0457b13	願眾等聽說日暮無常偈今日已過。暮夜	願 眾 等 聽 說 日 暮 無 常 偈 今 日 已 過 暮 夜 
T47n1982_001:0457b14	難保。但觀此身。念念衰老。百年常期。如何	難 保 但 觀 此 身 念 念 衰 老 百 年 常 期 如 何 
T47n1982_001:0457b15	可保。是故眾等。勤心行道。諸行無常。是生	可 保 是 故 眾 等 勤 心 行 道 諸行無常 是 生 
T47n1982_001:0457b16	滅法。生滅滅已。寂滅為樂。如來證涅槃。永	滅 法 生 滅 滅 已 寂 滅 為 樂 如 來 證 涅 槃 永 
T47n1982_001:0457b17	斷於生死。若能至心聽。常得無量樂。	斷 於 生 死 若 能 至 心 聽 常 得 無 量 樂 
T47n1982_001:0457b18	十方佛名經一卷	十 方 佛 名 經 一 卷 
T47n1982_001:0457b19	一切恭敬　敬禮常住三寶。	一 切 恭 敬 敬 禮 常 住 三 寶 
T47n1982_001:0457b20	一切普誦	一 切 普 誦 
T47n1982_001:0457b21	　如來妙色身　　世間無與等	 如 來 妙 色 身 世 間 無 與 等 
T47n1982_001:0457b22	　無比不思議　　是故今敬禮	 無 比 不 思 議 是 故 今 敬 禮 
T47n1982_001:0457b23	　如來色無盡　　智慧亦復然	 如 來 色 無 盡 智 慧 亦 復 然 
T47n1982_001:0457b24	　一切法常住　　是故我歸依	 一 切 法 常 住 是 故 我 歸 依 
T47n1982_001:0457b25	敬禮常住三寶。	敬 禮 常 住 三 寶 
T47n1982_001:0457b26	歎佛呪願	歎 佛 呪 願 
T47n1982_001:0457b27	　天上天下無如佛　　十方世界亦無比	 天 上 天 下 無 如 佛 十方世界 亦 無 比 
T47n1982_001:0457b28	　世界所有我盡見　　一切無有如佛者	 世 界 所 有 我 盡 見 一 切 無 有 如 佛 者 
T47n1982_001:0457b29	敬禮釋迦牟尼佛	敬 禮 釋 迦 牟 尼 佛 
T47n1982_001:0457c01	敬禮當來彌勒尊佛	敬 禮 當 來 彌 勒 尊 佛 
T47n1982_001:0457c02	敬禮東方善德如來一切諸佛	敬 禮 東 方 善 德 如 來 一切諸佛 
T47n1982_001:0457c03	敬禮東南方無優德如來一切諸佛	敬 禮 東 南 方 無 優 德 如 來 一切諸佛 
T47n1982_001:0457c04	敬禮南方旃檀功德如來一切諸佛	敬 禮 南 方 旃 檀 功 德 如 來 一切諸佛 
T47n1982_001:0457c05	敬禮西南方寶施如來一切諸佛	敬 禮 西 南 方 寶 施 如 來 一切諸佛 
T47n1982_001:0457c06	敬禮西方無量明如來一切諸佛	敬 禮 西 方 無 量 明 如 來 一切諸佛 
T47n1982_001:0457c07	敬禮西北方花德如來一切諸佛	敬 禮 西 北 方 花 德 如 來 一切諸佛 
T47n1982_001:0457c08	敬禮北方相德如來一切諸佛	敬 禮 北 方 相 德 如 來 一切諸佛 
T47n1982_001:0457c09	敬禮東北方三乘行如來一切諸佛	敬 禮 東 北 方 三 乘 行 如 來 一切諸佛 
T47n1982_001:0457c10	敬禮上方廣眾德如來一切諸佛	敬 禮 上 方 廣 眾 德 如 來 一切諸佛 
T47n1982_001:0457c11	敬禮下方明德如來一切諸佛	敬 禮 下 方 明 德 如 來 一切諸佛 
T47n1982_001:0457c12	敬禮賢劫千佛千五百佛	敬 禮 賢 劫 千 佛 千 五 百 佛 
T47n1982_001:0457c13	敬禮五百花首百億金剛藏佛	敬 禮 五 百 花 首 百 億 金 剛 藏 佛 
T47n1982_001:0457c14	敬禮三十五佛五十三佛	敬 禮 三 十 五 佛 五 十 三 佛 
T47n1982_001:0457c15	敬禮過現未來三世諸佛	敬 禮 過 現 未 來 三世諸佛 
T47n1982_001:0457c16	敬禮舍利形像浮圖廟塔	敬 禮 舍 利 形 像 浮 圖 廟 塔 
T47n1982_001:0457c17	敬禮十二部尊經甚深法藏	敬 禮 十 二 部 尊 經 甚 深 法 藏 
T47n1982_001:0457c18	敬禮諸大菩薩一切賢聖	敬 禮 諸 大 菩 薩 一 切 賢 聖 
T47n1982_001:0457c19	為二十八天釋梵王等敬禮。常住三寶	為 二十八天 釋 梵 王 等 敬 禮 常 住 三 寶 
T47n1982_001:0457c20	為諸龍神等風雨順時。敬禮常住三寶	為 諸 龍 神 等 風 雨 順 時 敬 禮 常 住 三 寶 
T47n1982_001:0457c21	為過現諸師恒為導首。敬禮常住三寶	為 過 現 諸 師 恒 為 導 首 敬 禮 常 住 三 寶 
T47n1982_001:0457c22	為天皇天后聖化無窮。敬禮常住三寶	為 天 皇 天 后 聖 化 無 窮 敬 禮 常 住 三 寶 
T47n1982_001:0457c23	為諸王公主文武百官。敬禮常住三寶	為 諸 王 公 主 文 武 百 官 敬 禮 常 住 三 寶 
T47n1982_001:0457c24	為現存父母諸善知識。敬禮常住三寶	為 現 存 父 母 諸 善 知 識 敬 禮 常 住 三 寶 
T47n1982_001:0457c25	為十方施主六度圓滿。敬禮常住三寶	為 十 方 施 主 六 度 圓 滿 敬 禮 常 住 三 寶 
T47n1982_001:0457c26	為此國過往諸人神生淨土。敬禮常住三寶	為 此 國 過 往 諸 人 神 生 淨 土 敬 禮 常 住 三 寶 
T47n1982_001:0457c27	為僧伽藍神并諸眷屬。敬禮常住三寶	為 僧 伽 藍 神 并 諸 眷 屬 敬 禮 常 住 三 寶 
T47n1982_001:0457c28	為四方寧靜兵甲休息。敬禮常住三寶	為 四 方 寧 靜 兵 甲 休 息 敬 禮 常 住 三 寶 
T47n1982_001:0457c29	為三塗八難受苦眾生。敬禮常住三寶	為 三 塗 八 難 受 苦 眾 生 敬 禮 常 住 三 寶 
T47n1982_001:0458a01	為法界眾生永除三障歸命懺悔。	為 法 界 眾 生 永 除 三 障 歸 命 懺 悔 
T47n1982_001:0458a02	至心懺悔	至 心 懺 悔 
T47n1982_001:0458a03	十方無量佛．所知無不盡．我今悉於前．發	十 方 無 量 佛 所 知 無 不 盡 我 今 悉 於 前 發 
T47n1982_001:0458a04	露諸黑惡．三三合九種．從三煩惱起．今身	露 諸 黑 惡 三 三 合 九 種 從 三 煩 惱 起 今 身 
T47n1982_001:0458a05	若前身．有罪盡懺悔．於三惡道中．若應受業	若 前 身 有 罪 盡 懺 悔 於 三 惡 道 中 若 應 受 業 
T47n1982_001:0458a06	報．願得今身償．不入惡道受。懺悔已。歸命禮	報 願 得 今 身 償 不 入 惡 道 受 懺 悔 已 歸 命 禮 
T47n1982_001:0458a07	三寶。	三 寶 
T47n1982_001:0458a08	至心勸請	至 心 勸 請 
T47n1982_001:0458a09	十方一切佛．現在成道者．我請轉法輪．安	十 方 一 切 佛 現 在 成 道 者 我 請 轉 法 輪 安 
T47n1982_001:0458a10	樂諸眾生．十方一切佛．若欲捨壽命．我今頭	樂 諸 眾 生 十 方 一 切 佛 若 欲 捨 壽 命 我 今 頭 
T47n1982_001:0458a11	面禮．勸請令久住。勸請已。歸命禮三寶。	面 禮 勸 請 令 久 住 勸 請 已 歸 命 禮 三 寶 
T47n1982_001:0458a12	至心隨喜	至 心 隨 喜 
T47n1982_001:0458a13	所有布施福．持戒修禪行．從身口意生．去	所 有 布 施 福 持 戒 修 禪 行 從 身 口 意 生 去 
T47n1982_001:0458a14	來今所有．習行三乘人．具足三乘者．一切凡	來 今 所 有 習 行 三 乘 人 具 足 三 乘 者 一 切 凡 
T47n1982_001:0458a15	夫福．眾等皆隨喜。隨喜已。歸命禮三寶。	夫 福 眾 等 皆 隨 喜 隨 喜 已 歸 命 禮 三 寶 
T47n1982_001:0458a16	至心迴向	至 心 迴 向 
T47n1982_001:0458a17	我所有福德．一切皆和合．為諸眾生故．正	我 所 有 福 德 一 切 皆 和 合 為 諸 眾 生 故 正 
T47n1982_001:0458a18	迴向佛道。迴向已。歸命禮三寶。	迴 向 佛 道 迴 向 已 歸 命 禮 三 寶 
T47n1982_001:0458a19	至心發願	至 心 發 願 
T47n1982_001:0458a20	願諸眾生等．悉發菩提心．繫心常思念．十	願 諸 眾 生 等 悉 發菩提心 繫 心 常 思 念 十 
T47n1982_001:0458a21	方一切佛．復願諸眾生．永破諸煩惱．了了見	方 一 切 佛 復 願 諸 眾 生 永 破 諸 煩 惱 了 了 見 
T47n1982_001:0458a22	佛性．猶如妙德等。發願已。歸命禮三寶。	佛 性 猶 如 妙 德 等 發 願 已 歸 命 禮 三 寶 
T47n1982_001:0458a23	諸大德。欲求寂滅樂。當學沙門法。衣食計	諸 大 德 欲 求 寂 滅 樂 當 學 沙 門 法 衣 食 計 
T47n1982_001:0458a24	身命精麁隨眾等。今朝某日僧各六念。六念	身 命 精 麁 隨 眾 等 今 朝 某 日 僧 各 六 念 六 念 
T47n1982_001:0458a25	已禮佛恭敬。	已 禮 佛 恭 敬 
T47n1982_001:0458a26	自歸依佛　當願眾生　體解大道　發無上	自 歸 依 佛 當 願 眾 生 體 解 大 道 發 無 上 
T47n1982_001:0458a27	意	意 
T47n1982_001:0458a28	自歸依法　當願眾生　深入經藏　智慧如	自 歸 依 法 當 願 眾 生 深 入 經 藏 智 慧 如 
T47n1982_001:0458a29	海	海 
T47n1982_001:0458b01	自歸依僧　當願眾生　統理大眾　一切無	自 歸 依 僧 當 願 眾 生 統 理 大 眾 一 切 無 
T47n1982_001:0458b02	礙	礙 
T47n1982_001:0458b03	願諸眾生　三業清淨　奉持尊教　和南聖	願 諸 眾 生 三 業 清 淨 奉 持 尊 教 和 南 聖 
T47n1982_001:0458b04	眾	眾 
T47n1982_001:0458b05	大集經呪	大 集 經 呪 
T47n1982_001:0458b06	南無佛陀耶　胡嚧嚧　悉度嚧　遮賦婆	南 無 佛 陀 耶 胡 嚧 嚧 悉 度 嚧 遮 賦 婆 
T47n1982_001:0458b07	　訖利波　悉檀尼　步嚧尼　娑婆訶	 訖 利 波 悉 檀 尼 步 嚧 尼 娑 婆 訶 
T47n1982_001:0458b08	此呪出大集經。誦一遍當誦十二部經一遍。	此 呪 出 大 集 經 誦 一 遍 當 誦 十二部經 一 遍 
T47n1982_001:0458b09	又當禮萬五千佛名四十萬八千五百遍。又	又 當 禮 萬 五 千 佛 名 四 十 萬 八 千 五 百 遍 又 
T47n1982_001:0458b10	持呪人身上如大地微塵。如是等罪普皆消	持 呪 人 身 上 如 大地微塵 如 是 等 罪 普 皆 消 
T47n1982_001:0458b11	滅。	滅 
T47n1982_001:0458b12	南無救苦觀世音菩薩摩訶薩。	南 無 救 苦 觀 世 音 菩薩摩訶薩 
T47n1982_001:0458b13	南無救苦觀世音菩薩摩訶薩。	南 無 救 苦 觀 世 音 菩薩摩訶薩 
T47n1982_001:0458b14	南無救苦觀世音菩薩摩訶薩。	南 無 救 苦 觀 世 音 菩薩摩訶薩 
T47n1982_001:0458b15	向來稱揚十念功德。廣大善根資益亡者。花	向 來 稱 揚 十 念 功 德 廣 大 善 根 資 益 亡 者 花 
T47n1982_001:0458b16	臺花閣空裹相迎。寶坐寶床乘虛接引。摩尼	臺 花 閣 空 裹 相 迎 寶 坐 寶 床 乘 虛 接 引 摩 尼 
T47n1982_001:0458b17	殿上聽說苦空。般若池中蕩除心垢。觀音化	殿 上 聽 說 苦 空 般 若 池 中 蕩 除 心 垢 觀 音 化 
T47n1982_001:0458b18	佛為作證明。彌勒坐前分明受記。六親眷屬	佛 為 作 證 明 彌 勒 坐 前 分 明 受 記 六 親 眷 屬 
T47n1982_001:0458b19	七族因緣。百福莊嚴天龍衛護。三塗息苦。地	七 族 因 緣 百 福 莊 嚴 天 龍 衛 護 三 塗 息 苦 地 
T47n1982_001:0458b20	獄停酸。大及亡靈俱時離苦。和南聖眾。檀為	獄 停 酸 大 及 亡 靈 俱 時 離 苦 和 南 聖 眾 檀 為 
T47n1982_001:0458b21	萬行首。捨著離慳貪。是故今施主。持財奉布	萬 行 首 捨 著 離 慳 貪 是 故 今 施 主 持 財 奉 布 
T47n1982_001:0458b22	施。以此勝善根。果報無窮盡。逮及苦眾生。當	施 以 此 勝 善 根 果 報 無 窮 盡 逮 及 苦 眾 生 當 
T47n1982_001:0458b23	來成佛道。	來 成 佛 道 
T47n1982_001:0458b24	施粥偈天帝釋說	施 粥 偈 天 帝 釋 說 
T47n1982_001:0458b25	　持戒清淨如所奉　　恭敬隨時以粥施	 持 戒 清 淨 如 所 奉 恭 敬 隨 時 以 粥 施 
T47n1982_001:0458b26	　十利饒益於行者　　色力壽樂辭清辯	 十 利 饒 益 於 行 者 色 力 壽 樂 辭 清 辯 
T47n1982_001:0458b27	　宿食風除飢渴消　　是名良藥佛所說	 宿 食 風 除 飢 渴 消 是 名 良 藥 佛 所 說 
T47n1982_001:0458b28	　欲得生天長受樂　　應當以粥施眾僧	 欲 得 生 天 長 受 樂 應 當 以 粥 施 眾 僧 
T47n1982_001:0458b29	南無十方無邊際．去來現在一切佛．等空不	南 無 十 方 無 邊 際 去來現在 一 切 佛 等 空 不 
T47n1982_001:0458c01	動真如智．清淨皎識庵摩羅．清淨法身毘	動 真 如 智 清 淨 皎 識 庵 摩 羅 清 淨 法 身 毘 
T47n1982_001:0458c02	嚧遮．圓滿報應嚧舍那．應化色身千百億．	嚧 遮 圓 滿 報 應 嚧 舍 那 應 化 色 身 千 百 億 
T47n1982_001:0458c03	釋迦牟尼現娑婆．三佛體同一切爾．故我頂	釋 迦 牟 尼 現 娑 婆 三 佛 體 同 一 切 爾 故 我 頂 
T47n1982_001:0458c04	禮諸佛陀．南無十方無邊際．去來現在一切	禮 諸 佛 陀 南 無 十 方 無 邊 際 去來現在 一 切 
T47n1982_001:0458c05	佛．諸佛身如新明鏡．我心淨若摩尼珠．諸佛	佛 諸 佛 身 如 新 明 鏡 我 心 淨 若 摩 尼 珠 諸 佛 
T47n1982_001:0458c06	悉來入我身．我還遍入諸佛軀．彼此相入如	悉 來 入 我 身 我 還 遍 入 諸 佛 軀 彼 此 相 入 如 
T47n1982_001:0458c07	鏡像．無來無去體空虛．無障無礙無生滅．故	鏡 像 無 來 無 去 體 空 虛 無障無礙 無 生 滅 故 
T47n1982_001:0458c08	我頂禮心真如．南無十方無邊際．去來現在	我 頂 禮 心 真 如 南 無 十 方 無 邊 際 去來現在 
T47n1982_001:0458c09	一切佛．諸佛真身並如鏡．善現聖凡真身相．	一 切 佛 諸 佛 真 身 並 如 鏡 善 現 聖 凡 真 身 相 
T47n1982_001:0458c10	一一身現一切身．一切身中身無量．法性清	一 一 身 現 一 切 身 一 切 身 中 身 無 量 法 性 清 
T47n1982_001:0458c11	淨體空融．身相涉入而無障．法身圓滿遍法	淨 體 空 融 身 相 涉 入 而 無 障 法身圓滿 遍 法 
T47n1982_001:0458c12	界．故我頂禮如來藏．南無十方無邊際．去來	界 故 我 頂 禮 如 來 藏 南 無 十 方 無 邊 際 去 來 
T47n1982_001:0458c13	現在一切佛．聖凡心性真如來．具足一切功	現 在 一 切 佛 聖 凡 心 性 真 如 來 具 足 一 切 功 
T47n1982_001:0458c14	德財．智慧光明恒普照．自性清淨心本開．常	德 財 智慧光明 恒 普 照 自 性 清 淨 心 本 開 常 
T47n1982_001:0458c15	樂我淨真識智．清淨不變始終明．久乘如道	樂 我 淨 真 識 智 清 淨 不 變 始 終 明 久 乘 如 道 
T47n1982_001:0458c16	成正覺．故我頂禮心如來．南無十方無邊際．	成 正 覺 故 我 頂 禮 心 如 來 南 無 十 方 無 邊 際 
T47n1982_001:0458c17	去來現在一切佛．法身實相真如智．湛然圓	去來現在 一 切 佛 法 身 實 相 真 如 智 湛 然 圓 
T47n1982_001:0458c18	滿遍世界．一切諸法藏總持．總持是心能善	滿 遍 世 界 一切諸法 藏 總 持 總 持 是 心 能 善 
T47n1982_001:0458c19	誓．不信見聞及覺知．無知見覺覺真正．自覺	誓 不 信 見 聞 及 覺 知 無 知 見 覺 覺 真 正 自 覺 
T47n1982_001:0458c20	覺他佛無二．故我頂禮身佛性．南無十方無	覺 他 佛 無 二 故 我 頂 禮 身 佛 性 南 無 十 方 無 
T47n1982_001:0458c21	邊際．去來現在一切佛．正真正道大悲心．自	邊 際 去來現在 一 切 佛 正 真 正 道 大 悲 心 自 
T47n1982_001:0458c22	性清淨極懸深．非修非作無見得．離名絕想	性 清 淨 極 懸 深 非 修 非 作 無 見 得 離 名 絕 想 
T47n1982_001:0458c23	叵思尋．非作有無微難見．諸魔外道莫能	叵 思 尋 非 作 有 無 微 難 見 諸 魔 外 道 莫 能 
T47n1982_001:0458c24	侵．常住圓滿無增減．故我頂禮菩提心．南無	侵 常 住 圓 滿 無 增 減 故 我 頂 禮 菩 提 心 南 無 
