T47n1982_002:0466b17	說。唯除睡時。恒憶恒念恒想恒觀此事等。故	說 唯 除 睡 時 恒 憶 恒 念 恒 想 恒 觀 此 事 等 故 
T47n1982_002:0466b18	名觀察門。	名 觀 察 門 
T47n1982_002:0466b19	四者作願門。所謂專心若晝若夜。一切時一	四 者 作 願 門 所 謂 專 心 若 晝 若 夜 一 切 時 一 
T47n1982_002:0466b20	切處。三業四威儀所作功德。不問初中後。皆	切 處 三 業 四 威 儀 所 作 功 德 不 問 初 中 後 皆 
T47n1982_002:0466b21	須真實心中發願願生彼國故名作願門。	須 真 實 心 中 發 願 願 生 彼 國 故 名 作 願 門 
T47n1982_002:0466b22	五者迴向門。所謂專心若自作善根。及一切	五 者 迴 向 門 所 謂 專 心 若 自 作 善 根 及 一 切 
T47n1982_002:0466b23	三乘五道一一聖凡等所作善根。深生隨喜。	三 乘 五 道 一 一 聖 凡 等 所 作 善 根 深 生 隨 喜 
T47n1982_002:0466b24	如諸佛菩薩所作隨喜。我亦如是隨喜。以此	如 諸佛菩薩 所 作 隨 喜 我 亦 如 是 隨 喜 以 此 
T47n1982_002:0466b25	隨喜善根及己所作善根。皆悉與眾生共之	隨 喜 善 根 及 己 所 作 善 根 皆 悉 與 眾 生 共 之 
T47n1982_002:0466b26	迴向彼國。故名迴向門。	迴 向 彼 國 故 名 迴 向 門 
T47n1982_002:0466b27	又到彼國已得六神通。迴入生死教化眾生。	又 到 彼 國 已 得 六 神 通 迴 入 生 死 教 化 眾 生 
T47n1982_002:0466b28	徹窮後際心無厭足。乃至成佛。亦名迴向門。	徹 窮 後 際 心 無 厭 足 乃至成佛 亦 名 迴 向 門 
T47n1982_002:0466b29	五門既具定得往生。一一門與上三心合。隨	五 門 既 具 定 得 往 生 一 一 門 與 上 三 心 合 隨 
T47n1982_002:0466c01	起業行不問多少。皆名真實業也。應知。	起 業 行 不 問 多 少 皆 名 真 實 業 也 應 知 
T47n1982_002:0466c02	又觀行四修法。用策三心五念之行。速得往	又 觀 行 四 修 法 用 策 三 心 五 念 之 行 速 得 往 
T47n1982_002:0466c03	生。何者為四。	生 何 者 為 四 
T47n1982_002:0466c04	一者恭敬修。所謂恭敬禮拜彼佛及彼一切	一 者 恭 敬 修 所 謂 恭敬禮拜 彼 佛 及 彼 一 切 
T47n1982_002:0466c05	聖眾等。故名恭敬修。畢命為期誓不中止。即	聖 眾 等 故 名 恭 敬 修 畢 命 為 期 誓 不 中 止 即 
T47n1982_002:0466c06	是長時修。	是 長 時 修 
T47n1982_002:0466c07	二者無餘修。所謂專稱彼佛名。專念專想專	二 者 無 餘 修 所 謂 專 稱 彼 佛 名 專 念 專 想 專 
T47n1982_002:0466c08	禮專讚彼佛及一切聖眾等。不雜餘業。故名	禮 專 讚 彼 佛 及 一 切 聖 眾 等 不 雜 餘 業 故 名 
T47n1982_002:0466c09	無餘修。畢命為期誓不中止。即是長時修。	無 餘 修 畢 命 為 期 誓 不 中 止 即 是 長 時 修 
T47n1982_002:0466c10	三者無間修。所謂相續恭敬禮拜稱名讚歎	三 者 無 間 修 所 謂 相 續 恭敬禮拜 稱 名 讚 歎 
T47n1982_002:0466c11	憶念觀察迴向發願。心心相續不以餘業來	憶 念 觀 察 迴 向 發 願 心 心 相 續 不 以 餘 業 來 
T47n1982_002:0466c12	間。故名無間修。又不以貪瞋煩惱來間隨犯	間 故 名 無 間 修 又 不 以 貪 瞋 煩 惱 來 間 隨 犯 
T47n1982_002:0466c13	隨懺。不令隔念隔時隔日。常使清淨。亦名無	隨 懺 不 令 隔 念 隔 時 隔 日 常 使 清 淨 亦 名 無 
T47n1982_002:0466c14	間修。畢命為期誓不中止。即是長時修。	間 修 畢 命 為 期 誓 不 中 止 即 是 長 時 修 
T47n1982_002:0466c15	又菩薩已免生死。所作善法迴求佛果。即是	又 菩 薩 已 免 生 死 所 作 善 法 迴 求 佛 果 即 是 
T47n1982_002:0466c16	自利。教化眾生盡未來際。即是利他。然今時	自 利 教 化 眾 生 盡未來際 即 是 利 他 然 今 時 
T47n1982_002:0466c17	眾生悉為煩惱繫縛。未免惡道生死等苦。隨	眾 生 悉 為 煩 惱 繫 縛 未 免 惡 道 生 死 等 苦 隨 
T47n1982_002:0466c18	緣起行一切善根。且速迴願往生彌陀佛國。	緣 起 行 一 切 善 根 且 速 迴 願 往 生 彌 陀 佛 國 
T47n1982_002:0466c19	到彼國已更無所畏如上四修自然任運。自	到 彼 國 已 更 無 所 畏 如 上 四 修 自 然 任 運 自 
T47n1982_002:0466c20	利利他無不具足。應知。	利 利 他 無 不 具 足 應 知 
T47n1982_002:0466c21	又如文殊波若云。欲明一行三昧。唯勸獨處	又 如 文 殊 波 若 云 欲 明 一行三昧 唯 勸 獨 處 
T47n1982_002:0466c22	空閑捨諸亂意。係心一佛不觀相貌專稱名	空 閑 捨 諸 亂 意 係 心 一 佛 不 觀 相 貌 專 稱 名 
T47n1982_002:0466c23	字。即於念中得見彼阿彌陀佛及一切佛等。	字 即 於 念 中 得 見 彼 阿 彌 陀 佛 及 一 切 佛 等 
T47n1982_002:0466c24	問曰。何故不令作觀。直遣專稱名字者。有何	問 曰 何 故 不 令 作 觀 直 遣 專 稱 名 字 者 有 何 
T47n1982_002:0466c25	意也。	意 也 
T47n1982_002:0466c26	答曰。乃由眾生障重境細心麁識颺神飛觀	答 曰 乃 由 眾 生 障 重 境 細 心 麁 識 颺 神 飛 觀 
T47n1982_002:0466c27	難成就。是以大聖悲憐。直勸專稱名字。正由	難 成 就 是 以 大 聖 悲 憐 直 勸 專 稱 名 字 正 由 
T47n1982_002:0466c28	稱名易故相續即生。問曰。既遣專稱一佛。何	稱 名 易 故 相 續 即 生 問 曰 既 遣 專 稱 一 佛 何 
T47n1982_002:0466c29	故境現即多。此豈非邪正相交一多雜現也。	故 境 現 即 多 此 豈 非 邪 正 相 交 一 多 雜 現 也 
T47n1982_002:0467a01	答曰。佛佛齊證。形無二別。縱使念一見多乖	答 曰 佛 佛 齊 證 形 無 二 別 縱 使 念 一 見 多 乖 
T47n1982_002:0467a02	何大道理也。	何 大 道 理 也 
T47n1982_002:0467a03	又如觀經云。行觀坐觀禮念等。皆須面向西	又 如 觀 經 云 行 觀 坐 觀 禮 念 等 皆 須 面 向 西 
T47n1982_002:0467a04	方者最勝。如樹先傾倒必隨曲。故必有事礙。	方 者 最 勝 如 樹 先 傾 倒 必 隨 曲 故 必 有 事 礙 
T47n1982_002:0467a05	不及向西方者。但作向西想亦得。問曰。一切	不 及 向 西 方 者 但 作 向 西 想 亦 得 問 曰 一 切 
T47n1982_002:0467a06	諸佛三身同證。悲智果圓亦應無二。隨方禮	諸 佛 三 身 同 證 悲 智 果 圓 亦 應 無 二 隨 方 禮 
T47n1982_002:0467a07	念課稱一佛。亦應得生。何故偏歎西方勸專	念 課 稱 一 佛 亦 應 得 生 何 故 偏 歎 西 方 勸 專 
T47n1982_002:0467a08	禮念等。有何義也　答曰。諸佛所證平等是	禮 念 等 有 何 義 也 答 曰 諸 佛 所 證 平 等 是 
T47n1982_002:0467a09	一。若以願行來收非無因緣。然彌陀世尊本	一 若 以 願 行 來 收 非 無 因 緣 然 彌 陀 世 尊 本 
T47n1982_002:0467a10	發深重誓願。願以光明名號攝化十方。但使	發 深 重 誓 願 願 以 光 明 名 號 攝 化 十 方 但 使 
T47n1982_002:0467a11	信心求念上盡一形。下至十聲一聲等。以佛	信 心 求 念 上 盡 一 形 下 至 十 聲 一 聲 等 以 佛 
T47n1982_002:0467a12	願力易得往生。是故釋迦及以諸佛勸向西	願 力 易 得 往 生 是 故 釋 迦 及 以 諸 佛 勸 向 西 
T47n1982_002:0467a13	方。為別異爾。亦非是稱念餘佛不能除障滅	方 為 別 異 爾 亦 非 是 稱 念 餘 佛 不 能 除 障 滅 
T47n1982_002:0467a14	罪也。應知。若能如上念念相續畢命為期者。	罪 也 應 知 若 能 如 上 念 念 相 續 畢 命 為 期 者 
T47n1982_002:0467a15	十即十生。百即百生。何以故。無外雜緣得正	十 即 十 生 百 即 百 生 何 以 故 無 外 雜 緣 得 正 
T47n1982_002:0467a16	念故。與佛本願得相應故。不違教故。隨順佛	念 故 與 佛 本 願 得 相 應 故 不 違 教 故 隨 順 佛 
T47n1982_002:0467a17	語故。若欲捨專修雜業者。百時希得一二。千	語 故 若 欲 捨 專 修 雜 業 者 百 時 希 得 一 二 千 
T47n1982_002:0467a18	時希得五三。何以故。乃由雜緣亂動失正念	時 希 得 五 三 何 以 故 乃 由 雜 緣 亂 動 失 正 念 
T47n1982_002:0467a19	故。與佛本願不相應故。與教相違故。不順佛	故 與 佛 本 願 不 相 應 故 與 教 相 違 故 不 順 佛 
T47n1982_002:0467a20	語故。係念不相續故。憶想間斷故。迴願不殷	語 故 係 念 不 相 續 故 憶 想 間 斷 故 迴 願 不 殷 
T47n1982_002:0467a21	重真實故。貪瞋諸見煩惱來間斷故。無有慚	重 真 實 故 貪 瞋 諸 見 煩 惱 來 間 斷 故 無 有 慚 
T47n1982_002:0467a22	愧懺悔心故。懺悔有三品。一要二略三廣。如	愧 懺 悔 心 故 懺 悔 有 三 品 一 要 二 略 三 廣 如 
T47n1982_002:0467a23	下具說。隨意用皆得又不相續念報彼佛恩	下 具 說 隨 意 用 皆 得 又 不 相 續 念 報 彼 佛 恩 
T47n1982_002:0467a24	故。心生輕慢。雖作業行常與名利相應故。人	故 心 生 輕 慢 雖 作 業 行 常 與 名 利 相 應 故 人 
T47n1982_002:0467a25	我自覆不親近同行善知識故。樂近雜緣自	我 自 覆 不 親 近 同 行 善 知 識 故 樂 近 雜 緣 自 
T47n1982_002:0467a26	障障他往生正行故。何以故爾。比自見聞諸	障 障 他 往 生 正 行 故 何 以 故 爾 比 自 見 聞 諸 
T47n1982_002:0467a27	方道俗解行不同專雜有異。但使專意作者十	方 道 俗 解 行 不 同 專 雜 有 異 但 使 專 意 作 者 十 
T47n1982_002:0467a28	即十生。修雜不至心者千中無一此二行得	即 十 生 修 雜 不 至 心 者 千 中 無 一 此 二 行 得 
T47n1982_002:0467a29	失如前已辯。仰願一切往生人等。善自思量。	失 如 前 已 辯 仰 願 一 切 往 生 人 等 善 自 思 量 
T47n1982_002:0467b01	已能今身願生彼國者。行住坐臥必須勵心	已 能 今 身 願 生 彼 國 者 行住坐臥 必 須 勵 心 
T47n1982_002:0467b02	剋已晝夜莫廢畢命為期。止在一形似如少苦。	剋 已 晝 夜 莫 廢 畢 命 為 期 止 在 一 形 似 如 少 苦 
T47n1982_002:0467b03	前念命終後念即生彼國。長時永劫常受無	前 念 命 終 後 念 即 生 彼 國 長 時 永 劫 常 受 無 
T47n1982_002:0467b04	為法樂。乃至成佛不經生死。豈非快哉。應知。	為 法 樂 乃至成佛 不 經 生 死 豈 非 快 哉 應 知 
T47n1982_002:0467b05	第一佛勸禮讚阿彌陀佛十二光名。求願往	第 一 佛 勸 禮 讚 阿 彌 陀 佛 十 二 光 名 求 願 往 
T47n1982_002:0467b06	生一十九拜。當日沒時禮。取中下懺悔亦得。	生 一 十 九 拜 當 日 沒 時 禮 取 中 下 懺 悔 亦 得 
T47n1982_002:0467b07	南無釋迦牟尼佛等一切三寶。我今稽首禮。	南 無 釋 迦 牟 尼 佛 等 一 切 三 寶 我 今 稽 首 禮 
T47n1982_002:0467b08	迴願往生無量壽國。此之一佛現是今時道	迴 願 往 生 無 量 壽 國 此 之 一 佛 現 是 今 時 道 
T47n1982_002:0467b09	俗等師。言三寶者。即是福田無量。若能禮之	俗 等 師 言 三 寶 者 即 是 福 田 無 量 若 能 禮 之 
T47n1982_002:0467b10	一拜。即是念報師恩以成已行。以斯一行迴	一 拜 即 是 念 報 師 恩 以 成 已 行 以 斯 一 行 迴 
T47n1982_002:0467b11	願往生。	願 往 生 
T47n1982_002:0467b12	南無十方三世盡虛空遍法界微塵剎土中。	南 無 十 方 三 世 盡 虛 空 遍 法 界 微 塵 剎 土 中 
T47n1982_002:0467b13	一切三寶。我今稽首禮。迴願往生無量壽國。	一 切 三 寶 我 今 稽 首 禮 迴 願 往 生 無 量 壽 國 
T47n1982_002:0467b14	然十方虛空無邊三寶無盡。若禮一拜。即是	然 十 方 虛 空 無 邊 三 寶 無 盡 若 禮 一 拜 即 是 
T47n1982_002:0467b15	福田無量功德無窮。能至心禮之一拜。一一	福 田 無量功德 無 窮 能 至 心 禮 之 一 拜 一 一 
T47n1982_002:0467b16	佛上。一一法上。一一菩薩上聖僧上。一一	佛 上 一 一 法 上 一 一 菩 薩 上 聖 僧 上 一 一 
T47n1982_002:0467b17	舍利上。皆得身口意業解脫分善根來資益	舍 利 上 皆 得 身口意業 解 脫 分 善 根 來 資 益 
T47n1982_002:0467b18	行者。以成己業。以斯一行迴願往生。	行 者 以 成 己 業 以 斯 一 行 迴 願 往 生 
T47n1982_002:0467b19	南無西方極樂世界阿彌陀佛。願共眾生咸	南 無 西方極樂 世 界 阿 彌 陀 佛 願 共 眾 生 咸 
T47n1982_002:0467b20	歸命故。我頂禮生彼國。	歸 命 故 我 頂 禮 生 彼 國 
T47n1982_002:0467b21	問曰。何故號為阿彌陀　答曰。彌陀經及觀	問 曰 何 故 號 為 阿 彌 陀 答 曰 彌 陀 經 及 觀 
T47n1982_002:0467b22	經云。彼佛光明無量。照十方國無所障礙。唯	經 云 彼 佛 光 明 無 量 照 十 方 國 無所障礙 唯 
T47n1982_002:0467b23	覓念佛眾生攝取不捨。故名阿彌陀佛。彼佛	覓 念 佛 眾 生 攝 取 不 捨 故 名 阿 彌 陀 佛 彼 佛 
T47n1982_002:0467b24	壽命及其人民無量無邊阿僧祇劫。故名阿	壽 命 及 其 人 民 無量無邊 阿僧祇劫 故 名 阿 
T47n1982_002:0467b25	彌陀。	彌 陀 
T47n1982_002:0467b26	又釋迦佛及十方佛。讚歎彌陀光明有十二	又 釋 迦 佛 及 十 方 佛 讚 歎 彌 陀 光 明 有 十 二 
T47n1982_002:0467b27	種名。普勸眾生稱名禮拜。相續不斷者。現世	種 名 普 勸 眾 生 稱 名 禮 拜 相續不斷 者 現 世 
T47n1982_002:0467b28	得無量功德。命終之後定得往生。如無量壽	得 無量功德 命終之後 定 得 往 生 如 無 量 壽 
T47n1982_002:0467b29	經說云。其有眾生遇斯光者。三垢消滅身意	經 說 云 其 有 眾 生 遇 斯 光 者 三 垢 消 滅 身 意 
T47n1982_002:0467c01	柔軟。歡喜踊躍善心生焉。若在三塗勤苦之	柔 軟 歡喜踊躍 善 心 生 焉 若 在 三 塗 勤 苦 之 
T47n1982_002:0467c02	處。見此光明無復苦惱。壽終之後皆蒙解脫。	處 見 此 光 明 無 復 苦 惱 壽終之後 皆 蒙 解 脫 
T47n1982_002:0467c03	無量壽佛光明顯赫。照耀十方諸佛國土。莫	無 量 壽 佛 光 明 顯 赫 照 耀 十方諸佛 國 土 莫 
T47n1982_002:0467c04	不聞焉。不但我今稱其光明。一切諸佛聲聞	不 聞 焉 不 但 我 今 稱 其 光 明 一切諸佛 聲 聞 
T47n1982_002:0467c05	緣覺諸菩薩眾咸共歎譽。亦復如是。若有眾	緣 覺 諸 菩 薩 眾 咸 共 歎 譽 亦復如是 若 有 眾 
T47n1982_002:0467c06	生聞其光明威神功德。日夜稱說至心不斷	生 聞 其 光 明 威 神 功 德 日 夜 稱 說 至 心 不 斷 
T47n1982_002:0467c07	者。隨其所願得生其國。常為諸菩薩聲聞之	者 隨 其 所 願 得 生 其 國 常 為 諸 菩 薩 聲 聞 之 
T47n1982_002:0467c08	眾。所共歎譽稱其功德。佛言。我說無量壽佛	眾 所 共 歎 譽 稱 其 功 德 佛 言 我 說 無 量 壽 佛 
T47n1982_002:0467c09	光明威神巍巍殊妙。晝夜一劫尚不能盡。	光 明 威 神 巍 巍 殊 妙 晝 夜 一 劫 尚 不 能 盡 
T47n1982_002:0467c10	白諸行者。當知彌陀身相光明。釋迦如來一	白 諸 行 者 當 知 彌 陀 身 相 光 明 釋 迦 如 來 一 
T47n1982_002:0467c11	劫說不能盡者。如觀經云。一一光明遍照十	劫 說 不 能 盡 者 如 觀 經 云 一 一 光明遍照 十 
T47n1982_002:0467c12	方世界。念佛眾生攝取不捨。今既觀經有如	方 世 界 念 佛 眾 生 攝 取 不 捨 今 既 觀 經 有 如 
T47n1982_002:0467c13	此不思議增上勝緣攝護行者。何不相續稱	此 不 思 議 增 上 勝 緣 攝 護 行 者 何 不 相 續 稱 
T47n1982_002:0467c14	觀禮念願往生也。應知。	觀 禮 念 願 往 生 也 應 知 
T47n1982_002:0467c15	南無西方　極樂世界　無量光佛　願共眾	南 無 西 方 極樂世界 無 量 光 佛 願 共 眾 
T47n1982_002:0467c16	生咸歸命。故我頂禮生彼國。	生 咸 歸 命 故 我 頂 禮 生 彼 國 
T47n1982_002:0467c17	南無西方　極樂世界　無邊光佛　願共眾	南 無 西 方 極樂世界 無 邊 光 佛 願 共 眾 
T47n1982_002:0467c18	生咸歸命。故我頂禮生彼國。	生 咸 歸 命 故 我 頂 禮 生 彼 國 
T47n1982_002:0467c19	南無西方　極樂世界　無礙光佛　願共眾	南 無 西 方 極樂世界 無 礙 光 佛 願 共 眾 
T47n1982_002:0467c20	生咸歸命。故我頂禮生彼國。	生 咸 歸 命 故 我 頂 禮 生 彼 國 
T47n1982_002:0467c21	南無西方　極樂世界　無對光佛　願共眾	南 無 西 方 極樂世界 無 對 光 佛 願 共 眾 
T47n1982_002:0467c22	生咸歸命。故我頂禮生彼國。	生 咸 歸 命 故 我 頂 禮 生 彼 國 
T47n1982_002:0467c23	南無西方　極樂世界　光焰王佛　願共眾	南 無 西 方 極樂世界 光 焰 王 佛 願 共 眾 
T47n1982_002:0467c24	生咸歸命。故我頂禮生彼國。	生 咸 歸 命 故 我 頂 禮 生 彼 國 
T47n1982_002:0467c25	南無西方　極樂世界　清淨光佛　願共眾	南 無 西 方 極樂世界 清 淨 光 佛 願 共 眾 
T47n1982_002:0467c26	生咸歸命。故我頂禮生彼國。	生 咸 歸 命 故 我 頂 禮 生 彼 國 
T47n1982_002:0467c27	南無西方　極樂世界　歡喜光佛　願共眾	南 無 西 方 極樂世界 歡 喜 光 佛 願 共 眾 
T47n1982_002:0467c28	生咸歸命。故我頂禮生彼國。	生 咸 歸 命 故 我 頂 禮 生 彼 國 
T47n1982_002:0467c29	南無西方　極樂世界　智慧光佛　願共眾	南 無 西 方 極樂世界 智 慧 光 佛 願 共 眾 
T47n1982_002:0468a01	生咸歸命。故我頂禮生彼國。	生 咸 歸 命 故 我 頂 禮 生 彼 國 
T47n1982_002:0468a02	南無西方　極樂世界　不斷光佛　願共眾	南 無 西 方 極樂世界 不 斷 光 佛 願 共 眾 
T47n1982_002:0468a03	生咸歸命。故我頂禮生彼國。	生 咸 歸 命 故 我 頂 禮 生 彼 國 
T47n1982_002:0468a04	南無西方　極樂世界　難思光佛　願共眾	南 無 西 方 極樂世界 難 思 光 佛 願 共 眾 
T47n1982_002:0468a05	生咸歸命。故我頂禮生彼國。	生 咸 歸 命 故 我 頂 禮 生 彼 國 
T47n1982_002:0468a06	南無西方　極樂世界　無稱光佛　願共眾	南 無 西 方 極樂世界 無 稱 光 佛 願 共 眾 
T47n1982_002:0468a07	生咸歸命。故我頂禮生彼國。	生 咸 歸 命 故 我 頂 禮 生 彼 國 
T47n1982_002:0468a08	南無西方　極樂世界　超日月光佛　願共	南 無 西 方 極樂世界 超 日 月 光 佛 願 共 
T47n1982_002:0468a09	眾生咸歸命。故我頂禮生彼國。	眾 生 咸 歸 命 故 我 頂 禮 生 彼 國 
T47n1982_002:0468a10	南無西方　極樂世界　阿彌陀佛。	南 無 西 方 極樂世界 阿 彌 陀 佛 
T47n1982_002:0468a11	哀愍覆護我．令法種增長．此世及後生．願	哀 愍 覆 護 我 令 法 種 增 長 此 世 及 後 生 願 
T47n1982_002:0468a12	佛常攝受　願共眾生咸歸命。故我頂禮生	佛 常 攝 受 願 共 眾 生 咸 歸 命 故 我 頂 禮 生 
T47n1982_002:0468a13	彼國。	彼 國 
T47n1982_002:0468a14	南無西方極樂世界觀世音菩薩　願共眾生	南 無 西方極樂 世 界 觀 世 音 菩 薩 願 共 眾 生 
T47n1982_002:0468a15	咸歸命。故我頂禮生彼國。	咸 歸 命 故 我 頂 禮 生 彼 國 
T47n1982_002:0468a16	南無西方極樂世界大勢至菩薩　願共眾生	南 無 西方極樂 世 界 大 勢 至 菩 薩 願 共 眾 生 
T47n1982_002:0468a17	咸歸命。故我頂禮生彼國。	咸 歸 命 故 我 頂 禮 生 彼 國 
T47n1982_002:0468a18	此二菩薩一切眾生臨命終時。共持花臺授	此 二 菩 薩 一 切 眾 生 臨命終時 共 持 花 臺 授 
T47n1982_002:0468a19	與行者。阿彌陀佛放大光明照行者身。復與	與 行 者 阿 彌 陀 佛 放大光明 照 行 者 身 復 與 
T47n1982_002:0468a20	無數化佛菩薩聲聞大眾等。一時授手。如彈	無 數 化 佛 菩 薩 聲 聞 大 眾 等 一 時 授 手 如 彈 
T47n1982_002:0468a21	指頃即得往生。為報恩故至心禮之一拜。	指 頃 即 得 往 生 為 報 恩 故 至 心 禮 之 一 拜 
T47n1982_002:0468a22	南無西方極樂世界　諸菩薩清淨大海眾	南 無 西方極樂 世 界 諸 菩 薩 清 淨 大 海 眾 
T47n1982_002:0468a23	　願共眾生咸歸命。故我頂禮生彼國。	 願 共 眾 生 咸 歸 命 故 我 頂 禮 生 彼 國 
T47n1982_002:0468a24	此等諸菩薩亦隨佛來迎接行者。為報恩故	此 等 諸 菩 薩 亦 隨 佛 來 迎 接 行 者 為 報 恩 故 
T47n1982_002:0468a25	至心禮之一拜。	至 心 禮 之 一 拜 
T47n1982_002:0468a26	普為師僧父母及善知識法界眾生。斷除三	普 為 師 僧 父 母 及 善 知 識 法 界 眾 生 斷 除 三 
T47n1982_002:0468a27	障。同得往生阿彌陀佛國。歸命懺悔。	障 同 得 往 生 阿 彌 陀 佛 國 歸 命 懺 悔 
T47n1982_002:0468a28	至心懺悔。	至 心 懺 悔 
T47n1982_002:0468b01	　南無歸懺十方佛　　願滅一切諸罪根	 南 無 歸 懺 十 方 佛 願 滅 一 切 諸 罪 根 
T47n1982_002:0468b02	　今將久近所修善　　迴作自他安樂因	 今 將 久 近 所 修 善 迴 作 自 他 安 樂 因 
T47n1982_002:0468b03	　恒願一切臨終時　　勝緣勝境悉現前	 恒 願 一 切 臨 終 時 勝 緣 勝 境 悉 現 前 
T47n1982_002:0468b04	　願覩彌陀大悲主　　觀音勢至十方尊	 願 覩 彌 陀 大 悲 主 觀 音 勢 至 十 方 尊 
T47n1982_002:0468b05	　仰惟神光蒙授手　　乘佛願力生彼國	 仰 惟 神 光 蒙 授 手 乘 佛 願 力 生 彼 國 
T47n1982_002:0468b06	　懺悔迴向發願已　　至心歸命阿彌陀佛	 懺 悔 迴 向 發 願 已 至 心 歸 命 阿 彌 陀 佛 
T47n1982_002:0468b07	次作梵　說偈發願(出寶性論)。	次 作 梵 說 偈 發 願 出 寶 性 論 
T47n1982_002:0468b08	　禮懺諸功德　　布施諸有情	 禮 懺 諸 功 德 布 施 諸 有 情 
T47n1982_002:0468b09	　願臨命終時　　見無量壽佛	 願 臨命終時 見 無 量 壽 佛 
T47n1982_002:0468b10	　無邊功德身　　我及餘信者	 無 邊 功 德 身 我 及 餘 信 者 
T47n1982_002:0468b11	　既見彼佛已　　願得離垢眼	 既 見 彼 佛 已 願 得 離 垢 眼 
T47n1982_002:0468b12	　往生安樂國　　成無上菩提	 往 生 安 樂 國 成 無上菩提 
T47n1982_002:0468b13	懺已一切恭敬。	懺 已 一 切 恭 敬 
T47n1982_002:0468b14	　歸佛得菩提　　道心恒不退	 歸 佛 得 菩 提 道 心 恒 不 退 
T47n1982_002:0468b15	　歸法薩婆若　　得大總持門	 歸 法 薩 婆 若 得 大 總 持 門 
T47n1982_002:0468b16	　歸僧息諍論　　同入和合海	 歸 僧 息 諍 論 同 入 和 合 海 
T47n1982_002:0468b17	　迴願往生　　無量壽國　　願諸眾生	 迴 願 往 生 無 量 壽 國 願 諸 眾 生 
T47n1982_002:0468b18	　三業清淨　　奉持佛教	 三 業 清 淨 奉 持 佛 教 
T47n1982_002:0468b19	　　和南一切賢聖迴願往生無量壽國。	 和 南 一 切 賢 聖 迴 願 往 生 無 量 壽 國 
T47n1982_002:0468b20	諸眾等聽說黃昏偈。	諸 眾 等 聽 說 黃 昏 偈 
T47n1982_002:0468b21	　人間怱怱營眾務　　不覺年命日夜去	 人 間 怱 怱 營 眾 務 不 覺 年 命 日 夜 去 
T47n1982_002:0468b22	　如燈風中滅難期　　忙忙六道無定趣	 如 燈 風 中 滅 難 期 忙 忙 六 道 無 定 趣 
T47n1982_002:0468b23	　未得解脫出苦海　　云何安然不驚懼	 未 得 解 脫 出 苦 海 云 何 安 然 不 驚 懼 
T47n1982_002:0468b24	　各聞強健有力時　　自策自勵求常住	 各 聞 強 健 有 力 時 自 策 自 勵 求 常 住 
T47n1982_002:0468b25	說此偈已更當心口發願。願弟子臨命終時。	說 此 偈 已 更 當 心 口 發 願 願 弟 子 臨命終時 
T47n1982_002:0468b26	心不顛倒。心不錯亂。心不失念。身心無諸苦	心 不 顛 倒 心 不 錯 亂 心 不 失 念 身 心 無 諸 苦 
T47n1982_002:0468b27	痛。身心安隱快樂。如入禪定。聖眾現前乘佛	痛 身 心 安 隱 快 樂 如 入 禪 定 聖 眾 現 前 乘 佛 
T47n1982_002:0468b28	本願。上品往生阿彌陀佛國。到彼國已得六	本 願 上 品 往 生 阿 彌 陀 佛 國 到 彼 國 已 得 六 
T47n1982_002:0468c01	神通。迴入十方界。救攝苦眾生。虛空法界盡。	神 通 迴 入 十 方 界 救 攝 苦 眾 生 虛 空 法 界 盡 
T47n1982_002:0468c02	我願亦如是。發願已至心歸命禮阿彌陀佛。	我 願 亦 如 是 發 願 已 至 心 歸 命 禮 阿 彌 陀 佛 
T47n1982_002:0468c03	初夜偈云。	初 夜 偈 云 
T47n1982_002:0468c04	　煩惱深無底　　生死海無邊	 煩 惱 深 無 底 生 死 海 無 邊 
T47n1982_002:0468c05	　度苦船未立　　云何樂睡眠	 度 苦 船 未 立 云 何 樂 睡 眠 
T47n1982_002:0468c06	　勇猛勤精進　　攝心常在禪	 勇猛勤精進 攝 心 常 在 禪 
T47n1982_002:0468c07	　勤修六度行　　菩提道自然	 勤 修 六 度 行 菩 提 道 自 然 
T47n1982_002:0468c08	中夜偈云。	中 夜 偈 云 
T47n1982_002:0468c09	　汝起勿抱臭身臥　　種種不淨假名人	 汝 起 勿 抱 臭 身 臥 種 種 不 淨 假 名 人 
T47n1982_002:0468c10	　如得重病箭入體　　眾苦痛集安可眠	 如 得 重 病 箭 入 體 眾 苦 痛 集 安 可 眠 
T47n1982_002:0468c11	後夜偈云。	後 夜 偈 云 
T47n1982_002:0468c12	　時光遷流轉　　忽至五更初	 時 光 遷 流 轉 忽 至 五 更 初 
T47n1982_002:0468c13	　無常念念至　　恒與死王居	 無 常 念 念 至 恒 與 死 王 居 
T47n1982_002:0468c14	　勸諸行道者　　勤學至無餘	 勸 諸 行 道 者 勤 學 至 無 餘 
T47n1982_002:0468c15	平旦偈云。	平 旦 偈 云 
T47n1982_002:0468c16	　欲求寂滅樂　　當學沙門法	 欲 求 寂 滅 樂 當 學 沙 門 法 
