T48n2011_001:0379a24	薩善根。自利利他莊嚴佛土。要須了四依乃	薩 善 根 自利利他 莊 嚴 佛 土 要 須 了 四 依 乃 
T48n2011_001:0379a25	窮實相。若依文執則失真宗。諸比丘等汝學	窮 實 相 若 依 文 執 則 失 真 宗 諸 比 丘 等 汝 學 
T48n2011_001:0379a26	他出家修道。此是出家出生死枷。是名出家。	他 出 家 修 道 此 是 出 家 出 生 死 枷 是 名 出 家 
T48n2011_001:0379a27	正念具足修道得成。乃至解身支節。臨命終	正 念 具 足 修 道 得 成 乃 至 解 身 支 節 臨 命 終 
T48n2011_001:0379a28	時不失正念。即得成佛。弟子上來集此論者。	時 不 失 正 念 即 得 成 佛 弟 子 上 來 集 此 論 者 
T48n2011_001:0379a29	直以信心依文取義作如是說。實非了了證	直 以 信 心 依 文 取 義 作如是說 實 非 了 了 證 
T48n2011_001:0379b01	知。若乖聖理者。願懺悔除滅。若當聖道者。迴	知 若 乖 聖 理 者 願 懺 悔 除 滅 若 當 聖 道 者 迴 
T48n2011_001:0379b02	施眾生。願皆識本心。一時成佛。聞者努力當	施 眾 生 願 皆 識 本 心 一 時 成 佛 聞 者 努 力 當 
T48n2011_001:0379b03	來成佛。願在前度我門徒。	來 成 佛 願 在 前 度 我 門 徒 
T48n2011_001:0379b04	問曰。此論從首至末。皆顯自心是道。未知果	問 曰 此 論 從 首 至 末 皆 顯 自 心 是 道 未 知 果 
T48n2011_001:0379b05	行二門是何門攝。答曰。此論顯一乘為宗。然	行 二 門 是 何 門 攝 答 曰 此 論 顯 一 乘 為 宗 然 
T48n2011_001:0379b06	其至意道迷趣。解自免生死。乃能度人直言	其 至 意 道 迷 趣 解 自 免 生 死 乃 能 度 人 直 言 
T48n2011_001:0379b07	自利不說利他。約行門攝。若有人依文行者	自 利 不 說 利 他 約 行 門 攝 若 有 人 依 文 行 者 
T48n2011_001:0379b08	即在前成佛。若我誑汝當來墮十八地獄。指	即 在 前 成 佛 若 我 誑 汝 當 來 墮 十 八 地 獄 指 
T48n2011_001:0379b09	天地為誓。若不信我世世被虎狼所食。	天 地 為 誓 若 不 信 我 世 世 被 虎 狼 所 食 
T48n2011_001:0379b10	最上乘論一卷(終)	最 上 乘 論 一 卷 終 
