T85n2797_001:0739b17	礙凡夫因果畢竟不受大樂歡喜。從一佛土	礙 凡 夫 因 果 畢 竟 不 受 大 樂 歡 喜 從 一 佛 土 
T85n2797_001:0739b18	入無量佛土。從一劫入無量劫。乃至廣說。體	入 無 量 佛 土 從 一 劫 入 無 量 劫 乃至廣說 體 
T85n2797_001:0739b19	性善惠地者。謂清淨明達一切善根。所謂慈	性 善 惠 地 者 謂 清 淨 明 達 一 切 善 根 所 謂 慈 
T85n2797_001:0739b20	捨惡觀四諦法度眾生苦。體性光明地者。謂	捨 惡 觀 四 諦 法 度 眾 生 苦 體 性 光 明 地 者 謂 
T85n2797_001:0739b21	以三昧解了智知三世一切法門。所謂十二	以 三 昧 解 了 智 知 三 世 一切法門 所 謂 十 二 
T85n2797_001:0739b22	分教。總持辨才心心行空乃至廣說。體性爾	分 教 總 持 辨 才 心 心 行 空 乃至廣說 體 性 爾 
T85n2797_001:0739b23	炎地者。謂爾炎真俗不斷不常修習覺品。入	炎 地 者 謂 爾 炎 真 俗 不 斷 不 常 修 習 覺 品 入 
T85n2797_001:0739b24	善權方便化一切眾生。使見佛體性常樂我	善權方便 化 一 切 眾 生 使 見 佛 體 性 常 樂 我 
T85n2797_001:0739b25	淨。體性惠照地者。謂此地中有十力品起一	淨 體 性 惠 照 地 者 謂 此 地 中 有 十 力 品 起 一 
T85n2797_001:0739b26	切功德行。體性花光者。地如上經說。能於	切 功 德 行 體 性 花 光 者 地 如 上 經 說 能 於 
T85n2797_001:0739b27	一切世界中十神通明智品。以示一切眾生	一切世界 中 十 神 通 明 智 品 以 示 一 切 眾 生 
T85n2797_001:0739b28	種種變化天眼明智知三世國土中微塵等一	種 種 變 化 天 眼 明 智 知 三 世 國 土 中 微 塵 等 一 
T85n2797_001:0739b29	切色分分成六道。以天耳智知十方眾生苦	切 色 分 分 成 六 道 以 天 耳 智 知 十 方 眾 生 苦 
T85n2797_001:0739c01	樂音聲。以天身智知一切色非色非男非女	樂 音 聲 以 天 身 智 知 一 切 色 非 色 非 男 非 女 
T85n2797_001:0739c02	形。於一念中遍十方三世國土劫量微塵身。	形 於 一 念 中 遍 十 方 三 世 國 土 劫 量 微 塵 身 
T85n2797_001:0739c03	以天他心智知十方三世眾生所行。以天人	以 天 他 心 智 知 十 方 三 世 眾 生 所 行 以 天 人 
T85n2797_001:0739c04	智知十方三世一切眾生宿世事。以解脫智	智 知 十 方 三 世 一 切 眾 生 宿 世 事 以 解 脫 智 
T85n2797_001:0739c05	知十方三世眾生解脫。斷除一切煩惱若多	知 十 方 三 世 眾 生 解 脫 斷除一切 煩 惱 若 多 
T85n2797_001:0739c06	若少。以天定心智知十方三世國土中眾生	若 少 以 天 定 心 智 知 十 方 三 世 國 土 中 眾 生 
T85n2797_001:0739c07	心定不定。以天覺智知一切眾生已成佛未成	心 定 不 定 以 天 覺 智 知 一 切 眾 生 已 成 佛 未 成 
T85n2797_001:0739c08	佛。知十方佛心中所為說法。以天念智知百	佛 知 十 方 佛 心 中 所 為 說 法 以 天 念 智 知 百 
T85n2797_001:0739c09	劫千劫中一切眾生受命久近。以天願智知	劫 千 劫 中 一 切 眾 生 受 命 久 近 以 天 願 智 知 
T85n2797_001:0739c10	一切眾生賢聖十地。三十心中一一行願體	一 切 眾 生 賢 聖 十 地 三 十 心 中 一 一 行 願 體 
T85n2797_001:0739c11	性滿足地。謂十八聖人智品下地所不共。謂	性 滿 足 地 謂 十 八 聖 人 智 品 下 地 所 不 共 謂 
T85n2797_001:0739c12	十八不共法智分。體性佛吼地者。謂入法王	十八不共法 智 分 體 性 佛 吼 地 者 謂 入 法 王 
T85n2797_001:0739c13	位三昧。其智知佛佛吼三昧故。大明定行常	位 三 昧 其 智 知 佛 佛 吼 三 昧 故 大 明 定 行 常 
T85n2797_001:0739c14	現在。可以法藥施一切眾生。為大法師破壞	現 在 可 以 法 藥 施 一 切 眾 生 為 大 法 師 破 壞 
T85n2797_001:0739c15	四魔。法身化化入佛境界。體性花嚴地者。如	四 魔 法 身 化 化 入 佛 境 界 體 性 花 嚴 地 者 如 
T85n2797_001:0739c16	經言。以佛威儀如來三昧自在王定出入無	經 言 以 佛 威 儀 如 來 三昧自在 王 定 出 入 無 
T85n2797_001:0739c17	時於十方世界中百億四天下一時成佛轉法	時 於 十方世界 中 百 億 四 天 下 一 時 成 佛 轉 法 
T85n2797_001:0739c18	輪。體性入佛界地者。謂其大惠空空復空。如	輪 體 性 入 佛 界 地 者 謂 其 大 惠 空 空 復 空 如 
T85n2797_001:0739c19	虛空平等智法同法性故名如來。爾時生寶	虛空平等 智 法 同 法 性 故 名 如 來 爾 時 生 寶 
T85n2797_001:0739c20	蓮花上。一切與受記。歡喜法身手摩其頂。同	蓮 花 上 一 切 與 受 記 歡 喜 法 身 手 摩 其 頂 同 
T85n2797_001:0739c21	見同學菩薩異口同音讚歎無二。	見 同 學 菩 薩 異口同音 讚 歎 無 二 
T85n2797_001:0739c22	經。是故戒光至非無因故光　釋曰。第二歎	經 是 故 戒 光 至 非 無 因 故 光 釋 曰 第 二 歎 
T85n2797_001:0739c23	德有三。一辨勝因。二光非青等下離相。三諸	德 有 三 一 辨 勝 因 二 光 非 青 等 下 離 相 三 諸 
T85n2797_001:0739c24	佛之本原下歎用。此即第一辨勝因。言戒光	佛 之 本 原 下 歎 用 此 即 第 一 辨 勝 因 言 戒 光 
T85n2797_001:0739c25	者。有其二義。一佛世尊常誦持故。欲說戒時	者 有 其 二 義 一 佛 世 尊 常 誦 持 故 欲 說 戒 時 
T85n2797_001:0739c26	有光明出。二所說戒能闍破故。假立光稱以	有 光 明 出 二 所 說 戒 能 闍 破 故 假 立 光 稱 以 
T85n2797_001:0739c27	戒能破破戒垢故。有緣者。謂此戒法三無數	戒 能 破 破 戒 垢 故 有 緣 者 謂 此 戒 法 三 無 數 
T85n2797_001:0739c28	劫修習圓滿因所生故。非無因故。光者謂遮	劫 修習圓滿 因 所 生 故 非 無 因 故 光 者 謂 遮 
T85n2797_001:0739c29	無因論。又有緣者。佛大慈悲本願因緣力有	無 因 論 又 有 緣 者 佛 大 慈 悲 本 願 因 緣 力 有 
T85n2797_001:0740a01	情感佛增上緣力。是故戒光從佛口出。如是	情 感 佛 增上緣力 是 故 戒 光 從 佛 口 出 如 是 
T85n2797_001:0740a02	光明必有因緣。非無因緣。而有此光。又欲說	光 明 必 有 因 緣 非 無 因 緣 而 有 此 光 又 欲 說 
T85n2797_001:0740a03	菩薩戒光因緣故。光非無因緣。	菩 薩 戒 光 因 緣 故 光 非 無 因 緣 
T85n2797_001:0740a04	經。光非青至非因果法　釋曰。第二離相有	經 光 非 青 至 非 因 果 法 釋 曰 第 二 離 相 有 
T85n2797_001:0740a05	三。一非色心。二非有無。三非因果。此復有	三 一 非 色 心 二 非 有 無 三 非 因 果 此 復 有 
T85n2797_001:0740a06	二。一如是戒法不離法界。非青黃等。謂此戒	二 一 如 是 戒 法 不 離 法 界 非 青 黃 等 謂 此 戒 
T85n2797_001:0740a07	法從因緣起。猶如幻事。非實有性。故非色	法 從 因 緣 起 猶 如 幻 事 非 實 有 性 故 非 色 
T85n2797_001:0740a08	心。又非有無者。因緣生故。非定實有。亦非	心 又 非 有 無 者 因 緣 生 故 非 定 實 有 亦 非 
T85n2797_001:0740a09	定無。如幻有故。無定性故。非實因果。二此無	定 無 如 幻 有 故 無 定 性 故 非 實 因 果 二 此 無 
T85n2797_001:0740a10	表戒法處所攝。非青黃等。亦非緣慮心心法	表 戒 法處所攝 非 青 黃 等 亦 非 緣 慮 心 心 法 
T85n2797_001:0740a11	攝。無實體性故。言非有而假建立。非如菟角。	攝 無 實 體 性 故 言 非 有 而 假 建 立 非 如 菟 角 
T85n2797_001:0740a12	故言非無非如所執有故。言非有因緣生故。	故 言 非 無 非 如 所 執 有 故 言 非 有 因 緣 生 故 
T85n2797_001:0740a13	名為非無。體非實有故非實因果。此中應言	名 為 非 無 體 非 實 有 故 非 實 因 果 此 中 應 言 
T85n2797_001:0740a14	非因緣果法非無因果。而准可知。略而不	非 因 緣 果 法 非 無 因 果 而 准 可 知 略 而 不 
T85n2797_001:0740a15	說。	說 
T85n2797_001:0740a16	經。諸佛之本原至根本　釋曰。第三歎用。雖	經 諸 佛 之 本 原 至 根 本 釋 曰 第 三 歎 用 雖 
T85n2797_001:0740a17	非實因果。而能生諸佛菩薩種種功德故。言	非 實 因 果 而 能 生 諸佛菩薩 種 種 功 德 故 言 
T85n2797_001:0740a18	本原等。	本 原 等 
T85n2797_001:0740a19	經。是故大眾至善學　釋曰。第三結勸誦持。	經 是 故 大 眾 至 善 學 釋 曰 第 三 結 勸 誦 持 
T85n2797_001:0740a20	有如上說殊勝功能。是故汝等應持善學。	有 如 上 說 殊 勝 功 能 是 故 汝 等 應 持 善 學 
T85n2797_001:0740a21	經。佛子諦聽至第一清淨者　釋曰。第二顯	經 佛 子 諦 聽 至 第 一 清 淨 者 釋 曰 第 二 顯 
T85n2797_001:0740a22	教所被機。此戒寬廣不同聲聞。唯人男女能	教 所 被 機 此 戒 寬 廣 不 同 聲 聞 唯 人 男 女 能 
T85n2797_001:0740a23	受具戒。非天龍等能受此戒。今大乘戒。廣攝	受 具 戒 非 天 龍 等 能 受 此 戒 今 大 乘 戒 廣 攝 
T85n2797_001:0740a24	有情。皆入此戒。問云。何八部受菩薩戒耶。	有 情 皆 入 此 戒 問 云 何 八 部 受 菩 薩 戒 耶 
T85n2797_001:0740a25	答。若八部中先已發心。亦得受戒。言八部者。	答 若 八 部 中 先 已 發 心 亦 得 受 戒 言 八 部 者 
T85n2797_001:0740a26	謂天龍等八。又四天王各領二部名八。金剛	謂 天 龍 等 八 又 四 天 王 各 領 二 部 名 八 金 剛 
T85n2797_001:0740a27	神者。謂金剛密迹力士。雖是菩薩。而願力故	神 者 謂 金 剛 密迹力士 雖 是 菩 薩 而 願 力 故 
T85n2797_001:0740a28	受金剛神身。具如金剛密迹經說。變化人者。	受 金 剛 神 身 具 如 金 剛 密 迹 經 說 變 化 人 者 
T85n2797_001:0740a29	謂諸龍等變為人受戒。	謂 諸 龍 等 變 為 人 受 戒 
T85n2797_001:0740b01	經。佛告諸佛子言至木叉　釋曰。第二正釋	經 佛 告 諸 佛 子 言 至 木 叉 釋 曰 第 二 正 釋 
T85n2797_001:0740b02	戒相。先重後輕。重中有三。一標章。二別釋。	戒 相 先 重 後 輕 重 中 有 三 一 標 章 二 別 釋 
T85n2797_001:0740b03	三勸持。前中有三。一標章。二勸學。三勸持。	三 勸 持 前 中 有 三 一 標 章 二 勸 學 三 勸 持 
T85n2797_001:0740b04	此即標章。然十波羅夷略作十門。一釋名。二	此 即 標 章 然 十 波 羅 夷 略 作 十 門 一 釋 名 二 
T85n2797_001:0740b05	辨體。三種數。四廢立。五犯境。六輕重。七犯	辨 體 三 種 數 四 廢 立 五 犯 境 六 輕 重 七 犯 
T85n2797_001:0740b06	相。八自他。九犯因。十受果。第一釋名。先通	相 八 自 他 九 犯 因 十 受 果 第 一 釋 名 先 通 
T85n2797_001:0740b07	後別。通者十是數名。波羅夷者。梵音波羅市	後 別 通 者 十 是 數 名 波 羅 夷 者 梵 音 波 羅 市 
T85n2797_001:0740b08	迦。此云他勝處。他有四種。一煩惱違性。名之	迦 此 云 他 勝 處 他 有 四 種 一 煩 惱 違 性 名 之 
T85n2797_001:0740b09	為他。二不善業道。違善戒品故名為他。三魔	為 他 二 不善業道 違 善 戒 品 故 名 為 他 三 魔 
T85n2797_001:0740b10	王名他。損善行故。四惡趣名他。不如意故。若	王 名 他 損 善 行 故 四 惡 趣 名 他 不 如 意 故 若 
T85n2797_001:0740b11	人犯十重。即他所勝他勝依處名他勝處。是	人 犯 十 重 即 他 所 勝 他 勝 依 處 名 他 勝 處 是 
T85n2797_001:0740b12	依主釋。言別名者。至文當釋。第二辨體者。	依 主 釋 言 別 名 者 至 文 當 釋 第 二 辨 體 者 
T85n2797_001:0740b13	殺盜婬沽。以不善身業為自性。妄語說過自	殺 盜 婬 沽 以 不 善 身 業 為 自 性 妄 語 說 過 自 
T85n2797_001:0740b14	讚誹謗。如是四種。不善語邪見以為自性。此	讚 誹 謗 如 是 四 種 不 善 語 邪 見 以 為 自 性 此 
T85n2797_001:0740b15	中妄語即妄語。若謗三寶邪見虛語誑語為	中 妄 語 即 妄 語 若 謗 三 寶 邪 見 虛 語 誑 語 為 
T85n2797_001:0740b16	自性。說過是麁惡語性。自讚虛誑及麁惡語	自 性 說 過 是 麁 惡 語 性 自 讚 虛 誑 及 麁 惡 語 
T85n2797_001:0740b17	為自性。慳貪瞋恚如次貪嗔業道為性(此即意業)又	為 自 性 慳 貪 瞋 恚 如 次 貪 嗔 業 道 為 性 此 即 意 業 又 
T85n2797_001:0740b18	說過是離間語。且依前釋。第三種數差別者。	說 過 是 離 間 語 且 依 前 釋 第 三 種 數 差 別 者 
T85n2797_001:0740b19	或有處說四種他勝處。謂後四種。如瑜伽論	或 有 處 說 四 種 他 勝 處 謂 後 四 種 如 瑜 伽 論 
T85n2797_001:0740b20	第四十說。或有處說六重。謂此前六。如優婆	第 四 十 說 或 有 處 說 六 重 謂 此 前 六 如 優 婆 
T85n2797_001:0740b21	塞戒經說。或有處說有八重。謂比丘四重及	塞 戒 經 說 或 有 處 說 有 八 重 謂 比 丘 四 重 及 
T85n2797_001:0740b22	此後四。如善戒經。或說十重。即如此經及本	此 後 四 如 善 戒 經 或 說 十 重 即 如 此 經 及 本 
T85n2797_001:0740b23	業瓔珞經說。又于填三藏云。波羅摩吉羅經。	業 瓔 珞 經 說 又 于 填 三 藏 云 波 羅 摩 吉 羅 經 
T85n2797_001:0740b24	此云極淨釘經說。十根本罪。同此經說。而未	此 云 極 淨 釘 經 說 十 根 本 罪 同 此 經 說 而 未 
T85n2797_001:0740b25	翻譯。問。何故如是經論不問。答。如來對機制	翻 譯 問 何 故 如 是 經 論 不 問 答 如 來 對 機 制 
T85n2797_001:0740b26	立學處說四六八十。不可會釋。又最後四犯	立 學 處 說 四 六 八 十 不 可 會 釋 又 最 後 四 犯 
T85n2797_001:0740b27	即成重。名他勝處。餘六不爾。於此亦有作而	即 成 重 名 他 勝 處 餘 六 不 爾 於 此 亦 有 作 而 
T85n2797_001:0740b28	不犯。如前持犯。已廣分別。沽酒說過。通犯不	不 犯 如 前 持 犯 已 廣 分 別 沽 酒 說 過 通 犯 不 
T85n2797_001:0740b29	犯。由此道理。前之六種。名隨順他勝。非根本	犯 由此道理 前 之 六 種 名 隨 順 他 勝 非 根 本 
T85n2797_001:0740c01	重。而說六重者。為化在家。新學菩薩。漸令遠	重 而 說 六 重 者 為 化 在 家 新學菩薩 漸 令 遠 
T85n2797_001:0740c02	離對二十四戒假立重名。又善戒經。若諸比丘	離 對 二 十 四 戒 假 立 重 名 又 善 戒 經 若 諸 比 丘 
T85n2797_001:0740c03	受具戒已受菩薩戒故。說八重。今此經中通	受 具 戒 已 受 菩 薩 戒 故 說 八 重 今 此 經 中 通 
T85n2797_001:0740c04	說根本隨順他勝處說十他勝法各據一義乎	說 根 本 隨 順 他 勝 處 說 十 他 勝 法 各 據 一 義 乎 
T85n2797_001:0740c05	不相違　第四廢立者。十不善業中。何故重	不 相 違 第 四 廢 立 者 十不善業 中 何 故 重 
T85n2797_001:0740c06	中不說雜穢語。答。過失輕故。問。若殺生者皆	中 不 說 雜 穢 語 答 過 失 輕 故 問 若 殺 生 者 皆 
T85n2797_001:0740c07	是他勝處說。他勝處亦殺生耶。答。應作四句。	是 他 勝 處 說 他 勝 處 亦 殺 生 耶 答 應 作 四 句 
T85n2797_001:0740c08	或有殺生而非他勝處。謂誤殺生。此唯方便。	或 有 殺 生 而 非 他 勝 處 謂 誤 殺 生 此 唯 方 便 
T85n2797_001:0740c09	非他勝處。及起慈心。而行殺生。如說國王殺	非 他 勝 處 及 起 慈 心 而 行 殺 生 如 說 國 王 殺 
T85n2797_001:0740c10	五百婆羅門而無殺罪。亦非他勝。或有他勝	五 百 婆 羅 門 而 無 殺 罪 亦 非 他 勝 或 有 他 勝 
T85n2797_001:0740c11	而非殺生。謂餘九重。第三句者謂不善心故	而 非 殺 生 謂 餘 九 重 第 三 句 者 謂 不 善 心 故 
T85n2797_001:0740c12	意殺生而不誤者。第四句除前相。如殺生對	意 殺 生 而 不 誤 者 第 四 句 除 前 相 如 殺 生 對 
T85n2797_001:0740c13	他勝處有其四句。乃至說過四句亦爾。問。為	他 勝 處 有 其 四 句 乃 至 說 過 四 句 亦 爾 問 為 
T85n2797_001:0740c14	利養自讚毀他皆是他勝處。設他勝處亦是為	利 養 自讚毀他 皆 是 他 勝 處 設 他 勝 處 亦 是 為 
T85n2797_001:0740c15	利養自讚毀他耶。答。應作順前句答。若為利	利 養 自讚毀他 耶 答 應 作 順 前 句 答 若 為 利 
T85n2797_001:0740c16	自讚毀他皆是他勝處。自有他勝處而非自讚	自讚毀他 皆 是 他 勝 處 自 有 他 勝 處 而 非 自 讚 
T85n2797_001:0740c17	毀他。謂餘他勝處。後之三戒應知亦爾。問。說	毀 他 謂 餘 他 勝 處 後 之 三 戒 應 知 亦 爾 問 說 
T85n2797_001:0740c18	過與謗僧有何差別。答。說過但說過而不謗	過 與 謗 僧 有何差別 答 說 過 但 說 過 而 不 謗 
T85n2797_001:0740c19	無。若謗僧寶撥彼功德而不說過。第五犯境	無 若 謗 僧 寶 撥 彼 功 德 而 不 說 過 第 五 犯 境 
T85n2797_001:0740c20	復有五種。一情非情境。二凡聖境。三漏無漏	復 有 五 種 一 情 非 情 境 二 凡 聖 境 三 漏 無 漏 
T85n2797_001:0740c21	境。四勝劣境。五因果境。第一情非情境者。此	境 四 勝 劣 境 五 因 果 境 第 一 情 非 情 境 者 此 
T85n2797_001:0740c22	十戒中。盜及誹謗通情非情。謗無因果通非	十 戒 中 盜 及 誹 謗 通 情 非 情 謗 無 因 果 通 非 
T85n2797_001:0740c23	情故。餘八有情境。又偷盜罪通情非情。餘九	情 故 餘 八 有 情 境 又 偷 盜 罪 通 情 非 情 餘 九 
T85n2797_001:0740c24	唯有情。又釋。慳貪嗔沽酒亦通二境。謂所對	唯 有 情 又 釋 慳 貪 嗔 沽 酒 亦 通 二 境 謂 所 對 
T85n2797_001:0740c25	是有情。所沽所慳是非情。故今依前釋。雖有	是 有 情 所 沽 所 慳 是 非 情 故 今 依 前 釋 雖 有 
T85n2797_001:0740c26	非情。嗔而非他勝。雖行婬死屍而不損他。非	非 情 嗔 而 非 他 勝 雖 行 婬 死 屍 而 不 損 他 非 
T85n2797_001:0740c27	他勝處。第二凡聖境者。此十種戒皆通凡聖。	他 勝 處 第 二 凡 聖 境 者 此 十 種 戒 皆 通 凡 聖 
T85n2797_001:0740c28	沽酒戒中通犯凡聖。未離欲聖者亦有飲故。	沽 酒 戒 中 通 犯 凡 聖 未離欲聖 者 亦 有 飲 故 
T85n2797_001:0740c29	言凡境者。唯於四趣除捺落迦。第十謗戒通	言 凡 境 者 唯 於 四 趣 除 捺 落 迦 第 十 謗 戒 通 
T85n2797_001:0741a01	三界天。餘九唯於欲界。第十通凡者。通謗凡	三 界 天 餘 九 唯 於 欲 界 第 十 通 凡 者 通 謗 凡 
T85n2797_001:0741a02	聖故。又唯聖非凡。第三漏無漏境者。說過毀	聖 故 又 唯 聖 非 凡 第 三 漏 無 漏 境 者 說 過 毀 
T85n2797_001:0741a03	他及誹謗戒通漏無漏境餘於有漏境雖有殺	他 及 誹 謗 戒 通 漏 無 漏 境 餘 於 有 漏 境 雖 有 殺 
T85n2797_001:0741a04	人者。而殺色身故。第四勝劣境者。九皆通二	人 者 而 殺 色 身 故 第 四 勝 劣 境 者 九 皆 通 二 
T85n2797_001:0741a05	境。第十於勝境。第五因果境者。佛地名果。餘	境 第 十 於 勝 境 第 五 因 果 境 者 佛 地 名 果 餘 
T85n2797_001:0741a06	即名因。前六種戒唯於因境。後之四種通於	即 名 因 前 六 種 戒 唯 於 因 境 後 之 四 種 通 於 
T85n2797_001:0741a07	因果。又釋。第十通於因果境。餘三因境。以彼	因 果 又 釋 第 十 通 於 因 果 境 餘 三 因 境 以 彼 
T85n2797_001:0741a08	不能惱世尊故。第六輕重者。若依業道判輕	不 能 惱 世 尊 故 第 六 輕 重 者 若 依 業 道 判 輕 
T85n2797_001:0741a09	重者。前四後三是最重。業道性故。說過自讚	重 者 前 四 後 三 是 最 重 業 道 性 故 說 過 自 讚 
T85n2797_001:0741a10	次重。是麁惡語。業道性故。沽酒最輕。非業道	次 重 是 麁 惡 語 業 道 性 故 沽 酒 最 輕 非 業 道 
T85n2797_001:0741a11	性故。問。前四後三。何者為重。答。第十最重。	性 故 問 前 四 後 三 何 者 為 重 答 第 十 最 重 
T85n2797_001:0741a12	又前四輕。亦許菩薩行前四故。後四最重。不	又 前 四 輕 亦 許 菩 薩 行 前 四 故 後 四 最 重 不 
T85n2797_001:0741a13	應行故。問。答爾何故先說殺戒。乃至第十謗	應 行 故 問 答 爾 何 故 先 說 殺 戒 乃 至 第 十 謗 
T85n2797_001:0741a14	戒。答。麁細次第說。相麁先說。相細後說。相	戒 答 麁 細 次 第 說 相 麁 先 說 相 細 後 說 相 
T85n2797_001:0741a15	非輕重次第。第七犯相者。謂非梵行說過。毀	非 輕 重 次 第 第 七 犯 相 者 謂 非 梵 行 說 過 毀 
T85n2797_001:0741a16	他誹謗始行即犯殺生必持。彼命終已方成	他 誹 謗 始 行 即 犯 殺 生 必 持 彼 命 終 已 方 成 
T85n2797_001:0741a17	他勝。非動加行即成業道。盜妄語亦爾。所餘	他 勝 非 動 加 行 即 成 業 道 盜 妄 語 亦 爾 所 餘 
T85n2797_001:0741a18	三種。非初非後。在中成犯。又釋婬說過。毀謗	三 種 非 初 非 後 在 中 成 犯 又 釋 婬 說 過 毀 謗 
T85n2797_001:0741a19	沽酒初行即犯。餘如前說。有言。婬始成犯。	沽 酒 初 行 即 犯 餘 如 前 說 有 言 婬 始 成 犯 
T85n2797_001:0741a20	殺終成犯。餘於中犯。此不應理。說過等四行	殺 終 成 犯 餘 於 中 犯 此 不 應 理 說 過 等 四 行 
T85n2797_001:0741a21	即有犯。如何待終。是故前說於理為善。第八	即 有 犯 如 何 待 終 是 故 前 說 於 理 為 善 第 八 
T85n2797_001:0741a22	自他犯者。慳貪瞋慧非梵行。二種唯自非他。	自 他 犯 者 慳 貪 瞋 慧 非 梵 行 二 種 唯 自 非 他 
T85n2797_001:0741a23	所以者何。慳貪業道必無使他而行犯故。使	所以者何 慳 貪 業 道 必 無 使 他 而 行 犯 故 使 
T85n2797_001:0741a24	他行時非自貪故。如貪嗔亦爾。所餘七種皆	他 行 時 非 自 貪 故 如 貪 嗔 亦 爾 所 餘 七 種 皆 
T85n2797_001:0741a25	通自他。問。若自行殺亦教他殺。設教他殺亦	通 自 他 問 若 自 行 殺 亦 教 他 殺 設 教 他 殺 亦 
T85n2797_001:0741a26	自行殺耶。答。應作四句。或自行殺而非教他	自 行 殺 耶 答 應 作 四 句 或 自 行 殺 而 非 教 他 
T85n2797_001:0741a27	殺。謂有自殺而非使他故。或有教他殺而非	殺 謂 有 自 殺 而 非 使 他 故 或 有 教 他 殺 而 非 
T85n2797_001:0741a28	自殺。如遣使殺。而自行餘業。第三句者。謂自	自 殺 如 遣 使 殺 而 自 行 餘 業 第 三 句 者 謂 自 
T85n2797_001:0741a29	行殺。亦使人殺。俱非者。謂除前相。如殺生有	行 殺 亦 使 人 殺 俱 非 者 謂 除 前 相 如 殺 生 有 
T85n2797_001:0741b01	四。偷盜欲行沽酒亦爾。皆應作四句。問。若自	四 偷 盜 欲 行 沽 酒 亦 爾 皆 應 作 四 句 問 若 自 
T85n2797_001:0741b02	妄語亦教他耶。設教他妄語亦自妄語耶。答。	妄 語 亦 教 他 耶 設 教 他 妄 語 亦 自 妄 語 耶 答 
T85n2797_001:0741b03	應作順後句答。若教他妄語必自妄語。教他	應 作 順 後 句 答 若 教 他 妄 語 必 自 妄 語 教 他 
T85n2797_001:0741b04	之時必誑語故。有自妄語而非教他。如妄語	之 時 必 誑 語 故 有 自 妄 語 而 非 教 他 如 妄 語 
T85n2797_001:0741b05	戒說過自讚誹謗亦爾。皆作順後句。此依對	戒 說 過 自 讚 誹 謗 亦 爾 皆 作 順 後 句 此 依 對 
T85n2797_001:0741b06	一境說有對別境四句。問。頗有一時觸殺盜	一 境 說 有 對 別 境 四 句 問 頗 有 一 時 觸 殺 盜 
T85n2797_001:0741b07	二罪耶。答。有謂使他盜自行殺等。問。頗有一	二 罪 耶 答 有 謂 使 他 盜 自 行 殺 等 問 頗 有 一 
T85n2797_001:0741b08	時結殺盜婬三罪耶。答。有謂。遣使殺盜自行	時 結 殺 盜 婬 三 罪 耶 答 有 謂 遣 使 殺 盜 自 行 
T85n2797_001:0741b09	欲行。或自行殺盜遣使欲行。問。頗有一人一	欲 行 或 自 行 殺 盜 遣 使 欲 行 問 頗 有 一 人 一 
T85n2797_001:0741b10	時觸四罪耶。答。有謂。遣使行殺盜婬行目虛	時 觸 四 罪 耶 答 有 謂 遣 使 行 殺 盜 婬 行 目 虛 
T85n2797_001:0741b11	誑語等。問。頗有一時觸五罪耶。答。有謂。遣	誑 語 等 問 頗 有 一 時 觸 五 罪 耶 答 有 謂 遣 
T85n2797_001:0741b12	使殺盜婬沽酒自行妄語。乃至有一時觸九	使 殺 盜 婬 沽 酒 自 行 妄 語 乃 至 有 一 時 觸 九 
T85n2797_001:0741b13	罪。謂。自行慳貪遣使行殺等八。必無一時觸	罪 謂 自 行 慳 貪 遣 使 行 殺 等 八 必 無 一 時 觸 
T85n2797_001:0741b14	十罪者。謂以貪嗔二唯自犯故自行貪行遣	十 罪 者 謂 以 貪 嗔 二 唯 自 犯 故 自 行 貪 行 遣 
T85n2797_001:0741b15	使行餘八除嗔自行嗔時遣使行餘除貪如是	使 行 餘 八 除 嗔 自 行 嗔 時 遣 使 行 餘 除 貪 如 是 
T85n2797_001:0741b16	等隨應當知。第九犯因者。謂十他勝處由三	等 隨 應 當 知 第 九 犯 因 者 謂 十 他 勝 處 由 三 
T85n2797_001:0741b17	因犯。所謂貪嗔癡。此中沽酒貪為方便。由	因 犯 所 謂 貪 嗔 癡 此 中 沽 酒 貪 為 方 便 由 
T85n2797_001:0741b18	貪究竟殺生三為方便。由嗔究竟如殺生瞋	貪 究 竟 殺 生 三 為 方 便 由 嗔 究 竟 如 殺 生 瞋 
T85n2797_001:0741b19	恚亦爾。偷盜之為方便由貪究竟如盜欲行	恚 亦 爾 偷 盜 之 為 方 便 由 貪 究 竟 如 盜 欲 行 
