T85n2797_001:0727a25	梵網經述記卷第一	梵 網 經 述 記 卷 第 一 
T85n2797_001:0727a27	發菩提願未。答言已發若依此經。和上問七	發 菩 提 願 未 答 言 已 發 若 依 此 經 和 上 問 七 
T85n2797_001:0727a28	遮故。下經言。若欲受戒時。法師問言。現身不	遮 故 下 經 言 若 欲 受 戒 時 法 師 問 言 現 身 不 
T85n2797_001:0727a29	作七逆罪邪。菩薩法師不得與七逆人現身	作 七 逆 罪 邪 菩 薩 法 師 不 得 與 七 逆 人 現 身 
T85n2797_001:0727b01	受戒。七逆者。出佛身血。殺父母殺和上。殺	受 戒 七 逆 者 出佛身血 殺 父 母 殺 和 上 殺 
T85n2797_001:0727b02	阿闍梨。破羯磨轉法輪僧。殺聖人。若具七遮。	阿 闍 梨 破 羯 磨 轉 法 輪 僧 殺 聖 人 若 具 七 遮 
T85n2797_001:0727b03	即身不得戒。餘一切得受戒。而瑜伽說。不說	即 身 不 得 戒 餘 一 切 得 受 戒 而 瑜 伽 說 不 說 
T85n2797_001:0727b04	七遮者。作懺悔亦得戒故。非如聲聞犯邊罪	七 遮 者 作 懺 悔 亦 得 戒 故 非 如 聲 聞 犯 邊 罪 
T85n2797_001:0727b05	已。更不得受。各據義故不相違。謂。此經中據	已 更 不 得 受 各 據 義 故 不 相 違 謂 此 經 中 據 
T85n2797_001:0727b06	不懺悔者說作七逆現身不得戒。論中據懺	不 懺 悔 者 說 作 七 逆 現 身 不 得 戒 論 中 據 懺 
T85n2797_001:0727b07	悔亦有受戒義故略不說。第四正作羯磨者。	悔 亦 有 受 戒 義 故 略 不 說 第 四 正 作 羯 磨 者 
T85n2797_001:0727b08	如瑜伽說。自此已後應作如是言。汝如是名	如 瑜 伽 說 自 此 已 後 應 作如是言 汝 如 是 名 
T85n2797_001:0727b09	善男子。或次第欲於我所受諸菩薩一切學	善 男 子 或 次 第 欲 於 我 所 受 諸 菩 薩 一 切 學 
T85n2797_001:0727b10	處。受諸菩薩一切淨戒。所謂律儀戒。攝善	處 受 諸 菩 薩 一 切 淨 戒 所 謂 律 儀 戒 攝 善 
T85n2797_001:0727b11	法戒。饒益有情戒。如是學處。如是淨戒。過	法 戒 饒益有情戒 如 是 學 處 如 是 淨 戒 過 
T85n2797_001:0727b12	去一切菩薩已具。未來一切菩薩當具。普於	去 一切菩薩 已 具 未 來 一切菩薩 當 具 普 於 
T85n2797_001:0727b13	十方現在一切菩薩今具。於是學處。於是淨	十 方 現 在 一切菩薩 今 具 於 是 學 處 於 是 淨 
T85n2797_001:0727b14	戒。過去一切菩薩已學。未來一切菩薩當學。	戒 過 去 一切菩薩 已 學 未 來 一切菩薩 當 學 
T85n2797_001:0727b15	現在一切菩薩今學。汝能受不。若能受。能	現 在 一切菩薩 今 學 汝 能 受 不 若 能 受 能 
T85n2797_001:0727b16	授菩薩第二第三亦如是說。能受菩薩第二	授 菩 薩 第二第三 亦 如 是 說 能 受 菩 薩 第 二 
T85n2797_001:0727b17	第三亦如是答。能授菩薩作如是問。乃至第	第 三 亦 如 是 答 能 授 菩 薩 作 如 是 問 乃 至 第 
T85n2797_001:0727b18	三授淨戒已。能受菩薩作如是答。乃至第三	三 授 淨 戒 已 能 受 菩 薩 作 如 是 答 乃 至 第 三 
T85n2797_001:0727b19	請證。如瑜伽云。受淨戒已。能受菩薩不起于	請 證 如 瑜 伽 云 受 淨 戒 已 能 受 菩 薩 不 起 于 
T85n2797_001:0727b20	坐。能授菩薩對佛像前。普於十方現住諸佛	坐 能 授 菩 薩 對 佛 像 前 普 於 十 方 現 住 諸 佛 
T85n2797_001:0727b21	及諸菩薩。恭敬供養頂禮雙足。作如是白。	及 諸 菩 薩 恭敬供養 頂 禮 雙 足 作 如 是 白 
T85n2797_001:0727b22	某名菩薩。今已於我某菩薩所。乃至三說受	某 名 菩 薩 今 已 於 我 某 菩 薩 所 乃 至 三 說 受 
T85n2797_001:0727b23	菩薩戒。我某菩薩已某作證。唯願十方無邊	菩 薩 戒 我 某 菩 薩 已 某 作 證 唯 願 十 方 無 邊 
T85n2797_001:0727b24	無際諸世界中諸佛菩薩第一真聖。於現不	無 際 諸 世 界 中 諸佛菩薩 第 一 真 聖 於 現 不 
T85n2797_001:0727b25	現一切時處。一切有情皆現學者。於此某名	現 一 切 時 處 一切有情 皆 現 學 者 於 此 某 名 
T85n2797_001:0727b26	受菩薩戒亦為作證。第二第三亦如是。受戒	受 菩 薩 戒 亦 為 作 證 第二第三 亦 如 是 受 戒 
T85n2797_001:0727b27	羯磨畢竟。從此無間。普於十方無邊無際諸	羯 磨 畢 竟 從此無間 普 於 十 方 無邊無際 諸 
T85n2797_001:0727b28	世界中現住諸佛已入大地諸菩薩前。法爾	世 界 中 現 住 諸 佛 已 入 大 地 諸 菩 薩 前 法 爾 
T85n2797_001:0727b29	相現。由此表示。如是菩薩已受菩薩所受淨	相 現 由 此 表 示 如 是 菩 薩 已 受 菩 薩 所 受 淨 
T85n2797_001:0727c01	戒。爾時十方諸佛菩薩。於是法爾之相生起	戒 爾 時 十方諸佛 菩 薩 於 是 法 爾 之 相 生 起 
T85n2797_001:0727c02	憶念。由憶念故。正智見轉。由正智見。如實	憶 念 由 憶 念 故 正 智 見 轉 由 正 智 見 如 實 
T85n2797_001:0727c03	覺知。某世界中某名菩薩。某菩薩所。正受菩	覺 知 某 世 界 中 某 名 菩 薩 某 菩 薩 所 正 受 菩 
T85n2797_001:0727c04	薩所受淨戒。一切於此受戒菩薩如子如弟。	薩 所受淨戒 一 切 於 此 受 戒 菩 薩 如 子 如 弟 
T85n2797_001:0727c05	生親善意。眷念憐愍。由佛菩薩眷念憐愍。令	生 親 善 意 眷 念 憐 愍 由 佛 菩 薩 眷 念 憐 愍 令 
T85n2797_001:0727c06	是菩薩希求善法倍復增長。無有退減。當知	是 菩 薩 希 求 善 法 倍 復 增 長 無 有 退 減 當 知 
T85n2797_001:0727c07	是名菩薩戒。啟白請證如是。已作受菩薩戒	是 名 菩 薩 戒 啟 白 請 證 如 是 已 作 受 菩 薩 戒 
T85n2797_001:0727c08	羯磨等事。授受菩薩俱起供養。普於十方無	羯 磨 等 事 授 受 菩 薩 俱 起 供 養 普 於 十 方 無 
T85n2797_001:0727c09	邊無際諸世界中諸佛菩薩頂禮雙足。恭敬	邊 無 際 諸 世 界 中 諸佛菩薩 頂 禮 雙 足 恭 敬 
T85n2797_001:0727c10	而退。如是菩薩所受律儀戒。於餘一切所受	而 退 如 是 菩 薩 所 受 律 儀 戒 於 餘 一 切 所 受 
T85n2797_001:0727c11	律儀戒。最勝無上無量無邊大功德藏之所	律 儀 戒 最 勝 無 上 無量無邊 大 功 德 藏 之 所 
T85n2797_001:0727c12	隨逐。第一最上。廣說乃至。一切別解脫律	隨 逐 第 一 最 上 廣說乃至 一 切 別 解 脫 律 
T85n2797_001:0727c13	儀。於此菩薩律儀戒。百分不及一。千分不及	儀 於 此 菩 薩 律 儀 戒 百 分 不 及 一 千 分 不 及 
T85n2797_001:0727c14	一。數分不及一。計分不及一。算分不及一。喻	一 數 分 不 及 一 計 分 不 及 一 算 分 不 及 一 喻 
T85n2797_001:0727c15	分不及一。鄔波尼殺曇分亦不及一。攝受一	分 不 及 一 鄔 波 尼 殺 曇 分 亦 不 及 一 攝 受 一 
T85n2797_001:0727c16	切大功德故。	切 大 功 德 故 
T85n2797_001:0727c17	第二明自誓受戒者。如瑜伽說第四十云。又	第 二 明 自 誓 受 戒 者 如 瑜 伽 說 第 四 十 云 又 
T85n2797_001:0727c18	諸菩薩。欲受菩薩淨戒律儀。若不會遇具足	諸 菩 薩 欲 受 菩薩淨戒 律 儀 若 不 會 遇 具 足 
T85n2797_001:0727c19	功德補特伽羅。爾時應對如來像前。自受菩	功 德 補 特 伽 羅 爾 時 應 對 如 來 像 前 自 受 菩 
T85n2797_001:0727c20	薩淨戒律儀。應如是受。偏袒右肩。右膝著	薩 淨 戒 律 儀 應 如 是 受 偏袒右肩 右 膝 著 
T85n2797_001:0727c21	地。或蹲跪坐。作如是言。我如是名。仰啟十	地 或 蹲 跪 坐 作如是言 我 如 是 名 仰 啟 十 
T85n2797_001:0727c22	方一切如來已入大地諸菩薩眾。我今欲於	方 一 切 如 來 已 入 大 地 諸 菩 薩 眾 我 今 欲 於 
T85n2797_001:0727c23	十方世界佛菩薩所。誓受一切菩薩學處。誓	十方世界 佛 菩 薩 所 誓 受 一切菩薩 學 處 誓 
T85n2797_001:0727c24	受一切菩薩淨戒。謂律儀戒。攝善法戒。饒益	受 一切菩薩 淨 戒 謂 律 儀 戒 攝善法戒 饒 益 
T85n2797_001:0727c25	有情戒。如是學處。如是淨戒。過去一切菩	有 情 戒 如 是 學 處 如 是 淨 戒 過 去 一 切 菩 
T85n2797_001:0727c26	薩已具。未來一切菩薩當具。普於十方現在	薩 已 具 未 來 一切菩薩 當 具 普 於 十 方 現 在 
T85n2797_001:0727c27	一切菩薩今具。如是學處。如是淨戒。過去一	一切菩薩 今 具 如 是 學 處 如 是 淨 戒 過 去 一 
T85n2797_001:0727c28	切菩薩已學。未來一切菩薩當學。普於十方	切 菩 薩 已 學 未 來 一切菩薩 當 學 普 於 十 方 
T85n2797_001:0727c29	現在一切菩薩今學。第二第三亦如是說。說	現 在 一切菩薩 今 學 第二第三 亦 如 是 說 說 
T85n2797_001:0728a01	已應起。所餘一切。如前應知。然自受者。必	已 應 起 所 餘 一 切 如 前 應 知 然 自 受 者 必 
T85n2797_001:0728a02	先懺悔。要須得見好相。以此為限。若不得好	先 懺 悔 要 須 得 見 好 相 以 此 為 限 若 不 得 好 
T85n2797_001:0728a03	相。不得戒故。此經下云佛滅度後。欲以好心	相 不 得 戒 故 此 經 下 云 佛 滅 度 後 欲 以 好 心 
T85n2797_001:0728a04	受菩薩戒時。於佛形像前。自誓受戒。當七	受 菩 薩 戒 時 於 佛 形 像 前 自 誓 受 戒 當 七 
T85n2797_001:0728a05	日佛前懺悔得見好相。便得戒。若不得好相	日 佛 前 懺 悔 得 見 好 相 便 得 戒 若 不 得 好 相 
T85n2797_001:0728a06	時。應一以二七三七乃至一年。要得好相。得	時 應 一 以 二 七 三 七 乃 至 一 年 要 得 好 相 得 
T85n2797_001:0728a07	好相已。便得佛菩薩形像前受戒。若不得好	好 相 已 便 得 佛 菩 薩 形 像 前 受 戒 若 不 得 好 
T85n2797_001:0728a08	相。雖佛菩薩形像前受戒不得戒。若現先受	相 雖 佛 菩 薩 形 像 前 受 戒 不 得 戒 若 現 先 受 
T85n2797_001:0728a09	菩薩戒法師前受戒時。不須見好相。是法師	菩 薩 戒 法 師 前 受 戒 時 不 須 見 好 相 是 法 師 
T85n2797_001:0728a10	師相授故。不須好相。若千里內無能受戒師。	師 相 授 故 不 須 好 相 若 千 里 內 無 能 受 戒 師 
T85n2797_001:0728a11	得佛菩薩形像前受得戒而要見好相。	得 佛 菩 薩 形 像 前 受 得 戒 而 要 見 好 相 
T85n2797_001:0728a12	第六得捨戒緣。此復有二。一者得戒緣。二	第 六 得 捨 戒 緣 此 復 有 二 一 者 得 戒 緣 二 
T85n2797_001:0728a13	者捨戒緣。得戒緣者復有二種。一七眾得戒	者 捨 戒 緣 得 戒 緣 者 復 有 二 種 一 七 眾 得 戒 
T85n2797_001:0728a14	緣。二菩薩得戒緣。七眾得戒有二。一得戒	緣 二 菩 薩 得 戒 緣 七 眾 得 戒 有 二 一 得 戒 
T85n2797_001:0728a15	差別。二具戒緣。得戒有二。一具戒。二餘六	差 別 二 具 戒 緣 得 戒 有 二 一 具 戒 二 餘 六 
T85n2797_001:0728a16	眾。得具戒者。諸宗不同。餘六眾。依一切有	眾 得 具 戒 者 諸 宗 不 同 餘 六 眾 依 一 切 有 
T85n2797_001:0728a17	部。顯十種不戒故。十誦律云。佛告諸比丘。十	部 顯 十 種 不 戒 故 十 誦 律 云 佛 告 諸 比 丘 十 
T85n2797_001:0728a18	種受具足。一自然。二見諦。三善來。四自誓。	種 受 具 足 一 自 然 二 見 諦 三 善 來 四 自 誓 
T85n2797_001:0728a19	五論議。六受重法。七遣信。八乞五德。九乞羯	五 論 議 六 受 重 法 七 遣 信 八 乞 五 德 九 乞 羯 
T85n2797_001:0728a20	磨得。十三歸。自然得者謂。佛獨覺。正理論	磨 得 十 三 歸 自 然 得 者 謂 佛 獨 覺 正 理 論 
T85n2797_001:0728a21	云。自然謂智以不從師。證此智時。得具足	云 自 然 謂 智 以 不 從 師 證 此 智 時 得 具 足 
T85n2797_001:0728a22	戒。問。何故不說阿羅漢自然得戒。唯說獨覺	戒 問 何 故 不 說 阿 羅 漢 自 然 得 戒 唯 說 獨 覺 
T85n2797_001:0728a23	得耶。答。獨覺利根自然得戒。阿羅漢鈍根故	得 耶 答 獨 覺 利 根 自 然 得 戒 阿 羅 漢 鈍 根 故 
T85n2797_001:0728a24	不說文。此中唯說大獨覺非部行也。問。此自	不 說 文 此 中 唯 說 大 獨 覺 非 部 行 也 問 此 自 
T85n2797_001:0728a25	然得戒有表業不。若無表業。云何言無表離	然 得 戒 有 表 業 不 若 無 表 業 云 何 言 無 表 離 
T85n2797_001:0728a26	表而生。答。有表者是何時表。入觀智時無身	表 而 生 答 有 表 者 是 何 時 表 入 觀 智 時 無 身 
T85n2797_001:0728a27	語表故。答。入觀前表得此智時。轉成根本能	語 表 故 答 入 觀 前 表 得 此 智 時 轉 成 根 本 能 
T85n2797_001:0728a28	發無表。是故無表亦依表生。問。如何得知。得	發 無 表 是 故 無 表 亦 依 表 生 問 如 何 得 知 得 
T85n2797_001:0728a29	阿羅漢時。無自然得戒。答。有阿羅漢沙彌等	阿 羅 漢 時 無 自 然 得 戒 答 有 阿 羅 漢 沙 彌 等 
T85n2797_001:0728b01	故。如大莊嚴說云。曾昔時寺中有諸羅漢沙	故 如 大 莊 嚴 說 云 曾 昔 時 寺 中 有 諸 羅 漢 沙 
T85n2797_001:0728b02	彌。乃至廣說。又雜阿含經二十三云。此二	彌 乃至廣說 又 雜 阿 含 經 二 十 三 云 此 二 
T85n2797_001:0728b03	沙彌是俱解脫阿羅漢。故知不得。問。自然得	沙 彌 是 俱 解 脫 阿 羅 漢 故 知 不 得 問 自 然 得 
T85n2797_001:0728b04	戒者先得五戒十戒以不。答。得盡智時一時	戒 者 先 得 五 戒 十 戒 以 不 答 得 盡 智 時 一 時 
T85n2797_001:0728b05	頓得五戒及具。以利根故。有說。先得五戒後	頓 得 五 戒 及 具 以 利 根 故 有 說 先 得 五 戒 後 
T85n2797_001:0728b06	得具戒。如梯橙故。問。何故比丘尼無自然得。	得 具 戒 如 梯 橙 故 問 何 故 比 丘 尼 無 自 然 得 
T85n2797_001:0728b07	答。性行劣故。必無女身成大覺獨覺故。見	答 性 行 劣 故 必 無 女 身 成 大 覺 獨 覺 故 見 
T85n2797_001:0728b08	諦得者。如正理說三十七云。由得入正性離	諦 得 者 如 正 理 說 三 十 七 云 由 得 入 正 性 離 
T85n2797_001:0728b09	生。謂。五苾芻由證見道得具足戒。問。何故比	生 謂 五 苾 芻 由 證 見 道 得 具 足 戒 問 何 故 比 
T85n2797_001:0728b10	丘尼無見道得戒。答。此諸女人多過失故。多	丘 尼 無 見 道 得 戒 答 此 諸 女 人 多 過 失 故 多 
T85n2797_001:0728b11	煩惱故。是故無有見道得戒。問。何故五人見	煩 惱 故 是 故 無 有 見 道 得 戒 問 何 故 五 人 見 
T85n2797_001:0728b12	諦得戒。餘苾芻不爾耶。答。此五苾芻。佛初	諦 得 戒 餘 苾 芻 不 爾 耶 答 此 五 苾 芻 佛 初 
T85n2797_001:0728b13	轉法輪。最初得見道。法住增故。問。何故五人	轉 法 輪 最 初 得 見 道 法 住 增 故 問 何 故 五 人 
T85n2797_001:0728b14	最初得道。答。由本願故。如世尊說。我於過去	最 初 得 道 答 由 本 願 故 如 世 尊 說 我 於 過 去 
T85n2797_001:0728b15	世中作國王。以身血氣施羅剎。即發願言。我	世 中 作 國 王 以 身 血 氣 施 羅 剎 即 發 願 言 我 
T85n2797_001:0728b16	當作佛時。先度五人。五羅剎者。今五苾芻	當 作 佛 時 先 度 五 人 五 羅 剎 者 今 五 苾 芻 
T85n2797_001:0728b17	是也。又菩薩過去作大魚身五人先見。乃至	是 也 又 菩 薩 過 去 作 大 魚 身 五 人 先 見 乃 至 
T85n2797_001:0728b18	廣說。善來得戒。如正理云。由佛命善來苾	廣 說 善 來 得 戒 如 正 理 云 由 佛 命 善 來 苾 
T85n2797_001:0728b19	芻。謂邪舍等由本願力佛威加故。薩婆多毘	芻 謂 邪 舍 等 由 本 願 力 佛 威 加 故 薩 婆 多 毘 
T85n2797_001:0728b20	婆沙二論云。三迦葉門徒一千人。舍利目連	婆 沙 二 論 云 三 迦 葉 門 徒 一 千 人 舍 利 目 連 
T85n2797_001:0728b21	門徒二百五十人。皆善來得戒。自誓得戒	門 徒 二百五十 人 皆 善 來 得 戒 自 誓 得 戒 
T85n2797_001:0728b22	者。如正理說云。由信受佛為大師。謂。大迦葉	者 如 正 理 說 云 由 信 受 佛 為 大 師 謂 大 迦 葉 
T85n2797_001:0728b23	問。何故餘人無自誓受得耶。答。信解薄故。論	問 何 故 餘 人 無 自 誓 受 得 耶 答 信 解 薄 故 論 
T85n2797_001:0728b24	議得者。正理論云。善巧酬答所問。謂蘇陀夷。	議 得 者 正 理 論 云 善 巧 酬 答 所 問 謂 蘇 陀 夷 
T85n2797_001:0728b25	此復云何。彼年八歲。來至佛所。佛問彼言。	此 復 云 何 彼 年 八 歲 來 至 佛 所 佛 問 彼 言 
T85n2797_001:0728b26	汝家何在。彼即答言。三界無家。佛知利根。	汝 家 何 在 彼 即 答 言 三 界 無 家 佛 知 利 根 
T85n2797_001:0728b27	雖年未滿。令僧為授。非答問時。便得具戒。	雖 年 未 滿 令 僧 為 授 非 答 問 時 便 得 具 戒 
T85n2797_001:0728b28	受重法者。正理說云。由敬受八尊重法。謂。大	受 重 法 者 正 理 說 云 由 敬 受 八尊重法 謂 大 
T85n2797_001:0728b29	生主為最初也。問。彼大生主。從於誰邊受重	生 主 為 最 初 也 問 彼 大 生 主 從 於 誰 邊 受 重 
T85n2797_001:0728c01	法。答。本是佛說。阿難為大生主說。彼大生	法 答 本 是 佛 說 阿 難 為 大 生 主 說 彼 大 生 
T85n2797_001:0728c02	主論阿難邊受八尊重。如中阿含經二十八	主 論 阿 難 邊 受 八 尊 重 如 中 阿 含 經 二 十 八 
T85n2797_001:0728c03	說。阿難白佛言。世尊。女人可得第四沙門果	說 阿 難 白 佛 言 世 尊 女 人 可 得 第 四沙門果 
T85n2797_001:0728c04	耶。因此故。女人得於此正法律中至捨家學	耶 因 此 故 女 人 得 於 此 正 法 律 中 至 捨 家 學 
T85n2797_001:0728c05	道耶。世尊告曰。止止阿難。莫作是念。若使女	道 耶 世 尊 告 曰 止 止 阿 難 莫 作 是 念 若 使 女 
T85n2797_001:0728c06	人得於此法中捨家者。令此梵行不得久住。	人 得 於 此 法 中 捨 家 者 令 此 梵 行 不 得 久 住 
T85n2797_001:0728c07	阿難。猶如人家多女少男者。此家為得轉興	阿 難 猶 如 人 家 多 女 少 男 者 此 家 為 得 轉 興 
T85n2797_001:0728c08	盛耶不也。世尊。如是。阿難。若使女人於此法	盛 耶 不 也 世 尊 如 是 阿 難 若 使 女 人 於 此 法 
T85n2797_001:0728c09	中捨家學道者。令此梵行不得久住。阿難。猶	中 捨 家 學 道 者 令 此 梵 行 不 得 久 住 阿 難 猶 
T85n2797_001:0728c10	如稻田及麥田中。有穢草生者。必壞彼田。如	如 稻 田 及 麥 田 中 有 穢 草 生 者 必 壞 彼 田 如 
T85n2797_001:0728c11	是女人捨家學道。令此梵行不得久住。阿難	是 女 人 捨 家 學 道 令 此 梵 行 不 得 久 住 阿 難 
T85n2797_001:0728c12	白佛言。世尊。瞿曇彌大愛道。為世尊所饒	白 佛 言 世 尊 瞿 曇 彌 大 愛 道 為 世 尊 所 饒 
T85n2797_001:0728c13	益。所以者何。世尊。母亡之後。瞿曇彌大愛	益 所以者何 世 尊 母 亡 之 後 瞿 曇 彌 大 愛 
T85n2797_001:0728c14	道掬養。世尊廣說。乃至。佛告阿難。我今為女	道 掬 養 世 尊 廣 說 乃 至 佛 告 阿 難 我 今 為 女 
T85n2797_001:0728c15	說八尊師法。謂。女人不當犯女人奉持盡形	說 八 尊 師 法 謂 女 人 不 當 犯 女 人 奉 持 盡 形 
T85n2797_001:0728c16	壽邪。云何為八尊師法。阿難。比丘尼當從比	壽 邪 云 何 為 八 尊 師 法 阿 難 比 丘 尼 當 從 比 
T85n2797_001:0728c17	丘受具足。我為女人施設第一尊師法。阿難。	丘 受 具 足 我 為 女 人 施 設 第 一 尊 師 法 阿 難 
T85n2797_001:0728c18	比丘應半月。半月從比丘乞受教誡。此為	比 丘 應 半 月 半 月 從 比 丘 乞 受 教 誡 此 為 
T85n2797_001:0728c19	第二若止住處。設無比丘者。不得受夏坐。此	第 二 若 止 住 處 設 無 比 丘 者 不 得 受 夏 坐 此 
T85n2797_001:0728c20	為第三比丘尼受夏坐訖。於兩部眾中當三	為 第 三 比 丘 尼 受 夏 坐 訖 於 兩 部 眾 中 當 三 
T85n2797_001:0728c21	事求見聞疑。此為第四。若比丘不聽聞者。比	事 求 見 聞 疑 此 為 第 四 若 比 丘 不 聽 聞 者 比 
T85n2797_001:0728c22	丘尼則不得聞經律阿毘曇。若聽聞者即得	丘 尼 則 不 得 聞 經 律 阿 毘 曇 若 聽 聞 者 即 得 
T85n2797_001:0728c23	聞。此為第五。阿難。比丘尼不得說比丘所	聞 此 為 第 五 阿 難 比 丘 尼 不 得 說 比 丘 所 
T85n2797_001:0728c24	犯。比丘得說比丘尼所犯。此為第六。阿難。	犯 比 丘 得 說 比 丘 尼 所 犯 此 為 第 六 阿 難 
T85n2797_001:0728c25	比丘尼若犯僧伽婆尸沙。當於兩部眾中十	比 丘 尼 若 犯 僧伽婆尸沙 當 於 兩 部 眾 中 十 
T85n2797_001:0728c26	五日行不慢。此為第七。阿難。比丘尼受具	五 日 行 不 慢 此 為 第 七 阿 難 比 丘 尼 受 具 
T85n2797_001:0728c27	足。雖至百歲故當向始受具足。比丘總下意	足 雖 至 百 歲 故 當 向 始 受 具 足 比 丘 總 下 意 
T85n2797_001:0728c28	禮拜恭敬承事。此為第八尊師法。爾時阿難。	禮 拜 恭 敬 承 事 此 為 第 八 尊 師 法 爾 時 阿 難 
T85n2797_001:0728c29	為彼大愛道。說八尊師法時。大愛道受八尊	為 彼 大 愛 道 說 八 尊 師 法 時 大 愛 道 受 八 尊 
T85n2797_001:0729a01	師法而得出家。佛告阿難。若女人不得於此	師 法 而 得 出 家 佛 告 阿 難 若 女 人 不 得 於 此 
T85n2797_001:0729a02	正法律出家學道。正法當住一千年。今失五	正 法 律 出家學道 正 法 當 住 一 千 年 今 失 五 
T85n2797_001:0729a03	百歲。餘有五百歲。毘尼母論二亦同此經。此	百 歲 餘 有 五 百 歲 毘 尼 母 論 二 亦 同 此 經 此 
T85n2797_001:0729a04	中意說。受八法時得具足戒。如十誦云。優波	中 意 說 受 八 法 時 得 具 足 戒 如 十 誦 云 優 波 
T85n2797_001:0729a05	離問波闍。受八重法。即是出家。成比丘尼。	離 問 波 闍 受 八 重 法 即 是 出 家 成 比 丘 尼 
T85n2797_001:0729a06	餘尼云。問佛言。應現前作白四羯磨。問。若爾	餘 尼 云 問 佛 言 應 現 前 作 白四羯磨 問 若 爾 
T85n2797_001:0729a07	于時尼眾既未滿足。餘者云何得戒。答。如薩	于 時 尼 眾 既 未 滿 足 餘 者 云 何 得 戒 答 如 薩 
T85n2797_001:0729a08	婆多論云。十四年前八數度女。十四年後羯	婆 多 論 云 十 四 年 前 八 數 度 女 十 四 年 後 羯 
T85n2797_001:0729a09	磨度之。又彼二云。成道八年後有白四羯磨。	磨 度 之 又 彼 二 云 成 道 八 年 後 有 白四羯磨 
T85n2797_001:0729a10	又五分云。五百比丘尼亦數法得。又毘尼母	又 五 分 云 五 百 比 丘 尼 亦 數 法 得 又 毘 尼 母 
T85n2797_001:0729a11	云。師法受具。中除憍曇彌五百諸女人。餘一	云 師 法 受 具 中 除 憍 曇 彌 五 百 諸 女 人 餘 一 
T85n2797_001:0729a12	切不得師法受具遣信者。正理論云。由遣使。	切 不 得 師 法 受 具 遣 信 者 正 理 論 云 由 遣 使 
T85n2797_001:0729a13	謂法授尼。五分云。婬女半迦尸。欲往蘭若住	謂 法 授 尼 五 分 云 婬 女 半 迦 尸 欲 往 蘭 若 住 
T85n2797_001:0729a14	處受具戒。賊眾道路同取彼女。女聞此事時	處 受 具 戒 賊 眾 道 路 同 取 彼 女 女 聞 此 事 時 
T85n2797_001:0729a15	不敢去。佛聽遙為受具先尼眾中作本法竟。	不 敢 去 佛 聽 遙 為 受 具 先 尼 眾 中 作 本 法 竟 
T85n2797_001:0729a16	置受戒人於一處所將十尼眾往蘭若處。禮	置 受 戒 人 於 一 處 所 將 十 尼 眾 往 蘭 若 處 禮 
T85n2797_001:0729a17	僧眾足。尼羯磨師。為從僧乞僧羯磨師。乃	僧 眾 足 尼 羯 磨 師 為 從 僧 乞 僧 羯 磨 師 乃 
T85n2797_001:0729a18	至為作白四羯磨已。和上闍梨將十尼還至	至 為 作 白四羯磨 已 和 上 闍 梨 將 十 尼 還 至 
T85n2797_001:0729a19	本處所。呼受戒人令禮眾足。乃至廣說。又毘	本 處 所 呼 受 戒 人 令 禮 眾 足 乃至廣說 又 毘 
T85n2797_001:0729a20	尼母云。尼遣使受戒。中唯有一女。得此女顏	尼 母 云 尼 遣 使 受 戒 中 唯 有 一 女 得 此 女 顏 
T85n2797_001:0729a21	容挺特。世所無比。若往者恐惡人抄掠。是佛	容 挺 特 世 所 無 比 若 往 者 恐 惡 人 抄 掠 是 佛 
T85n2797_001:0729a22	所聽。今時若有如是比者。可得遣使受戒乞	所 聽 今 時 若 有 如是比者 可 得 遣 使 受 戒 乞 
T85n2797_001:0729a23	五德者。正理論云。由持律為第五人。謂於邊	五 德 者 正 理 論 云 由 持 律 為 第 五 人 謂 於 邊 
T85n2797_001:0729a24	國羯磨得者。正理云。由十眾。謂於中國此即	國 羯 磨 得 者 正 理 云 由 十 眾 謂 於 中 國 此 即 
T85n2797_001:0729a25	通僧尼。尼受具中二部各十。所言五十者就	通 僧 尼 尼 受 具 中 二 部 各 十 所 言 五 十 者 就 
T85n2797_001:0729a26	極少說。若多若過於理無傷。三歸得者。正	極 少 說 若 多 若 過 於 理 無 傷 三 歸 得 者 正 
T85n2797_001:0729a27	理論云。由三說歸佛法僧。謂六十賢部共集	理 論 云 由 三 說 歸 佛 法 僧 謂 六 十 賢 部 共 集 
T85n2797_001:0729a28	受具戒。解云。佛遣無學為說三歸便得具足。	受 具 戒 解 云 佛 遣 無 學 為 說 三 歸 便 得 具 足 
