T85n2797_001:0735b09	三千大千世界。同壞同成。此據隨化。但言千	三千大千世界 同 壞 同 成 此 據 隨 化 但 言 千 
T85n2797_001:0735b10	等。理實一佛化十六界。又由願力說化大千。	等 理 實 一 佛 化 十 六 界 又 由 願 力 說 化 大 千 
T85n2797_001:0735b11	經。各坐菩提樹一時成佛道　釋曰。第二一	經 各 坐 菩 提 樹 一 時 成 佛 道 釋 曰 第 二 一 
T85n2797_001:0735b12	時成佛道。謂一本身及千百億一時成道菩	時 成 佛 道 謂 一 本 身 及 千 百 億 一 時 成 道 菩 
T85n2797_001:0735b13	提名覺。成覺之樹名菩提樹。然七佛成道其	提 名 覺 成 覺 之 樹 名 菩 提 樹 然 七 佛 成 道 其 
T85n2797_001:0735b14	樹各別。如長阿含經第一云。毘婆尸佛坐波	樹 各 別 如 長 阿 含 經 第 一 云 毘 婆 尸 佛 坐 波 
T85n2797_001:0735b15	波樹下成最正覺。尸棄佛坐分陀利樹下成	波 樹 下 成最正覺 尸 棄 佛 坐 分陀利樹 下 成 
T85n2797_001:0735b16	最正覺。毘舍浮佛坐婆羅樹下成最正覺。拘	最 正 覺 毘 舍 浮 佛 坐 婆 羅 樹 下 成最正覺 拘 
T85n2797_001:0735b17	樓孫佛坐尸利沙樹下成最正覺。拘那含牟	樓 孫 佛 坐 尸 利 沙 樹 下 成最正覺 拘 那 含 牟 
T85n2797_001:0735b18	尼佛坐烏暫婆羅樹下成最正覺。迦葉佛坐	尼 佛 坐 烏 暫 婆 羅 樹 下 成最正覺 迦 葉 佛 坐 
T85n2797_001:0735b19	尼拘律樹下成最正覺。我今坐鉢多樹下成	尼拘律樹 下 成最正覺 我 今 坐 鉢 多 樹 下 成 
T85n2797_001:0735b20	最正覺。大乘同性經云。此菩提樹王高無邊	最 正 覺 大 乘 同 性 經 云 此 菩 提 樹 王 高 無 邊 
T85n2797_001:0735b21	恒河沙佛剎微塵數世界縱廣正等。云何菩	恒 河 沙 佛 剎 微 塵 數 世 界 縱 廣 正 等 云 何 菩 
T85n2797_001:0735b22	薩往詣樹下成最正覺。如密迹力士經第三	薩 往 詣 樹 下 成最正覺 如 密迹力士 經 第 三 
T85n2797_001:0735b23	說。菩薩六年苦行。到閑靜處流河水際。洗身	說 菩 薩 六 年 苦 行 到 閑 靜 處 流 河 水 際 洗 身 
T85n2797_001:0735b24	清淨度河水去。往至他處而獨立。烏有彌迦	清 淨 度 河 水 去 往 至 他 處 而 獨 立 烏 有 彌 迦 
T85n2797_001:0735b25	女。名善蔭。搆于頭牛而取其乳。展轉相飲	女 名 善 蔭 搆 于 頭 牛 而 取 其 乳 展 轉 相 飲 
T85n2797_001:0735b26	取後淳湩用煮乳糜在釜跳上數十丈。其女	取 後 淳 湩 用 煮 乳 糜 在 釜 跳 上 數 十 丈 其 女 
T85n2797_001:0735b27	怪以梵志占之。臨成佛者乃應眼耳。時女詣	怪 以 梵 志 占 之 臨 成 佛 者 乃 應 眼 耳 時 女 詣 
T85n2797_001:0735b28	菩薩所。及六百天龍鬼神。各各齎食珍異甘	菩 薩 所 及 六 百 天 龍 鬼 神 各 各 齎 食 珍 異 甘 
T85n2797_001:0735b29	饍詣菩薩所。各自啟曰。唯願垂愍受是供養。	饍 詣 菩 薩 所 各 自 啟 曰 唯 願 垂 愍 受 是 供 養 
T85n2797_001:0735c01	于時菩薩受善蔭乳糜服食。亦取一切六方	于 時 菩 薩 受 善 蔭 乳 糜 服 食 亦 取 一 切 六 方 
T85n2797_001:0735c02	天龍鬼神示現皆食。諸來施者各自見獨受	天 龍 鬼 神 示 現 皆 食 諸 來 施 者 各 自 見 獨 受 
T85n2797_001:0735c03	其食。不見他人。爾時菩薩往詣菩提樹。坐	其 食 不 見 他 人 爾 時 菩 薩 往 詣 菩 提 樹 坐 
T85n2797_001:0735c04	樹王下。於其足底生千輻輪相。足出光明。遍	樹 王 下 於 其 足 底 生 千輻輪相 足 出 光 明 遍 
T85n2797_001:0735c05	照佛國土。一切地獄畜生餓鬼一切眾生苦	照 佛 國 土 一 切 地 獄 畜 生 餓 鬼 一 切 眾 生 苦 
T85n2797_001:0735c06	惱休息。又有一人名日吉安。遙住視菩薩因	惱 休 息 又 有 一 人 名 日 吉 安 遙 住 視 菩 薩 因 
T85n2797_001:0735c07	求好草。手執此草詣菩薩所。以此好草貢與	求 好 草 手 執 此 草 詣 菩 薩 所 以 此 好 草 貢 與 
T85n2797_001:0735c08	菩薩。稽首足下。即發無上正真道意。爾時菩	菩 薩 稽 首 足 下 即 發 無 上 正 真 道 意 爾 時 菩 
T85n2797_001:0735c09	薩以授好草布佛樹下。時八萬四千天子等。	薩 以 授 好 草 布 佛 樹 下 時 八萬四千 天 子 等 
T85n2797_001:0735c10	覩菩薩布坐。希奇心中。忻然尋設八萬四千	覩 菩 薩 布 坐 希 奇 心 中 忻 然 尋 設 八萬四千 
T85n2797_001:0735c11	師子之座。是諸天子各不相見。亦不相知。心	師 子 之 座 是 諸 天 子 各 不 相 見 亦 不 相 知 心 
T85n2797_001:0735c12	自念言。菩薩獨處乘師子座成最正覺。時	自 念 言 菩 薩 獨 處 乘 師 子 座 成最正覺 時 
T85n2797_001:0735c13	諸人天見彼菩薩或見坐於寶淨蓮花師子之	諸 人 天 見 彼 菩 薩 或 見 坐 於 寶 淨 蓮 花 師 子 之 
T85n2797_001:0735c14	座。或見在地。或在虛空師子座上或見在貝	座 或 見 在 地 或 在 虛 空 師 子 座 上 或 見 在 貝 
T85n2797_001:0735c15	多樹。或見在忉利天上盡度樹下。或見在眾	多 樹 或 見 在 忉 利 天 上 盡 度 樹 下 或 見 在 眾 
T85n2797_001:0735c16	寶樹下。或見在七尺諸佛樹下。乃至或見八	寶 樹 下 或 見 在 七 尺 諸 佛 樹 下 乃 至 或 見 八 
T85n2797_001:0735c17	萬四千由旬樹下坐。具說如彼。問。如何本身	萬 四 千 由 旬 樹 下 坐 具 說 如 彼 問 如 何 本 身 
T85n2797_001:0735c18	坐菩提樹。答。此菩提樹即蓮花藏界。蓮花藏	坐 菩 提 樹 答 此 菩 提 樹 即 蓮 花 藏 界 蓮 花 藏 
T85n2797_001:0735c19	界即菩提樹。又此唯顯百億釋迦各坐菩提	界 即 菩 提 樹 又 此 唯 顯 百 億 釋 迦 各 坐 菩 提 
T85n2797_001:0735c20	樹一時成佛。非本身佛。亦非千佛。	樹 一 時 成 佛 非 本 身 佛 亦 非 千 佛 
T85n2797_001:0735c21	經。如是千百億盧舍那本身　釋曰。第三攝	經 如 是 千 百 億 盧 舍 那 本 身 釋 曰 第 三 攝 
T85n2797_001:0735c22	化歸真。如是千百億是盧舍那佛之所化。皆	化 歸 真 如 是 千 百 億 是 盧 舍 那 佛 之 所 化 皆 
T85n2797_001:0735c23	以舍那為其本身。	以 舍 那 為 其 本 身 
T85n2797_001:0735c24	經。千百億釋迦至俱來至我所　釋曰。第二	經 千 百 億 釋 迦 至 俱 來 至 我 所 釋 曰 第 二 
T85n2797_001:0735c25	有兩行半頌。略開戒品有二。一有一行一句	有 兩 行 半 頌 略 開 戒 品 有 二 一 有 一 行 一 句 
T85n2797_001:0735c26	本身略開。二有一行一句化佛略誦。此即第	本 身 略 開 二 有 一 行 一 句 化 佛 略 誦 此 即 第 
T85n2797_001:0735c27	一本身略開有二。此即第一聽眾來集。	一 本 身 略 開 有 二 此 即 第 一 聽 眾 來 集 
T85n2797_001:0735c28	經。聽我誦佛戒甘露門即開　釋曰。第二本	經 聽 我 誦 佛 戒 甘 露 門 即 開 釋 曰 第 二 本 
T85n2797_001:0735c29	身略開。言甘露者。即是涅槃。於涅槃中離	身 略 開 言 甘 露 者 即 是 涅 槃 於 涅 槃 中 離 
T85n2797_001:0736a01	死所依蘊名為甘露。如是妙戒為涅槃門。以	死 所 依 蘊 名 為 甘 露 如 是 妙 戒 為 涅 槃 門 以 
T85n2797_001:0736a02	此為依起無悔等。乃至依定發如實惠。得涅	此 為 依 起 無 悔 等 乃 至 依 定 發 如 實 惠 得 涅 
T85n2797_001:0736a03	槃故。如雜集論第八言。何故此滅復名甘露。	槃 故 如 雜 集 論 第 八 言 何 故 此 滅 復 名 甘 露 
T85n2797_001:0736a04	離蘊魔故。永離一切死所依蘊故名甘露。又	離 蘊 魔 故 永 離 一 切 死 所 依 蘊 故 名 甘 露 又 
T85n2797_001:0736a05	說。由此律儀能速遠離生死苦故。又說。云何	說 由 此 律 儀 能 速 遠 離 生 死 苦 故 又 說 云 何 
T85n2797_001:0736a06	身語隨順現行。由能隨順涅槃得故。謂能隨	身 語 隨 順 現 行 由 能 隨 順 涅 槃 得 故 謂 能 隨 
T85n2797_001:0736a07	順得涅槃得能引聖道故。所言開者。謂宣示	順 得 涅 槃 得 能 引 聖 道 故 所 言 開 者 謂 宣 示 
T85n2797_001:0736a08	他故。	他 故 
T85n2797_001:0736a09	經。是時千百億至四十八　釋曰。第二化佛	經 是 時 千 百 億 至 四 十 八 釋 曰 第 二 化 佛 
T85n2797_001:0736a10	略誦。此中千佛及百億佛各誦本師戒。	略 誦 此 中 千 佛 及 百 億 佛 各 誦 本 師 戒 
T85n2797_001:0736a11	經。戒如明日月亦如瓔珞珠　釋曰。第三有	經 戒 如 明 日 月 亦 如 瓔 珞 珠 釋 曰 第 三 有 
T85n2797_001:0736a12	一行頌舉喻歎德。先喻。後法。此即舉喻。此中	一 行 頌 舉 喻 歎 德 先 喻 後 法 此 即 舉 喻 此 中 
T85n2797_001:0736a13	日月喻除滅諸惡。瓔珞珠喻修集諸善。饒益	日 月 喻 除 滅 諸 惡 瓔 珞 珠 喻 修 集 諸 善 饒 益 
T85n2797_001:0736a14	有情譬如日月能破諸闇。攝律儀戒離自黑	有 情 譬 如 日 月 能 破 諸 闇 攝律儀戒 離 自 黑 
T85n2797_001:0736a15	闇。攝有情戒能除他闇。闇有二種。一惡業果	闇 攝 有 情 戒 能 除 他 闇 闇 有 二 種 一 惡 業 果 
T85n2797_001:0736a16	闇。二生死闇。此戒能破諸身語惡及惡趣闇。	闇 二 生 死 闇 此 戒 能 破 諸 身 語 惡 及 惡 趣 闇 
T85n2797_001:0736a17	如戒經說。譬如明眼人能避陰惡道。世有聰	如 戒 經 說 譬 如 明 眼 人 能 避 陰 惡 道 世 有 聰 
T85n2797_001:0736a18	明人。能遠離諸惡。除生死闇者。由此展轉	明 人 能 遠 離 諸 惡 除 生 死 闇 者 由 此 展 轉 
T85n2797_001:0736a19	趣涅槃故。如大智論第十五云。死闇冥中戒	趣 涅 槃 故 如 大 智 論 第 十 五 云 死 闇 冥 中 戒 
T85n2797_001:0736a20	為燈明。又如世間有瓔珞珠有其二義。一莊	為 燈 明 又 如 世 間 有 瓔 珞 珠 有 其 二 義 一 莊 
T85n2797_001:0736a21	嚴身。戒亦如是。莊嚴行者。如增壹說。戒如	嚴 身 戒 亦 如 是 莊 嚴 行 者 如 增 壹 說 戒 如 
T85n2797_001:0736a22	瓔珞身現眾好相故。二者能感財寶。戒亦如	瓔 珞 身 現 眾 好 相 故 二 者 能 感 財 寶 戒 亦 如 
T85n2797_001:0736a23	是。一切妙行因此而起。如大智論云。譬如大	是 一 切 妙 行 因 此 而 起 如 大 智 論 云 譬 如 大 
T85n2797_001:0736a24	地一切萬物有形之類皆依於地。戒亦如是。	地 一 切 萬 物 有 形 之 類 皆 依 於 地 戒 亦 如 是 
T85n2797_001:0736a25	戒為一切善法住處。若人棄捨此戒。雖居山	戒 為 一 切 善 法 住 處 若 人 棄 捨 此 戒 雖 居 山 
T85n2797_001:0736a26	苦行。食菓服藥。與禽獸無異。或有人但依水	苦 行 食 菓 服 藥 與 禽 獸 無 異 或 有 人 但 依 水 
T85n2797_001:0736a27	為戒。或著草衣。或著木皮衣。受行苦行。空	為 戒 或 著 草 衣 或 著 木 皮 衣 受 行 苦 行 空 
T85n2797_001:0736a28	無所得。若有人雖處高堂大殿好衣美食。而	無 所 得 若 有 人 雖 處 高 堂 大 殿 好 衣 美 食 而 
T85n2797_001:0736a29	能行此戒者。得生好處。乃得道果。又增一	能 行 此 戒 者 得 生 好 處 乃 得 道 果 又 增 一 
T85n2797_001:0736b01	經說。夫禁戒者。猶吉祥瓶。所願便剋。諸道	經 說 夫 禁 戒 者 猶 吉 祥 瓶 所 願 便 剋 諸 道 
T85n2797_001:0736b02	品法皆由戒成。此顯攝善法戒。又如意珠有	品 法 皆 由 戒 成 此 顯 攝善法戒 又 如 意 珠 有 
T85n2797_001:0736b03	八功德。戒珠亦爾。如薩遮尼揵子經第三說。	八 功 德 戒 珠 亦 爾 如 薩 遮 尼 揵 子 經 第 三 說 
T85n2797_001:0736b04	如摩尼寶有八功德。一於黑夜闇放大光明。	如 摩 尼 寶 有 八 功 德 一 於 黑 夜 闇 放大光明 
T85n2797_001:0736b05	能照一百由旬。至於夏日眾生患熱。以摩尼	能 照 一 百 由 旬 至 於 夏 日 眾 生 患 熱 以 摩 尼 
T85n2797_001:0736b06	寶放光觸身得清涼故。二轉輪王若行曠野	寶 放 光 觸 身 得 清 涼 故 二 轉 輪 王 若 行 曠 野 
T85n2797_001:0736b07	無水之處。眾生飢渴時。摩尼寶即施八味具	無 水 之 處 眾 生 飢 渴 時 摩 尼 寶 即 施 八 味 具 
T85n2797_001:0736b08	功德水充足飢渴。三者王有所須一切皆從	功 德 水 充 足 飢 渴 三 者 王 有 所 須 一 切 皆 從 
T85n2797_001:0736b09	摩尼寶出。四者彼摩尼寶有八楞。一一楞中	摩 尼 寶 出 四 者 彼 摩 尼 寶 有 八 楞 一 一 楞 中 
T85n2797_001:0736b10	出種種光。謂青黃赤白頗梨紅紫。五者彼摩	出 種 種 光 謂 青 黃 赤 白 頗 梨 紅 紫 五 者 彼 摩 
T85n2797_001:0736b11	尼寶在所。能令一百由旬所有眾生。必離病	尼 寶 在 所 能 令 一 百 由 旬 所 有 眾 生 必 離 病 
T85n2797_001:0736b12	苦。當得定心。所作善心。無空過者。六者彼	苦 當 得 定 心 所 作 善 心 無 空 過 者 六 者 彼 
T85n2797_001:0736b13	摩尼寶所住境界。無諸毒龍能放毒氣。電風	摩 尼 寶 所 住 境 界 無 諸 毒 龍 能 放 毒 氣 電 風 
T85n2797_001:0736b14	惡雨損害眾生。七者一切山川嵠峪溝澗泉	惡 雨 損 害 眾 生 七 者 一 切 山 川 嵠 峪 溝 澗 泉 
T85n2797_001:0736b15	水乾竭悉令還服。樹林草木花菓枯悴能令	水 乾 竭 悉 令 還 服 樹 林 草 木 花 菓 枯 悴 能 令 
T85n2797_001:0736b16	滋茂。八者彼摩尼寶所在之處。人民無有疾	滋 茂 八 者 彼 摩 尼 寶 所 在 之 處 人 民 無 有 疾 
T85n2797_001:0736b17	疫諸毒非時死者。至於畜生相噉食者不起	疫 諸 毒 非 時 死 者 至 於 畜 生 相 噉 食 者 不 起 
T85n2797_001:0736b18	害心。具如彼經。如如意珠。戒珠亦爾。有八	害 心 具 如 彼 經 如 如 意 珠 戒 珠 亦 爾 有 八 
T85n2797_001:0736b19	功德。一除生死闇。二定水充滿。三生長善法。	功 德 一 除 生 死 闇 二 定 水 充 滿 三 生 長 善 法 
T85n2797_001:0736b20	四能放光明。五除身心病。六離法毒害。七憔	四 能 放 光 明 五 除 身 心 病 六 離 法 毒 害 七 憔 
T85n2797_001:0736b21	悴福林令得茂盛。八能令眾生無損害心。	悴 福 林 令 得 茂 盛 八 能 令 眾 生 無 損 害 心 
T85n2797_001:0736b22	經。微塵菩薩眾由此成正覺　釋曰。第二顯	經 微 塵 菩 薩 眾 由 此 成 正 覺 釋 曰 第 二 顯 
T85n2797_001:0736b23	法。謂由此戒除惡修善得成正覺。	法 謂 由 此 戒 除 惡 修 善 得 成 正 覺 
T85n2797_001:0736b24	經。是盧舍那至受持戒　釋曰。第二有五頌	經 是 盧 舍 那 至 受 持 戒 釋 曰 第 二 有 五 頌 
T85n2797_001:0736b25	半誡聽勸持。此中有五。一有一行頌歎勝勸	半 誡 聽 勸 持 此 中 有 五 一 有 一 行 頌 歎 勝 勸 
T85n2797_001:0736b26	持。二有兩句勸持傳說。三有三句誡聽。四有	持 二 有 兩 句 勸 持 傳 說 三 有 三 句 誡 聽 四 有 
T85n2797_001:0736b27	兩行三句勸信。五有兩句結勸。此即第一歎	兩 行 三 句 勸 信 五 有 兩 句 結 勸 此 即 第 一 歎 
T85n2797_001:0736b28	勝勸持。上二句歎勝本身所誦此戒勝也。後	勝 勸 持 上 二 句 歎 勝 本 身 所 誦 此 戒 勝 也 後 
T85n2797_001:0736b29	二句勸持戒法尊重可以以頂戴。	二 句 勸 持 戒 法 尊 重 可 以 以 頂 戴 
T85n2797_001:0736c01	經。受持是戒已轉授諸眾生　釋曰。第二勸	經 受 持 是 戒 已 轉 授 諸 眾 生 釋 曰 第 二 勸 
T85n2797_001:0736c02	持傳說。欲令此戒盡未來際不斷絕故。轉授	持 傳 說 欲 令 此 戒 盡未來際 不 斷 絕 故 轉 授 
T85n2797_001:0736c03	餘人。	餘 人 
T85n2797_001:0736c04	經。諦聽我正誦至木叉　釋曰。第三有三句	經 諦 聽 我 正 誦 至 木 叉 釋 曰 第 三 有 三 句 
T85n2797_001:0736c05	誡聽。屬耳專注。領所說義。名為諦聽。	誡 聽 屬 耳 專 注 領 所 說 義 名 為 諦 聽 
T85n2797_001:0736c06	經。大眾心諦信至已成佛　釋曰。第四勸信	經 大 眾 心 諦 信 至 已 成 佛 釋 曰 第 四 勸 信 
T85n2797_001:0736c07	有三。一有三句信已當成佛。二有一行頌信	有 三 一 有 三 句 信 已 當 成 佛 二 有 一 行 頌 信 
T85n2797_001:0736c08	戒具足。三有一行頌信同佛位。此即第一信	戒 具 足 三 有 一 行 頌 信 同 佛 位 此 即 第 一 信 
T85n2797_001:0736c09	已。當成佛信此戒故我當成佛。	已 當 成 佛 信 此 戒 故 我 當 成 佛 
T85n2797_001:0736c10	經。常作如是信至攝佛戒　釋曰。第二有一	經 常 作 如 是 信 至 攝 佛 戒 釋 曰 第 二 有 一 
T85n2797_001:0736c11	行頌信戒具足。由有此戒。所餘聲聞等一切	行 頌 信 戒 具 足 由 有 此 戒 所 餘 聲 聞 等 一 切 
T85n2797_001:0736c12	戒品。悉皆具足。諸所有戒皆入此故。由此道	戒 品 悉 皆 具 足 諸 所 有 戒 皆 入 此 故 由 此 道 
T85n2797_001:0736c13	理。一切有心皆應受佛戒。又普勸言。一切皆	理 一 切 有 心 皆 應 受 佛 戒 又 普 勸 言 一 切 皆 
T85n2797_001:0736c14	應受。如下經說。但解法師言者。盡受得戒。又	應 受 如 下 經 說 但 解 法 師 言 者 盡 受 得 戒 又 
T85n2797_001:0736c15	一切皆有理佛性故。皆應攝受。	一 切 皆 有 理 佛 性 故 皆 應 攝 受 
T85n2797_001:0736c16	經。眾生受佛至諸佛子　釋曰。第三信同佛	經 眾 生 受 佛 至 諸 佛 子 釋 曰 第 三 信 同 佛 
T85n2797_001:0736c17	位。謂因戒善合有處當來恒沙功德。於因說	位 謂 因 戒 善 合 有 處 當 來 恒 沙 功 德 於 因 說 
T85n2797_001:0736c18	果。因同大覺。如涅槃經說。發心究竟二不	果 因 同 大 覺 如 涅 槃 經 說 發 心 究 竟 二 不 
T85n2797_001:0736c19	別。如是應前心難當紹佛位名真佛子。	別 如 是 應 前 心 難 當 紹 佛 位 名 真 佛 子 
T85n2797_001:0736c20	經。大眾至我誦　釋曰。第五結聽。	經 大 眾 至 我 誦 釋 曰 第 五 結 聽 
T85n2797_001:0736c21	經。爾時釋迦牟尼至成無上覺　釋曰。自下	經 爾 時 釋 迦 牟 尼 至 成 無 上 覺 釋 曰 自 下 
T85n2797_001:0736c22	第二廣釋戒相。有二。先因緣。後告諸下廣釋	第 二 廣 釋 戒 相 有 二 先 因 緣 後 告 諸 下 廣 釋 
T85n2797_001:0736c23	戒相。前中有四。一成道。二結戒。三放光。四	戒 相 前 中 有 四 一 成 道 二 結 戒 三 放 光 四 
T85n2797_001:0736c24	集眾。成道中有四。一顯時。二辨名。三明處。	集 眾 成 道 中 有 四 一 顯 時 二 辨 名 三 明 處 
T85n2797_001:0736c25	四成道。爾時者顯時。謂已成佛時。正說戒	四 成 道 爾 時 者 顯 時 謂 已 成 佛 時 正 說 戒 
T85n2797_001:0736c26	時。已說心地時。釋迦牟尼佛者標名。釋迦姓	時 已 說 心 地 時 釋 迦 牟 尼 佛 者 標 名 釋 迦 姓 
T85n2797_001:0736c27	也。牟尼別名也。佛德號也。釋迦此云能。劫	也 牟 尼 別 名 也 佛 德 號 也 釋 迦 此 云 能 劫 
T85n2797_001:0736c28	初有王名平等意。姓剎帝利(云此田主)乃至彼有子	初 有 王 名 平 等 意 姓 剎 帝 利 云 此 田 主 乃 至 彼 有 子 
T85n2797_001:0736c29	孫王名茅草王。王有息名大茅草。如佛本行	孫 王 名 茅 草 王 王 有 息 名 大 茅 草 如 佛 本 行 
T85n2797_001:0737a01	經第五說。大茅草王無子。以其王位付諸大	經 第 五 說 大 茅 草 王 無 子 以 其 王 位 付 諸 大 
T85n2797_001:0737a02	臣。出家成就。四禪具足。五通得成。王仙壽	臣 出 家 成 就 四 禪 具 足 五 通 得 成 王 仙 壽 
T85n2797_001:0737a03	命極長。至年衰老不能遠行。時彼弟子欲往	命 極 長 至 年 衰 老 不 能 遠 行 時 彼 弟 子 欲 往 
T85n2797_001:0737a04	東西求覓飲食。取好軟草安置籠裏盛。其王	東 西 求 覓 飲 食 取 好 軟 草 安 置 籠 裏 盛 其 王 
T85n2797_001:0737a05	仙懸樹枝上。畏諸蟲獸來觸。王仙弟子去後	仙 懸 樹 枝 上 畏 諸 蟲 獸 來 觸 王 仙 弟 子 去 後 
T85n2797_001:0737a06	有一獵師。遙見王仙謂是白鳥。遂即射之。仙	有 一 獵 師 遙 見 王 仙 謂 是 白 鳥 遂 即 射 之 仙 
T85n2797_001:0737a07	既被射。有雨滴血出墮於地。即便命終。彼弟	既 被 射 有 雨 滴 血 出 墮 於 地 即 便 命 終 彼 弟 
T85n2797_001:0737a08	子來見彼王仙被射命終。復見血滴。焚燒王	子 來 見 彼 王 仙 被 射 命 終 復 見 血 滴 焚 燒 王 
T85n2797_001:0737a09	仙。將骨起塔。時雨滴血生二甘蔗牙漸漸高	仙 將 骨 起 塔 時 雨 滴 血 生 二 甘 蔗 牙 漸 漸 高 
T85n2797_001:0737a10	大。至甘蔗熟。日炙開剖。一莖生一童子。一莖	大 至 甘 蔗 熟 日 炙 開 剖 一 莖 生 一 童 子 一 莖 
T85n2797_001:0737a11	生一童女。端政可喜。世間無雙。時諸弟子念	生 一 童 女 端 政 可 喜 世 間 無 雙 時 諸 弟 子 念 
T85n2797_001:0737a12	言。今此兩童是王仙種。養護看視。報諸臣	言 今 此 兩 童 是 王 仙 種 養 護 看 視 報 諸 臣 
T85n2797_001:0737a13	知。時諸大臣聞已歡喜。迎二童子。將還入宮。	知 時 諸 大 臣 聞 已 歡 喜 迎 二 童 子 將 還 入 宮 
T85n2797_001:0737a14	召解相師教教令占相。并遣作名相師云。此	召 解 相 師 教 教 令 占 相 并 遣 作 名 相 師 云 此 
T85n2797_001:0737a15	既日炙熟甘蔗開而出生故。一名善生。第二	既 日 炙 熟 甘 蔗 開 而 出 生 故 一 名 善 生 第 二 
T85n2797_001:0737a16	復名甘蔗生。又曰。炙甘蔗出亦名日種彼女	復 名 甘 蔗 生 又 曰 炙 甘 蔗 出 亦 名 日 種 彼 女 
T85n2797_001:0737a17	因緣一種無別故名善賢童子。幼少年立以	因 緣 一 種 無 別 故 名 善 賢 童 子 幼 少 年 立 以 
T85n2797_001:0737a18	王女。至長大拜為第一妃王。第二妃絕妙端	王 女 至 長 大 拜 為 第 一 妃 王 第 二 妃 絕 妙 端 
T85n2797_001:0737a19	政生四子。一名金色。二名炬面。三名象眾。四	政 生 四 子 一 名 金 色 二 名 炬 面 三 名 象 眾 四 
T85n2797_001:0737a20	名別成。其善賢妃唯有一子。名曰長壽。端政	名 別 成 其 善 賢 妃 唯 有 一 子 名 曰 長 壽 端 政 
T85n2797_001:0737a21	可喜。其善賢妃。至於王邊白言。大王。我今從	可 喜 其 善 賢 妃 至 於 王 邊 白 言 大 王 我 今 從 
T85n2797_001:0737a22	大王乞求一願。王言。隨意。從心所欲。妃重白	大 王 乞 求 一 願 王 言 隨 意 從 心 所 欲 妃 重 白 
T85n2797_001:0737a23	王言。大王自在若與我願不得變悔。王言。我與	王 言 大 王 自 在 若 與 我 願 不 得 變 悔 王 言 我 與 
T85n2797_001:0737a24	妃心之所願後若悔者。當令我頭破作七分。	妃 心 之 所 願 後 若 悔 者 當 令 我 頭 破 作 七 分 
T85n2797_001:0737a25	妃言。大王四子擯出於國。遣我所生子長壽	妃 言 大 王 四 子 擯 出 於 國 遣 我 所 生 子 長 壽 
T85n2797_001:0737a26	為王。豈不善哉。至明清旦。王勅四子。今可出	為 王 豈 不 善 哉 至 明 清 旦 王 勅 四 子 今 可 出 
T85n2797_001:0737a27	去。我治化內不得居住。時四子母母妹及大	去 我 治 化 內 不 得 居 住 時 四 子 母 母 妹 及 大 
T85n2797_001:0737a28	臣等白王言。乞我等隨王子去。王言。隨意。王	臣 等 白 王 言 乞 我 等 隨 王 子 去 王 言 隨 意 王 
T85n2797_001:0737a29	子受王勅已向北方到雪山下。至山南面見	子 受 王 勅 已 向 北 方 到 雪 山 下 至 山 南 面 見 
T85n2797_001:0737b01	下。寬平無諸坑坎。舊有一仙。名迦毘羅。在中	下 寬 平 無 諸 坑 坎 舊 有 一 仙 名 迦 毘 羅 在 中 
T85n2797_001:0737b02	居止。王子見已。於此造城治化。王召國師言。	居 止 王 子 見 已 於 此 造 城 治 化 王 召 國 師 言 
T85n2797_001:0737b03	四子今在何處。答言。大王王子存北方。已生	四 子 今 在 何 處 答 言 大 王 王 子 存 北 方 已 生 
T85n2797_001:0737b04	男女。大好治化。能立國計。是故立姓為釋迦。	男 女 大 好 治 化 能 立 國 計 是 故 立 姓 為 釋 迦 
T85n2797_001:0737b05	於迦毘羅仙處所住故。因城立名故名迦毘	於 迦 毘 羅 仙 處 所 住 故 因 城 立 名 故 名 迦 毘 
T85n2797_001:0737b06	羅城。時三子沒後唯有一子在。名尼拘羅(此云別成)	羅 城 時 三 子 沒 後 唯 有 一 子 在 名 尼 拘 羅 此 云 別 成 
T85n2797_001:0737b07	為王。王生一子。名曰拘盧。拘盧王生一子。名	為 王 王 生 一 子 名 曰 拘 盧 拘 盧 王 生 一 子 名 
T85n2797_001:0737b08	瞿拘盧。瞿拘盧王生一子。名師子類。師子類	瞿 拘 盧 瞿 拘 盧 王 生 一 子 名 師 子 類 師 子 類 
T85n2797_001:0737b09	王生四子。一名淨飯。二名白飯。三名斛飯。四	王 生 四 子 一 名 淨 飯 二 名 白 飯 三 名 斛 飯 四 
T85n2797_001:0737b10	名甘露飯。有一女。名甘露味。其淨飯王以	名 甘 露 飯 有 一 女 名 甘 露 味 其 淨 飯 王 以 
T85n2797_001:0737b11	紹王位。還在父城。時迦毘城不遠復有一城。	紹 王 位 還 在 父 城 時 迦 毘 城 不 遠 復 有 一 城 
T85n2797_001:0737b12	名曰天臂城。有一釋種長者。名為善覺。大富	名 曰 天 臂 城 有 一 釋 種 長 者 名 為 善 覺 大 富 
T85n2797_001:0737b13	多財。如毘沙門王宮殿。無異時彼長者有八	多 財 如 毘 沙 門 王 宮 殿 無 異 時 彼 長 者 有 八 
