T85n2895_001:1414c22	佛說要行捨身經	佛 說 要 行 捨 身 經 
T85n2895_001:1414c24	如是我聞。一時佛在□□□□□□大苾芻	如是我聞 一 時 佛 在 大 苾 芻 
T85n2895_001:1414c25	眾千二百五□□□□□漢大迦葉波而為□	眾 千 二 百 五 漢 大 迦 葉 波 而 為 
T85n2895_001:1414c26	□□□一千人俱。飛騰辟支而為上首。諸大	 一 千 人 俱 飛 騰 辟 支 而 為 上 首 諸 大 
T85n2895_001:1414c27	菩薩八千人俱。地藏菩薩而為上首。大梵天	菩 薩 八 千 人 俱 地 藏 菩 薩 而 為 上 首 大 梵 天 
T85n2895_001:1414c28	王釋提桓因四天大王龍神八部。諸苾芻苾	王 釋提桓因 四 天 大 王 龍 神 八 部 諸 苾 芻 苾 
T85n2895_001:1414c29	芻尼烏波索迦烏波斯加。	芻 尼 烏 波 索 迦 烏 波 斯 加 
T85n2895_001:1415a01	爾時世尊於此眾中欣然而矣。放大光明照	爾 時 世 尊 於 此 眾 中 欣 然 而 矣 放大光明 照 
T85n2895_001:1415a02	屍陀林及此大會。未久之間其光還復從口	屍 陀 林 及 此 大 會 未 久 之 間 其 光 還 復 從 口 
T85n2895_001:1415a03	而入。端身而坐。正念不動。爾時迦葉波即從	而 入 端 身 而 坐 正 念 不 動 爾 時 迦 葉 波 即 從 
T85n2895_001:1415a04	座起。偏露右肩。遶三匝。即於佛前右膝著地。	座 起 偏露右肩 遶 三 匝 即 於 佛 前 右膝著地 
T85n2895_001:1415a05	而白佛言。世尊。如來何故於此眾中欣然而	而 白 佛 言 世 尊 如 來 何 故 於 此 眾 中 欣 然 而 
T85n2895_001:1415a06	笑。放大光明照屍陀林及此大會。未久之間	笑 放大光明 照 屍 陀 林 及 此 大 會 未 久 之 間 
T85n2895_001:1415a07	其光還復從口而入。端身而座。正念不動。唯	其 光 還 復 從 口 而 入 端 身 而 座 正 念 不 動 唯 
T85n2895_001:1415a08	願如來說其意志。佛言。善哉善哉。善男子。	願 如 來 說 其 意 志 佛 言 善哉善哉 善 男 子 
T85n2895_001:1415a09	汝當諦聽善思念之。吾當為汝說其要法。我	汝 當 諦 聽 善思念之 吾 當 為 汝 說 其 要 法 我 
T85n2895_001:1415a10	以佛眼觀此林中。捨身行者未來當獲正等	以 佛 眼 觀 此 林 中 捨 身 行 者 未 來 當 獲 正 等 
T85n2895_001:1415a11	菩提。若有有情能發勝上捨身之意。心生平	菩 提 若 有 有 情 能 發 勝 上 捨 身 之 意 心 生 平 
T85n2895_001:1415a12	等無有愛憎。不生慳悋。若能一發是心。雖未	等 無 有 愛 憎 不 生 慳 悋 若 能 一 發 是 心 雖 未 
T85n2895_001:1415a13	捨身是人已過二乘之行百千萬倍。即共諸	捨 身 是 人 已 過 二 乘 之 行 百 千 萬 倍 即 共 諸 
T85n2895_001:1415a14	菩薩等一切同志。況捨身命普及有情。如是	菩 薩 等 一 切 同 志 況 捨 身 命 普 及 有 情 如 是 
T85n2895_001:1415a15	功德。我若具說不可窮盡。迦葉波白佛言。世	功 德 我 若 具 說 不可窮盡 迦 葉 波 白 佛 言 世 
T85n2895_001:1415a16	尊如來所言在屍陀林普及一切有情。是義	尊 如 來 所 言 在 屍 陀 林 普 及 一切有情 是 義 
T85n2895_001:1415a17	不然不名為普。若是普者水性有情即無有	不 然 不 名 為 普 若 是 普 者 水 性 有 情 即 無 有 
T85n2895_001:1415a18	分。唯願如來示我普義。佛言。善男子。我正	分 唯 願 如 來 示 我 普 義 佛 言 善 男 子 我 正 
T85n2895_001:1415a19	許說汝方即問。若有有情能施身分。分為二	許 說 汝 方 即 問 若 有 有 情 能 施 身 分 分 為 二 
T85n2895_001:1415a20	分。一分水中。一分陸地。是人命欲終時。囑	分 一 分 水 中 一 分 陸 地 是 人 命 欲 終 時 囑 
T85n2895_001:1415a21	善知識同志願者。分割其身以為二分。是分	善 知 識 同 志 願 者 分 割 其 身 以 為 二 分 是 分 
T85n2895_001:1415a22	身者所得功德。與捨身人功德無二。我念過	身 者 所得功德 與 捨 身 人 功 德 無 二 我 念 過 
T85n2895_001:1415a23	去燃燈佛時。在舍衛國修菩提行。願捨身命	去 燃 燈 佛 時 在 舍 衛 國 修 菩 提 行 願 捨 身 命 
T85n2895_001:1415a24	皮肉筋骨。心心相續。彌勒于時為我善友。我	皮 肉 筋 骨 心 心 相 續 彌 勒 于 時 為 我 善 友 我 
T85n2895_001:1415a25	命既盡即分二分。安置如法。慈氏合掌即發	命 既 盡 即 分 二 分 安 置 如 法 慈 氏 合 掌 即 發 
T85n2895_001:1415a26	願言。以此微供普及有情水陸空行一切都	願 言 以 此 微 供 普 及 有 情 水 陸 空 行 一 切 都 
T85n2895_001:1415a27	食緣。是功德無始已來恒相值遇共為眷屬。	食 緣 是 功 德 無始已來 恒 相 值 遇 共 為 眷 屬 
T85n2895_001:1415a28	次復作佛即其人也。我因捨身發大誓言。若	次 復 作 佛 即 其 人 也 我 因 捨 身 發 大 誓 言 若 
T85n2895_001:1415a29	有有情飢食我肉。渴飲我血。既飲噉已。願令	有 有 情 飢 食 我 肉 渴 飲 我 血 既 飲 噉 已 願 令 
T85n2895_001:1415b01	一切有情因食我肉發菩提心離飢渴苦。未	一切有情 因 食 我 肉 發菩提心 離 飢 渴 苦 未 
T85n2895_001:1415b02	來當得法喜等食。資自性身。飲我血者離諸	來 當 得 法 喜 等 食 資 自 性 身 飲 我 血 者 離 諸 
T85n2895_001:1415b03	愛渴。當獲法水灌注心源。愛法王資變化	愛 渴 當 獲 法 水 灌 注 心 源 愛 法 王 資 變 化 
T85n2895_001:1415b04	身。以是義故疾得無上正等菩提。又迦葉波	身 以是義故 疾 得 無上正等菩提 又 迦 葉 波 
T85n2895_001:1415b05	我於因地初發心時。三度死捨正第四生。即	我 於 因 地 初 發 心 時 三 度 死 捨 正 第 四 生 即 
T85n2895_001:1415b06	能生捨不貪愛。於空王佛時。以悟空理即	能 生 捨 不 貪 愛 於 空 王 佛 時 以 悟 空 理 即 
T85n2895_001:1415b07	薩埵王子。施身餓虎飼於七子。亦作月光大	薩 埵 王 子 施 身 餓 虎 飼 於 七 子 亦 作 月 光 大 
T85n2895_001:1415b08	王。廣惠千首。亦為達拏太子。施妻子。亦為	王 廣 惠 千 首 亦 為 達 拏 太 子 施 妻 子 亦 為 
T85n2895_001:1415b09	慈力悲王施軀於五夜叉。為求法故。於雪山	慈 力 悲 王 施 軀 於 五 夜 叉 為 求 法 故 於 雪 山 
T85n2895_001:1415b10	邊求半句偈。以施其身餧其羅剎。我若廣	邊 求 半 句 偈 以 施 其 身 餧 其 羅 剎 我 若 廣 
T85n2895_001:1415b11	說無始已來生。捨身命於百千劫不可說盡。	說 無始已來 生 捨 身 命 於 百 千 劫 不 可 說 盡 
T85n2895_001:1415b12	何以故。都由因地初發心時死捨身故。迦葉	何 以 故 都 由 因 地 初 發 心 時 死 捨 身 故 迦 葉 
T85n2895_001:1415b13	放白佛言。世尊如是等人但行捨身功德	放 白 佛 言 世 尊 如 是 等 人 但 行 捨 身 功 德 
T85n2895_001:1415b14	無量。不審未施已前多生造罪。先世惡業捨	無 量 不 審 未 施 已 前 多 生 造 罪 先 世 惡 業 捨 
T85n2895_001:1415b15	身福報得滅以不。佛言。善男子。若有有情多	身 福 報 得 滅 以 不 佛 言 善 男 子 若 有 有 情 多 
T85n2895_001:1415b16	生殺害一切有情。遍娑婆界。四重五逆謗方	生 殺 害 一切有情 遍 娑 婆 界 四 重 五 逆 謗 方 
T85n2895_001:1415b17	等經。乃至食噉有情血肉。如是等罪無量無	等 經 乃 至 食 噉 有 情 血 肉 如 是 等 罪 無 量 無 
T85n2895_001:1415b18	邊。若有有情能施身分普濟有情。除飢渴苦。	邊 若 有 有 情 能 施 身 分 普 濟 有 情 除 飢 渴 苦 
T85n2895_001:1415b19	如上之罪悉皆消滅。從無始已來所有殃咎	如 上 之 罪 悉 皆 消 滅 從 無始已來 所 有 殃 咎 
T85n2895_001:1415b20	速滅無餘緣。捨身故即是大懺悔悉誠慚愧。	速 滅 無 餘 緣 捨 身 故 即 是 大 懺 悔 悉 誠 慚 愧 
T85n2895_001:1415b21	十方一切諸佛皆共稱嘆。善男子。假使有人	十 方 一切諸佛 皆 共 稱 嘆 善 男 子 假 使 有 人 
T85n2895_001:1415b22	從無始已來作業。偷僧祇物常住僧物見前	從 無始已來 作 業 偷 僧 祇 物 常 住 僧 物 見 前 
T85n2895_001:1415b23	僧物不淨說法。大斗重秤如是等罪。應入奈	僧 物 不 淨 說 法 大 斗 重 秤 如 是 等 罪 應 入 奈 
T85n2895_001:1415b24	落迦傍生餓鬼。百千劫中不得解脫。恐獲	落 迦 傍 生 餓 鬼 百 千 劫 中 不得解脫 恐 獲 
T85n2895_001:1415b25	來苦即請召集。娑訶世界三明六通具八解	來 苦 即 請 召 集 娑 訶 世 界 三 明 六 通 具 八 解 
T85n2895_001:1415b26	脫大阿羅漢。若凡若聖一切僧尼聚在一處。	脫 大阿羅漢 若 凡 若 聖 一 切 僧 尼 聚 在 一 處 
T85n2895_001:1415b27	欲滅其罪亦不可滅。何以即有百千殑伽娑	欲 滅 其 罪 亦 不 可 滅 何 以 即 有 百 千 殑 伽 娑 
T85n2895_001:1415b28	訶世界。一切眾僧清淨眾海即不來集。以是	訶 世 界 一 切 眾 僧 清 淨 眾 海 即 不 來 集 以 是 
T85n2895_001:1415b29	因緣罪難除滅。是故稱云常住僧物。普通法	因 緣 罪 難 除 滅 是 故 稱 云 常 住 僧 物 普 通 法 
T85n2895_001:1415c01	界上至諸佛下至沙彌。悉皆有分不如有人。	界 上 至 諸 佛 下 至 沙 彌 悉 皆 有 分 不 如 有 人 
T85n2895_001:1415c02	於一切生處。願捨此身皮肉筋骨。心心相續	於 一 切 生 處 願 捨 此 身 皮 肉 筋 骨 心 心 相 續 
T85n2895_001:1415c03	如上之罪。悉皆消滅。天曹地府所有薄籍自	如 上 之 罪 悉 皆 消 滅 天 曹 地 府 所 有 薄 籍 自 
T85n2895_001:1415c04	然除滅。以是因緣。我見是利故。勸諸有情當	然 除 滅 以是因緣 我 見 是 利 故 勸 諸 有 情 當 
T85n2895_001:1415c05	施身分必定獲得無上等覺。爾時世尊告彌	施 身 分 必 定 獲 得 無 上 等 覺 爾 時 世 尊 告 彌 
T85n2895_001:1415c06	勒菩薩言。慈氏如是輩經。汝等護持。於贍部	勒 菩 薩 言 慈 氏 如 是 輩 經 汝 等 護 持 於 贍 部 
T85n2895_001:1415c07	洲廣宣流布無令斷絕。爾時彌勒菩薩白佛	洲 廣 宣 流 布 無 令 斷 絕 爾 時 彌 勒 菩 薩 白 佛 
T85n2895_001:1415c08	言。世尊。如來滅後惡世之中。若善男子善女	言 世 尊 如來滅後 惡 世 之 中 若 善 男 子 善 女 
T85n2895_001:1415c09	人。發勇猛心。以身布施。一切有情為檀波	人 發 勇 猛 心 以 身 布 施 一切有情 為 檀 波 
T85n2895_001:1415c10	羅蜜故。如是等人我於龍花初首皆令得度。	羅 蜜 故 如 是 等 人 我 於 龍 花 初 首 皆 令 得 度 
T85n2895_001:1415c11	唯願佛曰。更不有慮。大梵天王釋提桓因四	唯 願 佛 曰 更 不 有 慮 大 梵 天 王 釋提桓因 四 
T85n2895_001:1415c12	天大王。龍神八部諸苾芻苾芻尼烏波索迦	天 大 王 龍 神 八 部 諸 苾 芻 苾 芻 尼 烏 波 索 迦 
T85n2895_001:1415c13	烏波斯迦。白佛言。世尊。如此人輩。我等從	烏波斯迦 白 佛 言 世 尊 如 此 人 輩 我 等 從 
T85n2895_001:1415c14	今為作衛護。不令有人作於留難。所以者何。	今 為 作 衛 護 不 令 有 人 作 於 留 難 所以者何 
T85n2895_001:1415c15	如此人輩必定獲得無等正覺。爾時慶喜白	如 此 人 輩 必 定 獲 得 無 等 正 覺 爾 時 慶 喜 白 
T85n2895_001:1415c16	佛言。世尊。當何名之。佛告慶喜。此經名諸佛	佛 言 世 尊 當 何 名 之 佛 告 慶 喜 此 經 名 諸 佛 
T85n2895_001:1415c17	要行捨身功德經。爾時一切天人阿素洛聞	要 行 捨 身 功 德 經 爾 時 一 切 天 人 阿 素 洛 聞 
T85n2895_001:1415c18	佛所說。信受奉行。	佛 所 說 信受奉行 
T85n2895_001:1415c19	佛說要行捨身經	佛 說 要 行 捨 身 經 
