T85n2797_001:0731b01	他故。建立遮罪。制諸聲聞。令不造作。諸有情	他 故 建 立 遮 罪 制 諸 聲 聞 令 不 造 作 諸 有 情 
T85n2797_001:0731b02	類未淨信者。令生淨信。已淨信者。令倍增	類 未 淨 信 者 令 生 淨 信 已 淨 信 者 令 倍 增 
T85n2797_001:0731b03	長。於中菩薩與諸聲聞應等修學。無有差別。	長 於 中 菩 薩 與 諸 聲 聞 應 等 修 學 無有差別 
T85n2797_001:0731b04	何以故。以諸聲聞自利為勝。尚不棄捨將護	何 以 故 以 諸 聲 聞 自 利 為 勝 尚 不 棄 捨 將 護 
T85n2797_001:0731b05	他行為。令有情未得信者。信信者增長學所	他 行 為 令 有 情 未 得 信 者 信 信 者 增 長 學 所 
T85n2797_001:0731b06	學處。何況菩薩利他為勝。當知是天從多分	學 處 何 況 菩 薩 利 他 為 勝 當 知 是 天 從 多 分 
T85n2797_001:0731b07	說。若盡道理。於遮罪中亦有不共。且如威儀	說 若 盡 道 理 於 遮 罪 中 亦 有 不 共 且 如 威 儀 
T85n2797_001:0731b08	戒。若見由衣不齊有利益菩薩。此中不整衣	戒 若 見 由 衣 不 齊 有 利 益 菩 薩 此 中 不 整 衣 
T85n2797_001:0731b09	如是等類。准此可知。又瑜伽云。若諸菩薩安	如是等類 准 此 可 知 又 瑜 伽 云 若 諸 菩 薩 安 
T85n2797_001:0731b10	住菩薩淨戒律儀。如薄伽梵。於別解脫毘奈	住 菩薩淨戒 律 儀 如 薄 伽 梵 於 別 解 脫 毘 奈 
T85n2797_001:0731b11	耶中。為令聲聞少事少業少希望住建立遮	耶 中 為 令 聲 聞 少 事 少 業 少 希 望 住 建 立 遮 
T85n2797_001:0731b12	罪。制諸聲聞令不造作。於中菩薩與諸聲聞	罪 制 諸 聲 聞 令 不 造 作 於 中 菩 薩 與 諸 聲 聞 
T85n2797_001:0731b13	不應等學。何以故。以諸聲聞自利為勝不願	不 應 等 學 何 以 故 以 諸 聲 聞 自 利 為 勝 不 願 
T85n2797_001:0731b14	利他。於利他中少事少業少希望住可名為	利 他 於 利 他 中 少 事 少 業 少 希 望 住 可 名 為 
T85n2797_001:0731b15	妙。非諸菩薩利他為勝不顧自利。於利他中	妙 非 諸 菩 薩 利 他 為 勝 不 顧 自 利 於 利 他 中 
T85n2797_001:0731b16	少事少業少希望住得名為妙。如是菩薩為	少 事 少 業 少 希 望 住 得 名 為 妙 如 是 菩 薩 為 
T85n2797_001:0731b17	利他故。從非親里長者居士婆羅門等及恣	利 他 故 從 非 親 里 長 者 居 士 婆 羅 門 等 及 恣 
T85n2797_001:0731b18	施家應求百千種種衣服。觀彼有力無力隨	施 家 應 求 百 千 種 種 衣 服 觀 彼 有 力 無 力 隨 
T85n2797_001:0731b19	其所施。如應而受如說求衣求鉢亦爾。如	其 所 施 如 應 而 受 如 說 求 衣 求 鉢 亦 爾 如 
T85n2797_001:0731b20	求衣鉢。如是自求種種絲縷。令非親里為織	求 衣 鉢 如 是 自 求 種 種 絲 縷 令 非 親 里 為 織 
T85n2797_001:0731b21	作衣。為利他故。應畜種種憍世邪衣諸坐臥	作 衣 為 利 他 故 應 畜 種 種 憍 世 邪 衣 諸 坐 臥 
T85n2797_001:0731b22	具事各至百。乃至廣說。廣大差別者。如攝	具 事 各 至 百 乃至廣說 廣 大 差 別 者 如 攝 
T85n2797_001:0731b23	論云。由四種廣大故。一種種無量學處廣大	論 云 由 四 種 廣 大 故 一 種 種 無 量 學 處 廣 大 
T85n2797_001:0731b24	故。二由攝受無量福德廣大故。三由攝受一	故 二 由 攝 受 無量福德 廣 大 故 三 由 攝 受 一 
T85n2797_001:0731b25	切有情利益安樂意樂廣大故。四由建立無	切 有情利益 安樂意樂 廣 大 故 四 由 建 立 無 
T85n2797_001:0731b26	上正等菩提廣大故。釋曰。種種無量學處廣	上 正等菩提 廣 大 故 釋 曰 種 種 無 量 學 處 廣 
T85n2797_001:0731b27	大者。謂諸菩薩所學尸羅種種品類無量差	大 者 謂 諸 菩 薩 所 學 尸 羅 種 種 品 類 無 量 差 
T85n2797_001:0731b28	別。所以廣大。攝受無量福德廣大資糧者。謂	別 所 以 廣 大 攝 受 無量福德 廣 大 資 糧 者 謂 
T85n2797_001:0731b29	此尸羅能攝無量福德資糧。所以廣大。攝受	此 尸 羅 能 攝 無量福德 資 糧 所 以 廣 大 攝 受 
T85n2797_001:0731c01	一切有情利益安樂意樂廣大者。謂此尸羅	一切有情 利益安樂 意 樂 廣 大 者 謂 此 尸 羅 
T85n2797_001:0731c02	攝諸有情此世他世世出世間捨惡攝善。若	攝 諸 有 情 此世他世 世出世間 捨 惡 攝 善 若 
T85n2797_001:0731c03	因若果饒益意樂。所以廣大。建立無上正等	因 若 果 饒 益 意 樂 所 以 廣 大 建 立 無 上 正 等 
T85n2797_001:0731c04	菩提廣大者。謂此尸羅建立大菩提。所以廣	菩 提 廣 大 者 謂 此 尸 羅 建 立 大 菩 提 所 以 廣 
T85n2797_001:0731c05	大。諸聲聞等無如事是。四甚深差別者。如攝	大 諸 聲 聞 等 無 如 事 是 四 甚 深 差 別 者 如 攝 
T85n2797_001:0731c06	論云。謂諸菩薩由是品類方便善巧行殺生	論 云 謂 諸 菩 薩 由 是 品 類 方便善巧 行 殺 生 
T85n2797_001:0731c07	等十種作業。而無有罪。生無量福。速證無上	等 十 種 作 業 而 無 有 罪 生 無 量 福 速 證 無 上 
T85n2797_001:0731c08	正等菩提。又諸菩薩現行變化身語兩業。應	正等菩提 又 諸 菩 薩 現 行 變 化 身 語 兩 業 應 
T85n2797_001:0731c09	知亦是甚深尸羅。由此因緣。或作國王。示行	知 亦 是 甚 深 尸 羅 由此因緣 或 作 國 王 示 行 
T85n2797_001:0731c10	種種惱有情事。乃至廣說。釋曰。由此品類方	種 種 惱 有 情 事 乃至廣說 釋 曰 由 此 品 類 方 
T85n2797_001:0731c11	便善巧者。謂諸菩薩悲願相應後得妙智。行	便 善 巧 者 謂 諸 菩 薩 悲 願 相 應 後 得 妙 智 行 
T85n2797_001:0731c12	殺生等十種作業而無有罪等事者。謂愛樂	殺 生 等 十 種 作 業 而 無 有 罪 等 事 者 謂 愛 樂 
T85n2797_001:0731c13	善法增惡不善見諸邪見性說名後三。依止此	善 法 增 惡 不 善 見 諸 邪 見 性 說 名 後 三 依 止 此 
T85n2797_001:0731c14	故行殺等七而無有罪。生無量福。速證菩提。	故 行 殺 等 七 而 無 有 罪 生 無 量 福 速 證 菩 提 
T85n2797_001:0731c15	或行前七。不起後三。大數言十。或已伏除。為	或 行 前 七 不 起 後 三 大 數 言 十 或 已 伏 除 為 
T85n2797_001:0731c16	試彼力故。心暫起不能招苦故。無有罪。能	試 彼 力 故 心 暫 起 不 能 招 苦 故 無 有 罪 能 
T85n2797_001:0731c17	助道故。生無量福。又瑜伽說。若諸菩薩安住	助 道 故 生 無 量 福 又 瑜 伽 說 若 諸 菩 薩 安 住 
T85n2797_001:0731c18	菩薩淨戒律儀。善摧方便。為利他故。於諸性	菩薩淨戒 律 儀 善 摧 方 便 為 利 他 故 於 諸 性 
T85n2797_001:0731c19	罪少分現行。由是因緣。於菩薩戒無所違犯。	罪 少 分 現 行 由是因緣 於 菩 薩 戒 無 所 違 犯 
T85n2797_001:0731c20	生多功德。謂如菩薩見劫盜賊。為貪財故欲	生 多 功 德 謂 如 菩 薩 見 劫 盜 賊 為 貪 財 故 欲 
T85n2797_001:0731c21	殺多眾。或復欲殺大德聲聞獨覺菩薩。或復	殺 多 眾 或 復 欲 殺 大 德 聲聞獨覺 菩 薩 或 復 
T85n2797_001:0731c22	欲造多無間業。見是事已。發心思惟。我若斷	欲 造 多 無 間 業 見 是 事 已 發心思惟 我 若 斷 
T85n2797_001:0731c23	彼惡眾生命。當墮地獄。如其不斷無間業成。	彼 惡 眾 生 命 當 墮 地 獄 如 其 不 斷 無 間 業 成 
T85n2797_001:0731c24	當受大苦。我寧殺彼墮那落迦。終不令彼受	當 受 大 苦 我 寧 殺 彼 墮 那 落 迦 終 不 令 彼 受 
T85n2797_001:0731c25	無間業。如是菩薩意樂思惟。於彼眾生或以	無 間 業 如 是 菩 薩 意 樂 思 惟 於 彼 眾 生 或 以 
T85n2797_001:0731c26	善心或無記心。知此事已。為當來故。深生慚	善 心 或 無 記 心 知 此 事 已 為 當 來 故 深 生 慚 
T85n2797_001:0731c27	愧。以憐愍心而斷彼命。由此因緣。於菩薩戒	愧 以 憐 愍 心 而 斷 彼 命 由此因緣 於 菩 薩 戒 
T85n2797_001:0731c28	無所違犯。生多功德。又如菩薩見劫盜賊奪	無 所 違 犯 生 多 功 德 又 如 菩 薩 見 劫 盜 賊 奪 
T85n2797_001:0731c29	他財物。若僧伽物。窣堵波物。而取多物。執	他 財 物 若 僧 伽 物 窣 堵 波 物 而 取 多 物 執 
T85n2797_001:0732a01	為己有。從情受用。菩薩見已起憐愍心。於	為 己 有 從 情 受 用 菩 薩 見 已 起 憐 愍 心 於 
T85n2797_001:0732a02	彼有情。發生利益安樂。隨力所能逼。而奪取	彼 有 情 發 生 利益安樂 隨力所能 逼 而 奪 取 
T85n2797_001:0732a03	勿令受用。如是財故。當受長夜無義無利。由	勿 令 受 用 如 是 財 故 當 受 長 夜 無義無利 由 
T85n2797_001:0732a04	此因能所奪財寶。若僧伽物還復僧伽。乃至	此 因 能 所 奪 財 寶 若 僧 伽 物 還 復 僧 伽 乃 至 
T85n2797_001:0732a05	廣說。又如菩薩處在居家。見有母已現無	廣 說 又 如 菩 薩 處 在 居 家 見 有 母 已 現 無 
T85n2797_001:0732a06	繫屬。習婬欲法繼心菩薩求非梵行。菩薩見	繫 屬 習 婬 欲 法 繼 心 菩 薩 求 非 梵 行 菩 薩 見 
T85n2797_001:0732a07	已作意思惟。勿令心恚多生非福。若隨其欲	已 作意思惟 勿 令 心 恚 多 生 非 福 若 隨 其 欲 
T85n2797_001:0732a08	便得自在方便安處。令種善根。亦當令其捨	便 得 自 在 方 便 安 處 令 種 善 根 亦 當 令 其 捨 
T85n2797_001:0732a09	不善業。住慈愍心。行非梵行。雖習如是穢	不 善 業 住 慈 愍 心 行非梵行 雖 習 如 是 穢 
T85n2797_001:0732a10	污之法。而無所犯多生功德。出家菩薩。為護	污 之 法 而 無 所 犯 多 生 功 德 出 家 菩 薩 為 護 
T85n2797_001:0732a11	聲聞。聖所教誡。令不壞滅。一切不應行非梵	聲 聞 聖 所 教 誡 令 不 壞 滅 一 切 不 應 行 非 梵 
T85n2797_001:0732a12	行。又如菩薩為多有情解脫命難。乃至剜眼	行 又 如 菩 薩 為 多 有 情 解 脫 命 難 乃 至 剜 眼 
T85n2797_001:0732a13	等難。雖諸菩薩為自命難亦不正知說於妄	等 難 雖 諸 菩 薩 為 自 命 難 亦 不 正 知 說 於 妄 
T85n2797_001:0732a14	語。然為救脫彼有情故。知而思惟故說妄語。	語 然 為 救 脫 彼 有 情 故 知 而 思 惟 故 說 妄 語 
T85n2797_001:0732a15	以要言之。菩薩唯觀有情義利非無利義自	以要言之 菩 薩 唯 觀 有情義利 非 無 利 義 自 
T85n2797_001:0732a16	無染心。唯為饒益諸有情故。覆相正知而說	無 染 心 唯 為 饒 益 諸 有 情 故 覆 相 正 知 而 說 
T85n2797_001:0732a17	異語。說是語時。於菩薩戒無所違犯。生多功	異 語 說 是 語 時 於 菩 薩 戒 無 所 違 犯 生 多 功 
T85n2797_001:0732a18	德。乃至廣說。決定毘尼經云。佛告憂波離。	德 乃至廣說 決定毘尼 經 云 佛 告 憂 波 離 
T85n2797_001:0732a19	汝今當知。聲聞乘人有異方便。有異深心。持	汝 今 當 知 聲 聞 乘 人 有 異 方 便 有 異 深 心 持 
T85n2797_001:0732a20	清淨戒。菩薩乘人有異方便。有異深心。持清	清 淨 戒 菩 薩 乘 人 有 異 方 便 有 異 深 心 持 清 
T85n2797_001:0732a21	淨戒。憂波離。聲聞乘人雖淨持戒。於菩薩乘	淨 戒 憂 波 離 聲 聞 乘 人 雖 淨 持 戒 於 菩 薩 乘 
T85n2797_001:0732a22	不名淨戒。菩薩乘人雖名淨戒。於聲聞乘人	不 名 淨 戒 菩 薩 乘 人 雖 名 淨 戒 於 聲 聞 乘 人 
T85n2797_001:0732a23	不名淨戒。云何名為聲聞乘人雖淨持戒。於	不 名 淨 戒 云 何 名 為 聲 聞 乘 人 雖 淨 持 戒 於 
T85n2797_001:0732a24	菩薩乘人不名淨戒。優波離。聲聞乘人不應	菩 薩 乘 人 不 名 淨 戒 優 波 離 聲 聞 乘 人 不 應 
T85n2797_001:0732a25	乃至一念起於一念欲更受身。是則名為聲	乃 至 一 念 起 於 一 念 欲 更 受 身 是 則 名 為 聲 
T85n2797_001:0732a26	聞乘人清淨持戒。於菩薩乘最大破戒。名不	聞 乘 人 清 淨 持 戒 於 菩 薩 乘 最 大 破 戒 名 不 
T85n2797_001:0732a27	清淨。解云。謂諸菩薩有利益處。方便受身。起	清 淨 解 云 謂 諸 菩 薩 有 利 益 處 方 便 受 身 起 
T85n2797_001:0732a28	種種欲。攝受有情。出不善處。安置善處。答	種 種 欲 攝受有情 出 不 善 處 安 置 善 處 答 
T85n2797_001:0732a29	諸菩薩不以其欲攝受有情。棄捨有情。即是	諸 菩 薩 不 以 其 欲 攝受有情 棄 捨 有 情 即 是 
T85n2797_001:0732b01	破戒。此中意說。在家菩薩非出家菩薩。出家	破 戒 此 中 意 說 在 家 菩 薩 非 出 家 菩 薩 出 家 
T85n2797_001:0732b02	菩薩為護聖教。是故不得行非梵行。又云。優	菩 薩 為 護 聖 教 是 故 不 得 行非梵行 又 云 優 
T85n2797_001:0732b03	波離。菩薩乘人。於無量劫堪忍受身。不生厭	波 離 菩 薩 乘 人 於 無 量 劫 堪 忍 受 身 不 生 厭 
T85n2797_001:0732b04	患。是則名為菩薩乘人清淨持戒。於聲聞乘	患 是 則 名 為 菩 薩 乘 人 清 淨 持 戒 於 聲 聞 乘 
T85n2797_001:0732b05	最大破戒。不名清淨。云何名為菩薩乘人持	最 大 破 戒 不 名 清 淨 云 何 名 為 菩 薩 乘 人 持 
T85n2797_001:0732b06	開通戒。聲聞乘人持不開通戒。優波離。菩薩	開 通 戒 聲 聞 乘 人 持 不 開 通 戒 優 波 離 菩 薩 
T85n2797_001:0732b07	乘人以初日分有所犯戒。日中分思惟當得	乘 人 以 初 日 分 有 所 犯 戒 日 中 分 思 惟 當 得 
T85n2797_001:0732b08	一切種智。菩薩爾時不破戒身。以日中分有	一切種智 菩 薩 爾 時 不 破 戒 身 以 日 中 分 有 
T85n2797_001:0732b09	所犯戒。於日後分思惟當得一切種智。菩薩	所 犯 戒 於 日 後 分 思 惟 當 得 一切種智 菩 薩 
T85n2797_001:0732b10	爾時不破戒身。廣說乃至以後夜分有所犯	爾 時 不 破 戒 身 廣說乃至 以 後 夜 分 有 所 犯 
T85n2797_001:0732b11	戒。於日初分思惟。當得一切種智。菩薩爾時	戒 於 日 初 分 思 惟 當 得 一切種智 菩 薩 爾 時 
T85n2797_001:0732b12	不破戒身。以是義故。菩薩乘人持開通戒。聲	不 破 戒 身 以是義故 菩 薩 乘 人 持 開 通 戒 聲 
T85n2797_001:0732b13	聞乘人持不開通戒。菩薩不應生大慚愧。亦	聞 乘 人 持 不 開 通 戒 菩 薩 不 應 生 大 慚 愧 亦 
T85n2797_001:0732b14	復不應生大悔纏。優波離。聲聞乘人數數犯	復 不 應 生 大 悔 纏 優 波 離 聲 聞 乘 人 數 數 犯 
T85n2797_001:0732b15	罪。即時破失聲聞戒身。所以者何。聲聞乘人。	罪 即 時 破 失 聲 聞 戒 身 所以者何 聲 聞 乘 人 
T85n2797_001:0732b16	應當持戒斷一切結。如救頭燃。所有深心為	應 當 持 戒 斷 一 切 結 如 救 頭 燃 所 有 深 心 為 
T85n2797_001:0732b17	涅槃故。廣說乃至。優波離。白佛言。世尊。或	涅 槃 故 廣說乃至 優 波 離 白 佛 言 世 尊 或 
T85n2797_001:0732b18	有欲相應心而犯於戒。有癡相應心而犯於	有 欲 相 應 心 而 犯 於 戒 有 癡 相 應 心 而 犯 於 
T85n2797_001:0732b19	戒。世尊。菩薩犯戒於欲相應心嗔相應心癡	戒 世 尊 菩 薩 犯 戒 於 欲 相 應 心 嗔 相 應 心 癡 
T85n2797_001:0732b20	相應心。何者為重。爾時世尊告優波離。若	相 應 心 何 者 為 重 爾 時 世 尊 告 優 波 離 若 
T85n2797_001:0732b21	有菩薩如恒河沙劫欲相應心而犯於戒。或	有 菩 薩 如 恒 河 沙 劫 欲 相 應 心 而 犯 於 戒 或 
T85n2797_001:0732b22	有菩薩因一嗔以而犯於戒等住菩薩大乘之	有 菩 薩 因 一 嗔 以 而 犯 於 戒 等 住 菩 薩 大 乘 之 
T85n2797_001:0732b23	道。因嗔犯者當知最重。所以者何。因嗔恚	道 因 嗔 犯 者 當 知 最 重 所以者何 因 嗔 恚 
T85n2797_001:0732b24	故。能捨眾生。因貪欲故。於諸眾生而生親愛。	故 能 捨 眾 生 因 貪 欲 故 於 諸 眾 生 而 生 親 愛 
T85n2797_001:0732b25	優波離所有諸結能生親愛。菩薩於此不應	優 波 離 所 有 諸 結 能 生 親 愛 菩 薩 於 此 不 應 
T85n2797_001:0732b26	生畏。所有諸結能捨眾生。菩薩於此應生不	生 畏 所 有 諸 結 能 捨 眾 生 菩 薩 於 此 應 生 不 
T85n2797_001:0732b27	畏。廣說乃至。大乘之人因欲犯者。我說是	畏 廣說乃至 大 乘 之 人 因 欲 犯 者 我 說 是 
T85n2797_001:0732b28	人不名為犯。因嗔犯者我說是人名為大犯。	人 不 名 為 犯 因 嗔 犯 者 我 說 是 人 名 為 大 犯 
T85n2797_001:0732b29	名大過患。名大墮落於佛法中。是大留難。若	名 大 過 患 名 大 墮 落 於佛法中 是 大 留 難 若 
T85n2797_001:0732c01	有菩薩無有方便。欲相應心而犯於戒。生於	有 菩 薩 無 有 方 便 欲 相 應 心 而 犯 於 戒 生 於 
T85n2797_001:0732c02	怖畏。於嗔犯戒不生怖畏。若有菩薩而有方	怖 畏 於 嗔 犯 戒 不 生 怖 畏 若 有 菩 薩 而 有 方 
T85n2797_001:0732c03	便。恚相應心而犯於戒。而生怖畏。欲相應心	便 恚 相 應 心 而 犯 於 戒 而 生 怖 畏 欲 相 應 心 
T85n2797_001:0732c04	而犯於戒。不生怖畏。又本業經說。嗔心犯戒	而 犯 於 戒 不 生 怖 畏 又 本 業 經 說 嗔 心 犯 戒 
T85n2797_001:0732c05	即便失戒　第五止作差別者。謂聲聞戒多	即 便 失 戒 第 五 止 作 差 別 者 謂 聲 聞 戒 多 
T85n2797_001:0732c06	是止持。雖有作持。而止持為宗。若菩薩戒通	是 止 持 雖 有 作 持 而 止 持 為 宗 若 菩 薩 戒 通 
T85n2797_001:0732c07	止作持。言止持者。謂聲聞共戒。言作持者	止 作 持 言 止 持 者 謂 聲 聞 共 戒 言 作 持 者 
T85n2797_001:0732c08	不共聲聞。如不往聽法即有所犯。往聽無犯。	不 共 聲 聞 如 不 往 聽 法 即 有 所 犯 往 聽 無 犯 
T85n2797_001:0732c09	又作看病即無所犯。不看即犯。如是等類。作	又 作 看 病 即 無 所 犯 不 看 即 犯 如是等類 作 
T85n2797_001:0732c10	即無犯。止即有犯。復有差別。謂聲聞戒准遮	即 無 犯 止 即 有 犯 復 有 差 別 謂 聲 聞 戒 准 遮 
T85n2797_001:0732c11	身語。若菩薩戒通遮三業　第六因差別者。	身 語 若 菩 薩 戒 通 遮 三 業 第 六 因 差 別 者 
T85n2797_001:0732c12	謂菩薩於大菩提願。大悲為因。第七果差別	謂 菩 薩 於 大 菩 提 願 大 悲 為 因 第 七 果 差 別 
T85n2797_001:0732c13	者。謂菩薩戒。無上大菩提以為果故　第八	者 謂 菩 薩 戒 無 上 大 菩 提 以 為 果 故 第 八 
T85n2797_001:0732c14	意樂差別。不共二乘何等意樂。謂有六種。一	意 樂 差 別 不 共 二 乘 何 等 意 樂 謂 有 六 種 一 
T85n2797_001:0732c15	無厭意樂。二廣大意樂。三歡喜意樂。四恩德	無 厭 意 樂 二 廣 大 意 樂 三 歡 喜 意 樂 四 恩 德 
T85n2797_001:0732c16	意樂。五無染意樂。六善好意樂。無厭意樂	意 樂 五 無 染 意 樂 六 善 好 意 樂 無 厭 意 樂 
T85n2797_001:0732c17	者。謂諸菩薩假使經於殑伽沙等生。是一一	者 謂 諸 菩 薩 假 使 經 於 殑 伽 沙 等 生 是 一 一 
T85n2797_001:0732c18	生殑伽沙等大劫壽量。於此長時諸資生具常	生 殑 伽 沙 等 大 劫 壽 量 於 此 長 時 諸 資 生 具 常 
T85n2797_001:0732c19	所匱之。三千大千世界滿中盛火恒在其中。	所 匱 之 三千大千世界 滿 中 盛 火 恒 在 其 中 
T85n2797_001:0732c20	行住坐臥。雖能修習一剎那戒。如是修習所	行住坐臥 雖 能 修 習 一 剎 那 戒 如 是 修 習 所 
T85n2797_001:0732c21	有戒聚。究竟滿足。能證無上正等菩提。名	有 戒 聚 究 竟 滿 足 能 證無上正等菩提 名 
T85n2797_001:0732c22	為菩薩無厭意樂。廣大意樂者。謂諸菩薩修	為 菩 薩 無 厭 意 樂 廣 大 意 樂 者 謂 諸 菩 薩 修 
T85n2797_001:0732c23	習戒時。展轉相續。無一剎那有退有斷。乃	習 戒 時 展轉相續 無 一 剎 那 有 退 有 斷 乃 
T85n2797_001:0732c24	至究竟坐菩提座。是名菩薩廣大意樂。歡喜	至 究 竟 坐菩提座 是 名 菩 薩 廣 大 意 樂 歡 喜 
T85n2797_001:0732c25	意樂者。謂諸菩薩修習戒時。於此所攝諸有	意 樂 者 謂 諸 菩 薩 修 習 戒 時 於 此 所 攝 諸 有 
T85n2797_001:0732c26	情所生大歡喜。是諸有情由此所攝。雖生歡	情 所 生大歡喜 是 諸 有 情 由 此 所 攝 雖 生 歡 
T85n2797_001:0732c27	喜。猶不能及。是名菩薩歡喜意樂。恩德意	喜 猶 不 能 及 是 名 菩 薩 歡 喜 意 樂 恩 德 意 
T85n2797_001:0732c28	樂者。謂諸菩薩修習戒時。觀此所攝一切有	樂 者 謂 諸 菩 薩 修 習 戒 時 觀 此 所 攝 一 切 有 
T85n2797_001:0732c29	情。於我己身有大恩德。不見己身。於彼有	情 於 我 己 身 有 大 恩 德 不 見 己 身 於 彼 有 
T85n2797_001:0733a01	恩由。資助我無上菩提故。是名菩薩恩德意	恩 由 資 助 我 無上菩提 故 是 名 菩 薩 恩 德 意 
T85n2797_001:0733a02	樂。無染意樂者。謂諸菩薩修習戒時。雖於無	樂 無 染 意 樂 者 謂 諸 菩 薩 修 習 戒 時 雖 於 無 
T85n2797_001:0733a03	量諸有情所興大戒福而不希報恩。當來果	量 諸 有 情 所 興 大 戒 福 而 不 希 報 恩 當 來 果 
T85n2797_001:0733a04	報是名菩薩無染意樂。善好意樂者。謂諸菩	報 是 名 菩 薩 無 染 意 樂 善 好 意 樂 者 謂 諸 菩 
T85n2797_001:0733a05	薩修習戒時。所有果報施諸有情。不自為己。	薩 修 習 戒 時 所 有 果 報 施 諸 有 情 不 自 為 己 
T85n2797_001:0733a06	又以此福。共諸有情。迴向無上正等菩提。是	又 以 此 福 共 諸 有 情 迴 向 無上正等菩提 是 
T85n2797_001:0733a07	名菩薩善好意樂(具如對法論十二)。	名 菩 薩 善 好 意 樂 具 如 對 法 論 十 二 
T85n2797_001:0733a08	第八犯已還淨。此有二種。一犯他勝處法。二	第 八 犯 已 還 淨 此 有 二 種 一 犯 他勝處法 二 
T85n2797_001:0733a09	犯輕垢。如下經說。若有犯十戒者。應教懺悔。	犯 輕 垢 如 下 經 說 若 有 犯 十 戒 者 應 教 懺 悔 
T85n2797_001:0733a10	在佛菩薩形像前。日日六時誦十重四十八	在 佛 菩 薩 形 像 前 日 日 六 時 誦 十 重 四 十 八 
T85n2797_001:0733a11	輕戒。發到禮三世千佛。須見好相。若一七	輕 戒 發 到 禮 三 世 千 佛 須 見 好 相 若 一 七 
T85n2797_001:0733a12	日二三七日。乃至一年。要見好相。見好相者	日 二 三 七 日 乃 至 一 年 要 見 好 相 見 好 相 者 
T85n2797_001:0733a13	佛來摩頂。若見光明花種種異相。便得罪滅。	佛 來 摩 頂 若 見 光 明 花 種 種 異 相 便 得 罪 滅 
T85n2797_001:0733a14	若無好相。雖懺無益。是人現身亦不得戒。	若 無 好 相 雖 懺 無 益 是 人 現 身 亦 不 得 戒 
T85n2797_001:0733a15	而得增益受戒。若犯四十八輕戒者。對手懺	而 得 增 益 受 戒 若 犯 四 十 八 輕 戒 者 對 手 懺 
T85n2797_001:0733a16	悔滅。若依瑜伽論。與此少異。故彼四十說。若	悔 滅 若 依 瑜 伽 論 與 此 少 異 故 彼 四 十 說 若 
T85n2797_001:0733a17	用耎中品纏毀犯四種他勝處法。不捨菩薩	用 耎 中 品 纏 毀 犯 四 種 他勝處法 不 捨 菩 薩 
T85n2797_001:0733a18	戒上品纏犯。即名為捨。若諸菩薩毀犯四種	戒 上 品 纏 犯 即 名 為 捨 若 諸 菩 薩 毀 犯 四 種 
T85n2797_001:0733a19	他勝處法。數數現行而無慚愧。深生愛樂。見	他勝處法 數數現行 而 無 慚 愧 深生愛樂 見 
T85n2797_001:0733a20	是功德。當知說名上品纏犯。非諸菩薩暫一	是 功 德 當 知 說 名 上 品 纏 犯 非 諸 菩 薩 暫 一 
T85n2797_001:0733a21	現行他勝處法。便捨菩薩淨戒律儀。如諸苾	現 行 他勝處法 便 捨 菩薩淨戒 律 儀 如 諸 苾 
T85n2797_001:0733a22	芻犯他勝處法。即便棄捨別解脫戒。若諸菩	芻 犯 他勝處法 即 便 棄 捨 別解脫戒 若 諸 菩 
T85n2797_001:0733a23	薩由此毀犯棄捨菩薩淨戒律儀。於現法中	薩 由 此 毀 犯 棄 捨 菩薩淨戒 律 儀 於現法中 
T85n2797_001:0733a24	堪任更受非不堪任。如苾芻住別解脫戒犯	堪 任 更 受 非 不 堪 任 如 苾 芻 住 別解脫戒 犯 
T85n2797_001:0733a25	他勝法。於現法中不任更受。又彼論四十一	他 勝 法 於現法中 不 任 更 受 又 彼 論 四 十 一 
T85n2797_001:0733a26	說。若諸菩薩以上品纏違犯如上他勝處法。	說 若 諸 菩 薩 以 上 品 纏 違 犯 如 上 他勝處法 
T85n2797_001:0733a27	失戒律儀。應當更受。若中品纏違犯如上他	失 戒 律 儀 應 當 更 受 若 中 品 纏 違 犯 如 上 他 
T85n2797_001:0733a28	勝處法。應對於三補特伽羅。或過是數。應	勝 處 法 應 對 於 三 補 特 伽 羅 或 過 是 數 應 
T85n2797_001:0733a29	如發露除惡作法先當稱述所犯事。名應作	如 發 露 除 惡 作 法 先 當 稱 述 所 犯 事 名 應 作 
T85n2797_001:0733b01	是說長老專志。或言。大德。我如是名違越菩	是 說 長 老 專 志 或 言 大 德 我 如 是 名 違 越 菩 
T85n2797_001:0733b02	薩毘奈耶法。如所稱事犯惡作罪。餘如苾芻	薩 毘 奈 耶 法 如 所 稱 事 犯 惡 作 罪 餘 如 苾 芻 
T85n2797_001:0733b03	發露悔滅惡作罪法。應如是說。若下品纏違	發露悔滅 惡 作 罪 法 應如是說 若 下 品 纏 違 
