X15n0300_008:0194b21	前既爾。後位可知。	前 既 爾 後 位 可 知 
X15n0300_008:0194b22	阿難是善男子盡是清淨(至)次成四種妙圓加行。	阿 難 是 善 男 子 盡 是 清 淨 至 次 成 四 種 妙 圓 加 行 
X15n0300_008:0194b23	此結前起後也。四十一心者。乾慧一。信住行向各	此 結 前 起 後 也 四 十 一 心 者 乾 慧 一 信 住 行 向 各 
X15n0300_008:0194b24	十。小乘通教皆有四加。而非妙非圓。故此特標妙	十 小 乘 通 教 皆 有 四 加 而 非 妙 非 圓 故 此 特 標 妙 
X15n0300_008:0194c01	圓加行。	圓 加 行 
X15n0300_008:0194c02	即以佛覺用為己心(至)欲然其木名為煖地。	即 以 佛 覺 用 為 己 心 至 欲 然 其 木 名 為 煖 地 
X15n0300_008:0194c03	佛覺。本覺也。前法界量滅。平等無二。無二之覺。即	佛 覺 本 覺 也 前 法 界 量 滅 平 等 無 二 無 二 之 覺 即 
X15n0300_008:0194c04	是佛覺。今將登地。故仍用佛覺為己因心。復加功	是 佛 覺 今 將 登 地 故 仍 用 佛 覺 為 己 因 心 復 加 功 
X15n0300_008:0194c05	行以求親證。將證未證。故云若出未出。火喻果覺。	行 以 求 親 證 將 證 未 證 故 云 若 出 未 出 火 喻 果 覺 
X15n0300_008:0194c06	本喻因心。鑽喻加行。猶未登地。故譬鑽火方得煖	本 喻 因 心 鑽 喻 加 行 猶 未 登 地 故 譬 鑽 火 方 得 煖 
X15n0300_008:0194c07	相。	相 
X15n0300_008:0194c08	又以己心成佛所履(至)下有微礙名為頂地。	又 以 己 心 成 佛 所 履 至 下 有 微 礙 名 為 頂 地 
X15n0300_008:0194c09	前以佛覺為己因心。此以己心欲成佛所履。佛所	前 以 佛 覺 為 己 因 心 此 以 己 心 欲 成 佛 所 履 佛 所 
X15n0300_008:0194c10	履者。即十地也。以一切諸佛皆由十地而登覺故。	履 者 即 十 地 也 以 一切諸佛 皆 由 十 地 而 登 覺 故 
X15n0300_008:0194c11	今行人志趨十地。即是欲成佛所履也。雖然。而障	今 行 人 志 趨 十 地 即 是 欲 成 佛 所 履 也 雖 然 而 障 
X15n0300_008:0194c12	初地無明未盡。則初地果若依未依。故譬登高山	初 地 無 明 未 盡 則 初 地 果 若 依 未 依 故 譬 登 高 山 
X15n0300_008:0194c13	身入虗空而下有微礙也。然已到頂。少需[打丁+雙]進。則	身 入 虗 空 而 下 有 微 礙 也 然 已 到 頂 少 需 [打丁雙] 進 則 
X15n0300_008:0194c14	微礙除矣。	微 礙 除 矣 
X15n0300_008:0194c15	心佛二同善得中道如忍事人非懷非出名為忍地。	心 佛 二 同 善 得 中 道 如 忍 事 人 非 懷 非 出 名 為 忍 地 
X15n0300_008:0194c16	行人之心同於佛心。曰二同。既同佛心。善得中道	行 人 之 心 同 於 佛 心 曰 二 同 既 同 佛 心 善 得 中 道 
X15n0300_008:0194c17	矣。然此雖得而不見可得。不見可得。則亦無所說。	矣 然 此 雖 得 而 不 見 可 得 不 見 可 得 則 亦 無 所 說 
X15n0300_008:0194c18	如忍事人。不見可懷。亦不出說也。	如 忍 事 人 不 見 可 懷 亦 不 出 說 也 
X15n0300_008:0194c19	數量銷滅迷覺中道二無所目名世第一地。	數 量 銷 滅 迷 覺 中 道 二 無 所 目 名 世 第 一 地 
X15n0300_008:0194c20	前位謂之二同。已墮數量。謂之善得中道。即覺中	前 位 謂 之 二 同 已 墮 數 量 謂 之 善 得 中 道 即 覺 中 
X15n0300_008:0194c21	道也。有覺則必有迷。至此數量迷覺俱不可得。脫	道 也 有 覺 則 必 有 迷 至 此 數 量 迷 覺 俱 不 可 得 脫 
X15n0300_008:0194c22	世情量。猶名世第一。若進十地。極乎妙覺。圓滿菩	世 情 量 猶 名 世 第 一 若 進 十 地 極 乎 妙 覺 圓 滿 菩 
X15n0300_008:0194c23	提。歸無所得。乃出世第一也。	提 歸 無 所 得 乃 出 世 第 一 也 
X15n0300_008:0194c24	十地者。蘊積前法。至於成實。一切佛法。依此發生。	十 地 者 蘊 積 前 法 至 於 成 實 一切佛法 依 此 發 生 
X15n0300_008:0195a01	故謂之地。自十信已來。位皆躡迹相資。直趨妙覺。	故 謂 之 地 自 十 信 已 來 位 皆 躡 迹 相 資 直 趨 妙 覺 
X15n0300_008:0195a02	於中不無斷證。是皆不斷而斷。不證而證也。	於 中 不 無 斷 證 是 皆 不 斷 而 斷 不 證 而 證 也 
X15n0300_008:0195a03	阿難是善男子於大菩提(至)盡佛境界名歡喜地。	阿 難 是 善 男 子 於 大 菩 提 至 盡 佛 境 界 名 歡 喜 地 
X15n0300_008:0195a04	下文云圓滿菩提歸無所得。以無所得為得大菩	下 文 云 圓 滿 菩 提 歸 無 所 得 以 無 所 得 為 得 大 菩 
X15n0300_008:0195a05	提。今既迷覺中道二無所目。故於大菩提善得通	提 今 既 迷 覺 中 道 二 無 所 目 故 於 大 菩 提 善 得 通 
X15n0300_008:0195a06	達也。盡。猶到也。佛境界者。即大菩提也。由於大菩	達 也 盡 猶 到 也 佛 境 界 者 即 大 菩 提 也 由 於 大 菩 
X15n0300_008:0195a07	提善得通達。故云覺通如來盡佛境界。由是法喜	提 善 得 通 達 故 云 覺 通 如 來 盡 佛 境 界 由 是 法 喜 
X15n0300_008:0195a08	復增。故復名歡喜。	復 增 故 復 名 歡 喜 
X15n0300_008:0195a09	異性入同同性亦滅名離垢地。	異 性 入 同 同 性 亦 滅 名 離 垢 地 
X15n0300_008:0195a10	通大菩提。盡佛境界。則一切障礙即究竟覺。眾生	通 大 菩 提 盡 佛 境 界 則 一 切 障 礙 即 究 竟 覺 眾 生 
X15n0300_008:0195a11	國土同一法性。是異性入同也。然見異見同。還是	國 土 同 一 法 性 是 異 性 入 同 也 然 見 異 見 同 還 是 
X15n0300_008:0195a12	情垢。至於同性亦滅。乃名離垢。	情 垢 至 於 同 性 亦 滅 乃 名 離 垢 
X15n0300_008:0195a13	淨極明生名發光地明極覺滿名燄慧地。	淨 極 明 生 名 發 光 地 明 極 覺 滿 名 燄 慧 地 
X15n0300_008:0195a14	情見淨極。妙覺明生。故名發光。明極覺滿。如大火	情 見 淨 極 妙 覺 明 生 故 名 發 光 明 極 覺 滿 如 大 火 
X15n0300_008:0195a15	聚。同異緣影。悉皆爍絕。故名燄慧。	聚 同 異 緣 影 悉 皆 爍 絕 故 名 燄 慧 
X15n0300_008:0195a16	一切同異所不能至名難勝地。	一 切 同 異 所 不 能 至 名 難 勝 地 
X15n0300_008:0195a17	由前燄慧爍絕。故一切同異所不能至。以下地不	由 前 燄 慧 爍 絕 故 一 切 同 異 所 不 能 至 以 下 地 不 
X15n0300_008:0195a18	能勝。故云難勝。	能 勝 故 云 難 勝 
X15n0300_008:0195a19	無為真如性淨明露名現前地盡真如際名遠行地。	無 為 真 如 性 淨 明 露 名 現 前 地 盡 真 如 際 名 遠 行 地 
X15n0300_008:0195a20	前既明極覺滿。同異不至。則真如淨性明露現前	前 既 明 極 覺 滿 同 異 不 至 則 真 如 淨 性 明 露 現 前 
X15n0300_008:0195a21	矣。真如既現。則迥超極造。以盡真如之際。故名遠	矣 真 如 既 現 則 迥 超 極 造 以 盡 真 如 之 際 故 名 遠 
X15n0300_008:0195a22	行。以真如是無際之際。理既無際。行豈近乎。	行 以 真 如 是 無 際 之 際 理 既 無 際 行 豈 近 乎 
X15n0300_008:0195a23	一真如心名不動地。	一 真 如 心 名 不 動 地 
X15n0300_008:0195a24	既盡其際。乃全得其體。一真凝常。故名不動。	既 盡 其 際 乃 全 得 其 體 一 真 凝 常 故 名 不 動 
X15n0300_008:0195b01	發真如用名善慧地。	發 真 如 用 名 善 慧 地 
X15n0300_008:0195b02	既得真體。斯發真用。凡所照應。無所不真。無所不	既 得 真 體 斯 發 真 用 凡 所 照 應 無 所 不 真 無 所 不 
X15n0300_008:0195b03	如。故名善慧。華嚴名此菩薩。具四無礙智。作大法	如 故 名 善 慧 華 嚴 名 此 菩 薩 具 四無礙智 作 大 法 
X15n0300_008:0195b04	師。演說無量阿僧祇句義。無有窮盡。故名發真如	師 演 說 無量阿僧祇 句 義 無 有 窮 盡 故 名 發 真 如 
X15n0300_008:0195b05	用。	用 
X15n0300_008:0195b06	阿難是諸菩薩從此已往(至)亦目此地名修習位。	阿 難 是 諸 菩 薩 從 此 已 往 至 亦 目 此 地 名 修 習 位 
X15n0300_008:0195b07	此結前顯後也。自初發信。至於登地。皆修習之事。	此 結 前 顯 後 也 自 初 發 信 至 於 登 地 皆 修 習 之 事 
X15n0300_008:0195b08	而此善慧已超八地無功用道。智悲並圓。則修習	而 此 善 慧 已 超 八 地 無 功 用 道 智 悲 並 圓 則 修 習 
X15n0300_008:0195b09	之功終畢於是。故名修習以結十地之因。次後乃	之 功 終 畢 於 是 故 名 修 習 以 結 十 地 之 因 次 後 乃 
X15n0300_008:0195b10	十地之果。無復修習矣。問。後位既無修習。復有斷	十 地 之 果 無 復 修 習 矣 問 後 位 既 無 修 習 復 有 斷 
X15n0300_008:0195b11	障之事。何耶。答。此明智悲功終。而云無復修習。若	障 之 事 何 耶 答 此 明 智 悲 功 終 而 云 無 復 修 習 若 
X15n0300_008:0195b12	論斷障。則等覺猶是修習。唯至妙覺乃名無學也。	論 斷 障 則 等 覺 猶 是 修 習 唯 至 妙 覺 乃 名 無 學 也 
X15n0300_008:0195b13	慈陰妙雲覆涅槃海名法雲地。	慈 陰 妙 雲 覆 涅 槃 海 名 法 雲 地 
X15n0300_008:0195b14	慈陰妙雲。十地之德也。十地果滿。智悲功圓。無復	慈 陰 妙 雲 十 地 之 德 也 十 地 果 滿 智 悲 功 圓 無 復 
X15n0300_008:0195b15	自利。純是利他。故以無緣慈。興大法雲。普覆眾生	自 利 純 是 利 他 故 以 無 緣 慈 興 大 法 雲 普 覆 眾 生 
X15n0300_008:0195b16	大涅槃海。名法雲地。	大 涅 槃 海 名 法 雲 地 
X15n0300_008:0195b17	如來逆流如是菩薩順行而至覺際入交名為等覺。	如 來 逆 流 如 是 菩 薩 順 行 而 至 覺 際 入 交 名 為 等 覺 
X15n0300_008:0195b18	前乾慧地云未與如來法流水接。至此順逆交際。	前 乾 慧 地 云 未 與 如 來 法 流 水 接 至 此 順 逆 交 際 
X15n0300_008:0195b19	即與如來法流水接也。法流。即果法聖智。如來逆	即 與 如 來 法 流 水 接 也 法 流 即 果 法 聖 智 如 來 逆 
X15n0300_008:0195b20	流者。謂從真起應。返入生死。從果入因也。如是下。	流 者 謂 從 真 起 應 返 入 生 死 從 果 入 因 也 如 是 下 
X15n0300_008:0195b21	謂從因入果。從生死入涅槃。順流而入。故云順行	謂 從 因 入 果 從 生 死 入 涅 槃 順 流 而 入 故 云 順 行 
X15n0300_008:0195b22	而至。起應之始。行因之極。順逆交際。故云入交。即	而 至 起 應 之 始 行 因 之 極 順 逆 交 際 故 云 入 交 即 
X15n0300_008:0195b23	於此處立為等覺。斯則十地菩薩混俗利生。與如	於 此 處 立 為 等 覺 斯 則 十地菩薩 混 俗 利 生 與 如 
X15n0300_008:0195b24	來同。所趨逆順。與如來異。蓋如來逆流。出同萬物。	來 同 所 趨 逆 順 與 如 來 異 蓋 如 來 逆 流 出 同 萬 物 
X15n0300_008:0195c01	菩薩順流。入趨妙覺。此雖齊等。未極於妙。至下本	菩 薩 順 流 入 趨 妙 覺 此 雖 齊 等 未 極 於 妙 至 下 本 
X15n0300_008:0195c02	因究盡。獲初乾慧。方盡妙覺也。	因 究 盡 獲 初 乾 慧 方 盡 妙 覺 也 
X15n0300_008:0195c03	阿難從乾慧心至等覺已(至)金剛心中初乾慧地。	阿 難 從 乾 慧 心 至 等 覺 已 至 金 剛 心 中 初 乾 慧 地 
X15n0300_008:0195c04	總牒前文。明窮盡妙覺也。初二句。總牒前文。是覺	總 牒 前 文 明 窮 盡 妙 覺 也 初 二 句 總 牒 前 文 是 覺 
X15n0300_008:0195c05	下。明至於等覺始獲初心。即窮盡妙覺也。下如是	下 明 至 於 等 覺 始 獲 初 心 即 窮 盡 妙 覺 也 下 如 是 
X15n0300_008:0195c06	重重等。不過牒結此文耳。既盡妙覺。何云是覺始	重 重 等 不 過 牒 結 此 文 耳 既 盡 妙 覺 何 云 是 覺 始 
X15n0300_008:0195c07	獲金剛心中初乾慧地。言是覺者。即等覺也。蓋等	獲 金 剛 心 中 初 乾 慧 地 言 是 覺 者 即 等 覺 也 蓋 等 
X15n0300_008:0195c08	覺所獲金剛乾慧。即初乾慧。以得初乾慧。即盡妙	覺 所 獲 金 剛 乾 慧 即 初 乾 慧 以 得 初 乾 慧 即 盡 妙 
X15n0300_008:0195c09	覺故。故涅槃云發心畢竟二不別也。	覺 故 故 涅 槃 云 發 心 畢 竟 二 不 別 也 
X15n0300_008:0195c10	如是重重單複十二方盡妙覺成無上道。	如 是 重 重 單 複 十 二 方 盡 妙 覺 成 無 上 道 
X15n0300_008:0195c11	此牒結上文也。始從乾慧。終至妙覺。單複相兼。總	此 牒 結 上 文 也 始 從 乾 慧 終 至 妙 覺 單 複 相 兼 總 
X15n0300_008:0195c12	有十二。單則有七。謂乾慧。煖。頂。忍。世第一。等覺。妙	有 十 二 單 則 有 七 謂 乾 慧 煖 頂 忍 世 第 一 等 覺 妙 
X15n0300_008:0195c13	覺。複則有五。謂信。住。行。向。地。以一一位中。自具於	覺 複 則 有 五 謂 信 住 行 向 地 以 一 一 位 中 自 具 於 
X15n0300_008:0195c14	十。故名為複。是則十一猶居等覺。惟至十二方盡	十 故 名 為 複 是 則 十 一 猶 居 等 覺 惟 至 十 二 方 盡 
X15n0300_008:0195c15	妙覺成無上道也。	妙 覺 成 無 上 道 也 
X15n0300_008:0195c16	是種種地皆以金剛(至)清淨修證漸次深入。	是 種 種 地 皆 以 金 剛 至 清 淨 修 證 漸 次 深 入 
X15n0300_008:0195c17	指前地位。以示能證止觀也。種種地。通指單複十	指 前 地 位 以 示 能 證 止 觀 也 種 種 地 通 指 單 複 十 
X15n0300_008:0195c18	二也。無位不爾。故云皆以。金剛觀察。即觀照之智。	二 也 無 位 不 爾 故 云 皆 以 金 剛 觀 察 即 觀 照 之 智 
X15n0300_008:0195c19	如幻十種深喻。即照法如幻等也。了法如此。則頓	如 幻 十 種 深 喻 即 照 法 如 幻 等 也 了 法 如 此 則 頓 
X15n0300_008:0195c20	忘情解。纖塵不立矣。以止中用觀。故云奢摩他中	忘 情 解 纖 塵 不 立 矣 以 止 中 用 觀 故 云 奢 摩 他 中 
X15n0300_008:0195c21	用諸如來毗婆舍那。由即止而觀。即觀而止。止觀	用 諸 如 來 毗 婆 舍 那 由 即 止 而 觀 即 觀 而 止 止 觀 
X15n0300_008:0195c22	不偏。故云清淨修證。由乾慧以至信。由信入住。乃	不 偏 故 云 清 淨 修 證 由 乾 慧 以 至 信 由 信 入 住 乃 
X15n0300_008:0195c23	至妙覺。故云漸次深入。十喻者。幻人。陽燄。水月。空	至 妙 覺 故 云 漸 次 深 入 十 喻 者 幻 人 陽 燄 水 月 空 
X15n0300_008:0195c24	華。谷響。乾城。夢。影。像。化也。言如來毗婆舍那者。揀	華 谷 響 乾 城 夢 影 像 化 也 言 如 來 毗 婆 舍 那 者 揀 
X15n0300_008:0196a01	異小乘也。	異 小 乘 也 
X15n0300_008:0196a02	阿難如是皆以三增進故(至)若他觀者名為邪觀。	阿 難 如 是 皆 以 三 增 進 故 至 若 他 觀 者 名 為 邪 觀 
X15n0300_008:0196a03	此結示邪正。欲人從正反邪以修證也。問。前第三	此 結 示 邪 正 欲 人 從 正 反 邪 以 修 證 也 問 前 第 三 
X15n0300_008:0196a04	增進云。是人即獲無生法忍。從是漸修。隨所發行	增 進 云 是 人 即 獲 無生法忍 從 是 漸 修 隨 所 發 行 
X15n0300_008:0196a05	安立聖位。何上云是種種地皆以金剛觀察等漸	安 立 聖 位 何 上 云 是 種 種 地 皆 以 金 剛 觀 察 等 漸 
X15n0300_008:0196a06	次深入耶。答。三增進中。云無生法忍者。即止觀不	次 深 入 耶 答 三 增 進 中 云 無生法忍 者 即 止 觀 不 
X15n0300_008:0196a07	二之心也。金剛觀察等。即止觀也。蓋一心不離止	二 之 心 也 金 剛 觀 察 等 即 止 觀 也 蓋 一 心 不 離 止 
X15n0300_008:0196a08	觀。止觀即是一心。故此結云。如是皆以三增進故。	觀 止 觀 即 是 一 心 故 此 結 云 如 是 皆 以 三 增 進 故 
X15n0300_008:0196a09	善能成就五十五位真菩提路。若作增進歷位觀	善 能 成 就 五 十 五 位 真 菩 提 路 若 作 增 進 歷 位 觀 
X15n0300_008:0196a10	者。名為正觀。若他觀者。名邪觀也。五十五位者。自	者 名 為 正 觀 若 他 觀 者 名 邪 觀 也 五 十 五 位 者 自 
X15n0300_008:0196a11	乾慧至十地是也。言菩提路者。菩提即覺也。五十	乾 慧 至 十 地 是 也 言 菩 提 路 者 菩 提 即 覺 也 五 十 
X15n0300_008:0196a12	五位。是趨覺之路。等妙二覺。是覺非路矣。	五 位 是 趨 覺 之 路 等 妙 二 覺 是 覺 非 路 矣 
X15n0300_008:0196a13	爾時文殊師利法王子(至)我及眾生云何奉持。	爾 時 文 殊 師 利 法 王 子 至 我 及 眾 生 云 何 奉 持 
X15n0300_008:0196a14	上明證果竟。此下名結經分也。正宗未終。而遽結	上 明 證 果 竟 此 下 名 結 經 分 也 正 宗 未 終 而 遽 結 
X15n0300_008:0196a15	經者。由初示密因。次開修證。而卒乎極果。垂範來	經 者 由 初 示 密 因 次 開 修 證 而 卒 乎 極 果 垂 範 來 
X15n0300_008:0196a16	世。有始有終。則經之正範畢矣。於是文殊請問經	世 有 始 有 終 則 經 之 正 範 畢 矣 於 是 文 殊 請 問 經 
X15n0300_008:0196a17	名及奉持法也。結經後文。尚屬正宗。而名助道者。	名 及 奉 持 法 也 結 經 後 文 尚 屬 正 宗 而 名 助 道 者 
X15n0300_008:0196a18	特助道而已。故於後別列。乃正助之辨也。	特 助 道 而 已 故 於 後 別 列 乃 正 助 之 辨 也 
X15n0300_008:0196a19	佛告文殊師利(至)十方如來清淨海眼。	佛 告 文 殊 師 利 至 十 方 如 來 清 淨 海 眼 
X15n0300_008:0196a20	此約所詮之理立名也。大佛頂白傘蓋無上寶印	此 約 所 詮 之 理 立 名 也 大 佛 頂 白 傘 蓋 無 上 寶 印 
X15n0300_008:0196a21	者。謂體極含覆。超情離見。即如來藏之心印也。證	者 謂 體 極 含 覆 超 情 離 見 即 如 來 藏 之 心 印 也 證 
X15n0300_008:0196a22	佛心要。必契於此。十方如來清淨海眼者。謂照窮	佛 心 要 必 契 於 此 十 方 如 來 清 淨 海 眼 者 謂 照 窮 
X15n0300_008:0196a23	剎海。淨絕纖塵。即爍迦羅之法眼也。開佛知見。必	剎 海 淨 絕 纖 塵 即 爍 迦 羅 之 法 眼 也 開 佛 知 見 必 
X15n0300_008:0196a24	資於此。實大事因緣。非小智之法。故以文殊請問。	資 於 此 實 大 事 因 緣 非 小 智 之 法 故 以 文 殊 請 問 
X15n0300_008:0196b01	亦名救護親因(至)亦名如來密因修證了義。	亦 名 救 護 親 因 至 亦 名 如 來 密 因 修 證 了 義 
X15n0300_008:0196b02	阿難為親。摩登為因。舉斯二者。明有緣皆度也。言	阿 難 為 親 摩 登 為 因 舉 斯 二 者 明 有 緣 皆 度 也 言 
X15n0300_008:0196b03	得菩提心等者。謂無上正覺。由此經得。一切智海。	得 菩 提 心 等 者 謂 無上正覺 由 此 經 得 一 切 智 海 
X15n0300_008:0196b04	由此經入。此約所化之用立名也。亦名如來下。約	由 此 經 入 此 約 所 化 之 用 立 名 也 亦 名 如 來 下 約 
X15n0300_008:0196b05	所詮因果之義立名。謂依如來密因修證。是為了	所 詮 因 果 之 義 立 名 謂 依 如 來 密 因 修 證 是 為 了 
X15n0300_008:0196b06	義。權乘修證。皆不了義。	義 權 乘 修 證 皆 不 了 義 
X15n0300_008:0196b07	亦名大方廣妙蓮華王十方佛母陀羅尼呪。	亦 名 大 方 廣 妙 蓮 華 王 十 方 佛 母 陀羅尼呪 
X15n0300_008:0196b08	此約體用功力立名也。大方廣。所說之法也。常徧	此 約 體 用 功 力 立 名 也 大 方 廣 所 說 之 法 也 常 徧 
X15n0300_008:0196b09	曰大。軌持曰方。包博曰廣。即體相用之三大。因果	曰 大 軌 持 曰 方 包 博 曰 廣 即 體 相 用 之 三 大 因 果 
X15n0300_008:0196b10	同彰。染淨不滯。於法自在。名妙蓮華王。出生十方	同 彰 染 淨 不 滯 於 法 自 在 名 妙 蓮 華 王 出 生 十 方 
X15n0300_008:0196b11	一切諸佛。總一切法。持無量義。名十方佛母陀羅	一切諸佛 總 一 切 法 持 無 量 義 名 十 方 佛 母 陀 羅 
X15n0300_008:0196b12	尼呪。蓋呪者。佛以教言詛願眾生。革凡成聖也。	尼 呪 蓋 呪 者 佛 以 教 言 詛 願 眾 生 革 凡 成 聖 也 
X15n0300_008:0196b13	亦名灌頂章句諸菩薩萬行首楞嚴汝當奉持。	亦 名 灌 頂 章 句 諸 菩 薩 萬 行 首 楞 嚴 汝 當 奉 持 
X15n0300_008:0196b14	此約教行立名也。此經從天竺灌頂部中流出。蓋	此 約 教 行 立 名 也 此 經 從 天 竺 灌 頂 部 中 流 出 蓋 
X15n0300_008:0196b15	約密言名灌頂章句。有誦持者。則如來智水灌其	約 密 言 名 灌 頂 章 句 有 誦 持 者 則 如 來 智 水 灌 其 
X15n0300_008:0196b16	心頂。亦如剎利之受職也。又菩薩由此受佛職位。	心 頂 亦 如 剎 利 之 受 職 也 又 菩 薩 由 此 受 佛 職 位 
X15n0300_008:0196b17	亦名灌頂章句。菩薩萬行。以首楞嚴為本。故修此	亦 名 灌 頂 章 句 菩 薩 萬 行 以 首 楞 嚴 為 本 故 修 此 
X15n0300_008:0196b18	定者。於一心中具足萬行。故名萬行首楞嚴。結經	定 者 於 一 心 中 具 足 萬 行 故 名 萬 行 首 楞 嚴 結 經 
X15n0300_008:0196b19	分竟。下為助道分。而有二科。一曰。別明諸趣。戒備	分 竟 下 為 助 道 分 而 有 二 科 一 曰 別 明 諸 趣 戒 備 
X15n0300_008:0196b20	失錯。始於下文。而終於第九卷中。二曰。詳辨魔境。	失 錯 始 於 下 文 而 終 於 第 九 卷 中 二 曰 詳 辨 魔 境 
X15n0300_008:0196b21	深邡邪誤。始於第九卷中。而終於第十卷末。	深 邡 邪 誤 始 於 第 九 卷 中 而 終 於 第 十 卷 末 
X15n0300_008:0196b22	說是語已即時阿難(至)修心六品微細煩惱。	說 是 語 已 即 時 阿 難 至 修 心 六 品 微 細 煩 惱 
X15n0300_008:0196b23	此結敘時眾獲益。下乃讚謝也。開示密印般怛囉	此 結 敘 時 眾 獲 益 下 乃 讚 謝 也 開 示 密 印 般 怛 囉 
X15n0300_008:0196b24	義者。即大佛頂悉怛多鉢怛囉無上寶印也。兼聞	義 者 即 大 佛 頂 悉 怛 多 鉢 怛 囉 無 上 寶 印 也 兼 聞 
X15n0300_008:0196c01	了義名目者。即如來密因修證了義等也。頓悟禪	了 義 名 目 者 即 如 來 密 因 修 證 了 義 等 也 頓 悟 禪 
X15n0300_008:0196c02	那等。謂因聞修進聖位。及密印了義名目。故得頓	那 等 謂 因 聞 修 進 聖 位 及 密 印 了 義 名 目 故 得 頓 
X15n0300_008:0196c03	悟禪那修進妙理。心慮虗凝。斷除三界煩惱也。修	悟 禪 那 修 進 妙 理 心 慮 虗 凝 斷 除 三 界 煩 惱 也 修 
X15n0300_008:0196c04	道所斷之惑。小乘於三界九地。地各九品。斷欲界	道 所 斷 之 惑 小 乘 於 三界九地 地 各 九 品 斷 欲 界 
X15n0300_008:0196c05	前六品而證二果。斷後三品而證三果。斷上二界	前 六 品 而 證 二 果 斷 後 三 品 而 證 三 果 斷 上 二 界 
X15n0300_008:0196c06	各九品而證無學。今此增上頓斷。故言三界六品。	各 九 品 而 證 無 學 今 此 增 上 頓 斷 故 言 三 界 六 品 
X15n0300_008:0196c07	即從座起頂禮佛足(至)為是眾生妄習生起。	即 從 座 起 頂禮佛足 至 為 是 眾 生 妄 習 生 起 
X15n0300_008:0196c08	讚謝前法。啟請後說也。俱生幽隱。故云沈惑。前說	讚 謝 前 法 啟 請 後 說 也 俱 生 幽 隱 故 云 沈 惑 前 說 
X15n0300_008:0196c09	真淨妙心本來徧圓。則法界一真。萬動一體。宜無	真 淨 妙 心 本 來 徧 圓 則 法 界 一 真 萬 動 一 體 宜 無 
X15n0300_008:0196c10	諸趣之異。其如方今現有。乃常情所疑。故或執諸	諸 趣 之 異 其 如 方 今 現 有 乃 常 情 所 疑 故 或 執 諸 
X15n0300_008:0196c11	趣而迷妙圓之體。或執妙圓而撥諸趣之業。以至	趣 而 迷 妙 圓 之 體 或 執 妙 圓 而 撥 諸 趣 之 業 以 至 
X15n0300_008:0196c12	失錯墮落。故特請問。冀佛詳明。令人知所戒備也。	失 錯 墮 落 故 特 請 問 冀 佛 詳 明 令 人 知 所 戒 備 也 
X15n0300_008:0196c13	世尊如寶蓮香比丘尼(至)歡喜頂戴謹潔無犯。	世 尊 如 寶 蓮 香 比 丘 尼 至 歡 喜 頂 戴 謹 潔 無 犯 
X15n0300_008:0196c14	問意有二。謂別業同報。別業別報。初問婬殺妄三。	問 意 有 二 謂 別 業 同 報 別 業 別 報 初 問 婬 殺 妄 三 
X15n0300_008:0196c15	即別業也。為有定處。即同報也。為復自然下。即問	即 別 業 也 為 有 定 處 即 同 報 也 為 復 自 然 下 即 問 
X15n0300_008:0196c16	別業別報。據下答意。皆是別業同報耳。文云。循造	別 業 別 報 據 下 答 意 皆 是 別 業 同 報 耳 文 云 循 造 
X15n0300_008:0196c17	惡業。雖則自招。眾同分中。兼有元地。乃至云。不斷	惡 業 雖 則 自 招 眾 同 分 中 兼 有 元 地 乃 至 云 不 斷 
X15n0300_008:0196c18	三業。各各有私。因各各私。眾私同分。非無定處。且	三 業 各 各 有 私 因 各 各 私 眾 私 同 分 非 無 定 處 且 
X15n0300_008:0196c19	此云。令持戒者謹潔無犯。下云不入邪見。即戒備	此 云 令 持 戒 者 謹 潔 無 犯 下 云 不 入 邪 見 即 戒 備 
X15n0300_008:0196c20	之意也。瑠璃。匿王太子。廢父自立。挾宿嫌。誅釋種。	之 意 也 瑠 璃 匿 王 太 子 廢 父 自 立 挾 宿 嫌 誅 釋 種 
X15n0300_008:0196c21	佛記其七日當入地獄。王泛海以避。水中自然燒	佛 記 其 七 日 當 入 地 獄 王 泛 海 以 避 水 中 自 然 燒 
