X15n0300_005:0177c18	別。即得心平。心地若平。即不見彼我高下等相。則	別 即 得 心 平 心 地 若 平 即 不 見 彼 我 高 下 等 相 則 
X15n0300_005:0177c19	一切皆平也。毗舍浮。此云徧一切自在。亦由平心	一 切 皆 平 也 毗 舍 浮 此 云 徧 一 切 自 在 亦 由 平 心 
X15n0300_005:0177c20	故一切自在。我即下。正陳所證。謂了身界二塵等	故 一 切 自 在 我 即 下 正 陳 所 證 謂 了 身 界 二 塵 等 
X15n0300_005:0177c21	本如來藏。故不相摩觸。了微塵性。即悟無生。故云	本 如 來 藏 故 不 相 摩 觸 了 微 塵 性 即 悟 無 生 故 云 
X15n0300_005:0177c22	我於法性獲無生忍。妙蓮華佛知見地。即諸佛心	我 於 法 性 獲 無 生 忍 妙 蓮 華 佛 知 見 地 即 諸 佛 心 
X15n0300_005:0177c23	地法門也。行實圓契。染淨雙忘。名妙蓮華。迥出三	地 法 門 也 行 實 圓 契 染 淨 雙 忘 名 妙 蓮 華 迥 出 三 
X15n0300_005:0177c24	乘。深造一實。名佛知見地。持地所持。在此而已。故	乘 深 造 一 實 名 佛 知 見 地 持 地 所 持 在 此 而 已 故 
X15n0300_005:0178a01	得身界塵銷。無上智圓也。	得 身 界 塵 銷 無 上 智 圓 也 
X15n0300_005:0178a02	月光童子即從座起(至)圓滿菩提斯為第一。	月 光 童 子 即 從 座 起 至 圓 滿 菩 提 斯 為 第 一 
X15n0300_005:0178a03	月。太陰水精。昔師水天。修習水觀。水性圓明。故號	月 太 陰 水 精 昔 師 水 天 修 習 水 觀 水 性 圓 明 故 號 
X15n0300_005:0178a04	月光。觀於下。明作觀相。蓋由初觀內身之水。性不	月 光 觀 於 下 明 作 觀 相 蓋 由 初 觀 內 身 之 水 性 不 
X15n0300_005:0178a05	相奪。以至觀世界外諸香海水。無二無別。故得水	相 奪 以 至 觀 世 界 外 諸 香 海 水 無 二 無 別 故 得 水 
X15n0300_005:0178a06	性圓明。我於是時。至身質如初。敘作觀之緣。初成	性 圓 明 我 於 是 時 至 身 質 如 初 敘 作 觀 之 緣 初 成 
X15n0300_005:0178a07	此觀。但見其水。明定果色隨心所變。未得無身。出	此 觀 但 見 其 水 明 定 果 色 隨 心 所 變 未 得 無 身 出 
X15n0300_005:0178a08	定心痛。如舍利弗於恒河岸入定。遭違害鬼所擊。	定 心 痛 如 舍 利 弗 於 恒 河 岸 入 定 遭 違 害 鬼 所 擊 
X15n0300_005:0178a09	而出定頭痛。亦未得無身也。久離病緣者。謂羅漢	而 出 定 頭 痛 亦 未 得 無 身 也 久 離 病 緣 者 謂 羅 漢 
X15n0300_005:0178a10	子縛雖盡。既未得無身。則果縛猶存。是以心痛。出	子 縛 雖 盡 既 未 得 無 身 則 果 縛 猶 存 是 以 心 痛 出 
X15n0300_005:0178a11	定不知者。由無明未盡也。觀身界之水無別。即性	定 不 知 者 由 無 明 未 盡 也 觀 身 界 之 水 無 別 即 性 
X15n0300_005:0178a12	合真空。以水性不相陵奪。云一味流通。由觀水性	合 真 空 以 水 性 不 相 陵 奪 云 一 味 流 通 由 觀 水 性 
X15n0300_005:0178a13	不相陵奪。得無生忍。圓滿菩提。故水大為第一也。	不 相 陵 奪 得無生忍 圓 滿 菩 提 故 水 大 為 第 一 也 
X15n0300_005:0178a14	瑠璃光法王子即從座起(至)傳一妙心斯為第一。	瑠 璃 光 法 王 子 即 從 座 起 至 傳 一 妙 心 斯 為 第 一 
X15n0300_005:0178a15	因風大圓悟。身心發光。洞徹無礙。號瑠璃光。無量	因 風 大 圓 悟 身 心 發 光 洞 徹 無 礙 號 瑠 璃 光 無 量 
X15n0300_005:0178a16	聲佛。依風大開示菩薩。欲其證得不動。故令觀於	聲 佛 依 風 大 開 示 菩 薩 欲 其 證 得 不 動 故 令 觀 於 
X15n0300_005:0178a17	羣動。若了羣動無依。即證本覺不動。瑠璃光因是	羣 動 若 了 羣 動 無 依 即 證 本 覺 不 動 瑠 璃 光 因 是 
X15n0300_005:0178a18	觀界觀世觀身觀心。遷流運止。悉惟風力。故曰諸	觀 界 觀 世 觀 身 觀 心 遷 流 運 止 悉 惟 風 力 故 曰 諸 
X15n0300_005:0178a19	動無二。亦復了知此性。來無所從。去無所至。由是	動 無 二 亦 復 了 知 此 性 來 無 所 從 去 無 所 至 由 是 
X15n0300_005:0178a20	覺了大千羣動。皆即狂勞。猶百蚊蚋鼓於方寸耳。	覺 了 大 千 羣 動 皆 即 狂 勞 猶 百 蚊 蚋 鼓 於 方 寸 耳 
X15n0300_005:0178a21	因了風無所從。故逢佛未幾。即悟無生。是於羣動	因 了 風 無 所 從 故 逢 佛 未 幾 即 悟 無 生 是 於 羣 動 
X15n0300_005:0178a22	而覺乎不動。故見自身於不動佛國為法王子也。	而 覺 乎 不 動 故 見 自 身 於 不 動 佛 國 為 法 王 子 也 
X15n0300_005:0178a23	東為羣動之本。而佛號不動。乃即動而靜者也。能	東 為 羣 動 之 本 而 佛 號 不 動 乃 即 動 而 靜 者 也 能 
X15n0300_005:0178a24	即動而靜。故身心無礙。洞徹發光。合十方佛傳一	即 動 而 靜 故 身 心 無 礙 洞 徹 發 光 合 十 方 佛 傳 一 
X15n0300_005:0178b01	妙心者。謂觀風力無依。所悟之心。即十方佛所傳	妙 心 者 謂 觀 風 力 無 依 所 悟 之 心 即 十 方 佛 所 傳 
X15n0300_005:0178b02	妙心故也。	妙 心 故 也 
X15n0300_005:0178b03	虗空藏菩薩即從座起(至)妙力圓明斯為第一。	虗 空 藏 菩 薩 即 從 座 起 至 妙 力 圓 明 斯 為 第 一 
X15n0300_005:0178b04	由觀空故。得證空性。則性中所有。一切皆空。身與	由 觀 空 故 得 證 空 性 則 性 中 所 有 一切皆空 身 與 
X15n0300_005:0178b05	剎海涉入無礙。號虗空藏。以證空性故。得無邊身。	剎 海 涉 入 無 礙 號 虗 空 藏 以 證 空 性 故 得 無 邊 身 
X15n0300_005:0178b06	由得無邊身故。能以四寶珠。照十方剎。化成虗空。	由 得 無 邊 身 故 能 以 四 寶 珠 照 十 方 剎 化 成 虗 空 
X15n0300_005:0178b07	於心現鏡。光照諸剎。來入鏡中。身剎互入。不相妨	於 心 現 鏡 光 照 諸 剎 來 入 鏡 中 身 剎 互 入 不 相 妨 
X15n0300_005:0178b08	礙。廣大隨順。施作佛事也。此大神力下。明妙力之	礙 廣 大 隨 順 施 作 佛 事 也 此 大 神 力 下 明 妙 力 之 
X15n0300_005:0178b09	因。謂由觀四大身心虗空佛國。同一虗妄。唯是圓	因 謂 由 觀 四 大 身 心 虗 空 佛 國 同 一 虗 妄 唯 是 圓 
X15n0300_005:0178b10	常。冥此發用。豈拘方所。佛問下。結答所證。妙力圓	常 冥 此 發 用 豈 拘 方 所 佛 問 下 結 答 所 證 妙 力 圓 
X15n0300_005:0178b11	明。即照剎現鏡之事。由觀空故得此妙力。故空大	明 即 照 剎 現 鏡 之 事 由 觀 空 故 得 此 妙 力 故 空 大 
X15n0300_005:0178b12	第一也。	第 一 也 
X15n0300_005:0178b13	彌勒菩薩即從座起(至)得無生忍斯為第一。	彌 勒 菩 薩 即 從 座 起 至 得無生忍 斯 為 第 一 
X15n0300_005:0178b14	彌勒。正云梅怛利曳那。此翻慈氏。謂慈隆即世。悲	彌 勒 正 云 梅 怛 利 曳 那 此 翻 慈 氏 謂 慈 隆 即 世 悲 
X15n0300_005:0178b15	臻後劫。愍物迷識。故示迹發明也。心重世名好遊	臻 後 劫 愍 物 迷 識 故 示 迹 發 明 也 心 重 世 名 好 遊 
X15n0300_005:0178b16	族姓者。明迷識逐境。外慕妄求也。從燈明教而名	族 姓 者 明 迷 識 逐 境 外 慕 妄 求 也 從 燈 明 教 而 名 
X15n0300_005:0178b17	心頓歇者。了境唯識。迷妄自除也。然燈佛現乃成	心 頓 歇 者 了 境 唯 識 迷 妄 自 除 也 然 燈 佛 現 乃 成 
X15n0300_005:0178b18	妙圓者。迷妄既除。真心即現。則萬境妙圓矣。得是	妙 圓 者 迷 妄 既 除 真 心 即 現 則 萬 境 妙 圓 矣 得 是 
X15n0300_005:0178b19	妙圓識心三昧。則了盡空如來國土皆我心變。淨	妙 圓 識 心 三 昧 則 了 盡 空 如 來 國 土 皆 我 心 變 淨 
X15n0300_005:0178b20	穢有無亦我心變。無量佛性從此發揮。是謂流出	穢 有 無 亦 我 心 變 無 量 佛 性 從 此 發 揮 是 謂 流 出 
X15n0300_005:0178b21	無量如來。至得補處。亦不離此也。識心圓明入圓	無 量 如 來 至 得 補 處 亦 不 離 此 也 識 心 圓 明 入 圓 
X15n0300_005:0178b22	成實等。蓋由識心妙圓。證圓成實。不復迷識逐境。	成 實 等 蓋 由 識 心 妙 圓 證 圓 成 實 不 復 迷 識 逐 境 
X15n0300_005:0178b23	種種計著。故能遠離依他及徧計執。而得無生忍	種 種 計 著 故 能 遠 離 依 他 及 徧 計 執 而 得無生忍 
X15n0300_005:0178b24	也。徧計所執。謂橫執眾生壽者我及我所。乃至情	也 徧 計 所 執 謂 橫 執 眾 生 壽 者 我及我所 乃 至 情 
X15n0300_005:0178c01	非情異。有實體性。故周徧計度也。依他起性。謂計	非 情 異 有 實 體 性 故 周 徧 計 度 也 依他起性 謂 計 
X15n0300_005:0178c02	有因緣世間和合。建立名相。執此假相定從種生。	有 因 緣 世 間 和 合 建 立 名 相 執 此 假 相 定 從 種 生 
X15n0300_005:0178c03	雖無我執自然種性。猶執五蘊等法。定從種生也。	雖 無 我 執 自 然 種 性 猶 執 五 蘊 等 法 定 從 種 生 也 
X15n0300_005:0178c04	圓成實性。即真如也。圓成如麻。依他如繩。徧計如	圓成實性 即 真 如 也 圓 成 如 麻 依 他 如 繩 徧 計 如 
X15n0300_005:0178c05	蛇。今入圓成。即證真如理也。	蛇 今 入 圓 成 即 證 真 如 理 也 
X15n0300_005:0178c06	大勢至法王子與其同倫(至)得三摩地斯為第一。	大 勢 至 法 王 子 與 其 同 倫 至 得 三 摩 地 斯 為 第 一 
X15n0300_005:0178c07	大勢至。亦名無量光。觀經云。以智慧光普照一切。	大 勢 至 亦 名 無 量 光 觀 經 云 以 智 慧 光 普 照 一 切 
X15n0300_005:0178c08	令離三途。得無上力。名大勢至。夫念佛者。不得一	令 離 三 途 得 無 上 力 名 大 勢 至 夫 念 佛 者 不 得 一 
X15n0300_005:0178c09	彈指頃念世五欲。是謂繫念。脫能如此一無間雜。	彈 指 頃 念 世 五 欲 是 謂 繫 念 脫 能 如 此 一 無 間 雜 
X15n0300_005:0178c10	則無量性光自然發明。下所謂不假方便自得心	則 無 量 性 光 自 然 發 明 下 所 謂 不 假 方 便 自 得 心 
X15n0300_005:0178c11	開者此也。譬如下。示必須繫念。然後相應。不專念	開 者 此 也 譬 如 下 示 必 須 繫 念 然 後 相 應 不 專 念 
X15n0300_005:0178c12	佛。則雖逢不逢。或見不見。染香則襲香。念佛則見	佛 則 雖 逢 不 逢 或 見 不 見 染 香 則 襲 香 念 佛 則 見 
X15n0300_005:0178c13	佛。故以念佛妙熏。名香光莊嚴也。念佛得忍者。蓋	佛 故 以 念 佛 妙 熏 名 香 光 莊 嚴 也 念 佛 得 忍 者 蓋 
X15n0300_005:0178c14	以淨念蠲濁想。正念滅邪受。邪濁既除。心境空寂。	以 淨 念 蠲 濁 想 正 念 滅 邪 受 邪 濁 既 除 心 境 空 寂 
X15n0300_005:0178c15	一切不生。名無生忍。如此。則自性佛土淨矣。故攝	一 切 不 生 名 無 生 忍 如 此 則 自 性 佛 土 淨 矣 故 攝 
X15n0300_005:0178c16	行人同歸也。我無下。正陳所證。都攝六根者。以念	行 人 同 歸 也 我 無 下 正 陳 所 證 都 攝 六 根 者 以 念 
X15n0300_005:0178c17	佛三昧通攝六根。即見大第一也。	佛 三 昧 通 攝 六 根 即 見 大 第 一 也 
X15n0300_006:0179a04	大佛頂如來密因修證了義諸菩薩萬行首楞嚴經	大 佛 頂 如 來 密 因 修 證 了 義 諸 菩 薩 萬 行 首 楞 嚴 經 
X15n0300_006:0179a05	纂註卷第六	纂 註 卷 第 六 
X15n0300_006:0179a06	唐　天竺沙門　般剌密諦　譯	唐 天 竺 沙 門 般 剌 密 諦 譯 
X15n0300_006:0179a07	唐　烏萇國沙門彌伽釋迦譯語	唐 烏 萇 國 沙 門 彌 伽 釋 迦 譯 語 
X15n0300_006:0179a08	唐菩薩戒弟子前正議大夫同中	唐 菩 薩 戒 弟 子 前 正 議 大 夫 同 中 
X15n0300_006:0179a09	書門下平章事清河房融筆受	書 門 下 平 章 事 清 河 房 融 筆 受 
X15n0300_006:0179a10	明　檇李沙門　真界　纂註	明 檇 李 沙 門 真 界 纂 註 
X15n0300_006:0179a11	爾時觀世音菩薩即從座起(至)從聞思修入三摩地。	爾 時 觀 世 音 菩 薩 即 從 座 起 至 從 聞 思 修 入 三 摩 地 
X15n0300_006:0179a12	觀音者。觀世言音。圓悟圓應之號也。於音言觀者。	觀 音 者 觀 世 言 音 圓 悟 圓 應 之 號 也 於 音 言 觀 者 
X15n0300_006:0179a13	以觀智照之。不以耳識聞之也。所謂入流亡所。則	以 觀 智 照 之 不 以 耳 識 聞 之 也 所 謂 入 流 亡 所 則 
X15n0300_006:0179a14	以觀不以聞可知矣。所師之佛亦名觀音者。因果	以 觀 不 以 聞 可 知 矣 所 師 之 佛 亦 名 觀 音 者 因 果 
X15n0300_006:0179a15	相符。古今一道也。達耳之謂聞。著心之謂思。治習	相 符 古 今 一 道 也 達 耳 之 謂 聞 著 心 之 謂 思 治 習 
X15n0300_006:0179a16	之謂修。三者圓明。是謂三慧。	之 謂 修 三 者 圓 明 是 謂 三 慧 
X15n0300_006:0179a17	初於聞中入流亡所(至)生滅既滅寂滅現前。	初 於 聞 中 入 流 亡 所 至 生 滅 既 滅 寂 滅 現 前 
X15n0300_006:0179a18	此敘入圓通之本因也。言入流亡所者。由初於聞	此 敘 入 圓 通 之 本 因 也 言 入 流 亡 所 者 由 初 於 聞 
X15n0300_006:0179a19	中。以圓修慧。反照聞性。不隨聲塵流逸。故得逆彼	中 以 圓 修 慧 反 照 聞 性 不 隨 聲 塵 流 逸 故 得 逆 彼 
X15n0300_006:0179a20	業流。亡所聞相。而所入寂也。所入既寂。動靜不生。	業 流 亡 所 聞 相 而 所 入 寂 也 所 入 既 寂 動 靜 不 生 
X15n0300_006:0179a21	觀慧漸增。能聞亦盡。所覺之聞既離。能覺之智亦	觀 慧 漸 增 能 聞 亦 盡 所 覺 之 聞 既 離 能 覺 之 智 亦 
X15n0300_006:0179a22	寂。境智不立。空覺極圓。所空觀智既亡。能空空覺	寂 境 智 不 立 空 覺 極 圓 所 空 觀 智 既 亡 能 空 空 覺 
X15n0300_006:0179a23	亦滅。則生滅相盡。圓通之性全體現前。即所謂有	亦 滅 則 生 滅 相 盡 圓 通 之 性 全 體 現 前 即 所 謂 有 
X15n0300_006:0179a24	照有覺。俱名障礙。照與照者同時寂滅也。	照 有 覺 俱 名 障 礙 照 與 照 者 同 時 寂 滅 也 
X15n0300_006:0179b01	忽然超越世出世間(至)與諸眾生同一悲仰。	忽 然 超 越 世出世間 至 與 諸 眾 生 同 一 悲 仰 
X15n0300_006:0179b02	由圓通之性現前。世出世法不能限礙。十方法界	由 圓 通 之 性 現 前 世 出 世 法 不 能 限 礙 十 方 法 界 
X15n0300_006:0179b03	圓明洞達。獲二殊勝。此即圓照三昧也。以其圓洞。	圓 明 洞 達 獲 二 殊 勝 此 即 圓 照 三 昧 也 以 其 圓 洞 
X15n0300_006:0179b04	故上合諸佛。下合羣生。無間然者。上合諸佛。遂能	故 上 合 諸 佛 下 合 羣 生 無 間 然 者 上 合 諸 佛 遂 能 
X15n0300_006:0179b05	愍物與慈。應機與樂。即三十二應是也。下合羣生。	愍 物 與 慈 應 機 與 樂 即 三 十 二 應 是 也 下 合 羣 生 
X15n0300_006:0179b06	故知其悲仰。隨與拔苦。即十四無畏是也。	故 知 其 悲 仰 隨 與 拔 苦 即 十 四 無 畏 是 也 
X15n0300_006:0179b07	世尊由我供養觀音(至)成三十二應入諸國土。	世 尊 由 我 供 養 觀 音 至 成 三 十 二 應 入 諸 國 土 
X15n0300_006:0179b08	此敘三十二應之本也。如幻者。幻人作為。本於無	此 敘 三 十 二 應 之 本 也 如 幻 者 幻 人 作 為 本 於 無 
X15n0300_006:0179b09	作。以喻熏修應機。即為無為。亡情絕解也。聞熏聞	作 以 喻 熏 修 應 機 即 為 無 為 亡 情 絕 解 也 聞 熏 聞 
X15n0300_006:0179b10	修者。謂熏修皆不離聞也。因依聞性熏修。結惑淨	修 者 謂 熏 修 皆 不 離 聞 也 因 依 聞 性 熏 修 結 惑 淨 
X15n0300_006:0179b11	盡。三昧現前。則與如來同一慈力。故能隨緣應化。	盡 三 昧 現 前 則 與 如 來 同 一 慈 力 故 能 隨 緣 應 化 
X15n0300_006:0179b12	凡皆如幻而已。三十二應者。現十法界身。圓應羣	凡 皆 如 幻 而 已 三 十 二 應 者 現 十 法 界 身 圓 應 羣 
X15n0300_006:0179b13	機也。開之有三十二。合之惟四聖六凡。攝盡羣類。	機 也 開 之 有 三 十 二 合 之 惟 四 聖 六 凡 攝 盡 羣 類 
X15n0300_006:0179b14	世尊若諸菩薩入三摩地(至)而為說法令其解脫。	世 尊 若 諸 菩 薩 入 三 摩 地 至 而 為 說 法 令 其 解 脫 
X15n0300_006:0179b15	由圓通性現。與佛同力。故能現佛身也。修正定。取	由 圓 通 性 現 與 佛 同 力 故 能 現 佛 身 也 修 正 定 取 
X15n0300_006:0179b16	正果。進求無餘。曰進修無漏。無明垂盡。種智將圓。	正 果 進 求 無 餘 曰 進 修 無 漏 無 明 垂 盡 種 智 將 圓 
X15n0300_006:0179b17	曰勝解現圓。斯可以得佛。故現佛身為說果法。令	曰 勝 解 現 圓 斯 可 以 得 佛 故 現 佛 身 為 說 果 法 令 
X15n0300_006:0179b18	其解脫者。使其圓滿菩提。歸無所得也。第十地菩	其 解 脫 者 使 其 圓 滿 菩 提 歸 無 所 得 也 第 十 地 菩 
X15n0300_006:0179b19	薩。坐華王座。垂成正覺。猶有學佛煩惱。亦須別佛	薩 坐 華 王 座 垂 成 正 覺 猶 有 學 佛 煩 惱 亦 須 別 佛 
X15n0300_006:0179b20	說教。斷最後無明。方成佛道。斯即其事也。	說 教 斷 最 後 無 明 方 成 佛 道 斯 即 其 事 也 
X15n0300_006:0179b21	若諸有學寂靜妙明(至)而為說法令其解脫。	若 諸 有 學 寂 靜 妙 明 至 而 為 說 法 令 其 解 脫 
X15n0300_006:0179b22	獨覺者。出無佛世。觀物變易。自覺無生。故號獨覺。	獨 覺 者 出 無 佛 世 觀 物 變 易 自 覺 無 生 故 號 獨 覺 
X15n0300_006:0179b23	樂獨善寂。求自然慧。故曰寂靜妙明。緣覺者。稟佛	樂 獨 善 寂 求 自 然 慧 故 曰 寂 靜 妙 明 緣 覺 者 稟 佛 
X15n0300_006:0179b24	之教。觀緣悟道。故云緣覺。知迷勝性由十二緣。於	之 教 觀 緣 悟 道 故 云 緣 覺 知 迷 勝 性 由 十 二 緣 於 
X15n0300_006:0179c01	是斷至無明。則緣斷而勝性現矣。性因緣斷而現。	是 斷 至 無 明 則 緣 斷 而 勝 性 現 矣 性 因 緣 斷 而 現 
X15n0300_006:0179c02	故曰緣斷勝性。勝妙現圓者。各約自乘理智。已現	故 曰 緣 斷 勝 性 勝 妙 現 圓 者 各 約 自 乘 理 智 已 現 
X15n0300_006:0179c03	已圓。但未克證。今現身說法。使其證入。即令解脫	已 圓 但 未 克 證 今 現 身 說 法 使 其 證 入 即 令 解 脫 
X15n0300_006:0179c04	也。	也 
X15n0300_006:0179c05	若諸有學得四諦空(至)而為說法令其解脫。	若 諸 有 學 得 四 諦 空 至 而 為 說 法 令 其 解 脫 
X15n0300_006:0179c06	三果已前。賢位聖位。俱屬有學。見道一十六心。斷	三 果 已 前 賢 位 聖 位 俱 屬 有 學 見 道 一 十 六 心 斷 
X15n0300_006:0179c07	四諦下惑。證生空理。故曰得四諦空。初果後。進斷	四 諦 下 惑 證 生 空 理 故 曰 得 四 諦 空 初 果 後 進 斷 
X15n0300_006:0179c08	三界八十一品俱生。品品皆證一分擇滅無為。故	三 界 八 十 一 品 俱 生 品 品 皆 證 一 分 擇 滅 無 為 故 
X15n0300_006:0179c09	云修道入滅。說法解脫之義。准上可知。四聖不舉	云 修 道 入 滅 說 法 解 脫 之 義 准 上 可 知 四 聖 不 舉 
X15n0300_006:0179c10	菩薩者略也。	菩 薩 者 略 也 
X15n0300_006:0179c11	若諸眾生欲心明悟(至)而為說法令其成就。	若 諸 眾 生 欲 心 明 悟 至 而 為 說 法 令 其 成 就 
X15n0300_006:0179c12	此應諸天也。梵王。即色天主。名為尸棄。此云頂髻。	此 應 諸 天 也 梵 王 即 色 天 主 名 為 尸 棄 此 云 頂 髻 
X15n0300_006:0179c13	纓珞明四禪皆有王。今言梵者。應是初禪之頂。以	纓 珞 明 四 禪 皆 有 王 今 言 梵 者 應 是 初 禪 之 頂 以 
X15n0300_006:0179c14	有覺觀語言之法。得為千界之主。說法者。如金光	有 覺 觀 語 言 之 法 得 為 千 界 之 主 說 法 者 如 金 光 
X15n0300_006:0179c15	明云。大梵天王說出欲論。解脫者。令離欲塵也。帝	明 云 大 梵 天 王 說 出 欲 論 解 脫 者 令 離 欲 塵 也 帝 
X15n0300_006:0179c16	釋。即欲界第二天主。說法。即十善法也。自在天。是	釋 即 欲 界 第 二 天 主 說 法 即 十 善 法 也 自 在 天 是 
X15n0300_006:0179c17	欲界頂天。大自在。即色頂摩醯首羅天。然初舉梵	欲 界 頂 天 大 自 在 即 色 頂 摩 醯 首 羅 天 然 初 舉 梵 
X15n0300_006:0179c18	王。復自欲天超至色頂。以明無剎不現也。	王 復 自 欲 天 超 至 色 頂 以 明 無 剎 不 現 也 
X15n0300_006:0179c19	若諸眾生愛統鬼神(至)而為說法令其成就。	若 諸 眾 生 愛 統 鬼 神 至 而 為 說 法 令 其 成 就 
X15n0300_006:0179c20	上舉正統。此舉臣輔也。天將軍。為帝釋上將。統領	上 舉 正 統 此 舉 臣 輔 也 天 將 軍 為 帝 釋 上 將 統 領 
X15n0300_006:0179c21	鬼神。四天王。臣於帝釋。統領世界。四天太子。即那	鬼 神 四 天 王 臣 於 帝 釋 統 領 世 界 四 天 太 子 即 那 
X15n0300_006:0179c22	吒之類。能驅鬼神。	吒 之 類 能 驅 鬼 神 
X15n0300_006:0179c23	若諸眾生樂為人王(至)而為說法令其成就。	若 諸 眾 生 樂 為 人 王 至 而 為 說 法 令 其 成 就 
X15n0300_006:0179c24	應王臣士庶也。自金輪至粟散。皆人王也。粟散。即	應 王 臣 士 庶 也 自 金 輪 至 粟 散 皆 人 王 也 粟 散 即 
X15n0300_006:0180a01	邦國小王。散於天下。如粟之多。長者具十德。謂姓	邦 國 小 王 散 於 天 下 如 粟 之 多 長 者 具 十 德 謂 姓 
X15n0300_006:0180a02	貴。位高。大富。威猛。智深。年耆。行淨。禮備。上歎。下歸。	貴 位 高 大 富 威 猛 智 深 年 耆 行 淨 禮 備 上 歎 下 歸 
X15n0300_006:0180a03	故為族姓之主。世間推讓也。隱居求志。行義達道。	故 為 族 姓 之 主 世 間 推 讓 也 隱 居 求 志 行 義 達 道 
X15n0300_006:0180a04	名居士。愛談名言。即典雅之言也。三台。輔相。州牧。	名 居 士 愛 談 名 言 即 典 雅 之 言 也 三 台 輔 相 州 牧 
X15n0300_006:0180a05	縣長。悉號宰官。婆羅門。此云淨行。愛諸數術。即和	縣 長 悉 號 宰 官 婆 羅 門 此 云 淨 行 愛 諸 數 術 即 和 
X15n0300_006:0180a06	合占相。推步盈虗也。	合 占 相 推 步 盈 虗 也 
X15n0300_006:0180a07	若有男子好學出家(至)而為說法令其成就。	若 有 男 子 好 學 出 家 至 而 為 說 法 令 其 成 就 
X15n0300_006:0180a08	應入道四眾也。戒。謂比丘二百五十。尼倍之。言律	應 入 道 四 眾 也 戒 謂 比 丘 二百五十 尼 倍 之 言 律 
X15n0300_006:0180a09	言禁者。比丘所持常律而已。尼則禁切尤詳。優婆	言 禁 者 比 丘 所 持 常 律 而 已 尼 則 禁 切 尤 詳 優 婆 
X15n0300_006:0180a10	塞優婆夷。謂近事佛法男女。以五戒自守。堪任近	塞 優 婆 夷 謂 近 事 佛 法 男 女 以 五 戒 自 守 堪 任 近 
X15n0300_006:0180a11	事出家二眾故。	事 出 家 二 眾 故 
X15n0300_006:0180a12	若有女人內政立身(至)而為說法令其成就。	若 有 女 人 內 政 立 身 至 而 為 說 法 令 其 成 就 
X15n0300_006:0180a13	應主婦童真也。天子三公九卿等掌外政。三后九	應 主 婦 童 真 也 天 子 三 公 九 卿 等 掌 外 政 三 后 九 
X15n0300_006:0180a14	妃等掌內政。所以修治家國。女主。即后妃也。命婦。	妃 等 掌 內 政 所 以 修 治 家 國 女 主 即 后 妃 也 命 婦 
X15n0300_006:0180a15	即公卿之妻受錫命者。國夫人。如論語邦君之妻	即 公 卿 之 妻 受 錫 命 者 國 夫 人 如 論 語 邦 君 之 妻 
X15n0300_006:0180a16	曰君夫人。大家。如後漢扶風曹世叔妻者。同郡班	曰 君 夫 人 大 家 如 後 漢 扶 風 曹 世 叔 妻 者 同 郡 班 
X15n0300_006:0180a17	彪之女。名昭。字惠姬。和帝數召入宮。令皇后貴人	彪 之 女 名 昭 字 惠 姬 和 帝 數 召 入 宮 令 皇 后 貴 人 
X15n0300_006:0180a18	師事焉。號曰大家。	師 事 焉 號 曰 大 家 
X15n0300_006:0180a19	若有諸天樂出天倫(至)而為說法令其成就。	若 有 諸 天 樂 出 天 倫 至 而 為 說 法 令 其 成 就 
X15n0300_006:0180a20	應八部雜類也。藥义。此云輕捷。乾闥婆。此云香陰。	應 八 部 雜 類 也 藥 义 此 云 輕 捷 乾 闥 婆 此 云 香 陰 
X15n0300_006:0180a21	新翻尋香行。帝釋樂神也。阿脩羅。新翻非天。以諂	新 翻 尋 香 行 帝 釋 樂 神 也 阿 脩 羅 新 翻 非 天 以 諂 
X15n0300_006:0180a22	詐無天行故。準普門品八部。此闕迦樓羅。即金翅	詐 無 天 行 故 準 普 門 品 八 部 此 闕 迦 樓 羅 即 金 翅 
X15n0300_006:0180a23	鳥也。緊那羅。形似人而頭有角。因呼為疑神。天帝	鳥 也 緊 那 羅 形 似 人 而 頭 有 角 因 呼 為 疑 神 天 帝 
X15n0300_006:0180a24	絲竹樂神也。小劣乾闥婆。摩呼羅伽。地龍。肇公云	絲 竹 樂 神 也 小 劣 乾 闥 婆 摩 呼 羅 伽 地 龍 肇 公 云 
X15n0300_006:0180b01	大蠎腹行也。有形。如休咎精明等。無形。如空散銷	大 蠎 腹 行 也 有 形 如 休 咎 精 明 等 無 形 如 空 散 銷 
X15n0300_006:0180b02	沈等。有想。如神鬼精靈等。無想。如精神化為土木	沈 等 有 想 如 神 鬼 精 靈 等 無 想 如 精 神 化 為 土 木 
