X22n0405_001:0247b23	蘇從生蘇出熟蘇從熟蘇生醍醐五味喻也初云如	蘇 從 生 蘇 出 熟 蘇 從 熟 蘇 生 醍 醐 五 味 喻 也 初 云 如 
X22n0405_001:0247b24	從佛出十二部經從十二部經出修多羅從修多羅	從 佛 出 十二部經 從 十二部經 出 修 多 羅 從 修 多 羅 
X22n0405_001:0247c01	出方等典從方等典出摩訶般若從摩訶般若出大	出 方 等 典 從 方 等 典 出 摩訶般若 從 摩訶般若 出 大 
X22n0405_001:0247c02	涅槃五時法合初譬從牛出乳即乳味對華嚴頓教	涅 槃 五 時 法 合 初 譬 從 牛 出 乳 即 乳 味 對 華 嚴 頓 教 
X22n0405_001:0247c03	八教有五化儀有三謂頓祕密不定化法唯二謂別	八 教 有 五 化 儀 有 三 謂 頓 祕 密 不 定 化 法 唯 二 謂 別 
X22n0405_001:0247c04	圓酪對修多羅第二味謂四阿含經漸初化儀有三	圓 酪 對 修 多 羅 第 二 味 謂 四 阿 含 經 漸 初 化 儀 有 三 
X22n0405_001:0247c05	謂小乘祕密不定化法唯一三藏教也生蘇對方等	謂 小 乘 祕 密 不 定 化 法 唯 一 三 藏 教 也 生 蘇 對 方 等 
X22n0405_001:0247c06	當第三昧漸部中有七教化儀有三例藏可知化法	當 第 三 昧 漸 部 中 有 七 教 化 儀 有 三 例 藏 可 知 化 法 
X22n0405_001:0247c07	有四謂藏等四教也熟蘇對般若當第四味漸部後	有 四 謂 藏 等 四 教 也 熟 蘇 對 般 若 當 第 四 味 漸 部 後 
X22n0405_001:0247c08	有六教化儀有三即漸等化法亦三謂通別圓醍醐	有 六 教 化 儀 有 三 即 漸 等 化 法 亦 三 謂 通 別 圓 醍 醐 
X22n0405_001:0247c09	對法華涅槃第五味也玅經唯有開權圓教獨顯一	對 法 華 涅 槃 第 五 味 也 玅 經 唯 有 開 權 圓 教 獨 顯 一 
X22n0405_001:0247c10	乘何者為實施權遍於四味開權顯實收攝四味五	乘 何 者 為 實 施 權 遍 於 四 味 開 權 顯 實 收 攝 四 味 五 
X22n0405_001:0247c11	時八教總入醍醐涅槃扶律明常具有四教總知常	時 八 教 總 入 醍 醐 涅 槃 扶 律 明 常 具 有 四 教 總 知 常 
X22n0405_001:0247c12	住一期化儀出世大事其功畢矣次大本二卷下翻	住 一 期 化 儀 出 世 大 事 其 功 畢 矣 次 大 本 二 卷 下 翻 
X22n0405_001:0247c13	譯時代翻譯者沙門畺良耶舍此云時稱西域人性	譯 時 代 翻 譯 者 沙 門 畺 良 耶 舍 此 云 時 稱 西 域 人 性 
X22n0405_001:0247c14	剛直寡嗜欲善通三藏多所諳知尤功禪思以宋文	剛 直 寡 嗜 欲 善 通 三 藏 多 所 諳 知 尤 功 禪 思 以 宋 文 
X22n0405_001:0247c15	帝永嘉元年歲次甲子達于京邑帝深加賞勅住鍾	帝 永 嘉 元 年 歲 次 甲 子 達 于 京 邑 帝 深 加 賞 勅 住 鍾 
X22n0405_001:0247c16	山道林精舍譯出藥王藥上菩薩經一卷譯觀無量	山 道 林 精 舍 譯 出 藥 王 藥 上 菩 薩 經 一 卷 譯 觀 無 量 
X22n0405_001:0247c17	壽佛經一卷沙門僧含筆受三藏明義下明義及經	壽 佛 經 一 卷 沙 門 僧 含 筆 受 三 藏 明 義 下 明 義 及 經 
X22n0405_001:0247c18	正意四題稱下簡異。	正 意 四 題 稱 下 簡 異 
X22n0405_001:0247c19	第三依文解釋為二初舉經分章次序中文二下略	第 三 依 文 解 釋 為 二 初 舉 經 分 章 次 序 中 文 二 下 略 
X22n0405_001:0247c20	釋二意一證信六句下廣釋言如是者所聞之法體	釋 二 意 一 證 信 六 句 下 廣 釋 言 如 是 者 所 聞 之 法 體 
X22n0405_001:0247c21	對破外道阿漚二字不如不是阿之言無漚之言有	對 破 外 道 阿 漚 二 字 不 如 不 是 阿 之 言 無 漚 之 言 有 
X22n0405_001:0247c22	即斷常二見不出有無故云如是也我聞者能聞之	即 斷 常 二 見 不 出 有 無 故 云 如 是 也 我 聞 者 能 聞 之 
X22n0405_001:0247c23	人即阿難親承佛聞一時者即聞時和合非異時也	人 即 阿 難 親 承 佛 聞 一 時 者 即 聞 時 和 合 非 異 時 也 
X22n0405_001:0247c24	釋論廣破等者迦毗羅計一優樓僧佉計異一異不	釋 論 廣 破 等 者 迦 毗 羅 計 一 優 樓 僧 佉 計 異 一 異 不 
X22n0405_001:0248a01	從因緣但由於時時來眾生熟時去即催促時能覺	從 因 緣 但 由 於 時 時 來 眾 生 熟 時 去 即 催 促 時 能 覺 
X22n0405_001:0248a02	悟人是說時為因廣破竟時有二種一迦羅名定時	悟 人 是 說 時 為 因 廣 破 竟 時 有 二 種 一 迦 羅 名 定 時 
X22n0405_001:0248a03	示內弟子時食時著衣時是也二三摩耶名假時破	示 內 弟 子 時 食 時 著 衣 時 是 也 二 三 摩 耶 名 假 時 破 
X22n0405_001:0248a04	外道外道計時實有今破假名而已定無實體也王	外 道 外 道 計 時 實 有 今 破 假 名 而 已 定 無 實 體 也 王 
X22n0405_001:0248a05	城即通方所耆山別方所我聞中三謂法喻合初又	城 即 通 方 所 耆 山 別 方 所 我 聞 中 三 謂 法 喻 合 初 又 
X22n0405_001:0248a06	二先簡異立義徵起次隨俗下答住者經曰在疏中	二 先 簡 異 立 義 徵 起 次 隨 俗 下 答 住 者 經 曰 在 疏 中 
X22n0405_001:0248a07	轉義釋為二先標列次釋釋中具明因果王城者文	轉 義 釋 為 二 先 標 列 次 釋 釋 中 具 明 因 果 王 城 者 文 
X22n0405_001:0248a08	有四悉初即世界王有夫下即為人又先所住城下	有 四 悉 初 即 世 界 王 有 夫 下 即 為 人 又 先 所 住 城 下 
X22n0405_001:0248a09	對治作是念時空聲下第一義此五山一義鞞婆羅	對 治 作 是 念 時 空 聲 下 第 一 義 此 五 山 一 義 鞞 婆 羅 
X22n0405_001:0248a10	跋怒此云天王穴薩多般那求訶此云七葉穴因施	跋 怒 此 云 天 王 穴 薩 多 般 那 求 訶 此 云 七 葉 穴 因 施 
X22n0405_001:0248a11	世羅求訶此云蛇神山薩菆怒魂真迦鉢羅此云少	世 羅 求 訶 此 云 蛇 神 山 薩 菆 怒 魂 真 迦 鉢 羅 此 云 少 
X22n0405_001:0248a12	獨力山五是耆闍崛山(云云)九十五種者除佛一人外	獨 力 山 五 是 耆 闍 崛 山 云 云 九 十 五 種 者 除 佛 一 人 外 
X22n0405_001:0248a13	道有六師一師有十五弟子合成九十六佛初曾事	道 有 六 師 一 師 有 十 五 弟 子 合 成 九 十 六 佛 初 曾 事 
X22n0405_001:0248a14	外道為弟子知其非究竟先同後異捨而離之後證	外 道 為 弟 子 知 其 非 究 竟 先 同 後 異 捨 而 離 之 後 證 
X22n0405_001:0248a15	得果故云勝也。	得 果 故 云 勝 也 
X22n0405_001:0248a16	發起序者為三初通明往意不同次今經下問答三	發 起 序 者 為 三 初 通 明 往 意 不 同 次 今 經 下 問 答 三 
X22n0405_001:0248a17	依文解釋發起一經亦名別序亦名弟子序亦名經	依 文 解 釋 發 起 一 經 亦 名 別 序 亦 名 弟 子 序 亦 名 經 
X22n0405_001:0248a18	前序證信序者亦名通序亦名經後序亦名如來序	前 序 證 信 序 者 亦 名 通 序 亦 名 經 後 序 亦 名 如 來 序 
X22n0405_001:0248a19	隨義種種差別也釋為四先分章次頻婆下問二意	隨 義 種種差別 也 釋 為 四 先 分 章 次 頻 婆 下 問 二 意 
X22n0405_001:0248a20	三父願聞法下答四乃釋義初為四下解釋初文有	三 父 願 聞 法 下 答 四 乃 釋 義 初 為 四 下 解 釋 初 文 有 
X22n0405_001:0248a21	四一舉能害人二明其惡緣三正明害父四制臣佐	四 一 舉 能 害 人 二 明 其 惡 緣 三 正 明 害 父 四 制 臣 佐 
X22n0405_001:0248a22	初文可知二惡緣者即調達是此人身雖出家情存	初 文 可 知 二 惡 緣 者 即 調 達 是 此 人 身 雖 出 家 情 存 
X22n0405_001:0248a23	利養往到佛所求出家欲學通法佛知其意止而不	利 養 往 到 佛 所 求 出 家 欲 學 通 法 佛 知 其 意 止 而 不 
X22n0405_001:0248a24	宣阿難親弟愍而為說既得通已惑於闍王殺父害	宣 阿 難 親 弟 愍 而 為 說 既 得 通 已 惑 於 闍 王 殺 父 害 
X22n0405_001:0248b01	母自欲殺佛當為新佛新王共治於世闍王敬重日	母 自 欲 殺 佛 當 為 新 佛 新 王 共 治 於 世 闍 王 敬 重 日 
X22n0405_001:0248b02	日侍從五百乘車朝暮問訊并供五百釜飲食父王	日 侍 從 五 百 乘 車 朝 暮 問 訊 并 供 五 百 釜 飲 食 父 王 
X22n0405_001:0248b03	聞已日日恒將七百乘車朝暮問訊世尊并供七百	聞 已 日 日 恒 將 七 百 乘 車 朝 暮 問 訊 世 尊 并 供 七 百 
X22n0405_001:0248b04	釜飲食達多聞已嫉妬心生遂失通法既失通已心	釜 飲 食 達 多 聞 已 嫉 妬 心 生 遂 失 通 法 既 失 通 已 心 
X22n0405_001:0248b05	生慚愧不敢見闍世即往佛所求乞徒眾佛言我尚	生 慚 愧 不 敢 見 闍 世 即 往 佛 所 求 乞 徒 眾 佛 言 我 尚 
X22n0405_001:0248b06	不付屬身子目連況汝癡人調達聞已心生忿恚往	不 付 屬 身 子 目 連 況 汝 癡 人 調 達 聞 已 心 生 忿 恚 往 
X22n0405_001:0248b07	闍世所語言汝父長壽若待父死不可得王位汝可	闍 世 所 語 言 汝 父 長 壽 若 待 父 死 不 可 得 王 位 汝 可 
X22n0405_001:0248b08	害父我當害佛當令現世有王佛興治國教化人民	害 父 我 當 害 佛 當 令 現 世 有 王 佛 興 治 國 教 化 人 民 
X22n0405_001:0248b09	安樂眾生得果豈不悅耶報言可爾因行逆故云惡	安 樂 眾 生 得 果 豈 不 悅 耶 報 言 可 爾 因 行 逆 故 云 惡 
X22n0405_001:0248b10	緣收執父王下三正害父經文又三先標王位次顯	緣 收 執 父 王 下 三 正 害 父 經 文 又 三 先 標 王 位 次 顯 
X22n0405_001:0248b11	列名三正興害制諸群臣下恐興異計故不得往。	列 名 三 正 興 害 制 諸 群 臣 下 恐 興 異 計 故 不 得 往 
X22n0405_001:0248b12	二夫人奉食極世飢苦得色身益經有四意一夫人	二 夫 人 奉 食 極 世 飢 苦 得 色 身 益 經 有 四 意 一 夫 人 
X22n0405_001:0248b13	奉食二王得食身安請佛三申請弟子四願聖拔苦	奉 食 二 王 得 食 身 安 請 佛 三 申 請 弟 子 四 願 聖 拔 苦 
X22n0405_001:0248b14	與樂得出世果三聖為說法救生死苦與涅槃樂受	與 樂 得 出 世 果 三 聖 為 說 法 救 生 死 苦 與 涅 槃 樂 受 
X22n0405_001:0248b15	戒增福說法進道王因被囚欣厭情深聖應和機說	戒 增 福 說 法 進 道 王 因 被 囚 欣 厭 情 深 聖 應 和 機 說 
X22n0405_001:0248b16	法感應道交方能獲果四如是時間下得益經有三	法 感 應 道 交 方 能 獲 果 四 如 是 時 間 下 得 益 經 有 三 
X22n0405_001:0248b17	意一明時節二顯食力三得現益。	意 一 明 時 節 二 顯 食 力 三 得 現 益 
X22n0405_001:0248b18	初闍世問守門者經有四意一問答二毀親三訶聖	初 闍 世 問 守 門 者 經 有 四 意 一 問 答 二 毀 親 三 訶 聖 
X22n0405_001:0248b19	四正害母毀親為賊者有二義故一是劫命賊昔共	四 正 害 母 毀 親 為 賊 者 有 二 義 故 一 是 劫 命 賊 昔 共 
X22n0405_001:0248b20	王斷仙人之命二盜食賊偷[麩夫+少]蜜漿以飼於王訶聖	王 斷 仙 人 之 命 二 盜 食 賊 偷 [麩夫少] 蜜 漿 以 飼 於 王 訶 聖 
X22n0405_001:0248b21	中二先人次法令惡王延惡命即執劒下四一正害	中 二 先 人 次 法 令 惡 王 延 惡 命 即 執 劒 下 四 一 正 害 
X22n0405_001:0248b22	母何其痛哉撮頭擬劒身命在於須臾慈母曲身合	母 何 其 痛 哉 撮 頭 擬 劒 身 命 在 於 須 臾 慈 母 曲 身 合 
X22n0405_001:0248b23	掌低頭就兒臨劒心神悶絕熱汗遍流恍忽之間逢	掌 低 頭 就 兒 臨 劒 心 神 悶 絕 熱 汗 遍 流 恍 忽 之 間 逢 
X22n0405_001:0248b24	斯極苦親所生子反逆心生殺父害母未曾聞見罪	斯 極 苦 親 所 生 子 反 逆 心 生 殺 父 害 母 未 曾 聞 見 罪 
X22n0405_001:0248c01	身當受敢有怨言今死成難冥當有報願王思念止	身 當 受 敢 有 怨 言 今 死 成 難 冥 當 有 報 願 王 思 念 止 
X22n0405_001:0248c02	殺害時一臣下二二臣勸不許害父為七初與伴申	殺 害 時 一 臣 下 二 二 臣 勸 不 許 害 父 為 七 初 與 伴 申 
X22n0405_001:0248c03	敬二白言下引證三王今為此下正諫四時二大臣	敬 二 白 言 下 引 證 三 王 今 為 此 下 正 諫 四 時 二 大 臣 
X22n0405_001:0248c04	下退躬五時阿闍世下求救六耆婆白下重諫七王	下 退 躬 五 時 阿 闍 世 下 求 救 六 耆 婆 白 下 重 諫 七 王 
X22n0405_001:0248c05	聞此語下止不害母菴羅女子者此女是毗舍離國	聞 此 語 下 止 不 害 母 菴 羅 女 子 者 此 女 是 毗 舍 離 國 
X22n0405_001:0248c06	大臣園中菴羅果樹上生即摩竭陀頻婆羅王到彼	大 臣 園 中 菴 羅 果 樹 上 生 即 摩 竭 陀 頻 婆 羅 王 到 彼 
X22n0405_001:0248c07	園中因即有身後生男長大兼先留王環為信送歸	園 中 因 即 有 身 後 生 男 長 大 兼 先 留 王 環 為 信 送 歸 
X22n0405_001:0248c08	本國策耆婆為太子後時既有闍王因託採藥遂讓	本 國 策 耆 婆 為 太 子 後 時 既 有 闍 王 因 託 採 藥 遂 讓 
X22n0405_001:0248c09	位不受出菴羅女經也經云毗陀論梵語此云明論	位 不 受 出 菴 羅 女 經 也 經 云 毗 陀 論 梵 語 此 云 明 論 
X22n0405_001:0248c10	詮義決定西方所重故依此經引古諫今古王無道	詮 義 決 定 西 方 所 重 故 依 此 經 引 古 諫 今 古 王 無 道 
X22n0405_001:0248c11	但害其父未曾害母王今害母罪踰昔王經云諸惡	但 害 其 父 未 曾 害 母 王 今 害 母 罪 踰 昔 王 經 云 諸 惡 
X22n0405_001:0248c12	者此總明非禮篡逆之人非一故云諸也剎利梵音	者 此 總 明 非 禮 篡 逆 之 人 非 一 故 云 諸 也 剎 利 梵 音 
X22n0405_001:0248c13	此云田主理應躬奉孝道率化萬民何自行逆害汙	此 云 田 主 理 應 躬 奉 孝 道 率 化 萬 民 何 自 行 逆 害 汙 
X22n0405_001:0248c14	剎利種是旃陀羅旃陀羅此云殺者極惡之人及蔑	剎 利 種 是 旃 陀 羅 旃 陀 羅 此 云 殺 者 極 惡 之 人 及 蔑 
X22n0405_001:0248c15	戾車等王今貴族云何同彼故云不宜住此有二義	戾 車 等 王 今 貴 族 云 何 同 彼 故 云 不 宜 住 此 有 二 義 
X22n0405_001:0248c16	故一者王今造惡不存風化京國神州豈遣旃陀羅	故 一 者 王 今 造 惡 不 存 風 化 京 國 神 州 豈 遣 旃 陀 羅 
X22n0405_001:0248c17	為王此合擯出宮城意二者王雖在國辱我宗親故	為 王 此 合 擯 出 宮 城 意 二 者 王 雖 在 國 辱 我 宗 親 故 
X22n0405_001:0248c18	須遠涉他邦永絕無聞之地故云不宜住此也經惶	須 遠 涉 他 邦 永 絕 無 聞 之 地 故 云 不 宜 住 此 也 經 惶 
X22n0405_001:0248c19	懼有二意一惶失位二懼臣叛。	懼 有 二 意 一 惶 失 位 二 懼 臣 叛 
X22n0405_001:0248c20	時韋提下請佛經有四一憂悴二申禮三正請見四	時 韋 提 下 請 佛 經 有 四 一 憂 悴 二 申 禮 三 正 請 見 四 
X22n0405_001:0248c21	悲哀再敬憂悴者心不悅樂名愁憂身無光澤稱為	悲 哀 再 敬 憂 悴 者 心 不 悅 樂 名 愁 憂 身 無 光 澤 稱 為 
X22n0405_001:0248c22	憔悴夫人憂悴備有六意一與大王生死永絕二與	憔 悴 夫 人 憂 悴 備 有 六 意 一 與 大 王 生 死 永 絕 二 與 
X22n0405_001:0248c23	眷眷思愛情離三厭斯穢境樂聞樂土四自指女質	眷 眷 思 愛 情 離 三 厭 斯 穢 境 樂 聞 樂 土 四 自 指 女 質 
X22n0405_001:0248c24	專求勝報五遙心請佛恐聖不應六自惟未修玅因	專 求 勝 報 五 遙 心 請 佛 恐 聖 不 應 六 自 惟 未 修 玅 因 
X22n0405_001:0249a01	不登上果具此諸事故身心不樂此六為二前二結	不 登 上 果 具 此 諸 事 故 身 心 不 樂 此 六 為 二 前 二 結 
X22n0405_001:0249a02	前後四生後離忍界極樂生感應至因果成未舉頭	前 後 四 生 後 離 忍 界 極 樂 生 感 應 至 因 果 成 未 舉 頭 
X22n0405_001:0249a03	下初神通經有三先明聖應時不異勝鬘者廣如寶	下 初 神 通 經 有 三 先 明 聖 應 時 不 異 勝 鬘 者 廣 如 寶 
X22n0405_001:0249a04	積經說勝鬘是波斯匿王末利夫人女嫁與踰闍國	積 經 說 勝 鬘 是 波 斯 匿 王 末 利 夫 人 女 嫁 與 踰 闍 國 
X22n0405_001:0249a05	王為夫人父母與女書云佛出我國神通自在普益	王 為 夫 人 父 母 與 女 書 云 佛 出 我 國 神通自在 普 益 
X22n0405_001:0249a06	眾生勝鬘執書啟告世尊世尊平等普化眾生此亦	眾 生 勝 鬘 執 書 啟 告 世 尊 世 尊 平 等 普 化 眾 生 此 亦 
X22n0405_001:0249a07	合現作白之時佛於空中現便讚如來玅色身等(云云)	合 現 作 白 之 時 佛 於 空 中 現 便 讚 如 來 玅 色 身 等 云 云 
X22n0405_001:0249a08	次知機三正感應中二初弟子次佛自性何故爾機	次 知 機 三 正 感 應 中 二 初 弟 子 次 佛 自 性 何 故 爾 機 
X22n0405_001:0249a09	宜不同應赴亦異大王機在弟子夫人感於二聖經	宜 不 同 應 赴 亦 異 大 王 機 在 弟 子 夫 人 感 於 二 聖 經 
X22n0405_001:0249a10	普雨天華持用供養者瑜伽云由七因緣釋梵諸天	普 雨 天 華 持 用 供 養 者 瑜 伽 云 由 七 因 緣 釋 梵 諸 天 
X22n0405_001:0249a11	來至佛所一供養二為聽法三為決疑故四翼從故	來 至 佛 所 一 供 養 二 為 聽 法 三 為 決 疑 故 四 翼 從 故 
X22n0405_001:0249a12	五為饒益他六敬重佛教故七欲起會故。	五 為 饒 益 他 六 敬 重 佛 教 故 七 欲 起 會 故 
X22n0405_001:0249a13	時韋提見下請生處有四一見佛傷嘆傷嘆者傷子	時 韋 提 見 下 請 生 處 有 四 一 見 佛 傷 嘆 傷 嘆 者 傷 子 
X22n0405_001:0249a14	無思是故悲傷嘆己宿罪此生惡報怨結難處情苦	無 思 是 故 悲 傷 嘆 己 宿 罪 此 生 惡 報 怨 結 難 處 情 苦 
X22n0405_001:0249a15	何堪障重殃深未達因果佛大聖三世照知唯願慈	何 堪 障 重 殃 深 未 達 因 果 佛 大 聖 三 世 照 知 唯 願 慈 
X22n0405_001:0249a16	悲示當生處捨茲穢境淨土受生當不願聞逆人名	悲 示 當 生 處 捨 茲 穢 境 淨 土 受 生 當 不 願 聞 逆 人 名 
X22n0405_001:0249a17	字傷嘆懺悔願佛哀怜次請說宿因三願聞淨土四	字 傷 嘆 懺 悔 願 佛 哀 怜 次 請 說 宿 因 三 願 聞 淨 土 四 
X22n0405_001:0249a18	遠離惡處今向世尊下經有二初三業悔過次專求	遠 離 惡 處 今 向 世 尊 下 經 有 二 初 三 業 悔 過 次 專 求 
X22n0405_001:0249a19	淨土生處。	淨 土 生 處 
X22n0405_001:0249a20	放光普示下經又三初明光體用次明光德色三明	放 光 普 示 下 經 又 三 初 明 光 體 用 次 明 光 德 色 三 明 
X22n0405_001:0249a21	中現土放眉間光者表中道理觀佛三昧經云如來	中 現 土 放 眉 間 光 者 表 中 道 理 觀 佛 三 昧 經 云 如 來 
X22n0405_001:0249a22	為太子時眉間白毫相長五尺至成道時長一丈五	為 太 子 時 眉間白毫相 長 五 尺 至 成 道 時 長 一 丈 五 
X22n0405_001:0249a23	尺舒之表裏清徹白色光明置之復卷聚在眉間至	尺 舒 之 表 裏 清 徹 白 色 光 明 置 之 復 卷 聚 在 眉 間 至 
X22n0405_001:0249a24	降魔時舒白毫毛至他化自在天彼天去閻浮提一	降 魔 時 舒 白 毫 毛 至 他化自在天 彼 天 去 閻 浮 提 一 
X22n0405_001:0249b01	百二十八萬由旬今放此光照十方界表眾生證中	百 二 十 八 萬 由 旬 今 放 此 光 照 十 方 界 表 眾 生 證 中 
X22n0405_001:0249b02	是光體用示土差別經有三先別次總三結今見。	是 光 體 用 示 土 差 別 經 有 三 先 別 次 總 三 結 今 見 
X22n0405_001:0249b03	去此不遠者經有四先問其定次明界遠近三勸觀	去 此 不 遠 者 經 有 四 先 問 其 定 次 明 界 遠 近 三 勸 觀 
X22n0405_001:0249b04	現果許為說譬經云如執明鏡自見面像狀如懸鼓	現 果 許 為 說 譬 經 云 如 執 明 鏡 自 見 面 像 狀 如 懸 鼓 
X22n0405_001:0249b05	如億千日又似星月如天瓔珞如旋火輪等四為未	如 億 千 日 又 似 星 月 如 天 瓔 珞 如 旋 火 輪 等 四 為 未 
X22n0405_001:0249b06	來世說修因法欲生彼國者經有三謂標列結列中	來 世 說 修 因 法 欲 生 彼 國 者 經 有 三 謂 標 列 結 列 中 
X22n0405_001:0249b07	初報恩敬法愍物行慈次生善離過二乘小行三因	初 報 恩 敬 法 愍 物 行 慈 次 生 善 離 過 二 乘 小 行 三 因 
X22n0405_001:0249b08	果發心大乘不共自他俱運結可知二佛告韋提此	果 發 心 大 乘 不 共 自 他 俱 運 結 可 知 二 佛 告 韋 提 此 
X22n0405_001:0249b09	三種下經有四一嘆正因二誡聽三許說淨業四讚	三 種 下 經 有 四 一 嘆 正 因 二 誡 聽 三 許 說 淨 業 四 讚 
X22n0405_001:0249b10	問合宜感應道交妙契機理即得無生法忍者經有	問 合 宜 感 應 道 交 妙 契 機 理 即 得無生法忍 者 經 有 
X22n0405_001:0249b11	三謂法喻合法中三一命阿難為眾廣說二佛自教	三 謂 法 喻 合 法 中 三 一 命 阿 難 為 眾 廣 說 二 佛 自 教 
X22n0405_001:0249b12	修行玅觀三顯佛力得見淨土言佛力者一釋迦說	修 行 玅 觀 三 顯 佛 力 得 見 淨 土 言 佛 力 者 一 釋 迦 說 
X22n0405_001:0249b13	力二彌陀願力三十方諸佛護念力喻中觀心如鏡	力 二 彌 陀 願 力 三 十方諸佛 護 念 力 喻 中 觀 心 如 鏡 
X22n0405_001:0249b14	所現土如面觀心變如影像見彼國土下合也無生	所 現 土 如 面 觀 心 變 如 影 像 見 彼 國 土 下 合 也 無 生 
X22n0405_001:0249b15	忍者由見是淨土稱本求心故生歡喜地應時即得	忍 者 由 見 是 淨 土 稱 本 求 心 故 生 歡 喜 地 應 時 即 得 
X22n0405_001:0249b16	者聞說玅觀意下文方得佛借方便令修玅因如教	者 聞 說 玅 觀 意 下 文 方 得 佛 借 方 便 令 修 玅 因 如 教 
X22n0405_001:0249b17	勤行因圓果滿獲無生忍入初住地。	勤 行 因 圓 果 滿 獲 無 生 忍 入 初 住 地 
X22n0405_001:0249b18	汝是凡夫下經有二一斥凡無力二顯聖有緣初影	汝 是 凡 夫 下 經 有 二 一 斥 凡 無 力 二 顯 聖 有 緣 初 影 
X22n0405_001:0249b19	障無聖德次心相無大勝見境不遙如我今者下問	障 無 聖 德 次 心 相 無 大 勝 見 境 不 遙 如 我 今 者 下 問 
X22n0405_001:0249b20	有二一自行因佛得見二為化眾生如何作觀得生	有 二 一 自 行 因 佛 得 見 二 為 化 眾 生 如 何 作 觀 得 生 
X22n0405_001:0249b21	淨土。	淨 土 
X22n0405_001:0249b22	答中十六觀答教我正受也文有三謂標列判判中	答 中 十 六 觀 答 教 我 正 受 也 文 有 三 謂 標 列 判 判 中 
X22n0405_001:0249b23	為二初十三觀觀往生處顯土勝彰土妙令觀淨境	為 二 初 十 三 觀 觀 往 生 處 顯 土 勝 彰 土 妙 令 觀 淨 境 
X22n0405_001:0249b24	覩極聖修勝因行玅行一念頃身證玅果豈非託境	覩 極 聖 修 勝 因 行 玅 行 一 念 頃 身 證 玅 果 豈 非 託 境 
X22n0405_001:0249c01	成觀轉穢為淨三惑破三身顯觀因圓果德滿觀眾	成 觀 轉 穢 為 淨 三 惑 破 三 身 顯 觀 因 圓 果 德 滿 觀 眾 
X22n0405_001:0249c02	感不同皆往生後三觀是得生人如文日指方所有	感 不 同 皆 往 生 後 三 觀 是 得 生 人 如 文 日 指 方 所 有 
X22n0405_001:0249c03	破闇之功如中觀除無明惑證得法身水有滌蕩澄	破 闇 之 功 如 中 觀 除 無 明 惑 證 得 法 身 水 有 滌 蕩 澄 
X22n0405_001:0249c04	清之德如假觀斷塵沙惑證得應身地為依報之本	清 之 德 如 假 觀 斷 塵 沙 惑 證 得 應 身 地 為 依 報 之 本 
X22n0405_001:0249c05	如座觀為身坐如空觀破見思惡證得報身如上次	如 座 觀 為 身 坐 如 空 觀 破 見 思 惡 證 得 報 身 如 上 次 
X22n0405_001:0249c06	第行時在一心中何以故假即空中空即假中中即	第 行 時 在 一 心 中 何 以 故 假 即 空 中 空 即 假 中 中 即 
X22n0405_001:0249c07	空假三觀互融而不一異即一而三即三而一非三	空 假 三 觀 互 融 而 不 一 異 即 一 而 三 即 三 而 一 非 三 
X22n0405_001:0249c08	非一而三而一圓融自在玅觀若斯豈同但中單空	非 一 而 三 而 一 圓 融 自 在 玅 觀 若 斯 豈 同 但 中 單 空 
X22n0405_001:0249c09	單假孤調解脫不具三觀者哉。	單 假 孤 調 解 脫 不 具 三 觀 者 哉 
X22n0405_001:0249c10	第一日觀文為五一勸修二作觀三舉所觀境四正	第 一 日 觀 文 為 五 一 勸 修 二 作 觀 三 舉 所 觀 境 四 正 
X22n0405_001:0249c11	教觀察五結初文二先明感應次勸修觀一切自非	教 觀 察 五 結 初 文 二 先 明 感 應 次 勸 修 觀 一 切 自 非 
X22n0405_001:0249c12	簡機皆見日沒舉境四教觀中二一修二既見日下	簡 機 皆 見 日 沒 舉 境 四 教 觀 中 二 一 修 二 既 見 日 下 
X22n0405_001:0249c13	觀成初文二先法次喻正坐簡異行住及臥行多掉	觀 成 初 文 二 先 法 次 喻 正 坐 簡 異 行 住 及 臥 行 多 掉 
X22n0405_001:0249c14	舉臥則昏沉立久疲勞故唯令坐坐結跏趺坐即左	舉 臥 則 昏 沉 立 久 疲 勞 故 唯 令 坐 坐 結跏趺坐 即 左 
X22n0405_001:0249c15	脚壓右脚右脚壓左脚能令身心不動定力所持諦	脚 壓 右 脚 右 脚 壓 左 脚 能 令 身 心 不 動 定 力 所 持 諦 
X22n0405_001:0249c16	於日心無散亂專相不移釋經喻者日沒舉所顯法	於 日 心 無 散 亂 專 相 不 移 釋 經 喻 者 日 沒 舉 所 顯 法 
X22n0405_001:0249c17	懸鼓明能顯喻。	懸 鼓 明 能 顯 喻 
