X22n0410_001:0374a08	譯不同真諦所譯謂之梁攝乃立第九真常淨識	譯 不 同 真 諦 所 譯 謂 之 梁 攝 乃 立 第 九 真 常 淨 識 
X22n0410_001:0374a09	[狀/廾]師所譯謂之唐攝不立第九乃云第九是第八	[狀廾] 師 所 譯 謂 之 唐 攝 不 立 第 九 乃 云 第 九 是 第 八 
X22n0410_001:0374a10	異名若然且如後世弘梁攝人見唐攝論謂之異	異 名 若 然 且 如 後 世 弘 梁 攝 人 見 唐 攝 論 謂 之 異 
X22n0410_001:0374a11	名豈謂梁攝但立八識由此論之新疏雖依善導	名 豈 謂 梁 攝 但 立 八 識 由 此 論 之 新 疏 雖 依 善 導 
X22n0410_001:0374a12	所說未知善導果是耶非耶吾宗釋經尚以善哉	所 說 未 知 善 導 果 是 耶 非 耶 吾 宗 釋 經 尚 以 善 哉 
X22n0410_001:0374a13	善哉二句相同之言謂之雙歎權實豈思惟正受	善 哉 二 句 相 同 之 言 謂 之 雙 歎 權 實 豈 思 惟 正 受 
X22n0410_001:0374a14	對當顯然不為異釋耶。	對 當 顯 然 不 為 異 釋 耶 
X22n0410_001:0374a15	論曰新疏所釋思惟正受之語設使不見善導玄義	論 曰 新 疏 所 釋 思 惟 正 受 之 語 設 使 不 見 善 導 玄 義 
X22n0410_001:0374a16	亦只合作請觀釋之何者凡論修觀必先起心思惟	亦 只 合 作 請 觀 釋 之 何 者 凡 論 修 觀 必 先 起 心 思 惟 
X22n0410_001:0374a17	決擇境觀不謬方入正觀但心境未忘猶屬思惟前	決 擇 境 觀 不 謬 方 入 正 觀 但 心 境 未 忘 猶 屬 思 惟 前 
X22n0410_001:0374a18	方便也心境一合觀成理顯名為正受作此釋者蓋	方 便 也 心 境 一 合 觀 成 理 顯 名 為 正 受 作 此 釋 者 蓋 
X22n0410_001:0374a19	本經文疏引地觀文云如此想者名為粗見極樂國	本 經 文 疏 引 地 觀 文 云 如 此 想 者 名 為 粗 見 極 樂 國 
X22n0410_001:0374a20	地即思惟也若得三昧見彼國地了了分明不可具	地 即 思 惟 也 若 得 三 昧 見 彼 國 地 了 了 分 明 不 可 具 
X22n0410_001:0374a21	說即正受也故曰設使不見玄義亦只合作請觀釋	說 即 正 受 也 故 曰 設 使 不 見 玄 義 亦 只 合 作 請 觀 釋 
X22n0410_001:0374a22	之何況玄義明有此說若合符節故得引之以成今	之 何 況 玄 義 明 有 此 說 若 合 符 節 故 得 引 之 以 成 今 
X22n0410_001:0374a23	義只緣韋提連請二句在文不顯善導恐人異解特	義 只 緣 韋 提 連 請 二 句 在 文 不 顯 善 導 恐 人 異 解 特 
X22n0410_001:0374a24	引華嚴異名釋之況思惟之名諸文多指正觀如普	引 華 嚴 異 名 釋 之 況 思 惟 之 名 諸 文 多 指 正 觀 如 普 
X22n0410_001:0374b01	賢觀云正念思惟一實境界又云思惟大乘心不休	賢 觀 云 正念思惟 一 實 境 界 又 云 思 惟 大 乘 心 不 休 
X22n0410_001:0374b02	廢輔行云思惟者正觀也又如諸文以三學收八正	廢 輔 行 云 思 惟 者 正 觀 也 又 如 諸 文 以 三 學 收 八 正 
X22n0410_001:0374b03	道則以思惟屬慧新疏為見韋提陳請之後經文隔	道 則 以 思 惟 屬 慧 新 疏 為 見 韋 提 陳 請 之 後 經 文 隔 
X22n0410_001:0374b04	絕將及半紙方云欲生彼國當修三福則非彰灼提	絕 將 及 半 紙 方 云 欲 生 彼 國 當 修 三 福 則 非 彰 灼 提 
X22n0410_001:0374b05	起前問雙酬所請是故得作助道釋之此說本於唐	起 前 問 雙 酬 所 請 是 故 得 作 助 道 釋 之 此 說 本 於 唐 
X22n0410_001:0374b06	朝善導至今經數百載玄義見行於世爾前不聞排	朝 善 導 至 今 經 數 百 載 玄 義 見 行 於 世 爾 前 不 聞 排 
X22n0410_001:0374b07	斥今疏乃是承用他義何苦諱之所引梁唐二攝立	斥 今 疏 乃 是 承 用 他 義 何 苦 諱 之 所 引 梁 唐 二 攝 立 
X22n0410_001:0374b08	識異名為今三昧異名例者今借彼例而反質之何	識 異 名 為 今 三 昧 異 名 例 者 今 借 彼 例 而 反 質 之 何 
X22n0410_001:0374b09	者梁攝雖見唐攝謂九識是八識異名曾不依用還	者 梁 攝 雖 見 唐 攝 謂 九 識 是 八 識 異 名 曾 不 依 用 還 
X22n0410_001:0374b10	立九識輔正何必抑令新疏須依天台以三福答思	立 九 識 輔 正 何 必 抑 令 新 疏 須 依 天 台 以 三 福 答 思 
X22n0410_001:0374b11	惟耶又復雖引異名為例其例不當何者自古所謂	惟 耶 又 復 雖 引 異 名 為 例 其 例 不 當 何 者 自 古 所 謂 
X22n0410_001:0374b12	地分南北攝有梁唐正緣立識或八或九或真或妄	地 分 南 北 攝 有 梁 唐 正 緣 立 識 或 八 或 九 或 真 或 妄 
X22n0410_001:0374b13	互相破立頓同水火是故唐攝雖謂九是八之異名	互 相 破 立 頓 同 水 火 是 故 唐 攝 雖 謂 九 是 八 之 異 名 
X22n0410_001:0374b14	梁攝不依宜矣今來善導為消經文彼華嚴恰相宛	梁 攝 不 依 宜 矣 今 來 善 導 為 消 經 文 彼 華 嚴 恰 相 宛 
X22n0410_001:0374b15	順故得用之豈與二攝諍競是同又引善哉二句為	順 故 得 用 之 豈 與 二 攝 諍 競 是 同 又 引 善 哉 二 句 為 
X22n0410_001:0374b16	例者此亦未為通論但在法華四大聲聞領解法譬	例 者 此 亦 未 為 通 論 但 在 法 華 四 大 聲 聞 領 解 法 譬 
X22n0410_001:0374b17	二周權實之法故使智者作雙歎釋之餘經則不然	二 周 權 實 之 法 故 使 智 者 作 雙 歎 釋 之 餘 經 則 不 然 
X22n0410_001:0374b18	智論云再言之者善之至也霅川釋金剛經云再言	智 論 云 再 言 之 者 善 之 至 也 霅 川 釋 金 剛 經 云 再 言 
X22n0410_001:0374b19	善哉者善之極也又且如何。	善 哉 者 善 之 極 也 又 且 如 何 
X22n0410_001:0374b20	新疏云淨土之行無魔能惱具列諸師無魔之說	新 疏 云 淨 土 之 行 無 魔 能 惱 具 列 諸 師 無 魔 之 說 
X22n0410_001:0374b21	此土入道則有於魔淨土諸經並不言魔即知此	此 土 入 道 則 有 於 魔 淨 土 諸 經 並 不 言 魔 即 知 此 
X22n0410_001:0374b22	法無魔明矣。	法 無 魔 明 矣 
X22n0410_001:0374b23	輔正曰所言淨土諸經不言魔者寡乎聞見鼓音	輔 正 曰 所 言 淨 土 諸 經 不 言 魔 者 寡 乎 聞 見 鼓 音 
X22n0410_001:0374b24	王經云阿彌陀佛應正遍知父名月上轉輪聖王	王 經 云 阿 彌 陀 佛 應 正 遍 知 父 名 月 上 轉輪聖王 
X22n0410_001:0374c01	爾時魔王名曰無勝此是佛言淨土有魔新疏返	爾 時 魔 王 名 曰 無 勝 此 是 佛 言 淨 土 有 魔 新 疏 返 
X22n0410_001:0374c02	言無魔佛與新疏何霄壤乎。	言 無 魔 佛 與 新 疏 何 霄 壤 乎 
X22n0410_001:0374c03	論曰凡欲立言垂訓展拓教門必先觀其大途不可	論 曰 凡 欲 立 言 垂 訓 展 拓 教 門 必 先 觀 其 大 途 不 可 
X22n0410_001:0374c04	拘於小節且彼安養淨土若使有魔則與五濁惡世	拘 於 小 節 且 彼 安養淨土 若 使 有 魔 則 與 五濁惡世 
X22n0410_001:0374c05	何以異耶所以羣經眾論不說魔者正為此輔正所	何 以 異 耶 所 以 羣 經 眾 論 不 說 魔 者 正 為 此 輔 正 所 
X22n0410_001:0374c06	據鼓音王經言淨土有魔者料想不聞大論彌陀亦	據 鼓 音 王 經 言 淨 土 有 魔 者 料 想 不 聞 大 論 彌 陀 亦 
X22n0410_001:0374c07	有不嚴淨國之說致茲妄謂當知彼經正是彌陀現	有 不 嚴 淨 國 之 說 致 茲 妄 謂 當 知 彼 經 正 是 彌 陀 現 
X22n0410_001:0374c08	穢之文那將難今淨土略舉一事較其優劣彼經明	穢 之 文 那 將 難 今 淨 土 略 舉 一 事 較 其 優 劣 彼 經 明 
X22n0410_001:0374c09	土乃云十千由旬此經明身乃云六十萬億那由他	土 乃 云 十 千 由 旬 此 經 明 身 乃 云 六 十 萬 億 那 由 他 
X22n0410_001:0374c10	恒河沙由旬以彼陋劣之土安能容此長大之身土	恒 河 沙 由 旬 以 彼 陋 劣 之 土 安 能 容 此 長 大 之 身 土 
X22n0410_001:0374c11	天殊驗知彼經現穢明矣是故孤山霅川並據大論	天 殊 驗 知 彼 經 現 穢 明 矣 是 故 孤 山 霅 川 並 據 大 論 
X22n0410_001:0374c12	引彼經云阿彌陀佛婆羅門種母名殊勝玅顏亦有	引 彼 經 云 阿 彌 陀 佛 婆 羅 門 種 母 名 殊 勝 玅 顏 亦 有 
X22n0410_001:0374c13	惡逆弟子名曰調達既有女人及惡逆者豈非彌陀	惡 逆 弟 子 名 曰 調 達 既 有 女 人 及 惡 逆 者 豈 非 彌 陀 
X22n0410_001:0374c14	現穢土耶(文)慈雲法師亦嘗料簡云鼓音王經佛母	現 穢 土 耶 文 慈 雲 法 師 亦 嘗 料 簡 云 鼓 音 王 經 佛 母 
X22n0410_001:0374c15	殊勝玅顏是則淨土亦有女人等耶答佛母恐指降	殊 勝 玅 顏 是 則 淨 土 亦 有 女 人 等 耶 答 佛 母 恐 指 降 
X22n0410_001:0374c16	生之時成正覺後國土隨淨必無女人其母或轉成	生 之 時 成 正 覺 後 國 土 隨 淨 必 無 女 人 其 母 或 轉 成 
X22n0410_001:0374c17	男子如此方龍女或復命終如悉達母(文)慈雲且據	男 子 如 此 方 龍 女 或 復 命 終 如 悉 達 母 文 慈 雲 且 據 
X22n0410_001:0374c18	女人一義料簡既指鼓音王經餘可例知今應例云	女 人 一 義 料 簡 既 指 鼓 音 王 經 餘 可 例 知 今 應 例 云 
X22n0410_001:0374c19	魔王恐指降生之時成正覺後國土隨淨必無魔王	魔 王 恐 指 降 生 之 時 成 正 覺 後 國 土 隨 淨 必 無 魔 王 
X22n0410_001:0374c20	況復天台十疑論中明五不退第四乃云外無鬼神	況 復 天 台 十 疑 論 中 明 五 不 退 第 四 乃 云 外 無 鬼 神 
X22n0410_001:0374c21	魔邪內無三毒煩惱(文)荊溪玅樂云佛國亦有品差	魔 邪 內 無 三 毒 煩 惱 文 荊 溪 玅 樂 云 佛 國 亦 有 品 差 
X22n0410_001:0374c22	不同既無女人必無惡道或時有女人亦無惡道如	不 同 既 無 女 人 必 無 惡 道 或 時 有 女 人 亦 無 惡 道 如 
X22n0410_001:0374c23	阿閦佛國雖有女人而無女事無量壽國二種俱無	阿 閦 佛 國 雖 有 女 人 而 無 女 事 無 量 壽 國 二 種 俱 無 
X22n0410_001:0374c24	(文)言二種者謂女人惡道也魔即惡道所收既云俱	 文 言 二 種 者 謂 女 人 惡 道 也 魔 即 惡 道 所 收 既 云 俱 
X22n0410_001:0375a01	無豈得復有魔耶佛祖正教皎如白日皆云淨土無	無 豈 得 復 有 魔 耶 佛 祖 正 教 皎 如 白 日 皆 云 淨 土 無 
X22n0410_001:0375a02	魔曾不披尋反責新疏寡於聞見識者觀之可發一	魔 曾 不 披 尋 反 責 新 疏 寡 於 聞 見 識 者 觀 之 可 發 一 
X22n0410_001:0375a03	笑。	笑 
X22n0410_001:0375a04	新疏云有人云心若清淨即是自性西方何必求	新 疏 云 有 人 云 心 若 清 淨 即 是 自 性 西 方 何 必 求 
X22n0410_001:0375a05	生他方淨土今謂非無此理斯乃教中法性理土	生 他 方 淨 土 今 謂 非 無 此 理 斯 乃 教 中 法 性 理 土 
X22n0410_001:0375a06	而非今經所明淨土然具縛凡夫未登忍地假令	而 非 今 經 所 明 淨 土 然 具 縛 凡 夫 未 登 忍 地 假 令 
X22n0410_001:0375a07	頓悟自心孰能恒守清淨法雖高玅不攝羣機但	頓 悟 自 心 孰 能 恒 守 清 淨 法 雖 高 玅 不 攝 羣 機 但 
X22n0410_001:0375a08	有虗言何造入。	有 虗 言 何 造 入 
X22n0410_001:0375a09	輔正曰法華高玅究竟雄談無非玅乘盡是自性	輔 正 曰 法 華 高 玅 究 竟 雄 談 無 非 玅 乘 盡 是 自 性 
X22n0410_001:0375a10	豈但虗言而不造入何緣高玅不攝羣機苦哉斯	豈 但 虗 言 而 不 造 入 何 緣 高 玅 不 攝 羣 機 苦 哉 斯 
X22n0410_001:0375a11	言謗瀆尊典又謂教中法性理土非西方淨土者	言 謗 瀆 尊 典 又 謂 教 中 法 性 理 土 非 西方淨土 者 
X22n0410_001:0375a12	何故藥王云聞是品者命終即往安樂世界阿彌	何 故 藥 王 云 聞 是 品 者 命 終 即 往 安樂世界 阿 彌 
X22n0410_001:0375a13	陀佛所耶且聞法華生彌陀土豈非大乘玅典身	陀 佛 所 耶 且 聞 法 華 生 彌 陀 土 豈 非 大 乘 玅 典 身 
X22n0410_001:0375a14	土教行無不包攝那云西方非法性土乃至云天	土 教 行 無 不 包 攝 那 云 西 方 非 法 性 土 乃 至 云 天 
X22n0410_001:0375a15	台修心玅觀感四淨土為宗玅盡大乘攝一切無	台 修 心 玅 觀 感 四 淨 土 為 宗 玅 盡 大 乘 攝 一 切 無 
X22n0410_001:0375a16	非西方(云云)。	非 西 方 云 云 
X22n0410_001:0375a17	論曰凡論身土自有橫竪即離之殊無宜一混斯乃	論 曰 凡 論 身 土 自 有 橫 竪 即 離 之 殊 無 宜 一 混 斯 乃 
X22n0410_001:0375a18	不分而分分而不分也究而言之唯一法性理土爾	不 分 而 分 分 而 不 分 也 究 而 言 之 唯 一 法 性 理 土 爾 
X22n0410_001:0375a19	然此法性理土所謂毗盧遮那遍一切諸法無非佛	然 此 法 性 理 土 所 謂 毗 盧 遮 那 遍 一切諸法 無 非 佛 
X22n0410_001:0375a20	法人人本具法法圓成一切大乘皆作此說豈唯法	法 人 人 本 具 法 法 圓 成 一切大乘 皆 作 此 說 豈 唯 法 
X22n0410_001:0375a21	華此理灼然高玅非是下凡心力所及經云唯佛一	華 此 理 灼 然 高 玅 非 是 下 凡 心 力 所 及 經 云 唯 佛 一 
X22n0410_001:0375a22	人居淨土蓋為此也世人多有倚傍聖教高談闊論	人 居 淨 土 蓋 為 此 也 世 人 多 有 倚 傍 聖 教 高 談 闊 論 
X22n0410_001:0375a23	便謂心淨土淨不假起修新疏所以責云但有虗言	便 謂 心 淨 土 淨 不 假 起 修 新 疏 所 以 責 云 但 有 虗 言 
X22n0410_001:0375a24	何由造入那謂謗經所引藥王品聞經往生之語謂	何 由 造 入 那 謂 謗 經 所 引 藥 王 品 聞 經 往 生 之 語 謂 
X22n0410_001:0375b01	之法性理土者何太徑[彳*廷]乎若約理言之無不可者	之 法 性 理 土 者 何 太 徑 [彳廷] 乎 若 約 理 言 之 無 不 可 者 
X22n0410_001:0375b02	若約事言之恐未必然何者且法性理土即常寂光	若 約 事 言 之 恐 未 必 然 何 者 且 法 性 理 土 即 常 寂 光 
X22n0410_001:0375b03	常寂光中豈有極樂世界之名阿彌陀佛之號當知	常 寂 光 中 豈 有 極樂世界 之 名 阿 彌 陀 佛 之 號 當 知 
X22n0410_001:0375b04	不分而分且指同居淨土彌陀應身可也又云一切	不 分 而 分 且 指 同 居 淨 土 彌 陀 應 身 可 也 又 云 一 切 
X22n0410_001:0375b05	無非西方者此蓋不究淨土之教特異常途遂致作	無 非 西 方 者 此 蓋 不 究 淨 土 之 教 特 異 常 途 遂 致 作 
X22n0410_001:0375b06	此瞞頇之說若也一切無非西方何必韋提俯為末	此 瞞 頇 之 說 若 也 一 切 無 非 西 方 何 必 韋 提 俯 為 末 
X22n0410_001:0375b07	代再三陳請何必釋迦光現土令韋提希隨意揀選	代 再 三 陳 請 何 必 釋 迦 光 現 土 令 韋 提 希 隨 意 揀 選 
X22n0410_001:0375b08	當知新疏如向區別極有眉目公心荷法試為詳鑑。	當 知 新 疏 如 向 區 別 極 有 眉 目 公 心 荷 法 試 為 詳 鑑 
X22n0410_001:0375b09	新疏云陳徐陵云願即還人中不高下處托生等	新 疏 云 陳 徐 陵 云 願 即 還 人 中 不 高 下 處 托 生 等 
X22n0410_001:0375b10	彼乃儒流不在言責禪講宗師率多此見皆言後	彼 乃 儒 流 不 在 言 責 禪 講 宗 師 率 多 此 見 皆 言 後 
X22n0410_001:0375b11	世不失男子出家學道嘗試語曰汝今已得男子	世 不 失 男 子 出家學道 嘗 試 語 曰 汝 今 已 得 男 子 
X22n0410_001:0375b12	出家只合更求出離何乃復求男子再願出家略	出 家 只 合 更 求 出 離 何 乃 復 求 男 子 再 願 出 家 略 
X22n0410_001:0375b13	無勝進乎。	無 勝 進 乎 
X22n0410_001:0375b14	輔正曰新疏出言不量憂患也縱有妄人作此見	輔 正 曰 新 疏 出 言 不 量 憂 患 也 縱 有 妄 人 作 此 見 
X22n0410_001:0375b15	解安形紙筆輙斥他宗況深禪玅教之人有德必	解 安 形 紙 筆 輙 斥 他 宗 況 深 禪 玅 教 之 人 有 德 必 
X22n0410_001:0375b16	言豈可混同以彰無據人或聞見讒瀆滋興不省	言 豈 可 混 同 以 彰 無 據 人 或 聞 見 讒 瀆 滋 興 不 省 
X22n0410_001:0375b17	由來責他橫逆彼宗學者宜刊正之。	由 來 責 他 橫 逆 彼 宗 學 者 宜 刊 正 之 
X22n0410_001:0375b18	論曰新疏為見儒釋之流雖號學佛而無超宗越格	論 曰 新 疏 為 見 儒 釋 之 流 雖 號 學 佛 而 無 超 宗 越 格 
X22n0410_001:0375b19	之見多滯常情所以苦口提誘反為輔正詆訶乃謂	之 見 多 滯 常 情 所 以 苦 口 提 誘 反 為 輔 正 詆 訶 乃 謂 
X22n0410_001:0375b20	深禪玅教之人有德必言今謂若是深禪玅教之人	深 禪 玅 教 之 人 有 德 必 言 今 謂 若 是 深 禪 玅 教 之 人 
X22n0410_001:0375b21	必不作此見解作此見解必非深禪玅教之人徐陵	必 不 作 此 見 解 作 此 見 解 必 非 深 禪 玅 教 之 人 徐 陵 
X22n0410_001:0375b22	乃陳朝重臣願文行世後人無識遞相授受為患非	乃 陳 朝 重 臣 願 文 行 世 後 人 無 識 遞 相 授 受 為 患 非 
X22n0410_001:0375b23	淺新疏愍此旁及禪講激勵勝進何憂患之有耶輔	淺 新 疏 愍 此 旁 及 禪 講 激 勵 勝 進 何 憂 患 之 有 耶 輔 
X22n0410_001:0375b24	正故欲埋沒新疏復令彼宗學者共刊正之何苦如	正 故 欲 埋 沒 新 疏 復 令 彼 宗 學 者 共 刊 正 之 何 苦 如 
X22n0410_001:0375c01	此。	此 
X22n0410_001:0375c02	新疏云天台疏云舉正報以收依報述化主以包	新 疏 云 天 台 疏 云 舉 正 報 以 收 依 報 述 化 主 以 包 
X22n0410_001:0375c03	徒眾觀雖十六言佛便周此約以要包攝前後釋	徒 眾 觀 雖 十 六 言 佛 便 周 此 約 以 要 包 攝 前 後 釋 
X22n0410_001:0375c04	也遠師疏云此經以觀佛為主故偏言之此據經	也 遠 師 疏 云 此 經 以 觀 佛 為 主 故 偏 言 之 此 據 經 
X22n0410_001:0375c05	宗諸觀相從釋也今詳兩釋後義尤長。	宗 諸 觀 相 從 釋 也 今 詳 兩 釋 後 義 尤 長 
X22n0410_001:0375c06	輔正曰理而言之遠疏有失天台則優與而為語	輔 正 曰 理 而 言 之 遠 疏 有 失 天 台 則 優 與 而 為 語 
X22n0410_001:0375c07	言偏意周彼此俱美新疏如何棄優取失且遠疏	言 偏 意 周 彼 此 俱 美 新 疏 如 何 棄 優 取 失 且 遠 疏 
X22n0410_001:0375c08	觀佛為主未必顯立相從之義天台舉正收依述	觀 佛 為 主 未 必 顯 立 相 從 之 義 天 台 舉 正 收 依 述 
X22n0410_001:0375c09	主包眾相從之義已在其間故云理而言之遠疏	主 包 眾 相 從 之 義 已 在 其 間 故 云 理 而 言 之 遠 疏 
X22n0410_001:0375c10	有失天台則優若與而為語言偏意周彼此俱美	有 失 天 台 則 優 若 與 而 為 語 言 偏 意 周 彼 此 俱 美 
X22n0410_001:0375c11	者天台主正包收之說曷無遠師觀佛為主之意	者 天 台 主 正 包 收 之 說 曷 無 遠 師 觀 佛 為 主 之 意 
X22n0410_001:0375c12	遠師觀佛主之言曷無天台主正包收之道作此	遠 師 觀 佛 主 之 言 曷 無 天 台 主 正 包 收 之 道 作 此 
X22n0410_001:0375c13	評品優劣可知。	評 品 優 劣 可 知 
X22n0410_001:0375c14	論曰北遠天台二疏行世莫非利物俱贊淨方其猶	論 曰 北 遠 天 台 二 疏 行 世 莫 非 利 物 俱 贊 淨 方 其 猶 
X22n0410_001:0375c15	當衢置罇隨人斟酌新疏述作但與己見參同於即	當 衢 置 罇 隨 人 斟 酌 新 疏 述 作 但 與 己 見 參 同 於 即 
X22n0410_001:0375c16	承用何分彼此蓋緣新疏以觀佛為宗而況經題偏	承 用 何 分 彼 此 蓋 緣 新 疏 以 觀 佛 為 宗 而 況 經 題 偏 
X22n0410_001:0375c17	言觀佛恰與遠疏符合故特取之此亦何害天台之	言 觀 佛 恰 與 遠 疏 符 合 故 特 取 之 此 亦 何 害 天 台 之 
X22n0410_001:0375c18	說若謂不合舍天台取遠疏者設或承用天台則應	說 若 謂 不 合 舍 天 台 取 遠 疏 者 設 或 承 用 天 台 則 應 
X22n0410_001:0375c19	遠疏又後興諍何窮已耶今觀遠疏天台立義天別	遠 疏 又 後 興 諍 何 窮 已 耶 今 觀 遠 疏 天 台 立 義 天 別 
X22n0410_001:0375c20	而輔正為見新疏獨取遠疏乃作二義攀齊初曰理	而 輔 正 為 見 新 疏 獨 取 遠 疏 乃 作 二 義 攀 齊 初 曰 理 
X22n0410_001:0375c21	而言之遠疏有失天台則優遠疏但云觀佛為主故	而 言 之 遠 疏 有 失 天 台 則 優 遠 疏 但 云 觀 佛 為 主 故 
X22n0410_001:0375c22	偏舉之未必顯立相從之義天台既云舉正收依述	偏 舉 之 未 必 顯 立 相 從 之 義 天 台 既 云 舉 正 收 依 述 
X22n0410_001:0375c23	主包眾則相從之義已在其間者今謂輔正何偏黨	主 包 眾 則 相 從 之 義 已 在 其 間 者 今 謂 輔 正 何 偏 黨 
X22n0410_001:0375c24	乎所言遠疏未必顯立相從之義謂之失者且輔正	乎 所 言 遠 疏 未 必 顯 立 相 從 之 義 謂 之 失 者 且 輔 正 
X22n0410_001:0376a01	既云天台相從之義已在其間亦非顯立以此論之	既 云 天 台 相 從 之 義 已 在 其 間 亦 非 顯 立 以 此 論 之 
X22n0410_001:0376a02	失則俱失優次曰若與而為語言偏意周彼此俱美	失 則 俱 失 優 次 曰 若 與 而 為 語 言 偏 意 周 彼 此 俱 美 
X22n0410_001:0376a03	天台主正包收之說曷無遠師觀佛為主之意等者	天 台 主 正 包 收 之 說 曷 無 遠 師 觀 佛 為 主 之 意 等 者 
X22n0410_001:0376a04	今謂天台主正包收則通該十六遠師觀佛為主則	今 謂 天 台 主 正 包 收 則 通 該 十 六 遠 師 觀 佛 為 主 則 
X22n0410_001:0376a05	偏取經宗並據經疏現文而說安以義推却將天台	偏 取 經 宗 並 據 經 疏 現 文 而 說 安 以 義 推 却 將 天 台 
X22n0410_001:0376a06	攀齊遠疏反顯天台未盡理耶輔正不為天台作主	攀 齊 遠 疏 反 顯 天 台 未 盡 理 耶 輔 正 不 為 天 台 作 主 
X22n0410_001:0376a07	却被新疏一語所轉便隨他去天台之意果如是乎。	却 被 新 疏 一 語 所 轉 便 隨 他 去 天 台 之 意 果 如 是 乎 
X22n0410_001:0376a08	新疏云無量壽亦云無量光即同居淨土攝生教	新 疏 云 無 量 壽 亦 云 無 量 光 即 同 居 淨 土 攝 生 教 
X22n0410_001:0376a09	主觀音補處實有壽限且據凡小莫數故言無量	主 觀 音 補 處 實 有 壽 限 且 據 凡 小 莫 數 故 言 無 量 
X22n0410_001:0376a10	輔正曰今經所談淨土屬生死耶法性耶若云生	輔 正 曰 今 經 所 談 淨 土 屬 生 死 耶 法 性 耶 若 云 生 
X22n0410_001:0376a11	死新疏上文自云此經圓頓上乘成佛之法是心	死 新 疏 上 文 自 云 此 經 圓 頓 上 乘 成 佛 之 法 是 心 
X22n0410_001:0376a12	是佛出自今經韋提一聞證無生忍豈有圓頓之	是 佛 出 自 今 經 韋 提 一 聞 證 無 生 忍 豈 有 圓 頓 之 
X22n0410_001:0376a13	機所生之土屬生死耶屬法性土者今文既云觀	機 所 生 之 土 屬 生 死 耶 屬 法 性 土 者 今 文 既 云 觀 
X22n0410_001:0376a14	音補處是生死身如何不是生死國耶。	音 補 處 是 生 死 身 如 何 不 是 生 死 國 耶 
X22n0410_001:0376a15	論曰輔正必欲擊揚新疏故作此說果持此見何足	論 曰 輔 正 必 欲 擊 揚 新 疏 故 作 此 說 果 持 此 見 何 足 
X22n0410_001:0376a16	以為輔正耶猶恐後學未明略為點示當知若了萬	以 為 輔 正 耶 猶 恐 後 學 未 明 略 為 點 示 當 知 若 了 萬 
X22n0410_001:0376a17	法唯心即生死土是法性土所謂豈離伽耶別求常	法 唯 心 即 生 死 土 是 法 性 土 所 謂 豈 離 伽 耶 別 求 常 
X22n0410_001:0376a18	寂土既如是身豈不然雖云前佛涅槃後佛補處佛	寂 土 既 如 是 身 豈 不 然 雖 云 前 佛 涅 槃 後 佛 補 處 佛 
X22n0410_001:0376a19	佛道同未嘗生滅新疏一筆製作前後豈有相違達	佛 道 同 未 嘗 生 滅 新 疏 一 筆 製 作 前 後 豈 有 相 違 達 
X22n0410_001:0376a20	理者無往不通執情者觸途成礙。	理 者 無 往 不 通 執 情 者 觸 途 成 礙 
X22n0410_001:0376a21	新疏曰因修獲證得無生忍位當初住。	新 疏 曰 因 修 獲 證 得無生忍 位 當 初 住 
X22n0410_001:0376a22	輔正曰據何經論以無生忍位當初住經中忍位	輔 正 曰 據 何 經 論 以 無 生 忍 位 當 初 住 經 中 忍 位 
X22n0410_001:0376a23	乃有五名無生忍位即第四也又初住位經中所	乃 有 五 名 無 生 忍 位 即 第 四 也 又 初 住 位 經 中 所 
X22n0410_001:0376a24	明其義不同華嚴經明四十位住前更無地位可	明 其 義 不 同 華 嚴 經 明 四 十 位 住 前 更 無 地 位 可 
X22n0410_001:0376b01	論縱依瓔珞住前更立十信位者若以五忍前之	論 縱 依 瓔 珞 住 前 更 立 十 信 位 者 若 以 五 忍 前 之 
X22n0410_001:0376b02	三忍破惑證理淺深相狀格量十信如何對之等。	三 忍 破 惑 證 理 淺 深 相 狀 格 量 十 信 如 何 對 之 等 
X22n0410_001:0376b03	論曰韋提凡夫一聞玅觀隨觀修習即破無明證無	論 曰 韋 提 凡 夫 一 聞 玅 觀 隨 觀 修 習 即 破 無 明 證 無 
X22n0410_001:0376b04	生忍既破無明不應證前似位尚是初心不應證後	生 忍 既 破 無 明 不 應 證 前 似 位 尚 是 初 心 不 應 證 後 
X22n0410_001:0376b05	玅覺是故新疏據諸經論所說四十二品無明豎對	玅 覺 是 故 新 疏 據 諸 經 論 所 說 四 十 二 品 無 明 豎 對 
X22n0410_001:0376b06	四十二位韋提初破一品無明位當初住如華嚴經	四 十 二 位 韋 提 初 破 一 品 無 明 位 當 初 住 如 華 嚴 經 
X22n0410_001:0376b07	云初發心時便成正覺此非初住之明文乎縱將五	云 初 發 心 時 便 成 正 覺 此 非 初 住 之 明 文 乎 縱 將 五 
