X22n0405_001:0249c18	二水觀中三初結前生後明所觀境二修行三結次	二 水 觀 中 三 初 結 前 生 後 明 所 觀 境 二 修 行 三 結 次 
X22n0405_001:0249c19	第修觀中四三如文第四結文有四初總明內外明	第 修 觀 中 四 三 如 文 第 四 結 文 有 四 初 總 明 內 外 明 
X22n0405_001:0249c20	地下眾寶光明地上諸相莊嚴四明虗空中莊嚴次	地 下 眾 寶 光 明 地 上 諸相莊嚴 四 明 虗 空 中 莊 嚴 次 
X22n0405_001:0249c21	地下寶幢光色及喻(云云)一一寶中下四虗空中有色	地 下 寶 幢 光 色 及 喻 云 云 一 一 寶 中 下 四 虗 空 中 有 色 
X22n0405_001:0249c22	光日星月樓閣華幢樂器清風演四諦法八種清風	光 日 星 月 樓 閣 華 幢 樂 器 清 風 演 四 諦 法 八 種 清 風 
X22n0405_001:0249c23	者如無量壽經云一者不寒二者不熱三者起動調	者 如 無 量 壽 經 云 一 者 不 寒 二 者 不 熱 三 者 起 動 調 
X22n0405_001:0249c24	和四直好無比五徐徐不起六不遲七不疾八者遍	和 四 直 好 無 比 五 徐 徐 不 起 六 不 遲 七 不 疾 八 者 遍 
X22n0405_001:0250a01	得中宜平攝物心三結中三先結次第次明觀成。	得 中 宜 平 攝 物 心 三 結 中 三 先 結 次 第 次 明 觀 成 
X22n0405_001:0250a02	三地觀佛告下三利益中二先益觀宣說次明利益	三 地 觀 佛 告 下 三 利 益 中 二 先 益 觀 宣 說 次 明 利 益 
X22n0405_001:0250a03	利益中二一此土次他方此觀成時重罪滅淨土生	利 益 中 二 一 此 土 次 他 方 此 觀 成 時 重 罪 滅 淨 土 生 
X22n0405_001:0250a04	必無疑惑日水二觀既在此土借為後觀之方便故	必 無 疑 惑 日 水 二 觀 既 在 此 土 借 為 後 觀 之 方 便 故 
X22n0405_001:0250a05	不能滅罪。	不 能 滅 罪 
X22n0405_001:0250a06	四樹觀二明莊嚴中又二初明樹相莊嚴次明於空	四 樹 觀 二 明 莊 嚴 中 又 二 初 明 樹 相 莊 嚴 次 明 於 空 
X22n0405_001:0250a07	中莊嚴初之經有四謂高廣具足七寶互莊嚴玅真	中 莊 嚴 初 之 經 有 四 謂 高 廣 具 足 七 寶 互 莊 嚴 玅 真 
X22n0405_001:0250a08	珠羅網彌覆其上一由旬四十里即高三十二萬里	珠 羅 網 彌 覆 其 上 一 由 旬 四 十 里 即 高 三 十 二 萬 里 
X22n0405_001:0250a09	次空中有二謂法喻法中四謂寶網七寶華宮五百	次 空 中 有 二 謂 法 喻 法 中 四 謂 寶 網 七 寶 華 宮 五 百 
X22n0405_001:0250a10	億天童自然摩尼瓔珞三明生法中二謂法喻合法	億 天 童 自 然 摩 尼 瓔 珞 三 明 生 法 中 二 謂 法 喻 合 法 
X22n0405_001:0250a11	中四謂行葉相次華果具足葉量大小華葉色相。	中 四 謂 行 葉 相 次 華 果 具 足 葉 量 大 小 華 葉 色 相 
X22n0405_001:0250a12	五池觀中有五如文池體中三初結前生後次數三	五 池 觀 中 有 五 如 文 池 體 中 三 初 結 前 生 後 次 數 三 
X22n0405_001:0250a13	體池相下有四謂水本水支池渠底沙池華數量三	體 池 相 下 有 四 謂 水 本 水 支 池 渠 底 沙 池 華 數 量 三 
X22n0405_001:0250a14	明隨心中有二四諦通大小六度四人修即生滅無	明 隨 心 中 有 二 四 諦 通 大 小 六 度 四 人 修 即 生 滅 無 
X22n0405_001:0250a15	生無量無作前二界內斷見思惑得五分法身後二	生 無 量 無 作 前 二 界 內 斷 見 思 惑 得 五分法身 後 二 
X22n0405_001:0250a16	界外斷無明惑次第頓入同證三身此經部屬方等	界 外 斷 無 明 惑 次 第 頓 入 同 證 三 身 此 經 部 屬 方 等 
X22n0405_001:0250a17	故修通四人利益中有寶鳥音聲柔軟常讚三寶。	故 修 通 四 人 利 益 中 有 寶 鳥 音 聲 柔 軟 常 讚 三 寶 
X22n0405_001:0250a18	第六觀中五先總次別別中三初觀樓次觀閣及空	第 六 觀 中 五 先 總 次 別 別 中 三 初 觀 樓 次 觀 閣 及 空 
X22n0405_001:0250a19	中音樂三結成觀相四利益五顯觀邪正次觀樹空	中 音 樂 三 結 成 觀 相 四 利 益 五 顯 觀 邪 正 次 觀 樹 空 
X22n0405_001:0250a20	有諸天樂空中玅幢皆讚三寶。	有 諸 天 樂 空 中 玅 幢 皆 讚 三 寶 
X22n0405_001:0250a21	第七觀勅聽許說三一誠聽即聞思修三慧次許說	第 七 觀 勅 聽 許 說 三 一 誠 聽 即 聞思修三慧 次 許 說 
X22n0405_001:0250a22	三勸持廣說二佛現身相中二先明師弟現身次明	三 勸 持 廣 說 二 佛 現 身 相 中 二 先 明 師 弟 現 身 次 明 
X22n0405_001:0250a23	光明中先法次喻色相不可得比三為未來請中二	光 明 中 先 法 次 喻 色 相 不 可 得 比 三 為 未 來 請 中 二 
X22n0405_001:0250a24	一接足申敬二宣言正請請中二一明自身因佛得	一 接 足 申 敬 二 宣 言 正 請 請 中 二 一 明 自 身 因 佛 得 
X22n0405_001:0250b01	見二為未來眾生問云何作觀得覩三聖願佛慈悲	見 二 為 未 來 眾 生 問 云 何 作 觀 得 覩 三 聖 願 佛 慈 悲 
X22n0405_001:0250b02	不違本誓廣為宣說開甘露門普益大眾教觀依正	不 違 本 誓 廣 為 宣 說 開 甘 露 門 普 益 大 眾 教 觀 依 正 
X22n0405_001:0250b03	令得聖果自他俱益方契本心接足慇[烈列+勤]意在於此	令 得 聖 果 自 他 俱 益 方 契 本 心 接 足 慇 [烈列勤] 意 在 於 此 
X22n0405_001:0250b04	佛大慈悲依請為說教觀身座侍者宛然普雜分明	佛 大 慈 悲 依 請 為 說 教 觀 身 座 侍 者 宛 然 普 雜 分 明 
X22n0405_001:0250b05	並皆成就三輩往生俱登淨國一明成座法經有五	並 皆 成 就 三 輩 往 生 俱 登 淨 國 一 明 成 座 法 經 有 五 
X22n0405_001:0250b06	一觀寶地華葉次從釋迦毗楞伽下觀華臺寶珠三	一 觀 寶 地 華 葉 次 從 釋 迦 毗 楞 伽 下 觀 華 臺 寶 珠 三 
X22n0405_001:0250b07	於其臺上下觀華寶幢四從幢上下觀華寶縵五從	於 其 臺 上 下 觀 華 寶 幢 四 從 幢 上 下 觀 華 寶 縵 五 從 
X22n0405_001:0250b08	有五百億寶珠下觀珠光色初文有二先總次別別	有 五 百 億 寶 珠 下 觀 珠 光 色 初 文 有 二 先 總 次 別 別 
X22n0405_001:0250b09	中六謂葉色脉光華量葉數珠三互顯遍覆地上華	中 六 謂 葉 色 脉 光 華 量 葉 數 珠 三 互 顯 遍 覆 地 上 華 
X22n0405_001:0250b10	臺中二一明臺體二明莊嚴如寶炬陀羅尼經云毗	臺 中 二 一 明 臺 體 二 明 莊 嚴 如 寶 炬 陀 羅 尼 經 云 毗 
X22n0405_001:0250b11	楞伽寶純真金色住於梵宮菩薩生覩率己善根力	楞 伽 寶 純 真 金 色 住 於 梵 宮 菩 薩 生 覩 率 己 善 根 力 
X22n0405_001:0250b12	故此寶自然生於篋中能降魔消毒等如經廣說二	故 此 寶 自 然 生 於 篋 中 能 降 魔 消 毒 等 如 經 廣 說 二 
X22n0405_001:0250b13	隨機利物中三一總次別三觀佛事五明未來利益	隨 機 利 物 中 三 一 總 次 別 三 觀 佛 事 五 明 未 來 利 益 
X22n0405_001:0250b14	中三先法次喻三明利益法中二先總次別。	中 三 先 法 次 喻 三 明 利 益 法 中 二 先 總 次 別 
X22n0405_001:0250b15	第八觀一結二釋釋中經有二先釋次是為下結觀	第 八 觀 一 結 二 釋 釋 中 經 有 二 先 釋 次 是 為 下 結 觀 
X22n0405_001:0250b16	次第釋中初諸佛身中有三先徵次釋三勸修因舉	次 第 釋 中 初 諸 佛 身 中 有 三 先 徵 次 釋 三 勸 修 因 舉 
X22n0405_001:0250b17	果為證是故應當一心下觀彼彌陀有二先觀真身	果 為 證 是 故 應 當 一 心 下 觀 彼 彌 陀 有 二 先 觀 真 身 
X22n0405_001:0250b18	次想彼佛者下觀有二先修觀次觀成修觀為二一	次 想 彼 佛 者 下 觀 有 二 先 修 觀 次 觀 成 修 觀 為 二 一 
X22n0405_001:0250b19	佛二菩薩佛中三先佛身次依土三見如此事下結	佛 二 菩 薩 佛 中 三 先 佛 身 次 依 土 三 見 如 此 事 下 結 
X22n0405_001:0250b20	法入喻見此事已下次想菩薩為二先想座次想像	法 入 喻 見 此 事 已 下 次 想 菩 薩 為 二 先 想 座 次 想 像 
X22n0405_001:0250b21	此想成時佛菩薩下次明觀成為三一因光見聖身	此 想 成 時 佛 菩 薩 下 次 明 觀 成 為 三 一 因 光 見 聖 身 
X22n0405_001:0250b22	座二當聞妙法三出入定所聞法去邪從正。	座 二 當 聞 妙 法 三 出 入 定 所 聞 法 去 邪 從 正 
X22n0405_001:0250b23	第九觀二觀佛身大小經有二初觀彌陀次見此事	第 九 觀 二 觀 佛 身 大 小 經 有 二 初 觀 彌 陀 次 見 此 事 
X22n0405_001:0250b24	者觀十方佛彌陀又二先別觀次總結別中六一明	者 觀 十 方 佛 彌 陀 又 二 先 別 觀 次 總 結 別 中 六 一 明 
X22n0405_001:0250c01	身色量二明毫相眼三明身光量四化佛侍者五明	身 色 量 二 明 毫 相 眼 三 明 身 光 量 四 化 佛 侍 者 五 明 
X22n0405_001:0250c02	佛相好六明光遍攝其光相好下次總結捨身他世	佛 相 好 六 明 光 遍 攝 其 光 相 好 下 次 總 結 捨 身 他 世 
X22n0405_001:0250c03	下四舉利益勸修經有五一明利益二是故智者下	下 四 舉 利 益 勸 修 經 有 五 一 明 利 益 二 是 故 智 者 下 
X22n0405_001:0250c04	正勸三勸觀白毫四見無量下見十方佛五得見諸	正 勸 三 勸 觀 白 毫 四 見 無 量 下 見 十 方 佛 五 得 見 諸 
X22n0405_001:0250c05	佛下授記。	佛 下 授 記 
X22n0405_001:0250c06	第十觀初觀身相有四初觀身相流光萬千次觀臂	第 十 觀 初 觀 身 相 有 四 初 觀 身 相 流 光 萬 千 次 觀 臂 
X22n0405_001:0250c07	色瓔珞普觀三觀掌指色光遍照四觀足輪臺華彌	色 瓔 珞 普 觀 三 觀 掌 指 色 光 遍 照 四 觀 足 輪 臺 華 彌 
X22n0405_001:0250c08	滿初身中六一明身量色二明頂髻光三明化佛身	滿 初 身 中 六 一 明 身 量 色 二 明 頂 髻 光 三 明 化 佛 身 
X22n0405_001:0250c09	光相四明天冠之佛量五明面色眉間寶六明光佛	光 相 四 明 天 冠 之 佛 量 五 明 面 色 眉 間 寶 六 明 光 佛 
X22n0405_001:0250c10	侍無量二與佛同異中三先同次異三結次第悲華	侍 無 量 二 與 佛 同 異 中 三 先 同 次 異 三 結 次 第 悲 華 
X22n0405_001:0250c11	經云觀音菩薩成佛時號出一切光明功德山王如	經 云 觀 音 菩 薩 成 佛 時 號 出 一 切 光 明 功 德 山 王 如 
X22n0405_001:0250c12	來世界轉名一切珍寶所有一切勝於安養。	來 世 界 轉 名 一 切 珍 寶 所有一切 勝 於 安 養 
X22n0405_001:0250c13	第十一觀初因光神力中三初明身光量次明身色	第 十 一 觀 初 因 光 神 力 中 三 初 明 身 光 量 次 明 身 色 
X22n0405_001:0250c14	毛孔相三明智慧能破障二與觀音同中有二初明	毛 孔 相 三 明 智 慧 能 破 障 二 與 觀 音 同 中 有 二 初 明 
X22n0405_001:0250c15	相同二明正想初為三初明身相普現佛次明行處	相 同 二 明 正 想 初 為 三 初 明 身 相 普 現 佛 次 明 行 處 
X22n0405_001:0250c16	寶華莊嚴三明坐儀分身雲集說法度眾生初中有	寶 華 莊 嚴 三 明 坐 儀 分 身 雲 集 說 法 度 眾 生 初 中 有 
X22n0405_001:0250c17	天冠頂髮寶瓶三異餘相同悲華經云勢至菩薩於	天 冠 頂 髮 寶 瓶 三 異 餘 相 同 悲 華 經 云 勢 至 菩 薩 於 
X22n0405_001:0250c18	安樂世界欲觀音後得成正覺名善住珍寶王如來	安樂世界 欲 觀 音 後 得 成 正 覺 名 善 住 珍 寶 王 如 來 
X22n0405_001:0250c19	三結中四初結觀次第二明利益三俱觀二聖四結	三 結 中 四 初 結 觀 次 第 二 明 利 益 三 俱 觀 二 聖 四 結 
X22n0405_001:0250c20	觀邪正。	觀 邪 正 
X22n0405_001:0250c21	第十二普觀中疏文為二初明同異次依文解釋初	第 十 二 普 觀 中 疏 文 為 二 初 明 同 異 次 依 文 解 釋 初 
X22n0405_001:0250c22	又二先問次普觀下答次釋初見此下作身想中三	又 二 先 問 次 普 觀 下 答 次 釋 初 見 此 下 作 身 想 中 三 
X22n0405_001:0250c23	初標次自往生三結觀次第次往生有四初往生次	初 標 次 自 往 生 三 結 觀 次 第 次 往 生 有 四 初 往 生 次 
X22n0405_001:0250c24	見佛聞法三憶持不忘四結觀成見於依正初文三	見佛聞法 三 憶持不忘 四 結 觀 成 見 於 依 正 初 文 三 
X22n0405_001:0251a01	初見身坐座次蓮華開合三色光照身眼目開想。	初 見 身 坐 座 次 蓮 華 開 合 三 色 光 照 身 眼 目 開 想 
X22n0405_001:0251a02	第十三觀第二彌陀變現中二先觀佛次觀菩薩初	第 十 三 觀 第 二 彌 陀 變 現 中 二 先 觀 佛 次 觀 菩 薩 初 
X22n0405_001:0251a03	為三先明身量無邊非凡所及次結彼如來下願力	為 三 先 明 身 量 無 邊 非 凡 所 及 次 結 彼 如 來 下 願 力 
X22n0405_001:0251a04	觀成利益三阿彌陀佛下總別現身隨機所應次觀	觀 成 利 益 三 阿 彌 陀 佛 下 總 別 現 身 隨 機 所 應 次 觀 
X22n0405_001:0251a05	世音下觀二菩薩。	世 音 下 觀 二 菩 薩 
X22n0405_001:0251a06	第十四觀下疏文為二先明來意次二釋會經論釋	第 十 四 觀 下 疏 文 為 二 先 明 來 意 次 二 釋 會 經 論 釋 
X22n0405_001:0251a07	中三重問答初二乘次女人三五逆謗法者三依文	中 三 重 問 答 初 二 乘 次 女 人 三 五 逆 謗 法 者 三 依 文 
X22n0405_001:0251a08	解釋初來意者觀依正二果故也只緣觀玅土觀眾	解 釋 初 來 意 者 觀 依 正 二 果 故 也 只 緣 觀 玅 土 觀 眾 
X22n0405_001:0251a09	聖依教修成勝行圓因成分果定九品生皆真正因	聖 依 教 修 成 勝 行 圓 因 成 分 果 定 九 品 生 皆 真 正 因 
X22n0405_001:0251a10	韋提自他請為來世問觀修行佛酬答應勸物根利	韋 提 自 他 請 為 來 世 問 觀 修 行 佛 酬 答 應 勸 物 根 利 
X22n0405_001:0251a11	鈍三輩為是文之大意也依文釋中二先判三品次	鈍 三 輩 為 是 文 之 大 意 也 依 文 釋 中 二 先 判 三 品 次 
X22n0405_001:0251a12	位乘臺不同依經釋義。上品上生文為二初別明	位 乘 臺 不 同 依 經 釋 義 上 品 上 生 文 為 二 初 別 明 
X22n0405_001:0251a13	三品後總結初明修因中二先標次釋釋中二初三	三 品 後 總 結 初 明 修 因 中 二 先 標 次 釋 釋 中 二 初 三 
X22n0405_001:0251a14	心次三行此二各四謂標徵起釋結生彼國時下二	心 次 三 行 此 二 各 四 謂 標 徵 起 釋 結 生 彼 國 時 下 二 
X22n0405_001:0251a15	值緣中五一值聖眾二持寶臺三佛放光四勝友迎	值 緣 中 五 一 值 聖 眾 二 持 寶 臺 三 佛 放 光 四 勝 友 迎 
X22n0405_001:0251a16	接五讚勸其心令行成就三得生中三初明三業歡	接 五 讚 勸 其 心 令 行 成 就 三 得 生 中 三 初 明 三 業 歡 
X22n0405_001:0251a17	喜次見身乘臺三應時往生四生後益生後利益中	喜 次 見 身 乘 臺 三 應 時 往 生 四 生 後 益 生 後 利 益 中 
X22n0405_001:0251a18	三一彼土次十方三本國初文三一見聖身相二聞	三 一 彼 土 次 十 方 三 本 國 初 文 三 一 見 聖 身 相 二 聞 
X22n0405_001:0251a19	玅法三聞已證果次十方中二一奉事諸佛二得受	玅 法 三 聞 已 證 果 次 十 方 中 二 一 奉 事 諸 佛 二 得 受 
X22n0405_001:0251a20	記言須臾者准俱舍論云百二十剎那為一怛剎那	記 言 須 臾 者 准 俱 舍 論 云 百 二 十 剎 那 為 一 怛 剎 那 
X22n0405_001:0251a21	六十怛剎那為臘縛三十臘縛為牟呼栗多三十牟	六 十 怛 剎 那 為 臘 縛 三 十 臘 縛 為 牟 呼 栗 多 三 十 牟 
X22n0405_001:0251a22	呼栗多為晝夜即牟呼栗多此云須臾如人行五里。	呼 栗 多 為 晝 夜 即 牟 呼 栗 多 此 云 須 臾 如 人 行 五 里 
X22n0405_001:0251a23	上品中生第二值緣經有五一時節二值聖眾三	上 品 中 生 第 二 值 緣 經 有 五 一 時 節 二 值 聖 眾 三 
X22n0405_001:0251a24	持寶臺四迎接五授記三得生有三一見身登臺次	持 寶 臺 四 迎 接 五 授 記 三 得 生 有 三 一 見 身 登 臺 次 
X22n0405_001:0251b01	合掌讚佛三速疾得生四往利益中經有四一彼土	合 掌 讚 佛 三 速 疾 得 生 四 往 利 益 中 經 有 四 一 彼 土 
X22n0405_001:0251b02	次十方三得忍四獲記初文為五一華開身色次聖	次 十 方 三 得 忍 四 獲 記 初 文 為 五 一 華 開 身 色 次 聖 
X22n0405_001:0251b03	眾放光三因宿習聞法四申禮五不退。上品下生	眾 放 光 三 因 宿 習 聞 法 四 申 禮 五 不 退 上 品 下 生 
X22n0405_001:0251b04	第二值緣經有五一時節二值聖眾三持華四化佛	第 二 值 緣 經 有 五 一 時 節 二 值 聖 眾 三 持 華 四 化 佛 
X22n0405_001:0251b05	授手五稱讚行者三得生二一見身登座二得往生	授 手 五 稱 讚 行 者 三 得 生 二 一 見 身 登 座 二 得 往 生 
X22n0405_001:0251b06	准十疑論明不退位有五一者阿彌陀佛大悲願力	准 十 疑 論 明 不 退 位 有 五 一 者 阿 彌 陀 佛 大 悲 願 力 
X22n0405_001:0251b07	故得不退轉二者佛光常照菩提心常增進故不退	故 得不退轉 二 者 佛 光 常 照 菩 提 心 常 增 進 故 不 退 
X22n0405_001:0251b08	轉三者水鳥樹林風聲樂音皆說苦空聞者常生念	轉 三 者 水 鳥 樹 林 風 聲 樂 音 皆 說 苦 空 聞 者 常 生 念 
X22n0405_001:0251b09	佛法僧之心故不退轉四者彼國名不退國諸佛菩	佛 法 僧 之 心 故 不 退 轉 四 者 彼 國 名 不 退 國 諸 佛 菩 
X22n0405_001:0251b10	薩為善友無惡緣境外之邪魔內無三毒必竟不起	薩 為 善 友 無 惡 緣 境 外 之 邪 魔 內 無 三 毒 必 竟 不 起 
X22n0405_001:0251b11	故不退轉五生彼國已壽命無量共佛齊等故不退	故 不 退 轉 五 生 彼 國 已 壽 命 無 量 共 佛 齊 等 故 不 退 
X22n0405_001:0251b12	也四生後利益遂解得百法明門者彼明謂色法心	也 四 生 後 利 益 遂 解 得 百 法 明 門 者 彼 明 謂 色 法 心 
X22n0405_001:0251b13	法心所法不相應行法無為法開成一百法入初地	法 心 所 法 不相應行 法 無 為 法 開 成 一 百 法 入 初 地 
X22n0405_001:0251b14	時一時頓證准天台疏一切眾生心數法通大地有	時 一 時 頓 證 准 天 台 疏 一 切 眾 生 心 數 法 通 大 地 有 
X22n0405_001:0251b15	十謂受想思觸欲慧念解脫憶定心王則正因佛性	十 謂 受 想 思 觸 欲 慧 念 解 脫 憶 定 心 王 則 正 因 佛 性 
X22n0405_001:0251b16	想數慧數了因佛性餘數緣因佛性一數起時餘九	想 數 慧 數 了 因 佛 性 餘 數 緣 因 佛 性 一 數 起 時 餘 九 
X22n0405_001:0251b17	相狀而起即有百數此百雖具三佛性眾生心具別	相 狀 而 起 即 有 百 數 此 百 雖 具 三 佛 性 眾 生 心 具 別 
X22n0405_001:0251b18	名三因佛性此百入十信亦具三佛性若從修說別	名 三 因 佛 性 此 百 入 十 信 亦 具 三 佛 性 若 從 修 說 別 
X22n0405_001:0251b19	名緣因佛性此百入十住三佛性圓證亦名百法明	名 緣 因 佛 性 此 百 入 十 住 三 佛 性 圓 證 亦 名 百 法 明 
X22n0405_001:0251b20	門亦名三德三身等(云云)經有三一彼土次十方三往	門 亦 名 三 德 三 身 等 云 云 經 有 三 一 彼 土 次 十 方 三 往 
X22n0405_001:0251b21	時入位初文三一華開次見佛明了三聞法彼土以	時 入 位 初 文 三 一 華 開 次 見 佛 明 了 三 聞 法 彼 土 以 
X22n0405_001:0251b22	華開名分於晝夜一日一夜案華嚴經娑婆一劫為	華 開 名 分 於 晝 夜 一 日 一 夜 案 華 嚴 經 娑 婆 一 劫 為 
X22n0405_001:0251b23	極樂世界一日一夜。	極樂世界 一 日 一 夜 
X22n0405_001:0251b24	第十五。中品上生第二值緣中三一值聖眾次放	第 十 五 中 品 上 生 第 二 值 緣 中 三 一 值 聖 眾 次 放 
X22n0405_001:0251c01	光三聞法得樂三得生中三見身坐華臺次申禮三	光 三 聞 法 得 樂 三 得 生 中 三 見 身 坐 華 臺 次 申 禮 三 
X22n0405_001:0251c02	得生四生後利益中三華開聞法二得果三具法四	得 生 四 生 後 利 益 中 三 華 開 聞 法 二 得 果 三 具 法 四 
X22n0405_001:0251c03	諦者文為五一四諦次羅漢三得三明三明者一過	諦 者 文 為 五 一 四 諦 次 羅 漢 三 得 三 明 三 明 者 一 過 
X22n0405_001:0251c04	去宿命明現在漏盡明未來天眼明四六通五釋八	去 宿 命 明 現 在 漏 盡 明 未 來 天 眼 明 四 六 通 五 釋 八 
X22n0405_001:0251c05	解脫釋中三謂標釋判判中先果次因次引釋論明	解 脫 釋 中 三 謂 標 釋 判 判 中 先 果 次 因 次 引 釋 論 明 
X22n0405_001:0251c06	四果不生者和會經論義合也。中品中生第二值	四 果 不 生 者 和 會 經 論 義 合 也 中 品 中 生 第 二 值 
X22n0405_001:0251c07	緣中三一值聖眾二放光三讚嘆迎接第四生後利	緣 中 三 一 值 聖 眾 二 放 光 三 讚 嘆 迎 接 第 四 生 後 利 
X22n0405_001:0251c08	益中三一華開二讚佛聞法三得果。中品下生第	益 中 三 一 華 開 二 讚 佛 聞 法 三 得 果 中 品 下 生 第 
X22n0405_001:0251c09	三得生中三謂法喻合四生後利益中三一見聖二	三 得 生 中 三 謂 法 喻 合 四 生 後 利 益 中 三 一 見 聖 二 
X22n0405_001:0251c10	聞法三得果。	聞 法 三 得 果 
X22n0405_001:0251c11	第十六。下品上生初明因中經為二初述惡造輕	第 十 六 下 品 上 生 初 明 因 中 經 為 二 初 述 惡 造 輕 
X22n0405_001:0251c12	過無重[億音+(天*天)]二從命欲終時下述善述善中二初聞法	過 無 重 [億音天天] 二 從 命 欲 終 時 下 述 善 述 善 中 二 初 聞 法 
X22n0405_001:0251c13	益除惡因次從智者下念佛益除惡果第三明緣中	益 除 惡 因 次 從 智 者 下 念 佛 益 除 惡 果 第 三 明 緣 中 
X22n0405_001:0251c14	二初感聖眾二稱讚迎接三得生中二一見佛光明	二 初 感 聖 眾 二 稱 讚 迎 接 三 得 生 中 二 一 見 佛 光 明 
X22n0405_001:0251c15	二乘華得生四生後利益中五一華開二感聖三聞	二 乘 華 得 生 四 生 後 利 益 中 五 一 華 開 二 感 聖 三 聞 
X22n0405_001:0251c16	法四發心五得果。下品中生初明因中二一標惡	法 四 發 心 五 得 果 下 品 中 生 初 明 因 中 二 一 標 惡 
X22n0405_001:0251c17	先因次果因中三一毀戒次盜僧物三不淨說法不	先 因 次 果 因 中 三 一 毀 戒 次 盜 僧 物 三 不 淨 說 法 不 
X22n0405_001:0251c18	淨說法者有於四過一輕心說法不求自利二求名	淨 說 法 者 有 於 四 過 一 輕 心 說 法 不 求 自 利 二 求 名 
X22n0405_001:0251c19	利己不為化他三生勝負心為求眷屬四為求世報	利 己 不 為 化 他 三 生 勝 負 心 為 求 眷 屬 四 為 求 世 報 
X22n0405_001:0251c20	隱正說邪如此說法名為不淨次如此罪人下惡果	隱 正 說 邪 如 此 說 法 名 為 不 淨 次 如 此 罪 人 下 惡 果 
X22n0405_001:0251c21	從遇善知識下二述善述善中二一述佛十力五分	從 遇 善 知 識 下 二 述 善 述 善 中 二 一 述 佛 十 力 五 分 
X22n0405_001:0251c22	法身二聞已得益生死罪除清涼風現四生後利益	法 身 二 聞 已 得 益 生 死 罪 除 清 涼 風 現 四 生 後 利 益 
X22n0405_001:0251c23	中四一華開二感聖眾三聞法四發心。下品下生	中 四 一 華 開 二 感 聖 眾 三 聞 法 四 發 心 下 品 下 生 
X22n0405_001:0251c24	初明修因經有二一標惡二障善初為二初惡因如	初 明 修 因 經 有 二 一 標 惡 二 障 善 初 為 二 初 惡 因 如 
X22n0405_001:0252a01	此愚人下次惡果次障善中五初明時節次遇善知	此 愚 人 下 次 惡 果 次 障 善 中 五 初 明 時 節 次 遇 善 知 
X22n0405_001:0252a02	識下善友教念三彼人苦下為苦所逼善不生四教	識 下 善 友 教 念 三 彼 人 苦 下 為 苦 所 逼 善 不 生 四 教 
X22n0405_001:0252a03	稱十念五念益罪除隨聲念中須具四緣一念彼佛	稱 十 念 五 念 益 罪 除 隨 聲 念 中 須 具 四 緣 一 念 彼 佛 
X22n0405_001:0252a04	有願者必生故須稱名二須至心善心散亂正念不	有 願 者 必 生 故 須 稱 名 二 須 至 心 善 心 散 亂 正 念 不 
X22n0405_001:0252a05	成三令聲聲不絕方入正觀四具足十念速疾成就	成 三 令 聲 聲 不 絕 方 入 正 觀 四 具 足 十 念 速 疾 成 就 
X22n0405_001:0252a06	具此四緣更無疑惑如十疑中說譬如十圍之索千	具 此 四 緣 更 無 疑 惑 如 十 疑 中 說 譬 如 十 圍 之 索 千 
X22n0405_001:0252a07	夫不制童子揮劍須臾數分又如千年積柴以豆火	夫 不 制 童 子 揮 劍 須 臾 數 分 又 如 千 年 積 柴 以 豆 火 
X22n0405_001:0252a08	焚之少時即盡況臨終猛利心念真實無間得生淨	焚 之 少 時 即 盡 況 臨 終 猛 利 心 念 真 實 無 間 得 生 淨 
X22n0405_001:0252a09	土者哉如一念頃即得往生第四獲利經文有四一	土 者 哉 如 一 念 頃 即 得 往 生 第 四 獲 利 經 文 有 四 一 
X22n0405_001:0252a10	華開二感聖三聞法罪滅四發菩提心。	華 開 二 感 聖 三 聞 法 罪 滅 四 發菩提心 
X22n0405_001:0252a11	第二大段利益初明道悟無生經有二意一結前生	第 二 大 段 利 益 初 明 道 悟 無 生 經 有 二 意 一 結 前 生 
X22n0405_001:0252a12	後生後中三初覩依正二果次三業領解三道悟無	後 生 後 中 三 初 覩 依 正 二 果 次 三 業 領 解 三 道 悟 無 
X22n0405_001:0252a13	生初觀依正二果者由上經文見佛傷嘆請其生處	生 初 觀 依 正 二 果 者 由 上 經 文 見 佛 傷 嘆 請 其 生 處 
