X22n0410_001:0369b04	觀經扶新論并序	觀 經 扶 新 論 并 序 
X22n0410_001:0369b05	拙庵　戒度　述	拙 庵 戒 度 述 
X22n0410_001:0369b06	君子可欺也不可罔也昔人所以戒也靈芝大智律	君 子 可 欺 也 不 可 罔 也 昔 人 所 以 戒 也 靈 芝 大 智 律 
X22n0410_001:0369b07	師平日常曰生弘毗尼死歸安養能事畢矣故於贊	師 平 日 常 曰 生 弘 毗 尼 死 歸 安 養 能 事 畢 矣 故 於 贊 
X22n0410_001:0369b08	述本宗之暇撰十六觀經新疏發揮淨土教門其間	述 本 宗 之 暇 撰 十 六 觀 經 新 疏 發 揮 淨 土 教 門 其 間 
X22n0410_001:0369b09	揀判純雜區別理事指的心境決擇疑濫最為精功	揀 判 純 雜 區 別 理 事 指 的 心 境 決 擇 疑 濫 最 為 精 功 
X22n0410_001:0369b10	庶使樂修之者即聞即行不俟窮年積學而後為得	庶 使 樂 修 之 者 即 聞 即 行 不 俟 窮 年 積 學 而 後 為 得 
X22n0410_001:0369b11	可謂往生之捷徑也凡所引用自成一家務存簡要	可 謂 往 生 之 捷 徑 也 凡 所 引 用 自 成 一 家 務 存 簡 要 
X22n0410_001:0369b12	故有芟除繁瑣之說而山家宗匠因公法師以謂越	故 有 芟 除 繁 瑣 之 說 而 山 家 宗 匠 因 公 法 師 以 謂 越 
X22n0410_001:0369b13	學經宗滅裂天台時教形言毀斥曰輔正解彌歷年	學 經 宗 滅 裂 天 台 時 教 形 言 毀 斥 曰 輔 正 解 彌 歷 年 
X22n0410_001:0369b14	所殆至湮沒適以故人見訪偶得其文初讀之則如	所 殆 至 湮 沒 適 以 故 人 見 訪 偶 得 其 文 初 讀 之 則 如 
X22n0410_001:0369b15	可畏再讀之則稍可疑三讀之則甚可笑君子可欺	可 畏 再 讀 之 則 稍 可 疑 三 讀 之 則 甚 可 笑 君 子 可 欺 
X22n0410_001:0369b16	也不可罔也昔人所以戒也輔正非獨欺之而又罔	也 不 可 罔 也 昔 人 所 以 戒 也 輔 正 非 獨 欺 之 而 又 罔 
X22n0410_001:0369b17	之三藏經論天下共之豈謂律學不可通經非欺而	之 三 藏 經 論 天 下 共 之 豈 謂 律 學 不 可 通 經 非 欺 而 
X22n0410_001:0369b18	何廣引法相橫樹難詞抑是為非掩長求短非罔而	何 廣 引 法 相 橫 樹 難 詞 抑 是 為 非 掩 長 求 短 非 罔 而 
X22n0410_001:0369b19	何竊惟輔正扶宗立教或抑或揚未易可知但患末	何 竊 惟 輔 正 扶 宗 立 教 或 抑 或 揚 未 易 可 知 但 患 末 
X22n0410_001:0369b20	學膚受傳為口實一唱百和遲疑兩端淨業正因自	學 膚 受 傳 為 口 實 一 唱 百 和 遲 疑 兩 端 淨 業 正 因 自 
X22n0410_001:0369b21	茲梗塞得無懼乎輙事筆墨而辨析之文成題曰扶	茲 梗 塞 得 無 懼 乎 輙 事 筆 墨 而 辨 析 之 文 成 題 曰 扶 
X22n0410_001:0369b22	新論庶幾扶持新疏之說不為時所欺罔也怒臂拒	新 論 庶 幾 扶 持 新 疏 之 說 不 為 時 所 欺 罔 也 怒 臂 拒 
X22n0410_001:0369b23	轍雖亦可謂有心捧土塞河實愧不知其量在理或	轍 雖 亦 可 謂 有 心 捧 土 塞 河 實 愧 不 知 其 量 在 理 或 
X22n0410_001:0369b24	當何必求人覽者幸毋以狂簡見誚焉。戊戌中春日	當 何 必 求 人 覽 者 幸 毋 以 狂 簡 見 誚 焉 戊 戌 中 春 日 
X22n0410_001:0369c01	戒度於董溪華嶼湖足庵序	戒 度 於 董 溪 華 嶼 湖 足 庵 序 
X22n0410_001:0369c02	輔正曰以由新疏不受時教為弊至甚故先解之。	輔 正 曰 以 由 新 疏 不 受 時 教 為 弊 至 甚 故 先 解 之 
X22n0410_001:0369c03	論曰且自東漢佛教西來至於齊梁源流浸廣弘闡	論 曰 且 自 東 漢 佛 教 西 來 至 於 齊 梁 源 流 浸 廣 弘 闡 
X22n0410_001:0369c04	之人非一二數莫不各有師承遞相祖述故使吾道	之 人 非 一 二 數 莫 不 各 有 師 承 遞 相 祖 述 故 使 吾 道 
X22n0410_001:0369c05	綿綿不絕其間修證悟入之者備存青史是時未聞	綿 綿 不 絕 其 間 修 證 悟 入 之 者 備 存 青 史 是 時 未 聞 
X22n0410_001:0369c06	天台時教之說何其盛哉借使南三北七盡為所破	天 台 時 教 之 說 何 其 盛 哉 借 使 南 三 北 七 盡 為 所 破 
X22n0410_001:0369c07	其如天台滅後賢首慈恩諸師角立宗派更多豈不	其 如 天 台 滅 後 賢 首 慈 恩 諸 師 角 立 宗 派 更 多 豈 不 
X22n0410_001:0369c08	知有天台時教亦未聞適從又如西竺聖師天親無	知 有 天 台 時 教 亦 未 聞 適 從 又 如 西 竺 聖 師 天 親 無 
X22n0410_001:0369c09	著凡有述作規矩亦別龍樹解般若但分二道馬鳴	著 凡 有 述 作 規 矩 亦 別 龍 樹 解 般 若 但 分 二 道 馬 鳴 
X22n0410_001:0369c10	釋遺教自為七分亦應不受天台時教例斥為非況	釋 遺 教 自 為 七 分 亦 應 不 受 天 台 時 教 例 斥 為 非 況 
X22n0410_001:0369c11	復清涼親從荊溪學天台教尚乃別立宗途競開戶	復 清 涼 親 從 荊 溪 學 天 台 教 尚 乃 別 立 宗 途 競 開 戶 
X22n0410_001:0369c12	牖新疏且非天台宗派那得責以天台時教豈謂天	牖 新 疏 且 非 天 台 宗 派 那 得 責 以 天 台 時 教 豈 謂 天 
X22n0410_001:0369c13	台所立時教不當理乎大抵在人取舍安可抑而與	台 所 立 時 教 不 當 理 乎 大 抵 在 人 取 舍 安 可 抑 而 與 
X22n0410_001:0369c14	之當知佛法譬如通都大邑東西南北隨人往來果	之 當 知 佛 法 譬 如 通 都 大 邑 東 西 南 北 隨 人 往 來 果 
X22n0410_001:0369c15	如輔正之見必使天下之人同遵一路而行其可得	如 輔 正 之 見 必 使 天 下 之 人 同 遵 一 路 而 行 其 可 得 
X22n0410_001:0369c16	乎若使新疏一依天台時教何勞別述只緣自古至	乎 若 使 新 疏 一 依 天 台 時 教 何 勞 別 述 只 緣 自 古 至 
X22n0410_001:0369c17	今不分兩土教法純雜之異致成一混唯我新疏乃	今 不 分 兩 土 教 法 純 雜 之 異 致 成 一 混 唯 我 新 疏 乃 
X22n0410_001:0369c18	能知之而輔正故以不受時教見斥所謂以己妨人	能 知 之 而 輔 正 故 以 不 受 時 教 見 斥 所 謂 以 己 妨 人 
X22n0410_001:0369c19	未知其可也。	未 知 其 可 也 
X22n0410_001:0369c20	新疏云諸師各尚宗風後學莫知攸往今摭取優	新 疏 云 諸 師 各 尚 宗 風 後 學 莫 知 攸 往 今 摭 取 優 
X22n0410_001:0369c21	長芟除繁瑣隋朝遠法師天台智者皆有章疏善	長 芟 除 繁 瑣 隋 朝 遠 法 師 天 台 智 者 皆 有 章 疏 善 
X22n0410_001:0369c22	導亦有玄義故今所釋擇善從之。	導 亦 有 玄 義 故 今 所 釋 擇 善 從 之 
X22n0410_001:0369c23	輔正曰我教東漸已來而大乘經論之學以其不	輔 正 曰 我 教 東 漸 已 來 而 大 乘 經 論 之 學 以 其 不 
X22n0410_001:0369c24	明時教邪正無別則與婆毗迦羅成其伴侶新疏	明 時 教 邪 正 無 別 則 與 婆 毗 迦 羅 成 其 伴 侶 新 疏 
X22n0410_001:0370a01	滅裂吾教直欲申經以微言奧義謂之繁瑣且如	滅 裂 吾 教 直 欲 申 經 以 微 言 奧 義 謂 之 繁 瑣 且 如 
X22n0410_001:0370a02	題中佛之一字有法報應佛生法佛勝劣佛今經	題 中 佛 之 一 字 有 法 報 應 佛 生 法 佛 勝 劣 佛 今 經 
X22n0410_001:0370a03	為屬何佛又觀之一字有從假入空觀從空入假	為 屬 何 佛 又 觀 之 一 字 有 從 假 入 空 觀 從 空 入 假 
X22n0410_001:0370a04	觀中道第一義觀乃至占察真如唯識等觀題中	觀 中 道 第 一 義 觀 乃 至 占 察 真 如 唯 識 等 觀 題 中 
X22n0410_001:0370a05	觀字為屬何收。	觀 字 為 屬 何 收 
X22n0410_001:0370a06	論曰天台以五時八教判釋一代群經南三北七蔑	論 曰 天 台 以 五 時 八 教 判 釋 一 代 群 經 南 三 北 七 蔑 
X22n0410_001:0370a07	如無聞孰敢擬議於其間哉況復南山作傳稱美靈	如 無 聞 孰 敢 擬 議 於 其 間 哉 況 復 南 山 作 傳 稱 美 靈 
X22n0410_001:0370a08	芝亦乃秉筆推尊然今新疏所謂芟除繁瑣者豈為	芝 亦 乃 秉 筆 推 尊 然 今 新 疏 所 謂 芟 除 繁 瑣 者 豈 為 
X22n0410_001:0370a09	天台時教而設斯乃論其製作文體唯從簡當不事	天 台 時 教 而 設 斯 乃 論 其 製 作 文 體 唯 從 簡 當 不 事 
X22n0410_001:0370a10	繁冗如選序云略其蕪穢集其清英書序云芟夷繁	繁 冗 如 選 序 云 略 其 蕪 穢 集 其 清 英 書 序 云 芟 夷 繁 
X22n0410_001:0370a11	亂翦截浮詞況復荊溪略疏序云筆在侍人不無繁	亂 翦 截 浮 詞 況 復 荊 溪 略 疏 序 云 筆 在 侍 人 不 無 繁 
X22n0410_001:0370a12	廣見者慕之弊其文多帶義必存言繁則翦(文)荊溪	廣 見 者 慕 之 弊 其 文 多 帶 義 必 存 言 繁 則 翦 文 荊 溪 
X22n0410_001:0370a13	乃天台弟子於師之文尚容翦削信是述作之通規	乃 天 台 弟 子 於 師 之 文 尚 容 翦 削 信 是 述 作 之 通 規 
X22n0410_001:0370a14	古今之常例縱使新疏對斥前代其間自有遠師善	古 今 之 常 例 縱 使 新 疏 對 斥 前 代 其 間 自 有 遠 師 善 
X22n0410_001:0370a15	導何獨黨於天台又復若使不明時教則與婆毗迦	導 何 獨 黨 於 天 台 又 復 若 使 不 明 時 教 則 與 婆 毗 迦 
X22n0410_001:0370a16	羅成伴侶者如向所引龍樹馬鳴西竺諸師以至慈	羅 成 伴 侶 者 如 向 所 引 龍 樹 馬 鳴 西 竺 諸 師 以 至 慈 
X22n0410_001:0370a17	恩賢首例皆陷於邪黨耶豈其然乎復將佛觀二字	恩 賢 首 例 皆 陷 於 邪 黨 耶 豈 其 然 乎 復 將 佛 觀 二 字 
X22n0410_001:0370a18	為難者秪緣輔正不分兩土教門之異遂將此土修	為 難 者 秪 緣 輔 正 不 分 兩 土 教 門 之 異 遂 將 此 土 修 
X22n0410_001:0370a19	證行相一混而說所以動轉皆成罣礙今謂假饒說	證 行 相 一 混 而 說 所 以 動 轉 皆 成 罣 礙 今 謂 假 饒 說 
X22n0410_001:0370a20	盡五時八教三身四土一心三觀乃至無量法門並	盡 五 時 八 教 三 身 四 土 一 心 三 觀 乃 至 無 量 法 門 並 
X22n0410_001:0370a21	是天台建立宗旨何關新疏之事乎。	是 天 台 建 立 宗 旨 何 關 新 疏 之 事 乎 
X22n0410_001:0370a22	新疏云極樂淨土純一大乘眾生生者莫不皆發	新 疏 云 極樂淨土 純 一 大 乘 眾 生 生 者 莫 不 皆 發 
X22n0410_001:0370a23	無上道心到彼皆得不退是知二土立教純雜不	無上道心 到 彼 皆 得 不 退 是 知 二 土 立 教 純 雜 不 
X22n0410_001:0370a24	同則淨土諸經不勞揀判天台云此是大乘方等	同 則 淨 土 諸 經 不 勞 揀 判 天 台 云 此 是 大 乘 方 等 
X22n0410_001:0370b01	教攝二藏明義菩薩收漸頓悟入此即頓教(云云)。	教 攝 二 藏 明 義 菩 薩 收 漸 頓 悟 入 此 即 頓 教 云 云 
X22n0410_001:0370b02	輔正曰新疏初謂淨土純是大乘不勞揀判者淨土	輔 正 曰 新 疏 初 謂 淨 土 純 是 大 乘 不 勞 揀 判 者 淨 土 
X22n0410_001:0370b03	雖復純是大乘揀判經文意在此土行者指其歸	雖 復 純 是 大 乘 揀 判 經 文 意 在 此 土 行 者 指 其 歸 
X22n0410_001:0370b04	趣新疏但準彼土已生之人不判此土令生之典	趣 新 疏 但 準 彼 土 已 生 之 人 不 判 此 土 令 生 之 典 
X22n0410_001:0370b05	既云純是大乘則是已揀偏小那云不勞此語既	既 云 純 是 大 乘 則 是 已 揀 偏 小 那 云 不 勞 此 語 既 
X22n0410_001:0370b06	當揀判但有其名而無其義天台部教那可忽之	當 揀 判 但 有 其 名 而 無 其 義 天 台 部 教 那 可 忽 之 
X22n0410_001:0370b07	次引天台菩薩藏攝未知如何領會且頓之義乃	次 引 天 台 菩 薩 藏 攝 未 知 如 何 領 會 且 頓 之 義 乃 
X22n0410_001:0370b08	有多途(云云)況菩薩之義亦有多種(云云)備引俱舍婆	有 多 途 云 云 況 菩 薩 之 義 亦 有 多 種 云 云 備 引 俱 舍 婆 
X22n0410_001:0370b09	沙論文(云云)乃至云將何等心用何等觀破何等惑	沙 論 文 云 云 乃 至 云 將 何 等 心 用 何 等 觀 破 何 等 惑 
X22n0410_001:0370b10	入何等位(云云)。	入 何 等 位 云 云 
X22n0410_001:0370b11	論曰新疏所謂淨土純是大乘豈非揀判經文耶揀	論 曰 新 疏 所 謂 淨 土 純 是 大 乘 豈 非 揀 判 經 文 耶 揀 
X22n0410_001:0370b12	判經文豈非為此土行者指歸趣耶只緣彼土已生	判 經 文 豈 非 為 此 土 行 者 指 歸 趣 耶 只 緣 彼 土 已 生 
X22n0410_001:0370b13	之人純是大乘故使此土令生之典不兼偏小機教	之 人 純 是 大 乘 故 使 此 土 令 生 之 典 不 兼 偏 小 機 教 
X22n0410_001:0370b14	一到安得兩分而云但準已生之人不判令生之典	一 到 安 得 兩 分 而 云 但 準 已 生 之 人 不 判 令 生 之 典 
X22n0410_001:0370b15	新疏顯然判云淨土純是大乘復引天台大乘方等	新 疏 顯 然 判 云 淨 土 純 是 大 乘 復 引 天 台 大 乘 方 等 
X22n0410_001:0370b16	為據那謂不判令生之典又復自知新疏純一大乘	為 據 那 謂 不 判 令 生 之 典 又 復 自 知 新 疏 純 一 大 乘 
X22n0410_001:0370b17	之語已是揀判恐遭人難仍轉計云此語即當揀判	之 語 已 是 揀 判 恐 遭 人 難 仍 轉 計 云 此 語 即 當 揀 判 
X22n0410_001:0370b18	那云不勞今謂不勞者但不同此土大小偏圓逐一	那 云 不 勞 今 謂 不 勞 者 但 不 同 此 土 大 小 偏 圓 逐 一 
X22n0410_001:0370b19	細揀其如淨土之教一言蔽諸無非大乘故云不勞	細 揀 其 如 淨 土 之 教 一 言 蔽 諸 無 非 大 乘 故 云 不 勞 
X22n0410_001:0370b20	爾若如輔正必欲揀判者且如純談淨土乃有七經	爾 若 如 輔 正 必 欲 揀 判 者 且 如 純 談 淨 土 乃 有 七 經 
X22n0410_001:0370b21	未審何經是大何經是小若純是大正同新疏不勞	未 審 何 經 是 大 何 經 是 小 若 純 是 大 正 同 新 疏 不 勞 
X22n0410_001:0370b22	揀判若兼偏小反顯淨土未為圓頓作此窮逐不攻	揀 判 若 兼 偏 小 反 顯 淨 土 未 為 圓 頓 作 此 窮 逐 不 攻 
X22n0410_001:0370b23	自壞又云次引天台菩薩藏攝如何領會乃至云頓	自 壞 又 云 次 引 天 台 菩 薩 藏 攝 如 何 領 會 乃 至 云 頓 
X22n0410_001:0370b24	義多途菩薩多種等者此正所謂欺罔也當知新疏	義 多 途 菩 薩 多 種 等 者 此 正 所 謂 欺 罔 也 當 知 新 疏 
X22n0410_001:0370c01	所立直申正義更不餘途據韋提希不歷小果便證	所 立 直 申 正 義 更 不 餘 途 據 韋 提 希 不 歷 小 果 便 證 
X22n0410_001:0370c02	無生故名為頓機既屬頓教理行果從而可如何反	無 生 故 名 為 頓 機 既 屬 頓 教 理 行 果 從 而 可 如 何 反 
X22n0410_001:0370c03	以俱舍婆沙小乘位次而相比擬枘方乖鑿未知其	以 俱 舍 婆 沙 小 乘 位 次 而 相 比 擬 枘 方 乖 鑿 未 知 其 
X22n0410_001:0370c04	可也大率輔正恃其強辯旁若無人不許他宗唯尊	可 也 大 率 輔 正 恃 其 強 辯 旁 若 無 人 不 許 他 宗 唯 尊 
X22n0410_001:0370c05	已學不分新疏流行於世無由滅絕所以鋪排法相	已 學 不 分 新 疏 流 行 於 世 無 由 滅 絕 所 以 鋪 排 法 相 
X22n0410_001:0370c06	堆疊教門橫引異端虗張難勢欲令新疏兒孫無所	堆 疊 教 門 橫 引 異 端 虗 張 難 勢 欲 令 新 疏 兒 孫 無 所 
X22n0410_001:0370c07	措其手足望崖而退不敢講談則使新疏自然陸沉	措 其 手 足 望 崖 而 退 不 敢 講 談 則 使 新 疏 自 然 陸 沉 
X22n0410_001:0370c08	用心若此為欺人乎為欺天乎新疏云新千歲之下	用 心 若 此 為 欺 人 乎 為 欺 天 乎 新 疏 云 新 千 歲 之 下 
X22n0410_001:0370c09	必有賞音豈容私情而掩蔽哉又云將何心用何觀	必 有 賞 音 豈 容 私 情 而 掩 蔽 哉 又 云 將 何 心 用 何 觀 
X22n0410_001:0370c10	破何惑入何位者只緣不辨兩土入道之殊故作此	破 何 惑 入 何 位 者 只 緣 不 辨 兩 土 入 道 之 殊 故 作 此 
X22n0410_001:0370c11	說當知往生淨土之人多是具縛凡夫之眾如觀經	說 當 知 往 生 淨 土 之 人 多 是 具 縛 凡 夫 之 眾 如 觀 經 
X22n0410_001:0370c12	云如來今者為未來世一切眾生為煩惱賊之所害	云 如 來 今 者 為 未 來 世 一 切 眾 生 為 煩 惱 賊 之 所 害 
X22n0410_001:0370c13	者說清淨業又云若佛滅後諸眾生等濁惡不善五	者 說 清 淨 業 又 云 若 佛 滅 後 諸 眾 生 等 濁 惡 不 善 五 
X22n0410_001:0370c14	苦所逼云何當見阿彌陀佛極樂世界天台云生彼	苦 所 逼 云 何 當 見 阿 彌 陀 佛 極樂世界 天 台 云 生 彼 
X22n0410_001:0370c15	土者未必悉是得道之人故經云犯重罪者臨終之	土 者 未 必 悉 是 得 道 之 人 故 經 云 犯 重 罪 者 臨 終 之 
X22n0410_001:0370c16	時懺罪念佛業障便轉即得往生若但生聖凡夫何	時 懺 罪 念 佛 業 障 便 轉 即 得 往 生 若 但 生 聖 凡 夫 何 
X22n0410_001:0370c17	得願生彼土故知雖具染惑亦得生也(文)四明亦云	得 願 生 彼 土 故 知 雖 具 染 惑 亦 得 生 也 文 四 明 亦 云 
X22n0410_001:0370c18	不離當念願達彼方庶即下凡便階不退又云即於	不 離 當 念 願 達 彼 方 庶 即 下 凡 便 階 不 退 又 云 即 於 
X22n0410_001:0370c19	博地能藉勝緣纔獲往生永無退轉(文)據此經疏以	博 地 能 藉 勝 緣 纔 獲 往 生 永 無 退 轉 文 據 此 經 疏 以 
X22n0410_001:0370c20	明則知到彼土已進修勝道方論破顯若在此土已	明 則 知 到 彼 土 已 進 修 勝 道 方 論 破 顯 若 在 此 土 已 
X22n0410_001:0370c21	破惑已入位何藉求生淨土耶輔正只欲破斥新疏	破 惑 已 入 位 何 藉 求 生 淨 土 耶 輔 正 只 欲 破 斥 新 疏 
X22n0410_001:0370c22	不知反自公違佛祖。	不 知 反 自 公 違 佛 祖 
X22n0410_001:0370c23	新疏云了彼淨土即我自心非他法也達彼彌陀	新 疏 云 了 彼 淨 土 即 我 自 心 非 他 法 也 達 彼 彌 陀 
X22n0410_001:0370c24	即我自性非他物也乃至云淨穢身土悉是眾生	即 我 自 性 非 他 物 也 乃 至 云 淨 穢 身 土 悉 是 眾 生 
X22n0410_001:0371a01	自心只由心體虗融故使往來無礙只由心體包	自 心 只 由 心 體 虗 融 故 使 往 來 無 礙 只 由 心 體 包 
X22n0410_001:0371a02	徧故令取舍無妨。	徧 故 令 取 舍 無 妨 
X22n0410_001:0371a03	輔正曰新疏所計不出心體虗融心性包徧於融	輔 正 曰 新 疏 所 計 不 出 心 體 虗 融 心 性 包 徧 於 融 
X22n0410_001:0371a04	徧中而有去來淨土極談臻於此也如此見解何	徧 中 而 有 去 來 淨 土 極 談 臻 於 此 也 如 此 見 解 何 
X22n0410_001:0371a05	殊外計外道尚云含徧國土又云我徧十方凝明	殊 外 計 外 道 尚 云 含 徧 國 土 又 云 我 徧 十 方 凝 明 
X22n0410_001:0371a06	不動一切眾生於我心中自生自死等新疏之談	不 動 一 切 眾 生 於 我 心 中 自 生 自 死 等 新 疏 之 談 
X22n0410_001:0371a07	此外道計相去幾何又小乘中所談幻化之心偏	此 外 道 計 相 去 幾 何 又 小 乘 中 所 談 幻 化 之 心 偏 
X22n0410_001:0371a08	於法界亦奚揀之雖然此經大乘了義觀佛三昧	於 法 界 亦 奚 揀 之 雖 然 此 經 大 乘 了 義 觀 佛 三 昧 
X22n0410_001:0371a09	攝受往生凡夫淺識三昧未成苟發斯解將何用	攝 受 往 生 凡 夫 淺 識 三 昧 未 成 苟 發 斯 解 將 何 用 
X22n0410_001:0371a10	心以別邪正。	心 以 別 邪 正 
X22n0410_001:0371a11	論曰新疏極談灼然臻於此也輔正不有成人之美	論 曰 新 疏 極 談 灼 然 臻 於 此 也 輔 正 不 有 成 人 之 美 
X22n0410_001:0371a12	但欲成人之惡引彼相似之言混此至當之義且如	但 欲 成 人 之 惡 引 彼 相 似 之 言 混 此 至 當 之 義 且 如 
X22n0410_001:0371a13	外道全是生死妄心所起邪計不出因緣及與自然	外 道 全 是 生 死 妄 心 所 起 邪 計 不 出 因 緣 及 與 自 然 
X22n0410_001:0371a14	小乘乃是生滅幻心體析諸法取證偏空尚都不聞	小 乘 乃 是 生 滅 幻 心 體 析 諸 法 取 證 偏 空 尚 都 不 聞 
X22n0410_001:0371a15	他佛身土之名安能信有唯心本性之說其理懸遠	他 佛 身 土 之 名 安 能 信 有 唯 心 本 性 之 說 其 理 懸 遠 
X22n0410_001:0371a16	如泰山之與秋毫安可同年而語自知不可作如此	如 泰 山 之 與 秋 毫 安 可 同 年 而 語 自 知 不 可 作 如 此 
X22n0410_001:0371a17	難復轉計云雖然此經大乘了義等者須知此說益	難 復 轉 計 云 雖 然 此 經 大 乘 了 義 等 者 須 知 此 說 益 
X22n0410_001:0371a18	見乖疎何者此土修行全運自力由被觀慧研窮妄	見 乖 疎 何 者 此 土 修 行 全 運 自 力 由 被 觀 慧 研 窮 妄 
X22n0410_001:0371a19	識故有發起宿業邪解若修淨業全假他力阿彌陀	識 故 有 發 起 宿 業 邪 解 若 修 淨 業 全 假 他 力 阿 彌 陀 
X22n0410_001:0371a20	佛誓願光明常來攝受決無魔事亦由不分兩土教	佛 誓 願 光 明 常 來 攝 受 決 無 魔 事 亦 由 不 分 兩 土 教 
X22n0410_001:0371a21	法之殊致茲混濫也。	法 之 殊 致 茲 混 濫 也 
X22n0410_001:0371a22	新疏云天台疏云此經心觀為宗此則單就能觀	新 疏 云 天 台 疏 云 此 經 心 觀 為 宗 此 則 單 就 能 觀 
X22n0410_001:0371a23	為言遠師善導等並以觀佛三昧為宗此則通就	為 言 遠 師 善 導 等 並 以 觀 佛 三 昧 為 宗 此 則 通 就 
X22n0410_001:0371a24	能所而立。	能 所 而 立 
X22n0410_001:0371b01	輔正曰新疏謂天台單就能觀者讀文不周也下	輔 正 曰 新 疏 謂 天 台 單 就 能 觀 者 讀 文 不 周 也 下 
X22n0410_001:0371b02	文既云以修心妙觀為宗豈是單就能觀耶蓋修	文 既 云 以 修 心 妙 觀 為 宗 豈 是 單 就 能 觀 耶 蓋 修 
X22n0410_001:0371b03	心玅觀之義乃約是心作佛佛於心顯故曰修心	心 玅 觀 之 義 乃 約 是 心 作 佛 佛 於 心 顯 故 曰 修 心 
X22n0410_001:0371b04	玅觀之言豈非三昧故知修心妙觀與觀佛三昧	玅 觀 之 言 豈 非 三 昧 故 知 修 心 妙 觀 與 觀 佛 三 昧 
X22n0410_001:0371b05	安可以能所單複揀之。	安 可 以 能 所 單 複 揀 之 
X22n0410_001:0371b06	論曰凡欲定當是非評量得失必據現文然後文下	論 曰 凡 欲 定 當 是 非 評 量 得 失 必 據 現 文 然 後 文 下 
X22n0410_001:0371b07	求義萬無失一新疏所以揀判兩家經宗乃據現文	求 義 萬 無 失 一 新 疏 所 以 揀 判 兩 家 經 宗 乃 據 現 文 
X22n0410_001:0371b08	也輔正却引下文約義曲釋欲具能所今謂下文修	也 輔 正 却 引 下 文 約 義 曲 釋 欲 具 能 所 今 謂 下 文 修 
X22n0410_001:0371b09	心妙觀之語與前心觀之說無殊如愚所見天台既	心 妙 觀 之 語 與 前 心 觀 之 說 無 殊 如 愚 所 見 天 台 既 
X22n0410_001:0371b10	談性具現前一念具足三千依正身土生佛因果小	談 性 具 現 前 一 念 具 足 三 千 依 正 身 土 生 佛 因 果 小 
X22n0410_001:0371b11	如毫末大若虗空舉一全收無非心性離能觀外無	如 毫 末 大 若 虗 空 舉 一 全 收 無 非 心 性 離 能 觀 外 無 
X22n0410_001:0371b12	別所觀若其然者假使天台單就能觀亦自佳矣何	別 所 觀 若 其 然 者 假 使 天 台 單 就 能 觀 亦 自 佳 矣 何 
X22n0410_001:0371b13	必攀附須具能所況今新疏以觀佛為宗一準十疑	必 攀 附 須 具 能 所 況 今 新 疏 以 觀 佛 為 宗 一 準 十 疑 
X22n0410_001:0371b14	論文彼云凡求生者希心起想緣阿彌陀佛相好光	論 文 彼 云 凡 求 生 者 希 心 起 想 緣 阿 彌 陀 佛 相 好 光 
X22n0410_001:0371b15	明又觀彼土七寶莊嚴備如十六觀經等疏即結云	明 又 觀 彼 土 七 寶 莊 嚴 備 如 十 六 觀 經 等 疏 即 結 云 
X22n0410_001:0371b16	今經觀佛斯為明據祖訓若此那得不遵。	今 經 觀 佛 斯 為 明 據 祖 訓 若 此 那 得 不 遵 
X22n0410_001:0371b17	新疏云以觀佛三昧為宗及引經論成證又明事	新 疏 云 以 觀 佛 三 昧 為 宗 及 引 經 論 成 證 又 明 事 
X22n0410_001:0371b18	理云理是虗寂之強名事乃施為之別目利根達	理 云 理 是 虗 寂 之 強 名 事 乃 施 為 之 別 目 利 根 達 
X22n0410_001:0371b19	理一切唯心鈍根永達專依事行。	理 一 切 唯 心 鈍 根 永 達 專 依 事 行 
X22n0410_001:0371b20	輔正曰新疏以觀佛三昧為宗者此經明佛乃有	輔 正 曰 新 疏 以 觀 佛 三 昧 為 宗 者 此 經 明 佛 乃 有 
X22n0410_001:0371b21	三品所謂八尺丈六八萬相好也三品之中為觀	三 品 所 謂 八 尺 丈 六 八 萬 相 好 也 三 品 之 中 為 觀 
X22n0410_001:0371b22	何品又三昧之名如智論總有百八楞嚴為首大	何 品 又 三 昧 之 名 如 智 論 總 有 百 八 楞 嚴 為 首 大 
X22n0410_001:0371b23	品師子奮迅三昧超越三昧乃至地持九種三昧	品 師子奮迅三昧 超越三昧 乃 至 地 持 九 種 三 昧 
X22n0410_001:0371b24	新疏但云觀佛三昧而已未審以何三昧觀何佛	新 疏 但 云 觀 佛 三 昧 而 已 未 審 以 何 三 昧 觀 何 佛 
X22n0410_001:0371c01	身所準十疑論文如何承用次明事理二觀本出	身 所 準 十 疑 論 文 如 何 承 用 次 明 事 理 二 觀 本 出 
X22n0410_001:0371c02	占察經中文云一者利根應習真如實觀其鈍根	占 察 經 中 文 云 一 者 利 根 應 習 真 如 實 觀 其 鈍 根 
X22n0410_001:0371c03	者應當先習唯心識觀真如豈非理心識豈非事	者 應 當 先 習 唯 心 識 觀 真 如 豈 非 理 心 識 豈 非 事 
X22n0410_001:0371c04	新疏那云利根理觀則達唯心。	新 疏 那 云 利 根 理 觀 則 達 唯 心 
