X22n0410_001:0376b08	忍對當前之三忍既云伏忍信忍順忍雖破見思猶	忍 對 當 前 之 三 忍 既 云 伏 忍 信 忍 順 忍 雖 破 見 思 猶 
X22n0410_001:0376b09	伏無明第四無生忍位正破無明恰與新疏符合自	伏 無 明 第 四 無 生 忍 位 正 破 無 明 恰 與 新 疏 符 合 自 
X22n0410_001:0376b10	餘位次出沒不同在彼經論赴機有異今疏且據一	餘 位 次 出 沒 不 同 在 彼 經 論 赴 機 有 異 今 疏 且 據 一 
X22n0410_001:0376b11	途而說不必多囉。	途 而 說 不 必 多 囉 
X22n0410_001:0376b12	新疏云乖前境量名為他觀不正曰邪雖是佛教	新 疏 云 乖 前 境 量 名 為 他 觀 不 正 曰 邪 雖 是 佛 教 
X22n0410_001:0376b13	大小觀法若非往生淨土之觀並是偏邪。	大 小 觀 法 若 非 往 生 淨 土 之 觀 並 是 偏 邪 
X22n0410_001:0376b14	輔正曰新疏破立缺於三思且法華云十方佛土	輔 正 曰 新 疏 破 立 缺 於 三 思 且 法 華 云 十 方 佛 土 
X22n0410_001:0376b15	中唯有一乘法又云已今當說法華第一如此玅	中 唯 有 一 乘 法 又 云 已 今 當 說 法 華 第 一 如 此 玅 
X22n0410_001:0376b16	乘無有過上不言淨土豈亦偏邪末代無知謗毀	乘 無 有 過 上 不 言 淨 土 豈 亦 偏 邪 末 代 無 知 謗 毀 
X22n0410_001:0376b17	玅典招惡果報由新疏而致也。	玅 典 招 惡 果 報 由 新 疏 而 致 也 
X22n0410_001:0376b18	論曰用心不公輔正為甚新疏為消經中正觀邪觀	論 曰 用 心 不 公 輔 正 為 甚 新 疏 為 消 經 中 正 觀 邪 觀 
X22n0410_001:0376b19	之語遂乃次第揀辯先就本經節之如修日觀而地	之 語 遂 乃 次 第 揀 辯 先 就 本 經 節 之 如 修 日 觀 而 地 
X22n0410_001:0376b20	觀見前雖同本經觀法既乖本心要期尚屬他邪何	觀 見 前 雖 同 本 經 觀 法 既 乖 本 心 要 期 尚 屬 他 邪 何 
X22n0410_001:0376b21	況餘經觀法安得不是他邪疏文又自釋云非同外	況 餘 經 觀 法 安 得 不 是 他 邪 疏 文 又 自 釋 云 非 同 外 
X22n0410_001:0376b22	道邪見之邪乃新疏欲令行者心境相當功不虗棄	道 邪 見 之 邪 乃 新 疏 欲 令 行 者 心 境 相 當 功 不 虗 棄 
X22n0410_001:0376b23	專對修行淨業一人而說且如有人依摩訶止觀揀	專 對 修 行 淨 業 一 人 而 說 且 如 有 人 依 摩 訶 止 觀 揀 
X22n0410_001:0376b24	境立陰觀三諦理正用觀時忽若淨土境界現前豈	境 立 陰 觀 三 諦 理 正 用 觀 時 忽 若 淨 土 境界現前 豈 
X22n0410_001:0376c01	非邪觀此則就正教中互分邪正未嘗曾說法華不	非 邪 觀 此 則 就 正 教 中 互 分 邪 正 未 嘗 曾 說 法 華 不 
X22n0410_001:0376c02	言淨土屬於偏邪厚誣新疏毀謗招報此言何歸。	言 淨 土 屬 於 偏 邪 厚 誣 新 疏 毀 謗 招 報 此 言 何 歸 
X22n0410_001:0376c03	新疏云為令識位有上中下即是大本三品也今	新 疏 云 為 令 識 位 有 上 中 下 即 是 大 本 三 品 也 今 
X22n0410_001:0376c04	謂大本三品皆曾發心可對今經上三品耳中下	謂 大 本 三 品 皆 曾 發 心 可 對 今 經 上 三 品 耳 中 下 
X22n0410_001:0376c05	二品則非所對況復行因與今全別尋經方知。	二 品 則 非 所 對 況 復 行 因 與 今 全 別 尋 經 方 知 
X22n0410_001:0376c06	輔正曰天台以今經九品會同大本三輩者乃約	輔 正 曰 天 台 以 今 經 九 品 會 同 大 本 三 輩 者 乃 約 
X22n0410_001:0376c07	彼此位次高下相同而會不約發心行因之相以	彼 此 位 次 高 下 相 同 而 會 不 約 發 心 行 因 之 相 以 
X22n0410_001:0376c08	會三品也。	會 三 品 也 
X22n0410_001:0376c09	論曰天台以今九品會彼三輩必應別有深意若如	論 曰 天 台 以 今 九 品 會 彼 三 輩 必 應 別 有 深 意 若 如 
X22n0410_001:0376c10	輔正謂約彼此位次高下相同而會不約發心行因	輔 正 謂 約 彼 此 位 次 高 下 相 同 而 會 不 約 發 心 行 因 
X22n0410_001:0376c11	之相者大無意味何哉若謂天台但約位次高下不	之 相 者 大 無 意 味 何 哉 若 謂 天 台 但 約 位 次 高 下 不 
X22n0410_001:0376c12	約行因發心則見天台空有會同之名而無會同之	約 行 因 發 心 則 見 天 台 空 有 會 同 之 名 而 無 會 同 之 
X22n0410_001:0376c13	旨大凡會同必須彼此泯齊只緣發心行因有異故	旨 大 凡 會 同 必 須 彼 此 泯 齊 只 緣 發 心 行 因 有 異 故 
X22n0410_001:0376c14	使位次而分高下若或不約行因發心安得位次有	使 位 次 而 分 高 下 若 或 不 約 行 因 發 心 安 得 位 次 有 
X22n0410_001:0376c15	高下耶所以新疏止對上三品者蓋由大本經云願	高 下 耶 所 以 新 疏 止 對 上 三 品 者 蓋 由 大 本 經 云 願 
X22n0410_001:0376c16	生彼國凡有三輩其上輩者捨家棄欲而作沙門發	生 彼 國 凡 有 三 輩 其 上 輩 者 捨 家 棄 欲 而 作 沙 門 發 
X22n0410_001:0376c17	菩提心一向專念無量壽佛修諸功德臨壽終時無	菩 提 心 一 向 專 念 無 量 壽 佛 修諸功德 臨壽終時 無 
X22n0410_001:0376c18	量壽佛與諸大眾現其人前即隨彼佛往生其國其	量 壽 佛 與 諸 大 眾 現其人前 即 隨 彼 佛 往 生 其 國 其 
X22n0410_001:0376c19	中輩者當發無上菩提之心專念彼佛修眾善根奉	中 輩 者 當 發 無上菩提 之 心 專 念 彼 佛 修 眾 善 根 奉 
X22n0410_001:0376c20	持齋戒起立塔像飯食沙門懸繒然燈散華燒香願	持 齋 戒 起 立 塔 像 飯 食 沙 門 懸 繒 然 燈 散 華 燒 香 願 
X22n0410_001:0376c21	生彼國其人臨終無量壽佛化現其身與諸大眾現	生 彼 國 其 人 臨 終 無 量 壽 佛 化 現 其 身 與 諸 大 眾 現 
X22n0410_001:0376c22	其人前即隨往生其下輩者至心欲生彼國假使不	其 人 前 即 隨 往 生 其 下 輩 者 至 心 欲 生 彼 國 假 使 不 
X22n0410_001:0376c23	能作諸功德當發無上菩提之心一向專意乃至十	能 作 諸 功 德 當 發 無上菩提 之 心 一 向 專 意 乃 至 十 
X22n0410_001:0376c24	念念無量壽佛願生其國此人臨終夢見彼佛亦得	念 念 無 量 壽 佛 願 生 其 國 此 人 臨 終 夢 見 彼 佛 亦 得 
X22n0410_001:0377a01	往生此是大本三輩發心行因之相雖則所修行相	往 生 此 是 大 本 三 輩 發 心 行 因 之 相 雖 則 所 修 行 相 
X22n0410_001:0377a02	不同莫不皆發菩提之心則與今經上品三輩發心	不 同 莫 不 皆 發 菩提之心 則 與 今 經 上 品 三 輩 發 心 
X22n0410_001:0377a03	是同故得新疏只對上品其如中下二品乃是彼土	是 同 故 得 新 疏 只 對 上 品 其 如 中 下 二 品 乃 是 彼 土 
X22n0410_001:0377a04	二乘人天之眾雖不執真住小奈何宿習未忘猶假	二 乘 人 天 之 眾 雖 不 執 真 住 小 奈 何 宿 習 未 忘 猶 假 
X22n0410_001:0377a05	小法而為開道並無因中發大道心之語比類大本	小 法 而 為 開 道 並 無 因 中 發 大 道 心 之 語 比 類 大 本 
X22n0410_001:0377a06	三輩霄壤相隔所以新疏不許對之若如輔正之說	三 輩 霄 壤 相 隔 所 以 新 疏 不 許 對 之 若 如 輔 正 之 說 
X22n0410_001:0377a07	猶恐未盡天台之意也。	猶 恐 未 盡 天 台 之 意 也 
X22n0410_001:0377a08	新疏云問彼土純一大乘何有小乘聲聞答此土	新 疏 云 問 彼 土 純 一 大 乘 何 有 小 乘 聲 聞 答 此 土 
X22n0410_001:0377a09	聲聞則有二種一者定性謂沈空滯寂取滅度者	聲 聞 則 有 二 種 一 者 定 性 謂 沈 空 滯 寂 取 滅 度 者 
X22n0410_001:0377a10	往生論云二乘種不生即此類也二者不定性謂	往 生 論 云 二 乘 種 不 生 即 此 類 也 二 者 不 定 性 謂 
X22n0410_001:0377a11	中間回心以至開顯知常獲記雖是聲聞不住小	中 間 回 心 以 至 開 顯 知 常 獲 記 雖 是 聲 聞 不 住 小 
X22n0410_001:0377a12	果淨土聲聞即同此類。	果 淨 土 聲 聞 即 同 此 類 
X22n0410_001:0377a13	輔正曰中間之言為在何處開顯之說為屬何經	輔 正 曰 中 間 之 言 為 在 何 處 開 顯 之 說 為 屬 何 經 
X22n0410_001:0377a14	若指法華者法華授聲聞記已則法身體顯分身	若 指 法 華 者 法 華 授 聲 聞 記 已 則 法 身 體 顯 分 身 
X22n0410_001:0377a15	剎土與物結緣未嘗有言生極樂土縱藥王品有	剎 土 與 物 結 緣 未 嘗 有 言 生 極 樂 土 縱 藥 王 品 有 
X22n0410_001:0377a16	此之言自屬滅後聞法之人即非開顯當機之眾。	此 之 言 自 屬 滅 後 聞 法 之 人 即 非 開 顯 當 機 之 眾 
X22n0410_001:0377a17	論曰新疏立義坦然明白何事猶迷當知中間之言	論 曰 新 疏 立 義 坦 然 明 白 何 事 猶 迷 當 知 中 間 之 言 
X22n0410_001:0377a18	且就今日施化言之始自鹿苑之後直至法華之前	且 就 今 日 施 化 言 之 始 自 鹿 苑 之 後 直 至 法 華 之 前 
X22n0410_001:0377a19	並屬中間安可的指一處開顯屬何經者雖三尺童	並 屬 中 間 安 可 的 指 一 處 開 顯 屬 何 經 者 雖 三 尺 童 
X22n0410_001:0377a20	子知是法華法師何故反不知之耶所言法華聲聞	子 知 是 法 華 法 師 何 故 反 不 知 之 耶 所 言 法 華 聲 聞 
X22n0410_001:0377a21	得記未嘗有生極樂土者未審此語從何而得新疏	得 記 未 嘗 有 生 極 樂 土 者 未 審 此 語 從 何 而 得 新 疏 
X22n0410_001:0377a22	自將此土二種聲聞格量淨土聲聞有如回心向大	自 將 此 土 二 種 聲 聞 格 量 淨 土 聲 聞 有 如 回 心 向 大 
X22n0410_001:0377a23	開顯得記之類爾並無一言直指法華當機三人生	開 顯 得 記 之 類 爾 並 無 一 言 直 指 法 華 當 機 三 人 生 
X22n0410_001:0377a24	極樂國雖欲屈抑新疏爭奈眾眼難瞞。	極 樂 國 雖 欲 屈 抑 新 疏 爭 奈 眾 眼 難 瞞 
X22n0410_001:0377b01	新疏云大本唯除五逆誹謗正法今經逆罪得生	新 疏 云 大 本 唯 除 五 逆 誹謗正法 今 經 逆 罪 得 生 
X22n0410_001:0377b02	者今解若據彌陀願力豈遮造惡之徒方便赴機	者 今 解 若 據 彌 陀 願 力 豈 遮 造 惡 之 徒 方 便 赴 機 
X22n0410_001:0377b03	言乖趣合彼則顯樂邦殊玅欲進善人此明淨業	言 乖 趣 合 彼 則 顯 樂 邦 殊 玅 欲 進 善 人 此 明 淨 業 
X22n0410_001:0377b04	功深不遺極惡。	功 深 不 遺 極 惡 
X22n0410_001:0377b05	輔正曰天台所立根有上下逆罪多寡悔不輕重	輔 正 曰 天 台 所 立 根 有 上 下 逆 罪 多 寡 悔 不 輕 重 
X22n0410_001:0377b06	行有定散以判二經取舍新疏則非此也直以各	行 有 定 散 以 判 二 經 取 舍 新 疏 則 非 此 也 直 以 各 
X22n0410_001:0377b07	赴機緣進善收惡適有不同耳今謂新疏云大本	赴 機 緣 進 善 收 惡 適 有 不 同 耳 今 謂 新 疏 云 大 本 
X22n0410_001:0377b08	但進善人者且西竺梵本未至此土者不可得知	但 進 善 人 者 且 西 竺 梵 本 未 至 此 土 者 不 可 得 知 
X22n0410_001:0377b09	若此觀經及餘諸部未至此土但見大本揀惡之	若 此 觀 經 及 餘 諸 部 未 至 此 土 但 見 大 本 揀 惡 之 
X22n0410_001:0377b10	文者則令惡人省已絕分以此照之新疏麤淺吾	文 者 則 令 惡 人 省 已 絕 分 以 此 照 之 新 疏 麤 淺 吾 
X22n0410_001:0377b11	祖判釋假如觀經及餘諸部未來此土獨見大本	祖 判 釋 假 如 觀 經 及 餘 諸 部 未 來 此 土 獨 見 大 本 
X22n0410_001:0377b12	揀惡之文亦必作上諸義解釋況新疏下文自引	揀 惡 之 文 亦 必 作 上 諸 義 解 釋 況 新 疏 下 文 自 引 
X22n0410_001:0377b13	觀佛三昧為證逆罪之人一日一夜繫念觀佛罪	觀 佛 三 昧 為 證 逆 罪 之 人 一 日 一 夜 繫 念 觀 佛 罪 
X22n0410_001:0377b14	障消滅此與天台所立此經明觀逆罪得生有何	障 消 滅 此 與 天 台 所 立 此 經 明 觀 逆 罪 得 生 有 何 
X22n0410_001:0377b15	差別返顯若不觀佛則不得生此與天台散善不	差 別 返 顯 若 不 觀 佛 則 不 得 生 此 與 天 台 散 善 不 
X22n0410_001:0377b16	生有何差別乃至云掩耳偷鈴傍觀絕倒。	生 有何差別 乃 至 云 掩 耳 偷 鈴 傍 觀 絕 倒 
X22n0410_001:0377b17	論曰新疏特以方便赴機言乖趣合以收二經玅窮	論 曰 新 疏 特 以 方 便 赴 機 言 乖 趣 合 以 收 二 經 玅 窮 
X22n0410_001:0377b18	佛意深經宗此乃新疏格外之見則與天台初無干	佛 意 深 經 宗 此 乃 新 疏 格 外 之 見 則 與 天 台 初 無 干 
X22n0410_001:0377b19	涉而輔正苦破新疏良難杜口試為言之所言觀經	涉 而 輔 正 苦 破 新 疏 良 難 杜 口 試 為 言 之 所 言 觀 經 
X22n0410_001:0377b20	諸部未來但見大本則令惡人絕分者是何言歟只	諸 部 未 來 但 見 大 本 則 令 惡 人 絕 分 者 是 何 言 歟 只 
X22n0410_001:0377b21	緣二經並列收揀不同故此和會兩不相違安以觀	緣 二 經 並 列 收 揀 不 同 故 此 和 會 兩 不 相 違 安 以 觀 
X22n0410_001:0377b22	經未來為難借使觀經未來獨見大本新疏亦作此	經 未 來 為 難 借 使 觀 經 未 來 獨 見 大 本 新 疏 亦 作 此 
X22n0410_001:0377b23	釋當知大本進善意在收惡觀經惡意必進善二經	釋 當 知 大 本 進 善 意 在 收 惡 觀 經 惡 意 必 進 善 二 經 
X22n0410_001:0377b24	一致所謂言乖趣合也輔正謂假如觀經未來智者	一 致 所 謂 言 乖 趣 合 也 輔 正 謂 假 如 觀 經 未 來 智 者 
X22n0410_001:0377c01	亦必作上諸義釋者今謂此說却有相妨何者若謂	亦 必 作 上 諸 義 釋 者 今 謂 此 說 却 有 相 妨 何 者 若 謂 
X22n0410_001:0377c02	天台所立大本揀惡乃是下根逆多悔輕行散故為	天 台 所 立 大 本 揀 惡 乃 是 下 根 逆 多 悔 輕 行 散 故 為 
X22n0410_001:0377c03	所揀今經收惡乃是上根逆寡悔重行定故為所收	所 揀 今 經 收 惡 乃 是 上 根 逆 寡 悔 重 行 定 故 為 所 收 
X22n0410_001:0377c04	若其然者果使觀經未來此土但見大本揀惡之文	若 其 然 者 果 使 觀 經 未 來 此 土 但 見 大 本 揀 惡 之 文 
X22n0410_001:0377c05	則應下根逆多悔輕行散之人省己絕分淨土之道	則 應 下 根 逆 多 悔 輕 行 散 之 人 省 己 絕 分 淨 土 之 道 
X22n0410_001:0377c06	何由可階以此照之輔正麤淺返累天台復見新疏	何 由 可 階 以 此 照 之 輔 正 麤 淺 返 累 天 台 復 見 新 疏 
X22n0410_001:0377c07	所引觀佛三昧等經證成逆罪消滅恐墮負處却乃	所 引 觀 佛 三 昧 等 經 證 成 逆 罪 消 滅 恐 墮 負 處 却 乃 
X22n0410_001:0377c08	攀齊而又反責嗚呼掩耳偷鈴傍觀絕倒推與誰耶	攀 齊 而 又 反 責 嗚 呼 掩 耳 偷 鈴 傍 觀 絕 倒 推 與 誰 耶 
X22n0410_001:0377c09	余雖不敏昔忝游學教律親承草菴法師提訓多矣	余 雖 不 敏 昔 忝 游 學 教 律 親 承 草 菴 法 師 提 訓 多 矣 
X22n0410_001:0377c10	紹興中法師甞赴西湖秀公之請主念佛三昧余獲	紹 興 中 法 師 甞 赴 西 湖 秀 公 之 請 主 念佛三昧 余 獲 
X22n0410_001:0377c11	侍焉法師以余為吾家人初無疑忌因乘閒請益日	侍 焉 法 師 以 余 為 吾 家 人 初 無 疑 忌 因 乘 閒 請 益 日 
X22n0410_001:0377c12	法師輔正解對破靈芝新疏其間似有不當如是難	法 師 輔 正 解 對 破 靈 芝 新 疏 其 間 似 有 不 當 如 是 難 
X22n0410_001:0377c13	者尊意如何法師頷之良久笑謂余曰公豈不聞俗	者 尊 意 如 何 法 師 頷 之 良 久 笑 謂 余 曰 公 豈 不 聞 俗 
X22n0410_001:0377c14	諺所謂相罵無好言相打無好拳建立門庭不得不	諺 所 謂 相 罵 無 好 言 相 打 無 好 拳 建 立 門 庭 不 得 不 
X22n0410_001:0377c15	爾余遂於言下深領法師之意及余復宗律部再以	爾 余 遂 於 言 下 深 領 法 師 之 意 及 余 復 宗 律 部 再 以 
X22n0410_001:0377c16	新疏輔正參較益信法師之說不我欺也比因華嚴	新 疏 輔 正 參 較 益 信 法 師 之 說 不 我 欺 也 比 因 華 嚴 
X22n0410_001:0377c17	高座政公啟講新疏首訪余曰輔正吾固不惑但患	高 座 政 公 啟 講 新 疏 首 訪 余 曰 輔 正 吾 固 不 惑 但 患 
X22n0410_001:0377c18	後進遲疑累欲執筆評之誠所未暇子幸閑居無事	後 進 遲 疑 累 欲 執 筆 評 之 誠 所 未 暇 子 幸 閑 居 無 事 
X22n0410_001:0377c19	能成我之志乎余念新疏屈而不申晦而不明惻隱	能 成 我 之 志 乎 余 念 新 疏 屈 而 不 申 晦 而 不 明 惻 隱 
X22n0410_001:0377c20	于心故非一日既承其命欣然是從即以法師向來	于 心 故 非 一 日 既 承 其 命 欣 然 是 從 即 以 法 師 向 來 
X22n0410_001:0377c21	告余之意而往求之無不可者言詞朴陋義理麤淺	告 余 之 意 而 往 求 之 無 不 可 者 言 詞 朴 陋 義 理 麤 淺 
X22n0410_001:0377c22	若與輔正爭驅並駕則余豈敢庶幾來學得牕按閒	若 與 輔 正 爭 驅 並 駕 則 余 豈 敢 庶 幾 來 學 得 牕 按 閒 
X22n0410_001:0377c23	討論之張本爾知我罪我莫非贊述淨土共期西邁	討 論 之 張 本 爾 知 我 罪 我 莫 非 贊 述 淨 土 共 期 西 邁 
X22n0410_001:0377c24	焉。	焉 
X22n0410_001:0378a01	觀經扶新論卷終	觀 經 扶 新 論 卷 終 
