X22n0405_001:0245b06	來除却萎華已便得顯現佛見眾生亦復如是已下	來 除 却 萎 華 已 便 得 顯 現 佛 見 眾 生 亦復如是 已 下 
X22n0405_001:0245b07	九譬總有九番長行偈頌各四五行今略引要合前	九 譬 總 有 九 番 長 行 偈 頌 各 四 五 行 今 略 引 要 合 前 
X22n0405_001:0245b08	喻相初云譬如萎變華其華未開敷天眼者觀見如	喻 相 初 云 譬 如 萎 變 華 其 華 未 開 敷 天 眼 者 觀 見 如 
X22n0405_001:0245b09	來身無染二云譬如嚴樹蜜無量蜂圍繞善方便取	來 身 無 染 二 云 譬 如 嚴 樹 蜜 無 量 蜂 圍 繞 善 方 便 取 
X22n0405_001:0245b10	者先除彼群蜂三云譬一切秔粮皮[禾*會]未除蕩貧者	者 先 除 彼 群 蜂 三 云 譬 一 切 秔 粮 皮 [禾會] 未 除 蕩 貧 者 
X22n0405_001:0245b11	猶賤之謂為可棄物四云譬金在不淨隱沒莫能覩	猶 賤 之 謂 為 可 棄 物 四 云 譬 金 在 不 淨 隱 沒 莫 能 覩 
X22n0405_001:0245b12	天眼者乃見即以告眾人五云譬如貧人家內有珍	天 眼 者 乃 見 即 以 告 眾 人 五 云 譬 如 貧 人 家 內 有 珍 
X22n0405_001:0245b13	寶藏主既不知見寶復不能言六云譬如菴羅果內	寶 藏 主 既 不 知 見 寶 復 不 能 言 六 云 譬 如 菴 羅 果 內 
X22n0405_001:0245b14	實不毀壞種之於大地必成大樹王七云譬如持金	實 不 毀 壞 種 之 於 大 地 必 成 大 樹 王 七 云 譬 如 持 金 
X22n0405_001:0245b15	像行詣於他方裹以弊穢物棄之以曠野八云譬如	像 行 詣 於 他 方 裹 以 弊 穢 物 棄 之 以 曠 野 八 云 譬 如 
X22n0405_001:0245b16	貧女人色貌甚醜陋而懷貴相子當為轉輪王九云	貧 女 人 色 貌 甚 醜 陋 而 懷 貴 相 子 當 為 轉 輪 王 九 云 
X22n0405_001:0245b17	譬如大冶鑄無量真金像愚者自外覩但見燋黑土	譬 如 大 冶 鑄 無 量 真 金 像 愚 者 自 外 覩 但 見 燋 黑 土 
X22n0405_001:0245b18	文中以佛性合喻二名字即緣理發大乘心三觀行	文 中 以 佛 性 合 喻 二 名 字 即 緣 理 發大乘心 三 觀 行 
X22n0405_001:0245b19	即修不思議十法通達無礙四相似即六根互用十	即 修 不 思 議 十 法 通 達 無 礙 四 相 似 即 六 根 互 用 十 
X22n0405_001:0245b20	信菩薩發大心長別三界苦輪海五分證即謂十住	信 菩 薩 發 大 心 長 別 三 界 苦 輪 海 五 分 證 即 謂 十 住 
X22n0405_001:0245b21	行向地等覺四十一位六究竟即玅覺佛地居常寂	行 向 地 等 覺 四 十 一 位 六 究 竟 即 玅 覺 佛 地 居 常 寂 
X22n0405_001:0245b22	光土初理即文為二先明三德次斯理下歎體不二	光 土 初 理 即 文 為 二 先 明 三 德 次 斯 理 下 歎 體 不 二 
X22n0405_001:0245b23	初文分三德初引四經更無不明了理即法身次雖	初 文 分 三 德 初 引 四 經 更 無 不 明 了 理 即 法 身 次 雖 
X22n0405_001:0245b24	五無間下理即解脫五無間者一受報無間(捨身受報)二	五 無 間 下 理 即 解 脫 五 無 間 者 一 受 報 無 間 捨 身 受 報 二 
X22n0405_001:0245c01	受苦無間(中無樂故)三時無間(定一劫故)四命無間(中無絕故)五形	受 苦 無 間 中 無 樂 故 三 時 無 間 定 一 劫 故 四 命 無 間 中 無 絕 故 五 形 
X22n0405_001:0245c02	無間(其身充滿八萬由旬)一人多人同處其中不相障礙皆悉	無 間 其 身 充 滿 八 萬 由 旬 一 人 多 人 同 處 其 中 不相障礙 皆 悉 
X22n0405_001:0245c03	遍滿業不思議也三雖昏盲下理即般若次斯理灼	遍 滿 業 不 思 議 也 三 雖 昏 盲 下 理 即 般 若 次 斯 理 灼 
X22n0405_001:0245c04	然下嘆體理常平等無二有無高下自爾本理覺性	然 下 嘆 體 理 常 平 等 無 二 有 無 高 下 自 爾 本 理 覺 性 
X22n0405_001:0245c05	恒如即理佛義名字即文為二先法次喻法華云一	恒 如 即 理 佛 義 名 字 即 文 為 二 先 法 次 喻 法 華 云 一 
X22n0405_001:0245c06	百八十劫初引二經多劫不聞名字次若佛出世由	百 八 十 劫 初 引 二 經 多 劫 不 聞 名 字 次 若 佛 出 世 由 
X22n0405_001:0245c07	出能說因說得聞聞教尋詮修行得理故云開甘露	出 能 說 因 說 得 聞 聞 教 尋 詮 修 行 得 理 故 云 開 甘 露 
X22n0405_001:0245c08	門門即是教甘露是理故須達聞名身毛皆竪名大	門 門 即 是 教 甘 露 是 理 故 須 達 聞 名 身 毛 皆 竪 名 大 
X22n0405_001:0245c09	經二十七云舍衛城中有一長者名須達多為兒娉	經 二 十 七 云 舍 衛 城 中 有 一 長 者 名 須 達 多 為 兒 娉 
X22n0405_001:0245c10	婦詣王舍城既達彼城寄止長者珊檀那舍時此長	婦 詣 王 舍 城 既 達 彼 城 寄 止 長 者 珊 檀 那 舍 時 此 長 
X22n0405_001:0245c11	者中夜而起告諸眷屬仁等可起速共莊嚴掃治宅	者 中 夜 而 起 告 諸 眷 屬 仁 等 可 起 速 共 莊 嚴 掃 治 宅 
X22n0405_001:0245c12	舍辨具餚饍須達聞已尋自思惟將非欲請摩伽王	舍 辨 具 餚 饍 須 達 聞 已 尋 自 思 惟 將 非 欲 請 摩 伽 王 
X22n0405_001:0245c13	耶乃至不安乃如是耶長者答言不也居士我明日	耶 乃 至 不 安 乃 如 是 耶 長 者 答 言 不 也 居 士 我 明 日 
X22n0405_001:0245c14	請佛無上法王須達長者初聞佛名身毛皆竪尋復	請 佛 無 上 法 王 須 達 長 者 初 聞 佛 名 身 毛 皆 竪 尋 復 
X22n0405_001:0245c15	問言何等名佛長者答言汝不聞耶迦毗羅城有釋	問 言 何 等 名 佛 長 者 答 言 汝 不 聞 耶 迦 毗 羅 城 有 釋 
X22n0405_001:0245c16	種子字悉達多姓瞿曇氏父名白淨(云云)乃至捨之出	種 子 字 悉 達 多 姓 瞿 曇 氏 父 名 白 淨 云 云 乃 至 捨 之 出 
X22n0405_001:0245c17	家無師自覺得三菩提貪恚癡盡常住不變不生不	家 無 師 自 覺 得 三 菩 提 貪 恚 癡 盡 常 住 不 變 不 生 不 
X22n0405_001:0245c18	滅無有憂畏於諸眾生其心平等(云云)乃至具足十力	滅 無 有 憂 畏 於 諸 眾 生 其 心 平 等 云 云 乃 至 具 足 十 力 
X22n0405_001:0245c19	四無畏五智三昧大慈大悲及三念處故號為佛(云云)	四 無 畏 五 智 三 昧 大慈大悲 及 三 念 處 故 號 為 佛 云 云 
X22n0405_001:0245c20	須達多言善哉大士所言佛者功德無上今在何處	須 達 多 言 善 哉 大 士 所 言 佛 者 功 德 無 上 今 在 何 處 
X22n0405_001:0245c21	長者答言今在此間王舍城迦蘭陀竹林精舍時須	長 者 答 言 今 在 此 間 王 舍 城 迦 蘭 陀 竹 林 精 舍 時 須 
X22n0405_001:0245c22	達多一心念佛所有功德十力無畏(云云)乃至三念處	達 多 一 心 念 佛 所 有 功 德 十 力 無 畏 云 云 乃 至 三 念 處 
X22n0405_001:0245c23	作是念時忽然大明日明猛盛即尋光出乃至來詣	作 是 念 時 忽 然 大 明 日 明 猛 盛 即 尋 光 出 乃 至 來 詣 
X22n0405_001:0245c24	我所到已頭面敬禮我足我時即為如應說法長者	我 所 到 已 頭 面 敬 禮 我 足 我 時 即 為 如 應 說 法 長 者 
X22n0405_001:0246a01	聞已得須陀洹果當知聞名身毛皆竪心生渴仰接	聞 已 得 須陀洹果 當 知 聞 名 身 毛 皆 竪 心 生 渴 仰 接 
X22n0405_001:0246a02	足頂禮便見佛佛說玅法便證聖果昏夜大朗喻闇	足 頂 禮 便 見 佛 佛 說 玅 法 便 證 聖 果 昏 夜 大 朗 喻 闇 
X22n0405_001:0246a03	惑心中於名字不了如昏夜因說生解如大朗即名	惑 心 中 於 名 字 不 了 如 昏 夜 因 說 生 解 如 大 朗 即 名 
X22n0405_001:0246a04	字佛也人解巨關自闢即名字人解悟觀行佛文為	字 佛 也 人 解 巨 關 自 闢 即 名 字 人 解 悟 觀 行 佛 文 為 
X22n0405_001:0246a05	三法喻合法又二初觀金像次心緣玄色下託境作	三 法 喻 合 法 又 二 初 觀 金 像 次 心 緣 玄 色 下 託 境 作 
X22n0405_001:0246a06	觀浩浩下喻周眸下合合三先十方次三世三三身	觀 浩 浩 下 喻 周 眸 下 合 合 三 先 十 方 次 三 世 三 三 身 
X22n0405_001:0246a07	三身中二先果次因一身即法身一智慧即報身力	三 身 中 二 先 果 次 因 一 身 即 法 身 一 智 慧 即 報 身 力 
X22n0405_001:0246a08	無畏即應身即果三德念色身即假觀念法門身即	無 畏 即 應 身 即 果 三 德 念 色 身 即 假 觀 念 法 門 身 即 
X22n0405_001:0246a09	空觀念實相身即中觀即因三觀相似文為三先觀	空 觀 念 實 相 身 即 中 觀 即 因 三 觀 相 似 文 為 三 先 觀 
X22n0405_001:0246a10	果因三身次釋相似比類四事相顯三引玅經示相	果 因 三 身 次 釋 相 似 比 類 四 事 相 顯 三 引 玅 經 示 相 
X22n0405_001:0246a11	生信初念佛相好身觀果應身得相似相應得因色	生 信 初 念 佛 相 好 身 觀 果 應 身 得 相 似 相 應 得 因 色 
X22n0405_001:0246a12	身念佛法門身觀果報身念實相身觀果法身得因	身 念 佛 法 門 身 觀 果 報 身 念 實 相 身 觀 果 法 身 得 因 
X22n0405_001:0246a13	報法二身例色身作分證佛文為二先廣釋初住次	報 法 二 身 例 色 身 作 分 證 佛 文 為 二 先 廣 釋 初 住 次 
X22n0405_001:0246a14	四十二位況例釋成初文二初釋一界次九界先明	四 十 二 位 況 例 釋 成 初 文 二 初 釋 一 界 次 九 界 先 明 
X22n0405_001:0246a15	初發心住一時分得三身破無明證中理三惑轉三	初 發 心 住 一 時 分 得 三 身 破 無 明 證 中 理 三 惑 轉 三 
X22n0405_001:0246a16	觀明智德增法身生故故一發一切發發一切功德	觀 明 智 德 增 法 身 生 故 故 一 發 一 切 發 發 一切功德 
X22n0405_001:0246a17	即應身一切智慧即報身一切境界即法身不前不	即 應 身 一 切 智 慧 即 報 身 一切境界 即 法 身 不 前 不 
X22n0405_001:0246a18	後下一心證三身三智至得報身得如來玅色至一	後 下 一 心 證 三 身 三 智 至 得 報 身 得 如 來 玅 色 至 一 
X22n0405_001:0246a19	切應身開祕密藏至其中即法身三身分成能起大	切 應 身 開 祕 密 藏 至 其 中 即 法 身 三 身 分 成 能 起 大 
X22n0405_001:0246a20	用分身百世界作佛應化物機作眾色像身輪現通	用 分 身 百 世 界 作 佛 應 化 物 機 作 眾 色 像 身 輪 現 通 
X22n0405_001:0246a21	一音至諸聲口輪說法不動至等悅意輪鑒機八相	一 音 至 諸 聲 口 輪 說 法 不 動 至 等 悅 意 輪 鑒 機 八 相 
X22n0405_001:0246a22	成道者一從兜率天下二託胎三出生四出家五降	成 道 者 一 從兜率天下 二 託 胎 三 出 生 四 出 家 五 降 
X22n0405_001:0246a23	魔六成道七轉法輪八入涅槃況九法界三輪耶者	魔 六 成 道 七 轉 法 輪 八 入 涅 槃 況 九 法 界 三 輪 耶 者 
X22n0405_001:0246a24	舉少況多二住千佛世界應化三住去乃至行向地	舉 少 況 多 二 住 千 佛 世 界 應 化 三 住 去 乃 至 行 向 地 
X22n0405_001:0246b01	等覺十信過前不可量究竟佛文為二先正釋佛義	等 覺 十 信 過 前 不 可 量 究 竟 佛 文 為 二 先 正 釋 佛 義 
X22n0405_001:0246b02	次佛有無量德下指廣初文三法喻合。	次 佛 有 無 量 德 下 指 廣 初 文 三 法 喻 合 
X22n0405_001:0246b03	說者口輪宣唱揚四辯於舌端流八音於聽表故云	說 者 口 輪 宣 唱 揚 四 辯 於 舌 端 流 八 音 於 聽 表 故 云 
X22n0405_001:0246b04	名說十二部經者或說修多羅伽陀及本事本生未	名 說 十二部經 者 或 說 修 多 羅 伽 陀 及 本 事 本 生 未 
X22n0405_001:0246b05	曾有亦說於因緣譬喻並祗夜優婆提舍經方廣授	曾 有 亦 說 於 因 緣 譬 喻 並 祗 夜 優 婆 提 舍 經 方 廣 授 
X22n0405_001:0246b06	記無問自說即大小共十二部小無大三廣問記大	記 無 問 自 說 即 大 小 共 十 二 部 小 無 大 三 廣 問 記 大 
X22n0405_001:0246b07	無三小緣喻事即各九部耳八萬法藏者故賢劫經	無 三 小 緣 喻 事 即 各 九 部 耳 八 萬 法 藏 者 故 賢 劫 經 
X22n0405_001:0246b08	云從佛初發心乃至分舍利凡三百五十法門一一	云 從 佛 初 發 心 乃 至 分 舍 利 凡 三 百 五 十 法 門 一 一 
X22n0405_001:0246b09	門各六度合二千一百度用是度破四分煩惱合成	門 各 六 度 合 二 千 一 百 度 用 是 度 破 四 分 煩 惱 合 成 
X22n0405_001:0246b10	八千四百約一度為十善合八萬四千法門若作八	八 千 四 百 約 一 度 為 十 善 合 八萬四千法門 若 作 八 
X22n0405_001:0246b11	萬四千法藏約苦諦為名若約集諦即八萬四千塵	萬 四 千 法 藏 約 苦 諦 為 名 若 約 集 諦 即 八萬四千 塵 
X22n0405_001:0246b12	勞門若約道諦即八萬四千陀羅尼門若約滅諦即	勞 門 若 約 道 諦 即 八萬四千 陀羅尼門 若 約 滅 諦 即 
X22n0405_001:0246b13	八萬四千波羅蜜門六度即六波羅蜜亦名八萬四	八萬四千 波 羅 蜜 門 六 度 即 六波羅蜜 亦 名 八 萬 四 
X22n0405_001:0246b14	千度無極六度者有四種謂生滅無生無量無作四	千 度 無 極 六 度 者 有 四 種 謂 生 滅 無 生 無 量 無 作 四 
X22n0405_001:0246b15	教法門四悉者悉之名遍檀之名施諸佛用此四法	教 法 門 四 悉 者 悉 之 名 遍 檀 之 名 施 諸 佛 用 此 四 法 
X22n0405_001:0246b16	遍施眾生故云四悉檀也聞者至受行即世界信戒	遍 施 眾 生 故 云 四 悉 檀 也 聞 者 至 受 行 即 世 界 信 戒 
X22n0405_001:0246b17	至開發即為人貪恚至氷消即對治隔凡至流水即	至 開 發 即 為 人 貪 恚 至 氷 消 即 對 治 隔 凡 至 流 水 即 
X22n0405_001:0246b18	第一義世界從果歡喜為名為人即生善為稱對治	第 一 義 世 界 從 果 歡 喜 為 名 為 人 即 生 善 為 稱 對 治 
X22n0405_001:0246b19	滅惡第一義入理或三二一者三無第一義二即世	滅 惡 第 一 義 入 理 或 三 二 一 者 三 無 第 一 義 二 即 世 
X22n0405_001:0246b20	界為人益一即唯得世界若得相應是信行人從開	界 為 人 益 一 即 唯 得 世 界 若 得 相 應 是 信 行 人 從 開 
X22n0405_001:0246b21	生解聽習經論問義修行從因至果則樂默然即法	生 解 聽 習 經 論 問 義 修 行 從 因 至 果 則 樂 默 然 即 法 
X22n0405_001:0246b22	行人端坐思惟心融法界隨心證入得果不差即惑	行 人 端 坐 思 惟 心 融 法 界 隨 心 證 入 得 果 不 差 即 惑 
X22n0405_001:0246b23	轉智明不同闇證真實修行不並小外凡邪所求為	轉 智 明 不 同 闇 證 真 實 修 行 不 並 小 外 凡 邪 所 求 為 
X22n0405_001:0246b24	一緣說者為生滅人說生滅諸緣諸法者即無生無	一 緣 說 者 為 生 滅 人 說 生 滅 諸 緣 諸 法 者 即 無 生 無 
X22n0405_001:0246c01	量無作通別圓十二門門門四悉益。	量 無 作 通 別 圓 十 二 門 門 門 四 悉 益 
X22n0405_001:0246c02	釋觀中二先標列經示處次今釋意下結成身智又	釋 觀 中 二 先 標 列 經 示 處 次 今 釋 意 下 結 成 身 智 又 
X22n0405_001:0246c03	二先釋次第次釋一心初文三釋空成報身次釋假	二 先 釋 次 第 次 釋 一 心 初 文 三 釋 空 成 報 身 次 釋 假 
X22n0405_001:0246c04	成應身三釋中成法身知病識藥者用四四辯觀四	成 應 身 三 釋 中 成 法 身 知 病 識 藥 者 用 四 四 辯 觀 四 
X22n0405_001:0246c05	四諦用法義三辯觀四苦集名知病法義二辯觀四	四 諦 用 法 義 三 辯 觀 四 苦 集 名 知 病 法 義 二 辯 觀 四 
X22n0405_001:0246c06	道滅名識藥辭及樂說名應病授藥令得服行是為	道 滅 名 識 藥 辭 及 樂 說 名 應 病 授 藥 令 得 服 行 是 為 
X22n0405_001:0246c07	入假之功用知次第法門用四種法鑒十法界機不	入 假 之 功 用 知 次 第 法 門 用 四 種 法 鑒 十 法 界 機 不 
X22n0405_001:0246c08	過不減機熟則度隨根證理大小俱成界內外法漚	過 不 減 機 熟 則 度 隨 根 證 理 大 小 俱 成 界 內 外 法 漚 
X22n0405_001:0246c09	和照知先空次假後中故名次第即別教義次釋一	和 照 知 先 空 次 假 後 中 故 名 次 第 即 別 教 義 次 釋 一 
X22n0405_001:0246c10	心三觀文為三先釋次引論證三結歎初為三先示	心 三 觀 文 為 三 先 釋 次 引 論 證 三 結 歎 初 為 三 先 示 
X22n0405_001:0246c11	處及釋義次類顯三三觀成身智次中論下引論證	處 及 釋 義 次 類 顯 三 三 觀 成 身 智 次 中 論 下 引 論 證 
X22n0405_001:0246c12	成三此觀微玅下結嘆圓融自在而不一異觀玅攝	成 三 此 觀 微 玅 下 結 嘆 圓 融 自 在 而 不 一 異 觀 玅 攝 
X22n0405_001:0246c13	法相即結成。	法 相 即 結 成 
X22n0405_001:0246c14	釋無量壽中先正釋次結此三身下融會初文三法	釋 無 量 壽 中 先 正 釋 次 結 此 三 身 下 融 會 初 文 三 法 
X22n0405_001:0246c15	喻合法文又二初翻名總釋次法身下別釋初又二	喻 合 法 文 又 二 初 翻 名 總 釋 次 法 身 下 別 釋 初 又 二 
X22n0405_001:0246c16	初翻名次佛本無身下約二諦為機總釋初真諦隨	初 翻 名 次 佛 本 無 身 下 約 二 諦 為 機 總 釋 初 真 諦 隨 
X22n0405_001:0246c17	順世間下俗諦次別釋三身為二先釋次結初為三	順 世 間 下 俗 諦 次 別 釋 三 身 為 二 先 釋 次 結 初 為 三 
X22n0405_001:0246c18	謂法報應法身為二先釋次此即非身之身下結示	謂 法 報 應 法 身 為 二 先 釋 次 此 即 非 身 之 身 下 結 示 
X22n0405_001:0246c19	初又二初釋身壽次釋量次報身亦三釋身壽量次	初 又 二 初 釋 身 壽 次 釋 量 次 報 身 亦 三 釋 身 壽 量 次 
X22n0405_001:0246c20	釋身又三初引二經示相次如如下境智並喻相成	釋 身 又 三 初 引 二 經 示 相 次 如 如 下 境 智 並 喻 相 成 
X22n0405_001:0246c21	三法身非身下簡異結成法壽非壽下釋壽法量非	三 法 身 非 身 下 簡 異 結 成 法 壽 非 壽 下 釋 壽 法 量 非 
X22n0405_001:0246c22	量下釋量應身亦三謂身壽量可知智與體冥下次	量 下 釋 量 應 身 亦 三 謂 身 壽 量 可 知 智 與 體 冥 下 次 
X22n0405_001:0246c23	結三身義智即報身體即法身能起大用即應身如	結 三 身 義 智 即 報 身 體 即 法 身 能 起 大 用 即 應 身 如 
X22n0405_001:0246c24	水銀下喻三身功德和法身下合僧祇及八十者並	水 銀 下 喻 三 身 功 德 和 法 身 下 合 僧 祇 及 八 十 者 並 
X22n0405_001:0247a01	是迹中壽命十九出家三十成道年八十唱入涅槃	是 迹 中 壽 命 十 九 出 家 三 十 成 道 年 八 十 唱 入 涅 槃 
X22n0405_001:0247a02	次然此三身下融會體德。	次 然 此 三 身 下 融 會 體 德 
X22n0405_001:0247a03	釋體中二初通釋次別解初為三法喻合法又二初	釋 體 中 二 初 通 釋 次 別 解 初 為 三 法 喻 合 法 又 二 初 
X22n0405_001:0247a04	明正體次具三德莊嚴次別解者為三先約俗類應	明 正 體 次 具 三 德 莊 嚴 次 別 解 者 為 三 先 約 俗 類 應 
X22n0405_001:0247a05	身次約底義正當法身三約達義當報身。	身 次 約 底 義 正 當 法 身 三 約 達 義 當 報 身 
X22n0405_001:0247a06	釋宗文為二先明古德立義不同次今言下正釋為	釋 宗 文 為 二 先 明 古 德 立 義 不 同 次 今 言 下 正 釋 為 
X22n0405_001:0247a07	三先標列次釋三故以修心下結標又三初立宗體	三 先 標 列 次 釋 三 故 以 修 心 下 結 標 又 三 初 立 宗 體 
X22n0405_001:0247a08	義次明心觀為宗三四種下略列土名以心觀淨即	義 次 明 心 觀 為 宗 三 四 種 下 略 列 土 名 以 心 觀 淨 即 
X22n0405_001:0247a09	因則佛土淨即果由淨心修十六觀得生彼土故以	因 則 佛 土 淨 即 果 由 淨 心 修 十 六 觀 得 生 彼 土 故 以 
X22n0405_001:0247a10	為宗各有淨穢下釋釋中二先略次娑婆惡下廣釋	為 宗 各 有 淨 穢 下 釋 釋 中 二 先 略 次 娑 婆 惡 下 廣 釋 
X22n0405_001:0247a11	凡聖同居者十法界共住六道四聖即十界故曰同	凡 聖 同 居 者 十 法 界 共 住 六 道 四 聖 即 十 界 故 曰 同 
X22n0405_001:0247a12	居四教並有生同居人藏教從初五停至羅漢向人	居 四 教 並 有 生 同 居 人 藏 教 從 初 五 停 至 羅 漢 向 人 
X22n0405_001:0247a13	並生此土通教從初地至六地別教從十信至第六	並 生 此 土 通 教 從 初 地 至 六 地 別 教 從 十 信 至 第 六 
X22n0405_001:0247a14	正心住圓教從第五品下至六信已上並生同居土	正 心 住 圓 教 從 第 五 品 下 至 六 信 已 上 並 生 同 居 土 
X22n0405_001:0247a15	同居穢者此中自分淨穢六道穢四聖淨四聖自分	同 居 穢 者 此 中 自 分 淨 穢 六 道 穢 四 聖 淨 四 聖 自 分 
X22n0405_001:0247a16	淨穢證偏中理為淨無明未除及分在為穢體柝巧	淨 穢 證 偏 中 理 為 淨 無 明 未 除 及 分 在 為 穢 體 柝 巧 
X22n0405_001:0247a17	拙有餘淨穢者析拙藏教心修體巧通教體色明空	拙 有 餘 淨 穢 者 析 拙 藏 教 心 修 體 巧 通 教 體 色 明 空 
X22n0405_001:0247a18	心修並得五分法身皆破見思為淨未斷無明為穢	心 修 並 得 五分法身 皆 破 見 思 為 淨 未 斷 無 明 為 穢 
X22n0405_001:0247a19	次第即別頓入即圓並證理為淨無明分在為穢耳	次 第 即 別 頓 入 即 圓 並 證 理 為 淨 無 明 分 在 為 穢 耳 
X22n0405_001:0247a20	方便有餘土者藏教二人即無學支佛通教四人從	方 便 有 餘 土 者 藏 教 二 人 即 無 學 支 佛 通 教 四 人 從 
X22n0405_001:0247a21	第七地至佛地別教從十信不退位乃至十迴向有	第 七 地 至 佛 地 別 教 從 十 信 不 退 位 乃 至 十 迴 向 有 
X22n0405_001:0247a22	三十四人圓教四人即七八九十信已上並生方便	三 十 四 人 圓 教 四 人 即 七 八 九 十 信 已 上 並 生 方 便 
X22n0405_001:0247a23	土四住惑者三界見為一住欲界思為二住色界思	土 四 住 惑 者 三 界 見 為 一 住 欲 界 思 為 二 住 色 界 思 
X22n0405_001:0247a24	為三往無色界思為四住若約界外破三界無明盡	為 三 往 無 色 界 思 為 四 住 若 約 界 外 破 三 界 無 明 盡 
X22n0405_001:0247b01	為五住惑云色愛無色愛等前二教斷見思盡證偏	為 五 住 惑 云 色 愛 無 色 愛 等 前 二 教 斷 見 思 盡 證 偏 
X22n0405_001:0247b02	真理後二教斷見思塵沙無明惑證圓中理有次第	真 理 後 二 教 斷 見 思 塵 沙 無 明 惑 證 圓 中 理 有 次 第 
X22n0405_001:0247b03	一心之異耳實報土者藏通無人別教有十地等覺	一 心 之 異 耳 實 報 土 者 藏 通 無 人 別 教 有 十 地 等 覺 
X22n0405_001:0247b04	玅覺十二人斷無明證中道圓教四十一位十住乃	玅 覺 十 二 人 斷 無 明 證 中 道 圓 教 四 十 一 位 十 住 乃 
X22n0405_001:0247b05	至等覺斷無明證中道常寂光土者玅覺極地三德	至 等 覺 斷 無 明 證 中 道 常 寂 光 土 者 玅 覺 極 地 三 德 
X22n0405_001:0247b06	究竟三身圓滿智斷二德不生不滅名涅槃純淨佛	究 竟 三 身 圓 滿 智 斷 二 德 不生不滅 名 涅 槃 純 淨 佛 
X22n0405_001:0247b07	土即上品寂光唯佛自住身土無二俱皆四德若中	土 即 上 品 寂 光 唯 佛 自 住 身 土 無 二 俱 皆 四 德 若 中 
X22n0405_001:0247b08	下二品寂光有淨有穢證理智明惑盡理窮智斷具	下 二 品 寂 光 有 淨 有 穢 證 理 智 明 惑 盡 理 窮 智 斷 具 
X22n0405_001:0247b09	足三結中修心玅觀者即十六觀依正二果三輩往	足 三 結 中 修 心 玅 觀 者 即 十 六 觀 依 正 二 果 三 輩 往 
X22n0405_001:0247b10	生能感淨土一一皆具空假中三觀故名為玅其德	生 能 感 淨 土 一 一 皆 具 空 假 中 三 觀 故 名 為 玅 其 德 
X22n0405_001:0247b11	者斷即空觀破四住惑報身成即假觀破塵沙惑應	者 斷 即 空 觀 破 四 住 惑 報 身 成 即 假 觀 破 塵 沙 惑 應 
X22n0405_001:0247b12	身成即中觀破無明惑法身成即三觀成三德因果	身 成 即 中 觀 破 無 明 惑 法 身 成 即 三 觀 成 三 德 因 果 
X22n0405_001:0247b13	滿三惑破三身顯因名三觀果名三德是則因果不	滿 三 惑 破 三 身 顯 因 名 三 觀 果 名 三 德 是 則 因 果 不 
X22n0405_001:0247b14	二融通自在即一而三即三而一非三非一而三而	二 融 通 自 在 即 一 而 三 即 三 而 一 非 三 非 一 而 三 而 
X22n0405_001:0247b15	一玅在其中頌曰空觀如性不可得假觀相合法界	一 玅 在 其 中 頌 曰 空 觀 如 性 不 可 得 假 觀 相 合 法 界 
X22n0405_001:0247b16	邊中觀體等理無二即一而三常宛然其德如是故	邊 中 觀 體 等 理 無 二 即 一 而 三 常 宛 然 其 德 如 是 故 
X22n0405_001:0247b17	名玅觀。	名 玅 觀 
X22n0405_001:0247b18	教相中為四初明部時次明翻譯三明藏攝四簡異	教 相 中 為 四 初 明 部 時 次 明 翻 譯 三 明 藏 攝 四 簡 異 
X22n0405_001:0247b19	初大乘方等教者即第三時生蘇味也對半明滿是	初 大 乘 方 等 教 者 即 第 三 時 生 蘇 味 也 對 半 明 滿 是 
X22n0405_001:0247b20	其教相因此便明五味教相雖非部本意傍知佛出	其 教 相 因 此 便 明 五 味 教 相 雖 非 部 本 意 傍 知 佛 出 
X22n0405_001:0247b21	世施開大綱五味調機用教增減隨根證入冷然自	世 施 開 大 綱 五 味 調 機 用 教 增 減 隨 根 證 入 冷 然 自 
X22n0405_001:0247b22	分(云云)故大經云譬如從牛出乳從乳出酪從酪出生	分 云 云 故 大 經 云 譬 如 從 牛 出 乳 從 乳 出 酪 從 酪 出 生 
