X22n0410_001:0371c05	論曰新疏所立觀佛三昧或八尺或丈六或八萬隨	論 曰 新 疏 所 立 觀 佛 三 昧 或 八 尺 或 丈 六 或 八 萬 隨 
X22n0410_001:0371c06	行者智力淺深宜觀八尺丈六則觀八尺丈六宜觀	行 者 智 力 淺 深 宜 觀 八 尺 丈 六 則 觀 八 尺 丈 六 宜 觀 
X22n0410_001:0371c07	八萬則觀八萬所以經中特立三品正為於此安可	八 萬 則 觀 八 萬 所 以 經 中 特 立 三 品 正 為 於 此 安 可 
X22n0410_001:0371c08	一槩定觀何品又復三昧名通今以觀佛而為三昧	一 槩 定 觀 何 品 又 復 三 昧 名 通 今 以 觀 佛 而 為 三 昧 
X22n0410_001:0371c09	則已揀異其餘三昧那云以何三昧觀何佛身準十	則 已 揀 異 其 餘 三 昧 那 云 以 何 三 昧 觀 何 佛 身 準 十 
X22n0410_001:0371c10	疑論申明厥旨非不明白隱却新疏全文却問如何	疑 論 申 明 厥 旨 非 不 明 白 隱 却 新 疏 全 文 却 問 如 何 
X22n0410_001:0371c11	展用公心何在所引占察經事理二觀難今唯心屬	展 用 公 心 何 在 所 引 占 察 經 事 理 二 觀 難 今 唯 心 屬 
X22n0410_001:0371c12	理者將恐述名失旨試為申之須知占察所示若事	理 者 將 恐 述 名 失 旨 試 為 申 之 須 知 占 察 所 示 若 事 
X22n0410_001:0371c13	若理並據修觀以說直達法界者名之為理起心推	若 理 並 據 修 觀 以 說 直 達 法 界 者 名 之 為 理 起 心 推 
X22n0410_001:0371c14	撿者名之為事事理雖殊無非修觀但約創心發足	撿 者 名 之 為 事 事 理 雖 殊 無 非 修 觀 但 約 創 心 發 足 
X22n0410_001:0371c15	以分二別新疏則不然乃是通論一切事理不專在	以 分 二 別 新 疏 則 不 然 乃 是 通 論 一 切 事 理 不 專 在 
X22n0410_001:0371c16	觀且如十六觀境無非彼土依正之相不徧事理但	觀 且 如 十 六 觀 境 無 非 彼 土 依 正 之 相 不 徧 事 理 但 
X22n0410_001:0371c17	隨行者觀之有異利根了境唯心則一切皆理鈍根	隨 行 者 觀 之 有 異 利 根 了 境 唯 心 則 一 切 皆 理 鈍 根 
X22n0410_001:0371c18	迷心為境則一切皆事此就心境迷了以分事理若	迷 心 為 境 則 一 切 皆 事 此 就 心 境 迷 了 以 分 事 理 若 
X22n0410_001:0371c19	以今疏對彼占察是則今之唯識自可通收彼經二	以 今 疏 對 彼 占 察 是 則 今 之 唯 識 自 可 通 收 彼 經 二 
X22n0410_001:0371c20	觀南山事抄懺篇論修唯識亦約投心而分兩異新	觀 南 山 事 抄 懺 篇 論 修 唯 識 亦 約 投 心 而 分 兩 異 新 
X22n0410_001:0371c21	疏於資持記委引占察經文示其修相非不知之隨	疏 於 資 持 記 委 引 占 察 經 文 示 其 修 相 非 不 知 之 隨 
X22n0410_001:0371c22	文用與豈可雷同況心識之名通事理經論盛談那	文 用 與 豈 可 雷 同 況 心 識 之 名 通 事 理 經 論 盛 談 那 
X22n0410_001:0371c23	見占察乍分二觀例判屬事耶若曉新疏所立反觀	見 占 察 乍 分 二 觀 例 判 屬 事 耶 若 曉 新 疏 所 立 反 觀 
X22n0410_001:0371c24	輔正之難大無交涉。	輔 正 之 難 大 無 交 涉 
X22n0410_001:0372a01	新疏云準知觀佛功德難量乃是却惡之前陣入	新 疏 云 準 知 觀 佛 功 德 難 量 乃 是 却 惡 之 前 陣 入 
X22n0410_001:0372a02	道之初門。	道 之 初 門 
X22n0410_001:0372a03	輔正曰新疏自云圓頓上乘成佛之法是心是佛	輔 正 曰 新 疏 自 云 圓 頓 上 乘 成 佛 之 法 是 心 是 佛 
X22n0410_001:0372a04	出自今經韋提一聞即破無明得無生忍若將了	出 自 今 經 韋 提 一 聞 即 破 無 明 得無生忍 若 將 了 
X22n0410_001:0372a05	義中了義之法以為前陣初門更以何為究竟法	義 中 了 義 之 法 以 為 前 陣 初 門 更 以 何 為 究 竟 法 
X22n0410_001:0372a06	耶。	耶 
X22n0410_001:0372a07	論曰新疏特彰觀佛三昧功德超勝更無過上獨推	論 曰 新 疏 特 彰 觀 佛 三 昧 功 德 超 勝 更 無 過 上 獨 推 
X22n0410_001:0372a08	第一是故謂之前陣初門即此便是究竟之法非謂	第 一 是 故 謂 之 前 陣 初 門 即 此 便 是 究 竟 之 法 非 謂 
X22n0410_001:0372a09	別有究竟法也請考新疏連引諸經觀佛為證方見	別 有 究 竟 法 也 請 考 新 疏 連 引 諸 經 觀 佛 為 證 方 見 
X22n0410_001:0372a10	指歸不究文意率爾形言蓋緣此語偶同天台戒疏	指 歸 不 究 文 意 率 爾 形 言 蓋 緣 此 語 偶 同 天 台 戒 疏 
X22n0410_001:0372a11	彼以三學迭論功用戒但止惡防非故曰運善之初	彼 以 三 學 迭 論 功 用 戒 但 止 惡 防 非 故 曰 運 善 之 初 
X22n0410_001:0372a12	章却惡之前陣定慧方能破惑顯理始為究竟料想	章 却 惡 之 前 陣 定 慧 方 能 破 惑 顯 理 始 為 究 竟 料 想 
X22n0410_001:0372a13	輔正錯認彼文故作是說。	輔 正 錯 認 彼 文 故 作 是 說 
X22n0410_001:0372a14	新疏云嘗考經文但出所觀之境不分事理之殊	新 疏 云 嘗 考 經 文 但 出 所 觀 之 境 不 分 事 理 之 殊 
X22n0410_001:0372a15	得非能觀之人根有利鈍而趣入乎。	得 非 能 觀 之 人 根 有 利 鈍 而 趣 入 乎 
X22n0410_001:0372a16	輔正曰自語相違也下自釋經是心作佛是心是	輔 正 曰 自語相違 也 下 自 釋 經 是 心 作 佛 是 心 是 
X22n0410_001:0372a17	佛云心者即是行者觀佛之心由觀佛相相現心	佛 云 心 者 即 是 行 者 觀 佛 之 心 由 觀 佛 相 相 現 心 
X22n0410_001:0372a18	中乃至云恐謂修成佛從外得只由此心當體是	中 乃 至 云 恐 謂 修 成 佛 從 外 得 只 由 此 心 當 體 是 
X22n0410_001:0372a19	佛故云是心是佛如此釋者為理為事為非理事	佛 故 云 是 心 是 佛 如 此 釋 者 為 理 為 事 為 非 理 事 
X22n0410_001:0372a20	若云事者理者上文自云不分事理何觀所收況	若 云 事 者 理 者 上 文 自 云 不 分 事 理 何 觀 所 收 況 
X22n0410_001:0372a21	自釋云當體是佛豈非理觀耶日觀已下擊心事	自 釋 云 當 體 是 佛 豈 非 理 觀 耶 日 觀 已 下 擊 心 事 
X22n0410_001:0372a22	境豈非事觀耶況韋提希請教我思惟正受並屬	境 豈 非 事 觀 耶 況 韋 提 希 請 教 我 思 惟 正 受 並 屬 
X22n0410_001:0372a23	能觀豈但只說一境更無所歸乎。	能 觀 豈 但 只 說 一 境 更 無 所 歸 乎 
X22n0410_001:0372a24	論曰輔正恅愺不觀上下文勢來歷摘掇一言半句	論 曰 輔 正 恅 愺 不 觀 上 下 文 勢 來 歷 摘 掇 一 言 半 句 
X22n0410_001:0372b01	以為難者實不可也蓋緣古今諸師將十六觀判釋	以 為 難 者 實 不 可 也 蓋 緣 古 今 諸 師 將 十 六 觀 判 釋 
X22n0410_001:0372b02	有偏一云十六妙境無非理觀一云據經始末皆是	有 偏 一 云 十 六 妙 境 無 非 理 觀 一 云 據 經 始 末 皆 是 
X22n0410_001:0372b03	事相一云前後十五是事第九佛觀為理故總責云	事 相 一 云 前 後 十 五 是 事 第 九 佛 觀 為 理 故 總 責 云 
X22n0410_001:0372b04	初釋遺於中下次解抑彼上根後說兩分尤非通論	初 釋 遺 於 中 下 次 解 抑 彼 上 根 後 說 兩 分 尤 非 通 論 
X22n0410_001:0372b05	故有今文之來意謂一經始末所談觀境不可偏判	故 有 今 文 之 來 意 謂 一 經 始 末 所 談 觀 境 不 可 偏 判 
X22n0410_001:0372b06	唯在造修行者利鈍如何利根則境境皆理鈍根則	唯 在 造 修 行 者 利 鈍 如 何 利 根 則 境 境 皆 理 鈍 根 則 
X22n0410_001:0372b07	境境皆事此乃新疏定境立觀能所兩分隨人趣入	境 境 皆 事 此 乃 新 疏 定 境 立 觀 能 所 兩 分 隨 人 趣 入 
X22n0410_001:0372b08	事理無偏輔正却將能觀之觀而難所觀之境反問	事 理 無 偏 輔 正 却 將 能 觀 之 觀 而 難 所 觀 之 境 反 問 
X22n0410_001:0372b09	為理為事為非事理予雖執筆強為分疎不覺絕倒。	為 理 為 事 為 非 事 理 予 雖 執 筆 強 為 分 疎 不 覺 絕 倒 
X22n0410_001:0372b10	新疏云是知世出世法莫非玅理如法華云觀一	新 疏 云 是 知 世 出 世 法 莫 非 玅 理 如 法 華 云 觀 一 
X22n0410_001:0372b11	切法空如實相又云一切諸法皆無所有金剛般	切 法 空 如 實 相 又 云 一切諸法 皆 無 所 有 金 剛 般 
X22n0410_001:0372b12	若云一切有為法如夢幻泡影普賢觀云一切諸	若 云 一 切 有 為 法 如 夢 幻 泡 影 普 賢 觀 云 一 切 諸 
X22n0410_001:0372b13	法即是佛法淨名云一切諸法即菩提相華嚴云	法 即 是 佛 法 淨 名 云 一切諸法 即 菩 提 相 華 嚴 云 
X22n0410_001:0372b14	一切法無生無滅又云了知一切法自性無所有	一 切 法 無生無滅 又 云 了 知一切法 自 性 無 所 有 
X22n0410_001:0372b15	等若離諸法而談玅理即墮偏邪。	等 若 離 諸 法 而 談 玅 理 即 墮 偏 邪 
X22n0410_001:0372b16	輔正曰引此七文證於不離諸法而談玅理且普	輔 正 曰 引 此 七 文 證 於 不 離 諸 法 而 談 玅 理 且 普 
X22n0410_001:0372b17	賢觀及華嚴初文淨名文此三文義容不離諸法	賢 觀 及 華 嚴 初 文 淨 名 文 此 三 文 義 容 不 離 諸 法 
X22n0410_001:0372b18	其餘四文如引法華觀一切法空者既為引證不	其 餘 四 文 如 引 法 華 觀 一切法空 者 既 為 引 證 不 
X22n0410_001:0372b19	離諸法如何云空然後如實相又引一切諸法皆	離 諸 法 如 何 云 空 然 後 如 實 相 又 引 一切諸法 皆 
X22n0410_001:0372b20	無所有者亦乃離一切有故云皆無豈是不離諸	無 所 有 者 亦 乃 離 一 切 有 故 云 皆 無 豈 是 不 離 諸 
X22n0410_001:0372b21	法又引華嚴了知一切法自性無所有者亦無其	法 又 引 華 嚴 了 知一切法 自 性 無 所 有 者 亦 無 其 
X22n0410_001:0372b22	有方見舍那金剛般若之文則是體性本空皆不	有 方 見 舍 那 金 剛 般 若 之 文 則 是 體 性 本 空 皆 不 
X22n0410_001:0372b23	可得此之四文皆言一切諸法空無所有方是玅	可 得 此 之 四 文 皆 言 一切諸法 空無所有 方 是 玅 
X22n0410_001:0372b24	理那云不離諸法而談玅理耶。	理 那 云 不 離 諸 法 而 談 玅 理 耶 
X22n0410_001:0372c01	論曰新疏為恐末世行者離却世間緣生之法別求	論 曰 新 疏 為 恐 末 世 行 者 離 却 世 間 緣 生 之 法 別 求 
X22n0410_001:0372c02	玅理成斷滅見特引七文為令生信莫非即事顯理	玅 理 成 斷 滅 見 特 引 七 文 為 令 生 信 莫 非 即 事 顯 理 
X22n0410_001:0372c03	達妄全真一切大乘義歸一揆而輔正但許三文乃	達 妄 全 真 一切大乘 義 歸 一 揆 而 輔 正 但 許 三 文 乃 
X22n0410_001:0372c04	謂其餘四文自是諸法皆空全無所有義當於離那	謂 其 餘 四 文 自 是 諸法皆空 全 無 所 有 義 當 於 離 那 
X22n0410_001:0372c05	云不離今謂輔正學天台道如何作此見解且如四	云 不 離 今 謂 輔 正 學 天 台 道 如 何 作 此 見 解 且 如 四 
X22n0410_001:0372c06	文所談一切法空非同大虗空無一物此乃第一義	文 所 談 一切法空 非 同 大 虗 空 無 一 物 此 乃 第 一 義 
X22n0410_001:0372c07	空法法宛爾真空不空玅有不有將何以為空有之	空 法 法 宛 爾 真 空 不 空 玅 有 不 有 將 何 以 為 空 有 之 
X22n0410_001:0372c08	定論乎若如輔正之說恰似小乘偏空又似外道斷	定 論 乎 若 如 輔 正 之 說 恰 似 小 乘 偏 空 又 似 外 道 斷 
X22n0410_001:0372c09	見不知其意如何也。	見 不 知 其 意 如 何 也 
X22n0410_001:0372c10	新疏云一代時教所明觀法略為五例一總觀諸	新 疏 云 一 代 時 教 所 明 觀 法 略 為 五 例 一 總 觀 諸 
X22n0410_001:0372c11	法如經云觀一切法空二別觀自心如止觀還源	法 如 經 云 觀 一切法空 二 別 觀 自 心 如 止 觀 還 源 
X22n0410_001:0372c12	等三者或但觀色如經云觀身實相觀佛亦然等	等 三 者 或 但 觀 色 如 經 云 觀 身 實 相 觀 佛 亦 然 等 
X22n0410_001:0372c13	四兼觀色心如經云照見五蘊皆空等五觀勝境	四 兼 觀 色 心 如 經 云 照 見 五 蘊 皆 空 等 五 觀 勝 境 
X22n0410_001:0372c14	即如諸經觀佛菩薩等。	即 如 諸 經 觀 佛 菩 薩 等 
X22n0410_001:0372c15	輔正曰一云總觀諸法者今問用觀之時為觀何	輔 正 曰 一 云 總 觀 諸 法 者 今 問 用 觀 之 時 為 觀 何 
X22n0410_001:0372c16	法為觀一法為觀諸法為一諸並觀為觀諸為一	法 為 觀 一 法 為 觀 諸 法 為 一 諸 並 觀 為 觀 諸 為 一 
X22n0410_001:0372c17	若觀一法者為屬色耶心耶心與第二義同色與	若 觀 一 法 者 為 屬 色 耶 心 耶 心 與 第 二 義 同 色 與 
X22n0410_001:0372c18	第三義同若觀諸法者諸法無量樊然淆亂行者	第 三 義 同 若 觀 諸 法 者 諸 法 無 量 樊 然 淆 亂 行 者 
X22n0410_001:0372c19	如何用心等乃至云由此推之全無指歸也。	如 何 用 心 等 乃 至 云 由 此 推 之 全 無 指 歸 也 
X22n0410_001:0372c20	論曰新疏所明觀法乃是通括一代大乘所詮行相	論 曰 新 疏 所 明 觀 法 乃 是 通 括 一 代 大 乘 所 詮 行 相 
X22n0410_001:0372c21	五例收之罄無不盡意欲揀辯今經屬第五例使無	五 例 收 之 罄 無 不 盡 意 欲 揀 辯 今 經 屬 第 五 例 使 無 
X22n0410_001:0372c22	混濫此且示其名相而已未是的論修觀及至行者	混 濫 此 且 示 其 名 相 而 已 未 是 的 論 修 觀 及 至 行 者 
X22n0410_001:0372c23	造修或請問良師或披尋聖教自當開解那將正修	造 修 或 請 問 良 師 或 披 尋 聖 教 自 當 開 解 那 將 正 修 
X22n0410_001:0372c24	觀法難今能攝名言果如所難反見輔正心境淆亂	觀 法 難 今 能 攝 名 言 果 如 所 難 反 見 輔 正 心 境 淆 亂 
X22n0410_001:0373a01	全無指歸不在新疏也。	全 無 指 歸 不 在 新 疏 也 
X22n0410_001:0373a02	新疏云問今十六觀可名觀心否答若乃達境唯	新 疏 云 問 今 十 六 觀 可 名 觀 心 否 答 若 乃 達 境 唯 
X22n0410_001:0373a03	心則彌陀身土孰非心乎但恐反求本陰局認點	心 則 彌 陀 身 土 孰 非 心 乎 但 恐 反 求 本 陰 局 認 點 
X22n0410_001:0373a04	靈則盡屬他經非今正觀也。	靈 則 盡 屬 他 經 非 今 正 觀 也 
X22n0410_001:0373a05	輔正曰所云反求本陰局認點靈屬他經者他經	輔 正 曰 所 云 反 求 本 陰 局 認 點 靈 屬 他 經 者 他 經 
X22n0410_001:0373a06	何嘗局認耶華嚴云游心法界如虗空又云一切	何 嘗 局 認 耶 華 嚴 云 游 心 法 界 如 虗 空 又 云 一 切 
X22n0410_001:0373a07	世間莫不由心楞嚴云心徧十方又云玅明元心	世 間 莫 不 由 心 楞 嚴 云 心 徧 十 方 又 云 玅 明 元 心 
X22n0410_001:0373a08	心精徧圓含裹十方此等經文豈是局點靈耶此	心 精 徧 圓 含 裹 十 方 此 等 經 文 豈 是 局 點 靈 耶 此 
X22n0410_001:0373a09	經亦云是心作佛是心佛正與他經談心體徧無	經 亦 云 是 心 作 佛 是 心 佛 正 與 他 經 談 心 體 徧 無 
X22n0410_001:0373a10	二無別何以優觀經而劣大藏。	二 無 別 何 以 優 觀 經 而 劣 大 藏 
X22n0410_001:0373a11	論曰新疏既立觀佛為宗特彰問答會同觀心兩無	論 曰 新 疏 既 立 觀 佛 為 宗 特 彰 問 答 會 同 觀 心 兩 無 
X22n0410_001:0373a12	妨礙但今觀心與他經不同他經乃是此土入道之	妨 礙 但 今 觀 心 與 他 經 不 同 他 經 乃 是 此 土 入 道 之 
X22n0410_001:0373a13	觀不取外境復揀餘陰界入等法唯觀自己一念妄	觀 不 取 外 境 復 揀 餘 陰 界 入 等 法 唯 觀 自 己 一 念 妄 
X22n0410_001:0373a14	心豈非局認點靈耶此是新疏的示行者投心發足	心 豈 非 局 認 點 靈 耶 此 是 新 疏 的 示 行 者 投 心 發 足 
X22n0410_001:0373a15	之處用觀入理之門最為緊要輔正考文不細却乃	之 處 用 觀 入 理 之 門 最 為 緊 要 輔 正 考 文 不 細 却 乃 
X22n0410_001:0373a16	連引諸文而見斥奪當知所引諸文若非談本來平	連 引 諸 文 而 見 斥 奪 當 知 所 引 諸 文 若 非 談 本 來 平 
X22n0410_001:0373a17	等心體即是示觀成理顯之相何關新疏所立之義	等 心 體 即 是 示 觀 成 理 顯 之 相 何 關 新 疏 所 立 之 義 
X22n0410_001:0373a18	乎況引本經心作心是會同諸經一往則是二往則	乎 況 引 本 經 心 作 心 是 會 同 諸 經 一 往 則 是 二 往 則 
X22n0410_001:0373a19	非學者討論自見臧否。	非 學 者 討 論 自 見 臧 否 
X22n0410_001:0373a20	新疏云一者自心三昧佛二者西方從因感果佛	新 疏 云 一 者 自 心 三 昧 佛 二 者 西 方 從 因 感 果 佛 
X22n0410_001:0373a21	諸經觀心則觀自心所見佛今經正觀西方從因	諸 經 觀 心 則 觀 自 心 所 見 佛 今 經 正 觀 西 方 從 因 
X22n0410_001:0373a22	感果佛等(云云)。	感 果 佛 等 云 云 
X22n0410_001:0373a23	輔正曰此經自云是心作佛是心是佛那云此經	輔 正 曰 此 經 自 云 是 心 作 佛 是 心 是 佛 那 云 此 經 
X22n0410_001:0373a24	觀從因感果佛不準佛言閉眼釋義。	觀 從 因 感 果 佛 不 準 佛 言 閉 眼 釋 義 
X22n0410_001:0373b01	論曰新疏所引古德二佛出自輔行彼文續云今具	論 曰 新 疏 所 引 古 德 二 佛 出 自 輔 行 彼 文 續 云 今 具 
X22n0410_001:0373b02	二義共為一境然此二佛約理須即約事須分其實	二 義 共 為 一 境 然 此 二 佛 約 理 須 即 約 事 須 分 其 實 
X22n0410_001:0373b03	不二但今新疏為順經宗須觀彼佛故引古德二佛	不 二 但 今 新 疏 為 順 經 宗 須 觀 彼 佛 故 引 古 德 二 佛 
X22n0410_001:0373b04	區以別矣庶使行者投心有托及乎三昧成時了知	區 以 別 矣 庶 使 行 者 投 心 有 托 及 乎 三 昧 成 時 了 知 
X22n0410_001:0373b05	佛非心外即心見佛故見佛時名見自心若見自心	佛 非 心 外 即 心 見 佛 故 見 佛 時 名 見 自 心 若 見 自 心 
X22n0410_001:0373b06	即見佛心當爾之時始可與言是心作佛是心是佛	即 見 佛 心 當 爾 之 時 始 可 與 言 是 心 作 佛 是 心 是 佛 
X22n0410_001:0373b07	矣新疏云建立纖毫不差所謂不準佛言閉眼釋義	矣 新 疏 云 建 立 纖 毫 不 差 所 謂 不 準 佛 言 閉 眼 釋 義 
X22n0410_001:0373b08	誣人之罪以罪加之。	誣 人 之 罪 以 罪 加 之 
X22n0410_001:0373b09	新疏云一者法性土二者應化土於應化中分三	新 疏 云 一 者 法 性 土 二 者 應 化 土 於 應 化 中 分 三 
X22n0410_001:0373b10	謂實報土方便土同居土又云空生大覺中即法	謂 實 報 土 方 便 土 同 居 土 又 云 空 生 大 覺 中 即 法 
X22n0410_001:0373b11	性土有漏微塵國即應化土。	性 土 有 漏 微 塵 國 即 應 化 土 
X22n0410_001:0373b12	輔正曰此之一文略有二失一者與自引智論相	輔 正 曰 此 之 一 文 略 有 二 失 一 者 與 自 引 智 論 相 
X22n0410_001:0373b13	違既於方便土中引論云聲聞緣覺出生其中受	違 既 於 方 便 土 中 引 論 云 聲 聞 緣 覺 出 生 其 中 受 
X22n0410_001:0373b14	法性身豈法性身居微塵土耶二者改易舊說天	法 性 身 豈 法 性 身 居 微 塵 土 耶 二 者 改 易 舊 說 天 
X22n0410_001:0373b15	台疏中既明四土與新疏所說無異何故沒却舊	台 疏 中 既 明 四 土 與 新 疏 所 說 無 異 何 故 沒 却 舊 
X22n0410_001:0373b16	名仍不顯用其義但作法性應化二土明之然後	名 仍 不 顯 用 其 義 但 作 法 性 應 化 二 土 明 之 然 後 
X22n0410_001:0373b17	開出四土且新疏既用戒疏四身何不顯用四土	開 出 四 土 且 新 疏 既 用 戒 疏 四 身 何 不 顯 用 四 土 
X22n0410_001:0373b18	等。	等 
X22n0410_001:0373b19	論曰古今章疏引文用義出沒取舍其例非一但與	論 曰 古 今 章 疏 引 文 用 義 出 沒 取 舍 其 例 非 一 但 與 
X22n0410_001:0373b20	文會則引用之適時之巧無可不可豈專一隅新疏	文 會 則 引 用 之 適 時 之 巧 無 可 不 可 豈 專 一 隅 新 疏 
X22n0410_001:0373b21	明用天台四身者葢緣戒疏四身之文與經泯合故	明 用 天 台 四 身 者 葢 緣 戒 疏 四 身 之 文 與 經 泯 合 故 
X22n0410_001:0373b22	得用之疏引經云諸佛如來法界身即法報也六十	得 用 之 疏 引 經 云 諸佛如來 法 界 身 即 法 報 也 六 十 
X22n0410_001:0373b23	萬億應身也或現大身丈六八尺乃至鳧鴈鴛鴦等	萬 億 應 身 也 或 現 大 身 丈 六 八 尺 乃 至 鳧 鴈 鴛 鴦 等 
X22n0410_001:0373b24	化身也以由名義相當更改作次明土中只緣戒疏	化 身 也 以 由 名 義 相 當 更 改 作 次 明 土 中 只 緣 戒 疏 
X22n0410_001:0373c01	無文所以不用輔正乃云戒疏既明四土新疏何故	無 文 所 以 不 用 輔 正 乃 云 戒 疏 既 明 四 土 新 疏 何 故 
X22n0410_001:0373c02	沒却舊名等者今問戒疏何處有文明說四土撿尋	沒 却 舊 名 等 者 今 問 戒 疏 何 處 有 文 明 說 四 土 撿 尋 
X22n0410_001:0373c03	不細反更瞞人吁可恠也良由諸經明土難可具陳	不 細 反 更 瞞 人 吁 可 恠 也 良 由 諸 經 明 土 難 可 具 陳 
X22n0410_001:0373c04	遂舉其要收束法相令義易見故作法性應化二土	遂 舉 其 要 收 束 法 相 令 義 易 見 故 作 法 性 應 化 二 土 
X22n0410_001:0373c05	明之除法性外一切塵剎皆應化收然作此說非無	明 之 除 法 性 外 一 切 塵 剎 皆 應 化 收 然 作 此 說 非 無 
X22n0410_001:0373c06	典據即引首楞嚴云空生大覺中如海一漚發有漏	典 據 即 引 首 楞 嚴 云 空 生 大 覺 中 如 海 一 漚 發 有 漏 
X22n0410_001:0373c07	微塵國皆依空所生疏自釋云大覺即法性土也微	微 塵 國 皆 依 空 所 生 疏 自 釋 云 大 覺 即 法 性 土 也 微 
X22n0410_001:0373c08	塵國即應化土也所謂出沒取舍適時之巧義見於	塵 國 即 應 化 土 也 所 謂 出 沒 取 舍 適 時 之 巧 義 見 於 
X22n0410_001:0373c09	斯新疏雖則一期建立亦有所法如天台淨名疏有	斯 新 疏 雖 則 一 期 建 立 亦 有 所 法 如 天 台 淨 名 疏 有 
X22n0410_001:0373c10	總明佛國別明佛國二科於總明中云國有事理事	總 明 佛 國 別 明 佛 國 二 科 於 總 明 中 云 國 有 事 理 事 
X22n0410_001:0373c11	即應身之域理即極智所照之境但以隨機應物說	即 應 身 之 域 理 即 極 智 所 照 之 境 但 以 隨 機 應 物 說 
X22n0410_001:0373c12	有真應故明理事乃至云垂迹故有應形應土顯本	有 真 應 故 明 理 事 乃 至 云 垂 迹 故 有 應 形 應 土 顯 本 
X22n0410_001:0373c13	故有法身真國次別明中方開四土文云諸佛利物	故 有 法 身 真 國 次 別 明 中 方 開 四 土 文 云 諸 佛 利 物 
X22n0410_001:0373c14	差別之相無量無邊今略為四一染淨國二有餘國	差別之相 無量無邊 今 略 為 四 一 染 淨 國 二 有 餘 國 
X22n0410_001:0373c15	三果報國四常寂光當知新疏初約法性應化一往	三 果 報 國 四 常 寂 光 當 知 新 疏 初 約 法 性 應 化 一 往 
X22n0410_001:0373c16	以分則與天台總明義同於應化中復分諸土則與	以 分 則 與 天 台 總 明 義 同 於 應 化 中 復 分 諸 土 則 與 
X22n0410_001:0373c17	天台別明義同天台既有等規矩何不審思而輒破	天 台 別 明 義 同 天 台 既 有 等 規 矩 何 不 審 思 而 輒 破 
X22n0410_001:0373c18	斥所言與智論相違者此非新疏相違乃是輔正之	斥 所 言 與 智 論 相 違 者 此 非 新 疏 相 違 乃 是 輔 正 之 
X22n0410_001:0373c19	失也須知聲聞緣覺雖居界外法性身土無明未破	失 也 須 知 聲 聞 緣 覺 雖 居 界 外 法 性 身 土 無 明 未 破 
X22n0410_001:0373c20	法性未圓盡屬變易生死方便有餘所收若望究竟	法 性 未 圓 盡 屬 變易生死 方 便 有 餘 所 收 若 望 究 竟 
X22n0410_001:0373c21	法性理土安得不是微塵土耶微塵乃喻其多也輔	法 性 理 土 安 得 不 是 微 塵 土 耶 微 塵 乃 喻 其 多 也 輔 
X22n0410_001:0373c22	正不察見有微塵之言將同世間穢惡境界便謂豈	正 不 察 見 有 微 塵 之 言 將 同 世 間 穢 惡 境 界 便 謂 豈 
X22n0410_001:0373c23	法性身居微塵土一何造次。	法 性 身 居 微 塵 土 一 何 造 次 
X22n0410_001:0373c24	新疏云韋提請云教我思惟教我正受古疏以三	新 疏 云 韋 提 請 云 教 我 思 惟 教 我 正 受 古 疏 以 三 
X22n0410_001:0374a01	福答思惟十六觀答正受善導云諸師將三福合	福 答 思 惟 十 六 觀 答 正 受 善 導 云 諸 師 將 三 福 合 
X22n0410_001:0374a02	思惟十六觀合正受今謂不然華嚴云說思惟正	思 惟 十 六 觀 合 正 受 今 謂 不 然 華 嚴 云 說 思 惟 正 
X22n0410_001:0374a03	受是三昧異名即知思惟正受只是請觀。	受 是 三 昧 異 名 即 知 思 惟 正 受 只 是 請 觀 
X22n0410_001:0374a04	輔正曰韋提既請思惟正受佛以福觀答之此蓋	輔 正 曰 韋 提 既 請 思 惟 正 受 佛 以 福 觀 答 之 此 蓋 
X22n0410_001:0374a05	關節相當文無盈縮縱華嚴有異名之說在彼譯	關 節 相 當 文 無 盈 縮 縱 華 嚴 有 異 名 之 說 在 彼 譯 
X22n0410_001:0374a06	人用意何關此經釋經固有引他部者經義若顯	人 用 意 何 關 此 經 釋 經 固 有 引 他 部 者 經 義 若 顯 
X22n0410_001:0374a07	何用相關今以一義例之如攝大乘論有梁唐二	何 用 相 關 今 以 一 義 例 之 如 攝 大 乘 論 有 梁 唐 二 
