X25n0483_001:0171b19	來。而實無不來。是名阿那含。	來 而 實 無 不 來 是 名 阿 那 含 
X25n0483_001:0171b20	斷下五結。得阿那含果。見思惑斷永脫苦輪。入於	斷 下 五 結 得 阿那含果 見 思 惑 斷 永 脫 苦 輪 入 於 
X25n0483_001:0171b21	涅槃。名為不來者。不來欲界受生也。而實無不來	涅 槃 名 為 不 來 者 不 來 欲 界 受 生 也 而 實 無 不 來 
X25n0483_001:0171b22	者。心無所得而不著不來之相也。	者 心 無 所 得 而 不 著 不 來 之 相 也 
X25n0483_001:0171b23	須菩提。於意云何。阿羅漢能作是念。我得阿羅漢道	須 菩 提 於意云何 阿 羅 漢 能 作 是 念 我 得阿羅漢 道 
X25n0483_001:0171b24	不(音否)須菩提言。不(音弗)也。世尊。何以故。實無有法名阿	不 音 否 須 菩 提 言 不 音 弗 也 世 尊 何 以 故 實 無 有 法 名 阿 
X25n0483_001:0171c01	羅漢。世尊。若阿羅漢作是念。我得阿羅漢道。即為著	羅 漢 世 尊 若 阿 羅 漢 作 是 念 我 得阿羅漢 道 即 為 著 
X25n0483_001:0171c02	我人眾生壽者。	我 人 眾 生 壽 者 
X25n0483_001:0171c03	阿羅漢果者。永斷貪欲．瞋恚．愚痴．無餘煩惱．生滅。	阿羅漢果 者 永 斷 貪 欲 瞋 恚 愚 痴 無 餘 煩 惱 生 滅 
X25n0483_001:0171c04	以盡淨行。以立於法無染。不來三界受生矣。阿羅	以 盡 淨 行 以 立 於 法 無 染 不 來 三 界 受 生 矣 阿 羅 
X25n0483_001:0171c05	漢者。悟諸法空。若作得道之念。有所得心未除。即	漢 者 悟 諸 法 空 若 作 得 道 之 念 有所得心 未 除 即 
X25n0483_001:0171c06	著四相矣。	著 四 相 矣 
X25n0483_001:0171c07	世尊。佛說我得無諍三昧。人中最為第一。是第一離	世 尊 佛 說 我 得 無諍三昧 人 中 最 為 第 一 是 第 一 離 
X25n0483_001:0171c08	欲阿羅漢。世尊。我不作是念。我是離欲阿羅漢。世尊。	欲 阿 羅 漢 世 尊 我 不 作 是 念 我 是 離 欲 阿 羅 漢 世 尊 
X25n0483_001:0171c09	我若作是念。我得阿羅漢道。世尊即不說須菩提是	我 若 作 是 念 我 得阿羅漢 道 世 尊 即 不 說 須 菩 提 是 
X25n0483_001:0171c10	樂阿蘭那行者。以須菩提實無所行。而名須菩提是	樂 阿 蘭 那 行 者 以 須 菩 提 實 無 所 行 而 名 須 菩 提 是 
X25n0483_001:0171c11	樂阿蘭那行。	樂 阿 蘭 那 行 
X25n0483_001:0171c12	無諍者。隨順無違也。三昧。梵語。此云正受。心不受	無 諍 者 隨 順 無 違 也 三 昧 梵 語 此 云 正 受 心 不 受 
X25n0483_001:0171c13	一法是也。阿蘭那者。梵語。此云即無諍也。須菩提	一 法 是 也 阿 蘭 那 者 梵 語 此 云 即 無 諍 也 須 菩 提 
X25n0483_001:0171c14	離三界。欲證四果法得無諍三昧。體悟真空。乃人	離 三 界 欲 證 四 果 法 得 無諍三昧 體 悟 真 空 乃 人 
X25n0483_001:0171c15	中最為第一者。雖然證此四果位。而心不作是念。	中 最 為 第 一 者 雖 然 證 此 四 果 位 而 心 不 作 是 念 
X25n0483_001:0171c16	若心作此證果之念。則與道相違。佛即不說須菩	若 心 作 此 證 果 之 念 則 與 道 相 違 佛 即 不 說 須 菩 
X25n0483_001:0171c17	提是行無諍之行也。實無所行者。悟心無得。雖云	提 是 行 無 諍 之 行 也 實 無 所 行 者 悟 心 無 得 雖 云 
X25n0483_001:0171c18	無諍之行。亦是虗名耳。	無 諍 之 行 亦 是 虗 名 耳 
X25n0483_001:0171c19	○莊嚴淨土分第十	 莊 嚴 淨 土 分 第 十 
X25n0483_001:0171c20	佛告須菩提。於意云何。如來昔在然燈佛所。於法有	佛 告 須 菩 提 於意云何 如 來 昔 在 然 燈 佛 所 於 法 有 
X25n0483_001:0171c21	所得不。不也。世尊。如來在然燈佛所。於法實無所得。	所 得 不 不 也 世 尊 如 來 在 然 燈 佛 所 於 法 實 無 所 得 
X25n0483_001:0171c22	如來者。佛自稱也。然燈佛者。即是釋迦牟尼佛之	如 來 者 佛 自 稱 也 然 燈 佛 者 即 是 釋 迦 牟 尼 佛 之 
X25n0483_001:0171c23	師也。法由心悟。豈從外得以心印。心是名為得也。	師 也 法 由 心 悟 豈 從 外 得 以 心 印 心 是 名 為 得 也 
X25n0483_001:0171c24	須菩提。於意云何。菩薩莊嚴佛土(音度)不(音否)不(音弗)也。世	須 菩 提 於意云何 菩 薩 莊 嚴 佛 土 音 度 不 音 否 不 音 弗 也 世 
X25n0483_001:0172a01	尊。何以故。莊嚴佛土(音度)者。即非莊嚴。是名莊嚴。	尊 何 以 故 莊 嚴 佛 土 音 度 者 即 非 莊 嚴 是 名 莊 嚴 
X25n0483_001:0172a02	菩薩莊嚴者。菩薩六度萬行以為莊嚴。佛土者。心	菩 薩 莊 嚴 者 菩 薩 六 度 萬 行 以 為 莊 嚴 佛 土 者 心 
X25n0483_001:0172a03	土也。真如妙心。廼諸佛之淨土。是眾生之覺源也。	土 也 真 如 妙 心 廼 諸 佛 之 淨 土 是 眾 生 之 覺 源 也 
X25n0483_001:0172a04	但了法空淨。即真莊嚴。維摩經云。隨其心淨。則佛	但 了 法 空 淨 即 真 莊 嚴 維 摩 經 云 隨 其 心 淨 則 佛 
X25n0483_001:0172a05	土淨。蓋此心淨。便是莊嚴也。若著相施為。即非莊	土 淨 蓋 此 心 淨 便 是 莊 嚴 也 若 著 相 施 為 即 非 莊 
X25n0483_001:0172a06	嚴。名莊嚴矣。	嚴 名 莊 嚴 矣 
X25n0483_001:0172a07	是故須菩提。諸菩薩摩訶薩應如是生清淨心。不應	是 故 須 菩 提 諸 菩薩摩訶薩 應 如 是 生 清 淨 心 不 應 
X25n0483_001:0172a08	住色生心。不應住聲香味觸法生心。應無所住而生	住 色 生 心 不 應 住 聲香味觸 法 生 心 應 無 所 住 而 生 
X25n0483_001:0172a09	其心。	其 心 
X25n0483_001:0172a10	佛土既以心淨為莊嚴。則菩薩當生無染淨心。不	佛 土 既 以 心 淨 為 莊 嚴 則 菩 薩 當 生 無 染 淨 心 不 
X25n0483_001:0172a11	當生六塵妄想之心矣。而者下接上之辭也。應無	當 生 六 塵 妄 想 之 心 矣 而 者 下 接 上 之 辭 也 應 無 
X25n0483_001:0172a12	所住而生其心者。若心無染而清淨。真心自生也。	所 住 而 生 其 心 者 若 心 無 染 而 清 淨 真 心 自 生 也 
X25n0483_001:0172a13	譬如天平盤中無物。其針自正矣。	譬 如 天 平 盤 中 無 物 其 針 自 正 矣 
X25n0483_001:0172a14	須菩提。譬如有人。身如須彌山王。於意云何。是身為	須 菩 提 譬 如 有 人 身 如須彌山 王 於意云何 是 身 為 
X25n0483_001:0172a15	大不(音否)須菩提言。甚大。世尊。何以故。佛說非身。是名	大 不 音 否 須 菩 提 言 甚 大 世 尊 何 以 故 佛 說 非 身 是 名 
X25n0483_001:0172a16	大身。	大 身 
X25n0483_001:0172a17	王者眾所尊也。須彌山者。上至忉利天。下極崑崙	王 者 眾 所 尊 也 須 彌 山 者 上 至 忉 利 天 下 極 崑 崙 
X25n0483_001:0172a18	際。乃娑婆世界之主山也。大之莫及矣。佛引此譬	際 乃 娑婆世界 之 主 山 也 大 之 莫 及 矣 佛 引 此 譬 
X25n0483_001:0172a19	喻。尚有人身如須彌山之大。可為大否。須菩提遵	喻 尚 有 人 身 如須彌山 之 大 可 為 大 否 須 菩 提 遵 
X25n0483_001:0172a20	順無違。答言。甚大。須彌雖大。不滿虗空。法身之大。	順 無 違 答 言 甚 大 須 彌 雖 大 不 滿 虗 空 法 身 之 大 
X25n0483_001:0172a21	含納大虗。故楞嚴云。虗空生汝心內。由如片雲點	含 納 大 虗 故 楞 嚴 云 虗 空 生 汝 心 內 由 如 片 雲 點 
X25n0483_001:0172a22	太清裏。況世界生於虗空之內。須彌亦住世界之	太 清 裏 況 世 界 生 於 虗 空 之 內 須 彌 亦 住 世 界 之 
X25n0483_001:0172a23	中。豈得為大也。故法身無相。誠為大也。須彌有相。	中 豈 得 為 大 也 故 法 身 無 相 誠 為 大 也 須 彌 有 相 
X25n0483_001:0172a24	不足為大矣。是故佛說非身是名大身也。	不 足 為 大 矣 是 故 佛 說 非 身 是 名 大 身 也 
X25n0483_001:0172b01	○無為福勝分第十一	 無 為 福 勝 分 第 十 一 
X25n0483_001:0172b02	須菩提。如恒河中所有沙數。如是沙等恒河。於意云	須 菩 提 如 恒 河 中 所 有 沙 數 如 是 沙 等 恒 河 於 意 云 
X25n0483_001:0172b03	何。是諸恒河沙寧為多不(音否)須菩提言。甚多。世尊。但	何 是 諸 恒 河 沙 寧 為 多 不 音 否 須 菩 提 言 甚 多 世 尊 但 
X25n0483_001:0172b04	諸恒河尚多無數。何況其沙。	諸 恒 河 尚 多 無 數 何 況 其 沙 
X25n0483_001:0172b05	恒河者。舍衛國城外有河名恒河也。佛常指河中	恒 河 者 舍 衛 國 城 外 有 河 名 恒 河 也 佛 常 指 河 中 
X25n0483_001:0172b06	沙為喻。言恒河中有此無量數之沙。亦有無量數	沙 為 喻 言 恒 河 中 有 此 無 量 數 之 沙 亦 有 無 量 數 
X25n0483_001:0172b07	之恒河勝過此沙之多。是諸恒河中之沙。此言多	之 恒 河 勝 過 此 沙 之 多 是 諸 恒 河 中 之 沙 此 言 多 
X25n0483_001:0172b08	之甚矣。	之 甚 矣 
X25n0483_001:0172b09	須菩提。我今實言告汝。若有善男子．善女人。以七寶	須 菩 提 我 今 實 言 告 汝 若 有 善 男 子 善 女 人 以 七 寶 
X25n0483_001:0172b10	滿爾所恒河沙數三千大千世界。以用布施。得福多	滿 爾 所 恒 河 沙 數 三千大千世界 以用布施 得 福 多 
X25n0483_001:0172b11	不(音否)須菩提言。甚多。世尊。佛告須菩提。若善男子．善	不 音 否 須 菩 提 言 甚 多 世 尊 佛 告 須 菩 提 若 善 男 子 善 
X25n0483_001:0172b12	女人。於此經中。乃至受持四句偈等。為他人說。而此	女 人 於 此 經 中 乃 至 受 持 四 句 偈 等 為 他 人 說 而 此 
X25n0483_001:0172b13	福德勝前福德。	福 德 勝 前 福 德 
X25n0483_001:0172b14	恒沙七寶布施。福報無過人天。若人於此經中究	恒 沙 七 寶 布 施 福 報 無 過 人 天 若 人 於 此 經 中 究 
X25n0483_001:0172b15	明至理。必證菩提之果矣。	明 至 理 必 證 菩 提 之 果 矣 
X25n0483_001:0172b16	○尊重正教分第十二	 尊 重 正 教 分 第 十 二 
X25n0483_001:0172b17	復次。須菩提。隨說是經。乃至四句偈等。當知此處。一	復 次 須 菩 提 隨 說 是 經 乃 至 四 句 偈 等 當 知 此 處 一 
X25n0483_001:0172b18	切世間．天．人．阿修羅。皆應供養。如佛塔廟。	切 世 間 天 人 阿 修 羅 皆 應 供 養 如 佛 塔 廟 
X25n0483_001:0172b19	隨說者。隨處與人說經之所也。塔者。貯佛舍利之	隨 說 者 隨 處 與 人 說 經 之 所 也 塔 者 貯 佛 舍 利 之 
X25n0483_001:0172b20	塔廟者。立佛聖相之廟也。故有人天修羅而此供	塔 廟 者 立 佛 聖 相 之 廟 也 故 有 人 天 修 羅 而 此 供 
X25n0483_001:0172b21	養。今當知此說經之處。一切人道天道修羅道。皆	養 今 當 知 此 說 經 之 處 一 切 人 道 天 道 修 羅 道 皆 
X25n0483_001:0172b22	以香華幡蓋以為供養。勝若佛之塔廟者。何也。為	以 香 華 幡 蓋 以 為 供 養 勝 若 佛 之 塔 廟 者 何 也 為 
X25n0483_001:0172b23	一切諸佛及諸佛阿耨多羅三藐三菩提法。皆從	一切諸佛 及 諸 佛 阿耨多羅三藐三菩提 法 皆 從 
X25n0483_001:0172b24	此經出也。是故人天如此恭敬矣。	此 經 出 也 是 故 人 天 如 此 恭 敬 矣 
X25n0483_001:0172c01	何況有人盡能受持讀誦。須菩提。當知是人成就最	何 況 有 人 盡 能 受持讀誦 須 菩 提 當 知 是 人 成 就 最 
X25n0483_001:0172c02	上第一希有之法。若是經典所在之處。即為有佛。若	上 第一希有 之 法 若 是 經 典 所 在 之 處 即 為 有 佛 若 
X25n0483_001:0172c03	尊重弟子。	尊重弟子 
X25n0483_001:0172c04	若人明此般若妙義。即知心能作佛如此受持。則	若 人 明 此 般 若 妙 義 即 知 心 能 作 佛 如 此 受 持 則 
X25n0483_001:0172c05	是成就第一希有之法也。一切諸佛皆依般若而	是 成 就 第一希有 之 法 也 一切諸佛 皆 依 般 若 而 
X25n0483_001:0172c06	證。故云此經在處。即為有佛也。是人若能恭敬此	證 故 云 此 經 在 處 即 為 有 佛 也 是 人 若 能 恭 敬 此 
X25n0483_001:0172c07	經。即為尊重弟子也。	經 即 為 尊重弟子 也 
X25n0483_001:0172c08	○如法受持分第十三	 如 法 受 持 分 第 十 三 
X25n0483_001:0172c09	爾時。須菩提白佛言。世尊。當何名此經。我等云何奉	爾 時 須 菩 提 白 佛 言 世 尊 當 何 名 此 經 我 等 云 何 奉 
X25n0483_001:0172c10	持。佛告須菩提。是經名為金剛般若波羅蜜。以是名	持 佛 告 須 菩 提 是 經 名 為 金 剛 般 若 波 羅 蜜 以 是 名 
X25n0483_001:0172c11	字。汝當奉持。	字 汝 當 奉 持 
X25n0483_001:0172c12	金剛是喻般若。是法般若。波羅蜜。是梵語。此云智	金 剛 是 喻 般 若 是 法 般 若 波 羅 蜜 是 梵 語 此 云 智 
X25n0483_001:0172c13	慧到彼岸也。出前經題。註訖耳。以是名字者。此經	慧到彼岸 也 出 前 經 題 註 訖 耳 以 是 名 字 者 此 經 
X25n0483_001:0172c14	乃般若之名。非真般若之體。故說名字也。汝當奉	乃 般 若 之 名 非 真 般 若 之 體 故 說 名 字 也 汝 當 奉 
X25n0483_001:0172c15	持者。當依義奉行持教流通也。	持 者 當 依 義 奉 行 持 教 流 通 也 
X25n0483_001:0172c16	所以者何。須菩提。佛說般若波羅蜜。即非般若波羅	所以者何 須 菩 提 佛 說 般 若 波 羅 蜜 即 非 般 若 波 羅 
X25n0483_001:0172c17	蜜。是名般若波羅蜜。	蜜 是 名 般 若 波 羅 蜜 
X25n0483_001:0172c18	但有言說皆無實義。般若無相。故佛說即非般若。	但有言說 皆 無 實 義 般 若 無 相 故 佛 說 即 非 般 若 
X25n0483_001:0172c19	是名般若也。	是 名 般 若 也 
X25n0483_001:0172c20	須菩提。於意云何。如來有所說法不。須菩提白佛言。	須 菩 提 於意云何 如 來 有 所 說 法 不 須 菩 提 白 佛 言 
X25n0483_001:0172c21	世尊。如來無所說。	世 尊 如 來 無 所 說 
X25n0483_001:0172c22	如來說法。為利生故。真如體淨。實無法可說也。	如 來 說 法 為 利 生 故 真 如 體 淨 實 無 法 可 說 也 
X25n0483_001:0172c23	須菩提。於意云何。三千大千世界所有微塵是為多	須 菩 提 於意云何 三千大千世界 所 有 微 塵 是 為 多 
X25n0483_001:0172c24	不(音否)須菩提言。甚多。世尊。須菩提。諸微塵。如來說非	不 音 否 須 菩 提 言 甚 多 世 尊 須 菩 提 諸 微 塵 如 來 說 非 
X25n0483_001:0173a01	微塵。是名微塵。如來說。世界。非世界。是名世界。	微 塵 是 名 微 塵 如 來 說 世 界 非 世 界 是 名 世 界 
X25n0483_001:0173a02	三千世界。不外乎心一切微塵。悉依於地。故世界	三千世界 不 外 乎 心 一 切 微 塵 悉 依 於 地 故 世 界 
X25n0483_001:0173a03	者。隨眾生心業所感。而有眾生心淨。則世界淨。眾	者 隨 眾 生 心 業 所 感 而 有 眾 生 心 淨 則 世 界 淨 眾 
X25n0483_001:0173a04	生心垢。則世界垢。悟法無體。即非微塵。悟相虗妄。	生 心 垢 則 世 界 垢 悟 法 無 體 即 非 微 塵 悟 相 虗 妄 
X25n0483_001:0173a05	則非世界。佛心空寂。觀此微塵不實。世界非堅。故	則 非 世 界 佛 心 空 寂 觀 此 微 塵 不 實 世 界 非 堅 故 
X25n0483_001:0173a06	說非有塵世。是名塵世也。	說 非 有 塵 世 是 名 塵 世 也 
X25n0483_001:0173a07	須菩提。於意云何。可以三十二相見如來不(音否)不(音弗)	須 菩 提 於意云何 可 以 三十二相 見 如 來 不 音 否 不 音 弗 
X25n0483_001:0173a08	也。世尊。不可以三十二相得見如來。何以故。如來說。	也 世 尊 不 可 以 三十二相 得 見 如 來 何 以 故 如 來 說 
X25n0483_001:0173a09	三十二相。即是非相。是名三十二相。	三十二相 即 是 非 相 是 名 三十二相 
X25n0483_001:0173a10	三十二相者。如來以三十二妙行感此報身妙相。	三十二相 者 如 來 以 三 十 二 妙 行 感 此 報 身 妙 相 
X25n0483_001:0173a11	淨如琉璃。內外明徹。雖則報身殊妙。亦是幻妄。終	淨 如 琉 璃 內 外 明 徹 雖 則 報 身 殊 妙 亦 是 幻 妄 終 
X25n0483_001:0173a12	歸壞滅。故說非相。是名為相也。	歸 壞 滅 故 說 非 相 是 名 為 相 也 
X25n0483_001:0173a13	須菩提。若善男子．善女人。以恒河沙等身命布施。	須 菩 提 若 善 男 子 善 女 人 以 恒 河 沙 等 身 命 布 施 
X25n0483_001:0173a14	七寶布施。是利物濟貧。身命布施。乃了心立行。無	七 寶 布 施 是 利 物 濟 貧 身 命 布 施 乃 了 心 立 行 無 
X25n0483_001:0173a15	非福報也。	非 福 報 也 
X25n0483_001:0173a16	若復有人。於此經中。乃至四句偈等。為他人說。其福	若 復 有 人 於 此 經 中 乃 至 四 句 偈 等 為 他 人 說 其 福 
X25n0483_001:0173a17	甚多。	甚 多 
X25n0483_001:0173a18	佛言。小則微塵。大則世界福報。則妙身立行。則布	佛 言 小 則 微 塵 大 則 世 界 福 報 則 妙 身 立 行 則 布 
X25n0483_001:0173a19	施如此塵世身行。四事盡屬虗幻無有實體。若人	施 如 此 塵 世 身 行 四 事 盡 屬 虗 幻 無 有 實 體 若 人 
X25n0483_001:0173a20	能持此一經。為人解說。則得福多矣。	能 持 此 一 經 為 人 解 說 則 得 福 多 矣 
X25n0483_001:0173a21	○離相寂滅分第十四	 離 相 寂 滅 分 第 十 四 
X25n0483_001:0173a22	爾時。須菩提聞說是經。深解義趣。涕淚悲泣。而白佛	爾 時 須 菩 提 聞 說 是 經 深 解 義 趣 涕 淚 悲 泣 而 白 佛 
X25n0483_001:0173a23	言。希有。世尊。佛說如是甚深經典。我從昔來所得慧	言 希 有 世 尊 佛 說 如 是 甚深經典 我 從 昔 來 所 得 慧 
X25n0483_001:0173a24	眼。未曾得聞如是之經。	眼 未 曾 得 聞 如 是 之 經 
X25n0483_001:0173b01	須菩提。聞佛說塵世身行盡屬虗幻。深悟明此金	須 菩 提 聞 佛 說 塵 世 身 行 盡 屬 虗 幻 深 悟 明 此 金 
X25n0483_001:0173b02	剛般若之義。傷感悲泣。白言。世尊。我昔得緣空慧	剛 般 若 之 義 傷 感 悲 泣 白 言 世 尊 我 昔 得 緣 空 慧 
X25n0483_001:0173b03	眼。如何契此經義之遲也。	眼 如 何 契 此 經 義 之 遲 也 
X25n0483_001:0173b04	世尊。若復有人得聞是經。信心清淨。即生實相。當知	世 尊 若 復 有 人 得 聞 是 經 信 心 清 淨 即 生 實 相 當 知 
X25n0483_001:0173b05	是人。成就第一希有功德。	是 人 成 就 第一希有 功 德 
X25n0483_001:0173b06	實相者。真實無妄之相也。若人聞此經義。信心清	實 相 者 真 實 無 妄 之 相 也 若 人 聞 此 經 義 信 心 清 
X25n0483_001:0173b07	淨。則實相自生。誠為第一希有之功德也。	淨 則 實 相 自 生 誠 為 第一希有 之 功 德 也 
X25n0483_001:0173b08	世尊。是實相者。即是非相。是故如來說名實相。	世 尊 是 實 相 者 即 是 非 相 是 故 如 來 說 名 實 相 
X25n0483_001:0173b09	實相無相托名為相。故說非相也。	實 相 無 相 托 名 為 相 故 說 非 相 也 
X25n0483_001:0173b10	世尊。我今得聞如是經典。信解受持不足為難。若當	世 尊 我 今 得 聞 如 是 經 典 信 解 受 持 不 足 為 難 若 當 
X25n0483_001:0173b11	來世。後五百歲。其有眾生。得聞是經。信解受持。是人	來 世 後 五 百 歲 其 有 眾 生 得 聞 是 經 信 解 受 持 是 人 
X25n0483_001:0173b12	即為第一希有。何以故。此人無我相．無人相．無眾生	即 為 第一希有 何 以 故 此 人 無 我 相 無 人 相 無 眾 生 
X25n0483_001:0173b13	相．無壽者相。所以者何。我相即是非相。人相．眾生相．	相 無 壽 者 相 所以者何 我 相 即 是 非 相 人 相 眾 生 相 
X25n0483_001:0173b14	壽者相即是非相。何以故。離一切諸相。即名諸佛。	壽 者 相 即 是 非 相 何 以 故 離 一 切 諸 相 即 名 諸 佛 
X25n0483_001:0173b15	須菩提言。聞經受持。不離者。心空即受持不難。來	須 菩 提 言 聞 經 受 持 不 離 者 心 空 即 受 持 不 難 來 
X25n0483_001:0173b16	世眾生能空四相。持此經者。即為第一希有。有四	世 眾 生 能 空 四 相 持 此 經 者 即 為 第一希有 有 四 
X25n0483_001:0173b17	相即忘殀之體。般若無相離相體淨。故名離相。即	相 即 忘 殀 之 體 般 若 無 相 離 相 體 淨 故 名 離 相 即 
X25n0483_001:0173b18	殀破相。盡是名諸佛。	殀 破 相 盡 是 名 諸 佛 
X25n0483_001:0173b19	佛告須菩提。如是。如是。若復有人。能聞是經。不驚．不	佛 告 須 菩 提 如 是 如 是 若 復 有 人 能 聞 是 經 不 驚 不 
X25n0483_001:0173b20	怖．不畏。當知是人甚為希有。	怖 不 畏 當 知 是 人 甚 為 希 有 
X25n0483_001:0173b21	如是如是者。佛許言之。理當理當也。若人聞此般	如是如是 者 佛 許 言 之 理 當 理 當 也 若 人 聞 此 般 
X25n0483_001:0173b22	若無相妙法。則無驚疑怖畏者。此人亦為希有也。	若 無 相 妙 法 則 無 驚 疑 怖 畏 者 此 人 亦 為 希 有 也 
X25n0483_001:0173b23	何以故。須菩提。如來說。第一波羅蜜。即非第一波羅	何 以 故 須 菩 提 如 來 說 第 一 波 羅 蜜 即 非 第 一 波 羅 
X25n0483_001:0173b24	蜜。是名第一波羅蜜。	蜜 是 名 第 一 波 羅 蜜 
X25n0483_001:0173c01	第一波羅蜜者。非說布施波羅蜜為第一也。直說	第 一 波 羅 蜜 者 非 說 布 施 波 羅 蜜 為 第 一 也 直 說 
X25n0483_001:0173c02	金剛般若波羅蜜矣。此般若能攝三乘．四果．六度	金 剛 般 若 波 羅 蜜 矣 此 般 若 能 攝 三 乘 四 果 六 度 
X25n0483_001:0173c03	萬行。凡諸善法。皆依般若之功也。非般若則不能	萬 行 凡 諸 善 法 皆 依 般 若 之 功 也 非 般 若 則 不 能 
X25n0483_001:0173c04	立此行。非般若則不能證是果矣。是心經云。菩提	立 此 行 非 般 若 則 不 能 證 是 果 矣 是 心 經 云 菩 提 
X25n0483_001:0173c05	薩埵依般若波羅蜜而得究竟涅槃。三世諸佛。依	薩 埵 依 般 若 波 羅 蜜 而 得 究竟涅槃 三世諸佛 依 
X25n0483_001:0173c06	般若波羅蜜得證菩提正果。故此般若是無上呪。	般 若 波 羅 蜜 得 證 菩 提 正 果 故 此 般 若 是 無 上 呪 
X25n0483_001:0173c07	是無等等呪。如此佛稱般若為第一之波羅蜜也。	是 無 等 等 呪 如 此 佛 稱 般 若 為 第 一 之 波 羅 蜜 也 
X25n0483_001:0173c08	即非第一波羅蜜。若屬言說。亦是名字中波羅蜜	即 非 第 一 波 羅 蜜 若 屬 言 說 亦 是 名 字 中 波 羅 蜜 
X25n0483_001:0173c09	也。	也 
X25n0483_001:0173c10	須菩提。忍辱波羅蜜。如來說非忍辱波羅蜜。是名忍	須 菩 提 忍 辱 波 羅 蜜 如 來 說 非 忍 辱 波 羅 蜜 是 名 忍 
X25n0483_001:0173c11	辱波羅蜜。	辱 波 羅 蜜 
X25n0483_001:0173c12	忍辱能降嗔怒。嗔怒能渾般若。古云。一念嗔心起。	忍 辱 能 降 嗔 怒 嗔 怒 能 渾 般 若 古 云 一 念 嗔 心 起 
X25n0483_001:0173c13	八萬障門開。若嗔怒既是不降。則般若真性不現。	八 萬 障 門 開 若 嗔 怒 既 是 不 降 則 般 若 真 性 不 現 
X25n0483_001:0173c14	故佛設忍辱之權。方淨般若之體。故稱忍辱波羅	故 佛 設 忍 辱 之 權 方 淨 般 若 之 體 故 稱 忍 辱 波 羅 
X25n0483_001:0173c15	蜜也。則忍辱亦無實體。其嗔既泯。其忍自消。故謂	蜜 也 則 忍 辱 亦 無 實 體 其 嗔 既 泯 其 忍 自 消 故 謂 
X25n0483_001:0173c16	非忍辱也。	非 忍 辱 也 
X25n0483_001:0173c17	何以故。須菩提。如我昔為歌利王割截身體。我於爾	何 以 故 須 菩 提 如 我 昔 為 歌 利 王 割 截 身 體 我 於 爾 
X25n0483_001:0173c18	時。無我相．無人相．無眾生相．無壽者相。何以故。我於	時 無 我 相 無 人 相 無 眾 生 相 無 壽 者 相 何 以 故 我 於 
X25n0483_001:0173c19	往昔節節支解時。若有我相．人相．眾生相．壽者相。應	往 昔 節 節 支 解 時 若 有 我 相 人 相 眾 生 相 壽 者 相 應 
X25n0483_001:0173c20	生嗔恨。須菩提。又念過去於五百世作忍辱仙人。於	生 嗔 恨 須 菩 提 又 念 過 去 於 五 百 世 作 忍 辱 仙 人 於 
X25n0483_001:0173c21	爾所世。無我相．無人相．無眾生相．無壽者相。	爾 所 世 無 我 相 無 人 相 無 眾 生 相 無 壽 者 相 
X25n0483_001:0173c22	歌者。好聲色。利者。貪財利。六祖云。此王好色。貪利。	歌 者 好 聲 色 利 者 貪 財 利 六 祖 云 此 王 好 色 貪 利 
X25n0483_001:0173c23	是無道之君也。人以一生為一世。佛在歌利王。五	是 無 道 之 君 也 人 以 一 生 為 一 世 佛 在 歌 利 王 五 
X25n0483_001:0173c24	百世前因中修五百世忍辱波羅蜜矣。故四相不	百 世 前 因 中 修 五 百 世 忍 辱 波 羅 蜜 矣 故 四 相 不 
X25n0483_001:0174a01	生。其心不忍而自忍也。	生 其 心 不 忍 而 自 忍 也 
X25n0483_001:0174a02	是故須菩提。菩薩應離一切相。發阿耨(音奴入聲)多羅三	是 故 須 菩 提 菩 薩 應 離一切相 發 阿 耨 音 奴 入 聲 多 羅 三 
X25n0483_001:0174a03	藐(音渺)三菩提心。不應住色生心。不應住聲香味觸法	藐 音 渺 三 菩 提 心 不 應 住 色 生 心 不 應 住 聲香味觸 法 
