X25n0483_001:0169a15	明色發。明見想成。異見成憎。同想成愛。流愛為種。	明 色 發 明 見 想 成 異 見 成 憎 同 想 成 愛 流 愛 為 種 
X25n0483_001:0169a16	納想為胎。交遘發生。吸引同業。六種亂想。隨業感	納 想 為 胎 交 遘 發 生 吸 引 同 業 六 種 亂 想 隨 業 感 
X25n0483_001:0169a17	生。種種眾生。各有八萬四千。充塞其類也。若卵生	生 種 種 眾 生 各 有 八萬四千 充 塞 其 類 也 若 卵 生 
X25n0483_001:0169a18	者。卵惟想生。合氣成卵。識想飛沉。故有魚鳥之類	者 卵 惟 想 生 合 氣 成 卵 識 想 飛 沉 故 有 魚 鳥 之 類 
X25n0483_001:0169a19	也。若胎生者。胎因情有。合精成胎。慾想竪橫。故感	也 若 胎 生 者 胎 因 情 有 合 精 成 胎 慾 想 竪 橫 故 感 
X25n0483_001:0169a20	人畜之類也。若濕生者。濕以合感。合愛為濕。和煖	人 畜 之 類 也 若 濕 生 者 濕 以 合 感 合 愛 為 濕 和 煖 
X25n0483_001:0169a21	發生。所趣無定。翻覆亂想。故感蠢蝡之類也。若化	發 生 所 趣 無 定 翻 覆 亂 想 故 感 蠢 蝡 之 類 也 若 化 
X25n0483_001:0169a22	生者。化以離應。意欲飛騰。趣新亂想。無而忽有。故	生 者 化 以 離 應 意 欲 飛 騰 趣 新 亂 想 無 而 忽 有 故 
X25n0483_001:0169a23	有轉蛻飛行之類也。若有色者。但事日月星辰。堅	有 轉 蛻 飛 行 之 類 也 若 有 色 者 但 事 日 月 星 辰 堅 
X25n0483_001:0169a24	執留礙。其心亂想。結成精耀。休咎精明。其類充塞。	執 留 礙 其 心 亂 想 結 成 精 耀 休 咎 精 明 其 類 充 塞 
X25n0483_001:0169b01	若無色者。厭有著空。滅身歸無。惑業昏重。識附陰	若 無 色 者 厭 有 著 空 滅 身 歸 無 惑 業 昏 重 識 附 陰 
X25n0483_001:0169b02	隱。體合空昧。空散銷沉。其類充塞。若有想者。虗妄	隱 體 合 空 昧 空 散 銷 沉 其 類 充 塞 若 有 想 者 虗 妄 
X25n0483_001:0169b03	失真。邪著影像。無有實色。託識罔象。潛結貌狀。神	失 真 邪 著 影 像 無 有 實 色 託 識 罔 象 潛 結 貌 狀 神 
X25n0483_001:0169b04	鬼精靈。其類充滿。若無想者。不了諦理。固守愚痴。	鬼 精 靈 其 類 充 滿 若 無 想 者 不 了 諦 理 固 守 愚 痴 
X25n0483_001:0169b05	習定灰疑。思專枯槁。精神化為土木金石。其類充	習 定 灰 疑 思 專 枯 槁 精 神 化 為 土 木 金 石 其 類 充 
X25n0483_001:0169b06	塞。若非有想者。誣罔取他。納為己有。忘本蒸甞。認	塞 若 非 有 想 者 誣 罔 取 他 納 為 己 有 忘 本 蒸 甞 認 
X25n0483_001:0169b07	彼宗嗣。異質相成。其類充塞。若非無想者。怨害相	彼 宗 嗣 異 質 相 成 其 類 充 塞 若 非 無 想 者 怨 害 相 
X25n0483_001:0169b08	酧。傷殺相反。生理恠誕。棄絕倫義。如土梟附塊。為	酧 傷 殺 相 反 生 理 恠 誕 棄 絕 倫 義 如 土 梟 附 塊 為 
X25n0483_001:0169b09	兒子。成父母。皆遭其食。其類充塞。此說九種十二	兒 子 成 父 母 皆 遭 其 食 其 類 充 塞 此 說 九 種 十 二 
X25n0483_001:0169b10	類眾生。皆未悟明涅槃。妙心迷陷。情欲積妄。發生	類 眾 生 皆 未 悟 明 涅 槃 妙 心 迷 陷 情 欲 積 妄 發 生 
X25n0483_001:0169b11	妄隨輪轉。誰不知此眾生。心體本即涅槃。若一念	妄 隨 輪 轉 誰 不 知 此 眾 生 心 體 本 即 涅 槃 若 一 念 
X25n0483_001:0169b12	回光悟明。無生之理。斷除情妄。即證入無餘涅槃。	回 光 悟 明 無 生 之 理 斷 除 情 妄 即 證 入無餘涅槃 
X25n0483_001:0169b13	而自滅度之矣。涅槃者。乃無生滅之心是也。眾生	而 自 滅 度 之 矣 涅 槃 者 乃 無 生 滅 之 心 是 也 眾 生 
X25n0483_001:0169b14	分上。無欠無餘矣。有餘者。習氣未盡。無餘者。能所	分 上 無 欠 無 餘 矣 有 餘 者 習 氣 未 盡 無 餘 者 能 所 
X25n0483_001:0169b15	俱消也。	俱 消 也 
X25n0483_001:0169b16	如是滅度無量無數無邊眾生。實無眾生得滅度者。	如 是 滅 度 無量無數 無 邊 眾 生 實 無 眾 生 得滅度者 
X25n0483_001:0169b17	何以故。須菩提。若菩薩有我相．人相．眾生相．壽者相。	何 以 故 須 菩 提 若 菩 薩 有 我 相 人 相 眾 生 相 壽 者 相 
X25n0483_001:0169b18	即非菩薩。	即 非 菩 薩 
X25n0483_001:0169b19	四相者。識心未了。即有我相。迷己認他。即有人相。	四 相 者 識 心 未 了 即 有 我 相 迷 己 認 他 即 有 人 相 
X25n0483_001:0169b20	情妄未除。即眾生相。作後有念。即壽者相。菩薩心	情 妄 未 除 即 眾 生 相 作 後 有 念 即 壽 者 相 菩 薩 心 
X25n0483_001:0169b21	淨。諸法不生。實非有相。若四相去除。即非真菩薩	淨 諸 法 不 生 實 非 有 相 若 四 相 去 除 即 非 真 菩 薩 
X25n0483_001:0169b22	矣。	矣 
X25n0483_001:0169b23	○妙行無住分第四	 妙 行 無 住 分 第 四 
X25n0483_001:0169b24	復次。須菩提。菩薩於法。應無所住。行於布施。所謂不	復 次 須 菩 提 菩 薩 於 法 應 無 所 住 行 於 布 施 所 謂 不 
X25n0483_001:0169c01	住色布施。不住聲香味觸法布施。須菩提。菩薩應如	住 色 布 施 不 住 聲香味觸 法 布 施 須 菩 提 菩 薩 應 如 
X25n0483_001:0169c02	是布施。不住於相。	是 布 施 不 住 於 相 
X25n0483_001:0169c03	復次者。重舉也。心有住著。即名慳貪心。無住著。即	復 次 者 重 舉 也 心 有 住 著 即 名 慳 貪 心 無 住 著 即 
X25n0483_001:0169c04	名布施。法乃塵妄之名。布施解脫之義法。本無住	名 布 施 法 乃 塵 妄 之 名 布 施 解 脫 之 義 法 本 無 住 
X25n0483_001:0169c05	所。生滅隨緣。言菩薩勿著於心。當行布施也。六塵	所 生 滅 隨 緣 言 菩 薩 勿 著 於 心 當 行 布 施 也 六 塵 
X25n0483_001:0169c06	者。在眼曰色。在耳曰聲。在鼻曰香。在舌曰味。在身	者 在 眼 曰 色 在 耳 曰 聲 在 鼻 曰 香 在 舌 曰 味 在 身 
X25n0483_001:0169c07	曰觸。在意曰法。今此六塵之相。若生染著。即為慳	曰 觸 在 意 曰 法 今 此 六 塵 之 相 若 生 染 著 即 為 慳 
X25n0483_001:0169c08	貪。若無住著。即名布施矣。	貪 若 無 住 著 即 名 布 施 矣 
X25n0483_001:0169c09	何以故。若菩薩不住相布施。其福德不可思量。	何 以 故 若 菩 薩 不 住 相 布 施 其 福 德 不 可 思 量 
X25n0483_001:0169c10	不住相布施者。菩薩覺心清淨。知法本空。雖有萬	不 住 相 布 施 者 菩 薩 覺 心 清 淨 知 法 本 空 雖 有 萬 
X25n0483_001:0169c11	行利益眾生。無有一毫著福之念。淨心無染。其福	行 利 益 眾 生 無 有 一 毫 著 福 之 念 淨 心 無 染 其 福 
X25n0483_001:0169c12	莫量也。	莫 量 也 
X25n0483_001:0169c13	須菩提。於意云何。東方虗空可思量不(音否)不(音弗)也。世	須 菩 提 於意云何 東 方 虗 空 可 思 量 不 音 否 不 音 弗 也 世 
X25n0483_001:0169c14	尊。須菩提。南西北方四維上下虗空可思量不(音否)不	尊 須 菩 提 南 西 北 方 四 維 上 下 虗 空 可 思 量 不 音 否 不 
X25n0483_001:0169c15	(音弗)也。世尊。須菩提。菩薩無住相布施。福德亦復如是	 音 弗 也 世 尊 須 菩 提 菩 薩 無 住 相 布 施 福 德 亦復如是 
X25n0483_001:0169c16	不可思量。須菩提。菩薩但應如所教住。	不 可 思 量 須 菩 提 菩 薩 但 應 如 所 教 住 
X25n0483_001:0169c17	東南西北為四方四維。即四隅也。以四方四維上	東 南 西 北 為 四 方 四 維 即 四 隅 也 以 四 方 四 維 上 
X25n0483_001:0169c18	下總謂十方矣。虗空本無方所。何有十方。佛言。十	下 總 謂 十 方 矣 虗 空 本 無 方 所 何 有 十 方 佛 言 十 
X25n0483_001:0169c19	方者。顯此虗空大之無極矣。今謂菩薩無住相布	方 者 顯 此 虗 空 大 之 無 極 矣 今 謂 菩 薩 無 住 相 布 
X25n0483_001:0169c20	施。言福德亦如此之大者。而心包太虗。則福性亦	施 言 福 德 亦 如 此 之 大 者 而 心 包 太 虗 則 福 性 亦 
X25n0483_001:0169c21	同太虗之大也。是故佛告菩薩。不當住法住相。但	同 太 虗 之 大 也 是 故 佛 告 菩 薩 不 當 住 法 住 相 但 
X25n0483_001:0169c22	當心無所住處而住。若心無所住。是名真住矣。	當 心無所住 處 而 住 若 心無所住 是 名 真 住 矣 
X25n0483_001:0169c23	○如理實見分第五	 如 理 實 見 分 第 五 
X25n0483_001:0169c24	須菩提。於意云何。可以身相見如來不(音否)不(音弗)也。世	須 菩 提 於意云何 可 以 身 相 見 如 來 不 音 否 不 音 弗 也 世 
X25n0483_001:0170a01	尊。不可以身相得見如來。何以故。如來所說身相。即	尊 不 可 以 身 相 得 見 如 來 何 以 故 如 來 所 說 身 相 即 
X25n0483_001:0170a02	非身相。	非 身 相 
X25n0483_001:0170a03	如來者。即真如性也。是諸佛法身。乃眾生本體也。	如 來 者 即 真 如 性 也 是 諸 佛 法 身 乃 眾 生 本 體 也 
X25n0483_001:0170a04	身相者。是色身幻相也。言不可以執幻相得見真	身 相 者 是 色 身 幻 相 也 言 不 可 以 執 幻 相 得 見 真 
X25n0483_001:0170a05	如妙心也。相本漚幻。故佛言。身相即非身相也。	如 妙 心 也 相 本 漚 幻 故 佛 言 身 相 即 非 身 相 也 
X25n0483_001:0170a06	佛告須菩提。凡所有相。皆是虛妄。若見諸相非相。即	佛 告 須 菩 提 凡 所 有 相 皆 是 虛 妄 若 見 諸 相 非 相 即 
X25n0483_001:0170a07	見如來。	見 如 來 
X25n0483_001:0170a08	若見諸相非相者。心不起分別見相之念也。若見	若 見 諸 相 非 相 者 心 不起分別 見 相 之 念 也 若 見 
X25n0483_001:0170a09	相著相。即背真理見相非相。即見如來矣。	相 著 相 即 背 真 理 見 相 非 相 即 見 如 來 矣 
X25n0483_001:0170a10	○正信希有分第六	 正 信 希 有 分 第 六 
X25n0483_001:0170a11	須菩提白佛言。世尊。頗有眾生。得聞如是言說章句。	須 菩 提 白 佛 言 世 尊 頗 有 眾 生 得 聞 如 是 言 說 章 句 
X25n0483_001:0170a12	生實信不。佛告須菩提。莫作是說。如來滅後。後五百	生 實 信 不 佛 告 須 菩 提 莫 作 是 說 如來滅後 後 五 百 
X25n0483_001:0170a13	歲。有持戒修福者。於此章句能生信心。以此為實。當	歲 有 持 戒 修 福 者 於 此 章 句 能 生 信 心 以 此 為 實 當 
X25n0483_001:0170a14	知是人不於一佛二佛三四五佛而種善根。已於無	知 是 人 不 於 一 佛 二 佛 三 四 五 佛 而 種 善 根 已 於 無 
X25n0483_001:0170a15	量千萬佛所種諸善根。	量 千 萬 佛 所 種 諸 善 根 
X25n0483_001:0170a16	實信者。實諦之階梯也。信則所言之理順。順則師	實 信 者 實 諦 之 階 梯 也 信 則 所 言 之 理 順 順 則 師 
X25n0483_001:0170a17	資之道成。蓋須菩提疑此如來言說般若無相章	資 之 道 成 蓋 須 菩 提 疑 此 如 來 言 說 般 若 無 相 章 
X25n0483_001:0170a18	句。眾生難信。故作是問。而佛恐阻眾生實信之心。	句 眾 生 難 信 故 作 是 問 而 佛 恐 阻 眾 生 實 信 之 心 
X25n0483_001:0170a19	且告之莫作是說矣。持戒者諸惡莫作。修福者。眾	且 告 之 莫 作 是 說 矣 持 戒 者 諸 惡 莫 作 修 福 者 眾 
X25n0483_001:0170a20	善奉行。倘佛滅度之後。若人聞此般若章句。信為	善 奉 行 倘 佛 滅 度 之 後 若 人 聞 此 般 若 章 句 信 為 
X25n0483_001:0170a21	實有者。則知此人。不但於三五佛前種諸善根。特	實 有 者 則 知 此 人 不 但 於 三 五 佛 前 種 諸 善 根 特 
X25n0483_001:0170a22	於無量劫中。承事諸佛種善根矣。	於 無 量 劫 中 承 事 諸 佛 種 善 根 矣 
X25n0483_001:0170a23	聞是章句。乃至一念生淨信者。須菩提。如來悉知悉	聞 是 章 句 乃 至 一 念 生 淨 信 者 須 菩 提 如 來 悉 知 悉 
X25n0483_001:0170a24	見。是諸眾生得如是無量福德。何以故。是諸眾生無	見 是 諸 眾 生 得 如 是 無量福德 何 以 故 是 諸 眾 生 無 
X25n0483_001:0170b01	復我相．人相．眾生相．壽者相無法相。亦無非法相。	復 我 相 人 相 眾 生 相 壽 者 相 無 法 相 亦 無 非 法 相 
X25n0483_001:0170b02	淨信者。淨者淨而無染信者。信而無疑。若人聞是	淨 信 者 淨 者 淨 而 無 染 信 者 信 而 無 疑 若 人 聞 是 
X25n0483_001:0170b03	章句。生一念淨信者。悉知此人心空。四相諸法自	章 句 生 一 念 淨 信 者 悉 知 此 人 心 空 四 相 諸 法 自 
X25n0483_001:0170b04	淨矣。無法相者。為無見所執也。亦無非法相者。為	淨 矣 無 法 相 者 為 無 見 所 執 也 亦 無 非 法 相 者 為 
X25n0483_001:0170b05	有見所執也。是以法相本無因執故有。若能信心	有 見 所 執 也 是 以 法 相 本 無 因 執 故 有 若 能 信 心 
X25n0483_001:0170b06	清淨。則眾生垢淨如此。即得福無量矣。	清 淨 則 眾 生 垢 淨 如 此 即 得 福 無 量 矣 
X25n0483_001:0170b07	何以故。是諸眾生若心取相。即為著我人眾生壽者。	何 以 故 是 諸 眾 生 若 心 取 相 即 為 著 我 人 眾 生 壽 者 
X25n0483_001:0170b08	若取法相。即著我人眾生壽者。何以故。若取非法相。	若 取 法 相 即 著 我 人 眾 生 壽 者 何 以 故 若 取 非 法 相 
X25n0483_001:0170b09	即著我人眾生壽者。是故不應取法。不應取非法。以	即 著 我 人 眾 生 壽 者 是 故 不 應 取 法 不 應 取 非 法 以 
X25n0483_001:0170b10	是義故。	是 義 故 
X25n0483_001:0170b11	心本無相。若覔心取相者。即著四相。若法與非法	心 本 無 相 若 覔 心 取 相 者 即 著 四 相 若 法 與 非 法 
X25n0483_001:0170b12	悉屬妄緣。俱無實相。若取而求之。亦染四相。是故	悉 屬 妄 緣 俱 無 實 相 若 取 而 求 之 亦 染 四 相 是 故 
X25n0483_001:0170b13	諸法體空。不當取著。故如來說不取相者。以是義	諸 法 體 空 不 當 取 著 故 如 來 說 不 取 相 者 以 是 義 
X25n0483_001:0170b14	故。	故 
X25n0483_001:0170b15	如來常說。汝等比(音必)丘。知我說法。如筏(音伐)喻者。法尚	如 來 常 說 汝 等 比 音 必 丘 知 我 說 法 如 筏 音 伐 喻 者 法 尚 
X25n0483_001:0170b16	應捨。何況非法。	應 捨 何 況 非 法 
X25n0483_001:0170b17	佛說。一切法度我。一切心我無。一切心何用。一切	佛 說 一 切 法 度 我 一 切 心 我 無 一 切 心 何 用 一 切 
X25n0483_001:0170b18	法是以如來說法。如舡筏者。能度此岸人於彼岸	法 是 以 如 來 說 法 如 舡 筏 者 能 度 此 岸 人 於 彼 岸 
X25n0483_001:0170b19	矣。蓋人四相空塵。心淨正法。當捨何況非法。正謂	矣 蓋 人 四 相 空 塵 心 淨 正 法 當 捨 何 況 非 法 正 謂 
X25n0483_001:0170b20	渡河當用筏到岸不須舟矣。	渡 河 當 用 筏 到 岸 不 須 舟 矣 
X25n0483_001:0170b21	○無得無說分第七	 無 得 無 說 分 第 七 
X25n0483_001:0170b22	須菩提。於意云何。如來得阿耨(音奴入聲)多羅三藐三菩	須 菩 提 於意云何 如 來 得 阿 耨 音 奴 入 聲 多 羅 三 藐 三 菩 
X25n0483_001:0170b23	提耶。如來有所說法耶。須菩提言。如我解佛所說義。	提 耶 如 來 有 所 說 法 耶 須 菩 提 言 如 我 解 佛 所 說 義 
X25n0483_001:0170b24	無有定法名阿耨(音奴入聲)多羅三藐(音渺)三菩提。亦無有	無 有 定 法 名 阿 耨 音 奴 入 聲 多 羅 三 藐 音 渺 三 菩 提 亦 無 有 
X25n0483_001:0170c01	定法。如來可說。	定 法 如 來 可 說 
X25n0483_001:0170c02	如來妙心。無有決定之法。即名菩提。亦無有定法	如 來 妙 心 無 有 決 定 之 法 即 名 菩 提 亦 無 有 定 法 
X25n0483_001:0170c03	可說也。如鏡本無定像。隨形自現。法本無定體。隨	可 說 也 如 鏡 本 無 定 像 隨 形 自 現 法 本 無 定 體 隨 
X25n0483_001:0170c04	緣自生。道經云。空即是空。空無定空。色即是色。色	緣 自 生 道 經 云 空 即 是 空 空 無 定 空 色 即 是 色 色 
X25n0483_001:0170c05	無定色是也。	無 定 色 是 也 
X25n0483_001:0170c06	何以故。如來所說法。皆不可取．不可說．非法．非非法。	何 以 故 如 來 所 說 法 皆 不 可 取 不 可 說 非 法 非 非 法 
X25n0483_001:0170c07	所以者何。一切賢聖。皆以無為法而有差別。	所以者何 一 切 賢 聖 皆 以 無 為 法 而有差別 
X25n0483_001:0170c08	無為體上。實無法可得可說矣。今經言非法非非	無 為 體 上 實 無 法 可 得 可 說 矣 今 經 言 非 法 非 非 
X25n0483_001:0170c09	法者。此法說有亦非有。說無亦非無。非法者。心本	法 者 此 法 說 有 亦 非 有 說 無 亦 非 無 非 法 者 心 本 
X25n0483_001:0170c10	是無。非非法者。應緣而有。理惟一心。事收萬法矣。	是 無 非 非 法 者 應 緣 而 有 理 惟 一 心 事 收 萬 法 矣 
X25n0483_001:0170c11	所以者何。言理無濶峽。見有淺深。此無為體上。或	所以者何 言 理 無 濶 峽 見 有 淺 深 此 無 為 體 上 或 
X25n0483_001:0170c12	有得皮得骨得髓者。聖賢之位。隨德稱尊。見深行	有 得 皮 得 骨 得 髓 者 聖 賢 之 位 隨 德 稱 尊 見 深 行 
X25n0483_001:0170c13	廣。位重名高。三乘賢聖於此無為體上證悟。各有	廣 位 重 名 高 三 乘 賢 聖 於 此 無 為 體 上 證 悟 各 有 
X25n0483_001:0170c14	淺深之殊。	淺 深 之 殊 
X25n0483_001:0170c15	○依法出生分第八	 依 法 出 生 分 第 八 
X25n0483_001:0170c16	須菩提。於意云何。若人滿三千大千世界七寶以用	須 菩 提 於意云何 若 人 滿 三千大千世界 七 寶 以 用 
X25n0483_001:0170c17	布施。是人所得福德。寧為多不(音否)。	布 施 是 人 所 得 福 德 寧 為 多 不 音 否 
X25n0483_001:0170c18	三千世界者。日月運行一須彌山。照四部洲中為	三千世界 者 日 月 運 行 一 須 彌 山 照 四 部 洲 中 為 
X25n0483_001:0170c19	一小世界。以一千小世界為一小千世界。以一千	一 小 世 界 以 一 千 小 世 界 為 一 小千世界 以 一 千 
X25n0483_001:0170c20	小千世界為一中千世界。以一千中千世界為一	小千世界 為 一 中千世界 以 一 千 中千世界 為 一 
X25n0483_001:0170c21	大千世界。以一千大千一千中千一千大千總為	大千世界 以 一 千 大 千 一 千 中 千 一 千 大 千 總 為 
X25n0483_001:0170c22	三千大千世界也。七寶者。所謂金．銀．瑠璃．珊瑚．瑪	三千大千世界 也 七 寶 者 所 謂 金 銀 瑠 璃 珊 瑚 瑪 
X25n0483_001:0170c23	瑙．瑱珠．玻瓈是也。佛言盡三千世界七寶布施。言	瑙 瑱 珠 玻 瓈 是 也 佛 言 盡 三千世界 七 寶 布 施 言 
X25n0483_001:0170c24	得福雖多。不如般若功德之大也。	得 福 雖 多 不 如 般 若 功 德 之 大 也 
X25n0483_001:0171a01	須菩提言。甚多。世尊。何以故。是福德即非福德性。是	須 菩 提 言 甚 多 世 尊 何 以 故 是 福 德 即 非 福 德 性 是 
X25n0483_001:0171a02	故如來說福德多。	故 如 來 說 福 德 多 
X25n0483_001:0171a03	須菩提證無諍三昧。悟體性空。答福德甚多者。心	須 菩 提 證 無諍三昧 悟 體 性 空 答 福 德 甚 多 者 心 
X25n0483_001:0171a04	順無諍。言非福德者。性悟真空也。福德性者。乃般	順 無 諍 言 非 福 德 者 性 悟 真 空 也 福 德 性 者 乃 般 
X25n0483_001:0171a05	若之慧也。性非福德。故如來說福德多矣。	若 之 慧 也 性 非 福 德 故 如 來 說 福 德 多 矣 
X25n0483_001:0171a06	若復有人。於此經中受持。乃至四句偈等。為他人說。	若 復 有 人 於 此 經 中 受 持 乃 至 四 句 偈 等 為 他 人 說 
X25n0483_001:0171a07	其福勝彼。何以故。須菩提。一切諸佛。及諸佛阿耨(音奴	其 福 勝 彼 何 以 故 須 菩 提 一切諸佛 及 諸 佛 阿 耨 音 奴 
X25n0483_001:0171a08	入聲)多羅三藐(音渺)三菩提法。皆從此經出。	入 聲 多 羅 三 藐 音 渺 三 菩 提 法 皆 從 此 經 出 
X25n0483_001:0171a09	此經中乃至四句偈者。休言獨稱四句偈上有乃	此 經 中 乃 至 四 句 偈 者 休 言 獨 稱 四 句 偈 上 有 乃 
X25n0483_001:0171a10	至二字下有等字也。或有一句二句乃至百千萬	至 二 字 下 有 等 字 也 或 有 一 句 二 句 乃 至 百 千 萬 
X25n0483_001:0171a11	句。只此統說。何以獨稱四句偈耶。看經者可宜詳	句 只 此 統 說 何 以 獨 稱 四 句 偈 耶 看 經 者 可 宜 詳 
X25n0483_001:0171a12	觀也。此言統說金剛般若經中之大義也。般若無	觀 也 此 言 統 說 金 剛 般 若 經 中 之 大 義 也 般 若 無 
X25n0483_001:0171a13	相偈說無為。謂人心體本自無為。當依般若能證	相 偈 說 無 為 謂 人 心 體 本 自 無 為 當 依 般 若 能 證 
X25n0483_001:0171a14	無為之果矣。若人於此經中能悟明真理。操心向	無 為 之 果 矣 若 人 於 此 經 中 能 悟 明 真 理 操 心 向 
X25n0483_001:0171a15	道。更復為人解說此經之義。則是人其福勝前三	道 更 復 為 人 解 說 此 經 之 義 則 是 人 其 福 勝 前 三 
X25n0483_001:0171a16	千七寶布施福德也。唐玄宗云。三千七寶雖多。用	千 七 寶 布 施 福 德 也 唐 玄 宗 云 三 千 七 寶 雖 多 用 
X25n0483_001:0171a17	盡還歸生滅。四句經文雖少。悟之直至菩提。所言	盡 還 歸 生 滅 四 句 經 文 雖 少 悟 之 直 至 菩 提 所 言 
X25n0483_001:0171a18	諸佛及諸佛法。皆由此金剛般若而出者。惟此經	諸 佛 及 諸 佛 法 皆 由 此 金 剛 般 若 而 出 者 惟 此 經 
X25n0483_001:0171a19	之至要也。	之 至 要 也 
X25n0483_001:0171a20	須菩提。所謂佛．法者。即非佛．法。	須 菩 提 所 謂 佛 法 者 即 非 佛 法 
X25n0483_001:0171a21	佛法在心而不在教。故云。所謂佛法者即非真佛	佛 法 在 心 而 不 在 教 故 云 所 謂 佛 法 者 即 非 真 佛 
X25n0483_001:0171a22	法也。	法 也 
X25n0483_001:0171a23	○一相無相分第九	 一相無相 分 第 九 
X25n0483_001:0171a24	須菩提。於意云何。須陀洹(音桓)能作是念。我得須陀洹	須 菩 提 於意云何 須 陀 洹 音 桓 能 作 是 念 我 得 須 陀 洹 
X25n0483_001:0171b01	果不(音否)須菩提言。不(音弗)也。世尊。何以故。須陀洹(音桓)名	果 不 音 否 須 菩 提 言 不 音 弗 也 世 尊 何 以 故 須 陀 洹 音 桓 名 
X25n0483_001:0171b02	為入流。而為所入。不入色聲香味觸法。是名須陀洹。	為 入 流 而 為 所 入 不 入 色聲香味觸 法 是 名 須 陀 洹 
X25n0483_001:0171b03	須陀洹．斯陀含．阿那含．阿羅漢。此四果者。乃凡夫	須 陀 洹 斯 陀 含 阿 那 含 阿 羅 漢 此 四 果 者 乃 凡 夫 
X25n0483_001:0171b04	流入聖位之階級也。若人心當以無念為宗．無著	流 入 聖 位 之 階 級 也 若 人 心 當 以 無 念 為 宗 無 著 
X25n0483_001:0171b05	為用。佛恐人心存四果之念萌於其間。以障其道。	為 用 佛 恐 人 心 存 四 果 之 念 萌 於 其 間 以 障 其 道 
X25n0483_001:0171b06	故設此四果而問。須菩提皆以不也答之。復為辨	故 設 此 四 果 而 問 須 菩 提 皆 以 不 也 答 之 復 為 辨 
X25n0483_001:0171b07	論。若以事言之。則有果有相。若以理言之。則非果	論 若 以 事 言 之 則 有 果 有 相 若 以 理 言 之 則 非 果 
X25n0483_001:0171b08	非相。斷三結。得須陀洹果。不墮三惡。人天七返。永	非 相 斷 三 結 得 須陀洹果 不 墮 三 惡 人 天 七 返 永 
X25n0483_001:0171b09	斷諸苦。入於涅槃。名為入流者。心不入六塵之境。	斷 諸 苦 入 於 涅 槃 名 為 入 流 者 心 不 入 六 塵 之 境 
X25n0483_001:0171b10	初流入聖地。是名須陀洹也。	初 流 入 聖 地 是 名 須 陀 洹 也 
X25n0483_001:0171b11	須菩提。於意云何。斯陀含能作是念。我得斯陀含果	須 菩 提 於意云何 斯 陀 含 能 作 是 念 我 得 斯陀含果 
X25n0483_001:0171b12	不(音否)須菩提言。不(音弗)也。世尊。何以故。斯陀含名一往	不 音 否 須 菩 提 言 不 音 弗 也 世 尊 何 以 故 斯 陀 含 名 一 往 
X25n0483_001:0171b13	來。而實無往來。是名斯陀含。	來 而 實 無 往 來 是 名 斯 陀 含 
X25n0483_001:0171b14	斷三結。薄貪嗔痴。得斯陀含果。永斷諸苦。樂證無	斷 三 結 薄 貪 嗔 痴 得 斯陀含果 永 斷 諸 苦 樂 證 無 
X25n0483_001:0171b15	為。名一往來者。一反生天上。一反生人間。便得涅	為 名 一 往 來 者 一 反 生 天 上 一 反 生 人 間 便 得 涅 
X25n0483_001:0171b16	槃。雖名往來而實無往來。是名斯陀含也。	槃 雖 名 往 來 而 實 無 往 來 是 名 斯 陀 含 也 
X25n0483_001:0171b17	須菩提。於意云何。阿那含能作是念。我得阿那含果	須 菩 提 於意云何 阿 那 含 能 作 是 念 我 得 阿那含果 
X25n0483_001:0171b18	不(音否)須菩提言。不(音弗)也。世尊。何以故。阿那含名為不	不 音 否 須 菩 提 言 不 音 弗 也 世 尊 何 以 故 阿 那 含 名 為 不 
