X25n0483_001:0176b15	須菩提。於意云何。如恒河中所有沙。佛說是沙不(音否)	須 菩 提 於意云何 如 恒 河 中 所 有 沙 佛 說 是 沙 不 音 否 
X25n0483_001:0176b16	如是。世尊。如來說是沙。須菩提。於意云何。如一恒河	如 是 世 尊 如 來 說 是 沙 須 菩 提 於意云何 如 一 恒 河 
X25n0483_001:0176b17	中所有沙。有如是沙等恒河。是諸恒河所有沙數。佛	中 所 有 沙 有 如 是 沙 等 恒 河 是 諸 恒 河 所 有 沙 數 佛 
X25n0483_001:0176b18	世界如是。寧為多不(音否)甚多。世尊。	世 界 如 是 寧 為 多 不 音 否 甚 多 世 尊 
X25n0483_001:0176b19	恒河者。舍衛國城外。有河名恒河也。河中之沙細	恒 河 者 舍 衛 國 城 外 有 河 名 恒 河 也 河 中 之 沙 細 
X25n0483_001:0176b20	如麵末。謂此恒河中有無量沙數。一粒之沙亦為	如 麵 末 謂 此 恒 河 中 有 無 量 沙 數 一 粒 之 沙 亦 為 
X25n0483_001:0176b21	一恒河也。如是諸沙等諸恒河。亦諸恒河中有無	一 恒 河 也 如 是 諸 沙 等 諸 恒 河 亦 諸 恒 河 中 有 無 
X25n0483_001:0176b22	量無數之沙。此說極多矣。言佛世界亦多之如此。	量 無 數 之 沙 此 說 極 多 矣 言 佛 世 界 亦 多 之 如 此 
X25n0483_001:0176b23	佛以恒沙世界言之。甚多耳。	佛 以 恒 沙 世 界 言 之 甚 多 耳 
X25n0483_001:0176b24	佛告須菩提。爾所國土中。所有眾生。若干種心。如來	佛 告 須 菩 提 爾 所 國 土 中 所 有 眾 生 若 干 種 心 如 來 
X25n0483_001:0176c01	悉知。	悉 知 
X25n0483_001:0176c02	若干者。干是不俱之數也。所有恒沙世界國土。盡	若 干 者 干 是 不 俱 之 數 也 所 有 恒 沙 世 界 國 土 盡 
X25n0483_001:0176c03	因眾生妄業所感而生。眾生諸心。如來悉知者。凡	因 眾 生 妄 業 所 感 而 生 眾 生 諸 心 如 來 悉 知 者 凡 
X25n0483_001:0176c04	眾生妄心。因業引起。而有業識妄想。盡依真體發	眾 生 妄 心 因 業 引 起 而 有 業 識 妄 想 盡 依 真 體 發 
X25n0483_001:0176c05	現。故楞嚴云。迷妄有虗空。因空立世界。想澄成國	現 故 楞 嚴 云 迷 妄 有 虗 空 因 空 立 世 界 想 澄 成 國 
X25n0483_001:0176c06	土。知覺乃眾生。但有塵緣妄想。悉依心現。故云如	土 知 覺 乃 眾 生 但 有 塵 緣 妄 想 悉 依 心 現 故 云 如 
X25n0483_001:0176c07	來悉知也。	來 悉 知 也 
X25n0483_001:0176c08	何以故。如來說。諸心皆為非心。是名為心。所以者何。	何 以 故 如 來 說 諸 心 皆 為 非 心 是 名 為 心 所以者何 
X25n0483_001:0176c09	須菩提。過去心不可得。現在心不可得。未來心不可	須 菩 提 過 去 心 不 可 得 現 在 心 不 可 得 未 來 心 不 可 
X25n0483_001:0176c10	得。	得 
X25n0483_001:0176c11	凡有心識。盡隨業生。無有實體。遇緣即生。緣消即	凡 有 心 識 盡 隨 業 生 無 有 實 體 遇 緣 即 生 緣 消 即 
X25n0483_001:0176c12	滅。故說非心是名為心矣。三心亦非有也。故論云。	滅 故 說 非 心 是 名 為 心 矣 三 心 亦 非 有 也 故 論 云 
X25n0483_001:0176c13	過去已滅。未來未至。現在空寂。三世求之了不可	過 去 已 滅 未 來 未 至 現 在 空 寂 三 世 求 之 了 不 可 
X25n0483_001:0176c14	得。楞嚴註云。三際求心心不有。心不有處妄原無。	得 楞 嚴 註 云 三 際 求 心 心 不 有 心 不 有 處 妄 原 無 
X25n0483_001:0176c15	妄心無處即菩提。生死涅槃本平等。	妄 心 無 處 即 菩 提 生死涅槃 本 平 等 
X25n0483_001:0176c16	○法身通化分第十九	 法 身 通 化 分 第 十 九 
X25n0483_001:0176c17	須菩提。於意云何。若有人滿三千大千世界七寶以	須 菩 提 於意云何 若 有 人 滿 三千大千世界 七 寶 以 
X25n0483_001:0176c18	用布施。是人以是因緣。得福多不(音否)如是。世尊。此人	用 布 施 是 人 以是因緣 得 福 多 不 音 否 如 是 世 尊 此 人 
X25n0483_001:0176c19	以是因緣。得福甚多。須菩提。若福德有實。如來不說	以是因緣 得 福 甚 多 須 菩 提 若 福 德 有 實 如 來 不 說 
X25n0483_001:0176c20	得福德多。以福德無故。如來說得福德多。	得 福 德 多 以 福 德 無 故 如 來 說 得 福 德 多 
X25n0483_001:0176c21	因緣得福者。福因修布而生。言福德無者。福因緣	因 緣 得 福 者 福 因 修 布 而 生 言 福 德 無 者 福 因 緣 
X25n0483_001:0176c22	消而滅。惟有法體週圓。融通無礙。是真福德也。	消 而 滅 惟 有 法 體 週 圓 融 通 無 礙 是 真 福 德 也 
X25n0483_001:0176c23	○離色離相分第二十	 離 色 離 相 分 第 二 十 
X25n0483_001:0176c24	須菩提。於意云何。佛可以具足色身見不(音否)不(音弗)也。	須 菩 提 於意云何 佛 可 以 具足色身 見 不 音 否 不 音 弗 也 
X25n0483_001:0177a01	世尊。如來不應以具足色身見。何以故。如來說。具足	世 尊 如 來 不 應 以 具足色身 見 何 以 故 如 來 說 具 足 
X25n0483_001:0177a02	色身。即非具足色身。是名具足色身。須菩提。於意云	色 身 即 非 具足色身 是 名 具足色身 須 菩 提 於 意 云 
X25n0483_001:0177a03	何。如來可以具足諸相見不(音否)不(音弗)也。世尊。如來不	何 如 來 可 以 具 足 諸 相 見 不 音 否 不 音 弗 也 世 尊 如 來 不 
X25n0483_001:0177a04	應以具足諸相見。何以故。如來說。諸相具足。即非具	應 以 具 足 諸 相 見 何 以 故 如 來 說 諸 相 具 足 即 非 具 
X25n0483_001:0177a05	足。是名諸相具足。	足 是 名 諸 相 具 足 
X25n0483_001:0177a06	佛者。覺也。具足色身諸相者。言具足報身三十二	佛 者 覺 也 具足色身 諸 相 者 言 具 足 報 身 三 十 二 
X25n0483_001:0177a07	相也。此覺心如海。身相如漚。若人著身相求見真	相 也 此 覺 心 如 海 身 相 如 漚 若 人 著 身 相 求 見 真 
X25n0483_001:0177a08	佛。誠為認漚為海也。身相總歸幻化。雖然身相具	佛 誠 為 認 漚 為 海 也 身 相 總 歸 幻 化 雖 然 身 相 具 
X25n0483_001:0177a09	足。佛言即非具足。是名身相具足也。	足 佛 言 即 非 具 足 是 名 身 相 具 足 也 
X25n0483_001:0177a10	○非說所說分第二十一	 非 說 所 說 分 第 二 十 一 
X25n0483_001:0177a11	須菩提。汝勿謂如來作是念。我當有所說法。莫作是	須 菩 提 汝 勿 謂 如 來 作 是 念 我 當 有 所 說 法 莫 作 是 
X25n0483_001:0177a12	念。何以故。若人言。如來有所說法。即為謗佛。不能解	念 何 以 故 若 人 言 如 來 有 所 說 法 即 為 謗 佛 不 能 解 
X25n0483_001:0177a13	我所說故。須菩提。說法者。無法可說。是名說法。	我 所 說 故 須 菩 提 說 法 者 無 法 可 說 是 名 說 法 
X25n0483_001:0177a14	勿者。止也。佛說。此一卷金剛般若之法。恐人心生	勿 者 止 也 佛 說 此 一 卷 金 剛 般 若 之 法 恐 人 心 生 
X25n0483_001:0177a15	說法之念。故誡須菩提。莫謂如來有說法之念。謗	說 法 之 念 故 誡 須 菩 提 莫 謂 如 來 有 說 法 之 念 謗 
X25n0483_001:0177a16	者。妄言也。言人不能解其覺體本淨。無有法念。妄	者 妄 言 也 言 人 不 能 解 其 覺 體 本 淨 無 有 法 念 妄 
X25n0483_001:0177a17	言佛有此說法之念。若心無一法。是真說法也。故	言 佛 有 此 說 法 之 念 若 心 無 一 法 是 真 說 法 也 故 
X25n0483_001:0177a18	維摩經云。法無眾生。離眾生垢。故法無有我。離我	維 摩 經 云 法 無 眾 生 離 眾 生 垢 故 法 無 有 我 離 我 
X25n0483_001:0177a19	垢。故法無壽命。離生死。故法無有人前後際斷。故	垢 故 法 無 壽 命 離 生 死 故 法 無 有 人 前後際斷 故 
X25n0483_001:0177a20	離此諸緣。何法可說。故此真空法體。無法可說。是	離 此 諸 緣 何 法 可 說 故 此 真 空 法 體 無 法 可 說 是 
X25n0483_001:0177a21	名為說也。	名 為 說 也 
X25n0483_001:0177a22	爾時。慧命須菩提白佛言。世尊。頗有眾生。於未來世。	爾 時 慧 命 須 菩 提 白 佛 言 世 尊 頗 有 眾 生 於未來世 
X25n0483_001:0177a23	聞說是法。生信心不(音否)佛言。須菩提。彼非眾生。非不	聞 說 是 法 生 信 心 不 音 否 佛 言 須 菩 提 彼 非 眾 生 非 不 
X25n0483_001:0177a24	眾生。何以故。須菩提。眾生眾生者。如來說非眾生。是	眾 生 何 以 故 須 菩 提 眾 生 眾 生 者 如 來 說 非 眾 生 是 
X25n0483_001:0177b01	名眾生。	名 眾 生 
X25n0483_001:0177b02	須菩提得佛智慧。故稱慧命也。問言。倘未來之世。	須 菩 提 得 佛 智 慧 故 稱 慧 命 也 問 言 倘 未 來 之 世 
X25n0483_001:0177b03	若眾生聞此真心無說之法。亦能信否。佛知須菩	若 眾 生 聞 此 真 心 無 說 之 法 亦 能 信 否 佛 知 須 菩 
X25n0483_001:0177b04	提心起眾生之念。故答云。彼非眾生。非不眾生。彼	提 心 起 眾 生 之 念 故 答 云 彼 非 眾 生 非 不 眾 生 彼 
X25n0483_001:0177b05	非眾生者。指未來眾生。非實眾生也。非不眾生者。	非 眾 生 者 指 未 來 眾 生 非 實 眾 生 也 非 不 眾 生 者 
X25n0483_001:0177b06	言此眾生因業感報而生也。眾生雖妄。亦依真有。	言 此 眾 生 因 業 感 報 而 生 也 眾 生 雖 妄 亦 依 真 有 
X25n0483_001:0177b07	乃生佛同原惟隔迷悟。但去執情。眾生即佛矣。故	乃 生 佛 同 原 惟 隔 迷 悟 但 去 執 情 眾 生 即 佛 矣 故 
X25n0483_001:0177b08	華嚴論云。一切眾生。本來成佛。云眾生眾生者。乃	華 嚴 論 云 一 切 眾 生 本 來 成 佛 云 眾 生 眾 生 者 乃 
X25n0483_001:0177b09	佛審問須菩提言。汝以眾生為眾生。佛言。我如來	佛 審 問 須 菩 提 言 汝 以 眾 生 為 眾 生 佛 言 我 如 來 
X25n0483_001:0177b10	說。眾生非眾生也。	說 眾 生 非 眾 生 也 
X25n0483_001:0177b11	○無法可得分第二十二	 無 法 可 得 分 第 二 十 二 
X25n0483_001:0177b12	須菩提白佛言。世尊。佛得阿耨(音奴入聲)多羅三(音渺)藐三	須 菩 提 白 佛 言 世 尊 佛 得 阿 耨 音 奴 入 聲 多 羅 三 音 渺 藐 三 
X25n0483_001:0177b13	菩提。為無所得耶。如是。如是。須菩提。我於阿耨多羅	菩 提 為 無 所 得 耶 如 是 如 是 須 菩 提 我 於 阿 耨 多 羅 
X25n0483_001:0177b14	三藐(音渺)三菩提乃至無有少法可得。是名阿耨(音奴入聲)	三 藐 音 渺 三 菩 提 乃 至 無 有 少 法 可 得 是 名 阿 耨 音 奴 入 聲 
X25n0483_001:0177b15	多羅三藐(音渺)三菩提。	多 羅 三 藐 音 渺 三 菩 提 
X25n0483_001:0177b16	須菩提深悟菩提體上實無所得。佛先許其契理	須 菩 提 深 悟 菩 提 體 上 實 無 所 得 佛 先 許 其 契 理 
X25n0483_001:0177b17	的當。後亦引淺至深。言我於此理。亦無少法可得。	的 當 後 亦 引 淺 至 深 言 我 於 此 理 亦 無 少 法 可 得 
X25n0483_001:0177b18	菩提亦是虗名也。	菩 提 亦 是 虗 名 也 
X25n0483_001:0177b19	○淨心行善分第二十三	 淨 心 行 善 分 第 二 十 三 
X25n0483_001:0177b20	復次。須菩提。是法平等。無有高下。是名阿耨(音奴入聲)多	復 次 須 菩 提 是 法 平 等 無有高下 是 名 阿 耨 音 奴 入 聲 多 
X25n0483_001:0177b21	羅三藐(音渺)三菩提。	羅 三 藐 音 渺 三 菩 提 
X25n0483_001:0177b22	是法平等者。此法無物不有。無時不然矣。法本無	是 法 平 等 者 此 法 無 物 不 有 無 時 不 然 矣 法 本 無 
X25n0483_001:0177b23	高下。奈業有差殊。若人有一念之善。福即隨生。報	高 下 奈 業 有 差 殊 若 人 有 一 念 之 善 福 即 隨 生 報 
X25n0483_001:0177b24	感人天之樂。若有一念之惡。罪即隨至。報感三途	感 人 天 之 樂 若 有 一 念 之 惡 罪 即 隨 至 報 感 三 途 
X25n0483_001:0177c01	之苦。故法體平等。高下由業自生。即此平等之法。	之 苦 故 法 體 平 等 高 下 由 業 自 生 即 此 平 等 之 法 
X25n0483_001:0177c02	是名菩提之正因也。	是 名 菩 提 之 正 因 也 
X25n0483_001:0177c03	以無我．無人．無眾生．無壽者。修一切善法。即得阿耨	以 無 我 無 人 無 眾 生 無 壽 者 修 一 切 善 法 即 得 阿 耨 
X25n0483_001:0177c04	(音奴入聲)多羅三藐(音渺)三菩提。	 音 奴 入 聲 多 羅 三 藐 音 渺 三 菩 提 
X25n0483_001:0177c05	修一切善法者。當修四聖諦十二因緣。六度萬行。	修 一 切 善 法 者 當 修 四 聖 諦 十二因緣 六 度 萬 行 
X25n0483_001:0177c06	三十七品助道法。五十五種菩提路。此一切法俱	三十七品助道法 五 十 五 種 菩 提 路 此 一 切 法 俱 
X25n0483_001:0177c07	名善法也。若人空其四相。修諸善法。潔淨其心。即	名 善 法 也 若 人 空 其 四 相 修 諸 善 法 潔 淨 其 心 即 
X25n0483_001:0177c08	得證此菩提妙果矣。	得 證 此 菩 提 妙 果 矣 
X25n0483_001:0177c09	須菩提。所言善法者。如來說非善法。是名善法。	須 菩 提 所 言 善 法 者 如 來 說 非 善 法 是 名 善 法 
X25n0483_001:0177c10	善法雖美。法體實無。纔生貪染。便瞖菩提。故云黃	善 法 雖 美 法 體 實 無 纔 生 貪 染 便 瞖 菩 提 故 云 黃 
X25n0483_001:0177c11	金雖至寶。入眼亦如塵。	金 雖 至 寶 入 眼 亦 如 塵 
X25n0483_001:0177c12	○福智無比分第二十四	 福 智 無 比 分 第 二 十 四 
X25n0483_001:0177c13	須菩提。若三千大千世界中所有諸須彌山王。如是	須 菩 提 若 三千大千世界 中 所 有 諸 須 彌 山 王 如 是 
X25n0483_001:0177c14	等七寶聚。有人持用布施。若人以此般若波羅蜜經。	等 七 寶 聚 有 人 持用布施 若 人 以 此 般若波羅蜜經 
X25n0483_001:0177c15	乃至四句偈等。受持．讀誦．為他人說。於前福德百分	乃 至 四 句 偈 等 受 持 讀 誦 為 他 人 說 於 前 福 德 百 分 
X25n0483_001:0177c16	不及一。千萬億分。乃至筭數譬喻所不能及。	不 及 一 千萬億分 乃 至 筭 數 譬 喻 所 不 能 及 
X25n0483_001:0177c17	所謂三千大千世界中須彌山者。總而言之。有百	所 謂 三千大千世界 中 須 彌 山 者 總 而 言 之 有 百 
X25n0483_001:0177c18	德日月百億須彌是也。言此多為須彌山之七寶	德 日 月 百 億 須 彌 是 也 言 此 多 為 須 彌 山 之 七 寶 
X25n0483_001:0177c19	布施之福。與般若真智為人演說之福。佛言。千萬	布 施 之 福 與 般 若 真 智 為 人 演 說 之 福 佛 言 千 萬 
X25n0483_001:0177c20	億分莫及其一矣。以此福德與智慧較之。誠乃無	億 分 莫 及 其 一 矣 以 此 福 德 與 智 慧 較 之 誠 乃 無 
X25n0483_001:0177c21	比無極也。	比 無 極 也 
X25n0483_001:0177c22	○化無所化分第二十五	 化 無 所 化 分 第 二 十 五 
X25n0483_001:0177c23	須菩提。於意云何。汝等勿謂如來作是念。我當度眾	須 菩 提 於意云何 汝 等 勿 謂 如 來 作 是 念 我 當 度 眾 
X25n0483_001:0177c24	生。須菩提。莫作是念。何以故。實無有眾生如來度者。	生 須 菩 提 莫 作 是 念 何 以 故 實 無 有 眾 生 如 來 度 者 
X25n0483_001:0178a01	若有眾生如來度者。如來即有我人眾生壽者。	若 有 眾 生 如 來 度 者 如 來 即 有 我 人 眾 生 壽 者 
X25n0483_001:0178a02	佛止須菩提言。莫謂如來有度生之念也。如來者。	佛 止 須 菩 提 言 莫 謂 如 來 有 度 生 之 念 也 如 來 者 
X25n0483_001:0178a03	真如體也。眾生者。情識也。言真如體上實無情識。	真 如 體 也 眾 生 者 情 識 也 言 真 如 體 上 實 無 情 識 
X25n0483_001:0178a04	既有情識。則有四相矣。	既 有 情 識 則 有 四 相 矣 
X25n0483_001:0178a05	須菩提。如來說。有我者。即非有我。而凡夫之人以為	須 菩 提 如 來 說 有 我 者 即 非 有 我 而 凡 夫 之 人 以 為 
X25n0483_001:0178a06	有我。須菩提。凡夫者。如來說即非凡夫是名凡夫。	有 我 須 菩 提 凡 夫 者 如 來 說 即 非 凡 夫 是 名 凡 夫 
X25n0483_001:0178a07	今如來說我者。乃權也。亦非有我之念。故頌云。利	今 如 來 說 我 者 乃 權 也 亦 非 有 我 之 念 故 頌 云 利 
X25n0483_001:0178a08	生權立我。證理實無人。此凡夫執著。認相為我。古	生 權 立 我 證 理 實 無 人 此 凡 夫 執 著 認 相 為 我 古 
X25n0483_001:0178a09	云。色身非我。任為我法身。真我而不任。是以凡夫	云 色 身 非 我 任 為 我 法 身 真 我 而 不 任 是 以 凡 夫 
X25n0483_001:0178a10	無實體。故說非凡夫也。	無 實 體 故 說 非 凡 夫 也 
X25n0483_001:0178a11	○法身非相分第二十六	 法 身 非 相 分 第 二 十 六 
X25n0483_001:0178a12	須菩提。於意云何。可以三十二相觀如來不(音否)須菩	須 菩 提 於意云何 可 以 三十二相 觀 如 來 不 音 否 須 菩 
X25n0483_001:0178a13	提言。如是。如是。以三十二相觀如來。佛言。須菩提。若	提 言 如 是 如 是 以 三十二相 觀 如 來 佛 言 須 菩 提 若 
X25n0483_001:0178a14	以三十二相觀如來者。轉輪聖王即是如來。須菩提	以 三十二相 觀 如 來 者 轉輪聖王 即 是 如 來 須 菩 提 
X25n0483_001:0178a15	白佛言。世尊。如我解佛所說義。不應以三十二相觀	白 佛 言 世 尊 如 我 解 佛 所 說 義 不 應 以 三十二相 觀 
X25n0483_001:0178a16	如來。爾時。世尊而說偈言。若以色見我。以音聲求我。	如 來 爾 時 世 尊 而 說 偈 言 若 以 色 見 我 以 音 聲 求 我 
X25n0483_001:0178a17	是人行邪道。不能見如來。	是 人 行 邪 道 不 能 見 如 來 
X25n0483_001:0178a18	三十二相。佛之報身。如來法身非相也。須菩提以	三十二相 佛 之 報 身 如來法身 非 相 也 須 菩 提 以 
X25n0483_001:0178a19	三十二相觀佛法身者。執波為水也。故佛說。若認	三十二相 觀 佛 法 身 者 執 波 為 水 也 故 佛 說 若 認 
X25n0483_001:0178a20	相為佛者。轉輪聖王亦佛也。轉輪聖王亦有三十	相 為 佛 者 轉輪聖王 亦 佛 也 轉輪聖王 亦 有 三 十 
X25n0483_001:0178a21	二相報身矣。須菩提亦言。不當三十二相觀佛法	二 相 報 身 矣 須 菩 提 亦 言 不 當 三十二相 觀 佛 法 
X25n0483_001:0178a22	身者。是撥波求水也。未明水之真體。故此經云。聲	身 者 是 撥 波 求 水 也 未 明 水 之 真 體 故 此 經 云 聲 
X25n0483_001:0178a23	色者。傍外之門。非真佛體也。若人著相離相者。即	色 者 傍 外 之 門 非 真 佛 體 也 若 人 著 相 離 相 者 即 
X25n0483_001:0178a24	是邪外之道。實不能見真佛法身也。頌云。聲色見	是 邪 外 之 道 實 不 能 見 真 佛 法 身 也 頌 云 聲 色 見 
X25n0483_001:0178b01	聞皆是妄。真空無相鏡非臺。四八身中尋得佛。轉	聞 皆 是 妄 真 空 無 相 鏡 非 臺 四 八 身 中 尋 得 佛 轉 
X25n0483_001:0178b02	輪王相即如來。	輪 王 相 即 如 來 
X25n0483_001:0178b03	○無斷無滅分第二十七	 無 斷 無 滅 分 第 二 十 七 
X25n0483_001:0178b04	須菩提。汝若作是念。如來不以具足相故得阿耨(音奴	須 菩 提 汝 若 作 是 念 如 來 不 以 具 足 相 故 得 阿 耨 音 奴 
X25n0483_001:0178b05	入聲)多羅三藐(音渺)三菩提須菩提莫作是念如來不以	入 聲 多 羅 三 藐 音 渺 三 菩 提 須 菩 提 莫 作 是 念 如 來 不 以 
X25n0483_001:0178b06	具足相故得阿耨多羅三藐三菩提。	具 足 相 故 得阿耨多羅三藐三菩提 
X25n0483_001:0178b07	此一章。承上章而言也。以者。當作是也。須菩提前	此 一 章 承 上 章 而 言 也 以 者 當 作 是 也 須 菩 提 前 
X25n0483_001:0178b08	言以三十二相觀如來心者。是常見之所惑。後言	言 以 三十二相 觀 如 來 心 者 是 常 見 之 所 惑 後 言 
X25n0483_001:0178b09	以不應以三十二相觀如來心者。是斷見之所失	以 不 應 以 三十二相 觀 如 來 心 者 是 斷 見 之 所 失 
X25n0483_001:0178b10	也。佛恐人陷於斷常見中。故作此問。呼須菩提徵	也 佛 恐 人 陷 於 斷 常 見 中 故 作 此 問 呼 須 菩 提 徵 
X25n0483_001:0178b11	之。汝若作是念謂佛不是具足相中得菩提心者	之 汝 若 作 是 念 謂 佛 不 是 具 足 相 中 得 菩 提 心 者 
X25n0483_001:0178b12	此言心相乖違生斷滅之見也。豈不見心經云色	此 言 心 相 乖 違 生 斷 滅 之 見 也 豈 不 見 心 經 云 色 
X25n0483_001:0178b13	不異空空不異色故云即波即水即妄即真何得	不 異 空 空不異色 故 云 即 波 即 水 即 妄 即 真 何 得 
X25n0483_001:0178b14	除此身相之外而別有菩提心也佛誡之莫作是	除 此 身 相 之 外 而 別 有 菩 提 心 也 佛 誡 之 莫 作 是 
X25n0483_001:0178b15	念者勿謂佛不是具足相中得菩提心也。	念 者 勿 謂 佛 不 是 具 足 相 中 得 菩 提 心 也 
X25n0483_001:0178b16	須菩提汝若作是念發阿耨(音奴入聲)多羅三藐(音渺)三菩	須 菩 提 汝 若 作 是 念 發 阿 耨 音 奴 入 聲 多 羅 三 藐 音 渺 三 菩 
X25n0483_001:0178b17	提心者說諸法斷滅莫作是念何以故發阿耨多羅	提 心 者 說 諸 法 斷 滅 莫 作 是 念 何 以 故 發 阿 耨 多 羅 
X25n0483_001:0178b18	三藐三菩提心者於法不說斷滅相。	三藐三菩提 心 者 於 法 不 說 斷 滅 相 
X25n0483_001:0178b19	汝若作無相。發菩提心之念者。言相非心而心非	汝 若 作 無 相 發菩提心 之 念 者 言 相 非 心 而 心 非 
X25n0483_001:0178b20	相。說諸法斷滅。重誡之莫作此無相得心之念。何	相 說 諸 法 斷 滅 重 誡 之 莫 作 此 無 相 得 心 之 念 何 
X25n0483_001:0178b21	以故。若發大菩提心之人。於諸法相無罣無礙。不	以 故 若 發 大菩提心 之 人 於 諸 法 相 無 罣 無 礙 不 
X25n0483_001:0178b22	著不離不說斷滅相也。	著 不 離 不 說 斷 滅 相 也 
X25n0483_001:0178b23	○不受不貪分第二十八	 不 受 不 貪 分 第 二 十 八 
X25n0483_001:0178b24	須菩提。若菩薩以滿恒河沙等世界七寶持用布施。	須 菩 提 若 菩 薩 以 滿 恒 河 沙 等 世 界 七 寶 持用布施 
X25n0483_001:0178c01	若復有人知一切法無我。得成於忍。此菩薩勝前菩	若 復 有 人 知一切法 無 我 得 成 於 忍 此 菩 薩 勝 前 菩 
X25n0483_001:0178c02	薩所得功德。何以故。須菩提。以諸菩薩不受福德故。	薩 所得功德 何 以 故 須 菩 提 以 諸 菩 薩 不 受 福 德 故 
X25n0483_001:0178c03	知一切法無我者。法本無我。是人妄生分別。以為	知一切法 無 我 者 法 本 無 我 是 人 妄 生 分 別 以 為 
X25n0483_001:0178c04	有我。若人知心無法知法。非我如此。則聖凡情盡。	有 我 若 人 知 心 無 法 知 法 非 我 如 此 則 聖 凡 情 盡 
X25n0483_001:0178c05	能所見消。即得成無生法忍。直證菩提。何干福德	能 所 見 消 即 得 成 無生法忍 直 證 菩 提 何 干 福 德 
X25n0483_001:0178c06	也。	也 
X25n0483_001:0178c07	須菩提白佛言。世尊。云何菩薩不受福德。須菩提。菩	須 菩 提 白 佛 言 世 尊 云 何 菩 薩 不 受 福 德 須 菩 提 菩 
X25n0483_001:0178c08	薩所作福德。不應貪著。是故說不受福德。	薩 所 作 福 德 不應貪著 是 故 說 不 受 福 德 
X25n0483_001:0178c09	菩薩心空無法。於福不著。若著福德。福德亦是法	菩 薩 心 空 無 法 於 福 不 著 若 著 福 德 福 德 亦 是 法 
X25n0483_001:0178c10	矣。故云。但能萬法不相干。一超直入如來地。	矣 故 云 但 能 萬 法 不 相 干 一 超 直 入如來地 
X25n0483_001:0178c11	○威儀寂靜分第二十九	 威儀寂靜 分 第 二 十 九 
X25n0483_001:0178c12	　威儀自威儀　　寂處有誰知　　若作威儀相	 威 儀 自 威 儀 寂 處 有 誰 知 若 作 威 儀 相 
X25n0483_001:0178c13	　大象沒深泥	 大 象 沒 深 泥 
X25n0483_001:0178c14	須菩提。若有人言。如來若來若去．若坐若臥。是人不	須 菩 提 若 有 人 言 如 來 若 來 若 去 若 坐 若 臥 是 人 不 
X25n0483_001:0178c15	解我所說義。何以故。如來者。無所從來。亦無所去。故	解 我 所 說 義 何 以 故 如 來 者 無所從來 亦 無 所 去 故 
X25n0483_001:0178c16	名如來。	名 如 來 
X25n0483_001:0178c17	如來者。佛真法身也。遍滿虗空。實無來去。今言此	如 來 者 佛 真 法 身 也 遍 滿 虗 空 實 無 來 去 今 言 此 
X25n0483_001:0178c18	來去坐臥者。來為法生。去為法滅。來去是法。坐臥	來 去 坐 臥 者 來 為 法 生 去 為 法 滅 來 去 是 法 坐 臥 
X25n0483_001:0178c19	是相。豈其佛法身而有來去耶。若人言此法身有	是 相 豈 其 佛 法 身 而 有 來 去 耶 若 人 言 此 法 身 有 
X25n0483_001:0178c20	此來去者。是未解實義也。故如來說無所來去也。	此 來 去 者 是 未 解 實 義 也 故 如 來 說 無 所 來 去 也 
X25n0483_001:0178c21	古德云。來為眾生來。去為眾生去。法身等虗空住	古 德 云 來 為 眾 生 來 去 為 眾 生 去 法 身 等 虗 空 住 
X25n0483_001:0178c22	在無心處。	在 無 心 處 
