X26n0520_002:0557b23	遠劫也。達磨經頌云。無始時來界。一切法等依。而	遠 劫 也 達 磨 經 頌 云 無始時來 界 一 切 法 等 依 而 
X26n0520_002:0557b24	言異於木石者。謂此賴耶緣三種境故。今依性宗。	言 異 於 木 石 者 謂 此 賴 耶 緣 三 種 境 故 今 依 性 宗 
X26n0520_002:0557c01	觀諸有情。阿賴耶識。依如來藏。而具真知。即異木	觀 諸 有 情 阿賴耶識 依 如 來 藏 而 具 真 知 即 異 木 
X26n0520_002:0557c02	石。故密嚴云。佛說如來藏。世間阿賴耶。全同起信。	石 故 密 嚴 云 佛 說 如 來 藏 世 間 阿 賴 耶 全 同 起 信 
X26n0520_002:0557c03	如來藏與生滅和合。為阿賴耶識。既言生滅。即此	如 來 藏 與 生 滅 和 合 為 阿賴耶識 既 言 生 滅 即 此 
X26n0520_002:0557c04	初剎那識矣。△二隨識生染淨。	初 剎 那 識 矣 二 隨 識 生 染 淨 
X26n0520_002:0557c05	生得染淨。各自能為無量無數染淨識本。	生 得 染 淨 各 自 能 為 無量無數 染 淨 識 本 
X26n0520_002:0557c06	亦約二宗以釋。起信論謂。若心有動。則有過恒沙	亦 約 二 宗 以 釋 起 信 論 謂 若 心 有 動 則 有 過 恒 沙 
X26n0520_002:0557c07	等妄染之義。即同生得無量無數染識本故。論又	等 妄 染 之 義 即 同 生 得 無量無數 染 識 本 故 論 又 
X26n0520_002:0557c08	謂。對此義故。心性無動。即有過恒沙等諸佛功德	謂 對 此 義 故 心 性 無 動 即 有 過 恒 沙 等 諸 佛 功 德 
X26n0520_002:0557c09	相義示現。即同生得無量無數淨識本故。上依性	相 義 示 現 即 同 生 得 無量無數 淨 識 本 故 上 依 性 
X26n0520_002:0557c10	宗釋之。若約相宗。由此有諸趣及涅槃證得。皆由	宗 釋 之 若 約 相 宗 由 此 有 諸 趣 及 涅 槃 證 得 皆 由 
X26n0520_002:0557c11	染淨識本耳。△三約證示地位。	染 淨 識 本 耳 三 約 證 示 地 位 
X26n0520_002:0557c12	從初剎那。不可說劫。	從 初 剎 那 不 可 說 劫 
X26n0520_002:0557c13	從初剎那。生淨識本。經不可說劫。即信賢十地諸	從 初 剎 那 生 淨 識 本 經 不 可 說 劫 即 信 賢 十 地 諸 
X26n0520_002:0557c14	位。如下文云。復次法雲地菩薩。從發信心。經百萬	位 如 下 文 云 復 次 法 雲 地 菩 薩 從 發 信 心 經 百 萬 
X26n0520_002:0557c15	阿僧祇劫。廣集無量助道法。增長無邊大福智。是	阿僧祇劫 廣 集 無 量 助 道 法 增 長 無 邊 大 福 智 是 
X26n0520_002:0557c16	也。	也 
X26n0520_002:0557c17	乃至金剛終一剎那。	乃 至 金 剛 終 一 剎 那 
X26n0520_002:0557c18	即等覺位。以金剛喻定最後一剎那。斷佛地障。即	即 等 覺 位 以 金 剛 喻 定 最 後 一 剎 那 斷 佛 地 障 即 
X26n0520_002:0557c19	入玅覺。△四約修辨諸假。於中八段。歷觀斯文。亦	入 玅 覺 四 約 修 辨 諸 假 於 中 八 段 歷 觀 斯 文 亦 
X26n0520_002:0557c20	具從空入假。雙觀真俗。如下文云。色心二法。如夢	具 從 空 入 假 雙 觀 真 俗 如 下 文 云 色 心 二 法 如 夢 
X26n0520_002:0557c21	所見。即真諦明空觀。三世善惡。如空中雲。即俗諦	所 見 即 真 諦 明 空 觀 三 世 善 惡 如 空 中 雲 即 俗 諦 
X26n0520_002:0557c22	明假觀。然修空觀成大智。則不住生死。假觀成大	明 假 觀 然 修 空 觀 成 大 智 則 不 住 生 死 假 觀 成 大 
X26n0520_002:0557c23	悲。而不住涅槃。以真俗境不二悲智念不殊。成無	悲 而 不住涅槃 以 真 俗 境 不 二 悲 智 念 不 殊 成 無 
X26n0520_002:0557c24	住行。斯亦賢首心經略疏梗槩耳。今初法假如幻	住 行 斯 亦 賢 首 心 經 略 疏 梗 槩 耳 今 初 法 假 如 幻 
X26n0520_002:0558a01	化。文三。初妄識生色心。	化 文 三 初 妄 識 生 色 心 
X26n0520_002:0558a02	有不可說不可說識。生諸有情色心二法。	有 不可說不可說 識 生 諸 有 情 色 心 二 法 
X26n0520_002:0558a03	然此諸識。至聖方知。亦如阿僧祇品明不可說不	然 此 諸 識 至 聖 方 知 亦 如 阿 僧 祇 品 明 不 可 說 不 
X26n0520_002:0558a04	可說數量。唯佛能知能說耳。上合辨色心。下開成	可 說 數 量 唯 佛 能 知 能 說 耳 上 合 辨 色 心 下 開 成 
X26n0520_002:0558a05	五蘊。	五 蘊 
X26n0520_002:0558a06	色名色蘊。心名四蘊。皆積聚性。隱覆真實。	色 名 色 蘊 心 名 四 蘊 皆 積 聚 性 隱 覆 真 實 
X26n0520_002:0558a07	梵語塞健陀。近翻名蘊。古翻為陰。蘊是積聚。陰是	梵 語 塞 健 陀 近 翻 名 蘊 古 翻 為 陰 蘊 是 積 聚 陰 是 
X26n0520_002:0558a08	陰覆。故云皆積聚性。隱覆真實。△二色法生根大。	陰 覆 故 云 皆 積 聚 性 隱 覆 真 實 二 色 法 生 根 大 
X26n0520_002:0558a09	大王。此一色法。生無量色。	大 王 此 一 色 法 生 無 量 色 
X26n0520_002:0558a10	總標。	總 標 
X26n0520_002:0558a11	眼得為色。耳得為聲。鼻得為香。舌得為味。身得為觸。	眼 得 為 色 耳 得 為 聲 鼻 得 為 香 舌 得 為 味 身 得 為 觸 
X26n0520_002:0558a12	雖舉五根。但取五塵。	雖 舉 五 根 但 取 五 塵 
X26n0520_002:0558a13	堅持名地。津潤名水。煖性名火。輕動名風。	堅 持 名 地 津 潤 名 水 煖 性 名 火 輕 動 名 風 
X26n0520_002:0558a14	前顯所造四微。今明能造四大。	前 顯 所 造 四 微 今 明 能 造 四 大 
X26n0520_002:0558a15	生五識處。名五色根。	生 五 識 處 名 五 色 根 
X26n0520_002:0558a16	此五色根。皆以淨色為體。△三總結皆幻法。	此 五 色 根 皆 以 淨 色 為 體 三 總 結 皆 幻 法 
X26n0520_002:0558a17	如是展轉。一色一心。生不可說。無量色心。皆如幻故。	如 是 展 轉 一 色 一 心 生 不 可 說 無 量 色 心 皆 如 幻 故 
X26n0520_002:0558a18	從微至著。皆如幻故。然辨法假。幻喻為先者。幻法	從 微 至 著 皆 如 幻 故 然 辨 法 假 幻 喻 為 先 者 幻 法 
X26n0520_002:0558a19	總故。良以五天此術頗多。見聞既審。法理易明。及	總 故 良 以 五 天 此 術 頗 多 見 聞 既 審 法 理 易 明 及 
X26n0520_002:0558a20	傳此方。翻成難曉。若依古師解華嚴如幻之文。法	傳 此 方 翻 成 難 曉 若 依 古 師 解 華 嚴 如 幻 之 文 法 
X26n0520_002:0558a21	喻各開五法。備如彼疏。△二受假。如睡夢。	喻 各 開 五 法 備 如 彼 疏 二 受 假 如 睡 夢 
X26n0520_002:0558a22	善男子。有情之受。依世俗立。	善 男 子 有 情 之 受 依 世 俗 立 
X26n0520_002:0558a23	眾生妄心。有受有著。皆依俗諦。北山錄云。俗也者	眾 生 妄 心 有 受 有 著 皆 依 俗 諦 北 山 錄 云 俗 也 者 
X26n0520_002:0558a24	假有也。假有之有。謂之似有。	假 有 也 假 有 之 有 謂 之 似 有 
X26n0520_002:0558b01	若有若無。但生有情妄想憶念。	若有若無 但 生 有 情 妄 想 憶 念 
X26n0520_002:0558b02	有情想念。如世夢寤。想之即有。不念即無。	有 情 想 念 如 世 夢 寤 想 之 即 有 不 念 即 無 
X26n0520_002:0558b03	作業受果。皆名世諦。	作 業 受 果 皆 名 世 諦 
X26n0520_002:0558b04	作業有三種。一惡。二善。三不動。受報有三時。謂現	作 業有三種 一 惡 二 善 三 不 動 受 報 有 三 時 謂 現 
X26n0520_002:0558b05	報。生報。後報。	報 生 報 後 報 
X26n0520_002:0558b06	三界六趣。一切有情。	三 界 六 趣 一切有情 
X26n0520_002:0558b07	三界依報之土。六趣正報之身。下示受假姓名。	三 界 依 報 之 土 六 趣 正 報 之 身 下 示 受 假 姓 名 
X26n0520_002:0558b08	婆羅門。	婆 羅 門 
X26n0520_002:0558b09	此云外意。淨行種也。	此 云 外 意 淨 行 種 也 
X26n0520_002:0558b10	剎帝利。	剎 帝 利 
X26n0520_002:0558b11	此云田主。即王種也。	此 云 田 主 即 王 種 也 
X26n0520_002:0558b12	毗舍。	毗 舍 
X26n0520_002:0558b13	此云商估。	此 云 商 估 
X26n0520_002:0558b14	首陀。	首 陀 
X26n0520_002:0558b15	此云田農。	此 云 田 農 
X26n0520_002:0558b16	我人知見。	我 人 知 見 
X26n0520_002:0558b17	外道計也。	外 道 計 也 
X26n0520_002:0558b18	色法心法。	色 法 心 法 
X26n0520_002:0558b19	通小乘法。	通 小 乘 法 
X26n0520_002:0558b20	如夢所見。	如夢所見 
X26n0520_002:0558b21	夢見諸境。雖有受著。覺來都無。如諸有情受假亦	夢 見 諸 境 雖 有 受 著 覺 來 都 無 如 諸 有 情 受 假 亦 
X26n0520_002:0558b22	然。故天親論云。同於夢境。但唯念性故。△三名假。	然 故 天 親 論 云 同 於 夢 境 但 唯 念 性 故 三 名 假 
X26n0520_002:0558b23	如聲響。	如 聲 響 
X26n0520_002:0558b24	善男子。一切諸名。皆假施設。	善 男 子 一 切 諸 名 皆 假 施 設 
X26n0520_002:0558c01	起信亦云。以一切言說。假名無實。	起 信 亦 云 以 一 切 言 說 假 名 無 實 
X26n0520_002:0558c02	佛未出前。	佛 未 出 前 
X26n0520_002:0558c03	獨指能仁未出世前。	獨 指 能 仁 未 出 世 前 
X26n0520_002:0558c04	世諦幻法。無名無義。	世 諦 幻 法 無 名 無 義 
X26n0520_002:0558c05	無能召之名義。	無 能 召 之 名 義 
X26n0520_002:0558c06	亦無體相。	亦 無 體 相 
X26n0520_002:0558c07	亦無所召體相。	亦 無 所 召 體 相 
X26n0520_002:0558c08	無三界名。善惡果報。六趣名字。	無 三 界 名 善 惡 果 報 六 趣 名 字 
X26n0520_002:0558c09	善因樂果。惡因苦報。	善 因 樂 果 惡 因 苦 報 
X26n0520_002:0558c10	諸佛出現。為有情故。	諸 佛 出 現 為 有 情 故 
X26n0520_002:0558c11	則指一佛。今言諸佛。影略其文。	則 指 一 佛 今 言 諸 佛 影 略 其 文 
X26n0520_002:0558c12	說於三界。六趣染淨。無量名字。	說 於 三 界 六 趣 染 淨 無 量 名 字 
X26n0520_002:0558c13	說三界勝劣等處。共業所感。六趣苦樂等身。別業	說 三 界 勝 劣 等 處 共 業 所 感 六 趣 苦 樂 等 身 別 業 
X26n0520_002:0558c14	所感。染即四趣黑業。淨即人天白業。名如塵沙。故	所 感 染 即 四 趣 黑 業 淨 即 人 天 白 業 名 如 塵 沙 故 
X26n0520_002:0558c15	云無量。名即字耳。	云 無 量 名 即 字 耳 
X26n0520_002:0558c16	如是一切。如呼聲響。	如是一切 如 呼 聲 響 
X26n0520_002:0558c17	空谷之響。隨聲高低。喻於名假悉皆無體。故淨名	空 谷 之 響 隨 聲 高 低 喻 於 名 假 悉 皆 無 體 故 淨 名 
X26n0520_002:0558c18	云。所聞聲如響等。△四相續假。如陽燄。	云 所 聞 聲 如 響 等 四 相 續 假 如 陽 燄 
X26n0520_002:0558c19	諸法相續。	諸 法 相 續 
X26n0520_002:0558c20	相續不斷。如水涓涓。	相續不斷 如 水 涓 涓 
X26n0520_002:0558c21	念念不住。	念 念 不 住 
X26n0520_002:0558c22	前滅後生。如燈燄燄。	前 滅 後 生 如 燈 燄 燄 
X26n0520_002:0558c23	剎那剎那。非一非異。	剎 那 剎 那 非一非異 
X26n0520_002:0558c24	欲言其一。剎那生滅。欲言其異。相續無窮。	欲 言 其 一 剎 那 生 滅 欲 言 其 異 相 續 無 窮 
X26n0520_002:0559a01	速起速滅。非斷非常。	速 起 速 滅 非 斷 非 常 
X26n0520_002:0559a02	速起故非斷。速滅故非常。何者。若唯速起。起則是	速 起 故 非 斷 速 滅 故 非 常 何 者 若 唯 速 起 起 則 是 
X26n0520_002:0559a03	有。定有則常。若唯速滅。滅則是無。定無則斷。若深	有 定 有 則 常 若 唯 速 滅 滅 則 是 無 定 無 則 斷 若 深 
X26n0520_002:0559a04	求速起速滅。即是非斷非常。故知二義相成。	求 速 起 速 滅 即 是 非 斷 非 常 故 知 二 義 相 成 
X26n0520_002:0559a05	諸有為法。如陽燄故。	諸 有 為 法 如 陽 燄 故 
X26n0520_002:0559a06	春陽發生。郊野氣動。燄燄而起。喻有為法相續不	春 陽 發 生 郊 野 氣 動 燄 燄 而 起 喻 有 為 法 相 續 不 
X26n0520_002:0559a07	斷。然此陽氣。若謂是有。且非水體。若謂是無。能引	斷 然 此 陽 氣 若 謂 是 有 且 非 水 體 若 謂 是 無 能 引 
X26n0520_002:0559a08	渴者。故古詩云。渴鹿盡尋陽。△五觀待假。如電光。	渴 者 故 古 詩 云 渴 鹿 盡 尋 陽 五 觀 待 假 如 電 光 
X26n0520_002:0559a09	諸法相待。所謂色界。眼界。眼識界。	諸 法 相 待 所 謂 色 界 眼 界 眼 識 界 
X26n0520_002:0559a10	待謂對得。如眼界對色界。眼色和合。即有識生。	待 謂 對 得 如 眼 界 對 色 界 眼 色 和 合 即 有 識 生 
X26n0520_002:0559a11	乃至法界。意界。意識界。	乃 至 法 界 意 界 意 識 界 
X26n0520_002:0559a12	略舉初後。以例中間。故云乃至。	略 舉 初 後 以 例 中 間 故 云 乃 至 
X26n0520_002:0559a13	猶如電光。	猶 如 電 光 
X26n0520_002:0559a14	對待之法。有生有滅。喻如電光。故功德施云。觀察	對 待 之 法 有 生 有 滅 喻 如 電 光 故 功 德 施 云 觀 察 
X26n0520_002:0559a15	心如電。生時即滅。△六形待假。如第二月。	心 如 電 生 時 即 滅 六 形 待 假 如 第 二 月 
X26n0520_002:0559a16	不定相待。有無一異。	不 定 相 待 有 無 一 異 
X26n0520_002:0559a17	諸法不定。形待而立。有不自有。必待於無。無不自	諸 法 不 定 形 待 而 立 有 不 自 有 必 待 於 無 無 不 自 
X26n0520_002:0559a18	無。必待於有。其猶高下相形。是非相生。豈有定耶。	無 必 待 於 有 其 猶 高 下 相 形 是 非 相 生 豈 有 定 耶 
X26n0520_002:0559a19	又一不自一。對異立一。異不自異。對一立異。更相	又 一 不 自 一 對 異 立 一 異 不 自 異 對 一 立 異 更 相 
X26n0520_002:0559a20	對待。豈有體哉。	對 待 豈 有 體 哉 
X26n0520_002:0559a21	如第二月。	如 第 二 月 
X26n0520_002:0559a22	諸法相待。其猶揑目對於本月。妄見有二。故楞嚴	諸 法 相 待 其 猶 揑 目 對 於 本 月 妄 見 有 二 故 楞 嚴 
X26n0520_002:0559a23	云。如第二月。非體非影。第二之觀。揑所成故。△七	云 如 第 二 月 非 體 非 影 第 二 之 觀 揑 所 成 故 七 
X26n0520_002:0559a24	緣成假。如水泡。	緣 成 假 如 水 泡 
X26n0520_002:0559b01	諸法緣成。蘊處界法。	諸 法 緣 成 蘊 處 界 法 
X26n0520_002:0559b02	夫緣成之法。有染有淨。染緣成六凡。淨緣成四聖。	夫 緣 成 之 法 有 染 有 淨 染 緣 成 六 凡 淨 緣 成 四 聖 
X26n0520_002:0559b03	今此三科約觀。觀境即染緣也。	今 此 三 科 約 觀 觀 境 即 染 緣 也 
X26n0520_002:0559b04	如水上泡。	如 水 上 泡 
X26n0520_002:0559b05	仗水生泡。泡實無體。喻法從緣亦無體矣。金剛論	仗 水 生 泡 泡 實 無 體 喻 法 從 緣 亦 無 體 矣 金 剛 論 
X26n0520_002:0559b06	云。壽如水泡。或暫停住。即歸散滅。△八因成假。如	云 壽 如 水 泡 或 暫 停 住 即 歸 散 滅 八 因 成 假 如 
X26n0520_002:0559b07	空雲。	空 雲 
X26n0520_002:0559b08	諸法因成。	諸 法 因 成 
X26n0520_002:0559b09	前明緣成。此顯因成。蓋因親緣疎。而分二假。	前 明 緣 成 此 顯 因 成 蓋 因 親 緣 疎 而 分 二 假 
X26n0520_002:0559b10	一切有情。俱時因果。	一切有情 俱 時 因 果 
X26n0520_002:0559b11	謂現世作善惡業。現身受苦樂報。名順現報。即俱	謂 現 世 作 善 惡 業 現 身 受 苦 樂 報 名 順 現 報 即 俱 
X26n0520_002:0559b12	時因果也。	時 因 果 也 
X26n0520_002:0559b13	異時因果。	異 時 因 果 
X26n0520_002:0559b14	今生作善惡。次一生受報。名順生報。即異時因果	今 生 作 善 惡 次 一 生 受 報 名 順 生 報 即 異 時 因 果 
X26n0520_002:0559b15	也。	也 
X26n0520_002:0559b16	三世善惡。	三 世 善 惡 
X26n0520_002:0559b17	報有三時。上二句是順現順生。亦有順後報者。即	報 有 三 時 上 二 句 是 順 現 順 生 亦 有 順 後 報 者 即 
X26n0520_002:0559b18	同原人論。三世業報善惡因果。	同 原 人 論 三 世 業 報 善 惡 因 果 
X26n0520_002:0559b19	如空中雲。	如 空 中 雲 
X26n0520_002:0559b20	前之七喻。喻真諦明空。故經云。一切有為法。如夢	前 之 七 喻 喻 真 諦 明 空 故 經 云 一 切 有 為 法 如 夢 
X26n0520_002:0559b21	幻泡影。如露亦如電。應作如是觀。今此雲喻。喻俗	幻 泡 影 如 露 亦 如 電 應 作 如 是 觀 今 此 雲 喻 喻 俗 
X26n0520_002:0559b22	諦明有。如經云。假使百千劫。所作業不忘。因緣會	諦 明 有 如 經 云 假 使 百 千 劫 所 作 業 不 忘 因 緣 會 
X26n0520_002:0559b23	過時。果報還須受。起信疏序亦云。雖復繁興鼓躍。	過 時 果 報 還 須 受 起 信 疏 序 亦 云 雖 復 繁 興 鼓 躍 
X26n0520_002:0559b24	未始動於心源。即真諦空也。靜諡虗凝。未嘗乖於	未 始 動 於 心 源 即 真 諦 空 也 靜 諡 虗 凝 未 嘗 乖 於 
X26n0520_002:0559c01	業果。即俗諦有也。故曰。一代聖言。皆以二諦因緣	業 果 即 俗 諦 有 也 故 曰 一 代 聖 言 皆 以 二 諦 因 緣 
X26n0520_002:0559c02	為宗。若依圭峯纂要。虗空中雲。唯喻未來。故引無	為 宗 若 依 圭 峯 纂 要 虗 空 中 雲 唯 喻 未 來 故 引 無 
X26n0520_002:0559c03	著論云。彼麤惡種子似虗空。引心出故如雲。△三	著 論 云 彼 麤 惡 種 子 似 虗 空 引 心 出 故 如 雲 三 
X26n0520_002:0559c04	雙結二。初別結廣略二。文二。初結略示。	雙 結 二 初 別 結 廣 略 二 文 二 初 結 略 示 
X26n0520_002:0559c05	善男子。菩薩摩訶薩。住無分別。無彼此相。	善 男 子 菩薩摩訶薩 住 無 分 別 無 彼 此 相 
X26n0520_002:0559c06	結前文。正住平等。無有彼我。	結 前 文 正 住 平 等 無 有 彼 我 
X26n0520_002:0559c07	無自他相。常行化利。無化利相。	無 自 他 相 常 行 化 利 無 化 利 相 
X26n0520_002:0559c08	結前文。如是觀察。化利眾生。然常行化利。即隨相	結 前 文 如 是 觀 察 化 利 眾 生 然 常 行 化 利 即 隨 相 
X26n0520_002:0559c09	行。無他相也。無化利相。即離相行。無自相也。△二	行 無 他 相 也 無 化 利 相 即 離 相 行 無 自 相 也 二 
X26n0520_002:0559c10	結廣釋。	結 廣 釋 
X26n0520_002:0559c11	是故應知。愚夫垢識。染著虗妄。為相所縛。	是 故 應 知 愚 夫 垢 識 染 著 虗 妄 為 相 所 縛 
X26n0520_002:0559c12	結前文生染識本。著五陰相。不求解脫。故顯揚論	結 前 文 生 染 識 本 著 五 陰 相 不 求 解 脫 故 顯 揚 論 
X26n0520_002:0559c13	云。相縛縛眾生。亦由麤重縛。善修雙止觀。方乃俱	云 相 縛 縛 眾 生 亦 由 麤 重 縛 善 修 雙 止 觀 方 乃 俱 
X26n0520_002:0559c14	解脫。	解 脫 
X26n0520_002:0559c15	菩薩照見。知如幻士。無有體相。但如空華。	菩 薩 照 見 知 如 幻 士 無 有 體 相 但 如 空 華 
X26n0520_002:0559c16	結前文生淨識本。了色心空。皆如幻故。亦如空華	結 前 文 生 淨 識 本 了 色 心 空 皆 如 幻 故 亦 如 空 華 
X26n0520_002:0559c17	故楞嚴云。見聞如幻翳。三界若空華。聞復瞖根除。	故 楞 嚴 云 見 聞 如 幻 翳 三 界 若 空 華 聞 復 瞖 根 除 
X26n0520_002:0559c18	塵消覺圓淨。△二總結自他二利。	塵 消 覺 圓 淨 二 總 結 自 他 二 利 
X26n0520_002:0559c19	是為菩薩摩訶薩。住利自他。如實觀察。	是 為 菩薩摩訶薩 住 利 自 他 如實觀察 
X26n0520_002:0559c20	言總結者。兼結淨識中。菩薩二利也。△三敘時眾	言 總 結 者 兼 結 淨 識 中 菩 薩 二 利 也 三 敘 時 眾 
X26n0520_002:0559c21	獲益。	獲 益 
X26n0520_002:0559c22	說是法時。會中無量人天大眾。有得伏忍。空無生忍。	說 是 法 時 會 中 無 量 人 天 大 眾 有 得 伏 忍 空 無 生 忍 
X26n0520_002:0559c23	一地二地。乃至十地。	一 地 二 地 乃 至 十 地 
X26n0520_002:0559c24	伏忍通十信三賢。空即四加行。以現立少物故。無	伏 忍 通 十 信 三 賢 空 即 四 加 行 以 現 立 少 物 故 無 
X26n0520_002:0560a01	生忍。據前文。即七八九三地耳。	生 忍 據 前 文 即 七 八 九 三 地 耳 
X26n0520_002:0560a02	無量菩薩。得一生補處。	無 量 菩 薩 得 一生補處 
X26n0520_002:0560a03	如瑜伽說。知足天身。補處尊故。	如 瑜 伽 說 知 足 天 身 補 處 尊 故 
X26n0520_002:0560a05	注仁王護國般若經卷第二	注 仁 王 護 國 般 若 經 卷 第 二 
X26n0520_003:0560a09	注仁王護國般若經卷第三	注 仁 王 護 國 般 若 經 卷 第 三 
X26n0520_003:0560a11	大宋國傳賢首祖教沙門　(淨源)　撰集	大 宋 國 傳 賢 首 祖 教 沙 門 淨 源 撰 集 
X26n0520_003:0560a12	二諦品第四	二 諦 品 第 四 
X26n0520_003:0560a13	初來意者。謂前觀如來及菩薩行。二品大意。自他	初 來 意 者 謂 前 觀 如 來 及 菩 薩 行 二 品 大 意 自 他 
X26n0520_003:0560a14	兼濟。悲智雙修。而初心菩薩有智無悲。則多趣寂。	兼 濟 悲 智 雙 修 而 初 心 菩 薩 有 智 無 悲 則 多 趣 寂 
X26n0520_003:0560a15	有悲無智。則成愛見。今以真諦絕於愛見。俗諦導	有 悲 無 智 則 成 愛 見 今 以 真 諦 絕 於 愛 見 俗 諦 導 
X26n0520_003:0560a16	乎趣寂。故次來也。又約當品雙資因果。而成下文。	乎 趣 寂 故 次 來 也 又 約 當 品 雙 資 因 果 而 成 下 文 
X26n0520_003:0560a17	護果護因。故次來也。次釋名。二者數也。諦審實也。	護 果 護 因 故 次 來 也 次 釋 名 二 者 數 也 諦 審 實 也 
X26n0520_003:0560a18	真諦顯理。修證俱亡。俗諦明事。因果歷然。即俗而	真 諦 顯 理 修 證 俱 亡 俗 諦 明 事 因 果 歷 然 即 俗 而 
X26n0520_003:0560a19	真。如鏡影即空。即真而俗。如空不壞影。真俗不二。	真 如 鏡 影 即 空 即 真 而 俗 如 空 不 壞 影 真 俗 不 二 
X26n0520_003:0560a20	唯一中道。如鏡中之明。若依相宗。真俗二諦。條然	唯 一 中 道 如 鏡 中 之 明 若 依 相 宗 真 俗 二 諦 條 然 
X26n0520_003:0560a21	不同。非斷非常。果生因滅。非此所尚耳。△三解經	不 同 非 斷 非 常 果 生 因 滅 非 此 所 尚 耳 三 解 經 
X26n0520_003:0560a22	五。初匿王致問。	五 初 匿 王 致 問 
X26n0520_003:0560a23	爾時波斯匿王白佛言。世尊。勝義諦中。有世俗諦不。	爾 時 波 斯 匿 王 白 佛 言 世 尊 勝 義 諦 中 有 世 俗 諦 不 
X26n0520_003:0560a24	先開雙關。次牒之而難。	先 開 雙 關 次 牒 之 而 難 
X26n0520_003:0560b01	若言無者。智不應二。	若 言 無 者 智 不 應 二 
X26n0520_003:0560b02	若無俗諦。則智不能照真俗之二。	若 無 俗 諦 則 智 不 能 照 真 俗 之 二 
X26n0520_003:0560b03	若言有者。智不應一。	若 言 有 者 智 不 應 一 
X26n0520_003:0560b04	若有俗諦。則智不能觀中道之一。	若 有 俗 諦 則 智 不 能 觀 中 道 之 一 
X26n0520_003:0560b05	一二之義。其事云何。	一 二 之 義 其 事 云 何 
X26n0520_003:0560b06	雙結前義。敢問如何。△二如來正答三。初實相明	雙 結 前 義 敢 問 如 何 二 如 來 正 答 三 初 實 相 明 
X26n0520_003:0560b07	真俗境二。先長行略示二。初敘昔示義。	真 俗 境 二 先 長 行 略 示 二 初 敘 昔 示 義 
X26n0520_003:0560b08	佛言大王。汝於過去龍光王佛法中。已問此義。	佛 言 大 王 汝 於 過 去 龍 光 王 佛 法 中 已 問 此 義 
X26n0520_003:0560b09	過去已問。獨善一身。自利也。今復請益。兼濟大眾。	過 去 已 問 獨 善 一 身 自 利 也 今 復 請 益 兼 濟 大 眾 
X26n0520_003:0560b10	利他也。	利 他 也 
X26n0520_003:0560b11	我今無說。汝今無聽。無說無聽。是即名為一義二義。	我 今 無 說 汝 今 無 聽 無 說 無 聽 是 即 名 為 一 義 二 義 
X26n0520_003:0560b12	說聽俱泯。真諦唯一。師資並存。俗諦具二。故華嚴	說 聽 俱 泯 真 諦 唯 一 師 資 並 存 俗 諦 具 二 故 華 嚴 
X26n0520_003:0560b13	序云。無說無示。理符不二之門。因言顯言。方闡大	序 云 無 說 無 示 理 符 不 二 之 門 因 言 顯 言 方 闡 大 
X26n0520_003:0560b14	千之義。△二勅聽許說。	千 之 義 二 勅 聽 許 說 
X26n0520_003:0560b15	汝今諦聽。當為汝說。	汝 今 諦 聽 當 為 汝 說 
X26n0520_003:0560b16	誡令審諦。勿雜餘緣。故智度論云。聽者端視如渴	誡 令 審 諦 勿 雜 餘 緣 故 智 度 論 云 聽 者 端 視 如 渴 
X26n0520_003:0560b17	飲。一心入於語義中。踊躍聞法心悲喜。如是之人	飲 一 心 入 於 語 義 中 踊 躍 聞 法 心 悲 喜 如 是 之 人 
X26n0520_003:0560b18	可為說。然此經文。對前亦互望。明其一二之義。謂	可 為 說 然 此 經 文 對 前 亦 互 望 明 其 一 二 之 義 謂 
X26n0520_003:0560b19	前文敘昔示義。即說聽俱泯。顯真諦之一也。今此	前 文 敘 昔 示 義 即 說 聽 俱 泯 顯 真 諦 之 一 也 今 此 
X26n0520_003:0560b20	勅聽許說。顯師資並存。即俗諦之二也。△二偈頌	勅 聽 許 說 顯 師 資 並 存 即 俗 諦 之 二 也 二 偈 頌 
X26n0520_003:0560b21	廣答。於中九頌。初有一偈。真俗絕待。次有七偈。二	廣 答 於 中 九 頌 初 有 一 偈 真 俗 絕 待 次 有 七 偈 二 
