X26n0520_003:0574b11	大疏以法施為總。慈等為別。皆是法施。夫法施者。	大 疏 以 法 施 為 總 慈 等 為 別 皆 是 法 施 夫 法 施 者 
X26n0520_003:0574b12	生解之玅方。起行之根本。入聖域之階漸。超苦海	生 解 之 玅 方 起 行 之 根 本 入 聖 域 之 階 漸 超 苦 海 
X26n0520_003:0574b13	之津梁。古德云。此經中託人以弘道。歎法師之勝	之 津 梁 古 德 云 此 經 中 託 人 以 弘 道 歎 法 師 之 勝 
X26n0520_003:0574b14	德。故知法施之功。過財施之難喻。△三修觀受生。	德 故 知 法 施 之 功 過 財 施 之 難 喻 三 修 觀 受 生 
X26n0520_003:0574b15	善觀五蘊三界二諦。	善 觀 五 蘊 三 界 二 諦 
X26n0520_003:0574b16	並如菩薩行品。但前廣此略為異。	並 如 菩 薩 行 品 但 前 廣 此 略 為 異 
X26n0520_003:0574b17	無自他相。得如實性。	無 自 他 相 得 如 實 性 
X26n0520_003:0574b18	釋義。倣前十行。	釋 義 倣 前 十 行 
X26n0520_003:0574b19	雖常修勝義。而受生三界。何以故。業習果報。未壞盡故。	雖 常 修 勝 義 而 受 生 三 界 何 以 故 業 習 果 報 未 壞 盡 故 
X26n0520_003:0574b20	初標。次徵。後釋。當句自釋。不俟繁文。	初 標 次 徵 後 釋 當 句 自 釋 不 俟 繁 文 
X26n0520_003:0574b21	於人天中順道生故。	於 人 天 中 順 道 生 故 
X26n0520_003:0574b22	在天而天。處人而人。順修中道。隨報受生。△四結	在 天 而 天 處 人 而 人 順 修 中 道 隨 報 受 生 四 結 
X26n0520_003:0574b23	賢進聖。	賢 進 聖 
X26n0520_003:0574b24	上品修習八萬四千波羅蜜多。於三阿僧祇劫。修二	上 品 修 習 八萬四千 波羅蜜多 於 三阿僧祇劫 修 二 
X26n0520_003:0574c01	利行。廣大饒益。得善調伏諸三摩地。	利 行 廣 大 饒 益 得 善 調 伏 諸 三 摩 地 
X26n0520_003:0574c02	諸三摩地。即止觀雙運。故大經迴向品偈云。禪定	諸 三 摩 地 即 止 觀 雙 運 故 大 經 迴 向 品 偈 云 禪 定 
X26n0520_003:0574c03	持心常一緣。智慧了境同三昧。上結三賢。下進十聖。	持 心 常 一 緣 智 慧 了 境 同 三 昧 上 結 三 賢 下 進 十 聖 
X26n0520_003:0574c04	住勝觀察。修出離所。	住 勝 觀 察 修 出 離 所 
X26n0520_003:0574c05	大經迴向品亦云。皆已觀察。皆得清淨。廣大功德。	大 經 迴 向 品 亦 云 皆 已 觀 察 皆 得 清 淨 廣 大 功 德 
X26n0520_003:0574c06	出離法中。	出 離 法 中 
X26n0520_003:0574c07	能證平等聖人地故。	能 證 平 等 聖 人 地 故 
X26n0520_003:0574c08	能證平等。即初地住平等忍。準諸經論。多說三阿	能 證 平 等 即 初 地 住 平 等 忍 準 諸 經 論 多 說 三 阿 
X26n0520_003:0574c09	僧祇成佛。今經地前已經三阿僧祇者。演義鈔謂。	僧 祇 成 佛 今 經 地 前 已 經 三阿僧祇 者 演 義 鈔 謂 
X26n0520_003:0574c10	地前菩薩。二乘聖者。見初入地。皆謂究竟。故說三	地 前 菩 薩 二 乘 聖 者 見 初 入 地 皆 謂 究 竟 故 說 三 
X26n0520_003:0574c11	祇成等正覺。亦佛隨宜。故寶雲經。實經無量阿僧	祇 成等正覺 亦 佛 隨 宜 故 寶 雲 經 實 經 無 量 阿 僧 
X26n0520_003:0574c12	祇劫。大經華藏品初。疏有會釋。又瑜伽說。有二種	祇 劫 大 經 華 藏 品 初 疏 有 會 釋 又 瑜 伽 說 有 二 種 
X26n0520_003:0574c13	無數劫。皆如大經疏鈔。	無 數 劫 皆 如 大 經 疏 鈔 
X26n0520_003:0574c15	注仁王護國般若經卷第三	注 仁 王 護 國 般 若 經 卷 第 三 
X26n0520_004:0574c19	注仁王護國般若經卷第四	注 仁 王 護 國 般 若 經 卷 第 四 
X26n0520_004:0574c20	大宋國傳賢首祖教沙門　(淨源)　撰集	大 宋 國 傳 賢 首 祖 教 沙 門 淨 源 撰 集 
X26n0520_004:0574c21	△二十聖法師。準大經疏。三賢十聖。皆以菩提心。	 二 十 聖 法 師 準 大 經 疏 三 賢 十 聖 皆 以 菩 提 心 
X26n0520_004:0574c22	而為其體。故清涼引起信云。菩提心有三。一者直	而 為 其 體 故 清 涼 引 起 信 云 菩 提 心 有 三 一 者 直 
X26n0520_004:0574c23	心。正念真如法故。二者深心。樂修一切諸善行故。	心 正 念 真 如 法 故 二 者 深 心 樂 修 一 切 諸 善 行 故 
X26n0520_004:0574c24	三者大悲心。救護一切苦眾生故。所念真如。亦即	三 者 大 悲 心 救 護 一 切 苦 眾 生 故 所 念 真 如 亦 即 
X26n0520_004:0575a01	本智。本覺智故。後二顯是恒沙性德。然此三心有	本 智 本 覺 智 故 後 二 顯 是 恒 沙 性 德 然 此 三 心 有 
X26n0520_004:0575a02	一。必兼餘二。而三賢互有增微。十住直心增故。故	一 必 兼 餘 二 而 三 賢 互 有 增 微 十 住 直 心 增 故 故 
X26n0520_004:0575a03	名為解。解為行願本故。首而明之。十行深心增故。	名 為 解 解 為 行 願 本 故 首 而 明 之 十 行 深 心 增 故 
X26n0520_004:0575a04	名為行依。於前解以起行故。十向大悲增故。名為	名 為 行 依 於 前 解 以 起 行 故 十 向 大 悲 增 故 名 為 
X26n0520_004:0575a05	願迴。前解行願。諸眾生離苦得樂故。十地三心等	願 迴 前 解 行 願 諸 眾 生 離 苦 得 樂 故 十 地 三 心 等 
X26n0520_004:0575a06	證故。名善決定。然則清涼既依起信三心之文。科	證 故 名 善 決 定 然 則 清 涼 既 依 起 信 三 心 之 文 科 
X26n0520_004:0575a07	判華嚴四會之經。故推馬鳴大士。為吾宗初祖。深	判 華 嚴 四 會 之 經 故 推 馬 鳴 大 士 為 吾 宗 初 祖 深 
X26n0520_004:0575a08	為通才之所取證矣。而習大疏者。不曉清涼之言。	為 通 才 之 所 取 證 矣 而 習 大 疏 者 不 曉 清 涼 之 言 
X26n0520_004:0575a09	輙負馬鳴之德。何愚蔽之甚耶。既知地前三心增	輙 負 馬 鳴 之 德 何 愚 蔽 之 甚 耶 既 知 地 前 三 心 增 
X26n0520_004:0575a10	微。次釋地上三心等證。又此經十地地地。皆列地	微 次 釋 地 上 三 心 等 證 又 此 經 十 地 地 地 皆 列 地 
X26n0520_004:0575a11	名。證如斷障觀智成行五義耳。然其地名成行。此	名 證 如 斷 障 觀 智 成 行 五 義 耳 然 其 地 名 成 行 此 
X26n0520_004:0575a12	二與前匿王偈中文勢大同。故於偈中。已依天親	二 與 前 匿 王 偈 中 文 勢 大 同 故 於 偈 中 已 依 天 親 
X26n0520_004:0575a13	論文。釋十地之名。依清凉疏義。釋十位之行。今但	論 文 釋 十 地 之 名 依 清 凉 疏 義 釋 十 位 之 行 今 但 
X26n0520_004:0575a14	引諸論。解證如斷障。亦引大經。解於觀智。其結位	引 諸 論 解 證 如 斷 障 亦 引 大 經 解 於 觀 智 其 結 位 
X26n0520_004:0575a15	成行。厥或文略。則直示節段。其文繁者。則隨難別	成 行 厥 或 文 略 則 直 示 節 段 其 文 繁 者 則 隨 難 別 
X26n0520_004:0575a16	解。今初歡喜地法師。文四。初創入聖位。	解 今 初歡喜地 法 師 文 四 初 創 入 聖 位 
X26n0520_004:0575a17	復次歡喜地菩薩摩訶薩。超愚夫地。	復 次 歡 喜 地 菩薩摩訶薩 超 愚 夫 地 
X26n0520_004:0575a18	大經即云。超凡夫地。疏釋云。以得出世間聖道故。	大 經 即 云 超 凡 夫 地 疏 釋 云 以 得 出 世 間 聖 道 故 
X26n0520_004:0575a19	超即過義。	超 即 過 義 
X26n0520_004:0575a20	生如來家。	生如來家 
X26n0520_004:0575a21	疏云。如世王子。生王家故。菩薩亦爾。若在外道法	疏 云 如 世 王 子 生 王 家 故 菩 薩 亦 爾 若 在 外 道 法 
X26n0520_004:0575a22	中出家。不足為勝。今得佛所證法。方為尊勝。	中 出 家 不 足 為 勝 今 得 佛 所 證 法 方 為 尊 勝 
X26n0520_004:0575a23	住平等忍。	住 平 等 忍 
X26n0520_004:0575a24	謂初入信忍。住平等理。故下偈云。歡喜菩薩轉輪	謂 初 入 信 忍 住 平 等 理 故 下 偈 云 歡 喜 菩 薩 轉 輪 
X26n0520_004:0575b01	王。初照二諦平等理。△二證如斷障。	王 初 照 二 諦 平 等 理 二 證 如 斷 障 
X26n0520_004:0575b02	初無相智。照勝義諦。一相平等。非相無相。	初 無 相 智 照 勝 義 諦 一 相 平 等 非 相 無 相 
X26n0520_004:0575b03	此地菩薩證徧行真如。以無相智。照二空理。非有	此 地 菩 薩 證 徧 行 真 如 以 無 相 智 照 二 空 理 非 有 
X26n0520_004:0575b04	相非無相。謂此真如二空所顯。無有一法而不在	相 非 無 相 謂 此 真 如 二 空 所 顯 無 有 一 法 而 不 在 
X26n0520_004:0575b05	故。梁攝論中。名為徧滿。徧滿一切有為行故。	故 梁 攝 論 中 名 為 徧 滿 徧 滿 一 切 有 為 行 故 
X26n0520_004:0575b06	斷諸無明。滅三界貪。	斷 諸 無 明 滅 三 界 貪 
X26n0520_004:0575b07	斷二障分別起者。即根本無明。初地施度徧增故。	斷 二 障 分 別 起 者 即 根本無明 初 地 施 度 徧 增 故 
X26n0520_004:0575b08	滅三界貪。唯識名異生性障。梁攝論名凡夫性障。	滅 三 界 貪 唯 識 名 異 生 性 障 梁 攝 論 名 凡 夫 性 障 
X26n0520_004:0575b09	十地論名凡夫我相障。然經論所出。名異義同。備	十 地 論 名 凡 夫 我 相 障 然 經 論 所 出 名 異 義 同 備 
X26n0520_004:0575b10	如大疏。	如 大 疏 
X26n0520_004:0575b11	未來無量生死。永不生故。	未 來 無 量 生 死 永 不 生 故 
X26n0520_004:0575b12	上明斷障即因亡。此無生死即果喪。△三觀智利	上 明 斷 障 即 因 亡 此 無 生 死 即 果 喪 三 觀 智 利 
X26n0520_004:0575b13	物二。初約法明權實。	物 二 初 約 法 明 權 實 
X26n0520_004:0575b14	大悲為首。起諸大願。	大 悲 為 首 起 諸 大 願 
X26n0520_004:0575b15	大經云。菩薩起如是心。以大悲為首。智慧增上。而	大 經 云 菩 薩 起 如 是 心 以 大 悲 為 首 智 慧 增 上 而 
X26n0520_004:0575b16	言起諸大願者。此地菩薩有十大願。初發供養願。	言 起 諸 大 願 者 此 地 菩 薩 有 十 大 願 初 發 供 養 願 
X26n0520_004:0575b17	乃至第十成正覺願。願者是希求義故。十地論云。	乃 至 第 十 成 正 覺 願 願 者 是 希 求 義 故 十 地 論 云 
X26n0520_004:0575b18	發諸大願。隨心求義故。	發 諸 大 願 隨 心 求 義 故 
X26n0520_004:0575b19	於方便智。念念修習。無量勝行。	於 方 便 智 念 念 修 習 無 量 勝 行 
X26n0520_004:0575b20	大經次前文云。善巧方便所攝。最上深心所持。如	大 經 次 前 文 云 善巧方便 所 攝 最 上 深 心 所 持 如 
X26n0520_004:0575b21	來力無量。以此三句。如次對今經。皆學權智也。	來 力 無 量 以 此 三 句 如 次 對 今 經 皆 學 權 智 也 
X26n0520_004:0575b22	非證非不證。一切徧學故。	非 證 非 不 證 一 切 徧 學 故 
X26n0520_004:0575b23	權智涉有非證也。實智觀空非不證也。故大經云。	權 智 涉 有 非 證 也 實 智 觀 空 非 不 證 也 故 大 經 云 
X26n0520_004:0575b24	此菩薩。轉更勤修一切善根。而得成就。敬順尊重	此 菩 薩 轉 更 勤 修 一 切 善 根 而 得 成 就 敬 順 尊 重 
X26n0520_004:0575c01	諸佛教法。故云一切徧學。	諸 佛 教 法 故 云 一 切 徧 學 
X26n0520_004:0575c02	非住非不住。向一切智故。	非 住 非 不 住 向 一 切 智 故 
X26n0520_004:0575c03	有悲故非住涅槃。有智故不住生死。大經亦云。此	有 悲 故 非 住 涅 槃 有 智 故 不 住 生 死 大 經 亦 云 此 
X26n0520_004:0575c04	菩薩不求一切資生之物。求一切智地故。	菩 薩 不 求 一 切 資 生 之 物 求 一切智地 故 
X26n0520_004:0575c05	行於生死。魔不動故。	行 於 生 死 魔 不 動 故 
X26n0520_004:0575c06	謂四魔中。而生死魔。不能動故。即上文有智故不	謂 四 魔 中 而 生 死 魔 不 能 動 故 即 上 文 有 智 故 不 
X26n0520_004:0575c07	住生死。大經又云。菩薩住如是法。名住菩薩歡喜	住 生 死 大 經 又 云 菩 薩 住 如 是 法 名 住 菩 薩 歡 喜 
X26n0520_004:0575c08	地。以不動相應故。	地 以 不 動 相 應 故 
X26n0520_004:0575c09	離我我所。無怖畏故。	離我我所 無 怖 畏 故 
X26n0520_004:0575c10	我與我所。該五怖畏。如大經云。此菩薩離我想故。	我 與 我 所 該 五 怖 畏 如 大 經 云 此 菩 薩 離 我 想 故 
X26n0520_004:0575c11	尚不愛自身。何況資財。是故無有不活畏。不於他	尚 不 愛 自 身 何 況 資 財 是 故 無 有 不 活 畏 不 於 他 
X26n0520_004:0575c12	所希求供養。唯專給施一切眾生。是故無有惡名	所 希 求 供 養 唯 專 給 施 一 切 眾 生 是 故 無 有 惡 名 
X26n0520_004:0575c13	畏。遠離我見。無有我想。是故無有死畏。自知死已。	畏 遠 離 我 見 無 有 我 想 是 故 無 有 死 畏 自 知 死 已 
X26n0520_004:0575c14	決定不離諸佛菩薩。是故無有惡道畏。我所志樂。	決 定 不 離 諸佛菩薩 是 故 無 有 惡 道 畏 我 所 志 樂 
X26n0520_004:0575c15	一切世間。無與等者。何況有勝。是故無有大眾威	一切世間 無 與 等 者 何 況 有 勝 是 故 無 有 大 眾 威 
X26n0520_004:0575c16	德畏。	德 畏 
X26n0520_004:0575c17	無自他相。常化眾生故。	無 自 他 相 常 化 眾 生 故 
X26n0520_004:0575c18	謂菩薩以觀智利物。不見自相為能化。他相為所	謂 菩 薩 以 觀 智 利 物 不 見 自 相 為 能 化 他 相 為 所 
X26n0520_004:0575c19	化。終日化生。而忘能所。故大經云。菩薩住此歡喜	化 終 日 化 生 而 忘 能 所 故 大 經 云 菩 薩 住 此 歡 喜 
X26n0520_004:0575c20	地。念清淨波羅蜜。念如來教化眾生。故生歡喜。	地 念 清 淨波羅蜜 念 如 來 教 化 眾 生 故 生 歡 喜 
X26n0520_004:0575c21	自在願力。生諸淨土故。	自 在 願 力 生 諸 淨 土 故 
X26n0520_004:0575c22	即前十大願中。第七淨土願。故大經云。又發大願。	即 前 十 大 願 中 第 七 淨 土 願 故 大 經 云 又 發 大 願 
X26n0520_004:0575c23	願一切國土。入一國土。一國土入一切國土。無量	願 一 切 國 土 入 一 國 土 一 國 土 入 一 切 國 土 無 量 
X26n0520_004:0575c24	佛土。普皆清淨。無量智慧眾生。充滿其中。隨眾生	佛 土 普 皆 清 淨 無 量 智 慧 眾 生 充 滿 其 中 隨 眾 生 
X26n0520_004:0576a01	心。而為示現。皆令歡喜。△二兼喻示權實。	心 而 為 示 現 皆 令 歡 喜 二 兼 喻 示 權 實 
X26n0520_004:0576a02	善男子。此初覺智。非如非智。非有非無。無有二相。	善 男 子 此 初 覺 智 非 如 非 智 非有非無 無 有 二 相 
X26n0520_004:0576a03	謂始覺實智。一念現前。非所證如。非能證智。唯一	謂 始 覺 實 智 一 念 現 前 非 所 證 如 非 能 證 智 唯 一 
X26n0520_004:0576a04	玅心。無能所二相。故唯識論云。若時於所緣。智都	玅 心 無 能 所 二 相 故 唯 識 論 云 若 時 於 所 緣 智 都 
X26n0520_004:0576a05	無所得。爾時住唯識。離二取相故。	無 所 得 爾 時 住 唯 識 離 二 取 相 故 
X26n0520_004:0576a06	方便玅用。非倒非住。非動非靜。	方 便 玅 用 非 倒 非 住 非 動 非 靜 
X26n0520_004:0576a07	謂方便權智。玅用應物。無愛見故。非倒非住。實智	謂 方 便 權 智 玅 用 應 物 無 愛 見 故 非 倒 非 住 實 智 
X26n0520_004:0576a08	證理。不趣寂故。非動非靜。以無愛見。異凡夫。而不	證 理 不 趣 寂 故 非 動 非 靜 以 無 愛 見 異 凡 夫 而 不 
X26n0520_004:0576a09	趣寂。異二乘。	趣 寂 異 二 乘 
X26n0520_004:0576a10	二利自在。如水與波。非一非異。	二 利 自 在 如 水 與 波 非一非異 
X26n0520_004:0576a11	實智自利。澄湛如水。權智利他。汪洋如波。挹之徧	實 智 自 利 澄 湛 如 水 權 智 利 他 汪 洋 如 波 挹 之 徧 
X26n0520_004:0576a12	乎四海。非一也。攝之歸於一源。非異也。	乎 四 海 非 一 也 攝 之 歸 於 一 源 非 異 也 
X26n0520_004:0576a13	智起諸波羅蜜多。亦非一異。	智 起 諸波羅蜜 多 亦 非 一 異 
X26n0520_004:0576a14	般若二利既爾。餘之五度。二利亦然。△四結位成	般 若 二 利 既 爾 餘 之 五 度 二 利 亦 然 四 結 位 成 
X26n0520_004:0576a15	行。	行 
X26n0520_004:0576a16	於四阿僧祇劫。滿足修習百萬行願。	於 四 阿僧祇劫 滿 足 修 習 百 萬 行 願 
X26n0520_004:0576a17	有行無願。其行必孤。有願無行。其願必虗。行願相	有 行 無 願 其 行 必 孤 有 願 無 行 其 願 必 虗 行 願 相 
X26n0520_004:0576a18	扶。如鳥之兩翼。車之兩輪。故能翱翔致遠也。	扶 如 鳥 之 兩 翼 車 之 兩 輪 故 能 翱 翔 致 遠 也 
X26n0520_004:0576a19	此地菩薩。無三界業習。更不造新。	此 地 菩 薩 無 三 界 業 習 更 不 造 新 
X26n0520_004:0576a20	前十迴向菩薩。雖常修勝義。而受生三界。以其業	前 十 迴 向 菩 薩 雖 常 修 勝 義 而 受 生 三 界 以 其 業 
X26n0520_004:0576a21	習果報未壞盡故。今此菩薩修出離行。滅三界貪。	習 果 報 未 壞 盡 故 今 此 菩 薩 修 出 離 行 滅 三 界 貪 
X26n0520_004:0576a22	故無業習。準華嚴疏。謂此地非但斷能起煩惱障。	故 無 業 習 準 華 嚴 疏 謂 此 地 非 但 斷 能 起 煩 惱 障 
X26n0520_004:0576a23	亦斷惡趣諸業果等。故云不造新業也。	亦 斷 惡 趣 諸 業 果 等 故 云 不 造 新 業 也 
X26n0520_004:0576a24	由隨智力。以願生故。	由 隨 智 力 以 願 生 故 
X26n0520_004:0576b01	此則智增菩薩。以其願心。生於淨土。若是悲增。即	此 則 智 增 菩 薩 以 其 願 心 生 於 淨 土 若 是 悲 增 即 
X26n0520_004:0576b02	住三界。利樂有情。	住 三 界 利樂有情 
X26n0520_004:0576b03	念念常行檀波羅蜜多。	念 念 常 行 檀 波羅蜜多 
X26n0520_004:0576b04	大經云。是菩薩十波羅蜜中。檀波羅蜜增上。餘波	大 經 云 是 菩 薩 十波羅蜜 中 檀 波 羅 蜜 增 上 餘 波 
X26n0520_004:0576b05	羅蜜非不修行。但隨力隨分。	羅 蜜 非 不 修 行 但 隨 力 隨 分 
X26n0520_004:0576b06	布施。愛語。利行。同事。	布 施 愛 語 利 行 同 事 
X26n0520_004:0576b07	經又云。常行大施。無有窮盡。布施愛語。利行同事。	經 又 云 常 行 大 施 無 有 窮 盡 布 施 愛 語 利 行 同 事 
X26n0520_004:0576b08	如是一切諸所作業。皆不離念佛。不離念法。不離	如是一切 諸 所 作 業 皆 不 離 念 佛 不 離 念 法 不 離 
X26n0520_004:0576b09	念僧。	念 僧 
X26n0520_004:0576b10	廣大清淨。善能安住。饒益眾生。	廣 大 清 淨 善 能 安 住 饒 益 眾 生 
X26n0520_004:0576b11	經云。能以大施。攝取眾生。善除眾生慳貪之垢。△	經 云 能 以 大 施 攝 取 眾 生 善 除 眾 生 慳 貪 之 垢 
X26n0520_004:0576b12	二離垢地法師三。初證如斷障。	二 離 垢 地 法 師 三 初 證 如 斷 障 
X26n0520_004:0576b13	復次離垢地菩薩摩訶薩。四無量心。最勝寂滅。	復 次 離 垢 地 菩薩摩訶薩 四無量心 最 勝 寂 滅 
X26n0520_004:0576b14	此地證最。勝真如。謂此真如具無邊德。於一切法。	此 地 證 最 勝 真 如 謂 此 真 如 具 無 邊 德 於一切法 
X26n0520_004:0576b15	最為勝故。	最 為 勝 故 
X26n0520_004:0576b16	斷瞋等習。	斷 瞋 等 習 
X26n0520_004:0576b17	等取邪行習氣。以此地斷邪行障故。謂修四無量	等 取 邪 行 習 氣 以 此 地 斷 邪 行 障 故 謂 修 四 無 量 
X26n0520_004:0576b18	心。斷瞋習氣。持性戒成就。斷邪行習氣。言邪行者。	心 斷 瞋 習 氣 持 性 戒 成 就 斷 邪 行 習 氣 言 邪 行 者 
X26n0520_004:0576b19	謂所知障中俱生一分。及彼所起誤犯三業。能障	謂 所 知 障 中 俱 生 一 分 及 彼 所 起 誤 犯 三 業 能 障 
X26n0520_004:0576b20	二地故。△二觀智利物。	二 地 故 二 觀 智 利 物 
X26n0520_004:0576b21	修一切行。所謂遠離殺害。	修 一 切 行 所 謂 遠 離 殺 害 
X26n0520_004:0576b22	大經云。性自遠離一切殺生。疏謂性自遠離。文屬	大 經 云 性 自 遠 離 一 切 殺 生 疏 謂 性 自 遠 離 文 屬 
X26n0520_004:0576b23	殺生。義該下九。	殺 生 義 該 下 九 
X26n0520_004:0576b24	不與不取。	不 與 不 取 
X26n0520_004:0576c01	經又云。性不偷盜。疏釋云。非理損財。不與而取。故	經 又 云 性 不 偷 盜 疏 釋 云 非 理 損 財 不 與 而 取 故 
X26n0520_004:0576c02	名為盜。	名 為 盜 
X26n0520_004:0576c03	心無染欲。	心 無 染 欲 
X26n0520_004:0576c04	經云。性不邪婬。疏謂乖禮曰邪。染愛曰淫。上皆護	經 云 性 不 邪 婬 疏 謂 乖 禮 曰 邪 染 愛 曰 淫 上 皆 護 
X26n0520_004:0576c05	持身之三非。	持 身 之 三 非 
X26n0520_004:0576c06	得真實語。	得 真 實 語 
X26n0520_004:0576c07	經云。性不妄語。疏謂違想背心。名之為妄。無相大	經 云 性 不 妄 語 疏 謂 違 想 背 心 名 之 為 妄 無 相 大 
X26n0520_004:0576c08	師云。如實語者。能除妄語。	師 云 如 實 語 者 能 除 妄 語 
X26n0520_004:0576c09	得和合語。	得 和 合 語 
X26n0520_004:0576c10	經云。性不兩舌。疏謂言不乖離。名離兩舌。兩舌成	經 云 性 不 兩 舌 疏 謂 言 不 乖 離 名 離 兩 舌 兩 舌 成 
X26n0520_004:0576c11	事。能令離間。無相曰。和合語者。能除兩舌。	事 能 令 離 間 無 相 曰 和 合 語 者 能 除 兩 舌 
X26n0520_004:0576c12	得柔輭語。	得 柔 輭 語 
X26n0520_004:0576c13	經云。性不惡口。疏謂言不麤鄙。名離惡口。無相曰。	經 云 性 不 惡 口 疏 謂 言 不 麤 鄙 名 離 惡 口 無 相 曰 
X26n0520_004:0576c14	柔輭語者。能除惡口。	柔 輭 語 者 能 除 惡 口 
X26n0520_004:0576c15	得調伏語。	得 調 伏 語 
X26n0520_004:0576c16	經云。性不綺語。疏謂言辭不正。故云綺語。其猶綺	經 云 性 不 綺 語 疏 謂 言 辭 不 正 故 云 綺 語 其 猶 綺 
X26n0520_004:0576c17	文。無相曰。正直語者。能除綺語。此即護持口之四	文 無 相 曰 正 直 語 者 能 除 綺 語 此 即 護 持 口 之 四 
X26n0520_004:0576c18	過。	過 
X26n0520_004:0576c19	常行捨心。	常 行 捨 心 
X26n0520_004:0576c20	經云。性不貪欲。於他財物。不願不求。疏謂他所攝	經 云 性 不 貪 欲 於 他 財 物 不 願 不 求 疏 謂 他 所 攝 
X26n0520_004:0576c21	故。此揀於己。	故 此 揀 於 己 
X26n0520_004:0576c22	常起慈心。	常 起 慈 心 
X26n0520_004:0576c23	經云。性離瞋恚。於諸眾生。恒起慈心。疏謂心不瞋	經 云 性 離 瞋 恚 於 諸 眾 生 恒 起 慈 心 疏 謂 心 不 瞋 
X26n0520_004:0576c24	毒。故名離瞋。	毒 故 名 離 瞋 
X26n0520_004:0577a01	住正直心。	住 正 直 心 
X26n0520_004:0577a02	經云。又離邪見。住於正道。心見正直。疏謂治異乘	經 云 又 離 邪 見 住 於 正 道 心 見 正 直 疏 謂 治 異 乘 
X26n0520_004:0577a03	見。小乘對大。非正道故。此明護持意之三愆。	見 小 乘 對 大 非 正 道 故 此 明 護 持 意 之 三 愆 
X26n0520_004:0577a04	寂靜純善。離破戒垢。	寂 靜 純 善 離 破 戒 垢 
X26n0520_004:0577a05	大經有寂靜純善十種深心。唯識亦云。具淨尸羅。	大 經 有 寂 靜 純 善 十 種 深 心 唯 識 亦 云 具 淨 尸 羅 
X26n0520_004:0577a06	遠離能起微細毀犯煩惱垢故。	遠 離 能 起 微 細 毀 犯 煩 惱 垢 故 
X26n0520_004:0577a07	行大慈觀。念念現前。	行 大 慈 觀 念 念 現 前 
X26n0520_004:0577a08	大經云。一切眾生。互相破壞。我當令彼住於無上	大 經 云 一 切 眾 生 互 相 破 壞 我 當 令 彼 住 於 無 上 
X26n0520_004:0577a09	大慈之中。△三結位成行。	大 慈 之 中 三 結 位 成 行 
X26n0520_004:0577a10	於五阿僧祇劫。具足清淨戒波羅蜜多。	於 五 阿僧祇劫 具 足 清 淨 戒 波羅蜜多 
X26n0520_004:0577a11	經云。此菩薩十波羅蜜中。持戒偏多。	經 云 此 菩 薩 十波羅蜜 中 持 戒 偏 多 
X26n0520_004:0577a12	志意勇猛。永離諸染。	志 意 勇 猛 永 離 諸 染 
X26n0520_004:0577a13	重頌偈云。勇猛精勤一念中。我當離彼住實法。上	重 頌 偈 云 勇 猛 精 勤 一 念 中 我 當 離 彼 住 實 法 上 
X26n0520_004:0577a14	皆義引。△三發光地法師三。初證如斷障。	皆 義 引 三 發 光 地 法 師 三 初 證 如 斷 障 
X26n0520_004:0577a15	復次發光地菩薩摩訶薩。住無分別。	復 次 發 光 地 菩薩摩訶薩 住 無 分 別 
X26n0520_004:0577a16	以無分別智。證勝流真如。唯識云。謂此真如所流	以 無分別智 證 勝 流 真 如 唯 識 云 謂 此 真 如 所 流 
X26n0520_004:0577a17	教法。於餘教法。極為勝故。梁攝云。從真如流出正	教 法 於 餘 教 法 極 為 勝 故 梁 攝 云 從 真 如 流 出 正 
X26n0520_004:0577a18	體智。正體智流出後得智。後得智流出大悲。大悲	體 智 正 體 智 流 出 後 得 智 後 得 智 流 出 大 悲 大 悲 
X26n0520_004:0577a19	流出十二部經。名為勝流法界故。	流 出 十二部經 名 為 勝 流 法 界 故 
X26n0520_004:0577a20	滅無明闇。	滅 無 明 闇 
X26n0520_004:0577a21	此地斷闇鈍障。唯識云。謂所知障中俱生一分。令	此 地 斷 闇 鈍 障 唯 識 云 謂 所 知 障 中 俱 生 一 分 令 
