X26n0520_001:0542b04	諦。則十法界。一切皆有。△三空色無礙觀。	諦 則 十 法 界 一 切 皆 有 三 空 色 無 礙 觀 
X26n0520_001:0542b05	善男子。若菩薩住於法相。有我相人相有情知見。為	善 男 子 若 菩 薩 住 於 法 相 有 我 相 人 相 有 情 知 見 為 
X26n0520_001:0542b06	住世間。即非菩薩。	住 世 間 即 非 菩 薩 
X26n0520_001:0542b07	謂此菩薩不了色相。舉體是空。故住世間。	謂 此 菩 薩 不 了 色 相 舉 體 是 空 故 住 世 間 
X26n0520_001:0542b08	所以者何。一切諸法。悉皆空故。	所以者何 一切諸法 悉 皆 空 故 
X26n0520_001:0542b09	以色是幻色。不礙真空。故終南觀云。是故菩薩看	以 色 是 幻 色 不 礙 真 空 故 終 南 觀 云 是 故 菩 薩 看 
X26n0520_001:0542b10	色。無不見空也。△四泯絕無寄觀。	色 無 不 見 空 也 四 泯 絕 無 寄 觀 
X26n0520_001:0542b11	若於諸法。而得不動。	若 於 諸 法 而 得 不 動 
X26n0520_001:0542b12	以生心動念。即乘法體故。	以 生 心 動 念 即 乘 法 體 故 
X26n0520_001:0542b13	不生。不滅。	不 生 不 滅 
X26n0520_001:0542b14	即空故不生。不即空故不滅。	即 空 故 不 生 不 即 空 故 不 滅 
X26n0520_001:0542b15	無相。無無相。	無 相 無 無 相 
X26n0520_001:0542b16	即幻色故無相。不即幻色故無無相。	即 幻 色 故 無 相 不 即 幻 色 故 無 無 相 
X26n0520_001:0542b17	不應起見。	不 應 起 見 
X26n0520_001:0542b18	非解所見。是謂行境。	非 解 所 見 是 謂 行 境 
X26n0520_001:0542b19	何以故。一切法皆如也。諸佛法僧。亦如也。	何 以 故 一 切 法 皆 如 也 諸 佛 法 僧 亦 如 也 
X26n0520_001:0542b20	法法皆如。即理法界於茲顯矣。△二理事無礙觀。	法 法 皆 如 即 理 法 界 於 茲 顯 矣 二 理 事 無 礙 觀 
X26n0520_001:0542b21	前文會色歸空。明空即色。皆揀情顯解。空色無礙。	前 文 會 色 歸 空 明 空 即 色 皆 揀 情 顯 解 空 色 無 礙 
X26n0520_001:0542b22	解終趣行。泯絕無寄。正成行體。雖有四門。方為真	解 終 趣 行 泯 絕 無 寄 正 成 行 體 雖 有 四 門 方 為 真 
X26n0520_001:0542b23	如之理。今此理事無礙觀。觀事當俗。觀理當真。令	如 之 理 今 此 理 事 無 礙 觀 觀 事 當 俗 觀 理 當 真 令 
X26n0520_001:0542b24	觀無礙。即顯真如之妙用。文二。初明聖證十地。	觀 無 礙 即 顯 真 如 之 妙 用 文 二 初 明 聖 證 十 地 
X26n0520_001:0542c01	聖智現前。最初一念。具足八萬四千波羅蜜多。名歡	聖 智 現 前 最 初 一 念 具 足 八萬四千 波羅蜜多 名 歡 
X26n0520_001:0542c02	喜地。	喜 地 
X26n0520_001:0542c03	據下經文。明十四忍。初地菩薩。行檀波羅蜜。今最	據 下 經 文 明 十 四 忍 初 地 菩 薩 行 檀 波 羅 蜜 今 最 
X26n0520_001:0542c04	初一念。具足八萬四千者。謂菩薩妙行。有其二種。	初 一 念 具 足 八萬四千 者 謂 菩 薩 妙 行 有 其 二 種 
X26n0520_001:0542c05	一行布。二圓融。行布是教相施設。圓融是理性德	一 行 布 二 圓 融 行 布 是 教 相 施 設 圓 融 是 理 性 德 
X26n0520_001:0542c06	用。行布不礙圓融。故最初一念具足八萬四千。圓	用 行 布 不 礙 圓 融 故 最 初 一 念 具 足 八萬四千 圓 
X26n0520_001:0542c07	融不礙行布。故初地聖人。行檀波羅蜜。賢劫經中。	融 不 礙 行 布 故 初 地 聖 人 行 檀 波 羅 蜜 賢 劫 經 中 
X26n0520_001:0542c08	但辨行布。唯此經與華嚴。具二無礙。故彼經初地	但 辨 行 布 唯 此 經 與 華 嚴 具 二 無 礙 故 彼 經 初 地 
X26n0520_001:0542c09	云。一地之中。具攝一切諸地功德。以此證之。則今	云 一 地 之 中 具 攝 一 切 諸 地 功 德 以 此 證 之 則 今 
X26n0520_001:0542c10	經屬一乘同教。其言不誣矣。	經 屬 一 乘 同 教 其 言 不 誣 矣 
X26n0520_001:0542c11	障盡解脫。	障 盡 解 脫 
X26n0520_001:0542c12	上明初地。此辨餘九。謂地地之中。皆斷一障二愚。	上 明 初 地 此 辨 餘 九 謂 地 地 之 中 皆 斷 一 障 二 愚 
X26n0520_001:0542c13	即證解脫果。	即 證 解 脫 果 
X26n0520_001:0542c14	運載名乘。	運 載 名 乘 
X26n0520_001:0542c15	謂運重載遠。即是大乘。梁攝論亦云。來大性故。名	謂 運 重 載 遠 即 是 大 乘 梁 攝 論 亦 云 來 大 性 故 名 
X26n0520_001:0542c16	為大乘。△二辨等妙二覺。	為 大 乘 二 辨 等 妙 二 覺 
X26n0520_001:0542c17	動相滅時。名金剛定。	動 相 滅 時 名 金 剛 定 
X26n0520_001:0542c18	動相即無明也。下經云。觀勝義諦。斷無明相。是為	動 相 即 無 明 也 下 經 云 觀 勝 義 諦 斷 無 明 相 是 為 
X26n0520_001:0542c19	等覺。亦以金剛喻定耳。	等 覺 亦 以 金 剛 喻 定 耳 
X26n0520_001:0542c20	體相平等。名一切智智。	體 相 平 等 名 一切智智 
X26n0520_001:0542c21	以根本智照體。後得智觀相。體相境不二。根後智	以 根 本 智 照 體 後 得 智 觀 相 體 相 境 不 二 根 後 智 
X26n0520_001:0542c22	不殊。即寂而照。其唯妙覺歟。△三文字釋詮上之	不 殊 即 寂 而 照 其 唯 妙 覺 歟 三 文 字 釋 詮 上 之 
X26n0520_001:0542c23	教三。初諸佛同宣。	教 三 初 諸 佛 同 宣 
X26n0520_001:0542c24	大王。此般若波羅蜜多。文字章句。	大 王 此 般 若 波羅蜜多 文 字 章 句 
X26n0520_001:0543a01	句詮差別。章者解句。	句 詮 差 別 章 者 解 句 
X26n0520_001:0543a02	百佛千佛。百千萬億。一切諸佛。而共同說。	百 佛 千 佛 百 千 萬 億 一切諸佛 而 共 同 說 
X26n0520_001:0543a03	諸佛道同。所說不異。下菩薩行品。大眾亦見恒沙	諸 佛 道 同 所 說 不 異 下 菩 薩 行 品 大 眾 亦 見 恒 沙 
X26n0520_001:0543a04	諸佛說十四忍。如我世尊所說無異。△二校量顯	諸 佛 說 十 四 忍 如 我 世 尊 所 說 無 異 二 校 量 顯 
X26n0520_001:0543a05	勝。	勝 
X26n0520_001:0543a06	若有人於恒河沙三千大千世界。	若 有 人 於 恒 河 沙 三千大千世界 
X26n0520_001:0543a07	俱舍偈云。四大洲日月。蘇迷盧欲天。梵世各一千。	俱 舍 偈 云 四 大 洲 日 月 蘇 迷 盧 欲 天 梵 世 各 一 千 
X26n0520_001:0543a08	名一小千界。此小千千陪。說名一中千。此千陪大	名 一 小 千 界 此 小 千 千 陪 說 名 一 中 千 此 千 陪 大 
X26n0520_001:0543a09	千。皆同一成壞。	千 皆 同 一 成 壞 
X26n0520_001:0543a10	滿中七寶。	滿 中 七 寶 
X26n0520_001:0543a11	金銀琉璃。珊瑚碼碯。赤真珠頗黎。	金 銀 琉 璃 珊 瑚 碼 碯 赤 真 珠 頗 黎 
X26n0520_001:0543a12	以用布施大千世界。一切有情。皆得阿羅漢果。	以用布施 大千世界 一切有情 皆 得阿羅漢 果 
X26n0520_001:0543a13	上校量。下顯勝。	上 校 量 下 顯 勝 
X26n0520_001:0543a14	不如有人於此經中。乃至起於一念淨信。	不 如 有 人 於 此 經 中 乃 至 起 於 一 念 淨 信 
X26n0520_001:0543a15	金剛云。信心清淨。則生實相。故超羅漢。自利偏真	金 剛 云 信 心 清 淨 則 生 實 相 故 超 羅 漢 自 利 偏 真 
X26n0520_001:0543a16	也。	也 
X26n0520_001:0543a17	何況有能受持讀誦解一句者。	何 況 有 能 受持讀誦 解 一 句 者 
X26n0520_001:0543a18	信力故受。念力故持。對文曰讀。離文曰誦。解一句	信 力 故 受 念 力 故 持 對 文 曰 讀 離 文 曰 誦 解 一 句 
X26n0520_001:0543a19	者。非非句也。△二徵釋所以二。初徵。	者 非 非 句 也 二 徵 釋 所 以 二 初 徵 
X26n0520_001:0543a20	所以有何。	所 以 有 何 
X26n0520_001:0543a21	一念淨信。所以勝者。何耶。△二釋二。初忘詮得旨	一 念 淨 信 所 以 勝 者 何 耶 二 釋 二 初 忘 詮 得 旨 
X26n0520_001:0543a22	勝。	勝 
X26n0520_001:0543a23	文字性離。無文字相。	文 字 性 離 無 文 字 相 
X26n0520_001:0543a24	淨名云。文字性離。無有文字。是則解脫。	淨 名 云 文 字 性 離 無 有 文 字 是 則 解 脫 
X26n0520_001:0543b01	非法。非非法。	非 法 非 非 法 
X26n0520_001:0543b02	天親論云。非法者。一切法無體相故。非非法者。彼	天 親 論 云 非 法 者 一 切 法 無 體 相 故 非 非 法 者 彼 
X26n0520_001:0543b03	真如無我實相有故。△二約法顯人勝。	真 如 無 我 實 相 有 故 二 約 法 顯 人 勝 
X26n0520_001:0543b04	般若空故。菩薩亦空。	般 若 空 故 菩 薩 亦 空 
X26n0520_001:0543b05	上句法。下句人。次徵釋云。	上 句 法 下 句 人 次 徵 釋 云 
X26n0520_001:0543b06	何以故。於十地中。地地皆有始生住生及以終生此	何 以 故 於 十 地 中 地 地 皆 有 始 生 住 生 及 以 終 生 此 
X26n0520_001:0543b07	三十生。悉皆是空。	三 十 生 悉 皆 是 空 
X26n0520_001:0543b08	以歡喜地最初見道。名為始生。於初地中。具修勝	以 歡 喜 地 最 初 見 道 名 為 始 生 於 初 地 中 具 修 勝 
X26n0520_001:0543b09	行。名為住生。初地將滿。進求後地。名為終生。餘九	行 名 為 住 生 初 地 將 滿 進 求 後 地 名 為 終 生 餘 九 
X26n0520_001:0543b10	例此。即成三十。亦是地地中。入住出三心也。上明	例 此 即 成 三 十 亦 是 地 地 中 入 住 出 三 心 也 上 明 
X26n0520_001:0543b11	因空。下例果空。	因 空 下 例 果 空 
X26n0520_001:0543b12	一切智智。亦復皆空。	一切智智 亦 復 皆 空 
X26n0520_001:0543b13	一切智根本智。下智字後得智。△二攝末歸本以	一 切 智 根 本 智 下 智 字 後 得 智 二 攝 末 歸 本 以 
X26n0520_001:0543b14	反結三。先結文字詮上之教二。初總標二種妄見。	反 結 三 先 結 文 字 詮 上 之 教 二 初 總 標 二 種 妄 見 
X26n0520_001:0543b15	大王。若菩薩見境見智見說見受。即非聖見。是愚夫	大 王 若 菩 薩 見 境 見 智 見 說 見 受 即 非 聖 見 是 愚 夫 
X26n0520_001:0543b16	見。	見 
X26n0520_001:0543b17	見實相之境。觀照之智。文字說受。非聖智真見。乃	見 實 相 之 境 觀 照 之 智 文 字 說 受 非 聖 智 真 見 乃 
X26n0520_001:0543b18	凡愚妄見也。△二別明詮上之教二。初三有果空	凡 愚 妄 見 也 二 別 明 詮 上 之 教 二 初 三 有 果 空 
X26n0520_001:0543b19	三。初總標。	三 初 總 標 
X26n0520_001:0543b20	有情果報。三界虗妄。	有 情 果 報 三 界 虗 妄 
X26n0520_001:0543b21	六趣輪迴。即有情世間正報也。三界虗妄。即器世	六 趣 輪 迴 即 有 情 世 間 正 報 也 三 界 虗 妄 即 器 世 
X26n0520_001:0543b22	間依報也。然虗妄之言。總該四惡趣。及四洲等。故	間 依 報 也 然 虗 妄 之 言 總 該 四 惡 趣 及 四 洲 等 故 
X26n0520_001:0543b23	楞嚴云。此等亦皆自虗妄業之所招引。△二別列。	楞 嚴 云 此 等 亦 皆 自 虗 妄 業 之 所 招 引 二 別 列 
X26n0520_001:0543b24	欲界分別所造諸業。	欲 界 分 別 所 造 諸 業 
X26n0520_001:0543c01	欲界六天諸識分別所造諸業。即修上品十善。及	欲界六天 諸 識 分 別 所 造 諸 業 即 修 上 品 十 善 及 
X26n0520_001:0543c02	施戒等。分別謂心跡也。楞嚴又謂。如是六天。形雖	施 戒 等 分 別 謂 心 跡 也 楞 嚴 又 謂 如 是 六 天 形 雖 
X26n0520_001:0543c03	出動。心跡尚交。	出 動 心 跡 尚 交 
X26n0520_001:0543c04	色四靜慮定所作業。	色 四 靜 慮 定 所 作 業 
X26n0520_001:0543c05	色界四禪天。定慧雙修。為所作業。靜定也。慮慧也。	色 界 四 禪 天 定 慧 雙 修 為 所 作 業 靜 定 也 慮 慧 也 
X26n0520_001:0543c06	定慧均平。方稱靜慮。楞嚴亦云。不假禪那。無有智	定 慧 均 平 方 稱 靜 慮 楞 嚴 亦 云 不 假 禪 那 無 有 智 
X26n0520_001:0543c07	慧。	慧 
X26n0520_001:0543c08	無色四空定所起業。	無 色 四 空 定 所 起 業 
X26n0520_001:0543c09	無色界四空天。定果色起。業果色滅。楞嚴又謂。是	無 色 界 四 空 天 定 果 色 起 業 果 色 滅 楞 嚴 又 謂 是 
X26n0520_001:0543c10	四空天。身心滅盡。定性現前。無業果色。△三顯空。	四 空 天 身 心 滅 盡 定 性 現 前 無 業 果 色 三 顯 空 
X26n0520_001:0543c11	三有業果。一切皆空。	三 有 業 果 一切皆空 
X26n0520_001:0543c12	四趣惡業果。人天善業果。上界禪定果。△二三界	四 趣 惡 業 果 人 天 善 業 果 上 界 禪 定 果 二 三 界 
X26n0520_001:0543c13	因空。	因 空 
X26n0520_001:0543c14	三界根本。無明亦空。	三 界 根 本 無 明 亦 空 
X26n0520_001:0543c15	三界有情。皆以無明。而為根本。故俱舍頌云。無明	三 界 有 情 皆 以 無 明 而 為 根 本 故 俱 舍 頌 云 無 明 
X26n0520_001:0543c16	諸有本。前業果既空。今惑因亦空。△二結觀照能	諸 有 本 前 業 果 既 空 今 惑 因 亦 空 二 結 觀 照 能 
X26n0520_001:0543c17	觀妙慧三。初明十地空。	觀 妙 慧 三 初 明 十 地 空 
X26n0520_001:0543c18	聖位諸地。無漏生滅。	聖 位 諸 地 無 漏 生 滅 
X26n0520_001:0543c19	地上菩薩。分得無漏之智。證無生滅之理。上通辨	地 上 菩 薩 分 得 無 漏 之 智 證 無 生 滅 之 理 上 通 辨 
X26n0520_001:0543c20	十地。下別明七八。	十 地 下 別 明 七 八 
X26n0520_001:0543c21	於三界中。餘無明習。	於 三 界 中 餘 無 明 習 
X26n0520_001:0543c22	七遠行地。斷餘無明習氣。故下偈云。順道法愛無	七 遠 行 地 斷 餘 無明習氣 故 下 偈 云 順 道 法 愛 無 
X26n0520_001:0543c23	明習。遠行菩薩獨能斷。	明 習 遠 行 菩 薩 獨 能 斷 
X26n0520_001:0543c24	變易果報。亦復皆空。	變 易 果 報 亦 復 皆 空 
X26n0520_001:0544a01	八不動地。受變易果。報行純熟。如下偈云。不動菩	八 不 動 地 受 變 易 果 報 行 純 熟 如 下 偈 云 不 動 菩 
X26n0520_001:0544a02	薩二禪王。得變易身常自在。△二辨等覺空。	薩 二 禪 王 得 變 易 身 常 自 在 二 辨 等 覺 空 
X26n0520_001:0544a03	等覺菩薩。得金剛定。二死因果空。一切智亦空。	等 覺 菩 薩 得 金 剛 定 二 死 因 果 空 一 切 智 亦 空 
X26n0520_001:0544a04	分段變易二種生死為果。由其煩惱所知二障為	分 段 變 易 二 種 生 死 為 果 由 其 煩惱所知 二 障 為 
X26n0520_001:0544a05	因。所斷因果既空。則能斷一切智亦空也。△三示	因 所 斷 因 果 既 空 則 能 斷 一 切 智 亦 空 也 三 示 
X26n0520_001:0544a06	妙覺空。	妙 覺 空 
X26n0520_001:0544a07	佛無上覺。種智圓滿。擇非擇滅。	佛 無 上 覺 種 智 圓 滿 擇 非 擇 滅 
X26n0520_001:0544a08	以慧揀擇。斷無明惑。佛果無斷。故非擇滅。起信云。	以 慧 揀 擇 斷 無 明 惑 佛 果 無 斷 故 非 擇 滅 起 信 云 
X26n0520_001:0544a09	無明頓盡。名一切種智。上顯涅槃斷果。次明菩提	無 明 頓 盡 名 一切種智 上 顯 涅 槃 斷 果 次 明 菩 提 
X26n0520_001:0544a10	智果。	智 果 
X26n0520_001:0544a11	真淨法界。性相平等。應用亦空。	真 淨 法 界 性 相 平 等 應 用 亦 空 
X26n0520_001:0544a12	性相不二。本唯一真。依真起應。用化羣生。羣生本	性 相 不 二 本 唯 一 真 依 真 起 應 用 化 羣 生 羣 生 本 
X26n0520_001:0544a13	如。應用皆空也。△三結實相所觀真性。	如 應 用 皆 空 也 三 結 實 相 所 觀 真 性 
X26n0520_001:0544a14	善男子。若有脩習般若波羅蜜多。	善 男 子 若 有 脩 習 般 若 波羅蜜多 
X26n0520_001:0544a15	躡前觀照。	躡 前 觀 照 
X26n0520_001:0544a16	說者聽者。譬如幻士。	說 者 聽 者 譬 如 幻 士 
X26n0520_001:0544a17	即真而俗。有說有聽。	即 真 而 俗 有 說 有 聽 
X26n0520_001:0544a18	無說無聽。法同法性。猶如虗空。	無 說 無 聽 法 同 法 性 猶 如 虗 空 
X26n0520_001:0544a19	即俗而真。無說無聞。	即 俗 而 真 無 說 無 聞 
X26n0520_001:0544a20	一切法皆如也。	一 切 法 皆 如 也 
X26n0520_001:0544a21	真俗不二。唯一實相。世出世法皆如也。△五略示	真 俗 不 二 唯 一 實 相 世 出 世 法 皆 如 也 五 略 示 
X26n0520_001:0544a22	因人護果。	因 人 護 果 
X26n0520_001:0544a23	大王。菩薩摩訶薩。護佛果為若此。	大 王 菩薩摩訶薩 護 佛 果 為 若 此 
X26n0520_001:0544a24	由其內護佛果。則能外護國土。內外更資。皆由般	由 其 內 護 佛 果 則 能 外 護 國 土 內 外 更 資 皆 由 般 
X26n0520_001:0544b01	若。其德如是。△六問答何相觀佛。夫能對揚妙訓。	若 其 德 如 是 六 問 答 何 相 觀 佛 夫 能 對 揚 妙 訓 
X26n0520_001:0544b02	隱顯其迹。皆法身大士。今經與夫淨名總相問答。	隱 顯 其 迹 皆 法身大士 今 經 與 夫 淨 名 總 相 問 答 
X26n0520_001:0544b03	文勢全同。故以匿王。例維摩詰。唯別答中。大同小	文 勢 全 同 故 以 匿 王 例 維 摩 詰 唯 別 答 中 大 同 小 
X26n0520_001:0544b04	異。抑又彼廣此略耳。文三。初覺帝埀問。	異 抑 又 彼 廣 此 略 耳 文 三 初 覺 帝 埀 問 
X26n0520_001:0544b05	爾時世尊。告波斯匿王言。汝以何相。而觀如來。	爾 時 世 尊 告 波 斯 匿 王 言 汝 以 何 相 而 觀 如 來 
X26n0520_001:0544b06	全同彼經。問維摩詰云。汝欲見如來。為以何等觀	全 同 彼 經 問 維 摩 詰 云 汝 欲 見 如 來 為 以 何 等 觀 
X26n0520_001:0544b07	如來乎。羅什釋曰。若自有慧眼。則能玄照。不能觀	如 來 乎 羅 什 釋 曰 若 自 有 慧 眼 則 能 玄 照 不 能 觀 
X26n0520_001:0544b08	形。若無慧眼。則對形而隔。故問其所以何等觀如	形 若 無 慧 眼 則 對 形 而 隔 故 問 其 所 以 何 等 觀 如 
X26n0520_001:0544b09	來。△二仁王申答三。初總答。	來 二 仁 王 申 答 三 初 總 答 
X26n0520_001:0544b10	波斯匿王言。觀身實相。觀佛亦然。	波 斯 匿 王 言 觀 身 實 相 觀 佛 亦 然 
X26n0520_001:0544b11	即同維摩詰言。如自觀身實相。觀佛亦然。肇公釋	即 同 維 摩 詰 言 如 自 觀 身 實 相 觀 佛 亦 然 肇 公 釋 
X26n0520_001:0544b12	云。佛者何也。蓋窮理盡性。大覺之稱也。其道虗玄。	云 佛 者 何 也 蓋 窮 理 盡 性 大 覺 之 稱 也 其 道 虗 玄 
X26n0520_001:0544b13	固以玅絕常境。心不可以智知。形不可以像測。同	固 以 玅 絕 常 境 心 不 可 以 智 知 形 不 可 以 像 測 同 
X26n0520_001:0544b14	萬物之為。而居不為之域。處言數之內。而止無言	萬 物 之 為 而 居 不 為 之 域 處 言 數 之 內 而 止 無 言 
X26n0520_001:0544b15	之鄉。故經曰。見實相法。為見佛也。△二別答。然淨	之 鄉 故 經 曰 見 實 相 法 為 見 佛 也 二 別 答 然 淨 
X26n0520_001:0544b16	名經別答中。羅什三藏。生肇二師。各申義解。今依	名 經 別 答 中 羅 什 三 藏 生 肇 二 師 各 申 義 解 今 依 
X26n0520_001:0544b17	本宗正解。深文而獨取肇師。兼明奧旨。若夫以教	本 宗 正 解 深 文 而 獨 取 肇 師 兼 明 奧 旨 若 夫 以 教 
X26n0520_001:0544b18	收經。如下文謂。不住三際。不離三際等。皆終教收。	收 經 如 下 文 謂 不 住 三 際 不 離 三 際 等 皆 終 教 收 
X26n0520_001:0544b19	非施非慳等。皆頓教攝。亦準演義鈔文。科判耳。	非 施 非 慳 等 皆 頓 教 攝 亦 準 演 義 鈔 文 科 判 耳 
X26n0520_001:0544b20	無前際。無後際。無中際。	無 前 際 無 後 際 無 中 際 
X26n0520_001:0544b21	謂所觀實相。不從前際來。非向後際去。不於現在	謂 所 觀 實 相 不 從 前 際 來 非 向 後 際 去 不 於 現 在 
X26n0520_001:0544b22	住。是則三際泯絕。一念斯忘矣。	住 是 則 三 際 泯 絕 一 念 斯 忘 矣 
X26n0520_001:0544b23	不住三際。不離三際。	不 住 三 際 不 離 三 際 
X26n0520_001:0544b24	三際求心。心不有不住也。三世悉在無有餘。不離	三 際 求 心 心 不 有 不 住 也 三 世 悉 在 無 有 餘 不 離 
X26n0520_001:0544c01	也。是則時無別體故不住。念劫圓融故不離。	也 是 則 時 無 別 體 故 不 住 念 劫 圓 融 故 不 離 
X26n0520_001:0544c02	不住五蘊。不離五蘊。	不 住 五 蘊 不 離 五 蘊 
X26n0520_001:0544c03	實色非真空故不住。真空即幻色故不離。	實 色 非 真 空 故 不 住 真 空 即 幻 色 故 不 離 
X26n0520_001:0544c04	不住四大。不離四大。	不 住 四 大 不 離 四 大 
X26n0520_001:0544c05	地水火風緣生而有。不住也。清淨本然周徧法界。	地水火風 緣 生 而 有 不 住 也 清 淨 本 然 周 徧 法 界 
X26n0520_001:0544c06	不離也。	不 離 也 
X26n0520_001:0544c07	不住六處。不離六處。	不 住 六 處 不 離 六 處 
X26n0520_001:0544c08	見聞如幻瞖。三界若空華。不住六處也。於諸如來。	見 聞 如 幻 瞖 三 界 若 空 華 不 住 六 處 也 於 諸 如 來 
X26n0520_001:0544c09	常了了分明見。不離六處也。	常 了 了 分 明 見 不 離 六 處 也 
X26n0520_001:0544c10	不住三界。不離三界。	不 住 三 界 不 離 三 界 
X26n0520_001:0544c11	實相淨而娑婆穢。不住三界也。而穢國與實相融	實 相 淨 而 娑 婆 穢 不 住 三 界 也 而 穢 國 與 實 相 融 
X26n0520_001:0544c12	通。故不離三界也。	通 故 不 離 三 界 也 
X26n0520_001:0544c13	不住方。不離方。	不 住 方 不 離 方 
X26n0520_001:0544c14	法身無在。而無不在。無在故不住方。無不在故不	法 身 無 在 而 無 不 在 無 在 故 不 住 方 無 不 在 故 不 
X26n0520_001:0544c15	離方。	離 方 
X26n0520_001:0544c16	明無明等。	明 無 明 等 
X26n0520_001:0544c17	實相無相。體順三明。雖有三明。而不異無明也。	實 相 無 相 體 順 三 明 雖 有 三 明 而 不 異 無 明 也 
X26n0520_001:0544c18	非一非異。	非一非異 
X26n0520_001:0544c19	無像不像。故非一像。而無像故非異。	無 像 不 像 故 非 一 像 而 無 像 故 非 異 
X26n0520_001:0544c20	非此非彼。非淨非穢。	非 此 非 彼 非 淨 非 穢 
X26n0520_001:0544c21	處生死而非此岸。非穢國。居涅槃而非彼岸。非淨	處 生 死 而 非 此 岸 非 穢 國 居 涅 槃 而 非 彼 岸 非 淨 
X26n0520_001:0544c22	邦。	邦 
X26n0520_001:0544c23	非有為。非無為。	非 有 為 非 無 為 
X26n0520_001:0544c24	欲言有為。無相無名。欲言無為。備應萬形。	欲 言 有 為 無 相 無 名 欲 言 無 為 備 應 萬 形 
X26n0520_001:0545a01	無自相。無他相。	無 自 相 無 他 相 
X26n0520_001:0545a02	冥穢潛應無自相。攝應會真無他相。	冥 穢 潛 應 無 自 相 攝 應 會 真 無 他 相 
X26n0520_001:0545a03	無名無相。	無 名 無 相 
X26n0520_001:0545a04	不可以名名。不可以相相。	不 可 以 名 名 不 可 以 相 相 
X26n0520_001:0545a05	無強無弱。無示無說。	無 強 無 弱 無 示 無 說 
X26n0520_001:0545a06	理絕上智。無強無說也。事泯下愚。無弱無示也。	理 絕 上 智 無 強 無 說 也 事 泯 下 愚 無 弱 無 示 也 
X26n0520_001:0545a07	非施非慳。非戒非犯。非忍非恚。非進非怠。非定非亂。	非 施 非 慳 非 戒 非 犯 非 忍 非 恚 非 進 非 怠 非 定 非 亂 
X26n0520_001:0545a08	非智非愚。	非 智 非 愚 
X26n0520_001:0545a09	真性具德。非六度之所修。玅慧圓通。非六蔽之能	真 性 具 德 非 六 度 之 所 修 玅 慧 圓 通 非 六 蔽 之 能 
X26n0520_001:0545a10	障。	障 
X26n0520_001:0545a11	非來非去。非入非出。	非 來 非 去 非 入 非 出 
X26n0520_001:0545a12	物感而顯。非王宮出來。感畢而隱。非雙樹入去。	物 感 而 顯 非 王 宮 出 來 感 畢 而 隱 非 雙 樹 入 去 
X26n0520_001:0545a13	非福田。非不福田。	非 福 田 非 不 福 田 
X26n0520_001:0545a14	無心應物。非福田也。有求皆益。非不福田。	無 心 應 物 非 福 田 也 有 求 皆 益 非 不 福 田 
X26n0520_001:0545a15	非相非無相。非取非捨。	非 相 非 無 相 非 取 非 捨 
X26n0520_001:0545a16	非相故。不可以有心取。非無相故。不可以無念捨。	非 相 故 不 可 以 有 心 取 非 無 相 故 不 可 以 無 念 捨 
X26n0520_001:0545a17	非大非小。非見非聞。非覺非知。	非 大 非 小 非 見 非 聞 非 覺 非 知 
X26n0520_001:0545a18	非小故。展之徧法界。非凡夫眼見耳聞也。非大故。	非 小 故 展 之 徧 法 界 非 凡 夫 眼 見 耳 聞 也 非 大 故 
X26n0520_001:0545a19	卷之入一塵。非二乘身覺智知也。△三結答。	卷 之 入 一 塵 非 二 乘 身 覺 智 知 也 三 結 答 
X26n0520_001:0545a20	心行處滅。言語道斷。同真際。等法性。	心行處滅 言語道斷 同 真 際 等 法 性 
X26n0520_001:0545a21	心行處滅。不可以心思也。言語道斷。即等法性。不	心行處滅 不 可 以 心 思 也 言語道斷 即 等 法 性 不 
X26n0520_001:0545a22	可以口議也。	可 以 口 議 也 
X26n0520_001:0545a23	我以此相。而觀如來。	我 以 此 相 而 觀 如 來 
X26n0520_001:0545a24	我以實相。而觀法身如來。故前文云。觀身實相。觀	我 以 實 相 而 觀 法 身 如 來 故 前 文 云 觀 身 實 相 觀 
