X26n0558_001:0888b03	 般若心經指掌序	 般 若 心 經 指 掌 序 
X26n0558_001:0888b04	般若無知諸法本寂根由一真之妙體影現二諦之	般 若 無 知 諸 法 本 寂 根 由 一 真 之 妙 體 影 現 二 諦 之 
X26n0558_001:0888b05	浮名似實似虗非虗實之所能擬亦離亦合非離合	浮 名 似 實 似 虗 非 虗 實 之 所 能 擬 亦 離 亦 合 非 離 合 
X26n0558_001:0888b06	之所能明所以空而非空有而非有互成不妨互奪	之 所 能 明 所 以 空 而 非 空 有 而 非 有 互 成 不 妨 互 奪 
X26n0558_001:0888b07	並存亦可並亡泯立無閡隱顯自在是謂般若之玄	並 存 亦 可 並 亡 泯 立 無 閡 隱 顯 自 在 是 謂 般 若 之 玄 
X26n0558_001:0888b08	宗也怎柰凡心易惑智火難然如舉網以張風似從	宗 也 怎 柰 凡 心 易 惑 智 火 難 然 如 舉 網 以 張 風 似 從 
X26n0558_001:0888b09	波而捉月徒歷艱辛翻成障礙由是百苦交纏千殃	波 而 捉 月 徒 歷 艱 辛 翻 成 障 礙 由 是 百 苦 交 纏 千 殃 
X26n0558_001:0888b10	並集都由此一念之執耳茲般若心經者文約而義	並 集 都 由 此 一 念 之 執 耳 茲 般 若 心 經 者 文 約 而 義 
X26n0558_001:0888b11	寔豐詞顯而理殊奧首開空色兩門專破有無二執	寔 豐 詞 顯 而 理 殊 奧 首 開 空 色 兩 門 專 破 有 無 二 執 
X26n0558_001:0888b12	有無盡而實相可顯色空合而妙義方圓日用明此	有 無 盡 而 實 相 可 顯 色 空 合 而 妙 義 方 圓 日 用 明 此 
X26n0558_001:0888b13	般若之道思過半矣嘗見諸家註釋罕臻其奧唯贒	般 若 之 道 思 過 半 矣 嘗 見 諸 家 註 釋 罕 臻 其 奧 唯 贒 
X26n0558_001:0888b14	首孤山二疏果彌法壇老將但廣摭經論侈布筌[(ㄇ@(企止))/弟]	首 孤 山 二 疏 果 彌 法 壇 老 將 但 廣 摭 經 論 侈 布 筌 [ㄇ企止弟] 
X26n0558_001:0888b15	非初學之所可通故茲特為指掌使其易見所以便	非 初 學 之 所 可 通 故 茲 特 為 指 掌 使 其 易 見 所 以 便 
X26n0558_001:0888b16	初學也然萬里之行起於跬步觀者幸毋忽焉。	初 學 也 然 萬 里 之 行 起 於 跬 步 觀 者 幸 毋 忽 焉 
X26n0558_001:0888b17	歲在甲午孟秋佛歡喜日	歲 在 甲 午 孟 秋 佛 歡 喜 日 
X26n0558_001:0888b18	鼓山比丘元贒稽首和南序	鼓 山 比 丘 元 贒 稽 首 和 南 序 
X26n0558_001:0888b19	贊。	贊 
X26n0558_001:0888b20	　老漢行年今八十　　世間事事皆收拾	 老 漢 行 年 今 八 十 世 間 事 事 皆 收 拾 
X26n0558_001:0888b21	　唯這影子遍諸方　　敗露重重遮不及	 唯 這 影 子 遍 諸 方 敗 露 重 重 遮 不 及 
X26n0558_001:0888b22	會麼。	會 麼 
X26n0558_001:0888b23	有相身中無相身低頭方見明歷歷。	有 相 身 中 無 相 身 低 頭 方 見 明 歷 歷 
X26n0558_001:0888b24	永覺老人自題	永 覺 老 人 自 題 
X26n0558_001:0888c05	般若心經指掌	般 若 心 經 指 掌 
X26n0558_001:0888c07	鼓山傳法沙門　元贒　述	鼓 山 傳 法 沙 門 元 贒 述 
X26n0558_001:0888c08	般若波羅蜜多心經	般 若 波羅蜜多 心 經 
X26n0558_001:0888c09	般若此云智慧即神悟玄奧妙契真源也波羅蜜	般 若 此 云 智 慧 即 神 悟 玄 奧 妙 契 真 源 也 波 羅 蜜 
X26n0558_001:0888c10	多此云彼岸到即由此妙慧翻生死過盡至真空	多 此 云 彼 岸 到 即 由 此 妙 慧 翻 生 死 過 盡 至 真 空 
X26n0558_001:0888c11	之際也般若是體波羅蜜多是用必合體用以成	之 際 也 般 若 是 體 波羅蜜多 是 用 必 合 體 用 以 成 
X26n0558_001:0888c12	名者乃是簡不到彼岸之慧也心是喻喻此經乃	名 者 乃 是 簡 不 到 彼 岸 之 慧 也 心 是 喻 喻 此 經 乃 
X26n0558_001:0888c13	大部六百卷之精要如人之一身雖有五官百骸	大 部 六 百 卷 之 精 要 如 人 之 一 身 雖 有 五 官 百 骸 
X26n0558_001:0888c14	而心為之主也上六字是所詮之法下經字乃能	而 心 為 之 主 也 上 六 字 是 所 詮 之 法 下 經 字 乃 能 
X26n0558_001:0888c15	詮之教經訓正訓常亦訓徑謂此所詮之法乃聖	詮 之 教 經 訓 正 訓 常 亦 訓 徑 謂 此 所 詮 之 法 乃 聖 
X26n0558_001:0888c16	凡同稟之正軌今古不易之常道亦即是出凡入	凡 同 稟 之 正 軌 今 古 不 易 之 常 道 亦 即 是 出 凡 入 
X26n0558_001:0888c17	聖之要路也。	聖 之 要 路 也 
X26n0558_001:0888c18	觀自在菩薩行深般若波羅蜜多時照見五蘊皆空	觀 自 在 菩 薩 行 深 般 若 波羅蜜多 時 照 見 五 蘊 皆 空 
X26n0558_001:0888c19	度一切苦厄。	度 一 切 苦 厄 
X26n0558_001:0888c20	此乃據行而略標綱要也觀自在菩薩者以此菩	此 乃 據 行 而 略 標 綱 要 也 觀 自 在 菩 薩 者 以 此 菩 
X26n0558_001:0888c21	薩妙慧圓照空有了無罣礙所以能有能無可空	薩 妙 慧 圓 照 空 有 了 無 罣 礙 所 以 能 有 能 無 可 空 
X26n0558_001:0888c22	可色得大自在故得此名菩薩梵語菩提薩埵華	可 色 得 大 自 在 故 得 此 名 菩 薩 梵 語 菩 提 薩 埵 華 
X26n0558_001:0888c23	言覺眾生稱菩薩者從略也行深般若者謂所脩	言 覺 眾 生 稱 菩 薩 者 從 略 也 行 深 般 若 者 謂 所 脩 
X26n0558_001:0888c24	行之般若乃是人法雙空惟一實相非同二乘偏	行 之 般 若 乃 是 人 法 雙 空 惟 一 實 相 非 同 二 乘 偏 
X26n0558_001:0889a01	淺所觀也照見五蘊皆空者謂達見五蘊自性本	淺 所 觀 也 照 見 五 蘊 皆 空 者 謂 達 見 五 蘊 自 性 本 
X26n0558_001:0889a02	空即二空理深慧所見也五蘊色受想行識也色	空 即 二 空 理 深 慧 所 見 也 五 蘊 色 受 想 行 識 也 色 
X26n0558_001:0889a03	即五根五塵及法塵之半分非止幻身也受謂幻	即 五 根 五 塵 及 法 塵 之 半 分 非 止 幻 身 也 受 謂 幻 
X26n0558_001:0889a04	身領納外塵而得受用有苦有樂及不苦不樂之	身 領 納 外 塵 而 得 受 用 有 苦 有 樂 及 不苦不樂 之 
X26n0558_001:0889a05	殊也想者謂心緣外境而成相也行謂造作念念	殊 也 想 者 謂 心 緣 外 境 而 成 相 也 行 謂 造 作 念 念 
X26n0558_001:0889a06	生滅遷流不息也識謂分別前境也識是心王受	生 滅 遷 流 不 息 也 識 謂 分 別 前 境 也 識 是 心 王 受 
X26n0558_001:0889a07	想行皆心所合之一妄心也度一切苦厄者謂證	想 行 皆 心 所 合 之 一 妄 心 也 度 一 切 苦 厄 者 謂 證 
X26n0558_001:0889a08	見真空苦惱斯盡當得遠離分段變易二種生死	見 真 空 苦 惱 斯 盡 當 得 遠 離 分 段 變 易 二 種 生 死 
X26n0558_001:0889a09	之苦也原夫凡夫之人執五蘊為我我所由是起	之 苦 也 原 夫 凡 夫 之 人 執 五 蘊 為 我 我 所 由 是 起 
X26n0558_001:0889a10	惑造業輪迴六道甘受諸苦無有出期二乘雖不	惑 造 業 輪 迴 六 道 甘 受 諸 苦 無 有 出 期 二 乘 雖 不 
X26n0558_001:0889a11	執為我我所而猶執蘊為實有所以躭空滯寂視	執 為 我 我 所 而 猶 執 蘊 為 實 有 所 以 躭 空 滯 寂 視 
X26n0558_001:0889a12	三界為牢獄不發度生之願是謂焦芽敗種無成	三 界 為 牢 獄 不 發 度 生 之 願 是 謂 焦 芽 敗 種 無 成 
X26n0558_001:0889a13	佛分佛深愍之故為說此般若之法使其知五蘊	佛 分 佛 深 愍 之 故 為 說 此 般 若 之 法 使 其 知 五 蘊 
X26n0558_001:0889a14	本空則身心如幻世界如化二執永亡三障頓消	本 空 則 身 心 如 幻 世 界 如 化 二 執 永 亡 三 障 頓 消 
X26n0558_001:0889a15	可以長御白牛廣運眾生同至彼岸而佛與眾生	可 以 長 御 白 牛 廣 運 眾 生 同 至 彼 岸 而 佛 與 眾 生 
X26n0558_001:0889a16	之名俱不可得矣。	之 名 俱 不 可 得 矣 
X26n0558_001:0889a17	舍利子色不異空空不異色色即是空空即是色受	舍 利 子 色不異空 空不異色 色 即 是 空 空 即 是 色 受 
X26n0558_001:0889a18	想行識亦復如是。	想 行 識 亦復如是 
X26n0558_001:0889a19	此下至三藐三菩提皆就機而廣陳實義也舍利	此 下 至 三藐三菩提 皆 就 機 而 廣 陳 實 義 也 舍 利 
X26n0558_001:0889a20	子佛之弟子智慧第一權現聲聞為眾上首故佛	子 佛 之 弟 子 智慧第一 權 現 聲 聞 為 眾 上 首 故 佛 
X26n0558_001:0889a21	呼其名而告之曰吾所謂照見五蘊皆空者非是	呼 其 名 而 告 之 曰 吾 所 謂 照 見 五 蘊 皆 空 者 非 是 
X26n0558_001:0889a22	離蘊之空乃即蘊之空也汝宗中但知蘊中無人	離 蘊 之 空 乃 即 蘊 之 空 也 汝 宗 中 但 知 蘊 中 無 人 
X26n0558_001:0889a23	而不知蘊亦非實必欲滅色方可見空是取斷滅	而 不 知 蘊 亦 非 實 必 欲 滅 色 方 可 見 空 是 取 斷 滅 
X26n0558_001:0889a24	空也當知色不異空空不異色未可差殊而觀蓋	空 也 當 知 色不異空 空不異色 未 可 差 殊 而 觀 蓋 
X26n0558_001:0889b01	空之與色本是一體色乃空之色未嘗不空故不	空 之 與 色 本 是 一 體 色 乃 空 之 色 未 嘗 不 空 故 不 
X26n0558_001:0889b02	異空空乃色之空未嘗不色故不異色豈可於色	異 空 空 乃 色 之 空 未 嘗 不 色 故 不 異 色 豈 可 於 色 
X26n0558_001:0889b03	外取空滅色見空哉佛復恐人猶存空色二見故	外 取 空 滅 色 見 空 哉 佛 復 恐 人 猶 存 空 色 二 見 故 
X26n0558_001:0889b04	又告之曰色即是空空即是色二諦恒存一味常	又 告 之 曰 色 即 是 空 空 即 是 色 二 諦 恒 存 一 味 常 
X26n0558_001:0889b05	顯非一非二亦一亦二涉有而不累于有觀空而	顯 非 一 非 二 亦 一 亦 二 涉 有 而 不 累 于 有 觀 空 而 
X26n0558_001:0889b06	不醉于空存亡無礙圓通無寄般若玄旨盡在斯	不 醉 于 空 存 亡 無 礙 圓 通 無 寄 般 若 玄 旨 盡 在 斯 
X26n0558_001:0889b07	矣受想行識雖非質礙之物但均屬幻有其望真	矣 受 想 行 識 雖 非 質 礙 之 物 但 均 屬 幻 有 其 望 真 
X26n0558_001:0889b08	空與色無殊故曰亦復如是此乃般若之要義學	空 與 色 無 殊 故 曰 亦復如是 此 乃 般 若 之 要 義 學 
X26n0558_001:0889b09	者宜盡心焉問舊解有水氷之喻世多相襲今何	者 宜 盡 心 焉 問 舊 解 有 水 氷 之 喻 世 多 相 襲 今 何 
X26n0558_001:0889b10	不用答以其法喻之不齊也空色雖有相成之義	不 用 答 以 其 法 喻 之 不 齊 也 空 色 雖 有 相 成 之 義 
X26n0558_001:0889b11	然非壞色以顯空亦非壞空以顯色今水結為氷	然 非 壞 色 以 顯 空 亦 非 壞 空 以 顯 色 今 水 結 為 氷 
X26n0558_001:0889b12	則水相壞也氷融為水則氷相壞也壞一顯一是	則 水 相 壞 也 氷 融 為 水 則 氷 相 壞 也 壞 一 顯 一 是 
X26n0558_001:0889b13	全不知空色之義故今不用也。	全 不 知 空 色 之 義 故 今 不 用 也 
X26n0558_001:0889b14	舍利子是諸法空相不生不滅不垢不淨不增不減。	舍 利 子 是 諸 法 空 相 不生不滅 不垢不淨 不增不減 
X26n0558_001:0889b15	是諸法指前五蘊也空相即五蘊空之相狀乃二	是 諸 法 指 前 五 蘊 也 空 相 即 五 蘊 空 之 相 狀 乃 二 
X26n0558_001:0889b16	空理顯也蓋有法則有生滅有垢淨有增減今法	空 理 顯 也 蓋 有 法 則 有 生 滅 有 垢 淨 有 增 減 今 法 
X26n0558_001:0889b17	既亡惟一真空豈復有生滅等之可言哉古有作	既 亡 惟 一 真 空 豈 復 有 生 滅 等 之 可 言 哉 古 有 作 
X26n0558_001:0889b18	道前道中道後釋者非是愚意真空相顯即佛亦	道 前 道 中 道 後 釋 者 非 是 愚 意 真 空 相 顯 即 佛 亦 
X26n0558_001:0889b19	且不立況道前道中道後乎又諸法空相有師作	且 不 立 況 道 前 道 中 道 後 乎 又 諸 法 空 相 有 師 作 
X26n0558_001:0889b20	真空實相釋者愚意不敢襲用以經既明言是諸	真 空 實 相 釋 者 愚 意 不 敢 襲 用 以 經 既 明 言 是 諸 
X26n0558_001:0889b21	法空相何得改作實相彼將謂諸妄既銷不真何	法 空 相 何 得 改 作 實 相 彼 將 謂 諸 妄 既 銷 不 真 何 
X26n0558_001:0889b22	待則空相便是實相也不知幻色真空俱以實相	待 則 空 相 便 是 實 相 也 不 知 幻 色 真 空 俱 以 實 相 
X26n0558_001:0889b23	為體若悟實相非獨真空是實相即幻色亦實相	為 體 若 悟 實 相 非 獨 真 空 是 實 相 即 幻 色 亦 實 相 
X26n0558_001:0889b24	也故法華云是法住法位世間相常住今但認空	也 故 法 華 云 是 法 住 法 位 世 間 相 常 住 今 但 認 空 
X26n0558_001:0889c01	相為實相則其為實相不亦偏乎且空相雖是實	相 為 實 相 則 其 為 實 相 不 亦 偏 乎 且 空 相 雖 是 實 
X26n0558_001:0889c02	相而實相中著不得空字不若但依經文為正。	相 而 實 相 中 著 不 得 空 字 不 若 但 依 經 文 為 正 
X26n0558_001:0889c03	是故空中無色無受想行識無眼耳鼻舌身意無色	是 故 空 中 無 色 無 受 想 行 識 無 眼 耳 鼻 舌 身 意 無 色 
X26n0558_001:0889c04	聲香味觸法無眼界乃至無意識界。	聲香味觸 法 無 眼 界 乃 至 無 意 識 界 
X26n0558_001:0889c05	空中即前諸法空之中也真空相現萬法俱泯故	空 中 即 前 諸 法 空 之 中 也 真 空 相 現 萬 法 俱 泯 故 
X26n0558_001:0889c06	皆無之非是壞法性本無故下並準此可知五蘊	皆 無 之 非 是 壞 法 性 本 無 故 下 並 準 此 可 知 五 蘊 
X26n0558_001:0889c07	十二處十八界總是色心二者隨機開合故不同	十 二 處 十 八 界 總 是 色 心 二 者 隨 機 開 合 故 不 同 
X26n0558_001:0889c08	也。	也 
X26n0558_001:0889c09	無無明亦無無明盡乃至無老死亦無老死盡。	無 無 明 亦 無 無 明 盡 乃 至 無 老 死 亦 無 老 死 盡 
X26n0558_001:0889c10	此明真空中無十二因緣也此十二本緣覺所觀	此 明 真 空 中 無 十二因緣 也 此 十 二 本 緣 覺 所 觀 
X26n0558_001:0889c11	之境一曰無明謂昏迷覺性也二曰行謂作業也	之 境 一 曰 無 明 謂 昏 迷 覺 性 也 二 曰 行 謂 作 業 也 
X26n0558_001:0889c12	此二支乃過去所作之因三曰識謂起妄念初託	此 二 支 乃 過 去 所 作 之 因 三 曰 識 謂 起 妄 念 初 託 
X26n0558_001:0889c13	母胎也四曰名色謂母胎中漸生諸形相也五曰	母 胎 也 四 曰 名 色 謂 母 胎 中 漸 生 諸 形 相 也 五 曰 
X26n0558_001:0889c14	六入謂胎中成六根也六曰觸謂出胎後六根對	六 入 謂 胎 中 成 六 根 也 六 曰 觸 謂 出 胎 後 六 根 對 
X26n0558_001:0889c15	六塵也七曰受謂領納世間好惡等事也此五支	六 塵 也 七 曰 受 謂 領 納 世 間 好 惡 等 事 也 此 五 支 
X26n0558_001:0889c16	乃現在所受之果也八曰愛謂于世間生貪愛也	乃 現 在 所 受 之 果 也 八 曰 愛 謂 于 世 間 生 貪 愛 也 
X26n0558_001:0889c17	九曰取謂于諸境生取著心也十曰有謂作有漏	九 曰 取 謂 于 諸 境 生 取 著 心 也 十 曰 有 謂 作 有 漏 
X26n0558_001:0889c18	之因能招未來之果也此三支乃現在所作之因	之 因 能 招 未 來 之 果 也 此 三 支 乃 現 在 所 作 之 因 
X26n0558_001:0889c19	十一曰生謂受未來五蘊之身也十二曰老死謂	十 一 曰 生 謂 受 未 來 五 蘊 之 身 也 十 二 曰 老 死 謂 
X26n0558_001:0889c20	未來之身老而死也此二支乃來世當受之果此	未 來 之 身 老 而 死 也 此 二 支 乃 來 世 當 受 之 果 此 
X26n0558_001:0889c21	十二支該三世因果一一相因而生名流轉門亦	十 二 支 該 三 世 因 果 一 一 相 因 而 生 名 流 轉 門 亦 
X26n0558_001:0889c22	相因而滅名還滅門真空之中悉皆離之生滅何	相 因 而 滅 名 還 滅 門 真 空 之 中 悉 皆 離 之 生 滅 何 
X26n0558_001:0889c23	有亦以性本無故也。	有 亦 以 性 本 無 故 也 
X26n0558_001:0889c24	無苦集滅道。	無 苦集滅道 
X26n0558_001:0890a01	此明真空之中無四諦也四諦本聲聞所觀之境	此 明 真 空 之 中 無 四 諦 也 四 諦 本 聲 聞 所 觀 之 境 
X26n0558_001:0890a02	苦即世間眾苦世間果也集即造作諸業世間因	苦 即 世 間 眾 苦 世 間 果 也 集 即 造 作 諸 業 世 間 因 
X26n0558_001:0890a03	也滅即涅槃出世果也道即八正道出世因也真	也 滅 即 涅 槃 出 世 果 也 道 即 八 正 道 出 世 因 也 真 
X26n0558_001:0890a04	空之中悉皆無之亦以性本無故。	空 之 中 悉 皆 無 之 亦 以 性 本 無 故 
X26n0558_001:0890a05	無智亦無得。	無 智 亦 無 得 
X26n0558_001:0890a06	此明真空之中非但無前諸法即知空之智亦不	此 明 真 空 之 中 非 但 無 前 諸 法 即 知 空 之 智 亦 不 
X26n0558_001:0890a07	可得非但能空之智不可得即所知空理亦不可	可 得 非 但 能 空 之 智 不 可 得 即 所 知 空 理 亦 不 可 
X26n0558_001:0890a08	得至此則藥病兩亡心境俱泯唯一實相而已是	得 至 此 則 藥 病 兩 亡 心 境 俱 泯 唯 一 實 相 而 已 是 
X26n0558_001:0890a09	為般若之極功也問前色空雙立今何一切皆無	為 般 若 之 極 功 也 問 前 色 空 雙 立 今 何 一 切 皆 無 
X26n0558_001:0890a10	答前之所立立而未嘗不盡今之所無無而未嘗	答 前 之 所 立 立 而 未 嘗 不 盡 今 之 所 無 無 而 未 嘗 
X26n0558_001:0890a11	不存蓋言有者但有其相而性元無也言無者但	不 存 蓋 言 有 者 但 有 其 相 而 性 元 無 也 言 無 者 但 
X26n0558_001:0890a12	性本無而相非壞也故存而正泯亡而恒立般若	性 本 無 而 相 非 壞 也 故 存 而 正 泯 亡 而 恒 立 般 若 
X26n0558_001:0890a13	之旨本如是也。	之 旨 本 如 是 也 
X26n0558_001:0890a14	以無所得故菩提薩埵依般若波羅蜜多故心無罣	以 無 所 得 故 菩 提 薩 埵 依 般 若 波羅蜜多 故 心 無 罣 
X26n0558_001:0890a15	礙無罣礙故無有恐怖遠離顛倒夢想究竟涅槃三	礙 無 罣 礙 故 無 有 恐 怖 遠 離 顛 倒 夢 想 究竟涅槃 三 
X26n0558_001:0890a16	世諸佛依般若波羅蜜多故得阿耨多羅三藐三菩	世 諸 佛 依 般 若 波羅蜜多 故 得 阿 耨 多 羅 三 藐 三 菩 
X26n0558_001:0890a17	提。	提 
X26n0558_001:0890a18	此下因言無所得而顯有所得也依此無得之光	此 下 因 言 無 所 得 而 顯 有 所 得 也 依 此 無 得 之 光 
X26n0558_001:0890a19	即得心境皆空觸處洞然而解脫無礙矣既無礙	即 得 心 境 皆 空 觸 處 洞 然 而 解 脫 無 礙 矣 既 無 礙 
X26n0558_001:0890a20	則隨其所向無生死苦厄之障故無恐怖非獨無	則 隨 其 所 向 無 生 死 苦 厄 之 障 故 無 恐 怖 非 獨 無 
X26n0558_001:0890a21	恐怖也即無始以來顛倒夢想亦可遠離矣顛倒	恐 怖 也 即 無 始 以 來 顛 倒 夢 想 亦 可 遠 離 矣 顛 倒 
X26n0558_001:0890a22	夢想乃無明煩惱也既無煩惱則究竟可至涅槃	夢 想 乃 無 明 煩 惱 也 既 無 煩 惱 則 究 竟 可 至 涅 槃 
X26n0558_001:0890a23	之地涅槃此云圓寂德無不備謂之圓障無不盡	之 地 涅 槃 此 云 圓 寂 德 無 不 備 謂 之 圓 障 無 不 盡 
X26n0558_001:0890a24	謂之寂此言其因能竟果也非獨菩薩依此而得	謂 之 寂 此 言 其 因 能 竟 果 也 非 獨 菩 薩 依 此 而 得 
X26n0558_001:0890b01	至涅槃即三世諸佛亦無異路惟依此而證無上	至 涅 槃 即 三世諸佛 亦 無 異 路 惟 依 此 而 證 無 上 
X26n0558_001:0890b02	正等正覺也涅槃是佛之斷果正覺是佛之智果	正 等 正 覺 也 涅 槃 是 佛 之 斷 果 正 覺 是 佛 之 智 果 
X26n0558_001:0890b03	今菩薩言涅槃佛言正覺者乃佛語互略意必俱	今 菩 薩 言 涅 槃 佛 言 正 覺 者 乃 佛 語 互 略 意 必 俱 
X26n0558_001:0890b04	備也問前既言無所得今又言有所得何也答此	備 也 問 前 既 言 無 所 得 今 又 言 有 所 得 何 也 答 此 
X26n0558_001:0890b05	有所得正得無所得而已非別有所得也。	有 所 得 正 得 無 所 得 而 已 非 別 有 所 得 也 
X26n0558_001:0890b06	故知般若波羅蜜多是大神呪是大明呪是無上呪	故 知 般 若 波羅蜜多 是 大 神 呪 是 大 明 呪 是 無 上 呪 
X26n0558_001:0890b07	是無等等呪能除一切苦真實不虗故說般若波羅	是 無 等 等 呪 能 除 一 切 苦 真 實 不 虗 故 說 般 若 波 羅 
X26n0558_001:0890b08	蜜多呪即說呪曰羯帝羯帝波羅羯帝波羅僧羯帝	蜜 多 呪 即 說 呪 曰 羯 帝 羯 帝 波 羅 羯 帝 波 羅 僧 羯 帝 
X26n0558_001:0890b09	菩提薩婆訶。	菩 提 薩 婆 訶 
X26n0558_001:0890b10	前是顯說般若後是密說般若既顯說而又密說	前 是 顯 說 般 若 後 是 密 說 般 若 既 顯 說 而 又 密 說 
X26n0558_001:0890b11	者何良由眾生根器不同所入有異故也又顯說	者 何 良 由 眾 生 根 器 不 同 所 入 有 異 故 也 又 顯 說 
X26n0558_001:0890b12	能生慧滅煩惱障密說令誦持生福滅罪業障為	能 生 慧 滅 煩 惱 障 密 說 令 誦 持 生 福 滅 罪 業 障 為 
X26n0558_001:0890b13	滅二障成二嚴故兩說也今將說密呪而先嘆其	滅 二 障 成 二 嚴 故 兩 說 也 今 將 說 密 呪 而 先 嘆 其 
X26n0558_001:0890b14	功能者所以勸進行人使其樂持以取速効耳能	功 能 者 所 以 勸 進 行 人 使 其 樂 持 以 取 速 効 耳 能 
X26n0558_001:0890b15	破魔障名大神呪能破癡暗名大明呪能顯至理	破 魔 障 名 大 神 呪 能 破 癡 暗 名 大 明 呪 能 顯 至 理 
X26n0558_001:0890b16	名無上呪能齊極果名無等等呪佛不與眾生等	名 無 上 呪 能 齊 極 果 名 無 等 等 呪 佛 不 與 眾 生 等 
X26n0558_001:0890b17	故稱無等然能與諸佛等故重言等也能除一切	故 稱 無 等 然 能 與 諸 佛 等 故 重 言 等 也 能 除 一 切 
X26n0558_001:0890b18	苦者三苦八苦一切苦也即說呪等者前未顯呪	苦 者 三 苦 八 苦 一 切 苦 也 即 說 呪 等 者 前 未 顯 呪 
X26n0558_001:0890b19	詞故今顯之此不可強釋以是佛之密語非因位	詞 故 今 顯 之 此 不 可 強 釋 以 是 佛 之 密 語 非 因 位 
X26n0558_001:0890b20	所知但當信受持誦以求除障增福可也。	所 知 但 當 信 受 持 誦 以 求 除 障 增 福 可 也 
X26n0558_001:0890b22	般若心經指掌(終)	般 若 心 經 指 掌 終 
