X31n0609_001:0486a16	就道德。所以有說。意趣難解。葢諸佛大聖人之道。	就 道 德 所 以 有 說 意 趣 難 解 葢 諸 佛 大 聖 人 之 道 
X31n0609_001:0486a17	中庸之道。故天下可均。爵祿可辭。白刃可蹈。中庸	中 庸 之 道 故 天 下 可 均 爵 祿 可 辭 白 刃 可 蹈 中 庸 
X31n0609_001:0486a18	不可能也。智即般若之智。故眾生心處處能思惟。	不 可 能 也 智 即 般 若 之 智 故 眾 生 心 處 處 能 思 惟 
X31n0609_001:0486a19	不能思般若。經即玅法華經。故大火洞然。擔入乾	不 能 思 般 若 經 即 玅 法 華 經 故 大 火 洞 然 擔 入 乾 
X31n0609_001:0486a20	草不燒。亦未為難。暫讀此經為難。大哉大聖人之	草 不 燒 亦 未 為 難 暫 讀 此 經 為 難 大 哉 大 聖 人 之 
X31n0609_001:0486a21	道。無方故不可到。無言故不可解。無相故不可視。	道 無 方 故 不 可 到 無 言 故 不 可 解 無 相 故 不 可 視 
X31n0609_001:0486a22	無意路故不可思。無柄杷故不可執。舉如意云。會	無 意 路 故 不 可 思 無 柄 杷 故 不 可 執 舉 如 意 云 會 
X31n0609_001:0486a23	麼。若於此會得。便見得道本不遠而人自遠。道本	麼 若 於 此 會 得 便 見 得 道 本 不 遠 而 人 自 遠 道 本 
X31n0609_001:0486a24	不難而人自難。洞山麻三觔。一夏將來合繩也好。	不 難 而 人 自 難 洞 山 麻 三 觔 一 夏 將 來 合 繩 也 好 
X31n0609_001:0486b01	撚線也好。青州衫七觔。冬天穿上。打眠也得。坐禪	撚 線 也 好 青 州 衫 七 觔 冬 天 穿 上 打 眠 也 得 坐 禪 
X31n0609_001:0486b02	也得。廬陵米。早炊可以作粥。晌午可以造飯。百丈	也 得 廬 陵 米 早 炊 可 以 作 粥 晌 午 可 以 造 飯 百 丈 
X31n0609_001:0486b03	屎。和水則澆茄。拌灰則栽芋。更何疑哉。其或不然。	屎 和 水 則 澆 茄 拌 灰 則 栽 芋 更 何 疑 哉 其 或 不 然 
X31n0609_001:0486b04	須是諸緣放下。萬慮撥開。單單看個一歸何處。忽	須 是 諸 緣 放 下 萬 慮 撥 開 單 單 看 個 一 歸 何 處 忽 
X31n0609_001:0486b05	地頓悟。始信大千沙界海中漚。一切聖賢如電拂。	地 頓 悟 始 信 大 千 沙 界 海 中 漚 一 切 聖 賢 如 電 拂 
X31n0609_001:0486b06	到此田地。佛法世法。打成一片。凡情聖情。元沒兩	到 此 田 地 佛 法 世 法 打 成 一 片 凡 情 聖 情 元 沒 兩 
X31n0609_001:0486b07	般。更聽說偈。自家一個黃金面。世世生生被土埋。	般 更 聽 說 偈 自 家 一 個 黃 金 面 世 世 生 生 被 土 埋 
X31n0609_001:0486b08	香水滿盆能一洗。光明依舊照靈臺。問曰。如何是	香 水 滿 盆 能 一 洗 光 明 依 舊 照 靈 臺 問 曰 如 何 是 
X31n0609_001:0486b09	黃金面。師曰。萬劫無更變。曰。如何是被土埋。師曰。	黃 金 面 師 曰 萬 劫 無 更 變 曰 如 何 是 被 土 埋 師 曰 
X31n0609_001:0486b10	六道自輪迴。曰。如何是能一洗。師曰。四相頓空爾。	六 道 自 輪 迴 曰 如 何 是 能 一 洗 師 曰 四 相 頓 空 爾 
X31n0609_001:0486b11	曰。如何是照靈臺。師曰。三身圓證來。曰。此大似講	曰 如 何 是 照 靈 臺 師 曰 三 身 圓 證 來 曰 此 大 似 講 
X31n0609_001:0486b12	說。師曰。誰為你說禪。	說 師 曰 誰 為 你 說 禪 
X31n0609_001:0486b13	舍利弗吾從成佛以來(至)令離諸著。	舍 利 弗 吾 從 成 佛 以 來 至 令 離 諸 著 
X31n0609_001:0486b14	此一段經。世尊自陳自成佛以來。四十餘年演教。	此 一 段 經 世 尊 自 陳 自 成 佛 以 來 四 十 餘 年 演 教 
X31n0609_001:0486b15	只是要人離著。葢著者。心入諸境不能遠離是也。	只 是 要 人 離 著 葢 著 者 心 入 諸 境 不 能 遠 離 是 也 
X31n0609_001:0486b16	境有有情境。有無情境。無情境者。大而天地。細而	境 有 有 情 境 有 無 情 境 無 情 境 者 大 而 天 地 細 而 
X31n0609_001:0486b17	微塵。眾而萬有紛紜。一而太極全體。但無知覺。名	微 塵 眾 而 萬 有 紛 紜 一 而 太 極 全 體 但 無 知 覺 名 
X31n0609_001:0486b18	無情境。有情境者。大而覺體。細而含靈。眾而萬類	無 情 境 有 情 境 者 大 而 覺 體 細 而 含 靈 眾 而 萬 類 
X31n0609_001:0486b19	升沉。一而法身不動。但有知覺。名有情境。如是乃	升 沉 一 而 法 身 不 動 但 有 知 覺 名 有 情 境 如 是 乃 
X31n0609_001:0486b20	至眼所見。耳所聞。鼻所嗅。舌所甞。身所覺。意所思。	至 眼 所 見 耳 所 聞 鼻 所 嗅 舌 所 甞 身 所 覺 意 所 思 
X31n0609_001:0486b21	或順。或逆。或近。或遠。或善。或惡。或親。或疎。俱名為	或 順 或 逆 或 近 或 遠 或 善 或 惡 或 親 或 疎 俱 名 為 
X31n0609_001:0486b22	境。於此境上不能消融成一法身。不能明了成一	境 於 此 境 上 不 能 消 融 成 一 法 身 不 能 明 了 成 一 
X31n0609_001:0486b23	佛知見。俱名為著。以眾人不能離此著故。吾佛大	佛 知 見 俱 名 為 著 以 眾 人 不 能 離 此 著 故 吾 佛 大 
X31n0609_001:0486b24	聖人。以六度萬行。種種因緣譬喻言教方便。廣談	聖 人 以 六 度 萬 行 種種因緣 譬 喻 言 教 方 便 廣 談 
X31n0609_001:0486c01	曲論。四十餘年。無他意。只是要人離著。舉如意云。	曲 論 四 十 餘 年 無 他 意 只 是 要 人 離 著 舉 如 意 云 
X31n0609_001:0486c02	會麼。若於此會得。青青翠竹。總是法身。鬱鬱黃華。	會 麼 若 於 此 會 得 青 青 翠 竹 總 是 法 身 鬱 鬱 黃 華 
X31n0609_001:0486c03	無非般若。鳶飛魚躍。與四十餘年演教無差。雨施	無 非 般 若 鳶 飛 魚 躍 與 四 十 餘 年 演 教 無 差 雨 施 
X31n0609_001:0486c04	雲行。與三百餘會談經不異。其或不然。更須提個	雲 行 與 三 百 餘 會 談 經 不 異 其 或 不 然 更 須 提 個 
X31n0609_001:0486c05	父母未生前話頭。工夫純熟。忽然頓悟。到此田地。	父 母 未 生 前 話 頭 工 夫 純 熟 忽 然 頓 悟 到 此 田 地 
X31n0609_001:0486c06	方自悟得截瓊枝。寸寸是玉。析栴檀。片片皆香。無	方 自 悟 得 截 瓊 枝 寸 寸 是 玉 析 栴 檀 片 片 皆 香 無 
X31n0609_001:0486c07	淫怒癡可去。如一輪明月掛秋空。無戒定慧可修。	淫 怒 癡 可 去 如 一 輪 明 月 掛 秋 空 無 戒 定 慧 可 修 
X31n0609_001:0486c08	似一點寒冰烹大冶。咦。更聽說偈。通身是病通身	似 一 點 寒 冰 烹 大 冶 咦 更 聽 說 偈 通 身 是 病 通 身 
X31n0609_001:0486c09	藥。身若空來藥亦空。我許道人俱勘破。泥牛騎過	藥 身 若 空 來 藥 亦 空 我 許 道 人 俱 勘 破 泥 牛 騎 過 
X31n0609_001:0486c10	海門東。問曰。如何是諸著。師曰。眼見耳聞并意想。	海 門 東 問 曰 如 何 是 諸 著 師 曰 眼 見 耳 聞 并 意 想 
X31n0609_001:0486c11	曰。如何是離諸著。師曰。眼無見。耳無聞。意無想。曰。	曰 如 何 是 離 諸 著 師 曰 眼 無 見 耳 無 聞 意 無 想 曰 
X31n0609_001:0486c12	恁麼則木人撫掌。石女謳歌。師曰。不可墮在無事	恁 麼 則 木 人 撫 掌 石 女 謳 歌 師 曰 不 可 墮 在 無 事 
X31n0609_001:0486c13	界裏。曰。如何是中庸一句。師曰。恁短恁長休剪綴。	界 裏 曰 如 何 是 中 庸 一 句 師 曰 恁 短 恁 長 休 剪 綴 
X31n0609_001:0486c14	隨高隨下自平治。	隨 高 隨 下 自 平 治 
X31n0609_001:0486c15	所以者何如來方便知見(至)唯佛與佛乃能究盡。	所以者何 如 來 方 便 知 見 至 唯 佛 與 佛 乃 能 究 盡 
X31n0609_001:0486c16	此一段經。大略只是極讚大聖人之心。究盡明了。	此 一 段 經 大 略 只 是 極 讚 大 聖 人 之 心 究 盡 明 了 
X31n0609_001:0486c17	誠實廣大。非世間小聖小智小見小解所能窺測	誠 實 廣 大 非 世 間 小 聖 小 智 小 見 小 解 所 能 窺 測 
X31n0609_001:0486c18	者也。試再以目前淺小比並一遍看。葢世之言壽	者 也 試 再 以 目 前 淺 小 比 並 一 遍 看 葢 世 之 言 壽 
X31n0609_001:0486c19	者。廣成子千二百歲。彭祖八百歲。至壽者天地。邵	者 廣 成 子 千 二 百 歲 彭 祖 八 百 歲 至 壽 者 天 地 邵 
X31n0609_001:0486c20	子推之。謂有十二萬九千六百歲。未有如佛言壽。	子 推 之 謂 有 十 二 萬 九 千 六 百 歲 未 有 如 佛 言 壽 
X31n0609_001:0486c21	以三千大千世界微塵數歲猶為至短。世之論國	以 三千大千世界 微 塵 數 歲 猶 為 至 短 世 之 論 國 
X31n0609_001:0486c22	一統者。不過四海九州之內。一萬八千之中。至廣	一 統 者 不 過 四 海 九 州 之 內 一 萬 八 千 之 中 至 廣 
X31n0609_001:0486c23	者不過日月出沒之際。星辰旋繞之間。未有如佛	者 不 過 日 月 出 沒 之 際 星 辰 旋 繞 之 間 未 有 如 佛 
X31n0609_001:0486c24	之言日月出沒之際。星辰旋繞之間。乃一須彌盧	之 言 日 月 出 沒 之 際 星 辰 旋 繞 之 間 乃 一 須 彌 盧 
X31n0609_001:0487a01	耳。如是千須彌盧謂之小千世界。如是千小千世	耳 如 是 千 須 彌 盧 謂 之 小千世界 如 是 千 小 千 世 
X31n0609_001:0487a02	界。謂之中千世界。如是千中千世界。謂之大千世	界 謂 之 中千世界 如 是 千 中千世界 謂 之 大 千 世 
X31n0609_001:0487a03	界。如是千大千世界。微塵數大千世界。始是一層。	界 如 是 千 大千世界 微 塵 數 大千世界 始 是 一 層 
X31n0609_001:0487a04	如是八萬四千層。始是一華藏世界。如是一華藏	如 是 八萬四千 層 始 是 一 華藏世界 如 是 一 華 藏 
X31n0609_001:0487a05	世界微塵數華藏世界。名為一毗盧遮那佛王化。	世 界 微 塵 數 華藏世界 名 為 一 毗 盧 遮 那 佛 王 化 
X31n0609_001:0487a06	如是毗盧遮那佛不知其數。豈國土世界能知其	如 是 毗 盧 遮 那 佛 不 知 其 數 豈 國 土 世 界 能 知 其 
X31n0609_001:0487a07	數。如是乃至論理論事。唯佛甚深。世莫能及。又有	數 如 是 乃 至 論 理 論 事 唯 佛 甚 深 世 莫 能 及 又 有 
X31n0609_001:0487a08	謂佛言雖廣大無實。自是人不靜思。肯靜思則其	謂 佛 言 雖 廣 大 無 實 自 是 人 不 靜 思 肯 靜 思 則 其 
X31n0609_001:0487a09	實自性之理。大而無外。非有形國土可能充滿。細	實 自 性 之 理 大 而 無 外 非 有 形 國 土 可 能 充 滿 細 
X31n0609_001:0487a10	而無內。非有智聦明可能見識。舉如意云。會麼。若	而 無 內 非 有 智 聦 明 可 能 見 識 舉 如 意 云 會 麼 若 
X31n0609_001:0487a11	於此會得。一月普現一切水。一切水月一月攝。如	於 此 會 得 一 月 普 現 一 切 水 一 切 水 月 一 月 攝 如 
X31n0609_001:0487a12	帝網珠。光光互照。無前際。無後際。無南方。無北方。	帝 網 珠 光 光 互 照 無 前 際 無 後 際 無 南 方 無 北 方 
X31n0609_001:0487a13	圓陀陀。活潑潑。揑不成。劈不開。其或不然。更聽說	圓 陀 陀 活 潑 潑 揑 不 成 劈 不 開 其 或 不 然 更 聽 說 
X31n0609_001:0487a14	偈。人人心即古毗盧。聲色門頭有即無。但肯回光	偈 人 人 心 即 古 毗 盧 聲 色 門 頭 有 即 無 但 肯 回 光 
X31n0609_001:0487a15	光自照。乾坤何法可親疎。問曰。諸佛既多。世界不	光 自 照 乾 坤 何 法 可 親 疎 問 曰 諸 佛 既 多 世 界 不 
X31n0609_001:0487a16	少。畢竟是一是多。師曰。非一非多。曰。如何是非一	少 畢 竟 是 一 是 多 師 曰 非 一 非 多 曰 如 何 是 非 一 
X31n0609_001:0487a17	非多。師曰。一有多種。二無兩般。曰。恁麼則論理元	非 多 師 曰 一 有 多 種 二 無 兩 般 曰 恁 麼 則 論 理 元 
X31n0609_001:0487a18	非二。隨情有萬般。師曰。文字之師。皆如是見。曰。如	非 二 隨 情 有 萬 般 師 曰 文 字 之 師 皆 如 是 見 曰 如 
X31n0609_001:0487a19	何是離文字一句。師曰。老虎看水磨。轉看轉不知。	何 是 離 文 字 一 句 師 曰 老 虎 看 水 磨 轉 看 轉 不 知 
X31n0609_001:0487a20	諸法實相(至)究竟等。	諸法實相 至 究 竟 等 
X31n0609_001:0487a21	此一段經。言諸法實相。即目前萬法。正玅經本意。	此 一 段 經 言 諸法實相 即 目 前 萬 法 正 玅 經 本 意 
X31n0609_001:0487a22	即十方諸佛圓證之實理。十方諸佛圓證之實理。	即 十方諸佛 圓 證 之 實 理 十方諸佛 圓 證 之 實 理 
X31n0609_001:0487a23	即眾生本具覺性。眾生本具覺性。即世間流轉苦	即 眾 生 本 具 覺 性 眾 生 本 具 覺 性 即 世 間 流 轉 苦 
X31n0609_001:0487a24	樂升沉之境。以眾生不悟諸法。不了諸法。不知諸	樂 升 沉 之 境 以 眾 生 不 悟 諸 法 不 了 諸 法 不 知 諸 
X31n0609_001:0487b01	法。癡癡昧昧。於此境上起惡心。作惡業。死此生彼。	法 癡 癡 昧 昧 於 此 境 上 起 惡 心 作 惡 業 死此生彼 
X31n0609_001:0487b02	展轉流浪。受苦無窮。故大聖人指此諸法。謂之夢	展 轉 流 浪 受 苦 無 窮 故 大 聖 人 指 此 諸 法 謂 之 夢 
X31n0609_001:0487b03	幻。謂之泡影。令人於此諸法境上求個無相無名。	幻 謂 之 泡 影 令 人 於 此 諸 法 境 上 求 個 無 相 無 名 
X31n0609_001:0487b04	不動不變的真理。以聲聞小乘人。不識諸法圓理。	不 動 不 變 的 真 理 以 聲 聞 小 乘 人 不 識 諸 法 圓 理 
X31n0609_001:0487b05	於此境上。厭苦求樂。破有執空。故大聖人又指此	於 此 境 上 厭 苦 求 樂 破 有 執 空 故 大 聖 人 又 指 此 
X31n0609_001:0487b06	諸法。即是真空。即是玅有。令人於此諸法境上。求	諸 法 即 是 真 空 即 是 玅 有 令 人 於 此 諸 法 境 上 求 
X31n0609_001:0487b07	個圓融妙會的覺性。以菩薩大乘人未知諸法實	個 圓 融 妙 會 的 覺 性 以 菩 薩 大 乘 人 未 知 諸 法 實 
X31n0609_001:0487b08	相。劫劫苦修。世世力進。務欲度盡眾生。必要證極	相 劫 劫 苦 修 世 世 力 進 務 欲 度 盡 眾 生 必 要 證 極 
X31n0609_001:0487b09	大道。故大聖人又指諸法即是實相。即是法性。即	大 道 故 大 聖 人 又 指 諸 法 即 是 實 相 即 是 法 性 即 
X31n0609_001:0487b10	是佛理。葢諸法實相之玅。參此。儒謂之格物。悟此。	是 佛 理 葢 諸法實相 之 玅 參 此 儒 謂 之 格 物 悟 此 
X31n0609_001:0487b11	儒謂之致知。知至物格。則諸法實相。了了常知。明	儒 謂 之 致 知 知 至 物 格 則 諸法實相 了 了 常 知 明 
X31n0609_001:0487b12	明不昧者也。以至修身齊家治國平天下。無不靈	明 不 昧 者 也 以 至 修 身 齊 家 治 國 平 天 下 無 不 靈 
X31n0609_001:0487b13	驗。以至超出死生。亘古亘今。以至頓入涅槃。徹上	驗 以 至 超 出 死 生 亘 古 亘 今 以 至 頓 入 涅 槃 徹 上 
X31n0609_001:0487b14	徹下。無有不玅應者也。舉如意云。會麼。若於此會	徹 下 無 有 不 玅 應 者 也 舉 如 意 云 會 麼 若 於 此 會 
X31n0609_001:0487b15	得。松直棘曲。鵠白烏黑。皆實相之體。生迷佛悟。事	得 松 直 棘 曲 鵠 白 烏 黑 皆 實 相 之 體 生 迷 佛 悟 事 
X31n0609_001:0487b16	俗理真。皆實相之用。其或不然。明日再為諸人打	俗 理 真 皆 實 相 之 用 其 或 不 然 明 日 再 為 諸 人 打 
X31n0609_001:0487b17	葛藤一遍。問曰。目前諸法皆實相。因何人不覺悟。	葛 藤 一 遍 問 曰 目 前 諸 法 皆 實 相 因 何 人 不 覺 悟 
X31n0609_001:0487b18	師曰。不是不悟。只是不肯悟。曰。學人參亦有年。也	師 曰 不 是 不 悟 只 是 不 肯 悟 曰 學 人 參 亦 有 年 也 
X31n0609_001:0487b19	不是不肯悟。師曰。既肯悟今日又問什麼。曰。肯悟	不 是 不 肯 悟 師 曰 既 肯 悟 今 日 又 問 什 麼 曰 肯 悟 
X31n0609_001:0487b20	時如何。師曰。諸法無非實相義。	時 如 何 師 曰 諸 法 無 非 實 相 義 
X31n0609_001:0487b21	諸法實相(至)本末究竟等(重拈)。	諸法實相 至 本 末 究 竟 等 重 拈 
X31n0609_001:0487b22	此一段經。南嶽天台諸師。講各不同。惟溫陵環師	此 一 段 經 南 嶽 天 台 諸 師 講 各 不 同 惟 溫 陵 環 師 
X31n0609_001:0487b23	講為切當。今依環師重拈一遍看。夫實相者。即相	講 為 切 當 今 依 環 師 重 拈 一 遍 看 夫 實 相 者 即 相 
X31n0609_001:0487b24	而真。與十方往古大聖人同體無異。圓常明玅。更	而 真 與 十 方 往 古 大 聖 人 同 體 無 異 圓 常 明 玅 更 
X31n0609_001:0487c01	無變別之法性也。然此法性。惟佛與佛乃能究盡。	無 變 別 之 法 性 也 然 此 法 性 惟 佛 與 佛 乃 能 究 盡 
X31n0609_001:0487c02	故經云。佛所成就第一希有難解之法。惟佛與佛	故 經 云 佛 所 成 就 第一希有 難 解 之 法 惟 佛 與 佛 
X31n0609_001:0487c03	乃能究盡諸法實相。諸法者。乾坤萬有紛紜。總不	乃 能 究 盡 諸法實相 諸 法 者 乾 坤 萬 有 紛 紜 總 不 
X31n0609_001:0487c04	出十法。十法者。一相。二性。三體。四力。五作。六因。七	出 十 法 十 法 者 一 相 二 性 三 體 四 力 五 作 六 因 七 
X31n0609_001:0487c05	緣。八果。九報。十本末究竟。本末究竟者。一切目前	緣 八 果 九 報 十 本 末 究 竟 本 末 究 竟 者 一 切 目 前 
X31n0609_001:0487c06	萬法。一一皆有根本終窮。一一皆有窮盡實際。如	萬 法 一 一 皆 有 根 本 終 窮 一 一 皆 有 窮 盡 實 際 如 
X31n0609_001:0487c07	目前卓子香爐。乃至松樹桃樹人物等類。不能窮	目 前 卓 子 香 爐 乃 至 松 樹 桃 樹 人 物 等 類 不 能 窮 
X31n0609_001:0487c08	盡實際。不足謂之格物。不能究盡根本。不足謂之	盡 實 際 不 足 謂 之 格 物 不 能 究 盡 根 本 不 足 謂 之 
X31n0609_001:0487c09	參禪。亦不謂之徹悟。亦不足謂之致知。致知徹悟。	參 禪 亦 不 謂 之 徹 悟 亦 不 足 謂 之 致 知 致 知 徹 悟 
X31n0609_001:0487c10	則目前卓子香爐。松樹人物。無不能格無不能參	則 目 前 卓 子 香 爐 松 樹 人 物 無 不 能 格 無 不 能 參 
X31n0609_001:0487c11	其本末究竟者也。再以十法細拈一遍看。報者。應	其 本 末 究 竟 者 也 再 以 十 法 細 拈 一 遍 看 報 者 應 
X31n0609_001:0487c12	果為報。如一樹桃子既實為果。果熟為報。果者。緣	果 為 報 如 一 樹 桃 子 既 實 為 果 果 熟 為 報 果 者 緣 
X31n0609_001:0487c13	熟為果。如一樹桃子既開華結實。雨露潤滋糞土	熟 為 果 如 一 樹 桃 子 既 開 華 結 實 雨 露 潤 滋 糞 土 
X31n0609_001:0487c14	封培。到香熟時節是也。緣者。助因為緣。如一樹桃	封 培 到 香 熟 時 節 是 也 緣 者 助 因 為 緣 如 一 樹 桃 
X31n0609_001:0487c15	子雖開華榮茂。若無雨露并糞土封培為助。終不	子 雖 開 華 榮 茂 若 無 雨 露 并 糞 土 封 培 為 助 終 不 
X31n0609_001:0487c16	能自榮自華自果。因者。資始為因。如一樹桃。雖目	能 自 榮 自 華 自 果 因 者 資 始 為 因 如 一 樹 桃 雖 目 
X31n0609_001:0487c17	前榮茂。其根本必有最初之日。作者。乍起為作。如	前 榮 茂 其 根 本 必 有 最 初 之 日 作 者 乍 起 為 作 如 
X31n0609_001:0487c18	一樹桃。雖有最初之日。種桃之心。乃乍然而發起	一 樹 桃 雖 有 最 初 之 日 種 桃 之 心 乃 乍 然 而 發 起 
X31n0609_001:0487c19	也。非固有之性也。力者。利用為力。如一樹桃到香	也 非 固 有 之 性 也 力 者 利 用 為 力 如 一 樹 桃 到 香 
X31n0609_001:0487c20	熟時。食得其味。賣得其財是也。體者。形具為體。如	熟 時 食 得 其 味 賣 得 其 財 是 也 體 者 形 具 為 體 如 
X31n0609_001:0487c21	一樹桃。或華或果。枝葉散殊。根本深厚是也。性者。	一 樹 桃 或 華 或 果 枝 葉 散 殊 根 本 深 厚 是 也 性 者 
X31n0609_001:0487c22	相本為性。如一樹桃為相。亦必有一樹桃之根性	相 本 為 性 如 一 樹 桃 為 相 亦 必 有 一 樹 桃 之 根 性 
X31n0609_001:0487c23	也。相者。可見為相。如一樹桃開華結果。人人皆見。	也 相 者 可 見 為 相 如 一 樹 桃 開 華 結 果 人 人 皆 見 
X31n0609_001:0487c24	所謂其性其實。其本末究竟。人皆不知。故唯佛與	所 謂 其 性 其 實 其 本 末 究 竟 人 皆 不 知 故 唯 佛 與 
X31n0609_001:0488a01	佛乃能究盡明了而無虗妄。其他聖人雖明不能	佛 乃 能 究 盡 明 了 而 無 虗 妄 其 他 聖 人 雖 明 不 能 
X31n0609_001:0488a02	究盡。	究 盡 
X31n0609_001:0488a03	唯佛與佛乃能究盡諸法實相(至)本末究竟(再拈)。	唯 佛 與 佛 乃 能 究 盡 諸法實相 至 本 末 究 竟 再 拈 
X31n0609_001:0488a04	此段經已講兩遍。今當第三遍。聽者亦莫厭煩。葢	此 段 經 已 講 兩 遍 今 當 第 三 遍 聽 者 亦 莫 厭 煩 葢 
X31n0609_001:0488a05	此段經乃格物之要端。參禪之正軌。若不細細條	此 段 經 乃 格 物 之 要 端 參 禪 之 正 軌 若 不 細 細 條 
X31n0609_001:0488a06	陳。晚學終莫入頭。(相)才雖不敏。悟亦有宗。試再以	陳 晚 學 終 莫 入 頭 相 才 雖 不 敏 悟 亦 有 宗 試 再 以 
X31n0609_001:0488a07	此經大略拈一遍看。夫世間萬法紛紜。不亦千變	此 經 大 略 拈 一 遍 看 夫 世 間 萬 法 紛 紜 不 亦 千 變 
X31n0609_001:0488a08	萬化。故謂之諸法。雖不可一一指陳。總其切要。不	萬 化 故 謂 之 諸 法 雖 不 可 一 一 指 陳 總 其 切 要 不 
X31n0609_001:0488a09	過此十法可以盡無餘蘊矣。一如是相者。即是總	過 此 十 法 可 以 盡 無 餘 蘊 矣 一 如 是 相 者 即 是 總 
X31n0609_001:0488a10	指萬有紛紜。千變萬化。眼可見之相狀也。然此相。	指 萬 有 紛 紜 千 變 萬 化 眼 可 見 之 相 狀 也 然 此 相 
X31n0609_001:0488a11	小聖無竪窮三際橫遍十方不可思議大眼目。局	小 聖 無 竪 窮 三 際 橫 遍 十 方 不可思議 大 眼 目 局 
X31n0609_001:0488a12	於世間聞見之狹者。相雖可見。亦不能窮盡無餘。	於 世 間 聞 見 之 狹 者 相 雖 可 見 亦 不 能 窮 盡 無 餘 
X31n0609_001:0488a13	故唯佛與佛乃能究盡。二如是性者。即我與萬物	故 唯 佛 與 佛 乃 能 究 盡 二 如 是 性 者 即 我 與 萬 物 
X31n0609_001:0488a14	形狀雖殊。究其根本。無不一也。一即是性。性即理	形 狀 雖 殊 究 其 根 本 無 不 一 也 一 即 是 性 性 即 理 
X31n0609_001:0488a15	也。此性此理。雖有二名。無二體也。故強謂之性。性	也 此 性 此 理 雖 有 二 名 無 二 體 也 故 強 謂 之 性 性 
X31n0609_001:0488a16	也者。大而無外。細而無內。前而無始。後而無終。大	也 者 大 而 無 外 細 而 無 內 前 而 無 始 後 而 無 終 大 
X31n0609_001:0488a17	聖明賢。指為圓覺。太極。大道。元體。上帝。明德。中庸。	聖 明 賢 指 為 圓 覺 太 極 大 道 元 體 上 帝 明 德 中 庸 
X31n0609_001:0488a18	法身。亦不能盡此性溥博淵泉廣大悉備之全體	法 身 亦 不 能 盡 此 性 溥 博 淵 泉 廣 大 悉 備 之 全 體 
X31n0609_001:0488a19	也。故曰。唯佛與佛乃能究盡。乃至如是體。如是力。	也 故 曰 唯 佛 與 佛 乃 能 究 盡 乃 至 如 是 體 如 是 力 
X31n0609_001:0488a20	如是作。如是因。如是緣。如是本末究竟等。皆唯佛	如 是 作 如 是 因 如 是 緣 如 是 本 末 究 竟 等 皆 唯 佛 
X31n0609_001:0488a21	與佛乃能究盡。非世間小聖可能盡知也。舉如意	與 佛 乃 能 究 盡 非 世 間 小 聖 可 能 盡 知 也 舉 如 意 
X31n0609_001:0488a22	云。會麼。若於此會得。可謂道是法住法位。世間相	云 會 麼 若 於 此 會 得 可 謂 道 是 法 住 法 位 世 間 相 
X31n0609_001:0488a23	常住。其或不然。須向靜室中焚香默坐。參此山僧	常 住 其 或 不 然 須 向 靜 室 中 焚 香 默 坐 參 此 山 僧 
X31n0609_001:0488a24	手中如意。前萬萬劫更前。却是何物。後萬萬劫更	手 中 如 意 前 萬 萬 劫 更 前 却 是 何 物 後 萬 萬 劫 更 
X31n0609_001:0488b01	後。復為何物。工夫純熟。打成一片。則當自覺古今	後 復 為 何 物 工 夫 純 熟 打 成 一 片 則 當 自 覺 古 今 
X31n0609_001:0488b02	不離於當念。剎海不隔於毫端。說甚唯佛與佛。問	不 離 於 當 念 剎 海 不 隔 於 毫 端 說 甚 唯 佛 與 佛 問 
X31n0609_001:0488b03	曰。如何是諸法實相。師曰。唯佛與佛。乃能究盡。曰。	曰 如 何 是 諸法實相 師 曰 唯 佛 與 佛 乃 能 究 盡 曰 
X31n0609_001:0488b04	恁麼則眾人不會。師曰。不是不會。不肯信。曰。肯信	恁 麼 則 眾 人 不 會 師 曰 不 是 不 會 不 肯 信 曰 肯 信 
X31n0609_001:0488b05	時如何。師曰。大地是黃金。	時 如 何 師 曰 大 地 是 黃 金 
X31n0609_001:0488b06	如是體如是力(至)本末究竟等(復講)。	如 是 體 如 是 力 至 本 末 究 竟 等 復 講 
X31n0609_001:0488b07	形具為體。利用為力。葢有如是體相。則有如是利	形 具 為 體 利 用 為 力 葢 有 如 是 體 相 則 有 如 是 利 
