X31n0609_003:0504a24	乃滅化城。復使其進。務到寶所。如佛知人不堪大	乃 滅 化 城 復 使 其 進 務 到 寶 所 如 佛 知 人 不 堪 大 
X31n0609_003:0504b01	法。權以變粗形為玅質。易短壽作長年。以漸教之。	法 權 以 變 粗 形 為 玅 質 易 短 壽 作 長 年 以 漸 教 之 
X31n0609_003:0504b02	人心既純。復說大法。令悟本來是佛。此品又謂之	人 心 既 純 復 說 大 法 令 悟 本 來 是 佛 此 品 又 謂 之 
X31n0609_003:0504b03	因緣周者。謂佛為我等故。曾於往昔經無量劫。以	因 緣 周 者 謂 佛 為 我 等 故 曾 於 往 昔 經 無 量 劫 以 
X31n0609_003:0504b04	此玅經教化我等。我等今日得聞妙經。若不信。是	此 玅 經 教 化 我 等 我 等 今 日 得 聞 妙 經 若 不 信 是 
X31n0609_003:0504b05	自昧夙時之正因。亦失見世之好緣者也。舉如意	自 昧 夙 時 之 正 因 亦 失 見 世 之 好 緣 者 也 舉 如 意 
X31n0609_003:0504b06	云。會麼。若於此會得。如子見父母。如暗遇燈燭。大	云 會 麼 若 於 此 會 得 如 子 見 父 母 如 暗 遇 燈 燭 大 
X31n0609_003:0504b07	通智勝佛却是青州布衫。大聚寶所何別庭前栢	通 智 勝 佛 却 是 青 州 布 衫 大 聚 寶 所 何 別 庭 前 栢 
X31n0609_003:0504b08	樹。仰觀俯察至道縱橫。左顧右盻至神充塞。更說	樹 仰 觀 俯 察 至 道 縱 橫 左 顧 右 盻 至 神 充 塞 更 說 
X31n0609_003:0504b09	什麼前際後際這邊那邊。其或未然。須向靜室中	什 麼 前 際 後 際 這 邊 那 邊 其 或 未 然 須 向 靜 室 中 
X31n0609_003:0504b10	放下更放下世緣。如紅爐點雪。提起再提起道心。	放 下 更 放 下 世 緣 如 紅 爐 點 雪 提 起 再 提 起 道 心 
X31n0609_003:0504b11	若順水推舟。一旦工夫做熟。當自大悟云。寶所無	若 順 水 推 舟 一 旦 工 夫 做 熟 當 自 大 悟 云 寶 所 無 
X31n0609_003:0504b12	寶所。成佛非成佛。三千界而物物全真。百萬劫而	寶 所 成 佛 非 成 佛 三 千 界 而 物 物 全 真 百 萬 劫 而 
X31n0609_003:0504b13	時時圓覺。到此田地。化城也如空含空。寶所也如	時 時 圓 覺 到 此 田 地 化 城 也 如 空 含 空 寶 所 也 如 
X31n0609_003:0504b14	鏡照鏡。更何疑哉。請聽山偈。一聲皷響大家聞。却	鏡 照 鏡 更 何 疑 哉 請 聽 山 偈 一 聲 皷 響 大 家 聞 却 
X31n0609_003:0504b15	許何人識皷神。識得皷神周徧處。塵塵剎剎是全	許 何 人 識 皷 神 識 得 皷 神 周 徧 處 塵 塵 剎 剎 是 全 
X31n0609_003:0504b16	身。問曰。如何是皷神周徧處。師曰。你還聞麼。曰學	身 問 曰 如 何 是 皷 神 周 徧 處 師 曰 你 還 聞 麼 曰 學 
X31n0609_003:0504b17	人不聞。師曰。你還記得話頭麼。曰學人記不得。師	人 不 聞 師 曰 你 還 記 得 話 頭 麼 曰 學 人 記 不 得 師 
X31n0609_003:0504b18	曰。塵塵剎剎是全身。曰請師直捷處道一句看。師	曰 塵 塵 剎 剎 是 全 身 曰 請 師 直 捷 處 道 一 句 看 師 
X31n0609_003:0504b19	曰。聽說山偈。若要直捷莫妄想。妄想恐墮世緣網。	曰 聽 說 山 偈 若 要 直 捷 莫 妄 想 妄 想 恐 墮 世 緣 網 
X31n0609_003:0504b20	須知十方三世間。總是沙門一隻眼。	須 知 十 方 三 世 間 總 是 沙 門 一 隻 眼 
X31n0609_003:0504b21	爾時大通智勝如來(至)十二行法輪。	爾 時 大 通 智 勝 如 來 至 十 二 行 法 輪 
X31n0609_003:0504b22	此一段經意。大略只是言大通佛既受虔請應機	此 一 段 經 意 大 略 只 是 言 大 通 佛 既 受 虔 請 應 機 
X31n0609_003:0504b23	說法。後乃各得悟解。各各成道果。更無他說。然講	說 法 後 乃 各 得 悟 解 各 各 成 道 果 更 無 他 說 然 講 
X31n0609_003:0504b24	以悟解為宗。禪以入妙為本。(某)濫叨講肆。亦辱禪	以 悟 解 為 宗 禪 以 入 妙 為 本 某 濫 叨 講 肆 亦 辱 禪 
X31n0609_003:0504c01	門。試以三轉十二法輪重拈一遍。末以禪家眼目	門 試 以 三 轉 十 二 法 輪 重 拈 一 遍 末 以 禪 家 眼 目 
X31n0609_003:0504c02	略陳梗槩。夫三轉者。示相轉。勸修轉。作證轉。作證	略 陳 梗 槩 夫 三 轉 者 示 相 轉 勸 修 轉 作 證 轉 作 證 
X31n0609_003:0504c03	轉者。謂我已證。汝亦應證。勸修轉者。示善道路。宜	轉 者 謂 我 已 證 汝 亦 應 證 勸 修 轉 者 示 善 道 路 宜 
X31n0609_003:0504c04	應進學。示相轉者。示四諦法。便知向方。四諦法者。	應 進 學 示 相 轉 者 示 四 諦 法 便 知 向 方 四 諦 法 者 
X31n0609_003:0504c05	謂苦集滅道四聖諦也。謂之聖諦者。謂此四法皆	謂 苦集滅道 四 聖 諦 也 謂 之 聖 諦 者 謂 此 四 法 皆 
X31n0609_003:0504c06	是大聖人諦實之法也。何以謂之苦。地獄餓鬼畜	是 大 聖 人 諦 實 之 法 也 何 以 謂 之 苦 地 獄 餓 鬼 畜 
X31n0609_003:0504c07	生三惡趣是也。佛說此三處苦者。以此三處俱受	生 三 惡 趣 是 也 佛 說 此 三 處 苦 者 以 此 三 處 俱 受 
X31n0609_003:0504c08	逼迫。不得自在。故名苦諦。何以謂之集。殺盜淫兩	逼 迫 不得自在 故 名 苦 諦 何 以 謂 之 集 殺 盜 淫 兩 
X31n0609_003:0504c09	舌惡口妄言綺語貪嗔癡十惡是也。佛說此十惡	舌 惡 口 妄 言 綺 語 貪 嗔 癡 十 惡 是 也 佛 說 此 十 惡 
X31n0609_003:0504c10	皆是召眾苦之本。故名集諦。何以謂之滅諦。冲虗	皆 是 召 眾 苦 之 本 故 名 集 諦 何 以 謂 之 滅 諦 冲 虗 
X31n0609_003:0504c11	妙粹清淨常樂是也。佛說此地眾苦不能侵。一靈	妙 粹 清 淨 常 樂 是 也 佛 說 此 地 眾 苦 不 能 侵 一 靈 
X31n0609_003:0504c12	常寂滅。故名滅諦。何以謂之道諦。三十七品修道	常 寂 滅 故 名 滅 諦 何 以 謂 之 道 諦 三十七品 修 道 
X31n0609_003:0504c13	名教是也。三十七品者。四念處。四正勤。五根。五力。	名 教 是 也 三十七品 者 四 念 處 四 正 勤 五 根 五 力 
X31n0609_003:0504c14	七覺支。八正道。四如意也。如是三十七品。若講說。	七 覺 支 八 正 道 四 如 意 也 如 是 三十七品 若 講 說 
X31n0609_003:0504c15	入海算沙。總是其體而已矣。如是三轉四諦。成十	入 海 算 沙 總 是 其 體 而 已 矣 如 是 三 轉 四 諦 成 十 
X31n0609_003:0504c16	二行法輪。上根一轉即悟。中根二轉乃明。下根必	二 行 法 輪 上 根 一 轉 即 悟 中 根 二 轉 乃 明 下 根 必 
X31n0609_003:0504c17	須三轉。舉如意云。會麼。若於此會得。千山勢向嶽	須 三 轉 舉 如 意 云 會 麼 若 於 此 會 得 千 山 勢 向 嶽 
X31n0609_003:0504c18	邊止。萬派聲歸海上消。佛法世法打成一片。道念	邊 止 萬 派 聲 歸 海 上 消 佛 法 世 法 打 成 一 片 道 念 
X31n0609_003:0504c19	情念融作一心。直得無法可說是名說法。其或不	情 念 融 作 一 心 直 得 無 法 可 說 是 名 說 法 其 或 不 
X31n0609_003:0504c20	然。山僧有偈。但能不作三途業。三十七般法亦空。	然 山 僧 有 偈 但 能 不 作 三 途 業 三 十 七 般 法 亦 空 
X31n0609_003:0504c21	無事道人常打睡。任他日月自西東。問曰。如何是	無 事 道 人 常 打 睡 任 他 日 月 自 西 東 問 曰 如 何 是 
X31n0609_003:0504c22	無事道人。師曰。不除妄想不求真。曰還了得生死	無 事 道 人 師 曰 不 除 妄 想 不 求 真 曰 還 了 得 生 死 
X31n0609_003:0504c23	也無。師曰。你喚恁麼作生死。曰恁麼則無明實性	也 無 師 曰 你 喚 恁 麼 作 生 死 曰 恁 麼 則 無 明 實 性 
X31n0609_003:0504c24	即佛性。幻化空身即法身。師曰。如是如是。	即 佛 性 幻 化 空 身 即 法 身 師 曰 如是如是 
X31n0609_003:0505a01	五百弟子受記品第八	五 百 弟 子 受 記 品 第 八 
X31n0609_003:0505a02	此一品經。佛為下根不悟。說因緣一周明夙。世因	此 一 品 經 佛 為 下 根 不 悟 說 因 緣 一 周 明 夙 世 因 
X31n0609_003:0505a03	緣之事。滿慈子等五百領悟。自述云。元來十方不	緣 之 事 滿 慈 子 等 五 百 領 悟 自 述 云 元 來 十 方 不 
X31n0609_003:0505a04	隔。三世不遷。性本圓明。心本靈妙。但當人拘於根	隔 三 世 不 遷 性 本 圓 明 心 本 靈 妙 但 當 人 拘 於 根 
X31n0609_003:0505a05	塵之偏。囿於形器之小。舊習不消。所以有成佛不	塵 之 偏 囿 於 形 器 之 小 舊 習 不 消 所 以 有 成 佛 不 
X31n0609_003:0505a06	成佛之分。授記不授記之別。豈佛心有揀擇而授	成 佛 之 分 授 記 不 授 記 之 別 豈 佛 心 有 揀 擇 而 授 
X31n0609_003:0505a07	記諸子有上下乎。舉如意云。會麼。若於此會得。根	記 諸 子 有 上 下 乎 舉 如 意 云 會 麼 若 於 此 會 得 根 
X31n0609_003:0505a08	塵逈脫。不異消片雪於紅爐。夙習頓空。宛若破輕	塵 逈 脫 不 異 消 片 雪 於 紅 爐 夙 習 頓 空 宛 若 破 輕 
X31n0609_003:0505a09	漚於大海。一即一切。盡乾坤是個法身。一切即一。	漚 於 大 海 一 即 一 切 盡 乾 坤 是 個 法 身 一 切 即 一 
X31n0609_003:0505a10	亘古今通為佛智。其或不然。須要靜中獨獨看個	亘 古 今 通 為 佛 智 其 或 不 然 須 要 靜 中 獨 獨 看 個 
X31n0609_003:0505a11	無始無終無內無外的竟是何物。工夫純熟。打成	無 始 無 終 無 內 無 外 的 竟 是 何 物 工 夫 純 熟 打 成 
X31n0609_003:0505a12	一片。必當自悟云。成佛不成佛。俱是辨空華之濃	一 片 必 當 自 悟 云 成 佛 不 成 佛 俱 是 辨 空 華 之 濃 
X31n0609_003:0505a13	淡。授記不授記。俱是較兔角之短長。如到此地。繫	淡 授 記 不 授 記 俱 是 較 兔 角 之 短 長 如 到 此 地 繫 
X31n0609_003:0505a14	珠之親。親亦我也。醉酒之我。我亦親也。更何貧苦	珠 之 親 親 亦 我 也 醉 酒 之 我 我 亦 親 也 更 何 貧 苦 
X31n0609_003:0505a15	之可拋。何富貴之可得哉。再聽說偈。一個圓明淨	之 可 拋 何 富 貴 之 可 得 哉 再 聽 說 偈 一 個 圓 明 淨 
X31n0609_003:0505a16	覺心。人人本具是他尋。必蒙授記方成佛。總是將	覺 心 人 人 本 具 是 他 尋 必 蒙 授 記 方 成 佛 總 是 將 
X31n0609_003:0505a17	金去換金。問曰。如何是授記方成佛之事。師曰。掀	金 去 換 金 問 曰 如 何 是 授 記 方 成 佛 之 事 師 曰 掀 
X31n0609_003:0505a18	天功業世無對。不得封侯也是閒。曰恁麼則理雖	天 功 業 世 無 對 不 得 封 侯 也 是 閒 曰 恁 麼 則 理 雖 
X31n0609_003:0505a19	圓具。習要漸消。道總已成。還須佛印。師曰。聽說古	圓 具 習 要 漸 消 道 總 已 成 還 須 佛 印 師 曰 聽 說 古 
X31n0609_003:0505a20	偈。壯志稜稜鬢未秋。男兒不奮不封侯。翻思清白	偈 壯 志 稜 稜 鬢 未 秋 男 兒 不 奮 不 封 侯 翻 思 清 白 
X31n0609_003:0505a21	傳家客。洗耳溪邊不飲牛。曰如是則不除妄想不	傳 家 客 洗 耳 溪 邊 不 飲 牛 曰 如 是 則 不 除 妄 想 不 
X31n0609_003:0505a22	求真。師曰。一道孤光。洞徹古今。	求 真 師 曰 一 道 孤 光 洞 徹 古 今 
X31n0609_003:0505a23	授學無學人記品第九	授 學 無 學 人 記 品 第 九 
X31n0609_003:0505a24	此一品經。授記之說。與前授記品說同。學者。明自	此 一 品 經 授 記 之 說 與 前 授 記 品 說 同 學 者 明 自 
X31n0609_003:0505b01	本性而漸斷惡習。無學者。得悟自性而舊習滅盡。	本 性 而 漸 斷 惡 習 無 學 者 得 悟 自 性 而 舊 習 滅 盡 
X31n0609_003:0505b02	或曰。得悟本性。習惑滅盡。蒙佛授記。將來成大聖	或 曰 得 悟 本 性 習 惑 滅 盡 蒙 佛 授 記 將 來 成 大 聖 
X31n0609_003:0505b03	人。宜矣。只如纔欲明性理。纔欲斷惡習。亦蒙授記	人 宜 矣 只 如 纔 欲 明 性 理 纔 欲 斷 惡 習 亦 蒙 授 記 
X31n0609_003:0505b04	當來成大聖人。理恐非宜。智人答曰。人之本性。性	當 來 成 大 聖 人 理 恐 非 宜 智 人 答 曰 人 之 本 性 性 
X31n0609_003:0505b05	即理也。元無聖凡之名可稱。元無善惡之迹可指。	即 理 也 元 無 聖 凡 之 名 可 稱 元 無 善 惡 之 迹 可 指 
X31n0609_003:0505b06	竪窮三際。橫遍十方。但以當人不知。或隨氣稟而	竪 窮 三 際 橫 遍 十 方 但 以 當 人 不 知 或 隨 氣 稟 而 
X31n0609_003:0505b07	有異。或拘習染而自差。所以有學無學二者之名。	有 異 或 拘 習 染 而 自 差 所 以 有 學 無 學 二 者 之 名 
X31n0609_003:0505b08	果能一念回光。復還天性。則無邊惡業直下頓消。	果 能 一 念 回 光 復 還 天 性 則 無 邊 惡 業 直 下 頓 消 
X31n0609_003:0505b09	無邊功德一時具足。更說什麼學與無學。故永嘉	無 邊 功 德 一 時 具 足 更 說 什 麼 學 與 無 學 故 永 嘉 
X31n0609_003:0505b10	云。證實相。無人法。剎那滅却阿鼻業。若將妄語誑	云 證 實 相 無 人 法 剎 那 滅 却 阿 鼻 業 若 將 妄 語 誑 
X31n0609_003:0505b11	眾生。自招拔舌塵沙劫。舉如意云。會麼。若於此會	眾 生 自 招 拔 舌 塵 沙 劫 舉 如 意 云 會 麼 若 於 此 會 
X31n0609_003:0505b12	得。頭頭總是。物物全彰。大而天地。眾而萬物。微而	得 頭 頭 總 是 物 物 全 彰 大 而 天 地 眾 而 萬 物 微 而 
X31n0609_003:0505b13	念慮。無不是祖師西來意。無不是七軸蓮華。無不	念 慮 無 不 是 祖 師 西 來 意 無 不 是 七 軸 蓮 華 無 不 
X31n0609_003:0505b14	是道人妙用。其或未委。須向靜中參句萬法歸一	是 道 人 妙 用 其 或 未 委 須 向 靜 中 參 句 萬 法 歸 一 
X31n0609_003:0505b15	一歸何處。工夫久久當自覺悟。十世古今始終不	一 歸 何 處 工 夫 久 久 當 自 覺 悟 十 世 古 今 始 終 不 
X31n0609_003:0505b16	離於當念。無邊剎海自他不隔於毫端。乃自家舊	離 於 當 念 無 邊 剎 海 自 他 不 隔 於 毫 端 乃 自 家 舊 
X31n0609_003:0505b17	物耳。再聽說偈。夙習未消須要滅。習消學滅總虗	物 耳 再 聽 說 偈 夙 習 未 消 須 要 滅 習 消 學 滅 總 虗 
X31n0609_003:0505b18	言。人言有水皆涵月。我道無雲便是天。問曰。如何	言 人 言 有 水 皆 涵 月 我 道 無 雲 便 是 天 問 曰 如 何 
X31n0609_003:0505b19	是無雲便是天。師曰。聽說山偈。圓明覺體本如然。	是 無 雲 便 是 天 師 曰 聽 說 山 偈 圓 明 覺 體 本 如 然 
X31n0609_003:0505b20	昧者不知道有言。既肯迷雲都掃盡。緣何不是大	昧 者 不 知 道 有 言 既 肯 迷 雲 都 掃 盡 緣 何 不 是 大 
X31n0609_003:0505b21	青天。曰恁麼則但離妄緣。即如如佛。師曰。闍黎如	青 天 曰 恁 麼 則 但 離 妄 緣 即 如 如 佛 師 曰 闍 黎 如 
X31n0609_003:0505b22	此。大家迴向。	此 大 家 迴 向 
X31n0609_003:0505b23	法師品第十(講品名至三菩提兩段)	法 師 品 第 十 講 品 名 至 三 菩 提 兩 段 
X31n0609_003:0505b24	此一品經。推尊弘法之足以為天人師。聞法之人	此 一 品 經 推 尊 弘 法 之 足 以 為 天 人 師 聞 法 之 人 
X31n0609_003:0505c01	亦必成佛無疑。故曰法師品。(再舉)爾時世尊因藥	亦 必 成 佛 無 疑 故 曰 法 師 品 再 舉 爾 時 世 尊 因 藥 
X31n0609_003:0505c02	王菩薩至三菩提。此一段經。廣記二乘八部四眾	王 菩 薩 至 三 菩 提 此 一 段 經 廣 記 二 乘 八 部 四 眾 
X31n0609_003:0505c03	但聞妙經皆得成佛無疑者也。(再舉)佛告藥王至	但 聞 妙 經 皆 得 成 佛 無 疑 者 也 再 舉 佛 告 藥 王 至 
X31n0609_003:0505c04	三菩提記。此一章經。特記濁惡之時聞此妙經。乃	三 菩 提 記 此 一 章 經 特 記 濁 惡 之 時 聞 此 妙 經 乃 
X31n0609_003:0505c05	至一句。一念隨喜。亦得受佛尊記。然此妙經。即人	至 一 句 一 念 隨 喜 亦 得 受 佛 尊 記 然 此 妙 經 即 人 
X31n0609_003:0505c06	人自性之理。以人人自性元與十方大聖人無少	人 自 性 之 理 以 人 人 自 性 元 與 十 方 大 聖 人 無 少 
X31n0609_003:0505c07	間隔。以無少間隔。故聖人間出。闡揚至道。莫不皆	間 隔 以 無 少 間 隔 故 聖 人 間 出 闡 揚 至 道 莫 不 皆 
X31n0609_003:0505c08	指此性廣無涯際壽無終始萬善圓具萬理圓通	指 此 性 廣 無 涯 際 壽 無 終 始 萬 善 圓 具 萬 理 圓 通 
X31n0609_003:0505c09	本來是佛者也。以人不明此性。故於此性上起人	本 來 是 佛 者 也 以 人 不 明 此 性 故 於 此 性 上 起 人 
X31n0609_003:0505c10	我見。其見既萌則萬別千差之取舍憎愛。如奔蟻	我 見 其 見 既 萌 則 萬 別 千 差 之 取 舍 憎 愛 如 奔 蟻 
X31n0609_003:0505c11	旋磨無有了期。以不悟此心。故於此性上生逆順	旋 磨 無 有 了 期 以 不 悟 此 心 故 於 此 性 上 生 逆 順 
X31n0609_003:0505c12	情。其情既立。則萬種千般之喜怒哀樂似老象溺	情 其 情 既 立 則 萬 種 千 般 之 喜 怒 哀 樂 似 老 象 溺 
X31n0609_003:0505c13	泥無有出日。良可嘆也。故吾佛大聖人。以四生同	泥 無 有 出 日 良 可 嘆 也 故 吾 佛 大 聖 人 以 四 生 同 
X31n0609_003:0505c14	體之仁。以萬類同知之智。生大憐愍。演此妙經。直	體 之 仁 以 萬 類 同 知 之 智 生 大 憐 愍 演 此 妙 經 直 
X31n0609_003:0505c15	指人人本具妙性本與十方大聖人了無毫髮間	指 人 人 本 具 妙 性 本 與 十 方 大 聖 人 了 無 毫 髮 間 
X31n0609_003:0505c16	隔。欲令人人一同悟入。復元來田地者也。如是。只	隔 欲 令 人 人 一 同 悟 入 復 元 來 田 地 者 也 如 是 只 
X31n0609_003:0505c17	恐不聞不信。但聞但信。將來成佛。如麵作餅。如白	恐 不 聞 不 信 但 聞 但 信 將 來 成 佛 如 麵 作 餅 如 白 
X31n0609_003:0505c18	受采。豈難事哉。舉如意云。會麼。若於此會得。全身	受 采 豈 難 事 哉 舉 如 意 云 會 麼 若 於 此 會 得 全 身 
X31n0609_003:0505c19	領荷。萬物一馬也。何真何假。天地一指也。孰是孰	領 荷 萬 物 一 馬 也 何 真 何 假 天 地 一 指 也 孰 是 孰 
X31n0609_003:0505c20	非。其或躊蹰。山僧有偈。當人只恐信不篤。信得篤	非 其 或 躊 蹰 山 僧 有 偈 當 人 只 恐 信 不 篤 信 得 篤 
X31n0609_003:0505c21	時心即佛。如施五彩白紙中。不須百樣功勞碌。問	時 心 即 佛 如 施 五 彩 白 紙 中 不 須 百 樣 功 勞 碌 問 
X31n0609_003:0505c22	曰。經云若聞一句亦得當來作佛。未審學人還成	曰 經 云 若 聞 一 句 亦 得 當 來 作 佛 未 審 學 人 還 成 
X31n0609_003:0505c23	佛否。師曰。你道那個不是佛。曰恁麼則人人本具。	佛 否 師 曰 你 道 那 個 不 是 佛 曰 恁 麼 則 人 人 本 具 
X31n0609_003:0505c24	個個圓成。師曰。闍黎若是更躊蹰。江北江南問王	個 個 圓 成 師 曰 闍 黎 若 是 更 躊 蹰 江 北 江 南 問 王 
X31n0609_003:0506a01	老。	老 
X31n0609_003:0506a02	若復有人(至)生此人間。	若 復 有 人 至 生 此 人 間 
X31n0609_003:0506a03	此一章經。科家謂之推尊其人。謂惟六種法師也。	此 一 章 經 科 家 謂 之 推 尊 其 人 謂 惟 六 種 法 師 也 
X31n0609_003:0506a04	六種法師者。一受持經。謂領受妙道。永無退失者	六 種 法 師 者 一 受 持 經 謂 領 受 妙 道 永 無 退 失 者 
X31n0609_003:0506a05	也。二對本讀經。謂尊道而行。不越毫髮者也。三離	也 二 對 本 讀 經 謂 尊 道 而 行 不 越 毫 髮 者 也 三 離 
X31n0609_003:0506a06	本唱誦。謂熟於斯道。左右逢源者也。四為人解說。	本 唱 誦 謂 熟 於 斯 道 左 右 逢 源 者 也 四 為 人 解 說 
X31n0609_003:0506a07	謂己道既得。以道化人者也。五書寫流通。謂道德	謂 己 道 既 得 以 道 化 人 者 也 五 書 寫 流 通 謂 道 德 
X31n0609_003:0506a08	既明。萬人取法者也。六供養經卷。謂以道自重。備	既 明 萬 人 取 法 者 也 六 供 養 經 卷 謂 以 道 自 重 備 
X31n0609_003:0506a09	修眾善者也。然俱稱為法師者。此六種人。皆可為	修 眾 善 者 也 然 俱 稱 為 法 師 者 此 六 種 人 皆 可 為 
X31n0609_003:0506a10	人中模範。海內舟航。堪當恭敬。或曰。佛特推尊之	人 中 模 範 海 內 舟 航 堪 當 恭 敬 或 曰 佛 特 推 尊 之 
X31n0609_003:0506a11	者何。葢此妙經即人人本具之至理。以理不明故。	者 何 葢 此 妙 經 即 人 人 本 具 之 至 理 以 理 不 明 故 
X31n0609_003:0506a12	經無量百千劫。於生死海頭出頭沒。無有盡日。今	經 無 量 百 千 劫 於 生 死 海 頭 出 頭 沒 無 有 盡 日 今 
X31n0609_003:0506a13	若得聞此經。則經理昭然而不昧。至道條然而不	若 得 聞 此 經 則 經 理 昭 然 而 不 昧 至 道 條 然 而 不 
X31n0609_003:0506a14	亂。以不亂故。折旋俯仰。皆合先聖威儀。以不昧故。	亂 以 不 亂 故 折 旋 俯 仰 皆 合 先 聖 威 儀 以 不 昧 故 
X31n0609_003:0506a15	念慮語言。皆是先佛玄妙。玄妙既與先佛相符。威	念 慮 語 言 皆 是 先 佛 玄 妙 玄 妙 既 與 先 佛 相 符 威 
X31n0609_003:0506a16	儀又與先聖無異。烏得不以法師稱之。特推尊於	儀 又 與 先 聖 無 異 烏 得 不 以 法 師 稱 之 特 推 尊 於 
X31n0609_003:0506a17	眾人之上者哉。舉如意云。會麼。若於此會得。俯仰	眾 人 之 上 者 哉 舉 如 意 云 會 麼 若 於 此 會 得 俯 仰 
X31n0609_003:0506a18	皆是妙經。鳶也宣揚。魚也宣揚。左右無非妙道。柴	皆 是 妙 經 鳶 也 宣 揚 魚 也 宣 揚 左 右 無 非 妙 道 柴 
X31n0609_003:0506a19	也書寫。水也書寫。其或不然。須向靜中看個喜怒	也 書 寫 水 也 書 寫 其 或 不 然 須 向 靜 中 看 個 喜 怒 
X31n0609_003:0506a20	哀樂的主人翁畢竟是何面孔。忽地悟來。便不受	哀 樂 的 主 人 翁 畢 竟 是 何 面 孔 忽 地 悟 來 便 不 受 
X31n0609_003:0506a21	人瞞。元來如此。元來如此。如若再疑。山僧有偈。竹	人 瞞 元 來 如 此 元 來 如 此 如 若 再 疑 山 僧 有 偈 竹 
X31n0609_003:0506a22	翠華黃總妙經。讀經真眼許誰明。今朝山野午拈	翠 華 黃 總 妙 經 讀 經 真 眼 許 誰 明 今 朝 山 野 午 拈 
X31n0609_003:0506a23	拂。昔日瞿曇曉見星。向上有關時打透。現前無道	拂 昔 日 瞿 曇 曉 見 星 向 上 有 關 時 打 透 現 前 無 道 
X31n0609_003:0506a24	不圓成。當人於此真能領。萬古天人師可稱。問曰。	不 圓 成 當 人 於 此 真 能 領 萬 古 天 人 師 可 稱 問 曰 
X31n0609_003:0506b01	今朝山野午拈拂一句學人不會。師曰。今日將午。	今 朝 山 野 午 拈 拂 一 句 學 人 不 會 師 曰 今 日 將 午 
X31n0609_003:0506b02	山僧講經。手拈拂子。有什麼不會。曰恁麼則運水	山 僧 講 經 手 拈 拂 子 有 什 麼 不 會 曰 恁 麼 則 運 水 
X31n0609_003:0506b03	搬柴。拈匙舉筋。無不是祖師的的大意也。師曰。金	搬 柴 拈 匙 舉 筋 無 不 是 祖 師 的 的 大 意 也 師 曰 金 
X31n0609_003:0506b04	屑雖貴。落眼成塵。曰如何是直捷一句。請師對眾	屑 雖 貴 落 眼 成 塵 曰 如 何 是 直 捷 一 句 請 師 對 眾 
X31n0609_003:0506b05	宣揚。師曰。你肯念佛。無人掩住你口。	宣 揚 師 曰 你 肯 念 佛 無 人 掩 住 你 口 
X31n0609_003:0506b06	藥王若有人(至)其罪甚重。	藥 王 若 有 人 至 其 罪 甚 重 
X31n0609_003:0506b07	藥王若有人問至必得作佛。此兩句經。言必得作	藥 王 若 有 人 問 至 必 得 作 佛 此 兩 句 經 言 必 得 作 
X31n0609_003:0506b08	佛之義。再舉何以故若善男子至種種供養者。此	佛 之 義 再 舉 何 以 故 若 善 男 子 至 種種供養 者 此 
X31n0609_003:0506b09	一篇經。言六種法師皆當以佛供養而供養之。以	一 篇 經 言 六 種 法 師 皆 當 以 佛 供 養 而 供 養 之 以 
X31n0609_003:0506b10	其成佛必矣。再舉藥王當知至廣演此經。此一行	其 成 佛 必 矣 再 舉 藥 王 當 知 至 廣 演 此 經 此 一 行 
X31n0609_003:0506b11	經。言如上六種法師皆再來菩薩也。再舉若是善	經 言 如 上 六 種 法 師 皆 再 來 菩 薩 也 再 舉 若 是 善 
X31n0609_003:0506b12	男子至廣為人說。此一段經。極讚說經功德。再舉	男 子 至 廣 為 人 說 此 一 段 經 極 讚 說 經 功 德 再 舉 
X31n0609_003:0506b13	藥王若有惡人至其罪甚重。此數句經。極稱妙經	藥 王 若 有 惡 人 至 其 罪 甚 重 此 數 句 經 極 稱 妙 經 
X31n0609_003:0506b14	毀之者其罪甚重。(某)才雖不敏。悟亦有宗。敢以毀	毀 之 者 其 罪 甚 重 某 才 雖 不 敏 悟 亦 有 宗 敢 以 毀 
X31n0609_003:0506b15	佛毀經之罪輕重。拈一遍看。葢諸佛居殊方之國。	佛 毀 經 之 罪 輕 重 拈 一 遍 看 葢 諸 佛 居 殊 方 之 國 
X31n0609_003:0506b16	妙經即當人之妙心也。故毀經是毀自己之心。雖	妙 經 即 當 人 之 妙 心 也 故 毀 經 是 毀 自 己 之 心 雖 
X31n0609_003:0506b17	一言而難懺。罵佛乃罵殊方之佛。故惟年久而可	一 言 而 難 懺 罵 佛 乃 罵 殊 方 之 佛 故 惟 年 久 而 可 
