X37n0660_003:0033b06	左傳云。心不測德義之經為頑。口不道忠信之言曰	左 傳 云 心 不 測 德 義 之 經 為 頑 口 不 道 忠 信 之 言 曰 
X37n0660_003:0033b07	嚚是也。	嚚 是 也 
X37n0660_003:0033b08	信邪術者。以四倒為術也。	信 邪 術 者 以 四 倒 為 術 也 
X37n0660_003:0033b09	膩潤為我者。著於有無。以自在故也。	膩 潤 為 我 者 著 於 有 無 以 自 在 故 也 
X37n0660_003:0033b10	經云不知病起根源者。述於常樂之解。純信邪常也。	經 云 不 知 病 起 根 源 者 述 於 常 樂 之 解 純 信 邪 常 也 
X37n0660_003:0033b11	經云知乳好醜善惡等者。正常樂為好為善。邪常樂	經 云 知 乳 好 醜 善 惡 等 者 正 常 樂 為 好 為 善 邪 常 樂 
X37n0660_003:0033b12	為醜為惡也。	為 醜 為 惡 也 
X37n0660_003:0033b13	王者主領為義者。譬眾生稟受邪教之。後自領徒屬	王 者 主 領 為 義 者 譬 眾 生 稟 受 邪 教 之 後 自 領 徒 屬 
X37n0660_003:0033b14	也。	也 
X37n0660_003:0033b15	眾生強請者。佛未出世。諸外道者。各化眾生也。	眾 生 強 請 者 佛 未 出 世 諸 外 道 者 各 化 眾 生 也 
X37n0660_003:0033b16	內無真解者。一切種智也。外無巧說者。佛四辨也。	內 無 真 解 者 一切種智 也 外 無 巧 說 者 佛 四 辨 也 
X37n0660_003:0033b17	藥少者。邪常等也。病多者。世間出世間等病也。	藥 少 者 邪 常 等 也 病 多 者 世間出世間 等 病 也 
X37n0660_003:0033b18	由於取相等者。見思無明等。是其相也。就中著見我	由 於 取 相 等 者 見 思 無 明 等 是 其 相 也 就 中 著 見 我 
X37n0660_003:0033b19	最強。亦名為相也。	最 強 亦 名 為 相 也 
X37n0660_003:0033b20	是不知藥者。雖知其名。而不知義也。	是 不 知 藥 者 雖 知 其 名 而 不 知 義 也 
X37n0660_003:0033b21	青白等下注(云云)者。廣如下釋也。	青 白 等 下 注 云 云 者 廣 如 下 釋 也 
X37n0660_003:0033b22	逗藥失所者。常病不用無常藥。無常病不用真常藥。	逗 藥 失 所 者 常 病 不 用 無 常 藥 無 常 病 不 用 真 常 藥 
X37n0660_003:0033b23	皆名失所也。	皆 名 失 所 也 
X37n0660_003:0033b24	二治病緣者。先同後異。為緣也。	二 治 病 緣 者 先 同 後 異 為 緣 也 
X37n0660_003:0033c01	佛知八正道者。即是大乘無作八正道。能治八倒。能	佛 知 八 正 道 者 即 是 大 乘 無 作 八 正 道 能 治 八 倒 能 
X37n0660_003:0033c02	用前兩教無常。後兩教常等。為八術也。	用 前 兩 教 無 常 後 兩 教 常 等 為 八 術 也 
X37n0660_003:0033c03	十中第一。	十 中 第 一 
X37n0660_003:0033c04	空見外道者。撥無一切因果。廣造諸惡也。	空 見 外 道 者 撥 無 一 切 因 果 廣 造 諸 惡 也 
X37n0660_003:0033c05	慧命亦死者。即是無常常無漏之慧命也。	慧 命 亦 死 者 即 是 無 常 常 無 漏 之 慧 命 也 
X37n0660_003:0033c06	常見外道者。謂生天及非想等處也。	常 見 外 道 者 謂 生 天 及 非 想 等 處 也 
X37n0660_003:0033c07	斷結外道者。用世智。斷下八地也。	斷 結 外 道 者 用 世 智 斷 下 八 地 也 
X37n0660_003:0033c08	雖能兼遍者。六度菩薩。約用四門為遍。化他為兼。無	雖 能 兼 遍 者 六 度 菩 薩 約 用 四 門 為 遍 化 他 為 兼 無 
X37n0660_003:0033c09	巧述者。未斷煩惱。行其事檀也。	巧 述 者 未 斷 煩 惱 行 其 事 檀 也 
X37n0660_003:0033c10	治難愈病者。破無明也。治無痛惱者。體法即空	治 難 愈 病 者 破 無 明 也 治 無 痛 惱 者 體 法 即 空 
X37n0660_003:0033c11	也。	也 
X37n0660_003:0033c12	不能治必死者。二乘未破無明也。	不 能 治 必 死 者 二 乘 未 破 無 明 也 
X37n0660_003:0033c13	不能令復本者。未入證也。	不 能 令 復 本 者 未 入 證 也 
X37n0660_003:0033c14	不能令過本者。未入二住已去。故云過。初住為本。至	不 能 令 過 本 者 未 入 二 住 已 去 故 云 過 初 住 為 本 至 
X37n0660_003:0033c15	等覺菩薩。不能過妙覺之本也。若作四句。本下迹高。	等 覺 菩 薩 不 能 過 妙 覺 之 本 也 若 作 四 句 本 下 迹 高 
X37n0660_003:0033c16	有高義也。	有 高 義 也 
X37n0660_003:0033c17	講武等者。講演也。如太子把文王弓。躬九重鐵圍山	講 武 等 者 講 演 也 如 太 子 把 文 王 弓 躬 九 重 鐵 圍 山 
X37n0660_003:0033c18	等。脫冠遣馬者。即是太子遊城四門。厭世出家。奴名	等 脫 冠 遣 馬 者 即 是 太 子 遊 城 四 門 厭 世 出 家 奴 名 
X37n0660_003:0033c19	車匿。馬名乾陟。發遣還宮也。	車 匿 馬 名 乾 陟 發 遣 還 宮 也 
X37n0660_003:0033c20	唯明此身成佛者。丈六身也。	唯 明 此 身 成 佛 者 丈 六 身 也 
X37n0660_003:0033c21	所餘二秊者。從法華至涅槃也。	所 餘 二 秊 者 從 法 華 至 涅 槃 也 
X37n0660_003:0033c22	各有六行者。約觀明也。	各 有 六 行 者 約 觀 明 也 
X37n0660_003:0033c23	經云從遠方來者。從真起應義之言遠也。	經 云 從 遠 方 來 者 從 真 起 應 義 之 言 遠 也 
X37n0660_003:0033c24	無觀機之智者。今昔之機也。	無 觀 機 之 智 者 今 昔 之 機 也 
X37n0660_003:0034a01	即是神通者。有漏通耳。	即 是 神 通 者 有 漏 通 耳 
X37n0660_003:0034a02	文鱗三歸者。即是龍王初度三歸也。	文 鱗 三 歸 者 即 是 龍 王 初 度 三 歸 也 
X37n0660_003:0034a03	經云今正是時者。雖云初教。意在於大機中論之。故	經 云 今正是時 者 雖 云 初 教 意 在 於 大 機 中 論 之 故 
X37n0660_003:0034a04	云時也。	云 時 也 
X37n0660_003:0034a05	根緣冥對者。機中冥有小大稱之事也。	根 緣 冥 對 者 機 中 冥 有 小 大 稱 之 事 也 
X37n0660_003:0034a06	餘界譬諸惑者。即初教之人。具足見思塵沙無明等	餘 界 譬 諸 惑 者 即 初 教 之 人 具 足 見 思 塵 沙 無 明 等 
X37n0660_003:0034a07	惑也。放害事多者。能生一切界內外煩惱故也。	惑 也 放 害 事 多 者 能 生 一 切 界 內 外 煩 惱 故 也 
X37n0660_003:0034a08	此名橫死者。邪惑障於正解。令慧命不生名之為死	此 名 橫 死 者 邪 惑 障 於 正 解 令 慧 命 不 生 名 之 為 死 
X37n0660_003:0034a09	也。	也 
X37n0660_003:0034a10	即上中下皆得悟者。此約小乘三根人也。上根阿若	即 上 中 下 皆 得 悟 者 此 約 小 乘 三 根 人 也 上 根 阿 若 
X37n0660_003:0034a11	憍陳如為首。	憍 陳 如 為 首 
X37n0660_003:0034a12	眾生不解者。不解權教無常。意在於實也。	眾 生 不 解 者 不 解 權 教 無 常 意 在 於 實 也 
X37n0660_003:0034a13	而執無為馬者。謂道無是馬。何處復有者却責也。	而 執 無 為 馬 者 謂 道 無 是 馬 何 處 復 有 者 却 責 也 
X37n0660_003:0034a14	此病易見者。佛果本是常。橫謂無常。若說是常。見生	此 病 易 見 者 佛 果 本 是 常 橫 謂 無 常 若 說 是 常 見 生 
X37n0660_003:0034a15	死無常也。	死 無 常 也 
X37n0660_003:0034a16	此病難見者。本是真常。今說無常。執無常病不知是	此 病 難 見 者 本 是 真 常 今 說 無 常 執 無 常 病 不 知 是 
X37n0660_003:0034a17	常。故云難也。	常 故 云 難 也 
X37n0660_003:0034a18	根緣扣佛者。大機欲生也。	根 緣 扣 佛 者 大 機 欲 生 也 
X37n0660_003:0034a19	遣使命醫者。以機為使也。	遣 使 命 醫 者 以 機 為 使 也 
X37n0660_003:0034a20	經云應服乳者。正真常之乳也。	經 云 應 服 乳 者 正 真 常 之 乳 也 
X37n0660_003:0034a21	開權者。如經是非實語。語只是教。昔非實說也。	開 權 者 如 經 是 非 實 語 語 只 是 教 昔 非 實 說 也 
X37n0660_003:0034a22	無常譬大者。如上文。是苦醎等藥皆能發熱。執之成	無 常 譬 大 者 如 上 文 是 苦 醎 等 藥 皆 能 發 熱 執 之 成 
X37n0660_003:0034a23	病也。	病 也 
X37n0660_003:0034a24	能燒世間者。即燒界外之世間也。	能 燒 世 間 者 即 燒 界 外 之 世 間 也 
X37n0660_003:0034b01	以昔譏今者。如經汝先言毒今云何服。即是譏今真	以 昔 譏 今 者 如 經 汝 先 言 毒 今 云 何 服 即 是 譏 今 真 
X37n0660_003:0034b02	常也。	常 也 
X37n0660_003:0034b03	今既令服等者。還服今日真常之乳。譏昔之毒。今昔	今 既 令 服 等 者 還 服 今 日 真 常 之 乳 譏 昔 之 毒 今 昔 
X37n0660_003:0034b04	相望。故為一雙也。	相 望 故 為 一 雙 也 
X37n0660_003:0034b05	還成上意者。成前雙驚之意也。	還 成 上 意 者 成 前 雙 驚 之 意 也 
X37n0660_003:0034b06	此中通體是譬者。上文開為四譬。此當第四用四德	此 中 通 體 是 譬 者 上 文 開 為 四 譬 此 當 第 四 用 四 德 
X37n0660_003:0034b07	之藥。故云道體也。	之 藥 故 云 道 體 也 
X37n0660_003:0034b08	而非解理者。理是常下之義也。	而 非 解 理 者 理 是 常 下 之 義 也 
X37n0660_003:0034b09	麥[麩夫+弋](夷識反)麥糠也。按諸書所無。唯趙書有人姓姚名	麥 [麩夫弋] 夷 識 反 麥 糠 也 按 諸 書 所 無 唯 趙 書 有 人 姓 姚 名 
X37n0660_003:0034b10	[麩夫+弋]。作此字耳。	[麩夫弋] 作 此 字 耳 
X37n0660_003:0034b11	次除是乳已下。古人分章門也。	次 除 是 乳 已 下 古 人 分 章 門 也 
X37n0660_003:0034b12	二鳥雙遊是行得所者。用之則行。捨之則藏。故云得	二 鳥 雙 遊 是 行 得 所 者 用 之 則 行 捨 之 則 藏 故 云 得 
X37n0660_003:0034b13	所。如下文俱藏俱息是也。	所 如 下 文 俱 藏 俱 息 是 也 
X37n0660_003:0034b14	符經合義者。經即今經。義即常樂之義。自相符合也。	符 經 合 義 者 經 即 今 經 義 即 常 樂 之 義 自 相 符 合 也 
X37n0660_003:0034b15	即上根人者。如法華身子之流為上根。法說同得悟	即 上 根 人 者 如 法 華 身 子 之 流 為 上 根 法 說 同 得 悟 
X37n0660_003:0034b16	也。	也 
X37n0660_003:0034b17	經云是藥非藥者。乳名雖同。外道非藥。如來是藥。能	經 云 是 藥 非 藥 者 乳 名 雖 同 外 道 非 藥 如 來 是 藥 能 
X37n0660_003:0034b18	治無常也。	治 無 常 也 
X37n0660_003:0034b20	涅槃經疏私記卷第三(一末)	涅 槃 經 疏 私 記 卷 第 三 一 末 
X37n0660_004:0034c01	天台涅槃疏私記卷第四(二本)	天 台 涅 槃 疏 私 記 卷 第 四 二 本 
X37n0660_004:0034c02	天台沙門　行滿　集	天 台 沙 門 行 滿 集 
X37n0660_004:0034c03	○釋長壽品第四	 釋 長 壽 品 第 四 
X37n0660_004:0034c04	前之三品嚴觀所安者。即是曇讖譯訖。謝公治定。嚴	前 之 三 品 嚴 觀 所 安 者 即 是 曇 讖 譯 訖 謝 公 治 定 嚴 
X37n0660_004:0034c05	觀二人開此一品為序等三品。故云安之。信知曇讖	觀 二 人 開 此 一 品 為 序 等 三 品 故 云 安 之 信 知 曇 讖 
X37n0660_004:0034c06	謝公亦有其分也。	謝 公 亦 有 其 分 也 
X37n0660_004:0034c07	此品存本者。緣前三品。同是壽命品。今存梵音也。	此 品 存 本 者 緣 前 三 品 同 是 壽 命 品 今 存 梵 音 也 
X37n0660_004:0034c08	譯人左右者。今移壽安下。改命為長安上。西方左下	譯 人 左 右 者 今 移 壽 安 下 改 命 為 長 安 上 西 方 左 下 
X37n0660_004:0034c09	此土安上。故云左右耳。猶如一物。東人謂西為右。人	此 土 安 上 故 云 左 右 耳 猶 如 一 物 東 人 謂 西 為 右 人 
X37n0660_004:0034c10	在物西謂東為左。物無別體也。	在 物 西 謂 東 為 左 物 無 別 體 也 
X37n0660_004:0034c11	恐依上文者。今家通意。如純陀獲五事果。廣明三身	恐 依 上 文 者 今 家 通 意 如 純 陀 獲 五 事 果 廣 明 三 身 
X37n0660_004:0034c12	四身皆是長壽之文。故云恐也。	四 身 皆 是 長 壽 之 文 故 云 恐 也 
X37n0660_004:0034c13	長只常下。問出所以也。常等是能從。長壽是所從立	長 只 常 下 問 出 所 以 也 常 等 是 能 從 長 壽 是 所 從 立 
X37n0660_004:0034c14	名。故所從能也。	名 故 所 從 能 也 
X37n0660_004:0034c15	一同諸佛法身者。十方諸如來。同共一法身。一身一	一 同 諸 佛 法 身 者 十 方 諸 如 來 同 共 一 法 身 一 身 一 
X37n0660_004:0034c16	智慧等。故云皆悉同等。此是釋品四悉檀意。諸佛不	智 慧 等 故 云 皆 悉 同 等 此 是 釋 品 四 悉 檀 意 諸 佛 不 
X37n0660_004:0034c17	同即世界也。	同 即 世 界 也 
X37n0660_004:0034c18	二由物忻長惡短者。物者謂之人。亦是物機忻厭不	二 由 物 忻 長 惡 短 者 物 者 謂 之 人 亦 是 物 機 忻 厭 不 
X37n0660_004:0034c19	等。宜見長壽。故令生理善。即為人悉。	等 宜 見 長 壽 故 令 生 理 善 即 為 人 悉 
X37n0660_004:0034c20	三對破偏修無常之拙等者。廣如上文勝劣相治。改	三 對 破 偏 修 無 常 之 拙 等 者 廣 如 上 文 勝 劣 相 治 改 
X37n0660_004:0034c21	於偏執。即對治意也。四會前三悉同成長壽。即第一	於 偏 執 即 對 治 意 也 四 會 前 三 悉 同 成 長 壽 即 第 一 
X37n0660_004:0034c22	義悉也。	義 悉 也 
X37n0660_004:0034c23	第三對菩薩眾者。上文純陀品對於雜眾。哀歎品對	第 三 對 菩 薩 眾 者 上 文 純 陀 品 對 於 雜 眾 哀 歎 品 對 
X37n0660_004:0034c24	聲聞。此對菩薩也。諸問答中長壽為首。以為言端也。	聲 聞 此 對 菩 薩 也 諸 問 答 中 長 壽 為 首 以 為 言 端 也 
X37n0660_004:0035a01	佛法至三故者。佛初勸。二復告。三佛告諸比丘故也。	佛 法 至 三 故 者 佛 初 勸 二 復 告 三 佛 告 諸 比 丘 故 也 
X37n0660_004:0035a02	上疑既盡初歡則嘿者。如下經文合譬中。時諸聲聞	上 疑 既 盡 初 歡 則 嘿 者 如 下 經 文 合 譬 中 時 諸 聲 聞 
X37n0660_004:0035a03	嘿然而住。即是其文。經家次第在後耳。	嘿 然 而 住 即 是 其 文 經 家 次 第 在 後 耳 
X37n0660_004:0035a04	後勸則推者。推諸菩薩有自行化他之功也。	後 勸 則 推 者 推 諸 菩 薩 有 自 行 化 他 之 功 也 
X37n0660_004:0035a05	上已問經者。意云純陀舉昔無常等身以問。佛以常	上 已 問 經 者 意 云 純 陀 舉 昔 無 常 等 身 以 問 佛 以 常 
X37n0660_004:0035a06	身等答。三修中廣論勝劣。皆是問經文也。	身 等 答 三 修 中 廣 論 勝 劣 皆 是 問 經 文 也 
X37n0660_004:0035a07	經深律淺者。今斥不許。且約事論有深有淺。若以涅	經 深 律 淺 者 今 斥 不 許 且 約 事 論 有 深 有 淺 若 以 涅 
X37n0660_004:0035a08	槃心修為被末代。有何深淺。故云而待勸耶。	槃 心 修 為 被 末 代 有 何 深 淺 故 云 而 待 勸 耶 
X37n0660_004:0035a09	又是今經之宗者。意亦不然。古人見有勸問戒律之	又 是 今 經 之 宗 者 意 亦 不 然 古 人 見 有 勸 問 戒 律 之 
X37n0660_004:0035a10	言將為經宗。准今所釋。依大師判教。此經為戒律說	言 將 為 經 宗 准 今 所 釋 依 大 師 判 教 此 經 為 戒 律 說 
X37n0660_004:0035a11	常。亦名贖命重寶。何者如來見諸比丘。末法多有破	常 亦 名 贖 命 重 寶 何 者 如 來 見 諸 比 丘 末 法 多 有 破 
X37n0660_004:0035a12	戒。畜八不淨物。常住慧命。埋沒煩惱。恐失慧命。將此	戒 畜 八 不 淨 物 常 住 慧 命 埋 沒 煩 惱 恐 失 慧 命 將 此 
X37n0660_004:0035a13	戒律用贖此命。如人在獄。多與財寶。命其得出。故非	戒 律 用 贖 此 命 如 人 在 獄 多 與 財 寶 命 其 得 出 故 非 
X37n0660_004:0035a14	其宗。今以常住佛性。為經宗也。	其 宗 今 以 常 住 佛 性 為 經 宗 也 
X37n0660_004:0035a15	今按經云於諸戒律者。既云於諸不獨問律。具問定	今 按 經 云 於 諸 戒 律 者 既 云 於 諸 不 獨 問 律 具 問 定 
X37n0660_004:0035a16	慧。經初雖無諸字。或本有之。今取下文於諸之言也。	慧 經 初 雖 無 諸 字 或 本 有 之 今 取 下 文 於 諸 之 言 也 
X37n0660_004:0035a17	律儀道定俱名為戒者。定謂定共。道謂道共等戒也。	律 儀 道 定 俱 名 為 戒 者 定 謂 定 共 道 謂 道 共 等 戒 也 
X37n0660_004:0035a18	諸言不一者。通問三學也。	諸 言 不 一 者 通 問 三 學 也 
X37n0660_004:0035a19	雙照二諦即勸問俗者。即含真為俗。廣如法華玄文	雙 照 二 諦 即 勸 問 俗 者 即 含 真 為 俗 廣 如 法 華 玄 文 
X37n0660_004:0035a20	七重二諦中明也。	七 重 二 諦 中 明 也 
X37n0660_004:0035a21	又言莫謂如來唯修空寂者。但以空寂之言為自。還	又 言 莫 謂 如 來 唯 修 空 寂 者 但 以 空 寂 之 言 為 自 還 
X37n0660_004:0035a22	目中道空寂雙非二諦也。	目 中 道 空 寂 雙 非 二 諦 也 
X37n0660_004:0035a23	具說如上者。具勸三學也。	具 說 如 上 者 具 勸 三 學 也 
X37n0660_004:0035a24	故以戒律而為勸端者。舉戒律即具定慧。又此具乘	故 以 戒 律 而 為 勸 端 者 舉 戒 律 即 具 定 慧 又 此 具 乘 
X37n0660_004:0035b01	戒故也。	戒 故 也 
X37n0660_004:0035b02	如來境界者。此約理論。三世諸佛從真起應。乘如實	如來境界 者 此 約 理 論 三世諸佛 從 真 起 應 乘 如 實 
X37n0660_004:0035b03	道來成正覺。故號如來。故云允同諸佛也。	道 來 成 正 覺 故 號 如 來 故 云 允 同 諸 佛 也 
X37n0660_004:0035b04	所有諸定者。此約行論。不思議定也。	所 有 諸 定 者 此 約 行 論 不 思 議 定 也 
X37n0660_004:0035b05	所演教誨者。此約教論。不思議教也。	所 演 教 誨 者 此 約 教 論 不 思 議 教 也 
X37n0660_004:0035b06	是道非道者。九法界為非道。佛界名為道。故淨名云。	是 道 非 道 者 九 法 界 為 非 道 佛 界 名 為 道 故 淨 名 云 
X37n0660_004:0035b07	行於非道。通達佛道等也。	行 於 非 道 通 達 佛 道 等 也 
X37n0660_004:0035b08	無三智者。二乘聲聞未具三智。故不能問三諦等也。	無 三 智 者 二 乘 聲 聞 未 具 三 智 故 不 能 問 三 諦 等 也 
X37n0660_004:0035b09	三云聲聞強受寄者。意辭不堪如來強與也。	三 云 聲 聞 強 受 寄 者 意 辭 不 堪 如 來 強 與 也 
X37n0660_004:0035b10	從過至現故百二十者。具約十支。未論未來生老死	從 過 至 現 故 百 二 十 者 具 約 十 支 未 論 未 來 生 老 死 
X37n0660_004:0035b11	等。由在現在當來未起故。一支十二。故百二十也(云云)	等 由 在 現 在 當 來 未 起 故 一 支 十 二 故 百 二 十 也 云 云 
X37n0660_004:0035b12	如不能居者。聲聞入滅。不能紹三寶種。令佛種久住。	如 不 能 居 者 聲 聞 入 滅 不 能 紹 三 寶 種 令 佛 種 久 住 
X37n0660_004:0035b13	故云居也。	故 云 居 也 
X37n0660_004:0035b14	故言富人如法華中稱為長者。財寶無量。自行化他。	故 言 富 人 如 法 華 中 稱 為 長 者 財 寶 無 量 自 行 化 他 
X37n0660_004:0035b15	內充外從。名之為富。緣事欲行者。此方緣謝。他方應	內 充 外 從 名 之 為 富 緣 事 欲 行 者 此 方 緣 謝 他 方 應 
X37n0660_004:0035b16	成。故云適化也。	成 故 云 適 化 也 
X37n0660_004:0035b17	乘如起應者。如是法身。從法身地。起他眾生也。	乘 如 起 應 者 如 是 法 身 從 法 身 地 起 他 眾 生 也 
X37n0660_004:0035b18	百金者。百句解脫也。	百 金 者 百 句 解 脫 也 
X37n0660_004:0035b19	漢書稱一萬為一金者。即一萬兩百金即百萬。百句	漢 書 稱 一 萬 為 一 金 者 即 一 萬 兩 百 金 即 百 萬 百 句 
X37n0660_004:0035b20	解脫。具如下釋。大師於靈石寺一夏講此百句解脫。	解 脫 具 如 下 釋 大 師 於 靈 石 寺 一 夏 講 此 百 句 解 脫 
X37n0660_004:0035b21	每一句作百句釋之。即一萬法門以為眷屬。與此相	每 一 句 作 百 句 釋 之 即 一 萬 法 門 以 為 眷 屬 與 此 相 
X37n0660_004:0035b22	會也。	會 也 
X37n0660_004:0035b23	人中為十天中二十者。約佛在於人天之中。說法教	人 中 為 十 天 中 二 十 者 約 佛 在 於 人 天 之 中 說 法 教 
X37n0660_004:0035b24	化也。	化 也 
X37n0660_004:0035c01	通別惑盡即是還時者。證大涅槃。如歸本國。故云還	通 別 惑 盡 即 是 還 時 者 證 大 涅 槃 如 歸 本 國 故 云 還 
X37n0660_004:0035c02	也。	也 
X37n0660_004:0035c03	歸我者。身中本有一體三寶。故云歸我也。	歸 我 者 身 中 本 有 一 體 三 寶 故 云 歸 我 也 
X37n0660_004:0035c04	此義稍便者。不同前釋也。	此 義 稍 便 者 不 同 前 釋 也 
X37n0660_004:0035c05	信心之子者。夫言子者。能紹繼字業。既無繼嗣。大乘	信 心 之 子 者 夫 言 子 者 能 紹 繼 字 業 既 無 繼 嗣 大 乘 
X37n0660_004:0035c06	常住散失也。	常 住 散 失 也 
X37n0660_004:0035c07	假說此言者。不應喚佛為癡人。故云假設。	假 說 此 言 者 不 應 喚 佛 為 癡 人 故 云 假 設 
X37n0660_004:0035c08	若遂寄下意云。受寄為癡人也。不應云佛也。	若 遂 寄 下 意 云 受 寄 為 癡 人 也 不 應 云 佛 也 
X37n0660_004:0035c09	經云當何所問者。不問即是法寶散失也。	經 云 當 何 所 問 者 不 問 即 是 法 寶 散 失 也 
X37n0660_004:0035c10	盛壯端正者。能自行化他。神通自在也。	盛 壯 端 正 者 能 自 行 化 他 神通自在 也 
X37n0660_004:0035c11	一切三昧悉入其中者。菩薩證得二十五三昧。破二	一 切 三 昧 悉 入 其 中 者 菩 薩 證 得 二 十 五 三 昧 破 二 
X37n0660_004:0035c12	十五有。名首楞嚴定。此三昧中王。亦云楗相三昧。一	十 五 有 名 首 楞 嚴 定 此 三 昧 中 王 亦 云 楗 相 三 昧 一 
X37n0660_004:0035c13	切三昧悉入其中也。	切 三 昧 悉 入 其 中 也 
X37n0660_004:0035c14	三諦一諦為母者。一實諦也。經云智度菩薩母。亦是	三 諦 一 諦 為 母 者 一 實 諦 也 經 云 智 度 菩 薩 母 亦 是 
X37n0660_004:0035c15	三智即一智也。	三 智 即 一 智 也 
X37n0660_004:0035c16	一諦三諦為父者。同體之權方便以為父。權智也。	一 諦 三 諦 為 父 者 同 體 之 權 方 便 以 為 父 權 智 也 
X37n0660_004:0035c17	經云如自己有者。菩薩證得法身。與諸佛同體。故云	經 云 如 自 己 有 者 菩 薩 證 得 法 身 與諸佛同 體 故 云 
X37n0660_004:0035c18	己有也。	己 有 也 
X37n0660_004:0035c19	經云時有人來者。謂是釋迦見比丘迴心機動感佛	經 云 時 有 人 來 者 謂 是 釋 迦 見 比 丘 迴 心 機 動 感 佛 
X37n0660_004:0035c20	義。之云來也。	義 之 云 來 也 
X37n0660_004:0035c21	忘我推功也者。忘我是聲聞不能推功於菩薩。善能	忘 我 推 功 也 者 忘 我 是 聲 聞 不 能 推 功 於 菩 薩 善 能 
X37n0660_004:0035c22	問答等也。悉出上文。如二緣乃至久住等。是也。	問 答 等 也 悉 出 上 文 如 二 緣 乃 至 久 住 等 是 也 
X37n0660_004:0035c23	又例無而意異者。菩薩久解。示同有問。聲聞新斷。故	又 例 無 而 意 異 者 菩 薩 久 解 示 同 有 問 聲 聞 新 斷 故 
X37n0660_004:0035c24	云無疑。推功不堪。即是意異也。	云 無 疑 推 功 不 堪 即 是 意 異 也 
X37n0660_004:0036a01	略舉同意者。施行義用等也。	略 舉 同 意 者 施 行 義 用 等 也 
X37n0660_004:0036a02	若問命即開天行者。第一義天常住壽命。	若 問 命 即 開 天 行 者 第 一 義 天 常 住 壽 命 
X37n0660_004:0036a03	問辨即開梵行者。智辨在說。慈悲為本。四無量心故	問 辨 即 開 梵 行 者 智 辨 在 說 慈 悲 為 本 四無量心 故 
X37n0660_004:0036a04	問梵行。故約施也。	問 梵 行 故 約 施 也 
X37n0660_004:0036a05	若問歸戒即開聖行等者。戒即戒聖行為戒故也。歸	若 問 歸 戒 即 開 聖 行 等 者 戒 即 戒 聖 行 為 戒 故 也 歸 
X37n0660_004:0036a06	即嬰兒人天之善。如下文木牛木馬黃葉等譬。故屬	即 嬰 兒 人 天 之 善 如 下 文 木 牛 木 馬 黃 葉 等 譬 故 屬 
X37n0660_004:0036a07	於歸。	於 歸 
X37n0660_004:0036a08	歸戒所妨即開病行者。病是惡故。惡是所防。戒為能	歸 戒 所 妨 即 開 病 行 者 病 是 惡 故 惡 是 所 防 戒 為 能 
X37n0660_004:0036a09	防。故約行也。	防 故 約 行 也 
X37n0660_004:0036a10	莊嚴無量者。約涅槃義。即是戒定慧等以為能嚴。涅	莊 嚴 無 量 者 約 涅 槃 義 即 是 戒 定 慧 等 以 為 能 嚴 涅 
X37n0660_004:0036a11	槃城以為所嚴。能嚴所嚴他用無盡。故云無量也。	槃 城 以 為 所 嚴 能 嚴 所 嚴 他 用 無 盡 故 云 無 量 也 
X37n0660_004:0036a12	無可問處者。約極理說也。	無 可 問 處 者 約 極 理 說 也 
X37n0660_004:0036a13	問辨即樂莊嚴者。多聞分別樂也。	問 辨 即 樂 莊 嚴 者 多 聞 分 別 樂 也 
X37n0660_004:0036a14	問歸即我莊嚴者。番除邪我。即是真我也。	問 歸 即 我 莊 嚴 者 番 除 邪 我 即 是 真 我 也 
X37n0660_004:0036a15	四如來施主下約用。	四 如 來 施 主 下 約 用 
X37n0660_004:0036a16	即用常命攝惡者。命者是戒。既持戒不殺即得命也。	即 用 常 命 攝 惡 者 命 者 是 戒 既 持 戒 不 殺 即 得 命 也 
