X37n0660_006:0065c21	法華壽量品本行菩薩道即是其因。故云多也。	法 華 壽 量 品 本 行菩薩道 即 是 其 因 故 云 多 也 
X37n0660_006:0065c22	僧是因人者。依佛修行故也。	僧 是 因 人 者 依 佛 修 行 故 也 
X37n0660_006:0065c23	如四非常者。只是無常苦空無我等四也。	如 四 非 常 者 只 是 無 常 苦 空 無 我 等 四 也 
X37n0660_006:0065c24	於一無常即備四義者。謂常無常亦常亦無常非常	於 一 無 常 即 備 四 義 者 謂 常 無 常 亦 常 亦 無 常 非 常 
X37n0660_006:0066a01	非無常等。亦是空有四門之義也。	非 無 常 等 亦 是 空 有 四 門 之 義 也 
X37n0660_006:0066a02	其意下注云云者。四教意也。	其 意 下 注 云 云 者 四 教 意 也 
X37n0660_006:0066a03	此與四教義合者。佛說生滅即藏教。即不生滅是通	此 與 四 教 義 合 者 佛 說 生 滅 即 藏 教 即 不 生 滅 是 通 
X37n0660_006:0066a04	教。亦生亦不滅即別教。別教地前亦生滅初地不生	教 亦 生 亦 不 滅 即 別 教 別 教 地 前 亦 生 滅 初 地 不 生 
X37n0660_006:0066a05	滅。非生滅非不生滅等圓教也。	滅 非 生 滅 非 不 生 滅 等 圓 教 也 
X37n0660_006:0066a06	三者劍四滲槃者。古譯不同。一名四實。前二名。後二	三 者 劍 四 滲 槃 者 古 譯 不 同 一 名 四 實 前 二 名 後 二 
X37n0660_006:0066a07	名別也。	名 別 也 
X37n0660_006:0066a08	初明經威德即法衰者。由僧衰故致令法衰。法由人	初 明 經 威 德 即 法 衰 者 由 僧 衰 故 致 令 法 衰 法 由 人 
X37n0660_006:0066a09	弘故也。	弘 故 也 
X37n0660_006:0066a10	得好弟子者。如弟如子。傳如來教如佛所行。名之為	得 好 弟 子 者 如 弟 如 子 傳 如 來 教 如 佛 所 行 名 之 為 
X37n0660_006:0066a11	好也。	好 也 
X37n0660_006:0066a12	成八斛一斗者。一斛一石即八石一斗。以四度加之	成 八 斛 一 斗 者 一 斛 一 石 即 八 石 一 斗 以 四 度 加 之 
X37n0660_006:0066a13	故也。	故 也 
X37n0660_006:0066a14	合譬有七句者。牧女四度添水為四。五譬受學者六	合 譬 有 七 句 者 牧 女 四 度 添 水 為 四 五 譬 受 學 者 六 
X37n0660_006:0066a15	譬弘經者。七譬聽法人猶勝小乘。故云千倍也。	譬 弘 經 者 七 譬 聽 法 人 猶 勝 小 乘 故 云 千 倍 也 
X37n0660_006:0066a16	後正譬弘法之人者與牧女譬弘經者。何別答。牧女	後 正 譬 弘 法 之 人 者 與 牧 女 譬 弘 經 者 何 別 答 牧 女 
X37n0660_006:0066a17	譬添譯。弘法譬求利。	譬 添 譯 弘 法 譬 求 利 
X37n0660_006:0066a18	婦譬常境者。境能生解故也。	婦 譬 常 境 者 境 能 生 解 故 也 
X37n0660_006:0066a19	餘知見譬賓客者。一實之外權法為餘也。	餘 知 見 譬 賓 客 者 一 實 之 外 權 法 為 餘 也 
X37n0660_006:0066a20	方便功用者。縛為人說也。	方 便 功 用 者 縛 為 人 說 也 
X37n0660_006:0066a21	智者以能被緣合者。所被約佛唯說真。乳能被約機。	智 者 以 能 被 緣 合 者 所 被 約 佛 唯 說 真 乳 能 被 約 機 
X37n0660_006:0066a22	二諦不同也。	二 諦 不 同 也 
X37n0660_006:0066a23	經云著後者。著字(中怒反)鄭玄著之言處也。廣雅補也。	經 云 著 後 者 著 字 中 怒 反 鄭 玄 著 之 言 處 也 廣 雅 補 也 
X37n0660_006:0066a24	亦立又音知略反非今所用也。	亦 立 又 音 知 略 反 非 今 所 用 也 
X37n0660_006:0066b01	應有四句者。一男子。男子不知佛性即是女人。二知	應 有 四 句 者 一 男 子 男 子 不 知 佛 性 即 是 女 人 二 知 
X37n0660_006:0066b02	佛性即是丈夫。三女人。女人若知佛性即是男子。四	佛 性 即 是 丈 夫 三 女 人 女 人 若 知 佛 性 即 是 男 子 四 
X37n0660_006:0066b03	不知佛性名為女人。經中男子女人各得一句耳。	不 知 佛 性 名 為 女 人 經 中 男 子 女 人 各 得 一 句 耳 
X37n0660_006:0066b04	經云我不隨順世間法也者。世間之法。即出世涅槃	經 云 我 不 隨順世間 法 也 者 世 間 之 法 即 出 世 涅 槃 
X37n0660_006:0066b05	之法也。	之 法 也 
X37n0660_006:0066b06	沒地者。末法漸減邪見轉增。佛法漸盡。故云沒也。	沒 地 者 末 法 漸 減 邪 見 轉 增 佛 法 漸 盡 故 云 沒 也 
X37n0660_006:0066b07	初釋偈疑兼遣上問者。若更開云何樂未生而能受	初 釋 偈 疑 兼 遣 上 問 者 若 更 開 云 何 樂 未 生 而 能 受 
X37n0660_006:0066b08	樂。兼答第九問也。引偈釋純陀之疑。遣迦葉之問。三	樂 兼 答 第 九 問 也 引 偈 釋 純 陀 之 疑 遣 迦 葉 之 問 三 
X37n0660_006:0066b09	乘若無性等也。	乘 若 無 性 等 也 
X37n0660_006:0066b10	差別即無差別者。三乘名差。一乘即無差也。	差 別 即 無 差 別 者 三 乘 名 差 一 乘 即 無 差 也 
X37n0660_006:0066b11	懸與理同者。與今差即無差。一乘理同也。	懸 與 理 同 者 與 今 差 即 無 差 一 乘 理 同 也 
X37n0660_006:0066b12	中根於迦葉問中悟者。上文三十四問中悟也。	中 根 於 迦 葉 問 中 悟 者 上 文 三 十 四 問 中 悟 也 
X37n0660_006:0066b13	文殊更為騰疑者。如經猶有疑心等。前文如來已答	文 殊 更 為 騰 疑 者 如 經 猶 有 疑 心 等 前 文 如 來 已 答 
X37n0660_006:0066b14	常身法身竟。今更騰疑。故云猶有也。	常 身 法 身 竟 今 更 騰 疑 故 云 猶 有 也 
X37n0660_006:0066b15	經云諸佛菩薩乃至無有差別者。意難如來今得於	經 云 諸佛菩薩 乃 至 無有差別 者 意 難 如 來 今 得 於 
X37n0660_006:0066b16	常。還同世間悉是無常。與此三乘有何差別。同無常	常 還 同 世 間 悉 是 無 常 與 此 三 乘 有何差別 同 無 常 
X37n0660_006:0066b17	也。	也 
X37n0660_006:0066b18	經云亦有差別亦無差別者。佛答意昔日無常即有	經 云 亦 有 差 別 亦 無 差 別 者 佛 答 意 昔 日 無 常 即 有 
X37n0660_006:0066b19	差別。今日聞常即無差別。差即無差無差即差。亦非	差 別 今 日 聞 常 即 無 差 別 差 即 無 差 無 差 即 差 亦 非 
X37n0660_006:0066b20	差非無差。三世有法無有是處。若有差別三世有法	差 非 無 差 三 世 有 法 無 有 是 處 若 有 差 別 三 世 有 法 
X37n0660_006:0066b21	無有是處也。	無 有 是 處 也 
X37n0660_006:0066b22	此一偈凡四出者。此是斯經之宗極。釋義之指歸。自	此 一 偈 凡 四 出 者 此 是 斯 經 之 宗 極 釋 義 之 指 歸 自 
X37n0660_006:0066b23	古名為涅槃四柱。若一不當涅槃室傾也。偈本有今	古 名 為 涅 槃 四 柱 若 一 不 當 涅 槃 室 傾 也 偈 本 有 今 
X37n0660_006:0066b24	無本無今有者。只是本有今有。本無今無何者。本有	無 本無今有 者 只 是 本 有 今 有 本 無 今 無 何 者 本 有 
X37n0660_006:0066c01	煩惱。今有涅槃。本無涅槃。今無煩惱。三世有法差。即	煩 惱 今 有 涅 槃 本 無 涅 槃 今 無 煩 惱 三 世 有 法 差 即 
X37n0660_006:0066c02	無有是處。無差即差。斯有是處。即是差別。因果非因	無 有 是 處 無 差 即 差 斯 有 是 處 即 是 差 別 因 果 非 因 
X37n0660_006:0066c03	非果。皆例此也。	非 果 皆 例 此 也 
X37n0660_006:0066c04	亦為下品三根者。上根此品。中根次下二品。下根至	亦 為 下 品 三 根 者 上 根 此 品 中 根 次 下 二 品 下 根 至 
X37n0660_006:0066c05	四品也。	四 品 也 
X37n0660_006:0066c06	而今無者。今以常故無無常也。	而 今 無 者 今 以 常 故 無 無 常 也 
X37n0660_006:0066c07	而今有者。有金剛後心常也。	而 今 有 者 有 金 剛 後 心 常 也 
X37n0660_006:0066c08	是純陀所疑非關偈意者。今斥昔是常今得於常。常	是 純 陀 所 疑 非 關 偈 意 者 今 斥 昔 是 常 今 得 於 常 常 
X37n0660_006:0066c09	即無常。正當其疑。偈意本明於常開。昔無常上半本	即 無 常 正 當 其 疑 偈 意 本 明 於 常 開 昔 無 常 上 半 本 
X37n0660_006:0066c10	有。今無無常即常下半。本無今有差即無差。乃同偈	有 今 無 無 常 即 常 下 半 本無今有 差 即 無 差 乃 同 偈 
X37n0660_006:0066c11	意也。	意 也 
X37n0660_006:0066c12	復云上半不異前者。同前金剛心前釋。	復 云 上 半 不 異 前 者 同 前 金 剛 心 前 釋 
X37n0660_006:0066c13	而言三乘人同入等者。此通教意也。	而 言 三 乘 人 同 入 等 者 此 通 教 意 也 
X37n0660_006:0066c14	地人云常非是始得等者。此計梨耶有清清之識。此	地 人 云 常 非 是 始 得 等 者 此 計 梨 耶 有 清 清 之 識 此 
X37n0660_006:0066c15	識含藏。具一切法也。	識 含 藏 具 一 切 法 也 
X37n0660_006:0066c16	亦應顯已還隱者。即同文殊。難意謂得常已後。還是	亦 應 顯 已 還 隱 者 即 同 文 殊 難 意 謂 得 常 已 後 還 是 
X37n0660_006:0066c17	無常也。	無 常 也 
X37n0660_006:0066c18	亦應隱而不顯者。無常與常不相即故。還同三世攝	亦 應 隱 而 不 顯 者 無 常 與 常 不 相 即 故 還 同 三 世 攝 
X37n0660_006:0066c19	也。	也 
X37n0660_006:0066c20	三藏師云者。真諦三藏釋也。	三 藏 師 云 者 真 諦 三 藏 釋 也 
X37n0660_006:0066c21	還同地人者。本隱今顯同也。	還 同 地 人 者 本 隱 今 顯 同 也 
X37n0660_006:0066c22	惑滅道存者。煩惱有始名之惑滅。涅槃無終名為道	惑 滅 道 存 者 煩 惱 有 始 名 之 惑 滅 涅 槃 無 終 名 為 道 
X37n0660_006:0066c23	存也。	存 也 
X37n0660_006:0066c24	昔於一為三今只三為一者。三是一家之三。於一佛	昔 於 一 為 三 今 只 三 為 一 者 三 是 一 家 之 三 於 一 佛 
X37n0660_006:0067a01	乘分別說三等。如棒間成指也。一是三家之一者。如	乘 分 別 說 三 等 如 棒 間 成 指 也 一 是 三 家 之 一 者 如 
X37n0660_006:0067a02	攬指成拳也。	攬 指 成 拳 也 
X37n0660_006:0067a03	而今無者。是昔日之今也。	而 今 無 者 是 昔 日 之 今 也 
X37n0660_006:0067a04	則本無而今有者。今日有一乘也。	則 本 無 而 今 有 者 今 日 有 一 乘 也 
X37n0660_006:0067a05	亦是現在過去者。本有今無也。	亦 是 現 在 過 去 者 本 有 今 無 也 
X37n0660_006:0067a06	現在未來者。本無今有也。	現在未來 者 本無今有 也 
X37n0660_006:0067a07	至論佛性乃至今本者。三世有法無有是處。却釋上	至 論 佛 性 乃 至 今 本 者 三 世 有 法 無 有 是 處 却 釋 上 
X37n0660_006:0067a08	半。故云今本也。	半 故 云 今 本 也 
X37n0660_006:0067a09	無常常者。無常即常。常即無常。非常非無常等。三世	無 常 常 者 無 常 即 常 常 即 無 常 非常非無常 等 三 世 
X37n0660_006:0067a10	有法無有是處也。	有 法 無 有 是 處 也 
X37n0660_006:0067a11	又云本有只是有者。本有只是今有何者。差即無差故。	又 云 本 有 只 是 有 者 本 有 只 是 今 有 何 者 差 即 無 差 故 
X37n0660_006:0067a12	今無只是無者。今無只是本無何者。今無三乘。即是	今 無 只 是 無 者 今 無 只 是 本 無 何 者 今 無 三 乘 即 是 
X37n0660_006:0067a13	本無一乘。故又本不有今不無者不有非有不無非	本 無 一 乘 故 又 本 不 有 今 不 無 者 不 有 非 有 不 無 非 
X37n0660_006:0067a14	無。三世有法無有是處故也。	無 三 世 有 法 無 有 是 處 故 也 
X37n0660_006:0067a15	如是展轉不得相離者。隨一一句。皆約三諦。一諦融	如 是 展 轉 不 得 相 離 者 隨 一 一 句 皆 約 三 諦 一 諦 融 
X37n0660_006:0067a16	通。差者相即故也。	通 差 者 相 即 故 也 
X37n0660_006:0067a17	亦是無常即常等者。上已答竟。文殊更騰。故云亦是	亦 是 無 常 即 常 等 者 上 已 答 竟 文 殊 更 騰 故 云 亦 是 
X37n0660_006:0067a18	也。	也 
X37n0660_006:0067a19	雲消氷冶者。今家釋意不同他人。如萬里長氷不過	雲 消 氷 冶 者 今 家 釋 意 不 同 他 人 如 萬 里 長 氷 不 過 
X37n0660_006:0067a20	春常之日自然消冶也。	春 常 之 日 自 然 消 冶 也 
X37n0660_006:0067a21	智悟亦然者。只是境智不二。一智即三智。三智即一	智 悟 亦 然 者 只 是 境 智 不 二 一 智 即 三 智 三 智 即 一 
X37n0660_006:0067a22	智。名之為悟也。	智 名 之 為 悟 也 
X37n0660_006:0067a23	亦有亦無即為人者。亦有生於昔日二乘之事善。亦	亦 有 亦 無 即 為 人 者 亦 有 生 於 昔 日 二 乘 之 事 善 亦 
X37n0660_006:0067a24	無生於今日菩薩之理善也。	無 生 於 今 日 菩 薩 之 理 善 也 
X37n0660_006:0067b01	三世有法乃至第一義者。即非有非無。顯中道也。	三 世 有 法 乃 至 第 一 義 者 即 非有非無 顯 中 道 也 
X37n0660_006:0067b02	今此一悉即具四悉者。圓釋自在。於一句中即世界	今 此 一 悉 即 具 四 悉 者 圓 釋 自 在 於 一 句 中 即 世 界 
X37n0660_006:0067b03	意能生善破惡入理等。餘之三悉例然。	意 能 生 善 破 惡 入 理 等 餘 之 三 悉 例 然 
X37n0660_006:0067b04	本有即有句有門者。有句約法。有門約教。無等亦爾。	本 有 即 有 句 有 門 者 有 句 約 法 有 門 約 教 無 等 亦 爾 
X37n0660_006:0067b05	聲聞緣覺亦有差別者。未悟一乘名為差別。今悟一	聲 聞 緣 覺 亦 有 差 別 者 未 悟 一 乘 名 為 差 別 今 悟 一 
X37n0660_006:0067b06	乘即無差別。	乘 即 無 差 別 
X37n0660_006:0067b07	上三句出所非非除性有性無者。意云本有今無非	上 三 句 出 所 非 非 除 性 有 性 無 者 意 云 本 有 今 無 非 
X37n0660_006:0067b08	除於有。次本無今有非除於無。即非有非無。故云結也	除 於 有 次 本無今有 非 除 於 無 即 非有非無 故 云 結 也 
X37n0660_006:0067b09	此有可令無者。二乘之有令無也。	此 有 可 令 無 者 二 乘 之 有 令 無 也 
X37n0660_006:0067b10	此無可令有者。涅槃妙有也。	此 無 可 令 有 者 涅 槃 妙 有 也 
X37n0660_006:0067b11	此有不有故非有者。非昔三乘之有令無也。	此 有 不 有 故 非 有 者 非 昔 三 乘 之 有 令 無 也 
X37n0660_006:0067b12	此無不無故非無者。今日無三乘之無有。涅槃之有也。	此 無 不 無 故 非 無 者 今 日 無 三 乘 之 無 有 涅 槃 之 有 也 
X37n0660_006:0067b13	即是非今之本者。昔日煩惱之本。非今涅槃之本也。	即 是 非 今 之 本 者 昔 日 煩 惱 之 本 非 今 涅 槃 之 本 也 
X37n0660_006:0067b14	即無本之今者。昔日煩惱有家之本。即是今日涅槃	即 無 本 之 今 者 昔 日 煩 惱 有 家 之 本 即 是 今 日 涅 槃 
X37n0660_006:0067b15	無家之本也。	無 家 之 本 也 
X37n0660_006:0067b16	此今非本即是非本之今者。此今是今日涅槃無家	此 今 非 本 即 是 非 本 之 今 者 此 今 是 今 日 涅 槃 無 家 
X37n0660_006:0067b17	之今。非是昔日有家之今也。	之 今 非 是 昔 日 有 家 之 今 也 
X37n0660_006:0067b18	經云利益安樂一切眾生者。若一切眾生得聞無差	經 云 利益安樂 一 切 眾 生 者 若 一 切 眾 生 得 聞 無 差 
X37n0660_006:0067b19	別義。能令一切眾生皆得涅槃。故云安樂也。	別 義 能 令 一 切 眾 生 皆 得 涅 槃 故 云 安 樂 也 
X37n0660_006:0067b20	尋便驚恠者。譬守護人一往生疑以有信故。能知乳	尋 便 驚 恠 者 譬 守 護 人 一 往 生 疑 以 有 信 故 能 知 乳 
X37n0660_006:0067b21	色也。	色 也 
X37n0660_006:0067b22	眾生業報者。即是同正因之報。令乳一色也。	眾 生 業 報 者 即 是 同 正 因 之 報 令 乳 一 色 也 
X37n0660_006:0067b23	經云同盡漏故者。同得理性涅槃無漏也。	經 云 同 盡 漏 故 者 同 得 理 性 涅 槃 無 漏 也 
X37n0660_006:0067b24	何曾證入者。二乘證入如來常住不變。故云不入也。	何 曾 證 入 者 二 乘 證 入 如 來 常 住 不 變 故 云 不 入 也 
X37n0660_006:0067c01	實同如來一涅槃者。豈有以進三百之路。而不到於	實 同 如 來 一 涅 槃 者 豈 有 以 進 三 百 之 路 而 不 到 於 
X37n0660_006:0067c02	寶所。為懈怠者。說二涅槃耳。	寶 所 為 懈 怠 者 說 二 涅 槃 耳 
X37n0660_006:0067c03	經云涅槃名為善有者。即是本有之性。名之為善。二	經 云 涅 槃 名 為 善 有 者 即 是 本 有 之 性 名 之 為 善 二 
X37n0660_006:0067c04	乘涅槃不名善有也。	乘 涅 槃 不 名 善 有 也 
X37n0660_006:0067c05	而實不爾者。未有如來出世。令二乘人而般涅槃故。	而 實 不 爾 者 未 有 如 來 出 世 令 二 乘 人 而 般 涅 槃 故 
X37n0660_006:0067c06	小般若云我皆令入無餘涅槃。即此義也。	小 般 若 云 我 皆 令 入無餘涅槃 即 此 義 也 
X37n0660_006:0067c07	雙領兩義者。昔日三乘名之為差。今說一乘差即無	雙 領 兩 義 者 昔 日 三 乘 名 之 為 差 今 說 一 乘 差 即 無 
X37n0660_006:0067c08	差同一佛性。故云雙領也。	差 同 一 佛 性 故 云 雙 領 也 
X37n0660_006:0067c09	經云一切眾生性相云何者。性以據內。相以據外。攬	經 云 一 切 眾 生 性 相 云 何 者 性 以 據 內 相 以 據 外 攬 
X37n0660_006:0067c10	而可別眾生之性與三乘性。其相如何。同邪異邪。仍	而 可 別 眾 生 之 性 與 三 乘 性 其 相 如 何 同 邪 異 邪 仍 
X37n0660_006:0067c11	於無差別中作差別。答者其性是同。其相則異。由雜	於 無 差 別 中 作 差 別 答 者 其 性 是 同 其 相 則 異 由 雜 
X37n0660_006:0067c12	煩惱故也。	煩 惱 故 也 
X37n0660_006:0067c13	經云不可俎壞者。由護正法持不煞戒等如上文答。	經 云 不 可 俎 壞 者 由 護 正 法 持 不 煞 戒 等 如 上 文 答 
X37n0660_006:0067c14	得長壽果金剛之身。即其義也。	得 長 壽 果 金 剛 之 身 即 其 義 也 
X37n0660_006:0067c15	口爽即生盲者。不能知味。同不見色邊。三寶屬色故	口 爽 即 生 盲 者 不 能 知 味 同 不 見 色 邊 三 寶 屬 色 故 
X37n0660_006:0067c16	也。	也 
X37n0660_006:0067c17	不識手足者。不識身中一體三實也。	不 識 手 足 者 不 識 身 中 一 體 三 實 也 
X37n0660_006:0067c18	○釋大眾問品第十七	 釋 大 眾 問 品 第 十 七 
X37n0660_006:0067c19	即為大眾所問之境者。謂大眾各對受供化佛為境	即 為 大 眾 所 問 之 境 者 謂 大 眾 各 對 受 供 化 佛 為 境 
X37n0660_006:0067c20	也。	也 
X37n0660_006:0067c21	意在茲品者。觀師意者。謂迦葉問名為大眾問品耳。	意 在 茲 品 者 觀 師 意 者 謂 迦 葉 問 名 為 大 眾 問 品 耳 
X37n0660_006:0067c22	今示涅槃之相者。佛以放光催供表其相也。	今 示 涅 槃 之 相 者 佛 以 放 光 催 供 表 其 相 也 
X37n0660_006:0067c23	從答顯問。即是大眾問如來答也。	從 答 顯 問 即 是 大 眾 問 如 來 答 也 
X37n0660_006:0067c24	及近無上道問者。即是超答此文在無餘問後也。	及 近 無 上 道 問 者 即 是 超 答 此 文 在 無 餘 問 後 也 
X37n0660_006:0068a01	三人天遮者。謂不許獨受純陀供也。	三 人 天 遮 者 謂 不 許 獨 受 純 陀 供 也 
X37n0660_006:0068a02	經云種種器物充滿具足者。豈有純陀八斛粳粮而	經 云 種 種 器 物 充 滿 具 足 者 豈 有 純 陀 八 斛 粳 粮 而 
X37n0660_006:0068a03	能如是。皆是如來不思議力。故云具足耳。	能 如 是 皆 是 如 來 不 思 議 力 故 云 具 足 耳 
X37n0660_006:0068a04	經云大威德諸天者。謂色界諸天也。	經 云 大 威 德 諸 天 者 謂 色界諸天 也 
X37n0660_006:0068a05	經云且止純陀勿使奉施者。是諸天等。謂佛獨受純	經 云 且 止 純 陀 勿 使 奉 施 者 是 諸 天 等 謂 佛 獨 受 純 
X37n0660_006:0068a06	陀供即入涅槃。不受人天。不知如來受純陀供正為	陀 供 即 入 涅 槃 不 受 人 天 不 知 如 來 受 純 陀 供 正 為 
X37n0660_006:0068a07	人天。皆因純陀故也。	人 天 皆 因 純 陀 故 也 
X37n0660_006:0068a08	經云猶如西方安樂國土者。如來借助威力令土清	經 云 猶 如 西 方 安 樂 國 土 者 如 來 借 助 威 力 令 土 清 
X37n0660_006:0068a09	淨也。	淨 也 
X37n0660_006:0068a10	經云時諸比丘等者。即是無供之眾。皆能生物善故。	經 云 時 諸 比 丘 等 者 即 是 無 供 之 眾 皆 能 生 物 善 故 
X37n0660_006:0068a11	受人天供也。	受 人 天 供 也 
X37n0660_006:0068a12	經云所食之物亦無差別者。即是麤非麤妙亦非妙。	經 云 所 食 之 物 亦 無 差 別 者 即 是 麤 非 麤 妙 亦 非 妙 
X37n0660_006:0068a13	皆是不思議如來之力也。	皆 是 不 思 議 如 來 之 力 也 
X37n0660_006:0068a14	經云諸佛法應爾者。機興則興。機謝則謝。皆為汝故。	經 云 諸 佛 法 應 爾 者 機 興 則 興 機 謝 則 謝 皆 為 汝 故 
X37n0660_006:0068a15	何須悲也。	何 須 悲 也 
X37n0660_006:0068a16	已經無量劫者。如法華壽量品說。常在靈鷲山及餘	已 經 無 量 劫 者 如 法 華 壽 量 品 說 常 在 靈 鷲 山 及 餘 
X37n0660_006:0068a17	諸住處等。	諸 住 處 等 
X37n0660_006:0068a18	經云咸得安隱樂者。我以久證涅槃。今為汝等大眾	經 云 咸 得 安 隱 樂 者 我 以 久 證 涅 槃 今 為 汝 等 大 眾 
X37n0660_006:0068a19	咸得涅槃。故云安隱樂也。	咸 得 涅 槃 故 云 安 隱 樂 也 
X37n0660_006:0068a20	此二鳥得共處者。意舉相違之事。令得相順我即涅	此 二 鳥 得 共 處 者 意 舉 相 違 之 事 令 得 相 順 我 即 涅 
X37n0660_006:0068a21	槃。今就相違何得令我入於涅槃。故皆假設假設令	槃 今 就 相 違 何 得 令 我 入 於 涅 槃 故 皆 假 設 假 設 令 
X37n0660_006:0068a22	順如來。亦不入於涅槃視諸眾生。如羅睺等。下諸雙	順 如 來 亦 不 入 於 涅 槃 視 諸 眾 生 如 羅 睺 等 下 諸 雙 
X37n0660_006:0068a23	意。例如來實不涅槃。汝等何故請如來莫入涅槃等	意 例 如 來 實 不 涅 槃 汝 等 何 故 請 如 來 莫 入 涅 槃 等 
X37n0660_006:0068a24	也。	也 
X37n0660_006:0068b01	即法是人等者。只是人法一體三實具足含中之真	即 法 是 人 等 者 只 是 人 法 一 體 三 實 具 足 含 中 之 真 
X37n0660_006:0068b02	諦也。不得以偏真解之。廣如法華玄文。七重二諦中	諦 也 不 得 以 偏 真 解 之 廣 如 法 華 玄 文 七 重 二 諦 中 
X37n0660_006:0068b03	釋也。	釋 也 
X37n0660_006:0068b04	違害法身者。除圓乘外前之三教猶名栴陀羅。若發	違 害 法 身 者 除 圓 乘 外 前 之 三 教 猶 名 栴 陀 羅 若 發 
X37n0660_006:0068b05	圓菩提心人即名羅漢。何者羅漢因人同於圓人。後	圓 菩 提 心 人 即 名 羅 漢 何 者 羅 漢 因 人 同 於 圓 人 後 
X37n0660_006:0068b06	必得故也。	必 得 故 也 
X37n0660_006:0068b07	經云一塵一佛。皆假設之言。若使純陀碎飯如塵供	經 云 一 塵 一 佛 皆 假 設 之 言 若 使 純 陀 碎 飯 如 塵 供 
X37n0660_006:0068b08	佛。亦不能遍。何者意領。皆是如來神力威助。令現斯	佛 亦 不 能 遍 何 者 意 領 皆 是 如來神力 威 助 令 現 斯 
X37n0660_006:0068b09	事耳。	事 耳 
X37n0660_006:0068b10	演說於秘密問者。即是有覆之密。非是大乘之秘。以	演 說 於 秘 密 問 者 即 是 有 覆 之 密 非 是 大 乘 之 秘 以 
X37n0660_006:0068b11	將有餘覆於無餘。故云密也。	將 有 餘 覆 於 無 餘 故 云 密 也 
X37n0660_006:0068b12	非平道顯理者。屈曲隨機覆理之說。名為密也。	非 平 道 顯 理 者 屈 曲 隨 機 覆 理 之 說 名 為 密 也 
X37n0660_006:0068b13	經云一切契經者。即通於大小。皆名契經。小即有餘	經 云 一 切 契 經 者 即 通 於 大 小 皆 名 契 經 小 即 有 餘 
X37n0660_006:0068b14	大即無餘。故云一切也。	大 即 無 餘 故 云 一 切 也 
X37n0660_006:0068b15	得近無上道兼答兩問等者。即是最後之問。今逐文	得 近 無 上 道 兼 答 兩 問 等 者 即 是 最 後 之 問 今 逐 文 
X37n0660_006:0068b16	便以超答之。故云兼也。	便 以 超 答 之 故 云 兼 也 
X37n0660_006:0068b17	三釋取意者。雖是罪人有可取之義故云意也。	三 釋 取 意 者 雖 是 罪 人 有 可 取 之 義 故 云 意 也 
X37n0660_006:0068b18	破戒及慳云何可讚者。破即三種病人。慳即是持戒	破 戒 及 慳 云 何 可 讚 者 破 即 三 種 病 人 慳 即 是 持 戒 
X37n0660_006:0068b19	人也。	人 也 
X37n0660_006:0068b20	經云所說破戒者。即是通也。三種病人且據闡提未	經 云 所 說 破 戒 者 即 是 通 也 三 種 病 人 且 據 闡 提 未 
X37n0660_006:0068b21	曾發心。故以簡之也。	曾 發 心 故 以 簡 之 也 
X37n0660_006:0068b22	經云其餘在所者。即是三種病通說四眾等也。	經 云 其 餘 在 所 者 即 是 三 種 病 通 說 四 眾 等 也 
X37n0660_006:0068b23	而亦趣向等者。且取言謗之邊。汝心猶未但是闡提	而 亦 趣 向 等 者 且 取 言 謗 之 邊 汝 心 猶 未 但 是 闡 提 
X37n0660_006:0068b24	之萌漸。故云趣向之道也。	之 萌 漸 故 云 趣 向 之 道 也 
X37n0660_006:0068c01	經云無佛法眾者。即是撥無因果不信三寶也。	經 云 無 佛 法 眾 者 即 是 撥無因果 不 信 三 寶 也 
