X37n0660_009:0098b12	者一體之上從始至終以為一周。如法華中為三根	者 一 體 之 上 從始至終 以 為 一 周 如 法 華 中 為 三 根 
X37n0660_009:0098b13	人三度而說。豈同十德。名義各別。故云異也。	人 三 度 而 說 豈 同 十 德 名 義 各 別 故 云 異 也 
X37n0660_009:0098b14	經云所不聞者而能得聞者。即是初地已上二地功	經 云 所 不 聞 者 而 能 得 聞 者 即 是 初 地 已 上 二 地 功 
X37n0660_009:0098b15	德為得聞也。	德 為 得 聞 也 
X37n0660_009:0098b16	初一聞慧者。他人意意見有聞字便作聞思釋之。今	初 一 聞 慧 者 他 人 意 意 見 有 聞 字 便 作 聞 思 釋 之 今 
X37n0660_009:0098b17	約證說。更作三慧釋之。如下廣破也。	約 證 說 更 作 三 慧 釋 之 如 下 廣 破 也 
X37n0660_009:0098b18	中間二是聞思功用者。謂見有能斷慧心之言。故云	中 間 二 是 聞 思 功 用 者 謂 見 有 能 斷 慧 心 之 言 故 云 
X37n0660_009:0098b19	用也。	用 也 
X37n0660_009:0098b20	初一是本者。意謂一切功德皆從聞得。故云本也。	初 一 是 本 者 意 謂 一切功德 皆 從 聞 得 故 云 本 也 
X37n0660_009:0098b21	尚不得以別真道釋者。意斥他人且作與奪。奪而言	尚 不 得 以 別 真 道 釋 者 意 斥 他 人 且 作 與 奪 奪 而 言 
X37n0660_009:0098b22	之。別教初地猶名功用。不與圓同與而言之。證道同	之 別 教 初 地 猶 名 功 用 不 與 圓 同 與 而 言 之 證 道 同 
X37n0660_009:0098b23	耳。故云不得真道釋也。	耳 故 云 不 得 真 道 釋 也 
X37n0660_009:0098b24	文明證得而作修解等者。今引十文。廣破他釋。作聞	文 明 證 得 而 作 修 解 等 者 今 引 十 文 廣 破 他 釋 作 聞 
X37n0660_009:0098c01	思修等。淺深不同故也。	思 修 等 淺 深 不 同 故 也 
X37n0660_009:0098c02	而作共解者。聞思等三共三乘故。	而 作 共 解 者 聞 思 等 三 共 三 乘 故 
X37n0660_009:0098c03	從他聞解者。謂從地前方便位聞故也。	從 他 聞 解 者 謂 從 地 前 方 便 位 聞 故 也 
X37n0660_009:0098c04	作思議解者。謂從地前偏真而說也。	作 思 議 解 者 謂 從 地 前 偏 真 而 說 也 
X37n0660_009:0098c05	作顯露解者。地前聞思說皆顯露故也。	作 顯 露 解 者 地 前 聞 思 說 皆 顯 露 故 也 
X37n0660_009:0098c06	作尋常解者。聞思等語小乘常談也。	作 尋 常 解 者 聞 思 等 語 小 乘 常 談 也 
X37n0660_009:0098c07	作差別解者。不聞聞等差別不故也。	作 差 別 解 者 不 聞 聞 等 差 別 不 故 也 
X37n0660_009:0098c08	作邊窮解者。前方便教。皆約二邊而有窮盡故也。	作 邊 窮 解 者 前 方 便 教 皆 約 二 邊 而 有 窮 盡 故 也 
X37n0660_009:0098c09	若依文者者。文謂現文五事之說。自免諸過也。	若 依 文 者 者 文 謂 現 文 五 事 之 說 自 免 諸 過 也 
X37n0660_009:0098c10	私諮下是先師重述經恐學者。逐語生迷故以出其	私 諮 下 是 先 師 重 述 經 恐 學 者 逐 語 生 迷 故 以 出 其 
X37n0660_009:0098c11	文旨。猶參因相正在證位。以因聞故文猶監因。若知	文 旨 猶 參 因 相 正 在 證 位 以 因 聞 故 文 猶 監 因 若 知 
X37n0660_009:0098c12	果上修因於理無失故也。	果 上 修 因 於 理 無 失 故 也 
X37n0660_009:0098c13	初既多立果名者。第一功德五名同是證得。故云果	初 既 多 立 果 名 者 第 一 功 德 五 名 同 是 證 得 故 云 果 
X37n0660_009:0098c14	也。	也 
X37n0660_009:0098c15	章安置多少之言者。如前料簡五行證少十德證多	章 安 置 多 少 之 言 者 如 前 料 簡 五 行 證 少 十 德 證 多 
X37n0660_009:0098c16	五行約修故云果少。十功約證故果多。二文中皆有	五 行 約 修 故 云 果 少 十 功 約 證 故 果 多 二 文 中 皆 有 
X37n0660_009:0098c17	修證。故以多少言之。故云意亦如是也。	修 證 故 以 多 少 言 之 故 云 意 亦 如 是 也 
X37n0660_009:0098c18	細尋九句之文者。下九功德皆約修證也。	細 尋 九 句 之 文 者 下 九 功 德 皆 約 修 證 也 
X37n0660_009:0098c19	若尋文取義等者。文若是證義。須依文義。若是圓文	若 尋 文 取 義 等 者 文 若 是 證 義 須 依 文 義 若 是 圓 文 
X37n0660_009:0098c20	隨義釋。故云判文也。細像者。不實之貌也。	隨 義 釋 故 云 判 文 也 細 像 者 不 實 之 貌 也 
X37n0660_009:0098c21	妙悟發解者。即是證初地。後功德自然而發。不由他	妙 悟 發 解 者 即 是 證 初 地 後 功 德 自 然 而 發 不 由 他 
X37n0660_009:0098c22	悟名之為妙。法界依正塵剎互冥。菩薩於茲得自在	悟 名 之 為 妙 法 界 依 正 塵 剎 互 冥 菩 薩 於 茲 得 自 在 
X37n0660_009:0098c23	用也。若從他聞下。略斥他人所解也。	用 也 若 從 他 聞 下 略 斥 他 人 所 解 也 
X37n0660_009:0098c24	三諦三法等者。諦謂諦境。法是境上。所觀之法也。	三 諦 三 法 等 者 諦 謂 諦 境 法 是 境 上 所 觀 之 法 也 
X37n0660_009:0099a01	亦不證俗者。此不思議俗二乘不知故也。	亦 不 證 俗 者 此 不 思 議 俗 二 乘 不 知 故 也 
X37n0660_009:0099a02	不知真之秘藏者。此真全是畢竟空體。故名為密也。	不 知 真 之 秘 藏 者 此 真 全 是 畢 竟 空 體 故 名 為 密 也 
X37n0660_009:0099a03	正歎於此者。歎此界聞聞等。具於三體五法也。	正 歎 於 此 者 歎 此 界 聞 聞 等 具 於 三 體 五 法 也 
X37n0660_009:0099a04	經云三寶性相者。三寶之性即是一體三寶之相。即	經 云 三 寶 性 相 者 三 寶 之 性 即 是 一 體 三 寶 之 相 即 
X37n0660_009:0099a05	是別體。故云性相也。	是 別 體 故 云 性 相 也 
X37n0660_009:0099a06	如來涅槃者。如來約來即不來而來。涅槃約去即不	如 來 涅 槃 者 如 來 約 來 即 不 來 而 來 涅 槃 約 去 即 不 
X37n0660_009:0099a07	去而去。來無其始。去無其終。故云常住無變也。	去 而 去 來 無 其 始 去 無 其 終 故 云 常 住 無 變 也 
X37n0660_009:0099a08	經云非有非無等者。此約真俗釋雙非顯於中道也。	經 云 非有非無 等 者 此 約 真 俗 釋 雙 非 顯 於 中 道 也 
X37n0660_009:0099a09	非有為無為下約二諦釋。非有漏無漏下約四	非 有 為 無 為 下 約 二 諦 釋 非 有漏無漏 下 約 四 
X37n0660_009:0099a10	諦釋。非色不色下約五陰釋。不色是心即是四陰	諦 釋 非 色 不 色 下 約 五 陰 釋 不 色 是 心 即 是 四 陰 
X37n0660_009:0099a11	也。非名不名下約假實釋也。非相非不相下約	也 非 名 不 名 下 約 假 實 釋 也 非 相 非 不 相 下 約 
X37n0660_009:0099a12	四相釋。不為四相所遷。故言非也。有非不有下約	四 相 釋 不 為 四 相 所 遷 故 言 非 也 有 非 不 有 下 約 
X37n0660_009:0099a13	三有釋。亦是二十五有不同也。非物非不物下約	三 有 釋 亦 是 二十五有 不 同 也 非 物 非 不 物 下 約 
X37n0660_009:0099a14	空有釋。非物即空物謂諸塵是有也。非因非果下	空 有 釋 非 物 即 空 物 謂 諸 塵 是 有 也 非 因 非 果 下 
X37n0660_009:0099a15	約世出世釋。因即世間果即出世間也。非待非不	約 世 出 世 釋 因 即 世 間 果 即 出 世 間 也 非 待 非 不 
X37n0660_009:0099a16	待下終相待釋。以俗待真雙非即是絕待也。非明	待 下 終 相 待 釋 以 俗 待 真 雙 非 即 是 絕 待 也 非 明 
X37n0660_009:0099a17	非闇下約愚智釋。非出非不出下約三界釋。非	非 闇 下 約 愚 智 釋 非 出 非 不 出 下 約 三 界 釋 非 
X37n0660_009:0099a18	常非不常下約凡聖釋。凡夫謂無常聖人是常也。	常 非 不 常 下 約 凡 聖 釋 凡 夫 謂 無 常 聖 人 是 常 也 
X37n0660_009:0099a19	非斷非不斷下約凡小釋。非始非終下約生死釋。	非 斷 非 不 斷 下 約 凡 小 釋 非 始 非 終 下 約 生 死 釋 
X37n0660_009:0099a20	非過去下約三世釋。乃至十二日緣等。皆約中道。深	非 過 去 下 約 三 世 釋 乃 至 十 二 日 緣 等 皆 約 中 道 深 
X37n0660_009:0099a21	觀三道。即是三德故也。	觀 三 道 即 是 三 德 故 也 
X37n0660_009:0099a22	餘亦如是者。不聞聞一句既二十句釋。無非中道下	餘 亦 如 是 者 不 聞 聞 一 句 既 二 十 句 釋 無 非 中 道 下 
X37n0660_009:0099a23	之四法。乃至九種功德。皆是中道故也。	之 四 法 乃 至 九 種 功 德 皆 是 中 道 故 也 
X37n0660_009:0099a24	經云如是等經者。一切外道經書來至。今經皆是秘	經 云 如 是 等 經 者 一 切 外 道 經 書 來 至 今 經 皆 是 秘 
X37n0660_009:0099b01	密之義也。	密 之 義 也 
X37n0660_009:0099b02	經云除毗佛略者。真諦小乘除方廣大乘故也。	經 云 除 毗 佛 略 者 真 諦 小 乘 除 方 廣 大 乘 故 也 
X37n0660_009:0099b03	非是思慧之益者。略斥他人三慧消文。故云非也。	非 是 思 慧 之 益 者 略 斥 他 人 三 慧 消 文 故 云 非 也 
X37n0660_009:0099b04	先提緣由者。聽受為緣。真為由故也。	先 提 緣 由 者 聽 受 為 緣 真 為 由 故 也 
X37n0660_009:0099b05	經具知一切乃至甚深義味者。謂開權顯實世間文	經 具 知 一 切 乃 至 甚 深 義 味 者 謂 開 權 顯 實 世 間 文 
X37n0660_009:0099b06	字無不甚深也。	字 無 不 甚 深 也 
X37n0660_009:0099b07	假智照事者。化他之行如炬照物自了了他。功歸於	假 智 照 事 者 化 他 之 行 如 炬 照 物 自 了 了 他 功 歸 於 
X37n0660_009:0099b08	己。亦復如是也。	己 亦復如是 也 
X37n0660_009:0099b09	令人易解者。大論云。三智實在一心中得令易解。故	令 人 易 解 者 大 論 云 三 智 實 在 一 心 中 得 令 易 解 故 
X37n0660_009:0099b10	分對三人耳。	分 對 三 人 耳 
X37n0660_009:0099b11	是廣明利益者。以明四法望前為廣。今此四法有其	是 廣 明 利 益 者 以 明 四 法 望 前 為 廣 今 此 四 法 有 其 
X37n0660_009:0099b12	二種四法。先約四法。後將四法轉釋。還成於四故也。	二 種 四 法 先 約 四 法 後 將 四 法 轉 釋 還 成 於 四 故 也 
X37n0660_009:0099b13	經二乘人遠見佛道。謂開權顯實汝等所行是菩薩	經 二 乘 人 遠 見 佛 道 謂 開 權 顯 實 汝 等 所 行 是 菩 薩 
X37n0660_009:0099b14	道等也。	道 等 也 
X37n0660_009:0099b15	疑是外論者。論謂往復折微令疑得斷。斷即是離故	疑 是 外 論 者 論 謂 往 復 折 微 令 疑 得 斷 斷 即 是 離 故 
X37n0660_009:0099b16	云離也。	云 離 也 
X37n0660_009:0099b17	明生闇滅者。前約明生。後約闇滅。亦是智斷。前後互	明 生 闇 滅 者 前 約 明 生 後 約 闇 滅 亦 是 智 斷 前 後 互 
X37n0660_009:0099b18	論故也。	論 故 也 
X37n0660_009:0099b19	將三單對一雙者。謂常無常為一雙。三單即是樂淨	將 三 單 對 一 雙 者 謂 常 無 常 為 一 雙 三 單 即 是 樂 淨 
X37n0660_009:0099b20	我等。具足應云無樂不淨無我等三即成八倒。故云	我 等 具 足 應 云 無 樂 不 淨 無 我 等 三 即 成 八 倒 故 云 
X37n0660_009:0099b21	文略也。	文 略 也 
X37n0660_009:0099b22	涅槃四倒總別之殊者。前明定涅槃不此是總名。後	涅 槃 四 倒 總 別 之 殊 者 前 明 定 涅 槃 不 此 是 總 名 後 
X37n0660_009:0099b23	云是常住不別名四倒故也。	云 是 常 住 不 別 名 四 倒 故 也 
X37n0660_009:0099b24	今但互現者。如經但云。眾生有佛性不云三乘。三乘	今 但 互 現 者 如 經 但 云 眾 生 有 佛 性 不 云 三 乘 三 乘 
X37n0660_009:0099c01	佛與眾生同。故云互耳。	佛 與 眾 生 同 故 云 互 耳 
X37n0660_009:0099c02	經云若命非命等者。約十六知見命。即是見我人眾	經 云 若 命 非 命 等 者 約 十 六 知 見 命 即 是 見 我 人 眾 
X37n0660_009:0099c03	生壽者等也。	生 壽 者 等 也 
X37n0660_009:0099c04	十二因緣輪轉無際者。謂過去無明。復由未來現在。	十二因緣 輪 轉 無 際 者 謂 過 去 無 明 復 由 未來現在 
X37n0660_009:0099c05	故云無際也。	故 云 無 際 也 
X37n0660_009:0099c06	無明一念者。故起信論云。一念無明迷真之始。故云	無 明 一 念 者 故 起 信 論 云 一 念 無 明 迷 真 之 始 故 云 
X37n0660_009:0099c07	其始也。	其 始 也 
X37n0660_009:0099c08	即便得離者。謂離界內外之疑也。	即 便 得 離 者 謂 離 界 內 外 之 疑 也 
X37n0660_009:0099c09	經云一切眾生悉有佛性者。從此已下不簡闡提。但	經 云 一 切 眾 生 悉 有 佛 性 者 從 此 已 下 不 簡 闡 提 但 
X37n0660_009:0099c10	令迴心皆得菩提。有佛性故也。	令 迴 心 皆 得 菩 提 有 佛 性 故 也 
X37n0660_009:0099c11	寄無而言有者。一切諸法猶如幻化。但有其名而無	寄 無 而 言 有 者 一切諸法 猶 如 幻 化 但 有 其 名 而 無 
X37n0660_009:0099c12	有實。由如病者見於空華。但除其病不用除華。故云	有 實 由 如 病 者 見 於 空 華 但 除 其 病 不 用 除 華 故 云 
X37n0660_009:0099c13	無也。	無 也 
X37n0660_009:0099c14	寄有而言無者。雖諸法皆從緣生而無實體。善惡之	寄 有 而 言 無 者 雖 諸 法 皆 從 緣 生 而 無 實 體 善 惡 之 
X37n0660_009:0099c15	業亦不敗亡。故云有也。	業 亦 不 敗 亡 故 云 有 也 
X37n0660_009:0099c16	寄非有非無而言有無等者。重釋上二約有約無皆	寄 非有非無 而 言 有 無 等 者 重 釋 上 二 約 有 約 無 皆 
X37n0660_009:0099c17	具三諦。不思議之有無也。	具 三 諦 不 思 議 之 有 無 也 
X37n0660_009:0099c18	不可思議不可思議復不可思議玄而復玄等者。一	不可思議 不可思議 復 不可思議 玄 而 復 玄 等 者 一 
X37n0660_009:0099c19	不思議約上來不聞聞等。言語道斷名為一玄。二不	不 思 議 約 上 來 不 聞 聞 等 言語道斷 名 為 一 玄 二 不 
X37n0660_009:0099c20	可思議約其五法心行處滅。三復不可思議約於現	可 思 議 約 其 五 法 心行處滅 三 復 不可思議 約 於 現 
X37n0660_009:0099c21	方而四論秘密。故云復玄。重重三諦重重涅槃重重	方 而 四 論 秘 密 故 云 復 玄 重 重 三 諦 重 重 涅 槃 重 重 
X37n0660_009:0099c22	依正皆不可說故著。復言若非一圓家用義消文。十	依 正 皆 不 可 說 故 著 復 言 若 非 一 圓 家 用 義 消 文 十 
X37n0660_009:0099c23	德之證還同他見耳。	德 之 證 還 同 他 見 耳 
X37n0660_009:0099c24	初領旨抑非者。謂領不聞聞等義名之為旨。其義未	初 領 旨 抑 非 者 謂 領 不 聞 聞 等 義 名 之 為 旨 其 義 未 
X37n0660_009:0100a01	了故以立非難。亦是為末代示同不解也。	了 故 以 立 非 難 亦 是 為 末 代 示 同 不 解 也 
X37n0660_009:0100a02	初文奪分便成兩者。如經法若有者即是其聞法。若	初 文 奪 分 便 成 兩 者 如 經 法 若 有 者 即 是 其 聞 法 若 
X37n0660_009:0100a03	無者即是不聞。世尊何故說聞不聞也。	無 者 即 是 不 聞 世 尊 何 故 說 聞 不 聞 也 
X37n0660_009:0100a04	遮生滅不得作一者。恐轉無是有轉有是無只是一	遮 生 滅 不 得 作 一 者 恐 轉 無 是 有 轉 有 是 無 只 是 一 
X37n0660_009:0100a05	體。故以遮之也。	體 故 以 遮 之 也 
X37n0660_009:0100a06	結定不應一者。如經聞所不聞正是二云何是一也。	結 定 不 應 一 者 如 經 聞 所 不 聞 正 是 二 云 何 是 一 也 
X37n0660_009:0100a07	至是住相者。轉釋聞即是住。去既未到者。轉釋不聞	至 是 住 相 者 轉 釋 聞 即 是 住 去 既 未 到 者 轉 釋 不 聞 
X37n0660_009:0100a08	生已是生故。故不更生等者。唯至不至轉釋聞所不	生 已 是 生 故 故 不 更 生 等 者 唯 至 不 至 轉 釋 聞 所 不 
X37n0660_009:0100a09	聞也。	聞 也 
X37n0660_009:0100a10	譬中無不一譬者。謂至不至等。今但合為一。三譬不	譬 中 無 不 一 譬 者 謂 至 不 至 等 今 但 合 為 一 三 譬 不 
X37n0660_009:0100a11	同合中。聞已不聞不聞不聞等。故云開合互現也。	同 合 中 聞 已 不 聞 不 聞 不 聞 等 故 云 開 合 互 現 也 
X37n0660_009:0100a12	一縱徵者。如經云。何復言等。意難縱云。眾生未見菩	一 縱 徵 者 如 經 云 何 復 言 等 意 難 縱 云 眾 生 未 見 菩 
X37n0660_009:0100a13	薩云見。云何未了既是未了。即同不見不見即是不	薩 云 見 云 何 未 了 既 是 未 了 即 同 不 見 不 見 即 是 不 
X37n0660_009:0100a14	聞。云何說言聞所不聞也。	聞 云 何 說 言 聞 所 不 聞 也 
X37n0660_009:0100a15	經云如來往昔從誰得聞者。既有於聞。聞必有師。故	經 云 如 來 往 昔 從 誰 得 聞 者 既 有 於 聞 聞 必 有 師 故 
X37n0660_009:0100a16	云誰也。	云 誰 也 
X37n0660_009:0100a17	經云於阿含等者。反徵無師。既云無師。云何復言聞	經 云 於 阿 含 等 者 反 徵 無 師 既 云 無 師 云 何 復 言 聞 
X37n0660_009:0100a18	不聞也。	不 聞 也 
X37n0660_009:0100a19	細不可見者。如極微色神鬼等色。故不可見也。	細 不 可 見 者 如 極 微 色 神 鬼 等 色 故 不 可 見 也 
X37n0660_009:0100a20	質柱一邊見者。如人柱東西則不見故也。	質 柱 一 邊 見 者 如 人 柱 東 西 則 不 見 故 也 
X37n0660_009:0100a21	聲亦類爾者。大聲遠則不聞。小乘及近亦不得聞也。	聲 亦 類 爾 者 大 聲 遠 則 不 聞 小 乘 及 近 亦 不 得 聞 也 
X37n0660_009:0100a22	經云聞已聲滅者。夫言聞者皆約句義可詮表故。一	經 云 聞 已 聲 滅 者 夫 言 聞 者 皆 約 句 義 可 詮 表 故 一 
X37n0660_009:0100a23	字不成聞。若喚後字前字已滅故。故云何得聞也。	字 不 成 聞 若 喚 後 字 前 字 已 滅 故 故 云 何 得 聞 也 
X37n0660_009:0100a24	是為歎答者。先歎後答。如經善知一切諸法如幻等。	是 為 歎 答 者 先 歎 後 答 如 經 善 知 一切諸法 如 幻 等 
X37n0660_009:0100b01	不聞聞等豈有定耶。	不 聞 聞 等 豈 有 定 耶 
X37n0660_009:0100b02	非青見青等乃至瑞答者。皆是不定之相。不來而來	非 青 見 青 等 乃 至 瑞 答 者 皆 是 不 定 之 相 不 來 而 來 
X37n0660_009:0100b03	顯於中道。不聞聞涅槃之相。故云瑞也。	顯 於 中 道 不 聞 聞 涅 槃 之 相 故 云 瑞 也 
X37n0660_009:0100b04	凡此三答三根釋然者。初明歎答從此更有二答。故	凡 此 三 答 三 根 釋 然 者 初 明 歎 答 從 此 更 有 二 答 故 
X37n0660_009:0100b05	云三也。	云 三 也 
X37n0660_009:0100b06	答別答者。即是見光琉璃之問等兼答前聞。故云別	答 別 答 者 即 是 見 光 琉 璃 之 問 等 兼 答 前 聞 故 云 別 
X37n0660_009:0100b07	也。	也 
X37n0660_009:0100b08	是光體者。即是中道之光為體也。	是 光 體 者 即 是 中 道 之 光 為 體 也 
X37n0660_009:0100b09	是光用者。謂非青見青等答前德王之問。聞所不聞	是 光 用 者 謂 非 青 見 青 等 答 前 德 王 之 問 聞 所 不 聞 
X37n0660_009:0100b10	等得益之用也。	等 得 益 之 用 也 
X37n0660_009:0100b11	一顯諸法無言者。此光是理體之本。故四菩薩展轉	一 顯 諸 法 無 言 者 此 光 是 理 體 之 本 故 四 菩 薩 展 轉 
X37n0660_009:0100b12	無言。如淨名杜口等。皆顯不思議也。	無 言 如 淨 名 杜 口 等 皆 顯 不 思 議 也 
X37n0660_009:0100b13	二寄言明本者。前第一義諦故以無言。此世俗文字	二 寄 言 明 本 者 前 第一義諦 故 以 無 言 此 世 俗 文 字 
X37n0660_009:0100b14	故言也。	故 言 也 
X37n0660_009:0100b15	經云光明者即是念佛者。此是一體三寶。故云常住	經 云 光 明 者 即 是 念 佛 者 此 是 一 體 三 寶 故 云 常 住 
X37n0660_009:0100b16	也。	也 
X37n0660_009:0100b17	經云亦有因緣者即不思議感應之因緣。涅槃之體	經 云 亦 有 因 緣 者 即 不 思 議 感 應 之 因 緣 涅 槃 之 體 
X37n0660_009:0100b18	寶不可說。為眾生故。亦可得說也。	寶 不 可 說 為 眾 生 故 亦 可 得 說 也 
X37n0660_009:0100b19	是破是立者。謂遍破遍立也。	是 破 是 立 者 謂 遍 破 遍 立 也 
X37n0660_009:0100b20	彼菩薩是佛者。此師意如文殊等皆是古佛。示為菩	彼 菩 薩 是 佛 者 此 師 意 如 文 殊 等 皆 是 古 佛 示 為 菩 
X37n0660_009:0100b21	薩輔佛行化。故云有光也。或云初住菩薩分證法身。	薩 輔 佛 行 化 故 云 有 光 也 或 云 初 住 菩 薩 分 證 法 身 
X37n0660_009:0100b22	亦有常光之本也。	亦 有 常 光 之 本 也 
X37n0660_009:0100b23	不佛道同者。即四悉意彼此土別即世界也。但生此	不 佛 道 同 者 即 四 悉 意 彼 此 土 別 即 世 界 也 但 生 此 
X37n0660_009:0100b24	正善為人滅此土惡對治。令見性得道第一義也。	正 善 為 人 滅 此 土 惡 對 治 令 見 性 得 道 第 一 義 也 
X37n0660_009:0100c01	此佛舉彼菩薩者。如經是大眾中有此光明等。問此	此 佛 舉 彼 菩 薩 者 如 經 是 大 眾 中 有 此 光 明 等 問 此 
X37n0660_009:0100c02	光明。即是舉彼也。	光 明 即 是 舉 彼 也 
X37n0660_009:0100c03	迦葉亦爾者。謂亦逗常機為其生善入第一義。不說	迦 葉 亦 爾 者 謂 亦 逗 常 機 為 其 生 善 入 第 一 義 不 說 
X37n0660_009:0100c04	對治扶律之當耳。	對 治 扶 律 之 當 耳 
X37n0660_009:0100c05	上文對佛者。謂純陀對佛與文殊論也。	上 文 對 佛 者 謂 純 陀 對 佛 與 文 殊 論 也 
X37n0660_009:0100c06	而法不傍者。純陀約無為法正論常住也。	而 法 不 傍 者 純 陀 約 無 為 法 正 論 常 住 也 
X37n0660_009:0100c07	有去來故來者。約俗諦來也。	有 去 來 故 來 者 約 俗 諦 來 也 
X37n0660_009:0100c08	無去來故來者。約真諦來也。	無 去 來 故 來 者 約 真 諦 來 也 
X37n0660_009:0100c09	經云諸行若常者。謂理無去來。若無常者。念念生滅	經 云 諸 行 若 常 者 謂 理 無 去 來 若 無 常 者 念念生滅 
X37n0660_009:0100c10	亦無去來也。	亦 無 去 來 也 
X37n0660_009:0100c11	後八番者。一約眾生即有去來。二約憍慢。三約取著。	後 八 番 者 一 約 眾 生 即 有 去 來 二 約 憍 慢 三 約 取 著 
X37n0660_009:0100c12	四約如來涅槃。五約見性。六約二乘涅槃。七約聲聞	四 約 如 來 涅 槃 五 約 見 性 六 約 二 乘 涅 槃 七 約 聲 聞 
X37n0660_009:0100c13	四德。八約如來四德也。	四 德 八 約 如 來 四 德 也 
X37n0660_009:0100c14	兼答高貴不聞而聞者。謂本即不聞迹而聞。即迹而	兼 答 高 貴 不 聞 而 聞 者 謂 本 即 不 聞 迹 而 聞 即 迹 而 
X37n0660_009:0100c15	本即不聞。不聞即本而迹。即是同同不來而來。利後	本 即 不 聞 不 聞 即 本 而 迹 即 是 同 同 不 來 而 來 利 後 
X37n0660_009:0100c16	如是。即迹而本來即不來。即本而迹。不來而來。迷悟	如 是 即 迹 而 本 來 即 不 來 即 本 而 迹 不 來 而 來 迷 悟 
X37n0660_009:0100c17	准此故也。	准 此 故 也 
X37n0660_009:0100c18	經云既蒙聽許兼被誡勅者。此是經家敘意誡文。猶	經 云 既 蒙 聽 許 兼 被 誡 勅 者 此 是 經 家 敘 意 誡 文 猶 
X37n0660_009:0100c19	在下答文之中也。	在 下 答 文 之 中 也 
X37n0660_009:0100c20	一德王問廣者。如上有奪縱等三雙也。	一 德 王 問 廣 者 如 上 有 奪 縱 等 三 雙 也 
X37n0660_009:0100c21	二德王問證者。不聞聞等不聞是證也。	二 德 王 問 證 者 不 聞 聞 等 不 聞 是 證 也 
X37n0660_009:0100c22	琉光問修者。既云問所不聞聞即是修也。琉光在本。	琉 光 問 修 者 既 云 問 所 不 聞 聞 即 是 修 也 琉 光 在 本 
X37n0660_009:0100c23	本謂本土。問彼佛不聞聞等義也。	本 謂 本 土 問 彼 佛 不 聞 聞 等 義 也 
X37n0660_009:0100c24	眾既問廣等者。有其二義故略。一者此中大眾已聞	眾 既 問 廣 等 者 有 其 二 義 故 略 一 者 此 中 大 眾 已 聞 
X37n0660_009:0101a01	德王問竟流光故略。二者隨流光來大眾彼已聞竟。	德 王 問 竟 流 光 故 略 二 者 隨 流 光 來 大 眾 彼 已 聞 竟 
X37n0660_009:0101a02	故但略聞也。	故 但 略 聞 也 
X37n0660_009:0101a03	天行任運增明者。初證住後。念念入法流。故增明也。	天 行 任 運 增 明 者 初 證 住 後 念 念 入 法 流 故 增 明 也 
X37n0660_009:0101a04	似如六度者。佛法幽微何能測度。今但比似約六度	似 如 六 度 者 佛 法 幽 微 何 能 測 度 今 但 比 似 約 六 度 
X37n0660_009:0101a05	釋之也。	釋 之 也 
X37n0660_009:0101a06	此約精進許者。如經。汝今欲盡如是大乘等。即是精	此 約 精 進 許 者 如 經 汝 今 欲 盡 如 是 大 乘 等 即 是 精 
X37n0660_009:0101a07	進也。	進 也 
X37n0660_009:0101a08	經云大涅槃海者。涅槃之體深而後廣喻之如海。大	經 云 大 涅 槃 海 者 涅 槃 之 體 深 而 後 廣 喻 之 如 海 大 
X37n0660_009:0101a09	乘即是能乘之人。從因至果。名大涅槃也。	乘 即 是 能 乘 之 人 從 因 至 果 名 大 涅 槃 也 
