X39n0703_001:0191c10	麤言便息。由忿蔽故。加以手足塊石刀杖。捶打傷害	麤 言 便 息 由 忿 蔽 故 加 以 手 足 塊 石 刀 杖 捶 打 傷 害 
X39n0703_001:0191c11	損惱有情。內懷猛利忿恨意樂。有所違犯。他來諫謝。	損 惱 有 情 內 懷 猛 利 忿 恨 意 樂 有 所 違 犯 他來諫謝 
X39n0703_001:0191c12	不受不忍。不捨怨結。是名第三他勝處法。	不 受 不 忍 不 捨 怨 結 是 名 第 三 他勝處法 
X39n0703_001:0191c13	一念瞋心起。百萬障門開。況可捶打損惱。況可懺	一 念 瞋 心 起 百 萬 障 門 開 況 可 捶 打 損 惱 況 可 懺 
X39n0703_001:0191c14	猶不受乎。既已隔絕眾生。菩提願力安在。	猶 不 受 乎 既 已 隔 絕 眾 生 菩 提 願 力 安 在 
X39n0703_001:0191c15	第四說相似法戒。	第 四 說 相 似 法 戒 
X39n0703_001:0191c16	若諸菩薩。謗菩薩藏。愛樂宣說。開示建立像似正法。	若 諸 菩 薩 謗 菩 薩 藏 愛 樂 宣 說 開 示 建 立 像似正法 
X39n0703_001:0191c17	於像似法。或自信解。或隨他轉。是名第四他勝處法。	於 像 似 法 或 自 信 解 或 隨 他 轉 是 名 第 四 他勝處法 
X39n0703_001:0191c18	真實正法。決與一印三印相應。像似正法。則似是	真 實 正 法 決 與 一 印 三 印 相 應 像似正法 則 似 是 
X39n0703_001:0191c19	而非。決與愛見二網相應。說此像似之法。即名謗	而 非 決 與 愛 見 二 網 相 應 說 此 像 似 之 法 即 名 謗 
X39n0703_001:0191c20	菩薩藏。葢不必排撥毀呰而後為謗法也。舊已流	菩 薩 藏 葢 不 必 排 撥 毀 呰 而 後 為 謗 法 也 舊 已 流 
X39n0703_001:0191c21	通。重為舉揚名宣說。闡擴輔翼。令使增廣名開示。	通 重 為 舉 揚 名 宣 說 闡 擴 輔 翼 令 使 增 廣 名 開 示 
X39n0703_001:0191c22	自創新談。別陳宗旨名建立。自信解者。即是邪師。	自 創 新 談 別 陳 宗 旨 名 建 立 自 信 解 者 即 是 邪 師 
X39n0703_001:0191c23	隨他轉者。即邪弟子。邪正不辨。則弘法者盡皆謗	隨 他 轉 者 即 邪 弟 子 邪 正 不 辨 則 弘 法 者 盡 皆 謗 
X39n0703_001:0191c24	法者耳。可不悲夫。	法 者 耳 可 不 悲 夫 
X39n0703_001:0192a01	三結成。	三 結 成 
X39n0703_001:0192a02	如是名為菩薩四種他勝處法。	如 是 名 為 菩 薩 四 種 他勝處法 
X39n0703_001:0192a03	名為菩薩他勝處者。正顯不與小乘共也。若殺盜	名 為 菩 薩 他 勝 處 者 正 顯 不 與 小 乘 共 也 若 殺 盜 
X39n0703_001:0192a04	婬妄。則大小乘共。名為根本戒矣。初明戒相竟。	婬 妄 則 大 小 乘 共 名 為 根 本 戒 矣 初 明 戒 相 竟 
X39n0703_001:0192a05	二明犯相二。初出過。二簡別。今初。	二 明 犯 相 二 初 出 過 二 簡 別 今 初 
X39n0703_001:0192a06	菩薩於四他勝處法。隨犯四種。況犯一切。不復堪能	菩 薩 於 四 他勝處法 隨 犯 四 種 況 犯 一 切 不 復 堪 能 
X39n0703_001:0192a07	於現法中。增長攝受廣大菩提資糧。不復堪能於現	於現法中 增 長 攝 受 廣 大 菩提資糧 不 復 堪 能 於 現 
X39n0703_001:0192a08	法中。意樂清淨。是即名為相似菩薩。非真菩薩。	法 中 意 樂 清 淨 是 即 名 為 相 似 菩 薩 非 真 菩 薩 
X39n0703_001:0192a09	隨犯四種。言四中隨犯其一也。況犯一切。言具犯	隨 犯 四 種 言 四 中 隨 犯 其 一 也 況 犯 一 切 言 具 犯 
X39n0703_001:0192a10	四種也。現法。即現在一生。廣大菩提資糧。即六度	四 種 也 現 法 即 現 在 一 生 廣 大 菩提資糧 即 六 度 
X39n0703_001:0192a11	萬行等。意樂清淨。即菩薩淨心地也。	萬 行 等 意 樂 清 淨 即 菩 薩 淨 心 地 也 
X39n0703_001:0192a12	二簡別。	二 簡 別 
X39n0703_001:0192a13	菩薩若用輭中品纏。毀犯四種他勝處法。不捨菩薩	菩 薩 若 用 輭 中 品 纏 毀 犯 四 種 他勝處法 不 捨 菩 薩 
X39n0703_001:0192a14	淨戒律儀。上品纏犯。即名為捨。若諸菩薩。毀犯四種	淨 戒 律 儀 上 品 纏 犯 即 名 為 捨 若 諸 菩 薩 毀 犯 四 種 
X39n0703_001:0192a15	他勝處法。數數現行。都無慚愧。深生愛樂。見是功德。	他勝處法 數數現行 都 無 慚 愧 深生愛樂 見 是 功 德 
X39n0703_001:0192a16	當知說名上品纏犯。	當 知 說 名 上 品 纏 犯 
X39n0703_001:0192a17	纏即十纏。一瞋。二覆。三睡。四眠。五掉。六悔。七嫉。八	纏 即 十 纏 一 瞋 二 覆 三 睡 四 眠 五 掉 六 悔 七 嫉 八 
X39n0703_001:0192a18	慳。九無慚。十無愧。各有下中上品。輭即下品也。下	慳 九 無 慚 十 無 愧 各 有下中上 品 輭 即 下 品 也 下 
X39n0703_001:0192a19	品中品十纏犯戒。不名失戒。上品纏犯。便為失戒	品 中 品 十 纏 犯 戒 不 名 失 戒 上 品 纏 犯 便 為 失 戒 
X39n0703_001:0192a20	捨即失也。數數現行以下。重釋上品纏犯之相。二	捨 即 失 也 數數現行 以 下 重 釋 上 品 纏 犯 之 相 二 
X39n0703_001:0192a21	明犯相竟。	明 犯 相 竟 
X39n0703_001:0192a22	三簡異小乘二。初明不失。二明失已容受。今	三 簡 異 小 乘 二 初 明 不 失 二 明 失 已 容 受 今 
X39n0703_001:0192a23	初。	初 
X39n0703_001:0192a24	非諸菩薩暫一現行他勝處法。便捨菩薩淨戒律儀。	非 諸 菩 薩 暫 一 現 行 他勝處法 便 捨 菩薩淨戒 律 儀 
X39n0703_001:0192b01	如諸苾蒭犯他勝處法。即便棄捨別解脫戒。	如 諸 苾 蒭 犯 他勝處法 即 便 棄 捨 別解脫戒 
X39n0703_001:0192b02	苾蒭。即比丘。梵音楚夏耳。比丘戒法。專藉外緣。故	苾 蒭 即 比 丘 梵 音 楚 夏 耳 比 丘 戒 法 專 藉 外 緣 故 
X39n0703_001:0192b03	易失。菩薩戒法。繇菩提心所感。故難失也。又比丘	易 失 菩 薩 戒 法 繇 菩 提 心 所 感 故 難 失 也 又 比 丘 
X39n0703_001:0192b04	他勝處法。是婬盜殺妄。故一犯永失。菩薩他勝處	他勝處法 是 婬 盜 殺 妄 故 一 犯 永 失 菩 薩 他 勝 處 
X39n0703_001:0192b05	法。是毀慳瞋謗。故偶犯仍未失也。別解脫者。梵名	法 是 毀 慳 瞋 謗 故 偶 犯 仍 未 失 也 別 解 脫 者 梵 名 
X39n0703_001:0192b06	波羅提木叉。	波羅提木叉 
X39n0703_001:0192b07	二明失已容受。	二 明 失 已 容 受 
X39n0703_001:0192b08	若諸菩薩。由此毀犯。棄捨菩薩淨戒律儀。於現法中。	若 諸 菩 薩 由 此 毀 犯 棄 捨 菩薩淨戒 律 儀 於現法中 
X39n0703_001:0192b09	堪任更受。非不堪任。如苾蒭住別解脫戒。犯他勝法。	堪 任 更 受 非 不 堪 任 如 苾 蒭 住 別解脫戒 犯 他 勝 法 
X39n0703_001:0192b10	於現法中。不任更受。	於現法中 不 任 更 受 
X39n0703_001:0192b11	由此毀犯。謂上品纏犯也。縱令失戒。猶許更受。故	由 此 毀 犯 謂 上 品 纏 犯 也 縱 令 失 戒 猶 許 更 受 故 
X39n0703_001:0192b12	不同小乘也。然復應知以上品纏。犯此毀慳瞋謗	不 同 小 乘 也 然 復 應 知 以 上 品 纏 犯 此 毀 慳 瞋 謗 
X39n0703_001:0192b13	四戒。但失菩薩戒。不失比丘戒。故設懺悔。仍任更	四 戒 但 失 菩 薩 戒 不 失 比 丘 戒 故 設 懺 悔 仍 任 更 
X39n0703_001:0192b14	受。若犯殺盜婬妄四戒。則既失比丘戒。并失菩薩	受 若 犯 殺 盜 婬 妄 四 戒 則 既 失 比 丘 戒 并 失 菩 薩 
X39n0703_001:0192b15	戒。不任更受。雖依梵網懺悔。得見好相。止許作菩	戒 不 任 更 受 雖 依 梵 網 懺 悔 得 見 好 相 止 許 作 菩 
X39n0703_001:0192b16	薩優婆塞。或作菩薩沙彌。終不得作菩薩比丘矣。	薩 優 婆 塞 或 作 菩 薩 沙 彌 終 不 得 作 菩 薩 比 丘 矣 
X39n0703_001:0192b17	三簡異小乘竟。	三 簡 異 小 乘 竟 
X39n0703_001:0192b18	四結歎功勝二。初明勝。二例明。今初。	四 結 歎 功 勝 二 初 明 勝 二 例 明 今 初 
X39n0703_001:0192b19	如是菩薩所受淨戒。於餘一切所受淨戒最勝最上。	如 是 菩 薩 所受淨戒 於 餘 一 切 所受淨戒 最 勝 最 上 
X39n0703_001:0192b20	無量無邊大功德藏之所隨逐。第一最上善心意樂	無量無邊 大 功 德 藏 之 所 隨 逐 第 一 最 上 善 心 意 樂 
X39n0703_001:0192b21	之所發起。普能除滅於一切有情一切種惡行。	之 所 發 起 普 能 除 滅 於 一切有情 一 切 種 惡 行 
X39n0703_001:0192b22	餘一切所受淨戒。指八戒五戒十戒具戒等。以此	餘 一 切 所受淨戒 指 八 戒 五 戒 十 戒 具 戒 等 以 此 
X39n0703_001:0192b23	種種淨戒。無不從菩薩淨戒海中流出。無不還歸	種 種 淨 戒 無 不 從 菩薩淨戒 海 中 流 出 無 不 還 歸 
X39n0703_001:0192b24	菩薩淨戒海中。故惟此戒為最勝最上。乃總歎也。	菩薩淨戒 海 中 故 惟 此 戒 為 最 勝 最 上 乃 總 歎 也 
X39n0703_001:0192c01	大功德藏之所隨逐。歎其所獲勝益。第一意樂之	大 功 德 藏 之 所 隨 逐 歎 其 所 獲 勝 益 第 一 意 樂 之 
X39n0703_001:0192c02	所發起。歎其因地勝心。普能除滅一切惡行。歎其	所 發 起 歎 其 因 地 勝 心 普 能 除 滅 一 切 惡 行 歎 其 
X39n0703_001:0192c03	滅罪勝力。	滅 罪 勝 力 
X39n0703_001:0192c04	二例明。	二 例 明 
X39n0703_001:0192c05	一切別解脫律儀。於此菩薩律儀戒。百分不及一。千	一 切 別解脫律儀 於 此 菩 薩 律 儀 戒 百 分 不 及 一 千 
X39n0703_001:0192c06	分不及一。數分計分算分喻分。乃至鄔波尼殺曇分	分 不 及 一 數 分 計 分 算 分 喻 分 乃 至 鄔 波 尼 殺 曇 分 
X39n0703_001:0192c07	亦不及一。攝受一切大功德故。	亦 不 及 一 攝 受 一 切 大 功 德 故 
X39n0703_001:0192c08	一切別解脫律儀。亦指八戒乃至具戒言之。鄔波	一 切 別解脫律儀 亦 指 八 戒 乃 至 具 戒 言 之 鄔 波 
X39n0703_001:0192c09	尼殺曇。此翻近少。謂微塵是色之近少分也。大文	尼 殺 曇 此 翻 近 少 謂 微 塵 是 色 之 近 少 分 也 大 文 
X39n0703_001:0192c10	二正授戒法竟。	二 正 授 戒 法 竟 
X39n0703_001:0192c11	三總結畢儀。	三 總 結 畢 儀 
X39n0703_001:0192c12	如是已作受菩薩戒羯磨等事。授受菩薩俱起。供養	如 是 已 作 受 菩 薩 戒 羯 磨 等 事 授 受 菩 薩 俱 起 供 養 
X39n0703_001:0192c13	普於十方無邊無際。諸世界中諸佛菩薩。頂禮雙足。	普 於 十 方 無邊無際 諸 世 界 中 諸佛菩薩 頂 禮 雙 足 
X39n0703_001:0192c14	恭敬而退。	恭 敬 而 退 
X39n0703_001:0192c15	此總結啟白請證。及正授戒法之後。應各運心普	此 總 結 啟 白 請 證 及 正 授 戒 法 之 後 應 各 運 心 普 
X39n0703_001:0192c16	供養也。	供 養 也 
X39n0703_001:0192c17	四揀擇非器二。初不從受。二不為說。今初。	四 揀 擇 非 器 二 初 不 從 受 二 不 為 說 今 初 
X39n0703_001:0192c18	又諸菩薩。不從一切諸聰慧者求受菩薩所受淨戒	又 諸 菩 薩 不 從 一 切 諸 聰 慧 者 求 受 菩 薩 所受淨戒 
X39n0703_001:0192c19	無淨信者。不應從受。謂於如是所受淨戒。初無信解。	無 淨 信 者 不 應 從 受 謂 於 如 是 所受淨戒 初 無 信 解 
X39n0703_001:0192c20	不能趣入。不善思惟。有慳貪者。慳貪蔽者。有大欲者。	不 能 趣 入 不 善 思 惟 有 慳 貪 者 慳 貪 蔽 者 有 大 欲 者 
X39n0703_001:0192c21	無喜足者。不應從受。毀淨戒者。於諸學處無恭敬者。	無 喜 足 者 不 應 從 受 毀 淨 戒 者 於 諸 學 處 無 恭 敬 者 
X39n0703_001:0192c22	於戒律儀有慢緩者。不應從受。有忿恨者。多不忍者。	於 戒 律 儀 有 慢 緩 者 不 應 從 受 有 忿 恨 者 多 不 忍 者 
X39n0703_001:0192c23	於他違犯不堪耐者。不應從受。有懶惰者。有懈怠者。	於 他 違 犯 不 堪 耐 者 不 應 從 受 有 懶 惰 者 有 懈 怠 者 
X39n0703_001:0192c24	多分耽著。日夜睡眠。樂倚樂臥。樂好合徒侶樂嬉談	多 分 耽 著 日 夜 睡 眠 樂 倚 樂 臥 樂 好 合 徒 侶 樂 嬉 談 
X39n0703_001:0193a01	者。不應從受。心散亂者。下至不能[愨心+牛]牛乳頃善心一	者 不 應 從 受 心 散 亂 者 下 至 不 能 [愨心牛] 牛 乳 頃 善 心 一 
X39n0703_001:0193a02	緣住修習者。不應從受。有闇昧者。愚癡類者。極劣心	緣 住 修 習 者 不 應 從 受 有 闇 昧 者 愚 癡 類 者 極 劣 心 
X39n0703_001:0193a03	者。誹謗菩薩素怛纜藏及摩怛迦者。不應從受。	者 誹 謗 菩 薩 素 怛 纜 藏 及 摩 怛 迦 者 不 應 從 受 
X39n0703_001:0193a04	此明菩薩法師應須揀擇根器。不可妄順人求而	此 明 菩 薩 法 師 應 須 揀 擇 根 器 不 可 妄 順 人 求 而 
X39n0703_001:0193a05	使其輙受也。葢此菩薩淨戒。乃是諸聰慧者之所	使 其 輙 受 也 葢 此 菩薩淨戒 乃 是 諸 聰 慧 者 之 所 
X39n0703_001:0193a06	求受。今彼既無淨信。乃至誹謗經論。何堪受此戒	求 受 今 彼 既 無 淨 信 乃 至 誹 謗 經 論 何 堪 受 此 戒 
X39n0703_001:0193a07	耶。文中略列二十二類。一無淨信。所謂不能趣入。	耶 文 中 略 列 二 十 二 類 一 無 淨 信 所 謂 不 能 趣 入 
X39n0703_001:0193a08	不善思惟。二有慳貪。三慳貪增上戒蔽。四有大欲。	不 善 思 惟 二 有 慳 貪 三 慳 貪 增 上 戒 蔽 四 有 大 欲 
X39n0703_001:0193a09	五無喜足。六毀淨戒。謂隨於所受八戒五戒十戒	五 無 喜 足 六 毀 淨 戒 謂 隨 於 所 受 八 戒 五 戒 十 戒 
X39n0703_001:0193a10	具戒既有毀犯。未經懺悔得好相者。皆為遮障。七	具 戒 既 有 毀 犯 未 經 懺 悔 得 好 相 者 皆 為 遮 障 七 
X39n0703_001:0193a11	不恭敬學處。八有慢緩。既於八戒至具戒等尚不	不 恭 敬 學 處 八 有 慢 緩 既 於 八 戒 至 具 戒 等 尚 不 
X39n0703_001:0193a12	不恭慢緩。何堪受此增上大戒。九有忿恨。十多不	不 恭 慢 緩 何 堪 受 此 增 上 大 戒 九 有 忿 恨 十 多 不 
X39n0703_001:0193a13	忍。十一不堪耐他違犯。十二懶惰而不勇猛。十三	忍 十 一 不 堪 耐 他 違 犯 十 二 懶 惰 而 不 勇 猛 十 三 
X39n0703_001:0193a14	懈怠而不精進。十四多分有所耽著。十五睡眠倚	懈 怠 而 不 精 進 十 四 多 分 有 所 耽 著 十 五 睡 眠 倚 
X39n0703_001:0193a15	臥。十六樂合徒眾。十七樂於嬉談。十八散亂。不能	臥 十 六 樂 合 徒 眾 十 七 樂 於 嬉 談 十 八 散 亂 不 能 
X39n0703_001:0193a16	善心一緣。十九闇昧。二十愚癡。二十一極劣心。二	善 心 一 緣 十 九 闇 昧 二 十 愚 癡 二 十 一 極 劣 心 二 
X39n0703_001:0193a17	十二誹謗經論。如此諸人。決定不能被弘誓鎧。趣	十 二 誹 謗 經 論 如 此 諸 人 決 定 不 能 被弘誓鎧 趣 
X39n0703_001:0193a18	向菩提。故皆不應從受也。[愨心+牛]。音遘。取牛乳頃。明其	向 菩 提 故 皆 不 應 從 受 也 [愨心牛] 音 遘 取 牛 乳 頃 明 其 
X39n0703_001:0193a19	至暫。素怛纜。即修多羅。此云契經。摩怛迦。即摩怛	至 暫 素 怛 纜 即 修 多 羅 此 云 契 經 摩 怛 迦 即 摩 怛 
X39n0703_001:0193a20	理進。解現上文。梵網不許揀擇種姓。今文特令揀	理 進 解 現 上 文 梵 網 不 許 揀 擇 種 姓 今 文 特 令 揀 
X39n0703_001:0193a21	擇根器。影略互成。不可不知。	擇 根 器 影 略 互 成 不 可 不 知 
X39n0703_001:0193a22	二不為說。	二 不 為 說 
X39n0703_001:0193a23	又諸菩薩。於受菩薩戒律儀法。雖已具足受持究竟。	又 諸 菩 薩 於 受 菩 薩 戒 律 儀 法 雖 已 具 足 受 持 究 竟 
X39n0703_001:0193a24	而於毀謗菩薩藏者無信有情。終不率爾宣示開悟。	而 於 毀 謗 菩 薩 藏 者 無 信 有 情 終 不 率 爾 宣 示 開 悟 
X39n0703_001:0193b01	所以者何。為其聞已。不能信解。大無知障之所覆蔽。	所以者何 為 其 聞 已 不能信解 大 無 知 障 之 所 覆 蔽 
X39n0703_001:0193b02	便生誹謗。由誹謗故。如住菩薩淨戒律儀。成就無量	便 生 誹 謗 由 誹 謗 故 如 住 菩薩淨戒 律 儀 成 就 無 量 
X39n0703_001:0193b03	大功德藏。彼誹謗者。亦為無量大罪業藏之所隨逐。	大 功 德 藏 彼 誹 謗 者 亦 為 無 量 大罪業藏 之 所 隨 逐 
X39n0703_001:0193b04	乃至一切惡言惡見及惡思惟未永棄捨。終不免離。	乃 至 一 切 惡 言 惡 見 及 惡 思 惟 未 永 棄 捨 終 不 免 離 
X39n0703_001:0193b05	菩薩說法。貴在觀機。若見有情。於此淨戒能生信	菩 薩 說 法 貴 在 觀 機 若 見 有 情 於 此 淨 戒 能 生 信 
X39n0703_001:0193b06	樂。則應宣示開悟。令其發起受戒之心。故梵網有	樂 則 應 宣 示 開 悟 令 其 發 起 受 戒 之 心 故 梵 網 有 
X39n0703_001:0193b07	不化眾生之戒。然大須隨時思察。豈容率爾妄宣。	不 化 眾 生 之 戒 然 大 須 隨 時 思 察 豈 容 率 爾 妄 宣 
X39n0703_001:0193b08	反令眾生墮罪業耶。當知彼經此論。亦互成也。已	反 令 眾 生 墮 罪 業 耶 當 知 彼 經 此 論 亦 互 成 也 已 
X39n0703_001:0193b09	上大科初明從師受竟。	上 大 科 初 明 從 師 受 竟 
X39n0703_001:0193b10	二明像前受。	二 明 像 前 受 
X39n0703_001:0193b11	若諸菩薩。欲受菩薩淨戒律儀。若不會遇具足功德	若 諸 菩 薩 欲 受 菩薩淨戒 律 儀 若 不 會 遇 具 足 功 德 
X39n0703_001:0193b12	補特伽羅。爾時應對如來像前。自受菩薩淨戒律儀。	補 特 伽 羅 爾 時 應 對 如 來 像 前 自 受 菩薩淨戒 律 儀 
X39n0703_001:0193b13	應如是受。偏袒右肩。右膝著地。作如是言。我如是名。	應 如 是 受 偏袒右肩 右膝著地 作如是言 我 如 是 名 
X39n0703_001:0193b14	仰啟十方一切如來。已入大地諸菩薩眾。我今欲於	仰 啟 十 方 一 切 如 來 已 入 大 地 諸 菩 薩 眾 我 今 欲 於 
X39n0703_001:0193b15	十方世界佛菩薩所。誓受一切菩薩學處。誓受一切	十方世界 佛 菩 薩 所 誓 受 一切菩薩 學 處 誓 受 一 切 
X39n0703_001:0193b16	菩薩淨戒。謂律儀戒。攝善法戒。饒益有情戒。如是學	菩薩淨戒 謂 律 儀 戒 攝善法戒 饒益有情戒 如 是 學 
X39n0703_001:0193b17	處。如是淨戒。過去一切菩薩已具。未來一切菩薩當	處 如 是 淨 戒 過 去 一切菩薩 已 具 未 來 一切菩薩 當 
X39n0703_001:0193b18	具普於十方現在一切菩薩今具。於是學處。於是淨	具 普 於 十 方 現 在 一切菩薩 今 具 於 是 學 處 於 是 淨 
X39n0703_001:0193b19	戒。過去一切菩薩已學。未來一切菩薩當學。普於十	戒 過 去 一切菩薩 已 學 未 來 一切菩薩 當 學 普 於 十 
X39n0703_001:0193b20	方現在一切菩薩今學。第二第三。亦如是說。說已應	方 現 在 一切菩薩 今 學 第二第三 亦 如 是 說 說 已 應 
X39n0703_001:0193b21	起。所餘一切。如前應知。	起 所 餘 一 切 如 前 應 知 
X39n0703_001:0193b22	補特伽羅。此翻有情。具足功德。謂已發大願。有智	補 特 伽 羅 此 翻 有 情 具 足 功 德 謂 已 發 大 願 有 智 
X39n0703_001:0193b23	有力。於語表義能授能開等也。審訪不得。方許像	有 力 於 語 表 義 能 授 能 開 等 也 審 訪 不 得 方 許 像 
X39n0703_001:0193b24	前自受。若遇明師而不從受。非癡即慢矣。梵網制	前 自 受 若 遇 明 師 而 不 從 受 非 癡 即 慢 矣 梵 網 制 
X39n0703_001:0193c01	令求見好相。此中但貴發菩提心。今人設欲自誓	令 求 見 好 相 此 中 但 貴 發菩提心 今 人 設 欲 自 誓 
X39n0703_001:0193c02	受戒。大須自斟酌也。仰啟十方等。即是三羯磨文。	受 戒 大 須 自 斟 酌 也 仰 啟 十 方 等 即 是 三 羯 磨 文 
X39n0703_001:0193c03	所餘一切如前應知。謂法爾相現。及四重法等。已	所 餘 一 切 如 前 應 知 謂 法 爾 相 現 及 四 重 法 等 已 
X39n0703_001:0193c04	上受戒羯磨第一竟。	上 受 戒 羯 磨 第 一 竟 
X39n0703_001:0193c05	懺罪羯磨第二又分為二。初誡令勿犯。二設犯	懺 罪 羯 磨 第 二 又 分 為 二 初 誡 令 勿 犯 二 設 犯 
X39n0703_001:0193c06	應懺。今初。	應 懺 今 初 
X39n0703_001:0193c07	若諸菩薩。從他正受戒律儀已。由善清淨求。學意樂。	若 諸 菩 薩 從 他 正 受 戒 律 儀 已 由 善 清 淨 求 學 意 樂 
X39n0703_001:0193c08	菩提意樂。饒益一切有情意樂。生起最極尊重恭敬。	菩 提 意 樂 饒益一切 有 情 意 樂 生 起 最 極 尊 重 恭 敬 
X39n0703_001:0193c09	從初專精。不應違犯。	從 初 專 精 不 應 違 犯 
X39n0703_001:0193c10	或初師前。或於像前。皆名從他正受。善清淨求學	或 初 師 前 或 於 像 前 皆 名 從 他 正 受 善 清 淨 求 學 
X39n0703_001:0193c11	意樂。約攝律儀戒言之。菩提意樂。約攝善法戒言	意 樂 約 攝律儀戒 言 之 菩 提 意 樂 約 攝善法戒 言 
X39n0703_001:0193c12	之。饒益一切有情意樂。約攝眾生戒言之。從初受	之 饒益一切 有 情 意 樂 約 攝 眾 生 戒 言 之 從 初 受 
X39n0703_001:0193c13	已。即應專一精純。恒時護持。護持此戒。不令違犯。	已 即 應 專 一 精 純 恒 時 護 持 護 持 此 戒 不 令 違 犯 
X39n0703_001:0193c14	即便具足三聚功德也。	即 便 具 足 三 聚 功 德 也 
X39n0703_001:0193c15	二設犯應懺又二。初總誡疾除。二別示二懺。	二 設 犯 應 懺 又 二 初 總 誡 疾 除 二 別 示 二 懺 
X39n0703_001:0193c16	今初。	今 初 
X39n0703_001:0193c17	設有違犯。即應如法疾疾悔除。令得還淨。	設 有 違 犯 即 應 如 法 疾 疾 悔 除 令 得 還 淨 
X39n0703_001:0193c18	有犯不悔。則日夜增長罪惡。故應疾疾除之。欲除	有 犯 不 悔 則 日 夜 增 長 罪 惡 故 應 疾 疾 除 之 欲 除 
X39n0703_001:0193c19	其罪而不能如法。罪亦不除。故先誡令如法也。譬	其 罪 而 不 能 如 法 罪 亦 不 除 故 先 誡 令 如 法 也 譬 
X39n0703_001:0193c20	如淨衣。偶觸汙穢。速以灰水洗浣。乃可還淨。不用	如 淨 衣 偶 觸 汙 穢 速 以 灰 水 洗 浣 乃 可 還 淨 不 用 
X39n0703_001:0193c21	灰水。臭氣不滅。停待時日。臭氣亦難除矣。	灰 水 臭 氣 不 滅 停 待 時 日 臭 氣 亦 難 除 矣 
X39n0703_001:0193c22	二別示二懺又二。初對首懺。二自誓懺。初又	二 別 示 二 懺 又 二 初 對 首 懺 二 自 誓 懺 初 又 
X39n0703_001:0193c23	二。初明所對之人。二明懺法差別。今初。	二 初 明 所 對 之 人 二 明 懺 法 差 別 今 初 
X39n0703_001:0193c24	如是菩薩一切違犯。當知皆是惡作所攝。應向有力。	如 是 菩 薩 一 切 違 犯 當 知 皆 是 惡 作 所 攝 應 向 有 力 
X39n0703_001:0194a01	於語表業能覺能授。小乘大乘補特伽羅。發露懺悔。	於 語 表 業 能 覺 能 授 小 乘 大乘補特伽羅 發 露 懺 悔 
X39n0703_001:0194a02	一切違犯。通指此中四重。及戒本中四十一輕而	一 切 違 犯 通 指 此 中 四 重 及 戒 本 中 四 十 一 輕 而 
X39n0703_001:0194a03	言之也。比丘戒法。局在僧輪。故詳列五篇七聚。名	言 之 也 比 丘 戒 法 局 在 僧 輪 故 詳 列 五 篇 七 聚 名 
X39n0703_001:0194a04	為秘法。菩薩戒法。通於七眾。故一切違犯。均名惡	為 秘 法 菩 薩 戒 法 通 於 七 眾 故 一 切 違 犯 均 名 惡 
X39n0703_001:0194a05	作。但有可悔不可悔若輕若重之殊耳。受戒必須	作 但 有 可 悔 不 可 悔 若 輕 若 重 之 殊 耳 受 戒 必 須 
X39n0703_001:0194a06	大乘法師。懺悔不拘小乘大乘者。以小乘比丘。亦	大 乘 法 師 懺 悔 不 拘 小 乘 大 乘 者 以 小 乘 比 丘 亦 
X39n0703_001:0194a07	是住持僧寶。堪為菩薩滅罪故也。	是 住 持 僧 寶 堪 為 菩 薩 滅 罪 故 也 
X39n0703_001:0194a08	二明懺法差別又三。初懺上品纏犯。二懺中品	二 明 懺 法 差 別 又 三 初 懺 上 品 纏 犯 二 懺 中 品 
X39n0703_001:0194a09	纏犯。三懺下品纏犯。及餘違犯。今初。	纏 犯 三 懺 下 品 纏 犯 及 餘 違 犯 今 初 
X39n0703_001:0194a10	若諸菩薩。以上品纏。違犯如上他勝處法。失戒律儀。	若 諸 菩 薩 以 上 品 纏 違 犯 如 上 他勝處法 失 戒 律 儀 
X39n0703_001:0194a11	應當更受。	應 當 更 受 
X39n0703_001:0194a12	如上他勝處法。即指毀慳瞋謗四戒而言之也。故	如 上 他勝處法 即 指 毀 慳 瞋 謗 四 戒 而 言 之 也 故 
X39n0703_001:0194a13	雖失戒。猶許更受。若犯殺盜婬妄。則須求見好相	雖 失 戒 猶 許 更 受 若 犯 殺 盜 婬 妄 則 須 求 見 好 相 
X39n0703_001:0194a14	矣。	矣 
X39n0703_001:0194a15	二懺中品纏犯。	二 懺 中 品 纏 犯 
X39n0703_001:0194a16	若中品纏。違犯如是他勝處法。應對於三補特伽羅。	若 中 品 纏 違 犯 如 是 他勝處法 應 對 於 三 補 特 伽 羅 
X39n0703_001:0194a17	或過是數。應如發露除惡作法。先當稱述所犯事名。	或 過 是 數 應 如 發 露 除 惡 作 法 先 當 稱 述 所 犯 事 名 
X39n0703_001:0194a18	應作是說。長老專志。或言大德。我如是名。違越菩薩	應 作 是 說 長 老 專 志 或 言 大 德 我 如 是 名 違 越 菩 薩 
