X39n0703_001:0194a19	毗柰耶法。如前稱事。犯惡作罪。餘如苾蒭發露悔滅。	毗 柰 耶 法 如 前 稱 事 犯 惡 作 罪 餘 如 苾 蒭 發露悔滅 
X39n0703_001:0194a20	惡作罪法。應如是說。	惡 作 罪 法 應如是說 
X39n0703_001:0194a21	餘如苾蒭等者。應言。長老一心念。我某甲。犯某甲	餘 如 苾 蒭 等 者 應 言 長 老 一 心 念 我 某 甲 犯 某 甲 
X39n0703_001:0194a22	罪。今從長老懺悔。不敢覆藏。懺悔則安樂。不懺悔	罪 今 從 長 老 懺 悔 不 敢 覆 藏 懺 悔 則 安 樂 不 懺 悔 
X39n0703_001:0194a23	不安樂。憶念犯發露。知而不覆藏。長老憶念我清	不 安 樂 憶 念 犯 發 露 知 而 不 覆 藏 長 老 憶 念 我 清 
X39n0703_001:0194a24	淨戒身。具足清淨布薩。如是三說。彼應語言。自責	淨 戒 身 具 足 清 淨 布 薩 如是三說 彼 應 語 言 自 責 
X39n0703_001:0194b01	汝心。應生厭離。答言。爾。又若對三有情懺悔者。彼	汝 心 應 生 厭 離 答 言 爾 又 若 對 三 有 情 懺 悔 者 彼 
X39n0703_001:0194b02	犯罪人。既至三有情邊說罪事已。於此三有情中。	犯 罪 人 既 至 三 有 情 邊 說 罪 事 已 於 此 三 有 情 中 
X39n0703_001:0194b03	隨一受懺悔者。應先問餘二有情言。若長老聽我	隨 一 受 懺 悔 者 應 先 問 餘 二 有 情 言 若 長 老 聽 我 
X39n0703_001:0194b04	受某甲菩薩懺者。我當受。二人應答言。可爾。然後	受 某 甲 菩 薩 懺 者 我 當 受 二 人 應 答 言 可 爾 然 後 
X39n0703_001:0194b05	受其懺悔。若對過三人數懺悔。即是對僧。應往僧	受 其 懺 悔 若 對 過 三 人 數 懺 悔 即 是 對 僧 應 往 僧 
X39n0703_001:0194b06	中偏袒。脫屣。禮僧足。胡跪合掌。如是白。大德僧聽。	中 偏 袒 脫 屣 禮 僧 足 胡 跪 合 掌 如 是 白 大德僧聽 
X39n0703_001:0194b07	我某甲。犯某甲罪。今從僧乞懺悔。如是三說。是中	我 某 甲 犯 某 甲 罪 今 從 僧 乞 懺 悔 如是三說 是 中 
X39n0703_001:0194b08	隨一受懺者應作白言。大德僧聽。此某甲菩薩。犯	隨 一 受 懺 者 應 作 白 言 大德僧聽 此 某 甲 菩 薩 犯 
X39n0703_001:0194b09	某甲罪。今從僧懺悔。若僧時到。僧忍聽。我受某甲	某 甲 罪 今 從 僧 懺 悔 若僧時到 僧 忍 聽 我 受 某 甲 
X39n0703_001:0194b10	菩薩懺。白如是。白已。犯罪者方陳懺辭。乃至。語言	菩 薩 懺 白 如 是 白 已 犯 罪 者 方 陳 懺 辭 乃 至 語 言 
X39n0703_001:0194b11	自責汝心。應生厭離。犯罪者答言爾。	自 責 汝 心 應 生 厭 離 犯 罪 者 答 言 爾 
X39n0703_001:0194b12	三懺下品纏犯。及餘違犯。	三 懺 下 品 纏 犯 及 餘 違 犯 
X39n0703_001:0194b13	若下品纏。違犯如上他勝處法。及餘違犯。應對於一	若 下 品 纏 違 犯 如 上 他勝處法 及 餘 違 犯 應 對 於 一 
X39n0703_001:0194b14	補特伽羅發露。悔法當知如前。	補 特 伽 羅 發 露 悔 法 當 知 如 前 
X39n0703_001:0194b15	餘違犯。即戒本經中四十一輕。亦名眾多犯。亦名	餘 違 犯 即 戒 本 經 中 四 十 一 輕 亦 名 眾 多 犯 亦 名 
X39n0703_001:0194b16	輕垢罪也。初對首懺竟。	輕 垢 罪 也 初 對 首 懺 竟 
X39n0703_001:0194b17	二自誓懺。	二 自 誓 懺 
X39n0703_001:0194b18	若無隨順補特伽羅可對發露。悔除所犯。爾時菩薩	若 無 隨 順 補 特 伽 羅 可 對 發 露 悔 除 所 犯 爾 時 菩 薩 
X39n0703_001:0194b19	以淨意樂。起自誓心。我當決定防護當來。終不重犯。	以 淨 意 樂 起 自 誓 心 我 當 決定防護 當 來 終不重犯 
X39n0703_001:0194b20	如是於犯還出還淨。	如 是 於 犯 還 出 還 淨 
X39n0703_001:0194b21	隨順補特伽羅。謂隨順小乘大乘正法。於語表業	隨 順 補 特 伽 羅 謂 隨 順 小 乘 大 乘 正 法 於 語 表 業 
X39n0703_001:0194b22	能覺能授者也。不應向未受戒人懺悔。亦不應向	能 覺 能 授 者 也 不 應 向 未 受 戒 人 懺 悔 亦 不 應 向 
X39n0703_001:0194b23	有違犯人懺悔。故設無清淨大小乘人。但可自誓	有 違 犯 人 懺 悔 故 設 無 清 淨 大 小 乘 人 但 可 自 誓 
X39n0703_001:0194b24	而已。自誓誠切。則罪還出而戒還淨矣。已上懺罪	而 已 自 誓 誠 切 則 罪 還 出 而 戒 還 淨 矣 已 上 懺 罪 
X39n0703_001:0194c01	羯磨第二竟。	羯 磨 第 二 竟 
X39n0703_001:0194c02	得捨差別第三又分為二。初明捨戒差別。二明	得 捨 差 別 第 三 又 分 為 二 初 明 捨 戒 差 別 二 明 
X39n0703_001:0194c03	得戒差別。今初。	得 戒 差 別 今 初 
X39n0703_001:0194c04	略由二緣。捨諸菩薩淨戒律儀。一者棄捨無上正等	略 由 二 緣 捨 諸 菩薩淨戒 律 儀 一 者 棄 捨 無 上 正 等 
X39n0703_001:0194c05	菩提大願。二者現行上品纏犯他勝處法。	菩 提 大 願 二 者 現 行 上 品 纏 犯 他勝處法 
X39n0703_001:0194c06	捨戒。即失戒也。先發無上正等菩提大願。乃得受	捨 戒 即 失 戒 也 先 發 無上正等菩提 大 願 乃 得 受 
X39n0703_001:0194c07	戒。今既棄捨此願。則戒亦隨失。此一緣也。上品纏	戒 今 既 棄 捨 此 願 則 戒 亦 隨 失 此 一 緣 也 上 品 纏 
X39n0703_001:0194c08	犯他勝處法。此二緣也。然或重發大願。如法悔除。	犯 他勝處法 此 二 緣 也 然 或 重 發 大 願 如法悔除 
X39n0703_001:0194c09	仍可重受。	仍 可 重 受 
X39n0703_001:0194c10	次明得戒差別又二。初明盡未來永得。一釋轉	次 明 得 戒 差 別 又 二 初 明 盡 未 來 永 得 一 釋 轉 
X39n0703_001:0194c11	生重受疑。今初。	生 重 受 疑 今 初 
X39n0703_001:0194c12	若諸菩薩。雖復轉身徧十方界。在在生處。不捨菩薩	若 諸 菩 薩 雖 復 轉 身 徧 十 方 界 在在生處 不 捨 菩 薩 
X39n0703_001:0194c13	淨戒律儀。由是菩薩不捨無上菩提大願。亦不現行	淨 戒 律 儀 由 是 菩 薩 不 捨 無上菩提 大 願 亦 不 現 行 
X39n0703_001:0194c14	上品纏犯他勝處法。	上 品 纏 犯 他勝處法 
X39n0703_001:0194c15	八關戒法。局在一日一夜。五戒十戒具戒。局在盡	八 關 戒 法 局 在 一 日 一 夜 五 戒 十 戒 具 戒 局 在 盡 
X39n0703_001:0194c16	壽。惟此菩薩戒法。一得永得。直至盡未來時。若無	壽 惟 此 菩 薩 戒 法 一 得 永 得 直 至 盡 未 來 時 若 無 
X39n0703_001:0194c17	退心犯重二緣。終不捨失也。	退 心 犯 重 二 緣 終 不 捨 失 也 
X39n0703_001:0194c18	二釋轉生重受疑。	二 釋 轉 生 重 受 疑 
X39n0703_001:0194c19	若諸菩薩。轉受餘生。忘失本念。值遇善友。為欲覺悟	若 諸 菩 薩 轉 受 餘 生 忘 失 本 念 值 遇 善 友 為 欲 覺 悟 
X39n0703_001:0194c20	菩薩戒念。雖數重受。而非新受。亦不新得。	菩 薩 戒 念 雖 數 重 受 而 非 新 受 亦 不 新 得 
X39n0703_001:0194c21	無作戒體。一發之後。永為佛種。縱令轉生忘失。然	無 作 戒 體 一 發 之 後 永 為 佛 種 縱 令 轉 生 忘 失 然 
X39n0703_001:0194c22	既無退心犯重二緣。當知戒體仍在。雖數數重受。	既 無 退 心 犯 重 二 緣 當 知 戒 體 仍 在 雖 數 數 重 受 
X39n0703_001:0194c23	但令覺悟而已。豈名新受新得哉。	但 令 覺 悟 而 已 豈 名 新 受 新 得 哉 
X39n0703_001:0194c24	菩薩戒羯磨文釋(終)	菩 薩 戒 羯 磨 文 釋 終 
