X58n1013_001:0516c24	三寶四諦生疑。雖通緣理事為相。唯迷理惑。非	三 寶 四 諦 生 疑 雖 通 緣 理 事 為 相 唯 迷 理 惑 非 
X58n1013_001:0517a01	如二取。唯緣事迷事。	如 二 取 唯 緣 事 迷 事 
X58n1013_001:0517a02	六身見。染慧為性。分別行緣蘊。不分別所起處。有	六 身 見 染 慧 為 性 分 別 行 緣 蘊 不 分 別 所 起 處 有 
X58n1013_001:0517a03	二十句。如於五蘊中。執色為我。我有色。色屬□	二 十 句 如 於 五 蘊 中 執 色 為 我 我 有 色 色 屬 
X58n1013_001:0517a04	我。我在色中。五蘊總相計之。有五箇我見。十五	我 我 在 色 中 五 蘊 總 相 計 之 有 五 箇 我 見 十 五 
X58n1013_001:0517a05	箇我所見。若執一蘊為我。何蘊是所起處。則一	箇 我 所 見 若 執 一 蘊 為 我 何 蘊 是 所 起 處 則 一 
X58n1013_001:0517a06	蘊為我。餘四蘊下。皆有三箇我所見。共有十二	蘊 為 我 餘 四 蘊 下 皆 有 三 箇 我 所 見 共 有 十 二 
X58n1013_001:0517a07	箇我所見。五蘊計之。便有六十五箇我我所見。	箇 我 所 見 五 蘊 計 之 便 有 六 十 五 箇 我 我 所 見 
X58n1013_001:0517a08	七邊見。執斷有七。計常有四十。染慧為性。我見後	七 邊 見 執 斷 有 七 計 常 有 四 十 染 慧 為 性 我 見 後 
X58n1013_001:0517a09	起。前際有八。四遍常。為我及世間。是有是無。是	起 前 際 有 八 四 遍 常 為 我 及 世 間 是 有 是 無 是 
X58n1013_001:0517a10	亦有無。是非有無。四一分常。為我常他無常。有	亦 有 無 是 非 有 無 四 一 分 常 為 我 常 他 無 常 有 
X58n1013_001:0517a11	無俱是俱非。後際有三十二。有想有十六。為我	無 俱 是 俱 非 後 際 有 三 十 二 有 想 有 十 六 為 我 
X58n1013_001:0517a12	後世是有是無。俱是俱非。計色身也。四邊。我是	後 世 是 有 是 無 俱 是 俱 非 計 色 身 也 四 邊 我 是 
X58n1013_001:0517a13	有邊無邊。俱是俱非。四我是小想大想。種種想	有邊無邊 俱 是 俱 非 四 我 是 小 想 大 想 種 種 想 
X58n1013_001:0517a14	無邊想。四我苦樂。俱是俱非。無想有八。四我有	無 邊 想 四 我 苦 樂 俱 是 俱 非 無 想 有 八 四 我 有 
X58n1013_001:0517a15	色無色。俱是俱非。四有邊等四句。後際非有想	色 無 色 俱 是 俱 非 四 有 邊 等 四 句 後 際 非 有 想 
X58n1013_001:0517a16	非無想八句。四我是有無。俱是俱非。四我是有	非 無 想 八 句 四 我 是 有 無 俱 是 俱 非 四 我 是 有 
X58n1013_001:0517a17	邊無邊等四句。斷見有七。為眾生死後斷滅。欲	邊 無 邊 等 四 句 斷 見 有 七 為 眾 生 死 後 斷 滅 欲 
X58n1013_001:0517a18	界人天為二。色界為一。無色為四。有四十七種。	界 人 天 為 二 色 界 為 一 無 色 為 四 有 四 十 七 種 
X58n1013_001:0517a19	斷常邊見。依何地。繫何地。定散尋伺。	斷 常 邊 見 依 何 地 繫 何 地 定 散 尋 伺 
X58n1013_001:0517a20	八邪見。有十五種。染慧為性。撥無因果。親迷諦理。	八 邪 見 有 十 五 種 染 慧 為 性 撥無因果 親 迷 諦 理 
X58n1013_001:0517a21	二無因論者。一從無想將死。不能憶入心前事。	二 無 因 論 者 一 從 無 想 將 死 不 能 憶 入 心 前 事 
X58n1013_001:0517a22	便生撥謗。二從無想沒。因尋伺所起。便生撥謗。	便 生 撥 謗 二 從 無 想 沒 因 尋 伺 所 起 便 生 撥 謗 
X58n1013_001:0517a23	三撥無因果。或有或無。或俱非俱是。四不死矯	三 撥無因果 或 有 或 無 或 俱 非 俱 是 四 不 死 矯 
X58n1013_001:0517a24	有四句。五種計現在樂為涅槃。一執欲界人天	有 四 句 五 種 計 現 在 樂 為 涅 槃 一 執 欲 界 人 天 
X58n1013_001:0517b01	樂。二計初禪樂。三計二禪樂。四計三禪樂。五計	樂 二 計 初 禪 樂 三 計 二 禪 樂 四 計 三 禪 樂 五 計 
X58n1013_001:0517b02	隨第六全具前五。有大隨八。并中隨二。及小隨三。	隨 第 六 全 具 前 五 有 大 隨 八 并 中 隨 二 及 小 隨 三 
X58n1013_001:0517b03	五受俱門。中隨二。大隨八。五受俱。小隨十。四受	五 受 俱 門 中 隨 二 大 隨 八 五 受 俱 小 隨 十 四 受 
X58n1013_001:0517b04	俱。除樂受　六別境門皆得俱　七根本門。中	俱 除 樂 受 六 別 境 門 皆 得 俱 七 根 本 門 中 
X58n1013_001:0517b05	二。大八。與根本容起。小隨十法。不與見疑俱。忿	二 大 八 與 根 本 容 起 小 隨 十 法 不 與 見 疑 俱 忿 
X58n1013_001:0517b06	等五法。與慢癡俱。此中已有體者。取不相違。得	等 五 法 與 慢 癡 俱 此 中 已 有 體 者 取 不 相 違 得 
X58n1013_001:0517b07	俱與他性相應。非自性也　八三性門。小隨七。	俱 與 他 性 相 應 非 自 性 也 八 三 性 門 小 隨 七 
X58n1013_001:0517b08	中隨二。唯不善性小三。大八通二性　九三界	中 隨 二 唯 不 善 性 小 三 大 八 通 二 性 九 三 界 
X58n1013_001:0517b09	門。不善唯欲界。有覆通上二界　十隨煩惱。皆	門 不 善 唯 欲 界 有 覆 通 上 二 界 十 隨 煩 惱 皆 
X58n1013_001:0517b10	非學無學。彼唯善性　十一俱為有事　十二	非 學 無 學 彼 唯 善 性 十 一 俱 為 有 事 十 二 
X58n1013_001:0517b11	並皆有漏。	並 皆 有 漏 
X58n1013_001:0517b12	不定有四。謂悔眠尋伺。下二各有淺深。二於善染。	不 定 有 四 謂 悔 眠 尋 伺 下 二 各 有 淺 深 二 於 善 染 
X58n1013_001:0517b13	遍行別境皆不定。起體通三性。唯在意地。依於	遍 行 別 境 皆 不 定 起 體 通 三 性 唯 在 意 地 依 於 
X58n1013_001:0517b14	尋伺有染離染立。三地別不依彼種子。及理行	尋 伺 有 染 離 染 立 三 地 別 不 依 彼 種 子 及 理 行 
X58n1013_001:0517b15	有無。一悔。謂追悔先所造業。後方追悔惡作	有 無 一 悔 謂 追 悔 先 所 造 業 後 方 追 悔 惡 作 
X58n1013_001:0517b16	為因。追悔是果。二眠。令心昧略為性。有五蓋	為 因 追 悔 是 果 二 眠 令 心 昧 略 為 性 有 五 蓋 
X58n1013_001:0517b17	八纏。體通三性。非思慧為體。別有自性。量云。悔	八 纏 體 通 三 性 非 思 慧 為 體 別 有 自 性 量 云 悔 
X58n1013_001:0517b18	眠是有法。非思慧想宗是纏性故。如無慚。三	眠 是 有 法 非 思 慧 想 宗 是 纏 性 故 如 無 慚 三 
X58n1013_001:0517b19	尋伺合說。用思慧為體。令心忩遽。於意言境。麤	尋 伺 合 說 用 思 慧 為 體 令 心 忩 遽 於 意 言 境 麤 
X58n1013_001:0517b20	轉細轉為性。思為尋體。淺慧為尋體。深思為伺	轉 細 轉 為 性 思 為 尋 體 淺 慧 為 尋 體 深 思 為 伺 
X58n1013_001:0517b21	體。淺慧為伺體。深尋伺各有染淨二分。無起從	體 淺 慧 為 伺 體 深 尋 伺 各 有 染 淨 二 分 無 起 從 
X58n1013_001:0517b22	二俱通。不深推度。及深推度。或云。思增慧劣為	二 俱 通 不 深 推 度 及 深 推 度 或 云 思 增 慧 劣 為 
X58n1013_001:0517b23	尋慧。增思劣為伺。或云。思慧俱劣為尋。思慧俱	尋 慧 增 思 劣 為 伺 或 云 思 慧 俱 劣 為 尋 思 慧 俱 
X58n1013_001:0517b24	增為伺。	增 為 伺 
X58n1013_001:0517c01	五蓋者。覆義也。一欲貪。蓋覆出家。二嗔。蓋覆正行。三	五 蓋 者 覆 義 也 一 欲 貪 蓋 覆 出 家 二 嗔 蓋 覆 正 行 三 
X58n1013_001:0517c02	昏沉。蓋覆定本。為對治棹舉。不覺引生睡眠。四	昏 沉 蓋 覆 定 本 為 對 治 棹 舉 不 覺 引 生 睡 眠 四 
X58n1013_001:0517c03	掉舉。惡造蓋覆慧。高明之心對治。昏沉不覺。引	掉 舉 惡 造 蓋 覆 慧 高 明 之 心 對 治 昏 沉 不 覺 引 
X58n1013_001:0517c04	生散亂。五疑。蓋覆捨雙。捨前四。不高不下。不覺	生 散 亂 五 疑 蓋 覆 捨 雙 捨 前 四 不 高 不 下 不 覺 
X58n1013_001:0517c05	引生疑。	引 生 疑 
X58n1013_001:0517c06	八纏者。昏沉睡眠纏。掉舉惡作纏。慳嫉纏。無慚愧	八 纏 者 昏 沉 睡 眠 纏 掉 舉 惡 作 纏 慳 嫉 纏 無 慚 愧 
X58n1013_001:0517c07	纏。	纏 
X58n1013_001:0517c08	　　　諸門料揀有十二	 諸 門 料 揀 有 十 二 
X58n1013_001:0517c09	一假實門。前二實後二假二自類單單可想	一 假 實 門 前 二 實 後 二 假 二 自 類 單 單 可 想 
X58n1013_001:0517c10	應三諸識唯意四五受容起五別境容	應 三 諸 識 唯 意 四 五 受 容 起 五 別 境 容 
X58n1013_001:0517c11	起六善位不定七根本不定八隨惑不	起 六 善 位 不 定 七 根 本 不 定 八 隨 惑 不 
X58n1013_001:0517c12	定九三性不定十三界欲。全中間一分。上	定 九 三 性 不 定 十 三 界 欲 全 中 間 一 分 上 
X58n1013_001:0517c13	二全無十一三學容有十二三斷。染者見	二 全 無 十 一 三 學 容 有 十 二 三 斷 染 者 見 
X58n1013_001:0517c14	所斷。無記修所斷。善者非斷	所 斷 無 記 修 所 斷 善 者 非 斷 
X58n1013_001:0517c15	上總六位五十一心所。俱生頌曰。	上 總 六 位 五 十 一 心 所 俱 生 頌 曰 
X58n1013_001:0517c16	五法五俱起。(遍行五)九法必六俱。(別境五。不定四。有遍行五俱)	五 法 五 俱 起 遍 行 五 九 法 必 六 俱 別 境 五 不 定 四 有 遍 行 五 俱 
X58n1013_001:0517c17	九法定十四。(癡八大隨遍行)二十一十五。(善十小三貪慢疑與五見)	九 法 定 十 四 癡 八 大 隨 遍 行 二 十 一 十 五 善 十 小 三 貪 慢 疑 與 五 見 
X58n1013_001:0517c18	三法起十六。(輕安無慚無愧。癡遍行五法。大隨八中。隨二善十。有輕安并遍行五十	三 法 起 十 六 輕 安 無慚無愧 癡 遍 行 五 法 大 隨 八 中 隨 二 善 十 有 輕 安 并 遍 行 五 十 
X58n1013_001:0517c19	六)八法十七俱。(小七如起一時有中二大八癡及遍行五)是心所相	六 八 法 十 七 俱 小 七 如 起 一 時 有 中 二 大 八 癡 及 遍 行 五 是 心 所 相 
X58n1013_001:0517c20	應。慧者應當悉。	應 慧 者 應 當 悉 
X58n1013_001:0517c21	三分位者。有十一。是心心所起處。分位五根六塵。	三 分 位 者 有 十 一 是 心 心 所 起 處 分 位 五 根 六 塵 
X58n1013_001:0517c22	四差別者。有二十四不相應。依前三分位假立。謂	四 差 別 者 有 二 十 四 不 相 應 依 前 三 分 位 假 立 謂 
X58n1013_001:0517c23	一得。二命根。三眾同分。四異生性。五無想定。六	一 得 二 命 根 三 眾 同 分 四 異 生 性 五 無 想 定 六 
X58n1013_001:0517c24	滅盡定。七無相報。八名身。九句身。十文身。十一	滅 盡 定 七 無 相 報 八 名 身 九 句 身 十 文 身 十 一 
X58n1013_001:0518a01	生。十二老。十三住。十四無常。十五流轉。十六定	生 十 二 老 十 三 住 十 四 無 常 十 五 流 轉 十 六 定 
X58n1013_001:0518a02	異。十七相應。十八勢速。十九次第。二十時。二十	異 十 七 相 應 十 八 勢 速 十 九 次 第 二 十 時 二 十 
X58n1013_001:0518a03	一方。二十二數。二十三和合。二十四不和合。	一 方 二 十 二 數 二 十 三 和 合 二 十 四 不 和 合 
X58n1013_001:0518a04	五六無為者。一擇滅無為。因斷障得三乘見道。二	五 六 無 為 者 一 擇 滅 無 為 因 斷 障 得 三 乘 見 道 二 
X58n1013_001:0518a05	非擇滅無為。闕緣不生。善無記法。三不動無為	非 擇 滅 無 為 闕 緣 不 生 善 無 記 法 三 不 動 無 為 
X58n1013_001:0518a06	妄心不生。四想受滅無為報得。五虗空無為。離	妄 心 不 生 四 想 受 滅 無 為 報 得 五 虗 空 無 為 離 
X58n1013_001:0518a07	礙假說。六真如無為常住不變。	礙 假 說 六 真 如 無 為 常 住 不 變 
X58n1013_001:0518a08	迷諦義	迷 諦 義 
X58n1013_001:0518a09	夫見道所斷。十煩惱十俱斷頓。以真見道。總緣諦故。	夫 見道所斷 十 煩 惱 十 俱 斷 頓 以 真 見 道 總 緣 諦 故 
X58n1013_001:0518a10	分別煩惱。迷於四諦。有總有別。而四句。	分 別 煩 惱 迷 於 四 諦 有 總 有 別 而 四 句 
X58n1013_001:0518a11	一數總。謂十煩惱迷四諦。三界一百十二。兼修道。共	一 數 總 謂 十 煩 惱 迷 四 諦 三 界 一 百 十 二 兼 修 道 共 
X58n1013_001:0518a12	有一百九十三種　二行總苦集。是彼因依處滅道。	有 一 百 九 十 三 種 二 行 總 苦 集 是 彼 因 依 處 滅 道 
X58n1013_001:0518a13	是彼煩惱怖畏處能斷彼　三數別。二唯迷苦。八通	是 彼 煩 惱 怖 畏 處 能 斷 彼 三 數 別 二 唯 迷 苦 八 通 
X58n1013_001:0518a14	迷四。身邊二見苦處起別。定非我扃。苦四行別。謂疑	迷 四 身邊二見 苦 處 起 別 定 非 我 扃 苦 四 行 別 謂 疑 
X58n1013_001:0518a15	後三見。親迷苦理。二取唯迷事。緣前三見。從他。而生	後 三 見 親 迷 苦 理 二 取 唯 迷 事 緣 前 三 見 從 他 而 生 
X58n1013_001:0518a16	如貪嗔慢。通迷理事。唯疎無明。通迷理事。唯親若親	如 貪 嗔 慢 通 迷 理 事 唯 疎 無 明 通 迷 理 事 唯 親 若 親 
X58n1013_001:0518a17	緣理。必親迷疑。及三見若疎緣理。未必親迷。為二取	緣 理 必 親 迷 疑 及 三 見 若 疎 緣 理 未 必 親 迷 為 二 取 
X58n1013_001:0518a18	緣。事必迷事。若獨頭貪嗔慢。亦親迷滅道。若貪嗔慢。	緣 事 必 迷 事 若 獨 頭 貪 嗔 慢 亦 親 迷 滅 道 若 貪 嗔 慢 
X58n1013_001:0518a19	三隨見疑引生。是疎迷理惑。若隨二取引生。是疎迷	三 隨 見 疑 引 生 是 疎 迷 理 惑 若 隨 二 取 引 生 是 疎 迷 
X58n1013_001:0518a20	事。俱生無明。通迷理事。獨頭無明。親迷四諦理。且如	事 俱 生 無 明 通 迷 理 事 獨 頭 無 明 親 迷 四 諦 理 且 如 
X58n1013_001:0518a21	無明迷於一諦。邪見與疑同時起。初起時依諦。增近	無 明 迷 於 一 諦 邪 見 與 疑 同 時 起 初 起 時 依 諦 增 近 
X58n1013_001:0518a22	引生貪嗔慢。所緣諦增依諦劣。此見疑是何諦下惑。	引 生 貪 嗔 慢 所 緣 諦 增 依 諦 劣 此 見 疑 是 何 諦 下 惑 
X58n1013_001:0518a23	答。此隨緣判諦。依即是緣。若作遠諦判。依增緣約隣	答 此 隨 緣 判 諦 依 即 是 緣 若 作 遠 諦 判 依 增 緣 約 隣 
X58n1013_001:0518a24	近引。故局依緣增。依約疎遠引。故局緣。若作迷諦。則	近 引 故 局 依 緣 增 依 約 疎 遠 引 故 局 緣 若 作 迷 諦 則 
X58n1013_001:0518b01	有四句。一依緣俱增親引親。二依緣俱約疎引疎。三	有 四 句 一 依 緣 俱 增 親 引 親 二 依 緣 俱 約 疎 引 疎 三 
X58n1013_001:0518b02	依增緣約親引疎。四緣增依約疎引親。若依即是緣。	依 增 緣 約 親 引 疎 四 緣 增 依 約 疎 引 親 若 依 即 是 緣 
X58n1013_001:0518b03	隨緣判諦。所緣不定故有依苦身。而起緣二諦三諦。	隨 緣 判 諦 所 緣 不 定 故 有 依 苦 身 而 起 緣 二 諦 三 諦 
X58n1013_001:0518b04	而起貪等。若緣即依。隨緣判諦。依不定。故依多諦而	而 起 貪 等 若 緣 即 依 隨 緣 判 諦 依 不 定 故 依 多 諦 而 
X58n1013_001:0518b05	緣一諦。若依緣各異。初起隨依。後起隨緣。	緣 一 諦 若 依 緣 各 異 初 起 隨 依 後 起 隨 緣 
X58n1013_001:0518b06	大乘伏斷義	大 乘 伏 斷 義 
X58n1013_001:0518b07	第七識中。俱生二障現行伏在。八地已去。若斷彼種。	第 七 識 中 俱 生 二 障 現 行 伏 在 八 地 已 去 若 斷 彼 種 
X58n1013_001:0518b08	至金剛心。第六識中。二障種理。分別迷於四諦。見道	至 金 剛 心 第 六 識 中 二 障 種 理 分 別 迷 於 四 諦 見 道 
X58n1013_001:0518b09	斷。俱生種理。迷三界事。心地理九地俱生。從麤至細。	斷 俱 生 種 理 迷 三 界 事 心 地 理 九 地 俱 生 從 麤 至 細 
X58n1013_001:0518b10	分為九品。前八品俱生迷事。第九品通迷理事。一地	分 為 九 品 前 八 品 俱 生 迷 事 第 九 品 通 迷 理 事 一 地 
X58n1013_001:0518b11	有九品。九地便有八十一品。於見道前。伏下俱生現	有 九 品 九 地 便 有 八 十 一 品 於 見 道 前 伏 下 俱 生 現 
X58n1013_001:0518b12	行。迷理事惑。其分別二障。迷四諦理。有一百七十二	行 迷 理 事 惑 其 分 別 二 障 迷 四 諦 理 有 一 百 七 十 二 
X58n1013_001:0518b13	義。不伏便斷。於見通前。一無數劫。伏除二取俱生現	義 不 伏 便 斷 於 見 通 前 一 無 數 劫 伏 除 二 取 俱 生 現 
X58n1013_001:0518b14	行。若二乘人。獨覺迴心至大乘。十信初心。經十千劫。	行 若 二 乘 人 獨 覺 迴 心 至 大 乘 十 信 初 心 經 十 千 劫 
X58n1013_001:0518b15	若初果迴心有八萬劫。二果迴心有六萬劫。三果迴	若 初 果 迴 心 有 八 萬 劫 二 果 迴 心 有 六 萬 劫 三 果 迴 
X58n1013_001:0518b16	心有四萬劫。四果迴心有二萬劫。	心 有 四 萬 劫 四 果 迴 心 有 二 萬 劫 
X58n1013_001:0518b17	小乘伏斷義	小 乘 伏 斷 義 
X58n1013_001:0518b18	聲聞人。從他聞法至自乘。見道利根者三生。鈍根者	聲 聞 人 從 他 聞 法 至 自 乘 見 道 利 根 者 三 生 鈍 根 者 
X58n1013_001:0518b19	六十小劫。有四類修。皆猒喧求靜。一見道前伏惑。	六 十 小 劫 有 四 類 修 皆 猒 喧 求 靜 一 見 道 前 伏 惑 
X58n1013_001:0518b20	超伏下欲界。俱生前六品入見道。不出便證第二果。	超 伏 下 欲 界 俱 生 前 六 品 入 見 道 不 出 便 證 第 二 果 
X58n1013_001:0518b21	若伏下欲界九品俱生惑入見道。不出超二果。證三	若 伏 下 欲 界 九 品 俱 生 惑 入 見 道 不 出 超 二 果 證 三 
X58n1013_001:0518b22	果上二界。有七十二品惑。共障無學。二次第得果。	果 上 二 界 有 七 十 二 品 惑 共 障 無 學 二 次 第 得 果 
X58n1013_001:0518b23	起一無間道一解脫道。斷惑一品。依初禪。未至定。	起 一 無 間 道 一 解 脫 道 斷 惑 一 品 依 初 禪 未 至 定 
X58n1013_001:0518b24	三見道後。束惑超九品俱生惑束九大品斷。欲界初	三 見 道 後 束 惑 超 九 品 俱 生 惑 束 九 大 品 斷 欲 界 初 
X58n1013_001:0518c01	品時。即斷至有頂地初品。由意樂力。是利根者。四	品 時 即 斷 至 有 頂 地 初 品 由 意 樂 力 是 利 根 者 四 
X58n1013_001:0518c02	超斷不超果。伏惑至五品。若斷只得初果。伏至七八	超 斷 不 超 果 伏 惑 至 五 品 若 斷 只 得 初 果 伏 至 七 八 
X58n1013_001:0518c03	品。若斷只得二果。若斷第九便得不還。下八地前。八	品 若 斷 只 得 二 果 若 斷 第 九 便 得 不 還 下 八 地 前 八 
X58n1013_001:0518c04	品迷事。第九品通迷理事。伏至無所有處。只得三果。	品 迷 事 第 九 品 通 迷 理 事 伏 至 無所有處 只 得 三 果 
X58n1013_001:0518c05	非非想一地。不伏便斷。彼無欣厭。相便證無學。	非 非 想 一 地 不 伏 便 斷 彼 無 欣 厭 相 便 證 無 學 
X58n1013_001:0518c06	欲界九品俱生惑。共閏七生者上上品獨閏二生。上	欲 界 九 品 俱 生 惑 共 閏 七 生 者 上 上 品 獨 閏 二 生 上 
X58n1013_001:0518c07	中上下共閏二生。中上品獨閏一生。中中品中下品	中 上 下 共 閏 二 生 中 上 品 獨 閏 一 生 中 中 品 中 下 品 
X58n1013_001:0518c08	共閏一生。此上。是一來果。下上品獨閏半生。下中品	共 閏 一 生 此 上 是 一 來 果 下 上 品 獨 閏 半 生 下 中 品 
X58n1013_001:0518c09	下下品共閏半生。是不還果。	下 下 品 共 閏 半 生 是 不 還 果 
X58n1013_001:0518c10	緣覺伏斷義	緣 覺 伏 斷 義 
X58n1013_001:0518c11	緣覺見生滅。緣發修行。心厭喧求靜。利根小乘。或云。	緣 覺 見 生 滅 緣 發 修 行 心 厭 喧 求 靜 利 根 小 乘 或 云 
X58n1013_001:0518c12	獨覺從果為名。於見道前。百劫練根。伏下九地俱生	獨 覺 從 果 為 名 於 見 道 前 百 劫 練 根 伏 下 九 地 俱 生 
X58n1013_001:0518c13	迷事惑。至無所有處。入見道時。三界分別俱生頓斷。	迷 事 惑 至 無所有處 入 見 道 時 三 界 分 別 俱 生 頓 斷 
X58n1013_001:0518c14	法已後入觀不出。用九無聞道。九解脫道。法智法忍。	法 已 後 入 觀 不 出 用 九 無 聞 道 九 解 脫 道 法 智 法 忍 
X58n1013_001:0518c15	上下四諦。共三十二心。并總一無間一解脫。其有五	上 下 四 諦 共 三 十 二 心 并 總 一 無 間 一 解 脫 其 有 五 
X58n1013_001:0518c16	十二心。證無學果。	十 二 心 證 無 學 果 
X58n1013_001:0518c17	大乘資粮加行義	大 乘 資 粮 加 行 義 
X58n1013_001:0518c18	一資粮位。依因力善友力作意力資粮力。自聞無漏	一 資 粮 位 依 因 力 善 友 力 作 意 力 資 粮 力 自 聞 無 漏 
X58n1013_001:0518c19	教法。薰習已去。發深固大菩薩心四弘誓願。於一阿	教 法 薰 習 已 去 發 深 固 大 菩 薩 心 四 弘 誓 願 於 一 阿 
X58n1013_001:0518c20	僧祇劫。善備福德智慧二種資粮。又名順果解脫分。	僧 祇 劫 善 備 福 德 智 慧 二 種 資 粮 又 名 順 果 解 脫 分 
X58n1013_001:0518c21	善勝解心中。修起四十心。所謂十信十住十迴向。為	善 勝 解 心 中 修 起 四 十 心 所 謂 十 信 十 住 十 迴 向 為 
X58n1013_001:0518c22	入見道。復修加行。	入 見 道 復 修 加 行 
X58n1013_001:0518c23	二加行位有四。一燸位。依明得定。發下品尋伺。望無	二 加 行 位 有 四 一 燸 位 依 明 得 定 發 下 品 尋 伺 望 無 
X58n1013_001:0518c24	漏聖智。名明明即所得。定能發慧。慧即尋伺。覺資粮	漏 聖 智 名 明 明 即 所 得 定 能 發 慧 慧 即 尋 伺 覺 資 粮 
X58n1013_001:0519a01	位中。一切法名義。各有自性差別。所薰所取種子伏	位 中 一 切 法 名 義 各 有 自性差別 所 薰 所 取 種 子 伏 
X58n1013_001:0519a02	之。假有學無離識非有。二頂位。依明增定。發生上	之 假 有 學 無 離 識 非 有 二 頂 位 依 明 增 定 發 生 上 
X58n1013_001:0519a03	品尋伺。重觀順無所取名等。四法假有實。無先所薰	品 尋 伺 重 觀 順 無 所 取 名 等 四 法 假 有 實 無 先 所 薰 
X58n1013_001:0519a04	種子。不生現行。已得純熟。三忍位。依印順定。發生	種 子 不 生 現 行 已 得 純 熟 三 忍 位 依 印 順 定 發 生 
X58n1013_001:0519a05	下品如實智。印前所取無順。後能取無。若印寬順狹。	下 品 如 實 智 印 前 所 取 無 順 後 能 取 無 若 印 寬 順 狹 
X58n1013_001:0519a06	印通初品後品。樂順在中品。若印順皆寬者。下品印	印 通 初 品 後 品 樂 順 在 中 品 若 印 順 皆 寬 者 下 品 印 
X58n1013_001:0519a07	無所取。即是順無中品。順即是印也。上品印無能取。	無 所 取 即 是 順 無 中 品 順 即 是 印 也 上 品 印 無 能 取 
X58n1013_001:0519a08	順後世第一也。若印順皆狹印。即初後品順。通中後	順 後 世 第 一 也 若 印 順 皆 狹 印 即 初 後 品 順 通 中 後 
X58n1013_001:0519a09	品。下忍名印。中忍樂順上忍印。順忍即印。印即是智。	品 下 忍 名 印 中 忍 樂 順 上 忍 印 順 忍 即 印 印 即 是 智 
X58n1013_001:0519a10	四世第一位。依無間定。發生上品如實智。一念双	四 世第一位 依 無 間 定 發 生 上 品 如 實 智 一 念 双 
X58n1013_001:0519a11	印前能所空。名世第一。異生性中最後念。故有漏無	印 前 能 所 空 名 世 第 一 異 生 性 中 最 後 念 故 有 漏 無 
X58n1013_001:0519a12	間。有無漏起。無漏無有。有漏生。既無實境。離能取識。	間 有 無 漏 起 無 漏 無 有 有 漏 生 既 無 實 境 離 能 取 識 
X58n1013_001:0519a13	寧有實識。離所取境。如實無漏智生。我法二執俱無。	寧 有 實 識 離 所 取 境 如 實 無 漏 智 生 我 法 二 執 俱 無 
X58n1013_001:0519a14	故名世第一也　若入見道。唯依欲界身。第四禪心。	故 名 世 第 一 也 若 入 見 道 唯 依 欲 界 身 第 四 禪 心 
X58n1013_001:0519a15	餘二厭心非殊勝。故　暖頂忍位。通依諸二禪。三禪。	餘 二 厭 心 非 殊 勝 故 暖 頂 忍 位 通 依 諸 二 禪 三 禪 
X58n1013_001:0519a16	靜慮。世第一。唯依第四禪心。入見道。若二乘四善根。	靜 慮 世 第 一 唯 依 第 四 禪 心 入 見 道 若 二 乘 四 善 根 
X58n1013_001:0519a17	唯依初禪。未至定迴心。入大乘見道。唯斷所知障。許	唯 依 初 禪 未 至 定 迴 心 入 大 乘 見 道 唯 斷 所 知 障 許 
X58n1013_001:0519a18	依色界身入。	依 色 界 身 入 
X58n1013_001:0519a19	見道義	見 道 義 
X58n1013_001:0519a20	若時。於所緣智。都無所得。爾時住唯識。離二取相。故	若 時 於 所 緣 智 都 無 所 得 爾 時 住 唯 識 離 二 取 相 故 
X58n1013_001:0519a21	心境相稱如智冥合。離二取絕戲論。能證之智有三。	心 境 相 稱 如 智 冥 合 離 二 取 絕 戲 論 能 證 之 智 有 三 
X58n1013_001:0519a22	一云。相見俱無說無二取。二云。二分俱有。若無相緣	一 云 相 見 俱 無 說 無 二 取 二 云 二 分 俱 有 若 無 相 緣 
