X58n1013_001:0514b06	華嚴法相槃節(并序)	華 嚴 法 相 槃 節 并 序 
X58n1013_001:0514b08	東京南任薗講經　道通　述	東 京 南 任 薗 講 經 道 通 述 
X58n1013_001:0514b09	大覺示滅。法日潛輝。教逐機差。不可局執。性相互資。	大 覺 示 滅 法 日 潛 輝 教 逐 機 差 不 可 局 執 性 相 互 資 
X58n1013_001:0514b10	其見圓妙。(道通)夙附真乘。窮居講肆。論聽宣益。經傳	其 見 圓 妙 道 通 夙 附 真 乘 窮 居 講 肆 論 聽 宣 益 經 傳 
X58n1013_001:0514b11	妙空。退慚先哲。無裨後學。屢經患難。倍覺衰遲。築室	妙 空 退 慚 先 哲 無 裨 後 學 屢 經 患 難 倍 覺 衰 遲 築 室 
X58n1013_001:0514b12	城南。苟延歲月。而二三學者。由不我弃。日以講席為	城 南 苟 延 歲 月 而 二 三 學 者 由 不 我 弃 日 以 講 席 為 
X58n1013_001:0514b13	事。因閱舊篋。得所論法義。謂曰槃節。其間染淨相融。	事 因 閱 舊 篋 得 所 論 法 義 謂 曰 槃 節 其 間 染 淨 相 融 
X58n1013_001:0514b14	依緣增約。慢體慢類。假我假法。三境五果之微言。四	依 緣 增 約 慢 體 慢 類 假 我 假 法 三 境 五 果 之 微 言 四 
X58n1013_001:0514b15	緣十因之妙說。自共相之能詮。表無表之分限。依理	緣 十 因 之 妙 說 自 共 相 之 能 詮 表 無 表 之 分 限 依 理 
X58n1013_001:0514b16	依事之殊。迷杌迷人之異。真可謂槃根錯節之義。鏘	依 事 之 殊 迷 杌 迷 人 之 異 真 可 謂 槃 根 錯 節 之 義 鏘 
X58n1013_001:0514b17	金振玉之文。不學而知。但聞其言。未見其人哉。非欲	金 振 玉 之 文 不 學 而 知 但 聞 其 言 未 見 其 人 哉 非 欲 
X58n1013_001:0514b18	成一家之說。用塞學者之問耳。同心之士。毋我笑焉。	成 一 家 之 說 用 塞 學 者 之 問 耳 同 心 之 士 毋 我 笑 焉 
X58n1013_001:0514b19	壬寅正月望。	壬 寅 正 月 望 
X58n1013_001:0514b20	今釋此文。略有四十四章。	今 釋 此 文 略 有 四 十 四 章 
X58n1013_001:0514b21	一百法義迷諦義大乘伏斷義	一 百 法 義 迷 諦 義 大 乘 伏 斷 義 
X58n1013_001:0514b22	小乘伏斷義緣覺伏斷義大乘資粮加行義	小 乘 伏 斷 義 緣 覺 伏 斷 義 大 乘 資 粮 加 行 義 
X58n1013_001:0514b23	見道義相見道緣義	見 道 義 相 見 道 緣 義 
X58n1013_001:0514b24	頓漸斷二師有十四解十一解相見道安立諦義	頓 漸 斷 二 師 有 十 四 解 十 一 解 相 見 道 安 立 諦 義 
X58n1013_001:0514c01	六現觀義修道義十地作釋義	六 現 觀 義 修 道 義 十 地 作 釋 義 
X58n1013_001:0514c02	十勝行義十重障義十真如義	十 勝 行 義 十 重 障 義 十 真 如 義 
X58n1013_001:0514c03	轉依義四涅槃義四智義	轉 依 義 四 涅 槃 義 四 智 義 
X58n1013_001:0514c04	三境義假我法義二十七聖義	三 境 義 假 我 法 義 二 十 七 聖 義 
X58n1013_001:0514c05	表無表義問答料揀義自共相義	表 無 表 義 問 答 料 揀 義 自 共 相 義 
X58n1013_001:0514c06	種子六義殘果義能熏新熏義	種 子 六 義 殘 果 義 能 熏 新 熏 義 
X58n1013_001:0514c07	四分義迷杌義四業義	四 分 義 迷 杌 義 四 業 義 
X58n1013_001:0514c08	滅盡定義五果義因緣義	滅 盡 定 義 五 果 義 因 緣 義 
X58n1013_001:0514c09	等無間義所緣緣義增上緣義	等 無 間 義 所 緣 緣 義 增 上 緣 義 
X58n1013_001:0514c10	十因十五依義福非福義八解義	十 因 十 五 依 義 福 非 福 義 八 解 義 
X58n1013_001:0514c11	名色支義揀十二有支漏俱義	名 色 支 義 揀 十二有支 漏 俱 義 
X58n1013_001:0514c12	二種生死義	二 種 生 死 義 
X58n1013_001:0514c13	一百法義	一 百 法 義 
X58n1013_001:0514c14	唯遮心外境。以見所變相揀之識。表心不空。故說五	唯 遮 心 外 境 以 見 所 變 相 揀 之 識 表 心 不 空 故 說 五 
X58n1013_001:0514c15	位。共一百法。一自性有八。一眼識。二耳。三鼻。四舌。五	位 共 一 百 法 一 自 性 有 八 一 眼 識 二 耳 三 鼻 四 舌 五 
X58n1013_001:0514c16	身。六意。七根。八異熟。二相應五十一。遍行五。別境五。	身 六 意 七 根 八 異 熟 二 相 應 五 十 一 遍 行 五 別 境 五 
X58n1013_001:0514c17	善十一。根隨二十六。不定四。三分位有十一。色聲香	善 十 一 根 隨 二 十 六 不 定 四 三 分 位 有 十 一 色 聲 香 
X58n1013_001:0514c18	味觸法。眼耳鼻舌身浮塵根。四差別二十四。一得。二	味 觸 法 眼 耳 鼻 舌 身 浮 塵 根 四 差 別 二 十 四 一 得 二 
X58n1013_001:0514c19	命根。三眾同分。四異生性。五無想定。五實性有六。一	命 根 三 眾 同 分 四 異 生 性 五 無 想 定 五 實 性 有 六 一 
X58n1013_001:0514c20	擇滅。二非擇滅。三想受滅。不動。虗空。真如。	擇 滅 二 非 擇 滅 三 想 受 滅 不 動 虗 空 真 如 
X58n1013_001:0514c21	識自性者	識 自 性 者 
X58n1013_001:0514c22	前五識。通善不善無記。唯緣現量因。第六引亦有	前 五 識 通 善不善無記 唯 緣 現 量 因 第 六 引 亦 有 
X58n1013_001:0514c23	任運分別。三十一心所俱。唯薰相分名言種。與	任 運 分 別 三 十 一 心 所 俱 唯 薰 相 分 名 言 種 與 
X58n1013_001:0514c24	當報親因。	當 報 親 因 
X58n1013_001:0515a01	六意識。具三性。通俱生分別。緣現比非三量。招總	六 意 識 具 三 性 通 俱 生 分 別 緣 現 比 非 三 量 招 總 
X58n1013_001:0515a02	別報。五十一心所俱。薰見相分種。一念善惡業。	別 報 五 十 一 心 所 俱 薰 見 相 分 種 一 念 善 惡 業 
X58n1013_001:0515a03	總報增上緣。	總 報 增 上 緣 
X58n1013_001:0515a04	七末那識。有覆無記性。唯緣非量。執第八為我。十	七 末 那 識 有覆無記 性 唯 緣 非 量 執 第 八 為 我 十 
X58n1013_001:0515a05	八心所相續不斷。二執常起。薰見分種。與相貌	八 心 所 相續不斷 二 執 常 起 薰 見 分 種 與 相 貌 
X58n1013_001:0515a06	差別增上緣。	差 別 增 上 緣 
X58n1013_001:0515a07	八藏識。無覆無記性。遍行五心所俱。唯緣現量種	八 藏 識 無覆無記性 遍 行 五 心 所 俱 唯 緣 現 量 種 
X58n1013_001:0515a08	子根身器界。藏漏無漏種。雖非煩惱。然是報體。	子 根 身 器 界 藏 漏 無 漏 種 雖 非 煩 惱 然 是 報 體 
X58n1013_001:0515a09	前異熟滅。後異熟生。無記有四。一威儀。二工巧。	前 異 熟 滅 後 異 熟 生 無 記 有 四 一 威 儀 二 工 巧 
X58n1013_001:0515a10	三變化。四異熟。前三無記。薰名言種。第四無記	三 變 化 四 異 熟 前 三 無 記 薰 名 言 種 第 四 無 記 
X58n1013_001:0515a11	劣。第八全。前六一分。但酧前世因。更不薰種子。	劣 第 八 全 前 六 一 分 但 酧 前 世 因 更 不 薰 種 子 
X58n1013_001:0515a12	識相應者	識 相 應 者 
X58n1013_001:0515a13	恒依心起。與心相應。繫屬於心。取境行相。顯體	恒 依 心 起 與 心 相 應 繫 屬 於 心 取 境 行 相 顯 體 
X58n1013_001:0515a14	外皆作用。遍行有五。遍在八識。三性三界三世	外 皆 作 用 遍 行 有 五 遍 在 八 識 三 性 三 界 三 世 
X58n1013_001:0515a15	有漏無漏。	有漏無漏 
X58n1013_001:0515a16	一觸。謂三和分別變易。令心心所觸境為性。受想	一 觸 謂 三 和 分 別 變 易 令 心 心 所 觸 境 為 性 受 想 
X58n1013_001:0515a17	思等所依為業。根境識三。更相隨順。觸依彼生。	思 等 所 依 為 業 根 境 識 三 更 相 隨 順 觸 依 彼 生 
X58n1013_001:0515a18	令彼和合。互為因果。順生心所功能名變易。觸	令 彼 和 合 互 為 因 果 順 生 心 所 功 能 名 變 易 觸 
X58n1013_001:0515a19	似彼生名分別。	似 彼 生 名 分 別 
X58n1013_001:0515a20	二作意。是意之作。警心為性。於應起者。或現識同	二 作 意 是 意 之 作 警 心 為 性 於 應 起 者 或 現 識 同 
X58n1013_001:0515a21	時。於所緣境引心為業。警心心所。令趣前境。	時 於 所 緣 境 引 心 為 業 警 心 心 所 令 趣 前 境 
X58n1013_001:0515a22	三受。領納為性。起愛為業。然境界受非共餘法。於	三 受 領 納 為 性 起 愛 為 業 然 境 界 受 非 共 餘 法 於 
X58n1013_001:0515a23	逆順俱非境。定屬己者。名境界受。	逆 順 俱 非 境 定 屬 己 者 名 境 界 受 
X58n1013_001:0515a24	四想。取像為性。施設種種名言為業。從因從果。取	四 想 取 像 為 性 施 設 種 種 名 言 為 業 從 因 從 果 取 
X58n1013_001:0515b01	青黃等共相境。起言說故。	青 黃 等 共 相 境 起 言 說 故 
X58n1013_001:0515b02	五思。令心造作為性。於善惡境役心為業。正因邪	五 思 令心造作 為 性 於 善 惡 境 役 心 為 業 正 因 邪 
X58n1013_001:0515b03	因俱非相。是所發身語因即是相。所以有三。	因 俱 非 相 是 所 發 身 語 因 即 是 相 所 以 有 三 
X58n1013_001:0515b04	別境有五	別 境 有 五 
X58n1013_001:0515b05	此五緣四境起。一所樂。二決定。三曾習。四所觀。	此 五 緣 四 境 起 一 所 樂 二 決 定 三 曾 習 四 所 觀 
X58n1013_001:0515b06	五所觀。皆有所緣境事。多分不同不定俱起。	五 所 觀 皆 有 所 緣 境 事 多 分 不 同 不 定 俱 起 
X58n1013_001:0515b07	一欲。於所樂境。欲觀察者。皆有欲生。任運即無。希	一 欲 於 所 樂 境 欲 觀 察 者 皆 有 欲 生 任 運 即 無 希 
X58n1013_001:0515b08	望為性。懃依為業。懃通三性。於不善懃即是懈	望 為 性 懃 依 為 業 懃 通 三 性 於 不 善 懃 即 是 懈 
X58n1013_001:0515b09	怠。於無記懃即是勝解。於善懃即是精進。境有	怠 於 無 記 懃 即 是 勝 解 於 善 懃 即 是 精 進 境 有 
X58n1013_001:0515b10	三解。一所欣。二所求。三所觀察。	三 解 一 所 欣 二 所 求 三 所 觀 察 
X58n1013_001:0515b11	二勝解。於決定境。印持為性。不可引轉為業。於邪	二 勝 解 於 決 定 境 印 持 為 性 不 可 引 轉 為 業 於 邪 
X58n1013_001:0515b12	正俱非教印持。更有異緣。不能引轉。於猶豫境	正 俱 非 教 印 持 更 有 異 緣 不 能 引 轉 於 猶 豫 境 
X58n1013_001:0515b13	即無。	即 無 
X58n1013_001:0515b14	三念。於曾習境。令心明記為性。定依為業。體境類	三 念 於 曾 習 境 令 心 明 記 為 性 定 依 為 業 體 境 類 
X58n1013_001:0515b15	境。應分四句。一染心。緣苦集體。是體家類。二染	境 應 分 四 句 一 染 心 緣 苦 集 體 是 體 家 類 二 染 
X58n1013_001:0515b16	心。緣無漏名。是名家類。三見道。證真如體。是名	心 緣 無 漏 名 是 名 家 類 三 見 道 證 真 如 體 是 名 
X58n1013_001:0515b17	家類。四無漏心。緣苦集名。是體家類。	家 類 四 無 漏 心 緣 苦 集 名 是 體 家 類 
X58n1013_001:0515b18	前五第八汎觀不名類境。非是曾習。故不起念。	前 五 第 八 汎 觀 不 名 類 境 非 是 曾 習 故 不 起 念 
X58n1013_001:0515b19	四定。於所觀境。令心專注不散為性。智依為業。於	四 定 於 所 觀 境 令心專注 不 散 為 性 智 依 為 業 於 
X58n1013_001:0515b20	得失非境中決擇智。生心專注。言非唯一境。不	得 失 非 境 中 決 擇 智 生 心 專 注 言 非 唯 一 境 不 
X58n1013_001:0515b21	爾見道十六心。應無智定生。若不專注。無有定	爾 見 道 十 六 心 應 無 智 定 生 若 不 專 注 無 有 定 
X58n1013_001:0515b22	生。故非遍行。	生 故 非 遍 行 
X58n1013_001:0515b23	五慧。於所觀境。揀擇為性。斷疑為業。於得失俱非	五 慧 於 所 觀 境 揀 擇 為 性 斷 疑 為 業 於 得 失 俱 非 
X58n1013_001:0515b24	境中慧推求。若愚昧心中無有揀擇。故非遍行。	境 中 慧 推 求 若 愚 昧 心 中 無 有 揀 擇 故 非 遍 行 
X58n1013_001:0515c01	此五緣四種境生。非定俱起。應說此五。單單起	此 五 緣 四 種 境 生 非 定 俱 起 應 說 此 五 單 單 起 
X58n1013_001:0515c02	有五。能所別觀。唯於所觀境。別起定慧。為止散	有 五 能 所 別 觀 唯 於 所 觀 境 別 起 定 慧 為 止 散 
X58n1013_001:0515c03	心。而不揀擇。有定無慧。如戲忘天。或於所觀不	心 而 不 揀 擇 有 定 無 慧 如 戲 忘 天 或 於 所 觀 不 
X58n1013_001:0515c04	專注。推求法相。有慧無定。	專 注 推 求 法 相 有 慧 無 定 
X58n1013_001:0515c05	諸門料揀有十一	諸 門 料 揀 有 十 一 
X58n1013_001:0515c06	一列名。二出體。三業。四八識有無。有義。前五識	一 列 名 二 出 體 三 業 四 八 識 有 無 有 義 前 五 識 
X58n1013_001:0515c07	無此自性散動。不能推度。有義前五容有。雖無	無 此 自 性 散 動 不 能 推 度 有 義 前 五 容 有 雖 無 
X58n1013_001:0515c08	增上別境。亦有微劣樂欲。未自在位。五八全無。	增 上 別 境 亦 有 微 劣 樂 欲 未 自 在 位 五 八 全 無 
X58n1013_001:0515c09	六七一分。得自在時。八地已去。八種識心。此五	六 七 一 分 得 自 在 時 八 地 已 去 八 種 識 心 此 五 
X58n1013_001:0515c10	定有。如遍行五。	定 有 如 遍 行 五 
X58n1013_001:0515c11	五五受相應。有義樂欲除憂苦。餘四通三受。有	五 五 受 相 應 有 義 樂 欲 除 憂 苦 餘 四 通 三 受 有 
X58n1013_001:0515c12	義五受俱相應。論說憂根。於無上法。思慕愁戚。	義 五 受 俱 相 應 論 說 憂 根 於 無 上 法 思 慕 愁 戚 
X58n1013_001:0515c13	求欲證故。於淺苦處。求解脫故。此五復依三性	求 欲 證 故 於 淺 苦 處 求 解 脫 故 此 五 復 依 三 性 
X58n1013_001:0515c14	三學三斷漏無漏報非報六門。與煩惱隨惑善	三 學 三 斷 漏 無 漏 報 非 報 六 門 與 煩 惱 隨 惑 善 
X58n1013_001:0515c15	心等。或俱或不俱。至下當知。	心 等 或 俱 或 不 俱 至 下 當 知 
X58n1013_001:0515c16	善十一者。唯善心俱。名善心所。謂信慚等。定有十	善 十 一 者 唯 善 心 俱 名 善 心 所 謂 信 慚 等 定 有 十 
X58n1013_001:0515c17	一。合為八。	一 合 為 八 
X58n1013_001:0515c18	一信。於實德能。(處也)深忍樂欲。(果也)心淨為性。對	一 信 於 實 德 能 處 也 深 忍 樂 欲 果 也 心 淨 為 性 對 
X58n1013_001:0515c19	治不信為業。自性澄清。能淨餘心所。是信別相。	治 不 信 為 業 自 性 澄 清 能 淨 餘 心 所 是 信 別 相 
X58n1013_001:0515c20	實中通三性。實招當報。漏無漏一切法德中唯	實 中 通 三 性 實 招 當 報 漏 無 漏 一 切 法 德 中 唯 
X58n1013_001:0515c21	善。三寶有六。一住持。塑畫佛。黃卷法。染衣僧。二	善 三 寶 有 六 一 住 持 塑 畫 佛 黃 卷 法 染 衣 僧 二 
X58n1013_001:0515c22	小乘。丈六佛。阿含法。四果僧。三地前。千丈佛。住	小 乘 丈 六 佛 阿 含 法 四 果 僧 三 地 前 千 丈 佛 住 
X58n1013_001:0515c23	行向法。三賢僧。四地上。十重他受用佛。十度隨	行 向 法 三 賢 僧 四 地 上 十 重 他 受 用 佛 十 度 隨 
X58n1013_001:0515c24	增法。十地菩薩僧。五等覺。報身佛。圓融法。補處	增 法 十地菩薩 僧 五 等 覺 報 身 佛 圓 融 法 補 處 
X58n1013_001:0516a01	一生僧。六一心。覺照佛。軌持法。無諍僧。	一 生 僧 六 一 心 覺 照 佛 軌 持 法 無 諍 僧 
X58n1013_001:0516a02	二慚愧合說。崇重賢善。是慚別相。輕拒暴惡。是愧	二 慚 愧 合 說 崇 重 賢 善 是 慚 別 相 輕 拒 暴 惡 是 愧 
X58n1013_001:0516a03	別相。於聖教力生慚緣。於世間力生愧緣。賢人	別 相 於 聖 教 力 生 慚 緣 於 世 間 力 生 愧 緣 賢 人 
X58n1013_001:0516a04	善法顯慚緣。惡人惡法顯愧緣。羞恥過罪。是二	善 法 顯 慚 緣 惡 人 惡 法 顯 愧 緣 羞 恥 過 罪 是 二 
X58n1013_001:0516a05	通相。此二不必雙具。隨緣一境。增劣不同。淨土	通 相 此 二 不 必 雙 具 隨 緣 一 境 增 劣 不 同 淨 土 
X58n1013_001:0516a06	中亦有愧生。	中 亦 有 愧 生 
X58n1013_001:0516a07	三無貪等三根。如何名根。生善勝故。對治不善故。	三 無 貪 等 三 根 如 何 名 根 生 善 勝 故 對 治 不 善 故 
X58n1013_001:0516a08	名為善根。	名 為 善 根 
X58n1013_001:0516a09	無貪。於有有具。三界五蘊也。無染為性。對治貪。	無 貪 於 有 有 具 三 界 五 蘊 也 無 染 為 性 對 治 貪 
X58n1013_001:0516a10	生善為業。	生 善 為 業 
X58n1013_001:0516a11	無嗔。於苦苦具。三界五蘊。無恚為性。生善為業。	無 嗔 於 苦 苦 具 三 界 五 蘊 無 恚 為 性 生 善 為 業 
X58n1013_001:0516a12	無癡於諸理事。無闇為性。別有自性。生善為業。	無 癡 於 諸 理 事 無 闇 為 性 別 有 自 性 生 善 為 業 
X58n1013_001:0516a13	四勤。謂精進勇捍為性。勇非染法。捍非無記。三善	四 勤 謂 精 進 勇 捍 為 性 勇 非 染 法 捍 非 無 記 三 善 
X58n1013_001:0516a14	根後。起治懈怠。	根 後 起 治 懈 怠 
X58n1013_001:0516a15	五輕安。有云。欲界有遍。於善心引定者。亦有調暢。	五 輕 安 有 云 欲 界 有 遍 於 善 心 引 定 者 亦 有 調 暢 
X58n1013_001:0516a16	有云。欲界無輕安。不遍善心。唯定地有。堪任為	有 云 欲 界 無 輕 安 不 遍 善 心 唯 定 地 有 堪 任 為 
X58n1013_001:0516a17	性。對治昏沉。	性 對 治 昏 沉 
X58n1013_001:0516a18	六不放逸。即用無貪及勤四法為體。於所修事。防	六 不 放 逸 即 用 無 貪 及 勤 四 法 為 體 於 所 修 事 防 
X58n1013_001:0516a19	修為性。雖信慚等亦有此能。而非根依。	修 為 性 雖 信 慚 等 亦 有 此 能 而 非 根 依 
X58n1013_001:0516a20	七行捨。於念中平等正直而住。由不放逸。先除雜	七 行 捨 於 念 中 平 等 正 直 而 住 由 不 放 逸 先 除 雜 
X58n1013_001:0516a21	染已行捨。令心淨住。對治掉舉。	染 已 行 捨 令 心 淨 住 對 治 掉 舉 
X58n1013_001:0516a22	八不害。於諸有情。不惱為性。無嗔實有不害。依彼	八 不 害 於諸有情 不 惱 為 性 無 嗔 實 有 不 害 依 彼 
X58n1013_001:0516a23	一分假立。無嗔與樂。不害拔苦。為顯慈悲二相	一 分 假 立 無 嗔 與 樂 不 害 拔 苦 為 顯 慈 悲 二 相 
X58n1013_001:0516a24	別故。	別 故 
X58n1013_001:0516b01	諸門料揀有十二	諸 門 料 揀 有 十 二 
X58n1013_001:0516b02	一列名。二出體如文。問寧淨少染。答。據實等。約	一 列 名 二 出 體 如 文 問 寧 淨 少 染 答 據 實 等 約 
X58n1013_001:0516b03	迷悟通局不同。三業用。四三假。不放逸行捨不	迷 悟 通 局 不 同 三 業 用 四 三 假 不放逸行 捨 不 
X58n1013_001:0516b04	害。餘八實有。五自類俱起。有云。十一中。四遍善	害 餘 八 實 有 五 自 類 俱 起 有 云 十 一 中 四 遍 善 
X58n1013_001:0516b05	心。為信與三根。餘七不定。有云。十遍善心。報得	心 為 信 與 三 根 餘 七 不 定 有 云 十 遍 善 心 報 得 
X58n1013_001:0516b06	輕安。在定地有六。八識隨位有無不定。前六定	輕 安 在 定 地 有 六 八 識 隨 位 有 無 不 定 前 六 定 
X58n1013_001:0516b07	地皆有。散闕輕安。七八因無果有。七十法與五	地 皆 有 散 闕 輕 安 七 八 因 無 果 有 七 十 法 與 五 
X58n1013_001:0516b08	受俱。除憂受苦受。遍三界故。八此十與遍行別	受 俱 除 憂 受 苦 受 遍 三 界 故 八 此 十 與 遍 行 別 
X58n1013_001:0516b09	境皆不違。得俱起故。遍漏無漏故。九此十三性	境 皆 不 違 得 俱 起 故 遍 漏 無 漏 故 九 此 十 三 性 
X58n1013_001:0516b10	中唯善。十此十欲界除輕安。餘十通三界。十一	中 唯 善 十 此 十 欲 界 除 輕 安 餘 十 通 三 界 十 一 
X58n1013_001:0516b11	此十學無學皆通。十二此十一非見所斷。通修	此 十 學 無 學 皆 通 十 二 此 十 一 非 見 所 斷 通 修 
X58n1013_001:0516b12	所斷者。是有漏善。及非所斷者。是劣無漏。信等	所 斷 者 是 有 漏 善 及 非 所 斷 者 是 劣 無 漏 信 等 
X58n1013_001:0516b13	五根。	五 根 
X58n1013_001:0516b14	染淨相翻頌曰。	染 淨 相 翻 頌 曰 
X58n1013_001:0516b15	　行相相翻捨慢悼　　疑見三大性對治	 行 相 相 翻 捨 慢 悼 疑 見 三 大 性 對 治 
X58n1013_001:0516b16	　根三大四小中隨　　總名染淨相翻義	 根 三 大 四 小 中 隨 總 名 染 淨 相 翻 義 
X58n1013_001:0516b17	若此行違彼行。即行相相翻。若違彼體。即體性	若 此 行 違 彼 行 即 行 相 相 翻 若 違 彼 體 即 體 性 
X58n1013_001:0516b18	行相俱相翻。若通三性。雜善染者。翻入別境性。	行 相 俱 相 翻 若 通 三 性 雜 善 染 者 翻 入 別 境 性 
X58n1013_001:0516b19	對治善慧性。治染慧。根本煩惱有六。諸論立名	對 治 善 慧 性 治 染 慧 根本煩惱 有 六 諸 論 立 名 
X58n1013_001:0516b20	不同。有三解。一五蘊論。疑俱二見之後。彼約唯	不 同 有 三 解 一 五 蘊 論 疑 俱 二 見 之 後 彼 約 唯 
X58n1013_001:0516b21	分別者。通俱生分別在前。二百法論。無明在慢	分 別 者 通 俱 生 分 別 在 前 二 百 法 論 無 明 在 慢 
X58n1013_001:0516b22	後。彼約通利鈍者在先。五見及疑。唯利惑迷理。	後 彼 約 通 利 鈍 者 在 先 五 見 及 疑 唯 利 惑 迷 理 
X58n1013_001:0516b23	貪嗔慢。通迷事理。三唯識論。為不善根在前。所	貪 嗔 慢 通 迷 事 理 三 唯 識 論 為 不 善 根 在 前 所 
X58n1013_001:0516b24	以慢非不善根。在無明後。	以 慢 非 不 善 根 在 無 明 後 
X58n1013_001:0516c01	一貪。於有有具。染著為性。	一 貪 於 有 有 具 染 著 為 性 
X58n1013_001:0516c02	二嗔。於苦苦具。增恚為性。	二 嗔 於 苦 苦 具 增 恚 為 性 
X58n1013_001:0516c03	三癡。於諸理事。迷暗為性。此三皆能生苦為業。	三 癡 於 諸 理 事 迷 暗 為 性 此 三 皆 能 生 苦 為 業 
X58n1013_001:0516c04	四慢。恃己於他高舉為性。能障不慢。生苦為業。於	四 慢 恃 己 於 他 高 舉 為 性 能 障 不 慢 生 苦 為 業 於 
X58n1013_001:0516c05	德有德。心不謙下。輪轉受苦。故有七體九類。於	德 有 德 心 不 謙 下 輪 轉 受 苦 故 有 七 體 九 類 於 
X58n1013_001:0516c06	三品境。起三品心。勝劣分上下。齊等便為中。前	三 品 境 起 三 品 心 勝 劣 分 上 下 齊 等 便 為 中 前 
X58n1013_001:0516c07	四慢。緣外境起他我見。是凌減慢。後三緣內我	四 慢 緣 外 境 起 他 我 見 是 凌 減 慢 後 三 緣 內 我 
X58n1013_001:0516c08	見。起恃己慢。無別法數。故不立類。七體者。一單	見 起 恃 己 慢 無 別 法 數 故 不 立 類 七 體 者 一 單 
X58n1013_001:0516c09	慢。於下品境。起於劣計己勝。於中品境。於等計	慢 於 下 品 境 起 於 劣 計 己 勝 於 中 品 境 於 等 計 
X58n1013_001:0516c10	己等。二過慢。於中品境。起於等計己勝。於上品	己 等 二 過 慢 於 中 品 境 起 於 等 計 己 勝 於 上 品 
X58n1013_001:0516c11	境。起於勝計己等。三慢過慢。唯上品境。起於勝	境 起 於 勝 計 己 等 三 慢 過 慢 唯 上 品 境 起 於 勝 
X58n1013_001:0516c12	計己勝。四卑慢。唯上品起。五增上慢。少得為多。	計 己 勝 四 卑 慢 唯 上 品 起 五 增 上 慢 少 得 為 多 
X58n1013_001:0516c13	六我慢。計蘊為我。七邪慢。全無為有。九類者。我	六 我 慢 計 蘊 為 我 七 邪 慢 全 無 為 有 九 類 者 我 
X58n1013_001:0516c14	勝。(過慢類)我等。(慢類)我劣。([(白日+田)/廾]慢類)有我勝。([(白日+田)/廾]慢)有我劣。(過慢	勝 過 慢 類 我 等 慢 類 我 劣 [白日田廾]慢類有我勝[白日田廾] 慢 有 我 劣 過 慢 
X58n1013_001:0516c15	類)無我勝。(慢類)無我劣。([(白日+田)/廾]慢類)無我等。(過慢類)前三類。	類 無 我 勝 慢 類 無 我 劣 [白日田廾] 慢 類 無 我 等 過 慢 類 前 三 類 
X58n1013_001:0516c16	將自望他。後六類。將他望自。有是表義。無是遮	將 自 望 他 後 六 類 將 他 望 自 有 是 表 義 無 是 遮 
X58n1013_001:0516c17	義。所緣境上品。能緣心下品。本論云。六於中上	義 所 緣 境 上 品 能 緣 心 下 品 本 論 云 六 於 中 上 
X58n1013_001:0516c18	生。三於卑慢生。是我劣有勝無劣。若依品類足	生 三 於 卑 慢 生 是 我 劣 有 勝 無 劣 若 依 品 類 足 
X58n1013_001:0516c19	論。三依一品生。為我勝有劣無等。皆過慢類。三	論 三 依 一 品 生 為 我 勝 有 劣 無 等 皆 過 慢 類 三 
X58n1013_001:0516c20	依三品生。為我等有劣無劣。依三一品生。我勝	依 三 品 生 為 我 等 有 劣 無 劣 依 三 一 品 生 我 勝 
X58n1013_001:0516c21	有劣無劣。皆卑慢類。本論則多分。不同足論。則	有 劣 無 劣 皆 卑 慢 類 本 論 則 多 分 不 同 足 論 則 
X58n1013_001:0516c22	即復有過。	即 復 有 過 
X58n1013_001:0516c23	五疑。於諸理事。猶豫為性。能障不疑。於他世因果。	五 疑 於 諸 理 事 猶 豫 為 性 能 障 不 疑 於 他 世 因 果 
