X58n1013_001:0523c16	七迷第八識事。起於二執俱淺。若迷第八法空理。二	七 迷 第 八 識 事 起 於 二 執 俱 淺 若 迷 第 八 法 空 理 二 
X58n1013_001:0523c17	執俱深。問若迷生空理。為深何過。答法寬我狹。善法	執 俱 深 問 若 迷 生 空 理 為 深 何 過 答 法 寬 我 狹 善 法 
X58n1013_001:0523c18	師云。愚伸此解。望契聖心。立筌來慕。宜應共悉。天微	師 云 愚 伸 此 解 望 契 聖 心 立 筌 來 慕 宜 應 共 悉 天 微 
X58n1013_001:0523c19	抄曾不屬心。諸百法章安得意。遂使學者。俱迷至理。	抄 曾 不 屬 心 諸 百 法 章 安 得 意 遂 使 學 者 俱 迷 至 理 
X58n1013_001:0523c20	競執譊訛。違背聖言。	競 執 譊 訛 違 背 聖 言 
X58n1013_001:0523c21	四業義	四 業 義 
X58n1013_001:0523c22	第六識中。一念分別。別善惡業。招當來總報。諸教異	第 六 識 中 一 念 分 別 別 善 惡 業 招 當 來 總 報 諸 教 異 
X58n1013_001:0523c23	說。有二種二受。一決定受三時俱勝。二不決定或闕	說 有 二 種 二 受 一 決 定 受 三 時 俱 勝 二 不 決 定 或 闕 
X58n1013_001:0523c24	一。二有二種四受。一唯識論中四受。一順現決定受。	一 二 有 二 種 四 受 一 唯 識 論 中 四 受 一 順 現 決 定 受 
X58n1013_001:0524a01	(上品別報)二順生決定受。(上品總報)三順後決定受。(中品有闕)四順	 上 品 別 報 二 順 生 決 定 受 上 品 總 報 三 順 後 決 定 受 中 品 有 闕 四 順 
X58n1013_001:0524a02	不定受。(悔所損無知造)瑜伽論中四受。一時定報不定。二報	不 定 受 悔 所 損 無 知 造 瑜 伽 論 中 四 受 一 時 定 報 不 定 二 報 
X58n1013_001:0524a03	定時不定。三時報俱定。四時報俱不定。若互相攝者。	定 時 不 定 三 時 報 俱 定 四 時 報 俱 不 定 若 互 相 攝 者 
X58n1013_001:0524a04	唯是不定業。總収餘者。唯識論中三種決定業。収瑜	唯 是 不 定 業 總 収 餘 者 唯 識 論 中 三 種 決 定 業 収 瑜 
X58n1013_001:0524a05	伽論中。収第三時報俱定。収唯識論中前三句。却瑜	伽 論 中 収 第 三 時 報 俱 定 収 唯 識 論 中 前 三 句 却 瑜 
X58n1013_001:0524a06	伽論中一二四句。収唯識論第四句。若定業収三。不	伽 論 中 一 二 四 句 収 唯 識 論 第 四 句 若 定 業 収 三 不 
X58n1013_001:0524a07	定業唯一。若定業収一。不定業収三。其造業性。定雖	定 業 唯 一 若 定 業 収 一 不 定 業 収 三 其 造 業 性 定 雖 
X58n1013_001:0524a08	經多劫。排之不受其業。現生後受。不改本名。從初造	經 多 劫 排 之 不 受 其 業 現 生 後 受 不 改 本 名 從 初 造 
X58n1013_001:0524a09	因業性定故。又有二種五業。一顯揚論五業。一順生。	因 業 性 定 故 又 有 二 種 五 業 一 顯 揚 論 五 業 一 順 生 
X58n1013_001:0524a10	二順現。三順後。四異熟。五作業。各有決定二字。集論	二 順 現 三 順 後 四 異 熟 五 作 業 各 有 決 定 二 字 集 論 
X58n1013_001:0524a11	中五業。一故思造時他教。二他勸。三無知造。四執着。	中 五 業 一 故 思 造 時 他 教 二 他 勸 三 無 知 造 四 執 着 
X58n1013_001:0524a12	五妄想。初三不增長。不定受後。二增長時。報定受。	五 妄 想 初 三 不 增 長 不 定 受 後 二 增 長 時 報 定 受 
X58n1013_001:0524a13	滅盡定義	滅 盡 定 義 
X58n1013_001:0524a14	滅盡定者。為有無學。或有學聖已伏。或離無所有。貪	滅 盡 定 者 為 有 無 學 或 有 學 聖 已 伏 或 離 無 所 有 貪 
X58n1013_001:0524a15	上貪不定。由止息想。作意為先。令不恒行。第六識滅。	上 貪 不 定 由 止 息 想 作 意 為 先 令 不 恒 行 第 六 識 滅 
X58n1013_001:0524a16	恒行染污。第七滅總名滅盡。主名無心。別名滅。受想	恒 行 染 污 第 七 滅 總 名 滅 盡 主 名 無 心 別 名 滅 受 想 
X58n1013_001:0524a17	此定唯聖非凡。初起必依有頂。遊觀加行。而入根本。	此 定 唯 聖 非 凡 初 起 必 依 有 頂 遊 觀 加 行 而 入 根 本 
X58n1013_001:0524a18	無漏定中。最居後故。若久修此定。已得自在。餘地心	無 漏 定 中 最 居 後 故 若 久 修 此 定 已 得 自 在 餘 地 心 
X58n1013_001:0524a19	後。亦得現前。若遠超者。從初禪次念。起非想心。為加	後 亦 得 現 前 若 遠 超 者 從 初 禪 次 念 起 非 想 心 為 加 
X58n1013_001:0524a20	行而入。若近起者。由串習力。不起非想心。便入滅定。	行 而 入 若 近 起 者 由 串 習 力 不 起 非 想 心 便 入 滅 定 
X58n1013_001:0524a21	要斷三界見惑修惑。斷下四地障定強故。上五地修	要 斷 三 界 見 惑 修 惑 斷 下 四 地 障 定 強 故 上 五 地 修 
X58n1013_001:0524a22	惑伏斷至非想時。作三類厭心。至微微心時。二十二	惑 伏 斷 至 非 想 時 作 三 類 厭 心 至 微 微 心 時 二 十 二 
X58n1013_001:0524a23	法。為彼定體。遍行五。別境五。善十一。心王現行。脚下	法 為 彼 定 體 遍 行 五 別 境 五 善 十 一 心 王 現 行 脚 下 
X58n1013_001:0524a24	種子。上有礙心。功能名為定體。	種 子 上 有 礙 心 功 能 名 為 定 體 
X58n1013_001:0524b01	初果迴心。向大趣。滅盡定者。六人二果。迴心向大趣。	初 果 迴 心 向 大 趣 滅 盡 定 者 六 人 二 果 迴心向大 趣 
X58n1013_001:0524b02	滅者有三人。身正還迴心趣。滅有七十二人。若不迴	滅 者 有 三 人 身 正 還 迴 心 趣 滅 有 七 十 二 人 若 不 迴 
X58n1013_001:0524b03	心有不入者。初果二果。非身證不還。獨覺一分。除步	心 有 不 入 者 初 果 二 果 非 身 證 不 還 獨 覺 一 分 除 步 
X58n1013_001:0524b04	行入地。除悲增者。不起此定。其餘聖人皆起此定。或	行 入 地 除 悲 增 者 不 起 此 定 其 餘 聖 人 皆 起 此 定 或 
X58n1013_001:0524b05	為成就無心功德。或為止息度生勞慮。	為 成 就 無 心 功 德 或 為 止 息 度 生 勞 慮 
X58n1013_001:0524b06	五果義	五 果 義 
X58n1013_001:0524b07	體生等流異熟義。生增上士用等流。因者名言種子。	體 生 等 流 異 熟 義 生 增 上 士 用 等 流 因 者 名 言 種 子 
X58n1013_001:0524b08	親生當果。現行能酧前因。別報色心異熟因。一念善	親 生 當 果 現 行 能 酧 前 因 別 報 色 心 異 熟 因 一 念 善 
X58n1013_001:0524b09	惡業。能招一期。總報果。果體唯無記。異類而熟異時。	惡 業 能 招 一 期 總 報 果 果 體 唯 無 記 異 類 而 熟 異 時 
X58n1013_001:0524b10	而熟變異。而熟俱有勢力。是增上果。一得多報。是士	而 熟 變 異 而 熟 俱 有 勢 力 是 增 上 果 一 得 多 報 是 士 
X58n1013_001:0524b11	用果。如求成佛。生在王家。若無漏因。真實知見。離相	用 果 如 求 成 佛 生 在 王 家 若 無 漏 因 真 實 知 見 離 相 
X58n1013_001:0524b12	修因。得離繫果。三乘聖位四句。一因果俱不雜。一眼	修 因 得 離 繫 果 三 乘 聖 位 四 句 一 因 果 俱 不 雜 一 眼 
X58n1013_001:0524b13	根望眼識。增上因得增上果。二種子功能。望現行識。	根 望 眼 識 增 上 因 得 增 上 果 二 種 子 功 能 望 現 行 識 
X58n1013_001:0524b14	士用因。得士用果。三自類種子。望等流現行。等流因。	士 用 因 得 士 用 果 三 自 類 種 子 望 等 流 現 行 等 流 因 
X58n1013_001:0524b15	得等流果。四善惡業。招無記果。二因雜。等流異熟果。	得 等 流 果 四 善 惡 業 招 無 記 果 二 因 雜 等 流 異 熟 果 
X58n1013_001:0524b16	各別三果。雜因不雜。於總報上。義說四因果俱雜。於	各 別 三 果 雜 因 不 雜 於 總 報 上 義 說 四 因 果 俱 雜 於 
X58n1013_001:0524b17	等流異熟果因上。義說增上士用因果。	等 流 異 熟 果 因 上 義 說 增 上 士 用 因 果 
X58n1013_001:0524b18	因緣義	因 緣 義 
X58n1013_001:0524b19	因緣者。為有為法。親辨自體。通於三性三界九地漏	因 緣 者 為 有 為 法 親 辨 自 體 通 於 三 性 三界九地 漏 
X58n1013_001:0524b20	無漏色心別報。與後自類為因。是種引種。及同時現	無 漏 色 心 別 報 與 後 自 類 為 因 是 種 引 種 及 同 時 現 
X58n1013_001:0524b21	果。為因是種生現。此非間斷。異性若現行。與種子為	果 為 因 是 種 生 現 此 非 間 斷 異 性 若 現 行 與 種 子 為 
X58n1013_001:0524b22	因。是前七識。有漏色心三性。名言種子。在第八無記	因 是 前 七 識 有 漏 色 心 三 性 名 言 種 子 在 第 八 無 記 
X58n1013_001:0524b23	識中。含藏遇緣生現。唯除佛果無漏善法。及四無記	識 中 含 藏 遇 緣 生 現 唯 除 佛 果 無 漏 善 法 及 四 無 記 
X58n1013_001:0524b24	中劣。無記異熟生。及業招第八。非是能熏。因緣有三。	中 劣 無 記 異 熟 生 及 業 招 第 八 非 是 能 熏 因 緣 有 三 
X58n1013_001:0524c01	為現行熏種子。種子生現行。種引種下。有八句同時	為 現 行 熏 種 子 種 子 生 現 行 種 引 種 下 有 八 句 同 時 
X58n1013_001:0524c02	異時。非因緣貫下。讀之皆不親辨矣。	異 時 非 因 緣 貫 下 讀 之 皆 不 親 辨 矣 
X58n1013_001:0524c03	一種子望現行異類二現行望現行異類	一 種 子 望 現 行 異 類 二 現 行 望 現 行 異 類 
X58n1013_001:0524c04	三種望種異類四現行望種子異類	三 種 望 種 異 類 四 現 行 望 種 子 異 類 
X58n1013_001:0524c05	等無間義	等 無 間 義 
X58n1013_001:0524c06	等無間者。前聚於後自類無間等。而開導令彼定生。	等 無 間 者 前 聚 於 後 自 類 無 間 等 而 開 導 令 彼 定 生 
X58n1013_001:0524c07	唯現非種體。通三性等。望前後無間。在中前一聚。心	唯 現 非 種 體 通 三 性 等 望 前 後 無 間 在 中 前 一 聚 心 
X58n1013_001:0524c08	心所劣。後一聚心心所多用等也。若前一聚。二十二	心 所 劣 後 一 聚 心 心 所 多 用 等 也 若 前 一 聚 二 十 二 
X58n1013_001:0524c09	法。後一聚亦爾。頭數體等等無間。非俱時同類。如觸	法 後 一 聚 亦 爾 頭 數 體 等 等 無 間 非 俱 時 同 類 如 觸 
X58n1013_001:0524c10	望作意非無學。末後心以無所引。不名此緣。若此八	望 作 意 非 無 學 末 後 心 以 無 所 引 不 名 此 緣 若 此 八 
X58n1013_001:0524c11	識心無間後。念定生。說此為彼等無間緣。此三界有	識 心 無 間 後 念 定 生 說 此 為 彼 等無間緣 此 三 界 有 
X58n1013_001:0524c12	十二心上下相。引生死位。中開導故。欲界有四。一善	十 二 心 上 下 相 引 生 死 位 中 開 導 故 欲 界 有 四 一 善 
X58n1013_001:0524c13	心。二染心。三有覆。四無記。上二界除染心。加有漏各	心 二 染 心 三 有 覆 四 無 記 上 二 界 除 染 心 加 有 漏 各 
X58n1013_001:0524c14	有四。三界共十二心。三乘修行。漏無漏相引者。大乘	有 四 三 界 共 十 二 心 三 乘 修 行 漏 無 漏 相 引 者 大 乘 
X58n1013_001:0524c15	見道。六七二識。頓悟人用第四禪心。引生無漏。第八	見 道 六 七 二 識 頓 悟 人 用 第 四 禪 心 引 生 無 漏 第 八 
X58n1013_001:0524c16	前五至成佛方。有漏引生無漏鏡知。及成所作智。第	前 五 至 成 佛 方 有 漏 引 生 無 漏 鏡 知 及 成所作智 第 
X58n1013_001:0524c17	七三界漏無漏位。互引三句。一人執入種位。引生法	七 三 界 漏 無 漏 位 互 引 三 句 一 人 執 入 種 位 引 生 法 
X58n1013_001:0524c18	執生現行二人。執入種位。生空後得智。中雙執生。現	執 生 現 行 二 人 執 入 種 位 生 空 後 得 智 中 雙 執 生 現 
X58n1013_001:0524c19	行三法。執入種位。引生平等智。生現行第六識中。三	行 三 法 執 入 種 位 引 生 平 等 智 生 現 行 第 六 識 中 三 
X58n1013_001:0524c20	界九地。漏無漏位於閏生智互相引。	界 九 地 漏 無 漏 位 於 閏 生 智 互 相 引 
X58n1013_001:0524c21	二乘人漸悟通欲色界。引生無漏發心。留身不定。同	二 乘 人 漸 悟 通 欲 色 界 引 生 無 漏 發 心 留 身 不 定 同 
X58n1013_001:0524c22	界唯除五淨居人。無發大乘心者。前五識眼耳身。三	界 唯 除 五 淨 居 人 無 發大乘心 者 前 五 識 眼 耳 身 三 
X58n1013_001:0524c23	二界二地繫。上下死生相引。鼻舌二識。一界一地繫。	二 界 二 地 繫 上 下 死 生 相 引 鼻 舌 二 識 一 界 一 地 繫 
X58n1013_001:0524c24	自類相引。至成佛時。互引然五色根是第八相分。有	自 類 相 引 至 成 佛 時 互 引 然 五 色 根 是 第 八 相 分 有 
X58n1013_001:0525a01	漏根不發無漏。識具四義。第六具三義無同境。一有	漏 根 不 發 無 漏 識 具 四 義 第 六 具 三 義 無 同 境 一 有 
X58n1013_001:0525a02	漏揀佛果。二不共揀第八共依。三必俱揀第六。或不	漏 揀 佛 果 二 不 共 揀 第 八 共 依 三 必 俱 揀 第 六 或 不 
X58n1013_001:0525a03	俱。四同境揀第七。為根發第六無漏識。	俱 四 同 境 揀 第 七 為 根 發 第 六 無 漏 識 
X58n1013_001:0525a04	所緣緣義	所 緣 緣 義 
X58n1013_001:0525a05	所緣緣者。謂若有法。(非計所執為緣。能引生心)是帶己相。(己者境也。見能	所 緣 緣 者 謂 若 有 法 非 計 所 執 為 緣 能 引 生 心 是 帶 己 相 己 者 境 也 見 能 
X58n1013_001:0525a06	變相相能帶境)古云。帶為變帶。難云。若證真如不變。如相應	變 相 相 能 帶 境 古 云 帶 為 變 帶 難 云 若 證 真 如 不 變 如 相 應 
X58n1013_001:0525a07	無所緣。應說帶為狹。帶相即體相。內三分相。緣挾帶	無 所 緣 應 說 帶 為 狹 帶 相 即 體 相 內 三 分 相 緣 挾 帶 
X58n1013_001:0525a08	真如相。起變帶有三。一即智變轉地。種子歸識變。大	真 如 相 起 變 帶 有 三 一 即 智 變 轉 地 種 子 歸 識 變 大 
X58n1013_001:0525a09	地作黃金。二離質變無而忽有。三仗質變轉麤為細。	地 作 黃 金 二 離 質 變 無 而 忽 有 三 仗 質 變 轉 麤 為 細 
X58n1013_001:0525a10	浮塵不動。細相籠之。如羅漢赴供。心或相應者。(是所引能	浮 塵 不 動 細 相 籠 之 如 羅 漢 赴 供 心 或 相 應 者 是 所 引 能 
X58n1013_001:0525a11	緣義)中間相分。(是所緣能帶義)起於內所慮。相分所托。本質應	緣 義 中 間 相 分 是 所 緣 能 帶 義 起 於 內 所 慮 相 分 所 托 本 質 應 
X58n1013_001:0525a12	知彼是親所緣緣。如鏡水為緣生。於面相設。為所慮	知 彼 是 親 所 緣 緣 如 鏡 水 為 緣 生 於 面 相 設 為 所 慮 
X58n1013_001:0525a13	非是所托。如假和合。軍林設為所托。非是所慮。若與	非 是 所 托 如 假 和 合 軍 林 設 為 所 托 非 是 所 慮 若 與 
X58n1013_001:0525a14	見分體。不相離為親所緣。望他本質為踈。所緣若第	見 分 體 不 相 離 為 親 所 緣 望 他 本 質 為 踈 所 緣 若 第 
X58n1013_001:0525a15	八識仗他本質。變他浮塵。一切時中。親疎不定。若第	八 識 仗 他 本 質 變 他 浮 塵 一 切 時 中 親 疎 不 定 若 第 
X58n1013_001:0525a16	七識者。定有第六識。緣過未疎無親。有前五識。仗他	七 識 者 定 有 第 六 識 緣 過 未 疎 無 親 有 前 五 識 仗 他 
X58n1013_001:0525a17	引生。親疎定有。若內二分相緣體。挾體緣見分。緣相	引 生 親 疎 定 有 若 內 二 分 相 緣 體 挾 體 緣 見 分 緣 相 
X58n1013_001:0525a18	時用挾。用緣自證。緣見分時。體挾用緣。若相分望外。	時 用 挾 用 緣 自 證 緣 見 分 時 體 挾 用 緣 若 相 分 望 外 
X58n1013_001:0525a19	質亦挾帶。起見分相。分望外即為變帶。	質 亦 挾 帶 起 見 分 相 分 望 外 即 為 變 帶 
X58n1013_001:0525a20	增上緣義	增 上 緣 義 
X58n1013_001:0525a21	增上緣者。謂有勝勢用。於生住成得。四事中或順或	增 上 緣 者 謂 有 勝 勢 用 於 生 住 成 得 四 事 中 或 順 或 
X58n1013_001:0525a22	逆。與未生法為緣。非前滅法。如世霜雹等。望未生黃	逆 與 未 生 法 為 緣 非 前 滅 法 如 世 霜 雹 等 望 未 生 黃 
X58n1013_001:0525a23	葉。為順因。望未生青葉。作違因。如一念無明起亦爾。	葉 為 順 因 望 未 生 青 葉 作 違 因 如 一 念 無 明 起 亦 爾 
X58n1013_001:0525a24	一念無漏智生亦爾。餘三緣不収。皆入此中。應知二	一 念 無 漏 智 生 亦 爾 餘 三 緣 不 収 皆 入 此 中 應 知 二 
X58n1013_001:0525b01	十二根。即此緣性。三無漏根者。一未知當知根。從初	十 二 根 即 此 緣 性 三無漏根 者 一 未知當知根 從 初 
X58n1013_001:0525b02	發心去。至見道前十五心已來。皆是二已知根。從十	發 心 去 至 見 道 前 十 五 心 已 來 皆 是 二 已 知 根 從 十 
X58n1013_001:0525b03	六心已去。至金剛心。皆是三具知根。成佛已去。盡未	六 心 已 去 至 金 剛 心 皆 是 三 具 知 根 成 佛 已 去 盡 未 
X58n1013_001:0525b04	來際。皆是頌曰。取境(眼耳鼻舌身意)續家族。(男女二根)活命(命根)受	來 際 皆 是 頌 曰 取 境 眼 耳 鼻 舌 身 意 續 家 族 男 女 二 根 活 命 命 根 受 
X58n1013_001:0525b05	業果。(五受根也)世間(信等五也)出世淨。(三無漏根)依此量立根。又頌	業 果 五 受 根 也 世 間 信 等 五 也 出 世 淨 三無漏根 依 此 量 立 根 又 頌 
X58n1013_001:0525b06	能受隱顯境。(眼等六男女二)受用時邊際。(命根)受用發雜染。(五受)	能 受 隱 顯 境 眼 等 六 男 女 二 受 用 時 邊 際 命 根 受 用 發 雜 染 五 受 
X58n1013_001:0525b07	安立清淨故(信等五三無漏)。	安 立 清 淨 故 信 等 五 三 無 漏 
X58n1013_001:0525b08	料揀欲界繫四全。(男女憂苦)十五少分。(除三無漏)色界繫。(十五少分)	料 揀 欲 界 繫 四 全 男 女 憂 苦 十 五 少 分 除 三 無 漏 色 界 繫 十 五 少 分 
X58n1013_001:0525b09	無色界繫。八少分。(信等五意命捨)三界全不繫。欲界繫。欲界	無 色 界 繫 八 少 分 信 等 五 意 命 捨 三 界 全 不 繫 欲 界 繫 欲 界 
X58n1013_001:0525b10	為境有四。(男女憂苦)欲色二界繫。欲界為境有八。(信等五三無漏	為 境 有 四 男 女 憂 苦 欲 色 二 界 繫 欲 界 為 境 有 八 信 等 五 三 無 漏 
X58n1013_001:0525b11	一向不繫侵二根)三根證理立。善性唯八。(三無漏信等五)無記有八。	一 向 不 繫 侵 二 根 三 根 證 理 立 善 性 唯 八 三 無 漏 信 等 五 無 記 有 八 
X58n1013_001:0525b12	(眼等五男女命)通善染有六(五受意根)。	 眼 等 五 男 女 命 通 善 染 有 六 五 受 意 根 
X58n1013_001:0525b13	十因十五依義	十 因 十 五 依 義 
X58n1013_001:0525b14	如是四緣。依十五處義。差別建立十因。通於三性。清	如 是 四 緣 依 十 五 處 義 差別建立 十 因 通 於 三 性 清 
X58n1013_001:0525b15	淨十因。正得離繫果。兼得餘四果。雜染十因。正得異	淨 十 因 正 得 離 繫 果 兼 得 餘 四 果 雜 染 十 因 正 得 異 
X58n1013_001:0525b16	熟果。兼得餘三果。無記十因。正得等流果。餘三果兼	熟 果 兼 得 餘 三 果 無 記 十 因 正 得 等 流 果 餘 三 果 兼 
X58n1013_001:0525b17	得攝一切法。盡十五依處。皆作持業。若十因者。一唯	得 攝 一 切 法 盡 十 五 依 處 皆 作 持 業 若 十 因 者 一 唯 
X58n1013_001:0525b18	依主。(同事)二依士。(隨說引發定異)六作持業。(觀待牽引生。起攝受相違。不相違)。	依 主 同 事 二 依 士 隨 說 引 發 定 異 六 作 持 業 觀 待 牽 引 生 起 攝 受 相 違 不 相 違 
X58n1013_001:0525b19	一語依處。立隨說因。依處即因。因為能依。名句為所	一 語 依 處 立 隨 說 因 依 處 即 因 因 為 能 依 名 句 為 所 
X58n1013_001:0525b20	依所隨說。二領受依處。立觀待因有四。一能受為	依 所 隨 說 二 領 受 依 處 立 觀 待 因 有 四 一 能 受 為 
X58n1013_001:0525b21	因。能受為果。如依樂立苦。二所受為因。所受為果。如	因 能 受 為 果 如 依 樂 立 苦 二 所 受 為 因 所 受 為 果 如 
X58n1013_001:0525b22	待足有往來用。三能受為因。所受為果。如待欲方求	待 足 有 往 來 用 三 能 受 為 因 所 受 為 果 如 待 欲 方 求 
X58n1013_001:0525b23	噉等。獨影也。四所受為因。所受為果。如見食方求噉	噉 等 獨 影 也 四 所 受 為 因 所 受 為 果 如 見 食 方 求 噉 
X58n1013_001:0525b24	等。帶質也。三習氣依處。立牽引因。三性名言種子。	等 帶 質 也 三 習 氣 依 處 立 牽 引 因 三 性 名 言 種 子 
X58n1013_001:0525c01	未閏時。遠牽當果。四有閏種子依處。立生起因。即	未 閏 時 遠 牽 當 果 四 有 閏 種 子 依 處 立 生 起 因 即 
X58n1013_001:0525c02	前種子。備間已去。五依無閏滅依處。立攝受因。為	前 種 子 備 間 已 去 五 依 無 閏 滅 依 處 立 攝 受 因 為 
X58n1013_001:0525c03	心心所。三界三性。勝劣相引。六依境界依處。除種	心 心 所 三 界 三 性 勝 劣 相 引 六 依 境 界 依 處 除 種 
X58n1013_001:0525c04	子。餘飲食等。資助親緣者。七根依處。與境界為增	子 餘 飲 食 等 資 助 親 緣 者 七 根 依 處 與 境 界 為 增 
X58n1013_001:0525c05	上。前五取色境。第六取意生於八識。八作用依處。	上 前 五 取 色 境 第 六 取 意 生 於 八 識 八 作 用 依 處 
X58n1013_001:0525c06	謂作者。作具辨。樓臺等。九士用依處。具人法。十	謂 作 者 作 具 辨 樓 臺 等 九 士 用 依 處 具 人 法 十 
X58n1013_001:0525c07	真實見依處。無漏知見。與一切法為因。具上六處。立	真 實 見 依 處 無 漏 知 見 與 一 切 法 為 因 具 上 六 處 立 
X58n1013_001:0525c08	攝受因。前五辨有漏種。具立辨無漏種。十一隨順	攝 受 因 前 五 辨 有 漏 種 具 立 辨 無 漏 種 十 一 隨 順 
X58n1013_001:0525c09	依處。立引發因。唯同類勝品。三界相引。以性論之。則	依 處 立 引 發 因 唯 同 類 勝 品 三 界 相 引 以 性 論 之 則 
X58n1013_001:0525c10	狹。十二差別功能依處。立定異因。於一界中。三性	狹 十 二 差 別 功 能 依 處 立 定 異 因 於 一 界 中 三 性 
X58n1013_001:0525c11	互引。體性相稱。名定不共。他法名異。界狹性寬。亦引	互 引 體 性 相 稱 名 定 不 共 他 法 名 異 界 狹 性 寬 亦 引 
X58n1013_001:0525c12	無為。十三和合依處。立同事因。除言說因。餘六為	無 為 十 三 和 合 依 處 立 同 事 因 除 言 說 因 餘 六 為 
X58n1013_001:0525c13	體。十四一切法礙障依處。立相違因。十五不障	體 十 四 一 切 法 礙 障 依 處 立 相 違 因 十 五 不 障 
X58n1013_001:0525c14	礙依處。立不相違因。	礙 依 處 立 不相違因 
X58n1013_001:0525c15	福非福義	福 非 福 義 
X58n1013_001:0525c16	夫三界依正由業因而得。謂福非福及不動。有漏善	夫 三 界 依 正 由 業 因 而 得 謂 福 非 福 及 不 動 有 漏 善 
X58n1013_001:0525c17	不善業。能招將來。總別報福業人天。別得總名。亦有	不 善 業 能 招 將 來 總 別 報 福 業 人 天 別 得 總 名 亦 有 
X58n1013_001:0525c18	別報。非福鬼畜。亦有別報福業。其不動業。不似欲業。	別 報 非 福 鬼 畜 亦 有 別 報 福 業 其 不 動 業 不 似 欲 業 
X58n1013_001:0525c19	許得餘趣。受定所伏。故由諸業習氣。二取習氣。俱俱	許 得 餘 趣 受 定 所 伏 故 由 諸 業 習 氣 二 取 習 氣 俱 俱 
X58n1013_001:0525c20	謂業種子上有名言。二取種是親疎緣。互相助成業	謂 業 種 子 上 有 名 言 二 取 種 是 親 疎 緣 互 相 助 成 業 
X58n1013_001:0525c21	招生顯。故先說之。總別相望有三句。一多生別報業。	招 生 顯 故 先 說 之 總 別 相 望 有 三 句 一 多 生 別 報 業 
X58n1013_001:0525c22	一生總報受。二一業總報。能受招聚。多別報果。三多	一 生 總 報 受 二 一 業 總 報 能 受 招 聚 多 別 報 果 三 多 
X58n1013_001:0525c23	業招多總報。然思業總報有盡。名言習氣受果無窮。	業 招 多 總 報 然 思 業 總 報 有 盡 名 言 習 氣 受 果 無 窮 
X58n1013_001:0525c24	為業流性。同易感異熟性。別難招因。通善惡果。唯無	為 業 流 性 同 易 感 異 熟 性 別 難 招 因 通 善 惡 果 唯 無 
X58n1013_001:0526a01	記。問第六識現行善惡才生即滅。自無其體。如何感	記 問 第 六 識 現 行 善 惡 才 生 即 滅 自 無 其 體 如 何 感 
X58n1013_001:0526a02	果。答而熏本識。起自功能。名為習氣。揀曾現受業。取	果 答 而 熏 本 識 起 自 功 能 名 為 習 氣 揀 曾 現 受 業 取 
X58n1013_001:0526a03	順現順生順不定業。	順 現 順 生 順 不 定 業 
X58n1013_001:0526a04	八解二取義	八 解 二 取 義 
X58n1013_001:0526a05	諸名言習氣。有為之法。各別親種有二種。	諸 名 言 習 氣 有 為 之 法 各 別 親 種 有 二 種 
