X58n1013_001:0519a23	色。應得聲無見非能緣。三云。見有相無。無分別。見分	色 應 得 聲 無 見 非 能 緣 三 云 見 有 相 無 無 分 別 見 分 
X58n1013_001:0519a24	狹帶真如體相。起今世第一。無漏智生。體會真如。名	狹 帶 真 如 體 相 起 今 世 第 一 無 漏 智 生 體 會 真 如 名 
X58n1013_001:0519b01	為見道。初照理故。多生歡喜。本論云。實斷二障。分別	為 見 道 初 照 理 故 多 生 歡 喜 本 論 云 實 斷 二 障 分 別 
X58n1013_001:0519b02	隨眠實證二空所顯真理。雖多剎那事。方究竟而相	隨 眠 實 證 二 空 所 顯 真 理 雖 多 剎 那 事 方 究 竟 而 相 
X58n1013_001:0519b03	第故。總名一心。	第 故 總 名 一 心 
X58n1013_001:0519b04	相見道緣非安立	相 見 道 緣 非 安 立 
X58n1013_001:0519b05	無漏後得智。見分緣。真見道理。作三心倣之。一緣內	無 漏 後 得 智 見 分 緣 真 見 道 理 作 三 心 倣 之 一 緣 內 
X58n1013_001:0519b06	遣有性假智。除下品二障惑。二外遣諸法假智。除法	遣 有 性 假 智 除 下 品 二 障 惑 二 外 遣 諸 法 假 智 除 法 
X58n1013_001:0519b07	執中品惑。三遍遣內外假智。除上品二障。若小乘倣	執 中 品 惑 三 遍 遣 內 外 假 智 除 上 品 二 障 若 小 乘 倣 
X58n1013_001:0519b08	法。俱是煩惱障。若大乘倣法。有情諸法是二障。麤者	法 俱 是 煩 惱 障 若 大 乘 倣 法 有 情 諸 法 是 二 障 麤 者 
X58n1013_001:0519b09	分二。細者為一。第三倣證。前二心總別。既殊緣名。法	分 二 細 者 為 一 第 三 倣 證 前 二 心 總 別 既 殊 緣 名 法 
X58n1013_001:0519b10	總緣名類。三緣下名法緣。上名類。若別倣用二無間	總 緣 名 類 三 緣 下 名 法 緣 上 名 類 若 別 倣 用 二 無 間 
X58n1013_001:0519b11	道。合倣用一解脫道。	道 合 倣 用 一 解 脫 道 
X58n1013_001:0519b12	漸斷十四解	漸 斷 十 四 解 
X58n1013_001:0519b13	有云。此中二空二障。漸斷漸證。以有理淺深障。有麤	有 云 此 中 二 空 二 障 漸 斷 漸 證 以 有 理 淺 深 障 有 麤 
X58n1013_001:0519b14	細異故。一二障各分三品。次第斷之用。六無間。六解	細 異 故 一 二 障 各 分 三 品 次 第 斷 之 用 六 無 間 六 解 
X58n1013_001:0519b15	脫。二勝進。共十四心。二用十三心。除中間勝進。三用	脫 二 勝 進 共 十 四 心 二 用 十 三 心 除 中 間 勝 進 三 用 
X58n1013_001:0519b16	十二心。除末後勝進。四若用後無間。即前解脫有八	十 二 心 除 末 後 勝 進 四 若 用 後 無 間 即 前 解 脫 有 八 
X58n1013_001:0519b17	心。六無間。一解脫。一勝進。五用七心。除末後勝進。六	心 六 無 間 一 解 脫 一 勝 進 五 用 七 心 除 末 後 勝 進 六 
X58n1013_001:0519b18	二障各分二品。用四無間。四解脫。二勝進。七除末後	二 障 各 分 二 品 用 四 無 間 四 解 脫 二 勝 進 七 除 末 後 
X58n1013_001:0519b19	勝進。八除中間勝進。九用後無間即前解脫。有五心。	勝 進 八 除 中 間 勝 進 九 用 後 無 間 即 前 解 脫 有 五 心 
X58n1013_001:0519b20	十除末後勝進。十一二障麤者別斷。細者合斷七心。	十 除 末 後 勝 進 十 一 二 障 麤 者 別 斷 細 者 合 斷 七 心 
X58n1013_001:0519b21	十二除末後勝進六心。十三後無間。即前解脫。有四	十 二 除 末 後 勝 進 六 心 十 三 後 無 間 即 前 解 脫 有 四 
X58n1013_001:0519b22	心。十四除末後勝進。有三心。	心 十 四 除 末 後 勝 進 有 三 心 
X58n1013_001:0519b23	頓斷十一解	頓 斷 十 一 解 
X58n1013_001:0519b24	有云。此中二空二障。頓斷頓證。以真見道。不別緣。故	有 云 此 中 二 空 二 障 頓 斷 頓 證 以 真 見 道 不 別 緣 故 
X58n1013_001:0519c01	二障共作二大品。用三無間三解脫一勝進。七心除	二 障 共 作 二 大 品 用 三 無 間 三 解 脫 一 勝 進 七 心 除 
X58n1013_001:0519c02	末後勝進。六心若後無間。即前解脫。四心除末後勝	末 後 勝 進 六 心 若 後 無 間 即 前 解 脫 四 心 除 末 後 勝 
X58n1013_001:0519c03	進。三心若二障麤細。共二品二無間二解脫。一勝進	進 三 心 若 二 障 麤 細 共 二 品 二 無 間 二 解 脫 一 勝 進 
X58n1013_001:0519c04	除末後勝進。有四心後。無間即前解脫。有三心除勝	除 末 後 勝 進 有 四 心 後 無 間 即 前 解 脫 有 三 心 除 勝 
X58n1013_001:0519c05	進有二心。若二障合為一大品。或三或二或一。	進 有 二 心 若 二 障 合 為 一 大 品 或 三 或 二 或 一 
X58n1013_001:0519c06	相見道安立諦	相 見 道 安 立 諦 
X58n1013_001:0519c07	無漏後得智。見分緣安立諦。作十六心影像。倣真見	無 漏 後 得 智 見 分 緣 安 立 諦 作 十 六 心 影 像 倣 真 見 
X58n1013_001:0519c08	道無間解脫二見。分於四諦。下斷惑證理。見分觀真	道 無間解脫 二 見 分 於 四 諦 下 斷 惑 證 理 見 分 觀 真 
X58n1013_001:0519c09	如為境。時斷四諦下惑。證四諦下理。有八箇見分。其	如 為 境 時 斷 四 諦 下 惑 證 四 諦 下 理 有 八 箇 見 分 其 
X58n1013_001:0519c10	自證分。證前所斷四障。所證四理。是觀正智為境。今	自 證 分 證 前 所 斷 四 障 所 證 四 理 是 觀 正 智 為 境 今 
X58n1013_001:0519c11	相見道。後得智見分。似彼真見道中斷證。故云。倣法	相 見 道 後 得 智 見 分 似 彼 真 見 道 中 斷 證 故 云 倣 法 
X58n1013_001:0519c12	論云。四諦法忍智。(自性立名見分斷惑)為斷三界二十八種分	論 云 四 諦 法 忍 智 自 性 立 名 見 分 斷 惑 為 斷 三 界 二 十 八 種 分 
X58n1013_001:0519c13	別隨眠。(倣法解義)四諦下法智。(倣法立名見分證理)證前所斷。(倣法解義)	別 隨 眠 倣 法 解 義 四 諦 下 法 智 倣 法 立 名 見 分 證 理 證 前 所 斷 倣 法 解 義 
X58n1013_001:0519c14	四諦類智忍。(自性立名自證證斷)於前法忍。各別內證。(通自性倣法解	四 諦 類 智 忍 自 性 立 名 自 證 證 斷 於 前 法 忍 各 別 內 證 通 自 性 倣 法 解 
X58n1013_001:0519c15	義立名)四諦類智。(自性立名自證分證見分證理)印可前印。又上下諦	義 立 名 四 諦 類 智 自 性 立 名 自 證 分 證 見 分 證 理 印 可 前 印 又 上 下 諦 
X58n1013_001:0519c16	境。不說自證分只論見。分下界現前名法。不現前上	境 不 說 自 證 分 只 論 見 分 下 界 現 前 名 法 不 現 前 上 
X58n1013_001:0519c17	二界。是類三界。四諦下。有一百十二種分別。煩惱論	二 界 是 類 三 界 四 諦 下 有 一 百 十 二 種 分 別 煩 惱 論 
X58n1013_001:0519c18	云。法真見道。無間解脫。各有見。自證分。差別建立。	云 法 真 見 道 無間解脫 各 有 見 自 證 分 差別建立 
X58n1013_001:0519c19	六現觀義	六 現 觀 義 
X58n1013_001:0519c20	一思即現觀。上品喜受。相應慧思。緣共相境。二信俱	一 思 即 現 觀 上 品 喜 受 相 應 慧 思 緣 共 相 境 二 信 俱 
X58n1013_001:0519c21	現觀。四不壞信。二戒之現觀。助成智故。四現觀。即智	現 觀 四不壞信 二 戒 之 現 觀 助 成 智 故 四 現 觀 即 智 
X58n1013_001:0519c22	智之諦。諦之現觀。五現觀之邊邊。即智智之諦。諦之	智 之 諦 諦 之 現 觀 五 現 觀 之 邊 邊 即 智 智 之 諦 諦 之 
X58n1013_001:0519c23	現觀後得智。六究竟即現觀。上一現觀。別名下一現	現 觀 後 得 智 六 究 竟 即 現 觀 上 一 現 觀 別 名 下 一 現 
X58n1013_001:0519c24	觀。通名真見道。収無漏戒至究竟。四少分相見道収。	觀 通 名 真 見 道 収 無 漏 戒 至 究 竟 四 少 分 相 見 道 収 
X58n1013_001:0520a01	第五全。餘四少分除第四現觀　頌曰。	第 五 全 餘 四 少 分 除 第 四 現 觀 頌 曰 
X58n1013_001:0520a02	此一非依□。(思現觀。不依九地定生)三依五依生。(後三未至定。及	此 一 非 依 思 現 觀 不 依 九 地 定 生 三 依 五 依 生 後 三 未 至 定 及 
X58n1013_001:0520a03	四禪根本)一種分亦爾。(信現觀也)餘依一切依(戒現觀不依九地定	四 禪 根 本 一 種 分 亦 爾 信 現 觀 也 餘 依 一 切 依 戒 現 觀 不 依 九 地 定 
X58n1013_001:0520a04	生)。	生 
X58n1013_001:0520a05	修道義	修 道 義 
X58n1013_001:0520a06	無得不思議。是出世間智。捨二麤重。故便證得轉依。	無 得 不 思 議 是 出世間智 捨 二 麤 重 故 便 證 得 轉 依 
X58n1013_001:0520a07	上二句無能所取。是根本智。下二句是修道義。取後	上 二 句 無 能 所 取 是 根 本 智 下 二 句 是 修 道 義 取 後 
X58n1013_001:0520a08	得智。依字通染。淨轉字為因。捨染得淨。是轉之依無	得 智 依 字 通 染 淨 轉 字 為 因 捨 染 得 淨 是 轉 之 依 無 
X58n1013_001:0520a09	漏智。種本有三品。其新熏種亦有三種智體。是一轉	漏 智 種 本 有 三 品 其 新 熏 種 亦 有 三 種 智 體 是 一 轉 
X58n1013_001:0520a10	去劣。用資新熏下品。齊本有中品。資新熏中品。齊本	去 劣 用 資 新 熏 下 品 齊 本 有 中 品 資 新 熏 中 品 齊 本 
X58n1013_001:0520a11	有上品。一念無漏智生。其用有三。一上資新熏。二傍	有 上 品 一 念 無 漏 智 生 其 用 有 三 一 上 資 新 熏 二 傍 
X58n1013_001:0520a12	資萬行。三脚下用增。不說無漏智。有惑可斷。但違彼	資 萬 行 三 脚 下 用 增 不 說 無 漏 智 有 惑 可 斷 但 違 彼 
X58n1013_001:0520a13	二障。種體令永不生。於染淨功能。上立凡性。聖性是	二 障 種 體 令 永 不 生 於 染 淨 功 能 上 立 凡 性 聖 性 是 
X58n1013_001:0520a14	不相應収。	不 相 應 収 
X58n1013_001:0520a15	十地作釋	十 地 作 釋 
X58n1013_001:0520a16	一極即喜。二垢之離。三光之發。四慧如焰。五難之勝。	一 極 即 喜 二 垢 之 離 三 光 之 發 四 慧 如 焰 五 難 之 勝 
X58n1013_001:0520a17	六現即前。七遠之行。八不能動。九善之慧。十法如雲。	六 現 即 前 七 遠 之 行 八 不 能 動 九 善 之 慧 十 法 如 雲 
X58n1013_001:0520a18	每地作四釋。若地之極喜。喜是加行智。若地即極喜。	每 地 作 四 釋 若 地 之 極 喜 喜 是 加 行 智 若 地 即 極 喜 
X58n1013_001:0520a19	喜是根本智。若極喜之地。以別揀通。是後得智中修	喜 是 根 本 智 若 極 喜 之 地 以 別 揀 通 是 後 得 智 中 修 
X58n1013_001:0520a20	行。若極喜即地所證真如。	行 若 極 喜 即 地 所 證 真 如 
X58n1013_001:0520a21	十勝行義	十 勝 行 義 
X58n1013_001:0520a22	十行者。前六行對法論通有三種。如六行束三壇。寬	十 行 者 前 六 行 對 法 論 通 有 三 種 如 六 行 束 三 壇 寬 
X58n1013_001:0520a23	狹可知。後四各有二種。要有七最勝。方成度義。一安	狹 可 知 後 四 各 有 二 種 要 有 七 最 勝 方 成 度 義 一 安 
X58n1013_001:0520a24	住菩提性。二依止菩提心。三意樂慜有情。四事業具	住 菩 提 性 二 依 止 菩 提 心 三 意 樂 慜 有 情 四 事 業 具 
X58n1013_001:0520b01	足行。五巧便無相智。六迴向無上菩提。七不為二障。	足 行 五 巧 便 無 相 智 六 迴 向 無上菩提 七 不 為 二 障 
X58n1013_001:0520b02	間雜應作四句。一是施非度。無七最勝。二是度非施	間 雜 應 作 四 句 一 是 施 非 度 無 七 最 勝 二 是 度 非 施 
X58n1013_001:0520b03	隨喜。具七最勝。三亦度亦施可知。四俱非貪等。前三	隨 喜 具 七 最 勝 三 亦 度 亦 施 可 知 四 俱 非 貪 等 前 三 
X58n1013_001:0520b04	施戒忍。人天增上。生道後三。勤定慧。決定勝道。方便	施 戒 忍 人 天 增 上 生 道 後 三 勤 定 慧 決 定 勝 道 方 便 
X58n1013_001:0520b05	助施。戒忍願助。精進力助。靜慮智助。般若凡行。一施	助 施 戒 忍 願 助 精 進 力 助 靜 慮 智 助 般 若 凡 行 一 施 
X58n1013_001:0520b06	定得五果。一斷慳得離繫果。二攝授自他。得士用果	定 得 五 果 一 斷 慳 得 離 繫 果 二 攝 授 自 他 得 士 用 果 
X58n1013_001:0520b07	三得勝生處等流果。四引大涅槃增上果。五感大財	三 得 勝 生 處 等 流 果 四 引 大 涅 槃 增 上 果 五 感 大 財 
X58n1013_001:0520b08	異熟果。	異 熟 果 
X58n1013_001:0520b09	十重障義	十 重 障 義 
X58n1013_001:0520b10	異生性。障善不善業。是能異因。五蘊報是所異果。果	異 生 性 障 善不善業 是 能 異 因 五 蘊 報 是 所 異 果 果 
X58n1013_001:0520b11	從因別。是異之生。報生五蘊。是總相性。是身中染法。	從 因 別 是 異 之 生 報 生 五 蘊 是 總 相 性 是 身 中 染 法 
X58n1013_001:0520b12	別從總以彰名。是生之性。性是二障。種體障。是種上	別 從 總 以 彰 名 是 生 之 性 性 是 二 障 種 體 障 是 種 上 
X58n1013_001:0520b13	功能。是性之障。所依種斷能依功。能不生名為聖性。	功 能 是 性 之 障 所 依 種 斷 能 依 功 能 不 生 名 為 聖 性 
X58n1013_001:0520b14	然愚與麤重。皆第六識中俱生法執。作七分斷之。若	然 愚 與 麤 重 皆 第 六 識 中 俱 生 法 執 作 七 分 斷 之 若 
X58n1013_001:0520b15	障即是愚。障中無煩惱。若障之愚。障通二障愚。用所	障 即 是 愚 障 中 無 煩 惱 若 障 之 愚 障 通 二 障 愚 用 所 
X58n1013_001:0520b16	知一分為體。	知 一 分 為 體 
X58n1013_001:0520b17	一極喜地。斷異生性障。執著我法愚。惡趣雜染愚。	一 極 喜 地 斷 異 生 性 障 執 著 我 法 愚 惡 趣 雜 染 愚 
X58n1013_001:0520b18	二離垢地。斷邪行障。微細悞犯愚。種種惡趣愚。	二 離 垢 地 斷 邪 行 障 微 細 悞 犯 愚 種 種 惡 趣 愚 
X58n1013_001:0520b19	三發光地。斷闇鈍障。聞思修妄失欲貪愚。聞持愚。	三 發 光 地 斷 闇 鈍 障 聞 思 修 妄 失 欲 貪 愚 聞 持 愚 
X58n1013_001:0520b20	四焰慧地。斷現行煩惱障。彼昔多與所知俱生六識	四 焰 慧 地 斷 現 行 煩 惱 障 彼 昔 多 與 所 知 俱 生 六 識 
X58n1013_001:0520b21	有俱生二見。永不現行。貪嗔不與。二見俱此名。害伴	有 俱 生 二 見 永 不 現 行 貪 嗔 不 與 二 見 俱 此 名 害 伴 
X58n1013_001:0520b22	等至愛愚法愛愚。	等 至 愛 愚 法 愛 愚 
X58n1013_001:0520b23	五難勝地。斷下乘般涅槃障。背生死愚。向涅槃愚。	五 難 勝 地 斷 下 乘 般 涅 槃 障 背 生 死 愚 向 涅 槃 愚 
X58n1013_001:0520b24	六現前地。斷麤相障。觀察流轉愚。無相現行愚。	六 現 前 地 斷 麤 相 障 觀 察 流 轉 愚 無 相 現 行 愚 
X58n1013_001:0520c01	七遠行地。斷細現行愚流。轉生死愚。生滅愚。	七 遠 行 地 斷 細 現 行 愚 流 轉 生 死 愚 生 滅 愚 
X58n1013_001:0520c02	八不動地。斷無相加行障。加行愚。相土未自在愚。	八 不 動 地 斷 無 相 加 行 障 加 行 愚 相 土 未 自 在 愚 
X58n1013_001:0520c03	九善慧地。斷利不欲行障。義詞愚。辨才自在愚。	九 善 慧 地 斷 利 不 欲 行 障 義 詞 愚 辨 才 自 在 愚 
X58n1013_001:0520c04	十法雲地。斷未得自在障。大神通愚。悟入微細愚。	十 法 雲 地 斷 未 得 自 在 障 大 神 通 愚 悟 入 微 細 愚 
X58n1013_001:0520c05	十一斷佛第一障所知著愚。微細礙愚。	十 一 斷 佛 第 一 障 所 知 著 愚 微 細 礙 愚 
X58n1013_001:0520c06	十真如義	十 真 如 義 
X58n1013_001:0520c07	依如說教。依教談如真如轉勝。將旨就詮。有其十種。	依 如 說 教 依 教 談 如 真 如 轉 勝 將 旨 就 詮 有 其 十 種 
X58n1013_001:0520c08	一遍行。二最勝。三勝流。四無攝受。五類無別。六無染	一 遍 行 二 最 勝 三 勝 流 四 無 攝 受 五 類 無 別 六 無 染 
X58n1013_001:0520c09	淨。七法無別。八不增減。九智自在。十業自在。	淨 七 法 無 別 八 不 增 減 九 智 自 在 十 業 自 在 
X58n1013_001:0520c10	二轉依果約位。有六種轉。一損力益。能轉為懺悔。過	二 轉 依 果 約 位 有 六 種 轉 一 損 力 益 能 轉 為 懺 悔 過 
X58n1013_001:0520c11	惡勝解力。損染種子。勢力益淨。種功能二。通達轉為	惡 勝 解 力 損 染 種 子 勢 力 益 淨 種 功 能 二 通 達 轉 為 
X58n1013_001:0520c12	五。無下劣轉。六果圓滿轉。	五 無 下 劣 轉 六 果 圓 滿 轉 
X58n1013_001:0520c13	轉依義	轉 依 義 
X58n1013_001:0520c14	一能轉道有二。一能伏道。加行位。伏隨眠不起。引無	一 能 轉 道 有 二 一 能 伏 道 加 行 位 伏 隨 眠 不 起 引 無 
X58n1013_001:0520c15	分別智。二能斷道。見道根本智斷迷理事惑。	分 別 智 二 能 斷 道 見 道 根 本 智 斷 迷 理 事 惑 
X58n1013_001:0520c16	二所轉依有二。一持種依。第八不依。於他受染淨熏。	二 所 轉 依 有 二 一 持 種 依 第 八 不 依 於 他 受 染 淨 熏 
X58n1013_001:0520c17	是淨無記性。二迷悟依真如。凡不減聖不增絕。染淨。	是 淨 無 記 性 二 迷 悟 依 真 如 凡 不 減 聖 不 增 絕 染 淨 
X58n1013_001:0520c18	三所轉捨有二。一所斷捨。為無間道斷。二障種令永	三 所 轉 捨 有 二 一 所 斷 捨 為 無 間 道 斷 二 障 種 令 永 
X58n1013_001:0520c19	不行。二所棄捨。有四事。一有漏善。二劣無漏。三異熟	不 行 二 所 棄 捨 有 四 事 一 有 漏 善 二 劣 無 漏 三 異 熟 
X58n1013_001:0520c20	無記。四習氣。於解脫道中。捨劣得勝。	無 記 四 習 氣 於 解 脫 道 中 捨 劣 得 勝 
X58n1013_001:0520c21	四所轉得有二。一所生得。即四智相應心品。有二十	四 所 轉 得 有 二 一 所 生 得 即 四 智 相 應 心 品 有 二 十 
X58n1013_001:0520c22	二法。二所顯得。真如體。三乘離障不同。說四涅槃。	二 法 二 所 顯 得 真 如 體 三 乘 離 障 不 同 說 四 涅 槃 
X58n1013_001:0520c23	由能伏道熏持。種依有所斷捨。獲四智菩提。	由 能 伏 道 熏 持 種 依 有 所 斷 捨 獲 四 智 菩 提 
X58n1013_001:0520c24	由能斷道證。迷悟依棄捨。四事顯得。四種涅槃。	由 能 斷 道 證 迷 悟 依 棄 捨 四 事 顯 得 四種涅槃 
X58n1013_001:0521a01	四涅槃義	四 涅 槃 義 
X58n1013_001:0521a02	一本來清淨涅槃。一切眾生。共有二有餘依涅槃。為	一 本 來 清 淨 涅 槃 一 切 眾 生 共 有 二 有餘依涅槃 為 
X58n1013_001:0521a03	前三果。有餘俱生惑。七返身能伏斷。智無學人未入	前 三 果 有 餘 俱 生 惑 七 返 身 能 伏 斷 智 無 學 人 未 入 
X58n1013_001:0521a04	滅。有苦依身。在三無餘依涅槃。樂寂灰斷者。小乘擇	滅 有 苦 依 身 在 三 無餘依涅槃 樂 寂 灰 斷 者 小 乘 擇 
X58n1013_001:0521a05	滅。大乘法空真理。四無住處涅槃。由悲故不住涅槃。	滅 大 乘 法 空 真 理 四 無住處涅槃 由 悲 故 不住涅槃 
X58n1013_001:0521a06	由智故不住生死。	由 智 故 不 住 生 死 
X58n1013_001:0521a07	料揀三乘有學凡夫。具初一。若回心入大者。初二四	料 揀 三 乘 有 學 凡 夫 具 初 一 若 回 心 入 大 者 初 二 四 
X58n1013_001:0521a08	無學。不定性。有初及三。大乘有學具三。直住入地。有	無 學 不 定 性 有 初 及 三 大 乘 有 學 具 三 直 住 入 地 有 
X58n1013_001:0521a09	初後。唯佛具四。云何。佛有有餘依涅槃。答。假說二乘。	初 後 唯 佛 具 四 云 何 佛 有 有餘依涅槃 答 假 說 二 乘 
X58n1013_001:0521a10	但得擇滅。依不得無住處。云何。斷所知障。不得涅槃。	但 得 擇 滅 依 不 得 無 住 處 云 何 斷 所 知 障 不 得 涅 槃 
X58n1013_001:0521a11	答。法空真理。即無住處。初一真如無為。後三擇滅無	答 法 空 真 理 即 無 住 處 初 一 真 如 無 為 後 三 擇 滅 無 
X58n1013_001:0521a12	為。想受滅不動。非擇滅収虗空離礙。	為 想 受 滅 不 動 非 擇 滅 収 虗 空 離 礙 
X58n1013_001:0521a13	四智義	四 智 義 
X58n1013_001:0521a14	一大圓鏡即智。能現能生身土智影。是自受用身。土	一 大 圓 鏡 即 智 能 現 能 生 身 土 智 影 是 自 受 用 身 土 
X58n1013_001:0521a15	所現所生。二一切有情平等性即智。依無住涅槃建	所 現 所 生 二 一切有情 平 等 性 即 智 依 無住涅槃 建 
X58n1013_001:0521a16	立。為十地菩薩。現他受用身土。三妙觀察之智。觀自	立 為 十地菩薩 現 他 受 用 身 土 三 妙 觀 察 之 智 觀 自 
X58n1013_001:0521a17	共相轉能遍十方。善說法故。四成所作即智。為地前	共 相 轉 能 遍 十 方 善 說 法 故 四 成 所 作 即 智 為 地 前 
X58n1013_001:0521a18	菩薩現千丈身。為凡夫現丈六。隨類鹿馬。此四智皆	菩 薩 現 千 丈 身 為 凡 夫 現 丈 六 隨 類 鹿 馬 此 四 智 皆 
X58n1013_001:0521a19	有三十二法。相應總収。佛地一切功德。轉於有漏八	有 三 十 二 法 相 應 總 収 佛 地 一切功德 轉 於 有 漏 八 
X58n1013_001:0521a20	七六五相應心品。東中智強識。劣六七二識。見道轉	七 六 五 相 應 心 品 東 中 智 強 識 劣 六 七 二 識 見 道 轉 
X58n1013_001:0521a21	成智。第八前五果中。方轉此四心品。緣一切真俗為	成 智 第 八 前 五 果 中 方 轉 此 四 心 品 緣 一 切 真 俗 為 
X58n1013_001:0521a22	境。論云。此即無漏界。(釋名)不思議善常。(歎德)安樂解脫身。	境 論 云 此 即 無 漏 界 釋 名 不 思 議 善 常 歎 德 安 樂 解 脫 身 
X58n1013_001:0521a23	大牟尼名法。(揀因位二乘也)諸漏永盡。(羅漢亦具)非漏隨增。(前三果亦	大 牟 尼 名 法 揀 因 位 二 乘 也 諸漏永盡 羅 漢 亦 具 非 漏 隨 增 前 三 果 亦 
X58n1013_001:0521a24	具此)性淨(凡夫亦具)圓(無學亦具)明。(菩薩亦具)但長讀文勢義意乃遠。	具 此 性 淨 凡 夫 亦 具 圓 無 學 亦 具 明 菩 薩 亦 具 但 長 讀 文 勢 義 意 乃 遠 
X58n1013_001:0521b01	三境義	三 境 義 
X58n1013_001:0521b02	奘法師頌善唯識解	奘 法 師 頌 善 唯 識 解 
X58n1013_001:0521b03	性境不隨心。獨影唯從見。帶質通情。本性種等。隨應	性 境 不 隨 心 獨 影 唯 從 見 帶 質 通 情 本 性 種 等 隨 應 
X58n1013_001:0521b04	一性。即境為五。塵根境從實種生。有實體用。能緣之	一 性 即 境 為 五 塵 根 境 從 實 種 生 有 實 體 用 能 緣 之 
X58n1013_001:0521b05	心。得彼自性。為自住自性。不隨能緣通。三性有二。一	心 得 彼 自 性 為 自 住 自 性 不 隨 能 緣 通 三 性 有 二 一 
X58n1013_001:0521b06	真。性境為前。五識緣自界。因中五塵。親得體八識。各	真 性 境 為 前 五 識 緣 自 界 因 中 五 塵 親 得 體 八 識 各 
X58n1013_001:0521b07	自證分緣見分。二似性境。第六識。緣前念中心。及緣	自 證 分 緣 見 分 二 似 性 境 第 六 識 緣 前 念 中 心 及 緣 
X58n1013_001:0521b08	自身五根疎。得體名似。	自 身 五 根 疎 得 體 名 似 
X58n1013_001:0521b09	二帶質境。見能變相。相能帶質。是質之帶。能帶即相	二 帶 質 境 見 能 變 相 相 能 帶 質 是 質 之 帶 能 帶 即 相 
X58n1013_001:0521b10	分中間。相分攝歸本質。唯無記攝歸。能緣見分通三	分 中 間 相 分 攝 歸 本 質 唯 無 記 攝 歸 能 緣 見 分 通 三 
X58n1013_001:0521b11	性。若離見別談。與本質種。同有二。一真帶質。以心緣	性 若 離 見 別 談 與 本 質 種 同 有 二 一 真 帶 質 以 心 緣 
X58n1013_001:0521b12	心。有實本質。如第七識。緣第八識自證分。為我中間。	心 有 實 本 質 如 第 七 識 緣 第 八 識 自 證 分 為 我 中 間 
X58n1013_001:0521b13	相分不熏種子。二似帶質。前六識心緣外境時。中間	相 分 不 熏 種 子 二 似 帶 質 前 六 識 心 緣 外 境 時 中 間 
X58n1013_001:0521b14	相分。定熏種子。名似帶質。	相 分 定 熏 種 子 名 似 帶 質 
X58n1013_001:0521b15	三獨影境。第六識見分。變三際境。獨頭意識。影像相	三 獨 影 境 第 六 識 見 分 變 三 際 境 獨 頭 意 識 影 像 相 
X58n1013_001:0521b16	分。唯從見分生有二。一有體。第六識緣過未。五蘊性	分 唯 從 見 分 生 有 二 一 有 體 第 六 識 緣 過 未 五 蘊 性 
X58n1013_001:0521b17	繫種三定。同能熏相分種後生。本質二無體。第六識	繫 種 三 定 同 能 熏 相 分 種 後 生 本 質 二 無 體 第 六 識 
X58n1013_001:0521b18	緣遍計實我實法。龜毛兔角。不熏種遍計色収。	緣 遍 計 實 我 實 法 龜 毛 兔 角 不 熏 種 遍 計 色 収 
X58n1013_001:0521b19	四性種等。隨應者。不定義。二合有三。一第八緣散地	四 性 種 等 隨 應 者 不 定 義 二 合 有 三 一 第 八 緣 散 地 
X58n1013_001:0521b20	境。心王緣是性境。心所緣是獨影。不熏種子。二前五	境 心 王 緣 是 性 境 心 所 緣 是 獨 影 不 熏 種 子 二 前 五 
X58n1013_001:0521b21	緣自他根塵。是性境。亦帶質熏種子。三第六緣過未	緣 自 他 根 塵 是 性 境 亦 帶 質 熏 種 子 三 第 六 緣 過 未 
