X59n1054_001:0091c12	即以二無名指並屈押之二中指頭相著二頭指各	即 以 二 無 名 指 並 屈 押 之 二 中 指 頭 相 著 二 頭 指 各 
X59n1054_001:0091c13	附中指上節二大指各附頭指側即成以印抄取水	附 中 指 上 節 二 大 指 各 附 頭 指 側 即 成 以 印 抄 取 水 
X59n1054_001:0091c14	用為灌頂呪曰。	用 為 灌 頂 呪 曰 
X59n1054_001:0091c15	唵(一)鸖佉哩哩(二)吽(三)泮	唵 一 鸖 佉 哩 哩 二 吽 三 泮 
X59n1054_001:0091c16	誦此呪三遍灌頂已拭身令乾即復結於頂髮作一	誦 此 呪 三 遍 灌 頂 已 拭 身 令 乾 即 復 結 於 頂 髮 作 一 
X59n1054_001:0091c17	結結頂髮印以右手為拳直舒大指即是結頂髮已	結 結 頂 髮 印 以 右 手 為 拳 直 舒 大 指 即 是 結 頂 髮 已 
X59n1054_001:0091c18	後方結印呪曰。	後 方 結 印 呪 曰 
X59n1054_001:0091c19	唵(一)始契莎訶	唵 一 始 契 莎 訶 
X59n1054_001:0091c20	又若澡浴時不應近埿及近棘刺危險等處旋水駛	又 若 澡 浴 時 不 應 近 埿 及 近 棘 刺 危 險 等 處 旋 水 駛 
X59n1054_001:0091c21	流乃至極深或時極淺皆不應浴若便利涕唾等俱	流 乃 至 極 深 或 時 極 淺 皆 不 應 浴 若 便 利 涕 唾 等 俱 
X59n1054_001:0091c22	不得於泉池河井皆勿弃不淨河池泉岸上亦然或	不 得 於 泉 池 河 井 皆 勿 弃 不 淨 河 池 泉 岸 上 亦 然 或 
X59n1054_001:0091c23	時踔躑或時咽沒或浮戲或臥或轉或視其形而生	時 踔 躑 或 時 咽 沒 或 浮 戲 或 臥 或 轉 或 視 其 形 而 生 
X59n1054_001:0091c24	欲心此皆不應當一心憶念諸佛菩薩等勿令散亂	欲 心 此 皆 不 應 當 一 心 憶 念 諸佛菩薩 等 勿 令 散 亂 
X59n1054_001:0092a01	想本呪天與自身無異想本呪神及三寶等如在目	想 本 呪 天 與 自 身 無 異 想 本 呪 神 及 三 寶 等 如 在 目 
X59n1054_001:0092a02	前用所浴水三掬而獻是印當以二手如常為掬但	前 用 所 浴 水 三 掬 而 獻 是 印 當 以 二 手 如 常 為 掬 但 
X59n1054_001:0092a03	以二大指與二頭指相捻先奉三寶然及本天獻水	以 二 大 指 與 二 頭 指 相 捻 先 奉 三 寶 然 及 本 天 獻 水 
X59n1054_001:0092a04	呪曰。	呪 曰 
X59n1054_001:0092a05	唵(一)帝哩帝哩(二)勃陀(三)莎訶	唵 一 帝 哩 帝 哩 二 勃 陀 三 莎 訶 
X59n1054_001:0092a06	唵(一)帝哩帝哩(二)達摩(三)莎訶	唵 一 帝 哩 帝 哩 二 達 摩 三 莎 訶 
X59n1054_001:0092a07	唵(一)帝哩帝哩(二)僧伽(三)莎訶	唵 一 帝 哩 帝 哩 二 僧 伽 三 莎 訶 
X59n1054_001:0092a08	獻本天水呪曰。	獻 本 天 水 呪 曰 
X59n1054_001:0092a09	唵(一)多哩(二)咄多唎(三)咄唎(四)阿哩鉗(五)婆伽婆帝	唵 一 多 哩 二 咄 多 唎 三 咄 唎 四 阿 哩 鉗 五 婆 伽 婆 帝 
X59n1054_001:0092a10	(六)鉢囉底車噎[牟*含](七)莎訶	 六 鉢 囉 底 車 噎 [牟含] 七 莎 訶 
X59n1054_001:0092a11	作是法上水已隨力多少於水中念於本呪已徐徐	作 是 法 上 水 已 隨 力 多 少 於 水 中 念 於 本 呪 已 徐 徐 
X59n1054_001:0092a12	出水取衣著著衣時用水灑於衣上然後取著但次	出 水 取 衣 著 著 衣 時 用 水 灑 於 衣 上 然 後 取 著 但 次 
X59n1054_001:0092a13	二手取水為拳用灑即是是印呪曰。	二 手 取 水 為 拳 用 灑 即 是 是 印 呪 曰 
X59n1054_001:0092a14	唵(一)薩婆怛他揭多(二)地瑟耻(二合)多(三)阿磨至皤囉	唵 一 薩 婆 怛 他 揭 多 二 地 瑟 耻 二 合 多 三 阿 磨 至 皤 囉 
X59n1054_001:0092a15	(四)莎訶	 四 莎 訶 
X59n1054_001:0092a16	次著衣印呪其印唯以二手各為拳即是呪曰。	次 著 衣 印 呪 其 印 唯 以 二 手 各 為 拳 即 是 呪 曰 
X59n1054_001:0092a17	唵(一)肥摩羅跛哩(二)皤[口*栗]多(三)跋折哩(四)吽	唵 一 肥 摩 羅 跛 哩 二 皤 [口栗] 多 三 跋 折 哩 四 吽 
X59n1054_001:0092a18	誦是呪著衣并著瓔珞頭冠鐶釧及諸嚴身之具皆	誦 是 呪 著 衣 并 著 瓔 珞 頭 冠 鐶 釧 及 諸 嚴 身 之 具 皆 
X59n1054_001:0092a19	同用前呪正澡浴著衣結護於其中間不應起嗔及	同 用 前 呪 正 澡 浴 著 衣 結 護 於其中間 不 應 起 嗔 及 
X59n1054_001:0092a20	邪憶念諸一切穢惡及不吉祥等物皆不應視若澡	邪 憶 念 諸 一 切 穢 惡 及 不 吉 祥 等 物 皆 不 應 視 若 澡 
X59n1054_001:0092a21	浴了已趣精舍時不可跣足而往心中作想有八葉	浴 了 已 趣 精 舍 時 不 可 跣 足 而 往 心 中 作 想 有 八 葉 
X59n1054_001:0092a22	蓮花承其脚足自身與本天形同類想左右皆備天	蓮 花 承 其 脚 足 自 身 與 本 天 形 同 類 想 左 右 皆 備 天 
X59n1054_001:0092a23	龍八部神王圍繞侍從想復觀本神在己面前儼然	龍 八 部 神 王 圍 繞 侍 從 想 復 觀 本 神 在 己 面 前 儼 然 
X59n1054_001:0092a24	而住三界之中一切持誦之人欲出行時無論遠近	而 住 三 界 之 中 一 切 持 誦 之 人 欲 出 行 時 無 論 遠 近 
X59n1054_001:0092b01	路中有生草及諸畜生等不應乘騎諸供養等物及	路 中 有 生 草 及 諸 畜 生 等 不 應 乘 騎 諸 供 養 等 物 及 
X59n1054_001:0092b02	塔影尊像等影及師僧父母等影皆不應踏至精舍	塔 影 尊 像 等 影 及 師 僧 父 母 等 影 皆 不 應 踏 至 精 舍 
X59n1054_001:0092b03	前復更洗嗽口而入精舍初開戶時作一吽聲而入	前 復 更 洗 嗽 口 而 入 精 舍 初 開 戶 時 作 一 吽 聲 而 入 
X59n1054_001:0092b04	入已作禮禮時作如是心三世諸佛菩薩一切法王	入 已 作 禮 禮 時 作 如 是 心 三世諸佛 菩 薩 一 切 法 王 
X59n1054_001:0092b05	常住無變但凡夫宍眼不親覩見作是想已當除三	常 住 無 變 但 凡 夫 宍 眼 不 親 覩 見 作 是 想 已 當 除 三 
X59n1054_001:0092b06	癡發修三福五體投地殷重而禮禮拜之時心口相	癡 發 修 三 福 五體投地 殷 重 而 禮 禮 拜 之 時 心 口 相 
X59n1054_001:0092b07	應作如是言我今歸命一切諸佛及菩薩作是言禮	應 作如是言 我 今 歸 命 一切諸佛 及 菩 薩 作 是 言 禮 
X59n1054_001:0092b08	已便雙膝而跪合掌至心懺悔一切過咎自作教他	已 便 雙 膝 而 跪 合 掌 至 心 懺 悔 一 切 過 咎 自 作 教 他 
X59n1054_001:0092b09	見聞道喜如是等諸惡悉皆懺悔懺悔了復應隨喜	見 聞 道 喜 如 是 等 諸 惡 悉 皆 懺 悔 懺 悔 了 復 應 隨 喜 
X59n1054_001:0092b10	一切功德廣發大願誓修諸善不害於物作是法已	一切功德 廣 發 大 願 誓 修 諸 善 不 害 於 物 作 是 法 已 
X59n1054_001:0092b11	即便右膝著地依前金剛三昧印誦是呪呪曰。	即 便 右膝著地 依 前 金 剛 三 昧 印 誦 是 呪 呪 曰 
X59n1054_001:0092b12	唵(一)跋折羅蜜(二)莎訶	唵 一 跋 折 羅 蜜 二 莎 訶 
X59n1054_001:0092b13	作是印時同以三業供養諸佛能令行者速得金剛	作 是 印 時 同 以 三 業 供 養 諸 佛 能 令 行 者 速 得 金 剛 
X59n1054_001:0092b14	堅固之身作是法竟當半跏趺坐開其二眼於右目	堅 固 之 身 作 是 法 竟 當 半 跏 趺 坐 開 其 二 眼 於 右 目 
X59n1054_001:0092b15	上想一摩字即此摩字全成輝日於左目上想一吒	上 想 一 摩 字 即 此 摩 字 全 成 輝 日 於 左 目 上 想 一 吒 
X59n1054_001:0092b16	字即此吒字全為皎月作是想已周迴四顧如師子	字 即 此 吒 字 全 為 皎 月 作 是 想 已 周 迴 四 顧 如 師 子 
X59n1054_001:0092b17	王於其目中流射金剛威光熾然奔騰赫焰散燒一	王 於 其 目 中 流 射 金 剛 威 光 熾 然 奔 騰 赫 焰 散 燒 一 
X59n1054_001:0092b18	切毗那夜迦作是法能令呪神皆悉歡喜作是想時	切 毗 那 夜 迦 作 是 法 能 令 呪 神 皆 悉 歡 喜 作 是 想 時 
X59n1054_001:0092b19	呪曰。	呪 曰 
X59n1054_001:0092b20	唵跋折囉(二)達[口*呂]瑟耻摩吒	唵 跋 折 囉 二 達 [口呂] 瑟 耻 摩 吒 
X59n1054_001:0092b21	復更燒香以此香煙逐上方虗空界處一切諸魔呪	復 更 燒 香 以 此 香 煙 逐 上 方 虗 空 界 處 一 切 諸 魔 呪 
X59n1054_001:0092b22	曰。	曰 
X59n1054_001:0092b23	唵(一)鉢頭彌儞(二)牟阿耶牟訶耶(三)闍刈牟訶儞(四)	唵 一 鉢 頭 彌 儞 二 牟 阿 耶 牟 訶 耶 三 闍 刈 牟 訶 儞 四 
X59n1054_001:0092b24	莎訶	莎 訶 
X59n1054_001:0092c01	誦此呪燒香淨除上方虗空界魔已即誦部心呪呪	誦 此 呪 燒 香 淨 除 上 方 虗 空 界 魔 已 即 誦 部 心 呪 呪 
X59n1054_001:0092c02	末香和水以為結四方界呪曰。	末 香 和 水 以 為 結 四 方 界 呪 曰 
X59n1054_001:0092c03	唵(一)阿路力(二)莎訶	唵 一 阿 路 力 二 莎 訶 
X59n1054_001:0092c04	作是法已復作是觀一紇哩字無量壽如來從是字	作 是 法 已 復 作 是 觀 一 紇 哩 字 無 量 壽 如 來 從 是 字 
X59n1054_001:0092c05	起身流妙乳水乃成大海於是海中想一鉢羅全此	起 身 流 妙 乳 水 乃 成 大 海 於 是 海 中 想 一 鉢 羅 全 此 
X59n1054_001:0092c06	鉢羅字化成一龜其形縱廣無量色如黃金於其背	鉢 羅 字 化 成 一 龜 其 形 縱 廣 無 量 色 如 黃 金 於 其 背 
X59n1054_001:0092c07	上想一紇哩字即此字復化為一蓮花其芲赤色皆	上 想 一 紇 哩 字 即 此 字 復 化 為 一 蓮 花 其 芲 赤 色 皆 
X59n1054_001:0092c08	有八葉葉有三重復於此芲中想蘇字蘇字兩邊各	有 八 葉 葉 有 三 重 復 於 此 芲 中 想 蘇 字 蘇 字 兩 邊 各 
X59n1054_001:0092c09	想有一吽字是乃化成一須彌盧山山有八峯眾寶	想 有 一 吽 字 是 乃 化 成 一 須 彌 盧 山 山 有 八 峯 眾 寶 
X59n1054_001:0092c10	合成於此山中復觀五室中室從胡字起東室從吽	合 成 於 此 山 中 復 觀 五 室 中 室 從 胡 字 起 東 室 從 吽 
X59n1054_001:0092c11	字起南室從怛落字起西室從紇哩字起北室從阿	字 起 南 室 從 怛 落 字 起 西 室 從 紇 哩 字 起 北 室 從 阿 
X59n1054_001:0092c12	字起即此五室外似有五而內是一室中有八大金	字 起 即 此 五 室 外 似 有 五 而 內 是 一 室 中 有 八 大 金 
X59n1054_001:0092c13	剛柱妙寶共成廁填間錯珍奇瑩飾上有摩竭魚首	剛 柱 妙 寶 共 成 廁 填 間 錯 珍 奇 瑩 飾 上 有 摩 竭 魚 首 
X59n1054_001:0092c14	牙銜寶[鋩亡+杲]懸以金鈴周垂瓔珞張以寶帳覺花莊嚴	牙 銜 寶 [鋩亡杲] 懸 以 金 鈴 周 垂 瓔 珞 張 以 寶 帳 覺 花 莊 嚴 
X59n1054_001:0092c15	[糸*畏]網帶萎蕤交連淨光相映頗璃等寶以為其地於	[糸畏] 網 帶 萎 蕤 交 連 淨 光 相 映 頗 璃 等 寶 以 為 其 地 於 
X59n1054_001:0092c16	其地上散布妙花俱蘇摩等淨戒塗香馥郁殊特燒	其 地 上 散 布 妙 花 俱 蘇 摩 等 淨 戒 塗 香 馥 郁 殊 特 燒 
X59n1054_001:0092c17	解脫香氤氛超勝智摩尼燈彩光晃耀寶樹行列香	解 脫 香 氤 氛 超 勝 智 摩 尼 燈 彩 光 晃 耀 寶 樹 行 列 香 
X59n1054_001:0092c18	風微觸妙俱發綺幡繽紛互相掩映種種無量藥叉	風 微 觸 妙 俱 發 綺 幡 繽 紛 互 相 掩 映 種 種 無 量 藥 叉 
X59n1054_001:0092c19	羅剎諸天等類前後圍遶奏諸音樂舞金剛舞讚金	羅 剎 諸 天 等 類 前 後 圍 遶 奏 諸 音 樂 舞 金 剛 舞 讚 金 
X59n1054_001:0092c20	剛歌瑞雲彌漫雨妙香花滿虗空中歷亂徐墜種種	剛 歌 瑞 雲 彌 漫 雨 妙 香 花 滿 虗 空 中 歷 亂 徐 墜 種 種 
X59n1054_001:0092c21	飲食安置供養行法之人應常如是澄渟諦觀與心	飲 食 安 置 供 養 行 法 之 人 應 常 如 是 澄 渟 諦 觀 與 心 
X59n1054_001:0092c22	相應入是觀時先誦是呪呪曰。	相 應 入 是 觀 時 先 誦 是 呪 呪 曰 
X59n1054_001:0092c23	那牟三曼多勃陀南(一)薩婆多他欠(二)嗢那刈諦(三)	那 牟 三 曼 多 勃 陀 南 一 薩 婆 多 他 欠 二 嗢 那 刈 諦 三 
X59n1054_001:0092c24	悉頗囉醯[牟*含](四)伽伽那絙(五)莎訶	悉 頗 囉 醯 [牟含] 四 伽 伽 那 絙 五 莎 訶 
X59n1054_001:0093a01	誦是明呪入諸三昧隨心所觀皆悉成就是佛誠言	誦 是 明 呪 入 諸 三 昧 隨 心 所 觀 皆 悉 成 就 是 佛 誠 言 
X59n1054_001:0093a02	不應疑也所以先作是觀者欲令內外清淨猶如虗	不 應 疑 也 所 以 先 作 是 觀 者 欲 令 內 外 清 淨 猶 如 虗 
X59n1054_001:0093a03	空不著一切自性清淨為淨身故復誦此呪與心印	空 不 著 一 切 自 性 清 淨 為 淨 身 故 復 誦 此 呪 與 心 印 
X59n1054_001:0093a04	俱呪曰。	俱 呪 曰 
X59n1054_001:0093a05	唵(一)莎婆皤嚩輸陀(二)薩婆達摩(三)莎婆皤婆輸度含	唵 一 莎 婆 皤 嚩 輸 陀 二 薩 婆 達 摩 三 莎 婆 皤 婆 輸 度 含 
X59n1054_001:0093a06	誦此明呪淨身畢已復作是言無量劫來淪流生死	誦 此 明 呪 淨 身 畢 已 復 作 是 言 無 量 劫 來 淪 流 生 死 
X59n1054_001:0093a07	溺煩惱埿不逢良友而隨安心不能出離於無上道	溺 煩 惱 埿 不 逢 良 友 而 隨 安 心 不 能 出 離 於 無 上 道 
X59n1054_001:0093a08	不起忻求是故今發菩提心應當口稱阿字此字是	不 起 忻 求 是 故 今 發菩提心 應 當 口 稱 阿 字 此 字 是 
X59n1054_001:0093a09	無生義趣空寂門唯獨此門能遠塵垢順此法者能	無 生 義 趣 空 寂 門 唯 獨 此 門 能 遠 塵 垢 順 此 法 者 能 
X59n1054_001:0093a10	除行人無量劫中微塵數罪譬如淨空明日善照一	除 行 人 無 量 劫 中 微 塵 數 罪 譬 如 淨 空 明 日 善 照 一 
X59n1054_001:0093a11	切幽暗自然開曉日者慧日空者呪空以斯慧日照	切 幽 暗 自 然 開 曉 日 者 慧 日 空 者 呪 空 以 斯 慧 日 照 
X59n1054_001:0093a12	於呪空除煩惱暗以澄淨心觀虗空界有諸如來數	於 呪 空 除 煩 惱 暗 以 澄 淨 心 觀 虗 空 界 有 諸 如 來 數 
X59n1054_001:0093a13	如胡麻相好周備是諸如來悉現在前彈指驚覺告	如 胡 麻 相 好 周 備 是 諸 如 來 悉 現 在 前 彈 指 驚 覺 告 
X59n1054_001:0093a14	言善男子汝欲發菩提心者應自觀心爾時行者得	言 善 男 子 汝 欲 發菩提心 者 應 自 觀 心 爾 時 行 者 得 
X59n1054_001:0093a15	斯言已應當踊躍從座而起詣諸佛所五體投地一	斯 言 已 應 當 踊 躍 從座而起 詣 諸 佛 所 五體投地 一 
X59n1054_001:0093a16	心敬禮禮諸佛時應誦是呪曰。	心 敬 禮 禮 諸 佛 時 應 誦 是 呪 曰 
X59n1054_001:0093a17	唵(一)薩婆怛他揭多(二)婆陀盤達那(三)羯嚧弭	唵 一 薩 婆 怛 他 揭 多 二 婆 陀 盤 達 那 三 羯 嚧 弭 
X59n1054_001:0093a18	誦是明呪想禮諸如來已即自觀心觀自心時當誦	誦 是 明 呪 想 禮 諸 如 來 已 即 自 觀 心 觀 自 心 時 當 誦 
X59n1054_001:0093a19	是呪呪曰。	是 呪 呪 曰 
X59n1054_001:0093a20	唵(一)質多鉢囉底吠陀(二)羯嚧彌	唵 一 質 多 鉢 囉 底 吠 陀 二 羯 嚧 彌 
X59n1054_001:0093a21	誦是明呪自想心中作月輪相若未分明即白佛言	誦 是 明 呪 自 想 心 中 作 月 輪 相 若 未 分 明 即 白 佛 言 
X59n1054_001:0093a22	我所作觀而未分明佛言善男子汝應更誦是呪重	我 所 作 觀 而 未 分 明 佛 言 善 男 子 汝 應 更 誦 是 呪 重 
X59n1054_001:0093a23	觀其心極令明淨呪曰。	觀 其 心 極 令 明 淨 呪 曰 
X59n1054_001:0093a24	唵(一)菩提質多母怛波陀夜弭	唵 一 菩 提 質 多 母 怛 波 陀 夜 弭 
X59n1054_001:0093b01	誦是呪觀於心月極明淨已得堅固菩提於月上觀	誦 是 呪 觀 於 心 月 極 明 淨 已 得 堅 固 菩 提 於 月 上 觀 
X59n1054_001:0093b02	一金剛蓮花觀是花時應誦是呪呪曰。	一 金 剛 蓮 花 觀 是 花 時 應 誦 是 呪 呪 曰 
X59n1054_001:0093b03	唵(一)底瑟侘(二)跋折羅(三)鉢陀摩	唵 一 底 瑟 侘 二 跋 折 羅 三 鉢 陀 摩 
X59n1054_001:0093b04	誦此呪用觀於芲於其花上有一金剛以是相故名	誦 此 呪 用 觀 於 芲 於 其 花 上 有 一 金 剛 以 是 相 故 名 
X59n1054_001:0093b05	曰金剛蓮花當作是心即我此身與金剛花非一非	曰 金 剛 蓮 花 當 作 是 心 即 我 此 身 與 金 剛 花 非 一 非 
X59n1054_001:0093b06	異漸漸開敷光明熾盛過無量界入是金剛蓮花開	異 漸 漸 開 敷 光 明 熾 盛 過 無 量 界 入 是 金 剛 蓮 花 開 
X59n1054_001:0093b07	敷光明三昧之時復誦是呪呪曰。	敷 光 明 三 昧 之 時 復 誦 是 呪 呪 曰 
X59n1054_001:0093b08	唵(一)悉頗囉(二)跋折羅(三)鉢陀摩	唵 一 悉 頗 囉 二 跋 折 羅 三 鉢 陀 摩 
X59n1054_001:0093b09	誦是呪觀是開花花之光明照於無量恒河沙數諸	誦 是 呪 觀 是 開 花 花 之 光 明 照 於 無 量 恒 河 沙 數 諸 
X59n1054_001:0093b10	佛妙剎於是光中演暢多利菩薩清朗青聲諮屈如	佛 妙 剎 於 是 光 中 演 暢 多 利 菩 薩 清 朗 青 聲 諮 屈 如 
X59n1054_001:0093b11	是方土如來入是花中是諸如來入斯花已即復徐	是 方 土 如 來 入 是 花 中 是 諸 如 來 入 斯 花 已 即 復 徐 
X59n1054_001:0093b12	徐縮斯妙花如舊無異隨力能觀是身大小而使住	徐 縮 斯 妙 花 如 舊 無 異 隨 力 能 觀 是 身 大 小 而 使 住 
X59n1054_001:0093b13	之作是斂花三昧之時應誦是呪呪曰。	之 作 是 斂 花 三 昧 之 時 應 誦 是 呪 呪 曰 
X59n1054_001:0093b14	唵(一)僧訶囉(二)跋折囉(三)鉢陀摩(二合)	唵 一 僧 訶 囉 二 跋 折 囉 三 鉢 陀 摩 二 合 
X59n1054_001:0093b15	誦此呪斂花隨其大小住已復入金剛蓮花之身三	誦 此 呪 斂 花 隨 其 大 小 住 已 復 入 金 剛 蓮 花 之 身 三 
X59n1054_001:0093b16	昧全此蓮花以成我身入是觀時復誦是呪呪曰。	昧 全 此 蓮 花 以 成 我 身 入 是 觀 時 復 誦 是 呪 呪 曰 
X59n1054_001:0093b17	唵(一)跋折囉(二合)(二)鉢陀摩(二合)(三)恒莽(二合)句含(四)三摩	唵 一 跋 折 囉 二 合 二 鉢 陀 摩 二 合 三 恒 莽 二 合 句 含 四 三 摩 
X59n1054_001:0093b18	庾含(五)摩訶三摩庾含	庾 含 五 摩 訶 三 摩 庾 含 
X59n1054_001:0093b19	觀是金剛蓮花身已即便觀于此身為於聖者觀世	觀 是 金 剛 蓮 花 身 已 即 便 觀 于 此 身 為 於 聖 者 觀 世 
X59n1054_001:0093b20	自在其身相者坐寶蓮花載寶花冠於其冠中有無	自 在 其 身 相 者 坐 寶 蓮 花 載 寶 花 冠 於 其 冠 中 有 無 
X59n1054_001:0093b21	量壽如來坐寶蓮花作說法相是名冠中如來之相	量 壽 如 來 坐 寶 蓮 花 作 說 法 相 是 名 冠 中 如 來 之 相 
X59n1054_001:0093b22	左手執持金剛蓮花其執花手先作蓮花拳已然後	左 手 執 持 金 剛 蓮 花 其 執 花 手 先 作 蓮 花 拳 已 然 後 
X59n1054_001:0093b23	申以中指文及頭指頭與大指相捻小指無名指如	申 以 中 指 文 及 頭 指 頭 與 大 指 相 捻 小 指 無 名 指 如 
X59n1054_001:0093b24	拳以茲印手執金剛花右亦然唯於花上捻一花葉	拳 以 茲 印 手 執 金 剛 花 右 亦 然 唯 於 花 上 捻 一 花 葉 
X59n1054_001:0093c01	作翻花勢如是觀者多利心菩薩聖者至觀所以先	作 翻 花 勢 如 是 觀 者 多 利 心 菩 薩 聖 者 至 觀 所 以 先 
X59n1054_001:0093c02	入斯觀為欲建立此身速獲堅固金剛之身復欲生	入 斯 觀 為 欲 建 立 此 身 速 獲 堅 固 金 剛 之 身 復 欲 生 
X59n1054_001:0093c03	生得如聖之身等無有異建立此身用是印呪應以	生 得 如 聖 之 身 等無有異 建 立 此 身 用 是 印 呪 應 以 
X59n1054_001:0093c04	二手頭指已下三指向外相叉以二頭指頭相拄如	二 手 頭 指 已 下 三 指 向 外 相 叉 以 二 頭 指 頭 相 拄 如 
X59n1054_001:0093c05	蓮花葉並申竪二大指呪曰。	蓮 花 葉 並 申 竪 二 大 指 呪 曰 
X59n1054_001:0093c06	唵(一)訖哩(二合)薩婆迦哩(二)阿地瑟佗(二合)莎縛[牟*含](三)紇	唵 一 訖 哩 二 合 薩 婆 迦 哩 二 阿 地 瑟 佗 二 合 莎 縛 [牟含] 三 紇 
X59n1054_001:0093c07	哩	哩 
X59n1054_001:0093c08	以是印呪印於四處四處者所謂心上眉間喉上頂	以 是 印 呪 印 於 四 處 四 處 者 所 謂 心 上 眉 間 喉 上 頂 
X59n1054_001:0093c09	上是為四處次作自灌頂法能令行者速得三身具	上 是 為 四 處 次 作 自 灌 頂 法 能 令 行 者 速 得 三 身 具 
X59n1054_001:0093c10	足成就是印相者當以二手如常合掌已即蹙頭指	足 成 就 是 印 相 者 當 以 二 手 如 常 合 掌 已 即 蹙 頭 指 
X59n1054_001:0093c11	已下四指頭相拄偃其指背作寶蓮花葉形呪曰。	已 下 四 指 頭 相 拄 偃 其 指 背 作 寶 蓮 花 葉 形 呪 曰 
X59n1054_001:0093c12	唵(一)地哩摩你鉢頭摩(二)阿毗詵者[牟*含]紇哩	唵 一 地 哩 摩 你 鉢 頭 摩 二 阿 毗 詵 者 [牟含] 紇 哩 
X59n1054_001:0093c13	誦此呪舉其印拄於額上便散分手遶頭至頂後已	誦 此 呪 舉 其 印 拄 於 額 上 便 散 分 手 遶 頭 至 頂 後 已 
X59n1054_001:0093c14	尋身徐徐乃至於心住於心前復以二手為金剛拳	尋 身 徐 徐 乃 至 於 心 住 於 心 前 復 以 二 手 為 金 剛 拳 
X59n1054_001:0093c15	即申頭指令直於右頭指面想有一唵字於左頭指	即 申 頭 指 令 直 於 右 頭 指 面 想 有 一 唵 字 於 左 頭 指 
X59n1054_001:0093c16	面想一砧字即以二指相繞其指字上放以光明甚	面 想 一 砧 字 即 以 二 指 相 繞 其 指 字 上 放 以 光 明 甚 
X59n1054_001:0093c17	有威德復以二手繞身向後至於背上亦復從背上	有 威 德 復 以 二 手 繞 身 向 後 至 於 背 上 亦 復 從 背 上 
X59n1054_001:0093c18	繞至臍上亦然復從臍上繞至於腰後復從腰後旋	繞 至 臍 上 亦 然 復 從 臍 上 繞 至 於 腰 後 復 從 腰 後 旋 
X59n1054_001:0093c19	繞周其坐處復從下向上至于咽喉前亦然復從喉	繞 周 其 坐 處 復 從 下 向 上 至 于 咽 喉 前 亦 然 復 從 喉 
X59n1054_001:0093c20	前至於頂後亦然從頂後上至於額上亦然從是額	前 至 於 頂 後 亦 然 從 頂 後 上 至 於 額 上 亦 然 從 是 額 
X59n1054_001:0093c21	上繞至頂後如是繞已徐徐散其二手十指作是法	上 繞 至 頂 後 如 是 繞 已 徐 徐 散 其 二 手 十 指 作 是 法 
X59n1054_001:0093c22	已一切天龍人非人等皆見行者是金剛身披金剛	已 一 切 天 龍 人 非 人 等 皆 見 行 者 是 金 剛 身 披 金 剛 
X59n1054_001:0093c23	甲諸魔邪等不敢正視退散馳走不能為害作是法	甲 諸 魔 邪 等 不 敢 正 視 退 散 馳 走 不 能 為 害 作 是 法 
X59n1054_001:0093c24	次復於面前觀本法像自觀音形相如常又復如前	次 復 於 面 前 觀 本 法 像 自 觀 音 形 相 如 常 又 復 如 前 
X59n1054_001:0094a01	所說妙高山觀五寶室中於其中一心諦觀無量光	所 說 妙 高 山 觀 五 寶 室 中 於 其 中 一 心 諦 觀 無 量 光 
X59n1054_001:0094a02	佛三十二相八十種好光明熾盛於佛右邊有一觀	佛 三十二相 八十種好 光 明 熾 盛 於 佛 右 邊 有 一 觀 
X59n1054_001:0094a03	音聖者於佛左邊有一無垢行菩薩於佛前稍近右	音 聖 者 於 佛 左 邊 有 一 無 垢 行 菩 薩 於 佛 前 稍 近 右 
X59n1054_001:0094a04	畔有聖者多利彌陀如來從紇哩字起形觀音菩薩	畔 有 聖 者 多 利 彌 陀 如 來 從 紇 哩 字 起 形 觀 音 菩 薩 
X59n1054_001:0094a05	從娑字起形無垢菩薩從皤字起形多利聖者從泈	從 娑 字 起 形 無 垢 菩 薩 從 皤 字 起 形 多 利 聖 者 從 泈 
X59n1054_001:0094a06	弄字起形多利菩薩右邊有一使者名為一髻是聖	弄 字 起 形 多 利 菩 薩 右 邊 有 一 使 者 名 為 一 髻 是 聖 
X59n1054_001:0094a07	者乃從噎字變起於形於無垢行菩薩右邊有一毗	者 乃 從 噎 字 變 起 於 形 於 無 垢 行 菩 薩 右 邊 有 一 毗 
X59n1054_001:0094a08	俱胝菩薩是菩薩從於毗字而起於左邊有一馬頭	俱 胝 菩 薩 是 菩 薩 從 於 毗 字 而 起 於 左 邊 有 一 馬 頭 
X59n1054_001:0094a09	菩薩是菩薩復從何字而起於形如是等形相廣如	菩 薩 是 菩 薩 復 從 何 字 而 起 於 形 如 是 等 形 相 廣 如 
X59n1054_001:0094a10	經說於佛面前有一地天是天從波字而起於形復	經 說 於 佛 面 前 有 一 地 天 是 天 從 波 字 而 起 於 形 復 
X59n1054_001:0094a11	於四方各想有神以為侍衛其東方神名曰印達囉	於 四 方 各 想 有 神 以 為 侍 衛 其 東 方 神 名 曰 印 達 囉 
X59n1054_001:0094a12	是神女容披金剛甲手執金剛而護東方南方有神	是 神 女 容 披 金 剛 甲 手 執 金 剛 而 護 東 方 南 方 有 神 
X59n1054_001:0094a13	名曰焰摩是神女容只披衣甲執焰摩杖而護南方	名 曰 焰 摩 是 神 女 容 只 披 衣 甲 執 焰 摩 杖 而 護 南 方 
X59n1054_001:0094a14	西方有神名曰皤嚧你披以甲冑亦作女容執於弓	西 方 有 神 名 曰 皤 嚧 你 披 以 甲 冑 亦 作 女 容 執 於 弓 
X59n1054_001:0094a15	矢而護西方北方有神名曰俱毗哩容狀衣甲一依	矢 而 護 西 方 北 方 有 神 名 曰 俱 毗 哩 容 狀 衣 甲 一 依 
X59n1054_001:0094a16	如前手中執一花棒而護北方如是神等皆有威光	如 前 手 中 執 一 花 棒 而 護 北 方 如 是 神 等 皆 有 威 光 
X59n1054_001:0094a17	必使歷然想觀如對目前作是法觀已復以本明呪	必 使 歷 然 想 觀 如 對 目 前 作 是 法 觀 已 復 以 本 明 呪 
X59n1054_001:0094a18	中呪字想在於身先以唵字想於頂上次以多字想	中 呪 字 想 在 於 身 先 以 唵 字 想 於 頂 上 次 以 多 字 想 
