X59n1054_001:0096c12	生十方淨土印　以合掌當心二大母指並拄心上	生 十 方 淨 土 印 以 合 掌 當 心 二 大 母 指 並 拄 心 上 
X59n1054_001:0096c13	作此印時為一切眾生臨命終誦呪一心為作印法	作 此 印 時 為 一 切 眾 生 臨 命 終 誦 呪 一 心 為 作 印 法 
X59n1054_001:0096c14	欲樂生何佛國隨意往生誦根本呪。	欲 樂 生 何 佛 國 隨 意 往 生 誦 根 本 呪 
X59n1054_001:0096c15	見觀音菩薩印　以二無名指及小指各反相叉右	見 觀 音 菩 薩 印 以 二 無 名 指 及 小 指 各 反 相 叉 右 
X59n1054_001:0096c16	押左二中指並頭直竪頭相拄二頭指各屈第二節	押 左 二 中 指 並 頭 直 竪 頭 相 拄 二 頭 指 各 屈 第 二 節 
X59n1054_001:0096c17	及第三節兩甲相背二大指押二頭指節上專心正	及 第 三 節 兩 甲 相 背 二 大 指 押 二 頭 指 節 上 專 心 正 
X59n1054_001:0096c18	念當現身時見已懺悔觀世音菩薩語行者言汝欲	念 當 現 身 時 見 已 懺 悔 觀 世 音 菩 薩 語 行 者 言 汝 欲 
X59n1054_001:0096c19	何願隨願皆滿作此法者當誦根本呪。	何 願 隨 願 皆 滿 作 此 法 者 當 誦 根 本 呪 
X59n1054_001:0096c20	總攝印　兩手腕仰相叉右大母指壓左大母指兩	總 攝 印 兩 手 腕 仰 相 叉 右 大 母 指 壓 左 大 母 指 兩 
X59n1054_001:0096c21	手八持急把拳此印總攝一切母陀羅尼總攝印呪	手 八 持 急 把 拳 此 印 總攝一切 母 陀 羅 尼 總 攝 印 呪 
X59n1054_001:0096c22	曰。	曰 
X59n1054_001:0096c23	唵(一)薩婆那庾多(二)母陀囉耶(三)盤陀盤陀(四)莎訶	唵 一 薩 婆 那 庾 多 二 母 陀 囉 耶 三 盤 陀 盤 陀 四 莎 訶 
X59n1054_001:0096c24	滿六度印　以兩手反合掌背相著戾腕向外以二	滿 六 度 印 以 兩 手 反 合 掌 背 相 著 戾 腕 向 外 以 二 
X59n1054_001:0097a01	大指當眉間向下垂作此印時起菩薩心觀一切蒼	大 指 當 眉 間 向 下 垂 作 此 印 時 起 菩 薩 心 觀 一 切 蒼 
X59n1054_001:0097a02	生猶如赤子一切眾生皆具足六波羅蜜所願滿足	生 猶 如 赤 子 一 切 眾 生 皆 具 足 六波羅蜜 所 願 滿 足 
X59n1054_001:0097a03	恒沙世界諸佛悉皆歡喜呪曰。	恒 沙 世 界 諸 佛 悉 皆 歡 喜 呪 曰 
X59n1054_001:0097a04	怛姪他(一)薩婆菩陀耶(二)薩婆鉢唎欀(三)波羅蜜多	怛 姪 他 一 薩 婆 菩 陀 耶 二 薩 婆 鉢 唎 欀 三 波羅蜜多 
X59n1054_001:0097a05	曳(四)唵(五)訶婆訶娑(六)莎訶(七)怛姪他(八)弭哩多哩	曳 四 唵 五 訶 婆 訶 娑 六 莎 訶 七 怛 姪 他 八 弭 哩 多 哩 
X59n1054_001:0097a06	(九)莎訶	 九 莎 訶 
X59n1054_001:0097a07	神足印　先以右手中指無名指屈在掌中以大指	神 足 印 先 以 右 手 中 指 無 名 指 屈 在 掌 中 以 大 指 
X59n1054_001:0097a08	押無名指中指甲上誦根本呪以摩兩足日馳千里	押 無 名 指 中 指 甲 上 誦 根 本 呪 以 摩 兩 足 日 馳 千 里 
X59n1054_001:0097a09	作此印時地神捧七寶花臺承行者足凡夫肉眼不	作 此 印 時 地 神 捧 七 寶 花 臺 承 行 者 足 凡 夫 肉 眼 不 
X59n1054_001:0097a10	見但生慈悲救護之心不為名聞利養必得萬神扶	見 但 生 慈 悲 救 護 之 心 不 為 名 聞 利 養 必 得 萬 神 扶 
X59n1054_001:0097a11	助。	助 
X59n1054_001:0097a12	隨心印　以右手頭指與左手小指相去開一寸許	隨 心 印 以 右 手 頭 指 與 左 手 小 指 相 去 開 一 寸 許 
X59n1054_001:0097a13	依此印時誦根本呪所願皆得。	依 此 印 時 誦 根 本 呪 所 願 皆 得 
X59n1054_001:0097a14	破諸天龍印　以右手捻左手背上四指向下相叉	破 諸 天 龍 印 以 右 手 捻 左 手 背 上 四 指 向 下 相 叉 
X59n1054_001:0097a15	以左手四指來去呪曰。	以 左 手 四 指 來 去 呪 曰 
X59n1054_001:0097a16	唵(一)俱嚧陀(二)薩婆提婆多(三)莎訶	唵 一 俱 嚧 陀 二 薩 婆 提 婆 多 三 莎 訶 
X59n1054_001:0097a17	隱形入六道印　以右手大指押無名指中指甲上	隱 形 入 六 道 印 以 右 手 大 指 押 無 名 指 中 指 甲 上 
X59n1054_001:0097a18	頭指及小指直竪左手亦然以大指從下向上入於	頭 指 及 小 指 直 竪 左 手 亦 然 以 大 指 從 下 向 上 入 於 
X59n1054_001:0097a19	右掌中鉤取左手中指無名指右指押左指呪曰。	右 掌 中 鉤 取 左 手 中 指 無 名 指 右 指 押 左 指 呪 曰 
X59n1054_001:0097a20	唵(一)俱[口*(鯬魚+木)]耶底(二)薩婆迦[口*梨]耶你(三)莎訶	唵 一 俱 [口鯬魚木]耶底二薩婆迦[口梨] 耶 你 三 莎 訶 
X59n1054_001:0097a21	作此法印時隱形遊行自在一切興心悉皆如願	作 此 法 印 時 隱 形 遊 行 自 在 一 切 興 心 悉 皆 如 願 
X59n1054_001:0097a22	多利菩薩身印　以中指已下三指內相叉竪二頭	多 利 菩 薩 身 印 以 中 指 已 下 三 指 內 相 叉 竪 二 頭 
X59n1054_001:0097a23	指相著並竪二大指呪曰。	指 相 著 並 竪 二 大 指 呪 曰 
X59n1054_001:0097a24	唵(一)多唎多唎(二)咄多唎(三)咄多唎(四)咄唎咄唎(五)	唵 一 多 唎 多 唎 二 咄 多 唎 三 咄 多 唎 四 咄 唎 咄 唎 五 
X59n1054_001:0097b01	莎訶	莎 訶 
X59n1054_001:0097b02	若作此一切印時甚須祕密不得於不淨處及露地	若 作 此 一 切 印 時 甚 須 祕 密 不 得 於 不 淨 處 及 露 地 
X59n1054_001:0097b03	輕心而結若結印時當以淨衣覆上不令人見及未	輕 心 而 結 若 結 印 時 當 以 淨 衣 覆 上 不 令 人 見 及 未 
X59n1054_001:0097b04	入三昧壇人亦不得對前結印作此印供養已方始	入 三 昧 壇 人 亦 不 得 對 前 結 印 作 此 印 供 養 已 方 始 
X59n1054_001:0097b05	安心念誦念誦之時當誦是呪。	安 心 念 誦 念 誦 之 時 當 誦 是 呪 
X59n1054_001:0097b06	唵(一)多唎(二)咄多唎(五)咄唎(四)莎訶	唵 一 多 唎 二 咄 多 唎 五 咄 唎 四 莎 訶 
X59n1054_001:0097b07	若誦此呪或誦前根本呪並得觀此呪字一一從本	若 誦 此 呪 或 誦 前 根 本 呪 並 得 觀 此 呪 字 一 一 從 本 
X59n1054_001:0097b08	神口出放七寶光入行者口銜行者心中月上周旋	神 口 出 放 七 寶 光 入 行 者 口 銜 行 者 心 中 月 上 周 旋 
X59n1054_001:0097b09	行列觀已即用蓮花子珠念誦捻珠之時應以大指	行 列 觀 已 即 用 蓮 花 子 珠 念 誦 捻 珠 之 時 應 以 大 指 
X59n1054_001:0097b10	及無名指相捻之。	及 無 名 指 相 捻 之 
X59n1054_001:0097b11	念誦初摯珠誦小心呪三遍呪曰。	念 誦 初 摯 珠 誦 小 心 呪 三 遍 呪 曰 
X59n1054_001:0097b12	唵(一)矩嚕矩隷(二)莎訶	唵 一 矩 嚕 矩 隷 二 莎 訶 
X59n1054_001:0097b13	作是法念誦應隨意多少所樂念之廣發大願隨所	作 是 法 念 誦 應 隨 意 多 少 所 樂 念 之 廣 發 大 願 隨 所 
X59n1054_001:0097b14	為皆悉陳請或[舍*巨]重結前印者悉當結之若不能總	為 皆 悉 陳 請 或 [舍巨] 重 結 前 印 者 悉 當 結 之 若 不 能 總 
X59n1054_001:0097b15	結者但結前三三昧耶印亦得結此印已當誦是呪	結 者 但 結 前 三 三 昧 耶 印 亦 得 結 此 印 已 當 誦 是 呪 
X59n1054_001:0097b16	發遣天等也呪曰。	發 遣 天 等 也 呪 曰 
X59n1054_001:0097b17	唵(一)訖[口*栗]覩皤薩婆薩埵遏他悉地捺多曳他奴伽	唵 一 訖 [口栗] 覩 皤 薩 婆 薩 埵 遏 他 悉 地 捺 多 曳 他 奴 伽 
X59n1054_001:0097b18	揭車(二)覩舍勃陀毗沙焰(三)布那羅伽(四)摩那耶覩	揭 車 二 覩 舍 勃 陀 毗 沙 焰 三 布 那 羅 伽 四 摩 那 耶 覩 
X59n1054_001:0097b19	唵縛日囉(二合)鉢達摩目	唵 縛 日 囉 二 合 鉢 達 摩 目 
X59n1054_001:0097b20	誦是呪結合蓮三昧印舉印安頭上散之如本來時	誦 是 呪 結 合 蓮 三 昧 印 舉 印 安 頭 上 散 之 如 本 來 時 
X59n1054_001:0097b21	法亦同相復當如前發願迴向已禮一切諸佛菩薩	法 亦 同 相 復 當 如 前 發 願 迴 向 已 禮 一切諸佛 菩 薩 
X59n1054_001:0097b22	等散前自觀自身菩薩想令復本形心常於諸有情	等 散 前 自 觀 自 身 菩 薩 想 令 復 本 形 心 常 於諸有情 
X59n1054_001:0097b23	起救度心已然後隨意出於精舍樞要。	起 救 度 心 已 然 後 隨 意 出 於 精 舍 樞 要 
X59n1054_001:0097b24	蓮花部多利心菩薩法一卷	蓮 花 部 多 利 心 菩 薩 法 一 卷 
