X59n1054_001:0094a19	在於額又以梨字想在於二目復以咄字想安喉上	在 於 額 又 以 梨 字 想 在 於 二 目 復 以 咄 字 想 安 喉 上 
X59n1054_001:0094a20	更以多字想在於二肩重以囇字想在心上再以覩	更 以 多 字 想 在 於 二 肩 重 以 囇 字 想 在 心 上 再 以 覩 
X59n1054_001:0094a21	字想在臍上又想唎字在於兩脾又想其莎字在二	字 想 在 臍 上 又 想 唎 字 在 於 兩 脾 又 想 其 莎 字 在 二 
X59n1054_001:0094a22	脛又想訶字想於二足之上今想此十字周布於身	脛 又 想 訶 字 想 於 二 足 之 上 今 想 此 十 字 周 布 於 身 
X59n1054_001:0094a23	已然復作寶車印用迎諸聖者等所以先作前本神	已 然 復 作 寶 車 印 用 迎 諸 聖 者 等 所 以 先 作 前 本 神 
X59n1054_001:0094a24	身觀然後方請聖者所為一一觀諸天知其相已方	身 觀 然 後 方 請 聖 者 所 為 一 一 觀 諸 天 知 其 相 已 方 
X59n1054_001:0094b01	請慧身來就法體由是義故先觀請寶車印者當以	請 慧 身 來 就 法 體 由 是 義 故 先 觀 請 寶 車 印 者 當 以 
X59n1054_001:0094b02	二手平仰頭指已下三指向內相叉以二頭指側相	二 手 平 仰 頭 指 已 下 三 指 向 內 相 叉 以 二 頭 指 側 相 
X59n1054_001:0094b03	拄以大母指向內撥其中指頭是名寶車印想是寶	拄 以 大 母 指 向 內 撥 其 中 指 頭 是 名 寶 車 印 想 是 寶 
X59n1054_001:0094b04	車而往諸尊所諸尊皆共乘此寶車而來想於是車	車 而 往 諸 尊 所 諸 尊 皆 共 乘 此 寶 車 而 來 想 於 是 車 
X59n1054_001:0094b05	上想有寶室眾寶莊嚴張覆寶網鈴珮周垂於其網	上 想 有 寶 室 眾 寶 莊 嚴 張 覆 寶 網 鈴 珮 周 垂 於 其 網 
X59n1054_001:0094b06	間皆有妙摩尼寶微光皎映乘五彩色雲飛昇而往	間 皆 有 妙 摩 尼 寶 微 光 皎 映 乘 五 彩 色 雲 飛 昇 而 往 
X59n1054_001:0094b07	是印呪曰。	是 印 呪 曰 
X59n1054_001:0094b08	唵(一)覩嚧覩嚧(二)吽	唵 一 覩 嚧 覩 嚧 二 吽 
X59n1054_001:0094b09	誦是呪以前印想往神所已復以本部心呪及印請	誦 是 呪 以 前 印 想 往 神 所 已 復 以 本 部 心 呪 及 印 請 
X59n1054_001:0094b10	聖者降赴部心印者以手十指向內相叉為拳即抽	聖 者 降 赴 部 心 印 者 以 手 十 指 向 內 相 叉 為 拳 即 抽 
X59n1054_001:0094b11	出其右大母指向內招之呪曰。	出 其 右 大 母 指 向 內 招 之 呪 曰 
X59n1054_001:0094b12	唵(一)阿嚧力(二)莎訶	唵 一 阿 嚧 力 二 莎 訶 
X59n1054_001:0094b13	前以寶車印呪先往迎之次更以部心呪印請降與	前 以 寶 車 印 呪 先 往 迎 之 次 更 以 部 心 呪 印 請 降 與 
X59n1054_001:0094b14	其俱來就行者所受供利益人天是來時復以馬頭	其 俱 來 就 行 者 所 受 供 利 益 人 天 是 來 時 復 以 馬 頭 
X59n1054_001:0094b15	菩薩印呪而以召之其印二手頭指已下三指向外	菩 薩 印 呪 而 以 召 之 其 印 二 手 頭 指 已 下 三 指 向 外 
X59n1054_001:0094b16	相叉為拳二大指右押左相交以二頭指屈中節背	相 叉 為 拳 二 大 指 右 押 左 相 交 以 二 頭 指 屈 中 節 背 
X59n1054_001:0094b17	相著即成呪曰。	相 著 即 成 呪 曰 
X59n1054_001:0094b18	唵(一)訶耶吉唎婆(二)摩訶鉢娜摩(三)矩舍羯哩莎耶	唵 一 訶 耶 吉 唎 婆 二 摩 訶 鉢 娜 摩 三 矩 舍 羯 哩 莎 耶 
X59n1054_001:0094b19	(四)施伽藍(二合)(五)薩婆鉢頭摩矩羅(六)三摩衍鉢頭摩	 四 施 伽 藍 二 合 五 薩 婆 鉢 頭 摩 矩 羅 六 三 摩 衍 鉢 頭 摩 
X59n1054_001:0094b20	(七)矩舍達囉(八)吽闍(入聲呼此印呪出恒僧碣羅訶經)	 七 矩 舍 達 囉 八 吽 闍 入 聲 呼 此 印 呪 出 恒 僧 碣 羅 訶 經 
X59n1054_001:0094b21	當用是印呪召之召時以頭指招之其車臨至復用	當 用 是 印 呪 召 之 召 時 以 頭 指 招 之 其 車 臨 至 復 用 
X59n1054_001:0094b22	本印呪下之以左手握其右手腕以左手安頂上向	本 印 呪 下 之 以 左 手 握 其 右 手 腕 以 左 手 安 頂 上 向 
X59n1054_001:0094b23	前招之呪曰。	前 招 之 呪 曰 
X59n1054_001:0094b24	唵(一)薩婆薩埵南(二)噎醯噎醯(三)莎訶	唵 一 薩 婆 薩 埵 南 二 噎 醯 噎 醯 三 莎 訶 
X59n1054_001:0094c01	用是印呪以下寶車下寶車已入寶室時復以此印	用 是 印 呪 以 下 寶 車 下 寶 車 已 入 寶 室 時 復 以 此 印 
X59n1054_001:0094c02	呪入之以二手虗中合掌令指頭相拄即交二頭指	呪 入 之 以 二 手 虗 中 合 掌 令 指 頭 相 拄 即 交 二 頭 指 
X59n1054_001:0094c03	上文右押左即是呪曰。	上 文 右 押 左 即 是 呪 曰 
X59n1054_001:0094c04	唵(一)阿牟伽鉢達摩波舍(二)俱嚧陀(三)阿迦哩沙耶	唵 一 阿 牟 伽 鉢 達 摩 波 舍 二 俱 嚧 陀 三 阿 迦 哩 沙 耶 
X59n1054_001:0094c05	(四)鉢囉吠舍耶(五)摩訶波輸波底(六)焰摩婆嚧拏(七)	 四 鉢 囉 吠 舍 耶 五 摩 訶 波 輸 波 底 六 焰 摩 婆 嚧 拏 七 
X59n1054_001:0094c06	俱毗囉勃囉摩(八)唵吠沙達囉(九)鉢頭摩俱囉(十)三	俱 毗 囉 勃 囉 摩 八 唵 吠 沙 達 囉 九 鉢 頭 摩 俱 囉 十 三 
X59n1054_001:0094c07	摩衍(十一)吽吽(十二)	摩 衍 十 一 吽 吽 十 二 
X59n1054_001:0094c08	以是印呪請蓮花中一切諸呪天等入於寶室入已	以 是 印 呪 請 蓮 花 中 一 切 諸 呪 天 等 入 於 寶 室 入 已 
X59n1054_001:0094c09	方更設座令坐坐印以二手腕相著直竪十指散開	方 更 設 座 令 坐 坐 印 以 二 手 腕 相 著 直 竪 十 指 散 開 
X59n1054_001:0094c10	如似開蓮想即是呪曰。	如 似 開 蓮 想 即 是 呪 曰 
X59n1054_001:0094c11	唵(一)薩婆鉢囉毗瑟吒(二)菩達那耶(三)莎訶	唵 一 薩 婆 鉢 囉 毗 瑟 吒 二 菩 達 那 耶 三 莎 訶 
X59n1054_001:0094c12	以是呪印設座已請諸天坐已當即獻其香水是水	以 是 呪 印 設 座 已 請 諸 天 坐 已 當 即 獻 其 香 水 是 水 
X59n1054_001:0094c13	名曰遏迦水也水印者以二手頭指已下三指握大	名 曰 遏 迦 水 也 水 印 者 以 二 手 頭 指 已 下 三 指 握 大 
X59n1054_001:0094c14	母指為拳以二頭指屈頭相拄呪曰。	母 指 為 拳 以 二 頭 指 屈 頭 相 拄 呪 曰 
X59n1054_001:0094c15	唵(一)薩婆烏特迦揭囉闍耶(二)莎訶	唵 一 薩 婆 烏 特 迦 揭 囉 闍 耶 二 莎 訶 
X59n1054_001:0094c16	以是印香水供養其水當白檀香埿等和之供養水	以 是 印 香 水 供 養 其 水 當 白 檀 香 埿 等 和 之 供 養 水 
X59n1054_001:0094c17	已即作閉門印以二手虗中合掌已即屈二頭指上	已 即 作 閉 門 印 以 二 手 虗 中 合 掌 已 即 屈 二 頭 指 上 
X59n1054_001:0094c18	文左押右相叉以二大指右押左相叉各捻其頭指	文 左 押 右 相 叉 以 二 大 指 右 押 左 相 叉 各 捻 其 頭 指 
X59n1054_001:0094c19	頭呪曰。	頭 呪 曰 
X59n1054_001:0094c20	唵(一)鉢頭摩(二)塞怖吒槃陀(三)薩婆鉢頭摩俱囉(四)	唵 一 鉢 頭 摩 二 塞 怖 吒 槃 陀 三 薩 婆 鉢 頭 摩 俱 囉 四 
X59n1054_001:0094c21	三摩衍(五)此揭藍(六)吽(七)蓇	三 摩 衍 五 此 揭 藍 六 吽 七 蓇 
X59n1054_001:0094c22	誦是呪用是印而閉於前寶室四門作是法已復作	誦 是 呪 用 是 印 而 閉 於 前 寶 室 四 門 作 是 法 已 復 作 
X59n1054_001:0094c23	歡喜印呪法令諸聖者等皆大歡喜合二手以二頭	歡 喜 印 呪 法 令 諸 聖 者 等 皆大歡喜 合 二 手 以 二 頭 
X59n1054_001:0094c24	指屈頭相拄以大指並屈入掌呪曰。	指 屈 頭 相 拄 以 大 指 並 屈 入 掌 呪 曰 
X59n1054_001:0095a01	唵(一)沙牟佉婆捺俱摩囉(二)吠沙達囉(三)鉢頭摩徤	唵 一 沙 牟 佉 婆 捺 俱 摩 囉 二 吠 沙 達 囉 三 鉢 頭 摩 徤 
X59n1054_001:0095a02	吒耶毗舍耶(四)薩婆鉢頭摩俱囉(五)三摩衍(六)薩婆	吒 耶 毗 舍 耶 四 薩 婆 鉢 頭 摩 俱 囉 五 三 摩 衍 六 薩 婆 
X59n1054_001:0095a03	沒搸藍(七)盤陀耶(八)薩婆悉地喻彌(九)鉢羅(二合)曳車	沒 搸 藍 七 盤 陀 耶 八 薩 婆 悉 地 喻 彌 九 鉢 羅 二 合 曳 車 
X59n1054_001:0095a04	(十)鉢頭摩吠舍(十一)阿阿阿阿(十二)	 十 鉢 頭 摩 吠 舍 十 一 阿 阿 阿 阿 十 二 
X59n1054_001:0095a05	作是法已便作淨地結下方金剛[檎离+土]印以中指左押	作 是 法 已 便 作 淨 地 結 下 方 金 剛 [檎离土] 印 以 中 指 左 押 
X59n1054_001:0095a06	右相交各以頭安頭指波間二無名指亦左押右相	右 相 交 各 以 頭 安 頭 指 波 間 二 無 名 指 亦 左 押 右 相 
X59n1054_001:0095a07	交以頭安小指岐間以二小指頭相拄頭指頭亦相	交 以 頭 安 小 指 岐 間 以 二 小 指 頭 相 拄 頭 指 頭 亦 相 
X59n1054_001:0095a08	拄二大指頭合相著呪曰。	拄 二 大 指 頭 合 相 著 呪 曰 
X59n1054_001:0095a09	唵(一)枳哩枳哩(二)跋折囉步羅(三)盤陀盤陀(四)吽(五)	唵 一 枳 哩 枳 哩 二 跋 折 囉 步 羅 三 盤 陀 盤 陀 四 吽 五 
X59n1054_001:0095a10	泮(六)莎訶	泮 六 莎 訶 
X59n1054_001:0095a11	以此印觸地能令下方一切毗那夜迦皆悉遠離作	以 此 印 觸 地 能 令 下 方 一 切 毗 那 夜 迦 皆 悉 遠 離 作 
X59n1054_001:0095a12	是法已復作結護四方印其印準前唯改竪二大指	是 法 已 復 作 結 護 四 方 印 其 印 準 前 唯 改 竪 二 大 指 
X59n1054_001:0095a13	即是呪曰。	即 是 呪 曰 
X59n1054_001:0095a14	唵(一)娑囉娑囉(二)跋折囉(二)鉢囉迦囉(四)吽(五)泮(六)	唵 一 娑 囉 娑 囉 二 跋 折 囉 二 鉢 囉 迦 囉 四 吽 五 泮 六 
X59n1054_001:0095a15	莎訶	莎 訶 
X59n1054_001:0095a16	誦是呪以將此印繞身三轉即成四方界是法除四	誦 是 呪 以 將 此 印 繞 身 三 轉 即 成 四 方 界 是 法 除 四 
X59n1054_001:0095a17	方魔鄣作是法已即結上方界其印準前唯改二頭	方 魔 鄣 作 是 法 已 即 結 上 方 界 其 印 準 前 唯 改 二 頭 
X59n1054_001:0095a18	指相交以二大指頭與二頭指頭相拄呪曰。	指 相 交 以 二 大 指 頭 與 二 頭 指 頭 相 拄 呪 曰 
X59n1054_001:0095a19	唵(一)毗悉普囉(二)捺落訖叉(三)跋折囉盤闍囉(四)吽	唵 一 毗 悉 普 囉 二 捺 落 訖 叉 三 跋 折 囉 盤 闍 囉 四 吽 
X59n1054_001:0095a20	(五)泮(六)莎訶	 五 泮 六 莎 訶 
X59n1054_001:0095a21	以用此印呪結於上方界訖作是結護法已然□□	以 用 此 印 呪 結 於 上 方 界 訖 作 是 結 護 法 已 然 
X59n1054_001:0095a22	秘密內外四種供養法先說內四種印第一名為鉢	秘 密 內 外 四 種 供 養 法 先 說 內 四 種 印 第 一 名 為 鉢 
X59n1054_001:0095a23	達摩羅寫此印相以二手頭指已下四指如常合掌	達 摩 羅 寫 此 印 相 以 二 手 頭 指 已 下 四 指 如 常 合 掌 
X59n1054_001:0095a24	而開於中復張二大指著身呪曰。	而 開 於 中 復 張 二 大 指 著 身 呪 曰 
X59n1054_001:0095b01	唵(一)鉢達摩羅細(喜戲)囉揭那(二)摩訶羅底囉揭(三)布	唵 一 鉢 達 摩 羅 細 喜 戲 囉 揭 那 二 摩 訶 羅 底 囉 揭 三 布 
X59n1054_001:0095b02	闍三摩曳(四)吽	闍 三 摩 曳 四 吽 
X59n1054_001:0095b03	第二名勃地那伽摩囉(鬘)印　準前印長申引向前	第 二 名 勃 地 那 伽 摩 囉 鬘 印 準 前 印 長 申 引 向 前 
X59n1054_001:0095b04	即是呪曰。	即 是 呪 曰 
X59n1054_001:0095b05	唵(一)鉢達摩摩[棣木+(上/矢)](二)毗詵者(三)阿毗囇迦(四)布闍三	唵 一 鉢 達 摩 摩 [棣木上矢] 二 毗 詵 者 三 阿 毗 囇 迦 四 布 闍 三 
X59n1054_001:0095b06	摩曳(五)吽	摩 曳 五 吽 
X59n1054_001:0095b07	第三名為鉢達摩儗多(歌詠)印　准前印復斂當心徐	第 三 名 為 鉢 達 摩 儗 多 歌 詠 印 准 前 印 復 斂 當 心 徐 
X59n1054_001:0095b08	徐向上開手散之即成呪曰。	徐 向 上 開 手 散 之 即 成 呪 曰 
X59n1054_001:0095b09	唵(一)鉢達摩儗帝(二)俄陀儗多(三)布闍三摩曳(四)吽	唵 一 鉢 達 摩 儗 帝 二 俄 陀 儗 多 三 布 闍 三 摩 曳 四 吽 
X59n1054_001:0095b10	第四名為鉢達摩捺[口*栗]智帝耶(儛)印　是印准前當	第 四 名 為 鉢 達 摩 捺 [口栗] 智 帝 耶 儛 印 是 印 准 前 當 
X59n1054_001:0095b11	心前以右手於左手上轉之徐徐上於頭即是呪曰。	心 前 以 右 手 於 左 手 上 轉 之 徐 徐 上 於 頭 即 是 呪 曰 
X59n1054_001:0095b12	唵(一)鉢達摩捺[口*栗]底耶(二)薩婆布闍(三)鉢羅婆[口*栗]多	唵 一 鉢 達 摩 捺 [口栗]底耶二薩婆布闍三鉢羅婆[口栗] 多 
X59n1054_001:0095b13	那(四)三摩耶(五)吽	那 四 三 摩 耶 五 吽 
X59n1054_001:0095b14	已上名為內院四種供養印法外四種者第一燒香	已 上 名 為 內 院 四 種 供 養 印 法 外 四 種 者 第 一 燒 香 
X59n1054_001:0095b15	印以二手合十指右押左相叉即徐徐向下開手即	印 以 二 手 合 十 指 右 押 左 相 叉 即 徐 徐 向 下 開 手 即 
X59n1054_001:0095b16	是呪曰。	是 呪 曰 
X59n1054_001:0095b17	唵(一)鉢頭摩度波(二)布闍三摩曳(三)鉢羅訶囉捺耶	唵 一 鉢 頭 摩 度 波 二 布 闍 三 摩 曳 三 鉢 羅 訶 囉 捺 耶 
X59n1054_001:0095b18	(四)鉢達摩俱囉乃諦(五)摩訶揭你(六)鉢頭摩囉帝(七)	 四 鉢 達 摩 俱 囉 乃 諦 五 摩 訶 揭 你 六 鉢 頭 摩 囉 帝 七 
X59n1054_001:0095b19	吽	吽 
X59n1054_001:0095b20	第二花印者以二手如常合掌已即開之向上散之	第 二 花 印 者 以 二 手 如 常 合 掌 已 即 開 之 向 上 散 之 
X59n1054_001:0095b21	即是呪曰。	即 是 呪 曰 
X59n1054_001:0095b22	唵(一)布瑟波布闍三摩曳(二)鉢達摩摩里你(三)摩訶	唵 一 布 瑟 波 布 闍 三 摩 曳 二 鉢 達 摩 摩 里 你 三 摩 訶 
X59n1054_001:0095b23	室哩曳(四)鉢達摩俱囉(五)鉢囉底訶哩(六)薩婆遏他	室 哩 曳 四 鉢 達 摩 俱 囉 五 鉢 囉 底 訶 哩 六 薩 婆 遏 他 
X59n1054_001:0095b24	(七)娑達夜(六)吽	 七 娑 達 夜 六 吽 
X59n1054_001:0095c01	第三燈印者以二手右押左向外相叉為拳並二大	第 三 燈 印 者 以 二 手 右 押 左 向 外 相 叉 為 拳 並 二 大 
X59n1054_001:0095c02	指押其拳上呪曰。	指 押 其 拳 上 呪 曰 
X59n1054_001:0095c03	唵(一)地波布闍三摩曳(二)鉢達摩孫捺哩(三)摩訶奴	唵 一 地 波 布 闍 三 摩 曳 二 鉢 達 摩 孫 捺 哩 三 摩 訶 奴 
X59n1054_001:0095c04	底夜(四)路昬散闍那夜(五)鉢達摩娑囉莎底(六)吽	底 夜 四 路 昬 散 闍 那 夜 五 鉢 達 摩 娑 囉 莎 底 六 吽 
X59n1054_001:0095c05	第四塗香印是印相者如常合掌虗中即開其手腕	第 四 塗 香 印 是 印 相 者 如 常 合 掌 虗 中 即 開 其 手 腕 
X59n1054_001:0095c06	以手向心散之即是呪曰。	以 手 向 心 散 之 即 是 呪 曰 
X59n1054_001:0095c07	唵(一)徤陀布闍三摩曳(二)摩訶鉢達摩俱羅制胝(三)	唵 一 徤 陀 布 闍 三 摩 曳 二 摩 訶 鉢 達 摩 俱 羅 制 胝 三 
X59n1054_001:0095c08	俱嚧薩婆羯摩你彌(四)鉢達摩悉地(五)吽	俱 嚧 薩 婆 羯 摩 你 彌 四 鉢 達 摩 悉 地 五 吽 
X59n1054_001:0095c09	次說獻食印呪法當以二手平仰側相著即是呪曰。	次 說 獻 食 印 呪 法 當 以 二 手 平 仰 側 相 著 即 是 呪 曰 
X59n1054_001:0095c10	唵(一)薩婆怛他揭多(二)囉娑囉娑(三)愚嚧怛羅布闍	唵 一 薩 婆 怛 他 揭 多 二 囉 娑 囉 娑 三 愚 嚧 怛 羅 布 闍 
X59n1054_001:0095c11	三摩曳(四)吽	三 摩 曳 四 吽 
X59n1054_001:0095c12	已上諸印名為飲食供養印呪。	已 上 諸 印 名 為 飲 食 供 養 印 呪 
X59n1054_001:0095c13	次說印部身供養法懺悔印　以二手如常合掌已	次 說 印 部 身 供 養 法 懺 悔 印 以 二 手 如 常 合 掌 已 
X59n1054_001:0095c14	即屈二小指背相著二頭指頭相拄即是呪曰。	即 屈 二 小 指 背 相 著 二 頭 指 頭 相 拄 即 是 呪 曰 
X59n1054_001:0095c15	怛地耶(二合)他(一)阿唎[棣木+(上/矢)]多唎(二)咄多唎(三)咄唎(四)醯	怛 地 耶 二 合 他 一 阿 唎 [棣木上矢] 多 唎 二 咄 多 唎 三 咄 唎 四 醯 
X59n1054_001:0095c16	[口*闌]拏夜揭羅鞞(五)囉叉囉叉[牟*含](六)薩婆耨契鞞耶(二合)	[口闌]拏夜揭羅鞞五囉叉囉叉[牟含] 六 薩 婆 耨 契 鞞 耶 二 合 
X59n1054_001:0095c17	(七)薩婆烏波捺囉吠鞞耶(八)莎訶	 七 薩 婆 烏 波 捺 囉 吠 鞞 耶 八 莎 訶 
X59n1054_001:0095c18	是名根本印此印對佛前悔過者能滅無量重罪復	是 名 根 本 印 此 印 對 佛 前 悔 過 者 能 滅 無 量 重 罪 復 
X59n1054_001:0095c19	作心印唯改二大指捻頭指以當心呪曰。	作 心 印 唯 改 二 大 指 捻 頭 指 以 當 心 呪 曰 
X59n1054_001:0095c20	唵(一)薩婆訶哩陀耶(三)三菩陀耶(四)莎訶	唵 一 薩 婆 訶 哩 陀 耶 三 三 菩 陀 耶 四 莎 訶 
X59n1054_001:0095c21	作是供養之時能除行者三業之罪。	作 是 供 養 之 時 能 除 行 者 三 業 之 罪 
X59n1054_001:0095c22	次說口印法准前心印唯改二大指屈入掌中捻小	次 說 口 印 法 准 前 心 印 唯 改 二 大 指 屈 入 掌 中 捻 小 
X59n1054_001:0095c23	指甲上即是呪曰。	指 甲 上 即 是 呪 曰 
X59n1054_001:0095c24	唵(一)毗婆囉始(二)伽伽那(三)莎訶	唵 一 毗 婆 囉 始 二 伽 伽 那 三 莎 訶 
X59n1054_001:0096a01	此印呪力能除行者一切口過。	此 印 呪 力 能 除 行 者 一 切 口 過 
X59n1054_001:0096a02	次說除一切蓋障印　以右手大指捻中指甲上左	次 說 除 一 切 蓋 障 印 以 右 手 大 指 捻 中 指 甲 上 左 
X59n1054_001:0096a03	亦然即以右手合於左手上呪曰。	亦 然 即 以 右 手 合 於 左 手 上 呪 曰 
X59n1054_001:0096a04	唵(一)薩婆勃陀菩提薩埵耶(二)莎訶	唵 一 薩 婆 勃 陀 菩 提 薩 埵 耶 二 莎 訶 
X59n1054_001:0096a05	次說召一切天龍印　以左手覆之已長申五指即	次 說 召 一 切 天 龍 印 以 左 手 覆 之 已 長 申 五 指 即 
X59n1054_001:0096a06	以右手向下叉之為拳以左手指向前招呪曰。	以 右 手 向 下 叉 之 為 拳 以 左 手 指 向 前 招 呪 曰 
X59n1054_001:0096a07	唵(一)俱嚧陀(二)婆婆弟婆南(三)莎訶	唵 一 俱 嚧 陀 二 婆 婆 弟 婆 南 三 莎 訶 
X59n1054_001:0096a08	誦此呪用召諸天龍八部。	誦 此 呪 用 召 諸 天 龍 八 部 
X59n1054_001:0096a09	次說結護一切方界辟除障印　先以二無名指左	次 說 結 護 一 切 方 界 辟 除 障 印 先 以 二 無 名 指 左 
X59n1054_001:0096a10	押右相叉即以右中指押於左無名指上以左大指	押 右 相 叉 即 以 右 中 指 押 於 左 無 名 指 上 以 左 大 指 
X59n1054_001:0096a11	押右小指頭次以左中指頭指及無名指握右中指	押 右 小 指 頭 次 以 左 中 指 頭 指 及 無 名 指 握 右 中 指 
X59n1054_001:0096a12	為拳以右大指押左中指等上次以右頭指頭與左	為 拳 以 右 大 指 押 左 中 指 等 上 次 以 右 頭 指 頭 與 左 
X59n1054_001:0096a13	小指頭相拄以印右繞身揮之隨行者心遠近欲為	小 指 頭 相 拄 以 印 右 繞 身 揮 之 隨 行 者 心 遠 近 欲 為 
X59n1054_001:0096a14	防護皆得成就呪曰。	防 護 皆 得 成 就 呪 曰 
X59n1054_001:0096a15	唵(一)薩婆藥叉囉叉婆(二)盤陀盤陀(三)莎訶	唵 一 薩 婆 藥 叉 囉 叉 婆 二 盤 陀 盤 陀 三 莎 訶 
X59n1054_001:0096a16	次作淨五眼印　以二手虗中合掌已即屈二頭指	次 作 淨 五 眼 印 以 二 手 虗 中 合 掌 已 即 屈 二 頭 指 
X59n1054_001:0096a17	頭相拄以大指捻之次二無名指附小指甲上呪曰。	頭 相 拄 以 大 指 捻 之 次 二 無 名 指 附 小 指 甲 上 呪 曰 
X59n1054_001:0096a18	唵(一)薩婆斫蒭(二)建羅羯羅耶(三)莎訶	唵 一 薩 婆 斫 蒭 二 建 羅 羯 羅 耶 三 莎 訶 
X59n1054_001:0096a19	結此印者五眼常得清淨。	結 此 印 者 五 眼 常 得 清 淨 
X59n1054_001:0096a20	次作施願印　以左手大指捻頭指頭餘三指申之	次 作 施 願 印 以 左 手 大 指 捻 頭 指 頭 餘 三 指 申 之 
X59n1054_001:0096a21	右手亦然左竪右垂用前身呪作此印時能令六道	右 手 亦 然 左 竪 右 垂 用 前 身 呪 作 此 印 時 能 令 六 道 
X59n1054_001:0096a22	有情無諸苦惱。	有 情 無 諸 苦 惱 
X59n1054_001:0096a23	次作召四王印　以二手中指已下三指右押左向	次 作 召 四 王 印 以 二 手 中 指 已 下 三 指 右 押 左 向 
X59n1054_001:0096a24	內相叉屈二大指於掌中以二頭指向內鉤之呪曰。	內 相 叉 屈 二 大 指 於 掌 中 以 二 頭 指 向 內 鉤 之 呪 曰 
X59n1054_001:0096b01	唵(一)薩婆弟婆阿羯哩沙耶(二)莎訶	唵 一 薩 婆 弟 婆 阿 羯 哩 沙 耶 二 莎 訶 
X59n1054_001:0096b02	作此印以召四王天問四天下事皆悉隨意。	作 此 印 以 召 四 王 天 問 四 天 下 事 皆 悉 隨 意 
X59n1054_001:0096b03	次作禁水印　以二手十指向內相叉已即抽竪二	次 作 禁 水 印 以 二 手 十 指 向 內 相 叉 已 即 抽 竪 二 
X59n1054_001:0096b04	頭指頭相拄二小指亦然呪曰。	頭 指 頭 相 拄 二 小 指 亦 然 呪 曰 
X59n1054_001:0096b05	唵(一)薩婆弟婆烏特迦(〔上〕)莎訶	唵 一 薩 婆 弟 婆 烏 特 迦 上 莎 訶 
X59n1054_001:0096b06	作此印時能令水天降伏。	作 此 印 時 能 令 水 天 降 伏 
X59n1054_001:0096b07	次作禁火印　於水印上唯改頭指小指頭相離少	次 作 禁 火 印 於 水 印 上 唯 改 頭 指 小 指 頭 相 離 少 
X59n1054_001:0096b08	許呪曰。	許 呪 曰 
X59n1054_001:0096b09	唵(一)阿祇那曳(二)薩婆弟婆多(三)阿祇那曳(四)莎訶	唵 一 阿 祇 那 曳 二 薩 婆 弟 婆 多 三 阿 祇 那 曳 四 莎 訶 
X59n1054_001:0096b10	次作禁風難印　先以右手中指無名指叉入左手	次 作 禁 風 難 印 先 以 右 手 中 指 無 名 指 叉 入 左 手 
X59n1054_001:0096b11	無名指背上二頭指小指隨入押左手無名及中指	無 名 指 背 上 二 頭 指 小 指 隨 入 押 左 手 無 名 及 中 指 
X59n1054_001:0096b12	心上左手頭指及小指押右手中指無名指背上出	心 上 左 手 頭 指 及 小 指 押 右 手 中 指 無 名 指 背 上 出 
X59n1054_001:0096b13	二大母指相去直竪反掌向外作此風印持一切風	二 大 母 指 相 去 直 竪 反 掌 向 外 作 此 風 印 持 一 切 風 
X59n1054_001:0096b14	難皆不為害風雨神王皆歸伏隨風印呪曰。	難 皆 不 為 害 風 雨 神 王 皆 歸 伏 隨 風 印 呪 曰 
X59n1054_001:0096b15	唵(一)摩耶吠(二)薩婆摩俱嚧陀(三)你縛多耶(四)莎訶	唵 一 摩 耶 吠 二 薩 婆 摩 俱 嚧 陀 三 你 縛 多 耶 四 莎 訶 
X59n1054_001:0096b16	次作淨戒印　以右膝著地已即如常合掌而虗其	次 作 淨 戒 印 以 右膝著地 已 即 如 常 合 掌 而 虗 其 
X59n1054_001:0096b17	中以二頭指各附二中指背上文二大指各附二頭	中 以 二 頭 指 各 附 二 中 指 背 上 文 二 大 指 各 附 二 頭 
X59n1054_001:0096b18	指下文呪曰。	指 下 文 呪 曰 
X59n1054_001:0096b19	唵(一)薩婆波囉提(二)牟訖叉褐哩陀那夜(三)莎訶	唵 一 薩 婆 波 囉 提 二 牟 訖 叉 褐 哩 陀 那 夜 三 莎 訶 
X59n1054_001:0096b20	結此印時能令無盡有情皆得淨戒身。	結 此 印 時 能 令 無 盡 有 情 皆 得 淨 戒 身 
X59n1054_001:0096b21	次作禁賊印　以二手頭指中指無名指及小指友	次 作 禁 賊 印 以 二 手 頭 指 中 指 無 名 指 及 小 指 友 
X59n1054_001:0096b22	鉤左手四指二大指各散直竪作此印時一切賊難	鉤 左 手 四 指 二 大 指 各 散 直 竪 作 此 印 時 一 切 賊 難 
X59n1054_001:0096b23	皆悉被縛不能為害呪曰。	皆 悉 被 縛 不 能 為 害 呪 曰 
X59n1054_001:0096b24	唵(一)薩婆突瑟吒(二)鉢囉突瑟吒喃(三)瞋陀耶(四)莎	唵 一 薩 婆 突 瑟 吒 二 鉢 囉 突 瑟 吒 喃 三 瞋 陀 耶 四 莎 
X59n1054_001:0096c01	訶	訶 
X59n1054_001:0096c02	聰明印　以兩手大母指各捻二無名指甲上二小	聰 明 印 以 兩 手 大 母 指 各 捻 二 無 名 指 甲 上 二 小 
X59n1054_001:0096c03	指並直竪相愽二中指側頭拄屈二頭指附二中指	指 並 直 竪 相 愽 二 中 指 側 頭 拄 屈 二 頭 指 附 二 中 指 
X59n1054_001:0096c04	側第二文上指頭相去一寸許作此印當心前若有	側 第 二 文 上 指 頭 相 去 一 寸 許 作 此 印 當 心 前 若 有 
X59n1054_001:0096c05	鈍根者為作此印供養所求如意頗梨王國內有一	鈍 根 者 為 作 此 印 供 養 所 求 如 意 頗 梨 王 國 內 有 一 
X59n1054_001:0096c06	大富長者為性鈍根為七日求願即得聰明日誦千	大 富 長 者 為 性 鈍 根 為 七 日 求 願 即 得 聰 明 日 誦 千 
X59n1054_001:0096c07	偈自餘證驗不可具論誦前根本呪。	偈 自 餘 證 驗 不 可 具 論 誦 前 根 本 呪 
X59n1054_001:0096c08	開地獄門印　以二中指無名指各屈在掌中相背	開 地 獄 門 印 以 二 中 指 無 名 指 各 屈 在 掌 中 相 背 
X59n1054_001:0096c09	二大母指頭指及小指各相去半寸許作此印時地	二 大 母 指 頭 指 及 小 指 各 相 去 半 寸 許 作 此 印 時 地 
X59n1054_001:0096c10	獄門開受苦眾生一時解脫閻摩羅王歡喜讚歎觀	獄 門 開 受 苦 眾 生 一 時 解 脫 閻 摩 羅 王 歡 喜 讚 歎 觀 
X59n1054_001:0096c11	音大悲憐慜蒼生說此法要度苦眾生亦誦根本呪	音 大 悲 憐 慜 蒼 生 說 此 法 要 度 苦 眾 生 亦 誦 根 本 呪 
