X60n1132_001:0710b21	過。	過 
X60n1132_001:0710b22	二。比丘尼不得罵詈比丘。訶責。不應誹謗。言破戒。破	二 比 丘 尼 不 得 罵 詈 比 丘 訶 責 不 應 誹 謗 言 破 戒 破 
X60n1132_001:0710b23	見。破威儀。如此法應尊重(餘詞如上說)。	見 破 威 儀 如 此 法 應 尊 重 餘 詞 如 上 說 
X60n1132_001:0710b24	三。比丘尼不應為比丘作舉。作憶念。作自言。不應遮	三 比 丘 尼 不 應 為 比 丘 作 舉 作 憶 念 作 自 言 不 應 遮 
X60n1132_001:0710c01	他覓罪。遮說戒。遮自恣。比丘尼。不應訶比丘。比丘應	他 覓 罪 遮 說 戒 遮 自 恣 比 丘 尼 不 應 訶 比 丘 比 丘 應 
X60n1132_001:0710c02	訶比丘尼。如此法。應尊重(餘詞如上)。	訶 比 丘 尼 如 此 法 應 尊 重 餘 詞 如 上 
X60n1132_001:0710c03	四。式叉摩那學戒已。從比丘僧乞受大戒。如此法。應	四 式叉摩那 學 戒 已 從 比 丘 僧 乞 受 大 戒 如 此 法 應 
X60n1132_001:0710c04	尊重(餘詞如上)。	尊 重 餘 詞 如 上 
X60n1132_001:0710c05	五。比丘尼犯僧殘罪。應二部僧中。行摩那埵。如此法。	五 比 丘 尼 犯 僧 殘 罪 應 二 部 僧 中 行 摩 那 埵 如 此 法 
X60n1132_001:0710c06	應尊重(餘詞如上)。	應 尊 重 餘 詞 如 上 
X60n1132_001:0710c07	六。比丘尼半月。從僧乞教授。如此法。應尊重(餘詞如上)。	六 比 丘 尼 半 月 從 僧 乞 教 授 如 此 法 應 尊 重 餘 詞 如 上 
X60n1132_001:0710c08	七。比丘尼不應在無比丘處夏安居。如此法。應尊重	七 比 丘 尼 不 應 在 無 比 丘 處 夏 安 居 如 此 法 應 尊 重 
X60n1132_001:0710c09	(餘詞如上)。	 餘 詞 如 上 
X60n1132_001:0710c10	八。比丘尼僧。夏安居竟。應比丘僧中。求三事自恣。見	八 比 丘 尼 僧 夏 安 居 竟 應 比 丘 僧 中 求 三 事 自 恣 見 
X60n1132_001:0710c11	聞疑。如此法。應尊重(餘詞如上)。如是阿難。我今說此八不	聞 疑 如 此 法 應 尊 重 餘 詞 如 上 如 是 阿 難 我 今 說 此 八 不 
X60n1132_001:0710c12	可過法。譬如有人於大水上安橋梁而渡。女人若能	可 過 法 譬 如 有 人 於 大 水 上 安 橋 梁 而 渡 女 人 若 能 
X60n1132_001:0710c13	行者。即是受戒(云云)。	行 者 即 是 受 戒 云 云 
X60n1132_001:0710c15	比丘尼受戒錄(終)	比 丘 尼 受 戒 錄 終 
