X60n1118_002:0255b19	等皆獲欺君之罪。今有愚人。屢受斯惑。至於亡身	等 皆 獲 欺 君 之 罪 今 有 愚 人 屢 受 斯 惑 至 於 亡 身 
X60n1118_002:0255b20	破家者不少。然釋子捨玉帛如棄涕唾。乃出家為	破 家 者 不 少 然 釋 子 捨 玉 帛 如 棄 涕 唾 乃 出 家 為 
X60n1118_002:0255b21	道。長生異術。不識四大皮囊。棄自心性。求為守尸	道 長 生 異 術 不 識 四 大 皮 囊 棄 自 心 性 求 為 守 尸 
X60n1118_002:0255b22	之鬼。萬無一驗。釋子知身如幻。世不久停。悟自本	之 鬼 萬 無 一 驗 釋 子 知 身 如 幻 世 不 久 停 悟 自 本 
X60n1118_002:0255b23	心。真常不泯。豈可返生貪愛。學此陋術。誠為可耻。	心 真 常 不 泯 豈 可 返 生 貪 愛 學 此 陋 術 誠 為 可 耻 
X60n1118_002:0255b24	自惑惑人。玷辱法門。獲罪非輕。	自 惑 惑 人 玷 辱 法 門 獲 罪 非 輕 
X60n1118_002:0255c01	神奇鬼怪符水等書。	神 奇 鬼 怪 符 水 等 書 
X60n1118_002:0255c02	有福而靈曰神。無福而魅曰鬼。又鬼者欺也。欺人	有 福 而 靈 曰 神 無 福 而 魅 曰 鬼 又 鬼 者 欺 也 欺 人 
X60n1118_002:0255c03	以求飲食也。此謂降神降鬼。畫符噀水。治病治鬼。	以 求 飲 食 也 此 謂 降 神 降 鬼 畫 符 噀 水 治 病 治 鬼 
X60n1118_002:0255c04	邪巫幻術諸書。妄說吉凶禍福。惑人取利。起自張	邪 巫 幻 術 諸 書 妄 說 吉 凶 禍 福 惑 人 取 利 起 自 張 
X60n1118_002:0255c05	道陵。自稱鬼卒道。造符水醮錄之術。傳至張角。角	道 陵 自 稱 鬼 卒 道 造 符 水 醮 錄 之 術 傳 至 張 角 角 
X60n1118_002:0255c06	以妖術種種怪異教民。妄呪符水以治病。眾見怪	以 妖 術 種 種 怪 異 教 民 妄 呪 符 水 以 治 病 眾 見 怪 
X60n1118_002:0255c07	誕。神而奇之。故曰神奇鬼怪。角後叛為黃巾賊焉。	誕 神 而 奇 之 故 曰 神 奇 鬼 怪 角 後 叛 為 黃 巾 賊 焉 
X60n1118_002:0255c08	乃至圓光。扶機。外道安宅呪。肢節呪。知人生死吉	乃 至 圓 光 扶 機 外 道 安 宅 呪 肢 節 呪 知 人 生 死 吉 
X60n1118_002:0255c09	凶呪。解諸音聲呪等。自不作。不教他作。灌頂經云。	凶 呪 解 諸 音 聲 呪 等 自 不 作 不 教 他 作 灌 頂 經 云 
X60n1118_002:0255c10	阿難白佛言。如來所有言說。真實不虗。然末世中。	阿 難 白 佛 言 如 來 所 有 言 說 真 實 不 虗 然 末 世 中 
X60n1118_002:0255c11	多有誹謗。佛先說諸經法。有呪術者。或云應學誦	多 有 誹 謗 佛 先 說 諸 經 法 有 呪 術 者 或 云 應 學 誦 
X60n1118_002:0255c12	持修行。或云不應修習禁呪。諸經法中。更互不同。	持 修 行 或 云 不 應 修 習 禁 呪 諸 經 法 中 更 互 不 同 
X60n1118_002:0255c13	反覆前後。故使末世諸比丘等。有信行者。有誹謗	反 覆 前 後 故 使 末 世 諸 比 丘 等 有 信 行 者 有 誹 謗 
X60n1118_002:0255c14	者。是故重問於世尊耳。佛言。我經中說諸禁呪術	者 是 故 重 問 於 世 尊 耳 佛 言 我 經 中 說 諸 禁 呪 術 
X60n1118_002:0255c15	不應行者。謂諸異道邪見法術。惑亂萬姓。但為利	不 應 行 者 謂 諸 異 道 邪 見 法 術 惑 亂 萬 姓 但 為 利 
X60n1118_002:0255c16	養。以活身命。我所不許。今吾所演灌頂章句。真實	養 以 活 身 命 我 所 不 許 今 吾 所 演 灌 頂 章 句 真 實 
X60n1118_002:0255c17	呪術。阿含所出。諸經雜呪。盡欲化導諸眾生故。不	呪 術 阿 含 所 出 諸 經 雜 呪 盡 欲 化 導 諸 眾 生 故 不 
X60n1118_002:0255c18	同異道。為利養也。但為度脫眾生危難。遭苦患者。	同 異 道 為 利 養 也 但 為 度 脫 眾 生 危 難 遭 苦 患 者 
X60n1118_002:0255c19	令得蘇息。故吾今聽許。當來末世四輩弟子。入我	令 得 蘇 息 故 吾 今 聽 許 當 來 末 世 四 輩 弟 子 入 我 
X60n1118_002:0255c20	法中。受持禁戒。多所缺犯。心不專一。急難之時。遭	法 中 受 持 禁 戒 多 所 缺 犯 心 不 專 一 急 難 之 時 遭 
X60n1118_002:0255c21	疾苦難。向諸異道邪見法中。以求福祐。欲脫眾難。	疾 苦 難 向 諸 異 道 邪 見 法 中 以 求 福 祐 欲 脫 眾 難 
X60n1118_002:0255c22	不可得離。不知宿對。前世業緣。而到異道所跪拜	不 可 得 離 不 知 宿 對 前 世 業 緣 而 到 異 道 所 跪 拜 
X60n1118_002:0255c23	問訊。願見救護。異道言。隨汝所願。吾當祈請。上通	問 訊 願 見 救 護 異 道 言 隨 汝 所 願 吾 當 祈 請 上 通 
X60n1118_002:0255c24	五官。下言地祗。令汝得福。救度危厄。不復遭苦。復	五 官 下 言 地 祗 令 汝 得 福 救 度 危 厄 不 復 遭 苦 復 
X60n1118_002:0256a01	言或汝先身犯諸過惡。或言七世殃咎所引。為王	言 或 汝 先 身 犯 諸 過 惡 或 言 七 世 殃 咎 所 引 為 王 
X60n1118_002:0256a02	官所錄。受諸讁罰。或言牽引滅及門族。或言汝七	官 所 錄 受 諸 讁 罰 或 言 牽 引 滅 及 門 族 或 言 汝 七 
X60n1118_002:0256a03	祖為九幽所羅。魂在太山。當以疋帛隨方之色。救	祖 為 九 幽 所 羅 魂 在 太 山 當 以 疋 帛 隨 方 之 色 救 
X60n1118_002:0256a04	贖汝等七祖之魂。拔除汝等七世之過。又言汝為	贖 汝 等 七 祖 之 魂 拔 除 汝 等 七 世 之 過 又 言 汝 為 
X60n1118_002:0256a05	山樹鬼神星宿之神所嬈害。致諸病痛。當以白牛	山 樹 鬼 神 星 宿 之 神 所 嬈 害 致 諸 病 痛 當 以 白 牛 
X60n1118_002:0256a06	白馬。種種肥美飲食。妓樂歌詠鬼神。可獲大福。除	白 馬 種 種 肥 美 飲 食 妓 樂 歌 詠 鬼 神 可 獲 大 福 除 
X60n1118_002:0256a07	汝危難。佛告阿難。末世眾生。為諸邪師所惑。殺眾	汝 危 難 佛 告 阿 難 末 世 眾 生 為 諸 邪 師 所 惑 殺 眾 
X60n1118_002:0256a08	生命。欲救危厄。殺者得罪。天神地祇。悉不噉食。是	生 命 欲 救 危 厄 殺 者 得 罪 天 神 地 祇 悉 不 噉 食 是 
X60n1118_002:0256a09	故我今廣演灌頂章句真實呪術。化諸未信不解	故 我 今 廣 演 灌 頂 章 句 真 實 呪 術 化 諸 未 信 不 解 
X60n1118_002:0256a10	道者。汝當宣傳。勿令毀失。	道 者 汝 當 宣 傳 勿 令 毀 失 
X60n1118_002:0256a11	不得習學宣卷打偈。	不 得 習 學 宣 卷 打 偈 
X60n1118_002:0256a12	即今無為教之金剛卷。一人宣之。眾人和之。曰打	即 今 無 為 教 之 金 剛 卷 一 人 宣 之 眾 人 和 之 曰 打 
X60n1118_002:0256a13	偈。	偈 
X60n1118_002:0256a14	不得習學外道書。除智力有餘。為欲知內外教深淺	不 得 習 學 外 道 書 除 智 力 有 餘 為 欲 知 內 外 教 深 淺 
X60n1118_002:0256a15	者。可以涉躐。然勿生習學想。	者 可 以 涉 躐 然 勿 生 習 學 想 
X60n1118_002:0256a16	躐亦作獵。躐踐也。內外教。如前釋。大經云。佛告諸	躐 亦 作 獵 躐 踐 也 內 外 教 如 前 釋 大 經 云 佛 告 諸 
X60n1118_002:0256a17	比丘。出家人應修慧學。尋究經典。不得披讀外書。	比 丘 出 家 人 應 修 慧 學 尋 究 經 典 不 得 披 讀 外 書 
X60n1118_002:0256a18	我涅槃後。有愚癡破戒人。捨十二部經。讀誦種種	我涅槃後 有 愚 癡 破 戒 人 捨 十二部經 讀 誦 種 種 
X60n1118_002:0256a19	外道典籍。文頌手筆。畜不淨物。言是佛聽。如是之	外 道 典 籍 文 頌 手 筆 畜 不 淨 物 言 是 佛 聽 如 是 之 
X60n1118_002:0256a20	人。以好旃檀。貿於瓦木。以甘露易於惡毒。故論云。	人 以 好 旃 檀 貿 於 瓦 木 以 甘 露 易 於 惡 毒 故 論 云 
X60n1118_002:0256a21	若菩薩於佛所說。棄捨不學。反學外道邪論。世俗	若 菩 薩 於 佛 所 說 棄 捨 不 學 反 學 外道邪論 世 俗 
X60n1118_002:0256a22	經典。是名為犯。若上聰明人。能速受學。得不動智。	經 典 是 名 為 犯 若 上 聰 明 人 能 速 受 學 得 不 動 智 
X60n1118_002:0256a23	於日月中。當以二分受學佛法。一分學外典。若於	於 日 月 中 當 以 二 分 受 學 佛 法 一 分 學 外 典 若 於 
X60n1118_002:0256a24	世典外道邪教。愛樂不捨。不作棄想。是名為犯。法	世 典 外 道 邪 教 愛 樂 不 捨 不 作 棄 想 是 名 為 犯 法 
X60n1118_002:0256b01	苑云。若一向廢內尋外。則便得罪。縱解理行。唯可	苑 云 若 一 向 廢 內 尋 外 則 便 得 罪 縱 解 理 行 唯 可 
X60n1118_002:0256b02	暫習。為伏外道。還須厭離。進修內業。務令增勝。若	暫 習 為 伏 外 道 還 須 厭 離 進 修 內 業 務 令 增 勝 若 
X60n1118_002:0256b03	偏躭著。則壞正法。豈成僧寶。若專讀外典。歌詠琴	偏 躭 著 則 壞 正 法 豈 成 僧 寶 若 專 讀 外 典 歌 詠 琴 
X60n1118_002:0256b04	棋。諷誦詩書。徒消日月。內教法藥。救生為急。文奧	棋 諷 誦 詩 書 徒 消 日 月 內 教 法 藥 救 生 為 急 文 奧 
X60n1118_002:0256b05	理深。辭華秘博。能解一句。演無量義。新舊經論。卷	理 深 辭 華 秘 博 能 解 一 句 演 無 量 義 新 舊 經 論 卷 
X60n1118_002:0256b06	軸數千。曾不窺撿一句之義。外道不急之事。日夜	軸 數 千 曾 不 窺 撿 一 句 之 義 外 道 不 急 之 事 日 夜 
X60n1118_002:0256b07	勤學。若謂白衣笑我無知。不學世典者。何如俗人	勤 學 若 謂 白 衣 笑 我 無 知 不 學 世 典 者 何 如 俗 人 
X60n1118_002:0256b08	問我經義。不能答耶。居內不閒於外。未足可羞。在	問 我 經 義 不 能 答 耶 居 內 不 閒 於 外 未 足 可 羞 在 
X60n1118_002:0256b09	內不解於內。恥辱彌甚。良由時將末法。人命轉促。	內 不 解 於 內 恥 辱 彌 甚 良 由 時 將 末 法 人 命 轉 促 
X60n1118_002:0256b10	無常交臂。朝不謀夕。恐一入冥途。累劫難出。再遇	無 常 交 臂 朝 不 謀 夕 恐 一 入 冥 途 累 劫 難 出 再 遇 
X60n1118_002:0256b11	佛法。想見無由。雖經論許一分學外。為伏外道。此	佛 法 想 見 無 由 雖 經 論 許 一 分 學 外 為 伏 外 道 此 
X60n1118_002:0256b12	為上智聰叡者說。先諳於內。兼令知外。機辯鋒芒。	為 上 智 聰 叡 者 說 先 諳 於 內 兼 令 知 外 機 辯 鋒 芒 
X60n1118_002:0256b13	出言關典。內外博究。堪為師匠。得如經說。為伏外	出 言 關 典 內 外 博 究 堪 為 師 匠 得 如 經 說 為 伏 外 
X60n1118_002:0256b14	道。今自量身。觸事無能。神識常閉。愚戇恒開。自救	道 今 自 量 身 觸 事 無 能 神 識 常 閉 愚 戇 恒 開 自 救 
X60n1118_002:0256b15	無聊。何能利人。色香不通。何辯菽麥。願自思退。省	無 聊 何 能 利 人 色 香 不 通 何 辯 菽 麥 願 自 思 退 省 
X60n1118_002:0256b16	己為學。亦不得以佛經糅雜俗典。如冥報記云。唐	己 為 學 亦 不 得 以 佛 經 糅 雜 俗 典 如 冥 報 記 云 唐 
X60n1118_002:0256b17	趙文信。遂州人。貞觀元年暴死。三日復甦云。至閻	趙 文 信 遂 州 人 貞 觀 元 年 暴 死 三 日 復 甦 云 至 閻 
X60n1118_002:0256b18	王所。王問汝修何功德。答言。一生以來。不修功德。	王 所 王 問 汝 修 何 功 德 答 言 一 生 以 來 不 修 功 德 
X60n1118_002:0256b19	唯好庾信文章集錄。王言。庾信是大罪人。現在受	唯 好 庾 信 文 章 集 錄 王 言 庾 信 是 大 罪 人 現 在 受 
X60n1118_002:0256b20	苦。頗曾識否。答言。雖讀渠文章。未識其人。王即遣	苦 頗 曾 識 否 答 言 雖 讀 渠 文 章 未 識 其 人 王 即 遣 
X60n1118_002:0256b21	人引出庾信。乃見一龜多頭。龜去少時。現一人身	人 引 出 庾 信 乃 見 一 龜 多 頭 龜 去 少 時 現 一 人 身 
X60n1118_002:0256b22	來云。我便是庾信。為在生時好作文章。妄引佛經。	來 云 我 便 是 庾 信 為 在 生 時 好 作 文 章 妄 引 佛 經 
X60n1118_002:0256b23	以雜俗書。誹謗佛法。謂不及孔老之教。今受龜身。	以 雜 俗 書 誹 謗 佛 法 謂 不 及 孔 老 之 教 今 受 龜 身 
X60n1118_002:0256b24	苦之極也。	苦 之 極 也 
X60n1118_002:0256c01	不得習學詩詞。	不 得 習 學 詩 詞 
X60n1118_002:0256c02	志之所發於言曰詩。言之所吐於文曰詞。記云。書	志 之 所 發 於 言 曰 詩 言 之 所 吐 於 文 曰 詞 記 云 書 
X60n1118_002:0256c03	算卜術。俗典文頌。俱是世法。非出家業。故不聽學。	算 卜 術 俗 典 文 頌 俱 是 世 法 非 出 家 業 故 不 聽 學 
X60n1118_002:0256c04	不得著心學字求工。但書寫端楷足矣。	不 得 著 心 學 字 求 工 但 書 寫 端 楷 足 矣 
X60n1118_002:0256c05	楷即楷書。乃上谷王次中所作。足以宣文顯義。何	楷 即 楷 書 乃 上 谷 王 次 中 所 作 足 以 宣 文 顯 義 何 
X60n1118_002:0256c06	更著心求工於草隸。今時出家多有不修正務。而	更 著 心 求 工 於 草 隸 今 時 出 家 多 有 不 修 正 務 而 
X60n1118_002:0256c07	晝夜求字精巧。終年苦心。迷不知省。縱饒學到鍾	晝 夜 求 字 精 巧 終 年 苦 心 迷 不 知 省 縱 饒 學 到 鍾 
X60n1118_002:0256c08	王之妙。程盱之巧。亦何救於生死。諸佛不讚。閻王	王 之 妙 程 盱 之 巧 亦 何 救 於 生 死 諸 佛 不 讚 閻 王 
X60n1118_002:0256c09	不受。終為廢物。成何底事。警訓云。律制雜學以妨	不 受 終 為 廢 物 成 何 底 事 警 訓 云 律 制 雜 學 以 妨 
X60n1118_002:0256c10	正業。故學書不得為好。然古高僧亦多異學。或精	正 業 故 學 書 不 得 為 好 然 古 高 僧 亦 多 異 學 或 精 
X60n1118_002:0256c11	草隸。或善篇章。或醫術馳名。或陰陽顯譽。皆為精	草 隸 或 善 篇 章 或 醫 術 馳 名 或 陰 陽 顯 譽 皆 為 精 
X60n1118_002:0256c12	窮內典。傍涉餘宗。無非志在護持。助通佛化。今時	窮 內 典 傍 涉 餘 宗 無 非 志 在 護 持 助 通 佛 化 今 時 
X60n1118_002:0256c13	釋子名實俱喪。能書寫則稱為草聖。通俗典則自	釋 子 名 實 俱 喪 能 書 寫 則 稱 為 草 聖 通 俗 典 則 自 
X60n1118_002:0256c14	號文章。擇地則名為山水。卜術則呼為三命。豈意	號 文 章 擇 地 則 名 為 山 水 卜 術 則 呼 為 三 命 豈 意 
X60n1118_002:0256c15	捨家事佛。而隨順俗流之名。本圖厭世超昇。而翻	捨 家 事 佛 而 隨 順 俗 流 之 名 本 圖 厭 世 超 昇 而 翻 
X60n1118_002:0256c16	習生死之業。沽名邀利。附勢矜能。形廁方袍。心染	習 生 死 之 業 沽 名 邀 利 附 勢 矜 能 形 廁 方 袍 心 染 
X60n1118_002:0256c17	浮俗。畢身虗度。良可哀哉。	浮 俗 畢 身 虗 度 良 可 哀 哉 
X60n1118_002:0256c18	不得污手執持經。	不 得 污 手 執 持 經 
X60n1118_002:0256c19	因果經云。觸手請經。當墮廁中蟲報。阿難請戒律	因 果 經 云 觸 手 請 經 當 墮 廁 中 蟲 報 阿 難 請 戒 律 
X60n1118_002:0256c20	論云。僧尼白衣等。因讀誦經律論等。行語手執翻	論 云 僧 尼 白 衣 等 因 讀 誦 經 律 論 等 行 語 手 執 翻 
X60n1118_002:0256c21	卷者。依忉利天歲數。受畜報二億歲。墮獐鹿中。恒	卷 者 依 忉 利 天 歲 數 受 畜 報 二 億 歲 墮 獐 鹿 中 恒 
X60n1118_002:0256c22	被摺脊。苦痛難忍。若無記戲言。捉經律論。亦招前	被 摺 脊 苦 痛 難 忍 若 無 記 戲 言 捉 經 律 論 亦 招 前 
X60n1118_002:0256c23	報。若安經像房堂簷前者。依忉利天歲數。八百歲	報 若 安 經 像 房 堂 簷 前 者 依 忉 利 天 歲 數 八 百 歲 
X60n1118_002:0256c24	受畜生報。二億歲墮猪狗中生。若得人身。一億歲	受 畜 生 報 二 億 歲 墮 猪 狗 中 生 若 得 人 身 一 億 歲 
X60n1118_002:0257a01	恒常作客。栖屑不得自在。	恒 常 作 客 栖 屑 不得自在 
X60n1118_002:0257a02	對經典。如對佛。不得戲笑。	對 經 典 如 對 佛 不 得 戲 笑 
X60n1118_002:0257a03	經是佛語。亦是佛師。故對經如對佛。一言一偈。千	經 是 佛 語 亦 是 佛 師 故 對 經 如 對 佛 一 言 一 偈 千 
X60n1118_002:0257a04	劫難逢。縱不解義。誦之亦種善根。故須特加尊重。	劫 難 逢 縱 不 解 義 誦 之 亦 種 善 根 故 須 特 加 尊 重 
X60n1118_002:0257a05	律云。慎無臥誦經。若纔覺疲倦。懈怠心生。即當痛	律 云 慎 無 臥 誦 經 若 纔 覺 疲 倦 懈 怠 心 生 即 當 痛 
X60n1118_002:0257a06	念人命呼吸。如救頭然。又何暇於懈怠哉。	念 人 命 呼 吸 如 救 頭 然 又 何 暇 於 懈 怠 哉 
X60n1118_002:0257a07	不得案上。狼藉卷帙。	不 得 案 上 狼 藉 卷 帙 
X60n1118_002:0257a08	帙音妷。經卷編次成夾曰帙。狼藉謂參差雜亂。不	帙 音 妷 經 卷 編 次 成 夾 曰 帙 狼 藉 謂 參 差 雜 亂 不 
X60n1118_002:0257a09	齊整也。	齊 整 也 
X60n1118_002:0257a10	不得高聲動眾。	不 得 高 聲 動 眾 
X60n1118_002:0257a11	凡讀經。要知句逗聲法。華梵了然。若隨眾諷誦。聲	凡 讀 經 要 知 句 逗 聲 法 華 梵 了 然 若 隨 眾 諷 誦 聲 
X60n1118_002:0257a12	宜調和。不得自恃。若自習學。聲須低小。勿動眾念	宜 調 和 不 得 自 恃 若 自 習 學 聲 須 低 小 勿 動 眾 念 
X60n1118_002:0257a13	也。	也 
X60n1118_002:0257a14	不得借人經看不還。及不加愛重。以致損壞。	不 得 借 人 經 看 不 還 及 不 加 愛 重 以 致 損 壞 
X60n1118_002:0257a15	經法是三乘人之父母。同加愛護。無有彼此。如有	經 法 是 三 乘 人 之 父 母 同 加 愛 護 無 有 彼 此 如 有 
X60n1118_002:0257a16	不敬損壞者。俱得慢法之罪。借而故心不還者。即	不 敬 損 壞 者 俱 得 慢 法 之 罪 借 而 故 心 不 還 者 即 
X60n1118_002:0257a17	得盜罪。經云。借取與。必分明。無違期約。以失信道。	得 盜 罪 經 云 借 取 與 必 分 明 無 違 期 約 以 失 信 道 
X60n1118_002:0257a18	△入寺院第九	 入 寺 院 第 九 
X60n1118_002:0257a19	凡入寺門。不得行中央。須緣左右邊行。緣左先左足。	凡 入 寺 門 不 得 行 中 央 須 緣 左 右 邊 行 緣 左 先 左 足 
X60n1118_002:0257a20	緣右先右足。	緣 右 先 右 足 
X60n1118_002:0257a21	行中央則唐突。無尊敬儀。如世公府衙門。下官尚	行 中 央 則 唐 突 無 尊 敬 儀 如 世 公 府 衙 門 下 官 尚 
X60n1118_002:0257a22	不得中進。況法王寶殿。而可不迴顧左右乎。當隨	不 得 中 進 況 法 王 寶 殿 而 可 不 迴 顧 左 右 乎 當 隨 
X60n1118_002:0257a23	門夾舉足出入。緣左手邊。先舉左足。緣右手邊。先	門 夾 舉 足 出 入 緣 左 手 邊 先 舉 左 足 緣 右 手 邊 先 
X60n1118_002:0257a24	舉右足。大律云。行時先下脚跟。後下脚指。平視直	舉 右 足 大 律 云 行 時 先 下 脚 跟 後 下 脚 指 平 視 直 
X60n1118_002:0257b01	進。迴時合身總迴。西國寺圖云。入出之時。悉轉面	進 迴 時 合 身 總 迴 西 國 寺 圖 云 入 出 之 時 悉 轉 面 
X60n1118_002:0257b02	向佛。若禮三寶。常念體唯是一。何者。覺法滿足名	向 佛 若 禮 三 寶 常 念 體 唯 是 一 何 者 覺 法 滿 足 名 
X60n1118_002:0257b03	佛。所覺之道名法。學佛道者名僧。則知一切凡聖	佛 所 覺 之 道 名 法 學 佛 道 者 名 僧 則 知 一 切 凡 聖 
X60n1118_002:0257b04	體同無二也。若入寺時。低頭看地。不得高視。見地	體 同 無 二 也 若 入 寺 時 低 頭 看 地 不 得 高 視 見 地 
X60n1118_002:0257b05	有蟲。勿悞傷殺。當歌唄讚歎。不唾僧地。若見草木	有 蟲 勿 悞 傷 殺 當 歌 唄 讚 歎 不 唾 僧 地 若 見 草 木 
X60n1118_002:0257b06	不淨。即須除却。言寺者。嗣也。謂治事者。相嗣續於	不 淨 即 須 除 却 言 寺 者 嗣 也 謂 治 事 者 相 嗣 續 於 
X60n1118_002:0257b07	其內。故天子有九寺。漢明帝永平十年。天竺摩騰	其 內 故 天 子 有 九 寺 漢 明 帝 永 平 十 年 天 竺 摩 騰 
X60n1118_002:0257b08	法蘭二法師。以白馬馱經像至洛陽。勅於鴻臚寺	法 蘭 二 法 師 以 白 馬 馱 經 像 至 洛 陽 勅 於 鴻 臚 寺 
X60n1118_002:0257b09	安置。次年敕於雍門外別建寺。以白馬為名。不忘	安 置 次 年 敕 於 雍 門 外 別 建 寺 以 白 馬 為 名 不 忘 
X60n1118_002:0257b10	其本。復名為寺。西國僧住處。名僧伽藍。此云眾園。	其 本 復 名 為 寺 西 國 僧 住 處 名 僧 伽 藍 此 云 眾 園 
X60n1118_002:0257b11	謂生長佛子之道芽也。	謂 生 長 佛 子 之 道 芽 也 
X60n1118_002:0257b12	不得無故登大殿遊行。	不 得 無 故 登 大 殿 遊 行 
X60n1118_002:0257b13	殿安聖像。敬像如佛在。豈得無事遊行。	殿 安 聖 像 敬 像 如 佛 在 豈 得 無 事 遊 行 
X60n1118_002:0257b14	不得無故登塔。	不 得 無 故 登 塔 
X60n1118_002:0257b15	塔無舍利佛像。尚不宜登。而況有乎。若為供養花	塔 無 舍 利 佛 像 尚 不 宜 登 而 況 有 乎 若 為 供 養 花 
X60n1118_002:0257b16	幡燈等。登上無犯。故古德云。無事不須登佛殿。等	幡 燈 等 登 上 無 犯 故 古 德 云 無 事 不 須 登 佛 殿 等 
X60n1118_002:0257b17	閑莫向塔中行。不因掃地添香水。縱有河沙福也	閑 莫 向 塔 中 行 不 因 掃 地 添 香 水 縱 有 河 沙 福 也 
X60n1118_002:0257b18	傾。	傾 
X60n1118_002:0257b19	入殿塔。當右遶。不得左轉。	入 殿 塔 當 右 遶 不 得 左 轉 
X60n1118_002:0257b20	右遶名吉。左遶名凶。凡遶佛遶塔。自東而南。即成	右 遶 名 吉 左 遶 名 凶 凡 遶 佛 遶 塔 自 東 而 南 即 成 
X60n1118_002:0257b21	右遶。非用自手為右。夫旋遶以敬慕佛為義。故當	右 遶 非 用 自 手 為 右 夫 旋 遶 以 敬 慕 佛 為 義 故 當 
X60n1118_002:0257b22	以佛為右也。文句記云。左迴偏僻。以表惡也。右迴	以 佛 為 右 也 文 句 記 云 左 迴 偏 僻 以 表 惡 也 右 迴 
X60n1118_002:0257b23	便易。以表善也。佛髮右旋。凡人左旋。故當從佛。	便 易 以 表 善 也 佛 髮 右 旋 凡 人 左 旋 故 當 從 佛 
X60n1118_002:0257b24	不得殿塔中涕唾。	不 得 殿 塔 中 涕 唾 
X60n1118_002:0257c01	僧護經云。在佛僧淨地涕唾污地。以是因緣。入地	僧 護 經 云 在 佛 僧 淨 地 涕 唾 污 地 以是因緣 入 地 
X60n1118_002:0257c02	獄中。刀刖己鼻。火燒受苦不息。詳如經說。	獄 中 刀 刖 己 鼻 火 燒 受 苦 不 息 詳 如 經 說 
X60n1118_002:0257c03	遶塔。或三匝七匝。乃至十百匝。須知遍數。	遶 塔 或 三 匝 七 匝 乃 至 十 百 匝 須 知 遍 數 
X60n1118_002:0257c04	凡敬遶塔像遍數。皆有所表。三匝表供三寶。除三	凡 敬 遶 塔 像 遍 數 皆 有 所 表 三 匝 表 供 三 寶 除 三 
X60n1118_002:0257c05	毒。淨三業。滅三惡道。得值三寶。七匝除七支罪。得	毒 淨 三 業 滅 三 惡 道 得 值 三 寶 七 匝 除 七 支 罪 得 
X60n1118_002:0257c06	七菩提分。十匝除十使。得佛十力。百匝除百煩惱。	七菩提分 十 匝 除 十 使 得 佛 十 力 百 匝 除 百 煩 惱 
X60n1118_002:0257c07	得百法門。提謂經云。長者提謂白佛言。散花燒香	得 百 法 門 提 謂 經 云 長 者 提 謂 白 佛 言 散 花 燒 香 
X60n1118_002:0257c08	然燈禮拜。是為供養。旋塔得何等福。佛言。旋塔有	然 燈 禮 拜 是 為 供 養 旋 塔 得 何 等 福 佛 言 旋 塔 有 
X60n1118_002:0257c09	五福德。一後世得端正好色。二得音聲好。三生天	五 福 德 一 後 世 得 端 正 好 色 二 得 音 聲 好 三 生 天 
X60n1118_002:0257c10	上。四得生王侯家。五得涅槃道。何因緣得端正好	上 四 得 生 王 侯 家 五 得 涅 槃 道 何 因 緣 得 端 正 好 
X60n1118_002:0257c11	色。由見佛像歡喜故。何緣得聲音好。由旋塔說經	色 由 見 佛 像 歡 喜 故 何 緣 得 聲 音 好 由 旋 塔 說 經 
X60n1118_002:0257c12	偈故。何緣得生天上。由當旋塔時。意不犯戒故。何	偈 故 何 緣 得 生 天 上 由 當 旋 塔 時 意 不 犯 戒 故 何 
X60n1118_002:0257c13	緣得生王侯家。由頭迴禮佛足故。何緣得涅槃道。	緣 得 生 王 侯 家 由 頭 迴 禮 佛 足 故 何 緣 得 涅 槃 道 
X60n1118_002:0257c14	由有餘福故。華嚴經旋塔偈云。始欲旋塔。當願眾	由 有 餘 福 故 華 嚴 經 旋 塔 偈 云 始 欲 旋 塔 當 願 眾 
X60n1118_002:0257c15	生。施行福祐。究暢道意。遶塔三匝。當願眾生。得一	生 施 行 福 祐 究 暢 道 意 遶 塔 三 匝 當 願 眾 生 得 一 
X60n1118_002:0257c16	向意。不絕四喜。	向 意 不 絕 四 喜 
X60n1118_002:0257c17	不得以笠杖等。倚殿壁。	不 得 以 笠 杖 等 倚 殿 壁 
X60n1118_002:0257c18	沙彌本無畜杖法。或遠行及老持之。入寺必須去	沙 彌 本 無 畜 杖 法 或 遠 行 及 老 持 之 入 寺 必 須 去 
X60n1118_002:0257c19	笠斂杖。若見二師上座尊宿。皆投杖笠於地。然後	笠 斂 杖 若 見 二 師 上 座 尊 宿 皆 投 杖 笠 於 地 然 後 
X60n1118_002:0257c20	問訊。若為二師持杖。師有顧問。必抱杖然後答之。	問 訊 若 為 二 師 持 杖 師 有 顧 問 必 抱 杖 然 後 答 之 
