X62n1194_001:0536a14	　谿聲正似廣長舌　　山鳥無非念阿彌	 谿 聲 正 似 廣 長 舌 山 鳥 無 非 念 阿 彌 
X62n1194_001:0536a15	　會到其中清虗意　　甯勞造作證菩提	 會 到 其 中 清 虗 意 甯 勞 造 作 證 菩 提 
X62n1194_001:0536a16	參問息心	參 問 息 心 
X62n1194_001:0536a17	　周遊南北與西東　參歷名山古剎風(甲子冬。上	 周 遊 南 北 與 西 東 參 歷 名 山 古 剎 風 甲 子 冬 上 
X62n1194_001:0536a18	北五臺。經峩山歸。已庚午春矣)　儒釋玄門原如是	北 五 臺 經 峩 山 歸 已 庚 午 春 矣 儒 釋 玄 門 原 如 是 
X62n1194_001:0536a19	　始知虗費草鞋銅	 始 知 虗 費 草 鞋 銅 
X62n1194_001:0536a20	　歷遍名山路萬千　風霜餐盡我心源	 歷 遍 名 山 路 萬 千 風 霜 餐 盡 我 心 源 
X62n1194_001:0536a21	　而今放下娘生面(到處叩問生死。莫如念佛為第一也)	 而 今 放 下 娘 生 面 到 處 叩 問 生 死 莫 如 念 佛 為 第 一 也 
X62n1194_001:0536a22	　執持彌陀不計年(除死方休)	 執 持 彌 陀 不 計 年 除 死 方 休 
X62n1194_001:0536a23	憶佛居跋	憶 佛 居 跋 
X62n1194_001:0536a24	楞嚴經大勢至菩薩念佛章云。譬如(有人)一專為憶一	楞 嚴 經 大 勢 至 菩 薩 念 佛 章 云 譬 如 有 人 一 專 為 憶 一 
X62n1194_001:0536b01	人專忘。如是二人。若逢不逢。乃至從生至生。同於形	人 專 忘 如 是 二 人 若 逢 不 逢 乃 至 從 生 至 生 同 於 形 
X62n1194_001:0536b02	影。不相乖異。十方如來憐念眾生。如母憶子。若子逃	影 不 相 乖 異 十 方 如 來 憐 念 眾 生 如 母 憶 子 若 子 逃 
X62n1194_001:0536b03	逝。雖憶何為。子若憶母。如母憶時母子歷生。不相違	逝 雖 憶 何 為 子 若 憶 母 如 母 憶 時 母 子 歷 生 不 相 違 
X62n1194_001:0536b04	遠。若眾生心。憶佛念佛。現前當來。必定見佛。去佛不	遠 若 眾 生 心 憶 佛 念 佛 現 前 當 來 必 定 見 佛 去 佛 不 
X62n1194_001:0536b05	遠。不假方便。自得心開。如染香人。身有香氣。嗟乎。此	遠 不 假 方 便 自 得 心 開 如 染 香 人 身 有 香 氣 嗟 乎 此 
X62n1194_001:0536b06	喻明超日月。極盡無餘。余愧苦惱深障。道業難成雖	喻 明 超 日 月 極 盡 無 餘 余 愧 苦 惱 深 障 道 業 難 成 雖 
X62n1194_001:0536b07	知淨土是最勝方便。惡逆凡夫。十念尚生。而我(戒香)	知 淨 土 是 最 勝 方 便 惡 逆 凡 夫 十 念 尚 生 而 我 戒 香 
X62n1194_001:0536b08	宿業沉重。念佛昏散。如之柰河。縱使厲聲旋繞。亦難	宿 業 沉 重 念 佛 昏 散 如 之 柰 河 縱 使 厲 聲 旋 繞 亦 難 
X62n1194_001:0536b09	相應。可愧可慘。賴彌陀。有十念往生。九品咸攝之願。	相 應 可 愧 可 慘 賴 彌 陀 有 十 念 往 生 九 品 咸 攝 之 願 
X62n1194_001:0536b10	故不管定心散意。只愁忘記。法華所謂一稱南無佛。	故 不 管 定 心 散 意 只 愁 忘 記 法 華 所 謂 一 稱 南 無 佛 
X62n1194_001:0536b11	皆共成佛道是也。佛既有如是之慈悲方便。只貴刻	皆 共 成 佛 道 是 也 佛 既 有 如 是 之 慈 悲 方 便 只 貴 刻 
X62n1194_001:0536b12	刻提撕。勿忘佛名。正猶母本望子。子若念母。何慮娘	刻 提 撕 勿 忘 佛 名 正 猶 母 本 望 子 子 若 念 母 何 慮 娘 
X62n1194_001:0536b13	不攝子乎。是以誠信篤行。不敢稍怠。縱千馬萬牛。亦	不 攝 子 乎 是 以 誠 信 篤 行 不 敢 稍 怠 縱 千 馬 萬 牛 亦 
X62n1194_001:0536b14	莫挽我之念。也故敬採經文。題其額曰。憶佛居。兼述	莫 挽 我 之 念 也 故 敬 採 經 文 題 其 額 曰 憶 佛 居 兼 述 
X62n1194_001:0536b15	句以誌之。	句 以 誌 之 
X62n1194_001:0536b16	　欲舍娑婆苦　　無門求護符　　博究方便法	 欲 舍 娑 婆 苦 無 門 求 護 符 博 究 方 便 法 
X62n1194_001:0536b17	　莫玅念彌陀　　散念宗憶念　　念念業海枯	 莫 玅 念 彌 陀 散 念 宗 憶 念 念 念 業 海 枯 
X62n1194_001:0536b18	　念到成片日　　決志取蓮窩	 念 到 成 片 日 決 志 取 蓮 窩 
X62n1194_001:0536b19	禪餘偶占	禪 餘 偶 占 
X62n1194_001:0536b20	　可憐一箇苦惱僧　　久墜汙泥不出塵	 可 憐 一 箇 苦 惱 僧 久 墜 汙 泥 不 出 塵 
X62n1194_001:0536b21	　垢水狂波無定意　　紛飛雜念閉心經	 垢 水 狂 波 無 定 意 紛 飛 雜 念 閉 心 經 
X62n1194_001:0536b22	　明珠投入始清染　　念佛方能出苦根	 明 珠 投 入 始 清 染 念 佛 方 能 出 苦 根 
X62n1194_001:0536b23	　念到根枯蓮蒂脫　　堂堂獨露向西生	 念 到 根 枯 蓮 蒂 脫 堂 堂 獨 露 向 西 生 
X62n1194_001:0536b24	　無常刻刻急相催　　催煞山僧歸去來	 無 常 刻 刻 急 相 催 催 煞 山 僧 歸 去 來 
X62n1194_001:0536c01	　五濁娑婆實險境　　蓮根淨土快藏栽	 五 濁 娑 婆 實 險 境 蓮 根 淨 土 快 藏 栽 
X62n1194_001:0536c02	　如雲勝友相待久　　勢至觀音輔佛隨	 如 雲 勝 友 相 待 久 勢 至 觀 音 輔 佛 隨 
X62n1194_001:0536c03	　速到樂邦俱會處　　寄栖華下越胞胎	 速 到 樂 邦 俱 會 處 寄 栖 華 下 越 胞 胎 
X62n1194_001:0536c04	夢甦迴心念佛文	夢 甦 迴 心 念 佛 文 
X62n1194_001:0536c05	夫溪光月影。幻質非堅。竹韻松聲。虗妄安實。然起滅	夫 溪 光 月 影 幻 質 非 堅 竹 韻 松 聲 虗 妄 安 實 然 起 滅 
X62n1194_001:0536c06	積殻於須彌。生死常流於苦海。自無始以來。縱貪嗔	積 殻 於 須 彌 生 死 常 流 於 苦 海 自 無 始 以 來 縱 貪 嗔 
X62n1194_001:0536c07	癡。造諸惡業。若其所作之業。有形相者。盡虗空界。不	癡 造 諸 惡 業 若 其 所 作 之 業 有 形 相 者 盡 虗 空 界 不 
X62n1194_001:0536c08	能容受。以是因緣。經歷惡道。無有出期者何也。由吾	能 容 受 以是因緣 經 歷 惡 道 無 有 出 期 者 何 也 由 吾 
X62n1194_001:0536c09	人現前一念之迷。遭萬劫無邊之苦。然迷久肯覺。猶	人 現 前 一 念 之 迷 遭 萬 劫 無 邊 之 苦 然 迷 久 肯 覺 猶 
X62n1194_001:0536c10	夢人受罪。痛醒便無。又譬商賈東行多年。記西即在	夢 人 受 罪 痛 醒 便 無 又 譬 商 賈 東 行 多 年 記 西 即 在 
X62n1194_001:0536c11	頃刻。而不勞動足。回首便西。迷人肯醒。亦復如是。慈	頃 刻 而 不 勞 動 足 回 首 便 西 迷 人 肯 醒 亦復如是 慈 
X62n1194_001:0536c12	雲所謂於一念頃。生極樂國是也。貴以迴向。及念佛	雲 所 謂 於 一 念 頃 生 極 樂 國 是 也 貴 以 迴 向 及 念 佛 
X62n1194_001:0536c13	心之所切不切耳。況阿彌陀佛。曾發四十八願。願願	心 之 所 切 不 切 耳 況 阿 彌 陀 佛 曾 發 四 十 八 願 願 願 
X62n1194_001:0536c14	度人。乃至十惡狂徒。臨終十念往生。要知十惡十念。	度 人 乃 至 十 惡 狂 徒 臨 終 十 念 往 生 要 知 十 惡 十 念 
X62n1194_001:0536c15	尚然得度。況戒定精誠。以終身而具信行願三切之	尚 然 得 度 況 戒 定 精 誠 以 終 身 而 具 信 行 願 三 切 之 
X62n1194_001:0536c16	所念佛乎。以劣比優。以善校惡。其間顯然可知。但愁	所 念 佛 乎 以 劣 比 優 以 善 校 惡 其 間 顯 然 可 知 但 愁 
X62n1194_001:0536c17	其不能懇切執持耳。既懇切執持。又慮其不一。既一	其 不 能 懇 切 執 持 耳 既 懇 切 執 持 又 慮 其 不 一 既 一 
X62n1194_001:0536c18	之。又恐其不久。苟能持而一之。一而久之。悠久無間。	之 又 恐 其 不 久 苟 能 持 而 一 之 一 而 久 之 悠 久 無 間 
X62n1194_001:0536c19	至死不變者。決定往生。若果然如是而再不往生者。	至 死 不 變 者 決 定 往 生 若 果 然 如 是 而 再 不 往 生 者 
X62n1194_001:0536c20	阿彌陀佛。及十方諸佛。便為妄語。試問篤正君子。尚	阿 彌 陀 佛 及 十方諸佛 便 為 妄 語 試 問 篤 正 君 子 尚 
X62n1194_001:0536c21	無異言。況天中天之金口親宣。而獨誑我哉乎。所以	無 異 言 況 天 中 天 之 金 口 親 宣 而 獨 誑 我 哉 乎 所 以 
X62n1194_001:0536c22	決無此理。毋勞猶豫。且執持名號。一心不亂。乃彌陀	決 無 此 理 毋 勞 猶 豫 且 執 持 名 號 一心不亂 乃 彌 陀 
X62n1194_001:0536c23	一經之綱宗。往生之左券也。真正難信之法。稀有之	一 經 之 綱 宗 往 生 之 左 券 也 真 正 難 信 之 法 稀 有 之 
X62n1194_001:0536c24	事。不出其間。兩句頂門。欲疾離苦海。飛生樂國者。莫	事 不 出 其 間 兩 句 頂 門 欲 疾 離 苦 海 飛 生 樂 國 者 莫 
X62n1194_001:0537a01	越於是矣。嗚呼我末代戒香。愚癡下劣。既久墮沉淪。	越 於 是 矣 嗚 呼 我 末 代 戒 香 愚 癡 下 劣 既 久 墮 沉 淪 
X62n1194_001:0537a02	故迷昧無知。現雖濫僧廁。竟茫茫然。無能霑以佛法。	故 迷 昧 無 知 現 雖 濫 僧 廁 竟 茫 茫 然 無 能 霑 以 佛 法 
X62n1194_001:0537a03	而暑往寒來。不覺命已耳順。去日既多。來日必寡。翛	而 暑 往 寒 來 不 覺 命 已 耳 順 去 日 既 多 來 日 必 寡 翛 
X62n1194_001:0537a04	然無常一到。猶晦夜而霧雨。前途黑漫後路悽愴。痛	然 無 常 一 到 猶 晦 夜 而 霧 雨 前 途 黑 漫 後 路 悽 愴 痛 
X62n1194_001:0537a05	喊枉然。趣向無由。須知赤膊條條。隻影煢獨既求生	喊 枉 然 趣 向 無 由 須 知 赤 膊 條 條 隻 影 煢 獨 既 求 生 
X62n1194_001:0537a06	已不得。似求死亦不得者。柰河如之。慎獨思之。孰不	已 不 得 似 求 死 亦 不 得 者 柰 河 如 之 慎 獨 思 之 孰 不 
X62n1194_001:0537a07	傷心。故我誠實苦惱。安得不預惶恐。而生悲畏哉乎。	傷 心 故 我 誠 實 苦 惱 安 得 不 預 惶 恐 而 生 悲 畏 哉 乎 
X62n1194_001:0537a08	苟非藉彌陀。慈願之接濟。及懇切念佛之[拚ㄙ+ㄊ]命者。萬	苟 非 藉 彌 陀 慈 願 之 接 濟 及 懇 切 念 佛 之 [拚ㄙㄊ] 命 者 萬 
X62n1194_001:0537a09	難越出。我業重若是。何幸遇此。念佛法門耶。今既承	難 越 出 我 業 重 若 是 何 幸 遇 此 念 佛 法 門 耶 今 既 承 
X62n1194_001:0537a10	佛力。當盡報受持。誓不敢怠。以偹不測。遺教經云。制	佛 力 當 盡 報 受 持 誓 不 敢 怠 以 偹 不 測 遺 教 經 云 制 
X62n1194_001:0537a11	之一處。何事不辨。予謂制之者。制其執持名號。一處	之 一 處 何 事 不 辨 予 謂 制 之 者 制 其 執 持 名 號 一 處 
X62n1194_001:0537a12	者。一其一心不亂。何事不辦者。即捨其娑婆。取其極	者 一 其 一心不亂 何 事 不 辦 者 即 捨 其 娑 婆 取 其 極 
X62n1194_001:0537a13	樂。乃至證果。又不出是經八字。而一生辦就也。以遺	樂 乃 至 證 果 又 不 出 是 經 八 字 而 一 生 辦 就 也 以 遺 
X62n1194_001:0537a14	教而合彌陀。則兩經相契。無不遂意耳。嗟乎釋迦慈	教 而 合 彌 陀 則 兩 經 相 契 無 不 遂 意 耳 嗟 乎 釋 迦 慈 
X62n1194_001:0537a15	父。以最後極慈之談者。因憐末劫蒼生。無門可入。故	父 以 最 後 極 慈 之 談 者 因 憐 末 劫 蒼 生 無 門 可 入 故 
X62n1194_001:0537a16	預為垂慈。方便直指。若論於我。正為一人慈示。論於	預 為 垂 慈 方 便 直 指 若 論 於 我 正 為 一 人 慈 示 論 於 
X62n1194_001:0537a17	人者。則為羣生所導也。是知不唯中下。急宜念佛。即	人 者 則 為 羣 生 所 導 也 是 知 不 唯 中 下 急 宜 念 佛 即 
X62n1194_001:0537a18	從上聖賢。無不以念佛得證。以其十方諸佛。皆念佛	從 上 聖 賢 無 不 以 念 佛 得 證 以 其 十方諸佛 皆 念 佛 
X62n1194_001:0537a19	成佛。經有所攷。譬儒氏之試官。不讀書者。而能作主	成 佛 經 有 所 攷 譬 儒 氏 之 試 官 不 讀 書 者 而 能 作 主 
X62n1194_001:0537a20	考。冢宰哉乎。故知不信念佛。任爾修諸雜善。福踰須	考 冢 宰 哉 乎 故 知 不 信 念 佛 任 爾 修 諸 雜 善 福 踰 須 
X62n1194_001:0537a21	彌。亦不得生。況餘門學道。猶蟻子上山。萬無一獲。念	彌 亦 不 得 生 況 餘 門 學 道 猶 蟻 子 上 山 萬 無 一 獲 念 
X62n1194_001:0537a22	佛修行。喻順水駕帆。萬行萬到。況彌陀慈願廣博。無	佛 修 行 喻 順 水 駕 帆 萬 行 萬 到 況 彌 陀 慈 願 廣 博 無 
X62n1194_001:0537a23	機不攝。如海納百川。淨穢齊收。雖爾予則獨愧其。念	機 不 攝 如 海 納 百 川 淨 穢 齊 收 雖 爾 予 則 獨 愧 其 念 
X62n1194_001:0537a24	不能一。愛不能輕也。苟舍三衣瓶鉢道具之外。無物	不 能 一 愛 不 能 輕 也 苟 舍 三 衣 瓶 鉢 道 具 之 外 無 物 
X62n1194_001:0537b01	不輕。輕之又輕。輕到無可輕處者。則念佛之心必一。	不 輕 輕 之 又 輕 輕 到 無 可 輕 處 者 則 念 佛 之 心 必 一 
X62n1194_001:0537b02	苟舍懇切持名。念佛之外。無念不一。一之又一。一到	苟 舍 懇 切 持 名 念 佛 之 外 無 念 不 一 一 之 又 一 一 到 
X62n1194_001:0537b03	無可一處者。則情愛之念必輕。愛既輕兮。念必一。念	無 可 一 處 者 則 情 愛 之 念 必 輕 愛 既 輕 兮 念 必 一 念 
X62n1194_001:0537b04	既一兮。佛必純。佛純念一。念一佛純。則心外無佛。佛	既 一 兮 佛 必 純 佛 純 念 一 念 一 佛 純 則 心 外 無 佛 佛 
X62n1194_001:0537b05	外無心。心佛一如。千江月現。報滿時至。無餘無欠。正	外 無 心 心 佛 一 如 千 江 月 現 報 滿 時 至 無 餘 無 欠 正 
X62n1194_001:0537b06	念分明。三聖齊現。隨佛往生。方知靈驗。以是鄙誠。[拚ㄙ+ㄊ]	念 分 明 三 聖 齊 現 隨 佛 往 生 方 知 靈 驗 以 是 鄙 誠 [拚ㄙㄊ] 
X62n1194_001:0537b07	命念去。一生安養。迴入塵衢。分身百億。勸導羣愚。同	命 念 去 一 生 安 養 迴 入 塵 衢 分 身 百 億 勸 導 羣 愚 同 
X62n1194_001:0537b08	出苦輪。共佛同居。立此誓願。復何言歟。復(何言歟願同太虛)。	出 苦 輪 共 佛 同 居 立 此 誓 願 復 何 言 歟 復 何 言 歟 願 同 太 虛 
X62n1194_001:0537b09	五更巡照偈	五 更 巡 照 偈 
X62n1194_001:0537b10	初更夜報與念佛者。一日完世事捨。竪起脊骨梁。打	初 更 夜 報 與 念 佛 者 一 日 完 世 事 捨 竪 起 脊 骨 梁 打 
X62n1194_001:0537b11	開大般若。快念佛。今日又過也	開 大 般 若 快 念 佛 今 日 又 過 也 
X62n1194_001:0537b12	二更到。速拜昏沉拋。醒將來。聽我道。人生大夢中。雜	二 更 到 速 拜 昏 沉 拋 醒 將 來 聽 我 道 人 生 大 夢 中 雜 
X62n1194_001:0537b13	念宜拋調。快念佛。莫待無常到	念 宜 拋 調 快 念 佛 莫 待 無 常 到 
X62n1194_001:0537b14	三更鼓。生死無常苦。既為僧須早悟。不當國王差。不	三 更 鼓 生 死 無 常 苦 既 為 僧 須 早 悟 不 當 國 王 差 不 
X62n1194_001:0537b15	掃爹娘墓。快念佛。免教見閻羅	掃 爹 娘 墓 快 念 佛 免 教 見 閻 羅 
X62n1194_001:0537b16	四更至。說與念佛知。生最難。死容易。多少聰明人。空	四 更 至 說 與 念 佛 知 生 最 難 死 容 易 多 少 聰 明 人 空 
X62n1194_001:0537b17	過不辯味。快念佛。瞬息無常至	過 不 辯 味 快 念 佛 瞬 息 無 常 至 
X62n1194_001:0537b18	五更了。大事如何好。念不一。人已老。彌陀本現前。錯	五 更 了 大 事 如 何 好 念 不 一 人 已 老 彌 陀 本 現 前 錯 
X62n1194_001:0537b19	過人多少。快念佛。念佛成佛道	過 人 多 少 快 念 佛 念 佛 成 佛 道 
X62n1194_001:0537b20	巡照者。巡其縱逸。照其生死也。古人以圓木作枕。	巡 照 者 巡 其 縱 逸 照 其 生 死 也 古 人 以 圓 木 作 枕 
X62n1194_001:0537b21	乃至身不沾其牀凳。即此之義。而今人不然者。日	乃 至 身 不 沾 其 牀 凳 即 此 之 義 而 今 人 不 然 者 日 
X62n1194_001:0537b22	以雜念紛飛夜為惛朦癡睡。於生死分上。絕無干	以 雜 念 紛 飛 夜 為 惛 朦 癡 睡 於 生 死 分 上 絕 無 干 
X62n1194_001:0537b23	涉。是以巡到我處。連佛號回答不出者。正癡眠之	涉 是 以 巡 到 我 處 連 佛 號 回 答 不 出 者 正 癡 眠 之 
X62n1194_001:0537b24	至矣。苦哉哀哉。是我戒香。如此做光頭。三途防有	至 矣 苦 哉 哀 哉 是 我 戒 香 如 此 做 光 頭 三 途 防 有 
X62n1194_001:0537c01	分。地獄亦。難遁。哀告諸上人。慈悲呵責我。憫我痛	分 地 獄 亦 難 遁 哀 告 諸 上 人 慈 悲 呵 責 我 憫 我 痛 
X62n1194_001:0537c02	策我。切弗哂效我。火速快念佛。立刻來度我。	策 我 切 弗 哂 效 我 火 速 快 念 佛 立 刻 來 度 我 
X62n1194_001:0537c03	苦勸火速念佛歌	苦 勸 火 速 念 佛 歌 
X62n1194_001:0537c04	　論斯事　　心酸痛　　實可憂　　憂既無益　　念佛好	 論 斯 事 心 酸 痛 實 可 憂 憂 既 無 益 念 佛 好 
X62n1194_001:0537c05	　提筆起　　眼哭腫　　實可愁　　愁既無益　　念佛好	 提 筆 起 眼 哭 腫 實 可 愁 愁 既 無 益 念 佛 好 
X62n1194_001:0537c06	　暫做人　　常獄籠　　實可愁　　愁既無益　　念佛好	 暫 做 人 常 獄 籠 實 可 愁 愁 既 無 益 念 佛 好 
X62n1194_001:0537c07	　雖為僧　　與俗同　　實可羞　　羞既無益　　念佛好	 雖 為 僧 與 俗 同 實 可 羞 羞 既 無 益 念 佛 好 
X62n1194_001:0537c08	　宗不明　　教不通　　實可慚　　慚既無益　　念佛好	 宗 不 明 教 不 通 實 可 慚 慚 既 無 益 念 佛 好 
X62n1194_001:0537c09	　戒行無　　三毒重　　實可愧　　愧既無益　　念佛好	 戒 行 無 三 毒 重 實 可 愧 愧 既 無 益 念 佛 好 
X62n1194_001:0537c10	　造眾罪　　三途送　　實可怖　　怖既無益　　念佛好	 造 眾 罪 三 途 送 實 可 怖 怖 既 無 益 念 佛 好 
X62n1194_001:0537c11	　惡業纏　　病魔凶　　實可畏　　畏既無益　　念佛好	 惡 業 纏 病 魔 凶 實 可 畏 畏 既 無 益 念 佛 好 
X62n1194_001:0537c12	　眼惛瞎　　耳不聰　　實可焦　　焦既無益　　念佛好	 眼 惛 瞎 耳 不 聰 實 可 焦 焦 既 無 益 念 佛 好 
X62n1194_001:0537c13	　遍體燒　　渾身痛　　實可悽　　悽既無益　　念佛好	 遍 體 燒 渾 身 痛 實 可 悽 悽 既 無 益 念 佛 好 
X62n1194_001:0537c14	　無常到　　手摸空　　實可慌　　慌既無益　　念佛好	 無 常 到 手 摸 空 實 可 慌 慌 既 無 益 念 佛 好 
X62n1194_001:0537c15	　諸鬼卒　　惡不容　　實可慘　　慘既無益　　念佛好	 諸 鬼 卒 惡 不 容 實 可 慘 慘 既 無 益 念 佛 好 
X62n1194_001:0537c16	　舌頭大　　口難動　　實可酸　　酸既無益　　念佛好	 舌 頭 大 口 難 動 實 可 酸 酸 既 無 益 念 佛 好 
X62n1194_001:0537c17	　地獄相　　火齊紅　　實可怕　　怕既無益　　念佛好	 地 獄 相 火 齊 紅 實 可 怕 怕 既 無 益 念 佛 好 
X62n1194_001:0537c18	　幸善友　　念佛濃　　實可喜　　喜亦無益　　念佛好	 幸 善 友 念 佛 濃 實 可 喜 喜 亦 無 益 念 佛 好 
X62n1194_001:0537c19	　藉佛力　　獲凉風　　實可喜　　喜亦無益　　念佛好	 藉 佛 力 獲 凉 風 實 可 喜 喜 亦 無 益 念 佛 好 
X62n1194_001:0537c20	　心稍清　　繫念通　　實可喜　　喜亦無益　　念佛好	 心 稍 清 繫 念 通 實 可 喜 喜 亦 無 益 念 佛 好 
X62n1194_001:0537c21	　未十念　　竟像鬆　　實可喜　　喜亦無益　　念佛好	 未 十 念 竟 像 鬆 實 可 喜 喜 亦 無 益 念 佛 好 
X62n1194_001:0537c22	　地獄形　　絕無踪　　實可喜　　喜既有益　　念佛好	 地 獄 形 絕 無 踪 實 可 喜 喜 既 有 益 念 佛 好 
X62n1194_001:0537c23	　承知識　　助示功　　實可喜　　喜既有益　　念佛好	 承 知 識 助 示 功 實 可 喜 喜 既 有 益 念 佛 好 
X62n1194_001:0537c24	　化佛至　　蓮臺擁　　實可喜　　喜既有益　　念佛好	 化 佛 至 蓮 臺 擁 實 可 喜 喜 既 有 益 念 佛 好 
X62n1194_001:0538a01	　金蓮花　　如日宏　　實可喜　　喜既有益　　念佛好	 金 蓮 花 如 日 宏 實 可 喜 喜 既 有 益 念 佛 好 
X62n1194_001:0538a02	　住人前　　更心聰　　實可喜　　喜既有益　　念佛好	 住 人 前 更 心 聰 實 可 喜 喜 既 有 益 念 佛 好 
X62n1194_001:0538a03	　一念頃　　樂國共　　實可喜　　喜既有益　　念佛好	 一 念 頃 樂 國 共 實 可 喜 喜 既 有 益 念 佛 好 
X62n1194_001:0538a04	念佛好。念佛好。持戒持名念佛好。以上多少凶險事。	念 佛 好 念 佛 好 持 戒 持 名 念 佛 好 以 上 多 少 凶 險 事 
X62n1194_001:0538a05	全賴一句佛力保。那怕王侯與鐵漢臨死歸根念佛	全 賴 一 句 佛 力 保 那 怕 王 侯 與 鐵 漢 臨 死 歸 根 念 佛 
X62n1194_001:0538a06	好。	好 
X62n1194_001:0538a07	此歌者。實我自身作業。真心發露。以苦口哀勸善	此 歌 者 實 我 自 身 作 業 真 心 發 露 以 苦 口 哀 勸 善 
X62n1194_001:0538a08	人。極信念佛要緊。為大丈夫自己。第一件要緊事	人 極 信 念 佛 要 緊 為 大 丈 夫 自 己 第 一 件 要 緊 事 
X62n1194_001:0538a09	幹。勿可輕視而自負。要知我戒香。過現造諸惡業。	幹 勿 可 輕 視 而 自 負 要 知 我 戒 香 過 現 造 諸 惡 業 
X62n1194_001:0538a10	臨終地獄眾火。一時顯現如是。僅以藉人助念之	臨 終 地 獄 眾 火 一 時 顯 現 如 是 僅 以 藉 人 助 念 之 
X62n1194_001:0538a11	功。及自己極念之力。不十念而回獄蓮擁。復感阿	功 及 自 己 極 念 之 力 不 十 念 而 回 獄 蓮 擁 復 感 阿 
X62n1194_001:0538a12	彌陀佛。化佛慰我。頃刻攝往。極樂同居。況諸善者。	彌 陀 佛 化 佛 慰 我 頃 刻 攝 往 極 樂 同 居 況 諸 善 者 
X62n1194_001:0538a13	以戒定持名懇切。終身之所念佛乎。須知念佛有	以 戒 定 持 名 懇 切 終 身 之 所 念 佛 乎 須 知 念 佛 有 
X62n1194_001:0538a14	如是好處。如是便宜。如是靈感而阿彌陀佛。有如	如 是 好 處 如 是 便 宜 如 是 靈 感 而 阿 彌 陀 佛 有 如 
X62n1194_001:0538a15	是慈悲。猶賊之父母。終不惡子為賊而不愛子。必	是 慈 悲 猶 賊 之 父 母 終 不 惡 子 為 賊 而 不 愛 子 必 
X62n1194_001:0538a16	要拖爾回家。如是恩典。磨骨揚灰。何足以報。是以	要 拖 爾 回 家 如 是 恩 典 磨 骨 揚 灰 何 足 以 報 是 以 
X62n1194_001:0538a17	再不信再不念。誠為可惜之至矣徹悟所謂不讀	再 不 信 再 不 念 誠 為 可 惜 之 至 矣 徹 悟 所 謂 不 讀 
X62n1194_001:0538a18	佛經。不聞開示。甯知此理。今而後。唯有竭力精修。	佛 經 不 聞 開 示 甯 知 此 理 今 而 後 唯 有 竭 力 精 修 
X62n1194_001:0538a19	盡報歸誠。[拚ㄙ+ㄊ]命念佛而已。復何言哉。	盡 報 歸 誠 [拚ㄙㄊ] 命 念 佛 而 已 復 何 言 哉 
X62n1194_001:0538a20	稽首發願迴向偈	稽 首 發 願 迴 向 偈 
X62n1194_001:0538a21	　稽首釋迦文　　阿彌陀如來　　十方一切佛	 稽 首 釋 迦 文 阿 彌 陀 如 來 十 方 一 切 佛 
X62n1194_001:0538a22	　圓頓脩多羅　　觀音及勢至　　菩薩上善人	 圓 頓 脩 多 羅 觀 音 及 勢 至 菩 薩 上 善 人 
X62n1194_001:0538a23	　廬山等梵天　　蓮社列聖祖　　敬集佛祖言	 廬 山 等 梵 天 蓮 社 列 聖 祖 敬 集 佛 祖 言 
X62n1194_001:0538a24	　述句讚淨土　　弟子承佛力　　頂戴恒信受	 述 句 讚 淨 土 弟 子 承 佛 力 頂 戴 恒 信 受 
X62n1194_001:0538b01	　伏願垂加護　　速令捨娑婆　　見聞諸善人	 伏 願 垂 加 護 速 令 捨 娑 婆 見 聞 諸 善 人 
X62n1194_001:0538b02	　遞相輾轉勸　　厥德不可量　　譬喻莫能盡	 遞 相 輾 轉 勸 厥 德 不 可 量 譬 喻 莫 能 盡 
X62n1194_001:0538b03	　願以此功德　　迴向佛淨土　　我與眾生等	 願 以 此 功 德 迴 向 佛 淨 土 我 與 眾 生 等 
X62n1194_001:0538b04	　同取極樂國	 同 取 極 樂 國 
X62n1194_001:0538b05	斯錄。乃戒香自己痛思之死門事大。急宜火速念	斯 錄 乃 戒 香 自 己 痛 思 之 死 門 事 大 急 宜 火 速 念 
X62n1194_001:0538b06	佛。以平日苟有十分的當者。將來稍有分毫抵敵。	佛 以 平 日 苟 有 十 分 的 當 者 將 來 稍 有 分 毫 抵 敵 
X62n1194_001:0538b07	或可權能作主。否則虗掛空名。全不濟事。故編之	或 可 權 能 作 主 否 則 虗 掛 空 名 全 不 濟 事 故 編 之 
X62n1194_001:0538b08	者。專為自策。而作護身之劵引。甯敢充能以醜人	者 專 為 自 策 而 作 護 身 之 劵 引 甯 敢 充 能 以 醜 人 
X62n1194_001:0538b09	乎。茲安康西有善士許妙明等。極信西方。見是錄	乎 茲 安 康 西 有 善 士 許 妙 明 等 極 信 西 方 見 是 錄 
X62n1194_001:0538b10	喜之不已。再四請梓。以便利眾。余之曰不可也。何	喜 之 不 已 再 四 請 梓 以 便 利 眾 余 之 曰 不 可 也 何 
X62n1194_001:0538b11	者。緣我所撰之文。以我能念之佛。實不相應。而語	者 緣 我 所 撰 之 文 以 我 能 念 之 佛 實 不 相 應 而 語 
