X62n1194_001:0538b12	句粗疎。何苦多招譏笑。許君曰。師之言雖是真實。	句 粗 疎 何 苦 多 招 譏 笑 許 君 曰 師 之 言 雖 是 真 實 
X62n1194_001:0538b13	不過難獻中上之士耶。然破我等俗情正似應時。	不 過 難 獻 中 上 之 士 耶 然 破 我 等 俗 情 正 似 應 時 
X62n1194_001:0538b14	何庸過謙。而猶儒童之教蒙童。竟可自習而益人。	何 庸 過 謙 而 猶 儒 童 之 教 蒙 童 竟 可 自 習 而 益 人 
X62n1194_001:0538b15	何太懼其哂耶。迴思固辭。既不見允。安敢執悋。以	何 太 懼 其 哂 耶 迴 思 固 辭 既 不 見 允 安 敢 執 悋 以 
X62n1194_001:0538b16	退他心乎。是以赧顏塞之。惶恐惶恐。伏乞重道善	退 他 心 乎 是 以 赧 顏 塞 之 惶 恐 惶 恐 伏 乞 重 道 善 
X62n1194_001:0538b17	友。憫我愚昧。勿計幸甚。是所致禱。	友 憫 我 愚 昧 勿 計 幸 甚 是 所 致 禱 
X62n1194_001:0538b18	同治壬申春淨業學人蓮根戒香稽首謹白	同 治 壬 申 春 淨 業 學 人 蓮 根 戒 香 稽 首 謹 白 
X62n1194_001:0538b19	厭離濁世思歸淨土文	厭 離 濁 世 思 歸 淨 土 文 
X62n1194_001:0538b20	夫法華經云。三界無安。猶如火宅。眾苦充滿。甚可怖	夫 法 華 經 云 三 界 無 安 猶 如 火 宅 眾 苦 充 滿 甚 可 怖 
X62n1194_001:0538b21	畏。誠哉是言也。以色界。欲界。及無色界。都諸苦惱。悉	畏 誠 哉 是 言 也 以 色 界 欲 界 及 無 色 界 都 諸 苦 惱 悉 
X62n1194_001:0538b22	無安隱。僅有西方淨土之中。斷諸怖畏。絕無煩惱。無	無 安 隱 僅 有 西方淨土 之 中 斷 諸 怖 畏 絕 無 煩 惱 無 
X62n1194_001:0538b23	眾苦名。但受諸樂。故名極樂。而無量壽經云。若稱我	眾 苦 名 但 受 諸 樂 故 名 極 樂 而 無 量 壽 經 云 若 稱 我 
X62n1194_001:0538b24	名。必生我國。若不爾者。誓不成佛。法華又云。若人散	名 必 生 我 國 若 不 爾 者 誓 不 成 佛 法 華 又 云 若 人 散 
X62n1194_001:0538c01	亂心。入於塔廟中。一稱南無佛。皆共成佛道。嗟乎。千	亂 心 入 於 塔 廟 中 一 稱 南 無 佛 皆 共 成 佛 道 嗟 乎 千 
X62n1194_001:0538c02	經共指。萬聖同宣。佛言不信。何言可信。要知稱佛聞	經 共 指 萬 聖 同 宣 佛 言 不 信 何 言 可 信 要 知 稱 佛 聞 
X62n1194_001:0538c03	名尚生彼。而成佛道。況盡形頂戴竭力受持哉乎。然	名 尚 生 彼 而 成 佛 道 況 盡 形 頂 戴 竭 力 受 持 哉 乎 然 
X62n1194_001:0538c04	此方之眾苦。實苦不可言。彼土之諸樂。真樂莫能窮。	此 方 之 眾 苦 實 苦 不 可 言 彼 土 之 諸 樂 真 樂 莫 能 窮 
X62n1194_001:0538c05	天壤懸遠。優劣自顯。故知三界中者。無人不當急出	天 壤 懸 遠 優 劣 自 顯 故 知 三 界 中 者 無 人 不 當 急 出 
X62n1194_001:0538c06	火宅。速入蓮池。以離生死。而待佛果者哉。每思娑婆	火 宅 速 入 蓮 池 以 離 生 死 而 待 佛 果 者 哉 每 思 娑 婆 
X62n1194_001:0538c07	五濁之苦。欣樂邦而厭苦域。急歸安養九品之樂。捨	五 濁 之 苦 欣 樂 邦 而 厭 苦 域 急 歸 安 養 九 品 之 樂 捨 
X62n1194_001:0538c08	胎獄而取華池。是以猛正念。蕩雜念。淡世味。濃佛味	胎 獄 而 取 華 池 是 以 猛 正 念 蕩 雜 念 淡 世 味 濃 佛 味 
X62n1194_001:0538c09	者。專為脫其娑婆哉也。欲脫以娑婆。須念以佛純。欲	者 專 為 脫 其 娑 婆 哉 也 欲 脫 以 娑 婆 須 念 以 佛 純 欲 
X62n1194_001:0538c10	念。以佛純。須斷以濁流。濁流止兮。恒河沙苦頓息。念	念 以 佛 純 須 斷 以 濁 流 濁 流 止 兮 恒 河 沙 苦 頓 息 念 
X62n1194_001:0538c11	佛純兮。捨報玅樂安祥。故不斷以世緣。絕以濁流者。	佛 純 兮 捨 報 玅 樂 安 祥 故 不 斷 以 世 緣 絕 以 濁 流 者 
X62n1194_001:0538c12	則心難純淨。念難純一觀想彌陀。甯能相應。猶形端	則 心 難 純 淨 念 難 純 一 觀 想 彌 陀 甯 能 相 應 猶 形 端 
X62n1194_001:0538c13	之於影正。源濁之於流昏。以是觀之。不得不砍其枝	之 於 影 正 源 濁 之 於 流 昏 以 是 觀 之 不 得 不 砍 其 枝 
X62n1194_001:0538c14	節。去其萌芽。淨其六根。清其三業。結茅舍。幽閉置於	節 去 其 萌 芽 淨 其 六 根 清 其 三 業 結 茅 舍 幽 閉 置 於 
X62n1194_001:0538c15	斗室。制身心。精持畢於終年。從旦至暮。晝夜六萬彌	斗 室 制 身 心 精 持 畢 於 終 年 從 旦 至 暮 晝 夜 六 萬 彌 
X62n1194_001:0538c16	陀二六時中。念念思歸淨土。燃香燒指。無非誓願求	陀 二 六 時 中 念 念 思 歸 淨 土 燃 香 燒 指 無 非 誓 願 求 
X62n1194_001:0538c17	生。發露翹勤。端為雪諸罪戾。疲勞豈憚。寒暄無間。設	生 發 露 翹 勤 端 為 雪 諸 罪 戾 疲 勞 豈 憚 寒 暄 無 間 設 
X62n1194_001:0538c18	過現之業重。或多劫之障深。不克盡此身而往者。誓	過 現 之 業 重 或 多 劫 之 障 深 不 克 盡 此 身 而 往 者 誓 
X62n1194_001:0538c19	以世世為僧。生生念佛無間。遵迦文之金言。及彌陀	以 世 世 為 僧 生 生 念 佛 無 間 遵 迦 文 之 金 言 及 彌 陀 
X62n1194_001:0538c20	之宏願。苟能藉慈光而生者。願其處處迴入。種種方	之 宏 願 苟 能 藉 慈 光 而 生 者 願 其 處 處 迴 入 種 種 方 
X62n1194_001:0538c21	便度生。虗空有盡。我願無窮。罄心鄙誠。恭疏短引。俚	便 度 生 虗 空 有 盡 我 願 無 窮 罄 心 鄙 誠 恭 疏 短 引 俚 
X62n1194_001:0538c22	言未定。粗韻草草聊成。工拙學疎。睞者幸諒勿哂。尚	言 未 定 粗 韻 草 草 聊 成 工 拙 學 疎 睞 者 幸 諒 勿 哂 尚 
X62n1194_001:0538c23	希慈誨。仰乞慜政。	希 慈 誨 仰 乞 慜 政 
X62n1194_001:0538c24	　急取安養宿　　免遭眾苦磨　　自愧焦芽子	 急 取 安 養 宿 免 遭 眾 苦 磨 自 愧 焦 芽 子 
X62n1194_001:0539a01	　敗種病真多　　賴有慈航濟　　稱名苦便無	 敗 種 病 真 多 賴 有 慈 航 濟 稱 名 苦 便 無 
X62n1194_001:0539a02	　願王光攝我　　帶業出娑婆	 願 王 光 攝 我 帶 業 出 娑 婆 
X62n1194_001:0539a03	　欲捨娑婆路　　先除荊棘疴　　毒根咸砍淨	 欲 捨 娑 婆 路 先 除 荊 棘 疴 毒 根 咸 砍 淨 
X62n1194_001:0539a04	　枝葉自然無　　一心恒不亂　　執持阿彌陀	 枝 葉 自 然 無 一 心 恒 不 亂 執 持 阿 彌 陀 
X62n1194_001:0539a05	　清淨無纖習　　報滿躲蓮窩	 清 淨 無 纖 習 報 滿 躲 蓮 窩 
X62n1194_001:0539a06	　思念三界苦　　歸向大覺仙　　急求離火宅	 思 念 三 界 苦 歸 向 大 覺 仙 急 求 離 火 宅 
X62n1194_001:0539a07	　念佛用當先　　聞名尚成就　　況持六十千	 念 佛 用 當 先 聞 名 尚 成 就 況 持 六 十 千 
X62n1194_001:0539a08	　遵經依佛語　　信願切宜堅	 遵 經 依 佛 語 信 願 切 宜 堅 
X62n1194_001:0539a09	　淨土真安樂　　往生最勝緣　　貴以欣厭切	 淨 土 真 安 樂 往 生 最 勝 緣 貴 以 欣 厭 切 
X62n1194_001:0539a10	　六字更綿綿　　念念心純一　　聲聲佛現前	 六 字 更 綿 綿 念 念 心 純 一 聲 聲 佛 現 前 
X62n1194_001:0539a11	　念至瓜香日　　誓入下品蓮(經云。下品下生。猶勝天官。況中上上	 念 至 瓜 香 日 誓 入 下 品 蓮 經 云 下 品 下 生 猶 勝 天 官 況 中 上 上 
X62n1194_001:0539a12	哉乎)。	哉 乎 
X62n1194_001:0539a13	又七言五韻四首。	又 七 言 五 韻 四 首 
X62n1194_001:0539a14	　三界火宅屬吾身　三業惛迷自造成(華嚴云。一	 三 界 火 宅 屬 吾 身 三 業 惛 迷 自 造 成 華 嚴 云 一 
X62n1194_001:0539a15	切惟心造)　經歷無邊諸惡道	切 惟 心 造 經 歷 無 邊 諸 惡 道 
X62n1194_001:0539a16	　從苦入苦到如今　慈父誘我方始覺	 從 苦 入 苦 到 如 今 慈 父 誘 我 方 始 覺 
X62n1194_001:0539a17	　痛悔貪瞋癡毒心　藉佛甘露洗滌我	 痛 悔 貪 瞋 癡 毒 心 藉 佛 甘 露 洗 滌 我 
X62n1194_001:0539a18	　障輕病減漸回春	 障 輕 病 減 漸 回 春 
X62n1194_001:0539a19	　我病該死何幸生　　全賴醫王無上尊	 我 病 該 死 何 幸 生 全 賴 醫 王 無 上 尊 
X62n1194_001:0539a20	　急切持名須努力　　自行他他酧慈恩	 急 切 持 名 須 努 力 自 行 他 他 酧 慈 恩 
X62n1194_001:0539a21	　娑婆患險真厭怖　　淨土安隱實羨忻	 娑 婆 患 險 真 厭 怖 淨 土 安 隱 實 羨 忻 
X62n1194_001:0539a22	　誓願臨終斷諸道　　正念直入志西升	 誓 願 臨 終 斷 諸 道 正 念 直 入 志 西 升 
X62n1194_001:0539a23	　生已迴入復娑婆　　處處闡揚報佛恩	 生 已 迴 入 復 娑 婆 處 處 闡 揚 報 佛 恩 
X62n1194_001:0539a24	　百億分身廣勸導　　方便種種度郡生	 百 億 分 身 廣 勸 導 方 便 種 種 度 郡 生 
X62n1194_001:0539b01	　隨機應化無倦息　　權現神通拔火抗	 隨 機 應 化 無 倦 息 權 現 神 通 拔 火 抗 
X62n1194_001:0539b02	　但願四生歸淨域　　蓮根方滿最初心	 但 願 四 生 歸 淨 域 蓮 根 方 滿 最 初 心 
X62n1194_001:0539b03	　佛慈悲願玅難量　　設盡無邊方便門	 佛 慈 悲 願 玅 難 量 設 盡 無 邊 方 便 門 
X62n1194_001:0539b04	　唯有樂邦稱最勝　　最勝最異度人登	 唯 有 樂 邦 稱 最 勝 最 勝 最 異 度 人 登 
X62n1194_001:0539b05	　迷子朦曉蓮池樂　　慳穢棄珍痛煞人	 迷 子 朦 曉 蓮 池 樂 慳 穢 棄 珍 痛 煞 人 
X62n1194_001:0539b06	　知得他方如斯玅　　天神也願即飛生	 知 得 他 方 如 斯 玅 天 神 也 願 即 飛 生 
X62n1194_001:0539b07	試問天神願生者何耶。答經云。天福享盡。尚墮三	試 問 天 神 願 生 者 何 耶 答 經 云 天 福 享 盡 尚 墮 三 
X62n1194_001:0539b08	途。故甯棄天宮。疾歸淨土者。顯見樂勝天庭。而位	途 故 甯 棄 天 宮 疾 歸 淨 土 者 顯 見 樂 勝 天 庭 而 位 
X62n1194_001:0539b09	居不退。永無墜日。要知天神尚然。況人民之區區	居 不 退 永 無 墜 日 要 知 天 神 尚 然 況 人 民 之 區 區 
X62n1194_001:0539b10	祿乎。然迷子之慳戀不察。猶蜂之慳花。蟻之戀穴。	祿 乎 然 迷 子 之 慳 戀 不 察 猶 蜂 之 慳 花 蟻 之 戀 穴 
X62n1194_001:0539b11	以污反喜。以少為足。有何異乎。但愚而罔知。固可	以 污 反 喜 以 少 為 足 有 何 異 乎 但 愚 而 罔 知 固 可 
X62n1194_001:0539b12	悲憐。或智而不覺。覺而不願者。深堪痛惜。若人道	悲 憐 或 智 而 不 覺 覺 而 不 願 者 深 堪 痛 惜 若 人 道 
X62n1194_001:0539b13	不透。何道可出。如甘心往來苦海。經歷險道。不願	不 透 何 道 可 出 如 甘 心 往 來 苦 海 經 歷 險 道 不 願 
X62n1194_001:0539b14	復本往生者。吾不知其所歸矣。	復 本 往 生 者 吾 不 知 其 所 歸 矣 
X62n1194_001:0539b15	娑婆西方。苦樂二境。優劣分明說。各十首。	娑 婆 西 方 苦 樂 二 境 優 劣 分 明 說 各 十 首 
X62n1194_001:0539b16	應厭而捨之。欣而取之。娑婆苦情曰。	應 厭 而 捨 之 欣 而 取 之 娑 婆 苦 情 曰 
X62n1194_001:0539b17	五濁急捨莫慳延。眾苦交煎節節聯。八難三災恒相	五 濁 急 捨 莫 慳 延 眾 苦 交 煎 節 節 聯 八 難 三 災 恒 相 
X62n1194_001:0539b18	遇。饑饉疾疫日增添(不出三界。諸人難免)。	遇 饑 饉 疾 疫 日 增 添 不 出 三 界 諸 人 難 免 
X62n1194_001:0539b19	光陰如箭壽真促。遷變無常瞬息間。若不急尋安養	光 陰 如 箭 壽 真 促 遷 變 無 常 瞬 息 間 若 不 急 尋 安 養 
X62n1194_001:0539b20	路。出來入去苦無邊(生此死彼。無非是苦)。	路 出 來 入 去 苦 無 邊 生 此 死 彼 無 非 是 苦 
X62n1194_001:0539b21	寒暄相交年復年。此情原屬總由天。熱來爐炭有何	寒 暄 相 交 年 復 年 此 情 原 屬 總 由 天 熱 來 爐 炭 有 何 
X62n1194_001:0539b22	異。冷去霜氷亦可憐(冷熱尚難嗷。況加餘苦乎)。	異 冷 去 霜 氷 亦 可 憐 冷 熱 尚 難 嗷 況 加 餘 苦 乎 
X62n1194_001:0539b23	世求衣食苦難言。冐雨充風奔苦波。苟能厭苦勤念	世 求 衣 食 苦 難 言 冐 雨 充 風 奔 苦 波 苟 能 厭 苦 勤 念 
X62n1194_001:0539b24	佛。樂邦珍寶最盈多(他方衣食。不假造作。自然而至。尚不捨礫。取其珍耶)。	佛 樂 邦 珍 寶 最 盈 多 他 方 衣 食 不 假 造 作 自 然 而 至 尚 不 捨 礫 取 其 珍 耶 
X62n1194_001:0539c01	升合難求分外楚。有朝無暮實饑虗。因由往昔慳悋	升 合 難 求 分 外 楚 有 朝 無 暮 實 饑 虗 因 由 往 昔 慳 悋 
X62n1194_001:0539c02	甚。遭報今生缺絕磨(既無春種。安有秋收)。	甚 遭 報 今 生 缺 絕 磨 既 無 春 種 安 有 秋 收 
X62n1194_001:0539c03	舉眼多見惡人形。百策奇端不可聞。造時易兮報時	舉 眼 多 見 惡 人 形 百 策 奇 端 不 可 聞 造 時 易 兮 報 時 
X62n1194_001:0539c04	苦。王案獄案豈容情(自道英人。誰知囚人。然他方無有惡之名目。況見其形乎。故應	苦 王 案 獄 案 豈 容 情 自 道 英 人 誰 知 囚 人 然 他 方 無 有 惡 之 名 目 況 見 其 形 乎 故 應 
X62n1194_001:0539c05	念佛。而速徃之)。	念 佛 而 速 徃 之 
X62n1194_001:0539c06	豺狼凶惡還可避。三毒居懷最難防。智者專行戒定	豺 狼 凶 惡 還 可 避 三 毒 居 懷 最 難 防 智 者 專 行 戒 定 
X62n1194_001:0539c07	慧。八邪十惡隱他方(舉止動靜。切宜留神。是虎縱出。害人非淺。慎之察之)。	慧 八 邪 十 惡 隱 他 方 舉 止 動 靜 切 宜 留 神 是 虎 縱 出 害 人 非 淺 慎 之 察 之 
X62n1194_001:0539c08	無邊惡道曾經過。拔骨抽筋都已臨。既到人身非容	無 邊 惡 道 曾 經 過 拔 骨 抽 筋 都 已 臨 既 到 人 身 非 容 
X62n1194_001:0539c09	易。緣何還不急求生(輪迴六道。不出胎卵濕化。故必歷歷經當今既為人應速追本)。	易 緣 何 還 不 急 求 生 輪 迴 六 道 不 出 胎 卵 濕 化 故 必 歷 歷 經 當 今 既 為 人 應 速 追 本 
X62n1194_001:0539c10	苦形苦事苦情多。苦不可言怎柰何。僅有痛心勤念	苦 形 苦 事 苦 情 多 苦 不 可 言 怎 柰 何 僅 有 痛 心 勤 念 
X62n1194_001:0539c11	佛。以苦轉樂是雄夫(念佛二字。非大丈夫之所不能也。故是雄夫。定能痛心。而娑婆	佛 以 苦 轉 樂 是 雄 夫 念 佛 二 字 非 大 丈 夫 之 所 不 能 也 故 是 雄 夫 定 能 痛 心 而 娑 婆 
X62n1194_001:0539c12	之苦情。唯佛可救。故應念佛)。	之 苦 情 唯 佛 可 救 故 應 念 佛 
X62n1194_001:0539c13	粗嘆娑婆眾苦情。勸君急出快離坑。只消信得西方	粗 嘆 娑 婆 眾 苦 情 勸 君 急 出 快 離 坑 只 消 信 得 西 方 
X62n1194_001:0539c14	切。十念彌陀亦往生(此坑不出。任爾上至國王。下至螻蟻等類。無非同在其中。苦苦	切 十 念 彌 陀 亦 往 生 此 坑 不 出 任 爾 上 至 國 王 下 至 螻 蟻 等 類 無 非 同 在 其 中 苦 苦 
X62n1194_001:0539c15	樂樂。度日是也有何趣味耶)。	樂 樂 度 日 是 也 有 何 趣 味 耶 
X62n1194_001:0539c16	西方樂景曰。	西 方 樂 景 曰 
X62n1194_001:0539c17	九蓮任取樂邦栖。樂不可言世所稀。衣食自然非造	九 蓮 任 取 樂 邦 栖 樂 不 可 言 世 所 稀 衣 食 自 然 非 造 
X62n1194_001:0539c18	作。珍寶不勝實稀奇(以此較彼天壤懸遠其間樂處。百劫難宣。知否)。	作 珍 寶 不 勝 實 稀 奇 以 此 較 彼 天 壤 懸 遠 其 間 樂 處 百 劫 難 宣 知 否 
X62n1194_001:0539c19	光明壽命悉難量。往者無分別短長。一生補處皆不	光 明 壽 命 悉 難 量 往 者 無 分 別 短 長 一生補處 皆 不 
X62n1194_001:0539c20	退。上善齊會各稱強(彼國人民。壽命等情。悉難度量)。	退 上 善 齊 會 各 稱 強 彼 國 人 民 壽 命 等 情 悉 難 度 量 
X62n1194_001:0539c21	黃金為地甚嚴麗。天樂迎空奉阿彌。各賚玅花端供	黃 金 為 地 甚 嚴 麗 天 樂 迎 空 奉 阿 彌 各 賚 玅 花 端 供 
X62n1194_001:0539c22	養。他方億佛悉瞻依(晝夜六時。恒流不絕)。	養 他 方 億 佛 悉 瞻 依 晝 夜 六 時 恒 流 不 絕 
X62n1194_001:0539c23	七寶池邊多玅臺。層層樓閣實嚴奢。微風吹動諸行	七 寶 池 邊 多 玅 臺 層 層 樓 閣 實 嚴 奢 微 風 吹 動 諸 行 
X62n1194_001:0539c24	樹。享福羅漢笑盈腮(是福與世福。優劣若何耶)。	樹 享 福 羅 漢 笑 盈 腮 是 福 與 世 福 優 劣 若 何 耶 
X62n1194_001:0540a01	奇玅雜色眾靈禽。出和雅音悅眾心。自然皆生念佛	奇 玅 雜 色 眾 靈 禽 出 和 雅 音 悅 眾 心 自 然 皆 生 念 佛 
X62n1194_001:0540a02	法。宣流變化豈旁生(既非罪報所生的是彌陀化作)。	法 宣 流 變 化 豈 旁 生 既 非 罪 報 所 生 的 是 彌 陀 化 作 
X62n1194_001:0540a03	無量無邊聲聞僧。皆是念佛極精誠。何知濁世諸男	無量無邊 聲 聞 僧 皆 是 念 佛 極 精 誠 何 知 濁 世 諸 男 
X62n1194_001:0540a04	女。甯有人人不堪生(他既丈夫我亦爾只要心切總能成)。	女 甯 有 人 人 不 堪 生 他 既 丈 夫 我 亦 爾 只 要 心 切 總 能 成 
X62n1194_001:0540a05	絕無纖苦純諸樂。易往無人實可憐。痛煞願王眼盻	絕 無 纖 苦 純 諸 樂 易 往 無 人 實 可 憐 痛 煞 願 王 眼 盻 
X62n1194_001:0540a06	破。迷子熟睡苦黃連(戀苦棄樂。迷之甚矣)。	破 迷 子 熟 睡 苦 黃 連 戀 苦 棄 樂 迷 之 甚 矣 
X62n1194_001:0540a07	樂邦玅趣豈能窮。無盡無窮一觀通。純一分明全體	樂 邦 玅 趣 豈 能 窮 無 盡 無 窮 一 觀 通 純 一 分 明 全 體 
X62n1194_001:0540a08	現。是心是佛在其中(是心是佛四字。勿輕意觀之)。	現 是 心 是 佛 在 其 中 是 心 是 佛 四 字 勿 輕 意 觀 之 
X62n1194_001:0540a09	念佛臨終獲玅因。彌陀大士悉親迎。一念頃入蓮窩	念 佛 臨 終 獲 玅 因 彌 陀 大 士 悉 親 迎 一 念 頃 入 蓮 窩 
X62n1194_001:0540a10	托。纔曉今朝悅我心(早知若是。生出便念。已恨遲了。諸仁快信之)。	托 纔 曉 今 朝 悅 我 心 早 知 若 是 生 出 便 念 已 恨 遲 了 諸 仁 快 信 之 
X62n1194_001:0540a11	略讚西方極樂情。星火念佛快精勤。休戀蟻穴殘穢	略 讚 西方極樂 情 星 火 念 佛 快 精 勤 休 戀 蟻 穴 殘 穢 
X62n1194_001:0540a12	食。速往蓮臺享上珍(有如是玅處。若再甘心戀其火宅。慳其瓦礫。不願徃生者。吾說	食 速 往 蓮 臺 享 上 珍 有 如 是 玅 處 若 再 甘 心 戀 其 火 宅 慳 其 瓦 礫 不 願 徃 生 者 吾 說 
X62n1194_001:0540a13	定無出期矣)。	定 無 出 期 矣 
X62n1194_001:0540a14	夫娑婆之苦情西方之樂趣者。真正的的確確。纖	夫 娑 婆 之 苦 情 西 方 之 樂 趣 者 真 正 的 的 確 確 纖 
X62n1194_001:0540a15	毫無虗。縱十方口。亦莫能宣。然苦樂既有如是優	毫 無 虗 縱 十 方 口 亦 莫 能 宣 然 苦 樂 既 有 如 是 優 
X62n1194_001:0540a16	劣。試問甘以迷戀苦境。急以覺取樂因耶其間唯	劣 試 問 甘 以 迷 戀 苦 境 急 以 覺 取 樂 因 耶 其 間 唯 
X62n1194_001:0540a17	讓智者知。勿以愚者道也。或曰此係蓮根杜撰。因	讓 智 者 知 勿 以 愚 者 道 也 或 曰 此 係 蓮 根 杜 撰 因 
X62n1194_001:0540a18	惡人而莫信之。答雖曰杜撰。歷有所攷。乃千經共	惡 人 而 莫 信 之 答 雖 曰 杜 撰 歷 有 所 攷 乃 千 經 共 
X62n1194_001:0540a19	指。萬佛同宣。既非述者咎。莫非經佛戾耶。嗟乎。佛	指 萬 佛 同 宣 既 非 述 者 咎 莫 非 經 佛 戾 耶 嗟 乎 佛 
X62n1194_001:0540a20	言不信信何言。人道不修何道修。(余)再剖心挖肺	言 不 信 信 何 言 人 道 不 修 何 道 修 余 再 剖 心 挖 肺 
X62n1194_001:0540a21	一句。我智善若心有纖欺。立墮犁耕。設真心供養	一 句 我 智 善 若 心 有 纖 欺 立 墮 犁 耕 設 真 心 供 養 
X62n1194_001:0540a22	諸仁者。願速離娑婆。誓入西方。再曰不信。即十方	諸 仁 者 願 速 離 娑 婆 誓 入 西 方 再 曰 不 信 即 十 方 
X62n1194_001:0540a23	諸佛。亦無可柰何矣。況一介山埜。破戒沙彌乎。	諸 佛 亦 無 可 柰 何 矣 況 一 介 山 埜 破 戒 沙 彌 乎 
X62n1194_001:0540a24	心字說	心 字 說 
X62n1194_001:0540b01	大哉是心也。玅哉亦是心也。大以當體為義。妙以任	大 哉 是 心 也 玅 哉 亦 是 心 也 大 以 當 體 為 義 妙 以 任 
X62n1194_001:0540b02	運為宗。能包其太虗。而量周沙界者。誠非肉團妄想。	運 為 宗 能 包 其 太 虗 而 量 周 沙 界 者 誠 非 肉 團 妄 想 
X62n1194_001:0540b03	之心為心。乃智慧光明之心謂心也。是心者越空有	之 心 為 心 乃 智慧光明 之 心 謂 心 也 是 心 者 越 空 有 
X62n1194_001:0540b04	以具眾理。超聲色而應萬事。假如河沙英才。能測其	以 具 眾 理 超 聲 色 而 應 萬 事 假 如 河 沙 英 才 能 測 其 
X62n1194_001:0540b05	智乎。然世出世法靡不由是心而作。為聖為賢亦莫	智 乎 然 世 出 世 法 靡 不 由 是 心 而 作 為 聖 為 賢 亦 莫 
X62n1194_001:0540b06	不由是心而成。中庸云不可須臾離者是心也。猶臣	不 由 是 心 而 成 中 庸 云 不 可 須 臾 離 者 是 心 也 猶 臣 
X62n1194_001:0540b07	之事君。子之事父。咫尺莫違可也。華嚴云應觀法界	之 事 君 子 之 事 父 咫 尺 莫 違 可 也 華 嚴 云 應 觀 法 界 
X62n1194_001:0540b08	性。一切惟心造。須知惟心造者。成聖作賢。以及一切	性 一 切 惟 心 造 須 知 惟 心 造 者 成 聖 作 賢 以 及 一 切 
X62n1194_001:0540b09	善惡因緣。無不由是心識。造成昇墜苦樂。多種果報。	善 惡 因 緣 無 不 由 是 心 識 造 成 昇 墜 苦 樂 多 種 果 報 
X62n1194_001:0540b10	是故吾人現前心中所起一念。不落佛界便落九界。	是 故 吾 人 現 前 心 中 所 起 一 念 不 落 佛 界 便 落 九 界 
X62n1194_001:0540b11	九界者。謂佛界菩薩界。圓覺界聲聞界。為之四聖。次	九 界 者 謂 佛 界 菩 薩 界 圓 覺 界 聲 聞 界 為 之 四 聖 次 
X62n1194_001:0540b12	則天界人界修羅界。及地獄餓鬼畜生等界。為之六	則 天 界 人 界 修 羅 界 及 地 獄 餓 鬼 畜 生 等 界 為 之 六 
X62n1194_001:0540b13	凡所以凡有心者。靡不有念。但有念者。終不越於是	凡 所 以 凡 有 心 者 靡 不 有 念 但 有 念 者 終 不 越 於 是 
X62n1194_001:0540b14	心中之十法界也。故心若念佛。定落佛界心若念餘。	心 中 之 十 法 界 也 故 心 若 念 佛 定 落 佛 界 心 若 念 餘 
X62n1194_001:0540b15	不出九界者以其一一。皆由是心中一念所成。落其	不 出 九 界 者 以 其 一 一 皆 由 是 心 中 一 念 所 成 落 其 
X62n1194_001:0540b16	九界哉也。譬影必隨形。流必隨源。形端則影正源濁	九 界 哉 也 譬 影 必 隨 形 流 必 隨 源 形 端 則 影 正 源 濁 
X62n1194_001:0540b17	則流昏明矣。經之所謂一切惟心造者。乃心外無法。	則 流 昏 明 矣 經 之 所 謂 一 切 惟 心 造 者 乃 心 外 無 法 
X62n1194_001:0540b18	法外無心。是言離吾人現前一念之外。無有毫法可	法 外 無 心 是 言 離 吾 人 現 前 一 念 之 外 無 有 毫 法 可 
X62n1194_001:0540b19	以立脚也。嗟乎心之一字。有如是之天淵優劣。如是	以 立 脚 也 嗟 乎 心 之 一 字 有 如 是 之 天 淵 優 劣 如 是 
X62n1194_001:0540b20	之升沉苦樂者。真正非人不珍。不珍非人也。是故智	之 升 沉 苦 樂 者 真 正 非 人 不 珍 不 珍 非 人 也 是 故 智 
X62n1194_001:0540b21	者慎獨。念念覺察。應以未敗之軀借假修真。息諸惡	者 慎 獨 念 念 覺 察 應 以 未 敗 之 軀 借 假 修 真 息 諸 惡 
X62n1194_001:0540b22	以奉眾善。行方便而濟羣生。更宜覺光陰之易返。悟	以 奉 眾 善 行 方 便 而 濟 羣 生 更 宜 覺 光 陰 之 易 返 悟 
X62n1194_001:0540b23	石火之難留。身如浮雲。命若風燭。既云呼吸難保。何	石 火 之 難 留 身 如 浮 雲 命 若 風 燭 既 云 呼 吸 難 保 何 
X62n1194_001:0540b24	苦作諸不善。急當信心念佛。縱居家以未能宜忙裡	苦 作 諸 不 善 急 當 信 心 念 佛 縱 居 家 以 未 能 宜 忙 裡 
X62n1194_001:0540c01	而偷閒。多寡念幾句阿彌陀佛。漸漸種一點最勝善	而 偷 閒 多 寡 念 幾 句 阿 彌 陀 佛 漸 漸 種 一 點 最 勝 善 
X62n1194_001:0540c02	因。若能杜絕塵緣屏息諸務。深信是心。本來是佛。以	因 若 能 杜 絕 塵 緣 屏 息 諸 務 深 信 是 心 本 來 是 佛 以 
X62n1194_001:0540c03	其無始迷昧。苦到如今。今既略覺。當立志願。從此掃	其 無 始 迷 昧 苦 到 如 今 今 既 略 覺 當 立 志 願 從 此 掃 
X62n1194_001:0540c04	盡餘學。專切讀佛。乃至氣絕脚直。亦不稍改稍怠。苟	盡 餘 學 專 切 讀 佛 乃 至 氣 絕 脚 直 亦 不 稍 改 稍 怠 苟 
X62n1194_001:0540c05	能如是深信。指日不難面佛。然而修行二字。誠無別	能 如 是 深 信 指 日 不 難 面 佛 然 而 修 行 二 字 誠 無 別 
