X62n1194_001:0540c06	法。貴乎持戒念佛。而念佛二字。亦別無奇特。貴乎懇	法 貴 乎 持 戒 念 佛 而 念 佛 二 字 亦 別 無 奇 特 貴 乎 懇 
X62n1194_001:0540c07	切精一。懇切精一者何。謂信願行並立為三也。果以	切 精 一 懇 切 精 一 者 何 謂 信 願 行 並 立 為 三 也 果 以 
X62n1194_001:0540c08	信切。必斷疑情。願切必脫娑婆。行切必達西方。近佛	信 切 必 斷 疑 情 願 切 必 脫 娑 婆 行 切 必 達 西 方 近 佛 
X62n1194_001:0540c09	必矣。至於觀經所語是心是佛者。乃釋迦本師大慈	必 矣 至 於 觀 經 所 語 是 心 是 佛 者 乃 釋 迦 本 師 大 慈 
X62n1194_001:0540c10	大悲。明示是心人人可以作佛也。既許人人可以作	大 悲 明 示 是 心 人 人 可 以 作 佛 也 既 許 人 人 可 以 作 
X62n1194_001:0540c11	佛者。安可以再棄而再迷耶。故當藉此幻質篤志精	佛 者 安 可 以 再 棄 而 再 迷 耶 故 當 藉 此 幻 質 篤 志 精 
X62n1194_001:0540c12	誠。讀佛禮佛。將來命終之時。必定見佛。是心苟如是。	誠 讀 佛 禮 佛 將 來 命 終 之 時 必 定 見 佛 是 心 苟 如 是 
X62n1194_001:0540c13	起以是念者。則斷盡九界。必落佛界矣。故曰玅哉是	起 以 是 念 者 則 斷 盡 九 界 必 落 佛 界 矣 故 曰 玅 哉 是 
X62n1194_001:0540c14	心之所一念也。所以知是理者。縱居王宮天宮亦不	心 之 所 一 念 也 所 以 知 是 理 者 縱 居 王 宮 天 宮 亦 不 
X62n1194_001:0540c15	以為喜。何則以其天福有限。經云天福享盡。還墮牛	以 為 喜 何 則 以 其 天 福 有 限 經 云 天 福 享 盡 還 墮 牛 
X62n1194_001:0540c16	領中蟲。況人間之區區福祿哉乎。又曰西方下下品。	領 中 蟲 況 人 間 之 區 區 福 祿 哉 乎 又 曰 西 方 下 下 品 
X62n1194_001:0540c17	猶勝於天宮。況上上品哉乎。故應急宜生信。專切行	猶 勝 於 天 宮 況 上 上 品 哉 乎 故 應 急 宜 生 信 專 切 行 
X62n1194_001:0540c18	持要緊。予若不遵佛語。有臆說而誑諸仁者。令我戒	持 要 緊 予 若 不 遵 佛 語 有 臆 說 而 誑 諸 仁 者 令 我 戒 
X62n1194_001:0540c19	香立墮犁耕如其真實奉勸諸君。深信是心誠可作	香 立 墮 犁 耕 如 其 真 實 奉 勸 諸 君 深 信 是 心 誠 可 作 
X62n1194_001:0540c20	佛而欲願諸仁同落佛界者。則願我盡此一報身。疾	佛 而 欲 願 諸 仁 同 落 佛 界 者 則 願 我 盡 此 一 報 身 疾 
X62n1194_001:0540c21	生安樂國。以便早面彌陀。早居淨土。早迴娑婆。早來	生 安 樂 國 以 便 早 面 彌 陀 早 居 淨 土 早 迴 娑 婆 早 來 
X62n1194_001:0540c22	化度。務望諸哲勿以人廢言。而辜負自心。請靜味之	化 度 務 望 諸 哲 勿 以 人 廢 言 而 辜 負 自 心 請 靜 味 之 
X62n1194_001:0540c23	皆可以由是心而越苦海。由是心而登樂邦。由是心	皆 可 以 由 是 心 而 越 苦 海 由 是 心 而 登 樂 邦 由 是 心 
X62n1194_001:0540c24	而生無窮福慧。由是心而居上品蓮臺。噫若是。則大	而 生 無 窮 福 慧 由 是 心 而 居 上 品 蓮 臺 噫 若 是 則 大 
X62n1194_001:0541a01	地之最勝快事。孰有復越於是者哉。	地 之 最 勝 快 事 孰 有 復 越 於 是 者 哉 
X62n1194_001:0541a02	禪餘自問何謂光頭皮	禪 餘 自 問 何 謂 光 頭 皮 
X62n1194_001:0541a03	原夫薙髮染衣。頭光跣足。便名離欲羅漢。出塵上士。	原 夫 薙 髮 染 衣 頭 光 跣 足 便 名 離 欲 羅 漢 出 塵 上 士 
X62n1194_001:0541a04	越諸塵以絕乎諸趣。悟三空而超乎三界。名利斷盡。	越 諸 塵 以 絕 乎 諸 趣 悟 三 空 而 超 乎 三 界 名 利 斷 盡 
X62n1194_001:0541a05	榮辱毫無。觀桃紅柳綠之色。覺似一紀。聽海會蓮池	榮 辱 毫 無 觀 桃 紅 柳 綠 之 色 覺 似 一 紀 聽 海 會 蓮 池 
X62n1194_001:0541a06	之聲。知皆勝友。要甚眷屬。管甚春秋。本似物外閒人	之 聲 知 皆 勝 友 要 甚 眷 屬 管 甚 春 秋 本 似 物 外 閒 人 
X62n1194_001:0541a07	奚以塵客之所比乎。何柰宿習深濃。不染而就。猶烏	奚 以 塵 客 之 所 比 乎 何 柰 宿 習 深 濃 不 染 而 就 猶 烏 
X62n1194_001:0541a08	鴉之黑羽。蜘蛛之網纏。甯假造作。豈勞人為。以其無	鴉 之 黑 羽 蜘 蛛 之 網 纏 甯 假 造 作 豈 勞 人 為 以 其 無 
X62n1194_001:0541a09	明滿腹。習氣全箱。專慣向外馳求。奚有內行正念。所	明 滿 腹 習 氣 全 箱 專 慣 向 外 馳 求 奚 有 內 行 正 念 所 
X62n1194_001:0541a10	以攀緣送禮。不時問安。哄宿山以結隊。引做會而成	以 攀 緣 送 禮 不 時 問 安 哄 宿 山 以 結 隊 引 做 會 而 成 
X62n1194_001:0541a11	羣。僧俗擠擁。男婦擾攘。外觀奚雅。成乎釋氏之規。難	羣 僧 俗 擠 擁 男 婦 擾 攘 外 觀 奚 雅 成 乎 釋 氏 之 規 難 
X62n1194_001:0541a12	免人談。甯像僧家之格。以是觀之。大違佛制。非犯律	免 人 談 甯 像 僧 家 之 格 以 是 觀 之 大 違 佛 制 非 犯 律 
X62n1194_001:0541a13	儀。定逆尸羅。使世人怎信。粒米怎銷。嗚呼。末法淋漓。	儀 定 逆 尸 羅 使 世 人 怎 信 粒 米 怎 銷 嗚 呼 末 法 淋 漓 
X62n1194_001:0541a14	如是。諸佛甯不悲懷。我輩苦惱。亦濫其間。深愧愚昧	如 是 諸 佛 甯 不 悲 懷 我 輩 苦 惱 亦 濫 其 間 深 愧 愚 昧 
X62n1194_001:0541a15	無知。藏首縮頸。是以懼見人顏。避蹟山林。誠無可以	無 知 藏 首 縮 頸 是 以 懼 見 人 顏 避 蹟 山 林 誠 無 可 以 
X62n1194_001:0541a16	能為。僅初學而讀佛。惟余也有二習。與人之所稍異	能 為 僅 初 學 而 讀 佛 惟 余 也 有 二 習 與 人 之 所 稍 異 
X62n1194_001:0541a17	者。謂畏以熱閙也。混雜也。害善法以傷尸羅也。輕善	者 謂 畏 以 熱 閙 也 混 雜 也 害 善 法 以 傷 尸 羅 也 輕 善 
X62n1194_001:0541a18	友而虧道德也。剎那怠惰也。佛聲倐息也。光陰電速	友 而 虧 道 德 也 剎 那 怠 惰 也 佛 聲 倐 息 也 光 陰 電 速 
X62n1194_001:0541a19	也。命在呼吸也。及將終時。苦痛呻吟。之所倒眉也。然	也 命 在 呼 吸 也 及 將 終 時 苦 痛 呻 吟 之 所 倒 眉 也 然 
X62n1194_001:0541a20	其次者。乃喜以冷淡也。清靜也。損惡道。以嚴律儀也。	其 次 者 乃 喜 以 冷 淡 也 清 靜 也 損 惡 道 以 嚴 律 儀 也 
X62n1194_001:0541a21	敬壞服而惜針福也。不敢稍怠也。精持佛號也。速離	敬 壞 服 而 惜 針 福 也 不 敢 稍 怠 也 精 持 佛 號 也 速 離 
X62n1194_001:0541a22	苦海也。疾登彼岸也。至捨報時。安詳而逝。之所體態	苦 海 也 疾 登 彼 岸 也 至 捨 報 時 安 詳 而 逝 之 所 體 態 
X62n1194_001:0541a23	也。舍此喜畏之鄙習。非吾所學之所應。亦非我所契	也 舍 此 喜 畏 之 鄙 習 非 吾 所 學 之 所 應 亦 非 我 所 契 
X62n1194_001:0541a24	之所願也。然欲報佛本懷。感彌陀迎者。莫妙乎。修無	之 所 願 也 然 欲 報 佛 本 懷 感 彌 陀 迎 者 莫 妙 乎 修 無 
X62n1194_001:0541b01	間淨業。修無間淨業者。須遵善導大師云。以身專禮	間 淨 業 修 無 間 淨 業 者 須 遵 善 導 大 師 云 以 身 專 禮 
X62n1194_001:0541b02	阿彌陀佛。以口專持阿彌陀佛以意專觀阿彌陀佛	阿 彌 陀 佛 以 口 專 持 阿 彌 陀 佛 以 意 專 觀 阿 彌 陀 佛 
X62n1194_001:0541b03	是也。謂令身口意。無時不淨土。無刻不親佛。兼之一	是 也 謂 令 身 口 意 無 時 不 淨 土 無 刻 不 親 佛 兼 之 一 
X62n1194_001:0541b04	喜一畏之習。終身無廢。大都該稱佛懷。亦定感彌陀	喜 一 畏 之 習 終 身 無 廢 大 都 該 稱 佛 懷 亦 定 感 彌 陀 
X62n1194_001:0541b05	哉矣。若舍是而別出奇習者。吾亦不知其為何如也。	哉 矣 若 舍 是 而 別 出 奇 習 者 吾 亦 不 知 其 為 何 如 也 
X62n1194_001:0541b06	所以光到頭皮。須先識[起巳+頁]目。若竟不知。何謂光頭皮	所 以 光 到 頭 皮 須 先 識 [起巳頁] 目 若 竟 不 知 何 謂 光 頭 皮 
X62n1194_001:0541b07	者。誠為可傷之至。猶士子入場。既不董其[起巳+頁]。怎堪做	者 誠 為 可 傷 之 至 猶 士 子 入 場 既 不 董 其 [起巳頁] 怎 堪 做 
X62n1194_001:0541b08	文章。而妄思登榜耶。光頭亦然。從薙髮以來。如瞽目	文 章 而 妄 思 登 榜 耶 光 頭 亦 然 從 薙 髮 以 來 如 瞽 目 
X62n1194_001:0541b09	亂闖。糊東撞西。至於今日。竟不知所幹何事。出言並	亂 闖 糊 東 撞 西 至 於 今 日 竟 不 知 所 幹 何 事 出 言 並 
X62n1194_001:0541b10	無典章。談說亦乏稽古。正省公淨土詩云。初步迷時	無 典 章 談 說 亦 乏 稽 古 正 省 公 淨 土 詩 云 初 步 迷 時 
X62n1194_001:0541b11	步步迷。是也。若逢賢者。導我念佛。則曰西方路遠。吾	步 步 迷 是 也 若 逢 賢 者 導 我 念 佛 則 曰 西 方 路 遠 吾 
X62n1194_001:0541b12	焉能到。或稍獲小技。自道已通佛法。或信施護助。憍	焉 能 到 或 稍 獲 小 技 自 道 已 通 佛 法 或 信 施 護 助 憍 
X62n1194_001:0541b13	言我有修功。所以眼界若鵞。大生我慢。縱見清廉。高	言 我 有 修 功 所 以 眼 界 若 鵞 大 生 我 慢 縱 見 清 廉 高 
X62n1194_001:0541b14	讓之士。不在我之眼下。以其專趣豪勢。慣貪名利。是	讓 之 士 不 在 我 之 眼 下 以 其 專 趣 豪 勢 慣 貪 名 利 是 
X62n1194_001:0541b15	以全不知羞。屑無慚愧。嗟乎。如此苦惱。自奚知病。眼	以 全 不 知 羞 屑 無 慚 愧 嗟 乎 如 此 苦 惱 自 奚 知 病 眼 
X62n1194_001:0541b16	光一落。從此百劫煎熬。只消自問。甯勞閻翁判斷。那	光 一 落 從 此 百 劫 煎 熬 只 消 自 問 甯 勞 閻 翁 判 斷 那 
X62n1194_001:0541b17	時再欲為僧。防難如願。是故智者。聽之痛涕。愚者聞	時 再 欲 為 僧 防 難 如 願 是 故 智 者 聽 之 痛 涕 愚 者 聞 
X62n1194_001:0541b18	之反恨。因取捨不同。公私之見而已矣。咄。苟如是者	之 反 恨 因 取 捨 不 同 公 私 之 見 而 已 矣 咄 苟 如 是 者 
X62n1194_001:0541b19	我且問你。你既別父母房族。斷六親眷屬。而光其頭	我 且 問 你 你 既 別 父 母 房 族 斷 六 親 眷 屬 而 光 其 頭 
X62n1194_001:0541b20	者。畢竟所為何幹。如是問之再四。何竟目定口呆。絕	者 畢 竟 所 為 何 幹 如 是 問 之 再 四 何 竟 目 定 口 呆 絕 
X62n1194_001:0541b21	無回言。復厲聲。拍案一問。猶五雷振頂。百箭入心。恍	無 回 言 復 厲 聲 拍 案 一 問 猶 五 雷 振 頂 百 箭 入 心 恍 
X62n1194_001:0541b22	然心悚毛竪。汗淚齊流。似服柴胡多兩。表藥幾劑。積	然 心 悚 毛 竪 汗 淚 齊 流 似 服 柴 胡 多 兩 表 藥 幾 劑 積 
X62n1194_001:0541b23	年之磕睡始甦。多染。之雜症稍輕。如此終身鞭問。縱	年 之 磕 睡 始 甦 多 染 之 雜 症 稍 輕 如 此 終 身 鞭 問 縱 
X62n1194_001:0541b24	卉木以悲濠。慎獨痛思。即頑石而傷酸。須知無情尚	卉 木 以 悲 濠 慎 獨 痛 思 即 頑 石 而 傷 酸 須 知 無 情 尚 
X62n1194_001:0541c01	然。況有虗靈不昧者乎。是以生大惶怖。起大慚愧。經	然 況 有 虗 靈 不 昧 者 乎 是 以 生 大 惶 怖 起 大 慚 愧 經 
X62n1194_001:0541c02	云人身難得。猶芥子以投針鋒。佛法難遇。若盲龜而	云 人 身 難 得 猶 芥 子 以 投 針 鋒 佛 法 難 遇 若 盲 龜 而 
X62n1194_001:0541c03	值浮木。要知人身尚難。況佛法哉乎。我今既得人身。	值 浮 木 要 知 人 身 尚 難 況 佛 法 哉 乎 我 今 既 得 人 身 
X62n1194_001:0541c04	復霑僧品。而獲其具戒者。真正千生有幸。若不趂此	復 霑 僧 品 而 獲 其 具 戒 者 真 正 千 生 有 幸 若 不 趂 此 
X62n1194_001:0541c05	報身。早離苦海。求生樂國者。尚待何身。而再逃生耶。	報 身 早 離 苦 海 求 生 樂 國 者 尚 待 何 身 而 再 逃 生 耶 
X62n1194_001:0541c06	然而袈裟一失。萬劫難逢。況人命無常。呼吸難保。人	然 而 袈 裟 一 失 萬 劫 難 逢 況 人 命 無 常 呼 吸 難 保 人 
X62n1194_001:0541c07	間暫寄。地府恒居。余再以譬喻。而試問曰。假如世有	間 暫 寄 地 府 恒 居 余 再 以 譬 喻 而 試 問 曰 假 如 世 有 
X62n1194_001:0541c08	二人。皆難活命。一以犯其國法。赴市候斬。一以極患	二 人 皆 難 活 命 一 以 犯 其 國 法 赴 市 候 斬 一 以 極 患 
X62n1194_001:0541c09	篤疾。遭焰將煨。如是二人。心既未死。必想救赦。定欲	篤 疾 遭 焰 將 煨 如 是 二 人 心 既 未 死 必 想 救 赦 定 欲 
X62n1194_001:0541c10	逃生。設有嬌妻美妾。子女珍寶。及受用百饈之類。令	逃 生 設 有 嬌 妻 美 妾 子 女 珍 寶 及 受 用 百 饈 之 類 令 
X62n1194_001:0541c11	彼二人。隨意自欲者。彼還能心識顧戀否。答曰。彼因	彼 二 人 隨 意 自 欲 者 彼 還 能 心 識 顧 戀 否 答 曰 彼 因 
X62n1194_001:0541c12	命在頃刻。只存逃命之念。敢起顧欲之心耶。不顧自	命 在 頃 刻 只 存 逃 命 之 念 敢 起 顧 欲 之 心 耶 不 顧 自 
X62n1194_001:0541c13	命。而反癡戀者。盡世無有此人。設遇有者。乃真正該	命 而 反 癡 戀 者 盡 世 無 有 此 人 設 遇 有 者 乃 真 正 該 
X62n1194_001:0541c14	死之客。千佛難救。況爾我乎。噫。妙哉是譬也。是問是	死 之 客 千 佛 難 救 況 爾 我 乎 噫 妙 哉 是 譬 也 是 問 是 
X62n1194_001:0541c15	答也。須知我命尚難保。況貪幻物乎。光頭皮。亦復如	答 也 須 知 我 命 尚 難 保 況 貪 幻 物 乎 光 頭 皮 亦 復 如 
X62n1194_001:0541c16	是。未明大事。未免生死。未脫苦海。未登彼岸。不慇懃	是 未 明 大 事 未 免 生 死 未 脫 苦 海 未 登 彼 岸 不 慇 懃 
X62n1194_001:0541c17	念佛。顧自慧命。而反貪戀一切緣務欲樂者。亦真愚	念 佛 顧 自 慧 命 而 反 貪 戀 一 切 緣 務 欲 樂 者 亦 真 愚 
X62n1194_001:0541c18	癡。該死之至矣。故智者不然。當效彼二志。篤行淨業。	癡 該 死 之 至 矣 故 智 者 不 然 當 效 彼 二 志 篤 行 淨 業 
X62n1194_001:0541c19	死求脫離。如就刑戮之怖。若遭水火之逼。拚命念佛。	死 求 脫 離 如 就 刑 戮 之 怖 若 遭 水 火 之 逼 拚 命 念 佛 
X62n1194_001:0541c20	專圖逃生。安敢纖毫怠息。而更攀世緣。營雜務。圖體	專 圖 逃 生 安 敢 纖 毫 怠 息 而 更 攀 世 緣 營 雜 務 圖 體 
X62n1194_001:0541c21	面。稱能會哉乎。果然若是覺已。而篤實念佛者。吾許	面 稱 能 會 哉 乎 果 然 若 是 覺 已 而 篤 實 念 佛 者 吾 許 
X62n1194_001:0541c22	斯人。指日生西。立地面佛可也。故既做光頭。定要斷	斯 人 指 日 生 西 立 地 面 佛 可 也 故 既 做 光 頭 定 要 斷 
X62n1194_001:0541c23	世緣。絕財色。任他天女蟾娥。盡世珍寶。乃至王位。不	世 緣 絕 財 色 任 他 天 女 蟾 娥 盡 世 珍 寶 乃 至 王 位 不 
X62n1194_001:0541c24	以為奇。設遇特來試我。誘我者。吾皆心如鉄石。而應	以 為 奇 設 遇 特 來 試 我 誘 我 者 吾 皆 心 如 鉄 石 而 應 
X62n1194_001:0542a01	惡財如礫。惡色若蛆。非我沙門所宜。甯死不關心。顧	惡 財 如 礫 惡 色 若 蛆 非 我 沙 門 所 宜 甯 死 不 關 心 顧 
X62n1194_001:0542a02	自慧命。是言為光頭之第一關。緊要文憑也。生死皂	自 慧 命 是 言 為 光 頭 之 第 一 關 緊 要 文 憑 也 生 死 皂 
X62n1194_001:0542a03	白。誠在於斯。而亦不唯釋氏者。即儒家。亦宜守其分	白 誠 在 於 斯 而 亦 不 唯 釋 氏 者 即 儒 家 亦 宜 守 其 分 
X62n1194_001:0542a04	內。奚應貪乎分外。是知喪風敗節。輕身試法者。莫不	內 奚 應 貪 乎 分 外 是 知 喪 風 敗 節 輕 身 試 法 者 莫 不 
X62n1194_001:0542a05	由此財色兩字。將一生名節。付於坑廁矣。況我堂堂	由 此 財 色 兩 字 將 一 生 名 節 付 於 坑 廁 矣 況 我 堂 堂 
X62n1194_001:0542a06	僧相。具受佛戒。應聽佛語。當依佛制。咬牙切齒。甯死	僧 相 具 受 佛 戒 應 聽 佛 語 當 依 佛 制 咬 牙 切 齒 甯 死 
X62n1194_001:0542a07	莫違。或曰爾戒香。沙彌之小見。行菩薩道者。智充力	莫 違 或 曰 爾 戒 香 沙 彌 之 小 見 行菩薩道 者 智 充 力 
X62n1194_001:0542a08	足。法無礙處。曰。然。試問爾是菩薩否。若地獄出入。刀	足 法 無 礙 處 曰 然 試 問 爾 是 菩 薩 否 若 地 獄 出 入 刀 
X62n1194_001:0542a09	鎗劍戟。糞穢之中。以及水火為家。爾能無礙。無拘。無	鎗 劍 戟 糞 穢 之 中 以 及 水 火 為 家 爾 能 無 礙 無 拘 無 
X62n1194_001:0542a10	懼否。若然者。果如其言。設毫末有礙者。幸弗圖爽口。	懼 否 若 然 者 果 如 其 言 設 毫 末 有 礙 者 幸 弗 圖 爽 口 
X62n1194_001:0542a11	而甘墜深淵。要知爾我。是具縛凡夫。稍有一屑微恙。	而 甘 墜 深 淵 要 知 爾 我 是 具 縛 凡 夫 稍 有 一 屑 微 恙 
X62n1194_001:0542a12	尚難作主。況極苦難忍之千係乎。良以自入學。以至	尚 難 作 主 況 極 苦 難 忍 之 千 係 乎 良 以 自 入 學 以 至 
X62n1194_001:0542a13	宰。從沙彌。而至佛。莫不以初步而入。猶行程千里。開	宰 從 沙 彌 而 至 佛 莫 不 以 初 步 而 入 猶 行 程 千 里 開 
X62n1194_001:0542a14	步行錯。前途怎到。我戒香既已不孝。作其沙門者。應	步 行 錯 前 途 怎 到 我 戒 香 既 已 不 孝 作 其 沙 門 者 應 
X62n1194_001:0542a15	遵佛敕。應守佛戒。應依佛行。只三句。便名光頭題目。	遵 佛 敕 應 守 佛 戒 應 依 佛 行 只 三 句 便 名 光 頭 題 目 
X62n1194_001:0542a16	當識得清楚。防得緊實。讀得純熟。記得牢拷。然後做	當 識 得 清 楚 防 得 緊 實 讀 得 純 熟 記 得 牢 拷 然 後 做 
X62n1194_001:0542a17	文章。作詩賦。無不取中。否則。無可為名。所以急應。自	文 章 作 詩 賦 無 不 取 中 否 則 無 可 為 名 所 以 急 應 自 
X62n1194_001:0542a18	立志願。將順調逆。以逆轉順。生處作熟。熟處轉生。此	立 志 願 將 順 調 逆 以 逆 轉 順 生 處 作 熟 熟 處 轉 生 此 
X62n1194_001:0542a19	雖鄙見。不甚奇特。請靜味。善研試之。該有相應。若曰	雖 鄙 見 不 甚 奇 特 請 靜 味 善 研 試 之 該 有 相 應 若 曰 
X62n1194_001:0542a20	既專淨土。何苦嚕囌者。竟可斬盡葛藤。以老老實實。	既 專 淨 土 何 苦 嚕 囌 者 竟 可 斬 盡 葛 藤 以 老 老 實 實 
X62n1194_001:0542a21	念句阿彌陀佛到底。可也。宜盡此報身。一刻無間。切	念 句 阿 彌 陀 佛 到 底 可 也 宜 盡 此 報 身 一 刻 無 間 切 
X62n1194_001:0542a22	忌雜修。雜行。便從今日篤行起。乃至氣絕。終不更改	忌 雜 修 雜 行 便 從 今 日 篤 行 起 乃 至 氣 絕 終 不 更 改 
X62n1194_001:0542a23	微毫花樣。能如是力行。願切者。瓜香之日。定面彌陀。	微 毫 花 樣 能 如 是 力 行 願 切 者 瓜 香 之 日 定 面 彌 陀 
X62n1194_001:0542a24	蒂落之時。包生淨土。而亦勝與無始以來。之經生父	蒂 落 之 時 包 生 淨 土 而 亦 勝 與 無 始 以 來 之 經 生 父 
X62n1194_001:0542b01	母師長。及冤親債主等靈。為其作大佛事。修諸功德。	母 師 長 及 冤 親 債 主 等 靈 為 其 作 大 佛 事 修諸功德 
X62n1194_001:0542b02	以令高超淨界者也。故知念佛功德。不可思議。若論	以 令 高 超 淨 界 者 也 故 知 念 佛 功 德 不可思議 若 論 
X62n1194_001:0542b03	自利。利他之說。則盡十方諸佛。共口難窮者。以其阿	自 利 利 他 之 說 則 盡 十方諸佛 共 口 難 窮 者 以 其 阿 
X62n1194_001:0542b04	彌陀佛。因地中。所發六八弘願力故。所以無機不攝。	彌 陀 佛 因 地 中 所 發 六 八 弘 願 力 故 所 以 無 機 不 攝 
X62n1194_001:0542b05	無生不利也。行人以是。信得切。行得一。篤誠念句佛	無 生 不 利 也 行 人 以 是 信 得 切 行 得 一 篤 誠 念 句 佛 
X62n1194_001:0542b06	者。當知宿具大善根。大福德。大因緣。始能極信深行。	者 當 知 宿 具 大 善 根 大 福 德 大 因 緣 始 能 極 信 深 行 
X62n1194_001:0542b07	而不怠惑。否則。惑怠難免。是故既遇是利。譬嬰孩咬	而 不 怠 惑 否 則 惑 怠 難 免 是 故 既 遇 是 利 譬 嬰 孩 咬 
X62n1194_001:0542b08	乳。井兒攀藤。死不可放鬆。生死取舍。在於自己。甯勞	乳 井 兒 攀 藤 死 不 可 放 鬆 生 死 取 舍 在 於 自 己 甯 勞 
X62n1194_001:0542b09	他獲哉乎。苟如是志切。而始終如一者。吾敢說曰。稱	他 獲 哉 乎 苟 如 是 志 切 而 始 終 如 一 者 吾 敢 說 曰 稱 
X62n1194_001:0542b10	道人也可。和尚也可。方不愧於光頭皮。三字也矣。余	道 人 也 可 和 尚 也 可 方 不 愧 於 光 頭 皮 三 字 也 矣 余 
X62n1194_001:0542b11	纔濫僧次。愧無所知。而謬行至今。苦無覺察。縱初學	纔 濫 僧 次 愧 無 所 知 而 謬 行 至 今 苦 無 覺 察 縱 初 學 
X62n1194_001:0542b12	讀其佛者。全似啞漢喊婆。萬難相應。誠為可羞。可痛。	讀 其 佛 者 全 似 啞 漢 喊 婆 萬 難 相 應 誠 為 可 羞 可 痛 
X62n1194_001:0542b13	可悲。可恥。茲因夏日天長。課餘消遣。述以是問者。端	可 悲 可 恥 茲 因 夏 日 天 長 課 餘 消 遣 述 以 是 問 者 端 
X62n1194_001:0542b14	為自俻日究。益加鞭策終身。故不避文粗句俗。專顧	為 自 俻 日 究 益 加 鞭 策 終 身 故 不 避 文 粗 句 俗 專 顧 
X62n1194_001:0542b15	自問。自責哉矣。	自 問 自 責 哉 矣 
X62n1194_001:0542b16	　頭皮我既禿　　輕財斷愛欲　　節食而量衣	 頭 皮 我 既 禿 輕 財 斷 愛 欲 節 食 而 量 衣 
X62n1194_001:0542b17	　淡泊應知足　　梵行須嚴淨　　律儀弗殘缺	 淡 泊 應 知 足 梵 行 須 嚴 淨 律 儀 弗 殘 缺 
X62n1194_001:0542b18	　光陰似隙駒　　念佛要急速　　幻質非堅久	 光 陰 似 隙 駒 念 佛 要 急 速 幻 質 非 堅 久 
X62n1194_001:0542b19	　呼吸命難確　　倐然無常至　　死如龜剝殻	 呼 吸 命 難 確 倐 然 無 常 至 死 如 龜 剝 殻 
X62n1194_001:0542b20	　仔細想將來　　悚惶悽濠哭　　慎獨思將去	 仔 細 想 將 來 悚 惶 悽 濠 哭 慎 獨 思 將 去 
X62n1194_001:0542b21	　心肝裂熱血　　此身誠患苦　　戀甚牢坑樂	 心 肝 裂 熱 血 此 身 誠 患 苦 戀 甚 牢 坑 樂 
X62n1194_001:0542b22	　娑婆五濁間　　三惡道充足　　而多不善聚	 娑 婆 五 濁 間 三 惡 道 充 足 而 多 不 善 聚 
X62n1194_001:0542b23	　立願勿再托　　篤志求往生　　決意入彼國	 立 願 勿 再 托 篤 志 求 往 生 決 意 入 彼 國 
X62n1194_001:0542b24	　欲佛垂光迎　　精誠奉佛讀　　深信諸佛言	 欲 佛 垂 光 迎 精 誠 奉 佛 讀 深 信 諸 佛 言 
X62n1194_001:0542c01	　西方真安樂　　此地實危險　　刻刻防刑戮	 西 方 真 安 樂 此 地 實 危 險 刻 刻 防 刑 戮 
X62n1194_001:0542c02	　今生再不逃　　何身脫牢獄　　甯死入安養	 今 生 再 不 逃 何 身 脫 牢 獄 甯 死 入 安 養 
X62n1194_001:0542c03	　誓不餘方宿　　一心念彌陀　　執持弗怠惑	 誓 不 餘 方 宿 一 心 念 彌 陀 執 持 弗 怠 惑 
X62n1194_001:0542c04	　揮淚述斯問　　終身自鞭骨　　見聞若隨喜	 揮 淚 述 斯 問 終 身 自 鞭 骨 見 聞 若 隨 喜 
X62n1194_001:0542c05	　轉勸更多福	 轉 勸 更 多 福 
X62n1194_001:0542c06	三次掩關讀佛往生詞	三 次 掩 關 讀 佛 往 生 詞 
X62n1194_001:0542c07	一間草屋。六尺淨地。不莊嚴。卻也清緻。懸幅佛像。奉	一 間 草 屋 六 尺 淨 地 不 莊 嚴 卻 也 清 緻 懸 幅 佛 像 奉 
X62n1194_001:0542c08	尊阿彌。供花一朵。燈一盞。香一炷。石罄不敲。木魚不	尊 阿 彌 供 花 一 朵 燈 一 盞 香 一 炷 石 罄 不 敲 木 魚 不 
X62n1194_001:0542c09	擊。純一念。蒲團坐倚。露個頭皮。赤雙脚底。將破衲頭	擊 純 一 念 蒲 團 坐 倚 露 個 頭 皮 赤 雙 脚 底 將 破 衲 頭 
X62n1194_001:0542c10	日作衣。夜當被一筷。醃菜。兩碗薄糜。罷貪求。知足無	日 作 衣 夜 當 被 一 筷 醃 菜 兩 碗 薄 糜 罷 貪 求 知 足 無 
X62n1194_001:0542c11	慮。菴門常掩。關扉常閉。遇道人談。淨友會。塵客避。不	慮 菴 門 常 掩 關 扉 常 閉 遇 道 人 談 淨 友 會 塵 客 避 不 
X62n1194_001:0542c12	讀教典。不閱經偈。省眼力。似省閑非。蕩盡糟粕。無非	讀 教 典 不 閱 經 偈 省 眼 力 似 省 閑 非 蕩 盡 糟 粕 無 非 
X62n1194_001:0542c13	禪味。但棄卜度。棄妄想。棄亂意。既無榮辱。亦斷名利。	禪 味 但 棄 卜 度 棄 妄 想 棄 亂 意 既 無 榮 辱 亦 斷 名 利 
X62n1194_001:0542c14	舍體面。有何拘繫。愧無能為。學讀阿彌。誓靜不廢。躁	舍 體 面 有 何 拘 繫 愧 無 能 為 學 讀 阿 彌 誓 靜 不 廢 躁 
