X64n1262_001:0440a13	○聰明見聞不惑。故曰聰明。	 聰 明 見 聞 不 惑 故 曰 聰 明 
X64n1262_001:0440a14	石門聰襄州谷隱山石門寺。蘊聰禪師。嗣首山念	石 門 聰 襄 州 谷 隱 山 石 門 寺 蘊 聰 禪 師 嗣 首 山 念 
X64n1262_001:0440a15	禪師。南嶽下九世。得法後住石門日。襄州太守。以	禪 師 南 嶽 下 九 世 得 法 後 住 石 門 日 襄 州 太 守 以 
X64n1262_001:0440a16	私意笞辱。既歸。眾僧迎於道側。首座趣前問訊曰。	私 意 笞 辱 既 歸 眾 僧 迎 於 道 側 首 座 趣 前 問 訊 曰 
X64n1262_001:0440a17	太守無辜曲辱和尚。師以手指地云。平地起骨堆。	太 守 無 辜 曲 辱 和 尚 師 以 手 指 地 云 平 地 起 骨 堆 
X64n1262_001:0440a18	隨手湧一骨堆。太守聞知。令人削去。復湧如初。太	隨 手 湧 一 骨 堆 太 守 聞 知 令 人 削 去 復 湧 如 初 太 
X64n1262_001:0440a19	守全家死於襄州也。	守 全 家 死 於 襄 州 也 
X64n1262_001:0440a20	棲賢舜南康軍雲居曉舜禪師。字老夫。嗣洞山聰。	棲 賢 舜 南 康 軍 雲 居 曉 舜 禪 師 字 老 夫 嗣 洞 山 聰 
X64n1262_001:0440a21	瑞州胡氏子。清源下十世。住廬山棲賢日。槐都官	瑞 州 胡 氏 子 清 源 下 十 世 住 廬 山 棲 賢 日 槐 都 官 
X64n1262_001:0440a22	守南康。多貪墨蹟。舜不忍以常住物。結情固位。被	守 南 康 多 貪 墨 蹟 舜 不 忍 以 常 住 物 結 情 固 位 被 
X64n1262_001:0440a23	人譖於郡守問還俗。民其衣。大覺昔曾入舜之室。	人 譖 於 郡 守 問 還 俗 民 其 衣 大 覺 昔 曾 入 舜 之 室 
X64n1262_001:0440a24	故往京都訪大覺。讓舜正寢。璉居偏室。仁宗數詔	故 往 京 都 訪 大 覺 讓 舜 正 寢 璉 居 偏 室 仁 宗 數 詔 
X64n1262_001:0440b01	入內問道。竟不言舜事。偶一日。聖旨勑淨慈飯僧。	入 內 問 道 竟 不 言 舜 事 偶 一 日 聖 旨 勑 淨 慈 飯 僧 
X64n1262_001:0440b02	見大覺侍舜甚恭。歸奏。帝召見之。乃嘆曰。道韻奇	見 大 覺 侍 舜 甚 恭 歸 奏 帝 召 見 之 乃 嘆 曰 道 韻 奇 
X64n1262_001:0440b03	偉。真山林達士。遂於扇書曰。賜曉舜依舊為僧。再	偉 真 山 林 達 士 遂 於 扇 書 曰 賜 曉 舜 依 舊 為 僧 再 
X64n1262_001:0440b04	住棲賢。仍賜紫衣銀鉢。舜罷棲賢日。有二壯力。舁	住 棲 賢 仍 賜 紫 衣 銀 鉢 舜 罷 棲 賢 日 有 二 壯 力 舁 
X64n1262_001:0440b05	轎至羅漢寺前。二人相謂曰。今不是我院長老。不	轎 至 羅 漢 寺 前 二 人 相 謂 曰 今 不 是 我 院 長 老 不 
X64n1262_001:0440b06	須遠送。棄轎而回。舜既再來。令人安撫曰。你當時	須 遠 送 棄 轎 而 回 舜 既 再 來 令 人 安 撫 曰 你 當 時 
X64n1262_001:0440b07	做得是。但安心不必疑懼。入院上堂曰。無端被譖	做 得 是 但 安 心 不 必 疑 懼 入 院 上 堂 曰 無 端 被 譖 
X64n1262_001:0440b08	枉遭迍。半年有餘作俗人。今日再歸三峽寺。幾多	枉 遭 迍 半 年 有 餘 作 俗 人 今 日 再 歸 三 峽 寺 幾 多 
X64n1262_001:0440b09	歡喜幾多嗔。	歡 喜 幾 多 嗔 
X64n1262_001:0440b10	歟疑辭。謙退而不敢質言。而言歟也。	歟 疑 辭 謙 退 而 不 敢 質 言 而 言 歟 也 
X64n1262_001:0440b11	隱微上幽暗也。下細事也。謂事之首不足慮。禍隱	隱 微 上 幽 暗 也 下 細 事 也 謂 事 之 首 不 足 慮 禍 隱 
X64n1262_001:0440b12	微深可憂也。葢著者。人所易見。故得為之。隱者。人	微 深 可 憂 也 葢 著 者 人 所 易 見 故 得 為 之 隱 者 人 
X64n1262_001:0440b13	所難知。故當謹而不可忽也。	所 難 知 故 當 謹 而 不 可 忽 也 
X64n1262_001:0440b14	尤甚也。○罹非理而遭痛毒也。	尤 甚 也 罹 非 理 而 遭 痛 毒 也 
X64n1262_001:0440b15	橫逆強暴不順理也。文出孟子離婁章。	橫 逆 強 暴 不 順 理 也 文 出 孟 子 離 婁 章 
X64n1262_001:0440b16	民衣老夫還俗。服民之衣也。	民 衣 老 夫 還 俗 服 民 之 衣 也 
X64n1262_001:0440b17	疇往昔之事也。	疇 往 昔 之 事 也 
X64n1262_001:0440b18	輦天子之車也。有輪曰輦。無輪曰輿。	輦 天 子 之 車 也 有 輪 曰 輦 無 輪 曰 輿 
X64n1262_001:0440b19	○賦稟也。均表敷布曰賦。謂天之所賦性於人。均	 賦 稟 也 均 表 敷 布 曰 賦 謂 天 之 所 賦 性 於 人 均 
X64n1262_001:0440b20	而無偏也。	而 無 偏 也 
X64n1262_001:0440b21	權衡上秤鎚也。下秤杆也。	權 衡 上 秤 鎚 也 下 秤 杆 也 
X64n1262_001:0440b22	貨以財變物曰貨。	貨 以 財 變 物 曰 貨 
X64n1262_001:0440b23	殖積聚財寶曰殖。又貨之所宜曰殖。	殖 積 聚 財 寶 曰 殖 又 貨 之 所 宜 曰 殖 
X64n1262_001:0440b24	一日不作百丈寺。在南嶽之絕頂也。大智禪師。每	一 日 不 作 百 丈 寺 在 南 嶽 之 絕 頂 也 大 智 禪 師 每 
X64n1262_001:0440c01	日力作以償其供。有勸止者。則曰我無德以勞人。	日 力 作 以 償 其 供 有 勸 止 者 則 曰 我 無 德 以 勞 人 
X64n1262_001:0440c02	眾不忍而藏其作具。徧索不得。遂不食。故有一日	眾 不 忍 而 藏 其 作 具 徧 索 不 得 遂 不 食 故 有 一 日 
X64n1262_001:0440c03	不作一日不食之語。流播寰宇。先德率身多如此	不 作 一 日 不 食 之 語 流 播 寰 宇 先 德 率 身 多 如 此 
X64n1262_001:0440c04	矣。	矣 
X64n1262_001:0440c05	垂將也。涉歷也。	垂 將 也 涉 歷 也 
X64n1262_001:0440c06	○傳持代代相承曰傳。拳拳執守曰持。	 傳 持 代 代 相 承 曰 傳 拳 拳 執 守 曰 持 
X64n1262_001:0440c07	操守志不改曰操。履踐行不怠曰履。	操 守 志 不 改 曰 操 履 踐 行 不 怠 曰 履 
X64n1262_001:0440c08	住持安住道德。執持教化。令法久住故也。又住於	住 持 安 住 道 德 執 持 教 化 令 法 久 住 故 也 又 住 於 
X64n1262_001:0440c09	真理。持而不失。	真 理 持 而 不 失 
X64n1262_001:0440c10	衒彰賣也。渝變也。	衒 彰 賣 也 渝 變 也 
X64n1262_001:0440c11	夷險上坦而平也。下峻而不平也。	夷 險 上 坦 而 平 也 下 峻 而 不 平 也 
X64n1262_001:0440c12	致理也。	致 理 也 
X64n1262_001:0440c13	○遠錄公舒州浮山法遠圓鑑禪師。鄭州王氏子。	 遠 錄 公 舒 州 浮 山 法 遠 圓 鑑 禪 師 鄭 州 王 氏 子 
X64n1262_001:0440c14	嗣葉縣省禪師。遠甞與達觀頴。薛大頭。七八輩遊	嗣 葉 縣 省 禪 師 遠 甞 與 達 觀 頴 薛 大 頭 七 八 輩 遊 
X64n1262_001:0440c15	蜀。幾次遭迍。師以智脫之。眾以曉吏事。故稱遠公	蜀 幾 次 遭 迍 師 以 智 脫 之 眾 以 曉 吏 事 故 稱 遠 公 
X64n1262_001:0440c16	也。	也 
X64n1262_001:0440c17	益堅乃馬援之言也。不墜青雲之志。	益 堅 乃 馬 援 之 言 也 不 墜 青 雲 之 志 
X64n1262_001:0440c18	益壯寧識白首之心。	益 壯 寧 識 白 首 之 心 
X64n1262_001:0440c19	苟竊不正之貌。苟容取安也。	苟 竊 不 正 之 貌 苟 容 取 安 也 
X64n1262_001:0440c20	志心之所之曰志。謹守而不逐物也。	志 心 之 所 之 曰 志 謹 守 而 不 逐 物 也 
X64n1262_001:0440c21	質本色也。表耐也。	質 本 色 也 表 耐 也 
X64n1262_001:0440c22	節義有節操而所行。合乎義理也。	節 義 有 節 操 而 所 行 合 乎 義 理 也 
X64n1262_001:0440c23	標致標。舉也。言其超卓傑立之極也。	標 致 標 舉 也 言 其 超 卓 傑 立 之 極 也 
X64n1262_001:0440c24	自強易云。君子之道。終日乾乾。而自強不息也。	自 強 易 云 君 子 之 道 終 日 乾 乾 而 自 強 不 息 也 
X64n1262_001:0441a01	逸翮上縱也。下羽勁也。	逸 翮 上 縱 也 下 羽 勁 也 
X64n1262_001:0441a02	○陸沉言無水而沉也。當顯而反隱。陸沉於眾。不	 陸 沉 言 無 水 而 沉 也 當 顯 而 反 隱 陸 沉 於 眾 不 
X64n1262_001:0441a03	願人知也。	願 人 知 也 
X64n1262_001:0441a04	葉縣省汝州葉縣廣教院。歸省禪師。冀州賈氏子。	葉 縣 省 汝 州 葉 縣 廣 教 院 歸 省 禪 師 冀 州 賈 氏 子 
X64n1262_001:0441a05	嗣首山念禪師。南嶽下九世。其住持枯淡嚴密。衲	嗣 首 山 念 禪 師 南 嶽 下 九 世 其 住 持 枯 淡 嚴 密 衲 
X64n1262_001:0441a06	子畏之。浮山遠。天衣懷。聞其高風。特往參叩。正值	子 畏 之 浮 山 遠 天 衣 懷 聞 其 高 風 特 往 參 叩 正 值 
X64n1262_001:0441a07	雪寒。省喝罵驅逐。至以將水潑地。衣服皆濕。他僧	雪 寒 省 喝 罵 驅 逐 至 以 將 水 潑 地 衣 服 皆 濕 他 僧 
X64n1262_001:0441a08	怒去。唯遠與懷。整衣數具。復坐如故。師到呵曰。你	怒 去 唯 遠 與 懷 整 衣 數 具 復 坐 如 故 師 到 呵 曰 你 
X64n1262_001:0441a09	更不去。待我打你。遠。近前云。某二人數千里。特來	更 不 去 待 我 打 你 遠 近 前 云 某 二 人 數 千 里 特 來 
X64n1262_001:0441a10	參和尚禪。豈以一杓水潑之便去。師笑曰。你兩個	參 和 尚 禪 豈 以 一 杓 水 潑 之 便 去 師 笑 曰 你 兩 個 
X64n1262_001:0441a11	果來要參禪。却去掛搭。遠充典座。眾苦其枯淡。省	果 來 要 參 禪 却 去 掛 搭 遠 充 典 座 眾 苦 其 枯 淡 省 
X64n1262_001:0441a12	偶出庄去。遠竊取鑰匙取油麵。作五味粥方熟。師	偶 出 庄 去 遠 竊 取 鑰 匙 取 油 麵 作 五 味 粥 方 熟 師 
X64n1262_001:0441a13	忽歸。粥罷詣典作。遠至。師云。汝竊取油麵。係盜用	忽 歸 粥 罷 詣 典 作 遠 至 師 云 汝 竊 取 油 麵 係 盜 用 
X64n1262_001:0441a14	常住。遠云。實取油麵。願乞責罰。師令筭估衣鉢還	常 住 遠 云 實 取 油 麵 願 乞 責 罰 師 令 筭 估 衣 鉢 還 
X64n1262_001:0441a15	訖。更打三十拄杖赶出院。道友勸勉師不允。友曰。	訖 更 打 三 十 拄 杖 赶 出 院 道 友 勸 勉 師 不 允 友 曰 
X64n1262_001:0441a16	若不容歸。只乞隨眾聽法。師亦不許。師一日出街。	若 不 容 歸 只 乞 隨 眾 聽 法 師 亦 不 許 師 一 日 出 街 
X64n1262_001:0441a17	見遠旅邸前立。師曰。此是院門房廊。你在此許久。	見 遠 旅 邸 前 立 師 曰 此 是 院 門 房 廊 你 在 此 許 久 
X64n1262_001:0441a18	曾還店錢否。令筭所欠追取。遠無難色。持鉢於市	曾 還 店 錢 否 令 筭 所 欠 追 取 遠 無 難 色 持 鉢 於 市 
X64n1262_001:0441a19	化還之。師一日出街。見遠持鉢。歸謂眾曰。遠真意	化 還 之 師 一 日 出 街 見 遠 持 鉢 歸 謂 眾 曰 遠 真 意 
X64n1262_001:0441a20	參禪。遂令歸。上堂對眾付衣法嗣。	參 禪 遂 令 歸 上 堂 對 眾 付 衣 法 嗣 
X64n1262_001:0441a21	依違謀善者從之。不善者違之。亦何有所定平。出	依 違 謀 善 者 從 之 不 善 者 違 之 亦 何 有 所 定 平 出 
X64n1262_001:0441a22	小雅也。	小 雅 也 
X64n1262_001:0441a23	姑息苟容取安。出禮記。	姑 息 苟 容 取 安 出 禮 記 
X64n1262_001:0441a24	○暴音曝。日晒也。○刻剝削害於人也。	 暴 音 曝 日 晒 也 刻 剝 削 害 於 人 也 
X64n1262_001:0441b01	中外中則徒屬。外則四眾。	中 外 中 則 徒 屬 外 則 四 眾 
X64n1262_001:0441b02	洽恩澤周徧曰洽。哀敢怒而不敢言。	洽 恩 澤 周 徧 曰 洽 哀 敢 怒 而 不 敢 言 
X64n1262_001:0441b03	○三要宋仁宗。司馬光諫曰仁明勇。註曰。仁者。純	 三 要 宋 仁 宗 司 馬 光 諫 曰 仁 明 勇 註 曰 仁 者 純 
X64n1262_001:0441b04	乎天理。斷絕眾惡。無一毫私欲也。明者。燭物理。辯	乎 天 理 斷 絕 眾 惡 無 一 毫 私 欲 也 明 者 燭 物 理 辯 
X64n1262_001:0441b05	是非。無一息之疑惑也。勇者。見義必為。聞善必遷。	是 非 無 一 息 之 疑 惑 也 勇 者 見 義 必 為 聞 善 必 遷 
X64n1262_001:0441b06	無一之退怯也。	無 一 之 退 怯 也 
X64n1262_001:0441b07	教化以道誨人曰教。躬行於上。風動於下曰化。	教 化 以 道 誨 人 曰 教 躬 行 於 上 風 動 於 下 曰 化 
X64n1262_001:0441b08	侫才辨論曲謂也。耘鋤也。	侫 才 辨 論 曲 謂 也 耘 鋤 也 
X64n1262_001:0441b09	刈割也。	刈 割 也 
X64n1262_001:0441b10	○智愚賢不肖稟清和之氣。才識明敏曰智。稟滓	 智 愚 賢 不 肖 稟 清 和 之 氣 才 識 明 敏 曰 智 稟 滓 
X64n1262_001:0441b11	濁駁雜之氣。頑蠢無知曰愚。稟得天地至和之氣。	濁 駁 雜 之 氣 頑 蠢 無 知 曰 愚 稟 得 天 地 至 和 之 氣 
X64n1262_001:0441b12	慈儉溫良曰賢。稟陰陽謬亂之氣。凶險奸邪曰不	慈 儉 溫 良 曰 賢 稟 陰 陽 謬 亂 之 氣 凶 險 奸 邪 曰 不 
X64n1262_001:0441b13	肖。如明暗相傾。薰蕕不並。決然之理矣。	肖 如 明 暗 相 傾 薰 蕕 不 並 決 然 之 理 矣 
X64n1262_001:0441b14	詐侫詐侫者。與君子不似也。謂發言宛同聖賢。行	詐 侫 詐 侫 者 與 君 子 不 似 也 謂 發 言 宛 同 聖 賢 行 
X64n1262_001:0441b15	事不如常人。	事 不 如 常 人 
X64n1262_001:0441b16	素分命稟於有生之前。而清濁已定。故有智愚之	素 分 命 稟 於 有 生 之 前 而 清 濁 已 定 故 有 智 愚 之 
X64n1262_001:0441b17	分也。	分 也 
X64n1262_001:0441b18	醇懿一色成體曰醇。溫柔克聖曰懿。	醇 懿 一 色 成 體 曰 醇 溫 柔 克 聖 曰 懿 
X64n1262_001:0441b19	嗜慾上貪也。下情之所好慾也。	嗜 慾 上 貪 也 下 情 之 所 好 慾 也 
X64n1262_001:0441b20	綱紀總繩曰綱。眾目曰紀。網賴綱紀。君賴股肱。乃	綱 紀 總 繩 曰 綱 眾 目 曰 紀 網 賴 綱 紀 君 賴 股 肱 乃 
X64n1262_001:0441b21	規範之大者也。	規 範 之 大 者 也 
X64n1262_001:0441b22	優劣上勝也。下衰弱也。	優 劣 上 勝 也 下 衰 弱 也 
X64n1262_001:0441b23	烏何也。	烏 何 也 
X64n1262_001:0441b24	○從容上七恭切。含緩而不迫也。	 從 容 上 七 恭 切 含 緩 而 不 迫 也 
X64n1262_001:0441c01	雍肅和敬也。	雍 肅 和 敬 也 
X64n1262_001:0441c02	○道悟真潭州道悟寺可真禪師。嗣石霜圓禪師。	 道 悟 真 潭 州 道 悟 寺 可 真 禪 師 嗣 石 霜 圓 禪 師 
X64n1262_001:0441c03	南嶽十世。	南 嶽 十 世 
X64n1262_001:0441c04	馳騁自誇也。	馳 騁 自 誇 也 
X64n1262_001:0441c05	丹雘彩色之總名。山海經云。雞足山下多丹雘。說	丹 雘 彩 色 之 總 名 山 海 經 云 雞 足 山 下 多 丹 雘 說 
X64n1262_001:0441c06	文云。雘。美也。	文 云 雘 美 也 
X64n1262_001:0441c07	○五祖演蘄州五祖法演禪師。綿州鄧氏子。嗣白	 五 祖 演 蘄 州 五 祖 法 演 禪 師 綿 州 鄧 氏 子 嗣 白 
X64n1262_001:0441c08	雲端禪師。南嶽下十三世。	雲 端 禪 師 南 嶽 下 十 三 世 
X64n1262_001:0441c09	心為下心者。神明之府。虗靈洞徹。以具眾理而應	心 為 下 心 者 神 明 之 府 虗 靈 洞 徹 以 具 眾 理 而 應 
X64n1262_001:0441c10	萬事者也。謂百千三昧。無量法門。莫不皆由一心	萬 事 者 也 謂 百 千 三 昧 無 量 法 門 莫 不 皆 由 一 心 
X64n1262_001:0441c11	而建立也。	而 建 立 也 
X64n1262_001:0441c12	敬和悅也。莊端嚴也。	敬 和 悅 也 莊 端 嚴 也 
X64n1262_001:0441c13	神靈也。陰陽不測之謂神。又陽之精也。	神 靈 也 陰 陽 不 測 之 謂 神 又 陽 之 精 也 
X64n1262_001:0441c14	○士有德之稱。	 士 有 德 之 稱 
X64n1262_001:0441c15	諦當審實曰諦。中正曰當。	諦 當 審 實 曰 諦 中 正 曰 當 
X64n1262_001:0441c16	聞去聲。聲著於外曰聞。	聞 去 聲 聲 著 於 外 曰 聞 
X64n1262_001:0441c17	利養財之所欲曰利。利之所樂曰養。	利 養 財 之 所 欲 曰 利 利 之 所 樂 曰 養 
X64n1262_001:0441c18	把茅出世為人而結菴。乃草菴也。	把 茅 出 世 為 人 而 結 菴 乃 草 菴 也 
X64n1262_001:0441c19	勉加力行之也。	勉 加 力 行 之 也 
X64n1262_001:0441c20	○楊岐遠州楊岐山方會禪師。宜春冷氏之子。嗣	 楊 岐 遠 州 楊 岐 山 方 會 禪 師 宜 春 冷 氏 之 子 嗣 
X64n1262_001:0441c21	慈明圓禪師。南嶽十世。	慈 明 圓 禪 師 南 嶽 十 世 
X64n1262_001:0441c22	僅將也。莫與暮同。季冬也。	僅 將 也 莫 與 暮 同 季 冬 也 
X64n1262_001:0441c23	霰雨雪雜下。	霰 雨 雪 雜 下 
X64n1262_001:0441c24	遑不急之貌。謂雖有雪霰。不以寒苦動其心。	遑 不 急 之 貌 謂 雖 有 雪 霰 不 以 寒 苦 動 其 心 
X64n1262_001:0442a01	詎豈也。	詎 豈 也 
X64n1262_001:0442a02	事豐屋事。好也。宋李靖公名沆。為丞相。自奉甚薄。	事 豐 屋 事 好 也 宋 李 靖 公 名 沆 為 丞 相 自 奉 甚 薄 
X64n1262_001:0442a03	所居陋巷。廳事無重門。家人勸修之。沆曰。身食厚	所 居 陋 巷 廳 事 無 重 門 家 人 勸 修 之 沆 曰 身 食 厚 
X64n1262_001:0442a04	祿。安榮如意。人生朝暮不保。奚用功夫。事豐屋也。	祿 安 榮 如 意 人 生 朝 暮 不 保 奚 用 功 夫 事 豐 屋 也 
X64n1262_001:0442a05	翌明日也。	翌 明 日 也 
X64n1262_001:0442a06	樹下居佛戒弟子日中一食。樹下一宿。修身以避	樹 下 居 佛 戒 弟 子 日 中 一 食 樹 下 一 宿 修 身 以 避 
X64n1262_001:0442a07	名。臨大節而不可奪。	名 臨 大 節 而 不 可 奪 
X64n1262_001:0442a08	○心城謂其中有正覺法王。萬德所聚。故曰心城。	 心 城 謂 其 中 有 正 覺 法 王 萬 德 所 聚 故 曰 心 城 
X64n1262_001:0442a09	使宼不侵奪。境緣不搖動。方可進道。	使 宼 不 侵 奪 境 緣 不 搖 動 方 可 進 道 
X64n1262_001:0442a10	越思越。過也。學而不思則罔。思而不學則殆。	越 思 越 過 也 學 而 不 思 則 罔 思 而 不 學 則 殆 
X64n1262_001:0442a11	○陶鑄範土曰陶。鎔金曰鑄。	 陶 鑄 範 土 曰 陶 鎔 金 曰 鑄 
X64n1262_001:0442a12	革改也。	革 改 也 
X64n1262_001:0442a13	○病憂也。聖人云。不患人之不己知。患不知人也。	 病 憂 也 聖 人 云 不 患 人 之 不 己 知 患 不 知 人 也 
X64n1262_001:0442a14	聽言觀行始我觀聽於人也。謂聽其所說。以為有	聽 言 觀 行 始 我 觀 聽 於 人 也 謂 聽 其 所 說 以 為 有 
X64n1262_001:0442a15	德。但恐其能言而不能行。必欲觀其所行之行也。	德 但 恐 其 能 言 而 不 能 行 必 欲 觀 其 所 行 之 行 也 
X64n1262_001:0442a16	南嶽讓衡州南嶽懷讓禪師。金州杜氏子。嗣六祖	南 嶽 讓 衡 州 南 嶽 懷 讓 禪 師 金 州 杜 氏 子 嗣 六 祖 
X64n1262_001:0442a17	大鑑禪師。	大 鑑 禪 師 
X64n1262_001:0442a18	大鑑六祖惠能大鑑禪師。范陽人。即涿州也。盧氏	大 鑑 六 祖 惠 能 大 鑑 禪 師 范 陽 人 即 涿 州 也 盧 氏 
X64n1262_001:0442a19	子。先父遷於嶺南新州住。後生能。嗣五祖弘忍大	子 先 父 遷 於 嶺 南 新 州 住 後 生 能 嗣 五 祖 弘 忍 大 
X64n1262_001:0442a20	師也。	師 也 
X64n1262_001:0442a21	馬祖江西馬祖道一禪師。漢州什邡縣馬氏子。嗣	馬 祖 江 西 馬 祖 道 一 禪 師 漢 州 什 邡 縣 馬 氏 子 嗣 
X64n1262_001:0442a22	南嶽讓禪師。依羅漢寺出家。容貌奇異。牛行虎視。	南 嶽 讓 禪 師 依 羅 漢 寺 出 家 容 貌 奇 異 牛 行 虎 視 
X64n1262_001:0442a23	引舌過鼻。足下有二輪。乃唐德宗時人也。	引 舌 過 鼻 足 下 有 二 輪 乃 唐 德 宗 時 人 也 
X64n1262_001:0442a24	固非下道高于師。方堪傳授。見于師齊。減師半德	固 非 下 道 高 于 師 方 堪 傳 授 見 于 師 齊 減 師 半 德 
X64n1262_001:0442b01	也。	也 
X64n1262_001:0442b02	洪規大法也。謂權衡佛祖。模範人天。非細事也。	洪 規 大 法 也 謂 權 衡 佛 祖 模 範 人 天 非 細 事 也 
X64n1262_001:0442b03	當家種草當家者。選有德之子。克紹家業。使祖風	當 家 種 草 當 家 者 選 有 德 之 子 克 紹 家 業 使 祖 風 
X64n1262_001:0442b04	之不遺墜也。種草者。如農家種田。相地厚薄而投	之 不 遺 墜 也 種 草 者 如 農 家 種 田 相 地 厚 薄 而 投 
X64n1262_001:0442b05	子也。	子 也 
X64n1262_001:0442b06	巧言令色令。猶善也。言乃心之聲。出於口。當出而	巧 言 令 色 令 猶 善 也 言 乃 心 之 聲 出 於 口 當 出 而 
X64n1262_001:0442b07	出。色。心之發。見於面。當見而見。則天理存於內	出 色 心 之 發 見 於 面 當 見 而 見 則 天 理 存 於 內 
X64n1262_001:0442b08	矣。或出諸於外。巧言如簧。甘言若醴。象恭其容。色	矣 或 出 諸 於 外 巧 言 如 簧 甘 言 若 醴 象 恭 其 容 色 
X64n1262_001:0442b09	莊其貌。務以悅人之聽觀。而本心之德全忘矣。	莊 其 貌 務 以 悅 人 之 聽 觀 而 本 心 之 德 全 忘 矣 
X64n1262_001:0442b10	便僻外習威儀。舉止輕揚。而內無實德也。	便 僻 外 習 威 儀 舉 止 輕 揚 而 內 無 實 德 也 
X64n1262_001:0442b11	謟屈己侫求。曰謟。媚親順取悅於人也。	謟 屈 己 侫 求 曰 謟 媚 親 順 取 悅 於 人 也 
X64n1262_001:0442b12	○柄權也。	 柄 權 也 
X64n1262_001:0442b13	惠以恩及人曰惠。愛施者。仁之端。	惠 以 恩 及 人 曰 惠 愛 施 者 仁 之 端 
X64n1262_001:0442b14	德以敬修身曰德。修身者。智之府。	德 以 敬 修 身 曰 德 修 身 者 智 之 府 
X64n1262_001:0442b15	敷施也。適當也。用也。	敷 施 也 適 當 也 用 也 
X64n1262_001:0442b16	養保守也。宣布散也。	養 保 守 也 宣 布 散 也 
X64n1262_001:0442b17	蓄養也。積也。孰誰也。	蓄 養 也 積 也 孰 誰 也 
X64n1262_001:0442b18	○省覲省察也。秋後見曰覲。如朝廷。須為朝覲。乃	 省 覲 省 察 也 秋 後 見 曰 覲 如 朝 廷 須 為 朝 覲 乃 
X64n1262_001:0442b19	會合省察一年之事。	會 合 省 察 一 年 之 事 
X64n1262_001:0442b20	籌慮方思後對。而不敢便答。	籌 慮 方 思 後 對 而 不 敢 便 答 
X64n1262_001:0442b21	正色有威而不猛。嚴而厲恭。雖曰怒。而不失其正	正 色 有 威 而 不 猛 嚴 而 厲 恭 雖 曰 怒 而 不 失 其 正 
X64n1262_001:0442b22	也。	也 
X64n1262_001:0442b23	細務急先務心。君子務本。	細 務 急 先 務 心 君 子 務 本 
X64n1262_001:0442b24	慈明潭州石霜慈明楚圓禪師。金州李氏子。嗣汾	慈 明 潭 州 石 霜 慈 明 楚 圓 禪 師 金 州 李 氏 子 嗣 汾 
X64n1262_001:0442c01	陽善昭禪師。南嶽下九世也。	陽 善 昭 禪 師 南 嶽 下 九 世 也 
X64n1262_001:0442c02	機辯機如掣電。辯似懸河。	機 辯 機 如 掣 電 辯 似 懸 河 
X64n1262_001:0442c03	弟子學於師後曰弟。智從師生曰子。	弟 子 學 於 師 後 曰 弟 智 從 師 生 曰 子 
X64n1262_001:0442c04	應對有呼則應。有問則對。	應 對 有 呼 則 應 有 問 則 對 
X64n1262_001:0442c05	含緩忍而不敢言曰含。從容而不急曰緩。	含 緩 忍 而 不 敢 言 曰 含 從 容 而 不 急 曰 緩 
X64n1262_001:0442c06	○猥屑不可言其所為謂之惡也。猥。鄙也。屑。苟也。	 猥 屑 不 可 言 其 所 為 謂 之 惡 也 猥 鄙 也 屑 苟 也 
X64n1262_001:0442c07	愈加下施不測之恩也。	愈 加 下 施 不 測 之 恩 也 
X64n1262_001:0442c08	○己過孟子曰。子路人告之有過則喜。喜其得聞	 己 過 孟 子 曰 子 路 人 告 之 有 過 則 喜 喜 其 得 聞 
X64n1262_001:0442c09	改之。其勇於自修如此。程子曰。子路人告之有過	改 之 其 勇 於 自 修 如 此 程 子 曰 子 路 人 告 之 有 過 
X64n1262_001:0442c10	則喜。可謂百世之師也。	則 喜 可 謂 百 世 之 師 也 
X64n1262_001:0442c11	喜善禹王聞善言則拜。葢不待有過。而屈己以受	喜 善 禹 王 聞 善 言 則 拜 葢 不 待 有 過 而 屈 己 以 受 
X64n1262_001:0442c12	天下之善也。	天 下 之 善 也 
X64n1262_001:0442c13	包荒易經泰卦。君子處泰之道。必有包荒之量。其	包 荒 易 經 泰 卦 君 子 處 泰 之 道 必 有 包 荒 之 量 其 
X64n1262_001:0442c14	施為寬裕詳密也。又量寬容眾。德廣安居也。	施 為 寬 裕 詳 密 也 又 量 寬 容 眾 德 廣 安 居 也 
X64n1262_001:0442c15	碩廣也。大也。○啻止也。	碩 廣 也 大 也 啻 止 也 
X64n1262_001:0442c16	○郭功輔提刑郭正祥。字功輔。號淨空居士。問道	 郭 功 輔 提 刑 郭 正 祥 字 功 輔 號 淨 空 居 士 問 道 
X64n1262_001:0442c17	於白雲端。	於 白 雲 端 
X64n1262_001:0442c18	造物儒言天命。釋言定業也。	造 物 儒 言 天 命 釋 言 定 業 也 
X64n1262_001:0442c19	○絕江直渡也。	 絕 江 直 渡 也 
X64n1262_001:0442c20	訪白雲郭功輔。乃現宰官身而作佛事。可謂在欲	訪 白 雲 郭 功 輔 乃 現 宰 官 身 而 作 佛 事 可 謂 在 欲 
X64n1262_001:0442c21	而無欲。居塵不染塵。亦是他宿植德本。有大因緣。	而 無 欲 居 塵 不 染 塵 亦 是 他 宿 植 德 本 有 大 因 緣 
X64n1262_001:0442c22	故致根塵脫繫。一念無依。到此橋斷路窮。不免求	故 致 根 塵 脫 繫 一 念 無 依 到 此 橋 斷 路 窮 不 免 求 
X64n1262_001:0442c23	人指示。故訪白雲於海會。白具通方正眼。運匠石	人 指 示 故 訪 白 雲 於 海 會 白 具 通 方 正 眼 運 匠 石 
X64n1262_001:0442c24	之功。施無礙之辯。便問公牛淳乎。以公曾經大冶	之 功 施 無 礙 之 辯 便 問 公 牛 淳 乎 以 公 曾 經 大 冶 
