X64n1262_001:0445c01	隆窪謂天下之道。以適中為貴。過與不及。俱不可	隆 窪 謂 天 下 之 道 以 適 中 為 貴 過 與 不 及 俱 不 可 
X64n1262_001:0445c02	也。下之平之。欲其損有餘而益不足。務合中道也。	也 下 之 平 之 欲 其 損 有 餘 而 益 不 足 務 合 中 道 也 
X64n1262_001:0445c03	姁嫗上許御切。下衣遇切。陰陽相得。覆育萬物。以	姁 嫗 上 許 御 切 下 衣 遇 切 陰 陽 相 得 覆 育 萬 物 以 
X64n1262_001:0445c04	氣曰姁。以體曰嫗。姁當作煦。出禮記。	氣 曰 姁 以 體 曰 嫗 姁 當 作 煦 出 禮 記 
X64n1262_001:0445c05	○三關語黃龍問龍慶閑云。人人有箇生緣。上座	 三 關 語 黃 龍 問 龍 慶 閑 云 人 人 有 箇 生 緣 上 座 
X64n1262_001:0445c06	生緣在甚麼處。閑云。早晨吃白粥。至晚又覺饑。又	生 緣 在 甚 麼 處 閑 云 早 晨 吃 白 粥 至 晚 又 覺 饑 又 
X64n1262_001:0445c07	問云。我手何如佛手。閑云。月下弄琵琶。又問云。我	問 云 我 手 何 如 佛 手 閑 云 月 下 弄 琵 琶 又 問 云 我 
X64n1262_001:0445c08	脚何似驢脚。閑云。鷺鷥立雪非同色。三十餘年未	脚 何 似 驢 脚 閑 云 鷺 鷥 立 雪 非 同 色 三 十 餘 年 未 
X64n1262_001:0445c09	有契其機者。脫有酬對。唯斂目危坐。由此叢林。目	有 契 其 機 者 脫 有 酬 對 唯 斂 目 危 坐 由 此 叢 林 目 
X64n1262_001:0445c10	為三關語。師自頌云。生緣斷處伸驢脚。驢脚伸時	為 三 關 語 師 自 頌 云 生 緣 斷 處 伸 驢 脚 驢 脚 伸 時 
X64n1262_001:0445c11	佛手開。為報五湖參禪客。三關一一透將來。	佛 手 開 為 報 五 湖 參 禪 客 三 關 一 一 透 將 來 
X64n1262_001:0445c12	脫有或然之辭。○孰與下去聲。及也。	脫 有 或 然 之 辭 孰 與 下 去 聲 及 也 
X64n1262_001:0445c13	○越地名。在紹興府。之往也。	 越 地 名 在 紹 興 府 之 往 也 
X64n1262_001:0445c14	○英邵武隆興府泐潭洪英禪師。邵武陳氏子。嗣	 英 邵 武 隆 興 府 泐 潭 洪 英 禪 師 邵 武 陳 氏 子 嗣 
X64n1262_001:0445c15	黃龍惠南禪師。	黃 龍 惠 南 禪 師 
X64n1262_001:0445c16	○批判批點分判。謂聖人之心如寶鑑。物來則現。	 批 判 批 點 分 判 謂 聖 人 之 心 如 寶 鑑 物 來 則 現 
X64n1262_001:0445c17	未有心念也。豈堪分章析句。批點拈提。此則無異	未 有 心 念 也 豈 堪 分 章 析 句 批 點 拈 提 此 則 無 異 
X64n1262_001:0445c18	描虗空。而刻湛水。亦乃向枝蔓更添芒索。	描 虗 空 而 刻 湛 水 亦 乃 向 枝 蔓 更 添 芒 索 
X64n1262_001:0445c19	公案乃喻公府之案牘也。法之所在。而王道治焉。	公 案 乃 喻 公 府 之 案 牘 也 法 之 所 在 而 王 道 治 焉 
X64n1262_001:0445c20	公者。乃聖賢一期之轍。天下通途之理也。案者。聖	公 者 乃 聖 賢 一 期 之 轍 天 下 通 途 之 理 也 案 者 聖 
X64n1262_001:0445c21	賢之正文也。凡有天下者。未甞無公府也。有公府。	賢 之 正 文 也 凡 有 天 下 者 未 甞 無 公 府 也 有 公 府 
X64n1262_001:0445c22	未甞無案牘。葢取為法。而治天下之不正矣。夫佛	未 甞 無 案 牘 葢 取 為 法 而 治 天 下 之 不 正 矣 夫 佛 
X64n1262_001:0445c23	祖機緣。目之曰公案者。亦由是而已。葢非一人之	祖 機 緣 目 之 曰 公 案 者 亦 由 是 而 已 葢 非 一 人 之 
X64n1262_001:0445c24	臆見。乃百千開示同稟。至理也。	臆 見 乃 百 千 開 示 同 稟 至 理 也 
X64n1262_001:0446a01	培益也。沃灌也。	培 益 也 沃 灌 也 
X64n1262_001:0446a02	益之增益先覺之理。	益 之 增 益 先 覺 之 理 
X64n1262_001:0446a03	○旅泊旅如客店暫住。豈能久居。泊如舟夜止歇。	 旅 泊 旅 如 客 店 暫 住 豈 能 久 居 泊 如 舟 夜 止 歇 
X64n1262_001:0446a04	天曉復行。言其不常住也。	天 曉 復 行 言 其 不 常 住 也 
X64n1262_001:0446a05	大丈夫富貴不能淫。貧賤不能移。威武不能屈。此	大 丈 夫 富 貴 不 能 淫 貧 賤 不 能 移 威 武 不 能 屈 此 
X64n1262_001:0446a06	之謂大丈夫。語出孟子。	之 謂 大 丈 夫 語 出 孟 子 
X64n1262_001:0446a07	恢大也。	恢 大 也 
X64n1262_001:0446a08	誘掖前導曰誘。傍扶曰掖。	誘 掖 前 導 曰 誘 傍 扶 曰 掖 
X64n1262_001:0446a09	忌畏也。媒招也。	忌 畏 也 媒 招 也 
X64n1262_001:0446a10	○比丘梵語比丘。此云乞士。謂上乞諸佛之智。以	 比 丘 梵 語 比 丘 此 云 乞 士 謂 上 乞 諸 佛 之 智 以 
X64n1262_001:0446a11	資慧命。下乞羣生之食。以資色身。比丘具五德。謂	資 慧 命 下 乞 羣 生 之 食 以 資 色 身 比 丘 具 五 德 謂 
X64n1262_001:0446a12	乞士。破惡。怖魔。淨命。殺賊也。	乞 士 破 惡 怖 魔 淨 命 殺 賊 也 
X64n1262_001:0446a13	苞苴包褁奇物。奉獻謟侫。以求托囑也。	苞 苴 包 褁 奇 物 奉 獻 謟 侫 以 求 托 囑 也 
X64n1262_001:0446a14	骯髒體盤旋貌。漢書云。曲眉骯髒。倚立門傍也。	骯 髒 體 盤 旋 貌 漢 書 云 曲 眉 骯 髒 倚 立 門 傍 也 
X64n1262_001:0446a15	搖尾乞憐如犬見人搖尾以媚之。求憐憫而已。小	搖 尾 乞 憐 如 犬 見 人 搖 尾 以 媚 之 求 憐 憫 而 已 小 
X64n1262_001:0446a16	人謟侫。亦猶是而已矣。	人 謟 侫 亦 猶 是 而 已 矣 
X64n1262_001:0446a17	天人天上人間。太息大聲之歎也。	天 人 天 上 人 間 太 息 大 聲 之 歎 也 
X64n1262_001:0446a18	頷點頭而納。口不言而心許也。	頷 點 頭 而 納 口 不 言 而 心 許 也 
X64n1262_001:0446a19	○迹有為功用曰迹。	 迹 有 為 功 用 曰 迹 
X64n1262_001:0446a20	○真淨文隆興府。寶峯真淨克文禪師。陝府閔鄉	 真 淨 文 隆 興 府 寶 峯 真 淨 克 文 禪 師 陝 府 閔 鄉 
X64n1262_001:0446a21	鄭氏子。嗣黃龍南禪師。南嶽下十一世。	鄭 氏 子 嗣 黃 龍 南 禪 師 南 嶽 下 十 一 世 
X64n1262_001:0446a22	載爾雅云。夏曰歲。取歲行一次也。商曰祀。取四時	載 爾 雅 云 夏 曰 歲 取 歲 行 一 次 也 商 曰 祀 取 四 時 
X64n1262_001:0446a23	祭祀一終也。周曰年。取禾熟之意。唐虞曰載。取物	祭 祀 一 終 也 周 曰 年 取 禾 熟 之 意 唐 虞 曰 載 取 物 
X64n1262_001:0446a24	終更始之義。已上俱年也。	終 更 始 之 義 已 上 俱 年 也 
X64n1262_001:0446b01	再閏閏月定四時而成歲也。張純曰。三年一閏。天	再 閏 閏 月 定 四 時 而 成 歲 也 張 純 曰 三 年 一 閏 天 
X64n1262_001:0446b02	氣小備。五年一閏。天氣大備。葢閏月之不足。日之	氣 小 備 五 年 一 閏 天 氣 大 備 葢 閏 月 之 不 足 日 之 
X64n1262_001:0446b03	有餘也。古者一年三百六十六日。分為十二月。每	有 餘 也 古 者 一 年 三 百 六 十 六 日 分 為 十 二 月 每 
X64n1262_001:0446b04	月三十日。一年共三百六十日。餘剩六日。又六箇	月 三 十 日 一 年 共 三 百 六 十 日 餘 剩 六 日 又 六 箇 
X64n1262_001:0446b05	月小。除六日為一歲。共餘十二日。三歲共三十六	月 小 除 六 日 為 一 歲 共 餘 十 二 日 三 歲 共 三 十 六 
X64n1262_001:0446b06	日閏一月。還餘六日在後。至二年餘二十四日。連	日 閏 一 月 還 餘 六 日 在 後 至 二 年 餘 二 十 四 日 連 
X64n1262_001:0446b07	前六日。共三十日。又閏一月。是為三載。故易云。五	前 六 日 共 三 十 日 又 閏 一 月 是 為 三 載 故 易 云 五 
X64n1262_001:0446b08	歲再閏。	歲 再 閏 
X64n1262_001:0446b09	聖人云下四句。出左傳。范文子答晉景公之文也。	聖 人 云 下 四 句 出 左 傳 范 文 子 答 晉 景 公 之 文 也 
X64n1262_001:0446b10	敏勤也。	敏 勤 也 
X64n1262_001:0446b11	喆侍者潭州大溈真如慕喆禪師。撫州臨川聞氏	喆 侍 者 潭 州 大 溈 真 如 慕 喆 禪 師 撫 州 臨 川 聞 氏 
X64n1262_001:0446b12	子。嗣翠巖真。南嶽下十一世也。	子 嗣 翠 巖 真 南 嶽 下 十 一 世 也 
X64n1262_001:0446b13	覺音教。睡醒曰覺。般若此云智慧也。	覺 音 教 睡 醒 曰 覺 般 若 此 云 智 慧 也 
X64n1262_001:0446b14	湘西即湖廣長沙府。相陰湘潭縣也。	湘 西 即 湖 廣 長 沙 府 相 陰 湘 潭 縣 也 
X64n1262_001:0446b15	目擊溫伯雪子適齊。途中相遇孔子。二人各辭而	目 擊 溫 伯 雪 子 適 齊 途 中 相 遇 孔 子 二 人 各 辭 而 
X64n1262_001:0446b16	去。子路曰。夫子久聞雪子。見無所言者何也。子曰。	去 子 路 曰 夫 子 久 聞 雪 子 見 無 所 言 者 何 也 子 曰 
X64n1262_001:0446b17	我與雪子目擊而道存。豈用言乎。出莊子逍遙篇。	我 與 雪 子 目 擊 而 道 存 豈 用 言 乎 出 莊 子 逍 遙 篇 
X64n1262_001:0446b18	○香城順西山香城景順禪師。蜀州人也。嗣黃龍	 香 城 順 西 山 香 城 景 順 禪 師 蜀 州 人 也 嗣 黃 龍 
X64n1262_001:0446b19	南禪師。乃坐脫於香城。	南 禪 師 乃 坐 脫 於 香 城 
X64n1262_001:0446b20	諸葛姓諸葛。名亮。字孔明。瑯琊人。躬耕於南陽之	諸 葛 姓 諸 葛 名 亮 字 孔 明 瑯 琊 人 躬 耕 於 南 陽 之 
X64n1262_001:0446b21	西臥龍崗。與徐庶為友。時劉玄德屯兵於新野。庶	西 臥 龍 崗 與 徐 庶 為 友 時 劉 玄 德 屯 兵 於 新 野 庶 
X64n1262_001:0446b22	見之告曰。諸葛孔明臥龍也。將軍盍往見之。此人	見 之 告 曰 諸 葛 孔 明 臥 龍 也 將 軍 盍 往 見 之 此 人 
X64n1262_001:0446b23	可以就見。不可以屈。由是玄德。遂詣亮所。凡三往	可 以 就 見 不 可 以 屈 由 是 玄 德 遂 詣 亮 所 凡 三 往 
X64n1262_001:0446b24	而從之。遂拜為軍師。後為蜀漢相。史咏云。世亂雄	而 從 之 遂 拜 為 軍 師 後 為 蜀 漢 相 史 咏 云 世 亂 雄 
X64n1262_001:0446c01	兵百戰餘。孔明曾此樂耘鋤。蜀王不自垂三顧。爭	兵 百 戰 餘 孔 明 曾 此 樂 耘 鋤 蜀 王 不 自 垂 三 顧 爭 
X64n1262_001:0446c02	得先生出故廬。	得 先 生 出 故 廬 
X64n1262_001:0446c03	春力時運該興。不能隱藏。	春 力 時 運 該 興 不 能 隱 藏 
X64n1262_001:0446c04	○廣道者瑞州九峯希廣禪師。西蜀梓州人。師慈	 廣 道 者 瑞 州 九 峯 希 廣 禪 師 西 蜀 梓 州 人 師 慈 
X64n1262_001:0446c05	仁惠物。不尋細檢。故叢林號為廣無心。嗣真淨克	仁 惠 物 不 尋 細 檢 故 叢 林 號 為 廣 無 心 嗣 真 淨 克 
X64n1262_001:0446c06	文禪師。南嶽下十二世也。	文 禪 師 南 嶽 下 十 二 世 也 
X64n1262_001:0446c07	輿眾也。	輿 眾 也 
X64n1262_001:0446c08	分外事官受爵於國。牧民正國。豈為奇特。夫為善	分 外 事 官 受 爵 於 國 牧 民 正 國 豈 為 奇 特 夫 為 善 
X64n1262_001:0446c09	知識者。主叢林。興教化。安眾克己。不干常住。正宜	知 識 者 主 叢 林 興 教 化 安 眾 克 己 不 干 常 住 正 宜 
X64n1262_001:0446c10	如此。豈分外事耶。	如 此 豈 分 外 事 耶 
X64n1262_001:0446c11	○雲委積聚也。	 雲 委 積 聚 也 
X64n1262_001:0446c12	○委曲教之之法。常俯而就之。方便以成其德故	 委 曲 教 之 之 法 常 俯 而 就 之 方 便 以 成 其 德 故 
X64n1262_001:0446c13	也。	也 
X64n1262_001:0446c14	褫音池。成就也。體栽格式也。	褫 音 池 成 就 也 體 栽 格 式 也 
X64n1262_001:0446c15	○舒王宋徽宗。進荊公為舒王也。荊公熈寧間拜	 舒 王 宋 徽 宗 進 荊 公 為 舒 王 也 荊 公 熈 寧 間 拜 
X64n1262_001:0446c16	為相。作務新法病民。其子王雱。為崇正殿大學士。	為 相 作 務 新 法 病 民 其 子 王 雱 為 崇 正 殿 大 學 士 
X64n1262_001:0446c17	因父佐務新法必行。雱卒。父罷相。晏閑間如夢寐。	因 父 佐 務 新 法 必 行 雱 卒 父 罷 相 晏 閑 間 如 夢 寐 
X64n1262_001:0446c18	見一鬼使領雱。荷鐵枷。泣於公前曰。因父務新法	見 一 鬼 使 領 雱 荷 鐵 枷 泣 於 公 前 曰 因 父 務 新 法 
X64n1262_001:0446c19	所致。公問使乞解。使曰。建寺飯僧可免。公遂於金	所 致 公 問 使 乞 解 使 曰 建 寺 飯 僧 可 免 公 遂 於 金 
X64n1262_001:0446c20	陵田地。捨宅為寺。賜額保寧。請真淨主之。	陵 田 地 捨 宅 為 寺 賜 額 保 寧 請 真 淨 主 之 
X64n1262_001:0446c21	縑音兼。絹也。	縑 音 兼 絹 也 
X64n1262_001:0446c22	袈裟具云迦羅沙曳。此云不正色。亦名離塵服。	袈 裟 具 云 迦 羅 沙 曳 此 云 不 正 色 亦 名 離 塵 服 
X64n1262_001:0446c23	衣去聲字。著衣也。	衣 去 聲 字 著 衣 也 
X64n1262_001:0446c24	伽黎名雜碎衣。以條數多故。大衣分三品。九條。十	伽 黎 名 雜 碎 衣 以 條 數 多 故 大 衣 分 三 品 九 條 十 
X64n1262_001:0447a01	一條。十三條。名下品。十五條。十七條。十九條。名中	一 條 十 三 條 名 下 品 十 五 條 十 七 條 十 九 條 名 中 
X64n1262_001:0447a02	品。二十一條。二十三條。二十五條。名上品。	品 二 十 一 條 二 十 三 條 二 十 五 條 名 上 品 
X64n1262_001:0447a03	估賣也。價也。事好也。	估 賣 也 價 也 事 好 也 
X64n1262_001:0447a04	○湛堂隆興府泐潭湛堂文準禪師。興元府。梁氏	 湛 堂 隆 興 府 泐 潭 湛 堂 文 準 禪 師 興 元 府 梁 氏 
X64n1262_001:0447a05	子。嗣真淨文禪師。南嶽下十三世也。	子 嗣 真 淨 文 禪 師 南 嶽 下 十 三 世 也 
X64n1262_001:0447a06	兆形顯之義。	兆 形 顯 之 義 
X64n1262_001:0447a07	枯死枯老死滅殘缺蠹損也。	枯 死 枯 老 死 滅 殘 缺 蠹 損 也 
X64n1262_001:0447a08	卜決疑也。○杜斷也。塞也。	卜 決 疑 也 杜 斷 也 塞 也 
X64n1262_001:0447a09	注灌注也。如瓶注水。使心不亂也。	注 灌 注 也 如 瓶 注 水 使 心 不 亂 也 
X64n1262_001:0447a10	出師表諸葛武侯。受顧命輔後主。七擒孟獲。已定	出 師 表 諸 葛 武 侯 受 顧 命 輔 後 主 七 擒 孟 獲 已 定 
X64n1262_001:0447a11	南方。乃出師伐魏。臨行遺表於後主。表曰。先帝創	南 方 乃 出 師 伐 魏 臨 行 遺 表 於 後 主 表 曰 先 帝 創 
X64n1262_001:0447a12	業未半。而中道崩殂。今天下三分。益州罷敝。此誠	業 未 半 而 中 道 崩 殂 今 天 下 三 分 益 州 罷 敝 此 誠 
X64n1262_001:0447a13	危急存亡之秋也。然侍衛之臣。不懈於內。忠志之	危 急 存 亡 之 秋 也 然 侍 衛 之 臣 不 懈 於 內 忠 志 之 
X64n1262_001:0447a14	士。亡身於外者。葢追先帝之殊遇。欲報之於陛下	士 亡 身 於 外 者 葢 追 先 帝 之 殊 遇 欲 報 之 於 陛 下 
X64n1262_001:0447a15	也。誠宜開張聖聽。以光先帝遺德。恢弘志士之氣。	也 誠 宜 開 張 聖 聽 以 光 先 帝 遺 德 恢 弘 志 士 之 氣 
X64n1262_001:0447a16	不宜妄自菲薄。引喻失義。以塞忠諫之路也。宮中	不 宜 妄 自 菲 薄 引 喻 失 義 以 塞 忠 諫 之 路 也 宮 中 
X64n1262_001:0447a17	府中俱為一體。湛師聞末二句。豁然開悟。如訓文	府 中 俱 為 一 體 湛 師 聞 末 二 句 豁 然 開 悟 如 訓 文 
X64n1262_001:0447a18	中云。	中 云 
X64n1262_001:0447a19	○好惡好人之所惡。惡人之所好。是為拂人之性。	 好 惡 好 人 之 所 惡 惡 人 之 所 好 是 為 拂 人 之 性 
X64n1262_001:0447a20	災必逮夫身。	災 必 逮 夫 身 
X64n1262_001:0447a21	拂逆也。	拂 逆 也 
X64n1262_001:0447a22	○殢係替二音。極困也。滯也。	 殢 係 替 二 音 極 困 也 滯 也 
X64n1262_001:0447a23	僧問僧問處。名偏辟問。州答處。名信手拈來無意	僧 問 僧 問 處 名 偏 辟 問 州 答 處 名 信 手 拈 來 無 意 
X64n1262_001:0447a24	路話。又謂放風前箭。轉格外機。須向言前領旨。句	路 話 又 謂 放 風 前 箭 轉 格 外 機 須 向 言 前 領 旨 句 
X64n1262_001:0447b01	外明宗。不可尋言逐句。妄生揆度。趙州已至不立	外 明 宗 不 可 尋 言 逐 句 妄 生 揆 度 趙 州 已 至 不 立 
X64n1262_001:0447b02	玄危。平坦之地。了無佛法身心。凡酬酢。信口開合。	玄 危 平 坦 之 地 了 無 佛 法 身 心 凡 酬 酢 信 口 開 合 
X64n1262_001:0447b03	皆無情識。不可較量也。故雪竇頌曰。偏辟曾挨老	皆 無 情 識 不 可 較 量 也 故 雪 竇 頌 曰 偏 辟 曾 挨 老 
X64n1262_001:0447b04	古錐。七斤衫重少人知。而今擲向西湖裏。下載清	古 錐 七 斤 衫 重 少 人 知 而 今 擲 向 西 湖 裏 下 載 清 
X64n1262_001:0447b05	風付與誰。	風 付 與 誰 
X64n1262_001:0447b06	趙州趙州觀音院從諗禪師。曹州郝氏子。嗣南泉	趙 州 趙 州 觀 音 院 從 諗 禪 師 曹 州 郝 氏 子 嗣 南 泉 
X64n1262_001:0447b07	普願禪師。南嶽下三世。後住觀音院。聲傳大夏。名	普 願 禪 師 南 嶽 下 三 世 後 住 觀 音 院 聲 傳 大 夏 名 
X64n1262_001:0447b08	聞九州。壽一百二十歲。唐昭宗乾寧四年。十一月	聞 九 州 壽 一 百 二 十 歲 唐 昭 宗 乾 寧 四 年 十 一 月 
X64n1262_001:0447b09	初二日。無疾。右脇而寂也。	初 二 日 無 疾 右 脇 而 寂 也 
X64n1262_001:0447b10	酬酢下音昨。客報主曰酢。主答客曰酬。	酬 酢 下 音 昨 客 報 主 曰 酢 主 答 客 曰 酬 
X64n1262_001:0447b11	虡音巨。謂飛虡天上神獸。鹿頭龍身。說文云。鍾皷	虡 音 巨 謂 飛 虡 天 上 神 獸 鹿 頭 龍 身 說 文 云 鍾 皷 
X64n1262_001:0447b12	之柎也。飾為猛獸。釋名曰。橫曰栒。縱曰虡。	之 柎 也 飾 為 猛 獸 釋 名 曰 橫 曰 栒 縱 曰 虡 
X64n1262_001:0447b13	○差楚宜切。略也。	 差 楚 宜 切 略 也 
X64n1262_001:0447b14	○秋晚末運之際。法道凋零。	 秋 晚 末 運 之 際 法 道 凋 零 
X64n1262_001:0447b15	○訥言遲也。尚加也。	 訥 言 遲 也 尚 加 也 
X64n1262_001:0447b16	[曰/月]蒙昧也。殆乃也。危也。	[曰月] 蒙 昧 也 殆 乃 也 危 也 
X64n1262_001:0447b17	○驥尾參逐人行。曰附驥尾。謂蒼蠅之飛不可數	 驥 尾 參 逐 人 行 曰 附 驥 尾 謂 蒼 蠅 之 飛 不 可 數 
X64n1262_001:0447b18	步。托於驥尾。乃能千里之達也。	步 托 於 驥 尾 乃 能 千 里 之 達 也 
X64n1262_001:0447b19	居必下出荀子勸學篇。	居 必 下 出 荀 子 勸 學 篇 
X64n1262_001:0447b20	福嚴雅澤州福嚴良雅禪師。嗣洞山守初。青原下	福 嚴 雅 澤 州 福 嚴 良 雅 禪 師 嗣 洞 山 守 初 青 原 下 
X64n1262_001:0447b21	八世也。	八 世 也 
X64n1262_001:0447b22	大寧寬洪州大寧道寬禪師。嗣石霜楚禪師。南嶽	大 寧 寬 洪 州 大 寧 道 寬 禪 師 嗣 石 霜 楚 禪 師 南 嶽 
X64n1262_001:0447b23	下十一世也。	下 十 一 世 也 
X64n1262_001:0447b24	蔣山元蔣山贊元禪師。婺州義烏人。傅大士之裔。	蔣 山 元 蔣 山 贊 元 禪 師 婺 州 義 烏 人 傅 大 士 之 裔 
X64n1262_001:0447c01	嗣石霜禪師。	嗣 石 霜 禪 師 
X64n1262_001:0447c02	楷同也。並也。	楷 同 也 並 也 
X64n1262_001:0447c03	龍象水中力大。龍也。陸中有威。象也。巨德以喻之	龍 象 水 中 力 大 龍 也 陸 中 有 威 象 也 巨 德 以 喻 之 
X64n1262_001:0447c04	者。言其有力而托。有威而可習故也。	者 言 其 有 力 而 托 有 威 而 可 習 故 也 
X64n1262_001:0447c05	支撑持也。	支 撑 持 也 
X64n1262_001:0447c06	○上下時民以名利為上。師今不愛名利。故不為	 上 下 時 民 以 名 利 為 上 師 今 不 愛 名 利 故 不 為 
X64n1262_001:0447c07	時上。時人以庸鄙為下。師今操道德故。不為時下	時 上 時 人 以 庸 鄙 為 下 師 今 操 道 德 故 不 為 時 下 
X64n1262_001:0447c08	也。	也 
X64n1262_001:0447c09	○死心隆興府黃龍死心悟新禪師。韶州黃氏子。	 死 心 隆 興 府 黃 龍 死 心 悟 新 禪 師 韶 州 黃 氏 子 
X64n1262_001:0447c10	嗣黃龍祖心禪師。南嶽下十三世也。	嗣 黃 龍 祖 心 禪 師 南 嶽 下 十 三 世 也 
X64n1262_001:0447c11	城郭郭。外城也。孟子曰。三里之城。七里之郭。	城 郭 郭 外 城 也 孟 子 曰 三 里 之 城 七 里 之 郭 
X64n1262_001:0447c12	良器良。大也。靈源知過必改。死心正而不屈。	良 器 良 大 也 靈 源 知 過 必 改 死 心 正 而 不 屈 
X64n1262_001:0447c13	○憩息也。	 憩 息 也 
X64n1262_001:0447c14	黃太史諱庭堅。字魯直。號山谷居士。得法於黃龍	黃 太 史 諱 庭 堅 字 魯 直 號 山 谷 居 士 得 法 於 黃 龍 
X64n1262_001:0447c15	祖心禪師。	祖 心 禪 師 
X64n1262_001:0447c16	特爾天性如此。不可強為。	特 爾 天 性 如 此 不 可 強 為 
X64n1262_001:0447c17	○庶幾方可也。	 庶 幾 方 可 也 
X64n1262_001:0447c18	○長靈卓東京天寧長靈守卓禪師。泉州莊氏子。	 長 靈 卓 東 京 天 寧 長 靈 守 卓 禪 師 泉 州 莊 氏 子 
X64n1262_001:0447c19	嗣靈源清禪師。南嶽十四世。	嗣 靈 源 清 禪 師 南 嶽 十 四 世 
X64n1262_001:0447c20	連城趙有卞和璧。秦昭王。欲以十二連城貿之。趙	連 城 趙 有 卞 和 璧 秦 昭 王 欲 以 十 二 連 城 貿 之 趙 
X64n1262_001:0447c21	遣相如送之入秦。相如視秦王。惟有愛璧之心。而	遣 相 如 送 之 入 秦 相 如 視 秦 王 惟 有 愛 璧 之 心 而 
X64n1262_001:0447c22	無割城之意。乃詐曰。璧有瑕。請示之。王授璧與相	無 割 城 之 意 乃 詐 曰 璧 有 瑕 請 示 之 王 授 璧 與 相 
X64n1262_001:0447c23	如。如將璧却倚柱立。怒髮衝冠。謂曰。臣聞布衣之	如 如 將 璧 却 倚 柱 立 怒 髮 衝 冠 謂 曰 臣 聞 布 衣 之 
X64n1262_001:0447c24	交。尚不忍相欺。況大國乎。王若急臣。臣頭璧俱碎	交 尚 不 忍 相 欺 況 大 國 乎 王 若 急 臣 臣 頭 璧 俱 碎 
X64n1262_001:0448a01	於柱。王恐璧碎。使人扶相如起。頌曰。卞璧無瑕曜	於 柱 王 恐 璧 碎 使 人 扶 相 如 起 頌 曰 卞 璧 無 瑕 曜 
X64n1262_001:0448a02	日輝。秦王雖愛不輸機。可憐又入相如手。一陣清	日 輝 秦 王 雖 愛 不 輸 機 可 憐 又 入 相 如 手 一 陣 清 
X64n1262_001:0448a03	風滿路歸。	風 滿 路 歸 
X64n1262_001:0448a04	礫小石也。	礫 小 石 也 
X64n1262_001:0448a05	神鼎潭州神鼎洪諲禪師。襄水扈氏子。嗣首山念	神 鼎 潭 州 神 鼎 洪 諲 禪 師 襄 水 扈 氏 子 嗣 首 山 念 
X64n1262_001:0448a06	禪師。南嶽下九世。尋常一衲。以度寒暑。後隱衡嶽。	禪 師 南 嶽 下 九 世 尋 常 一 衲 以 度 寒 暑 後 隱 衡 嶽 
X64n1262_001:0448a07	有一豪貴來山遊。見師氣貌閑靜。一鉢無餘。遂拜	有 一 豪 貴 來 山 遊 見 師 氣 貌 閑 靜 一 鉢 無 餘 遂 拜 
X64n1262_001:0448a08	請住神鼎。十年枯淡。室無升米。一鉢掛壁。日收盞	請 住 神 鼎 十 年 枯 淡 室 無 升 米 一 鉢 掛 壁 日 收 盞 
X64n1262_001:0448a09	飯。一枯木床為法座。殘僧數輩圍之。始終如此。後	飯 一 枯 木 床 為 法 座 殘 僧 數 輩 圍 之 始 終 如 此 後 
X64n1262_001:0448a10	宗風大振。門弟子氣吞諸方。由是慈明。髮長不剪。	宗 風 大 振 門 弟 子 氣 吞 諸 方 由 是 慈 明 髮 長 不 剪 
X64n1262_001:0448a11	敝衣而特往見鼎。鼎曰。汾陽有西河師子是否。慈	敝 衣 而 特 往 見 鼎 鼎 曰 汾 陽 有 西 河 師 子 是 否 慈 
X64n1262_001:0448a12	明指後厲聲曰。屋倒矣。鼎回顧相視。慈明坐脫隻	明 指 後 厲 聲 曰 屋 倒 矣 鼎 回 顧 相 視 慈 明 坐 脫 隻 
X64n1262_001:0448a13	履而視之。鼎老忘問。又失公所在。慈明遂整衣且	履 而 視 之 鼎 老 忘 問 又 失 公 所 在 慈 明 遂 整 衣 且 
X64n1262_001:0448a14	行且曰。見面不如聞名。遂去。鼎遣人追之不返。鼎	行 且 曰 見 面 不 如 聞 名 遂 去 鼎 遣 人 追 之 不 返 鼎 
X64n1262_001:0448a15	嘆曰。汾陽有此兒也。慈明自此名重四方。	嘆 曰 汾 陽 有 此 兒 也 慈 明 自 此 名 重 四 方 
X64n1262_001:0448a16	○古人云前漢書文帝。丁卯六年。淮南厲王長謀	 古 人 云 前 漢 書 文 帝 丁 卯 六 年 淮 南 厲 王 長 謀 
X64n1262_001:0448a17	反。廢處蜀郡。嗔恚不食死。梁太傅賈誼上疏曰。臣	反 廢 處 蜀 郡 嗔 恚 不 食 死 梁 太 傅 賈 誼 上 疏 曰 臣 
X64n1262_001:0448a18	竊惟事執。可為痛哭者一。可為流涕者二。可為長	竊 惟 事 執 可 為 痛 哭 者 一 可 為 流 涕 者 二 可 為 長 
X64n1262_001:0448a19	太息者六。若其他背理而傷道者。難徧以疏舉。進	太 息 者 六 若 其 他 背 理 而 傷 道 者 難 徧 以 疏 舉 進 
X64n1262_001:0448a20	言者。皆言天下已安已治矣。臣獨以為未也。曰安	言 者 皆 言 天 下 已 安 已 治 矣 臣 獨 以 為 未 也 曰 安 
X64n1262_001:0448a21	且治者。非愚則諛。皆非事實知治亂之體者也。夫	且 治 者 非 愚 則 諛 皆 非 事 實 知 治 亂 之 體 者 也 夫 
X64n1262_001:0448a22	抱火厝之積薪之下。而寢其上。火未及燃。固為之	抱 火 厝 之 積 薪 之 下 而 寢 其 上 火 未 及 燃 固 為 之 
X64n1262_001:0448a23	安。方今之執。何以異此。本末舛逆。首尾衡決。國制	安 方 今 之 執 何 以 異 此 本 末 舛 逆 首 尾 衡 決 國 制 
