X64n1262_001:0451a08	○區區卑小之稱。猶碌碌也。	 區 區 卑 小 之 稱 猶 碌 碌 也 
X64n1262_001:0451a09	○成枯木東京淨國枯木法成禪師。何朔人。嗣芙	 成 枯 木 東 京 淨 國 枯 木 法 成 禪 師 何 朔 人 嗣 芙 
X64n1262_001:0451a10	蓉楷禪師。清源下十二世也。	蓉 楷 禪 師 清 源 下 十 二 世 也 
X64n1262_001:0451a11	侈靡奢費也。	侈 靡 奢 費 也 
X64n1262_001:0451a12	輕肥乘肥馬。衣輕裘也。肥馬衣輕裘。佯佯過閭里。	輕 肥 乘 肥 馬 衣 輕 裘 也 肥 馬 衣 輕 裘 佯 佯 過 閭 里 
X64n1262_001:0451a13	雖得市廛憐。還為識者鄙。	雖 得 市 廛 憐 還 為 識 者 鄙 
X64n1262_001:0451a14	○區分也。係連及也。	 區 分 也 係 連 及 也 
X64n1262_001:0451a15	關在也。干也。弛廢也。弓解。	關 在 也 干 也 弛 廢 也 弓 解 
X64n1262_001:0451a16	凌遲凋敗也。	凌 遲 凋 敗 也 
X64n1262_001:0451a17	育王諶慶元府育王寺無示介諶禪師。溫州張氏	育 王 諶 慶 元 府 育 王 寺 無 示 介 諶 禪 師 溫 州 張 氏 
X64n1262_001:0451a18	子。嗣長靈卓禪師。其性剛毅。臨眾合古法。當時有	子 嗣 長 靈 卓 禪 師 其 性 剛 毅 臨 眾 合 古 法 當 時 有 
X64n1262_001:0451a19	諶鐵面之稱。	諶 鐵 面 之 稱 
X64n1262_001:0451a20	仰山偉袁州仰山行偉禪師。何朔人。嗣黃龍南禪	仰 山 偉 袁 州 仰 山 行 偉 禪 師 何 朔 人 嗣 黃 龍 南 禪 
X64n1262_001:0451a21	師。其為人性剛。蒞事有法度。使某人。幹某事。莫敢	師 其 為 人 性 剛 蒞 事 有 法 度 使 某 人 幹 某 事 莫 敢 
X64n1262_001:0451a22	違者。甞將十二輩名。付維那。使明日俱到方丈受	違 者 甞 將 十 二 輩 名 付 維 那 使 明 日 俱 到 方 丈 受 
X64n1262_001:0451a23	曲折。及會茶時。即失一人。偉問為誰。侍曰。隨州永	曲 折 及 會 茶 時 即 失 一 人 偉 問 為 誰 侍 曰 隨 州 永 
X64n1262_001:0451a24	泰。首座曰。泰遊山未回。以請他僧備具。偉然之。俄	泰 首 座 曰 泰 遊 山 未 回 以 請 他 僧 備 具 偉 然 之 俄 
X64n1262_001:0451b01	有告曰。泰實在。首座匿之。偉色莊。使搜得。泰自陳	有 告 曰 泰 實 在 首 座 匿 之 偉 色 莊 使 搜 得 泰 自 陳 
X64n1262_001:0451b02	拙弱。恐失所受之事。首座實不知也。偉令擊鍾集	拙 弱 恐 失 所 受 之 事 首 座 實 不 知 也 偉 令 擊 鍾 集 
X64n1262_001:0451b03	眾。白曰。昧心欺眾。他人猶不可為。況首座。以分座	眾 白 曰 昧 心 欺 眾 他 人 猶 不 可 為 況 首 座 以 分 座 
X64n1262_001:0451b04	授道。是老師所賞之職。而自破壞乎。二人俱受罸	授 道 是 老 師 所 賞 之 職 而 自 破 壞 乎 二 人 俱 受 罸 
X64n1262_001:0451b05	出院。由此諸服其公。泰後嗣法住黃蘗山。首座住	出 院 由 此 諸 服 其 公 泰 後 嗣 法 住 黃 蘗 山 首 座 住 
X64n1262_001:0451b06	溈山。嗣黃龍禪師。出僧寶傳。	溈 山 嗣 黃 龍 禪 師 出 僧 寶 傳 
X64n1262_001:0451b07	隳毀也。夙興早起也。	隳 毀 也 夙 興 早 起 也 
X64n1262_001:0451b08	參會夜晚小參省會也。	參 會 夜 晚 小 參 省 會 也 
X64n1262_001:0451b09	貪饕求之不足曰貪。嗜之不足曰饕。	貪 饕 求 之 不 足 曰 貪 嗜 之 不 足 曰 饕 
X64n1262_001:0451b10	○袂音眉。衣袂也。袖也。	 袂 音 眉 衣 袂 也 袖 也 
X64n1262_001:0451b11	征役軍差曰征。民差曰役。	征 役 軍 差 曰 征 民 差 曰 役 
X64n1262_001:0451b12	○延壽堂撫安老病之所也。古者叢林老僧送安	 延 壽 堂 撫 安 老 病 之 所 也 古 者 叢 林 老 僧 送 安 
X64n1262_001:0451b13	樂堂。病者送延壽堂也。又今涅槃堂是。	樂 堂 病 者 送 延 壽 堂 也 又 今 涅 槃 堂 是 
X64n1262_001:0451b14	不幸不救乃天命將盡。而不能救也。	不 幸 不 救 乃 天 命 將 盡 而 不 能 救 也 
X64n1262_001:0451b15	○佛印南康軍雲居佛印了元禪師。嗣開元善暹	 佛 印 南 康 軍 雲 居 佛 印 了 元 禪 師 嗣 開 元 善 暹 
X64n1262_001:0451b16	禪師。	禪 師 
X64n1262_001:0451b17	燕休大學曰。燕居獨處也。論語云。子之燕居。	燕 休 大 學 曰 燕 居 獨 處 也 論 語 云 子 之 燕 居 
X64n1262_001:0451b18	從心孔子曰。吾十有五。而志於學。三十而立。四十	從 心 孔 子 曰 吾 十 有 五 而 志 於 學 三 十 而 立 四 十 
X64n1262_001:0451b19	而不惑。五十而知天命。六十而耳順。七十而從心	而 不 惑 五 十 而 知 天 命 六 十 而 耳 順 七 十 而 從 心 
X64n1262_001:0451b20	所欲不踰矩。註曰。從者。凡事隨心所欲。不過法度	所 欲 不 踰 矩 註 曰 從 者 凡 事 隨 心 所 欲 不 過 法 度 
X64n1262_001:0451b21	也。	也 
X64n1262_001:0451b22	長庚星名也。東有啟明。曰金星。西有長庚。曰水星。	長 庚 星 名 也 東 有 啟 明 曰 金 星 西 有 長 庚 曰 水 星 
X64n1262_001:0451b23	金星在西。日出則現。水星在東。日沒則現。又先日	金 星 在 西 日 出 則 現 水 星 在 東 日 沒 則 現 又 先 日 
X64n1262_001:0451b24	而出曰啟明。後日而沒謂之長庚也。	而 出 曰 啟 明 後 日 而 沒 謂 之 長 庚 也 
X64n1262_001:0451c01	曉月言其二十七八之月。纔出則天曉矣。所謂光	曉 月 言 其 二 十 七 八 之 月 纔 出 則 天 曉 矣 所 謂 光 
X64n1262_001:0451c02	景不長。若此矣。	景 不 長 若 此 矣 
X64n1262_001:0451c03	○旌獎上。表顯也。下。勸獎也。	 旌 獎 上 表 顯 也 下 勸 獎 也 
X64n1262_001:0451c04	璞藏玉之石也。抵擲拋棄也。	璞 藏 玉 之 石 也 抵 擲 拋 棄 也 
X64n1262_001:0451c05	琢磨治玉石者。既琢而復磨之。言其已精。而益求	琢 磨 治 玉 石 者 既 琢 而 復 磨 之 言 其 已 精 而 益 求 
X64n1262_001:0451c06	其精也。	其 精 也 
X64n1262_001:0451c07	圭璋瑞玉也。上圓下方。公執桓圭九寸。侯執信圭。	圭 璋 瑞 玉 也 上 圓 下 方 公 執 桓 圭 九 寸 侯 執 信 圭 
X64n1262_001:0451c08	伯執躬圭。皆七寸也。	伯 執 躬 圭 皆 七 寸 也 
X64n1262_001:0451c09	閼音遏。塞也。濬音峻。深也。	閼 音 遏 塞 也 濬 音 峻 深 也 
X64n1262_001:0451c10	殷大也。	殷 大 也 
X64n1262_001:0451c11	○恭敬恭現於外。敬存於內。恭。莊敬也。	 恭 敬 恭 現 於 外 敬 存 於 內 恭 莊 敬 也 
X64n1262_001:0451c12	失容無恭敬之容。顯我慢之相。	失 容 無 恭 敬 之 容 顯 我 慢 之 相 
X64n1262_001:0451c13	諭曉也。	諭 曉 也 
X64n1262_001:0451c14	唐石頭南嶽石頭希遷禪師。瑞州高安陳氏子。嗣	唐 石 頭 南 嶽 石 頭 希 遷 禪 師 瑞 州 高 安 陳 氏 子 嗣 
X64n1262_001:0451c15	清源行思禪師。後於衡嶽寺之東。有石狀如臺。結	清 源 行 思 禪 師 後 於 衡 嶽 寺 之 東 有 石 狀 如 臺 結 
X64n1262_001:0451c16	庵居之也。	庵 居 之 也 
X64n1262_001:0451c17	瞬動目也。	瞬 動 目 也 
X64n1262_001:0451c18	○法眼金陵清涼院文益禪師。餘杭魯氏子。甞與	 法 眼 金 陵 清 涼 院 文 益 禪 師 餘 杭 魯 氏 子 甞 與 
X64n1262_001:0451c19	悟空修山主行脚。至福州湖外。值天雨忽作溪流	悟 空 修 山 主 行 脚 至 福 州 湖 外 值 天 雨 忽 作 溪 流 
X64n1262_001:0451c20	瀑漲。暫寓城西地藏院。阻雪少憩。附爐次。琛曰。上	瀑 漲 暫 寓 城 西 地 藏 院 阻 雪 少 憩 附 爐 次 琛 曰 上 
X64n1262_001:0451c21	座何往。師曰。迤邐行脚。曰行脚事作麼生。師曰。不	座 何 往 師 曰 迤 邐 行 脚 曰 行 脚 事 作 麼 生 師 曰 不 
X64n1262_001:0451c22	知。曰不知最親切。師豁然大悟。遂嗣其法。後剏法	知 曰 不 知 最 親 切 師 豁 然 大 悟 遂 嗣 其 法 後 剏 法 
X64n1262_001:0451c23	眼宗是也。	眼 宗 是 也 
X64n1262_001:0451c24	地藏漳州羅漢院。珪琛禪師。常山李氏子。嗣玄沙	地 藏 漳 州 羅 漢 院 珪 琛 禪 師 常 山 李 氏 子 嗣 玄 沙 
X64n1262_001:0452a01	師備禪師。後漳州。牧主請住地藏院。次遷羅漢院。	師 備 禪 師 後 漳 州 牧 主 請 住 地 藏 院 次 遷 羅 漢 院 
X64n1262_001:0452a02	破屋壞垣。師恬然自樂也。	破 屋 壞 垣 師 恬 然 自 樂 也 
X64n1262_001:0452a03	明教見神鼎嵩禪師見神鼎。鼎坐其堂上。嵩展具	明 教 見 神 鼎 嵩 禪 師 見 神 鼎 鼎 坐 其 堂 上 嵩 展 具 
X64n1262_001:0452a04	敬禮。鼎指堂上兩小瓮曰。子來是其時。寺中今年	敬 禮 鼎 指 堂 上 兩 小 瓮 曰 子 來 是 其 時 寺 中 今 年 
X64n1262_001:0452a05	始有醬食。至明時食粥。見一淨人。挾筐取物。投僧	始 有 醬 食 至 明 時 食 粥 見 一 淨 人 挾 筐 取 物 投 僧 
X64n1262_001:0452a06	鉢中。嵩視上下有咀嚼者。有置之自若者。嵩袖之	鉢 中 嵩 視 上 下 有 咀 嚼 者 有 置 之 自 若 者 嵩 袖 之 
X64n1262_001:0452a07	下堂看。乃碎米餅餌。嵩問於耆宿。宿曰。此寺自來	下 堂 看 乃 碎 米 餅 餌 嵩 問 於 耆 宿 宿 曰 此 寺 自 來 
X64n1262_001:0452a08	不煑粥。有檀越請齋日。次第撥僧赴之。剩其乾殘	不 煑 粥 有 檀 越 請 齋 日 次 第 撥 僧 赴 之 剩 其 乾 殘 
X64n1262_001:0452a09	者。歸納庫中。無齋之日。令碎焙均而分之。表同甘	者 歸 納 庫 中 無 齋 之 日 令 碎 焙 均 而 分 之 表 同 甘 
X64n1262_001:0452a10	苦也。	苦 也 
X64n1262_001:0452a11	○風格氣象度量。凜然色莊敬畏。	 風 格 氣 象 度 量 凜 然 色 莊 敬 畏 
X64n1262_001:0452a12	殊絕也。介在也。動也。	殊 絕 也 介 在 也 動 也 
X64n1262_001:0452a13	裁制也。謂使學者。至於無過不及之地。而終成大	裁 制 也 謂 使 學 者 至 於 無 過 不 及 之 地 而 終 成 大 
X64n1262_001:0452a14	德也。	德 也 
X64n1262_001:0452a15	○甲首也。以十干言之。而甲居首。乃雲居為江南	 甲 首 也 以 十 干 言 之 而 甲 居 首 乃 雲 居 為 江 南 
X64n1262_001:0452a16	十剎之首也。	十 剎 之 首 也 
X64n1262_001:0452a17	去就見處也。行事也。	去 就 見 處 也 行 事 也 
X64n1262_001:0452a18	○招提梵語招闘提奢。略云招提。唐言四方僧物。	 招 提 梵 語 招 闘 提 奢 略 云 招 提 唐 言 四 方 僧 物 
X64n1262_001:0452a19	今稱十方常住也。	今 稱 十 方 常 住 也 
X64n1262_001:0452a20	削弱上。減損也。下。衰敗也。謂顛沛祖風。有傷法化	削 弱 上 減 損 也 下 衰 敗 也 謂 顛 沛 祖 風 有 傷 法 化 
X64n1262_001:0452a21	也。	也 
X64n1262_001:0452a22	精舍精修梵行之所。乃行人棲心修道之處也。	精 舍 精 修 梵 行 之 所 乃 行 人 棲 心 修 道 之 處 也 
X64n1262_001:0452a23	調御師化物不暴曰調御。三界模範曰師。	調 御 師 化 物 不 暴 曰 調 御 三 界 模 範 曰 師 
X64n1262_001:0452a24	滅裂輕薄也。	滅 裂 輕 薄 也 
X64n1262_001:0452b01	○靈源門榜其略曰。惟清名字住持。實同寄客。但	 靈 源 門 榜 其 略 曰 惟 清 名 字 住 持 實 同 寄 客 但 
X64n1262_001:0452b02	以領徒弘法。仰助教風為職事爾。若其常住財物。	以 領 徒 弘 法 仰 助 教 風 為 職 事 爾 若 其 常 住 財 物 
X64n1262_001:0452b03	既非己有。理不得專。悉委職事僧徒。分局主執。照	既 非 己 有 理 不 得 專 悉 委 職 事 僧 徒 分 局 主 執 照 
X64n1262_001:0452b04	依公私。合同支破。惟清止同眾僧齋襯。隨身瓶鉢。	依 公 私 合 同 支 破 惟 清 止 同 眾 僧 齋 襯 隨 身 瓶 鉢 
X64n1262_001:0452b05	任緣而住。伏望四方君子。來有所需。惟顧寢食祇	任 緣 而 住 伏 望 四 方 君 子 來 有 所 需 惟 顧 寢 食 祇 
X64n1262_001:0452b06	接之餘別難應供。若其世法。則屬官物。若其佛法。	接 之 餘 別 難 應 供 若 其 世 法 則 屬 官 物 若 其 佛 法 
X64n1262_001:0452b07	則為眾財。偷眾財。盜官物。買悅人情。則實非素分	則 為 眾 財 偷 眾 財 盜 官 物 買 悅 人 情 則 實 非 素 分 
X64n1262_001:0452b08	志之所敢當。預具白文。冀垂鑑察也。	志 之 所 敢 當 預 具 白 文 冀 垂 鑑 察 也 
X64n1262_001:0452b09	張無盡丞相張商英字天覺。號無盡。十九登第。後	張 無 盡 丞 相 張 商 英 字 天 覺 號 無 盡 十 九 登 第 後 
X64n1262_001:0452b10	深信佛乘。留心祖道。宋哲宗。元祐六年。為江西漕	深 信 佛 乘 留 心 祖 道 宋 哲 宗 元 祐 六 年 為 江 西 漕 
X64n1262_001:0452b11	運使。後得法於兜率。從悅禪師。	運 使 後 得 法 於 兜 率 從 悅 禪 師 
X64n1262_001:0452b12	屢致上頻數也。下請舉也。	屢 致 上 頻 數 也 下 請 舉 也 
X64n1262_001:0452b13	可許也。肯也。	可 許 也 肯 也 
X64n1262_001:0452b14	飜然變動也。萬章問曰。人有言。伊尹以割烹要湯	飜 然 變 動 也 萬 章 問 曰 人 有 言 伊 尹 以 割 烹 要 湯 
X64n1262_001:0452b15	有諸。孟子曰否。伊尹耕於有莘之野。而樂堯舜之	有 諸 孟 子 曰 否 伊 尹 耕 於 有 莘 之 野 而 樂 堯 舜 之 
X64n1262_001:0452b16	道焉。湯使三往而聘之。既而飜然改曰。與我處畎	道 焉 湯 使 三 往 而 聘 之 既 而 飜 然 改 曰 與 我 處 畎 
X64n1262_001:0452b17	畆之中。由是樂堯舜之道。吾豈若使君為堯舜之	畆 之 中 由 是 樂 堯 舜 之 道 吾 豈 若 使 君 為 堯 舜 之 
X64n1262_001:0452b18	君哉。吾豈若使民為堯舜之民哉。吾豈若身親見	君 哉 吾 豈 若 使 民 為 堯 舜 之 民 哉 吾 豈 若 身 親 見 
X64n1262_001:0452b19	之哉。故天生斯民也。使先知覺後知也。予將以斯	之 哉 故 天 生 斯 民 也 使 先 知 覺 後 知 也 予 將 以 斯 
X64n1262_001:0452b20	道而覺斯民。非予覺之而誰也。	道 而 覺 斯 民 非 予 覺 之 而 誰 也 
X64n1262_001:0452b21	假我偷安佛去世逾遠。教以季末。何得無邪佞之	假 我 偷 安 佛 去 世 逾 遠 教 以 季 末 何 得 無 邪 佞 之 
X64n1262_001:0452b22	輩。寄身於我教中。苟且偷安其生也。	輩 寄 身 於 我 教 中 苟 且 偷 安 其 生 也 
X64n1262_001:0452b23	跬丘癸切。半步也。恙病也。	跬 丘 癸 切 半 步 也 恙 病 也 
X64n1262_001:0452b24	凜骨寒驚。懼之貌。	凜 骨 寒 驚 懼 之 貌 
X64n1262_001:0452c01	擘窠上分也。下字眼之方楷也。	擘 窠 上 分 也 下 字 眼 之 方 楷 也 
X64n1262_001:0452c02	人能弘道弘。廓大也。人外無道。道外無人。然人心	人 能 弘 道 弘 廓 大 也 人 外 無 道 道 外 無 人 然 人 心 
X64n1262_001:0452c03	有覺。道體無為。故人能弘道。道不能弘人。子張曰。	有 覺 道 體 無 為 故 人 能 弘 道 道 不 能 弘 人 子 張 曰 
X64n1262_001:0452c04	心能盡性。人能弘道也。性不能檢其心。道不能弘	心 能 盡 性 人 能 弘 道 也 性 不 能 檢 其 心 道 不 能 弘 
X64n1262_001:0452c05	其人也。	其 人 也 
X64n1262_001:0452c06	○歸雲本撫州疎山歸雲如本禪師。本州台城人。	 歸 雲 本 撫 州 疎 山 歸 雲 如 本 禪 師 本 州 台 城 人 
X64n1262_001:0452c07	嗣靈隱惠遠禪師。南嶽下十六世。	嗣 靈 隱 惠 遠 禪 師 南 嶽 下 十 六 世 
X64n1262_001:0452c08	富鄭公丞相富弼。字彥國。河南府人。宋神宗。拜為	富 鄭 公 丞 相 富 弼 字 彥 國 河 南 府 人 宋 神 宗 拜 為 
X64n1262_001:0452c09	鄭國公。又封韓國公。諡文忠定公。得法於投子修	鄭 國 公 又 封 韓 國 公 諡 文 忠 定 公 得 法 於 投 子 修 
X64n1262_001:0452c10	顒也。致仕洛陽。以書答蘇州圓照本禪師云。曾見	顒 也 致 仕 洛 陽 以 書 答 蘇 州 圓 照 本 禪 師 云 曾 見 
X64n1262_001:0452c11	顒師悟入深。因緣傳得老師心。東南謾說江山遠。	顒 師 悟 入 深 因 緣 傳 得 老 師 心 東 南 謾 說 江 山 遠 
X64n1262_001:0452c12	目覩靈光演妙音。	目 覩 靈 光 演 妙 音 
X64n1262_001:0452c13	投子顒舒州投子悟證修顒禪師。嗣惠林宗本禪	投 子 顒 舒 州 投 子 悟 證 修 顒 禪 師 嗣 惠 林 宗 本 禪 
X64n1262_001:0452c14	師。清源下十二世也。	師 清 源 下 十 二 世 也 
X64n1262_001:0452c15	碑豎石記功曰碑。灼昭然也。	碑 豎 石 記 功 曰 碑 灼 昭 然 也 
X64n1262_001:0452c16	篤誠也。厚也。	篤 誠 也 厚 也 
X64n1262_001:0452c17	社稷社。土神。稷。糓神。建國則立壇壝以祀。葢國以	社 稷 社 土 神 稷 糓 神 建 國 則 立 壇 壝 以 祀 葢 國 以 
X64n1262_001:0452c18	安民為本。社稷亦為民而立。君之尊。係於二者之	安 民 為 本 社 稷 亦 為 民 而 立 君 之 尊 係 於 二 者 之 
X64n1262_001:0452c19	存亡。孟子曰。民為貴。社稷次之。君為輕。又掃蕩烟	存 亡 孟 子 曰 民 為 貴 社 稷 次 之 君 為 輕 又 掃 蕩 烟 
X64n1262_001:0452c20	塵曰社。起取稅賦曰稷。	塵 曰 社 起 取 稅 賦 曰 稷 
X64n1262_001:0452c21	忘齒不拘年齒。屈勢不拘名位之謂也。	忘 齒 不 拘 年 齒 屈 勢 不 拘 名 位 之 謂 也 
X64n1262_001:0452c22	楊大年宋楊億。字大年。建州蒲城人。諡文正公。官	楊 大 年 宋 楊 億 字 大 年 建 州 蒲 城 人 諡 文 正 公 官 
X64n1262_001:0452c23	至翰林。得法於廣慧元璉禪師。後於四帝仁宗康	至 翰 林 得 法 於 廣 慧 元 璉 禪 師 後 於 四 帝 仁 宗 康 
X64n1262_001:0452c24	定間。與慈明為友。	定 間 與 慈 明 為 友 
X64n1262_001:0453a01	李和文駙馬都尉李遵勗。號和文居士。得法於谷	李 和 文 駙 馬 都 尉 李 遵 勗 號 和 文 居 士 得 法 於 谷 
X64n1262_001:0453a02	隱蘊聰禪師。初參聰時。聰以崔趙公。問徑山公案	隱 蘊 聰 禪 師 初 參 聰 時 聰 以 崔 趙 公 問 徑 山 公 案 
X64n1262_001:0453a03	答之。公於言下有省。呈頌曰。學道須是鐵漢。著手	答 之 公 於 言 下 有 省 呈 頌 曰 學 道 須 是 鐵 漢 著 手 
X64n1262_001:0453a04	心頭便判。直取無上菩提。一切是非莫管。後與慈	心 頭 便 判 直 取 無上菩提 一 切 是 非 莫 管 後 與 慈 
X64n1262_001:0453a05	明。為方外友。	明 為 方 外 友 
X64n1262_001:0453a06	廣慧璉汝州廣慧院元璉禪師。泉州陳氏子。嗣首	廣 慧 璉 汝 州 廣 慧 院 元 璉 禪 師 泉 州 陳 氏 子 嗣 首 
X64n1262_001:0453a07	山念禪師。南嶽下九世也。	山 念 禪 師 南 嶽 下 九 世 也 
X64n1262_001:0453a08	激揚激。發也。揚。舉也。激濁揚清之義也。謂混濁者	激 揚 激 發 也 揚 舉 也 激 濁 揚 清 之 義 也 謂 混 濁 者 
X64n1262_001:0453a09	激發之使自勉。清潔者舉揚之使易見。	激 發 之 使 自 勉 清 潔 者 舉 揚 之 使 易 見 
X64n1262_001:0453a10	班班明也。件也。	班 班 明 也 件 也 
X64n1262_001:0453a11	兜率悅隆興府。兜率寺從悅禪師。贛州熊氏子。嗣	兜 率 悅 隆 興 府 兜 率 寺 從 悅 禪 師 贛 州 熊 氏 子 嗣 
X64n1262_001:0453a12	真淨文禪師。南嶽下十三世也。	真 淨 文 禪 師 南 嶽 下 十 三 世 也 
X64n1262_001:0453a13	扣關擊節扣關。緊要處。難過而能過。擊節。阻隔處。	扣 關 擊 節 扣 關 緊 要 處 難 過 而 能 過 擊 節 阻 隔 處 
X64n1262_001:0453a14	不通而能通也。謂扣其機關。擊其節要。提持祖印。	不 通 而 能 通 也 謂 扣 其 機 關 擊 其 節 要 提 持 祖 印 
X64n1262_001:0453a15	顯露真機。於節要處敲擊。使其慶快也。	顯 露 真 機 於 節 要 處 敲 擊 使 其 慶 快 也 
X64n1262_001:0453a16	苟然豈徒然也。	苟 然 豈 徒 然 也 
X64n1262_001:0453a17	張無垢侍郎張九成。字子韶。號無垢居士。杭州鹽	張 無 垢 侍 郎 張 九 成 字 子 韶 號 無 垢 居 士 杭 州 鹽 
X64n1262_001:0453a18	官人。得法於妙喜杲禪師。	官 人 得 法 於 妙 喜 杲 禪 師 
X64n1262_001:0453a19	李漢老參政李邴。字漢老。得法於妙喜禪師。	李 漢 老 參 政 李 邴 字 漢 老 得 法 於 妙 喜 禪 師 
X64n1262_001:0453a20	呂居仁姓呂。名本中。字居仁。問道於妙喜杲禪師。	呂 居 仁 姓 呂 名 本 中 字 居 仁 問 道 於 妙 喜 杲 禪 師 
X64n1262_001:0453a21	官至翰林。	官 至 翰 林 
X64n1262_001:0453a22	入室學者請益問道。咨決心疑於禪奧之室也。	入 室 學 者 請 益 問 道 咨 決 心 疑 於 禪 奧 之 室 也 
X64n1262_001:0453a23	方外友出塵勞方隅之外。脫凡情拘繫之中。故謂	方 外 友 出 塵 勞 方 隅 之 外 脫 凡 情 拘 繫 之 中 故 謂 
X64n1262_001:0453a24	方外友也。	方 外 友 也 
X64n1262_001:0453b01	雷揮電掃雷揮。則激散長空。電掃。則蕩除妖孽。葢	雷 揮 電 掃 雷 揮 則 激 散 長 空 電 掃 則 蕩 除 妖 孽 葢 
X64n1262_001:0453b02	情愛順逆逈然清淨也。	情 愛 順 逆 逈 然 清 淨 也 
X64n1262_001:0453b03	衽衣襟也。辟易惶悚失守之貌。	衽 衣 襟 也 辟 易 惶 悚 失 守 之 貌 
X64n1262_001:0453b04	涯涘水之邊際也。言其不能測度也。	涯 涘 水 之 邊 際 也 言 其 不 能 測 度 也 
X64n1262_001:0453b05	擬度也。	擬 度 也 
X64n1262_001:0453b06	書刺下音七。古來未有紙。削竹木以書其名姓。	書 刺 下 音 七 古 來 未 有 紙 削 竹 木 以 書 其 名 姓 
X64n1262_001:0453b07	恬安靜也。餒奴罪切。饑也。	恬 安 靜 也 餒 奴 罪 切 饑 也 
X64n1262_001:0453b08	折腰折腰之勢也。晉時陶潛。字淵明。號元亮。門栽	折 腰 折 腰 之 勢 也 晉 時 陶 潛 字 淵 明 號 元 亮 門 栽 
X64n1262_001:0453b09	五柳。自號五柳先生。為彭澤令。性簡貴。不私事上	五 柳 自 號 五 柳 先 生 為 彭 澤 令 性 簡 貴 不 私 事 上 
X64n1262_001:0453b10	官。一日遣督郵至縣。吏謂應束帶見之。淵明歎曰。	官 一 日 遣 督 郵 至 縣 吏 謂 應 束 帶 見 之 淵 明 歎 曰 
X64n1262_001:0453b11	吾豈能為五斗米。折腰向鄉里小兒。即日解綬去	吾 豈 能 為 五 斗 米 折 腰 向 鄉 里 小 兒 即 日 解 綬 去 
X64n1262_001:0453b12	職。賦歸去來辭。史咏云。英俊那堪屈下僚。門栽五	職 賦 歸 去 來 辭 史 咏 云 英 俊 那 堪 屈 下 僚 門 栽 五 
X64n1262_001:0453b13	柳事蕭條。鳳凰不共鷄爭食。莫恠先生懶折腰。	柳 事 蕭 條 鳳 凰 不 共 鷄 爭 食 莫 恠 先 生 懶 折 腰 
X64n1262_001:0453b14	擁篲掃地之形也。漢高祖即位。五日一朝太公。以	擁 篲 掃 地 之 形 也 漢 高 祖 即 位 五 日 一 朝 太 公 以 
X64n1262_001:0453b15	父子禮待之。其家令。謂太公曰。高祖雖子。人主也。	父 子 禮 待 之 其 家 令 謂 太 公 曰 高 祖 雖 子 人 主 也 
X64n1262_001:0453b16	太公雖父。人臣也。柰何以人主而拜人臣。如此則	太 公 雖 父 人 臣 也 柰 何 以 人 主 而 拜 人 臣 如 此 則 
X64n1262_001:0453b17	威重不行矣。後高祖朝太公。公擁篲迎門却行。高	威 重 不 行 矣 後 高 祖 朝 太 公 公 擁 篲 迎 門 却 行 高 
X64n1262_001:0453b18	祖大驚。下扶太公。公曰。帝。人主也。柰何以我亂天	祖 大 驚 下 扶 太 公 公 曰 帝 人 主 也 柰 何 以 我 亂 天 
X64n1262_001:0453b19	下之法。於是高祖。尊太公為太上皇帝。善家令之	下 之 法 於 是 高 祖 尊 太 公 為 太 上 皇 帝 善 家 令 之 
X64n1262_001:0453b20	言。賜金五百斤也。	言 賜 金 五 百 斤 也 
X64n1262_001:0453b21	酸寒言怖畏之勢。身酸心寒也。	酸 寒 言 怖 畏 之 勢 身 酸 心 寒 也 
X64n1262_001:0453b22	跼蹐上。曲身也。下。累足小步也。謂人恐懼。其身不	跼 蹐 上 曲 身 也 下 累 足 小 步 也 謂 人 恐 懼 其 身 不 
X64n1262_001:0453b23	敢伸。足不敢放。謟勢如此也。	敢 伸 足 不 敢 放 謟 勢 如 此 也 
X64n1262_001:0453b24	鍾聚也。申明也。呈也。	鍾 聚 也 申 明 也 呈 也 
X64n1262_001:0453c01	膜拜長跪也。誅明其罪而殺之。曰誅。	膜 拜 長 跪 也 誅 明 其 罪 而 殺 之 曰 誅 
X64n1262_001:0453c02	錄收錄其名。而考其罪。曰錄。	錄 收 錄 其 名 而 考 其 罪 曰 錄 
X64n1262_001:0453c03	贖納金免罪曰贖。	贖 納 金 免 罪 曰 贖 
X64n1262_001:0453c04	僧遠齊高祖建元元年。庚辰八月。有事駕臨鍾山。	僧 遠 齊 高 祖 建 元 元 年 庚 辰 八 月 有 事 駕 臨 鍾 山 
X64n1262_001:0453c05	因幸沙門僧遠。帝訪之。遠床坐辭老疾不迎。高祖	因 幸 沙 門 僧 遠 帝 訪 之 遠 床 坐 辭 老 疾 不 迎 高 祖 
X64n1262_001:0453c06	將詣床下見之。左右曰。房榻窄狹。不能容輿葢。遂	將 詣 床 下 見 之 左 右 曰 房 榻 窄 狹 不 能 容 輿 葢 遂 
X64n1262_001:0453c07	駐輦。慇懃致問而去。且遠居山五十餘年。初時飲	駐 輦 慇 懃 致 問 而 去 且 遠 居 山 五 十 餘 年 初 時 飲 
X64n1262_001:0453c08	食不繼。澗飲木食。二十餘年。諸方仰其高風。壽終	食 不 繼 澗 飲 木 食 二 十 餘 年 諸 方 仰 其 高 風 壽 終 
X64n1262_001:0453c09	之日。以表奏帝。帝遂以為師。御葬鍾山焉。	之 日 以 表 奏 帝 帝 遂 以 為 師 御 葬 鍾 山 焉 
X64n1262_001:0453c10	慧遠廬山東林虎溪慧遠禪師。雁門樓煩賈氏子。	慧 遠 廬 山 東 林 虎 溪 慧 遠 禪 師 雁 門 樓 煩 賈 氏 子 
