X65n1281_007:0237a13	歷三際。歷歷三際而了了無際。則此不無之無。即為	歷 三 際 歷 歷 三 際 而 了 了 無 際 則 此 不 無 之 無 即 為 
X65n1281_007:0237a14	不有之有。而無際實際矣。然則安得有所謂截斷洪	不 有 之 有 而 無 際 實 際 矣 然 則 安 得 有 所 謂 截 斷 洪 
X65n1281_007:0237a15	流自往還者耶。既有往有還。則未甞截斷。既有往還	流 自 往 還 者 耶 既 有 往 有 還 則 未 甞 截 斷 既 有 往 還 
X65n1281_007:0237a16	之自。則已墮洪流。且此洪流。不舍晝夜者。正是不動	之 自 則 已 墮 洪 流 且 此 洪 流 不 舍 晝 夜 者 正 是 不 動 
X65n1281_007:0237a17	道場。若云截斷。即為外道。蓋洪流必無截斷之理。而	道 場 若 云 截 斷 即 為 外 道 蓋 洪 流 必 無 截 斷 之 理 而 
X65n1281_007:0237a18	不截原無不斷之流。於此未明。又復將何為月。將何	不 截 原 無 不 斷 之 流 於 此 未 明 又 復 將 何 為 月 將 何 
X65n1281_007:0237a19	為印耶。藏忍父子。妄認古人前後際斷。大死大活等	為 印 耶 藏 忍 父 子 妄 認 古 人 前後際斷 大 死 大 活 等 
X65n1281_007:0237a20	語。為實法。於是以一睡五日為大死。聞折竹聲驚醒	語 為 實 法 於 是 以 一 睡 五 日 為 大 死 聞 折 竹 聲 驚 醒 
X65n1281_007:0237a21	為大活。將五日之前後為前後際斷。豈知這一覺醒	為 大 活 將 五 日 之 前 後 為 前後際斷 豈 知 這 一 覺 醒 
X65n1281_007:0237a22	來。仍只是箇竹葉精靈。直饒一覺醒來。會得移星換	來 仍 只 是 箇 竹 葉 精 靈 直 饒 一 覺 醒 來 會 得 移 星 換 
X65n1281_007:0237a23	斗。乘雲吐霧。種種神通。也只是箇竹葉精靈在。未曾	斗 乘 雲 吐 霧 種 種 神 通 也 只 是 箇 竹 葉 精 靈 在 未 曾 
X65n1281_007:0237a24	前後際斷也。乃漫疑密雲銅官山頂情與無情煥然	前後際斷 也 乃 漫 疑 密 雲 銅 官 山 頂 情 與 無 情 煥 然 
X65n1281_007:0237b01	頓現。與此境界相似。而譏密雲守住這箇境界。不求	頓 現 與 此 境 界 相 似 而 譏 密 雲 守 住 這 箇 境 界 不 求 
X65n1281_007:0237b02	更進。不如魔藏得此之後。又學得三元三要等。許多	更 進 不 如 魔 藏 得 此 之 後 又 學 得 三 元 三 要 等 許 多 
X65n1281_007:0237b03	法門。故曰。老魚持鮒便歸去。安得龍珠掌上看。此等	法 門 故 曰 老 魚 持 鮒 便 歸 去 安 得 龍 珠 掌 上 看 此 等 
X65n1281_007:0237b04	魔說。實能斷絕慧命。果能前後際斷。縱使釋迦牟尼	魔 說 實 能 斷 絕 慧 命 果 能 前後際斷 縱 使 釋 迦 牟 尼 
X65n1281_007:0237b05	佛出世。親口傳與佛法。亦不肯要。說甚龍珠。唯其人	佛 出 世 親 口 傳 與 佛 法 亦 不 肯 要 說 甚 龍 珠 唯 其 人 
X65n1281_007:0237b06	法兩空。是以前後際斷。豈有前後際斷之後。別去學	法 兩 空 是 以 前後際斷 豈 有 前後際斷 之 後 別 去 學 
X65n1281_007:0237b07	甚元要法門之理。密雲老漁。却已知真諦中無一法	甚 元 要 法 門 之 理 密 雲 老 漁 却 已 知 真 諦 中 無 一 法 
X65n1281_007:0237b08	可得。是箇滿船空載月明歸。并且未甞持鮒去。而藏	可 得 是 箇 滿 船 空 載 月 明 歸 并 且 未 甞 持 鮒 去 而 藏 
X65n1281_007:0237b09	忍父子。造出無邊龍蜃樓臺。誇逞弄珠好手。正其所	忍 父 子 造 出 無 邊 龍 蜃 樓 臺 誇 逞 弄 珠 好 手 正 其 所 
X65n1281_007:0237b10	以為魔也。	以 為 魔 也 
X65n1281_007:0237b11	魔忍又記曰。後參三元要。於兩堂首座同喝處。忽爾	魔 忍 又 記 曰 後 參 三 元 要 於 兩 堂 首 座 同 喝 處 忽 爾 
X65n1281_007:0237b12	符契。乃取覺範智證傳讀之。四百餘年。不分延促。如	符 契 乃 取 覺 範 智 證 傳 讀 之 四 百 餘 年 不 分 延 促 如 
X65n1281_007:0237b13	在室中親受印記。遂欣然奉高峰為印心。覺範為印	在 室 中 親 受 印 記 遂 欣 然 奉 高 峰 為 印 心 覺 範 為 印 
X65n1281_007:0237b14	法。且傷覺公無後。意欲遙嗣之。於是閉門高臥。惟以	法 且 傷 覺 公 無 後 意 欲 遙 嗣 之 於 是 閉 門 高 臥 惟 以 
X65n1281_007:0237b15	所得質之古人。研極五宗之妙。著五宗原。	所 得 質 之 古 人 研 極 五 宗 之 妙 著 五 宗 原 
X65n1281_007:0237b16	藏忍父子曾記誦內外諸典。故剽竊摸擬。如鸚鵡能	藏 忍 父 子 曾 記 誦 內 外 諸 典 故 剽 竊 摸 擬 如 鸚 鵡 能 
X65n1281_007:0237b17	作人言。歷歷可聽。不知終是鳥語。未得人身。夫所為	作 人 言 歷 歷 可 聽 不 知 終 是 鳥 語 未 得 人 身 夫 所 為 
X65n1281_007:0237b18	四百餘年不分延促。非時之謂耶。所為如在一堂親	四 百 餘 年 不 分 延 促 非 時 之 謂 耶 所 為 如 在 一 堂 親 
X65n1281_007:0237b19	受印記。非法之謂耶。中觀論偈云。時住不可得。時去	受 印 記 非 法 之 謂 耶 中 觀 論 偈 云 時 住 不 可 得 時 去 
X65n1281_007:0237b20	亦叵得。時若不可得。云何說時相。因物故有時。離物	亦 叵 得 時 若 不 可 得 云 何 說 時 相 因 物 故 有 時 離 物 
X65n1281_007:0237b21	何有時。物尚無所有。何況當有時。永明曰。既無來去	何 有 時 物 尚 無 所 有 何 況 當 有 時 永 明 曰 既 無 來 去 
X65n1281_007:0237b22	之法。亦無住止之時。以因法明時。因時辨法。法既無	之 法 亦 無 住 止 之 時 以 因 法 明 時 因 時 辨 法 法 既 無 
X65n1281_007:0237b23	有。時豈成耶。世人認物為己。背覺合塵。以動為身。以	有 時 豈 成 耶 世 人 認 物 為 己 背 覺 合 塵 以 動 為 身 以 
X65n1281_007:0237b24	動為境。則顛倒行事。性心失真。境實不遷。唯心妄動。	動 為 境 則 顛 倒 行 事 性 心 失 真 境 實 不 遷 唯 心 妄 動 
X65n1281_007:0237b25	雲駛月運。舟行岸移。若得證親涅槃。則法法各住真	雲 駛 月 運 舟 行 岸 移 若 得 證 親 涅 槃 則 法 法 各 住 真 
X65n1281_007:0237c01	如之位。無有一物往來。亦未曾一念暫住。皆不相待。	如 之 位 無 有 一 物 往 來 亦 未 曾 一 念 暫 住 皆 不 相 待 
X65n1281_007:0237c02	豈其或遷。然則果能證入不遷常住一心之道。則不	豈 其 或 遷 然 則 果 能 證 入 不 遷 常 住 一 心 之 道 則 不 
X65n1281_007:0237c03	馳騁於古今。各性住於一世。豈得分區畫段。獨於覺	馳 騁 於 古 今 各 性 住 於 一 世 豈 得 分 區 畫 段 獨 於 覺 
X65n1281_007:0237c04	範四百年間。不分延促耶。既明此不分延促之理。尚	範 四 百 年 間 不 分 延 促 耶 既 明 此 不 分 延 促 之 理 尚 
X65n1281_007:0237c05	安有法可得。乃如在一堂。親受印記耶。然則所為四	安 有 法 可 得 乃 如 在 一 堂 親 受 印 記 耶 然 則 所 為 四 
X65n1281_007:0237c06	百餘年不分延促者。正如夢裏事。仍是心意識知所	百 餘 年 不 分 延 促 者 正 如 夢 裏 事 仍 是 心 意 識 知 所 
X65n1281_007:0237c07	造。何甞前後際斷。而其所為如在一堂親受印記者。	造 何 甞 前後際斷 而 其 所 為 如 在 一 堂 親 受 印 記 者 
X65n1281_007:0237c08	亦是饑人忽夢飯甑溢。未得真果腹在。乃彷彿天台	亦 是 饑 人 忽 夢 飯 甑 溢 未 得 真 果 腹 在 乃 彷 彿 天 台 
X65n1281_007:0237c09	及肇論。作此依稀似曲之論。正如鸚鵡學人言。不能	及 肇 論 作 此 依 稀 似 曲 之 論 正 如 鸚 鵡 學 人 言 不 能 
X65n1281_007:0237c10	達人意也。至於既稱前後際斷。又於三元三要閑家	達 人 意 也 至 於 既 稱 前後際斷 又 於 三 元 三 要 閑 家 
X65n1281_007:0237c11	具。著臨濟熱瞞。則並未前後際斷。若高峰印心。覺範	具 著 臨 濟 熱 瞞 則 並 未 前後際斷 若 高 峰 印 心 覺 範 
X65n1281_007:0237c12	印法。岐心與法而二之。益為妄謬。是則介葛盧所不	印 法 岐 心 與 法 而 二 之 益 為 妄 謬 是 則 介 葛 盧 所 不 
X65n1281_007:0237c13	能知。不特鸚鵡學人言矣。又曰。閉門高臥。唯以所得	能 知 不 特 鸚 鵡 學 人 言 矣 又 曰 閉 門 高 臥 唯 以 所 得 
X65n1281_007:0237c14	質之古人。夫古人何在耶。今人是也。岐今與古。又是	質 之 古 人 夫 古 人 何 在 耶 今 人 是 也 岐 今 與 古 又 是 
X65n1281_007:0237c15	未甞前後際斷之明證。如欲質之古人。何用閉門高	未 甞 前後際斷 之 明 證 如 欲 質 之 古 人 何 用 閉 門 高 
X65n1281_007:0237c16	臥。觀其閉門高臥。則未甞一見古人可知。且既自謂	臥 觀 其 閉 門 高 臥 則 未 甞 一 見 古 人 可 知 且 既 自 謂 
X65n1281_007:0237c17	有所得。則其漆桶未破。亦不必更質之古人矣。其奪	有 所 得 則 其 漆 桶 未 破 亦 不 必 更 質 之 古 人 矣 其 奪 
X65n1281_007:0237c18	弄精魂。輾轉業識中。已於言下灼然。又曰。研極五宗	弄 精 魂 輾 轉 業 識 中 已 於 言 下 灼 然 又 曰 研 極 五 宗 
X65n1281_007:0237c19	之妙。作五宗原。只一妙字。屈煞五宗。魔藏以所作五	之 妙 作 五 宗 原 只 一 妙 字 屈 煞 五 宗 魔 藏 以 所 作 五 
X65n1281_007:0237c20	宗原呈密雲。密雲不視。以書曉之曰。目原之一字。恐	宗 原 呈 密 雲 密 雲 不 視 以 書 曉 之 曰 目 原 之 一 字 恐 
X65n1281_007:0237c21	已成知解宗徒。蓋即原得字字不差。已成知解。況五	已 成 知 解 宗 徒 蓋 即 原 得 字 字 不 差 已 成 知 解 況 五 
X65n1281_007:0237c22	宗各各如大火聚。近傍著即燎却面門。作麼生原得。	宗 各 各 如大火聚 近 傍 著 即 燎 却 面 門 作 麼 生 原 得 
X65n1281_007:0237c23	魔忍又記曰。後聞天童悟和尚出世金粟。師策杖從	魔 忍 又 記 曰 後 聞 天 童 悟 和 尚 出 世 金 粟 師 策 杖 從 
X65n1281_007:0237c24	之。甫至。粟即上堂告眾曰。漢公悟處真實。學大而名	之 甫 至 粟 即 上 堂 告 眾 曰 漢 公 悟 處 真 實 學 大 而 名 
X65n1281_007:0238a01	先出世於我。所以屈身來此者。為臨濟源流耳。老僧	先 出 世 於 我 所 以 屈 身 來 此 者 為 臨 濟 源 流 耳 老 僧 
X65n1281_007:0238a02	從來不易安首座。今以累漢公。即日請師為第一座。	從 來 不 易 安 首 座 今 以 累 漢 公 即 日 請 師 為 第 一 座 
X65n1281_007:0238a03	師請粟上堂。粟舉百丈再參馬祖黃檗接臨濟公案。	師 請 粟 上 堂 粟 舉 百 丈 再 參 馬 祖 黃 檗 接 臨 濟 公 案 
X65n1281_007:0238a04	師出眾問答。當仁不讓。一眾傾仰。自是居座元寮。循	師 出 眾 問 答 當 仁 不 讓 一 眾 傾 仰 自 是 居 座 元 寮 循 
X65n1281_007:0238a05	循首眾。識者服師荷法之誠。而天童之道。亦自此愈	循 首 眾 識 者 服 師 荷 法 之 誠 而 天 童 之 道 亦 自 此 愈 
X65n1281_007:0238a06	尊矣。	尊 矣 
X65n1281_007:0238a08	事有相得而益彰。亦有相妨而並累。如溈仰父子。一	事 有 相 得 而 益 彰 亦 有 相 妨 而 並 累 如 溈 仰 父 子 一 
X65n1281_007:0238a09	堂啐啄。共闡元音。非所為相得益彰者乎。若魔忍所	堂 啐 啄 共 闡 元 音 非 所 為 相 得 益 彰 者 乎 若 魔 忍 所 
X65n1281_007:0238a10	記密雲上堂告眾語。祇是埋却密雲。何甞救得法藏。	記 密 雲 上 堂 告 眾 語 祇 是 埋 却 密 雲 何 甞 救 得 法 藏 
X65n1281_007:0238a11	密雲作闢妄救。詳載一默漢月潭吉三人記載互異。	密 雲 作 闢 妄 救 詳 載 一 默 漢 月 潭 吉 三 人 記 載 互 異 
X65n1281_007:0238a12	以見所言之誣妄。今亦不必左袒密雲臆斷藏忍。但	以 見 所 言 之 誣 妄 今 亦 不 必 左 袒 密 雲 臆 斷 藏 忍 但 
X65n1281_007:0238a13	使伊等所記果確。密雲果將臨濟源流。作奇珍異寶。	使 伊 等 所 記 果 確 密 雲 果 將 臨 濟 源 流 作 奇 珍 異 寶 
X65n1281_007:0238a14	誇示法藏。則密雲即非臨濟子孫。而其源流。亦非佛	誇 示 法 藏 則 密 雲 即 非 臨 濟 子 孫 而 其 源 流 亦 非 佛 
X65n1281_007:0238a15	祖源流矣。豈止靈龜負圖自取喪身之兆。在密雲已	祖 源 流 矣 豈 止 靈 龜 負 圖 自 取 喪 身 之 兆 在 密 雲 已 
X65n1281_007:0238a16	不足言。何況受密雲付囑之法藏。如其不然。則妄揑	不 足 言 何 況 受 密 雲 付 囑 之 法 藏 如 其 不 然 則 妄 揑 
X65n1281_007:0238a17	密雲示眾語。并謂密雲之道。得法藏為首座而愈尊。	密 雲 示 眾 語 并 謂 密 雲 之 道 得 法 藏 為 首 座 而 愈 尊 
X65n1281_007:0238a18	亦可為詐而且愚矣。自在糞坑中頭出頭沒。而牽連	亦 可 為 詐 而 且 愚 矣 自 在 糞 坑 中 頭 出 頭 沒 而 牽 連 
X65n1281_007:0238a19	密雲一坑埋却。豈非所為相妨而並累者乎。且如密	密 雲 一 坑 埋 却 豈 非 所 為 相 妨 而 並 累 者 乎 且 如 密 
X65n1281_007:0238a20	雲果有漢公悟處真實學大而名先出世於我之語。	雲 果 有 漢 公 悟 處 真 實 學 大 而 名 先 出 世 於 我 之 語 
X65n1281_007:0238a21	則密雲於法藏未到金粟以前。業已將其平生罪案。	則 密 雲 於 法 藏 未 到 金 粟 以 前 業 已 將 其 平 生 罪 案 
X65n1281_007:0238a22	一語判盡。且其所以提持法藏。使之撥轉念頭者。亦	一 語 判 盡 且 其 所 以 提 持 法 藏 使 之 撥 轉 念 頭 者 亦 
X65n1281_007:0238a23	已不遺餘力。奈伊不悟。殃及兒孫。轉奉此以為美談。	已 不 遺 餘 力 奈 伊 不 悟 殃 及 兒 孫 轉 奉 此 以 為 美 談 
X65n1281_007:0238a24	轉藉口以徵詰密雲。轉坐密雲以兩舌。誠司馬遷所	轉 藉 口 以 徵 詰 密 雲 轉 坐 密 雲 以 兩 舌 誠 司 馬 遷 所 
X65n1281_007:0238a25	云。未可一二為俗人道者也。夫法藏之病。正以挾其	云 未 可 一 二 為 俗 人 道 者 也 夫 法 藏 之 病 正 以 挾 其 
X65n1281_007:0238a26	平生解路推求所得。自謂悟處真實。識得幾字。閱過	平 生 解 路 推 求 所 得 自 謂 悟 處 真 實 識 得 幾 字 閱 過 
X65n1281_007:0238a27	世典。自詡學大。為一時盲眼士人。啞羊禪侶。一人傳	世 典 自 詡 學 大 為 一 時 盲 眼 士 人 啞 羊 禪 侶 一 人 傳 
X65n1281_007:0238b01	虗。千人傳實。自負名高。不知毗盧頂上。常寂光中。何	虗 千 人 傳 實 自 負 名 高 不 知 毗 盧 頂 上 常 寂 光 中 何 
X65n1281_007:0238b02	處安著得。若聞密雲此語後。愧念不甘。將此種入心	處 安 著 得 若 聞 密 雲 此 語 後 愧 念 不 甘 將 此 種 入 心 
X65n1281_007:0238b03	熱毒。盡情嘔却。發猛利願力。求本分相應。當不至始	熱 毒 盡 情 嘔 却 發 猛 利 願 力 求 本 分 相 應 當 不 至 始 
X65n1281_007:0238b04	終落魔落外。可憐未到金粟。早被密雲淋頭一杓惡	終 落 魔 落 外 可 憐 未 到 金 粟 早 被 密 雲 淋 頭 一 杓 惡 
X65n1281_007:0238b05	水。全然不覺。且將此水愛玩不休。傳子傳孫。此固密	水 全 然 不 覺 且 將 此 水 愛 玩 不 休 傳 子 傳 孫 此 固 密 
X65n1281_007:0238b06	雲之所不料也。	雲 之 所 不 料 也 
X65n1281_007:0238b07	魔忍又記曰。未幾。請及堂奧中事。粟不應。良久曰。宗	魔 忍 又 記 曰 未 幾 請 及 堂 奧 中 事 粟 不 應 良 久 曰 宗 
X65n1281_007:0238b08	旨太密。嗣續難乎其人。不若巳之。且先師不曾提起。	旨 太 密 嗣 續 難 乎 其 人 不 若 巳 之 且 先 師 不 曾 提 起 
X65n1281_007:0238b09	師曰。不然。黃龍有言。學者欺詐之弊。不以如來知見	師 曰 不 然 黃 龍 有 言 學 者 欺 詐 之 弊 不 以 如 來 知 見 
X65n1281_007:0238b10	之慧。密而煆之。何由能盡。且古人建立宗旨。千牢百	之 慧 密 而 煆 之 何 由 能 盡 且 古 人 建 立 宗 旨 千 牢 百 
X65n1281_007:0238b11	固。尚有乘虛接響者。混我真宗。若師家大法不明。無	固 尚 有 乘 虛 接 響 者 混 我 真 宗 若 師 家 大 法 不 明 無 
X65n1281_007:0238b12	從辨驗。則胡喝亂棒。羣然。而起。吾宗掃地矣。遂辭去。	從 辨 驗 則 胡 喝 亂 棒 羣 然 而 起 吾 宗 掃 地 矣 遂 辭 去 
X65n1281_007:0238b13	魔忍述密雲告法藏之語。謂宗旨太密。嗣續難乎其	魔 忍 述 密 雲 告 法 藏 之 語 謂 宗 旨 太 密 嗣 續 難 乎 其 
X65n1281_007:0238b14	人。不若巳之。且先師不曾提起。此數語。其為裝誣密	人 不 若 巳 之 且 先 師 不 曾 提 起 此 數 語 其 為 裝 誣 密 
X65n1281_007:0238b15	雲。可以決定無疑。蓋密雲見地。雖未到至處。然觀其	雲 可 以 決 定 無 疑 蓋 密 雲 見 地 雖 未 到 至 處 然 觀 其 
X65n1281_007:0238b16	平生語句。並未落於魔外。豈有將宗旨作麤密評量	平 生 語 句 並 未 落 於 魔 外 豈 有 將 宗 旨 作 麤 密 評 量 
X65n1281_007:0238b17	之理。這箇。若言其密。盛水不漏。未足為喻。不居內外	之 理 這 箇 若 言 其 密 盛 水 不 漏 未 足 為 喻 不 居 內 外 
X65n1281_007:0238b18	及中間。說密者亦在密裏。無你下口贊密處。若言其	及 中 間 說 密 者 亦 在 密 裏 無 你 下 口 贊 密 處 若 言 其 
X65n1281_007:0238b19	非密。正是爛柴斷索。何處尋討些些密意來。古德有	非 密 正 是 爛 柴 斷 索 何 處 尋 討 些 些 密 意 來 古 德 有 
X65n1281_007:0238b20	云。這是什麼所在。容你說麤說細。總因魔輩。以一棒	云 這 是 什 麼 所 在 容 你 說 麤 說 細 總 因 魔 輩 以 一 棒 
X65n1281_007:0238b21	為麤。以齊文定旨。逐語分宗為密。既不識一棒之密	為 麤 以 齊 文 定 旨 逐 語 分 宗 為 密 既 不 識 一 棒 之 密 
X65n1281_007:0238b22	處。又何由識齊文定旨。逐語分宗之非密乎。即曰密	處 又 何 由 識 齊 文 定 旨 逐 語 分 宗 之 非 密 乎 即 曰 密 
X65n1281_007:0238b23	甚。又與這箇有何交涉。若以此等密處。傳子傳孫。成	甚 又 與 這 箇 有 何 交 涉 若 以 此 等 密 處 傳 子 傳 孫 成 
X65n1281_007:0238b24	得恁麼閑家計。轉不若百工技藝之相傳。有濟世用。	得 恁 麼 閑 家 計 轉 不 若 百 工 技 藝 之 相 傳 有 濟 世 用 
X65n1281_007:0238b25	何可比兵農禮樂之專業。實裨治功。然則佛佛祖祖	何 可 比 兵 農 禮 樂 之 專 業 實 裨 治 功 然 則 佛 佛 祖 祖 
X65n1281_007:0238b26	授記。作人天眼目者。乃是一場笑具耶。欲得不遭無	授 記 作 人 天 眼 目 者 乃 是 一 場 笑 具 耶 欲 得 不 遭 無 
X65n1281_007:0238c01	間業。莫謗如來正法輪。密雲之必不曾謗佛。固可深	間 業 莫 謗 如 來 正 法 輪 密 雲 之 必 不 曾 謗 佛 固 可 深 
X65n1281_007:0238c02	信。密雲既不謗佛。則藏忍父子之破妄語戒。所必然	信 密 雲 既 不 謗 佛 則 藏 忍 父 子 之 破 妄 語 戒 所 必 然 
X65n1281_007:0238c03	矣。至法藏答密雲曰。黃龍有言。學者欺詐之弊。不以	矣 至 法 藏 答 密 雲 曰 黃 龍 有 言 學 者 欺 詐 之 弊 不 以 
X65n1281_007:0238c04	如來知見之慧密而煆之。何由能盡。黃龍此語。便是	如 來 知 見 之 慧 密 而 煆 之 何 由 能 盡 黃 龍 此 語 便 是 
X65n1281_007:0238c05	亂統。夫了了知。無所知。了了見。無能見。而謂如來有	亂 統 夫 了 了 知 無 所 知 了 了 見 無 能 見 而 謂 如 來 有 
X65n1281_007:0238c06	知見之慧耶。若通如來有知見之慧。正是第一箇欺	知 見 之 慧 耶 若 通 如 來 有 知 見 之 慧 正 是 第 一 箇 欺 
X65n1281_007:0238c07	詐學徒。孟八郎漢。夫學人欺詐。與如來知見。翻手覆	詐 學 徒 孟 八 郎 漢 夫 學 人 欺 詐 與 如 來 知 見 翻 手 覆 
X65n1281_007:0238c08	手。只是一手。在學人一舉手翻覆之耳。若要師家出	手 只 是 一 手 在 學 人 一 舉 手 翻 覆 之 耳 若 要 師 家 出 
X65n1281_007:0238c09	如來知見之慧。煆學人欺詐之弊。恐海枯石爛。未有	如 來 知 見 之 慧 煆 學 人 欺 詐 之 弊 恐 海 枯 石 爛 未 有 
X65n1281_007:0238c10	盡時。何以故。鎔金須用火。斷無以金鎔金之理也。且	盡 時 何 以 故 鎔 金 須 用 火 斷 無 以 金 鎔 金 之 理 也 且 
X65n1281_007:0238c11	既已欺詐。即未曾起信。既未曾起信。即是眾生。如何	既 已 欺 詐 即 未 曾 起 信 既 未 曾 起 信 即 是 眾 生 如 何 
X65n1281_007:0238c12	稱得學人。如曰。吾有如來知見之慧。吾將以此密而	稱 得 學 人 如 曰 吾 有 如 來 知 見 之 慧 吾 將 以 此 密 而 
X65n1281_007:0238c13	煆之。則我見橫前。又是一箇眾生。安得有眾生度眾	煆 之 則 我 見 橫 前 又 是 一 箇 眾 生 安 得 有 眾 生 度 眾 
X65n1281_007:0238c14	生之理。又曰。古人建立宗旨。千牢百固。尚有乘虗接	生 之 理 又 曰 古 人 建 立 宗 旨 千 牢 百 固 尚 有 乘 虗 接 
X65n1281_007:0238c15	響者。混我真宗。此言埋沒古人不少。未知伊於何處	響 者 混 我 真 宗 此 言 埋 沒 古 人 不 少 未 知 伊 於 何 處 
X65n1281_007:0238c16	見得古人建立宗旨。又於何處見得什麼千牢百固。	見 得 古 人 建 立 宗 旨 又 於 何 處 見 得 什 麼 千 牢 百 固 
X65n1281_007:0238c17	若古人有如是建立者。即是魔外。古德不云乎。淨躶	若 古 人 有 如 是 建 立 者 即 是 魔 外 古 德 不 云 乎 淨 躶 
X65n1281_007:0238c18	躶。赤灑灑。沒可把。然則何處著此千牢百固之宗旨	躶 赤 灑 灑 沒 可 把 然 則 何 處 著 此 千 牢 百 固 之 宗 旨 
X65n1281_007:0238c19	耶。如曰。正此淨躶躶。赤灑灑。沒可把者。是箇千牢百	耶 如 曰 正 此 淨 躶 躶 赤 灑 灑 沒 可 把 者 是 箇 千 牢 百 
X65n1281_007:0238c20	固之宗旨。則早已不曾淨躶躶赤灑灑。而亦有可把	固 之 宗 旨 則 早 已 不 曾 淨 躶 躶 赤 灑 灑 而 亦 有 可 把 
X65n1281_007:0238c21	了也。夫此真宗。竪窮三際。橫亘十方。豈有一絲毫不	了 也 夫 此 真 宗 竪 窮 三 際 橫 亘 十 方 豈 有 一 絲 毫 不 
X65n1281_007:0238c22	在裏許。而曰乘虗接響者。混我真宗。此宗。豈亦是世	在 裏 許 而 曰 乘 虗 接 響 者 混 我 真 宗 此 宗 豈 亦 是 世 
X65n1281_007:0238c23	法宗族之宗。晉推王謝。唐推崔盧。甲乙門第。不許小	法 宗 族 之 宗 晉 推 王 謝 唐 推 崔 盧 甲 乙 門 第 不 許 小 
X65n1281_007:0238c24	姓混入大姓耶。向大圓鏡裏。鼓動心機。於無脫法中。	姓 混 入 大 姓 耶 向 大 圓 鏡 裏 鼓 動 心 機 於 無 脫 法 中 
X65n1281_007:0239a01	自生繫縛。寧非癡甚。鴉鳴鵲噪。盡說菩提。竹翠花黃。	自 生 繫 縛 寧 非 癡 甚 鴉 鳴 鵲 噪 盡 說 菩 提 竹 翠 花 黃 
X65n1281_007:0239a02	咸明般若。何處有乘虗接響之者。如曰乘虗接響。亦	咸 明 般 若 何 處 有 乘 虗 接 響 之 者 如 曰 乘 虗 接 響 亦 
X65n1281_007:0239a03	彼自乘虗接響。豈能混此真宗。不見鴉鳴鵲噪。竹翠	彼 自 乘 虗 接 響 豈 能 混 此 真 宗 不 見 鴉 鳴 鵲 噪 竹 翠 
X65n1281_007:0239a04	花黃。曾經混却。鴉鳴鵲噪。竹翠花黃。轉明得這箇圓	花 黃 曾 經 混 却 鴉 鳴 鵲 噪 竹 翠 花 黃 轉 明 得 這 箇 圓 
X65n1281_007:0239a05	融無盡。即今藏忍父子。以邪魔外道。乘虗接響。亦是	融 無 盡 即 今 藏 忍 父 子 以 邪 魔 外 道 乘 虗 接 響 亦 是 
X65n1281_007:0239a06	伊父子自成邪魔外道耳。真宗豈曾被伊混却。且所	伊 父 子 自 成 邪 魔 外 道 耳 真 宗 豈 曾 被 伊 混 却 且 所 
X65n1281_007:0239a07	為宗者何歟。請未論其宗。先除其我。今乃轉將此宗	為 宗 者 何 歟 請 未 論 其 宗 先 除 其 我 今 乃 轉 將 此 宗 
X65n1281_007:0239a08	屬之於我。我相千牢百固。而恐他人之乘虗接響以	屬 之 於 我 我 相 千 牢 百 固 而 恐 他 人 之 乘 虗 接 響 以 
X65n1281_007:0239a09	混之。譬如將糞水洗旃檀。而欲去其塵垢。不知糞水	混 之 譬 如 將 糞 水 洗 旃 檀 而 欲 去 其 塵 垢 不 知 糞 水 
X65n1281_007:0239a10	之更污於塵垢也。乃欲以此辨驗學人。是又譬如以	之 更 污 於 塵 垢 也 乃 欲 以 此 辨 驗 學 人 是 又 譬 如 以 
X65n1281_007:0239a11	糞草之火。燒旃檀。而欲辨其香之高下也。作麼生辨	糞 草 之 火 燒 旃 檀 而 欲 辨 其 香 之 高 下 也 作 麼 生 辨 
X65n1281_007:0239a12	得。總之此段公案。皆是魔藏住安隱後。以宗旨迷誤	得 總 之 此 段 公 案 皆 是 魔 藏 住 安 隱 後 以 宗 旨 迷 誤 
X65n1281_007:0239a13	學人。魔魅外護。密雲聞之。切加呵斥。伊遂背師滅父。	學 人 魔 魅 外 護 密 雲 聞 之 切 加 呵 斥 伊 遂 背 師 滅 父 
X65n1281_007:0239a14	欲必伸其說而後止。於是揑造誑語。揜飾受囑之由。	欲 必 伸 其 說 而 後 止 於 是 揑 造 誑 語 揜 飾 受 囑 之 由 
X65n1281_007:0239a15	以為受囑於密雲者。係密雲攀伊為高弟。非伊心悅	以 為 受 囑 於 密 雲 者 係 密 雲 攀 伊 為 高 弟 非 伊 心 悅 
X65n1281_007:0239a16	誠服。奉密雲為真師而已。天下後世明眼人。必不可	誠 服 奉 密 雲 為 真 師 而 已 天 下 後 世 明 眼 人 必 不 可 
