X65n1281_005:0223a30	取者。因知十智同真。亦屬解路。況如此推演開去。何	取 者 因 知 十 智 同 真 亦 屬 解 路 況 如 此 推 演 開 去 何 
X65n1281_005:0223a31	所底止。正同入海算沙。未能啟初學之疑情。先牽引	所 底 止 正 同 入 海 算 沙 未 能 啟 初 學 之 疑 情 先 牽 引 
X65n1281_005:0223a32	入於知解宗徒。亦無裨於發心參學者。葢其平生得	入 於 知 解 宗 徒 亦 無 裨 於 發 心 參 學 者 葢 其 平 生 得 
X65n1281_005:0223a33	力處。不過三元三要閑家具。未踏向上一著在。今觀	力 處 不 過 三 元 三 要 閑 家 具 未 踏 向 上 一 著 在 今 觀 
X65n1281_005:0223b01	其三元三要總頌分頌。亦屬言中取則。意下推求。以	其 三 元 三 要 總 頌 分 頌 亦 屬 言 中 取 則 意 下 推 求 以 
X65n1281_005:0223b02	明三元三要則可矣。與這箇沒交涉。魔忍倚為泰山。	明 三 元 三 要 則 可 矣 與 這 箇 沒 交 涉 魔 忍 倚 為 泰 山 
X65n1281_005:0223b03	以斥密雲三元三要。為臨濟一時上堂語之非。反覆	以 斥 密 雲 三 元 三 要 為 臨 濟 一 時 上 堂 語 之 非 反 覆 
X65n1281_005:0223b04	辨論。推尊三元三要。為箇事極則。足知伊於三元三	辨 論 推 尊 三 元 三 要 為 箇 事 極 則 足 知 伊 於 三 元 三 
X65n1281_005:0223b05	要。亦未夢見在。三元三要。十智同真。又豈著得爭競	要 亦 未 夢 見 在 三 元 三 要 十 智 同 真 又 豈 著 得 爭 競 
X65n1281_005:0223b06	耶。至密雲悟謂三元既已劈破。後世不當復有三元。	耶 至 密 雲 悟 謂 三 元 既 已 劈 破 後 世 不 當 復 有 三 元 
X65n1281_005:0223b07	固屬拙語。而魔忍笑其認三元為泥丸土鼓。將汾陽	固 屬 拙 語 而 魔 忍 笑 其 認 三 元 為 泥 丸 土 鼓 將 汾 陽 
X65n1281_005:0223b08	劈破之義。顢頇過去。謂如畫龍點眼。益為漆桶。夫泥	劈 破 之 義 顢 頇 過 去 謂 如 畫 龍 點 眼 益 為 漆 桶 夫 泥 
X65n1281_005:0223b09	丸土鼓。安見不是三元三要。豈特泥丸土鼓中。即具	丸 土 鼓 安 見 不 是 三 元 三 要 豈 特 泥 丸 土 鼓 中 即 具 
X65n1281_005:0223b10	三元三要。若能於泥丸土鼓。直下承當。却正好劈破	三 元 三 要 若 能 於 泥 丸 土 鼓 直 下 承 當 却 正 好 劈 破 
X65n1281_005:0223b11	三元三要。銷除十智同真。淨躶躶。赤灑灑。直達寶所。	三 元 三 要 銷 除 十 智 同 真 淨 躶 躶 赤 灑 灑 直 達 寶 所 
X65n1281_005:0223b12	圓通無礙。肯向三元三要十智同真等閑言賸語。作	圓 通 無 礙 肯 向 三 元 三 要 十 智 同 真 等 閑 言 賸 語 作 
X65n1281_005:0223b13	門前之遶耶。魔忍又以汾陽總頌三元處。非為抹却	門 前 之 遶 耶 魔 忍 又 以 汾 陽 總 頌 三 元 處 非 為 抹 却 
X65n1281_005:0223b14	三元。若總頌是抹却者。分頌豈非自禁自犯。汾陽昏	三 元 若 總 頌 是 抹 却 者 分 頌 豈 非 自 禁 自 犯 汾 陽 昏 
X65n1281_005:0223b15	悖。不至於此。不知此無是無非法門。安可以情見卜	悖 不 至 於 此 不 知 此 無 是 無 非 法 門 安 可 以 情 見 卜 
X65n1281_005:0223b16	度。當汾陽總頌三元。亦不得謂之禁。迨後分頌三元。	度 當 汾 陽 總 頌 三 元 亦 不 得 謂 之 禁 迨 後 分 頌 三 元 
X65n1281_005:0223b17	又安得謂之犯。且汾陽明明說三元三要事難分矣。	又 安 得 謂 之 犯 且 汾 陽 明 明 說 三 元 三 要 事 難 分 矣 
X65n1281_005:0223b18	又分第一元。第二元。第三元。各為之頌。試問謂分耶	又 分 第 一 元 第 二 元 第 三 元 各 為 之 頌 試 問 謂 分 耶 
X65n1281_005:0223b19	不分耶。不解者。若曰昏悖。此亦昏悖極矣。魔忍何以	不 分 耶 不 解 者 若 曰 昏 悖 此 亦 昏 悖 極 矣 魔 忍 何 以 
X65n1281_005:0223b20	又畏忌而不敢指斥。而專指斥密雲耶。至於密雲引	又 畏 忌 而 不 敢 指 斥 而 專 指 斥 密 雲 耶 至 於 密 雲 引 
X65n1281_005:0223b21	汾陽十八問盡皆打得語。為一棒之據。而魔忍謂非	汾 陽 十 八 問 盡 皆 打 得 語 為 一 棒 之 據 而 魔 忍 謂 非 
X65n1281_005:0223b22	肘後有符者。如何識得破。既未識得破。如何打得。足	肘 後 有 符 者 如 何 識 得 破 既 未 識 得 破 如 何 打 得 足 
X65n1281_005:0223b23	知伊將一棒作實法會。不特喫棒未有了期。且亦并	知 伊 將 一 棒 作 實 法 會 不 特 喫 棒 未 有 了 期 且 亦 并 
X65n1281_005:0223b24	無棒喫分在。汾陽所為識得破者。豈在意言象數邊	無 棒 喫 分 在 汾 陽 所 為 識 得 破 者 豈 在 意 言 象 數 邊 
X65n1281_005:0223c01	識取。如必識得意言象數。則恒河沙數法門。又豈十	識 取 如 必 識 得 意 言 象 數 則 恒 河 沙 數 法 門 又 豈 十 
X65n1281_005:0223c02	八問之所能該。雖有阿難之多聞。又如何識得盡。如	八 問 之 所 能 該 雖 有 阿 難 之 多 聞 又 如 何 識 得 盡 如 
X65n1281_005:0223c03	果無一不記。無一不通。則其人八識田中。裝滿如許	果 無 一 不 記 無 一 不 通 則 其 人 八 識 田 中 裝 滿 如 許 
X65n1281_005:0223c04	絡索。情見熾然。其人安可與語。若離意言象數別有	絡 索 情 見 熾 然 其 人 安 可 與 語 若 離 意 言 象 數 別 有 
X65n1281_005:0223c05	者。則是已經會取十八問盡皆打得之旨趣矣。既已	者 則 是 已 經 會 取 十 八 問 盡 皆 打 得 之 旨 趣 矣 既 已 
X65n1281_005:0223c06	會得。則業已肘後有符。更別求什麼符繫肘後乎。一	會 得 則 業 已 肘 後 有 符 更 別 求 什 麼 符 繫 肘 後 乎 一 
X65n1281_005:0223c07	棒是罰是賞。是建是銷。本無實義。亦無實法。如何於	棒 是 罰 是 賞 是 建 是 銷 本 無 實 義 亦 無 實 法 如 何 於 
X65n1281_005:0223c08	此橫生分別。揑目生華耶。又謂密雲評論汾陽處。若	此 橫 生 分 別 揑 目 生 華 耶 又 謂 密 雲 評 論 汾 陽 處 若 
X65n1281_005:0223c09	三元之頌為非。則汾陽見處固非。十八問亦不足觀。	三 元 之 頌 為 非 則 汾 陽 見 處 固 非 十 八 問 亦 不 足 觀 
X65n1281_005:0223c10	如十八問為是。則汾陽見處元是。三元之頌亦是。何	如 十 八 問 為 是 則 汾 陽 見 處 元 是 三 元 之 頌 亦 是 何 
X65n1281_005:0223c11	其紛綸不定。一讚而一呵之。考密雲之於汾陽。實亦	其 紛 綸 不 定 一 讚 而 一 呵 之 考 密 雲 之 於 汾 陽 實 亦 
X65n1281_005:0223c12	未具頂[寧*頁]隻眼。並未緇素分明。故其欽重汾陽甚至。	未 具 頂 [寧頁] 隻 眼 並 未 緇 素 分 明 故 其 欽 重 汾 陽 甚 至 
X65n1281_005:0223c13	何甞敢於指斥。而魔忍亦非不知密雲並未指斥汾	何 甞 敢 於 指 斥 而 魔 忍 亦 非 不 知 密 雲 並 未 指 斥 汾 
X65n1281_005:0223c14	陽。特欲裝誣密雲。則其事莫須有。使天下後世有議	陽 特 欲 裝 誣 密 雲 則 其 事 莫 須 有 使 天 下 後 世 有 議 
X65n1281_005:0223c15	伊呵斥乃祖密雲者。將曰。密雲之於祖汾陽。亦復如	伊 呵 斥 乃 祖 密 雲 者 將 曰 密 雲 之 於 祖 汾 陽 亦 復 如 
X65n1281_005:0223c16	是。不特使疑密雲者信伊。并使信密雲者亦不疑伊。	是 不 特 使 疑 密 雲 者 信 伊 并 使 信 密 雲 者 亦 不 疑 伊 
X65n1281_005:0223c17	其術誠巧。顧其拘執謬悠之論。實足疑誤學人。不可	其 術 誠 巧 顧 其 拘 執 謬 悠 之 論 實 足 疑 誤 學 人 不 可 
X65n1281_005:0223c18	不辨。夫此圓宗。所為無是無非法者。非若外道猖狂	不 辨 夫 此 圓 宗 所 為 無 是 無 非 法 者 非 若 外 道 猖 狂 
X65n1281_005:0223c19	之見。任意縱橫。謂之無是無非也。葢以四句分之。皆	之 見 任 意 縱 橫 謂 之 無 是 無 非 也 葢 以 四 句 分 之 皆 
X65n1281_005:0223c20	無所住。無所著。則絕對待。既絕對待。則離四句。既離	無 所 住 無 所 著 則 絕 對 待 既 絕 對 待 則 離 四 句 既 離 
X65n1281_005:0223c21	四句。則絕百非。於此薦得。則千七百則公案。無全是。	四 句 則 絕 百 非 於 此 薦 得 則 千 七 百 則 公 案 無 全 是 
X65n1281_005:0223c22	無全非。無皆是皆非。無無非無是。隨舉一則而皆然。	無 全 非 無 皆 是 皆 非 無 無 非 無 是 隨 舉 一 則 而 皆 然 
X65n1281_005:0223c23	然後可於無等級中。分霄分壤。無分別中。辨澠辨淄。	然 後 可 於 無 等 級 中 分 霄 分 壤 無 分 別 中 辨 澠 辨 淄 
X65n1281_005:0223c24	否則纔有是非。紛然失心。自救不了。如何為人。夫就	否 則 纔 有 是 非 紛 然 失 心 自 救 不 了 如 何 為 人 夫 就 
X65n1281_005:0224a01	一則公案。尚且如是。豈可於一人平生公案內。謂三	一 則 公 案 尚 且 如 是 豈 可 於 一 人 平 生 公 案 內 謂 三 
X65n1281_005:0224a02	元頌是。則十八問必無非。十八問非。則三元頌必無	元 頌 是 則 十 八 問 必 無 非 十 八 問 非 則 三 元 頌 必 無 
X65n1281_005:0224a03	是耶。從其是而言之。三元頌亦是。十八問亦是。從其	是 耶 從 其 是 而 言 之 三 元 頌 亦 是 十 八 問 亦 是 從 其 
X65n1281_005:0224a04	非而言之。三元頌亦非。十八問亦非。從其有是有非	非 而 言 之 三 元 頌 亦 非 十 八 問 亦 非 從 其 有 是 有 非 
X65n1281_005:0224a05	言之。三元頌亦有是有非。十八問亦有是有非。從其	言 之 三 元 頌 亦 有 是 有 非 十 八 問 亦 有 是 有 非 從 其 
X65n1281_005:0224a06	無非無是言之。三元頌亦無非無是。十八問亦無非	無 非 無 是 言 之 三 元 頌 亦 無 非 無 是 十 八 問 亦 無 非 
X65n1281_005:0224a07	無是。據十八問以非三元頌也可。據三元頌以非十	無 是 據 十 八 問 以 非 三 元 頌 也 可 據 三 元 頌 以 非 十 
X65n1281_005:0224a08	八問也可。據三元頌而是十八問也可。據十八問而	八 問 也 可 據 三 元 頌 而 是 十 八 問 也 可 據 十 八 問 而 
X65n1281_005:0224a09	是三元頌也可。於此薦得。則推移無定。却為緇素分	是 三 元 頌 也 可 於 此 薦 得 則 推 移 無 定 却 為 緇 素 分 
X65n1281_005:0224a10	明。於此不薦。則緇素分明。正是人法兩執。若魔忍之	明 於 此 不 薦 則 緇 素 分 明 正 是 人 法 兩 執 若 魔 忍 之 
X65n1281_005:0224a11	見。無論全未會得汾陽三元頌十八問落處在。直饒	見 無 論 全 未 會 得 汾 陽 三 元 頌 十 八 問 落 處 在 直 饒 
X65n1281_005:0224a12	分別清疎得。仍是業識茫茫。無本可據。	分 別 清 疎 得 仍 是 業 識 茫 茫 無 本 可 據 
X65n1281_005:0224a13	魔忍曰。灌嬰滕公樊噲等。從漢高起豐沛間。攻城掠	魔 忍 曰 灌 嬰 滕 公 樊 噲 等 從 漢 高 起 豐 沛 間 攻 城 掠 
X65n1281_005:0224a14	地。隨功而漸進。至漢有天下。數人者位不過封侯。至	地 隨 功 而 漸 進 至 漢 有 天 下 數 人 者 位 不 過 封 侯 至 
X65n1281_005:0224a15	若韓信。則一見而授以上將之權。此先爵而後功者	若 韓 信 則 一 見 而 授 以 上 將 之 權 此 先 爵 而 後 功 者 
X65n1281_005:0224a16	也。若夫胃處尊位而功業罔建。尠有不夷滅者。功業	也 若 夫 胃 處 尊 位 而 功 業 罔 建 尠 有 不 夷 滅 者 功 業 
X65n1281_005:0224a17	建矣。而稍自矜伐。亦尠有不夷滅者。楞嚴曰。理須頓	建 矣 而 稍 自 矜 伐 亦 尠 有 不 夷 滅 者 楞 嚴 曰 理 須 頓 
X65n1281_005:0224a18	悟。事以漸修。長沙曰。功未齊於諸聖。夫三乘十地。灌	悟 事 以 漸 修 長 沙 曰 功 未 齊 於 諸 聖 夫 三 乘 十 地 灌 
X65n1281_005:0224a19	嬰滕公比也。功勝於悟。大心凡夫超宗越格。韓信比	嬰 滕 公 比 也 功 勝 於 悟 大 心 凡 夫 超 宗 越 格 韓 信 比 
X65n1281_005:0224a20	也。悟勝於功。無功之功也。予以是觀汾陽之悟之行。	也 悟 勝 於 功 無 功 之 功 也 予 以 是 觀 汾 陽 之 悟 之 行 
X65n1281_005:0224a21	豈非直授上將。而不矜功伐者歟。	豈 非 直 授 上 將 而 不 矜 功 伐 者 歟 
X65n1281_005:0224a22	如來者。無所從來。亦無所去。往應羣機而不去。恒歸	如 來 者 無所從來 亦 無 所 去 往 應 羣 機 而 不 去 恒 歸 
X65n1281_005:0224a23	寂滅而不來。故曰如來。入此圓宗。則曰一超直入如	寂 滅 而 不 來 故 曰 如 來 入 此 圓 宗 則 曰 一 超 直 入 如 
X65n1281_005:0224a24	來地。為萬法之總持。則有法王之號。作人天之眼目。	來 地 為 萬 法 之 總 持 則 有 法 王 之 號 作 人 天 之 眼 目 
X65n1281_005:0224a25	爰有導師之稱。然此名相。畢竟虗空。讚歎徒多。虗空	爰 有 導 師 之 稱 然 此 名 相 畢 竟 虗 空 讚 歎 徒 多 虗 空 
X65n1281_005:0224a26	不受。豈若世間班爵制祿。有公侯伯子男之分。立政	不 受 豈 若 世 間 班 爵 制 祿 有 公 侯 伯 子 男 之 分 立 政 
X65n1281_005:0224a27	經邦。有君臣民事物之位。魔忍託跡宗門。馳情塵海。	經 邦 有 君 臣 民 事 物 之 位 魔 忍 託 跡 宗 門 馳 情 塵 海 
X65n1281_005:0224b01	三條衲下。裹求富貴而未得之幻軀。百尺竿頭。作留	三 條 衲 下 裹 求 富 貴 而 未 得 之 幻 軀 百 尺 竿 頭 作 留 
X65n1281_005:0224b02	聲名於千古之癡夢。加以曾涉墳典。略觀古今。記史	聲 名 於 千 古 之 癡 夢 加 以 曾 涉 墳 典 略 觀 古 今 記 史 
X65n1281_005:0224b03	氏之賸言。無可眩耀。疑古錐之心行。即是塵勞。遂以	氏 之 賸 言 無 可 眩 耀 疑 古 錐 之 心 行 即 是 塵 勞 遂 以 
X65n1281_005:0224b04	菩薩十地。等之絳灌之儔。如來正因。擬作淮陰之將。	菩薩十地 等 之 絳 灌 之 儔 如 來 正 因 擬 作 淮 陰 之 將 
X65n1281_005:0224b05	如帶如礪。移為紹承祖印之丹書。勿伐勿矜。取作涅	如 帶 如 礪 移 為 紹 承 祖 印 之 丹 書 勿 伐 勿 矜 取 作 涅 
X65n1281_005:0224b06	槃妙心之寶鑑。直是一場笑柄。尚未足云外道邪魔	槃 妙 心 之 寶 鑑 直 是 一 場 笑 柄 尚 未 足 云 外 道 邪 魔 
X65n1281_005:0224b07	也。	也 
X65n1281_005:0224b08	魔忍曰。玉在山則秀。珠在川則媚。道之在人也。寧獨	魔 忍 曰 玉 在 山 則 秀 珠 在 川 則 媚 道 之 在 人 也 寧 獨 
X65n1281_005:0224b09	不然。予觀會公。深得慈明之道。服勤甚久。至出世。而	不 然 予 觀 會 公 深 得 慈 明 之 道 服 勤 甚 久 至 出 世 而 
X65n1281_005:0224b10	同參者不知其履實踐真。深韜厚晦。去今日實霄壤。	同 參 者 不 知 其 履 實 踐 真 深 韜 厚 晦 去 今 日 實 霄 壤 
X65n1281_005:0224b11	浮山遠錄公謂首座曰。所以治心。須求妙悟。悟則神	浮 山 遠 錄 公 謂 首 座 曰 所 以 治 心 須 求 妙 悟 悟 則 神 
X65n1281_005:0224b12	和氣靜。容敬色莊。妄想情慮皆融為真心矣。以此治	和 氣 靜 容 敬 色 莊 妄 想 情 慮 皆 融 為 真 心 矣 以 此 治 
X65n1281_005:0224b13	心。心自靈妙。然後導物。孰不從化。遠公。首山之嫡孫	心 心 自 靈 妙 然 後 導 物 孰 不 從 化 遠 公 首 山 之 嫡 孫 
X65n1281_005:0224b14	也。所示如此。而近世稱悟者。狀若屠兒魁劊。出言行	也 所 示 如 此 而 近 世 稱 悟 者 狀 若 屠 兒 魁 劊 出 言 行 
X65n1281_005:0224b15	事。禽獸之不若。而世人敬之。意其有悟耳。予願好心	事 禽 獸 之 不 若 而 世 人 敬 之 意 其 有 悟 耳 予 願 好 心 
X65n1281_005:0224b16	護法而道眼未明者。以遠公言辨之。	護 法 而 道 眼 未 明 者 以 遠 公 言 辨 之 
X65n1281_005:0224b17	謂近世稱悟者。狀若屠兒魁劊。出言行事。禽獸之不	謂 近 世 稱 悟 者 狀 若 屠 兒 魁 劊 出 言 行 事 禽 獸 之 不 
X65n1281_005:0224b18	若。而世人敬之。意其有悟。此數語。不知其何所指。指	若 而 世 人 敬 之 意 其 有 悟 此 數 語 不 知 其 何 所 指 指 
X65n1281_005:0224b19	同參之廣通輩耶。抑即指伊祖密雲耶。總不過欲當	同 參 之 廣 通 輩 耶 抑 即 指 伊 祖 密 雲 耶 總 不 過 欲 當 
X65n1281_005:0224b20	時士大夫輩。勿敬他人而敬伊耳。其語言辭氣。尚是	時 士 大 夫 輩 勿 敬 他 人 而 敬 伊 耳 其 語 言 辭 氣 尚 是 
X65n1281_005:0224b21	楊岐所云神和氣靜。容敬色莊。妄想情慮。皆融為真	楊 岐 所 云 神 和 氣 靜 容 敬 色 莊 妄 想 情 慮 皆 融 為 真 
X65n1281_005:0224b22	心之悟人否。拍浮糟池中。而戒人飲酒。鼓刀屠肆裏。	心 之 悟 人 否 拍 浮 糟 池 中 而 戒 人 飲 酒 鼓 刀 屠 肆 裏 
X65n1281_005:0224b23	而勸勿殺生。令人厭惡嗤笑。况證悟之與修行。如水	而 勸 勿 殺 生 令 人 厭 惡 嗤 笑 况 證 悟 之 與 修 行 如 水 
X65n1281_005:0224b24	與米。煑而成飯。當其成也。分不得。合不得。未證悟者。	與 米 煑 而 成 飯 當 其 成 也 分 不 得 合 不 得 未 證 悟 者 
X65n1281_005:0224b25	雖歷劫修持。而有我我所。祇增益得人天福果。如有	雖 歷 劫 修 持 而 有 我 我 所 祇 增 益 得 人 天 福 果 如 有 
X65n1281_005:0224b26	水無米。飯不得成。既證悟而修持未至。其力未充。功	水 無 米 飯 不 得 成 既 證 悟 而 修 持 未 至 其 力 未 充 功 
X65n1281_005:0224b27	未齊於諸聖。如水多水少。飯不堪喫。夫所謂修行者。	未 齊 於 諸 聖 如 水 多 水 少 飯 不 堪 喫 夫 所 謂 修 行 者 
X65n1281_005:0224c01	自是六度萬行邊事。所謂夢中佛事。鏡裏莊嚴。唯夢	自 是 六 度 萬 行 邊 事 所 謂 夢 中 佛 事 鏡 裏 莊 嚴 唯 夢 
X65n1281_005:0224c02	唯鏡。即幻即真。不將夢與鏡作幻相會。然後能行滿	唯 鏡 即 幻 即 真 不 將 夢 與 鏡 作 幻 相 會 然 後 能 行 滿 
X65n1281_005:0224c03	普賢願海。而同夢與鏡觀。至若宗師為人。痛下鉗鎚。	普 賢 願 海 而 同 夢 與 鏡 觀 至 若 宗 師 為 人 痛 下 鉗 鎚 
X65n1281_005:0224c04	只要伊立地自證。遑計我此言。我此行。與屠兒魁劊	只 要 伊 立 地 自 證 遑 計 我 此 言 我 此 行 與 屠 兒 魁 劊 
X65n1281_005:0224c05	爰若。自古豈有專論語言外貌之宗師耶。古德云。或	爰 若 自 古 豈 有 專 論 語 言 外 貌 之 宗 師 耶 古 德 云 或 
X65n1281_005:0224c06	是或非人不識。安得將為人解粘去縛之施設。教人	是 或 非 人 不 識 安 得 將 為 人 解 粘 去 縛 之 施 設 教 人 
X65n1281_005:0224c07	執滯較量。則如雲門三度扣睦州門。睦州啟門即閉。	執 滯 較 量 則 如 雲 門 三 度 扣 睦 州 門 睦 州 啟 門 即 閉 
X65n1281_005:0224c08	軋折雲門一足。得非屠兒魁劊乎。臨濟於大愚肋下	軋 折 雲 門 一 足 得 非 屠 兒 魁 劊 乎 臨 濟 於 大 愚 肋 下 
X65n1281_005:0224c09	築三拳。又兩度掌其師黃檗。甚至將钁築地。謂其師	築 三 拳 又 兩 度 掌 其 師 黃 檗 甚 至 將 钁 築 地 謂 其 師 
X65n1281_005:0224c10	曰。諸方火葬。我這裏活埋。得非屠兒魁劊乎。他如尼	曰 諸 方 火 葬 我 這 裏 活 埋 得 非 屠 兒 魁 劊 乎 他 如 尼 
X65n1281_005:0224c11	問趙州如何是密密意。趙州以手搯之。俱胝因童子	問 趙 州 如 何 是 密 密 意 趙 州 以 手 搯 之 俱 胝 因 童 子 
X65n1281_005:0224c12	竪指。舉刀斫斷其指。如此等類。不可勝數。魔忍於此	竪 指 舉 刀 斫 斷 其 指 如 此 等 類 不 可 勝 數 魔 忍 於 此 
X65n1281_005:0224c13	等處。將亦生謗議耶。若不敢生謗議。何得詐分皂白。	等 處 將 亦 生 謗 議 耶 若 不 敢 生 謗 議 何 得 詐 分 皂 白 
X65n1281_005:0224c14	誑惑閭閻。且如溈山云山下作一頭水牯牛去。一邊	誑 惑 閭 閻 且 如 溈 山 云 山 下 作 一 頭 水 牯 牛 去 一 邊 
X65n1281_005:0224c15	書溈山僧。一邊書水牯牛。道是溈山僧。又是水牯牛。	書 溈 山 僧 一 邊 書 水 牯 牛 道 是 溈 山 僧 又 是 水 牯 牛 
X65n1281_005:0224c16	道是水牯牛。又是溈山僧。不知魔忍所為好心護法	道 是 水 牯 牛 又 是 溈 山 僧 不 知 魔 忍 所 為 好 心 護 法 
X65n1281_005:0224c17	者。於此當作麼生辨別。應致敬不應致敬。其敢以禽	者 於 此 當 作 麼 生 辨 別 應 致 敬 不 應 致 敬 其 敢 以 禽 
X65n1281_005:0224c18	獸目溈山乎。舉儒門禮法。以誵訛宗門之機緣。自然	獸 目 溈 山 乎 舉 儒 門 禮 法 以 誵 訛 宗 門 之 機 緣 自 然 
X65n1281_005:0224c19	方底圓葢。魔忍之意。只為密雲纔問便棒。便謂是屠	方 底 圓 葢 魔 忍 之 意 只 為 密 雲 纔 問 便 棒 便 謂 是 屠 
X65n1281_005:0224c20	兒魁劊。因而痛詆之為禽獸。以魔魅士大夫之無識	兒 魁 劊 因 而 痛 詆 之 為 禽 獸 以 魔 魅 士 大 夫 之 無 識 
X65n1281_005:0224c21	者。且以牢籠四方緇侶。令皆樂其逢迎。如此心行。却	者 且 以 牢 籠 四 方 緇 侶 令 皆 樂 其 逢 迎 如 此 心 行 却 
X65n1281_005:0224c22	是儒門中所指為禽獸之不若者也。楊岐警戒首座	是 儒 門 中 所 指 為 禽 獸 之 不 若 者 也 楊 岐 警 戒 首 座 
X65n1281_005:0224c23	之言。葢屬對病下藥。却因魔忍妄下註脚。鈍置不少。	之 言 葢 屬 對 病 下 藥 却 因 魔 忍 妄 下 註 脚 鈍 置 不 少 
X65n1281_005:0224c24	魔忍曰。昔妙喜大徹後。反於數禪客有疑。乃以問昭	魔 忍 曰 昔 妙 喜 大 徹 後 反 於 數 禪 客 有 疑 乃 以 問 昭 
X65n1281_005:0225a01	覺。覺曰。我禪如大海。你須將箇大海傾去始得。若將	覺 覺 曰 我 禪 如 大 海 你 須 將 箇 大 海 傾 去 始 得 若 將 
X65n1281_005:0225a02	鉢盂盛得些子。是伊器量如此。吾當奈何。嗟嗟。今日	鉢 盂 盛 得 些 子 是 伊 器 量 如 此 吾 當 奈 何 嗟 嗟 今 日 
X65n1281_005:0225a03	以鉢盂盛得者。若真海水。於此末世亦表表可觀矣。	以 鉢 盂 盛 得 者 若 真 海 水 於 此 末 世 亦 表 表 可 觀 矣 
X65n1281_005:0225a04	其所盛又皆污穢不堪之物。便欲撥棄師法。顛狂橫	其 所 盛 又 皆 污 穢 不 堪 之 物 便 欲 撥 棄 師 法 顛 狂 橫 
X65n1281_005:0225a05	悖。牢不可開。三復白雲之語。為之涕泗。	悖 牢 不 可 開 三 復 白 雲 之 語 為 之 涕 泗 
X65n1281_005:0225a06	須將大海來。傾取大海去。迷則海心渴死。悟來無盡	須 將 大 海 來 傾 取 大 海 去 迷 則 海 心 渴 死 悟 來 無 盡 
X65n1281_005:0225a07	無邊。葢此大圓覺海。不共而不分。不出而不入。不可	無 邊 葢 此 大 圓 覺 海 不 共 而 不 分 不 出 而 不 入 不 可 
X65n1281_005:0225a08	以智知。不可以識識。無大小垢淨之差別。從上古德	以 智 知 不 可 以 識 識 無 大 小 垢 淨 之 差 別 從 上 古 德 
X65n1281_005:0225a09	相傳。不過爾如是。我亦如是。如是。則以一針尖舉滴	相 傳 不 過 爾 如 是 我 亦 如 是 如 是 則 以 一 針 尖 舉 滴 
X65n1281_005:0225a10	水。而與大海之潤性無差。不如是。則雖河伯望洋。而	水 而 與 大 海 之 潤 性 無 差 不 如 是 則 雖 河 伯 望 洋 而 
X65n1281_005:0225a11	有見笑大方之歎。況乃以鉢盂盛取者乎。魔忍謂今	有 見 笑 大 方 之 歎 況 乃 以 鉢 盂 盛 取 者 乎 魔 忍 謂 今 
X65n1281_005:0225a12	日以鉢盂盛得者。若真海水。於此末世。亦表表可觀	日 以 鉢 盂 盛 得 者 若 真 海 水 於 此 末 世 亦 表 表 可 觀 
X65n1281_005:0225a13	矣。其所盛又皆污穢不堪之物。便欲撥棄師法。顛狂	矣 其 所 盛 又 皆 污 穢 不 堪 之 物 便 欲 撥 棄 師 法 顛 狂 
X65n1281_005:0225a14	橫悖。牢不可開。三復白雲之言。為之涕泗。不知鉢盂	橫 悖 牢 不 可 開 三 復 白 雲 之 言 為 之 涕 泗 不 知 鉢 盂 
X65n1281_005:0225a15	盛得。即非海水。并此鉢盂。亦在海中。如何盛取。上天	盛 得 即 非 海 水 并 此 鉢 盂 亦 在 海 中 如 何 盛 取 上 天 
X65n1281_005:0225a16	下地。古之今之。如魚在水。通身是水。若泊沙泥。而呴	下 地 古 之 今 之 如 魚 在 水 通 身 是 水 若 泊 沙 泥 而 呴 
X65n1281_005:0225a17	取勺水。則魚將為非魚矣。乃鰓鰓然。較量鉢盂所盛	取 勺 水 則 魚 將 為 非 魚 矣 乃 鰓 鰓 然 較 量 鉢 盂 所 盛 
X65n1281_005:0225a18	之是海水。非海水。是垢。是淨。總因伊未見大海故。若	之 是 海 水 非 海 水 是 垢 是 淨 總 因 伊 未 見 大 海 故 若 
X65n1281_005:0225a19	真到大海。自然不生是非垢淨之想。自然知得盛入	真 到 大 海 自 然 不 生 是 非 垢 淨 之 想 自 然 知 得 盛 入 
X65n1281_005:0225a20	鉢盂。即為鉢盂。不為大海。斷無表表可觀之理。且既	鉢 盂 即 為 鉢 盂 不 為 大 海 斷 無 表 表 可 觀 之 理 且 既 
X65n1281_005:0225a21	入鉢盂。即為死水。日炙風吹。塵蒙土坌。即便污穢不	入 鉢 盂 即 為 死 水 日 炙 風 吹 塵 蒙 土 坌 即 便 污 穢 不 
X65n1281_005:0225a22	堪。雖從龍王手內分來。究竟背離真海水。若欲得真	堪 雖 從 龍 王 手 內 分 來 究 竟 背 離 真 海 水 若 欲 得 真 
