X65n1281_002:0207a13	於是不復再遣人遺以鹽三斤耶。藏忍兩盲驢。聞此	於 是 不 復 再 遣 人 遺 以 鹽 三 斤 耶 藏 忍 兩 盲 驢 聞 此 
X65n1281_002:0207a14	不知亦發一笑否。	不 知 亦 發 一 笑 否 
X65n1281_002:0207a15	魔忍曰。三問三打。古今惟黃蘗一人。又止於接臨濟	魔 忍 曰 三 問 三 打 古 今 惟 黃 蘗 一 人 又 止 於 接 臨 濟 
X65n1281_002:0207a16	一用。若再問。則效顰者蠭然而起矣。況千問千棒。萬	一 用 若 再 問 則 效 顰 者 蠭 然 而 起 矣 況 千 問 千 棒 萬 
X65n1281_002:0207a17	問萬打。可至今日而無弊乎。昔者昭覺勤禪師常曰。	問 萬 打 可 至 今 日 而 無 弊 乎 昔 者 昭 覺 勤 禪 師 常 曰 
X65n1281_002:0207a18	近來諸方盡成窠臼。五祖下我與佛鑑佛眼三人結	近 來 諸 方 盡 成 窠 臼 五 祖 下 我 與 佛 鑑 佛 眼 三 人 結 
X65n1281_002:0207a19	社參禪。如今早見漏逗出來。佛鑑下。有一種作狗子	社 參 禪 如 今 早 見 漏 逗 出 來 佛 鑑 下 有 一 種 作 狗 子 
X65n1281_002:0207a20	呌。鵓鳩鳴。取笑人。佛眼下。有一種覰燈籠露柱。指東	呌 鵓 鳩 鳴 取 笑 人 佛 眼 下 有 一 種 覰 燈 籠 露 柱 指 東 
X65n1281_002:0207a21	畫西。如眼見鬼。我這裏且無這兩般病。妙喜曰。擊石	畫 西 如 眼 見 鬼 我 這 裏 且 無 這 兩 般 病 妙 喜 曰 擊 石 
X65n1281_002:0207a22	火。閃電光。引得無限人弄業識。舉了便會了。豈不是	火 閃 電 光 引 得 無 限 人 弄 業 識 舉 了 便 會 了 豈 不 是 
X65n1281_002:0207a23	佛法大窠臼。勤不覺吐舌。乃曰休管他。我以契證為	佛 法 大 窠 臼 勤 不 覺 吐 舌 乃 曰 休 管 他 我 以 契 證 為 
X65n1281_002:0207a24	期。若不契證。斷不放過。妙喜曰。契證即得。若只恁麼	期 若 不 契 證 斷 不 放 過 妙 喜 曰 契 證 即 得 若 只 恁 麼 
X65n1281_002:0207a25	傳將去。舉了便會了。硬作主張。擊石火。閃電光。業識	傳 將 去 舉 了 便 會 了 硬 作 主 張 擊 石 火 閃 電 光 業 識 
X65n1281_002:0207a26	茫茫。未有了日。勤深肯之。噫。證之一字。惟宗旨可以	茫 茫 未 有 了 日 勤 深 肯 之 噫 證 之 一 字 惟 宗 旨 可 以 
X65n1281_002:0207a27	辨驗。否則金鍮混雜。孰敢誰何。	辨 驗 否 則 金 鍮 混 雜 孰 敢 誰 何 
X65n1281_002:0207a28	己眼不明。終無為人之分。若使頂[寧*頁]上具眼衲師。任	己 眼 不 明 終 無 為 人 之 分 若 使 頂 [寧頁] 上 具 眼 衲 師 任 
X65n1281_002:0207b01	爾如何蓋覆。如銅鐵金銀。入罏便曉。罏無分別之意。	爾 如 何 蓋 覆 如 銅 鐵 金 銀 入 罏 便 曉 罏 無 分 別 之 意 
X65n1281_002:0207b02	火無辨驗之心。罏火何甞預立箇法門。以待銅鐵金	火 無 辨 驗 之 心 罏 火 何 甞 預 立 箇 法 門 以 待 銅 鐵 金 
X65n1281_002:0207b03	銀之就勘。若別有勘銅鐵金銀法門。便不成罏火了	銀 之 就 勘 若 別 有 勘 銅 鐵 金 銀 法 門 便 不 成 罏 火 了 
X65n1281_002:0207b04	也。大慧杲遠遜其師圓悟勤處。即此便見。明明向伊	也 大 慧 杲 遠 遜 其 師 圓 悟 勤 處 即 此 便 見 明 明 向 伊 
X65n1281_002:0207b05	道以契證為期。若不契證。斷不放過。猶道。若只恁麼	道 以 契 證 為 期 若 不 契 證 斷 不 放 過 猶 道 若 只 恁 麼 
X65n1281_002:0207b06	傳將去。舉了便會了。硬作主張。擊石火。閃電光。業識	傳 將 去 舉 了 便 會 了 硬 作 主 張 擊 石 火 閃 電 光 業 識 
X65n1281_002:0207b07	茫茫。未有了日。此語圓悟勤何由深肯。即當曰深肯	茫 茫 未 有 了 日 此 語 圓 悟 勤 何 由 深 肯 即 當 曰 深 肯 
X65n1281_002:0207b08	其語。知他圓悟勤是何心行。從上古德。接引學人。皆	其 語 知 他 圓 悟 勤 是 何 心 行 從 上 古 德 接 引 學 人 皆 
X65n1281_002:0207b09	是應時及節。隨病發藥。至於契證。離却六祖只合自	是 應 時 及 節 隨 病 發 藥 至 於 契 證 離 却 六 祖 只 合 自 
X65n1281_002:0207b10	性自度一語。有何奇妙秘密之旨。可以自我度他。若	性 自 度 一 語 有 何 奇 妙 秘 密 之 旨 可 以 自 我 度 他 若 
X65n1281_002:0207b11	有。即是魔說。即是實法。自救不了。如何為人。魔忍乃	有 即 是 魔 說 即 是 實 法 自 救 不 了 如 何 為 人 魔 忍 乃 
X65n1281_002:0207b12	以密雲千問千打萬問萬打為有獘。而謂證之一字。	以 密 雲 千 問 千 打 萬 問 萬 打 為 有 獘 而 謂 證 之 一 字 
X65n1281_002:0207b13	必宗旨可以辨驗。否則金鍮混雜。孰敢誰何。夫密雲	必 宗 旨 可 以 辨 驗 否 則 金 鍮 混 雜 孰 敢 誰 何 夫 密 雲 
X65n1281_002:0207b14	千問千打。萬問萬打。固是金鍮混雜。然猶是金則從	千 問 千 打 萬 問 萬 打 固 是 金 鍮 混 雜 然 猶 是 金 則 從 
X65n1281_002:0207b15	他金。鍮則從他鍮。若魔忍以作為實法為宗旨。則自	他 金 鍮 則 從 他 鍮 若 魔 忍 以 作 為 實 法 為 宗 旨 則 自 
X65n1281_002:0207b16	己通體是鍮。却欲辨他孰為金孰為鍮。化他鍮令成	己 通 體 是 鍮 却 欲 辨 他 孰 為 金 孰 為 鍮 化 他 鍮 令 成 
X65n1281_002:0207b17	金。豈非業識茫茫。未有了日。譬如身在岸上。則能拯	金 豈 非 業 識 茫 茫 未 有 了 日 譬 如 身 在 岸 上 則 能 拯 
X65n1281_002:0207b18	人以出於水。若自己沒頂入水。而自誇有辟水珠。呼	人 以 出 於 水 若 自 己 沒 頂 入 水 而 自 誇 有 辟 水 珠 呼 
X65n1281_002:0207b19	在岸在水之人。隨伊所向。則其為非拯人出水之人。	在 岸 在 水 之 人 隨 伊 所 向 則 其 為 非 拯 人 出 水 之 人 
X65n1281_002:0207b20	而為引人入水之魔。必矣。三問三打。何所見古今只	而 為 引 人 入 水 之 魔 必 矣 三 問 三 打 何 所 見 古 今 只 
X65n1281_002:0207b21	黃蘗一人。黃蘗平生。何所是只接臨濟一用。箇事。豈	黃 蘗 一 人 黃 蘗 平 生 何 所 是 只 接 臨 濟 一 用 箇 事 豈 
X65n1281_002:0207b22	在冊子上考究得者。三問三打。如使黃蘗負墮。那許	在 冊 子 上 考 究 得 者 三 問 三 打 如 使 黃 蘗 負 墮 那 許 
X65n1281_002:0207b23	他偶然一用。若果接得臨濟。何妨千問千打。萬問萬	他 偶 然 一 用 若 果 接 得 臨 濟 何 妨 千 問 千 打 萬 問 萬 
X65n1281_002:0207b24	打。此事從冊子上得來者。古人皆斥為念言語漢。何	打 此 事 從 冊 子 上 得 來 者 古 人 皆 斥 為 念 言 語 漢 何 
X65n1281_002:0207c01	況從冊子上查考故事。威音那畔。今世門頭。種種事	況 從 冊 子 上 查 考 故 事 威 音 那 畔 今 世 門 頭 種 種 事 
X65n1281_002:0207c02	相。百萬億那由他算數譬喻之所不能及。其載在冊	相 百 萬 億 那 由 他 算 數 譬 喻 之 所 不 能 及 其 載 在 冊 
X65n1281_002:0207c03	子上者。乃恒河裏一沙耳。即載在冊子。而目光未到。	子 上 者 乃 恒 河 裏 一 沙 耳 即 載 在 冊 子 而 目 光 未 到 
X65n1281_002:0207c04	不會裝入茫茫業識中者。當不知凡幾。乃欲據兩眼	不 會 裝 入 茫 茫 業 識 中 者 當 不 知 凡 幾 乃 欲 據 兩 眼 
X65n1281_002:0207c05	如豆之光。查看所得者。以評論箇事。豈非輕談般若	如 豆 之 光 查 看 所 得 者 以 評 論 箇 事 豈 非 輕 談 般 若 
X65n1281_002:0207c06	乎。古德云。諸祖共傳諸佛清淨自覺聖智。真如妙心。	乎 古 德 云 諸 祖 共 傳 諸 佛 清 淨 自覺聖智 真 如 妙 心 
X65n1281_002:0207c07	不同世間文字所得。若有悟斯真實法性。此人則能	不 同 世 間 文 字 所 得 若 有 悟 斯 真 實 法 性 此 人 則 能 
X65n1281_002:0207c08	了知三世諸佛。及一切眾生。同一法界。本來平等常	了 知 三世諸佛 及 一 切 眾 生 同 一 法 界 本 來 平 等 常 
X65n1281_002:0207c09	恒不變。是知吾宗本無有旨。言旨即已非宗。無可名	恒 不 變 是 知 吾 宗 本 無 有 旨 言 旨 即 已 非 宗 無 可 名 
X65n1281_002:0207c10	言。強名宗旨。以離却心意識故。今乃以心意識所造	言 強 名 宗 旨 以 離 却 心 意 識 故 今 乃 以 心 意 識 所 造 
X65n1281_002:0207c11	之雙頭獨結等。辨驗一切眾生心意識。如打謎。如射	之 雙 頭 獨 結 等 辨 驗 一 切 眾 生 心 意 識 如 打 謎 如 射 
X65n1281_002:0207c12	覆。中者。則謂之契證。宗風掃地矣。此事豈可意解情	覆 中 者 則 謂 之 契 證 宗 風 掃 地 矣 此 事 豈 可 意 解 情 
X65n1281_002:0207c13	求。若以意解情求。如將兔角之弓。架龜毛之箭。以無	求 若 以 意 解 情 求 如 將 兔 角 之 弓 架 龜 毛 之 箭 以 無 
X65n1281_002:0207c14	手之者。擬射碎須彌之山。似傾壓沙之油。點無煙之	手 之 者 擬 射 碎 須 彌 之 山 似 傾 壓 沙 之 油 點 無 煙 之 
X65n1281_002:0207c15	火。貯漏巵之內。欲照破鐵圍之闇。徒役狂心。無有是	火 貯 漏 巵 之 內 欲 照 破 鐵 圍 之 闇 徒 役 狂 心 無 有 是 
X65n1281_002:0207c16	處。今以狂心所造之狂華。飲人狂藥。令人同狂。以為	處 今 以 狂 心 所 造 之 狂 華 飲 人 狂 藥 令 人 同 狂 以 為 
X65n1281_002:0207c17	宗旨。以為契證。將使末學受其無窮之遺毒。如欲仰	宗 旨 以 為 契 證 將 使 末 學 受 其 無 窮 之 遺 毒 如 欲 仰 
X65n1281_002:0207c18	報佛恩。安得不思迴狂瀾於既倒。反覆辨論。其能已	報 佛 恩 安 得 不 思 迴 狂 瀾 於 既 倒 反 覆 辨 論 其 能 已 
X65n1281_002:0207c19	乎。	乎 
X65n1281_002:0207c20	魔忍曰。余救五宗。禍患死生。不暇措意。但恐百千世	魔 忍 曰 余 救 五 宗 禍 患 死 生 不 暇 措 意 但 恐 百 千 世 
X65n1281_002:0207c21	後。不復知有揚子雲。為可歎耳。	後 不 復 知 有 揚 子 雲 為 可 歎 耳 
X65n1281_002:0207c22	常寂光中。毗盧頂上。有甚禍患死生。說甚措意不措	常 寂 光 中 毗 盧 頂 上 有 甚 禍 患 死 生 說 甚 措 意 不 措 
X65n1281_002:0207c23	意。魔忍自誇其因救五宗之故。不措意於禍患死生。	意 魔 忍 自 誇 其 因 救 五 宗 之 故 不 措 意 於 禍 患 死 生 
X65n1281_002:0207c24	又以後世人之不知為可惜。復自託於揚子雲。以見	又 以 後 世 人 之 不 知 為 可 惜 復 自 託 於 揚 子 雲 以 見 
X65n1281_002:0208a01	後世之必知。請問此等語言。在常寂光中。毗盧頂上。	後 世 之 必 知 請 問 此 等 語 言 在 常 寂 光 中 毗 盧 頂 上 
X65n1281_002:0208a02	有可著處否。不污濁否。雖然。伊恐百千世後。不復知	有 可 著 處 否 不 污 濁 否 雖 然 伊 恐 百 千 世 後 不 復 知 
X65n1281_002:0208a03	有揚子雲。豈知百千世後。必知有揚子雲。猶夫百千	有 揚 子 雲 豈 知 百 千 世 後 必 知 有 揚 子 雲 猶 夫 百 千 
X65n1281_002:0208a04	世後。必知有魔忍。此則自因生自果。理合遺臭萬年。	世 後 必 知 有 魔 忍 此 則 自 因 生 自 果 理 合 遺 臭 萬 年 
X65n1281_002:0208a05	無可如何者也。揚子雲者。王莽之大夫也。其急欲貌	無 可 如 何 者 也 揚 子 雲 者 王 莽 之 大 夫 也 其 急 欲 貌 
X65n1281_002:0208a06	為孔子。正與魔藏父子急欲貌為臨濟同。其作法言	為 孔 子 正 與 魔 藏 父 子 急 欲 貌 為 臨 濟 同 其 作 法 言 
X65n1281_002:0208a07	仿論語。作太元經仿周易。正與魔藏父子妄立雙頭	仿 論 語 作 太 元 經 仿 周 易 正 與 魔 藏 父 子 妄 立 雙 頭 
X65n1281_002:0208a08	獨結等。為達摩西來宗旨同。其作劇秦美新。正與魔	獨 結 等 為 達 摩 西 來 宗 旨 同 其 作 劇 秦 美 新 正 與 魔 
X65n1281_002:0208a09	藏父子作五宗原五宗救同。魔藏父子。特不及揚子	藏 父 子 作 五 宗 原 五 宗 救 同 魔 藏 父 子 特 不 及 揚 子 
X65n1281_002:0208a10	雲博學多聞耳。然揚子雲陷身亂賊。為忠臣孝子所	雲 博 學 多 聞 耳 然 揚 子 雲 陷 身 亂 賊 為 忠 臣 孝 子 所 
X65n1281_002:0208a11	羞稱。魔藏父子倒戈乃祖乃父。為宗徒中之敗類。其	羞 稱 魔 藏 父 子 倒 戈 乃 祖 乃 父 為 宗 徒 中 之 敗 類 其 
X65n1281_002:0208a12	罪正同。伊欲自比揚子雲。供招已定。可為千秋鐵案	罪 正 同 伊 欲 自 比 揚 子 雲 供 招 已 定 可 為 千 秋 鐵 案 
X65n1281_002:0208a13	　華嚴經云。汝承事一切善知識。應發如大地心。荷	 華 嚴 經 云 汝 承 事 一 切 善 知 識 應 發 如 大 地 心 荷 
X65n1281_002:0208a14	負重任無疲倦故。應發如金剛心。志願堅固不可壞	負 重 任 無 疲 倦 故 應 發 如 金 剛 心 志 願 堅 固 不 可 壞 
X65n1281_002:0208a15	故。應發如鐵圍山心。一切諸苦無能動故。應發如給	故 應 發 如 鐵 圍 山 心 一 切 諸 苦 無 能 動 故 應 發 如 給 
X65n1281_002:0208a16	侍心。所有教令皆隨順故。應發如弟子心。所有訓誨	侍 心 所 有 教 令 皆 隨 順 故 應 發 如 弟 子 心 所 有 訓 誨 
X65n1281_002:0208a17	無違逆故。應發如僮僕心。不厭一切諸作務故。應發	無 違 逆 故 應 發 如 僮 僕 心 不 厭 一 切 諸 作 務 故 應 發 
X65n1281_002:0208a18	如養母心。受諸勤苦不告勞故。應發如傭作心。隨所	如 養 母 心 受 諸 勤 苦 不 告 勞 故 應 發 如 傭 作 心 隨 所 
X65n1281_002:0208a19	受教。無違逆故。應發如除糞人心。離憍慢故。應發如	受 教 無 違 逆 故 應 發 如 除 糞 人 心 離 憍 慢 故 應 發 如 
X65n1281_002:0208a20	已熟稼心。能低下故。應發如良馬心。離惡性故。應發	已 熟 稼 心 能 低 下 故 應 發 如 良 馬 心 離 惡 性 故 應 發 
X65n1281_002:0208a21	如大車心。能運量故。應發如調順象心。恒伏從故。應	如 大 車 心 能 運 量 故 應 發 如 調 順 象 心 恒 伏 從 故 應 
X65n1281_002:0208a22	發如須彌山心。不傾動故。應發如良犬心。不害主故。	發 如須彌山 心 不 傾 動 故 應 發 如 良 犬 心 不 害 主 故 
X65n1281_002:0208a23	應發如旃陀羅心。離憍慢故。應發如牸牛心。無威怒	應 發 如 旃 陀 羅 心 離 憍 慢 故 應 發 如 牸 牛 心 無 威 怒 
X65n1281_002:0208a24	故。應發如舟船心。往來不倦故。應發如橋梁心。濟渡	故 應 發 如 舟 船 心 往 來 不 倦 故 應 發 如 橋 梁 心 濟 渡 
X65n1281_002:0208b01	志疲故。應發如孝子心。承順顏色故。應發如王子心。	志 疲 故 應 發 如 孝 子 心 承 順 顏 色 故 應 發 如 王 子 心 
X65n1281_002:0208b02	遵行教命故。夫佛之誠言。承事善知識當如是。今五	遵 行 教 命 故 夫 佛 之 誠 言 承 事 善 知 識 當 如 是 今 五 
X65n1281_002:0208b03	宗救中。呵罵譏誚乃祖密雲悟之語。不一而足。顯悖	宗 救 中 呵 罵 譏 誚 乃 祖 密 雲 悟 之 語 不 一 而 足 顯 悖 
X65n1281_002:0208b04	佛教。尚何論宗旨。實屬法國土背道之臣。大乘家邪	佛 教 尚 何 論 宗 旨 實 屬 法 國 土 背 道 之 臣 大 乘 家 邪 
X65n1281_002:0208b05	見之子。	見 之 子 
X65n1281_002:0208b07	御製揀魔辨異錄卷二	御 製 揀 魔 辨 異 錄 卷 二 
X65n1281_003:0208b11	御製揀魔辨異錄卷三	御 製 揀 魔 辨 異 錄 卷 三 
X65n1281_003:0208b13	魔忍曰。濟用處。如巨靈擘華嶽。女媧鍊石補天。無堅	魔 忍 曰 濟 用 處 如 巨 靈 擘 華 嶽 女 媧 鍊 石 補 天 無 堅 
X65n1281_003:0208b14	不破。無迹不絕。而後世驚駭以為荒僻怪誕不稽之	不 破 無 迹 不 絕 而 後 世 驚 駭 以 為 荒 僻 怪 誕 不 稽 之 
X65n1281_003:0208b15	語。即信然者。又謂神妙莫可測識。非己智所窺。安知	語 即 信 然 者 又 謂 神 妙 莫 可 測 識 非 己 智 所 窺 安 知 
X65n1281_003:0208b16	不欺之力。本自具足。但學者望崖不前耳。妙喜偈曰	不 欺 之 力 本 自 具 足 但 學 者 望 崖 不 前 耳 妙 喜 偈 曰 
X65n1281_003:0208b17	龜毛拈得笑咍咍。一擊萬重關鎻開。慶快平生在今	龜 毛 拈 得 笑 咍 咍 一 擊 萬 重 關 鎻 開 慶 快 平 生 在 今 
X65n1281_003:0208b18	日。孰云千里賺吾來。語曰。不入虎穴。難得虎子。夫臨	日 孰 云 千 里 賺 吾 來 語 曰 不 入 虎 穴 難 得 虎 子 夫 臨 
X65n1281_003:0208b19	濟一後生也。三年不知問話。使其進道之不篤。師友	濟 一 後 生 也 三 年 不 知 問 話 使 其 進 道 之 不 篤 師 友 
X65n1281_003:0208b20	挾持之不力。與庸眾何異哉。後來建大法幢。如十日	挾 持 之 不 力 與 庸 眾 何 異 哉 後 來 建 大 法 幢 如 十 日 
X65n1281_003:0208b21	並照。輝映古昔。當是時。出其門者。皆獅子王哮吼一	並 照 輝 映 古 昔 當 是 時 出 其 門 者 皆 獅 子 王 哮 吼 一 
X65n1281_003:0208b22	聲。精邪辟易。真可以典型百代。冠冕五宗。然而法運	聲 精 邪 辟 易 真 可 以 典 型 百 代 冠 冕 五 宗 然 而 法 運 
X65n1281_003:0208b23	久湮。弘護之人借緣而起。是故三峰唱於前。而天童	久 湮 弘 護 之 人 借 緣 而 起 是 故 三 峰 唱 於 前 而 天 童 
X65n1281_003:0208b24	闢於後。闢者唱之機。唱者闢之響。如鐘之受杵。愈扣	闢 於 後 闢 者 唱 之 機 唱 者 闢 之 響 如 鐘 之 受 杵 愈 扣 
X65n1281_003:0208b25	愈鳴。愈擊愈莫能掩。吾又從而和焉。使臨濟眼光於	愈 鳴 愈 擊 愈 莫 能 掩 吾 又 從 而 和 焉 使 臨 濟 眼 光 於 
X65n1281_003:0208b26	是乎在。倘出格高流。向佛法無多子處。萬戶俱洞。是	是 乎 在 倘 出 格 高 流 向 佛 法 無 多 子 處 萬 戶 俱 洞 是 
X65n1281_003:0208b27	旦暮遇之也。然則天童三峯二老子者。果可以世法	旦 暮 遇 之 也 然 則 天 童 三 峯 二 老 子 者 果 可 以 世 法 
X65n1281_003:0208b28	論哉。	論 哉 
X65n1281_003:0208b29	古德云。臨濟大似白拈賊。此等言句。豈是呵辱臨濟。	古 德 云 臨 濟 大 似 白 拈 賊 此 等 言 句 豈 是 呵 辱 臨 濟 
X65n1281_003:0208c01	到此地位。豈同世諦流布。乃以巨靈擘嶽。女媧補天	到 此 地 位 豈 同 世 諦 流 布 乃 以 巨 靈 擘 嶽 女 媧 補 天 
X65n1281_003:0208c02	頌之。臨濟聞之。當必揜耳而走。這箇沒縫塔子。容誰	頌 之 臨 濟 聞 之 當 必 揜 耳 而 走 這 箇 沒 縫 塔 子 容 誰 
X65n1281_003:0208c03	擘耶。如何補耶。又曰。後世驚駭。以為荒僻怪誕不稽	擘 耶 如 何 補 耶 又 曰 後 世 驚 駭 以 為 荒 僻 怪 誕 不 稽 
X65n1281_003:0208c04	之談。即信然者。又謂神妙莫可測識。非己智所窺。此	之 談 即 信 然 者 又 謂 神 妙 莫 可 測 識 非 己 智 所 窺 此 
X65n1281_003:0208c05	二種不了漢。何足挂齒。從上諸禪德。雖復同中有異	二 種 不 了 漢 何 足 挂 齒 從 上 諸 禪 德 雖 復 同 中 有 異 
X65n1281_003:0208c06	異中同。然以此二種不了漢視之。凡其言句。無不可	異 中 同 然 以 此 二 種 不 了 漢 視 之 凡 其 言 句 無 不 可 
X65n1281_003:0208c07	驚可駭。無不神妙莫測。豈但臨濟為然耶。濟之施設	驚 可 駭 無 不 神 妙 莫 測 豈 但 臨 濟 為 然 耶 濟 之 施 設 
X65n1281_003:0208c08	處。不是臨濟。若以此為臨濟。鈍置煞臨濟。乃云安知	處 不 是 臨 濟 若 以 此 為 臨 濟 鈍 置 煞 臨 濟 乃 云 安 知 
X65n1281_003:0208c09	不欺之力。本自具足。但學者望崖不前。學者若從施	不 欺 之 力 本 自 具 足 但 學 者 望 崖 不 前 學 者 若 從 施 
X65n1281_003:0208c10	設處學臨濟。正是夸父逐日矣。又如典型百代冠冕	設 處 學 臨 濟 正 是 夸 父 逐 日 矣 又 如 典 型 百 代 冠 冕 
X65n1281_003:0208c11	五宗等語。皆屬謬論。世尊七處九會。豈不典型百代。	五 宗 等 語 皆 屬 謬 論 世 尊 七 處 九 會 豈 不 典 型 百 代 
X65n1281_003:0208c12	末後道吾未甞說一字。然則世尊不欲以七處九會	末 後 道 吾 未 甞 說 一 字 然 則 世 尊 不 欲 以 七 處 九 會 
X65n1281_003:0208c13	為百代典型明矣。凡屬門庭施設。即非典型。儒門事	為 百 代 典 型 明 矣 凡 屬 門 庭 施 設 即 非 典 型 儒 門 事 
X65n1281_003:0208c14	事是實法。所以有典型之說。典者可載於書冊者也。	事 是 實 法 所 以 有 典 型 之 說 典 者 可 載 於 書 冊 者 也 
X65n1281_003:0208c15	型者以合土範金之模格為喻。言其可用為定式者	型 者 以 合 土 範 金 之 模 格 為 喻 言 其 可 用 為 定 式 者 
X65n1281_003:0208c16	也。禪宗無語句。亦無一法與人。然則何所為典型百	也 禪 宗 無 語 句 亦 無 一 法 與 人 然 則 何 所 為 典 型 百 
X65n1281_003:0208c17	代耶。若論五宗。俱是門庭邊事。若論本分。則是達摩	代 耶 若 論 五 宗 俱 是 門 庭 邊 事 若 論 本 分 則 是 達 摩 
X65n1281_003:0208c18	西來。光發千燈。盡未來際無盡之燈。並是一般照天	西 來 光 發 千 燈 盡未來際 無 盡 之 燈 並 是 一 般 照 天 
X65n1281_003:0208c19	照地。尚不得謂達摩為典型百代冠冕五宗。何況臨	照 地 尚 不 得 謂 達 摩 為 典 型 百 代 冠 冕 五 宗 何 況 臨 
X65n1281_003:0208c20	濟。若有冠冕。即有裳衣。既有冠裳。即有階級。此事可	濟 若 有 冠 冕 即 有 裳 衣 既 有 冠 裳 即 有 階 級 此 事 可 
X65n1281_003:0208c21	有如許差別相耶。又魔忍於此篇復作解紛之語。回	有 如 許 差 別 相 耶 又 魔 忍 於 此 篇 復 作 解 紛 之 語 回 
X65n1281_003:0208c22	護天童。將魔藏之倒戈。與天童之攻擊。謂俱非世法。	護 天 童 將 魔 藏 之 倒 戈 與 天 童 之 攻 擊 謂 俱 非 世 法 
X65n1281_003:0208c23	正是巧於回護魔藏。正是世法。豈能逃明眼人之覷	正 是 巧 於 回 護 魔 藏 正 是 世 法 豈 能 逃 明 眼 人 之 覷 
X65n1281_003:0208c24	破。又謂兩人彼唱此闢。己又從而和之。然後臨濟眼	破 又 謂 兩 人 彼 唱 此 闢 己 又 從 而 和 之 然 後 臨 濟 眼 
X65n1281_003:0209a01	光不墜。而出格高流。向佛法無多子處。萬戶俱洞。是	光 不 墜 而 出 格 高 流 向 佛 法 無 多 子 處 萬 戶 俱 洞 是 
X65n1281_003:0209a02	旦暮遇之。尤可嗤笑。夫嘉禾惡莠。沒陰陽地上。總不	旦 暮 遇 之 尤 可 嗤 笑 夫 嘉 禾 惡 莠 沒 陰 陽 地 上 總 不 
X65n1281_003:0209a03	能生。而清淨大海中。活物死物。俱不能住。此唱彼闢。	能 生 而 清 淨 大 海 中 活 物 死 物 俱 不 能 住 此 唱 彼 闢 
X65n1281_003:0209a04	若皆世諦流布。則此沒陰陽地上。兩皆不著。若是較	若 皆 世 諦 流 布 則 此 沒 陰 陽 地 上 兩 皆 不 著 若 是 較 
X65n1281_003:0209a05	論宗乘。則無論藏忍固屬魔論。天童亦已全身落草。	論 宗 乘 則 無 論 藏 忍 固 屬 魔 論 天 童 亦 已 全 身 落 草 
X65n1281_003:0209a06	帶水拖泥。雖有死活之別。要之俱不得住清淨大海	帶 水 拖 泥 雖 有 死 活 之 別 要 之 俱 不 得 住 清 淨 大 海 
X65n1281_003:0209a07	中矣。安得於此有佛法無多子可證耶。且未論門庭。	中 矣 安 得 於 此 有 佛 法 無 多 子 可 證 耶 且 未 論 門 庭 
X65n1281_003:0209a08	先泯人法。人空法空。則何是何非。離非於百非。非所	先 泯 人 法 人 空 法 空 則 何 是 何 非 離 非 於 百 非 非 所 
X65n1281_003:0209a09	不能非也。超是於萬是。是所不能是也。非所不能非。	不 能 非 也 超 是 於 萬 是 是 所 不 能 是 也 非 所 不 能 非 
X65n1281_003:0209a10	則無非矣。是所不能是。則無是矣。即到無是無非境	則 無 非 矣 是 所 不 能 是 則 無 是 矣 即 到 無 是 無 非 境 
X65n1281_003:0209a11	界。尚未踏百尺竿頭一步在。今乃於是非堆裏索取	界 尚 未 踏 百 尺 竿 頭 一 步 在 今 乃 於 是 非 堆 裏 索 取 
X65n1281_003:0209a12	佛法無多子。何異向大火聚中求一滴水耶。	佛 法 無 多 子 何 異 向 大 火 聚 中 求 一 滴 水 耶 
X65n1281_003:0209a13	魔藏黃檗三頓棒頌曰。層疊樓高一步登。未梢撩著	魔 藏 黃 檗 三 頓 棒 頌 曰 層 疊 樓 高 一 步 登 未 梢 撩 著 
X65n1281_003:0209a14	迅騫騰。角尖迸出元中要。萬古真師貴所承。	迅 騫 騰 角 尖 迸 出 元 中 要 萬 古 真 師 貴 所 承 
X65n1281_003:0209a15	若喻程途。則百尺之樓。離地雖遠。究亦因地而起。初	若 喻 程 途 則 百 尺 之 樓 離 地 雖 遠 究 亦 因 地 而 起 初 
X65n1281_003:0209a16	級頂級。平等無二。步步踏實。即是步步登空。步步登	級 頂 級 平 等 無 二 步 步 踏 實 即 是 步 步 登 空 步 步 登 
X65n1281_003:0209a17	空。何非步步踏實。如欲騫騰。即是脚跟不點地漢。若	空 何 非 步 步 踏 實 如 欲 騫 騰 即 是 脚 跟 不 點 地 漢 若 
X65n1281_003:0209a18	喻了悟。則一心法界。法界一心。圅蓋十方。不露絲髮。	喻 了 悟 則 一 心 法 界 法 界 一 心 圅 蓋 十 方 不 露 絲 髮 
X65n1281_003:0209a19	今既有箇樓在。又有箇登樓之人在。又說箇重疊之	今 既 有 箇 樓 在 又 有 箇 登 樓 之 人 在 又 說 箇 重 疊 之 
