X70n1398_001:0650a02	魔擎叉。臨濟三玄。洞山五位。巴陵銀椀裡盛雪。雲門	魔 擎 叉 臨 濟 三 玄 洞 山 五 位 巴 陵 銀 椀 裡 盛 雪 雲 門 
X70n1398_001:0650a03	北斗裡藏身。隱顯縱橫。千差萬別。若不以此為證。即	北 斗 裡 藏 身 隱 顯 縱 橫 千 差 萬 別 若 不 以 此 為 證 即 
X70n1398_001:0650a04	不能成就。教中道。一切諸佛。及諸佛無上菩提之法。	不 能 成 就 教 中 道 一切諸佛 及 諸 佛 無上菩提 之 法 
X70n1398_001:0650a05	皆從此經出。但是世間出世間。一切佛法。無有不從	皆 從 此 經 出 但 是 世間出世間 一切佛法 無 有 不 從 
X70n1398_001:0650a06	此經出者。佛法且置。畢竟如何是此經。莫是以兩手	此 經 出 者 佛 法 且 置 畢 竟 如 何 是 此 經 莫 是 以 兩 手 
X70n1398_001:0650a07	舒空作展經勢麼。莫是叉手進前。退身三步是麼。又	舒 空 作 展 經 勢 麼 莫 是 叉 手 進 前 退 身 三 步 是 麼 又 
X70n1398_001:0650a08	莫是最初如是我聞。末後信受奉行是麼。莫是不著	莫 是 最 初 如是我聞 末 後 信受奉行 是 麼 莫 是 不 著 
X70n1398_001:0650a09	他語言文字是麼。又莫是但向料掉沒交涉處。道一	他 語 言 文 字 是 麼 又 莫 是 但 向 料 掉 沒 交 涉 處 道 一 
X70n1398_001:0650a10	句便得麼。若作如是見解。大似隔靴抓癢。既不作如	句 便 得 麼 若 作 如 是 見 解 大 似 隔 靴 抓 癢 既 不 作 如 
X70n1398_001:0650a11	是見解。畢竟作麼生。擊拂。須是恁麼明得。苟能恁麼	是 見 解 畢 竟 作 麼 生 擊 拂 須 是 恁 麼 明 得 苟 能 恁 麼 
X70n1398_001:0650a12	明得。於朝夕日用之間。無一處而不見佛。無一處而	明 得 於 朝 夕 日 用 之 間 無 一 處 而 不 見 佛 無 一 處 而 
X70n1398_001:0650a13	不聞法。所以道。在在處處。即為有佛。一切法皆是佛	不 聞 法 所 以 道 在在處處 即 為 有 佛 一 切 法 皆 是 佛 
X70n1398_001:0650a14	法。若恁麼見得。一任三門頭合掌。佛殿裡燒香。經案	法 若 恁 麼 見 得 一 任 三 門 頭 合 掌 佛 殿 裡 燒 香 經 案 
X70n1398_001:0650a15	上橫拈倒把。左卷右舒。放去収來。朝讀暮誦。直得竪	上 橫 拈 倒 把 左 卷 右 舒 放 去 収 來 朝 讀 暮 誦 直 得 竪 
X70n1398_001:0650a16	窮三際。橫亘十方。周法界之群生。徧剎塵之品類。包	窮 三 際 橫 亘 十 方 周 法 界 之 群 生 徧 剎 塵 之 品 類 包 
X70n1398_001:0650a17	羅萬有。該括二儀。無一法而不明。無一法而不顯。可	羅 萬 有 該 括 二 儀 無 一 法 而 不 明 無 一 法 而 不 顯 可 
X70n1398_001:0650a18	謂法門重疊。若雲起於長空。行解紛披。似花敷於錦	謂 法 門 重 疊 若 雲 起 於 長 空 行 解 紛 披 似 花 敷 於 錦 
X70n1398_001:0650a19	上。言言見諦。句句超宗。其舒也。窮微極妙而不違及。	上 言 言 見 諦 句 句 超 宗 其 舒 也 窮 微 極 妙 而 不 違 及 
X70n1398_001:0650a20	其卷也。經頭只有箇以字不成。八字不是。且道是什	其 卷 也 經 頭 只 有 箇 以 字 不 成 八 字 不 是 且 道 是 什 
X70n1398_001:0650a21	麼字。假使智如鶖子。辯若滿慈。到這裡。也須目瞠口	麼 字 假 使 智 如 鶖 子 辯 若 滿 慈 到 這 裡 也 須 目 瞠 口 
X70n1398_001:0650a22	呿。所以僧問睦州。經頭有箇以字不成。八字不是。未	呿 所 以 僧 問 睦 州 經 頭 有 箇 以 字 不 成 八 字 不 是 未 
X70n1398_001:0650a23	審是箇甚麼字。睦州彈指一聲云。會麼。僧云。不會。睦	審 是 箇 甚 麼 字 睦 州 彈 指 一 聲 云 會 麼 僧 云 不 會 睦 
X70n1398_001:0650a24	州云。上來講讚。無限良因。且道。當時睦州是與這僧	州 云 上 來 講 讚 無 限 良 因 且 道 當 時 睦 州 是 與 這 僧 
X70n1398_001:0650b01	說這箇字。是不說這箇字。因甚。睦州便問這僧會麼。	說 這 箇 字 是 不 說 這 箇 字 因 甚 睦 州 便 問 這 僧 會 麼 
X70n1398_001:0650b02	諸人若向這裡會得。不惟可以上報。	諸 人 若 向 這 裡 會 得 不 惟 可 以 上 報 
X70n1398_001:0650b03	當今聖主大恩。亦可表顯自己看經眼目。正與麼時。	當 今 聖 主 大 恩 亦 可 表 顯 自 己 看 經 眼 目 正 與 麼 時 
X70n1398_001:0650b04	還會得麼。聖心廣大包寰宇。佛法流通亘古今。	還 會 得 麼 聖 心 廣 大 包 寰 宇 佛 法 流 通 亘 古 今 
X70n1398_001:0650b05	復云。教中云。有大經卷。量等三千大千世界。書寫三	復 云 教 中 云 有 大 經 卷 量等三千大千世界 書 寫 三 
X70n1398_001:0650b06	千大千世界中事。只在微塵中。誰能破此微塵。出此	千 大千世界 中 事 只 在 微 塵 中 誰 能 破 此 微 塵 出 此 
X70n1398_001:0650b07	大經。卓主丈。即今一微塵已破。諸人還見此大經卷	大 經 卓 主 丈 即 今 一 微 塵 已 破 諸 人 還 見 此 大 經 卷 
X70n1398_001:0650b08	麼。喝一喝。	麼 喝 一 喝 
X70n1398_001:0650b09	冬節小參。群陰剝。子啐母啄。一陽生。殻綻眼明。功用	冬 節 小 參 群 陰 剝 子 啐 母 啄 一 陽 生 殻 綻 眼 明 功 用 
X70n1398_001:0650b10	綿密。持養老成。忘其物。忘其情。空而妙。虗而靈。正恁	綿 密 持 養 老 成 忘 其 物 忘 其 情 空 而 妙 虗 而 靈 正 恁 
X70n1398_001:0650b11	麼。何似生。回機轉位異類中行。幾度黑風翻大浪。未	麼 何 似 生 回 機 轉 位 異 類 中 行 幾 度 黑 風 翻 大 浪 未 
X70n1398_001:0650b12	曾聞道釣舟傾。	曾 聞 道 釣 舟 傾 
X70n1398_001:0650b13	上堂。至德如流。上善若水。一塵入正受。諸塵三昧起。	上 堂 至 德 如 流 上 善 若 水 一 塵 入 正 受 諸 塵 三 昧 起 
X70n1398_001:0650b14	洗面摸著鼻。喫茶濕却觜。忽有箇出來問。久嚮薦福。	洗 面 摸 著 鼻 喫 茶 濕 却 觜 忽 有 箇 出 來 問 久 嚮 薦 福 
X70n1398_001:0650b15	元來只說古人舊話。只向他道。熟處難忘。	元 來 只 說 古 人 舊 話 只 向 他 道 熟 處 難 忘 
X70n1398_001:0650b16	上堂。八尺釘。丈二楔。著在眼中。撼搖不得。薦福門下。	上 堂 八 尺 釘 丈 二 楔 著 在 眼 中 撼 搖 不 得 薦 福 門 下 
X70n1398_001:0650b17	妙在轉處。誰是知音。不見三祖大師道。纔有是非。紛	妙 在 轉 處 誰 是 知 音 不 見 三 祖 大 師 道 纔 有 是 非 紛 
X70n1398_001:0650b18	然失心。乃擲下主丈。	然 失 心 乃 擲 下 主 丈 
X70n1398_001:0650b19	頌古	頌 古 
X70n1398_001:0650b20	僧問雲門。樹凋葉落時如何。門云。體露金風。	僧 問 雲 門 樹 凋 葉 落 時 如 何 門 云 體 露 金 風 
X70n1398_001:0650b21	秋風葉落動凉颸。堪笑雲門跛阿師。銷盡浮華到真	秋 風 葉 落 動 凉 颸 堪 笑 雲 門 跛 阿 師 銷 盡 浮 華 到 真 
X70n1398_001:0650b22	實。不知開口落今時。	實 不 知 開 口 落 今 時 
X70n1398_001:0650b23	僧問香林。如何是衲衣下事。林云。臘月火燒山。	僧 問 香 林 如 何 是 衲 衣 下 事 林 云 臘 月 火 燒 山 
X70n1398_001:0650b24	香林臘月火燒山。黑齒波師帶白環。唐梵一時俱譯	香 林 臘 月 火 燒 山 黑 齒 波 師 帶 白 環 唐 梵 一 時 俱 譯 
X70n1398_001:0650c01	了。肯將名字落人間。	了 肯 將 名 字 落 人 間 
X70n1398_001:0650c02	僧問趙州云。未有世間。早有此性。世界懷時。此性	僧 問 趙 州 云 未 有 世 間 早 有 此 性 世 界 懷 時 此 性 
X70n1398_001:0650c03	不壞。如何是不壞底性。州云。四大五蘊。僧云。此猶	不 壞 如 何 是 不 壞 底 性 州 云 四 大 五 蘊 僧 云 此 猶 
X70n1398_001:0650c04	是壞底。如何是不壞底。州云。四大五蘊。	是 壞 底 如 何 是 不 壞 底 州 云 四 大 五 蘊 
X70n1398_001:0650c05	老諗年尊閱事多。清平世界樂無何。一身儱侗無邊	老 諗 年 尊 閱 事 多 清 平 世 界 樂 無 何 一 身 儱 侗 無 邊 
X70n1398_001:0650c06	表。地覆天翻也只那。	表 地 覆 天 翻 也 只 那 
X70n1398_001:0650c07	雲門示眾云。十五日以前不問汝。十五日以後。道	雲 門 示 眾 云 十 五 日 以 前 不 問 汝 十 五 日 以 後 道 
X70n1398_001:0650c08	將一句來。代云。日日是好日。	將 一 句 來 代 云 日 日 是 好 日 
X70n1398_001:0650c09	日日是好日。時時是好時。鯨吞海水盡。露出珊瑚枝。	日 日 是 好 日 時 時 是 好 時 鯨 吞 海 水 盡 露 出 珊 瑚 枝 
X70n1398_001:0650c10	僧問古德。冬至後。日長多少。德云。長一絲。佛法長	僧 問 古 德 冬 至 後 日 長 多 少 德 云 長 一 絲 佛 法 長 
X70n1398_001:0650c11	多少。德云。一線長。	多 少 德 云 一 線 長 
X70n1398_001:0650c12	佛法一線長。青天謾度量。絲頭纔咬斷。紅日上扶桑。	佛 法 一 線 長 青 天 謾 度 量 絲 頭 纔 咬 斷 紅 日 上 扶 桑 
X70n1398_001:0650c13	泐潭常禪師。一日面壁而坐。南泉來見。撫師背一	泐 潭 常 禪 師 一 日 面 壁 而 坐 南 泉 來 見 撫 師 背 一 
X70n1398_001:0650c14	下。潭云誰。泉云某甲。潭云如何。泉云也尋常。潭云	下 潭 云 誰 泉 云 某 甲 潭 云 如 何 泉 云 也 尋 常 潭 云 
X70n1398_001:0650c15	汝何多事。	汝 何 多 事 
X70n1398_001:0650c16	言中有響語藏鋒。一色明邊分異同。月棹各撑俱到	言 中 有 響 語 藏 鋒 一 色 明 邊 分 異 同 月 棹 各 撑 俱 到 
X70n1398_001:0650c17	岸。不知身在草窠中。	岸 不 知 身 在 草 窠 中 
X70n1398_001:0650c18	谷隱性空和尚。因僧問。靈山一會。何異今日。性空	谷 隱 性 空 和 尚 因 僧 問 靈 山 一 會 何 異 今 日 性 空 
X70n1398_001:0650c19	云。不異今日。僧云。不異底事作麼生。性空云。如來	云 不 異 今 日 僧 云 不 異 底 事 作 麼 生 性 空 云 如 來 
X70n1398_001:0650c20	密語。迦葉不傳。	密 語 迦 葉 不 傳 
X70n1398_001:0650c21	酬應相於理不乖。泯然一種似平懷。及乎話到聱訛	酬 應 相 於 理 不 乖 泯 然 一 種 似 平 懷 及 乎 話 到 聱 訛 
X70n1398_001:0650c22	處。樹上心肝不帶來。	處 樹 上 心 肝 不 帶 來 
X70n1398_001:0650c23	偈頌	偈 頌 
X70n1398_001:0650c24	水心	水 心 
X70n1398_001:0651a01	一源見徹萬波翻。澄不清兮撓不渾。識浪境風俱列	一 源 見 徹 萬 波 翻 澄 不 清 兮 撓 不 渾 識 浪 境 風 俱 列 
X70n1398_001:0651a02	下。鑄成滄海鐵崑崙。	下 鑄 成 滄 海 鐵 崑 崙 
X70n1398_001:0651a03	靈竺	靈 竺 
X70n1398_001:0651a04	鷲嶺人天鴨聽雷。大僊密付絕纖埃。飛來小朵從何	鷲 嶺 人 天 鴨 聽 雷 大 僊 密 付 絕 纖 埃 飛 來 小 朵 從 何 
X70n1398_001:0651a05	有。兩澗琮琤一逕開。	有 兩 澗 琮 琤 一 逕 開 
X70n1398_001:0651a06	雲頂	雲 頂 
X70n1398_001:0651a07	溶溶洩洩復閒閒。來者從教斫額看。起滅無蹤空絕	溶 溶 洩 洩 復 閒 閒 來 者 從 教 斫 額 看 起 滅 無 蹤 空 絕 
X70n1398_001:0651a08	迹。竪摩醯眼照人間。	迹 竪 摩 醯 眼 照 人 間 
X70n1398_001:0651a09	震上人	震 上 人 
X70n1398_001:0651a10	惡辣兒孫喪本宗。向空拏撮便填空。震威一喝無今	惡 辣 兒 孫 喪 本 宗 向 空 拏 撮 便 填 空 震 威 一 喝 無 今 
X70n1398_001:0651a11	古。百丈馬師皆患聾。	古 百 丈 馬 師 皆 患 聾 
X70n1398_001:0651a12	刀鑷沈生	刀 鑷 沈 生 
X70n1398_001:0651a13	空彈霜鑷到巖扄。覿面難將妙手呈。雨洗秋容同澹	空 彈 霜 鑷 到 巖 扄 覿 面 難 將 妙 手 呈 雨 洗 秋 容 同 澹 
X70n1398_001:0651a14	泊。遠山無限佛頭青。	泊 遠 山 無 限 佛 頭 青 
X70n1398_001:0651a15	遠上人	遠 上 人 
X70n1398_001:0651a16	遠來一見便相違。竹外清風聽者稀。却是晚鴻知此	遠 來 一 見 便 相 違 竹 外 清 風 聽 者 稀 却 是 晚 鴻 知 此 
X70n1398_001:0651a17	意。數聲清唳入雲微。	意 數 聲 清 唳 入 雲 微 
X70n1398_001:0651a18	秀上人之仰	秀 上 人 之 仰 
X70n1398_001:0651a19	碧巖千尺瀑雪落。峭壁萬疊峰雲寒。一笻雙履超聲	碧 巖 千 尺 瀑 雪 落 峭 壁 萬 疊 峰 雲 寒 一 笻 雙 履 超 聲 
X70n1398_001:0651a20	外。圓相暗機誰共看。	外 圓 相 暗 機 誰 共 看 
X70n1398_001:0651a21	無相	無 相 
X70n1398_001:0651a22	意地消融見亦空。名模何有可形容。百千明鏡俱時	意 地 消 融 見 亦 空 名 模 何 有 可 形 容 百 千 明 鏡 俱 時 
X70n1398_001:0651a23	照。一法不痕歸大同。	照 一 法 不 痕 歸 大 同 
X70n1398_001:0651a24	總心	總 心 
X70n1398_001:0651b01	休攀月窟躡天根。及盡玄微見本元。一髮不遺千聖	休 攀 月 窟 躡 天 根 及 盡 玄 微 見 本 元 一 髮 不 遺 千 聖 
X70n1398_001:0651b02	共。湛然隨處洞無痕。	共 湛 然 隨 處 洞 無 痕 
X70n1398_001:0651b03	正堂	正 堂 
X70n1398_001:0651b04	當軒大坐照無偏。爭肯顢頇數屋椽。三目洞明惟直	當 軒 大 坐 照 無 偏 爭 肯 顢 頇 數 屋 椽 三 目 洞 明 惟 直 
X70n1398_001:0651b05	指。雖然無語有人傳。	指 雖 然 無 語 有 人 傳 
X70n1398_001:0651b06	覺海	覺 海 
X70n1398_001:0651b07	非湛非搖見量消。一漚那更目全潮。不知水底蓬塵	非 湛 非 搖 見 量 消 一 漚 那 更 目 全 潮 不 知 水 底 蓬 塵 
X70n1398_001:0651b08	起。但見珊瑚長玉苗。	起 但 見 珊 瑚 長 玉 苗 
X70n1398_001:0651b09	印空	印 空 
X70n1398_001:0651b10	萬象森羅古篆文。太虗無際水無痕。當陽一搭全提	萬 象 森 羅 古 篆 文 太 虗 無 際 水 無 痕 當 陽 一 搭 全 提 
X70n1398_001:0651b11	處。直得三千海嶽昏。	處 直 得 三 千 海 嶽 昏 
X70n1398_001:0651b12	海峰	海 峰 
X70n1398_001:0651b13	萬浪聲消一鏡新。金鰲寒從玉璘珣。珊瑚枝上照紅	萬 浪 聲 消 一 鏡 新 金 鰲 寒 從 玉 璘 珣 珊 瑚 枝 上 照 紅 
X70n1398_001:0651b14	日。融盡十洲三島春。	日 融 盡 十 洲 三 島 春 
X70n1398_001:0651b15	瑩然	瑩 然 
X70n1398_001:0651b16	碧落無雲水似天。清明表裡一虗玄。纖塵不立充寥	碧 落 無 雲 水 似 天 清 明 表 裡 一 虗 玄 纖 塵 不 立 充 寥 
X70n1398_001:0651b17	廓。十世古今如目前。	廓 十 世 古 今 如 目 前 
X70n1398_001:0651b18	曉山	曉 山 
X70n1398_001:0651b19	大明洞起爍群昏。黯黯青青未易論。眨得眼來遲八	大 明 洞 起 爍 群 昏 黯 黯 青 青 未 易 論 眨 得 眼 來 遲 八 
X70n1398_001:0651b20	刻。金烏已過鐵崑崙。	刻 金 烏 已 過 鐵 崑 崙 
X70n1398_001:0651b21	仰山中村接待	仰 山 中 村 接 待 
X70n1398_001:0651b22	水雲食息且休論。東土西天也莫存。此去仰山問來	水 雲 食 息 且 休 論 東 土 西 天 也 莫 存 此 去 仰 山 問 來 
X70n1398_001:0651b23	歷。但云昨夜宿中村。	歷 但 云 昨 夜 宿 中 村 
X70n1398_001:0651b24	劒關	劒 關 
X70n1398_001:0651c01	燄燄寒霜不可干。湛盧光射斗牛寒。直饒過得連雲	燄 燄 寒 霜 不 可 干 湛 盧 光 射 斗 牛 寒 直 饒 過 得 連 雲 
X70n1398_001:0651c02	機。一劄當陽透者難。	機 一 劄 當 陽 透 者 難 
X70n1398_001:0651c03	十牛圖	十 牛 圖 
X70n1398_001:0651c04	尋蹤見跡得逢渠。牧就騎來驀直歸。物我兩忘純白	尋 蹤 見 跡 得 逢 渠 牧 就 騎 來 驀 直 歸 物 我 兩 忘 純 白 
X70n1398_001:0651c05	後。透花春入萬紅圍。	後 透 花 春 入 萬 紅 圍 
X70n1398_001:0651c06	明維那再往踈山	明 維 那 再 往 踈 山 
X70n1398_001:0651c07	法身向上不須論。留箇枯椿示子孫。賣却布單招感	法 身 向 上 不 須 論 留 箇 枯 椿 示 子 孫 賣 却 布 單 招 感 
X70n1398_001:0651c08	得。累人頻上白雲門。	得 累 人 頻 上 白 雲 門 
X70n1398_001:0651c09	桂侍者	桂 侍 者 
X70n1398_001:0651c10	耽耽雙眼視空山。伏虎師曾放一斑。春雨春風謝來	耽 耽 雙 眼 視 空 山 伏 虎 師 曾 放 一 斑 春 雨 春 風 謝 來 
X70n1398_001:0651c11	往。山中佛是石頭頑。	往 山 中 佛 是 石 頭 頑 
X70n1398_001:0651c12	淦傅子仁號無無居士	淦 傅 子 仁 號 無 無 居 士 
X70n1398_001:0651c13	一塵不立萬緣空。纔有絲毫便失宗。蹉口連聲提起	一 塵 不 立 萬 緣 空 纔 有 絲 毫 便 失 宗 蹉 口 連 聲 提 起 
X70n1398_001:0651c14	處。趙州來也不相容。	處 趙 州 來 也 不 相 容 
X70n1398_001:0651c15	石門溈侍者	石 門 溈 侍 者 
X70n1398_001:0651c16	聲撼天風虎出林。石門無鑰海濤深。瑞筠不閘虗空	聲 撼 天 風 虎 出 林 石 門 無 鑰 海 濤 深 瑞 筠 不 閘 虗 空 
X70n1398_001:0651c17	檻。放去雲峰千萬尋。	檻 放 去 雲 峰 千 萬 尋 
X70n1398_001:0651c18	遠上人	遠 上 人 
X70n1398_001:0651c19	遠來問訊近相迎。物外相於不世情。蒿湯備禮松陰	遠 來 問 訊 近 相 迎 物 外 相 於 不 世 情 蒿 湯 備 禮 松 陰 
X70n1398_001:0651c20	坐。山鳥自啼春晝晴。	坐 山 鳥 自 啼 春 晝 晴 
X70n1398_001:0651c21	送興首座歸鄉	送 興 首 座 歸 鄉 
X70n1398_001:0651c22	諸老門庭已徧參。青出於藍青於藍。表儀多士冠東	諸 老 門 庭 已 徧 參 青 出 於 藍 青 於 藍 表 儀 多 士 冠 東 
X70n1398_001:0651c23	南。賓主歷然曾對談。長篇短章玄可探。杖藜所到如	南 賓 主 歷 然 曾 對 談 長 篇 短 章 玄 可 探 杖 藜 所 到 如 
X70n1398_001:0651c24	優曇。夜月娟娟松毿毿。深期瘦影同蘿龕。定力已固	優 曇 夜 月 娟 娟 松 毿 毿 深 期 瘦 影 同 蘿 龕 定 力 已 固 
X70n1398_001:0652a01	輕毗嵐。德山臨際空喃喃。	輕 毗 嵐 德 山 臨 際 空 喃 喃 
X70n1398_001:0652a02	示芳上人	示 芳 上 人 
X70n1398_001:0652a03	萬里無寸草。連天日杲杲。出門便是草。接地長安道。	萬 里 無 寸 草 連 天 日 杲 杲 出 門 便 是 草 接 地 長 安 道 
X70n1398_001:0652a04	庭際立無人。古逕跡亦掃。付與芳禪人。問取虗空討。	庭 際 立 無 人 古 逕 跡 亦 掃 付 與 芳 禪 人 問 取 虗 空 討 
X70n1398_001:0652a05	蕭山孤峰持談季蕭梅軸惠訪。書于后	蕭 山 孤 峰 持 談 季 蕭 梅 軸 惠 訪 書 于 后 
X70n1398_001:0652a06	孤峰雪後歸蕭關。我來瑞筠時往還。能消幾屐看青	孤 峰 雪 後 歸 蕭 關 我 來 瑞 筠 時 往 還 能 消 幾 屐 看 青 
X70n1398_001:0652a07	山。展梅一笑俱蒼顏。孤山山人盟未寒。逃禪禪意墨	山 展 梅 一 笑 俱 蒼 顏 孤 山 山 人 盟 未 寒 逃 禪 禪 意 墨 
X70n1398_001:0652a08	未乾。季蕭左幹萬鈞重。坐客駭囑推其難。造化無始	未 乾 季 蕭 左 幹 萬 鈞 重 坐 客 駭 囑 推 其 難 造 化 無 始 
X70n1398_001:0652a09	舒卷間。先天下春非等閒。歲晚相看成二老。此詩此	舒 卷 間 先 天 下 春 非 等 閒 歲 晚 相 看 成 二 老 此 詩 此 
X70n1398_001:0652a10	畵古今寶。	畵 古 今 寶 
X70n1398_001:0652a11	毗陵自然居士	毗 陵 自 然 居 士 
X70n1398_001:0652a12	非因非緣非自然。自然而然然不然。無然非自自然	非 因 非 緣 非 自 然 自 然 而 然 然 不 然 無 然 非 自 自 然 
X70n1398_001:0652a13	自。無自非然然自然。自其不然常現前。斯言脗合天	自 無 自 非 然 然 自 然 自 其 不 然 常 現 前 斯 言 脗 合 天 
X70n1398_001:0652a14	地先。萬化茫茫從此出。堂堂日用乘誰力。	地 先 萬 化 茫 茫 從 此 出 堂 堂 日 用 乘 誰 力 
X70n1398_001:0652a15	示攸州慈雲玉侍者	示 攸 州 慈 雲 玉 侍 者 
X70n1398_001:0652a16	石碌碌。玉落落。光彩惟渾圓。塵泥自消礫。匪穿鑿。匪	石 碌 碌 玉 落 落 光 彩 惟 渾 圓 塵 泥 自 消 礫 匪 穿 鑿 匪 
X70n1398_001:0652a17	磨琢。翻笑曹山露圭角。學子投師空抱璞。玉兮玉兮	磨 琢 翻 笑 曹 山 露 圭 角 學 子 投 師 空 抱 璞 玉 兮 玉 兮 
X70n1398_001:0652a18	知不知。老野三呼應者誰。剖破方知自家底。價重連	知 不 知 老 野 三 呼 應 者 誰 剖 破 方 知 自 家 底 價 重 連 
X70n1398_001:0652a19	城莫輕許。自有聲光滿寰宇。	城 莫 輕 許 自 有 聲 光 滿 寰 宇 
X70n1398_001:0652a20	佛祖讚	佛 祖 讚 
X70n1398_001:0652a21	出山	出 山 
X70n1398_001:0652a22	智慧德相。大地誰無。見星說悟。謾自分疎。流毒至今	智 慧 德 相 大 地 誰 無 見 星 說 悟 謾 自 分 疎 流 毒 至 今 
X70n1398_001:0652a23	未已。邪法難扶。	未 已 邪 法 難 扶 
X70n1398_001:0652a24	觀音(淦州判李濟川。世居饒。昔有以絹素繪大士像。為風水所漂。後二十年。漁人網	觀 音 淦 州 判 李 濟 川 世 居 饒 昔 有 以 絹 素 繪 大 士 像 為 風 水 所 漂 後 二 十 年 漁 人 網 
X70n1398_001:0652b01	得之。像不壞。濟川重新裝飾。請贊)	得 之 像 不 壞 濟 川 重 新 裝 飾 請 贊 
X70n1398_001:0652b02	菩薩漁師。持正法網。入生死海。摝諸眾生。達大覺岸。	菩 薩 漁 師 持 正 法 網 入 生 死 海 摝 諸 眾 生 達 大 覺 岸 
X70n1398_001:0652b03	昔於華嚴法門。甞誦其言。今於濟川居士。所得水中	昔 於 華 嚴 法 門 甞 誦 其 言 今 於 濟 川 居 士 所 得 水 中 
X70n1398_001:0652b04	觀音畵像。乃驗其事。是知法力應化。言像皆真。必有	觀 音 畵 像 乃 驗 其 事 是 知 法 力 應 化 言 像 皆 真 必 有 
X70n1398_001:0652b05	入淨心海。得不壞信者。不言而喻也。偈曰。	入 淨 心 海 得 不 壞 信 者 不 言 而 喻 也 偈 曰 
X70n1398_001:0652b06	舒卷流通亘古今。最難消是大悲心。全身入水全身	舒 卷 流 通 亘 古 今 最 難 消 是 大 悲 心 全 身 入 水 全 身 
X70n1398_001:0652b07	出。奈彼眾生業海深。	出 奈 彼 眾 生 業 海 深 
X70n1398_001:0652b08	漁籃	漁 籃 
X70n1398_001:0652b09	提錦鱗。露珠瓔。年華如許。高韻絕塵。籃子尚有眼。如	提 錦 鱗 露 珠 瓔 年 華 如 許 高 韻 絕 塵 籃 子 尚 有 眼 如 
X70n1398_001:0652b10	何謾得人。	何 謾 得 人 
X70n1398_001:0652b11	郁山主	郁 山 主 
X70n1398_001:0652b12	拾得明珠。當甚驢屎。溪橋橫浸洣川水。	拾 得 明 珠 當 甚 驢 屎 溪 橋 橫 浸 洣 川 水 
X70n1398_001:0652b13	政黃牛	政 黃 牛 
X70n1398_001:0652b14	一字不穩。騎牛覔牛。萬疊寒山翠如流。	一 字 不 穩 騎 牛 覔 牛 萬 疊 寒 山 翠 如 流 
X70n1398_001:0652b15	朝陽　待月	朝 陽 待 月 
X70n1398_001:0652b16	海天高。山月小。大地是卷經。何時看得了。放下自分	海 天 高 山 月 小 大 地 是 卷 經 何 時 看 得 了 放 下 自 分 
X70n1398_001:0652b17	曉。	曉 
X70n1398_001:0652b18	穴鼻針。無絲線。一咬便斷。自然成片。杲日當空現。	穴 鼻 針 無 絲 線 一 咬 便 斷 自 然 成 片 杲 日 當 空 現 
X70n1398_001:0652b19	達磨	達 磨 
X70n1398_001:0652b20	對梁王不契。休言東土無人。令二祖覔心。將謂西天	對 梁 王 不 契 休 言 東 土 無 人 令 二 祖 覔 心 將 謂 西 天 
X70n1398_001:0652b21	有佛。少林月冷。揚子江空。至今雪浪號霜風。	有 佛 少 林 月 冷 揚 子 江 空 至 今 雪 浪 號 霜 風 
X70n1398_001:0652b22	自真讚	自 真 讚 
X70n1398_001:0652b23	立首座	立 首 座 
X70n1398_001:0652b24	行不踏人前。立不落人後。老去移東湖。言疎道轉踈。	行 不 踏 人 前 立 不 落 人 後 老 去 移 東 湖 言 疎 道 轉 踈 
X70n1398_001:0652c01	自非筆墨可明模。分付雪岑首座。看是甚麼面孔。唵	自 非 筆 墨 可 明 模 分 付 雪 岑 首 座 看 是 甚 麼 面 孔 唵 
X70n1398_001:0652c02	癹癹叱咄攝。	癹 癹 叱 咄 攝 
X70n1398_001:0652c03	黃鍔鈍翁請	黃 鍔 鈍 翁 請 
X70n1398_001:0652c04	渾大璞。匪琱琢。聚精會神。藏鋒斂鍔。迴入塵勞。雖涉	渾 大 璞 匪 琱 琢 聚 精 會 神 藏 鋒 斂 鍔 迴 入 塵 勞 雖 涉 
X70n1398_001:0652c05	萬緣。全提佛祖。機先一著。尋常只用鈍鉗鎚。從教大	萬 緣 全 提 佛 祖 機 先 一 著 尋 常 只 用 鈍 鉗 鎚 從 教 大 
X70n1398_001:0652c06	地人描邈。	地 人 描 邈 
X70n1398_001:0652c07	處靖庵主	處 靖 庵 主 
X70n1398_001:0652c08	靖而專。笑面[祝/土]嗔拳。溫而厲。觸人忘忌諱。謂此是一	靖 而 專 笑 面 [祝土] 嗔 拳 溫 而 厲 觸 人 忘 忌 諱 謂 此 是 一 
X70n1398_001:0652c09	而二。謂此非伊復誰。竹外遠山青似眉。	而 二 謂 此 非 伊 復 誰 竹 外 遠 山 青 似 眉 
X70n1398_001:0652c10	跋	跋 
X70n1398_001:0652c11	佛照和尚書帖南岡長老求跋	佛 照 和 尚 書 帖 南 岡 長 老 求 跋 
X70n1398_001:0652c12	佛照在靈徑時。益公政當國。王臣外護。得行其道。遂	佛 照 在 靈 徑 時 益 公 政 當 國 王 臣 外 護 得 行 其 道 遂 
X70n1398_001:0652c13	有孤雲秀巖空叟諸老。相繼而出。可想當時法社之	有 孤 雲 秀 巖 空 叟 諸 老 相 繼 而 出 可 想 當 時 法 社 之 
X70n1398_001:0652c14	盛。偶持鉢來吉文。訪南岡於龍華。出此軸相示。炷香	盛 偶 持 鉢 來 吉 文 訪 南 岡 於 龍 華 出 此 軸 相 示 炷 香 
X70n1398_001:0652c15	展味。惻然久之。	展 味 惻 然 久 之 
X70n1398_001:0652c16	跋癡絕書伯夷頌	跋 癡 絕 書 伯 夷 頌 
